,user_input,retrieved_contexts,response,reference,faithfulness,answer_relevancy,context_recall,context_precision
0,Luật Giao thông Đường bộ 2025 có những thay đổi gì về phân hạng giấy phép lái xe?,"['a) Giấy phép lái xe hết thời hạn sử dụng;\n\nb) Giấy phép lái xe bị thu hồi theo quy định tại khoản 5 Điều 62 của Luật này.\n\n8. Giấy phép lái xe quốc tế được quy định như sau:\n\na) Giấy phép lái xe quốc tế là giấy phép lái xe do cơ quan nhà nước có thẩm quyền của quốc gia là thành viên của Công ước Viên cấp theo một mẫu thống nhất; có thời hạn không quá 03 năm kể từ ngày cấp và phải phù hợp với thời hạn còn hiệu lực của giấy phép lái xe quốc gia;\n\nb) Người có giấy phép lái xe quốc tế do quốc gia là thành viên của Công ước Viên cấp khi lái xe tham gia giao thông đường bộ trên lãnh thổ Việt Nam phải mang theo giấy phép lái xe quốc tế và giấy phép lái xe quốc gia được cấp phù hợp với hạng xe điều khiển, còn thời hạn sử dụng; phải tuân thủ pháp luật về trật tự, an toàn giao thông đường bộ của Việt Nam;\n\nc) Người có giấy phép lái xe quốc tế vi phạm pháp luật về trật tự, an toàn giao thông đường bộ của Việt Nam mà bị tước quyền sử dụng giấy phép lái xe có thời hạn thì thời gian bị tước quyền sử dụng không quá thời gian người lái xe được phép cư trú tại lãnh thổ Việt Nam;\n\nd) Người Việt Nam hoặc người nước ngoài có thẻ thường trú hoặc thẻ tạm trú tại Việt Nam có giấy phép lái xe do Việt Nam hoặc quốc gia là thành viên của điều ước quốc tế mà nước Cộng hòa xã hội chủ nghĩa Việt Nam là thành viên cấp, còn giá trị sử dụng, nếu có nhu cầu được cấp giấy phép lái xe quốc tế.\n\n9. Bộ trưởng Bộ Giao thông vận tải quy định mẫu giấy phép lái xe và giấy phép lái xe quốc tế, trình tự, thủ tục cấp và việc sử dụng giấy phép lái xe, giấy phép lái xe quốc tế; đối với mẫu giấy phép lái xe, trình tự, thủ tục cấp và việc sử dụng giấy phép lái xe của lực lượng quân đội, công an làm nhiệm vụ quốc phòng, an ninh do Bộ trưởng Bộ Quốc phòng, Bộ trưởng Bộ Công an quy định.\n\nĐiều 58. Điểm của giấy phép lái xe \n\n1. Điểm của giấy phép lái xe được dùng để quản lý việc chấp hành pháp luật về trật tự, an toàn giao thông đường bộ của người lái xe trên hệ thống cơ sở dữ liệu về trật tự, an toàn giao thông đường bộ, bao gồm 12 điểm. Số điểm trừ mỗi lần vi phạm tùy thuộc tính chất, mức độ của hành vi vi phạm pháp luật về trật tự, an toàn giao thông đường bộ. Dữ liệu về điểm trừ giấy phép lái xe của người vi phạm sẽ được cập nhật vào hệ thống cơ sở dữ liệu ngay sau khi quyết định xử phạt có hiệu lực thi hành và thông báo cho người bị trừ điểm giấy phép lái xe biết.\n\n2. Giấy phép lái xe chưa bị trừ hết điểm và không bị trừ điểm trong thời hạn 12 tháng từ ngày bị trừ điểm gần nhất thì được phục hồi đủ 12 điểm.\n\n3. Trường hợp giấy phép lái xe bị trừ hết điểm thì người có giấy phép lái xe không được điều khiển phương tiện tham gia giao thông đường bộ theo giấy phép lái xe đó. Sau thời hạn ít nhất là 06 tháng kể từ ngày bị trừ hết điểm, người có giấy phép lái xe được tham gia kiểm tra nội dung kiến thức pháp luật về trật tự, an toàn giao thông đường bộ theo quy định tại khoản 7 Điều 61 của Luật này do lực lượng Cảnh sát giao thông tổ chức, có kết quả đạt yêu cầu thì được phục hồi đủ 12 điểm.\n\n4. Giấy phép lái xe sau khi đổi, cấp lại, nâng hạng được giữ nguyên số điểm của giấy phép lái xe trước khi đổi, cấp lại, nâng hạng.\n\n5. Người có thẩm quyền xử phạt vi phạm hành chính có thẩm quyền trừ điểm giấy phép lái xe.\n\n6. Chính phủ quy định chi tiết khoản 1 Điều này; quy định trình tự, thủ tục, thẩm quyền trừ điểm, phục hồi điểm giấy phép lái xe; quy định lộ trình thực hiện Điều này. Bộ trưởng Bộ Công an quy định chi tiết khoản 3 Điều này.\n\nĐiều 59. Tuổi, sức khỏe của người điều khiển phương tiện tham gia giao thông đường bộ\n\n1. Độ tuổi của người lái xe, người điều khiển xe máy chuyên dùng được quy định như sau:\n\na) Người đủ 16 tuổi trở lên được điều khiển xe gắn máy;\n\nb) Người đủ 18 tuổi trở lên được cấp giấy phép lái xe hạng A1, A, B1, B, C1, được cấp chứng chỉ bồi dưỡng kiến thức pháp luật về giao thông đường bộ để điều khiển xe máy chuyên dùng tham gia giao thông đường bộ;\n\nc) Người đủ 21 tuổi trở lên được cấp giấy phép lái xe hạng C, BE;\n\nd) Người đủ 24 tuổi trở lên được cấp giấy phép lái xe hạng D1, D2, C1E, CE;\n\nđ) Người đủ 27 tuổi trở lên được cấp giấy phép lái xe hạng D, D1E, D2E, DE;\n\ne) Tuổi tối đa của người lái xe ô tô chở người (kể cả xe buýt) trên 29 chỗ (không kể chỗ của người lái xe), xe ô tô chở người giường nằm là đủ 57 tuổi đối với nam, đủ 55 tuổi đối với nữ.\n\n2. Người điều khiển phương tiện tham gia giao thông đường bộ phải bảo đảm điều kiện sức khỏe phù hợp với từng loại phương tiện được phép điều khiển. Bộ trưởng Bộ Y tế quy định về tiêu chuẩn sức khỏe, việc khám sức khỏe đối với người lái xe, người điều khiển xe máy chuyên dùng; việc khám sức khỏe định kỳ đối với người hành nghề lái xe ô tô; xây dựng cơ sở dữ liệu về sức khỏe của người lái xe, người điều khiển xe máy chuyên dùng.\n\n3. Bộ trưởng Bộ Quốc phòng, Bộ trưởng Bộ Công an quy định độ tuổi của người lái xe trong lực lượng quân đội, công an làm nhiệm vụ quốc phòng, an ninh.\n\nĐiều 60. Đào tạo lái xe\n\n1. Người có nhu cầu được cấp giấy phép lái xe phải được đào tạo nội dung lý thuyết và thực hành theo chương trình đào tạo quy định cho từng hạng giấy phép lái xe.\n\n2. Người học lái xe phải được đào tạo tại các cơ sở đào tạo lái xe hoặc các hình thức đào tạo lái xe khác để cấp mới hoặc nâng hạng giấy phép lái xe.\n\n3. Việc đào tạo để nâng hạng giấy phép lái xe thực hiện đối với những đối tượng sau đây:\n\na) Nâng hạng giấy phép lái xe từ hạng B lên hạng C1 hoặc lên hạng C hoặc lên hạng D1 hoặc lên hạng D2;\n\nb) Nâng hạng giấy phép lái xe từ hạng C1 lên hạng C hoặc lên hạng D1 hoặc lên hạng D2;\n\nc) Nâng hạng giấy phép lái xe từ hạng C lên hạng D1 hoặc lên hạng D2 hoặc lên hạng D;\n\nd) Nâng hạng giấy phép lái xe từ hạng D1 lên hạng D2 hoặc lên hạng D;\n\nđ) Nâng hạng giấy phép lái xe từ hạng D2 lên hạng D;\n\ne) Nâng hạng giấy phép lái xe từ hạng B lên hạng BE, từ hạng C1 lên\xa0 hạng C1E, từ hạng C lên hạng CE, từ hạng D1 lên hạng D1E, từ hạng D2 lên hạng D2E, từ hạng D lên hạng DE.\n\n4.\xa0Người có nhu cầu được đào tạo nâng hạng giấy phép lái xe khi giấy phép lái xe còn hiệu lực, phải có đủ thời gian lái xe an toàn quy định cho từng hạng giấy phép lái xe;\xa0đối với việc nâng hạng giấy phép lái xe lên hạng D1, D2, D thì người có nhu cầu được đào tạo còn phải có trình độ từ trung học cơ sở trở lên.\n\n5. Giấy phép lái xe các hạng C, D1, D2, D, BE, C1E, CE, D1E, D2E, DE phải được đào tạo bằng hình thức đào tạo nâng hạng theo các điều kiện quy định tại khoản 3 và khoản 4 Điều này.\n\n6. Cơ sở đào tạo lái xe ô tô phải đáp ứng các điều kiện do Chính phủ quy định; có giáo trình, giáo án; thực hiện đào tạo theo đúng hình thức, nội dung và chương trình quy định cho từng hạng giấy phép lái xe.\n\n7. Chính phủ quy định chi tiết các hình thức đào tạo lái xe khác quy định tại khoản 2 Điều này; quy định trình tự, thủ tục kiểm tra, đánh giá để cấp, cấp lại và thu hồi giấy phép xe tập lái; quy định tiêu chuẩn của giáo viên dạy lái xe; quy định việc cấp, cấp lại và thu hồi giấy chứng nhận giáo viên dạy lái xe; quy định việc cấp, cấp lại và thu hồi giấy phép đào tạo lái xe.\n\n8. Bộ trưởng Bộ Giao thông vận tải quy định hình thức, nội dung, chương trình đào tạo lái xe, thời gian lái xe an toàn cho từng hạng giấy phép lái xe quy định tại khoản 4 Điều này và quy định tiêu chuẩn của cơ sở đào tạo lái xe mô tô; đối với cơ sở đào tạo, tổ chức đào tạo lái xe cho lực lượng quân đội, công an làm nhiệm vụ quốc phòng, an ninh do Bộ trưởng Bộ Quốc phòng, Bộ trưởng Bộ Công an quy định.\n\nĐiều 61. Sát hạch lái xe\n\n1. Người đã hoàn thành chương trình đào tạo lái xe, có độ tuổi, sức khỏe theo quy định tại Điều 59 của Luật này được đăng ký để tham dự kỳ sát hạch lái xe.\n\n2. Nội dung sát hạch lái xe phải phù hợp với hạng giấy phép lái xe và chương trình đào tạo lái xe.\n\n3. Hoạt động sát hạch lái xe ô tô phải thực hiện tại các trung tâm sát hạch lái xe; hoạt động sát hạch lái xe mô tô thực hiện tại các trung tâm sát hạch lái xe hoặc tại sân tập lái đáp ứng điều kiện, tiêu chuẩn về cơ sở vật chất, kỹ thuật. Hoạt động sát hạch lái xe do cơ quan nhà nước có thẩm quyền thực hiện.', 'a) Chứng nhận đăng ký xe hoặc bản sao Chứng nhận đăng ký xe có chứng thực kèm bản gốc giấy tờ xác nhận của tổ chức tín dụng, chi nhánh ngân hàng nước ngoài còn hiệu lực trong trường hợp xe đang được thế chấp tại tổ chức tín dụng, chi nhánh ngân hàng nước ngoài;\n\nb) Giấy phép lái xe phù hợp với loại xe đang điều khiển;\n\nc) Chứng nhận kiểm định an toàn kỹ thuật và bảo vệ môi trường đối với xe cơ giới theo quy định của pháp luật;\n\nd) Chứng nhận bảo hiểm bắt buộc trách nhiệm dân sự của chủ xe cơ giới.\n\n2. Người điều khiển xe máy chuyên dùng tham gia giao thông đường bộ phải đủ tuổi, sức khỏe theo quy định của pháp luật; có bằng hoặc chứng chỉ điều khiển xe máy chuyên dùng phù hợp loại xe máy chuyên dùng đang điều khiển; có giấy phép lái xe đang còn điểm, còn hiệu lực hoặc chứng chỉ bồi dưỡng kiến thức pháp luật về giao thông đường bộ. Khi tham gia giao thông đường bộ, người điều khiển xe máy chuyên dùng phải mang theo các loại giấy tờ sau đây:\n\na) Chứng nhận đăng ký xe hoặc bản sao Chứng nhận đăng ký xe có chứng thực kèm bản gốc Giấy biên nhận còn hiệu lực của tổ chức tín dụng, chi nhánh ngân hàng nước ngoài trong trường hợp xe đang được thế chấp tại tổ chức tín dụng, chi nhánh ngân hàng nước ngoài;\n\nb) Bằng hoặc chứng chỉ điều khiển xe máy chuyên dùng;\n\nc) Giấy phép lái xe hoặc chứng chỉ bồi dưỡng kiến thức pháp luật về giao thông đường bộ;\n\nd) Chứng nhận kiểm định an toàn kỹ thuật và bảo vệ môi trường đối với xe máy chuyên dùng theo quy định của pháp luật;\n\nđ) Chứng nhận bảo hiểm bắt buộc trách nhiệm dân sự theo quy định của pháp luật.\n\n3. Trường hợp giấy tờ quy định tại khoản 1 và khoản 2 Điều này đã được tích hợp vào tài khoản định danh điện tử thì việc xuất trình, kiểm tra có thể thực hiện thông qua tài khoản định danh điện tử.\n\n4. Người lái xe gắn máy tham gia giao thông đường bộ phải hiểu biết quy tắc giao thông đường bộ, có kỹ năng điều khiển phương tiện; đủ điều kiện về độ tuổi, sức khỏe theo quy định tại điểm a khoản 1 và khoản 2 Điều 59 của Luật này.\n\n5. Người tập lái xe ô tô, người dự sát hạch lái xe ô tô khi tham gia giao thông đường bộ phải thực hành trên xe tập lái, xe sát hạch trên tuyến đường tập lái, tuyến đường sát hạch, có giáo viên dạy lái hoặc sát hạch viên bảo trợ tay lái. Giáo viên dạy lái, sát hạch viên phải mang theo các loại giấy tờ quy định tại khoản 1 Điều này.\n\nĐiều 57. Giấy phép lái xe\n\n1. Giấy phép lái xe bao gồm các hạng sau đây:\n\na) Hạng A1 cấp cho người lái xe mô tô hai bánh có dung tích xi-lanh đến 125 cm3 hoặc có công suất động cơ điện đến 11 kW;\n\nb) Hạng A cấp cho người lái xe mô tô hai bánh có dung tích xi-lanh\xa0 trên 125 cm3\xa0hoặc có công suất động cơ điện trên 11 kW và các loại xe quy định cho giấy phép lái xe hạng A1;\n\nc) Hạng B1 cấp cho người lái xe mô tô ba bánh và các loại xe quy định cho giấy phép lái xe hạng A1;\n\nd) Hạng B cấp cho người lái xe ô tô chở người đến 08 chỗ (không kể chỗ của người lái xe); xe ô tô tải và ô tô chuyên dùng có khối lượng toàn bộ theo thiết kế đến 3.500 kg; các loại xe ô tô quy định cho giấy phép lái xe hạng B kéo rơ moóc có khối lượng toàn bộ theo thiết kế đến 750 kg; \n\nđ) Hạng C1 cấp cho người lái xe ô tô tải và ô tô chuyên dùng có khối lượng toàn bộ theo thiết kế trên 3.500 kg đến 7.500 kg; các loại xe ô tô tải quy định cho giấy phép lái xe hạng C1 kéo rơ moóc có khối lượng toàn bộ theo thiết kế đến 750 kg; các loại xe quy định cho giấy phép lái xe hạng B;\n\ne) Hạng C cấp cho người lái xe ô tô tải và ô tô chuyên dùng có khối lượng toàn bộ theo thiết kế trên 7.500 kg; các loại xe ô tô tải quy định cho giấy phép lái xe hạng C kéo rơ moóc có khối lượng toàn bộ theo thiết kế đến 750 kg; các loại xe quy định cho giấy phép lái xe hạng B và hạng C1;\n\ng) Hạng D1 cấp cho người lái xe ô tô chở người trên 08 chỗ (không kể chỗ của người lái xe) đến 16 chỗ (không kể chỗ của người lái xe); các loại xe ô tô chở người quy định cho giấy phép lái xe hạng D1 kéo rơ moóc có khối lượng toàn bộ theo thiết kế đến 750 kg; các loại xe quy định cho giấy phép lái xe các hạng B, C1, C;\n\nh) Hạng D2 cấp cho người lái xe ô tô chở người (kể cả xe buýt) trên 16 chỗ (không kể chỗ của người lái xe) đến 29 chỗ (không kể chỗ của người lái xe); các loại xe ô tô chở người quy định cho giấy phép lái xe hạng D2 kéo rơ moóc có khối lượng toàn bộ theo thiết kế đến 750 kg; các loại xe quy định cho giấy phép lái xe các hạng B, C1, C, D1;\n\ni) Hạng D cấp cho người lái xe ô tô chở người (kể cả xe buýt) trên 29 chỗ (không kể chỗ của người lái xe); xe ô tô chở người giường nằm; các loại xe ô tô chở người quy định cho giấy phép lái xe hạng D kéo rơ moóc có khối lượng toàn bộ theo thiết kế đến 750 kg; các loại xe quy định cho giấy phép lái xe các hạng B, C1, C, D1, D2;\n\nk) Hạng BE cấp cho người lái các loại xe ô tô quy định cho giấy phép lái xe hạng B kéo rơ moóc có khối lượng toàn bộ theo thiết kế trên 750 kg;\n\nl) Hạng C1E cấp cho người lái các loại xe ô tô quy định cho giấy phép lái xe hạng C1 kéo rơ moóc có khối lượng toàn bộ theo thiết kế trên 750 kg;\n\nm) Hạng CE cấp cho người lái các loại xe ô tô quy định cho giấy phép lái xe hạng C kéo rơ moóc có khối lượng toàn bộ theo thiết kế trên 750 kg; xe ô tô đầu kéo kéo sơ mi rơ moóc;\n\nn) Hạng D1E cấp cho người lái các loại xe ô tô quy định cho giấy phép lái xe hạng D1 kéo rơ moóc có khối lượng toàn bộ theo thiết kế trên 750 kg;\n\no) Hạng D2E cấp cho người lái các loại xe ô tô quy định cho giấy phép lái xe hạng D2 kéo rơ moóc có khối lượng toàn bộ theo thiết kế trên 750 kg;\n\np) Hạng DE cấp cho người lái các loại xe ô tô quy định cho giấy phép lái xe hạng D kéo rơ moóc có khối lượng toàn bộ theo thiết kế trên 750 kg; xe ô tô chở khách nối toa.\n\n2. Người khuyết tật điều khiển xe mô tô ba bánh dùng cho người khuyết tật được cấp giấy phép lái xe hạng A1.\n\nNgười khuyết tật điều khiển xe ô tô số tự động có kết cấu phù hợp với tình trạng khuyết tật thì được cấp giấy phép lái xe hạng B.\n\n3. Người điều khiển xe chở hàng bốn bánh có gắn động cơ, xe chở người bốn bánh có gắn động cơ phải sử dụng giấy phép lái xe có hạng phù hợp với xe ô tô tải hoặc xe ô tô chở người tương ứng.\n\n4. Người điều khiển xe ô tô có thiết kế, cải tạo với số chỗ ít hơn xe cùng loại, kích thước giới hạn tương đương phải sử dụng giấy phép lái xe có hạng phù hợp với xe ô tô cùng loại, kích thước giới hạn tương đương và có số chỗ nhiều nhất.\n\n5. Thời hạn của giấy phép lái xe được quy định như sau:\n\na) Giấy phép lái xe các hạng A1, A, B1 không thời hạn;\n\nb) Giấy phép lái xe hạng B và hạng C1 có thời hạn 10 năm kể từ ngày cấp;\n\nc) Giấy phép lái xe các hạng C, D1, D2, D, BE, C1E, CE, D1E, D2E và DE có thời hạn 05 năm kể từ ngày cấp.\n\n6. Giấy phép lái xe có giá trị sử dụng trong phạm vi lãnh thổ Việt Nam bao gồm:\n\na) Giấy phép lái xe do cơ quan có thẩm quyền của Việt Nam cấp;\n\nb) Giấy phép lái xe quốc tế và giấy phép lái xe quốc gia phù hợp với loại xe được phép điều khiển do quốc gia là thành viên của Công ước của Liên hợp quốc về Giao thông đường bộ năm 1968 (sau đây gọi là Công ước Viên) cấp;\n\nc) Giấy phép lái xe phù hợp với loại xe được phép điều khiển của nước hoặc vùng lãnh thổ mà Việt Nam ký kết điều ước quốc tế hoặc thỏa thuận quốc tế công nhận giấy phép lái xe của nhau;\n\nd) Giấy phép lái xe nước ngoài phù hợp với loại xe được phép điều khiển do quốc gia được công nhận theo điều ước quốc tế mà nước Cộng hòa xã hội chủ nghĩa Việt Nam là thành viên.\n\n7. Giấy phép lái xe không có hiệu lực trong các trường hợp sau đây:\n\na) Giấy phép lái xe hết thời hạn sử dụng;\n\nb) Giấy phép lái xe bị thu hồi theo quy định tại khoản 5 Điều 62 của Luật này.\n\n8. Giấy phép lái xe quốc tế được quy định như sau:\n\na) Giấy phép lái xe quốc tế là giấy phép lái xe do cơ quan nhà nước có thẩm quyền của quốc gia là thành viên của Công ước Viên cấp theo một mẫu thống nhất; có thời hạn không quá 03 năm kể từ ngày cấp và phải phù hợp với thời hạn còn hiệu lực của giấy phép lái xe quốc gia;', '8. Ủy ban nhân dân các cấp, trong phạm vi nhiệm vụ, quyền hạn của mình, thực hiện quản lý nhà nước về trật tự, an toàn giao thông đường bộ tại địa phương.\n\nChương IX\n\nĐIỀU KHOẢN THI HÀNH\n\nĐiều 88. Hiệu lực thi hành\n\n1. Luật này có hiệu lực thi hành từ ngày 01 tháng 01 năm 2025, trừ trường hợp quy định tại khoản 2 Điều này.\n\n2. Khoản 3 Điều 10 của Luật này có hiệu lực thi hành từ ngày 01 tháng 01 năm 2026.\n\n3. Luật Giao thông đường bộ số 23/2008/QH12 đã được sửa đổi, bổ sung một số điều theo Luật số 35/2018/QH14 và Luật số 44/2019/QH14 hết hiệu lực kể từ ngày Luật này có hiệu lực thi hành, trừ trường hợp quy định tại các khoản 1, 2, 5 và 6 Điều 89 của Luật này.\n\n4. Nghị quyết số 73/2022/QH15 của Quốc hội về thí điểm đấu giá biển số xe ô tô hết hiệu lực kể từ ngày Luật này có hiệu lực thi hành, trừ trường hợp quy định tại khoản 7 Điều 89 của Luật này.\n\nĐiều 89. Quy định chuyển tiếp\n\n1. Giấy phép lái xe được cấp trước ngày Luật này có hiệu lực thi hành được tiếp tục sử dụng theo thời hạn ghi trên giấy phép lái xe. \n\n2. Giấy phép lái xe được cấp trước ngày Luật này có hiệu lực thi hành nếu chưa thực hiện đổi, cấp lại theo quy định của Luật này có hiệu lực sử dụng như sau:\n\na) Giấy phép lái xe hạng A1 được tiếp tục điều khiển xe mô tô hai bánh có dung tích xi-lanh từ 50 cm3\xa0đến dưới 175 cm3 hoặc có công suất động cơ điện từ 04 kW đến dưới 14 kW;\n\nb) Giấy phép lái xe hạng A2 được tiếp tục điều khiển xe mô tô hai bánh có dung tích xi-lanh từ 175 cm3\xa0trở lên hoặc có công suất động cơ điện từ 14 kW trở lên và các loại xe quy định cho giấy phép lái xe hạng A1 quy định tại điểm a khoản này;\n\nc) Giấy phép lái xe hạng A3 được tiếp tục điều khiển xe mô tô ba bánh, các loại xe quy định cho giấy phép lái xe hạng A1 quy định tại điểm a khoản này và các xe tương tự;\n\nd) Giấy phép lái xe hạng A4 được tiếp tục điều khiển máy kéo có trọng tải đến 1.000 kg;\n\nđ) Giấy phép lái xe hạng B1 số tự động cấp cho người không hành nghề lái xe được tiếp tục điều khiển xe ô tô số tự động chở người đến 08 chỗ (không kể chỗ của người lái xe); xe ô tô tải, kể cả ô tô tải chuyên dùng số tự động có trọng tải dưới 3.500 kg;\n\ne) Giấy phép lái xe hạng B1 cấp cho người không hành nghề lái xe được tiếp tục điều khiển xe ô tô chở người đến 08 chỗ (không kể chỗ của người lái xe); xe ô tô tải, máy kéo có trọng tải dưới 3.500 kg;\n\ng) Giấy phép lái xe hạng B2 cấp cho người hành nghề lái xe được tiếp tục điều khiển xe ô tô chở người đến 08 chỗ (không kể chỗ của người lái xe); xe ô tô tải, máy kéo có trọng tải dưới 3.500 kg;\n\nh) Giấy phép lái xe hạng C được tiếp tục điều khiển xe ô tô tải, máy kéo có trọng tải từ 3.500 kg trở lên và các loại xe quy định cho các giấy phép lái xe hạng B1, B2 quy định tại các điểm đ, e và g khoản này;\n\ni) Giấy phép lái xe hạng D được tiếp tục điều khiển xe ô tô chở người từ 09 chỗ (không kể chỗ của người lái xe) đến 29 chỗ (không kể chỗ của người lái xe) và các loại xe quy định cho các giấy phép lái xe hạng B1, B2, C quy định tại các điểm đ, e, g và h khoản này;\n\nk) Giấy phép lái xe hạng E được tiếp tục điều khiển xe ô tô chở người trên 29 chỗ (không kể chỗ của người lái xe) và các loại xe quy định cho các giấy phép lái xe hạng B1, B2, C, D quy định tại các điểm đ, e, g, h và i khoản này;\n\nl) Giấy phép lái xe hạng FB2, FD được tiếp tục điều khiển các loại xe quy định cho giấy phép lái xe hạng B2, D quy định tại điểm g và điểm i khoản này khi kéo rơ moóc; giấy phép lái xe hạng FC được tiếp tục điều khiển các loại xe quy định cho giấy phép lái xe hạng C quy định tại điểm h khoản này khi kéo rơ moóc, đầu kéo kéo sơ mi rơ moóc; giấy phép lái xe hạng FE được tiếp tục điều khiển các loại xe quy định cho giấy phép lái xe hạng E quy định tại điểm k khoản này khi kéo rơ moóc\xa0hoặc xe ô tô chở khách nối toa.\n\n3. Trường hợp người có giấy phép lái xe đã được cấp trước ngày Luật này có hiệu lực thi hành có nhu cầu đổi, cấp lại giấy phép lái xe thì thực hiện như sau:\n\na) Giấy phép lái xe hạng A1 được đổi, cấp lại sang giấy phép lái xe hạng A với điều kiện hạn chế là chỉ được điều khiển xe mô tô hai bánh có dung tích xi-lanh đến dưới 175 cm3 hoặc có công suất động cơ điện đến dưới 14 kW;\n\nb) Giấy phép lái xe hạng A2 được đổi, cấp lại sang giấy phép lái xe hạng A;\n\nc) Giấy phép lái xe hạng A3 được đổi, cấp lại sang giấy phép lái xe hạng B1;\n\nd) Giấy phép lái xe hạng A4 được đổi, cấp lại sang chứng chỉ điều khiển xe máy chuyên dùng cho người điều khiển máy kéo có trọng tải đến 1.000 kg và chứng chỉ bồi dưỡng kiến thức pháp luật về giao thông đường bộ cho người điều khiển xe máy chuyên dùng;\n\nđ) Giấy phép lái xe hạng B1 số tự động được đổi, cấp lại sang giấy phép lái xe hạng B với điều kiện hạn chế là chỉ được điều khiển xe ô tô số tự động;\n\ne) Giấy phép lái xe hạng B1, B2 được đổi, cấp lại sang giấy phép lái xe hạng B hoặc hạng C1 và chứng chỉ điều khiển xe máy chuyên dùng cho người điều khiển máy kéo có trọng tải đến 3.500 kg;\n\ng) Giấy phép lái xe hạng C giữ nguyên và đổi, cấp lại cùng hạng và chứng chỉ điều khiển xe máy chuyên dùng cho người điều khiển máy kéo có trọng tải trên 3.500 kg;\n\nh) Giấy phép lái xe hạng D được đổi, cấp lại sang giấy phép lái xe hạng D2 và chứng chỉ điều khiển xe máy chuyên dùng cho người điều khiển máy kéo có trọng tải trên 3.500 kg;\n\ni) Giấy phép lái xe hạng E được đổi, cấp lại sang giấy phép lái xe hạng D và chứng chỉ điều khiển xe máy chuyên dùng cho người điều khiển máy kéo có trọng tải trên 3.500 kg;\n\nk) Giấy phép lái xe hạng FB2 được đổi, cấp lại sang giấy phép lái xe hạng BE hoặc hạng C1E và chứng chỉ điều khiển xe máy chuyên dùng cho người điều khiển máy kéo có trọng tải đến 3.500 kg;\n\nl) Giấy phép lái xe hạng FC được đổi, cấp lại sang giấy phép lái xe hạng CE và chứng chỉ điều khiển xe máy chuyên dùng cho người điều khiển máy kéo có trọng tải trên 3.500 kg;\n\nm) Giấy phép lái xe hạng FD được đổi, cấp lại sang giấy phép lái xe hạng D2E và chứng chỉ điều khiển xe máy chuyên dùng cho người điều khiển máy kéo có trọng tải trên 3.500 kg;\n\nn) Giấy phép lái xe hạng FE được đổi, cấp lại sang giấy phép lái xe hạng DE và chứng chỉ điều khiển xe máy chuyên dùng cho người điều khiển máy kéo có trọng tải trên 3.500 kg.\n\n4. Người học lái xe đã được đào tạo lái xe trước ngày Luật này có hiệu lực thi hành hoặc đang được đào tạo lái xe tại ngày Luật này có hiệu lực thi hành chưa được sát hạch, cấp giấy phép lái xe thì được sát hạch, cấp giấy phép lái xe theo hạng giấy phép lái xe đổi, cấp lại quy định tại khoản 3 Điều này.\n\n5. Chứng nhận đăng ký xe, biển số xe máy chuyên dùng cấp trước ngày Luật này có hiệu lực thi hành vẫn có giá trị sử dụng.\n\n6. Chứng nhận chất lượng an toàn kỹ thuật và bảo vệ môi trường được cấp trước ngày Luật này có hiệu lực thi hành thì có giá trị sử dụng đến hết thời hạn ghi trên giấy chứng nhận đó.\n\n7. Việc đấu giá biển số xe ô tô được thực hiện trước ngày Luật này có hiệu lực thi hành và đến ngày Luật này có hiệu lực thi hành đã được cấp văn bản xác nhận biển số xe ô tô trúng đấu giá thì tiếp tục thực hiện theo Nghị quyết số 73/2022/QH15 của Quốc hội về thí điểm đấu giá biển số xe ô tô; trường hợp chưa được cấp xác nhận biển số xe ô tô trúng đấu giá thì tiếp tục thực hiện theo Nghị quyết số 73/2022/QH15 của Quốc hội về thí điểm đấu giá biển số xe ô tô và quy định tại điểm d khoản 1 Điều 38 của Luật này./.\n\nLuật này được Quốc hội nước Cộng hòa xã hội chủ nghĩa Việt Nam khóa XV, kỳ họp thứ 7 thông qua ngày 27 tháng 6 năm 2024.\n\nE-pas: 60179 CHỦ TỊCH QUỐC HỘI\n\n\n\n\nTrần Thanh Mẫn']","**Nguồn văn bản:** /content/drive/MyDrive/ITProject_data/new_law/36_2024_QH15_444251.docx

**Tên văn bản:** (Không có tiêu đề trong metadata)

**(Không có điều khoản trong metadata):**

**Nội dung:**

1. Giấy phép lái xe bao gồm các hạng sau đây:

	a) Hạng A1 cấp cho người lái xe mô tô hai bánh có dung tích xi-lanh đến 125 cm3 hoặc có công suất động cơ điện đến 11 kW.

	b) Hạng A cấp cho người lái xe mô tô hai bánh có dung tích xi-lanh trên 125 cm3 hoặc có công suất động cơ điện trên 11 kW và các loại xe quy định cho giấy phép lái xe hạng A1.

	c) Hạng B1 cấp cho người lái xe mô tô ba bánh và các loại xe quy định cho giấy phép lái xe hạng A1.

	d) Hạng B cấp cho người lái xe ô tô chở người đến 08 chỗ (không kể chỗ của người lái xe); xe ô tô tải và ô tô chuyên dùng có khối lượng toàn bộ theo thiết kế đến 3.500 kg; các loại xe ô tô quy định cho giấy phép lái xe hạng B kéo rơ moóc có khối lượng toàn bộ theo thiết kế đến 750 kg.

	đ) Hạng C1 cấp cho người lái xe ô tô tải và ô tô chuyên dùng có khối lượng toàn bộ theo thiết kế trên 3.500 kg đến 7.500 kg; các loại xe ô tô tải quy định cho giấy phép lái xe hạng C1 kéo rơ moóc có khối lượng toàn bộ theo thiết kế đến 750 kg; các loại xe quy định cho giấy phép lái xe hạng B.

	e) Hạng C cấp cho người lái xe ô tô tải và ô tô chuyên dùng có khối lượng toàn bộ theo thiết kế trên 7.500 kg; các loại xe ô tô tải quy định cho giấy phép lái xe hạng C kéo rơ moóc có khối lượng toàn bộ theo thiết kế đến 750 kg; các loại xe quy định cho giấy phép lái xe hạng B và hạng C1.

	g) Hạng D1 cấp cho người lái xe ô tô chở người trên 08 chỗ (không kể chỗ của người lái xe) đến 16 chỗ (không kể chỗ của người lái xe); các loại xe ô tô chở người quy định cho giấy phép lái xe hạng D1 kéo rơ moóc có khối lượng toàn bộ theo thiết kế đến 750 kg; các loại xe quy định cho giấy phép lái xe các hạng B, C1, C.

	h) Hạng D2 cấp cho người lái xe ô tô chở người (kể cả xe buýt) trên 16 chỗ (không kể chỗ của người lái xe) đến 29 chỗ (không kể chỗ của người lái xe); các loại xe ô tô chở người quy định cho giấy phép lái xe hạng D2 kéo rơ moóc có khối lượng toàn bộ theo thiết kế đến 750 kg; các loại xe quy định cho giấy phép lái xe các hạng B, C1, C, D1.

	i) Hạng D cấp cho người lái xe ô tô chở người (kể cả xe buýt) trên 29 chỗ (không kể chỗ của người lái xe); xe ô tô chở người giường nằm; các loại xe ô tô chở người quy định cho giấy phép lái xe hạng D kéo rơ moóc có khối lượng toàn bộ theo thiết kế đến 750 kg; các loại xe quy định cho giấy phép lái xe các hạng B, C1, C, D1, D2.

	k) Hạng BE cấp cho người lái các loại xe ô tô quy định cho giấy phép lái xe hạng B kéo rơ moóc có khối lượng toàn bộ theo thiết kế trên 750 kg.

	l) Hạng C1E cấp cho người lái các loại xe ô tô quy định cho giấy phép lái xe hạng C1 kéo rơ moóc có khối lượng toàn bộ theo thiết kế trên 750 kg.

	m) Hạng CE cấp cho người lái các loại xe ô tô quy định cho giấy phép lái xe hạng C kéo rơ moóc có khối lượng toàn bộ theo thiết kế trên 750 kg; xe ô tô đầu kéo kéo sơ mi rơ moóc.

	n) Hạng D1E cấp cho người lái các loại xe ô tô quy định cho giấy phép lái xe hạng D1 kéo rơ moóc có khối lượng toàn bộ theo thiết kế trên 750 kg.

	o) Hạng D2E cấp cho người lái các loại xe ô tô quy định cho giấy phép lái xe hạng D2 kéo rơ moóc có khối lượng toàn bộ theo thiết kế trên 750 kg.

	p) Hạng DE cấp cho người lái các loại xe ô tô quy định cho giấy phép lái xe hạng D kéo rơ moóc có khối lượng toàn bộ theo thiết kế trên 750 kg; xe ô tô chở khách nối toa.


2. Người khuyết tật điều khiển xe mô tô ba bánh dùng cho người khuyết tật được cấp giấy phép lái xe hạng A1.

Người khuyết tật điều khiển xe ô tô số tự động có kết cấu phù hợp với tình trạng khuyết tật thì được cấp giấy phép lái xe hạng B.


3. Người điều khiển xe chở hàng bốn bánh có gắn động cơ, xe chở người bốn bánh có gắn động cơ phải sử dụng giấy phép lái xe có hạng phù hợp với xe ô tô tải hoặc xe ô tô chở người tương ứng.


4. Người điều khiển xe ô tô có thiết kế, cải tạo với số chỗ ít hơn xe cùng loại, kích thước giới hạn tương đương phải sử dụng giấy phép lái xe có hạng phù hợp với xe ô tô cùng loại, kích thước giới hạn tương đương và có số chỗ nhiều nhất.

**Tóm lại:** Giấy phép lái xe được phân hạng từ A1, A, B1, B, C1, C, D1, D2, D, BE, C1E, CE, D1E, D2E, DE,  phù hợp với từng loại xe và đối tượng người lái xe (người khuyết tật, người điều khiển xe chở hàng bốn bánh, xe chở người bốn bánh...).
","Từ năm 2025, hệ thống phân hạng giấy phép lái xe được mở rộng lên 15 hạng: A1, A, B1, B, C1, C, D1, D2, D, BE, C1E, CE, D1E, D2E, DE.",1.0,0.6430447699238153,1.0,0.49999999995
1,Giấy phép lái xe hạng A1 mới cấp cho loại xe nào?,"['a) Chứng nhận đăng ký xe hoặc bản sao Chứng nhận đăng ký xe có chứng thực kèm bản gốc giấy tờ xác nhận của tổ chức tín dụng, chi nhánh ngân hàng nước ngoài còn hiệu lực trong trường hợp xe đang được thế chấp tại tổ chức tín dụng, chi nhánh ngân hàng nước ngoài;\n\nb) Giấy phép lái xe phù hợp với loại xe đang điều khiển;\n\nc) Chứng nhận kiểm định an toàn kỹ thuật và bảo vệ môi trường đối với xe cơ giới theo quy định của pháp luật;\n\nd) Chứng nhận bảo hiểm bắt buộc trách nhiệm dân sự của chủ xe cơ giới.\n\n2. Người điều khiển xe máy chuyên dùng tham gia giao thông đường bộ phải đủ tuổi, sức khỏe theo quy định của pháp luật; có bằng hoặc chứng chỉ điều khiển xe máy chuyên dùng phù hợp loại xe máy chuyên dùng đang điều khiển; có giấy phép lái xe đang còn điểm, còn hiệu lực hoặc chứng chỉ bồi dưỡng kiến thức pháp luật về giao thông đường bộ. Khi tham gia giao thông đường bộ, người điều khiển xe máy chuyên dùng phải mang theo các loại giấy tờ sau đây:\n\na) Chứng nhận đăng ký xe hoặc bản sao Chứng nhận đăng ký xe có chứng thực kèm bản gốc Giấy biên nhận còn hiệu lực của tổ chức tín dụng, chi nhánh ngân hàng nước ngoài trong trường hợp xe đang được thế chấp tại tổ chức tín dụng, chi nhánh ngân hàng nước ngoài;\n\nb) Bằng hoặc chứng chỉ điều khiển xe máy chuyên dùng;\n\nc) Giấy phép lái xe hoặc chứng chỉ bồi dưỡng kiến thức pháp luật về giao thông đường bộ;\n\nd) Chứng nhận kiểm định an toàn kỹ thuật và bảo vệ môi trường đối với xe máy chuyên dùng theo quy định của pháp luật;\n\nđ) Chứng nhận bảo hiểm bắt buộc trách nhiệm dân sự theo quy định của pháp luật.\n\n3. Trường hợp giấy tờ quy định tại khoản 1 và khoản 2 Điều này đã được tích hợp vào tài khoản định danh điện tử thì việc xuất trình, kiểm tra có thể thực hiện thông qua tài khoản định danh điện tử.\n\n4. Người lái xe gắn máy tham gia giao thông đường bộ phải hiểu biết quy tắc giao thông đường bộ, có kỹ năng điều khiển phương tiện; đủ điều kiện về độ tuổi, sức khỏe theo quy định tại điểm a khoản 1 và khoản 2 Điều 59 của Luật này.\n\n5. Người tập lái xe ô tô, người dự sát hạch lái xe ô tô khi tham gia giao thông đường bộ phải thực hành trên xe tập lái, xe sát hạch trên tuyến đường tập lái, tuyến đường sát hạch, có giáo viên dạy lái hoặc sát hạch viên bảo trợ tay lái. Giáo viên dạy lái, sát hạch viên phải mang theo các loại giấy tờ quy định tại khoản 1 Điều này.\n\nĐiều 57. Giấy phép lái xe\n\n1. Giấy phép lái xe bao gồm các hạng sau đây:\n\na) Hạng A1 cấp cho người lái xe mô tô hai bánh có dung tích xi-lanh đến 125 cm3 hoặc có công suất động cơ điện đến 11 kW;\n\nb) Hạng A cấp cho người lái xe mô tô hai bánh có dung tích xi-lanh\xa0 trên 125 cm3\xa0hoặc có công suất động cơ điện trên 11 kW và các loại xe quy định cho giấy phép lái xe hạng A1;\n\nc) Hạng B1 cấp cho người lái xe mô tô ba bánh và các loại xe quy định cho giấy phép lái xe hạng A1;\n\nd) Hạng B cấp cho người lái xe ô tô chở người đến 08 chỗ (không kể chỗ của người lái xe); xe ô tô tải và ô tô chuyên dùng có khối lượng toàn bộ theo thiết kế đến 3.500 kg; các loại xe ô tô quy định cho giấy phép lái xe hạng B kéo rơ moóc có khối lượng toàn bộ theo thiết kế đến 750 kg; \n\nđ) Hạng C1 cấp cho người lái xe ô tô tải và ô tô chuyên dùng có khối lượng toàn bộ theo thiết kế trên 3.500 kg đến 7.500 kg; các loại xe ô tô tải quy định cho giấy phép lái xe hạng C1 kéo rơ moóc có khối lượng toàn bộ theo thiết kế đến 750 kg; các loại xe quy định cho giấy phép lái xe hạng B;\n\ne) Hạng C cấp cho người lái xe ô tô tải và ô tô chuyên dùng có khối lượng toàn bộ theo thiết kế trên 7.500 kg; các loại xe ô tô tải quy định cho giấy phép lái xe hạng C kéo rơ moóc có khối lượng toàn bộ theo thiết kế đến 750 kg; các loại xe quy định cho giấy phép lái xe hạng B và hạng C1;\n\ng) Hạng D1 cấp cho người lái xe ô tô chở người trên 08 chỗ (không kể chỗ của người lái xe) đến 16 chỗ (không kể chỗ của người lái xe); các loại xe ô tô chở người quy định cho giấy phép lái xe hạng D1 kéo rơ moóc có khối lượng toàn bộ theo thiết kế đến 750 kg; các loại xe quy định cho giấy phép lái xe các hạng B, C1, C;\n\nh) Hạng D2 cấp cho người lái xe ô tô chở người (kể cả xe buýt) trên 16 chỗ (không kể chỗ của người lái xe) đến 29 chỗ (không kể chỗ của người lái xe); các loại xe ô tô chở người quy định cho giấy phép lái xe hạng D2 kéo rơ moóc có khối lượng toàn bộ theo thiết kế đến 750 kg; các loại xe quy định cho giấy phép lái xe các hạng B, C1, C, D1;\n\ni) Hạng D cấp cho người lái xe ô tô chở người (kể cả xe buýt) trên 29 chỗ (không kể chỗ của người lái xe); xe ô tô chở người giường nằm; các loại xe ô tô chở người quy định cho giấy phép lái xe hạng D kéo rơ moóc có khối lượng toàn bộ theo thiết kế đến 750 kg; các loại xe quy định cho giấy phép lái xe các hạng B, C1, C, D1, D2;\n\nk) Hạng BE cấp cho người lái các loại xe ô tô quy định cho giấy phép lái xe hạng B kéo rơ moóc có khối lượng toàn bộ theo thiết kế trên 750 kg;\n\nl) Hạng C1E cấp cho người lái các loại xe ô tô quy định cho giấy phép lái xe hạng C1 kéo rơ moóc có khối lượng toàn bộ theo thiết kế trên 750 kg;\n\nm) Hạng CE cấp cho người lái các loại xe ô tô quy định cho giấy phép lái xe hạng C kéo rơ moóc có khối lượng toàn bộ theo thiết kế trên 750 kg; xe ô tô đầu kéo kéo sơ mi rơ moóc;\n\nn) Hạng D1E cấp cho người lái các loại xe ô tô quy định cho giấy phép lái xe hạng D1 kéo rơ moóc có khối lượng toàn bộ theo thiết kế trên 750 kg;\n\no) Hạng D2E cấp cho người lái các loại xe ô tô quy định cho giấy phép lái xe hạng D2 kéo rơ moóc có khối lượng toàn bộ theo thiết kế trên 750 kg;\n\np) Hạng DE cấp cho người lái các loại xe ô tô quy định cho giấy phép lái xe hạng D kéo rơ moóc có khối lượng toàn bộ theo thiết kế trên 750 kg; xe ô tô chở khách nối toa.\n\n2. Người khuyết tật điều khiển xe mô tô ba bánh dùng cho người khuyết tật được cấp giấy phép lái xe hạng A1.\n\nNgười khuyết tật điều khiển xe ô tô số tự động có kết cấu phù hợp với tình trạng khuyết tật thì được cấp giấy phép lái xe hạng B.\n\n3. Người điều khiển xe chở hàng bốn bánh có gắn động cơ, xe chở người bốn bánh có gắn động cơ phải sử dụng giấy phép lái xe có hạng phù hợp với xe ô tô tải hoặc xe ô tô chở người tương ứng.\n\n4. Người điều khiển xe ô tô có thiết kế, cải tạo với số chỗ ít hơn xe cùng loại, kích thước giới hạn tương đương phải sử dụng giấy phép lái xe có hạng phù hợp với xe ô tô cùng loại, kích thước giới hạn tương đương và có số chỗ nhiều nhất.\n\n5. Thời hạn của giấy phép lái xe được quy định như sau:\n\na) Giấy phép lái xe các hạng A1, A, B1 không thời hạn;\n\nb) Giấy phép lái xe hạng B và hạng C1 có thời hạn 10 năm kể từ ngày cấp;\n\nc) Giấy phép lái xe các hạng C, D1, D2, D, BE, C1E, CE, D1E, D2E và DE có thời hạn 05 năm kể từ ngày cấp.\n\n6. Giấy phép lái xe có giá trị sử dụng trong phạm vi lãnh thổ Việt Nam bao gồm:\n\na) Giấy phép lái xe do cơ quan có thẩm quyền của Việt Nam cấp;\n\nb) Giấy phép lái xe quốc tế và giấy phép lái xe quốc gia phù hợp với loại xe được phép điều khiển do quốc gia là thành viên của Công ước của Liên hợp quốc về Giao thông đường bộ năm 1968 (sau đây gọi là Công ước Viên) cấp;\n\nc) Giấy phép lái xe phù hợp với loại xe được phép điều khiển của nước hoặc vùng lãnh thổ mà Việt Nam ký kết điều ước quốc tế hoặc thỏa thuận quốc tế công nhận giấy phép lái xe của nhau;\n\nd) Giấy phép lái xe nước ngoài phù hợp với loại xe được phép điều khiển do quốc gia được công nhận theo điều ước quốc tế mà nước Cộng hòa xã hội chủ nghĩa Việt Nam là thành viên.\n\n7. Giấy phép lái xe không có hiệu lực trong các trường hợp sau đây:\n\na) Giấy phép lái xe hết thời hạn sử dụng;\n\nb) Giấy phép lái xe bị thu hồi theo quy định tại khoản 5 Điều 62 của Luật này.\n\n8. Giấy phép lái xe quốc tế được quy định như sau:\n\na) Giấy phép lái xe quốc tế là giấy phép lái xe do cơ quan nhà nước có thẩm quyền của quốc gia là thành viên của Công ước Viên cấp theo một mẫu thống nhất; có thời hạn không quá 03 năm kể từ ngày cấp và phải phù hợp với thời hạn còn hiệu lực của giấy phép lái xe quốc gia;', '8. Ủy ban nhân dân các cấp, trong phạm vi nhiệm vụ, quyền hạn của mình, thực hiện quản lý nhà nước về trật tự, an toàn giao thông đường bộ tại địa phương.\n\nChương IX\n\nĐIỀU KHOẢN THI HÀNH\n\nĐiều 88. Hiệu lực thi hành\n\n1. Luật này có hiệu lực thi hành từ ngày 01 tháng 01 năm 2025, trừ trường hợp quy định tại khoản 2 Điều này.\n\n2. Khoản 3 Điều 10 của Luật này có hiệu lực thi hành từ ngày 01 tháng 01 năm 2026.\n\n3. Luật Giao thông đường bộ số 23/2008/QH12 đã được sửa đổi, bổ sung một số điều theo Luật số 35/2018/QH14 và Luật số 44/2019/QH14 hết hiệu lực kể từ ngày Luật này có hiệu lực thi hành, trừ trường hợp quy định tại các khoản 1, 2, 5 và 6 Điều 89 của Luật này.\n\n4. Nghị quyết số 73/2022/QH15 của Quốc hội về thí điểm đấu giá biển số xe ô tô hết hiệu lực kể từ ngày Luật này có hiệu lực thi hành, trừ trường hợp quy định tại khoản 7 Điều 89 của Luật này.\n\nĐiều 89. Quy định chuyển tiếp\n\n1. Giấy phép lái xe được cấp trước ngày Luật này có hiệu lực thi hành được tiếp tục sử dụng theo thời hạn ghi trên giấy phép lái xe. \n\n2. Giấy phép lái xe được cấp trước ngày Luật này có hiệu lực thi hành nếu chưa thực hiện đổi, cấp lại theo quy định của Luật này có hiệu lực sử dụng như sau:\n\na) Giấy phép lái xe hạng A1 được tiếp tục điều khiển xe mô tô hai bánh có dung tích xi-lanh từ 50 cm3\xa0đến dưới 175 cm3 hoặc có công suất động cơ điện từ 04 kW đến dưới 14 kW;\n\nb) Giấy phép lái xe hạng A2 được tiếp tục điều khiển xe mô tô hai bánh có dung tích xi-lanh từ 175 cm3\xa0trở lên hoặc có công suất động cơ điện từ 14 kW trở lên và các loại xe quy định cho giấy phép lái xe hạng A1 quy định tại điểm a khoản này;\n\nc) Giấy phép lái xe hạng A3 được tiếp tục điều khiển xe mô tô ba bánh, các loại xe quy định cho giấy phép lái xe hạng A1 quy định tại điểm a khoản này và các xe tương tự;\n\nd) Giấy phép lái xe hạng A4 được tiếp tục điều khiển máy kéo có trọng tải đến 1.000 kg;\n\nđ) Giấy phép lái xe hạng B1 số tự động cấp cho người không hành nghề lái xe được tiếp tục điều khiển xe ô tô số tự động chở người đến 08 chỗ (không kể chỗ của người lái xe); xe ô tô tải, kể cả ô tô tải chuyên dùng số tự động có trọng tải dưới 3.500 kg;\n\ne) Giấy phép lái xe hạng B1 cấp cho người không hành nghề lái xe được tiếp tục điều khiển xe ô tô chở người đến 08 chỗ (không kể chỗ của người lái xe); xe ô tô tải, máy kéo có trọng tải dưới 3.500 kg;\n\ng) Giấy phép lái xe hạng B2 cấp cho người hành nghề lái xe được tiếp tục điều khiển xe ô tô chở người đến 08 chỗ (không kể chỗ của người lái xe); xe ô tô tải, máy kéo có trọng tải dưới 3.500 kg;\n\nh) Giấy phép lái xe hạng C được tiếp tục điều khiển xe ô tô tải, máy kéo có trọng tải từ 3.500 kg trở lên và các loại xe quy định cho các giấy phép lái xe hạng B1, B2 quy định tại các điểm đ, e và g khoản này;\n\ni) Giấy phép lái xe hạng D được tiếp tục điều khiển xe ô tô chở người từ 09 chỗ (không kể chỗ của người lái xe) đến 29 chỗ (không kể chỗ của người lái xe) và các loại xe quy định cho các giấy phép lái xe hạng B1, B2, C quy định tại các điểm đ, e, g và h khoản này;\n\nk) Giấy phép lái xe hạng E được tiếp tục điều khiển xe ô tô chở người trên 29 chỗ (không kể chỗ của người lái xe) và các loại xe quy định cho các giấy phép lái xe hạng B1, B2, C, D quy định tại các điểm đ, e, g, h và i khoản này;\n\nl) Giấy phép lái xe hạng FB2, FD được tiếp tục điều khiển các loại xe quy định cho giấy phép lái xe hạng B2, D quy định tại điểm g và điểm i khoản này khi kéo rơ moóc; giấy phép lái xe hạng FC được tiếp tục điều khiển các loại xe quy định cho giấy phép lái xe hạng C quy định tại điểm h khoản này khi kéo rơ moóc, đầu kéo kéo sơ mi rơ moóc; giấy phép lái xe hạng FE được tiếp tục điều khiển các loại xe quy định cho giấy phép lái xe hạng E quy định tại điểm k khoản này khi kéo rơ moóc\xa0hoặc xe ô tô chở khách nối toa.\n\n3. Trường hợp người có giấy phép lái xe đã được cấp trước ngày Luật này có hiệu lực thi hành có nhu cầu đổi, cấp lại giấy phép lái xe thì thực hiện như sau:\n\na) Giấy phép lái xe hạng A1 được đổi, cấp lại sang giấy phép lái xe hạng A với điều kiện hạn chế là chỉ được điều khiển xe mô tô hai bánh có dung tích xi-lanh đến dưới 175 cm3 hoặc có công suất động cơ điện đến dưới 14 kW;\n\nb) Giấy phép lái xe hạng A2 được đổi, cấp lại sang giấy phép lái xe hạng A;\n\nc) Giấy phép lái xe hạng A3 được đổi, cấp lại sang giấy phép lái xe hạng B1;\n\nd) Giấy phép lái xe hạng A4 được đổi, cấp lại sang chứng chỉ điều khiển xe máy chuyên dùng cho người điều khiển máy kéo có trọng tải đến 1.000 kg và chứng chỉ bồi dưỡng kiến thức pháp luật về giao thông đường bộ cho người điều khiển xe máy chuyên dùng;\n\nđ) Giấy phép lái xe hạng B1 số tự động được đổi, cấp lại sang giấy phép lái xe hạng B với điều kiện hạn chế là chỉ được điều khiển xe ô tô số tự động;\n\ne) Giấy phép lái xe hạng B1, B2 được đổi, cấp lại sang giấy phép lái xe hạng B hoặc hạng C1 và chứng chỉ điều khiển xe máy chuyên dùng cho người điều khiển máy kéo có trọng tải đến 3.500 kg;\n\ng) Giấy phép lái xe hạng C giữ nguyên và đổi, cấp lại cùng hạng và chứng chỉ điều khiển xe máy chuyên dùng cho người điều khiển máy kéo có trọng tải trên 3.500 kg;\n\nh) Giấy phép lái xe hạng D được đổi, cấp lại sang giấy phép lái xe hạng D2 và chứng chỉ điều khiển xe máy chuyên dùng cho người điều khiển máy kéo có trọng tải trên 3.500 kg;\n\ni) Giấy phép lái xe hạng E được đổi, cấp lại sang giấy phép lái xe hạng D và chứng chỉ điều khiển xe máy chuyên dùng cho người điều khiển máy kéo có trọng tải trên 3.500 kg;\n\nk) Giấy phép lái xe hạng FB2 được đổi, cấp lại sang giấy phép lái xe hạng BE hoặc hạng C1E và chứng chỉ điều khiển xe máy chuyên dùng cho người điều khiển máy kéo có trọng tải đến 3.500 kg;\n\nl) Giấy phép lái xe hạng FC được đổi, cấp lại sang giấy phép lái xe hạng CE và chứng chỉ điều khiển xe máy chuyên dùng cho người điều khiển máy kéo có trọng tải trên 3.500 kg;\n\nm) Giấy phép lái xe hạng FD được đổi, cấp lại sang giấy phép lái xe hạng D2E và chứng chỉ điều khiển xe máy chuyên dùng cho người điều khiển máy kéo có trọng tải trên 3.500 kg;\n\nn) Giấy phép lái xe hạng FE được đổi, cấp lại sang giấy phép lái xe hạng DE và chứng chỉ điều khiển xe máy chuyên dùng cho người điều khiển máy kéo có trọng tải trên 3.500 kg.\n\n4. Người học lái xe đã được đào tạo lái xe trước ngày Luật này có hiệu lực thi hành hoặc đang được đào tạo lái xe tại ngày Luật này có hiệu lực thi hành chưa được sát hạch, cấp giấy phép lái xe thì được sát hạch, cấp giấy phép lái xe theo hạng giấy phép lái xe đổi, cấp lại quy định tại khoản 3 Điều này.\n\n5. Chứng nhận đăng ký xe, biển số xe máy chuyên dùng cấp trước ngày Luật này có hiệu lực thi hành vẫn có giá trị sử dụng.\n\n6. Chứng nhận chất lượng an toàn kỹ thuật và bảo vệ môi trường được cấp trước ngày Luật này có hiệu lực thi hành thì có giá trị sử dụng đến hết thời hạn ghi trên giấy chứng nhận đó.\n\n7. Việc đấu giá biển số xe ô tô được thực hiện trước ngày Luật này có hiệu lực thi hành và đến ngày Luật này có hiệu lực thi hành đã được cấp văn bản xác nhận biển số xe ô tô trúng đấu giá thì tiếp tục thực hiện theo Nghị quyết số 73/2022/QH15 của Quốc hội về thí điểm đấu giá biển số xe ô tô; trường hợp chưa được cấp xác nhận biển số xe ô tô trúng đấu giá thì tiếp tục thực hiện theo Nghị quyết số 73/2022/QH15 của Quốc hội về thí điểm đấu giá biển số xe ô tô và quy định tại điểm d khoản 1 Điều 38 của Luật này./.\n\nLuật này được Quốc hội nước Cộng hòa xã hội chủ nghĩa Việt Nam khóa XV, kỳ họp thứ 7 thông qua ngày 27 tháng 6 năm 2024.\n\nE-pas: 60179 CHỦ TỊCH QUỐC HỘI\n\n\n\n\nTrần Thanh Mẫn', '7. In, phát hành và quản lý việc sử dụng phôi chứng chỉ cho người điều khiển xe máy chuyên dùng thuộc phạm vi quản lý của Bộ Quốc phòng để thống nhất trong toàn quân.\n\n8. Kiểm tra, phúc tra công tác bồi dưỡng kiến thức pháp luật về giao thông đường bộ, cấp chứng chỉ cho người điều khiển xe máy chuyên dùng thuộc phạm vi quản lý của Bộ Quốc phòng.\n\nĐiều 57. Trách nhiệm của cơ quan xe - máy hoặc cơ quan xe máy - vận tải các đơn vị\n\n1. Chịu sự chỉ đạo của Cục Xe máy - Vận tải/Tổng cục Hậu cần - Kỹ thuật về nghiệp vụ đào tạo lái xe quân sự và bồi dưỡng kiến thức pháp luật về giao thông đường bộ cho người điều khiển xe máy chuyên dùng.\n\n2. Quản lý, chỉ đạo, hướng dẫn và kiểm tra cơ sở đào tạo lái xe quân sự; cơ sở bồi dưỡng kiến thức pháp luật về giao thông đường bộ cùng cấp về việc thực hiện nội dung, chương trình, quy chế đào tạo; nghiệp vụ quản lý xe - máy và thực hiện các chế độ theo quy định.\n\n3. Tham gia các đợt kiểm tra, giám sát cơ sở đào tạo lái xe; cơ sở bồi dưỡng kiến thức pháp luật về giao thông đường bộ theo kế hoạch.\n\n4. Đề nghị cấp, đổi, cấp lại Giấy phép xe quân sự cho quân nhân, công chức quốc phòng, công nhân và viên chức quốc phòng, lao động hợp đồng theo quy định tại Thông tư này.\n\n5. Báo cáo nhu cầu, tiếp nhận, quản lý việc sử dụng phôi chứng chỉ tại cơ sở bồi dưỡng kiến thức pháp luật về giao thông đường bộ thuộc phạm vi đơn vị.\n\nĐiều 58. Trách nhiệm của cơ sở đào tạo\n\n1. Chịu sự chỉ đạo của Cục Xe máy - Vận tải/Tổng cục Hậu cần - Kỹ thuật và cơ quan xe - máy hoặc cơ quan xe máy - vận tải cấp trên về nghiệp vụ đào tạo lái xe quân sự và bồi dưỡng kiến thức pháp luật về giao thông đường bộ cho người điều khiển xe máy chuyên dùng.\n\n2. Bảo đảm đủ cơ sở vật chất, trang bị, phương tiện kỹ thuật đáp ứng yêu cầu nhiệm vụ, nâng cao chất lượng đào tạo, sát hạch lái xe và quản lý, rèn luyện học viên theo Quy chế quản lý học viên quân sự trong nhà trường Quân đội, Điều lệnh quản lý bộ đội và Điều lệ công tác nhà trường Quân đội nhân dân Việt Nam.\n\n3. Thực hiện đúng quy định quản lý, sử dụng trang bị xe - máy thực hiện nhiệm vụ đào tạo, sát hạch lái xe quân sự. Đề nghị cấp giấy phép dạy lái xe cho giáo viên đủ điều kiện, giấy phép xe tập lái, biển “Tập lái” đúng quy định.\n\n4. Quản lý, lưu trữ hồ sơ đào tạo, sát hạch lái xe và bồi dưỡng kiến thức pháp luật về giao thông đường bộ cho người điều khiển xe máy chuyên dùng thuộc phạm vi quản lý của Bộ Quốc phòng theo quy định tại Thông tư này.\n\n5. Đề xuất với Cục Xe máy - Vận tải/Tổng cục Hậu cần - Kỹ thuật và các cơ quan liên quan giải pháp nâng cao chất lượng công tác đào tạo, sát hạch lái xe quân sự và bồi dưỡng kiến thức pháp luật về giao thông đường bộ cho người điều khiển xe máy chuyên dùng thuộc phạm vi quản lý của Bộ Quốc phòng.\n\nĐiều 59. Trách nhiệm của cá nhân trong quản lý, sử dụng Giấy phép lái xe quân sự\n\n1. Người được giao nhiệm vụ điều khiển xe quân sự phải có Giấy phép lái xe quân sự.\n\n2. Người có Giấy phép lái xe quân sự được phép điều khiển những loại xe quy định cho từng hạng ghi trên Giấy phép lái xe quân sự.\n\n3. Giấy phép lái xe quân sự phải được mang theo khi lái xe; có trách nhiệm giữ gìn, sử dụng đúng mục đích. Khi mất hoặc phát hiện có sai lệch thông tin ghi trên Giấy phép lái xe quân sự phải báo cáo kịp thời với các cơ quan chức năng để xem xét, giải quyết theo quy định.\n\nChương VI\n\nĐIỀU KHOẢN THI HÀNH\n\nĐiều 60. Hiệu lực thi hành\n\n1. Thông tư này có hiệu lực kể từ ngày 01 tháng 01 năm 2025.\n\n2. Kể từ ngày Thông tư này có hiệu lực thi hành, các Thông tư sau hết hiệu lực thi hành:\n\na) Thông tư số 170/2021/TT-BQP ngày 23 tháng 12 năm 2021 của Bộ trưởng Bộ Quốc phòng quy định về đào tạo, sát hạch, cấp Giấy phép lái xe quân sự; bồi dưỡng kiến thức pháp luật về giao thông đường bộ cho người điều khiển xe máy chuyên dùng trong Bộ Quốc phòng;\n\nb) Thông tư số 86/2023/TT-BQP ngày 20 tháng 11 năm 2023 của Bộ trưởng Bộ Quốc phòng sửa đổi, bổ sung một số điều của Thông tư số 170/2021/TT-BQP ngày 23 tháng 12 năm 2021 của Bộ trưởng Bộ Quốc phòng về đào tạo, sát hạch, cấp Giấy phép lái xe quân sự; bồi dưỡng kiến thức pháp luật về giao thông đường bộ cho người điều khiển xe máy chuyên dùng trong Bộ Quốc phòng.\n\n3. Trường hợp văn bản viện dẫn trong Thông tư này được sửa đổi, bổ sung hoặc thay thế thì áp dụng theo văn bản sửa đổi, bổ sung hoặc thay thế.\n\nĐiều 61. Quy định chuyển tiếp\n\n1. Giấy phép lái xe quân sự được cấp trước ngày Thông tư này có hiệu lực thi hành được tiếp tục sử dụng theo thời hạn ghi trên giấy phép lái xe.\n\n2. Giấy phép lái xe quân sự được cấp trước ngày Thông tư này có hiệu lực thi hành nếu chưa thực hiện đổi, cấp lại theo quy định của Thông tư này có hiệu lực sử dụng như sau:\n\na) Giấy phép lái xe quân sự hạng A1 được tiếp tục điều khiển xe mô tô hai bánh có dung tích xi-lanh từ 50 cm3 đến dưới 175 cm3 hoặc có công suất động cơ điện từ 04 kW đến dưới 14 kW;\n\nb) Giấy phép lái xe quân sự hạng A2 được tiếp tục điều khiển xe mô tô hai bánh có dung tích xi-lanh từ 175 cm3 trở lên hoặc có công suất động cơ điện từ 14 kW trở lên và các loại xe quy định cho Giấy phép lái xe hạng A1 quy định tại điểm a khoản này;\n\nc) Giấy phép lái xe quân sự hạng A3 được tiếp tục điều khiển xe mô tô ba bánh, các loại xe quy định cho Giấy phép lái xe hạng A1 quy định tại điểm a khoản này và các xe tương tự;\n\nd) Giấy phép lái xe quân sự hạng B2 được tiếp tục điều khiển xe ô tô chở người đến 08 chỗ (không kể chỗ của người lái xe); xe ô tô tải, máy kéo có trọng tải dưới 3.500 kg; các loại xe ô tô quy định cho Giấy phép lái xe hạng B kéo theo một rơ moóc hoặc vũ khí, khí tài quân sự dạng rơ moóc có khối lượng toàn bộ theo thiết kế đến 750 kg;\n\nđ) Giấy phép lái xe quân sự hạng C được tiếp tục điều khiển xe ô tô tải, máy kéo có trọng tải từ 3.500 kg trở lên và các loại xe quy định cho các Giấy phép lái xe hạng B2 quy định tại điểm d khoản này; các loại xe ô tô quy định cho Giấy phép lái xe hạng C kéo theo một rơ moóc hoặc vũ khí, khí tài quân sự dạng rơ moóc có khối lượng toàn bộ theo thiết kế đến 750 kg;\n\ne) Giấy phép lái xe quân sự hạng D được tiếp tục điều khiển xe ô tô chở người từ 09 chỗ (không kể chỗ của người lái xe) đến 29 chỗ (không kể chỗ của người lái xe) và các loại xe quy định cho các Giấy phép lái xe hạng B2, C quy định tại các điểm d, đ khoản này; các loại xe ô tô quy định cho Giấy phép lái xe hạng D2 kéo theo một rơ moóc hoặc vũ khí, khí tài quân sự dạng rơ moóc có khối lượng toàn bộ theo thiết kế đến 750 kg;\n\ng) Giấy phép lái xe quân sự hạng E được tiếp tục điều khiển xe ô tô chở người trên 29 chỗ (không kể chỗ của người lái xe) và các loại xe quy định cho các giấy phép lái xe hạng B2, C, D quy định tại các điểm d, đ và e khoản này; các loại ô tô quy định cho Giấy phép lái xe hạng D kéo theo một rơ moóc hoặc vũ khí, khí tài quân sự dạng rơ moóc có khối lượng toàn bộ theo thiết kế đến 750 kg;\n\nh) Giấy phép lái xe quân sự hạng FC được tiếp tục điều khiển các loại xe quy định cho Giấy phép lái xe hạng C quy định tại điểm đ khoản này khi kéo rơ moóc, khí tài quân sự dạng rơ moóc và ô tô đầu kéo kéo sơ mi rơ moóc, khí tài quân sự dạng sơ mi rơ moóc;\n\ni) Giấy phép lái xe quân sự hạng FX được tiếp tục điều khiển xe xích kéo vũ khí, khí tài quân sự và các loại xe quy định cho Giấy phép lái xe hạng C quy định tại điểm đ khoản này.\n\n3. Trường hợp người có Giấy phép, lái xe quân sự đã được cấp trước ngày Thông tư này có hiệu lực thi hành khi đổi, cấp lại giấy phép lái xe thì thực hiện như sau:\n\na) Giấy phép lái xe quân sự hạng A1 được đổi, cấp lại sang Giấy phép lái xe quân sự hạng A với điều kiện hạn chế là chỉ được điều khiển xe mô tô hai bánh có dung tích xi-lanh đến dưới 175 cm3 hoặc có công suất động cơ điện đến dưới 14 kW;\n\nb) Giấy phép lái xe quân sự hạng A2 được đổi, cấp lại sang Giấy phép lái xe quân sự hạng A;\n\nc) Giấy phép lái xe quân sự hạng A3 được đổi, cấp lại sang Giấy phép lái xe quân sự hạng B1;\n\nd) Giấy phép lái xe quân sự hạng B2 được đổi, cấp lại sang Giấy phép lái xe quân sự hạng B hoặc hạng C1;\n\nđ) Giấy phép lái xe quân sự hạng C giữ nguyên và đổi, cấp lại cùng hạng;']","**Nguồn văn bản:** /content/drive/MyDrive/ITProject_data/new_law/36_2024_QH15_444251.docx

**Tên văn bản:** (Không có tiêu đề trong metadata)

**(Không có điều khoản trong metadata):**

**Nội dung:**

1. Giấy phép lái xe bao gồm các hạng sau đây:

        a) Hạng A1 cấp cho người lái xe mô tô hai bánh có dung tích xi-lanh đến 125 cm3 hoặc có công suất động cơ điện đến 11 kW.

        b) Hạng A cấp cho người lái xe mô tô hai bánh có dung tích xi-lanh trên 125 cm3 hoặc có công suất động cơ điện trên 11 kW và các loại xe quy định cho giấy phép lái xe hạng A1.

        c) Hạng B1 cấp cho người lái xe mô tô ba bánh và các loại xe quy định cho giấy phép lái xe hạng A1.

        d) Hạng B cấp cho người lái xe ô tô chở người đến 08 chỗ (không kể chỗ của người lái xe); xe ô tô tải và ô tô chuyên dùng có khối lượng toàn bộ theo thiết kế đến 3.500 kg; các loại xe ô tô quy định cho giấy phép lái xe hạng B kéo rơ moóc có khối lượng toàn bộ theo thiết kế đến 750 kg.

        đ) Hạng C1 cấp cho người lái xe ô tô tải và ô tô chuyên dùng có khối lượng toàn bộ theo thiết kế trên 3.500 kg đến 7.500 kg; các loại xe ô tô tải quy định cho giấy phép lái xe hạng C1 kéo rơ moóc có khối lượng toàn bộ theo thiết kế đến 750 kg; các loại xe quy định cho giấy phép lái xe hạng B.

        e) Hạng C cấp cho người lái xe ô tô tải và ô tô chuyên dùng có khối lượng toàn bộ theo thiết kế trên 7.500 kg; các loại xe ô tô tải quy định cho giấy phép lái xe hạng C kéo rơ moóc có khối lượng toàn bộ theo thiết kế đến 750 kg; các loại xe quy định cho giấy phép lái xe hạng B và hạng C1.
        
        g) Hạng D1 cấp cho người lái xe ô tô chở người trên 08 chỗ (không kể chỗ của người lái xe) đến 16 chỗ (không kể chỗ của người lái xe); các loại xe ô tô chở người quy định cho giấy phép lái xe hạng D1 kéo rơ moóc có khối lượng toàn bộ theo thiết kế đến 750 kg; các loại xe quy định cho giấy phép lái xe các hạng B, C1, C.

        h) Hạng D2 cấp cho người lái xe ô tô chở người (kể cả xe buýt) trên 16 chỗ (không kể chỗ của người lái xe) đến 29 chỗ (không kể chỗ của người lái xe); các loại xe ô tô chở người quy định cho giấy phép lái xe hạng D2 kéo rơ moóc có khối lượng toàn bộ theo thiết kế đến 750 kg; các loại xe quy định cho giấy phép lái xe các hạng B, C1, C, D1.

        i) Hạng D cấp cho người lái xe ô tô chở người (kể cả xe buýt) trên 29 chỗ (không kể chỗ của người lái xe); xe ô tô chở người giường nằm; các loại xe ô tô chở người quy định cho giấy phép lái xe hạng D kéo rơ moóc có khối lượng toàn bộ theo thiết kế đến 750 kg; các loại xe quy định cho giấy phép lái xe các hạng B, C1, C, D1, D2.

        k) Hạng BE cấp cho người lái các loại xe ô tô quy định cho giấy phép lái xe hạng B kéo rơ moóc có khối lượng toàn bộ theo thiết kế trên 750 kg.

        l) Hạng C1E cấp cho người lái các loại xe ô tô quy định cho giấy phép lái xe hạng C1 kéo rơ moóc có khối lượng toàn bộ theo thiết kế trên 750 kg.

        m) Hạng CE cấp cho người lái các loại xe ô tô quy định cho giấy phép lái xe hạng C kéo rơ moóc có khối lượng toàn bộ theo thiết kế trên 750 kg; xe ô tô đầu kéo kéo sơ mi rơ moóc.

        n) Hạng D1E cấp cho người lái các loại xe ô tô quy định cho giấy phép lái xe hạng D1 kéo rơ moóc có khối lượng toàn bộ theo thiết kế trên 750 kg.

        o) Hạng D2E cấp cho người lái các loại xe ô tô quy định cho giấy phép lái xe hạng D2 kéo rơ moóc có khối lượng toàn bộ theo thiết kế trên 750 kg.

        p) Hạng DE cấp cho người lái các loại xe ô tô quy định cho giấy phép lái xe hạng D kéo rơ moóc có khối lượng toàn bộ theo thiết kế trên 750 kg; xe ô tô chở khách nối toa.


2. Người khuyết tật điều khiển xe mô tô ba bánh dùng cho người khuyết tật được cấp giấy phép lái xe hạng A1.

Người khuyết tật điều khiển xe ô tô số tự động có kết cấu phù hợp với tình trạng khuyết tật thì được cấp giấy phép lái xe hạng B.

3. Người điều khiển xe chở hàng bốn bánh có gắn động cơ, xe chở người bốn bánh có gắn động cơ phải sử dụng giấy phép lái xe có hạng phù hợp với xe ô tô tải hoặc xe ô tô chở người tương ứng.

4. Người điều khiển xe ô tô có thiết kế, cải tạo với số chỗ ít hơn xe cùng loại, kích thước giới hạn tương đương phải sử dụng giấy phép lái xe có hạng phù hợp với xe ô tô cùng loại, kích thước giới hạn tương đương và có số chỗ nhiều nhất.

5. Thời hạn của giấy phép lái xe được quy định như sau:

        a) Giấy phép lái xe các hạng A1, A, B1 không thời hạn.

        b) Giấy phép lái xe hạng B và hạng C1 có thời hạn 10 năm kể từ ngày cấp.

        c) Giấy phép lái xe các hạng C, D1, D2, D, BE, C1E, CE, D1E, D2E và DE có thời hạn 05 năm kể từ ngày cấp.


**Tóm lại:** Giấy phép lái xe hạng A1 được cấp cho người lái xe mô tô hai bánh có dung tích xi lanh đến 125 cm3 hoặc có công suất động cơ điện đến 11 kW. Người khuyết tật điều khiển xe mô tô ba bánh dùng cho người khuyết tật cũng được cấp giấy phép lái xe hạng A1.
",Hạng A1 mới cấp cho người lái xe mô tô từ trên 50 phân khối đến 125 phân khối.,1.0,0.7131396435388462,0.0,0.0
2,Thời hạn của giấy phép lái xe hạng B theo Luật Giao thông Đường bộ 2025 là bao lâu?,"['a) Chứng nhận đăng ký xe hoặc bản sao Chứng nhận đăng ký xe có chứng thực kèm bản gốc giấy tờ xác nhận của tổ chức tín dụng, chi nhánh ngân hàng nước ngoài còn hiệu lực trong trường hợp xe đang được thế chấp tại tổ chức tín dụng, chi nhánh ngân hàng nước ngoài;\n\nb) Giấy phép lái xe phù hợp với loại xe đang điều khiển;\n\nc) Chứng nhận kiểm định an toàn kỹ thuật và bảo vệ môi trường đối với xe cơ giới theo quy định của pháp luật;\n\nd) Chứng nhận bảo hiểm bắt buộc trách nhiệm dân sự của chủ xe cơ giới.\n\n2. Người điều khiển xe máy chuyên dùng tham gia giao thông đường bộ phải đủ tuổi, sức khỏe theo quy định của pháp luật; có bằng hoặc chứng chỉ điều khiển xe máy chuyên dùng phù hợp loại xe máy chuyên dùng đang điều khiển; có giấy phép lái xe đang còn điểm, còn hiệu lực hoặc chứng chỉ bồi dưỡng kiến thức pháp luật về giao thông đường bộ. Khi tham gia giao thông đường bộ, người điều khiển xe máy chuyên dùng phải mang theo các loại giấy tờ sau đây:\n\na) Chứng nhận đăng ký xe hoặc bản sao Chứng nhận đăng ký xe có chứng thực kèm bản gốc Giấy biên nhận còn hiệu lực của tổ chức tín dụng, chi nhánh ngân hàng nước ngoài trong trường hợp xe đang được thế chấp tại tổ chức tín dụng, chi nhánh ngân hàng nước ngoài;\n\nb) Bằng hoặc chứng chỉ điều khiển xe máy chuyên dùng;\n\nc) Giấy phép lái xe hoặc chứng chỉ bồi dưỡng kiến thức pháp luật về giao thông đường bộ;\n\nd) Chứng nhận kiểm định an toàn kỹ thuật và bảo vệ môi trường đối với xe máy chuyên dùng theo quy định của pháp luật;\n\nđ) Chứng nhận bảo hiểm bắt buộc trách nhiệm dân sự theo quy định của pháp luật.\n\n3. Trường hợp giấy tờ quy định tại khoản 1 và khoản 2 Điều này đã được tích hợp vào tài khoản định danh điện tử thì việc xuất trình, kiểm tra có thể thực hiện thông qua tài khoản định danh điện tử.\n\n4. Người lái xe gắn máy tham gia giao thông đường bộ phải hiểu biết quy tắc giao thông đường bộ, có kỹ năng điều khiển phương tiện; đủ điều kiện về độ tuổi, sức khỏe theo quy định tại điểm a khoản 1 và khoản 2 Điều 59 của Luật này.\n\n5. Người tập lái xe ô tô, người dự sát hạch lái xe ô tô khi tham gia giao thông đường bộ phải thực hành trên xe tập lái, xe sát hạch trên tuyến đường tập lái, tuyến đường sát hạch, có giáo viên dạy lái hoặc sát hạch viên bảo trợ tay lái. Giáo viên dạy lái, sát hạch viên phải mang theo các loại giấy tờ quy định tại khoản 1 Điều này.\n\nĐiều 57. Giấy phép lái xe\n\n1. Giấy phép lái xe bao gồm các hạng sau đây:\n\na) Hạng A1 cấp cho người lái xe mô tô hai bánh có dung tích xi-lanh đến 125 cm3 hoặc có công suất động cơ điện đến 11 kW;\n\nb) Hạng A cấp cho người lái xe mô tô hai bánh có dung tích xi-lanh\xa0 trên 125 cm3\xa0hoặc có công suất động cơ điện trên 11 kW và các loại xe quy định cho giấy phép lái xe hạng A1;\n\nc) Hạng B1 cấp cho người lái xe mô tô ba bánh và các loại xe quy định cho giấy phép lái xe hạng A1;\n\nd) Hạng B cấp cho người lái xe ô tô chở người đến 08 chỗ (không kể chỗ của người lái xe); xe ô tô tải và ô tô chuyên dùng có khối lượng toàn bộ theo thiết kế đến 3.500 kg; các loại xe ô tô quy định cho giấy phép lái xe hạng B kéo rơ moóc có khối lượng toàn bộ theo thiết kế đến 750 kg; \n\nđ) Hạng C1 cấp cho người lái xe ô tô tải và ô tô chuyên dùng có khối lượng toàn bộ theo thiết kế trên 3.500 kg đến 7.500 kg; các loại xe ô tô tải quy định cho giấy phép lái xe hạng C1 kéo rơ moóc có khối lượng toàn bộ theo thiết kế đến 750 kg; các loại xe quy định cho giấy phép lái xe hạng B;\n\ne) Hạng C cấp cho người lái xe ô tô tải và ô tô chuyên dùng có khối lượng toàn bộ theo thiết kế trên 7.500 kg; các loại xe ô tô tải quy định cho giấy phép lái xe hạng C kéo rơ moóc có khối lượng toàn bộ theo thiết kế đến 750 kg; các loại xe quy định cho giấy phép lái xe hạng B và hạng C1;\n\ng) Hạng D1 cấp cho người lái xe ô tô chở người trên 08 chỗ (không kể chỗ của người lái xe) đến 16 chỗ (không kể chỗ của người lái xe); các loại xe ô tô chở người quy định cho giấy phép lái xe hạng D1 kéo rơ moóc có khối lượng toàn bộ theo thiết kế đến 750 kg; các loại xe quy định cho giấy phép lái xe các hạng B, C1, C;\n\nh) Hạng D2 cấp cho người lái xe ô tô chở người (kể cả xe buýt) trên 16 chỗ (không kể chỗ của người lái xe) đến 29 chỗ (không kể chỗ của người lái xe); các loại xe ô tô chở người quy định cho giấy phép lái xe hạng D2 kéo rơ moóc có khối lượng toàn bộ theo thiết kế đến 750 kg; các loại xe quy định cho giấy phép lái xe các hạng B, C1, C, D1;\n\ni) Hạng D cấp cho người lái xe ô tô chở người (kể cả xe buýt) trên 29 chỗ (không kể chỗ của người lái xe); xe ô tô chở người giường nằm; các loại xe ô tô chở người quy định cho giấy phép lái xe hạng D kéo rơ moóc có khối lượng toàn bộ theo thiết kế đến 750 kg; các loại xe quy định cho giấy phép lái xe các hạng B, C1, C, D1, D2;\n\nk) Hạng BE cấp cho người lái các loại xe ô tô quy định cho giấy phép lái xe hạng B kéo rơ moóc có khối lượng toàn bộ theo thiết kế trên 750 kg;\n\nl) Hạng C1E cấp cho người lái các loại xe ô tô quy định cho giấy phép lái xe hạng C1 kéo rơ moóc có khối lượng toàn bộ theo thiết kế trên 750 kg;\n\nm) Hạng CE cấp cho người lái các loại xe ô tô quy định cho giấy phép lái xe hạng C kéo rơ moóc có khối lượng toàn bộ theo thiết kế trên 750 kg; xe ô tô đầu kéo kéo sơ mi rơ moóc;\n\nn) Hạng D1E cấp cho người lái các loại xe ô tô quy định cho giấy phép lái xe hạng D1 kéo rơ moóc có khối lượng toàn bộ theo thiết kế trên 750 kg;\n\no) Hạng D2E cấp cho người lái các loại xe ô tô quy định cho giấy phép lái xe hạng D2 kéo rơ moóc có khối lượng toàn bộ theo thiết kế trên 750 kg;\n\np) Hạng DE cấp cho người lái các loại xe ô tô quy định cho giấy phép lái xe hạng D kéo rơ moóc có khối lượng toàn bộ theo thiết kế trên 750 kg; xe ô tô chở khách nối toa.\n\n2. Người khuyết tật điều khiển xe mô tô ba bánh dùng cho người khuyết tật được cấp giấy phép lái xe hạng A1.\n\nNgười khuyết tật điều khiển xe ô tô số tự động có kết cấu phù hợp với tình trạng khuyết tật thì được cấp giấy phép lái xe hạng B.\n\n3. Người điều khiển xe chở hàng bốn bánh có gắn động cơ, xe chở người bốn bánh có gắn động cơ phải sử dụng giấy phép lái xe có hạng phù hợp với xe ô tô tải hoặc xe ô tô chở người tương ứng.\n\n4. Người điều khiển xe ô tô có thiết kế, cải tạo với số chỗ ít hơn xe cùng loại, kích thước giới hạn tương đương phải sử dụng giấy phép lái xe có hạng phù hợp với xe ô tô cùng loại, kích thước giới hạn tương đương và có số chỗ nhiều nhất.\n\n5. Thời hạn của giấy phép lái xe được quy định như sau:\n\na) Giấy phép lái xe các hạng A1, A, B1 không thời hạn;\n\nb) Giấy phép lái xe hạng B và hạng C1 có thời hạn 10 năm kể từ ngày cấp;\n\nc) Giấy phép lái xe các hạng C, D1, D2, D, BE, C1E, CE, D1E, D2E và DE có thời hạn 05 năm kể từ ngày cấp.\n\n6. Giấy phép lái xe có giá trị sử dụng trong phạm vi lãnh thổ Việt Nam bao gồm:\n\na) Giấy phép lái xe do cơ quan có thẩm quyền của Việt Nam cấp;\n\nb) Giấy phép lái xe quốc tế và giấy phép lái xe quốc gia phù hợp với loại xe được phép điều khiển do quốc gia là thành viên của Công ước của Liên hợp quốc về Giao thông đường bộ năm 1968 (sau đây gọi là Công ước Viên) cấp;\n\nc) Giấy phép lái xe phù hợp với loại xe được phép điều khiển của nước hoặc vùng lãnh thổ mà Việt Nam ký kết điều ước quốc tế hoặc thỏa thuận quốc tế công nhận giấy phép lái xe của nhau;\n\nd) Giấy phép lái xe nước ngoài phù hợp với loại xe được phép điều khiển do quốc gia được công nhận theo điều ước quốc tế mà nước Cộng hòa xã hội chủ nghĩa Việt Nam là thành viên.\n\n7. Giấy phép lái xe không có hiệu lực trong các trường hợp sau đây:\n\na) Giấy phép lái xe hết thời hạn sử dụng;\n\nb) Giấy phép lái xe bị thu hồi theo quy định tại khoản 5 Điều 62 của Luật này.\n\n8. Giấy phép lái xe quốc tế được quy định như sau:\n\na) Giấy phép lái xe quốc tế là giấy phép lái xe do cơ quan nhà nước có thẩm quyền của quốc gia là thành viên của Công ước Viên cấp theo một mẫu thống nhất; có thời hạn không quá 03 năm kể từ ngày cấp và phải phù hợp với thời hạn còn hiệu lực của giấy phép lái xe quốc gia;', 'a) Giấy phép lái xe hết thời hạn sử dụng;\n\nb) Giấy phép lái xe bị thu hồi theo quy định tại khoản 5 Điều 62 của Luật này.\n\n8. Giấy phép lái xe quốc tế được quy định như sau:\n\na) Giấy phép lái xe quốc tế là giấy phép lái xe do cơ quan nhà nước có thẩm quyền của quốc gia là thành viên của Công ước Viên cấp theo một mẫu thống nhất; có thời hạn không quá 03 năm kể từ ngày cấp và phải phù hợp với thời hạn còn hiệu lực của giấy phép lái xe quốc gia;\n\nb) Người có giấy phép lái xe quốc tế do quốc gia là thành viên của Công ước Viên cấp khi lái xe tham gia giao thông đường bộ trên lãnh thổ Việt Nam phải mang theo giấy phép lái xe quốc tế và giấy phép lái xe quốc gia được cấp phù hợp với hạng xe điều khiển, còn thời hạn sử dụng; phải tuân thủ pháp luật về trật tự, an toàn giao thông đường bộ của Việt Nam;\n\nc) Người có giấy phép lái xe quốc tế vi phạm pháp luật về trật tự, an toàn giao thông đường bộ của Việt Nam mà bị tước quyền sử dụng giấy phép lái xe có thời hạn thì thời gian bị tước quyền sử dụng không quá thời gian người lái xe được phép cư trú tại lãnh thổ Việt Nam;\n\nd) Người Việt Nam hoặc người nước ngoài có thẻ thường trú hoặc thẻ tạm trú tại Việt Nam có giấy phép lái xe do Việt Nam hoặc quốc gia là thành viên của điều ước quốc tế mà nước Cộng hòa xã hội chủ nghĩa Việt Nam là thành viên cấp, còn giá trị sử dụng, nếu có nhu cầu được cấp giấy phép lái xe quốc tế.\n\n9. Bộ trưởng Bộ Giao thông vận tải quy định mẫu giấy phép lái xe và giấy phép lái xe quốc tế, trình tự, thủ tục cấp và việc sử dụng giấy phép lái xe, giấy phép lái xe quốc tế; đối với mẫu giấy phép lái xe, trình tự, thủ tục cấp và việc sử dụng giấy phép lái xe của lực lượng quân đội, công an làm nhiệm vụ quốc phòng, an ninh do Bộ trưởng Bộ Quốc phòng, Bộ trưởng Bộ Công an quy định.\n\nĐiều 58. Điểm của giấy phép lái xe \n\n1. Điểm của giấy phép lái xe được dùng để quản lý việc chấp hành pháp luật về trật tự, an toàn giao thông đường bộ của người lái xe trên hệ thống cơ sở dữ liệu về trật tự, an toàn giao thông đường bộ, bao gồm 12 điểm. Số điểm trừ mỗi lần vi phạm tùy thuộc tính chất, mức độ của hành vi vi phạm pháp luật về trật tự, an toàn giao thông đường bộ. Dữ liệu về điểm trừ giấy phép lái xe của người vi phạm sẽ được cập nhật vào hệ thống cơ sở dữ liệu ngay sau khi quyết định xử phạt có hiệu lực thi hành và thông báo cho người bị trừ điểm giấy phép lái xe biết.\n\n2. Giấy phép lái xe chưa bị trừ hết điểm và không bị trừ điểm trong thời hạn 12 tháng từ ngày bị trừ điểm gần nhất thì được phục hồi đủ 12 điểm.\n\n3. Trường hợp giấy phép lái xe bị trừ hết điểm thì người có giấy phép lái xe không được điều khiển phương tiện tham gia giao thông đường bộ theo giấy phép lái xe đó. Sau thời hạn ít nhất là 06 tháng kể từ ngày bị trừ hết điểm, người có giấy phép lái xe được tham gia kiểm tra nội dung kiến thức pháp luật về trật tự, an toàn giao thông đường bộ theo quy định tại khoản 7 Điều 61 của Luật này do lực lượng Cảnh sát giao thông tổ chức, có kết quả đạt yêu cầu thì được phục hồi đủ 12 điểm.\n\n4. Giấy phép lái xe sau khi đổi, cấp lại, nâng hạng được giữ nguyên số điểm của giấy phép lái xe trước khi đổi, cấp lại, nâng hạng.\n\n5. Người có thẩm quyền xử phạt vi phạm hành chính có thẩm quyền trừ điểm giấy phép lái xe.\n\n6. Chính phủ quy định chi tiết khoản 1 Điều này; quy định trình tự, thủ tục, thẩm quyền trừ điểm, phục hồi điểm giấy phép lái xe; quy định lộ trình thực hiện Điều này. Bộ trưởng Bộ Công an quy định chi tiết khoản 3 Điều này.\n\nĐiều 59. Tuổi, sức khỏe của người điều khiển phương tiện tham gia giao thông đường bộ\n\n1. Độ tuổi của người lái xe, người điều khiển xe máy chuyên dùng được quy định như sau:\n\na) Người đủ 16 tuổi trở lên được điều khiển xe gắn máy;\n\nb) Người đủ 18 tuổi trở lên được cấp giấy phép lái xe hạng A1, A, B1, B, C1, được cấp chứng chỉ bồi dưỡng kiến thức pháp luật về giao thông đường bộ để điều khiển xe máy chuyên dùng tham gia giao thông đường bộ;\n\nc) Người đủ 21 tuổi trở lên được cấp giấy phép lái xe hạng C, BE;\n\nd) Người đủ 24 tuổi trở lên được cấp giấy phép lái xe hạng D1, D2, C1E, CE;\n\nđ) Người đủ 27 tuổi trở lên được cấp giấy phép lái xe hạng D, D1E, D2E, DE;\n\ne) Tuổi tối đa của người lái xe ô tô chở người (kể cả xe buýt) trên 29 chỗ (không kể chỗ của người lái xe), xe ô tô chở người giường nằm là đủ 57 tuổi đối với nam, đủ 55 tuổi đối với nữ.\n\n2. Người điều khiển phương tiện tham gia giao thông đường bộ phải bảo đảm điều kiện sức khỏe phù hợp với từng loại phương tiện được phép điều khiển. Bộ trưởng Bộ Y tế quy định về tiêu chuẩn sức khỏe, việc khám sức khỏe đối với người lái xe, người điều khiển xe máy chuyên dùng; việc khám sức khỏe định kỳ đối với người hành nghề lái xe ô tô; xây dựng cơ sở dữ liệu về sức khỏe của người lái xe, người điều khiển xe máy chuyên dùng.\n\n3. Bộ trưởng Bộ Quốc phòng, Bộ trưởng Bộ Công an quy định độ tuổi của người lái xe trong lực lượng quân đội, công an làm nhiệm vụ quốc phòng, an ninh.\n\nĐiều 60. Đào tạo lái xe\n\n1. Người có nhu cầu được cấp giấy phép lái xe phải được đào tạo nội dung lý thuyết và thực hành theo chương trình đào tạo quy định cho từng hạng giấy phép lái xe.\n\n2. Người học lái xe phải được đào tạo tại các cơ sở đào tạo lái xe hoặc các hình thức đào tạo lái xe khác để cấp mới hoặc nâng hạng giấy phép lái xe.\n\n3. Việc đào tạo để nâng hạng giấy phép lái xe thực hiện đối với những đối tượng sau đây:\n\na) Nâng hạng giấy phép lái xe từ hạng B lên hạng C1 hoặc lên hạng C hoặc lên hạng D1 hoặc lên hạng D2;\n\nb) Nâng hạng giấy phép lái xe từ hạng C1 lên hạng C hoặc lên hạng D1 hoặc lên hạng D2;\n\nc) Nâng hạng giấy phép lái xe từ hạng C lên hạng D1 hoặc lên hạng D2 hoặc lên hạng D;\n\nd) Nâng hạng giấy phép lái xe từ hạng D1 lên hạng D2 hoặc lên hạng D;\n\nđ) Nâng hạng giấy phép lái xe từ hạng D2 lên hạng D;\n\ne) Nâng hạng giấy phép lái xe từ hạng B lên hạng BE, từ hạng C1 lên\xa0 hạng C1E, từ hạng C lên hạng CE, từ hạng D1 lên hạng D1E, từ hạng D2 lên hạng D2E, từ hạng D lên hạng DE.\n\n4.\xa0Người có nhu cầu được đào tạo nâng hạng giấy phép lái xe khi giấy phép lái xe còn hiệu lực, phải có đủ thời gian lái xe an toàn quy định cho từng hạng giấy phép lái xe;\xa0đối với việc nâng hạng giấy phép lái xe lên hạng D1, D2, D thì người có nhu cầu được đào tạo còn phải có trình độ từ trung học cơ sở trở lên.\n\n5. Giấy phép lái xe các hạng C, D1, D2, D, BE, C1E, CE, D1E, D2E, DE phải được đào tạo bằng hình thức đào tạo nâng hạng theo các điều kiện quy định tại khoản 3 và khoản 4 Điều này.\n\n6. Cơ sở đào tạo lái xe ô tô phải đáp ứng các điều kiện do Chính phủ quy định; có giáo trình, giáo án; thực hiện đào tạo theo đúng hình thức, nội dung và chương trình quy định cho từng hạng giấy phép lái xe.\n\n7. Chính phủ quy định chi tiết các hình thức đào tạo lái xe khác quy định tại khoản 2 Điều này; quy định trình tự, thủ tục kiểm tra, đánh giá để cấp, cấp lại và thu hồi giấy phép xe tập lái; quy định tiêu chuẩn của giáo viên dạy lái xe; quy định việc cấp, cấp lại và thu hồi giấy chứng nhận giáo viên dạy lái xe; quy định việc cấp, cấp lại và thu hồi giấy phép đào tạo lái xe.\n\n8. Bộ trưởng Bộ Giao thông vận tải quy định hình thức, nội dung, chương trình đào tạo lái xe, thời gian lái xe an toàn cho từng hạng giấy phép lái xe quy định tại khoản 4 Điều này và quy định tiêu chuẩn của cơ sở đào tạo lái xe mô tô; đối với cơ sở đào tạo, tổ chức đào tạo lái xe cho lực lượng quân đội, công an làm nhiệm vụ quốc phòng, an ninh do Bộ trưởng Bộ Quốc phòng, Bộ trưởng Bộ Công an quy định.\n\nĐiều 61. Sát hạch lái xe\n\n1. Người đã hoàn thành chương trình đào tạo lái xe, có độ tuổi, sức khỏe theo quy định tại Điều 59 của Luật này được đăng ký để tham dự kỳ sát hạch lái xe.\n\n2. Nội dung sát hạch lái xe phải phù hợp với hạng giấy phép lái xe và chương trình đào tạo lái xe.\n\n3. Hoạt động sát hạch lái xe ô tô phải thực hiện tại các trung tâm sát hạch lái xe; hoạt động sát hạch lái xe mô tô thực hiện tại các trung tâm sát hạch lái xe hoặc tại sân tập lái đáp ứng điều kiện, tiêu chuẩn về cơ sở vật chất, kỹ thuật. Hoạt động sát hạch lái xe do cơ quan nhà nước có thẩm quyền thực hiện.', '8. Ủy ban nhân dân các cấp, trong phạm vi nhiệm vụ, quyền hạn của mình, thực hiện quản lý nhà nước về trật tự, an toàn giao thông đường bộ tại địa phương.\n\nChương IX\n\nĐIỀU KHOẢN THI HÀNH\n\nĐiều 88. Hiệu lực thi hành\n\n1. Luật này có hiệu lực thi hành từ ngày 01 tháng 01 năm 2025, trừ trường hợp quy định tại khoản 2 Điều này.\n\n2. Khoản 3 Điều 10 của Luật này có hiệu lực thi hành từ ngày 01 tháng 01 năm 2026.\n\n3. Luật Giao thông đường bộ số 23/2008/QH12 đã được sửa đổi, bổ sung một số điều theo Luật số 35/2018/QH14 và Luật số 44/2019/QH14 hết hiệu lực kể từ ngày Luật này có hiệu lực thi hành, trừ trường hợp quy định tại các khoản 1, 2, 5 và 6 Điều 89 của Luật này.\n\n4. Nghị quyết số 73/2022/QH15 của Quốc hội về thí điểm đấu giá biển số xe ô tô hết hiệu lực kể từ ngày Luật này có hiệu lực thi hành, trừ trường hợp quy định tại khoản 7 Điều 89 của Luật này.\n\nĐiều 89. Quy định chuyển tiếp\n\n1. Giấy phép lái xe được cấp trước ngày Luật này có hiệu lực thi hành được tiếp tục sử dụng theo thời hạn ghi trên giấy phép lái xe. \n\n2. Giấy phép lái xe được cấp trước ngày Luật này có hiệu lực thi hành nếu chưa thực hiện đổi, cấp lại theo quy định của Luật này có hiệu lực sử dụng như sau:\n\na) Giấy phép lái xe hạng A1 được tiếp tục điều khiển xe mô tô hai bánh có dung tích xi-lanh từ 50 cm3\xa0đến dưới 175 cm3 hoặc có công suất động cơ điện từ 04 kW đến dưới 14 kW;\n\nb) Giấy phép lái xe hạng A2 được tiếp tục điều khiển xe mô tô hai bánh có dung tích xi-lanh từ 175 cm3\xa0trở lên hoặc có công suất động cơ điện từ 14 kW trở lên và các loại xe quy định cho giấy phép lái xe hạng A1 quy định tại điểm a khoản này;\n\nc) Giấy phép lái xe hạng A3 được tiếp tục điều khiển xe mô tô ba bánh, các loại xe quy định cho giấy phép lái xe hạng A1 quy định tại điểm a khoản này và các xe tương tự;\n\nd) Giấy phép lái xe hạng A4 được tiếp tục điều khiển máy kéo có trọng tải đến 1.000 kg;\n\nđ) Giấy phép lái xe hạng B1 số tự động cấp cho người không hành nghề lái xe được tiếp tục điều khiển xe ô tô số tự động chở người đến 08 chỗ (không kể chỗ của người lái xe); xe ô tô tải, kể cả ô tô tải chuyên dùng số tự động có trọng tải dưới 3.500 kg;\n\ne) Giấy phép lái xe hạng B1 cấp cho người không hành nghề lái xe được tiếp tục điều khiển xe ô tô chở người đến 08 chỗ (không kể chỗ của người lái xe); xe ô tô tải, máy kéo có trọng tải dưới 3.500 kg;\n\ng) Giấy phép lái xe hạng B2 cấp cho người hành nghề lái xe được tiếp tục điều khiển xe ô tô chở người đến 08 chỗ (không kể chỗ của người lái xe); xe ô tô tải, máy kéo có trọng tải dưới 3.500 kg;\n\nh) Giấy phép lái xe hạng C được tiếp tục điều khiển xe ô tô tải, máy kéo có trọng tải từ 3.500 kg trở lên và các loại xe quy định cho các giấy phép lái xe hạng B1, B2 quy định tại các điểm đ, e và g khoản này;\n\ni) Giấy phép lái xe hạng D được tiếp tục điều khiển xe ô tô chở người từ 09 chỗ (không kể chỗ của người lái xe) đến 29 chỗ (không kể chỗ của người lái xe) và các loại xe quy định cho các giấy phép lái xe hạng B1, B2, C quy định tại các điểm đ, e, g và h khoản này;\n\nk) Giấy phép lái xe hạng E được tiếp tục điều khiển xe ô tô chở người trên 29 chỗ (không kể chỗ của người lái xe) và các loại xe quy định cho các giấy phép lái xe hạng B1, B2, C, D quy định tại các điểm đ, e, g, h và i khoản này;\n\nl) Giấy phép lái xe hạng FB2, FD được tiếp tục điều khiển các loại xe quy định cho giấy phép lái xe hạng B2, D quy định tại điểm g và điểm i khoản này khi kéo rơ moóc; giấy phép lái xe hạng FC được tiếp tục điều khiển các loại xe quy định cho giấy phép lái xe hạng C quy định tại điểm h khoản này khi kéo rơ moóc, đầu kéo kéo sơ mi rơ moóc; giấy phép lái xe hạng FE được tiếp tục điều khiển các loại xe quy định cho giấy phép lái xe hạng E quy định tại điểm k khoản này khi kéo rơ moóc\xa0hoặc xe ô tô chở khách nối toa.\n\n3. Trường hợp người có giấy phép lái xe đã được cấp trước ngày Luật này có hiệu lực thi hành có nhu cầu đổi, cấp lại giấy phép lái xe thì thực hiện như sau:\n\na) Giấy phép lái xe hạng A1 được đổi, cấp lại sang giấy phép lái xe hạng A với điều kiện hạn chế là chỉ được điều khiển xe mô tô hai bánh có dung tích xi-lanh đến dưới 175 cm3 hoặc có công suất động cơ điện đến dưới 14 kW;\n\nb) Giấy phép lái xe hạng A2 được đổi, cấp lại sang giấy phép lái xe hạng A;\n\nc) Giấy phép lái xe hạng A3 được đổi, cấp lại sang giấy phép lái xe hạng B1;\n\nd) Giấy phép lái xe hạng A4 được đổi, cấp lại sang chứng chỉ điều khiển xe máy chuyên dùng cho người điều khiển máy kéo có trọng tải đến 1.000 kg và chứng chỉ bồi dưỡng kiến thức pháp luật về giao thông đường bộ cho người điều khiển xe máy chuyên dùng;\n\nđ) Giấy phép lái xe hạng B1 số tự động được đổi, cấp lại sang giấy phép lái xe hạng B với điều kiện hạn chế là chỉ được điều khiển xe ô tô số tự động;\n\ne) Giấy phép lái xe hạng B1, B2 được đổi, cấp lại sang giấy phép lái xe hạng B hoặc hạng C1 và chứng chỉ điều khiển xe máy chuyên dùng cho người điều khiển máy kéo có trọng tải đến 3.500 kg;\n\ng) Giấy phép lái xe hạng C giữ nguyên và đổi, cấp lại cùng hạng và chứng chỉ điều khiển xe máy chuyên dùng cho người điều khiển máy kéo có trọng tải trên 3.500 kg;\n\nh) Giấy phép lái xe hạng D được đổi, cấp lại sang giấy phép lái xe hạng D2 và chứng chỉ điều khiển xe máy chuyên dùng cho người điều khiển máy kéo có trọng tải trên 3.500 kg;\n\ni) Giấy phép lái xe hạng E được đổi, cấp lại sang giấy phép lái xe hạng D và chứng chỉ điều khiển xe máy chuyên dùng cho người điều khiển máy kéo có trọng tải trên 3.500 kg;\n\nk) Giấy phép lái xe hạng FB2 được đổi, cấp lại sang giấy phép lái xe hạng BE hoặc hạng C1E và chứng chỉ điều khiển xe máy chuyên dùng cho người điều khiển máy kéo có trọng tải đến 3.500 kg;\n\nl) Giấy phép lái xe hạng FC được đổi, cấp lại sang giấy phép lái xe hạng CE và chứng chỉ điều khiển xe máy chuyên dùng cho người điều khiển máy kéo có trọng tải trên 3.500 kg;\n\nm) Giấy phép lái xe hạng FD được đổi, cấp lại sang giấy phép lái xe hạng D2E và chứng chỉ điều khiển xe máy chuyên dùng cho người điều khiển máy kéo có trọng tải trên 3.500 kg;\n\nn) Giấy phép lái xe hạng FE được đổi, cấp lại sang giấy phép lái xe hạng DE và chứng chỉ điều khiển xe máy chuyên dùng cho người điều khiển máy kéo có trọng tải trên 3.500 kg.\n\n4. Người học lái xe đã được đào tạo lái xe trước ngày Luật này có hiệu lực thi hành hoặc đang được đào tạo lái xe tại ngày Luật này có hiệu lực thi hành chưa được sát hạch, cấp giấy phép lái xe thì được sát hạch, cấp giấy phép lái xe theo hạng giấy phép lái xe đổi, cấp lại quy định tại khoản 3 Điều này.\n\n5. Chứng nhận đăng ký xe, biển số xe máy chuyên dùng cấp trước ngày Luật này có hiệu lực thi hành vẫn có giá trị sử dụng.\n\n6. Chứng nhận chất lượng an toàn kỹ thuật và bảo vệ môi trường được cấp trước ngày Luật này có hiệu lực thi hành thì có giá trị sử dụng đến hết thời hạn ghi trên giấy chứng nhận đó.\n\n7. Việc đấu giá biển số xe ô tô được thực hiện trước ngày Luật này có hiệu lực thi hành và đến ngày Luật này có hiệu lực thi hành đã được cấp văn bản xác nhận biển số xe ô tô trúng đấu giá thì tiếp tục thực hiện theo Nghị quyết số 73/2022/QH15 của Quốc hội về thí điểm đấu giá biển số xe ô tô; trường hợp chưa được cấp xác nhận biển số xe ô tô trúng đấu giá thì tiếp tục thực hiện theo Nghị quyết số 73/2022/QH15 của Quốc hội về thí điểm đấu giá biển số xe ô tô và quy định tại điểm d khoản 1 Điều 38 của Luật này./.\n\nLuật này được Quốc hội nước Cộng hòa xã hội chủ nghĩa Việt Nam khóa XV, kỳ họp thứ 7 thông qua ngày 27 tháng 6 năm 2024.\n\nE-pas: 60179 CHỦ TỊCH QUỐC HỘI\n\n\n\n\nTrần Thanh Mẫn']","**Nguồn văn bản:** /content/drive/MyDrive/ITProject_data/new_law/36_2024_QH15_444251.docx

**Tên văn bản:** (Không có tiêu đề trong metadata)

**(Không có điều khoản trong metadata):**

**Nội dung:**

5. Thời hạn của giấy phép lái xe được quy định như sau:

	a) Giấy phép lái xe các hạng A1, A, B1 không thời hạn.

	b) Giấy phép lái xe hạng B và hạng C1 có thời hạn 10 năm kể từ ngày cấp.

	c) Giấy phép lái xe các hạng C, D1, D2, D, BE, C1E, CE, D1E, D2E và DE có thời hạn 05 năm kể từ ngày cấp.


**Tóm lại:** Giấy phép lái xe hạng B có thời hạn 10 năm kể từ ngày cấp.
",Giấy phép lái xe hạng B có thời hạn 10 năm kể từ ngày cấp.,1.0,0.8427394436164227,1.0,0.9999999999
3,Giấy phép lái xe hạng C1 có thời hạn bao lâu?,"['a) Chứng nhận đăng ký xe hoặc bản sao Chứng nhận đăng ký xe có chứng thực kèm bản gốc giấy tờ xác nhận của tổ chức tín dụng, chi nhánh ngân hàng nước ngoài còn hiệu lực trong trường hợp xe đang được thế chấp tại tổ chức tín dụng, chi nhánh ngân hàng nước ngoài;\n\nb) Giấy phép lái xe phù hợp với loại xe đang điều khiển;\n\nc) Chứng nhận kiểm định an toàn kỹ thuật và bảo vệ môi trường đối với xe cơ giới theo quy định của pháp luật;\n\nd) Chứng nhận bảo hiểm bắt buộc trách nhiệm dân sự của chủ xe cơ giới.\n\n2. Người điều khiển xe máy chuyên dùng tham gia giao thông đường bộ phải đủ tuổi, sức khỏe theo quy định của pháp luật; có bằng hoặc chứng chỉ điều khiển xe máy chuyên dùng phù hợp loại xe máy chuyên dùng đang điều khiển; có giấy phép lái xe đang còn điểm, còn hiệu lực hoặc chứng chỉ bồi dưỡng kiến thức pháp luật về giao thông đường bộ. Khi tham gia giao thông đường bộ, người điều khiển xe máy chuyên dùng phải mang theo các loại giấy tờ sau đây:\n\na) Chứng nhận đăng ký xe hoặc bản sao Chứng nhận đăng ký xe có chứng thực kèm bản gốc Giấy biên nhận còn hiệu lực của tổ chức tín dụng, chi nhánh ngân hàng nước ngoài trong trường hợp xe đang được thế chấp tại tổ chức tín dụng, chi nhánh ngân hàng nước ngoài;\n\nb) Bằng hoặc chứng chỉ điều khiển xe máy chuyên dùng;\n\nc) Giấy phép lái xe hoặc chứng chỉ bồi dưỡng kiến thức pháp luật về giao thông đường bộ;\n\nd) Chứng nhận kiểm định an toàn kỹ thuật và bảo vệ môi trường đối với xe máy chuyên dùng theo quy định của pháp luật;\n\nđ) Chứng nhận bảo hiểm bắt buộc trách nhiệm dân sự theo quy định của pháp luật.\n\n3. Trường hợp giấy tờ quy định tại khoản 1 và khoản 2 Điều này đã được tích hợp vào tài khoản định danh điện tử thì việc xuất trình, kiểm tra có thể thực hiện thông qua tài khoản định danh điện tử.\n\n4. Người lái xe gắn máy tham gia giao thông đường bộ phải hiểu biết quy tắc giao thông đường bộ, có kỹ năng điều khiển phương tiện; đủ điều kiện về độ tuổi, sức khỏe theo quy định tại điểm a khoản 1 và khoản 2 Điều 59 của Luật này.\n\n5. Người tập lái xe ô tô, người dự sát hạch lái xe ô tô khi tham gia giao thông đường bộ phải thực hành trên xe tập lái, xe sát hạch trên tuyến đường tập lái, tuyến đường sát hạch, có giáo viên dạy lái hoặc sát hạch viên bảo trợ tay lái. Giáo viên dạy lái, sát hạch viên phải mang theo các loại giấy tờ quy định tại khoản 1 Điều này.\n\nĐiều 57. Giấy phép lái xe\n\n1. Giấy phép lái xe bao gồm các hạng sau đây:\n\na) Hạng A1 cấp cho người lái xe mô tô hai bánh có dung tích xi-lanh đến 125 cm3 hoặc có công suất động cơ điện đến 11 kW;\n\nb) Hạng A cấp cho người lái xe mô tô hai bánh có dung tích xi-lanh\xa0 trên 125 cm3\xa0hoặc có công suất động cơ điện trên 11 kW và các loại xe quy định cho giấy phép lái xe hạng A1;\n\nc) Hạng B1 cấp cho người lái xe mô tô ba bánh và các loại xe quy định cho giấy phép lái xe hạng A1;\n\nd) Hạng B cấp cho người lái xe ô tô chở người đến 08 chỗ (không kể chỗ của người lái xe); xe ô tô tải và ô tô chuyên dùng có khối lượng toàn bộ theo thiết kế đến 3.500 kg; các loại xe ô tô quy định cho giấy phép lái xe hạng B kéo rơ moóc có khối lượng toàn bộ theo thiết kế đến 750 kg; \n\nđ) Hạng C1 cấp cho người lái xe ô tô tải và ô tô chuyên dùng có khối lượng toàn bộ theo thiết kế trên 3.500 kg đến 7.500 kg; các loại xe ô tô tải quy định cho giấy phép lái xe hạng C1 kéo rơ moóc có khối lượng toàn bộ theo thiết kế đến 750 kg; các loại xe quy định cho giấy phép lái xe hạng B;\n\ne) Hạng C cấp cho người lái xe ô tô tải và ô tô chuyên dùng có khối lượng toàn bộ theo thiết kế trên 7.500 kg; các loại xe ô tô tải quy định cho giấy phép lái xe hạng C kéo rơ moóc có khối lượng toàn bộ theo thiết kế đến 750 kg; các loại xe quy định cho giấy phép lái xe hạng B và hạng C1;\n\ng) Hạng D1 cấp cho người lái xe ô tô chở người trên 08 chỗ (không kể chỗ của người lái xe) đến 16 chỗ (không kể chỗ của người lái xe); các loại xe ô tô chở người quy định cho giấy phép lái xe hạng D1 kéo rơ moóc có khối lượng toàn bộ theo thiết kế đến 750 kg; các loại xe quy định cho giấy phép lái xe các hạng B, C1, C;\n\nh) Hạng D2 cấp cho người lái xe ô tô chở người (kể cả xe buýt) trên 16 chỗ (không kể chỗ của người lái xe) đến 29 chỗ (không kể chỗ của người lái xe); các loại xe ô tô chở người quy định cho giấy phép lái xe hạng D2 kéo rơ moóc có khối lượng toàn bộ theo thiết kế đến 750 kg; các loại xe quy định cho giấy phép lái xe các hạng B, C1, C, D1;\n\ni) Hạng D cấp cho người lái xe ô tô chở người (kể cả xe buýt) trên 29 chỗ (không kể chỗ của người lái xe); xe ô tô chở người giường nằm; các loại xe ô tô chở người quy định cho giấy phép lái xe hạng D kéo rơ moóc có khối lượng toàn bộ theo thiết kế đến 750 kg; các loại xe quy định cho giấy phép lái xe các hạng B, C1, C, D1, D2;\n\nk) Hạng BE cấp cho người lái các loại xe ô tô quy định cho giấy phép lái xe hạng B kéo rơ moóc có khối lượng toàn bộ theo thiết kế trên 750 kg;\n\nl) Hạng C1E cấp cho người lái các loại xe ô tô quy định cho giấy phép lái xe hạng C1 kéo rơ moóc có khối lượng toàn bộ theo thiết kế trên 750 kg;\n\nm) Hạng CE cấp cho người lái các loại xe ô tô quy định cho giấy phép lái xe hạng C kéo rơ moóc có khối lượng toàn bộ theo thiết kế trên 750 kg; xe ô tô đầu kéo kéo sơ mi rơ moóc;\n\nn) Hạng D1E cấp cho người lái các loại xe ô tô quy định cho giấy phép lái xe hạng D1 kéo rơ moóc có khối lượng toàn bộ theo thiết kế trên 750 kg;\n\no) Hạng D2E cấp cho người lái các loại xe ô tô quy định cho giấy phép lái xe hạng D2 kéo rơ moóc có khối lượng toàn bộ theo thiết kế trên 750 kg;\n\np) Hạng DE cấp cho người lái các loại xe ô tô quy định cho giấy phép lái xe hạng D kéo rơ moóc có khối lượng toàn bộ theo thiết kế trên 750 kg; xe ô tô chở khách nối toa.\n\n2. Người khuyết tật điều khiển xe mô tô ba bánh dùng cho người khuyết tật được cấp giấy phép lái xe hạng A1.\n\nNgười khuyết tật điều khiển xe ô tô số tự động có kết cấu phù hợp với tình trạng khuyết tật thì được cấp giấy phép lái xe hạng B.\n\n3. Người điều khiển xe chở hàng bốn bánh có gắn động cơ, xe chở người bốn bánh có gắn động cơ phải sử dụng giấy phép lái xe có hạng phù hợp với xe ô tô tải hoặc xe ô tô chở người tương ứng.\n\n4. Người điều khiển xe ô tô có thiết kế, cải tạo với số chỗ ít hơn xe cùng loại, kích thước giới hạn tương đương phải sử dụng giấy phép lái xe có hạng phù hợp với xe ô tô cùng loại, kích thước giới hạn tương đương và có số chỗ nhiều nhất.\n\n5. Thời hạn của giấy phép lái xe được quy định như sau:\n\na) Giấy phép lái xe các hạng A1, A, B1 không thời hạn;\n\nb) Giấy phép lái xe hạng B và hạng C1 có thời hạn 10 năm kể từ ngày cấp;\n\nc) Giấy phép lái xe các hạng C, D1, D2, D, BE, C1E, CE, D1E, D2E và DE có thời hạn 05 năm kể từ ngày cấp.\n\n6. Giấy phép lái xe có giá trị sử dụng trong phạm vi lãnh thổ Việt Nam bao gồm:\n\na) Giấy phép lái xe do cơ quan có thẩm quyền của Việt Nam cấp;\n\nb) Giấy phép lái xe quốc tế và giấy phép lái xe quốc gia phù hợp với loại xe được phép điều khiển do quốc gia là thành viên của Công ước của Liên hợp quốc về Giao thông đường bộ năm 1968 (sau đây gọi là Công ước Viên) cấp;\n\nc) Giấy phép lái xe phù hợp với loại xe được phép điều khiển của nước hoặc vùng lãnh thổ mà Việt Nam ký kết điều ước quốc tế hoặc thỏa thuận quốc tế công nhận giấy phép lái xe của nhau;\n\nd) Giấy phép lái xe nước ngoài phù hợp với loại xe được phép điều khiển do quốc gia được công nhận theo điều ước quốc tế mà nước Cộng hòa xã hội chủ nghĩa Việt Nam là thành viên.\n\n7. Giấy phép lái xe không có hiệu lực trong các trường hợp sau đây:\n\na) Giấy phép lái xe hết thời hạn sử dụng;\n\nb) Giấy phép lái xe bị thu hồi theo quy định tại khoản 5 Điều 62 của Luật này.\n\n8. Giấy phép lái xe quốc tế được quy định như sau:\n\na) Giấy phép lái xe quốc tế là giấy phép lái xe do cơ quan nhà nước có thẩm quyền của quốc gia là thành viên của Công ước Viên cấp theo một mẫu thống nhất; có thời hạn không quá 03 năm kể từ ngày cấp và phải phù hợp với thời hạn còn hiệu lực của giấy phép lái xe quốc gia;', 'a) Giấy phép lái xe hết thời hạn sử dụng;\n\nb) Giấy phép lái xe bị thu hồi theo quy định tại khoản 5 Điều 62 của Luật này.\n\n8. Giấy phép lái xe quốc tế được quy định như sau:\n\na) Giấy phép lái xe quốc tế là giấy phép lái xe do cơ quan nhà nước có thẩm quyền của quốc gia là thành viên của Công ước Viên cấp theo một mẫu thống nhất; có thời hạn không quá 03 năm kể từ ngày cấp và phải phù hợp với thời hạn còn hiệu lực của giấy phép lái xe quốc gia;\n\nb) Người có giấy phép lái xe quốc tế do quốc gia là thành viên của Công ước Viên cấp khi lái xe tham gia giao thông đường bộ trên lãnh thổ Việt Nam phải mang theo giấy phép lái xe quốc tế và giấy phép lái xe quốc gia được cấp phù hợp với hạng xe điều khiển, còn thời hạn sử dụng; phải tuân thủ pháp luật về trật tự, an toàn giao thông đường bộ của Việt Nam;\n\nc) Người có giấy phép lái xe quốc tế vi phạm pháp luật về trật tự, an toàn giao thông đường bộ của Việt Nam mà bị tước quyền sử dụng giấy phép lái xe có thời hạn thì thời gian bị tước quyền sử dụng không quá thời gian người lái xe được phép cư trú tại lãnh thổ Việt Nam;\n\nd) Người Việt Nam hoặc người nước ngoài có thẻ thường trú hoặc thẻ tạm trú tại Việt Nam có giấy phép lái xe do Việt Nam hoặc quốc gia là thành viên của điều ước quốc tế mà nước Cộng hòa xã hội chủ nghĩa Việt Nam là thành viên cấp, còn giá trị sử dụng, nếu có nhu cầu được cấp giấy phép lái xe quốc tế.\n\n9. Bộ trưởng Bộ Giao thông vận tải quy định mẫu giấy phép lái xe và giấy phép lái xe quốc tế, trình tự, thủ tục cấp và việc sử dụng giấy phép lái xe, giấy phép lái xe quốc tế; đối với mẫu giấy phép lái xe, trình tự, thủ tục cấp và việc sử dụng giấy phép lái xe của lực lượng quân đội, công an làm nhiệm vụ quốc phòng, an ninh do Bộ trưởng Bộ Quốc phòng, Bộ trưởng Bộ Công an quy định.\n\nĐiều 58. Điểm của giấy phép lái xe \n\n1. Điểm của giấy phép lái xe được dùng để quản lý việc chấp hành pháp luật về trật tự, an toàn giao thông đường bộ của người lái xe trên hệ thống cơ sở dữ liệu về trật tự, an toàn giao thông đường bộ, bao gồm 12 điểm. Số điểm trừ mỗi lần vi phạm tùy thuộc tính chất, mức độ của hành vi vi phạm pháp luật về trật tự, an toàn giao thông đường bộ. Dữ liệu về điểm trừ giấy phép lái xe của người vi phạm sẽ được cập nhật vào hệ thống cơ sở dữ liệu ngay sau khi quyết định xử phạt có hiệu lực thi hành và thông báo cho người bị trừ điểm giấy phép lái xe biết.\n\n2. Giấy phép lái xe chưa bị trừ hết điểm và không bị trừ điểm trong thời hạn 12 tháng từ ngày bị trừ điểm gần nhất thì được phục hồi đủ 12 điểm.\n\n3. Trường hợp giấy phép lái xe bị trừ hết điểm thì người có giấy phép lái xe không được điều khiển phương tiện tham gia giao thông đường bộ theo giấy phép lái xe đó. Sau thời hạn ít nhất là 06 tháng kể từ ngày bị trừ hết điểm, người có giấy phép lái xe được tham gia kiểm tra nội dung kiến thức pháp luật về trật tự, an toàn giao thông đường bộ theo quy định tại khoản 7 Điều 61 của Luật này do lực lượng Cảnh sát giao thông tổ chức, có kết quả đạt yêu cầu thì được phục hồi đủ 12 điểm.\n\n4. Giấy phép lái xe sau khi đổi, cấp lại, nâng hạng được giữ nguyên số điểm của giấy phép lái xe trước khi đổi, cấp lại, nâng hạng.\n\n5. Người có thẩm quyền xử phạt vi phạm hành chính có thẩm quyền trừ điểm giấy phép lái xe.\n\n6. Chính phủ quy định chi tiết khoản 1 Điều này; quy định trình tự, thủ tục, thẩm quyền trừ điểm, phục hồi điểm giấy phép lái xe; quy định lộ trình thực hiện Điều này. Bộ trưởng Bộ Công an quy định chi tiết khoản 3 Điều này.\n\nĐiều 59. Tuổi, sức khỏe của người điều khiển phương tiện tham gia giao thông đường bộ\n\n1. Độ tuổi của người lái xe, người điều khiển xe máy chuyên dùng được quy định như sau:\n\na) Người đủ 16 tuổi trở lên được điều khiển xe gắn máy;\n\nb) Người đủ 18 tuổi trở lên được cấp giấy phép lái xe hạng A1, A, B1, B, C1, được cấp chứng chỉ bồi dưỡng kiến thức pháp luật về giao thông đường bộ để điều khiển xe máy chuyên dùng tham gia giao thông đường bộ;\n\nc) Người đủ 21 tuổi trở lên được cấp giấy phép lái xe hạng C, BE;\n\nd) Người đủ 24 tuổi trở lên được cấp giấy phép lái xe hạng D1, D2, C1E, CE;\n\nđ) Người đủ 27 tuổi trở lên được cấp giấy phép lái xe hạng D, D1E, D2E, DE;\n\ne) Tuổi tối đa của người lái xe ô tô chở người (kể cả xe buýt) trên 29 chỗ (không kể chỗ của người lái xe), xe ô tô chở người giường nằm là đủ 57 tuổi đối với nam, đủ 55 tuổi đối với nữ.\n\n2. Người điều khiển phương tiện tham gia giao thông đường bộ phải bảo đảm điều kiện sức khỏe phù hợp với từng loại phương tiện được phép điều khiển. Bộ trưởng Bộ Y tế quy định về tiêu chuẩn sức khỏe, việc khám sức khỏe đối với người lái xe, người điều khiển xe máy chuyên dùng; việc khám sức khỏe định kỳ đối với người hành nghề lái xe ô tô; xây dựng cơ sở dữ liệu về sức khỏe của người lái xe, người điều khiển xe máy chuyên dùng.\n\n3. Bộ trưởng Bộ Quốc phòng, Bộ trưởng Bộ Công an quy định độ tuổi của người lái xe trong lực lượng quân đội, công an làm nhiệm vụ quốc phòng, an ninh.\n\nĐiều 60. Đào tạo lái xe\n\n1. Người có nhu cầu được cấp giấy phép lái xe phải được đào tạo nội dung lý thuyết và thực hành theo chương trình đào tạo quy định cho từng hạng giấy phép lái xe.\n\n2. Người học lái xe phải được đào tạo tại các cơ sở đào tạo lái xe hoặc các hình thức đào tạo lái xe khác để cấp mới hoặc nâng hạng giấy phép lái xe.\n\n3. Việc đào tạo để nâng hạng giấy phép lái xe thực hiện đối với những đối tượng sau đây:\n\na) Nâng hạng giấy phép lái xe từ hạng B lên hạng C1 hoặc lên hạng C hoặc lên hạng D1 hoặc lên hạng D2;\n\nb) Nâng hạng giấy phép lái xe từ hạng C1 lên hạng C hoặc lên hạng D1 hoặc lên hạng D2;\n\nc) Nâng hạng giấy phép lái xe từ hạng C lên hạng D1 hoặc lên hạng D2 hoặc lên hạng D;\n\nd) Nâng hạng giấy phép lái xe từ hạng D1 lên hạng D2 hoặc lên hạng D;\n\nđ) Nâng hạng giấy phép lái xe từ hạng D2 lên hạng D;\n\ne) Nâng hạng giấy phép lái xe từ hạng B lên hạng BE, từ hạng C1 lên\xa0 hạng C1E, từ hạng C lên hạng CE, từ hạng D1 lên hạng D1E, từ hạng D2 lên hạng D2E, từ hạng D lên hạng DE.\n\n4.\xa0Người có nhu cầu được đào tạo nâng hạng giấy phép lái xe khi giấy phép lái xe còn hiệu lực, phải có đủ thời gian lái xe an toàn quy định cho từng hạng giấy phép lái xe;\xa0đối với việc nâng hạng giấy phép lái xe lên hạng D1, D2, D thì người có nhu cầu được đào tạo còn phải có trình độ từ trung học cơ sở trở lên.\n\n5. Giấy phép lái xe các hạng C, D1, D2, D, BE, C1E, CE, D1E, D2E, DE phải được đào tạo bằng hình thức đào tạo nâng hạng theo các điều kiện quy định tại khoản 3 và khoản 4 Điều này.\n\n6. Cơ sở đào tạo lái xe ô tô phải đáp ứng các điều kiện do Chính phủ quy định; có giáo trình, giáo án; thực hiện đào tạo theo đúng hình thức, nội dung và chương trình quy định cho từng hạng giấy phép lái xe.\n\n7. Chính phủ quy định chi tiết các hình thức đào tạo lái xe khác quy định tại khoản 2 Điều này; quy định trình tự, thủ tục kiểm tra, đánh giá để cấp, cấp lại và thu hồi giấy phép xe tập lái; quy định tiêu chuẩn của giáo viên dạy lái xe; quy định việc cấp, cấp lại và thu hồi giấy chứng nhận giáo viên dạy lái xe; quy định việc cấp, cấp lại và thu hồi giấy phép đào tạo lái xe.\n\n8. Bộ trưởng Bộ Giao thông vận tải quy định hình thức, nội dung, chương trình đào tạo lái xe, thời gian lái xe an toàn cho từng hạng giấy phép lái xe quy định tại khoản 4 Điều này và quy định tiêu chuẩn của cơ sở đào tạo lái xe mô tô; đối với cơ sở đào tạo, tổ chức đào tạo lái xe cho lực lượng quân đội, công an làm nhiệm vụ quốc phòng, an ninh do Bộ trưởng Bộ Quốc phòng, Bộ trưởng Bộ Công an quy định.\n\nĐiều 61. Sát hạch lái xe\n\n1. Người đã hoàn thành chương trình đào tạo lái xe, có độ tuổi, sức khỏe theo quy định tại Điều 59 của Luật này được đăng ký để tham dự kỳ sát hạch lái xe.\n\n2. Nội dung sát hạch lái xe phải phù hợp với hạng giấy phép lái xe và chương trình đào tạo lái xe.\n\n3. Hoạt động sát hạch lái xe ô tô phải thực hiện tại các trung tâm sát hạch lái xe; hoạt động sát hạch lái xe mô tô thực hiện tại các trung tâm sát hạch lái xe hoặc tại sân tập lái đáp ứng điều kiện, tiêu chuẩn về cơ sở vật chất, kỹ thuật. Hoạt động sát hạch lái xe do cơ quan nhà nước có thẩm quyền thực hiện.', 'khí, khí tài quân sự dạng rơ moóc có khối lượng toàn bộ theo thiết kế đến 750 kg; các loại xe quy định cho Giấy phép lái xe quân sự hạng B, C1, C, D1;\n\ni) Hạng D cấp cho người điều khiển xe ô tô chở người từ trên 29 chỗ (không kể chỗ của người lái xe); các loại xe ô tô chở người quy định cho Giấy phép lái xe hạng D kéo rơ moóc hoặc vũ khí, khí tài quân sự dạng rơ moóc có khối lượng toàn bộ theo thiết kế đến 750 kg; các loại xe quy định cho Giấy phép lái xe quân sự hạng B, C1, C, D1, D2;\n\nk) Hạng C1E cấp cho người điều khiển các loại xe ô tô quy định cho Giấy phép lái xe hạng C1 kéo rơ moóc hoặc vũ khí, khí tài quân sự dạng rơ moóc có khối lượng toàn bộ theo thiết kế trên 750 kg;\n\nl) Hạng CE cấp cho người điều khiển các loại xe ô tô quy định cho Giấy phép lái xe hạng C kéo rơ moóc hoặc vũ khí, khí tài quân sự dạng rơ moóc có khối lượng toàn bộ theo thiết kế trên 750 kg; xe ô tô đầu kéo kéo sơ mi rơ moóc hoặc khí tài quân sự dạng sơ mi rơ moóc;\n\nm) Hạng CX cấp cho người đã có Giấy phép lái xe quân sự hạng C để điều khiển xe xích kéo vũ khí, khí tài quân sự.\n\n2. Người điều khiển xe chở hàng bốn bánh có gắn động cơ, xe chở người bốn bánh có gắn động cơ phải sử dụng giấy phép lái xe có hạng phù hợp với xe ô tô tải và ô tô chở người tương ứng.\n\n3. Người điều khiển xe ô tô có thiết kế, cải tạo với số chỗ ngồi ít hơn ô tô cùng loại, kích thước giới hạn tương đương phải sử dụng giấy phép lái xe có hạng phù hợp với ô tô cùng loại, kích thước giới hạn tương đương và có số chỗ ngồi nhiều nhất.\n\nĐiều 6. Mẫu và thời hạn Giấy phép lái xe quân sự\n\n1. Mẫu Giấy phép lái xe quân sự\n\na) Giấy phép lái xe quân sự thực hiện theo quy định tại Mẫu số 08 kèm theo Thông tư này;\n\nb) Cục trưởng Cục Xe máy - Vận tải/Tổng cục Hậu cần - Kỹ thuật có trách nhiệm quản lý việc sử dụng Giấy phép lái xe quân sự thuộc phạm vi quản lý của Bộ Quốc phòng.\n\n2. Thời hạn sử dụng Giấy phép lái xe quân sự\n\na) Giấy phép lái xe quân sự hạng A1, A, B1 là không thời hạn;\n\nb) Giấy phép lái xe quân sự các hạng B, C1, C, D1, D2, D, C1E, CE, CX có thời hạn 05 năm kể từ ngày cấp;\n\nc) Trường hợp cấp, đổi do lý do khác thời hạn theo thời hạn ghi trên Giấy phép lái xe quân sự.\n\n3. Giấy phép lái xe quân sự không có hiệu lực trong các trường hợp sau:\n\na) Giấy phép lái xe quân sự hết thời hạn sử dụng được ghi trên Giấy phép lái xe;\n\nb) Giấy phép lái xe quân sự bị trừ hết điểm theo quy định tại Điều 7 của Thông tư này;\n\nc) Giấy phép lái xe quân sự có Quyết định thu hồi theo khoản 1 Điều 47 Thông tư này.\n\nĐiều 7. Điểm của Giấy phép lái xe quân sự\n\n1. Điểm của Giấy phép lái xe quân sự gồm 12 điểm theo quy định của Luật Trật tự, an toàn giao thông đường bộ, được dùng để quản lý việc chấp hành pháp luật về trật tự, an toàn giao thông đường bộ của người lái xe. Số điểm trừ mỗi lần tùy theo tính chất, mức độ vi phạm theo quy định của pháp luật. Giấy phép lái xe chưa bị trừ hết điểm và không bị trừ điểm trong thời hạn 12 tháng kể từ ngày bị trừ điểm gần nhất thì được phục hồi đủ 12 điểm.\n\n2. Trường hợp Giấy phép lái xe quân sự bị trừ hết điểm, sau thời hạn ít nhất 06 tháng kể từ ngày bị trừ hết điểm, người có Giấy phép lái xe quân sự bị trừ hết điểm được tham gia kiểm tra kiến thức pháp luật về giao thông đường bộ tổ chức tại cơ sở đào tạo lái xe quân sự theo quy định tại điểm a khoản 1 Điều 40 và khoản 1 Điều 41 Thông tư này, nếu kết quả đặt yêu cầu được phục hồi đủ 12 điểm.\n\n3. Điểm của Giấy phép lái xe quân sự đổi, cấp lại, đào tạo nâng hạng được giữ nguyên như trước khi đổi, cấp lại, đào tạo nâng hạng.\n\nĐiều 8. Độ tuổi của người được cấp Giấy phép lái xe quân sự\n\n1. Quân nhân, công chức quốc phòng, công nhân viên chức quốc phòng, lao động hợp đồng đang phục vụ trong Bộ Quốc phòng đủ 18 tuổi trở lên được cấp Giấy phép lái xe quân sự hạng A1, A, B1, B, C1, C.\n\n2. Quân nhân, công chức quốc phòng, công nhân viên chức quốc phòng, lao động hợp đồng đang phục vụ trong Bộ Quốc phòng đủ 24 tuổi trở lên được cấp Giấy phép lái xe quân sự hạng D1, D2, C1E, CE, CX.\n\nCác trường hợp đào tạo chuyển tiếp từ hạng C lên hạng CE hoặc CX theo chỉ tiêu của Bộ Tổng Tham mưu, đủ 19 tuổi trở lên.\n\n3. Quân nhân, công chức quốc phòng, công nhân viên chức quốc phòng, lao động hợp đồng đang phục vụ trong Bộ Quốc phòng đủ 27 tuổi trở lên được cấp Giấy phép lái xe quân sự hạng D. Độ tuổi tối đa của người được cấp Giấy phép lái xe quân sự hạng D là đủ 57 tuổi đối với nam và đủ 55 tuổi đối với nữ.\n\nChương II\n\nĐÀO TẠO LÁI XE QUÂN SỰ\n\nMục I. NGƯỜI HỌC\n\nĐiều 9. Điều kiện đối với người học lái xe quân sự\n\n1. Quân nhân, công chức quốc phòng, công nhân viên chức quốc phòng, lao động hợp đồng đang phục vụ trong Bộ Quốc phòng có đủ các điều kiện: Tiêu chuẩn về tuổi đời, thời gian công tác, sức khỏe, trình độ văn hóa, phẩm chất chính trị theo quy định của Bộ Quốc phòng.\n\nĐối với lao động hợp đồng: Chỉ đào tạo nâng hạng khi có đủ điều kiện, tiêu chuẩn quy định tại khoản 1 Điều này.\n\n2. Đối với người học nâng hạng Giấy phép lái xe quân sự phải có thời gian lái xe và số km lái xe an toàn như sau:\n\na) Từ hạng B lên hạng C1; hạng C1 lên hạng C, C1E; hạng C lên hạng D1, CE, CX; hạng D1 lên hạng D2; hạng D2 lên hạng D: Có thời gian lái xe 02 năm trở lên và 30.000 km lái xe an toàn trở lên (trừ các trường hợp đào tạo chuyển tiếp từ hạng C lên hạng CE hoặc CX theo chỉ tiêu của Bộ Tổng Tham mưu);\n\nb) Từ hạng B lên hạng C, D1; hạng C1 lên D1; hạng C lên hạng D2; hạng D1 lên hạng D: Có thời gian lái xe 03 năm trở lên và có 50.000 km lái xe an toàn trở lên;\n\nc) Từ hạng B lên hạng D2, từ hạng C1 lên hạng D2, từ hạng C lên hạng D: Có thời gian lái xe 05 năm trở lên và 100.000 km lái xe an toàn trở lên.\n\n3. Đối với người học nâng hạng Giấy phép lái xe quân sự lên hạng D1, D2, D ngoài các quy định tại các khoản 1, 2 Điều này phải có bằng tốt nghiệp trung học cơ sở trở lên.\n\nĐiều 10. Hồ sơ đào tạo lái xe\n\n1. Hạng A1, A, gồm:\n\na) Kế hoạch huấn luyện lái xe mô tô quân sự hạng A1, A (kèm theo danh sách học viên) của cơ quan, đơn vị theo quy định tại Mẫu số 13 Phụ lục I kèm theo Thông tư này;\n\nb) Đơn đề nghị học và sát hạch, cấp Giấy phép lái xe quân sự của cá nhân có xác nhận của Thủ trưởng cơ quan, đơn vị trực tiếp quản lý từ cấp trung đoàn hoặc tương đương trở lên theo quy định tại Mẫu số 01 Phụ lục I kèm theo Thông tư này;\n\nc) Bản sao Căn cước công dân (căn cước) và bản sao một trong các loại giấy tờ sau: Giấy chứng minh quân nhân, công chức quốc phòng, công nhân và viên chức quốc phòng, quyết định nhập ngũ, tuyển dụng, phiếu quân nhân, thẻ học viên, quyết định thăng, phong quân hàm, nâng lương gần nhất còn hiệu lực;\n\nd) Giấy chứng nhận sức khỏe theo quy định do quân y cấp trung đoàn và tương đương trở lên xác nhận theo quy định tại Mẫu số 02 Phụ lục I kèm theo Thông tư này;\n\nđ) Hai ảnh màu cỡ 2 x 3 cm (ảnh chụp trên nền màu xanh; quân nhân mặc quân phục thường dùng; công chức quốc phòng, công nhân và viên chức quốc phòng, lao động hợp đồng mặc đồng phục; đeo biển tên theo quy định, không đội mũ).\n\n2. Hạng B1, B, C1, C, gồm:\n\na) Kế hoạch đào tạo lái xe quân sự hạng B1, B, C1, C (kèm theo danh sách học viên) của cơ sở đào tạo;\n\nb) Bản sao quyết định giao chỉ tiêu đào tạo nhân viên kỹ thuật sơ cấp của Tổng Tham mưu trưởng đối với trường hợp đào tạo theo chỉ tiêu nhiệm vụ; văn bản đề nghị đào tạo lái xe của Thủ trưởng cơ quan, đơn vị đầu mối trực thuộc Bộ Quốc phòng đối với trường hợp gửi đào tạo;\n\nc) Hồ sơ quy định tại các điểm b, c, d, đ khoản 1 Điều này;\n\n3. Đào tạo nâng hạng Giấy phép lái xe quân sự\n\nNgoài hồ sơ quy định tại khoản 2 Điều này phải bổ sung các giấy tờ như sau:\n\na) Bản khai thời gian lái xe và số km lái xe an toàn quy định cho từng hạng xe có xác nhận của Thủ trưởng cơ quan, đơn vị trực tiếp quản lý từ cấp trung đoàn hoặc tương đương trở lên theo quy định tại Mẫu số 03 Phụ lục I kèm theo Thông tư này;\n\nb) Bản sao Giấy phép lái xe quân sự đang sử dụng.\n\nMục II. CƠ SỞ ĐÀO TẠO LÁI XE QUÂN SỰ\n\nĐiều 11. Nhiệm vụ của cơ sở đào tạo lái xe quân sự']","**Nguồn văn bản:** /content/drive/MyDrive/ITProject_data/new_law/36_2024_QH15_444251.docx

**Tên văn bản:** (Không có tiêu đề trong metadata)

**(Không có điều khoản trong metadata):**

**Nội dung:**

5. Thời hạn của giấy phép lái xe được quy định như sau:

	a) Giấy phép lái xe các hạng A1, A, B1 không thời hạn.

	b) Giấy phép lái xe hạng B và hạng C1 có thời hạn 10 năm kể từ ngày cấp.

	c) Giấy phép lái xe các hạng C, D1, D2, D, BE, C1E, CE, D1E, D2E và DE có thời hạn 05 năm kể từ ngày cấp.


**Tóm lại:** Thời hạn của giấy phép lái xe hạng C1 là 10 năm kể từ ngày cấp.
",Giấy phép lái xe hạng C1 có thời hạn 10 năm kể từ ngày cấp.,1.0,0.9357325966046988,1.0,0.9999999999
4,Giấy phép lái xe hạng D có thời hạn bao lâu?,"['a) Chứng nhận đăng ký xe hoặc bản sao Chứng nhận đăng ký xe có chứng thực kèm bản gốc giấy tờ xác nhận của tổ chức tín dụng, chi nhánh ngân hàng nước ngoài còn hiệu lực trong trường hợp xe đang được thế chấp tại tổ chức tín dụng, chi nhánh ngân hàng nước ngoài;\n\nb) Giấy phép lái xe phù hợp với loại xe đang điều khiển;\n\nc) Chứng nhận kiểm định an toàn kỹ thuật và bảo vệ môi trường đối với xe cơ giới theo quy định của pháp luật;\n\nd) Chứng nhận bảo hiểm bắt buộc trách nhiệm dân sự của chủ xe cơ giới.\n\n2. Người điều khiển xe máy chuyên dùng tham gia giao thông đường bộ phải đủ tuổi, sức khỏe theo quy định của pháp luật; có bằng hoặc chứng chỉ điều khiển xe máy chuyên dùng phù hợp loại xe máy chuyên dùng đang điều khiển; có giấy phép lái xe đang còn điểm, còn hiệu lực hoặc chứng chỉ bồi dưỡng kiến thức pháp luật về giao thông đường bộ. Khi tham gia giao thông đường bộ, người điều khiển xe máy chuyên dùng phải mang theo các loại giấy tờ sau đây:\n\na) Chứng nhận đăng ký xe hoặc bản sao Chứng nhận đăng ký xe có chứng thực kèm bản gốc Giấy biên nhận còn hiệu lực của tổ chức tín dụng, chi nhánh ngân hàng nước ngoài trong trường hợp xe đang được thế chấp tại tổ chức tín dụng, chi nhánh ngân hàng nước ngoài;\n\nb) Bằng hoặc chứng chỉ điều khiển xe máy chuyên dùng;\n\nc) Giấy phép lái xe hoặc chứng chỉ bồi dưỡng kiến thức pháp luật về giao thông đường bộ;\n\nd) Chứng nhận kiểm định an toàn kỹ thuật và bảo vệ môi trường đối với xe máy chuyên dùng theo quy định của pháp luật;\n\nđ) Chứng nhận bảo hiểm bắt buộc trách nhiệm dân sự theo quy định của pháp luật.\n\n3. Trường hợp giấy tờ quy định tại khoản 1 và khoản 2 Điều này đã được tích hợp vào tài khoản định danh điện tử thì việc xuất trình, kiểm tra có thể thực hiện thông qua tài khoản định danh điện tử.\n\n4. Người lái xe gắn máy tham gia giao thông đường bộ phải hiểu biết quy tắc giao thông đường bộ, có kỹ năng điều khiển phương tiện; đủ điều kiện về độ tuổi, sức khỏe theo quy định tại điểm a khoản 1 và khoản 2 Điều 59 của Luật này.\n\n5. Người tập lái xe ô tô, người dự sát hạch lái xe ô tô khi tham gia giao thông đường bộ phải thực hành trên xe tập lái, xe sát hạch trên tuyến đường tập lái, tuyến đường sát hạch, có giáo viên dạy lái hoặc sát hạch viên bảo trợ tay lái. Giáo viên dạy lái, sát hạch viên phải mang theo các loại giấy tờ quy định tại khoản 1 Điều này.\n\nĐiều 57. Giấy phép lái xe\n\n1. Giấy phép lái xe bao gồm các hạng sau đây:\n\na) Hạng A1 cấp cho người lái xe mô tô hai bánh có dung tích xi-lanh đến 125 cm3 hoặc có công suất động cơ điện đến 11 kW;\n\nb) Hạng A cấp cho người lái xe mô tô hai bánh có dung tích xi-lanh\xa0 trên 125 cm3\xa0hoặc có công suất động cơ điện trên 11 kW và các loại xe quy định cho giấy phép lái xe hạng A1;\n\nc) Hạng B1 cấp cho người lái xe mô tô ba bánh và các loại xe quy định cho giấy phép lái xe hạng A1;\n\nd) Hạng B cấp cho người lái xe ô tô chở người đến 08 chỗ (không kể chỗ của người lái xe); xe ô tô tải và ô tô chuyên dùng có khối lượng toàn bộ theo thiết kế đến 3.500 kg; các loại xe ô tô quy định cho giấy phép lái xe hạng B kéo rơ moóc có khối lượng toàn bộ theo thiết kế đến 750 kg; \n\nđ) Hạng C1 cấp cho người lái xe ô tô tải và ô tô chuyên dùng có khối lượng toàn bộ theo thiết kế trên 3.500 kg đến 7.500 kg; các loại xe ô tô tải quy định cho giấy phép lái xe hạng C1 kéo rơ moóc có khối lượng toàn bộ theo thiết kế đến 750 kg; các loại xe quy định cho giấy phép lái xe hạng B;\n\ne) Hạng C cấp cho người lái xe ô tô tải và ô tô chuyên dùng có khối lượng toàn bộ theo thiết kế trên 7.500 kg; các loại xe ô tô tải quy định cho giấy phép lái xe hạng C kéo rơ moóc có khối lượng toàn bộ theo thiết kế đến 750 kg; các loại xe quy định cho giấy phép lái xe hạng B và hạng C1;\n\ng) Hạng D1 cấp cho người lái xe ô tô chở người trên 08 chỗ (không kể chỗ của người lái xe) đến 16 chỗ (không kể chỗ của người lái xe); các loại xe ô tô chở người quy định cho giấy phép lái xe hạng D1 kéo rơ moóc có khối lượng toàn bộ theo thiết kế đến 750 kg; các loại xe quy định cho giấy phép lái xe các hạng B, C1, C;\n\nh) Hạng D2 cấp cho người lái xe ô tô chở người (kể cả xe buýt) trên 16 chỗ (không kể chỗ của người lái xe) đến 29 chỗ (không kể chỗ của người lái xe); các loại xe ô tô chở người quy định cho giấy phép lái xe hạng D2 kéo rơ moóc có khối lượng toàn bộ theo thiết kế đến 750 kg; các loại xe quy định cho giấy phép lái xe các hạng B, C1, C, D1;\n\ni) Hạng D cấp cho người lái xe ô tô chở người (kể cả xe buýt) trên 29 chỗ (không kể chỗ của người lái xe); xe ô tô chở người giường nằm; các loại xe ô tô chở người quy định cho giấy phép lái xe hạng D kéo rơ moóc có khối lượng toàn bộ theo thiết kế đến 750 kg; các loại xe quy định cho giấy phép lái xe các hạng B, C1, C, D1, D2;\n\nk) Hạng BE cấp cho người lái các loại xe ô tô quy định cho giấy phép lái xe hạng B kéo rơ moóc có khối lượng toàn bộ theo thiết kế trên 750 kg;\n\nl) Hạng C1E cấp cho người lái các loại xe ô tô quy định cho giấy phép lái xe hạng C1 kéo rơ moóc có khối lượng toàn bộ theo thiết kế trên 750 kg;\n\nm) Hạng CE cấp cho người lái các loại xe ô tô quy định cho giấy phép lái xe hạng C kéo rơ moóc có khối lượng toàn bộ theo thiết kế trên 750 kg; xe ô tô đầu kéo kéo sơ mi rơ moóc;\n\nn) Hạng D1E cấp cho người lái các loại xe ô tô quy định cho giấy phép lái xe hạng D1 kéo rơ moóc có khối lượng toàn bộ theo thiết kế trên 750 kg;\n\no) Hạng D2E cấp cho người lái các loại xe ô tô quy định cho giấy phép lái xe hạng D2 kéo rơ moóc có khối lượng toàn bộ theo thiết kế trên 750 kg;\n\np) Hạng DE cấp cho người lái các loại xe ô tô quy định cho giấy phép lái xe hạng D kéo rơ moóc có khối lượng toàn bộ theo thiết kế trên 750 kg; xe ô tô chở khách nối toa.\n\n2. Người khuyết tật điều khiển xe mô tô ba bánh dùng cho người khuyết tật được cấp giấy phép lái xe hạng A1.\n\nNgười khuyết tật điều khiển xe ô tô số tự động có kết cấu phù hợp với tình trạng khuyết tật thì được cấp giấy phép lái xe hạng B.\n\n3. Người điều khiển xe chở hàng bốn bánh có gắn động cơ, xe chở người bốn bánh có gắn động cơ phải sử dụng giấy phép lái xe có hạng phù hợp với xe ô tô tải hoặc xe ô tô chở người tương ứng.\n\n4. Người điều khiển xe ô tô có thiết kế, cải tạo với số chỗ ít hơn xe cùng loại, kích thước giới hạn tương đương phải sử dụng giấy phép lái xe có hạng phù hợp với xe ô tô cùng loại, kích thước giới hạn tương đương và có số chỗ nhiều nhất.\n\n5. Thời hạn của giấy phép lái xe được quy định như sau:\n\na) Giấy phép lái xe các hạng A1, A, B1 không thời hạn;\n\nb) Giấy phép lái xe hạng B và hạng C1 có thời hạn 10 năm kể từ ngày cấp;\n\nc) Giấy phép lái xe các hạng C, D1, D2, D, BE, C1E, CE, D1E, D2E và DE có thời hạn 05 năm kể từ ngày cấp.\n\n6. Giấy phép lái xe có giá trị sử dụng trong phạm vi lãnh thổ Việt Nam bao gồm:\n\na) Giấy phép lái xe do cơ quan có thẩm quyền của Việt Nam cấp;\n\nb) Giấy phép lái xe quốc tế và giấy phép lái xe quốc gia phù hợp với loại xe được phép điều khiển do quốc gia là thành viên của Công ước của Liên hợp quốc về Giao thông đường bộ năm 1968 (sau đây gọi là Công ước Viên) cấp;\n\nc) Giấy phép lái xe phù hợp với loại xe được phép điều khiển của nước hoặc vùng lãnh thổ mà Việt Nam ký kết điều ước quốc tế hoặc thỏa thuận quốc tế công nhận giấy phép lái xe của nhau;\n\nd) Giấy phép lái xe nước ngoài phù hợp với loại xe được phép điều khiển do quốc gia được công nhận theo điều ước quốc tế mà nước Cộng hòa xã hội chủ nghĩa Việt Nam là thành viên.\n\n7. Giấy phép lái xe không có hiệu lực trong các trường hợp sau đây:\n\na) Giấy phép lái xe hết thời hạn sử dụng;\n\nb) Giấy phép lái xe bị thu hồi theo quy định tại khoản 5 Điều 62 của Luật này.\n\n8. Giấy phép lái xe quốc tế được quy định như sau:\n\na) Giấy phép lái xe quốc tế là giấy phép lái xe do cơ quan nhà nước có thẩm quyền của quốc gia là thành viên của Công ước Viên cấp theo một mẫu thống nhất; có thời hạn không quá 03 năm kể từ ngày cấp và phải phù hợp với thời hạn còn hiệu lực của giấy phép lái xe quốc gia;', 'a) Giấy phép lái xe hết thời hạn sử dụng;\n\nb) Giấy phép lái xe bị thu hồi theo quy định tại khoản 5 Điều 62 của Luật này.\n\n8. Giấy phép lái xe quốc tế được quy định như sau:\n\na) Giấy phép lái xe quốc tế là giấy phép lái xe do cơ quan nhà nước có thẩm quyền của quốc gia là thành viên của Công ước Viên cấp theo một mẫu thống nhất; có thời hạn không quá 03 năm kể từ ngày cấp và phải phù hợp với thời hạn còn hiệu lực của giấy phép lái xe quốc gia;\n\nb) Người có giấy phép lái xe quốc tế do quốc gia là thành viên của Công ước Viên cấp khi lái xe tham gia giao thông đường bộ trên lãnh thổ Việt Nam phải mang theo giấy phép lái xe quốc tế và giấy phép lái xe quốc gia được cấp phù hợp với hạng xe điều khiển, còn thời hạn sử dụng; phải tuân thủ pháp luật về trật tự, an toàn giao thông đường bộ của Việt Nam;\n\nc) Người có giấy phép lái xe quốc tế vi phạm pháp luật về trật tự, an toàn giao thông đường bộ của Việt Nam mà bị tước quyền sử dụng giấy phép lái xe có thời hạn thì thời gian bị tước quyền sử dụng không quá thời gian người lái xe được phép cư trú tại lãnh thổ Việt Nam;\n\nd) Người Việt Nam hoặc người nước ngoài có thẻ thường trú hoặc thẻ tạm trú tại Việt Nam có giấy phép lái xe do Việt Nam hoặc quốc gia là thành viên của điều ước quốc tế mà nước Cộng hòa xã hội chủ nghĩa Việt Nam là thành viên cấp, còn giá trị sử dụng, nếu có nhu cầu được cấp giấy phép lái xe quốc tế.\n\n9. Bộ trưởng Bộ Giao thông vận tải quy định mẫu giấy phép lái xe và giấy phép lái xe quốc tế, trình tự, thủ tục cấp và việc sử dụng giấy phép lái xe, giấy phép lái xe quốc tế; đối với mẫu giấy phép lái xe, trình tự, thủ tục cấp và việc sử dụng giấy phép lái xe của lực lượng quân đội, công an làm nhiệm vụ quốc phòng, an ninh do Bộ trưởng Bộ Quốc phòng, Bộ trưởng Bộ Công an quy định.\n\nĐiều 58. Điểm của giấy phép lái xe \n\n1. Điểm của giấy phép lái xe được dùng để quản lý việc chấp hành pháp luật về trật tự, an toàn giao thông đường bộ của người lái xe trên hệ thống cơ sở dữ liệu về trật tự, an toàn giao thông đường bộ, bao gồm 12 điểm. Số điểm trừ mỗi lần vi phạm tùy thuộc tính chất, mức độ của hành vi vi phạm pháp luật về trật tự, an toàn giao thông đường bộ. Dữ liệu về điểm trừ giấy phép lái xe của người vi phạm sẽ được cập nhật vào hệ thống cơ sở dữ liệu ngay sau khi quyết định xử phạt có hiệu lực thi hành và thông báo cho người bị trừ điểm giấy phép lái xe biết.\n\n2. Giấy phép lái xe chưa bị trừ hết điểm và không bị trừ điểm trong thời hạn 12 tháng từ ngày bị trừ điểm gần nhất thì được phục hồi đủ 12 điểm.\n\n3. Trường hợp giấy phép lái xe bị trừ hết điểm thì người có giấy phép lái xe không được điều khiển phương tiện tham gia giao thông đường bộ theo giấy phép lái xe đó. Sau thời hạn ít nhất là 06 tháng kể từ ngày bị trừ hết điểm, người có giấy phép lái xe được tham gia kiểm tra nội dung kiến thức pháp luật về trật tự, an toàn giao thông đường bộ theo quy định tại khoản 7 Điều 61 của Luật này do lực lượng Cảnh sát giao thông tổ chức, có kết quả đạt yêu cầu thì được phục hồi đủ 12 điểm.\n\n4. Giấy phép lái xe sau khi đổi, cấp lại, nâng hạng được giữ nguyên số điểm của giấy phép lái xe trước khi đổi, cấp lại, nâng hạng.\n\n5. Người có thẩm quyền xử phạt vi phạm hành chính có thẩm quyền trừ điểm giấy phép lái xe.\n\n6. Chính phủ quy định chi tiết khoản 1 Điều này; quy định trình tự, thủ tục, thẩm quyền trừ điểm, phục hồi điểm giấy phép lái xe; quy định lộ trình thực hiện Điều này. Bộ trưởng Bộ Công an quy định chi tiết khoản 3 Điều này.\n\nĐiều 59. Tuổi, sức khỏe của người điều khiển phương tiện tham gia giao thông đường bộ\n\n1. Độ tuổi của người lái xe, người điều khiển xe máy chuyên dùng được quy định như sau:\n\na) Người đủ 16 tuổi trở lên được điều khiển xe gắn máy;\n\nb) Người đủ 18 tuổi trở lên được cấp giấy phép lái xe hạng A1, A, B1, B, C1, được cấp chứng chỉ bồi dưỡng kiến thức pháp luật về giao thông đường bộ để điều khiển xe máy chuyên dùng tham gia giao thông đường bộ;\n\nc) Người đủ 21 tuổi trở lên được cấp giấy phép lái xe hạng C, BE;\n\nd) Người đủ 24 tuổi trở lên được cấp giấy phép lái xe hạng D1, D2, C1E, CE;\n\nđ) Người đủ 27 tuổi trở lên được cấp giấy phép lái xe hạng D, D1E, D2E, DE;\n\ne) Tuổi tối đa của người lái xe ô tô chở người (kể cả xe buýt) trên 29 chỗ (không kể chỗ của người lái xe), xe ô tô chở người giường nằm là đủ 57 tuổi đối với nam, đủ 55 tuổi đối với nữ.\n\n2. Người điều khiển phương tiện tham gia giao thông đường bộ phải bảo đảm điều kiện sức khỏe phù hợp với từng loại phương tiện được phép điều khiển. Bộ trưởng Bộ Y tế quy định về tiêu chuẩn sức khỏe, việc khám sức khỏe đối với người lái xe, người điều khiển xe máy chuyên dùng; việc khám sức khỏe định kỳ đối với người hành nghề lái xe ô tô; xây dựng cơ sở dữ liệu về sức khỏe của người lái xe, người điều khiển xe máy chuyên dùng.\n\n3. Bộ trưởng Bộ Quốc phòng, Bộ trưởng Bộ Công an quy định độ tuổi của người lái xe trong lực lượng quân đội, công an làm nhiệm vụ quốc phòng, an ninh.\n\nĐiều 60. Đào tạo lái xe\n\n1. Người có nhu cầu được cấp giấy phép lái xe phải được đào tạo nội dung lý thuyết và thực hành theo chương trình đào tạo quy định cho từng hạng giấy phép lái xe.\n\n2. Người học lái xe phải được đào tạo tại các cơ sở đào tạo lái xe hoặc các hình thức đào tạo lái xe khác để cấp mới hoặc nâng hạng giấy phép lái xe.\n\n3. Việc đào tạo để nâng hạng giấy phép lái xe thực hiện đối với những đối tượng sau đây:\n\na) Nâng hạng giấy phép lái xe từ hạng B lên hạng C1 hoặc lên hạng C hoặc lên hạng D1 hoặc lên hạng D2;\n\nb) Nâng hạng giấy phép lái xe từ hạng C1 lên hạng C hoặc lên hạng D1 hoặc lên hạng D2;\n\nc) Nâng hạng giấy phép lái xe từ hạng C lên hạng D1 hoặc lên hạng D2 hoặc lên hạng D;\n\nd) Nâng hạng giấy phép lái xe từ hạng D1 lên hạng D2 hoặc lên hạng D;\n\nđ) Nâng hạng giấy phép lái xe từ hạng D2 lên hạng D;\n\ne) Nâng hạng giấy phép lái xe từ hạng B lên hạng BE, từ hạng C1 lên\xa0 hạng C1E, từ hạng C lên hạng CE, từ hạng D1 lên hạng D1E, từ hạng D2 lên hạng D2E, từ hạng D lên hạng DE.\n\n4.\xa0Người có nhu cầu được đào tạo nâng hạng giấy phép lái xe khi giấy phép lái xe còn hiệu lực, phải có đủ thời gian lái xe an toàn quy định cho từng hạng giấy phép lái xe;\xa0đối với việc nâng hạng giấy phép lái xe lên hạng D1, D2, D thì người có nhu cầu được đào tạo còn phải có trình độ từ trung học cơ sở trở lên.\n\n5. Giấy phép lái xe các hạng C, D1, D2, D, BE, C1E, CE, D1E, D2E, DE phải được đào tạo bằng hình thức đào tạo nâng hạng theo các điều kiện quy định tại khoản 3 và khoản 4 Điều này.\n\n6. Cơ sở đào tạo lái xe ô tô phải đáp ứng các điều kiện do Chính phủ quy định; có giáo trình, giáo án; thực hiện đào tạo theo đúng hình thức, nội dung và chương trình quy định cho từng hạng giấy phép lái xe.\n\n7. Chính phủ quy định chi tiết các hình thức đào tạo lái xe khác quy định tại khoản 2 Điều này; quy định trình tự, thủ tục kiểm tra, đánh giá để cấp, cấp lại và thu hồi giấy phép xe tập lái; quy định tiêu chuẩn của giáo viên dạy lái xe; quy định việc cấp, cấp lại và thu hồi giấy chứng nhận giáo viên dạy lái xe; quy định việc cấp, cấp lại và thu hồi giấy phép đào tạo lái xe.\n\n8. Bộ trưởng Bộ Giao thông vận tải quy định hình thức, nội dung, chương trình đào tạo lái xe, thời gian lái xe an toàn cho từng hạng giấy phép lái xe quy định tại khoản 4 Điều này và quy định tiêu chuẩn của cơ sở đào tạo lái xe mô tô; đối với cơ sở đào tạo, tổ chức đào tạo lái xe cho lực lượng quân đội, công an làm nhiệm vụ quốc phòng, an ninh do Bộ trưởng Bộ Quốc phòng, Bộ trưởng Bộ Công an quy định.\n\nĐiều 61. Sát hạch lái xe\n\n1. Người đã hoàn thành chương trình đào tạo lái xe, có độ tuổi, sức khỏe theo quy định tại Điều 59 của Luật này được đăng ký để tham dự kỳ sát hạch lái xe.\n\n2. Nội dung sát hạch lái xe phải phù hợp với hạng giấy phép lái xe và chương trình đào tạo lái xe.\n\n3. Hoạt động sát hạch lái xe ô tô phải thực hiện tại các trung tâm sát hạch lái xe; hoạt động sát hạch lái xe mô tô thực hiện tại các trung tâm sát hạch lái xe hoặc tại sân tập lái đáp ứng điều kiện, tiêu chuẩn về cơ sở vật chất, kỹ thuật. Hoạt động sát hạch lái xe do cơ quan nhà nước có thẩm quyền thực hiện.', 'khí, khí tài quân sự dạng rơ moóc có khối lượng toàn bộ theo thiết kế đến 750 kg; các loại xe quy định cho Giấy phép lái xe quân sự hạng B, C1, C, D1;\n\ni) Hạng D cấp cho người điều khiển xe ô tô chở người từ trên 29 chỗ (không kể chỗ của người lái xe); các loại xe ô tô chở người quy định cho Giấy phép lái xe hạng D kéo rơ moóc hoặc vũ khí, khí tài quân sự dạng rơ moóc có khối lượng toàn bộ theo thiết kế đến 750 kg; các loại xe quy định cho Giấy phép lái xe quân sự hạng B, C1, C, D1, D2;\n\nk) Hạng C1E cấp cho người điều khiển các loại xe ô tô quy định cho Giấy phép lái xe hạng C1 kéo rơ moóc hoặc vũ khí, khí tài quân sự dạng rơ moóc có khối lượng toàn bộ theo thiết kế trên 750 kg;\n\nl) Hạng CE cấp cho người điều khiển các loại xe ô tô quy định cho Giấy phép lái xe hạng C kéo rơ moóc hoặc vũ khí, khí tài quân sự dạng rơ moóc có khối lượng toàn bộ theo thiết kế trên 750 kg; xe ô tô đầu kéo kéo sơ mi rơ moóc hoặc khí tài quân sự dạng sơ mi rơ moóc;\n\nm) Hạng CX cấp cho người đã có Giấy phép lái xe quân sự hạng C để điều khiển xe xích kéo vũ khí, khí tài quân sự.\n\n2. Người điều khiển xe chở hàng bốn bánh có gắn động cơ, xe chở người bốn bánh có gắn động cơ phải sử dụng giấy phép lái xe có hạng phù hợp với xe ô tô tải và ô tô chở người tương ứng.\n\n3. Người điều khiển xe ô tô có thiết kế, cải tạo với số chỗ ngồi ít hơn ô tô cùng loại, kích thước giới hạn tương đương phải sử dụng giấy phép lái xe có hạng phù hợp với ô tô cùng loại, kích thước giới hạn tương đương và có số chỗ ngồi nhiều nhất.\n\nĐiều 6. Mẫu và thời hạn Giấy phép lái xe quân sự\n\n1. Mẫu Giấy phép lái xe quân sự\n\na) Giấy phép lái xe quân sự thực hiện theo quy định tại Mẫu số 08 kèm theo Thông tư này;\n\nb) Cục trưởng Cục Xe máy - Vận tải/Tổng cục Hậu cần - Kỹ thuật có trách nhiệm quản lý việc sử dụng Giấy phép lái xe quân sự thuộc phạm vi quản lý của Bộ Quốc phòng.\n\n2. Thời hạn sử dụng Giấy phép lái xe quân sự\n\na) Giấy phép lái xe quân sự hạng A1, A, B1 là không thời hạn;\n\nb) Giấy phép lái xe quân sự các hạng B, C1, C, D1, D2, D, C1E, CE, CX có thời hạn 05 năm kể từ ngày cấp;\n\nc) Trường hợp cấp, đổi do lý do khác thời hạn theo thời hạn ghi trên Giấy phép lái xe quân sự.\n\n3. Giấy phép lái xe quân sự không có hiệu lực trong các trường hợp sau:\n\na) Giấy phép lái xe quân sự hết thời hạn sử dụng được ghi trên Giấy phép lái xe;\n\nb) Giấy phép lái xe quân sự bị trừ hết điểm theo quy định tại Điều 7 của Thông tư này;\n\nc) Giấy phép lái xe quân sự có Quyết định thu hồi theo khoản 1 Điều 47 Thông tư này.\n\nĐiều 7. Điểm của Giấy phép lái xe quân sự\n\n1. Điểm của Giấy phép lái xe quân sự gồm 12 điểm theo quy định của Luật Trật tự, an toàn giao thông đường bộ, được dùng để quản lý việc chấp hành pháp luật về trật tự, an toàn giao thông đường bộ của người lái xe. Số điểm trừ mỗi lần tùy theo tính chất, mức độ vi phạm theo quy định của pháp luật. Giấy phép lái xe chưa bị trừ hết điểm và không bị trừ điểm trong thời hạn 12 tháng kể từ ngày bị trừ điểm gần nhất thì được phục hồi đủ 12 điểm.\n\n2. Trường hợp Giấy phép lái xe quân sự bị trừ hết điểm, sau thời hạn ít nhất 06 tháng kể từ ngày bị trừ hết điểm, người có Giấy phép lái xe quân sự bị trừ hết điểm được tham gia kiểm tra kiến thức pháp luật về giao thông đường bộ tổ chức tại cơ sở đào tạo lái xe quân sự theo quy định tại điểm a khoản 1 Điều 40 và khoản 1 Điều 41 Thông tư này, nếu kết quả đặt yêu cầu được phục hồi đủ 12 điểm.\n\n3. Điểm của Giấy phép lái xe quân sự đổi, cấp lại, đào tạo nâng hạng được giữ nguyên như trước khi đổi, cấp lại, đào tạo nâng hạng.\n\nĐiều 8. Độ tuổi của người được cấp Giấy phép lái xe quân sự\n\n1. Quân nhân, công chức quốc phòng, công nhân viên chức quốc phòng, lao động hợp đồng đang phục vụ trong Bộ Quốc phòng đủ 18 tuổi trở lên được cấp Giấy phép lái xe quân sự hạng A1, A, B1, B, C1, C.\n\n2. Quân nhân, công chức quốc phòng, công nhân viên chức quốc phòng, lao động hợp đồng đang phục vụ trong Bộ Quốc phòng đủ 24 tuổi trở lên được cấp Giấy phép lái xe quân sự hạng D1, D2, C1E, CE, CX.\n\nCác trường hợp đào tạo chuyển tiếp từ hạng C lên hạng CE hoặc CX theo chỉ tiêu của Bộ Tổng Tham mưu, đủ 19 tuổi trở lên.\n\n3. Quân nhân, công chức quốc phòng, công nhân viên chức quốc phòng, lao động hợp đồng đang phục vụ trong Bộ Quốc phòng đủ 27 tuổi trở lên được cấp Giấy phép lái xe quân sự hạng D. Độ tuổi tối đa của người được cấp Giấy phép lái xe quân sự hạng D là đủ 57 tuổi đối với nam và đủ 55 tuổi đối với nữ.\n\nChương II\n\nĐÀO TẠO LÁI XE QUÂN SỰ\n\nMục I. NGƯỜI HỌC\n\nĐiều 9. Điều kiện đối với người học lái xe quân sự\n\n1. Quân nhân, công chức quốc phòng, công nhân viên chức quốc phòng, lao động hợp đồng đang phục vụ trong Bộ Quốc phòng có đủ các điều kiện: Tiêu chuẩn về tuổi đời, thời gian công tác, sức khỏe, trình độ văn hóa, phẩm chất chính trị theo quy định của Bộ Quốc phòng.\n\nĐối với lao động hợp đồng: Chỉ đào tạo nâng hạng khi có đủ điều kiện, tiêu chuẩn quy định tại khoản 1 Điều này.\n\n2. Đối với người học nâng hạng Giấy phép lái xe quân sự phải có thời gian lái xe và số km lái xe an toàn như sau:\n\na) Từ hạng B lên hạng C1; hạng C1 lên hạng C, C1E; hạng C lên hạng D1, CE, CX; hạng D1 lên hạng D2; hạng D2 lên hạng D: Có thời gian lái xe 02 năm trở lên và 30.000 km lái xe an toàn trở lên (trừ các trường hợp đào tạo chuyển tiếp từ hạng C lên hạng CE hoặc CX theo chỉ tiêu của Bộ Tổng Tham mưu);\n\nb) Từ hạng B lên hạng C, D1; hạng C1 lên D1; hạng C lên hạng D2; hạng D1 lên hạng D: Có thời gian lái xe 03 năm trở lên và có 50.000 km lái xe an toàn trở lên;\n\nc) Từ hạng B lên hạng D2, từ hạng C1 lên hạng D2, từ hạng C lên hạng D: Có thời gian lái xe 05 năm trở lên và 100.000 km lái xe an toàn trở lên.\n\n3. Đối với người học nâng hạng Giấy phép lái xe quân sự lên hạng D1, D2, D ngoài các quy định tại các khoản 1, 2 Điều này phải có bằng tốt nghiệp trung học cơ sở trở lên.\n\nĐiều 10. Hồ sơ đào tạo lái xe\n\n1. Hạng A1, A, gồm:\n\na) Kế hoạch huấn luyện lái xe mô tô quân sự hạng A1, A (kèm theo danh sách học viên) của cơ quan, đơn vị theo quy định tại Mẫu số 13 Phụ lục I kèm theo Thông tư này;\n\nb) Đơn đề nghị học và sát hạch, cấp Giấy phép lái xe quân sự của cá nhân có xác nhận của Thủ trưởng cơ quan, đơn vị trực tiếp quản lý từ cấp trung đoàn hoặc tương đương trở lên theo quy định tại Mẫu số 01 Phụ lục I kèm theo Thông tư này;\n\nc) Bản sao Căn cước công dân (căn cước) và bản sao một trong các loại giấy tờ sau: Giấy chứng minh quân nhân, công chức quốc phòng, công nhân và viên chức quốc phòng, quyết định nhập ngũ, tuyển dụng, phiếu quân nhân, thẻ học viên, quyết định thăng, phong quân hàm, nâng lương gần nhất còn hiệu lực;\n\nd) Giấy chứng nhận sức khỏe theo quy định do quân y cấp trung đoàn và tương đương trở lên xác nhận theo quy định tại Mẫu số 02 Phụ lục I kèm theo Thông tư này;\n\nđ) Hai ảnh màu cỡ 2 x 3 cm (ảnh chụp trên nền màu xanh; quân nhân mặc quân phục thường dùng; công chức quốc phòng, công nhân và viên chức quốc phòng, lao động hợp đồng mặc đồng phục; đeo biển tên theo quy định, không đội mũ).\n\n2. Hạng B1, B, C1, C, gồm:\n\na) Kế hoạch đào tạo lái xe quân sự hạng B1, B, C1, C (kèm theo danh sách học viên) của cơ sở đào tạo;\n\nb) Bản sao quyết định giao chỉ tiêu đào tạo nhân viên kỹ thuật sơ cấp của Tổng Tham mưu trưởng đối với trường hợp đào tạo theo chỉ tiêu nhiệm vụ; văn bản đề nghị đào tạo lái xe của Thủ trưởng cơ quan, đơn vị đầu mối trực thuộc Bộ Quốc phòng đối với trường hợp gửi đào tạo;\n\nc) Hồ sơ quy định tại các điểm b, c, d, đ khoản 1 Điều này;\n\n3. Đào tạo nâng hạng Giấy phép lái xe quân sự\n\nNgoài hồ sơ quy định tại khoản 2 Điều này phải bổ sung các giấy tờ như sau:\n\na) Bản khai thời gian lái xe và số km lái xe an toàn quy định cho từng hạng xe có xác nhận của Thủ trưởng cơ quan, đơn vị trực tiếp quản lý từ cấp trung đoàn hoặc tương đương trở lên theo quy định tại Mẫu số 03 Phụ lục I kèm theo Thông tư này;\n\nb) Bản sao Giấy phép lái xe quân sự đang sử dụng.\n\nMục II. CƠ SỞ ĐÀO TẠO LÁI XE QUÂN SỰ\n\nĐiều 11. Nhiệm vụ của cơ sở đào tạo lái xe quân sự']","**Nguồn văn bản:** /content/drive/MyDrive/ITProject_data/new_law/36_2024_QH15_444251.docx

**Tên văn bản:** (Không có tiêu đề trong metadata)

**(Không có điều khoản trong metadata):**

**Nội dung:**

5. Thời hạn của giấy phép lái xe được quy định như sau:

	a) Giấy phép lái xe các hạng A1, A, B1 không thời hạn.

	b) Giấy phép lái xe hạng B và hạng C1 có thời hạn 10 năm kể từ ngày cấp.

	c) Giấy phép lái xe các hạng C, D1, D2, D, BE, C1E, CE, D1E, D2E và DE có thời hạn 05 năm kể từ ngày cấp.


**Tóm lại:** Thời hạn của giấy phép lái xe hạng D là 05 năm kể từ ngày cấp.
",Giấy phép lái xe hạng D có thời hạn 5 năm kể từ ngày cấp.,1.0,0.9182076287423495,1.0,0.8333333332916666
5,Giấy phép lái xe hạng BE cho phép lái những loại xe nào?,"['a) Chứng nhận đăng ký xe hoặc bản sao Chứng nhận đăng ký xe có chứng thực kèm bản gốc giấy tờ xác nhận của tổ chức tín dụng, chi nhánh ngân hàng nước ngoài còn hiệu lực trong trường hợp xe đang được thế chấp tại tổ chức tín dụng, chi nhánh ngân hàng nước ngoài;\n\nb) Giấy phép lái xe phù hợp với loại xe đang điều khiển;\n\nc) Chứng nhận kiểm định an toàn kỹ thuật và bảo vệ môi trường đối với xe cơ giới theo quy định của pháp luật;\n\nd) Chứng nhận bảo hiểm bắt buộc trách nhiệm dân sự của chủ xe cơ giới.\n\n2. Người điều khiển xe máy chuyên dùng tham gia giao thông đường bộ phải đủ tuổi, sức khỏe theo quy định của pháp luật; có bằng hoặc chứng chỉ điều khiển xe máy chuyên dùng phù hợp loại xe máy chuyên dùng đang điều khiển; có giấy phép lái xe đang còn điểm, còn hiệu lực hoặc chứng chỉ bồi dưỡng kiến thức pháp luật về giao thông đường bộ. Khi tham gia giao thông đường bộ, người điều khiển xe máy chuyên dùng phải mang theo các loại giấy tờ sau đây:\n\na) Chứng nhận đăng ký xe hoặc bản sao Chứng nhận đăng ký xe có chứng thực kèm bản gốc Giấy biên nhận còn hiệu lực của tổ chức tín dụng, chi nhánh ngân hàng nước ngoài trong trường hợp xe đang được thế chấp tại tổ chức tín dụng, chi nhánh ngân hàng nước ngoài;\n\nb) Bằng hoặc chứng chỉ điều khiển xe máy chuyên dùng;\n\nc) Giấy phép lái xe hoặc chứng chỉ bồi dưỡng kiến thức pháp luật về giao thông đường bộ;\n\nd) Chứng nhận kiểm định an toàn kỹ thuật và bảo vệ môi trường đối với xe máy chuyên dùng theo quy định của pháp luật;\n\nđ) Chứng nhận bảo hiểm bắt buộc trách nhiệm dân sự theo quy định của pháp luật.\n\n3. Trường hợp giấy tờ quy định tại khoản 1 và khoản 2 Điều này đã được tích hợp vào tài khoản định danh điện tử thì việc xuất trình, kiểm tra có thể thực hiện thông qua tài khoản định danh điện tử.\n\n4. Người lái xe gắn máy tham gia giao thông đường bộ phải hiểu biết quy tắc giao thông đường bộ, có kỹ năng điều khiển phương tiện; đủ điều kiện về độ tuổi, sức khỏe theo quy định tại điểm a khoản 1 và khoản 2 Điều 59 của Luật này.\n\n5. Người tập lái xe ô tô, người dự sát hạch lái xe ô tô khi tham gia giao thông đường bộ phải thực hành trên xe tập lái, xe sát hạch trên tuyến đường tập lái, tuyến đường sát hạch, có giáo viên dạy lái hoặc sát hạch viên bảo trợ tay lái. Giáo viên dạy lái, sát hạch viên phải mang theo các loại giấy tờ quy định tại khoản 1 Điều này.\n\nĐiều 57. Giấy phép lái xe\n\n1. Giấy phép lái xe bao gồm các hạng sau đây:\n\na) Hạng A1 cấp cho người lái xe mô tô hai bánh có dung tích xi-lanh đến 125 cm3 hoặc có công suất động cơ điện đến 11 kW;\n\nb) Hạng A cấp cho người lái xe mô tô hai bánh có dung tích xi-lanh\xa0 trên 125 cm3\xa0hoặc có công suất động cơ điện trên 11 kW và các loại xe quy định cho giấy phép lái xe hạng A1;\n\nc) Hạng B1 cấp cho người lái xe mô tô ba bánh và các loại xe quy định cho giấy phép lái xe hạng A1;\n\nd) Hạng B cấp cho người lái xe ô tô chở người đến 08 chỗ (không kể chỗ của người lái xe); xe ô tô tải và ô tô chuyên dùng có khối lượng toàn bộ theo thiết kế đến 3.500 kg; các loại xe ô tô quy định cho giấy phép lái xe hạng B kéo rơ moóc có khối lượng toàn bộ theo thiết kế đến 750 kg; \n\nđ) Hạng C1 cấp cho người lái xe ô tô tải và ô tô chuyên dùng có khối lượng toàn bộ theo thiết kế trên 3.500 kg đến 7.500 kg; các loại xe ô tô tải quy định cho giấy phép lái xe hạng C1 kéo rơ moóc có khối lượng toàn bộ theo thiết kế đến 750 kg; các loại xe quy định cho giấy phép lái xe hạng B;\n\ne) Hạng C cấp cho người lái xe ô tô tải và ô tô chuyên dùng có khối lượng toàn bộ theo thiết kế trên 7.500 kg; các loại xe ô tô tải quy định cho giấy phép lái xe hạng C kéo rơ moóc có khối lượng toàn bộ theo thiết kế đến 750 kg; các loại xe quy định cho giấy phép lái xe hạng B và hạng C1;\n\ng) Hạng D1 cấp cho người lái xe ô tô chở người trên 08 chỗ (không kể chỗ của người lái xe) đến 16 chỗ (không kể chỗ của người lái xe); các loại xe ô tô chở người quy định cho giấy phép lái xe hạng D1 kéo rơ moóc có khối lượng toàn bộ theo thiết kế đến 750 kg; các loại xe quy định cho giấy phép lái xe các hạng B, C1, C;\n\nh) Hạng D2 cấp cho người lái xe ô tô chở người (kể cả xe buýt) trên 16 chỗ (không kể chỗ của người lái xe) đến 29 chỗ (không kể chỗ của người lái xe); các loại xe ô tô chở người quy định cho giấy phép lái xe hạng D2 kéo rơ moóc có khối lượng toàn bộ theo thiết kế đến 750 kg; các loại xe quy định cho giấy phép lái xe các hạng B, C1, C, D1;\n\ni) Hạng D cấp cho người lái xe ô tô chở người (kể cả xe buýt) trên 29 chỗ (không kể chỗ của người lái xe); xe ô tô chở người giường nằm; các loại xe ô tô chở người quy định cho giấy phép lái xe hạng D kéo rơ moóc có khối lượng toàn bộ theo thiết kế đến 750 kg; các loại xe quy định cho giấy phép lái xe các hạng B, C1, C, D1, D2;\n\nk) Hạng BE cấp cho người lái các loại xe ô tô quy định cho giấy phép lái xe hạng B kéo rơ moóc có khối lượng toàn bộ theo thiết kế trên 750 kg;\n\nl) Hạng C1E cấp cho người lái các loại xe ô tô quy định cho giấy phép lái xe hạng C1 kéo rơ moóc có khối lượng toàn bộ theo thiết kế trên 750 kg;\n\nm) Hạng CE cấp cho người lái các loại xe ô tô quy định cho giấy phép lái xe hạng C kéo rơ moóc có khối lượng toàn bộ theo thiết kế trên 750 kg; xe ô tô đầu kéo kéo sơ mi rơ moóc;\n\nn) Hạng D1E cấp cho người lái các loại xe ô tô quy định cho giấy phép lái xe hạng D1 kéo rơ moóc có khối lượng toàn bộ theo thiết kế trên 750 kg;\n\no) Hạng D2E cấp cho người lái các loại xe ô tô quy định cho giấy phép lái xe hạng D2 kéo rơ moóc có khối lượng toàn bộ theo thiết kế trên 750 kg;\n\np) Hạng DE cấp cho người lái các loại xe ô tô quy định cho giấy phép lái xe hạng D kéo rơ moóc có khối lượng toàn bộ theo thiết kế trên 750 kg; xe ô tô chở khách nối toa.\n\n2. Người khuyết tật điều khiển xe mô tô ba bánh dùng cho người khuyết tật được cấp giấy phép lái xe hạng A1.\n\nNgười khuyết tật điều khiển xe ô tô số tự động có kết cấu phù hợp với tình trạng khuyết tật thì được cấp giấy phép lái xe hạng B.\n\n3. Người điều khiển xe chở hàng bốn bánh có gắn động cơ, xe chở người bốn bánh có gắn động cơ phải sử dụng giấy phép lái xe có hạng phù hợp với xe ô tô tải hoặc xe ô tô chở người tương ứng.\n\n4. Người điều khiển xe ô tô có thiết kế, cải tạo với số chỗ ít hơn xe cùng loại, kích thước giới hạn tương đương phải sử dụng giấy phép lái xe có hạng phù hợp với xe ô tô cùng loại, kích thước giới hạn tương đương và có số chỗ nhiều nhất.\n\n5. Thời hạn của giấy phép lái xe được quy định như sau:\n\na) Giấy phép lái xe các hạng A1, A, B1 không thời hạn;\n\nb) Giấy phép lái xe hạng B và hạng C1 có thời hạn 10 năm kể từ ngày cấp;\n\nc) Giấy phép lái xe các hạng C, D1, D2, D, BE, C1E, CE, D1E, D2E và DE có thời hạn 05 năm kể từ ngày cấp.\n\n6. Giấy phép lái xe có giá trị sử dụng trong phạm vi lãnh thổ Việt Nam bao gồm:\n\na) Giấy phép lái xe do cơ quan có thẩm quyền của Việt Nam cấp;\n\nb) Giấy phép lái xe quốc tế và giấy phép lái xe quốc gia phù hợp với loại xe được phép điều khiển do quốc gia là thành viên của Công ước của Liên hợp quốc về Giao thông đường bộ năm 1968 (sau đây gọi là Công ước Viên) cấp;\n\nc) Giấy phép lái xe phù hợp với loại xe được phép điều khiển của nước hoặc vùng lãnh thổ mà Việt Nam ký kết điều ước quốc tế hoặc thỏa thuận quốc tế công nhận giấy phép lái xe của nhau;\n\nd) Giấy phép lái xe nước ngoài phù hợp với loại xe được phép điều khiển do quốc gia được công nhận theo điều ước quốc tế mà nước Cộng hòa xã hội chủ nghĩa Việt Nam là thành viên.\n\n7. Giấy phép lái xe không có hiệu lực trong các trường hợp sau đây:\n\na) Giấy phép lái xe hết thời hạn sử dụng;\n\nb) Giấy phép lái xe bị thu hồi theo quy định tại khoản 5 Điều 62 của Luật này.\n\n8. Giấy phép lái xe quốc tế được quy định như sau:\n\na) Giấy phép lái xe quốc tế là giấy phép lái xe do cơ quan nhà nước có thẩm quyền của quốc gia là thành viên của Công ước Viên cấp theo một mẫu thống nhất; có thời hạn không quá 03 năm kể từ ngày cấp và phải phù hợp với thời hạn còn hiệu lực của giấy phép lái xe quốc gia;', '8. Ủy ban nhân dân các cấp, trong phạm vi nhiệm vụ, quyền hạn của mình, thực hiện quản lý nhà nước về trật tự, an toàn giao thông đường bộ tại địa phương.\n\nChương IX\n\nĐIỀU KHOẢN THI HÀNH\n\nĐiều 88. Hiệu lực thi hành\n\n1. Luật này có hiệu lực thi hành từ ngày 01 tháng 01 năm 2025, trừ trường hợp quy định tại khoản 2 Điều này.\n\n2. Khoản 3 Điều 10 của Luật này có hiệu lực thi hành từ ngày 01 tháng 01 năm 2026.\n\n3. Luật Giao thông đường bộ số 23/2008/QH12 đã được sửa đổi, bổ sung một số điều theo Luật số 35/2018/QH14 và Luật số 44/2019/QH14 hết hiệu lực kể từ ngày Luật này có hiệu lực thi hành, trừ trường hợp quy định tại các khoản 1, 2, 5 và 6 Điều 89 của Luật này.\n\n4. Nghị quyết số 73/2022/QH15 của Quốc hội về thí điểm đấu giá biển số xe ô tô hết hiệu lực kể từ ngày Luật này có hiệu lực thi hành, trừ trường hợp quy định tại khoản 7 Điều 89 của Luật này.\n\nĐiều 89. Quy định chuyển tiếp\n\n1. Giấy phép lái xe được cấp trước ngày Luật này có hiệu lực thi hành được tiếp tục sử dụng theo thời hạn ghi trên giấy phép lái xe. \n\n2. Giấy phép lái xe được cấp trước ngày Luật này có hiệu lực thi hành nếu chưa thực hiện đổi, cấp lại theo quy định của Luật này có hiệu lực sử dụng như sau:\n\na) Giấy phép lái xe hạng A1 được tiếp tục điều khiển xe mô tô hai bánh có dung tích xi-lanh từ 50 cm3\xa0đến dưới 175 cm3 hoặc có công suất động cơ điện từ 04 kW đến dưới 14 kW;\n\nb) Giấy phép lái xe hạng A2 được tiếp tục điều khiển xe mô tô hai bánh có dung tích xi-lanh từ 175 cm3\xa0trở lên hoặc có công suất động cơ điện từ 14 kW trở lên và các loại xe quy định cho giấy phép lái xe hạng A1 quy định tại điểm a khoản này;\n\nc) Giấy phép lái xe hạng A3 được tiếp tục điều khiển xe mô tô ba bánh, các loại xe quy định cho giấy phép lái xe hạng A1 quy định tại điểm a khoản này và các xe tương tự;\n\nd) Giấy phép lái xe hạng A4 được tiếp tục điều khiển máy kéo có trọng tải đến 1.000 kg;\n\nđ) Giấy phép lái xe hạng B1 số tự động cấp cho người không hành nghề lái xe được tiếp tục điều khiển xe ô tô số tự động chở người đến 08 chỗ (không kể chỗ của người lái xe); xe ô tô tải, kể cả ô tô tải chuyên dùng số tự động có trọng tải dưới 3.500 kg;\n\ne) Giấy phép lái xe hạng B1 cấp cho người không hành nghề lái xe được tiếp tục điều khiển xe ô tô chở người đến 08 chỗ (không kể chỗ của người lái xe); xe ô tô tải, máy kéo có trọng tải dưới 3.500 kg;\n\ng) Giấy phép lái xe hạng B2 cấp cho người hành nghề lái xe được tiếp tục điều khiển xe ô tô chở người đến 08 chỗ (không kể chỗ của người lái xe); xe ô tô tải, máy kéo có trọng tải dưới 3.500 kg;\n\nh) Giấy phép lái xe hạng C được tiếp tục điều khiển xe ô tô tải, máy kéo có trọng tải từ 3.500 kg trở lên và các loại xe quy định cho các giấy phép lái xe hạng B1, B2 quy định tại các điểm đ, e và g khoản này;\n\ni) Giấy phép lái xe hạng D được tiếp tục điều khiển xe ô tô chở người từ 09 chỗ (không kể chỗ của người lái xe) đến 29 chỗ (không kể chỗ của người lái xe) và các loại xe quy định cho các giấy phép lái xe hạng B1, B2, C quy định tại các điểm đ, e, g và h khoản này;\n\nk) Giấy phép lái xe hạng E được tiếp tục điều khiển xe ô tô chở người trên 29 chỗ (không kể chỗ của người lái xe) và các loại xe quy định cho các giấy phép lái xe hạng B1, B2, C, D quy định tại các điểm đ, e, g, h và i khoản này;\n\nl) Giấy phép lái xe hạng FB2, FD được tiếp tục điều khiển các loại xe quy định cho giấy phép lái xe hạng B2, D quy định tại điểm g và điểm i khoản này khi kéo rơ moóc; giấy phép lái xe hạng FC được tiếp tục điều khiển các loại xe quy định cho giấy phép lái xe hạng C quy định tại điểm h khoản này khi kéo rơ moóc, đầu kéo kéo sơ mi rơ moóc; giấy phép lái xe hạng FE được tiếp tục điều khiển các loại xe quy định cho giấy phép lái xe hạng E quy định tại điểm k khoản này khi kéo rơ moóc\xa0hoặc xe ô tô chở khách nối toa.\n\n3. Trường hợp người có giấy phép lái xe đã được cấp trước ngày Luật này có hiệu lực thi hành có nhu cầu đổi, cấp lại giấy phép lái xe thì thực hiện như sau:\n\na) Giấy phép lái xe hạng A1 được đổi, cấp lại sang giấy phép lái xe hạng A với điều kiện hạn chế là chỉ được điều khiển xe mô tô hai bánh có dung tích xi-lanh đến dưới 175 cm3 hoặc có công suất động cơ điện đến dưới 14 kW;\n\nb) Giấy phép lái xe hạng A2 được đổi, cấp lại sang giấy phép lái xe hạng A;\n\nc) Giấy phép lái xe hạng A3 được đổi, cấp lại sang giấy phép lái xe hạng B1;\n\nd) Giấy phép lái xe hạng A4 được đổi, cấp lại sang chứng chỉ điều khiển xe máy chuyên dùng cho người điều khiển máy kéo có trọng tải đến 1.000 kg và chứng chỉ bồi dưỡng kiến thức pháp luật về giao thông đường bộ cho người điều khiển xe máy chuyên dùng;\n\nđ) Giấy phép lái xe hạng B1 số tự động được đổi, cấp lại sang giấy phép lái xe hạng B với điều kiện hạn chế là chỉ được điều khiển xe ô tô số tự động;\n\ne) Giấy phép lái xe hạng B1, B2 được đổi, cấp lại sang giấy phép lái xe hạng B hoặc hạng C1 và chứng chỉ điều khiển xe máy chuyên dùng cho người điều khiển máy kéo có trọng tải đến 3.500 kg;\n\ng) Giấy phép lái xe hạng C giữ nguyên và đổi, cấp lại cùng hạng và chứng chỉ điều khiển xe máy chuyên dùng cho người điều khiển máy kéo có trọng tải trên 3.500 kg;\n\nh) Giấy phép lái xe hạng D được đổi, cấp lại sang giấy phép lái xe hạng D2 và chứng chỉ điều khiển xe máy chuyên dùng cho người điều khiển máy kéo có trọng tải trên 3.500 kg;\n\ni) Giấy phép lái xe hạng E được đổi, cấp lại sang giấy phép lái xe hạng D và chứng chỉ điều khiển xe máy chuyên dùng cho người điều khiển máy kéo có trọng tải trên 3.500 kg;\n\nk) Giấy phép lái xe hạng FB2 được đổi, cấp lại sang giấy phép lái xe hạng BE hoặc hạng C1E và chứng chỉ điều khiển xe máy chuyên dùng cho người điều khiển máy kéo có trọng tải đến 3.500 kg;\n\nl) Giấy phép lái xe hạng FC được đổi, cấp lại sang giấy phép lái xe hạng CE và chứng chỉ điều khiển xe máy chuyên dùng cho người điều khiển máy kéo có trọng tải trên 3.500 kg;\n\nm) Giấy phép lái xe hạng FD được đổi, cấp lại sang giấy phép lái xe hạng D2E và chứng chỉ điều khiển xe máy chuyên dùng cho người điều khiển máy kéo có trọng tải trên 3.500 kg;\n\nn) Giấy phép lái xe hạng FE được đổi, cấp lại sang giấy phép lái xe hạng DE và chứng chỉ điều khiển xe máy chuyên dùng cho người điều khiển máy kéo có trọng tải trên 3.500 kg.\n\n4. Người học lái xe đã được đào tạo lái xe trước ngày Luật này có hiệu lực thi hành hoặc đang được đào tạo lái xe tại ngày Luật này có hiệu lực thi hành chưa được sát hạch, cấp giấy phép lái xe thì được sát hạch, cấp giấy phép lái xe theo hạng giấy phép lái xe đổi, cấp lại quy định tại khoản 3 Điều này.\n\n5. Chứng nhận đăng ký xe, biển số xe máy chuyên dùng cấp trước ngày Luật này có hiệu lực thi hành vẫn có giá trị sử dụng.\n\n6. Chứng nhận chất lượng an toàn kỹ thuật và bảo vệ môi trường được cấp trước ngày Luật này có hiệu lực thi hành thì có giá trị sử dụng đến hết thời hạn ghi trên giấy chứng nhận đó.\n\n7. Việc đấu giá biển số xe ô tô được thực hiện trước ngày Luật này có hiệu lực thi hành và đến ngày Luật này có hiệu lực thi hành đã được cấp văn bản xác nhận biển số xe ô tô trúng đấu giá thì tiếp tục thực hiện theo Nghị quyết số 73/2022/QH15 của Quốc hội về thí điểm đấu giá biển số xe ô tô; trường hợp chưa được cấp xác nhận biển số xe ô tô trúng đấu giá thì tiếp tục thực hiện theo Nghị quyết số 73/2022/QH15 của Quốc hội về thí điểm đấu giá biển số xe ô tô và quy định tại điểm d khoản 1 Điều 38 của Luật này./.\n\nLuật này được Quốc hội nước Cộng hòa xã hội chủ nghĩa Việt Nam khóa XV, kỳ họp thứ 7 thông qua ngày 27 tháng 6 năm 2024.\n\nE-pas: 60179 CHỦ TỊCH QUỐC HỘI\n\n\n\n\nTrần Thanh Mẫn', 'BỘ QUỐC PHÒNG\n------- CỘNG HÒA XÃ HỘI CHỦ NGHĨA VIỆT NAM\nĐộc lập - Tự do - Hạnh phúc\n-------------- Số: 68/2024/TT-BQP Hà Nội, ngày 14 tháng 10 năm 2024\n\nTHÔNG TƯ\n\nQUY ĐỊNH VỀ ĐÀO TẠO, SÁT HẠCH, CẤP GIẤY PHÉP LÁI XE QUÂN SỰ; BỒI DƯỠNG KIẾN THỨC PHÁP LUẬT VỀ GIAO THÔNG ĐƯỜNG BỘ CHO NGƯỜI ĐIỀU KHIỂN XE MÁY CHUYÊN DÙNG THUỘC PHẠM VI QUẢN LÝ CỦA BỘ QUỐC PHÒNG\n\nCăn cứ Luật Trật tự, an toàn giao thông đường bộ ngày 27 tháng 6 năm 2024;\n\nCăn cứ Luật Giáo dục nghề nghiệp ngày 27 tháng 11 năm 2014;\n\nCăn cứ Nghị định số 01/2022/NĐ-CP ngày 30 tháng 11 năm 2022 của Chính phủ quy định chức năng, nhiệm vụ, quyền hạn và cơ cấu tổ chức của Bộ Quốc phòng;\n\nTheo đề nghị của Chủ nhiệm Tổng cục Kỹ thuật;\n\nBộ trưởng Bộ Quốc phòng ban hành Thông tư quy định về đào tạo, sát hạch, cấp Giấy phép lái xe quân sự; bồi dưỡng kiến thức pháp luật về giao thông đường bộ cho người điều khiển xe máy chuyên dùng thuộc phạm vi quản lý của Bộ Quốc phòng.\n\nChương I\n\nQUY ĐỊNH CHUNG\n\nĐiều 1. Phạm vi điều chỉnh\n\nThông tư này quy định về đào tạo, sát hạch, cấp, đổi, cấp lại và thu hồi Giấy phép lái xe quân sự; bồi dưỡng kiến thức pháp luật về giao thông đường bộ cho người điều khiển xe máy chuyên dùng thuộc phạm vi quản lý của Bộ Quốc phòng; trách nhiệm của các cơ quan, đơn vị, tổ chức và cá nhân liên quan.\n\nĐiều 2. Đối tượng áp dụng\n\n1. Cơ quan, đơn vị quản lý công tác đào tạo, sát hạch, cấp, đổi, cấp lại và thu hồi Giấy phép lái xe quân sự; bồi dưỡng kiến thức pháp luật về giao thông đường bộ cho người điều khiển xe máy chuyên dùng thuộc phạm vi quản lý của Bộ Quốc phòng.\n\n2. Cơ sở đào tạo lái xe quân sự và cơ sở bồi dưỡng kiến thức pháp luật về giao thông đường bộ thuộc phạm vi quản lý của Bộ Quốc phòng.\n\n3. Cơ quan, đơn vị, tổ chức và cá nhân liên quan.\n\nĐiều 3. Giải thích từ ngữ\n\nTrong Thông tư này, các từ ngữ dưới đây được hiểu như sau:\n\n1. Xe cơ giới gồm xe ô tô (kể cả xe cơ sở là xe ô tô có lắp các trang thiết bị chuyên dùng, xe ô tô đầu kéo, xe ô tô điện; xe xích; rơ moóc, sơ mi rơ moóc được kéo bởi xe ô tô; xe mô tô hai bánh, xe mô tô ba bánh, xe gắn máy (kể cả xe máy điện).\n\n2. Trọng tải thiết kế của xe ô tô chuyên dùng là khối lượng hàng chuyên chở theo thiết kế của xe tải cùng kiểu loại hoặc tương đương.\n\n3. Xe máy chuyên dùng gồm xe máy chuyên dùng quân sự, xe máy thi công; xe máy nông nghiệp, lâm nghiệp và các loại xe chuyên dùng khác có tham gia giao thông được trang bị cho các cơ quan, đơn vị trực thuộc Bộ Quốc phòng theo quy định tại Phụ lục II kèm theo Thông tư này.\n\n4. Xe quân sự gồm xe cơ giới và xe máy chuyên dùng được trang bị cho các cơ quan, đơn vị trực thuộc Bộ Quốc phòng quản lý, sử dụng vào mục đích quân sự, quốc phòng.\n\n5. Cơ sở đào tạo lái xe quân sự là các cơ sở đào tạo thuộc phạm vi quản lý của Bộ Quốc phòng có chức năng đào tạo lái xe quân sự.\n\n6. Giấy phép lái xe quân sự là Giấy phép lái xe do Bộ trưởng Bộ Quốc phòng ủy quyền cho Cục Xe máy - Vận tải/Tổng cục Hậu cần - Kỹ thuật cấp cho quân nhân, công chức quốc phòng, công nhân viên chức quốc phòng và người lao động hợp đồng đang phục vụ trong Bộ Quốc phòng để điều khiển một hoặc một số loại xe cơ giới tham gia giao thông đường bộ.\n\n7. Giấy phép lái xe dân sự là Giấy phép lái xe do cơ quan có thẩm quyền ngoài Quân đội cấp cho người điều khiển xe cơ giới đường bộ.\n\n\n\n8. Chứng chỉ bồi dưỡng kiến thức pháp luật về giao thông đường bộ (sau đây gọi tắt là chứng chỉ) là Giấy chứng nhận cấp cho người điều khiển xe máy chuyên dùng thuộc phạm vi quản lý của Bộ Quốc phòng tham gia giao thông đường bộ.\n\n9. Thời gian lái xe là thời gian người có Giấy phép lái xe đã lái loại xe ghi trong giấy phép lái xe.\n\n10. Số ki-lô-mét (km) lái xe an toàn là số km mà người có Giấy phép lái xe đã lái loại xe ghi trong Giấy phép lái xe không để xảy ra tai nạn loại A, B.\n\nĐiều 4. Lưu trữ hồ sơ đào tạo, sát hạch, cấp, đổi, cấp lại Giấy phép lái xe quân sự\n\n1. Cục Xe máy - Vận tải/Tổng cục Hậu cần - Kỹ thuật lưu trữ các loại hồ sơ, gồm:\n\na) Hồ sơ quy định tại điểm a khoản 1 và điểm a, b khoản 2 Điều 10 Thông tư này;\n\nb) Hồ sơ quy định tại điểm a khoản 1 Điều 14; điểm a khoản 1 Điều 15; điểm b khoản 1 Điều 16 Thông tư này;\n\nc) Hồ sơ quy định tại điểm b khoản 1; điểm b khoản 2; các điểm a, b, c, d, đ khoản 3 Điều 33 Thông tư này;\n\nd) Hồ sơ quy định tại điểm a khoản 3; điểm a, d, đ khoản 4 Điều 45 Thông tư này;\n\nđ) Hồ sơ quy định tại các điểm a, c khoản 2 Điều 46 Thông tư này.\n\n2. Cơ quan xe - máy hoặc cơ quan xe máy - vận tải các đơn vị đầu mối trực thuộc Bộ Quốc phòng lưu trữ các loại hồ, gồm:\n\na) Hồ sơ quy định tại khoản 1 Điều 10 Thông tư này;\n\nb) Hồ sơ quy định tại khoản 3 Điều 33 Thông tư này;\n\nc) Hồ sơ quy định tại các khoản 2, 3, 4 Điều 45 Thông tư này;\n\nd) Hồ sơ quy định tại khoản 2 Điều 46 Thông tư này.\n\n3. Cơ sở đào tạo lái xe quân sự lưu trữ các loại hồ sơ, gồm:\n\na) Hồ sơ quy định tại Điều 10 Thông tư này;\n\nb) Hồ sơ quy định tại khoản 1 Điều 14, khoản 1 Điều 15, khoản 1 Điều 16 Thông tư này;\n\nc) Hồ sơ quy định tại các khoản 1, 2 Điều 33 Thông tư này.\n\nĐiều 5. Giấy phép lái xe quân sự\n\n1. Giấy phép lái xe quân sự, được phân hạng theo quy định của Luật Trật tự, an toàn giao thông đường bộ, đồng thời phù hợp với đặc thù quân sự của phương tiện cơ giới đường bộ thuộc phạm vi quản lý của Bộ Quốc phòng. Giấy phép lái xe quân sự, gồm:\n\na) Hạng A1 cấp cho người điều khiển xe mô tô hai bánh có dung tích xi-lanh đến 125 cm3 hoặc có công suất động cơ điện đến 11 kW;\n\nb) Hạng A cấp cho người điều khiển xe mô tô hai bánh có dung tích xi-lanh trên 125 cm3 hoặc có công suất động cơ điện trên 11kW và các loại xe quy định cho Giấy phép lái xe quân sự hạng A1;\n\nc) Hạng B1 cấp cho người điều khiển xe mô tô ba bánh và các loại xe quy định cho Giấy phép lái xe quân sự hạng A1;\n\nd) Hạng B cấp cho người điều khiển các loại xe ô tô chở người đến 08 chỗ ngồi (không kể chỗ của người lái xe); xe ô tô tải và ô tô chuyên dùng có khối lượng toàn bộ theo thiết kế đến 3.500 kg; các loại xe ô tô quy định cho Giấy phép lái xe hạng B có kéo rơ moóc hoặc vũ khí, khí tài quân sự dạng rơ moóc có khối lượng toàn bộ theo thiết kế đến 750 kg;\n\nđ) Hạng C1 cấp cho người điều khiển các loại xe ô tô vận tải và ô tô chuyên dùng có khối lượng toàn bộ theo thiết kế trên 3.500 kg đến 7.500 kg; các loại xe ô tô quy định cho Giấy phép lái xe hạng C1 kéo rơ moóc hoặc vũ khí, khí tài quân sự dạng rơ moóc có khối lượng toàn bộ theo thiết kế đến 750 kg; các loại xe quy định cho Giấy phép lái xe quân sự hạng B;\n\ne) Hạng C cấp cho người điều khiển các loại xe ô tô tải và ô tô chuyên dùng có khối lượng toàn bộ theo thiết kế trên 7.500 kg; các loại xe ô tô tải quy định cho Giấy phép lái xe hạng C kéo rơ moóc hoặc vũ khí, khí tài quân sự dạng rơ moóc có khối lượng toàn bộ theo thiết kế đến 750 kg; các loại xe quy định cho Giấy phép lái xe quân sự hạng B và hạng C1;\n\ng) Hạng D1 cấp cho người điều khiển xe ô tô chở người trên 8 chỗ (không kể chỗ của người lái xe) đến 16 chỗ (không kể chỗ của người lái xe); các loại xe ô tô chở người quy định cho Giấy phép lái xe hạng D1 kéo rơ moóc hoặc vũ khí, khí tài quân sự dạng rơ moóc có khối lượng toàn bộ theo thiết kế đến 750 kg; các loại xe quy định cho Giấy phép lái xe quân sự hạng B, C1, C;\n\nh) Hạng D2 cấp cho người điều khiển xe ô tô chở người từ trên 16 đến 29 chỗ (không kể chỗ của người lái xe); các loại xe ô tô chở người quy định cho Giấy phép lái xe hạng D2 kéo rơ moóc hoặc vũ \n\n\n\nkhí, khí tài quân sự dạng rơ moóc có khối lượng toàn bộ theo thiết kế đến 750 kg; các loại xe quy định cho Giấy phép lái xe quân sự hạng B, C1, C, D1;\n\ni) Hạng D cấp cho người điều khiển xe ô tô chở người từ trên 29 chỗ (không kể chỗ của người lái xe); các loại xe ô tô chở người quy định cho Giấy phép lái xe hạng D kéo rơ moóc hoặc vũ khí, khí tài quân sự dạng rơ moóc có khối lượng toàn bộ theo thiết kế đến 750 kg; các loại xe quy định cho Giấy phép lái xe quân sự hạng B, C1, C, D1, D2;']","**Nguồn văn bản:** /content/drive/MyDrive/ITProject_data/new_law/36_2024_QH15_444251.docx

**Tên văn bản:** (Không có tiêu đề trong metadata)

**(Không có điều khoản trong metadata):** (Không có tên điều khoản trong metadata)

**Nội dung:**

k) Hạng BE cấp cho người lái các loại xe ô tô quy định cho giấy phép lái xe hạng B kéo rơ moóc có khối lượng toàn bộ theo thiết kế trên 750 kg.

**Tóm lại:** Giấy phép lái xe hạng BE cho phép điều khiển các loại xe ô tô quy định cho giấy phép lái xe hạng B kéo rơ moóc có khối lượng toàn bộ theo thiết kế trên 750 kg.
",Hạng BE cho phép lái xe ô tô chở người đến 9 chỗ ngồi kéo rơ moóc có trọng tải trên 750 kg.,0.0,0.8875094225810468,0.0,0.9999999999
6,Giấy phép lái xe hạng C1E cho phép lái những loại xe nào?,"['a) Chứng nhận đăng ký xe hoặc bản sao Chứng nhận đăng ký xe có chứng thực kèm bản gốc giấy tờ xác nhận của tổ chức tín dụng, chi nhánh ngân hàng nước ngoài còn hiệu lực trong trường hợp xe đang được thế chấp tại tổ chức tín dụng, chi nhánh ngân hàng nước ngoài;\n\nb) Giấy phép lái xe phù hợp với loại xe đang điều khiển;\n\nc) Chứng nhận kiểm định an toàn kỹ thuật và bảo vệ môi trường đối với xe cơ giới theo quy định của pháp luật;\n\nd) Chứng nhận bảo hiểm bắt buộc trách nhiệm dân sự của chủ xe cơ giới.\n\n2. Người điều khiển xe máy chuyên dùng tham gia giao thông đường bộ phải đủ tuổi, sức khỏe theo quy định của pháp luật; có bằng hoặc chứng chỉ điều khiển xe máy chuyên dùng phù hợp loại xe máy chuyên dùng đang điều khiển; có giấy phép lái xe đang còn điểm, còn hiệu lực hoặc chứng chỉ bồi dưỡng kiến thức pháp luật về giao thông đường bộ. Khi tham gia giao thông đường bộ, người điều khiển xe máy chuyên dùng phải mang theo các loại giấy tờ sau đây:\n\na) Chứng nhận đăng ký xe hoặc bản sao Chứng nhận đăng ký xe có chứng thực kèm bản gốc Giấy biên nhận còn hiệu lực của tổ chức tín dụng, chi nhánh ngân hàng nước ngoài trong trường hợp xe đang được thế chấp tại tổ chức tín dụng, chi nhánh ngân hàng nước ngoài;\n\nb) Bằng hoặc chứng chỉ điều khiển xe máy chuyên dùng;\n\nc) Giấy phép lái xe hoặc chứng chỉ bồi dưỡng kiến thức pháp luật về giao thông đường bộ;\n\nd) Chứng nhận kiểm định an toàn kỹ thuật và bảo vệ môi trường đối với xe máy chuyên dùng theo quy định của pháp luật;\n\nđ) Chứng nhận bảo hiểm bắt buộc trách nhiệm dân sự theo quy định của pháp luật.\n\n3. Trường hợp giấy tờ quy định tại khoản 1 và khoản 2 Điều này đã được tích hợp vào tài khoản định danh điện tử thì việc xuất trình, kiểm tra có thể thực hiện thông qua tài khoản định danh điện tử.\n\n4. Người lái xe gắn máy tham gia giao thông đường bộ phải hiểu biết quy tắc giao thông đường bộ, có kỹ năng điều khiển phương tiện; đủ điều kiện về độ tuổi, sức khỏe theo quy định tại điểm a khoản 1 và khoản 2 Điều 59 của Luật này.\n\n5. Người tập lái xe ô tô, người dự sát hạch lái xe ô tô khi tham gia giao thông đường bộ phải thực hành trên xe tập lái, xe sát hạch trên tuyến đường tập lái, tuyến đường sát hạch, có giáo viên dạy lái hoặc sát hạch viên bảo trợ tay lái. Giáo viên dạy lái, sát hạch viên phải mang theo các loại giấy tờ quy định tại khoản 1 Điều này.\n\nĐiều 57. Giấy phép lái xe\n\n1. Giấy phép lái xe bao gồm các hạng sau đây:\n\na) Hạng A1 cấp cho người lái xe mô tô hai bánh có dung tích xi-lanh đến 125 cm3 hoặc có công suất động cơ điện đến 11 kW;\n\nb) Hạng A cấp cho người lái xe mô tô hai bánh có dung tích xi-lanh\xa0 trên 125 cm3\xa0hoặc có công suất động cơ điện trên 11 kW và các loại xe quy định cho giấy phép lái xe hạng A1;\n\nc) Hạng B1 cấp cho người lái xe mô tô ba bánh và các loại xe quy định cho giấy phép lái xe hạng A1;\n\nd) Hạng B cấp cho người lái xe ô tô chở người đến 08 chỗ (không kể chỗ của người lái xe); xe ô tô tải và ô tô chuyên dùng có khối lượng toàn bộ theo thiết kế đến 3.500 kg; các loại xe ô tô quy định cho giấy phép lái xe hạng B kéo rơ moóc có khối lượng toàn bộ theo thiết kế đến 750 kg; \n\nđ) Hạng C1 cấp cho người lái xe ô tô tải và ô tô chuyên dùng có khối lượng toàn bộ theo thiết kế trên 3.500 kg đến 7.500 kg; các loại xe ô tô tải quy định cho giấy phép lái xe hạng C1 kéo rơ moóc có khối lượng toàn bộ theo thiết kế đến 750 kg; các loại xe quy định cho giấy phép lái xe hạng B;\n\ne) Hạng C cấp cho người lái xe ô tô tải và ô tô chuyên dùng có khối lượng toàn bộ theo thiết kế trên 7.500 kg; các loại xe ô tô tải quy định cho giấy phép lái xe hạng C kéo rơ moóc có khối lượng toàn bộ theo thiết kế đến 750 kg; các loại xe quy định cho giấy phép lái xe hạng B và hạng C1;\n\ng) Hạng D1 cấp cho người lái xe ô tô chở người trên 08 chỗ (không kể chỗ của người lái xe) đến 16 chỗ (không kể chỗ của người lái xe); các loại xe ô tô chở người quy định cho giấy phép lái xe hạng D1 kéo rơ moóc có khối lượng toàn bộ theo thiết kế đến 750 kg; các loại xe quy định cho giấy phép lái xe các hạng B, C1, C;\n\nh) Hạng D2 cấp cho người lái xe ô tô chở người (kể cả xe buýt) trên 16 chỗ (không kể chỗ của người lái xe) đến 29 chỗ (không kể chỗ của người lái xe); các loại xe ô tô chở người quy định cho giấy phép lái xe hạng D2 kéo rơ moóc có khối lượng toàn bộ theo thiết kế đến 750 kg; các loại xe quy định cho giấy phép lái xe các hạng B, C1, C, D1;\n\ni) Hạng D cấp cho người lái xe ô tô chở người (kể cả xe buýt) trên 29 chỗ (không kể chỗ của người lái xe); xe ô tô chở người giường nằm; các loại xe ô tô chở người quy định cho giấy phép lái xe hạng D kéo rơ moóc có khối lượng toàn bộ theo thiết kế đến 750 kg; các loại xe quy định cho giấy phép lái xe các hạng B, C1, C, D1, D2;\n\nk) Hạng BE cấp cho người lái các loại xe ô tô quy định cho giấy phép lái xe hạng B kéo rơ moóc có khối lượng toàn bộ theo thiết kế trên 750 kg;\n\nl) Hạng C1E cấp cho người lái các loại xe ô tô quy định cho giấy phép lái xe hạng C1 kéo rơ moóc có khối lượng toàn bộ theo thiết kế trên 750 kg;\n\nm) Hạng CE cấp cho người lái các loại xe ô tô quy định cho giấy phép lái xe hạng C kéo rơ moóc có khối lượng toàn bộ theo thiết kế trên 750 kg; xe ô tô đầu kéo kéo sơ mi rơ moóc;\n\nn) Hạng D1E cấp cho người lái các loại xe ô tô quy định cho giấy phép lái xe hạng D1 kéo rơ moóc có khối lượng toàn bộ theo thiết kế trên 750 kg;\n\no) Hạng D2E cấp cho người lái các loại xe ô tô quy định cho giấy phép lái xe hạng D2 kéo rơ moóc có khối lượng toàn bộ theo thiết kế trên 750 kg;\n\np) Hạng DE cấp cho người lái các loại xe ô tô quy định cho giấy phép lái xe hạng D kéo rơ moóc có khối lượng toàn bộ theo thiết kế trên 750 kg; xe ô tô chở khách nối toa.\n\n2. Người khuyết tật điều khiển xe mô tô ba bánh dùng cho người khuyết tật được cấp giấy phép lái xe hạng A1.\n\nNgười khuyết tật điều khiển xe ô tô số tự động có kết cấu phù hợp với tình trạng khuyết tật thì được cấp giấy phép lái xe hạng B.\n\n3. Người điều khiển xe chở hàng bốn bánh có gắn động cơ, xe chở người bốn bánh có gắn động cơ phải sử dụng giấy phép lái xe có hạng phù hợp với xe ô tô tải hoặc xe ô tô chở người tương ứng.\n\n4. Người điều khiển xe ô tô có thiết kế, cải tạo với số chỗ ít hơn xe cùng loại, kích thước giới hạn tương đương phải sử dụng giấy phép lái xe có hạng phù hợp với xe ô tô cùng loại, kích thước giới hạn tương đương và có số chỗ nhiều nhất.\n\n5. Thời hạn của giấy phép lái xe được quy định như sau:\n\na) Giấy phép lái xe các hạng A1, A, B1 không thời hạn;\n\nb) Giấy phép lái xe hạng B và hạng C1 có thời hạn 10 năm kể từ ngày cấp;\n\nc) Giấy phép lái xe các hạng C, D1, D2, D, BE, C1E, CE, D1E, D2E và DE có thời hạn 05 năm kể từ ngày cấp.\n\n6. Giấy phép lái xe có giá trị sử dụng trong phạm vi lãnh thổ Việt Nam bao gồm:\n\na) Giấy phép lái xe do cơ quan có thẩm quyền của Việt Nam cấp;\n\nb) Giấy phép lái xe quốc tế và giấy phép lái xe quốc gia phù hợp với loại xe được phép điều khiển do quốc gia là thành viên của Công ước của Liên hợp quốc về Giao thông đường bộ năm 1968 (sau đây gọi là Công ước Viên) cấp;\n\nc) Giấy phép lái xe phù hợp với loại xe được phép điều khiển của nước hoặc vùng lãnh thổ mà Việt Nam ký kết điều ước quốc tế hoặc thỏa thuận quốc tế công nhận giấy phép lái xe của nhau;\n\nd) Giấy phép lái xe nước ngoài phù hợp với loại xe được phép điều khiển do quốc gia được công nhận theo điều ước quốc tế mà nước Cộng hòa xã hội chủ nghĩa Việt Nam là thành viên.\n\n7. Giấy phép lái xe không có hiệu lực trong các trường hợp sau đây:\n\na) Giấy phép lái xe hết thời hạn sử dụng;\n\nb) Giấy phép lái xe bị thu hồi theo quy định tại khoản 5 Điều 62 của Luật này.\n\n8. Giấy phép lái xe quốc tế được quy định như sau:\n\na) Giấy phép lái xe quốc tế là giấy phép lái xe do cơ quan nhà nước có thẩm quyền của quốc gia là thành viên của Công ước Viên cấp theo một mẫu thống nhất; có thời hạn không quá 03 năm kể từ ngày cấp và phải phù hợp với thời hạn còn hiệu lực của giấy phép lái xe quốc gia;', '8. Ủy ban nhân dân các cấp, trong phạm vi nhiệm vụ, quyền hạn của mình, thực hiện quản lý nhà nước về trật tự, an toàn giao thông đường bộ tại địa phương.\n\nChương IX\n\nĐIỀU KHOẢN THI HÀNH\n\nĐiều 88. Hiệu lực thi hành\n\n1. Luật này có hiệu lực thi hành từ ngày 01 tháng 01 năm 2025, trừ trường hợp quy định tại khoản 2 Điều này.\n\n2. Khoản 3 Điều 10 của Luật này có hiệu lực thi hành từ ngày 01 tháng 01 năm 2026.\n\n3. Luật Giao thông đường bộ số 23/2008/QH12 đã được sửa đổi, bổ sung một số điều theo Luật số 35/2018/QH14 và Luật số 44/2019/QH14 hết hiệu lực kể từ ngày Luật này có hiệu lực thi hành, trừ trường hợp quy định tại các khoản 1, 2, 5 và 6 Điều 89 của Luật này.\n\n4. Nghị quyết số 73/2022/QH15 của Quốc hội về thí điểm đấu giá biển số xe ô tô hết hiệu lực kể từ ngày Luật này có hiệu lực thi hành, trừ trường hợp quy định tại khoản 7 Điều 89 của Luật này.\n\nĐiều 89. Quy định chuyển tiếp\n\n1. Giấy phép lái xe được cấp trước ngày Luật này có hiệu lực thi hành được tiếp tục sử dụng theo thời hạn ghi trên giấy phép lái xe. \n\n2. Giấy phép lái xe được cấp trước ngày Luật này có hiệu lực thi hành nếu chưa thực hiện đổi, cấp lại theo quy định của Luật này có hiệu lực sử dụng như sau:\n\na) Giấy phép lái xe hạng A1 được tiếp tục điều khiển xe mô tô hai bánh có dung tích xi-lanh từ 50 cm3\xa0đến dưới 175 cm3 hoặc có công suất động cơ điện từ 04 kW đến dưới 14 kW;\n\nb) Giấy phép lái xe hạng A2 được tiếp tục điều khiển xe mô tô hai bánh có dung tích xi-lanh từ 175 cm3\xa0trở lên hoặc có công suất động cơ điện từ 14 kW trở lên và các loại xe quy định cho giấy phép lái xe hạng A1 quy định tại điểm a khoản này;\n\nc) Giấy phép lái xe hạng A3 được tiếp tục điều khiển xe mô tô ba bánh, các loại xe quy định cho giấy phép lái xe hạng A1 quy định tại điểm a khoản này và các xe tương tự;\n\nd) Giấy phép lái xe hạng A4 được tiếp tục điều khiển máy kéo có trọng tải đến 1.000 kg;\n\nđ) Giấy phép lái xe hạng B1 số tự động cấp cho người không hành nghề lái xe được tiếp tục điều khiển xe ô tô số tự động chở người đến 08 chỗ (không kể chỗ của người lái xe); xe ô tô tải, kể cả ô tô tải chuyên dùng số tự động có trọng tải dưới 3.500 kg;\n\ne) Giấy phép lái xe hạng B1 cấp cho người không hành nghề lái xe được tiếp tục điều khiển xe ô tô chở người đến 08 chỗ (không kể chỗ của người lái xe); xe ô tô tải, máy kéo có trọng tải dưới 3.500 kg;\n\ng) Giấy phép lái xe hạng B2 cấp cho người hành nghề lái xe được tiếp tục điều khiển xe ô tô chở người đến 08 chỗ (không kể chỗ của người lái xe); xe ô tô tải, máy kéo có trọng tải dưới 3.500 kg;\n\nh) Giấy phép lái xe hạng C được tiếp tục điều khiển xe ô tô tải, máy kéo có trọng tải từ 3.500 kg trở lên và các loại xe quy định cho các giấy phép lái xe hạng B1, B2 quy định tại các điểm đ, e và g khoản này;\n\ni) Giấy phép lái xe hạng D được tiếp tục điều khiển xe ô tô chở người từ 09 chỗ (không kể chỗ của người lái xe) đến 29 chỗ (không kể chỗ của người lái xe) và các loại xe quy định cho các giấy phép lái xe hạng B1, B2, C quy định tại các điểm đ, e, g và h khoản này;\n\nk) Giấy phép lái xe hạng E được tiếp tục điều khiển xe ô tô chở người trên 29 chỗ (không kể chỗ của người lái xe) và các loại xe quy định cho các giấy phép lái xe hạng B1, B2, C, D quy định tại các điểm đ, e, g, h và i khoản này;\n\nl) Giấy phép lái xe hạng FB2, FD được tiếp tục điều khiển các loại xe quy định cho giấy phép lái xe hạng B2, D quy định tại điểm g và điểm i khoản này khi kéo rơ moóc; giấy phép lái xe hạng FC được tiếp tục điều khiển các loại xe quy định cho giấy phép lái xe hạng C quy định tại điểm h khoản này khi kéo rơ moóc, đầu kéo kéo sơ mi rơ moóc; giấy phép lái xe hạng FE được tiếp tục điều khiển các loại xe quy định cho giấy phép lái xe hạng E quy định tại điểm k khoản này khi kéo rơ moóc\xa0hoặc xe ô tô chở khách nối toa.\n\n3. Trường hợp người có giấy phép lái xe đã được cấp trước ngày Luật này có hiệu lực thi hành có nhu cầu đổi, cấp lại giấy phép lái xe thì thực hiện như sau:\n\na) Giấy phép lái xe hạng A1 được đổi, cấp lại sang giấy phép lái xe hạng A với điều kiện hạn chế là chỉ được điều khiển xe mô tô hai bánh có dung tích xi-lanh đến dưới 175 cm3 hoặc có công suất động cơ điện đến dưới 14 kW;\n\nb) Giấy phép lái xe hạng A2 được đổi, cấp lại sang giấy phép lái xe hạng A;\n\nc) Giấy phép lái xe hạng A3 được đổi, cấp lại sang giấy phép lái xe hạng B1;\n\nd) Giấy phép lái xe hạng A4 được đổi, cấp lại sang chứng chỉ điều khiển xe máy chuyên dùng cho người điều khiển máy kéo có trọng tải đến 1.000 kg và chứng chỉ bồi dưỡng kiến thức pháp luật về giao thông đường bộ cho người điều khiển xe máy chuyên dùng;\n\nđ) Giấy phép lái xe hạng B1 số tự động được đổi, cấp lại sang giấy phép lái xe hạng B với điều kiện hạn chế là chỉ được điều khiển xe ô tô số tự động;\n\ne) Giấy phép lái xe hạng B1, B2 được đổi, cấp lại sang giấy phép lái xe hạng B hoặc hạng C1 và chứng chỉ điều khiển xe máy chuyên dùng cho người điều khiển máy kéo có trọng tải đến 3.500 kg;\n\ng) Giấy phép lái xe hạng C giữ nguyên và đổi, cấp lại cùng hạng và chứng chỉ điều khiển xe máy chuyên dùng cho người điều khiển máy kéo có trọng tải trên 3.500 kg;\n\nh) Giấy phép lái xe hạng D được đổi, cấp lại sang giấy phép lái xe hạng D2 và chứng chỉ điều khiển xe máy chuyên dùng cho người điều khiển máy kéo có trọng tải trên 3.500 kg;\n\ni) Giấy phép lái xe hạng E được đổi, cấp lại sang giấy phép lái xe hạng D và chứng chỉ điều khiển xe máy chuyên dùng cho người điều khiển máy kéo có trọng tải trên 3.500 kg;\n\nk) Giấy phép lái xe hạng FB2 được đổi, cấp lại sang giấy phép lái xe hạng BE hoặc hạng C1E và chứng chỉ điều khiển xe máy chuyên dùng cho người điều khiển máy kéo có trọng tải đến 3.500 kg;\n\nl) Giấy phép lái xe hạng FC được đổi, cấp lại sang giấy phép lái xe hạng CE và chứng chỉ điều khiển xe máy chuyên dùng cho người điều khiển máy kéo có trọng tải trên 3.500 kg;\n\nm) Giấy phép lái xe hạng FD được đổi, cấp lại sang giấy phép lái xe hạng D2E và chứng chỉ điều khiển xe máy chuyên dùng cho người điều khiển máy kéo có trọng tải trên 3.500 kg;\n\nn) Giấy phép lái xe hạng FE được đổi, cấp lại sang giấy phép lái xe hạng DE và chứng chỉ điều khiển xe máy chuyên dùng cho người điều khiển máy kéo có trọng tải trên 3.500 kg.\n\n4. Người học lái xe đã được đào tạo lái xe trước ngày Luật này có hiệu lực thi hành hoặc đang được đào tạo lái xe tại ngày Luật này có hiệu lực thi hành chưa được sát hạch, cấp giấy phép lái xe thì được sát hạch, cấp giấy phép lái xe theo hạng giấy phép lái xe đổi, cấp lại quy định tại khoản 3 Điều này.\n\n5. Chứng nhận đăng ký xe, biển số xe máy chuyên dùng cấp trước ngày Luật này có hiệu lực thi hành vẫn có giá trị sử dụng.\n\n6. Chứng nhận chất lượng an toàn kỹ thuật và bảo vệ môi trường được cấp trước ngày Luật này có hiệu lực thi hành thì có giá trị sử dụng đến hết thời hạn ghi trên giấy chứng nhận đó.\n\n7. Việc đấu giá biển số xe ô tô được thực hiện trước ngày Luật này có hiệu lực thi hành và đến ngày Luật này có hiệu lực thi hành đã được cấp văn bản xác nhận biển số xe ô tô trúng đấu giá thì tiếp tục thực hiện theo Nghị quyết số 73/2022/QH15 của Quốc hội về thí điểm đấu giá biển số xe ô tô; trường hợp chưa được cấp xác nhận biển số xe ô tô trúng đấu giá thì tiếp tục thực hiện theo Nghị quyết số 73/2022/QH15 của Quốc hội về thí điểm đấu giá biển số xe ô tô và quy định tại điểm d khoản 1 Điều 38 của Luật này./.\n\nLuật này được Quốc hội nước Cộng hòa xã hội chủ nghĩa Việt Nam khóa XV, kỳ họp thứ 7 thông qua ngày 27 tháng 6 năm 2024.\n\nE-pas: 60179 CHỦ TỊCH QUỐC HỘI\n\n\n\n\nTrần Thanh Mẫn', 'khí, khí tài quân sự dạng rơ moóc có khối lượng toàn bộ theo thiết kế đến 750 kg; các loại xe quy định cho Giấy phép lái xe quân sự hạng B, C1, C, D1;\n\ni) Hạng D cấp cho người điều khiển xe ô tô chở người từ trên 29 chỗ (không kể chỗ của người lái xe); các loại xe ô tô chở người quy định cho Giấy phép lái xe hạng D kéo rơ moóc hoặc vũ khí, khí tài quân sự dạng rơ moóc có khối lượng toàn bộ theo thiết kế đến 750 kg; các loại xe quy định cho Giấy phép lái xe quân sự hạng B, C1, C, D1, D2;\n\nk) Hạng C1E cấp cho người điều khiển các loại xe ô tô quy định cho Giấy phép lái xe hạng C1 kéo rơ moóc hoặc vũ khí, khí tài quân sự dạng rơ moóc có khối lượng toàn bộ theo thiết kế trên 750 kg;\n\nl) Hạng CE cấp cho người điều khiển các loại xe ô tô quy định cho Giấy phép lái xe hạng C kéo rơ moóc hoặc vũ khí, khí tài quân sự dạng rơ moóc có khối lượng toàn bộ theo thiết kế trên 750 kg; xe ô tô đầu kéo kéo sơ mi rơ moóc hoặc khí tài quân sự dạng sơ mi rơ moóc;\n\nm) Hạng CX cấp cho người đã có Giấy phép lái xe quân sự hạng C để điều khiển xe xích kéo vũ khí, khí tài quân sự.\n\n2. Người điều khiển xe chở hàng bốn bánh có gắn động cơ, xe chở người bốn bánh có gắn động cơ phải sử dụng giấy phép lái xe có hạng phù hợp với xe ô tô tải và ô tô chở người tương ứng.\n\n3. Người điều khiển xe ô tô có thiết kế, cải tạo với số chỗ ngồi ít hơn ô tô cùng loại, kích thước giới hạn tương đương phải sử dụng giấy phép lái xe có hạng phù hợp với ô tô cùng loại, kích thước giới hạn tương đương và có số chỗ ngồi nhiều nhất.\n\nĐiều 6. Mẫu và thời hạn Giấy phép lái xe quân sự\n\n1. Mẫu Giấy phép lái xe quân sự\n\na) Giấy phép lái xe quân sự thực hiện theo quy định tại Mẫu số 08 kèm theo Thông tư này;\n\nb) Cục trưởng Cục Xe máy - Vận tải/Tổng cục Hậu cần - Kỹ thuật có trách nhiệm quản lý việc sử dụng Giấy phép lái xe quân sự thuộc phạm vi quản lý của Bộ Quốc phòng.\n\n2. Thời hạn sử dụng Giấy phép lái xe quân sự\n\na) Giấy phép lái xe quân sự hạng A1, A, B1 là không thời hạn;\n\nb) Giấy phép lái xe quân sự các hạng B, C1, C, D1, D2, D, C1E, CE, CX có thời hạn 05 năm kể từ ngày cấp;\n\nc) Trường hợp cấp, đổi do lý do khác thời hạn theo thời hạn ghi trên Giấy phép lái xe quân sự.\n\n3. Giấy phép lái xe quân sự không có hiệu lực trong các trường hợp sau:\n\na) Giấy phép lái xe quân sự hết thời hạn sử dụng được ghi trên Giấy phép lái xe;\n\nb) Giấy phép lái xe quân sự bị trừ hết điểm theo quy định tại Điều 7 của Thông tư này;\n\nc) Giấy phép lái xe quân sự có Quyết định thu hồi theo khoản 1 Điều 47 Thông tư này.\n\nĐiều 7. Điểm của Giấy phép lái xe quân sự\n\n1. Điểm của Giấy phép lái xe quân sự gồm 12 điểm theo quy định của Luật Trật tự, an toàn giao thông đường bộ, được dùng để quản lý việc chấp hành pháp luật về trật tự, an toàn giao thông đường bộ của người lái xe. Số điểm trừ mỗi lần tùy theo tính chất, mức độ vi phạm theo quy định của pháp luật. Giấy phép lái xe chưa bị trừ hết điểm và không bị trừ điểm trong thời hạn 12 tháng kể từ ngày bị trừ điểm gần nhất thì được phục hồi đủ 12 điểm.\n\n2. Trường hợp Giấy phép lái xe quân sự bị trừ hết điểm, sau thời hạn ít nhất 06 tháng kể từ ngày bị trừ hết điểm, người có Giấy phép lái xe quân sự bị trừ hết điểm được tham gia kiểm tra kiến thức pháp luật về giao thông đường bộ tổ chức tại cơ sở đào tạo lái xe quân sự theo quy định tại điểm a khoản 1 Điều 40 và khoản 1 Điều 41 Thông tư này, nếu kết quả đặt yêu cầu được phục hồi đủ 12 điểm.\n\n3. Điểm của Giấy phép lái xe quân sự đổi, cấp lại, đào tạo nâng hạng được giữ nguyên như trước khi đổi, cấp lại, đào tạo nâng hạng.\n\nĐiều 8. Độ tuổi của người được cấp Giấy phép lái xe quân sự\n\n1. Quân nhân, công chức quốc phòng, công nhân viên chức quốc phòng, lao động hợp đồng đang phục vụ trong Bộ Quốc phòng đủ 18 tuổi trở lên được cấp Giấy phép lái xe quân sự hạng A1, A, B1, B, C1, C.\n\n2. Quân nhân, công chức quốc phòng, công nhân viên chức quốc phòng, lao động hợp đồng đang phục vụ trong Bộ Quốc phòng đủ 24 tuổi trở lên được cấp Giấy phép lái xe quân sự hạng D1, D2, C1E, CE, CX.\n\nCác trường hợp đào tạo chuyển tiếp từ hạng C lên hạng CE hoặc CX theo chỉ tiêu của Bộ Tổng Tham mưu, đủ 19 tuổi trở lên.\n\n3. Quân nhân, công chức quốc phòng, công nhân viên chức quốc phòng, lao động hợp đồng đang phục vụ trong Bộ Quốc phòng đủ 27 tuổi trở lên được cấp Giấy phép lái xe quân sự hạng D. Độ tuổi tối đa của người được cấp Giấy phép lái xe quân sự hạng D là đủ 57 tuổi đối với nam và đủ 55 tuổi đối với nữ.\n\nChương II\n\nĐÀO TẠO LÁI XE QUÂN SỰ\n\nMục I. NGƯỜI HỌC\n\nĐiều 9. Điều kiện đối với người học lái xe quân sự\n\n1. Quân nhân, công chức quốc phòng, công nhân viên chức quốc phòng, lao động hợp đồng đang phục vụ trong Bộ Quốc phòng có đủ các điều kiện: Tiêu chuẩn về tuổi đời, thời gian công tác, sức khỏe, trình độ văn hóa, phẩm chất chính trị theo quy định của Bộ Quốc phòng.\n\nĐối với lao động hợp đồng: Chỉ đào tạo nâng hạng khi có đủ điều kiện, tiêu chuẩn quy định tại khoản 1 Điều này.\n\n2. Đối với người học nâng hạng Giấy phép lái xe quân sự phải có thời gian lái xe và số km lái xe an toàn như sau:\n\na) Từ hạng B lên hạng C1; hạng C1 lên hạng C, C1E; hạng C lên hạng D1, CE, CX; hạng D1 lên hạng D2; hạng D2 lên hạng D: Có thời gian lái xe 02 năm trở lên và 30.000 km lái xe an toàn trở lên (trừ các trường hợp đào tạo chuyển tiếp từ hạng C lên hạng CE hoặc CX theo chỉ tiêu của Bộ Tổng Tham mưu);\n\nb) Từ hạng B lên hạng C, D1; hạng C1 lên D1; hạng C lên hạng D2; hạng D1 lên hạng D: Có thời gian lái xe 03 năm trở lên và có 50.000 km lái xe an toàn trở lên;\n\nc) Từ hạng B lên hạng D2, từ hạng C1 lên hạng D2, từ hạng C lên hạng D: Có thời gian lái xe 05 năm trở lên và 100.000 km lái xe an toàn trở lên.\n\n3. Đối với người học nâng hạng Giấy phép lái xe quân sự lên hạng D1, D2, D ngoài các quy định tại các khoản 1, 2 Điều này phải có bằng tốt nghiệp trung học cơ sở trở lên.\n\nĐiều 10. Hồ sơ đào tạo lái xe\n\n1. Hạng A1, A, gồm:\n\na) Kế hoạch huấn luyện lái xe mô tô quân sự hạng A1, A (kèm theo danh sách học viên) của cơ quan, đơn vị theo quy định tại Mẫu số 13 Phụ lục I kèm theo Thông tư này;\n\nb) Đơn đề nghị học và sát hạch, cấp Giấy phép lái xe quân sự của cá nhân có xác nhận của Thủ trưởng cơ quan, đơn vị trực tiếp quản lý từ cấp trung đoàn hoặc tương đương trở lên theo quy định tại Mẫu số 01 Phụ lục I kèm theo Thông tư này;\n\nc) Bản sao Căn cước công dân (căn cước) và bản sao một trong các loại giấy tờ sau: Giấy chứng minh quân nhân, công chức quốc phòng, công nhân và viên chức quốc phòng, quyết định nhập ngũ, tuyển dụng, phiếu quân nhân, thẻ học viên, quyết định thăng, phong quân hàm, nâng lương gần nhất còn hiệu lực;\n\nd) Giấy chứng nhận sức khỏe theo quy định do quân y cấp trung đoàn và tương đương trở lên xác nhận theo quy định tại Mẫu số 02 Phụ lục I kèm theo Thông tư này;\n\nđ) Hai ảnh màu cỡ 2 x 3 cm (ảnh chụp trên nền màu xanh; quân nhân mặc quân phục thường dùng; công chức quốc phòng, công nhân và viên chức quốc phòng, lao động hợp đồng mặc đồng phục; đeo biển tên theo quy định, không đội mũ).\n\n2. Hạng B1, B, C1, C, gồm:\n\na) Kế hoạch đào tạo lái xe quân sự hạng B1, B, C1, C (kèm theo danh sách học viên) của cơ sở đào tạo;\n\nb) Bản sao quyết định giao chỉ tiêu đào tạo nhân viên kỹ thuật sơ cấp của Tổng Tham mưu trưởng đối với trường hợp đào tạo theo chỉ tiêu nhiệm vụ; văn bản đề nghị đào tạo lái xe của Thủ trưởng cơ quan, đơn vị đầu mối trực thuộc Bộ Quốc phòng đối với trường hợp gửi đào tạo;\n\nc) Hồ sơ quy định tại các điểm b, c, d, đ khoản 1 Điều này;\n\n3. Đào tạo nâng hạng Giấy phép lái xe quân sự\n\nNgoài hồ sơ quy định tại khoản 2 Điều này phải bổ sung các giấy tờ như sau:\n\na) Bản khai thời gian lái xe và số km lái xe an toàn quy định cho từng hạng xe có xác nhận của Thủ trưởng cơ quan, đơn vị trực tiếp quản lý từ cấp trung đoàn hoặc tương đương trở lên theo quy định tại Mẫu số 03 Phụ lục I kèm theo Thông tư này;\n\nb) Bản sao Giấy phép lái xe quân sự đang sử dụng.\n\nMục II. CƠ SỞ ĐÀO TẠO LÁI XE QUÂN SỰ\n\nĐiều 11. Nhiệm vụ của cơ sở đào tạo lái xe quân sự']","**Nguồn văn bản:** /content/drive/MyDrive/ITProject_data/new_law/36_2024_QH15_444251.docx

**Tên văn bản:** (Không có tiêu đề trong metadata)

**(Không có điều khoản trong metadata):**

**Nội dung:**

l) Hạng C1E cấp cho người lái các loại xe ô tô quy định cho giấy phép lái xe hạng C1 kéo rơ moóc có khối lượng toàn bộ theo thiết kế trên 750 kg.


**Tóm lại:** Giấy phép lái xe hạng C1E cho phép lái các loại xe ô tô thuộc hạng C1 kéo theo rơ-moóc có khối lượng toàn bộ theo thiết kế trên 750 kg.
",Hạng C1E cho phép lái xe ô tô tải có trọng tải từ 3.500 kg đến 7.500 kg kéo rơ moóc có trọng tải trên 750 kg.,0.3333333333333333,0.8989423018524891,1.0,0.9999999999
7,Giấy phép lái xe hạng D1E cho phép lái những loại xe nào?,"['a) Chứng nhận đăng ký xe hoặc bản sao Chứng nhận đăng ký xe có chứng thực kèm bản gốc giấy tờ xác nhận của tổ chức tín dụng, chi nhánh ngân hàng nước ngoài còn hiệu lực trong trường hợp xe đang được thế chấp tại tổ chức tín dụng, chi nhánh ngân hàng nước ngoài;\n\nb) Giấy phép lái xe phù hợp với loại xe đang điều khiển;\n\nc) Chứng nhận kiểm định an toàn kỹ thuật và bảo vệ môi trường đối với xe cơ giới theo quy định của pháp luật;\n\nd) Chứng nhận bảo hiểm bắt buộc trách nhiệm dân sự của chủ xe cơ giới.\n\n2. Người điều khiển xe máy chuyên dùng tham gia giao thông đường bộ phải đủ tuổi, sức khỏe theo quy định của pháp luật; có bằng hoặc chứng chỉ điều khiển xe máy chuyên dùng phù hợp loại xe máy chuyên dùng đang điều khiển; có giấy phép lái xe đang còn điểm, còn hiệu lực hoặc chứng chỉ bồi dưỡng kiến thức pháp luật về giao thông đường bộ. Khi tham gia giao thông đường bộ, người điều khiển xe máy chuyên dùng phải mang theo các loại giấy tờ sau đây:\n\na) Chứng nhận đăng ký xe hoặc bản sao Chứng nhận đăng ký xe có chứng thực kèm bản gốc Giấy biên nhận còn hiệu lực của tổ chức tín dụng, chi nhánh ngân hàng nước ngoài trong trường hợp xe đang được thế chấp tại tổ chức tín dụng, chi nhánh ngân hàng nước ngoài;\n\nb) Bằng hoặc chứng chỉ điều khiển xe máy chuyên dùng;\n\nc) Giấy phép lái xe hoặc chứng chỉ bồi dưỡng kiến thức pháp luật về giao thông đường bộ;\n\nd) Chứng nhận kiểm định an toàn kỹ thuật và bảo vệ môi trường đối với xe máy chuyên dùng theo quy định của pháp luật;\n\nđ) Chứng nhận bảo hiểm bắt buộc trách nhiệm dân sự theo quy định của pháp luật.\n\n3. Trường hợp giấy tờ quy định tại khoản 1 và khoản 2 Điều này đã được tích hợp vào tài khoản định danh điện tử thì việc xuất trình, kiểm tra có thể thực hiện thông qua tài khoản định danh điện tử.\n\n4. Người lái xe gắn máy tham gia giao thông đường bộ phải hiểu biết quy tắc giao thông đường bộ, có kỹ năng điều khiển phương tiện; đủ điều kiện về độ tuổi, sức khỏe theo quy định tại điểm a khoản 1 và khoản 2 Điều 59 của Luật này.\n\n5. Người tập lái xe ô tô, người dự sát hạch lái xe ô tô khi tham gia giao thông đường bộ phải thực hành trên xe tập lái, xe sát hạch trên tuyến đường tập lái, tuyến đường sát hạch, có giáo viên dạy lái hoặc sát hạch viên bảo trợ tay lái. Giáo viên dạy lái, sát hạch viên phải mang theo các loại giấy tờ quy định tại khoản 1 Điều này.\n\nĐiều 57. Giấy phép lái xe\n\n1. Giấy phép lái xe bao gồm các hạng sau đây:\n\na) Hạng A1 cấp cho người lái xe mô tô hai bánh có dung tích xi-lanh đến 125 cm3 hoặc có công suất động cơ điện đến 11 kW;\n\nb) Hạng A cấp cho người lái xe mô tô hai bánh có dung tích xi-lanh\xa0 trên 125 cm3\xa0hoặc có công suất động cơ điện trên 11 kW và các loại xe quy định cho giấy phép lái xe hạng A1;\n\nc) Hạng B1 cấp cho người lái xe mô tô ba bánh và các loại xe quy định cho giấy phép lái xe hạng A1;\n\nd) Hạng B cấp cho người lái xe ô tô chở người đến 08 chỗ (không kể chỗ của người lái xe); xe ô tô tải và ô tô chuyên dùng có khối lượng toàn bộ theo thiết kế đến 3.500 kg; các loại xe ô tô quy định cho giấy phép lái xe hạng B kéo rơ moóc có khối lượng toàn bộ theo thiết kế đến 750 kg; \n\nđ) Hạng C1 cấp cho người lái xe ô tô tải và ô tô chuyên dùng có khối lượng toàn bộ theo thiết kế trên 3.500 kg đến 7.500 kg; các loại xe ô tô tải quy định cho giấy phép lái xe hạng C1 kéo rơ moóc có khối lượng toàn bộ theo thiết kế đến 750 kg; các loại xe quy định cho giấy phép lái xe hạng B;\n\ne) Hạng C cấp cho người lái xe ô tô tải và ô tô chuyên dùng có khối lượng toàn bộ theo thiết kế trên 7.500 kg; các loại xe ô tô tải quy định cho giấy phép lái xe hạng C kéo rơ moóc có khối lượng toàn bộ theo thiết kế đến 750 kg; các loại xe quy định cho giấy phép lái xe hạng B và hạng C1;\n\ng) Hạng D1 cấp cho người lái xe ô tô chở người trên 08 chỗ (không kể chỗ của người lái xe) đến 16 chỗ (không kể chỗ của người lái xe); các loại xe ô tô chở người quy định cho giấy phép lái xe hạng D1 kéo rơ moóc có khối lượng toàn bộ theo thiết kế đến 750 kg; các loại xe quy định cho giấy phép lái xe các hạng B, C1, C;\n\nh) Hạng D2 cấp cho người lái xe ô tô chở người (kể cả xe buýt) trên 16 chỗ (không kể chỗ của người lái xe) đến 29 chỗ (không kể chỗ của người lái xe); các loại xe ô tô chở người quy định cho giấy phép lái xe hạng D2 kéo rơ moóc có khối lượng toàn bộ theo thiết kế đến 750 kg; các loại xe quy định cho giấy phép lái xe các hạng B, C1, C, D1;\n\ni) Hạng D cấp cho người lái xe ô tô chở người (kể cả xe buýt) trên 29 chỗ (không kể chỗ của người lái xe); xe ô tô chở người giường nằm; các loại xe ô tô chở người quy định cho giấy phép lái xe hạng D kéo rơ moóc có khối lượng toàn bộ theo thiết kế đến 750 kg; các loại xe quy định cho giấy phép lái xe các hạng B, C1, C, D1, D2;\n\nk) Hạng BE cấp cho người lái các loại xe ô tô quy định cho giấy phép lái xe hạng B kéo rơ moóc có khối lượng toàn bộ theo thiết kế trên 750 kg;\n\nl) Hạng C1E cấp cho người lái các loại xe ô tô quy định cho giấy phép lái xe hạng C1 kéo rơ moóc có khối lượng toàn bộ theo thiết kế trên 750 kg;\n\nm) Hạng CE cấp cho người lái các loại xe ô tô quy định cho giấy phép lái xe hạng C kéo rơ moóc có khối lượng toàn bộ theo thiết kế trên 750 kg; xe ô tô đầu kéo kéo sơ mi rơ moóc;\n\nn) Hạng D1E cấp cho người lái các loại xe ô tô quy định cho giấy phép lái xe hạng D1 kéo rơ moóc có khối lượng toàn bộ theo thiết kế trên 750 kg;\n\no) Hạng D2E cấp cho người lái các loại xe ô tô quy định cho giấy phép lái xe hạng D2 kéo rơ moóc có khối lượng toàn bộ theo thiết kế trên 750 kg;\n\np) Hạng DE cấp cho người lái các loại xe ô tô quy định cho giấy phép lái xe hạng D kéo rơ moóc có khối lượng toàn bộ theo thiết kế trên 750 kg; xe ô tô chở khách nối toa.\n\n2. Người khuyết tật điều khiển xe mô tô ba bánh dùng cho người khuyết tật được cấp giấy phép lái xe hạng A1.\n\nNgười khuyết tật điều khiển xe ô tô số tự động có kết cấu phù hợp với tình trạng khuyết tật thì được cấp giấy phép lái xe hạng B.\n\n3. Người điều khiển xe chở hàng bốn bánh có gắn động cơ, xe chở người bốn bánh có gắn động cơ phải sử dụng giấy phép lái xe có hạng phù hợp với xe ô tô tải hoặc xe ô tô chở người tương ứng.\n\n4. Người điều khiển xe ô tô có thiết kế, cải tạo với số chỗ ít hơn xe cùng loại, kích thước giới hạn tương đương phải sử dụng giấy phép lái xe có hạng phù hợp với xe ô tô cùng loại, kích thước giới hạn tương đương và có số chỗ nhiều nhất.\n\n5. Thời hạn của giấy phép lái xe được quy định như sau:\n\na) Giấy phép lái xe các hạng A1, A, B1 không thời hạn;\n\nb) Giấy phép lái xe hạng B và hạng C1 có thời hạn 10 năm kể từ ngày cấp;\n\nc) Giấy phép lái xe các hạng C, D1, D2, D, BE, C1E, CE, D1E, D2E và DE có thời hạn 05 năm kể từ ngày cấp.\n\n6. Giấy phép lái xe có giá trị sử dụng trong phạm vi lãnh thổ Việt Nam bao gồm:\n\na) Giấy phép lái xe do cơ quan có thẩm quyền của Việt Nam cấp;\n\nb) Giấy phép lái xe quốc tế và giấy phép lái xe quốc gia phù hợp với loại xe được phép điều khiển do quốc gia là thành viên của Công ước của Liên hợp quốc về Giao thông đường bộ năm 1968 (sau đây gọi là Công ước Viên) cấp;\n\nc) Giấy phép lái xe phù hợp với loại xe được phép điều khiển của nước hoặc vùng lãnh thổ mà Việt Nam ký kết điều ước quốc tế hoặc thỏa thuận quốc tế công nhận giấy phép lái xe của nhau;\n\nd) Giấy phép lái xe nước ngoài phù hợp với loại xe được phép điều khiển do quốc gia được công nhận theo điều ước quốc tế mà nước Cộng hòa xã hội chủ nghĩa Việt Nam là thành viên.\n\n7. Giấy phép lái xe không có hiệu lực trong các trường hợp sau đây:\n\na) Giấy phép lái xe hết thời hạn sử dụng;\n\nb) Giấy phép lái xe bị thu hồi theo quy định tại khoản 5 Điều 62 của Luật này.\n\n8. Giấy phép lái xe quốc tế được quy định như sau:\n\na) Giấy phép lái xe quốc tế là giấy phép lái xe do cơ quan nhà nước có thẩm quyền của quốc gia là thành viên của Công ước Viên cấp theo một mẫu thống nhất; có thời hạn không quá 03 năm kể từ ngày cấp và phải phù hợp với thời hạn còn hiệu lực của giấy phép lái xe quốc gia;', 'a) Giấy phép lái xe hết thời hạn sử dụng;\n\nb) Giấy phép lái xe bị thu hồi theo quy định tại khoản 5 Điều 62 của Luật này.\n\n8. Giấy phép lái xe quốc tế được quy định như sau:\n\na) Giấy phép lái xe quốc tế là giấy phép lái xe do cơ quan nhà nước có thẩm quyền của quốc gia là thành viên của Công ước Viên cấp theo một mẫu thống nhất; có thời hạn không quá 03 năm kể từ ngày cấp và phải phù hợp với thời hạn còn hiệu lực của giấy phép lái xe quốc gia;\n\nb) Người có giấy phép lái xe quốc tế do quốc gia là thành viên của Công ước Viên cấp khi lái xe tham gia giao thông đường bộ trên lãnh thổ Việt Nam phải mang theo giấy phép lái xe quốc tế và giấy phép lái xe quốc gia được cấp phù hợp với hạng xe điều khiển, còn thời hạn sử dụng; phải tuân thủ pháp luật về trật tự, an toàn giao thông đường bộ của Việt Nam;\n\nc) Người có giấy phép lái xe quốc tế vi phạm pháp luật về trật tự, an toàn giao thông đường bộ của Việt Nam mà bị tước quyền sử dụng giấy phép lái xe có thời hạn thì thời gian bị tước quyền sử dụng không quá thời gian người lái xe được phép cư trú tại lãnh thổ Việt Nam;\n\nd) Người Việt Nam hoặc người nước ngoài có thẻ thường trú hoặc thẻ tạm trú tại Việt Nam có giấy phép lái xe do Việt Nam hoặc quốc gia là thành viên của điều ước quốc tế mà nước Cộng hòa xã hội chủ nghĩa Việt Nam là thành viên cấp, còn giá trị sử dụng, nếu có nhu cầu được cấp giấy phép lái xe quốc tế.\n\n9. Bộ trưởng Bộ Giao thông vận tải quy định mẫu giấy phép lái xe và giấy phép lái xe quốc tế, trình tự, thủ tục cấp và việc sử dụng giấy phép lái xe, giấy phép lái xe quốc tế; đối với mẫu giấy phép lái xe, trình tự, thủ tục cấp và việc sử dụng giấy phép lái xe của lực lượng quân đội, công an làm nhiệm vụ quốc phòng, an ninh do Bộ trưởng Bộ Quốc phòng, Bộ trưởng Bộ Công an quy định.\n\nĐiều 58. Điểm của giấy phép lái xe \n\n1. Điểm của giấy phép lái xe được dùng để quản lý việc chấp hành pháp luật về trật tự, an toàn giao thông đường bộ của người lái xe trên hệ thống cơ sở dữ liệu về trật tự, an toàn giao thông đường bộ, bao gồm 12 điểm. Số điểm trừ mỗi lần vi phạm tùy thuộc tính chất, mức độ của hành vi vi phạm pháp luật về trật tự, an toàn giao thông đường bộ. Dữ liệu về điểm trừ giấy phép lái xe của người vi phạm sẽ được cập nhật vào hệ thống cơ sở dữ liệu ngay sau khi quyết định xử phạt có hiệu lực thi hành và thông báo cho người bị trừ điểm giấy phép lái xe biết.\n\n2. Giấy phép lái xe chưa bị trừ hết điểm và không bị trừ điểm trong thời hạn 12 tháng từ ngày bị trừ điểm gần nhất thì được phục hồi đủ 12 điểm.\n\n3. Trường hợp giấy phép lái xe bị trừ hết điểm thì người có giấy phép lái xe không được điều khiển phương tiện tham gia giao thông đường bộ theo giấy phép lái xe đó. Sau thời hạn ít nhất là 06 tháng kể từ ngày bị trừ hết điểm, người có giấy phép lái xe được tham gia kiểm tra nội dung kiến thức pháp luật về trật tự, an toàn giao thông đường bộ theo quy định tại khoản 7 Điều 61 của Luật này do lực lượng Cảnh sát giao thông tổ chức, có kết quả đạt yêu cầu thì được phục hồi đủ 12 điểm.\n\n4. Giấy phép lái xe sau khi đổi, cấp lại, nâng hạng được giữ nguyên số điểm của giấy phép lái xe trước khi đổi, cấp lại, nâng hạng.\n\n5. Người có thẩm quyền xử phạt vi phạm hành chính có thẩm quyền trừ điểm giấy phép lái xe.\n\n6. Chính phủ quy định chi tiết khoản 1 Điều này; quy định trình tự, thủ tục, thẩm quyền trừ điểm, phục hồi điểm giấy phép lái xe; quy định lộ trình thực hiện Điều này. Bộ trưởng Bộ Công an quy định chi tiết khoản 3 Điều này.\n\nĐiều 59. Tuổi, sức khỏe của người điều khiển phương tiện tham gia giao thông đường bộ\n\n1. Độ tuổi của người lái xe, người điều khiển xe máy chuyên dùng được quy định như sau:\n\na) Người đủ 16 tuổi trở lên được điều khiển xe gắn máy;\n\nb) Người đủ 18 tuổi trở lên được cấp giấy phép lái xe hạng A1, A, B1, B, C1, được cấp chứng chỉ bồi dưỡng kiến thức pháp luật về giao thông đường bộ để điều khiển xe máy chuyên dùng tham gia giao thông đường bộ;\n\nc) Người đủ 21 tuổi trở lên được cấp giấy phép lái xe hạng C, BE;\n\nd) Người đủ 24 tuổi trở lên được cấp giấy phép lái xe hạng D1, D2, C1E, CE;\n\nđ) Người đủ 27 tuổi trở lên được cấp giấy phép lái xe hạng D, D1E, D2E, DE;\n\ne) Tuổi tối đa của người lái xe ô tô chở người (kể cả xe buýt) trên 29 chỗ (không kể chỗ của người lái xe), xe ô tô chở người giường nằm là đủ 57 tuổi đối với nam, đủ 55 tuổi đối với nữ.\n\n2. Người điều khiển phương tiện tham gia giao thông đường bộ phải bảo đảm điều kiện sức khỏe phù hợp với từng loại phương tiện được phép điều khiển. Bộ trưởng Bộ Y tế quy định về tiêu chuẩn sức khỏe, việc khám sức khỏe đối với người lái xe, người điều khiển xe máy chuyên dùng; việc khám sức khỏe định kỳ đối với người hành nghề lái xe ô tô; xây dựng cơ sở dữ liệu về sức khỏe của người lái xe, người điều khiển xe máy chuyên dùng.\n\n3. Bộ trưởng Bộ Quốc phòng, Bộ trưởng Bộ Công an quy định độ tuổi của người lái xe trong lực lượng quân đội, công an làm nhiệm vụ quốc phòng, an ninh.\n\nĐiều 60. Đào tạo lái xe\n\n1. Người có nhu cầu được cấp giấy phép lái xe phải được đào tạo nội dung lý thuyết và thực hành theo chương trình đào tạo quy định cho từng hạng giấy phép lái xe.\n\n2. Người học lái xe phải được đào tạo tại các cơ sở đào tạo lái xe hoặc các hình thức đào tạo lái xe khác để cấp mới hoặc nâng hạng giấy phép lái xe.\n\n3. Việc đào tạo để nâng hạng giấy phép lái xe thực hiện đối với những đối tượng sau đây:\n\na) Nâng hạng giấy phép lái xe từ hạng B lên hạng C1 hoặc lên hạng C hoặc lên hạng D1 hoặc lên hạng D2;\n\nb) Nâng hạng giấy phép lái xe từ hạng C1 lên hạng C hoặc lên hạng D1 hoặc lên hạng D2;\n\nc) Nâng hạng giấy phép lái xe từ hạng C lên hạng D1 hoặc lên hạng D2 hoặc lên hạng D;\n\nd) Nâng hạng giấy phép lái xe từ hạng D1 lên hạng D2 hoặc lên hạng D;\n\nđ) Nâng hạng giấy phép lái xe từ hạng D2 lên hạng D;\n\ne) Nâng hạng giấy phép lái xe từ hạng B lên hạng BE, từ hạng C1 lên\xa0 hạng C1E, từ hạng C lên hạng CE, từ hạng D1 lên hạng D1E, từ hạng D2 lên hạng D2E, từ hạng D lên hạng DE.\n\n4.\xa0Người có nhu cầu được đào tạo nâng hạng giấy phép lái xe khi giấy phép lái xe còn hiệu lực, phải có đủ thời gian lái xe an toàn quy định cho từng hạng giấy phép lái xe;\xa0đối với việc nâng hạng giấy phép lái xe lên hạng D1, D2, D thì người có nhu cầu được đào tạo còn phải có trình độ từ trung học cơ sở trở lên.\n\n5. Giấy phép lái xe các hạng C, D1, D2, D, BE, C1E, CE, D1E, D2E, DE phải được đào tạo bằng hình thức đào tạo nâng hạng theo các điều kiện quy định tại khoản 3 và khoản 4 Điều này.\n\n6. Cơ sở đào tạo lái xe ô tô phải đáp ứng các điều kiện do Chính phủ quy định; có giáo trình, giáo án; thực hiện đào tạo theo đúng hình thức, nội dung và chương trình quy định cho từng hạng giấy phép lái xe.\n\n7. Chính phủ quy định chi tiết các hình thức đào tạo lái xe khác quy định tại khoản 2 Điều này; quy định trình tự, thủ tục kiểm tra, đánh giá để cấp, cấp lại và thu hồi giấy phép xe tập lái; quy định tiêu chuẩn của giáo viên dạy lái xe; quy định việc cấp, cấp lại và thu hồi giấy chứng nhận giáo viên dạy lái xe; quy định việc cấp, cấp lại và thu hồi giấy phép đào tạo lái xe.\n\n8. Bộ trưởng Bộ Giao thông vận tải quy định hình thức, nội dung, chương trình đào tạo lái xe, thời gian lái xe an toàn cho từng hạng giấy phép lái xe quy định tại khoản 4 Điều này và quy định tiêu chuẩn của cơ sở đào tạo lái xe mô tô; đối với cơ sở đào tạo, tổ chức đào tạo lái xe cho lực lượng quân đội, công an làm nhiệm vụ quốc phòng, an ninh do Bộ trưởng Bộ Quốc phòng, Bộ trưởng Bộ Công an quy định.\n\nĐiều 61. Sát hạch lái xe\n\n1. Người đã hoàn thành chương trình đào tạo lái xe, có độ tuổi, sức khỏe theo quy định tại Điều 59 của Luật này được đăng ký để tham dự kỳ sát hạch lái xe.\n\n2. Nội dung sát hạch lái xe phải phù hợp với hạng giấy phép lái xe và chương trình đào tạo lái xe.\n\n3. Hoạt động sát hạch lái xe ô tô phải thực hiện tại các trung tâm sát hạch lái xe; hoạt động sát hạch lái xe mô tô thực hiện tại các trung tâm sát hạch lái xe hoặc tại sân tập lái đáp ứng điều kiện, tiêu chuẩn về cơ sở vật chất, kỹ thuật. Hoạt động sát hạch lái xe do cơ quan nhà nước có thẩm quyền thực hiện.', 'khí, khí tài quân sự dạng rơ moóc có khối lượng toàn bộ theo thiết kế đến 750 kg; các loại xe quy định cho Giấy phép lái xe quân sự hạng B, C1, C, D1;\n\ni) Hạng D cấp cho người điều khiển xe ô tô chở người từ trên 29 chỗ (không kể chỗ của người lái xe); các loại xe ô tô chở người quy định cho Giấy phép lái xe hạng D kéo rơ moóc hoặc vũ khí, khí tài quân sự dạng rơ moóc có khối lượng toàn bộ theo thiết kế đến 750 kg; các loại xe quy định cho Giấy phép lái xe quân sự hạng B, C1, C, D1, D2;\n\nk) Hạng C1E cấp cho người điều khiển các loại xe ô tô quy định cho Giấy phép lái xe hạng C1 kéo rơ moóc hoặc vũ khí, khí tài quân sự dạng rơ moóc có khối lượng toàn bộ theo thiết kế trên 750 kg;\n\nl) Hạng CE cấp cho người điều khiển các loại xe ô tô quy định cho Giấy phép lái xe hạng C kéo rơ moóc hoặc vũ khí, khí tài quân sự dạng rơ moóc có khối lượng toàn bộ theo thiết kế trên 750 kg; xe ô tô đầu kéo kéo sơ mi rơ moóc hoặc khí tài quân sự dạng sơ mi rơ moóc;\n\nm) Hạng CX cấp cho người đã có Giấy phép lái xe quân sự hạng C để điều khiển xe xích kéo vũ khí, khí tài quân sự.\n\n2. Người điều khiển xe chở hàng bốn bánh có gắn động cơ, xe chở người bốn bánh có gắn động cơ phải sử dụng giấy phép lái xe có hạng phù hợp với xe ô tô tải và ô tô chở người tương ứng.\n\n3. Người điều khiển xe ô tô có thiết kế, cải tạo với số chỗ ngồi ít hơn ô tô cùng loại, kích thước giới hạn tương đương phải sử dụng giấy phép lái xe có hạng phù hợp với ô tô cùng loại, kích thước giới hạn tương đương và có số chỗ ngồi nhiều nhất.\n\nĐiều 6. Mẫu và thời hạn Giấy phép lái xe quân sự\n\n1. Mẫu Giấy phép lái xe quân sự\n\na) Giấy phép lái xe quân sự thực hiện theo quy định tại Mẫu số 08 kèm theo Thông tư này;\n\nb) Cục trưởng Cục Xe máy - Vận tải/Tổng cục Hậu cần - Kỹ thuật có trách nhiệm quản lý việc sử dụng Giấy phép lái xe quân sự thuộc phạm vi quản lý của Bộ Quốc phòng.\n\n2. Thời hạn sử dụng Giấy phép lái xe quân sự\n\na) Giấy phép lái xe quân sự hạng A1, A, B1 là không thời hạn;\n\nb) Giấy phép lái xe quân sự các hạng B, C1, C, D1, D2, D, C1E, CE, CX có thời hạn 05 năm kể từ ngày cấp;\n\nc) Trường hợp cấp, đổi do lý do khác thời hạn theo thời hạn ghi trên Giấy phép lái xe quân sự.\n\n3. Giấy phép lái xe quân sự không có hiệu lực trong các trường hợp sau:\n\na) Giấy phép lái xe quân sự hết thời hạn sử dụng được ghi trên Giấy phép lái xe;\n\nb) Giấy phép lái xe quân sự bị trừ hết điểm theo quy định tại Điều 7 của Thông tư này;\n\nc) Giấy phép lái xe quân sự có Quyết định thu hồi theo khoản 1 Điều 47 Thông tư này.\n\nĐiều 7. Điểm của Giấy phép lái xe quân sự\n\n1. Điểm của Giấy phép lái xe quân sự gồm 12 điểm theo quy định của Luật Trật tự, an toàn giao thông đường bộ, được dùng để quản lý việc chấp hành pháp luật về trật tự, an toàn giao thông đường bộ của người lái xe. Số điểm trừ mỗi lần tùy theo tính chất, mức độ vi phạm theo quy định của pháp luật. Giấy phép lái xe chưa bị trừ hết điểm và không bị trừ điểm trong thời hạn 12 tháng kể từ ngày bị trừ điểm gần nhất thì được phục hồi đủ 12 điểm.\n\n2. Trường hợp Giấy phép lái xe quân sự bị trừ hết điểm, sau thời hạn ít nhất 06 tháng kể từ ngày bị trừ hết điểm, người có Giấy phép lái xe quân sự bị trừ hết điểm được tham gia kiểm tra kiến thức pháp luật về giao thông đường bộ tổ chức tại cơ sở đào tạo lái xe quân sự theo quy định tại điểm a khoản 1 Điều 40 và khoản 1 Điều 41 Thông tư này, nếu kết quả đặt yêu cầu được phục hồi đủ 12 điểm.\n\n3. Điểm của Giấy phép lái xe quân sự đổi, cấp lại, đào tạo nâng hạng được giữ nguyên như trước khi đổi, cấp lại, đào tạo nâng hạng.\n\nĐiều 8. Độ tuổi của người được cấp Giấy phép lái xe quân sự\n\n1. Quân nhân, công chức quốc phòng, công nhân viên chức quốc phòng, lao động hợp đồng đang phục vụ trong Bộ Quốc phòng đủ 18 tuổi trở lên được cấp Giấy phép lái xe quân sự hạng A1, A, B1, B, C1, C.\n\n2. Quân nhân, công chức quốc phòng, công nhân viên chức quốc phòng, lao động hợp đồng đang phục vụ trong Bộ Quốc phòng đủ 24 tuổi trở lên được cấp Giấy phép lái xe quân sự hạng D1, D2, C1E, CE, CX.\n\nCác trường hợp đào tạo chuyển tiếp từ hạng C lên hạng CE hoặc CX theo chỉ tiêu của Bộ Tổng Tham mưu, đủ 19 tuổi trở lên.\n\n3. Quân nhân, công chức quốc phòng, công nhân viên chức quốc phòng, lao động hợp đồng đang phục vụ trong Bộ Quốc phòng đủ 27 tuổi trở lên được cấp Giấy phép lái xe quân sự hạng D. Độ tuổi tối đa của người được cấp Giấy phép lái xe quân sự hạng D là đủ 57 tuổi đối với nam và đủ 55 tuổi đối với nữ.\n\nChương II\n\nĐÀO TẠO LÁI XE QUÂN SỰ\n\nMục I. NGƯỜI HỌC\n\nĐiều 9. Điều kiện đối với người học lái xe quân sự\n\n1. Quân nhân, công chức quốc phòng, công nhân viên chức quốc phòng, lao động hợp đồng đang phục vụ trong Bộ Quốc phòng có đủ các điều kiện: Tiêu chuẩn về tuổi đời, thời gian công tác, sức khỏe, trình độ văn hóa, phẩm chất chính trị theo quy định của Bộ Quốc phòng.\n\nĐối với lao động hợp đồng: Chỉ đào tạo nâng hạng khi có đủ điều kiện, tiêu chuẩn quy định tại khoản 1 Điều này.\n\n2. Đối với người học nâng hạng Giấy phép lái xe quân sự phải có thời gian lái xe và số km lái xe an toàn như sau:\n\na) Từ hạng B lên hạng C1; hạng C1 lên hạng C, C1E; hạng C lên hạng D1, CE, CX; hạng D1 lên hạng D2; hạng D2 lên hạng D: Có thời gian lái xe 02 năm trở lên và 30.000 km lái xe an toàn trở lên (trừ các trường hợp đào tạo chuyển tiếp từ hạng C lên hạng CE hoặc CX theo chỉ tiêu của Bộ Tổng Tham mưu);\n\nb) Từ hạng B lên hạng C, D1; hạng C1 lên D1; hạng C lên hạng D2; hạng D1 lên hạng D: Có thời gian lái xe 03 năm trở lên và có 50.000 km lái xe an toàn trở lên;\n\nc) Từ hạng B lên hạng D2, từ hạng C1 lên hạng D2, từ hạng C lên hạng D: Có thời gian lái xe 05 năm trở lên và 100.000 km lái xe an toàn trở lên.\n\n3. Đối với người học nâng hạng Giấy phép lái xe quân sự lên hạng D1, D2, D ngoài các quy định tại các khoản 1, 2 Điều này phải có bằng tốt nghiệp trung học cơ sở trở lên.\n\nĐiều 10. Hồ sơ đào tạo lái xe\n\n1. Hạng A1, A, gồm:\n\na) Kế hoạch huấn luyện lái xe mô tô quân sự hạng A1, A (kèm theo danh sách học viên) của cơ quan, đơn vị theo quy định tại Mẫu số 13 Phụ lục I kèm theo Thông tư này;\n\nb) Đơn đề nghị học và sát hạch, cấp Giấy phép lái xe quân sự của cá nhân có xác nhận của Thủ trưởng cơ quan, đơn vị trực tiếp quản lý từ cấp trung đoàn hoặc tương đương trở lên theo quy định tại Mẫu số 01 Phụ lục I kèm theo Thông tư này;\n\nc) Bản sao Căn cước công dân (căn cước) và bản sao một trong các loại giấy tờ sau: Giấy chứng minh quân nhân, công chức quốc phòng, công nhân và viên chức quốc phòng, quyết định nhập ngũ, tuyển dụng, phiếu quân nhân, thẻ học viên, quyết định thăng, phong quân hàm, nâng lương gần nhất còn hiệu lực;\n\nd) Giấy chứng nhận sức khỏe theo quy định do quân y cấp trung đoàn và tương đương trở lên xác nhận theo quy định tại Mẫu số 02 Phụ lục I kèm theo Thông tư này;\n\nđ) Hai ảnh màu cỡ 2 x 3 cm (ảnh chụp trên nền màu xanh; quân nhân mặc quân phục thường dùng; công chức quốc phòng, công nhân và viên chức quốc phòng, lao động hợp đồng mặc đồng phục; đeo biển tên theo quy định, không đội mũ).\n\n2. Hạng B1, B, C1, C, gồm:\n\na) Kế hoạch đào tạo lái xe quân sự hạng B1, B, C1, C (kèm theo danh sách học viên) của cơ sở đào tạo;\n\nb) Bản sao quyết định giao chỉ tiêu đào tạo nhân viên kỹ thuật sơ cấp của Tổng Tham mưu trưởng đối với trường hợp đào tạo theo chỉ tiêu nhiệm vụ; văn bản đề nghị đào tạo lái xe của Thủ trưởng cơ quan, đơn vị đầu mối trực thuộc Bộ Quốc phòng đối với trường hợp gửi đào tạo;\n\nc) Hồ sơ quy định tại các điểm b, c, d, đ khoản 1 Điều này;\n\n3. Đào tạo nâng hạng Giấy phép lái xe quân sự\n\nNgoài hồ sơ quy định tại khoản 2 Điều này phải bổ sung các giấy tờ như sau:\n\na) Bản khai thời gian lái xe và số km lái xe an toàn quy định cho từng hạng xe có xác nhận của Thủ trưởng cơ quan, đơn vị trực tiếp quản lý từ cấp trung đoàn hoặc tương đương trở lên theo quy định tại Mẫu số 03 Phụ lục I kèm theo Thông tư này;\n\nb) Bản sao Giấy phép lái xe quân sự đang sử dụng.\n\nMục II. CƠ SỞ ĐÀO TẠO LÁI XE QUÂN SỰ\n\nĐiều 11. Nhiệm vụ của cơ sở đào tạo lái xe quân sự']","**Nguồn văn bản:** /content/drive/MyDrive/ITProject_data/new_law/36_2024_QH15_444251.docx

**Tên văn bản:** (Không có tiêu đề trong metadata)

**(Không có điều khoản):** (Không có article_title trong metadata)

**Nội dung:**

Điều kiện của giấy phép lái xe hạng D1E:

Cấp cho người lái các loại xe ô tô quy định cho giấy phép lái xe hạng D1 kéo rơ moóc có khối lượng toàn bộ theo thiết kế trên 750 kg.

**Tóm lại:** Giấy phép lái xe hạng D1E cấp cho người lái xe ô tô hạng D1 kéo rơ moóc trên 750 kg.
",Hạng D1E cho phép lái xe ô tô chở người từ 10 đến 30 chỗ ngồi kéo rơ moóc có trọng tải trên 750 kg.,0.75,0.8726761371603396,0.0,0.9999999999
8,Giấy phép lái xe hạng D2E cho phép lái những loại xe nào?,"['a) Chứng nhận đăng ký xe hoặc bản sao Chứng nhận đăng ký xe có chứng thực kèm bản gốc giấy tờ xác nhận của tổ chức tín dụng, chi nhánh ngân hàng nước ngoài còn hiệu lực trong trường hợp xe đang được thế chấp tại tổ chức tín dụng, chi nhánh ngân hàng nước ngoài;\n\nb) Giấy phép lái xe phù hợp với loại xe đang điều khiển;\n\nc) Chứng nhận kiểm định an toàn kỹ thuật và bảo vệ môi trường đối với xe cơ giới theo quy định của pháp luật;\n\nd) Chứng nhận bảo hiểm bắt buộc trách nhiệm dân sự của chủ xe cơ giới.\n\n2. Người điều khiển xe máy chuyên dùng tham gia giao thông đường bộ phải đủ tuổi, sức khỏe theo quy định của pháp luật; có bằng hoặc chứng chỉ điều khiển xe máy chuyên dùng phù hợp loại xe máy chuyên dùng đang điều khiển; có giấy phép lái xe đang còn điểm, còn hiệu lực hoặc chứng chỉ bồi dưỡng kiến thức pháp luật về giao thông đường bộ. Khi tham gia giao thông đường bộ, người điều khiển xe máy chuyên dùng phải mang theo các loại giấy tờ sau đây:\n\na) Chứng nhận đăng ký xe hoặc bản sao Chứng nhận đăng ký xe có chứng thực kèm bản gốc Giấy biên nhận còn hiệu lực của tổ chức tín dụng, chi nhánh ngân hàng nước ngoài trong trường hợp xe đang được thế chấp tại tổ chức tín dụng, chi nhánh ngân hàng nước ngoài;\n\nb) Bằng hoặc chứng chỉ điều khiển xe máy chuyên dùng;\n\nc) Giấy phép lái xe hoặc chứng chỉ bồi dưỡng kiến thức pháp luật về giao thông đường bộ;\n\nd) Chứng nhận kiểm định an toàn kỹ thuật và bảo vệ môi trường đối với xe máy chuyên dùng theo quy định của pháp luật;\n\nđ) Chứng nhận bảo hiểm bắt buộc trách nhiệm dân sự theo quy định của pháp luật.\n\n3. Trường hợp giấy tờ quy định tại khoản 1 và khoản 2 Điều này đã được tích hợp vào tài khoản định danh điện tử thì việc xuất trình, kiểm tra có thể thực hiện thông qua tài khoản định danh điện tử.\n\n4. Người lái xe gắn máy tham gia giao thông đường bộ phải hiểu biết quy tắc giao thông đường bộ, có kỹ năng điều khiển phương tiện; đủ điều kiện về độ tuổi, sức khỏe theo quy định tại điểm a khoản 1 và khoản 2 Điều 59 của Luật này.\n\n5. Người tập lái xe ô tô, người dự sát hạch lái xe ô tô khi tham gia giao thông đường bộ phải thực hành trên xe tập lái, xe sát hạch trên tuyến đường tập lái, tuyến đường sát hạch, có giáo viên dạy lái hoặc sát hạch viên bảo trợ tay lái. Giáo viên dạy lái, sát hạch viên phải mang theo các loại giấy tờ quy định tại khoản 1 Điều này.\n\nĐiều 57. Giấy phép lái xe\n\n1. Giấy phép lái xe bao gồm các hạng sau đây:\n\na) Hạng A1 cấp cho người lái xe mô tô hai bánh có dung tích xi-lanh đến 125 cm3 hoặc có công suất động cơ điện đến 11 kW;\n\nb) Hạng A cấp cho người lái xe mô tô hai bánh có dung tích xi-lanh\xa0 trên 125 cm3\xa0hoặc có công suất động cơ điện trên 11 kW và các loại xe quy định cho giấy phép lái xe hạng A1;\n\nc) Hạng B1 cấp cho người lái xe mô tô ba bánh và các loại xe quy định cho giấy phép lái xe hạng A1;\n\nd) Hạng B cấp cho người lái xe ô tô chở người đến 08 chỗ (không kể chỗ của người lái xe); xe ô tô tải và ô tô chuyên dùng có khối lượng toàn bộ theo thiết kế đến 3.500 kg; các loại xe ô tô quy định cho giấy phép lái xe hạng B kéo rơ moóc có khối lượng toàn bộ theo thiết kế đến 750 kg; \n\nđ) Hạng C1 cấp cho người lái xe ô tô tải và ô tô chuyên dùng có khối lượng toàn bộ theo thiết kế trên 3.500 kg đến 7.500 kg; các loại xe ô tô tải quy định cho giấy phép lái xe hạng C1 kéo rơ moóc có khối lượng toàn bộ theo thiết kế đến 750 kg; các loại xe quy định cho giấy phép lái xe hạng B;\n\ne) Hạng C cấp cho người lái xe ô tô tải và ô tô chuyên dùng có khối lượng toàn bộ theo thiết kế trên 7.500 kg; các loại xe ô tô tải quy định cho giấy phép lái xe hạng C kéo rơ moóc có khối lượng toàn bộ theo thiết kế đến 750 kg; các loại xe quy định cho giấy phép lái xe hạng B và hạng C1;\n\ng) Hạng D1 cấp cho người lái xe ô tô chở người trên 08 chỗ (không kể chỗ của người lái xe) đến 16 chỗ (không kể chỗ của người lái xe); các loại xe ô tô chở người quy định cho giấy phép lái xe hạng D1 kéo rơ moóc có khối lượng toàn bộ theo thiết kế đến 750 kg; các loại xe quy định cho giấy phép lái xe các hạng B, C1, C;\n\nh) Hạng D2 cấp cho người lái xe ô tô chở người (kể cả xe buýt) trên 16 chỗ (không kể chỗ của người lái xe) đến 29 chỗ (không kể chỗ của người lái xe); các loại xe ô tô chở người quy định cho giấy phép lái xe hạng D2 kéo rơ moóc có khối lượng toàn bộ theo thiết kế đến 750 kg; các loại xe quy định cho giấy phép lái xe các hạng B, C1, C, D1;\n\ni) Hạng D cấp cho người lái xe ô tô chở người (kể cả xe buýt) trên 29 chỗ (không kể chỗ của người lái xe); xe ô tô chở người giường nằm; các loại xe ô tô chở người quy định cho giấy phép lái xe hạng D kéo rơ moóc có khối lượng toàn bộ theo thiết kế đến 750 kg; các loại xe quy định cho giấy phép lái xe các hạng B, C1, C, D1, D2;\n\nk) Hạng BE cấp cho người lái các loại xe ô tô quy định cho giấy phép lái xe hạng B kéo rơ moóc có khối lượng toàn bộ theo thiết kế trên 750 kg;\n\nl) Hạng C1E cấp cho người lái các loại xe ô tô quy định cho giấy phép lái xe hạng C1 kéo rơ moóc có khối lượng toàn bộ theo thiết kế trên 750 kg;\n\nm) Hạng CE cấp cho người lái các loại xe ô tô quy định cho giấy phép lái xe hạng C kéo rơ moóc có khối lượng toàn bộ theo thiết kế trên 750 kg; xe ô tô đầu kéo kéo sơ mi rơ moóc;\n\nn) Hạng D1E cấp cho người lái các loại xe ô tô quy định cho giấy phép lái xe hạng D1 kéo rơ moóc có khối lượng toàn bộ theo thiết kế trên 750 kg;\n\no) Hạng D2E cấp cho người lái các loại xe ô tô quy định cho giấy phép lái xe hạng D2 kéo rơ moóc có khối lượng toàn bộ theo thiết kế trên 750 kg;\n\np) Hạng DE cấp cho người lái các loại xe ô tô quy định cho giấy phép lái xe hạng D kéo rơ moóc có khối lượng toàn bộ theo thiết kế trên 750 kg; xe ô tô chở khách nối toa.\n\n2. Người khuyết tật điều khiển xe mô tô ba bánh dùng cho người khuyết tật được cấp giấy phép lái xe hạng A1.\n\nNgười khuyết tật điều khiển xe ô tô số tự động có kết cấu phù hợp với tình trạng khuyết tật thì được cấp giấy phép lái xe hạng B.\n\n3. Người điều khiển xe chở hàng bốn bánh có gắn động cơ, xe chở người bốn bánh có gắn động cơ phải sử dụng giấy phép lái xe có hạng phù hợp với xe ô tô tải hoặc xe ô tô chở người tương ứng.\n\n4. Người điều khiển xe ô tô có thiết kế, cải tạo với số chỗ ít hơn xe cùng loại, kích thước giới hạn tương đương phải sử dụng giấy phép lái xe có hạng phù hợp với xe ô tô cùng loại, kích thước giới hạn tương đương và có số chỗ nhiều nhất.\n\n5. Thời hạn của giấy phép lái xe được quy định như sau:\n\na) Giấy phép lái xe các hạng A1, A, B1 không thời hạn;\n\nb) Giấy phép lái xe hạng B và hạng C1 có thời hạn 10 năm kể từ ngày cấp;\n\nc) Giấy phép lái xe các hạng C, D1, D2, D, BE, C1E, CE, D1E, D2E và DE có thời hạn 05 năm kể từ ngày cấp.\n\n6. Giấy phép lái xe có giá trị sử dụng trong phạm vi lãnh thổ Việt Nam bao gồm:\n\na) Giấy phép lái xe do cơ quan có thẩm quyền của Việt Nam cấp;\n\nb) Giấy phép lái xe quốc tế và giấy phép lái xe quốc gia phù hợp với loại xe được phép điều khiển do quốc gia là thành viên của Công ước của Liên hợp quốc về Giao thông đường bộ năm 1968 (sau đây gọi là Công ước Viên) cấp;\n\nc) Giấy phép lái xe phù hợp với loại xe được phép điều khiển của nước hoặc vùng lãnh thổ mà Việt Nam ký kết điều ước quốc tế hoặc thỏa thuận quốc tế công nhận giấy phép lái xe của nhau;\n\nd) Giấy phép lái xe nước ngoài phù hợp với loại xe được phép điều khiển do quốc gia được công nhận theo điều ước quốc tế mà nước Cộng hòa xã hội chủ nghĩa Việt Nam là thành viên.\n\n7. Giấy phép lái xe không có hiệu lực trong các trường hợp sau đây:\n\na) Giấy phép lái xe hết thời hạn sử dụng;\n\nb) Giấy phép lái xe bị thu hồi theo quy định tại khoản 5 Điều 62 của Luật này.\n\n8. Giấy phép lái xe quốc tế được quy định như sau:\n\na) Giấy phép lái xe quốc tế là giấy phép lái xe do cơ quan nhà nước có thẩm quyền của quốc gia là thành viên của Công ước Viên cấp theo một mẫu thống nhất; có thời hạn không quá 03 năm kể từ ngày cấp và phải phù hợp với thời hạn còn hiệu lực của giấy phép lái xe quốc gia;', '8. Ủy ban nhân dân các cấp, trong phạm vi nhiệm vụ, quyền hạn của mình, thực hiện quản lý nhà nước về trật tự, an toàn giao thông đường bộ tại địa phương.\n\nChương IX\n\nĐIỀU KHOẢN THI HÀNH\n\nĐiều 88. Hiệu lực thi hành\n\n1. Luật này có hiệu lực thi hành từ ngày 01 tháng 01 năm 2025, trừ trường hợp quy định tại khoản 2 Điều này.\n\n2. Khoản 3 Điều 10 của Luật này có hiệu lực thi hành từ ngày 01 tháng 01 năm 2026.\n\n3. Luật Giao thông đường bộ số 23/2008/QH12 đã được sửa đổi, bổ sung một số điều theo Luật số 35/2018/QH14 và Luật số 44/2019/QH14 hết hiệu lực kể từ ngày Luật này có hiệu lực thi hành, trừ trường hợp quy định tại các khoản 1, 2, 5 và 6 Điều 89 của Luật này.\n\n4. Nghị quyết số 73/2022/QH15 của Quốc hội về thí điểm đấu giá biển số xe ô tô hết hiệu lực kể từ ngày Luật này có hiệu lực thi hành, trừ trường hợp quy định tại khoản 7 Điều 89 của Luật này.\n\nĐiều 89. Quy định chuyển tiếp\n\n1. Giấy phép lái xe được cấp trước ngày Luật này có hiệu lực thi hành được tiếp tục sử dụng theo thời hạn ghi trên giấy phép lái xe. \n\n2. Giấy phép lái xe được cấp trước ngày Luật này có hiệu lực thi hành nếu chưa thực hiện đổi, cấp lại theo quy định của Luật này có hiệu lực sử dụng như sau:\n\na) Giấy phép lái xe hạng A1 được tiếp tục điều khiển xe mô tô hai bánh có dung tích xi-lanh từ 50 cm3\xa0đến dưới 175 cm3 hoặc có công suất động cơ điện từ 04 kW đến dưới 14 kW;\n\nb) Giấy phép lái xe hạng A2 được tiếp tục điều khiển xe mô tô hai bánh có dung tích xi-lanh từ 175 cm3\xa0trở lên hoặc có công suất động cơ điện từ 14 kW trở lên và các loại xe quy định cho giấy phép lái xe hạng A1 quy định tại điểm a khoản này;\n\nc) Giấy phép lái xe hạng A3 được tiếp tục điều khiển xe mô tô ba bánh, các loại xe quy định cho giấy phép lái xe hạng A1 quy định tại điểm a khoản này và các xe tương tự;\n\nd) Giấy phép lái xe hạng A4 được tiếp tục điều khiển máy kéo có trọng tải đến 1.000 kg;\n\nđ) Giấy phép lái xe hạng B1 số tự động cấp cho người không hành nghề lái xe được tiếp tục điều khiển xe ô tô số tự động chở người đến 08 chỗ (không kể chỗ của người lái xe); xe ô tô tải, kể cả ô tô tải chuyên dùng số tự động có trọng tải dưới 3.500 kg;\n\ne) Giấy phép lái xe hạng B1 cấp cho người không hành nghề lái xe được tiếp tục điều khiển xe ô tô chở người đến 08 chỗ (không kể chỗ của người lái xe); xe ô tô tải, máy kéo có trọng tải dưới 3.500 kg;\n\ng) Giấy phép lái xe hạng B2 cấp cho người hành nghề lái xe được tiếp tục điều khiển xe ô tô chở người đến 08 chỗ (không kể chỗ của người lái xe); xe ô tô tải, máy kéo có trọng tải dưới 3.500 kg;\n\nh) Giấy phép lái xe hạng C được tiếp tục điều khiển xe ô tô tải, máy kéo có trọng tải từ 3.500 kg trở lên và các loại xe quy định cho các giấy phép lái xe hạng B1, B2 quy định tại các điểm đ, e và g khoản này;\n\ni) Giấy phép lái xe hạng D được tiếp tục điều khiển xe ô tô chở người từ 09 chỗ (không kể chỗ của người lái xe) đến 29 chỗ (không kể chỗ của người lái xe) và các loại xe quy định cho các giấy phép lái xe hạng B1, B2, C quy định tại các điểm đ, e, g và h khoản này;\n\nk) Giấy phép lái xe hạng E được tiếp tục điều khiển xe ô tô chở người trên 29 chỗ (không kể chỗ của người lái xe) và các loại xe quy định cho các giấy phép lái xe hạng B1, B2, C, D quy định tại các điểm đ, e, g, h và i khoản này;\n\nl) Giấy phép lái xe hạng FB2, FD được tiếp tục điều khiển các loại xe quy định cho giấy phép lái xe hạng B2, D quy định tại điểm g và điểm i khoản này khi kéo rơ moóc; giấy phép lái xe hạng FC được tiếp tục điều khiển các loại xe quy định cho giấy phép lái xe hạng C quy định tại điểm h khoản này khi kéo rơ moóc, đầu kéo kéo sơ mi rơ moóc; giấy phép lái xe hạng FE được tiếp tục điều khiển các loại xe quy định cho giấy phép lái xe hạng E quy định tại điểm k khoản này khi kéo rơ moóc\xa0hoặc xe ô tô chở khách nối toa.\n\n3. Trường hợp người có giấy phép lái xe đã được cấp trước ngày Luật này có hiệu lực thi hành có nhu cầu đổi, cấp lại giấy phép lái xe thì thực hiện như sau:\n\na) Giấy phép lái xe hạng A1 được đổi, cấp lại sang giấy phép lái xe hạng A với điều kiện hạn chế là chỉ được điều khiển xe mô tô hai bánh có dung tích xi-lanh đến dưới 175 cm3 hoặc có công suất động cơ điện đến dưới 14 kW;\n\nb) Giấy phép lái xe hạng A2 được đổi, cấp lại sang giấy phép lái xe hạng A;\n\nc) Giấy phép lái xe hạng A3 được đổi, cấp lại sang giấy phép lái xe hạng B1;\n\nd) Giấy phép lái xe hạng A4 được đổi, cấp lại sang chứng chỉ điều khiển xe máy chuyên dùng cho người điều khiển máy kéo có trọng tải đến 1.000 kg và chứng chỉ bồi dưỡng kiến thức pháp luật về giao thông đường bộ cho người điều khiển xe máy chuyên dùng;\n\nđ) Giấy phép lái xe hạng B1 số tự động được đổi, cấp lại sang giấy phép lái xe hạng B với điều kiện hạn chế là chỉ được điều khiển xe ô tô số tự động;\n\ne) Giấy phép lái xe hạng B1, B2 được đổi, cấp lại sang giấy phép lái xe hạng B hoặc hạng C1 và chứng chỉ điều khiển xe máy chuyên dùng cho người điều khiển máy kéo có trọng tải đến 3.500 kg;\n\ng) Giấy phép lái xe hạng C giữ nguyên và đổi, cấp lại cùng hạng và chứng chỉ điều khiển xe máy chuyên dùng cho người điều khiển máy kéo có trọng tải trên 3.500 kg;\n\nh) Giấy phép lái xe hạng D được đổi, cấp lại sang giấy phép lái xe hạng D2 và chứng chỉ điều khiển xe máy chuyên dùng cho người điều khiển máy kéo có trọng tải trên 3.500 kg;\n\ni) Giấy phép lái xe hạng E được đổi, cấp lại sang giấy phép lái xe hạng D và chứng chỉ điều khiển xe máy chuyên dùng cho người điều khiển máy kéo có trọng tải trên 3.500 kg;\n\nk) Giấy phép lái xe hạng FB2 được đổi, cấp lại sang giấy phép lái xe hạng BE hoặc hạng C1E và chứng chỉ điều khiển xe máy chuyên dùng cho người điều khiển máy kéo có trọng tải đến 3.500 kg;\n\nl) Giấy phép lái xe hạng FC được đổi, cấp lại sang giấy phép lái xe hạng CE và chứng chỉ điều khiển xe máy chuyên dùng cho người điều khiển máy kéo có trọng tải trên 3.500 kg;\n\nm) Giấy phép lái xe hạng FD được đổi, cấp lại sang giấy phép lái xe hạng D2E và chứng chỉ điều khiển xe máy chuyên dùng cho người điều khiển máy kéo có trọng tải trên 3.500 kg;\n\nn) Giấy phép lái xe hạng FE được đổi, cấp lại sang giấy phép lái xe hạng DE và chứng chỉ điều khiển xe máy chuyên dùng cho người điều khiển máy kéo có trọng tải trên 3.500 kg.\n\n4. Người học lái xe đã được đào tạo lái xe trước ngày Luật này có hiệu lực thi hành hoặc đang được đào tạo lái xe tại ngày Luật này có hiệu lực thi hành chưa được sát hạch, cấp giấy phép lái xe thì được sát hạch, cấp giấy phép lái xe theo hạng giấy phép lái xe đổi, cấp lại quy định tại khoản 3 Điều này.\n\n5. Chứng nhận đăng ký xe, biển số xe máy chuyên dùng cấp trước ngày Luật này có hiệu lực thi hành vẫn có giá trị sử dụng.\n\n6. Chứng nhận chất lượng an toàn kỹ thuật và bảo vệ môi trường được cấp trước ngày Luật này có hiệu lực thi hành thì có giá trị sử dụng đến hết thời hạn ghi trên giấy chứng nhận đó.\n\n7. Việc đấu giá biển số xe ô tô được thực hiện trước ngày Luật này có hiệu lực thi hành và đến ngày Luật này có hiệu lực thi hành đã được cấp văn bản xác nhận biển số xe ô tô trúng đấu giá thì tiếp tục thực hiện theo Nghị quyết số 73/2022/QH15 của Quốc hội về thí điểm đấu giá biển số xe ô tô; trường hợp chưa được cấp xác nhận biển số xe ô tô trúng đấu giá thì tiếp tục thực hiện theo Nghị quyết số 73/2022/QH15 của Quốc hội về thí điểm đấu giá biển số xe ô tô và quy định tại điểm d khoản 1 Điều 38 của Luật này./.\n\nLuật này được Quốc hội nước Cộng hòa xã hội chủ nghĩa Việt Nam khóa XV, kỳ họp thứ 7 thông qua ngày 27 tháng 6 năm 2024.\n\nE-pas: 60179 CHỦ TỊCH QUỐC HỘI\n\n\n\n\nTrần Thanh Mẫn', 'a) Giấy phép lái xe hết thời hạn sử dụng;\n\nb) Giấy phép lái xe bị thu hồi theo quy định tại khoản 5 Điều 62 của Luật này.\n\n8. Giấy phép lái xe quốc tế được quy định như sau:\n\na) Giấy phép lái xe quốc tế là giấy phép lái xe do cơ quan nhà nước có thẩm quyền của quốc gia là thành viên của Công ước Viên cấp theo một mẫu thống nhất; có thời hạn không quá 03 năm kể từ ngày cấp và phải phù hợp với thời hạn còn hiệu lực của giấy phép lái xe quốc gia;\n\nb) Người có giấy phép lái xe quốc tế do quốc gia là thành viên của Công ước Viên cấp khi lái xe tham gia giao thông đường bộ trên lãnh thổ Việt Nam phải mang theo giấy phép lái xe quốc tế và giấy phép lái xe quốc gia được cấp phù hợp với hạng xe điều khiển, còn thời hạn sử dụng; phải tuân thủ pháp luật về trật tự, an toàn giao thông đường bộ của Việt Nam;\n\nc) Người có giấy phép lái xe quốc tế vi phạm pháp luật về trật tự, an toàn giao thông đường bộ của Việt Nam mà bị tước quyền sử dụng giấy phép lái xe có thời hạn thì thời gian bị tước quyền sử dụng không quá thời gian người lái xe được phép cư trú tại lãnh thổ Việt Nam;\n\nd) Người Việt Nam hoặc người nước ngoài có thẻ thường trú hoặc thẻ tạm trú tại Việt Nam có giấy phép lái xe do Việt Nam hoặc quốc gia là thành viên của điều ước quốc tế mà nước Cộng hòa xã hội chủ nghĩa Việt Nam là thành viên cấp, còn giá trị sử dụng, nếu có nhu cầu được cấp giấy phép lái xe quốc tế.\n\n9. Bộ trưởng Bộ Giao thông vận tải quy định mẫu giấy phép lái xe và giấy phép lái xe quốc tế, trình tự, thủ tục cấp và việc sử dụng giấy phép lái xe, giấy phép lái xe quốc tế; đối với mẫu giấy phép lái xe, trình tự, thủ tục cấp và việc sử dụng giấy phép lái xe của lực lượng quân đội, công an làm nhiệm vụ quốc phòng, an ninh do Bộ trưởng Bộ Quốc phòng, Bộ trưởng Bộ Công an quy định.\n\nĐiều 58. Điểm của giấy phép lái xe \n\n1. Điểm của giấy phép lái xe được dùng để quản lý việc chấp hành pháp luật về trật tự, an toàn giao thông đường bộ của người lái xe trên hệ thống cơ sở dữ liệu về trật tự, an toàn giao thông đường bộ, bao gồm 12 điểm. Số điểm trừ mỗi lần vi phạm tùy thuộc tính chất, mức độ của hành vi vi phạm pháp luật về trật tự, an toàn giao thông đường bộ. Dữ liệu về điểm trừ giấy phép lái xe của người vi phạm sẽ được cập nhật vào hệ thống cơ sở dữ liệu ngay sau khi quyết định xử phạt có hiệu lực thi hành và thông báo cho người bị trừ điểm giấy phép lái xe biết.\n\n2. Giấy phép lái xe chưa bị trừ hết điểm và không bị trừ điểm trong thời hạn 12 tháng từ ngày bị trừ điểm gần nhất thì được phục hồi đủ 12 điểm.\n\n3. Trường hợp giấy phép lái xe bị trừ hết điểm thì người có giấy phép lái xe không được điều khiển phương tiện tham gia giao thông đường bộ theo giấy phép lái xe đó. Sau thời hạn ít nhất là 06 tháng kể từ ngày bị trừ hết điểm, người có giấy phép lái xe được tham gia kiểm tra nội dung kiến thức pháp luật về trật tự, an toàn giao thông đường bộ theo quy định tại khoản 7 Điều 61 của Luật này do lực lượng Cảnh sát giao thông tổ chức, có kết quả đạt yêu cầu thì được phục hồi đủ 12 điểm.\n\n4. Giấy phép lái xe sau khi đổi, cấp lại, nâng hạng được giữ nguyên số điểm của giấy phép lái xe trước khi đổi, cấp lại, nâng hạng.\n\n5. Người có thẩm quyền xử phạt vi phạm hành chính có thẩm quyền trừ điểm giấy phép lái xe.\n\n6. Chính phủ quy định chi tiết khoản 1 Điều này; quy định trình tự, thủ tục, thẩm quyền trừ điểm, phục hồi điểm giấy phép lái xe; quy định lộ trình thực hiện Điều này. Bộ trưởng Bộ Công an quy định chi tiết khoản 3 Điều này.\n\nĐiều 59. Tuổi, sức khỏe của người điều khiển phương tiện tham gia giao thông đường bộ\n\n1. Độ tuổi của người lái xe, người điều khiển xe máy chuyên dùng được quy định như sau:\n\na) Người đủ 16 tuổi trở lên được điều khiển xe gắn máy;\n\nb) Người đủ 18 tuổi trở lên được cấp giấy phép lái xe hạng A1, A, B1, B, C1, được cấp chứng chỉ bồi dưỡng kiến thức pháp luật về giao thông đường bộ để điều khiển xe máy chuyên dùng tham gia giao thông đường bộ;\n\nc) Người đủ 21 tuổi trở lên được cấp giấy phép lái xe hạng C, BE;\n\nd) Người đủ 24 tuổi trở lên được cấp giấy phép lái xe hạng D1, D2, C1E, CE;\n\nđ) Người đủ 27 tuổi trở lên được cấp giấy phép lái xe hạng D, D1E, D2E, DE;\n\ne) Tuổi tối đa của người lái xe ô tô chở người (kể cả xe buýt) trên 29 chỗ (không kể chỗ của người lái xe), xe ô tô chở người giường nằm là đủ 57 tuổi đối với nam, đủ 55 tuổi đối với nữ.\n\n2. Người điều khiển phương tiện tham gia giao thông đường bộ phải bảo đảm điều kiện sức khỏe phù hợp với từng loại phương tiện được phép điều khiển. Bộ trưởng Bộ Y tế quy định về tiêu chuẩn sức khỏe, việc khám sức khỏe đối với người lái xe, người điều khiển xe máy chuyên dùng; việc khám sức khỏe định kỳ đối với người hành nghề lái xe ô tô; xây dựng cơ sở dữ liệu về sức khỏe của người lái xe, người điều khiển xe máy chuyên dùng.\n\n3. Bộ trưởng Bộ Quốc phòng, Bộ trưởng Bộ Công an quy định độ tuổi của người lái xe trong lực lượng quân đội, công an làm nhiệm vụ quốc phòng, an ninh.\n\nĐiều 60. Đào tạo lái xe\n\n1. Người có nhu cầu được cấp giấy phép lái xe phải được đào tạo nội dung lý thuyết và thực hành theo chương trình đào tạo quy định cho từng hạng giấy phép lái xe.\n\n2. Người học lái xe phải được đào tạo tại các cơ sở đào tạo lái xe hoặc các hình thức đào tạo lái xe khác để cấp mới hoặc nâng hạng giấy phép lái xe.\n\n3. Việc đào tạo để nâng hạng giấy phép lái xe thực hiện đối với những đối tượng sau đây:\n\na) Nâng hạng giấy phép lái xe từ hạng B lên hạng C1 hoặc lên hạng C hoặc lên hạng D1 hoặc lên hạng D2;\n\nb) Nâng hạng giấy phép lái xe từ hạng C1 lên hạng C hoặc lên hạng D1 hoặc lên hạng D2;\n\nc) Nâng hạng giấy phép lái xe từ hạng C lên hạng D1 hoặc lên hạng D2 hoặc lên hạng D;\n\nd) Nâng hạng giấy phép lái xe từ hạng D1 lên hạng D2 hoặc lên hạng D;\n\nđ) Nâng hạng giấy phép lái xe từ hạng D2 lên hạng D;\n\ne) Nâng hạng giấy phép lái xe từ hạng B lên hạng BE, từ hạng C1 lên\xa0 hạng C1E, từ hạng C lên hạng CE, từ hạng D1 lên hạng D1E, từ hạng D2 lên hạng D2E, từ hạng D lên hạng DE.\n\n4.\xa0Người có nhu cầu được đào tạo nâng hạng giấy phép lái xe khi giấy phép lái xe còn hiệu lực, phải có đủ thời gian lái xe an toàn quy định cho từng hạng giấy phép lái xe;\xa0đối với việc nâng hạng giấy phép lái xe lên hạng D1, D2, D thì người có nhu cầu được đào tạo còn phải có trình độ từ trung học cơ sở trở lên.\n\n5. Giấy phép lái xe các hạng C, D1, D2, D, BE, C1E, CE, D1E, D2E, DE phải được đào tạo bằng hình thức đào tạo nâng hạng theo các điều kiện quy định tại khoản 3 và khoản 4 Điều này.\n\n6. Cơ sở đào tạo lái xe ô tô phải đáp ứng các điều kiện do Chính phủ quy định; có giáo trình, giáo án; thực hiện đào tạo theo đúng hình thức, nội dung và chương trình quy định cho từng hạng giấy phép lái xe.\n\n7. Chính phủ quy định chi tiết các hình thức đào tạo lái xe khác quy định tại khoản 2 Điều này; quy định trình tự, thủ tục kiểm tra, đánh giá để cấp, cấp lại và thu hồi giấy phép xe tập lái; quy định tiêu chuẩn của giáo viên dạy lái xe; quy định việc cấp, cấp lại và thu hồi giấy chứng nhận giáo viên dạy lái xe; quy định việc cấp, cấp lại và thu hồi giấy phép đào tạo lái xe.\n\n8. Bộ trưởng Bộ Giao thông vận tải quy định hình thức, nội dung, chương trình đào tạo lái xe, thời gian lái xe an toàn cho từng hạng giấy phép lái xe quy định tại khoản 4 Điều này và quy định tiêu chuẩn của cơ sở đào tạo lái xe mô tô; đối với cơ sở đào tạo, tổ chức đào tạo lái xe cho lực lượng quân đội, công an làm nhiệm vụ quốc phòng, an ninh do Bộ trưởng Bộ Quốc phòng, Bộ trưởng Bộ Công an quy định.\n\nĐiều 61. Sát hạch lái xe\n\n1. Người đã hoàn thành chương trình đào tạo lái xe, có độ tuổi, sức khỏe theo quy định tại Điều 59 của Luật này được đăng ký để tham dự kỳ sát hạch lái xe.\n\n2. Nội dung sát hạch lái xe phải phù hợp với hạng giấy phép lái xe và chương trình đào tạo lái xe.\n\n3. Hoạt động sát hạch lái xe ô tô phải thực hiện tại các trung tâm sát hạch lái xe; hoạt động sát hạch lái xe mô tô thực hiện tại các trung tâm sát hạch lái xe hoặc tại sân tập lái đáp ứng điều kiện, tiêu chuẩn về cơ sở vật chất, kỹ thuật. Hoạt động sát hạch lái xe do cơ quan nhà nước có thẩm quyền thực hiện.']","**Nguồn văn bản:** /content/drive/MyDrive/ITProject_data/new_law/36_2024_QH15_444251.docx

**Tên văn bản:** (Không có tiêu đề trong metadata)

**(Không có điều khoản trong metadata):**

**Nội dung:**

1. Giấy phép lái xe bao gồm các hạng sau đây:

        a) Hạng A1 cấp cho người lái xe mô tô hai bánh có dung tích xi-lanh đến 125 cm3 hoặc có công suất động cơ điện đến 11 kW.

        b) Hạng A cấp cho người lái xe mô tô hai bánh có dung tích xi-lanh trên 125 cm3 hoặc có công suất động cơ điện trên 11 kW và các loại xe quy định cho giấy phép lái xe hạng A1.

        c) Hạng B1 cấp cho người lái xe mô tô ba bánh và các loại xe quy định cho giấy phép lái xe hạng A1.

        d) Hạng B cấp cho người lái xe ô tô chở người đến 08 chỗ (không kể chỗ của người lái xe); xe ô tô tải và ô tô chuyên dùng có khối lượng toàn bộ theo thiết kế đến 3.500 kg; các loại xe ô tô quy định cho giấy phép lái xe hạng B kéo rơ moóc có khối lượng toàn bộ theo thiết kế đến 750 kg.

        đ) Hạng C1 cấp cho người lái xe ô tô tải và ô tô chuyên dùng có khối lượng toàn bộ theo thiết kế trên 3.500 kg đến 7.500 kg; các loại xe ô tô tải quy định cho giấy phép lái xe hạng C1 kéo rơ moóc có khối lượng toàn bộ theo thiết kế đến 750 kg; các loại xe quy định cho giấy phép lái xe hạng B.

        e) Hạng C cấp cho người lái xe ô tô tải và ô tô chuyên dùng có khối lượng toàn bộ theo thiết kế trên 7.500 kg; các loại xe ô tô tải quy định cho giấy phép lái xe hạng C kéo rơ moóc có khối lượng toàn bộ theo thiết kế đến 750 kg; các loại xe quy định cho giấy phép lái xe hạng B và hạng C1.

        g) Hạng D1 cấp cho người lái xe ô tô chở người trên 08 chỗ (không kể chỗ của người lái xe) đến 16 chỗ (không kể chỗ của người lái xe); các loại xe ô tô chở người quy định cho giấy phép lái xe hạng D1 kéo rơ moóc có khối lượng toàn bộ theo thiết kế đến 750 kg; các loại xe quy định cho giấy phép lái xe các hạng B, C1, C.

        h) Hạng D2 cấp cho người lái xe ô tô chở người (kể cả xe buýt) trên 16 chỗ (không kể chỗ của người lái xe) đến 29 chỗ (không kể chỗ của người lái xe); các loại xe ô tô chở người quy định cho giấy phép lái xe hạng D2 kéo rơ moóc có khối lượng toàn bộ theo thiết kế đến 750 kg; các loại xe quy định cho giấy phép lái xe các hạng B, C1, C, D1.

        i) Hạng D cấp cho người lái xe ô tô chở người (kể cả xe buýt) trên 29 chỗ (không kể chỗ của người lái xe); xe ô tô chở người giường nằm; các loại xe ô tô chở người quy định cho giấy phép lái xe hạng D kéo rơ moóc có khối lượng toàn bộ theo thiết kế đến 750 kg; các loại xe quy định cho giấy phép lái xe các hạng B, C1, C, D1, D2.

        k) Hạng BE cấp cho người lái các loại xe ô tô quy định cho giấy phép lái xe hạng B kéo rơ moóc có khối lượng toàn bộ theo thiết kế trên 750 kg.

        l) Hạng C1E cấp cho người lái các loại xe ô tô quy định cho giấy phép lái xe hạng C1 kéo rơ moóc có khối lượng toàn bộ theo thiết kế trên 750 kg.

        m) Hạng CE cấp cho người lái các loại xe ô tô quy định cho giấy phép lái xe hạng C kéo rơ moóc có khối lượng toàn bộ theo thiết kế trên 750 kg; xe ô tô đầu kéo kéo sơ mi rơ moóc.

        n) Hạng D1E cấp cho người lái các loại xe ô tô quy định cho giấy phép lái xe hạng D1 kéo rơ moóc có khối lượng toàn bộ theo thiết kế trên 750 kg.

        o) Hạng D2E cấp cho người lái các loại xe ô tô quy định cho giấy phép lái xe hạng D2 kéo rơ moóc có khối lượng toàn bộ theo thiết kế trên 750 kg.

        p) Hạng DE cấp cho người lái các loại xe ô tô quy định cho giấy phép lái xe hạng D kéo rơ moóc có khối lượng toàn bộ theo thiết kế trên 750 kg; xe ô tô chở khách nối toa.


**Tóm lại:** Giấy phép lái xe hạng D2E cho phép lái xe ô tô chở người từ 16 đến 29 chỗ (không kể chỗ người lái) kéo rơ moóc có khối lượng toàn bộ theo thiết kế trên 750 kg, và tất cả các loại xe thuộc hạng B, C1, C, D1, D2.
",Hạng D2E cho phép lái xe ô tô chở người trên 30 chỗ ngồi kéo rơ moóc có trọng tải trên 750 kg.,0.8571428571428571,0.6604419594775103,0.0,0.0
9,Giấy phép lái xe hạng DE cho phép lái những loại xe nào?,"['a) Chứng nhận đăng ký xe hoặc bản sao Chứng nhận đăng ký xe có chứng thực kèm bản gốc giấy tờ xác nhận của tổ chức tín dụng, chi nhánh ngân hàng nước ngoài còn hiệu lực trong trường hợp xe đang được thế chấp tại tổ chức tín dụng, chi nhánh ngân hàng nước ngoài;\n\nb) Giấy phép lái xe phù hợp với loại xe đang điều khiển;\n\nc) Chứng nhận kiểm định an toàn kỹ thuật và bảo vệ môi trường đối với xe cơ giới theo quy định của pháp luật;\n\nd) Chứng nhận bảo hiểm bắt buộc trách nhiệm dân sự của chủ xe cơ giới.\n\n2. Người điều khiển xe máy chuyên dùng tham gia giao thông đường bộ phải đủ tuổi, sức khỏe theo quy định của pháp luật; có bằng hoặc chứng chỉ điều khiển xe máy chuyên dùng phù hợp loại xe máy chuyên dùng đang điều khiển; có giấy phép lái xe đang còn điểm, còn hiệu lực hoặc chứng chỉ bồi dưỡng kiến thức pháp luật về giao thông đường bộ. Khi tham gia giao thông đường bộ, người điều khiển xe máy chuyên dùng phải mang theo các loại giấy tờ sau đây:\n\na) Chứng nhận đăng ký xe hoặc bản sao Chứng nhận đăng ký xe có chứng thực kèm bản gốc Giấy biên nhận còn hiệu lực của tổ chức tín dụng, chi nhánh ngân hàng nước ngoài trong trường hợp xe đang được thế chấp tại tổ chức tín dụng, chi nhánh ngân hàng nước ngoài;\n\nb) Bằng hoặc chứng chỉ điều khiển xe máy chuyên dùng;\n\nc) Giấy phép lái xe hoặc chứng chỉ bồi dưỡng kiến thức pháp luật về giao thông đường bộ;\n\nd) Chứng nhận kiểm định an toàn kỹ thuật và bảo vệ môi trường đối với xe máy chuyên dùng theo quy định của pháp luật;\n\nđ) Chứng nhận bảo hiểm bắt buộc trách nhiệm dân sự theo quy định của pháp luật.\n\n3. Trường hợp giấy tờ quy định tại khoản 1 và khoản 2 Điều này đã được tích hợp vào tài khoản định danh điện tử thì việc xuất trình, kiểm tra có thể thực hiện thông qua tài khoản định danh điện tử.\n\n4. Người lái xe gắn máy tham gia giao thông đường bộ phải hiểu biết quy tắc giao thông đường bộ, có kỹ năng điều khiển phương tiện; đủ điều kiện về độ tuổi, sức khỏe theo quy định tại điểm a khoản 1 và khoản 2 Điều 59 của Luật này.\n\n5. Người tập lái xe ô tô, người dự sát hạch lái xe ô tô khi tham gia giao thông đường bộ phải thực hành trên xe tập lái, xe sát hạch trên tuyến đường tập lái, tuyến đường sát hạch, có giáo viên dạy lái hoặc sát hạch viên bảo trợ tay lái. Giáo viên dạy lái, sát hạch viên phải mang theo các loại giấy tờ quy định tại khoản 1 Điều này.\n\nĐiều 57. Giấy phép lái xe\n\n1. Giấy phép lái xe bao gồm các hạng sau đây:\n\na) Hạng A1 cấp cho người lái xe mô tô hai bánh có dung tích xi-lanh đến 125 cm3 hoặc có công suất động cơ điện đến 11 kW;\n\nb) Hạng A cấp cho người lái xe mô tô hai bánh có dung tích xi-lanh\xa0 trên 125 cm3\xa0hoặc có công suất động cơ điện trên 11 kW và các loại xe quy định cho giấy phép lái xe hạng A1;\n\nc) Hạng B1 cấp cho người lái xe mô tô ba bánh và các loại xe quy định cho giấy phép lái xe hạng A1;\n\nd) Hạng B cấp cho người lái xe ô tô chở người đến 08 chỗ (không kể chỗ của người lái xe); xe ô tô tải và ô tô chuyên dùng có khối lượng toàn bộ theo thiết kế đến 3.500 kg; các loại xe ô tô quy định cho giấy phép lái xe hạng B kéo rơ moóc có khối lượng toàn bộ theo thiết kế đến 750 kg; \n\nđ) Hạng C1 cấp cho người lái xe ô tô tải và ô tô chuyên dùng có khối lượng toàn bộ theo thiết kế trên 3.500 kg đến 7.500 kg; các loại xe ô tô tải quy định cho giấy phép lái xe hạng C1 kéo rơ moóc có khối lượng toàn bộ theo thiết kế đến 750 kg; các loại xe quy định cho giấy phép lái xe hạng B;\n\ne) Hạng C cấp cho người lái xe ô tô tải và ô tô chuyên dùng có khối lượng toàn bộ theo thiết kế trên 7.500 kg; các loại xe ô tô tải quy định cho giấy phép lái xe hạng C kéo rơ moóc có khối lượng toàn bộ theo thiết kế đến 750 kg; các loại xe quy định cho giấy phép lái xe hạng B và hạng C1;\n\ng) Hạng D1 cấp cho người lái xe ô tô chở người trên 08 chỗ (không kể chỗ của người lái xe) đến 16 chỗ (không kể chỗ của người lái xe); các loại xe ô tô chở người quy định cho giấy phép lái xe hạng D1 kéo rơ moóc có khối lượng toàn bộ theo thiết kế đến 750 kg; các loại xe quy định cho giấy phép lái xe các hạng B, C1, C;\n\nh) Hạng D2 cấp cho người lái xe ô tô chở người (kể cả xe buýt) trên 16 chỗ (không kể chỗ của người lái xe) đến 29 chỗ (không kể chỗ của người lái xe); các loại xe ô tô chở người quy định cho giấy phép lái xe hạng D2 kéo rơ moóc có khối lượng toàn bộ theo thiết kế đến 750 kg; các loại xe quy định cho giấy phép lái xe các hạng B, C1, C, D1;\n\ni) Hạng D cấp cho người lái xe ô tô chở người (kể cả xe buýt) trên 29 chỗ (không kể chỗ của người lái xe); xe ô tô chở người giường nằm; các loại xe ô tô chở người quy định cho giấy phép lái xe hạng D kéo rơ moóc có khối lượng toàn bộ theo thiết kế đến 750 kg; các loại xe quy định cho giấy phép lái xe các hạng B, C1, C, D1, D2;\n\nk) Hạng BE cấp cho người lái các loại xe ô tô quy định cho giấy phép lái xe hạng B kéo rơ moóc có khối lượng toàn bộ theo thiết kế trên 750 kg;\n\nl) Hạng C1E cấp cho người lái các loại xe ô tô quy định cho giấy phép lái xe hạng C1 kéo rơ moóc có khối lượng toàn bộ theo thiết kế trên 750 kg;\n\nm) Hạng CE cấp cho người lái các loại xe ô tô quy định cho giấy phép lái xe hạng C kéo rơ moóc có khối lượng toàn bộ theo thiết kế trên 750 kg; xe ô tô đầu kéo kéo sơ mi rơ moóc;\n\nn) Hạng D1E cấp cho người lái các loại xe ô tô quy định cho giấy phép lái xe hạng D1 kéo rơ moóc có khối lượng toàn bộ theo thiết kế trên 750 kg;\n\no) Hạng D2E cấp cho người lái các loại xe ô tô quy định cho giấy phép lái xe hạng D2 kéo rơ moóc có khối lượng toàn bộ theo thiết kế trên 750 kg;\n\np) Hạng DE cấp cho người lái các loại xe ô tô quy định cho giấy phép lái xe hạng D kéo rơ moóc có khối lượng toàn bộ theo thiết kế trên 750 kg; xe ô tô chở khách nối toa.\n\n2. Người khuyết tật điều khiển xe mô tô ba bánh dùng cho người khuyết tật được cấp giấy phép lái xe hạng A1.\n\nNgười khuyết tật điều khiển xe ô tô số tự động có kết cấu phù hợp với tình trạng khuyết tật thì được cấp giấy phép lái xe hạng B.\n\n3. Người điều khiển xe chở hàng bốn bánh có gắn động cơ, xe chở người bốn bánh có gắn động cơ phải sử dụng giấy phép lái xe có hạng phù hợp với xe ô tô tải hoặc xe ô tô chở người tương ứng.\n\n4. Người điều khiển xe ô tô có thiết kế, cải tạo với số chỗ ít hơn xe cùng loại, kích thước giới hạn tương đương phải sử dụng giấy phép lái xe có hạng phù hợp với xe ô tô cùng loại, kích thước giới hạn tương đương và có số chỗ nhiều nhất.\n\n5. Thời hạn của giấy phép lái xe được quy định như sau:\n\na) Giấy phép lái xe các hạng A1, A, B1 không thời hạn;\n\nb) Giấy phép lái xe hạng B và hạng C1 có thời hạn 10 năm kể từ ngày cấp;\n\nc) Giấy phép lái xe các hạng C, D1, D2, D, BE, C1E, CE, D1E, D2E và DE có thời hạn 05 năm kể từ ngày cấp.\n\n6. Giấy phép lái xe có giá trị sử dụng trong phạm vi lãnh thổ Việt Nam bao gồm:\n\na) Giấy phép lái xe do cơ quan có thẩm quyền của Việt Nam cấp;\n\nb) Giấy phép lái xe quốc tế và giấy phép lái xe quốc gia phù hợp với loại xe được phép điều khiển do quốc gia là thành viên của Công ước của Liên hợp quốc về Giao thông đường bộ năm 1968 (sau đây gọi là Công ước Viên) cấp;\n\nc) Giấy phép lái xe phù hợp với loại xe được phép điều khiển của nước hoặc vùng lãnh thổ mà Việt Nam ký kết điều ước quốc tế hoặc thỏa thuận quốc tế công nhận giấy phép lái xe của nhau;\n\nd) Giấy phép lái xe nước ngoài phù hợp với loại xe được phép điều khiển do quốc gia được công nhận theo điều ước quốc tế mà nước Cộng hòa xã hội chủ nghĩa Việt Nam là thành viên.\n\n7. Giấy phép lái xe không có hiệu lực trong các trường hợp sau đây:\n\na) Giấy phép lái xe hết thời hạn sử dụng;\n\nb) Giấy phép lái xe bị thu hồi theo quy định tại khoản 5 Điều 62 của Luật này.\n\n8. Giấy phép lái xe quốc tế được quy định như sau:\n\na) Giấy phép lái xe quốc tế là giấy phép lái xe do cơ quan nhà nước có thẩm quyền của quốc gia là thành viên của Công ước Viên cấp theo một mẫu thống nhất; có thời hạn không quá 03 năm kể từ ngày cấp và phải phù hợp với thời hạn còn hiệu lực của giấy phép lái xe quốc gia;', '8. Ủy ban nhân dân các cấp, trong phạm vi nhiệm vụ, quyền hạn của mình, thực hiện quản lý nhà nước về trật tự, an toàn giao thông đường bộ tại địa phương.\n\nChương IX\n\nĐIỀU KHOẢN THI HÀNH\n\nĐiều 88. Hiệu lực thi hành\n\n1. Luật này có hiệu lực thi hành từ ngày 01 tháng 01 năm 2025, trừ trường hợp quy định tại khoản 2 Điều này.\n\n2. Khoản 3 Điều 10 của Luật này có hiệu lực thi hành từ ngày 01 tháng 01 năm 2026.\n\n3. Luật Giao thông đường bộ số 23/2008/QH12 đã được sửa đổi, bổ sung một số điều theo Luật số 35/2018/QH14 và Luật số 44/2019/QH14 hết hiệu lực kể từ ngày Luật này có hiệu lực thi hành, trừ trường hợp quy định tại các khoản 1, 2, 5 và 6 Điều 89 của Luật này.\n\n4. Nghị quyết số 73/2022/QH15 của Quốc hội về thí điểm đấu giá biển số xe ô tô hết hiệu lực kể từ ngày Luật này có hiệu lực thi hành, trừ trường hợp quy định tại khoản 7 Điều 89 của Luật này.\n\nĐiều 89. Quy định chuyển tiếp\n\n1. Giấy phép lái xe được cấp trước ngày Luật này có hiệu lực thi hành được tiếp tục sử dụng theo thời hạn ghi trên giấy phép lái xe. \n\n2. Giấy phép lái xe được cấp trước ngày Luật này có hiệu lực thi hành nếu chưa thực hiện đổi, cấp lại theo quy định của Luật này có hiệu lực sử dụng như sau:\n\na) Giấy phép lái xe hạng A1 được tiếp tục điều khiển xe mô tô hai bánh có dung tích xi-lanh từ 50 cm3\xa0đến dưới 175 cm3 hoặc có công suất động cơ điện từ 04 kW đến dưới 14 kW;\n\nb) Giấy phép lái xe hạng A2 được tiếp tục điều khiển xe mô tô hai bánh có dung tích xi-lanh từ 175 cm3\xa0trở lên hoặc có công suất động cơ điện từ 14 kW trở lên và các loại xe quy định cho giấy phép lái xe hạng A1 quy định tại điểm a khoản này;\n\nc) Giấy phép lái xe hạng A3 được tiếp tục điều khiển xe mô tô ba bánh, các loại xe quy định cho giấy phép lái xe hạng A1 quy định tại điểm a khoản này và các xe tương tự;\n\nd) Giấy phép lái xe hạng A4 được tiếp tục điều khiển máy kéo có trọng tải đến 1.000 kg;\n\nđ) Giấy phép lái xe hạng B1 số tự động cấp cho người không hành nghề lái xe được tiếp tục điều khiển xe ô tô số tự động chở người đến 08 chỗ (không kể chỗ của người lái xe); xe ô tô tải, kể cả ô tô tải chuyên dùng số tự động có trọng tải dưới 3.500 kg;\n\ne) Giấy phép lái xe hạng B1 cấp cho người không hành nghề lái xe được tiếp tục điều khiển xe ô tô chở người đến 08 chỗ (không kể chỗ của người lái xe); xe ô tô tải, máy kéo có trọng tải dưới 3.500 kg;\n\ng) Giấy phép lái xe hạng B2 cấp cho người hành nghề lái xe được tiếp tục điều khiển xe ô tô chở người đến 08 chỗ (không kể chỗ của người lái xe); xe ô tô tải, máy kéo có trọng tải dưới 3.500 kg;\n\nh) Giấy phép lái xe hạng C được tiếp tục điều khiển xe ô tô tải, máy kéo có trọng tải từ 3.500 kg trở lên và các loại xe quy định cho các giấy phép lái xe hạng B1, B2 quy định tại các điểm đ, e và g khoản này;\n\ni) Giấy phép lái xe hạng D được tiếp tục điều khiển xe ô tô chở người từ 09 chỗ (không kể chỗ của người lái xe) đến 29 chỗ (không kể chỗ của người lái xe) và các loại xe quy định cho các giấy phép lái xe hạng B1, B2, C quy định tại các điểm đ, e, g và h khoản này;\n\nk) Giấy phép lái xe hạng E được tiếp tục điều khiển xe ô tô chở người trên 29 chỗ (không kể chỗ của người lái xe) và các loại xe quy định cho các giấy phép lái xe hạng B1, B2, C, D quy định tại các điểm đ, e, g, h và i khoản này;\n\nl) Giấy phép lái xe hạng FB2, FD được tiếp tục điều khiển các loại xe quy định cho giấy phép lái xe hạng B2, D quy định tại điểm g và điểm i khoản này khi kéo rơ moóc; giấy phép lái xe hạng FC được tiếp tục điều khiển các loại xe quy định cho giấy phép lái xe hạng C quy định tại điểm h khoản này khi kéo rơ moóc, đầu kéo kéo sơ mi rơ moóc; giấy phép lái xe hạng FE được tiếp tục điều khiển các loại xe quy định cho giấy phép lái xe hạng E quy định tại điểm k khoản này khi kéo rơ moóc\xa0hoặc xe ô tô chở khách nối toa.\n\n3. Trường hợp người có giấy phép lái xe đã được cấp trước ngày Luật này có hiệu lực thi hành có nhu cầu đổi, cấp lại giấy phép lái xe thì thực hiện như sau:\n\na) Giấy phép lái xe hạng A1 được đổi, cấp lại sang giấy phép lái xe hạng A với điều kiện hạn chế là chỉ được điều khiển xe mô tô hai bánh có dung tích xi-lanh đến dưới 175 cm3 hoặc có công suất động cơ điện đến dưới 14 kW;\n\nb) Giấy phép lái xe hạng A2 được đổi, cấp lại sang giấy phép lái xe hạng A;\n\nc) Giấy phép lái xe hạng A3 được đổi, cấp lại sang giấy phép lái xe hạng B1;\n\nd) Giấy phép lái xe hạng A4 được đổi, cấp lại sang chứng chỉ điều khiển xe máy chuyên dùng cho người điều khiển máy kéo có trọng tải đến 1.000 kg và chứng chỉ bồi dưỡng kiến thức pháp luật về giao thông đường bộ cho người điều khiển xe máy chuyên dùng;\n\nđ) Giấy phép lái xe hạng B1 số tự động được đổi, cấp lại sang giấy phép lái xe hạng B với điều kiện hạn chế là chỉ được điều khiển xe ô tô số tự động;\n\ne) Giấy phép lái xe hạng B1, B2 được đổi, cấp lại sang giấy phép lái xe hạng B hoặc hạng C1 và chứng chỉ điều khiển xe máy chuyên dùng cho người điều khiển máy kéo có trọng tải đến 3.500 kg;\n\ng) Giấy phép lái xe hạng C giữ nguyên và đổi, cấp lại cùng hạng và chứng chỉ điều khiển xe máy chuyên dùng cho người điều khiển máy kéo có trọng tải trên 3.500 kg;\n\nh) Giấy phép lái xe hạng D được đổi, cấp lại sang giấy phép lái xe hạng D2 và chứng chỉ điều khiển xe máy chuyên dùng cho người điều khiển máy kéo có trọng tải trên 3.500 kg;\n\ni) Giấy phép lái xe hạng E được đổi, cấp lại sang giấy phép lái xe hạng D và chứng chỉ điều khiển xe máy chuyên dùng cho người điều khiển máy kéo có trọng tải trên 3.500 kg;\n\nk) Giấy phép lái xe hạng FB2 được đổi, cấp lại sang giấy phép lái xe hạng BE hoặc hạng C1E và chứng chỉ điều khiển xe máy chuyên dùng cho người điều khiển máy kéo có trọng tải đến 3.500 kg;\n\nl) Giấy phép lái xe hạng FC được đổi, cấp lại sang giấy phép lái xe hạng CE và chứng chỉ điều khiển xe máy chuyên dùng cho người điều khiển máy kéo có trọng tải trên 3.500 kg;\n\nm) Giấy phép lái xe hạng FD được đổi, cấp lại sang giấy phép lái xe hạng D2E và chứng chỉ điều khiển xe máy chuyên dùng cho người điều khiển máy kéo có trọng tải trên 3.500 kg;\n\nn) Giấy phép lái xe hạng FE được đổi, cấp lại sang giấy phép lái xe hạng DE và chứng chỉ điều khiển xe máy chuyên dùng cho người điều khiển máy kéo có trọng tải trên 3.500 kg.\n\n4. Người học lái xe đã được đào tạo lái xe trước ngày Luật này có hiệu lực thi hành hoặc đang được đào tạo lái xe tại ngày Luật này có hiệu lực thi hành chưa được sát hạch, cấp giấy phép lái xe thì được sát hạch, cấp giấy phép lái xe theo hạng giấy phép lái xe đổi, cấp lại quy định tại khoản 3 Điều này.\n\n5. Chứng nhận đăng ký xe, biển số xe máy chuyên dùng cấp trước ngày Luật này có hiệu lực thi hành vẫn có giá trị sử dụng.\n\n6. Chứng nhận chất lượng an toàn kỹ thuật và bảo vệ môi trường được cấp trước ngày Luật này có hiệu lực thi hành thì có giá trị sử dụng đến hết thời hạn ghi trên giấy chứng nhận đó.\n\n7. Việc đấu giá biển số xe ô tô được thực hiện trước ngày Luật này có hiệu lực thi hành và đến ngày Luật này có hiệu lực thi hành đã được cấp văn bản xác nhận biển số xe ô tô trúng đấu giá thì tiếp tục thực hiện theo Nghị quyết số 73/2022/QH15 của Quốc hội về thí điểm đấu giá biển số xe ô tô; trường hợp chưa được cấp xác nhận biển số xe ô tô trúng đấu giá thì tiếp tục thực hiện theo Nghị quyết số 73/2022/QH15 của Quốc hội về thí điểm đấu giá biển số xe ô tô và quy định tại điểm d khoản 1 Điều 38 của Luật này./.\n\nLuật này được Quốc hội nước Cộng hòa xã hội chủ nghĩa Việt Nam khóa XV, kỳ họp thứ 7 thông qua ngày 27 tháng 6 năm 2024.\n\nE-pas: 60179 CHỦ TỊCH QUỐC HỘI\n\n\n\n\nTrần Thanh Mẫn', 'a) Giấy phép lái xe hết thời hạn sử dụng;\n\nb) Giấy phép lái xe bị thu hồi theo quy định tại khoản 5 Điều 62 của Luật này.\n\n8. Giấy phép lái xe quốc tế được quy định như sau:\n\na) Giấy phép lái xe quốc tế là giấy phép lái xe do cơ quan nhà nước có thẩm quyền của quốc gia là thành viên của Công ước Viên cấp theo một mẫu thống nhất; có thời hạn không quá 03 năm kể từ ngày cấp và phải phù hợp với thời hạn còn hiệu lực của giấy phép lái xe quốc gia;\n\nb) Người có giấy phép lái xe quốc tế do quốc gia là thành viên của Công ước Viên cấp khi lái xe tham gia giao thông đường bộ trên lãnh thổ Việt Nam phải mang theo giấy phép lái xe quốc tế và giấy phép lái xe quốc gia được cấp phù hợp với hạng xe điều khiển, còn thời hạn sử dụng; phải tuân thủ pháp luật về trật tự, an toàn giao thông đường bộ của Việt Nam;\n\nc) Người có giấy phép lái xe quốc tế vi phạm pháp luật về trật tự, an toàn giao thông đường bộ của Việt Nam mà bị tước quyền sử dụng giấy phép lái xe có thời hạn thì thời gian bị tước quyền sử dụng không quá thời gian người lái xe được phép cư trú tại lãnh thổ Việt Nam;\n\nd) Người Việt Nam hoặc người nước ngoài có thẻ thường trú hoặc thẻ tạm trú tại Việt Nam có giấy phép lái xe do Việt Nam hoặc quốc gia là thành viên của điều ước quốc tế mà nước Cộng hòa xã hội chủ nghĩa Việt Nam là thành viên cấp, còn giá trị sử dụng, nếu có nhu cầu được cấp giấy phép lái xe quốc tế.\n\n9. Bộ trưởng Bộ Giao thông vận tải quy định mẫu giấy phép lái xe và giấy phép lái xe quốc tế, trình tự, thủ tục cấp và việc sử dụng giấy phép lái xe, giấy phép lái xe quốc tế; đối với mẫu giấy phép lái xe, trình tự, thủ tục cấp và việc sử dụng giấy phép lái xe của lực lượng quân đội, công an làm nhiệm vụ quốc phòng, an ninh do Bộ trưởng Bộ Quốc phòng, Bộ trưởng Bộ Công an quy định.\n\nĐiều 58. Điểm của giấy phép lái xe \n\n1. Điểm của giấy phép lái xe được dùng để quản lý việc chấp hành pháp luật về trật tự, an toàn giao thông đường bộ của người lái xe trên hệ thống cơ sở dữ liệu về trật tự, an toàn giao thông đường bộ, bao gồm 12 điểm. Số điểm trừ mỗi lần vi phạm tùy thuộc tính chất, mức độ của hành vi vi phạm pháp luật về trật tự, an toàn giao thông đường bộ. Dữ liệu về điểm trừ giấy phép lái xe của người vi phạm sẽ được cập nhật vào hệ thống cơ sở dữ liệu ngay sau khi quyết định xử phạt có hiệu lực thi hành và thông báo cho người bị trừ điểm giấy phép lái xe biết.\n\n2. Giấy phép lái xe chưa bị trừ hết điểm và không bị trừ điểm trong thời hạn 12 tháng từ ngày bị trừ điểm gần nhất thì được phục hồi đủ 12 điểm.\n\n3. Trường hợp giấy phép lái xe bị trừ hết điểm thì người có giấy phép lái xe không được điều khiển phương tiện tham gia giao thông đường bộ theo giấy phép lái xe đó. Sau thời hạn ít nhất là 06 tháng kể từ ngày bị trừ hết điểm, người có giấy phép lái xe được tham gia kiểm tra nội dung kiến thức pháp luật về trật tự, an toàn giao thông đường bộ theo quy định tại khoản 7 Điều 61 của Luật này do lực lượng Cảnh sát giao thông tổ chức, có kết quả đạt yêu cầu thì được phục hồi đủ 12 điểm.\n\n4. Giấy phép lái xe sau khi đổi, cấp lại, nâng hạng được giữ nguyên số điểm của giấy phép lái xe trước khi đổi, cấp lại, nâng hạng.\n\n5. Người có thẩm quyền xử phạt vi phạm hành chính có thẩm quyền trừ điểm giấy phép lái xe.\n\n6. Chính phủ quy định chi tiết khoản 1 Điều này; quy định trình tự, thủ tục, thẩm quyền trừ điểm, phục hồi điểm giấy phép lái xe; quy định lộ trình thực hiện Điều này. Bộ trưởng Bộ Công an quy định chi tiết khoản 3 Điều này.\n\nĐiều 59. Tuổi, sức khỏe của người điều khiển phương tiện tham gia giao thông đường bộ\n\n1. Độ tuổi của người lái xe, người điều khiển xe máy chuyên dùng được quy định như sau:\n\na) Người đủ 16 tuổi trở lên được điều khiển xe gắn máy;\n\nb) Người đủ 18 tuổi trở lên được cấp giấy phép lái xe hạng A1, A, B1, B, C1, được cấp chứng chỉ bồi dưỡng kiến thức pháp luật về giao thông đường bộ để điều khiển xe máy chuyên dùng tham gia giao thông đường bộ;\n\nc) Người đủ 21 tuổi trở lên được cấp giấy phép lái xe hạng C, BE;\n\nd) Người đủ 24 tuổi trở lên được cấp giấy phép lái xe hạng D1, D2, C1E, CE;\n\nđ) Người đủ 27 tuổi trở lên được cấp giấy phép lái xe hạng D, D1E, D2E, DE;\n\ne) Tuổi tối đa của người lái xe ô tô chở người (kể cả xe buýt) trên 29 chỗ (không kể chỗ của người lái xe), xe ô tô chở người giường nằm là đủ 57 tuổi đối với nam, đủ 55 tuổi đối với nữ.\n\n2. Người điều khiển phương tiện tham gia giao thông đường bộ phải bảo đảm điều kiện sức khỏe phù hợp với từng loại phương tiện được phép điều khiển. Bộ trưởng Bộ Y tế quy định về tiêu chuẩn sức khỏe, việc khám sức khỏe đối với người lái xe, người điều khiển xe máy chuyên dùng; việc khám sức khỏe định kỳ đối với người hành nghề lái xe ô tô; xây dựng cơ sở dữ liệu về sức khỏe của người lái xe, người điều khiển xe máy chuyên dùng.\n\n3. Bộ trưởng Bộ Quốc phòng, Bộ trưởng Bộ Công an quy định độ tuổi của người lái xe trong lực lượng quân đội, công an làm nhiệm vụ quốc phòng, an ninh.\n\nĐiều 60. Đào tạo lái xe\n\n1. Người có nhu cầu được cấp giấy phép lái xe phải được đào tạo nội dung lý thuyết và thực hành theo chương trình đào tạo quy định cho từng hạng giấy phép lái xe.\n\n2. Người học lái xe phải được đào tạo tại các cơ sở đào tạo lái xe hoặc các hình thức đào tạo lái xe khác để cấp mới hoặc nâng hạng giấy phép lái xe.\n\n3. Việc đào tạo để nâng hạng giấy phép lái xe thực hiện đối với những đối tượng sau đây:\n\na) Nâng hạng giấy phép lái xe từ hạng B lên hạng C1 hoặc lên hạng C hoặc lên hạng D1 hoặc lên hạng D2;\n\nb) Nâng hạng giấy phép lái xe từ hạng C1 lên hạng C hoặc lên hạng D1 hoặc lên hạng D2;\n\nc) Nâng hạng giấy phép lái xe từ hạng C lên hạng D1 hoặc lên hạng D2 hoặc lên hạng D;\n\nd) Nâng hạng giấy phép lái xe từ hạng D1 lên hạng D2 hoặc lên hạng D;\n\nđ) Nâng hạng giấy phép lái xe từ hạng D2 lên hạng D;\n\ne) Nâng hạng giấy phép lái xe từ hạng B lên hạng BE, từ hạng C1 lên\xa0 hạng C1E, từ hạng C lên hạng CE, từ hạng D1 lên hạng D1E, từ hạng D2 lên hạng D2E, từ hạng D lên hạng DE.\n\n4.\xa0Người có nhu cầu được đào tạo nâng hạng giấy phép lái xe khi giấy phép lái xe còn hiệu lực, phải có đủ thời gian lái xe an toàn quy định cho từng hạng giấy phép lái xe;\xa0đối với việc nâng hạng giấy phép lái xe lên hạng D1, D2, D thì người có nhu cầu được đào tạo còn phải có trình độ từ trung học cơ sở trở lên.\n\n5. Giấy phép lái xe các hạng C, D1, D2, D, BE, C1E, CE, D1E, D2E, DE phải được đào tạo bằng hình thức đào tạo nâng hạng theo các điều kiện quy định tại khoản 3 và khoản 4 Điều này.\n\n6. Cơ sở đào tạo lái xe ô tô phải đáp ứng các điều kiện do Chính phủ quy định; có giáo trình, giáo án; thực hiện đào tạo theo đúng hình thức, nội dung và chương trình quy định cho từng hạng giấy phép lái xe.\n\n7. Chính phủ quy định chi tiết các hình thức đào tạo lái xe khác quy định tại khoản 2 Điều này; quy định trình tự, thủ tục kiểm tra, đánh giá để cấp, cấp lại và thu hồi giấy phép xe tập lái; quy định tiêu chuẩn của giáo viên dạy lái xe; quy định việc cấp, cấp lại và thu hồi giấy chứng nhận giáo viên dạy lái xe; quy định việc cấp, cấp lại và thu hồi giấy phép đào tạo lái xe.\n\n8. Bộ trưởng Bộ Giao thông vận tải quy định hình thức, nội dung, chương trình đào tạo lái xe, thời gian lái xe an toàn cho từng hạng giấy phép lái xe quy định tại khoản 4 Điều này và quy định tiêu chuẩn của cơ sở đào tạo lái xe mô tô; đối với cơ sở đào tạo, tổ chức đào tạo lái xe cho lực lượng quân đội, công an làm nhiệm vụ quốc phòng, an ninh do Bộ trưởng Bộ Quốc phòng, Bộ trưởng Bộ Công an quy định.\n\nĐiều 61. Sát hạch lái xe\n\n1. Người đã hoàn thành chương trình đào tạo lái xe, có độ tuổi, sức khỏe theo quy định tại Điều 59 của Luật này được đăng ký để tham dự kỳ sát hạch lái xe.\n\n2. Nội dung sát hạch lái xe phải phù hợp với hạng giấy phép lái xe và chương trình đào tạo lái xe.\n\n3. Hoạt động sát hạch lái xe ô tô phải thực hiện tại các trung tâm sát hạch lái xe; hoạt động sát hạch lái xe mô tô thực hiện tại các trung tâm sát hạch lái xe hoặc tại sân tập lái đáp ứng điều kiện, tiêu chuẩn về cơ sở vật chất, kỹ thuật. Hoạt động sát hạch lái xe do cơ quan nhà nước có thẩm quyền thực hiện.']","**Nguồn văn bản:** /content/drive/MyDrive/ITProject_data/new_law/36_2024_QH15_444251.docx

**Tên văn bản:**  (Không có tiêu đề trong metadata)

**(Không có điều khoản):** (Không có article_title trong metadata)

**Nội dung:**

Giấy phép lái xe hạng DE cấp cho người lái các loại xe sau:

* Các loại xe ô tô quy định cho giấy phép lái xe hạng D kéo rơ moóc có khối lượng toàn bộ theo thiết kế trên 750 kg.
* Xe ô tô chở khách nối toa.

**Tóm lại:** Giấy phép lái xe hạng DE cho phép lái xe ô tô chở người trên 29 chỗ kéo rơ moóc trên 750 kg và xe ô tô chở khách nối toa.
",Hạng DE cho phép lái xe ô tô chở người trên 30 chỗ ngồi kéo rơ moóc có trọng tải trên 750 kg.,0.8,0.9308089487086537,1.0,0.9999999999
10,Luật Giao thông Đường bộ 2025 quy định như thế nào về điểm giấy phép lái xe?,"['đ) Không trừ điểm giấy phép lái xe khi giấy phép lái xe đó đang trong thời hạn bị tước quyền sử dụng giấy phép lái xe.\n\n2. Thẩm quyền trừ điểm giấy phép lái xe\n\nNgười có thẩm quyền áp dụng hình thức xử phạt tước quyền sử dụng giấy phép, chứng chỉ hành nghề có thời hạn hoặc đình chỉ hoạt động có thời hạn quy định tại Chương II Phần thứ hai của Luật Xử lý vi phạm hành chính, Mục 1 Chương III của Nghị định này và có thẩm quyền xử phạt vi phạm hành chính đối với hành vi vi phạm có quy định trừ điểm giấy phép lái xe thì có thẩm quyền trừ điểm giấy phép lái xe đối với hành vi vi phạm đó.\n\n3. Trình tự, thủ tục trừ điểm giấy phép lái xe\n\na) Ngay sau khi quyết định xử phạt vi phạm hành chính có hiệu lực thi hành, dữ liệu trừ điểm giấy phép lái xe của người bị xử phạt sẽ được cập nhật tự động vào Cơ sở dữ liệu về xử lý vi phạm hành chính về trật tự, an toàn giao thông đường bộ, người có thẩm quyền trừ điểm giấy phép lái xe thông báo cho người bị trừ điểm giấy phép lái xe biết việc trừ điểm.\n\nTrường hợp Chủ tịch Ủy ban nhân dân cấp huyện, Chủ tịch Ủy ban nhân dân cấp tỉnh ra quyết định xử phạt vi phạm hành chính đối với hành vi vi phạm có trừ điểm giấy phép lái xe thì Trưởng Công an cấp huyện hoặc Trưởng phòng Cảnh sát giao thông Công an cấp tỉnh có trách nhiệm cập nhật dữ liệu trừ điểm giấy phép lái xe vào Cơ sở dữ liệu về xử lý vi phạm hành chính về trật tự, an toàn giao thông đường bộ;\n\nb) Việc thông báo trừ điểm giấy phép lái xe thực hiện bằng văn bản theo mẫu quy định của Bộ trưởng Bộ Công an và được giao trực tiếp hoặc gửi qua dịch vụ bưu chính hoặc thực hiện thông báo bằng phương thức điện tử thông qua tài khoản của công dân đăng ký trên Cổng dịch vụ công, Ứng dụng giao thông trên thiết bị di động khi đáp ứng điều kiện về cơ sở hạ tầng, kỹ thuật, thông tin; đồng thời cập nhật thông tin về giấy phép lái xe bị trừ điểm trên Trang thông tin điện tử của Cục Cảnh sát giao thông. Trường hợp giấy phép lái xe được thể hiện dưới hình thức thông điệp dữ liệu thì cơ quan, người có thẩm quyền thực hiện cập nhật trạng thái trừ điểm giấy phép lái xe trong căn cước điện tử, tài khoản định danh điện tử trên ứng dụng định danh quốc gia.\n\nĐiều 51. Thẩm quyền, trình tự, thủ tục phục hồi điểm giấy phép lái xe\n\n1. Thẩm quyền phục hồi điểm giấy phép lái xe\n\na) Cục trưởng Cục Cảnh sát giao thông có trách nhiệm quản lý, vận hành Cơ sở dữ liệu về xử lý vi phạm hành chính về trật tự, an toàn giao thông đường bộ để thực hiện cập nhật, tự động phục hồi điểm giấy phép lái xe đối với trường hợp quy định tại khoản 2 Điều này;\n\nb) Cục trưởng Cục Cảnh sát giao thông, Trưởng phòng Cảnh sát giao thông nơi tổ chức kiểm tra kiến thức pháp luật về trật tự, an toàn giao thông đường bộ có thẩm quyền phục hồi điểm cho giấy phép lái xe đối với trường hợp quy định tại khoản 3 Điều này.\n\n2. Trình tự, thủ tục phục hồi điểm giấy phép lái xe đối với trường hợp giấy phép lái xe chưa bị trừ hết điểm và không bị trừ điểm trong thời hạn 12 tháng từ ngày bị trừ điểm gần nhất\n\na) Khi đủ thời hạn 12 tháng, kể từ ngày bị trừ điểm giấy phép lái xe gần nhất, dữ liệu điểm giấy phép lái xe sẽ được tự động phục hồi đủ 12 điểm (gồm cả giấy phép lái xe đang trong thời hạn bị tước quyền sử dụng) và cập nhật tự động trong Cơ sở dữ liệu về xử lý vi phạm hành chính về trật tự, an toàn giao thông đường bộ;\n\nb) Ngay sau khi dữ liệu điểm giấy phép lái xe được phục hồi, Cơ sở dữ liệu về xử lý vi phạm hành chính về trật tự, an toàn giao thông đường bộ sẽ tự động chuyển thông tin thông báo cho người được phục hồi điểm giấy phép lái xe biết việc phục hồi điểm theo quy định tại điểm c khoản này;\n\nc) Việc thông báo phục hồi điểm giấy phép lái xe thực hiện bằng phương thức điện tử thông qua tài khoản của công dân đăng ký trên Cổng dịch vụ công, Ứng dụng giao thông trên thiết bị di động; đồng thời cập nhật thông tin về giấy phép lái xe được phục hồi điểm trên Trang thông tin điện tử của Cục Cảnh sát giao thông. Trường hợp giấy phép lái xe được thể hiện dưới hình thức thông điệp dữ liệu thì thực hiện cập nhật trạng thái phục hồi điểm giấy phép lái xe trong căn cước điện tử, tài khoản định danh điện tử trên ứng dụng định danh quốc gia.\n\n3. Trình tự, thủ tục phục hồi điểm giấy phép lái xe đối với trường hợp giấy phép lái xe bị trừ hết điểm\n\na) Sau khi người có giấy phép lái xe bị trừ hết điểm tham gia kiểm tra nội dung kiến thức pháp luật về trật tự, an toàn giao thông đường bộ và đạt yêu cầu, kết quả kiểm tra được cập nhật vào phần mềm kiểm tra kiến thức pháp luật về trật tự, an toàn giao thông đường bộ và đồng bộ dữ liệu với Cơ sở dữ liệu về xử lý vi phạm hành chính về trật tự, an toàn giao thông đường bộ, dữ liệu điểm giấy phép lái xe sẽ được phục hồi đủ 12 điểm và cập nhật tự động trong Cơ sở dữ liệu về xử lý vi phạm hành chính về trật tự, an toàn giao thông đường bộ;\n\nb) Ngay sau khi dữ liệu điểm giấy phép lái xe được phục hồi đủ 12 điểm thì người có thẩm quyền quy định tại điểm b khoản 1 Điều này thông báo cho người được phục hồi điểm giấy phép lái xe biết việc phục hồi điểm;\n\nc) Việc thông báo phục hồi điểm giấy phép lái xe thực hiện bằng văn bản theo mẫu quy định của Bộ trưởng Bộ Công an và được giao trực tiếp hoặc gửi qua dịch vụ bưu chính hoặc thực hiện thông báo bằng phương thức điện tử thông qua tài khoản của công dân đăng ký trên Cổng dịch vụ công, Ứng dụng giao thông trên thiết bị di động; đồng thời cập nhật thông tin về giấy phép lái xe được phục hồi điểm trên Trang thông tin điện tử của Cục Cảnh sát giao thông. Trường hợp giấy phép lái xe được thể hiện dưới hình thức thông điệp dữ liệu thì cơ quan, người có thẩm quyền thực hiện cập nhật trạng thái phục hồi điểm giấy phép lái xe trong căn cước điện tử, tài khoản định danh điện tử trên ứng dụng định danh quốc gia.\n\nChương IV\n\nĐIỀU KHOẢN THI HÀNH\n\nĐiều 52. Sửa đổi, bổ sung một số điều của Nghị định số 100/2019/NĐ-CP ngày 30 tháng 12 năm 2019 của Chính phủ quy định xử phạt vi phạm hành chính trong lĩnh vực giao thông đường bộ và đường sắt đã được sửa đổi, bổ sung một số điều theo Nghị định số 123/2021/NĐ-CP ngày 28 tháng 12 năm 2021 của Chính phủ sửa đổi, bổ sung một số điều của các Nghị định quy định xử phạt vi phạm hành chính trong lĩnh vực hàng hải; giao thông đường bộ, đường sắt; hàng không dân dụng\n\n1. Bổ sung khoản 2a vào sau khoản 2 Điều 1 như sau:\n\n“2a. Hình thức, mức xử phạt, biện pháp khắc phục hậu quả đối với từng hành vi vi phạm hành chính; thẩm quyền lập biên bản, thẩm quyền xử phạt, mức phạt tiền cụ thể đối với từng chức danh về trật tự, an toàn giao thông trong lĩnh vực giao thông đường bộ thì áp dụng quy định tại Nghị định quy định xử phạt vi phạm hành chính về trật tự, an toàn giao thông trong lĩnh vực giao thông đường bộ; trừ điểm, phục hồi điểm giấy phép lái xe”.\n\n2. Sửa đổi, bổ sung một số điểm của khoản 6 Điều 28 như sau:\n\na) Sửa đổi, bổ sung điểm d khoản 6 Điều 28 như sau:\n\n“d) Không thực hiện đúng các nội dung đã đăng ký, niêm yết về: giá cước; giá dịch vụ; tiêu chuẩn chất lượng dịch vụ vận tải, dịch vụ hỗ trợ vận tải;”;\n\nb) Sửa đổi, bổ sung điểm i khoản 6 Điều 28 như sau:\n\n“i) Sử dụng phương tiện kinh doanh vận tải có chất lượng không bảo đảm điều kiện của hình thức kinh doanh đã đăng ký;”.\n\n3. Sửa đổi, bổ sung điểm a, điểm b khoản 10 Điều 28 như sau:\n\n“a) Thực hiện hành vi vi phạm quy định tại điểm a, điểm b, điểm d, điểm đ, điểm h, điểm l, điểm o, điểm p, điểm r, điểm s, điểm t khoản 4; điểm d, điểm i, điểm k, điểm l, điểm n, điểm q khoản 6; điểm e khoản 7 Điều này bị tước quyền sử dụng phù hiệu từ 01 tháng đến 03 tháng (nếu có hoặc đã được cấp) đối với xe vi phạm;\n\nb) Thực hiện hành vi vi phạm quy định tại điểm i, điểm k khoản 4; điểm h khoản 6; điểm b khoản 7 Điều này bị tước quyền sử dụng giấy phép kinh doanh vận tải từ 01 tháng đến 03 tháng;”.\n\n4. Sửa đổi, bổ sung điểm h khoản 11 Điều 28 như sau:\n\n“h) Thực hiện hành vi vi phạm quy định tại điểm n khoản 6 Điều này buộc lắp đặt đồng hồ tính tiền cước, thiết bị in hóa đơn trên xe theo đúng quy định;”.\n\n5. Sửa đổi, bổ sung một số điểm, khoản của Điều 74 như sau:', 'a) Giấy phép lái xe hết thời hạn sử dụng;\n\nb) Giấy phép lái xe bị thu hồi theo quy định tại khoản 5 Điều 62 của Luật này.\n\n8. Giấy phép lái xe quốc tế được quy định như sau:\n\na) Giấy phép lái xe quốc tế là giấy phép lái xe do cơ quan nhà nước có thẩm quyền của quốc gia là thành viên của Công ước Viên cấp theo một mẫu thống nhất; có thời hạn không quá 03 năm kể từ ngày cấp và phải phù hợp với thời hạn còn hiệu lực của giấy phép lái xe quốc gia;\n\nb) Người có giấy phép lái xe quốc tế do quốc gia là thành viên của Công ước Viên cấp khi lái xe tham gia giao thông đường bộ trên lãnh thổ Việt Nam phải mang theo giấy phép lái xe quốc tế và giấy phép lái xe quốc gia được cấp phù hợp với hạng xe điều khiển, còn thời hạn sử dụng; phải tuân thủ pháp luật về trật tự, an toàn giao thông đường bộ của Việt Nam;\n\nc) Người có giấy phép lái xe quốc tế vi phạm pháp luật về trật tự, an toàn giao thông đường bộ của Việt Nam mà bị tước quyền sử dụng giấy phép lái xe có thời hạn thì thời gian bị tước quyền sử dụng không quá thời gian người lái xe được phép cư trú tại lãnh thổ Việt Nam;\n\nd) Người Việt Nam hoặc người nước ngoài có thẻ thường trú hoặc thẻ tạm trú tại Việt Nam có giấy phép lái xe do Việt Nam hoặc quốc gia là thành viên của điều ước quốc tế mà nước Cộng hòa xã hội chủ nghĩa Việt Nam là thành viên cấp, còn giá trị sử dụng, nếu có nhu cầu được cấp giấy phép lái xe quốc tế.\n\n9. Bộ trưởng Bộ Giao thông vận tải quy định mẫu giấy phép lái xe và giấy phép lái xe quốc tế, trình tự, thủ tục cấp và việc sử dụng giấy phép lái xe, giấy phép lái xe quốc tế; đối với mẫu giấy phép lái xe, trình tự, thủ tục cấp và việc sử dụng giấy phép lái xe của lực lượng quân đội, công an làm nhiệm vụ quốc phòng, an ninh do Bộ trưởng Bộ Quốc phòng, Bộ trưởng Bộ Công an quy định.\n\nĐiều 58. Điểm của giấy phép lái xe \n\n1. Điểm của giấy phép lái xe được dùng để quản lý việc chấp hành pháp luật về trật tự, an toàn giao thông đường bộ của người lái xe trên hệ thống cơ sở dữ liệu về trật tự, an toàn giao thông đường bộ, bao gồm 12 điểm. Số điểm trừ mỗi lần vi phạm tùy thuộc tính chất, mức độ của hành vi vi phạm pháp luật về trật tự, an toàn giao thông đường bộ. Dữ liệu về điểm trừ giấy phép lái xe của người vi phạm sẽ được cập nhật vào hệ thống cơ sở dữ liệu ngay sau khi quyết định xử phạt có hiệu lực thi hành và thông báo cho người bị trừ điểm giấy phép lái xe biết.\n\n2. Giấy phép lái xe chưa bị trừ hết điểm và không bị trừ điểm trong thời hạn 12 tháng từ ngày bị trừ điểm gần nhất thì được phục hồi đủ 12 điểm.\n\n3. Trường hợp giấy phép lái xe bị trừ hết điểm thì người có giấy phép lái xe không được điều khiển phương tiện tham gia giao thông đường bộ theo giấy phép lái xe đó. Sau thời hạn ít nhất là 06 tháng kể từ ngày bị trừ hết điểm, người có giấy phép lái xe được tham gia kiểm tra nội dung kiến thức pháp luật về trật tự, an toàn giao thông đường bộ theo quy định tại khoản 7 Điều 61 của Luật này do lực lượng Cảnh sát giao thông tổ chức, có kết quả đạt yêu cầu thì được phục hồi đủ 12 điểm.\n\n4. Giấy phép lái xe sau khi đổi, cấp lại, nâng hạng được giữ nguyên số điểm của giấy phép lái xe trước khi đổi, cấp lại, nâng hạng.\n\n5. Người có thẩm quyền xử phạt vi phạm hành chính có thẩm quyền trừ điểm giấy phép lái xe.\n\n6. Chính phủ quy định chi tiết khoản 1 Điều này; quy định trình tự, thủ tục, thẩm quyền trừ điểm, phục hồi điểm giấy phép lái xe; quy định lộ trình thực hiện Điều này. Bộ trưởng Bộ Công an quy định chi tiết khoản 3 Điều này.\n\nĐiều 59. Tuổi, sức khỏe của người điều khiển phương tiện tham gia giao thông đường bộ\n\n1. Độ tuổi của người lái xe, người điều khiển xe máy chuyên dùng được quy định như sau:\n\na) Người đủ 16 tuổi trở lên được điều khiển xe gắn máy;\n\nb) Người đủ 18 tuổi trở lên được cấp giấy phép lái xe hạng A1, A, B1, B, C1, được cấp chứng chỉ bồi dưỡng kiến thức pháp luật về giao thông đường bộ để điều khiển xe máy chuyên dùng tham gia giao thông đường bộ;\n\nc) Người đủ 21 tuổi trở lên được cấp giấy phép lái xe hạng C, BE;\n\nd) Người đủ 24 tuổi trở lên được cấp giấy phép lái xe hạng D1, D2, C1E, CE;\n\nđ) Người đủ 27 tuổi trở lên được cấp giấy phép lái xe hạng D, D1E, D2E, DE;\n\ne) Tuổi tối đa của người lái xe ô tô chở người (kể cả xe buýt) trên 29 chỗ (không kể chỗ của người lái xe), xe ô tô chở người giường nằm là đủ 57 tuổi đối với nam, đủ 55 tuổi đối với nữ.\n\n2. Người điều khiển phương tiện tham gia giao thông đường bộ phải bảo đảm điều kiện sức khỏe phù hợp với từng loại phương tiện được phép điều khiển. Bộ trưởng Bộ Y tế quy định về tiêu chuẩn sức khỏe, việc khám sức khỏe đối với người lái xe, người điều khiển xe máy chuyên dùng; việc khám sức khỏe định kỳ đối với người hành nghề lái xe ô tô; xây dựng cơ sở dữ liệu về sức khỏe của người lái xe, người điều khiển xe máy chuyên dùng.\n\n3. Bộ trưởng Bộ Quốc phòng, Bộ trưởng Bộ Công an quy định độ tuổi của người lái xe trong lực lượng quân đội, công an làm nhiệm vụ quốc phòng, an ninh.\n\nĐiều 60. Đào tạo lái xe\n\n1. Người có nhu cầu được cấp giấy phép lái xe phải được đào tạo nội dung lý thuyết và thực hành theo chương trình đào tạo quy định cho từng hạng giấy phép lái xe.\n\n2. Người học lái xe phải được đào tạo tại các cơ sở đào tạo lái xe hoặc các hình thức đào tạo lái xe khác để cấp mới hoặc nâng hạng giấy phép lái xe.\n\n3. Việc đào tạo để nâng hạng giấy phép lái xe thực hiện đối với những đối tượng sau đây:\n\na) Nâng hạng giấy phép lái xe từ hạng B lên hạng C1 hoặc lên hạng C hoặc lên hạng D1 hoặc lên hạng D2;\n\nb) Nâng hạng giấy phép lái xe từ hạng C1 lên hạng C hoặc lên hạng D1 hoặc lên hạng D2;\n\nc) Nâng hạng giấy phép lái xe từ hạng C lên hạng D1 hoặc lên hạng D2 hoặc lên hạng D;\n\nd) Nâng hạng giấy phép lái xe từ hạng D1 lên hạng D2 hoặc lên hạng D;\n\nđ) Nâng hạng giấy phép lái xe từ hạng D2 lên hạng D;\n\ne) Nâng hạng giấy phép lái xe từ hạng B lên hạng BE, từ hạng C1 lên\xa0 hạng C1E, từ hạng C lên hạng CE, từ hạng D1 lên hạng D1E, từ hạng D2 lên hạng D2E, từ hạng D lên hạng DE.\n\n4.\xa0Người có nhu cầu được đào tạo nâng hạng giấy phép lái xe khi giấy phép lái xe còn hiệu lực, phải có đủ thời gian lái xe an toàn quy định cho từng hạng giấy phép lái xe;\xa0đối với việc nâng hạng giấy phép lái xe lên hạng D1, D2, D thì người có nhu cầu được đào tạo còn phải có trình độ từ trung học cơ sở trở lên.\n\n5. Giấy phép lái xe các hạng C, D1, D2, D, BE, C1E, CE, D1E, D2E, DE phải được đào tạo bằng hình thức đào tạo nâng hạng theo các điều kiện quy định tại khoản 3 và khoản 4 Điều này.\n\n6. Cơ sở đào tạo lái xe ô tô phải đáp ứng các điều kiện do Chính phủ quy định; có giáo trình, giáo án; thực hiện đào tạo theo đúng hình thức, nội dung và chương trình quy định cho từng hạng giấy phép lái xe.\n\n7. Chính phủ quy định chi tiết các hình thức đào tạo lái xe khác quy định tại khoản 2 Điều này; quy định trình tự, thủ tục kiểm tra, đánh giá để cấp, cấp lại và thu hồi giấy phép xe tập lái; quy định tiêu chuẩn của giáo viên dạy lái xe; quy định việc cấp, cấp lại và thu hồi giấy chứng nhận giáo viên dạy lái xe; quy định việc cấp, cấp lại và thu hồi giấy phép đào tạo lái xe.\n\n8. Bộ trưởng Bộ Giao thông vận tải quy định hình thức, nội dung, chương trình đào tạo lái xe, thời gian lái xe an toàn cho từng hạng giấy phép lái xe quy định tại khoản 4 Điều này và quy định tiêu chuẩn của cơ sở đào tạo lái xe mô tô; đối với cơ sở đào tạo, tổ chức đào tạo lái xe cho lực lượng quân đội, công an làm nhiệm vụ quốc phòng, an ninh do Bộ trưởng Bộ Quốc phòng, Bộ trưởng Bộ Công an quy định.\n\nĐiều 61. Sát hạch lái xe\n\n1. Người đã hoàn thành chương trình đào tạo lái xe, có độ tuổi, sức khỏe theo quy định tại Điều 59 của Luật này được đăng ký để tham dự kỳ sát hạch lái xe.\n\n2. Nội dung sát hạch lái xe phải phù hợp với hạng giấy phép lái xe và chương trình đào tạo lái xe.\n\n3. Hoạt động sát hạch lái xe ô tô phải thực hiện tại các trung tâm sát hạch lái xe; hoạt động sát hạch lái xe mô tô thực hiện tại các trung tâm sát hạch lái xe hoặc tại sân tập lái đáp ứng điều kiện, tiêu chuẩn về cơ sở vật chất, kỹ thuật. Hoạt động sát hạch lái xe do cơ quan nhà nước có thẩm quyền thực hiện.', '2. Nội dung sát hạch lái xe phải phù hợp với hạng giấy phép lái xe và chương trình đào tạo lái xe.\n\n3. Hoạt động sát hạch lái xe ô tô phải thực hiện tại các trung tâm sát hạch lái xe; hoạt động sát hạch lái xe mô tô thực hiện tại các trung tâm sát hạch lái xe hoặc tại sân tập lái đáp ứng điều kiện, tiêu chuẩn về cơ sở vật chất, kỹ thuật. Hoạt động sát hạch lái xe do cơ quan nhà nước có thẩm quyền thực hiện.\n\n4. Trung tâm sát hạch lái xe là đơn vị cung cấp dịch vụ sát hạch lái xe; phải đáp ứng các điều kiện do Chính phủ quy định và đáp ứng yêu cầu kỹ thuật theo quy chuẩn kỹ thuật quốc gia về trung tâm sát hạch lái xe cơ giới đường bộ; phải sử dụng thiết bị ứng dụng công nghệ thông tin và phải chia sẻ ngay kết quả và dữ liệu giám sát quá trình sát hạch đến cơ quan quản lý đào tạo, sát hạch, cấp giấy phép lái xe, cơ quan quản lý về trật tự, an toàn giao thông đường bộ để giám sát. \n\n5. Việc sát hạch lái xe do sát hạch viên thực hiện. Sát hạch viên phải có đủ điều kiện, tiêu chuẩn, được cấp thẻ sát hạch viên và phải chịu trách nhiệm về kết quả sát hạch của mình.\n\n6. Chính phủ quy định điều kiện, trình tự, thủ tục kiểm tra, đánh giá để cấp, cấp lại và thu hồi giấy phép sát hạch cho trung tâm sát hạch lái xe; điều kiện sân tập lái để sát hạch lái xe mô tô.\n\n7. Bộ trưởng Bộ Giao thông vận tải quy định hình thức, nội dung, quy trình sát hạch để cấp giấy phép lái xe; điều kiện, tiêu chuẩn sát hạch viên, tổ chức tập huấn, cấp thẻ sát hạch viên; tiêu chuẩn kỹ thuật sân tập lái để sát hạch lái xe mô tô, quy chuẩn kỹ thuật quốc gia về trung tâm sát hạch lái xe cơ giới đường bộ; đối với sát hạch lái xe cho lực lượng quân đội, công an làm nhiệm vụ quốc phòng, an ninh do Bộ trưởng Bộ Quốc phòng, Bộ trưởng Bộ Công an quy định.\n\nĐiều 62. Cấp, đổi, cấp lại và thu hồi giấy phép lái xe\n\n1. Giấy phép lái xe được cấp cho người tham dự kỳ sát hạch lái xe có kết quả đạt yêu cầu.\n\n2. Người có giấy phép lái xe được đổi, cấp lại giấy phép lái xe trong các trường hợp sau đây:\n\na) Giấy phép lái xe bị mất;\n\nb) Giấy phép lái xe bị hỏng không còn sử dụng được;\n\nc) Trước thời hạn ghi trên giấy phép lái xe; \n\nd) Thay đổi thông tin ghi trên giấy phép lái xe;\n\nđ) Giấy phép lái xe nước ngoài do cơ quan có thẩm quyền của nước ngoài cấp còn giá trị sử dụng;\n\ne) Giấy phép lái xe do Bộ Quốc phòng, Bộ Công an cấp khi có yêu cầu hoặc người được cấp không còn làm nhiệm vụ quốc phòng, an ninh.\n\n3. Khuyến khích đổi giấy phép lái xe không thời hạn được cấp trước ngày 01 tháng 7 năm 2012 sang giấy phép lái xe theo quy định của Luật này.\n\n4. Chưa cấp, đổi, cấp lại giấy phép lái xe đối với người vi phạm pháp luật về trật tự, an toàn giao thông đường bộ khi người đó chưa thực hiện xong yêu cầu của cơ quan nhà nước có thẩm quyền về giải quyết vụ việc vi phạm hành chính trong lĩnh vực trật tự, an toàn giao thông đường bộ.\n\n5. Giấy phép lái xe bị thu hồi khi thuộc một trong các trường hợp sau đây:\n\na) Người được cấp giấy phép lái xe không đủ điều kiện sức khỏe theo kết luận của cơ sở khám bệnh, chữa bệnh đối với từng hạng giấy phép lái xe;\n\nb) Giấy phép lái xe được cấp sai quy định;\n\nc) Giấy phép lái xe đã quá thời hạn tạm giữ hoặc hết thời hiệu thi hành quyết định xử phạt vi phạm hành chính theo quy định của pháp luật về xử lý vi phạm hành chính nếu người vi phạm không đến nhận mà không có lý do chính đáng.\n\n6. Bộ trưởng Bộ Giao thông vận tải quy định điều kiện, trình tự, thủ tục về cấp, đổi, cấp lại và thu hồi giấy phép lái xe, trừ trường hợp quy định tại khoản 7 Điều này. \n\n7. Bộ trưởng Bộ Quốc phòng, Bộ trưởng Bộ Công an quy định về cấp, đổi, cấp lại, thu hồi giấy phép lái xe cho lực lượng quân đội, công an làm nhiệm vụ quốc phòng, an ninh. Bộ trưởng Bộ Lao động Thương binh và Xã hội quy định điều kiện, trình tự, thủ tục cấp, đổi, cấp lại, thu hồi chứng chỉ điều khiển xe máy chuyên dùng cho người điều khiển máy kéo có giấy phép lái xe quy định tại các điểm d, e, g, h, i, k, l, m và n khoản 3 Điều 89 của Luật này.\n\nĐiều 63. Đào tạo, kiểm tra cấp chứng chỉ bồi dưỡng kiến thức pháp luật về giao thông đường bộ cho người điều khiển xe máy chuyên dùng\n\n1. Chứng chỉ bồi dưỡng kiến thức pháp luật về giao thông đường bộ là giấy chứng nhận cấp cho người có đủ điều kiện theo quy định của pháp luật để điều khiển xe máy chuyên dùng tham gia giao thông đường bộ. \n\n2. Người có nhu cầu cấp chứng chỉ bồi dưỡng kiến thức pháp luật về giao thông đường bộ được đăng ký với cơ sở đào tạo lái xe ô tô hoặc cơ sở đào tạo người điều khiển xe máy chuyên dùng đủ tiêu chuẩn để được bồi dưỡng kiến thức pháp luật về giao thông đường bộ.\n\n3. Cơ sở đào tạo lái xe ô tô, cơ sở đào tạo người điều khiển xe máy chuyên dùng đủ tiêu chuẩn được thực hiện bồi dưỡng kiến thức pháp luật về giao thông đường bộ phải theo đúng hình thức, nội dung, chương trình bồi dưỡng; kiểm tra và cấp chứng chỉ bồi dưỡng kiến thức pháp luật về giao thông đường bộ cho người có kết quả kiểm tra đạt yêu cầu.\n\n4. Bộ trưởng Bộ Giao thông vận tải quy định hình thức, nội dung, chương trình bồi dưỡng kiến thức pháp luật về giao thông đường bộ; việc kiểm tra và thủ tục cấp, cấp lại chứng chỉ bồi dưỡng kiến thức pháp luật về giao thông đường bộ; tiêu chuẩn của cơ sở đào tạo người điều khiển xe máy chuyên dùng thực hiện bồi dưỡng, kiểm tra, cấp chứng chỉ bồi dưỡng kiến thức pháp luật về giao thông đường bộ, trừ trường hợp quy định tại khoản 5 Điều này.\n\n5. Bộ trưởng Bộ Quốc phòng, Bộ trưởng Bộ Công an quy định hình thức, nội dung, chương trình bồi dưỡng kiến thức pháp luật về giao thông đường bộ; tiêu chuẩn của cơ sở đào tạo người điều khiển xe máy chuyên dùng thực hiện bồi dưỡng, kiểm tra, cấp chứng chỉ bồi dưỡng kiến thức pháp luật về giao thông đường bộ cho lực lượng quân đội, công an làm nhiệm vụ quốc phòng, an ninh.\n\nĐiều 64. Thời gian làm việc của người lái xe ô tô kinh doanh vận tải và vận tải nội bộ\n\n1. Thời gian lái xe của người lái xe ô tô không quá 10 giờ trong một ngày và không quá 48 giờ trong một tuần; lái xe liên tục không quá 04 giờ và bảo đảm các quy định có liên quan của Bộ luật Lao động.\n\n2. Đơn vị kinh doanh vận tải, đơn vị hoạt động vận tải nội bộ và người lái xe ô tô kinh doanh vận tải và vận tải nội bộ chịu trách nhiệm thực hiện các quy định tại Điều này.\n\nChương V\n\nTUẦN TRA, KIỂM SOÁT VỀ TRẬT TỰ, AN TOÀN GIAO THÔNG ĐƯỜNG BỘ\n\nĐiều 65. Hoạt động tuần tra, kiểm soát về trật tự, an toàn giao thông đường bộ\n\n1. Hoạt động tuần tra, kiểm soát bao gồm:\n\na) Bố trí lực lượng, phương tiện thực hiện nhiệm vụ tuần tra, kiểm soát;\n\nb) Kiểm tra, kiểm soát người, phương tiện tham gia giao thông đường bộ;\n\nc) Phát hiện, ngăn chặn và xử lý vi phạm pháp luật về trật tự, an toàn giao thông đường bộ và vi phạm pháp luật khác.\n\n2. Hình thức tuần tra, kiểm soát bao gồm:\n\na) Tổ chức lực lượng trực tiếp tuần tra, kiểm soát trên tuyến giao thông đường bộ;\n\nb) Kiểm soát thông qua hệ thống, phương tiện, thiết bị, dữ liệu quy định tại các khoản 1, 2, 3 và 4 Điều 67 của Luật này.\n\n3. Lực lượng thực hiện tuần tra, kiểm soát bao gồm:\n\na) Lực lượng Cảnh sát giao thông; \n\nb) Lực lượng, đơn vị khác trong Công an nhân dân được huy động tham gia phối hợp với Cảnh sát giao thông thực hiện tuần tra, kiểm soát trong trường hợp cần thiết trên cơ sở nhiệm vụ, quyền hạn của lực lượng được huy động theo quy định của pháp luật, quyết định của cấp có thẩm quyền và phù hợp với thực tế nhiệm vụ.\n\n4. Nhiệm vụ của Cảnh sát giao thông khi thực hiện tuần tra, kiểm soát bao gồm:\n\na) Quan sát, nắm tình hình người, phương tiện tham gia giao thông đường bộ; tình hình trật tự, an toàn giao thông đường bộ; an ninh, trật tự trên tuyến giao thông đường bộ; \n\nb) Thực hiện quy định tại điểm b và điểm c khoản 1 Điều này;\n\nc) Hướng dẫn, tuyên truyền, vận động người tham gia giao thông đường bộ chấp hành pháp luật về trật tự, an toàn giao thông đường bộ;\n\nd) Giúp đỡ, hỗ trợ người, phương tiện tham gia giao thông đường bộ khi cần thiết;\n\nđ) Chỉ huy, điều khiển giao thông đường bộ;\n\ne) Điều tra, giải quyết tai nạn giao thông đường bộ theo quy định của pháp luật;']","**Nguồn văn bản:** /content/drive/MyDrive/ITProject_data/new_law/36_2024_QH15_444251.docx

**Tên văn bản:** (Không có tiêu đề trong metadata)

**Điều 58:** Điểm của giấy phép lái xe

**Nội dung:**

1. Điểm của giấy phép lái xe được dùng để quản lý việc chấp hành pháp luật về trật tự, an toàn giao thông đường bộ của người lái xe trên hệ thống cơ sở dữ liệu về trật tự, an toàn giao thông đường bộ, bao gồm 12 điểm. 

Số điểm trừ mỗi lần vi phạm tùy thuộc tính chất, mức độ của hành vi vi phạm pháp luật về trật tự, an toàn giao thông đường bộ. 

Dữ liệu về điểm trừ giấy phép lái xe của người vi phạm sẽ được cập nhật vào hệ thống cơ sở dữ liệu ngay sau khi quyết định xử phạt có hiệu lực thi hành và thông báo cho người bị trừ điểm giấy phép lái xe biết.

2. Giấy phép lái xe chưa bị trừ hết điểm và không bị trừ điểm trong thời hạn 12 tháng từ ngày bị trừ điểm gần nhất thì được phục hồi đủ 12 điểm.

3. Trường hợp giấy phép lái xe bị trừ hết điểm thì người có giấy phép lái xe không được điều khiển phương tiện tham gia giao thông đường bộ theo giấy phép lái xe đó. 

Sau thời hạn ít nhất là 06 tháng kể từ ngày bị trừ hết điểm, người có giấy phép lái xe được tham gia kiểm tra nội dung kiến thức pháp luật về trật tự, an toàn giao thông đường bộ theo quy định tại khoản 7 Điều 61 của Luật này do lực lượng Cảnh sát giao thông tổ chức, có kết quả đạt yêu cầu thì được phục hồi đủ 12 điểm.

4. Giấy phép lái xe sau khi đổi, cấp lại, nâng hạng được giữ nguyên số điểm của giấy phép lái xe trước khi đổi, cấp lại, nâng hạng.

5. Người có thẩm quyền xử phạt vi phạm hành chính có thẩm quyền trừ điểm giấy phép lái xe.

6. Chính phủ quy định chi tiết khoản 1 Điều này; quy định trình tự, thủ tục, thẩm quyền trừ điểm, phục hồi điểm giấy phép lái xe; quy định lộ trình thực hiện Điều này. 

Bộ trưởng Bộ Công an quy định chi tiết khoản 3 Điều này.


**Tóm lại:** Giấy phép lái xe có 12 điểm, bị trừ khi vi phạm luật giao thông. Điểm được phục hồi sau 12 tháng không vi phạm hoặc thi lại sau 6 tháng nếu bị trừ hết điểm.
","Mỗi giấy phép lái xe có 12 điểm; nếu bị trừ hết điểm, người lái xe phải tham gia kiểm tra phục hồi điểm.",1.0,0.6664982191688171,1.0,0.99999999995
11,Người lái xe máy cần làm gì để phục hồi điểm giấy phép lái xe?,"['đ) Không trừ điểm giấy phép lái xe khi giấy phép lái xe đó đang trong thời hạn bị tước quyền sử dụng giấy phép lái xe.\n\n2. Thẩm quyền trừ điểm giấy phép lái xe\n\nNgười có thẩm quyền áp dụng hình thức xử phạt tước quyền sử dụng giấy phép, chứng chỉ hành nghề có thời hạn hoặc đình chỉ hoạt động có thời hạn quy định tại Chương II Phần thứ hai của Luật Xử lý vi phạm hành chính, Mục 1 Chương III của Nghị định này và có thẩm quyền xử phạt vi phạm hành chính đối với hành vi vi phạm có quy định trừ điểm giấy phép lái xe thì có thẩm quyền trừ điểm giấy phép lái xe đối với hành vi vi phạm đó.\n\n3. Trình tự, thủ tục trừ điểm giấy phép lái xe\n\na) Ngay sau khi quyết định xử phạt vi phạm hành chính có hiệu lực thi hành, dữ liệu trừ điểm giấy phép lái xe của người bị xử phạt sẽ được cập nhật tự động vào Cơ sở dữ liệu về xử lý vi phạm hành chính về trật tự, an toàn giao thông đường bộ, người có thẩm quyền trừ điểm giấy phép lái xe thông báo cho người bị trừ điểm giấy phép lái xe biết việc trừ điểm.\n\nTrường hợp Chủ tịch Ủy ban nhân dân cấp huyện, Chủ tịch Ủy ban nhân dân cấp tỉnh ra quyết định xử phạt vi phạm hành chính đối với hành vi vi phạm có trừ điểm giấy phép lái xe thì Trưởng Công an cấp huyện hoặc Trưởng phòng Cảnh sát giao thông Công an cấp tỉnh có trách nhiệm cập nhật dữ liệu trừ điểm giấy phép lái xe vào Cơ sở dữ liệu về xử lý vi phạm hành chính về trật tự, an toàn giao thông đường bộ;\n\nb) Việc thông báo trừ điểm giấy phép lái xe thực hiện bằng văn bản theo mẫu quy định của Bộ trưởng Bộ Công an và được giao trực tiếp hoặc gửi qua dịch vụ bưu chính hoặc thực hiện thông báo bằng phương thức điện tử thông qua tài khoản của công dân đăng ký trên Cổng dịch vụ công, Ứng dụng giao thông trên thiết bị di động khi đáp ứng điều kiện về cơ sở hạ tầng, kỹ thuật, thông tin; đồng thời cập nhật thông tin về giấy phép lái xe bị trừ điểm trên Trang thông tin điện tử của Cục Cảnh sát giao thông. Trường hợp giấy phép lái xe được thể hiện dưới hình thức thông điệp dữ liệu thì cơ quan, người có thẩm quyền thực hiện cập nhật trạng thái trừ điểm giấy phép lái xe trong căn cước điện tử, tài khoản định danh điện tử trên ứng dụng định danh quốc gia.\n\nĐiều 51. Thẩm quyền, trình tự, thủ tục phục hồi điểm giấy phép lái xe\n\n1. Thẩm quyền phục hồi điểm giấy phép lái xe\n\na) Cục trưởng Cục Cảnh sát giao thông có trách nhiệm quản lý, vận hành Cơ sở dữ liệu về xử lý vi phạm hành chính về trật tự, an toàn giao thông đường bộ để thực hiện cập nhật, tự động phục hồi điểm giấy phép lái xe đối với trường hợp quy định tại khoản 2 Điều này;\n\nb) Cục trưởng Cục Cảnh sát giao thông, Trưởng phòng Cảnh sát giao thông nơi tổ chức kiểm tra kiến thức pháp luật về trật tự, an toàn giao thông đường bộ có thẩm quyền phục hồi điểm cho giấy phép lái xe đối với trường hợp quy định tại khoản 3 Điều này.\n\n2. Trình tự, thủ tục phục hồi điểm giấy phép lái xe đối với trường hợp giấy phép lái xe chưa bị trừ hết điểm và không bị trừ điểm trong thời hạn 12 tháng từ ngày bị trừ điểm gần nhất\n\na) Khi đủ thời hạn 12 tháng, kể từ ngày bị trừ điểm giấy phép lái xe gần nhất, dữ liệu điểm giấy phép lái xe sẽ được tự động phục hồi đủ 12 điểm (gồm cả giấy phép lái xe đang trong thời hạn bị tước quyền sử dụng) và cập nhật tự động trong Cơ sở dữ liệu về xử lý vi phạm hành chính về trật tự, an toàn giao thông đường bộ;\n\nb) Ngay sau khi dữ liệu điểm giấy phép lái xe được phục hồi, Cơ sở dữ liệu về xử lý vi phạm hành chính về trật tự, an toàn giao thông đường bộ sẽ tự động chuyển thông tin thông báo cho người được phục hồi điểm giấy phép lái xe biết việc phục hồi điểm theo quy định tại điểm c khoản này;\n\nc) Việc thông báo phục hồi điểm giấy phép lái xe thực hiện bằng phương thức điện tử thông qua tài khoản của công dân đăng ký trên Cổng dịch vụ công, Ứng dụng giao thông trên thiết bị di động; đồng thời cập nhật thông tin về giấy phép lái xe được phục hồi điểm trên Trang thông tin điện tử của Cục Cảnh sát giao thông. Trường hợp giấy phép lái xe được thể hiện dưới hình thức thông điệp dữ liệu thì thực hiện cập nhật trạng thái phục hồi điểm giấy phép lái xe trong căn cước điện tử, tài khoản định danh điện tử trên ứng dụng định danh quốc gia.\n\n3. Trình tự, thủ tục phục hồi điểm giấy phép lái xe đối với trường hợp giấy phép lái xe bị trừ hết điểm\n\na) Sau khi người có giấy phép lái xe bị trừ hết điểm tham gia kiểm tra nội dung kiến thức pháp luật về trật tự, an toàn giao thông đường bộ và đạt yêu cầu, kết quả kiểm tra được cập nhật vào phần mềm kiểm tra kiến thức pháp luật về trật tự, an toàn giao thông đường bộ và đồng bộ dữ liệu với Cơ sở dữ liệu về xử lý vi phạm hành chính về trật tự, an toàn giao thông đường bộ, dữ liệu điểm giấy phép lái xe sẽ được phục hồi đủ 12 điểm và cập nhật tự động trong Cơ sở dữ liệu về xử lý vi phạm hành chính về trật tự, an toàn giao thông đường bộ;\n\nb) Ngay sau khi dữ liệu điểm giấy phép lái xe được phục hồi đủ 12 điểm thì người có thẩm quyền quy định tại điểm b khoản 1 Điều này thông báo cho người được phục hồi điểm giấy phép lái xe biết việc phục hồi điểm;\n\nc) Việc thông báo phục hồi điểm giấy phép lái xe thực hiện bằng văn bản theo mẫu quy định của Bộ trưởng Bộ Công an và được giao trực tiếp hoặc gửi qua dịch vụ bưu chính hoặc thực hiện thông báo bằng phương thức điện tử thông qua tài khoản của công dân đăng ký trên Cổng dịch vụ công, Ứng dụng giao thông trên thiết bị di động; đồng thời cập nhật thông tin về giấy phép lái xe được phục hồi điểm trên Trang thông tin điện tử của Cục Cảnh sát giao thông. Trường hợp giấy phép lái xe được thể hiện dưới hình thức thông điệp dữ liệu thì cơ quan, người có thẩm quyền thực hiện cập nhật trạng thái phục hồi điểm giấy phép lái xe trong căn cước điện tử, tài khoản định danh điện tử trên ứng dụng định danh quốc gia.\n\nChương IV\n\nĐIỀU KHOẢN THI HÀNH\n\nĐiều 52. Sửa đổi, bổ sung một số điều của Nghị định số 100/2019/NĐ-CP ngày 30 tháng 12 năm 2019 của Chính phủ quy định xử phạt vi phạm hành chính trong lĩnh vực giao thông đường bộ và đường sắt đã được sửa đổi, bổ sung một số điều theo Nghị định số 123/2021/NĐ-CP ngày 28 tháng 12 năm 2021 của Chính phủ sửa đổi, bổ sung một số điều của các Nghị định quy định xử phạt vi phạm hành chính trong lĩnh vực hàng hải; giao thông đường bộ, đường sắt; hàng không dân dụng\n\n1. Bổ sung khoản 2a vào sau khoản 2 Điều 1 như sau:\n\n“2a. Hình thức, mức xử phạt, biện pháp khắc phục hậu quả đối với từng hành vi vi phạm hành chính; thẩm quyền lập biên bản, thẩm quyền xử phạt, mức phạt tiền cụ thể đối với từng chức danh về trật tự, an toàn giao thông trong lĩnh vực giao thông đường bộ thì áp dụng quy định tại Nghị định quy định xử phạt vi phạm hành chính về trật tự, an toàn giao thông trong lĩnh vực giao thông đường bộ; trừ điểm, phục hồi điểm giấy phép lái xe”.\n\n2. Sửa đổi, bổ sung một số điểm của khoản 6 Điều 28 như sau:\n\na) Sửa đổi, bổ sung điểm d khoản 6 Điều 28 như sau:\n\n“d) Không thực hiện đúng các nội dung đã đăng ký, niêm yết về: giá cước; giá dịch vụ; tiêu chuẩn chất lượng dịch vụ vận tải, dịch vụ hỗ trợ vận tải;”;\n\nb) Sửa đổi, bổ sung điểm i khoản 6 Điều 28 như sau:\n\n“i) Sử dụng phương tiện kinh doanh vận tải có chất lượng không bảo đảm điều kiện của hình thức kinh doanh đã đăng ký;”.\n\n3. Sửa đổi, bổ sung điểm a, điểm b khoản 10 Điều 28 như sau:\n\n“a) Thực hiện hành vi vi phạm quy định tại điểm a, điểm b, điểm d, điểm đ, điểm h, điểm l, điểm o, điểm p, điểm r, điểm s, điểm t khoản 4; điểm d, điểm i, điểm k, điểm l, điểm n, điểm q khoản 6; điểm e khoản 7 Điều này bị tước quyền sử dụng phù hiệu từ 01 tháng đến 03 tháng (nếu có hoặc đã được cấp) đối với xe vi phạm;\n\nb) Thực hiện hành vi vi phạm quy định tại điểm i, điểm k khoản 4; điểm h khoản 6; điểm b khoản 7 Điều này bị tước quyền sử dụng giấy phép kinh doanh vận tải từ 01 tháng đến 03 tháng;”.\n\n4. Sửa đổi, bổ sung điểm h khoản 11 Điều 28 như sau:\n\n“h) Thực hiện hành vi vi phạm quy định tại điểm n khoản 6 Điều này buộc lắp đặt đồng hồ tính tiền cước, thiết bị in hóa đơn trên xe theo đúng quy định;”.\n\n5. Sửa đổi, bổ sung một số điểm, khoản của Điều 74 như sau:', 'a) Giấy phép lái xe hết thời hạn sử dụng;\n\nb) Giấy phép lái xe bị thu hồi theo quy định tại khoản 5 Điều 62 của Luật này.\n\n8. Giấy phép lái xe quốc tế được quy định như sau:\n\na) Giấy phép lái xe quốc tế là giấy phép lái xe do cơ quan nhà nước có thẩm quyền của quốc gia là thành viên của Công ước Viên cấp theo một mẫu thống nhất; có thời hạn không quá 03 năm kể từ ngày cấp và phải phù hợp với thời hạn còn hiệu lực của giấy phép lái xe quốc gia;\n\nb) Người có giấy phép lái xe quốc tế do quốc gia là thành viên của Công ước Viên cấp khi lái xe tham gia giao thông đường bộ trên lãnh thổ Việt Nam phải mang theo giấy phép lái xe quốc tế và giấy phép lái xe quốc gia được cấp phù hợp với hạng xe điều khiển, còn thời hạn sử dụng; phải tuân thủ pháp luật về trật tự, an toàn giao thông đường bộ của Việt Nam;\n\nc) Người có giấy phép lái xe quốc tế vi phạm pháp luật về trật tự, an toàn giao thông đường bộ của Việt Nam mà bị tước quyền sử dụng giấy phép lái xe có thời hạn thì thời gian bị tước quyền sử dụng không quá thời gian người lái xe được phép cư trú tại lãnh thổ Việt Nam;\n\nd) Người Việt Nam hoặc người nước ngoài có thẻ thường trú hoặc thẻ tạm trú tại Việt Nam có giấy phép lái xe do Việt Nam hoặc quốc gia là thành viên của điều ước quốc tế mà nước Cộng hòa xã hội chủ nghĩa Việt Nam là thành viên cấp, còn giá trị sử dụng, nếu có nhu cầu được cấp giấy phép lái xe quốc tế.\n\n9. Bộ trưởng Bộ Giao thông vận tải quy định mẫu giấy phép lái xe và giấy phép lái xe quốc tế, trình tự, thủ tục cấp và việc sử dụng giấy phép lái xe, giấy phép lái xe quốc tế; đối với mẫu giấy phép lái xe, trình tự, thủ tục cấp và việc sử dụng giấy phép lái xe của lực lượng quân đội, công an làm nhiệm vụ quốc phòng, an ninh do Bộ trưởng Bộ Quốc phòng, Bộ trưởng Bộ Công an quy định.\n\nĐiều 58. Điểm của giấy phép lái xe \n\n1. Điểm của giấy phép lái xe được dùng để quản lý việc chấp hành pháp luật về trật tự, an toàn giao thông đường bộ của người lái xe trên hệ thống cơ sở dữ liệu về trật tự, an toàn giao thông đường bộ, bao gồm 12 điểm. Số điểm trừ mỗi lần vi phạm tùy thuộc tính chất, mức độ của hành vi vi phạm pháp luật về trật tự, an toàn giao thông đường bộ. Dữ liệu về điểm trừ giấy phép lái xe của người vi phạm sẽ được cập nhật vào hệ thống cơ sở dữ liệu ngay sau khi quyết định xử phạt có hiệu lực thi hành và thông báo cho người bị trừ điểm giấy phép lái xe biết.\n\n2. Giấy phép lái xe chưa bị trừ hết điểm và không bị trừ điểm trong thời hạn 12 tháng từ ngày bị trừ điểm gần nhất thì được phục hồi đủ 12 điểm.\n\n3. Trường hợp giấy phép lái xe bị trừ hết điểm thì người có giấy phép lái xe không được điều khiển phương tiện tham gia giao thông đường bộ theo giấy phép lái xe đó. Sau thời hạn ít nhất là 06 tháng kể từ ngày bị trừ hết điểm, người có giấy phép lái xe được tham gia kiểm tra nội dung kiến thức pháp luật về trật tự, an toàn giao thông đường bộ theo quy định tại khoản 7 Điều 61 của Luật này do lực lượng Cảnh sát giao thông tổ chức, có kết quả đạt yêu cầu thì được phục hồi đủ 12 điểm.\n\n4. Giấy phép lái xe sau khi đổi, cấp lại, nâng hạng được giữ nguyên số điểm của giấy phép lái xe trước khi đổi, cấp lại, nâng hạng.\n\n5. Người có thẩm quyền xử phạt vi phạm hành chính có thẩm quyền trừ điểm giấy phép lái xe.\n\n6. Chính phủ quy định chi tiết khoản 1 Điều này; quy định trình tự, thủ tục, thẩm quyền trừ điểm, phục hồi điểm giấy phép lái xe; quy định lộ trình thực hiện Điều này. Bộ trưởng Bộ Công an quy định chi tiết khoản 3 Điều này.\n\nĐiều 59. Tuổi, sức khỏe của người điều khiển phương tiện tham gia giao thông đường bộ\n\n1. Độ tuổi của người lái xe, người điều khiển xe máy chuyên dùng được quy định như sau:\n\na) Người đủ 16 tuổi trở lên được điều khiển xe gắn máy;\n\nb) Người đủ 18 tuổi trở lên được cấp giấy phép lái xe hạng A1, A, B1, B, C1, được cấp chứng chỉ bồi dưỡng kiến thức pháp luật về giao thông đường bộ để điều khiển xe máy chuyên dùng tham gia giao thông đường bộ;\n\nc) Người đủ 21 tuổi trở lên được cấp giấy phép lái xe hạng C, BE;\n\nd) Người đủ 24 tuổi trở lên được cấp giấy phép lái xe hạng D1, D2, C1E, CE;\n\nđ) Người đủ 27 tuổi trở lên được cấp giấy phép lái xe hạng D, D1E, D2E, DE;\n\ne) Tuổi tối đa của người lái xe ô tô chở người (kể cả xe buýt) trên 29 chỗ (không kể chỗ của người lái xe), xe ô tô chở người giường nằm là đủ 57 tuổi đối với nam, đủ 55 tuổi đối với nữ.\n\n2. Người điều khiển phương tiện tham gia giao thông đường bộ phải bảo đảm điều kiện sức khỏe phù hợp với từng loại phương tiện được phép điều khiển. Bộ trưởng Bộ Y tế quy định về tiêu chuẩn sức khỏe, việc khám sức khỏe đối với người lái xe, người điều khiển xe máy chuyên dùng; việc khám sức khỏe định kỳ đối với người hành nghề lái xe ô tô; xây dựng cơ sở dữ liệu về sức khỏe của người lái xe, người điều khiển xe máy chuyên dùng.\n\n3. Bộ trưởng Bộ Quốc phòng, Bộ trưởng Bộ Công an quy định độ tuổi của người lái xe trong lực lượng quân đội, công an làm nhiệm vụ quốc phòng, an ninh.\n\nĐiều 60. Đào tạo lái xe\n\n1. Người có nhu cầu được cấp giấy phép lái xe phải được đào tạo nội dung lý thuyết và thực hành theo chương trình đào tạo quy định cho từng hạng giấy phép lái xe.\n\n2. Người học lái xe phải được đào tạo tại các cơ sở đào tạo lái xe hoặc các hình thức đào tạo lái xe khác để cấp mới hoặc nâng hạng giấy phép lái xe.\n\n3. Việc đào tạo để nâng hạng giấy phép lái xe thực hiện đối với những đối tượng sau đây:\n\na) Nâng hạng giấy phép lái xe từ hạng B lên hạng C1 hoặc lên hạng C hoặc lên hạng D1 hoặc lên hạng D2;\n\nb) Nâng hạng giấy phép lái xe từ hạng C1 lên hạng C hoặc lên hạng D1 hoặc lên hạng D2;\n\nc) Nâng hạng giấy phép lái xe từ hạng C lên hạng D1 hoặc lên hạng D2 hoặc lên hạng D;\n\nd) Nâng hạng giấy phép lái xe từ hạng D1 lên hạng D2 hoặc lên hạng D;\n\nđ) Nâng hạng giấy phép lái xe từ hạng D2 lên hạng D;\n\ne) Nâng hạng giấy phép lái xe từ hạng B lên hạng BE, từ hạng C1 lên\xa0 hạng C1E, từ hạng C lên hạng CE, từ hạng D1 lên hạng D1E, từ hạng D2 lên hạng D2E, từ hạng D lên hạng DE.\n\n4.\xa0Người có nhu cầu được đào tạo nâng hạng giấy phép lái xe khi giấy phép lái xe còn hiệu lực, phải có đủ thời gian lái xe an toàn quy định cho từng hạng giấy phép lái xe;\xa0đối với việc nâng hạng giấy phép lái xe lên hạng D1, D2, D thì người có nhu cầu được đào tạo còn phải có trình độ từ trung học cơ sở trở lên.\n\n5. Giấy phép lái xe các hạng C, D1, D2, D, BE, C1E, CE, D1E, D2E, DE phải được đào tạo bằng hình thức đào tạo nâng hạng theo các điều kiện quy định tại khoản 3 và khoản 4 Điều này.\n\n6. Cơ sở đào tạo lái xe ô tô phải đáp ứng các điều kiện do Chính phủ quy định; có giáo trình, giáo án; thực hiện đào tạo theo đúng hình thức, nội dung và chương trình quy định cho từng hạng giấy phép lái xe.\n\n7. Chính phủ quy định chi tiết các hình thức đào tạo lái xe khác quy định tại khoản 2 Điều này; quy định trình tự, thủ tục kiểm tra, đánh giá để cấp, cấp lại và thu hồi giấy phép xe tập lái; quy định tiêu chuẩn của giáo viên dạy lái xe; quy định việc cấp, cấp lại và thu hồi giấy chứng nhận giáo viên dạy lái xe; quy định việc cấp, cấp lại và thu hồi giấy phép đào tạo lái xe.\n\n8. Bộ trưởng Bộ Giao thông vận tải quy định hình thức, nội dung, chương trình đào tạo lái xe, thời gian lái xe an toàn cho từng hạng giấy phép lái xe quy định tại khoản 4 Điều này và quy định tiêu chuẩn của cơ sở đào tạo lái xe mô tô; đối với cơ sở đào tạo, tổ chức đào tạo lái xe cho lực lượng quân đội, công an làm nhiệm vụ quốc phòng, an ninh do Bộ trưởng Bộ Quốc phòng, Bộ trưởng Bộ Công an quy định.\n\nĐiều 61. Sát hạch lái xe\n\n1. Người đã hoàn thành chương trình đào tạo lái xe, có độ tuổi, sức khỏe theo quy định tại Điều 59 của Luật này được đăng ký để tham dự kỳ sát hạch lái xe.\n\n2. Nội dung sát hạch lái xe phải phù hợp với hạng giấy phép lái xe và chương trình đào tạo lái xe.\n\n3. Hoạt động sát hạch lái xe ô tô phải thực hiện tại các trung tâm sát hạch lái xe; hoạt động sát hạch lái xe mô tô thực hiện tại các trung tâm sát hạch lái xe hoặc tại sân tập lái đáp ứng điều kiện, tiêu chuẩn về cơ sở vật chất, kỹ thuật. Hoạt động sát hạch lái xe do cơ quan nhà nước có thẩm quyền thực hiện.', 'BỘ CÔNG AN\n------- CỘNG HÒA XÃ HỘI CHỦ NGHĨA VIỆT NAM\nĐộc lập - Tự do - Hạnh phúc\n--------------- Số: 65/2024/TT-BCA Hà Nội, ngày 12 tháng 11 năm 2024\n\nTHÔNG TƯ\n\nQUY ĐỊNH KIỂM TRA KIẾN THỨC PHÁP LUẬT VỀ TRẬT TỰ, AN TOÀN GIAO THÔNG ĐƯỜNG BỘ ĐỂ ĐƯỢC PHỤC HỒI ĐIỂM GIẤY PHÉP LÁI XE\n\nCăn cứ Luật Trật tự, an toàn giao thông đường bộ ngày 27 tháng 6 năm 2024;\n\nCăn cứ Nghị định số 01/2018/NĐ-CP ngày 06 tháng 8 năm 2018 của Chính phủ quy định chức năng, nhiệm vụ, quyền hạn và cơ cấu tổ chức của Bộ Công an;\n\nTheo đề nghị của Cục trưởng Cục Cảnh sát giao thông;\n\nBộ trưởng Bộ Công an ban hành Thông tư quy định kiểm tra kiến thức pháp luật về trật tự, an toàn giao thông đường bộ để được phục hồi điểm giấy phép lái xe.\n\nChương I\n\nQUY ĐỊNH CHUNG\n\nĐiều 1. Phạm vi điều chỉnh\n\nThông tư này quy định kiểm tra kiến thức pháp luật về trật tự, an toàn giao thông đường bộ đối với người có giấy phép lái xe bị trừ hết điểm để được phục hồi điểm giấy phép lái xe.\n\nĐiều 2. Đối tượng áp dụng\n\n1. Sĩ quan, hạ sĩ quan Công an nhân dân (sau đây gọi chung là cán bộ) thực hiện nhiệm vụ kiểm tra kiến thức pháp luật về trật tự, an toàn giao thông đường bộ.\n\n2. Công an các đơn vị, địa phương.\n\n3. Người có giấy phép lái xe bị trừ hết điểm.\n\n4. Cơ quan, tổ chức, cá nhân có liên quan đến kiểm tra kiến thức pháp luật về trật tự, an toàn giao thông đường bộ.\n\nChương II\n\nQUY ĐỊNH CỤ THỂ\n\n\n\nĐiều 3. Người được tham gia kiểm tra kiến thức pháp luật về trật tự, an toàn giao thông đường bộ\n\nNgười được tham gia kiểm tra kiến thức pháp luật về trật tự, an toàn giao thông đường bộ là người có giấy phép lái xe bị trừ hết điểm.\n\nĐiều 4. Cơ quan có thẩm quyền kiểm tra kiến thức pháp luật về trật tự, an toàn giao thông đường bộ\n\nCơ quan có thẩm quyền kiểm tra kiến thức pháp luật về trật tự, an toàn giao thông đường bộ:\n\n1. Cục Cảnh sát giao thông.\n\n2. Phòng Cảnh sát giao thông Công an tỉnh, thành phố trực thuộc trung ương.\n\nĐiều 5. Bảo đảm điều kiện tổ chức kiểm tra kiến thức pháp luật về trật tự, an toàn giao thông đường bộ\n\n1. Bảo đảm về cơ sở vật chất, thiết bị thuộc quyền sử dụng của cơ quan có thẩm quyền kiểm tra:\n\na) Có phòng kiểm tra kiến thức pháp luật về trật tự, an toàn giao thông đường bộ, được trang bị máy tính, máy in dùng cho cán bộ thực hiện nhiệm vụ kiểm tra và cơ sở vật chất, thiết bị cần thiết trực tiếp phục vụ việc kiểm tra; máy tính để người dự kiểm tra sử dụng có kết nối mạng WAN Bộ Công an đến máy chủ đặt tại Cục Cảnh sát giao thông;\n\nMáy chủ có cài đặt phần mềm kiểm tra kiến thức pháp luật về trật tự, an toàn giao thông đường bộ được Bộ Công an phê duyệt được kết nối với máy tính tại các điểm kiểm tra và phải bảo đảm an ninh, an toàn dữ liệu các máy tính sử dụng để phục vụ kiểm tra, lưu trữ nhật ký kết nối, chỉnh sửa dữ liệu.\n\nb) Có hệ thống camera giám sát được toàn bộ hình ảnh phòng kiểm tra, có thiết bị lưu trữ dữ liệu hình ảnh camera. Hệ thống camera giám sát phải đảm bảo tính bảo mật, ngăn chặn các truy cập trái phép từ bên ngoài;\n\nc) Trường hợp máy tính tại nơi kiểm tra chưa có kết nối mạng WAN theo quy định tại điểm a khoản 1 Điều này thì cơ quan có thẩm quyền kiểm tra sử dụng thiết bị có chức năng lưu trữ thông tin bảo đảm an ninh, an toàn để lưu trữ thông tin của người dự kiểm tra phục vụ việc tổ chức kiểm tra.\n\n2. Cán bộ được giao nhiệm vụ kiểm tra kiến thức pháp luật về trật tự, an toàn giao thông đường bộ phải có giấy phép lái xe mô tô hạng A và giấy phép lái xe ô tô, được Cục Cảnh sát giao thông tổ chức tập huấn, cấp thẻ Sát hạch viên.\n\nĐiều 6. Nội dung, phương pháp, thời gian, kết cấu bài kiểm tra, kết quả kiểm tra đạt yêu cầu\n\n\n\n1. Nội dung kiểm tra, bao gồm:\n\na) Kiểm tra lý thuyết kiến thức pháp luật về trật tự, an toàn giao thông đường bộ được thực hiện theo câu hỏi sát hạch lý thuyết để cấp giấy phép lái xe theo quy định của Bộ trưởng Bộ Giao thông vận tải (sau đây viết gọn là kiểm tra lý thuyết kiến thức pháp luật);\n\nb) Kiểm tra kiến thức pháp luật về trật tự, an toàn giao thông đường bộ theo mô phỏng các tình huống giao thông trên máy tính theo quy định của Bộ trưởng Bộ Giao thông vận tải (sau đây viết gọn là kiểm tra kiến thức pháp luật theo mô phỏng).\n\n2. Phương pháp kiểm tra:\n\na) Đối với kiểm tra lý thuyết kiến thức pháp luật, người dự kiểm tra thực hiện bài kiểm tra trắc nghiệm trên máy tính theo phần mềm kiểm tra kiến thức pháp luật về trật tự, an toàn giao thông đường bộ;\n\nb) Đối với kiểm tra kiến thức pháp luật theo mô phỏng, người dự kiểm tra xử lý các tình huống giao thông theo mô phỏng trên máy tính.\n\n3. Thời gian, kết cấu bài kiểm tra và kết quả kiểm tra lý thuyết kiến thức pháp luật đạt yêu cầu:\n\na) Người dự kiểm tra có giấy phép lái xe hạng A1 làm bài kiểm tra trong thời gian 19 phút. Kết cấu bài kiểm tra gồm 25 câu hỏi trắc nghiệm, mỗi câu hỏi được tính 01 điểm, trong đó có 01 câu hỏi được tính là điểm liệt. Kết quả từ 21/25 điểm trở lên là đạt yêu cầu. Trường hợp kết quả từ 21/25 điểm trở lên nhưng trả lời sai vào câu hỏi được tính là điểm liệt thì không đạt yêu cầu;\n\nb) Người dự kiểm tra có giấy phép lái xe hạng A, B1 làm bài kiểm tra trong thời gian 19 phút. Kết cấu bài kiểm tra gồm 25 câu hỏi trắc nghiệm, mỗi câu hỏi được tính 01 điểm, trong đó có 01 câu hỏi được tính là điểm liệt. Kết quả đạt từ 23/25 điểm trở lên là đạt yêu cầu. Trường hợp kết quả từ 23/25 điểm trở lên nhưng trả lời sai vào câu hỏi được tính là điểm liệt thì không đạt yêu cầu;\n\nc) Người dự kiểm tra có giấy phép lái xe hạng B làm bài kiểm tra trong thời gian 20 phút. Kết cấu bài kiểm tra gồm 30 câu hỏi trắc nghiệm, mỗi câu hỏi được tính 01 điểm, trong đó có 01 câu hỏi được tính là điểm liệt. Kết quả đạt từ 27/30 điểm trở lên là đạt yêu cầu. Trường hợp kết quả từ 27/30 điểm trở lên nhưng trả lời sai vào câu hỏi được tính là điểm liệt thì không đạt yêu cầu;\n\nd) Người dự kiểm tra có giấy phép lái xe hạng C1 làm bài kiểm tra trong thời gian 22 phút. Kết cấu bài kiểm tra gồm 35 câu hỏi trắc nghiệm, mỗi câu hỏi được tính 01 điểm, trong đó có 01 câu hỏi được tính là điểm liệt. Kết quả đạt từ 32/35 điểm trở lên là đạt yêu cầu. Trường hợp kết quả từ 32/35 điểm trở lên nhưng trả lời sai vào câu hỏi được tính là điểm liệt thì không đạt yêu cầu;\n\nđ) Người dự kiểm tra có giấy phép lái xe hạng C làm bài kiểm tra trong thời gian 24 phút. Kết cấu bài kiểm tra gồm 40 câu hỏi trắc nghiệm, mỗi câu hỏi được tính 01 điểm, trong đó có 01 câu hỏi được tính là điểm liệt. Kết quả đạt từ 36/40 điểm trở lên là đạt yêu cầu. Trường hợp kết quả từ 36/40 điểm trở lên nhưng trả lời sai vào câu hỏi được tính là điểm liệt thì không đạt yêu cầu;\n\ne) Người dự kiểm tra có giấy phép lái xe hạng D1, D2, D, BE, C1Q, CE, D1E, D2E, DE làm bài kiểm tra trong thời gian 26 phút. Kết cấu bài kiểm tra gồm 45 câu hỏi trắc nghiệm, mỗi câu hỏi được tính 01 điểm, trong đó có 01 câu hỏi được tính là điểm liệt. Kết quả đạt từ 41/45 điểm trở lên là đạt yêu cầu. Trường hợp kết quả từ 41/45 điểm trở lên nhưng trả lời sai vào câu hỏi được tính là điểm liệt thì không đạt yêu cầu.\n\n4. Thời gian, kết cấu bài kiểm tra và kết quả kiểm tra kiến thức pháp luật theo mô phỏng đạt yêu cầu:\n\nThời gian kiểm tra không quá 10 phút. Bài kiểm tra được thiết kế dưới dạng 10 câu hỏi mô phỏng các tình huống giao thông, mỗi câu hỏi là 01 tình huống tiềm ẩn nguy cơ mất an toàn giao thông, mỗi câu hỏi có số điểm tối đa là 05 điểm và số điểm tối thiểu là 0 điểm. Số điểm đạt được của người dự kiểm tra tương ứng với thời điểm nhận biết và xác định tình huống tiềm ẩn nguy cơ mất an toàn giao thông thông qua việc tương tác với máy tính có cài đặt phần mềm mô phỏng. Người dự kiểm tra đạt từ 35/50 điểm trở lên là đạt yêu cầu.\n\n5. Kết quả kiểm tra đạt yêu cầu được phục hồi điểm giấy phép lái xe:\n\na) Đối với trường hợp người có giấy phép lái xe mô tô bị trừ hết điểm: được phục hồi điểm giấy phép lái xe khi có kết quả kiểm tra lý thuyết kiến thức pháp luật đạt yêu cầu quy định tại điểm a, điểm b khoản 3 Điều này;']","**Nguồn văn bản:** /content/drive/MyDrive/ITProject_data/new_law/36_2024_QH15_444251.docx

**Tên văn bản:** (Không có tiêu đề trong metadata)

**(Không có điều khoản trong metadata):**

**Nội dung:**

2. Giấy phép lái xe chưa bị trừ hết điểm và không bị trừ điểm trong thời hạn 12 tháng từ ngày bị trừ điểm gần nhất thì được phục hồi đủ 12 điểm.

3. Trường hợp giấy phép lái xe bị trừ hết điểm thì người có giấy phép lái xe không được điều khiển phương tiện tham gia giao thông đường bộ theo giấy phép lái xe đó.
Sau thời hạn ít nhất là 06 tháng kể từ ngày bị trừ hết điểm, người có giấy phép lái xe được tham gia kiểm tra nội dung kiến thức pháp luật về trật tự, an toàn giao thông đường bộ theo quy định tại khoản 7 Điều 61 của Luật này do lực lượng Cảnh sát giao thông tổ chức, có kết quả đạt yêu cầu thì được phục hồi đủ 12 điểm.


**Tóm lại:** Có hai điều kiện để phục hồi điểm giấy phép lái xe máy:

1. Nếu giấy phép lái xe chưa bị trừ hết điểm và không bị trừ điểm trong vòng 12 tháng, kể từ ngày bị trừ điểm gần nhất, thì điểm sẽ tự động được phục hồi.

2. Nếu giấy phép lái xe bị trừ hết điểm, người điều khiển phải chờ ít nhất 6 tháng, sau đó tham gia kỳ kiểm tra kiến thức luật giao thông đường bộ do Cảnh sát giao thông tổ chức. Nếu đạt yêu cầu, điểm sẽ được phục hồi.
",Người lái xe máy phải làm kiểm tra lý thuyết theo các câu hỏi như khi thi bằng lái xe.,1.0,0.8205775538432268,1.0,0.3333333333
12,Người lái ô tô cần làm gì để phục hồi điểm giấy phép lái xe?,"['đ) Không trừ điểm giấy phép lái xe khi giấy phép lái xe đó đang trong thời hạn bị tước quyền sử dụng giấy phép lái xe.\n\n2. Thẩm quyền trừ điểm giấy phép lái xe\n\nNgười có thẩm quyền áp dụng hình thức xử phạt tước quyền sử dụng giấy phép, chứng chỉ hành nghề có thời hạn hoặc đình chỉ hoạt động có thời hạn quy định tại Chương II Phần thứ hai của Luật Xử lý vi phạm hành chính, Mục 1 Chương III của Nghị định này và có thẩm quyền xử phạt vi phạm hành chính đối với hành vi vi phạm có quy định trừ điểm giấy phép lái xe thì có thẩm quyền trừ điểm giấy phép lái xe đối với hành vi vi phạm đó.\n\n3. Trình tự, thủ tục trừ điểm giấy phép lái xe\n\na) Ngay sau khi quyết định xử phạt vi phạm hành chính có hiệu lực thi hành, dữ liệu trừ điểm giấy phép lái xe của người bị xử phạt sẽ được cập nhật tự động vào Cơ sở dữ liệu về xử lý vi phạm hành chính về trật tự, an toàn giao thông đường bộ, người có thẩm quyền trừ điểm giấy phép lái xe thông báo cho người bị trừ điểm giấy phép lái xe biết việc trừ điểm.\n\nTrường hợp Chủ tịch Ủy ban nhân dân cấp huyện, Chủ tịch Ủy ban nhân dân cấp tỉnh ra quyết định xử phạt vi phạm hành chính đối với hành vi vi phạm có trừ điểm giấy phép lái xe thì Trưởng Công an cấp huyện hoặc Trưởng phòng Cảnh sát giao thông Công an cấp tỉnh có trách nhiệm cập nhật dữ liệu trừ điểm giấy phép lái xe vào Cơ sở dữ liệu về xử lý vi phạm hành chính về trật tự, an toàn giao thông đường bộ;\n\nb) Việc thông báo trừ điểm giấy phép lái xe thực hiện bằng văn bản theo mẫu quy định của Bộ trưởng Bộ Công an và được giao trực tiếp hoặc gửi qua dịch vụ bưu chính hoặc thực hiện thông báo bằng phương thức điện tử thông qua tài khoản của công dân đăng ký trên Cổng dịch vụ công, Ứng dụng giao thông trên thiết bị di động khi đáp ứng điều kiện về cơ sở hạ tầng, kỹ thuật, thông tin; đồng thời cập nhật thông tin về giấy phép lái xe bị trừ điểm trên Trang thông tin điện tử của Cục Cảnh sát giao thông. Trường hợp giấy phép lái xe được thể hiện dưới hình thức thông điệp dữ liệu thì cơ quan, người có thẩm quyền thực hiện cập nhật trạng thái trừ điểm giấy phép lái xe trong căn cước điện tử, tài khoản định danh điện tử trên ứng dụng định danh quốc gia.\n\nĐiều 51. Thẩm quyền, trình tự, thủ tục phục hồi điểm giấy phép lái xe\n\n1. Thẩm quyền phục hồi điểm giấy phép lái xe\n\na) Cục trưởng Cục Cảnh sát giao thông có trách nhiệm quản lý, vận hành Cơ sở dữ liệu về xử lý vi phạm hành chính về trật tự, an toàn giao thông đường bộ để thực hiện cập nhật, tự động phục hồi điểm giấy phép lái xe đối với trường hợp quy định tại khoản 2 Điều này;\n\nb) Cục trưởng Cục Cảnh sát giao thông, Trưởng phòng Cảnh sát giao thông nơi tổ chức kiểm tra kiến thức pháp luật về trật tự, an toàn giao thông đường bộ có thẩm quyền phục hồi điểm cho giấy phép lái xe đối với trường hợp quy định tại khoản 3 Điều này.\n\n2. Trình tự, thủ tục phục hồi điểm giấy phép lái xe đối với trường hợp giấy phép lái xe chưa bị trừ hết điểm và không bị trừ điểm trong thời hạn 12 tháng từ ngày bị trừ điểm gần nhất\n\na) Khi đủ thời hạn 12 tháng, kể từ ngày bị trừ điểm giấy phép lái xe gần nhất, dữ liệu điểm giấy phép lái xe sẽ được tự động phục hồi đủ 12 điểm (gồm cả giấy phép lái xe đang trong thời hạn bị tước quyền sử dụng) và cập nhật tự động trong Cơ sở dữ liệu về xử lý vi phạm hành chính về trật tự, an toàn giao thông đường bộ;\n\nb) Ngay sau khi dữ liệu điểm giấy phép lái xe được phục hồi, Cơ sở dữ liệu về xử lý vi phạm hành chính về trật tự, an toàn giao thông đường bộ sẽ tự động chuyển thông tin thông báo cho người được phục hồi điểm giấy phép lái xe biết việc phục hồi điểm theo quy định tại điểm c khoản này;\n\nc) Việc thông báo phục hồi điểm giấy phép lái xe thực hiện bằng phương thức điện tử thông qua tài khoản của công dân đăng ký trên Cổng dịch vụ công, Ứng dụng giao thông trên thiết bị di động; đồng thời cập nhật thông tin về giấy phép lái xe được phục hồi điểm trên Trang thông tin điện tử của Cục Cảnh sát giao thông. Trường hợp giấy phép lái xe được thể hiện dưới hình thức thông điệp dữ liệu thì thực hiện cập nhật trạng thái phục hồi điểm giấy phép lái xe trong căn cước điện tử, tài khoản định danh điện tử trên ứng dụng định danh quốc gia.\n\n3. Trình tự, thủ tục phục hồi điểm giấy phép lái xe đối với trường hợp giấy phép lái xe bị trừ hết điểm\n\na) Sau khi người có giấy phép lái xe bị trừ hết điểm tham gia kiểm tra nội dung kiến thức pháp luật về trật tự, an toàn giao thông đường bộ và đạt yêu cầu, kết quả kiểm tra được cập nhật vào phần mềm kiểm tra kiến thức pháp luật về trật tự, an toàn giao thông đường bộ và đồng bộ dữ liệu với Cơ sở dữ liệu về xử lý vi phạm hành chính về trật tự, an toàn giao thông đường bộ, dữ liệu điểm giấy phép lái xe sẽ được phục hồi đủ 12 điểm và cập nhật tự động trong Cơ sở dữ liệu về xử lý vi phạm hành chính về trật tự, an toàn giao thông đường bộ;\n\nb) Ngay sau khi dữ liệu điểm giấy phép lái xe được phục hồi đủ 12 điểm thì người có thẩm quyền quy định tại điểm b khoản 1 Điều này thông báo cho người được phục hồi điểm giấy phép lái xe biết việc phục hồi điểm;\n\nc) Việc thông báo phục hồi điểm giấy phép lái xe thực hiện bằng văn bản theo mẫu quy định của Bộ trưởng Bộ Công an và được giao trực tiếp hoặc gửi qua dịch vụ bưu chính hoặc thực hiện thông báo bằng phương thức điện tử thông qua tài khoản của công dân đăng ký trên Cổng dịch vụ công, Ứng dụng giao thông trên thiết bị di động; đồng thời cập nhật thông tin về giấy phép lái xe được phục hồi điểm trên Trang thông tin điện tử của Cục Cảnh sát giao thông. Trường hợp giấy phép lái xe được thể hiện dưới hình thức thông điệp dữ liệu thì cơ quan, người có thẩm quyền thực hiện cập nhật trạng thái phục hồi điểm giấy phép lái xe trong căn cước điện tử, tài khoản định danh điện tử trên ứng dụng định danh quốc gia.\n\nChương IV\n\nĐIỀU KHOẢN THI HÀNH\n\nĐiều 52. Sửa đổi, bổ sung một số điều của Nghị định số 100/2019/NĐ-CP ngày 30 tháng 12 năm 2019 của Chính phủ quy định xử phạt vi phạm hành chính trong lĩnh vực giao thông đường bộ và đường sắt đã được sửa đổi, bổ sung một số điều theo Nghị định số 123/2021/NĐ-CP ngày 28 tháng 12 năm 2021 của Chính phủ sửa đổi, bổ sung một số điều của các Nghị định quy định xử phạt vi phạm hành chính trong lĩnh vực hàng hải; giao thông đường bộ, đường sắt; hàng không dân dụng\n\n1. Bổ sung khoản 2a vào sau khoản 2 Điều 1 như sau:\n\n“2a. Hình thức, mức xử phạt, biện pháp khắc phục hậu quả đối với từng hành vi vi phạm hành chính; thẩm quyền lập biên bản, thẩm quyền xử phạt, mức phạt tiền cụ thể đối với từng chức danh về trật tự, an toàn giao thông trong lĩnh vực giao thông đường bộ thì áp dụng quy định tại Nghị định quy định xử phạt vi phạm hành chính về trật tự, an toàn giao thông trong lĩnh vực giao thông đường bộ; trừ điểm, phục hồi điểm giấy phép lái xe”.\n\n2. Sửa đổi, bổ sung một số điểm của khoản 6 Điều 28 như sau:\n\na) Sửa đổi, bổ sung điểm d khoản 6 Điều 28 như sau:\n\n“d) Không thực hiện đúng các nội dung đã đăng ký, niêm yết về: giá cước; giá dịch vụ; tiêu chuẩn chất lượng dịch vụ vận tải, dịch vụ hỗ trợ vận tải;”;\n\nb) Sửa đổi, bổ sung điểm i khoản 6 Điều 28 như sau:\n\n“i) Sử dụng phương tiện kinh doanh vận tải có chất lượng không bảo đảm điều kiện của hình thức kinh doanh đã đăng ký;”.\n\n3. Sửa đổi, bổ sung điểm a, điểm b khoản 10 Điều 28 như sau:\n\n“a) Thực hiện hành vi vi phạm quy định tại điểm a, điểm b, điểm d, điểm đ, điểm h, điểm l, điểm o, điểm p, điểm r, điểm s, điểm t khoản 4; điểm d, điểm i, điểm k, điểm l, điểm n, điểm q khoản 6; điểm e khoản 7 Điều này bị tước quyền sử dụng phù hiệu từ 01 tháng đến 03 tháng (nếu có hoặc đã được cấp) đối với xe vi phạm;\n\nb) Thực hiện hành vi vi phạm quy định tại điểm i, điểm k khoản 4; điểm h khoản 6; điểm b khoản 7 Điều này bị tước quyền sử dụng giấy phép kinh doanh vận tải từ 01 tháng đến 03 tháng;”.\n\n4. Sửa đổi, bổ sung điểm h khoản 11 Điều 28 như sau:\n\n“h) Thực hiện hành vi vi phạm quy định tại điểm n khoản 6 Điều này buộc lắp đặt đồng hồ tính tiền cước, thiết bị in hóa đơn trên xe theo đúng quy định;”.\n\n5. Sửa đổi, bổ sung một số điểm, khoản của Điều 74 như sau:', 'a) Giấy phép lái xe hết thời hạn sử dụng;\n\nb) Giấy phép lái xe bị thu hồi theo quy định tại khoản 5 Điều 62 của Luật này.\n\n8. Giấy phép lái xe quốc tế được quy định như sau:\n\na) Giấy phép lái xe quốc tế là giấy phép lái xe do cơ quan nhà nước có thẩm quyền của quốc gia là thành viên của Công ước Viên cấp theo một mẫu thống nhất; có thời hạn không quá 03 năm kể từ ngày cấp và phải phù hợp với thời hạn còn hiệu lực của giấy phép lái xe quốc gia;\n\nb) Người có giấy phép lái xe quốc tế do quốc gia là thành viên của Công ước Viên cấp khi lái xe tham gia giao thông đường bộ trên lãnh thổ Việt Nam phải mang theo giấy phép lái xe quốc tế và giấy phép lái xe quốc gia được cấp phù hợp với hạng xe điều khiển, còn thời hạn sử dụng; phải tuân thủ pháp luật về trật tự, an toàn giao thông đường bộ của Việt Nam;\n\nc) Người có giấy phép lái xe quốc tế vi phạm pháp luật về trật tự, an toàn giao thông đường bộ của Việt Nam mà bị tước quyền sử dụng giấy phép lái xe có thời hạn thì thời gian bị tước quyền sử dụng không quá thời gian người lái xe được phép cư trú tại lãnh thổ Việt Nam;\n\nd) Người Việt Nam hoặc người nước ngoài có thẻ thường trú hoặc thẻ tạm trú tại Việt Nam có giấy phép lái xe do Việt Nam hoặc quốc gia là thành viên của điều ước quốc tế mà nước Cộng hòa xã hội chủ nghĩa Việt Nam là thành viên cấp, còn giá trị sử dụng, nếu có nhu cầu được cấp giấy phép lái xe quốc tế.\n\n9. Bộ trưởng Bộ Giao thông vận tải quy định mẫu giấy phép lái xe và giấy phép lái xe quốc tế, trình tự, thủ tục cấp và việc sử dụng giấy phép lái xe, giấy phép lái xe quốc tế; đối với mẫu giấy phép lái xe, trình tự, thủ tục cấp và việc sử dụng giấy phép lái xe của lực lượng quân đội, công an làm nhiệm vụ quốc phòng, an ninh do Bộ trưởng Bộ Quốc phòng, Bộ trưởng Bộ Công an quy định.\n\nĐiều 58. Điểm của giấy phép lái xe \n\n1. Điểm của giấy phép lái xe được dùng để quản lý việc chấp hành pháp luật về trật tự, an toàn giao thông đường bộ của người lái xe trên hệ thống cơ sở dữ liệu về trật tự, an toàn giao thông đường bộ, bao gồm 12 điểm. Số điểm trừ mỗi lần vi phạm tùy thuộc tính chất, mức độ của hành vi vi phạm pháp luật về trật tự, an toàn giao thông đường bộ. Dữ liệu về điểm trừ giấy phép lái xe của người vi phạm sẽ được cập nhật vào hệ thống cơ sở dữ liệu ngay sau khi quyết định xử phạt có hiệu lực thi hành và thông báo cho người bị trừ điểm giấy phép lái xe biết.\n\n2. Giấy phép lái xe chưa bị trừ hết điểm và không bị trừ điểm trong thời hạn 12 tháng từ ngày bị trừ điểm gần nhất thì được phục hồi đủ 12 điểm.\n\n3. Trường hợp giấy phép lái xe bị trừ hết điểm thì người có giấy phép lái xe không được điều khiển phương tiện tham gia giao thông đường bộ theo giấy phép lái xe đó. Sau thời hạn ít nhất là 06 tháng kể từ ngày bị trừ hết điểm, người có giấy phép lái xe được tham gia kiểm tra nội dung kiến thức pháp luật về trật tự, an toàn giao thông đường bộ theo quy định tại khoản 7 Điều 61 của Luật này do lực lượng Cảnh sát giao thông tổ chức, có kết quả đạt yêu cầu thì được phục hồi đủ 12 điểm.\n\n4. Giấy phép lái xe sau khi đổi, cấp lại, nâng hạng được giữ nguyên số điểm của giấy phép lái xe trước khi đổi, cấp lại, nâng hạng.\n\n5. Người có thẩm quyền xử phạt vi phạm hành chính có thẩm quyền trừ điểm giấy phép lái xe.\n\n6. Chính phủ quy định chi tiết khoản 1 Điều này; quy định trình tự, thủ tục, thẩm quyền trừ điểm, phục hồi điểm giấy phép lái xe; quy định lộ trình thực hiện Điều này. Bộ trưởng Bộ Công an quy định chi tiết khoản 3 Điều này.\n\nĐiều 59. Tuổi, sức khỏe của người điều khiển phương tiện tham gia giao thông đường bộ\n\n1. Độ tuổi của người lái xe, người điều khiển xe máy chuyên dùng được quy định như sau:\n\na) Người đủ 16 tuổi trở lên được điều khiển xe gắn máy;\n\nb) Người đủ 18 tuổi trở lên được cấp giấy phép lái xe hạng A1, A, B1, B, C1, được cấp chứng chỉ bồi dưỡng kiến thức pháp luật về giao thông đường bộ để điều khiển xe máy chuyên dùng tham gia giao thông đường bộ;\n\nc) Người đủ 21 tuổi trở lên được cấp giấy phép lái xe hạng C, BE;\n\nd) Người đủ 24 tuổi trở lên được cấp giấy phép lái xe hạng D1, D2, C1E, CE;\n\nđ) Người đủ 27 tuổi trở lên được cấp giấy phép lái xe hạng D, D1E, D2E, DE;\n\ne) Tuổi tối đa của người lái xe ô tô chở người (kể cả xe buýt) trên 29 chỗ (không kể chỗ của người lái xe), xe ô tô chở người giường nằm là đủ 57 tuổi đối với nam, đủ 55 tuổi đối với nữ.\n\n2. Người điều khiển phương tiện tham gia giao thông đường bộ phải bảo đảm điều kiện sức khỏe phù hợp với từng loại phương tiện được phép điều khiển. Bộ trưởng Bộ Y tế quy định về tiêu chuẩn sức khỏe, việc khám sức khỏe đối với người lái xe, người điều khiển xe máy chuyên dùng; việc khám sức khỏe định kỳ đối với người hành nghề lái xe ô tô; xây dựng cơ sở dữ liệu về sức khỏe của người lái xe, người điều khiển xe máy chuyên dùng.\n\n3. Bộ trưởng Bộ Quốc phòng, Bộ trưởng Bộ Công an quy định độ tuổi của người lái xe trong lực lượng quân đội, công an làm nhiệm vụ quốc phòng, an ninh.\n\nĐiều 60. Đào tạo lái xe\n\n1. Người có nhu cầu được cấp giấy phép lái xe phải được đào tạo nội dung lý thuyết và thực hành theo chương trình đào tạo quy định cho từng hạng giấy phép lái xe.\n\n2. Người học lái xe phải được đào tạo tại các cơ sở đào tạo lái xe hoặc các hình thức đào tạo lái xe khác để cấp mới hoặc nâng hạng giấy phép lái xe.\n\n3. Việc đào tạo để nâng hạng giấy phép lái xe thực hiện đối với những đối tượng sau đây:\n\na) Nâng hạng giấy phép lái xe từ hạng B lên hạng C1 hoặc lên hạng C hoặc lên hạng D1 hoặc lên hạng D2;\n\nb) Nâng hạng giấy phép lái xe từ hạng C1 lên hạng C hoặc lên hạng D1 hoặc lên hạng D2;\n\nc) Nâng hạng giấy phép lái xe từ hạng C lên hạng D1 hoặc lên hạng D2 hoặc lên hạng D;\n\nd) Nâng hạng giấy phép lái xe từ hạng D1 lên hạng D2 hoặc lên hạng D;\n\nđ) Nâng hạng giấy phép lái xe từ hạng D2 lên hạng D;\n\ne) Nâng hạng giấy phép lái xe từ hạng B lên hạng BE, từ hạng C1 lên\xa0 hạng C1E, từ hạng C lên hạng CE, từ hạng D1 lên hạng D1E, từ hạng D2 lên hạng D2E, từ hạng D lên hạng DE.\n\n4.\xa0Người có nhu cầu được đào tạo nâng hạng giấy phép lái xe khi giấy phép lái xe còn hiệu lực, phải có đủ thời gian lái xe an toàn quy định cho từng hạng giấy phép lái xe;\xa0đối với việc nâng hạng giấy phép lái xe lên hạng D1, D2, D thì người có nhu cầu được đào tạo còn phải có trình độ từ trung học cơ sở trở lên.\n\n5. Giấy phép lái xe các hạng C, D1, D2, D, BE, C1E, CE, D1E, D2E, DE phải được đào tạo bằng hình thức đào tạo nâng hạng theo các điều kiện quy định tại khoản 3 và khoản 4 Điều này.\n\n6. Cơ sở đào tạo lái xe ô tô phải đáp ứng các điều kiện do Chính phủ quy định; có giáo trình, giáo án; thực hiện đào tạo theo đúng hình thức, nội dung và chương trình quy định cho từng hạng giấy phép lái xe.\n\n7. Chính phủ quy định chi tiết các hình thức đào tạo lái xe khác quy định tại khoản 2 Điều này; quy định trình tự, thủ tục kiểm tra, đánh giá để cấp, cấp lại và thu hồi giấy phép xe tập lái; quy định tiêu chuẩn của giáo viên dạy lái xe; quy định việc cấp, cấp lại và thu hồi giấy chứng nhận giáo viên dạy lái xe; quy định việc cấp, cấp lại và thu hồi giấy phép đào tạo lái xe.\n\n8. Bộ trưởng Bộ Giao thông vận tải quy định hình thức, nội dung, chương trình đào tạo lái xe, thời gian lái xe an toàn cho từng hạng giấy phép lái xe quy định tại khoản 4 Điều này và quy định tiêu chuẩn của cơ sở đào tạo lái xe mô tô; đối với cơ sở đào tạo, tổ chức đào tạo lái xe cho lực lượng quân đội, công an làm nhiệm vụ quốc phòng, an ninh do Bộ trưởng Bộ Quốc phòng, Bộ trưởng Bộ Công an quy định.\n\nĐiều 61. Sát hạch lái xe\n\n1. Người đã hoàn thành chương trình đào tạo lái xe, có độ tuổi, sức khỏe theo quy định tại Điều 59 của Luật này được đăng ký để tham dự kỳ sát hạch lái xe.\n\n2. Nội dung sát hạch lái xe phải phù hợp với hạng giấy phép lái xe và chương trình đào tạo lái xe.\n\n3. Hoạt động sát hạch lái xe ô tô phải thực hiện tại các trung tâm sát hạch lái xe; hoạt động sát hạch lái xe mô tô thực hiện tại các trung tâm sát hạch lái xe hoặc tại sân tập lái đáp ứng điều kiện, tiêu chuẩn về cơ sở vật chất, kỹ thuật. Hoạt động sát hạch lái xe do cơ quan nhà nước có thẩm quyền thực hiện.', 'c) Lưu trữ, bảo quản biên bản sát hạch thực hành lái xe trên đường của từng kỳ sát hạch, gồm: chữ ký của thí sinh tại phiếu kết quả sát hạch thực hành lái xe trên đường được in từ thiết bị chấm điểm tự động trên ô tô sát hạch thực hành lái xe trên đường hoặc biên bản sát hạch thực hành lái xe trên đường có chữ ký của sát hạch viên;\n\nd) Trường hợp cơ sở đào tạo lái xe có sân tập lái dùng để thực hiện sát hạch lái xe mô tô phải lưu trữ dữ liệu giám sát sát hạch; dữ liệu kết quả sát hạch lý thuyết, thực hành lái xe trong hình với thời hạn 03 năm.\n\n3. Trung tâm sát hạch lái xe lưu trữ hồ sơ của kỳ sát hạch bao gồm:\n\na) Các tài liệu quy định tại các điểm d, điểm g và điểm h khoản 1 Điều này;\n\nb) Dữ liệu giám sát sát hạch; dữ liệu kết quả sát hạch lý thuyết, thực hành lái xe trong hình, phần mềm mô phỏng các tình huống giao thông và sát hạch trên đường;\n\nc) Danh sách, kết quả sát hạch lái xe trên phần mềm mô phỏng các tình huống giao thông.\n\n4. Thí sinh tự bảo quản Biên bản tổng hợp kết quả sát hạch.\n\n5. Thời gian lưu trữ hồ sơ\n\na) Không thời hạn đối với các tài liệu quy định tại điểm i và điểm k khoản 1 Điều này;\n\nb) 05 năm đối với các tài liệu quy định tại các điểm a, điểm b, điểm c, điểm d, điểm đ, điểm e, điểm g, điểm h khoản 1 Điều này;\n\nc) 02 năm đối với các tài liệu quy định tại điểm b khoản 3 Điều này.\n\nChương III\n\nCẤP, THU HỒI GIẤY PHÉP LÁI XE\n\nĐiều 31. Mẫu giấy phép lái xe\n\n1. Sở Giao thông vận tải thực hiện việc cấp giấy phép lái xe theo quy định tại Mẫu số 01 Phụ lục XXIV ban hành kèm theo Thông tư này kể từ ngày Thông tư này có hiệu lực đến hết ngày 31 tháng 12 năm 2025; việc cấp giấy phép lái xe theo quy định tại Mẫu số 02 Phụ lục XXIV ban hành kèm theo Thông tư được thực hiện kể từ ngày 01 tháng 01 năm 2026.\n\n2. Việc ghi điều kiện hạn chế của giấy phép lái xe áp dụng cho cả Mẫu số 01 và Mẫu số 02 thực hiện theo quy định tại mục 2 của Mẫu số 03 Phụ lục XXIV ban hành kèm theo Thông tư này.\n\n3. Việc ghi danh mục hạng giấy phép lái xe và mã số điều kiện hạn chế thực hiện đối với giấy phép lái xe theo Mẫu số 02 thực hiện theo quy định tại mục 1 và mục 3 của Mẫu số 03 Phụ lục XXIV ban hành kèm theo Thông tư này.\n\nĐiều 32. Sử dụng, quản lý giấy phép lái xe\n\n1. Giấy phép lái xe bằng vật liệu PET. cấp cho mỗi người bảo đảm duy nhất có 01 số quản lý, dùng chung cho cả giấy phép lái xe không thời hạn và giấy phép lái xe có thời hạn.\n\n2. Cá nhân nếu có nhu cầu tích hợp giấy phép lái xe không thời hạn với giấy phép lái xe có thời hạn thì đăng ký vào đơn đề nghị đổi (cấp lại) giấy phép lái xe quy định tại Phụ lục XXVI ban hành kèm theo Thông tư này, làm thủ tục đổi giấy phép lái xe theo quy định tại Điều 36 của Thông tư này.\n\n3. Người có giấy phép lái xe chỉ được lái loại xe ghi trong giấy phép lái xe.\n\n4. Khi đổi, cấp giấy phép lái xe nâng hạng, cơ quan cấp giấy phép lái xe thu lại giấy phép lái xe cũ và tiêu huỷ theo quy định của pháp luật về lưu trữ.\n\n5. Người có giấy phép lái xe hạng B số tự động không được lái loại xe ô tô số cơ khí (số sàn).\n\n6. Người nước ngoài hoặc người Việt Nam cư trú ở nước ngoài có nhu cầu lái xe ở Việt Nam thực hiện như sau:\n\na) Nếu có giấy phép lái xe quốc gia thì phải làm thủ tục đổi sang giấy phép lái xe tương ứng của Việt Nam;\n\nb) Trường hợp điều ước quốc tế về giấy phép lái xe mà Việt Nam là thành viên có quy định khác thì áp dụng quy định của điều ước quốc tế đó.\n\n7. Giấy phép lái xe bằng vật liệu PET. và giấy phép lái xe cấp từ ngày 01 tháng 01 năm 2025 là giấy phép lái xe do cơ quan có thẩm quyền cấp có hiệu lực, có số phôi, ngày cấp, ngày hết hạn in trên giấy phép lái xe trùng với số phôi, ngày cấp, ngày hết hạn trong hệ thống thông tin quản lý giấy phép lái xe hoặc có thông tin giấy phép lái xe đã được tích hợp vào tài khoản định danh điện tử.\n\nĐiều 33. Xác minh giấy phép lái xe\n\n1. Các trường hợp thực hiện xác minh\n\na) Cấp, đổi giấy phép lái xe do ngành Giao thông vận tải cấp\n\nSở Giao thông vận tải phải tra cứu và in thông tin về giấy phép lái xe trong các trường hợp xét sát hạch nâng hạng, đổi, cấp lại giấy phép lái xe từ hệ thống thông tin quản lý giấy phép lái xe; trường hợp chưa có thông tin phải có văn bản đề nghị cơ quan đã cấp giấy phép lái xe xác minh giấy phép lái xe đã cấp.\n\nKhi chưa có kết quả xác minh giấy phép lái xe hoặc có kết quả xác minh giấy phép lái xe không do Sở Giao thông vận tải cấp thì Sở Giao thông vận tải không xét sát hạch nâng hạng, đổi, cấp lại giấy phép lái xe;\n\nb) Đổi giấy phép lái xe quân sự do Bộ Quốc phòng cấp sang giấy phép lái xe do ngành Giao thông vận tải cấp\n\nTrường hợp phát hiện có nghi vấn, cơ quan cấp đổi giấy phép lái xe có văn bản đề nghị Cục Xe - Máy thuộc Bộ Quốc phòng xác minh giấy phép lái xe đã cấp.\n\nKhi chưa có kết quả xác minh giấy phép lái xe hoặc có kết quả xác minh giấy phép lái xe không do Bộ Quốc phòng cấp thì Sở Giao thông vận tải không đổi giấy phép lái xe;\n\nc) Đổi giấy phép lái xe do ngành Công an cấp sang giấy phép lái xe do ngành Giao thông vận tải cấp\n\nTrường hợp phát hiện có nghi vấn, cơ quan cấp đổi giấy phép lái xe có văn bản đề nghị Cục Cảnh sát giao thông thuộc Bộ Công an quản lý giấy phép lái xe xác minh giấy phép lái xe đã cấp.\n\nKhi chưa có kết quả xác minh giấy phép lái xe hoặc có kết quả xác minh giấy phép lái xe không do ngành Công an cấp thì Sở Giao thông vận tải không đổi giấy phép lái xe.\n\n2. Cách thức thực hiện xác minh giấy phép lái xe\n\na) Sau 01 ngày làm việc kể từ ngày nhận được danh sách đề nghị xác minh giấy phép lái xe của cơ sở đào tạo lái xe hoặc hồ sơ hợp lệ quy định tại Điều 36, Điều 37 và Điều 38 Thông tư này, Sở Giao thông vận tải có văn bản bản đề nghị xác minh giấy phép lái xe theo Mẫu số 01 Phụ lục XXV ban hành kèm theo Thông tư này gửi cơ quan đã cấp giấy phép lái xe;\n\nb) Ngay khi nhận được văn bản đề nghị xác minh, Sở Giao thông vận tải tiếp nhận xác minh giấy phép lái xe phải trả lời bằng hình thức điện thoại hoặc thư điện tử hoặc fax; sau 02 ngày làm việc có văn bản trả lời theo Mẫu số 02 quy định tại Phụ lục XXV ban hành kèm theo Thông tư này.\n\nĐiều 34. Cấp giấy phép lái xe\n\n1. Người đạt kết quả kỳ sát hạch được cấp giấy phép lái xe đúng hạng đã trúng tuyển; đối với trường hợp nâng hạng hoặc cấp theo quy định tại khoản 2\n\nĐiều này phải xuất trình bản chính giấy phép lái xe khi đến nhận giấy phép lái xe\n\na) Căn cứ quyết định công nhận trúng tuyển kỳ sát hạch, Sở Giao thông vận tải cấp giấy phép lái xe cho người trúng tuyển. Ngày trúng tuyển ghi tại mặt sau giấy phép lái xe là ngày ký quyết định công nhận trúng tuyển kỳ sát hạch;\n\nb) Thời gian cấp giấy phép lái xe chậm nhất không quá 10 ngày, kể từ ngày kết thúc kỳ sát hạch và người đạt kết quả kỳ sát hạch đã hoàn thành nghĩa vụ nộp lệ phí cấp giấy phép lái xe.\n\n2. Người có giấy phép lái xe quá thời hạn sử dụng\n\na) Người có giấy phép lái xe các hạng B, C1, C, D1, D2, D, BE, C1E, CE, D1E, D2E, DE quá thời hạn sử dụng\n\nQuá hạn dưới 01 năm kể từ ngày hết hạn phải sát hạch lý thuyết theo quy định tại điểm a khoản 1 Điều 17 Thông tư này để cấp giấy phép lái xe.\n\nQuá hạn từ 01 năm trở lên kể từ ngày hết hạn phải sát hạch lý thuyết, thực hành lái xe trong hình và trên đường để cấp giấy phép lái xe theo quy định tại khoản 1, khoản 2 và khoản 3 Điều 17 Thông tư này.\n\nHồ sơ dự sát hạch thực hiện theo quy định tại khoản 3 Điều 29 Thông tư này;\n\nb) Người có giấy phép lái xe các hạng B, C1, C, D1, D2, D, BE, C1E, CE, D1E, D2E, DE bị mất nhưng quá thời hạn sử dụng, có tên trong hồ sơ của Sở Giao thông vận tải, không thuộc trường hợp đang bị các cơ quan có thẩm quyền thu giữ, xử lý phải dự sát hạch các nội dung:\n\nQuá hạn dưới 01 năm, phải dự sát hạch lý thuyết để cấp giấy phép lái xe theo quy định tại điểm a khoản 1 Điều 17 Thông tư này.\n\nQuá hạn từ 01 năm trở lên kể từ ngày hết hạn phải sát hạch lý thuyết, thực hành lái xe trong hình và trên đường để cấp giấy phép lái xe theo quy định tại khoản 1, khoản 2 và khoản 3 Điều 17 Thông tư này.\n\nHồ sơ dự sát hạch thực hiện theo quy định tại khoản 3 Điều 29 của Thông tư này;']","**Nguồn văn bản:** /content/drive/MyDrive/ITProject_data/new_law/36_2024_QH15_444251.docx

**Tên văn bản:** (Không có tiêu đề trong metadata)

**(Không có điều khoản trong metadata):**

**Nội dung:**

2. Giấy phép lái xe chưa bị trừ hết điểm và không bị trừ điểm trong thời hạn 12 tháng từ ngày bị trừ điểm gần nhất thì được phục hồi đủ 12 điểm.

3. Trường hợp giấy phép lái xe bị trừ hết điểm thì người có giấy phép lái xe không được điều khiển phương tiện tham gia giao thông đường bộ theo giấy phép lái xe đó. 

Sau thời hạn ít nhất là 06 tháng kể từ ngày bị trừ hết điểm, người có giấy phép lái xe được tham gia kiểm tra nội dung kiến thức pháp luật về trật tự, an toàn giao thông đường bộ theo quy định tại khoản 7 Điều 61 của Luật này do lực lượng Cảnh sát giao thông tổ chức, có kết quả đạt yêu cầu thì được phục hồi đủ 12 điểm.


**Tóm lại:** Có hai điều kiện để phục hồi điểm giấy phép lái xe:

1. Giấy phép lái xe chưa bị trừ hết điểm và không bị trừ điểm trong vòng 12 tháng, điểm sẽ được tự động phục hồi.

2. Giấy phép lái xe bị trừ hết điểm, sau 6 tháng, người có giấy phép lái xe phải tham gia kiểm tra kiến thức luật giao thông đường bộ và đạt yêu cầu để được phục hồi điểm.
",Người lái ô tô phải làm kiểm tra lý thuyết và mô phỏng theo các câu hỏi như khi thi bằng lái xe.,1.0,0.8735701914808017,0.0,0.0
13,Luật Giao thông Đường bộ 2025 có quy định gì mới về việc sử dụng điện thoại khi lái xe?,"['5. Đua xe, tổ chức đua xe, xúi giục, giúp sức, cổ vũ đua xe trái phép; điều khiển phương tiện tham gia giao thông đường bộ lạng lách, đánh võng, rú ga liên tục.\n\n6. Dùng tay cầm và sử dụng điện thoại hoặc thiết bị điện tử khác khi điều khiển phương tiện tham gia giao thông đang di chuyển trên đường bộ.\n\n7. Giao xe cơ giới, xe máy chuyên dùng cho người không đủ điều kiện theo quy định của pháp luật để điều khiển xe tham gia giao thông đường bộ.\n\n8. Đưa xe cơ giới, xe máy chuyên dùng không bảo đảm quy định của pháp luật về an toàn kỹ thuật và bảo vệ môi trường, phương tiện khác không đủ điều kiện theo quy định của pháp luật để tham gia giao thông đường bộ.\n\n9. Nhập khẩu, sản xuất, lắp ráp xe cơ giới, xe máy chuyên dùng không bảo đảm quy định của pháp luật về chất lượng an toàn kỹ thuật và bảo vệ môi trường.\n\n10. Cải tạo xe ô tô loại khác thành xe ô tô chở người, trừ cải tạo thành xe ô tô chở người phục vụ mục đích quốc phòng, an ninh.\n\n11. Cải tạo trái phép; cố ý can thiệp làm sai lệch chỉ số trên đồng hồ báo quãng đường đã chạy của xe ô tô; cắt, hàn, tẩy xóa, đục sửa, đóng lại trái phép số khung, số động cơ của xe cơ giới, xe máy chuyên dùng.\n\n12. Cố ý can thiệp, thay đổi phần mềm điều khiển của xe, động cơ của xe đã được đăng ký với cơ quan quản lý, nhằm mục đích gian lận kết quả kiểm tra, thử nghiệm, kiểm định; thuê, mượn phụ tùng xe cơ giới chỉ để thực hiện việc kiểm định.\n\n13. Chở hàng hóa vượt quá khối lượng toàn bộ, tải trọng trục, kích thước cho phép của xe hoặc vượt quá tải trọng, kích thước giới hạn cho phép của đường bộ khi chưa được cơ quan quản lý cấp phép hoặc không bảo đảm yêu cầu theo quy định của Luật này; chở hàng hóa trên xe có quy định phải chằng buộc nhưng không chằng buộc hoặc chằng buộc không đúng quy định của pháp luật; chở quá số người theo quy định của pháp luật.\n\n14. Vận chuyển hàng hóa cấm lưu hành, vận chuyển trái phép hoặc không thực hiện đầy đủ các quy định của pháp luật về vận chuyển hàng hóa nguy hiểm, động vật hoang dã.\n\n15. Đe dọa, xúc phạm, tranh giành, lôi kéo hành khách; đe doạ, cưỡng ép hành khách sử dụng dịch vụ ngoài ý muốn; chuyển tải, xuống khách hoặc các hành vi khác nhằm trốn tránh phát hiện xe chở quá tải, quá số người theo quy định của pháp luật. \n\n16. Lắp đặt, sử dụng thiết bị âm thanh, ánh sáng trên xe cơ giới, xe máy chuyên dùng gây mất trật tự, an toàn giao thông đường bộ.\n\n17. Sản xuất, sử dụng, mua, bán trái phép biển số xe; điều khiển xe cơ giới, xe máy chuyên dùng gắn biển số xe không do cơ quan nhà nước có thẩm quyền cấp, gắn biển số xe không đúng vị trí; bẻ cong, che lấp biển số xe; làm thay đổi chữ, số, màu sắc, hình dạng, kích thước của biển số xe.\n\n18. Làm gián đoạn hoạt động hoặc làm sai lệch dữ liệu của thiết bị giám sát hành trình, camera lắp trên xe theo quy định của Luật này.\n\n19. Hủy hoại, làm hư hỏng, làm mất tác dụng thiết bị điều khiển, giám sát giao thông đường bộ, thiết bị thông minh hỗ trợ chỉ huy, điều khiển giao thông đường bộ.\n\n20. Đặt, để chướng ngại vật, vật cản khác trái phép trên đường bộ; rải vật sắc nhọn, đổ chất gây trơn trượt trên đường bộ; làm rơi vãi đất đá, hàng hóa, vật liệu xây dựng, phế thải trên đường bộ; đổ, xả thải, làm rơi vãi hóa chất, chất thải gây mất an toàn giao thông đường bộ.\n\n21. Cản trở người, phương tiện tham gia giao thông trên đường bộ; ném gạch, đất, đá, cát hoặc vật thể khác vào người, phương tiện đang tham gia giao thông trên đường bộ.\n\n22. Lợi dụng, lạm dụng nhiệm vụ bảo đảm trật tự, an toàn giao thông đường bộ để thực hiện hành vi vi phạm pháp luật, nhũng nhiễu, xâm phạm lợi ích của Nhà nước, quyền và lợi ích hợp pháp của tổ chức, cá nhân.\n\n23. Lợi dụng chức vụ, quyền hạn, nghề nghiệp của bản thân hoặc người khác để vi phạm pháp luật về trật tự, an toàn giao thông đường bộ hoặc can thiệp, tác động vào quá trình xử lý vi phạm pháp luật về trật tự, an toàn giao thông đường bộ.\n\n24. Sử dụng quyền của xe ưu tiên khi không thực hiện nhiệm vụ theo quy định của pháp luật; lắp đặt, sử dụng thiết bị phát tín hiệu ưu tiên không đúng quy định của pháp luật.\n\n25. Không khai báo, khai báo gian dối hoặc cung cấp thông tin, tài liệu không đúng sự thật để trốn tránh trách nhiệm khi bị phát hiện vi phạm pháp luật về trật tự, an toàn giao thông đường bộ.\n\n26. Bỏ trốn sau khi gây tai nạn giao thông đường bộ để trốn tránh trách nhiệm; khi có điều kiện mà cố ý không cứu giúp người bị tai nạn giao thông đường bộ; xâm phạm tính mạng, sức khỏe, tài sản của người bị nạn, người gây tai nạn giao thông đường bộ hoặc người giúp đỡ, cứu chữa, đưa người bị nạn đi cấp cứu; lợi dụng việc xảy ra tai nạn giao thông đường bộ để hành hung, đe dọa, xúi giục, gây sức ép, làm mất trật tự, cản trở việc xử lý tai nạn giao thông đường bộ.\n\n27. Điều khiển vật thể bay, tàu bay không người lái, phương tiện bay siêu nhẹ hoạt động trong phạm vi khổ giới hạn đường bộ gây cản trở hoặc nguy cơ mất an toàn cho người, phương tiện tham gia giao thông đường bộ, trừ tàu bay không người lái, phương tiện bay siêu nhẹ được cấp phép bay.\n\n28. Hành vi khác vi phạm quy tắc giao thông đường bộ quy định tại Chương II của Luật này.\n\nChương II\n\nQUY TẮC GIAO THÔNG ĐƯỜNG BỘ\n\nĐiều 10. Quy tắc chung\n\n1. Người tham gia giao thông đường bộ phải đi bên phải theo chiều đi của mình, đi đúng làn đường, phần đường quy định, chấp hành báo hiệu đường bộ và các quy tắc giao thông đường bộ khác.\n\n2. Người lái xe và người được chở trên xe ô tô phải thắt dây đai an toàn tại những chỗ có trang bị dây đai an toàn khi tham gia giao thông đường bộ.\n\n3. Khi chở trẻ em dưới 10 tuổi và chiều cao dưới 1,35 mét trên xe ô tô không được cho trẻ em ngồi cùng hàng ghế với người lái xe, trừ loại xe ô tô chỉ có một hàng ghế; người lái xe phải sử dụng, hướng dẫn sử dụng thiết bị an toàn phù hợp cho trẻ em.\n\nĐiều 11. Chấp hành báo hiệu đường bộ\n\n1. Báo hiệu đường bộ bao gồm: hiệu lệnh của người điều khiển giao thông; đèn tín hiệu giao thông; biển báo hiệu đường bộ; vạch kẻ đường và các dấu hiệu khác trên mặt đường; cọc tiêu, tường bảo vệ, rào chắn, đinh phản quang, tiêu phản quang, cột Km, cọc H; thiết bị âm thanh báo hiệu đường bộ.\n\n2. Người tham gia giao thông đường bộ phải chấp hành báo hiệu đường bộ theo thứ tự ưu tiên từ trên xuống dưới như sau: \n\na) Hiệu lệnh của người điều khiển giao thông;\n\nb) Tín hiệu đèn giao thông;\n\nc) Biển báo hiệu đường bộ;\n\nd) Vạch kẻ đường và các dấu hiệu khác trên mặt đường;\n\nđ) Cọc tiêu, tường bảo vệ, rào chắn, đinh phản quang, tiêu phản quang,\ncột Km, cọc H;\n\ne) Thiết bị âm thanh báo hiệu đường bộ.\n\n3. Hiệu lệnh của người điều khiển giao thông được quy định như sau:\n\na) Tay bên phải giơ thẳng đứng để báo hiệu cho người tham gia giao thông đường bộ ở tất cả các hướng phải dừng lại;\n\nb) Hai tay hoặc một tay dang ngang để báo hiệu cho người tham gia giao thông đường bộ ở phía trước và ở phía sau người điều khiển giao thông phải dừng lại; người tham gia giao thông đường bộ ở phía bên phải và bên trái người điều khiển giao thông được đi;\n\nc) Tay bên phải giơ về phía trước để báo hiệu cho người tham gia giao thông đường bộ ở phía sau và bên phải người điều khiển giao thông phải dừng lại; người tham gia giao thông đường bộ ở phía trước người điều khiển giao thông được rẽ phải; người tham gia giao thông đường bộ ở phía bên trái người điều khiển giao thông được đi tất cả các hướng; người đi bộ qua đường phải đi sau lưng người điều khiển giao thông.\n\n4. Tín hiệu đèn giao thông có 03 màu, gồm: màu xanh, màu vàng, màu đỏ; có hiển thị thời gian hoặc không hiển thị thời gian. Người tham gia giao thông đường bộ phải chấp hành như sau:\n\na) Tín hiệu đèn màu xanh là được đi; trường hợp người đi bộ, xe lăn của người khuyết tật đang đi ở lòng đường, người điều khiển phương tiện tham gia giao thông đường bộ phải giảm tốc độ hoặc dừng lại nhường đường cho người đi bộ, xe lăn của người khuyết tật qua đường;', 'BỘ GIAO THÔNG VẬN TẢI\n------- CỘNG HÒA XÃ HỘI CHỦ NGHĨA VIỆT NAM\nĐộc lập - Tự do - Hạnh phúc \n--------------- Số: 34/2024/TT-BGTVT Hà Nội, ngày 14 tháng 11 năm 2024\n\nTHÔNG TƯ\n\nQUY ĐỊNH VỀ HOẠT ĐỘNG TRẠM THU PHÍ ĐƯỜNG BỘ\n\nCăn cứ Luật Đường bộ ngày 27 tháng 6 năm 2024;\n\nCăn cứ Nghị định số 56/2022/NĐ-CP ngày 24 tháng 8 năm 2022 của Chính phủ quy định chức năng, nhiệm vụ, quyền hạn và cơ cấu tổ chức của Bộ Giao thông vận tải;\n\nTheo đề nghị của Vụ trưởng Vụ Kết cấu hạ tầng giao thông và Cục trưởng Cục Đường bộ Việt Nam;\n\nBộ trưởng Bộ Giao thông vận tải ban hành Thông tư quy định về hoạt động trạm thu phí đường bộ.\n\nChương I\n\nQUY ĐỊNH CHUNG\n\nĐiều 1. Phạm vi điều chỉnh\n\nThông tư này quy định về hoạt động trạm thu phí đường bộ.\n\nĐiều 2. Đối tượng áp dụng\n\nThông tư này áp dụng đối với các tổ chức, cá nhân liên quan đến hoạt động trạm thu phí đường bộ.\n\nĐiều 3. Giải thích từ ngữ\n\n1. Hoạt động trạm thu phí đường bộ bao gồm: quản lý, vận hành, bảo trì, nâng cấp trạm thu phí đường bộ; quản lý hoạt động trạm thu phí đường bộ; trách nhiệm trong quản lý hoạt động thu phí đường bộ.\n\n2. Trạm thu phí đường bộ (sau đây gọi tắt là trạm thu phí) bao gồm hạ tầng trạm thu phí và hệ thống thu phí.\n\n\n\n3. Hạ tầng trạm thu phí bao gồm: nhà điều hành; giá long môn và cổng trạm thu phí (nếu có); mặt đường và hệ thống điện chiếu sáng trong phạm vi trạm thu phí; đảo phân làn (nếu có); cabin thu phí (nếu có); các trang bị an toàn và hệ thống an toàn giao thông tại trạm thu phí.\n\n4. Hệ thống điều hành và trung tâm dữ liệu của nhà cung cấp dịch vụ thanh toán tiền sử dụng đường bộ (sau đây được gọi là hệ thống Back-End) là hệ thống theo quy định của pháp luật về thanh toán điện tử giao thông đường bộ.\n\n5. Hệ thống thiết bị lắp đặt tại trạm thu phí, trực tiếp tương tác với phương tiện giao thông đi qua trạm (sau đây được gọi là hệ thống Front-End) bao gồm các thiết bị điện tử như đầu đọc thẻ, ăng ten, ca-me-ra nhận dạng biển số, thiết bị nhận diện xe vào trạm, ba-ri-e tốc độ cao và các hệ thống phần cứng, phần mềm, thiết bị tự động hóa khác. Hệ thống Front-End kết nối với hệ thống Back-End để gửi thông tin giao dịch và thu nhận thông tin của phương tiện, thẻ đầu cuối.\n\n6. Hệ thống thu phí bao gồm hệ thống Back-End, hệ thống Front-End và hệ thống đường truyền dữ liệu.\n\n7. Đơn vị quản lý thu đối với thu phí sử dụng đường cao tốc là cơ quan quản lý thu, tổ chức nhận nhượng quyền thu phí sử dụng đường cao tốc theo quy định của pháp luật về thu phí sử dụng đường bộ cao tốc đối với phương tiện lưu thông trên tuyến đường bộ cao tốc thuộc sở hữu toàn dân do Nhà nước đại diện chủ sở hữu và trực tiếp quản lý, khai thác (sau đây gọi tắt là quy định của pháp luật về thu phí sử dụng đường cao tốc).\n\nChương II\n\nQUẢN LÝ, VẬN HÀNH, BẢO TRÌ, NÂNG CẤP TRẠM THU PHÍ\n\nĐiều 4. Quản lý, vận hành, bảo trì, nâng cấp hạ tầng trạm thu phí và hệ thống Front-End\n\n1. Đơn vị vận hành thu thực hiện công tác quản lý, vận hành, bảo trì, nâng cấp hạ tầng trạm thu phí và hệ thống Front-End theo nhiệm vụ được giao hoặc hợp đồng dịch vụ thu với đơn vị quản lý thu.\n\n2. Đối với trạm thu phí để thu tiền dịch vụ sử dụng đường bộ theo pháp luật về giá (sau đây gọi tắt là tiền dịch vụ sử dụng đường bộ), chi phí quản lý, vận hành, bảo trì, nâng cấp được lấy từ nguồn thu tiền dịch vụ sử dụng đường bộ và được xác định trong phương án tài chính của dự án đầu tư có thu tiền dịch vụ sử dụng đường bộ. Trường hợp nhà cung cấp dịch vụ thanh toán tiền sử dụng đường bộ đồng thời là đơn vị vận hành thu theo hợp đồng với cơ quan có thẩm quyền thì chi phí quản lý, vận hành, bảo trì, nâng cấp được tính trong hợp đồng ký với cơ quan có thẩm quyền.\n\n3. Đối với trạm thu phí để thu phí sử dụng đường cao tốc đối với phương tiện lưu thông trên tuyến đường cao tốc thuộc sở hữu toàn dân do Nhà nước đầu tư, sở hữu, quản lý và khai thác (sau đây gọi tắt là phí sử dụng đường cao tốc), chi phí quản lý, vận hành được lấy từ nguồn thu phí sử dụng đường cao tốc theo quy định của pháp luật về thu phí sử dụng đường cao tốc; chi phí bảo trì, nâng cấp được lấy từ nguồn tài chính quy định tại khoản 1 Điều 42 Luật Đường bộ.\n\n\n\nĐiều 5. Quản lý, vận hành, bảo trì, nâng cấp hệ thống Back-End và hệ thống đường truyền dữ liệu\n\n1. Nhà cung cấp dịch vụ thanh toán tiền sử dụng đường bộ thực hiện công tác quản lý, vận hành, bảo trì, nâng cấp hệ thống Back-End và hệ thống đường truyền dữ liệu theo quy định pháp luật về thanh toán điện tử giao thông đường bộ và quy định trong hợp đồng ký kết với cơ quan có thẩm quyền, trừ trường hợp cơ quan có thẩm quyền tự cung cấp dịch vụ thanh toán tiền sử dụng đường bộ.\n\n2. Chi phí quản lý, vận hành, bảo trì, nâng cấp được lấy từ nguồn chi phí dịch vụ thanh toán tiền sử dụng đường bộ theo hình thức điện tử không dừng và các nguồn kinh phí hợp pháp theo quy định pháp luật.\n\nĐiều 6. Thời gian làm việc, trang phục, phù hiệu\n\n1. Trạm thu phí hoạt động 24/24 giờ vào tất cả các ngày trong năm, kể cả ngày nghỉ và ngày lễ trừ những trường hợp tạm dừng thu, dừng thu theo quy định tại Điều 22, Điều 23 Thông tư này.\n\n2. Người lao động làm việc tại trạm thu phí phải mặc đồng phục trong khi thực hiện nhiệm vụ. Mẫu đồng phục của người lao động tại trạm thu phí do đơn vị vận hành thu quyết định nhưng phải đảm bảo có phù hiệu, biểu trưng của đơn vị vận hành thu, biển tên, chức danh được bố trí ở vị trí dễ nhận biết.\n\nĐiều 7. Hình thức thu tiền sử dụng đường bộ\n\nThu tiền sử dụng đường bộ được thực hiện theo hình thức điện tử không dừng và hình thức một dừng.\n\n1. Hình thức điện tử không dừng là hình thức thu tiền sử dụng đường bộ tự động, phương tiện tham gia giao thông đường bộ không phải dừng lại để trả tiền sử dụng đường bộ khi qua trạm thu phí.\n\n2. Hình thức một dừng là hình thức thu tiền sử dụng đường bộ mà khi qua trạm thu phí, phương tiện giao thông đường bộ thực hiện một lần dừng khi qua cửa kiểm soát làn thu phí để trả tiền sử dụng đường bộ.\n\nĐiều 8. Dữ liệu thu tiền sử dụng đường bộ\n\n1. Dữ liệu thu tiền sử dụng đường bộ bao gồm dữ liệu thông tin tài khoản giao thông và dữ liệu về giao dịch thanh toán tiền sử dụng đường bộ.\n\n2. Dữ liệu thông tin tài khoản giao thông bao gồm các thông tin tài khoản giao thông theo quy định của pháp luật về thanh toán điện tử giao thông đường bộ.\n\n3. Dữ liệu về giao dịch thanh toán tiền sử dụng đường bộ bao gồm:\n\na) Các tập tin dữ liệu thông tin thanh toán tiền sử dụng đường bộ theo quy định của pháp luật về thanh toán điện tử giao thông đường bộ;\n\nb) Các tập tin dữ liệu về lưu lượng, doanh thu thu phí, vé lượt, vé tháng, vé quý;\n\nc) Các tập tin video giám sát làn, giám sát toàn cảnh.\n\n4. Dữ liệu thu tiền sử dụng đường bộ phải tuân thủ theo quy định của pháp luật về giao dịch điện tử, pháp luật về an toàn thông tin mạng.\n\n5. Chế độ lưu dữ liệu thu tiền sử dụng đường bộ:\n\na) Lưu trữ tối thiểu 1 năm: các tập tin video giám sát toàn cảnh;\n\nb) Lưu trữ tối thiểu 5 năm: các tập tin video giám sát làn; các tập tin hình ảnh chụp phương tiện lưu thông qua trạm thu phí;\n\nc) Lưu trữ từ thời điểm đưa trạm thu phí vào hoạt động đến thời điểm sau 10 năm kể từ khi thanh lý hợp đồng dự án PPP hoặc kể từ thời điểm dừng hoạt động trạm thu phí: các tập tin dữ liệu thông tin thanh toán tiền sử dụng đường bộ (trừ ảnh chụp phương tiện, ảnh chụp biển số); các tập tin dữ liệu về lưu lượng, doanh thu thu phí, vé lượt, vé tháng, vé quý;\n\nd) Các tập tin dữ liệu thông tin tài khoản giao thông được lưu trữ từ thời điểm mở tài khoản giao thông đến thời điểm sau 10 năm kể từ khi tài khoản giao thông được đóng.\n\nĐiều 9. Kết nối dữ liệu thu tiền sử dụng đường bộ\n\n1. Dữ liệu thu tiền sử dụng đường bộ được kết nối theo quy định của các tiêu chuẩn hiện hành về thu phí, theo quy định của pháp luật về thanh toán điện tử giao thông đường bộ và yêu cầu của cơ quan có thẩm quyền.', 'd) Các tập tin dữ liệu thông tin tài khoản giao thông được lưu trữ từ thời điểm mở tài khoản giao thông đến thời điểm sau 10 năm kể từ khi tài khoản giao thông được đóng.\n\nĐiều 9. Kết nối dữ liệu thu tiền sử dụng đường bộ\n\n1. Dữ liệu thu tiền sử dụng đường bộ được kết nối theo quy định của các tiêu chuẩn hiện hành về thu phí, theo quy định của pháp luật về thanh toán điện tử giao thông đường bộ và yêu cầu của cơ quan có thẩm quyền.\n\n2. Nhà cung cấp dịch vụ thanh toán tiền sử dụng đường bộ phải đảm bảo kết nối, chia sẻ, đồng bộ dữ liệu trên nguyên tắc sẵn sàng, khả thi, thuận tiện, tránh trùng lặp, lãng phí theo quy định của Thông tư này và quy định của pháp luật có liên quan. Chi phí kết nối dữ liệu thu phí giữa các Back-End do các nhà cung cấp dịch vụ thanh toán tiền sử dụng đường bộ thoả thuận.\n\n3. Dữ liệu thu tiền sử dụng đường bộ phải được kết nối về hệ thống quản lý cơ sở dữ liệu thanh toán điện tử giao thông đường bộ theo quy định của pháp luật về thanh toán điện tử giao thông đường bộ.\n\n4. Kết nối dữ liệu thu tiền sử dụng đường bộ phải đảm bảo tốc độ truyền dẫn, tính dự phòng; đáp ứng yêu cầu an ninh và bảo mật thông tin, dữ liệu theo quy định của pháp luật về giao dịch điện tử, pháp luật về an ninh mạng, pháp luật về an toàn thông tin mạng.\n\nĐiều 10. Quản lý, khai thác dữ liệu thu tiền sử dụng đường bộ\n\n1. Cục Đường bộ Việt Nam quản lý, khai thác dữ liệu thu tiền sử dụng đường bộ của các trạm thu phí trên hệ thống quản lý cơ sở dữ liệu thanh toán điện tử giao thông đường bộ; khai thác dữ liệu về giao dịch thanh toán tiền sử dụng đường bộ thông qua tài khoản đăng nhập và mật khẩu được cung cấp để truy cập vào cổng thông tin dành cho cơ quan quản lý nhà nước trên hệ thống Back-End của nhà cung cấp dịch vụ thanh toán tiền sử dụng đường bộ.\n\n2. Ủy ban nhân dân cấp tỉnh tổ chức quản lý, khai thác dữ liệu thu tiền sử dụng đường bộ của các trạm thu phí do địa phương quản lý trên hệ thống quản lý cơ sở dữ liệu thanh toán điện tử giao thông đường bộ; khai thác giao dịch về thanh toán tiền sử dụng đường bộ của các trạm thu phí do địa phương quản lý thông qua tài khoản đăng nhập và mật khẩu được cung cấp để truy cập vào cổng thông tin dành cho cơ quan quản lý nhà nước trên hệ thống Back-End của nhà cung cấp dịch vụ thanh toán tiền sử dụng đường bộ.\n\n3. Nhà cung cấp dịch vụ thanh toán tiền sử dụng đường bộ quản lý, khai thác dữ liệu thu tiền sử dụng đường bộ trên hệ thống Back-End theo quy định của hợp đồng dịch vụ thu và quy định của pháp luật về thanh toán điện tử giao thông đường bộ.\n\n4. Đơn vị quản lý thu và đơn vị vận hành thu quản lý, khai thác dữ liệu thu tiền sử dụng đường bộ theo hình thức một dừng tại trạm thu phí thuộc phạm vi quản lý. Đồng thời phải kết nối đồng bộ dữ liệu về lịch sử giao dịch thu tiền sử dụng đường bộ theo hình thức một dừng tại trạm thu phí lên hệ thống Back-End của nhà cung cấp dịch vụ thanh toán tiền sử dụng đường bộ.\n\n5. Đơn vị quản lý thu và đơn vị vận hành thu được khai thác dữ liệu về giao dịch thanh toán tiền sử dụng đường bộ của các trạm thu phí thuộc phạm vi quản lý thông qua tài khoản đăng nhập được cung cấp để truy cập vào cổng thông tin của hệ thống Back-End của nhà cung cấp dịch vụ thanh toán tiền sử dụng đường bộ.\n\n6. Chủ phương tiện được khai thác dữ liệu thu tiền sử dụng đường bộ thông qua tài khoản giao thông và ứng dụng thanh toán điện tử giao thông đường bộ cho chủ phương tiện trên hệ thống Back-End của nhà cung cấp dịch vụ thanh toán tiền sử dụng đường bộ.\n\n7. Việc quản lý, khai thác dữ liệu thu tiền sử dụng đường bộ phải thực hiện theo quy định của pháp luật về giao dịch điện tử, pháp luật về an ninh mạng, pháp luật về an toàn thông tin mạng và quy định khác của pháp luật có liên quan.\n\nĐiều 11. Quản lý, giám sát hoạt động trạm thu phí\n\n1. Đơn vị quản lý thu, đơn vị vận hành thu và nhà cung cấp dịch vụ thanh toán tiền sử dụng đường bộ phải có trách nhiệm kiểm tra, giám sát hoạt động của trạm thu phí để bảo đảm hoạt động thu đúng quy định. Cung cấp đầy đủ thông tin, dữ liệu, số liệu, tài liệu theo yêu cầu của cơ quan chức năng về hoạt động của trạm thu phí trong quá trình khai thác.\n\n2. Công tác quản lý, kiểm tra, giám sát, xử lý vi phạm hoạt động của trạm thu phí được thực hiện theo quy định tại Thông tư, các quy định của pháp luật có liên quan và theo quy định của hợp đồng.\n\nChương III\n\nQUẢN LÝ TIỀN SỬ DỤNG ĐƯỜNG BỘ\n\nĐiều 12. Mở và sử dụng tài khoản để tiếp nhận tiền từ việc thực hiện thanh toán điện tử giao thông đường bộ\n\n1. Nhà cung cấp dịch vụ thanh toán tiền sử dụng đường bộ mở tài khoản trên hệ thống ngân hàng thương mại để tiếp nhận tiền từ việc thực hiện thu tiền\n\nsử dụng đường bộ (sau đây gọi tắt là tài khoản thu tiền sử dụng đường bộ) của chủ phương tiện.\n\n2. Toàn bộ số tiền trong tài khoản thu tiền sử dụng đường bộ phải được quản lý độc lập và tách biệt với các khoản tiền khác của nhà cung cấp dịch vụ thanh toán tiền sử dụng đường bộ và chỉ được sử dụng cho các mục đích quy định tại khoản 3 Điều này.\n\n3. Tài khoản thu tiền sử dụng đường bộ được sử dụng để thực hiện các giao dịch thu, chi sau đây:\n\na) Hoàn trả doanh thu thu tiền sử dụng đường bộ cho đơn vị quản lý thu theo quy định của pháp luật về thanh toán điện tử giao thông đường bộ;\n\nb) Chi trả dịch vụ thanh toán điện tử giao thông đường bộ cho nhà cung cấp dịch vụ thanh toán tiền sử dụng đường bộ và dịch vụ vận hành trạm thu phí của đơn vị vận hành thu đối với trường hợp nhà cung cấp dịch vụ thanh toán tiền sử dụng đường bộ đồng thời là đơn vị vận hành thu;\n\nc) Thanh toán các khoản phải hoàn trả cho chủ phương tiện.\n\nĐiều 13. Đối soát số thu và chuyển tiền vào tài khoản thu tiền sử dụng đường bộ\n\n1. Đối soát số thu phí sử dụng đường cao tốc giữa đơn vị quản lý thu, đơn vị vận hành thu và nhà cung cấp dịch vụ thanh toán tiền sử dụng đường bộ:\n\na) Đơn vị vận hành thu thực hiện đối soát số thu phí sử dụng đường cao tốc với nhà cung cấp dịch vụ thanh toán tiền sử dụng đường bộ theo quy định tại khoản 2 Điều này;\n\nb) Đơn vị quản lý thu thực hiện kiểm tra hoạt động, số thu phí sử dụng đường cao tốc của đơn vị vận hành thu, nhà cung cấp dịch vụ thanh toán tiền sử dụng đường bộ để đảm bảo thu đúng, thu đủ.\n\n2. Đối soát số thu tiền dịch vụ sử dụng đường bộ giữa đơn vị quản lý thu, đơn vị vận hành thu và nhà cung cấp dịch vụ thanh toán tiền sử dụng đường bộ:\n\na) Căn cứ dữ liệu quy định tại khoản 3 Điều 8 Thông tư này, nhà cung cấp dịch vụ thanh toán tiền sử dụng đường bộ thực hiện đối soát số liệu thu tiền sử dụng đường bộ hàng ngày ngay sau thời điểm chốt số liệu (24 giờ tính từ thời điểm chốt số liệu trở về trước) với đơn vị quản lý thu làm căn cứ xác nhận số thu tiền sử dụng đường bộ đã thu được trong ngày, thời điểm chốt số liệu được thống nhất trong hợp đồng cung cấp dịch vụ thu;\n\nb) Trước ngày mùng 5 hàng tháng, nhà cung cấp dịch vụ thanh toán tiền sử dụng đường bộ và đơn vị quản lý thu thực hiện đối soát, chốt công nợ cho tháng liền trước đó;\n\nc) Trong thời hạn 30 ngày kể từ ngày kết thúc mỗi năm tài chính, nhà cung cấp dịch vụ thanh toán tiền sử dụng đường bộ và đơn vị quản lý thu thực hiện chốt công nợ, quyết toán cho năm liền trước đó.\n\n3. Trường hợp nhà cung cấp dịch vụ thanh toán tiền sử dụng đường bộ đồng thời là đơn vị vận hành thu, nhà cung cấp dịch vụ thanh toán tiền sử dụng đường bộ có trách nhiệm tổ chức thực hiện đối soát số liệu thu phí theo quy định tại khoản 2 Điều này đảm bảo thu đúng, thu đủ theo quy định.\n\n4. Nhà cung cấp dịch vụ thanh toán tiền sử dụng đường bộ có trách nhiệm xây dựng quy trình đối soát, chuyển tiền phù hợp với quy định của Thông tư này và quy định của pháp luật về thanh toán điện tử giao thông đường bộ, pháp luật về thu phí sử dụng đường cao tốc.\n\n5. Đơn vị quản lý thu đối với trạm thu phí để thu tiền dịch vụ sử dụng đường bộ, đơn vị vận hành thu đối với trạm thu phí để thu phí sử dụng đường cao tốc có trách nhiệm phối hợp với nhà cung cấp dịch vụ thanh toán tiền sử dụng đường bộ để thực hiện quy trình đối soát và khắc phục, điều chỉnh các lỗi, sai số phát hiện được thông qua quá trình đối soát.']","**Nguồn văn bản:** /content/drive/MyDrive/ITProject_data/new_law/36_2024_QH15_444251.docx

**Tên văn bản:** (Không có tiêu đề trong metadata)

**(Không có điều khoản trong metadata):** 

**Nội dung:**

6. Dùng tay cầm và sử dụng điện thoại hoặc thiết bị điện tử khác khi điều khiển phương tiện tham gia giao thông đang di chuyển trên đường bộ.


**Tóm lại:** Luật Giao thông Đường bộ nghiêm cấm việc dùng tay cầm và sử dụng điện thoại hoặc thiết bị điện tử khác khi đang điều khiển phương tiện giao thông di chuyển trên đường.
",Luật cấm sử dụng điện thoại di động khi đang điều khiển phương tiện giao thông.,0.5,0.8267736735587375,1.0,0.9999999999
14,Quy định mới về tốc độ tối đa trong khu vực đô thị là gì?,"['BỘ GIAO THÔNG VẬN TẢI\n-------- CỘNG HÒA XÃ HỘI CHỦ NGHĨA VIỆT NAM\nĐộc lập - Tự do - Hạnh phúc \n--------------- Số: 38/2024/TT-BGTVT Hà Nội, Ngày 15 tháng 11 năm 2024\n\nTHÔNG TƯ\n\nQUY ĐỊNH VỀ TỐC ĐỘ VÀ KHOẢNG CÁCH AN TOÀN CỦA XE CƠ GIỚI, XE MÁY CHUYÊN DÙNG THAM GIA GIAO THÔNG TRÊN ĐƯỜNG BỘ\n\nCăn cứ Luật Trật tự, an toàn giao thông đường bộ ngày 27 tháng 6 năm 2024;\n\nCăn cứ Luật Đường bộ ngày 27 tháng 6 năm 2024;\n\nCăn cứ Nghị định số 56/2022/NĐ-CP ngày 24 tháng 8 năm 2022 của Chính phủ quy định chức năng, nhiệm vụ, quyền hạn và cơ cấu tổ chức của Bộ Giao thông vận tải;\n\nTheo đề nghị của Vụ trưởng Vụ Kết cấu hạ tầng giao thông và Cục trưởng Cục đường bộ Việt Nam;\n\nBộ trưởng Bộ Giao thông vận tải ban hành Thông tư quy định về tốc độ và khoảng cách an toàn của xe cơ giới, xe máy chuyên dùng tham gia giao thông trên đường bộ.\n\nChương I\n\nQUY ĐỊNH CHUNG\n\nĐiều 1. Phạm vi điều chỉnh\n\nThông tư này quy định về tốc độ thiết kế của đường bộ; tốc độ khai thác và khoảng cách an toàn của xe cơ giới, xe máy chuyên dùng khi tham gia giao thông trên đường bộ, trừ xe ưu tiên đang đi làm nhiệm vụ theo quy định của pháp luật.\n\nĐiều 2. Đối tượng áp dụng\n\nThông tư này áp dụng đối với người lái xe, người điều khiển xe máy chuyên dùng và tổ chức, cá nhân liên quan đến quản lý và thực hiện các quy định về tốc độ thiết kế, tốc độ khai thác của đường bộ và khoảng cách an toàn của xe cơ giới, xe máy chuyên dùng khi tham gia giao thông trên đường bộ.\n\nĐiều 3. Giải thích từ ngữ\n\nTrong Thông tư này, các từ ngữ dưới đây được hiểu như sau:\n\n1. Đường bộ trong khu đông dân cư là đoạn đường bộ nằm trong khu vực nội thành phố, nội thị xã, nội thị trấn và những đoạn đường có đông dân cư sinh sống sát dọc theo đường, được xác định bằng biển báo “Bắt đầu khu đông dân cư” và biển báo “Hết khu đông dân cư”.\n\n2. Đường đôi là đường có chiều đi và chiều về được phân biệt bằng dải phân cách giữa.\n\n3. Đường một chiều là đường chỉ cho đi một chiều.\n\n4. Đường hai chiều là đường dùng chung cho cả chiều đi và về trên cùng một phần đường xe chạy mà không có dải phân cách giữa.\n\n5. Trọng tải là khối lượng hàng hóa chuyên chở cho phép, được ghi trên Giấy chứng nhận an toàn kỹ thuật và bảo vệ môi trường của phương tiện giao thông cơ giới đường bộ, Giấy chứng \n\n\n\nnhận chất lượng an toàn kỹ thuật và bảo vệ môi trường xe cơ giới nhập khẩu hoặc Giấy chứng nhận chất lượng an toàn kỹ thuật và bảo vệ môi trường kiểu loại ô tô sản xuất, lắp ráp.\n\n6. Tốc độ khai thác tối đa là giá trị tốc độ lớn nhất cho phép phương tiện tham gia giao thông trên đường bộ bảo đảm an toàn giao thông và khai thác hiệu quả tuyến đường.\n\n7. Tốc độ khai thác tối thiểu là giá trị tốc độ nhỏ nhất cho phép phương tiện tham gia giao thông trên đường bộ bảo đảm an toàn giao thông và khai thác hiệu quả tuyến đường.\n\n8. Khoảng cách an toàn là cự ly tối thiểu giữa phương tiện phía sau với phương tiện đang di chuyển liền trước, cùng làn đường, bảo đảm tránh xảy ra va chạm trong trường hợp phương tiện phía trước đột ngột giảm tốc độ hoặc dừng lại.\n\n9. Tốc độ lưu hành là giá trị tốc độ của phương tiện tại thời điểm tham gia giao thông trên đường bộ.\n\nĐiều 4. Nguyên tắc chấp hành quy định về tốc độ khai thác và khoảng cách an toàn khi điều khiển phương tiện trên đường bộ\n\n1. Khi tham gia giao thông trên đường bộ, người lái xe, người điều khiển xe máy chuyên dùng phải chấp hành quy định về tốc độ khai thác và khoảng cách an toàn theo quy định tại Điều 12 Luật Trật tự, an toàn giao thông đường bộ.\n\n2. Tại những đoạn đường không bố trí biển báo tốc độ khai thác tối đa, không bố trí biển báo khoảng cách an toàn giữa hai xe, người điều khiển phương tiện tham gia giao thông phải thực hiện theo quy định tại Điều 6, Điều 7, Điều 8 và Điều 11 Thông tư này.\n\nChương II\n\nTỐC ĐỘ THIẾT KẾ CỦA ĐƯỜNG BỘ; TỐC ĐỘ KHAI THÁC CỦA ĐƯỜNG BỘ, KHOẢNG CÁCH AN TOÀN CỦA XE CƠ GIỚI, XE MÁY CHUYÊN DÙNG THAM GIA GIAO THÔNG TRÊN ĐƯỜNG BỘ\n\nĐiều 5. Tốc độ thiết kế của đường bộ\n\n1. Tốc độ thiết kế của đường bộ là giá trị vận tốc được dùng để tính toán các chỉ tiêu kỹ thuật của đường bộ. Tốc độ thiết kế của đường bộ được xác định trong giai đoạn đầu tư xây dựng, nâng cấp, cải tạo đường bộ nhằm bảo đảm cho phương tiện di chuyển an toàn; được quyết định theo cấp kỹ thuật của đường bộ và điều kiện địa hình.\n\n2. Tốc độ thiết kế đường bộ cao tốc là giá trị vận tốc được dùng để tính toán các chỉ tiêu kỹ thuật của đường bộ cao tốc, được xác định theo cấp đường cao tốc. Khi thiết kế đường bộ cao tốc có thể áp dụng tốc độ thiết kế khác nhau theo từng đoạn nhưng phải bảo đảm các yêu cầu về chiều dài đoạn chuyển tiếp và tốc độ thiết kế trung gian giữa các đoạn. Tốc độ thiết kế đường bộ cao tốc được xác định theo Quy chuẩn kỹ thuật quốc gia về đường bộ cao tốc QCVN 115:2024/BGTVT.\n\n3. Tốc độ thiết kế đường bộ được xác định theo Tiêu chuẩn quốc gia TCVN 4054: 2005 Đường ô tô - Yêu cầu thiết kế.\n\n4. Tốc độ thiết kế đường bộ trong phạm vi đô thị được xác định theo Quy chuẩn kỹ thuật quốc gia về hệ thống công trình hạ tầng kỹ thuật QCVN 07-4:2023/BXD.\n\n5. Tốc độ thiết kế đường giao thông nông thôn được xác định theo Tiêu chuẩn quốc gia TCVN 10380:2014 Đường giao thông nông thôn - Yêu cầu thiết kế.\n\n\n\nĐiều 6. Tốc độ khai thác tối đa cho phép xe cơ giới tham gia giao thông trên đường bộ (trừ đường cao tốc)\n\n1. Tốc độ khai thác tối đa cho phép xe cơ giới tham gia giao thông trên đường bộ trong khu vực đông dân cư\n\nBảng 1\n\nLoại xe cơ giới đường bộ Tốc độ khai thác tối đa (km/h) Tốc độ khai thác tối đa (km/h) Đường đôi; đường một chiều có từ hai làn xe cơ giới trở lên Đường hai chiều; đường một chiều có một làn xe cơ giới Các loại xe cơ giới, trừ các xe được quy định tại Điều 7 và Điều 8 Thông tư này 60 50\n\n2. Tốc độ khai thác tối đa cho phép xe cơ giới tham gia giao thông trên đường bộ ngoài khu vực đông dân cư\n\nBảng 2\n\nLoại xe cơ giới đường bộ Tốc độ khai thác tối đa (km/h) Tốc độ khai thác tối đa (km/h) Đường đôi; đường một chiều có từ hai làn xe cơ giới trở lên Đường hai chiều; đường một chiều có một làn xe cơ giới Xe ô tô chở người đến 28 chỗ không kể chỗ của người lái xe (trừ xe buýt); ô tô tải có trọng tải không lớn hơn 3,5 tấn 90 80 Xe ô tô chở người trên 28 chỗ không kể chỗ người lái xe (trừ xe buýt); ô tô tải có trọng tải trên 3,5 tấn (trừ ô tô xi téc) 80 70 Xe buýt; ô tô đầu kéo kéo sơ mi rơ moóc (trừ ô tô đầu kéo kéo sơ mi rơ moóc xi téc); xe mô tô; ô tô chuyên dùng (trừ ô tô trộn vữa, ô tô trộn bê tông lưu động) 70 60 Ô tô kéo rơ moóc; ô tô kéo xe khác; ô tô trộn vữa, ô tô trộn bê tông lưu động, ô tô xi téc, ô tô đầu kéo kéo sơ mi rơ moóc xi téc, ô tô kéo theo rơ moóc xi téc) 60 50\n\nĐiều 7. Tốc độ khai thác tối đa cho phép đối với xe máy chuyên dùng, xe gắn máy và các loại xe tương tự tham gia giao thông trên đường bộ (trừ đường cao tốc)\n\nXe máy chuyên dùng, xe gắn máy và các loại xe tương tự khi tham gia giao thông, tốc độ khai thác tối đa là 40 km/h.\n\nĐiều 8. Tốc độ khai thác tối đa cho phép đối với xe chở người bốn bánh có gắn động cơ, xe chở hàng bốn bánh có gắn động cơ tham gia giao thông trên đường bộ (trừ đường cao tốc)\n\n1. Xe chở người bốn bánh có gắn động cơ khi tham gia giao thông trong phạm vi và thời gian cho phép hoạt động, tốc độ khai thác tối đa là 30 km/h.\n\n2. Xe chở hàng bốn bánh có gắn động cơ khi tham gia giao thông trong phạm vi và thời gian cho phép hoạt động, tốc độ khai thác tối đa là 50 km/h.\n\nĐiều 9. Tốc độ khai thác tối đa, tốc độ khai thác tối thiểu cho phép đối với các loại xe cơ giới, xe máy chuyên dùng trên đường cao tốc\n\n1. Đường cao tốc phải được đặt biển báo tốc độ khai thác tối đa, tốc độ khai thác tối thiểu.\n\n2. Tốc độ khai thác tối đa cho phép trên đường cao tốc là 120 km/h.\n\n3. Tốc độ khai thác tối thiểu cho phép trên đường cao tốc là 60 km/h. Trường hợp đường cao tốc có tốc độ thiết kế 60 km/h thì tốc độ khai thác tối thiểu thực hiện theo phương án tổ chức giao thông được cấp có thẩm quyền phê duyệt.', '2.3.2.2. Đối với hầm dài từ 1.000,0 m trở lên khi không bố trí làn dừng xe khẩn cấp phải bố trí vị trí dừng xe khẩn cấp có chiều dài tối thiểu 30,0 m cách nhau tối đa 500,0 m, bề rộng vị trí dừng xe khẩn cấp theo cấp tốc độ thiết kế của đường bộ cao tốc.\n\n2.4. Bố trí hệ thống đường gom, đường bên để bảo đảm việc đi lại cho người dân khu vực bị ảnh hưởng, chia cắt bởi đường bộ cao tốc.\n\n2.5. Các yếu tố hình học đường bộ cao tốc\n\n2.5.1. Các yếu tố hình học của đường bộ cao tốc phải đáp ứng các yêu cầu được quy định tại Bảng 1 sau đây.\n\nBảng 1 - Các trị số giới hạn thiết kế bình đồ và mặt cắt dọc\n\nSTT Tên chỉ tiêu Đơn vị Cấp tốc độ thiết kế (km/h) Cấp tốc độ thiết kế (km/h) Cấp tốc độ thiết kế (km/h) 1 Tốc độ thiết kế Vtk km/h 120 100 80 2 Độ dốc siêu cao (hay độ nghiêng một mái) lớn nhất isc không lớn hơn % 8 8 8 3 Bán kính tối thiểu Rmin tương ứng với isc = +8% m 650 450 240 (140) 4 Bán kính tương ứng với isc = +2% m 3000 2000 1300 (700) 5 Bán kính tối thiểu không cần cấu tạo siêu cao isc = -2% m 5500 4000 2500 (1500) 6 Chiều dài tối thiểu đường cong chuyển tiếp ứng với Rmin m 210 210 170 (150) 7 Tầm nhìn dừng xe tối thiểu m 210 160 110 (75) 8 Độ dốc dọc lên dốc lớn nhất % 4 5 6 9 Độ dốc dọc xuống dốc lớn nhất % 5,5 6 6 10 Bán kính đường cong đứng lồi tối thiểu giới hạn m 12000 6000 3000 (1500) 11 Bán kính đường cong đứng lồi tối thiểu thông thường m 17000 10000 4500 (2000) 12 Bán kính đường cong đứng lõm tối thiểu giới hạn m 4000 3000 2000 (1000) 13 Bán kính đường cong đứng lõm tối thiểu thông thường m 6000 4500 3000 (1500) 14 Chiều dài đường cong đứng tối thiểu giới hạn m 100 85 70(50) 15 Chiều dài đường cong đứng tối thiểu thông thường m 250 210 170 (120) 1. Trị số trong ngoặc tương ứng với tốc độ thiết kế 60 km/h. 2. Chiều dài đường cong chuyển tiếp phải được tính toán để bảo đảm an toàn, êm thuận. Không phải bố trí đường cong chuyển tiếp tại các đường cong không cần cấu tạo siêu cao. 1. Trị số trong ngoặc tương ứng với tốc độ thiết kế 60 km/h. 2. Chiều dài đường cong chuyển tiếp phải được tính toán để bảo đảm an toàn, êm thuận. Không phải bố trí đường cong chuyển tiếp tại các đường cong không cần cấu tạo siêu cao. 1. Trị số trong ngoặc tương ứng với tốc độ thiết kế 60 km/h. 2. Chiều dài đường cong chuyển tiếp phải được tính toán để bảo đảm an toàn, êm thuận. Không phải bố trí đường cong chuyển tiếp tại các đường cong không cần cấu tạo siêu cao. 1. Trị số trong ngoặc tương ứng với tốc độ thiết kế 60 km/h. 2. Chiều dài đường cong chuyển tiếp phải được tính toán để bảo đảm an toàn, êm thuận. Không phải bố trí đường cong chuyển tiếp tại các đường cong không cần cấu tạo siêu cao. 1. Trị số trong ngoặc tương ứng với tốc độ thiết kế 60 km/h. 2. Chiều dài đường cong chuyển tiếp phải được tính toán để bảo đảm an toàn, êm thuận. Không phải bố trí đường cong chuyển tiếp tại các đường cong không cần cấu tạo siêu cao. 1. Trị số trong ngoặc tương ứng với tốc độ thiết kế 60 km/h. 2. Chiều dài đường cong chuyển tiếp phải được tính toán để bảo đảm an toàn, êm thuận. Không phải bố trí đường cong chuyển tiếp tại các đường cong không cần cấu tạo siêu cao.\n\n2.5.2. Phải bảo đảm tầm nhìn cho các xe trên đường bộ cao tốc.\n\n2.5.3. Quy định về dốc dọc.\n\n2.5.3.1. Độ dốc dọc lớn nhất được quy định tại Bảng 1 tùy thuộc cấp thiết kế của đường bộ cao tốc.\n\n2.5.3.2. Trên các đoạn nền đào phải thiết kế độ dốc dọc tối thiểu bằng 0,50 %.\n\n2.5.3.3. Trên các đoạn chuyển tiếp có độ dốc ngang mặt đường dưới 1,00 % phải thiết kế dốc dọc tối thiểu là 0,50 %.\n\n2.5.3.4. Trong hầm, độ dốc dọc tối thiểu là 0,30 %.\n\n2.5.4. Phải bố trí đường cong đứng dạng tròn hoặc parabol tại các vị trí đổi dốc.\n\n2.6. Nút giao khác mức, đường nhánh ra, vào trên đường bộ cao tốc\n\n2.6.1. Phải bố trí nút giao khác mức tại các vị trí đường bộ cao tốc giao với các loại đường khác.\n\n2.6.2. Trường hợp đường bộ cao tốc vượt trên các đường khác phải bảo đảm tĩnh không tương ứng với cấp kỹ thuật quy hoạch của đường bên dưới.\n\n2.6.3. Khoảng cách tối thiểu giữa nút giao khác mức liên thông và vị trí ra, vào trên đường bộ cao tốc là 4,0 km. Khoảng cách giữa các vị trí nút giao khác mức liên thông trên đường bộ cao tốc tối thiểu 10,0 km, ở gần các thành phố lớn, khu đô thị lớn và khu chức năng khoảng cách tối thiểu 5,0 km. Trường hợp có các yêu cầu về an ninh quốc phòng hoặc phục vụ mục đích đặc biệt nhằm phát triển kinh tế xã hội của địa phương, khoảng cách tối thiểu giữa các nút giao khác mức liên thông được phép giảm xuống nhưng không nhỏ hơn 3,0 km.\n\n2.6.4. Các thông số kỹ thuật áp dụng cho phạm vi nút giao khác mức liên thông và các nhánh ra, vào đường bộ cao tốc.\n\n2.6.4.1. Tốc độ thiết kế trên các đường nhánh thuộc phạm vi nút giao khác mức liên thông được quy định tại Bảng 2 sau đây.\n\nBảng 2 - Tốc độ thiết kế trên các đường nhánh thuộc phạm vi nút giao khác mức liên thông\n\nĐặc điểm nút giao khác mức liên thông Cấp tốc độ thiết kế (km/h) Cấp tốc độ thiết kế (km/h) Cấp tốc độ thiết kế (km/h) 120 100 80 Liên thông giữa đường bộ cao tốc với đường bộ cao tốc và đường cấp I, cấp II 80 ÷ 50 70 ÷ 40 60 ÷ 35 (50 ÷ 35) Liên thông giữa đường bộ cao tốc với đường khác 60 ÷ 35 50 ÷ 35 40 ÷ 30 (35 ÷ 30) Trị số trong ngoặc tương ứng với tốc độ thiết kế là 60 km/h. Trị số trong ngoặc tương ứng với tốc độ thiết kế là 60 km/h. Trị số trong ngoặc tương ứng với tốc độ thiết kế là 60 km/h. Trị số trong ngoặc tương ứng với tốc độ thiết kế là 60 km/h.\n\n2.6.4.2. Các yếu tố hình học của đường nhánh (bán kính đường cong bằng, đường cong chuyển tiếp, siêu cao, độ mở rộng, độ dốc dọc, đường cong đứng, tầm nhìn xe) phải bảo đảm yêu cầu kỹ thuật tương ứng với tốc độ thiết kế.\n\n2.6.5. Phải bố trí làn tăng, giảm tốc tại các nhánh vào, ra đường bộ cao tốc.\n\n2.7. Nền, mặt đường của đường bộ cao tốc\n\n2.7.1. Nền đường\n\n2.7.1.1. Nền đường phải bảo đảm ổn định, duy trì được các kích thước hình học, có đủ cường độ để chịu được các tác động của tải trọng xe và các yếu tố thiên nhiên trong suốt thời gian sử dụng.\n\n2.7.1.2. Nền đường phải tính toán, thiết kế xây dựng dựa trên các số liệu khảo sát địa hình, địa chất, thủy văn.\n\n2.7.2. Mặt đường phải được thiết kế, xây dựng bảo đảm các yêu cầu về cường độ, tính bền vững, độ nhám, độ bằng phẳng và khả năng thoát nước.\n\n2.8. An toàn phòng hộ trên đường bộ cao tốc\n\n2.8.1. Bố trí phòng hộ\n\n2.8.1.1. Phải bố trí đồng bộ hệ thống phòng hộ bảo đảm an toàn giao thông trên đường bộ cao tốc.\n\n2.8.1.2. Phải bố trí hàng rào bảo vệ để ngăn cách người, gia súc hoặc thú rừng qua đường.\n\n2.8.2. Hệ thống báo hiệu trên đường bộ cao tốc được bố trí tuân thủ quy chuẩn kỹ thuật quốc gia về báo hiệu đường bộ.\n\n2.8.3. Phải bố trí hệ thống vạch sơn dẫn hướng và kết hợp với việc bố trí lan can phòng hộ hoặc cọc tiêu để bảo đảm an toàn khai thác.\n\n2.8.4. Chống chói\n\n2.8.4.1. Phải có biện pháp chống chói do đèn pha của xe chạy ngược chiều về ban đêm.\n\n2.8.4.2. Phải kiểm tra việc bảo đảm tầm nhìn ở các đoạn đường cong khi có bố trí các giải pháp chống chói.\n\n2.8.4.3. Đoạn đường bộ cao tốc có dải giữa rộng từ 12,0 m trở lên không cần có biện pháp chống chói.\n\n2.8.5. Bố trí chiếu sáng trên đường bộ cao tốc tại các khu vực sau:\n\n2.8.5.1. Trạm thu phí.\n\n2.8.5.2. Trong hầm.\n\n2.8.5.3. Phạm vi các vị trí giao nhau liên thông trên đường bộ cao tốc.\n\n2.8.6. Phải bố trí tường chống ồn ở gần khu vực đông dân cư.\n\n2.9. Tốc độ tối đa cho phép khai thác trên đường bộ cao tốc không vượt quá 120 km/h. Tốc độ tối đa cho phép và tốc độ thiết kế không được chênh nhau quá 20 km/h; tốc độ tối đa cho phép của 02 đoạn tuyến liên tiếp không được chênh nhau quá 20 km/h.\n\n3. TỔ CHỨC THỰC HIỆN\n\n3.1. Cục Đường cao tốc Việt Nam chịu trách nhiệm tổ chức triển khai Quy chuẩn này.\n\n3.2. Trường hợp các văn bản quy phạm pháp luật được viện dẫn trong Quy chuẩn này có sự thay đổi, bổ sung hoặc được thay thế thì áp dụng theo văn bản sửa đổi, bổ sung, thay thế./.', '1. Đường cao tốc phải được đặt biển báo tốc độ khai thác tối đa, tốc độ khai thác tối thiểu.\n\n2. Tốc độ khai thác tối đa cho phép trên đường cao tốc là 120 km/h.\n\n3. Tốc độ khai thác tối thiểu cho phép trên đường cao tốc là 60 km/h. Trường hợp đường cao tốc có tốc độ thiết kế 60 km/h thì tốc độ khai thác tối thiểu thực hiện theo phương án tổ chức giao thông được cấp có thẩm quyền phê duyệt.\n\n4. Trị số tốc độ khai thác tối đa, tối thiểu cho phép trên đường cao tốc, kể cả các đường nhánh ra, vào đường cao tốc được xác định trong phương án tổ chức giao thông được cấp có thẩm quyền phê duyệt.\n\nĐiều 10. Đặt biển báo tốc độ khai thác\n\n1. Việc đặt biển báo tốc độ khai thác thực hiện theo quy định của pháp luật về báo hiệu đường bộ và phải căn cứ vào điều kiện thực tế của đoạn tuyến, tuyến đường về: kết cấu hạ tầng giao thông đường bộ, lưu lượng, loại phương tiện và thời gian trong ngày.\n\n2. Cơ quan có thẩm quyền quy định tại khoản 3 Điều này quyết định đặt biển báo hiệu các trường hợp dưới đây:\n\na) Đối với đường đôi, đặt biển báo tốc độ khai thác tối đa riêng cho từng chiều đường;\n\nb) Đặt biển báo tốc độ khai thác tối đa cho một khoảng thời gian trong ngày (biển phụ, biển điện tử);\n\nc) Đặt biển báo tốc độ khai thác tối đa riêng đối với các loại phương tiện có nguy cơ mất an toàn giao thông cao;\n\nd) Đặt biển báo tốc độ khai thác trong trường hợp quy định tại khoản 4 Điều này.\n\n3. Cơ quan có thẩm quyền quyết định đặt biển báo đối với các trường hợp quy định tại khoản 2 Điều này, bao gồm:\n\na) Cục Đường bộ Việt Nam, Cục Đường Cao tốc Việt Nam đối với đường cao tốc được Bộ Giao thông vận tải giao quản lý:\n\nb) Cục Đường bộ Việt Nam đối với đường cao tốc do doanh nghiệp được Nhà nước giao quản lý, vận hành, khai thác; hệ thống quốc lộ và đường khác thuộc phạm vi quản lý của Bộ Giao thông vận tải;\n\nc) Ủy ban nhân dân tỉnh, thành phố trực thuộc Trung ương đối với đường cao tốc, quốc lộ, đường tỉnh, đường huyện, đường xã, đường thôn, đường đô thị và đường chuyên dùng có hoạt động giao thông công cộng thuộc phạm vi quản lý.\n\n4. Cơ quan quản lý đường bộ có thẩm quyền quy định tại khoản 3 Điều này chủ trì, phối hợp với lực lượng cảnh sát giao thông trên tuyến, Ủy ban nhân cấp huyện nơi có đoạn đường cần đặt biển báo tốc độ cho phép để xem xét, quyết định tốc độ khai thác cho phép và tổ chức thực hiện đặt biển báo tốc độ trong các trường hợp sau:\n\na) Đường bộ đang khai thác nằm trong khu vực đông dân cư có điều kiện bất lợi (đường một chiều hoặc đường hai chiều có tổng bề rộng phần xe chạy nhỏ hơn 3,0m và tập trung công trình hạ tầng liên tiếp, sát mép phần xe chạy, tầm nhìn hạn chế).\n\nb) Đường bộ đang khai thác nằm ngoài khu vực đông dân cư thuộc các đoạn đường cấp IV, cấp V, cấp VI và các đoạn đường theo cấp kỹ thuật quy định tại điểm d khoản 2 Điều 10 Luật Đường bộ, có điều kiện bất lợi, tiềm ẩn nguy cơ xảy ra mất an toàn giao thông (bán kính đường cong nhỏ, đường cong liên tiếp, độ dốc dọc lớn, tầm nhìn hạn chế).\n\nĐiều 11. Khoảng cách an toàn giữa hai xe khi tham gia giao thông trên đường bộ\n\n1. Khi điều khiển phương tiện tham gia giao thông trên đường bộ, người lái xe, người điều khiển xe máy chuyên dùng phải giữ một khoảng cách an toàn đối với xe chạy liền trước cùng làn hoặc cùng phần đường, cùng chiều xe của mình; ở nơi có biển báo ""Cự ly tối thiểu giữa hai xe"" phải giữ khoảng cách không nhỏ hơn trị số ghi trên biển báo.\n\n2. Khoảng cách an toàn giữa hai xe khi tham gia giao thông trên đường\n\na) Trong điều kiện mặt đường khô ráo, không có sương mù, mặt đường không trơn trượt, địa hình bằng phẳng, đường thẳng, tầm nhìn bảo đảm, khoảng cách an toàn ứng với mỗi tốc độ được quy định như sau:\n\nBảng 3\n\nTốc độ lưu hành (V km/h) Khoảng cách an toàn (m) V = 60 35 60 < V ≤ 80 55 80 < V ≤ 100 70 100 < V ≤ 120 100\n\nKhi điều khiển xe chạy với tốc độ dưới 60 km/h, người lái xe, người điều khiển xe máy chuyên dùng phải chủ động giữ khoảng cách an toàn phù hợp với xe chạy liền trước xe của mình; khoảng cách này tùy thuộc vào mật độ phương tiện, tình hình giao thông thực tế để đảm bảo an toàn giao thông.\n\nb) Trong điều kiện trời mưa, có sương mù, mặt đường trơn trượt, đường có địa hình quanh co, đèo dốc, tầm nhìn hạn chế, người lái xe phải điều chỉnh khoảng cách an toàn lớn hơn trị số ghi trên biển báo hoặc trị số được quy định tại điểm a khoản này.\n\nChương III\n\nHIỆU LỰC THI HÀNH\n\nĐiều 12. Hiệu lực thi hành\n\n1. Thông tư này có hiệu lực kể từ ngày 01 tháng 01 năm 2025 và thay thế Thông tư số 31/2019/TT-BGTVT ngày 29 tháng 8 năm 2019 của Bộ trưởng Bộ Giao thông vận tải quy định về tốc độ và khoảng cách an toàn của xe cơ giới, xe máy chuyên dùng tham gia giao thông đường bộ, thay thế Điều 15 Thông tư số 06/2023/TT-BGTVT ngày 12 tháng 5 năm 2023 của Bộ trưởng Bộ Giao thông vận tải sửa đổi, bổ sung một số điều của các Thông tư liên quan đến quản lý, khai thác, sử dụng, bảo trì và bảo vệ đường bộ.\n\n2. Trường hợp các văn bản quy phạm được dẫn chiếu tại Thông tư này được sửa đổi, bổ sung hoặc thay thế thì áp dụng các văn bản sửa đổi, bổ sung hoặc thay thế./.\n\nNơi nhận:\n- Bộ trưởng (để b/c);\n- Các Thứ trưởng Bộ GTVT;\n- Văn phòng Chính phủ;\n- Tòa án nhân dân tối cao;\n- Viện kiểm sát nhân dân tối cao;\n- Các Bộ, cơ quan ngang Bộ, cơ quan thuộc Chính phủ;\n- UBND các tỉnh, thành phố trực thuộc Trung ương;\n- Cục Kiểm tra văn bản QPPL (Bộ Tư pháp);\n- Công báo;\n- Cổng Thông tin điện tử Chính phủ;\n- Cổng Thông tin điện tử Bộ GTVT;\n- Các cơ quan, đơn vị thuộc Bộ GTVT;\n- Lưu VT, KCHT(10). KT.BỘ TRƯỞNG\nTHỨ TRƯỞNG\n\n\n\n\nNguyễn Duy Lâm']","**Nguồn văn bản:** /content/drive/MyDrive/ITProject_data/new_law/38_2024_TT-BGTVT_622477.docx

**Tên văn bản:** (Không có tiêu đề trong metadata)

**(Không có article_title):** (Không có article_title trong metadata)

**Nội dung:**

1. Tốc độ khai thác tối đa cho phép xe cơ giới tham gia giao thông trên đường bộ trong khu vực đông dân cư:

    Bảng 1

    | Loại xe cơ giới đường bộ | Tốc độ khai thác tối đa (km/h) Đường đôi; đường một chiều có từ hai làn xe cơ giới trở lên | Tốc độ khai thác tối đa (km/h) Đường hai chiều; đường một chiều có một làn xe cơ giới |
    |---|---|---|
    | Các loại xe cơ giới, trừ các xe được quy định tại Điều 7 và Điều 8 Thông tư này | 60 | 50 |


2. Tốc độ khai thác tối đa cho phép xe cơ giới tham gia giao thông trên đường bộ ngoài khu vực đông dân cư:

    Bảng 2

    | Loại xe cơ giới đường bộ | Tốc độ khai thác tối đa (km/h) Đường đôi; đường một chiều có từ hai làn xe cơ giới trở lên | Tốc độ khai thác tối đa (km/h) Đường hai chiều; đường một chiều có một làn xe cơ giới |
    |---|---|---|
    | Xe ô tô chở người đến 28 chỗ không kể chỗ của người lái xe (trừ xe buýt); ô tô tải có trọng tải không lớn hơn 3,5 tấn | 90 | 80 |
    | Xe ô tô chở người trên 28 chỗ không kể chỗ người lái xe (trừ xe buýt); ô tô tải có trọng tải trên 3,5 tấn (trừ ô tô xi téc) | 80 | 70 |
    | Xe buýt; ô tô đầu kéo kéo sơ mi rơ moóc (trừ ô tô đầu kéo kéo sơ mi rơ moóc xi téc); xe mô tô; ô tô chuyên dùng (trừ ô tô trộn vữa, ô tô trộn bê tông lưu động) | 70 | 60 |
    | Ô tô kéo rơ moóc; ô tô kéo xe khác; ô tô trộn vữa, ô tô trộn bê tông lưu động, ô tô xi téc, ô tô đầu kéo kéo sơ mi rơ moóc xi téc, ô tô kéo theo rơ moóc xi téc) | 60 | 50 |

3. Tốc độ khai thác tối đa cho phép đối với xe máy chuyên dùng, xe gắn máy và các loại xe tương tự tham gia giao thông trên đường bộ (trừ đường cao tốc): 40 km/h.

4. Tốc độ khai thác tối đa cho phép đối với xe chở người bốn bánh có gắn động cơ: 30 km/h.

5. Tốc độ khai thác tối đa cho phép đối với xe chở hàng bốn bánh có gắn động cơ: 50 km/h.


**Tóm lại:** Tốc độ tối đa trong khu vực đô thị là 50 km/h trên đường hai chiều, đường một chiều có một làn xe cơ giới và 60 km/h trên đường đôi, đường một chiều có từ hai làn xe cơ giới trở lên. Đối với xe máy chuyên dùng, xe gắn máy và các loại xe tương tự là 40 km/h. Xe chở người bốn bánh có gắn động cơ là 30 km/h và xe chở hàng bốn bánh có gắn động cơ là 50km/h.
",Tốc độ tối đa trong khu vực đô thị được giảm từ 50 km/h xuống 40 km/h.,1.0,0.6258303844774304,0.0,0.0
15,Quy định mới về tốc độ tối đa ngoài khu vực đô thị là gì?,"['BỘ GIAO THÔNG VẬN TẢI\n-------- CỘNG HÒA XÃ HỘI CHỦ NGHĨA VIỆT NAM\nĐộc lập - Tự do - Hạnh phúc \n--------------- Số: 38/2024/TT-BGTVT Hà Nội, Ngày 15 tháng 11 năm 2024\n\nTHÔNG TƯ\n\nQUY ĐỊNH VỀ TỐC ĐỘ VÀ KHOẢNG CÁCH AN TOÀN CỦA XE CƠ GIỚI, XE MÁY CHUYÊN DÙNG THAM GIA GIAO THÔNG TRÊN ĐƯỜNG BỘ\n\nCăn cứ Luật Trật tự, an toàn giao thông đường bộ ngày 27 tháng 6 năm 2024;\n\nCăn cứ Luật Đường bộ ngày 27 tháng 6 năm 2024;\n\nCăn cứ Nghị định số 56/2022/NĐ-CP ngày 24 tháng 8 năm 2022 của Chính phủ quy định chức năng, nhiệm vụ, quyền hạn và cơ cấu tổ chức của Bộ Giao thông vận tải;\n\nTheo đề nghị của Vụ trưởng Vụ Kết cấu hạ tầng giao thông và Cục trưởng Cục đường bộ Việt Nam;\n\nBộ trưởng Bộ Giao thông vận tải ban hành Thông tư quy định về tốc độ và khoảng cách an toàn của xe cơ giới, xe máy chuyên dùng tham gia giao thông trên đường bộ.\n\nChương I\n\nQUY ĐỊNH CHUNG\n\nĐiều 1. Phạm vi điều chỉnh\n\nThông tư này quy định về tốc độ thiết kế của đường bộ; tốc độ khai thác và khoảng cách an toàn của xe cơ giới, xe máy chuyên dùng khi tham gia giao thông trên đường bộ, trừ xe ưu tiên đang đi làm nhiệm vụ theo quy định của pháp luật.\n\nĐiều 2. Đối tượng áp dụng\n\nThông tư này áp dụng đối với người lái xe, người điều khiển xe máy chuyên dùng và tổ chức, cá nhân liên quan đến quản lý và thực hiện các quy định về tốc độ thiết kế, tốc độ khai thác của đường bộ và khoảng cách an toàn của xe cơ giới, xe máy chuyên dùng khi tham gia giao thông trên đường bộ.\n\nĐiều 3. Giải thích từ ngữ\n\nTrong Thông tư này, các từ ngữ dưới đây được hiểu như sau:\n\n1. Đường bộ trong khu đông dân cư là đoạn đường bộ nằm trong khu vực nội thành phố, nội thị xã, nội thị trấn và những đoạn đường có đông dân cư sinh sống sát dọc theo đường, được xác định bằng biển báo “Bắt đầu khu đông dân cư” và biển báo “Hết khu đông dân cư”.\n\n2. Đường đôi là đường có chiều đi và chiều về được phân biệt bằng dải phân cách giữa.\n\n3. Đường một chiều là đường chỉ cho đi một chiều.\n\n4. Đường hai chiều là đường dùng chung cho cả chiều đi và về trên cùng một phần đường xe chạy mà không có dải phân cách giữa.\n\n5. Trọng tải là khối lượng hàng hóa chuyên chở cho phép, được ghi trên Giấy chứng nhận an toàn kỹ thuật và bảo vệ môi trường của phương tiện giao thông cơ giới đường bộ, Giấy chứng \n\n\n\nnhận chất lượng an toàn kỹ thuật và bảo vệ môi trường xe cơ giới nhập khẩu hoặc Giấy chứng nhận chất lượng an toàn kỹ thuật và bảo vệ môi trường kiểu loại ô tô sản xuất, lắp ráp.\n\n6. Tốc độ khai thác tối đa là giá trị tốc độ lớn nhất cho phép phương tiện tham gia giao thông trên đường bộ bảo đảm an toàn giao thông và khai thác hiệu quả tuyến đường.\n\n7. Tốc độ khai thác tối thiểu là giá trị tốc độ nhỏ nhất cho phép phương tiện tham gia giao thông trên đường bộ bảo đảm an toàn giao thông và khai thác hiệu quả tuyến đường.\n\n8. Khoảng cách an toàn là cự ly tối thiểu giữa phương tiện phía sau với phương tiện đang di chuyển liền trước, cùng làn đường, bảo đảm tránh xảy ra va chạm trong trường hợp phương tiện phía trước đột ngột giảm tốc độ hoặc dừng lại.\n\n9. Tốc độ lưu hành là giá trị tốc độ của phương tiện tại thời điểm tham gia giao thông trên đường bộ.\n\nĐiều 4. Nguyên tắc chấp hành quy định về tốc độ khai thác và khoảng cách an toàn khi điều khiển phương tiện trên đường bộ\n\n1. Khi tham gia giao thông trên đường bộ, người lái xe, người điều khiển xe máy chuyên dùng phải chấp hành quy định về tốc độ khai thác và khoảng cách an toàn theo quy định tại Điều 12 Luật Trật tự, an toàn giao thông đường bộ.\n\n2. Tại những đoạn đường không bố trí biển báo tốc độ khai thác tối đa, không bố trí biển báo khoảng cách an toàn giữa hai xe, người điều khiển phương tiện tham gia giao thông phải thực hiện theo quy định tại Điều 6, Điều 7, Điều 8 và Điều 11 Thông tư này.\n\nChương II\n\nTỐC ĐỘ THIẾT KẾ CỦA ĐƯỜNG BỘ; TỐC ĐỘ KHAI THÁC CỦA ĐƯỜNG BỘ, KHOẢNG CÁCH AN TOÀN CỦA XE CƠ GIỚI, XE MÁY CHUYÊN DÙNG THAM GIA GIAO THÔNG TRÊN ĐƯỜNG BỘ\n\nĐiều 5. Tốc độ thiết kế của đường bộ\n\n1. Tốc độ thiết kế của đường bộ là giá trị vận tốc được dùng để tính toán các chỉ tiêu kỹ thuật của đường bộ. Tốc độ thiết kế của đường bộ được xác định trong giai đoạn đầu tư xây dựng, nâng cấp, cải tạo đường bộ nhằm bảo đảm cho phương tiện di chuyển an toàn; được quyết định theo cấp kỹ thuật của đường bộ và điều kiện địa hình.\n\n2. Tốc độ thiết kế đường bộ cao tốc là giá trị vận tốc được dùng để tính toán các chỉ tiêu kỹ thuật của đường bộ cao tốc, được xác định theo cấp đường cao tốc. Khi thiết kế đường bộ cao tốc có thể áp dụng tốc độ thiết kế khác nhau theo từng đoạn nhưng phải bảo đảm các yêu cầu về chiều dài đoạn chuyển tiếp và tốc độ thiết kế trung gian giữa các đoạn. Tốc độ thiết kế đường bộ cao tốc được xác định theo Quy chuẩn kỹ thuật quốc gia về đường bộ cao tốc QCVN 115:2024/BGTVT.\n\n3. Tốc độ thiết kế đường bộ được xác định theo Tiêu chuẩn quốc gia TCVN 4054: 2005 Đường ô tô - Yêu cầu thiết kế.\n\n4. Tốc độ thiết kế đường bộ trong phạm vi đô thị được xác định theo Quy chuẩn kỹ thuật quốc gia về hệ thống công trình hạ tầng kỹ thuật QCVN 07-4:2023/BXD.\n\n5. Tốc độ thiết kế đường giao thông nông thôn được xác định theo Tiêu chuẩn quốc gia TCVN 10380:2014 Đường giao thông nông thôn - Yêu cầu thiết kế.\n\n\n\nĐiều 6. Tốc độ khai thác tối đa cho phép xe cơ giới tham gia giao thông trên đường bộ (trừ đường cao tốc)\n\n1. Tốc độ khai thác tối đa cho phép xe cơ giới tham gia giao thông trên đường bộ trong khu vực đông dân cư\n\nBảng 1\n\nLoại xe cơ giới đường bộ Tốc độ khai thác tối đa (km/h) Tốc độ khai thác tối đa (km/h) Đường đôi; đường một chiều có từ hai làn xe cơ giới trở lên Đường hai chiều; đường một chiều có một làn xe cơ giới Các loại xe cơ giới, trừ các xe được quy định tại Điều 7 và Điều 8 Thông tư này 60 50\n\n2. Tốc độ khai thác tối đa cho phép xe cơ giới tham gia giao thông trên đường bộ ngoài khu vực đông dân cư\n\nBảng 2\n\nLoại xe cơ giới đường bộ Tốc độ khai thác tối đa (km/h) Tốc độ khai thác tối đa (km/h) Đường đôi; đường một chiều có từ hai làn xe cơ giới trở lên Đường hai chiều; đường một chiều có một làn xe cơ giới Xe ô tô chở người đến 28 chỗ không kể chỗ của người lái xe (trừ xe buýt); ô tô tải có trọng tải không lớn hơn 3,5 tấn 90 80 Xe ô tô chở người trên 28 chỗ không kể chỗ người lái xe (trừ xe buýt); ô tô tải có trọng tải trên 3,5 tấn (trừ ô tô xi téc) 80 70 Xe buýt; ô tô đầu kéo kéo sơ mi rơ moóc (trừ ô tô đầu kéo kéo sơ mi rơ moóc xi téc); xe mô tô; ô tô chuyên dùng (trừ ô tô trộn vữa, ô tô trộn bê tông lưu động) 70 60 Ô tô kéo rơ moóc; ô tô kéo xe khác; ô tô trộn vữa, ô tô trộn bê tông lưu động, ô tô xi téc, ô tô đầu kéo kéo sơ mi rơ moóc xi téc, ô tô kéo theo rơ moóc xi téc) 60 50\n\nĐiều 7. Tốc độ khai thác tối đa cho phép đối với xe máy chuyên dùng, xe gắn máy và các loại xe tương tự tham gia giao thông trên đường bộ (trừ đường cao tốc)\n\nXe máy chuyên dùng, xe gắn máy và các loại xe tương tự khi tham gia giao thông, tốc độ khai thác tối đa là 40 km/h.\n\nĐiều 8. Tốc độ khai thác tối đa cho phép đối với xe chở người bốn bánh có gắn động cơ, xe chở hàng bốn bánh có gắn động cơ tham gia giao thông trên đường bộ (trừ đường cao tốc)\n\n1. Xe chở người bốn bánh có gắn động cơ khi tham gia giao thông trong phạm vi và thời gian cho phép hoạt động, tốc độ khai thác tối đa là 30 km/h.\n\n2. Xe chở hàng bốn bánh có gắn động cơ khi tham gia giao thông trong phạm vi và thời gian cho phép hoạt động, tốc độ khai thác tối đa là 50 km/h.\n\nĐiều 9. Tốc độ khai thác tối đa, tốc độ khai thác tối thiểu cho phép đối với các loại xe cơ giới, xe máy chuyên dùng trên đường cao tốc\n\n1. Đường cao tốc phải được đặt biển báo tốc độ khai thác tối đa, tốc độ khai thác tối thiểu.\n\n2. Tốc độ khai thác tối đa cho phép trên đường cao tốc là 120 km/h.\n\n3. Tốc độ khai thác tối thiểu cho phép trên đường cao tốc là 60 km/h. Trường hợp đường cao tốc có tốc độ thiết kế 60 km/h thì tốc độ khai thác tối thiểu thực hiện theo phương án tổ chức giao thông được cấp có thẩm quyền phê duyệt.', '1. Đường cao tốc phải được đặt biển báo tốc độ khai thác tối đa, tốc độ khai thác tối thiểu.\n\n2. Tốc độ khai thác tối đa cho phép trên đường cao tốc là 120 km/h.\n\n3. Tốc độ khai thác tối thiểu cho phép trên đường cao tốc là 60 km/h. Trường hợp đường cao tốc có tốc độ thiết kế 60 km/h thì tốc độ khai thác tối thiểu thực hiện theo phương án tổ chức giao thông được cấp có thẩm quyền phê duyệt.\n\n4. Trị số tốc độ khai thác tối đa, tối thiểu cho phép trên đường cao tốc, kể cả các đường nhánh ra, vào đường cao tốc được xác định trong phương án tổ chức giao thông được cấp có thẩm quyền phê duyệt.\n\nĐiều 10. Đặt biển báo tốc độ khai thác\n\n1. Việc đặt biển báo tốc độ khai thác thực hiện theo quy định của pháp luật về báo hiệu đường bộ và phải căn cứ vào điều kiện thực tế của đoạn tuyến, tuyến đường về: kết cấu hạ tầng giao thông đường bộ, lưu lượng, loại phương tiện và thời gian trong ngày.\n\n2. Cơ quan có thẩm quyền quy định tại khoản 3 Điều này quyết định đặt biển báo hiệu các trường hợp dưới đây:\n\na) Đối với đường đôi, đặt biển báo tốc độ khai thác tối đa riêng cho từng chiều đường;\n\nb) Đặt biển báo tốc độ khai thác tối đa cho một khoảng thời gian trong ngày (biển phụ, biển điện tử);\n\nc) Đặt biển báo tốc độ khai thác tối đa riêng đối với các loại phương tiện có nguy cơ mất an toàn giao thông cao;\n\nd) Đặt biển báo tốc độ khai thác trong trường hợp quy định tại khoản 4 Điều này.\n\n3. Cơ quan có thẩm quyền quyết định đặt biển báo đối với các trường hợp quy định tại khoản 2 Điều này, bao gồm:\n\na) Cục Đường bộ Việt Nam, Cục Đường Cao tốc Việt Nam đối với đường cao tốc được Bộ Giao thông vận tải giao quản lý:\n\nb) Cục Đường bộ Việt Nam đối với đường cao tốc do doanh nghiệp được Nhà nước giao quản lý, vận hành, khai thác; hệ thống quốc lộ và đường khác thuộc phạm vi quản lý của Bộ Giao thông vận tải;\n\nc) Ủy ban nhân dân tỉnh, thành phố trực thuộc Trung ương đối với đường cao tốc, quốc lộ, đường tỉnh, đường huyện, đường xã, đường thôn, đường đô thị và đường chuyên dùng có hoạt động giao thông công cộng thuộc phạm vi quản lý.\n\n4. Cơ quan quản lý đường bộ có thẩm quyền quy định tại khoản 3 Điều này chủ trì, phối hợp với lực lượng cảnh sát giao thông trên tuyến, Ủy ban nhân cấp huyện nơi có đoạn đường cần đặt biển báo tốc độ cho phép để xem xét, quyết định tốc độ khai thác cho phép và tổ chức thực hiện đặt biển báo tốc độ trong các trường hợp sau:\n\na) Đường bộ đang khai thác nằm trong khu vực đông dân cư có điều kiện bất lợi (đường một chiều hoặc đường hai chiều có tổng bề rộng phần xe chạy nhỏ hơn 3,0m và tập trung công trình hạ tầng liên tiếp, sát mép phần xe chạy, tầm nhìn hạn chế).\n\nb) Đường bộ đang khai thác nằm ngoài khu vực đông dân cư thuộc các đoạn đường cấp IV, cấp V, cấp VI và các đoạn đường theo cấp kỹ thuật quy định tại điểm d khoản 2 Điều 10 Luật Đường bộ, có điều kiện bất lợi, tiềm ẩn nguy cơ xảy ra mất an toàn giao thông (bán kính đường cong nhỏ, đường cong liên tiếp, độ dốc dọc lớn, tầm nhìn hạn chế).\n\nĐiều 11. Khoảng cách an toàn giữa hai xe khi tham gia giao thông trên đường bộ\n\n1. Khi điều khiển phương tiện tham gia giao thông trên đường bộ, người lái xe, người điều khiển xe máy chuyên dùng phải giữ một khoảng cách an toàn đối với xe chạy liền trước cùng làn hoặc cùng phần đường, cùng chiều xe của mình; ở nơi có biển báo ""Cự ly tối thiểu giữa hai xe"" phải giữ khoảng cách không nhỏ hơn trị số ghi trên biển báo.\n\n2. Khoảng cách an toàn giữa hai xe khi tham gia giao thông trên đường\n\na) Trong điều kiện mặt đường khô ráo, không có sương mù, mặt đường không trơn trượt, địa hình bằng phẳng, đường thẳng, tầm nhìn bảo đảm, khoảng cách an toàn ứng với mỗi tốc độ được quy định như sau:\n\nBảng 3\n\nTốc độ lưu hành (V km/h) Khoảng cách an toàn (m) V = 60 35 60 < V ≤ 80 55 80 < V ≤ 100 70 100 < V ≤ 120 100\n\nKhi điều khiển xe chạy với tốc độ dưới 60 km/h, người lái xe, người điều khiển xe máy chuyên dùng phải chủ động giữ khoảng cách an toàn phù hợp với xe chạy liền trước xe của mình; khoảng cách này tùy thuộc vào mật độ phương tiện, tình hình giao thông thực tế để đảm bảo an toàn giao thông.\n\nb) Trong điều kiện trời mưa, có sương mù, mặt đường trơn trượt, đường có địa hình quanh co, đèo dốc, tầm nhìn hạn chế, người lái xe phải điều chỉnh khoảng cách an toàn lớn hơn trị số ghi trên biển báo hoặc trị số được quy định tại điểm a khoản này.\n\nChương III\n\nHIỆU LỰC THI HÀNH\n\nĐiều 12. Hiệu lực thi hành\n\n1. Thông tư này có hiệu lực kể từ ngày 01 tháng 01 năm 2025 và thay thế Thông tư số 31/2019/TT-BGTVT ngày 29 tháng 8 năm 2019 của Bộ trưởng Bộ Giao thông vận tải quy định về tốc độ và khoảng cách an toàn của xe cơ giới, xe máy chuyên dùng tham gia giao thông đường bộ, thay thế Điều 15 Thông tư số 06/2023/TT-BGTVT ngày 12 tháng 5 năm 2023 của Bộ trưởng Bộ Giao thông vận tải sửa đổi, bổ sung một số điều của các Thông tư liên quan đến quản lý, khai thác, sử dụng, bảo trì và bảo vệ đường bộ.\n\n2. Trường hợp các văn bản quy phạm được dẫn chiếu tại Thông tư này được sửa đổi, bổ sung hoặc thay thế thì áp dụng các văn bản sửa đổi, bổ sung hoặc thay thế./.\n\nNơi nhận:\n- Bộ trưởng (để b/c);\n- Các Thứ trưởng Bộ GTVT;\n- Văn phòng Chính phủ;\n- Tòa án nhân dân tối cao;\n- Viện kiểm sát nhân dân tối cao;\n- Các Bộ, cơ quan ngang Bộ, cơ quan thuộc Chính phủ;\n- UBND các tỉnh, thành phố trực thuộc Trung ương;\n- Cục Kiểm tra văn bản QPPL (Bộ Tư pháp);\n- Công báo;\n- Cổng Thông tin điện tử Chính phủ;\n- Cổng Thông tin điện tử Bộ GTVT;\n- Các cơ quan, đơn vị thuộc Bộ GTVT;\n- Lưu VT, KCHT(10). KT.BỘ TRƯỞNG\nTHỨ TRƯỞNG\n\n\n\n\nNguyễn Duy Lâm', '2.3.2.2. Đối với hầm dài từ 1.000,0 m trở lên khi không bố trí làn dừng xe khẩn cấp phải bố trí vị trí dừng xe khẩn cấp có chiều dài tối thiểu 30,0 m cách nhau tối đa 500,0 m, bề rộng vị trí dừng xe khẩn cấp theo cấp tốc độ thiết kế của đường bộ cao tốc.\n\n2.4. Bố trí hệ thống đường gom, đường bên để bảo đảm việc đi lại cho người dân khu vực bị ảnh hưởng, chia cắt bởi đường bộ cao tốc.\n\n2.5. Các yếu tố hình học đường bộ cao tốc\n\n2.5.1. Các yếu tố hình học của đường bộ cao tốc phải đáp ứng các yêu cầu được quy định tại Bảng 1 sau đây.\n\nBảng 1 - Các trị số giới hạn thiết kế bình đồ và mặt cắt dọc\n\nSTT Tên chỉ tiêu Đơn vị Cấp tốc độ thiết kế (km/h) Cấp tốc độ thiết kế (km/h) Cấp tốc độ thiết kế (km/h) 1 Tốc độ thiết kế Vtk km/h 120 100 80 2 Độ dốc siêu cao (hay độ nghiêng một mái) lớn nhất isc không lớn hơn % 8 8 8 3 Bán kính tối thiểu Rmin tương ứng với isc = +8% m 650 450 240 (140) 4 Bán kính tương ứng với isc = +2% m 3000 2000 1300 (700) 5 Bán kính tối thiểu không cần cấu tạo siêu cao isc = -2% m 5500 4000 2500 (1500) 6 Chiều dài tối thiểu đường cong chuyển tiếp ứng với Rmin m 210 210 170 (150) 7 Tầm nhìn dừng xe tối thiểu m 210 160 110 (75) 8 Độ dốc dọc lên dốc lớn nhất % 4 5 6 9 Độ dốc dọc xuống dốc lớn nhất % 5,5 6 6 10 Bán kính đường cong đứng lồi tối thiểu giới hạn m 12000 6000 3000 (1500) 11 Bán kính đường cong đứng lồi tối thiểu thông thường m 17000 10000 4500 (2000) 12 Bán kính đường cong đứng lõm tối thiểu giới hạn m 4000 3000 2000 (1000) 13 Bán kính đường cong đứng lõm tối thiểu thông thường m 6000 4500 3000 (1500) 14 Chiều dài đường cong đứng tối thiểu giới hạn m 100 85 70(50) 15 Chiều dài đường cong đứng tối thiểu thông thường m 250 210 170 (120) 1. Trị số trong ngoặc tương ứng với tốc độ thiết kế 60 km/h. 2. Chiều dài đường cong chuyển tiếp phải được tính toán để bảo đảm an toàn, êm thuận. Không phải bố trí đường cong chuyển tiếp tại các đường cong không cần cấu tạo siêu cao. 1. Trị số trong ngoặc tương ứng với tốc độ thiết kế 60 km/h. 2. Chiều dài đường cong chuyển tiếp phải được tính toán để bảo đảm an toàn, êm thuận. Không phải bố trí đường cong chuyển tiếp tại các đường cong không cần cấu tạo siêu cao. 1. Trị số trong ngoặc tương ứng với tốc độ thiết kế 60 km/h. 2. Chiều dài đường cong chuyển tiếp phải được tính toán để bảo đảm an toàn, êm thuận. Không phải bố trí đường cong chuyển tiếp tại các đường cong không cần cấu tạo siêu cao. 1. Trị số trong ngoặc tương ứng với tốc độ thiết kế 60 km/h. 2. Chiều dài đường cong chuyển tiếp phải được tính toán để bảo đảm an toàn, êm thuận. Không phải bố trí đường cong chuyển tiếp tại các đường cong không cần cấu tạo siêu cao. 1. Trị số trong ngoặc tương ứng với tốc độ thiết kế 60 km/h. 2. Chiều dài đường cong chuyển tiếp phải được tính toán để bảo đảm an toàn, êm thuận. Không phải bố trí đường cong chuyển tiếp tại các đường cong không cần cấu tạo siêu cao. 1. Trị số trong ngoặc tương ứng với tốc độ thiết kế 60 km/h. 2. Chiều dài đường cong chuyển tiếp phải được tính toán để bảo đảm an toàn, êm thuận. Không phải bố trí đường cong chuyển tiếp tại các đường cong không cần cấu tạo siêu cao.\n\n2.5.2. Phải bảo đảm tầm nhìn cho các xe trên đường bộ cao tốc.\n\n2.5.3. Quy định về dốc dọc.\n\n2.5.3.1. Độ dốc dọc lớn nhất được quy định tại Bảng 1 tùy thuộc cấp thiết kế của đường bộ cao tốc.\n\n2.5.3.2. Trên các đoạn nền đào phải thiết kế độ dốc dọc tối thiểu bằng 0,50 %.\n\n2.5.3.3. Trên các đoạn chuyển tiếp có độ dốc ngang mặt đường dưới 1,00 % phải thiết kế dốc dọc tối thiểu là 0,50 %.\n\n2.5.3.4. Trong hầm, độ dốc dọc tối thiểu là 0,30 %.\n\n2.5.4. Phải bố trí đường cong đứng dạng tròn hoặc parabol tại các vị trí đổi dốc.\n\n2.6. Nút giao khác mức, đường nhánh ra, vào trên đường bộ cao tốc\n\n2.6.1. Phải bố trí nút giao khác mức tại các vị trí đường bộ cao tốc giao với các loại đường khác.\n\n2.6.2. Trường hợp đường bộ cao tốc vượt trên các đường khác phải bảo đảm tĩnh không tương ứng với cấp kỹ thuật quy hoạch của đường bên dưới.\n\n2.6.3. Khoảng cách tối thiểu giữa nút giao khác mức liên thông và vị trí ra, vào trên đường bộ cao tốc là 4,0 km. Khoảng cách giữa các vị trí nút giao khác mức liên thông trên đường bộ cao tốc tối thiểu 10,0 km, ở gần các thành phố lớn, khu đô thị lớn và khu chức năng khoảng cách tối thiểu 5,0 km. Trường hợp có các yêu cầu về an ninh quốc phòng hoặc phục vụ mục đích đặc biệt nhằm phát triển kinh tế xã hội của địa phương, khoảng cách tối thiểu giữa các nút giao khác mức liên thông được phép giảm xuống nhưng không nhỏ hơn 3,0 km.\n\n2.6.4. Các thông số kỹ thuật áp dụng cho phạm vi nút giao khác mức liên thông và các nhánh ra, vào đường bộ cao tốc.\n\n2.6.4.1. Tốc độ thiết kế trên các đường nhánh thuộc phạm vi nút giao khác mức liên thông được quy định tại Bảng 2 sau đây.\n\nBảng 2 - Tốc độ thiết kế trên các đường nhánh thuộc phạm vi nút giao khác mức liên thông\n\nĐặc điểm nút giao khác mức liên thông Cấp tốc độ thiết kế (km/h) Cấp tốc độ thiết kế (km/h) Cấp tốc độ thiết kế (km/h) 120 100 80 Liên thông giữa đường bộ cao tốc với đường bộ cao tốc và đường cấp I, cấp II 80 ÷ 50 70 ÷ 40 60 ÷ 35 (50 ÷ 35) Liên thông giữa đường bộ cao tốc với đường khác 60 ÷ 35 50 ÷ 35 40 ÷ 30 (35 ÷ 30) Trị số trong ngoặc tương ứng với tốc độ thiết kế là 60 km/h. Trị số trong ngoặc tương ứng với tốc độ thiết kế là 60 km/h. Trị số trong ngoặc tương ứng với tốc độ thiết kế là 60 km/h. Trị số trong ngoặc tương ứng với tốc độ thiết kế là 60 km/h.\n\n2.6.4.2. Các yếu tố hình học của đường nhánh (bán kính đường cong bằng, đường cong chuyển tiếp, siêu cao, độ mở rộng, độ dốc dọc, đường cong đứng, tầm nhìn xe) phải bảo đảm yêu cầu kỹ thuật tương ứng với tốc độ thiết kế.\n\n2.6.5. Phải bố trí làn tăng, giảm tốc tại các nhánh vào, ra đường bộ cao tốc.\n\n2.7. Nền, mặt đường của đường bộ cao tốc\n\n2.7.1. Nền đường\n\n2.7.1.1. Nền đường phải bảo đảm ổn định, duy trì được các kích thước hình học, có đủ cường độ để chịu được các tác động của tải trọng xe và các yếu tố thiên nhiên trong suốt thời gian sử dụng.\n\n2.7.1.2. Nền đường phải tính toán, thiết kế xây dựng dựa trên các số liệu khảo sát địa hình, địa chất, thủy văn.\n\n2.7.2. Mặt đường phải được thiết kế, xây dựng bảo đảm các yêu cầu về cường độ, tính bền vững, độ nhám, độ bằng phẳng và khả năng thoát nước.\n\n2.8. An toàn phòng hộ trên đường bộ cao tốc\n\n2.8.1. Bố trí phòng hộ\n\n2.8.1.1. Phải bố trí đồng bộ hệ thống phòng hộ bảo đảm an toàn giao thông trên đường bộ cao tốc.\n\n2.8.1.2. Phải bố trí hàng rào bảo vệ để ngăn cách người, gia súc hoặc thú rừng qua đường.\n\n2.8.2. Hệ thống báo hiệu trên đường bộ cao tốc được bố trí tuân thủ quy chuẩn kỹ thuật quốc gia về báo hiệu đường bộ.\n\n2.8.3. Phải bố trí hệ thống vạch sơn dẫn hướng và kết hợp với việc bố trí lan can phòng hộ hoặc cọc tiêu để bảo đảm an toàn khai thác.\n\n2.8.4. Chống chói\n\n2.8.4.1. Phải có biện pháp chống chói do đèn pha của xe chạy ngược chiều về ban đêm.\n\n2.8.4.2. Phải kiểm tra việc bảo đảm tầm nhìn ở các đoạn đường cong khi có bố trí các giải pháp chống chói.\n\n2.8.4.3. Đoạn đường bộ cao tốc có dải giữa rộng từ 12,0 m trở lên không cần có biện pháp chống chói.\n\n2.8.5. Bố trí chiếu sáng trên đường bộ cao tốc tại các khu vực sau:\n\n2.8.5.1. Trạm thu phí.\n\n2.8.5.2. Trong hầm.\n\n2.8.5.3. Phạm vi các vị trí giao nhau liên thông trên đường bộ cao tốc.\n\n2.8.6. Phải bố trí tường chống ồn ở gần khu vực đông dân cư.\n\n2.9. Tốc độ tối đa cho phép khai thác trên đường bộ cao tốc không vượt quá 120 km/h. Tốc độ tối đa cho phép và tốc độ thiết kế không được chênh nhau quá 20 km/h; tốc độ tối đa cho phép của 02 đoạn tuyến liên tiếp không được chênh nhau quá 20 km/h.\n\n3. TỔ CHỨC THỰC HIỆN\n\n3.1. Cục Đường cao tốc Việt Nam chịu trách nhiệm tổ chức triển khai Quy chuẩn này.\n\n3.2. Trường hợp các văn bản quy phạm pháp luật được viện dẫn trong Quy chuẩn này có sự thay đổi, bổ sung hoặc được thay thế thì áp dụng theo văn bản sửa đổi, bổ sung, thay thế./.']","**Nguồn văn bản:** /content/drive/MyDrive/ITProject_data/new_law/38_2024_TT-BGTVT_622477.docx

**Tên văn bản:**  THÔNG TƯ QUY ĐỊNH VỀ TỐC ĐỘ VÀ KHOẢNG CÁCH AN TOÀN CỦA XE CƠ GIỚI, XE MÁY CHUYÊN DÙNG THAM GIA GIAO THÔNG TRÊN ĐƯỜNG BỘ

**Điều 6:** Tốc độ khai thác tối đa cho phép xe cơ giới tham gia giao thông trên đường bộ (trừ đường cao tốc)

**Nội dung:**

2. Tốc độ khai thác tối đa cho phép xe cơ giới tham gia giao thông trên đường bộ ngoài khu vực đông dân cư:

Bảng 2

Loại xe cơ giới đường bộ | Tốc độ khai thác tối đa (km/h) | Tốc độ khai thác tối đa (km/h)
------- | -------- | --------
 | Đường đôi; đường một chiều có từ hai làn xe cơ giới trở lên | Đường hai chiều; đường một chiều có một làn xe cơ giới
Xe ô tô chở người đến 28 chỗ không kể chỗ của người lái xe (trừ xe buýt); ô tô tải có trọng tải không lớn hơn 3,5 tấn | 90 | 80
Xe ô tô chở người trên 28 chỗ không kể chỗ người lái xe (trừ xe buýt); ô tô tải có trọng tải trên 3,5 tấn (trừ ô tô xi téc) | 80 | 70
Xe buýt; ô tô đầu kéo kéo sơ mi rơ moóc (trừ ô tô đầu kéo kéo sơ mi rơ moóc xi téc); xe mô tô; ô tô chuyên dùng (trừ ô tô trộn vữa, ô tô trộn bê tông lưu động) | 70 | 60
Ô tô kéo rơ moóc; ô tô kéo xe khác; ô tô trộn vữa, ô tô trộn bê tông lưu động, ô tô xi téc, ô tô đầu kéo kéo sơ mi rơ moóc xi téc, ô tô kéo theo rơ moóc xi téc) | 60 | 50


**Tóm lại:** Tốc độ tối đa ngoài khu vực đông dân cư phụ thuộc vào loại xe và loại đường.  Cụ thể, tốc độ tối đa cho phép dao động từ 50 km/h đến 90 km/h. Đường đôi hoặc đường một chiều có từ hai làn xe cơ giới trở lên cho phép tốc độ cao hơn so với đường hai chiều hoặc đường một chiều chỉ có một làn xe cơ giới.
",Tốc độ tối đa ngoài khu vực đô thị được giảm từ 80 km/h xuống 70 km/h.,1.0,0.7071361155428608,0.0,0.0
16,Luật Giao thông Đường bộ 2025 có quy định gì về việc sử dụng đèn pha trong khu vực đô thị?,"['Điều 6. Cơ sở dữ liệu đường bộ\n\n1. Cơ sở dữ liệu đường bộ được thiết kế, xây dựng, vận hành theo Khung kiến trúc tổng thể quốc gia số, bao gồm:\n\na) Cơ sở dữ liệu về quy hoạch mạng lưới đường bộ, quy hoạch kết cấu hạ tầng đường bộ;\n\nb) Cơ sở dữ liệu về tình hình đầu tư, xây dựng kết cấu hạ tầng đường bộ;\n\nc) Cơ sở dữ liệu về kết cấu hạ tầng đường bộ đã đưa vào khai thác;\n\nd) Cơ sở dữ liệu thanh toán điện tử giao thông đường bộ;\n\nđ) Cơ sở dữ liệu về hoạt động vận tải bằng xe ô tô, trừ cơ sở dữ liệu về hành trình của phương tiện giao thông đường bộ, hình ảnh người lái xe và cơ sở dữ liệu về quản lý thời gian điều khiển phương tiện của người lái xe theo quy định của pháp luật.\n\n2. Cơ sở dữ liệu đường bộ được kết nối, chia sẻ với cơ sở dữ liệu về trật tự, an toàn giao thông đường bộ và các cơ sở dữ liệu khác có liên quan.\n\n3. Chính phủ quy định chi tiết khoản 1 và khoản 2 Điều này; quy định việc thu thập, quản lý, khai thác thông tin trong cơ sở dữ liệu đường bộ.\n\nĐiều 7. Các hành vi bị nghiêm cấm\n\n1. Phá hoại kết cấu hạ tầng đường bộ; khai thác, sử dụng kết cấu hạ tầng đường bộ trái quy định của pháp luật.\n\n2. Đấu nối trái phép vào đường chính, đường nhánh; tháo dỡ, di chuyển trái phép hoặc làm sai lệch công trình đường bộ.\n\n3. Lấn, chiếm, sử dụng, xây dựng trái phép trong phạm vi bảo vệ kết cấu hạ tầng đường bộ.\n\n4. Lắp đặt, tháo dỡ, di chuyển, điều chỉnh, che khuất báo hiệu đường bộ trái quy định của pháp luật; gắn, treo, lắp vào báo hiệu đường bộ nội dung không liên quan tới ý nghĩa, mục đích của báo hiệu đường bộ hoặc làm sai lệch báo hiệu đường bộ.\n\n5. Kinh doanh vận tải bằng xe ô tô, bằng xe bốn bánh có gắn động cơ mà không có giấy phép kinh doanh vận tải theo quy định của pháp luật hoặc kinh doanh không đúng giấy phép.\n\n6. Lập điểm đón, trả khách, bốc dỡ hàng hóa trái quy định của pháp luật.\n\nChương II\n\nKẾT CẤU HẠ TẦNG ĐƯỜNG BỘ \n\nMục 1. PHÂN LOẠI, ĐẶT TÊN, SỐ HIỆU ĐƯỜNG BỘ\n\nĐiều 8. Phân loại đường bộ theo cấp quản lý\n\n1. Đường bộ theo cấp quản lý bao gồm: quốc lộ, đường tỉnh, đường huyện, đường xã, đường thôn, đường đô thị, đường chuyên dùng và được xác định như sau:\n\na) Quốc lộ là đường nối liền Thủ đô Hà Nội với trung tâm hành chính cấp tỉnh; đường nối liền các trung tâm hành chính cấp tỉnh; đường có vị trí quan trọng đối với sự phát triển kinh tế - xã hội, bảo đảm quốc phòng, an ninh của vùng, khu vực;\n\nb) Đường tỉnh là đường nằm trong địa bàn một tỉnh nối trung tâm hành chính của tỉnh với trung tâm hành chính của huyện; đường có vị trí quan trọng đối với sự phát triển kinh tế - xã hội của tỉnh;\n\nc) Đường huyện là đường nối trung tâm hành chính của huyện với trung tâm hành chính của xã, cụm xã hoặc trung tâm hành chính của huyện lân cận; đường có vị trí quan trọng đối với sự phát triển kinh tế - xã hội của huyện;\n\nd) Đường xã là đường nối trung tâm hành chính của xã với thôn, làng, ấp, bản, buôn, bon, phum, sóc (sau đây gọi là thôn) và điểm dân cư nông thôn hoặc đường nối với xã lân cận; đường có vị trí quan trọng đối với sự phát triển kinh tế - xã hội của xã;\n\nđ) Đường thôn là đường trong khu vực thôn, đường trục nối thôn với khu vực sản xuất nông nghiệp, lâm nghiệp và cơ sở sản xuất, kinh doanh khác trên địa bàn thôn;\n\ne) Đường đô thị là đường trong phạm vi địa giới hành chính nội thành, nội thị, bao gồm: đường cao tốc đô thị, đường phố, đường ngõ, ngách, kiệt, hẻm trong đô thị;\n\ng) Đường chuyên dùng là đường chuyên phục vụ giao thông cho một hoặc một số cơ quan, tổ chức, cá nhân và đường nội bộ.\n\n2. Đường địa phương bao gồm: đường tỉnh, đường đô thị, đường huyện, đường xã, đường thôn.\n\n3. Bộ Giao thông vận tải có trách nhiệm quản lý quốc lộ, trừ quốc lộ quy định tại điểm a khoản 4 Điều này và đường gom, đường bên quy định tại điểm c khoản 4 Điều này.\n\n4. Ủy ban nhân dân cấp tỉnh có trách nhiệm quản lý các loại đường sau đây:\n\na) Quản lý đường tỉnh, quốc lộ đi qua đô thị loại đặc biệt; quốc lộ khi được phân cấp; tuyến, đoạn tuyến quốc lộ đã hoàn thành việc đầu tư xây dựng tuyến tránh thay thế phù hợp với quy hoạch mạng lưới đường bộ; tuyến, đoạn tuyến quốc lộ không còn trong quy hoạch mạng lưới đường bộ, trừ trường hợp quốc lộ có yêu cầu đặc biệt về bảo đảm quốc phòng, an ninh; tuyến, đoạn tuyến quốc lộ được Thủ tướng Chính phủ giao trên cơ sở đề nghị của Ủy ban nhân dân cấp tỉnh để đáp ứng nhu cầu phát triển kinh tế - xã hội, bảo đảm lợi ích quốc gia, quốc phòng, an ninh, khả năng bố trí nguồn lực của địa phương; tuyến, đoạn tuyến quốc lộ đã được điều chuyển tài sản về Ủy ban nhân dân cấp tỉnh quản lý theo quy định của pháp luật về quản lý, sử dụng tài sản công;\n\nb) Quy định việc quản lý đường đô thị, đường huyện, đường xã, đường thôn;\n\nc) Quản lý đường gom, đường bên tách khỏi quốc lộ.\n\n5. Người quản lý, sử dụng đường bộ đối với đường chuyên dùng có trách nhiệm quản lý đường chuyên dùng theo quy định của Luật này và quy định khác của pháp luật có liên quan.\n\n6. Chính phủ quy định chi tiết Điều này.\n\nĐiều 9. Phân loại đường bộ theo chức năng phục vụ\n\n1. Đường chính là đường phục vụ giao thông chủ yếu trong khu vực, kết nối giao thông các khu vực, vùng.\n\n2. Đường nhánh là đường nối vào đường chính, có chức năng kết nối giao thông các khu vực hai bên đường chính; kết nối giao thông từ đường gom vào đường chính thông qua nút giao.\n\n3. Đường gom là đường để gom hệ thống đường giao thông nội bộ của các khu đô thị, công nghiệp, kinh tế, dân cư, thương mại - dịch vụ và các đường khác vào đường chính hoặc vào đường nhánh trước khi đấu nối vào đường chính. Đường gom có thể là đường bên theo quy định tại khoản 4 Điều này.\n\n4. Đường bên là đường được xây dựng bên cạnh các đoạn đường chính để ngăn cách giao thông khu vực hai bên đường với đường chính. Đường bên được tách khỏi đường chính hoặc ngăn cách với đường chính bằng dải phân cách, tường bảo vệ, rào chắn.\n\n5. Đường dành cho giao thông công cộng là đường phục vụ cho tất cả mọi người, phương tiện giao thông đường bộ theo quy định của Luật này và quy định khác của pháp luật có liên quan.\n\n6. Đường nội bộ là đường trong phạm vi khu chung cư, đô thị, công nghiệp, kinh tế, thương mại - dịch vụ, các cơ quan, tổ chức, đơn vị khác và chỉ phục vụ các đối tượng được phép vào, ra bên trong phạm vi các khu vực quy định tại khoản này.\n\n7. Đường dành riêng cho người đi bộ, người đi xe đạp và các đường khác.\n\nĐiều 10. Cấp kỹ thuật của đường bộ\n\n1. Cấp kỹ thuật của đường bộ phải được xác định trong dự án đầu tư xây dựng đường bộ. Việc thiết kế, thi công xây dựng đường bộ phải thực hiện đúng quy định về cấp kỹ thuật tuyến đường trong dự án đầu tư xây dựng đường bộ được duyệt; tuân thủ quy chuẩn, tiêu chuẩn kỹ thuật về cấp kỹ thuật của đường bộ.\n\n2. Cấp kỹ thuật của đường bộ được quy định trong các quy chuẩn, tiêu chuẩn thiết kế của đường bộ, bao gồm:\n\na) Đường cao tốc;\n\nb) Đường cấp I, II, III, IV, V, VI;\n\nc) Đường đô thị;\n\nd) Đường cấp A, B, C, D, đường khác.\n\n3. Cấp kỹ thuật của đường bộ quy định tại các điểm a, b và d khoản 2 Điều này thực hiện theo quy chuẩn kỹ thuật quốc gia do Bộ trưởng Bộ Giao thông vận tải ban hành và tiêu chuẩn kỹ thuật do cấp có thẩm quyền công bố.\n\n4. Cấp kỹ thuật của đường bộ quy định tại điểm c khoản 2 Điều này thực hiện theo quy chuẩn kỹ thuật quốc gia do Bộ trưởng Bộ Xây dựng ban hành và tiêu chuẩn kỹ thuật do cấp có thẩm quyền công bố.\n\nĐiều 11. Đặt tên, đổi tên, số hiệu đường bộ\n\n1. Việc đặt tên, số hiệu đường bộ được quy định như sau:\n\na) Tên đường bộ được đặt theo tên danh nhân, người có công với đất nước; di tích, sự kiện lịch sử, văn hóa; tên địa danh hoặc tên theo tập quán. Số hiệu đường bộ được đặt theo số tự nhiên hoặc số tự nhiên kèm theo chữ cái nếu cần thiết. Trường hợp đường đô thị trùng với đường khác thì sử dụng cả tên đường đô thị và tên, số hiệu của đường khác;', 'c) Thứ tự lắp đặt đèn tín hiệu giao thông theo chiều ngang: đèn đỏ ở phía bên trái, đèn vàng ở giữa và đèn xanh ở phía bên phải theo chiều đi;\n\nd) Hệ thống đèn tín hiệu giao thông sau khi lắp đặt xong phải được chủ đầu tư, cơ quan quản lý đường bộ tổ chức vận hành thử phù hợp với yêu cầu tổ chức giao thông trên đường bộ trước khi nghiệm thu, đưa vào khai thác.\n\n3. Nguyên tắc lắp đặt biển báo hiệu đường bộ được quy định như sau:\n\na) Mặt biển quay về hướng đối diện chiều đi;\n\nb) Được đặt về phía bên phải hoặc phía trên phần đường xe chạy. Trong một số trường hợp cụ thể có thể đặt bổ sung biển báo ở phía bên trái theo chiều đi để chỉ dẫn, báo hiệu cho người tham gia giao thông đường bộ;\n\nc) Đặt ở vị trí để người tham gia giao thông đường bộ dễ quan sát và thực hiện;\n\nd) Biển phụ được sử dụng kết hợp để thuyết minh bổ sung các loại biển báo cấm, biển báo nguy hiểm, biển hiệu lệnh và biển chỉ dẫn.\n\n4. Nguyên tắc bố trí vạch kẻ đường được quy định như sau:\n\na) Vạch kẻ đường là hình thức báo hiệu đường bộ được kẻ trên mặt đường và trên các công trình đường bộ;\n\nb) Vạch kẻ đường có thể bố trí độc lập và có thể kết hợp với các biển báo hiệu đường bộ hoặc đèn tín hiệu giao thông.\n\n5. Nguyên tắc lắp, đặt cọc tiêu, tường bảo vệ, đinh phản quang, tiêu phản quang, cột Km, cọc H, rào chắn, mốc lộ giới được quy định như sau:\n\na) Cọc tiêu được lắp đặt ở các đoạn đường nguy hiểm và vị trí cần thiết để hướng dẫn cho người tham gia giao thông đường bộ biết phần đường an toàn và hướng đi của tuyến đường;\n\nb) Đinh phản quang được lắp đặt trên mặt đường theo chiều dọc hoặc chiều ngang đường để dẫn hướng, phân làn đường;\n\nc) Tiêu phản quang được lắp đặt tại các nơi mà tuyến đường có thể gây nhầm lẫn về hướng đường để dẫn hướng xe chạy vào ban đêm hoặc trong điều kiện sương mù, điều kiện hạn chế tầm nhìn;\n\nd) Cột Km được lắp đặt bảo đảm khoảng cách giữa hai cột Km liền kề là 1.000 mét, trường hợp đặc biệt, khoảng cách giữa hai cột liền kề có chiều dài lớn hơn hoặc nhỏ hơn 1.000 mét. Cột Km được sử dụng trong quản lý, vận hành, khai thác, xây dựng, cải tạo, bảo trì đường bộ và xác định vị trí sự cố công trình, ùn tắc giao thông, tai nạn giao thông đường bộ; giúp người tham gia giao thông đường bộ xác định khoảng cách các đoạn đường;\n\nđ) Cọc H được lắp đặt trong phạm vi giữa hai cột Km liền kề và bảo đảm khoảng cách giữa 02 cọc liền kề là 100 mét;\n\ne) Mốc lộ giới là cọc mốc được đặt ở mép ngoài cùng xác định ranh giới của hành lang an toàn đường bộ theo chiều ngang đường;\n\ng) Việc lắp đặt tường bảo vệ, rào chắn thực hiện theo quy định tại khoản 3 Điều 24 của Luật này.\n\n6. Việc lắp đặt thiết bị báo hiệu đường bộ bằng âm thanh thực hiện theo hướng dẫn của nhà sản xuất.\n\n7. Việc lắp đặt, điều chỉnh, bổ sung, thay thế báo hiệu đường bộ thực hiện theo nguyên tắc quy định tại các khoản 2, 3, 4 và 5 Điều này, bảo đảm quy chuẩn kỹ thuật và quy định của pháp luật có liên quan.\n\n8. Trách nhiệm lắp đặt, điều chỉnh, bổ sung, thay thế báo hiệu đường bộ được quy định như sau:\n\na) Chủ đầu tư dự án đầu tư xây dựng công trình đường bộ có trách nhiệm tổ chức thiết kế, lắp đặt đầy đủ báo hiệu đường bộ trong phạm vi dự án đầu tư xây dựng công trình đường bộ và báo hiệu đường bộ chỉ dẫn tại các điểm đấu nối đường khác với đường bộ do mình đầu tư xây dựng;\n\nb) Người quản lý, sử dụng công trình đường bộ có trách nhiệm quản lý, sử dụng báo hiệu đường bộ; rà soát, điều chỉnh, bổ sung, thay thế báo hiệu đường bộ theo quy định của Luật này, quy định của pháp luật về trật tự, an toàn giao thông đường bộ và quy chuẩn kỹ thuật quốc gia về báo hiệu đường bộ trong phạm vi\n\nĐiều 24. Công trình an toàn giao thông đường bộ\n\nCông trình an toàn giao thông đường bộ được xây dựng, lắp đặt, bố trí để bảo đảm an toàn cho người và phương tiện tham gia giao thông đường bộ, bao gồm:\n\n1. Đường cứu nạn được xây dựng tại các đoạn đường đèo dốc, để xe mất kiểm soát khi xuống dốc có thể rời khỏi đường chính đi vào, giảm tốc độ và bảo đảm dừng lại;\n\n2. Hầm cứu nạn gắn liền với hầm đường bộ, phục vụ việc thoát hiểm, cứu hộ, cứu nạn khi hầm chính xảy ra sự cố hoặc sử dụng trong công tác bảo trì hầm đường bộ. Không sử dụng hầm cứu nạn phục vụ mục đích lưu thông của các phương tiện giao thông;\n\n3. Tường bảo vệ, rào chắn, hàng rào hộ lan được bố trí tại vị trí nguy hiểm, có tác dụng ngăn ngừa các phương tiện tham gia giao thông đường bộ lao ra khỏi phần đường xe chạy khi gặp sự cố không kiểm soát được phương tiện.\n\nTrường hợp không đồng thời bố trí cọc tiêu thì trên tường bảo vệ, hàng rào hộ lan phải được gắn tiêu phản quang hoặc sơn phản quang để cảnh báo cho người tham gia giao thông đường bộ về vị trí nguy hiểm và chỉ dẫn người tham gia giao thông đường bộ đi đúng theo hướng của phần đường xe chạy;\n\n4. Công trình chống chói được bố trí trên dải phân cách giữa, có tác dụng giảm bớt tác động, giảm bớt ánh sáng đèn của phương tiện lưu thông ngược chiều tới mắt người điều khiển phương tiện tham gia giao thông đường bộ;\n\n5. Gương cầu lồi được lắp đặt tại lưng đường cong bán kính nhỏ, các vị trí giao cắt có tầm nhìn hạn chế hoặc bị che khuất, giúp người điều khiển phương tiện tham gia giao thông đường bộ có thể quan sát được từ xa phương tiện lưu thông ngược chiều để điều chỉnh tốc độ cho phù hợp;\n\n6. Hệ thống chiếu sáng được xây dựng để chiếu sáng bảo đảm an toàn cho người, phương tiện tham gia giao thông; thời gian thắp sáng trong hầm đường bộ theo quy trình vận hành, khai thác của công trình hầm;\n\n7. Dải phân cách được lắp đặt để phân chia phần đường xe chạy thành hai chiều riêng biệt hoặc để phân chia phần đường dành cho xe cơ giới và xe thô sơ hoặc của nhiều loại xe khác nhau trên cùng một chiều đường;\n\n8. Tường chống ồn được xây dựng tại các vị trí cần thiết để giảm tiếng ồn do phương tiện giao thông đường bộ gây ra;\n\n9. Gờ, gồ giảm tốc được lắp đặt ở các vị trí cần cảnh báo hoặc bắt buộc người điều khiển phương tiện tham gia giao thông đường bộ giảm tốc độ để bảo đảm an toàn giao thông;\n\n10. Công trình khác phục vụ an toàn giao thông đường bộ.\n\nĐiều 25. Tổ chức giao thông\n\n1. Tổ chức giao thông được thực hiện từ giai đoạn quy hoạch, đầu tư, xây dựng đến giai đoạn quản lý, vận hành, khai thác, sử dụng, bảo trì kết cấu hạ tầng đường bộ nhằm bảo đảm giao thông thông suốt, an toàn, hiệu quả.\n\n2. Nội dung tổ chức giao thông đường bộ trong giai đoạn thiết kế, thi công xây dựng, quản lý, vận hành, khai thác, sử dụng, bảo trì công trình đường bộ bao gồm:\n\na) Quy định số làn đường, phần đường dành cho xe ô tô và các phương tiện tham gia giao thông đường bộ khác, phần đường dành cho người đi bộ; chiều đi, tốc độ các phương tiện cơ giới tham gia giao thông đường bộ;\n\nb) Tổ chức phân làn, phân luồng trên tuyến đường đang đầu tư xây dựng và tại các tuyến đường bộ kết nối;\n\nc) Quy định giao thông tại các nút giao, vị trí đấu nối với đường khác; quy định về tránh, vượt xe trên đường, các điểm được phép dừng xe, đỗ xe trên đường, vị trí đón, trả khách;\n\nd) Quy định khổ giới hạn và tải trọng cho phép phương tiện tham gia giao thông đường bộ an toàn;\n\nđ) Quy định thời gian cho phép tham gia giao thông; thời gian cho phép đi theo các hướng của đèn tín hiệu giao thông;\n\ne) Quy định thời gian bật, tắt hệ thống chiếu sáng trên đường;\n\ng) Quy định về các trường hợp tạm dừng khai thác một phần hoặc toàn bộ tuyến đường;\n\nh) Khai thác, sử dụng hệ thống quản lý giao thông thông minh, trung tâm quản lý, điều hành giao thông tuyến đường cao tốc và các thiết bị công nghệ khác phục vụ cung cấp thông tin, chỉ dẫn cho người tham gia giao thông đường bộ;\n\ni) Lắp đặt đầy đủ hệ thống báo hiệu đường bộ và thực hiện các công việc cần thiết khác;\n\nk) Phê duyệt phương án tổ chức giao thông đối với đường cao tốc.\n\n3. Chủ đầu tư dự án đầu tư xây dựng công trình đường bộ, người quản lý, sử dụng đường bộ, tổ chức, cá nhân liên quan có trách nhiệm lắp đặt, điều chỉnh, bổ sung đầy đủ báo hiệu đường bộ, công trình an toàn giao thông đường bộ đối với dự án và tuyến đường thuộc phạm vi quản lý; thực hiện phương án tổ chức giao thông đường cao tốc được phê duyệt.', '2. Việc xây dựng công trình hạ tầng kỹ thuật sử dụng chung với đường bộ phải đáp ứng các yêu cầu sau đây:\n\na) Phù hợp với quy hoạch, quy mô của dự án, cấp kỹ thuật của đường bộ;\n\nb) Bảo đảm quy chuẩn, tiêu chuẩn kỹ thuật trong xây dựng; bảo đảm quy định của pháp luật về phòng cháy, chữa cháy và cứu nạn, cứu hộ; bảo đảm an toàn công trình, bảo đảm cảnh quan và môi trường;\n\nc) Tuân thủ quy định của Luật này, quy định của pháp luật về xây dựng và quy định khác của pháp luật có liên quan.\n\n3. Xây dựng công trình hạ tầng kỹ thuật sử dụng chung với đường bộ được thực hiện đối với các trường hợp sau đây:\n\na) Đầu tư xây dựng đường đô thị phải kết hợp với bố trí, xây dựng công trình hạ tầng kỹ thuật sử dụng chung để bảo đảm tính đồng bộ nhằm tiết kiệm tài nguyên đất, tiết kiệm chi phí đầu tư, xây dựng, bảo đảm cảnh quan và môi trường, nâng cao hiệu quả khai thác các công trình và bảo đảm trật tự, an toàn giao thông đường bộ trong giai đoạn vận hành, khai thác, sử dụng đường đô thị;\n\nb) Đầu tư xây dựng cầu đường bộ phải thiết kế, bố trí vị trí để lắp đặt đường dây thông tin, viễn thông, đường ống cấp nước, đường dây tải điện, dây dẫn điện, trừ dây dẫn điện cao thế và dây dẫn điện không có bộ phận cách điện;\n\nc) Đầu tư xây dựng hầm đường bộ phải thiết kế, lắp đặt cống cáp, hào hoặc tuy nen kỹ thuật để bố trí, lắp đặt hệ thống phòng cháy, chữa cháy, đường ống cấp nước, thoát nước và các công trình quy định tại điểm b khoản này;\n\nd) Trường hợp cần thiết khác.\n\n4. Việc quản lý, vận hành, khai thác, bảo trì công trình hạ tầng kỹ thuật sử dụng chung với đường bộ phải bảo đảm các quy định sau đây:\n\na) Không ảnh hưởng đến an toàn công trình đường bộ, an toàn giao thông đường bộ; không cản trở công tác bảo trì công trình đường bộ;\n\nb) Bảo đảm quy định tại điểm b và điểm c khoản 2 Điều này;\n\nc) Thực hiện di dời, tháo dỡ công trình hạ tầng kỹ thuật sử dụng chung, công trình lắp đặt trong công trình hạ tầng kỹ thuật sử dụng chung khi có yêu cầu của người quản lý, sử dụng công trình đường bộ để đầu tư, xây dựng, nâng cấp, mở rộng và bảo trì công trình đường bộ; thực hiện biện pháp nhằm bảo đảm an toàn cho công trình đường bộ, an toàn phòng, chống cháy, nổ; tổ chức giao thông và các trường hợp cần thiết khác;\n\nd) Người quản lý, sử dụng công trình hạ tầng kỹ thuật sử dụng chung với đường bộ, người quản lý, sử dụng công trình đường bộ có trách nhiệm phối hợp trong quản lý, vận hành, khai thác và bảo trì các công trình để bảo đảm an toàn trong khai thác, sử dụng các công trình, bảo đảm chất lượng, thời hạn khai thác, sử dụng công trình theo quy định của pháp luật;\n\nđ) Tổ chức, cá nhân quy định tại điểm d khoản này, trừ trường hợp phục vụ nhiệm vụ quốc phòng, an ninh, có trách nhiệm đóng góp chi phí để thực hiện vận hành, khai thác, bảo trì công trình hạ tầng kỹ thuật sử dụng chung với đường bộ.\n\n5. Chính phủ quy định chi tiết Điều này.\n\nĐiều 21. Bảo vệ kết cấu hạ tầng đường bộ\n\n1. Bảo vệ kết cấu hạ tầng đường bộ bao gồm:\n\na) Hoạt động bảo đảm an toàn kết cấu hạ tầng đường bộ;\n\nb) Thực hiện các biện pháp phòng ngừa, ngăn chặn, xử lý hành vi hủy hoại, lấn, chiếm, sử dụng trái phép kết cấu hạ tầng đường bộ, đấu nối trái phép vào đường bộ và các hành vi vi phạm pháp luật khác trong phạm vi bảo vệ kết cấu hạ tầng đường bộ.\n\n2. Phạm vi bảo vệ kết cấu hạ tầng đường bộ là giới hạn trên mặt đất, trên mặt nước, trên không và phần dưới mặt đất, dưới mặt nước của kết cấu hạ tầng đường bộ.\n\n3. Trách nhiệm bảo vệ kết cấu hạ tầng đường bộ quy định như sau:\n\na) Bộ Giao thông vận tải tổ chức thực hiện bảo vệ kết cấu hạ tầng đường bộ thuộc phạm vi quản lý, trừ quy định tại điểm b khoản này;\n\nb) Ủy ban nhân dân các cấp tổ chức thực hiện bảo vệ kết cấu hạ tầng đường bộ thuộc phạm vi quản lý; phối hợp với người quản lý, sử dụng đường bộ để tuyên truyền, phổ biến pháp luật về bảo vệ kết cấu hạ tầng đường bộ; công bố công khai mốc lộ giới sử dụng đất trong hành lang an toàn đường bộ; kịp thời xử lý trường hợp lấn, chiếm, sử dụng trái phép hành lang an toàn đường bộ, đất của đường bộ;\n\nc) Người quản lý, sử dụng đường bộ có trách nhiệm bảo vệ kết cấu hạ tầng đường bộ thuộc phạm vi quản lý; trường hợp phát hiện công trình bị hư hỏng, nguy cơ gây ra sự cố công trình, nguy cơ mất an toàn giao thông đường bộ thì phải xử lý, sửa chữa, khắc phục kịp thời; công khai về mốc lộ giới hành lang an toàn đường bộ theo quy định tại điểm c khoản 3 Điều 15 của Luật này, báo cáo và yêu cầu Ủy ban nhân dân cấp xã nơi có hành lang an toàn đường bộ bị lấn, chiếm, sử dụng trái phép để xử lý; thực hiện các công việc khác về quản lý, bảo vệ hành lang an toàn đường bộ theo quy định của Luật này, Luật Đất đai và quy định khác của pháp luật có liên quan.\n\n4. Tổ chức, cá nhân phát hiện công trình đường bộ bị hư hỏng hoặc bị xâm hại, hành lang an toàn đường bộ bị lấn chiếm phải kịp thời thông báo cho Ủy ban nhân dân cấp xã, cơ quan quản lý đường bộ hoặc cơ quan công an nơi gần nhất để xử lý; trường hợp cần thiết có biện pháp báo hiệu ngay cho người tham gia giao thông đường bộ biết. Khi nhận được tin báo, cơ quan có trách nhiệm phải nhanh chóng thực hiện các biện pháp khắc phục để bảo đảm giao thông thông suốt, an toàn.\n\n5. Chính phủ quy định chi tiết Điều này.\n\nMục 3. CÔNG TRÌNH PHỤ TRỢ GẮN LIỀN VỚI ĐƯỜNG BỘ; PHƯƠNG TIỆN, THIẾT BỊ PHỤC VỤ QUẢN LÝ, VẬN HÀNH, KHAI THÁC ĐƯỜNG BỘ VÀ TỔ CHỨC GIAO THÔNG\n\nĐiều 22. Công trình phụ trợ gắn liền với đường bộ; phương tiện, thiết bị phục vụ quản lý, vận hành, khai thác đường bộ\n\n1. Công trình phụ trợ gắn liền với đường bộ bao gồm:\n\na) Báo hiệu đường bộ, trừ hiệu lệnh của người điều khiển giao thông;\n\nb) Công trình an toàn giao thông đường bộ;\n\nc) Hệ thống thoát nước đường bộ;\n\nd) Tường chắn, kè bảo vệ đường bộ;\n\nđ) Cọc mốc giải phóng mặt bằng;\n\ne) Công trình, bộ phận công trình, thiết bị lắp đặt vào công trình thuộc hệ thống quản lý giao thông thông minh; hệ thống thu thập xử lý và lưu giữ dữ liệu kết cấu hạ tầng đường bộ; hệ thống theo dõi tình trạng kỹ thuật và quan trắc đường, cầu đường bộ và công trình phụ trợ khác.\n\n2. Phương tiện, thiết bị phục vụ quản lý, vận hành, khai thác công trình đường bộ bao gồm:\n\na) Thiết bị lắp đặt vào các công trình, bộ phận công trình quy định tại điểm e khoản 1 Điều này;\n\nb) Phương tiện, thiết bị phục vụ công tác phòng, chống, khắc phục hậu quả thiên tai và tìm kiếm cứu nạn đường bộ; phương tiện, thiết bị phục vụ cứu nạn, cứu hộ giao thông đường bộ;\n\nc) Phà, phương tiện, thiết bị khác phục vụ quản lý, vận hành, khai thác bến phà đường bộ;\n\nd) Phương tiện, thiết bị khác phục vụ quản lý, vận hành, khai thác đường bộ.\n\n3. Đường bộ đang khai thác phải được điều chỉnh, bổ sung công trình phụ trợ, phương tiện, thiết bị quy định tại khoản 1 và khoản 2 Điều này để việc quản lý, vận hành, khai thác, sử dụng công trình đường bộ bảo đảm an toàn giao thông đường bộ, an toàn công trình.\n\nĐiều 23. Lắp đặt báo hiệu đường bộ\n\n1. Báo hiệu đường bộ được lắp đặt bao gồm:\n\na) Đèn tín hiệu giao thông;\n\nb) Biển báo hiệu đường bộ gồm: biển báo cấm, biển báo nguy hiểm, biển hiệu lệnh, biển chỉ dẫn, biển phụ;\n\nc) Vạch kẻ đường và các dấu hiệu khác trên mặt đường (gọi chung là vạch kẻ đường);\n\nd) Cọc tiêu, đinh phản quang, tiêu phản quang, cột Km, cọc H, mốc lộ giới;\n\nđ) Tường bảo vệ và rào chắn;\n\ne) Thiết bị âm thanh báo hiệu đường bộ.\n\n2. Nguyên tắc lắp đặt đèn tín hiệu giao thông được quy định như sau:\n\na) Mặt đèn quay về hướng đối diện chiều đi và phải đặt ở vị trí để người tham gia giao thông đường bộ dễ quan sát;\n\nb) Thứ tự lắp đặt đèn tín hiệu giao thông theo chiều thẳng đứng: đèn đỏ ở trên, đèn vàng ở giữa và đèn xanh ở dưới;\n\nc) Thứ tự lắp đặt đèn tín hiệu giao thông theo chiều ngang: đèn đỏ ở phía bên trái, đèn vàng ở giữa và đèn xanh ở phía bên phải theo chiều đi;\n\nd) Hệ thống đèn tín hiệu giao thông sau khi lắp đặt xong phải được chủ đầu tư, cơ quan quản lý đường bộ tổ chức vận hành thử phù hợp với yêu cầu tổ chức giao thông trên đường bộ trước khi nghiệm thu, đưa vào khai thác.\n\n3. Nguyên tắc lắp đặt biển báo hiệu đường bộ được quy định như sau:']","Không tìm thấy thông tin liên quan tới câu hỏi này.
",Cấm sử dụng đèn pha trong khu vực đô thị để tránh gây chói mắt cho người tham gia giao thông khác.,0.0,0.0,0.0,0.0
17,Quy định mới về việc đỗ xe trên vỉa hè là gì?,"['BỘ GIAO THÔNG VẬN TẢI\n------- CỘNG HÒA XÃ HỘI CHỦ NGHĨA VIỆT NAM\nĐộc lập - Tự do - Hạnh phúc \n--------------- Số: 58/2024/TT-BGTVT Hà Nội, ngày 15 tháng 11 năm 2024\n\nTHÔNG TƯ\n\nQUY ĐỊNH VỀ ĐẦU TƯ ĐIỂM DỪNG XE, ĐỖ XE VÀ VỊ TRÍ, QUY MÔ TRẠM DỪNG NGHỈ, ĐIỂM DỪNG XE, ĐỖ XE TRÊN ĐƯỜNG CAO TỐC\n\nCăn cứ Luật Đường bộ ngày 27 tháng 6 năm 2024;\n\nCăn cứ Nghị định số 56/2022/NĐ-CP ngày 24 tháng 8 năm 2022 của Chính phủ quy định chức năng, nhiệm vụ, quyền hạn và cơ cấu tổ chức của Bộ Giao thông vận tải;\n\nTheo đề nghị của Cục trưởng Cục Đường cao tốc Việt Nam;\n\nBộ trưởng Bộ Giao thông vận tải ban hành Thông tư quy định về đầu tư điểm dừng xe, đỗ xe và vị trí, quy mô trạm dừng nghỉ, điểm dừng xe, đỗ xe trên đường cao tốc.\n\nĐiều 1. Phạm vi điều chỉnh\n\nThông tư này quy định chi tiết khoản 3 và khoản 4 Điều 52 Luật Đường bộ, bao gồm:\n\n1. Xem xét quyết định việc đầu tư điểm dừng xe, đỗ xe trên đường cao tốc;\n\n2. Vị trí, quy mô trạm dừng nghỉ, điểm dừng xe, đỗ xe trên đường cao tốc.\n\nĐiều 2. Đối tượng áp dụng\n\nThông tư này áp dụng đối với tổ chức, cá nhân có liên quan đến quyết định đầu tư điểm dừng xe, đỗ xe và xác định vị trí, quy mô trạm dừng nghỉ, điểm dừng xe, đỗ xe trên đường cao tốc.\n\nĐiều 3. Đầu tư điểm dừng xe, đỗ xe\n\n1. Trong quá trình lập báo cáo nghiên cứu khả thi, căn cứ nhu cầu sử dụng dịch vụ, tính chất dự án, đơn vị chuẩn bị dự án nghiên cứu, đề xuất việc đầu tư điểm dừng xe, đỗ xe tại địa điểm:\n\na) Có cảnh quan thiên nhiên hoặc danh lam thắng cảnh, di tích lịch sử - văn hóa nhằm phát triển du lịch, quảng bá văn hóa địa phương;\n\nb) Có đường ra, vào thuận tiện, không che khuất tầm nhìn, phù hợp với tính chất, điều kiện địa hình, địa chất, thủy văn của công trình dự án, bảo đảm an toàn khi khai thác.\n\n\n\n2. Cơ quan quyết định đầu tư dự án đối với dự án đầu tư công hoặc cơ quan phê duyệt dự án đối với dự án đầu tư theo phương thức đối tác công tư quyết định đầu tư điểm dừng xe, đỗ xe căn cứ nghiên cứu, đề xuất của đơn vị chuẩn bị dự án tại khoản 1 Điều này.\n\nĐiều 4. Vị trí, quy mô điểm dừng xe, đỗ xe\n\n1. Điểm dừng xe, đỗ xe được xây dựng ngoài phạm vi hành lang an toàn đường bộ.\n\n2. Điểm dừng, đỗ xe có quy mô diện tích tối thiểu 500 m2 không bao gồm đường ra vào.\n\nĐiều 5. Các hạng mục công trình thuộc điểm dừng xe, đỗ xe\n\n1. Điểm dừng, đỗ xe bao gồm các hạng mục sau:\n\na) Đường ra, vào;\n\nb) Mặt bằng khu vực dừng xe, đỗ xe;\n\nc) Nơi cung cấp thông tin, bản đồ du lịch hoặc các thiết bị nghe, nhìn khác phục vụ cung cấp thông tin cho người tham gia giao thông hoặc quảng bá du lịch địa phương.\n\n2. Yêu cầu thiết kế các hạng mục tại khoản 1 Điều này như sau:\n\na) Đường ra, vào tuân thủ quy định về đường nhánh ra, vào trên đường cao tốc theo Quy chuẩn kỹ thuật quốc gia về đường bộ cao tốc;\n\nb) Kết cấu mặt bằng khu vực dừng xe, đỗ xe và nơi cung cấp thông tin là mặt đường bê tông xi măng có chiều dày tối thiểu 20 cm hoặc bê tông nhựa có chiều dày tối thiểu 7 cm;\n\nc) Đường lưu thông trong mặt bằng khu vực dừng xe, đỗ xe phải có các biển báo hiệu, vạch kẻ đường; có bán kính quay xe tối thiểu 10 m tính theo tim đường, đảm bảo cho các loại phương tiện lưu thông an toàn trong khu vực điểm dừng xe, đỗ xe;\n\nd) Có biện pháp thoát nước phù hợp.\n\nĐiều 6. Vị trí, quy mô trạm dừng nghỉ\n\n1. Trạm dừng nghỉ được xây dựng ngoài phạm vi hành lang an toàn đường bộ theo quy định tại điểm d khoản 1 Điều 39 Luật Đường bộ.\n\n2. Trong quá trình lập báo cáo nghiên cứu khả thi, đơn vị chuẩn bị dự án nghiên cứu, đề xuất vị trí, quy mô trạm dừng nghỉ căn cứ:\n\na) Quy chuẩn kỹ thuật quốc gia về trạm dừng nghỉ, quy chuẩn kỹ thuật quốc\n\ngia về đường bộ cao tốc;\n\n\n\nc) Hình thức đầu tư, khả năng cân đối nguồn lực đầu tư;\n\nd) Điều kiện địa hình, địa chất và tính chất của công trình dự án.\n\nĐiều 7. Hiệu lực thi hành\n\n1. Thông tư này có hiệu lực thi hành kể từ ngày 01 tháng 01 năm 2025.\n\n2. Đối với các trạm dừng nghỉ đã được phê duyệt và quyết định vị trí, quy mô trước ngày Thông tư này có hiệu lực thi hành thì tiếp tục thực hiện theo nội dung đã được phê duyệt./.\n\nNơi nhận:\n- Bộ trưởng (để b/c);\n- Các Thứ trưởng Bộ Giao thông vận tải;\n- Văn phòng Chính phủ;\n- Các bộ, cơ quan ngang bộ, cơ quan thuộc Chính phủ;\n- UBND các tỉnh, thành phố trực thuộc trung ương;\n- Cục Kiểm tra văn bản QPPL (Bộ Tư pháp);\n- Công báo;\n- Cổng thông tin điện tử Chính phủ;\n- Cổng thông tin điện tử Bộ GTVT;\n- Báo Giao thông, Tạp chí GTVT;\n- Lưu: VT, CĐTVN. KT. BỘ TRƯỞNG \nTHỨ TRƯỞNG\n\n\n\n\nNguyễn Duy Lâm', '6. Trường hợp tước quyền sử dụng giấy phép lái xe tích hợp giấy phép lái xe không thời hạn (xe mô tô, xe tương tự xe mô tô) và giấy phép lái xe có thời hạn (xe ô tô, xe tương tự xe ô tô, xe chở người bốn bánh có gắn động cơ, xe chở hàng bốn bánh có gắn động cơ) thì người có thẩm quyền xử phạt áp dụng tước quyền sử dụng đối với giấy phép lái xe không thời hạn khi người điều khiển xe mô tô, xe tương tự xe mô tô hoặc tước quyền sử dụng đối với giấy phép lái xe có thời hạn khi người điều khiển xe ô tô, xe tương tự xe ô tô, xe chở người bốn bánh có gắn động cơ, xe chở hàng bốn bánh có gắn động cơ thực hiện hành vi vi phạm hành chính có quy định bị tước quyền sử dụng giấy phép lái xe. Trong thời gian bị tước quyền sử dụng, người có giấy phép lái xe tích hợp được cấp, đổi giấy phép lái xe đối với giấy phép lái xe không bị tước quyền sử dụng.\n\n7. Trường hợp giấy phép, chứng chỉ hành nghề được cấp dưới dạng điện tử hoặc thể hiện dưới hình thức thông điệp dữ liệu thì cơ quan, người có thẩm quyền thực hiện tạm giữ, tước trên môi trường điện tử theo quy định nếu đáp ứng điều kiện về cơ sở hạ tầng, kỹ thuật, thông tin. Việc tạm giữ, tước quyền sử dụng được cập nhật trạng thái trên cơ sở dữ liệu, căn cước điện tử, tài khoản định danh điện tử và ứng dụng thông tin điện tử khác theo quy định.\n\nChương II\n\nHÀNH VI VI PHẠM, HÌNH THỨC, MỨC XỬ PHẠT, MỨC TRỪ ĐIỂM GIẤY PHÉP LÁI XE VÀ BIỆN PHÁP KHẮC PHỤC HẬU QUẢ VI PHẠM HÀNH CHÍNH VỀ TRẬT TỰ, AN TOÀN GIAO THÔNG TRONG LĨNH VỰC GIAO THÔNG ĐƯỜNG BỘ\n\nMục 1. VI PHẠM QUY TẮC GIAO THÔNG ĐƯỜNG BỘ\n\nĐiều 6. Xử phạt, trừ điểm giấy phép lái xe của người điều khiển xe ô tô, xe chở người bốn bánh có gắn động cơ, xe chở hàng bốn bánh có gắn động cơ và các loại xe tương tự xe ô tô vi phạm quy tắc giao thông đường bộ\n\n1. Phạt tiền từ 400.000 đồng đến 600.000 đồng đối với người điều khiển xe thực hiện một trong các hành vi vi phạm sau đây:\n\na) Không chấp hành hiệu lệnh, chỉ dẫn của biển báo hiệu, vạch kẻ đường, trừ các hành vi vi phạm quy định tại điểm a, điểm c, điểm d, điểm đ khoản 2; điểm a, điểm d, điểm đ, điểm e, điểm n, điểm o khoản 3; điểm a, điểm b, điểm đ, điểm e, điểm i, điểm k, điểm l khoản 4; điểm a, điểm b, điểm c, điểm d, điểm đ, điểm i, điểm k khoản 5; điểm a khoản 6; khoản 7; điểm b, điểm d khoản 9; điểm a khoản 10; điểm đ khoản 11 Điều này;\n\nb) Khi ra, vào vị trí dừng xe, đỗ xe không có tín hiệu báo cho người điều khiển phương tiện khác biết;\n\nc) Không báo hiệu bằng đèn khẩn cấp hoặc không đặt biển cảnh báo “Chú ý xe đỗ” theo quy định trong trường hợp gặp sự cố kỹ thuật (hoặc bất khả kháng khác) buộc phải đỗ xe chiếm một phần đường xe chạy hoặc tại nơi không được phép đỗ xe, trừ hành vi vi phạm quy định tại điểm c khoản 7 Điều này;\n\nd) Không gắn biển báo hiệu ở phía trước xe kéo, phía sau xe được kéo; điều khiển xe kéo rơ moóc không có biển báo hiệu theo quy định;\n\nđ) Sử dụng còi trong thời gian từ 22 giờ ngày hôm trước đến 05 giờ ngày hôm sau trong khu đông dân cư, khu vực cơ sở khám bệnh, chữa bệnh, trừ các xe ưu tiên đang đi làm nhiệm vụ theo quy định.\n\n2. Phạt tiền từ 600.000 đồng đến 800.000 đồng đối với người điều khiển xe thực hiện một trong các hành vi vi phạm sau đây:\n\na) Chuyển làn đường không đúng nơi cho phép hoặc không có tín hiệu báo trước hoặc chuyển làn đường không đúng quy định “mỗi lần chuyển làn đường chỉ được phép chuyển sang một làn đường liền kề”, trừ các hành vi vi phạm quy định tại điểm g khoản 5 Điều này;\n\nb) Chở người trên buồng lái quá số lượng quy định;\n\nc) Không tuân thủ các quy định về nhường đường tại nơi đường bộ giao nhau, trừ các hành vi vi phạm quy định tại điểm n, điểm o khoản 5 Điều này;\n\nd) Dừng xe, đỗ xe trên phần đường xe chạy ở đoạn đường ngoài đô thị nơi có lề đường rộng; dừng xe, đỗ xe không sát mép đường phía bên phải theo chiều đi ở nơi đường có lề đường hẹp hoặc không có lề đường; dừng xe, đỗ xe ngược với chiều lưu thông của làn đường; dừng xe, đỗ xe trên dải phân cách cố định ở giữa hai phần đường xe chạy; đỗ xe trên dốc không chèn bánh;\n\nđ) Dừng xe không sát theo lề đường, vỉa hè phía bên phải theo chiều đi hoặc bánh xe gần nhất cách lề đường, vỉa hè quá 0,25 mét; dừng xe trên đường dành riêng cho xe buýt; dừng xe trên miệng cống thoát nước, miệng hầm của đường điện thoại, điện cao thế, chỗ dành riêng cho xe chữa cháy lấy nước; rời vị trí lái, tắt máy khi dừng xe (trừ trường hợp rời khỏi vị trí lái để đóng, mở cửa xe, xếp dỡ hàng hóa, kiểm tra kỹ thuật xe) hoặc rời vị trí lái khi dừng xe nhưng không sử dụng phanh đỗ xe (hoặc thực hiện biện pháp an toàn khác); dừng xe, đỗ xe không đúng vị trí quy định ở những đoạn có bố trí nơi dừng xe, đỗ xe; dừng xe, đỗ xe trên phần đường dành cho người đi bộ qua đường; dừng xe nơi có biển “Cấm dừng xe và đỗ xe”, trừ hành vi vi phạm quy định tại điểm đ khoản 4, điểm c khoản 7 Điều này.\n\n3. Phạt tiền từ 800.000 đồng đến 1.000.000 đồng đối với người điều khiển xe thực hiện một trong các hành vi vi phạm sau đây:\n\na) Điều khiển xe chạy quá tốc độ quy định từ 05 km/h đến dưới 10 km/h;\n\nb) Sử dụng còi, rú ga liên tục; sử dụng còi hơi, sử dụng đèn chiếu xa khi gặp người đi bộ qua đường hoặc khi đi trên đoạn đường qua khu dân cư có hệ thống chiếu sáng đang hoạt động hoặc khi gặp xe đi ngược chiều (trừ trường hợp dải phân cách có khả năng chống chói) hoặc khi chuyển hướng xe tại nơi đường giao nhau, trừ các xe ưu tiên đang đi làm nhiệm vụ theo quy định;\n\nc) Chuyển hướng không quan sát hoặc không bảo đảm khoảng cách an toàn với xe phía sau hoặc không giảm tốc độ hoặc không có tín hiệu báo hướng rẽ hoặc có tín hiệu báo hướng rẽ nhưng không sử dụng liên tục trong quá trình chuyển hướng (trừ trường hợp điều khiển xe đi theo hướng cong của đoạn đường bộ ở nơi đường không giao nhau cùng mức);\n\nd) Không tuân thủ các quy định về dừng xe, đỗ xe tại nơi đường bộ giao nhau cùng mức với đường sắt; dừng xe, đỗ xe trong phạm vi bảo vệ công trình đường sắt, phạm vi an toàn của đường sắt;\n\nđ) Dừng xe, đỗ xe tại vị trí: nơi đường bộ giao nhau hoặc trong phạm vi 05 mét tính từ mép đường giao nhau; điểm đón, trả khách; trước cổng hoặc trong phạm vi 05 mét hai bên cổng trụ sở cơ quan, tổ chức có bố trí đường cho xe ra, vào; nơi phần đường có bề rộng chỉ đủ cho một làn xe cơ giới; che khuất biển báo hiệu đường bộ, đèn tín hiệu giao thông; nơi mở dải phân cách giữa; cách xe ô tô đang đỗ ngược chiều dưới 20 mét trên đường phố hẹp, dưới 40 mét trên đường có một làn xe cơ giới trên một chiều đường;\n\ne) Đỗ xe không sát theo lề đường, vỉa hè phía bên phải theo chiều đi hoặc bánh xe gần nhất cách lề đường, vỉa hè quá 0,25 mét; đỗ xe trên đường dành riêng cho xe buýt; đỗ xe trên miệng cống thoát nước, miệng hầm của đường điện thoại, điện cao thế, chỗ dành riêng cho xe chữa cháy lấy nước; đỗ, để xe ở vỉa hè trái quy định của pháp luật; đỗ xe nơi có biển “Cấm đỗ xe” hoặc biển “Cấm dừng xe và đỗ xe”, trừ hành vi vi phạm quy định tại điểm đ khoản 4, điểm c khoản 7 Điều này;\n\ng) Không sử dụng hoặc sử dụng không đủ đèn chiếu sáng trong thời gian từ 18 giờ ngày hôm trước đến 06 giờ ngày hôm sau hoặc khi có sương mù, khói, bụi, trời mưa, thời tiết xấu làm hạn chế tầm nhìn;\n\nh) Điều khiển xe ô tô kéo theo xe khác, vật khác (trừ trường hợp kéo theo một rơ moóc, sơ mi rơ moóc hoặc một xe ô tô, xe máy chuyên dùng khác khi xe này không tự chạy được); điều khiển xe ô tô đẩy xe khác, vật khác; điều khiển xe kéo rơ moóc, sơ mi rơ moóc kéo thêm rơ moóc hoặc xe khác, vật khác; không nối chắc chắn, an toàn giữa xe kéo và xe được kéo khi kéo nhau;\n\ni) Chở người trên xe được kéo, trừ người điều khiển;\n\nk) Không thắt dây đai an toàn khi điều khiển xe chạy trên đường;\n\nl) Chở người trên xe ô tô không thắt dây đai an toàn (tại vị trí có trang bị dây đai an toàn) khi xe đang chạy;\n\nm) Chở trẻ em dưới 10 tuổi và chiều cao dưới 1,35 mét trên xe ô tô ngồi cùng hàng ghế với người lái xe (trừ loại xe ô tô chỉ có một hàng ghế) hoặc không sử dụng thiết bị an toàn phù hợp cho trẻ em theo quy định;\n\nn) Chạy trong hầm đường bộ không sử dụng đèn chiếu sáng gần;', 'Điều 43. Quy định về hoạt động của bãi đỗ xe, điểm dừng xe\n\n1. Yêu cầu đối với bãi đỗ xe\n\na) Đảm bảo an ninh, trật tự; đáp ứng yêu cầu về phòng, chống cháy, nổ và vệ sinh môi trường;\n\nb) Đường ra, vào bãi đỗ xe phải được bố trí đảm bảo an toàn và không gây ùn tắc giao thông.\n\n2. Nội dung kinh doanh tại bãi đỗ xe \n\na) Dịch vụ trông giữ phương tiện;\n\nb) Tổ chức các dịch vụ bảo dưỡng, sửa chữa phương tiện;\n\nc) Kinh doanh các dịch vụ khác theo quy định của pháp luật.\n\n3. Quy định đối với đơn vị quản lý, kinh doanh bãi đỗ xe\n\na) Đảm bảo an ninh, trật tự, vệ sinh môi trường và phòng, chống cháy, nổ tại bãi đỗ xe;\n\nb) Niêm yết công khai nội quy, giá các dịch vụ tại bãi đỗ xe, tên và số điện thoại cơ quan quản lý nhà nước có thẩm quyền để chủ xe phản ánh, khiếu nại khi cần thiết;\n\nc) Bồi thường thiệt hại cho người gửi xe nếu để xảy ra mất mát, hư hỏng phương tiện nhận gửi;\n\nd) Chịu sự kiểm tra, giám sát của các cơ quan nhà nước có thẩm quyền;\n\nđ) Kinh doanh các loại dịch vụ quy định tại khoản 2 Điều này;\n\ne) Không được để các chủ phương tiện kinh doanh vận tải sử dụng bãi đỗ xe để đón, trả khách hoặc xếp dỡ hàng hóa, đóng gói, sang tải và bảo quản hàng hóa;\n\ng) Có quyền từ chối phục vụ đối với chủ phương tiện không chấp hành nội quy bãi đỗ xe.\n\n4. Trách nhiệm, quyền hạn của chủ phương tiện hoặc người lái xe tại bãi đỗ xe\n\na) Chấp hành nội quy và sự hướng dẫn của nhân viên điều hành bãi đỗ xe;\n\nb) Sử dụng các dịch vụ tại bãi đỗ xe;\n\nc) Có quyền phản ánh, kiến nghị đến các cơ quan có thẩm quyền về các hành vi vi phạm của bãi đỗ xe.\n\n5. Quy định về điểm dừng xe\n\na) Việc tổ chức điểm dừng xe trên đường bộ phải phù hợp với quy định của pháp luật về trật tự, an toàn giao thông đường bộ và được bố trí tại các vị trí thuận tiện cho người lên, xuống xe;\n\nb) Người điều khiển phương tiện tham gia giao thông đường bộ khi dừng xe tại điểm dừng xe phải chấp hành đúng quy định tại Điều 18 Luật Trật tự an toàn giao thông đường bộ.\n\nChương V\n\nTRÁCH NHIỆM CỦA CÁC CƠ QUAN QUẢN LÝ NHÀ NƯỚC\n\nĐiều 44. Cục Đường bộ Việt Nam\n\n1. Quản lý hoạt động vận tải bằng xe ô tô trong phạm vi cả nước.\n\n2. Thực hiện trách nhiệm theo quy định tại khoản 2 Điều 10, khoản 5 Điều 37, điểm d khoản 2 và điểm c khoản 3 Điều 46 của Thông tư này.\n\n3. Ứng dụng công nghệ thông tin trong quản lý hoạt động vận tải và dịch vụ hỗ trợ vận tải đường bộ, tổ chức triển khai áp dụng thống nhất trong toàn quốc.\n\n4. Xây dựng quy trình điện tử của dịch vụ công trực tuyến đối với các thủ tục cấp, cấp đổi Giấy phép kinh doanh vận tải bằng xe ô tô, phù hiệu, biển hiệu, thủ tục đăng ký khai thác tuyến vận tải khách cố định để áp dụng trong toàn quốc.\n\n5. Rà soát và thực hiện cắm biển hạn chế tốc độ đối với xe khách có giường nằm hai tầng tại các vị trí cần thiết, đặc biệt là khu vực có địa hình đèo, dốc, tại các vị trí có bán kính đường cong nhỏ trên các tuyến quốc lộ thuộc phạm vi quản lý.\n\n6. Thanh tra, kiểm tra và xử lý theo thẩm quyền các hành vi vi phạm quy định về tổ chức quản lý vận tải.\n\n7. Chủ trì, phối hợp với các cơ quan có liên quan chỉ đạo, đôn đốc, theo dõi thực hiện Thông tư này.\n\nĐiều 45. Sở Giao thông vận tải\n\n1. Quản lý hoạt động vận tải bằng xe ô tô và dịch vụ hỗ trợ vận tải đường bộ trên địa bàn địa phương và theo thẩm quyền.\n\n2. Báo cáo Cục Đường bộ Việt Nam về hoạt động vận tải bằng xe ô tô và dịch vụ hỗ trợ vận tải đường bộ trên địa bàn địa phương.\n\n3. Tiếp nhận, tổng hợp, phân tích, khai thác sử dụng các thông tin từ thiết bị giám sát hành trình của xe do đơn vị kinh doanh vận tải (hoặc tổ chức được ủy quyền) cung cấp và từ cơ sở dữ liệu của Cục Cảnh sát giao thông để phục vụ công tác quản lý nhà nước về giao thông vận tải.\n\n4. Xây dựng cơ sở dữ liệu, lập trang thông tin điện tử về quản lý hoạt động vận tải bằng xe ô tô của địa phương. Tổ chức thực hiện dịch vụ công trực tuyến để giải quyết các thủ tục hành chính về hoạt động vận tải bằng xe ô tô và dịch vụ hỗ trợ vận tải đường bộ theo quy định.\n\n5. Khai thác, sử dụng dữ liệu trên phần mềm quản lý bến xe khách của các bến xe để phục vụ công tác quản lý bến xe, thanh tra, kiểm tra hoạt động của các bến xe khách trên địa bàn và người lái xe kinh doanh vận tải trên địa bàn địa phương.\n\n6. Quản lý hoạt động vận tải hành khách đối với xe khách có giường nằm hai tầng\n\na) Kiểm tra, giám sát đối với các đơn vị có sử dụng xe khách có giường nằm hai tầng;\n\nb) Rà soát và thực hiện cắm biển hạn chế tốc độ đối với xe khách có giường nằm hai tầng tại các vị trí cần thiết, đặc biệt là khu vực có địa hình đèo, dốc, tại các vị trí có bán kính đường cong nhỏ trên các tuyến đường do địa phương quản lý.\n\n7. Thanh tra, kiểm tra và xử lý theo thẩm quyền các hành vi vi phạm về tổ chức, quản lý hoạt động vận tải bằng xe ô tô và hoạt động của bến xe, bãi đỗ xe, trạm dừng nghỉ, điểm dừng xe trên đường bộ trên địa bàn địa phương.\n\nChương VI\n\nTỔ CHỨC THỰC HIỆN VÀ HIỆU LỰC THI HÀNH\n\nĐiều 46. Quy định về chế độ báo cáo\n\n1. Báo cáo tình hình hoạt động vận tải của đơn vị kinh doanh vận tải; Báo cáo kết quả hoạt động của bến xe\n\na) Tên báo cáo: báo cáo kết quả hoạt động vận tải, bến xe;\n\nb) Nội dung yêu cầu báo cáo: kết quả hoạt động của đơn vị vận tải, bến xe;\n\nc) Đối tượng thực hiện báo cáo: đơn vị kinh doanh vận tải, bến xe;\n\nd) Cơ quan nhận báo cáo: Sở Giao thông vận tải;\n\nđ) Phương thức gửi, nhận báo cáo: báo cáo được thể hiện dưới hình thức văn bản giấy hoặc văn bản điện tử. Báo cáo được gửi đến cơ quan nhận báo cáo bằng một trong các phương thức sau: gửi trực tiếp, qua dịch vụ bưu chính, fax, qua hệ thống thư điện tử, hoặc các phương thức khác theo quy định của pháp luật;\n\ne) Tần suất thực hiện báo cáo: định kỳ hàng tháng;\n\ng) Thời hạn gửi báo cáo: trước ngày 20 của tháng tiếp theo kỳ báo cáo;\n\nh) Thời gian chốt số liệu báo cáo: từ ngày 01 đến ngày cuối cùng của tháng báo cáo;\n\ni) Mẫu đề cương báo cáo: theo quy định tại Phụ lục XIV, Phụ lục XV và Phụ lục XVI ban hành kèm theo Thông tư này.\n\n2. Báo cáo tình hình hoạt động vận tải đường bộ của địa phương\n\na) Tên báo cáo: báo cáo tình hình hoạt động vận tải;\n\nb) Nội dung yêu cầu báo cáo: kết quả hoạt động vận chuyển hành khách, vận tải hàng hóa; hoạt động của các bến xe trên địa bàn;\n\nc) Đối tượng thực hiện báo cáo: Sở Giao thông vận tải các tỉnh, thành phố trực thuộc Trung ương;\n\nd) Cơ quan nhận báo cáo: Cục Đường bộ Việt Nam;\n\nđ) Phương thức gửi, nhận báo cáo: báo cáo được thể hiện dưới hình thức văn bản giấy hoặc văn bản điện tử. Báo cáo được gửi đến cơ quan nhận báo cáo bằng một trong các phương thức sau: gửi trực tiếp, qua dịch vụ bưu chính, fax, qua hệ thống thư điện tử, hoặc các phương thức khác theo quy định của pháp luật;\n\ne) Tần suất thực hiện báo cáo: định kỳ hàng năm;\n\ng) Thời hạn gửi báo cáo: trước ngày 20 tháng 12 hàng năm;\n\nh) Thời gian chốt số liệu báo cáo: từ ngày 01 tháng 12 của năm trước đến ngày 30 tháng 11 năm báo cáo;\n\ni) Mẫu đề cương báo cáo: theo quy định tại Phụ lục XVII Thông tư này.\n\n3. Báo cáo tình hình hoạt động vận tải đường bộ trên phạm vi toàn quốc như sau:\n\na) Tên báo cáo: báo cáo tình hình hoạt động vận tải;\n\nb) Nội dung yêu cầu báo cáo: kết quả hoạt động vận chuyển hành khách, vận tải hàng hóa; hoạt động của các bến xe trên địa bàn;\n\nc) Đối tượng thực hiện báo cáo: Cục Đường bộ Việt Nam;\n\nd) Cơ quan nhận báo cáo: Bộ Giao thông vận tải;\n\nđ) Phương thức gửi, nhận báo cáo: báo cáo được thể hiện dưới hình thức văn bản giấy hoặc văn bản điện tử. Báo cáo được gửi đến cơ quan nhận báo cáo bằng một trong các phương thức sau: gửi trực tiếp, qua dịch vụ bưu chính, fax, qua hệ thống thư điện tử, hoặc các phương thức khác theo quy định của pháp luật;\n\ne) Tần suất thực hiện báo cáo: định kỳ hằng năm;\n\ng) Thời hạn gửi báo cáo: trước ngày 15 tháng 02 năm tiếp theo của kỳ báo cáo;\n\nh) Thời gian chốt số liệu báo cáo: từ ngày 01 tháng 12 của năm trước đến ngày 30 tháng 11 năm báo cáo;\n\ni) Mẫu đề cương báo cáo: theo quy định tại Phụ lục XVIII ban hành kèm theo Thông tư này.\n\nĐiều 47. Điều khoản thi hành\n\n1. Thông tư này có hiệu lực thi hành kể từ ngày 01 tháng 01 năm 2025.\n\n2. Bãi bỏ các Thông tư:']","**Nguồn văn bản:** /content/drive/MyDrive/ITProject_data/new_law/168_2024_ND-CP_619502.docx

**Tên văn bản:** (Không có tiêu đề trong metadata)

**(Không có điều khoản trong metadata):**

**Nội dung:**

2. Phạt tiền từ 600.000 đồng đến 800.000 đồng đối với người điều khiển xe thực hiện một trong các hành vi vi phạm sau đây:

    đ) Dừng xe không sát theo lề đường, vỉa hè phía bên phải theo chiều đi hoặc bánh xe gần nhất cách lề đường, vỉa hè quá 0,25 mét; dừng xe trên đường dành riêng cho xe buýt; dừng xe trên miệng cống thoát nước, miệng hầm của đường điện thoại, điện cao thế, chỗ dành riêng cho xe chữa cháy lấy nước; rời vị trí lái, tắt máy khi dừng xe (trừ trường hợp rời khỏi vị trí lái để đóng, mở cửa xe, xếp dỡ hàng hóa, kiểm tra kỹ thuật xe) hoặc rời vị trí lái khi dừng xe nhưng không sử dụng phanh đỗ xe (hoặc thực hiện biện pháp an toàn khác); dừng xe, đỗ xe không đúng vị trí quy định ở những đoạn có bố trí nơi dừng xe, đỗ xe; dừng xe, đỗ xe trên phần đường dành cho người đi bộ qua đường; dừng xe nơi có biển “Cấm dừng xe và đỗ xe”, trừ hành vi vi phạm quy định tại điểm đ khoản 4, điểm c khoản 7 Điều này.

3. Phạt tiền từ 800.000 đồng đến 1.000.000 đồng đối với người điều khiển xe thực hiện một trong các hành vi vi phạm sau đây:


    e) Đỗ xe không sát theo lề đường, vỉa hè phía bên phải theo chiều đi hoặc bánh xe gần nhất cách lề đường, vỉa hè quá 0,25 mét; đỗ xe trên đường dành riêng cho xe buýt; đỗ xe trên miệng cống thoát nước, miệng hầm của đường điện thoại, điện cao thế, chỗ dành riêng cho xe chữa cháy lấy nước; đỗ, để xe ở vỉa hè trái quy định của pháp luật; đỗ xe nơi có biển “Cấm đỗ xe” hoặc biển “Cấm dừng xe và đỗ xe”, trừ hành vi vi phạm quy định tại điểm đ khoản 4, điểm c khoản 7 Điều này.


**Tóm lại:** Việc đỗ xe ở vỉa hè trái quy định sẽ bị phạt tiền từ 800.000 đồng đến 1.000.000 đồng.  Ngoài ra, dừng xe không sát lề đường, vỉa hè hoặc dừng, đỗ xe ở một số vị trí bị cấm cũng sẽ bị xử phạt theo quy định.
","Cấm đỗ xe trên vỉa hè, trừ những nơi có biển báo cho phép.",1.0,0.6236799307553352,0.0,0.0
18,Luật Giao thông Đường bộ 2025 có quy định gì về việc sử dụng làn đường dành cho xe buýt?,"['BỘ GIAO THÔNG VẬN TẢI\n------- CỘNG HÒA XÃ HỘI CHỦ NGHĨA VIỆT NAM\nĐộc lập - Tự do - Hạnh phúc \n--------------- Số: 34/2024/TT-BGTVT Hà Nội, ngày 14 tháng 11 năm 2024\n\nTHÔNG TƯ\n\nQUY ĐỊNH VỀ HOẠT ĐỘNG TRẠM THU PHÍ ĐƯỜNG BỘ\n\nCăn cứ Luật Đường bộ ngày 27 tháng 6 năm 2024;\n\nCăn cứ Nghị định số 56/2022/NĐ-CP ngày 24 tháng 8 năm 2022 của Chính phủ quy định chức năng, nhiệm vụ, quyền hạn và cơ cấu tổ chức của Bộ Giao thông vận tải;\n\nTheo đề nghị của Vụ trưởng Vụ Kết cấu hạ tầng giao thông và Cục trưởng Cục Đường bộ Việt Nam;\n\nBộ trưởng Bộ Giao thông vận tải ban hành Thông tư quy định về hoạt động trạm thu phí đường bộ.\n\nChương I\n\nQUY ĐỊNH CHUNG\n\nĐiều 1. Phạm vi điều chỉnh\n\nThông tư này quy định về hoạt động trạm thu phí đường bộ.\n\nĐiều 2. Đối tượng áp dụng\n\nThông tư này áp dụng đối với các tổ chức, cá nhân liên quan đến hoạt động trạm thu phí đường bộ.\n\nĐiều 3. Giải thích từ ngữ\n\n1. Hoạt động trạm thu phí đường bộ bao gồm: quản lý, vận hành, bảo trì, nâng cấp trạm thu phí đường bộ; quản lý hoạt động trạm thu phí đường bộ; trách nhiệm trong quản lý hoạt động thu phí đường bộ.\n\n2. Trạm thu phí đường bộ (sau đây gọi tắt là trạm thu phí) bao gồm hạ tầng trạm thu phí và hệ thống thu phí.\n\n\n\n3. Hạ tầng trạm thu phí bao gồm: nhà điều hành; giá long môn và cổng trạm thu phí (nếu có); mặt đường và hệ thống điện chiếu sáng trong phạm vi trạm thu phí; đảo phân làn (nếu có); cabin thu phí (nếu có); các trang bị an toàn và hệ thống an toàn giao thông tại trạm thu phí.\n\n4. Hệ thống điều hành và trung tâm dữ liệu của nhà cung cấp dịch vụ thanh toán tiền sử dụng đường bộ (sau đây được gọi là hệ thống Back-End) là hệ thống theo quy định của pháp luật về thanh toán điện tử giao thông đường bộ.\n\n5. Hệ thống thiết bị lắp đặt tại trạm thu phí, trực tiếp tương tác với phương tiện giao thông đi qua trạm (sau đây được gọi là hệ thống Front-End) bao gồm các thiết bị điện tử như đầu đọc thẻ, ăng ten, ca-me-ra nhận dạng biển số, thiết bị nhận diện xe vào trạm, ba-ri-e tốc độ cao và các hệ thống phần cứng, phần mềm, thiết bị tự động hóa khác. Hệ thống Front-End kết nối với hệ thống Back-End để gửi thông tin giao dịch và thu nhận thông tin của phương tiện, thẻ đầu cuối.\n\n6. Hệ thống thu phí bao gồm hệ thống Back-End, hệ thống Front-End và hệ thống đường truyền dữ liệu.\n\n7. Đơn vị quản lý thu đối với thu phí sử dụng đường cao tốc là cơ quan quản lý thu, tổ chức nhận nhượng quyền thu phí sử dụng đường cao tốc theo quy định của pháp luật về thu phí sử dụng đường bộ cao tốc đối với phương tiện lưu thông trên tuyến đường bộ cao tốc thuộc sở hữu toàn dân do Nhà nước đại diện chủ sở hữu và trực tiếp quản lý, khai thác (sau đây gọi tắt là quy định của pháp luật về thu phí sử dụng đường cao tốc).\n\nChương II\n\nQUẢN LÝ, VẬN HÀNH, BẢO TRÌ, NÂNG CẤP TRẠM THU PHÍ\n\nĐiều 4. Quản lý, vận hành, bảo trì, nâng cấp hạ tầng trạm thu phí và hệ thống Front-End\n\n1. Đơn vị vận hành thu thực hiện công tác quản lý, vận hành, bảo trì, nâng cấp hạ tầng trạm thu phí và hệ thống Front-End theo nhiệm vụ được giao hoặc hợp đồng dịch vụ thu với đơn vị quản lý thu.\n\n2. Đối với trạm thu phí để thu tiền dịch vụ sử dụng đường bộ theo pháp luật về giá (sau đây gọi tắt là tiền dịch vụ sử dụng đường bộ), chi phí quản lý, vận hành, bảo trì, nâng cấp được lấy từ nguồn thu tiền dịch vụ sử dụng đường bộ và được xác định trong phương án tài chính của dự án đầu tư có thu tiền dịch vụ sử dụng đường bộ. Trường hợp nhà cung cấp dịch vụ thanh toán tiền sử dụng đường bộ đồng thời là đơn vị vận hành thu theo hợp đồng với cơ quan có thẩm quyền thì chi phí quản lý, vận hành, bảo trì, nâng cấp được tính trong hợp đồng ký với cơ quan có thẩm quyền.\n\n3. Đối với trạm thu phí để thu phí sử dụng đường cao tốc đối với phương tiện lưu thông trên tuyến đường cao tốc thuộc sở hữu toàn dân do Nhà nước đầu tư, sở hữu, quản lý và khai thác (sau đây gọi tắt là phí sử dụng đường cao tốc), chi phí quản lý, vận hành được lấy từ nguồn thu phí sử dụng đường cao tốc theo quy định của pháp luật về thu phí sử dụng đường cao tốc; chi phí bảo trì, nâng cấp được lấy từ nguồn tài chính quy định tại khoản 1 Điều 42 Luật Đường bộ.\n\n\n\nĐiều 5. Quản lý, vận hành, bảo trì, nâng cấp hệ thống Back-End và hệ thống đường truyền dữ liệu\n\n1. Nhà cung cấp dịch vụ thanh toán tiền sử dụng đường bộ thực hiện công tác quản lý, vận hành, bảo trì, nâng cấp hệ thống Back-End và hệ thống đường truyền dữ liệu theo quy định pháp luật về thanh toán điện tử giao thông đường bộ và quy định trong hợp đồng ký kết với cơ quan có thẩm quyền, trừ trường hợp cơ quan có thẩm quyền tự cung cấp dịch vụ thanh toán tiền sử dụng đường bộ.\n\n2. Chi phí quản lý, vận hành, bảo trì, nâng cấp được lấy từ nguồn chi phí dịch vụ thanh toán tiền sử dụng đường bộ theo hình thức điện tử không dừng và các nguồn kinh phí hợp pháp theo quy định pháp luật.\n\nĐiều 6. Thời gian làm việc, trang phục, phù hiệu\n\n1. Trạm thu phí hoạt động 24/24 giờ vào tất cả các ngày trong năm, kể cả ngày nghỉ và ngày lễ trừ những trường hợp tạm dừng thu, dừng thu theo quy định tại Điều 22, Điều 23 Thông tư này.\n\n2. Người lao động làm việc tại trạm thu phí phải mặc đồng phục trong khi thực hiện nhiệm vụ. Mẫu đồng phục của người lao động tại trạm thu phí do đơn vị vận hành thu quyết định nhưng phải đảm bảo có phù hiệu, biểu trưng của đơn vị vận hành thu, biển tên, chức danh được bố trí ở vị trí dễ nhận biết.\n\nĐiều 7. Hình thức thu tiền sử dụng đường bộ\n\nThu tiền sử dụng đường bộ được thực hiện theo hình thức điện tử không dừng và hình thức một dừng.\n\n1. Hình thức điện tử không dừng là hình thức thu tiền sử dụng đường bộ tự động, phương tiện tham gia giao thông đường bộ không phải dừng lại để trả tiền sử dụng đường bộ khi qua trạm thu phí.\n\n2. Hình thức một dừng là hình thức thu tiền sử dụng đường bộ mà khi qua trạm thu phí, phương tiện giao thông đường bộ thực hiện một lần dừng khi qua cửa kiểm soát làn thu phí để trả tiền sử dụng đường bộ.\n\nĐiều 8. Dữ liệu thu tiền sử dụng đường bộ\n\n1. Dữ liệu thu tiền sử dụng đường bộ bao gồm dữ liệu thông tin tài khoản giao thông và dữ liệu về giao dịch thanh toán tiền sử dụng đường bộ.\n\n2. Dữ liệu thông tin tài khoản giao thông bao gồm các thông tin tài khoản giao thông theo quy định của pháp luật về thanh toán điện tử giao thông đường bộ.\n\n3. Dữ liệu về giao dịch thanh toán tiền sử dụng đường bộ bao gồm:\n\na) Các tập tin dữ liệu thông tin thanh toán tiền sử dụng đường bộ theo quy định của pháp luật về thanh toán điện tử giao thông đường bộ;\n\nb) Các tập tin dữ liệu về lưu lượng, doanh thu thu phí, vé lượt, vé tháng, vé quý;\n\nc) Các tập tin video giám sát làn, giám sát toàn cảnh.\n\n4. Dữ liệu thu tiền sử dụng đường bộ phải tuân thủ theo quy định của pháp luật về giao dịch điện tử, pháp luật về an toàn thông tin mạng.\n\n5. Chế độ lưu dữ liệu thu tiền sử dụng đường bộ:\n\na) Lưu trữ tối thiểu 1 năm: các tập tin video giám sát toàn cảnh;\n\nb) Lưu trữ tối thiểu 5 năm: các tập tin video giám sát làn; các tập tin hình ảnh chụp phương tiện lưu thông qua trạm thu phí;\n\nc) Lưu trữ từ thời điểm đưa trạm thu phí vào hoạt động đến thời điểm sau 10 năm kể từ khi thanh lý hợp đồng dự án PPP hoặc kể từ thời điểm dừng hoạt động trạm thu phí: các tập tin dữ liệu thông tin thanh toán tiền sử dụng đường bộ (trừ ảnh chụp phương tiện, ảnh chụp biển số); các tập tin dữ liệu về lưu lượng, doanh thu thu phí, vé lượt, vé tháng, vé quý;\n\nd) Các tập tin dữ liệu thông tin tài khoản giao thông được lưu trữ từ thời điểm mở tài khoản giao thông đến thời điểm sau 10 năm kể từ khi tài khoản giao thông được đóng.\n\nĐiều 9. Kết nối dữ liệu thu tiền sử dụng đường bộ\n\n1. Dữ liệu thu tiền sử dụng đường bộ được kết nối theo quy định của các tiêu chuẩn hiện hành về thu phí, theo quy định của pháp luật về thanh toán điện tử giao thông đường bộ và yêu cầu của cơ quan có thẩm quyền.', '5. Đua xe, tổ chức đua xe, xúi giục, giúp sức, cổ vũ đua xe trái phép; điều khiển phương tiện tham gia giao thông đường bộ lạng lách, đánh võng, rú ga liên tục.\n\n6. Dùng tay cầm và sử dụng điện thoại hoặc thiết bị điện tử khác khi điều khiển phương tiện tham gia giao thông đang di chuyển trên đường bộ.\n\n7. Giao xe cơ giới, xe máy chuyên dùng cho người không đủ điều kiện theo quy định của pháp luật để điều khiển xe tham gia giao thông đường bộ.\n\n8. Đưa xe cơ giới, xe máy chuyên dùng không bảo đảm quy định của pháp luật về an toàn kỹ thuật và bảo vệ môi trường, phương tiện khác không đủ điều kiện theo quy định của pháp luật để tham gia giao thông đường bộ.\n\n9. Nhập khẩu, sản xuất, lắp ráp xe cơ giới, xe máy chuyên dùng không bảo đảm quy định của pháp luật về chất lượng an toàn kỹ thuật và bảo vệ môi trường.\n\n10. Cải tạo xe ô tô loại khác thành xe ô tô chở người, trừ cải tạo thành xe ô tô chở người phục vụ mục đích quốc phòng, an ninh.\n\n11. Cải tạo trái phép; cố ý can thiệp làm sai lệch chỉ số trên đồng hồ báo quãng đường đã chạy của xe ô tô; cắt, hàn, tẩy xóa, đục sửa, đóng lại trái phép số khung, số động cơ của xe cơ giới, xe máy chuyên dùng.\n\n12. Cố ý can thiệp, thay đổi phần mềm điều khiển của xe, động cơ của xe đã được đăng ký với cơ quan quản lý, nhằm mục đích gian lận kết quả kiểm tra, thử nghiệm, kiểm định; thuê, mượn phụ tùng xe cơ giới chỉ để thực hiện việc kiểm định.\n\n13. Chở hàng hóa vượt quá khối lượng toàn bộ, tải trọng trục, kích thước cho phép của xe hoặc vượt quá tải trọng, kích thước giới hạn cho phép của đường bộ khi chưa được cơ quan quản lý cấp phép hoặc không bảo đảm yêu cầu theo quy định của Luật này; chở hàng hóa trên xe có quy định phải chằng buộc nhưng không chằng buộc hoặc chằng buộc không đúng quy định của pháp luật; chở quá số người theo quy định của pháp luật.\n\n14. Vận chuyển hàng hóa cấm lưu hành, vận chuyển trái phép hoặc không thực hiện đầy đủ các quy định của pháp luật về vận chuyển hàng hóa nguy hiểm, động vật hoang dã.\n\n15. Đe dọa, xúc phạm, tranh giành, lôi kéo hành khách; đe doạ, cưỡng ép hành khách sử dụng dịch vụ ngoài ý muốn; chuyển tải, xuống khách hoặc các hành vi khác nhằm trốn tránh phát hiện xe chở quá tải, quá số người theo quy định của pháp luật. \n\n16. Lắp đặt, sử dụng thiết bị âm thanh, ánh sáng trên xe cơ giới, xe máy chuyên dùng gây mất trật tự, an toàn giao thông đường bộ.\n\n17. Sản xuất, sử dụng, mua, bán trái phép biển số xe; điều khiển xe cơ giới, xe máy chuyên dùng gắn biển số xe không do cơ quan nhà nước có thẩm quyền cấp, gắn biển số xe không đúng vị trí; bẻ cong, che lấp biển số xe; làm thay đổi chữ, số, màu sắc, hình dạng, kích thước của biển số xe.\n\n18. Làm gián đoạn hoạt động hoặc làm sai lệch dữ liệu của thiết bị giám sát hành trình, camera lắp trên xe theo quy định của Luật này.\n\n19. Hủy hoại, làm hư hỏng, làm mất tác dụng thiết bị điều khiển, giám sát giao thông đường bộ, thiết bị thông minh hỗ trợ chỉ huy, điều khiển giao thông đường bộ.\n\n20. Đặt, để chướng ngại vật, vật cản khác trái phép trên đường bộ; rải vật sắc nhọn, đổ chất gây trơn trượt trên đường bộ; làm rơi vãi đất đá, hàng hóa, vật liệu xây dựng, phế thải trên đường bộ; đổ, xả thải, làm rơi vãi hóa chất, chất thải gây mất an toàn giao thông đường bộ.\n\n21. Cản trở người, phương tiện tham gia giao thông trên đường bộ; ném gạch, đất, đá, cát hoặc vật thể khác vào người, phương tiện đang tham gia giao thông trên đường bộ.\n\n22. Lợi dụng, lạm dụng nhiệm vụ bảo đảm trật tự, an toàn giao thông đường bộ để thực hiện hành vi vi phạm pháp luật, nhũng nhiễu, xâm phạm lợi ích của Nhà nước, quyền và lợi ích hợp pháp của tổ chức, cá nhân.\n\n23. Lợi dụng chức vụ, quyền hạn, nghề nghiệp của bản thân hoặc người khác để vi phạm pháp luật về trật tự, an toàn giao thông đường bộ hoặc can thiệp, tác động vào quá trình xử lý vi phạm pháp luật về trật tự, an toàn giao thông đường bộ.\n\n24. Sử dụng quyền của xe ưu tiên khi không thực hiện nhiệm vụ theo quy định của pháp luật; lắp đặt, sử dụng thiết bị phát tín hiệu ưu tiên không đúng quy định của pháp luật.\n\n25. Không khai báo, khai báo gian dối hoặc cung cấp thông tin, tài liệu không đúng sự thật để trốn tránh trách nhiệm khi bị phát hiện vi phạm pháp luật về trật tự, an toàn giao thông đường bộ.\n\n26. Bỏ trốn sau khi gây tai nạn giao thông đường bộ để trốn tránh trách nhiệm; khi có điều kiện mà cố ý không cứu giúp người bị tai nạn giao thông đường bộ; xâm phạm tính mạng, sức khỏe, tài sản của người bị nạn, người gây tai nạn giao thông đường bộ hoặc người giúp đỡ, cứu chữa, đưa người bị nạn đi cấp cứu; lợi dụng việc xảy ra tai nạn giao thông đường bộ để hành hung, đe dọa, xúi giục, gây sức ép, làm mất trật tự, cản trở việc xử lý tai nạn giao thông đường bộ.\n\n27. Điều khiển vật thể bay, tàu bay không người lái, phương tiện bay siêu nhẹ hoạt động trong phạm vi khổ giới hạn đường bộ gây cản trở hoặc nguy cơ mất an toàn cho người, phương tiện tham gia giao thông đường bộ, trừ tàu bay không người lái, phương tiện bay siêu nhẹ được cấp phép bay.\n\n28. Hành vi khác vi phạm quy tắc giao thông đường bộ quy định tại Chương II của Luật này.\n\nChương II\n\nQUY TẮC GIAO THÔNG ĐƯỜNG BỘ\n\nĐiều 10. Quy tắc chung\n\n1. Người tham gia giao thông đường bộ phải đi bên phải theo chiều đi của mình, đi đúng làn đường, phần đường quy định, chấp hành báo hiệu đường bộ và các quy tắc giao thông đường bộ khác.\n\n2. Người lái xe và người được chở trên xe ô tô phải thắt dây đai an toàn tại những chỗ có trang bị dây đai an toàn khi tham gia giao thông đường bộ.\n\n3. Khi chở trẻ em dưới 10 tuổi và chiều cao dưới 1,35 mét trên xe ô tô không được cho trẻ em ngồi cùng hàng ghế với người lái xe, trừ loại xe ô tô chỉ có một hàng ghế; người lái xe phải sử dụng, hướng dẫn sử dụng thiết bị an toàn phù hợp cho trẻ em.\n\nĐiều 11. Chấp hành báo hiệu đường bộ\n\n1. Báo hiệu đường bộ bao gồm: hiệu lệnh của người điều khiển giao thông; đèn tín hiệu giao thông; biển báo hiệu đường bộ; vạch kẻ đường và các dấu hiệu khác trên mặt đường; cọc tiêu, tường bảo vệ, rào chắn, đinh phản quang, tiêu phản quang, cột Km, cọc H; thiết bị âm thanh báo hiệu đường bộ.\n\n2. Người tham gia giao thông đường bộ phải chấp hành báo hiệu đường bộ theo thứ tự ưu tiên từ trên xuống dưới như sau: \n\na) Hiệu lệnh của người điều khiển giao thông;\n\nb) Tín hiệu đèn giao thông;\n\nc) Biển báo hiệu đường bộ;\n\nd) Vạch kẻ đường và các dấu hiệu khác trên mặt đường;\n\nđ) Cọc tiêu, tường bảo vệ, rào chắn, đinh phản quang, tiêu phản quang,\ncột Km, cọc H;\n\ne) Thiết bị âm thanh báo hiệu đường bộ.\n\n3. Hiệu lệnh của người điều khiển giao thông được quy định như sau:\n\na) Tay bên phải giơ thẳng đứng để báo hiệu cho người tham gia giao thông đường bộ ở tất cả các hướng phải dừng lại;\n\nb) Hai tay hoặc một tay dang ngang để báo hiệu cho người tham gia giao thông đường bộ ở phía trước và ở phía sau người điều khiển giao thông phải dừng lại; người tham gia giao thông đường bộ ở phía bên phải và bên trái người điều khiển giao thông được đi;\n\nc) Tay bên phải giơ về phía trước để báo hiệu cho người tham gia giao thông đường bộ ở phía sau và bên phải người điều khiển giao thông phải dừng lại; người tham gia giao thông đường bộ ở phía trước người điều khiển giao thông được rẽ phải; người tham gia giao thông đường bộ ở phía bên trái người điều khiển giao thông được đi tất cả các hướng; người đi bộ qua đường phải đi sau lưng người điều khiển giao thông.\n\n4. Tín hiệu đèn giao thông có 03 màu, gồm: màu xanh, màu vàng, màu đỏ; có hiển thị thời gian hoặc không hiển thị thời gian. Người tham gia giao thông đường bộ phải chấp hành như sau:\n\na) Tín hiệu đèn màu xanh là được đi; trường hợp người đi bộ, xe lăn của người khuyết tật đang đi ở lòng đường, người điều khiển phương tiện tham gia giao thông đường bộ phải giảm tốc độ hoặc dừng lại nhường đường cho người đi bộ, xe lăn của người khuyết tật qua đường;', 'Điều 21. Quy định về ngừng khai thác trên tuyến, đóng tuyến xe buýt; bổ sung xe, thay thế xe buýt khai thác trên tuyến\n\n1. Ngừng khai thác trên tuyến, đóng tuyến xe buýt\n\na) Trước khi ngừng khai thác ít nhất 30 ngày, đơn vị kinh doanh vận tải có văn bản thông báo ngừng khai thác trên tuyến gửi Sở Giao thông vận tải nơi cấp Giấy phép kinh doanh vận tải bằng xe ô tô.\n\nTrường hợp ngừng khai thác dẫn đến phải thay đổi tần suất chạy xe trên tuyến hoặc phải đóng tuyến, trong thời hạn 10 ngày làm việc kể từ ngày nhận được thông báo của đơn vị kinh doanh vận tải, Sở Giao thông vận tải nơi cấp Giấy phép kinh doanh vận tải bằng xe ô tô (hoặc thống nhất với Sở Giao thông vận tải đầu tuyến bên kia đối với tuyến xe buýt liên tỉnh) công bố tần suất chạy xe mới hoặc công bố đóng tuyến trên cơ sở đề nghị của đơn vị kinh doanh vận tải;\n\nb) Sở Giao thông vận tải có trách nhiệm công bố trên các phương tiện thông tin đại chúng chậm nhất 15 ngày làm việc kể từ ngày nhận được thông báo;\n\nc) Sau thời điểm ngừng khai thác tối đa 05 ngày làm việc, đơn vị kinh doanh vận tải phải nộp lại phù hiệu của các xe ngừng khai thác cho Sở Giao thông vận tải nơi cấp.\n\n2. Bổ sung xe, thay thế xe buýt\n\na) Đơn vị kinh doanh vận tải được thay thế xe đang khai thác trên tuyến hoặc được bổ sung xe nếu việc bổ sung không làm tăng số chuyến xe. Xe được bổ sung, thay thế phải có phù hiệu “XE BUÝT” và phải đảm bảo các yêu cầu về loại phương tiện tham gia khai thác tuyến theo hợp đồng đã ký kết;\n\nb) Đơn vị kinh doanh vận tải được sử dụng các phương tiện bất kỳ của đơn vị mình đã được cấp phù hiệu “XE BUÝT” để thay thế xe đột xuất khi xe đang hoạt động trên tuyến gặp sự cố kỹ thuật hoặc tai nạn giao thông hoặc do các nguyên nhân bất khả kháng khác.\n\nĐiều 22. Quyền hạn và trách nhiệm của đơn vị kinh doanh vận tải hành khách công cộng bằng xe buýt\n\n1. Tổ chức, thực hiện đúng biểu đồ chạy xe theo phương án khai thác đã ký kết trong hợp đồng.\n\n2. Thực hiện các quy định tại Điều 4 của Thông tư này.\n\n3. Xây dựng quy định nội bộ về đồng phục và thẻ tên cho người lái xe, nhân viên phục vụ trên xe, thẻ nhận dạng người lái xe; thẻ tên phải có ảnh, ghi rõ họ tên, đơn vị quản lý, thẻ tên có thể kết hợp với thẻ nhận dạng người lái xe.\n\n4. Được sử dụng thiết bị điện tử để niêm yết thông tin theo quy định tại khoản 2, khoản 3 và khoản 4 Điều 7 của Thông tư này.\n\n5. Thực hiện các trách nhiệm khác theo quy định tại Luật Đường bộ, Luật Trật tự, an toàn giao thông đường bộ; tuân thủ và duy trì các điều kiện kinh doanh đối với đơn vị kinh doanh vận tải hành khách công cộng bằng xe buýt trong quá trình hoạt động kinh doanh vận tải hành khách công cộng bằng xe buýt.\n\nĐiều 23. Quyền hạn và trách nhiệm của người lái xe, nhân viên phục vụ trên xe buýt\n\n1. Đeo thẻ tên, mặc đồng phục theo đúng mẫu đơn vị kinh doanh vận tải đã quy định.\n\n2. Thực hiện đúng biểu đồ, hành trình chạy xe đã được phê duyệt.\n\n3. Cung cấp thông tin về hành trình tuyến, các điểm dừng trên tuyến khi hành khách yêu cầu; hướng dẫn và giúp đỡ hành khách (đặc biệt là người khuyết tật, người cao tuổi, phụ nữ có thai và trẻ em) khi lên, xuống xe; có thái độ phục vụ văn minh, lịch sự.\n\n4. Giữ gìn vệ sinh phương tiện.\n\n5. Thực hiện các trách nhiệm khác theo quy định tại Luật Đường bộ, Luật Trật tự, an toàn giao thông đường bộ; tuân thủ và duy trì các điều kiện kinh doanh đối với người lái xe, nhân viên phục vụ trên xe buýt trong quá trình hoạt động kinh doanh vận tải hành khách công cộng bằng xe buýt.\n\nĐiều 24. Quyền hạn, trách nhiệm của hành khách đi xe buýt\n\n1. Mang theo hành lý với trọng lượng không quá 10 kg và kích thước không quá 30x40x60 cm. Đối với hành khách đi trên xe của tuyến xe buýt có điểm đầu hoặc điểm cuối nằm trong khu vực cảng hàng không, tuyến xe buýt liên tỉnh hành khách được mang theo hành lý với trọng lượng không quá 20 kg và kích thước phù hợp với thiết kế của xe.\n\n2. Chấp hành các quy định khi đi xe và sự hướng dẫn của người lái xe, nhân viên phục vụ trên xe.\n\n3. Yêu cầu nhân viên phục vụ trên xe xuất vé đúng loại sau khi trả tiền; giữ vé suốt hành trình và xuất trình vé khi người có thẩm quyền yêu cầu kiểm tra.\n\n4. Khiếu nại, kiến nghị, phản ánh những hành vi vi phạm quy định về quản lý vận tải của đơn vị kinh doanh vận tải, người lái xe, nhân viên phục vụ trên xe và yêu cầu bồi thường thiệt hại (nếu có).\n\n5. Thực hiện các trách nhiệm khác theo quy định tại Luật Đường bộ, Luật Trật tự, an toàn giao thông đường bộ.\n\nMục 4. KINH DOANH VẬN TẢI HÀNH KHÁCH BẰNG XE TAXI\n\nĐiều 25. Quy định đối với xe taxi\n\n1. Tuân thủ và duy trì các điều kiện kinh doanh đối với xe taxi trong quá trình hoạt động kinh doanh vận tải hành khách bằng xe taxi.\n\n2. Thực hiện niêm yết thông tin như sau:\n\na) Hai bên cánh cửa xe: tên, số điện thoại và biểu trưng (logo) của đơn vị kinh doanh vận tải với kích thước tối thiểu: chiều dài là 20 cm, chiều rộng là 20 cm; bảng giá cước đã kê khai theo mẫu quy định tại Phụ lục III ban hành kèm theo Thông tư này;\n\nb) Trong xe: bảng giá cước tính tiền theo kilômét (km), giá cước tính tiền cho thời gian xe phải chờ đợi theo yêu cầu của hành khách và các chi phí khác (nếu có) mà hành khách phải trả; bảng giá cước đã kê khai theo mẫu quy định tại Phụ lục III ban hành kèm theo Thông tư này;\n\nc) Trường hợp xe taxi sử dụng phần mềm tính tiền phải hiển thị trên giao diện dành cho hành khách bảng giá cước đã kê khai theo mẫu quy định tại Phụ lục III ban hành kèm theo Thông tư này.\n\n3. Việc đảm bảo điều kiện an toàn về phòng cháy và chữa cháy thực hiện theo quy định tại khoản 4 Điều 8 Thông tư này.\n\n4. Trong xe phải có Bảng hướng dẫn về an toàn giao thông và thoát hiểm cho hành khách, các nội dung chính gồm: hướng dẫn cài dây an toàn (nếu có); bảng cấm hút thuốc trên xe; hướng dẫn đóng, mở cửa xe đảm bảo an toàn.\n\nĐiều 26. Điểm dừng đón, trả khách công cộng, điểm đỗ xe taxi\n\n1. Điểm dừng đón, trả khách công cộng cho xe taxi phải đảm bảo an toàn giao thông và được báo hiệu bằng biển báo, vạch sơn kẻ đường theo quy định về tổ chức giao thông.\n\n2. Điểm đỗ xe taxi\n\na) Điểm đỗ xe taxi gồm 02 loại: điểm đỗ xe taxi do đơn vị kinh doanh vận tải tổ chức và quản lý; điểm đỗ xe taxi công cộng do cơ quan quản lý nhà nước của địa phương tổ chức và quản lý;\n\nb) Yêu cầu đối với điểm đỗ xe taxi: đảm bảo trật tự, an toàn và không gây ùn tắc giao thông; đáp ứng yêu cầu về phòng, chống cháy nổ và vệ sinh môi trường.\n\nĐiều 27. Quyền hạn và trách nhiệm của đơn vị kinh doanh vận tải hành khách bằng xe taxi\n\n1. Thực hiện các quy định tại Điều 4 của Thông tư này.\n\n2. Xây dựng quy định đồng phục và thẻ tên cho người lái xe, thẻ nhận dạng người lái xe; thẻ tên phải có ảnh, ghi rõ họ tên, đơn vị quản lý, thẻ tên có thể kết hợp với thẻ nhận dạng người lái xe.\n\n3. Được sử dụng thiết bị điện tử để niêm yết thông tin theo quy định tại khoản 2 Điều 25 của Thông tư này.\n\n4. Thực hiện các trách nhiệm khác theo quy định tại Luật Đường bộ, Luật Trật tự, an toàn giao thông đường bộ; tuân thủ và duy trì các điều kiện kinh doanh đối với đơn vị kinh doanh vận tải hành khách bằng xe taxi trong quá trình hoạt động kinh doanh vận tải hành khách bằng xe taxi.\n\nĐiều 28. Quyền hạn, trách nhiệm của người lái xe taxi\n\n1. Đeo thẻ tên, mặc đồng phục theo đúng quy định của đơn vị kinh doanh vận tải.\n\n2. Thu tiền cước của hành khách khi kết thúc hành trình theo đồng hồ tính tiền hoặc theo thông báo trên phần mềm hoặc theo thỏa thuận giữa hành khách với đơn vị kinh doanh vận tải.\n\n3. Giữ gìn vệ sinh phương tiện.\n\n4. Cung cấp thông tin về tuyến đường khi hành khách yêu cầu; hướng dẫn và giúp đỡ hành khách (đặc biệt là người khuyết tật, người cao tuổi, phụ nữ có thai và trẻ em) khi lên, xuống xe.\n\n5. Thực hiện các trách nhiệm khác theo quy định tại Luật Đường bộ, Luật Trật tự, an toàn giao thông đường bộ.\n\nĐiều 29. Quyền hạn, trách nhiệm của hành khách đi xe taxi\n\n1. Yêu cầu người lái xe cung cấp thông tin về hành trình chạy xe.']","**Nguồn văn bản:** /content/drive/MyDrive/ITProject_data/new_law/36_2024_QH15_444251.docx

**Tên văn bản:**  (Không có tiêu đề trong metadata)

**(Không có article_title):**

**Nội dung:**

Điều 10. Quy tắc chung

1. Người tham gia giao thông đường bộ phải đi bên phải theo chiều đi của mình, đi đúng làn đường, phần đường quy định, chấp hành báo hiệu đường bộ và các quy tắc giao thông đường bộ khác.

2. Người lái xe và người được chở trên xe ô tô phải thắt dây đai an toàn tại những chỗ có trang bị dây đai an toàn khi tham gia giao thông đường bộ.

3. Khi chở trẻ em dưới 10 tuổi và chiều cao dưới 1,35 mét trên xe ô tô không được cho trẻ em ngồi cùng hàng ghế với người lái xe, trừ loại xe ô tô chỉ có một hàng ghế; người lái xe phải sử dụng, hướng dẫn sử dụng thiết bị an toàn phù hợp cho trẻ em.


**Tóm lại:** Văn bản này đề cập đến quy tắc giao thông đường bộ chung, không có quy định cụ thể về việc sử dụng làn đường dành cho xe buýt.
",Cấm các phương tiện không phải xe buýt sử dụng làn đường dành riêng cho xe buýt trong giờ cao điểm.,0.7142857142857143,0.6924504913142623,0.0,0.0
