,user_input,retrieved_contexts,response,reference,faithfulness,answer_relevancy,context_recall,context_precision
0,Luật Giao thông Đường bộ 2025 có những thay đổi gì về phân hạng giấy phép lái xe?,"['a) Giấy phép lái xe hết thời hạn sử dụng;\n\nb) Giấy phép lái xe bị thu hồi theo quy định tại khoản 5 Điều 62 của Luật này.\n\n8. Giấy phép lái xe quốc tế được quy định như sau:\n\na) Giấy phép lái xe quốc tế là giấy phép lái xe do cơ quan nhà nước có thẩm quyền của quốc gia là thành viên của Công ước Viên cấp theo một mẫu thống nhất; có thời hạn không quá 03 năm kể từ ngày cấp và phải phù hợp với thời hạn còn hiệu lực của giấy phép lái xe quốc gia;\n\nb) Người có giấy phép lái xe quốc tế do quốc gia là thành viên của Công ước Viên cấp khi lái xe tham gia giao thông đường bộ trên lãnh thổ Việt Nam phải mang theo giấy phép lái xe quốc tế và giấy phép lái xe quốc gia được cấp phù hợp với hạng xe điều khiển, còn thời hạn sử dụng; phải tuân thủ pháp luật về trật tự, an toàn giao thông đường bộ của Việt Nam;\n\nc) Người có giấy phép lái xe quốc tế vi phạm pháp luật về trật tự, an toàn giao thông đường bộ của Việt Nam mà bị tước quyền sử dụng giấy phép lái xe có thời hạn thì thời gian bị tước quyền sử dụng không quá thời gian người lái xe được phép cư trú tại lãnh thổ Việt Nam;\n\nd) Người Việt Nam hoặc người nước ngoài có thẻ thường trú hoặc thẻ tạm trú tại Việt Nam có giấy phép lái xe do Việt Nam hoặc quốc gia là thành viên của điều ước quốc tế mà nước Cộng hòa xã hội chủ nghĩa Việt Nam là thành viên cấp, còn giá trị sử dụng, nếu có nhu cầu được cấp giấy phép lái xe quốc tế.\n\n9. Bộ trưởng Bộ Giao thông vận tải quy định mẫu giấy phép lái xe và giấy phép lái xe quốc tế, trình tự, thủ tục cấp và việc sử dụng giấy phép lái xe, giấy phép lái xe quốc tế; đối với mẫu giấy phép lái xe, trình tự, thủ tục cấp và việc sử dụng giấy phép lái xe của lực lượng quân đội, công an làm nhiệm vụ quốc phòng, an ninh do Bộ trưởng Bộ Quốc phòng, Bộ trưởng Bộ Công an quy định.\n\nĐiều 58. Điểm của giấy phép lái xe \n\n1. Điểm của giấy phép lái xe được dùng để quản lý việc chấp hành pháp luật về trật tự, an toàn giao thông đường bộ của người lái xe trên hệ thống cơ sở dữ liệu về trật tự, an toàn giao thông đường bộ, bao gồm 12 điểm. Số điểm trừ mỗi lần vi phạm tùy thuộc tính chất, mức độ của hành vi vi phạm pháp luật về trật tự, an toàn giao thông đường bộ. Dữ liệu về điểm trừ giấy phép lái xe của người vi phạm sẽ được cập nhật vào hệ thống cơ sở dữ liệu ngay sau khi quyết định xử phạt có hiệu lực thi hành và thông báo cho người bị trừ điểm giấy phép lái xe biết.\n\n2. Giấy phép lái xe chưa bị trừ hết điểm và không bị trừ điểm trong thời hạn 12 tháng từ ngày bị trừ điểm gần nhất thì được phục hồi đủ 12 điểm.\n\n3. Trường hợp giấy phép lái xe bị trừ hết điểm thì người có giấy phép lái xe không được điều khiển phương tiện tham gia giao thông đường bộ theo giấy phép lái xe đó. Sau thời hạn ít nhất là 06 tháng kể từ ngày bị trừ hết điểm, người có giấy phép lái xe được tham gia kiểm tra nội dung kiến thức pháp luật về trật tự, an toàn giao thông đường bộ theo quy định tại khoản 7 Điều 61 của Luật này do lực lượng Cảnh sát giao thông tổ chức, có kết quả đạt yêu cầu thì được phục hồi đủ 12 điểm.\n\n4. Giấy phép lái xe sau khi đổi, cấp lại, nâng hạng được giữ nguyên số điểm của giấy phép lái xe trước khi đổi, cấp lại, nâng hạng.\n\n5. Người có thẩm quyền xử phạt vi phạm hành chính có thẩm quyền trừ điểm giấy phép lái xe.\n\n6. Chính phủ quy định chi tiết khoản 1 Điều này; quy định trình tự, thủ tục, thẩm quyền trừ điểm, phục hồi điểm giấy phép lái xe; quy định lộ trình thực hiện Điều này. Bộ trưởng Bộ Công an quy định chi tiết khoản 3 Điều này.\n\nĐiều 59. Tuổi, sức khỏe của người điều khiển phương tiện tham gia giao thông đường bộ\n\n1. Độ tuổi của người lái xe, người điều khiển xe máy chuyên dùng được quy định như sau:\n\na) Người đủ 16 tuổi trở lên được điều khiển xe gắn máy;\n\nb) Người đủ 18 tuổi trở lên được cấp giấy phép lái xe hạng A1, A, B1, B, C1, được cấp chứng chỉ bồi dưỡng kiến thức pháp luật về giao thông đường bộ để điều khiển xe máy chuyên dùng tham gia giao thông đường bộ;\n\nc) Người đủ 21 tuổi trở lên được cấp giấy phép lái xe hạng C, BE;\n\nd) Người đủ 24 tuổi trở lên được cấp giấy phép lái xe hạng D1, D2, C1E, CE;\n\nđ) Người đủ 27 tuổi trở lên được cấp giấy phép lái xe hạng D, D1E, D2E, DE;\n\ne) Tuổi tối đa của người lái xe ô tô chở người (kể cả xe buýt) trên 29 chỗ (không kể chỗ của người lái xe), xe ô tô chở người giường nằm là đủ 57 tuổi đối với nam, đủ 55 tuổi đối với nữ.\n\n2. Người điều khiển phương tiện tham gia giao thông đường bộ phải bảo đảm điều kiện sức khỏe phù hợp với từng loại phương tiện được phép điều khiển. Bộ trưởng Bộ Y tế quy định về tiêu chuẩn sức khỏe, việc khám sức khỏe đối với người lái xe, người điều khiển xe máy chuyên dùng; việc khám sức khỏe định kỳ đối với người hành nghề lái xe ô tô; xây dựng cơ sở dữ liệu về sức khỏe của người lái xe, người điều khiển xe máy chuyên dùng.\n\n3. Bộ trưởng Bộ Quốc phòng, Bộ trưởng Bộ Công an quy định độ tuổi của người lái xe trong lực lượng quân đội, công an làm nhiệm vụ quốc phòng, an ninh.\n\nĐiều 60. Đào tạo lái xe\n\n1. Người có nhu cầu được cấp giấy phép lái xe phải được đào tạo nội dung lý thuyết và thực hành theo chương trình đào tạo quy định cho từng hạng giấy phép lái xe.\n\n2. Người học lái xe phải được đào tạo tại các cơ sở đào tạo lái xe hoặc các hình thức đào tạo lái xe khác để cấp mới hoặc nâng hạng giấy phép lái xe.\n\n3. Việc đào tạo để nâng hạng giấy phép lái xe thực hiện đối với những đối tượng sau đây:\n\na) Nâng hạng giấy phép lái xe từ hạng B lên hạng C1 hoặc lên hạng C hoặc lên hạng D1 hoặc lên hạng D2;\n\nb) Nâng hạng giấy phép lái xe từ hạng C1 lên hạng C hoặc lên hạng D1 hoặc lên hạng D2;\n\nc) Nâng hạng giấy phép lái xe từ hạng C lên hạng D1 hoặc lên hạng D2 hoặc lên hạng D;\n\nd) Nâng hạng giấy phép lái xe từ hạng D1 lên hạng D2 hoặc lên hạng D;\n\nđ) Nâng hạng giấy phép lái xe từ hạng D2 lên hạng D;\n\ne) Nâng hạng giấy phép lái xe từ hạng B lên hạng BE, từ hạng C1 lên\xa0 hạng C1E, từ hạng C lên hạng CE, từ hạng D1 lên hạng D1E, từ hạng D2 lên hạng D2E, từ hạng D lên hạng DE.\n\n4.\xa0Người có nhu cầu được đào tạo nâng hạng giấy phép lái xe khi giấy phép lái xe còn hiệu lực, phải có đủ thời gian lái xe an toàn quy định cho từng hạng giấy phép lái xe;\xa0đối với việc nâng hạng giấy phép lái xe lên hạng D1, D2, D thì người có nhu cầu được đào tạo còn phải có trình độ từ trung học cơ sở trở lên.\n\n5. Giấy phép lái xe các hạng C, D1, D2, D, BE, C1E, CE, D1E, D2E, DE phải được đào tạo bằng hình thức đào tạo nâng hạng theo các điều kiện quy định tại khoản 3 và khoản 4 Điều này.\n\n6. Cơ sở đào tạo lái xe ô tô phải đáp ứng các điều kiện do Chính phủ quy định; có giáo trình, giáo án; thực hiện đào tạo theo đúng hình thức, nội dung và chương trình quy định cho từng hạng giấy phép lái xe.\n\n7. Chính phủ quy định chi tiết các hình thức đào tạo lái xe khác quy định tại khoản 2 Điều này; quy định trình tự, thủ tục kiểm tra, đánh giá để cấp, cấp lại và thu hồi giấy phép xe tập lái; quy định tiêu chuẩn của giáo viên dạy lái xe; quy định việc cấp, cấp lại và thu hồi giấy chứng nhận giáo viên dạy lái xe; quy định việc cấp, cấp lại và thu hồi giấy phép đào tạo lái xe.\n\n8. Bộ trưởng Bộ Giao thông vận tải quy định hình thức, nội dung, chương trình đào tạo lái xe, thời gian lái xe an toàn cho từng hạng giấy phép lái xe quy định tại khoản 4 Điều này và quy định tiêu chuẩn của cơ sở đào tạo lái xe mô tô; đối với cơ sở đào tạo, tổ chức đào tạo lái xe cho lực lượng quân đội, công an làm nhiệm vụ quốc phòng, an ninh do Bộ trưởng Bộ Quốc phòng, Bộ trưởng Bộ Công an quy định.\n\nĐiều 61. Sát hạch lái xe\n\n1. Người đã hoàn thành chương trình đào tạo lái xe, có độ tuổi, sức khỏe theo quy định tại Điều 59 của Luật này được đăng ký để tham dự kỳ sát hạch lái xe.\n\n2. Nội dung sát hạch lái xe phải phù hợp với hạng giấy phép lái xe và chương trình đào tạo lái xe.\n\n3. Hoạt động sát hạch lái xe ô tô phải thực hiện tại các trung tâm sát hạch lái xe; hoạt động sát hạch lái xe mô tô thực hiện tại các trung tâm sát hạch lái xe hoặc tại sân tập lái đáp ứng điều kiện, tiêu chuẩn về cơ sở vật chất, kỹ thuật. Hoạt động sát hạch lái xe do cơ quan nhà nước có thẩm quyền thực hiện.']","**Nguồn văn bản:** /content/drive/MyDrive/ITProject_data/new_law/36_2024_QH15_444251.docx

**Tên văn bản:** (Không có tiêu đề trong metadata)


**Nội dung:**

Điều 59. Tuổi, sức khỏe của người điều khiển phương tiện tham gia giao thông đường bộ

1. Độ tuổi của người lái xe, người điều khiển xe máy chuyên dùng được quy định như sau:

        a) Người đủ 16 tuổi trở lên được điều khiển xe gắn máy.

        b) Người đủ 18 tuổi trở lên được cấp giấy phép lái xe hạng A1, A, B1, B, C1, được cấp chứng chỉ bồi dưỡng kiến thức pháp luật về giao thông đường bộ để điều khiển xe máy chuyên dùng tham gia giao thông đường bộ.

        c) Người đủ 21 tuổi trở lên được cấp giấy phép lái xe hạng C, BE.

        d) Người đủ 24 tuổi trở lên được cấp giấy phép lái xe hạng D1, D2, C1E, CE.

        đ) Người đủ 27 tuổi trở lên được cấp giấy phép lái xe hạng D, D1E, D2E, DE.

        e) Tuổi tối đa của người lái xe ô tô chở người (kể cả xe buýt) trên 29 chỗ (không kể chỗ của người lái xe), xe ô tô chở người giường nằm là đủ 57 tuổi đối với nam, đủ 55 tuổi đối với nữ.


2. Người điều khiển phương tiện tham gia giao thông đường bộ phải bảo đảm điều kiện sức khỏe phù hợp với từng loại phương tiện được phép điều khiển. Bộ trưởng Bộ Y tế quy định về tiêu chuẩn sức khỏe, việc khám sức khỏe đối với người lái xe, người điều khiển xe máy chuyên dùng; việc khám sức khỏe định kỳ đối với người hành nghề lái xe ô tô; xây dựng cơ sở dữ liệu về sức khỏe của người lái xe, người điều khiển xe máy chuyên dùng.

3. Bộ trưởng Bộ Quốc phòng, Bộ trưởng Bộ Công an quy định độ tuổi của người lái xe trong lực lượng quân đội, công an làm nhiệm vụ quốc phòng, an ninh.

Điều 60. Đào tạo lái xe

1. Người có nhu cầu được cấp giấy phép lái xe phải được đào tạo nội dung lý thuyết và thực hành theo chương trình đào tạo quy định cho từng hạng giấy phép lái xe.


2. Người học lái xe phải được đào tạo tại các cơ sở đào tạo lái xe hoặc các hình thức đào tạo lái xe khác để cấp mới hoặc nâng hạng giấy phép lái xe.

3. Việc đào tạo để nâng hạng giấy phép lái xe thực hiện đối với những đối tượng sau đây:

        a) Nâng hạng giấy phép lái xe từ hạng B lên hạng C1 hoặc lên hạng C hoặc lên hạng D1 hoặc lên hạng D2.

        b) Nâng hạng giấy phép lái xe từ hạng C1 lên hạng C hoặc lên hạng D1 hoặc lên hạng D2.

        c) Nâng hạng giấy phép lái xe từ hạng C lên hạng D1 hoặc lên hạng D2 hoặc lên hạng D.

        d) Nâng hạng giấy phép lái xe từ hạng D1 lên hạng D2 hoặc lên hạng D.

        đ) Nâng hạng giấy phép lái xe từ hạng D2 lên hạng D.

        e) Nâng hạng giấy phép lái xe từ hạng B lên hạng BE, từ hạng C1 lên hạng C1E, từ hạng C lên hạng CE, từ hạng D1 lên hạng D1E, từ hạng D2 lên hạng D2E, từ hạng D lên hạng DE.

4. Người có nhu cầu được đào tạo nâng hạng giấy phép lái xe khi giấy phép lái xe còn hiệu lực, phải có đủ thời gian lái xe an toàn quy định cho từng hạng giấy phép lái xe; đối với việc nâng hạng giấy phép lái xe lên hạng D1, D2, D thì người có nhu cầu được đào tạo còn phải có trình độ từ trung học cơ sở trở lên.

5. Giấy phép lái xe các hạng C, D1, D2, D, BE, C1E, CE, D1E, D2E, DE phải được đào tạo bằng hình thức đào tạo nâng hạng theo các điều kiện quy định tại khoản 3 và khoản 4 Điều này.


Tóm lại: Luật quy định các hạng giấy phép lái xe bao gồm: A1, A, B1, B, C1, C, D1, D2, D, BE, C1E, CE, D1E, D2E, DE.  Độ tuổi được cấp phép, điều kiện nâng hạng, đào tạo lái xe được quy định cụ thể theo từng hạng.
","**Nguồn văn bản:** 36_2024_QH15_444251

**Tên văn bản:** Luật Trật tự, an toàn giao thông đường bộ

**Điều 57:** Giấy phép lái xe

**Nội dung:**

1. Giấy phép lái xe bao gồm các hạng sau đây:

	a) Hạng A1 cấp cho người lái xe mô tô hai bánh có dung tích xi-lanh đến 125 cm3 hoặc có công suất động cơ điện đến 11 kW.

	b) Hạng A cấp cho người lái xe mô tô hai bánh có dung tích xi-lanh trên 125 cm3 hoặc có công suất động cơ điện trên 11 kW và các loại xe quy định cho giấy phép lái xe hạng A1.

	c) Hạng B1 cấp cho người lái xe mô tô ba bánh và các loại xe quy định cho giấy phép lái xe hạng A1.

	d) Hạng B cấp cho người lái xe ô tô chở người đến 08 chỗ (không kể chỗ của người lái xe); xe ô tô tải và ô tô chuyên dùng có khối lượng toàn bộ theo thiết kế đến 3.500 kg; các loại xe ô tô quy định cho giấy phép lái xe hạng B kéo rơ moóc có khối lượng toàn bộ theo thiết kế đến 750 kg.

	đ) Hạng C1 cấp cho người lái xe ô tô tải và ô tô chuyên dùng có khối lượng toàn bộ theo thiết kế trên 3.500 kg đến 7.500 kg; các loại xe ô tô tải quy định cho giấy phép lái xe hạng C1 kéo rơ moóc có khối lượng toàn bộ theo thiết kế đến 750 kg; các loại xe quy định cho giấy phép lái xe hạng B.

	e) Hạng C cấp cho người lái xe ô tô tải và ô tô chuyên dùng có khối lượng toàn bộ theo thiết kế trên 7.500 kg; các loại xe ô tô tải quy định cho giấy phép lái xe hạng C kéo rơ moóc có khối lượng toàn bộ theo thiết kế đến 750 kg; các loại xe quy định cho giấy phép lái xe hạng B và hạng C1.

	g) Hạng D1 cấp cho người lái xe ô tô chở người trên 08 chỗ (không kể chỗ của người lái xe) đến 16 chỗ (không kể chỗ của người lái xe); các loại xe ô tô chở người quy định cho giấy phép lái xe hạng D1 kéo rơ moóc có khối lượng toàn bộ theo thiết kế đến 750 kg; các loại xe quy định cho giấy phép lái xe các hạng B, C1, C.

	h) Hạng D2 cấp cho người lái xe ô tô chở người (kể cả xe buýt) trên 16 chỗ (không kể chỗ của người lái xe) đến 29 chỗ (không kể chỗ của người lái xe); các loại xe ô tô chở người quy định cho giấy phép lái xe hạng D2 kéo rơ moóc có khối lượng toàn bộ theo thiết kế đến 750 kg; các loại xe quy định cho giấy phép lái xe các hạng B, C1, C, D1.

	i) Hạng D cấp cho người lái xe ô tô chở người (kể cả xe buýt) trên 29 chỗ (không kể chỗ của người lái xe); xe ô tô chở người giường nằm; các loại xe ô tô chở người quy định cho giấy phép lái xe hạng D kéo rơ moóc có khối lượng toàn bộ theo thiết kế đến 750 kg; các loại xe quy định cho giấy phép lái xe các hạng B, C1, C, D1, D2.

	k) Hạng BE cấp cho người lái các loại xe ô tô quy định cho giấy phép lái xe hạng B kéo rơ moóc có khối lượng toàn bộ theo thiết kế trên 750 kg.

	l) Hạng C1E cấp cho người lái các loại xe ô tô quy định cho giấy phép lái xe hạng C1 kéo rơ moóc có khối lượng toàn bộ theo thiết kế trên 750 kg.

	m) Hạng CE cấp cho người lái các loại xe ô tô quy định cho giấy phép lái xe hạng C kéo rơ moóc có khối lượng toàn bộ theo thiết kế trên 750 kg; xe ô tô đầu kéo kéo sơ mi rơ moóc.

	n) Hạng D1E cấp cho người lái các loại xe ô tô quy định cho giấy phép lái xe hạng D1 kéo rơ moóc có khối lượng toàn bộ theo thiết kế trên 750 kg.

	o) Hạng D2E cấp cho người lái các loại xe ô tô quy định cho giấy phép lái xe hạng D2 kéo rơ moóc có khối lượng toàn bộ theo thiết kế trên 750 kg.

	p) Hạng DE cấp cho người lái các loại xe ô tô quy định cho giấy phép lái xe hạng D kéo rơ moóc có khối lượng toàn bộ theo thiết kế trên 750 kg; xe ô tô chở khách nối toa.


2. Người khuyết tật điều khiển xe mô tô ba bánh dùng cho người khuyết tật được cấp giấy phép lái xe hạng A1. Người khuyết tật điều khiển xe ô tô số tự động có kết cấu phù hợp với tình trạng khuyết tật thì được cấp giấy phép lái xe hạng B.

3. Người điều khiển xe chở hàng bốn bánh có gắn động cơ, xe chở người bốn bánh có gắn động cơ phải sử dụng giấy phép lái xe có hạng phù hợp với xe ô tô tải hoặc xe ô tô chở người tương ứng.

4. Người điều khiển xe ô tô có thiết kế, cải tạo với số chỗ ít hơn xe cùng loại, kích thước giới hạn tương đương phải sử dụng giấy phép lái xe có hạng phù hợp với xe ô tô cùng loại, kích thước giới hạn tương đương và có số chỗ nhiều nhất.

5. Thời hạn của giấy phép lái xe được quy định như sau:

	a) Giấy phép lái xe các hạng A1, A, B1 không thời hạn.

	b) Giấy phép lái xe hạng B và hạng C1 có thời hạn 10 năm kể từ ngày cấp.

	c) Giấy phép lái xe các hạng C, D1, D2, D, BE, C1E, CE, D1E, D2E và DE có thời hạn 05 năm kể từ ngày cấp.


**Tóm lại:** Giấy phép lái xe được phân thành nhiều hạng từ A1, A, B1, B, C1, C, D1, D2, D, BE, C1E, CE, D1E, D2E, DE,  tùy thuộc vào loại xe được phép điều khiển. Mỗi hạng xe có quy định cụ thể về loại xe và khối lượng cho phép. Giấy phép lái xe có thời hạn hoặc không thời hạn tùy theo hạng.
",1.0,0.567739958125799,0.0,0.0
1,Giấy phép lái xe hạng A1 mới cấp cho loại xe nào?,"['a) Chứng nhận đăng ký xe hoặc bản sao Chứng nhận đăng ký xe có chứng thực kèm bản gốc giấy tờ xác nhận của tổ chức tín dụng, chi nhánh ngân hàng nước ngoài còn hiệu lực trong trường hợp xe đang được thế chấp tại tổ chức tín dụng, chi nhánh ngân hàng nước ngoài;\n\nb) Giấy phép lái xe phù hợp với loại xe đang điều khiển;\n\nc) Chứng nhận kiểm định an toàn kỹ thuật và bảo vệ môi trường đối với xe cơ giới theo quy định của pháp luật;\n\nd) Chứng nhận bảo hiểm bắt buộc trách nhiệm dân sự của chủ xe cơ giới.\n\n2. Người điều khiển xe máy chuyên dùng tham gia giao thông đường bộ phải đủ tuổi, sức khỏe theo quy định của pháp luật; có bằng hoặc chứng chỉ điều khiển xe máy chuyên dùng phù hợp loại xe máy chuyên dùng đang điều khiển; có giấy phép lái xe đang còn điểm, còn hiệu lực hoặc chứng chỉ bồi dưỡng kiến thức pháp luật về giao thông đường bộ. Khi tham gia giao thông đường bộ, người điều khiển xe máy chuyên dùng phải mang theo các loại giấy tờ sau đây:\n\na) Chứng nhận đăng ký xe hoặc bản sao Chứng nhận đăng ký xe có chứng thực kèm bản gốc Giấy biên nhận còn hiệu lực của tổ chức tín dụng, chi nhánh ngân hàng nước ngoài trong trường hợp xe đang được thế chấp tại tổ chức tín dụng, chi nhánh ngân hàng nước ngoài;\n\nb) Bằng hoặc chứng chỉ điều khiển xe máy chuyên dùng;\n\nc) Giấy phép lái xe hoặc chứng chỉ bồi dưỡng kiến thức pháp luật về giao thông đường bộ;\n\nd) Chứng nhận kiểm định an toàn kỹ thuật và bảo vệ môi trường đối với xe máy chuyên dùng theo quy định của pháp luật;\n\nđ) Chứng nhận bảo hiểm bắt buộc trách nhiệm dân sự theo quy định của pháp luật.\n\n3. Trường hợp giấy tờ quy định tại khoản 1 và khoản 2 Điều này đã được tích hợp vào tài khoản định danh điện tử thì việc xuất trình, kiểm tra có thể thực hiện thông qua tài khoản định danh điện tử.\n\n4. Người lái xe gắn máy tham gia giao thông đường bộ phải hiểu biết quy tắc giao thông đường bộ, có kỹ năng điều khiển phương tiện; đủ điều kiện về độ tuổi, sức khỏe theo quy định tại điểm a khoản 1 và khoản 2 Điều 59 của Luật này.\n\n5. Người tập lái xe ô tô, người dự sát hạch lái xe ô tô khi tham gia giao thông đường bộ phải thực hành trên xe tập lái, xe sát hạch trên tuyến đường tập lái, tuyến đường sát hạch, có giáo viên dạy lái hoặc sát hạch viên bảo trợ tay lái. Giáo viên dạy lái, sát hạch viên phải mang theo các loại giấy tờ quy định tại khoản 1 Điều này.\n\nĐiều 57. Giấy phép lái xe\n\n1. Giấy phép lái xe bao gồm các hạng sau đây:\n\na) Hạng A1 cấp cho người lái xe mô tô hai bánh có dung tích xi-lanh đến 125 cm3 hoặc có công suất động cơ điện đến 11 kW;\n\nb) Hạng A cấp cho người lái xe mô tô hai bánh có dung tích xi-lanh\xa0 trên 125 cm3\xa0hoặc có công suất động cơ điện trên 11 kW và các loại xe quy định cho giấy phép lái xe hạng A1;\n\nc) Hạng B1 cấp cho người lái xe mô tô ba bánh và các loại xe quy định cho giấy phép lái xe hạng A1;\n\nd) Hạng B cấp cho người lái xe ô tô chở người đến 08 chỗ (không kể chỗ của người lái xe); xe ô tô tải và ô tô chuyên dùng có khối lượng toàn bộ theo thiết kế đến 3.500 kg; các loại xe ô tô quy định cho giấy phép lái xe hạng B kéo rơ moóc có khối lượng toàn bộ theo thiết kế đến 750 kg; \n\nđ) Hạng C1 cấp cho người lái xe ô tô tải và ô tô chuyên dùng có khối lượng toàn bộ theo thiết kế trên 3.500 kg đến 7.500 kg; các loại xe ô tô tải quy định cho giấy phép lái xe hạng C1 kéo rơ moóc có khối lượng toàn bộ theo thiết kế đến 750 kg; các loại xe quy định cho giấy phép lái xe hạng B;\n\ne) Hạng C cấp cho người lái xe ô tô tải và ô tô chuyên dùng có khối lượng toàn bộ theo thiết kế trên 7.500 kg; các loại xe ô tô tải quy định cho giấy phép lái xe hạng C kéo rơ moóc có khối lượng toàn bộ theo thiết kế đến 750 kg; các loại xe quy định cho giấy phép lái xe hạng B và hạng C1;\n\ng) Hạng D1 cấp cho người lái xe ô tô chở người trên 08 chỗ (không kể chỗ của người lái xe) đến 16 chỗ (không kể chỗ của người lái xe); các loại xe ô tô chở người quy định cho giấy phép lái xe hạng D1 kéo rơ moóc có khối lượng toàn bộ theo thiết kế đến 750 kg; các loại xe quy định cho giấy phép lái xe các hạng B, C1, C;\n\nh) Hạng D2 cấp cho người lái xe ô tô chở người (kể cả xe buýt) trên 16 chỗ (không kể chỗ của người lái xe) đến 29 chỗ (không kể chỗ của người lái xe); các loại xe ô tô chở người quy định cho giấy phép lái xe hạng D2 kéo rơ moóc có khối lượng toàn bộ theo thiết kế đến 750 kg; các loại xe quy định cho giấy phép lái xe các hạng B, C1, C, D1;\n\ni) Hạng D cấp cho người lái xe ô tô chở người (kể cả xe buýt) trên 29 chỗ (không kể chỗ của người lái xe); xe ô tô chở người giường nằm; các loại xe ô tô chở người quy định cho giấy phép lái xe hạng D kéo rơ moóc có khối lượng toàn bộ theo thiết kế đến 750 kg; các loại xe quy định cho giấy phép lái xe các hạng B, C1, C, D1, D2;\n\nk) Hạng BE cấp cho người lái các loại xe ô tô quy định cho giấy phép lái xe hạng B kéo rơ moóc có khối lượng toàn bộ theo thiết kế trên 750 kg;\n\nl) Hạng C1E cấp cho người lái các loại xe ô tô quy định cho giấy phép lái xe hạng C1 kéo rơ moóc có khối lượng toàn bộ theo thiết kế trên 750 kg;\n\nm) Hạng CE cấp cho người lái các loại xe ô tô quy định cho giấy phép lái xe hạng C kéo rơ moóc có khối lượng toàn bộ theo thiết kế trên 750 kg; xe ô tô đầu kéo kéo sơ mi rơ moóc;\n\nn) Hạng D1E cấp cho người lái các loại xe ô tô quy định cho giấy phép lái xe hạng D1 kéo rơ moóc có khối lượng toàn bộ theo thiết kế trên 750 kg;\n\no) Hạng D2E cấp cho người lái các loại xe ô tô quy định cho giấy phép lái xe hạng D2 kéo rơ moóc có khối lượng toàn bộ theo thiết kế trên 750 kg;\n\np) Hạng DE cấp cho người lái các loại xe ô tô quy định cho giấy phép lái xe hạng D kéo rơ moóc có khối lượng toàn bộ theo thiết kế trên 750 kg; xe ô tô chở khách nối toa.\n\n2. Người khuyết tật điều khiển xe mô tô ba bánh dùng cho người khuyết tật được cấp giấy phép lái xe hạng A1.\n\nNgười khuyết tật điều khiển xe ô tô số tự động có kết cấu phù hợp với tình trạng khuyết tật thì được cấp giấy phép lái xe hạng B.\n\n3. Người điều khiển xe chở hàng bốn bánh có gắn động cơ, xe chở người bốn bánh có gắn động cơ phải sử dụng giấy phép lái xe có hạng phù hợp với xe ô tô tải hoặc xe ô tô chở người tương ứng.\n\n4. Người điều khiển xe ô tô có thiết kế, cải tạo với số chỗ ít hơn xe cùng loại, kích thước giới hạn tương đương phải sử dụng giấy phép lái xe có hạng phù hợp với xe ô tô cùng loại, kích thước giới hạn tương đương và có số chỗ nhiều nhất.\n\n5. Thời hạn của giấy phép lái xe được quy định như sau:\n\na) Giấy phép lái xe các hạng A1, A, B1 không thời hạn;\n\nb) Giấy phép lái xe hạng B và hạng C1 có thời hạn 10 năm kể từ ngày cấp;\n\nc) Giấy phép lái xe các hạng C, D1, D2, D, BE, C1E, CE, D1E, D2E và DE có thời hạn 05 năm kể từ ngày cấp.\n\n6. Giấy phép lái xe có giá trị sử dụng trong phạm vi lãnh thổ Việt Nam bao gồm:\n\na) Giấy phép lái xe do cơ quan có thẩm quyền của Việt Nam cấp;\n\nb) Giấy phép lái xe quốc tế và giấy phép lái xe quốc gia phù hợp với loại xe được phép điều khiển do quốc gia là thành viên của Công ước của Liên hợp quốc về Giao thông đường bộ năm 1968 (sau đây gọi là Công ước Viên) cấp;\n\nc) Giấy phép lái xe phù hợp với loại xe được phép điều khiển của nước hoặc vùng lãnh thổ mà Việt Nam ký kết điều ước quốc tế hoặc thỏa thuận quốc tế công nhận giấy phép lái xe của nhau;\n\nd) Giấy phép lái xe nước ngoài phù hợp với loại xe được phép điều khiển do quốc gia được công nhận theo điều ước quốc tế mà nước Cộng hòa xã hội chủ nghĩa Việt Nam là thành viên.\n\n7. Giấy phép lái xe không có hiệu lực trong các trường hợp sau đây:\n\na) Giấy phép lái xe hết thời hạn sử dụng;\n\nb) Giấy phép lái xe bị thu hồi theo quy định tại khoản 5 Điều 62 của Luật này.\n\n8. Giấy phép lái xe quốc tế được quy định như sau:\n\na) Giấy phép lái xe quốc tế là giấy phép lái xe do cơ quan nhà nước có thẩm quyền của quốc gia là thành viên của Công ước Viên cấp theo một mẫu thống nhất; có thời hạn không quá 03 năm kể từ ngày cấp và phải phù hợp với thời hạn còn hiệu lực của giấy phép lái xe quốc gia;']","**Nguồn văn bản:** /content/drive/MyDrive/ITProject_data/new_law/36_2024_QH15_444251.docx

**Tên văn bản:** (Không có tiêu đề trong metadata)

**(Không có điều khoản trong metadata):**

**Nội dung:**

1. Giấy phép lái xe bao gồm các hạng sau đây:

        a) Hạng A1 cấp cho người lái xe mô tô hai bánh có dung tích xi-lanh đến 125 cm3 hoặc có công suất động cơ điện đến 11 kW.

        b) Hạng A cấp cho người lái xe mô tô hai bánh có dung tích xi-lanh trên 125 cm3 hoặc có công suất động cơ điện trên 11 kW và các loại xe quy định cho giấy phép lái xe hạng A1.

        c) Hạng B1 cấp cho người lái xe mô tô ba bánh và các loại xe quy định cho giấy phép lái xe hạng A1.

        d) Hạng B cấp cho người lái xe ô tô chở người đến 08 chỗ (không kể chỗ của người lái xe); xe ô tô tải và ô tô chuyên dùng có khối lượng toàn bộ theo thiết kế đến 3.500 kg; các loại xe ô tô quy định cho giấy phép lái xe hạng B kéo rơ moóc có khối lượng toàn bộ theo thiết kế đến 750 kg.

        đ) Hạng C1 cấp cho người lái xe ô tô tải và ô tô chuyên dùng có khối lượng toàn bộ theo thiết kế trên 3.500 kg đến 7.500 kg; các loại xe ô tô tải quy định cho giấy phép lái xe hạng C1 kéo rơ moóc có khối lượng toàn bộ theo thiết kế đến 750 kg; các loại xe quy định cho giấy phép lái xe hạng B.

        e) Hạng C cấp cho người lái xe ô tô tải và ô tô chuyên dùng có khối lượng toàn bộ theo thiết kế trên 7.500 kg; các loại xe ô tô tải quy định cho giấy phép lái xe hạng C kéo rơ moóc có khối lượng toàn bộ theo thiết kế đến 750 kg; các loại xe quy định cho giấy phép lái xe hạng B và hạng C1.

        g) Hạng D1 cấp cho người lái xe ô tô chở người trên 08 chỗ (không kể chỗ của người lái xe) đến 16 chỗ (không kể chỗ của người lái xe); các loại xe ô tô chở người quy định cho giấy phép lái xe hạng D1 kéo rơ moóc có khối lượng toàn bộ theo thiết kế đến 750 kg; các loại xe quy định cho giấy phép lái xe các hạng B, C1, C.

        h) Hạng D2 cấp cho người lái xe ô tô chở người (kể cả xe buýt) trên 16 chỗ (không kể chỗ của người lái xe) đến 29 chỗ (không kể chỗ của người lái xe); các loại xe ô tô chở người quy định cho giấy phép lái xe hạng D2 kéo rơ moóc có khối lượng toàn bộ theo thiết kế đến 750 kg; các loại xe quy định cho giấy phép lái xe các hạng B, C1, C, D1.

        i) Hạng D cấp cho người lái xe ô tô chở người (kể cả xe buýt) trên 29 chỗ (không kể chỗ của người lái xe); xe ô tô chở người giường nằm; các loại xe ô tô chở người quy định cho giấy phép lái xe hạng D kéo rơ moóc có khối lượng toàn bộ theo thiết kế đến 750 kg; các loại xe quy định cho giấy phép lái xe các hạng B, C1, C, D1, D2.

        k) Hạng BE cấp cho người lái các loại xe ô tô quy định cho giấy phép lái xe hạng B kéo rơ moóc có khối lượng toàn bộ theo thiết kế trên 750 kg.

        l) Hạng C1E cấp cho người lái các loại xe ô tô quy định cho giấy phép lái xe hạng C1 kéo rơ moóc có khối lượng toàn bộ theo thiết kế trên 750 kg.

        m) Hạng CE cấp cho người lái các loại xe ô tô quy định cho giấy phép lái xe hạng C kéo rơ moóc có khối lượng toàn bộ theo thiết kế trên 750 kg; xe ô tô đầu kéo kéo sơ mi rơ moóc.

        n) Hạng D1E cấp cho người lái các loại xe ô tô quy định cho giấy phép lái xe hạng D1 kéo rơ moóc có khối lượng toàn bộ theo thiết kế trên 750 kg.

        o) Hạng D2E cấp cho người lái các loại xe ô tô quy định cho giấy phép lái xe hạng D2 kéo rơ moóc có khối lượng toàn bộ theo thiết kế trên 750 kg.

        p) Hạng DE cấp cho người lái các loại xe ô tô quy định cho giấy phép lái xe hạng D kéo rơ moóc có khối lượng toàn bộ theo thiết kế trên 750 kg; xe ô tô chở khách nối toa.


2. Người khuyết tật điều khiển xe mô tô ba bánh dùng cho người khuyết tật được cấp giấy phép lái xe hạng A1.

Người khuyết tật điều khiển xe ô tô số tự động có kết cấu phù hợp với tình trạng khuyết tật thì được cấp giấy phép lái xe hạng B.


3. Người điều khiển xe chở hàng bốn bánh có gắn động cơ, xe chở người bốn bánh có gắn động cơ phải sử dụng giấy phép lái xe có hạng phù hợp với xe ô tô tải hoặc xe ô tô chở người tương ứng.


4. Người điều khiển xe ô tô có thiết kế, cải tạo với số chỗ ít hơn xe cùng loại, kích thước giới hạn tương đương phải sử dụng giấy phép lái xe có hạng phù hợp với xe ô tô cùng loại, kích thước giới hạn tương đương và có số chỗ nhiều nhất.


5. Thời hạn của giấy phép lái xe được quy định như sau:

        a) Giấy phép lái xe các hạng A1, A, B1 không thời hạn.

        b) Giấy phép lái xe hạng B và hạng C1 có thời hạn 10 năm kể từ ngày cấp.

        c) Giấy phép lái xe các hạng C, D1, D2, D, BE, C1E, CE, D1E, D2E và DE có thời hạn 05 năm kể từ ngày cấp.


6. Giấy phép lái xe có giá trị sử dụng trong phạm vi lãnh thổ Việt Nam bao gồm:
        a) Giấy phép lái xe do cơ quan có thẩm quyền của Việt Nam cấp.

        b) Giấy phép lái xe quốc tế và giấy phép lái xe quốc gia phù hợp với loại xe được phép điều khiển do quốc gia là thành viên của Công ước của Liên hợp quốc về Giao thông đường bộ năm 1968 (sau đây gọi là Công ước Viên) cấp.

        c) Giấy phép lái xe phù hợp với loại xe được phép điều khiển của nước hoặc vùng lãnh thổ mà Việt Nam ký kết điều ước quốc tế hoặc thỏa thuận quốc tế công nhận giấy phép lái xe của nhau.

        d) Giấy phép lái xe nước ngoài phù hợp với loại xe được phép điều khiển do quốc gia được công nhận theo điều ước quốc tế mà nước Cộng hòa xã hội chủ nghĩa Việt Nam là thành viên.


7. Giấy phép lái xe không có hiệu lực trong các trường hợp sau đây:

        a) Giấy phép lái xe hết thời hạn sử dụng.

        b) Giấy phép lái xe bị thu hồi theo quy định tại khoản 5 Điều 62 của Luật này.


8. Giấy phép lái xe quốc tế được quy định như sau:

        a) Giấy phép lái xe quốc tế là giấy phép lái xe do cơ quan nhà nước có thẩm quyền của quốc gia là thành viên của Công ước Viên cấp theo một mẫu thống nhất; có thời hạn không quá 03 năm kể từ ngày cấp và phải phù hợp với thời hạn còn hiệu lực của giấy phép lái xe quốc gia.


**Tóm lại:** Giấy phép lái xe hạng A1 được cấp cho người lái xe mô tô hai bánh có dung tích xi lanh đến 125 cm3 hoặc có công suất động cơ điện đến 11 kW. Người khuyết tật điều khiển xe mô tô ba bánh dùng cho người khuyết tật cũng được cấp giấy phép lái xe hạng A1.
","**Nguồn văn bản:** 36_2024_QH15_444251

**Tên văn bản:** Luật Trật tự, an toàn giao thông đường bộ

**Điều 57:** Giấy phép lái xe

**Nội dung:**

1. Giấy phép lái xe bao gồm các hạng sau đây:

	a) Hạng A1 cấp cho người lái xe mô tô hai bánh có dung tích xi-lanh đến 125 cm3 hoặc có công suất động cơ điện đến 11 kw.

	b) Hạng A cấp cho người lái xe mô tô hai bánh có dung tích xi-lanh trên 125 cm3 hoặc có công suất động cơ điện trên 11 kw và các loại xe quy định cho giấy phép lái xe hạng A1.

	c) Hạng B1 cấp cho người lái xe mô tô ba bánh và các loại xe quy định cho giấy phép lái xe hạng A1.

	d) Hạng B cấp cho người lái xe ô tô chở người đến 08 chỗ (không kể chỗ của người lái xe); xe ô tô tải và ô tô chuyên dùng có khối lượng toàn bộ theo thiết kế đến 3.500 kg; các loại xe ô tô quy định cho giấy phép lái xe hạng B kéo rơ moóc có khối lượng toàn bộ theo thiết kế đến 750 kg.

	đ) Hạng C1 cấp cho người lái xe ô tô tải và ô tô chuyên dùng có khối lượng toàn bộ theo thiết kế trên 3.500 kg đến 7.500 kg; các loại xe ô tô tải quy định cho giấy phép lái xe hạng C1 kéo rơ moóc có khối lượng toàn bộ theo thiết kế đến 750 kg; các loại xe quy định cho giấy phép lái xe hạng B.

	e) Hạng C cấp cho người lái xe ô tô tải và ô tô chuyên dùng có khối lượng toàn bộ theo thiết kế trên 7.500 kg; các loại xe ô tô tải quy định cho giấy phép lái xe hạng C kéo rơ moóc có khối lượng toàn bộ theo thiết kế đến 750 kg; các loại xe quy định cho giấy phép lái xe hạng B và hạng C1.

	g) Hạng D1 cấp cho người lái xe ô tô chở người trên 08 chỗ (không kể chỗ của người lái xe) đến 16 chỗ (không kể chỗ của người lái xe); các loại xe ô tô chở người quy định cho giấy phép lái xe hạng D1 kéo rơ moóc có khối lượng toàn bộ theo thiết kế đến 750 kg; các loại xe quy định cho giấy phép lái xe các hạng B, C1, C.

	h) Hạng D2 cấp cho người lái xe ô tô chở người (kể cả xe buýt) trên 16 chỗ (không kể chỗ của người lái xe) đến 29 chỗ (không kể chỗ của người lái xe); các loại xe ô tô chở người quy định cho giấy phép lái xe hạng D2 kéo rơ moóc có khối lượng toàn bộ theo thiết kế đến 750 kg; các loại xe quy định cho giấy phép lái xe các hạng B, C1, C, D1.
	
	i) Hạng D cấp cho người lái xe ô tô chở người (kể cả xe buýt) trên 29 chỗ (không kể chỗ của người lái xe); xe ô tô chở người giường nằm; các loại xe ô tô chở người quy định cho giấy phép lái xe hạng D kéo rơ moóc có khối lượng toàn bộ theo thiết kế đến 750 kg; các loại xe quy định cho giấy phép lái xe các hạng B, C1, C, D1, D2.

	k) Hạng BE cấp cho người lái các loại xe ô tô quy định cho giấy phép lái xe hạng B kéo rơ moóc có khối lượng toàn bộ theo thiết kế trên 750 kg.

	l) Hạng C1E cấp cho người lái các loại xe ô tô quy định cho giấy phép lái xe hạng C1 kéo rơ moóc có khối lượng toàn bộ theo thiết kế trên 750 kg.

	m) Hạng CE cấp cho người lái các loại xe ô tô quy định cho giấy phép lái xe hạng C kéo rơ moóc có khối lượng toàn bộ theo thiết kế trên 750 kg; xe ô tô đầu kéo kéo sơ mi rơ moóc.

	n) Hạng D1E cấp cho người lái các loại xe ô tô quy định cho giấy phép lái xe hạng D1 kéo rơ moóc có khối lượng toàn bộ theo thiết kế trên 750 kg.

	o) Hạng D2E cấp cho người lái các loại xe ô tô quy định cho giấy phép lái xe hạng D2 kéo rơ moóc có khối lượng toàn bộ theo thiết kế trên 750 kg.

	p) Hạng DE cấp cho người lái các loại xe ô tô quy định cho giấy phép lái xe hạng D kéo rơ moóc có khối lượng toàn bộ theo thiết kế trên 750 kg; xe ô tô chở khách nối toa.


2. Người khuyết tật điều khiển xe mô tô ba bánh dùng cho người khuyết tật được cấp giấy phép lái xe hạng A1. Người khuyết tật điều khiển xe ô tô số tự động có kết cấu phù hợp với tình trạng khuyết tật thì được cấp giấy phép lái xe hạng B.

3. Người điều khiển xe chở hàng bốn bánh có gắn động cơ, xe chở người bốn bánh có gắn động cơ phải sử dụng giấy phép lái xe có hạng phù hợp với xe ô tô tải hoặc xe ô tô chở người tương ứng.

4. Người điều khiển xe ô tô có thiết kế, cải tạo với số chỗ ít hơn xe cùng loại, kích thước giới hạn tương đương phải sử dụng giấy phép lái xe có hạng phù hợp với xe ô tô cùng loại, kích thước giới hạn tương đương và có số chỗ nhiều nhất.

5. Thời hạn của giấy phép lái xe được quy định như sau:

	a) Giấy phép lái xe các hạng A1, A, B1 không thời hạn.

	b) Giấy phép lái xe hạng B và hạng C1 có thời hạn 10 năm kể từ ngày cấp.

	c) Giấy phép lái xe các hạng C, D1, D2, D, BE, C1E, CE, D1E, D2E và DE có thời hạn 05 năm kể từ ngày cấp.


**Tóm lại:** Giấy phép lái xe hạng A1 được cấp cho người lái xe mô tô hai bánh có dung tích xi lanh đến 125 cm3 hoặc có công suất động cơ điện đến 11 kw.  Người khuyết tật điều khiển xe mô tô ba bánh dùng cho người khuyết tật cũng được cấp giấy phép lái xe hạng A1.
",1.0,0.6735565668117952,0.8571428571428571,0.9999999999
2,Thời hạn của giấy phép lái xe hạng B theo Luật Giao thông Đường bộ 2025 là bao lâu?,"['a) Chứng nhận đăng ký xe hoặc bản sao Chứng nhận đăng ký xe có chứng thực kèm bản gốc giấy tờ xác nhận của tổ chức tín dụng, chi nhánh ngân hàng nước ngoài còn hiệu lực trong trường hợp xe đang được thế chấp tại tổ chức tín dụng, chi nhánh ngân hàng nước ngoài;\n\nb) Giấy phép lái xe phù hợp với loại xe đang điều khiển;\n\nc) Chứng nhận kiểm định an toàn kỹ thuật và bảo vệ môi trường đối với xe cơ giới theo quy định của pháp luật;\n\nd) Chứng nhận bảo hiểm bắt buộc trách nhiệm dân sự của chủ xe cơ giới.\n\n2. Người điều khiển xe máy chuyên dùng tham gia giao thông đường bộ phải đủ tuổi, sức khỏe theo quy định của pháp luật; có bằng hoặc chứng chỉ điều khiển xe máy chuyên dùng phù hợp loại xe máy chuyên dùng đang điều khiển; có giấy phép lái xe đang còn điểm, còn hiệu lực hoặc chứng chỉ bồi dưỡng kiến thức pháp luật về giao thông đường bộ. Khi tham gia giao thông đường bộ, người điều khiển xe máy chuyên dùng phải mang theo các loại giấy tờ sau đây:\n\na) Chứng nhận đăng ký xe hoặc bản sao Chứng nhận đăng ký xe có chứng thực kèm bản gốc Giấy biên nhận còn hiệu lực của tổ chức tín dụng, chi nhánh ngân hàng nước ngoài trong trường hợp xe đang được thế chấp tại tổ chức tín dụng, chi nhánh ngân hàng nước ngoài;\n\nb) Bằng hoặc chứng chỉ điều khiển xe máy chuyên dùng;\n\nc) Giấy phép lái xe hoặc chứng chỉ bồi dưỡng kiến thức pháp luật về giao thông đường bộ;\n\nd) Chứng nhận kiểm định an toàn kỹ thuật và bảo vệ môi trường đối với xe máy chuyên dùng theo quy định của pháp luật;\n\nđ) Chứng nhận bảo hiểm bắt buộc trách nhiệm dân sự theo quy định của pháp luật.\n\n3. Trường hợp giấy tờ quy định tại khoản 1 và khoản 2 Điều này đã được tích hợp vào tài khoản định danh điện tử thì việc xuất trình, kiểm tra có thể thực hiện thông qua tài khoản định danh điện tử.\n\n4. Người lái xe gắn máy tham gia giao thông đường bộ phải hiểu biết quy tắc giao thông đường bộ, có kỹ năng điều khiển phương tiện; đủ điều kiện về độ tuổi, sức khỏe theo quy định tại điểm a khoản 1 và khoản 2 Điều 59 của Luật này.\n\n5. Người tập lái xe ô tô, người dự sát hạch lái xe ô tô khi tham gia giao thông đường bộ phải thực hành trên xe tập lái, xe sát hạch trên tuyến đường tập lái, tuyến đường sát hạch, có giáo viên dạy lái hoặc sát hạch viên bảo trợ tay lái. Giáo viên dạy lái, sát hạch viên phải mang theo các loại giấy tờ quy định tại khoản 1 Điều này.\n\nĐiều 57. Giấy phép lái xe\n\n1. Giấy phép lái xe bao gồm các hạng sau đây:\n\na) Hạng A1 cấp cho người lái xe mô tô hai bánh có dung tích xi-lanh đến 125 cm3 hoặc có công suất động cơ điện đến 11 kW;\n\nb) Hạng A cấp cho người lái xe mô tô hai bánh có dung tích xi-lanh\xa0 trên 125 cm3\xa0hoặc có công suất động cơ điện trên 11 kW và các loại xe quy định cho giấy phép lái xe hạng A1;\n\nc) Hạng B1 cấp cho người lái xe mô tô ba bánh và các loại xe quy định cho giấy phép lái xe hạng A1;\n\nd) Hạng B cấp cho người lái xe ô tô chở người đến 08 chỗ (không kể chỗ của người lái xe); xe ô tô tải và ô tô chuyên dùng có khối lượng toàn bộ theo thiết kế đến 3.500 kg; các loại xe ô tô quy định cho giấy phép lái xe hạng B kéo rơ moóc có khối lượng toàn bộ theo thiết kế đến 750 kg; \n\nđ) Hạng C1 cấp cho người lái xe ô tô tải và ô tô chuyên dùng có khối lượng toàn bộ theo thiết kế trên 3.500 kg đến 7.500 kg; các loại xe ô tô tải quy định cho giấy phép lái xe hạng C1 kéo rơ moóc có khối lượng toàn bộ theo thiết kế đến 750 kg; các loại xe quy định cho giấy phép lái xe hạng B;\n\ne) Hạng C cấp cho người lái xe ô tô tải và ô tô chuyên dùng có khối lượng toàn bộ theo thiết kế trên 7.500 kg; các loại xe ô tô tải quy định cho giấy phép lái xe hạng C kéo rơ moóc có khối lượng toàn bộ theo thiết kế đến 750 kg; các loại xe quy định cho giấy phép lái xe hạng B và hạng C1;\n\ng) Hạng D1 cấp cho người lái xe ô tô chở người trên 08 chỗ (không kể chỗ của người lái xe) đến 16 chỗ (không kể chỗ của người lái xe); các loại xe ô tô chở người quy định cho giấy phép lái xe hạng D1 kéo rơ moóc có khối lượng toàn bộ theo thiết kế đến 750 kg; các loại xe quy định cho giấy phép lái xe các hạng B, C1, C;\n\nh) Hạng D2 cấp cho người lái xe ô tô chở người (kể cả xe buýt) trên 16 chỗ (không kể chỗ của người lái xe) đến 29 chỗ (không kể chỗ của người lái xe); các loại xe ô tô chở người quy định cho giấy phép lái xe hạng D2 kéo rơ moóc có khối lượng toàn bộ theo thiết kế đến 750 kg; các loại xe quy định cho giấy phép lái xe các hạng B, C1, C, D1;\n\ni) Hạng D cấp cho người lái xe ô tô chở người (kể cả xe buýt) trên 29 chỗ (không kể chỗ của người lái xe); xe ô tô chở người giường nằm; các loại xe ô tô chở người quy định cho giấy phép lái xe hạng D kéo rơ moóc có khối lượng toàn bộ theo thiết kế đến 750 kg; các loại xe quy định cho giấy phép lái xe các hạng B, C1, C, D1, D2;\n\nk) Hạng BE cấp cho người lái các loại xe ô tô quy định cho giấy phép lái xe hạng B kéo rơ moóc có khối lượng toàn bộ theo thiết kế trên 750 kg;\n\nl) Hạng C1E cấp cho người lái các loại xe ô tô quy định cho giấy phép lái xe hạng C1 kéo rơ moóc có khối lượng toàn bộ theo thiết kế trên 750 kg;\n\nm) Hạng CE cấp cho người lái các loại xe ô tô quy định cho giấy phép lái xe hạng C kéo rơ moóc có khối lượng toàn bộ theo thiết kế trên 750 kg; xe ô tô đầu kéo kéo sơ mi rơ moóc;\n\nn) Hạng D1E cấp cho người lái các loại xe ô tô quy định cho giấy phép lái xe hạng D1 kéo rơ moóc có khối lượng toàn bộ theo thiết kế trên 750 kg;\n\no) Hạng D2E cấp cho người lái các loại xe ô tô quy định cho giấy phép lái xe hạng D2 kéo rơ moóc có khối lượng toàn bộ theo thiết kế trên 750 kg;\n\np) Hạng DE cấp cho người lái các loại xe ô tô quy định cho giấy phép lái xe hạng D kéo rơ moóc có khối lượng toàn bộ theo thiết kế trên 750 kg; xe ô tô chở khách nối toa.\n\n2. Người khuyết tật điều khiển xe mô tô ba bánh dùng cho người khuyết tật được cấp giấy phép lái xe hạng A1.\n\nNgười khuyết tật điều khiển xe ô tô số tự động có kết cấu phù hợp với tình trạng khuyết tật thì được cấp giấy phép lái xe hạng B.\n\n3. Người điều khiển xe chở hàng bốn bánh có gắn động cơ, xe chở người bốn bánh có gắn động cơ phải sử dụng giấy phép lái xe có hạng phù hợp với xe ô tô tải hoặc xe ô tô chở người tương ứng.\n\n4. Người điều khiển xe ô tô có thiết kế, cải tạo với số chỗ ít hơn xe cùng loại, kích thước giới hạn tương đương phải sử dụng giấy phép lái xe có hạng phù hợp với xe ô tô cùng loại, kích thước giới hạn tương đương và có số chỗ nhiều nhất.\n\n5. Thời hạn của giấy phép lái xe được quy định như sau:\n\na) Giấy phép lái xe các hạng A1, A, B1 không thời hạn;\n\nb) Giấy phép lái xe hạng B và hạng C1 có thời hạn 10 năm kể từ ngày cấp;\n\nc) Giấy phép lái xe các hạng C, D1, D2, D, BE, C1E, CE, D1E, D2E và DE có thời hạn 05 năm kể từ ngày cấp.\n\n6. Giấy phép lái xe có giá trị sử dụng trong phạm vi lãnh thổ Việt Nam bao gồm:\n\na) Giấy phép lái xe do cơ quan có thẩm quyền của Việt Nam cấp;\n\nb) Giấy phép lái xe quốc tế và giấy phép lái xe quốc gia phù hợp với loại xe được phép điều khiển do quốc gia là thành viên của Công ước của Liên hợp quốc về Giao thông đường bộ năm 1968 (sau đây gọi là Công ước Viên) cấp;\n\nc) Giấy phép lái xe phù hợp với loại xe được phép điều khiển của nước hoặc vùng lãnh thổ mà Việt Nam ký kết điều ước quốc tế hoặc thỏa thuận quốc tế công nhận giấy phép lái xe của nhau;\n\nd) Giấy phép lái xe nước ngoài phù hợp với loại xe được phép điều khiển do quốc gia được công nhận theo điều ước quốc tế mà nước Cộng hòa xã hội chủ nghĩa Việt Nam là thành viên.\n\n7. Giấy phép lái xe không có hiệu lực trong các trường hợp sau đây:\n\na) Giấy phép lái xe hết thời hạn sử dụng;\n\nb) Giấy phép lái xe bị thu hồi theo quy định tại khoản 5 Điều 62 của Luật này.\n\n8. Giấy phép lái xe quốc tế được quy định như sau:\n\na) Giấy phép lái xe quốc tế là giấy phép lái xe do cơ quan nhà nước có thẩm quyền của quốc gia là thành viên của Công ước Viên cấp theo một mẫu thống nhất; có thời hạn không quá 03 năm kể từ ngày cấp và phải phù hợp với thời hạn còn hiệu lực của giấy phép lái xe quốc gia;']","**Nguồn văn bản:** /content/drive/MyDrive/ITProject_data/new_law/36_2024_QH15_444251.docx

**Tên văn bản:** (Không có tiêu đề trong metadata)


**Nội dung:**

5. Thời hạn của giấy phép lái xe được quy định như sau:

	a) Giấy phép lái xe các hạng A1, A, B1 không thời hạn.

	b) Giấy phép lái xe hạng B và hạng C1 có thời hạn 10 năm kể từ ngày cấp.

	c) Giấy phép lái xe các hạng C, D1, D2, D, BE, C1E, CE, D1E, D2E và DE có thời hạn 05 năm kể từ ngày cấp.


Tóm lại: Thời hạn của giấy phép lái xe hạng B là 10 năm kể từ ngày cấp.
","**Nguồn văn bản:** 36_2024_QH15_444251

**Tên văn bản:** Luật Trật tự, an toàn giao thông đường bộ

**Điều 57:** Giấy phép lái xe

**Nội dung:**

5. Thời hạn của giấy phép lái xe được quy định như sau:

	a) Giấy phép lái xe các hạng A1, A, B1 không thời hạn.

	b) Giấy phép lái xe hạng B và hạng C1 có thời hạn 10 năm kể từ ngày cấp.

	c) Giấy phép lái xe các hạng C, D1, D2, D, BE, C1E, CE, D1E, D2E và DE có thời hạn 05 năm kể từ ngày cấp.


**Tóm lại:** Giấy phép lái xe hạng B có thời hạn 10 năm.
",0.7142857142857143,0.8427394493788628,0.6666666666666666,0.9999999999
3,Giấy phép lái xe hạng C1 có thời hạn bao lâu?,"['a) Chứng nhận đăng ký xe hoặc bản sao Chứng nhận đăng ký xe có chứng thực kèm bản gốc giấy tờ xác nhận của tổ chức tín dụng, chi nhánh ngân hàng nước ngoài còn hiệu lực trong trường hợp xe đang được thế chấp tại tổ chức tín dụng, chi nhánh ngân hàng nước ngoài;\n\nb) Giấy phép lái xe phù hợp với loại xe đang điều khiển;\n\nc) Chứng nhận kiểm định an toàn kỹ thuật và bảo vệ môi trường đối với xe cơ giới theo quy định của pháp luật;\n\nd) Chứng nhận bảo hiểm bắt buộc trách nhiệm dân sự của chủ xe cơ giới.\n\n2. Người điều khiển xe máy chuyên dùng tham gia giao thông đường bộ phải đủ tuổi, sức khỏe theo quy định của pháp luật; có bằng hoặc chứng chỉ điều khiển xe máy chuyên dùng phù hợp loại xe máy chuyên dùng đang điều khiển; có giấy phép lái xe đang còn điểm, còn hiệu lực hoặc chứng chỉ bồi dưỡng kiến thức pháp luật về giao thông đường bộ. Khi tham gia giao thông đường bộ, người điều khiển xe máy chuyên dùng phải mang theo các loại giấy tờ sau đây:\n\na) Chứng nhận đăng ký xe hoặc bản sao Chứng nhận đăng ký xe có chứng thực kèm bản gốc Giấy biên nhận còn hiệu lực của tổ chức tín dụng, chi nhánh ngân hàng nước ngoài trong trường hợp xe đang được thế chấp tại tổ chức tín dụng, chi nhánh ngân hàng nước ngoài;\n\nb) Bằng hoặc chứng chỉ điều khiển xe máy chuyên dùng;\n\nc) Giấy phép lái xe hoặc chứng chỉ bồi dưỡng kiến thức pháp luật về giao thông đường bộ;\n\nd) Chứng nhận kiểm định an toàn kỹ thuật và bảo vệ môi trường đối với xe máy chuyên dùng theo quy định của pháp luật;\n\nđ) Chứng nhận bảo hiểm bắt buộc trách nhiệm dân sự theo quy định của pháp luật.\n\n3. Trường hợp giấy tờ quy định tại khoản 1 và khoản 2 Điều này đã được tích hợp vào tài khoản định danh điện tử thì việc xuất trình, kiểm tra có thể thực hiện thông qua tài khoản định danh điện tử.\n\n4. Người lái xe gắn máy tham gia giao thông đường bộ phải hiểu biết quy tắc giao thông đường bộ, có kỹ năng điều khiển phương tiện; đủ điều kiện về độ tuổi, sức khỏe theo quy định tại điểm a khoản 1 và khoản 2 Điều 59 của Luật này.\n\n5. Người tập lái xe ô tô, người dự sát hạch lái xe ô tô khi tham gia giao thông đường bộ phải thực hành trên xe tập lái, xe sát hạch trên tuyến đường tập lái, tuyến đường sát hạch, có giáo viên dạy lái hoặc sát hạch viên bảo trợ tay lái. Giáo viên dạy lái, sát hạch viên phải mang theo các loại giấy tờ quy định tại khoản 1 Điều này.\n\nĐiều 57. Giấy phép lái xe\n\n1. Giấy phép lái xe bao gồm các hạng sau đây:\n\na) Hạng A1 cấp cho người lái xe mô tô hai bánh có dung tích xi-lanh đến 125 cm3 hoặc có công suất động cơ điện đến 11 kW;\n\nb) Hạng A cấp cho người lái xe mô tô hai bánh có dung tích xi-lanh\xa0 trên 125 cm3\xa0hoặc có công suất động cơ điện trên 11 kW và các loại xe quy định cho giấy phép lái xe hạng A1;\n\nc) Hạng B1 cấp cho người lái xe mô tô ba bánh và các loại xe quy định cho giấy phép lái xe hạng A1;\n\nd) Hạng B cấp cho người lái xe ô tô chở người đến 08 chỗ (không kể chỗ của người lái xe); xe ô tô tải và ô tô chuyên dùng có khối lượng toàn bộ theo thiết kế đến 3.500 kg; các loại xe ô tô quy định cho giấy phép lái xe hạng B kéo rơ moóc có khối lượng toàn bộ theo thiết kế đến 750 kg; \n\nđ) Hạng C1 cấp cho người lái xe ô tô tải và ô tô chuyên dùng có khối lượng toàn bộ theo thiết kế trên 3.500 kg đến 7.500 kg; các loại xe ô tô tải quy định cho giấy phép lái xe hạng C1 kéo rơ moóc có khối lượng toàn bộ theo thiết kế đến 750 kg; các loại xe quy định cho giấy phép lái xe hạng B;\n\ne) Hạng C cấp cho người lái xe ô tô tải và ô tô chuyên dùng có khối lượng toàn bộ theo thiết kế trên 7.500 kg; các loại xe ô tô tải quy định cho giấy phép lái xe hạng C kéo rơ moóc có khối lượng toàn bộ theo thiết kế đến 750 kg; các loại xe quy định cho giấy phép lái xe hạng B và hạng C1;\n\ng) Hạng D1 cấp cho người lái xe ô tô chở người trên 08 chỗ (không kể chỗ của người lái xe) đến 16 chỗ (không kể chỗ của người lái xe); các loại xe ô tô chở người quy định cho giấy phép lái xe hạng D1 kéo rơ moóc có khối lượng toàn bộ theo thiết kế đến 750 kg; các loại xe quy định cho giấy phép lái xe các hạng B, C1, C;\n\nh) Hạng D2 cấp cho người lái xe ô tô chở người (kể cả xe buýt) trên 16 chỗ (không kể chỗ của người lái xe) đến 29 chỗ (không kể chỗ của người lái xe); các loại xe ô tô chở người quy định cho giấy phép lái xe hạng D2 kéo rơ moóc có khối lượng toàn bộ theo thiết kế đến 750 kg; các loại xe quy định cho giấy phép lái xe các hạng B, C1, C, D1;\n\ni) Hạng D cấp cho người lái xe ô tô chở người (kể cả xe buýt) trên 29 chỗ (không kể chỗ của người lái xe); xe ô tô chở người giường nằm; các loại xe ô tô chở người quy định cho giấy phép lái xe hạng D kéo rơ moóc có khối lượng toàn bộ theo thiết kế đến 750 kg; các loại xe quy định cho giấy phép lái xe các hạng B, C1, C, D1, D2;\n\nk) Hạng BE cấp cho người lái các loại xe ô tô quy định cho giấy phép lái xe hạng B kéo rơ moóc có khối lượng toàn bộ theo thiết kế trên 750 kg;\n\nl) Hạng C1E cấp cho người lái các loại xe ô tô quy định cho giấy phép lái xe hạng C1 kéo rơ moóc có khối lượng toàn bộ theo thiết kế trên 750 kg;\n\nm) Hạng CE cấp cho người lái các loại xe ô tô quy định cho giấy phép lái xe hạng C kéo rơ moóc có khối lượng toàn bộ theo thiết kế trên 750 kg; xe ô tô đầu kéo kéo sơ mi rơ moóc;\n\nn) Hạng D1E cấp cho người lái các loại xe ô tô quy định cho giấy phép lái xe hạng D1 kéo rơ moóc có khối lượng toàn bộ theo thiết kế trên 750 kg;\n\no) Hạng D2E cấp cho người lái các loại xe ô tô quy định cho giấy phép lái xe hạng D2 kéo rơ moóc có khối lượng toàn bộ theo thiết kế trên 750 kg;\n\np) Hạng DE cấp cho người lái các loại xe ô tô quy định cho giấy phép lái xe hạng D kéo rơ moóc có khối lượng toàn bộ theo thiết kế trên 750 kg; xe ô tô chở khách nối toa.\n\n2. Người khuyết tật điều khiển xe mô tô ba bánh dùng cho người khuyết tật được cấp giấy phép lái xe hạng A1.\n\nNgười khuyết tật điều khiển xe ô tô số tự động có kết cấu phù hợp với tình trạng khuyết tật thì được cấp giấy phép lái xe hạng B.\n\n3. Người điều khiển xe chở hàng bốn bánh có gắn động cơ, xe chở người bốn bánh có gắn động cơ phải sử dụng giấy phép lái xe có hạng phù hợp với xe ô tô tải hoặc xe ô tô chở người tương ứng.\n\n4. Người điều khiển xe ô tô có thiết kế, cải tạo với số chỗ ít hơn xe cùng loại, kích thước giới hạn tương đương phải sử dụng giấy phép lái xe có hạng phù hợp với xe ô tô cùng loại, kích thước giới hạn tương đương và có số chỗ nhiều nhất.\n\n5. Thời hạn của giấy phép lái xe được quy định như sau:\n\na) Giấy phép lái xe các hạng A1, A, B1 không thời hạn;\n\nb) Giấy phép lái xe hạng B và hạng C1 có thời hạn 10 năm kể từ ngày cấp;\n\nc) Giấy phép lái xe các hạng C, D1, D2, D, BE, C1E, CE, D1E, D2E và DE có thời hạn 05 năm kể từ ngày cấp.\n\n6. Giấy phép lái xe có giá trị sử dụng trong phạm vi lãnh thổ Việt Nam bao gồm:\n\na) Giấy phép lái xe do cơ quan có thẩm quyền của Việt Nam cấp;\n\nb) Giấy phép lái xe quốc tế và giấy phép lái xe quốc gia phù hợp với loại xe được phép điều khiển do quốc gia là thành viên của Công ước của Liên hợp quốc về Giao thông đường bộ năm 1968 (sau đây gọi là Công ước Viên) cấp;\n\nc) Giấy phép lái xe phù hợp với loại xe được phép điều khiển của nước hoặc vùng lãnh thổ mà Việt Nam ký kết điều ước quốc tế hoặc thỏa thuận quốc tế công nhận giấy phép lái xe của nhau;\n\nd) Giấy phép lái xe nước ngoài phù hợp với loại xe được phép điều khiển do quốc gia được công nhận theo điều ước quốc tế mà nước Cộng hòa xã hội chủ nghĩa Việt Nam là thành viên.\n\n7. Giấy phép lái xe không có hiệu lực trong các trường hợp sau đây:\n\na) Giấy phép lái xe hết thời hạn sử dụng;\n\nb) Giấy phép lái xe bị thu hồi theo quy định tại khoản 5 Điều 62 của Luật này.\n\n8. Giấy phép lái xe quốc tế được quy định như sau:\n\na) Giấy phép lái xe quốc tế là giấy phép lái xe do cơ quan nhà nước có thẩm quyền của quốc gia là thành viên của Công ước Viên cấp theo một mẫu thống nhất; có thời hạn không quá 03 năm kể từ ngày cấp và phải phù hợp với thời hạn còn hiệu lực của giấy phép lái xe quốc gia;']","**Nguồn văn bản:** /content/drive/MyDrive/ITProject_data/new_law/36_2024_QH15_444251.docx

**Tên văn bản:** (Không có tiêu đề trong metadata)


**Nội dung:**

5. Thời hạn của giấy phép lái xe được quy định như sau:

	a) Giấy phép lái xe các hạng A1, A, B1 không thời hạn.

	b) Giấy phép lái xe hạng B và hạng C1 có thời hạn 10 năm kể từ ngày cấp.

	c) Giấy phép lái xe các hạng C, D1, D2, D, BE, C1E, CE, D1E, D2E và DE có thời hạn 05 năm kể từ ngày cấp.


Tóm lại: Giấy phép lái xe hạng C1 có thời hạn 10 năm kể từ ngày cấp.
","**Nguồn văn bản:** 36_2024_QH15_444251

**Tên văn bản:** Luật Trật tự, an toàn giao thông đường bộ

**Điều 57:** Giấy phép lái xe

**Nội dung:**

5. Thời hạn của giấy phép lái xe được quy định như sau:

	a) Giấy phép lái xe các hạng A1, A, B1 không thời hạn.

	b) Giấy phép lái xe hạng B và hạng C1 có thời hạn 10 năm kể từ ngày cấp.

	c) Giấy phép lái xe các hạng C, D1, D2, D, BE, C1E, CE, D1E, D2E và DE có thời hạn 05 năm kể từ ngày cấp.


**Tóm lại:** Giấy phép lái xe hạng C1 có thời hạn 10 năm.
",1.0,0.9357325205061388,0.6666666666666666,0.9999999999
4,Giấy phép lái xe hạng D có thời hạn bao lâu?,"['a) Chứng nhận đăng ký xe hoặc bản sao Chứng nhận đăng ký xe có chứng thực kèm bản gốc giấy tờ xác nhận của tổ chức tín dụng, chi nhánh ngân hàng nước ngoài còn hiệu lực trong trường hợp xe đang được thế chấp tại tổ chức tín dụng, chi nhánh ngân hàng nước ngoài;\n\nb) Giấy phép lái xe phù hợp với loại xe đang điều khiển;\n\nc) Chứng nhận kiểm định an toàn kỹ thuật và bảo vệ môi trường đối với xe cơ giới theo quy định của pháp luật;\n\nd) Chứng nhận bảo hiểm bắt buộc trách nhiệm dân sự của chủ xe cơ giới.\n\n2. Người điều khiển xe máy chuyên dùng tham gia giao thông đường bộ phải đủ tuổi, sức khỏe theo quy định của pháp luật; có bằng hoặc chứng chỉ điều khiển xe máy chuyên dùng phù hợp loại xe máy chuyên dùng đang điều khiển; có giấy phép lái xe đang còn điểm, còn hiệu lực hoặc chứng chỉ bồi dưỡng kiến thức pháp luật về giao thông đường bộ. Khi tham gia giao thông đường bộ, người điều khiển xe máy chuyên dùng phải mang theo các loại giấy tờ sau đây:\n\na) Chứng nhận đăng ký xe hoặc bản sao Chứng nhận đăng ký xe có chứng thực kèm bản gốc Giấy biên nhận còn hiệu lực của tổ chức tín dụng, chi nhánh ngân hàng nước ngoài trong trường hợp xe đang được thế chấp tại tổ chức tín dụng, chi nhánh ngân hàng nước ngoài;\n\nb) Bằng hoặc chứng chỉ điều khiển xe máy chuyên dùng;\n\nc) Giấy phép lái xe hoặc chứng chỉ bồi dưỡng kiến thức pháp luật về giao thông đường bộ;\n\nd) Chứng nhận kiểm định an toàn kỹ thuật và bảo vệ môi trường đối với xe máy chuyên dùng theo quy định của pháp luật;\n\nđ) Chứng nhận bảo hiểm bắt buộc trách nhiệm dân sự theo quy định của pháp luật.\n\n3. Trường hợp giấy tờ quy định tại khoản 1 và khoản 2 Điều này đã được tích hợp vào tài khoản định danh điện tử thì việc xuất trình, kiểm tra có thể thực hiện thông qua tài khoản định danh điện tử.\n\n4. Người lái xe gắn máy tham gia giao thông đường bộ phải hiểu biết quy tắc giao thông đường bộ, có kỹ năng điều khiển phương tiện; đủ điều kiện về độ tuổi, sức khỏe theo quy định tại điểm a khoản 1 và khoản 2 Điều 59 của Luật này.\n\n5. Người tập lái xe ô tô, người dự sát hạch lái xe ô tô khi tham gia giao thông đường bộ phải thực hành trên xe tập lái, xe sát hạch trên tuyến đường tập lái, tuyến đường sát hạch, có giáo viên dạy lái hoặc sát hạch viên bảo trợ tay lái. Giáo viên dạy lái, sát hạch viên phải mang theo các loại giấy tờ quy định tại khoản 1 Điều này.\n\nĐiều 57. Giấy phép lái xe\n\n1. Giấy phép lái xe bao gồm các hạng sau đây:\n\na) Hạng A1 cấp cho người lái xe mô tô hai bánh có dung tích xi-lanh đến 125 cm3 hoặc có công suất động cơ điện đến 11 kW;\n\nb) Hạng A cấp cho người lái xe mô tô hai bánh có dung tích xi-lanh\xa0 trên 125 cm3\xa0hoặc có công suất động cơ điện trên 11 kW và các loại xe quy định cho giấy phép lái xe hạng A1;\n\nc) Hạng B1 cấp cho người lái xe mô tô ba bánh và các loại xe quy định cho giấy phép lái xe hạng A1;\n\nd) Hạng B cấp cho người lái xe ô tô chở người đến 08 chỗ (không kể chỗ của người lái xe); xe ô tô tải và ô tô chuyên dùng có khối lượng toàn bộ theo thiết kế đến 3.500 kg; các loại xe ô tô quy định cho giấy phép lái xe hạng B kéo rơ moóc có khối lượng toàn bộ theo thiết kế đến 750 kg; \n\nđ) Hạng C1 cấp cho người lái xe ô tô tải và ô tô chuyên dùng có khối lượng toàn bộ theo thiết kế trên 3.500 kg đến 7.500 kg; các loại xe ô tô tải quy định cho giấy phép lái xe hạng C1 kéo rơ moóc có khối lượng toàn bộ theo thiết kế đến 750 kg; các loại xe quy định cho giấy phép lái xe hạng B;\n\ne) Hạng C cấp cho người lái xe ô tô tải và ô tô chuyên dùng có khối lượng toàn bộ theo thiết kế trên 7.500 kg; các loại xe ô tô tải quy định cho giấy phép lái xe hạng C kéo rơ moóc có khối lượng toàn bộ theo thiết kế đến 750 kg; các loại xe quy định cho giấy phép lái xe hạng B và hạng C1;\n\ng) Hạng D1 cấp cho người lái xe ô tô chở người trên 08 chỗ (không kể chỗ của người lái xe) đến 16 chỗ (không kể chỗ của người lái xe); các loại xe ô tô chở người quy định cho giấy phép lái xe hạng D1 kéo rơ moóc có khối lượng toàn bộ theo thiết kế đến 750 kg; các loại xe quy định cho giấy phép lái xe các hạng B, C1, C;\n\nh) Hạng D2 cấp cho người lái xe ô tô chở người (kể cả xe buýt) trên 16 chỗ (không kể chỗ của người lái xe) đến 29 chỗ (không kể chỗ của người lái xe); các loại xe ô tô chở người quy định cho giấy phép lái xe hạng D2 kéo rơ moóc có khối lượng toàn bộ theo thiết kế đến 750 kg; các loại xe quy định cho giấy phép lái xe các hạng B, C1, C, D1;\n\ni) Hạng D cấp cho người lái xe ô tô chở người (kể cả xe buýt) trên 29 chỗ (không kể chỗ của người lái xe); xe ô tô chở người giường nằm; các loại xe ô tô chở người quy định cho giấy phép lái xe hạng D kéo rơ moóc có khối lượng toàn bộ theo thiết kế đến 750 kg; các loại xe quy định cho giấy phép lái xe các hạng B, C1, C, D1, D2;\n\nk) Hạng BE cấp cho người lái các loại xe ô tô quy định cho giấy phép lái xe hạng B kéo rơ moóc có khối lượng toàn bộ theo thiết kế trên 750 kg;\n\nl) Hạng C1E cấp cho người lái các loại xe ô tô quy định cho giấy phép lái xe hạng C1 kéo rơ moóc có khối lượng toàn bộ theo thiết kế trên 750 kg;\n\nm) Hạng CE cấp cho người lái các loại xe ô tô quy định cho giấy phép lái xe hạng C kéo rơ moóc có khối lượng toàn bộ theo thiết kế trên 750 kg; xe ô tô đầu kéo kéo sơ mi rơ moóc;\n\nn) Hạng D1E cấp cho người lái các loại xe ô tô quy định cho giấy phép lái xe hạng D1 kéo rơ moóc có khối lượng toàn bộ theo thiết kế trên 750 kg;\n\no) Hạng D2E cấp cho người lái các loại xe ô tô quy định cho giấy phép lái xe hạng D2 kéo rơ moóc có khối lượng toàn bộ theo thiết kế trên 750 kg;\n\np) Hạng DE cấp cho người lái các loại xe ô tô quy định cho giấy phép lái xe hạng D kéo rơ moóc có khối lượng toàn bộ theo thiết kế trên 750 kg; xe ô tô chở khách nối toa.\n\n2. Người khuyết tật điều khiển xe mô tô ba bánh dùng cho người khuyết tật được cấp giấy phép lái xe hạng A1.\n\nNgười khuyết tật điều khiển xe ô tô số tự động có kết cấu phù hợp với tình trạng khuyết tật thì được cấp giấy phép lái xe hạng B.\n\n3. Người điều khiển xe chở hàng bốn bánh có gắn động cơ, xe chở người bốn bánh có gắn động cơ phải sử dụng giấy phép lái xe có hạng phù hợp với xe ô tô tải hoặc xe ô tô chở người tương ứng.\n\n4. Người điều khiển xe ô tô có thiết kế, cải tạo với số chỗ ít hơn xe cùng loại, kích thước giới hạn tương đương phải sử dụng giấy phép lái xe có hạng phù hợp với xe ô tô cùng loại, kích thước giới hạn tương đương và có số chỗ nhiều nhất.\n\n5. Thời hạn của giấy phép lái xe được quy định như sau:\n\na) Giấy phép lái xe các hạng A1, A, B1 không thời hạn;\n\nb) Giấy phép lái xe hạng B và hạng C1 có thời hạn 10 năm kể từ ngày cấp;\n\nc) Giấy phép lái xe các hạng C, D1, D2, D, BE, C1E, CE, D1E, D2E và DE có thời hạn 05 năm kể từ ngày cấp.\n\n6. Giấy phép lái xe có giá trị sử dụng trong phạm vi lãnh thổ Việt Nam bao gồm:\n\na) Giấy phép lái xe do cơ quan có thẩm quyền của Việt Nam cấp;\n\nb) Giấy phép lái xe quốc tế và giấy phép lái xe quốc gia phù hợp với loại xe được phép điều khiển do quốc gia là thành viên của Công ước của Liên hợp quốc về Giao thông đường bộ năm 1968 (sau đây gọi là Công ước Viên) cấp;\n\nc) Giấy phép lái xe phù hợp với loại xe được phép điều khiển của nước hoặc vùng lãnh thổ mà Việt Nam ký kết điều ước quốc tế hoặc thỏa thuận quốc tế công nhận giấy phép lái xe của nhau;\n\nd) Giấy phép lái xe nước ngoài phù hợp với loại xe được phép điều khiển do quốc gia được công nhận theo điều ước quốc tế mà nước Cộng hòa xã hội chủ nghĩa Việt Nam là thành viên.\n\n7. Giấy phép lái xe không có hiệu lực trong các trường hợp sau đây:\n\na) Giấy phép lái xe hết thời hạn sử dụng;\n\nb) Giấy phép lái xe bị thu hồi theo quy định tại khoản 5 Điều 62 của Luật này.\n\n8. Giấy phép lái xe quốc tế được quy định như sau:\n\na) Giấy phép lái xe quốc tế là giấy phép lái xe do cơ quan nhà nước có thẩm quyền của quốc gia là thành viên của Công ước Viên cấp theo một mẫu thống nhất; có thời hạn không quá 03 năm kể từ ngày cấp và phải phù hợp với thời hạn còn hiệu lực của giấy phép lái xe quốc gia;']","**Nguồn văn bản:** /content/drive/MyDrive/ITProject_data/new_law/36_2024_QH15_444251.docx

**Tên văn bản:** (Không có tiêu đề trong metadata)

**(Không có điều khoản trong metadata):**

**Nội dung:**

5. Thời hạn của giấy phép lái xe được quy định như sau:

        a) Giấy phép lái xe các hạng A1, A, B1 không thời hạn.

        b) Giấy phép lái xe hạng B và hạng C1 có thời hạn 10 năm kể từ ngày cấp.

        c) Giấy phép lái xe các hạng C, D1, D2, D, BE, C1E, CE, D1E, D2E và DE có thời hạn 05 năm kể từ ngày cấp.


**Tóm lại:** Giấy phép lái xe hạng D có thời hạn 5 năm.
","**Nguồn văn bản:** 36_2024_QH15_444251

**Tên văn bản:** Luật Trật tự, an toàn giao thông đường bộ

**Điều 57:** Giấy phép lái xe

**Nội dung:**

5. Thời hạn của giấy phép lái xe được quy định như sau:

    a) Giấy phép lái xe các hạng A1, A, B1 không thời hạn.

    b) Giấy phép lái xe hạng B và hạng C1 có thời hạn 10 năm kể từ ngày cấp.

    c) Giấy phép lái xe các hạng C, D1, D2, D, BE, C1E, CE, D1E, D2E và DE có thời hạn 05 năm kể từ ngày cấp.


**Tóm lại:** Thời hạn của giấy phép lái xe hạng D là 05 năm.
",1.0,0.9168035273679439,0.7777777777777778,0.9999999999
5,Giấy phép lái xe hạng BE cho phép lái những loại xe nào?,"['a) Chứng nhận đăng ký xe hoặc bản sao Chứng nhận đăng ký xe có chứng thực kèm bản gốc giấy tờ xác nhận của tổ chức tín dụng, chi nhánh ngân hàng nước ngoài còn hiệu lực trong trường hợp xe đang được thế chấp tại tổ chức tín dụng, chi nhánh ngân hàng nước ngoài;\n\nb) Giấy phép lái xe phù hợp với loại xe đang điều khiển;\n\nc) Chứng nhận kiểm định an toàn kỹ thuật và bảo vệ môi trường đối với xe cơ giới theo quy định của pháp luật;\n\nd) Chứng nhận bảo hiểm bắt buộc trách nhiệm dân sự của chủ xe cơ giới.\n\n2. Người điều khiển xe máy chuyên dùng tham gia giao thông đường bộ phải đủ tuổi, sức khỏe theo quy định của pháp luật; có bằng hoặc chứng chỉ điều khiển xe máy chuyên dùng phù hợp loại xe máy chuyên dùng đang điều khiển; có giấy phép lái xe đang còn điểm, còn hiệu lực hoặc chứng chỉ bồi dưỡng kiến thức pháp luật về giao thông đường bộ. Khi tham gia giao thông đường bộ, người điều khiển xe máy chuyên dùng phải mang theo các loại giấy tờ sau đây:\n\na) Chứng nhận đăng ký xe hoặc bản sao Chứng nhận đăng ký xe có chứng thực kèm bản gốc Giấy biên nhận còn hiệu lực của tổ chức tín dụng, chi nhánh ngân hàng nước ngoài trong trường hợp xe đang được thế chấp tại tổ chức tín dụng, chi nhánh ngân hàng nước ngoài;\n\nb) Bằng hoặc chứng chỉ điều khiển xe máy chuyên dùng;\n\nc) Giấy phép lái xe hoặc chứng chỉ bồi dưỡng kiến thức pháp luật về giao thông đường bộ;\n\nd) Chứng nhận kiểm định an toàn kỹ thuật và bảo vệ môi trường đối với xe máy chuyên dùng theo quy định của pháp luật;\n\nđ) Chứng nhận bảo hiểm bắt buộc trách nhiệm dân sự theo quy định của pháp luật.\n\n3. Trường hợp giấy tờ quy định tại khoản 1 và khoản 2 Điều này đã được tích hợp vào tài khoản định danh điện tử thì việc xuất trình, kiểm tra có thể thực hiện thông qua tài khoản định danh điện tử.\n\n4. Người lái xe gắn máy tham gia giao thông đường bộ phải hiểu biết quy tắc giao thông đường bộ, có kỹ năng điều khiển phương tiện; đủ điều kiện về độ tuổi, sức khỏe theo quy định tại điểm a khoản 1 và khoản 2 Điều 59 của Luật này.\n\n5. Người tập lái xe ô tô, người dự sát hạch lái xe ô tô khi tham gia giao thông đường bộ phải thực hành trên xe tập lái, xe sát hạch trên tuyến đường tập lái, tuyến đường sát hạch, có giáo viên dạy lái hoặc sát hạch viên bảo trợ tay lái. Giáo viên dạy lái, sát hạch viên phải mang theo các loại giấy tờ quy định tại khoản 1 Điều này.\n\nĐiều 57. Giấy phép lái xe\n\n1. Giấy phép lái xe bao gồm các hạng sau đây:\n\na) Hạng A1 cấp cho người lái xe mô tô hai bánh có dung tích xi-lanh đến 125 cm3 hoặc có công suất động cơ điện đến 11 kW;\n\nb) Hạng A cấp cho người lái xe mô tô hai bánh có dung tích xi-lanh\xa0 trên 125 cm3\xa0hoặc có công suất động cơ điện trên 11 kW và các loại xe quy định cho giấy phép lái xe hạng A1;\n\nc) Hạng B1 cấp cho người lái xe mô tô ba bánh và các loại xe quy định cho giấy phép lái xe hạng A1;\n\nd) Hạng B cấp cho người lái xe ô tô chở người đến 08 chỗ (không kể chỗ của người lái xe); xe ô tô tải và ô tô chuyên dùng có khối lượng toàn bộ theo thiết kế đến 3.500 kg; các loại xe ô tô quy định cho giấy phép lái xe hạng B kéo rơ moóc có khối lượng toàn bộ theo thiết kế đến 750 kg; \n\nđ) Hạng C1 cấp cho người lái xe ô tô tải và ô tô chuyên dùng có khối lượng toàn bộ theo thiết kế trên 3.500 kg đến 7.500 kg; các loại xe ô tô tải quy định cho giấy phép lái xe hạng C1 kéo rơ moóc có khối lượng toàn bộ theo thiết kế đến 750 kg; các loại xe quy định cho giấy phép lái xe hạng B;\n\ne) Hạng C cấp cho người lái xe ô tô tải và ô tô chuyên dùng có khối lượng toàn bộ theo thiết kế trên 7.500 kg; các loại xe ô tô tải quy định cho giấy phép lái xe hạng C kéo rơ moóc có khối lượng toàn bộ theo thiết kế đến 750 kg; các loại xe quy định cho giấy phép lái xe hạng B và hạng C1;\n\ng) Hạng D1 cấp cho người lái xe ô tô chở người trên 08 chỗ (không kể chỗ của người lái xe) đến 16 chỗ (không kể chỗ của người lái xe); các loại xe ô tô chở người quy định cho giấy phép lái xe hạng D1 kéo rơ moóc có khối lượng toàn bộ theo thiết kế đến 750 kg; các loại xe quy định cho giấy phép lái xe các hạng B, C1, C;\n\nh) Hạng D2 cấp cho người lái xe ô tô chở người (kể cả xe buýt) trên 16 chỗ (không kể chỗ của người lái xe) đến 29 chỗ (không kể chỗ của người lái xe); các loại xe ô tô chở người quy định cho giấy phép lái xe hạng D2 kéo rơ moóc có khối lượng toàn bộ theo thiết kế đến 750 kg; các loại xe quy định cho giấy phép lái xe các hạng B, C1, C, D1;\n\ni) Hạng D cấp cho người lái xe ô tô chở người (kể cả xe buýt) trên 29 chỗ (không kể chỗ của người lái xe); xe ô tô chở người giường nằm; các loại xe ô tô chở người quy định cho giấy phép lái xe hạng D kéo rơ moóc có khối lượng toàn bộ theo thiết kế đến 750 kg; các loại xe quy định cho giấy phép lái xe các hạng B, C1, C, D1, D2;\n\nk) Hạng BE cấp cho người lái các loại xe ô tô quy định cho giấy phép lái xe hạng B kéo rơ moóc có khối lượng toàn bộ theo thiết kế trên 750 kg;\n\nl) Hạng C1E cấp cho người lái các loại xe ô tô quy định cho giấy phép lái xe hạng C1 kéo rơ moóc có khối lượng toàn bộ theo thiết kế trên 750 kg;\n\nm) Hạng CE cấp cho người lái các loại xe ô tô quy định cho giấy phép lái xe hạng C kéo rơ moóc có khối lượng toàn bộ theo thiết kế trên 750 kg; xe ô tô đầu kéo kéo sơ mi rơ moóc;\n\nn) Hạng D1E cấp cho người lái các loại xe ô tô quy định cho giấy phép lái xe hạng D1 kéo rơ moóc có khối lượng toàn bộ theo thiết kế trên 750 kg;\n\no) Hạng D2E cấp cho người lái các loại xe ô tô quy định cho giấy phép lái xe hạng D2 kéo rơ moóc có khối lượng toàn bộ theo thiết kế trên 750 kg;\n\np) Hạng DE cấp cho người lái các loại xe ô tô quy định cho giấy phép lái xe hạng D kéo rơ moóc có khối lượng toàn bộ theo thiết kế trên 750 kg; xe ô tô chở khách nối toa.\n\n2. Người khuyết tật điều khiển xe mô tô ba bánh dùng cho người khuyết tật được cấp giấy phép lái xe hạng A1.\n\nNgười khuyết tật điều khiển xe ô tô số tự động có kết cấu phù hợp với tình trạng khuyết tật thì được cấp giấy phép lái xe hạng B.\n\n3. Người điều khiển xe chở hàng bốn bánh có gắn động cơ, xe chở người bốn bánh có gắn động cơ phải sử dụng giấy phép lái xe có hạng phù hợp với xe ô tô tải hoặc xe ô tô chở người tương ứng.\n\n4. Người điều khiển xe ô tô có thiết kế, cải tạo với số chỗ ít hơn xe cùng loại, kích thước giới hạn tương đương phải sử dụng giấy phép lái xe có hạng phù hợp với xe ô tô cùng loại, kích thước giới hạn tương đương và có số chỗ nhiều nhất.\n\n5. Thời hạn của giấy phép lái xe được quy định như sau:\n\na) Giấy phép lái xe các hạng A1, A, B1 không thời hạn;\n\nb) Giấy phép lái xe hạng B và hạng C1 có thời hạn 10 năm kể từ ngày cấp;\n\nc) Giấy phép lái xe các hạng C, D1, D2, D, BE, C1E, CE, D1E, D2E và DE có thời hạn 05 năm kể từ ngày cấp.\n\n6. Giấy phép lái xe có giá trị sử dụng trong phạm vi lãnh thổ Việt Nam bao gồm:\n\na) Giấy phép lái xe do cơ quan có thẩm quyền của Việt Nam cấp;\n\nb) Giấy phép lái xe quốc tế và giấy phép lái xe quốc gia phù hợp với loại xe được phép điều khiển do quốc gia là thành viên của Công ước của Liên hợp quốc về Giao thông đường bộ năm 1968 (sau đây gọi là Công ước Viên) cấp;\n\nc) Giấy phép lái xe phù hợp với loại xe được phép điều khiển của nước hoặc vùng lãnh thổ mà Việt Nam ký kết điều ước quốc tế hoặc thỏa thuận quốc tế công nhận giấy phép lái xe của nhau;\n\nd) Giấy phép lái xe nước ngoài phù hợp với loại xe được phép điều khiển do quốc gia được công nhận theo điều ước quốc tế mà nước Cộng hòa xã hội chủ nghĩa Việt Nam là thành viên.\n\n7. Giấy phép lái xe không có hiệu lực trong các trường hợp sau đây:\n\na) Giấy phép lái xe hết thời hạn sử dụng;\n\nb) Giấy phép lái xe bị thu hồi theo quy định tại khoản 5 Điều 62 của Luật này.\n\n8. Giấy phép lái xe quốc tế được quy định như sau:\n\na) Giấy phép lái xe quốc tế là giấy phép lái xe do cơ quan nhà nước có thẩm quyền của quốc gia là thành viên của Công ước Viên cấp theo một mẫu thống nhất; có thời hạn không quá 03 năm kể từ ngày cấp và phải phù hợp với thời hạn còn hiệu lực của giấy phép lái xe quốc gia;']","**Nguồn văn bản:** /content/drive/MyDrive/ITProject_data/new_law/36_2024_QH15_444251.docx

**Tên văn bản:** (Không có tiêu đề trong metadata)


**Nội dung:**

Giấy phép lái xe hạng BE cấp cho người lái các loại xe ô tô quy định cho giấy phép lái xe hạng B kéo rơ moóc có khối lượng toàn bộ theo thiết kế trên 750 kg.

Cụ thể hơn, giấy phép lái xe hạng B cho phép lái:

* Xe ô tô chở người đến 08 chỗ (không kể chỗ của người lái xe).
* Xe ô tô tải và ô tô chuyên dùng có khối lượng toàn bộ theo thiết kế đến 3.500 kg.
* Các loại xe ô tô quy định cho giấy phép lái xe hạng B kéo rơ moóc có khối lượng toàn bộ theo thiết kế đến 750 kg.

Vậy, giấy phép lái xe hạng BE cho phép lái các loại xe hạng B kể trên, nhưng được kéo thêm rơ moóc có khối lượng toàn bộ theo thiết kế trên 750 kg.


Tóm lại: Giấy phép lái xe hạng BE cho phép lái xe ô tô hạng B (xe chở người đến 8 chỗ, xe tải và xe chuyên dùng đến 3.500 kg) kèm theo rơ moóc có khối lượng toàn bộ trên 750 kg.
","**Nguồn văn bản:** 36_2024_QH15_444251

**Tên văn bản:** Luật Trật tự, an toàn giao thông đường bộ

**Điều 57:** Giấy phép lái xe

**Nội dung:**

Giấy phép lái xe hạng BE cấp cho người lái các loại xe ô tô quy định cho giấy phép lái xe hạng B kéo rơ moóc có khối lượng toàn bộ theo thiết kế trên 750 kg.

Giấy phép lái xe hạng B cấp cho người lái xe ô tô chở người đến 08 chỗ (không kể chỗ của người lái xe); xe ô tô tải và ô tô chuyên dùng có khối lượng toàn bộ theo thiết kế đến 3.500 kg; các loại xe ô tô quy định cho giấy phép lái xe hạng B kéo rơ moóc có khối lượng toàn bộ theo thiết kế đến 750 kg.


**Tóm lại:** Giấy phép lái xe hạng BE cho phép lái xe ô tô chở người đến 8 chỗ, xe ô tô tải và ô tô chuyên dùng có khối lượng toàn bộ theo thiết kế đến 3.500 kg, được kéo theo rơ moóc có khối lượng toàn bộ theo thiết kế trên 750 kg.
",0.8333333333333334,0.8530644260213083,0.42857142857142855,0.9999999999
6,Giấy phép lái xe hạng C1E cho phép lái những loại xe nào?,"['a) Chứng nhận đăng ký xe hoặc bản sao Chứng nhận đăng ký xe có chứng thực kèm bản gốc giấy tờ xác nhận của tổ chức tín dụng, chi nhánh ngân hàng nước ngoài còn hiệu lực trong trường hợp xe đang được thế chấp tại tổ chức tín dụng, chi nhánh ngân hàng nước ngoài;\n\nb) Giấy phép lái xe phù hợp với loại xe đang điều khiển;\n\nc) Chứng nhận kiểm định an toàn kỹ thuật và bảo vệ môi trường đối với xe cơ giới theo quy định của pháp luật;\n\nd) Chứng nhận bảo hiểm bắt buộc trách nhiệm dân sự của chủ xe cơ giới.\n\n2. Người điều khiển xe máy chuyên dùng tham gia giao thông đường bộ phải đủ tuổi, sức khỏe theo quy định của pháp luật; có bằng hoặc chứng chỉ điều khiển xe máy chuyên dùng phù hợp loại xe máy chuyên dùng đang điều khiển; có giấy phép lái xe đang còn điểm, còn hiệu lực hoặc chứng chỉ bồi dưỡng kiến thức pháp luật về giao thông đường bộ. Khi tham gia giao thông đường bộ, người điều khiển xe máy chuyên dùng phải mang theo các loại giấy tờ sau đây:\n\na) Chứng nhận đăng ký xe hoặc bản sao Chứng nhận đăng ký xe có chứng thực kèm bản gốc Giấy biên nhận còn hiệu lực của tổ chức tín dụng, chi nhánh ngân hàng nước ngoài trong trường hợp xe đang được thế chấp tại tổ chức tín dụng, chi nhánh ngân hàng nước ngoài;\n\nb) Bằng hoặc chứng chỉ điều khiển xe máy chuyên dùng;\n\nc) Giấy phép lái xe hoặc chứng chỉ bồi dưỡng kiến thức pháp luật về giao thông đường bộ;\n\nd) Chứng nhận kiểm định an toàn kỹ thuật và bảo vệ môi trường đối với xe máy chuyên dùng theo quy định của pháp luật;\n\nđ) Chứng nhận bảo hiểm bắt buộc trách nhiệm dân sự theo quy định của pháp luật.\n\n3. Trường hợp giấy tờ quy định tại khoản 1 và khoản 2 Điều này đã được tích hợp vào tài khoản định danh điện tử thì việc xuất trình, kiểm tra có thể thực hiện thông qua tài khoản định danh điện tử.\n\n4. Người lái xe gắn máy tham gia giao thông đường bộ phải hiểu biết quy tắc giao thông đường bộ, có kỹ năng điều khiển phương tiện; đủ điều kiện về độ tuổi, sức khỏe theo quy định tại điểm a khoản 1 và khoản 2 Điều 59 của Luật này.\n\n5. Người tập lái xe ô tô, người dự sát hạch lái xe ô tô khi tham gia giao thông đường bộ phải thực hành trên xe tập lái, xe sát hạch trên tuyến đường tập lái, tuyến đường sát hạch, có giáo viên dạy lái hoặc sát hạch viên bảo trợ tay lái. Giáo viên dạy lái, sát hạch viên phải mang theo các loại giấy tờ quy định tại khoản 1 Điều này.\n\nĐiều 57. Giấy phép lái xe\n\n1. Giấy phép lái xe bao gồm các hạng sau đây:\n\na) Hạng A1 cấp cho người lái xe mô tô hai bánh có dung tích xi-lanh đến 125 cm3 hoặc có công suất động cơ điện đến 11 kW;\n\nb) Hạng A cấp cho người lái xe mô tô hai bánh có dung tích xi-lanh\xa0 trên 125 cm3\xa0hoặc có công suất động cơ điện trên 11 kW và các loại xe quy định cho giấy phép lái xe hạng A1;\n\nc) Hạng B1 cấp cho người lái xe mô tô ba bánh và các loại xe quy định cho giấy phép lái xe hạng A1;\n\nd) Hạng B cấp cho người lái xe ô tô chở người đến 08 chỗ (không kể chỗ của người lái xe); xe ô tô tải và ô tô chuyên dùng có khối lượng toàn bộ theo thiết kế đến 3.500 kg; các loại xe ô tô quy định cho giấy phép lái xe hạng B kéo rơ moóc có khối lượng toàn bộ theo thiết kế đến 750 kg; \n\nđ) Hạng C1 cấp cho người lái xe ô tô tải và ô tô chuyên dùng có khối lượng toàn bộ theo thiết kế trên 3.500 kg đến 7.500 kg; các loại xe ô tô tải quy định cho giấy phép lái xe hạng C1 kéo rơ moóc có khối lượng toàn bộ theo thiết kế đến 750 kg; các loại xe quy định cho giấy phép lái xe hạng B;\n\ne) Hạng C cấp cho người lái xe ô tô tải và ô tô chuyên dùng có khối lượng toàn bộ theo thiết kế trên 7.500 kg; các loại xe ô tô tải quy định cho giấy phép lái xe hạng C kéo rơ moóc có khối lượng toàn bộ theo thiết kế đến 750 kg; các loại xe quy định cho giấy phép lái xe hạng B và hạng C1;\n\ng) Hạng D1 cấp cho người lái xe ô tô chở người trên 08 chỗ (không kể chỗ của người lái xe) đến 16 chỗ (không kể chỗ của người lái xe); các loại xe ô tô chở người quy định cho giấy phép lái xe hạng D1 kéo rơ moóc có khối lượng toàn bộ theo thiết kế đến 750 kg; các loại xe quy định cho giấy phép lái xe các hạng B, C1, C;\n\nh) Hạng D2 cấp cho người lái xe ô tô chở người (kể cả xe buýt) trên 16 chỗ (không kể chỗ của người lái xe) đến 29 chỗ (không kể chỗ của người lái xe); các loại xe ô tô chở người quy định cho giấy phép lái xe hạng D2 kéo rơ moóc có khối lượng toàn bộ theo thiết kế đến 750 kg; các loại xe quy định cho giấy phép lái xe các hạng B, C1, C, D1;\n\ni) Hạng D cấp cho người lái xe ô tô chở người (kể cả xe buýt) trên 29 chỗ (không kể chỗ của người lái xe); xe ô tô chở người giường nằm; các loại xe ô tô chở người quy định cho giấy phép lái xe hạng D kéo rơ moóc có khối lượng toàn bộ theo thiết kế đến 750 kg; các loại xe quy định cho giấy phép lái xe các hạng B, C1, C, D1, D2;\n\nk) Hạng BE cấp cho người lái các loại xe ô tô quy định cho giấy phép lái xe hạng B kéo rơ moóc có khối lượng toàn bộ theo thiết kế trên 750 kg;\n\nl) Hạng C1E cấp cho người lái các loại xe ô tô quy định cho giấy phép lái xe hạng C1 kéo rơ moóc có khối lượng toàn bộ theo thiết kế trên 750 kg;\n\nm) Hạng CE cấp cho người lái các loại xe ô tô quy định cho giấy phép lái xe hạng C kéo rơ moóc có khối lượng toàn bộ theo thiết kế trên 750 kg; xe ô tô đầu kéo kéo sơ mi rơ moóc;\n\nn) Hạng D1E cấp cho người lái các loại xe ô tô quy định cho giấy phép lái xe hạng D1 kéo rơ moóc có khối lượng toàn bộ theo thiết kế trên 750 kg;\n\no) Hạng D2E cấp cho người lái các loại xe ô tô quy định cho giấy phép lái xe hạng D2 kéo rơ moóc có khối lượng toàn bộ theo thiết kế trên 750 kg;\n\np) Hạng DE cấp cho người lái các loại xe ô tô quy định cho giấy phép lái xe hạng D kéo rơ moóc có khối lượng toàn bộ theo thiết kế trên 750 kg; xe ô tô chở khách nối toa.\n\n2. Người khuyết tật điều khiển xe mô tô ba bánh dùng cho người khuyết tật được cấp giấy phép lái xe hạng A1.\n\nNgười khuyết tật điều khiển xe ô tô số tự động có kết cấu phù hợp với tình trạng khuyết tật thì được cấp giấy phép lái xe hạng B.\n\n3. Người điều khiển xe chở hàng bốn bánh có gắn động cơ, xe chở người bốn bánh có gắn động cơ phải sử dụng giấy phép lái xe có hạng phù hợp với xe ô tô tải hoặc xe ô tô chở người tương ứng.\n\n4. Người điều khiển xe ô tô có thiết kế, cải tạo với số chỗ ít hơn xe cùng loại, kích thước giới hạn tương đương phải sử dụng giấy phép lái xe có hạng phù hợp với xe ô tô cùng loại, kích thước giới hạn tương đương và có số chỗ nhiều nhất.\n\n5. Thời hạn của giấy phép lái xe được quy định như sau:\n\na) Giấy phép lái xe các hạng A1, A, B1 không thời hạn;\n\nb) Giấy phép lái xe hạng B và hạng C1 có thời hạn 10 năm kể từ ngày cấp;\n\nc) Giấy phép lái xe các hạng C, D1, D2, D, BE, C1E, CE, D1E, D2E và DE có thời hạn 05 năm kể từ ngày cấp.\n\n6. Giấy phép lái xe có giá trị sử dụng trong phạm vi lãnh thổ Việt Nam bao gồm:\n\na) Giấy phép lái xe do cơ quan có thẩm quyền của Việt Nam cấp;\n\nb) Giấy phép lái xe quốc tế và giấy phép lái xe quốc gia phù hợp với loại xe được phép điều khiển do quốc gia là thành viên của Công ước của Liên hợp quốc về Giao thông đường bộ năm 1968 (sau đây gọi là Công ước Viên) cấp;\n\nc) Giấy phép lái xe phù hợp với loại xe được phép điều khiển của nước hoặc vùng lãnh thổ mà Việt Nam ký kết điều ước quốc tế hoặc thỏa thuận quốc tế công nhận giấy phép lái xe của nhau;\n\nd) Giấy phép lái xe nước ngoài phù hợp với loại xe được phép điều khiển do quốc gia được công nhận theo điều ước quốc tế mà nước Cộng hòa xã hội chủ nghĩa Việt Nam là thành viên.\n\n7. Giấy phép lái xe không có hiệu lực trong các trường hợp sau đây:\n\na) Giấy phép lái xe hết thời hạn sử dụng;\n\nb) Giấy phép lái xe bị thu hồi theo quy định tại khoản 5 Điều 62 của Luật này.\n\n8. Giấy phép lái xe quốc tế được quy định như sau:\n\na) Giấy phép lái xe quốc tế là giấy phép lái xe do cơ quan nhà nước có thẩm quyền của quốc gia là thành viên của Công ước Viên cấp theo một mẫu thống nhất; có thời hạn không quá 03 năm kể từ ngày cấp và phải phù hợp với thời hạn còn hiệu lực của giấy phép lái xe quốc gia;']","**Nguồn văn bản:** /content/drive/MyDrive/ITProject_data/new_law/36_2024_QH15_444251.docx

**Tên văn bản:** (Không có tiêu đề trong metadata)

**(Không có điều khoản):** (Không có tên điều khoản trong metadata)

**Nội dung:**

Các loại xe được phép lái với giấy phép lái xe hạng C1E:

Người có giấy phép lái xe hạng C1E được phép lái:

l) Các loại xe ô tô quy định cho giấy phép lái xe hạng C1 kéo rơ moóc có khối lượng toàn bộ theo thiết kế trên 750 kg.

Giấy phép lái xe hạng C1 cấp cho người lái:

đ) Xe ô tô tải và ô tô chuyên dùng có khối lượng toàn bộ theo thiết kế trên 3.500 kg đến 7.500 kg.
Các loại xe ô tô tải quy định cho giấy phép lái xe hạng C1 kéo rơ moóc có khối lượng toàn bộ theo thiết kế đến 750 kg.
Các loại xe quy định cho giấy phép lái xe hạng B.


**Tóm lại:** Giấy phép lái xe hạng C1E cho phép lái xe ô tô tải và ô tô chuyên dùng có khối lượng toàn bộ theo thiết kế từ 3.500 kg đến 7.500 kg (bao gồm cả loại được kéo rơ moóc đến 750kg theo hạng C1)  kéo thêm rơ moóc có khối lượng toàn bộ theo thiết kế trên 750 kg, và tất cả các loại xe thuộc hạng B.
","**Nguồn văn bản:** 36_2024_QH15_444251

**Tên văn bản:** Luật Trật tự, an toàn giao thông đường bộ

**Điều 57:** Giấy phép lái xe

**Nội dung:**

1. Giấy phép lái xe bao gồm các hạng sau đây:

    a) Hạng A1 cấp cho người lái xe mô tô hai bánh có dung tích xi-lanh đến 125 cm3 hoặc có công suất động cơ điện đến 11 kW.

    b) Hạng A cấp cho người lái xe mô tô hai bánh có dung tích xi-lanh trên 125 cm3 hoặc có công suất động cơ điện trên 11 kW và các loại xe quy định cho giấy phép lái xe hạng A1.

    c) Hạng B1 cấp cho người lái xe mô tô ba bánh và các loại xe quy định cho giấy phép lái xe hạng A1.

    d) Hạng B cấp cho người lái xe ô tô chở người đến 08 chỗ (không kể chỗ của người lái xe); xe ô tô tải và ô tô chuyên dùng có khối lượng toàn bộ theo thiết kế đến 3.500 kg; các loại xe ô tô quy định cho giấy phép lái xe hạng B kéo rơ moóc có khối lượng toàn bộ theo thiết kế đến 750 kg.

    đ) Hạng C1 cấp cho người lái xe ô tô tải và ô tô chuyên dùng có khối lượng toàn bộ theo thiết kế trên 3.500 kg đến 7.500 kg; các loại xe ô tô tải quy định cho giấy phép lái xe hạng C1 kéo rơ moóc có khối lượng toàn bộ theo thiết kế đến 750 kg; các loại xe quy định cho giấy phép lái xe hạng B.

    e) Hạng C cấp cho người lái xe ô tô tải và ô tô chuyên dùng có khối lượng toàn bộ theo thiết kế trên 7.500 kg; các loại xe ô tô tải quy định cho giấy phép lái xe hạng C kéo rơ moóc có khối lượng toàn bộ theo thiết kế đến 750 kg; các loại xe quy định cho giấy phép lái xe hạng B và hạng C1.

    g) Hạng D1 cấp cho người lái xe ô tô chở người trên 08 chỗ (không kể chỗ của người lái xe) đến 16 chỗ (không kể chỗ của người lái xe); các loại xe ô tô chở người quy định cho giấy phép lái xe hạng D1 kéo rơ moóc có khối lượng toàn bộ theo thiết kế đến 750 kg; các loại xe quy định cho giấy phép lái xe các hạng B, C1, C.

    h) Hạng D2 cấp cho người lái xe ô tô chở người (kể cả xe buýt) trên 16 chỗ (không kể chỗ của người lái xe) đến 29 chỗ (không kể chỗ của người lái xe); các loại xe ô tô chở người quy định cho giấy phép lái xe hạng D2 kéo rơ moóc có khối lượng toàn bộ theo thiết kế đến 750 kg; các loại xe quy định cho giấy phép lái xe các hạng B, C1, C, D1.

    i) Hạng D cấp cho người lái xe ô tô chở người (kể cả xe buýt) trên 29 chỗ (không kể chỗ của người lái xe); xe ô tô chở người giường nằm; các loại xe ô tô chở người quy định cho giấy phép lái xe hạng D kéo rơ moóc có khối lượng toàn bộ theo thiết kế đến 750 kg; các loại xe quy định cho giấy phép lái xe các hạng B, C1, C, D1, D2.

    k) Hạng BE cấp cho người lái các loại xe ô tô quy định cho giấy phép lái xe hạng B kéo rơ moóc có khối lượng toàn bộ theo thiết kế trên 750 kg.

    l) Hạng C1E cấp cho người lái các loại xe ô tô quy định cho giấy phép lái xe hạng C1 kéo rơ moóc có khối lượng toàn bộ theo thiết kế trên 750 kg.

    m) Hạng CE cấp cho người lái các loại xe ô tô quy định cho giấy phép lái xe hạng C kéo rơ moóc có khối lượng toàn bộ theo thiết kế trên 750 kg; xe ô tô đầu kéo kéo sơ mi rơ moóc.

    n) Hạng D1E cấp cho người lái các loại xe ô tô quy định cho giấy phép lái xe hạng D1 kéo rơ moóc có khối lượng toàn bộ theo thiết kế trên 750 kg.

    o) Hạng D2E cấp cho người lái các loại xe ô tô quy định cho giấy phép lái xe hạng D2 kéo rơ moóc có khối lượng toàn bộ theo thiết kế trên 750 kg.

    p) Hạng DE cấp cho người lái các loại xe ô tô quy định cho giấy phép lái xe hạng D kéo rơ moóc có khối lượng toàn bộ theo thiết kế trên 750 kg; xe ô tô chở khách nối toa.


2. Người khuyết tật điều khiển xe mô tô ba bánh dùng cho người khuyết tật được cấp giấy phép lái xe hạng A1. Người khuyết tật điều khiển xe ô tô số tự động có kết cấu phù hợp với tình trạng khuyết tật thì được cấp giấy phép lái xe hạng B.

3. Người điều khiển xe chở hàng bốn bánh có gắn động cơ, xe chở người bốn bánh có gắn động cơ phải sử dụng giấy phép lái xe có hạng phù hợp với xe ô tô tải hoặc xe ô tô chở người tương ứng.

4. Người điều khiển xe ô tô có thiết kế, cải tạo với số chỗ ít hơn xe cùng loại, kích thước giới hạn tương đương phải sử dụng giấy phép lái xe có hạng phù hợp với xe ô tô cùng loại, kích thước giới hạn tương đương và có số chỗ nhiều nhất.

5. Thời hạn của giấy phép lái xe được quy định như sau:
    a) Giấy phép lái xe các hạng A1, A, B1 không thời hạn.
    b) Giấy phép lái xe hạng B và hạng C1 có thời hạn 10 năm kể từ ngày cấp.
    c) Giấy phép lái xe các hạng C, D1, D2, D, BE, C1E, CE, D1E, D2E và DE có thời hạn 05 năm kể từ ngày cấp.


**Tóm lại:** Giấy phép lái xe hạng C1E cho phép lái các loại xe ô tô quy định cho giấy phép lái xe hạng C1, nhưng được kéo rơ moóc có khối lượng toàn bộ theo thiết kế trên 750 kg.  Hạng C1 là xe ô tô tải và ô tô chuyên dùng có khối lượng toàn bộ theo thiết kế trên 3.500 kg đến 7.500 kg.
",1.0,0.9627713541001061,0.6666666666666666,0.9999999999
7,Giấy phép lái xe hạng D1E cho phép lái những loại xe nào?,"['a) Chứng nhận đăng ký xe hoặc bản sao Chứng nhận đăng ký xe có chứng thực kèm bản gốc giấy tờ xác nhận của tổ chức tín dụng, chi nhánh ngân hàng nước ngoài còn hiệu lực trong trường hợp xe đang được thế chấp tại tổ chức tín dụng, chi nhánh ngân hàng nước ngoài;\n\nb) Giấy phép lái xe phù hợp với loại xe đang điều khiển;\n\nc) Chứng nhận kiểm định an toàn kỹ thuật và bảo vệ môi trường đối với xe cơ giới theo quy định của pháp luật;\n\nd) Chứng nhận bảo hiểm bắt buộc trách nhiệm dân sự của chủ xe cơ giới.\n\n2. Người điều khiển xe máy chuyên dùng tham gia giao thông đường bộ phải đủ tuổi, sức khỏe theo quy định của pháp luật; có bằng hoặc chứng chỉ điều khiển xe máy chuyên dùng phù hợp loại xe máy chuyên dùng đang điều khiển; có giấy phép lái xe đang còn điểm, còn hiệu lực hoặc chứng chỉ bồi dưỡng kiến thức pháp luật về giao thông đường bộ. Khi tham gia giao thông đường bộ, người điều khiển xe máy chuyên dùng phải mang theo các loại giấy tờ sau đây:\n\na) Chứng nhận đăng ký xe hoặc bản sao Chứng nhận đăng ký xe có chứng thực kèm bản gốc Giấy biên nhận còn hiệu lực của tổ chức tín dụng, chi nhánh ngân hàng nước ngoài trong trường hợp xe đang được thế chấp tại tổ chức tín dụng, chi nhánh ngân hàng nước ngoài;\n\nb) Bằng hoặc chứng chỉ điều khiển xe máy chuyên dùng;\n\nc) Giấy phép lái xe hoặc chứng chỉ bồi dưỡng kiến thức pháp luật về giao thông đường bộ;\n\nd) Chứng nhận kiểm định an toàn kỹ thuật và bảo vệ môi trường đối với xe máy chuyên dùng theo quy định của pháp luật;\n\nđ) Chứng nhận bảo hiểm bắt buộc trách nhiệm dân sự theo quy định của pháp luật.\n\n3. Trường hợp giấy tờ quy định tại khoản 1 và khoản 2 Điều này đã được tích hợp vào tài khoản định danh điện tử thì việc xuất trình, kiểm tra có thể thực hiện thông qua tài khoản định danh điện tử.\n\n4. Người lái xe gắn máy tham gia giao thông đường bộ phải hiểu biết quy tắc giao thông đường bộ, có kỹ năng điều khiển phương tiện; đủ điều kiện về độ tuổi, sức khỏe theo quy định tại điểm a khoản 1 và khoản 2 Điều 59 của Luật này.\n\n5. Người tập lái xe ô tô, người dự sát hạch lái xe ô tô khi tham gia giao thông đường bộ phải thực hành trên xe tập lái, xe sát hạch trên tuyến đường tập lái, tuyến đường sát hạch, có giáo viên dạy lái hoặc sát hạch viên bảo trợ tay lái. Giáo viên dạy lái, sát hạch viên phải mang theo các loại giấy tờ quy định tại khoản 1 Điều này.\n\nĐiều 57. Giấy phép lái xe\n\n1. Giấy phép lái xe bao gồm các hạng sau đây:\n\na) Hạng A1 cấp cho người lái xe mô tô hai bánh có dung tích xi-lanh đến 125 cm3 hoặc có công suất động cơ điện đến 11 kW;\n\nb) Hạng A cấp cho người lái xe mô tô hai bánh có dung tích xi-lanh\xa0 trên 125 cm3\xa0hoặc có công suất động cơ điện trên 11 kW và các loại xe quy định cho giấy phép lái xe hạng A1;\n\nc) Hạng B1 cấp cho người lái xe mô tô ba bánh và các loại xe quy định cho giấy phép lái xe hạng A1;\n\nd) Hạng B cấp cho người lái xe ô tô chở người đến 08 chỗ (không kể chỗ của người lái xe); xe ô tô tải và ô tô chuyên dùng có khối lượng toàn bộ theo thiết kế đến 3.500 kg; các loại xe ô tô quy định cho giấy phép lái xe hạng B kéo rơ moóc có khối lượng toàn bộ theo thiết kế đến 750 kg; \n\nđ) Hạng C1 cấp cho người lái xe ô tô tải và ô tô chuyên dùng có khối lượng toàn bộ theo thiết kế trên 3.500 kg đến 7.500 kg; các loại xe ô tô tải quy định cho giấy phép lái xe hạng C1 kéo rơ moóc có khối lượng toàn bộ theo thiết kế đến 750 kg; các loại xe quy định cho giấy phép lái xe hạng B;\n\ne) Hạng C cấp cho người lái xe ô tô tải và ô tô chuyên dùng có khối lượng toàn bộ theo thiết kế trên 7.500 kg; các loại xe ô tô tải quy định cho giấy phép lái xe hạng C kéo rơ moóc có khối lượng toàn bộ theo thiết kế đến 750 kg; các loại xe quy định cho giấy phép lái xe hạng B và hạng C1;\n\ng) Hạng D1 cấp cho người lái xe ô tô chở người trên 08 chỗ (không kể chỗ của người lái xe) đến 16 chỗ (không kể chỗ của người lái xe); các loại xe ô tô chở người quy định cho giấy phép lái xe hạng D1 kéo rơ moóc có khối lượng toàn bộ theo thiết kế đến 750 kg; các loại xe quy định cho giấy phép lái xe các hạng B, C1, C;\n\nh) Hạng D2 cấp cho người lái xe ô tô chở người (kể cả xe buýt) trên 16 chỗ (không kể chỗ của người lái xe) đến 29 chỗ (không kể chỗ của người lái xe); các loại xe ô tô chở người quy định cho giấy phép lái xe hạng D2 kéo rơ moóc có khối lượng toàn bộ theo thiết kế đến 750 kg; các loại xe quy định cho giấy phép lái xe các hạng B, C1, C, D1;\n\ni) Hạng D cấp cho người lái xe ô tô chở người (kể cả xe buýt) trên 29 chỗ (không kể chỗ của người lái xe); xe ô tô chở người giường nằm; các loại xe ô tô chở người quy định cho giấy phép lái xe hạng D kéo rơ moóc có khối lượng toàn bộ theo thiết kế đến 750 kg; các loại xe quy định cho giấy phép lái xe các hạng B, C1, C, D1, D2;\n\nk) Hạng BE cấp cho người lái các loại xe ô tô quy định cho giấy phép lái xe hạng B kéo rơ moóc có khối lượng toàn bộ theo thiết kế trên 750 kg;\n\nl) Hạng C1E cấp cho người lái các loại xe ô tô quy định cho giấy phép lái xe hạng C1 kéo rơ moóc có khối lượng toàn bộ theo thiết kế trên 750 kg;\n\nm) Hạng CE cấp cho người lái các loại xe ô tô quy định cho giấy phép lái xe hạng C kéo rơ moóc có khối lượng toàn bộ theo thiết kế trên 750 kg; xe ô tô đầu kéo kéo sơ mi rơ moóc;\n\nn) Hạng D1E cấp cho người lái các loại xe ô tô quy định cho giấy phép lái xe hạng D1 kéo rơ moóc có khối lượng toàn bộ theo thiết kế trên 750 kg;\n\no) Hạng D2E cấp cho người lái các loại xe ô tô quy định cho giấy phép lái xe hạng D2 kéo rơ moóc có khối lượng toàn bộ theo thiết kế trên 750 kg;\n\np) Hạng DE cấp cho người lái các loại xe ô tô quy định cho giấy phép lái xe hạng D kéo rơ moóc có khối lượng toàn bộ theo thiết kế trên 750 kg; xe ô tô chở khách nối toa.\n\n2. Người khuyết tật điều khiển xe mô tô ba bánh dùng cho người khuyết tật được cấp giấy phép lái xe hạng A1.\n\nNgười khuyết tật điều khiển xe ô tô số tự động có kết cấu phù hợp với tình trạng khuyết tật thì được cấp giấy phép lái xe hạng B.\n\n3. Người điều khiển xe chở hàng bốn bánh có gắn động cơ, xe chở người bốn bánh có gắn động cơ phải sử dụng giấy phép lái xe có hạng phù hợp với xe ô tô tải hoặc xe ô tô chở người tương ứng.\n\n4. Người điều khiển xe ô tô có thiết kế, cải tạo với số chỗ ít hơn xe cùng loại, kích thước giới hạn tương đương phải sử dụng giấy phép lái xe có hạng phù hợp với xe ô tô cùng loại, kích thước giới hạn tương đương và có số chỗ nhiều nhất.\n\n5. Thời hạn của giấy phép lái xe được quy định như sau:\n\na) Giấy phép lái xe các hạng A1, A, B1 không thời hạn;\n\nb) Giấy phép lái xe hạng B và hạng C1 có thời hạn 10 năm kể từ ngày cấp;\n\nc) Giấy phép lái xe các hạng C, D1, D2, D, BE, C1E, CE, D1E, D2E và DE có thời hạn 05 năm kể từ ngày cấp.\n\n6. Giấy phép lái xe có giá trị sử dụng trong phạm vi lãnh thổ Việt Nam bao gồm:\n\na) Giấy phép lái xe do cơ quan có thẩm quyền của Việt Nam cấp;\n\nb) Giấy phép lái xe quốc tế và giấy phép lái xe quốc gia phù hợp với loại xe được phép điều khiển do quốc gia là thành viên của Công ước của Liên hợp quốc về Giao thông đường bộ năm 1968 (sau đây gọi là Công ước Viên) cấp;\n\nc) Giấy phép lái xe phù hợp với loại xe được phép điều khiển của nước hoặc vùng lãnh thổ mà Việt Nam ký kết điều ước quốc tế hoặc thỏa thuận quốc tế công nhận giấy phép lái xe của nhau;\n\nd) Giấy phép lái xe nước ngoài phù hợp với loại xe được phép điều khiển do quốc gia được công nhận theo điều ước quốc tế mà nước Cộng hòa xã hội chủ nghĩa Việt Nam là thành viên.\n\n7. Giấy phép lái xe không có hiệu lực trong các trường hợp sau đây:\n\na) Giấy phép lái xe hết thời hạn sử dụng;\n\nb) Giấy phép lái xe bị thu hồi theo quy định tại khoản 5 Điều 62 của Luật này.\n\n8. Giấy phép lái xe quốc tế được quy định như sau:\n\na) Giấy phép lái xe quốc tế là giấy phép lái xe do cơ quan nhà nước có thẩm quyền của quốc gia là thành viên của Công ước Viên cấp theo một mẫu thống nhất; có thời hạn không quá 03 năm kể từ ngày cấp và phải phù hợp với thời hạn còn hiệu lực của giấy phép lái xe quốc gia;']","**Nguồn văn bản:** /content/drive/MyDrive/ITProject_data/new_law/36_2024_QH15_444251.docx

**Tên văn bản:** (Không có tiêu đề trong metadata)

**(Không có điều khoản):**

**Nội dung:**

Điều kiện điều khiển xe hạng D1E được quy định tại khoản 1, mục n, Điều 57 như sau: Hạng D1E cấp cho người lái các loại xe ô tô quy định cho giấy phép lái xe hạng D1 kéo rơ moóc có khối lượng toàn bộ theo thiết kế trên 750 kg.

Trong đó, hạng D1 được quy định tại khoản 1, mục g, Điều 57: Hạng D1 cấp cho người lái xe ô tô chở người trên 08 chỗ (không kể chỗ của người lái xe) đến 16 chỗ (không kể chỗ của người lái xe); các loại xe ô tô chở người quy định cho giấy phép lái xe hạng D1 kéo rơ moóc có khối lượng toàn bộ theo thiết kế đến 750 kg; các loại xe quy định cho giấy phép lái xe các hạng B, C1, C.


**Tóm lại:** Để điều khiển xe hạng D1E, người lái cần có giấy phép lái xe hạng D1E.  Điều này cho phép họ lái xe ô tô chở người từ 9 đến 16 chỗ  kéo theo rơ-moóc có khối lượng toàn bộ theo thiết kế trên 750kg.  Người lái cũng cần đáp ứng các quy định chung về điều khiển xe như đủ tuổi, sức khỏe, giấy tờ xe hợp lệ.
","**Nguồn văn bản:** 36_2024_QH15_444251

**Tên văn bản:** Luật Trật tự, an toàn giao thông đường bộ

**Điều 57:** Giấy phép lái xe

**Nội dung:**

1. Giấy phép lái xe bao gồm các hạng sau đây:

	a) Hạng A1 cấp cho người lái xe mô tô hai bánh có dung tích xi-lanh đến 125 cm3 hoặc có công suất động cơ điện đến 11 kW.

	b) Hạng A cấp cho người lái xe mô tô hai bánh có dung tích xi-lanh trên 125 cm3 hoặc có công suất động cơ điện trên 11 kW và các loại xe quy định cho giấy phép lái xe hạng A1.

	c) Hạng B1 cấp cho người lái xe mô tô ba bánh và các loại xe quy định cho giấy phép lái xe hạng A1.

	d) Hạng B cấp cho người lái xe ô tô chở người đến 08 chỗ (không kể chỗ của người lái xe); xe ô tô tải và ô tô chuyên dùng có khối lượng toàn bộ theo thiết kế đến 3.500 kg; các loại xe ô tô quy định cho giấy phép lái xe hạng B kéo rơ moóc có khối lượng toàn bộ theo thiết kế đến 750 kg.

	đ) Hạng C1 cấp cho người lái xe ô tô tải và ô tô chuyên dùng có khối lượng toàn bộ theo thiết kế trên 3.500 kg đến 7.500 kg; các loại xe ô tô tải quy định cho giấy phép lái xe hạng C1 kéo rơ moóc có khối lượng toàn bộ theo thiết kế đến 750 kg; các loại xe quy định cho giấy phép lái xe hạng B.

	e) Hạng C cấp cho người lái xe ô tô tải và ô tô chuyên dùng có khối lượng toàn bộ theo thiết kế trên 7.500 kg; các loại xe ô tô tải quy định cho giấy phép lái xe hạng C kéo rơ moóc có khối lượng toàn bộ theo thiết kế đến 750 kg; các loại xe quy định cho giấy phép lái xe hạng B và hạng C1.

	g) Hạng D1 cấp cho người lái xe ô tô chở người trên 08 chỗ (không kể chỗ của người lái xe) đến 16 chỗ (không kể chỗ của người lái xe); các loại xe ô tô chở người quy định cho giấy phép lái xe hạng D1 kéo rơ moóc có khối lượng toàn bộ theo thiết kế đến 750 kg; các loại xe quy định cho giấy phép lái xe các hạng B, C1, C.

	h) Hạng D2 cấp cho người lái xe ô tô chở người (kể cả xe buýt) trên 16 chỗ (không kể chỗ của người lái xe) đến 29 chỗ (không kể chỗ của người lái xe); các loại xe ô tô chở người quy định cho giấy phép lái xe hạng D2 kéo rơ moóc có khối lượng toàn bộ theo thiết kế đến 750 kg; các loại xe quy định cho giấy phép lái xe các hạng B, C1, C, D1.

	i) Hạng D cấp cho người lái xe ô tô chở người (kể cả xe buýt) trên 29 chỗ (không kể chỗ của người lái xe); xe ô tô chở người giường nằm; các loại xe ô tô chở người quy định cho giấy phép lái xe hạng D kéo rơ moóc có khối lượng toàn bộ theo thiết kế đến 750 kg; các loại xe quy định cho giấy phép lái xe các hạng B, C1, C, D1, D2.

	k) Hạng BE cấp cho người lái các loại xe ô tô quy định cho giấy phép lái xe hạng B kéo rơ moóc có khối lượng toàn bộ theo thiết kế trên 750 kg.

	l) Hạng C1E cấp cho người lái các loại xe ô tô quy định cho giấy phép lái xe hạng C1 kéo rơ moóc có khối lượng toàn bộ theo thiết kế trên 750 kg.

	m) Hạng CE cấp cho người lái các loại xe ô tô quy định cho giấy phép lái xe hạng C kéo rơ moóc có khối lượng toàn bộ theo thiết kế trên 750 kg; xe ô tô đầu kéo kéo sơ mi rơ moóc.

	n) Hạng D1E cấp cho người lái các loại xe ô tô quy định cho giấy phép lái xe hạng D1 kéo rơ moóc có khối lượng toàn bộ theo thiết kế trên 750 kg.

	o) Hạng D2E cấp cho người lái các loại xe ô tô quy định cho giấy phép lái xe hạng D2 kéo rơ moóc có khối lượng toàn bộ theo thiết kế trên 750 kg.

	p) Hạng DE cấp cho người lái các loại xe ô tô quy định cho giấy phép lái xe hạng D kéo rơ moóc có khối lượng toàn bộ theo thiết kế trên 750 kg; xe ô tô chở khách nối toa.


**Tóm lại:** Giấy phép lái xe hạng D1E cấp cho người lái các loại xe ô tô quy định cho giấy phép lái xe hạng D1 (xe ô tô chở người từ 9 đến 16 chỗ) kéo rơ moóc có khối lượng toàn bộ theo thiết kế trên 750 kg.
",0.8888888888888888,0.8945499771337514,0.8571428571428571,0.9999999999
8,Giấy phép lái xe hạng D2E cho phép lái những loại xe nào?,"['a) Chứng nhận đăng ký xe hoặc bản sao Chứng nhận đăng ký xe có chứng thực kèm bản gốc giấy tờ xác nhận của tổ chức tín dụng, chi nhánh ngân hàng nước ngoài còn hiệu lực trong trường hợp xe đang được thế chấp tại tổ chức tín dụng, chi nhánh ngân hàng nước ngoài;\n\nb) Giấy phép lái xe phù hợp với loại xe đang điều khiển;\n\nc) Chứng nhận kiểm định an toàn kỹ thuật và bảo vệ môi trường đối với xe cơ giới theo quy định của pháp luật;\n\nd) Chứng nhận bảo hiểm bắt buộc trách nhiệm dân sự của chủ xe cơ giới.\n\n2. Người điều khiển xe máy chuyên dùng tham gia giao thông đường bộ phải đủ tuổi, sức khỏe theo quy định của pháp luật; có bằng hoặc chứng chỉ điều khiển xe máy chuyên dùng phù hợp loại xe máy chuyên dùng đang điều khiển; có giấy phép lái xe đang còn điểm, còn hiệu lực hoặc chứng chỉ bồi dưỡng kiến thức pháp luật về giao thông đường bộ. Khi tham gia giao thông đường bộ, người điều khiển xe máy chuyên dùng phải mang theo các loại giấy tờ sau đây:\n\na) Chứng nhận đăng ký xe hoặc bản sao Chứng nhận đăng ký xe có chứng thực kèm bản gốc Giấy biên nhận còn hiệu lực của tổ chức tín dụng, chi nhánh ngân hàng nước ngoài trong trường hợp xe đang được thế chấp tại tổ chức tín dụng, chi nhánh ngân hàng nước ngoài;\n\nb) Bằng hoặc chứng chỉ điều khiển xe máy chuyên dùng;\n\nc) Giấy phép lái xe hoặc chứng chỉ bồi dưỡng kiến thức pháp luật về giao thông đường bộ;\n\nd) Chứng nhận kiểm định an toàn kỹ thuật và bảo vệ môi trường đối với xe máy chuyên dùng theo quy định của pháp luật;\n\nđ) Chứng nhận bảo hiểm bắt buộc trách nhiệm dân sự theo quy định của pháp luật.\n\n3. Trường hợp giấy tờ quy định tại khoản 1 và khoản 2 Điều này đã được tích hợp vào tài khoản định danh điện tử thì việc xuất trình, kiểm tra có thể thực hiện thông qua tài khoản định danh điện tử.\n\n4. Người lái xe gắn máy tham gia giao thông đường bộ phải hiểu biết quy tắc giao thông đường bộ, có kỹ năng điều khiển phương tiện; đủ điều kiện về độ tuổi, sức khỏe theo quy định tại điểm a khoản 1 và khoản 2 Điều 59 của Luật này.\n\n5. Người tập lái xe ô tô, người dự sát hạch lái xe ô tô khi tham gia giao thông đường bộ phải thực hành trên xe tập lái, xe sát hạch trên tuyến đường tập lái, tuyến đường sát hạch, có giáo viên dạy lái hoặc sát hạch viên bảo trợ tay lái. Giáo viên dạy lái, sát hạch viên phải mang theo các loại giấy tờ quy định tại khoản 1 Điều này.\n\nĐiều 57. Giấy phép lái xe\n\n1. Giấy phép lái xe bao gồm các hạng sau đây:\n\na) Hạng A1 cấp cho người lái xe mô tô hai bánh có dung tích xi-lanh đến 125 cm3 hoặc có công suất động cơ điện đến 11 kW;\n\nb) Hạng A cấp cho người lái xe mô tô hai bánh có dung tích xi-lanh\xa0 trên 125 cm3\xa0hoặc có công suất động cơ điện trên 11 kW và các loại xe quy định cho giấy phép lái xe hạng A1;\n\nc) Hạng B1 cấp cho người lái xe mô tô ba bánh và các loại xe quy định cho giấy phép lái xe hạng A1;\n\nd) Hạng B cấp cho người lái xe ô tô chở người đến 08 chỗ (không kể chỗ của người lái xe); xe ô tô tải và ô tô chuyên dùng có khối lượng toàn bộ theo thiết kế đến 3.500 kg; các loại xe ô tô quy định cho giấy phép lái xe hạng B kéo rơ moóc có khối lượng toàn bộ theo thiết kế đến 750 kg; \n\nđ) Hạng C1 cấp cho người lái xe ô tô tải và ô tô chuyên dùng có khối lượng toàn bộ theo thiết kế trên 3.500 kg đến 7.500 kg; các loại xe ô tô tải quy định cho giấy phép lái xe hạng C1 kéo rơ moóc có khối lượng toàn bộ theo thiết kế đến 750 kg; các loại xe quy định cho giấy phép lái xe hạng B;\n\ne) Hạng C cấp cho người lái xe ô tô tải và ô tô chuyên dùng có khối lượng toàn bộ theo thiết kế trên 7.500 kg; các loại xe ô tô tải quy định cho giấy phép lái xe hạng C kéo rơ moóc có khối lượng toàn bộ theo thiết kế đến 750 kg; các loại xe quy định cho giấy phép lái xe hạng B và hạng C1;\n\ng) Hạng D1 cấp cho người lái xe ô tô chở người trên 08 chỗ (không kể chỗ của người lái xe) đến 16 chỗ (không kể chỗ của người lái xe); các loại xe ô tô chở người quy định cho giấy phép lái xe hạng D1 kéo rơ moóc có khối lượng toàn bộ theo thiết kế đến 750 kg; các loại xe quy định cho giấy phép lái xe các hạng B, C1, C;\n\nh) Hạng D2 cấp cho người lái xe ô tô chở người (kể cả xe buýt) trên 16 chỗ (không kể chỗ của người lái xe) đến 29 chỗ (không kể chỗ của người lái xe); các loại xe ô tô chở người quy định cho giấy phép lái xe hạng D2 kéo rơ moóc có khối lượng toàn bộ theo thiết kế đến 750 kg; các loại xe quy định cho giấy phép lái xe các hạng B, C1, C, D1;\n\ni) Hạng D cấp cho người lái xe ô tô chở người (kể cả xe buýt) trên 29 chỗ (không kể chỗ của người lái xe); xe ô tô chở người giường nằm; các loại xe ô tô chở người quy định cho giấy phép lái xe hạng D kéo rơ moóc có khối lượng toàn bộ theo thiết kế đến 750 kg; các loại xe quy định cho giấy phép lái xe các hạng B, C1, C, D1, D2;\n\nk) Hạng BE cấp cho người lái các loại xe ô tô quy định cho giấy phép lái xe hạng B kéo rơ moóc có khối lượng toàn bộ theo thiết kế trên 750 kg;\n\nl) Hạng C1E cấp cho người lái các loại xe ô tô quy định cho giấy phép lái xe hạng C1 kéo rơ moóc có khối lượng toàn bộ theo thiết kế trên 750 kg;\n\nm) Hạng CE cấp cho người lái các loại xe ô tô quy định cho giấy phép lái xe hạng C kéo rơ moóc có khối lượng toàn bộ theo thiết kế trên 750 kg; xe ô tô đầu kéo kéo sơ mi rơ moóc;\n\nn) Hạng D1E cấp cho người lái các loại xe ô tô quy định cho giấy phép lái xe hạng D1 kéo rơ moóc có khối lượng toàn bộ theo thiết kế trên 750 kg;\n\no) Hạng D2E cấp cho người lái các loại xe ô tô quy định cho giấy phép lái xe hạng D2 kéo rơ moóc có khối lượng toàn bộ theo thiết kế trên 750 kg;\n\np) Hạng DE cấp cho người lái các loại xe ô tô quy định cho giấy phép lái xe hạng D kéo rơ moóc có khối lượng toàn bộ theo thiết kế trên 750 kg; xe ô tô chở khách nối toa.\n\n2. Người khuyết tật điều khiển xe mô tô ba bánh dùng cho người khuyết tật được cấp giấy phép lái xe hạng A1.\n\nNgười khuyết tật điều khiển xe ô tô số tự động có kết cấu phù hợp với tình trạng khuyết tật thì được cấp giấy phép lái xe hạng B.\n\n3. Người điều khiển xe chở hàng bốn bánh có gắn động cơ, xe chở người bốn bánh có gắn động cơ phải sử dụng giấy phép lái xe có hạng phù hợp với xe ô tô tải hoặc xe ô tô chở người tương ứng.\n\n4. Người điều khiển xe ô tô có thiết kế, cải tạo với số chỗ ít hơn xe cùng loại, kích thước giới hạn tương đương phải sử dụng giấy phép lái xe có hạng phù hợp với xe ô tô cùng loại, kích thước giới hạn tương đương và có số chỗ nhiều nhất.\n\n5. Thời hạn của giấy phép lái xe được quy định như sau:\n\na) Giấy phép lái xe các hạng A1, A, B1 không thời hạn;\n\nb) Giấy phép lái xe hạng B và hạng C1 có thời hạn 10 năm kể từ ngày cấp;\n\nc) Giấy phép lái xe các hạng C, D1, D2, D, BE, C1E, CE, D1E, D2E và DE có thời hạn 05 năm kể từ ngày cấp.\n\n6. Giấy phép lái xe có giá trị sử dụng trong phạm vi lãnh thổ Việt Nam bao gồm:\n\na) Giấy phép lái xe do cơ quan có thẩm quyền của Việt Nam cấp;\n\nb) Giấy phép lái xe quốc tế và giấy phép lái xe quốc gia phù hợp với loại xe được phép điều khiển do quốc gia là thành viên của Công ước của Liên hợp quốc về Giao thông đường bộ năm 1968 (sau đây gọi là Công ước Viên) cấp;\n\nc) Giấy phép lái xe phù hợp với loại xe được phép điều khiển của nước hoặc vùng lãnh thổ mà Việt Nam ký kết điều ước quốc tế hoặc thỏa thuận quốc tế công nhận giấy phép lái xe của nhau;\n\nd) Giấy phép lái xe nước ngoài phù hợp với loại xe được phép điều khiển do quốc gia được công nhận theo điều ước quốc tế mà nước Cộng hòa xã hội chủ nghĩa Việt Nam là thành viên.\n\n7. Giấy phép lái xe không có hiệu lực trong các trường hợp sau đây:\n\na) Giấy phép lái xe hết thời hạn sử dụng;\n\nb) Giấy phép lái xe bị thu hồi theo quy định tại khoản 5 Điều 62 của Luật này.\n\n8. Giấy phép lái xe quốc tế được quy định như sau:\n\na) Giấy phép lái xe quốc tế là giấy phép lái xe do cơ quan nhà nước có thẩm quyền của quốc gia là thành viên của Công ước Viên cấp theo một mẫu thống nhất; có thời hạn không quá 03 năm kể từ ngày cấp và phải phù hợp với thời hạn còn hiệu lực của giấy phép lái xe quốc gia;']","**Nguồn văn bản:** /content/drive/MyDrive/ITProject_data/new_law/36_2024_QH15_444251.docx

**Tên văn bản:** Không có tiêu đề

**Điều 57. Giấy phép lái xe:**

**Nội dung:**

Người được cấp giấy phép lái xe hạng D2E được phép lái các loại xe ô tô quy định cho giấy phép lái xe hạng D2 kéo rơ moóc có khối lượng toàn bộ theo thiết kế trên 750 kg. Cụ thể, giấy phép lái xe hạng D2 cấp cho người lái xe ô tô chở người (kể cả xe buýt) trên 16 chỗ (không kể chỗ của người lái xe) đến 29 chỗ (không kể chỗ của người lái xe); các loại xe ô tô chở người quy định cho giấy phép lái xe hạng D2 kéo rơ moóc có khối lượng toàn bộ theo thiết kế đến 750 kg; các loại xe quy định cho giấy phép lái xe các hạng B, C1, C, D1.


**Tóm lại:** Giấy phép lái xe hạng D2E cho phép lái xe ô tô chở người từ 16 đến 29 chỗ kéo rơ moóc trên 750 kg và tất cả các loại xe thuộc hạng B, C1, C, D1, D2.
","**Nguồn văn bản:** 36_2024_QH15_444251

**Tên văn bản:** Luật Trật tự, an toàn giao thông đường bộ

**Điều 57:** Giấy phép lái xe

**Nội dung:**

Giấy phép lái xe hạng D2E cấp cho người lái:

1. Các loại xe ô tô quy định cho giấy phép lái xe hạng D2:
    a) Ô tô chở người (kể cả xe buýt) trên 16 chỗ (không kể chỗ của người lái xe) đến 29 chỗ (không kể chỗ của người lái xe).
    b) Các loại xe ô tô chở người quy định cho giấy phép lái xe hạng D2 kéo rơ moóc có khối lượng toàn bộ theo thiết kế đến 750 kg.
    c) Các loại xe quy định cho giấy phép lái xe các hạng B, C1, C, D1.

2. Kéo rơ moóc có khối lượng toàn bộ theo thiết kế trên 750 kg.


**Tóm lại:** Giấy phép lái xe hạng D2E cho phép lái xe ô tô chở người từ 17 đến 29 chỗ (kể cả xe buýt), kéo theo rơ-moóc trên 750kg, và tất cả các loại xe thuộc hạng B, C1, C, D1, D2 (kể cả khi kéo rơ-moóc đến 750kg).
",1.0,0.9272878763156264,0.7272727272727273,0.9999999999
9,Giấy phép lái xe hạng DE cho phép lái những loại xe nào?,"['a) Chứng nhận đăng ký xe hoặc bản sao Chứng nhận đăng ký xe có chứng thực kèm bản gốc giấy tờ xác nhận của tổ chức tín dụng, chi nhánh ngân hàng nước ngoài còn hiệu lực trong trường hợp xe đang được thế chấp tại tổ chức tín dụng, chi nhánh ngân hàng nước ngoài;\n\nb) Giấy phép lái xe phù hợp với loại xe đang điều khiển;\n\nc) Chứng nhận kiểm định an toàn kỹ thuật và bảo vệ môi trường đối với xe cơ giới theo quy định của pháp luật;\n\nd) Chứng nhận bảo hiểm bắt buộc trách nhiệm dân sự của chủ xe cơ giới.\n\n2. Người điều khiển xe máy chuyên dùng tham gia giao thông đường bộ phải đủ tuổi, sức khỏe theo quy định của pháp luật; có bằng hoặc chứng chỉ điều khiển xe máy chuyên dùng phù hợp loại xe máy chuyên dùng đang điều khiển; có giấy phép lái xe đang còn điểm, còn hiệu lực hoặc chứng chỉ bồi dưỡng kiến thức pháp luật về giao thông đường bộ. Khi tham gia giao thông đường bộ, người điều khiển xe máy chuyên dùng phải mang theo các loại giấy tờ sau đây:\n\na) Chứng nhận đăng ký xe hoặc bản sao Chứng nhận đăng ký xe có chứng thực kèm bản gốc Giấy biên nhận còn hiệu lực của tổ chức tín dụng, chi nhánh ngân hàng nước ngoài trong trường hợp xe đang được thế chấp tại tổ chức tín dụng, chi nhánh ngân hàng nước ngoài;\n\nb) Bằng hoặc chứng chỉ điều khiển xe máy chuyên dùng;\n\nc) Giấy phép lái xe hoặc chứng chỉ bồi dưỡng kiến thức pháp luật về giao thông đường bộ;\n\nd) Chứng nhận kiểm định an toàn kỹ thuật và bảo vệ môi trường đối với xe máy chuyên dùng theo quy định của pháp luật;\n\nđ) Chứng nhận bảo hiểm bắt buộc trách nhiệm dân sự theo quy định của pháp luật.\n\n3. Trường hợp giấy tờ quy định tại khoản 1 và khoản 2 Điều này đã được tích hợp vào tài khoản định danh điện tử thì việc xuất trình, kiểm tra có thể thực hiện thông qua tài khoản định danh điện tử.\n\n4. Người lái xe gắn máy tham gia giao thông đường bộ phải hiểu biết quy tắc giao thông đường bộ, có kỹ năng điều khiển phương tiện; đủ điều kiện về độ tuổi, sức khỏe theo quy định tại điểm a khoản 1 và khoản 2 Điều 59 của Luật này.\n\n5. Người tập lái xe ô tô, người dự sát hạch lái xe ô tô khi tham gia giao thông đường bộ phải thực hành trên xe tập lái, xe sát hạch trên tuyến đường tập lái, tuyến đường sát hạch, có giáo viên dạy lái hoặc sát hạch viên bảo trợ tay lái. Giáo viên dạy lái, sát hạch viên phải mang theo các loại giấy tờ quy định tại khoản 1 Điều này.\n\nĐiều 57. Giấy phép lái xe\n\n1. Giấy phép lái xe bao gồm các hạng sau đây:\n\na) Hạng A1 cấp cho người lái xe mô tô hai bánh có dung tích xi-lanh đến 125 cm3 hoặc có công suất động cơ điện đến 11 kW;\n\nb) Hạng A cấp cho người lái xe mô tô hai bánh có dung tích xi-lanh\xa0 trên 125 cm3\xa0hoặc có công suất động cơ điện trên 11 kW và các loại xe quy định cho giấy phép lái xe hạng A1;\n\nc) Hạng B1 cấp cho người lái xe mô tô ba bánh và các loại xe quy định cho giấy phép lái xe hạng A1;\n\nd) Hạng B cấp cho người lái xe ô tô chở người đến 08 chỗ (không kể chỗ của người lái xe); xe ô tô tải và ô tô chuyên dùng có khối lượng toàn bộ theo thiết kế đến 3.500 kg; các loại xe ô tô quy định cho giấy phép lái xe hạng B kéo rơ moóc có khối lượng toàn bộ theo thiết kế đến 750 kg; \n\nđ) Hạng C1 cấp cho người lái xe ô tô tải và ô tô chuyên dùng có khối lượng toàn bộ theo thiết kế trên 3.500 kg đến 7.500 kg; các loại xe ô tô tải quy định cho giấy phép lái xe hạng C1 kéo rơ moóc có khối lượng toàn bộ theo thiết kế đến 750 kg; các loại xe quy định cho giấy phép lái xe hạng B;\n\ne) Hạng C cấp cho người lái xe ô tô tải và ô tô chuyên dùng có khối lượng toàn bộ theo thiết kế trên 7.500 kg; các loại xe ô tô tải quy định cho giấy phép lái xe hạng C kéo rơ moóc có khối lượng toàn bộ theo thiết kế đến 750 kg; các loại xe quy định cho giấy phép lái xe hạng B và hạng C1;\n\ng) Hạng D1 cấp cho người lái xe ô tô chở người trên 08 chỗ (không kể chỗ của người lái xe) đến 16 chỗ (không kể chỗ của người lái xe); các loại xe ô tô chở người quy định cho giấy phép lái xe hạng D1 kéo rơ moóc có khối lượng toàn bộ theo thiết kế đến 750 kg; các loại xe quy định cho giấy phép lái xe các hạng B, C1, C;\n\nh) Hạng D2 cấp cho người lái xe ô tô chở người (kể cả xe buýt) trên 16 chỗ (không kể chỗ của người lái xe) đến 29 chỗ (không kể chỗ của người lái xe); các loại xe ô tô chở người quy định cho giấy phép lái xe hạng D2 kéo rơ moóc có khối lượng toàn bộ theo thiết kế đến 750 kg; các loại xe quy định cho giấy phép lái xe các hạng B, C1, C, D1;\n\ni) Hạng D cấp cho người lái xe ô tô chở người (kể cả xe buýt) trên 29 chỗ (không kể chỗ của người lái xe); xe ô tô chở người giường nằm; các loại xe ô tô chở người quy định cho giấy phép lái xe hạng D kéo rơ moóc có khối lượng toàn bộ theo thiết kế đến 750 kg; các loại xe quy định cho giấy phép lái xe các hạng B, C1, C, D1, D2;\n\nk) Hạng BE cấp cho người lái các loại xe ô tô quy định cho giấy phép lái xe hạng B kéo rơ moóc có khối lượng toàn bộ theo thiết kế trên 750 kg;\n\nl) Hạng C1E cấp cho người lái các loại xe ô tô quy định cho giấy phép lái xe hạng C1 kéo rơ moóc có khối lượng toàn bộ theo thiết kế trên 750 kg;\n\nm) Hạng CE cấp cho người lái các loại xe ô tô quy định cho giấy phép lái xe hạng C kéo rơ moóc có khối lượng toàn bộ theo thiết kế trên 750 kg; xe ô tô đầu kéo kéo sơ mi rơ moóc;\n\nn) Hạng D1E cấp cho người lái các loại xe ô tô quy định cho giấy phép lái xe hạng D1 kéo rơ moóc có khối lượng toàn bộ theo thiết kế trên 750 kg;\n\no) Hạng D2E cấp cho người lái các loại xe ô tô quy định cho giấy phép lái xe hạng D2 kéo rơ moóc có khối lượng toàn bộ theo thiết kế trên 750 kg;\n\np) Hạng DE cấp cho người lái các loại xe ô tô quy định cho giấy phép lái xe hạng D kéo rơ moóc có khối lượng toàn bộ theo thiết kế trên 750 kg; xe ô tô chở khách nối toa.\n\n2. Người khuyết tật điều khiển xe mô tô ba bánh dùng cho người khuyết tật được cấp giấy phép lái xe hạng A1.\n\nNgười khuyết tật điều khiển xe ô tô số tự động có kết cấu phù hợp với tình trạng khuyết tật thì được cấp giấy phép lái xe hạng B.\n\n3. Người điều khiển xe chở hàng bốn bánh có gắn động cơ, xe chở người bốn bánh có gắn động cơ phải sử dụng giấy phép lái xe có hạng phù hợp với xe ô tô tải hoặc xe ô tô chở người tương ứng.\n\n4. Người điều khiển xe ô tô có thiết kế, cải tạo với số chỗ ít hơn xe cùng loại, kích thước giới hạn tương đương phải sử dụng giấy phép lái xe có hạng phù hợp với xe ô tô cùng loại, kích thước giới hạn tương đương và có số chỗ nhiều nhất.\n\n5. Thời hạn của giấy phép lái xe được quy định như sau:\n\na) Giấy phép lái xe các hạng A1, A, B1 không thời hạn;\n\nb) Giấy phép lái xe hạng B và hạng C1 có thời hạn 10 năm kể từ ngày cấp;\n\nc) Giấy phép lái xe các hạng C, D1, D2, D, BE, C1E, CE, D1E, D2E và DE có thời hạn 05 năm kể từ ngày cấp.\n\n6. Giấy phép lái xe có giá trị sử dụng trong phạm vi lãnh thổ Việt Nam bao gồm:\n\na) Giấy phép lái xe do cơ quan có thẩm quyền của Việt Nam cấp;\n\nb) Giấy phép lái xe quốc tế và giấy phép lái xe quốc gia phù hợp với loại xe được phép điều khiển do quốc gia là thành viên của Công ước của Liên hợp quốc về Giao thông đường bộ năm 1968 (sau đây gọi là Công ước Viên) cấp;\n\nc) Giấy phép lái xe phù hợp với loại xe được phép điều khiển của nước hoặc vùng lãnh thổ mà Việt Nam ký kết điều ước quốc tế hoặc thỏa thuận quốc tế công nhận giấy phép lái xe của nhau;\n\nd) Giấy phép lái xe nước ngoài phù hợp với loại xe được phép điều khiển do quốc gia được công nhận theo điều ước quốc tế mà nước Cộng hòa xã hội chủ nghĩa Việt Nam là thành viên.\n\n7. Giấy phép lái xe không có hiệu lực trong các trường hợp sau đây:\n\na) Giấy phép lái xe hết thời hạn sử dụng;\n\nb) Giấy phép lái xe bị thu hồi theo quy định tại khoản 5 Điều 62 của Luật này.\n\n8. Giấy phép lái xe quốc tế được quy định như sau:\n\na) Giấy phép lái xe quốc tế là giấy phép lái xe do cơ quan nhà nước có thẩm quyền của quốc gia là thành viên của Công ước Viên cấp theo một mẫu thống nhất; có thời hạn không quá 03 năm kể từ ngày cấp và phải phù hợp với thời hạn còn hiệu lực của giấy phép lái xe quốc gia;']","**Nguồn văn bản:** /content/drive/MyDrive/ITProject_data/new_law/36_2024_QH15_444251.docx

**Tên văn bản:** (Không có tiêu đề trong metadata)


**Nội dung:**

Giấy phép lái xe hạng DE cho phép điều khiển các loại xe sau:

p) Các loại xe ô tô quy định cho giấy phép lái xe hạng D kéo rơ moóc có khối lượng toàn bộ theo thiết kế trên 750 kg; xe ô tô chở khách nối toa.

Tóm lại: Giấy phép lái xe hạng DE cho phép điều khiển xe ô tô chở người trên 29 chỗ kéo rơ-moóc trên 750kg và xe ô tô chở khách nối toa.
","**Nguồn văn bản:** 36_2024_QH15_444251

**Tên văn bản:** Luật Trật tự, an toàn giao thông đường bộ

**Điều 57:** Giấy phép lái xe

**Nội dung:**

1. Giấy phép lái xe bao gồm các hạng sau đây:

        a) Hạng DE cấp cho người lái các loại xe ô tô quy định cho giấy phép lái xe hạng D kéo rơ moóc có khối lượng toàn bộ theo thiết kế trên 750 kg; xe ô tô chở khách nối toa.

        b) Hạng D cấp cho người lái xe ô tô chở người trên 29 chỗ (không kể chỗ của người lái xe); xe ô tô chở người giường nằm; các loại xe ô tô chở người quy định cho giấy phép lái xe hạng D kéo rơ moóc có khối lượng toàn bộ theo thiết kế đến 750 kg; các loại xe quy định cho giấy phép lái xe các hạng B, C1, C, D1, D2.


**Tóm lại:** Giấy phép lái xe hạng DE cho phép lái xe ô tô chở người trên 29 chỗ kéo rơ moóc trên 750 kg và xe ô tô chở khách nối toa.  Ngoài ra, người có bằng DE được phép lái tất cả các loại xe thuộc hạng D.
",1.0,0.9169171411585215,0.7777777777777778,0.9999999999
10,Luật Giao thông Đường bộ 2025 quy định như thế nào về điểm giấy phép lái xe?,"['đ) Không trừ điểm giấy phép lái xe khi giấy phép lái xe đó đang trong thời hạn bị tước quyền sử dụng giấy phép lái xe.\n\n2. Thẩm quyền trừ điểm giấy phép lái xe\n\nNgười có thẩm quyền áp dụng hình thức xử phạt tước quyền sử dụng giấy phép, chứng chỉ hành nghề có thời hạn hoặc đình chỉ hoạt động có thời hạn quy định tại Chương II Phần thứ hai của Luật Xử lý vi phạm hành chính, Mục 1 Chương III của Nghị định này và có thẩm quyền xử phạt vi phạm hành chính đối với hành vi vi phạm có quy định trừ điểm giấy phép lái xe thì có thẩm quyền trừ điểm giấy phép lái xe đối với hành vi vi phạm đó.\n\n3. Trình tự, thủ tục trừ điểm giấy phép lái xe\n\na) Ngay sau khi quyết định xử phạt vi phạm hành chính có hiệu lực thi hành, dữ liệu trừ điểm giấy phép lái xe của người bị xử phạt sẽ được cập nhật tự động vào Cơ sở dữ liệu về xử lý vi phạm hành chính về trật tự, an toàn giao thông đường bộ, người có thẩm quyền trừ điểm giấy phép lái xe thông báo cho người bị trừ điểm giấy phép lái xe biết việc trừ điểm.\n\nTrường hợp Chủ tịch Ủy ban nhân dân cấp huyện, Chủ tịch Ủy ban nhân dân cấp tỉnh ra quyết định xử phạt vi phạm hành chính đối với hành vi vi phạm có trừ điểm giấy phép lái xe thì Trưởng Công an cấp huyện hoặc Trưởng phòng Cảnh sát giao thông Công an cấp tỉnh có trách nhiệm cập nhật dữ liệu trừ điểm giấy phép lái xe vào Cơ sở dữ liệu về xử lý vi phạm hành chính về trật tự, an toàn giao thông đường bộ;\n\nb) Việc thông báo trừ điểm giấy phép lái xe thực hiện bằng văn bản theo mẫu quy định của Bộ trưởng Bộ Công an và được giao trực tiếp hoặc gửi qua dịch vụ bưu chính hoặc thực hiện thông báo bằng phương thức điện tử thông qua tài khoản của công dân đăng ký trên Cổng dịch vụ công, Ứng dụng giao thông trên thiết bị di động khi đáp ứng điều kiện về cơ sở hạ tầng, kỹ thuật, thông tin; đồng thời cập nhật thông tin về giấy phép lái xe bị trừ điểm trên Trang thông tin điện tử của Cục Cảnh sát giao thông. Trường hợp giấy phép lái xe được thể hiện dưới hình thức thông điệp dữ liệu thì cơ quan, người có thẩm quyền thực hiện cập nhật trạng thái trừ điểm giấy phép lái xe trong căn cước điện tử, tài khoản định danh điện tử trên ứng dụng định danh quốc gia.\n\nĐiều 51. Thẩm quyền, trình tự, thủ tục phục hồi điểm giấy phép lái xe\n\n1. Thẩm quyền phục hồi điểm giấy phép lái xe\n\na) Cục trưởng Cục Cảnh sát giao thông có trách nhiệm quản lý, vận hành Cơ sở dữ liệu về xử lý vi phạm hành chính về trật tự, an toàn giao thông đường bộ để thực hiện cập nhật, tự động phục hồi điểm giấy phép lái xe đối với trường hợp quy định tại khoản 2 Điều này;\n\nb) Cục trưởng Cục Cảnh sát giao thông, Trưởng phòng Cảnh sát giao thông nơi tổ chức kiểm tra kiến thức pháp luật về trật tự, an toàn giao thông đường bộ có thẩm quyền phục hồi điểm cho giấy phép lái xe đối với trường hợp quy định tại khoản 3 Điều này.\n\n2. Trình tự, thủ tục phục hồi điểm giấy phép lái xe đối với trường hợp giấy phép lái xe chưa bị trừ hết điểm và không bị trừ điểm trong thời hạn 12 tháng từ ngày bị trừ điểm gần nhất\n\na) Khi đủ thời hạn 12 tháng, kể từ ngày bị trừ điểm giấy phép lái xe gần nhất, dữ liệu điểm giấy phép lái xe sẽ được tự động phục hồi đủ 12 điểm (gồm cả giấy phép lái xe đang trong thời hạn bị tước quyền sử dụng) và cập nhật tự động trong Cơ sở dữ liệu về xử lý vi phạm hành chính về trật tự, an toàn giao thông đường bộ;\n\nb) Ngay sau khi dữ liệu điểm giấy phép lái xe được phục hồi, Cơ sở dữ liệu về xử lý vi phạm hành chính về trật tự, an toàn giao thông đường bộ sẽ tự động chuyển thông tin thông báo cho người được phục hồi điểm giấy phép lái xe biết việc phục hồi điểm theo quy định tại điểm c khoản này;\n\nc) Việc thông báo phục hồi điểm giấy phép lái xe thực hiện bằng phương thức điện tử thông qua tài khoản của công dân đăng ký trên Cổng dịch vụ công, Ứng dụng giao thông trên thiết bị di động; đồng thời cập nhật thông tin về giấy phép lái xe được phục hồi điểm trên Trang thông tin điện tử của Cục Cảnh sát giao thông. Trường hợp giấy phép lái xe được thể hiện dưới hình thức thông điệp dữ liệu thì thực hiện cập nhật trạng thái phục hồi điểm giấy phép lái xe trong căn cước điện tử, tài khoản định danh điện tử trên ứng dụng định danh quốc gia.\n\n3. Trình tự, thủ tục phục hồi điểm giấy phép lái xe đối với trường hợp giấy phép lái xe bị trừ hết điểm\n\na) Sau khi người có giấy phép lái xe bị trừ hết điểm tham gia kiểm tra nội dung kiến thức pháp luật về trật tự, an toàn giao thông đường bộ và đạt yêu cầu, kết quả kiểm tra được cập nhật vào phần mềm kiểm tra kiến thức pháp luật về trật tự, an toàn giao thông đường bộ và đồng bộ dữ liệu với Cơ sở dữ liệu về xử lý vi phạm hành chính về trật tự, an toàn giao thông đường bộ, dữ liệu điểm giấy phép lái xe sẽ được phục hồi đủ 12 điểm và cập nhật tự động trong Cơ sở dữ liệu về xử lý vi phạm hành chính về trật tự, an toàn giao thông đường bộ;\n\nb) Ngay sau khi dữ liệu điểm giấy phép lái xe được phục hồi đủ 12 điểm thì người có thẩm quyền quy định tại điểm b khoản 1 Điều này thông báo cho người được phục hồi điểm giấy phép lái xe biết việc phục hồi điểm;\n\nc) Việc thông báo phục hồi điểm giấy phép lái xe thực hiện bằng văn bản theo mẫu quy định của Bộ trưởng Bộ Công an và được giao trực tiếp hoặc gửi qua dịch vụ bưu chính hoặc thực hiện thông báo bằng phương thức điện tử thông qua tài khoản của công dân đăng ký trên Cổng dịch vụ công, Ứng dụng giao thông trên thiết bị di động; đồng thời cập nhật thông tin về giấy phép lái xe được phục hồi điểm trên Trang thông tin điện tử của Cục Cảnh sát giao thông. Trường hợp giấy phép lái xe được thể hiện dưới hình thức thông điệp dữ liệu thì cơ quan, người có thẩm quyền thực hiện cập nhật trạng thái phục hồi điểm giấy phép lái xe trong căn cước điện tử, tài khoản định danh điện tử trên ứng dụng định danh quốc gia.\n\nChương IV\n\nĐIỀU KHOẢN THI HÀNH\n\nĐiều 52. Sửa đổi, bổ sung một số điều của Nghị định số 100/2019/NĐ-CP ngày 30 tháng 12 năm 2019 của Chính phủ quy định xử phạt vi phạm hành chính trong lĩnh vực giao thông đường bộ và đường sắt đã được sửa đổi, bổ sung một số điều theo Nghị định số 123/2021/NĐ-CP ngày 28 tháng 12 năm 2021 của Chính phủ sửa đổi, bổ sung một số điều của các Nghị định quy định xử phạt vi phạm hành chính trong lĩnh vực hàng hải; giao thông đường bộ, đường sắt; hàng không dân dụng\n\n1. Bổ sung khoản 2a vào sau khoản 2 Điều 1 như sau:\n\n“2a. Hình thức, mức xử phạt, biện pháp khắc phục hậu quả đối với từng hành vi vi phạm hành chính; thẩm quyền lập biên bản, thẩm quyền xử phạt, mức phạt tiền cụ thể đối với từng chức danh về trật tự, an toàn giao thông trong lĩnh vực giao thông đường bộ thì áp dụng quy định tại Nghị định quy định xử phạt vi phạm hành chính về trật tự, an toàn giao thông trong lĩnh vực giao thông đường bộ; trừ điểm, phục hồi điểm giấy phép lái xe”.\n\n2. Sửa đổi, bổ sung một số điểm của khoản 6 Điều 28 như sau:\n\na) Sửa đổi, bổ sung điểm d khoản 6 Điều 28 như sau:\n\n“d) Không thực hiện đúng các nội dung đã đăng ký, niêm yết về: giá cước; giá dịch vụ; tiêu chuẩn chất lượng dịch vụ vận tải, dịch vụ hỗ trợ vận tải;”;\n\nb) Sửa đổi, bổ sung điểm i khoản 6 Điều 28 như sau:\n\n“i) Sử dụng phương tiện kinh doanh vận tải có chất lượng không bảo đảm điều kiện của hình thức kinh doanh đã đăng ký;”.\n\n3. Sửa đổi, bổ sung điểm a, điểm b khoản 10 Điều 28 như sau:\n\n“a) Thực hiện hành vi vi phạm quy định tại điểm a, điểm b, điểm d, điểm đ, điểm h, điểm l, điểm o, điểm p, điểm r, điểm s, điểm t khoản 4; điểm d, điểm i, điểm k, điểm l, điểm n, điểm q khoản 6; điểm e khoản 7 Điều này bị tước quyền sử dụng phù hiệu từ 01 tháng đến 03 tháng (nếu có hoặc đã được cấp) đối với xe vi phạm;\n\nb) Thực hiện hành vi vi phạm quy định tại điểm i, điểm k khoản 4; điểm h khoản 6; điểm b khoản 7 Điều này bị tước quyền sử dụng giấy phép kinh doanh vận tải từ 01 tháng đến 03 tháng;”.\n\n4. Sửa đổi, bổ sung điểm h khoản 11 Điều 28 như sau:\n\n“h) Thực hiện hành vi vi phạm quy định tại điểm n khoản 6 Điều này buộc lắp đặt đồng hồ tính tiền cước, thiết bị in hóa đơn trên xe theo đúng quy định;”.\n\n5. Sửa đổi, bổ sung một số điểm, khoản của Điều 74 như sau:']","**Nguồn văn bản:** /content/drive/MyDrive/ITProject_data/new_law/168_2024_ND-CP_619502.docx

**Tên văn bản:** (Không có tiêu đề trong metadata)


**Nội dung:**

Luật Giao thông Đường bộ quy định về điểm giấy phép lái xe như sau:

**Về việc trừ điểm:**

* Không trừ điểm khi giấy phép lái xe đang bị tước quyền sử dụng.
* Thẩm quyền trừ điểm thuộc về người có thẩm quyền xử phạt vi phạm hành chính.
* Trình tự, thủ tục trừ điểm:
    a) Sau khi quyết định xử phạt có hiệu lực, dữ liệu trừ điểm được cập nhật tự động vào Cơ sở dữ liệu. Người có thẩm quyền thông báo cho người bị trừ điểm.
    b) Thông báo trừ điểm được thực hiện bằng văn bản hoặc phương thức điện tử.


**Về việc phục hồi điểm:**

* Thẩm quyền phục hồi điểm thuộc về Cục trưởng Cục Cảnh sát giao thông.
* Có hai trường hợp phục hồi điểm:
    * Trường hợp 1: Giấy phép lái xe chưa bị trừ hết điểm và không bị trừ điểm trong 12 tháng:
        a) Sau 12 tháng, điểm được tự động phục hồi.
        b) Hệ thống tự động thông báo cho người được phục hồi điểm.
        c) Thông báo được thực hiện bằng phương thức điện tử.

    * Trường hợp 2: Giấy phép lái xe bị trừ hết điểm:
        a) Người vi phạm phải kiểm tra kiến thức luật giao thông và đạt yêu cầu.
        b) Sau khi đạt yêu cầu, điểm được phục hồi và người có thẩm quyền thông báo.
        c) Thông báo được thực hiện bằng văn bản hoặc phương thức điện tử.


Tóm lại: Luật quy định rõ về việc trừ và phục hồi điểm giấy phép lái xe, bao gồm thẩm quyền, trình tự, thủ tục và các trường hợp cụ thể. Việc trừ điểm được thực hiện tự động sau khi có quyết định xử phạt, điểm sẽ được phục hồi sau 12 tháng không vi phạm hoặc sau khi người vi phạm vượt qua bài kiểm tra kiến thức luật giao thông nếu bị trừ hết điểm.
","**Nguồn văn bản:** 36_2024_QH15_444251

**Tên văn bản:** Luật Trật tự, an toàn giao thông đường bộ

**Điều 58:** Điểm của giấy phép lái xe

**Nội dung:**

1. Điểm của giấy phép lái xe được dùng để quản lý việc chấp hành pháp luật về trật tự, an toàn giao thông đường bộ của người lái xe trên hệ thống cơ sở dữ liệu về trật tự, an toàn giao thông đường bộ, bao gồm 12 điểm.

   Số điểm trừ mỗi lần vi phạm tùy thuộc tính chất, mức độ của hành vi vi phạm pháp luật về trật tự, an toàn giao thông đường bộ.

   Dữ liệu về điểm trừ giấy phép lái xe của người vi phạm sẽ được cập nhật vào hệ thống cơ sở dữ liệu ngay sau khi quyết định xử phạt có hiệu lực thi hành và thông báo cho người bị trừ điểm giấy phép lái xe biết.

2. Giấy phép lái xe chưa bị trừ hết điểm và không bị trừ điểm trong thời hạn 12 tháng từ ngày bị trừ điểm gần nhất thì được phục hồi đủ 12 điểm.

3. Trường hợp giấy phép lái xe bị trừ hết điểm thì người có giấy phép lái xe không được điều khiển phương tiện tham gia giao thông đường bộ theo giấy phép lái xe đó.

   Sau thời hạn ít nhất là 06 tháng kể từ ngày bị trừ hết điểm, người có giấy phép lái xe được tham gia kiểm tra nội dung kiến thức pháp luật về trật tự, an toàn giao thông đường bộ theo quy định tại khoản 7 điều 61 của luật này do lực lượng cảnh sát giao thông tổ chức, có kết quả đạt yêu cầu thì được phục hồi đủ 12 điểm.

4. Giấy phép lái xe sau khi đổi, cấp lại, nâng hạng được giữ nguyên số điểm của giấy phép lái xe trước khi đổi, cấp lại, nâng hạng.

5. Người có thẩm quyền xử phạt vi phạm hành chính có thẩm quyền trừ điểm giấy phép lái xe.

6. Chính phủ quy định chi tiết khoản 1 điều này; quy định trình tự, thủ tục, thẩm quyền trừ điểm, phục hồi điểm giấy phép lái xe; quy định lộ trình thực hiện điều này. 

   Bộ trưởng Bộ Công an quy định chi tiết khoản 3 điều này.


**Tóm lại:** Giấy phép lái xe có 12 điểm. Điểm bị trừ khi vi phạm luật giao thông. Nếu bị trừ hết điểm, người lái xe không được lái xe cho đến khi được phục hồi điểm sau khi thi lại.  Giấy phép lái xe được phục hồi 12 điểm nếu không bị trừ điểm trong vòng 12 tháng.
",0.75,0.72397394589633,0.4666666666666667,0.9999999999
11,Người lái xe máy cần làm gì để phục hồi điểm giấy phép lái xe?,"['đ) Không trừ điểm giấy phép lái xe khi giấy phép lái xe đó đang trong thời hạn bị tước quyền sử dụng giấy phép lái xe.\n\n2. Thẩm quyền trừ điểm giấy phép lái xe\n\nNgười có thẩm quyền áp dụng hình thức xử phạt tước quyền sử dụng giấy phép, chứng chỉ hành nghề có thời hạn hoặc đình chỉ hoạt động có thời hạn quy định tại Chương II Phần thứ hai của Luật Xử lý vi phạm hành chính, Mục 1 Chương III của Nghị định này và có thẩm quyền xử phạt vi phạm hành chính đối với hành vi vi phạm có quy định trừ điểm giấy phép lái xe thì có thẩm quyền trừ điểm giấy phép lái xe đối với hành vi vi phạm đó.\n\n3. Trình tự, thủ tục trừ điểm giấy phép lái xe\n\na) Ngay sau khi quyết định xử phạt vi phạm hành chính có hiệu lực thi hành, dữ liệu trừ điểm giấy phép lái xe của người bị xử phạt sẽ được cập nhật tự động vào Cơ sở dữ liệu về xử lý vi phạm hành chính về trật tự, an toàn giao thông đường bộ, người có thẩm quyền trừ điểm giấy phép lái xe thông báo cho người bị trừ điểm giấy phép lái xe biết việc trừ điểm.\n\nTrường hợp Chủ tịch Ủy ban nhân dân cấp huyện, Chủ tịch Ủy ban nhân dân cấp tỉnh ra quyết định xử phạt vi phạm hành chính đối với hành vi vi phạm có trừ điểm giấy phép lái xe thì Trưởng Công an cấp huyện hoặc Trưởng phòng Cảnh sát giao thông Công an cấp tỉnh có trách nhiệm cập nhật dữ liệu trừ điểm giấy phép lái xe vào Cơ sở dữ liệu về xử lý vi phạm hành chính về trật tự, an toàn giao thông đường bộ;\n\nb) Việc thông báo trừ điểm giấy phép lái xe thực hiện bằng văn bản theo mẫu quy định của Bộ trưởng Bộ Công an và được giao trực tiếp hoặc gửi qua dịch vụ bưu chính hoặc thực hiện thông báo bằng phương thức điện tử thông qua tài khoản của công dân đăng ký trên Cổng dịch vụ công, Ứng dụng giao thông trên thiết bị di động khi đáp ứng điều kiện về cơ sở hạ tầng, kỹ thuật, thông tin; đồng thời cập nhật thông tin về giấy phép lái xe bị trừ điểm trên Trang thông tin điện tử của Cục Cảnh sát giao thông. Trường hợp giấy phép lái xe được thể hiện dưới hình thức thông điệp dữ liệu thì cơ quan, người có thẩm quyền thực hiện cập nhật trạng thái trừ điểm giấy phép lái xe trong căn cước điện tử, tài khoản định danh điện tử trên ứng dụng định danh quốc gia.\n\nĐiều 51. Thẩm quyền, trình tự, thủ tục phục hồi điểm giấy phép lái xe\n\n1. Thẩm quyền phục hồi điểm giấy phép lái xe\n\na) Cục trưởng Cục Cảnh sát giao thông có trách nhiệm quản lý, vận hành Cơ sở dữ liệu về xử lý vi phạm hành chính về trật tự, an toàn giao thông đường bộ để thực hiện cập nhật, tự động phục hồi điểm giấy phép lái xe đối với trường hợp quy định tại khoản 2 Điều này;\n\nb) Cục trưởng Cục Cảnh sát giao thông, Trưởng phòng Cảnh sát giao thông nơi tổ chức kiểm tra kiến thức pháp luật về trật tự, an toàn giao thông đường bộ có thẩm quyền phục hồi điểm cho giấy phép lái xe đối với trường hợp quy định tại khoản 3 Điều này.\n\n2. Trình tự, thủ tục phục hồi điểm giấy phép lái xe đối với trường hợp giấy phép lái xe chưa bị trừ hết điểm và không bị trừ điểm trong thời hạn 12 tháng từ ngày bị trừ điểm gần nhất\n\na) Khi đủ thời hạn 12 tháng, kể từ ngày bị trừ điểm giấy phép lái xe gần nhất, dữ liệu điểm giấy phép lái xe sẽ được tự động phục hồi đủ 12 điểm (gồm cả giấy phép lái xe đang trong thời hạn bị tước quyền sử dụng) và cập nhật tự động trong Cơ sở dữ liệu về xử lý vi phạm hành chính về trật tự, an toàn giao thông đường bộ;\n\nb) Ngay sau khi dữ liệu điểm giấy phép lái xe được phục hồi, Cơ sở dữ liệu về xử lý vi phạm hành chính về trật tự, an toàn giao thông đường bộ sẽ tự động chuyển thông tin thông báo cho người được phục hồi điểm giấy phép lái xe biết việc phục hồi điểm theo quy định tại điểm c khoản này;\n\nc) Việc thông báo phục hồi điểm giấy phép lái xe thực hiện bằng phương thức điện tử thông qua tài khoản của công dân đăng ký trên Cổng dịch vụ công, Ứng dụng giao thông trên thiết bị di động; đồng thời cập nhật thông tin về giấy phép lái xe được phục hồi điểm trên Trang thông tin điện tử của Cục Cảnh sát giao thông. Trường hợp giấy phép lái xe được thể hiện dưới hình thức thông điệp dữ liệu thì thực hiện cập nhật trạng thái phục hồi điểm giấy phép lái xe trong căn cước điện tử, tài khoản định danh điện tử trên ứng dụng định danh quốc gia.\n\n3. Trình tự, thủ tục phục hồi điểm giấy phép lái xe đối với trường hợp giấy phép lái xe bị trừ hết điểm\n\na) Sau khi người có giấy phép lái xe bị trừ hết điểm tham gia kiểm tra nội dung kiến thức pháp luật về trật tự, an toàn giao thông đường bộ và đạt yêu cầu, kết quả kiểm tra được cập nhật vào phần mềm kiểm tra kiến thức pháp luật về trật tự, an toàn giao thông đường bộ và đồng bộ dữ liệu với Cơ sở dữ liệu về xử lý vi phạm hành chính về trật tự, an toàn giao thông đường bộ, dữ liệu điểm giấy phép lái xe sẽ được phục hồi đủ 12 điểm và cập nhật tự động trong Cơ sở dữ liệu về xử lý vi phạm hành chính về trật tự, an toàn giao thông đường bộ;\n\nb) Ngay sau khi dữ liệu điểm giấy phép lái xe được phục hồi đủ 12 điểm thì người có thẩm quyền quy định tại điểm b khoản 1 Điều này thông báo cho người được phục hồi điểm giấy phép lái xe biết việc phục hồi điểm;\n\nc) Việc thông báo phục hồi điểm giấy phép lái xe thực hiện bằng văn bản theo mẫu quy định của Bộ trưởng Bộ Công an và được giao trực tiếp hoặc gửi qua dịch vụ bưu chính hoặc thực hiện thông báo bằng phương thức điện tử thông qua tài khoản của công dân đăng ký trên Cổng dịch vụ công, Ứng dụng giao thông trên thiết bị di động; đồng thời cập nhật thông tin về giấy phép lái xe được phục hồi điểm trên Trang thông tin điện tử của Cục Cảnh sát giao thông. Trường hợp giấy phép lái xe được thể hiện dưới hình thức thông điệp dữ liệu thì cơ quan, người có thẩm quyền thực hiện cập nhật trạng thái phục hồi điểm giấy phép lái xe trong căn cước điện tử, tài khoản định danh điện tử trên ứng dụng định danh quốc gia.\n\nChương IV\n\nĐIỀU KHOẢN THI HÀNH\n\nĐiều 52. Sửa đổi, bổ sung một số điều của Nghị định số 100/2019/NĐ-CP ngày 30 tháng 12 năm 2019 của Chính phủ quy định xử phạt vi phạm hành chính trong lĩnh vực giao thông đường bộ và đường sắt đã được sửa đổi, bổ sung một số điều theo Nghị định số 123/2021/NĐ-CP ngày 28 tháng 12 năm 2021 của Chính phủ sửa đổi, bổ sung một số điều của các Nghị định quy định xử phạt vi phạm hành chính trong lĩnh vực hàng hải; giao thông đường bộ, đường sắt; hàng không dân dụng\n\n1. Bổ sung khoản 2a vào sau khoản 2 Điều 1 như sau:\n\n“2a. Hình thức, mức xử phạt, biện pháp khắc phục hậu quả đối với từng hành vi vi phạm hành chính; thẩm quyền lập biên bản, thẩm quyền xử phạt, mức phạt tiền cụ thể đối với từng chức danh về trật tự, an toàn giao thông trong lĩnh vực giao thông đường bộ thì áp dụng quy định tại Nghị định quy định xử phạt vi phạm hành chính về trật tự, an toàn giao thông trong lĩnh vực giao thông đường bộ; trừ điểm, phục hồi điểm giấy phép lái xe”.\n\n2. Sửa đổi, bổ sung một số điểm của khoản 6 Điều 28 như sau:\n\na) Sửa đổi, bổ sung điểm d khoản 6 Điều 28 như sau:\n\n“d) Không thực hiện đúng các nội dung đã đăng ký, niêm yết về: giá cước; giá dịch vụ; tiêu chuẩn chất lượng dịch vụ vận tải, dịch vụ hỗ trợ vận tải;”;\n\nb) Sửa đổi, bổ sung điểm i khoản 6 Điều 28 như sau:\n\n“i) Sử dụng phương tiện kinh doanh vận tải có chất lượng không bảo đảm điều kiện của hình thức kinh doanh đã đăng ký;”.\n\n3. Sửa đổi, bổ sung điểm a, điểm b khoản 10 Điều 28 như sau:\n\n“a) Thực hiện hành vi vi phạm quy định tại điểm a, điểm b, điểm d, điểm đ, điểm h, điểm l, điểm o, điểm p, điểm r, điểm s, điểm t khoản 4; điểm d, điểm i, điểm k, điểm l, điểm n, điểm q khoản 6; điểm e khoản 7 Điều này bị tước quyền sử dụng phù hiệu từ 01 tháng đến 03 tháng (nếu có hoặc đã được cấp) đối với xe vi phạm;\n\nb) Thực hiện hành vi vi phạm quy định tại điểm i, điểm k khoản 4; điểm h khoản 6; điểm b khoản 7 Điều này bị tước quyền sử dụng giấy phép kinh doanh vận tải từ 01 tháng đến 03 tháng;”.\n\n4. Sửa đổi, bổ sung điểm h khoản 11 Điều 28 như sau:\n\n“h) Thực hiện hành vi vi phạm quy định tại điểm n khoản 6 Điều này buộc lắp đặt đồng hồ tính tiền cước, thiết bị in hóa đơn trên xe theo đúng quy định;”.\n\n5. Sửa đổi, bổ sung một số điểm, khoản của Điều 74 như sau:']","**Nguồn văn bản:** /content/drive/MyDrive/ITProject_data/new_law/168_2024_ND-CP_619502.docx

**Tên văn bản:** (Không có tiêu đề trong metadata)


**Nội dung:**

Điều kiện để phục hồi điểm giấy phép lái xe máy được chia thành hai trường hợp:

1. Giấy phép lái xe chưa bị trừ hết điểm và không bị trừ điểm trong thời hạn 12 tháng từ ngày bị trừ điểm gần nhất:

    a) Khi đủ thời hạn 12 tháng, kể từ ngày bị trừ điểm giấy phép lái xe gần nhất, điểm giấy phép lái xe sẽ được tự động phục hồi đủ 12 điểm (bao gồm cả giấy phép lái xe đang trong thời hạn bị tước quyền sử dụng). Dữ liệu được cập nhật tự động trong Cơ sở dữ liệu về xử lý vi phạm hành chính về trật tự, an toàn giao thông đường bộ.

    b) Hệ thống sẽ tự động thông báo cho người được phục hồi điểm.

    c) Thông báo được gửi bằng phương thức điện tử hoặc cập nhật trong căn cước công dân điện tử, tài khoản định danh điện tử.


2. Giấy phép lái xe bị trừ hết điểm:

    a) Người có giấy phép lái xe bị trừ hết điểm phải tham gia kiểm tra kiến thức pháp luật về trật tự, an toàn giao thông đường bộ và đạt yêu cầu. Kết quả kiểm tra sẽ được cập nhật vào hệ thống và điểm giấy phép lái xe sẽ được phục hồi đủ 12 điểm.

    b) Cơ quan có thẩm quyền sẽ thông báo cho người được phục hồi điểm.

    c) Thông báo được gửi bằng văn bản, phương thức điện tử hoặc cập nhật trong căn cước công dân điện tử, tài khoản định danh điện tử.


**Tóm lại:** Điểm giấy phép lái xe máy sẽ được tự động phục hồi sau 12 tháng không vi phạm. Nếu bị trừ hết điểm, cần tham gia và đạt yêu cầu kỳ kiểm tra kiến thức luật giao thông đường bộ để được phục hồi.
","**Nguồn văn bản:** 168_2024_ND-CP_619502

**Tên văn bản:** Nghị định Quy định xử phạt vi phạm hành chính về trật tự, an toàn giao thông trong lĩnh vực giao thông đường bộ; trừ điểm, phục hồi điểm giấy phép lái xe

**Điều 51:** Thẩm quyền, trình tự, thủ tục phục hồi điểm giấy phép lái xe

**Nội dung:**

1. Thẩm quyền phục hồi điểm giấy phép lái xe

	a) Cục trưởng Cục Cảnh sát giao thông có trách nhiệm quản lý, vận hành cơ sở dữ liệu về xử lý vi phạm hành chính về trật tự, an toàn giao thông đường bộ để thực hiện cập nhật, tự động phục hồi điểm giấy phép lái xe đối với trường hợp quy định tại khoản 2 Điều này.

	b) Cục trưởng Cục Cảnh sát giao thông, Trưởng phòng Cảnh sát giao thông nơi tổ chức kiểm tra kiến thức pháp luật về trật tự, an toàn giao thông đường bộ có thẩm quyền phục hồi điểm cho giấy phép lái xe đối với trường hợp quy định tại khoản 3 Điều này.

2. Trình tự, thủ tục phục hồi điểm giấy phép lái xe đối với trường hợp giấy phép lái xe chưa bị trừ hết điểm và không bị trừ điểm trong thời hạn 12 tháng từ ngày bị trừ điểm gần nhất

	a) Khi đủ thời hạn 12 tháng, kể từ ngày bị trừ điểm giấy phép lái xe gần nhất, dữ liệu điểm giấy phép lái xe sẽ được tự động phục hồi đủ 12 điểm (gồm cả giấy phép lái xe đang trong thời hạn bị tước quyền sử dụng) và cập nhật tự động trong cơ sở dữ liệu về xử lý vi phạm hành chính về trật tự, an toàn giao thông đường bộ.

	b) Ngay sau khi dữ liệu điểm giấy phép lái xe được phục hồi, cơ sở dữ liệu về xử lý vi phạm hành chính về trật tự, an toàn giao thông đường bộ sẽ tự động chuyển thông tin thông báo cho người được phục hồi điểm giấy phép lái xe biết việc phục hồi điểm theo quy định tại điểm c khoản này.

	c) Việc thông báo phục hồi điểm giấy phép lái xe thực hiện bằng phương thức điện tử thông qua tài khoản của công dân đăng ký trên Cổng Dịch vụ công, ứng dụng giao thông trên thiết bị di động; đồng thời cập nhật thông tin về giấy phép lái xe được phục hồi điểm trên trang thông tin điện tử của Cục Cảnh sát giao thông. Trường hợp giấy phép lái xe được thể hiện dưới hình thức thông điệp dữ liệu thì thực hiện cập nhật trạng thái phục hồi điểm giấy phép lái xe trong căn cước điện tử, tài khoản định danh điện tử trên ứng dụng định danh quốc gia.


3. Trình tự, thủ tục phục hồi điểm giấy phép lái xe đối với trường hợp giấy phép lái xe bị trừ hết điểm

	a) Sau khi người có giấy phép lái xe bị trừ hết điểm tham gia kiểm tra nội dung kiến thức pháp luật về trật tự, an toàn giao thông đường bộ và đạt yêu cầu, kết quả kiểm tra được cập nhật vào phần mềm kiểm tra kiến thức pháp luật về trật tự, an toàn giao thông đường bộ và đồng bộ dữ liệu với cơ sở dữ liệu về xử lý vi phạm hành chính về trật tự, an toàn giao thông đường bộ, dữ liệu điểm giấy phép lái xe sẽ được phục hồi đủ 12 điểm và cập nhật tự động trong cơ sở dữ liệu về xử lý vi phạm hành chính về trật tự, an toàn giao thông đường bộ.

	b) Ngay sau khi dữ liệu điểm giấy phép lái xe được phục hồi đủ 12 điểm thì người có thẩm quyền quy định tại điểm b khoản 1 Điều này thông báo cho người được phục hồi điểm giấy phép lái xe biết việc phục hồi điểm.

	c) Việc thông báo phục hồi điểm giấy phép lái xe thực hiện bằng văn bản theo mẫu quy định của Bộ trưởng Bộ Công an và được giao trực tiếp hoặc gửi qua dịch vụ bưu chính hoặc thực hiện thông báo bằng phương thức điện tử thông qua tài khoản của công dân đăng ký trên Cổng Dịch vụ công, ứng dụng giao thông trên thiết bị di động; đồng thời cập nhật thông tin về giấy phép lái xe được phục hồi điểm trên trang thông tin điện tử của Cục Cảnh sát giao thông. Trường hợp giấy phép lái xe được thể hiện dưới hình thức thông điệp dữ liệu thì cơ quan, người có thẩm quyền thực hiện cập nhật trạng thái phục hồi điểm giấy phép lái xe trong căn cước điện tử, tài khoản định danh điện tử trên ứng dụng định danh quốc gia.


**Tóm lại:** Có hai điều kiện để phục hồi điểm giấy phép lái xe máy: 1) Giấy phép lái xe chưa bị trừ hết điểm và không bị trừ điểm trong 12 tháng, điểm sẽ được tự động phục hồi. 2) Giấy phép lái xe bị trừ hết điểm, người vi phạm phải tham gia kiểm tra kiến thức luật giao thông đường bộ và đạt yêu cầu để được phục hồi điểm.
",0.9285714285714286,0.8160207324395006,0.8125,0.9999999999
12,Người lái ô tô cần làm gì để phục hồi điểm giấy phép lái xe?,"['đ) Không trừ điểm giấy phép lái xe khi giấy phép lái xe đó đang trong thời hạn bị tước quyền sử dụng giấy phép lái xe.\n\n2. Thẩm quyền trừ điểm giấy phép lái xe\n\nNgười có thẩm quyền áp dụng hình thức xử phạt tước quyền sử dụng giấy phép, chứng chỉ hành nghề có thời hạn hoặc đình chỉ hoạt động có thời hạn quy định tại Chương II Phần thứ hai của Luật Xử lý vi phạm hành chính, Mục 1 Chương III của Nghị định này và có thẩm quyền xử phạt vi phạm hành chính đối với hành vi vi phạm có quy định trừ điểm giấy phép lái xe thì có thẩm quyền trừ điểm giấy phép lái xe đối với hành vi vi phạm đó.\n\n3. Trình tự, thủ tục trừ điểm giấy phép lái xe\n\na) Ngay sau khi quyết định xử phạt vi phạm hành chính có hiệu lực thi hành, dữ liệu trừ điểm giấy phép lái xe của người bị xử phạt sẽ được cập nhật tự động vào Cơ sở dữ liệu về xử lý vi phạm hành chính về trật tự, an toàn giao thông đường bộ, người có thẩm quyền trừ điểm giấy phép lái xe thông báo cho người bị trừ điểm giấy phép lái xe biết việc trừ điểm.\n\nTrường hợp Chủ tịch Ủy ban nhân dân cấp huyện, Chủ tịch Ủy ban nhân dân cấp tỉnh ra quyết định xử phạt vi phạm hành chính đối với hành vi vi phạm có trừ điểm giấy phép lái xe thì Trưởng Công an cấp huyện hoặc Trưởng phòng Cảnh sát giao thông Công an cấp tỉnh có trách nhiệm cập nhật dữ liệu trừ điểm giấy phép lái xe vào Cơ sở dữ liệu về xử lý vi phạm hành chính về trật tự, an toàn giao thông đường bộ;\n\nb) Việc thông báo trừ điểm giấy phép lái xe thực hiện bằng văn bản theo mẫu quy định của Bộ trưởng Bộ Công an và được giao trực tiếp hoặc gửi qua dịch vụ bưu chính hoặc thực hiện thông báo bằng phương thức điện tử thông qua tài khoản của công dân đăng ký trên Cổng dịch vụ công, Ứng dụng giao thông trên thiết bị di động khi đáp ứng điều kiện về cơ sở hạ tầng, kỹ thuật, thông tin; đồng thời cập nhật thông tin về giấy phép lái xe bị trừ điểm trên Trang thông tin điện tử của Cục Cảnh sát giao thông. Trường hợp giấy phép lái xe được thể hiện dưới hình thức thông điệp dữ liệu thì cơ quan, người có thẩm quyền thực hiện cập nhật trạng thái trừ điểm giấy phép lái xe trong căn cước điện tử, tài khoản định danh điện tử trên ứng dụng định danh quốc gia.\n\nĐiều 51. Thẩm quyền, trình tự, thủ tục phục hồi điểm giấy phép lái xe\n\n1. Thẩm quyền phục hồi điểm giấy phép lái xe\n\na) Cục trưởng Cục Cảnh sát giao thông có trách nhiệm quản lý, vận hành Cơ sở dữ liệu về xử lý vi phạm hành chính về trật tự, an toàn giao thông đường bộ để thực hiện cập nhật, tự động phục hồi điểm giấy phép lái xe đối với trường hợp quy định tại khoản 2 Điều này;\n\nb) Cục trưởng Cục Cảnh sát giao thông, Trưởng phòng Cảnh sát giao thông nơi tổ chức kiểm tra kiến thức pháp luật về trật tự, an toàn giao thông đường bộ có thẩm quyền phục hồi điểm cho giấy phép lái xe đối với trường hợp quy định tại khoản 3 Điều này.\n\n2. Trình tự, thủ tục phục hồi điểm giấy phép lái xe đối với trường hợp giấy phép lái xe chưa bị trừ hết điểm và không bị trừ điểm trong thời hạn 12 tháng từ ngày bị trừ điểm gần nhất\n\na) Khi đủ thời hạn 12 tháng, kể từ ngày bị trừ điểm giấy phép lái xe gần nhất, dữ liệu điểm giấy phép lái xe sẽ được tự động phục hồi đủ 12 điểm (gồm cả giấy phép lái xe đang trong thời hạn bị tước quyền sử dụng) và cập nhật tự động trong Cơ sở dữ liệu về xử lý vi phạm hành chính về trật tự, an toàn giao thông đường bộ;\n\nb) Ngay sau khi dữ liệu điểm giấy phép lái xe được phục hồi, Cơ sở dữ liệu về xử lý vi phạm hành chính về trật tự, an toàn giao thông đường bộ sẽ tự động chuyển thông tin thông báo cho người được phục hồi điểm giấy phép lái xe biết việc phục hồi điểm theo quy định tại điểm c khoản này;\n\nc) Việc thông báo phục hồi điểm giấy phép lái xe thực hiện bằng phương thức điện tử thông qua tài khoản của công dân đăng ký trên Cổng dịch vụ công, Ứng dụng giao thông trên thiết bị di động; đồng thời cập nhật thông tin về giấy phép lái xe được phục hồi điểm trên Trang thông tin điện tử của Cục Cảnh sát giao thông. Trường hợp giấy phép lái xe được thể hiện dưới hình thức thông điệp dữ liệu thì thực hiện cập nhật trạng thái phục hồi điểm giấy phép lái xe trong căn cước điện tử, tài khoản định danh điện tử trên ứng dụng định danh quốc gia.\n\n3. Trình tự, thủ tục phục hồi điểm giấy phép lái xe đối với trường hợp giấy phép lái xe bị trừ hết điểm\n\na) Sau khi người có giấy phép lái xe bị trừ hết điểm tham gia kiểm tra nội dung kiến thức pháp luật về trật tự, an toàn giao thông đường bộ và đạt yêu cầu, kết quả kiểm tra được cập nhật vào phần mềm kiểm tra kiến thức pháp luật về trật tự, an toàn giao thông đường bộ và đồng bộ dữ liệu với Cơ sở dữ liệu về xử lý vi phạm hành chính về trật tự, an toàn giao thông đường bộ, dữ liệu điểm giấy phép lái xe sẽ được phục hồi đủ 12 điểm và cập nhật tự động trong Cơ sở dữ liệu về xử lý vi phạm hành chính về trật tự, an toàn giao thông đường bộ;\n\nb) Ngay sau khi dữ liệu điểm giấy phép lái xe được phục hồi đủ 12 điểm thì người có thẩm quyền quy định tại điểm b khoản 1 Điều này thông báo cho người được phục hồi điểm giấy phép lái xe biết việc phục hồi điểm;\n\nc) Việc thông báo phục hồi điểm giấy phép lái xe thực hiện bằng văn bản theo mẫu quy định của Bộ trưởng Bộ Công an và được giao trực tiếp hoặc gửi qua dịch vụ bưu chính hoặc thực hiện thông báo bằng phương thức điện tử thông qua tài khoản của công dân đăng ký trên Cổng dịch vụ công, Ứng dụng giao thông trên thiết bị di động; đồng thời cập nhật thông tin về giấy phép lái xe được phục hồi điểm trên Trang thông tin điện tử của Cục Cảnh sát giao thông. Trường hợp giấy phép lái xe được thể hiện dưới hình thức thông điệp dữ liệu thì cơ quan, người có thẩm quyền thực hiện cập nhật trạng thái phục hồi điểm giấy phép lái xe trong căn cước điện tử, tài khoản định danh điện tử trên ứng dụng định danh quốc gia.\n\nChương IV\n\nĐIỀU KHOẢN THI HÀNH\n\nĐiều 52. Sửa đổi, bổ sung một số điều của Nghị định số 100/2019/NĐ-CP ngày 30 tháng 12 năm 2019 của Chính phủ quy định xử phạt vi phạm hành chính trong lĩnh vực giao thông đường bộ và đường sắt đã được sửa đổi, bổ sung một số điều theo Nghị định số 123/2021/NĐ-CP ngày 28 tháng 12 năm 2021 của Chính phủ sửa đổi, bổ sung một số điều của các Nghị định quy định xử phạt vi phạm hành chính trong lĩnh vực hàng hải; giao thông đường bộ, đường sắt; hàng không dân dụng\n\n1. Bổ sung khoản 2a vào sau khoản 2 Điều 1 như sau:\n\n“2a. Hình thức, mức xử phạt, biện pháp khắc phục hậu quả đối với từng hành vi vi phạm hành chính; thẩm quyền lập biên bản, thẩm quyền xử phạt, mức phạt tiền cụ thể đối với từng chức danh về trật tự, an toàn giao thông trong lĩnh vực giao thông đường bộ thì áp dụng quy định tại Nghị định quy định xử phạt vi phạm hành chính về trật tự, an toàn giao thông trong lĩnh vực giao thông đường bộ; trừ điểm, phục hồi điểm giấy phép lái xe”.\n\n2. Sửa đổi, bổ sung một số điểm của khoản 6 Điều 28 như sau:\n\na) Sửa đổi, bổ sung điểm d khoản 6 Điều 28 như sau:\n\n“d) Không thực hiện đúng các nội dung đã đăng ký, niêm yết về: giá cước; giá dịch vụ; tiêu chuẩn chất lượng dịch vụ vận tải, dịch vụ hỗ trợ vận tải;”;\n\nb) Sửa đổi, bổ sung điểm i khoản 6 Điều 28 như sau:\n\n“i) Sử dụng phương tiện kinh doanh vận tải có chất lượng không bảo đảm điều kiện của hình thức kinh doanh đã đăng ký;”.\n\n3. Sửa đổi, bổ sung điểm a, điểm b khoản 10 Điều 28 như sau:\n\n“a) Thực hiện hành vi vi phạm quy định tại điểm a, điểm b, điểm d, điểm đ, điểm h, điểm l, điểm o, điểm p, điểm r, điểm s, điểm t khoản 4; điểm d, điểm i, điểm k, điểm l, điểm n, điểm q khoản 6; điểm e khoản 7 Điều này bị tước quyền sử dụng phù hiệu từ 01 tháng đến 03 tháng (nếu có hoặc đã được cấp) đối với xe vi phạm;\n\nb) Thực hiện hành vi vi phạm quy định tại điểm i, điểm k khoản 4; điểm h khoản 6; điểm b khoản 7 Điều này bị tước quyền sử dụng giấy phép kinh doanh vận tải từ 01 tháng đến 03 tháng;”.\n\n4. Sửa đổi, bổ sung điểm h khoản 11 Điều 28 như sau:\n\n“h) Thực hiện hành vi vi phạm quy định tại điểm n khoản 6 Điều này buộc lắp đặt đồng hồ tính tiền cước, thiết bị in hóa đơn trên xe theo đúng quy định;”.\n\n5. Sửa đổi, bổ sung một số điểm, khoản của Điều 74 như sau:']","**Nguồn văn bản:** /content/drive/MyDrive/ITProject_data/new_law/168_2024_ND-CP_619502.docx

**Tên văn bản:** (Không có tiêu đề trong metadata)


**Nội dung:**

Điều 51. Thẩm quyền, trình tự, thủ tục phục hồi điểm giấy phép lái xe

1. Thẩm quyền phục hồi điểm giấy phép lái xe

    a) Cục trưởng Cục Cảnh sát giao thông có trách nhiệm quản lý, vận hành Cơ sở dữ liệu về xử lý vi phạm hành chính về trật tự, an toàn giao thông đường bộ để thực hiện cập nhật, tự động phục hồi điểm giấy phép lái xe đối với trường hợp quy định tại khoản 2 Điều này.

    b) Cục trưởng Cục Cảnh sát giao thông, Trưởng phòng Cảnh sát giao thông nơi tổ chức kiểm tra kiến thức pháp luật về trật tự, an toàn giao thông đường bộ có thẩm quyền phục hồi điểm cho giấy phép lái xe đối với trường hợp quy định tại khoản 3 Điều này.


2. Trình tự, thủ tục phục hồi điểm giấy phép lái xe đối với trường hợp giấy phép lái xe chưa bị trừ hết điểm và không bị trừ điểm trong thời hạn 12 tháng từ ngày bị trừ điểm gần nhất

    a) Khi đủ thời hạn 12 tháng, kể từ ngày bị trừ điểm giấy phép lái xe gần nhất, dữ liệu điểm giấy phép lái xe sẽ được tự động phục hồi đủ 12 điểm (gồm cả giấy phép lái xe đang trong thời hạn bị tước quyền sử dụng) và cập nhật tự động trong Cơ sở dữ liệu về xử lý vi phạm hành chính về trật tự, an toàn giao thông đường bộ.

    b) Ngay sau khi dữ liệu điểm giấy phép lái xe được phục hồi, Cơ sở dữ liệu về xử lý vi phạm hành chính về trật tự, an toàn giao thông đường bộ sẽ tự động chuyển thông tin thông báo cho người được phục hồi điểm giấy phép lái xe biết việc phục hồi điểm theo quy định tại điểm c khoản này.

    c) Việc thông báo phục hồi điểm giấy phép lái xe thực hiện bằng phương thức điện tử thông qua tài khoản của công dân đăng ký trên Cổng dịch vụ công, Ứng dụng giao thông trên thiết bị di động; đồng thời cập nhật thông tin về giấy phép lái xe được phục hồi điểm trên Trang thông tin điện tử của Cục Cảnh sát giao thông. Trường hợp giấy phép lái xe được thể hiện dưới hình thức thông điệp dữ liệu thì thực hiện cập nhật trạng thái phục hồi điểm giấy phép lái xe trong căn cước điện tử, tài khoản định danh điện tử trên ứng dụng định danh quốc gia.


3. Trình tự, thủ tục phục hồi điểm giấy phép lái xe đối với trường hợp giấy phép lái xe bị trừ hết điểm

    a) Sau khi người có giấy phép lái xe bị trừ hết điểm tham gia kiểm tra nội dung kiến thức pháp luật về trật tự, an toàn giao thông đường bộ và đạt yêu cầu, kết quả kiểm tra được cập nhật vào phần mềm kiểm tra kiến thức pháp luật về trật tự, an toàn giao thông đường bộ và đồng bộ dữ liệu với Cơ sở dữ liệu về xử lý vi phạm hành chính về trật tự, an toàn giao thông đường bộ, dữ liệu điểm giấy phép lái xe sẽ được phục hồi đủ 12 điểm và cập nhật tự động trong Cơ sở dữ liệu về xử lý vi phạm hành chính về trật tự, an toàn giao thông đường bộ.

    b) Ngay sau khi dữ liệu điểm giấy phép lái xe được phục hồi đủ 12 điểm thì người có thẩm quyền quy định tại điểm b khoản 1 Điều này thông báo cho người được phục hồi điểm giấy phép lái xe biết việc phục hồi điểm.

    c) Việc thông báo phục hồi điểm giấy phép lái xe thực hiện bằng văn bản theo mẫu quy định của Bộ trưởng Bộ Công an và được giao trực tiếp hoặc gửi qua dịch vụ bưu chính hoặc thực hiện thông báo bằng phương thức điện tử thông qua tài khoản của công dân đăng ký trên Cổng dịch vụ công, Ứng dụng giao thông trên thiết bị di động; đồng thời cập nhật thông tin về giấy phép lái xe được phục hồi điểm trên Trang thông tin điện tử của Cục Cảnh sát giao thông. Trường hợp giấy phép lái xe được thể hiện dưới hình thức thông điệp dữ liệu thì cơ quan, người có thẩm quyền thực hiện cập nhật trạng thái phục hồi điểm giấy phép lái xe trong căn cước điện tử, tài khoản định danh điện tử trên ứng dụng định danh quốc gia.


Tóm lại: Có hai trường hợp phục hồi điểm giấy phép lái xe: 1) Tự động phục hồi sau 12 tháng không bị trừ điểm kể từ lần trừ gần nhất; 2) Phục hồi sau khi thi lại và đạt yêu cầu nếu bị trừ hết điểm. Cục Cảnh sát Giao thông quản lý và thực hiện việc phục hồi điểm.
","**Nguồn văn bản:** 168_2024_ND-CP_619502

**Tên văn bản:** Nghị định Quy định xử phạt vi phạm hành chính về trật tự, an toàn giao thông trong lĩnh vực giao thông đường bộ; trừ điểm, phục hồi điểm giấy phép lái xe

**Điều 51:** Thẩm quyền, trình tự, thủ tục phục hồi điểm giấy phép lái xe

**Nội dung:**

1. Thẩm quyền phục hồi điểm giấy phép lái xe

	a) Cục trưởng Cục Cảnh sát giao thông có trách nhiệm quản lý, vận hành cơ sở dữ liệu về xử lý vi phạm hành chính về trật tự, an toàn giao thông đường bộ để thực hiện cập nhật, tự động phục hồi điểm giấy phép lái xe đối với trường hợp quy định tại khoản 2 Điều này.

	b) Cục trưởng Cục Cảnh sát giao thông, Trưởng phòng Cảnh sát giao thông nơi tổ chức kiểm tra kiến thức pháp luật về trật tự, an toàn giao thông đường bộ có thẩm quyền phục hồi điểm cho giấy phép lái xe đối với trường hợp quy định tại khoản 3 Điều này.

2. Trình tự, thủ tục phục hồi điểm giấy phép lái xe đối với trường hợp giấy phép lái xe chưa bị trừ hết điểm và không bị trừ điểm trong thời hạn 12 tháng từ ngày bị trừ điểm gần nhất

	a) Khi đủ thời hạn 12 tháng, kể từ ngày bị trừ điểm giấy phép lái xe gần nhất, dữ liệu điểm giấy phép lái xe sẽ được tự động phục hồi đủ 12 điểm (gồm cả giấy phép lái xe đang trong thời hạn bị tước quyền sử dụng) và cập nhật tự động trong cơ sở dữ liệu về xử lý vi phạm hành chính về trật tự, an toàn giao thông đường bộ.

	b) Ngay sau khi dữ liệu điểm giấy phép lái xe được phục hồi, cơ sở dữ liệu về xử lý vi phạm hành chính về trật tự, an toàn giao thông đường bộ sẽ tự động chuyển thông tin thông báo cho người được phục hồi điểm giấy phép lái xe biết việc phục hồi điểm theo quy định tại điểm c khoản này.

	c) Việc thông báo phục hồi điểm giấy phép lái xe thực hiện bằng phương thức điện tử thông qua tài khoản của công dân đăng ký trên Cổng Dịch vụ công, ứng dụng giao thông trên thiết bị di động; đồng thời cập nhật thông tin về giấy phép lái xe được phục hồi điểm trên trang thông tin điện tử của Cục Cảnh sát giao thông. Trường hợp giấy phép lái xe được thể hiện dưới hình thức thông điệp dữ liệu thì thực hiện cập nhật trạng thái phục hồi điểm giấy phép lái xe trong căn cước điện tử, tài khoản định danh điện tử trên ứng dụng định danh quốc gia.


3. Trình tự, thủ tục phục hồi điểm giấy phép lái xe đối với trường hợp giấy phép lái xe bị trừ hết điểm

	a) Sau khi người có giấy phép lái xe bị trừ hết điểm tham gia kiểm tra nội dung kiến thức pháp luật về trật tự, an toàn giao thông đường bộ và đạt yêu cầu, kết quả kiểm tra được cập nhật vào phần mềm kiểm tra kiến thức pháp luật về trật tự, an toàn giao thông đường bộ và đồng bộ dữ liệu với cơ sở dữ liệu về xử lý vi phạm hành chính về trật tự, an toàn giao thông đường bộ, dữ liệu điểm giấy phép lái xe sẽ được phục hồi đủ 12 điểm và cập nhật tự động trong cơ sở dữ liệu về xử lý vi phạm hành chính về trật tự, an toàn giao thông đường bộ.

	b) Ngay sau khi dữ liệu điểm giấy phép lái xe được phục hồi đủ 12 điểm thì người có thẩm quyền quy định tại điểm b khoản 1 Điều này thông báo cho người được phục hồi điểm giấy phép lái xe biết việc phục hồi điểm.

	c) Việc thông báo phục hồi điểm giấy phép lái xe thực hiện bằng văn bản theo mẫu quy định của Bộ trưởng Bộ Công an và được giao trực tiếp hoặc gửi qua dịch vụ bưu chính hoặc thực hiện thông báo bằng phương thức điện tử thông qua tài khoản của công dân đăng ký trên Cổng Dịch vụ công, ứng dụng giao thông trên thiết bị di động; đồng thời cập nhật thông tin về giấy phép lái xe được phục hồi điểm trên trang thông tin điện tử của Cục Cảnh sát giao thông. Trường hợp giấy phép lái xe được thể hiện dưới hình thức thông điệp dữ liệu thì cơ quan, người có thẩm quyền thực hiện cập nhật trạng thái phục hồi điểm giấy phép lái xe trong căn cước điện tử, tài khoản định danh điện tử trên ứng dụng định danh quốc gia.


**Tóm lại:** Có hai trường hợp để phục hồi điểm giấy phép lái xe: 1) Giấy phép lái xe chưa bị trừ hết điểm và không bị trừ điểm trong 12 tháng, điểm sẽ tự động được phục hồi. 2) Giấy phép lái xe bị trừ hết điểm, người lái xe phải tham gia kiểm tra kiến thức luật giao thông đường bộ và đạt yêu cầu để được phục hồi điểm.
",1.0,0.7937848817888803,0.9333333333333333,0.9999999999
13,Luật Giao thông Đường bộ 2025 có quy định gì mới về việc sử dụng điện thoại khi lái xe?,"['5. Đua xe, tổ chức đua xe, xúi giục, giúp sức, cổ vũ đua xe trái phép; điều khiển phương tiện tham gia giao thông đường bộ lạng lách, đánh võng, rú ga liên tục.\n\n6. Dùng tay cầm và sử dụng điện thoại hoặc thiết bị điện tử khác khi điều khiển phương tiện tham gia giao thông đang di chuyển trên đường bộ.\n\n7. Giao xe cơ giới, xe máy chuyên dùng cho người không đủ điều kiện theo quy định của pháp luật để điều khiển xe tham gia giao thông đường bộ.\n\n8. Đưa xe cơ giới, xe máy chuyên dùng không bảo đảm quy định của pháp luật về an toàn kỹ thuật và bảo vệ môi trường, phương tiện khác không đủ điều kiện theo quy định của pháp luật để tham gia giao thông đường bộ.\n\n9. Nhập khẩu, sản xuất, lắp ráp xe cơ giới, xe máy chuyên dùng không bảo đảm quy định của pháp luật về chất lượng an toàn kỹ thuật và bảo vệ môi trường.\n\n10. Cải tạo xe ô tô loại khác thành xe ô tô chở người, trừ cải tạo thành xe ô tô chở người phục vụ mục đích quốc phòng, an ninh.\n\n11. Cải tạo trái phép; cố ý can thiệp làm sai lệch chỉ số trên đồng hồ báo quãng đường đã chạy của xe ô tô; cắt, hàn, tẩy xóa, đục sửa, đóng lại trái phép số khung, số động cơ của xe cơ giới, xe máy chuyên dùng.\n\n12. Cố ý can thiệp, thay đổi phần mềm điều khiển của xe, động cơ của xe đã được đăng ký với cơ quan quản lý, nhằm mục đích gian lận kết quả kiểm tra, thử nghiệm, kiểm định; thuê, mượn phụ tùng xe cơ giới chỉ để thực hiện việc kiểm định.\n\n13. Chở hàng hóa vượt quá khối lượng toàn bộ, tải trọng trục, kích thước cho phép của xe hoặc vượt quá tải trọng, kích thước giới hạn cho phép của đường bộ khi chưa được cơ quan quản lý cấp phép hoặc không bảo đảm yêu cầu theo quy định của Luật này; chở hàng hóa trên xe có quy định phải chằng buộc nhưng không chằng buộc hoặc chằng buộc không đúng quy định của pháp luật; chở quá số người theo quy định của pháp luật.\n\n14. Vận chuyển hàng hóa cấm lưu hành, vận chuyển trái phép hoặc không thực hiện đầy đủ các quy định của pháp luật về vận chuyển hàng hóa nguy hiểm, động vật hoang dã.\n\n15. Đe dọa, xúc phạm, tranh giành, lôi kéo hành khách; đe doạ, cưỡng ép hành khách sử dụng dịch vụ ngoài ý muốn; chuyển tải, xuống khách hoặc các hành vi khác nhằm trốn tránh phát hiện xe chở quá tải, quá số người theo quy định của pháp luật. \n\n16. Lắp đặt, sử dụng thiết bị âm thanh, ánh sáng trên xe cơ giới, xe máy chuyên dùng gây mất trật tự, an toàn giao thông đường bộ.\n\n17. Sản xuất, sử dụng, mua, bán trái phép biển số xe; điều khiển xe cơ giới, xe máy chuyên dùng gắn biển số xe không do cơ quan nhà nước có thẩm quyền cấp, gắn biển số xe không đúng vị trí; bẻ cong, che lấp biển số xe; làm thay đổi chữ, số, màu sắc, hình dạng, kích thước của biển số xe.\n\n18. Làm gián đoạn hoạt động hoặc làm sai lệch dữ liệu của thiết bị giám sát hành trình, camera lắp trên xe theo quy định của Luật này.\n\n19. Hủy hoại, làm hư hỏng, làm mất tác dụng thiết bị điều khiển, giám sát giao thông đường bộ, thiết bị thông minh hỗ trợ chỉ huy, điều khiển giao thông đường bộ.\n\n20. Đặt, để chướng ngại vật, vật cản khác trái phép trên đường bộ; rải vật sắc nhọn, đổ chất gây trơn trượt trên đường bộ; làm rơi vãi đất đá, hàng hóa, vật liệu xây dựng, phế thải trên đường bộ; đổ, xả thải, làm rơi vãi hóa chất, chất thải gây mất an toàn giao thông đường bộ.\n\n21. Cản trở người, phương tiện tham gia giao thông trên đường bộ; ném gạch, đất, đá, cát hoặc vật thể khác vào người, phương tiện đang tham gia giao thông trên đường bộ.\n\n22. Lợi dụng, lạm dụng nhiệm vụ bảo đảm trật tự, an toàn giao thông đường bộ để thực hiện hành vi vi phạm pháp luật, nhũng nhiễu, xâm phạm lợi ích của Nhà nước, quyền và lợi ích hợp pháp của tổ chức, cá nhân.\n\n23. Lợi dụng chức vụ, quyền hạn, nghề nghiệp của bản thân hoặc người khác để vi phạm pháp luật về trật tự, an toàn giao thông đường bộ hoặc can thiệp, tác động vào quá trình xử lý vi phạm pháp luật về trật tự, an toàn giao thông đường bộ.\n\n24. Sử dụng quyền của xe ưu tiên khi không thực hiện nhiệm vụ theo quy định của pháp luật; lắp đặt, sử dụng thiết bị phát tín hiệu ưu tiên không đúng quy định của pháp luật.\n\n25. Không khai báo, khai báo gian dối hoặc cung cấp thông tin, tài liệu không đúng sự thật để trốn tránh trách nhiệm khi bị phát hiện vi phạm pháp luật về trật tự, an toàn giao thông đường bộ.\n\n26. Bỏ trốn sau khi gây tai nạn giao thông đường bộ để trốn tránh trách nhiệm; khi có điều kiện mà cố ý không cứu giúp người bị tai nạn giao thông đường bộ; xâm phạm tính mạng, sức khỏe, tài sản của người bị nạn, người gây tai nạn giao thông đường bộ hoặc người giúp đỡ, cứu chữa, đưa người bị nạn đi cấp cứu; lợi dụng việc xảy ra tai nạn giao thông đường bộ để hành hung, đe dọa, xúi giục, gây sức ép, làm mất trật tự, cản trở việc xử lý tai nạn giao thông đường bộ.\n\n27. Điều khiển vật thể bay, tàu bay không người lái, phương tiện bay siêu nhẹ hoạt động trong phạm vi khổ giới hạn đường bộ gây cản trở hoặc nguy cơ mất an toàn cho người, phương tiện tham gia giao thông đường bộ, trừ tàu bay không người lái, phương tiện bay siêu nhẹ được cấp phép bay.\n\n28. Hành vi khác vi phạm quy tắc giao thông đường bộ quy định tại Chương II của Luật này.\n\nChương II\n\nQUY TẮC GIAO THÔNG ĐƯỜNG BỘ\n\nĐiều 10. Quy tắc chung\n\n1. Người tham gia giao thông đường bộ phải đi bên phải theo chiều đi của mình, đi đúng làn đường, phần đường quy định, chấp hành báo hiệu đường bộ và các quy tắc giao thông đường bộ khác.\n\n2. Người lái xe và người được chở trên xe ô tô phải thắt dây đai an toàn tại những chỗ có trang bị dây đai an toàn khi tham gia giao thông đường bộ.\n\n3. Khi chở trẻ em dưới 10 tuổi và chiều cao dưới 1,35 mét trên xe ô tô không được cho trẻ em ngồi cùng hàng ghế với người lái xe, trừ loại xe ô tô chỉ có một hàng ghế; người lái xe phải sử dụng, hướng dẫn sử dụng thiết bị an toàn phù hợp cho trẻ em.\n\nĐiều 11. Chấp hành báo hiệu đường bộ\n\n1. Báo hiệu đường bộ bao gồm: hiệu lệnh của người điều khiển giao thông; đèn tín hiệu giao thông; biển báo hiệu đường bộ; vạch kẻ đường và các dấu hiệu khác trên mặt đường; cọc tiêu, tường bảo vệ, rào chắn, đinh phản quang, tiêu phản quang, cột Km, cọc H; thiết bị âm thanh báo hiệu đường bộ.\n\n2. Người tham gia giao thông đường bộ phải chấp hành báo hiệu đường bộ theo thứ tự ưu tiên từ trên xuống dưới như sau: \n\na) Hiệu lệnh của người điều khiển giao thông;\n\nb) Tín hiệu đèn giao thông;\n\nc) Biển báo hiệu đường bộ;\n\nd) Vạch kẻ đường và các dấu hiệu khác trên mặt đường;\n\nđ) Cọc tiêu, tường bảo vệ, rào chắn, đinh phản quang, tiêu phản quang,\ncột Km, cọc H;\n\ne) Thiết bị âm thanh báo hiệu đường bộ.\n\n3. Hiệu lệnh của người điều khiển giao thông được quy định như sau:\n\na) Tay bên phải giơ thẳng đứng để báo hiệu cho người tham gia giao thông đường bộ ở tất cả các hướng phải dừng lại;\n\nb) Hai tay hoặc một tay dang ngang để báo hiệu cho người tham gia giao thông đường bộ ở phía trước và ở phía sau người điều khiển giao thông phải dừng lại; người tham gia giao thông đường bộ ở phía bên phải và bên trái người điều khiển giao thông được đi;\n\nc) Tay bên phải giơ về phía trước để báo hiệu cho người tham gia giao thông đường bộ ở phía sau và bên phải người điều khiển giao thông phải dừng lại; người tham gia giao thông đường bộ ở phía trước người điều khiển giao thông được rẽ phải; người tham gia giao thông đường bộ ở phía bên trái người điều khiển giao thông được đi tất cả các hướng; người đi bộ qua đường phải đi sau lưng người điều khiển giao thông.\n\n4. Tín hiệu đèn giao thông có 03 màu, gồm: màu xanh, màu vàng, màu đỏ; có hiển thị thời gian hoặc không hiển thị thời gian. Người tham gia giao thông đường bộ phải chấp hành như sau:\n\na) Tín hiệu đèn màu xanh là được đi; trường hợp người đi bộ, xe lăn của người khuyết tật đang đi ở lòng đường, người điều khiển phương tiện tham gia giao thông đường bộ phải giảm tốc độ hoặc dừng lại nhường đường cho người đi bộ, xe lăn của người khuyết tật qua đường;']","**Nguồn văn bản:** /content/drive/MyDrive/ITProject_data/new_law/36_2024_QH15_444251.docx

**Tên văn bản:**  (Không có tiêu đề trong metadata)


**Nội dung:**

6. Dùng tay cầm và sử dụng điện thoại hoặc thiết bị điện tử khác khi điều khiển phương tiện tham gia giao thông đang di chuyển trên đường bộ.


Tóm lại: Luật Giao thông Đường bộ nghiêm cấm việc dùng tay cầm và sử dụng điện thoại hoặc thiết bị điện tử khác khi đang điều khiển phương tiện giao thông di chuyển trên đường.
","**Nguồn văn bản:** 168_2024_ND-CP_619502

**Tên văn bản:** Nghị định Quy định xử phạt vi phạm hành chính về trật tự, an toàn giao thông trong lĩnh vực giao thông đường bộ; trừ điểm, phục hồi điểm giấy phép lái xe

**Điều 6:** Xử phạt, trừ điểm giấy phép lái xe của người điều khiển xe ô tô, xe chở người bốn bánh có gắn động cơ, xe chở hàng bốn bánh có gắn động cơ và các loại xe tương tự xe ô tô vi phạm quy tắc giao thông đường bộ

**Nội dung:**

5. Phạt tiền từ 4.000.000 đồng đến 6.000.000 đồng đối với người điều khiển xe thực hiện một trong các hành vi vi phạm sau đây:
    
    a) Vượt xe trong những trường hợp không được vượt, vượt xe tại đoạn đường có biển báo hiệu có nội dung cấm vượt (đối với loại phương tiện đang điều khiển); không có tín hiệu trước khi vượt hoặc có tín hiệu vượt xe nhưng không sử dụng trong suốt quá trình vượt xe; vượt bên phải xe khác trong trường hợp không được phép.

    b) Điều khiển xe không đi bên phải theo chiều đi của mình; đi không đúng phần đường hoặc làn đường quy định (làn cùng chiều hoặc làn ngược chiều) trừ hành vi quy định tại điểm a khoản 4 điều này; điều khiển xe đi qua dải phân cách cố định ở giữa hai phần đường xe chạy.

    c) Tránh xe đi ngược chiều không đúng quy định (trừ hành vi vi phạm sử dụng đèn chiếu xa khi tránh xe đi ngược chiều quy định tại điểm b khoản 3 điều này); không nhường đường cho xe đi ngược chiều theo quy định tại nơi đường hẹp, đường dốc, nơi có chướng ngại vật.

    d) Không tuân thủ quy định khi vào hoặc ra đường cao tốc; điều khiển xe chạy ở làn dừng xe khẩn cấp hoặc phần lề đường của đường cao tốc; không tuân thủ quy định về khoảng cách an toàn đối với xe chạy liền trước khi chạy trên đường cao tốc.

    đ) Điều khiển xe chạy quá tốc độ quy định từ 10 km/h đến 20 km/h.

    e) Xe không được quyền ưu tiên lắp đặt, sử dụng thiết bị phát tín hiệu của xe được quyền ưu tiên.

    g) Chuyển làn đường không đúng nơi cho phép hoặc không có tín hiệu báo trước hoặc chuyển làn đường không đúng quy định “mỗi lần chuyển làn đường chỉ được phép chuyển sang một làn đường liền kề” khi chạy trên đường cao tốc.

    h) Dùng tay cầm và sử dụng điện thoại hoặc các thiết bị điện tử khác khi điều khiển phương tiện tham gia giao thông đang di chuyển trên đường bộ.

    i) Đi vào khu vực cấm, đường có biển báo hiệu có nội dung cấm đi vào đối với loại phương tiện đang điều khiển, trừ các hành vi vi phạm quy định tại điểm d khoản 9, điểm đ khoản 11 điều này, hành vi bị cấm đi vào công trình thủy lợi và các trường hợp xe ưu tiên đang đi làm nhiệm vụ khẩn cấp theo quy định.

    k) Dừng xe, đỗ xe, quay đầu xe trái quy định gây ùn tắc giao thông.

    l) Chuyển hướng không nhường quyền đi trước cho: người đi bộ, xe lăn của người khuyết tật qua đường tại nơi có vạch kẻ đường dành cho người đi bộ; xe thô sơ đang đi trên phần đường dành cho xe thô sơ.

    m) Chuyển hướng không nhường đường cho: các xe đi ngược chiều; người đi bộ, xe thô sơ đang qua đường tại nơi không có vạch kẻ đường cho người đi bộ.

    n) Không giảm tốc độ (hoặc dừng lại) và nhường đường khi điều khiển xe đi từ đường không ưu tiên ra đường ưu tiên, từ đường nhánh ra đường chính.

    o) Không giảm tốc độ và nhường đường cho xe đi đến từ bên phải tại nơi đường giao nhau không có báo hiệu đi theo vòng xuyến; không giảm tốc độ và nhường đường cho xe đi đến từ bên trái tại nơi đường giao nhau có báo hiệu đi theo vòng xuyến.

    p) Chở người trên thùng xe trái quy định; chở người trên nóc xe; để người đu bám ở cửa xe, bên ngoài thành xe khi xe đang chạy.

    q) Mở cửa xe, để cửa xe mở không bảo đảm an toàn.


**Tóm lại:**  Người điều khiển phương tiện giao thông bị phạt từ 4.000.000 đồng đến 6.000.000 đồng nếu dùng tay cầm và sử dụng điện thoại hoặc các thiết bị điện tử khác khi điều khiển phương tiện đang di chuyển trên đường bộ.
",0.5,0.7276092236173453,0.1111111111111111,0.0
14,Quy định mới về tốc độ tối đa trong khu vực đô thị là gì?,"['BỘ GIAO THÔNG VẬN TẢI\n-------- CỘNG HÒA XÃ HỘI CHỦ NGHĨA VIỆT NAM\nĐộc lập - Tự do - Hạnh phúc \n--------------- Số: 38/2024/TT-BGTVT Hà Nội, Ngày 15 tháng 11 năm 2024\n\nTHÔNG TƯ\n\nQUY ĐỊNH VỀ TỐC ĐỘ VÀ KHOẢNG CÁCH AN TOÀN CỦA XE CƠ GIỚI, XE MÁY CHUYÊN DÙNG THAM GIA GIAO THÔNG TRÊN ĐƯỜNG BỘ\n\nCăn cứ Luật Trật tự, an toàn giao thông đường bộ ngày 27 tháng 6 năm 2024;\n\nCăn cứ Luật Đường bộ ngày 27 tháng 6 năm 2024;\n\nCăn cứ Nghị định số 56/2022/NĐ-CP ngày 24 tháng 8 năm 2022 của Chính phủ quy định chức năng, nhiệm vụ, quyền hạn và cơ cấu tổ chức của Bộ Giao thông vận tải;\n\nTheo đề nghị của Vụ trưởng Vụ Kết cấu hạ tầng giao thông và Cục trưởng Cục đường bộ Việt Nam;\n\nBộ trưởng Bộ Giao thông vận tải ban hành Thông tư quy định về tốc độ và khoảng cách an toàn của xe cơ giới, xe máy chuyên dùng tham gia giao thông trên đường bộ.\n\nChương I\n\nQUY ĐỊNH CHUNG\n\nĐiều 1. Phạm vi điều chỉnh\n\nThông tư này quy định về tốc độ thiết kế của đường bộ; tốc độ khai thác và khoảng cách an toàn của xe cơ giới, xe máy chuyên dùng khi tham gia giao thông trên đường bộ, trừ xe ưu tiên đang đi làm nhiệm vụ theo quy định của pháp luật.\n\nĐiều 2. Đối tượng áp dụng\n\nThông tư này áp dụng đối với người lái xe, người điều khiển xe máy chuyên dùng và tổ chức, cá nhân liên quan đến quản lý và thực hiện các quy định về tốc độ thiết kế, tốc độ khai thác của đường bộ và khoảng cách an toàn của xe cơ giới, xe máy chuyên dùng khi tham gia giao thông trên đường bộ.\n\nĐiều 3. Giải thích từ ngữ\n\nTrong Thông tư này, các từ ngữ dưới đây được hiểu như sau:\n\n1. Đường bộ trong khu đông dân cư là đoạn đường bộ nằm trong khu vực nội thành phố, nội thị xã, nội thị trấn và những đoạn đường có đông dân cư sinh sống sát dọc theo đường, được xác định bằng biển báo “Bắt đầu khu đông dân cư” và biển báo “Hết khu đông dân cư”.\n\n2. Đường đôi là đường có chiều đi và chiều về được phân biệt bằng dải phân cách giữa.\n\n3. Đường một chiều là đường chỉ cho đi một chiều.\n\n4. Đường hai chiều là đường dùng chung cho cả chiều đi và về trên cùng một phần đường xe chạy mà không có dải phân cách giữa.\n\n5. Trọng tải là khối lượng hàng hóa chuyên chở cho phép, được ghi trên Giấy chứng nhận an toàn kỹ thuật và bảo vệ môi trường của phương tiện giao thông cơ giới đường bộ, Giấy chứng \n\n\n\nnhận chất lượng an toàn kỹ thuật và bảo vệ môi trường xe cơ giới nhập khẩu hoặc Giấy chứng nhận chất lượng an toàn kỹ thuật và bảo vệ môi trường kiểu loại ô tô sản xuất, lắp ráp.\n\n6. Tốc độ khai thác tối đa là giá trị tốc độ lớn nhất cho phép phương tiện tham gia giao thông trên đường bộ bảo đảm an toàn giao thông và khai thác hiệu quả tuyến đường.\n\n7. Tốc độ khai thác tối thiểu là giá trị tốc độ nhỏ nhất cho phép phương tiện tham gia giao thông trên đường bộ bảo đảm an toàn giao thông và khai thác hiệu quả tuyến đường.\n\n8. Khoảng cách an toàn là cự ly tối thiểu giữa phương tiện phía sau với phương tiện đang di chuyển liền trước, cùng làn đường, bảo đảm tránh xảy ra va chạm trong trường hợp phương tiện phía trước đột ngột giảm tốc độ hoặc dừng lại.\n\n9. Tốc độ lưu hành là giá trị tốc độ của phương tiện tại thời điểm tham gia giao thông trên đường bộ.\n\nĐiều 4. Nguyên tắc chấp hành quy định về tốc độ khai thác và khoảng cách an toàn khi điều khiển phương tiện trên đường bộ\n\n1. Khi tham gia giao thông trên đường bộ, người lái xe, người điều khiển xe máy chuyên dùng phải chấp hành quy định về tốc độ khai thác và khoảng cách an toàn theo quy định tại Điều 12 Luật Trật tự, an toàn giao thông đường bộ.\n\n2. Tại những đoạn đường không bố trí biển báo tốc độ khai thác tối đa, không bố trí biển báo khoảng cách an toàn giữa hai xe, người điều khiển phương tiện tham gia giao thông phải thực hiện theo quy định tại Điều 6, Điều 7, Điều 8 và Điều 11 Thông tư này.\n\nChương II\n\nTỐC ĐỘ THIẾT KẾ CỦA ĐƯỜNG BỘ; TỐC ĐỘ KHAI THÁC CỦA ĐƯỜNG BỘ, KHOẢNG CÁCH AN TOÀN CỦA XE CƠ GIỚI, XE MÁY CHUYÊN DÙNG THAM GIA GIAO THÔNG TRÊN ĐƯỜNG BỘ\n\nĐiều 5. Tốc độ thiết kế của đường bộ\n\n1. Tốc độ thiết kế của đường bộ là giá trị vận tốc được dùng để tính toán các chỉ tiêu kỹ thuật của đường bộ. Tốc độ thiết kế của đường bộ được xác định trong giai đoạn đầu tư xây dựng, nâng cấp, cải tạo đường bộ nhằm bảo đảm cho phương tiện di chuyển an toàn; được quyết định theo cấp kỹ thuật của đường bộ và điều kiện địa hình.\n\n2. Tốc độ thiết kế đường bộ cao tốc là giá trị vận tốc được dùng để tính toán các chỉ tiêu kỹ thuật của đường bộ cao tốc, được xác định theo cấp đường cao tốc. Khi thiết kế đường bộ cao tốc có thể áp dụng tốc độ thiết kế khác nhau theo từng đoạn nhưng phải bảo đảm các yêu cầu về chiều dài đoạn chuyển tiếp và tốc độ thiết kế trung gian giữa các đoạn. Tốc độ thiết kế đường bộ cao tốc được xác định theo Quy chuẩn kỹ thuật quốc gia về đường bộ cao tốc QCVN 115:2024/BGTVT.\n\n3. Tốc độ thiết kế đường bộ được xác định theo Tiêu chuẩn quốc gia TCVN 4054: 2005 Đường ô tô - Yêu cầu thiết kế.\n\n4. Tốc độ thiết kế đường bộ trong phạm vi đô thị được xác định theo Quy chuẩn kỹ thuật quốc gia về hệ thống công trình hạ tầng kỹ thuật QCVN 07-4:2023/BXD.\n\n5. Tốc độ thiết kế đường giao thông nông thôn được xác định theo Tiêu chuẩn quốc gia TCVN 10380:2014 Đường giao thông nông thôn - Yêu cầu thiết kế.\n\n\n\nĐiều 6. Tốc độ khai thác tối đa cho phép xe cơ giới tham gia giao thông trên đường bộ (trừ đường cao tốc)\n\n1. Tốc độ khai thác tối đa cho phép xe cơ giới tham gia giao thông trên đường bộ trong khu vực đông dân cư\n\nBảng 1\n\nLoại xe cơ giới đường bộ Tốc độ khai thác tối đa (km/h) Tốc độ khai thác tối đa (km/h) Đường đôi; đường một chiều có từ hai làn xe cơ giới trở lên Đường hai chiều; đường một chiều có một làn xe cơ giới Các loại xe cơ giới, trừ các xe được quy định tại Điều 7 và Điều 8 Thông tư này 60 50\n\n2. Tốc độ khai thác tối đa cho phép xe cơ giới tham gia giao thông trên đường bộ ngoài khu vực đông dân cư\n\nBảng 2\n\nLoại xe cơ giới đường bộ Tốc độ khai thác tối đa (km/h) Tốc độ khai thác tối đa (km/h) Đường đôi; đường một chiều có từ hai làn xe cơ giới trở lên Đường hai chiều; đường một chiều có một làn xe cơ giới Xe ô tô chở người đến 28 chỗ không kể chỗ của người lái xe (trừ xe buýt); ô tô tải có trọng tải không lớn hơn 3,5 tấn 90 80 Xe ô tô chở người trên 28 chỗ không kể chỗ người lái xe (trừ xe buýt); ô tô tải có trọng tải trên 3,5 tấn (trừ ô tô xi téc) 80 70 Xe buýt; ô tô đầu kéo kéo sơ mi rơ moóc (trừ ô tô đầu kéo kéo sơ mi rơ moóc xi téc); xe mô tô; ô tô chuyên dùng (trừ ô tô trộn vữa, ô tô trộn bê tông lưu động) 70 60 Ô tô kéo rơ moóc; ô tô kéo xe khác; ô tô trộn vữa, ô tô trộn bê tông lưu động, ô tô xi téc, ô tô đầu kéo kéo sơ mi rơ moóc xi téc, ô tô kéo theo rơ moóc xi téc) 60 50\n\nĐiều 7. Tốc độ khai thác tối đa cho phép đối với xe máy chuyên dùng, xe gắn máy và các loại xe tương tự tham gia giao thông trên đường bộ (trừ đường cao tốc)\n\nXe máy chuyên dùng, xe gắn máy và các loại xe tương tự khi tham gia giao thông, tốc độ khai thác tối đa là 40 km/h.\n\nĐiều 8. Tốc độ khai thác tối đa cho phép đối với xe chở người bốn bánh có gắn động cơ, xe chở hàng bốn bánh có gắn động cơ tham gia giao thông trên đường bộ (trừ đường cao tốc)\n\n1. Xe chở người bốn bánh có gắn động cơ khi tham gia giao thông trong phạm vi và thời gian cho phép hoạt động, tốc độ khai thác tối đa là 30 km/h.\n\n2. Xe chở hàng bốn bánh có gắn động cơ khi tham gia giao thông trong phạm vi và thời gian cho phép hoạt động, tốc độ khai thác tối đa là 50 km/h.\n\nĐiều 9. Tốc độ khai thác tối đa, tốc độ khai thác tối thiểu cho phép đối với các loại xe cơ giới, xe máy chuyên dùng trên đường cao tốc\n\n1. Đường cao tốc phải được đặt biển báo tốc độ khai thác tối đa, tốc độ khai thác tối thiểu.\n\n2. Tốc độ khai thác tối đa cho phép trên đường cao tốc là 120 km/h.\n\n3. Tốc độ khai thác tối thiểu cho phép trên đường cao tốc là 60 km/h. Trường hợp đường cao tốc có tốc độ thiết kế 60 km/h thì tốc độ khai thác tối thiểu thực hiện theo phương án tổ chức giao thông được cấp có thẩm quyền phê duyệt.']","**Nguồn văn bản:** /content/drive/MyDrive/ITProject_data/new_law/38_2024_TT-BGTVT_622477.docx

**Tên văn bản:** Thông tư quy định về tốc độ và khoảng cách an toàn của xe cơ giới, xe máy chuyên dùng tham gia giao thông trên đường bộ.

**Số:** 38/2024/TT-BGTVT

**Nội dung:**

Tốc độ tối đa trong khu vực đông dân cư được quy định như sau:

1. Đối với xe cơ giới (trừ các loại xe được quy định tại Điều 7 và 8 của Thông tư này):

    a) Đường đôi; đường một chiều có từ hai làn xe cơ giới trở lên: 60 km/h.

    b) Đường hai chiều; đường một chiều có một làn xe cơ giới: 50 km/h.

2. Đối với xe máy chuyên dùng, xe gắn máy và các loại xe tương tự: 40 km/h.

3. Đối với xe chở người bốn bánh có gắn động cơ: 30 km/h.

4. Đối với xe chở hàng bốn bánh có gắn động cơ: 50 km/h.


**Tóm lại:** Tốc độ tối đa trong khu vực đông dân cư dao động từ 30 km/h đến 60 km/h tùy theo loại xe và loại đường. Cụ thể, xe cơ giới được phép chạy tối đa 50-60 km/h, xe máy chuyên dụng, xe gắn máy 40 km/h, xe chở người 4 bánh có gắn động cơ 30 km/h và xe chở hàng 4 bánh có gắn động cơ 50 km/h.
","**Nguồn văn bản:** 38_2024_TT-BGTVT_622477

**Tên văn bản:** Thông tư Quy định về tốc độ và khoảng cách an toàn của xe cơ giới, xe máy chuyên dùng tham gia giao thông trên đường bộ

**Điều 6:** Tốc độ khai thác tối đa cho phép xe cơ giới tham gia giao thông trên đường bộ (trừ đường cao tốc)

**Nội dung:**

1. Tốc độ khai thác tối đa cho phép xe cơ giới tham gia giao thông trên đường bộ trong khu vực đông dân cư bảng 1.

2. Tốc độ khai thác tối đa cho phép xe cơ giới tham gia giao thông trên đường bộ ngoài khu vực đông dân cư bảng 2.


**Điều 7:** Tốc độ khai thác tối đa cho phép đối với xe máy chuyên dùng, xe gắn máy và các loại xe tương tự tham gia giao thông trên đường bộ (trừ đường cao tốc)

**Nội dung:**

Xe máy chuyên dùng, xe gắn máy và các loại xe tương tự khi tham gia giao thông, tốc độ khai thác tối đa là 40 km/h.


**Tóm lại:** Context cung cấp thông tin về tốc độ tối đa cho phép của xe cơ giới trong và ngoài khu vực đông dân cư, và tốc độ tối đa cho phép của xe máy chuyên dùng, xe gắn máy (40km/h). Tuy nhiên, context thiếu bảng 1 và bảng 2 nêu trong Điều 6 nên chưa thể xác định tốc độ tối đa trong khu vực đô thị. Cần bổ sung thêm thông tin.
",1.0,0.6653959808896832,0.6666666666666666,0.0
15,Quy định mới về tốc độ tối đa ngoài khu vực đô thị là gì?,"['BỘ GIAO THÔNG VẬN TẢI\n-------- CỘNG HÒA XÃ HỘI CHỦ NGHĨA VIỆT NAM\nĐộc lập - Tự do - Hạnh phúc \n--------------- Số: 38/2024/TT-BGTVT Hà Nội, Ngày 15 tháng 11 năm 2024\n\nTHÔNG TƯ\n\nQUY ĐỊNH VỀ TỐC ĐỘ VÀ KHOẢNG CÁCH AN TOÀN CỦA XE CƠ GIỚI, XE MÁY CHUYÊN DÙNG THAM GIA GIAO THÔNG TRÊN ĐƯỜNG BỘ\n\nCăn cứ Luật Trật tự, an toàn giao thông đường bộ ngày 27 tháng 6 năm 2024;\n\nCăn cứ Luật Đường bộ ngày 27 tháng 6 năm 2024;\n\nCăn cứ Nghị định số 56/2022/NĐ-CP ngày 24 tháng 8 năm 2022 của Chính phủ quy định chức năng, nhiệm vụ, quyền hạn và cơ cấu tổ chức của Bộ Giao thông vận tải;\n\nTheo đề nghị của Vụ trưởng Vụ Kết cấu hạ tầng giao thông và Cục trưởng Cục đường bộ Việt Nam;\n\nBộ trưởng Bộ Giao thông vận tải ban hành Thông tư quy định về tốc độ và khoảng cách an toàn của xe cơ giới, xe máy chuyên dùng tham gia giao thông trên đường bộ.\n\nChương I\n\nQUY ĐỊNH CHUNG\n\nĐiều 1. Phạm vi điều chỉnh\n\nThông tư này quy định về tốc độ thiết kế của đường bộ; tốc độ khai thác và khoảng cách an toàn của xe cơ giới, xe máy chuyên dùng khi tham gia giao thông trên đường bộ, trừ xe ưu tiên đang đi làm nhiệm vụ theo quy định của pháp luật.\n\nĐiều 2. Đối tượng áp dụng\n\nThông tư này áp dụng đối với người lái xe, người điều khiển xe máy chuyên dùng và tổ chức, cá nhân liên quan đến quản lý và thực hiện các quy định về tốc độ thiết kế, tốc độ khai thác của đường bộ và khoảng cách an toàn của xe cơ giới, xe máy chuyên dùng khi tham gia giao thông trên đường bộ.\n\nĐiều 3. Giải thích từ ngữ\n\nTrong Thông tư này, các từ ngữ dưới đây được hiểu như sau:\n\n1. Đường bộ trong khu đông dân cư là đoạn đường bộ nằm trong khu vực nội thành phố, nội thị xã, nội thị trấn và những đoạn đường có đông dân cư sinh sống sát dọc theo đường, được xác định bằng biển báo “Bắt đầu khu đông dân cư” và biển báo “Hết khu đông dân cư”.\n\n2. Đường đôi là đường có chiều đi và chiều về được phân biệt bằng dải phân cách giữa.\n\n3. Đường một chiều là đường chỉ cho đi một chiều.\n\n4. Đường hai chiều là đường dùng chung cho cả chiều đi và về trên cùng một phần đường xe chạy mà không có dải phân cách giữa.\n\n5. Trọng tải là khối lượng hàng hóa chuyên chở cho phép, được ghi trên Giấy chứng nhận an toàn kỹ thuật và bảo vệ môi trường của phương tiện giao thông cơ giới đường bộ, Giấy chứng \n\n\n\nnhận chất lượng an toàn kỹ thuật và bảo vệ môi trường xe cơ giới nhập khẩu hoặc Giấy chứng nhận chất lượng an toàn kỹ thuật và bảo vệ môi trường kiểu loại ô tô sản xuất, lắp ráp.\n\n6. Tốc độ khai thác tối đa là giá trị tốc độ lớn nhất cho phép phương tiện tham gia giao thông trên đường bộ bảo đảm an toàn giao thông và khai thác hiệu quả tuyến đường.\n\n7. Tốc độ khai thác tối thiểu là giá trị tốc độ nhỏ nhất cho phép phương tiện tham gia giao thông trên đường bộ bảo đảm an toàn giao thông và khai thác hiệu quả tuyến đường.\n\n8. Khoảng cách an toàn là cự ly tối thiểu giữa phương tiện phía sau với phương tiện đang di chuyển liền trước, cùng làn đường, bảo đảm tránh xảy ra va chạm trong trường hợp phương tiện phía trước đột ngột giảm tốc độ hoặc dừng lại.\n\n9. Tốc độ lưu hành là giá trị tốc độ của phương tiện tại thời điểm tham gia giao thông trên đường bộ.\n\nĐiều 4. Nguyên tắc chấp hành quy định về tốc độ khai thác và khoảng cách an toàn khi điều khiển phương tiện trên đường bộ\n\n1. Khi tham gia giao thông trên đường bộ, người lái xe, người điều khiển xe máy chuyên dùng phải chấp hành quy định về tốc độ khai thác và khoảng cách an toàn theo quy định tại Điều 12 Luật Trật tự, an toàn giao thông đường bộ.\n\n2. Tại những đoạn đường không bố trí biển báo tốc độ khai thác tối đa, không bố trí biển báo khoảng cách an toàn giữa hai xe, người điều khiển phương tiện tham gia giao thông phải thực hiện theo quy định tại Điều 6, Điều 7, Điều 8 và Điều 11 Thông tư này.\n\nChương II\n\nTỐC ĐỘ THIẾT KẾ CỦA ĐƯỜNG BỘ; TỐC ĐỘ KHAI THÁC CỦA ĐƯỜNG BỘ, KHOẢNG CÁCH AN TOÀN CỦA XE CƠ GIỚI, XE MÁY CHUYÊN DÙNG THAM GIA GIAO THÔNG TRÊN ĐƯỜNG BỘ\n\nĐiều 5. Tốc độ thiết kế của đường bộ\n\n1. Tốc độ thiết kế của đường bộ là giá trị vận tốc được dùng để tính toán các chỉ tiêu kỹ thuật của đường bộ. Tốc độ thiết kế của đường bộ được xác định trong giai đoạn đầu tư xây dựng, nâng cấp, cải tạo đường bộ nhằm bảo đảm cho phương tiện di chuyển an toàn; được quyết định theo cấp kỹ thuật của đường bộ và điều kiện địa hình.\n\n2. Tốc độ thiết kế đường bộ cao tốc là giá trị vận tốc được dùng để tính toán các chỉ tiêu kỹ thuật của đường bộ cao tốc, được xác định theo cấp đường cao tốc. Khi thiết kế đường bộ cao tốc có thể áp dụng tốc độ thiết kế khác nhau theo từng đoạn nhưng phải bảo đảm các yêu cầu về chiều dài đoạn chuyển tiếp và tốc độ thiết kế trung gian giữa các đoạn. Tốc độ thiết kế đường bộ cao tốc được xác định theo Quy chuẩn kỹ thuật quốc gia về đường bộ cao tốc QCVN 115:2024/BGTVT.\n\n3. Tốc độ thiết kế đường bộ được xác định theo Tiêu chuẩn quốc gia TCVN 4054: 2005 Đường ô tô - Yêu cầu thiết kế.\n\n4. Tốc độ thiết kế đường bộ trong phạm vi đô thị được xác định theo Quy chuẩn kỹ thuật quốc gia về hệ thống công trình hạ tầng kỹ thuật QCVN 07-4:2023/BXD.\n\n5. Tốc độ thiết kế đường giao thông nông thôn được xác định theo Tiêu chuẩn quốc gia TCVN 10380:2014 Đường giao thông nông thôn - Yêu cầu thiết kế.\n\n\n\nĐiều 6. Tốc độ khai thác tối đa cho phép xe cơ giới tham gia giao thông trên đường bộ (trừ đường cao tốc)\n\n1. Tốc độ khai thác tối đa cho phép xe cơ giới tham gia giao thông trên đường bộ trong khu vực đông dân cư\n\nBảng 1\n\nLoại xe cơ giới đường bộ Tốc độ khai thác tối đa (km/h) Tốc độ khai thác tối đa (km/h) Đường đôi; đường một chiều có từ hai làn xe cơ giới trở lên Đường hai chiều; đường một chiều có một làn xe cơ giới Các loại xe cơ giới, trừ các xe được quy định tại Điều 7 và Điều 8 Thông tư này 60 50\n\n2. Tốc độ khai thác tối đa cho phép xe cơ giới tham gia giao thông trên đường bộ ngoài khu vực đông dân cư\n\nBảng 2\n\nLoại xe cơ giới đường bộ Tốc độ khai thác tối đa (km/h) Tốc độ khai thác tối đa (km/h) Đường đôi; đường một chiều có từ hai làn xe cơ giới trở lên Đường hai chiều; đường một chiều có một làn xe cơ giới Xe ô tô chở người đến 28 chỗ không kể chỗ của người lái xe (trừ xe buýt); ô tô tải có trọng tải không lớn hơn 3,5 tấn 90 80 Xe ô tô chở người trên 28 chỗ không kể chỗ người lái xe (trừ xe buýt); ô tô tải có trọng tải trên 3,5 tấn (trừ ô tô xi téc) 80 70 Xe buýt; ô tô đầu kéo kéo sơ mi rơ moóc (trừ ô tô đầu kéo kéo sơ mi rơ moóc xi téc); xe mô tô; ô tô chuyên dùng (trừ ô tô trộn vữa, ô tô trộn bê tông lưu động) 70 60 Ô tô kéo rơ moóc; ô tô kéo xe khác; ô tô trộn vữa, ô tô trộn bê tông lưu động, ô tô xi téc, ô tô đầu kéo kéo sơ mi rơ moóc xi téc, ô tô kéo theo rơ moóc xi téc) 60 50\n\nĐiều 7. Tốc độ khai thác tối đa cho phép đối với xe máy chuyên dùng, xe gắn máy và các loại xe tương tự tham gia giao thông trên đường bộ (trừ đường cao tốc)\n\nXe máy chuyên dùng, xe gắn máy và các loại xe tương tự khi tham gia giao thông, tốc độ khai thác tối đa là 40 km/h.\n\nĐiều 8. Tốc độ khai thác tối đa cho phép đối với xe chở người bốn bánh có gắn động cơ, xe chở hàng bốn bánh có gắn động cơ tham gia giao thông trên đường bộ (trừ đường cao tốc)\n\n1. Xe chở người bốn bánh có gắn động cơ khi tham gia giao thông trong phạm vi và thời gian cho phép hoạt động, tốc độ khai thác tối đa là 30 km/h.\n\n2. Xe chở hàng bốn bánh có gắn động cơ khi tham gia giao thông trong phạm vi và thời gian cho phép hoạt động, tốc độ khai thác tối đa là 50 km/h.\n\nĐiều 9. Tốc độ khai thác tối đa, tốc độ khai thác tối thiểu cho phép đối với các loại xe cơ giới, xe máy chuyên dùng trên đường cao tốc\n\n1. Đường cao tốc phải được đặt biển báo tốc độ khai thác tối đa, tốc độ khai thác tối thiểu.\n\n2. Tốc độ khai thác tối đa cho phép trên đường cao tốc là 120 km/h.\n\n3. Tốc độ khai thác tối thiểu cho phép trên đường cao tốc là 60 km/h. Trường hợp đường cao tốc có tốc độ thiết kế 60 km/h thì tốc độ khai thác tối thiểu thực hiện theo phương án tổ chức giao thông được cấp có thẩm quyền phê duyệt.']","**Nguồn văn bản:** /content/drive/MyDrive/ITProject_data/new_law/38_2024_TT-BGTVT_622477.docx

**Tên văn bản:** Không có tiêu đề trong metadata

**Điều khoản:** Không có điều khoản trong metadata

**Nội dung:**

Tốc độ khai thác tối đa cho phép xe cơ giới tham gia giao thông trên đường bộ ngoài khu vực đông dân cư được quy định như sau:

* **Đường đôi; đường một chiều có từ hai làn xe cơ giới trở lên:**

    a) Xe ô tô chở người đến 28 chỗ không kể chỗ của người lái xe (trừ xe buýt); ô tô tải có trọng tải không lớn hơn 3,5 tấn: 90 km/h.

    b) Xe ô tô chở người trên 28 chỗ không kể chỗ người lái xe (trừ xe buýt); ô tô tải có trọng tải trên 3,5 tấn (trừ ô tô xi téc): 80 km/h.

    c) Xe buýt; ô tô đầu kéo kéo sơ mi rơ moóc (trừ ô tô đầu kéo kéo sơ mi rơ moóc xi téc); xe mô tô; ô tô chuyên dùng (trừ ô tô trộn vữa, ô tô trộn bê tông lưu động): 70 km/h.

    d) Ô tô kéo rơ moóc; ô tô kéo xe khác; ô tô trộn vữa, ô tô trộn bê tông lưu động, ô tô xi téc, ô tô đầu kéo kéo sơ mi rơ moóc xi téc, ô tô kéo theo rơ moóc xi téc): 60 km/h.


* **Đường hai chiều; đường một chiều có một làn xe cơ giới:**

    a) Xe ô tô chở người đến 28 chỗ không kể chỗ của người lái xe (trừ xe buýt); ô tô tải có trọng tải không lớn hơn 3,5 tấn: 80 km/h.

    b) Xe ô tô chở người trên 28 chỗ không kể chỗ người lái xe (trừ xe buýt); ô tô tải có trọng tải trên 3,5 tấn (trừ ô tô xi téc): 70 km/h.

    c) Xe buýt; ô tô đầu kéo kéo sơ mi rơ moóc (trừ ô tô đầu kéo kéo sơ mi rơ moóc xi téc); xe mô tô; ô tô chuyên dùng (trừ ô tô trộn vữa, ô tô trộn bê tông lưu động): 60 km/h.

    d) Ô tô kéo rơ moóc; ô tô kéo xe khác; ô tô trộn vữa, ô tô trộn bê tông lưu động, ô tô xi téc, ô tô đầu kéo kéo sơ mi rơ moóc xi téc, ô tô kéo theo rơ moóc xi téc): 50 km/h.


**Tóm lại:** Tốc độ tối đa ngoài khu vực đông dân cư phụ thuộc vào loại xe và loại đường. Đường đôi hoặc một chiều nhiều làn cho phép tốc độ cao hơn so với đường hai chiều hoặc một chiều một làn.  Tốc độ tối đa dao động từ 50 km/h đến 90 km/h tùy thuộc vào loại xe.
","**Nguồn văn bản:** 38_2024_TT-BGTVT_622477

**Tên văn bản:** Thông tư Quy định về tốc độ và khoảng cách an toàn của xe cơ giới, xe máy chuyên dùng tham gia giao thông trên đường bộ

**Điều 6:** Tốc độ khai thác tối đa cho phép xe cơ giới tham gia giao thông trên đường bộ (trừ đường cao tốc)

**Nội dung:**

1. Tốc độ khai thác tối đa cho phép xe cơ giới tham gia giao thông trên đường bộ trong khu vực đông dân cư bảng 1

2. Tốc độ khai thác tối đa cho phép xe cơ giới tham gia giao thông trên đường bộ ngoài khu vực đông dân cư bảng 2


**Tóm lại:** Văn bản này quy định tốc độ tối đa cho phép xe cơ giới ngoài khu vực đông dân cư được quy định tại bảng 2. Tuy nhiên, nội dung của bảng 2 không được cung cấp trong đoạn context này.
",1.0,0.7392970933085552,0.7142857142857143,0.9999999999
16,Luật Giao thông Đường bộ 2025 có quy định gì về việc sử dụng đèn pha trong khu vực đô thị?,"['Điều 11. Đặt tên, đổi tên, số hiệu đường bộ\n\n1. Việc đặt tên, số hiệu đường bộ được quy định như sau:\n\na) Tên đường bộ được đặt theo tên danh nhân, người có công với đất nước; di tích, sự kiện lịch sử, văn hóa; tên địa danh hoặc tên theo tập quán. Số hiệu đường bộ được đặt theo số tự nhiên hoặc số tự nhiên kèm theo chữ cái nếu cần thiết. Trường hợp đường đô thị trùng với đường khác thì sử dụng cả tên đường đô thị và tên, số hiệu của đường khác;\n\nb) Tên, số hiệu đường bộ tham gia vào mạng lưới đường bộ quốc tế thực hiện theo điều ước quốc tế giữa nước Cộng hòa xã hội chủ nghĩa Việt Nam với các quốc gia, tổ chức quốc tế có liên quan. Đường bộ kết nối vào mạng lưới đường bộ quốc tế thì sử dụng cả tên, số hiệu đường bộ trong nước và tên, số hiệu đường bộ quốc tế.\n\n2. Trường hợp có tuyến, đoạn tuyến đường bộ đi trùng nhau thì sử dụng tên, số hiệu đường bộ thuộc cấp quản lý cao hơn, trừ trường hợp quy định tại điểm a khoản 1 Điều này.\n\n3. Không bắt buộc đặt tên, số hiệu đường bộ đối với đường xã, đường thôn, đường nội bộ, đường chuyên dùng; không bắt buộc đổi tên, số hiệu đường bộ trong trường hợp đường đó đi qua địa bàn được cấp có thẩm quyền quyết định giải thể, nhập, chia, điều chỉnh địa giới hành chính của địa phương.\n\n4. Chính phủ quy định chi tiết Điều này.\n\nMục 2. ĐẤT DÀNH CHO KẾT CẤU HẠ TẦNG ĐƯỜNG BỘ, BẢO VỆ KẾT CẤU HẠ TẦNG ĐƯỜNG BỘ\n\nĐiều 12. Quỹ đất dành cho kết cấu hạ tầng đường bộ\n\n1. Quỹ đất dành cho kết cấu hạ tầng đường bộ phải phù hợp với quy hoạch mạng lưới đường bộ; quy hoạch, kế hoạch sử dụng đất cấp tỉnh; quy hoạch sử dụng đất cấp huyện và các quy hoạch khác có liên quan.\n\n2. Quỹ đất dành cho kết cấu hạ tầng đường bộ trong đô thị là một bộ phận của đất dành cho giao thông so với đất xây dựng đô thị.\n\n3. Tỷ lệ đất dành cho giao thông trên đất xây dựng đô thị đạt từ 11% đến 26%, phù hợp với tiêu chuẩn về trình độ phát triển cơ sở hạ tầng và kiến trúc cảnh quan khu vực nội thành, nội thị của từng loại đô thị theo quy định của pháp luật về quy hoạch đô thị và quy định khác của pháp luật có liên quan.\n\n4. Đô thị có yếu tố đặc thù theo quy định của Ủy ban Thường vụ Quốc hội thì tỷ lệ đất dành cho giao thông so với đất xây dựng đô thị tối thiểu đạt 50% tỷ lệ đất quy định tại khoản 3 Điều này.\n\nĐiều 13. Đất dành cho kết cấu hạ tầng đường bộ\n\n1. Đất dành cho kết cấu hạ tầng đường bộ bao gồm:\n\na) Đất của đường bộ gồm phần đất để xây dựng công trình đường bộ và phần đất để bảo vệ, bảo trì đường bộ;\n\nb) Đất để xây dựng bến xe; bãi đỗ xe; điểm dừng xe, đỗ xe; trạm dừng nghỉ; các công trình phụ trợ phục vụ cho hoạt động đường bộ;\n\nc) Hành lang an toàn đường bộ.\n\n2. Việc quản lý, sử dụng đất dành cho kết cấu hạ tầng đường bộ phải tuân thủ quy định của pháp luật về đất đai, pháp luật về quy hoạch, pháp luật về quy hoạch đô thị, pháp luật về xây dựng, quy định của Luật này và quy định khác của pháp luật có liên quan.\n\n3. Trường hợp do vị trí tự nhiên mà việc thoát nước từ công trình thuộc kết cấu hạ tầng đường bộ buộc phải qua bất động sản khác thì chủ sở hữu bất động sản có hệ thống thoát nước đi qua phải dành một lối thoát nước thích hợp, không được cản trở hoặc ngăn chặn hệ thống thoát nước.\n\nNgười quản lý, sử dụng đường bộ phải hạn chế đến mức thấp nhất thiệt hại cho chủ sở hữu bất động sản khi xây dựng, lắp đặt hệ thống thoát nước; nếu gây thiệt hại phải bồi thường theo quy định của pháp luật.\n\nĐiều 14. Phần đất để bảo vệ, bảo trì đường bộ\n\n1. Chiều rộng phần đất để bảo vệ, bảo trì đường bộ ngoài đô thị phụ thuộc vào cấp kỹ thuật của đường bộ và được xác định theo nguyên tắc sau đây:\n\na) Đối với đường bộ có nền đắp, phần đất để bảo vệ, bảo trì được xác định từ chân ta luy nền đường ra bên ngoài;\n\nb) Đối với đường bộ có nền đào, phần đất để bảo vệ, bảo trì được xác định từ mép ngoài cùng của rãnh đỉnh ra bên ngoài; ở nơi không xây dựng rãnh đỉnh thì xác định từ mép trên cùng đỉnh mái ta luy dương nền đường ra bên ngoài;\n\nc) Đối với cầu, cống, rãnh, hố thu và các hạng mục công trình của đường bộ thì phần đất để bảo vệ, bảo trì đường bộ được xác định từ mép ngoài bộ phận kết cấu ngoài cùng của công trình trở ra; đối với cầu cạn, cầu vượt trên cao, phạm vi đất để bảo vệ, bảo trì cầu được xác định từ mép ngoài trở ra của móng các hạng mục công trình mố, trụ, mép ngoài của kết cấu cầu;\n\nd) Đối với trường hợp không thuộc quy định tại các điểm a, b và c khoản này, phần đất để bảo vệ, bảo trì đường bộ nằm dọc phía ngoài lề đường và cách lề đường một khoảng đủ để xây dựng rãnh thoát nước, nhưng không nhỏ hơn 01 mét.\n\n2. Phần đất để bảo vệ, bảo trì đường đô thị được xác định theo nguyên tắc sau đây:\n\na) Đường đô thị đã có hè phố thì sử dụng một phần hè phố để thực hiện bảo vệ, bảo trì đường đô thị;\n\nb) Trường hợp đường đô thị đi sát với tường bao nhà ở, tường bao công trình xây dựng khác, đường không có hè phố, đường nằm trong ngõ, ngách, kiệt, hẻm, đường nội bộ khu dân cư đô thị thì được sử dụng một phần mặt đường khi thực hiện bảo vệ, bảo trì đường đô thị;\n\nc) Trường hợp không thuộc quy định tại điểm a và điểm b khoản này thì được xác định tương tự đường ngoài đô thị;\n\nd) Phần đất để bảo vệ, bảo trì cầu, cống, rãnh, hố thu và các hạng mục công trình của đường đô thị được xác định theo quy định tại điểm c khoản 1 Điều này. Trường hợp cầu, cống, rãnh, hố thu và các hạng mục công trình của đường đô thị nằm liền kề với công trình xây dựng khác thì phần đất để bảo vệ, bảo trì là ranh giới của các công trình.\n\n3. Tại các đoạn đường chồng lấn, giao nhau, phần đất để bảo vệ, bảo trì đường bộ được xác định theo đường có cấp kỹ thuật cao hơn; đối với các đường liền kề nhau, phần đất để bảo vệ, bảo trì đường bộ được xác định từ mép của đường ngoài cùng trở ra.\n\n4. Trường hợp phần đất để bảo vệ, bảo trì đường bộ chồng lấn với phạm vi đất dành cho đường sắt thì việc sử dụng phần đất để bảo vệ, bảo trì đường bộ không được ảnh hưởng đến an toàn giao thông và an toàn công trình đường sắt.\n\n5. Trường hợp phần đất để bảo vệ, bảo trì đường bộ chồng lấn với hành lang bảo vệ đê, việc sử dụng phần đất để bảo vệ, bảo trì đường bộ không được ảnh hưởng đến vận hành và an toàn công trình đê điều. Trường hợp phần đất để bảo vệ, bảo trì đường bộ chồng lấn với phạm vi bảo vệ công trình thủy lợi, việc sử dụng phần đất để bảo vệ, bảo trì đường bộ không được ảnh hưởng đến vận hành và an toàn công trình thủy lợi; nếu bị ảnh hưởng thì người quản lý, sử dụng đường bộ, chủ sở hữu hoặc chủ quản lý công trình thủy lợi phải có biện pháp khắc phục, bảo đảm an toàn công trình đường bộ, công trình thủy lợi và an toàn giao thông.\n\n6. Phần đất để bảo vệ, bảo trì hầm đường bộ, bến phà đường bộ, cầu phao đường bộ, công trình kè, tường chắn được xác định như sau:\n\na) Phần đất để bảo vệ, bảo trì hầm đường bộ phụ thuộc vào cấp công trình hầm và được xác định từ mép ngoài cửa hầm chính, cửa hầm phụ, cửa hầm thông gió và các hạng mục công trình khác ra xung quanh;\n\nb) Phần đất để bảo vệ, bảo trì bến phà đường bộ phụ thuộc vào cấp công trình phà và được xác định từ mép ngoài đường xuống bến, công trình bến; phần đất để bảo vệ, bảo trì cầu phao đường bộ được xác định từ mép ngoài đường đầu cầu phao và mố, trụ cầu phao;\n\nc) Trường hợp đường bộ có phần đất để bảo vệ, bảo trì đường bộ chồng lấn với công trình đường thủy nội địa, ranh giới đất để bảo vệ, bảo trì đường bộ là chân móng của đường, các hạng mục thuộc công trình đường bộ;\n\nd) Phần đất bảo vệ, bảo trì công trình kè, tường chắn được xác định từ mép ngoài của bộ phận ngoài cùng của công trình ra xung quanh.\n\n7. Chính phủ quy định chi tiết Điều này.\n\nĐiều 15. Hành lang an toàn đường bộ\n\n1. Chiều rộng hành lang an toàn đường bộ được xác định theo nguyên tắc sau đây:\n\na) Đối với đường ngoài đô thị, xác định từ mép ngoài phần đất để bảo vệ, bảo trì đường bộ, theo quy mô, cấp kỹ thuật của đường; trường hợp đường hiện hữu chưa xác định cấp kỹ thuật, thì căn cứ chiều rộng mặt đường và tiêu chuẩn thiết kế đường để xác định cấp kỹ thuật tương ứng làm căn cứ xác định chiều rộng hành lang an toàn đường bộ;']","**Nguồn văn bản:** /content/drive/MyDrive/ITProject_data/new_law/35_2024_QH15_588811.docx

**Tên văn bản:** (Không có tiêu đề trong metadata)

**(Không có điều khoản trong metadata):**

**Nội dung:**
Điều 11. Đặt tên, đổi tên, số hiệu đường bộ

1. Việc đặt tên, số hiệu đường bộ được quy định như sau:

        a) Tên đường bộ được đặt theo tên danh nhân, người có công với đất nước; di tích, sự kiện lịch sử, văn hóa; tên địa danh hoặc tên theo tập quán. 
        Số hiệu đường bộ được đặt theo số tự nhiên hoặc số tự nhiên kèm theo chữ cái nếu cần thiết. 
        Trường hợp đường đô thị trùng với đường khác thì sử dụng cả tên đường đô thị và tên, số hiệu của đường khác.

        b) Tên, số hiệu đường bộ tham gia vào mạng lưới đường bộ quốc tế thực hiện theo điều ước quốc tế giữa nước Cộng hòa xã hội chủ nghĩa Việt Nam với các quốc gia, tổ chức quốc tế có liên quan. 
        Đường bộ kết nối vào mạng lưới đường bộ quốc tế thì sử dụng cả tên, số hiệu đường bộ trong nước và tên, số hiệu đường bộ quốc tế.

2. Trường hợp có tuyến, đoạn tuyến đường bộ đi trùng nhau thì sử dụng tên, số hiệu đường bộ thuộc cấp quản lý cao hơn, trừ trường hợp quy định tại điểm a khoản 1 Điều này.

3. Không bắt buộc đặt tên, số hiệu đường bộ đối với đường xã, đường thôn, đường nội bộ, đường chuyên dùng; không bắt buộc đổi tên, số hiệu đường bộ trong trường hợp đường đó đi qua địa bàn được cấp có thẩm quyền quyết định giải thể, nhập, chia, điều chỉnh địa giới hành chính của địa phương.

4. Chính phủ quy định chi tiết Điều này.

Mục 2. ĐẤT DÀNH CHO KẾT CẤU HẠ TẦNG ĐƯỜNG BỘ, BẢO VỆ KẾT CẤU HẠ TẦNG ĐƯỜNG BỘ

Điều 12. Quỹ đất dành cho kết cấu hạ tầng đường bộ

1. Quỹ đất dành cho kết cấu hạ tầng đường bộ phải phù hợp với quy hoạch mạng lưới đường bộ; quy hoạch, kế hoạch sử dụng đất cấp tỉnh; quy hoạch sử dụng đất cấp huyện và các quy hoạch khác có liên quan.

2. Quỹ đất dành cho kết cấu hạ tầng đường bộ trong đô thị là một bộ phận của đất dành cho giao thông so với đất xây dựng đô thị.

3. Tỷ lệ đất dành cho giao thông trên đất xây dựng đô thị đạt từ 11% đến 26%, phù hợp với tiêu chuẩn về trình độ phát triển cơ sở hạ tầng và kiến trúc cảnh quan khu vực nội thành, nội thị của từng loại đô thị theo quy định của pháp luật về quy hoạch đô thị và quy định khác của pháp luật có liên quan.

4. Đô thị có yếu tố đặc thù theo quy định của Ủy ban Thường vụ Quốc hội thì tỷ lệ đất dành cho giao thông so với đất xây dựng đô thị tối thiểu đạt 50% tỷ lệ đất quy định tại khoản 3 Điều này.


... (Các điều còn lại)


Tóm lại: Không tìm thấy thông tin liên quan tới việc sử dụng đèn pha trong khu vực đô thị.
","**Nguồn văn bản:** 168_2024_ND-CP_619502

**Tên văn bản:** Nghị định Quy định xử phạt vi phạm hành chính về trật tự, an toàn giao thông trong lĩnh vực giao thông đường bộ; trừ điểm, phục hồi điểm giấy phép lái xe

**Điều 7:** Xử phạt, trừ điểm giấy phép lái của người điều khiển xe mô tô, xe gắn máy, các loại xe tương tự xe mô tô và các loại xe tương tự xe gắn máy vi phạm quy tắc giao thông đường bộ

**Nội dung:**

1. Phạt tiền từ 200.000 đồng đến 400.000 đồng đối với người điều khiển xe thực hiện một trong các hành vi vi phạm sau đây:

	a) Không chấp hành hiệu lệnh, chỉ dẫn của biển báo hiệu, vạch kẻ đường, trừ các hành vi vi phạm quy định tại điểm b, điểm d, điểm e khoản 2; điểm a, điểm c, điểm d, điểm h khoản 3; điểm a, điểm b, điểm c, điểm d khoản 4; điểm b, điểm d khoản 6; điểm a, điểm b, điểm c khoản 7; điểm a khoản 8; điểm b khoản 9; điểm a khoản 10 điều này.

	b) Không có tín hiệu trước khi vượt hoặc có tín hiệu vượt xe nhưng không sử dụng trong suốt quá trình vượt xe.

	c) Lùi xe mô tô ba bánh không quan sát hai bên, phía sau xe hoặc không có tín hiệu lùi xe.

	d) Chở người ngồi trên xe sử dụng ô (dù).

	đ) Không tuân thủ các quy định về nhường đường tại nơi đường giao nhau, trừ các hành vi vi phạm quy định tại điểm c, điểm d khoản 6 điều này.

	e) Chuyển làn đường không đúng nơi cho phép hoặc không có tín hiệu báo trước hoặc chuyển làn đường không đúng quy định “mỗi lần chuyển làn đường chỉ được phép chuyển sang một làn đường liền kề”.

	g) Không sử dụng đèn chiếu sáng trong thời gian từ 18 giờ ngày hôm trước đến 06 giờ ngày hôm sau hoặc khi có sương mù, khói, bụi, trời mưa, thời tiết xấu làm hạn chế tầm nhìn.

	h) Tránh xe không đúng quy định; sử dụng đèn chiếu xa khi gặp người đi bộ qua đường hoặc khi đi trên đoạn đường qua khu dân cư có hệ thống chiếu sáng đang hoạt động hoặc khi gặp xe đi ngược chiều (trừ trường hợp dải phân cách có khả năng chống chói) hoặc khi chuyển hướng xe tại nơi đường giao nhau; không nhường đường cho xe đi ngược chiều theo quy định tại nơi đường hẹp, đường dốc, nơi có chướng ngại vật.

	i) Sử dụng còi trong thời gian từ 22 giờ ngày hôm trước đến 05 giờ ngày hôm sau trong khu đông dân cư, khu vực cơ sở khám bệnh, chữa bệnh, trừ các xe ưu tiên đang đi làm nhiệm vụ theo quy định.

	k) Điều khiển xe chạy dưới tốc độ tối thiểu trên đoạn đường bộ có quy định tốc độ tối thiểu cho phép.


**Tóm lại:**  Trong khu vực đô thị, khi gặp người đi bộ qua đường, khi đi trên đoạn đường có hệ thống chiếu sáng đang hoạt động, khi gặp xe đi ngược chiều (trừ trường hợp dải phân cách có khả năng chống chói), hoặc khi chuyển hướng xe tại nơi đường giao nhau mà sử dụng đèn chiếu xa sẽ bị phạt tiền từ 200.000 đồng đến 400.000 đồng.  Ngoài ra, không sử dụng đèn chiếu sáng trong thời gian từ 18 giờ ngày hôm trước đến 06 giờ ngày hôm sau hoặc khi có sương mù, khói, bụi, trời mưa, thời tiết xấu làm hạn chế tầm nhìn cũng bị phạt trong khung tiền này.
",0.8636363636363636,0.4662704743372923,0.0,0.0
17,Quy định mới về việc đỗ xe trên vỉa hè là gì?,"['BỘ GIAO THÔNG VẬN TẢI\n------- CỘNG HÒA XÃ HỘI CHỦ NGHĨA VIỆT NAM\nĐộc lập - Tự do - Hạnh phúc \n--------------- Số: 58/2024/TT-BGTVT Hà Nội, ngày 15 tháng 11 năm 2024\n\nTHÔNG TƯ\n\nQUY ĐỊNH VỀ ĐẦU TƯ ĐIỂM DỪNG XE, ĐỖ XE VÀ VỊ TRÍ, QUY MÔ TRẠM DỪNG NGHỈ, ĐIỂM DỪNG XE, ĐỖ XE TRÊN ĐƯỜNG CAO TỐC\n\nCăn cứ Luật Đường bộ ngày 27 tháng 6 năm 2024;\n\nCăn cứ Nghị định số 56/2022/NĐ-CP ngày 24 tháng 8 năm 2022 của Chính phủ quy định chức năng, nhiệm vụ, quyền hạn và cơ cấu tổ chức của Bộ Giao thông vận tải;\n\nTheo đề nghị của Cục trưởng Cục Đường cao tốc Việt Nam;\n\nBộ trưởng Bộ Giao thông vận tải ban hành Thông tư quy định về đầu tư điểm dừng xe, đỗ xe và vị trí, quy mô trạm dừng nghỉ, điểm dừng xe, đỗ xe trên đường cao tốc.\n\nĐiều 1. Phạm vi điều chỉnh\n\nThông tư này quy định chi tiết khoản 3 và khoản 4 Điều 52 Luật Đường bộ, bao gồm:\n\n1. Xem xét quyết định việc đầu tư điểm dừng xe, đỗ xe trên đường cao tốc;\n\n2. Vị trí, quy mô trạm dừng nghỉ, điểm dừng xe, đỗ xe trên đường cao tốc.\n\nĐiều 2. Đối tượng áp dụng\n\nThông tư này áp dụng đối với tổ chức, cá nhân có liên quan đến quyết định đầu tư điểm dừng xe, đỗ xe và xác định vị trí, quy mô trạm dừng nghỉ, điểm dừng xe, đỗ xe trên đường cao tốc.\n\nĐiều 3. Đầu tư điểm dừng xe, đỗ xe\n\n1. Trong quá trình lập báo cáo nghiên cứu khả thi, căn cứ nhu cầu sử dụng dịch vụ, tính chất dự án, đơn vị chuẩn bị dự án nghiên cứu, đề xuất việc đầu tư điểm dừng xe, đỗ xe tại địa điểm:\n\na) Có cảnh quan thiên nhiên hoặc danh lam thắng cảnh, di tích lịch sử - văn hóa nhằm phát triển du lịch, quảng bá văn hóa địa phương;\n\nb) Có đường ra, vào thuận tiện, không che khuất tầm nhìn, phù hợp với tính chất, điều kiện địa hình, địa chất, thủy văn của công trình dự án, bảo đảm an toàn khi khai thác.\n\n\n\n2. Cơ quan quyết định đầu tư dự án đối với dự án đầu tư công hoặc cơ quan phê duyệt dự án đối với dự án đầu tư theo phương thức đối tác công tư quyết định đầu tư điểm dừng xe, đỗ xe căn cứ nghiên cứu, đề xuất của đơn vị chuẩn bị dự án tại khoản 1 Điều này.\n\nĐiều 4. Vị trí, quy mô điểm dừng xe, đỗ xe\n\n1. Điểm dừng xe, đỗ xe được xây dựng ngoài phạm vi hành lang an toàn đường bộ.\n\n2. Điểm dừng, đỗ xe có quy mô diện tích tối thiểu 500 m2 không bao gồm đường ra vào.\n\nĐiều 5. Các hạng mục công trình thuộc điểm dừng xe, đỗ xe\n\n1. Điểm dừng, đỗ xe bao gồm các hạng mục sau:\n\na) Đường ra, vào;\n\nb) Mặt bằng khu vực dừng xe, đỗ xe;\n\nc) Nơi cung cấp thông tin, bản đồ du lịch hoặc các thiết bị nghe, nhìn khác phục vụ cung cấp thông tin cho người tham gia giao thông hoặc quảng bá du lịch địa phương.\n\n2. Yêu cầu thiết kế các hạng mục tại khoản 1 Điều này như sau:\n\na) Đường ra, vào tuân thủ quy định về đường nhánh ra, vào trên đường cao tốc theo Quy chuẩn kỹ thuật quốc gia về đường bộ cao tốc;\n\nb) Kết cấu mặt bằng khu vực dừng xe, đỗ xe và nơi cung cấp thông tin là mặt đường bê tông xi măng có chiều dày tối thiểu 20 cm hoặc bê tông nhựa có chiều dày tối thiểu 7 cm;\n\nc) Đường lưu thông trong mặt bằng khu vực dừng xe, đỗ xe phải có các biển báo hiệu, vạch kẻ đường; có bán kính quay xe tối thiểu 10 m tính theo tim đường, đảm bảo cho các loại phương tiện lưu thông an toàn trong khu vực điểm dừng xe, đỗ xe;\n\nd) Có biện pháp thoát nước phù hợp.\n\nĐiều 6. Vị trí, quy mô trạm dừng nghỉ\n\n1. Trạm dừng nghỉ được xây dựng ngoài phạm vi hành lang an toàn đường bộ theo quy định tại điểm d khoản 1 Điều 39 Luật Đường bộ.\n\n2. Trong quá trình lập báo cáo nghiên cứu khả thi, đơn vị chuẩn bị dự án nghiên cứu, đề xuất vị trí, quy mô trạm dừng nghỉ căn cứ:\n\na) Quy chuẩn kỹ thuật quốc gia về trạm dừng nghỉ, quy chuẩn kỹ thuật quốc\n\ngia về đường bộ cao tốc;\n\n\n\nc) Hình thức đầu tư, khả năng cân đối nguồn lực đầu tư;\n\nd) Điều kiện địa hình, địa chất và tính chất của công trình dự án.\n\nĐiều 7. Hiệu lực thi hành\n\n1. Thông tư này có hiệu lực thi hành kể từ ngày 01 tháng 01 năm 2025.\n\n2. Đối với các trạm dừng nghỉ đã được phê duyệt và quyết định vị trí, quy mô trước ngày Thông tư này có hiệu lực thi hành thì tiếp tục thực hiện theo nội dung đã được phê duyệt./.\n\nNơi nhận:\n- Bộ trưởng (để b/c);\n- Các Thứ trưởng Bộ Giao thông vận tải;\n- Văn phòng Chính phủ;\n- Các bộ, cơ quan ngang bộ, cơ quan thuộc Chính phủ;\n- UBND các tỉnh, thành phố trực thuộc trung ương;\n- Cục Kiểm tra văn bản QPPL (Bộ Tư pháp);\n- Công báo;\n- Cổng thông tin điện tử Chính phủ;\n- Cổng thông tin điện tử Bộ GTVT;\n- Báo Giao thông, Tạp chí GTVT;\n- Lưu: VT, CĐTVN. KT. BỘ TRƯỞNG \nTHỨ TRƯỞNG\n\n\n\n\nNguyễn Duy Lâm']","**Nguồn văn bản:** /content/drive/MyDrive/ITProject_data/new_law/58_2024_TT-BGTVT_634169.docx

**Tên văn bản:** (Không có tiêu đề trong metadata)

**(Không có điều khoản trong metadata):**

**Nội dung:**
BỘ GIAO THÔNG VẬN TẢI
------- CỘNG HÒA XÃ HỘI CHỦ NGHĨA VIỆT NAM
Độc lập - Tự do - Hạnh phúc 
--------------- Số: 58/2024/TT-BGTVT Hà Nội, ngày 15 tháng 11 năm 2024

THÔNG TƯ

QUY ĐỊNH VỀ ĐẦU TƯ ĐIỂM DỪNG XE, ĐỖ XE VÀ VỊ TRÍ, QUY MÔ TRẠM DỪNG NGHỈ, ĐIỂM DỪNG XE, ĐỖ XE TRÊN ĐƯỜNG CAO TỐC

Căn cứ Luật Đường bộ ngày 27 tháng 6 năm 2024;

Căn cứ Nghị định số 56/2022/NĐ-CP ngày 24 tháng 8 năm 2022 của Chính phủ quy định chức năng, nhiệm vụ, quyền hạn và cơ cấu tổ chức của Bộ Giao thông vận tải;

Theo đề nghị của Cục trưởng Cục Đường cao tốc Việt Nam;

Bộ trưởng Bộ Giao thông vận tải ban hành Thông tư quy định về đầu tư điểm dừng xe, đỗ xe và vị trí, quy mô trạm dừng nghỉ, điểm dừng xe, đỗ xe trên đường cao tốc.


Điều 1. Phạm vi điều chỉnh

Thông tư này quy định chi tiết khoản 3 và khoản 4 Điều 52 Luật Đường bộ, bao gồm:

1. Xem xét quyết định việc đầu tư điểm dừng xe, đỗ xe trên đường cao tốc;

2. Vị trí, quy mô trạm dừng nghỉ, điểm dừng xe, đỗ xe trên đường cao tốc.


Điều 2. Đối tượng áp dụng

Thông tư này áp dụng đối với tổ chức, cá nhân có liên quan đến quyết định đầu tư điểm dừng xe, đỗ xe và xác định vị trí, quy mô trạm dừng nghỉ, điểm dừng xe, đỗ xe trên đường cao tốc.

... (Các điều còn lại của Thông tư)


**Tóm lại:** Văn bản này quy định về đầu tư, vị trí, quy mô của điểm dừng đỗ xe và trạm dừng nghỉ trên đường cao tốc, chứ không đề cập đến quy định đỗ xe trên vỉa hè.
","**Nguồn văn bản:** 36_2024_QH15_444251

**Tên văn bản:** Luật Trật tự, an toàn giao thông đường bộ

**Điều 18:** Dừng xe, đỗ xe

**Nội dung:**

1. Dừng xe là trạng thái đứng yên tạm thời của xe trong một khoảng thời gian cần thiết đủ để cho người lên xe, xuống xe, xếp dỡ hàng hóa, kiểm tra kỹ thuật xe hoặc hoạt động khác. Khi dừng xe không được tắt máy và không được rời khỏi vị trí lái, trừ trường hợp rời khỏi vị trí lái để đóng, mở cửa xe, xếp dỡ hàng hóa, kiểm tra kỹ thuật xe nhưng phải sử dụng phanh đỗ xe hoặc thực hiện biện pháp an toàn khác.

2. Đỗ xe là trạng thái đứng yên của xe không giới hạn thời gian. Khi đỗ xe, người điều khiển phương tiện tham gia giao thông đường bộ chỉ được rời khỏi xe khi đã sử dụng phanh đỗ xe hoặc thực hiện biện pháp an toàn khác. Xe đỗ trên đoạn đường dốc phải đánh lái về phía lề đường, chèn bánh.

3. Người điều khiển phương tiện tham gia giao thông đường bộ khi dừng xe, đỗ xe trên đường phải thực hiện các quy định sau đây:

	a) Có tín hiệu báo cho người điều khiển phương tiện tham gia giao thông đường bộ khác biết khi ra, vào vị trí dừng xe, đỗ xe.

	b) Không làm ảnh hưởng đến người đi bộ và các phương tiện tham gia giao thông đường bộ.

4. Người điều khiển phương tiện tham gia giao thông đường bộ không được dừng xe, đỗ xe tại các vị trí sau đây:

	a) Bên trái đường một chiều.

	b) Trên đoạn đường cong hoặc gần đầu dốc mà tầm nhìn bị che khuất.

	c) Trên cầu, trừ những trường hợp tổ chức giao thông cho phép.

	d) Gầm cầu vượt, trừ những nơi cho phép dừng xe, đỗ xe.

	đ) Song song cùng chiều với một xe khác đang dừng, đỗ trên đường.

	e) Cách xe ô tô đang đỗ ngược chiều dưới 20 mét trên đường phố hẹp, dưới 40 mét trên đường có một làn xe cơ giới trên một chiều đường.

	g) Trên phần đường dành cho người đi bộ qua đường.

	h) Nơi đường giao nhau và trong phạm vi 05 mét tính từ mép đường giao nhau.

	i) Điểm đón, trả khách.

	k) Trước cổng và trong phạm vi 05 mét hai bên cổng trụ sở cơ quan, tổ chức có bố trí đường cho xe ra, vào.

	l) Tại nơi phần đường có chiều rộng chỉ đủ cho một làn xe cơ giới.

	m) Trong phạm vi an toàn của đường sắt.

	n) Che khuất biển báo hiệu đường bộ, đèn tín hiệu giao thông.

	o) Trên đường dành riêng cho xe buýt, trên miệng cống thoát nước, miệng hầm của đường điện thoại, điện cao thế, chỗ dành riêng cho xe chữa cháy lấy nước; trên lòng đường, vỉa hè trái quy định của pháp luật.


5. Trên đường bộ, người điều khiển phương tiện tham gia giao thông đường bộ chỉ được dừng xe, đỗ xe ở nơi có lề đường rộng hoặc khu đất ở bên ngoài phần đường xe chạy; trường hợp lề đường hẹp hoặc không có lề đường thì chỉ được dừng xe, đỗ xe sát mép đường phía bên phải theo chiều đi của mình.

6. Trên đường phố, người điều khiển phương tiện tham gia giao thông đường bộ chỉ được dừng xe, đỗ xe sát theo lề đường, vỉa hè phía bên phải theo chiều đi của mình; bánh xe gần nhất không được cách xa lề đường, vỉa hè quá 0,25 mét và không gây cản trở, nguy hiểm cho người và phương tiện tham gia giao thông đường bộ.

7. Trong trường hợp gặp sự cố kỹ thuật hoặc bất khả kháng khác buộc phải đỗ xe, khi đỗ xe chiếm một phần đường xe chạy hoặc tại nơi không được phép đỗ, phải có báo hiệu bằng đèn khẩn cấp hoặc đặt biển cảnh báo về phía sau xe để người điều khiển phương tiện tham gia giao thông đường bộ khác biết.


**Tóm lại:** Việc đỗ xe trên vỉa hè là bị cấm, trừ trường hợp đỗ xe sát lề đường, vỉa hè phía bên phải theo chiều đi, bánh xe gần nhất không quá 0,25m so với lề đường, vỉa hè và không gây cản trở giao thông.  Đỗ xe trên lòng đường, vỉa hè trái quy định của pháp luật là bị nghiêm cấm.
",0.6923076923076923,0.6137315659134794,0.0,0.0
18,Luật Giao thông Đường bộ 2025 có quy định gì về việc sử dụng làn đường dành cho xe buýt?,"['d) Trên đường hai chiều tại khu vực đỉnh dốc có tầm nhìn bị hạn chế; \n\nđ) Nơi đường giao nhau, đường bộ giao nhau cùng mức với đường sắt; \n\ne) Khi điều kiện thời tiết hoặc đường không bảo đảm an toàn cho việc vượt; \n\ng) Khi gặp xe ưu tiên; \n\nh) Ở phần đường dành cho người đi bộ qua đường; \n\ni) Khi có người đi bộ, xe lăn của người khuyết tật qua đường; \n\nk) Trong hầm đường bộ.\n\nĐiều 15. Chuyển hướng xe\n\n1. Chuyển hướng xe là tình huống giao thông mà xe rẽ trái hoặc rẽ phải hoặc quay đầu xe.\n\n2. Trước khi chuyển hướng, người điều khiển phương tiện tham gia giao thông đường bộ phải quan sát, bảo đảm khoảng cách an toàn với xe phía sau, giảm tốc độ và có tín hiệu báo hướng rẽ hoặc có tín hiệu bằng tay theo hướng rẽ đối với xe thô sơ không có đèn báo hướng rẽ, chuyển dần sang làn gần nhất với hướng rẽ. Tín hiệu báo hướng rẽ hoặc tín hiệu bằng tay phải sử dụng liên tục trong quá trình chuyển hướng. Khi bảo đảm an toàn, không gây trở ngại cho người và phương tiện khác mới được chuyển hướng.\n\n3. Khi chuyển hướng, người lái xe, người điều khiển xe máy chuyên dùng phải nhường đường cho người đi bộ, xe thô sơ, xe đi ngược chiều và chỉ chuyển hướng khi không gây trở ngại hoặc nguy hiểm cho người, phương tiện khác.\n\n4. Không được quay đầu xe ở phần đường dành cho người đi bộ qua đường, trên cầu, đầu cầu, gầm cầu vượt, ngầm, tại nơi đường bộ giao nhau cùng mức với đường sắt, đường hẹp, đường dốc, đoạn đường cong tầm nhìn bị che khuất, trên đường cao tốc, trong hầm đường bộ, trên đường một chiều, trừ khi có hiệu lệnh của người điều khiển giao thông hoặc chỉ dẫn của biển báo hiệu tạm thời.\n\nĐiều 16. Lùi xe\n\n1. Khi lùi xe, người điều khiển phương tiện tham gia giao thông đường bộ phải quan sát hai bên và phía sau xe, có tín hiệu lùi và chỉ lùi xe khi bảo đảm an toàn.\n\n2. Không được lùi xe ở đường một chiều, khu vực cấm dừng, trên phần đường dành cho người đi bộ qua đường, nơi đường bộ giao nhau, đường bộ giao nhau cùng mức với đường sắt, nơi tầm nhìn bị che khuất, trong hầm đường bộ, trên đường cao tốc.\n\nĐiều 17. Tránh xe đi ngược chiều\n\n1. Trên đường không phân chia thành hai chiều xe chạy riêng biệt, hai xe đi ngược chiều tránh nhau, người điều khiển phương tiện tham gia giao thông đường bộ phải giảm tốc độ và cho xe đi về bên phải theo chiều xe chạy của mình.\n\n2. Các trường hợp nhường đường khi tránh nhau bao gồm:\n\na) Nơi đường hẹp chỉ đủ cho một xe chạy và có chỗ tránh xe thì xe nào ở gần chỗ tránh hơn phải vào vị trí tránh, nhường đường cho xe đi ngược chiều;\n\nb) Xe xuống dốc phải nhường đường cho xe lên dốc;\n\nc) Xe có chướng ngại vật phía trước phải nhường đường cho xe không có chướng ngại vật phía trước.\n\nĐiều 18. Dừng xe, đỗ xe\n\n1. Dừng xe là trạng thái đứng yên tạm thời của xe trong một khoảng thời gian cần thiết đủ để cho người lên xe, xuống xe, xếp dỡ hàng hóa, kiểm tra kỹ thuật xe hoặc hoạt động khác. Khi dừng xe không được tắt máy và không được rời khỏi vị trí lái, trừ trường hợp rời khỏi vị trí lái để đóng, mở cửa xe, xếp dỡ hàng hóa, kiểm tra kỹ thuật xe nhưng phải sử dụng phanh đỗ xe hoặc thực hiện biện pháp an toàn khác.\n\n2. Đỗ xe là trạng thái đứng yên của xe không giới hạn thời gian. Khi đỗ xe, người điều khiển phương tiện tham gia giao thông đường bộ chỉ được rời khỏi xe khi đã sử dụng phanh đỗ xe hoặc thực hiện biện pháp an toàn khác. Xe đỗ trên đoạn đường dốc phải đánh lái về phía lề đường, chèn bánh.\n\n3. Người điều khiển phương tiện tham gia giao thông đường bộ khi dừng xe, đỗ xe trên đường phải thực hiện các quy định sau đây:\n\na) Có tín hiệu báo cho người điều khiển phương tiện tham gia giao thông đường bộ khác biết khi ra, vào vị trí dừng xe, đỗ xe;\n\nb) Không làm ảnh hưởng đến người đi bộ và các phương tiện tham gia giao thông đường bộ.\n\n4. Người điều khiển phương tiện tham gia giao thông đường bộ không được dừng xe, đỗ xe tại các vị trí sau đây:\n\na) Bên trái đường một chiều;\n\nb) Trên đoạn đường cong hoặc gần đầu dốc mà tầm nhìn bị che khuất;\n\nc) Trên cầu, trừ những trường hợp tổ chức giao thông cho phép;\n\nd) Gầm cầu vượt, trừ những nơi cho phép dừng xe, đỗ xe;\n\nđ) Song song cùng chiều với một xe khác đang dừng, đỗ trên đường;\n\ne) Cách xe ô tô đang đỗ ngược chiều dưới 20 mét trên đường phố hẹp, \ndưới 40 mét trên đường có một làn xe cơ giới trên một chiều đường;\n\ng) Trên phần đường dành cho người đi bộ qua đường;\n\nh) Nơi đường giao nhau và trong phạm vi 05 mét tính từ mép đường giao nhau;\n\ni) Điểm đón, trả khách;\xa0 \n\nk) Trước cổng và trong phạm vi 05 mét hai bên cổng trụ sở cơ quan, tổ chức có bố trí đường cho xe ra, vào;\n\nl) Tại nơi phần đường có chiều rộng chỉ đủ cho một làn xe cơ giới;\n\nm) Trong phạm vi an toàn của đường sắt;\n\nn) Che khuất biển báo hiệu đường bộ, đèn tín hiệu giao thông;\n\no) Trên đường dành riêng cho xe buýt, trên miệng cống thoát nước, miệng hầm của đường điện thoại, điện cao thế, chỗ dành riêng cho xe chữa cháy lấy nước; trên lòng đường, vỉa hè trái quy định của pháp luật.\n\n5. Trên đường bộ, người điều khiển phương tiện tham gia giao thông đường bộ chỉ được dừng xe, đỗ xe ở nơi có lề đường rộng hoặc khu đất ở bên ngoài phần đường xe chạy; trường hợp lề đường hẹp hoặc không có lề đường thì chỉ được dừng xe, đỗ xe sát mép đường phía bên phải theo chiều đi của mình.\n\n6. Trên đường phố, người điều khiển phương tiện tham gia giao thông đường bộ chỉ được dừng xe, đỗ xe sát theo lề đường, vỉa hè phía bên phải theo chiều đi của mình; bánh xe gần nhất không được cách xa lề đường, vỉa hè quá 0,25 mét và không gây cản trở, nguy hiểm cho người và phương tiện tham gia giao thông đường bộ. \n\n7. Trong trường hợp gặp sự cố kỹ thuật hoặc bất khả kháng khác buộc phải đỗ xe, khi đỗ xe chiếm một phần đường xe chạy hoặc tại nơi không được phép đỗ, phải có báo hiệu bằng đèn khẩn cấp hoặc đặt biển cảnh báo về phía sau xe để người điều khiển phương tiện tham gia giao thông đường bộ khác biết.\n\nĐiều 19. Mở cửa xe\n\n1. Chỉ được mở cửa xe khi xe đã dừng, đỗ.\n\n2. Trước khi mở cửa xe, người mở cửa phải quan sát phía trước, phía sau và bên phía mở cửa xe, khi thấy an toàn mới được mở cửa xe, ra khỏi xe; không để cửa xe mở nếu không bảo đảm an toàn.\n\nĐiều 20. Sử dụng đèn \n\n1. Người lái xe, người điều khiển xe máy chuyên dùng tham gia giao thông đường bộ phải bật đèn chiếu sáng phía trước trong thời gian từ 18 giờ ngày hôm trước đến 06 giờ ngày hôm sau hoặc khi có sương mù, khói, bụi, trời mưa, thời tiết xấu làm hạn chế tầm nhìn.\n\n2. Người lái xe, người điều khiển xe máy chuyên dùng phải tắt đèn chiếu xa, bật đèn chiếu gần trong các trường hợp sau đây:\n\na) Khi gặp người đi bộ qua đường;\n\nb) Khi đi trên các đoạn đường qua khu đông dân cư có hệ thống chiếu sáng đang hoạt động;\n\nc) Khi gặp xe đi ngược chiều, trừ trường hợp dải phân cách có khả năng chống chói;\n\nd) Khi chuyển hướng xe tại nơi đường giao nhau.\n\n3. Người lái xe, người điều khiển xe máy chuyên dùng khi thực hiện công việc trên đường bộ phải bật sáng đèn cảnh báo màu vàng.\n\nĐiều 21. Sử dụng tín hiệu còi \n\n1. Chỉ được sử dụng tín hiệu còi của phương tiện tham gia giao thông đường bộ trong các trường hợp sau đây:\n\na) Báo hiệu cho người tham gia giao thông đường bộ khi xuất hiện tình huống có thể mất an toàn giao thông;\n\nb) Báo hiệu chuẩn bị vượt xe.\n\n2. Không sử dụng còi liên tục; không sử dụng còi có âm lượng không đúng quy định; không sử dụng còi trong thời gian từ 22 giờ ngày hôm trước đến 05 giờ ngày hôm sau trong khu đông dân cư, khu vực cơ sở khám bệnh, chữa bệnh, trừ xe ưu tiên.\n\nĐiều 22. Nhường đường tại nơi đường giao nhau\n\nKhi đến gần đường giao nhau, người điều khiển phương tiện tham gia giao thông đường bộ phải quan sát, giảm tốc độ và nhường đường theo quy định sau đây:\n\n1. Tại nơi đường giao nhau giữa đường không ưu tiên với đường ưu tiên hoặc giữa đường nhánh với đường chính thì xe đi từ đường không ưu tiên hoặc đường nhánh phải nhường đường cho xe đi trên đường ưu tiên hoặc đường chính từ bất kỳ hướng nào tới;\n\n2. Tại nơi đường giao nhau không có báo hiệu đi theo vòng xuyến, phải nhường đường cho xe đi đến từ bên phải;']","**Nguồn văn bản:** /content/drive/MyDrive/ITProject_data/new_law/36_2024_QH15_444251.docx

**Tên văn bản:** (Không có tiêu đề trong metadata)


**Nội dung:**

Điều 18. Dừng xe, đỗ xe

4. Người điều khiển phương tiện tham gia giao thông đường bộ không được dừng xe, đỗ xe tại các vị trí sau đây:

    a) Bên trái đường một chiều.

    b) Trên đoạn đường cong hoặc gần đầu dốc mà tầm nhìn bị che khuất.

    c) Trên cầu, trừ những trường hợp tổ chức giao thông cho phép.

    d) Gầm cầu vượt, trừ những nơi cho phép dừng xe, đỗ xe.

    đ) Song song cùng chiều với một xe khác đang dừng, đỗ trên đường.

    e) Cách xe ô tô đang đỗ ngược chiều dưới 20 mét trên đường phố hẹp, dưới 40 mét trên đường có một làn xe cơ giới trên một chiều đường.

    g) Trên phần đường dành cho người đi bộ qua đường.

    h) Nơi đường giao nhau và trong phạm vi 05 mét tính từ mép đường giao nhau.

    i) Điểm đón, trả khách. 

    k) Trước cổng và trong phạm vi 05 mét hai bên cổng trụ sở cơ quan, tổ chức có bố trí đường cho xe ra, vào.

    l) Tại nơi phần đường có chiều rộng chỉ đủ cho một làn xe cơ giới.

    m) Trong phạm vi an toàn của đường sắt.

    n) Che khuất biển báo hiệu đường bộ, đèn tín hiệu giao thông.

    o) Trên đường dành riêng cho xe buýt, trên miệng cống thoát nước, miệng hầm của đường điện thoại, điện cao thế, chỗ dành riêng cho xe chữa cháy lấy nước; trên lòng đường, vỉa hè trái quy định của pháp luật.


Tóm lại: Không được dừng, đỗ xe trên đường dành riêng cho xe buýt.
","**Nguồn văn bản:** 36_2024_QH15_444251

**Tên văn bản:** Luật Trật tự, an toàn giao thông đường bộ

**Điều 18:** Dừng xe, đỗ xe

**Nội dung:**

4. Người điều khiển phương tiện tham gia giao thông đường bộ không được dừng xe, đỗ xe tại các vị trí sau đây:

	a) Bên trái đường một chiều.

	b) Trên đoạn đường cong hoặc gần đầu dốc mà tầm nhìn bị che khuất.

	c) Trên cầu, trừ những trường hợp tổ chức giao thông cho phép.

	d) Gầm cầu vượt, trừ những nơi cho phép dừng xe, đỗ xe.

	đ) Song song cùng chiều với một xe khác đang dừng, đỗ trên đường.

	e) Cách xe ô tô đang đỗ ngược chiều dưới 20 mét trên đường phố hẹp, dưới 40 mét trên đường có một làn xe cơ giới trên một chiều đường.

	g) Trên phần đường dành cho người đi bộ qua đường.

	h) Nơi đường giao nhau và trong phạm vi 05 mét tính từ mép đường giao nhau.

	i) Điểm đón, trả khách.

	k) Trước cổng và trong phạm vi 05 mét hai bên cổng trụ sở cơ quan, tổ chức có bố trí đường cho xe ra, vào.

	l) Tại nơi phần đường có chiều rộng chỉ đủ cho một làn xe cơ giới.

	m) Trong phạm vi an toàn của đường sắt.

	n) Che khuất biển báo hiệu đường bộ, đèn tín hiệu giao thông.

	o) Trên đường dành riêng cho xe buýt, trên miệng cống thoát nước, miệng hầm của đường điện thoại, điện cao thế, chỗ dành riêng cho xe chữa cháy lấy nước; trên lòng đường, vỉa hè trái quy định của pháp luật.


**Tóm lại:** Luật Giao thông Đường bộ quy định nghiêm cấm dừng, đỗ xe trên đường dành riêng cho xe buýt. Việc dừng, đỗ xe tại đây được xem là hành vi vi phạm luật giao thông.
",1.0,0.6658083664640826,0.9,0.9999999999
19,"Quy định mới về việc sử dụng còi xe trong khu vực bệnh viện, trường học là gì?","['i) Sử dụng còi trong thời gian từ 22 giờ ngày hôm trước đến 05 giờ ngày hôm sau trong khu đông dân cư, khu vực cơ sở khám bệnh, chữa bệnh, trừ các xe ưu tiên đang đi làm nhiệm vụ theo quy định;\n\nk) Điều khiển xe chạy dưới tốc độ tối thiểu trên đoạn đường bộ có quy định tốc độ tối thiểu cho phép.\n\n2. Phạt tiền từ 400.000 đồng đến 600.000 đồng đối với người điều khiển xe thực hiện một trong các hành vi vi phạm sau đây:\n\na) Dừng xe, đỗ xe trên phần đường xe chạy ở đoạn đường ngoài đô thị nơi có lề đường;\n\nb) Điều khiển xe chạy quá tốc độ quy định từ 05 km/h đến dưới 10 km/h;\n\nc) Điều khiển xe chạy tốc độ thấp mà không đi bên phải phần đường xe chạy gây cản trở giao thông;\n\nd) Dừng xe, đỗ xe ở lòng đường gây cản trở giao thông; tụ tập từ 03 xe trở lên ở lòng đường, trong hầm đường bộ; đỗ, để xe ở lòng đường, vỉa hè trái phép;\n\nđ) Xe không được quyền ưu tiên lắp đặt, sử dụng thiết bị phát tín hiệu của xe được quyền ưu tiên;\n\ne) Dừng xe, đỗ xe trên điểm đón, trả khách, nơi đường bộ giao nhau, trên phần đường dành cho người đi bộ qua đường; dừng xe nơi có biển “Cấm dừng xe và đỗ xe”; đỗ xe tại nơi có biển “Cấm đỗ xe” hoặc biển “Cấm dừng xe và đỗ xe”; không tuân thủ các quy định về dừng xe, đỗ xe tại nơi đường bộ giao nhau cùng mức với đường sắt; dừng xe, đỗ xe trong phạm vi hành lang an toàn giao thông đường sắt;\n\ng) Chở theo 02 người trên xe, trừ trường hợp chở người bệnh đi cấp cứu, trẻ em dưới 12 tuổi, người già yếu hoặc người khuyết tật, áp giải người có hành vi vi phạm pháp luật;\n\nh) Không đội “mũ bảo hiểm cho người đi mô tô, xe máy” hoặc đội “mũ bảo hiểm cho người đi mô tô, xe máy” không cài quai đúng quy cách khi điều khiển xe tham gia giao thông trên đường bộ;\n\ni) Chở người ngồi trên xe không đội “mũ bảo hiểm cho người đi mô tô, xe máy” hoặc đội “mũ bảo hiểm cho người đi mô tô, xe máy” không cài quai đúng quy cách, trừ trường hợp chở người bệnh đi cấp cứu, trẻ em dưới 06 tuổi, áp giải người có hành vi vi phạm pháp luật;\n\nk) Quay đầu xe tại nơi không được quay đầu xe, trừ hành vi vi phạm quy định tại điểm d khoản 4 Điều này.\n\n3. Phạt tiền từ 600.000 đồng đến 800.000 đồng đối với người điều khiển xe thực hiện một trong các hành vi vi phạm sau đây:\n\na) Chuyển hướng không quan sát hoặc không bảo đảm khoảng cách an toàn với xe phía sau hoặc không giảm tốc độ hoặc không có tín hiệu báo hướng rẽ hoặc có tín hiệu báo hướng rẽ nhưng không sử dụng liên tục trong quá trình chuyển hướng (trừ trường hợp điều khiển xe đi theo hướng cong của đoạn đường bộ ở nơi đường không giao nhau cùng mức); điều khiển xe rẽ trái tại nơi có biển báo hiệu có nội dung cấm rẽ trái đối với loại phương tiện đang điều khiển; điều khiển xe rẽ phải tại nơi có biển báo hiệu có nội dung cấm rẽ phải đối với loại phương tiện đang điều khiển;\n\nb) Chở theo từ 03 người trở lên trên xe;\n\nc) Dừng xe, đỗ xe trên cầu;\n\nd) Điều khiển xe không đi bên phải theo chiều đi của mình; đi không đúng phần đường, làn đường quy định (làn cùng chiều hoặc làn ngược chiều); điều khiển xe đi qua dải phân cách cố định ở giữa hai phần đường xe chạy;\n\nđ) Vượt bên phải trong trường hợp không được phép;\n\ne) Người đang điều khiển xe hoặc chở người ngồi trên xe bám, kéo, đẩy xe khác, vật khác, dẫn dắt vật nuôi, mang vác vật cồng kềnh; chở người đứng trên yên, giá đèo hàng hoặc ngồi trên tay lái của xe;\n\ng) Điều khiển xe kéo theo xe khác, vật khác;\n\nh) Chạy trong hầm đường bộ không sử dụng đèn chiếu sáng gần;\n\ni) Không giữ khoảng cách an toàn để xảy ra va chạm với xe chạy liền trước hoặc không giữ khoảng cách theo quy định của biển báo hiệu “Cự ly tối thiểu giữa hai xe”;\n\nk) Điều khiển xe chạy dàn hàng ngang từ 03 xe trở lên;\n\nl) Xe được quyền ưu tiên lắp đặt, sử dụng thiết bị phát tín hiệu ưu tiên không đúng quy định hoặc sử dụng thiết bị phát tín hiệu ưu tiên mà không có giấy phép của cơ quan có thẩm quyền cấp hoặc có giấy phép của cơ quan có thẩm quyền cấp nhưng không còn giá trị sử dụng theo quy định.\n\n4. Phạt tiền từ 800.000 đồng đến 1.000.000 đồng đối với người điều khiển xe thực hiện một trong các hành vi vi phạm sau đây:\n\na) Điều khiển xe chạy quá tốc độ quy định từ 10 km/h đến 20 km/h;\n\nb) Dừng xe, đỗ xe trong hầm đường bộ không đúng nơi quy định;\n\nc) Vượt xe trong những trường hợp không được vượt, vượt xe tại đoạn đường có biển báo hiệu có nội dung cấm vượt đối với loại phương tiện đang điều khiển, trừ các hành vi vi phạm quy định tại điểm đ khoản 3 Điều này;\n\nd) Quay đầu xe trong hầm đường bộ;\n\nđ) Người đang điều khiển xe sử dụng ô (dù), thiết bị âm thanh (trừ thiết bị trợ thính), dùng tay cầm và sử dụng điện thoại hoặc các thiết bị điện tử khác.\n\n5. Phạt tiền từ 1.000.000 đồng đến 2.000.000 đồng đối với người điều khiển xe thực hiện một trong các hành vi vi phạm sau đây:\n\na) Điều khiển xe có liên quan trực tiếp đến vụ tai nạn giao thông mà không dừng ngay phương tiện, không giữ nguyên hiện trường, không trợ giúp người bị nạn, trừ hành vi vi phạm quy định tại điểm c khoản 9 Điều này;\n\nb) Chuyển hướng không nhường quyền đi trước cho: người đi bộ, xe lăn của người khuyết tật qua đường tại nơi có vạch kẻ đường dành cho người đi bộ; xe thô sơ đang đi trên phần đường dành cho xe thô sơ;\n\nc) Chuyển hướng không nhường đường cho: các xe đi ngược chiều; người đi bộ, xe thô sơ đang qua đường tại nơi không có vạch kẻ đường cho người đi bộ.\n\n6. Phạt tiền từ 2.000.000 đồng đến 3.000.000 đồng đối với người điều khiển xe thực hiện một trong các hành vi vi phạm sau đây:\n\na) Điều khiển xe trên đường mà trong máu hoặc hơi thở có nồng độ cồn nhưng chưa vượt quá 50 miligam/100 mililít máu hoặc chưa vượt quá 0,25 miligam/1 lít khí thở;\n\nb) Đi vào khu vực cấm, đường có biển báo hiệu có nội dung cấm đi vào đối với loại phương tiện đang điều khiển, trừ các hành vi vi phạm quy định tại điểm a, điểm b khoản 7 Điều này và các trường hợp xe ưu tiên đang đi làm nhiệm vụ khẩn cấp theo quy định;\n\nc) Không giảm tốc độ (hoặc dừng lại) và nhường đường khi điều khiển xe đi từ đường không ưu tiên ra đường ưu tiên, từ đường nhánh ra đường chính;\n\nd) Không giảm tốc độ và nhường đường cho xe đi đến từ bên phải tại nơi đường giao nhau không có báo hiệu đi theo vòng xuyến; không giảm tốc độ và nhường đường cho xe đi đến từ bên trái tại nơi đường giao nhau có báo hiệu đi theo vòng xuyến.\n\n7. Phạt tiền từ 4.000.000 đồng đến 6.000.000 đồng đối với người điều khiển xe thực hiện một trong các hành vi vi phạm sau đây:\n\na) Đi ngược chiều của đường một chiều, đi ngược chiều trên đường có biển “Cấm đi ngược chiều”, trừ hành vi vi phạm quy định tại điểm b khoản này và các trường hợp xe ưu tiên đang đi làm nhiệm vụ khẩn cấp theo quy định; điều khiển xe đi trên vỉa hè, trừ trường hợp điều khiển xe đi qua vỉa hè để vào nhà, cơ quan;\n\nb) Điều khiển xe đi vào đường cao tốc, trừ xe phục vụ việc quản lý, bảo trì đường cao tốc;\n\nc) Không chấp hành hiệu lệnh của đèn tín hiệu giao thông;\n\nd) Không chấp hành hiệu lệnh, hướng dẫn của người điều khiển giao thông hoặc người kiểm soát giao thông;\n\nđ) Không nhường đường hoặc gây cản trở xe được quyền ưu tiên đang phát tín hiệu ưu tiên đi làm nhiệm vụ.\n\n8. Phạt tiền từ 6.000.000 đồng đến 8.000.000 đồng đối với người điều khiển xe thực hiện một trong các hành vi vi phạm sau đây:\n\na) Điều khiển xe chạy quá tốc độ quy định trên 20 km/h;\n\nb) Điều khiển xe trên đường mà trong máu hoặc hơi thở có nồng độ cồn vượt quá 50 miligam đến 80 miligam/100 mililít máu hoặc vượt quá 0,25 miligam đến 0,4 miligam/1 lít khí thở.\n\n9. Phạt tiền từ 8.000.000 đồng đến 10.000.000 đồng đối với người điều khiển xe thực hiện một trong các hành vi vi phạm sau đây:\n\na) Điều khiển xe lạng lách, đánh võng trên đường bộ; sử dụng chân chống hoặc vật khác quệt xuống đường khi xe đang chạy;\n\nb) Điều khiển xe thành nhóm từ 02 xe trở lên chạy quá tốc độ quy định;\n\nc) Gây tai nạn giao thông không dừng ngay phương tiện, không giữ nguyên hiện trường, không trợ giúp người bị nạn, không ở lại hiện trường hoặc không đến trình báo ngay với cơ quan công an, Ủy ban nhân dân nơi gần nhất;']","**Nguồn văn bản:** /content/drive/MyDrive/ITProject_data/new_law/168_2024_ND-CP_619502.docx

**Tên văn bản:** (Không có tiêu đề trong metadata)


**Nội dung:**

i) Sử dụng còi trong thời gian từ 22 giờ ngày hôm trước đến 05 giờ ngày hôm sau trong khu đông dân cư, khu vực cơ sở khám bệnh, chữa bệnh, trừ các xe ưu tiên đang đi làm nhiệm vụ theo quy định.


Tóm lại: Cấm sử dụng còi xe trong khoảng thời gian từ 22h hôm trước đến 5h hôm sau tại khu đông dân cư và khu vực bệnh viện, trừ xe ưu tiên đang làm nhiệm vụ.
","**Nguồn văn bản:** 36_2024_QH15_444251

**Tên văn bản:** Luật Trật tự, an toàn giao thông đường bộ

**Điều 21:** Sử dụng tín hiệu còi

**Nội dung:**

1. Chỉ được sử dụng tín hiệu còi của phương tiện tham gia giao thông đường bộ trong các trường hợp sau đây:

	a) Báo hiệu cho người tham gia giao thông đường bộ khi xuất hiện tình huống có thể mất an toàn giao thông.

	b) Báo hiệu chuẩn bị vượt xe.

2. Không sử dụng còi liên tục; không sử dụng còi có âm lượng không đúng quy định; không sử dụng còi trong thời gian từ 22 giờ ngày hôm trước đến 05 giờ ngày hôm sau trong khu đông dân cư, khu vực cơ sở khám bệnh, chữa bệnh, trừ xe ưu tiên.

**Nguồn văn bản:** 168_2024_ND-CP_619502

**Tên văn bản:** Nghị định Quy định xử phạt vi phạm hành chính về trật tự, an toàn giao thông trong lĩnh vực giao thông đường bộ; trừ điểm, phục hồi điểm giấy phép lái xe

**Điều 7:** Xử phạt, trừ điểm giấy phép lái của người điều khiển xe mô tô, xe gắn máy, các loại xe tương tự xe mô tô và các loại xe tương tự xe gắn máy vi phạm quy tắc giao thông đường bộ

**Nội dung:**

1. Phạt tiền từ 200.000 đồng đến 400.000 đồng đối với người điều khiển xe thực hiện một trong các hành vi vi phạm sau đây:
    
    a) Không chấp hành hiệu lệnh, chỉ dẫn của biển báo hiệu, vạch kẻ đường, trừ các hành vi vi phạm quy định tại điểm b, điểm d, điểm e khoản 2; điểm a, điểm c, điểm d, điểm h khoản 3; điểm a, điểm b, điểm c, điểm d khoản 4; điểm b, điểm d khoản 6; điểm a, điểm b, điểm c khoản 7; điểm a khoản 8; điểm b khoản 9; điểm a khoản 10 điều này.
    
    b) Không có tín hiệu trước khi vượt hoặc có tín hiệu vượt xe nhưng không sử dụng trong suốt quá trình vượt xe.
    
    c) Lùi xe mô tô ba bánh không quan sát hai bên, phía sau xe hoặc không có tín hiệu lùi xe.
    
    d) Chở người ngồi trên xe sử dụng ô (dù).
    
    đ) Không tuân thủ các quy định về nhường đường tại nơi đường giao nhau, trừ các hành vi vi phạm quy định tại điểm c, điểm d khoản 6 điều này.
    
    e) Chuyển làn đường không đúng nơi cho phép hoặc không có tín hiệu báo trước hoặc chuyển làn đường không đúng quy định “mỗi lần chuyển làn đường chỉ được phép chuyển sang một làn đường liền kề”.
    
    g) Không sử dụng đèn chiếu sáng trong thời gian từ 18 giờ ngày hôm trước đến 06 giờ ngày hôm sau hoặc khi có sương mù, khói, bụi, trời mưa, thời tiết xấu làm hạn chế tầm nhìn.
    
    h) Tránh xe không đúng quy định; sử dụng đèn chiếu xa khi gặp người đi bộ qua đường hoặc khi đi trên đoạn đường qua khu dân cư có hệ thống chiếu sáng đang hoạt động hoặc khi gặp xe đi ngược chiều (trừ trường hợp dải phân cách có khả năng chống chói) hoặc khi chuyển hướng xe tại nơi đường giao nhau; không nhường đường cho xe đi ngược chiều theo quy định tại nơi đường hẹp, đường dốc, nơi có chướng ngại vật.
    
    i) Sử dụng còi trong thời gian từ 22 giờ ngày hôm trước đến 05 giờ ngày hôm sau trong khu đông dân cư, khu vực cơ sở khám bệnh, chữa bệnh, trừ các xe ưu tiên đang đi làm nhiệm vụ theo quy định.
    
    k) Điều khiển xe chạy dưới tốc độ tối thiểu trên đoạn đường bộ có quy định tốc độ tối thiểu cho phép.


**(Còn nữa)**


**Tóm lại:** Cấm bóp còi từ 22h hôm trước đến 5h hôm sau ở khu đông dân cư, khu vực bệnh viện, trừ xe ưu tiên. Chỉ được bóp còi khi báo hiệu nguy hiểm hoặc xin vượt. Không bóp còi liên tục hoặc âm lượng quá lớn.
",1.0,0.5831115493142822,0.06666666666666667,0.9999999999
20,Luật Giao thông Đường bộ 2025 có quy định gì về việc sử dụng ghế trẻ em trên ô tô?,"['5. Phạt tiền từ 12.000.000 đồng đến 14.000.000 đồng đối với hành vi vận chuyển hàng hóa nguy hiểm không có giấy phép vận chuyển hàng hóa nguy hiểm hoặc có nhưng hết hiệu lực hoặc không thực hiện đúng quy định trong giấy phép vận chuyển hàng hóa nguy hiểm, trừ các hành vi vi phạm quy định tại điểm a khoản 6 Điều 20 của Nghị định này.\n\n6. Ngoài việc bị áp dụng hình thức xử phạt, người thực hiện hành vi vi phạm quy định tại khoản 4, khoản 5 Điều này nếu gây ô nhiễm môi trường còn bị áp dụng các biện pháp khắc phục hậu quả buộc thực hiện các biện pháp khắc phục tình trạng ô nhiễm môi trường do vi phạm hành chính gây ra.\n\n7. Ngoài việc bị áp dụng hình thức xử phạt, người điều khiển phương tiện thực hiện hành vi vi phạm còn bị trừ điểm giấy phép lái xe như sau:\n\na) Thực hiện hành vi quy định tại khoản 3, khoản 4 Điều này bị trừ điểm giấy phép lái xe 02 điểm;\n\nb) Thực hiện hành vi quy định tại khoản 5 Điều này bị trừ điểm giấy phép lái xe 04 điểm.\n\nĐiều 24. Xử phạt, trừ điểm giấy phép lái xe của người điều khiển xe ô tô thực hiện hành vi vi phạm quy định về vận chuyển động vật sống, thực phẩm tươi sống\n\n1. Phạt tiền từ 1.000.000 đồng đến 2.000.000 đồng đối với hành vi vi phạm vận chuyển động vật sống, thực phẩm tươi sống không mang đủ giấy tờ theo quy định (đối với loại động vật sống, thực phẩm tươi sống khi vận chuyển phải có giấy tờ).\n\n2. Phạt tiền từ 3.000.000 đồng đến 5.000.000 đồng đối với hành vi vi phạm vận chuyển thực phẩm tươi sống không chấp hành quy định về an toàn thực phẩm, vệ sinh dịch tễ, phòng dịch và bảo đảm vệ sinh môi trường theo quy định.\n\n3. Ngoài việc bị áp dụng hình thức xử phạt, người điều khiển phương tiện thực hiện hành vi vi phạm quy định tại khoản 2 Điều này còn bị trừ điểm giấy phép lái xe 02 điểm.\n\nĐiều 25. Xử phạt, trừ điểm giấy phép lái xe của người điều khiển xe vệ sinh môi trường, xe ô tô chở phế thải thực hiện hành vi vi phạm quy định về hoạt động vận tải trong đô thị\n\n1. Phạt tiền từ 2.000.000 đồng đến 3.000.000 đồng đối với hành vi điều khiển xe không chạy đúng tuyến, phạm vi, thời gian quy định.\n\n2. Ngoài việc bị áp dụng hình thức xử phạt, người điều khiển phương tiện thực hiện hành vi vi phạm quy định tại khoản 1 Điều này còn bị trừ điểm giấy phép lái xe 02 điểm.\n\nĐiều 26. Xử phạt các hành vi vi phạm quy định về trật tự, an toàn giao thông đường bộ trong vận tải đường bộ, dịch vụ hỗ trợ vận tải đường bộ\n\n1. Phạt tiền từ 500.000 đồng đến 1.000.000 đồng đối với cá nhân, từ 1.000.000 đồng đến 2.000.000 đồng đối với tổ chức thực hiện một trong các hành vi vi phạm sau đây:\n\na) Xếp hàng hóa lên mỗi xe ô tô (kể cả rơ moóc và sơ mi rơ moóc) vượt quá trọng tải (khối lượng hàng chuyên chở) cho phép tham gia giao thông được ghi trong giấy chứng nhận kiểm định an toàn kỹ thuật và bảo vệ môi trường của xe trên 10% đến 50% (trừ xe xi téc chở chất lỏng), trên 20% đến 50% đối với xe xi téc chở chất lỏng;\n\nb) Xếp hàng hóa lên xe ô tô mà không ký xác nhận việc xếp hàng hóa vào giấy vận tải theo quy định.\n\n2. Phạt tiền từ 1.000.000 đồng đến 2.000.000 đồng đối với cá nhân, từ 2.000.000 đồng đến 4.000.000 đồng đối với tổ chức kinh doanh vận tải, dịch vụ hỗ trợ vận tải thực hiện một trong các hành vi vi phạm sau đây:\n\na) Không đánh số thứ tự ghế ngồi, giường nằm trên xe ô tô chở hành khách theo quy định;\n\nb) Sử dụng xe ô tô kinh doanh vận tải hành khách theo tuyến cố định, xe ô tô kinh doanh vận tải hành khách bằng xe buýt không có chỗ ưu tiên cho người khuyết tật, người cao tuổi và phụ nữ mang thai theo quy định;\n\nc) Sử dụng xe ô tô kinh doanh vận tải hành khách không có hướng dẫn cho hành khách về an toàn giao thông, thoát hiểm khi xảy ra sự cố trên xe theo quy định;\n\nd) Không bố trí người áp tải trên xe vận chuyển hàng hóa nguy hiểm đối với những trường hợp quy định phải có người áp tải;\n\nđ) Không cấp lệnh vận chuyển, giấy vận tải cho lái xe hoặc cấp lệnh vận chuyển, giấy vận tải nhưng không đúng theo quy định (đối với loại xe quy định phải cấp lệnh vận chuyển, giấy vận tải);\n\ne) Sử dụng xe vận chuyển hàng hóa nguy hiểm mà không làm sạch hoặc không bóc (xóa) biểu trưng nguy hiểm trên phương tiện khi không tiếp tục vận chuyển loại hàng hóa đó.\n\n3. Phạt tiền từ 2.000.000 đồng đến 3.000.000 đồng đối với cá nhân, từ 4.000.000 đồng đến 6.000.000 đồng đối với tổ chức thực hiện hành vi vi phạm xếp hàng hóa lên mỗi xe ô tô (kể cả rơ moóc và sơ mi rơ moóc) vượt quá trọng tải (khối lượng hàng chuyên chở) cho phép tham gia giao thông được ghi trong giấy chứng nhận kiểm định an toàn kỹ thuật và bảo vệ môi trường của xe trên 50% đến 100%.\n\n4. Phạt tiền từ 3.000.000 đồng đến 4.000.000 đồng đối với cá nhân, từ 6.000.000 đồng đến 8.000.000 đồng đối với tổ chức kinh doanh vận tải, dịch vụ hỗ trợ vận tải thực hiện một trong các hành vi vi phạm sau đây:\n\na) Không cấp thẻ nhận dạng lái xe cho lái xe theo quy định;\n\nb) Sử dụng lái xe, nhân viên phục vụ trên xe để tham gia kinh doanh vận tải bằng xe ô tô mà không được tập huấn, hướng dẫn về nghiệp vụ vận tải hành khách và an toàn giao thông theo quy định (đối với hình thức kinh doanh vận tải có quy định lái xe, nhân viên phục vụ trên xe phải được tập huấn, hướng dẫn nghiệp vụ), trừ các hành vi vi phạm quy định tại điểm c, điểm d khoản này;\n\nc) Sử dụng lái xe, người quản lý trên xe để tham gia kinh doanh vận tải bằng xe ô tô mà không được hướng dẫn về quy trình bảo đảm an toàn khi đưa đón trẻ em mầm non, học sinh;\n\nd) Sử dụng lái xe, người áp tải vận chuyển hàng hóa nguy hiểm mà không được tập huấn về vận chuyển hàng hóa nguy hiểm;\n\nđ) Sử dụng xe ô tô kinh doanh vận tải hành khách không có dây đai an toàn tại các vị trí ghế ngồi, giường nằm theo quy định (trừ xe buýt nội tỉnh);\n\ne) Sử dụng xe ô tô kinh doanh vận tải chở trẻ em mầm non, học sinh tiểu học, xe ô tô kinh doanh vận tải kết hợp với hoạt động đưa đón trẻ em mầm non, học sinh tiểu học không có dây đai an toàn phù hợp với lứa tuổi hoặc không có ghế ngồi phù hợp với lứa tuổi theo quy định;\n\ng) Không thực hiện việc niêm yết thông tin trên xe theo quy định hoặc có niêm yết nhưng không chính xác, không đầy đủ thông tin theo quy định.\n\n5. Phạt tiền từ 4.000.000 đồng đến 5.000.000 đồng đối với cá nhân, từ 8.000.000 đồng đến 10.000.000 đồng đối với tổ chức xếp hàng hóa lên mỗi xe ô tô (kể cả rơ moóc và sơ mi rơ moóc) vượt quá trọng tải (khối lượng hàng chuyên chở) cho phép tham gia giao thông được ghi trong giấy chứng nhận kiểm định an toàn kỹ thuật và bảo vệ môi trường của xe trên 100%.\n\n6. Phạt tiền từ 4.000.000 đồng đến 6.000.000 đồng đối với cá nhân, từ 8.000.000 đồng đến 12.000.000 đồng đối với tổ chức kinh doanh vận tải thực hiện một trong các hành vi vi phạm sau đây:\n\na) Sử dụng xe vận chuyển động vật sống không có kết cấu phù hợp với loại động vật chuyên chở theo quy định;\n\nb) Sử dụng xe ô tô kinh doanh vận tải chở trẻ em mầm non, học sinh, xe ô tô kinh doanh vận tải kết hợp với hoạt động đưa đón trẻ em mầm non, học sinh không có thiết bị ghi nhận hình ảnh trẻ em mầm non, học sinh hoặc không có thiết bị có chức năng cảnh báo, chống bỏ quên trẻ em trên xe hoặc không có thiết bị ghi nhận hình ảnh trẻ em mầm non, học sinh và thiết bị có chức năng cảnh báo, chống bỏ quên trẻ em trên xe;\n\nc) Sử dụng xe ô tô kinh doanh vận tải chở trẻ em mầm non, học sinh không có màu sơn theo quy định;\n\nd) Sử dụng xe ô tô kinh doanh vận tải chở trẻ em mầm non, học sinh, xe ô tô kinh doanh vận tải kết hợp với hoạt động đưa đón trẻ em mầm non, học sinh không có biển báo dấu hiệu nhận biết là xe chở trẻ em mầm non, học sinh theo quy định.\n\n7. Phạt tiền từ 5.000.000 đồng đến 6.000.000 đồng đối với cá nhân, từ 10.000.000 đồng đến 12.000.000 đồng đối với tổ chức kinh doanh vận tải, dịch vụ hỗ trợ vận tải thực hiện một trong các hành vi vi phạm sau đây:\n\na) Không thực hiện việc cung cấp, cập nhật, truyền, lưu trữ, quản lý thông tin, dữ liệu từ thiết bị giám sát hành trình theo quy định;\n\nb) Không thực hiện đúng nội dung thông tin đã niêm yết trên xe theo quy định;']","**Nguồn văn bản:** /content/drive/MyDrive/ITProject_data/new_law/168_2024_ND-CP_619502.docx

**Tên văn bản:** (Không có tiêu đề trong metadata)


**Nội dung:**

5. Phạt tiền từ 12.000.000 đồng đến 14.000.000 đồng đối với hành vi vận chuyển hàng hóa nguy hiểm không có giấy phép vận chuyển hàng hóa nguy hiểm hoặc có nhưng hết hiệu lực hoặc không thực hiện đúng quy định trong giấy phép vận chuyển hàng hóa nguy hiểm, trừ các hành vi vi phạm quy định tại điểm a khoản 6 Điều 20 của Nghị định này.

6. Ngoài việc bị áp dụng hình thức xử phạt, người thực hiện hành vi vi phạm quy định tại khoản 4, khoản 5 Điều này nếu gây ô nhiễm môi trường còn bị áp dụng các biện pháp khắc phục hậu quả buộc thực hiện các biện pháp khắc phục tình trạng ô nhiễm môi trường do vi phạm hành chính gây ra.

7. Ngoài việc bị áp dụng hình thức xử phạt, người điều khiển phương tiện thực hiện hành vi vi phạm còn bị trừ điểm giấy phép lái xe như sau:

    a) Thực hiện hành vi quy định tại khoản 3, khoản 4 Điều này bị trừ điểm giấy phép lái xe 02 điểm.

    b) Thực hiện hành vi quy định tại khoản 5 Điều này bị trừ điểm giấy phép lái xe 04 điểm.


Điều 24. Xử phạt, trừ điểm giấy phép lái xe của người điều khiển xe ô tô thực hiện hành vi vi phạm quy định về vận chuyển động vật sống, thực phẩm tươi sống

1. Phạt tiền từ 1.000.000 đồng đến 2.000.000 đồng đối với hành vi vi phạm vận chuyển động vật sống, thực phẩm tươi sống không mang đủ giấy tờ theo quy định (đối với loại động vật sống, thực phẩm tươi sống khi vận chuyển phải có giấy tờ).

2. Phạt tiền từ 3.000.000 đồng đến 5.000.000 đồng đối với hành vi vi phạm vận chuyển thực phẩm tươi sống không chấp hành quy định về an toàn thực phẩm, vệ sinh dịch tễ, phòng dịch và bảo đảm vệ sinh môi trường theo quy định.

3. Ngoài việc bị áp dụng hình thức xử phạt, người điều khiển phương tiện thực hiện hành vi vi phạm quy định tại khoản 2 Điều này còn bị trừ điểm giấy phép lái xe 02 điểm.

...(Nội dung còn lại của context)


Tóm lại: Nội dung đoạn văn bản được cung cấp không chứa thông tin liên quan đến quy định về việc sử dụng ghế trẻ em trên ô tô.
","**Nguồn văn bản:** 36_2024_QH15_444251

**Tên văn bản:** Luật Trật tự, an toàn giao thông đường bộ

**Điều 7:** Tuyên truyền, phổ biến pháp luật về trật tự, an toàn giao thông đường bộ

**Nội dung:**

7. Thành viên trong gia đình có trách nhiệm tuyên truyền, nhắc nhở thành viên khác chấp hành pháp luật về trật tự, an toàn giao thông đường bộ, sử dụng dây đai an toàn, ghế dành cho trẻ em hoặc có người lớn ngồi cùng trẻ em phía sau khi chở trẻ em dưới 06 tuổi bằng xe gắn máy, xe mô tô.


**Điều 10:** Quy tắc chung

**Nội dung:**

3. Khi chở trẻ em dưới 10 tuổi và chiều cao dưới 1,35 mét trên xe ô tô không được cho trẻ em ngồi cùng hàng ghế với người lái xe, trừ loại xe ô tô chỉ có một hàng ghế; người lái xe phải sử dụng, hướng dẫn sử dụng thiết bị an toàn phù hợp cho trẻ em.

**Tóm lại:** Luật Giao thông Đường bộ quy định khi chở trẻ em dưới 10 tuổi và chiều cao dưới 1,35m trên ô tô, không được cho trẻ ngồi cùng hàng ghế với người lái (trừ xe chỉ có một hàng ghế) và phải sử dụng thiết bị an toàn phù hợp.  Khi chở trẻ em dưới 6 tuổi bằng xe máy, xe mô tô phải có ghế dành cho trẻ em hoặc có người lớn ngồi cùng phía sau. Gia đình có trách nhiệm tuyên truyền, nhắc nhở việc sử dụng các thiết bị an toàn này.
",0.0,0.42872965962860893,0.0,0.0
21,Quy định mới về việc sử dụng dây an toàn trên ô tô là gì?,"['4. Giới hạn theo phương thẳng đứng của đường dây thông tin, viễn thông đi phía trên đường bộ không nhỏ hơn 5,5 mét tính từ điểm thấp nhất của đường dây thông tin, viễn thông đi qua đường bộ tới điểm cao nhất trên mặt đường. Trường hợp đường dây đi phía trên cầu đường bộ phải đáp ứng đồng thời quy định tại khoản này và điểm a khoản 2 Điều này.\n\n5. Giới hạn theo phương thẳng đứng của đường dây tải điện, dây dẫn điện đi phía trên đường bộ được quy định như sau:\n\na) Trường hợp đường dây tải điện, dây dẫn điện đi phía trên đường bộ thì khoảng cách theo phương thẳng đứng tính từ điểm cao nhất của mặt đường bộ tới điểm thấp nhất của đường dây tải điện, dây dẫn điện đi phía trên đường bộ không nhỏ hơn chiều cao tĩnh không của đường bộ cộng với khoảng cách an toàn phóng điện theo quy định của pháp luật về điện lực;\n\nb) Trường hợp đường dây tải điện, dây dẫn điện đi phía trên cầu phải đáp ứng quy định tại điểm a khoản 2 Điều này cộng với khoảng cách an toàn phóng điện theo quy định của pháp luật về điện lực, nhưng không thấp hơn quy định tại điểm a khoản này;\n\nc) Đường dây tải điện, dây dẫn điện đi phía trên cột đèn chiếu sáng của đường bộ phải bảo đảm khoảng cách theo phương thẳng đứng tính từ điểm cao nhất của cột đèn chiếu sáng tới điểm thấp nhất của đường dây tải điện, dây dẫn điện không nhỏ hơn 02 mét cộng với khoảng cách an toàn phóng điện theo quy định của pháp luật về điện lực.\n\n6. Trường hợp đường dây thông tin, viễn thông, đường dây tải điện, dây dẫn điện đi phía trên cầu dây treo, ngoài việc thực hiện quy định tại các khoản 2, 4 và 5 Điều này còn phải bảo đảm an toàn cho hệ thống dây treo và trụ tháp của cầu.\n\n7. Giới hạn khoảng cách an toàn trên không đối với trạm thu phí và các hạng mục công trình đường bộ khác được tính từ điểm cao nhất của công trình trở lên theo phương thẳng đứng là 02 mét; đối với đường dây tải điện, dây dẫn điện còn phải bảo đảm khoảng cách an toàn phóng điện theo quy định của pháp luật về điện lực.\n\n8. Khi tiến hành xây dựng, khai thác, bảo trì công trình ngầm bên dưới công trình đường bộ phải bảo đảm quy chuẩn, tiêu chuẩn kỹ thuật và bảo đảm an toàn cho công trình đường bộ, công trình liền kề.\n\n9. Chính phủ quy định chi tiết khoản 5 Điều này.\n\nĐiều 18. Xây dựng, lắp đặt biển quảng cáo, biển thông tin cổ động, tuyên truyền chính trị trong phạm vi bảo vệ kết cấu hạ tầng đường bộ\n\n1. Biển quảng cáo gồm bảng quảng cáo, băng rôn, biển hiệu, hộp đèn, màn hình chuyên quảng cáo theo quy định của pháp luật về quảng cáo. Biển quảng cáo được xây dựng, lắp đặt tại các vị trí sau đây:\n\na) Trong phạm vi hành lang an toàn đường bộ, trừ hành lang an toàn đường cao tốc và hành lang an toàn đường bộ tại nút giao;\n\nb) Trường hợp nút giao có đường kính lớn hơn 02 lần chiều rộng hành lang an toàn đường bộ, thì được xây dựng, lắp đặt biển quảng cáo trong phạm vi đất giữa nút giao nhưng phải bảo đảm khoảng cách từ biển quảng cáo đến mép ngoài mặt đường theo các hướng không nhỏ hơn chiều rộng hành lang an toàn đường bộ.\n\n2. Việc xây dựng, lắp đặt biển quảng cáo phải đáp ứng các yêu cầu sau đây:\n\na) Không được che khuất báo hiệu đường bộ; không ảnh hưởng đến tầm nhìn của người điều khiển phương tiện tham gia giao thông đường bộ;\n\nb) Không ảnh hưởng đến việc quản lý, khai thác, sử dụng và bảo trì đường bộ, không ảnh hưởng đến an toàn công trình hạ tầng trong phạm vi bảo vệ kết cấu hạ tầng đường bộ, an toàn giao thông đường bộ;\n\nc) Biển quảng cáo phải được lắp đặt bảo đảm bền vững, an toàn, chịu được tác động của tải trọng và các tác động khác; phải được thiết kế, thẩm định và xây dựng theo quy định của Luật này, quy định của pháp luật về xây dựng, pháp luật về quảng cáo.\n\n3. Việc xây dựng, lắp đặt biển quảng cáo quy định tại khoản 1 Điều này phải được cơ quan quản lý đường bộ chấp thuận bằng văn bản về vị trí, quy mô, kích thước biển quảng cáo, phương án thi công để bảo đảm an toàn giao thông, an toàn cho công trình đường bộ và công trình liền kề khác.\n\n4. Tổ chức, cá nhân xây dựng, lắp đặt biển quảng cáo có trách nhiệm sau đây:\n\na) Xây dựng, lắp đặt biển quảng cáo đáp ứng quy định tại các khoản 1, 2 và 3 Điều này;\n\nb) Việc tháo dỡ biển quảng cáo, các bộ phận của biển quảng cáo không được làm ảnh hưởng đến kết cấu hạ tầng đường bộ và không được bồi thường khi có yêu cầu của cơ quan quản lý đường bộ, người quản lý, sử dụng đường bộ;\n\nc) Tuân thủ quy định khác của Luật này, pháp luật về xây dựng, pháp luật về quảng cáo;\n\n5. Việc xây dựng, lắp đặt biển thông tin cổ động, tuyên truyền chính trị phải đáp ứng yêu cầu quy định tại khoản 2, khoản 3, điểm b và điểm c khoản 4 Điều này.\n\n6. Chính phủ quy định chi tiết khoản 3 Điều này.\n\nĐiều 19. Xây dựng, lắp đặt công trình hạ tầng trong phạm vi bảo vệ kết cấu hạ tầng đường bộ\n\n1. Trong phạm vi bảo vệ kết cấu hạ tầng đường bộ, không được xây dựng công trình khác, trừ trường hợp sau đây:\n\na) Công trình phục vụ quốc phòng, an ninh;\n\nb) Công trình thông tin, viễn thông, đường dây tải điện, dây dẫn điện, cột viễn thông, trạm thu phát sóng di động, cột điện;\n\nc) Công trình cấp năng lượng, cấp nước, thoát nước, trừ nhà máy nước, nhà máy sản xuất năng lượng;\n\nd) Công trình thủy lợi, đê điều, phòng, chống thiên tai, thủy điện;\n\nđ) Băng tải phục vụ sản xuất, công trình hạ tầng kỹ thuật đô thị, các công trình đặc biệt khác;\n\ne) Tuyến đường khác giao cắt hoặc đi song song với đường hiện hữu.\n\n2. Công trình quy định tại khoản 1 Điều này khi xây dựng, lắp đặt trong phạm vi bảo vệ kết cấu hạ tầng đường bộ phải bảo đảm quy chuẩn, tiêu chuẩn kỹ thuật, an toàn trong xây dựng, an toàn giao thông đường bộ, quy định của pháp luật về bảo vệ môi trường và không ảnh hưởng đến khai thác, sử dụng kết cấu hạ tầng đường bộ.\n\n3. Việc xây dựng, lắp đặt công trình quy định tại khoản 1 Điều này trong phạm vi bảo vệ kết cấu hạ tầng đường bộ phải được cơ quan quản lý đường bộ có thẩm quyền chấp thuận bằng văn bản, trừ công trình đê điều và trường hợp quy định tại khoản 4 Điều này.\n\n4. Đường dây tải điện, dây dẫn điện, đường dây thông tin, viễn thông xây dựng bên trên đường bộ không cần có văn bản chấp thuận của cơ quan quản lý đường bộ có thẩm quyền khi đáp ứng các quy định sau đây:\n\na) Cột công trình hạ tầng nằm ngoài hành lang an toàn đường bộ;\n\nb) Chiều cao đường dây đi bên trên đường bộ đáp ứng quy định tại Điều 17 của Luật này;\n\nc) Đường dây không ảnh hưởng đến an toàn trong vận hành, khai thác công trình đường bộ.\n\n5. Công trình hạ tầng xây dựng, lắp đặt trong phạm vi bảo vệ đường chuyên dùng phải được sự đồng ý của người quản lý, sử dụng đường bộ đối với đường chuyên dùng.\n\n6. Chủ sở hữu hoặc người quản lý, sử dụng công trình quy định tại khoản 1 Điều này, trừ công trình đê điều, công trình quốc phòng, an ninh phải hoàn trả công trình đường bộ bị ảnh hưởng, bố trí kinh phí và tổ chức di dời công trình trong các trường hợp sau đây:\n\na) Khi cơ quan quản lý đường bộ có thẩm quyền, người quản lý, sử dụng đường bộ có yêu cầu di dời công trình để đầu tư, xây dựng mới, nâng cấp, mở rộng, cải tạo, sửa chữa, bảo trì công trình đường bộ;\n\nb) Công trình ảnh hưởng đến an toàn giao thông đường bộ, an toàn công trình đường bộ mà không có biện pháp khắc phục;\n\nc) Công trình xây dựng trái phép.\n\n7. Chính phủ quy định chi tiết Điều này.\n\nĐiều 20. Xây dựng, quản lý, vận hành, khai thác, bảo trì công trình hạ tầng kỹ thuật sử dụng chung với đường bộ\n\n1. Công trình hạ tầng kỹ thuật sử dụng chung với đường bộ là công trình được xây dựng để bố trí, lắp đặt đường dây thông tin, viễn thông, đường dây tải điện, dây dẫn điện, chiếu sáng công cộng; đường ống cấp nước, thoát nước, cấp năng lượng.\n\n2. Việc xây dựng công trình hạ tầng kỹ thuật sử dụng chung với đường bộ phải đáp ứng các yêu cầu sau đây:\n\na) Phù hợp với quy hoạch, quy mô của dự án, cấp kỹ thuật của đường bộ;\n\nb) Bảo đảm quy chuẩn, tiêu chuẩn kỹ thuật trong xây dựng; bảo đảm quy định của pháp luật về phòng cháy, chữa cháy và cứu nạn, cứu hộ; bảo đảm an toàn công trình, bảo đảm cảnh quan và môi trường;']","**Nguồn văn bản:** /content/drive/MyDrive/ITProject_data/new_law/35_2024_QH15_588811.docx

**Tên văn bản:** (Không có tiêu đề trong metadata)

**(Không có điều khoản trong metadata):**

**Nội dung:**
4. Giới hạn theo phương thẳng đứng của đường dây thông tin, viễn thông đi phía trên đường bộ không nhỏ hơn 5,5 mét tính từ điểm thấp nhất của đường dây thông tin, viễn thông đi qua đường bộ tới điểm cao nhất trên mặt đường. Trường hợp đường dây đi phía trên cầu đường bộ phải đáp ứng đồng thời quy định tại khoản này và điểm a khoản 2 Điều này.

5. Giới hạn theo phương thẳng đứng của đường dây tải điện, dây dẫn điện đi phía trên đường bộ được quy định như sau:

	a) Trường hợp đường dây tải điện, dây dẫn điện đi phía trên đường bộ thì khoảng cách theo phương thẳng đứng tính từ điểm cao nhất của mặt đường bộ tới điểm thấp nhất của đường dây tải điện, dây dẫn điện đi phía trên đường bộ không nhỏ hơn chiều cao tĩnh không của đường bộ cộng với khoảng cách an toàn phóng điện theo quy định của pháp luật về điện lực;

	b) Trường hợp đường dây tải điện, dây dẫn điện đi phía trên cầu phải đáp ứng quy định tại điểm a khoản 2 Điều này cộng với khoảng cách an toàn phóng điện theo quy định của pháp luật về điện lực, nhưng không thấp hơn quy định tại điểm a khoản này;

	c) Đường dây tải điện, dây dẫn điện đi phía trên cột đèn chiếu sáng của đường bộ phải bảo đảm khoảng cách theo phương thẳng đứng tính từ điểm cao nhất của cột đèn chiếu sáng tới điểm thấp nhất của đường dây tải điện, dây dẫn điện không nhỏ hơn 02 mét cộng với khoảng cách an toàn phóng điện theo quy định của pháp luật về điện lực.

6. Trường hợp đường dây thông tin, viễn thông, đường dây tải điện, dây dẫn điện đi phía trên cầu dây treo, ngoài việc thực hiện quy định tại các khoản 2, 4 và 5 Điều này còn phải bảo đảm an toàn cho hệ thống dây treo và trụ tháp của cầu.

7. Giới hạn khoảng cách an toàn trên không đối với trạm thu phí và các hạng mục công trình đường bộ khác được tính từ điểm cao nhất của công trình trở lên theo phương thẳng đứng là 02 mét; đối với đường dây tải điện, dây dẫn điện còn phải bảo đảm khoảng cách an toàn phóng điện theo quy định của pháp luật về điện lực.

8. Khi tiến hành xây dựng, khai thác, bảo trì công trình ngầm bên dưới công trình đường bộ phải bảo đảm quy chuẩn, tiêu chuẩn kỹ thuật và bảo đảm an toàn cho công trình đường bộ, công trình liền kề.

9. Chính phủ quy định chi tiết khoản 5 Điều này.


**Tóm lại:** Không tìm thấy thông tin liên quan tới việc sử dụng dây an toàn trên ô tô.
","**Nguồn văn bản:** 36_2024_QH15_444251

**Tên văn bản:** Luật Trật tự, an toàn giao thông đường bộ

**Điều 10:** Quy tắc chung

**Nội dung:**

2. Người lái xe và người được chở trên xe ô tô phải thắt dây đai an toàn tại những chỗ có trang bị dây đai an toàn khi tham gia giao thông đường bộ.

3. Khi chở trẻ em dưới 10 tuổi và chiều cao dưới 1,35 mét trên xe ô tô không được cho trẻ em ngồi cùng hàng ghế với người lái xe, trừ loại xe ô tô chỉ có một hàng ghế; người lái xe phải sử dụng, hướng dẫn sử dụng thiết bị an toàn phù hợp cho trẻ em.


**Nguồn văn bản:** 158_2024_ND-CP_636875

**Tên văn bản:** Nghị định Quy định về hoạt động vận tải đường bộ

**Điều 24:** quy định đối với vận tải người nội bộ bằng xe ô tô

**Nội dung:**

1. Xe ô tô vận tải người nội bộ

	a) Sử dụng xe ô tô phải đáp ứng các điều kiện tham gia giao thông theo quy định tại khoản 1 Điều 35, khoản 1, khoản 2 và khoản 3 Điều 40 của Luật trật tự, an toàn giao thông đường bộ; phải có dây an toàn tại các vị trí ghế ngồi, có hướng dẫn về an toàn giao thông và thoát hiểm khi xảy ra sự cố trên xe.

	b) Xe ô tô phải được niêm yết (dán cố định) cụm từ “xe nội bộ” làm bằng vật liệu phản quang trên kính phía trước và kính phía sau xe, kích thước tối thiểu của cụm từ “xe nội bộ” là 10 x 35 cm theo mẫu số 12 Phụ lục XIII kèm theo Nghị định này. Trường hợp niêm yết bằng thiết bị điện tử phải bảo đảm cụm từ “xe nội bộ” luôn được bật sáng và có kích thước tối thiểu là 10 x 35 cm.

	c) Phải thuộc quyền sở hữu hoặc quyền sử dụng hợp pháp theo hợp đồng thuê phương tiện bằng văn bản của đơn vị vận tải nội bộ với tổ chức, cá nhân theo quy định của pháp luật. Trường hợp xe đăng ký thuộc sở hữu của thành viên hợp tác xã phải có hợp đồng dịch vụ giữa thành viên với hợp tác xã, trong đó quy định hợp tác xã có quyền, trách nhiệm và nghĩa vụ quản lý, sử dụng, điều hành xe ô tô thuộc sở hữu của thành viên hợp tác xã.


3. Người lái xe ô tô hoạt động vận tải nội bộ

	a) Có trách nhiệm kiểm tra các điều kiện bảo đảm an toàn của xe, hướng dẫn cho người ngồi trên xe về an toàn giao thông và thoát hiểm khi gặp sự cố, yêu cầu người ngồi trên xe thắt dây an toàn trước khi cho xe khởi hành; kiểm tra việc sắp xếp, chằng buộc hành lý bảo đảm an toàn.

	b) Thực hiện quy định về thời gian lái xe liên tục, thời gian làm việc trong ngày, thời gian nghỉ theo khoản 1 Điều 64 Luật trật tự, an toàn giao thông đường bộ.

	c) Không được chở người trên mui, trong khoang chở hành lý hoặc để người đu, bám bên ngoài xe; không được chở hàng nguy hiểm, hàng cấm lưu hành, hàng lậu, động thực vật hoang dã; không được chở người, hành lý, hàng hóa vượt quá trọng tải, quá số người theo quy định.

	d) Từ chối điều khiển phương tiện khi phát hiện phương tiện không bảo đảm các điều kiện về an toàn, không có hoặc không có đủ dây an toàn trên xe.


**Tóm lại:** Người lái xe và người ngồi trên ô tô có trang bị dây an toàn phải thắt dây an toàn khi tham gia giao thông. Xe ô tô vận tải người nội bộ phải có dây an toàn tại các vị trí ghế ngồi. Người lái xe phải yêu cầu người ngồi trên xe thắt dây an toàn và từ chối vận hành xe nếu xe không có đủ dây an toàn.
",1.0,0.5637013827583247,0.0,0.0
22,Luật Giao thông Đường bộ 2025 có quy định gì về việc sử dụng mũ bảo hiểm cho người đi xe đạp điện?,"['5. Khi có tín hiệu của xe ưu tiên, người và phương tiện tham gia giao thông đường bộ phải giảm tốc độ, đi sát lề đường bên phải hoặc dừng lại để nhường đường, trạm thu phí phải ưu tiên cho xe ưu tiên qua trạm trong mọi tình huống, không được gây cản trở.\n\n6. Chính phủ quy định về quản lý, lắp đặt, sử dụng thiết bị phát tín hiệu của xe ưu tiên và trình tự, thủ tục cấp mới, cấp lại và thu hồi giấy phép sử dụng thiết bị phát tín hiệu của xe ưu tiên.\n\n7. Bộ trưởng Bộ Công an quy định các đoàn trong nước và khách nước ngoài đến Việt Nam có bố trí xe Cảnh sát giao thông dẫn đường; quy định quy trình dẫn đường của Cảnh sát giao thông đối với các đoàn trong nước và khách nước ngoài đến Việt Nam.\n\nĐiều 28. Trường hợp chở người trên xe ô tô chở hàng\n\n1. Chỉ được chở người trên thùng xe ô tô chở hàng trong trường hợp sau đây:\n\na) Chở người đi làm nhiệm vụ cứu nạn, cứu hộ, phòng, chống thiên tai, dịch bệnh hoặc thực hiện nhiệm vụ khẩn cấp; chở người bị nạn đi cấp cứu; đưa người ra khỏi khu vực nguy hiểm hoặc trong trường hợp khẩn cấp khác theo quy định của pháp luật;\n\nb) Chở người thuộc lực lượng vũ trang nhân dân đi làm nhiệm vụ khẩn cấp; \n\nc) Chở người đi thực hành lái xe trên xe tập lái; chở người dự sát hạch lái xe trên xe sát hạch; chở công nhân đang làm nhiệm vụ duy tu, bảo dưỡng đường bộ;\n\nd) Chở người diễu hành theo đoàn khi được cơ quan có thẩm quyền cho phép.\n\n2. Xe ô tô chở hàng mà chở người trong các trường hợp quy định tại khoản 1 Điều này phải bảo đảm an toàn khi tham gia giao thông đường bộ.\n\nĐiều 29. Xe kéo xe, xe kéo rơ moóc và xe ô tô đầu kéo kéo sơ mi rơ moóc\n\n1. Một xe ô tô chỉ được kéo theo một xe ô tô hoặc xe máy chuyên dùng khác khi xe được kéo không tự chạy được, trừ trường hợp quy định tại khoản 3 Điều 53 của Luật này và phải bảo đảm các quy định sau đây:\n\na) Xe được kéo phải có người điều khiển và hệ thống lái của xe đó phải còn hiệu lực;\n\nb) Việc nối xe kéo với xe được kéo phải bảo đảm chắc chắn, an toàn; trường hợp hệ thống hãm của xe được kéo không còn hiệu lực thì xe kéo nhau phải nối bằng thanh nối cứng;\n\nc) Phía trước của xe kéo và phía sau của xe được kéo phải có biển báo hiệu, có đèn cảnh báo nhấp nháy màu vàng.\n\n2. Xe kéo rơ moóc, xe ô tô đầu kéo chỉ được kéo rơ moóc, sơ mi rơ moóc phù hợp với thiết kế của xe; việc kết nối xe kéo với rơ moóc, xe ô tô đầu kéo với sơ mi rơ moóc phải bảo đảm chắc chắn, an toàn.\n\n3. Không được chở người trên xe được kéo, trừ người điều khiển; xe kéo rơ moóc, xe ô tô đầu kéo kéo sơ mi rơ moóc không được kéo thêm rơ moóc, sơ mi rơ moóc hoặc xe khác.\n\nĐiều 30. Người đi bộ; trẻ em, phụ nữ mang thai, người già yếu, người khuyết tật, người mất năng lực hành vi dân sự tham gia giao thông đường bộ\n\n1. Người đi bộ phải tuân thủ các quy định sau đây:\n\na) Phải đi trên vỉa hè, lề đường, đường dành riêng cho người đi bộ; trường hợp đường không có vỉa hè, lề đường, đường dành riêng cho người đi bộ thì người đi bộ phải đi sát mép đường bên phải theo chiều đi của mình;\n\nb) Chỉ được qua đường ở những nơi có đèn tín hiệu, có vạch kẻ đường hoặc có cầu vượt, hầm dành cho người đi bộ và phải tuân thủ tín hiệu chỉ dẫn, báo hiệu đường bộ. Trường hợp không có đèn tín hiệu, vạch kẻ đường, cầu vượt, hầm dành cho người đi bộ thì phải quan sát các xe đang đi tới, chỉ qua đường khi bảo đảm an toàn, khi qua đường phải có tín hiệu bằng tay;\n\nc) Không được vượt qua dải phân cách, đu, bám vào phương tiện giao thông đường bộ đang di chuyển; khi mang, vác vật cồng kềnh phải bảo đảm an toàn và không gây trở ngại cho người và phương tiện tham gia giao thông đường bộ.\n\n2. Trẻ em, phụ nữ mang thai, người già yếu, người khuyết tật, người mất năng lực hành vi dân sự tham gia giao thông đường bộ được quy định như sau:\n\na) Trẻ em dưới 07 tuổi khi đi qua đường phải có người lớn dẫn dắt; \n\nb) Người khuyết tật sử dụng xe lăn có động cơ hoặc không có động cơ phải đi trên vỉa hè, lề đường và nơi có vạch kẻ đường dành cho người đi bộ và xe thô sơ;\n\nc) Người khiếm thị khi đi trên đường bộ phải có người dẫn dắt hoặc có công cụ để báo hiệu cho người khác nhận biết là người khiếm thị;\n\nd) Người mất năng lực hành vi dân sự khi đi trên đường bộ phải có người dẫn dắt;\n\nđ) Mọi người có trách nhiệm giúp đỡ trẻ em dưới 07 tuổi, phụ nữ mang thai, người già yếu, người khuyết tật, người mất năng lực hành vi dân sự khi đi qua đường.\n\nĐiều 31. Người điều khiển, người được chở, hàng hóa xếp trên xe thô sơ\n\n1. Người điều khiển xe đạp, xe đạp máy chỉ được chở một người, trừ trường hợp chở thêm một trẻ em dưới 07 tuổi thì được chở tối đa hai người.\n\n2. Người điều khiển xe đạp, xe đạp máy không được thực hiện các hành vi quy định tại khoản 3 Điều 33 của Luật này; người được chở trên xe đạp, xe đạp máy khi tham gia giao thông đường bộ không được thực hiện các hành vi quy định tại khoản 4 Điều 33 của Luật này. \n\n3. Người điều khiển, người được chở trên xe đạp máy phải đội mũ bảo hiểm theo đúng quy chuẩn kỹ thuật quốc gia và cài quai đúng quy cách. \n\n4. Người điều khiển xe thô sơ chỉ được cho xe đi hàng một, nơi có phần đường dành cho xe thô sơ thì phải đi đúng phần đường quy định; khi tham gia giao thông đường bộ trong thời gian từ 18 giờ ngày hôm trước đến 06 giờ ngày hôm sau phải sử dụng đèn hoặc có báo hiệu ở phía trước và phía sau xe. \n\n5. Hàng hóa xếp trên xe thô sơ phải bảo đảm an toàn, không gây cản trở giao thông và che khuất tầm nhìn của người điều khiển. Hàng hóa xếp trên xe không vượt quá 1/3 chiều dài thân xe và không vượt quá 01 mét phía trước và phía sau xe; không vượt quá 0,4 mét mỗi bên bánh xe.\n\nĐiều 32. Người điều khiển, dẫn dắt vật nuôi, điều khiển xe vật nuôi kéo đi trên đường bộ\n\n1. Người điều khiển, dẫn dắt vật nuôi, điều khiển xe vật nuôi kéo đi trên đường bộ phải cho vật nuôi đi sát mép đường bên phải; trường hợp cần cho vật nuôi đi ngang qua đường thì phải quan sát và chỉ được đi qua đường khi có đủ điều kiện an toàn; không được gây cản trở cho người và phương tiện tham gia giao thông đường bộ khác.\n\n2. Không được điều khiển, dẫn dắt vật nuôi, điều khiển xe vật nuôi kéo đi vào làn đường dành cho xe cơ giới. \n\n3. Không được thả vật nuôi trên đường bộ.\n\nĐiều 33. Người lái xe, người được chở, hàng hóa xếp trên xe mô tô, xe gắn máy\n\n1. Người lái xe mô tô hai bánh, xe gắn máy chỉ được chở một người, trừ những trường hợp sau thì được chở tối đa hai người:\n\na) Chở người bệnh đi cấp cứu;\n\nb) Áp giải người có hành vi vi phạm pháp luật;\n\nc) Trẻ em dưới 12 tuổi;\n\nd) Người già yếu hoặc người khuyết tật.\n\n2. Người lái xe, người được chở trên xe mô tô hai bánh, xe mô tô ba bánh, xe gắn máy phải đội mũ bảo hiểm theo đúng quy chuẩn kỹ thuật quốc gia và cài quai đúng quy cách.\n\n3. Người lái xe mô tô hai bánh, xe mô tô ba bánh, xe gắn máy không được thực hiện các hành vi sau đây:\n\na) Đi xe dàn hàng ngang;\n\nb) Đi xe vào phần đường dành cho người đi bộ và phương tiện khác;\n\nc) Sử dụng ô, thiết bị âm thanh, trừ thiết bị trợ thính;\n\nd) Buông cả hai tay; đi xe bằng một bánh đối với xe mô tô, xe gắn máy hai bánh; đi xe bằng hai bánh đối với xe mô tô, xe gắn máy ba bánh;\n\nđ) Sử dụng xe để kéo, đẩy xe khác, vật khác, dẫn dắt vật nuôi, mang, vác và chở vật cồng kềnh; chở người đứng trên xe, giá đèo hàng hoặc ngồi trên tay lái; xếp hàng hóa trên xe quá giới hạn quy định;\n\ne) Ngồi về một bên điều khiển xe; đứng, nằm trên xe điều khiển xe; thay người lái xe khi xe đang chạy; quay người về phía sau để điều khiển xe hoặc bịt mắt điều khiển xe; sử dụng chân chống hoặc vật khác quệt xuống đường khi xe đang chạy;\n\ng) Hành vi khác gây mất trật tự, an toàn giao thông đường bộ.\n\n4. Người được chở trên xe mô tô hai bánh, xe mô tô ba bánh, xe gắn máy\xa0 khi tham gia giao thông đường bộ không được thực hiện các hành vi sau đây:\n\na) Mang, vác vật cồng kềnh;\n\nb) Sử dụng ô;\n\nc) Bám, kéo hoặc đẩy các phương tiện khác;\n\nd) Đứng trên yên, giá đèo hàng hoặc ngồi trên tay lái;\n\nđ) Hành vi khác gây mất trật tự, an toàn giao thông đường bộ.']","**Nguồn văn bản:** /content/drive/MyDrive/ITProject_data/new_law/36_2024_QH15_444251.docx

**Tên văn bản:** (Không có tiêu đề trong metadata)


**Nội dung:**

3. Người điều khiển, người được chở trên xe đạp máy phải đội mũ bảo hiểm theo đúng quy chuẩn kỹ thuật quốc gia và cài quai đúng quy cách.

Tóm lại: Người điều khiển và người được chở trên xe đạp máy phải đội mũ bảo hiểm đạt chuẩn và cài quai đúng cách.
","**Nguồn văn bản:** 36_2024_QH15_444251

**Tên văn bản:** Luật Trật tự, an toàn giao thông đường bộ

**Điều 31:** Người điều khiển, người được chở, hàng hóa xếp trên xe thô sơ

**Nội dung:**

1. Người điều khiển xe đạp, xe đạp máy chỉ được chở một người, trừ trường hợp chở thêm một trẻ em dưới 07 tuổi thì được chở tối đa hai người.

2. Người điều khiển xe đạp, xe đạp máy không được thực hiện các hành vi quy định tại khoản 3 điều 33 của luật này; người được chở trên xe đạp, xe đạp máy khi tham gia giao thông đường bộ không được thực hiện các hành vi quy định tại khoản 4 điều 33 của luật này.

3. Người điều khiển, người được chở trên xe đạp máy phải đội mũ bảo hiểm theo đúng quy chuẩn kỹ thuật quốc gia và cài quai đúng quy cách.

4. Người điều khiển xe thô sơ chỉ được cho xe đi hàng một, nơi có phần đường dành cho xe thô sơ thì phải đi đúng phần đường quy định; khi tham gia giao thông đường bộ trong thời gian từ 18 giờ ngày hôm trước đến 06 giờ ngày hôm sau phải sử dụng đèn hoặc có báo hiệu ở phía trước và phía sau xe.

5. Hàng hóa xếp trên xe thô sơ phải bảo đảm an toàn, không gây cản trở giao thông và che khuất tầm nhìn của người điều khiển. Hàng hóa xếp trên xe không vượt quá 1/3 chiều dài thân xe và không vượt quá 01 mét phía trước và phía sau xe; không vượt quá 0,4 mét mỗi bên bánh xe.


**Nguồn văn bản:** 168_2024_ND-CP_619502

**Tên văn bản:** Nghị định Quy định xử phạt vi phạm hành chính về trật tự, an toàn giao thông trong lĩnh vực giao thông đường bộ; trừ điểm, phục hồi điểm giấy phép lái xe

**Điều 9:** Xử phạt người điều khiển xe đạp, xe đạp máy, người điều khiển xe thô sơ khác vi phạm quy tắc giao thông đường bộ

**Nội dung:**

4. Phạt tiền từ 400.000 đồng đến 600.000 đồng đối với người điều khiển xe thực hiện một trong các hành vi vi phạm sau đây:

    d) Người điều khiển xe đạp máy không đội “mũ bảo hiểm cho người đi mô tô, xe máy” hoặc đội “mũ bảo hiểm cho người đi mô tô, xe máy” không cài quai đúng quy cách khi tham gia giao thông trên đường bộ.

    đ) Chở người ngồi trên xe đạp máy không đội “mũ bảo hiểm cho người đi mô tô, xe máy” hoặc đội “mũ bảo hiểm cho người đi mô tô, xe máy” không cài quai đúng quy cách, trừ trường hợp chở người bệnh đi cấp cứu, trẻ em dưới 06 tuổi, áp giải người có hành vi vi phạm pháp luật.


**Tóm lại:** Người điều khiển và người được chở trên xe đạp máy phải đội mũ bảo hiểm đạt quy chuẩn và cài quai đúng quy cách. Người điều khiển xe đạp máy không đội mũ bảo hiểm hoặc đội mũ bảo hiểm không cài quai đúng quy cách sẽ bị phạt tiền từ 400.000 đồng đến 600.000 đồng.  Xe đạp điện được xếp vào loại xe đạp máy.
",0.75,0.6566928353389802,0.4,0.0
23,Quy định mới về việc sử dụng xe máy điện là gì?,"['BỘ QUỐC PHÒNG\n------- CỘNG HÒA XÃ HỘI CHỦ NGHĨA VIỆT NAM\nĐộc lập - Tự do - Hạnh phúc \n--------------- Số: 66/2024/TT-BQP Hà Nội, ngày 14 tháng 10 năm 2024\n\nTHÔNG TƯ\n\nQUY ĐỊNH VỀ KIỂM ĐỊNH AN TOÀN KỸ THUẬT VÀ BẢO VỆ MÔI TRƯỜNG XE CƠ GIỚI, XE MÁY CHUYÊN DÙNG THUỘC PHẠM VI QUẢN LÝ CỦA BỘ QUỐC PHÒNG\n\nCăn cứ Luật Trật tự, an toàn giao thông đường bộ ngày 27 tháng 6 năm 2024;\n\nCăn cứ Nghị định số 01/2022/NĐ-CP ngày 30 tháng 11 năm 2022 của Chính phủ quy định chức năng, nhiệm vụ, quyền hạn và cơ cấu tổ chức của Bộ Quốc phòng;\n\nTheo đề nghị của Chủ nhiệm Tổng cục Kỹ thuật;\n\nBộ trưởng Bộ Quốc phòng ban hành Thông tư quy định về kiểm định an toàn kỹ thuật và bảo vệ môi trường xe cơ giới, xe máy chuyên dùng thuộc phạm vi quản lý của Bộ Quốc phòng.\n\nChương I\n\nQUY ĐỊNH CHUNG\n\nĐiều 1. Phạm vi điều chỉnh\n\nThông tư này quy định về kiểm định an toàn kỹ thuật và bảo vệ môi trường xe cơ giới, xe máy chuyên dùng của các cơ quan, đơn vị, doanh nghiệp thuộc phạm vi quản lý của Bộ Quốc phòng sử dụng vào mục đích quốc phòng, an ninh.\n\nĐiều 2. Đối tượng áp dụng\n\nThông tư này áp dụng đối với các trung tâm, trạm kiểm định an toàn kỹ thuật xe - máy quân sự; các cơ quan, đơn vị, doanh nghiệp thuộc phạm vi quản lý của Bộ Quốc phòng, các tổ chức và cá nhân liên quan đến việc kiểm định an toàn kỹ thuật và bảo vệ môi trường xe cơ giới, xe máy chuyên dùng.\n\nĐiều 3. Giải thích từ ngữ\n\nTrong Thông tư này, các từ ngữ dưới đây được hiểu như sau:\n\n1. Doanh nghiệp thuộc phạm vi quản lý của Bộ Quốc phòng (sau đây viết gọn là doanh nghiệp) là doanh nghiệp trực tiếp phục vụ quốc phòng, an ninh hoặc doanh nghiệp kết hợp kinh tế với quốc phòng, an ninh theo quy định tại Nghị định số 16/2023/NĐ-CP ngày 25 tháng 4 năm 2023 của Chính phủ về tổ chức quản lý và hoạt động của doanh nghiệp trực tiếp phục vụ quốc phòng, an ninh và doanh nghiệp kết hợp kinh tế với quốc phòng, an ninh; sửa đổi quy định tại điểm g khoản 1 Điều 23 Nghị định số 47/2021/NĐ-CP ngày 01 tháng 4 năm 2021 của Chính phủ quy định chi tiết một số điều của Luật Doanh nghiệp.\n\n2. Xe cơ giới là xe được trang bị cho các cơ quan, đơn vị, doanh nghiệp do Bộ Quốc phòng trực tiếp đăng ký, quản lý, sử dụng vào mục đích quốc phòng, an ninh.\n\n3. Xe cơ giới của doanh nghiệp là xe cơ giới sử dụng vào mục đích quốc phòng, an ninh không thuộc trường hợp xe cơ giới quy định tại khoản 2 Điều này.\n\n4. Xe máy chuyên dùng gồm xe máy chuyên dùng quân sự, xe máy thi công; xe máy nông nghiệp, lâm nghiệp và các loại xe chuyên dùng khác có tham gia giao thông được trang bị cho các cơ quan, đơn vị trực thuộc Bộ Quốc phòng theo quy định tại Phụ lục VI kèm theo Thông tư này.\n\n5. Cơ sở kiểm định là các trung tâm, trạm kiểm định an toàn kỹ thuật xe - máy quân sự do Tổng Tham mưu trưởng quyết định thành lập.\n\n6. Kiểm định an toàn kỹ thuật và bảo vệ môi trường xe cơ giới, xe máy chuyên dùng (sau đây viết gọn là kiểm định) là việc kiểm tra, đánh giá lần đầu và định kỳ tình trạng an toàn kỹ thuật và bảo vệ môi trường của xe cơ giới, xe máy chuyên dùng theo các tiêu chuẩn, quy chuẩn, quy định của nhà nước và Bộ Quốc phòng.\n\n7. Chu kỳ kiểm định là khoảng thời gian giữa hai lần kiểm định được tính bằng tháng.\n\n8. Phiếu kiểm định là bản xác nhận kết quả kiểm định an toàn kỹ thuật và bảo vệ môi trường của từng xe cơ giới, xe máy chuyên dùng khi kiểm định.\n\n9. Giấy chứng nhận an toàn kỹ thuật và bảo vệ môi trường xe cơ giới, xe máy chuyên dùng (sau đây gọi là Giấy chứng nhận kiểm định) là bản xác nhận cho xe cơ giới, xe máy chuyên dùng đã được kiểm định đạt các tiêu chuẩn, quy chuẩn, quy định của nhà nước và Bộ Quốc phòng về an toàn kỹ thuật và bảo vệ môi trường, đủ điều kiện tham gia giao thông đường bộ.\n\n\n\n10. Tem kiểm định an toàn kỹ thuật và bảo vệ môi trường xe cơ giới, xe máy chuyên dùng (sau đây viết gọn là Tem kiểm định) là biểu trưng do các cơ sở kiểm định cấp, dán lên xe cơ giới, xe máy chuyên dùng sau khi đã được cấp Giấy chứng nhận kiểm định và được phép tham gia giao thông đường bộ theo thời hạn ghi trên Tem kiểm định.\n\n11. Chỉ huy cơ sở kiểm định là giám đốc, phó giám đốc trung tâm kiểm định; trạm trưởng trạm kiểm định thuộc Bộ Quốc phòng.\n\n12. Kiểm định viên là người có đủ trình độ, kỹ năng, kinh nghiệm được tập huấn (đào tạo); cấp Giấy chứng nhận, thẻ kiểm định viên theo quy định của nhà nước, Bộ Quốc phòng để thực hiện một phần hoặc toàn bộ việc kiểm định xe cơ giới, xe máy chuyên dùng.\n\n13. Chương trình quản lý kiểm định là hệ thống phần mềm do Cục Xe máy - Vận tải/Tổng cục Hậu cần - Kỹ thuật xây dựng để quản lý cơ sở dữ liệu kiểm định và công tác kiểm định xe cơ giới, xe máy chuyên dùng; được sử dụng tại các cơ sở kiểm định và Cục Xe máy - Vận tải/Tổng cục Hậu cần - Kỹ thuật.\n\nĐiều 4. Những hành vi nghiêm cấm\n\n1. Kiểm định không đủ nội dung, không đúng quy trình, quy định; làm sai lệch kết quả kiểm định.\n\n2. Sử dụng thiết bị kiểm tra bị hư hỏng; phương tiện đo, thiết bị kiểm tra chưa được kiểm định, hiệu chuẩn hoặc quá thời hạn sử dụng.\n\n3. Bố trí không đúng, không đủ kiểm định viên trên dây chuyền kiểm định.\n\n4. Tự ý in phôi Giấy chứng nhận kiểm định, Tem kiểm định để sử dụng.\n\n5. Sửa đổi các nội dung in, ghi trên Giấy chứng nhận kiểm định, Tem kiểm định; tự ý bóc, dán Tem kiểm định.\n\n6. Có hành vi tiêu cực, sách nhiễu trong quá trình kiểm định.\n\n7. Kiểm định, cấp Giấy chứng nhận kiểm định, dán Tem kiểm định cho xe cơ giới, xe máy chuyên dùng của doanh nghiệp: Hết niên hạn sử dụng, không nộp phí sử dụng đường bộ theo quy định của pháp luật.\n\nChương II\n\nQUY ĐỊNH VỀ KIỂM ĐỊNH\n\nĐiều 5. Đối tượng, thẩm quyền kiểm định\n\n1. Xe cơ giới, xe máy chuyên dùng phải được kiểm định bằng các trang thiết bị, dụng cụ kiểm định tại cơ sở kiểm định hoặc cơ động (trừ các trường hợp được miễn kiểm định lần đầu theo quy định tại Điều 11 Thông tư này).\n\n2. Việc cơ động kiểm định chỉ áp dụng đối với các cơ quan, đơn vị, doanh nghiệp ở vùng sâu, vùng xa, biên giới, hải đảo không có điều kiện đưa xe cơ giới, xe máy chuyên dùng đến cơ sở kiểm định (khoảng cách từ cơ quan, đơn vị, doanh nghiệp đến cơ sở kiểm định phải có bán kính lớn hơn 50 km); nhóm xe tác chiến; xe cứu thương, cứu hoả, xe làm nhiệm vụ cứu hộ, cứu nạn; xe quá khổ, quá tải không vào được dây chuyền kiểm định.\n\n3. Chỉ huy cơ sở kiểm định kết luận, ký tên, đóng dấu trên Phiếu kiểm định, Giấy chứng nhận kiểm định, Tem kiểm định và chịu trách nhiệm trước pháp luật về kết quả kiểm định.\n\nĐiều 6. Hồ sơ kiểm định lần đầu\n\n1. Xe cơ giới, xe máy chuyên dùng.\n\na) Công văn hoặc giấy giới thiệu đề nghị kiểm định do chỉ huy cơ quan, đơn vị cấp trung đoàn hoặc tương đương trở lên ký tên, đóng dấu theo quy định;\n\nb) Chứng nhận đăng ký xe, lý lịch xe (áp dụng đối với xe cơ giới, xe máy chuyên dùng đã đăng ký);\n\nc) Biển số tạm thời (áp dụng đối với xe cơ giới, xe máy chuyên dùng chưa hoàn thành thủ tục đăng ký);\n\nd) Bản sao Giấy chứng nhận chất lượng an toàn kỹ thuật xe cơ giới, xe máy chuyên dùng cải tạo (áp dụng đối với xe cơ giới, xe máy chuyên dùng cải tạo).\n\n2. Xe cơ giới, xe máy chuyên dùng của doanh nghiệp.\n\na) Công văn hoặc giấy giới thiệu đề nghị kiểm định do giám đốc hoặc phó giám đốc doanh nghiệp ký tên, đóng dấu theo quy định;\n\nb) Chứng nhận đăng ký xe;\n\nc) Bản sao Giấy chứng nhận chất lượng an toàn kỹ thuật và bảo vệ môi trường xe cơ giới, xe máy chuyên dùng (áp dụng đối với xe cơ giới, xe máy chuyên dùng nhập khẩu);\n\n\n\nd) Bản sao Phiếu kiểm tra chất lượng xuất xưởng (áp dụng đối với xe cơ giới, xe máy chuyên dùng sản xuất, lắp ráp trong nước);\n\nđ) Bản sao Giấy chứng nhận chất lượng an toàn kỹ thuật và bảo vệ môi trường xe cơ giới, xe máy chuyên dùng cải tạo (áp dụng đối với xe cơ giới, xe máy chuyên dùng cải tạo).\n\nĐiều 7. Hồ sơ kiểm định định kỳ\n\n1. Xe cơ giới, xe máy chuyên dùng: Thực hiện theo quy định tại các điểm a, b khoản 1 Điều 6 Thông tư này.\n\n2. Xe cơ giới, xe máy chuyên dùng của doanh nghiệp: Thực hiện theo quy định tại các điểm a, b khoản 2 Điều 6 Thông tư này.\n\n3. Lập hồ sơ kiểm định.']","**Nguồn văn bản:** /content/drive/MyDrive/ITProject_data/new_law/66_2024_TT-BQP_628579.docx

**Tên văn bản:** None

**None:** None

**Nội dung:**
BỘ QUỐC PHÒNG
------- CỘNG HÒA XÃ HỘI CHỦ NGHĨA VIỆT NAM
Độc lập - Tự do - Hạnh phúc 
--------------- Số: 66/2024/TT-BQP Hà Nội, ngày 14 tháng 10 năm 2024

THÔNG TƯ

QUY ĐỊNH VỀ KIỂM ĐỊNH AN TOÀN KỸ THUẬT VÀ BẢO VỆ MÔI TRƯỜNG XE CƠ GIỚI, XE MÁY CHUYÊN DÙNG THUỘC PHẠM VI QUẢN LÝ CỦA BỘ QUỐC PHÒNG

Căn cứ Luật Trật tự, an toàn giao thông đường bộ ngày 27 tháng 6 năm 2024;

Căn cứ Nghị định số 01/2022/NĐ-CP ngày 30 tháng 11 năm 2022 của Chính phủ quy định chức năng, nhiệm vụ, quyền hạn và cơ cấu tổ chức của Bộ Quốc phòng;

Theo đề nghị của Chủ nhiệm Tổng cục Kỹ thuật;

Bộ trưởng Bộ Quốc phòng ban hành Thông tư quy định về kiểm định an toàn kỹ thuật và bảo vệ môi trường xe cơ giới, xe máy chuyên dùng thuộc phạm vi quản lý của Bộ Quốc phòng.

Chương I

QUY ĐỊNH CHUNG

Điều 1. Phạm vi điều chỉnh

Thông tư này quy định về kiểm định an toàn kỹ thuật và bảo vệ môi trường xe cơ giới, xe máy chuyên dùng của các cơ quan, đơn vị, doanh nghiệp thuộc phạm vi quản lý của Bộ Quốc phòng sử dụng vào mục đích quốc phòng, an ninh.

Điều 2. Đối tượng áp dụng

Thông tư này áp dụng đối với các trung tâm, trạm kiểm định an toàn kỹ thuật xe - máy quân sự; các cơ quan, đơn vị, doanh nghiệp thuộc phạm vi quản lý của Bộ Quốc phòng, các tổ chức và cá nhân liên quan đến việc kiểm định an toàn kỹ thuật và bảo vệ môi trường xe cơ giới, xe máy chuyên dùng.


Điều 3. Giải thích từ ngữ

Trong Thông tư này, các từ ngữ dưới đây được hiểu như sau:

1. Doanh nghiệp thuộc phạm vi quản lý của Bộ Quốc phòng (sau đây viết gọn là doanh nghiệp) là doanh nghiệp trực tiếp phục vụ quốc phòng, an ninh hoặc doanh nghiệp kết hợp kinh tế với quốc phòng, an ninh theo quy định tại Nghị định số 16/2023/NĐ-CP ngày 25 tháng 4 năm 2023 của Chính phủ về tổ chức quản lý và hoạt động của doanh nghiệp trực tiếp phục vụ quốc phòng, an ninh và doanh nghiệp kết hợp kinh tế với quốc phòng, an ninh; sửa đổi quy định tại điểm g khoản 1 Điều 23 Nghị định số 47/2021/NĐ-CP ngày 01 tháng 4 năm 2021 của Chính phủ quy định chi tiết một số điều của Luật Doanh nghiệp.

2. Xe cơ giới là xe được trang bị cho các cơ quan, đơn vị, doanh nghiệp do Bộ Quốc phòng trực tiếp đăng ký, quản lý, sử dụng vào mục đích quốc phòng, an ninh.

3. Xe cơ giới của doanh nghiệp là xe cơ giới sử dụng vào mục đích quốc phòng, an ninh không thuộc trường hợp xe cơ giới quy định tại khoản 2 Điều này.

4. Xe máy chuyên dùng gồm xe máy chuyên dùng quân sự, xe máy thi công; xe máy nông nghiệp, lâm nghiệp và các loại xe chuyên dùng khác có tham gia giao thông được trang bị cho các cơ quan, đơn vị trực thuộc Bộ Quốc phòng theo quy định tại Phụ lục VI kèm theo Thông tư này.

5. Cơ sở kiểm định là các trung tâm, trạm kiểm định an toàn kỹ thuật xe - máy quân sự do Tổng Tham mưu trưởng quyết định thành lập.

6. Kiểm định an toàn kỹ thuật và bảo vệ môi trường xe cơ giới, xe máy chuyên dùng (sau đây viết gọn là kiểm định) là việc kiểm tra, đánh giá lần đầu và định kỳ tình trạng an toàn kỹ thuật và bảo vệ môi trường của xe cơ giới, xe máy chuyên dùng theo các tiêu chuẩn, quy chuẩn, quy định của nhà nước và Bộ Quốc phòng.

7. Chu kỳ kiểm định là khoảng thời gian giữa hai lần kiểm định được tính bằng tháng.

8. Phiếu kiểm định là bản xác nhận kết quả kiểm định an toàn kỹ thuật và bảo vệ môi trường của từng xe cơ giới, xe máy chuyên dùng khi kiểm định.

9. Giấy chứng nhận an toàn kỹ thuật và bảo vệ môi trường xe cơ giới, xe máy chuyên dùng (sau đây gọi là Giấy chứng nhận kiểm định) là bản xác nhận cho xe cơ giới, xe máy chuyên dùng đã được kiểm định đạt các tiêu chuẩn, quy chuẩn, quy định của nhà nước và Bộ Quốc phòng về an toàn kỹ thuật và bảo vệ môi trường, đủ điều kiện tham gia giao thông đường bộ.

10. Tem kiểm định an toàn kỹ thuật và bảo vệ môi trường xe cơ giới, xe máy chuyên dùng (sau đây viết gọn là Tem kiểm định) là biểu trưng do các cơ sở kiểm định cấp, dán lên xe cơ giới, xe máy chuyên dùng sau khi đã được cấp Giấy chứng nhận kiểm định và được phép tham gia giao thông đường bộ theo thời hạn ghi trên Tem kiểm định.


11. Chỉ huy cơ sở kiểm định là giám đốc, phó giám đốc trung tâm kiểm định; trạm trưởng trạm kiểm định thuộc Bộ Quốc phòng.

12. Kiểm định viên là người có đủ trình độ, kỹ năng, kinh nghiệm được tập huấn (đào tạo); cấp Giấy chứng nhận, thẻ kiểm định viên theo quy định của nhà nước, Bộ Quốc phòng để thực hiện một phần hoặc toàn bộ việc kiểm định xe cơ giới, xe máy chuyên dùng.

13. Chương trình quản lý kiểm định là hệ thống phần mềm do Cục Xe máy - Vận tải/Tổng cục Hậu cần - Kỹ thuật xây dựng để quản lý cơ sở dữ liệu kiểm định và công tác kiểm định xe cơ giới, xe máy chuyên dùng; được sử dụng tại các cơ sở kiểm định và Cục Xe máy - Vận tải/Tổng cục Hậu cần - Kỹ thuật.


Điều 4. Những hành vi nghiêm cấm

1. Kiểm định không đủ nội dung, không đúng quy trình, quy định; làm sai lệch kết quả kiểm định.

2. Sử dụng thiết bị kiểm tra bị hư hỏng; phương tiện đo, thiết bị kiểm tra chưa được kiểm định, hiệu chuẩn hoặc quá thời hạn sử dụng.

3. Bố trí không đúng, không đủ kiểm định viên trên dây chuyền kiểm định.

4. Tự ý in phôi Giấy chứng nhận kiểm định, Tem kiểm định để sử dụng.

5. Sửa đổi các nội dung in, ghi trên Giấy chứng nhận kiểm định, Tem kiểm định; tự ý bóc, dán Tem kiểm định.

6. Có hành vi tiêu cực, sách nhiễu trong quá trình kiểm định.

7. Kiểm định, cấp Giấy chứng nhận kiểm định, dán Tem kiểm định cho xe cơ giới, xe máy chuyên dùng của doanh nghiệp: Hết niên hạn sử dụng, không nộp phí sử dụng đường bộ theo quy định của pháp luật.


Chương II

QUY ĐỊNH VỀ KIỂM ĐỊNH

Điều 5. Đối tượng, thẩm quyền kiểm định

1. Xe cơ giới, xe máy chuyên dùng phải được kiểm định bằng các trang thiết bị, dụng cụ kiểm định tại cơ sở kiểm định hoặc cơ động (trừ các trường hợp được miễn kiểm định lần đầu theo quy định tại Điều 11 Thông tư này).

2. Việc cơ động kiểm định chỉ áp dụng đối với các cơ quan, đơn vị, doanh nghiệp ở vùng sâu, vùng xa, biên giới, hải đảo không có điều kiện đưa xe cơ giới, xe máy chuyên dùng đến cơ sở kiểm định (khoảng cách từ cơ quan, đơn vị, doanh nghiệp đến cơ sở kiểm định phải có bán kính lớn hơn 50 km); nhóm xe tác chiến; xe cứu thương, cứu hoả, xe làm nhiệm vụ cứu hộ, cứu nạn; xe quá khổ, quá tải không vào được dây chuyền kiểm định.

3. Chỉ huy cơ sở kiểm định kết luận, ký tên, đóng dấu trên Phiếu kiểm định, Giấy chứng nhận kiểm định, Tem kiểm định và chịu trách nhiệm trước pháp luật về kết quả kiểm định.

Điều 6. Hồ sơ kiểm định lần đầu

1. Xe cơ giới, xe máy chuyên dùng.

	a) Công văn hoặc giấy giới thiệu đề nghị kiểm định do chỉ huy cơ quan, đơn vị cấp trung đoàn hoặc tương đương trở lên ký tên, đóng dấu theo quy định;

	b) Chứng nhận đăng ký xe, lý lịch xe (áp dụng đối với xe cơ giới, xe máy chuyên dùng đã đăng ký);

	c) Biển số tạm thời (áp dụng đối với xe cơ giới, xe máy chuyên dùng chưa hoàn thành thủ tục đăng ký);

	d) Bản sao Giấy chứng nhận chất lượng an toàn kỹ thuật xe cơ giới, xe máy chuyên dùng cải tạo (áp dụng đối với xe cơ giới, xe máy chuyên dùng cải tạo).

2. Xe cơ giới, xe máy chuyên dùng của doanh nghiệp.

	a) Công văn hoặc giấy giới thiệu đề nghị kiểm định do giám đốc hoặc phó giám đốc doanh nghiệp ký tên, đóng dấu theo quy định;

	b) Chứng nhận đăng ký xe;

	c) Bản sao Giấy chứng nhận chất lượng an toàn kỹ thuật và bảo vệ môi trường xe cơ giới, xe máy chuyên dùng (áp dụng đối với xe cơ giới, xe máy chuyên dùng nhập khẩu);

	d) Bản sao Phiếu kiểm tra chất lượng xuất xưởng (áp dụng đối với xe cơ giới, xe máy chuyên dùng sản xuất, lắp ráp trong nước);

	đ) Bản sao Giấy chứng nhận chất lượng an toàn kỹ thuật và bảo vệ môi trường xe cơ giới, xe máy chuyên dùng cải tạo (áp dụng đối với xe cơ giới, xe máy chuyên dùng cải tạo).


Điều 7. Hồ sơ kiểm định định kỳ

1. Xe cơ giới, xe máy chuyên dùng: Thực hiện theo quy định tại các điểm a, b khoản 1 Điều 6 Thông tư này.

2. Xe cơ giới, xe máy chuyên dùng của doanh nghiệp: Thực hiện theo quy định tại các điểm a, b khoản 2 Điều 6 Thông tư này.

3. Lập hồ sơ kiểm định.

**Tóm lại:** Văn bản này quy định về kiểm định an toàn kỹ thuật và bảo vệ môi trường đối với xe cơ giới, xe máy chuyên dùng thuộc Bộ Quốc Phòng, không đề cập đến quy định sử dụng xe máy điện dân dụng.
","**Nguồn văn bản:** 53_2024_TT-BGTVT_624420

**Tên văn bản:** Thông tư Quy định về phân loại phương tiện giao thông đường bộ và dấu hiệu nhận biết xe cơ giới sử dụng năng lượng sạch, năng lượng xanh, thân thiện môi trường

**Điều 1:** Phạm vi điều chỉnh

**Nội dung:**

Thông tư quy định về phân loại phương tiện giao thông đường bộ và dấu hiệu nhận biết xe cơ giới sử dụng năng lượng sạch, năng lượng xanh, thân thiện môi trường.

**Tóm lại:** Thông tư 53/2024/TT-BGTVT quy định về phân loại phương tiện giao thông đường bộ, bao gồm cả xe máy điện, và dấu hiệu nhận biết xe cơ giới sử dụng năng lượng sạch, năng lượng xanh, thân thiện môi trường.  Tuy nhiên, chi tiết về việc sử dụng xe máy điện (như đăng ký, đội mũ bảo hiểm,...) không được đề cập trong đoạn trích này.
",0.9545454545454546,0.5468454373316317,0.0,0.0
24,Luật Giao thông Đường bộ 2025 có quy định gì về việc sử dụng xe đạp trên đường cao tốc?,"['BỘ GIAO THÔNG VẬN TẢI\n-------- CỘNG HÒA XÃ HỘI CHỦ NGHĨA VIỆT NAM\nĐộc lập - Tự do - Hạnh phúc \n--------------- Số: 38/2024/TT-BGTVT Hà Nội, Ngày 15 tháng 11 năm 2024\n\nTHÔNG TƯ\n\nQUY ĐỊNH VỀ TỐC ĐỘ VÀ KHOẢNG CÁCH AN TOÀN CỦA XE CƠ GIỚI, XE MÁY CHUYÊN DÙNG THAM GIA GIAO THÔNG TRÊN ĐƯỜNG BỘ\n\nCăn cứ Luật Trật tự, an toàn giao thông đường bộ ngày 27 tháng 6 năm 2024;\n\nCăn cứ Luật Đường bộ ngày 27 tháng 6 năm 2024;\n\nCăn cứ Nghị định số 56/2022/NĐ-CP ngày 24 tháng 8 năm 2022 của Chính phủ quy định chức năng, nhiệm vụ, quyền hạn và cơ cấu tổ chức của Bộ Giao thông vận tải;\n\nTheo đề nghị của Vụ trưởng Vụ Kết cấu hạ tầng giao thông và Cục trưởng Cục đường bộ Việt Nam;\n\nBộ trưởng Bộ Giao thông vận tải ban hành Thông tư quy định về tốc độ và khoảng cách an toàn của xe cơ giới, xe máy chuyên dùng tham gia giao thông trên đường bộ.\n\nChương I\n\nQUY ĐỊNH CHUNG\n\nĐiều 1. Phạm vi điều chỉnh\n\nThông tư này quy định về tốc độ thiết kế của đường bộ; tốc độ khai thác và khoảng cách an toàn của xe cơ giới, xe máy chuyên dùng khi tham gia giao thông trên đường bộ, trừ xe ưu tiên đang đi làm nhiệm vụ theo quy định của pháp luật.\n\nĐiều 2. Đối tượng áp dụng\n\nThông tư này áp dụng đối với người lái xe, người điều khiển xe máy chuyên dùng và tổ chức, cá nhân liên quan đến quản lý và thực hiện các quy định về tốc độ thiết kế, tốc độ khai thác của đường bộ và khoảng cách an toàn của xe cơ giới, xe máy chuyên dùng khi tham gia giao thông trên đường bộ.\n\nĐiều 3. Giải thích từ ngữ\n\nTrong Thông tư này, các từ ngữ dưới đây được hiểu như sau:\n\n1. Đường bộ trong khu đông dân cư là đoạn đường bộ nằm trong khu vực nội thành phố, nội thị xã, nội thị trấn và những đoạn đường có đông dân cư sinh sống sát dọc theo đường, được xác định bằng biển báo “Bắt đầu khu đông dân cư” và biển báo “Hết khu đông dân cư”.\n\n2. Đường đôi là đường có chiều đi và chiều về được phân biệt bằng dải phân cách giữa.\n\n3. Đường một chiều là đường chỉ cho đi một chiều.\n\n4. Đường hai chiều là đường dùng chung cho cả chiều đi và về trên cùng một phần đường xe chạy mà không có dải phân cách giữa.\n\n5. Trọng tải là khối lượng hàng hóa chuyên chở cho phép, được ghi trên Giấy chứng nhận an toàn kỹ thuật và bảo vệ môi trường của phương tiện giao thông cơ giới đường bộ, Giấy chứng \n\n\n\nnhận chất lượng an toàn kỹ thuật và bảo vệ môi trường xe cơ giới nhập khẩu hoặc Giấy chứng nhận chất lượng an toàn kỹ thuật và bảo vệ môi trường kiểu loại ô tô sản xuất, lắp ráp.\n\n6. Tốc độ khai thác tối đa là giá trị tốc độ lớn nhất cho phép phương tiện tham gia giao thông trên đường bộ bảo đảm an toàn giao thông và khai thác hiệu quả tuyến đường.\n\n7. Tốc độ khai thác tối thiểu là giá trị tốc độ nhỏ nhất cho phép phương tiện tham gia giao thông trên đường bộ bảo đảm an toàn giao thông và khai thác hiệu quả tuyến đường.\n\n8. Khoảng cách an toàn là cự ly tối thiểu giữa phương tiện phía sau với phương tiện đang di chuyển liền trước, cùng làn đường, bảo đảm tránh xảy ra va chạm trong trường hợp phương tiện phía trước đột ngột giảm tốc độ hoặc dừng lại.\n\n9. Tốc độ lưu hành là giá trị tốc độ của phương tiện tại thời điểm tham gia giao thông trên đường bộ.\n\nĐiều 4. Nguyên tắc chấp hành quy định về tốc độ khai thác và khoảng cách an toàn khi điều khiển phương tiện trên đường bộ\n\n1. Khi tham gia giao thông trên đường bộ, người lái xe, người điều khiển xe máy chuyên dùng phải chấp hành quy định về tốc độ khai thác và khoảng cách an toàn theo quy định tại Điều 12 Luật Trật tự, an toàn giao thông đường bộ.\n\n2. Tại những đoạn đường không bố trí biển báo tốc độ khai thác tối đa, không bố trí biển báo khoảng cách an toàn giữa hai xe, người điều khiển phương tiện tham gia giao thông phải thực hiện theo quy định tại Điều 6, Điều 7, Điều 8 và Điều 11 Thông tư này.\n\nChương II\n\nTỐC ĐỘ THIẾT KẾ CỦA ĐƯỜNG BỘ; TỐC ĐỘ KHAI THÁC CỦA ĐƯỜNG BỘ, KHOẢNG CÁCH AN TOÀN CỦA XE CƠ GIỚI, XE MÁY CHUYÊN DÙNG THAM GIA GIAO THÔNG TRÊN ĐƯỜNG BỘ\n\nĐiều 5. Tốc độ thiết kế của đường bộ\n\n1. Tốc độ thiết kế của đường bộ là giá trị vận tốc được dùng để tính toán các chỉ tiêu kỹ thuật của đường bộ. Tốc độ thiết kế của đường bộ được xác định trong giai đoạn đầu tư xây dựng, nâng cấp, cải tạo đường bộ nhằm bảo đảm cho phương tiện di chuyển an toàn; được quyết định theo cấp kỹ thuật của đường bộ và điều kiện địa hình.\n\n2. Tốc độ thiết kế đường bộ cao tốc là giá trị vận tốc được dùng để tính toán các chỉ tiêu kỹ thuật của đường bộ cao tốc, được xác định theo cấp đường cao tốc. Khi thiết kế đường bộ cao tốc có thể áp dụng tốc độ thiết kế khác nhau theo từng đoạn nhưng phải bảo đảm các yêu cầu về chiều dài đoạn chuyển tiếp và tốc độ thiết kế trung gian giữa các đoạn. Tốc độ thiết kế đường bộ cao tốc được xác định theo Quy chuẩn kỹ thuật quốc gia về đường bộ cao tốc QCVN 115:2024/BGTVT.\n\n3. Tốc độ thiết kế đường bộ được xác định theo Tiêu chuẩn quốc gia TCVN 4054: 2005 Đường ô tô - Yêu cầu thiết kế.\n\n4. Tốc độ thiết kế đường bộ trong phạm vi đô thị được xác định theo Quy chuẩn kỹ thuật quốc gia về hệ thống công trình hạ tầng kỹ thuật QCVN 07-4:2023/BXD.\n\n5. Tốc độ thiết kế đường giao thông nông thôn được xác định theo Tiêu chuẩn quốc gia TCVN 10380:2014 Đường giao thông nông thôn - Yêu cầu thiết kế.\n\n\n\nĐiều 6. Tốc độ khai thác tối đa cho phép xe cơ giới tham gia giao thông trên đường bộ (trừ đường cao tốc)\n\n1. Tốc độ khai thác tối đa cho phép xe cơ giới tham gia giao thông trên đường bộ trong khu vực đông dân cư\n\nBảng 1\n\nLoại xe cơ giới đường bộ Tốc độ khai thác tối đa (km/h) Tốc độ khai thác tối đa (km/h) Đường đôi; đường một chiều có từ hai làn xe cơ giới trở lên Đường hai chiều; đường một chiều có một làn xe cơ giới Các loại xe cơ giới, trừ các xe được quy định tại Điều 7 và Điều 8 Thông tư này 60 50\n\n2. Tốc độ khai thác tối đa cho phép xe cơ giới tham gia giao thông trên đường bộ ngoài khu vực đông dân cư\n\nBảng 2\n\nLoại xe cơ giới đường bộ Tốc độ khai thác tối đa (km/h) Tốc độ khai thác tối đa (km/h) Đường đôi; đường một chiều có từ hai làn xe cơ giới trở lên Đường hai chiều; đường một chiều có một làn xe cơ giới Xe ô tô chở người đến 28 chỗ không kể chỗ của người lái xe (trừ xe buýt); ô tô tải có trọng tải không lớn hơn 3,5 tấn 90 80 Xe ô tô chở người trên 28 chỗ không kể chỗ người lái xe (trừ xe buýt); ô tô tải có trọng tải trên 3,5 tấn (trừ ô tô xi téc) 80 70 Xe buýt; ô tô đầu kéo kéo sơ mi rơ moóc (trừ ô tô đầu kéo kéo sơ mi rơ moóc xi téc); xe mô tô; ô tô chuyên dùng (trừ ô tô trộn vữa, ô tô trộn bê tông lưu động) 70 60 Ô tô kéo rơ moóc; ô tô kéo xe khác; ô tô trộn vữa, ô tô trộn bê tông lưu động, ô tô xi téc, ô tô đầu kéo kéo sơ mi rơ moóc xi téc, ô tô kéo theo rơ moóc xi téc) 60 50\n\nĐiều 7. Tốc độ khai thác tối đa cho phép đối với xe máy chuyên dùng, xe gắn máy và các loại xe tương tự tham gia giao thông trên đường bộ (trừ đường cao tốc)\n\nXe máy chuyên dùng, xe gắn máy và các loại xe tương tự khi tham gia giao thông, tốc độ khai thác tối đa là 40 km/h.\n\nĐiều 8. Tốc độ khai thác tối đa cho phép đối với xe chở người bốn bánh có gắn động cơ, xe chở hàng bốn bánh có gắn động cơ tham gia giao thông trên đường bộ (trừ đường cao tốc)\n\n1. Xe chở người bốn bánh có gắn động cơ khi tham gia giao thông trong phạm vi và thời gian cho phép hoạt động, tốc độ khai thác tối đa là 30 km/h.\n\n2. Xe chở hàng bốn bánh có gắn động cơ khi tham gia giao thông trong phạm vi và thời gian cho phép hoạt động, tốc độ khai thác tối đa là 50 km/h.\n\nĐiều 9. Tốc độ khai thác tối đa, tốc độ khai thác tối thiểu cho phép đối với các loại xe cơ giới, xe máy chuyên dùng trên đường cao tốc\n\n1. Đường cao tốc phải được đặt biển báo tốc độ khai thác tối đa, tốc độ khai thác tối thiểu.\n\n2. Tốc độ khai thác tối đa cho phép trên đường cao tốc là 120 km/h.\n\n3. Tốc độ khai thác tối thiểu cho phép trên đường cao tốc là 60 km/h. Trường hợp đường cao tốc có tốc độ thiết kế 60 km/h thì tốc độ khai thác tối thiểu thực hiện theo phương án tổ chức giao thông được cấp có thẩm quyền phê duyệt.']","**Nguồn văn bản:** /content/drive/MyDrive/ITProject_data/new_law/38_2024_TT-BGTVT_622477.docx

**Tên văn bản:**  Không có tiêu đề

**Nội dung:**

Thông tư này quy định về tốc độ và khoảng cách an toàn của xe cơ giới, xe máy chuyên dùng tham gia giao thông trên đường bộ, trừ xe ưu tiên đang đi làm nhiệm vụ. Văn bản này không đề cập đến việc sử dụng xe đạp trên đường cao tốc.

Tóm lại: Không tìm thấy thông tin liên quan tới việc sử dụng xe đạp trên đường cao tốc trong văn bản này.
","Không tìm thấy thông tin liên quan tới câu hỏi này.
",1.0,0.7059337891158203,0.0,0.0
25,Quy định mới về việc sử dụng xe máy trên đường cao tốc là gì?,"['BỘ GIAO THÔNG VẬN TẢI\n-------- CỘNG HÒA XÃ HỘI CHỦ NGHĨA VIỆT NAM\nĐộc lập - Tự do - Hạnh phúc \n--------------- Số: 38/2024/TT-BGTVT Hà Nội, Ngày 15 tháng 11 năm 2024\n\nTHÔNG TƯ\n\nQUY ĐỊNH VỀ TỐC ĐỘ VÀ KHOẢNG CÁCH AN TOÀN CỦA XE CƠ GIỚI, XE MÁY CHUYÊN DÙNG THAM GIA GIAO THÔNG TRÊN ĐƯỜNG BỘ\n\nCăn cứ Luật Trật tự, an toàn giao thông đường bộ ngày 27 tháng 6 năm 2024;\n\nCăn cứ Luật Đường bộ ngày 27 tháng 6 năm 2024;\n\nCăn cứ Nghị định số 56/2022/NĐ-CP ngày 24 tháng 8 năm 2022 của Chính phủ quy định chức năng, nhiệm vụ, quyền hạn và cơ cấu tổ chức của Bộ Giao thông vận tải;\n\nTheo đề nghị của Vụ trưởng Vụ Kết cấu hạ tầng giao thông và Cục trưởng Cục đường bộ Việt Nam;\n\nBộ trưởng Bộ Giao thông vận tải ban hành Thông tư quy định về tốc độ và khoảng cách an toàn của xe cơ giới, xe máy chuyên dùng tham gia giao thông trên đường bộ.\n\nChương I\n\nQUY ĐỊNH CHUNG\n\nĐiều 1. Phạm vi điều chỉnh\n\nThông tư này quy định về tốc độ thiết kế của đường bộ; tốc độ khai thác và khoảng cách an toàn của xe cơ giới, xe máy chuyên dùng khi tham gia giao thông trên đường bộ, trừ xe ưu tiên đang đi làm nhiệm vụ theo quy định của pháp luật.\n\nĐiều 2. Đối tượng áp dụng\n\nThông tư này áp dụng đối với người lái xe, người điều khiển xe máy chuyên dùng và tổ chức, cá nhân liên quan đến quản lý và thực hiện các quy định về tốc độ thiết kế, tốc độ khai thác của đường bộ và khoảng cách an toàn của xe cơ giới, xe máy chuyên dùng khi tham gia giao thông trên đường bộ.\n\nĐiều 3. Giải thích từ ngữ\n\nTrong Thông tư này, các từ ngữ dưới đây được hiểu như sau:\n\n1. Đường bộ trong khu đông dân cư là đoạn đường bộ nằm trong khu vực nội thành phố, nội thị xã, nội thị trấn và những đoạn đường có đông dân cư sinh sống sát dọc theo đường, được xác định bằng biển báo “Bắt đầu khu đông dân cư” và biển báo “Hết khu đông dân cư”.\n\n2. Đường đôi là đường có chiều đi và chiều về được phân biệt bằng dải phân cách giữa.\n\n3. Đường một chiều là đường chỉ cho đi một chiều.\n\n4. Đường hai chiều là đường dùng chung cho cả chiều đi và về trên cùng một phần đường xe chạy mà không có dải phân cách giữa.\n\n5. Trọng tải là khối lượng hàng hóa chuyên chở cho phép, được ghi trên Giấy chứng nhận an toàn kỹ thuật và bảo vệ môi trường của phương tiện giao thông cơ giới đường bộ, Giấy chứng \n\n\n\nnhận chất lượng an toàn kỹ thuật và bảo vệ môi trường xe cơ giới nhập khẩu hoặc Giấy chứng nhận chất lượng an toàn kỹ thuật và bảo vệ môi trường kiểu loại ô tô sản xuất, lắp ráp.\n\n6. Tốc độ khai thác tối đa là giá trị tốc độ lớn nhất cho phép phương tiện tham gia giao thông trên đường bộ bảo đảm an toàn giao thông và khai thác hiệu quả tuyến đường.\n\n7. Tốc độ khai thác tối thiểu là giá trị tốc độ nhỏ nhất cho phép phương tiện tham gia giao thông trên đường bộ bảo đảm an toàn giao thông và khai thác hiệu quả tuyến đường.\n\n8. Khoảng cách an toàn là cự ly tối thiểu giữa phương tiện phía sau với phương tiện đang di chuyển liền trước, cùng làn đường, bảo đảm tránh xảy ra va chạm trong trường hợp phương tiện phía trước đột ngột giảm tốc độ hoặc dừng lại.\n\n9. Tốc độ lưu hành là giá trị tốc độ của phương tiện tại thời điểm tham gia giao thông trên đường bộ.\n\nĐiều 4. Nguyên tắc chấp hành quy định về tốc độ khai thác và khoảng cách an toàn khi điều khiển phương tiện trên đường bộ\n\n1. Khi tham gia giao thông trên đường bộ, người lái xe, người điều khiển xe máy chuyên dùng phải chấp hành quy định về tốc độ khai thác và khoảng cách an toàn theo quy định tại Điều 12 Luật Trật tự, an toàn giao thông đường bộ.\n\n2. Tại những đoạn đường không bố trí biển báo tốc độ khai thác tối đa, không bố trí biển báo khoảng cách an toàn giữa hai xe, người điều khiển phương tiện tham gia giao thông phải thực hiện theo quy định tại Điều 6, Điều 7, Điều 8 và Điều 11 Thông tư này.\n\nChương II\n\nTỐC ĐỘ THIẾT KẾ CỦA ĐƯỜNG BỘ; TỐC ĐỘ KHAI THÁC CỦA ĐƯỜNG BỘ, KHOẢNG CÁCH AN TOÀN CỦA XE CƠ GIỚI, XE MÁY CHUYÊN DÙNG THAM GIA GIAO THÔNG TRÊN ĐƯỜNG BỘ\n\nĐiều 5. Tốc độ thiết kế của đường bộ\n\n1. Tốc độ thiết kế của đường bộ là giá trị vận tốc được dùng để tính toán các chỉ tiêu kỹ thuật của đường bộ. Tốc độ thiết kế của đường bộ được xác định trong giai đoạn đầu tư xây dựng, nâng cấp, cải tạo đường bộ nhằm bảo đảm cho phương tiện di chuyển an toàn; được quyết định theo cấp kỹ thuật của đường bộ và điều kiện địa hình.\n\n2. Tốc độ thiết kế đường bộ cao tốc là giá trị vận tốc được dùng để tính toán các chỉ tiêu kỹ thuật của đường bộ cao tốc, được xác định theo cấp đường cao tốc. Khi thiết kế đường bộ cao tốc có thể áp dụng tốc độ thiết kế khác nhau theo từng đoạn nhưng phải bảo đảm các yêu cầu về chiều dài đoạn chuyển tiếp và tốc độ thiết kế trung gian giữa các đoạn. Tốc độ thiết kế đường bộ cao tốc được xác định theo Quy chuẩn kỹ thuật quốc gia về đường bộ cao tốc QCVN 115:2024/BGTVT.\n\n3. Tốc độ thiết kế đường bộ được xác định theo Tiêu chuẩn quốc gia TCVN 4054: 2005 Đường ô tô - Yêu cầu thiết kế.\n\n4. Tốc độ thiết kế đường bộ trong phạm vi đô thị được xác định theo Quy chuẩn kỹ thuật quốc gia về hệ thống công trình hạ tầng kỹ thuật QCVN 07-4:2023/BXD.\n\n5. Tốc độ thiết kế đường giao thông nông thôn được xác định theo Tiêu chuẩn quốc gia TCVN 10380:2014 Đường giao thông nông thôn - Yêu cầu thiết kế.\n\n\n\nĐiều 6. Tốc độ khai thác tối đa cho phép xe cơ giới tham gia giao thông trên đường bộ (trừ đường cao tốc)\n\n1. Tốc độ khai thác tối đa cho phép xe cơ giới tham gia giao thông trên đường bộ trong khu vực đông dân cư\n\nBảng 1\n\nLoại xe cơ giới đường bộ Tốc độ khai thác tối đa (km/h) Tốc độ khai thác tối đa (km/h) Đường đôi; đường một chiều có từ hai làn xe cơ giới trở lên Đường hai chiều; đường một chiều có một làn xe cơ giới Các loại xe cơ giới, trừ các xe được quy định tại Điều 7 và Điều 8 Thông tư này 60 50\n\n2. Tốc độ khai thác tối đa cho phép xe cơ giới tham gia giao thông trên đường bộ ngoài khu vực đông dân cư\n\nBảng 2\n\nLoại xe cơ giới đường bộ Tốc độ khai thác tối đa (km/h) Tốc độ khai thác tối đa (km/h) Đường đôi; đường một chiều có từ hai làn xe cơ giới trở lên Đường hai chiều; đường một chiều có một làn xe cơ giới Xe ô tô chở người đến 28 chỗ không kể chỗ của người lái xe (trừ xe buýt); ô tô tải có trọng tải không lớn hơn 3,5 tấn 90 80 Xe ô tô chở người trên 28 chỗ không kể chỗ người lái xe (trừ xe buýt); ô tô tải có trọng tải trên 3,5 tấn (trừ ô tô xi téc) 80 70 Xe buýt; ô tô đầu kéo kéo sơ mi rơ moóc (trừ ô tô đầu kéo kéo sơ mi rơ moóc xi téc); xe mô tô; ô tô chuyên dùng (trừ ô tô trộn vữa, ô tô trộn bê tông lưu động) 70 60 Ô tô kéo rơ moóc; ô tô kéo xe khác; ô tô trộn vữa, ô tô trộn bê tông lưu động, ô tô xi téc, ô tô đầu kéo kéo sơ mi rơ moóc xi téc, ô tô kéo theo rơ moóc xi téc) 60 50\n\nĐiều 7. Tốc độ khai thác tối đa cho phép đối với xe máy chuyên dùng, xe gắn máy và các loại xe tương tự tham gia giao thông trên đường bộ (trừ đường cao tốc)\n\nXe máy chuyên dùng, xe gắn máy và các loại xe tương tự khi tham gia giao thông, tốc độ khai thác tối đa là 40 km/h.\n\nĐiều 8. Tốc độ khai thác tối đa cho phép đối với xe chở người bốn bánh có gắn động cơ, xe chở hàng bốn bánh có gắn động cơ tham gia giao thông trên đường bộ (trừ đường cao tốc)\n\n1. Xe chở người bốn bánh có gắn động cơ khi tham gia giao thông trong phạm vi và thời gian cho phép hoạt động, tốc độ khai thác tối đa là 30 km/h.\n\n2. Xe chở hàng bốn bánh có gắn động cơ khi tham gia giao thông trong phạm vi và thời gian cho phép hoạt động, tốc độ khai thác tối đa là 50 km/h.\n\nĐiều 9. Tốc độ khai thác tối đa, tốc độ khai thác tối thiểu cho phép đối với các loại xe cơ giới, xe máy chuyên dùng trên đường cao tốc\n\n1. Đường cao tốc phải được đặt biển báo tốc độ khai thác tối đa, tốc độ khai thác tối thiểu.\n\n2. Tốc độ khai thác tối đa cho phép trên đường cao tốc là 120 km/h.\n\n3. Tốc độ khai thác tối thiểu cho phép trên đường cao tốc là 60 km/h. Trường hợp đường cao tốc có tốc độ thiết kế 60 km/h thì tốc độ khai thác tối thiểu thực hiện theo phương án tổ chức giao thông được cấp có thẩm quyền phê duyệt.']","**Nguồn văn bản:** /content/drive/MyDrive/ITProject_data/new_law/38_2024_TT-BGTVT_622477.docx

**Tên văn bản:** (Không có tiêu đề trong metadata)

**(Không có article_title):**

**Nội dung:**
BỘ GIAO THÔNG VẬN TẢI
-------- CỘNG HÒA XÃ HỘI CHỦ NGHĨA VIỆT NAM
Độc lập - Tự do - Hạnh phúc 
--------------- Số: 38/2024/TT-BGTVT Hà Nội, Ngày 15 tháng 11 năm 2024

THÔNG TƯ

QUY ĐỊNH VỀ TỐC ĐỘ VÀ KHOẢNG CÁCH AN TOÀN CỦA XE CƠ GIỚI, XE MÁY CHUYÊN DÙNG THAM GIA GIAO THÔNG TRÊN ĐƯỜNG BỘ


Điều 7. Tốc độ khai thác tối đa cho phép đối với xe máy chuyên dùng, xe gắn máy và các loại xe tương tự tham gia giao thông trên đường bộ (trừ đường cao tốc)

Xe máy chuyên dùng, xe gắn máy và các loại xe tương tự khi tham gia giao thông, tốc độ khai thác tối đa là 40 km/h.

Điều 9. Tốc độ khai thác tối đa, tốc độ khai thác tối thiểu cho phép đối với các loại xe cơ giới, xe máy chuyên dùng trên đường cao tốc

1. Đường cao tốc phải được đặt biển báo tốc độ khai thác tối đa, tốc độ khai thác tối thiểu.

2. Tốc độ khai thác tối đa cho phép trên đường cao tốc là 120 km/h.

3. Tốc độ khai thác tối thiểu cho phép trên đường cao tốc là 60 km/h. Trường hợp đường cao tốc có tốc độ thiết kế 60 km/h thì tốc độ khai thác tối thiểu thực hiện theo phương án tổ chức giao thông được cấp có thẩm quyền phê duyệt.


**Tóm lại:** Xe máy, xe gắn máy và các loại xe tương tự không được phép lưu thông trên đường cao tốc.  Tốc độ tối đa cho phép của các loại xe này khi tham gia giao thông trên các tuyến đường khác (trừ đường cao tốc) là 40 km/h.
","**Nguồn văn bản:** 36_2024_QH15_444251

**Tên văn bản:** Luật Trật tự, an toàn giao thông đường bộ

**Điều 12:** Chấp hành quy định về tốc độ và khoảng cách giữa các xe

**Nội dung:**

1. Người lái xe, người điều khiển xe máy chuyên dùng phải chấp hành quy định về tốc độ, khoảng cách an toàn tối thiểu với xe phía trước cùng làn đường hoặc phần đường.

2. Người điều khiển phương tiện tham gia giao thông đường bộ phải bảo đảm tốc độ phù hợp điều kiện của cầu, đường, mật độ giao thông, địa hình, thời tiết và các yếu tố ảnh hưởng khác để bảo đảm an toàn.

3. Người điều khiển phương tiện tham gia giao thông đường bộ phải quan sát, giảm tốc độ hoặc dừng lại để bảo đảm an toàn trong các trường hợp sau đây:

	a) Tại nơi có vạch kẻ đường hoặc báo hiệu khác dành cho người đi bộ hoặc tại nơi mà người đi bộ, xe lăn của người khuyết tật đang qua đường.

	b) Có báo hiệu cảnh báo nguy hiểm hoặc có chướng ngại vật trên đường.

	c) Chuyển hướng xe chạy hoặc tầm nhìn bị hạn chế.

	d) Nơi đường bộ giao nhau cùng mức với đường bộ, đường bộ giao nhau cùng mức với đường sắt; đường hẹp, đường vòng, đường quanh co, đường đèo, dốc.

	đ) Nơi cầu, cống hẹp, đập tràn, đường ngầm, hầm chui, hầm đường bộ.

	e) Khu vực có trường học, bệnh viện, bến xe, công trình công cộng tập trung đông người, khu vực đông dân cư, chợ, khu vực đang thi công trên đường bộ, hiện trường vụ tai nạn giao thông đường bộ.

	g) Có vật nuôi đi trên đường hoặc chăn thả ở ven đường.

	h) Tránh xe đi ngược chiều hoặc khi cho xe đi phía sau vượt; khi có tín hiệu xin đường, tín hiệu khẩn cấp của xe đi cùng chiều phía trước.

	i) Điểm dừng xe, đỗ xe trên đường bộ có khách đang lên, xuống xe.

	k) Gặp xe vận chuyển hàng siêu trường, siêu trọng, hàng hóa nguy hiểm; đoàn người đi bộ.

	l) Gặp xe ưu tiên.

	m) Điều kiện trời mưa, gió, sương, khói, bụi, mặt đường trơn trượt, lầy lội, có nhiều đất đá, vật liệu rơi vãi ảnh hưởng đến an toàn giao thông đường bộ.

	n) Khu vực đang tổ chức kiểm soát giao thông đường bộ.

4. Bộ trưởng Bộ Giao thông vận tải quy định chi tiết về tốc độ và khoảng cách an toàn của xe cơ giới, xe máy chuyên dùng tham gia giao thông đường bộ.


**Nguồn văn bản:** 38_2024_TT-BGTVT_622477

**Tên văn bản:** Thông tư Quy định về tốc độ và khoảng cách an toàn của xe cơ giới, xe máy chuyên dùng tham gia giao thông trên đường bộ

**Điều 4:** Nguyên tắc chấp hành quy định về tốc độ khai thác và khoảng cách an toàn khi điều khiển phương tiện trên đường bộ

**Nội dung:**

1. Khi tham gia giao thông trên đường bộ, người lái xe, người điều khiển xe máy chuyên dùng phải chấp hành quy định về tốc độ khai thác và khoảng cách an toàn theo quy định tại Điều 12 Luật Trật tự, an toàn giao thông đường bộ.

2. Tại những đoạn đường không bố trí biển báo tốc độ khai thác tối đa, không bố trí biển báo khoảng cách an toàn giữa hai xe, người điều khiển phương tiện tham gia giao thông phải thực hiện theo quy định tại Điều 6, Điều 7, Điều 8 và Điều 11 Thông tư này. Chương II Tốc độ thiết kế của đường bộ; tốc độ khai thác của đường bộ, khoảng cách an toàn của xe cơ giới, xe máy chuyên dùng tham gia giao thông trên đường bộ.


Tóm lại: Các văn bản cung cấp thông tin về tốc độ và khoảng cách an toàn khi tham gia giao thông, chứ không đề cập cụ thể việc sử dụng xe máy trên đường cao tốc. Bộ Giao thông Vận tải có trách nhiệm quy định chi tiết về vấn đề này.  Bạn nên tìm kiếm thông tin từ các văn bản khác hoặc liên hệ cơ quan chức năng để biết thêm chi tiết.
",0.5,0.6045108184423928,0.6666666666666666,0.0
26,Luật Giao thông Đường bộ 2025 có quy định gì về việc sử dụng xe ô tô tải trong giờ cao điểm?,"['9. Ngoài hoạt động cấp cứu người, phục vụ các nhiệm vụ khẩn cấp như thiên tai, địch họa theo yêu cầu của lực lượng chức năng, xe ô tô vận chuyển hành khách theo hợp đồng không được đón, trả khách ngoài các địa điểm ghi trong hợp đồng.\n\n10. Định kỳ từ ngày 01 đến ngày 05 hằng tháng, Sở Giao thông vận tải thông báo bằng văn bản danh sách các xe được cấp mới phù hiệu xe hợp đồng của tháng liền trước đến Ủy ban nhân dân cấp xã nơi đơn vị kinh doanh vận tải đặt trụ sở chính hoặc trụ sở chi nhánh để phối hợp quản lý; đăng công khai trên trang thông tin điện tử của Sở Giao thông vận tải.\n\nĐiều 8. Kinh doanh vận tải hàng hóa bằng xe ô tô\n\n1. Đơn vị kinh doanh vận tải có Giấy phép kinh doanh vận tải bằng ô tô, trong đó có một hoặc các loại hình kinh doanh vận tải hàng hóa bằng xe ô tô quy định tại khoản 2, khoản 3 và khoản 4 Điều này thì được tham gia kinh doanh vận tải hàng hóa bằng xe ô tô theo loại hình đã đăng ký.\n\n2. Kinh doanh vận tải hàng hóa bằng xe taxi tải là việc sử dụng xe ô tô có trọng tải từ 1.500 ki-lô-gam trở xuống để vận chuyển hàng hóa và người thuê vận tải trả tiền cho lái xe theo đồng hồ tính tiền hoặc theo phần mềm tính tiền trên xe. Mặt ngoài hai bên thành xe hoặc cánh cửa xe niêm yết cụm từ “TAXI TẢI” theo Mẫu số 08 Phụ lục XIII kèm theo Nghị định này, số điện thoại liên lạc, tên đơn vị kinh doanh vận tải.\n\n3. Kinh doanh vận tải hàng hóa siêu trường, siêu trọng\n\na) Kinh doanh vận tải hàng hóa siêu trường, siêu trọng là việc sử dụng xe ô tô để vận chuyển hàng không thể chia nhỏ, tháo rời, khi vận chuyển trên đường bộ làm cho phương tiện hoặc tổ hợp phương tiện bị vượt quá giới hạn cho phép tham gia giao thông đường bộ về kích thước, khối lượng theo quy định của pháp luật;\n\nb) Khi vận chuyển hàng hóa siêu trường, siêu trọng, phải thực hiện theo quy định tại Điều 53 Luật Trật tự, an toàn giao thông đường bộ.\n\n4. Kinh doanh vận tải hàng hóa nguy hiểm\n\na) Kinh doanh vận tải hàng hóa nguy hiểm là việc sử dụng xe ô tô để vận chuyển hàng hóa có chứa các chất nguy hiểm có khả năng gây nguy hại tới tính mạng, sức khỏe con người, môi trường, an toàn và an ninh quốc gia;\n\nb) Khi vận chuyển hàng hóa nguy hiểm phải thực hiện theo quy định tại Điều 51 Luật Trật tự, an toàn giao thông đường bộ.\n\n5. Kinh doanh vận tải hàng hóa thông thường là hình thức kinh doanh vận tải hàng hóa, trừ các hình thức kinh doanh vận tải quy định tại các khoản 2, khoản 3 Điều này.\n\n6. Xe ô tô đầu kéo kéo rơ moóc hoặc sơ mi rơ moóc kinh doanh vận tải hàng hóa, xe ô tô tải kinh doanh vận tải hàng hóa thông thường và xe taxi tải phải có phù hiệu “XE TẢI” theo Mẫu số 09 Phụ lục XIII kèm theo Nghị định này và được dán cố định tại góc trên bên phải ngay sát phía dưới vị trí của Tem kiểm định, mặt trong kính chắn gió phía trước của xe.\n\n7. Đơn vị kinh doanh vận tải hàng hóa phải chịu trách nhiệm thực hiện đúng quy định việc xếp hàng hóa lên xe ô tô.\n\n8. Đơn vị kinh doanh vận tải hàng hóa phải cấp cho lái xe Giấy vận tải trong quá trình vận chuyển hàng hóa trên đường. Giấy vận tải phải có xác nhận (ký, ghi rõ họ và tên) khối lượng hàng hóa đã xếp lên phương tiện của chủ hàng (hoặc người được chủ hàng ủy quyền) hoặc đại diện đơn vị, cá nhân thực hiện việc xếp hàng.\n\n9. Khi vận chuyển hàng hóa, lái xe phải mang theo Giấy vận tải (Giấy vận chuyển) bằng văn bản giấy hoặc phải có thiết bị để truy cập vào phần mềm thể hiện nội dung của Giấy vận tải và các giấy tờ của lái xe và phương tiện theo quy định của pháp luật. Đơn vị kinh doanh vận tải và lái xe không được chở hàng vượt quá khối lượng cho phép tham gia giao thông.\n\n10. Đối với hoạt động vận chuyển xe đạp, xe mô tô, xe gắn máy và các loại xe tương tự qua hầm đường bộ áp dụng theo quy định tại khoản 4 Điều này.\n\n11. Giấy vận tải bằng văn bản giấy hoặc điện tử do đơn vị kinh doanh vận tải hàng hóa tự phát hành và có các thông tin tối thiểu gồm: tên đơn vị vận tải; biển kiểm soát xe; tên đơn vị hoặc người thuê vận tải; hành trình (điểm đầu, điểm cuối); số hợp đồng, ngày tháng năm ký hợp đồng (nếu có); loại hàng và khối lượng hàng vận chuyển trên xe. Đơn vị kinh doanh vận tải hàng hóa phải thực hiện lưu trữ Giấy vận tải của các chuyến xe đã thực hiện trong thời gian tối thiểu 03 năm.\n\n12. Việc bồi thường hàng hóa hư hỏng, mất mát, thiếu hụt được thực hiện theo hợp đồng vận chuyển hoặc theo thỏa thuận giữa người kinh doanh vận tải và người thuê vận tải.\n\nĐiều 9. Kinh doanh vận tải hành khách bằng xe bốn bánh có gắn động cơ\n\n1. Đơn vị kinh doanh vận tải có Giấy phép kinh doanh vận tải, trong đó có loại hình kinh doanh vận tải bằng xe bốn bánh có gắn động cơ thì được sử dụng xe bốn bánh có gắn động cơ để kinh doanh vận tải hành khách.\n\n2. Đơn vị kinh doanh vận tải hành khách bằng xe bốn bánh có gắn động cơ phải có phương tiện đáp ứng các điều kiện tham gia giao thông theo quy định tại điểm d khoản 1 Điều 34 và khoản 1 Điều 48 của Luật Trật tự, an toàn giao thông đường bộ; phải hướng dẫn cho hành khách bảo đảm an toàn giao thông khi ngồi trên xe.\n\n3. Đơn vị kinh doanh vận tải bằng xe bốn bánh có gắn động cơ tuân thủ các quy định tại Điều 11 (trừ điểm a khoản 3, khoản 5, khoản 9 và khoản 10) Nghị định này.\n\n4. Phải có phù hiệu “XE CHỞ KHÁCH” theo Mẫu số 10 Phụ lục XIII kèm theo Nghị định này và được dán cố định phía bên phải mặt trong kính trước của xe.\n\nĐiều 10. Kinh doanh vận tải hàng hóa bằng xe bốn bánh có gắn động cơ\n\n1. Đơn vị kinh doanh vận tải có Giấy phép kinh doanh vận tải, trong đó có loại hình kinh doanh vận tải bằng xe bốn bánh có gắn động cơ thì được sử dụng xe bốn bánh có gắn động cơ để kinh doanh vận tải hàng hóa.\n\n2. Đơn vị kinh doanh vận tải sử dụng xe bốn bánh có gắn động cơ phải đáp ứng các điều kiện tham gia giao thông theo quy định tại điểm đ khoản 1 Điều 34 và khoản 1 Điều 48 của Luật Trật tự, an toàn giao thông đường bộ; phải thực hiện đúng quy định về xếp hàng hóa lên xe.\n\n3. Đơn vị kinh doanh vận tải bằng xe bốn bánh có gắn động cơ tuân thủ các quy định tại Điều 11 (trừ điểm a khoản 3, khoản 5, khoản 9 và khoản 10) Nghị định này.\n\n4. Phải có phù hiệu “XE CHỞ HÀNG” theo Mẫu số 11 Phụ lục XIII kèm theo Nghị định này và được dán cố định phía bên phải mặt trong kính trước của xe.\n\nĐiều 11. Quy định về công tác bảo đảm an toàn trong hoạt động vận tải bằng xe ô tô, bằng xe bốn bánh có gắn động cơ\n\n1. Đơn vị kinh doanh vận tải bằng xe ô tô, bằng xe bốn bánh có gắn động cơ phải có bộ phận quản lý an toàn, xây dựng và thực hiện bảo đảm an toàn giao thông trong hoạt động vận tải đáp ứng yêu cầu sau:\n\na) Có người trực tiếp điều hành vận tải theo quy định tại khoản 2 Điều này và có nhân sự thực hiện theo dõi, giám sát hoạt động của lái xe, phương tiện trong suốt quá trình tham gia kinh doanh vận tải;\n\nb) Xây dựng và thực hiện các nhiệm vụ bảo đảm an toàn giao thông theo quy định tại điều này;\n\nc) Giao nhiệm vụ cho lái xe; chỉ sử dụng lái xe điều khiển phương tiện kinh doanh vận tải có Giấy phép lái xe phù hợp loại xe theo quy định tại Điều 57 Luật Trật tự, an toàn giao thông đường bộ và lái xe đã được cấp Giấy chứng nhận hoàn thành tập huấn nghiệp vụ vận tải.\n\n2. Người trực tiếp điều hành vận tải của đơn vị kinh doanh vận tải phải bảo đảm các yêu cầu như sau:\n\na) Đối với đơn vị kinh doanh vận tải hành khách theo tuyến cố định, kinh doanh vận tải hành khách bằng xe buýt, bằng xe taxi và các đơn vị kinh doanh vận tải hàng hóa sử dụng xe ô tô kéo rơ moóc, xe ô tô đầu kéo kéo theo sơ mi rơ moóc phải có trình độ chuyên môn về vận tải (có chứng chỉ sơ cấp chuyên ngành vận tải hoặc có bằng tốt nghiệp trung cấp chuyên ngành vận tải hoặc đường bộ trở lên);\n\nb) Đối với đơn vị kinh doanh vận tải hành khách, hàng hóa (không thuộc đối tượng quy định tại điểm a khoản này) đáp ứng yêu cầu tại điểm a khoản này hoặc phải có kinh nghiệm làm việc tại đơn vị kinh doanh vận tải tối thiểu từ 03 năm trở lên hoặc là chủ hộ kinh doanh vận tải của đơn vị kinh doanh vận tải hoặc là người đại diện pháp luật của đơn vị kinh doanh vận tải;']","**Nguồn văn bản:** /content/drive/MyDrive/ITProject_data/new_law/158_2024_ND-CP_636875.docx

**Tên văn bản:** (Không có tiêu đề trong metadata)


**Nội dung:**

Điều 8. Kinh doanh vận tải hàng hóa bằng xe ô tô

1. Đơn vị kinh doanh vận tải có Giấy phép kinh doanh vận tải bằng ô tô, trong đó có một hoặc các loại hình kinh doanh vận tải hàng hóa bằng xe ô tô quy định tại khoản 2, khoản 3 và khoản 4 Điều này thì được tham gia kinh doanh vận tải hàng hóa bằng xe ô tô theo loại hình đã đăng ký.

2. Kinh doanh vận tải hàng hóa bằng xe taxi tải là việc sử dụng xe ô tô có trọng tải từ 1.500 ki-lô-gam trở xuống để vận chuyển hàng hóa và người thuê vận tải trả tiền cho lái xe theo đồng hồ tính tiền hoặc theo phần mềm tính tiền trên xe. Mặt ngoài hai bên thành xe hoặc cánh cửa xe niêm yết cụm từ “TAXI TẢI” theo Mẫu số 08 Phụ lục XIII kèm theo Nghị định này, số điện thoại liên lạc, tên đơn vị kinh doanh vận tải.

3. Kinh doanh vận tải hàng hóa siêu trường, siêu trọng

    a) Kinh doanh vận tải hàng hóa siêu trường, siêu trọng là việc sử dụng xe ô tô để vận chuyển hàng không thể chia nhỏ, tháo rời, khi vận chuyển trên đường bộ làm cho phương tiện hoặc tổ hợp phương tiện bị vượt quá giới hạn cho phép tham gia giao thông đường bộ về kích thước, khối lượng theo quy định của pháp luật;

    b) Khi vận chuyển hàng hóa siêu trường, siêu trọng, phải thực hiện theo quy định tại Điều 53 Luật Trật tự, an toàn giao thông đường bộ.

4. Kinh doanh vận tải hàng hóa nguy hiểm

    a) Kinh doanh vận tải hàng hóa nguy hiểm là việc sử dụng xe ô tô để vận chuyển hàng hóa có chứa các chất nguy hiểm có khả năng gây nguy hại tới tính mạng, sức khỏe con người, môi trường, an toàn và an ninh quốc gia;

    b) Khi vận chuyển hàng hóa nguy hiểm phải thực hiện theo quy định tại Điều 51 Luật Trật tự, an toàn giao thông đường bộ.

5. Kinh doanh vận tải hàng hóa thông thường là hình thức kinh doanh vận tải hàng hóa, trừ các hình thức kinh doanh vận tải quy định tại các khoản 2, khoản 3 Điều này.

6. Xe ô tô đầu kéo kéo rơ moóc hoặc sơ mi rơ moóc kinh doanh vận tải hàng hóa, xe ô tô tải kinh doanh vận tải hàng hóa thông thường và xe taxi tải phải có phù hiệu “XE TẢI” theo Mẫu số 09 Phụ lục XIII kèm theo Nghị định này và được dán cố định tại góc trên bên phải ngay sát phía dưới vị trí của Tem kiểm định, mặt trong kính chắn gió phía trước của xe.

7. Đơn vị kinh doanh vận tải hàng hóa phải chịu trách nhiệm thực hiện đúng quy định việc xếp hàng hóa lên xe ô tô.

8. Đơn vị kinh doanh vận tải hàng hóa phải cấp cho lái xe Giấy vận tải trong quá trình vận chuyển hàng hóa trên đường. Giấy vận tải phải có xác nhận (ký, ghi rõ họ và tên) khối lượng hàng hóa đã xếp lên phương tiện của chủ hàng (hoặc người được chủ hàng ủy quyền) hoặc đại diện đơn vị, cá nhân thực hiện việc xếp hàng.

9. Khi vận chuyển hàng hóa, lái xe phải mang theo Giấy vận tải (Giấy vận chuyển) bằng văn bản giấy hoặc phải có thiết bị để truy cập vào phần mềm thể hiện nội dung của Giấy vận tải và các giấy tờ của lái xe và phương tiện theo quy định của pháp luật. Đơn vị kinh doanh vận tải và lái xe không được chở hàng vượt quá khối lượng cho phép tham gia giao thông.


Tóm lại: Văn bản này không đề cập đến việc hạn chế sử dụng xe ô tô tải trong giờ cao điểm. Nó quy định về các loại hình kinh doanh vận tải hàng hóa, điều kiện kinh doanh, trách nhiệm của đơn vị kinh doanh và lái xe trong việc vận chuyển hàng hóa.
","**Nguồn văn bản:** 35_2024_QH15_588811

**Tên văn bản:** Luật Đường bộ

**Điều 25:** Tổ chức giao thông

**Nội dung:**

2. Nội dung tổ chức giao thông đường bộ trong giai đoạn thiết kế, thi công xây dựng, quản lý, vận hành, khai thác, sử dụng, bảo trì công trình đường bộ bao gồm:

	a) Quy định số làn đường, phần đường dành cho xe ô tô và các phương tiện tham gia giao thông đường bộ khác, phần đường dành cho người đi bộ; chiều đi, tốc độ các phương tiện cơ giới tham gia giao thông đường bộ.

	b) Tổ chức phân làn, phân luồng trên tuyến đường đang đầu tư xây dựng và tại các tuyến đường bộ kết nối.

	c) Quy định giao thông tại các nút giao, vị trí đấu nối với đường khác; quy định về tránh, vượt xe trên đường, các điểm được phép dừng xe, đỗ xe trên đường, vị trí đón, trả khách.

	d) Quy định khổ giới hạn và tải trọng cho phép phương tiện tham gia giao thông đường bộ an toàn.

	đ) Quy định thời gian cho phép tham gia giao thông; thời gian cho phép đi theo các hướng của đèn tín hiệu giao thông.

	e) Quy định thời gian bật, tắt hệ thống chiếu sáng trên đường.

	g) Quy định về các trường hợp tạm dừng khai thác một phần hoặc toàn bộ tuyến đường.

	h) Khai thác, sử dụng hệ thống quản lý giao thông thông minh, trung tâm quản lý, điều hành giao thông tuyến đường cao tốc và các thiết bị công nghệ khác phục vụ cung cấp thông tin, chỉ dẫn cho người tham gia giao thông đường bộ.

	i) Lắp đặt đầy đủ hệ thống báo hiệu đường bộ và thực hiện các công việc cần thiết khác.

	k) Phê duyệt phương án tổ chức giao thông đối với đường cao tốc.


5. Bộ Giao thông vận tải, Ủy ban nhân dân các cấp chịu trách nhiệm tổ chức giao thông trên các tuyến đường bộ thuộc phạm vi quản lý.


**Tóm lại:** Luật Đường bộ quy định về việc tổ chức giao thông nói chung, bao gồm cả việc phân luồng, phân làn, quy định thời gian, tốc độ cho phép,... cho các phương tiện giao thông đường bộ. Việc này được thực hiện bởi Bộ Giao thông vận tải và Ủy ban nhân dân các cấp để đảm bảo giao thông thông suốt và an toàn.  Tuy nhiên, trong đoạn trích này không đề cập cụ thể đến việc hạn chế xe ô tô tải trong giờ cao điểm.
",0.8181818181818182,0.7171678011171339,0.0,0.0
27,Quy định mới về việc sử dụng xe ô tô chở hàng nguy hiểm là gì?,"['5. Phạt tiền từ 12.000.000 đồng đến 14.000.000 đồng đối với hành vi vận chuyển hàng hóa nguy hiểm không có giấy phép vận chuyển hàng hóa nguy hiểm hoặc có nhưng hết hiệu lực hoặc không thực hiện đúng quy định trong giấy phép vận chuyển hàng hóa nguy hiểm, trừ các hành vi vi phạm quy định tại điểm a khoản 6 Điều 20 của Nghị định này.\n\n6. Ngoài việc bị áp dụng hình thức xử phạt, người thực hiện hành vi vi phạm quy định tại khoản 4, khoản 5 Điều này nếu gây ô nhiễm môi trường còn bị áp dụng các biện pháp khắc phục hậu quả buộc thực hiện các biện pháp khắc phục tình trạng ô nhiễm môi trường do vi phạm hành chính gây ra.\n\n7. Ngoài việc bị áp dụng hình thức xử phạt, người điều khiển phương tiện thực hiện hành vi vi phạm còn bị trừ điểm giấy phép lái xe như sau:\n\na) Thực hiện hành vi quy định tại khoản 3, khoản 4 Điều này bị trừ điểm giấy phép lái xe 02 điểm;\n\nb) Thực hiện hành vi quy định tại khoản 5 Điều này bị trừ điểm giấy phép lái xe 04 điểm.\n\nĐiều 24. Xử phạt, trừ điểm giấy phép lái xe của người điều khiển xe ô tô thực hiện hành vi vi phạm quy định về vận chuyển động vật sống, thực phẩm tươi sống\n\n1. Phạt tiền từ 1.000.000 đồng đến 2.000.000 đồng đối với hành vi vi phạm vận chuyển động vật sống, thực phẩm tươi sống không mang đủ giấy tờ theo quy định (đối với loại động vật sống, thực phẩm tươi sống khi vận chuyển phải có giấy tờ).\n\n2. Phạt tiền từ 3.000.000 đồng đến 5.000.000 đồng đối với hành vi vi phạm vận chuyển thực phẩm tươi sống không chấp hành quy định về an toàn thực phẩm, vệ sinh dịch tễ, phòng dịch và bảo đảm vệ sinh môi trường theo quy định.\n\n3. Ngoài việc bị áp dụng hình thức xử phạt, người điều khiển phương tiện thực hiện hành vi vi phạm quy định tại khoản 2 Điều này còn bị trừ điểm giấy phép lái xe 02 điểm.\n\nĐiều 25. Xử phạt, trừ điểm giấy phép lái xe của người điều khiển xe vệ sinh môi trường, xe ô tô chở phế thải thực hiện hành vi vi phạm quy định về hoạt động vận tải trong đô thị\n\n1. Phạt tiền từ 2.000.000 đồng đến 3.000.000 đồng đối với hành vi điều khiển xe không chạy đúng tuyến, phạm vi, thời gian quy định.\n\n2. Ngoài việc bị áp dụng hình thức xử phạt, người điều khiển phương tiện thực hiện hành vi vi phạm quy định tại khoản 1 Điều này còn bị trừ điểm giấy phép lái xe 02 điểm.\n\nĐiều 26. Xử phạt các hành vi vi phạm quy định về trật tự, an toàn giao thông đường bộ trong vận tải đường bộ, dịch vụ hỗ trợ vận tải đường bộ\n\n1. Phạt tiền từ 500.000 đồng đến 1.000.000 đồng đối với cá nhân, từ 1.000.000 đồng đến 2.000.000 đồng đối với tổ chức thực hiện một trong các hành vi vi phạm sau đây:\n\na) Xếp hàng hóa lên mỗi xe ô tô (kể cả rơ moóc và sơ mi rơ moóc) vượt quá trọng tải (khối lượng hàng chuyên chở) cho phép tham gia giao thông được ghi trong giấy chứng nhận kiểm định an toàn kỹ thuật và bảo vệ môi trường của xe trên 10% đến 50% (trừ xe xi téc chở chất lỏng), trên 20% đến 50% đối với xe xi téc chở chất lỏng;\n\nb) Xếp hàng hóa lên xe ô tô mà không ký xác nhận việc xếp hàng hóa vào giấy vận tải theo quy định.\n\n2. Phạt tiền từ 1.000.000 đồng đến 2.000.000 đồng đối với cá nhân, từ 2.000.000 đồng đến 4.000.000 đồng đối với tổ chức kinh doanh vận tải, dịch vụ hỗ trợ vận tải thực hiện một trong các hành vi vi phạm sau đây:\n\na) Không đánh số thứ tự ghế ngồi, giường nằm trên xe ô tô chở hành khách theo quy định;\n\nb) Sử dụng xe ô tô kinh doanh vận tải hành khách theo tuyến cố định, xe ô tô kinh doanh vận tải hành khách bằng xe buýt không có chỗ ưu tiên cho người khuyết tật, người cao tuổi và phụ nữ mang thai theo quy định;\n\nc) Sử dụng xe ô tô kinh doanh vận tải hành khách không có hướng dẫn cho hành khách về an toàn giao thông, thoát hiểm khi xảy ra sự cố trên xe theo quy định;\n\nd) Không bố trí người áp tải trên xe vận chuyển hàng hóa nguy hiểm đối với những trường hợp quy định phải có người áp tải;\n\nđ) Không cấp lệnh vận chuyển, giấy vận tải cho lái xe hoặc cấp lệnh vận chuyển, giấy vận tải nhưng không đúng theo quy định (đối với loại xe quy định phải cấp lệnh vận chuyển, giấy vận tải);\n\ne) Sử dụng xe vận chuyển hàng hóa nguy hiểm mà không làm sạch hoặc không bóc (xóa) biểu trưng nguy hiểm trên phương tiện khi không tiếp tục vận chuyển loại hàng hóa đó.\n\n3. Phạt tiền từ 2.000.000 đồng đến 3.000.000 đồng đối với cá nhân, từ 4.000.000 đồng đến 6.000.000 đồng đối với tổ chức thực hiện hành vi vi phạm xếp hàng hóa lên mỗi xe ô tô (kể cả rơ moóc và sơ mi rơ moóc) vượt quá trọng tải (khối lượng hàng chuyên chở) cho phép tham gia giao thông được ghi trong giấy chứng nhận kiểm định an toàn kỹ thuật và bảo vệ môi trường của xe trên 50% đến 100%.\n\n4. Phạt tiền từ 3.000.000 đồng đến 4.000.000 đồng đối với cá nhân, từ 6.000.000 đồng đến 8.000.000 đồng đối với tổ chức kinh doanh vận tải, dịch vụ hỗ trợ vận tải thực hiện một trong các hành vi vi phạm sau đây:\n\na) Không cấp thẻ nhận dạng lái xe cho lái xe theo quy định;\n\nb) Sử dụng lái xe, nhân viên phục vụ trên xe để tham gia kinh doanh vận tải bằng xe ô tô mà không được tập huấn, hướng dẫn về nghiệp vụ vận tải hành khách và an toàn giao thông theo quy định (đối với hình thức kinh doanh vận tải có quy định lái xe, nhân viên phục vụ trên xe phải được tập huấn, hướng dẫn nghiệp vụ), trừ các hành vi vi phạm quy định tại điểm c, điểm d khoản này;\n\nc) Sử dụng lái xe, người quản lý trên xe để tham gia kinh doanh vận tải bằng xe ô tô mà không được hướng dẫn về quy trình bảo đảm an toàn khi đưa đón trẻ em mầm non, học sinh;\n\nd) Sử dụng lái xe, người áp tải vận chuyển hàng hóa nguy hiểm mà không được tập huấn về vận chuyển hàng hóa nguy hiểm;\n\nđ) Sử dụng xe ô tô kinh doanh vận tải hành khách không có dây đai an toàn tại các vị trí ghế ngồi, giường nằm theo quy định (trừ xe buýt nội tỉnh);\n\ne) Sử dụng xe ô tô kinh doanh vận tải chở trẻ em mầm non, học sinh tiểu học, xe ô tô kinh doanh vận tải kết hợp với hoạt động đưa đón trẻ em mầm non, học sinh tiểu học không có dây đai an toàn phù hợp với lứa tuổi hoặc không có ghế ngồi phù hợp với lứa tuổi theo quy định;\n\ng) Không thực hiện việc niêm yết thông tin trên xe theo quy định hoặc có niêm yết nhưng không chính xác, không đầy đủ thông tin theo quy định.\n\n5. Phạt tiền từ 4.000.000 đồng đến 5.000.000 đồng đối với cá nhân, từ 8.000.000 đồng đến 10.000.000 đồng đối với tổ chức xếp hàng hóa lên mỗi xe ô tô (kể cả rơ moóc và sơ mi rơ moóc) vượt quá trọng tải (khối lượng hàng chuyên chở) cho phép tham gia giao thông được ghi trong giấy chứng nhận kiểm định an toàn kỹ thuật và bảo vệ môi trường của xe trên 100%.\n\n6. Phạt tiền từ 4.000.000 đồng đến 6.000.000 đồng đối với cá nhân, từ 8.000.000 đồng đến 12.000.000 đồng đối với tổ chức kinh doanh vận tải thực hiện một trong các hành vi vi phạm sau đây:\n\na) Sử dụng xe vận chuyển động vật sống không có kết cấu phù hợp với loại động vật chuyên chở theo quy định;\n\nb) Sử dụng xe ô tô kinh doanh vận tải chở trẻ em mầm non, học sinh, xe ô tô kinh doanh vận tải kết hợp với hoạt động đưa đón trẻ em mầm non, học sinh không có thiết bị ghi nhận hình ảnh trẻ em mầm non, học sinh hoặc không có thiết bị có chức năng cảnh báo, chống bỏ quên trẻ em trên xe hoặc không có thiết bị ghi nhận hình ảnh trẻ em mầm non, học sinh và thiết bị có chức năng cảnh báo, chống bỏ quên trẻ em trên xe;\n\nc) Sử dụng xe ô tô kinh doanh vận tải chở trẻ em mầm non, học sinh không có màu sơn theo quy định;\n\nd) Sử dụng xe ô tô kinh doanh vận tải chở trẻ em mầm non, học sinh, xe ô tô kinh doanh vận tải kết hợp với hoạt động đưa đón trẻ em mầm non, học sinh không có biển báo dấu hiệu nhận biết là xe chở trẻ em mầm non, học sinh theo quy định.\n\n7. Phạt tiền từ 5.000.000 đồng đến 6.000.000 đồng đối với cá nhân, từ 10.000.000 đồng đến 12.000.000 đồng đối với tổ chức kinh doanh vận tải, dịch vụ hỗ trợ vận tải thực hiện một trong các hành vi vi phạm sau đây:\n\na) Không thực hiện việc cung cấp, cập nhật, truyền, lưu trữ, quản lý thông tin, dữ liệu từ thiết bị giám sát hành trình theo quy định;\n\nb) Không thực hiện đúng nội dung thông tin đã niêm yết trên xe theo quy định;']","**Nguồn văn bản:** /content/drive/MyDrive/ITProject_data/new_law/168_2024_ND-CP_619502.docx

**Tên văn bản:** (Không có tiêu đề trong metadata)


**Nội dung:**

5. Phạt tiền từ 12.000.000 đồng đến 14.000.000 đồng đối với hành vi vận chuyển hàng hóa nguy hiểm không có giấy phép vận chuyển hàng hóa nguy hiểm hoặc có nhưng hết hiệu lực hoặc không thực hiện đúng quy định trong giấy phép vận chuyển hàng hóa nguy hiểm, trừ các hành vi vi phạm quy định tại điểm a khoản 6 Điều 20 của Nghị định này.

6. Ngoài việc bị áp dụng hình thức xử phạt, người thực hiện hành vi vi phạm quy định tại khoản 4, khoản 5 Điều này nếu gây ô nhiễm môi trường còn bị áp dụng các biện pháp khắc phục hậu quả buộc thực hiện các biện pháp khắc phục tình trạng ô nhiễm môi trường do vi phạm hành chính gây ra.

7. Ngoài việc bị áp dụng hình thức xử phạt, người điều khiển phương tiện thực hiện hành vi vi phạm còn bị trừ điểm giấy phép lái xe như sau:

    a) Thực hiện hành vi quy định tại khoản 3, khoản 4 Điều này bị trừ điểm giấy phép lái xe 02 điểm.

    b) Thực hiện hành vi quy định tại khoản 5 Điều này bị trừ điểm giấy phép lái xe 04 điểm.


2. Phạt tiền từ 1.000.000 đồng đến 2.000.000 đồng đối với cá nhân, từ 2.000.000 đồng đến 4.000.000 đồng đối với tổ chức kinh doanh vận tải, dịch vụ hỗ trợ vận tải thực hiện một trong các hành vi vi phạm sau đây:
    
    d) Không bố trí người áp tải trên xe vận chuyển hàng hóa nguy hiểm đối với những trường hợp quy định phải có người áp tải.

    e) Sử dụng xe vận chuyển hàng hóa nguy hiểm mà không làm sạch hoặc không bóc (xóa) biểu trưng nguy hiểm trên phương tiện khi không tiếp tục vận chuyển loại hàng hóa đó.

4. Phạt tiền từ 3.000.000 đồng đến 4.000.000 đồng đối với cá nhân, từ 6.000.000 đồng đến 8.000.000 đồng đối với tổ chức kinh doanh vận tải, dịch vụ hỗ trợ vận tải thực hiện một trong các hành vi vi phạm sau đây:

    d) Sử dụng lái xe, người áp tải vận chuyển hàng hóa nguy hiểm mà không được tập huấn về vận chuyển hàng hóa nguy hiểm.


Tóm lại: Vận chuyển hàng hóa nguy hiểm phải có giấy phép, tuân thủ quy định trong giấy phép, bố trí người áp tải đã qua tập huấn khi cần thiết, làm sạch hoặc bóc (xóa) biểu trưng nguy hiểm sau khi vận chuyển.  Vi phạm sẽ bị phạt tiền từ 1.000.000 đồng đến 14.000.000 đồng tùy theo mức độ vi phạm và bị trừ điểm giấy phép lái xe. Nếu gây ô nhiễm môi trường còn phải khắc phục hậu quả.
","**Nguồn văn bản:** 36_2024_QH15_444251

**Tên văn bản:** Luật Trật tự, an toàn giao thông đường bộ

**Điều 51:** Bảo đảm trật tự, an toàn giao thông đường bộ đối với phương tiện giao thông đường bộ vận chuyển hàng hoá nguy hiểm

**Nội dung:**

1. Hàng hóa nguy hiểm là hàng hóa có chứa các chất hoặc vật phẩm nguy hiểm khi chở trên đường bộ có khả năng gây nguy hại tới tính mạng, sức khỏe con người, môi trường, an toàn và an ninh quốc gia.

2. Việc vận chuyển hàng hoá nguy hiểm phải có giấy phép vận chuyển; trong trường hợp cần thiết, đơn vị vận chuyển hàng hoá nguy hiểm phải bố trí người áp tải để bảo đảm trật tự, an toàn giao thông đường bộ.

3. Xe ô tô vận chuyển hàng hoá nguy hiểm phải dán biểu trưng nhận diện hàng hóa nguy hiểm; lắp đèn, tín hiệu cảnh báo.

4. Người lái xe hoặc người áp tải vận chuyển hàng hóa nguy hiểm phải được tập huấn về vận chuyển hàng hóa nguy hiểm.

5. Cơ quan cấp giấy phép vận chuyển hàng hóa nguy hiểm có trách nhiệm gửi thông báo ngay đến cơ quan cảnh sát giao thông bộ công an và cơ quan cảnh sát giao thông thực hiện nhiệm vụ bảo đảm trật tự, an toàn giao thông trên tuyến đường, đoạn đường mà phương tiện đi qua để chỉ huy, điều khiển giao thông đường bộ, kiểm tra, kiểm soát, xử lý vi phạm pháp luật, bảo đảm trật tự, an toàn giao thông đường bộ.

6. Chính phủ quy định chi tiết điều này.

**Tóm lại:** Vận chuyển hàng nguy hiểm phải có giấy phép, xe phải có biểu trưng, người lái xe và người áp tải phải được tập huấn, đồng thời cơ quan cấp phép phải thông báo cho cảnh sát giao thông.
",1.0,0.6323057879111635,0.18181818181818182,0.0
28,Luật Giao thông Đường bộ 2025 có quy định gì về việc nghỉ ngơi của tài xế xe tải?,"['đ) Không được để các chủ phương tiện kinh doanh vận tải sử dụng bãi đỗ xe để đón, trả khách hoặc xếp, dỡ hàng hóa, đóng gói, sang tải hàng hóa;\n\ne) Từ chối phục vụ đối với chủ phương tiện giao thông đường bộ không chấp hành nội quy bãi đỗ xe;\n\ng) Chịu sự kiểm tra, giám sát của cơ quan nhà nước có thẩm quyền.\n\nĐiều 74. Dịch vụ đại lý vận tải hàng hóa\n\n1. Đơn vị kinh doanh dịch vụ đại lý vận tải hàng hóa được thành lập theo quy định của pháp luật về doanh nghiệp, pháp luật về hợp tác xã.\n\n2. Dịch vụ đại lý vận tải hàng hóa là việc tổ chức, cá nhân được đơn vị kinh doanh vận tải thuê thực hiện một hoặc nhiều công đoạn trong quá trình vận tải, trừ công đoạn trực tiếp điều hành phương tiện và người lái xe hoặc quyết định giá cước vận tải.\n\n3. Đơn vị kinh doanh dịch vụ đại lý vận tải hàng hóa được hưởng tiền công dịch vụ đại lý vận tải theo thoả thuận với đơn vị kinh doanh vận tải.\n\n4. Đơn vị kinh doanh dịch vụ đại lý vận tải hàng hóa khi xếp, dỡ hàng hóa trên xe phải tuân thủ quy định của Luật này và quy định khác của pháp luật có liên quan.\n\nĐiều 75. Dịch vụ đại lý bán vé\n\n1. Đơn vị kinh doanh dịch vụ đại lý bán vé được thành lập theo quy định của pháp luật về doanh nghiệp, pháp luật về hợp tác xã.\n\n2. Đơn vị kinh doanh dịch vụ đại lý bán vé phải có hợp đồng đại lý bán vé với đơn vị kinh doanh vận tải hành khách bằng xe buýt, đơn vị kinh doanh vận tải theo tuyến cố định.\n\n3. Đơn vị kinh doanh vận tải và đơn vị kinh doanh dịch vụ đại lý bán vé không được tổ chức đón, trả khách tại địa điểm đặt đại lý bán vé, trừ trường hợp đại lý bán vé được đặt tại bến xe khách.\n\nĐiều 76. Dịch vụ thu gom hàng, chuyển tải, kho bãi hàng hóa trong hoạt động vận tải đường bộ\n\n1. Đơn vị kinh doanh dịch vụ đại lý thu gom hàng, dịch vụ chuyển tải, dịch vụ kho bãi hàng hóa được thành lập theo quy định của pháp luật về doanh nghiệp, pháp luật về hợp tác xã.\n\n2. Đơn vị kinh doanh dịch vụ đại lý thu gom hàng, dịch vụ chuyển tải, dịch vụ kho bãi hàng hóa phải bảo quản hàng hóa theo quy định của chủ hàng và phải có hợp đồng về việc thu gom hàng, chuyển tải hàng hoặc cho thuê kho bãi hàng hóa với chủ hàng.\n\n3. Việc xếp hàng hóa lên xe ô tô phải tuân thủ quy định của Luật này và quy định khác của pháp luật có liên quan.\n\nĐiều 77. Dịch vụ xếp, dỡ hàng hóa trên phương tiện tham gia giao thông đường bộ\n\n1. Đơn vị kinh doanh dịch vụ xếp, dỡ hàng hóa trên phương tiện tham gia giao thông đường bộ được thành lập theo quy định của pháp luật về doanh nghiệp, pháp luật về hợp tác xã.\n\n2. Việc xếp hàng hóa trên phương tiện không được vượt quá khối lượng hàng hóa chuyên chở cho phép tham gia giao thông được ghi trong giấy chứng nhận kiểm định an toàn kỹ thuật và bảo vệ môi trường của phương tiện giao thông đường bộ và thực hiện quy định của pháp luật về trật tự, an toàn giao thông đường bộ.\n\n3. Người xếp hàng hóa chịu trách nhiệm khi vi phạm các quy định về xếp hàng hóa trên xe ô tô.\n\n4. Người xếp, dỡ hàng hóa chịu trách nhiệm bồi thường mất mát, hư hỏng hàng hóa theo quy định của pháp luật.\n\nĐiều 78. Dịch vụ cho thuê phương tiện giao thông cơ giới đường bộ\n\n1. Dịch vụ cho thuê phương tiện giao thông cơ giới đường bộ bao gồm:\n\na) Dịch vụ cho thuê phương tiện để tự lái là việc tổ chức, cá nhân cho thuê xe ô tô chở người dưới 08 chỗ (không kể chỗ của người lái xe), xe gắn máy, xe mô tô hai bánh, xe mô tô ba bánh để người thuê xe tự điều khiển phương tiện;\n\nb) Dịch vụ cho thuê phương tiện để kinh doanh vận tải, vận tải nội bộ là việc tổ chức, cá nhân cho thuê xe ô tô (không bao gồm thuê người lái xe) để bên thuê xe tổ chức hoạt động kinh doanh vận tải bằng xe ô tô hoặc vận tải nội bộ.\n\n2. Đơn vị kinh doanh cho thuê phương tiện để tự lái phải đáp ứng các yêu cầu sau đây:\n\na) Chỉ được cho thuê phương tiện khi người thuê có giấy phép lái xe đang còn điểm, còn hiệu lực phù hợp với loại xe cho thuê;\n\nb) Không được bố trí lái xe cho người thuê phương tiện;\n\nc) Phải ký kết hợp đồng cho thuê phương tiện để tự lái với người thuê kèm theo bản phô tô giấy phép lái xe của người thuê.\n\n3. Người thuê phương tiện để tự lái không được sử dụng phương tiện đi thuê để vận tải hành khách, hàng hóa có thu tiền.\n\n4. Đơn vị kinh doanh dịch vụ cho thuê phương tiện để kinh doanh vận tải bằng xe ô tô, vận tải nội bộ phải đáp ứng các yêu cầu sau đây:\n\na) Được thành lập theo quy định của pháp luật về doanh nghiệp, pháp luật về hợp tác xã. Đối với nhà cung cấp dịch vụ nước ngoài chỉ được cung cấp dịch vụ thông qua thành lập liên doanh với đối tác Việt Nam theo tỷ lệ vốn góp theo quy định của điều ước quốc tế mà nước Cộng hòa xã hội chủ nghĩa Việt Nam là thành viên và quy định của pháp luật có liên quan;\n\nb) Phải ký kết hợp đồng cho thuê phương tiện không kèm người lái xe với bên thuê.\n\nĐiều 79. Dịch vụ cứu hộ giao thông đường bộ\n\n1. Tổ chức, cá nhân kinh doanh dịch vụ cứu hộ giao thông đường bộ phải đáp ứng các yêu cầu sau đây:\n\na) Được thành lập theo quy định của pháp luật về doanh nghiệp, pháp luật về hợp tác xã;\n\nb) Phải bảo đảm an toàn giao thông, an toàn lao động trong quá trình thực hiện cứu hộ;\n\nc) Không được sử dụng xe cứu hộ để kinh doanh vận tải hàng hóa bằng xe ô tô.\n\n2. Tổ chức, cá nhân kinh doanh dịch vụ cứu hộ giao thông đường bộ có trách nhiệm thực hiện quy định của pháp luật về trật tự, an toàn giao thông đường bộ.\n\nĐiều 80. Dịch vụ phần mềm hỗ trợ kết nối vận tải bằng xe ô tô\n\n1. Phần mềm hỗ trợ kết nối vận tải bằng xe ô tô là giao thức kết nối giữa đơn vị kinh doanh vận tải, người lái xe với hành khách hoặc người thuê vận tải diễn ra trong môi trường điện tử.\n\n2. Tổ chức, cá nhân kinh doanh vận tải bằng xe ô tô sử dụng phần mềm hỗ trợ kết nối vận tải bằng xe ô tô phải tuân thủ các quy định về kinh doanh, điều kiện kinh doanh vận tải bằng xe ô tô, pháp luật về giao dịch điện tử và quy định khác của pháp luật có liên quan.\n\n3. Tổ chức, cá nhân cung cấp dịch vụ phần mềm hỗ trợ kết nối vận tải bằng xe ô tô cho các đơn vị kinh doanh vận tải bằng xe ô tô phải tuân thủ quy định của pháp luật về thương mại điện tử, pháp luật về giao dịch điện tử và quy định khác của pháp luật có liên quan.\n\nChương V\n\nQUẢN LÝ NHÀ NƯỚC VỀ HOẠT ĐỘNG ĐƯỜNG BỘ\n\nĐiều 81. Nội dung quản lý nhà nước về hoạt động đường bộ\n\n1. Xây dựng, ban hành hoặc trình cơ quan có thẩm quyền ban hành và tổ chức thực hiện chính sách, pháp luật; quy chuẩn, tiêu chuẩn kỹ thuật, định mức kinh tế - kỹ thuật về hoạt động đường bộ.\n\n2. Xây dựng, ban hành và tổ chức thực hiện quy hoạch, kế hoạch về hoạt động đường bộ.\n\n3. Tuyên truyền, phổ biến, giáo dục pháp luật trong hoạt động đường bộ.\n\n4. Đầu tư, xây dựng, quản lý, vận hành, khai thác, bảo trì, bảo vệ kết cấu hạ tầng đường bộ.\n\n5. Quản lý vận tải và dịch vụ hỗ trợ vận tải đường bộ.\n\n6. Tổ chức nghiên cứu, ứng dụng khoa học và công nghệ; đào tạo, bồi dưỡng nguồn nhân lực trong hoạt động đường bộ.\n\n7. Kiểm tra, thanh tra, giải quyết khiếu nại, tố cáo; xử lý vi phạm pháp luật trong hoạt động đường bộ.\n\n8. Hợp tác quốc tế trong hoạt động đường bộ.\n\nĐiều 82. Trách nhiệm quản lý nhà nước về hoạt động đường bộ\n\n1. Chính phủ thống nhất quản lý nhà nước về hoạt động đường bộ.\n\n2. Bộ Giao thông vận tải là cơ quan chịu trách nhiệm giúp Chính phủ thực hiện quản lý nhà nước về hoạt động đường bộ.\n\n3. Bộ, cơ quan ngang Bộ, trong phạm vi nhiệm vụ, quyền hạn của mình, có trách nhiệm chủ trì, phối hợp với Bộ Giao thông vận tải thực hiện quản lý nhà nước về hoạt động đường bộ.\n\n4. Ủy ban nhân dân các cấp, trong phạm vi nhiệm vụ, quyền hạn của mình, có trách nhiệm tổ chức thực hiện quản lý nhà nước về hoạt động đường bộ.\n\nĐiều 83. Thanh tra đường bộ\n\nThanh tra đường bộ có nhiệm vụ sau đây:\n\n1. Thanh tra, kiểm tra, xử lý vi phạm pháp luật về kết cấu hạ tầng đường bộ; vận tải đường bộ tại đơn vị vận tải, bến xe, bãi đỗ xe, trạm dừng nghỉ, đơn vị thực hiện dịch vụ hỗ trợ vận tải;']","**Nguồn văn bản:** /content/drive/MyDrive/ITProject_data/new_law/35_2024_QH15_588811.docx

**Tên văn bản:** (Không có tiêu đề trong metadata)


**Nội dung:**
đ) Không được để các chủ phương tiện kinh doanh vận tải sử dụng bãi đỗ xe để đón, trả khách hoặc xếp, dỡ hàng hóa, đóng gói, sang tải hàng hóa.

e) Từ chối phục vụ đối với chủ phương tiện giao thông đường bộ không chấp hành nội quy bãi đỗ xe.

g) Chịu sự kiểm tra, giám sát của cơ quan nhà nước có thẩm quyền.

Điều 74. Dịch vụ đại lý vận tải hàng hóa

1. Đơn vị kinh doanh dịch vụ đại lý vận tải hàng hóa được thành lập theo quy định của pháp luật về doanh nghiệp, pháp luật về hợp tác xã.

2. Dịch vụ đại lý vận tải hàng hóa là việc tổ chức, cá nhân được đơn vị kinh doanh vận tải thuê thực hiện một hoặc nhiều công đoạn trong quá trình vận tải, trừ công đoạn trực tiếp điều hành phương tiện và người lái xe hoặc quyết định giá cước vận tải.

3. Đơn vị kinh doanh dịch vụ đại lý vận tải hàng hóa được hưởng tiền công dịch vụ đại lý vận tải theo thoả thuận với đơn vị kinh doanh vận tải.

4. Đơn vị kinh doanh dịch vụ đại lý vận tải hàng hóa khi xếp, dỡ hàng hóa trên xe phải tuân thủ quy định của Luật này và quy định khác của pháp luật có liên quan.


Tóm lại: Đoạn văn bản được cung cấp không chứa thông tin về quy định nghỉ ngơi của tài xế xe tải.
","**Nguồn văn bản:** 158_2024_ND-CP_636875

**Tên văn bản:** Nghị định Quy định về hoạt động vận tải đường bộ

**Điều 11:** quy định về công tác bảo đảm an toàn trong hoạt động vận tải bằng xe ô tô, bằng xe bốn bánh có gắn động cơ

**Nội dung:**

3. Bộ phận quản lý an toàn tại đơn vị kinh doanh vận tải bằng xe ô tô, bằng xe bốn bánh có gắn động cơ trước khi giao nhiệm vụ vận chuyển mới cho người lái xe phải thực hiện các nhiệm vụ sau:

	a) Tổng hợp, phân tích các dữ liệu về hoạt động của từng phương tiện trong quá trình thực hiện nhiệm vụ vận chuyển thông qua thiết bị giám sát hành trình, thiết bị ghi nhận hình ảnh người lái xe (áp dụng đối với phương tiện thuộc đối tượng phải lắp) để chấn chỉnh, nhắc nhở và xử lý các trường hợp vi phạm.

	b) Tiếp nhận và giải quyết các đề xuất, phản ánh của người lái xe về các vấn đề liên quan đến an toàn giao thông.

	c) Phối hợp với bộ phận khác của đơn vị để bố trí xe và người lái xe thực hiện nhiệm vụ vận chuyển, bảo đảm thời gian lái xe liên tục, thời gian lái xe trong một ngày, trong một tuần, thời gian nghỉ ngơi của người lái xe theo quy định tại điều 64 Luật Trật tự, an toàn giao thông đường bộ.

7. Khi xe đang hoạt động trên đường

	a) Bộ phận quản lý an toàn giao thông hoặc người được giao nhiệm vụ quản lý an toàn giao thông trong đơn vị kinh doanh vận tải thực hiện các nhiệm vụ: thông qua dữ liệu từ thiết bị giám sát hành trình, khi phát hiện lái xe vi phạm quá thời gian lái xe liên tục, quá thời gian lái xe trong ngày, chạy sai hành trình, thiết bị giám sát hành trình không hoạt động thì kịp thời thông tin cho lái xe yêu cầu điều chỉnh, kịp thời khắc phục các sai phạm.

	b) Người lái xe phải chấp hành nghiêm các quy định về an toàn giao thông trong quá trình điều khiển phương tiện để vận chuyển hành khách, hàng hóa, chấp hành quy định về thời gian lái xe liên tục, thời gian lái xe trong một ngày, trong một tuần, quy định về tốc độ, hành trình chạy xe, thiết bị giám sát hành trình, thiết bị ghi nhận hình ảnh người lái xe (đối với loại phương tiện phải lắp) bảo đảm luôn hoạt động; báo cáo ngay thời gian, địa điểm và nguyên nhân khi xảy ra sự cố mất an toàn giao thông để đơn vị có biện pháp xử lý kịp thời.

13. Thời gian nghỉ giữa 2 lần lái xe liên tục như sau:

	a) Đối với lái xe ô tô taxi, xe ô tô buýt nội tỉnh tối thiểu là 05 phút.

	b) Đối với lái xe ô tô vận tải hành khách theo tuyến cố định, xe buýt liên tỉnh, xe ô tô vận tải hành khách theo hợp đồng, xe ô tô vận tải hàng hóa tối thiểu là 15 phút.


**Tóm lại:** Thời gian nghỉ ngơi của tài xế xe tải được quy định tại Điều 64 của Luật Trật tự, an toàn giao thông đường bộ.  Nghị định 158/2024/NĐ-CP yêu cầu đơn vị kinh doanh vận tải phải đảm bảo thời gian lái xe liên tục, thời gian lái xe trong ngày/tuần và thời gian nghỉ ngơi của tài xế theo quy định này. Cụ thể, thời gian nghỉ giữa 2 lần lái xe liên tục tối thiểu là 15 phút đối với lái xe ô tô vận tải hàng hóa.
",1.0,0.0,0.0,0.0
29,Quy định mới về việc sử dụng thiết bị giám sát hành trình trên xe ô tô kinh doanh vận tải là gì?,"['7. Phạt tiền từ 5.000.000 đồng đến 6.000.000 đồng đối với cá nhân, từ 10.000.000 đồng đến 12.000.000 đồng đối với tổ chức kinh doanh vận tải, dịch vụ hỗ trợ vận tải thực hiện một trong các hành vi vi phạm sau đây:\n\na) Không thực hiện việc cung cấp, cập nhật, truyền, lưu trữ, quản lý thông tin, dữ liệu từ thiết bị giám sát hành trình theo quy định;\n\nb) Không thực hiện đúng nội dung thông tin đã niêm yết trên xe theo quy định;\n\nc) Sử dụng phương tiện kinh doanh vận tải không lắp thiết bị giám sát hành trình của xe (đối với hình thức kinh doanh vận tải có quy định phương tiện phải lắp thiết bị) hoặc lắp thiết bị nhưng thiết bị không hoạt động, không đúng quy chuẩn theo quy định hoặc làm sai lệch dữ liệu của thiết bị giám sát hành trình của xe ô tô;\n\nd) Sử dụng xe trung chuyển chở hành khách không đúng quy định;\n\nđ) Sử dụng lái xe điều khiển xe khách giường nằm hai tầng, xe ô tô đưa đón trẻ em mầm non, học sinh chưa đủ số năm kinh nghiệm theo quy định;\n\ne) Sử dụng xe kinh doanh vận tải hành khách theo hợp đồng mà trên xe không có hợp đồng vận tải, danh sách hành khách kèm theo, thiết bị để truy cập nội dung hợp đồng điện tử và danh sách hành khách theo quy định hoặc có hợp đồng vận tải, danh sách hành khách, thiết bị để truy cập nhưng không bảo đảm yêu cầu theo quy định, chở người không có tên trong danh sách hành khách hoặc vận chuyển không đúng đối tượng theo quy định (đối với xe kinh doanh vận tải hành khách theo hợp đồng vận chuyển trẻ em mầm non, học sinh, sinh viên, cán bộ, công chức, viên chức, công nhân);\n\ng) Sử dụng xe ô tô kinh doanh vận tải không lắp thiết bị ghi nhận hình ảnh người lái xe theo quy định (đối với loại xe có quy định phải lắp thiết bị ghi nhận hình ảnh người lái xe) hoặc có lắp thiết bị ghi nhận hình ảnh người lái xe nhưng không ghi, không lưu trữ được dữ liệu trên xe trong quá trình xe tham gia giao thông theo quy định hoặc làm sai lệch dữ liệu của thiết bị ghi nhận hình ảnh người lái xe lắp trên xe ô tô;\n\nh) Không thực hiện việc cung cấp, cập nhật, truyền dẫn, lưu trữ, quản lý thông tin, dữ liệu thu thập từ thiết bị ghi nhận hình ảnh người lái xe lắp trên xe ô tô theo quy định;\n\ni) Sử dụng phương tiện kinh doanh vận tải có niên hạn sử dụng không bảo đảm điều kiện của hình thức kinh doanh đã đăng ký.\n\n8. Phạt tiền từ 10.000.000 đồng đến 12.000.000 đồng đối với cá nhân, từ 20.000.000 đồng đến 24.000.000 đồng đối với tổ chức kinh doanh vận tải, dịch vụ hỗ trợ vận tải thực hiện một trong các hành vi vi phạm sau đây:\n\na) Không tổ chức khám sức khỏe định kỳ cho lái xe theo quy định hoặc có tổ chức khám nhưng không đầy đủ các nội dung theo quy định;\n\nb) Vi phạm quy định về kinh doanh, điều kiện kinh doanh vận tải bằng xe ô tô để xảy ra tai nạn giao thông gây hậu quả từ mức nghiêm trọng trở lên;\n\nc) Sử dụng xe ô tô kinh doanh vận tải để đón, trả khách; nhận, trả hàng trên đường cao tốc.\n\n9. Phạt tiền từ 20.000.000 đồng đến 40.000.000 đồng đối với đơn vị sản xuất, lắp ráp, nhập khẩu thiết bị giám sát hành trình của xe ô tô, đơn vị cung cấp dịch vụ liên quan đến giám sát hành trình, ghi nhận hình ảnh người lái xe thực hiện một trong các hành vi sau:\n\na) Đơn vị sản xuất, lắp ráp, nhập khẩu thiết bị giám sát hành trình của xe ô tô không có nhân sự cho từng vị trí công việc theo quy định;\n\nb) Đơn vị sản xuất, lắp ráp, nhập khẩu thiết bị giám sát hành trình của xe ô tô không báo cáo về việc cập nhật, thay đổi phần mềm của thiết bị theo quy định.\n\n10. Phạt tiền từ 40.000.000 đồng đến 60.000.000 đồng đối với đơn vị sản xuất, lắp ráp, nhập khẩu thiết bị ghi nhận hình ảnh người lái xe lắp trên xe ô tô, đơn vị cung cấp dịch vụ liên quan đến giám sát hành trình, ghi nhận hình ảnh người lái xe thực hiện một trong các hành vi vi phạm sau đây:\n\na) Làm sai lệch thông tin, dữ liệu của thiết bị giám sát hành trình của xe ô tô;\n\nb) Làm sai lệch thông tin, dữ liệu của thiết bị ghi nhận hình ảnh người lái xe lắp trên xe ô tô.\n\n11. Phạt tiền từ 40.000.000 đồng đến 50.000.000 đồng đối với cá nhân, từ 80.000.000 đồng đến 100.000.000 đồng đối với tổ chức kinh doanh vận tải, dịch vụ hỗ trợ vận tải tái phạm hành vi quy định tại điểm a, điểm h khoản 7 Điều này.\n\n12. Ngoài việc bị phạt tiền, cá nhân, tổ chức thực hiện hành vi vi phạm quy định tại điểm c khoản 2; điểm a, điểm b, điểm đ, điểm g khoản 4; điểm b, điểm c, điểm d, điểm đ, điểm e, điểm g khoản 7; điểm c khoản 8 Điều này còn bị áp dụng các hình thức xử phạt bổ sung tước quyền sử dụng phù hiệu từ 01 tháng đến 03 tháng (nếu có hoặc đã được cấp) đối với xe vi phạm.\n\n13. Ngoài việc bị áp dụng hình thức xử phạt, cá nhân, tổ chức thực hiện hành vi vi phạm còn bị áp dụng các biện pháp khắc phục hậu quả sau đây:\n\na) Thực hiện hành vi quy định tại điểm a khoản 4 Điều này buộc cấp thẻ nhận dạng lái xe cho lái xe theo quy định;\n\nb) Thực hiện hành vi quy định tại điểm b, điểm c, điểm d khoản 4; điểm a khoản 8 Điều này buộc tổ chức tập huấn, hướng dẫn nghiệp vụ, quy trình hoặc tổ chức khám sức khỏe định kỳ cho lái xe và nhân viên phục vụ trên xe theo quy định;\n\nc) Thực hiện hành vi quy định tại điểm đ, điểm e khoản 4; điểm c, điểm g khoản 7 Điều này buộc lắp đặt thiết bị giám sát hành trình, thiết bị ghi nhận hình ảnh người lái xe, dây đai an toàn, ghế ngồi cho trẻ em mầm non, học sinh tiểu học trên xe theo đúng quy định;\n\nd) Thực hiện hành vi quy định tại điểm a, điểm h khoản 7; khoản 11 Điều này buộc cung cấp, cập nhật, truyền dẫn, lưu trữ, quản lý thông tin, dữ liệu thu thập từ thiết bị giám sát hành trình, thiết bị ghi nhận hình ảnh người lái xe lắp trên xe ô tô theo quy định;\n\nđ) Thực hiện hành vi quy định tại điểm c, điểm d khoản 6 Điều này buộc thực hiện đúng quy định về màu sơn, biển báo dấu hiệu nhận biết của xe.\n\n14. Ngoài việc bị áp dụng hình thức xử phạt, người điều khiển phương tiện thực hiện hành vi vi phạm còn bị trừ điểm giấy phép lái xe như sau:\n\na) Thực hiện hành vi quy định tại điểm đ khoản 2; điểm b, điểm c, điểm d khoản 6; điểm b, điểm c, điểm e, điểm i khoản 7 Điều này trong trường hợp cá nhân kinh doanh vận tải là người trực tiếp điều khiển phương tiện còn bị trừ điểm giấy phép lái xe 02 điểm;\n\nb) Thực hiện hành vi quy định tại điểm c khoản 8 Điều này trong trường hợp cá nhân kinh doanh vận tải là người trực tiếp điều khiển phương tiện còn bị trừ điểm giấy phép lái xe 06 điểm.\n\nĐiều 27. Xử phạt, trừ điểm giấy phép lái xe của người điều khiển xe ô tô kinh doanh vận tải chở trẻ em mầm non, học sinh, xe ô tô kinh doanh vận tải kết hợp với hoạt động đưa đón trẻ em mầm non, học sinh\n\n1. Phạt tiền từ 1.000.000 đồng đến 2.000.000 đồng đối với người điều khiển xe ô tô kinh doanh vận tải chở trẻ em mầm non, học sinh, xe ô tô kinh doanh vận tải kết hợp với hoạt động đưa đón trẻ em mầm non, học sinh thực hiện một trong các hành vi vi phạm sau đây:\n\na) Không hướng dẫn trẻ em mầm non, học sinh ngồi đúng vị trí quy định trong xe;\n\nb) Điều khiển xe ô tô kinh doanh vận tải chở trẻ em mầm non, học sinh tiểu học, xe ô tô kinh doanh vận tải kết hợp với hoạt động đưa đón trẻ em mầm non, học sinh tiểu học không có dây đai an toàn phù hợp với lứa tuổi hoặc không có ghế ngồi phù hợp với lứa tuổi theo quy định;\n\nc) Điều khiển xe không lắp thiết bị ghi nhận hình ảnh người lái xe hoặc có lắp thiết bị ghi nhận hình ảnh người lái xe nhưng không có tác dụng trong quá trình xe tham gia giao thông theo quy định hoặc làm sai lệch dữ liệu của thiết bị ghi nhận hình ảnh người lái xe lắp trên xe ô tô.\n\n2. Phạt tiền từ 2.000.000 đồng đến 3.000.000 đồng đối với hành vi điều khiển xe ô tô kinh doanh vận tải chở trẻ em mầm non, học sinh tiểu học, xe ô tô kinh doanh vận tải kết hợp với hoạt động đưa đón trẻ em mầm non, học sinh tiểu học không có hoặc không đủ người quản lý trên mỗi xe ô tô theo quy định tại khoản 3 Điều 46 của Luật Trật tự, an toàn giao thông đường bộ.\n\n3. Phạt tiền từ 3.000.000 đồng đến 5.000.000 đồng đối với người điều khiển xe ô tô kinh doanh vận tải chở trẻ em mầm non, học sinh, xe ô tô kinh doanh vận tải kết hợp với hoạt động đưa đón trẻ em mầm non, học sinh thực hiện một trong các hành vi vi phạm sau đây:']","**Nguồn văn bản:** /content/drive/MyDrive/ITProject_data/new_law/168_2024_ND-CP_619502.docx

**Tên văn bản:** (Không có tiêu đề trong metadata)


**Nội dung:**

7. Phạt tiền từ 5.000.000 đồng đến 6.000.000 đồng đối với cá nhân, từ 10.000.000 đồng đến 12.000.000 đồng đối với tổ chức kinh doanh vận tải, dịch vụ hỗ trợ vận tải thực hiện một trong các hành vi vi phạm sau đây:

	a) Không thực hiện việc cung cấp, cập nhật, truyền, lưu trữ, quản lý thông tin, dữ liệu từ thiết bị giám sát hành trình theo quy định.

	b) Không thực hiện đúng nội dung thông tin đã niêm yết trên xe theo quy định.

	c) Sử dụng phương tiện kinh doanh vận tải không lắp thiết bị giám sát hành trình của xe (đối với hình thức kinh doanh vận tải có quy định phương tiện phải lắp thiết bị) hoặc lắp thiết bị nhưng thiết bị không hoạt động, không đúng quy chuẩn theo quy định hoặc làm sai lệch dữ liệu của thiết bị giám sát hành trình của xe ô tô.

	d) Sử dụng xe trung chuyển chở hành khách không đúng quy định.

	đ) Sử dụng lái xe điều khiển xe khách giường nằm hai tầng, xe ô tô đưa đón trẻ em mầm non, học sinh chưa đủ số năm kinh nghiệm theo quy định.

	e) Sử dụng xe kinh doanh vận tải hành khách theo hợp đồng mà trên xe không có hợp đồng vận tải, danh sách hành khách kèm theo, thiết bị để truy cập nội dung hợp đồng điện tử và danh sách hành khách theo quy định hoặc có hợp đồng vận tải, danh sách hành khách, thiết bị để truy cập nhưng không bảo đảm yêu cầu theo quy định, chở người không có tên trong danh sách hành khách hoặc vận chuyển không đúng đối tượng theo quy định (đối với xe kinh doanh vận tải hành khách theo hợp đồng vận chuyển trẻ em mầm non, học sinh, sinh viên, cán bộ, công chức, viên chức, công nhân).

	g) Sử dụng xe ô tô kinh doanh vận tải không lắp thiết bị ghi nhận hình ảnh người lái xe theo quy định (đối với loại xe có quy định phải lắp thiết bị ghi nhận hình ảnh người lái xe) hoặc có lắp thiết bị ghi nhận hình ảnh người lái xe nhưng không ghi, không lưu trữ được dữ liệu trên xe trong quá trình xe tham gia giao thông theo quy định hoặc làm sai lệch dữ liệu của thiết bị ghi nhận hình ảnh người lái xe lắp trên xe ô tô.

	h) Không thực hiện việc cung cấp, cập nhật, truyền dẫn, lưu trữ, quản lý thông tin, dữ liệu thu thập từ thiết bị ghi nhận hình ảnh người lái xe lắp trên xe ô tô theo quy định.

	i) Sử dụng phương tiện kinh doanh vận tải có niên hạn sử dụng không bảo đảm điều kiện của hình thức kinh doanh đã đăng ký.


Tóm lại: Xe ô tô kinh doanh vận tải phải lắp đặt thiết bị giám sát hành trình hoạt động đúng quy định, cung cấp đầy đủ dữ liệu theo quy định. Các hành vi vi phạm như không lắp đặt, lắp đặt thiết bị không hoạt động, làm sai lệch dữ liệu, không cung cấp dữ liệu đều bị xử phạt hành chính.
","**Nguồn văn bản:** 36_2024_QH15_444251

**Tên văn bản:** Luật Trật tự, an toàn giao thông đường bộ

**Điều 35:** Điều kiện phương tiện tham gia giao thông đường bộ

**Nội dung:**

2. Xe ô tô kinh doanh vận tải phải lắp thiết bị giám sát hành trình. Xe ô tô chở người từ 08 chỗ trở lên (không kể chỗ của người lái xe) kinh doanh vận tải, xe ô tô đầu kéo, xe cứu thương phải lắp thiết bị giám sát hành trình và thiết bị ghi nhận hình ảnh người lái xe.


**Nguồn văn bản:** 151_2024_ND-CP_619564

**Tên văn bản:** Nghị định Quy định chi tiết một số điều và biện pháp thi hành luật trật tự, an toàn giao thông đường bộ

**Điều 27:** thiết bị giám sát hành trình lắp trên xe ô tô kinh doanh vận tải, xe ô tô đầu kéo, xe cứu thương, xe cứu hộ giao thông đường bộ

**Nội dung:**

1. Xe ô tô kinh doanh vận tải, xe ô tô đầu kéo, xe cứu thương, xe cứu hộ giao thông đường bộ phải lắp thiết bị giám sát hành trình bảo đảm yêu cầu kỹ thuật theo quy định của quy chuẩn kỹ thuật quốc gia về thiết bị giám sát hành trình và thiết bị ghi nhận hình ảnh người lái xe.

2. Thông tin, dữ liệu thu thập từ thiết bị giám sát hành trình lắp trên xe ô tô kinh doanh vận tải, xe ô tô đầu kéo, xe cứu thương, xe cứu hộ giao thông đường bộ phục vụ công tác bảo đảm an ninh, trật tự, an toàn giao thông đường bộ và xử lý hành vi vi phạm pháp luật, quản lý nhà nước về vận tải đường bộ và được kết nối, chia sẻ với Bộ Giao thông vận tải (Cục Đường bộ Việt Nam), Sở Giao thông vận tải các tỉnh, thành phố trực thuộc trung ương và các cơ quan có liên quan theo quy định của pháp luật.


**Tóm lại:** Xe ô tô kinh doanh vận tải phải lắp đặt thiết bị giám sát hành trình đạt chuẩn kỹ thuật quốc gia.  Đối với xe chở người từ 8 chỗ trở lên, xe đầu kéo và xe cứu thương thì phải lắp đặt cả thiết bị giám sát hành trình và thiết bị ghi nhận hình ảnh người lái. Dữ liệu từ thiết bị này được dùng để đảm bảo an ninh, trật tự, an toàn giao thông và được chia sẻ với các cơ quan chức năng.
",1.0,0.6491827299404404,0.4166666666666667,0.0
30,Luật Giao thông Đường bộ 2025 có quy định gì về việc sử dụng xe đạp điện trong khu vực đô thị?,"['Điều 6. Cơ sở dữ liệu đường bộ\n\n1. Cơ sở dữ liệu đường bộ được thiết kế, xây dựng, vận hành theo Khung kiến trúc tổng thể quốc gia số, bao gồm:\n\na) Cơ sở dữ liệu về quy hoạch mạng lưới đường bộ, quy hoạch kết cấu hạ tầng đường bộ;\n\nb) Cơ sở dữ liệu về tình hình đầu tư, xây dựng kết cấu hạ tầng đường bộ;\n\nc) Cơ sở dữ liệu về kết cấu hạ tầng đường bộ đã đưa vào khai thác;\n\nd) Cơ sở dữ liệu thanh toán điện tử giao thông đường bộ;\n\nđ) Cơ sở dữ liệu về hoạt động vận tải bằng xe ô tô, trừ cơ sở dữ liệu về hành trình của phương tiện giao thông đường bộ, hình ảnh người lái xe và cơ sở dữ liệu về quản lý thời gian điều khiển phương tiện của người lái xe theo quy định của pháp luật.\n\n2. Cơ sở dữ liệu đường bộ được kết nối, chia sẻ với cơ sở dữ liệu về trật tự, an toàn giao thông đường bộ và các cơ sở dữ liệu khác có liên quan.\n\n3. Chính phủ quy định chi tiết khoản 1 và khoản 2 Điều này; quy định việc thu thập, quản lý, khai thác thông tin trong cơ sở dữ liệu đường bộ.\n\nĐiều 7. Các hành vi bị nghiêm cấm\n\n1. Phá hoại kết cấu hạ tầng đường bộ; khai thác, sử dụng kết cấu hạ tầng đường bộ trái quy định của pháp luật.\n\n2. Đấu nối trái phép vào đường chính, đường nhánh; tháo dỡ, di chuyển trái phép hoặc làm sai lệch công trình đường bộ.\n\n3. Lấn, chiếm, sử dụng, xây dựng trái phép trong phạm vi bảo vệ kết cấu hạ tầng đường bộ.\n\n4. Lắp đặt, tháo dỡ, di chuyển, điều chỉnh, che khuất báo hiệu đường bộ trái quy định của pháp luật; gắn, treo, lắp vào báo hiệu đường bộ nội dung không liên quan tới ý nghĩa, mục đích của báo hiệu đường bộ hoặc làm sai lệch báo hiệu đường bộ.\n\n5. Kinh doanh vận tải bằng xe ô tô, bằng xe bốn bánh có gắn động cơ mà không có giấy phép kinh doanh vận tải theo quy định của pháp luật hoặc kinh doanh không đúng giấy phép.\n\n6. Lập điểm đón, trả khách, bốc dỡ hàng hóa trái quy định của pháp luật.\n\nChương II\n\nKẾT CẤU HẠ TẦNG ĐƯỜNG BỘ \n\nMục 1. PHÂN LOẠI, ĐẶT TÊN, SỐ HIỆU ĐƯỜNG BỘ\n\nĐiều 8. Phân loại đường bộ theo cấp quản lý\n\n1. Đường bộ theo cấp quản lý bao gồm: quốc lộ, đường tỉnh, đường huyện, đường xã, đường thôn, đường đô thị, đường chuyên dùng và được xác định như sau:\n\na) Quốc lộ là đường nối liền Thủ đô Hà Nội với trung tâm hành chính cấp tỉnh; đường nối liền các trung tâm hành chính cấp tỉnh; đường có vị trí quan trọng đối với sự phát triển kinh tế - xã hội, bảo đảm quốc phòng, an ninh của vùng, khu vực;\n\nb) Đường tỉnh là đường nằm trong địa bàn một tỉnh nối trung tâm hành chính của tỉnh với trung tâm hành chính của huyện; đường có vị trí quan trọng đối với sự phát triển kinh tế - xã hội của tỉnh;\n\nc) Đường huyện là đường nối trung tâm hành chính của huyện với trung tâm hành chính của xã, cụm xã hoặc trung tâm hành chính của huyện lân cận; đường có vị trí quan trọng đối với sự phát triển kinh tế - xã hội của huyện;\n\nd) Đường xã là đường nối trung tâm hành chính của xã với thôn, làng, ấp, bản, buôn, bon, phum, sóc (sau đây gọi là thôn) và điểm dân cư nông thôn hoặc đường nối với xã lân cận; đường có vị trí quan trọng đối với sự phát triển kinh tế - xã hội của xã;\n\nđ) Đường thôn là đường trong khu vực thôn, đường trục nối thôn với khu vực sản xuất nông nghiệp, lâm nghiệp và cơ sở sản xuất, kinh doanh khác trên địa bàn thôn;\n\ne) Đường đô thị là đường trong phạm vi địa giới hành chính nội thành, nội thị, bao gồm: đường cao tốc đô thị, đường phố, đường ngõ, ngách, kiệt, hẻm trong đô thị;\n\ng) Đường chuyên dùng là đường chuyên phục vụ giao thông cho một hoặc một số cơ quan, tổ chức, cá nhân và đường nội bộ.\n\n2. Đường địa phương bao gồm: đường tỉnh, đường đô thị, đường huyện, đường xã, đường thôn.\n\n3. Bộ Giao thông vận tải có trách nhiệm quản lý quốc lộ, trừ quốc lộ quy định tại điểm a khoản 4 Điều này và đường gom, đường bên quy định tại điểm c khoản 4 Điều này.\n\n4. Ủy ban nhân dân cấp tỉnh có trách nhiệm quản lý các loại đường sau đây:\n\na) Quản lý đường tỉnh, quốc lộ đi qua đô thị loại đặc biệt; quốc lộ khi được phân cấp; tuyến, đoạn tuyến quốc lộ đã hoàn thành việc đầu tư xây dựng tuyến tránh thay thế phù hợp với quy hoạch mạng lưới đường bộ; tuyến, đoạn tuyến quốc lộ không còn trong quy hoạch mạng lưới đường bộ, trừ trường hợp quốc lộ có yêu cầu đặc biệt về bảo đảm quốc phòng, an ninh; tuyến, đoạn tuyến quốc lộ được Thủ tướng Chính phủ giao trên cơ sở đề nghị của Ủy ban nhân dân cấp tỉnh để đáp ứng nhu cầu phát triển kinh tế - xã hội, bảo đảm lợi ích quốc gia, quốc phòng, an ninh, khả năng bố trí nguồn lực của địa phương; tuyến, đoạn tuyến quốc lộ đã được điều chuyển tài sản về Ủy ban nhân dân cấp tỉnh quản lý theo quy định của pháp luật về quản lý, sử dụng tài sản công;\n\nb) Quy định việc quản lý đường đô thị, đường huyện, đường xã, đường thôn;\n\nc) Quản lý đường gom, đường bên tách khỏi quốc lộ.\n\n5. Người quản lý, sử dụng đường bộ đối với đường chuyên dùng có trách nhiệm quản lý đường chuyên dùng theo quy định của Luật này và quy định khác của pháp luật có liên quan.\n\n6. Chính phủ quy định chi tiết Điều này.\n\nĐiều 9. Phân loại đường bộ theo chức năng phục vụ\n\n1. Đường chính là đường phục vụ giao thông chủ yếu trong khu vực, kết nối giao thông các khu vực, vùng.\n\n2. Đường nhánh là đường nối vào đường chính, có chức năng kết nối giao thông các khu vực hai bên đường chính; kết nối giao thông từ đường gom vào đường chính thông qua nút giao.\n\n3. Đường gom là đường để gom hệ thống đường giao thông nội bộ của các khu đô thị, công nghiệp, kinh tế, dân cư, thương mại - dịch vụ và các đường khác vào đường chính hoặc vào đường nhánh trước khi đấu nối vào đường chính. Đường gom có thể là đường bên theo quy định tại khoản 4 Điều này.\n\n4. Đường bên là đường được xây dựng bên cạnh các đoạn đường chính để ngăn cách giao thông khu vực hai bên đường với đường chính. Đường bên được tách khỏi đường chính hoặc ngăn cách với đường chính bằng dải phân cách, tường bảo vệ, rào chắn.\n\n5. Đường dành cho giao thông công cộng là đường phục vụ cho tất cả mọi người, phương tiện giao thông đường bộ theo quy định của Luật này và quy định khác của pháp luật có liên quan.\n\n6. Đường nội bộ là đường trong phạm vi khu chung cư, đô thị, công nghiệp, kinh tế, thương mại - dịch vụ, các cơ quan, tổ chức, đơn vị khác và chỉ phục vụ các đối tượng được phép vào, ra bên trong phạm vi các khu vực quy định tại khoản này.\n\n7. Đường dành riêng cho người đi bộ, người đi xe đạp và các đường khác.\n\nĐiều 10. Cấp kỹ thuật của đường bộ\n\n1. Cấp kỹ thuật của đường bộ phải được xác định trong dự án đầu tư xây dựng đường bộ. Việc thiết kế, thi công xây dựng đường bộ phải thực hiện đúng quy định về cấp kỹ thuật tuyến đường trong dự án đầu tư xây dựng đường bộ được duyệt; tuân thủ quy chuẩn, tiêu chuẩn kỹ thuật về cấp kỹ thuật của đường bộ.\n\n2. Cấp kỹ thuật của đường bộ được quy định trong các quy chuẩn, tiêu chuẩn thiết kế của đường bộ, bao gồm:\n\na) Đường cao tốc;\n\nb) Đường cấp I, II, III, IV, V, VI;\n\nc) Đường đô thị;\n\nd) Đường cấp A, B, C, D, đường khác.\n\n3. Cấp kỹ thuật của đường bộ quy định tại các điểm a, b và d khoản 2 Điều này thực hiện theo quy chuẩn kỹ thuật quốc gia do Bộ trưởng Bộ Giao thông vận tải ban hành và tiêu chuẩn kỹ thuật do cấp có thẩm quyền công bố.\n\n4. Cấp kỹ thuật của đường bộ quy định tại điểm c khoản 2 Điều này thực hiện theo quy chuẩn kỹ thuật quốc gia do Bộ trưởng Bộ Xây dựng ban hành và tiêu chuẩn kỹ thuật do cấp có thẩm quyền công bố.\n\nĐiều 11. Đặt tên, đổi tên, số hiệu đường bộ\n\n1. Việc đặt tên, số hiệu đường bộ được quy định như sau:\n\na) Tên đường bộ được đặt theo tên danh nhân, người có công với đất nước; di tích, sự kiện lịch sử, văn hóa; tên địa danh hoặc tên theo tập quán. Số hiệu đường bộ được đặt theo số tự nhiên hoặc số tự nhiên kèm theo chữ cái nếu cần thiết. Trường hợp đường đô thị trùng với đường khác thì sử dụng cả tên đường đô thị và tên, số hiệu của đường khác;']","Không tìm thấy thông tin liên quan tới câu hỏi này.
","Không tìm thấy thông tin liên quan tới câu hỏi này.
",0.0,0.0,0.0,0.0
31,Quy định mới về việc sử dụng xe máy trong khu vực cấm là gì?,"['BỘ QUỐC PHÒNG\n------- CỘNG HÒA XÃ HỘI CHỦ NGHĨA VIỆT NAM\nĐộc lập - Tự do - Hạnh phúc \n--------------- Số: 66/2024/TT-BQP Hà Nội, ngày 14 tháng 10 năm 2024\n\nTHÔNG TƯ\n\nQUY ĐỊNH VỀ KIỂM ĐỊNH AN TOÀN KỸ THUẬT VÀ BẢO VỆ MÔI TRƯỜNG XE CƠ GIỚI, XE MÁY CHUYÊN DÙNG THUỘC PHẠM VI QUẢN LÝ CỦA BỘ QUỐC PHÒNG\n\nCăn cứ Luật Trật tự, an toàn giao thông đường bộ ngày 27 tháng 6 năm 2024;\n\nCăn cứ Nghị định số 01/2022/NĐ-CP ngày 30 tháng 11 năm 2022 của Chính phủ quy định chức năng, nhiệm vụ, quyền hạn và cơ cấu tổ chức của Bộ Quốc phòng;\n\nTheo đề nghị của Chủ nhiệm Tổng cục Kỹ thuật;\n\nBộ trưởng Bộ Quốc phòng ban hành Thông tư quy định về kiểm định an toàn kỹ thuật và bảo vệ môi trường xe cơ giới, xe máy chuyên dùng thuộc phạm vi quản lý của Bộ Quốc phòng.\n\nChương I\n\nQUY ĐỊNH CHUNG\n\nĐiều 1. Phạm vi điều chỉnh\n\nThông tư này quy định về kiểm định an toàn kỹ thuật và bảo vệ môi trường xe cơ giới, xe máy chuyên dùng của các cơ quan, đơn vị, doanh nghiệp thuộc phạm vi quản lý của Bộ Quốc phòng sử dụng vào mục đích quốc phòng, an ninh.\n\nĐiều 2. Đối tượng áp dụng\n\nThông tư này áp dụng đối với các trung tâm, trạm kiểm định an toàn kỹ thuật xe - máy quân sự; các cơ quan, đơn vị, doanh nghiệp thuộc phạm vi quản lý của Bộ Quốc phòng, các tổ chức và cá nhân liên quan đến việc kiểm định an toàn kỹ thuật và bảo vệ môi trường xe cơ giới, xe máy chuyên dùng.\n\nĐiều 3. Giải thích từ ngữ\n\nTrong Thông tư này, các từ ngữ dưới đây được hiểu như sau:\n\n1. Doanh nghiệp thuộc phạm vi quản lý của Bộ Quốc phòng (sau đây viết gọn là doanh nghiệp) là doanh nghiệp trực tiếp phục vụ quốc phòng, an ninh hoặc doanh nghiệp kết hợp kinh tế với quốc phòng, an ninh theo quy định tại Nghị định số 16/2023/NĐ-CP ngày 25 tháng 4 năm 2023 của Chính phủ về tổ chức quản lý và hoạt động của doanh nghiệp trực tiếp phục vụ quốc phòng, an ninh và doanh nghiệp kết hợp kinh tế với quốc phòng, an ninh; sửa đổi quy định tại điểm g khoản 1 Điều 23 Nghị định số 47/2021/NĐ-CP ngày 01 tháng 4 năm 2021 của Chính phủ quy định chi tiết một số điều của Luật Doanh nghiệp.\n\n2. Xe cơ giới là xe được trang bị cho các cơ quan, đơn vị, doanh nghiệp do Bộ Quốc phòng trực tiếp đăng ký, quản lý, sử dụng vào mục đích quốc phòng, an ninh.\n\n3. Xe cơ giới của doanh nghiệp là xe cơ giới sử dụng vào mục đích quốc phòng, an ninh không thuộc trường hợp xe cơ giới quy định tại khoản 2 Điều này.\n\n4. Xe máy chuyên dùng gồm xe máy chuyên dùng quân sự, xe máy thi công; xe máy nông nghiệp, lâm nghiệp và các loại xe chuyên dùng khác có tham gia giao thông được trang bị cho các cơ quan, đơn vị trực thuộc Bộ Quốc phòng theo quy định tại Phụ lục VI kèm theo Thông tư này.\n\n5. Cơ sở kiểm định là các trung tâm, trạm kiểm định an toàn kỹ thuật xe - máy quân sự do Tổng Tham mưu trưởng quyết định thành lập.\n\n6. Kiểm định an toàn kỹ thuật và bảo vệ môi trường xe cơ giới, xe máy chuyên dùng (sau đây viết gọn là kiểm định) là việc kiểm tra, đánh giá lần đầu và định kỳ tình trạng an toàn kỹ thuật và bảo vệ môi trường của xe cơ giới, xe máy chuyên dùng theo các tiêu chuẩn, quy chuẩn, quy định của nhà nước và Bộ Quốc phòng.\n\n7. Chu kỳ kiểm định là khoảng thời gian giữa hai lần kiểm định được tính bằng tháng.\n\n8. Phiếu kiểm định là bản xác nhận kết quả kiểm định an toàn kỹ thuật và bảo vệ môi trường của từng xe cơ giới, xe máy chuyên dùng khi kiểm định.\n\n9. Giấy chứng nhận an toàn kỹ thuật và bảo vệ môi trường xe cơ giới, xe máy chuyên dùng (sau đây gọi là Giấy chứng nhận kiểm định) là bản xác nhận cho xe cơ giới, xe máy chuyên dùng đã được kiểm định đạt các tiêu chuẩn, quy chuẩn, quy định của nhà nước và Bộ Quốc phòng về an toàn kỹ thuật và bảo vệ môi trường, đủ điều kiện tham gia giao thông đường bộ.\n\n\n\n10. Tem kiểm định an toàn kỹ thuật và bảo vệ môi trường xe cơ giới, xe máy chuyên dùng (sau đây viết gọn là Tem kiểm định) là biểu trưng do các cơ sở kiểm định cấp, dán lên xe cơ giới, xe máy chuyên dùng sau khi đã được cấp Giấy chứng nhận kiểm định và được phép tham gia giao thông đường bộ theo thời hạn ghi trên Tem kiểm định.\n\n11. Chỉ huy cơ sở kiểm định là giám đốc, phó giám đốc trung tâm kiểm định; trạm trưởng trạm kiểm định thuộc Bộ Quốc phòng.\n\n12. Kiểm định viên là người có đủ trình độ, kỹ năng, kinh nghiệm được tập huấn (đào tạo); cấp Giấy chứng nhận, thẻ kiểm định viên theo quy định của nhà nước, Bộ Quốc phòng để thực hiện một phần hoặc toàn bộ việc kiểm định xe cơ giới, xe máy chuyên dùng.\n\n13. Chương trình quản lý kiểm định là hệ thống phần mềm do Cục Xe máy - Vận tải/Tổng cục Hậu cần - Kỹ thuật xây dựng để quản lý cơ sở dữ liệu kiểm định và công tác kiểm định xe cơ giới, xe máy chuyên dùng; được sử dụng tại các cơ sở kiểm định và Cục Xe máy - Vận tải/Tổng cục Hậu cần - Kỹ thuật.\n\nĐiều 4. Những hành vi nghiêm cấm\n\n1. Kiểm định không đủ nội dung, không đúng quy trình, quy định; làm sai lệch kết quả kiểm định.\n\n2. Sử dụng thiết bị kiểm tra bị hư hỏng; phương tiện đo, thiết bị kiểm tra chưa được kiểm định, hiệu chuẩn hoặc quá thời hạn sử dụng.\n\n3. Bố trí không đúng, không đủ kiểm định viên trên dây chuyền kiểm định.\n\n4. Tự ý in phôi Giấy chứng nhận kiểm định, Tem kiểm định để sử dụng.\n\n5. Sửa đổi các nội dung in, ghi trên Giấy chứng nhận kiểm định, Tem kiểm định; tự ý bóc, dán Tem kiểm định.\n\n6. Có hành vi tiêu cực, sách nhiễu trong quá trình kiểm định.\n\n7. Kiểm định, cấp Giấy chứng nhận kiểm định, dán Tem kiểm định cho xe cơ giới, xe máy chuyên dùng của doanh nghiệp: Hết niên hạn sử dụng, không nộp phí sử dụng đường bộ theo quy định của pháp luật.\n\nChương II\n\nQUY ĐỊNH VỀ KIỂM ĐỊNH\n\nĐiều 5. Đối tượng, thẩm quyền kiểm định\n\n1. Xe cơ giới, xe máy chuyên dùng phải được kiểm định bằng các trang thiết bị, dụng cụ kiểm định tại cơ sở kiểm định hoặc cơ động (trừ các trường hợp được miễn kiểm định lần đầu theo quy định tại Điều 11 Thông tư này).\n\n2. Việc cơ động kiểm định chỉ áp dụng đối với các cơ quan, đơn vị, doanh nghiệp ở vùng sâu, vùng xa, biên giới, hải đảo không có điều kiện đưa xe cơ giới, xe máy chuyên dùng đến cơ sở kiểm định (khoảng cách từ cơ quan, đơn vị, doanh nghiệp đến cơ sở kiểm định phải có bán kính lớn hơn 50 km); nhóm xe tác chiến; xe cứu thương, cứu hoả, xe làm nhiệm vụ cứu hộ, cứu nạn; xe quá khổ, quá tải không vào được dây chuyền kiểm định.\n\n3. Chỉ huy cơ sở kiểm định kết luận, ký tên, đóng dấu trên Phiếu kiểm định, Giấy chứng nhận kiểm định, Tem kiểm định và chịu trách nhiệm trước pháp luật về kết quả kiểm định.\n\nĐiều 6. Hồ sơ kiểm định lần đầu\n\n1. Xe cơ giới, xe máy chuyên dùng.\n\na) Công văn hoặc giấy giới thiệu đề nghị kiểm định do chỉ huy cơ quan, đơn vị cấp trung đoàn hoặc tương đương trở lên ký tên, đóng dấu theo quy định;\n\nb) Chứng nhận đăng ký xe, lý lịch xe (áp dụng đối với xe cơ giới, xe máy chuyên dùng đã đăng ký);\n\nc) Biển số tạm thời (áp dụng đối với xe cơ giới, xe máy chuyên dùng chưa hoàn thành thủ tục đăng ký);\n\nd) Bản sao Giấy chứng nhận chất lượng an toàn kỹ thuật xe cơ giới, xe máy chuyên dùng cải tạo (áp dụng đối với xe cơ giới, xe máy chuyên dùng cải tạo).\n\n2. Xe cơ giới, xe máy chuyên dùng của doanh nghiệp.\n\na) Công văn hoặc giấy giới thiệu đề nghị kiểm định do giám đốc hoặc phó giám đốc doanh nghiệp ký tên, đóng dấu theo quy định;\n\nb) Chứng nhận đăng ký xe;\n\nc) Bản sao Giấy chứng nhận chất lượng an toàn kỹ thuật và bảo vệ môi trường xe cơ giới, xe máy chuyên dùng (áp dụng đối với xe cơ giới, xe máy chuyên dùng nhập khẩu);\n\n\n\nd) Bản sao Phiếu kiểm tra chất lượng xuất xưởng (áp dụng đối với xe cơ giới, xe máy chuyên dùng sản xuất, lắp ráp trong nước);\n\nđ) Bản sao Giấy chứng nhận chất lượng an toàn kỹ thuật và bảo vệ môi trường xe cơ giới, xe máy chuyên dùng cải tạo (áp dụng đối với xe cơ giới, xe máy chuyên dùng cải tạo).\n\nĐiều 7. Hồ sơ kiểm định định kỳ\n\n1. Xe cơ giới, xe máy chuyên dùng: Thực hiện theo quy định tại các điểm a, b khoản 1 Điều 6 Thông tư này.\n\n2. Xe cơ giới, xe máy chuyên dùng của doanh nghiệp: Thực hiện theo quy định tại các điểm a, b khoản 2 Điều 6 Thông tư này.\n\n3. Lập hồ sơ kiểm định.']","**Nguồn văn bản:** /content/drive/MyDrive/ITProject_data/new_law/66_2024_TT-BQP_628579.docx

**Tên văn bản:** (Không có tiêu đề trong metadata)

**(Không có điều khoản trong metadata):**

**Nội dung:**
Không tìm thấy thông tin liên quan tới câu hỏi này. Văn bản này quy định về kiểm định an toàn kỹ thuật và bảo vệ môi trường xe cơ giới, xe máy chuyên dùng thuộc phạm vi quản lý của Bộ Quốc phòng, chứ không đề cập đến việc sử dụng xe máy trong khu vực cấm.

**Tóm lại:**  Văn bản không chứa thông tin về việc sử dụng xe máy trong khu vực cấm.
","**Nguồn văn bản:** 168_2024_ND-CP_619502

**Tên văn bản:** Nghị định Quy định xử phạt vi phạm hành chính về trật tự, an toàn giao thông trong lĩnh vực giao thông đường bộ; trừ điểm, phục hồi điểm giấy phép lái xe

**Điều 9:** Xử phạt người điều khiển xe đạp, xe đạp máy, người điều khiển xe thô sơ khác vi phạm quy tắc giao thông đường bộ

**Nội dung:**

3. Phạt tiền từ 300.000 đồng đến 400.000 đồng đối với người điều khiển xe thực hiện một trong các hành vi vi phạm sau đây:

	a) Điều khiển xe lạng lách, đánh võng; đuổi nhau trên đường.

	b) Đi xe bằng một bánh đối với xe đạp, xe đạp máy; đi xe bằng hai bánh đối với xe xích lô.

	c) Đi vào khu vực cấm, đường có biển báo hiệu nội dung cấm đi vào đối với loại phương tiện đang điều khiển; đi ngược chiều đường của đường một chiều, đường có biển “cấm đi ngược chiều"".

	d) Điều khiển xe trên đường mà trong máu hoặc hơi thở có nồng độ cồn vượt quá 50 miligam đến 80 miligam/100 mililít máu hoặc vượt quá 0,25 miligam đến 0,4 miligam/1 lít khí thở.


**Điều 6:** Xử phạt, trừ điểm giấy phép lái xe của người điều khiển xe ô tô, xe chở người bốn bánh có gắn động cơ, xe chở hàng bốn bánh có gắn động cơ và các loại xe tương tự xe ô tô vi phạm quy tắc giao thông đường bộ

**Nội dung:**
5. Phạt tiền từ 4.000.000 đồng đến 6.000.000 đồng đối với người điều khiển xe thực hiện một trong các hành vi vi phạm sau đây:
    
    a) Vượt xe trong những trường hợp không được vượt, vượt xe tại đoạn đường có biển báo hiệu có nội dung cấm vượt (đối với loại phương tiện đang điều khiển); không có tín hiệu trước khi vượt hoặc có tín hiệu vượt xe nhưng không sử dụng trong suốt quá trình vượt xe; vượt bên phải xe khác trong trường hợp không được phép.
    
    b) Điều khiển xe không đi bên phải theo chiều đi của mình; đi không đúng phần đường hoặc làn đường quy định (làn cùng chiều hoặc làn ngược chiều) trừ hành vi quy định tại điểm a khoản 4 điều này; điều khiển xe đi qua dải phân cách cố định ở giữa hai phần đường xe chạy.
    
    c) Tránh xe đi ngược chiều không đúng quy định (trừ hành vi vi phạm sử dụng đèn chiếu xa khi tránh xe đi ngược chiều quy định tại điểm b khoản 3 điều này); không nhường đường cho xe đi ngược chiều theo quy định tại nơi đường hẹp, đường dốc, nơi có chướng ngại vật.
    
    d) Không tuân thủ quy định khi vào hoặc ra đường cao tốc; điều khiển xe chạy ở làn dừng xe khẩn cấp hoặc phần lề đường của đường cao tốc; không tuân thủ quy định về khoảng cách an toàn đối với xe chạy liền trước khi chạy trên đường cao tốc.
    
    đ) Điều khiển xe chạy quá tốc độ quy định từ 10 km/h đến 20 km/h.
    
    e) Xe không được quyền ưu tiên lắp đặt, sử dụng thiết bị phát tín hiệu của xe được quyền ưu tiên.
    
    g) Chuyển làn đường không đúng nơi cho phép hoặc không có tín hiệu báo trước hoặc chuyển làn đường không đúng quy định “mỗi lần chuyển làn đường chỉ được phép chuyển sang một làn đường liền kề” khi chạy trên đường cao tốc.
    
    h) Dùng tay cầm và sử dụng điện thoại hoặc các thiết bị điện tử khác khi điều khiển phương tiện tham gia giao thông đang di chuyển trên đường bộ.
    
    i) Đi vào khu vực cấm, đường có biển báo hiệu có nội dung cấm đi vào đối với loại phương tiện đang điều khiển, trừ các hành vi vi phạm quy định tại điểm d khoản 9, điểm đ khoản 11 điều này, hành vi bị cấm đi vào công trình thủy lợi và các trường hợp xe ưu tiên đang đi làm nhiệm vụ khẩn cấp theo quy định.
    
    k) Dừng xe, đỗ xe, quay đầu xe trái quy định gây ùn tắc giao thông.
    
    l) Chuyển hướng không nhường quyền đi trước cho: người đi bộ, xe lăn của người khuyết tật qua đường tại nơi có vạch kẻ đường dành cho người đi bộ; xe thô sơ đang đi trên phần đường dành cho xe thô sơ.
    
    m) Chuyển hướng không nhường đường cho: các xe đi ngược chiều; người đi bộ, xe thô sơ đang qua đường tại nơi không có vạch kẻ đường cho người đi bộ.
    
    n) Không giảm tốc độ (hoặc dừng lại) và nhường đường khi điều khiển xe đi từ đường không ưu tiên ra đường ưu tiên, từ đường nhánh ra đường chính.
    
    o) Không giảm tốc độ và nhường đường cho xe đi đến từ bên phải tại nơi đường giao nhau không có báo hiệu đi theo vòng xuyến; không giảm tốc độ và nhường đường cho xe đi đến từ bên trái tại nơi đường giao nhau có báo hiệu đi theo vòng xuyến.
    
    p) Chở người trên thùng xe trái quy định; chở người trên nóc xe; để người đu bám ở cửa xe, bên ngoài thành xe khi xe đang chạy.
    
    q) Mở cửa xe, để cửa xe mở không bảo đảm an toàn.



**Tóm lại:** Đi xe máy vào khu vực cấm bị phạt từ 4.000.000 đồng đến 6.000.000 đồng theo điểm i khoản 5 Điều 6 Nghị định 168/2024/NĐ-CP.  Ngoài ra, người điều khiển xe máy cũng có thể bị phạt theo Điều 9 nếu vi phạm các quy định khác khi đi vào khu vực cấm.
",0.42857142857142855,0.7495170848434056,0.0,0.0
32,Luật Giao thông Đường bộ 2025 có quy định gì về việc sử dụng xe ô tô cá nhân trong giờ cao điểm?,"['6. Trường hợp tước quyền sử dụng giấy phép lái xe tích hợp giấy phép lái xe không thời hạn (xe mô tô, xe tương tự xe mô tô) và giấy phép lái xe có thời hạn (xe ô tô, xe tương tự xe ô tô, xe chở người bốn bánh có gắn động cơ, xe chở hàng bốn bánh có gắn động cơ) thì người có thẩm quyền xử phạt áp dụng tước quyền sử dụng đối với giấy phép lái xe không thời hạn khi người điều khiển xe mô tô, xe tương tự xe mô tô hoặc tước quyền sử dụng đối với giấy phép lái xe có thời hạn khi người điều khiển xe ô tô, xe tương tự xe ô tô, xe chở người bốn bánh có gắn động cơ, xe chở hàng bốn bánh có gắn động cơ thực hiện hành vi vi phạm hành chính có quy định bị tước quyền sử dụng giấy phép lái xe. Trong thời gian bị tước quyền sử dụng, người có giấy phép lái xe tích hợp được cấp, đổi giấy phép lái xe đối với giấy phép lái xe không bị tước quyền sử dụng.\n\n7. Trường hợp giấy phép, chứng chỉ hành nghề được cấp dưới dạng điện tử hoặc thể hiện dưới hình thức thông điệp dữ liệu thì cơ quan, người có thẩm quyền thực hiện tạm giữ, tước trên môi trường điện tử theo quy định nếu đáp ứng điều kiện về cơ sở hạ tầng, kỹ thuật, thông tin. Việc tạm giữ, tước quyền sử dụng được cập nhật trạng thái trên cơ sở dữ liệu, căn cước điện tử, tài khoản định danh điện tử và ứng dụng thông tin điện tử khác theo quy định.\n\nChương II\n\nHÀNH VI VI PHẠM, HÌNH THỨC, MỨC XỬ PHẠT, MỨC TRỪ ĐIỂM GIẤY PHÉP LÁI XE VÀ BIỆN PHÁP KHẮC PHỤC HẬU QUẢ VI PHẠM HÀNH CHÍNH VỀ TRẬT TỰ, AN TOÀN GIAO THÔNG TRONG LĨNH VỰC GIAO THÔNG ĐƯỜNG BỘ\n\nMục 1. VI PHẠM QUY TẮC GIAO THÔNG ĐƯỜNG BỘ\n\nĐiều 6. Xử phạt, trừ điểm giấy phép lái xe của người điều khiển xe ô tô, xe chở người bốn bánh có gắn động cơ, xe chở hàng bốn bánh có gắn động cơ và các loại xe tương tự xe ô tô vi phạm quy tắc giao thông đường bộ\n\n1. Phạt tiền từ 400.000 đồng đến 600.000 đồng đối với người điều khiển xe thực hiện một trong các hành vi vi phạm sau đây:\n\na) Không chấp hành hiệu lệnh, chỉ dẫn của biển báo hiệu, vạch kẻ đường, trừ các hành vi vi phạm quy định tại điểm a, điểm c, điểm d, điểm đ khoản 2; điểm a, điểm d, điểm đ, điểm e, điểm n, điểm o khoản 3; điểm a, điểm b, điểm đ, điểm e, điểm i, điểm k, điểm l khoản 4; điểm a, điểm b, điểm c, điểm d, điểm đ, điểm i, điểm k khoản 5; điểm a khoản 6; khoản 7; điểm b, điểm d khoản 9; điểm a khoản 10; điểm đ khoản 11 Điều này;\n\nb) Khi ra, vào vị trí dừng xe, đỗ xe không có tín hiệu báo cho người điều khiển phương tiện khác biết;\n\nc) Không báo hiệu bằng đèn khẩn cấp hoặc không đặt biển cảnh báo “Chú ý xe đỗ” theo quy định trong trường hợp gặp sự cố kỹ thuật (hoặc bất khả kháng khác) buộc phải đỗ xe chiếm một phần đường xe chạy hoặc tại nơi không được phép đỗ xe, trừ hành vi vi phạm quy định tại điểm c khoản 7 Điều này;\n\nd) Không gắn biển báo hiệu ở phía trước xe kéo, phía sau xe được kéo; điều khiển xe kéo rơ moóc không có biển báo hiệu theo quy định;\n\nđ) Sử dụng còi trong thời gian từ 22 giờ ngày hôm trước đến 05 giờ ngày hôm sau trong khu đông dân cư, khu vực cơ sở khám bệnh, chữa bệnh, trừ các xe ưu tiên đang đi làm nhiệm vụ theo quy định.\n\n2. Phạt tiền từ 600.000 đồng đến 800.000 đồng đối với người điều khiển xe thực hiện một trong các hành vi vi phạm sau đây:\n\na) Chuyển làn đường không đúng nơi cho phép hoặc không có tín hiệu báo trước hoặc chuyển làn đường không đúng quy định “mỗi lần chuyển làn đường chỉ được phép chuyển sang một làn đường liền kề”, trừ các hành vi vi phạm quy định tại điểm g khoản 5 Điều này;\n\nb) Chở người trên buồng lái quá số lượng quy định;\n\nc) Không tuân thủ các quy định về nhường đường tại nơi đường bộ giao nhau, trừ các hành vi vi phạm quy định tại điểm n, điểm o khoản 5 Điều này;\n\nd) Dừng xe, đỗ xe trên phần đường xe chạy ở đoạn đường ngoài đô thị nơi có lề đường rộng; dừng xe, đỗ xe không sát mép đường phía bên phải theo chiều đi ở nơi đường có lề đường hẹp hoặc không có lề đường; dừng xe, đỗ xe ngược với chiều lưu thông của làn đường; dừng xe, đỗ xe trên dải phân cách cố định ở giữa hai phần đường xe chạy; đỗ xe trên dốc không chèn bánh;\n\nđ) Dừng xe không sát theo lề đường, vỉa hè phía bên phải theo chiều đi hoặc bánh xe gần nhất cách lề đường, vỉa hè quá 0,25 mét; dừng xe trên đường dành riêng cho xe buýt; dừng xe trên miệng cống thoát nước, miệng hầm của đường điện thoại, điện cao thế, chỗ dành riêng cho xe chữa cháy lấy nước; rời vị trí lái, tắt máy khi dừng xe (trừ trường hợp rời khỏi vị trí lái để đóng, mở cửa xe, xếp dỡ hàng hóa, kiểm tra kỹ thuật xe) hoặc rời vị trí lái khi dừng xe nhưng không sử dụng phanh đỗ xe (hoặc thực hiện biện pháp an toàn khác); dừng xe, đỗ xe không đúng vị trí quy định ở những đoạn có bố trí nơi dừng xe, đỗ xe; dừng xe, đỗ xe trên phần đường dành cho người đi bộ qua đường; dừng xe nơi có biển “Cấm dừng xe và đỗ xe”, trừ hành vi vi phạm quy định tại điểm đ khoản 4, điểm c khoản 7 Điều này.\n\n3. Phạt tiền từ 800.000 đồng đến 1.000.000 đồng đối với người điều khiển xe thực hiện một trong các hành vi vi phạm sau đây:\n\na) Điều khiển xe chạy quá tốc độ quy định từ 05 km/h đến dưới 10 km/h;\n\nb) Sử dụng còi, rú ga liên tục; sử dụng còi hơi, sử dụng đèn chiếu xa khi gặp người đi bộ qua đường hoặc khi đi trên đoạn đường qua khu dân cư có hệ thống chiếu sáng đang hoạt động hoặc khi gặp xe đi ngược chiều (trừ trường hợp dải phân cách có khả năng chống chói) hoặc khi chuyển hướng xe tại nơi đường giao nhau, trừ các xe ưu tiên đang đi làm nhiệm vụ theo quy định;\n\nc) Chuyển hướng không quan sát hoặc không bảo đảm khoảng cách an toàn với xe phía sau hoặc không giảm tốc độ hoặc không có tín hiệu báo hướng rẽ hoặc có tín hiệu báo hướng rẽ nhưng không sử dụng liên tục trong quá trình chuyển hướng (trừ trường hợp điều khiển xe đi theo hướng cong của đoạn đường bộ ở nơi đường không giao nhau cùng mức);\n\nd) Không tuân thủ các quy định về dừng xe, đỗ xe tại nơi đường bộ giao nhau cùng mức với đường sắt; dừng xe, đỗ xe trong phạm vi bảo vệ công trình đường sắt, phạm vi an toàn của đường sắt;\n\nđ) Dừng xe, đỗ xe tại vị trí: nơi đường bộ giao nhau hoặc trong phạm vi 05 mét tính từ mép đường giao nhau; điểm đón, trả khách; trước cổng hoặc trong phạm vi 05 mét hai bên cổng trụ sở cơ quan, tổ chức có bố trí đường cho xe ra, vào; nơi phần đường có bề rộng chỉ đủ cho một làn xe cơ giới; che khuất biển báo hiệu đường bộ, đèn tín hiệu giao thông; nơi mở dải phân cách giữa; cách xe ô tô đang đỗ ngược chiều dưới 20 mét trên đường phố hẹp, dưới 40 mét trên đường có một làn xe cơ giới trên một chiều đường;\n\ne) Đỗ xe không sát theo lề đường, vỉa hè phía bên phải theo chiều đi hoặc bánh xe gần nhất cách lề đường, vỉa hè quá 0,25 mét; đỗ xe trên đường dành riêng cho xe buýt; đỗ xe trên miệng cống thoát nước, miệng hầm của đường điện thoại, điện cao thế, chỗ dành riêng cho xe chữa cháy lấy nước; đỗ, để xe ở vỉa hè trái quy định của pháp luật; đỗ xe nơi có biển “Cấm đỗ xe” hoặc biển “Cấm dừng xe và đỗ xe”, trừ hành vi vi phạm quy định tại điểm đ khoản 4, điểm c khoản 7 Điều này;\n\ng) Không sử dụng hoặc sử dụng không đủ đèn chiếu sáng trong thời gian từ 18 giờ ngày hôm trước đến 06 giờ ngày hôm sau hoặc khi có sương mù, khói, bụi, trời mưa, thời tiết xấu làm hạn chế tầm nhìn;\n\nh) Điều khiển xe ô tô kéo theo xe khác, vật khác (trừ trường hợp kéo theo một rơ moóc, sơ mi rơ moóc hoặc một xe ô tô, xe máy chuyên dùng khác khi xe này không tự chạy được); điều khiển xe ô tô đẩy xe khác, vật khác; điều khiển xe kéo rơ moóc, sơ mi rơ moóc kéo thêm rơ moóc hoặc xe khác, vật khác; không nối chắc chắn, an toàn giữa xe kéo và xe được kéo khi kéo nhau;\n\ni) Chở người trên xe được kéo, trừ người điều khiển;\n\nk) Không thắt dây đai an toàn khi điều khiển xe chạy trên đường;\n\nl) Chở người trên xe ô tô không thắt dây đai an toàn (tại vị trí có trang bị dây đai an toàn) khi xe đang chạy;\n\nm) Chở trẻ em dưới 10 tuổi và chiều cao dưới 1,35 mét trên xe ô tô ngồi cùng hàng ghế với người lái xe (trừ loại xe ô tô chỉ có một hàng ghế) hoặc không sử dụng thiết bị an toàn phù hợp cho trẻ em theo quy định;\n\nn) Chạy trong hầm đường bộ không sử dụng đèn chiếu sáng gần;']","**Nguồn văn bản:** /content/drive/MyDrive/ITProject_data/new_law/168_2024_ND-CP_619502.docx

**Tên văn bản:** (Không có tiêu đề trong metadata)


**Nội dung:**

6. Trường hợp tước quyền sử dụng giấy phép lái xe tích hợp giấy phép lái xe không thời hạn (xe mô tô, xe tương tự xe mô tô) và giấy phép lái xe có thời hạn (xe ô tô, xe tương tự xe ô tô, xe chở người bốn bánh có gắn động cơ, xe chở hàng bốn bánh có gắn động cơ) thì người có thẩm quyền xử phạt áp dụng tước quyền sử dụng đối với giấy phép lái xe không thời hạn khi người điều khiển xe mô tô, xe tương tự xe mô tô hoặc tước quyền sử dụng đối với giấy phép lái xe có thời hạn khi người điều khiển xe ô tô, xe tương tự xe ô tô, xe chở người bốn bánh có gắn động cơ, xe chở hàng bốn bánh có gắn động cơ thực hiện hành vi vi phạm hành chính có quy định bị tước quyền sử dụng giấy phép lái xe. Trong thời gian bị tước quyền sử dụng, người có giấy phép lái xe tích hợp được cấp, đổi giấy phép lái xe đối với giấy phép lái xe không bị tước quyền sử dụng.

7. Trường hợp giấy phép, chứng chỉ hành nghề được cấp dưới dạng điện tử hoặc thể hiện dưới hình thức thông điệp dữ liệu thì cơ quan, người có thẩm quyền thực hiện tạm giữ, tước trên môi trường điện tử theo quy định nếu đáp ứng điều kiện về cơ sở hạ tầng, kỹ thuật, thông tin. Việc tạm giữ, tước quyền sử dụng được cập nhật trạng thái trên cơ sở dữ liệu, căn cước điện tử, tài khoản định danh điện tử và ứng dụng thông tin điện tử khác theo quy định.

Chương II

HÀNH VI VI PHẠM, HÌNH THỨC, MỨC XỬ PHẠT, MỨC TRỪ ĐIỂM GIẤY PHÉP LÁI XE VÀ BIỆN PHÁP KHẮC PHỤC HẬU QUẢ VI PHẠM HÀNH CHÍNH VỀ TRẬT TỰ, AN TOÀN GIAO THÔNG TRONG LĨNH VỰC GIAO THÔNG ĐƯỜNG BỘ

Mục 1. VI PHẠM QUY TẮC GIAO THÔNG ĐƯỜNG BỘ

Điều 6. Xử phạt, trừ điểm giấy phép lái xe của người điều khiển xe ô tô, xe chở người bốn bánh có gắn động cơ, xe chở hàng bốn bánh có gắn động cơ và các loại xe tương tự xe ô tô vi phạm quy tắc giao thông đường bộ

1. Phạt tiền từ 400.000 đồng đến 600.000 đồng đối với người điều khiển xe thực hiện một trong các hành vi vi phạm sau đây:

	a) Không chấp hành hiệu lệnh, chỉ dẫn của biển báo hiệu, vạch kẻ đường, trừ các hành vi vi phạm quy định tại điểm a, điểm c, điểm d, điểm đ khoản 2; điểm a, điểm d, điểm đ, điểm e, điểm n, điểm o khoản 3; điểm a, điểm b, điểm đ, điểm e, điểm i, điểm k, điểm l khoản 4; điểm a, điểm b, điểm c, điểm d, điểm đ, điểm i, điểm k khoản 5; điểm a khoản 6; khoản 7; điểm b, điểm d khoản 9; điểm a khoản 10; điểm đ khoản 11 Điều này.

	b) Khi ra, vào vị trí dừng xe, đỗ xe không có tín hiệu báo cho người điều khiển phương tiện khác biết.

	c) Không báo hiệu bằng đèn khẩn cấp hoặc không đặt biển cảnh báo “Chú ý xe đỗ” theo quy định trong trường hợp gặp sự cố kỹ thuật (hoặc bất khả kháng khác) buộc phải đỗ xe chiếm một phần đường xe chạy hoặc tại nơi không được phép đỗ xe, trừ hành vi vi phạm quy định tại điểm c khoản 7 Điều này.

	d) Không gắn biển báo hiệu ở phía trước xe kéo, phía sau xe được kéo; điều khiển xe kéo rơ moóc không có biển báo hiệu theo quy định.

	đ) Sử dụng còi trong thời gian từ 22 giờ ngày hôm trước đến 05 giờ ngày hôm sau trong khu đông dân cư, khu vực cơ sở khám bệnh, chữa bệnh, trừ các xe ưu tiên đang đi làm nhiệm vụ theo quy định.


2. Phạt tiền từ 600.000 đồng đến 800.000 đồng đối với người điều khiển xe thực hiện một trong các hành vi vi phạm sau đây:
    .... (Các lỗi vi phạm khác)

3. Phạt tiền từ 800.000 đồng đến 1.000.000 đồng đối với người điều khiển xe thực hiện một trong các hành vi vi phạm sau đây:
    .... (Các lỗi vi phạm khác)


Tóm lại: Văn bản này không đề cập đến việc sử dụng xe ô tô cá nhân trong giờ cao điểm nói chung, mà chỉ liệt kê các hành vi vi phạm giao thông đường bộ cụ thể của người điều khiển xe ô tô và hình phạt tương ứng.
","**Nguồn văn bản:** 35_2024_QH15_588811

**Tên văn bản:** Luật Đường bộ

**Điều 25:** Tổ chức giao thông

**Nội dung:**

1. Tổ chức giao thông được thực hiện từ giai đoạn quy hoạch, đầu tư, xây dựng đến giai đoạn quản lý, vận hành, khai thác, sử dụng, bảo trì kết cấu hạ tầng đường bộ nhằm bảo đảm giao thông thông suốt, an toàn, hiệu quả.

2. Nội dung tổ chức giao thông đường bộ trong giai đoạn thiết kế, thi công xây dựng, quản lý, vận hành, khai thác, sử dụng, bảo trì công trình đường bộ bao gồm:

	a) Quy định số làn đường, phần đường dành cho xe ô tô và các phương tiện tham gia giao thông đường bộ khác, phần đường dành cho người đi bộ; chiều đi, tốc độ các phương tiện cơ giới tham gia giao thông đường bộ.

	b) Tổ chức phân làn, phân luồng trên tuyến đường đang đầu tư xây dựng và tại các tuyến đường bộ kết nối.

	c) Quy định giao thông tại các nút giao, vị trí đấu nối với đường khác; quy định về tránh, vượt xe trên đường, các điểm được phép dừng xe, đỗ xe trên đường, vị trí đón, trả khách.

	d) Quy định khổ giới hạn và tải trọng cho phép phương tiện tham gia giao thông đường bộ an toàn.

	đ) Quy định thời gian cho phép tham gia giao thông; thời gian cho phép đi theo các hướng của đèn tín hiệu giao thông.

	e) Quy định thời gian bật, tắt hệ thống chiếu sáng trên đường.

	g) Quy định về các trường hợp tạm dừng khai thác một phần hoặc toàn bộ tuyến đường.

	h) Khai thác, sử dụng hệ thống quản lý giao thông thông minh, trung tâm quản lý, điều hành giao thông tuyến đường cao tốc và các thiết bị công nghệ khác phục vụ cung cấp thông tin, chỉ dẫn cho người tham gia giao thông đường bộ.

	i) Lắp đặt đầy đủ hệ thống báo hiệu đường bộ và thực hiện các công việc cần thiết khác.

	k) Phê duyệt phương án tổ chức giao thông đối với đường cao tốc.

3. Chủ đầu tư dự án đầu tư xây dựng công trình đường bộ, người quản lý, sử dụng đường bộ, tổ chức, cá nhân liên quan có trách nhiệm lắp đặt, điều chỉnh, bổ sung đầy đủ báo hiệu đường bộ, công trình an toàn giao thông đường bộ đối với dự án và tuyến đường thuộc phạm vi quản lý; thực hiện phương án tổ chức giao thông đường cao tốc được phê duyệt.

4. Việc theo dõi, đánh giá tình hình giao thông trên tuyến đường, điều chỉnh tổ chức giao thông để khắc phục tình trạng ùn tắc giao thông, bảo đảm trật tự, an toàn giao thông đường bộ được thực hiện trong quá trình vận hành, khai thác, sử dụng, bảo trì đường bộ.

5. Bộ Giao thông vận tải, Ủy ban nhân dân các cấp chịu trách nhiệm tổ chức giao thông trên các tuyến đường bộ thuộc phạm vi quản lý.

6. Người quản lý, sử dụng đường bộ đối với đường chuyên dùng chịu trách nhiệm tổ chức giao thông trên đường chuyên dùng; trường hợp đường chuyên dùng có hoạt động giao thông công cộng thì phải tổ chức giao thông theo quy định của điều này.

7. Chính phủ quy định chi tiết điều này.


Tóm lại: Luật Đường bộ quy định về tổ chức giao thông nói chung, bao gồm phân làn, phân luồng, quy định tốc độ, điểm dừng đỗ... để đảm bảo giao thông thông suốt và an toàn. Việc tổ chức giao thông này được thực hiện bởi Bộ Giao thông Vận tải và Ủy ban nhân dân các cấp, và được điều chỉnh để khắc phục ùn tắc.  Tuy nhiên, không có quy định cụ thể nào riêng về việc sử dụng xe ô tô cá nhân trong giờ cao điểm.
",1.0,0.7611787378676297,0.0,0.0
33,Quy định mới về việc sử dụng xe ô tô điện là gì?,"['BỘ GIAO THÔNG VẬN TẢI\n-------- CỘNG HÒA XÃ HỘI CHỦ NGHĨA VIỆT NAM\nĐộc lập - Tự do - Hạnh phúc \n--------------- Số: 53/2024/TT-BGTVT Hà Nội, ngày 15 tháng 11 năm 2024\n\nTHÔNG TƯ\n\nQUY ĐỊNH VỀ PHÂN LOẠI PHƯƠNG TIỆN GIAO THÔNG ĐƯỜNG BỘ VÀ DẤU HIỆU NHẬN BIẾT XE CƠ GIỚI SỬ DỤNG NĂNG LƯỢNG SẠCH, NĂNG LƯỢNG XANH, THÂN THIỆN MÔI TRƯỜNG\n\nCăn cứ Luật Trật tự, an toàn giao thông đường bộ ngày 27 tháng 6 năm 2024;\n\nCăn cứ Nghị định số 56/2022/NĐ-CP ngày 24 tháng 8 năm 2022 của Chính phủ quy định chức năng, nhiệm vụ, quyền hạn và cơ cấu tổ chức của Bộ Giao thông vận tải;\n\nTheo đề nghị của Vụ trưởng Vụ Khoa học - Công nghệ và Môi trường và Cục trưởng Cục Đăng kiểm Việt Nam;\n\nBộ trưởng Bộ Giao thông vận tải ban hành Thông tư quy định về phân loại phương tiện giao thông đường bộ và dấu hiệu nhận biết xe cơ giới sử dụng năng lượng sạch, năng lượng xanh, thân thiện môi trường.\n\nChương I\n\nQUY ĐỊNH CHUNG\n\nĐiều 1. Phạm vi điều chỉnh\n\nThông tư quy định về phân loại phương tiện giao thông đường bộ và dấu hiệu nhận biết xe cơ giới sử dụng năng lượng sạch, năng lượng xanh, thân thiện môi trường.\n\nĐiều 2. Đối tượng áp dụng\n\nThông tư này áp dụng đối với các tổ chức, cá nhân có liên quan đến phân loại phương tiện giao thông đường bộ, dấu hiệu nhận biết xe cơ giới sử dụng năng lượng sạch, năng lượng xanh, thân thiện môi trường.\n\nĐiều 3. Giải thích từ ngữ\n\nTrong Thông tư này, các cụm từ dưới đây được hiểu như sau:\n\n1. Hệ thống truyền động điện (Electric powertrain) là hệ thống bao gồm một hoặc nhiều: thiết bị tích trữ điện năng (ắc quy, pin, bánh đà điện cơ hoặc siêu tụ); thiết bị ổn định điện năng; thiết bị điện được sử dụng để chuyển đổi điện năng tích trữ thành cơ năng truyền tới các bánh xe làm nguồn động lực cho xe chuyển động;\n\n2. Xe thuần điện (PEV - Pure electric vehicle hoặc BEV - Battery electric vehicle) là xe cơ giới sử dụng hệ thống truyền động điện;\n\n3. Xe điện dùng pin nhiên liệu thuần túy (PFCEV - Pure fuel cell electric vehicle hoặc FCEV - Fuel cell electric vehicle) là xe cơ giới điện sử dụng pin nhiên liệu thuần túy, trong đó hệ thống pin nhiên liệu là nguồn năng lượng duy nhất trên xe cho hệ thống động lực của xe;\n\n4. Hệ thống truyền động hybrid điện (Hybrid electric powertrain) là hệ truyền động tiêu thụ năng lượng từ cả hai nguồn năng lượng được tích trữ trên xe, gồm nhiên liệu và thiết bị tích trữ điện năng;\n\n5. Xe hybrid điện (HEV - Hybrid electric vehicle) là xe cơ giới được dẫn động bằng hệ thống truyền động hybrid điện (bao gồm cả xe sử dụng nhiên liệu tiêu thụ chỉ để nạp điện cho thiết bị tích trữ điện năng), gồm có:\n\n\n\na) Xe hybrid điện nhẹ (MHEV - Mild hybrid electric vehicle) là xe hybrid điện; động cơ (mô-tơ) điện có chức năng hỗ trợ động cơ đốt trong khởi động, hỗ trợ tăng tốc, phanh tái tạo và cung cấp năng lượng cho hệ thống phụ trợ. Xe không có khả năng nạp điện được từ nguồn điện bên ngoài;\n\nb) Xe hybrid điện hoàn toàn (FHEV- Full hybrid electric vehicle hoặc SHEV\n\nStrong hybrid electric vehicle) là xe hybrid điện có khả năng di chuyển hoàn toàn chỉ bằng năng lượng điện trong những điều kiện nhất định (như bắt đầu di chuyển từ trạng thái đứng yên, di chuyển ở tốc độ thấp...). Xe không có khả năng nạp điện được từ nguồn điện bên ngoài;\n\nc) Xe hybrid nạp điện ngoài (PHEV - Plug-in hybrid electric vehicle) là xe hybrid điện có khả năng nạp điện được từ nguồn điện bên ngoài.\n\nChương II\n\nPHÂN LOẠI PHƯƠNG TIỆN GIAO THÔNG ĐƯỜNG BỘ THEO MỤC ĐÍCH SỬ DỤNG\n\nĐiều 4. Xe cơ giới\n\nXe cơ giới quy định tại khoản 1 Điều 34 Luật Trật tự, an toàn giao thông đường bộ gồm:\n\n1. Xe ô tô được phân loại như sau:\n\na) Xe ô tô chở người là các loại ô tô có kết cấu và trang bị chủ yếu dùng để chở người, hành lý mang theo. Ô tô chở người cũng có thể kéo theo một rơ moóc. Các loại ô tô chở người gồm:\n\nÔ tô chở người đến 08 chỗ (không kể chỗ của người lái xe) gồm các loại quy định tại Phụ lục I ban hành kèm theo Thông tư này;\n\nÔ tô chở người trên 08 chỗ (không kể chỗ của người lái xe) gồm các loại quy định tại Phụ lục II ban hành kèm theo Thông tư này;\n\nÔ tô chở người chuyên dùng là ô tô chở người có đặc điểm khác với đặc điểm của các loại ô tô chở người nêu trên, có kết cấu và trang bị để chở người trong điều kiện đặc biệt hoặc chở người với sự sắp xếp đặc biệt, gồm các loại quy định tại Phụ lục III ban hành kèm theo Thông tư này;\n\nb) Ô tô chở hàng là các loại ô tô có kết cấu và trang bị chủ yếu dùng để chở hàng. Ô tô chở hàng có thể bố trí tối đa hai hàng ghế và chở không quá 06 người kể cả người lái trong cabin. Ô tô chở hàng cũng có thể kéo theo một rơ moóc. Các loại ô tô chở hàng gồm:\n\nÔ tô tải thông dụng gồm các loại quy định tại Phụ lục IV ban hành kèm theo Thông tư này;\n\nÔ tô tải chuyên dùng bao gồm các loại ô tô chở hàng có kết cấu và trang bị để chở hàng hóa cần sự sắp xếp đặc biệt gồm các loại quy định tại Phụ lục V ban hành kèm theo Thông tư này;\n\nc) Ô tô chuyên dùng là các loại ô tô có kết cấu và trang bị để thực hiện một chức năng, công dụng đặc biệt khác với các loại ô tô nêu tại điểm a và điểm b khoản này. Ô tô chuyên dùng gồm các loại ô tô quy định tại Phụ lục VI ban hành kèm theo Thông tư này;\n\nd) Ô tô đầu kéo là ô tô được thiết kế để kéo sơ mi rơ moóc và có các trang, thiết bị gồm: cơ cấu mâm kéo (fifth-wheel coupling); cơ cấu kết nối và điều khiển hệ thống đèn tín hiệu và hệ thống phanh của sơ mi rơ moóc; có thể trang bị cần cẩu, máy phát điện, cơ cấu móc kéo (tow coupling, hook coupling) để kéo rơ moóc;\n\nđ) Ô tô kéo moóc là ô tô được thiết kế dành riêng hoặc chủ yếu dùng để kéo rơ moóc và có các trang, thiết bị gồm: cơ cấu móc kéo (tow coupling, hook coupling); thùng hoặc sàn chất phụ tải; cơ cấu kết nối và điều khiển hệ thống đèn tín hiệu và hệ thống phanh của rơ moóc;\n\nÔ tô kéo moóc không bao gồm: ô tô chở hàng có trang bị cơ cấu móc kéo; ô tô đầu kéo trang bị thêm cơ cấu móc kéo.\n\n2. Rơ moóc được phân loại theo quy định tại Phụ lục VII ban hành kèm theo Thông tư này.\n\n\n\n3. Sơ mi rơ moóc được phân loại theo quy định tại Phụ lục VIII ban hành kèm theo Thông tư này.\n\n4. Xe chở người bốn bánh có gắn động cơ được phân loại như sau:\n\na) Xe chở người bốn bánh có gắn động cơ tham gia giao thông công cộng là xe được thiết kế để hoạt động trên đường giao thông công cộng;\n\nb) Xe chở người bốn bánh có gắn động cơ hoạt động trên đường chuyên dùng, nội bộ là xe được thiết kế chỉ để hoạt động trên đường chuyên dùng, đường nội bộ.\n\n5. Xe chở hàng bốn bánh có gắn động cơ.\n\n6. Xe mô tô được phân loại như sau:\n\na) Xe mô tô hai bánh;\n\nb) Xe mô tô ba bánh chở người;\n\nc) Xe mô tô ba bánh chở hàng;\n\nd) Xe mô tô ba bánh dùng cho người khuyết tật.\n\n7. Xe gắn máy được phân loại như sau:\n\na) Xe gắn máy hai bánh;\n\nb) Xe gắn máy ba bánh chở người;\n\nc) Xe gắn máy ba bánh chở hàng;\n\nd) Xe gắn máy ba bánh dùng cho người khuyết tật.\n\nĐiều 5. Xe máy chuyên dùng\n\nXe máy chuyên dùng được phân loại như sau:\n\n1. Xe máy thi công được phân loại theo quy định tại Phụ lục IX ban hành kèm theo Thông tư này;\n\n2. Xe máy nông nghiệp, lâm nghiệp là xe máy chuyên dùng chỉ phục vụ trong nông nghiệp, lâm nghiệp;\n\n3. Máy kéo;\n\n4. Rơ moóc, sơ mi rơ moóc được kéo bởi máy kéo: Rơ moóc, sơ mi rơ moóc được thiết kế, chế tạo chỉ để kéo bởi máy kéo;\n\n5. Xe máy thực hiện chức năng, công dụng đặc biệt được phân loại theo quy định tại Phụ lục X ban hành kèm theo Thông tư này;\n\n6. Các loại xe đặc chủng sử dụng vào mục đích quốc phòng, an ninh có tham gia giao thông đường bộ.\n\nĐiều 6. Xe thô sơ\n\nXe thô sơ gồm các loại xe được quy định tại khoản 2 Điều 34 Luật Trật tự, an toàn giao thông đường bộ.\n\nChương III\n\nPHÂN LOẠI XE CƠ GIỚI THEO MỨC ĐỘ TỰ ĐỘNG HÓA\n\nĐiều 7. Phương tiện giao thông thông thường\n\nPhương tiện giao thông thông thường là xe cơ giới mà người lái thực hiện toàn bộ các nhiệm vụ điều khiển chuyển động của xe ngay cả khi được hỗ trợ bởi các hệ thống an toàn chủ động trên xe.\n\nĐiều 8. Phương tiện giao thông thông minh']","**Nguồn văn bản:** /content/drive/MyDrive/ITProject_data/new_law/53_2024_TT-BGTVT_624420.docx

**Tên văn bản:** (Không có tiêu đề trong metadata)

**(Không có điều khoản trong metadata):**

**Nội dung:**
Thông tư 53/2024/TT-BGTVT quy định về phân loại phương tiện giao thông đường bộ và dấu hiệu nhận biết xe cơ giới sử dụng năng lượng sạch, năng lượng xanh, thân thiện môi trường.  Dưới đây là quy định về xe ô tô điện, được chiết xuất từ Thông tư:

Điều 3. Giải thích từ ngữ

1. Hệ thống truyền động điện (Electric powertrain): Là hệ thống bao gồm một hoặc nhiều thiết bị tích trữ điện năng (ắc quy, pin, bánh đà điện cơ hoặc siêu tụ); thiết bị ổn định điện năng; thiết bị điện được sử dụng để chuyển đổi điện năng tích trữ thành cơ năng truyền tới các bánh xe làm nguồn động lực cho xe chuyển động.

2. Xe thuần điện (PEV - Pure electric vehicle hoặc BEV - Battery electric vehicle): Là xe cơ giới sử dụng hệ thống truyền động điện.

3. Xe điện dùng pin nhiên liệu thuần túy (PFCEV - Pure fuel cell electric vehicle hoặc FCEV - Fuel cell electric vehicle): Là xe cơ giới điện sử dụng pin nhiên liệu thuần túy, trong đó hệ thống pin nhiên liệu là nguồn năng lượng duy nhất trên xe cho hệ thống động lực của xe.

4. Hệ thống truyền động hybrid điện (Hybrid electric powertrain): Là hệ truyền động tiêu thụ năng lượng từ cả hai nguồn năng lượng được tích trữ trên xe, gồm nhiên liệu và thiết bị tích trữ điện năng.

5. Xe hybrid điện (HEV - Hybrid electric vehicle): Là xe cơ giới được dẫn động bằng hệ thống truyền động hybrid điện (bao gồm cả xe sử dụng nhiên liệu tiêu thụ chỉ để nạp điện cho thiết bị tích trữ điện năng), gồm có:

	a) Xe hybrid điện nhẹ (MHEV - Mild hybrid electric vehicle): Là xe hybrid điện; động cơ (mô-tơ) điện có chức năng hỗ trợ động cơ đốt trong khởi động, hỗ trợ tăng tốc, phanh tái tạo và cung cấp năng lượng cho hệ thống phụ trợ. Xe không có khả năng nạp điện được từ nguồn điện bên ngoài.

	b) Xe hybrid điện hoàn toàn (FHEV- Full hybrid electric vehicle hoặc SHEV - Strong hybrid electric vehicle): Là xe hybrid điện có khả năng di chuyển hoàn toàn chỉ bằng năng lượng điện trong những điều kiện nhất định (như bắt đầu di chuyển từ trạng thái đứng yên, di chuyển ở tốc độ thấp...). Xe không có khả năng nạp điện được từ nguồn điện bên ngoài.

	c) Xe hybrid nạp điện ngoài (PHEV - Plug-in hybrid electric vehicle): Là xe hybrid điện có khả năng nạp điện được từ nguồn điện bên ngoài.


**Tóm lại:** Thông tư định nghĩa và phân loại xe ô tô điện thành các loại: xe thuần điện (PEV/BEV), xe điện dùng pin nhiên liệu (PFCEV/FCEV) và xe hybrid điện (HEV) bao gồm hybrid nhẹ (MHEV), hybrid hoàn toàn (FHEV/SHEV) và hybrid nạp điện ngoài (PHEV).
","**Nguồn văn bản:** 36_2024_QH15_444251

**Tên văn bản:** Luật Trật tự, an toàn giao thông đường bộ

**Điều 34:** Phân loại phương tiện giao thông đường bộ

**Nội dung:**

1. Xe cơ giới bao gồm:

	a) Xe ô tô gồm:

		- Xe có từ bốn bánh trở lên chạy bằng động cơ, được thiết kế, sản xuất để hoạt động trên đường bộ, không chạy trên đường ray, dùng để chở người, hàng hóa, kéo rơ moóc, kéo sơ mi rơ moóc hoặc được kết cấu để thực hiện chức năng, công dụng đặc biệt, có thể được nối với đường dây dẫn điện.
		- Xe ba bánh có khối lượng bản thân lớn hơn 400 kg.
		- Xe ô tô không bao gồm xe chở người bốn bánh có gắn động cơ và xe chở hàng bốn bánh có gắn động cơ.

	b) Rơ moóc là xe không có động cơ để di chuyển, được thiết kế, sản xuất để hoạt động trên đường bộ, được kéo bởi xe ô tô; phần chủ yếu của khối lượng toàn bộ rơ moóc không đặt lên xe kéo.

	c) Sơ mi rơ moóc là xe không có động cơ để di chuyển, được thiết kế, sản xuất để hoạt động trên đường bộ; được kéo bởi xe ô tô đầu kéo và có một phần đáng kể khối lượng toàn bộ đặt lên xe ô tô đầu kéo.

	d) Xe chở người bốn bánh có gắn động cơ là xe có từ bốn bánh trở lên, chạy bằng động cơ, được thiết kế, sản xuất để hoạt động trên đường bộ, có kết cấu để chở người, vận tốc thiết kế không lớn hơn 30 km/h, số người cho phép chở tối đa 15 người (không kể người lái xe).

	đ) Xe chở hàng bốn bánh có gắn động cơ là xe có từ bốn bánh trở lên, chạy bằng động cơ, được thiết kế, sản xuất để hoạt động trên đường bộ, có kết cấu để chở hàng, có phần động cơ và thùng hàng lắp trên cùng một khung xe, có tối đa hai hàng ghế và chở tối đa 05 người (không kể người lái xe), vận tốc thiết kế không lớn hơn 60 km/h và khối lượng bản thân không lớn hơn 550 kg; trường hợp xe sử dụng động cơ điện thì có công suất động cơ không lớn hơn 15 kw.

	e) Xe mô tô gồm: 

		- Xe có hai hoặc ba bánh chạy bằng động cơ, được thiết kế, sản xuất để hoạt động trên đường bộ, trừ xe gắn máy.
		- Đối với xe ba bánh thì khối lượng bản thân không lớn hơn 400 kg.

	g) Xe gắn máy là xe có hai hoặc ba bánh chạy bằng động cơ, được thiết kế, sản xuất để hoạt động trên đường bộ, có vận tốc thiết kế không lớn hơn 50 km/h; nếu động cơ dẫn động là động cơ nhiệt thì dung tích làm việc hoặc dung tích tương đương không lớn hơn 50 cm3; nếu động cơ dẫn động là động cơ điện thì công suất của động cơ không lớn hơn 04 kw; xe gắn máy không bao gồm xe đạp máy.

	h) Xe tương tự các loại xe quy định tại khoản này.


6. Bộ trưởng Bộ Giao thông vận tải quy định chi tiết điều này; quy định dấu hiệu nhận biết xe cơ giới sử dụng năng lượng sạch, năng lượng xanh, thân thiện môi trường.

**Tóm lại:** Xe ô tô điện được phân loại là xe cơ giới theo Luật Giao thông Đường bộ.  Bộ Giao thông Vận tải có trách nhiệm quy định chi tiết về việc quản lý, sử dụng xe ô tô điện, bao gồm cả dấu hiệu nhận biết xe sử dụng năng lượng sạch.
",1.0,0.5883154705462784,0.5,0.9999999999
34,Luật Giao thông Đường bộ 2025 có quy định gì về việc sử dụng xe ô tô tự lái?,"['QUỐC HỘI\n-------- CỘNG HÒA XÃ HỘI CHỦ NGHĨA VIỆT NAM\nĐộc lập - Tự do - Hạnh phúc \n--------------- Luật số: 36/2024/QH15 Hà Nội, ngày 27 tháng 6 năm 2024\n\nLUẬT\n\nTRẬT TỰ, AN TOÀN GIAO THÔNG ĐƯỜNG BỘ\n\nCăn cứ Hiến pháp nước Cộng hòa xã hội chủ nghĩa Việt Nam;\n\nQuốc hội ban hành Luật Trật tự, an toàn giao thông đường bộ.\n\nChương I\n\nNHỮNG QUY ĐỊNH CHUNG\n\nĐiều 1. Phạm vi điều chỉnh\n\nLuật này quy định về quy tắc, phương tiện, người tham gia giao thông đường bộ, chỉ huy, điều khiển, tuần tra, kiểm soát, giải quyết tai nạn giao thông đường bộ, trách nhiệm quản lý nhà nước và trách nhiệm của cơ quan, tổ chức, cá nhân có liên quan đến trật tự, an toàn giao thông đường bộ.\n\nĐiều 2. Giải thích từ ngữ\n\n1. Trật tự, an toàn giao thông đường bộ là trạng thái giao thông trên đường bộ có trật tự, bảo đảm an toàn, thông suốt; được hình thành và điều chỉnh bởi các quy tắc, nguyên tắc, quy phạm pháp luật trong lĩnh vực giao thông đường bộ. \n\n2. Phương tiện giao thông đường bộ là các loại xe, bao gồm: phương tiện giao thông cơ giới đường bộ (sau đây gọi là xe cơ giới), phương tiện giao thông thô sơ đường bộ (sau đây gọi là xe thô sơ), xe máy chuyên dùng và các loại xe tương tự.\n\n3. Phương tiện tham gia giao thông đường bộ là phương tiện giao thông đường bộ tham gia giao thông trên đường bộ.\n\n4. Đường ưu tiên\xa0là đường mà trên đó phương tiện tham gia giao thông đường bộ được các phương tiện tham gia giao thông đường bộ đến từ hướng khác nhường đường khi qua nơi đường giao nhau, được cắm biển báo hiệu đường ưu tiên.\n\n5. Phần đường xe chạy là phần của đường bộ được sử dụng cho phương tiện giao thông đường bộ đi lại.\n\n6. Làn đường là một phần của phần đường xe chạy được chia theo chiều dọc của đường, có đủ chiều rộng cho xe chạy an toàn.\n\n7. Cải tạo xe (sau đây gọi là cải tạo) là việc thay đổi đặc điểm của xe đã được cấp đăng ký xe, biển số xe hoặc xe đã qua sử dụng được nhập khẩu dẫn đến thay đổi về kiểu loại xe theo quy định của cơ quan có thẩm quyền.\n\n8. Người tham gia giao thông đường bộ bao gồm: người điều khiển, người được chở trên phương tiện tham gia giao thông đường bộ; người điều khiển, dẫn dắt vật nuôi trên đường bộ; người đi bộ trên đường bộ.\n\n\n\n9. Người điều khiển phương tiện tham gia giao thông đường bộ bao gồm: người điều khiển xe cơ giới (sau đây gọi là người lái xe), người điều khiển xe thô sơ, người điều khiển xe máy chuyên dùng.\n\n10. Người điều khiển giao thông đường bộ (sau đây gọi là người điều khiển giao thông) bao gồm: Cảnh sát giao thông và người được giao nhiệm vụ hướng dẫn giao thông trên đường bộ.\n\n11. Ùn tắc giao thông đường bộ (sau đây gọi là ùn tắc giao thông) là tình trạng người, phương tiện tham gia giao thông đường bộ bị dồn ứ, di chuyển với tốc độ rất chậm hoặc không thể di chuyển được.\n\n12. Tai nạn giao thông đường bộ là va chạm liên quan đến người, phương tiện khi tham gia giao thông đường bộ, xảy ra ngoài ý muốn của người tham gia giao thông đường bộ, gây thiệt hại đến tính mạng, sức khỏe, tài sản của cá nhân hoặc tài sản của cơ quan, tổ chức.\n\n13. Thiết bị an toàn cho trẻ em là thiết bị có đủ khả năng bảo đảm an toàn cho trẻ em ở tư thế ngồi hoặc nằm trên xe ô tô, được thiết kế để giảm nguy cơ chấn thương cho người dùng trong trường hợp xảy ra va chạm hoặc xe ô tô giảm tốc độ đột ngột, bằng cách hạn chế sự di chuyển của cơ thể trẻ em.\n\n14. Thiết bị thông minh hỗ trợ chỉ huy, điều khiển giao thông đường bộ là thiết bị kỹ thuật công nghệ có khả năng phát hiện, phân tích, đánh giá các tình huống giao thông đường bộ, vi phạm pháp luật trên đường bộ; do lực lượng chức năng sử dụng để hỗ trợ chỉ huy, điều khiển giao thông đường bộ, giải quyết tình huống và xử lý vi phạm pháp luật trên đường bộ.\n\nĐiều 3. Nguyên tắc bảo đảm trật tự, an toàn giao thông đường bộ\n\n1. Tuân thủ Hiến pháp, pháp luật Việt Nam và điều ước quốc tế mà nước Cộng hòa xã hội chủ nghĩa Việt Nam là thành viên. \n\n2. Bảo đảm giao thông đường bộ được trật tự, an toàn, thông suốt, góp phần phát triển kinh tế - xã hội, bảo đảm quốc phòng, an ninh và bảo vệ môi trường; phòng ngừa vi phạm pháp luật về trật tự, an toàn giao thông đường bộ, tai nạn giao thông đường bộ và ùn tắc giao thông; bảo vệ tính mạng, sức khỏe, tài sản của cá nhân và tài sản của cơ quan, tổ chức.\n\n3. Bảo đảm trật tự, an toàn giao thông đường bộ là trách nhiệm của cơ quan, tổ chức, cá nhân.\n\n4. Người tham gia giao thông đường bộ phải chấp hành các quy định của pháp luật về trật tự, an toàn giao thông đường bộ và quy định khác của pháp luật có liên quan, có trách nhiệm giữ an toàn cho mình và cho người khác.\n\n5. Mọi hành vi vi phạm pháp luật về trật tự, an toàn giao thông đường bộ phải được phát hiện, ngăn chặn kịp thời và phải bị xử lý nghiêm minh theo quy định của pháp luật.\n\n6. Hoạt động bảo đảm trật tự, an toàn giao thông đường bộ phải công khai, minh bạch và thuận lợi cho người dân.\n\n7. Công tác bảo đảm trật tự, an toàn giao thông đường bộ được thực hiện thống nhất trên cơ sở phân công, phân cấp, phù hợp với chức năng, nhiệm vụ và sự phối hợp chặt chẽ giữa các cơ quan, tổ chức, cá nhân có liên quan. \n\nĐiều 4. Chính sách của Nhà nước về trật tự, an toàn giao thông đường bộ\n\n1. Bảo đảm ngân sách nhà nước, cơ sở vật chất, phương tiện, thiết bị hiện đại, các điều kiện bảo đảm và nâng cao năng lực thực thi nhiệm vụ của lực lượng trực tiếp bảo đảm trật tự, an toàn giao \n\n\n\nthông đường bộ. Huy động, sử dụng các nguồn lực để bảo đảm trật tự, an toàn giao thông đường bộ. Bố trí tương ứng từ các khoản thu tiền xử phạt vi phạm hành chính về trật tự, an toàn giao thông đường bộ và tiền đấu giá biển số xe sau khi nộp vào ngân sách nhà nước để tăng cường, hiện đại hóa cơ sở vật chất, phương tiện, thiết bị, phục vụ bảo đảm an ninh, trật tự, an toàn giao thông theo quy định của Chính phủ.\n\n2. Hiện đại hoá các trung tâm chỉ huy giao thông; bảo đảm kết nối, chia sẻ Cơ sở dữ liệu về trật tự, an toàn giao thông đường bộ giữa các cơ quan nhà nước có liên quan.\n\n3. Tạo điều kiện để cơ quan, tổ chức, cá nhân trong nước, nước ngoài nghiên cứu, ứng dụng và chuyển giao khoa học, công nghệ trong công tác bảo đảm trật tự, an toàn giao thông đường bộ, đầu tư, xây dựng, chuyển giao hệ thống, phương tiện, thiết bị giám sát phục vụ công tác bảo đảm trật tự, an toàn giao thông đường bộ; khuyến khích cơ quan, tổ chức, cá nhân tự nguyện tham gia phối hợp bảo đảm trật tự, an toàn giao thông đường bộ phù hợp với quy định của pháp luật, cung cấp thông tin, tài liệu phục vụ công tác bảo đảm trật tự, an toàn giao thông đường bộ và xử lý vi phạm pháp luật về trật tự, an toàn giao thông đường bộ.\n\n4. Bảo đảm công bằng, bình đẳng, an toàn đối với người tham gia giao thông đường bộ; tạo thuận lợi cho trẻ em, phụ nữ mang thai, người già yếu, người khuyết tật trong tham gia giao thông đường bộ; xây dựng văn hóa giao thông; giáo dục, phổ biến, bồi dưỡng kiến thức pháp luật về giao thông đường bộ cho trẻ em, học sinh để hình thành, nâng cao ý thức tự bảo vệ bản thân và tự giác chấp hành pháp luật khi tham gia giao thông đường bộ.\n\n5. Cơ quan, tổ chức, cá nhân tham gia phối hợp, cộng tác, hỗ trợ, giúp đỡ cơ quan nhà nước thực hiện nhiệm vụ bảo đảm trật tự, an toàn giao thông đường bộ, có thành tích thì được khen thưởng, bị thiệt hại về tài sản thì được đền bù; người bị tổn hại về danh dự, nhân phẩm thì được khôi phục; người bị thương, bị tổn hại về sức khỏe, tính mạng thì bản thân, gia đình được hưởng chế độ, chính sách theo quy định của pháp luật.']","**Nguồn văn bản:** /content/drive/MyDrive/ITProject_data/new_law/36_2024_QH15_444251.docx

**Tên văn bản:** (Không có tiêu đề trong metadata)

**(Không có điều khoản trong metadata):**

**Nội dung:**
QUỐC HỘI
-------- CỘNG HÒA XÃ HỘI CHỦ NGHĨA VIỆT NAM
Độc lập - Tự do - Hạnh phúc 
--------------- Luật số: 36/2024/QH15 Hà Nội, ngày 27 tháng 6 năm 2024

LUẬT

TRẬT TỰ, AN TOÀN GIAO THÔNG ĐƯỜNG BỘ

Căn cứ Hiến pháp nước Cộng hòa xã hội chủ nghĩa Việt Nam;

Quốc hội ban hành Luật Trật tự, an toàn giao thông đường bộ.

Chương I

NHỮNG QUY ĐỊNH CHUNG

Điều 1. Phạm vi điều chỉnh

Luật này quy định về quy tắc, phương tiện, người tham gia giao thông đường bộ, chỉ huy, điều khiển, tuần tra, kiểm soát, giải quyết tai nạn giao thông đường bộ, trách nhiệm quản lý nhà nước và trách nhiệm của cơ quan, tổ chức, cá nhân có liên quan đến trật tự, an toàn giao thông đường bộ.

Điều 2. Giải thích từ ngữ

1. Trật tự, an toàn giao thông đường bộ là trạng thái giao thông trên đường bộ có trật tự, bảo đảm an toàn, thông suốt; được hình thành và điều chỉnh bởi các quy tắc, nguyên tắc, quy phạm pháp luật trong lĩnh vực giao thông đường bộ. 

2. Phương tiện giao thông đường bộ là các loại xe, bao gồm: phương tiện giao thông cơ giới đường bộ (sau đây gọi là xe cơ giới), phương tiện giao thông thô sơ đường bộ (sau đây gọi là xe thô sơ), xe máy chuyên dùng và các loại xe tương tự.

3. Phương tiện tham gia giao thông đường bộ là phương tiện giao thông đường bộ tham gia giao thông trên đường bộ.

4. Đường ưu tiên là đường mà trên đó phương tiện tham gia giao thông đường bộ được các phương tiện tham gia giao thông đường bộ đến từ hướng khác nhường đường khi qua nơi đường giao nhau, được cắm biển báo hiệu đường ưu tiên.

5. Phần đường xe chạy là phần của đường bộ được sử dụng cho phương tiện giao thông đường bộ đi lại.

6. Làn đường là một phần của phần đường xe chạy được chia theo chiều dọc của đường, có đủ chiều rộng cho xe chạy an toàn.

7. Cải tạo xe (sau đây gọi là cải tạo) là việc thay đổi đặc điểm của xe đã được cấp đăng ký xe, biển số xe hoặc xe đã qua sử dụng được nhập khẩu dẫn đến thay đổi về kiểu loại xe theo quy định của cơ quan có thẩm quyền.

8. Người tham gia giao thông đường bộ bao gồm: người điều khiển, người được chở trên phương tiện tham gia giao thông đường bộ; người điều khiển, dẫn dắt vật nuôi trên đường bộ; người đi bộ trên đường bộ.


9. Người điều khiển phương tiện tham gia giao thông đường bộ bao gồm: người điều khiển xe cơ giới (sau đây gọi là người lái xe), người điều khiển xe thô sơ, người điều khiển xe máy chuyên dùng.

10. Người điều khiển giao thông đường bộ (sau đây gọi là người điều khiển giao thông) bao gồm: Cảnh sát giao thông và người được giao nhiệm vụ hướng dẫn giao thông trên đường bộ.

11. Ùn tắc giao thông đường bộ (sau đây gọi là ùn tắc giao thông) là tình trạng người, phương tiện tham gia giao thông đường bộ bị dồn ứ, di chuyển với tốc độ rất chậm hoặc không thể di chuyển được.

12. Tai nạn giao thông đường bộ là va chạm liên quan đến người, phương tiện khi tham gia giao thông đường bộ, xảy ra ngoài ý muốn của người tham gia giao thông đường bộ, gây thiệt hại đến tính mạng, sức khỏe, tài sản của cá nhân hoặc tài sản của cơ quan, tổ chức.

13. Thiết bị an toàn cho trẻ em là thiết bị có đủ khả năng bảo đảm an toàn cho trẻ em ở tư thế ngồi hoặc nằm trên xe ô tô, được thiết kế để giảm nguy cơ chấn thương cho người dùng trong trường hợp xảy ra va chạm hoặc xe ô tô giảm tốc độ đột ngột, bằng cách hạn chế sự di chuyển của cơ thể trẻ em.

14. Thiết bị thông minh hỗ trợ chỉ huy, điều khiển giao thông đường bộ là thiết bị kỹ thuật công nghệ có khả năng phát hiện, phân tích, đánh giá các tình huống giao thông đường bộ, vi phạm pháp luật trên đường bộ; do lực lượng chức năng sử dụng để hỗ trợ chỉ huy, điều khiển giao thông đường bộ, giải quyết tình huống và xử lý vi phạm pháp luật trên đường bộ.


Điều 3. Nguyên tắc bảo đảm trật tự, an toàn giao thông đường bộ

1. Tuân thủ Hiến pháp, pháp luật Việt Nam và điều ước quốc tế mà nước Cộng hòa xã hội chủ nghĩa Việt Nam là thành viên. 

2. Bảo đảm giao thông đường bộ được trật tự, an toàn, thông suốt, góp phần phát triển kinh tế - xã hội, bảo đảm quốc phòng, an ninh và bảo vệ môi trường; phòng ngừa vi phạm pháp luật về trật tự, an toàn giao thông đường bộ, tai nạn giao thông đường bộ và ùn tắc giao thông; bảo vệ tính mạng, sức khỏe, tài sản của cá nhân và tài sản của cơ quan, tổ chức.

3. Bảo đảm trật tự, an toàn giao thông đường bộ là trách nhiệm của cơ quan, tổ chức, cá nhân.

4. Người tham gia giao thông đường bộ phải chấp hành các quy định của pháp luật về trật tự, an toàn giao thông đường bộ và quy định khác của pháp luật có liên quan, có trách nhiệm giữ an toàn cho mình và cho người khác.

5. Mọi hành vi vi phạm pháp luật về trật tự, an toàn giao thông đường bộ phải được phát hiện, ngăn chặn kịp thời và phải bị xử lý nghiêm minh theo quy định của pháp luật.

6. Hoạt động bảo đảm trật tự, an toàn giao thông đường bộ phải công khai, minh bạch và thuận lợi cho người dân.

7. Công tác bảo đảm trật tự, an toàn giao thông đường bộ được thực hiện thống nhất trên cơ sở phân công, phân cấp, phù hợp với chức năng, nhiệm vụ và sự phối hợp chặt chẽ giữa các cơ quan, tổ chức, cá nhân có liên quan. 


Điều 4. Chính sách của Nhà nước về trật tự, an toàn giao thông đường bộ

1. Bảo đảm ngân sách nhà nước, cơ sở vật chất, phương tiện, thiết bị hiện đại, các điều kiện bảo đảm và nâng cao năng lực thực thi nhiệm vụ của lực lượng trực tiếp bảo đảm trật tự, an toàn giao thông đường bộ. Huy động, sử dụng các nguồn lực để bảo đảm trật tự, an toàn giao thông đường bộ. Bố trí tương ứng từ các khoản thu tiền xử phạt vi phạm hành chính về trật tự, an toàn giao thông đường bộ và tiền đấu giá biển số xe sau khi nộp vào ngân sách nhà nước để tăng cường, hiện đại hóa cơ sở vật chất, phương tiện, thiết bị, phục vụ bảo đảm an ninh, trật tự, an toàn giao thông theo quy định của Chính phủ.

2. Hiện đại hoá các trung tâm chỉ huy giao thông; bảo đảm kết nối, chia sẻ Cơ sở dữ liệu về trật tự, an toàn giao thông đường bộ giữa các cơ quan nhà nước có liên quan.

3. Tạo điều kiện để cơ quan, tổ chức, cá nhân trong nước, nước ngoài nghiên cứu, ứng dụng và chuyển giao khoa học, công nghệ trong công tác bảo đảm trật tự, an toàn giao thông đường bộ, đầu tư, xây dựng, chuyển giao hệ thống, phương tiện, thiết bị giám sát phục vụ công tác bảo đảm trật tự, an toàn giao thông đường bộ; khuyến khích cơ quan, tổ chức, cá nhân tự nguyện tham gia phối hợp bảo đảm trật tự, an toàn giao thông đường bộ phù hợp với quy định của pháp luật, cung cấp thông tin, tài liệu phục vụ công tác bảo đảm trật tự, an toàn giao thông đường bộ và xử lý vi phạm pháp luật về trật tự, an toàn giao thông đường bộ.

4. Bảo đảm công bằng, bình đẳng, an toàn đối với người tham gia giao thông đường bộ; tạo thuận lợi cho trẻ em, phụ nữ mang thai, người già yếu, người khuyết tật trong tham gia giao thông đường bộ; xây dựng văn hóa giao thông; giáo dục, phổ biến, bồi dưỡng kiến thức pháp luật về giao thông đường bộ cho trẻ em, học sinh để hình thành, nâng cao ý thức tự bảo vệ bản thân và tự giác chấp hành pháp luật khi tham gia giao thông đường bộ.

5. Cơ quan, tổ chức, cá nhân tham gia phối hợp, cộng tác, hỗ trợ, giúp đỡ cơ quan nhà nước thực hiện nhiệm vụ bảo đảm trật tự, an toàn giao thông đường bộ, có thành tích thì được khen thưởng, bị thiệt hại về tài sản thì được đền bù; người bị tổn hại về danh dự, nhân phẩm thì được khôi phục; người bị thương, bị tổn hại về sức khỏe, tính mạng thì bản thân, gia đình được hưởng chế độ, chính sách theo quy định của pháp luật.


Tóm lại: Đoạn văn bản được cung cấp không đề cập đến luật giao thông đường bộ về việc sử dụng xe ô tô tự lái.
","Không tìm thấy thông tin liên quan tới câu hỏi này.
",1.0,0.7578552966098068,0.0,0.0
35,Quy định mới về việc sử dụng xe máy phân khối lớn trong khu vực đô thị là gì?,"['BỘ GIAO THÔNG VẬN TẢI\n------- CỘNG HÒA XÃ HỘI CHỦ NGHĨA VIỆT NAM\nĐộc lập - Tự do - Hạnh phúc \n--------------- Số: 52/2024/TT-BGTVT Hà Nội, ngày 15 tháng 11 năm 2024\n\nTHÔNG TƯ\n\nQUY ĐỊNH VỀ YÊU CẦU KỸ THUẬT ĐỐI VỚI XE CƠ GIỚI, XE MÁY CHUYÊN DÙNG THUỘC ĐỐI TƯỢNG NGHIÊN CỨU PHÁT TRIỂN CÓ NHU CẦU THAM GIA GIAO THÔNG ĐƯỜNG BỘ \n\nCăn cứ Luật Trật tự, an toàn giao thông đường bộ ngày 27 tháng 6 năm 2024; \n\nCăn cứ Nghị định số 56/2022/NĐ-CP ngày 24 tháng 8 năm 2022 của Chính phủ quy định chức năng, nhiệm vụ, quyền hạn và cơ cấu tổ chức của Bộ Giao thông vận tải; \n\nTheo đề nghị của Vụ trưởng Vụ Khoa học - Công nghệ và Môi trường và Cục trưởng Cục Đăng kiểm Việt Nam; \n\nBộ trưởng Bộ Giao thông vận tải ban hành Thông tư quy định về yêu cầu kỹ thuật đối với xe cơ giới, xe máy chuyên dùng thuộc đối tượng nghiên cứu phát triển có nhu cầu tham gia giao thông đường bộ. \n\nĐiều 1. Phạm vi điều chỉnh \n\nThông tư này quy định về yêu cầu kỹ thuật đối với xe cơ giới, xe máy chuyên dùng thuộc đối tượng nghiên cứu phát triển có nhu cầu tham gia giao thông đường bộ. \n\nĐiều 2. Đối tượng áp dụng \n\nThông tư này áp dụng đối với cơ sở nghiên cứu phát triển xe cơ giới, xe máy chuyên dùng thuộc đối tượng nghiên cứu phát triển có nhu cầu tham gia giao thông đường bộ và các tổ chức, cá nhân có liên quan. \n\nĐiều 3. Giải thích từ ngữ \n\nTrong Thông tư này các từ ngữ dưới đây được hiểu như sau: \n\n1. Xe cơ giới, xe máy chuyên dùng thuộc đối tượng nghiên cứu phát triển có nhu cầu tham gia giao thông đường bộ (sau đây gọi tắt là xe nghiên cứu phát triển) là các loại xe được phân loại theo quy định của Bộ trưởng Bộ Giao thông vận tải, chưa được chứng nhận chất lượng an toàn kỹ thuật và bảo vệ môi trường nhưng có nhu cầu tham gia giao thông đường bộ để đánh giá về độ bền, khả năng thích nghi của xe đối với các yếu tố thời tiết, môi trường, điều kiện giao thông \n\n\n\ntại Việt Nam hoặc nhằm mục đích cải tiến chất lượng an toàn kỹ thuật và bảo vệ môi trường của sản phẩm. \n\n2. Chạy thử trên đường là việc xe nghiên cứu phát triển tham gia giao thông đường bộ. \n\n3. Cơ sở nghiên cứu phát triển là doanh nghiệp sản xuất, lắp ráp xe trong nước đã được đánh giá việc bảo đảm chất lượng an toàn kỹ thuật và bảo vệ môi trường đạt yêu cầu theo quy định của pháp luật. \n\n4. Phụ tùng chưa qua sử dụng là các tổng thành, hệ thống, chi tiết của xe chưa được sử dụng để sản xuất, lắp ráp xe hoặc sử dụng với bất kỳ mục đích nào khác. \n\n5. Xe chưa qua sử dụng là xe chưa được đăng ký lưu hành hoặc chưa được đưa vào sử dụng với bất kỳ mục đích nào khác. \n\n6. Kiểm tra chất lượng xuất xưởng là việc cơ sở nghiên cứu phát triển kiểm tra các hệ thống an toàn kỹ thuật của xe nghiên cứu phát triển theo tiêu chuẩn của nhà sản xuất. \n\n7. Phiếu kiểm tra chất lượng xuất xưởng là tài liệu của cơ sở nghiên cứu phát triển cấp cho từng xe nghiên cứu phát triển theo mẫu quy định tại Phụ lục ban hành kèm theo Thông tư này và được in trên phôi phiếu kiểm tra chất lượng xuất xưởng của xe sản xuất, lắp ráp trong nước. \n\n8. Tải trọng giả là tải trọng giả lập, sử dụng để kiểm tra khả năng chịu tải và hoạt động của xe trong các điều kiện khác nhau, nhằm mục đích đánh giá về chất lượng an toàn kỹ thuật và hiệu quả của xe, bao gồm: khối bê tông, khối hoặc tấm kim loại, thùng nước, bao cát, thiết bị mô phỏng tải trọng. \n\n9. Tổ chức có thẩm quyền nước ngoài là tổ chức chứng nhận hoặc tổ chức dịch vụ kỹ thuật thuộc danh sách niêm yết của các nước thành viên tham gia điều ước quốc tế liên quan đến phương tiện giao thông đường bộ mà Việt Nam là thành viên. \n\nĐiều 4. Yêu cầu kỹ thuật chung \n\n1. Xe nghiên cứu phát triển phải là xe thuộc một trong các trường hợp sau: \n\na) Được sản xuất, lắp ráp từ phụ tùng chưa qua sử dụng; \n\nb) Được cải tiến, thay đổi từ xe chưa qua sử dụng và sử dụng phụ tùng chưa qua sử dụng để cải tiến, thay đổi; \n\nc) Được cải tiến, thay đổi từ xe nghiên cứu phát triển đang trong quá trình chạy thử và sử dụng phụ tùng chưa qua sử dụng để cải tiến, thay đổi; \n\nd) Đã được chạy thử trên đường tại nước ngoài. \n\n2. Kích thước và khối lượng của xe phải tuân thủ quy định sau: \n\n\n\na) Đối với xe ô tô: quy chuẩn kỹ thuật quốc gia về chất lượng an toàn kỹ thuật và bảo vệ môi trường đối với xe ô tô; \n\nb) Đối với rơ moóc, sơ mi rơ moóc: quy chuẩn kỹ thuật quốc gia về chất lượng an toàn kỹ thuật và bảo vệ môi trường đối với rơ moóc, sơ mi rơ moóc; \n\nc) Đối với xe chở người bốn bánh có gắn động cơ: quy chuẩn kỹ thuật quốc gia về chất lượng an toàn kỹ thuật và bảo vệ môi trường đối với xe chở người bốn bánh có gắn động cơ; \n\nd) Đối với xe chở hàng bốn bánh có gắn động cơ: quy chuẩn kỹ thuật quốc gia về chất lượng an toàn kỹ thuật và bảo vệ môi trường đối với xe chở hàng bốn bánh có gắn động cơ; \n\nđ) Đối với xe mô tô, xe gắn máy: quy chuẩn kỹ thuật quốc gia về chất lượng an toàn kỹ thuật và bảo vệ môi trường đối với xe mô tô, xe gắn máy; \n\ne) Đối với xe máy chuyên dùng (trừ rơ moóc, sơ mi rơ moóc được kéo bởi máy kéo): \n\nKích thước chiều dài toàn bộ của xe không được lớn hơn 12,2 m; \n\nKích thước chiều rộng toàn bộ của xe không được lớn hơn 2,5 m; \n\nKích thước chiều cao toàn bộ của xe không được lớn hơn 4,0 m; \n\nKhối lượng toàn bộ theo thiết kế và khối lượng toàn bộ theo thiết kế phân bố lên trục xe phải tuân thủ quy định tại quy chuẩn kỹ thuật quốc gia về chất lượng an toàn kỹ thuật và bảo vệ môi trường đối với xe máy chuyên dùng và không được vượt quá tải trọng của đường bộ. \n\ng) Đối với rơ moóc, sơ mi rơ moóc được kéo bởi máy kéo: \n\nKích thước chiều rộng toàn bộ của xe không được lớn hơn 2,5 m; \n\nKích thước chiều cao toàn bộ của xe không được lớn hơn 4,0 m; \n\nKhối lượng toàn bộ theo thiết kế và khối lượng toàn bộ theo thiết kế phân bố lên trục xe phải tuân thủ quy định tại quy chuẩn kỹ thuật quốc gia về chất lượng an toàn kỹ thuật và bảo vệ môi trường đối với xe máy chuyên dùng không được vượt quá tải trọng của đường bộ. \n\n3. Có tài liệu thiết kế, trong đó kết quả tính toán phải thể hiện xe phù hợp với quy định của quy chuẩn kỹ thuật quốc gia nêu tại khoản 2 Điều này. \n\n4. Các phụ tùng xe cơ giới bao gồm: pin lithium sử dụng làm nguồn dự trữ năng lượng trên xe (trường hợp xe sử dụng pin lithium làm nguồn năng lượng dự trữ), gương, đèn, kính, lốp, vành hợp kim phải thuộc kiểu loại đã được chứng nhận hoặc có kết quả thử nghiệm đạt yêu cầu tại Việt Nam hoặc của tổ chức có thẩm quyền nước ngoài. \n\n5. Trường hợp xe được dán hoặc sơn ngụy trang bên ngoài xe thì phải đảm bảo không làm che khuất tầm nhìn của người lái xe qua kính chắn gió, gương chiếu hậu, không ảnh hưởng tới chức năng, hoạt động của đèn chiếu sáng, tín hiệu, cửa thoát hiểm. \n\n6. Phải có dòng chữ “Xe chạy thử” phía trước và phía sau xe. Riêng đối với trường hợp rơ moóc và sơ mi rơ moóc được kéo bởi xe ô tô hoặc máy kéo thì dòng chữ “Xe chạy thử” phải được gắn phía trước xe kéo và phía sau xe được kéo. Kích thước, khoảng cách của dòng chữ “Xe chạy thử” được quy định như sau: chiều cao chữ cái không nhỏ hơn 60 mm, chiều rộng chữ cái không nhỏ hơn 35 mm, khoảng cách giữa các chữ cái là 15±5 mm. \n\n7. Xe ô tô, xe chở người bốn bánh có gắn động cơ, xe chở hàng bốn bánh có gắn động cơ, xe máy chuyên dùng (trừ rơ moóc, sơ mi rơ moóc được kéo bởi máy kéo), xe mô tô, gắn máy phải được trang bị thiết bị theo dõi hành trình đảm bảo ghi nhận được hành trình xe chạy, tốc độ xe chạy; camera hành trình đảm bảo ghi nhận hình ảnh phía trước và phía sau xe khi lưu thông trên đường (trừ xe mô tô, xe gắn máy camera hành trình đảm bảo ghi nhận hình ảnh phía trước xe). Các thiết bị này phải được hoạt động trong toàn bộ thời gian xe chạy thử trên đường. \n\n8. Xe phải được cơ sở nghiên cứu phát triển chạy thử trong đường nội bộ tối thiểu 10 km, kiểm tra xuất xưởng đạt yêu cầu và cấp Phiếu kiểm tra chất lượng xuất xưởng. \n\n9. Khi chất tải lên xe phải đảm bảo khối lượng toàn bộ của xe thực tế không được vượt quá khối lượng toàn bộ theo thiết kế của nhà sản xuất và đảm bảo các yêu cầu sau: \n\na) Số người trên xe không vượt quá số người tối đa cho phép chở, kể cả người lái xe quy định tại Điều 5 Thông tư này;']","**Nguồn văn bản:** /content/drive/MyDrive/ITProject_data/new_law/52_2024_TT-BGTVT_622845.docx

**Tên văn bản:** (Không có tiêu đề trong metadata)

**(Không có điều khoản trong metadata):**

**Nội dung:**
Thông tư này quy định về yêu cầu kỹ thuật đối với xe cơ giới, xe máy chuyên dùng thuộc đối tượng nghiên cứu phát triển có nhu cầu tham gia giao thông đường bộ. Nó không đề cập đến quy định về việc sử dụng xe máy phân khối lớn trong khu vực đô thị.

**Tóm lại:** Không tìm thấy thông tin liên quan tới câu hỏi này.
","Không tìm thấy thông tin liên quan tới câu hỏi này.
",1.0,0.0,0.0,0.0
36,Luật Giao thông Đường bộ 2025 có quy định gì về việc sử dụng xe ô tô chở hàng trong khu vực dân cư?,"['5. Khi có tín hiệu của xe ưu tiên, người và phương tiện tham gia giao thông đường bộ phải giảm tốc độ, đi sát lề đường bên phải hoặc dừng lại để nhường đường, trạm thu phí phải ưu tiên cho xe ưu tiên qua trạm trong mọi tình huống, không được gây cản trở.\n\n6. Chính phủ quy định về quản lý, lắp đặt, sử dụng thiết bị phát tín hiệu của xe ưu tiên và trình tự, thủ tục cấp mới, cấp lại và thu hồi giấy phép sử dụng thiết bị phát tín hiệu của xe ưu tiên.\n\n7. Bộ trưởng Bộ Công an quy định các đoàn trong nước và khách nước ngoài đến Việt Nam có bố trí xe Cảnh sát giao thông dẫn đường; quy định quy trình dẫn đường của Cảnh sát giao thông đối với các đoàn trong nước và khách nước ngoài đến Việt Nam.\n\nĐiều 28. Trường hợp chở người trên xe ô tô chở hàng\n\n1. Chỉ được chở người trên thùng xe ô tô chở hàng trong trường hợp sau đây:\n\na) Chở người đi làm nhiệm vụ cứu nạn, cứu hộ, phòng, chống thiên tai, dịch bệnh hoặc thực hiện nhiệm vụ khẩn cấp; chở người bị nạn đi cấp cứu; đưa người ra khỏi khu vực nguy hiểm hoặc trong trường hợp khẩn cấp khác theo quy định của pháp luật;\n\nb) Chở người thuộc lực lượng vũ trang nhân dân đi làm nhiệm vụ khẩn cấp; \n\nc) Chở người đi thực hành lái xe trên xe tập lái; chở người dự sát hạch lái xe trên xe sát hạch; chở công nhân đang làm nhiệm vụ duy tu, bảo dưỡng đường bộ;\n\nd) Chở người diễu hành theo đoàn khi được cơ quan có thẩm quyền cho phép.\n\n2. Xe ô tô chở hàng mà chở người trong các trường hợp quy định tại khoản 1 Điều này phải bảo đảm an toàn khi tham gia giao thông đường bộ.\n\nĐiều 29. Xe kéo xe, xe kéo rơ moóc và xe ô tô đầu kéo kéo sơ mi rơ moóc\n\n1. Một xe ô tô chỉ được kéo theo một xe ô tô hoặc xe máy chuyên dùng khác khi xe được kéo không tự chạy được, trừ trường hợp quy định tại khoản 3 Điều 53 của Luật này và phải bảo đảm các quy định sau đây:\n\na) Xe được kéo phải có người điều khiển và hệ thống lái của xe đó phải còn hiệu lực;\n\nb) Việc nối xe kéo với xe được kéo phải bảo đảm chắc chắn, an toàn; trường hợp hệ thống hãm của xe được kéo không còn hiệu lực thì xe kéo nhau phải nối bằng thanh nối cứng;\n\nc) Phía trước của xe kéo và phía sau của xe được kéo phải có biển báo hiệu, có đèn cảnh báo nhấp nháy màu vàng.\n\n2. Xe kéo rơ moóc, xe ô tô đầu kéo chỉ được kéo rơ moóc, sơ mi rơ moóc phù hợp với thiết kế của xe; việc kết nối xe kéo với rơ moóc, xe ô tô đầu kéo với sơ mi rơ moóc phải bảo đảm chắc chắn, an toàn.\n\n3. Không được chở người trên xe được kéo, trừ người điều khiển; xe kéo rơ moóc, xe ô tô đầu kéo kéo sơ mi rơ moóc không được kéo thêm rơ moóc, sơ mi rơ moóc hoặc xe khác.\n\nĐiều 30. Người đi bộ; trẻ em, phụ nữ mang thai, người già yếu, người khuyết tật, người mất năng lực hành vi dân sự tham gia giao thông đường bộ\n\n1. Người đi bộ phải tuân thủ các quy định sau đây:\n\na) Phải đi trên vỉa hè, lề đường, đường dành riêng cho người đi bộ; trường hợp đường không có vỉa hè, lề đường, đường dành riêng cho người đi bộ thì người đi bộ phải đi sát mép đường bên phải theo chiều đi của mình;\n\nb) Chỉ được qua đường ở những nơi có đèn tín hiệu, có vạch kẻ đường hoặc có cầu vượt, hầm dành cho người đi bộ và phải tuân thủ tín hiệu chỉ dẫn, báo hiệu đường bộ. Trường hợp không có đèn tín hiệu, vạch kẻ đường, cầu vượt, hầm dành cho người đi bộ thì phải quan sát các xe đang đi tới, chỉ qua đường khi bảo đảm an toàn, khi qua đường phải có tín hiệu bằng tay;\n\nc) Không được vượt qua dải phân cách, đu, bám vào phương tiện giao thông đường bộ đang di chuyển; khi mang, vác vật cồng kềnh phải bảo đảm an toàn và không gây trở ngại cho người và phương tiện tham gia giao thông đường bộ.\n\n2. Trẻ em, phụ nữ mang thai, người già yếu, người khuyết tật, người mất năng lực hành vi dân sự tham gia giao thông đường bộ được quy định như sau:\n\na) Trẻ em dưới 07 tuổi khi đi qua đường phải có người lớn dẫn dắt; \n\nb) Người khuyết tật sử dụng xe lăn có động cơ hoặc không có động cơ phải đi trên vỉa hè, lề đường và nơi có vạch kẻ đường dành cho người đi bộ và xe thô sơ;\n\nc) Người khiếm thị khi đi trên đường bộ phải có người dẫn dắt hoặc có công cụ để báo hiệu cho người khác nhận biết là người khiếm thị;\n\nd) Người mất năng lực hành vi dân sự khi đi trên đường bộ phải có người dẫn dắt;\n\nđ) Mọi người có trách nhiệm giúp đỡ trẻ em dưới 07 tuổi, phụ nữ mang thai, người già yếu, người khuyết tật, người mất năng lực hành vi dân sự khi đi qua đường.\n\nĐiều 31. Người điều khiển, người được chở, hàng hóa xếp trên xe thô sơ\n\n1. Người điều khiển xe đạp, xe đạp máy chỉ được chở một người, trừ trường hợp chở thêm một trẻ em dưới 07 tuổi thì được chở tối đa hai người.\n\n2. Người điều khiển xe đạp, xe đạp máy không được thực hiện các hành vi quy định tại khoản 3 Điều 33 của Luật này; người được chở trên xe đạp, xe đạp máy khi tham gia giao thông đường bộ không được thực hiện các hành vi quy định tại khoản 4 Điều 33 của Luật này. \n\n3. Người điều khiển, người được chở trên xe đạp máy phải đội mũ bảo hiểm theo đúng quy chuẩn kỹ thuật quốc gia và cài quai đúng quy cách. \n\n4. Người điều khiển xe thô sơ chỉ được cho xe đi hàng một, nơi có phần đường dành cho xe thô sơ thì phải đi đúng phần đường quy định; khi tham gia giao thông đường bộ trong thời gian từ 18 giờ ngày hôm trước đến 06 giờ ngày hôm sau phải sử dụng đèn hoặc có báo hiệu ở phía trước và phía sau xe. \n\n5. Hàng hóa xếp trên xe thô sơ phải bảo đảm an toàn, không gây cản trở giao thông và che khuất tầm nhìn của người điều khiển. Hàng hóa xếp trên xe không vượt quá 1/3 chiều dài thân xe và không vượt quá 01 mét phía trước và phía sau xe; không vượt quá 0,4 mét mỗi bên bánh xe.\n\nĐiều 32. Người điều khiển, dẫn dắt vật nuôi, điều khiển xe vật nuôi kéo đi trên đường bộ\n\n1. Người điều khiển, dẫn dắt vật nuôi, điều khiển xe vật nuôi kéo đi trên đường bộ phải cho vật nuôi đi sát mép đường bên phải; trường hợp cần cho vật nuôi đi ngang qua đường thì phải quan sát và chỉ được đi qua đường khi có đủ điều kiện an toàn; không được gây cản trở cho người và phương tiện tham gia giao thông đường bộ khác.\n\n2. Không được điều khiển, dẫn dắt vật nuôi, điều khiển xe vật nuôi kéo đi vào làn đường dành cho xe cơ giới. \n\n3. Không được thả vật nuôi trên đường bộ.\n\nĐiều 33. Người lái xe, người được chở, hàng hóa xếp trên xe mô tô, xe gắn máy\n\n1. Người lái xe mô tô hai bánh, xe gắn máy chỉ được chở một người, trừ những trường hợp sau thì được chở tối đa hai người:\n\na) Chở người bệnh đi cấp cứu;\n\nb) Áp giải người có hành vi vi phạm pháp luật;\n\nc) Trẻ em dưới 12 tuổi;\n\nd) Người già yếu hoặc người khuyết tật.\n\n2. Người lái xe, người được chở trên xe mô tô hai bánh, xe mô tô ba bánh, xe gắn máy phải đội mũ bảo hiểm theo đúng quy chuẩn kỹ thuật quốc gia và cài quai đúng quy cách.\n\n3. Người lái xe mô tô hai bánh, xe mô tô ba bánh, xe gắn máy không được thực hiện các hành vi sau đây:\n\na) Đi xe dàn hàng ngang;\n\nb) Đi xe vào phần đường dành cho người đi bộ và phương tiện khác;\n\nc) Sử dụng ô, thiết bị âm thanh, trừ thiết bị trợ thính;\n\nd) Buông cả hai tay; đi xe bằng một bánh đối với xe mô tô, xe gắn máy hai bánh; đi xe bằng hai bánh đối với xe mô tô, xe gắn máy ba bánh;\n\nđ) Sử dụng xe để kéo, đẩy xe khác, vật khác, dẫn dắt vật nuôi, mang, vác và chở vật cồng kềnh; chở người đứng trên xe, giá đèo hàng hoặc ngồi trên tay lái; xếp hàng hóa trên xe quá giới hạn quy định;\n\ne) Ngồi về một bên điều khiển xe; đứng, nằm trên xe điều khiển xe; thay người lái xe khi xe đang chạy; quay người về phía sau để điều khiển xe hoặc bịt mắt điều khiển xe; sử dụng chân chống hoặc vật khác quệt xuống đường khi xe đang chạy;\n\ng) Hành vi khác gây mất trật tự, an toàn giao thông đường bộ.\n\n4. Người được chở trên xe mô tô hai bánh, xe mô tô ba bánh, xe gắn máy\xa0 khi tham gia giao thông đường bộ không được thực hiện các hành vi sau đây:\n\na) Mang, vác vật cồng kềnh;\n\nb) Sử dụng ô;\n\nc) Bám, kéo hoặc đẩy các phương tiện khác;\n\nd) Đứng trên yên, giá đèo hàng hoặc ngồi trên tay lái;\n\nđ) Hành vi khác gây mất trật tự, an toàn giao thông đường bộ.']","**Nguồn văn bản:** /content/drive/MyDrive/ITProject_data/new_law/36_2024_QH15_444251.docx

**Tên văn bản:**  Không có tiêu đề trong metadata.

**(Không có điều khoản nào được ghi trong metadata):**

**Nội dung:**

Điều 28. Trường hợp chở người trên xe ô tô chở hàng

1. Chỉ được chở người trên thùng xe ô tô chở hàng trong trường hợp sau đây:

        a) Chở người đi làm nhiệm vụ cứu nạn, cứu hộ, phòng, chống thiên tai, dịch bệnh hoặc thực hiện nhiệm vụ khẩn cấp; chở người bị nạn đi cấp cứu; đưa người ra khỏi khu vực nguy hiểm hoặc trong trường hợp khẩn cấp khác theo quy định của pháp luật.

        b) Chở người thuộc lực lượng vũ trang nhân dân đi làm nhiệm vụ khẩn cấp.

        c) Chở người đi thực hành lái xe trên xe tập lái; chở người dự sát hạch lái xe trên xe sát hạch; chở công nhân đang làm nhiệm vụ duy tu, bảo dưỡng đường bộ.

        d) Chở người diễu hành theo đoàn khi được cơ quan có thẩm quyền cho phép.

2. Xe ô tô chở hàng mà chở người trong các trường hợp quy định tại khoản 1 Điều này phải bảo đảm an toàn khi tham gia giao thông đường bộ.


**Tóm lại:** Việc chở người trên thùng xe ô tô chở hàng trong khu dân cư là không được phép, trừ một số trường hợp đặc biệt như cứu nạn, cứu hộ, lực lượng vũ trang làm nhiệm vụ, thực hành lái xe, thi sát hạch lái xe, công nhân bảo dưỡng đường bộ và diễu hành được cấp phép.  Khi chở người trong các trường hợp này phải đảm bảo an toàn giao thông.
","**Nguồn văn bản:** 36_2024_QH15_444251

**Tên văn bản:** Luật Trật tự, an toàn giao thông đường bộ

**Điều 44:** Bảo đảm trật tự, an toàn giao thông đường bộ đối với phương tiện vận tải đường bộ trong đô thị

**Nội dung:**

1. Xe buýt, xe chở người bốn bánh có gắn động cơ phải hoạt động đúng tuyến, đúng lịch trình, thời gian được phép hoạt động và dừng xe, đỗ xe đúng nơi quy định.

2. Xe taxi đón, trả hành khách theo thỏa thuận giữa hành khách và người lái xe nhưng phải chấp hành các quy định của pháp luật về trật tự, an toàn giao thông đường bộ khi đón, trả hành khách.

3. Xe chở hàng phải hoạt động đúng tuyến, phạm vi và thời gian quy định đối với từng loại xe.

4. Xe vệ sinh môi trường, xe ô tô chở vật liệu xây dựng, phế thải rời phải được che phủ kín, không để rơi vãi trên đường phố và có thời gian hoạt động theo quy định của Ủy ban nhân dân cấp tỉnh.

5. Ủy ban nhân dân cấp tỉnh quy định về hoạt động vận tải đường bộ trong đô thị và tỷ lệ phương tiện vận chuyển hành khách công cộng có thiết bị hỗ trợ cho người khuyết tật trong đô thị.


**Tóm lại:** Luật Giao thông Đường bộ quy định xe chở hàng trong khu vực đô thị phải hoạt động đúng tuyến đường, phạm vi hoạt động và thời gian được phép hoạt động theo quy định của địa phương.  Ủy ban nhân dân cấp tỉnh có thẩm quyền quy định chi tiết về vấn đề này.
",0.8333333333333334,0.6357643845809579,0.0,0.0
37,Quy định mới về việc sử dụng xe ô tô chở khách trong khu vực du lịch là gì?,"['Chương II\n\nQUY ĐỊNH VỀ HOẠT ĐỘNG VẬN TẢI ĐƯỜNG BỘ TRONG NƯỚC\n\nMục 1. QUY ĐỊNH VỀ KINH DOANH VẬN TẢI BẰNG XE Ô TÔ, BẰNG XE BỐN BÁNH CÓ GẮN ĐỘNG CƠ\n\nĐiều 4. Kinh doanh vận tải hành khách bằng xe ô tô theo tuyến cố định\n\n\n\n1. Đơn vị kinh doanh vận tải có Giấy phép kinh doanh vận tải bằng xe ô tô, trong đó có loại hình kinh doanh vận tải hành khách theo tuyến cố định thì được đăng ký khai thác tuyến theo quy định tại Điều 22 của Nghị định này.\n\n2. Tuyến cố định phải xuất phát và kết thúc tại bến xe khách đã được công bố đưa vào khai thác.\n\n3. Sở Giao thông vận tải thực hiện nội dung quản lý tuyến\n\na) Xây dựng, điều chỉnh, bổ sung, công bố danh mục mạng lưới tuyến cố định nội tỉnh; thống nhất với Sở Giao thông vận tải đầu tuyến bên kia để thực hiện xây dựng, điều chỉnh, bổ sung và công bố danh mục mạng lưới tuyến cố định liên tỉnh theo nguyên tắc ổn định các tuyến đã công bố; đối với các tỉnh, thành phố có bến xe bảo đảm tổ chức vận tải theo hướng tuyến cần tuân thủ nguyên tắc tuyến vận tải đi theo hướng nào thì điểm đầu, điểm cuối là bến xe hướng đó;\n\nb) Thông báo biểu đồ chạy xe theo tuyến và cập nhật vào danh mục mạng lưới tuyến các nội dung gồm: tổng số chuyến xe tối đa được khai thác trên tuyến, giãn cách thời gian tối thiểu giữa các chuyến xe liền kề, giờ xuất bến của các chuyến xe đã có đơn vị tham gia khai thác; thông báo danh sách đơn vị đang khai thác tuyến trên hệ thống dịch vụ công trực tuyến của Bộ Giao thông vận tải; xây dựng và thông báo điểm dừng đón, trả khách trên các tuyến;\n\nc) Theo dõi, tổng hợp kết quả hoạt động vận tải của các đơn vị kinh doanh vận tải, bến xe trên tuyến.\n\n4. Xe ô tô kinh doanh vận tải hành khách theo tuyến cố định\n\na) Phải có chỗ ưu tiên cho người khuyết tật, người cao tuổi và phụ nữ mang thai;\n\nb) Phải có phù hiệu “XE TUYẾN CỐ ĐỊNH” theo Mẫu số 01 Phụ lục XIII kèm theo Nghị định này và được dán cố định tại góc trên bên phải ngay sát phía dưới vị trí của Tem kiểm định, mặt trong kính chắn gió phía trước của xe;\n\nc) Phải được niêm yết đầy đủ các thông tin trên xe.\n\n5. Xe ô tô sử dụng để vận tải trung chuyển hành khách\n\na) Sử dụng xe ô tô chở người đến 29 chỗ (không kể chỗ của người lái xe);\n\nb) Phải có phù hiệu “XE TRUNG CHUYỂN” theo Mẫu số 02 Phụ lục XIII kèm theo Nghị định này và được dán cố định tại góc trên bên phải ngay sát phía dưới vị trí của Tem kiểm định, mặt trong kính chắn gió phía trước của xe; phải được niêm yết đầy đủ các thông tin trên xe;\n\nc) Chỉ được hoạt động vận tải trung chuyển hành khách trong phạm vi địa bàn địa phương (cấp tỉnh) nơi cấp phù hiệu “XE TRUNG CHUYỂN”.\n\n6. Quy định đối với hoạt động tăng cường phương tiện để giải toả hành khách trên tuyến cố định\n\na) Tăng cường phương tiện vào các dịp Lễ, Tết và các kỳ thi trung học phổ thông Quốc gia, tuyển sinh đại học, cao đẳng: đơn vị kinh doanh vận tải hành khách đang khai thác theo tuyến cố định căn cứ vào nhu cầu đi lại, thống nhất với bến xe khách xây dựng phương án tăng cường phương tiện trên tuyến; gửi phương án tăng cường đến Sở Giao thông vận tải hai đầu tuyến phối hợp, quản lý;\n\nb) Tăng cường phương tiện vào các ngày cuối tuần (thứ Sáu, thứ Bảy và Chủ nhật) có lượng khách tăng đột biến: đơn vị kinh doanh vận tải hành khách đang khai thác tuyến cố định căn cứ vào nhu cầu đi lại, thống nhất với bến xe khách xây dựng phương án tăng cường phương tiện trên tuyến; thông báo đến Sở Giao thông vận tải hai đầu tuyến để thực hiện trong năm. Căn cứ phương án tăng cường phương tiện đã thông báo đến Sở Giao thông vận tải hai đầu tuyến và lưu lượng khách thực tế tại bến xe, bến xe khách xác nhận chuyến xe tăng cường vào Lệnh vận chuyển của đơn vị kinh doanh vận tải khai thác tuyến khi thực hiện. Xe sử dụng để tăng cường là xe đã được cấp phù hiệu “XE TUYẾN CỐ ĐỊNH”, “XE HỢP ĐỒNG” , “XE BUÝT” liên tỉnh còn giá trị sử dụng.\n\n7. Đơn vị kinh doanh dịch vụ bến xe khách xác nhận vào Lệnh vận chuyển của đơn vị kinh doanh vận tải khi xe xuất bến. Nội dung xác nhận gồm: biển kiểm soát xe, số lượng hành khách và giờ xe xuất bến.\n\n8. Đơn vị kinh doanh vận tải hành khách bằng xe ô tô theo tuyến cố định thực hiện lưu trữ Lệnh vận chuyển của các chuyến xe đã thực hiện trong thời gian tối thiểu 03 năm.\n\nĐiều 5. Kinh doanh vận tải hành khách công cộng bằng xe buýt\n\n1. Đơn vị kinh doanh vận tải có Giấy phép kinh doanh vận tải bằng ô tô, trong đó có loại hình kinh doanh vận tải hành khách công cộng bằng xe buýt thì được tham gia kinh doanh vận tải công cộng bằng xe buýt trên các tuyến xe buýt nội tỉnh, tuyến xe buýt liên tỉnh.\n\n2. Xe ô tô kinh doanh vận tải hành khách công cộng bằng xe buýt\n\na) Phải có chỗ ưu tiên cho người khuyết tật, người cao tuổi và phụ nữ mang thai và trẻ em dưới 6 tuổi;\n\nb) Phải có phù hiệu “XE BUÝT” theo Mẫu số 03 Phụ lục XIII kèm theo Nghị định này và được dán cố định tại góc trên bên phải ngay sát phía dưới vị trí của Tem kiểm định, mặt trong kính chắn gió phía trước của xe; phải được niêm yết đầy đủ các thông tin trên xe;\n\nc) Vị trí, số chỗ ngồi, chỗ đứng cho hành khách và các quy định kỹ thuật khác đối với xe buýt theo quy chuẩn kỹ thuật quốc gia về chất lượng an toàn kỹ thuật và bảo vệ môi trường đối với xe ô tô.\n\n3. Sở Giao thông vận tải thực hiện nội dung quản lý tuyến đối với tuyến xe buýt nội tỉnh, tuyến xe buýt liên tỉnh\n\na) Xây dựng, điều chỉnh, bổ sung và công bố danh mục mạng lưới tuyến, biểu đồ chạy xe trên các tuyến, giá vé;\n\nb) Đề xuất, xây dựng và báo cáo Ủy ban nhân dân cấp tỉnh: về các chính sách hỗ trợ của nhà nước về khuyến khích phát triển vận tải hành khách công cộng bằng xe buýt trên địa bàn địa phương; việc tổ chức đấu thầu, tiêu chí để đặt hàng khai thác đối với tuyến xe buýt trong danh mục mạng lưới tuyến đã công bố theo quy định của pháp luật về thầu; tổ chức đặt hàng khai thác đối với tuyến xe buýt liên tỉnh và tuyến xe buýt có sử dụng xe ô tô thoáng nóc chở khách du lịch không được hỗ trợ kinh phí hoạt động từ ngân sách nhà nước trong danh mục mạng lưới tuyến đã công bố;\n\nc) Xây dựng, bảo trì và quản lý kết cấu hạ tầng phục vụ hoạt động xe buýt; quyết định tiêu chí kỹ thuật, vị trí điểm đầu, điểm cuối và điểm dừng của tuyến xe buýt trên địa bàn địa phương;\n\nd) Theo dõi, tổng hợp kết quả hoạt động vận tải của các đơn vị kinh doanh vận tải trên tuyến; thống kê sản lượng hành khách.\n\n4. Đơn vị kinh doanh vận tải hành khách bằng xe buýt thực hiện lưu trữ Lệnh vận chuyển như sau:\n\na) Lưu trữ Lệnh vận chuyển của các chuyến xe đã thực hiện (không được hỗ trợ kinh phí hoạt động từ ngân sách nhà nước) trong thời hạn ít nhất là 03 năm;\n\nb) Lưu trữ Lệnh vận chuyển của các chuyến xe đã thực hiện (được hỗ trợ kinh phí hoạt động từ ngân sách nhà nước) theo thời hạn tài liệu kế toán phải lưu trữ được quy định tại khoản 5 Điều 41 Luật Kế toán năm 2015.\n\n5. Xe buýt được ưu tiên bố trí nơi dừng, đỗ để đón, trả khách tại các bến xe, nhà ga, sân bay, bến cảng, khu du lịch, điểm du lịch, cơ sở lưu trú du lịch, điểm tham quan du lịch, địa điểm văn hóa, thể thao, trung tâm thương mại, đầu mối giao thông và các địa điểm kết nối với các phương thức vận tải khác; được ưu tiên hoạt động khi tổ chức giao thông tại đô thị.\n\nĐiều 6. Kinh doanh vận tải hành khách bằng xe taxi\n\n1. Đơn vị kinh doanh vận tải có Giấy phép kinh doanh vận tải bằng ô tô, trong đó có loại hình kinh doanh vận tải hành khách bằng taxi thì được tham gia kinh doanh vận tải hành khách bằng taxi.\n\n2. Xe ô tô kinh doanh vận tải hành khách bằng taxi\n\na) Xe ô tô phải bảo đảm đúng theo quy định tại khoản 9 Điều 56 Luật Đường bộ;\n\nb) Phải có phù hiệu “XE TAXI” theo Mẫu số 04 Phụ lục XIII kèm theo Nghị định này và được dán cố định tại góc trên bên phải ngay sát phía dưới vị trí của Tem kiểm định, mặt trong kính chắn gió phía trước của xe; phải được niêm yết đầy đủ các thông tin trên xe theo quy định;']","**Nguồn văn bản:** /content/drive/MyDrive/ITProject_data/new_law/158_2024_ND-CP_636875.docx

**Tên văn bản:** (Không có tiêu đề trong metadata)


**Nội dung:**

Xe ô tô chở khách hoạt động trong khu vực du lịch được đề cập đến trong Điều 5 của văn bản, cụ thể là xe buýt được ưu tiên:

5. Xe buýt được ưu tiên bố trí nơi dừng, đỗ để đón, trả khách tại các bến xe, nhà ga, sân bay, bến cảng, khu du lịch, điểm du lịch, cơ sở lưu trú du lịch, điểm tham quan du lịch, địa điểm văn hóa, thể thao, trung tâm thương mại, đầu mối giao thông và các địa điểm kết nối với các phương thức vận tải khác; được ưu tiên hoạt động khi tổ chức giao thông tại đô thị.

Tóm lại: Xe buýt được ưu tiên dừng, đỗ để đón, trả khách tại các khu du lịch, điểm du lịch và các địa điểm liên quan đến du lịch.
","**Nguồn văn bản:** 35_2024_QH15_588811

**Tên văn bản:** Luật Đường bộ

**Điều 58:** Quyền và nghĩa vụ của đơn vị kinh doanh vận tải hành khách bằng xe ô tô

**Nội dung:**

1. Đơn vị kinh doanh vận tải hành khách bằng xe ô tô có các quyền sau đây:

	a) Thu tiền vận tải.

	b) Từ chối vận tải hành khách có hành vi gây rối trật tự công cộng trên xe ô tô, cản trở hoạt động của đơn vị kinh doanh vận tải hành khách bằng xe ô tô, ảnh hưởng đến tính mạng, sức khỏe, tài sản của người khác, gian lận vé.

	c) Quyết định các chính sách ưu đãi để phục vụ khách hàng và mở rộng thị trường kinh doanh.


2. Đơn vị kinh doanh vận tải hành khách bằng xe ô tô có các nghĩa vụ sau đây:

	a) Chấp hành và thực hiện đầy đủ quy định về kinh doanh, điều kiện kinh doanh vận tải bằng xe ô tô, cam kết về chất lượng vận tải, hợp đồng vận tải.

	b) Mua bảo hiểm cho hành khách; phí bảo hiểm được tính vào giá vé, giá trị hợp đồng vận tải.

	c) Thực hiện kê khai giá theo quy định của pháp luật về giá; cung cấp vé, chứng từ thu tiền vận tải.

	d) Bồi thường thiệt hại do người lao động, người đại diện của đơn vị kinh doanh vận tải hành khách bằng xe ô tô gây ra trong quá trình vận tải theo quy định của pháp luật.

	đ) Thực hiện việc miễn giảm giá vé đối với người cao tuổi, người khuyết tật và các đối tượng chính sách khác theo quy định của pháp luật.

	e) Không được để tổ chức, cá nhân không có giấy phép kinh doanh vận tải bằng xe ô tô loại hình vận tải hành khách thực hiện điều hành phương tiện và lái xe hoặc quyết định giá cước để vận tải hành khách.

	g) Không được sử dụng người không có giấy phép lái xe hoặc có giấy phép lái xe nhưng không phù hợp với loại xe, người có giấy phép lái xe bị trừ hết điểm, người đang bị tước hoặc bị thu hồi giấy phép lái xe để điều khiển phương tiện vận tải hành khách.


**Nguồn văn bản:** 36_2024_QH15_444251

**Tên văn bản:** Luật Trật tự, an toàn giao thông đường bộ

**Điều 55:** Bảo đảm trật tự, an toàn giao thông đường bộ đối với trường hợp xe ô tô của người nước ngoài đăng ký tại nước ngoài có tay lái ở bên phải tham gia giao thông tại Việt Nam; xe cơ giới nước ngoài do người nước ngoài đưa vào Việt Nam du lịch

**Nội dung:**

1. Xe ô tô của người nước ngoài đăng ký tại nước ngoài có tay lái ở bên phải tham gia giao thông tại Việt Nam, xe cơ giới nước ngoài do người nước ngoài đưa vào Việt Nam du lịch phải được cơ quan có thẩm quyền cấp phép.

2. Cơ quan cấp phép cho xe ô tô của người nước ngoài đăng ký tại nước ngoài có tay lái ở bên phải tham gia giao thông tại Việt Nam, xe cơ giới nước ngoài do người nước ngoài đưa vào Việt Nam du lịch thông báo ngay cho cơ quan quản lý xuất nhập cảnh.

3. Việc lưu hành xe ô tô của người nước ngoài đăng ký tại nước ngoài có tay lái ở bên phải tham gia giao thông tại Việt Nam, xe cơ giới nước ngoài do người nước ngoài đưa vào Việt Nam du lịch được quy định như sau:

	a) Chấp hành quy định của pháp luật về trật tự, an toàn giao thông đường bộ của Việt Nam. Trường hợp điều ước quốc tế mà nước Cộng hòa xã hội chủ nghĩa Việt Nam là thành viên có quy định khác thì áp dụng theo điều ước quốc tế đó.

	b) Tham gia giao thông đúng trong phạm vi, tuyến đường, thời gian đã được cơ quan có thẩm quyền của Việt Nam cấp phép.

	c) Xe ô tô của người nước ngoài đăng ký tại nước ngoài có tay lái ở bên phải phải đi theo đoàn và có người, phương tiện hỗ trợ, hướng dẫn giao thông.

	d) Tổ chức, cá nhân đưa xe có tay lái ở bên phải vào Việt Nam có trách nhiệm bố trí xe hướng dẫn giao thông, bảo đảm an toàn giao thông khi phương tiện lưu hành trên lãnh thổ Việt Nam.

4. Chính phủ quy định chi tiết điều này.


Tóm lại: Các quy định về xe chở khách tập trung vào quyền và nghĩa vụ của đơn vị kinh doanh vận tải (như bảo hiểm, giá vé, điều kiện lái xe), cũng như quy định về xe nước ngoài có tay lái bên phải khi tham gia giao thông tại Việt Nam (như việc cấp phép, đi theo đoàn, có xe hướng dẫn).  Chưa có thông tin cụ thể về quy định sử dụng xe ô tô chở khách *trong khu vực du lịch*.
",0.9473684210526315,0.7620479724750139,0.1,0.0
38,Luật Giao thông Đường bộ 2025 có quy định gì về việc sử dụng xe ô tô chở học sinh?,"['CHÍNH PHỦ\n------- CỘNG HÒA XÃ HỘI CHỦ NGHĨA VIỆT NAM\nĐộc lập - Tự do - Hạnh phúc \n--------------- Số: 151/2024/NĐ-CP Hà Nội, ngày 15 tháng 11 năm 2024\n\nNGHỊ ĐỊNH\n\nQUY ĐỊNH CHI TIẾT MỘT SỐ ĐIỀU VÀ BIỆN PHÁP THI HÀNH LUẬT TRẬT TỰ, AN TOÀN GIAO THÔNG ĐƯỜNG BỘ\n\nCăn cứ Luật Tổ chức Chính phủ ngày 19 tháng 6 năm 2015; Luật sửa đổi, bổ sung một số điều của Luật Tổ chức Chính phủ và Luật Tổ chức chính quyền địa phương ngày 22 tháng 11 năm 2019;\n\nCăn cứ Luật Trật tự, an toàn giao thông đường bộ ngày 27 tháng 6 năm 2024;\n\nTheo đề nghị của Bộ trưởng Bộ Công an;\n\nChính phủ ban hành Nghị định quy định chi tiết một số điều và biện pháp thi hành Luật Trật tự, an toàn giao thông đường bộ.\n\nChương I\n\nNHỮNG QUY ĐỊNH CHUNG\n\nĐiều 1. Phạm vi điều chỉnh\n\nNghị định này quy định chi tiết một số điều và biện pháp thi hành Luật Trật tự, an toàn giao thông đường bộ bao gồm:\n\n1. Điều 6 về giáo dục kiến thức pháp luật về trật tự, an toàn giao thông đường bộ.\n\n2. Khoản 3 Điều 7 về Cơ sở dữ liệu về trật tự, an toàn giao thông đường bộ; việc thu thập, quản lý, khai thác thông tin trong Cơ sở dữ liệu về trật tự, an toàn giao thông đường bộ.\n\n3. Khoản 6 Điều 27 về quản lý, lắp đặt, sử dụng thiết bị phát tín hiệu của xe ưu tiên và trình tự, thủ tục cấp mới, cấp lại, thu hồi giấy phép sử dụng thiết bị phát tín hiệu của xe ưu tiên.\n\n4. Khoản 5 Điều 35 về lắp thiết bị giám sát hành trình đối với xe ô tô kinh doanh vận tải; lắp thiết bị giám sát hành trình và thiết bị ghi nhận hình ảnh người lái xe đối với xe ô tô chở người từ 08 chỗ trở lên (không kể chỗ của người lái xe) kinh doanh vận tải, xe ô tô đầu kéo, xe cứu thương, xe cứu hộ giao thông đường bộ; cấp phép hoạt động đối với phương tiện giao thông thông minh; điều kiện hoạt động của xe thô sơ.\n\n\n\n5. Điểm a khoản 1 Điều 46 về màu sơn của xe ô tô kinh doanh vận tải chở trẻ em mầm non, học sinh.\n\n6. Điểm đ khoản 4 Điều 52 về trường hợp cần thiết phải có người, phương tiện hỗ trợ lái xe, cảnh báo cho người, phương tiện tham gia giao thông đường bộ khác và thực hiện các biện pháp bảo đảm an toàn giao thông đường bộ đối với xe quá khổ giới hạn, xe quá tải trọng, xe bánh xích, xe vận chuyển hàng siêu trường, siêu trọng lưu hành trên đường bộ.\n\n7. Khoản 4 Điều 55 về bảo đảm trật tự, an toàn giao thông đường bộ đối với xe ô tô của người nước ngoài đăng ký tại nước ngoài có tay lái ở bên phải tham gia giao thông tại Việt Nam; xe cơ giới nước ngoài do người nước ngoài đưa vào Việt Nam du lịch.\n\nĐiều 2. Đối tượng áp dụng\n\nNghị định này áp dụng đối với cơ quan, tổ chức, cá nhân trong nước và nước ngoài liên quan đến trật tự, an toàn giao thông đường bộ trên lãnh thổ nước Cộng hòa xã hội chủ nghĩa Việt Nam.\n\nĐiều 3. Phụ lục kèm theo Nghị định\n\n1. Phụ lục I: Yêu cầu kỹ thuật thiết bị phát tín hiệu của xe ưu tiên.\n\n2. Phụ lục II: Biểu mẫu liên quan đến cấp giấy phép sử dụng thiết bị phát tín hiệu của xe ưu tiên.\n\n3. Phụ lục III: Biểu mẫu liên quan đến cấp giấy phép hoạt động phương tiện giao thông thông minh.\n\n4. Phụ lục IV: Biểu mẫu liên quan đến chấp thuận doanh nghiệp kinh doanh dịch vụ lữ hành quốc tế của Việt Nam tổ chức cho người nước ngoài đưa xe cơ giới nước ngoài vào Việt Nam du lịch; tổ chức, cá nhân đưa xe ô tô có tay lái ở bên phải vào tham gia giao thông tại Việt Nam không phải mục đích du lịch.\n\nChương II\n\nGIÁO DỤC KIẾN THỨC PHÁP LUẬT VỀ TRẬT TỰ, AN TOÀN GIAO THÔNG ĐƯỜNG BỘ\n\nĐiều 4. Nội dung giáo dục kiến thức pháp luật về trật tự, an toàn giao thông đường bộ trong các cơ sở giáo dục\n\n1. Nội dung giáo dục kiến thức pháp luật về trật tự, an toàn giao thông đường bộ đối với trẻ em tại cơ sở giáo dục mầm non bao gồm:\n\na) Nhận biết loại phương tiện giao thông đường bộ;\n\nb) Nhận biết đèn tín hiệu giao thông, ý nghĩa tín hiệu đèn và một số biển báo hiệu đường bộ thường gặp;\n\n\n\nc) An toàn khi đi bộ, trên các phương tiện giao thông đường bộ;\n\nd) Biết đội mũ bảo hiểm đúng cách;\n\nđ) Nơi vui chơi an toàn;\n\ne) Những nguy hiểm, hậu quả khi không tuân thủ quy định an toàn giao thông đường bộ.\n\n2. Nội dung giáo dục kiến thức pháp luật về trật tự, an toàn giao thông đường bộ đối với học sinh tiểu học bao gồm:\n\na) Nhận biết hiệu lệnh của người điều khiển giao thông; tín hiệu đèn giao thông; biển báo hiệu đường bộ thường gặp;\n\nb) Một số quy tắc giao thông đường bộ thường gặp; nhận biết được sự cần thiết phải tuân thủ quy tắc giao thông đường bộ;\n\nc) Đi qua đường bộ an toàn;\n\nd) Chọn và đội mũ bảo hiểm đúng cách;\n\nđ) Lên, xuống xe đạp, xe gắn máy, xe mô tô an toàn;\n\ne) Làm quen với xe đạp và cách điều khiển xe đạp an toàn;\n\ng) Một số kỹ năng phòng tránh tai nạn giao thông đường bộ.\n\n3. Nội dung giáo dục kiến thức pháp luật về trật tự, an toàn giao thông đường bộ đối với học sinh trung học cơ sở bao gồm:\n\na) Quy tắc giao thông đường bộ;\n\nb) Nhận biết và chấp hành báo hiệu đường bộ;\n\nc) Đội mũ bảo hiểm đạt chuẩn và cài quai đúng quy cách khi tham gia giao thông đường bộ;\n\nd) An toàn khi ngồi trên xe cơ giới;\n\nđ) Cách điều khiển xe đạp, xe đạp điện an toàn;\n\ne) Phòng ngừa rủi ro, hậu quả của tai nạn giao thông và xử lý sự cố giao thông.\n\n4. Nội dung giáo dục kiến thức pháp luật về trật tự, an toàn giao thông đường bộ đối với học sinh trung học phổ thông, học sinh cơ sở giáo dục nghề nghiệp bao gồm:\n\na) Quy tắc giao thông đường bộ; báo hiệu đường bộ; tốc độ và khoảng cách an toàn của xe cơ giới;\n\nb) Dự đoán và phòng tránh nguy hiểm;\n\nc) Cách điều khiển xe gắn máy an toàn.\n\nĐiều 5. Hướng dẫn kỹ năng lái xe gắn máy an toàn cho học sinh bắt đầu vào học trung học phổ thông và cơ sở giáo dục nghề nghiệp\n\n1. Nội dung hướng dẫn kỹ năng lái xe gắn máy an toàn bao gồm:\n\na) Phương pháp nhận biết và xử lý các tình huống nguy hiểm khi lái xe;\n\nb) Cấu tạo và chức năng của các bộ phận xe gắn máy, phương pháp bảo dưỡng xe, kiểm tra xe an toàn;\n\nc) Văn hóa tham gia giao thông; trách nhiệm của người điều khiển xe cơ giới; cứu giúp người bị tai nạn giao thông;\n\nd) Cách khởi động và tắt máy, cách sử dụng ga, phanh, thay đổi số, sử dụng các thiết bị bảo hộ;\n\nđ) Tư thế lên ngồi lái xe, xuống xe an toàn;\n\ne) Khởi hành, điều chỉnh tốc độ phù hợp, dừng xe an toàn;\n\ng) Lái xe theo 04 hình mẫu bao gồm: đi qua hình số 8, đi qua vạch đường thẳng, đi qua đường có vạch cản, đi qua đường gồ ghề;\n\nh) Các nội dung khác có liên quan.\n\n2. Học sinh thực hành lái xe gắn máy an toàn theo quy định tại điểm d, điểm đ, điểm e, điểm g khoản 1 Điều này.\n\n3. Thời gian hướng dẫn và đánh giá kỹ năng lái xe gắn máy an toàn theo hướng dẫn của cơ quan Cảnh sát giao thông trực tiếp thực hiện phù hợp với yêu cầu thực tiễn tại cơ sở giáo dục và bảo đảm nội dung hướng dẫn quy định tại khoản 1 Điều này.\n\nĐiều 6. Trách nhiệm hướng dẫn kỹ năng lái xe gắn máy an toàn cho học sinh\n\n1. Bộ Công an chủ trì, phối hợp với Bộ Giáo dục và Đào tạo, Bộ Lao động - Thương binh và Xã hội xây dựng chương trình giảng dạy, tài liệu hướng dẫn thực hành kỹ năng lái xe gắn máy an toàn bảo đảm phù hợp với đối tượng, nội dung quy định tại Điều 5 của Nghị định này.\n\n2. Bộ Giáo dục và Đào tạo chủ trì, chỉ đạo cơ quan quản lý trường trung học phổ thông chuẩn bị cơ sở vật chất, phương tiện xe gắn máy để phối hợp với lực lượng Cảnh sát giao thông tổ chức hướng dẫn kỹ năng lái xe gắn máy an toàn.\n\n3. Bộ Lao động - Thương binh và Xã hội chủ trì, chỉ đạo cơ quan quản lý cơ sở giáo dục nghề nghiệp chuẩn bị cơ sở vật chất, phương tiện xe gắn máy để phối hợp với lực lượng Cảnh sát giao thông tổ chức hướng dẫn kỹ năng lái xe gắn máy an toàn.\n\n4. Trách nhiệm của trường trung học phổ thông, cơ sở giáo dục nghề nghiệp:\n\na) Tổ chức cho học sinh, gia đình học sinh ký cam kết chấp hành quy định của pháp luật về trật tự, an toàn giao thông đường bộ, bao gồm các nội dung: học sinh không điều khiển xe mô tô khi chưa đủ điều kiện theo quy định, không điều khiển xe gắn máy khi chưa hoàn thành chương trình hướng dẫn kỹ năng lái xe gắn máy an toàn; gia đình học sinh không giao xe cho học sinh điều khiển khi chưa đủ điều kiện theo quy định của pháp luật;']","**Nguồn văn bản:** /content/drive/MyDrive/ITProject_data/new_law/151_2024_ND-CP_619564.docx

**Tên văn bản:** (Không có tiêu đề trong metadata)

**(Không có article_title):**

**Nội dung:**
Nghị định 151/2024/NĐ-CP quy định chi tiết một số điều và biện pháp thi hành Luật Trật tự, an toàn giao thông đường bộ. Điểm a khoản 1 Điều 46 quy định về màu sơn của xe ô tô kinh doanh vận tải chở trẻ em mầm non, học sinh. Tuy nhiên, nội dung chi tiết về màu sơn không được đề cập trong đoạn trích này.  Các điều khoản khác trong nghị định này tập trung vào giáo dục kiến thức pháp luật về trật tự an toàn giao thông đường bộ, quản lý thiết bị phát tín hiệu ưu tiên, thiết bị giám sát hành trình,  và một số quy định khác liên quan đến an toàn giao thông.

**Tóm lại:** Văn bản đề cập đến quy định về màu sơn xe ô tô kinh doanh vận tải chở học sinh tại điểm a khoản 1 Điều 46, nhưng không cung cấp chi tiết về màu sơn cụ thể. Để biết màu sơn theo quy định, cần tra cứu đầy đủ Nghị định 151/2024/NĐ-CP.
","**Nguồn văn bản:** 36_2024_QH15_444251

**Tên văn bản:** Luật Trật tự, an toàn giao thông đường bộ

**Điều 46:** Bảo đảm trật tự, an toàn giao thông đường bộ đối với xe ô tô chở trẻ em mầm non, học sinh

**Nội dung:**

1. Xe ô tô kinh doanh vận tải chở trẻ em mầm non, học sinh phải đáp ứng các yêu cầu sau đây:

	a) Bảo đảm các điều kiện quy định tại khoản 1 và khoản 2 điều 35 của luật này; có thiết bị ghi nhận hình ảnh trẻ em mầm non, học sinh và thiết bị có chức năng cảnh báo, chống bỏ quên trẻ em trên xe; có niên hạn sử dụng không quá 20 năm; có màu sơn theo quy định của Chính phủ.

	b) Xe ô tô chở trẻ em mầm non hoặc học sinh tiểu học phải có dây đai an toàn phù hợp với lứa tuổi hoặc sử dụng xe có ghế ngồi phù hợp với lứa tuổi theo quy định của pháp luật.

2. Xe ô tô kinh doanh vận tải kết hợp với hoạt động đưa đón trẻ em mầm non, học sinh phải đáp ứng các yêu cầu theo quy định tại khoản 3 điều 10, khoản 1 và khoản 2 điều 35 của luật này; có thiết bị ghi nhận hình ảnh trẻ em mầm non, học sinh và thiết bị có chức năng cảnh báo, chống bỏ quên trẻ em trên xe đáp ứng yêu cầu theo quy định tại điểm a khoản 1 điều này.

3. Khi đưa đón trẻ em mầm non, học sinh tiểu học phải bố trí tối thiểu 01 người quản lý trên mỗi xe ô tô để hướng dẫn, giám sát, duy trì trật tự và bảo đảm an toàn cho trẻ em mầm non, học sinh tiểu học trong suốt chuyến đi. Trường hợp xe từ 29 chỗ trở lên (không kể chỗ của người lái xe) mà chở từ 27 trẻ em mầm non và học sinh tiểu học trở lên phải bố trí tối thiểu 02 người quản lý trên mỗi xe ô tô. Người quản lý, người lái xe có trách nhiệm kiểm tra trẻ em mầm non, học sinh tiểu học khi xuống xe; không được để trẻ em mầm non, học sinh tiểu học trên xe khi người quản lý và người lái xe đã rời xe.

4. Người lái xe ô tô đưa đón trẻ em mầm non, học sinh phải có tối thiểu 02 năm kinh nghiệm lái xe vận tải hành khách.

5. Cơ sở giáo dục phải xây dựng quy trình bảo đảm an toàn khi đưa đón trẻ em mầm non, học sinh; hướng dẫn cho lái xe và người quản lý trẻ em mầm non, học sinh nắm vững và thực hiện đúng quy trình; chịu trách nhiệm bảo đảm trật tự, an toàn giao thông đường bộ khi tổ chức đưa đón trẻ em mầm non, học sinh của cơ sở giáo dục đó.

6. Xe đưa đón trẻ em mầm non, học sinh được ưu tiên trong tổ chức phân luồng, điều tiết giao thông, bố trí nơi dừng xe, đỗ xe tại khu vực trường học và tại các điểm trên lộ trình đưa đón trẻ em mầm non, học sinh.


**Nguồn văn bản:** 35_2024_QH15_588811

**Tên văn bản:** Luật Đường bộ

**Điều 70:** Hoạt động vận tải đưa đón trẻ em mầm non, học sinh bằng xe ô tô

**Nội dung:**

1. Hoạt động vận tải đưa đón trẻ em mầm non, học sinh bằng xe ô tô là hoạt động sử dụng xe ô tô để đưa đón trẻ em mầm non, học sinh đi lại giữa nơi ở và nơi học tập hoặc tham gia các hoạt động khác.

2. Hoạt động vận tải đưa đón trẻ em mầm non, học sinh bằng xe ô tô do cơ sở giáo dục tự tổ chức hoặc do đơn vị kinh doanh vận tải thực hiện và được quy định như sau:

	a) Trường hợp cơ sở giáo dục tự tổ chức hoạt động đưa đón trẻ em mầm non, học sinh phải đáp ứng quy định về hoạt động vận tải nội bộ bằng xe ô tô.

	b) Trường hợp đơn vị kinh doanh vận tải thực hiện đưa đón trẻ em mầm non, học sinh bằng xe ô tô phải đáp ứng quy định về hoạt động kinh doanh vận tải bằng xe ô tô.

3. Hoạt động vận tải đưa đón trẻ em mầm non, học sinh bằng xe ô tô phải tuân thủ quy định của pháp luật về trật tự, an toàn giao thông đường bộ.


**Nguồn văn bản:** 151_2024_ND-CP_619564

**Tên văn bản:** Nghị định Quy định chi tiết một số điều và biện pháp thi hành luật trật tự, an toàn giao thông đường bộ

**Điều 30:** Màu sơn của xe ô tô kinh doanh vận tải chở trẻ em mầm non, học sinh

**Nội dung:**

1. Xe ô tô kinh doanh vận tải chở trẻ em mầm non, học sinh quy định tại điểm a khoản 1 Điều 46 Luật Trật tự, an toàn giao thông đường bộ phải được sơn màu vàng đậm phủ bên ngoài thân xe; mặt trước và hai cạnh bên xe phía trên cửa sổ phải có biển báo dấu hiệu nhận biết là xe chuyên dùng chở trẻ em mầm non, học sinh.

2. Xe ô tô kinh doanh vận tải kết hợp với hoạt động đưa đón trẻ em mầm non, học sinh quy định tại khoản 2 Điều 46 Luật Trật tự, an toàn giao thông đường bộ phải có biển báo dấu hiệu nhận biết là xe chở trẻ em mầm non, học sinh đặt ở mặt trước và hai cạnh bên xe phía trên cửa sổ.


**Tóm lại:** Xe ô tô đưa đón học sinh phải tuân thủ các quy định về an toàn giao thông đường bộ, bao gồm các yêu cầu về điều kiện xe, người lái xe, người quản lý trên xe, màu sơn (vàng đậm đối với xe kinh doanh vận tải), biển báo nhận biết, thiết bị an toàn (ghi hình, cảnh báo chống bỏ quên), kinh nghiệm lái xe, quy trình đưa đón an toàn và được ưu tiên trong phân luồng giao thông. Cơ sở giáo dục tự tổ chức đưa đón hoặc thuê đơn vị vận tải đều phải tuân thủ các quy định tương ứng.
",1.0,0.0,0.23076923076923078,0.0
39,Quy định mới về việc sử dụng xe ô tô chở người khuyết tật là gì?,"['5. Khi có tín hiệu của xe ưu tiên, người và phương tiện tham gia giao thông đường bộ phải giảm tốc độ, đi sát lề đường bên phải hoặc dừng lại để nhường đường, trạm thu phí phải ưu tiên cho xe ưu tiên qua trạm trong mọi tình huống, không được gây cản trở.\n\n6. Chính phủ quy định về quản lý, lắp đặt, sử dụng thiết bị phát tín hiệu của xe ưu tiên và trình tự, thủ tục cấp mới, cấp lại và thu hồi giấy phép sử dụng thiết bị phát tín hiệu của xe ưu tiên.\n\n7. Bộ trưởng Bộ Công an quy định các đoàn trong nước và khách nước ngoài đến Việt Nam có bố trí xe Cảnh sát giao thông dẫn đường; quy định quy trình dẫn đường của Cảnh sát giao thông đối với các đoàn trong nước và khách nước ngoài đến Việt Nam.\n\nĐiều 28. Trường hợp chở người trên xe ô tô chở hàng\n\n1. Chỉ được chở người trên thùng xe ô tô chở hàng trong trường hợp sau đây:\n\na) Chở người đi làm nhiệm vụ cứu nạn, cứu hộ, phòng, chống thiên tai, dịch bệnh hoặc thực hiện nhiệm vụ khẩn cấp; chở người bị nạn đi cấp cứu; đưa người ra khỏi khu vực nguy hiểm hoặc trong trường hợp khẩn cấp khác theo quy định của pháp luật;\n\nb) Chở người thuộc lực lượng vũ trang nhân dân đi làm nhiệm vụ khẩn cấp; \n\nc) Chở người đi thực hành lái xe trên xe tập lái; chở người dự sát hạch lái xe trên xe sát hạch; chở công nhân đang làm nhiệm vụ duy tu, bảo dưỡng đường bộ;\n\nd) Chở người diễu hành theo đoàn khi được cơ quan có thẩm quyền cho phép.\n\n2. Xe ô tô chở hàng mà chở người trong các trường hợp quy định tại khoản 1 Điều này phải bảo đảm an toàn khi tham gia giao thông đường bộ.\n\nĐiều 29. Xe kéo xe, xe kéo rơ moóc và xe ô tô đầu kéo kéo sơ mi rơ moóc\n\n1. Một xe ô tô chỉ được kéo theo một xe ô tô hoặc xe máy chuyên dùng khác khi xe được kéo không tự chạy được, trừ trường hợp quy định tại khoản 3 Điều 53 của Luật này và phải bảo đảm các quy định sau đây:\n\na) Xe được kéo phải có người điều khiển và hệ thống lái của xe đó phải còn hiệu lực;\n\nb) Việc nối xe kéo với xe được kéo phải bảo đảm chắc chắn, an toàn; trường hợp hệ thống hãm của xe được kéo không còn hiệu lực thì xe kéo nhau phải nối bằng thanh nối cứng;\n\nc) Phía trước của xe kéo và phía sau của xe được kéo phải có biển báo hiệu, có đèn cảnh báo nhấp nháy màu vàng.\n\n2. Xe kéo rơ moóc, xe ô tô đầu kéo chỉ được kéo rơ moóc, sơ mi rơ moóc phù hợp với thiết kế của xe; việc kết nối xe kéo với rơ moóc, xe ô tô đầu kéo với sơ mi rơ moóc phải bảo đảm chắc chắn, an toàn.\n\n3. Không được chở người trên xe được kéo, trừ người điều khiển; xe kéo rơ moóc, xe ô tô đầu kéo kéo sơ mi rơ moóc không được kéo thêm rơ moóc, sơ mi rơ moóc hoặc xe khác.\n\nĐiều 30. Người đi bộ; trẻ em, phụ nữ mang thai, người già yếu, người khuyết tật, người mất năng lực hành vi dân sự tham gia giao thông đường bộ\n\n1. Người đi bộ phải tuân thủ các quy định sau đây:\n\na) Phải đi trên vỉa hè, lề đường, đường dành riêng cho người đi bộ; trường hợp đường không có vỉa hè, lề đường, đường dành riêng cho người đi bộ thì người đi bộ phải đi sát mép đường bên phải theo chiều đi của mình;\n\nb) Chỉ được qua đường ở những nơi có đèn tín hiệu, có vạch kẻ đường hoặc có cầu vượt, hầm dành cho người đi bộ và phải tuân thủ tín hiệu chỉ dẫn, báo hiệu đường bộ. Trường hợp không có đèn tín hiệu, vạch kẻ đường, cầu vượt, hầm dành cho người đi bộ thì phải quan sát các xe đang đi tới, chỉ qua đường khi bảo đảm an toàn, khi qua đường phải có tín hiệu bằng tay;\n\nc) Không được vượt qua dải phân cách, đu, bám vào phương tiện giao thông đường bộ đang di chuyển; khi mang, vác vật cồng kềnh phải bảo đảm an toàn và không gây trở ngại cho người và phương tiện tham gia giao thông đường bộ.\n\n2. Trẻ em, phụ nữ mang thai, người già yếu, người khuyết tật, người mất năng lực hành vi dân sự tham gia giao thông đường bộ được quy định như sau:\n\na) Trẻ em dưới 07 tuổi khi đi qua đường phải có người lớn dẫn dắt; \n\nb) Người khuyết tật sử dụng xe lăn có động cơ hoặc không có động cơ phải đi trên vỉa hè, lề đường và nơi có vạch kẻ đường dành cho người đi bộ và xe thô sơ;\n\nc) Người khiếm thị khi đi trên đường bộ phải có người dẫn dắt hoặc có công cụ để báo hiệu cho người khác nhận biết là người khiếm thị;\n\nd) Người mất năng lực hành vi dân sự khi đi trên đường bộ phải có người dẫn dắt;\n\nđ) Mọi người có trách nhiệm giúp đỡ trẻ em dưới 07 tuổi, phụ nữ mang thai, người già yếu, người khuyết tật, người mất năng lực hành vi dân sự khi đi qua đường.\n\nĐiều 31. Người điều khiển, người được chở, hàng hóa xếp trên xe thô sơ\n\n1. Người điều khiển xe đạp, xe đạp máy chỉ được chở một người, trừ trường hợp chở thêm một trẻ em dưới 07 tuổi thì được chở tối đa hai người.\n\n2. Người điều khiển xe đạp, xe đạp máy không được thực hiện các hành vi quy định tại khoản 3 Điều 33 của Luật này; người được chở trên xe đạp, xe đạp máy khi tham gia giao thông đường bộ không được thực hiện các hành vi quy định tại khoản 4 Điều 33 của Luật này. \n\n3. Người điều khiển, người được chở trên xe đạp máy phải đội mũ bảo hiểm theo đúng quy chuẩn kỹ thuật quốc gia và cài quai đúng quy cách. \n\n4. Người điều khiển xe thô sơ chỉ được cho xe đi hàng một, nơi có phần đường dành cho xe thô sơ thì phải đi đúng phần đường quy định; khi tham gia giao thông đường bộ trong thời gian từ 18 giờ ngày hôm trước đến 06 giờ ngày hôm sau phải sử dụng đèn hoặc có báo hiệu ở phía trước và phía sau xe. \n\n5. Hàng hóa xếp trên xe thô sơ phải bảo đảm an toàn, không gây cản trở giao thông và che khuất tầm nhìn của người điều khiển. Hàng hóa xếp trên xe không vượt quá 1/3 chiều dài thân xe và không vượt quá 01 mét phía trước và phía sau xe; không vượt quá 0,4 mét mỗi bên bánh xe.\n\nĐiều 32. Người điều khiển, dẫn dắt vật nuôi, điều khiển xe vật nuôi kéo đi trên đường bộ\n\n1. Người điều khiển, dẫn dắt vật nuôi, điều khiển xe vật nuôi kéo đi trên đường bộ phải cho vật nuôi đi sát mép đường bên phải; trường hợp cần cho vật nuôi đi ngang qua đường thì phải quan sát và chỉ được đi qua đường khi có đủ điều kiện an toàn; không được gây cản trở cho người và phương tiện tham gia giao thông đường bộ khác.\n\n2. Không được điều khiển, dẫn dắt vật nuôi, điều khiển xe vật nuôi kéo đi vào làn đường dành cho xe cơ giới. \n\n3. Không được thả vật nuôi trên đường bộ.\n\nĐiều 33. Người lái xe, người được chở, hàng hóa xếp trên xe mô tô, xe gắn máy\n\n1. Người lái xe mô tô hai bánh, xe gắn máy chỉ được chở một người, trừ những trường hợp sau thì được chở tối đa hai người:\n\na) Chở người bệnh đi cấp cứu;\n\nb) Áp giải người có hành vi vi phạm pháp luật;\n\nc) Trẻ em dưới 12 tuổi;\n\nd) Người già yếu hoặc người khuyết tật.\n\n2. Người lái xe, người được chở trên xe mô tô hai bánh, xe mô tô ba bánh, xe gắn máy phải đội mũ bảo hiểm theo đúng quy chuẩn kỹ thuật quốc gia và cài quai đúng quy cách.\n\n3. Người lái xe mô tô hai bánh, xe mô tô ba bánh, xe gắn máy không được thực hiện các hành vi sau đây:\n\na) Đi xe dàn hàng ngang;\n\nb) Đi xe vào phần đường dành cho người đi bộ và phương tiện khác;\n\nc) Sử dụng ô, thiết bị âm thanh, trừ thiết bị trợ thính;\n\nd) Buông cả hai tay; đi xe bằng một bánh đối với xe mô tô, xe gắn máy hai bánh; đi xe bằng hai bánh đối với xe mô tô, xe gắn máy ba bánh;\n\nđ) Sử dụng xe để kéo, đẩy xe khác, vật khác, dẫn dắt vật nuôi, mang, vác và chở vật cồng kềnh; chở người đứng trên xe, giá đèo hàng hoặc ngồi trên tay lái; xếp hàng hóa trên xe quá giới hạn quy định;\n\ne) Ngồi về một bên điều khiển xe; đứng, nằm trên xe điều khiển xe; thay người lái xe khi xe đang chạy; quay người về phía sau để điều khiển xe hoặc bịt mắt điều khiển xe; sử dụng chân chống hoặc vật khác quệt xuống đường khi xe đang chạy;\n\ng) Hành vi khác gây mất trật tự, an toàn giao thông đường bộ.\n\n4. Người được chở trên xe mô tô hai bánh, xe mô tô ba bánh, xe gắn máy\xa0 khi tham gia giao thông đường bộ không được thực hiện các hành vi sau đây:\n\na) Mang, vác vật cồng kềnh;\n\nb) Sử dụng ô;\n\nc) Bám, kéo hoặc đẩy các phương tiện khác;\n\nd) Đứng trên yên, giá đèo hàng hoặc ngồi trên tay lái;\n\nđ) Hành vi khác gây mất trật tự, an toàn giao thông đường bộ.']","**Nguồn văn bản:** /content/drive/MyDrive/ITProject_data/new_law/36_2024_QH15_444251.docx

**Tên văn bản:** (Không có tiêu đề trong metadata)


**Nội dung:**

Điều 30. Người đi bộ; trẻ em, phụ nữ mang thai, người già yếu, người khuyết tật, người mất năng lực hành vi dân sự tham gia giao thông đường bộ

1. Người đi bộ phải tuân thủ các quy định sau đây:

        a) Phải đi trên vỉa hè, lề đường, đường dành riêng cho người đi bộ; trường hợp đường không có vỉa hè, lề đường, đường dành riêng cho người đi bộ thì người đi bộ phải đi sát mép đường bên phải theo chiều đi của mình.

        b) Chỉ được qua đường ở những nơi có đèn tín hiệu, có vạch kẻ đường hoặc có cầu vượt, hầm dành cho người đi bộ và phải tuân thủ tín hiệu chỉ dẫn, báo hiệu đường bộ. Trường hợp không có đèn tín hiệu, vạch kẻ đường, cầu vượt, hầm dành cho người đi bộ thì phải quan sát các xe đang đi tới, chỉ qua đường khi bảo đảm an toàn, khi qua đường phải có tín hiệu bằng tay.

        c) Không được vượt qua dải phân cách, đu, bám vào phương tiện giao thông đường bộ đang di chuyển; khi mang, vác vật cồng kềnh phải bảo đảm an toàn và không gây trở ngại cho người và phương tiện tham gia giao thông đường bộ.


2. Trẻ em, phụ nữ mang thai, người già yếu, người khuyết tật, người mất năng lực hành vi dân sự tham gia giao thông đường bộ được quy định như sau:

        a) Trẻ em dưới 07 tuổi khi đi qua đường phải có người lớn dẫn dắt.

        b) Người khuyết tật sử dụng xe lăn có động cơ hoặc không có động cơ phải đi trên vỉa hè, lề đường và nơi có vạch kẻ đường dành cho người đi bộ và xe thô sơ.

        c) Người khiếm thị khi đi trên đường bộ phải có người dẫn dắt hoặc có công cụ để báo hiệu cho người khác nhận biết là người khiếm thị.

        d) Người mất năng lực hành vi dân sự khi đi trên đường bộ phải có người dẫn dắt.

        đ) Mọi người có trách nhiệm giúp đỡ trẻ em dưới 07 tuổi, phụ nữ mang thai, người già yếu, người khuyết tật, người mất năng lực hành vi dân sự khi đi qua đường.

Điều 33. Người lái xe, người được chở, hàng hóa xếp trên xe mô tô, xe gắn máy

1. Người lái xe mô tô hai bánh, xe gắn máy chỉ được chở một người, trừ những trường hợp sau thì được chở tối đa hai người:

        a) Chở người bệnh đi cấp cứu.

        b) Áp giải người có hành vi vi phạm pháp luật.

        c) Trẻ em dưới 12 tuổi.

        d) Người già yếu hoặc người khuyết tật.


Tóm lại: Người khuyết tật khi tham gia giao thông được quy định tại Điều 30 và 33.  Nếu sử dụng xe lăn (có/không động cơ) phải đi trên vỉa hè, lề đường, nơi có vạch kẻ đường cho người đi bộ và xe thô sơ. Người khiếm thị cần có người dẫn dắt hoặc công cụ báo hiệu.  Người khác có trách nhiệm giúp đỡ người khuyết tật khi qua đường.  Xe máy được phép chở tối đa 2 người nếu một trong số đó là người già yếu hoặc người khuyết tật.
","**Nguồn văn bản:** 36_2024_QH15_444251

**Tên văn bản:** Luật Trật tự, an toàn giao thông đường bộ

**Điều 30:** Người đi bộ; trẻ em, phụ nữ mang thai, người già yếu, người khuyết tật, người mất năng lực hành vi dân sự tham gia giao thông đường bộ

**Nội dung:**

1. Người đi bộ phải tuân thủ các quy định sau đây:

	a) Phải đi trên vỉa hè, lề đường, đường dành riêng cho người đi bộ; trường hợp đường không có vỉa hè, lề đường, đường dành riêng cho người đi bộ thì người đi bộ phải đi sát mép đường bên phải theo chiều đi của mình.

	b) Chỉ được qua đường ở những nơi có đèn tín hiệu, có vạch kẻ đường hoặc có cầu vượt, hầm dành cho người đi bộ và phải tuân thủ tín hiệu chỉ dẫn, báo hiệu đường bộ. Trường hợp không có đèn tín hiệu, vạch kẻ đường, cầu vượt, hầm dành cho người đi bộ thì phải quan sát các xe đang đi tới, chỉ qua đường khi bảo đảm an toàn, khi qua đường phải có tín hiệu bằng tay.

	c) Không được vượt qua dải phân cách, đu, bám vào phương tiện giao thông đường bộ đang di chuyển; khi mang, vác vật cồng kềnh phải bảo đảm an toàn và không gây trở ngại cho người và phương tiện tham gia giao thông đường bộ.


2. Trẻ em, phụ nữ mang thai, người già yếu, người khuyết tật, người mất năng lực hành vi dân sự tham gia giao thông đường bộ được quy định như sau:

	a) Trẻ em dưới 07 tuổi khi đi qua đường phải có người lớn dẫn dắt.

	b) Người khuyết tật sử dụng xe lăn có động cơ hoặc không có động cơ phải đi trên vỉa hè, lề đường và nơi có vạch kẻ đường dành cho người đi bộ và xe thô sơ.

	c) Người khiếm thị khi đi trên đường bộ phải có người dẫn dắt hoặc có công cụ để báo hiệu cho người khác nhận biết là người khiếm thị.

	d) Người mất năng lực hành vi dân sự khi đi trên đường bộ phải có người dẫn dắt.

	đ) Mọi người có trách nhiệm giúp đỡ trẻ em dưới 07 tuổi, phụ nữ mang thai, người già yếu, người khuyết tật, người mất năng lực hành vi dân sự khi đi qua đường.

**Nguồn văn bản:** 158_2024_ND-CP_636875

**Tên văn bản:** Nghị định Quy định về hoạt động vận tải đường bộ

**Điều 5:** kinh doanh vận tải hành khách công cộng bằng xe buýt

**Nội dung:**
1. Đơn vị kinh doanh vận tải có giấy phép kinh doanh vận tải bằng ô tô, trong đó có loại hình kinh doanh vận tải hành khách công cộng bằng xe buýt thì được tham gia kinh doanh vận tải công cộng bằng xe buýt trên các tuyến xe buýt nội tỉnh, tuyến xe buýt liên tỉnh.

2. Xe ô tô kinh doanh vận tải hành khách công cộng bằng xe buýt

	a) Phải có chỗ ưu tiên cho người khuyết tật, người cao tuổi và phụ nữ mang thai và trẻ em dưới 6 tuổi.

	b) Phải có phù hiệu “xe buýt” theo mẫu số 03 phụ lục XIII kèm theo Nghị định này và được dán cố định tại góc trên bên phải ngay sát phía dưới vị trí của tem kiểm định, mặt trong kính chắn gió phía trước của xe; phải được niêm yết đầy đủ các thông tin trên xe.

	c) Vị trí, số chỗ ngồi, chỗ đứng cho hành khách và các quy định kỹ thuật khác đối với xe buýt theo quy chuẩn kỹ thuật quốc gia về chất lượng an toàn kỹ thuật và bảo vệ môi trường đối với xe ô tô.


Tóm lại: Xe buýt phải có chỗ ưu tiên dành cho người khuyết tật. Người khuyết tật khi tham gia giao thông phải tuân thủ luật giao thông đường bộ, sử dụng xe lăn phải đi trên vỉa hè, lề đường; người khiếm thị khi đi trên đường phải có người dẫn dắt hoặc công cụ báo hiệu. Mọi người có trách nhiệm giúp đỡ người khuyết tật khi qua đường.
",1.0,0.7341016236158463,0.7222222222222222,0.9999999999
