,user_input,retrieved_contexts,response,reference,faithfulness,answer_relevancy,context_recall,context_precision
0,Luật Giao thông Đường bộ 2025 có những thay đổi gì về phân hạng giấy phép lái xe?,"['Quá hạn dưới 01 năm, phải dự sát hạch lý thuyết để cấp giấy phép lái xe theo quy định tại điểm a khoản 1 Điều 17 Thông tư này.\n\nQuá hạn từ 01 năm trở lên kể từ ngày hết hạn phải sát hạch lý thuyết, thực hành lái xe trong hình và trên đường để cấp giấy phép lái xe theo quy định tại khoản 1, khoản 2 và khoản 3 Điều 17 Thông tư này.\n\nHồ sơ dự sát hạch thực hiện theo quy định tại khoản 3 Điều 29 của Thông tư này;\n\nc) Ngày trúng tuyển ghi tại mặt sau giấy phép lái xe được tính theo ngày trúng tuyển của giấy phép lái xe cũ;\n\nd) Người dự sát hạch có nhu cầu ôn tập, đăng ký với các cơ sở đào tạo lái xe để được hướng dẫn ôn tập, phải nộp phí ôn tập theo quy định, không phải học lại theo chương trình đào tạo;\n\nđ) Trường hợp không đạt kết quả để được cấp giấy phép lái xe, người có giấy phép lái xe quá thời hạn sử dụng, bị mất nhưng quá thời hạn sử dụng phải đăng ký với Sở Giao thông vận tải để tham gia sát hạch lại.\n\n3. Chưa sát hạch cấp giấy phép lái xe đối với người vi phạm trật tự, an toàn giao thông đường bộ chưa thực hiện xong yêu cầu của cơ quan nhà nước có thẩm quyền về giải quyết, xử lý vụ việc vi phạm hành chính trong lĩnh vực trật tự, an toàn giao thông đường bộ.\n\nĐiều 35. Cấp lại giấy phép lái xe\n\n1. Người có giấy phép lái xe bị mất, còn thời hạn sử dụng được xét cấp lại giấy phép lái xe. Việc cấp lại giấy phép lái xe bị mất thực hiện theo quy định tại các khoản 2, khoản 3 và khoản 4 Điều 36 Thông tư này.\n\n2. Ngày trúng tuyển ghi tại mặt sau giấy phép lái xe được tính theo ngày trúng tuyển của giấy phép lái xe cũ.\n\n3. Không cấp lại giấy phép lái xe đối với các trường hợp sau: giấy phép lái xe không có trong hệ thống thông tin giấy phép lái xe tại Cục Đường bộ Việt Nam, bảng kê danh sách cấp giấy phép lái xe (sổ quản lý); chưa cấp lại giấy phép lái xe đối với người vi phạm trật tự, an toàn giao thông đường bộ chưa thực hiện xong yêu cầu của cơ quan nhà nước có thẩm quyền về giải quyết, xử lý vụ việc vi phạm hành chính trong lĩnh vực trật tự, an toàn giao thông đường bộ.\n\nĐiều 36. Đổi giấy phép lái xe do ngành Giao thông vận tải cấp\n\n1. Yêu cầu đối với việc đổi giấy phép lái xe\n\na) Người Việt Nam, người nước ngoài được đào tạo, sát hạch, cấp giấy phép lái xe tại Việt Nam;\n\nb) Người có giấy phép lái xe do ngành Giao thông vận tải cấp bị hỏng không còn sử dụng được;\n\nc) Người Việt Nam, người nước ngoài có thẻ thường trú ở Việt Nam đã có giấy phép lái xe Việt Nam đổi từ giấy phép lái xe nước ngoài, khi hết hạn nếu có nhu cầu được đổi giấy phép lái xe;\n\nd) Trường hợp ngày, tháng, năm sinh, họ, tên, tên đệm, quốc tịch, nơi sinh, nơi cư trú ghi trên giấy phép lái xe có sai lệch với căn cước công dân hoặc căn cước thì cơ quan quản lý giấy phép lái xe làm thủ tục đổi giấy phép lái xe mới phù hợp với thông tin ghi trong căn cước công dân hoặc căn cước;\n\nđ) Không đổi giấy phép lái xe đối với các trường hợp sau: giấy phép lái xe không có trong hệ thống thông tin giấy phép lái xe tại Cục Đường bộ Việt Nam, bảng kê danh sách cấp giấy phép lái xe (sổ quản lý); người vi phạm trật tự, an toàn giao thông đường bộ chưa thực hiện xong yêu cầu của cơ quan nhà nước có thẩm quyền về giải quyết, xử lý vụ việc vi phạm hành chính trong lĩnh vực trật tự, an toàn giao thông đường bộ.\n\n2. Hồ sơ đổi giấy phép lái xe do ngành Giao thông vận tải cấp, gồm:\n\na) Đơn đề nghị đổi (cấp lại) giấy phép lái xe theo mẫu quy định tại Phụ lục XXVI ban hành kèm theo Thông tư này;\n\nb) Giấy khám sức khỏe của người lái xe do cơ sở khám bệnh, chữa bệnh đủ tiêu chuẩn theo quy định của pháp luật về khám bệnh, chữa bệnh cấp còn hiệu lực (trừ người có giấy phép lái xe hạng A, A1, B1);\n\nc) Bản sao hoặc bản sao điện tử được chứng thực từ bản chính hoặc bản sao điện tử được cấp từ sổ gốc của giấy phép lái xe hoặc Quyết định xử phạt vi phạm hành chính trong lĩnh vực giao thông đường bộ đối với trường hợp tước quyền sử dụng giấy phép lái xe tích hợp;\n\nd) Hộ chiếu còn thời hạn sử dụng (đối với người nước ngoài, người Việt Nam định cư ở nước ngoài).\n\n3. Trình tự thực hiện\n\na) Cá nhân lập 01 bộ hồ sơ theo quy định tại khoản 2 Điều này gửi trực tiếp hoặc qua hệ thống dịch vụ công trực tuyến đến Sở Giao thông vận tải.\n\nTrường hợp nộp hồ sơ trực tiếp cá nhân phải chụp ảnh trực tiếp tại cơ quan cấp giấy phép lái xe và phải hoàn thành nghĩa vụ nộp lệ phí khi được tiếp nhận hồ sơ.\n\nTrường hợp nộp hồ sơ qua hệ thống dịch vụ công trực tuyến, cá nhân kê khai theo hướng dẫn, phải chịu trách nhiệm về tính chính xác, tính hợp pháp của nội dung đã kê khai và phải hoàn thành nghĩa vụ nộp lệ phí cấp giấy phép lái xe thông qua chức năng thanh toán của hệ thống dịch vụ công trực tuyến theo quy định và nộp phí sử dụng dịch vụ khác theo nhu cầu của cá nhân; khi nhận giấy phép lái xe, phải nộp lại giấy phép lái xe cũ để lưu hồ sơ;\n\nb) Sở Giao thông vận tải kiểm tra hồ sơ khi tiếp nhận, tra cứu phần mềm quản lý vi phạm của hệ thống thông tin về đào tạo, sát hạch, cấp giấy phép lái xe, chứng chỉ bồi dưỡng kiến thức pháp luật về giao thông đường bộ, truy cập phần mềm cơ sở dữ liệu về trật tự, an toàn giao thông đường bộ của ngành Công an hoặc tra cứu vi phạm của người lái xe thông qua tài khoản định danh điện tử; trường hợp giấy phép lái xe không thuộc đối tượng được đổi hoặc hồ sơ không đúng theo quy định, phải thông báo trực tiếp hoặc bằng văn bản hoặc qua hệ thống dịch vụ công trực tuyến những nội dung cần bổ sung hoặc sửa đổi cho cá nhân trong thời hạn 02 ngày làm việc, kể từ ngày nhận hồ sơ;\n\nc) Trong thời hạn 05 ngày làm việc, kể từ ngày nhận đủ hồ sơ đúng theo quy định (bao gồm xác thực tài khoản định danh điện tử qua hệ thống định danh và xác thực điện tử), Sở Giao thông vận tải thực hiện việc đổi giấy phép lái xe; trường hợp không đổi giấy phép lái xe thì phải trả lời bằng văn bản và nêu rõ lý do;\n\nd) Cơ quan cấp giấy phép lái xe lưu trữ bản chính hồ sơ đổi giấy phép lái xe của ngành Giao thông vận tải cấp (trừ trường hợp đổi giấy phép lái xe qua hệ thống dịch vụ công trực tuyến) trong thời hạn 02 năm kể từ ngày cấp giấy phép lái xe và thu lại giấy phép lái xe cũ (trường hợp đổi giấy phép lái xe trực tuyến toàn trình, người lái xe chịu trách nhiệm gửi giấy phép lái xe cũ đến cơ quan cấp giấy phép lái xe để hủy theo quy định) trừ trường hợp đổi giấy phép lái xe cho người có giấy phép lái xe tích hợp đang trong thời gian bị tước giấy phép lái xe;\n\nđ) Trường hợp người lái xe có nhu cầu đổi giấy phép lái xe xuống hạng thấp hơn, phải khai rõ tại đơn đề nghị đổi (cấp lại) giấy phép lái xe quy định tại Phụ lục XXVI ban hành kèm theo Thông tư này và chịu trách nhiệm về nội dung kê khai.\n\n4. Việc trả giấy phép lái xe được thực hiện tại cơ quan tiếp nhận hồ sơ hoặc thông qua dịch vụ bưu chính theo yêu cầu của cá nhân; trường hợp nộp hồ sơ qua hệ thống dịch vụ công trực tuyến, giấy phép lái xe được trả cho đúng cá nhân đổi giấy phép lái xe.\n\nĐiều 37. Đổi giấy phép lái xe quân sự do Bộ Quốc phòng cấp sang giấy phép lái xe do ngành Giao thông vận tải cấp\n\n1. Yêu cầu đối với việc đổi giấy phép lái xe do Bộ Quốc phòng cấp sang giấy phép lái xe do ngành Giao thông vận tải cấp\n\na) Người có giấy phép lái xe quân sự còn thời hạn sử dụng khi thôi phục vụ trong quân đội (xuất ngũ, chuyển ngành, nghỉ hưu, chấm dứt hợp đồng lao động trong quân đội) có nhu cầu được đổi giấy phép lái xe;\n\nb) Giấy phép lái xe quân sự có hiệu lực được phép lái nhiều hạng xe khác nhau được đổi sang giấy phép lái xe ngành Giao thông vận tải có hiệu lực lái các hạng xe tương ứng; giấy phép lái xe quân sự hạng Cx được đổi sang giấy phép lái xe hạng C do ngành Giao thông vận tải cấp;\n\nc) Người có giấy phép lái xe quân sự do Bộ Quốc phòng cấp bị hỏng không còn sử dụng được;\n\nd) Không đổi giấy phép lái xe quân sự bị tẩy xóa thông tin hoặc có sự khác biệt về nhận dạng; người vi phạm trật tự, an toàn giao thông đường bộ chưa thực hiện xong yêu cầu của cơ quan nhà nước có thẩm quyền về giải quyết, xử lý vụ việc vi phạm hành chính trong lĩnh vực trật tự, an toàn giao thông đường bộ.\n\n2. Hồ sơ bao gồm:', '6. Hồ sơ đổi giấy phép lái xe do ngành Công an cấp là hồ sơ gốc, gồm tài liệu quy định tại khoản 2, khoản 3 và khoản 4 Điều này và giấy phép lái xe do ngành Công an cấp đã được cắt góc, giao cho người lái xe tự bảo quản.\n\nĐiều 39. Đổi giấy phép lái xe hoặc bằng lái xe của nước ngoài sang giấy phép lái xe do ngành Giao thông vận tải cấp\n\n1. Yêu cầu đối với việc đổi giấy phép lái xe hoặc bằng lái xe của nước ngoài sang giấy phép lái xe do ngành Giao thông vận tải cấp\n\na) Người nước ngoài cư trú, làm việc, học tập tại Việt Nam có giấy phép lái xe quốc gia còn thời hạn sử dụng và có một trong các giấy tờ sau: giấy chứng minh thư ngoại giao, giấy chứng minh thư công vụ, thẻ tạm trú, thẻ cư trú, thẻ lưu trú hoặc thẻ thường trú với thời gian từ 03 tháng trở lên nếu có nhu cầu lái xe ở Việt Nam được xét đổi sang hạng giấy phép lái xe tương ứng của Việt Nam;\n\nb) Người Việt Nam (mang quốc tịch Việt Nam) trong thời gian cư trú, học tập, làm việc ở nước ngoài được cơ quan có thẩm quyền nước ngoài cấp giấy phép lái xe quốc gia, còn thời hạn sử dụng, nếu có nhu cầu lái xe tại Việt Nam được xét đổi sang hạng giấy phép lái xe tương ứng của Việt Nam;\n\nc) Không đổi giấy phép lái xe tạm thời của nước ngoài; giấy phép lái xe quốc tế; giấy phép lái xe của nước ngoài quá thời hạn sử dụng, bị tẩy xóa, rách nát không còn đủ thông tin để đổi giấy phép lái xe hoặc có sự khác biệt về nhận dạng; giấy phép lái xe nước ngoài không do cơ quan có thẩm quyền cấp; người Việt Nam có giấy phép lái xe nước ngoài có thời gian lưu trú tại nước ngoài dưới 03 tháng và thời hạn lưu trú không phù hợp với thời gian đào tạo lái xe của nước cấp giấy phép lái xe.\n\n2. Hồ sơ bao gồm:\n\na) Đơn đề nghị đổi (cấp lại) giấy phép lái xe (đối với người Việt Nam theo mẫu quy định tại Phụ lục XXVI ban hành kèm theo Thông tư này, đối với người nước ngoài theo mẫu quy định tại Phụ lục XXVII ban hành kèm theo Thông tư này);\n\nb) Bản dịch giấy phép lái xe nước ngoài ra tiếng Việt được bảo chứng chất lượng dịch thuật của cơ quan Công chứng tại Việt Nam, cơ quan đại diện Việt Nam ở nước ngoài mà người dịch làm việc, đóng dấu giáp lai với bản sao giấy phép lái xe;\n\nc) Giấy khám sức khỏe của người lái xe do cơ sở khám bệnh, chữa bệnh đủ tiêu chuẩn theo quy định của pháp luật về khám bệnh, chữa bệnh cấp còn hiệu lực (trừ người nước ngoài đổi giấy phép lái xe theo thời hạn ghi trong thị thực nhập cảnh hoặc thẻ tạm trú);\n\nd) Bản sao hoặc bản sao điện tử được chứng thực từ bản chính hoặc bản sao điện tử được cấp từ sổ gốc của một trong các giấy tờ: thẻ tạm trú, thẻ thường trú hoặc chứng minh thư ngoại giao, chứng minh thư công vụ.\n\n3. Trình tự thực hiện\n\na) Cá nhân lập 01 bộ hồ sơ theo quy định tại khoản 2 Điều này gửi trực tiếp tại Sở Giao thông vận tải nơi đăng ký cư trú, lưu trú, tạm trú hoặc thường trú; cá nhân phải chụp ảnh trực tiếp tại cơ quan cấp giấy phép lái xe và phải xuất trình bản chính các hồ sơ nêu trên (trừ các bản chính đã gửi) để đối chiếu và phải hoàn thành nghĩa vụ nộp lệ phí khi được tiếp nhận hồ sơ;\n\nb) Trong thời hạn 05 ngày làm việc, kể từ ngày nhận đủ hồ sơ đúng theo quy định (bao gồm xác thực tài khoản định danh điện tử qua hệ thống định danh và xác thực điện tử), Sở Giao thông vận tải thực hiện việc đổi giấy phép lái xe; trường hợp không đổi giấy phép lái xe thì phải trả lời bằng văn bản và nêu rõ lý do;\n\nc) Việc trả giấy phép lái xe được thực hiện tại cơ quan tiếp nhận hồ sơ hoặc thông qua dịch vụ bưu chính theo yêu cầu của cá nhân.\n\n4. Hồ sơ đổi giấy phép lái xe do cơ quan đổi giấy phép lái xe giao cho người lái xe quản lý là hồ sơ gốc, gồm các tài liệu quy định tại khoản 2 Điều này và giấy phép lái xe nước ngoài. Hồ sơ đổi giấy phép lái xe của người nước ngoài không thường trú tại Việt Nam do cơ quan đổi giấy phép lái xe lưu trữ 01 năm, gồm các tài liệu quy định tại khoản 2 Điều này.\n\n5. Trường hợp phát hiện có nghi vấn về việc nhập cảnh, cư trú của người nước ngoài tại Việt Nam, cơ quan cấp đổi giấy phép lái xe có văn bản đề nghị Bộ Ngoại giao, Cục Quản lý Xuất nhập cảnh thuộc Bộ Công an, Phòng Quản lý xuất nhập Cảnh thuộc Công an tỉnh, thành phố trực thuộc Trung ương xác minh.\n\n6. Thời hạn sử dụng và hạng xe được phép điều khiển\n\na) Thời hạn sử dụng giấy phép lái xe Việt Nam đổi cho người nước ngoài phù hợp với thời hạn ghi tại một trong các giấy tờ quy định tại điểm a khoản 1 Điều này phù hợp với thời hạn sử dụng giấy phép lái xe nước ngoài nhưng không vượt quá thời hạn quy định của giấy phép lái xe Việt Nam;\n\nb) Giấy phép lái xe quốc gia cấp cho người đổi được điều khiển nhiều hạng xe khác nhau được đổi sang giấy phép lái xe Việt Nam để điều khiển các hạng xe tương ứng.\n\nĐiều 40. Thu hồi giấy phép lái xe\n\n1. Cơ quan có thẩm quyền cấp giấy phép lái xe thực hiện thu hồi theo trình tự sau:\n\na) Sau 03 ngày kể từ ngày phát hiện người có giấy phép lái xe thuộc một trong các trường hợp quy định tại khoản 5 Điều 62 Luật Trật tự, an toàn giao thông đường bộ, thủ trưởng cơ quan có thẩm quyền cấp giấy phép lái xe ra quyết định thu hồi để hủy bỏ giấy phép lái xe. Nội dung của quyết định nêu rõ lý do thu hồi và hủy bỏ;\n\nb) Trong thời hạn 05 ngày làm việc kể từ ngày nhận được Quyết định thu hồi giấy phép lái xe, cá nhân phải nộp giấy phép lái xe bị thu hồi đến cơ quan thu hồi giấy phép lái xe và cơ quan có thẩm quyền cấp giấy phép lái xe có trách nhiệm thu hồi giấy phép lái xe đã cấp và hủy bỏ theo quy định;\n\nc) Trường hợp cơ quan có thẩm quyền cấp giấy phép lái xe đã sáp nhập, chia, tách, giải thể, hết thẩm quyền cấp thì cơ quan có thẩm quyền thu hồi, hủy bỏ giấy phép lái xe là cơ quan đang quản lý sổ gốc cấp giấy phép lái xe.\n\n2. Xử lý đối với trường hợp giấy phép lái xe bị thu hồi\n\na) Giấy phép lái xe bị thu hồi theo quy định tại điểm a và điểm b khoản 5 Điều 62 Luật Trật tự, an toàn giao thông đường bộ; hồ sơ, trình tự thực hiện cấp lại giấy phép lái xe thực hiện theo quy định tại khoản 2, khoản 3 và khoản 4 Điều 36 Thông tư này;\n\nb) Giấy phép lái xe bị thu hồi theo quy định tại điểm c khoản 5 Điều 62 Luật Trật tự, an toàn giao thông đường bộ không có giá trị sử dụng, cơ quan quản lý giấy phép lái xe cập nhật dữ liệu về hành vi vi phạm trên hệ thống thông tin giấy phép lái xe tại Cục Đường bộ Việt Nam kể từ ngày phát hiện hành vi vi phạm; ngoài ra, người có hành vi vi phạm không được cấp giấy phép lái xe trong thời hạn 05 năm, kể từ ngày phát hiện hành vi vi phạm; sau thời hạn 05 năm, kể từ ngày phát hiện hành vi vi phạm nếu có nhu cầu cấp lại giấy phép lái xe phải học và sát hạch lại như trường hợp cấp giấy phép lái xe lần đầu.\n\nPhần III\n\nCẤP, SỬ DỤNG GIẤY PHÉP LÁI XE QUỐC TẾ \n\nChương I\n\nCẤP GIẤY PHÉP LÁI XE QUỐC TẾ\n\nĐiều 41. Mẫu giấy phép lái xe quốc tế\n\n1. IDP là một quyển sổ có kích thước A6 (148 mm x 105 mm), có ký hiệu bảo mật, bìa màu xám, những trang giấy bên trong màu trắng theo mẫu quy định tại Phụ lục XXVIII ban hành kèm theo Thông tư này.\n\n2. Trang 1 (trang bìa) ghi thông tin cơ bản của IDP được in song ngữ tiếng Việt và tiếng Anh; trang 2 quy định về phạm vi sử dụng IDP in song ngữ tiếng Việt và tiếng Anh, trang 3 quy định phần khai về người lái xe và phân hạng IDP in bằng tiếng Việt, trang 4 để trống, trang 5 quy định phần khai về người lái xe và phân hạng IDP in bằng tiếng Anh, trang 6 quy định phần khai về người lái xe và phân hạng IDP in bằng tiếng Nga, trang 7 quy định phần khai về người lái xe và phân hạng IDP in bằng tiếng Tây Ban Nha, trang 8 quy định phần khai về người lái xe và phân hạng IDP in bằng tiếng Pháp, trang 9 quy định hạng xe được điều khiển in bằng tiếng Pháp.\n\n3. Số IDP gồm ký hiệu phân biệt quốc gia của Việt Nam đối với giao thông quốc tế là VN và 12 chữ số sau là số giấy phép lái xe quốc gia.\n\nĐiều 42. Hạng xe điều khiển của giấy phép lái xe quốc tế\n\nHạng xe được phép điều khiển của IDP tương ứng với các hạng xe của giấy phép lái xe quốc gia do Việt Nam cấp quy định tại Phụ lục XXIX ban hành kèm theo Thông tư này.\n\nĐiều 43. Cấp giấy phép lái xe quốc tế', 'a) Giấy phép lái xe hết thời hạn sử dụng;\n\nb) Giấy phép lái xe bị thu hồi theo quy định tại khoản 5 Điều 62 của Luật này.\n\n8. Giấy phép lái xe quốc tế được quy định như sau:\n\na) Giấy phép lái xe quốc tế là giấy phép lái xe do cơ quan nhà nước có thẩm quyền của quốc gia là thành viên của Công ước Viên cấp theo một mẫu thống nhất; có thời hạn không quá 03 năm kể từ ngày cấp và phải phù hợp với thời hạn còn hiệu lực của giấy phép lái xe quốc gia;\n\nb) Người có giấy phép lái xe quốc tế do quốc gia là thành viên của Công ước Viên cấp khi lái xe tham gia giao thông đường bộ trên lãnh thổ Việt Nam phải mang theo giấy phép lái xe quốc tế và giấy phép lái xe quốc gia được cấp phù hợp với hạng xe điều khiển, còn thời hạn sử dụng; phải tuân thủ pháp luật về trật tự, an toàn giao thông đường bộ của Việt Nam;\n\nc) Người có giấy phép lái xe quốc tế vi phạm pháp luật về trật tự, an toàn giao thông đường bộ của Việt Nam mà bị tước quyền sử dụng giấy phép lái xe có thời hạn thì thời gian bị tước quyền sử dụng không quá thời gian người lái xe được phép cư trú tại lãnh thổ Việt Nam;\n\nd) Người Việt Nam hoặc người nước ngoài có thẻ thường trú hoặc thẻ tạm trú tại Việt Nam có giấy phép lái xe do Việt Nam hoặc quốc gia là thành viên của điều ước quốc tế mà nước Cộng hòa xã hội chủ nghĩa Việt Nam là thành viên cấp, còn giá trị sử dụng, nếu có nhu cầu được cấp giấy phép lái xe quốc tế.\n\n9. Bộ trưởng Bộ Giao thông vận tải quy định mẫu giấy phép lái xe và giấy phép lái xe quốc tế, trình tự, thủ tục cấp và việc sử dụng giấy phép lái xe, giấy phép lái xe quốc tế; đối với mẫu giấy phép lái xe, trình tự, thủ tục cấp và việc sử dụng giấy phép lái xe của lực lượng quân đội, công an làm nhiệm vụ quốc phòng, an ninh do Bộ trưởng Bộ Quốc phòng, Bộ trưởng Bộ Công an quy định.\n\nĐiều 58. Điểm của giấy phép lái xe \n\n1. Điểm của giấy phép lái xe được dùng để quản lý việc chấp hành pháp luật về trật tự, an toàn giao thông đường bộ của người lái xe trên hệ thống cơ sở dữ liệu về trật tự, an toàn giao thông đường bộ, bao gồm 12 điểm. Số điểm trừ mỗi lần vi phạm tùy thuộc tính chất, mức độ của hành vi vi phạm pháp luật về trật tự, an toàn giao thông đường bộ. Dữ liệu về điểm trừ giấy phép lái xe của người vi phạm sẽ được cập nhật vào hệ thống cơ sở dữ liệu ngay sau khi quyết định xử phạt có hiệu lực thi hành và thông báo cho người bị trừ điểm giấy phép lái xe biết.\n\n2. Giấy phép lái xe chưa bị trừ hết điểm và không bị trừ điểm trong thời hạn 12 tháng từ ngày bị trừ điểm gần nhất thì được phục hồi đủ 12 điểm.\n\n3. Trường hợp giấy phép lái xe bị trừ hết điểm thì người có giấy phép lái xe không được điều khiển phương tiện tham gia giao thông đường bộ theo giấy phép lái xe đó. Sau thời hạn ít nhất là 06 tháng kể từ ngày bị trừ hết điểm, người có giấy phép lái xe được tham gia kiểm tra nội dung kiến thức pháp luật về trật tự, an toàn giao thông đường bộ theo quy định tại khoản 7 Điều 61 của Luật này do lực lượng Cảnh sát giao thông tổ chức, có kết quả đạt yêu cầu thì được phục hồi đủ 12 điểm.\n\n4. Giấy phép lái xe sau khi đổi, cấp lại, nâng hạng được giữ nguyên số điểm của giấy phép lái xe trước khi đổi, cấp lại, nâng hạng.\n\n5. Người có thẩm quyền xử phạt vi phạm hành chính có thẩm quyền trừ điểm giấy phép lái xe.\n\n6. Chính phủ quy định chi tiết khoản 1 Điều này; quy định trình tự, thủ tục, thẩm quyền trừ điểm, phục hồi điểm giấy phép lái xe; quy định lộ trình thực hiện Điều này. Bộ trưởng Bộ Công an quy định chi tiết khoản 3 Điều này.\n\nĐiều 59. Tuổi, sức khỏe của người điều khiển phương tiện tham gia giao thông đường bộ\n\n1. Độ tuổi của người lái xe, người điều khiển xe máy chuyên dùng được quy định như sau:\n\na) Người đủ 16 tuổi trở lên được điều khiển xe gắn máy;\n\nb) Người đủ 18 tuổi trở lên được cấp giấy phép lái xe hạng A1, A, B1, B, C1, được cấp chứng chỉ bồi dưỡng kiến thức pháp luật về giao thông đường bộ để điều khiển xe máy chuyên dùng tham gia giao thông đường bộ;\n\nc) Người đủ 21 tuổi trở lên được cấp giấy phép lái xe hạng C, BE;\n\nd) Người đủ 24 tuổi trở lên được cấp giấy phép lái xe hạng D1, D2, C1E, CE;\n\nđ) Người đủ 27 tuổi trở lên được cấp giấy phép lái xe hạng D, D1E, D2E, DE;\n\ne) Tuổi tối đa của người lái xe ô tô chở người (kể cả xe buýt) trên 29 chỗ (không kể chỗ của người lái xe), xe ô tô chở người giường nằm là đủ 57 tuổi đối với nam, đủ 55 tuổi đối với nữ.\n\n2. Người điều khiển phương tiện tham gia giao thông đường bộ phải bảo đảm điều kiện sức khỏe phù hợp với từng loại phương tiện được phép điều khiển. Bộ trưởng Bộ Y tế quy định về tiêu chuẩn sức khỏe, việc khám sức khỏe đối với người lái xe, người điều khiển xe máy chuyên dùng; việc khám sức khỏe định kỳ đối với người hành nghề lái xe ô tô; xây dựng cơ sở dữ liệu về sức khỏe của người lái xe, người điều khiển xe máy chuyên dùng.\n\n3. Bộ trưởng Bộ Quốc phòng, Bộ trưởng Bộ Công an quy định độ tuổi của người lái xe trong lực lượng quân đội, công an làm nhiệm vụ quốc phòng, an ninh.\n\nĐiều 60. Đào tạo lái xe\n\n1. Người có nhu cầu được cấp giấy phép lái xe phải được đào tạo nội dung lý thuyết và thực hành theo chương trình đào tạo quy định cho từng hạng giấy phép lái xe.\n\n2. Người học lái xe phải được đào tạo tại các cơ sở đào tạo lái xe hoặc các hình thức đào tạo lái xe khác để cấp mới hoặc nâng hạng giấy phép lái xe.\n\n3. Việc đào tạo để nâng hạng giấy phép lái xe thực hiện đối với những đối tượng sau đây:\n\na) Nâng hạng giấy phép lái xe từ hạng B lên hạng C1 hoặc lên hạng C hoặc lên hạng D1 hoặc lên hạng D2;\n\nb) Nâng hạng giấy phép lái xe từ hạng C1 lên hạng C hoặc lên hạng D1 hoặc lên hạng D2;\n\nc) Nâng hạng giấy phép lái xe từ hạng C lên hạng D1 hoặc lên hạng D2 hoặc lên hạng D;\n\nd) Nâng hạng giấy phép lái xe từ hạng D1 lên hạng D2 hoặc lên hạng D;\n\nđ) Nâng hạng giấy phép lái xe từ hạng D2 lên hạng D;\n\ne) Nâng hạng giấy phép lái xe từ hạng B lên hạng BE, từ hạng C1 lên\xa0 hạng C1E, từ hạng C lên hạng CE, từ hạng D1 lên hạng D1E, từ hạng D2 lên hạng D2E, từ hạng D lên hạng DE.\n\n4.\xa0Người có nhu cầu được đào tạo nâng hạng giấy phép lái xe khi giấy phép lái xe còn hiệu lực, phải có đủ thời gian lái xe an toàn quy định cho từng hạng giấy phép lái xe;\xa0đối với việc nâng hạng giấy phép lái xe lên hạng D1, D2, D thì người có nhu cầu được đào tạo còn phải có trình độ từ trung học cơ sở trở lên.\n\n5. Giấy phép lái xe các hạng C, D1, D2, D, BE, C1E, CE, D1E, D2E, DE phải được đào tạo bằng hình thức đào tạo nâng hạng theo các điều kiện quy định tại khoản 3 và khoản 4 Điều này.\n\n6. Cơ sở đào tạo lái xe ô tô phải đáp ứng các điều kiện do Chính phủ quy định; có giáo trình, giáo án; thực hiện đào tạo theo đúng hình thức, nội dung và chương trình quy định cho từng hạng giấy phép lái xe.\n\n7. Chính phủ quy định chi tiết các hình thức đào tạo lái xe khác quy định tại khoản 2 Điều này; quy định trình tự, thủ tục kiểm tra, đánh giá để cấp, cấp lại và thu hồi giấy phép xe tập lái; quy định tiêu chuẩn của giáo viên dạy lái xe; quy định việc cấp, cấp lại và thu hồi giấy chứng nhận giáo viên dạy lái xe; quy định việc cấp, cấp lại và thu hồi giấy phép đào tạo lái xe.\n\n8. Bộ trưởng Bộ Giao thông vận tải quy định hình thức, nội dung, chương trình đào tạo lái xe, thời gian lái xe an toàn cho từng hạng giấy phép lái xe quy định tại khoản 4 Điều này và quy định tiêu chuẩn của cơ sở đào tạo lái xe mô tô; đối với cơ sở đào tạo, tổ chức đào tạo lái xe cho lực lượng quân đội, công an làm nhiệm vụ quốc phòng, an ninh do Bộ trưởng Bộ Quốc phòng, Bộ trưởng Bộ Công an quy định.\n\nĐiều 61. Sát hạch lái xe\n\n1. Người đã hoàn thành chương trình đào tạo lái xe, có độ tuổi, sức khỏe theo quy định tại Điều 59 của Luật này được đăng ký để tham dự kỳ sát hạch lái xe.\n\n2. Nội dung sát hạch lái xe phải phù hợp với hạng giấy phép lái xe và chương trình đào tạo lái xe.\n\n3. Hoạt động sát hạch lái xe ô tô phải thực hiện tại các trung tâm sát hạch lái xe; hoạt động sát hạch lái xe mô tô thực hiện tại các trung tâm sát hạch lái xe hoặc tại sân tập lái đáp ứng điều kiện, tiêu chuẩn về cơ sở vật chất, kỹ thuật. Hoạt động sát hạch lái xe do cơ quan nhà nước có thẩm quyền thực hiện.']","Không tìm thấy thông tin liên quan tới câu hỏi này.  Các văn bản được cung cấp tập trung vào quy trình cấp, đổi, cấp lại và thu hồi giấy phép lái xe, không đề cập đến những thay đổi về phân hạng giấy phép lái xe trong Luật Giao thông Đường bộ năm 2025.
","Từ năm 2025, hệ thống phân hạng giấy phép lái xe được mở rộng lên 15 hạng: A1, A, B1, B, C1, C, D1, D2, D, BE, C1E, CE, D1E, D2E, DE.",0.6666666666666666,0.0,0.0,0.0
1,Giấy phép lái xe hạng A1 mới cấp cho loại xe nào?,"['8. Ủy ban nhân dân các cấp, trong phạm vi nhiệm vụ, quyền hạn của mình, thực hiện quản lý nhà nước về trật tự, an toàn giao thông đường bộ tại địa phương.\n\nChương IX\n\nĐIỀU KHOẢN THI HÀNH\n\nĐiều 88. Hiệu lực thi hành\n\n1. Luật này có hiệu lực thi hành từ ngày 01 tháng 01 năm 2025, trừ trường hợp quy định tại khoản 2 Điều này.\n\n2. Khoản 3 Điều 10 của Luật này có hiệu lực thi hành từ ngày 01 tháng 01 năm 2026.\n\n3. Luật Giao thông đường bộ số 23/2008/QH12 đã được sửa đổi, bổ sung một số điều theo Luật số 35/2018/QH14 và Luật số 44/2019/QH14 hết hiệu lực kể từ ngày Luật này có hiệu lực thi hành, trừ trường hợp quy định tại các khoản 1, 2, 5 và 6 Điều 89 của Luật này.\n\n4. Nghị quyết số 73/2022/QH15 của Quốc hội về thí điểm đấu giá biển số xe ô tô hết hiệu lực kể từ ngày Luật này có hiệu lực thi hành, trừ trường hợp quy định tại khoản 7 Điều 89 của Luật này.\n\nĐiều 89. Quy định chuyển tiếp\n\n1. Giấy phép lái xe được cấp trước ngày Luật này có hiệu lực thi hành được tiếp tục sử dụng theo thời hạn ghi trên giấy phép lái xe. \n\n2. Giấy phép lái xe được cấp trước ngày Luật này có hiệu lực thi hành nếu chưa thực hiện đổi, cấp lại theo quy định của Luật này có hiệu lực sử dụng như sau:\n\na) Giấy phép lái xe hạng A1 được tiếp tục điều khiển xe mô tô hai bánh có dung tích xi-lanh từ 50 cm3\xa0đến dưới 175 cm3 hoặc có công suất động cơ điện từ 04 kW đến dưới 14 kW;\n\nb) Giấy phép lái xe hạng A2 được tiếp tục điều khiển xe mô tô hai bánh có dung tích xi-lanh từ 175 cm3\xa0trở lên hoặc có công suất động cơ điện từ 14 kW trở lên và các loại xe quy định cho giấy phép lái xe hạng A1 quy định tại điểm a khoản này;\n\nc) Giấy phép lái xe hạng A3 được tiếp tục điều khiển xe mô tô ba bánh, các loại xe quy định cho giấy phép lái xe hạng A1 quy định tại điểm a khoản này và các xe tương tự;\n\nd) Giấy phép lái xe hạng A4 được tiếp tục điều khiển máy kéo có trọng tải đến 1.000 kg;\n\nđ) Giấy phép lái xe hạng B1 số tự động cấp cho người không hành nghề lái xe được tiếp tục điều khiển xe ô tô số tự động chở người đến 08 chỗ (không kể chỗ của người lái xe); xe ô tô tải, kể cả ô tô tải chuyên dùng số tự động có trọng tải dưới 3.500 kg;\n\ne) Giấy phép lái xe hạng B1 cấp cho người không hành nghề lái xe được tiếp tục điều khiển xe ô tô chở người đến 08 chỗ (không kể chỗ của người lái xe); xe ô tô tải, máy kéo có trọng tải dưới 3.500 kg;\n\ng) Giấy phép lái xe hạng B2 cấp cho người hành nghề lái xe được tiếp tục điều khiển xe ô tô chở người đến 08 chỗ (không kể chỗ của người lái xe); xe ô tô tải, máy kéo có trọng tải dưới 3.500 kg;\n\nh) Giấy phép lái xe hạng C được tiếp tục điều khiển xe ô tô tải, máy kéo có trọng tải từ 3.500 kg trở lên và các loại xe quy định cho các giấy phép lái xe hạng B1, B2 quy định tại các điểm đ, e và g khoản này;\n\ni) Giấy phép lái xe hạng D được tiếp tục điều khiển xe ô tô chở người từ 09 chỗ (không kể chỗ của người lái xe) đến 29 chỗ (không kể chỗ của người lái xe) và các loại xe quy định cho các giấy phép lái xe hạng B1, B2, C quy định tại các điểm đ, e, g và h khoản này;\n\nk) Giấy phép lái xe hạng E được tiếp tục điều khiển xe ô tô chở người trên 29 chỗ (không kể chỗ của người lái xe) và các loại xe quy định cho các giấy phép lái xe hạng B1, B2, C, D quy định tại các điểm đ, e, g, h và i khoản này;\n\nl) Giấy phép lái xe hạng FB2, FD được tiếp tục điều khiển các loại xe quy định cho giấy phép lái xe hạng B2, D quy định tại điểm g và điểm i khoản này khi kéo rơ moóc; giấy phép lái xe hạng FC được tiếp tục điều khiển các loại xe quy định cho giấy phép lái xe hạng C quy định tại điểm h khoản này khi kéo rơ moóc, đầu kéo kéo sơ mi rơ moóc; giấy phép lái xe hạng FE được tiếp tục điều khiển các loại xe quy định cho giấy phép lái xe hạng E quy định tại điểm k khoản này khi kéo rơ moóc\xa0hoặc xe ô tô chở khách nối toa.\n\n3. Trường hợp người có giấy phép lái xe đã được cấp trước ngày Luật này có hiệu lực thi hành có nhu cầu đổi, cấp lại giấy phép lái xe thì thực hiện như sau:\n\na) Giấy phép lái xe hạng A1 được đổi, cấp lại sang giấy phép lái xe hạng A với điều kiện hạn chế là chỉ được điều khiển xe mô tô hai bánh có dung tích xi-lanh đến dưới 175 cm3 hoặc có công suất động cơ điện đến dưới 14 kW;\n\nb) Giấy phép lái xe hạng A2 được đổi, cấp lại sang giấy phép lái xe hạng A;\n\nc) Giấy phép lái xe hạng A3 được đổi, cấp lại sang giấy phép lái xe hạng B1;\n\nd) Giấy phép lái xe hạng A4 được đổi, cấp lại sang chứng chỉ điều khiển xe máy chuyên dùng cho người điều khiển máy kéo có trọng tải đến 1.000 kg và chứng chỉ bồi dưỡng kiến thức pháp luật về giao thông đường bộ cho người điều khiển xe máy chuyên dùng;\n\nđ) Giấy phép lái xe hạng B1 số tự động được đổi, cấp lại sang giấy phép lái xe hạng B với điều kiện hạn chế là chỉ được điều khiển xe ô tô số tự động;\n\ne) Giấy phép lái xe hạng B1, B2 được đổi, cấp lại sang giấy phép lái xe hạng B hoặc hạng C1 và chứng chỉ điều khiển xe máy chuyên dùng cho người điều khiển máy kéo có trọng tải đến 3.500 kg;\n\ng) Giấy phép lái xe hạng C giữ nguyên và đổi, cấp lại cùng hạng và chứng chỉ điều khiển xe máy chuyên dùng cho người điều khiển máy kéo có trọng tải trên 3.500 kg;\n\nh) Giấy phép lái xe hạng D được đổi, cấp lại sang giấy phép lái xe hạng D2 và chứng chỉ điều khiển xe máy chuyên dùng cho người điều khiển máy kéo có trọng tải trên 3.500 kg;\n\ni) Giấy phép lái xe hạng E được đổi, cấp lại sang giấy phép lái xe hạng D và chứng chỉ điều khiển xe máy chuyên dùng cho người điều khiển máy kéo có trọng tải trên 3.500 kg;\n\nk) Giấy phép lái xe hạng FB2 được đổi, cấp lại sang giấy phép lái xe hạng BE hoặc hạng C1E và chứng chỉ điều khiển xe máy chuyên dùng cho người điều khiển máy kéo có trọng tải đến 3.500 kg;\n\nl) Giấy phép lái xe hạng FC được đổi, cấp lại sang giấy phép lái xe hạng CE và chứng chỉ điều khiển xe máy chuyên dùng cho người điều khiển máy kéo có trọng tải trên 3.500 kg;\n\nm) Giấy phép lái xe hạng FD được đổi, cấp lại sang giấy phép lái xe hạng D2E và chứng chỉ điều khiển xe máy chuyên dùng cho người điều khiển máy kéo có trọng tải trên 3.500 kg;\n\nn) Giấy phép lái xe hạng FE được đổi, cấp lại sang giấy phép lái xe hạng DE và chứng chỉ điều khiển xe máy chuyên dùng cho người điều khiển máy kéo có trọng tải trên 3.500 kg.\n\n4. Người học lái xe đã được đào tạo lái xe trước ngày Luật này có hiệu lực thi hành hoặc đang được đào tạo lái xe tại ngày Luật này có hiệu lực thi hành chưa được sát hạch, cấp giấy phép lái xe thì được sát hạch, cấp giấy phép lái xe theo hạng giấy phép lái xe đổi, cấp lại quy định tại khoản 3 Điều này.\n\n5. Chứng nhận đăng ký xe, biển số xe máy chuyên dùng cấp trước ngày Luật này có hiệu lực thi hành vẫn có giá trị sử dụng.\n\n6. Chứng nhận chất lượng an toàn kỹ thuật và bảo vệ môi trường được cấp trước ngày Luật này có hiệu lực thi hành thì có giá trị sử dụng đến hết thời hạn ghi trên giấy chứng nhận đó.\n\n7. Việc đấu giá biển số xe ô tô được thực hiện trước ngày Luật này có hiệu lực thi hành và đến ngày Luật này có hiệu lực thi hành đã được cấp văn bản xác nhận biển số xe ô tô trúng đấu giá thì tiếp tục thực hiện theo Nghị quyết số 73/2022/QH15 của Quốc hội về thí điểm đấu giá biển số xe ô tô; trường hợp chưa được cấp xác nhận biển số xe ô tô trúng đấu giá thì tiếp tục thực hiện theo Nghị quyết số 73/2022/QH15 của Quốc hội về thí điểm đấu giá biển số xe ô tô và quy định tại điểm d khoản 1 Điều 38 của Luật này./.\n\nLuật này được Quốc hội nước Cộng hòa xã hội chủ nghĩa Việt Nam khóa XV, kỳ họp thứ 7 thông qua ngày 27 tháng 6 năm 2024.\n\nE-pas: 60179 CHỦ TỊCH QUỐC HỘI\n\n\n\n\nTrần Thanh Mẫn', 'a) Chứng nhận đăng ký xe hoặc bản sao Chứng nhận đăng ký xe có chứng thực kèm bản gốc giấy tờ xác nhận của tổ chức tín dụng, chi nhánh ngân hàng nước ngoài còn hiệu lực trong trường hợp xe đang được thế chấp tại tổ chức tín dụng, chi nhánh ngân hàng nước ngoài;\n\nb) Giấy phép lái xe phù hợp với loại xe đang điều khiển;\n\nc) Chứng nhận kiểm định an toàn kỹ thuật và bảo vệ môi trường đối với xe cơ giới theo quy định của pháp luật;\n\nd) Chứng nhận bảo hiểm bắt buộc trách nhiệm dân sự của chủ xe cơ giới.\n\n2. Người điều khiển xe máy chuyên dùng tham gia giao thông đường bộ phải đủ tuổi, sức khỏe theo quy định của pháp luật; có bằng hoặc chứng chỉ điều khiển xe máy chuyên dùng phù hợp loại xe máy chuyên dùng đang điều khiển; có giấy phép lái xe đang còn điểm, còn hiệu lực hoặc chứng chỉ bồi dưỡng kiến thức pháp luật về giao thông đường bộ. Khi tham gia giao thông đường bộ, người điều khiển xe máy chuyên dùng phải mang theo các loại giấy tờ sau đây:\n\na) Chứng nhận đăng ký xe hoặc bản sao Chứng nhận đăng ký xe có chứng thực kèm bản gốc Giấy biên nhận còn hiệu lực của tổ chức tín dụng, chi nhánh ngân hàng nước ngoài trong trường hợp xe đang được thế chấp tại tổ chức tín dụng, chi nhánh ngân hàng nước ngoài;\n\nb) Bằng hoặc chứng chỉ điều khiển xe máy chuyên dùng;\n\nc) Giấy phép lái xe hoặc chứng chỉ bồi dưỡng kiến thức pháp luật về giao thông đường bộ;\n\nd) Chứng nhận kiểm định an toàn kỹ thuật và bảo vệ môi trường đối với xe máy chuyên dùng theo quy định của pháp luật;\n\nđ) Chứng nhận bảo hiểm bắt buộc trách nhiệm dân sự theo quy định của pháp luật.\n\n3. Trường hợp giấy tờ quy định tại khoản 1 và khoản 2 Điều này đã được tích hợp vào tài khoản định danh điện tử thì việc xuất trình, kiểm tra có thể thực hiện thông qua tài khoản định danh điện tử.\n\n4. Người lái xe gắn máy tham gia giao thông đường bộ phải hiểu biết quy tắc giao thông đường bộ, có kỹ năng điều khiển phương tiện; đủ điều kiện về độ tuổi, sức khỏe theo quy định tại điểm a khoản 1 và khoản 2 Điều 59 của Luật này.\n\n5. Người tập lái xe ô tô, người dự sát hạch lái xe ô tô khi tham gia giao thông đường bộ phải thực hành trên xe tập lái, xe sát hạch trên tuyến đường tập lái, tuyến đường sát hạch, có giáo viên dạy lái hoặc sát hạch viên bảo trợ tay lái. Giáo viên dạy lái, sát hạch viên phải mang theo các loại giấy tờ quy định tại khoản 1 Điều này.\n\nĐiều 57. Giấy phép lái xe\n\n1. Giấy phép lái xe bao gồm các hạng sau đây:\n\na) Hạng A1 cấp cho người lái xe mô tô hai bánh có dung tích xi-lanh đến 125 cm3 hoặc có công suất động cơ điện đến 11 kW;\n\nb) Hạng A cấp cho người lái xe mô tô hai bánh có dung tích xi-lanh\xa0 trên 125 cm3\xa0hoặc có công suất động cơ điện trên 11 kW và các loại xe quy định cho giấy phép lái xe hạng A1;\n\nc) Hạng B1 cấp cho người lái xe mô tô ba bánh và các loại xe quy định cho giấy phép lái xe hạng A1;\n\nd) Hạng B cấp cho người lái xe ô tô chở người đến 08 chỗ (không kể chỗ của người lái xe); xe ô tô tải và ô tô chuyên dùng có khối lượng toàn bộ theo thiết kế đến 3.500 kg; các loại xe ô tô quy định cho giấy phép lái xe hạng B kéo rơ moóc có khối lượng toàn bộ theo thiết kế đến 750 kg; \n\nđ) Hạng C1 cấp cho người lái xe ô tô tải và ô tô chuyên dùng có khối lượng toàn bộ theo thiết kế trên 3.500 kg đến 7.500 kg; các loại xe ô tô tải quy định cho giấy phép lái xe hạng C1 kéo rơ moóc có khối lượng toàn bộ theo thiết kế đến 750 kg; các loại xe quy định cho giấy phép lái xe hạng B;\n\ne) Hạng C cấp cho người lái xe ô tô tải và ô tô chuyên dùng có khối lượng toàn bộ theo thiết kế trên 7.500 kg; các loại xe ô tô tải quy định cho giấy phép lái xe hạng C kéo rơ moóc có khối lượng toàn bộ theo thiết kế đến 750 kg; các loại xe quy định cho giấy phép lái xe hạng B và hạng C1;\n\ng) Hạng D1 cấp cho người lái xe ô tô chở người trên 08 chỗ (không kể chỗ của người lái xe) đến 16 chỗ (không kể chỗ của người lái xe); các loại xe ô tô chở người quy định cho giấy phép lái xe hạng D1 kéo rơ moóc có khối lượng toàn bộ theo thiết kế đến 750 kg; các loại xe quy định cho giấy phép lái xe các hạng B, C1, C;\n\nh) Hạng D2 cấp cho người lái xe ô tô chở người (kể cả xe buýt) trên 16 chỗ (không kể chỗ của người lái xe) đến 29 chỗ (không kể chỗ của người lái xe); các loại xe ô tô chở người quy định cho giấy phép lái xe hạng D2 kéo rơ moóc có khối lượng toàn bộ theo thiết kế đến 750 kg; các loại xe quy định cho giấy phép lái xe các hạng B, C1, C, D1;\n\ni) Hạng D cấp cho người lái xe ô tô chở người (kể cả xe buýt) trên 29 chỗ (không kể chỗ của người lái xe); xe ô tô chở người giường nằm; các loại xe ô tô chở người quy định cho giấy phép lái xe hạng D kéo rơ moóc có khối lượng toàn bộ theo thiết kế đến 750 kg; các loại xe quy định cho giấy phép lái xe các hạng B, C1, C, D1, D2;\n\nk) Hạng BE cấp cho người lái các loại xe ô tô quy định cho giấy phép lái xe hạng B kéo rơ moóc có khối lượng toàn bộ theo thiết kế trên 750 kg;\n\nl) Hạng C1E cấp cho người lái các loại xe ô tô quy định cho giấy phép lái xe hạng C1 kéo rơ moóc có khối lượng toàn bộ theo thiết kế trên 750 kg;\n\nm) Hạng CE cấp cho người lái các loại xe ô tô quy định cho giấy phép lái xe hạng C kéo rơ moóc có khối lượng toàn bộ theo thiết kế trên 750 kg; xe ô tô đầu kéo kéo sơ mi rơ moóc;\n\nn) Hạng D1E cấp cho người lái các loại xe ô tô quy định cho giấy phép lái xe hạng D1 kéo rơ moóc có khối lượng toàn bộ theo thiết kế trên 750 kg;\n\no) Hạng D2E cấp cho người lái các loại xe ô tô quy định cho giấy phép lái xe hạng D2 kéo rơ moóc có khối lượng toàn bộ theo thiết kế trên 750 kg;\n\np) Hạng DE cấp cho người lái các loại xe ô tô quy định cho giấy phép lái xe hạng D kéo rơ moóc có khối lượng toàn bộ theo thiết kế trên 750 kg; xe ô tô chở khách nối toa.\n\n2. Người khuyết tật điều khiển xe mô tô ba bánh dùng cho người khuyết tật được cấp giấy phép lái xe hạng A1.\n\nNgười khuyết tật điều khiển xe ô tô số tự động có kết cấu phù hợp với tình trạng khuyết tật thì được cấp giấy phép lái xe hạng B.\n\n3. Người điều khiển xe chở hàng bốn bánh có gắn động cơ, xe chở người bốn bánh có gắn động cơ phải sử dụng giấy phép lái xe có hạng phù hợp với xe ô tô tải hoặc xe ô tô chở người tương ứng.\n\n4. Người điều khiển xe ô tô có thiết kế, cải tạo với số chỗ ít hơn xe cùng loại, kích thước giới hạn tương đương phải sử dụng giấy phép lái xe có hạng phù hợp với xe ô tô cùng loại, kích thước giới hạn tương đương và có số chỗ nhiều nhất.\n\n5. Thời hạn của giấy phép lái xe được quy định như sau:\n\na) Giấy phép lái xe các hạng A1, A, B1 không thời hạn;\n\nb) Giấy phép lái xe hạng B và hạng C1 có thời hạn 10 năm kể từ ngày cấp;\n\nc) Giấy phép lái xe các hạng C, D1, D2, D, BE, C1E, CE, D1E, D2E và DE có thời hạn 05 năm kể từ ngày cấp.\n\n6. Giấy phép lái xe có giá trị sử dụng trong phạm vi lãnh thổ Việt Nam bao gồm:\n\na) Giấy phép lái xe do cơ quan có thẩm quyền của Việt Nam cấp;\n\nb) Giấy phép lái xe quốc tế và giấy phép lái xe quốc gia phù hợp với loại xe được phép điều khiển do quốc gia là thành viên của Công ước của Liên hợp quốc về Giao thông đường bộ năm 1968 (sau đây gọi là Công ước Viên) cấp;\n\nc) Giấy phép lái xe phù hợp với loại xe được phép điều khiển của nước hoặc vùng lãnh thổ mà Việt Nam ký kết điều ước quốc tế hoặc thỏa thuận quốc tế công nhận giấy phép lái xe của nhau;\n\nd) Giấy phép lái xe nước ngoài phù hợp với loại xe được phép điều khiển do quốc gia được công nhận theo điều ước quốc tế mà nước Cộng hòa xã hội chủ nghĩa Việt Nam là thành viên.\n\n7. Giấy phép lái xe không có hiệu lực trong các trường hợp sau đây:\n\na) Giấy phép lái xe hết thời hạn sử dụng;\n\nb) Giấy phép lái xe bị thu hồi theo quy định tại khoản 5 Điều 62 của Luật này.\n\n8. Giấy phép lái xe quốc tế được quy định như sau:\n\na) Giấy phép lái xe quốc tế là giấy phép lái xe do cơ quan nhà nước có thẩm quyền của quốc gia là thành viên của Công ước Viên cấp theo một mẫu thống nhất; có thời hạn không quá 03 năm kể từ ngày cấp và phải phù hợp với thời hạn còn hiệu lực của giấy phép lái xe quốc gia;', '7. In, phát hành và quản lý việc sử dụng phôi chứng chỉ cho người điều khiển xe máy chuyên dùng thuộc phạm vi quản lý của Bộ Quốc phòng để thống nhất trong toàn quân.\n\n8. Kiểm tra, phúc tra công tác bồi dưỡng kiến thức pháp luật về giao thông đường bộ, cấp chứng chỉ cho người điều khiển xe máy chuyên dùng thuộc phạm vi quản lý của Bộ Quốc phòng.\n\nĐiều 57. Trách nhiệm của cơ quan xe - máy hoặc cơ quan xe máy - vận tải các đơn vị\n\n1. Chịu sự chỉ đạo của Cục Xe máy - Vận tải/Tổng cục Hậu cần - Kỹ thuật về nghiệp vụ đào tạo lái xe quân sự và bồi dưỡng kiến thức pháp luật về giao thông đường bộ cho người điều khiển xe máy chuyên dùng.\n\n2. Quản lý, chỉ đạo, hướng dẫn và kiểm tra cơ sở đào tạo lái xe quân sự; cơ sở bồi dưỡng kiến thức pháp luật về giao thông đường bộ cùng cấp về việc thực hiện nội dung, chương trình, quy chế đào tạo; nghiệp vụ quản lý xe - máy và thực hiện các chế độ theo quy định.\n\n3. Tham gia các đợt kiểm tra, giám sát cơ sở đào tạo lái xe; cơ sở bồi dưỡng kiến thức pháp luật về giao thông đường bộ theo kế hoạch.\n\n4. Đề nghị cấp, đổi, cấp lại Giấy phép xe quân sự cho quân nhân, công chức quốc phòng, công nhân và viên chức quốc phòng, lao động hợp đồng theo quy định tại Thông tư này.\n\n5. Báo cáo nhu cầu, tiếp nhận, quản lý việc sử dụng phôi chứng chỉ tại cơ sở bồi dưỡng kiến thức pháp luật về giao thông đường bộ thuộc phạm vi đơn vị.\n\nĐiều 58. Trách nhiệm của cơ sở đào tạo\n\n1. Chịu sự chỉ đạo của Cục Xe máy - Vận tải/Tổng cục Hậu cần - Kỹ thuật và cơ quan xe - máy hoặc cơ quan xe máy - vận tải cấp trên về nghiệp vụ đào tạo lái xe quân sự và bồi dưỡng kiến thức pháp luật về giao thông đường bộ cho người điều khiển xe máy chuyên dùng.\n\n2. Bảo đảm đủ cơ sở vật chất, trang bị, phương tiện kỹ thuật đáp ứng yêu cầu nhiệm vụ, nâng cao chất lượng đào tạo, sát hạch lái xe và quản lý, rèn luyện học viên theo Quy chế quản lý học viên quân sự trong nhà trường Quân đội, Điều lệnh quản lý bộ đội và Điều lệ công tác nhà trường Quân đội nhân dân Việt Nam.\n\n3. Thực hiện đúng quy định quản lý, sử dụng trang bị xe - máy thực hiện nhiệm vụ đào tạo, sát hạch lái xe quân sự. Đề nghị cấp giấy phép dạy lái xe cho giáo viên đủ điều kiện, giấy phép xe tập lái, biển “Tập lái” đúng quy định.\n\n4. Quản lý, lưu trữ hồ sơ đào tạo, sát hạch lái xe và bồi dưỡng kiến thức pháp luật về giao thông đường bộ cho người điều khiển xe máy chuyên dùng thuộc phạm vi quản lý của Bộ Quốc phòng theo quy định tại Thông tư này.\n\n5. Đề xuất với Cục Xe máy - Vận tải/Tổng cục Hậu cần - Kỹ thuật và các cơ quan liên quan giải pháp nâng cao chất lượng công tác đào tạo, sát hạch lái xe quân sự và bồi dưỡng kiến thức pháp luật về giao thông đường bộ cho người điều khiển xe máy chuyên dùng thuộc phạm vi quản lý của Bộ Quốc phòng.\n\nĐiều 59. Trách nhiệm của cá nhân trong quản lý, sử dụng Giấy phép lái xe quân sự\n\n1. Người được giao nhiệm vụ điều khiển xe quân sự phải có Giấy phép lái xe quân sự.\n\n2. Người có Giấy phép lái xe quân sự được phép điều khiển những loại xe quy định cho từng hạng ghi trên Giấy phép lái xe quân sự.\n\n3. Giấy phép lái xe quân sự phải được mang theo khi lái xe; có trách nhiệm giữ gìn, sử dụng đúng mục đích. Khi mất hoặc phát hiện có sai lệch thông tin ghi trên Giấy phép lái xe quân sự phải báo cáo kịp thời với các cơ quan chức năng để xem xét, giải quyết theo quy định.\n\nChương VI\n\nĐIỀU KHOẢN THI HÀNH\n\nĐiều 60. Hiệu lực thi hành\n\n1. Thông tư này có hiệu lực kể từ ngày 01 tháng 01 năm 2025.\n\n2. Kể từ ngày Thông tư này có hiệu lực thi hành, các Thông tư sau hết hiệu lực thi hành:\n\na) Thông tư số 170/2021/TT-BQP ngày 23 tháng 12 năm 2021 của Bộ trưởng Bộ Quốc phòng quy định về đào tạo, sát hạch, cấp Giấy phép lái xe quân sự; bồi dưỡng kiến thức pháp luật về giao thông đường bộ cho người điều khiển xe máy chuyên dùng trong Bộ Quốc phòng;\n\nb) Thông tư số 86/2023/TT-BQP ngày 20 tháng 11 năm 2023 của Bộ trưởng Bộ Quốc phòng sửa đổi, bổ sung một số điều của Thông tư số 170/2021/TT-BQP ngày 23 tháng 12 năm 2021 của Bộ trưởng Bộ Quốc phòng về đào tạo, sát hạch, cấp Giấy phép lái xe quân sự; bồi dưỡng kiến thức pháp luật về giao thông đường bộ cho người điều khiển xe máy chuyên dùng trong Bộ Quốc phòng.\n\n3. Trường hợp văn bản viện dẫn trong Thông tư này được sửa đổi, bổ sung hoặc thay thế thì áp dụng theo văn bản sửa đổi, bổ sung hoặc thay thế.\n\nĐiều 61. Quy định chuyển tiếp\n\n1. Giấy phép lái xe quân sự được cấp trước ngày Thông tư này có hiệu lực thi hành được tiếp tục sử dụng theo thời hạn ghi trên giấy phép lái xe.\n\n2. Giấy phép lái xe quân sự được cấp trước ngày Thông tư này có hiệu lực thi hành nếu chưa thực hiện đổi, cấp lại theo quy định của Thông tư này có hiệu lực sử dụng như sau:\n\na) Giấy phép lái xe quân sự hạng A1 được tiếp tục điều khiển xe mô tô hai bánh có dung tích xi-lanh từ 50 cm3 đến dưới 175 cm3 hoặc có công suất động cơ điện từ 04 kW đến dưới 14 kW;\n\nb) Giấy phép lái xe quân sự hạng A2 được tiếp tục điều khiển xe mô tô hai bánh có dung tích xi-lanh từ 175 cm3 trở lên hoặc có công suất động cơ điện từ 14 kW trở lên và các loại xe quy định cho Giấy phép lái xe hạng A1 quy định tại điểm a khoản này;\n\nc) Giấy phép lái xe quân sự hạng A3 được tiếp tục điều khiển xe mô tô ba bánh, các loại xe quy định cho Giấy phép lái xe hạng A1 quy định tại điểm a khoản này và các xe tương tự;\n\nd) Giấy phép lái xe quân sự hạng B2 được tiếp tục điều khiển xe ô tô chở người đến 08 chỗ (không kể chỗ của người lái xe); xe ô tô tải, máy kéo có trọng tải dưới 3.500 kg; các loại xe ô tô quy định cho Giấy phép lái xe hạng B kéo theo một rơ moóc hoặc vũ khí, khí tài quân sự dạng rơ moóc có khối lượng toàn bộ theo thiết kế đến 750 kg;\n\nđ) Giấy phép lái xe quân sự hạng C được tiếp tục điều khiển xe ô tô tải, máy kéo có trọng tải từ 3.500 kg trở lên và các loại xe quy định cho các Giấy phép lái xe hạng B2 quy định tại điểm d khoản này; các loại xe ô tô quy định cho Giấy phép lái xe hạng C kéo theo một rơ moóc hoặc vũ khí, khí tài quân sự dạng rơ moóc có khối lượng toàn bộ theo thiết kế đến 750 kg;\n\ne) Giấy phép lái xe quân sự hạng D được tiếp tục điều khiển xe ô tô chở người từ 09 chỗ (không kể chỗ của người lái xe) đến 29 chỗ (không kể chỗ của người lái xe) và các loại xe quy định cho các Giấy phép lái xe hạng B2, C quy định tại các điểm d, đ khoản này; các loại xe ô tô quy định cho Giấy phép lái xe hạng D2 kéo theo một rơ moóc hoặc vũ khí, khí tài quân sự dạng rơ moóc có khối lượng toàn bộ theo thiết kế đến 750 kg;\n\ng) Giấy phép lái xe quân sự hạng E được tiếp tục điều khiển xe ô tô chở người trên 29 chỗ (không kể chỗ của người lái xe) và các loại xe quy định cho các giấy phép lái xe hạng B2, C, D quy định tại các điểm d, đ và e khoản này; các loại ô tô quy định cho Giấy phép lái xe hạng D kéo theo một rơ moóc hoặc vũ khí, khí tài quân sự dạng rơ moóc có khối lượng toàn bộ theo thiết kế đến 750 kg;\n\nh) Giấy phép lái xe quân sự hạng FC được tiếp tục điều khiển các loại xe quy định cho Giấy phép lái xe hạng C quy định tại điểm đ khoản này khi kéo rơ moóc, khí tài quân sự dạng rơ moóc và ô tô đầu kéo kéo sơ mi rơ moóc, khí tài quân sự dạng sơ mi rơ moóc;\n\ni) Giấy phép lái xe quân sự hạng FX được tiếp tục điều khiển xe xích kéo vũ khí, khí tài quân sự và các loại xe quy định cho Giấy phép lái xe hạng C quy định tại điểm đ khoản này.\n\n3. Trường hợp người có Giấy phép, lái xe quân sự đã được cấp trước ngày Thông tư này có hiệu lực thi hành khi đổi, cấp lại giấy phép lái xe thì thực hiện như sau:\n\na) Giấy phép lái xe quân sự hạng A1 được đổi, cấp lại sang Giấy phép lái xe quân sự hạng A với điều kiện hạn chế là chỉ được điều khiển xe mô tô hai bánh có dung tích xi-lanh đến dưới 175 cm3 hoặc có công suất động cơ điện đến dưới 14 kW;\n\nb) Giấy phép lái xe quân sự hạng A2 được đổi, cấp lại sang Giấy phép lái xe quân sự hạng A;\n\nc) Giấy phép lái xe quân sự hạng A3 được đổi, cấp lại sang Giấy phép lái xe quân sự hạng B1;\n\nd) Giấy phép lái xe quân sự hạng B2 được đổi, cấp lại sang Giấy phép lái xe quân sự hạng B hoặc hạng C1;\n\nđ) Giấy phép lái xe quân sự hạng C giữ nguyên và đổi, cấp lại cùng hạng;']","**Nguồn văn bản:** /content/drive/MyDrive/ITProject_data/new_law/36_2024_QH15_444251.docx

**Tên văn bản:** Luật này được Quốc hội nước Cộng hòa xã hội chủ nghĩa Việt Nam khóa XV, kỳ họp thứ 7 thông qua ngày 27 tháng 6 năm 2024.

**Điều 89:** Quy định chuyển tiếp

**Nội dung:**

2. Giấy phép lái xe được cấp trước ngày Luật này có hiệu lực thi hành nếu chưa thực hiện đổi, cấp lại theo quy định của Luật này có hiệu lực sử dụng như sau:

    a) Giấy phép lái xe hạng A1 được tiếp tục điều khiển xe mô tô hai bánh có dung tích xi-lanh từ 50 cm3 đến dưới 175 cm3 hoặc có công suất động cơ điện từ 04 kW đến dưới 14 kW;

    b) Giấy phép lái xe hạng A2 được tiếp tục điều khiển xe mô tô hai bánh có dung tích xi-lanh từ 175 cm3 trở lên hoặc có công suất động cơ điện từ 14 kW trở lên và các loại xe quy định cho giấy phép lái xe hạng A1 quy định tại điểm a khoản này;

    c) Giấy phép lái xe hạng A3 được tiếp tục điều khiển xe mô tô ba bánh, các loại xe quy định cho giấy phép lái xe hạng A1 quy định tại điểm a khoản này và các xe tương tự;

    d) Giấy phép lái xe hạng A4 được tiếp tục điều khiển máy kéo có trọng tải đến 1.000 kg;

    đ) Giấy phép lái xe hạng B1 số tự động cấp cho người không hành nghề lái xe được tiếp tục điều khiển xe ô tô số tự động chở người đến 08 chỗ (không kể chỗ của người lái xe); xe ô tô tải, kể cả ô tô tải chuyên dùng số tự động có trọng tải dưới 3.500 kg;

    e) Giấy phép lái xe hạng B1 cấp cho người không hành nghề lái xe được tiếp tục điều khiển xe ô tô chở người đến 08 chỗ (không kể chỗ của người lái xe); xe ô tô tải, máy kéo có trọng tải dưới 3.500 kg;

    g) Giấy phép lái xe hạng B2 cấp cho người hành nghề lái xe được tiếp tục điều khiển xe ô tô chở người đến 08 chỗ (không kể chỗ của người lái xe); xe ô tô tải, máy kéo có trọng tải dưới 3.500 kg;

    h) Giấy phép lái xe hạng C được tiếp tục điều khiển xe ô tô tải, máy kéo có trọng tải từ 3.500 kg trở lên và các loại xe quy định cho các giấy phép lái xe hạng B1, B2 quy định tại các điểm đ, e và g khoản này;

    i) Giấy phép lái xe hạng D được tiếp tục điều khiển xe ô tô chở người từ 09 chỗ (không kể chỗ của người lái xe) đến 29 chỗ (không kể chỗ của người lái xe) và các loại xe quy định cho các giấy phép lái xe hạng B1, B2, C quy định tại các điểm đ, e, g và h khoản này;

    k) Giấy phép lái xe hạng E được tiếp tục điều khiển xe ô tô chở người trên 29 chỗ (không kể chỗ của người lái xe) và các loại xe quy định cho các giấy phép lái xe hạng B1, B2, C, D quy định tại các điểm đ, e, g, h và i khoản này;

    l) Giấy phép lái xe hạng FB2, FD được tiếp tục điều khiển các loại xe quy định cho giấy phép lái xe hạng B2, D quy định tại điểm g và điểm i khoản này khi kéo rơ moóc; giấy phép lái xe hạng FC được tiếp tục điều khiển các loại xe quy định cho giấy phép lái xe hạng C quy định tại điểm h khoản này khi kéo rơ moóc, đầu kéo kéo sơ mi rơ moóc; giấy phép lái xe hạng FE được tiếp tục điều khiển các loại xe quy định cho giấy phép lái xe hạng E quy định tại điểm k khoản này khi kéo rơ moóc hoặc xe ô tô chở khách nối toa.


Tóm lại: Giấy phép lái xe hạng A1 được phép điều khiển xe mô tô hai bánh có dung tích xi-lanh từ 50 cm3 đến dưới 175 cm3 hoặc có công suất động cơ điện từ 04 kW đến dưới 14 kW (theo quy định chuyển tiếp của Luật).
",Hạng A1 mới cấp cho người lái xe mô tô từ trên 50 phân khối đến 125 phân khối.,0.3333333333333333,0.821053820026922,0.0,0.0
2,Thời hạn của giấy phép lái xe hạng B theo Luật Giao thông Đường bộ 2025 là bao lâu?,"['a) Chứng nhận đăng ký xe hoặc bản sao Chứng nhận đăng ký xe có chứng thực kèm bản gốc giấy tờ xác nhận của tổ chức tín dụng, chi nhánh ngân hàng nước ngoài còn hiệu lực trong trường hợp xe đang được thế chấp tại tổ chức tín dụng, chi nhánh ngân hàng nước ngoài;\n\nb) Giấy phép lái xe phù hợp với loại xe đang điều khiển;\n\nc) Chứng nhận kiểm định an toàn kỹ thuật và bảo vệ môi trường đối với xe cơ giới theo quy định của pháp luật;\n\nd) Chứng nhận bảo hiểm bắt buộc trách nhiệm dân sự của chủ xe cơ giới.\n\n2. Người điều khiển xe máy chuyên dùng tham gia giao thông đường bộ phải đủ tuổi, sức khỏe theo quy định của pháp luật; có bằng hoặc chứng chỉ điều khiển xe máy chuyên dùng phù hợp loại xe máy chuyên dùng đang điều khiển; có giấy phép lái xe đang còn điểm, còn hiệu lực hoặc chứng chỉ bồi dưỡng kiến thức pháp luật về giao thông đường bộ. Khi tham gia giao thông đường bộ, người điều khiển xe máy chuyên dùng phải mang theo các loại giấy tờ sau đây:\n\na) Chứng nhận đăng ký xe hoặc bản sao Chứng nhận đăng ký xe có chứng thực kèm bản gốc Giấy biên nhận còn hiệu lực của tổ chức tín dụng, chi nhánh ngân hàng nước ngoài trong trường hợp xe đang được thế chấp tại tổ chức tín dụng, chi nhánh ngân hàng nước ngoài;\n\nb) Bằng hoặc chứng chỉ điều khiển xe máy chuyên dùng;\n\nc) Giấy phép lái xe hoặc chứng chỉ bồi dưỡng kiến thức pháp luật về giao thông đường bộ;\n\nd) Chứng nhận kiểm định an toàn kỹ thuật và bảo vệ môi trường đối với xe máy chuyên dùng theo quy định của pháp luật;\n\nđ) Chứng nhận bảo hiểm bắt buộc trách nhiệm dân sự theo quy định của pháp luật.\n\n3. Trường hợp giấy tờ quy định tại khoản 1 và khoản 2 Điều này đã được tích hợp vào tài khoản định danh điện tử thì việc xuất trình, kiểm tra có thể thực hiện thông qua tài khoản định danh điện tử.\n\n4. Người lái xe gắn máy tham gia giao thông đường bộ phải hiểu biết quy tắc giao thông đường bộ, có kỹ năng điều khiển phương tiện; đủ điều kiện về độ tuổi, sức khỏe theo quy định tại điểm a khoản 1 và khoản 2 Điều 59 của Luật này.\n\n5. Người tập lái xe ô tô, người dự sát hạch lái xe ô tô khi tham gia giao thông đường bộ phải thực hành trên xe tập lái, xe sát hạch trên tuyến đường tập lái, tuyến đường sát hạch, có giáo viên dạy lái hoặc sát hạch viên bảo trợ tay lái. Giáo viên dạy lái, sát hạch viên phải mang theo các loại giấy tờ quy định tại khoản 1 Điều này.\n\nĐiều 57. Giấy phép lái xe\n\n1. Giấy phép lái xe bao gồm các hạng sau đây:\n\na) Hạng A1 cấp cho người lái xe mô tô hai bánh có dung tích xi-lanh đến 125 cm3 hoặc có công suất động cơ điện đến 11 kW;\n\nb) Hạng A cấp cho người lái xe mô tô hai bánh có dung tích xi-lanh\xa0 trên 125 cm3\xa0hoặc có công suất động cơ điện trên 11 kW và các loại xe quy định cho giấy phép lái xe hạng A1;\n\nc) Hạng B1 cấp cho người lái xe mô tô ba bánh và các loại xe quy định cho giấy phép lái xe hạng A1;\n\nd) Hạng B cấp cho người lái xe ô tô chở người đến 08 chỗ (không kể chỗ của người lái xe); xe ô tô tải và ô tô chuyên dùng có khối lượng toàn bộ theo thiết kế đến 3.500 kg; các loại xe ô tô quy định cho giấy phép lái xe hạng B kéo rơ moóc có khối lượng toàn bộ theo thiết kế đến 750 kg; \n\nđ) Hạng C1 cấp cho người lái xe ô tô tải và ô tô chuyên dùng có khối lượng toàn bộ theo thiết kế trên 3.500 kg đến 7.500 kg; các loại xe ô tô tải quy định cho giấy phép lái xe hạng C1 kéo rơ moóc có khối lượng toàn bộ theo thiết kế đến 750 kg; các loại xe quy định cho giấy phép lái xe hạng B;\n\ne) Hạng C cấp cho người lái xe ô tô tải và ô tô chuyên dùng có khối lượng toàn bộ theo thiết kế trên 7.500 kg; các loại xe ô tô tải quy định cho giấy phép lái xe hạng C kéo rơ moóc có khối lượng toàn bộ theo thiết kế đến 750 kg; các loại xe quy định cho giấy phép lái xe hạng B và hạng C1;\n\ng) Hạng D1 cấp cho người lái xe ô tô chở người trên 08 chỗ (không kể chỗ của người lái xe) đến 16 chỗ (không kể chỗ của người lái xe); các loại xe ô tô chở người quy định cho giấy phép lái xe hạng D1 kéo rơ moóc có khối lượng toàn bộ theo thiết kế đến 750 kg; các loại xe quy định cho giấy phép lái xe các hạng B, C1, C;\n\nh) Hạng D2 cấp cho người lái xe ô tô chở người (kể cả xe buýt) trên 16 chỗ (không kể chỗ của người lái xe) đến 29 chỗ (không kể chỗ của người lái xe); các loại xe ô tô chở người quy định cho giấy phép lái xe hạng D2 kéo rơ moóc có khối lượng toàn bộ theo thiết kế đến 750 kg; các loại xe quy định cho giấy phép lái xe các hạng B, C1, C, D1;\n\ni) Hạng D cấp cho người lái xe ô tô chở người (kể cả xe buýt) trên 29 chỗ (không kể chỗ của người lái xe); xe ô tô chở người giường nằm; các loại xe ô tô chở người quy định cho giấy phép lái xe hạng D kéo rơ moóc có khối lượng toàn bộ theo thiết kế đến 750 kg; các loại xe quy định cho giấy phép lái xe các hạng B, C1, C, D1, D2;\n\nk) Hạng BE cấp cho người lái các loại xe ô tô quy định cho giấy phép lái xe hạng B kéo rơ moóc có khối lượng toàn bộ theo thiết kế trên 750 kg;\n\nl) Hạng C1E cấp cho người lái các loại xe ô tô quy định cho giấy phép lái xe hạng C1 kéo rơ moóc có khối lượng toàn bộ theo thiết kế trên 750 kg;\n\nm) Hạng CE cấp cho người lái các loại xe ô tô quy định cho giấy phép lái xe hạng C kéo rơ moóc có khối lượng toàn bộ theo thiết kế trên 750 kg; xe ô tô đầu kéo kéo sơ mi rơ moóc;\n\nn) Hạng D1E cấp cho người lái các loại xe ô tô quy định cho giấy phép lái xe hạng D1 kéo rơ moóc có khối lượng toàn bộ theo thiết kế trên 750 kg;\n\no) Hạng D2E cấp cho người lái các loại xe ô tô quy định cho giấy phép lái xe hạng D2 kéo rơ moóc có khối lượng toàn bộ theo thiết kế trên 750 kg;\n\np) Hạng DE cấp cho người lái các loại xe ô tô quy định cho giấy phép lái xe hạng D kéo rơ moóc có khối lượng toàn bộ theo thiết kế trên 750 kg; xe ô tô chở khách nối toa.\n\n2. Người khuyết tật điều khiển xe mô tô ba bánh dùng cho người khuyết tật được cấp giấy phép lái xe hạng A1.\n\nNgười khuyết tật điều khiển xe ô tô số tự động có kết cấu phù hợp với tình trạng khuyết tật thì được cấp giấy phép lái xe hạng B.\n\n3. Người điều khiển xe chở hàng bốn bánh có gắn động cơ, xe chở người bốn bánh có gắn động cơ phải sử dụng giấy phép lái xe có hạng phù hợp với xe ô tô tải hoặc xe ô tô chở người tương ứng.\n\n4. Người điều khiển xe ô tô có thiết kế, cải tạo với số chỗ ít hơn xe cùng loại, kích thước giới hạn tương đương phải sử dụng giấy phép lái xe có hạng phù hợp với xe ô tô cùng loại, kích thước giới hạn tương đương và có số chỗ nhiều nhất.\n\n5. Thời hạn của giấy phép lái xe được quy định như sau:\n\na) Giấy phép lái xe các hạng A1, A, B1 không thời hạn;\n\nb) Giấy phép lái xe hạng B và hạng C1 có thời hạn 10 năm kể từ ngày cấp;\n\nc) Giấy phép lái xe các hạng C, D1, D2, D, BE, C1E, CE, D1E, D2E và DE có thời hạn 05 năm kể từ ngày cấp.\n\n6. Giấy phép lái xe có giá trị sử dụng trong phạm vi lãnh thổ Việt Nam bao gồm:\n\na) Giấy phép lái xe do cơ quan có thẩm quyền của Việt Nam cấp;\n\nb) Giấy phép lái xe quốc tế và giấy phép lái xe quốc gia phù hợp với loại xe được phép điều khiển do quốc gia là thành viên của Công ước của Liên hợp quốc về Giao thông đường bộ năm 1968 (sau đây gọi là Công ước Viên) cấp;\n\nc) Giấy phép lái xe phù hợp với loại xe được phép điều khiển của nước hoặc vùng lãnh thổ mà Việt Nam ký kết điều ước quốc tế hoặc thỏa thuận quốc tế công nhận giấy phép lái xe của nhau;\n\nd) Giấy phép lái xe nước ngoài phù hợp với loại xe được phép điều khiển do quốc gia được công nhận theo điều ước quốc tế mà nước Cộng hòa xã hội chủ nghĩa Việt Nam là thành viên.\n\n7. Giấy phép lái xe không có hiệu lực trong các trường hợp sau đây:\n\na) Giấy phép lái xe hết thời hạn sử dụng;\n\nb) Giấy phép lái xe bị thu hồi theo quy định tại khoản 5 Điều 62 của Luật này.\n\n8. Giấy phép lái xe quốc tế được quy định như sau:\n\na) Giấy phép lái xe quốc tế là giấy phép lái xe do cơ quan nhà nước có thẩm quyền của quốc gia là thành viên của Công ước Viên cấp theo một mẫu thống nhất; có thời hạn không quá 03 năm kể từ ngày cấp và phải phù hợp với thời hạn còn hiệu lực của giấy phép lái xe quốc gia;', 'a) Giấy phép lái xe hết thời hạn sử dụng;\n\nb) Giấy phép lái xe bị thu hồi theo quy định tại khoản 5 Điều 62 của Luật này.\n\n8. Giấy phép lái xe quốc tế được quy định như sau:\n\na) Giấy phép lái xe quốc tế là giấy phép lái xe do cơ quan nhà nước có thẩm quyền của quốc gia là thành viên của Công ước Viên cấp theo một mẫu thống nhất; có thời hạn không quá 03 năm kể từ ngày cấp và phải phù hợp với thời hạn còn hiệu lực của giấy phép lái xe quốc gia;\n\nb) Người có giấy phép lái xe quốc tế do quốc gia là thành viên của Công ước Viên cấp khi lái xe tham gia giao thông đường bộ trên lãnh thổ Việt Nam phải mang theo giấy phép lái xe quốc tế và giấy phép lái xe quốc gia được cấp phù hợp với hạng xe điều khiển, còn thời hạn sử dụng; phải tuân thủ pháp luật về trật tự, an toàn giao thông đường bộ của Việt Nam;\n\nc) Người có giấy phép lái xe quốc tế vi phạm pháp luật về trật tự, an toàn giao thông đường bộ của Việt Nam mà bị tước quyền sử dụng giấy phép lái xe có thời hạn thì thời gian bị tước quyền sử dụng không quá thời gian người lái xe được phép cư trú tại lãnh thổ Việt Nam;\n\nd) Người Việt Nam hoặc người nước ngoài có thẻ thường trú hoặc thẻ tạm trú tại Việt Nam có giấy phép lái xe do Việt Nam hoặc quốc gia là thành viên của điều ước quốc tế mà nước Cộng hòa xã hội chủ nghĩa Việt Nam là thành viên cấp, còn giá trị sử dụng, nếu có nhu cầu được cấp giấy phép lái xe quốc tế.\n\n9. Bộ trưởng Bộ Giao thông vận tải quy định mẫu giấy phép lái xe và giấy phép lái xe quốc tế, trình tự, thủ tục cấp và việc sử dụng giấy phép lái xe, giấy phép lái xe quốc tế; đối với mẫu giấy phép lái xe, trình tự, thủ tục cấp và việc sử dụng giấy phép lái xe của lực lượng quân đội, công an làm nhiệm vụ quốc phòng, an ninh do Bộ trưởng Bộ Quốc phòng, Bộ trưởng Bộ Công an quy định.\n\nĐiều 58. Điểm của giấy phép lái xe \n\n1. Điểm của giấy phép lái xe được dùng để quản lý việc chấp hành pháp luật về trật tự, an toàn giao thông đường bộ của người lái xe trên hệ thống cơ sở dữ liệu về trật tự, an toàn giao thông đường bộ, bao gồm 12 điểm. Số điểm trừ mỗi lần vi phạm tùy thuộc tính chất, mức độ của hành vi vi phạm pháp luật về trật tự, an toàn giao thông đường bộ. Dữ liệu về điểm trừ giấy phép lái xe của người vi phạm sẽ được cập nhật vào hệ thống cơ sở dữ liệu ngay sau khi quyết định xử phạt có hiệu lực thi hành và thông báo cho người bị trừ điểm giấy phép lái xe biết.\n\n2. Giấy phép lái xe chưa bị trừ hết điểm và không bị trừ điểm trong thời hạn 12 tháng từ ngày bị trừ điểm gần nhất thì được phục hồi đủ 12 điểm.\n\n3. Trường hợp giấy phép lái xe bị trừ hết điểm thì người có giấy phép lái xe không được điều khiển phương tiện tham gia giao thông đường bộ theo giấy phép lái xe đó. Sau thời hạn ít nhất là 06 tháng kể từ ngày bị trừ hết điểm, người có giấy phép lái xe được tham gia kiểm tra nội dung kiến thức pháp luật về trật tự, an toàn giao thông đường bộ theo quy định tại khoản 7 Điều 61 của Luật này do lực lượng Cảnh sát giao thông tổ chức, có kết quả đạt yêu cầu thì được phục hồi đủ 12 điểm.\n\n4. Giấy phép lái xe sau khi đổi, cấp lại, nâng hạng được giữ nguyên số điểm của giấy phép lái xe trước khi đổi, cấp lại, nâng hạng.\n\n5. Người có thẩm quyền xử phạt vi phạm hành chính có thẩm quyền trừ điểm giấy phép lái xe.\n\n6. Chính phủ quy định chi tiết khoản 1 Điều này; quy định trình tự, thủ tục, thẩm quyền trừ điểm, phục hồi điểm giấy phép lái xe; quy định lộ trình thực hiện Điều này. Bộ trưởng Bộ Công an quy định chi tiết khoản 3 Điều này.\n\nĐiều 59. Tuổi, sức khỏe của người điều khiển phương tiện tham gia giao thông đường bộ\n\n1. Độ tuổi của người lái xe, người điều khiển xe máy chuyên dùng được quy định như sau:\n\na) Người đủ 16 tuổi trở lên được điều khiển xe gắn máy;\n\nb) Người đủ 18 tuổi trở lên được cấp giấy phép lái xe hạng A1, A, B1, B, C1, được cấp chứng chỉ bồi dưỡng kiến thức pháp luật về giao thông đường bộ để điều khiển xe máy chuyên dùng tham gia giao thông đường bộ;\n\nc) Người đủ 21 tuổi trở lên được cấp giấy phép lái xe hạng C, BE;\n\nd) Người đủ 24 tuổi trở lên được cấp giấy phép lái xe hạng D1, D2, C1E, CE;\n\nđ) Người đủ 27 tuổi trở lên được cấp giấy phép lái xe hạng D, D1E, D2E, DE;\n\ne) Tuổi tối đa của người lái xe ô tô chở người (kể cả xe buýt) trên 29 chỗ (không kể chỗ của người lái xe), xe ô tô chở người giường nằm là đủ 57 tuổi đối với nam, đủ 55 tuổi đối với nữ.\n\n2. Người điều khiển phương tiện tham gia giao thông đường bộ phải bảo đảm điều kiện sức khỏe phù hợp với từng loại phương tiện được phép điều khiển. Bộ trưởng Bộ Y tế quy định về tiêu chuẩn sức khỏe, việc khám sức khỏe đối với người lái xe, người điều khiển xe máy chuyên dùng; việc khám sức khỏe định kỳ đối với người hành nghề lái xe ô tô; xây dựng cơ sở dữ liệu về sức khỏe của người lái xe, người điều khiển xe máy chuyên dùng.\n\n3. Bộ trưởng Bộ Quốc phòng, Bộ trưởng Bộ Công an quy định độ tuổi của người lái xe trong lực lượng quân đội, công an làm nhiệm vụ quốc phòng, an ninh.\n\nĐiều 60. Đào tạo lái xe\n\n1. Người có nhu cầu được cấp giấy phép lái xe phải được đào tạo nội dung lý thuyết và thực hành theo chương trình đào tạo quy định cho từng hạng giấy phép lái xe.\n\n2. Người học lái xe phải được đào tạo tại các cơ sở đào tạo lái xe hoặc các hình thức đào tạo lái xe khác để cấp mới hoặc nâng hạng giấy phép lái xe.\n\n3. Việc đào tạo để nâng hạng giấy phép lái xe thực hiện đối với những đối tượng sau đây:\n\na) Nâng hạng giấy phép lái xe từ hạng B lên hạng C1 hoặc lên hạng C hoặc lên hạng D1 hoặc lên hạng D2;\n\nb) Nâng hạng giấy phép lái xe từ hạng C1 lên hạng C hoặc lên hạng D1 hoặc lên hạng D2;\n\nc) Nâng hạng giấy phép lái xe từ hạng C lên hạng D1 hoặc lên hạng D2 hoặc lên hạng D;\n\nd) Nâng hạng giấy phép lái xe từ hạng D1 lên hạng D2 hoặc lên hạng D;\n\nđ) Nâng hạng giấy phép lái xe từ hạng D2 lên hạng D;\n\ne) Nâng hạng giấy phép lái xe từ hạng B lên hạng BE, từ hạng C1 lên\xa0 hạng C1E, từ hạng C lên hạng CE, từ hạng D1 lên hạng D1E, từ hạng D2 lên hạng D2E, từ hạng D lên hạng DE.\n\n4.\xa0Người có nhu cầu được đào tạo nâng hạng giấy phép lái xe khi giấy phép lái xe còn hiệu lực, phải có đủ thời gian lái xe an toàn quy định cho từng hạng giấy phép lái xe;\xa0đối với việc nâng hạng giấy phép lái xe lên hạng D1, D2, D thì người có nhu cầu được đào tạo còn phải có trình độ từ trung học cơ sở trở lên.\n\n5. Giấy phép lái xe các hạng C, D1, D2, D, BE, C1E, CE, D1E, D2E, DE phải được đào tạo bằng hình thức đào tạo nâng hạng theo các điều kiện quy định tại khoản 3 và khoản 4 Điều này.\n\n6. Cơ sở đào tạo lái xe ô tô phải đáp ứng các điều kiện do Chính phủ quy định; có giáo trình, giáo án; thực hiện đào tạo theo đúng hình thức, nội dung và chương trình quy định cho từng hạng giấy phép lái xe.\n\n7. Chính phủ quy định chi tiết các hình thức đào tạo lái xe khác quy định tại khoản 2 Điều này; quy định trình tự, thủ tục kiểm tra, đánh giá để cấp, cấp lại và thu hồi giấy phép xe tập lái; quy định tiêu chuẩn của giáo viên dạy lái xe; quy định việc cấp, cấp lại và thu hồi giấy chứng nhận giáo viên dạy lái xe; quy định việc cấp, cấp lại và thu hồi giấy phép đào tạo lái xe.\n\n8. Bộ trưởng Bộ Giao thông vận tải quy định hình thức, nội dung, chương trình đào tạo lái xe, thời gian lái xe an toàn cho từng hạng giấy phép lái xe quy định tại khoản 4 Điều này và quy định tiêu chuẩn của cơ sở đào tạo lái xe mô tô; đối với cơ sở đào tạo, tổ chức đào tạo lái xe cho lực lượng quân đội, công an làm nhiệm vụ quốc phòng, an ninh do Bộ trưởng Bộ Quốc phòng, Bộ trưởng Bộ Công an quy định.\n\nĐiều 61. Sát hạch lái xe\n\n1. Người đã hoàn thành chương trình đào tạo lái xe, có độ tuổi, sức khỏe theo quy định tại Điều 59 của Luật này được đăng ký để tham dự kỳ sát hạch lái xe.\n\n2. Nội dung sát hạch lái xe phải phù hợp với hạng giấy phép lái xe và chương trình đào tạo lái xe.\n\n3. Hoạt động sát hạch lái xe ô tô phải thực hiện tại các trung tâm sát hạch lái xe; hoạt động sát hạch lái xe mô tô thực hiện tại các trung tâm sát hạch lái xe hoặc tại sân tập lái đáp ứng điều kiện, tiêu chuẩn về cơ sở vật chất, kỹ thuật. Hoạt động sát hạch lái xe do cơ quan nhà nước có thẩm quyền thực hiện.', '8. Ủy ban nhân dân các cấp, trong phạm vi nhiệm vụ, quyền hạn của mình, thực hiện quản lý nhà nước về trật tự, an toàn giao thông đường bộ tại địa phương.\n\nChương IX\n\nĐIỀU KHOẢN THI HÀNH\n\nĐiều 88. Hiệu lực thi hành\n\n1. Luật này có hiệu lực thi hành từ ngày 01 tháng 01 năm 2025, trừ trường hợp quy định tại khoản 2 Điều này.\n\n2. Khoản 3 Điều 10 của Luật này có hiệu lực thi hành từ ngày 01 tháng 01 năm 2026.\n\n3. Luật Giao thông đường bộ số 23/2008/QH12 đã được sửa đổi, bổ sung một số điều theo Luật số 35/2018/QH14 và Luật số 44/2019/QH14 hết hiệu lực kể từ ngày Luật này có hiệu lực thi hành, trừ trường hợp quy định tại các khoản 1, 2, 5 và 6 Điều 89 của Luật này.\n\n4. Nghị quyết số 73/2022/QH15 của Quốc hội về thí điểm đấu giá biển số xe ô tô hết hiệu lực kể từ ngày Luật này có hiệu lực thi hành, trừ trường hợp quy định tại khoản 7 Điều 89 của Luật này.\n\nĐiều 89. Quy định chuyển tiếp\n\n1. Giấy phép lái xe được cấp trước ngày Luật này có hiệu lực thi hành được tiếp tục sử dụng theo thời hạn ghi trên giấy phép lái xe. \n\n2. Giấy phép lái xe được cấp trước ngày Luật này có hiệu lực thi hành nếu chưa thực hiện đổi, cấp lại theo quy định của Luật này có hiệu lực sử dụng như sau:\n\na) Giấy phép lái xe hạng A1 được tiếp tục điều khiển xe mô tô hai bánh có dung tích xi-lanh từ 50 cm3\xa0đến dưới 175 cm3 hoặc có công suất động cơ điện từ 04 kW đến dưới 14 kW;\n\nb) Giấy phép lái xe hạng A2 được tiếp tục điều khiển xe mô tô hai bánh có dung tích xi-lanh từ 175 cm3\xa0trở lên hoặc có công suất động cơ điện từ 14 kW trở lên và các loại xe quy định cho giấy phép lái xe hạng A1 quy định tại điểm a khoản này;\n\nc) Giấy phép lái xe hạng A3 được tiếp tục điều khiển xe mô tô ba bánh, các loại xe quy định cho giấy phép lái xe hạng A1 quy định tại điểm a khoản này và các xe tương tự;\n\nd) Giấy phép lái xe hạng A4 được tiếp tục điều khiển máy kéo có trọng tải đến 1.000 kg;\n\nđ) Giấy phép lái xe hạng B1 số tự động cấp cho người không hành nghề lái xe được tiếp tục điều khiển xe ô tô số tự động chở người đến 08 chỗ (không kể chỗ của người lái xe); xe ô tô tải, kể cả ô tô tải chuyên dùng số tự động có trọng tải dưới 3.500 kg;\n\ne) Giấy phép lái xe hạng B1 cấp cho người không hành nghề lái xe được tiếp tục điều khiển xe ô tô chở người đến 08 chỗ (không kể chỗ của người lái xe); xe ô tô tải, máy kéo có trọng tải dưới 3.500 kg;\n\ng) Giấy phép lái xe hạng B2 cấp cho người hành nghề lái xe được tiếp tục điều khiển xe ô tô chở người đến 08 chỗ (không kể chỗ của người lái xe); xe ô tô tải, máy kéo có trọng tải dưới 3.500 kg;\n\nh) Giấy phép lái xe hạng C được tiếp tục điều khiển xe ô tô tải, máy kéo có trọng tải từ 3.500 kg trở lên và các loại xe quy định cho các giấy phép lái xe hạng B1, B2 quy định tại các điểm đ, e và g khoản này;\n\ni) Giấy phép lái xe hạng D được tiếp tục điều khiển xe ô tô chở người từ 09 chỗ (không kể chỗ của người lái xe) đến 29 chỗ (không kể chỗ của người lái xe) và các loại xe quy định cho các giấy phép lái xe hạng B1, B2, C quy định tại các điểm đ, e, g và h khoản này;\n\nk) Giấy phép lái xe hạng E được tiếp tục điều khiển xe ô tô chở người trên 29 chỗ (không kể chỗ của người lái xe) và các loại xe quy định cho các giấy phép lái xe hạng B1, B2, C, D quy định tại các điểm đ, e, g, h và i khoản này;\n\nl) Giấy phép lái xe hạng FB2, FD được tiếp tục điều khiển các loại xe quy định cho giấy phép lái xe hạng B2, D quy định tại điểm g và điểm i khoản này khi kéo rơ moóc; giấy phép lái xe hạng FC được tiếp tục điều khiển các loại xe quy định cho giấy phép lái xe hạng C quy định tại điểm h khoản này khi kéo rơ moóc, đầu kéo kéo sơ mi rơ moóc; giấy phép lái xe hạng FE được tiếp tục điều khiển các loại xe quy định cho giấy phép lái xe hạng E quy định tại điểm k khoản này khi kéo rơ moóc\xa0hoặc xe ô tô chở khách nối toa.\n\n3. Trường hợp người có giấy phép lái xe đã được cấp trước ngày Luật này có hiệu lực thi hành có nhu cầu đổi, cấp lại giấy phép lái xe thì thực hiện như sau:\n\na) Giấy phép lái xe hạng A1 được đổi, cấp lại sang giấy phép lái xe hạng A với điều kiện hạn chế là chỉ được điều khiển xe mô tô hai bánh có dung tích xi-lanh đến dưới 175 cm3 hoặc có công suất động cơ điện đến dưới 14 kW;\n\nb) Giấy phép lái xe hạng A2 được đổi, cấp lại sang giấy phép lái xe hạng A;\n\nc) Giấy phép lái xe hạng A3 được đổi, cấp lại sang giấy phép lái xe hạng B1;\n\nd) Giấy phép lái xe hạng A4 được đổi, cấp lại sang chứng chỉ điều khiển xe máy chuyên dùng cho người điều khiển máy kéo có trọng tải đến 1.000 kg và chứng chỉ bồi dưỡng kiến thức pháp luật về giao thông đường bộ cho người điều khiển xe máy chuyên dùng;\n\nđ) Giấy phép lái xe hạng B1 số tự động được đổi, cấp lại sang giấy phép lái xe hạng B với điều kiện hạn chế là chỉ được điều khiển xe ô tô số tự động;\n\ne) Giấy phép lái xe hạng B1, B2 được đổi, cấp lại sang giấy phép lái xe hạng B hoặc hạng C1 và chứng chỉ điều khiển xe máy chuyên dùng cho người điều khiển máy kéo có trọng tải đến 3.500 kg;\n\ng) Giấy phép lái xe hạng C giữ nguyên và đổi, cấp lại cùng hạng và chứng chỉ điều khiển xe máy chuyên dùng cho người điều khiển máy kéo có trọng tải trên 3.500 kg;\n\nh) Giấy phép lái xe hạng D được đổi, cấp lại sang giấy phép lái xe hạng D2 và chứng chỉ điều khiển xe máy chuyên dùng cho người điều khiển máy kéo có trọng tải trên 3.500 kg;\n\ni) Giấy phép lái xe hạng E được đổi, cấp lại sang giấy phép lái xe hạng D và chứng chỉ điều khiển xe máy chuyên dùng cho người điều khiển máy kéo có trọng tải trên 3.500 kg;\n\nk) Giấy phép lái xe hạng FB2 được đổi, cấp lại sang giấy phép lái xe hạng BE hoặc hạng C1E và chứng chỉ điều khiển xe máy chuyên dùng cho người điều khiển máy kéo có trọng tải đến 3.500 kg;\n\nl) Giấy phép lái xe hạng FC được đổi, cấp lại sang giấy phép lái xe hạng CE và chứng chỉ điều khiển xe máy chuyên dùng cho người điều khiển máy kéo có trọng tải trên 3.500 kg;\n\nm) Giấy phép lái xe hạng FD được đổi, cấp lại sang giấy phép lái xe hạng D2E và chứng chỉ điều khiển xe máy chuyên dùng cho người điều khiển máy kéo có trọng tải trên 3.500 kg;\n\nn) Giấy phép lái xe hạng FE được đổi, cấp lại sang giấy phép lái xe hạng DE và chứng chỉ điều khiển xe máy chuyên dùng cho người điều khiển máy kéo có trọng tải trên 3.500 kg.\n\n4. Người học lái xe đã được đào tạo lái xe trước ngày Luật này có hiệu lực thi hành hoặc đang được đào tạo lái xe tại ngày Luật này có hiệu lực thi hành chưa được sát hạch, cấp giấy phép lái xe thì được sát hạch, cấp giấy phép lái xe theo hạng giấy phép lái xe đổi, cấp lại quy định tại khoản 3 Điều này.\n\n5. Chứng nhận đăng ký xe, biển số xe máy chuyên dùng cấp trước ngày Luật này có hiệu lực thi hành vẫn có giá trị sử dụng.\n\n6. Chứng nhận chất lượng an toàn kỹ thuật và bảo vệ môi trường được cấp trước ngày Luật này có hiệu lực thi hành thì có giá trị sử dụng đến hết thời hạn ghi trên giấy chứng nhận đó.\n\n7. Việc đấu giá biển số xe ô tô được thực hiện trước ngày Luật này có hiệu lực thi hành và đến ngày Luật này có hiệu lực thi hành đã được cấp văn bản xác nhận biển số xe ô tô trúng đấu giá thì tiếp tục thực hiện theo Nghị quyết số 73/2022/QH15 của Quốc hội về thí điểm đấu giá biển số xe ô tô; trường hợp chưa được cấp xác nhận biển số xe ô tô trúng đấu giá thì tiếp tục thực hiện theo Nghị quyết số 73/2022/QH15 của Quốc hội về thí điểm đấu giá biển số xe ô tô và quy định tại điểm d khoản 1 Điều 38 của Luật này./.\n\nLuật này được Quốc hội nước Cộng hòa xã hội chủ nghĩa Việt Nam khóa XV, kỳ họp thứ 7 thông qua ngày 27 tháng 6 năm 2024.\n\nE-pas: 60179 CHỦ TỊCH QUỐC HỘI\n\n\n\n\nTrần Thanh Mẫn']","**Nguồn văn bản:** /content/drive/MyDrive/ITProject_data/new_law/36_2024_QH15_444251.docx

**Tên văn bản:** Không có tiêu đề trong context

**Điều 57:** Giấy phép lái xe

**Nội dung:**

5. Thời hạn của giấy phép lái xe được quy định như sau:

    a) Giấy phép lái xe các hạng A1, A, B1 không thời hạn.

    b) Giấy phép lái xe hạng B và hạng C1 có thời hạn 10 năm kể từ ngày cấp.

    c) Giấy phép lái xe các hạng C, D1, D2, D, BE, C1E, CE, D1E, D2E và DE có thời hạn 05 năm kể từ ngày cấp.


Tóm lại: Giấy phép lái xe hạng B có thời hạn 10 năm kể từ ngày cấp.
",Giấy phép lái xe hạng B có thời hạn 10 năm kể từ ngày cấp.,1.0,0.8427394436164227,1.0,0.9999999999
3,Giấy phép lái xe hạng C1 có thời hạn bao lâu?,"['a) Chứng nhận đăng ký xe hoặc bản sao Chứng nhận đăng ký xe có chứng thực kèm bản gốc giấy tờ xác nhận của tổ chức tín dụng, chi nhánh ngân hàng nước ngoài còn hiệu lực trong trường hợp xe đang được thế chấp tại tổ chức tín dụng, chi nhánh ngân hàng nước ngoài;\n\nb) Giấy phép lái xe phù hợp với loại xe đang điều khiển;\n\nc) Chứng nhận kiểm định an toàn kỹ thuật và bảo vệ môi trường đối với xe cơ giới theo quy định của pháp luật;\n\nd) Chứng nhận bảo hiểm bắt buộc trách nhiệm dân sự của chủ xe cơ giới.\n\n2. Người điều khiển xe máy chuyên dùng tham gia giao thông đường bộ phải đủ tuổi, sức khỏe theo quy định của pháp luật; có bằng hoặc chứng chỉ điều khiển xe máy chuyên dùng phù hợp loại xe máy chuyên dùng đang điều khiển; có giấy phép lái xe đang còn điểm, còn hiệu lực hoặc chứng chỉ bồi dưỡng kiến thức pháp luật về giao thông đường bộ. Khi tham gia giao thông đường bộ, người điều khiển xe máy chuyên dùng phải mang theo các loại giấy tờ sau đây:\n\na) Chứng nhận đăng ký xe hoặc bản sao Chứng nhận đăng ký xe có chứng thực kèm bản gốc Giấy biên nhận còn hiệu lực của tổ chức tín dụng, chi nhánh ngân hàng nước ngoài trong trường hợp xe đang được thế chấp tại tổ chức tín dụng, chi nhánh ngân hàng nước ngoài;\n\nb) Bằng hoặc chứng chỉ điều khiển xe máy chuyên dùng;\n\nc) Giấy phép lái xe hoặc chứng chỉ bồi dưỡng kiến thức pháp luật về giao thông đường bộ;\n\nd) Chứng nhận kiểm định an toàn kỹ thuật và bảo vệ môi trường đối với xe máy chuyên dùng theo quy định của pháp luật;\n\nđ) Chứng nhận bảo hiểm bắt buộc trách nhiệm dân sự theo quy định của pháp luật.\n\n3. Trường hợp giấy tờ quy định tại khoản 1 và khoản 2 Điều này đã được tích hợp vào tài khoản định danh điện tử thì việc xuất trình, kiểm tra có thể thực hiện thông qua tài khoản định danh điện tử.\n\n4. Người lái xe gắn máy tham gia giao thông đường bộ phải hiểu biết quy tắc giao thông đường bộ, có kỹ năng điều khiển phương tiện; đủ điều kiện về độ tuổi, sức khỏe theo quy định tại điểm a khoản 1 và khoản 2 Điều 59 của Luật này.\n\n5. Người tập lái xe ô tô, người dự sát hạch lái xe ô tô khi tham gia giao thông đường bộ phải thực hành trên xe tập lái, xe sát hạch trên tuyến đường tập lái, tuyến đường sát hạch, có giáo viên dạy lái hoặc sát hạch viên bảo trợ tay lái. Giáo viên dạy lái, sát hạch viên phải mang theo các loại giấy tờ quy định tại khoản 1 Điều này.\n\nĐiều 57. Giấy phép lái xe\n\n1. Giấy phép lái xe bao gồm các hạng sau đây:\n\na) Hạng A1 cấp cho người lái xe mô tô hai bánh có dung tích xi-lanh đến 125 cm3 hoặc có công suất động cơ điện đến 11 kW;\n\nb) Hạng A cấp cho người lái xe mô tô hai bánh có dung tích xi-lanh\xa0 trên 125 cm3\xa0hoặc có công suất động cơ điện trên 11 kW và các loại xe quy định cho giấy phép lái xe hạng A1;\n\nc) Hạng B1 cấp cho người lái xe mô tô ba bánh và các loại xe quy định cho giấy phép lái xe hạng A1;\n\nd) Hạng B cấp cho người lái xe ô tô chở người đến 08 chỗ (không kể chỗ của người lái xe); xe ô tô tải và ô tô chuyên dùng có khối lượng toàn bộ theo thiết kế đến 3.500 kg; các loại xe ô tô quy định cho giấy phép lái xe hạng B kéo rơ moóc có khối lượng toàn bộ theo thiết kế đến 750 kg; \n\nđ) Hạng C1 cấp cho người lái xe ô tô tải và ô tô chuyên dùng có khối lượng toàn bộ theo thiết kế trên 3.500 kg đến 7.500 kg; các loại xe ô tô tải quy định cho giấy phép lái xe hạng C1 kéo rơ moóc có khối lượng toàn bộ theo thiết kế đến 750 kg; các loại xe quy định cho giấy phép lái xe hạng B;\n\ne) Hạng C cấp cho người lái xe ô tô tải và ô tô chuyên dùng có khối lượng toàn bộ theo thiết kế trên 7.500 kg; các loại xe ô tô tải quy định cho giấy phép lái xe hạng C kéo rơ moóc có khối lượng toàn bộ theo thiết kế đến 750 kg; các loại xe quy định cho giấy phép lái xe hạng B và hạng C1;\n\ng) Hạng D1 cấp cho người lái xe ô tô chở người trên 08 chỗ (không kể chỗ của người lái xe) đến 16 chỗ (không kể chỗ của người lái xe); các loại xe ô tô chở người quy định cho giấy phép lái xe hạng D1 kéo rơ moóc có khối lượng toàn bộ theo thiết kế đến 750 kg; các loại xe quy định cho giấy phép lái xe các hạng B, C1, C;\n\nh) Hạng D2 cấp cho người lái xe ô tô chở người (kể cả xe buýt) trên 16 chỗ (không kể chỗ của người lái xe) đến 29 chỗ (không kể chỗ của người lái xe); các loại xe ô tô chở người quy định cho giấy phép lái xe hạng D2 kéo rơ moóc có khối lượng toàn bộ theo thiết kế đến 750 kg; các loại xe quy định cho giấy phép lái xe các hạng B, C1, C, D1;\n\ni) Hạng D cấp cho người lái xe ô tô chở người (kể cả xe buýt) trên 29 chỗ (không kể chỗ của người lái xe); xe ô tô chở người giường nằm; các loại xe ô tô chở người quy định cho giấy phép lái xe hạng D kéo rơ moóc có khối lượng toàn bộ theo thiết kế đến 750 kg; các loại xe quy định cho giấy phép lái xe các hạng B, C1, C, D1, D2;\n\nk) Hạng BE cấp cho người lái các loại xe ô tô quy định cho giấy phép lái xe hạng B kéo rơ moóc có khối lượng toàn bộ theo thiết kế trên 750 kg;\n\nl) Hạng C1E cấp cho người lái các loại xe ô tô quy định cho giấy phép lái xe hạng C1 kéo rơ moóc có khối lượng toàn bộ theo thiết kế trên 750 kg;\n\nm) Hạng CE cấp cho người lái các loại xe ô tô quy định cho giấy phép lái xe hạng C kéo rơ moóc có khối lượng toàn bộ theo thiết kế trên 750 kg; xe ô tô đầu kéo kéo sơ mi rơ moóc;\n\nn) Hạng D1E cấp cho người lái các loại xe ô tô quy định cho giấy phép lái xe hạng D1 kéo rơ moóc có khối lượng toàn bộ theo thiết kế trên 750 kg;\n\no) Hạng D2E cấp cho người lái các loại xe ô tô quy định cho giấy phép lái xe hạng D2 kéo rơ moóc có khối lượng toàn bộ theo thiết kế trên 750 kg;\n\np) Hạng DE cấp cho người lái các loại xe ô tô quy định cho giấy phép lái xe hạng D kéo rơ moóc có khối lượng toàn bộ theo thiết kế trên 750 kg; xe ô tô chở khách nối toa.\n\n2. Người khuyết tật điều khiển xe mô tô ba bánh dùng cho người khuyết tật được cấp giấy phép lái xe hạng A1.\n\nNgười khuyết tật điều khiển xe ô tô số tự động có kết cấu phù hợp với tình trạng khuyết tật thì được cấp giấy phép lái xe hạng B.\n\n3. Người điều khiển xe chở hàng bốn bánh có gắn động cơ, xe chở người bốn bánh có gắn động cơ phải sử dụng giấy phép lái xe có hạng phù hợp với xe ô tô tải hoặc xe ô tô chở người tương ứng.\n\n4. Người điều khiển xe ô tô có thiết kế, cải tạo với số chỗ ít hơn xe cùng loại, kích thước giới hạn tương đương phải sử dụng giấy phép lái xe có hạng phù hợp với xe ô tô cùng loại, kích thước giới hạn tương đương và có số chỗ nhiều nhất.\n\n5. Thời hạn của giấy phép lái xe được quy định như sau:\n\na) Giấy phép lái xe các hạng A1, A, B1 không thời hạn;\n\nb) Giấy phép lái xe hạng B và hạng C1 có thời hạn 10 năm kể từ ngày cấp;\n\nc) Giấy phép lái xe các hạng C, D1, D2, D, BE, C1E, CE, D1E, D2E và DE có thời hạn 05 năm kể từ ngày cấp.\n\n6. Giấy phép lái xe có giá trị sử dụng trong phạm vi lãnh thổ Việt Nam bao gồm:\n\na) Giấy phép lái xe do cơ quan có thẩm quyền của Việt Nam cấp;\n\nb) Giấy phép lái xe quốc tế và giấy phép lái xe quốc gia phù hợp với loại xe được phép điều khiển do quốc gia là thành viên của Công ước của Liên hợp quốc về Giao thông đường bộ năm 1968 (sau đây gọi là Công ước Viên) cấp;\n\nc) Giấy phép lái xe phù hợp với loại xe được phép điều khiển của nước hoặc vùng lãnh thổ mà Việt Nam ký kết điều ước quốc tế hoặc thỏa thuận quốc tế công nhận giấy phép lái xe của nhau;\n\nd) Giấy phép lái xe nước ngoài phù hợp với loại xe được phép điều khiển do quốc gia được công nhận theo điều ước quốc tế mà nước Cộng hòa xã hội chủ nghĩa Việt Nam là thành viên.\n\n7. Giấy phép lái xe không có hiệu lực trong các trường hợp sau đây:\n\na) Giấy phép lái xe hết thời hạn sử dụng;\n\nb) Giấy phép lái xe bị thu hồi theo quy định tại khoản 5 Điều 62 của Luật này.\n\n8. Giấy phép lái xe quốc tế được quy định như sau:\n\na) Giấy phép lái xe quốc tế là giấy phép lái xe do cơ quan nhà nước có thẩm quyền của quốc gia là thành viên của Công ước Viên cấp theo một mẫu thống nhất; có thời hạn không quá 03 năm kể từ ngày cấp và phải phù hợp với thời hạn còn hiệu lực của giấy phép lái xe quốc gia;', 'a) Giấy phép lái xe hết thời hạn sử dụng;\n\nb) Giấy phép lái xe bị thu hồi theo quy định tại khoản 5 Điều 62 của Luật này.\n\n8. Giấy phép lái xe quốc tế được quy định như sau:\n\na) Giấy phép lái xe quốc tế là giấy phép lái xe do cơ quan nhà nước có thẩm quyền của quốc gia là thành viên của Công ước Viên cấp theo một mẫu thống nhất; có thời hạn không quá 03 năm kể từ ngày cấp và phải phù hợp với thời hạn còn hiệu lực của giấy phép lái xe quốc gia;\n\nb) Người có giấy phép lái xe quốc tế do quốc gia là thành viên của Công ước Viên cấp khi lái xe tham gia giao thông đường bộ trên lãnh thổ Việt Nam phải mang theo giấy phép lái xe quốc tế và giấy phép lái xe quốc gia được cấp phù hợp với hạng xe điều khiển, còn thời hạn sử dụng; phải tuân thủ pháp luật về trật tự, an toàn giao thông đường bộ của Việt Nam;\n\nc) Người có giấy phép lái xe quốc tế vi phạm pháp luật về trật tự, an toàn giao thông đường bộ của Việt Nam mà bị tước quyền sử dụng giấy phép lái xe có thời hạn thì thời gian bị tước quyền sử dụng không quá thời gian người lái xe được phép cư trú tại lãnh thổ Việt Nam;\n\nd) Người Việt Nam hoặc người nước ngoài có thẻ thường trú hoặc thẻ tạm trú tại Việt Nam có giấy phép lái xe do Việt Nam hoặc quốc gia là thành viên của điều ước quốc tế mà nước Cộng hòa xã hội chủ nghĩa Việt Nam là thành viên cấp, còn giá trị sử dụng, nếu có nhu cầu được cấp giấy phép lái xe quốc tế.\n\n9. Bộ trưởng Bộ Giao thông vận tải quy định mẫu giấy phép lái xe và giấy phép lái xe quốc tế, trình tự, thủ tục cấp và việc sử dụng giấy phép lái xe, giấy phép lái xe quốc tế; đối với mẫu giấy phép lái xe, trình tự, thủ tục cấp và việc sử dụng giấy phép lái xe của lực lượng quân đội, công an làm nhiệm vụ quốc phòng, an ninh do Bộ trưởng Bộ Quốc phòng, Bộ trưởng Bộ Công an quy định.\n\nĐiều 58. Điểm của giấy phép lái xe \n\n1. Điểm của giấy phép lái xe được dùng để quản lý việc chấp hành pháp luật về trật tự, an toàn giao thông đường bộ của người lái xe trên hệ thống cơ sở dữ liệu về trật tự, an toàn giao thông đường bộ, bao gồm 12 điểm. Số điểm trừ mỗi lần vi phạm tùy thuộc tính chất, mức độ của hành vi vi phạm pháp luật về trật tự, an toàn giao thông đường bộ. Dữ liệu về điểm trừ giấy phép lái xe của người vi phạm sẽ được cập nhật vào hệ thống cơ sở dữ liệu ngay sau khi quyết định xử phạt có hiệu lực thi hành và thông báo cho người bị trừ điểm giấy phép lái xe biết.\n\n2. Giấy phép lái xe chưa bị trừ hết điểm và không bị trừ điểm trong thời hạn 12 tháng từ ngày bị trừ điểm gần nhất thì được phục hồi đủ 12 điểm.\n\n3. Trường hợp giấy phép lái xe bị trừ hết điểm thì người có giấy phép lái xe không được điều khiển phương tiện tham gia giao thông đường bộ theo giấy phép lái xe đó. Sau thời hạn ít nhất là 06 tháng kể từ ngày bị trừ hết điểm, người có giấy phép lái xe được tham gia kiểm tra nội dung kiến thức pháp luật về trật tự, an toàn giao thông đường bộ theo quy định tại khoản 7 Điều 61 của Luật này do lực lượng Cảnh sát giao thông tổ chức, có kết quả đạt yêu cầu thì được phục hồi đủ 12 điểm.\n\n4. Giấy phép lái xe sau khi đổi, cấp lại, nâng hạng được giữ nguyên số điểm của giấy phép lái xe trước khi đổi, cấp lại, nâng hạng.\n\n5. Người có thẩm quyền xử phạt vi phạm hành chính có thẩm quyền trừ điểm giấy phép lái xe.\n\n6. Chính phủ quy định chi tiết khoản 1 Điều này; quy định trình tự, thủ tục, thẩm quyền trừ điểm, phục hồi điểm giấy phép lái xe; quy định lộ trình thực hiện Điều này. Bộ trưởng Bộ Công an quy định chi tiết khoản 3 Điều này.\n\nĐiều 59. Tuổi, sức khỏe của người điều khiển phương tiện tham gia giao thông đường bộ\n\n1. Độ tuổi của người lái xe, người điều khiển xe máy chuyên dùng được quy định như sau:\n\na) Người đủ 16 tuổi trở lên được điều khiển xe gắn máy;\n\nb) Người đủ 18 tuổi trở lên được cấp giấy phép lái xe hạng A1, A, B1, B, C1, được cấp chứng chỉ bồi dưỡng kiến thức pháp luật về giao thông đường bộ để điều khiển xe máy chuyên dùng tham gia giao thông đường bộ;\n\nc) Người đủ 21 tuổi trở lên được cấp giấy phép lái xe hạng C, BE;\n\nd) Người đủ 24 tuổi trở lên được cấp giấy phép lái xe hạng D1, D2, C1E, CE;\n\nđ) Người đủ 27 tuổi trở lên được cấp giấy phép lái xe hạng D, D1E, D2E, DE;\n\ne) Tuổi tối đa của người lái xe ô tô chở người (kể cả xe buýt) trên 29 chỗ (không kể chỗ của người lái xe), xe ô tô chở người giường nằm là đủ 57 tuổi đối với nam, đủ 55 tuổi đối với nữ.\n\n2. Người điều khiển phương tiện tham gia giao thông đường bộ phải bảo đảm điều kiện sức khỏe phù hợp với từng loại phương tiện được phép điều khiển. Bộ trưởng Bộ Y tế quy định về tiêu chuẩn sức khỏe, việc khám sức khỏe đối với người lái xe, người điều khiển xe máy chuyên dùng; việc khám sức khỏe định kỳ đối với người hành nghề lái xe ô tô; xây dựng cơ sở dữ liệu về sức khỏe của người lái xe, người điều khiển xe máy chuyên dùng.\n\n3. Bộ trưởng Bộ Quốc phòng, Bộ trưởng Bộ Công an quy định độ tuổi của người lái xe trong lực lượng quân đội, công an làm nhiệm vụ quốc phòng, an ninh.\n\nĐiều 60. Đào tạo lái xe\n\n1. Người có nhu cầu được cấp giấy phép lái xe phải được đào tạo nội dung lý thuyết và thực hành theo chương trình đào tạo quy định cho từng hạng giấy phép lái xe.\n\n2. Người học lái xe phải được đào tạo tại các cơ sở đào tạo lái xe hoặc các hình thức đào tạo lái xe khác để cấp mới hoặc nâng hạng giấy phép lái xe.\n\n3. Việc đào tạo để nâng hạng giấy phép lái xe thực hiện đối với những đối tượng sau đây:\n\na) Nâng hạng giấy phép lái xe từ hạng B lên hạng C1 hoặc lên hạng C hoặc lên hạng D1 hoặc lên hạng D2;\n\nb) Nâng hạng giấy phép lái xe từ hạng C1 lên hạng C hoặc lên hạng D1 hoặc lên hạng D2;\n\nc) Nâng hạng giấy phép lái xe từ hạng C lên hạng D1 hoặc lên hạng D2 hoặc lên hạng D;\n\nd) Nâng hạng giấy phép lái xe từ hạng D1 lên hạng D2 hoặc lên hạng D;\n\nđ) Nâng hạng giấy phép lái xe từ hạng D2 lên hạng D;\n\ne) Nâng hạng giấy phép lái xe từ hạng B lên hạng BE, từ hạng C1 lên\xa0 hạng C1E, từ hạng C lên hạng CE, từ hạng D1 lên hạng D1E, từ hạng D2 lên hạng D2E, từ hạng D lên hạng DE.\n\n4.\xa0Người có nhu cầu được đào tạo nâng hạng giấy phép lái xe khi giấy phép lái xe còn hiệu lực, phải có đủ thời gian lái xe an toàn quy định cho từng hạng giấy phép lái xe;\xa0đối với việc nâng hạng giấy phép lái xe lên hạng D1, D2, D thì người có nhu cầu được đào tạo còn phải có trình độ từ trung học cơ sở trở lên.\n\n5. Giấy phép lái xe các hạng C, D1, D2, D, BE, C1E, CE, D1E, D2E, DE phải được đào tạo bằng hình thức đào tạo nâng hạng theo các điều kiện quy định tại khoản 3 và khoản 4 Điều này.\n\n6. Cơ sở đào tạo lái xe ô tô phải đáp ứng các điều kiện do Chính phủ quy định; có giáo trình, giáo án; thực hiện đào tạo theo đúng hình thức, nội dung và chương trình quy định cho từng hạng giấy phép lái xe.\n\n7. Chính phủ quy định chi tiết các hình thức đào tạo lái xe khác quy định tại khoản 2 Điều này; quy định trình tự, thủ tục kiểm tra, đánh giá để cấp, cấp lại và thu hồi giấy phép xe tập lái; quy định tiêu chuẩn của giáo viên dạy lái xe; quy định việc cấp, cấp lại và thu hồi giấy chứng nhận giáo viên dạy lái xe; quy định việc cấp, cấp lại và thu hồi giấy phép đào tạo lái xe.\n\n8. Bộ trưởng Bộ Giao thông vận tải quy định hình thức, nội dung, chương trình đào tạo lái xe, thời gian lái xe an toàn cho từng hạng giấy phép lái xe quy định tại khoản 4 Điều này và quy định tiêu chuẩn của cơ sở đào tạo lái xe mô tô; đối với cơ sở đào tạo, tổ chức đào tạo lái xe cho lực lượng quân đội, công an làm nhiệm vụ quốc phòng, an ninh do Bộ trưởng Bộ Quốc phòng, Bộ trưởng Bộ Công an quy định.\n\nĐiều 61. Sát hạch lái xe\n\n1. Người đã hoàn thành chương trình đào tạo lái xe, có độ tuổi, sức khỏe theo quy định tại Điều 59 của Luật này được đăng ký để tham dự kỳ sát hạch lái xe.\n\n2. Nội dung sát hạch lái xe phải phù hợp với hạng giấy phép lái xe và chương trình đào tạo lái xe.\n\n3. Hoạt động sát hạch lái xe ô tô phải thực hiện tại các trung tâm sát hạch lái xe; hoạt động sát hạch lái xe mô tô thực hiện tại các trung tâm sát hạch lái xe hoặc tại sân tập lái đáp ứng điều kiện, tiêu chuẩn về cơ sở vật chất, kỹ thuật. Hoạt động sát hạch lái xe do cơ quan nhà nước có thẩm quyền thực hiện.', 'khí, khí tài quân sự dạng rơ moóc có khối lượng toàn bộ theo thiết kế đến 750 kg; các loại xe quy định cho Giấy phép lái xe quân sự hạng B, C1, C, D1;\n\ni) Hạng D cấp cho người điều khiển xe ô tô chở người từ trên 29 chỗ (không kể chỗ của người lái xe); các loại xe ô tô chở người quy định cho Giấy phép lái xe hạng D kéo rơ moóc hoặc vũ khí, khí tài quân sự dạng rơ moóc có khối lượng toàn bộ theo thiết kế đến 750 kg; các loại xe quy định cho Giấy phép lái xe quân sự hạng B, C1, C, D1, D2;\n\nk) Hạng C1E cấp cho người điều khiển các loại xe ô tô quy định cho Giấy phép lái xe hạng C1 kéo rơ moóc hoặc vũ khí, khí tài quân sự dạng rơ moóc có khối lượng toàn bộ theo thiết kế trên 750 kg;\n\nl) Hạng CE cấp cho người điều khiển các loại xe ô tô quy định cho Giấy phép lái xe hạng C kéo rơ moóc hoặc vũ khí, khí tài quân sự dạng rơ moóc có khối lượng toàn bộ theo thiết kế trên 750 kg; xe ô tô đầu kéo kéo sơ mi rơ moóc hoặc khí tài quân sự dạng sơ mi rơ moóc;\n\nm) Hạng CX cấp cho người đã có Giấy phép lái xe quân sự hạng C để điều khiển xe xích kéo vũ khí, khí tài quân sự.\n\n2. Người điều khiển xe chở hàng bốn bánh có gắn động cơ, xe chở người bốn bánh có gắn động cơ phải sử dụng giấy phép lái xe có hạng phù hợp với xe ô tô tải và ô tô chở người tương ứng.\n\n3. Người điều khiển xe ô tô có thiết kế, cải tạo với số chỗ ngồi ít hơn ô tô cùng loại, kích thước giới hạn tương đương phải sử dụng giấy phép lái xe có hạng phù hợp với ô tô cùng loại, kích thước giới hạn tương đương và có số chỗ ngồi nhiều nhất.\n\nĐiều 6. Mẫu và thời hạn Giấy phép lái xe quân sự\n\n1. Mẫu Giấy phép lái xe quân sự\n\na) Giấy phép lái xe quân sự thực hiện theo quy định tại Mẫu số 08 kèm theo Thông tư này;\n\nb) Cục trưởng Cục Xe máy - Vận tải/Tổng cục Hậu cần - Kỹ thuật có trách nhiệm quản lý việc sử dụng Giấy phép lái xe quân sự thuộc phạm vi quản lý của Bộ Quốc phòng.\n\n2. Thời hạn sử dụng Giấy phép lái xe quân sự\n\na) Giấy phép lái xe quân sự hạng A1, A, B1 là không thời hạn;\n\nb) Giấy phép lái xe quân sự các hạng B, C1, C, D1, D2, D, C1E, CE, CX có thời hạn 05 năm kể từ ngày cấp;\n\nc) Trường hợp cấp, đổi do lý do khác thời hạn theo thời hạn ghi trên Giấy phép lái xe quân sự.\n\n3. Giấy phép lái xe quân sự không có hiệu lực trong các trường hợp sau:\n\na) Giấy phép lái xe quân sự hết thời hạn sử dụng được ghi trên Giấy phép lái xe;\n\nb) Giấy phép lái xe quân sự bị trừ hết điểm theo quy định tại Điều 7 của Thông tư này;\n\nc) Giấy phép lái xe quân sự có Quyết định thu hồi theo khoản 1 Điều 47 Thông tư này.\n\nĐiều 7. Điểm của Giấy phép lái xe quân sự\n\n1. Điểm của Giấy phép lái xe quân sự gồm 12 điểm theo quy định của Luật Trật tự, an toàn giao thông đường bộ, được dùng để quản lý việc chấp hành pháp luật về trật tự, an toàn giao thông đường bộ của người lái xe. Số điểm trừ mỗi lần tùy theo tính chất, mức độ vi phạm theo quy định của pháp luật. Giấy phép lái xe chưa bị trừ hết điểm và không bị trừ điểm trong thời hạn 12 tháng kể từ ngày bị trừ điểm gần nhất thì được phục hồi đủ 12 điểm.\n\n2. Trường hợp Giấy phép lái xe quân sự bị trừ hết điểm, sau thời hạn ít nhất 06 tháng kể từ ngày bị trừ hết điểm, người có Giấy phép lái xe quân sự bị trừ hết điểm được tham gia kiểm tra kiến thức pháp luật về giao thông đường bộ tổ chức tại cơ sở đào tạo lái xe quân sự theo quy định tại điểm a khoản 1 Điều 40 và khoản 1 Điều 41 Thông tư này, nếu kết quả đặt yêu cầu được phục hồi đủ 12 điểm.\n\n3. Điểm của Giấy phép lái xe quân sự đổi, cấp lại, đào tạo nâng hạng được giữ nguyên như trước khi đổi, cấp lại, đào tạo nâng hạng.\n\nĐiều 8. Độ tuổi của người được cấp Giấy phép lái xe quân sự\n\n1. Quân nhân, công chức quốc phòng, công nhân viên chức quốc phòng, lao động hợp đồng đang phục vụ trong Bộ Quốc phòng đủ 18 tuổi trở lên được cấp Giấy phép lái xe quân sự hạng A1, A, B1, B, C1, C.\n\n2. Quân nhân, công chức quốc phòng, công nhân viên chức quốc phòng, lao động hợp đồng đang phục vụ trong Bộ Quốc phòng đủ 24 tuổi trở lên được cấp Giấy phép lái xe quân sự hạng D1, D2, C1E, CE, CX.\n\nCác trường hợp đào tạo chuyển tiếp từ hạng C lên hạng CE hoặc CX theo chỉ tiêu của Bộ Tổng Tham mưu, đủ 19 tuổi trở lên.\n\n3. Quân nhân, công chức quốc phòng, công nhân viên chức quốc phòng, lao động hợp đồng đang phục vụ trong Bộ Quốc phòng đủ 27 tuổi trở lên được cấp Giấy phép lái xe quân sự hạng D. Độ tuổi tối đa của người được cấp Giấy phép lái xe quân sự hạng D là đủ 57 tuổi đối với nam và đủ 55 tuổi đối với nữ.\n\nChương II\n\nĐÀO TẠO LÁI XE QUÂN SỰ\n\nMục I. NGƯỜI HỌC\n\nĐiều 9. Điều kiện đối với người học lái xe quân sự\n\n1. Quân nhân, công chức quốc phòng, công nhân viên chức quốc phòng, lao động hợp đồng đang phục vụ trong Bộ Quốc phòng có đủ các điều kiện: Tiêu chuẩn về tuổi đời, thời gian công tác, sức khỏe, trình độ văn hóa, phẩm chất chính trị theo quy định của Bộ Quốc phòng.\n\nĐối với lao động hợp đồng: Chỉ đào tạo nâng hạng khi có đủ điều kiện, tiêu chuẩn quy định tại khoản 1 Điều này.\n\n2. Đối với người học nâng hạng Giấy phép lái xe quân sự phải có thời gian lái xe và số km lái xe an toàn như sau:\n\na) Từ hạng B lên hạng C1; hạng C1 lên hạng C, C1E; hạng C lên hạng D1, CE, CX; hạng D1 lên hạng D2; hạng D2 lên hạng D: Có thời gian lái xe 02 năm trở lên và 30.000 km lái xe an toàn trở lên (trừ các trường hợp đào tạo chuyển tiếp từ hạng C lên hạng CE hoặc CX theo chỉ tiêu của Bộ Tổng Tham mưu);\n\nb) Từ hạng B lên hạng C, D1; hạng C1 lên D1; hạng C lên hạng D2; hạng D1 lên hạng D: Có thời gian lái xe 03 năm trở lên và có 50.000 km lái xe an toàn trở lên;\n\nc) Từ hạng B lên hạng D2, từ hạng C1 lên hạng D2, từ hạng C lên hạng D: Có thời gian lái xe 05 năm trở lên và 100.000 km lái xe an toàn trở lên.\n\n3. Đối với người học nâng hạng Giấy phép lái xe quân sự lên hạng D1, D2, D ngoài các quy định tại các khoản 1, 2 Điều này phải có bằng tốt nghiệp trung học cơ sở trở lên.\n\nĐiều 10. Hồ sơ đào tạo lái xe\n\n1. Hạng A1, A, gồm:\n\na) Kế hoạch huấn luyện lái xe mô tô quân sự hạng A1, A (kèm theo danh sách học viên) của cơ quan, đơn vị theo quy định tại Mẫu số 13 Phụ lục I kèm theo Thông tư này;\n\nb) Đơn đề nghị học và sát hạch, cấp Giấy phép lái xe quân sự của cá nhân có xác nhận của Thủ trưởng cơ quan, đơn vị trực tiếp quản lý từ cấp trung đoàn hoặc tương đương trở lên theo quy định tại Mẫu số 01 Phụ lục I kèm theo Thông tư này;\n\nc) Bản sao Căn cước công dân (căn cước) và bản sao một trong các loại giấy tờ sau: Giấy chứng minh quân nhân, công chức quốc phòng, công nhân và viên chức quốc phòng, quyết định nhập ngũ, tuyển dụng, phiếu quân nhân, thẻ học viên, quyết định thăng, phong quân hàm, nâng lương gần nhất còn hiệu lực;\n\nd) Giấy chứng nhận sức khỏe theo quy định do quân y cấp trung đoàn và tương đương trở lên xác nhận theo quy định tại Mẫu số 02 Phụ lục I kèm theo Thông tư này;\n\nđ) Hai ảnh màu cỡ 2 x 3 cm (ảnh chụp trên nền màu xanh; quân nhân mặc quân phục thường dùng; công chức quốc phòng, công nhân và viên chức quốc phòng, lao động hợp đồng mặc đồng phục; đeo biển tên theo quy định, không đội mũ).\n\n2. Hạng B1, B, C1, C, gồm:\n\na) Kế hoạch đào tạo lái xe quân sự hạng B1, B, C1, C (kèm theo danh sách học viên) của cơ sở đào tạo;\n\nb) Bản sao quyết định giao chỉ tiêu đào tạo nhân viên kỹ thuật sơ cấp của Tổng Tham mưu trưởng đối với trường hợp đào tạo theo chỉ tiêu nhiệm vụ; văn bản đề nghị đào tạo lái xe của Thủ trưởng cơ quan, đơn vị đầu mối trực thuộc Bộ Quốc phòng đối với trường hợp gửi đào tạo;\n\nc) Hồ sơ quy định tại các điểm b, c, d, đ khoản 1 Điều này;\n\n3. Đào tạo nâng hạng Giấy phép lái xe quân sự\n\nNgoài hồ sơ quy định tại khoản 2 Điều này phải bổ sung các giấy tờ như sau:\n\na) Bản khai thời gian lái xe và số km lái xe an toàn quy định cho từng hạng xe có xác nhận của Thủ trưởng cơ quan, đơn vị trực tiếp quản lý từ cấp trung đoàn hoặc tương đương trở lên theo quy định tại Mẫu số 03 Phụ lục I kèm theo Thông tư này;\n\nb) Bản sao Giấy phép lái xe quân sự đang sử dụng.\n\nMục II. CƠ SỞ ĐÀO TẠO LÁI XE QUÂN SỰ\n\nĐiều 11. Nhiệm vụ của cơ sở đào tạo lái xe quân sự']","**Nguồn văn bản:** /content/drive/MyDrive/ITProject_data/new_law/36_2024_QH15_444251.docx

**Tên văn bản:** Không có tiêu đề trong context

**Điều 57:** Giấy phép lái xe

**Nội dung:**

5. Thời hạn của giấy phép lái xe được quy định như sau:

    a) Giấy phép lái xe các hạng A1, A, B1 không thời hạn;

    b) Giấy phép lái xe hạng B và hạng C1 có thời hạn 10 năm kể từ ngày cấp;

    c) Giấy phép lái xe các hạng C, D1, D2, D, BE, C1E, CE, D1E, D2E và DE có thời hạn 05 năm kể từ ngày cấp.


Tóm lại: Giấy phép lái xe hạng C1 có thời hạn 10 năm kể từ ngày cấp.
",Giấy phép lái xe hạng C1 có thời hạn 10 năm kể từ ngày cấp.,0.75,0.9357325966046988,1.0,0.9999999999
4,Giấy phép lái xe hạng D có thời hạn bao lâu?,"['a) Chứng nhận đăng ký xe hoặc bản sao Chứng nhận đăng ký xe có chứng thực kèm bản gốc giấy tờ xác nhận của tổ chức tín dụng, chi nhánh ngân hàng nước ngoài còn hiệu lực trong trường hợp xe đang được thế chấp tại tổ chức tín dụng, chi nhánh ngân hàng nước ngoài;\n\nb) Giấy phép lái xe phù hợp với loại xe đang điều khiển;\n\nc) Chứng nhận kiểm định an toàn kỹ thuật và bảo vệ môi trường đối với xe cơ giới theo quy định của pháp luật;\n\nd) Chứng nhận bảo hiểm bắt buộc trách nhiệm dân sự của chủ xe cơ giới.\n\n2. Người điều khiển xe máy chuyên dùng tham gia giao thông đường bộ phải đủ tuổi, sức khỏe theo quy định của pháp luật; có bằng hoặc chứng chỉ điều khiển xe máy chuyên dùng phù hợp loại xe máy chuyên dùng đang điều khiển; có giấy phép lái xe đang còn điểm, còn hiệu lực hoặc chứng chỉ bồi dưỡng kiến thức pháp luật về giao thông đường bộ. Khi tham gia giao thông đường bộ, người điều khiển xe máy chuyên dùng phải mang theo các loại giấy tờ sau đây:\n\na) Chứng nhận đăng ký xe hoặc bản sao Chứng nhận đăng ký xe có chứng thực kèm bản gốc Giấy biên nhận còn hiệu lực của tổ chức tín dụng, chi nhánh ngân hàng nước ngoài trong trường hợp xe đang được thế chấp tại tổ chức tín dụng, chi nhánh ngân hàng nước ngoài;\n\nb) Bằng hoặc chứng chỉ điều khiển xe máy chuyên dùng;\n\nc) Giấy phép lái xe hoặc chứng chỉ bồi dưỡng kiến thức pháp luật về giao thông đường bộ;\n\nd) Chứng nhận kiểm định an toàn kỹ thuật và bảo vệ môi trường đối với xe máy chuyên dùng theo quy định của pháp luật;\n\nđ) Chứng nhận bảo hiểm bắt buộc trách nhiệm dân sự theo quy định của pháp luật.\n\n3. Trường hợp giấy tờ quy định tại khoản 1 và khoản 2 Điều này đã được tích hợp vào tài khoản định danh điện tử thì việc xuất trình, kiểm tra có thể thực hiện thông qua tài khoản định danh điện tử.\n\n4. Người lái xe gắn máy tham gia giao thông đường bộ phải hiểu biết quy tắc giao thông đường bộ, có kỹ năng điều khiển phương tiện; đủ điều kiện về độ tuổi, sức khỏe theo quy định tại điểm a khoản 1 và khoản 2 Điều 59 của Luật này.\n\n5. Người tập lái xe ô tô, người dự sát hạch lái xe ô tô khi tham gia giao thông đường bộ phải thực hành trên xe tập lái, xe sát hạch trên tuyến đường tập lái, tuyến đường sát hạch, có giáo viên dạy lái hoặc sát hạch viên bảo trợ tay lái. Giáo viên dạy lái, sát hạch viên phải mang theo các loại giấy tờ quy định tại khoản 1 Điều này.\n\nĐiều 57. Giấy phép lái xe\n\n1. Giấy phép lái xe bao gồm các hạng sau đây:\n\na) Hạng A1 cấp cho người lái xe mô tô hai bánh có dung tích xi-lanh đến 125 cm3 hoặc có công suất động cơ điện đến 11 kW;\n\nb) Hạng A cấp cho người lái xe mô tô hai bánh có dung tích xi-lanh\xa0 trên 125 cm3\xa0hoặc có công suất động cơ điện trên 11 kW và các loại xe quy định cho giấy phép lái xe hạng A1;\n\nc) Hạng B1 cấp cho người lái xe mô tô ba bánh và các loại xe quy định cho giấy phép lái xe hạng A1;\n\nd) Hạng B cấp cho người lái xe ô tô chở người đến 08 chỗ (không kể chỗ của người lái xe); xe ô tô tải và ô tô chuyên dùng có khối lượng toàn bộ theo thiết kế đến 3.500 kg; các loại xe ô tô quy định cho giấy phép lái xe hạng B kéo rơ moóc có khối lượng toàn bộ theo thiết kế đến 750 kg; \n\nđ) Hạng C1 cấp cho người lái xe ô tô tải và ô tô chuyên dùng có khối lượng toàn bộ theo thiết kế trên 3.500 kg đến 7.500 kg; các loại xe ô tô tải quy định cho giấy phép lái xe hạng C1 kéo rơ moóc có khối lượng toàn bộ theo thiết kế đến 750 kg; các loại xe quy định cho giấy phép lái xe hạng B;\n\ne) Hạng C cấp cho người lái xe ô tô tải và ô tô chuyên dùng có khối lượng toàn bộ theo thiết kế trên 7.500 kg; các loại xe ô tô tải quy định cho giấy phép lái xe hạng C kéo rơ moóc có khối lượng toàn bộ theo thiết kế đến 750 kg; các loại xe quy định cho giấy phép lái xe hạng B và hạng C1;\n\ng) Hạng D1 cấp cho người lái xe ô tô chở người trên 08 chỗ (không kể chỗ của người lái xe) đến 16 chỗ (không kể chỗ của người lái xe); các loại xe ô tô chở người quy định cho giấy phép lái xe hạng D1 kéo rơ moóc có khối lượng toàn bộ theo thiết kế đến 750 kg; các loại xe quy định cho giấy phép lái xe các hạng B, C1, C;\n\nh) Hạng D2 cấp cho người lái xe ô tô chở người (kể cả xe buýt) trên 16 chỗ (không kể chỗ của người lái xe) đến 29 chỗ (không kể chỗ của người lái xe); các loại xe ô tô chở người quy định cho giấy phép lái xe hạng D2 kéo rơ moóc có khối lượng toàn bộ theo thiết kế đến 750 kg; các loại xe quy định cho giấy phép lái xe các hạng B, C1, C, D1;\n\ni) Hạng D cấp cho người lái xe ô tô chở người (kể cả xe buýt) trên 29 chỗ (không kể chỗ của người lái xe); xe ô tô chở người giường nằm; các loại xe ô tô chở người quy định cho giấy phép lái xe hạng D kéo rơ moóc có khối lượng toàn bộ theo thiết kế đến 750 kg; các loại xe quy định cho giấy phép lái xe các hạng B, C1, C, D1, D2;\n\nk) Hạng BE cấp cho người lái các loại xe ô tô quy định cho giấy phép lái xe hạng B kéo rơ moóc có khối lượng toàn bộ theo thiết kế trên 750 kg;\n\nl) Hạng C1E cấp cho người lái các loại xe ô tô quy định cho giấy phép lái xe hạng C1 kéo rơ moóc có khối lượng toàn bộ theo thiết kế trên 750 kg;\n\nm) Hạng CE cấp cho người lái các loại xe ô tô quy định cho giấy phép lái xe hạng C kéo rơ moóc có khối lượng toàn bộ theo thiết kế trên 750 kg; xe ô tô đầu kéo kéo sơ mi rơ moóc;\n\nn) Hạng D1E cấp cho người lái các loại xe ô tô quy định cho giấy phép lái xe hạng D1 kéo rơ moóc có khối lượng toàn bộ theo thiết kế trên 750 kg;\n\no) Hạng D2E cấp cho người lái các loại xe ô tô quy định cho giấy phép lái xe hạng D2 kéo rơ moóc có khối lượng toàn bộ theo thiết kế trên 750 kg;\n\np) Hạng DE cấp cho người lái các loại xe ô tô quy định cho giấy phép lái xe hạng D kéo rơ moóc có khối lượng toàn bộ theo thiết kế trên 750 kg; xe ô tô chở khách nối toa.\n\n2. Người khuyết tật điều khiển xe mô tô ba bánh dùng cho người khuyết tật được cấp giấy phép lái xe hạng A1.\n\nNgười khuyết tật điều khiển xe ô tô số tự động có kết cấu phù hợp với tình trạng khuyết tật thì được cấp giấy phép lái xe hạng B.\n\n3. Người điều khiển xe chở hàng bốn bánh có gắn động cơ, xe chở người bốn bánh có gắn động cơ phải sử dụng giấy phép lái xe có hạng phù hợp với xe ô tô tải hoặc xe ô tô chở người tương ứng.\n\n4. Người điều khiển xe ô tô có thiết kế, cải tạo với số chỗ ít hơn xe cùng loại, kích thước giới hạn tương đương phải sử dụng giấy phép lái xe có hạng phù hợp với xe ô tô cùng loại, kích thước giới hạn tương đương và có số chỗ nhiều nhất.\n\n5. Thời hạn của giấy phép lái xe được quy định như sau:\n\na) Giấy phép lái xe các hạng A1, A, B1 không thời hạn;\n\nb) Giấy phép lái xe hạng B và hạng C1 có thời hạn 10 năm kể từ ngày cấp;\n\nc) Giấy phép lái xe các hạng C, D1, D2, D, BE, C1E, CE, D1E, D2E và DE có thời hạn 05 năm kể từ ngày cấp.\n\n6. Giấy phép lái xe có giá trị sử dụng trong phạm vi lãnh thổ Việt Nam bao gồm:\n\na) Giấy phép lái xe do cơ quan có thẩm quyền của Việt Nam cấp;\n\nb) Giấy phép lái xe quốc tế và giấy phép lái xe quốc gia phù hợp với loại xe được phép điều khiển do quốc gia là thành viên của Công ước của Liên hợp quốc về Giao thông đường bộ năm 1968 (sau đây gọi là Công ước Viên) cấp;\n\nc) Giấy phép lái xe phù hợp với loại xe được phép điều khiển của nước hoặc vùng lãnh thổ mà Việt Nam ký kết điều ước quốc tế hoặc thỏa thuận quốc tế công nhận giấy phép lái xe của nhau;\n\nd) Giấy phép lái xe nước ngoài phù hợp với loại xe được phép điều khiển do quốc gia được công nhận theo điều ước quốc tế mà nước Cộng hòa xã hội chủ nghĩa Việt Nam là thành viên.\n\n7. Giấy phép lái xe không có hiệu lực trong các trường hợp sau đây:\n\na) Giấy phép lái xe hết thời hạn sử dụng;\n\nb) Giấy phép lái xe bị thu hồi theo quy định tại khoản 5 Điều 62 của Luật này.\n\n8. Giấy phép lái xe quốc tế được quy định như sau:\n\na) Giấy phép lái xe quốc tế là giấy phép lái xe do cơ quan nhà nước có thẩm quyền của quốc gia là thành viên của Công ước Viên cấp theo một mẫu thống nhất; có thời hạn không quá 03 năm kể từ ngày cấp và phải phù hợp với thời hạn còn hiệu lực của giấy phép lái xe quốc gia;', 'a) Giấy phép lái xe hết thời hạn sử dụng;\n\nb) Giấy phép lái xe bị thu hồi theo quy định tại khoản 5 Điều 62 của Luật này.\n\n8. Giấy phép lái xe quốc tế được quy định như sau:\n\na) Giấy phép lái xe quốc tế là giấy phép lái xe do cơ quan nhà nước có thẩm quyền của quốc gia là thành viên của Công ước Viên cấp theo một mẫu thống nhất; có thời hạn không quá 03 năm kể từ ngày cấp và phải phù hợp với thời hạn còn hiệu lực của giấy phép lái xe quốc gia;\n\nb) Người có giấy phép lái xe quốc tế do quốc gia là thành viên của Công ước Viên cấp khi lái xe tham gia giao thông đường bộ trên lãnh thổ Việt Nam phải mang theo giấy phép lái xe quốc tế và giấy phép lái xe quốc gia được cấp phù hợp với hạng xe điều khiển, còn thời hạn sử dụng; phải tuân thủ pháp luật về trật tự, an toàn giao thông đường bộ của Việt Nam;\n\nc) Người có giấy phép lái xe quốc tế vi phạm pháp luật về trật tự, an toàn giao thông đường bộ của Việt Nam mà bị tước quyền sử dụng giấy phép lái xe có thời hạn thì thời gian bị tước quyền sử dụng không quá thời gian người lái xe được phép cư trú tại lãnh thổ Việt Nam;\n\nd) Người Việt Nam hoặc người nước ngoài có thẻ thường trú hoặc thẻ tạm trú tại Việt Nam có giấy phép lái xe do Việt Nam hoặc quốc gia là thành viên của điều ước quốc tế mà nước Cộng hòa xã hội chủ nghĩa Việt Nam là thành viên cấp, còn giá trị sử dụng, nếu có nhu cầu được cấp giấy phép lái xe quốc tế.\n\n9. Bộ trưởng Bộ Giao thông vận tải quy định mẫu giấy phép lái xe và giấy phép lái xe quốc tế, trình tự, thủ tục cấp và việc sử dụng giấy phép lái xe, giấy phép lái xe quốc tế; đối với mẫu giấy phép lái xe, trình tự, thủ tục cấp và việc sử dụng giấy phép lái xe của lực lượng quân đội, công an làm nhiệm vụ quốc phòng, an ninh do Bộ trưởng Bộ Quốc phòng, Bộ trưởng Bộ Công an quy định.\n\nĐiều 58. Điểm của giấy phép lái xe \n\n1. Điểm của giấy phép lái xe được dùng để quản lý việc chấp hành pháp luật về trật tự, an toàn giao thông đường bộ của người lái xe trên hệ thống cơ sở dữ liệu về trật tự, an toàn giao thông đường bộ, bao gồm 12 điểm. Số điểm trừ mỗi lần vi phạm tùy thuộc tính chất, mức độ của hành vi vi phạm pháp luật về trật tự, an toàn giao thông đường bộ. Dữ liệu về điểm trừ giấy phép lái xe của người vi phạm sẽ được cập nhật vào hệ thống cơ sở dữ liệu ngay sau khi quyết định xử phạt có hiệu lực thi hành và thông báo cho người bị trừ điểm giấy phép lái xe biết.\n\n2. Giấy phép lái xe chưa bị trừ hết điểm và không bị trừ điểm trong thời hạn 12 tháng từ ngày bị trừ điểm gần nhất thì được phục hồi đủ 12 điểm.\n\n3. Trường hợp giấy phép lái xe bị trừ hết điểm thì người có giấy phép lái xe không được điều khiển phương tiện tham gia giao thông đường bộ theo giấy phép lái xe đó. Sau thời hạn ít nhất là 06 tháng kể từ ngày bị trừ hết điểm, người có giấy phép lái xe được tham gia kiểm tra nội dung kiến thức pháp luật về trật tự, an toàn giao thông đường bộ theo quy định tại khoản 7 Điều 61 của Luật này do lực lượng Cảnh sát giao thông tổ chức, có kết quả đạt yêu cầu thì được phục hồi đủ 12 điểm.\n\n4. Giấy phép lái xe sau khi đổi, cấp lại, nâng hạng được giữ nguyên số điểm của giấy phép lái xe trước khi đổi, cấp lại, nâng hạng.\n\n5. Người có thẩm quyền xử phạt vi phạm hành chính có thẩm quyền trừ điểm giấy phép lái xe.\n\n6. Chính phủ quy định chi tiết khoản 1 Điều này; quy định trình tự, thủ tục, thẩm quyền trừ điểm, phục hồi điểm giấy phép lái xe; quy định lộ trình thực hiện Điều này. Bộ trưởng Bộ Công an quy định chi tiết khoản 3 Điều này.\n\nĐiều 59. Tuổi, sức khỏe của người điều khiển phương tiện tham gia giao thông đường bộ\n\n1. Độ tuổi của người lái xe, người điều khiển xe máy chuyên dùng được quy định như sau:\n\na) Người đủ 16 tuổi trở lên được điều khiển xe gắn máy;\n\nb) Người đủ 18 tuổi trở lên được cấp giấy phép lái xe hạng A1, A, B1, B, C1, được cấp chứng chỉ bồi dưỡng kiến thức pháp luật về giao thông đường bộ để điều khiển xe máy chuyên dùng tham gia giao thông đường bộ;\n\nc) Người đủ 21 tuổi trở lên được cấp giấy phép lái xe hạng C, BE;\n\nd) Người đủ 24 tuổi trở lên được cấp giấy phép lái xe hạng D1, D2, C1E, CE;\n\nđ) Người đủ 27 tuổi trở lên được cấp giấy phép lái xe hạng D, D1E, D2E, DE;\n\ne) Tuổi tối đa của người lái xe ô tô chở người (kể cả xe buýt) trên 29 chỗ (không kể chỗ của người lái xe), xe ô tô chở người giường nằm là đủ 57 tuổi đối với nam, đủ 55 tuổi đối với nữ.\n\n2. Người điều khiển phương tiện tham gia giao thông đường bộ phải bảo đảm điều kiện sức khỏe phù hợp với từng loại phương tiện được phép điều khiển. Bộ trưởng Bộ Y tế quy định về tiêu chuẩn sức khỏe, việc khám sức khỏe đối với người lái xe, người điều khiển xe máy chuyên dùng; việc khám sức khỏe định kỳ đối với người hành nghề lái xe ô tô; xây dựng cơ sở dữ liệu về sức khỏe của người lái xe, người điều khiển xe máy chuyên dùng.\n\n3. Bộ trưởng Bộ Quốc phòng, Bộ trưởng Bộ Công an quy định độ tuổi của người lái xe trong lực lượng quân đội, công an làm nhiệm vụ quốc phòng, an ninh.\n\nĐiều 60. Đào tạo lái xe\n\n1. Người có nhu cầu được cấp giấy phép lái xe phải được đào tạo nội dung lý thuyết và thực hành theo chương trình đào tạo quy định cho từng hạng giấy phép lái xe.\n\n2. Người học lái xe phải được đào tạo tại các cơ sở đào tạo lái xe hoặc các hình thức đào tạo lái xe khác để cấp mới hoặc nâng hạng giấy phép lái xe.\n\n3. Việc đào tạo để nâng hạng giấy phép lái xe thực hiện đối với những đối tượng sau đây:\n\na) Nâng hạng giấy phép lái xe từ hạng B lên hạng C1 hoặc lên hạng C hoặc lên hạng D1 hoặc lên hạng D2;\n\nb) Nâng hạng giấy phép lái xe từ hạng C1 lên hạng C hoặc lên hạng D1 hoặc lên hạng D2;\n\nc) Nâng hạng giấy phép lái xe từ hạng C lên hạng D1 hoặc lên hạng D2 hoặc lên hạng D;\n\nd) Nâng hạng giấy phép lái xe từ hạng D1 lên hạng D2 hoặc lên hạng D;\n\nđ) Nâng hạng giấy phép lái xe từ hạng D2 lên hạng D;\n\ne) Nâng hạng giấy phép lái xe từ hạng B lên hạng BE, từ hạng C1 lên\xa0 hạng C1E, từ hạng C lên hạng CE, từ hạng D1 lên hạng D1E, từ hạng D2 lên hạng D2E, từ hạng D lên hạng DE.\n\n4.\xa0Người có nhu cầu được đào tạo nâng hạng giấy phép lái xe khi giấy phép lái xe còn hiệu lực, phải có đủ thời gian lái xe an toàn quy định cho từng hạng giấy phép lái xe;\xa0đối với việc nâng hạng giấy phép lái xe lên hạng D1, D2, D thì người có nhu cầu được đào tạo còn phải có trình độ từ trung học cơ sở trở lên.\n\n5. Giấy phép lái xe các hạng C, D1, D2, D, BE, C1E, CE, D1E, D2E, DE phải được đào tạo bằng hình thức đào tạo nâng hạng theo các điều kiện quy định tại khoản 3 và khoản 4 Điều này.\n\n6. Cơ sở đào tạo lái xe ô tô phải đáp ứng các điều kiện do Chính phủ quy định; có giáo trình, giáo án; thực hiện đào tạo theo đúng hình thức, nội dung và chương trình quy định cho từng hạng giấy phép lái xe.\n\n7. Chính phủ quy định chi tiết các hình thức đào tạo lái xe khác quy định tại khoản 2 Điều này; quy định trình tự, thủ tục kiểm tra, đánh giá để cấp, cấp lại và thu hồi giấy phép xe tập lái; quy định tiêu chuẩn của giáo viên dạy lái xe; quy định việc cấp, cấp lại và thu hồi giấy chứng nhận giáo viên dạy lái xe; quy định việc cấp, cấp lại và thu hồi giấy phép đào tạo lái xe.\n\n8. Bộ trưởng Bộ Giao thông vận tải quy định hình thức, nội dung, chương trình đào tạo lái xe, thời gian lái xe an toàn cho từng hạng giấy phép lái xe quy định tại khoản 4 Điều này và quy định tiêu chuẩn của cơ sở đào tạo lái xe mô tô; đối với cơ sở đào tạo, tổ chức đào tạo lái xe cho lực lượng quân đội, công an làm nhiệm vụ quốc phòng, an ninh do Bộ trưởng Bộ Quốc phòng, Bộ trưởng Bộ Công an quy định.\n\nĐiều 61. Sát hạch lái xe\n\n1. Người đã hoàn thành chương trình đào tạo lái xe, có độ tuổi, sức khỏe theo quy định tại Điều 59 của Luật này được đăng ký để tham dự kỳ sát hạch lái xe.\n\n2. Nội dung sát hạch lái xe phải phù hợp với hạng giấy phép lái xe và chương trình đào tạo lái xe.\n\n3. Hoạt động sát hạch lái xe ô tô phải thực hiện tại các trung tâm sát hạch lái xe; hoạt động sát hạch lái xe mô tô thực hiện tại các trung tâm sát hạch lái xe hoặc tại sân tập lái đáp ứng điều kiện, tiêu chuẩn về cơ sở vật chất, kỹ thuật. Hoạt động sát hạch lái xe do cơ quan nhà nước có thẩm quyền thực hiện.', 'khí, khí tài quân sự dạng rơ moóc có khối lượng toàn bộ theo thiết kế đến 750 kg; các loại xe quy định cho Giấy phép lái xe quân sự hạng B, C1, C, D1;\n\ni) Hạng D cấp cho người điều khiển xe ô tô chở người từ trên 29 chỗ (không kể chỗ của người lái xe); các loại xe ô tô chở người quy định cho Giấy phép lái xe hạng D kéo rơ moóc hoặc vũ khí, khí tài quân sự dạng rơ moóc có khối lượng toàn bộ theo thiết kế đến 750 kg; các loại xe quy định cho Giấy phép lái xe quân sự hạng B, C1, C, D1, D2;\n\nk) Hạng C1E cấp cho người điều khiển các loại xe ô tô quy định cho Giấy phép lái xe hạng C1 kéo rơ moóc hoặc vũ khí, khí tài quân sự dạng rơ moóc có khối lượng toàn bộ theo thiết kế trên 750 kg;\n\nl) Hạng CE cấp cho người điều khiển các loại xe ô tô quy định cho Giấy phép lái xe hạng C kéo rơ moóc hoặc vũ khí, khí tài quân sự dạng rơ moóc có khối lượng toàn bộ theo thiết kế trên 750 kg; xe ô tô đầu kéo kéo sơ mi rơ moóc hoặc khí tài quân sự dạng sơ mi rơ moóc;\n\nm) Hạng CX cấp cho người đã có Giấy phép lái xe quân sự hạng C để điều khiển xe xích kéo vũ khí, khí tài quân sự.\n\n2. Người điều khiển xe chở hàng bốn bánh có gắn động cơ, xe chở người bốn bánh có gắn động cơ phải sử dụng giấy phép lái xe có hạng phù hợp với xe ô tô tải và ô tô chở người tương ứng.\n\n3. Người điều khiển xe ô tô có thiết kế, cải tạo với số chỗ ngồi ít hơn ô tô cùng loại, kích thước giới hạn tương đương phải sử dụng giấy phép lái xe có hạng phù hợp với ô tô cùng loại, kích thước giới hạn tương đương và có số chỗ ngồi nhiều nhất.\n\nĐiều 6. Mẫu và thời hạn Giấy phép lái xe quân sự\n\n1. Mẫu Giấy phép lái xe quân sự\n\na) Giấy phép lái xe quân sự thực hiện theo quy định tại Mẫu số 08 kèm theo Thông tư này;\n\nb) Cục trưởng Cục Xe máy - Vận tải/Tổng cục Hậu cần - Kỹ thuật có trách nhiệm quản lý việc sử dụng Giấy phép lái xe quân sự thuộc phạm vi quản lý của Bộ Quốc phòng.\n\n2. Thời hạn sử dụng Giấy phép lái xe quân sự\n\na) Giấy phép lái xe quân sự hạng A1, A, B1 là không thời hạn;\n\nb) Giấy phép lái xe quân sự các hạng B, C1, C, D1, D2, D, C1E, CE, CX có thời hạn 05 năm kể từ ngày cấp;\n\nc) Trường hợp cấp, đổi do lý do khác thời hạn theo thời hạn ghi trên Giấy phép lái xe quân sự.\n\n3. Giấy phép lái xe quân sự không có hiệu lực trong các trường hợp sau:\n\na) Giấy phép lái xe quân sự hết thời hạn sử dụng được ghi trên Giấy phép lái xe;\n\nb) Giấy phép lái xe quân sự bị trừ hết điểm theo quy định tại Điều 7 của Thông tư này;\n\nc) Giấy phép lái xe quân sự có Quyết định thu hồi theo khoản 1 Điều 47 Thông tư này.\n\nĐiều 7. Điểm của Giấy phép lái xe quân sự\n\n1. Điểm của Giấy phép lái xe quân sự gồm 12 điểm theo quy định của Luật Trật tự, an toàn giao thông đường bộ, được dùng để quản lý việc chấp hành pháp luật về trật tự, an toàn giao thông đường bộ của người lái xe. Số điểm trừ mỗi lần tùy theo tính chất, mức độ vi phạm theo quy định của pháp luật. Giấy phép lái xe chưa bị trừ hết điểm và không bị trừ điểm trong thời hạn 12 tháng kể từ ngày bị trừ điểm gần nhất thì được phục hồi đủ 12 điểm.\n\n2. Trường hợp Giấy phép lái xe quân sự bị trừ hết điểm, sau thời hạn ít nhất 06 tháng kể từ ngày bị trừ hết điểm, người có Giấy phép lái xe quân sự bị trừ hết điểm được tham gia kiểm tra kiến thức pháp luật về giao thông đường bộ tổ chức tại cơ sở đào tạo lái xe quân sự theo quy định tại điểm a khoản 1 Điều 40 và khoản 1 Điều 41 Thông tư này, nếu kết quả đặt yêu cầu được phục hồi đủ 12 điểm.\n\n3. Điểm của Giấy phép lái xe quân sự đổi, cấp lại, đào tạo nâng hạng được giữ nguyên như trước khi đổi, cấp lại, đào tạo nâng hạng.\n\nĐiều 8. Độ tuổi của người được cấp Giấy phép lái xe quân sự\n\n1. Quân nhân, công chức quốc phòng, công nhân viên chức quốc phòng, lao động hợp đồng đang phục vụ trong Bộ Quốc phòng đủ 18 tuổi trở lên được cấp Giấy phép lái xe quân sự hạng A1, A, B1, B, C1, C.\n\n2. Quân nhân, công chức quốc phòng, công nhân viên chức quốc phòng, lao động hợp đồng đang phục vụ trong Bộ Quốc phòng đủ 24 tuổi trở lên được cấp Giấy phép lái xe quân sự hạng D1, D2, C1E, CE, CX.\n\nCác trường hợp đào tạo chuyển tiếp từ hạng C lên hạng CE hoặc CX theo chỉ tiêu của Bộ Tổng Tham mưu, đủ 19 tuổi trở lên.\n\n3. Quân nhân, công chức quốc phòng, công nhân viên chức quốc phòng, lao động hợp đồng đang phục vụ trong Bộ Quốc phòng đủ 27 tuổi trở lên được cấp Giấy phép lái xe quân sự hạng D. Độ tuổi tối đa của người được cấp Giấy phép lái xe quân sự hạng D là đủ 57 tuổi đối với nam và đủ 55 tuổi đối với nữ.\n\nChương II\n\nĐÀO TẠO LÁI XE QUÂN SỰ\n\nMục I. NGƯỜI HỌC\n\nĐiều 9. Điều kiện đối với người học lái xe quân sự\n\n1. Quân nhân, công chức quốc phòng, công nhân viên chức quốc phòng, lao động hợp đồng đang phục vụ trong Bộ Quốc phòng có đủ các điều kiện: Tiêu chuẩn về tuổi đời, thời gian công tác, sức khỏe, trình độ văn hóa, phẩm chất chính trị theo quy định của Bộ Quốc phòng.\n\nĐối với lao động hợp đồng: Chỉ đào tạo nâng hạng khi có đủ điều kiện, tiêu chuẩn quy định tại khoản 1 Điều này.\n\n2. Đối với người học nâng hạng Giấy phép lái xe quân sự phải có thời gian lái xe và số km lái xe an toàn như sau:\n\na) Từ hạng B lên hạng C1; hạng C1 lên hạng C, C1E; hạng C lên hạng D1, CE, CX; hạng D1 lên hạng D2; hạng D2 lên hạng D: Có thời gian lái xe 02 năm trở lên và 30.000 km lái xe an toàn trở lên (trừ các trường hợp đào tạo chuyển tiếp từ hạng C lên hạng CE hoặc CX theo chỉ tiêu của Bộ Tổng Tham mưu);\n\nb) Từ hạng B lên hạng C, D1; hạng C1 lên D1; hạng C lên hạng D2; hạng D1 lên hạng D: Có thời gian lái xe 03 năm trở lên và có 50.000 km lái xe an toàn trở lên;\n\nc) Từ hạng B lên hạng D2, từ hạng C1 lên hạng D2, từ hạng C lên hạng D: Có thời gian lái xe 05 năm trở lên và 100.000 km lái xe an toàn trở lên.\n\n3. Đối với người học nâng hạng Giấy phép lái xe quân sự lên hạng D1, D2, D ngoài các quy định tại các khoản 1, 2 Điều này phải có bằng tốt nghiệp trung học cơ sở trở lên.\n\nĐiều 10. Hồ sơ đào tạo lái xe\n\n1. Hạng A1, A, gồm:\n\na) Kế hoạch huấn luyện lái xe mô tô quân sự hạng A1, A (kèm theo danh sách học viên) của cơ quan, đơn vị theo quy định tại Mẫu số 13 Phụ lục I kèm theo Thông tư này;\n\nb) Đơn đề nghị học và sát hạch, cấp Giấy phép lái xe quân sự của cá nhân có xác nhận của Thủ trưởng cơ quan, đơn vị trực tiếp quản lý từ cấp trung đoàn hoặc tương đương trở lên theo quy định tại Mẫu số 01 Phụ lục I kèm theo Thông tư này;\n\nc) Bản sao Căn cước công dân (căn cước) và bản sao một trong các loại giấy tờ sau: Giấy chứng minh quân nhân, công chức quốc phòng, công nhân và viên chức quốc phòng, quyết định nhập ngũ, tuyển dụng, phiếu quân nhân, thẻ học viên, quyết định thăng, phong quân hàm, nâng lương gần nhất còn hiệu lực;\n\nd) Giấy chứng nhận sức khỏe theo quy định do quân y cấp trung đoàn và tương đương trở lên xác nhận theo quy định tại Mẫu số 02 Phụ lục I kèm theo Thông tư này;\n\nđ) Hai ảnh màu cỡ 2 x 3 cm (ảnh chụp trên nền màu xanh; quân nhân mặc quân phục thường dùng; công chức quốc phòng, công nhân và viên chức quốc phòng, lao động hợp đồng mặc đồng phục; đeo biển tên theo quy định, không đội mũ).\n\n2. Hạng B1, B, C1, C, gồm:\n\na) Kế hoạch đào tạo lái xe quân sự hạng B1, B, C1, C (kèm theo danh sách học viên) của cơ sở đào tạo;\n\nb) Bản sao quyết định giao chỉ tiêu đào tạo nhân viên kỹ thuật sơ cấp của Tổng Tham mưu trưởng đối với trường hợp đào tạo theo chỉ tiêu nhiệm vụ; văn bản đề nghị đào tạo lái xe của Thủ trưởng cơ quan, đơn vị đầu mối trực thuộc Bộ Quốc phòng đối với trường hợp gửi đào tạo;\n\nc) Hồ sơ quy định tại các điểm b, c, d, đ khoản 1 Điều này;\n\n3. Đào tạo nâng hạng Giấy phép lái xe quân sự\n\nNgoài hồ sơ quy định tại khoản 2 Điều này phải bổ sung các giấy tờ như sau:\n\na) Bản khai thời gian lái xe và số km lái xe an toàn quy định cho từng hạng xe có xác nhận của Thủ trưởng cơ quan, đơn vị trực tiếp quản lý từ cấp trung đoàn hoặc tương đương trở lên theo quy định tại Mẫu số 03 Phụ lục I kèm theo Thông tư này;\n\nb) Bản sao Giấy phép lái xe quân sự đang sử dụng.\n\nMục II. CƠ SỞ ĐÀO TẠO LÁI XE QUÂN SỰ\n\nĐiều 11. Nhiệm vụ của cơ sở đào tạo lái xe quân sự']","**Nguồn văn bản:** /content/drive/MyDrive/ITProject_data/new_law/36_2024_QH15_444251.docx

**Tên văn bản:** Không có tiêu đề trong context

**Điều 57:** Giấy phép lái xe

**Nội dung:**

5. Thời hạn của giấy phép lái xe được quy định như sau:

    a) Giấy phép lái xe các hạng A1, A, B1 không thời hạn.

    b) Giấy phép lái xe hạng B và hạng C1 có thời hạn 10 năm kể từ ngày cấp.

    c) Giấy phép lái xe các hạng C, D1, D2, D, BE, C1E, CE, D1E, D2E và DE có thời hạn 05 năm kể từ ngày cấp.


Tóm lại: Giấy phép lái xe hạng D có thời hạn 5 năm kể từ ngày cấp.
",Giấy phép lái xe hạng D có thời hạn 5 năm kể từ ngày cấp.,0.875,0.9121975094063473,1.0,0.8333333332916666
5,Giấy phép lái xe hạng BE cho phép lái những loại xe nào?,"['a) Chứng nhận đăng ký xe hoặc bản sao Chứng nhận đăng ký xe có chứng thực kèm bản gốc giấy tờ xác nhận của tổ chức tín dụng, chi nhánh ngân hàng nước ngoài còn hiệu lực trong trường hợp xe đang được thế chấp tại tổ chức tín dụng, chi nhánh ngân hàng nước ngoài;\n\nb) Giấy phép lái xe phù hợp với loại xe đang điều khiển;\n\nc) Chứng nhận kiểm định an toàn kỹ thuật và bảo vệ môi trường đối với xe cơ giới theo quy định của pháp luật;\n\nd) Chứng nhận bảo hiểm bắt buộc trách nhiệm dân sự của chủ xe cơ giới.\n\n2. Người điều khiển xe máy chuyên dùng tham gia giao thông đường bộ phải đủ tuổi, sức khỏe theo quy định của pháp luật; có bằng hoặc chứng chỉ điều khiển xe máy chuyên dùng phù hợp loại xe máy chuyên dùng đang điều khiển; có giấy phép lái xe đang còn điểm, còn hiệu lực hoặc chứng chỉ bồi dưỡng kiến thức pháp luật về giao thông đường bộ. Khi tham gia giao thông đường bộ, người điều khiển xe máy chuyên dùng phải mang theo các loại giấy tờ sau đây:\n\na) Chứng nhận đăng ký xe hoặc bản sao Chứng nhận đăng ký xe có chứng thực kèm bản gốc Giấy biên nhận còn hiệu lực của tổ chức tín dụng, chi nhánh ngân hàng nước ngoài trong trường hợp xe đang được thế chấp tại tổ chức tín dụng, chi nhánh ngân hàng nước ngoài;\n\nb) Bằng hoặc chứng chỉ điều khiển xe máy chuyên dùng;\n\nc) Giấy phép lái xe hoặc chứng chỉ bồi dưỡng kiến thức pháp luật về giao thông đường bộ;\n\nd) Chứng nhận kiểm định an toàn kỹ thuật và bảo vệ môi trường đối với xe máy chuyên dùng theo quy định của pháp luật;\n\nđ) Chứng nhận bảo hiểm bắt buộc trách nhiệm dân sự theo quy định của pháp luật.\n\n3. Trường hợp giấy tờ quy định tại khoản 1 và khoản 2 Điều này đã được tích hợp vào tài khoản định danh điện tử thì việc xuất trình, kiểm tra có thể thực hiện thông qua tài khoản định danh điện tử.\n\n4. Người lái xe gắn máy tham gia giao thông đường bộ phải hiểu biết quy tắc giao thông đường bộ, có kỹ năng điều khiển phương tiện; đủ điều kiện về độ tuổi, sức khỏe theo quy định tại điểm a khoản 1 và khoản 2 Điều 59 của Luật này.\n\n5. Người tập lái xe ô tô, người dự sát hạch lái xe ô tô khi tham gia giao thông đường bộ phải thực hành trên xe tập lái, xe sát hạch trên tuyến đường tập lái, tuyến đường sát hạch, có giáo viên dạy lái hoặc sát hạch viên bảo trợ tay lái. Giáo viên dạy lái, sát hạch viên phải mang theo các loại giấy tờ quy định tại khoản 1 Điều này.\n\nĐiều 57. Giấy phép lái xe\n\n1. Giấy phép lái xe bao gồm các hạng sau đây:\n\na) Hạng A1 cấp cho người lái xe mô tô hai bánh có dung tích xi-lanh đến 125 cm3 hoặc có công suất động cơ điện đến 11 kW;\n\nb) Hạng A cấp cho người lái xe mô tô hai bánh có dung tích xi-lanh\xa0 trên 125 cm3\xa0hoặc có công suất động cơ điện trên 11 kW và các loại xe quy định cho giấy phép lái xe hạng A1;\n\nc) Hạng B1 cấp cho người lái xe mô tô ba bánh và các loại xe quy định cho giấy phép lái xe hạng A1;\n\nd) Hạng B cấp cho người lái xe ô tô chở người đến 08 chỗ (không kể chỗ của người lái xe); xe ô tô tải và ô tô chuyên dùng có khối lượng toàn bộ theo thiết kế đến 3.500 kg; các loại xe ô tô quy định cho giấy phép lái xe hạng B kéo rơ moóc có khối lượng toàn bộ theo thiết kế đến 750 kg; \n\nđ) Hạng C1 cấp cho người lái xe ô tô tải và ô tô chuyên dùng có khối lượng toàn bộ theo thiết kế trên 3.500 kg đến 7.500 kg; các loại xe ô tô tải quy định cho giấy phép lái xe hạng C1 kéo rơ moóc có khối lượng toàn bộ theo thiết kế đến 750 kg; các loại xe quy định cho giấy phép lái xe hạng B;\n\ne) Hạng C cấp cho người lái xe ô tô tải và ô tô chuyên dùng có khối lượng toàn bộ theo thiết kế trên 7.500 kg; các loại xe ô tô tải quy định cho giấy phép lái xe hạng C kéo rơ moóc có khối lượng toàn bộ theo thiết kế đến 750 kg; các loại xe quy định cho giấy phép lái xe hạng B và hạng C1;\n\ng) Hạng D1 cấp cho người lái xe ô tô chở người trên 08 chỗ (không kể chỗ của người lái xe) đến 16 chỗ (không kể chỗ của người lái xe); các loại xe ô tô chở người quy định cho giấy phép lái xe hạng D1 kéo rơ moóc có khối lượng toàn bộ theo thiết kế đến 750 kg; các loại xe quy định cho giấy phép lái xe các hạng B, C1, C;\n\nh) Hạng D2 cấp cho người lái xe ô tô chở người (kể cả xe buýt) trên 16 chỗ (không kể chỗ của người lái xe) đến 29 chỗ (không kể chỗ của người lái xe); các loại xe ô tô chở người quy định cho giấy phép lái xe hạng D2 kéo rơ moóc có khối lượng toàn bộ theo thiết kế đến 750 kg; các loại xe quy định cho giấy phép lái xe các hạng B, C1, C, D1;\n\ni) Hạng D cấp cho người lái xe ô tô chở người (kể cả xe buýt) trên 29 chỗ (không kể chỗ của người lái xe); xe ô tô chở người giường nằm; các loại xe ô tô chở người quy định cho giấy phép lái xe hạng D kéo rơ moóc có khối lượng toàn bộ theo thiết kế đến 750 kg; các loại xe quy định cho giấy phép lái xe các hạng B, C1, C, D1, D2;\n\nk) Hạng BE cấp cho người lái các loại xe ô tô quy định cho giấy phép lái xe hạng B kéo rơ moóc có khối lượng toàn bộ theo thiết kế trên 750 kg;\n\nl) Hạng C1E cấp cho người lái các loại xe ô tô quy định cho giấy phép lái xe hạng C1 kéo rơ moóc có khối lượng toàn bộ theo thiết kế trên 750 kg;\n\nm) Hạng CE cấp cho người lái các loại xe ô tô quy định cho giấy phép lái xe hạng C kéo rơ moóc có khối lượng toàn bộ theo thiết kế trên 750 kg; xe ô tô đầu kéo kéo sơ mi rơ moóc;\n\nn) Hạng D1E cấp cho người lái các loại xe ô tô quy định cho giấy phép lái xe hạng D1 kéo rơ moóc có khối lượng toàn bộ theo thiết kế trên 750 kg;\n\no) Hạng D2E cấp cho người lái các loại xe ô tô quy định cho giấy phép lái xe hạng D2 kéo rơ moóc có khối lượng toàn bộ theo thiết kế trên 750 kg;\n\np) Hạng DE cấp cho người lái các loại xe ô tô quy định cho giấy phép lái xe hạng D kéo rơ moóc có khối lượng toàn bộ theo thiết kế trên 750 kg; xe ô tô chở khách nối toa.\n\n2. Người khuyết tật điều khiển xe mô tô ba bánh dùng cho người khuyết tật được cấp giấy phép lái xe hạng A1.\n\nNgười khuyết tật điều khiển xe ô tô số tự động có kết cấu phù hợp với tình trạng khuyết tật thì được cấp giấy phép lái xe hạng B.\n\n3. Người điều khiển xe chở hàng bốn bánh có gắn động cơ, xe chở người bốn bánh có gắn động cơ phải sử dụng giấy phép lái xe có hạng phù hợp với xe ô tô tải hoặc xe ô tô chở người tương ứng.\n\n4. Người điều khiển xe ô tô có thiết kế, cải tạo với số chỗ ít hơn xe cùng loại, kích thước giới hạn tương đương phải sử dụng giấy phép lái xe có hạng phù hợp với xe ô tô cùng loại, kích thước giới hạn tương đương và có số chỗ nhiều nhất.\n\n5. Thời hạn của giấy phép lái xe được quy định như sau:\n\na) Giấy phép lái xe các hạng A1, A, B1 không thời hạn;\n\nb) Giấy phép lái xe hạng B và hạng C1 có thời hạn 10 năm kể từ ngày cấp;\n\nc) Giấy phép lái xe các hạng C, D1, D2, D, BE, C1E, CE, D1E, D2E và DE có thời hạn 05 năm kể từ ngày cấp.\n\n6. Giấy phép lái xe có giá trị sử dụng trong phạm vi lãnh thổ Việt Nam bao gồm:\n\na) Giấy phép lái xe do cơ quan có thẩm quyền của Việt Nam cấp;\n\nb) Giấy phép lái xe quốc tế và giấy phép lái xe quốc gia phù hợp với loại xe được phép điều khiển do quốc gia là thành viên của Công ước của Liên hợp quốc về Giao thông đường bộ năm 1968 (sau đây gọi là Công ước Viên) cấp;\n\nc) Giấy phép lái xe phù hợp với loại xe được phép điều khiển của nước hoặc vùng lãnh thổ mà Việt Nam ký kết điều ước quốc tế hoặc thỏa thuận quốc tế công nhận giấy phép lái xe của nhau;\n\nd) Giấy phép lái xe nước ngoài phù hợp với loại xe được phép điều khiển do quốc gia được công nhận theo điều ước quốc tế mà nước Cộng hòa xã hội chủ nghĩa Việt Nam là thành viên.\n\n7. Giấy phép lái xe không có hiệu lực trong các trường hợp sau đây:\n\na) Giấy phép lái xe hết thời hạn sử dụng;\n\nb) Giấy phép lái xe bị thu hồi theo quy định tại khoản 5 Điều 62 của Luật này.\n\n8. Giấy phép lái xe quốc tế được quy định như sau:\n\na) Giấy phép lái xe quốc tế là giấy phép lái xe do cơ quan nhà nước có thẩm quyền của quốc gia là thành viên của Công ước Viên cấp theo một mẫu thống nhất; có thời hạn không quá 03 năm kể từ ngày cấp và phải phù hợp với thời hạn còn hiệu lực của giấy phép lái xe quốc gia;', '8. Ủy ban nhân dân các cấp, trong phạm vi nhiệm vụ, quyền hạn của mình, thực hiện quản lý nhà nước về trật tự, an toàn giao thông đường bộ tại địa phương.\n\nChương IX\n\nĐIỀU KHOẢN THI HÀNH\n\nĐiều 88. Hiệu lực thi hành\n\n1. Luật này có hiệu lực thi hành từ ngày 01 tháng 01 năm 2025, trừ trường hợp quy định tại khoản 2 Điều này.\n\n2. Khoản 3 Điều 10 của Luật này có hiệu lực thi hành từ ngày 01 tháng 01 năm 2026.\n\n3. Luật Giao thông đường bộ số 23/2008/QH12 đã được sửa đổi, bổ sung một số điều theo Luật số 35/2018/QH14 và Luật số 44/2019/QH14 hết hiệu lực kể từ ngày Luật này có hiệu lực thi hành, trừ trường hợp quy định tại các khoản 1, 2, 5 và 6 Điều 89 của Luật này.\n\n4. Nghị quyết số 73/2022/QH15 của Quốc hội về thí điểm đấu giá biển số xe ô tô hết hiệu lực kể từ ngày Luật này có hiệu lực thi hành, trừ trường hợp quy định tại khoản 7 Điều 89 của Luật này.\n\nĐiều 89. Quy định chuyển tiếp\n\n1. Giấy phép lái xe được cấp trước ngày Luật này có hiệu lực thi hành được tiếp tục sử dụng theo thời hạn ghi trên giấy phép lái xe. \n\n2. Giấy phép lái xe được cấp trước ngày Luật này có hiệu lực thi hành nếu chưa thực hiện đổi, cấp lại theo quy định của Luật này có hiệu lực sử dụng như sau:\n\na) Giấy phép lái xe hạng A1 được tiếp tục điều khiển xe mô tô hai bánh có dung tích xi-lanh từ 50 cm3\xa0đến dưới 175 cm3 hoặc có công suất động cơ điện từ 04 kW đến dưới 14 kW;\n\nb) Giấy phép lái xe hạng A2 được tiếp tục điều khiển xe mô tô hai bánh có dung tích xi-lanh từ 175 cm3\xa0trở lên hoặc có công suất động cơ điện từ 14 kW trở lên và các loại xe quy định cho giấy phép lái xe hạng A1 quy định tại điểm a khoản này;\n\nc) Giấy phép lái xe hạng A3 được tiếp tục điều khiển xe mô tô ba bánh, các loại xe quy định cho giấy phép lái xe hạng A1 quy định tại điểm a khoản này và các xe tương tự;\n\nd) Giấy phép lái xe hạng A4 được tiếp tục điều khiển máy kéo có trọng tải đến 1.000 kg;\n\nđ) Giấy phép lái xe hạng B1 số tự động cấp cho người không hành nghề lái xe được tiếp tục điều khiển xe ô tô số tự động chở người đến 08 chỗ (không kể chỗ của người lái xe); xe ô tô tải, kể cả ô tô tải chuyên dùng số tự động có trọng tải dưới 3.500 kg;\n\ne) Giấy phép lái xe hạng B1 cấp cho người không hành nghề lái xe được tiếp tục điều khiển xe ô tô chở người đến 08 chỗ (không kể chỗ của người lái xe); xe ô tô tải, máy kéo có trọng tải dưới 3.500 kg;\n\ng) Giấy phép lái xe hạng B2 cấp cho người hành nghề lái xe được tiếp tục điều khiển xe ô tô chở người đến 08 chỗ (không kể chỗ của người lái xe); xe ô tô tải, máy kéo có trọng tải dưới 3.500 kg;\n\nh) Giấy phép lái xe hạng C được tiếp tục điều khiển xe ô tô tải, máy kéo có trọng tải từ 3.500 kg trở lên và các loại xe quy định cho các giấy phép lái xe hạng B1, B2 quy định tại các điểm đ, e và g khoản này;\n\ni) Giấy phép lái xe hạng D được tiếp tục điều khiển xe ô tô chở người từ 09 chỗ (không kể chỗ của người lái xe) đến 29 chỗ (không kể chỗ của người lái xe) và các loại xe quy định cho các giấy phép lái xe hạng B1, B2, C quy định tại các điểm đ, e, g và h khoản này;\n\nk) Giấy phép lái xe hạng E được tiếp tục điều khiển xe ô tô chở người trên 29 chỗ (không kể chỗ của người lái xe) và các loại xe quy định cho các giấy phép lái xe hạng B1, B2, C, D quy định tại các điểm đ, e, g, h và i khoản này;\n\nl) Giấy phép lái xe hạng FB2, FD được tiếp tục điều khiển các loại xe quy định cho giấy phép lái xe hạng B2, D quy định tại điểm g và điểm i khoản này khi kéo rơ moóc; giấy phép lái xe hạng FC được tiếp tục điều khiển các loại xe quy định cho giấy phép lái xe hạng C quy định tại điểm h khoản này khi kéo rơ moóc, đầu kéo kéo sơ mi rơ moóc; giấy phép lái xe hạng FE được tiếp tục điều khiển các loại xe quy định cho giấy phép lái xe hạng E quy định tại điểm k khoản này khi kéo rơ moóc\xa0hoặc xe ô tô chở khách nối toa.\n\n3. Trường hợp người có giấy phép lái xe đã được cấp trước ngày Luật này có hiệu lực thi hành có nhu cầu đổi, cấp lại giấy phép lái xe thì thực hiện như sau:\n\na) Giấy phép lái xe hạng A1 được đổi, cấp lại sang giấy phép lái xe hạng A với điều kiện hạn chế là chỉ được điều khiển xe mô tô hai bánh có dung tích xi-lanh đến dưới 175 cm3 hoặc có công suất động cơ điện đến dưới 14 kW;\n\nb) Giấy phép lái xe hạng A2 được đổi, cấp lại sang giấy phép lái xe hạng A;\n\nc) Giấy phép lái xe hạng A3 được đổi, cấp lại sang giấy phép lái xe hạng B1;\n\nd) Giấy phép lái xe hạng A4 được đổi, cấp lại sang chứng chỉ điều khiển xe máy chuyên dùng cho người điều khiển máy kéo có trọng tải đến 1.000 kg và chứng chỉ bồi dưỡng kiến thức pháp luật về giao thông đường bộ cho người điều khiển xe máy chuyên dùng;\n\nđ) Giấy phép lái xe hạng B1 số tự động được đổi, cấp lại sang giấy phép lái xe hạng B với điều kiện hạn chế là chỉ được điều khiển xe ô tô số tự động;\n\ne) Giấy phép lái xe hạng B1, B2 được đổi, cấp lại sang giấy phép lái xe hạng B hoặc hạng C1 và chứng chỉ điều khiển xe máy chuyên dùng cho người điều khiển máy kéo có trọng tải đến 3.500 kg;\n\ng) Giấy phép lái xe hạng C giữ nguyên và đổi, cấp lại cùng hạng và chứng chỉ điều khiển xe máy chuyên dùng cho người điều khiển máy kéo có trọng tải trên 3.500 kg;\n\nh) Giấy phép lái xe hạng D được đổi, cấp lại sang giấy phép lái xe hạng D2 và chứng chỉ điều khiển xe máy chuyên dùng cho người điều khiển máy kéo có trọng tải trên 3.500 kg;\n\ni) Giấy phép lái xe hạng E được đổi, cấp lại sang giấy phép lái xe hạng D và chứng chỉ điều khiển xe máy chuyên dùng cho người điều khiển máy kéo có trọng tải trên 3.500 kg;\n\nk) Giấy phép lái xe hạng FB2 được đổi, cấp lại sang giấy phép lái xe hạng BE hoặc hạng C1E và chứng chỉ điều khiển xe máy chuyên dùng cho người điều khiển máy kéo có trọng tải đến 3.500 kg;\n\nl) Giấy phép lái xe hạng FC được đổi, cấp lại sang giấy phép lái xe hạng CE và chứng chỉ điều khiển xe máy chuyên dùng cho người điều khiển máy kéo có trọng tải trên 3.500 kg;\n\nm) Giấy phép lái xe hạng FD được đổi, cấp lại sang giấy phép lái xe hạng D2E và chứng chỉ điều khiển xe máy chuyên dùng cho người điều khiển máy kéo có trọng tải trên 3.500 kg;\n\nn) Giấy phép lái xe hạng FE được đổi, cấp lại sang giấy phép lái xe hạng DE và chứng chỉ điều khiển xe máy chuyên dùng cho người điều khiển máy kéo có trọng tải trên 3.500 kg.\n\n4. Người học lái xe đã được đào tạo lái xe trước ngày Luật này có hiệu lực thi hành hoặc đang được đào tạo lái xe tại ngày Luật này có hiệu lực thi hành chưa được sát hạch, cấp giấy phép lái xe thì được sát hạch, cấp giấy phép lái xe theo hạng giấy phép lái xe đổi, cấp lại quy định tại khoản 3 Điều này.\n\n5. Chứng nhận đăng ký xe, biển số xe máy chuyên dùng cấp trước ngày Luật này có hiệu lực thi hành vẫn có giá trị sử dụng.\n\n6. Chứng nhận chất lượng an toàn kỹ thuật và bảo vệ môi trường được cấp trước ngày Luật này có hiệu lực thi hành thì có giá trị sử dụng đến hết thời hạn ghi trên giấy chứng nhận đó.\n\n7. Việc đấu giá biển số xe ô tô được thực hiện trước ngày Luật này có hiệu lực thi hành và đến ngày Luật này có hiệu lực thi hành đã được cấp văn bản xác nhận biển số xe ô tô trúng đấu giá thì tiếp tục thực hiện theo Nghị quyết số 73/2022/QH15 của Quốc hội về thí điểm đấu giá biển số xe ô tô; trường hợp chưa được cấp xác nhận biển số xe ô tô trúng đấu giá thì tiếp tục thực hiện theo Nghị quyết số 73/2022/QH15 của Quốc hội về thí điểm đấu giá biển số xe ô tô và quy định tại điểm d khoản 1 Điều 38 của Luật này./.\n\nLuật này được Quốc hội nước Cộng hòa xã hội chủ nghĩa Việt Nam khóa XV, kỳ họp thứ 7 thông qua ngày 27 tháng 6 năm 2024.\n\nE-pas: 60179 CHỦ TỊCH QUỐC HỘI\n\n\n\n\nTrần Thanh Mẫn', '7. In, phát hành và quản lý việc sử dụng phôi chứng chỉ cho người điều khiển xe máy chuyên dùng thuộc phạm vi quản lý của Bộ Quốc phòng để thống nhất trong toàn quân.\n\n8. Kiểm tra, phúc tra công tác bồi dưỡng kiến thức pháp luật về giao thông đường bộ, cấp chứng chỉ cho người điều khiển xe máy chuyên dùng thuộc phạm vi quản lý của Bộ Quốc phòng.\n\nĐiều 57. Trách nhiệm của cơ quan xe - máy hoặc cơ quan xe máy - vận tải các đơn vị\n\n1. Chịu sự chỉ đạo của Cục Xe máy - Vận tải/Tổng cục Hậu cần - Kỹ thuật về nghiệp vụ đào tạo lái xe quân sự và bồi dưỡng kiến thức pháp luật về giao thông đường bộ cho người điều khiển xe máy chuyên dùng.\n\n2. Quản lý, chỉ đạo, hướng dẫn và kiểm tra cơ sở đào tạo lái xe quân sự; cơ sở bồi dưỡng kiến thức pháp luật về giao thông đường bộ cùng cấp về việc thực hiện nội dung, chương trình, quy chế đào tạo; nghiệp vụ quản lý xe - máy và thực hiện các chế độ theo quy định.\n\n3. Tham gia các đợt kiểm tra, giám sát cơ sở đào tạo lái xe; cơ sở bồi dưỡng kiến thức pháp luật về giao thông đường bộ theo kế hoạch.\n\n4. Đề nghị cấp, đổi, cấp lại Giấy phép xe quân sự cho quân nhân, công chức quốc phòng, công nhân và viên chức quốc phòng, lao động hợp đồng theo quy định tại Thông tư này.\n\n5. Báo cáo nhu cầu, tiếp nhận, quản lý việc sử dụng phôi chứng chỉ tại cơ sở bồi dưỡng kiến thức pháp luật về giao thông đường bộ thuộc phạm vi đơn vị.\n\nĐiều 58. Trách nhiệm của cơ sở đào tạo\n\n1. Chịu sự chỉ đạo của Cục Xe máy - Vận tải/Tổng cục Hậu cần - Kỹ thuật và cơ quan xe - máy hoặc cơ quan xe máy - vận tải cấp trên về nghiệp vụ đào tạo lái xe quân sự và bồi dưỡng kiến thức pháp luật về giao thông đường bộ cho người điều khiển xe máy chuyên dùng.\n\n2. Bảo đảm đủ cơ sở vật chất, trang bị, phương tiện kỹ thuật đáp ứng yêu cầu nhiệm vụ, nâng cao chất lượng đào tạo, sát hạch lái xe và quản lý, rèn luyện học viên theo Quy chế quản lý học viên quân sự trong nhà trường Quân đội, Điều lệnh quản lý bộ đội và Điều lệ công tác nhà trường Quân đội nhân dân Việt Nam.\n\n3. Thực hiện đúng quy định quản lý, sử dụng trang bị xe - máy thực hiện nhiệm vụ đào tạo, sát hạch lái xe quân sự. Đề nghị cấp giấy phép dạy lái xe cho giáo viên đủ điều kiện, giấy phép xe tập lái, biển “Tập lái” đúng quy định.\n\n4. Quản lý, lưu trữ hồ sơ đào tạo, sát hạch lái xe và bồi dưỡng kiến thức pháp luật về giao thông đường bộ cho người điều khiển xe máy chuyên dùng thuộc phạm vi quản lý của Bộ Quốc phòng theo quy định tại Thông tư này.\n\n5. Đề xuất với Cục Xe máy - Vận tải/Tổng cục Hậu cần - Kỹ thuật và các cơ quan liên quan giải pháp nâng cao chất lượng công tác đào tạo, sát hạch lái xe quân sự và bồi dưỡng kiến thức pháp luật về giao thông đường bộ cho người điều khiển xe máy chuyên dùng thuộc phạm vi quản lý của Bộ Quốc phòng.\n\nĐiều 59. Trách nhiệm của cá nhân trong quản lý, sử dụng Giấy phép lái xe quân sự\n\n1. Người được giao nhiệm vụ điều khiển xe quân sự phải có Giấy phép lái xe quân sự.\n\n2. Người có Giấy phép lái xe quân sự được phép điều khiển những loại xe quy định cho từng hạng ghi trên Giấy phép lái xe quân sự.\n\n3. Giấy phép lái xe quân sự phải được mang theo khi lái xe; có trách nhiệm giữ gìn, sử dụng đúng mục đích. Khi mất hoặc phát hiện có sai lệch thông tin ghi trên Giấy phép lái xe quân sự phải báo cáo kịp thời với các cơ quan chức năng để xem xét, giải quyết theo quy định.\n\nChương VI\n\nĐIỀU KHOẢN THI HÀNH\n\nĐiều 60. Hiệu lực thi hành\n\n1. Thông tư này có hiệu lực kể từ ngày 01 tháng 01 năm 2025.\n\n2. Kể từ ngày Thông tư này có hiệu lực thi hành, các Thông tư sau hết hiệu lực thi hành:\n\na) Thông tư số 170/2021/TT-BQP ngày 23 tháng 12 năm 2021 của Bộ trưởng Bộ Quốc phòng quy định về đào tạo, sát hạch, cấp Giấy phép lái xe quân sự; bồi dưỡng kiến thức pháp luật về giao thông đường bộ cho người điều khiển xe máy chuyên dùng trong Bộ Quốc phòng;\n\nb) Thông tư số 86/2023/TT-BQP ngày 20 tháng 11 năm 2023 của Bộ trưởng Bộ Quốc phòng sửa đổi, bổ sung một số điều của Thông tư số 170/2021/TT-BQP ngày 23 tháng 12 năm 2021 của Bộ trưởng Bộ Quốc phòng về đào tạo, sát hạch, cấp Giấy phép lái xe quân sự; bồi dưỡng kiến thức pháp luật về giao thông đường bộ cho người điều khiển xe máy chuyên dùng trong Bộ Quốc phòng.\n\n3. Trường hợp văn bản viện dẫn trong Thông tư này được sửa đổi, bổ sung hoặc thay thế thì áp dụng theo văn bản sửa đổi, bổ sung hoặc thay thế.\n\nĐiều 61. Quy định chuyển tiếp\n\n1. Giấy phép lái xe quân sự được cấp trước ngày Thông tư này có hiệu lực thi hành được tiếp tục sử dụng theo thời hạn ghi trên giấy phép lái xe.\n\n2. Giấy phép lái xe quân sự được cấp trước ngày Thông tư này có hiệu lực thi hành nếu chưa thực hiện đổi, cấp lại theo quy định của Thông tư này có hiệu lực sử dụng như sau:\n\na) Giấy phép lái xe quân sự hạng A1 được tiếp tục điều khiển xe mô tô hai bánh có dung tích xi-lanh từ 50 cm3 đến dưới 175 cm3 hoặc có công suất động cơ điện từ 04 kW đến dưới 14 kW;\n\nb) Giấy phép lái xe quân sự hạng A2 được tiếp tục điều khiển xe mô tô hai bánh có dung tích xi-lanh từ 175 cm3 trở lên hoặc có công suất động cơ điện từ 14 kW trở lên và các loại xe quy định cho Giấy phép lái xe hạng A1 quy định tại điểm a khoản này;\n\nc) Giấy phép lái xe quân sự hạng A3 được tiếp tục điều khiển xe mô tô ba bánh, các loại xe quy định cho Giấy phép lái xe hạng A1 quy định tại điểm a khoản này và các xe tương tự;\n\nd) Giấy phép lái xe quân sự hạng B2 được tiếp tục điều khiển xe ô tô chở người đến 08 chỗ (không kể chỗ của người lái xe); xe ô tô tải, máy kéo có trọng tải dưới 3.500 kg; các loại xe ô tô quy định cho Giấy phép lái xe hạng B kéo theo một rơ moóc hoặc vũ khí, khí tài quân sự dạng rơ moóc có khối lượng toàn bộ theo thiết kế đến 750 kg;\n\nđ) Giấy phép lái xe quân sự hạng C được tiếp tục điều khiển xe ô tô tải, máy kéo có trọng tải từ 3.500 kg trở lên và các loại xe quy định cho các Giấy phép lái xe hạng B2 quy định tại điểm d khoản này; các loại xe ô tô quy định cho Giấy phép lái xe hạng C kéo theo một rơ moóc hoặc vũ khí, khí tài quân sự dạng rơ moóc có khối lượng toàn bộ theo thiết kế đến 750 kg;\n\ne) Giấy phép lái xe quân sự hạng D được tiếp tục điều khiển xe ô tô chở người từ 09 chỗ (không kể chỗ của người lái xe) đến 29 chỗ (không kể chỗ của người lái xe) và các loại xe quy định cho các Giấy phép lái xe hạng B2, C quy định tại các điểm d, đ khoản này; các loại xe ô tô quy định cho Giấy phép lái xe hạng D2 kéo theo một rơ moóc hoặc vũ khí, khí tài quân sự dạng rơ moóc có khối lượng toàn bộ theo thiết kế đến 750 kg;\n\ng) Giấy phép lái xe quân sự hạng E được tiếp tục điều khiển xe ô tô chở người trên 29 chỗ (không kể chỗ của người lái xe) và các loại xe quy định cho các giấy phép lái xe hạng B2, C, D quy định tại các điểm d, đ và e khoản này; các loại ô tô quy định cho Giấy phép lái xe hạng D kéo theo một rơ moóc hoặc vũ khí, khí tài quân sự dạng rơ moóc có khối lượng toàn bộ theo thiết kế đến 750 kg;\n\nh) Giấy phép lái xe quân sự hạng FC được tiếp tục điều khiển các loại xe quy định cho Giấy phép lái xe hạng C quy định tại điểm đ khoản này khi kéo rơ moóc, khí tài quân sự dạng rơ moóc và ô tô đầu kéo kéo sơ mi rơ moóc, khí tài quân sự dạng sơ mi rơ moóc;\n\ni) Giấy phép lái xe quân sự hạng FX được tiếp tục điều khiển xe xích kéo vũ khí, khí tài quân sự và các loại xe quy định cho Giấy phép lái xe hạng C quy định tại điểm đ khoản này.\n\n3. Trường hợp người có Giấy phép, lái xe quân sự đã được cấp trước ngày Thông tư này có hiệu lực thi hành khi đổi, cấp lại giấy phép lái xe thì thực hiện như sau:\n\na) Giấy phép lái xe quân sự hạng A1 được đổi, cấp lại sang Giấy phép lái xe quân sự hạng A với điều kiện hạn chế là chỉ được điều khiển xe mô tô hai bánh có dung tích xi-lanh đến dưới 175 cm3 hoặc có công suất động cơ điện đến dưới 14 kW;\n\nb) Giấy phép lái xe quân sự hạng A2 được đổi, cấp lại sang Giấy phép lái xe quân sự hạng A;\n\nc) Giấy phép lái xe quân sự hạng A3 được đổi, cấp lại sang Giấy phép lái xe quân sự hạng B1;\n\nd) Giấy phép lái xe quân sự hạng B2 được đổi, cấp lại sang Giấy phép lái xe quân sự hạng B hoặc hạng C1;\n\nđ) Giấy phép lái xe quân sự hạng C giữ nguyên và đổi, cấp lại cùng hạng;']","**Nguồn văn bản:** /content/drive/MyDrive/ITProject_data/new_law/36_2024_QH15_444251.docx

**Tên văn bản:** Không có tiêu đề trong context

**Điều 57:** Giấy phép lái xe

**Nội dung:**

1. Giấy phép lái xe bao gồm các hạng sau đây:

    k) Hạng BE cấp cho người lái các loại xe ô tô quy định cho giấy phép lái xe hạng B kéo rơ moóc có khối lượng toàn bộ theo thiết kế trên 750 kg;


Tóm lại: Giấy phép lái xe hạng BE được phép lái các loại xe ô tô quy định cho giấy phép lái xe hạng B kéo rơ moóc có khối lượng toàn bộ theo thiết kế trên 750 kg.
",Hạng BE cho phép lái xe ô tô chở người đến 9 chỗ ngồi kéo rơ moóc có trọng tải trên 750 kg.,1.0,0.829866691546021,0.0,0.9999999999
6,Giấy phép lái xe hạng C1E cho phép lái những loại xe nào?,"['a) Chứng nhận đăng ký xe hoặc bản sao Chứng nhận đăng ký xe có chứng thực kèm bản gốc giấy tờ xác nhận của tổ chức tín dụng, chi nhánh ngân hàng nước ngoài còn hiệu lực trong trường hợp xe đang được thế chấp tại tổ chức tín dụng, chi nhánh ngân hàng nước ngoài;\n\nb) Giấy phép lái xe phù hợp với loại xe đang điều khiển;\n\nc) Chứng nhận kiểm định an toàn kỹ thuật và bảo vệ môi trường đối với xe cơ giới theo quy định của pháp luật;\n\nd) Chứng nhận bảo hiểm bắt buộc trách nhiệm dân sự của chủ xe cơ giới.\n\n2. Người điều khiển xe máy chuyên dùng tham gia giao thông đường bộ phải đủ tuổi, sức khỏe theo quy định của pháp luật; có bằng hoặc chứng chỉ điều khiển xe máy chuyên dùng phù hợp loại xe máy chuyên dùng đang điều khiển; có giấy phép lái xe đang còn điểm, còn hiệu lực hoặc chứng chỉ bồi dưỡng kiến thức pháp luật về giao thông đường bộ. Khi tham gia giao thông đường bộ, người điều khiển xe máy chuyên dùng phải mang theo các loại giấy tờ sau đây:\n\na) Chứng nhận đăng ký xe hoặc bản sao Chứng nhận đăng ký xe có chứng thực kèm bản gốc Giấy biên nhận còn hiệu lực của tổ chức tín dụng, chi nhánh ngân hàng nước ngoài trong trường hợp xe đang được thế chấp tại tổ chức tín dụng, chi nhánh ngân hàng nước ngoài;\n\nb) Bằng hoặc chứng chỉ điều khiển xe máy chuyên dùng;\n\nc) Giấy phép lái xe hoặc chứng chỉ bồi dưỡng kiến thức pháp luật về giao thông đường bộ;\n\nd) Chứng nhận kiểm định an toàn kỹ thuật và bảo vệ môi trường đối với xe máy chuyên dùng theo quy định của pháp luật;\n\nđ) Chứng nhận bảo hiểm bắt buộc trách nhiệm dân sự theo quy định của pháp luật.\n\n3. Trường hợp giấy tờ quy định tại khoản 1 và khoản 2 Điều này đã được tích hợp vào tài khoản định danh điện tử thì việc xuất trình, kiểm tra có thể thực hiện thông qua tài khoản định danh điện tử.\n\n4. Người lái xe gắn máy tham gia giao thông đường bộ phải hiểu biết quy tắc giao thông đường bộ, có kỹ năng điều khiển phương tiện; đủ điều kiện về độ tuổi, sức khỏe theo quy định tại điểm a khoản 1 và khoản 2 Điều 59 của Luật này.\n\n5. Người tập lái xe ô tô, người dự sát hạch lái xe ô tô khi tham gia giao thông đường bộ phải thực hành trên xe tập lái, xe sát hạch trên tuyến đường tập lái, tuyến đường sát hạch, có giáo viên dạy lái hoặc sát hạch viên bảo trợ tay lái. Giáo viên dạy lái, sát hạch viên phải mang theo các loại giấy tờ quy định tại khoản 1 Điều này.\n\nĐiều 57. Giấy phép lái xe\n\n1. Giấy phép lái xe bao gồm các hạng sau đây:\n\na) Hạng A1 cấp cho người lái xe mô tô hai bánh có dung tích xi-lanh đến 125 cm3 hoặc có công suất động cơ điện đến 11 kW;\n\nb) Hạng A cấp cho người lái xe mô tô hai bánh có dung tích xi-lanh\xa0 trên 125 cm3\xa0hoặc có công suất động cơ điện trên 11 kW và các loại xe quy định cho giấy phép lái xe hạng A1;\n\nc) Hạng B1 cấp cho người lái xe mô tô ba bánh và các loại xe quy định cho giấy phép lái xe hạng A1;\n\nd) Hạng B cấp cho người lái xe ô tô chở người đến 08 chỗ (không kể chỗ của người lái xe); xe ô tô tải và ô tô chuyên dùng có khối lượng toàn bộ theo thiết kế đến 3.500 kg; các loại xe ô tô quy định cho giấy phép lái xe hạng B kéo rơ moóc có khối lượng toàn bộ theo thiết kế đến 750 kg; \n\nđ) Hạng C1 cấp cho người lái xe ô tô tải và ô tô chuyên dùng có khối lượng toàn bộ theo thiết kế trên 3.500 kg đến 7.500 kg; các loại xe ô tô tải quy định cho giấy phép lái xe hạng C1 kéo rơ moóc có khối lượng toàn bộ theo thiết kế đến 750 kg; các loại xe quy định cho giấy phép lái xe hạng B;\n\ne) Hạng C cấp cho người lái xe ô tô tải và ô tô chuyên dùng có khối lượng toàn bộ theo thiết kế trên 7.500 kg; các loại xe ô tô tải quy định cho giấy phép lái xe hạng C kéo rơ moóc có khối lượng toàn bộ theo thiết kế đến 750 kg; các loại xe quy định cho giấy phép lái xe hạng B và hạng C1;\n\ng) Hạng D1 cấp cho người lái xe ô tô chở người trên 08 chỗ (không kể chỗ của người lái xe) đến 16 chỗ (không kể chỗ của người lái xe); các loại xe ô tô chở người quy định cho giấy phép lái xe hạng D1 kéo rơ moóc có khối lượng toàn bộ theo thiết kế đến 750 kg; các loại xe quy định cho giấy phép lái xe các hạng B, C1, C;\n\nh) Hạng D2 cấp cho người lái xe ô tô chở người (kể cả xe buýt) trên 16 chỗ (không kể chỗ của người lái xe) đến 29 chỗ (không kể chỗ của người lái xe); các loại xe ô tô chở người quy định cho giấy phép lái xe hạng D2 kéo rơ moóc có khối lượng toàn bộ theo thiết kế đến 750 kg; các loại xe quy định cho giấy phép lái xe các hạng B, C1, C, D1;\n\ni) Hạng D cấp cho người lái xe ô tô chở người (kể cả xe buýt) trên 29 chỗ (không kể chỗ của người lái xe); xe ô tô chở người giường nằm; các loại xe ô tô chở người quy định cho giấy phép lái xe hạng D kéo rơ moóc có khối lượng toàn bộ theo thiết kế đến 750 kg; các loại xe quy định cho giấy phép lái xe các hạng B, C1, C, D1, D2;\n\nk) Hạng BE cấp cho người lái các loại xe ô tô quy định cho giấy phép lái xe hạng B kéo rơ moóc có khối lượng toàn bộ theo thiết kế trên 750 kg;\n\nl) Hạng C1E cấp cho người lái các loại xe ô tô quy định cho giấy phép lái xe hạng C1 kéo rơ moóc có khối lượng toàn bộ theo thiết kế trên 750 kg;\n\nm) Hạng CE cấp cho người lái các loại xe ô tô quy định cho giấy phép lái xe hạng C kéo rơ moóc có khối lượng toàn bộ theo thiết kế trên 750 kg; xe ô tô đầu kéo kéo sơ mi rơ moóc;\n\nn) Hạng D1E cấp cho người lái các loại xe ô tô quy định cho giấy phép lái xe hạng D1 kéo rơ moóc có khối lượng toàn bộ theo thiết kế trên 750 kg;\n\no) Hạng D2E cấp cho người lái các loại xe ô tô quy định cho giấy phép lái xe hạng D2 kéo rơ moóc có khối lượng toàn bộ theo thiết kế trên 750 kg;\n\np) Hạng DE cấp cho người lái các loại xe ô tô quy định cho giấy phép lái xe hạng D kéo rơ moóc có khối lượng toàn bộ theo thiết kế trên 750 kg; xe ô tô chở khách nối toa.\n\n2. Người khuyết tật điều khiển xe mô tô ba bánh dùng cho người khuyết tật được cấp giấy phép lái xe hạng A1.\n\nNgười khuyết tật điều khiển xe ô tô số tự động có kết cấu phù hợp với tình trạng khuyết tật thì được cấp giấy phép lái xe hạng B.\n\n3. Người điều khiển xe chở hàng bốn bánh có gắn động cơ, xe chở người bốn bánh có gắn động cơ phải sử dụng giấy phép lái xe có hạng phù hợp với xe ô tô tải hoặc xe ô tô chở người tương ứng.\n\n4. Người điều khiển xe ô tô có thiết kế, cải tạo với số chỗ ít hơn xe cùng loại, kích thước giới hạn tương đương phải sử dụng giấy phép lái xe có hạng phù hợp với xe ô tô cùng loại, kích thước giới hạn tương đương và có số chỗ nhiều nhất.\n\n5. Thời hạn của giấy phép lái xe được quy định như sau:\n\na) Giấy phép lái xe các hạng A1, A, B1 không thời hạn;\n\nb) Giấy phép lái xe hạng B và hạng C1 có thời hạn 10 năm kể từ ngày cấp;\n\nc) Giấy phép lái xe các hạng C, D1, D2, D, BE, C1E, CE, D1E, D2E và DE có thời hạn 05 năm kể từ ngày cấp.\n\n6. Giấy phép lái xe có giá trị sử dụng trong phạm vi lãnh thổ Việt Nam bao gồm:\n\na) Giấy phép lái xe do cơ quan có thẩm quyền của Việt Nam cấp;\n\nb) Giấy phép lái xe quốc tế và giấy phép lái xe quốc gia phù hợp với loại xe được phép điều khiển do quốc gia là thành viên của Công ước của Liên hợp quốc về Giao thông đường bộ năm 1968 (sau đây gọi là Công ước Viên) cấp;\n\nc) Giấy phép lái xe phù hợp với loại xe được phép điều khiển của nước hoặc vùng lãnh thổ mà Việt Nam ký kết điều ước quốc tế hoặc thỏa thuận quốc tế công nhận giấy phép lái xe của nhau;\n\nd) Giấy phép lái xe nước ngoài phù hợp với loại xe được phép điều khiển do quốc gia được công nhận theo điều ước quốc tế mà nước Cộng hòa xã hội chủ nghĩa Việt Nam là thành viên.\n\n7. Giấy phép lái xe không có hiệu lực trong các trường hợp sau đây:\n\na) Giấy phép lái xe hết thời hạn sử dụng;\n\nb) Giấy phép lái xe bị thu hồi theo quy định tại khoản 5 Điều 62 của Luật này.\n\n8. Giấy phép lái xe quốc tế được quy định như sau:\n\na) Giấy phép lái xe quốc tế là giấy phép lái xe do cơ quan nhà nước có thẩm quyền của quốc gia là thành viên của Công ước Viên cấp theo một mẫu thống nhất; có thời hạn không quá 03 năm kể từ ngày cấp và phải phù hợp với thời hạn còn hiệu lực của giấy phép lái xe quốc gia;', 'a) Giấy phép lái xe hết thời hạn sử dụng;\n\nb) Giấy phép lái xe bị thu hồi theo quy định tại khoản 5 Điều 62 của Luật này.\n\n8. Giấy phép lái xe quốc tế được quy định như sau:\n\na) Giấy phép lái xe quốc tế là giấy phép lái xe do cơ quan nhà nước có thẩm quyền của quốc gia là thành viên của Công ước Viên cấp theo một mẫu thống nhất; có thời hạn không quá 03 năm kể từ ngày cấp và phải phù hợp với thời hạn còn hiệu lực của giấy phép lái xe quốc gia;\n\nb) Người có giấy phép lái xe quốc tế do quốc gia là thành viên của Công ước Viên cấp khi lái xe tham gia giao thông đường bộ trên lãnh thổ Việt Nam phải mang theo giấy phép lái xe quốc tế và giấy phép lái xe quốc gia được cấp phù hợp với hạng xe điều khiển, còn thời hạn sử dụng; phải tuân thủ pháp luật về trật tự, an toàn giao thông đường bộ của Việt Nam;\n\nc) Người có giấy phép lái xe quốc tế vi phạm pháp luật về trật tự, an toàn giao thông đường bộ của Việt Nam mà bị tước quyền sử dụng giấy phép lái xe có thời hạn thì thời gian bị tước quyền sử dụng không quá thời gian người lái xe được phép cư trú tại lãnh thổ Việt Nam;\n\nd) Người Việt Nam hoặc người nước ngoài có thẻ thường trú hoặc thẻ tạm trú tại Việt Nam có giấy phép lái xe do Việt Nam hoặc quốc gia là thành viên của điều ước quốc tế mà nước Cộng hòa xã hội chủ nghĩa Việt Nam là thành viên cấp, còn giá trị sử dụng, nếu có nhu cầu được cấp giấy phép lái xe quốc tế.\n\n9. Bộ trưởng Bộ Giao thông vận tải quy định mẫu giấy phép lái xe và giấy phép lái xe quốc tế, trình tự, thủ tục cấp và việc sử dụng giấy phép lái xe, giấy phép lái xe quốc tế; đối với mẫu giấy phép lái xe, trình tự, thủ tục cấp và việc sử dụng giấy phép lái xe của lực lượng quân đội, công an làm nhiệm vụ quốc phòng, an ninh do Bộ trưởng Bộ Quốc phòng, Bộ trưởng Bộ Công an quy định.\n\nĐiều 58. Điểm của giấy phép lái xe \n\n1. Điểm của giấy phép lái xe được dùng để quản lý việc chấp hành pháp luật về trật tự, an toàn giao thông đường bộ của người lái xe trên hệ thống cơ sở dữ liệu về trật tự, an toàn giao thông đường bộ, bao gồm 12 điểm. Số điểm trừ mỗi lần vi phạm tùy thuộc tính chất, mức độ của hành vi vi phạm pháp luật về trật tự, an toàn giao thông đường bộ. Dữ liệu về điểm trừ giấy phép lái xe của người vi phạm sẽ được cập nhật vào hệ thống cơ sở dữ liệu ngay sau khi quyết định xử phạt có hiệu lực thi hành và thông báo cho người bị trừ điểm giấy phép lái xe biết.\n\n2. Giấy phép lái xe chưa bị trừ hết điểm và không bị trừ điểm trong thời hạn 12 tháng từ ngày bị trừ điểm gần nhất thì được phục hồi đủ 12 điểm.\n\n3. Trường hợp giấy phép lái xe bị trừ hết điểm thì người có giấy phép lái xe không được điều khiển phương tiện tham gia giao thông đường bộ theo giấy phép lái xe đó. Sau thời hạn ít nhất là 06 tháng kể từ ngày bị trừ hết điểm, người có giấy phép lái xe được tham gia kiểm tra nội dung kiến thức pháp luật về trật tự, an toàn giao thông đường bộ theo quy định tại khoản 7 Điều 61 của Luật này do lực lượng Cảnh sát giao thông tổ chức, có kết quả đạt yêu cầu thì được phục hồi đủ 12 điểm.\n\n4. Giấy phép lái xe sau khi đổi, cấp lại, nâng hạng được giữ nguyên số điểm của giấy phép lái xe trước khi đổi, cấp lại, nâng hạng.\n\n5. Người có thẩm quyền xử phạt vi phạm hành chính có thẩm quyền trừ điểm giấy phép lái xe.\n\n6. Chính phủ quy định chi tiết khoản 1 Điều này; quy định trình tự, thủ tục, thẩm quyền trừ điểm, phục hồi điểm giấy phép lái xe; quy định lộ trình thực hiện Điều này. Bộ trưởng Bộ Công an quy định chi tiết khoản 3 Điều này.\n\nĐiều 59. Tuổi, sức khỏe của người điều khiển phương tiện tham gia giao thông đường bộ\n\n1. Độ tuổi của người lái xe, người điều khiển xe máy chuyên dùng được quy định như sau:\n\na) Người đủ 16 tuổi trở lên được điều khiển xe gắn máy;\n\nb) Người đủ 18 tuổi trở lên được cấp giấy phép lái xe hạng A1, A, B1, B, C1, được cấp chứng chỉ bồi dưỡng kiến thức pháp luật về giao thông đường bộ để điều khiển xe máy chuyên dùng tham gia giao thông đường bộ;\n\nc) Người đủ 21 tuổi trở lên được cấp giấy phép lái xe hạng C, BE;\n\nd) Người đủ 24 tuổi trở lên được cấp giấy phép lái xe hạng D1, D2, C1E, CE;\n\nđ) Người đủ 27 tuổi trở lên được cấp giấy phép lái xe hạng D, D1E, D2E, DE;\n\ne) Tuổi tối đa của người lái xe ô tô chở người (kể cả xe buýt) trên 29 chỗ (không kể chỗ của người lái xe), xe ô tô chở người giường nằm là đủ 57 tuổi đối với nam, đủ 55 tuổi đối với nữ.\n\n2. Người điều khiển phương tiện tham gia giao thông đường bộ phải bảo đảm điều kiện sức khỏe phù hợp với từng loại phương tiện được phép điều khiển. Bộ trưởng Bộ Y tế quy định về tiêu chuẩn sức khỏe, việc khám sức khỏe đối với người lái xe, người điều khiển xe máy chuyên dùng; việc khám sức khỏe định kỳ đối với người hành nghề lái xe ô tô; xây dựng cơ sở dữ liệu về sức khỏe của người lái xe, người điều khiển xe máy chuyên dùng.\n\n3. Bộ trưởng Bộ Quốc phòng, Bộ trưởng Bộ Công an quy định độ tuổi của người lái xe trong lực lượng quân đội, công an làm nhiệm vụ quốc phòng, an ninh.\n\nĐiều 60. Đào tạo lái xe\n\n1. Người có nhu cầu được cấp giấy phép lái xe phải được đào tạo nội dung lý thuyết và thực hành theo chương trình đào tạo quy định cho từng hạng giấy phép lái xe.\n\n2. Người học lái xe phải được đào tạo tại các cơ sở đào tạo lái xe hoặc các hình thức đào tạo lái xe khác để cấp mới hoặc nâng hạng giấy phép lái xe.\n\n3. Việc đào tạo để nâng hạng giấy phép lái xe thực hiện đối với những đối tượng sau đây:\n\na) Nâng hạng giấy phép lái xe từ hạng B lên hạng C1 hoặc lên hạng C hoặc lên hạng D1 hoặc lên hạng D2;\n\nb) Nâng hạng giấy phép lái xe từ hạng C1 lên hạng C hoặc lên hạng D1 hoặc lên hạng D2;\n\nc) Nâng hạng giấy phép lái xe từ hạng C lên hạng D1 hoặc lên hạng D2 hoặc lên hạng D;\n\nd) Nâng hạng giấy phép lái xe từ hạng D1 lên hạng D2 hoặc lên hạng D;\n\nđ) Nâng hạng giấy phép lái xe từ hạng D2 lên hạng D;\n\ne) Nâng hạng giấy phép lái xe từ hạng B lên hạng BE, từ hạng C1 lên\xa0 hạng C1E, từ hạng C lên hạng CE, từ hạng D1 lên hạng D1E, từ hạng D2 lên hạng D2E, từ hạng D lên hạng DE.\n\n4.\xa0Người có nhu cầu được đào tạo nâng hạng giấy phép lái xe khi giấy phép lái xe còn hiệu lực, phải có đủ thời gian lái xe an toàn quy định cho từng hạng giấy phép lái xe;\xa0đối với việc nâng hạng giấy phép lái xe lên hạng D1, D2, D thì người có nhu cầu được đào tạo còn phải có trình độ từ trung học cơ sở trở lên.\n\n5. Giấy phép lái xe các hạng C, D1, D2, D, BE, C1E, CE, D1E, D2E, DE phải được đào tạo bằng hình thức đào tạo nâng hạng theo các điều kiện quy định tại khoản 3 và khoản 4 Điều này.\n\n6. Cơ sở đào tạo lái xe ô tô phải đáp ứng các điều kiện do Chính phủ quy định; có giáo trình, giáo án; thực hiện đào tạo theo đúng hình thức, nội dung và chương trình quy định cho từng hạng giấy phép lái xe.\n\n7. Chính phủ quy định chi tiết các hình thức đào tạo lái xe khác quy định tại khoản 2 Điều này; quy định trình tự, thủ tục kiểm tra, đánh giá để cấp, cấp lại và thu hồi giấy phép xe tập lái; quy định tiêu chuẩn của giáo viên dạy lái xe; quy định việc cấp, cấp lại và thu hồi giấy chứng nhận giáo viên dạy lái xe; quy định việc cấp, cấp lại và thu hồi giấy phép đào tạo lái xe.\n\n8. Bộ trưởng Bộ Giao thông vận tải quy định hình thức, nội dung, chương trình đào tạo lái xe, thời gian lái xe an toàn cho từng hạng giấy phép lái xe quy định tại khoản 4 Điều này và quy định tiêu chuẩn của cơ sở đào tạo lái xe mô tô; đối với cơ sở đào tạo, tổ chức đào tạo lái xe cho lực lượng quân đội, công an làm nhiệm vụ quốc phòng, an ninh do Bộ trưởng Bộ Quốc phòng, Bộ trưởng Bộ Công an quy định.\n\nĐiều 61. Sát hạch lái xe\n\n1. Người đã hoàn thành chương trình đào tạo lái xe, có độ tuổi, sức khỏe theo quy định tại Điều 59 của Luật này được đăng ký để tham dự kỳ sát hạch lái xe.\n\n2. Nội dung sát hạch lái xe phải phù hợp với hạng giấy phép lái xe và chương trình đào tạo lái xe.\n\n3. Hoạt động sát hạch lái xe ô tô phải thực hiện tại các trung tâm sát hạch lái xe; hoạt động sát hạch lái xe mô tô thực hiện tại các trung tâm sát hạch lái xe hoặc tại sân tập lái đáp ứng điều kiện, tiêu chuẩn về cơ sở vật chất, kỹ thuật. Hoạt động sát hạch lái xe do cơ quan nhà nước có thẩm quyền thực hiện.', '8. Ủy ban nhân dân các cấp, trong phạm vi nhiệm vụ, quyền hạn của mình, thực hiện quản lý nhà nước về trật tự, an toàn giao thông đường bộ tại địa phương.\n\nChương IX\n\nĐIỀU KHOẢN THI HÀNH\n\nĐiều 88. Hiệu lực thi hành\n\n1. Luật này có hiệu lực thi hành từ ngày 01 tháng 01 năm 2025, trừ trường hợp quy định tại khoản 2 Điều này.\n\n2. Khoản 3 Điều 10 của Luật này có hiệu lực thi hành từ ngày 01 tháng 01 năm 2026.\n\n3. Luật Giao thông đường bộ số 23/2008/QH12 đã được sửa đổi, bổ sung một số điều theo Luật số 35/2018/QH14 và Luật số 44/2019/QH14 hết hiệu lực kể từ ngày Luật này có hiệu lực thi hành, trừ trường hợp quy định tại các khoản 1, 2, 5 và 6 Điều 89 của Luật này.\n\n4. Nghị quyết số 73/2022/QH15 của Quốc hội về thí điểm đấu giá biển số xe ô tô hết hiệu lực kể từ ngày Luật này có hiệu lực thi hành, trừ trường hợp quy định tại khoản 7 Điều 89 của Luật này.\n\nĐiều 89. Quy định chuyển tiếp\n\n1. Giấy phép lái xe được cấp trước ngày Luật này có hiệu lực thi hành được tiếp tục sử dụng theo thời hạn ghi trên giấy phép lái xe. \n\n2. Giấy phép lái xe được cấp trước ngày Luật này có hiệu lực thi hành nếu chưa thực hiện đổi, cấp lại theo quy định của Luật này có hiệu lực sử dụng như sau:\n\na) Giấy phép lái xe hạng A1 được tiếp tục điều khiển xe mô tô hai bánh có dung tích xi-lanh từ 50 cm3\xa0đến dưới 175 cm3 hoặc có công suất động cơ điện từ 04 kW đến dưới 14 kW;\n\nb) Giấy phép lái xe hạng A2 được tiếp tục điều khiển xe mô tô hai bánh có dung tích xi-lanh từ 175 cm3\xa0trở lên hoặc có công suất động cơ điện từ 14 kW trở lên và các loại xe quy định cho giấy phép lái xe hạng A1 quy định tại điểm a khoản này;\n\nc) Giấy phép lái xe hạng A3 được tiếp tục điều khiển xe mô tô ba bánh, các loại xe quy định cho giấy phép lái xe hạng A1 quy định tại điểm a khoản này và các xe tương tự;\n\nd) Giấy phép lái xe hạng A4 được tiếp tục điều khiển máy kéo có trọng tải đến 1.000 kg;\n\nđ) Giấy phép lái xe hạng B1 số tự động cấp cho người không hành nghề lái xe được tiếp tục điều khiển xe ô tô số tự động chở người đến 08 chỗ (không kể chỗ của người lái xe); xe ô tô tải, kể cả ô tô tải chuyên dùng số tự động có trọng tải dưới 3.500 kg;\n\ne) Giấy phép lái xe hạng B1 cấp cho người không hành nghề lái xe được tiếp tục điều khiển xe ô tô chở người đến 08 chỗ (không kể chỗ của người lái xe); xe ô tô tải, máy kéo có trọng tải dưới 3.500 kg;\n\ng) Giấy phép lái xe hạng B2 cấp cho người hành nghề lái xe được tiếp tục điều khiển xe ô tô chở người đến 08 chỗ (không kể chỗ của người lái xe); xe ô tô tải, máy kéo có trọng tải dưới 3.500 kg;\n\nh) Giấy phép lái xe hạng C được tiếp tục điều khiển xe ô tô tải, máy kéo có trọng tải từ 3.500 kg trở lên và các loại xe quy định cho các giấy phép lái xe hạng B1, B2 quy định tại các điểm đ, e và g khoản này;\n\ni) Giấy phép lái xe hạng D được tiếp tục điều khiển xe ô tô chở người từ 09 chỗ (không kể chỗ của người lái xe) đến 29 chỗ (không kể chỗ của người lái xe) và các loại xe quy định cho các giấy phép lái xe hạng B1, B2, C quy định tại các điểm đ, e, g và h khoản này;\n\nk) Giấy phép lái xe hạng E được tiếp tục điều khiển xe ô tô chở người trên 29 chỗ (không kể chỗ của người lái xe) và các loại xe quy định cho các giấy phép lái xe hạng B1, B2, C, D quy định tại các điểm đ, e, g, h và i khoản này;\n\nl) Giấy phép lái xe hạng FB2, FD được tiếp tục điều khiển các loại xe quy định cho giấy phép lái xe hạng B2, D quy định tại điểm g và điểm i khoản này khi kéo rơ moóc; giấy phép lái xe hạng FC được tiếp tục điều khiển các loại xe quy định cho giấy phép lái xe hạng C quy định tại điểm h khoản này khi kéo rơ moóc, đầu kéo kéo sơ mi rơ moóc; giấy phép lái xe hạng FE được tiếp tục điều khiển các loại xe quy định cho giấy phép lái xe hạng E quy định tại điểm k khoản này khi kéo rơ moóc\xa0hoặc xe ô tô chở khách nối toa.\n\n3. Trường hợp người có giấy phép lái xe đã được cấp trước ngày Luật này có hiệu lực thi hành có nhu cầu đổi, cấp lại giấy phép lái xe thì thực hiện như sau:\n\na) Giấy phép lái xe hạng A1 được đổi, cấp lại sang giấy phép lái xe hạng A với điều kiện hạn chế là chỉ được điều khiển xe mô tô hai bánh có dung tích xi-lanh đến dưới 175 cm3 hoặc có công suất động cơ điện đến dưới 14 kW;\n\nb) Giấy phép lái xe hạng A2 được đổi, cấp lại sang giấy phép lái xe hạng A;\n\nc) Giấy phép lái xe hạng A3 được đổi, cấp lại sang giấy phép lái xe hạng B1;\n\nd) Giấy phép lái xe hạng A4 được đổi, cấp lại sang chứng chỉ điều khiển xe máy chuyên dùng cho người điều khiển máy kéo có trọng tải đến 1.000 kg và chứng chỉ bồi dưỡng kiến thức pháp luật về giao thông đường bộ cho người điều khiển xe máy chuyên dùng;\n\nđ) Giấy phép lái xe hạng B1 số tự động được đổi, cấp lại sang giấy phép lái xe hạng B với điều kiện hạn chế là chỉ được điều khiển xe ô tô số tự động;\n\ne) Giấy phép lái xe hạng B1, B2 được đổi, cấp lại sang giấy phép lái xe hạng B hoặc hạng C1 và chứng chỉ điều khiển xe máy chuyên dùng cho người điều khiển máy kéo có trọng tải đến 3.500 kg;\n\ng) Giấy phép lái xe hạng C giữ nguyên và đổi, cấp lại cùng hạng và chứng chỉ điều khiển xe máy chuyên dùng cho người điều khiển máy kéo có trọng tải trên 3.500 kg;\n\nh) Giấy phép lái xe hạng D được đổi, cấp lại sang giấy phép lái xe hạng D2 và chứng chỉ điều khiển xe máy chuyên dùng cho người điều khiển máy kéo có trọng tải trên 3.500 kg;\n\ni) Giấy phép lái xe hạng E được đổi, cấp lại sang giấy phép lái xe hạng D và chứng chỉ điều khiển xe máy chuyên dùng cho người điều khiển máy kéo có trọng tải trên 3.500 kg;\n\nk) Giấy phép lái xe hạng FB2 được đổi, cấp lại sang giấy phép lái xe hạng BE hoặc hạng C1E và chứng chỉ điều khiển xe máy chuyên dùng cho người điều khiển máy kéo có trọng tải đến 3.500 kg;\n\nl) Giấy phép lái xe hạng FC được đổi, cấp lại sang giấy phép lái xe hạng CE và chứng chỉ điều khiển xe máy chuyên dùng cho người điều khiển máy kéo có trọng tải trên 3.500 kg;\n\nm) Giấy phép lái xe hạng FD được đổi, cấp lại sang giấy phép lái xe hạng D2E và chứng chỉ điều khiển xe máy chuyên dùng cho người điều khiển máy kéo có trọng tải trên 3.500 kg;\n\nn) Giấy phép lái xe hạng FE được đổi, cấp lại sang giấy phép lái xe hạng DE và chứng chỉ điều khiển xe máy chuyên dùng cho người điều khiển máy kéo có trọng tải trên 3.500 kg.\n\n4. Người học lái xe đã được đào tạo lái xe trước ngày Luật này có hiệu lực thi hành hoặc đang được đào tạo lái xe tại ngày Luật này có hiệu lực thi hành chưa được sát hạch, cấp giấy phép lái xe thì được sát hạch, cấp giấy phép lái xe theo hạng giấy phép lái xe đổi, cấp lại quy định tại khoản 3 Điều này.\n\n5. Chứng nhận đăng ký xe, biển số xe máy chuyên dùng cấp trước ngày Luật này có hiệu lực thi hành vẫn có giá trị sử dụng.\n\n6. Chứng nhận chất lượng an toàn kỹ thuật và bảo vệ môi trường được cấp trước ngày Luật này có hiệu lực thi hành thì có giá trị sử dụng đến hết thời hạn ghi trên giấy chứng nhận đó.\n\n7. Việc đấu giá biển số xe ô tô được thực hiện trước ngày Luật này có hiệu lực thi hành và đến ngày Luật này có hiệu lực thi hành đã được cấp văn bản xác nhận biển số xe ô tô trúng đấu giá thì tiếp tục thực hiện theo Nghị quyết số 73/2022/QH15 của Quốc hội về thí điểm đấu giá biển số xe ô tô; trường hợp chưa được cấp xác nhận biển số xe ô tô trúng đấu giá thì tiếp tục thực hiện theo Nghị quyết số 73/2022/QH15 của Quốc hội về thí điểm đấu giá biển số xe ô tô và quy định tại điểm d khoản 1 Điều 38 của Luật này./.\n\nLuật này được Quốc hội nước Cộng hòa xã hội chủ nghĩa Việt Nam khóa XV, kỳ họp thứ 7 thông qua ngày 27 tháng 6 năm 2024.\n\nE-pas: 60179 CHỦ TỊCH QUỐC HỘI\n\n\n\n\nTrần Thanh Mẫn']","**Nguồn văn bản:** /content/drive/MyDrive/ITProject_data/new_law/36_2024_QH15_444251.docx

**Tên văn bản:** Không có tiêu đề trong context

**Điều 57:** Giấy phép lái xe

**Nội dung:**

1. Giấy phép lái xe bao gồm các hạng sau đây:

    a) Hạng A1 cấp cho người lái xe mô tô hai bánh có dung tích xi-lanh đến 125 cm3 hoặc có công suất động cơ điện đến 11 kW.

    b) Hạng A cấp cho người lái xe mô tô hai bánh có dung tích xi-lanh trên 125 cm3 hoặc có công suất động cơ điện trên 11 kW và các loại xe quy định cho giấy phép lái xe hạng A1.

    c) Hạng B1 cấp cho người lái xe mô tô ba bánh và các loại xe quy định cho giấy phép lái xe hạng A1.

    d) Hạng B cấp cho người lái xe ô tô chở người đến 08 chỗ (không kể chỗ của người lái xe); xe ô tô tải và ô tô chuyên dùng có khối lượng toàn bộ theo thiết kế đến 3.500 kg; các loại xe ô tô quy định cho giấy phép lái xe hạng B kéo rơ moóc có khối lượng toàn bộ theo thiết kế đến 750 kg.

    e) Hạng C1 cấp cho người lái xe ô tô tải và ô tô chuyên dùng có khối lượng toàn bộ theo thiết kế trên 3.500 kg đến 7.500 kg; các loại xe ô tô tải quy định cho giấy phép lái xe hạng C1 kéo rơ moóc có khối lượng toàn bộ theo thiết kế đến 750 kg; các loại xe quy định cho giấy phép lái xe hạng B.

    g) Hạng C cấp cho người lái xe ô tô tải và ô tô chuyên dùng có khối lượng toàn bộ theo thiết kế trên 7.500 kg; các loại xe ô tô tải quy định cho giấy phép lái xe hạng C kéo rơ moóc có khối lượng toàn bộ theo thiết kế đến 750 kg; các loại xe quy định cho giấy phép lái xe hạng B và hạng C1.

    h) Hạng D1 cấp cho người lái xe ô tô chở người trên 08 chỗ (không kể chỗ của người lái xe) đến 16 chỗ (không kể chỗ của người lái xe); các loại xe ô tô chở người quy định cho giấy phép lái xe hạng D1 kéo rơ moóc có khối lượng toàn bộ theo thiết kế đến 750 kg; các loại xe quy định cho giấy phép lái xe các hạng B, C1, C.

    i) Hạng D2 cấp cho người lái xe ô tô chở người (kể cả xe buýt) trên 16 chỗ (không kể chỗ của người lái xe) đến 29 chỗ (không kể chỗ của người lái xe); các loại xe ô tô chở người quy định cho giấy phép lái xe hạng D2 kéo rơ moóc có khối lượng toàn bộ theo thiết kế đến 750 kg; các loại xe quy định cho giấy phép lái xe các hạng B, C1, C, D1.

    k) Hạng D cấp cho người lái xe ô tô chở người (kể cả xe buýt) trên 29 chỗ (không kể chỗ của người lái xe); xe ô tô chở người giường nằm; các loại xe ô tô chở người quy định cho giấy phép lái xe hạng D kéo rơ moóc có khối lượng toàn bộ theo thiết kế đến 750 kg; các loại xe quy định cho giấy phép lái xe các hạng B, C1, C, D1, D2.

    l) Hạng BE cấp cho người lái các loại xe ô tô quy định cho giấy phép lái xe hạng B kéo rơ moóc có khối lượng toàn bộ theo thiết kế trên 750 kg.

    m) Hạng C1E cấp cho người lái các loại xe ô tô quy định cho giấy phép lái xe hạng C1 kéo rơ moóc có khối lượng toàn bộ theo thiết kế trên 750 kg.

    n) Hạng CE cấp cho người lái các loại xe ô tô quy định cho giấy phép lái xe hạng C kéo rơ moóc có khối lượng toàn bộ theo thiết kế trên 750 kg; xe ô tô đầu kéo kéo sơ mi rơ moóc.

    o) Hạng D1E cấp cho người lái các loại xe ô tô quy định cho giấy phép lái xe hạng D1 kéo rơ moóc có khối lượng toàn bộ theo thiết kế trên 750 kg.

    p) Hạng D2E cấp cho người lái các loại xe ô tô quy định cho giấy phép lái xe hạng D2 kéo rơ moóc có khối lượng toàn bộ theo thiết kế trên 750 kg.

    q) Hạng DE cấp cho người lái các loại xe ô tô quy định cho giấy phép lái xe hạng D kéo rơ moóc có khối lượng toàn bộ theo thiết kế trên 750 kg; xe ô tô chở khách nối toa.


2. Người khuyết tật điều khiển xe mô tô ba bánh dùng cho người khuyết tật được cấp giấy phép lái xe hạng A1. Người khuyết tật điều khiển xe ô tô số tự động có kết cấu phù hợp với tình trạng khuyết tật thì được cấp giấy phép lái xe hạng B.

3. Người điều khiển xe chở hàng bốn bánh có gắn động cơ, xe chở người bốn bánh có gắn động cơ phải sử dụng giấy phép lái xe có hạng phù hợp với xe ô tô tải hoặc xe ô tô chở người tương ứng.

4. Người điều khiển xe ô tô có thiết kế, cải tạo với số chỗ ít hơn xe cùng loại, kích thước giới hạn tương đương phải sử dụng giấy phép lái xe có hạng phù hợp với xe ô tô cùng loại, kích thước giới hạn tương đương và có số chỗ nhiều nhất.

5. Thời hạn của giấy phép lái xe được quy định như sau:

    a) Giấy phép lái xe các hạng A1, A, B1 không thời hạn.

    b) Giấy phép lái xe hạng B và hạng C1 có thời hạn 10 năm kể từ ngày cấp.

    c) Giấy phép lái xe các hạng C, D1, D2, D, BE, C1E, CE, D1E, D2E và DE có thời hạn 05 năm kể từ ngày cấp.


Tóm lại: Giấy phép lái xe hạng C1E cho phép lái các loại xe ô tô quy định cho giấy phép lái xe hạng C1 kéo rơ moóc có khối lượng toàn bộ theo thiết kế trên 750 kg.  Thời hạn của giấy phép lái xe hạng C1E là 5 năm.
",Hạng C1E cho phép lái xe ô tô tải có trọng tải từ 3.500 kg đến 7.500 kg kéo rơ moóc có trọng tải trên 750 kg.,0.6666666666666666,0.5951388609625335,1.0,0.9999999999
7,Giấy phép lái xe hạng D1E cho phép lái những loại xe nào?,"['a) Chứng nhận đăng ký xe hoặc bản sao Chứng nhận đăng ký xe có chứng thực kèm bản gốc giấy tờ xác nhận của tổ chức tín dụng, chi nhánh ngân hàng nước ngoài còn hiệu lực trong trường hợp xe đang được thế chấp tại tổ chức tín dụng, chi nhánh ngân hàng nước ngoài;\n\nb) Giấy phép lái xe phù hợp với loại xe đang điều khiển;\n\nc) Chứng nhận kiểm định an toàn kỹ thuật và bảo vệ môi trường đối với xe cơ giới theo quy định của pháp luật;\n\nd) Chứng nhận bảo hiểm bắt buộc trách nhiệm dân sự của chủ xe cơ giới.\n\n2. Người điều khiển xe máy chuyên dùng tham gia giao thông đường bộ phải đủ tuổi, sức khỏe theo quy định của pháp luật; có bằng hoặc chứng chỉ điều khiển xe máy chuyên dùng phù hợp loại xe máy chuyên dùng đang điều khiển; có giấy phép lái xe đang còn điểm, còn hiệu lực hoặc chứng chỉ bồi dưỡng kiến thức pháp luật về giao thông đường bộ. Khi tham gia giao thông đường bộ, người điều khiển xe máy chuyên dùng phải mang theo các loại giấy tờ sau đây:\n\na) Chứng nhận đăng ký xe hoặc bản sao Chứng nhận đăng ký xe có chứng thực kèm bản gốc Giấy biên nhận còn hiệu lực của tổ chức tín dụng, chi nhánh ngân hàng nước ngoài trong trường hợp xe đang được thế chấp tại tổ chức tín dụng, chi nhánh ngân hàng nước ngoài;\n\nb) Bằng hoặc chứng chỉ điều khiển xe máy chuyên dùng;\n\nc) Giấy phép lái xe hoặc chứng chỉ bồi dưỡng kiến thức pháp luật về giao thông đường bộ;\n\nd) Chứng nhận kiểm định an toàn kỹ thuật và bảo vệ môi trường đối với xe máy chuyên dùng theo quy định của pháp luật;\n\nđ) Chứng nhận bảo hiểm bắt buộc trách nhiệm dân sự theo quy định của pháp luật.\n\n3. Trường hợp giấy tờ quy định tại khoản 1 và khoản 2 Điều này đã được tích hợp vào tài khoản định danh điện tử thì việc xuất trình, kiểm tra có thể thực hiện thông qua tài khoản định danh điện tử.\n\n4. Người lái xe gắn máy tham gia giao thông đường bộ phải hiểu biết quy tắc giao thông đường bộ, có kỹ năng điều khiển phương tiện; đủ điều kiện về độ tuổi, sức khỏe theo quy định tại điểm a khoản 1 và khoản 2 Điều 59 của Luật này.\n\n5. Người tập lái xe ô tô, người dự sát hạch lái xe ô tô khi tham gia giao thông đường bộ phải thực hành trên xe tập lái, xe sát hạch trên tuyến đường tập lái, tuyến đường sát hạch, có giáo viên dạy lái hoặc sát hạch viên bảo trợ tay lái. Giáo viên dạy lái, sát hạch viên phải mang theo các loại giấy tờ quy định tại khoản 1 Điều này.\n\nĐiều 57. Giấy phép lái xe\n\n1. Giấy phép lái xe bao gồm các hạng sau đây:\n\na) Hạng A1 cấp cho người lái xe mô tô hai bánh có dung tích xi-lanh đến 125 cm3 hoặc có công suất động cơ điện đến 11 kW;\n\nb) Hạng A cấp cho người lái xe mô tô hai bánh có dung tích xi-lanh\xa0 trên 125 cm3\xa0hoặc có công suất động cơ điện trên 11 kW và các loại xe quy định cho giấy phép lái xe hạng A1;\n\nc) Hạng B1 cấp cho người lái xe mô tô ba bánh và các loại xe quy định cho giấy phép lái xe hạng A1;\n\nd) Hạng B cấp cho người lái xe ô tô chở người đến 08 chỗ (không kể chỗ của người lái xe); xe ô tô tải và ô tô chuyên dùng có khối lượng toàn bộ theo thiết kế đến 3.500 kg; các loại xe ô tô quy định cho giấy phép lái xe hạng B kéo rơ moóc có khối lượng toàn bộ theo thiết kế đến 750 kg; \n\nđ) Hạng C1 cấp cho người lái xe ô tô tải và ô tô chuyên dùng có khối lượng toàn bộ theo thiết kế trên 3.500 kg đến 7.500 kg; các loại xe ô tô tải quy định cho giấy phép lái xe hạng C1 kéo rơ moóc có khối lượng toàn bộ theo thiết kế đến 750 kg; các loại xe quy định cho giấy phép lái xe hạng B;\n\ne) Hạng C cấp cho người lái xe ô tô tải và ô tô chuyên dùng có khối lượng toàn bộ theo thiết kế trên 7.500 kg; các loại xe ô tô tải quy định cho giấy phép lái xe hạng C kéo rơ moóc có khối lượng toàn bộ theo thiết kế đến 750 kg; các loại xe quy định cho giấy phép lái xe hạng B và hạng C1;\n\ng) Hạng D1 cấp cho người lái xe ô tô chở người trên 08 chỗ (không kể chỗ của người lái xe) đến 16 chỗ (không kể chỗ của người lái xe); các loại xe ô tô chở người quy định cho giấy phép lái xe hạng D1 kéo rơ moóc có khối lượng toàn bộ theo thiết kế đến 750 kg; các loại xe quy định cho giấy phép lái xe các hạng B, C1, C;\n\nh) Hạng D2 cấp cho người lái xe ô tô chở người (kể cả xe buýt) trên 16 chỗ (không kể chỗ của người lái xe) đến 29 chỗ (không kể chỗ của người lái xe); các loại xe ô tô chở người quy định cho giấy phép lái xe hạng D2 kéo rơ moóc có khối lượng toàn bộ theo thiết kế đến 750 kg; các loại xe quy định cho giấy phép lái xe các hạng B, C1, C, D1;\n\ni) Hạng D cấp cho người lái xe ô tô chở người (kể cả xe buýt) trên 29 chỗ (không kể chỗ của người lái xe); xe ô tô chở người giường nằm; các loại xe ô tô chở người quy định cho giấy phép lái xe hạng D kéo rơ moóc có khối lượng toàn bộ theo thiết kế đến 750 kg; các loại xe quy định cho giấy phép lái xe các hạng B, C1, C, D1, D2;\n\nk) Hạng BE cấp cho người lái các loại xe ô tô quy định cho giấy phép lái xe hạng B kéo rơ moóc có khối lượng toàn bộ theo thiết kế trên 750 kg;\n\nl) Hạng C1E cấp cho người lái các loại xe ô tô quy định cho giấy phép lái xe hạng C1 kéo rơ moóc có khối lượng toàn bộ theo thiết kế trên 750 kg;\n\nm) Hạng CE cấp cho người lái các loại xe ô tô quy định cho giấy phép lái xe hạng C kéo rơ moóc có khối lượng toàn bộ theo thiết kế trên 750 kg; xe ô tô đầu kéo kéo sơ mi rơ moóc;\n\nn) Hạng D1E cấp cho người lái các loại xe ô tô quy định cho giấy phép lái xe hạng D1 kéo rơ moóc có khối lượng toàn bộ theo thiết kế trên 750 kg;\n\no) Hạng D2E cấp cho người lái các loại xe ô tô quy định cho giấy phép lái xe hạng D2 kéo rơ moóc có khối lượng toàn bộ theo thiết kế trên 750 kg;\n\np) Hạng DE cấp cho người lái các loại xe ô tô quy định cho giấy phép lái xe hạng D kéo rơ moóc có khối lượng toàn bộ theo thiết kế trên 750 kg; xe ô tô chở khách nối toa.\n\n2. Người khuyết tật điều khiển xe mô tô ba bánh dùng cho người khuyết tật được cấp giấy phép lái xe hạng A1.\n\nNgười khuyết tật điều khiển xe ô tô số tự động có kết cấu phù hợp với tình trạng khuyết tật thì được cấp giấy phép lái xe hạng B.\n\n3. Người điều khiển xe chở hàng bốn bánh có gắn động cơ, xe chở người bốn bánh có gắn động cơ phải sử dụng giấy phép lái xe có hạng phù hợp với xe ô tô tải hoặc xe ô tô chở người tương ứng.\n\n4. Người điều khiển xe ô tô có thiết kế, cải tạo với số chỗ ít hơn xe cùng loại, kích thước giới hạn tương đương phải sử dụng giấy phép lái xe có hạng phù hợp với xe ô tô cùng loại, kích thước giới hạn tương đương và có số chỗ nhiều nhất.\n\n5. Thời hạn của giấy phép lái xe được quy định như sau:\n\na) Giấy phép lái xe các hạng A1, A, B1 không thời hạn;\n\nb) Giấy phép lái xe hạng B và hạng C1 có thời hạn 10 năm kể từ ngày cấp;\n\nc) Giấy phép lái xe các hạng C, D1, D2, D, BE, C1E, CE, D1E, D2E và DE có thời hạn 05 năm kể từ ngày cấp.\n\n6. Giấy phép lái xe có giá trị sử dụng trong phạm vi lãnh thổ Việt Nam bao gồm:\n\na) Giấy phép lái xe do cơ quan có thẩm quyền của Việt Nam cấp;\n\nb) Giấy phép lái xe quốc tế và giấy phép lái xe quốc gia phù hợp với loại xe được phép điều khiển do quốc gia là thành viên của Công ước của Liên hợp quốc về Giao thông đường bộ năm 1968 (sau đây gọi là Công ước Viên) cấp;\n\nc) Giấy phép lái xe phù hợp với loại xe được phép điều khiển của nước hoặc vùng lãnh thổ mà Việt Nam ký kết điều ước quốc tế hoặc thỏa thuận quốc tế công nhận giấy phép lái xe của nhau;\n\nd) Giấy phép lái xe nước ngoài phù hợp với loại xe được phép điều khiển do quốc gia được công nhận theo điều ước quốc tế mà nước Cộng hòa xã hội chủ nghĩa Việt Nam là thành viên.\n\n7. Giấy phép lái xe không có hiệu lực trong các trường hợp sau đây:\n\na) Giấy phép lái xe hết thời hạn sử dụng;\n\nb) Giấy phép lái xe bị thu hồi theo quy định tại khoản 5 Điều 62 của Luật này.\n\n8. Giấy phép lái xe quốc tế được quy định như sau:\n\na) Giấy phép lái xe quốc tế là giấy phép lái xe do cơ quan nhà nước có thẩm quyền của quốc gia là thành viên của Công ước Viên cấp theo một mẫu thống nhất; có thời hạn không quá 03 năm kể từ ngày cấp và phải phù hợp với thời hạn còn hiệu lực của giấy phép lái xe quốc gia;', '8. Ủy ban nhân dân các cấp, trong phạm vi nhiệm vụ, quyền hạn của mình, thực hiện quản lý nhà nước về trật tự, an toàn giao thông đường bộ tại địa phương.\n\nChương IX\n\nĐIỀU KHOẢN THI HÀNH\n\nĐiều 88. Hiệu lực thi hành\n\n1. Luật này có hiệu lực thi hành từ ngày 01 tháng 01 năm 2025, trừ trường hợp quy định tại khoản 2 Điều này.\n\n2. Khoản 3 Điều 10 của Luật này có hiệu lực thi hành từ ngày 01 tháng 01 năm 2026.\n\n3. Luật Giao thông đường bộ số 23/2008/QH12 đã được sửa đổi, bổ sung một số điều theo Luật số 35/2018/QH14 và Luật số 44/2019/QH14 hết hiệu lực kể từ ngày Luật này có hiệu lực thi hành, trừ trường hợp quy định tại các khoản 1, 2, 5 và 6 Điều 89 của Luật này.\n\n4. Nghị quyết số 73/2022/QH15 của Quốc hội về thí điểm đấu giá biển số xe ô tô hết hiệu lực kể từ ngày Luật này có hiệu lực thi hành, trừ trường hợp quy định tại khoản 7 Điều 89 của Luật này.\n\nĐiều 89. Quy định chuyển tiếp\n\n1. Giấy phép lái xe được cấp trước ngày Luật này có hiệu lực thi hành được tiếp tục sử dụng theo thời hạn ghi trên giấy phép lái xe. \n\n2. Giấy phép lái xe được cấp trước ngày Luật này có hiệu lực thi hành nếu chưa thực hiện đổi, cấp lại theo quy định của Luật này có hiệu lực sử dụng như sau:\n\na) Giấy phép lái xe hạng A1 được tiếp tục điều khiển xe mô tô hai bánh có dung tích xi-lanh từ 50 cm3\xa0đến dưới 175 cm3 hoặc có công suất động cơ điện từ 04 kW đến dưới 14 kW;\n\nb) Giấy phép lái xe hạng A2 được tiếp tục điều khiển xe mô tô hai bánh có dung tích xi-lanh từ 175 cm3\xa0trở lên hoặc có công suất động cơ điện từ 14 kW trở lên và các loại xe quy định cho giấy phép lái xe hạng A1 quy định tại điểm a khoản này;\n\nc) Giấy phép lái xe hạng A3 được tiếp tục điều khiển xe mô tô ba bánh, các loại xe quy định cho giấy phép lái xe hạng A1 quy định tại điểm a khoản này và các xe tương tự;\n\nd) Giấy phép lái xe hạng A4 được tiếp tục điều khiển máy kéo có trọng tải đến 1.000 kg;\n\nđ) Giấy phép lái xe hạng B1 số tự động cấp cho người không hành nghề lái xe được tiếp tục điều khiển xe ô tô số tự động chở người đến 08 chỗ (không kể chỗ của người lái xe); xe ô tô tải, kể cả ô tô tải chuyên dùng số tự động có trọng tải dưới 3.500 kg;\n\ne) Giấy phép lái xe hạng B1 cấp cho người không hành nghề lái xe được tiếp tục điều khiển xe ô tô chở người đến 08 chỗ (không kể chỗ của người lái xe); xe ô tô tải, máy kéo có trọng tải dưới 3.500 kg;\n\ng) Giấy phép lái xe hạng B2 cấp cho người hành nghề lái xe được tiếp tục điều khiển xe ô tô chở người đến 08 chỗ (không kể chỗ của người lái xe); xe ô tô tải, máy kéo có trọng tải dưới 3.500 kg;\n\nh) Giấy phép lái xe hạng C được tiếp tục điều khiển xe ô tô tải, máy kéo có trọng tải từ 3.500 kg trở lên và các loại xe quy định cho các giấy phép lái xe hạng B1, B2 quy định tại các điểm đ, e và g khoản này;\n\ni) Giấy phép lái xe hạng D được tiếp tục điều khiển xe ô tô chở người từ 09 chỗ (không kể chỗ của người lái xe) đến 29 chỗ (không kể chỗ của người lái xe) và các loại xe quy định cho các giấy phép lái xe hạng B1, B2, C quy định tại các điểm đ, e, g và h khoản này;\n\nk) Giấy phép lái xe hạng E được tiếp tục điều khiển xe ô tô chở người trên 29 chỗ (không kể chỗ của người lái xe) và các loại xe quy định cho các giấy phép lái xe hạng B1, B2, C, D quy định tại các điểm đ, e, g, h và i khoản này;\n\nl) Giấy phép lái xe hạng FB2, FD được tiếp tục điều khiển các loại xe quy định cho giấy phép lái xe hạng B2, D quy định tại điểm g và điểm i khoản này khi kéo rơ moóc; giấy phép lái xe hạng FC được tiếp tục điều khiển các loại xe quy định cho giấy phép lái xe hạng C quy định tại điểm h khoản này khi kéo rơ moóc, đầu kéo kéo sơ mi rơ moóc; giấy phép lái xe hạng FE được tiếp tục điều khiển các loại xe quy định cho giấy phép lái xe hạng E quy định tại điểm k khoản này khi kéo rơ moóc\xa0hoặc xe ô tô chở khách nối toa.\n\n3. Trường hợp người có giấy phép lái xe đã được cấp trước ngày Luật này có hiệu lực thi hành có nhu cầu đổi, cấp lại giấy phép lái xe thì thực hiện như sau:\n\na) Giấy phép lái xe hạng A1 được đổi, cấp lại sang giấy phép lái xe hạng A với điều kiện hạn chế là chỉ được điều khiển xe mô tô hai bánh có dung tích xi-lanh đến dưới 175 cm3 hoặc có công suất động cơ điện đến dưới 14 kW;\n\nb) Giấy phép lái xe hạng A2 được đổi, cấp lại sang giấy phép lái xe hạng A;\n\nc) Giấy phép lái xe hạng A3 được đổi, cấp lại sang giấy phép lái xe hạng B1;\n\nd) Giấy phép lái xe hạng A4 được đổi, cấp lại sang chứng chỉ điều khiển xe máy chuyên dùng cho người điều khiển máy kéo có trọng tải đến 1.000 kg và chứng chỉ bồi dưỡng kiến thức pháp luật về giao thông đường bộ cho người điều khiển xe máy chuyên dùng;\n\nđ) Giấy phép lái xe hạng B1 số tự động được đổi, cấp lại sang giấy phép lái xe hạng B với điều kiện hạn chế là chỉ được điều khiển xe ô tô số tự động;\n\ne) Giấy phép lái xe hạng B1, B2 được đổi, cấp lại sang giấy phép lái xe hạng B hoặc hạng C1 và chứng chỉ điều khiển xe máy chuyên dùng cho người điều khiển máy kéo có trọng tải đến 3.500 kg;\n\ng) Giấy phép lái xe hạng C giữ nguyên và đổi, cấp lại cùng hạng và chứng chỉ điều khiển xe máy chuyên dùng cho người điều khiển máy kéo có trọng tải trên 3.500 kg;\n\nh) Giấy phép lái xe hạng D được đổi, cấp lại sang giấy phép lái xe hạng D2 và chứng chỉ điều khiển xe máy chuyên dùng cho người điều khiển máy kéo có trọng tải trên 3.500 kg;\n\ni) Giấy phép lái xe hạng E được đổi, cấp lại sang giấy phép lái xe hạng D và chứng chỉ điều khiển xe máy chuyên dùng cho người điều khiển máy kéo có trọng tải trên 3.500 kg;\n\nk) Giấy phép lái xe hạng FB2 được đổi, cấp lại sang giấy phép lái xe hạng BE hoặc hạng C1E và chứng chỉ điều khiển xe máy chuyên dùng cho người điều khiển máy kéo có trọng tải đến 3.500 kg;\n\nl) Giấy phép lái xe hạng FC được đổi, cấp lại sang giấy phép lái xe hạng CE và chứng chỉ điều khiển xe máy chuyên dùng cho người điều khiển máy kéo có trọng tải trên 3.500 kg;\n\nm) Giấy phép lái xe hạng FD được đổi, cấp lại sang giấy phép lái xe hạng D2E và chứng chỉ điều khiển xe máy chuyên dùng cho người điều khiển máy kéo có trọng tải trên 3.500 kg;\n\nn) Giấy phép lái xe hạng FE được đổi, cấp lại sang giấy phép lái xe hạng DE và chứng chỉ điều khiển xe máy chuyên dùng cho người điều khiển máy kéo có trọng tải trên 3.500 kg.\n\n4. Người học lái xe đã được đào tạo lái xe trước ngày Luật này có hiệu lực thi hành hoặc đang được đào tạo lái xe tại ngày Luật này có hiệu lực thi hành chưa được sát hạch, cấp giấy phép lái xe thì được sát hạch, cấp giấy phép lái xe theo hạng giấy phép lái xe đổi, cấp lại quy định tại khoản 3 Điều này.\n\n5. Chứng nhận đăng ký xe, biển số xe máy chuyên dùng cấp trước ngày Luật này có hiệu lực thi hành vẫn có giá trị sử dụng.\n\n6. Chứng nhận chất lượng an toàn kỹ thuật và bảo vệ môi trường được cấp trước ngày Luật này có hiệu lực thi hành thì có giá trị sử dụng đến hết thời hạn ghi trên giấy chứng nhận đó.\n\n7. Việc đấu giá biển số xe ô tô được thực hiện trước ngày Luật này có hiệu lực thi hành và đến ngày Luật này có hiệu lực thi hành đã được cấp văn bản xác nhận biển số xe ô tô trúng đấu giá thì tiếp tục thực hiện theo Nghị quyết số 73/2022/QH15 của Quốc hội về thí điểm đấu giá biển số xe ô tô; trường hợp chưa được cấp xác nhận biển số xe ô tô trúng đấu giá thì tiếp tục thực hiện theo Nghị quyết số 73/2022/QH15 của Quốc hội về thí điểm đấu giá biển số xe ô tô và quy định tại điểm d khoản 1 Điều 38 của Luật này./.\n\nLuật này được Quốc hội nước Cộng hòa xã hội chủ nghĩa Việt Nam khóa XV, kỳ họp thứ 7 thông qua ngày 27 tháng 6 năm 2024.\n\nE-pas: 60179 CHỦ TỊCH QUỐC HỘI\n\n\n\n\nTrần Thanh Mẫn', 'khí, khí tài quân sự dạng rơ moóc có khối lượng toàn bộ theo thiết kế đến 750 kg; các loại xe quy định cho Giấy phép lái xe quân sự hạng B, C1, C, D1;\n\ni) Hạng D cấp cho người điều khiển xe ô tô chở người từ trên 29 chỗ (không kể chỗ của người lái xe); các loại xe ô tô chở người quy định cho Giấy phép lái xe hạng D kéo rơ moóc hoặc vũ khí, khí tài quân sự dạng rơ moóc có khối lượng toàn bộ theo thiết kế đến 750 kg; các loại xe quy định cho Giấy phép lái xe quân sự hạng B, C1, C, D1, D2;\n\nk) Hạng C1E cấp cho người điều khiển các loại xe ô tô quy định cho Giấy phép lái xe hạng C1 kéo rơ moóc hoặc vũ khí, khí tài quân sự dạng rơ moóc có khối lượng toàn bộ theo thiết kế trên 750 kg;\n\nl) Hạng CE cấp cho người điều khiển các loại xe ô tô quy định cho Giấy phép lái xe hạng C kéo rơ moóc hoặc vũ khí, khí tài quân sự dạng rơ moóc có khối lượng toàn bộ theo thiết kế trên 750 kg; xe ô tô đầu kéo kéo sơ mi rơ moóc hoặc khí tài quân sự dạng sơ mi rơ moóc;\n\nm) Hạng CX cấp cho người đã có Giấy phép lái xe quân sự hạng C để điều khiển xe xích kéo vũ khí, khí tài quân sự.\n\n2. Người điều khiển xe chở hàng bốn bánh có gắn động cơ, xe chở người bốn bánh có gắn động cơ phải sử dụng giấy phép lái xe có hạng phù hợp với xe ô tô tải và ô tô chở người tương ứng.\n\n3. Người điều khiển xe ô tô có thiết kế, cải tạo với số chỗ ngồi ít hơn ô tô cùng loại, kích thước giới hạn tương đương phải sử dụng giấy phép lái xe có hạng phù hợp với ô tô cùng loại, kích thước giới hạn tương đương và có số chỗ ngồi nhiều nhất.\n\nĐiều 6. Mẫu và thời hạn Giấy phép lái xe quân sự\n\n1. Mẫu Giấy phép lái xe quân sự\n\na) Giấy phép lái xe quân sự thực hiện theo quy định tại Mẫu số 08 kèm theo Thông tư này;\n\nb) Cục trưởng Cục Xe máy - Vận tải/Tổng cục Hậu cần - Kỹ thuật có trách nhiệm quản lý việc sử dụng Giấy phép lái xe quân sự thuộc phạm vi quản lý của Bộ Quốc phòng.\n\n2. Thời hạn sử dụng Giấy phép lái xe quân sự\n\na) Giấy phép lái xe quân sự hạng A1, A, B1 là không thời hạn;\n\nb) Giấy phép lái xe quân sự các hạng B, C1, C, D1, D2, D, C1E, CE, CX có thời hạn 05 năm kể từ ngày cấp;\n\nc) Trường hợp cấp, đổi do lý do khác thời hạn theo thời hạn ghi trên Giấy phép lái xe quân sự.\n\n3. Giấy phép lái xe quân sự không có hiệu lực trong các trường hợp sau:\n\na) Giấy phép lái xe quân sự hết thời hạn sử dụng được ghi trên Giấy phép lái xe;\n\nb) Giấy phép lái xe quân sự bị trừ hết điểm theo quy định tại Điều 7 của Thông tư này;\n\nc) Giấy phép lái xe quân sự có Quyết định thu hồi theo khoản 1 Điều 47 Thông tư này.\n\nĐiều 7. Điểm của Giấy phép lái xe quân sự\n\n1. Điểm của Giấy phép lái xe quân sự gồm 12 điểm theo quy định của Luật Trật tự, an toàn giao thông đường bộ, được dùng để quản lý việc chấp hành pháp luật về trật tự, an toàn giao thông đường bộ của người lái xe. Số điểm trừ mỗi lần tùy theo tính chất, mức độ vi phạm theo quy định của pháp luật. Giấy phép lái xe chưa bị trừ hết điểm và không bị trừ điểm trong thời hạn 12 tháng kể từ ngày bị trừ điểm gần nhất thì được phục hồi đủ 12 điểm.\n\n2. Trường hợp Giấy phép lái xe quân sự bị trừ hết điểm, sau thời hạn ít nhất 06 tháng kể từ ngày bị trừ hết điểm, người có Giấy phép lái xe quân sự bị trừ hết điểm được tham gia kiểm tra kiến thức pháp luật về giao thông đường bộ tổ chức tại cơ sở đào tạo lái xe quân sự theo quy định tại điểm a khoản 1 Điều 40 và khoản 1 Điều 41 Thông tư này, nếu kết quả đặt yêu cầu được phục hồi đủ 12 điểm.\n\n3. Điểm của Giấy phép lái xe quân sự đổi, cấp lại, đào tạo nâng hạng được giữ nguyên như trước khi đổi, cấp lại, đào tạo nâng hạng.\n\nĐiều 8. Độ tuổi của người được cấp Giấy phép lái xe quân sự\n\n1. Quân nhân, công chức quốc phòng, công nhân viên chức quốc phòng, lao động hợp đồng đang phục vụ trong Bộ Quốc phòng đủ 18 tuổi trở lên được cấp Giấy phép lái xe quân sự hạng A1, A, B1, B, C1, C.\n\n2. Quân nhân, công chức quốc phòng, công nhân viên chức quốc phòng, lao động hợp đồng đang phục vụ trong Bộ Quốc phòng đủ 24 tuổi trở lên được cấp Giấy phép lái xe quân sự hạng D1, D2, C1E, CE, CX.\n\nCác trường hợp đào tạo chuyển tiếp từ hạng C lên hạng CE hoặc CX theo chỉ tiêu của Bộ Tổng Tham mưu, đủ 19 tuổi trở lên.\n\n3. Quân nhân, công chức quốc phòng, công nhân viên chức quốc phòng, lao động hợp đồng đang phục vụ trong Bộ Quốc phòng đủ 27 tuổi trở lên được cấp Giấy phép lái xe quân sự hạng D. Độ tuổi tối đa của người được cấp Giấy phép lái xe quân sự hạng D là đủ 57 tuổi đối với nam và đủ 55 tuổi đối với nữ.\n\nChương II\n\nĐÀO TẠO LÁI XE QUÂN SỰ\n\nMục I. NGƯỜI HỌC\n\nĐiều 9. Điều kiện đối với người học lái xe quân sự\n\n1. Quân nhân, công chức quốc phòng, công nhân viên chức quốc phòng, lao động hợp đồng đang phục vụ trong Bộ Quốc phòng có đủ các điều kiện: Tiêu chuẩn về tuổi đời, thời gian công tác, sức khỏe, trình độ văn hóa, phẩm chất chính trị theo quy định của Bộ Quốc phòng.\n\nĐối với lao động hợp đồng: Chỉ đào tạo nâng hạng khi có đủ điều kiện, tiêu chuẩn quy định tại khoản 1 Điều này.\n\n2. Đối với người học nâng hạng Giấy phép lái xe quân sự phải có thời gian lái xe và số km lái xe an toàn như sau:\n\na) Từ hạng B lên hạng C1; hạng C1 lên hạng C, C1E; hạng C lên hạng D1, CE, CX; hạng D1 lên hạng D2; hạng D2 lên hạng D: Có thời gian lái xe 02 năm trở lên và 30.000 km lái xe an toàn trở lên (trừ các trường hợp đào tạo chuyển tiếp từ hạng C lên hạng CE hoặc CX theo chỉ tiêu của Bộ Tổng Tham mưu);\n\nb) Từ hạng B lên hạng C, D1; hạng C1 lên D1; hạng C lên hạng D2; hạng D1 lên hạng D: Có thời gian lái xe 03 năm trở lên và có 50.000 km lái xe an toàn trở lên;\n\nc) Từ hạng B lên hạng D2, từ hạng C1 lên hạng D2, từ hạng C lên hạng D: Có thời gian lái xe 05 năm trở lên và 100.000 km lái xe an toàn trở lên.\n\n3. Đối với người học nâng hạng Giấy phép lái xe quân sự lên hạng D1, D2, D ngoài các quy định tại các khoản 1, 2 Điều này phải có bằng tốt nghiệp trung học cơ sở trở lên.\n\nĐiều 10. Hồ sơ đào tạo lái xe\n\n1. Hạng A1, A, gồm:\n\na) Kế hoạch huấn luyện lái xe mô tô quân sự hạng A1, A (kèm theo danh sách học viên) của cơ quan, đơn vị theo quy định tại Mẫu số 13 Phụ lục I kèm theo Thông tư này;\n\nb) Đơn đề nghị học và sát hạch, cấp Giấy phép lái xe quân sự của cá nhân có xác nhận của Thủ trưởng cơ quan, đơn vị trực tiếp quản lý từ cấp trung đoàn hoặc tương đương trở lên theo quy định tại Mẫu số 01 Phụ lục I kèm theo Thông tư này;\n\nc) Bản sao Căn cước công dân (căn cước) và bản sao một trong các loại giấy tờ sau: Giấy chứng minh quân nhân, công chức quốc phòng, công nhân và viên chức quốc phòng, quyết định nhập ngũ, tuyển dụng, phiếu quân nhân, thẻ học viên, quyết định thăng, phong quân hàm, nâng lương gần nhất còn hiệu lực;\n\nd) Giấy chứng nhận sức khỏe theo quy định do quân y cấp trung đoàn và tương đương trở lên xác nhận theo quy định tại Mẫu số 02 Phụ lục I kèm theo Thông tư này;\n\nđ) Hai ảnh màu cỡ 2 x 3 cm (ảnh chụp trên nền màu xanh; quân nhân mặc quân phục thường dùng; công chức quốc phòng, công nhân và viên chức quốc phòng, lao động hợp đồng mặc đồng phục; đeo biển tên theo quy định, không đội mũ).\n\n2. Hạng B1, B, C1, C, gồm:\n\na) Kế hoạch đào tạo lái xe quân sự hạng B1, B, C1, C (kèm theo danh sách học viên) của cơ sở đào tạo;\n\nb) Bản sao quyết định giao chỉ tiêu đào tạo nhân viên kỹ thuật sơ cấp của Tổng Tham mưu trưởng đối với trường hợp đào tạo theo chỉ tiêu nhiệm vụ; văn bản đề nghị đào tạo lái xe của Thủ trưởng cơ quan, đơn vị đầu mối trực thuộc Bộ Quốc phòng đối với trường hợp gửi đào tạo;\n\nc) Hồ sơ quy định tại các điểm b, c, d, đ khoản 1 Điều này;\n\n3. Đào tạo nâng hạng Giấy phép lái xe quân sự\n\nNgoài hồ sơ quy định tại khoản 2 Điều này phải bổ sung các giấy tờ như sau:\n\na) Bản khai thời gian lái xe và số km lái xe an toàn quy định cho từng hạng xe có xác nhận của Thủ trưởng cơ quan, đơn vị trực tiếp quản lý từ cấp trung đoàn hoặc tương đương trở lên theo quy định tại Mẫu số 03 Phụ lục I kèm theo Thông tư này;\n\nb) Bản sao Giấy phép lái xe quân sự đang sử dụng.\n\nMục II. CƠ SỞ ĐÀO TẠO LÁI XE QUÂN SỰ\n\nĐiều 11. Nhiệm vụ của cơ sở đào tạo lái xe quân sự']","**Nguồn văn bản:** /content/drive/MyDrive/ITProject_data/new_law/36_2024_QH15_444251.docx

**Tên văn bản:** Không có tiêu đề trong context

**Điều 57:** Giấy phép lái xe

**Nội dung:**

1. Giấy phép lái xe bao gồm các hạng sau đây:

    a) Hạng A1 cấp cho người lái xe mô tô hai bánh có dung tích xi-lanh đến 125 cm3 hoặc có công suất động cơ điện đến 11 kW.

    b) Hạng A cấp cho người lái xe mô tô hai bánh có dung tích xi-lanh trên 125 cm3 hoặc có công suất động cơ điện trên 11 kW và các loại xe quy định cho giấy phép lái xe hạng A1.

    c) Hạng B1 cấp cho người lái xe mô tô ba bánh và các loại xe quy định cho giấy phép lái xe hạng A1.

    d) Hạng B cấp cho người lái xe ô tô chở người đến 08 chỗ (không kể chỗ của người lái xe); xe ô tô tải và ô tô chuyên dùng có khối lượng toàn bộ theo thiết kế đến 3.500 kg; các loại xe ô tô quy định cho giấy phép lái xe hạng B kéo rơ moóc có khối lượng toàn bộ theo thiết kế đến 750 kg.

    đ) Hạng C1 cấp cho người lái xe ô tô tải và ô tô chuyên dùng có khối lượng toàn bộ theo thiết kế trên 3.500 kg đến 7.500 kg; các loại xe ô tô tải quy định cho giấy phép lái xe hạng C1 kéo rơ moóc có khối lượng toàn bộ theo thiết kế đến 750 kg; các loại xe quy định cho giấy phép lái xe hạng B.

    e) Hạng C cấp cho người lái xe ô tô tải và ô tô chuyên dùng có khối lượng toàn bộ theo thiết kế trên 7.500 kg; các loại xe ô tô tải quy định cho giấy phép lái xe hạng C kéo rơ moóc có khối lượng toàn bộ theo thiết kế đến 750 kg; các loại xe quy định cho giấy phép lái xe hạng B và hạng C1.

    g) Hạng D1 cấp cho người lái xe ô tô chở người trên 08 chỗ (không kể chỗ của người lái xe) đến 16 chỗ (không kể chỗ của người lái xe); các loại xe ô tô chở người quy định cho giấy phép lái xe hạng D1 kéo rơ moóc có khối lượng toàn bộ theo thiết kế đến 750 kg; các loại xe quy định cho giấy phép lái xe các hạng B, C1, C.

    h) Hạng D2 cấp cho người lái xe ô tô chở người (kể cả xe buýt) trên 16 chỗ (không kể chỗ của người lái xe) đến 29 chỗ (không kể chỗ của người lái xe); các loại xe ô tô chở người quy định cho giấy phép lái xe hạng D2 kéo rơ moóc có khối lượng toàn bộ theo thiết kế đến 750 kg; các loại xe quy định cho giấy phép lái xe các hạng B, C1, C, D1.

    i) Hạng D cấp cho người lái xe ô tô chở người (kể cả xe buýt) trên 29 chỗ (không kể chỗ của người lái xe); xe ô tô chở người giường nằm; các loại xe ô tô chở người quy định cho giấy phép lái xe hạng D kéo rơ moóc có khối lượng toàn bộ theo thiết kế đến 750 kg; các loại xe quy định cho giấy phép lái xe các hạng B, C1, C, D1, D2.

    k) Hạng BE cấp cho người lái các loại xe ô tô quy định cho giấy phép lái xe hạng B kéo rơ moóc có khối lượng toàn bộ theo thiết kế trên 750 kg.

    l) Hạng C1E cấp cho người lái các loại xe ô tô quy định cho giấy phép lái xe hạng C1 kéo rơ moóc có khối lượng toàn bộ theo thiết kế trên 750 kg.

    m) Hạng CE cấp cho người lái các loại xe ô tô quy định cho giấy phép lái xe hạng C kéo rơ moóc có khối lượng toàn bộ theo thiết kế trên 750 kg; xe ô tô đầu kéo kéo sơ mi rơ moóc.

    n) Hạng D1E cấp cho người lái các loại xe ô tô quy định cho giấy phép lái xe hạng D1 kéo rơ moóc có khối lượng toàn bộ theo thiết kế trên 750 kg.

    o) Hạng D2E cấp cho người lái các loại xe ô tô quy định cho giấy phép lái xe hạng D2 kéo rơ moóc có khối lượng toàn bộ theo thiết kế trên 750 kg.

    p) Hạng DE cấp cho người lái các loại xe ô tô quy định cho giấy phép lái xe hạng D kéo rơ moóc có khối lượng toàn bộ theo thiết kế trên 750 kg; xe ô tô chở khách nối toa.


2. Người khuyết tật điều khiển xe mô tô ba bánh dùng cho người khuyết tật được cấp giấy phép lái xe hạng A1.

3. Người khuyết tật điều khiển xe ô tô số tự động có kết cấu phù hợp với tình trạng khuyết tật thì được cấp giấy phép lái xe hạng B.

4. Người điều khiển xe chở hàng bốn bánh có gắn động cơ, xe chở người bốn bánh có gắn động cơ phải sử dụng giấy phép lái xe có hạng phù hợp với xe ô tô tải hoặc xe ô tô chở người tương ứng.

5. Người điều khiển xe ô tô có thiết kế, cải tạo với số chỗ ít hơn xe cùng loại, kích thước giới hạn tương đương phải sử dụng giấy phép lái xe có hạng phù hợp với xe ô tô cùng loại, kích thước giới hạn tương đương và có số chỗ nhiều nhất.


Tóm lại: Giấy phép lái xe hạng D1E được phép lái các loại xe ô tô quy định cho giấy phép lái xe hạng D1 kéo rơ moóc có khối lượng toàn bộ theo thiết kế trên 750 kg.
",Hạng D1E cho phép lái xe ô tô chở người từ 10 đến 30 chỗ ngồi kéo rơ moóc có trọng tải trên 750 kg.,1.0,0.6695681384087617,0.0,0.9999999999
8,Giấy phép lái xe hạng D2E cho phép lái những loại xe nào?,"['a) Chứng nhận đăng ký xe hoặc bản sao Chứng nhận đăng ký xe có chứng thực kèm bản gốc giấy tờ xác nhận của tổ chức tín dụng, chi nhánh ngân hàng nước ngoài còn hiệu lực trong trường hợp xe đang được thế chấp tại tổ chức tín dụng, chi nhánh ngân hàng nước ngoài;\n\nb) Giấy phép lái xe phù hợp với loại xe đang điều khiển;\n\nc) Chứng nhận kiểm định an toàn kỹ thuật và bảo vệ môi trường đối với xe cơ giới theo quy định của pháp luật;\n\nd) Chứng nhận bảo hiểm bắt buộc trách nhiệm dân sự của chủ xe cơ giới.\n\n2. Người điều khiển xe máy chuyên dùng tham gia giao thông đường bộ phải đủ tuổi, sức khỏe theo quy định của pháp luật; có bằng hoặc chứng chỉ điều khiển xe máy chuyên dùng phù hợp loại xe máy chuyên dùng đang điều khiển; có giấy phép lái xe đang còn điểm, còn hiệu lực hoặc chứng chỉ bồi dưỡng kiến thức pháp luật về giao thông đường bộ. Khi tham gia giao thông đường bộ, người điều khiển xe máy chuyên dùng phải mang theo các loại giấy tờ sau đây:\n\na) Chứng nhận đăng ký xe hoặc bản sao Chứng nhận đăng ký xe có chứng thực kèm bản gốc Giấy biên nhận còn hiệu lực của tổ chức tín dụng, chi nhánh ngân hàng nước ngoài trong trường hợp xe đang được thế chấp tại tổ chức tín dụng, chi nhánh ngân hàng nước ngoài;\n\nb) Bằng hoặc chứng chỉ điều khiển xe máy chuyên dùng;\n\nc) Giấy phép lái xe hoặc chứng chỉ bồi dưỡng kiến thức pháp luật về giao thông đường bộ;\n\nd) Chứng nhận kiểm định an toàn kỹ thuật và bảo vệ môi trường đối với xe máy chuyên dùng theo quy định của pháp luật;\n\nđ) Chứng nhận bảo hiểm bắt buộc trách nhiệm dân sự theo quy định của pháp luật.\n\n3. Trường hợp giấy tờ quy định tại khoản 1 và khoản 2 Điều này đã được tích hợp vào tài khoản định danh điện tử thì việc xuất trình, kiểm tra có thể thực hiện thông qua tài khoản định danh điện tử.\n\n4. Người lái xe gắn máy tham gia giao thông đường bộ phải hiểu biết quy tắc giao thông đường bộ, có kỹ năng điều khiển phương tiện; đủ điều kiện về độ tuổi, sức khỏe theo quy định tại điểm a khoản 1 và khoản 2 Điều 59 của Luật này.\n\n5. Người tập lái xe ô tô, người dự sát hạch lái xe ô tô khi tham gia giao thông đường bộ phải thực hành trên xe tập lái, xe sát hạch trên tuyến đường tập lái, tuyến đường sát hạch, có giáo viên dạy lái hoặc sát hạch viên bảo trợ tay lái. Giáo viên dạy lái, sát hạch viên phải mang theo các loại giấy tờ quy định tại khoản 1 Điều này.\n\nĐiều 57. Giấy phép lái xe\n\n1. Giấy phép lái xe bao gồm các hạng sau đây:\n\na) Hạng A1 cấp cho người lái xe mô tô hai bánh có dung tích xi-lanh đến 125 cm3 hoặc có công suất động cơ điện đến 11 kW;\n\nb) Hạng A cấp cho người lái xe mô tô hai bánh có dung tích xi-lanh\xa0 trên 125 cm3\xa0hoặc có công suất động cơ điện trên 11 kW và các loại xe quy định cho giấy phép lái xe hạng A1;\n\nc) Hạng B1 cấp cho người lái xe mô tô ba bánh và các loại xe quy định cho giấy phép lái xe hạng A1;\n\nd) Hạng B cấp cho người lái xe ô tô chở người đến 08 chỗ (không kể chỗ của người lái xe); xe ô tô tải và ô tô chuyên dùng có khối lượng toàn bộ theo thiết kế đến 3.500 kg; các loại xe ô tô quy định cho giấy phép lái xe hạng B kéo rơ moóc có khối lượng toàn bộ theo thiết kế đến 750 kg; \n\nđ) Hạng C1 cấp cho người lái xe ô tô tải và ô tô chuyên dùng có khối lượng toàn bộ theo thiết kế trên 3.500 kg đến 7.500 kg; các loại xe ô tô tải quy định cho giấy phép lái xe hạng C1 kéo rơ moóc có khối lượng toàn bộ theo thiết kế đến 750 kg; các loại xe quy định cho giấy phép lái xe hạng B;\n\ne) Hạng C cấp cho người lái xe ô tô tải và ô tô chuyên dùng có khối lượng toàn bộ theo thiết kế trên 7.500 kg; các loại xe ô tô tải quy định cho giấy phép lái xe hạng C kéo rơ moóc có khối lượng toàn bộ theo thiết kế đến 750 kg; các loại xe quy định cho giấy phép lái xe hạng B và hạng C1;\n\ng) Hạng D1 cấp cho người lái xe ô tô chở người trên 08 chỗ (không kể chỗ của người lái xe) đến 16 chỗ (không kể chỗ của người lái xe); các loại xe ô tô chở người quy định cho giấy phép lái xe hạng D1 kéo rơ moóc có khối lượng toàn bộ theo thiết kế đến 750 kg; các loại xe quy định cho giấy phép lái xe các hạng B, C1, C;\n\nh) Hạng D2 cấp cho người lái xe ô tô chở người (kể cả xe buýt) trên 16 chỗ (không kể chỗ của người lái xe) đến 29 chỗ (không kể chỗ của người lái xe); các loại xe ô tô chở người quy định cho giấy phép lái xe hạng D2 kéo rơ moóc có khối lượng toàn bộ theo thiết kế đến 750 kg; các loại xe quy định cho giấy phép lái xe các hạng B, C1, C, D1;\n\ni) Hạng D cấp cho người lái xe ô tô chở người (kể cả xe buýt) trên 29 chỗ (không kể chỗ của người lái xe); xe ô tô chở người giường nằm; các loại xe ô tô chở người quy định cho giấy phép lái xe hạng D kéo rơ moóc có khối lượng toàn bộ theo thiết kế đến 750 kg; các loại xe quy định cho giấy phép lái xe các hạng B, C1, C, D1, D2;\n\nk) Hạng BE cấp cho người lái các loại xe ô tô quy định cho giấy phép lái xe hạng B kéo rơ moóc có khối lượng toàn bộ theo thiết kế trên 750 kg;\n\nl) Hạng C1E cấp cho người lái các loại xe ô tô quy định cho giấy phép lái xe hạng C1 kéo rơ moóc có khối lượng toàn bộ theo thiết kế trên 750 kg;\n\nm) Hạng CE cấp cho người lái các loại xe ô tô quy định cho giấy phép lái xe hạng C kéo rơ moóc có khối lượng toàn bộ theo thiết kế trên 750 kg; xe ô tô đầu kéo kéo sơ mi rơ moóc;\n\nn) Hạng D1E cấp cho người lái các loại xe ô tô quy định cho giấy phép lái xe hạng D1 kéo rơ moóc có khối lượng toàn bộ theo thiết kế trên 750 kg;\n\no) Hạng D2E cấp cho người lái các loại xe ô tô quy định cho giấy phép lái xe hạng D2 kéo rơ moóc có khối lượng toàn bộ theo thiết kế trên 750 kg;\n\np) Hạng DE cấp cho người lái các loại xe ô tô quy định cho giấy phép lái xe hạng D kéo rơ moóc có khối lượng toàn bộ theo thiết kế trên 750 kg; xe ô tô chở khách nối toa.\n\n2. Người khuyết tật điều khiển xe mô tô ba bánh dùng cho người khuyết tật được cấp giấy phép lái xe hạng A1.\n\nNgười khuyết tật điều khiển xe ô tô số tự động có kết cấu phù hợp với tình trạng khuyết tật thì được cấp giấy phép lái xe hạng B.\n\n3. Người điều khiển xe chở hàng bốn bánh có gắn động cơ, xe chở người bốn bánh có gắn động cơ phải sử dụng giấy phép lái xe có hạng phù hợp với xe ô tô tải hoặc xe ô tô chở người tương ứng.\n\n4. Người điều khiển xe ô tô có thiết kế, cải tạo với số chỗ ít hơn xe cùng loại, kích thước giới hạn tương đương phải sử dụng giấy phép lái xe có hạng phù hợp với xe ô tô cùng loại, kích thước giới hạn tương đương và có số chỗ nhiều nhất.\n\n5. Thời hạn của giấy phép lái xe được quy định như sau:\n\na) Giấy phép lái xe các hạng A1, A, B1 không thời hạn;\n\nb) Giấy phép lái xe hạng B và hạng C1 có thời hạn 10 năm kể từ ngày cấp;\n\nc) Giấy phép lái xe các hạng C, D1, D2, D, BE, C1E, CE, D1E, D2E và DE có thời hạn 05 năm kể từ ngày cấp.\n\n6. Giấy phép lái xe có giá trị sử dụng trong phạm vi lãnh thổ Việt Nam bao gồm:\n\na) Giấy phép lái xe do cơ quan có thẩm quyền của Việt Nam cấp;\n\nb) Giấy phép lái xe quốc tế và giấy phép lái xe quốc gia phù hợp với loại xe được phép điều khiển do quốc gia là thành viên của Công ước của Liên hợp quốc về Giao thông đường bộ năm 1968 (sau đây gọi là Công ước Viên) cấp;\n\nc) Giấy phép lái xe phù hợp với loại xe được phép điều khiển của nước hoặc vùng lãnh thổ mà Việt Nam ký kết điều ước quốc tế hoặc thỏa thuận quốc tế công nhận giấy phép lái xe của nhau;\n\nd) Giấy phép lái xe nước ngoài phù hợp với loại xe được phép điều khiển do quốc gia được công nhận theo điều ước quốc tế mà nước Cộng hòa xã hội chủ nghĩa Việt Nam là thành viên.\n\n7. Giấy phép lái xe không có hiệu lực trong các trường hợp sau đây:\n\na) Giấy phép lái xe hết thời hạn sử dụng;\n\nb) Giấy phép lái xe bị thu hồi theo quy định tại khoản 5 Điều 62 của Luật này.\n\n8. Giấy phép lái xe quốc tế được quy định như sau:\n\na) Giấy phép lái xe quốc tế là giấy phép lái xe do cơ quan nhà nước có thẩm quyền của quốc gia là thành viên của Công ước Viên cấp theo một mẫu thống nhất; có thời hạn không quá 03 năm kể từ ngày cấp và phải phù hợp với thời hạn còn hiệu lực của giấy phép lái xe quốc gia;', '8. Ủy ban nhân dân các cấp, trong phạm vi nhiệm vụ, quyền hạn của mình, thực hiện quản lý nhà nước về trật tự, an toàn giao thông đường bộ tại địa phương.\n\nChương IX\n\nĐIỀU KHOẢN THI HÀNH\n\nĐiều 88. Hiệu lực thi hành\n\n1. Luật này có hiệu lực thi hành từ ngày 01 tháng 01 năm 2025, trừ trường hợp quy định tại khoản 2 Điều này.\n\n2. Khoản 3 Điều 10 của Luật này có hiệu lực thi hành từ ngày 01 tháng 01 năm 2026.\n\n3. Luật Giao thông đường bộ số 23/2008/QH12 đã được sửa đổi, bổ sung một số điều theo Luật số 35/2018/QH14 và Luật số 44/2019/QH14 hết hiệu lực kể từ ngày Luật này có hiệu lực thi hành, trừ trường hợp quy định tại các khoản 1, 2, 5 và 6 Điều 89 của Luật này.\n\n4. Nghị quyết số 73/2022/QH15 của Quốc hội về thí điểm đấu giá biển số xe ô tô hết hiệu lực kể từ ngày Luật này có hiệu lực thi hành, trừ trường hợp quy định tại khoản 7 Điều 89 của Luật này.\n\nĐiều 89. Quy định chuyển tiếp\n\n1. Giấy phép lái xe được cấp trước ngày Luật này có hiệu lực thi hành được tiếp tục sử dụng theo thời hạn ghi trên giấy phép lái xe. \n\n2. Giấy phép lái xe được cấp trước ngày Luật này có hiệu lực thi hành nếu chưa thực hiện đổi, cấp lại theo quy định của Luật này có hiệu lực sử dụng như sau:\n\na) Giấy phép lái xe hạng A1 được tiếp tục điều khiển xe mô tô hai bánh có dung tích xi-lanh từ 50 cm3\xa0đến dưới 175 cm3 hoặc có công suất động cơ điện từ 04 kW đến dưới 14 kW;\n\nb) Giấy phép lái xe hạng A2 được tiếp tục điều khiển xe mô tô hai bánh có dung tích xi-lanh từ 175 cm3\xa0trở lên hoặc có công suất động cơ điện từ 14 kW trở lên và các loại xe quy định cho giấy phép lái xe hạng A1 quy định tại điểm a khoản này;\n\nc) Giấy phép lái xe hạng A3 được tiếp tục điều khiển xe mô tô ba bánh, các loại xe quy định cho giấy phép lái xe hạng A1 quy định tại điểm a khoản này và các xe tương tự;\n\nd) Giấy phép lái xe hạng A4 được tiếp tục điều khiển máy kéo có trọng tải đến 1.000 kg;\n\nđ) Giấy phép lái xe hạng B1 số tự động cấp cho người không hành nghề lái xe được tiếp tục điều khiển xe ô tô số tự động chở người đến 08 chỗ (không kể chỗ của người lái xe); xe ô tô tải, kể cả ô tô tải chuyên dùng số tự động có trọng tải dưới 3.500 kg;\n\ne) Giấy phép lái xe hạng B1 cấp cho người không hành nghề lái xe được tiếp tục điều khiển xe ô tô chở người đến 08 chỗ (không kể chỗ của người lái xe); xe ô tô tải, máy kéo có trọng tải dưới 3.500 kg;\n\ng) Giấy phép lái xe hạng B2 cấp cho người hành nghề lái xe được tiếp tục điều khiển xe ô tô chở người đến 08 chỗ (không kể chỗ của người lái xe); xe ô tô tải, máy kéo có trọng tải dưới 3.500 kg;\n\nh) Giấy phép lái xe hạng C được tiếp tục điều khiển xe ô tô tải, máy kéo có trọng tải từ 3.500 kg trở lên và các loại xe quy định cho các giấy phép lái xe hạng B1, B2 quy định tại các điểm đ, e và g khoản này;\n\ni) Giấy phép lái xe hạng D được tiếp tục điều khiển xe ô tô chở người từ 09 chỗ (không kể chỗ của người lái xe) đến 29 chỗ (không kể chỗ của người lái xe) và các loại xe quy định cho các giấy phép lái xe hạng B1, B2, C quy định tại các điểm đ, e, g và h khoản này;\n\nk) Giấy phép lái xe hạng E được tiếp tục điều khiển xe ô tô chở người trên 29 chỗ (không kể chỗ của người lái xe) và các loại xe quy định cho các giấy phép lái xe hạng B1, B2, C, D quy định tại các điểm đ, e, g, h và i khoản này;\n\nl) Giấy phép lái xe hạng FB2, FD được tiếp tục điều khiển các loại xe quy định cho giấy phép lái xe hạng B2, D quy định tại điểm g và điểm i khoản này khi kéo rơ moóc; giấy phép lái xe hạng FC được tiếp tục điều khiển các loại xe quy định cho giấy phép lái xe hạng C quy định tại điểm h khoản này khi kéo rơ moóc, đầu kéo kéo sơ mi rơ moóc; giấy phép lái xe hạng FE được tiếp tục điều khiển các loại xe quy định cho giấy phép lái xe hạng E quy định tại điểm k khoản này khi kéo rơ moóc\xa0hoặc xe ô tô chở khách nối toa.\n\n3. Trường hợp người có giấy phép lái xe đã được cấp trước ngày Luật này có hiệu lực thi hành có nhu cầu đổi, cấp lại giấy phép lái xe thì thực hiện như sau:\n\na) Giấy phép lái xe hạng A1 được đổi, cấp lại sang giấy phép lái xe hạng A với điều kiện hạn chế là chỉ được điều khiển xe mô tô hai bánh có dung tích xi-lanh đến dưới 175 cm3 hoặc có công suất động cơ điện đến dưới 14 kW;\n\nb) Giấy phép lái xe hạng A2 được đổi, cấp lại sang giấy phép lái xe hạng A;\n\nc) Giấy phép lái xe hạng A3 được đổi, cấp lại sang giấy phép lái xe hạng B1;\n\nd) Giấy phép lái xe hạng A4 được đổi, cấp lại sang chứng chỉ điều khiển xe máy chuyên dùng cho người điều khiển máy kéo có trọng tải đến 1.000 kg và chứng chỉ bồi dưỡng kiến thức pháp luật về giao thông đường bộ cho người điều khiển xe máy chuyên dùng;\n\nđ) Giấy phép lái xe hạng B1 số tự động được đổi, cấp lại sang giấy phép lái xe hạng B với điều kiện hạn chế là chỉ được điều khiển xe ô tô số tự động;\n\ne) Giấy phép lái xe hạng B1, B2 được đổi, cấp lại sang giấy phép lái xe hạng B hoặc hạng C1 và chứng chỉ điều khiển xe máy chuyên dùng cho người điều khiển máy kéo có trọng tải đến 3.500 kg;\n\ng) Giấy phép lái xe hạng C giữ nguyên và đổi, cấp lại cùng hạng và chứng chỉ điều khiển xe máy chuyên dùng cho người điều khiển máy kéo có trọng tải trên 3.500 kg;\n\nh) Giấy phép lái xe hạng D được đổi, cấp lại sang giấy phép lái xe hạng D2 và chứng chỉ điều khiển xe máy chuyên dùng cho người điều khiển máy kéo có trọng tải trên 3.500 kg;\n\ni) Giấy phép lái xe hạng E được đổi, cấp lại sang giấy phép lái xe hạng D và chứng chỉ điều khiển xe máy chuyên dùng cho người điều khiển máy kéo có trọng tải trên 3.500 kg;\n\nk) Giấy phép lái xe hạng FB2 được đổi, cấp lại sang giấy phép lái xe hạng BE hoặc hạng C1E và chứng chỉ điều khiển xe máy chuyên dùng cho người điều khiển máy kéo có trọng tải đến 3.500 kg;\n\nl) Giấy phép lái xe hạng FC được đổi, cấp lại sang giấy phép lái xe hạng CE và chứng chỉ điều khiển xe máy chuyên dùng cho người điều khiển máy kéo có trọng tải trên 3.500 kg;\n\nm) Giấy phép lái xe hạng FD được đổi, cấp lại sang giấy phép lái xe hạng D2E và chứng chỉ điều khiển xe máy chuyên dùng cho người điều khiển máy kéo có trọng tải trên 3.500 kg;\n\nn) Giấy phép lái xe hạng FE được đổi, cấp lại sang giấy phép lái xe hạng DE và chứng chỉ điều khiển xe máy chuyên dùng cho người điều khiển máy kéo có trọng tải trên 3.500 kg.\n\n4. Người học lái xe đã được đào tạo lái xe trước ngày Luật này có hiệu lực thi hành hoặc đang được đào tạo lái xe tại ngày Luật này có hiệu lực thi hành chưa được sát hạch, cấp giấy phép lái xe thì được sát hạch, cấp giấy phép lái xe theo hạng giấy phép lái xe đổi, cấp lại quy định tại khoản 3 Điều này.\n\n5. Chứng nhận đăng ký xe, biển số xe máy chuyên dùng cấp trước ngày Luật này có hiệu lực thi hành vẫn có giá trị sử dụng.\n\n6. Chứng nhận chất lượng an toàn kỹ thuật và bảo vệ môi trường được cấp trước ngày Luật này có hiệu lực thi hành thì có giá trị sử dụng đến hết thời hạn ghi trên giấy chứng nhận đó.\n\n7. Việc đấu giá biển số xe ô tô được thực hiện trước ngày Luật này có hiệu lực thi hành và đến ngày Luật này có hiệu lực thi hành đã được cấp văn bản xác nhận biển số xe ô tô trúng đấu giá thì tiếp tục thực hiện theo Nghị quyết số 73/2022/QH15 của Quốc hội về thí điểm đấu giá biển số xe ô tô; trường hợp chưa được cấp xác nhận biển số xe ô tô trúng đấu giá thì tiếp tục thực hiện theo Nghị quyết số 73/2022/QH15 của Quốc hội về thí điểm đấu giá biển số xe ô tô và quy định tại điểm d khoản 1 Điều 38 của Luật này./.\n\nLuật này được Quốc hội nước Cộng hòa xã hội chủ nghĩa Việt Nam khóa XV, kỳ họp thứ 7 thông qua ngày 27 tháng 6 năm 2024.\n\nE-pas: 60179 CHỦ TỊCH QUỐC HỘI\n\n\n\n\nTrần Thanh Mẫn', 'a) Giấy phép lái xe hết thời hạn sử dụng;\n\nb) Giấy phép lái xe bị thu hồi theo quy định tại khoản 5 Điều 62 của Luật này.\n\n8. Giấy phép lái xe quốc tế được quy định như sau:\n\na) Giấy phép lái xe quốc tế là giấy phép lái xe do cơ quan nhà nước có thẩm quyền của quốc gia là thành viên của Công ước Viên cấp theo một mẫu thống nhất; có thời hạn không quá 03 năm kể từ ngày cấp và phải phù hợp với thời hạn còn hiệu lực của giấy phép lái xe quốc gia;\n\nb) Người có giấy phép lái xe quốc tế do quốc gia là thành viên của Công ước Viên cấp khi lái xe tham gia giao thông đường bộ trên lãnh thổ Việt Nam phải mang theo giấy phép lái xe quốc tế và giấy phép lái xe quốc gia được cấp phù hợp với hạng xe điều khiển, còn thời hạn sử dụng; phải tuân thủ pháp luật về trật tự, an toàn giao thông đường bộ của Việt Nam;\n\nc) Người có giấy phép lái xe quốc tế vi phạm pháp luật về trật tự, an toàn giao thông đường bộ của Việt Nam mà bị tước quyền sử dụng giấy phép lái xe có thời hạn thì thời gian bị tước quyền sử dụng không quá thời gian người lái xe được phép cư trú tại lãnh thổ Việt Nam;\n\nd) Người Việt Nam hoặc người nước ngoài có thẻ thường trú hoặc thẻ tạm trú tại Việt Nam có giấy phép lái xe do Việt Nam hoặc quốc gia là thành viên của điều ước quốc tế mà nước Cộng hòa xã hội chủ nghĩa Việt Nam là thành viên cấp, còn giá trị sử dụng, nếu có nhu cầu được cấp giấy phép lái xe quốc tế.\n\n9. Bộ trưởng Bộ Giao thông vận tải quy định mẫu giấy phép lái xe và giấy phép lái xe quốc tế, trình tự, thủ tục cấp và việc sử dụng giấy phép lái xe, giấy phép lái xe quốc tế; đối với mẫu giấy phép lái xe, trình tự, thủ tục cấp và việc sử dụng giấy phép lái xe của lực lượng quân đội, công an làm nhiệm vụ quốc phòng, an ninh do Bộ trưởng Bộ Quốc phòng, Bộ trưởng Bộ Công an quy định.\n\nĐiều 58. Điểm của giấy phép lái xe \n\n1. Điểm của giấy phép lái xe được dùng để quản lý việc chấp hành pháp luật về trật tự, an toàn giao thông đường bộ của người lái xe trên hệ thống cơ sở dữ liệu về trật tự, an toàn giao thông đường bộ, bao gồm 12 điểm. Số điểm trừ mỗi lần vi phạm tùy thuộc tính chất, mức độ của hành vi vi phạm pháp luật về trật tự, an toàn giao thông đường bộ. Dữ liệu về điểm trừ giấy phép lái xe của người vi phạm sẽ được cập nhật vào hệ thống cơ sở dữ liệu ngay sau khi quyết định xử phạt có hiệu lực thi hành và thông báo cho người bị trừ điểm giấy phép lái xe biết.\n\n2. Giấy phép lái xe chưa bị trừ hết điểm và không bị trừ điểm trong thời hạn 12 tháng từ ngày bị trừ điểm gần nhất thì được phục hồi đủ 12 điểm.\n\n3. Trường hợp giấy phép lái xe bị trừ hết điểm thì người có giấy phép lái xe không được điều khiển phương tiện tham gia giao thông đường bộ theo giấy phép lái xe đó. Sau thời hạn ít nhất là 06 tháng kể từ ngày bị trừ hết điểm, người có giấy phép lái xe được tham gia kiểm tra nội dung kiến thức pháp luật về trật tự, an toàn giao thông đường bộ theo quy định tại khoản 7 Điều 61 của Luật này do lực lượng Cảnh sát giao thông tổ chức, có kết quả đạt yêu cầu thì được phục hồi đủ 12 điểm.\n\n4. Giấy phép lái xe sau khi đổi, cấp lại, nâng hạng được giữ nguyên số điểm của giấy phép lái xe trước khi đổi, cấp lại, nâng hạng.\n\n5. Người có thẩm quyền xử phạt vi phạm hành chính có thẩm quyền trừ điểm giấy phép lái xe.\n\n6. Chính phủ quy định chi tiết khoản 1 Điều này; quy định trình tự, thủ tục, thẩm quyền trừ điểm, phục hồi điểm giấy phép lái xe; quy định lộ trình thực hiện Điều này. Bộ trưởng Bộ Công an quy định chi tiết khoản 3 Điều này.\n\nĐiều 59. Tuổi, sức khỏe của người điều khiển phương tiện tham gia giao thông đường bộ\n\n1. Độ tuổi của người lái xe, người điều khiển xe máy chuyên dùng được quy định như sau:\n\na) Người đủ 16 tuổi trở lên được điều khiển xe gắn máy;\n\nb) Người đủ 18 tuổi trở lên được cấp giấy phép lái xe hạng A1, A, B1, B, C1, được cấp chứng chỉ bồi dưỡng kiến thức pháp luật về giao thông đường bộ để điều khiển xe máy chuyên dùng tham gia giao thông đường bộ;\n\nc) Người đủ 21 tuổi trở lên được cấp giấy phép lái xe hạng C, BE;\n\nd) Người đủ 24 tuổi trở lên được cấp giấy phép lái xe hạng D1, D2, C1E, CE;\n\nđ) Người đủ 27 tuổi trở lên được cấp giấy phép lái xe hạng D, D1E, D2E, DE;\n\ne) Tuổi tối đa của người lái xe ô tô chở người (kể cả xe buýt) trên 29 chỗ (không kể chỗ của người lái xe), xe ô tô chở người giường nằm là đủ 57 tuổi đối với nam, đủ 55 tuổi đối với nữ.\n\n2. Người điều khiển phương tiện tham gia giao thông đường bộ phải bảo đảm điều kiện sức khỏe phù hợp với từng loại phương tiện được phép điều khiển. Bộ trưởng Bộ Y tế quy định về tiêu chuẩn sức khỏe, việc khám sức khỏe đối với người lái xe, người điều khiển xe máy chuyên dùng; việc khám sức khỏe định kỳ đối với người hành nghề lái xe ô tô; xây dựng cơ sở dữ liệu về sức khỏe của người lái xe, người điều khiển xe máy chuyên dùng.\n\n3. Bộ trưởng Bộ Quốc phòng, Bộ trưởng Bộ Công an quy định độ tuổi của người lái xe trong lực lượng quân đội, công an làm nhiệm vụ quốc phòng, an ninh.\n\nĐiều 60. Đào tạo lái xe\n\n1. Người có nhu cầu được cấp giấy phép lái xe phải được đào tạo nội dung lý thuyết và thực hành theo chương trình đào tạo quy định cho từng hạng giấy phép lái xe.\n\n2. Người học lái xe phải được đào tạo tại các cơ sở đào tạo lái xe hoặc các hình thức đào tạo lái xe khác để cấp mới hoặc nâng hạng giấy phép lái xe.\n\n3. Việc đào tạo để nâng hạng giấy phép lái xe thực hiện đối với những đối tượng sau đây:\n\na) Nâng hạng giấy phép lái xe từ hạng B lên hạng C1 hoặc lên hạng C hoặc lên hạng D1 hoặc lên hạng D2;\n\nb) Nâng hạng giấy phép lái xe từ hạng C1 lên hạng C hoặc lên hạng D1 hoặc lên hạng D2;\n\nc) Nâng hạng giấy phép lái xe từ hạng C lên hạng D1 hoặc lên hạng D2 hoặc lên hạng D;\n\nd) Nâng hạng giấy phép lái xe từ hạng D1 lên hạng D2 hoặc lên hạng D;\n\nđ) Nâng hạng giấy phép lái xe từ hạng D2 lên hạng D;\n\ne) Nâng hạng giấy phép lái xe từ hạng B lên hạng BE, từ hạng C1 lên\xa0 hạng C1E, từ hạng C lên hạng CE, từ hạng D1 lên hạng D1E, từ hạng D2 lên hạng D2E, từ hạng D lên hạng DE.\n\n4.\xa0Người có nhu cầu được đào tạo nâng hạng giấy phép lái xe khi giấy phép lái xe còn hiệu lực, phải có đủ thời gian lái xe an toàn quy định cho từng hạng giấy phép lái xe;\xa0đối với việc nâng hạng giấy phép lái xe lên hạng D1, D2, D thì người có nhu cầu được đào tạo còn phải có trình độ từ trung học cơ sở trở lên.\n\n5. Giấy phép lái xe các hạng C, D1, D2, D, BE, C1E, CE, D1E, D2E, DE phải được đào tạo bằng hình thức đào tạo nâng hạng theo các điều kiện quy định tại khoản 3 và khoản 4 Điều này.\n\n6. Cơ sở đào tạo lái xe ô tô phải đáp ứng các điều kiện do Chính phủ quy định; có giáo trình, giáo án; thực hiện đào tạo theo đúng hình thức, nội dung và chương trình quy định cho từng hạng giấy phép lái xe.\n\n7. Chính phủ quy định chi tiết các hình thức đào tạo lái xe khác quy định tại khoản 2 Điều này; quy định trình tự, thủ tục kiểm tra, đánh giá để cấp, cấp lại và thu hồi giấy phép xe tập lái; quy định tiêu chuẩn của giáo viên dạy lái xe; quy định việc cấp, cấp lại và thu hồi giấy chứng nhận giáo viên dạy lái xe; quy định việc cấp, cấp lại và thu hồi giấy phép đào tạo lái xe.\n\n8. Bộ trưởng Bộ Giao thông vận tải quy định hình thức, nội dung, chương trình đào tạo lái xe, thời gian lái xe an toàn cho từng hạng giấy phép lái xe quy định tại khoản 4 Điều này và quy định tiêu chuẩn của cơ sở đào tạo lái xe mô tô; đối với cơ sở đào tạo, tổ chức đào tạo lái xe cho lực lượng quân đội, công an làm nhiệm vụ quốc phòng, an ninh do Bộ trưởng Bộ Quốc phòng, Bộ trưởng Bộ Công an quy định.\n\nĐiều 61. Sát hạch lái xe\n\n1. Người đã hoàn thành chương trình đào tạo lái xe, có độ tuổi, sức khỏe theo quy định tại Điều 59 của Luật này được đăng ký để tham dự kỳ sát hạch lái xe.\n\n2. Nội dung sát hạch lái xe phải phù hợp với hạng giấy phép lái xe và chương trình đào tạo lái xe.\n\n3. Hoạt động sát hạch lái xe ô tô phải thực hiện tại các trung tâm sát hạch lái xe; hoạt động sát hạch lái xe mô tô thực hiện tại các trung tâm sát hạch lái xe hoặc tại sân tập lái đáp ứng điều kiện, tiêu chuẩn về cơ sở vật chất, kỹ thuật. Hoạt động sát hạch lái xe do cơ quan nhà nước có thẩm quyền thực hiện.']","**Nguồn văn bản:** /content/drive/MyDrive/ITProject_data/new_law/36_2024_QH15_444251.docx

**Tên văn bản:** Không có tiêu đề trong context

**Điều 57:** Giấy phép lái xe

**Nội dung:**

1. Giấy phép lái xe bao gồm các hạng sau đây:

    a) Hạng A1 cấp cho người lái xe mô tô hai bánh có dung tích xi-lanh đến 125 cm3 hoặc có công suất động cơ điện đến 11 kW.

    b) Hạng A cấp cho người lái xe mô tô hai bánh có dung tích xi-lanh trên 125 cm3 hoặc có công suất động cơ điện trên 11 kW và các loại xe quy định cho giấy phép lái xe hạng A1.

    c) Hạng B1 cấp cho người lái xe mô tô ba bánh và các loại xe quy định cho giấy phép lái xe hạng A1.

    d) Hạng B cấp cho người lái xe ô tô chở người đến 08 chỗ (không kể chỗ của người lái xe); xe ô tô tải và ô tô chuyên dùng có khối lượng toàn bộ theo thiết kế đến 3.500 kg; các loại xe ô tô quy định cho giấy phép lái xe hạng B kéo rơ moóc có khối lượng toàn bộ theo thiết kế đến 750 kg.

    đ) Hạng C1 cấp cho người lái xe ô tô tải và ô tô chuyên dùng có khối lượng toàn bộ theo thiết kế trên 3.500 kg đến 7.500 kg; các loại xe ô tô tải quy định cho giấy phép lái xe hạng C1 kéo rơ moóc có khối lượng toàn bộ theo thiết kế đến 750 kg; các loại xe quy định cho giấy phép lái xe hạng B.

    e) Hạng C cấp cho người lái xe ô tô tải và ô tô chuyên dùng có khối lượng toàn bộ theo thiết kế trên 7.500 kg; các loại xe ô tô tải quy định cho giấy phép lái xe hạng C kéo rơ moóc có khối lượng toàn bộ theo thiết kế đến 750 kg; các loại xe quy định cho giấy phép lái xe hạng B và hạng C1.

    g) Hạng D1 cấp cho người lái xe ô tô chở người trên 08 chỗ (không kể chỗ của người lái xe) đến 16 chỗ (không kể chỗ của người lái xe); các loại xe ô tô chở người quy định cho giấy phép lái xe hạng D1 kéo rơ moóc có khối lượng toàn bộ theo thiết kế đến 750 kg; các loại xe quy định cho giấy phép lái xe các hạng B, C1, C.

    h) Hạng D2 cấp cho người lái xe ô tô chở người (kể cả xe buýt) trên 16 chỗ (không kể chỗ của người lái xe) đến 29 chỗ (không kể chỗ của người lái xe); các loại xe ô tô chở người quy định cho giấy phép lái xe hạng D2 kéo rơ moóc có khối lượng toàn bộ theo thiết kế đến 750 kg; các loại xe quy định cho giấy phép lái xe các hạng B, C1, C, D1.

    i) Hạng D cấp cho người lái xe ô tô chở người (kể cả xe buýt) trên 29 chỗ (không kể chỗ của người lái xe); xe ô tô chở người giường nằm; các loại xe ô tô chở người quy định cho giấy phép lái xe hạng D kéo rơ moóc có khối lượng toàn bộ theo thiết kế đến 750 kg; các loại xe quy định cho giấy phép lái xe các hạng B, C1, C, D1, D2.

    k) Hạng BE cấp cho người lái các loại xe ô tô quy định cho giấy phép lái xe hạng B kéo rơ moóc có khối lượng toàn bộ theo thiết kế trên 750 kg.

    l) Hạng C1E cấp cho người lái các loại xe ô tô quy định cho giấy phép lái xe hạng C1 kéo rơ moóc có khối lượng toàn bộ theo thiết kế trên 750 kg.

    m) Hạng CE cấp cho người lái các loại xe ô tô quy định cho giấy phép lái xe hạng C kéo rơ moóc có khối lượng toàn bộ theo thiết kế trên 750 kg; xe ô tô đầu kéo kéo sơ mi rơ moóc.

    n) Hạng D1E cấp cho người lái các loại xe ô tô quy định cho giấy phép lái xe hạng D1 kéo rơ moóc có khối lượng toàn bộ theo thiết kế trên 750 kg.

    o) Hạng D2E cấp cho người lái các loại xe ô tô quy định cho giấy phép lái xe hạng D2 kéo rơ moóc có khối lượng toàn bộ theo thiết kế trên 750 kg.

    p) Hạng DE cấp cho người lái các loại xe ô tô quy định cho giấy phép lái xe hạng D kéo rơ moóc có khối lượng toàn bộ theo thiết kế trên 750 kg; xe ô tô chở khách nối toa.


2. Người khuyết tật điều khiển xe mô tô ba bánh dùng cho người khuyết tật được cấp giấy phép lái xe hạng A1.  Người khuyết tật điều khiển xe ô tô số tự động có kết cấu phù hợp với tình trạng khuyết tật thì được cấp giấy phép lái xe hạng B.

3. Người điều khiển xe chở hàng bốn bánh có gắn động cơ, xe chở người bốn bánh có gắn động cơ phải sử dụng giấy phép lái xe có hạng phù hợp với xe ô tô tải hoặc xe ô tô chở người tương ứng.

4. Người điều khiển xe ô tô có thiết kế, cải tạo với số chỗ ít hơn xe cùng loại, kích thước giới hạn tương đương phải sử dụng giấy phép lái xe có hạng phù hợp với xe ô tô cùng loại, kích thước giới hạn tương đương và có số chỗ nhiều nhất.

5. Thời hạn của giấy phép lái xe được quy định như sau:
    a) Giấy phép lái xe các hạng A1, A, B1 không thời hạn.
    b) Giấy phép lái xe hạng B và hạng C1 có thời hạn 10 năm kể từ ngày cấp.
    c) Giấy phép lái xe các hạng C, D1, D2, D, BE, C1E, CE, D1E, D2E và DE có thời hạn 05 năm kể từ ngày cấp.


Tóm lại: Giấy phép lái xe hạng D2E được phép lái các loại xe ô tô quy định cho giấy phép lái xe hạng D2 kéo rơ moóc có khối lượng toàn bộ theo thiết kế trên 750 kg.  Ngoài ra, người này cũng được phép lái các loại xe quy định cho các hạng B, C1, C, và D1.
",Hạng D2E cho phép lái xe ô tô chở người trên 30 chỗ ngồi kéo rơ moóc có trọng tải trên 750 kg.,1.0,0.6604419594775103,0.0,0.9999999999
9,Giấy phép lái xe hạng DE cho phép lái những loại xe nào?,"['a) Chứng nhận đăng ký xe hoặc bản sao Chứng nhận đăng ký xe có chứng thực kèm bản gốc giấy tờ xác nhận của tổ chức tín dụng, chi nhánh ngân hàng nước ngoài còn hiệu lực trong trường hợp xe đang được thế chấp tại tổ chức tín dụng, chi nhánh ngân hàng nước ngoài;\n\nb) Giấy phép lái xe phù hợp với loại xe đang điều khiển;\n\nc) Chứng nhận kiểm định an toàn kỹ thuật và bảo vệ môi trường đối với xe cơ giới theo quy định của pháp luật;\n\nd) Chứng nhận bảo hiểm bắt buộc trách nhiệm dân sự của chủ xe cơ giới.\n\n2. Người điều khiển xe máy chuyên dùng tham gia giao thông đường bộ phải đủ tuổi, sức khỏe theo quy định của pháp luật; có bằng hoặc chứng chỉ điều khiển xe máy chuyên dùng phù hợp loại xe máy chuyên dùng đang điều khiển; có giấy phép lái xe đang còn điểm, còn hiệu lực hoặc chứng chỉ bồi dưỡng kiến thức pháp luật về giao thông đường bộ. Khi tham gia giao thông đường bộ, người điều khiển xe máy chuyên dùng phải mang theo các loại giấy tờ sau đây:\n\na) Chứng nhận đăng ký xe hoặc bản sao Chứng nhận đăng ký xe có chứng thực kèm bản gốc Giấy biên nhận còn hiệu lực của tổ chức tín dụng, chi nhánh ngân hàng nước ngoài trong trường hợp xe đang được thế chấp tại tổ chức tín dụng, chi nhánh ngân hàng nước ngoài;\n\nb) Bằng hoặc chứng chỉ điều khiển xe máy chuyên dùng;\n\nc) Giấy phép lái xe hoặc chứng chỉ bồi dưỡng kiến thức pháp luật về giao thông đường bộ;\n\nd) Chứng nhận kiểm định an toàn kỹ thuật và bảo vệ môi trường đối với xe máy chuyên dùng theo quy định của pháp luật;\n\nđ) Chứng nhận bảo hiểm bắt buộc trách nhiệm dân sự theo quy định của pháp luật.\n\n3. Trường hợp giấy tờ quy định tại khoản 1 và khoản 2 Điều này đã được tích hợp vào tài khoản định danh điện tử thì việc xuất trình, kiểm tra có thể thực hiện thông qua tài khoản định danh điện tử.\n\n4. Người lái xe gắn máy tham gia giao thông đường bộ phải hiểu biết quy tắc giao thông đường bộ, có kỹ năng điều khiển phương tiện; đủ điều kiện về độ tuổi, sức khỏe theo quy định tại điểm a khoản 1 và khoản 2 Điều 59 của Luật này.\n\n5. Người tập lái xe ô tô, người dự sát hạch lái xe ô tô khi tham gia giao thông đường bộ phải thực hành trên xe tập lái, xe sát hạch trên tuyến đường tập lái, tuyến đường sát hạch, có giáo viên dạy lái hoặc sát hạch viên bảo trợ tay lái. Giáo viên dạy lái, sát hạch viên phải mang theo các loại giấy tờ quy định tại khoản 1 Điều này.\n\nĐiều 57. Giấy phép lái xe\n\n1. Giấy phép lái xe bao gồm các hạng sau đây:\n\na) Hạng A1 cấp cho người lái xe mô tô hai bánh có dung tích xi-lanh đến 125 cm3 hoặc có công suất động cơ điện đến 11 kW;\n\nb) Hạng A cấp cho người lái xe mô tô hai bánh có dung tích xi-lanh\xa0 trên 125 cm3\xa0hoặc có công suất động cơ điện trên 11 kW và các loại xe quy định cho giấy phép lái xe hạng A1;\n\nc) Hạng B1 cấp cho người lái xe mô tô ba bánh và các loại xe quy định cho giấy phép lái xe hạng A1;\n\nd) Hạng B cấp cho người lái xe ô tô chở người đến 08 chỗ (không kể chỗ của người lái xe); xe ô tô tải và ô tô chuyên dùng có khối lượng toàn bộ theo thiết kế đến 3.500 kg; các loại xe ô tô quy định cho giấy phép lái xe hạng B kéo rơ moóc có khối lượng toàn bộ theo thiết kế đến 750 kg; \n\nđ) Hạng C1 cấp cho người lái xe ô tô tải và ô tô chuyên dùng có khối lượng toàn bộ theo thiết kế trên 3.500 kg đến 7.500 kg; các loại xe ô tô tải quy định cho giấy phép lái xe hạng C1 kéo rơ moóc có khối lượng toàn bộ theo thiết kế đến 750 kg; các loại xe quy định cho giấy phép lái xe hạng B;\n\ne) Hạng C cấp cho người lái xe ô tô tải và ô tô chuyên dùng có khối lượng toàn bộ theo thiết kế trên 7.500 kg; các loại xe ô tô tải quy định cho giấy phép lái xe hạng C kéo rơ moóc có khối lượng toàn bộ theo thiết kế đến 750 kg; các loại xe quy định cho giấy phép lái xe hạng B và hạng C1;\n\ng) Hạng D1 cấp cho người lái xe ô tô chở người trên 08 chỗ (không kể chỗ của người lái xe) đến 16 chỗ (không kể chỗ của người lái xe); các loại xe ô tô chở người quy định cho giấy phép lái xe hạng D1 kéo rơ moóc có khối lượng toàn bộ theo thiết kế đến 750 kg; các loại xe quy định cho giấy phép lái xe các hạng B, C1, C;\n\nh) Hạng D2 cấp cho người lái xe ô tô chở người (kể cả xe buýt) trên 16 chỗ (không kể chỗ của người lái xe) đến 29 chỗ (không kể chỗ của người lái xe); các loại xe ô tô chở người quy định cho giấy phép lái xe hạng D2 kéo rơ moóc có khối lượng toàn bộ theo thiết kế đến 750 kg; các loại xe quy định cho giấy phép lái xe các hạng B, C1, C, D1;\n\ni) Hạng D cấp cho người lái xe ô tô chở người (kể cả xe buýt) trên 29 chỗ (không kể chỗ của người lái xe); xe ô tô chở người giường nằm; các loại xe ô tô chở người quy định cho giấy phép lái xe hạng D kéo rơ moóc có khối lượng toàn bộ theo thiết kế đến 750 kg; các loại xe quy định cho giấy phép lái xe các hạng B, C1, C, D1, D2;\n\nk) Hạng BE cấp cho người lái các loại xe ô tô quy định cho giấy phép lái xe hạng B kéo rơ moóc có khối lượng toàn bộ theo thiết kế trên 750 kg;\n\nl) Hạng C1E cấp cho người lái các loại xe ô tô quy định cho giấy phép lái xe hạng C1 kéo rơ moóc có khối lượng toàn bộ theo thiết kế trên 750 kg;\n\nm) Hạng CE cấp cho người lái các loại xe ô tô quy định cho giấy phép lái xe hạng C kéo rơ moóc có khối lượng toàn bộ theo thiết kế trên 750 kg; xe ô tô đầu kéo kéo sơ mi rơ moóc;\n\nn) Hạng D1E cấp cho người lái các loại xe ô tô quy định cho giấy phép lái xe hạng D1 kéo rơ moóc có khối lượng toàn bộ theo thiết kế trên 750 kg;\n\no) Hạng D2E cấp cho người lái các loại xe ô tô quy định cho giấy phép lái xe hạng D2 kéo rơ moóc có khối lượng toàn bộ theo thiết kế trên 750 kg;\n\np) Hạng DE cấp cho người lái các loại xe ô tô quy định cho giấy phép lái xe hạng D kéo rơ moóc có khối lượng toàn bộ theo thiết kế trên 750 kg; xe ô tô chở khách nối toa.\n\n2. Người khuyết tật điều khiển xe mô tô ba bánh dùng cho người khuyết tật được cấp giấy phép lái xe hạng A1.\n\nNgười khuyết tật điều khiển xe ô tô số tự động có kết cấu phù hợp với tình trạng khuyết tật thì được cấp giấy phép lái xe hạng B.\n\n3. Người điều khiển xe chở hàng bốn bánh có gắn động cơ, xe chở người bốn bánh có gắn động cơ phải sử dụng giấy phép lái xe có hạng phù hợp với xe ô tô tải hoặc xe ô tô chở người tương ứng.\n\n4. Người điều khiển xe ô tô có thiết kế, cải tạo với số chỗ ít hơn xe cùng loại, kích thước giới hạn tương đương phải sử dụng giấy phép lái xe có hạng phù hợp với xe ô tô cùng loại, kích thước giới hạn tương đương và có số chỗ nhiều nhất.\n\n5. Thời hạn của giấy phép lái xe được quy định như sau:\n\na) Giấy phép lái xe các hạng A1, A, B1 không thời hạn;\n\nb) Giấy phép lái xe hạng B và hạng C1 có thời hạn 10 năm kể từ ngày cấp;\n\nc) Giấy phép lái xe các hạng C, D1, D2, D, BE, C1E, CE, D1E, D2E và DE có thời hạn 05 năm kể từ ngày cấp.\n\n6. Giấy phép lái xe có giá trị sử dụng trong phạm vi lãnh thổ Việt Nam bao gồm:\n\na) Giấy phép lái xe do cơ quan có thẩm quyền của Việt Nam cấp;\n\nb) Giấy phép lái xe quốc tế và giấy phép lái xe quốc gia phù hợp với loại xe được phép điều khiển do quốc gia là thành viên của Công ước của Liên hợp quốc về Giao thông đường bộ năm 1968 (sau đây gọi là Công ước Viên) cấp;\n\nc) Giấy phép lái xe phù hợp với loại xe được phép điều khiển của nước hoặc vùng lãnh thổ mà Việt Nam ký kết điều ước quốc tế hoặc thỏa thuận quốc tế công nhận giấy phép lái xe của nhau;\n\nd) Giấy phép lái xe nước ngoài phù hợp với loại xe được phép điều khiển do quốc gia được công nhận theo điều ước quốc tế mà nước Cộng hòa xã hội chủ nghĩa Việt Nam là thành viên.\n\n7. Giấy phép lái xe không có hiệu lực trong các trường hợp sau đây:\n\na) Giấy phép lái xe hết thời hạn sử dụng;\n\nb) Giấy phép lái xe bị thu hồi theo quy định tại khoản 5 Điều 62 của Luật này.\n\n8. Giấy phép lái xe quốc tế được quy định như sau:\n\na) Giấy phép lái xe quốc tế là giấy phép lái xe do cơ quan nhà nước có thẩm quyền của quốc gia là thành viên của Công ước Viên cấp theo một mẫu thống nhất; có thời hạn không quá 03 năm kể từ ngày cấp và phải phù hợp với thời hạn còn hiệu lực của giấy phép lái xe quốc gia;', '8. Ủy ban nhân dân các cấp, trong phạm vi nhiệm vụ, quyền hạn của mình, thực hiện quản lý nhà nước về trật tự, an toàn giao thông đường bộ tại địa phương.\n\nChương IX\n\nĐIỀU KHOẢN THI HÀNH\n\nĐiều 88. Hiệu lực thi hành\n\n1. Luật này có hiệu lực thi hành từ ngày 01 tháng 01 năm 2025, trừ trường hợp quy định tại khoản 2 Điều này.\n\n2. Khoản 3 Điều 10 của Luật này có hiệu lực thi hành từ ngày 01 tháng 01 năm 2026.\n\n3. Luật Giao thông đường bộ số 23/2008/QH12 đã được sửa đổi, bổ sung một số điều theo Luật số 35/2018/QH14 và Luật số 44/2019/QH14 hết hiệu lực kể từ ngày Luật này có hiệu lực thi hành, trừ trường hợp quy định tại các khoản 1, 2, 5 và 6 Điều 89 của Luật này.\n\n4. Nghị quyết số 73/2022/QH15 của Quốc hội về thí điểm đấu giá biển số xe ô tô hết hiệu lực kể từ ngày Luật này có hiệu lực thi hành, trừ trường hợp quy định tại khoản 7 Điều 89 của Luật này.\n\nĐiều 89. Quy định chuyển tiếp\n\n1. Giấy phép lái xe được cấp trước ngày Luật này có hiệu lực thi hành được tiếp tục sử dụng theo thời hạn ghi trên giấy phép lái xe. \n\n2. Giấy phép lái xe được cấp trước ngày Luật này có hiệu lực thi hành nếu chưa thực hiện đổi, cấp lại theo quy định của Luật này có hiệu lực sử dụng như sau:\n\na) Giấy phép lái xe hạng A1 được tiếp tục điều khiển xe mô tô hai bánh có dung tích xi-lanh từ 50 cm3\xa0đến dưới 175 cm3 hoặc có công suất động cơ điện từ 04 kW đến dưới 14 kW;\n\nb) Giấy phép lái xe hạng A2 được tiếp tục điều khiển xe mô tô hai bánh có dung tích xi-lanh từ 175 cm3\xa0trở lên hoặc có công suất động cơ điện từ 14 kW trở lên và các loại xe quy định cho giấy phép lái xe hạng A1 quy định tại điểm a khoản này;\n\nc) Giấy phép lái xe hạng A3 được tiếp tục điều khiển xe mô tô ba bánh, các loại xe quy định cho giấy phép lái xe hạng A1 quy định tại điểm a khoản này và các xe tương tự;\n\nd) Giấy phép lái xe hạng A4 được tiếp tục điều khiển máy kéo có trọng tải đến 1.000 kg;\n\nđ) Giấy phép lái xe hạng B1 số tự động cấp cho người không hành nghề lái xe được tiếp tục điều khiển xe ô tô số tự động chở người đến 08 chỗ (không kể chỗ của người lái xe); xe ô tô tải, kể cả ô tô tải chuyên dùng số tự động có trọng tải dưới 3.500 kg;\n\ne) Giấy phép lái xe hạng B1 cấp cho người không hành nghề lái xe được tiếp tục điều khiển xe ô tô chở người đến 08 chỗ (không kể chỗ của người lái xe); xe ô tô tải, máy kéo có trọng tải dưới 3.500 kg;\n\ng) Giấy phép lái xe hạng B2 cấp cho người hành nghề lái xe được tiếp tục điều khiển xe ô tô chở người đến 08 chỗ (không kể chỗ của người lái xe); xe ô tô tải, máy kéo có trọng tải dưới 3.500 kg;\n\nh) Giấy phép lái xe hạng C được tiếp tục điều khiển xe ô tô tải, máy kéo có trọng tải từ 3.500 kg trở lên và các loại xe quy định cho các giấy phép lái xe hạng B1, B2 quy định tại các điểm đ, e và g khoản này;\n\ni) Giấy phép lái xe hạng D được tiếp tục điều khiển xe ô tô chở người từ 09 chỗ (không kể chỗ của người lái xe) đến 29 chỗ (không kể chỗ của người lái xe) và các loại xe quy định cho các giấy phép lái xe hạng B1, B2, C quy định tại các điểm đ, e, g và h khoản này;\n\nk) Giấy phép lái xe hạng E được tiếp tục điều khiển xe ô tô chở người trên 29 chỗ (không kể chỗ của người lái xe) và các loại xe quy định cho các giấy phép lái xe hạng B1, B2, C, D quy định tại các điểm đ, e, g, h và i khoản này;\n\nl) Giấy phép lái xe hạng FB2, FD được tiếp tục điều khiển các loại xe quy định cho giấy phép lái xe hạng B2, D quy định tại điểm g và điểm i khoản này khi kéo rơ moóc; giấy phép lái xe hạng FC được tiếp tục điều khiển các loại xe quy định cho giấy phép lái xe hạng C quy định tại điểm h khoản này khi kéo rơ moóc, đầu kéo kéo sơ mi rơ moóc; giấy phép lái xe hạng FE được tiếp tục điều khiển các loại xe quy định cho giấy phép lái xe hạng E quy định tại điểm k khoản này khi kéo rơ moóc\xa0hoặc xe ô tô chở khách nối toa.\n\n3. Trường hợp người có giấy phép lái xe đã được cấp trước ngày Luật này có hiệu lực thi hành có nhu cầu đổi, cấp lại giấy phép lái xe thì thực hiện như sau:\n\na) Giấy phép lái xe hạng A1 được đổi, cấp lại sang giấy phép lái xe hạng A với điều kiện hạn chế là chỉ được điều khiển xe mô tô hai bánh có dung tích xi-lanh đến dưới 175 cm3 hoặc có công suất động cơ điện đến dưới 14 kW;\n\nb) Giấy phép lái xe hạng A2 được đổi, cấp lại sang giấy phép lái xe hạng A;\n\nc) Giấy phép lái xe hạng A3 được đổi, cấp lại sang giấy phép lái xe hạng B1;\n\nd) Giấy phép lái xe hạng A4 được đổi, cấp lại sang chứng chỉ điều khiển xe máy chuyên dùng cho người điều khiển máy kéo có trọng tải đến 1.000 kg và chứng chỉ bồi dưỡng kiến thức pháp luật về giao thông đường bộ cho người điều khiển xe máy chuyên dùng;\n\nđ) Giấy phép lái xe hạng B1 số tự động được đổi, cấp lại sang giấy phép lái xe hạng B với điều kiện hạn chế là chỉ được điều khiển xe ô tô số tự động;\n\ne) Giấy phép lái xe hạng B1, B2 được đổi, cấp lại sang giấy phép lái xe hạng B hoặc hạng C1 và chứng chỉ điều khiển xe máy chuyên dùng cho người điều khiển máy kéo có trọng tải đến 3.500 kg;\n\ng) Giấy phép lái xe hạng C giữ nguyên và đổi, cấp lại cùng hạng và chứng chỉ điều khiển xe máy chuyên dùng cho người điều khiển máy kéo có trọng tải trên 3.500 kg;\n\nh) Giấy phép lái xe hạng D được đổi, cấp lại sang giấy phép lái xe hạng D2 và chứng chỉ điều khiển xe máy chuyên dùng cho người điều khiển máy kéo có trọng tải trên 3.500 kg;\n\ni) Giấy phép lái xe hạng E được đổi, cấp lại sang giấy phép lái xe hạng D và chứng chỉ điều khiển xe máy chuyên dùng cho người điều khiển máy kéo có trọng tải trên 3.500 kg;\n\nk) Giấy phép lái xe hạng FB2 được đổi, cấp lại sang giấy phép lái xe hạng BE hoặc hạng C1E và chứng chỉ điều khiển xe máy chuyên dùng cho người điều khiển máy kéo có trọng tải đến 3.500 kg;\n\nl) Giấy phép lái xe hạng FC được đổi, cấp lại sang giấy phép lái xe hạng CE và chứng chỉ điều khiển xe máy chuyên dùng cho người điều khiển máy kéo có trọng tải trên 3.500 kg;\n\nm) Giấy phép lái xe hạng FD được đổi, cấp lại sang giấy phép lái xe hạng D2E và chứng chỉ điều khiển xe máy chuyên dùng cho người điều khiển máy kéo có trọng tải trên 3.500 kg;\n\nn) Giấy phép lái xe hạng FE được đổi, cấp lại sang giấy phép lái xe hạng DE và chứng chỉ điều khiển xe máy chuyên dùng cho người điều khiển máy kéo có trọng tải trên 3.500 kg.\n\n4. Người học lái xe đã được đào tạo lái xe trước ngày Luật này có hiệu lực thi hành hoặc đang được đào tạo lái xe tại ngày Luật này có hiệu lực thi hành chưa được sát hạch, cấp giấy phép lái xe thì được sát hạch, cấp giấy phép lái xe theo hạng giấy phép lái xe đổi, cấp lại quy định tại khoản 3 Điều này.\n\n5. Chứng nhận đăng ký xe, biển số xe máy chuyên dùng cấp trước ngày Luật này có hiệu lực thi hành vẫn có giá trị sử dụng.\n\n6. Chứng nhận chất lượng an toàn kỹ thuật và bảo vệ môi trường được cấp trước ngày Luật này có hiệu lực thi hành thì có giá trị sử dụng đến hết thời hạn ghi trên giấy chứng nhận đó.\n\n7. Việc đấu giá biển số xe ô tô được thực hiện trước ngày Luật này có hiệu lực thi hành và đến ngày Luật này có hiệu lực thi hành đã được cấp văn bản xác nhận biển số xe ô tô trúng đấu giá thì tiếp tục thực hiện theo Nghị quyết số 73/2022/QH15 của Quốc hội về thí điểm đấu giá biển số xe ô tô; trường hợp chưa được cấp xác nhận biển số xe ô tô trúng đấu giá thì tiếp tục thực hiện theo Nghị quyết số 73/2022/QH15 của Quốc hội về thí điểm đấu giá biển số xe ô tô và quy định tại điểm d khoản 1 Điều 38 của Luật này./.\n\nLuật này được Quốc hội nước Cộng hòa xã hội chủ nghĩa Việt Nam khóa XV, kỳ họp thứ 7 thông qua ngày 27 tháng 6 năm 2024.\n\nE-pas: 60179 CHỦ TỊCH QUỐC HỘI\n\n\n\n\nTrần Thanh Mẫn', 'a) Giấy phép lái xe hết thời hạn sử dụng;\n\nb) Giấy phép lái xe bị thu hồi theo quy định tại khoản 5 Điều 62 của Luật này.\n\n8. Giấy phép lái xe quốc tế được quy định như sau:\n\na) Giấy phép lái xe quốc tế là giấy phép lái xe do cơ quan nhà nước có thẩm quyền của quốc gia là thành viên của Công ước Viên cấp theo một mẫu thống nhất; có thời hạn không quá 03 năm kể từ ngày cấp và phải phù hợp với thời hạn còn hiệu lực của giấy phép lái xe quốc gia;\n\nb) Người có giấy phép lái xe quốc tế do quốc gia là thành viên của Công ước Viên cấp khi lái xe tham gia giao thông đường bộ trên lãnh thổ Việt Nam phải mang theo giấy phép lái xe quốc tế và giấy phép lái xe quốc gia được cấp phù hợp với hạng xe điều khiển, còn thời hạn sử dụng; phải tuân thủ pháp luật về trật tự, an toàn giao thông đường bộ của Việt Nam;\n\nc) Người có giấy phép lái xe quốc tế vi phạm pháp luật về trật tự, an toàn giao thông đường bộ của Việt Nam mà bị tước quyền sử dụng giấy phép lái xe có thời hạn thì thời gian bị tước quyền sử dụng không quá thời gian người lái xe được phép cư trú tại lãnh thổ Việt Nam;\n\nd) Người Việt Nam hoặc người nước ngoài có thẻ thường trú hoặc thẻ tạm trú tại Việt Nam có giấy phép lái xe do Việt Nam hoặc quốc gia là thành viên của điều ước quốc tế mà nước Cộng hòa xã hội chủ nghĩa Việt Nam là thành viên cấp, còn giá trị sử dụng, nếu có nhu cầu được cấp giấy phép lái xe quốc tế.\n\n9. Bộ trưởng Bộ Giao thông vận tải quy định mẫu giấy phép lái xe và giấy phép lái xe quốc tế, trình tự, thủ tục cấp và việc sử dụng giấy phép lái xe, giấy phép lái xe quốc tế; đối với mẫu giấy phép lái xe, trình tự, thủ tục cấp và việc sử dụng giấy phép lái xe của lực lượng quân đội, công an làm nhiệm vụ quốc phòng, an ninh do Bộ trưởng Bộ Quốc phòng, Bộ trưởng Bộ Công an quy định.\n\nĐiều 58. Điểm của giấy phép lái xe \n\n1. Điểm của giấy phép lái xe được dùng để quản lý việc chấp hành pháp luật về trật tự, an toàn giao thông đường bộ của người lái xe trên hệ thống cơ sở dữ liệu về trật tự, an toàn giao thông đường bộ, bao gồm 12 điểm. Số điểm trừ mỗi lần vi phạm tùy thuộc tính chất, mức độ của hành vi vi phạm pháp luật về trật tự, an toàn giao thông đường bộ. Dữ liệu về điểm trừ giấy phép lái xe của người vi phạm sẽ được cập nhật vào hệ thống cơ sở dữ liệu ngay sau khi quyết định xử phạt có hiệu lực thi hành và thông báo cho người bị trừ điểm giấy phép lái xe biết.\n\n2. Giấy phép lái xe chưa bị trừ hết điểm và không bị trừ điểm trong thời hạn 12 tháng từ ngày bị trừ điểm gần nhất thì được phục hồi đủ 12 điểm.\n\n3. Trường hợp giấy phép lái xe bị trừ hết điểm thì người có giấy phép lái xe không được điều khiển phương tiện tham gia giao thông đường bộ theo giấy phép lái xe đó. Sau thời hạn ít nhất là 06 tháng kể từ ngày bị trừ hết điểm, người có giấy phép lái xe được tham gia kiểm tra nội dung kiến thức pháp luật về trật tự, an toàn giao thông đường bộ theo quy định tại khoản 7 Điều 61 của Luật này do lực lượng Cảnh sát giao thông tổ chức, có kết quả đạt yêu cầu thì được phục hồi đủ 12 điểm.\n\n4. Giấy phép lái xe sau khi đổi, cấp lại, nâng hạng được giữ nguyên số điểm của giấy phép lái xe trước khi đổi, cấp lại, nâng hạng.\n\n5. Người có thẩm quyền xử phạt vi phạm hành chính có thẩm quyền trừ điểm giấy phép lái xe.\n\n6. Chính phủ quy định chi tiết khoản 1 Điều này; quy định trình tự, thủ tục, thẩm quyền trừ điểm, phục hồi điểm giấy phép lái xe; quy định lộ trình thực hiện Điều này. Bộ trưởng Bộ Công an quy định chi tiết khoản 3 Điều này.\n\nĐiều 59. Tuổi, sức khỏe của người điều khiển phương tiện tham gia giao thông đường bộ\n\n1. Độ tuổi của người lái xe, người điều khiển xe máy chuyên dùng được quy định như sau:\n\na) Người đủ 16 tuổi trở lên được điều khiển xe gắn máy;\n\nb) Người đủ 18 tuổi trở lên được cấp giấy phép lái xe hạng A1, A, B1, B, C1, được cấp chứng chỉ bồi dưỡng kiến thức pháp luật về giao thông đường bộ để điều khiển xe máy chuyên dùng tham gia giao thông đường bộ;\n\nc) Người đủ 21 tuổi trở lên được cấp giấy phép lái xe hạng C, BE;\n\nd) Người đủ 24 tuổi trở lên được cấp giấy phép lái xe hạng D1, D2, C1E, CE;\n\nđ) Người đủ 27 tuổi trở lên được cấp giấy phép lái xe hạng D, D1E, D2E, DE;\n\ne) Tuổi tối đa của người lái xe ô tô chở người (kể cả xe buýt) trên 29 chỗ (không kể chỗ của người lái xe), xe ô tô chở người giường nằm là đủ 57 tuổi đối với nam, đủ 55 tuổi đối với nữ.\n\n2. Người điều khiển phương tiện tham gia giao thông đường bộ phải bảo đảm điều kiện sức khỏe phù hợp với từng loại phương tiện được phép điều khiển. Bộ trưởng Bộ Y tế quy định về tiêu chuẩn sức khỏe, việc khám sức khỏe đối với người lái xe, người điều khiển xe máy chuyên dùng; việc khám sức khỏe định kỳ đối với người hành nghề lái xe ô tô; xây dựng cơ sở dữ liệu về sức khỏe của người lái xe, người điều khiển xe máy chuyên dùng.\n\n3. Bộ trưởng Bộ Quốc phòng, Bộ trưởng Bộ Công an quy định độ tuổi của người lái xe trong lực lượng quân đội, công an làm nhiệm vụ quốc phòng, an ninh.\n\nĐiều 60. Đào tạo lái xe\n\n1. Người có nhu cầu được cấp giấy phép lái xe phải được đào tạo nội dung lý thuyết và thực hành theo chương trình đào tạo quy định cho từng hạng giấy phép lái xe.\n\n2. Người học lái xe phải được đào tạo tại các cơ sở đào tạo lái xe hoặc các hình thức đào tạo lái xe khác để cấp mới hoặc nâng hạng giấy phép lái xe.\n\n3. Việc đào tạo để nâng hạng giấy phép lái xe thực hiện đối với những đối tượng sau đây:\n\na) Nâng hạng giấy phép lái xe từ hạng B lên hạng C1 hoặc lên hạng C hoặc lên hạng D1 hoặc lên hạng D2;\n\nb) Nâng hạng giấy phép lái xe từ hạng C1 lên hạng C hoặc lên hạng D1 hoặc lên hạng D2;\n\nc) Nâng hạng giấy phép lái xe từ hạng C lên hạng D1 hoặc lên hạng D2 hoặc lên hạng D;\n\nd) Nâng hạng giấy phép lái xe từ hạng D1 lên hạng D2 hoặc lên hạng D;\n\nđ) Nâng hạng giấy phép lái xe từ hạng D2 lên hạng D;\n\ne) Nâng hạng giấy phép lái xe từ hạng B lên hạng BE, từ hạng C1 lên\xa0 hạng C1E, từ hạng C lên hạng CE, từ hạng D1 lên hạng D1E, từ hạng D2 lên hạng D2E, từ hạng D lên hạng DE.\n\n4.\xa0Người có nhu cầu được đào tạo nâng hạng giấy phép lái xe khi giấy phép lái xe còn hiệu lực, phải có đủ thời gian lái xe an toàn quy định cho từng hạng giấy phép lái xe;\xa0đối với việc nâng hạng giấy phép lái xe lên hạng D1, D2, D thì người có nhu cầu được đào tạo còn phải có trình độ từ trung học cơ sở trở lên.\n\n5. Giấy phép lái xe các hạng C, D1, D2, D, BE, C1E, CE, D1E, D2E, DE phải được đào tạo bằng hình thức đào tạo nâng hạng theo các điều kiện quy định tại khoản 3 và khoản 4 Điều này.\n\n6. Cơ sở đào tạo lái xe ô tô phải đáp ứng các điều kiện do Chính phủ quy định; có giáo trình, giáo án; thực hiện đào tạo theo đúng hình thức, nội dung và chương trình quy định cho từng hạng giấy phép lái xe.\n\n7. Chính phủ quy định chi tiết các hình thức đào tạo lái xe khác quy định tại khoản 2 Điều này; quy định trình tự, thủ tục kiểm tra, đánh giá để cấp, cấp lại và thu hồi giấy phép xe tập lái; quy định tiêu chuẩn của giáo viên dạy lái xe; quy định việc cấp, cấp lại và thu hồi giấy chứng nhận giáo viên dạy lái xe; quy định việc cấp, cấp lại và thu hồi giấy phép đào tạo lái xe.\n\n8. Bộ trưởng Bộ Giao thông vận tải quy định hình thức, nội dung, chương trình đào tạo lái xe, thời gian lái xe an toàn cho từng hạng giấy phép lái xe quy định tại khoản 4 Điều này và quy định tiêu chuẩn của cơ sở đào tạo lái xe mô tô; đối với cơ sở đào tạo, tổ chức đào tạo lái xe cho lực lượng quân đội, công an làm nhiệm vụ quốc phòng, an ninh do Bộ trưởng Bộ Quốc phòng, Bộ trưởng Bộ Công an quy định.\n\nĐiều 61. Sát hạch lái xe\n\n1. Người đã hoàn thành chương trình đào tạo lái xe, có độ tuổi, sức khỏe theo quy định tại Điều 59 của Luật này được đăng ký để tham dự kỳ sát hạch lái xe.\n\n2. Nội dung sát hạch lái xe phải phù hợp với hạng giấy phép lái xe và chương trình đào tạo lái xe.\n\n3. Hoạt động sát hạch lái xe ô tô phải thực hiện tại các trung tâm sát hạch lái xe; hoạt động sát hạch lái xe mô tô thực hiện tại các trung tâm sát hạch lái xe hoặc tại sân tập lái đáp ứng điều kiện, tiêu chuẩn về cơ sở vật chất, kỹ thuật. Hoạt động sát hạch lái xe do cơ quan nhà nước có thẩm quyền thực hiện.']","**Nguồn văn bản:** /content/drive/MyDrive/ITProject_data/new_law/36_2024_QH15_444251.docx

**Tên văn bản:** Không có tiêu đề trong context

**Điều 57:** Giấy phép lái xe

**Nội dung:**

1. Giấy phép lái xe bao gồm các hạng sau đây:

    a) Hạng A1 cấp cho người lái xe mô tô hai bánh có dung tích xi-lanh đến 125 cm3 hoặc có công suất động cơ điện đến 11 kW.

    b) Hạng A cấp cho người lái xe mô tô hai bánh có dung tích xi-lanh trên 125 cm3 hoặc có công suất động cơ điện trên 11 kW và các loại xe quy định cho giấy phép lái xe hạng A1.

    c) Hạng B1 cấp cho người lái xe mô tô ba bánh và các loại xe quy định cho giấy phép lái xe hạng A1.

    d) Hạng B cấp cho người lái xe ô tô chở người đến 08 chỗ (không kể chỗ của người lái xe); xe ô tô tải và ô tô chuyên dùng có khối lượng toàn bộ theo thiết kế đến 3.500 kg; các loại xe ô tô quy định cho giấy phép lái xe hạng B kéo rơ moóc có khối lượng toàn bộ theo thiết kế đến 750 kg.

    đ) Hạng C1 cấp cho người lái xe ô tô tải và ô tô chuyên dùng có khối lượng toàn bộ theo thiết kế trên 3.500 kg đến 7.500 kg; các loại xe ô tô tải quy định cho giấy phép lái xe hạng C1 kéo rơ moóc có khối lượng toàn bộ theo thiết kế đến 750 kg; các loại xe quy định cho giấy phép lái xe hạng B.

    e) Hạng C cấp cho người lái xe ô tô tải và ô tô chuyên dùng có khối lượng toàn bộ theo thiết kế trên 7.500 kg; các loại xe ô tô tải quy định cho giấy phép lái xe hạng C kéo rơ moóc có khối lượng toàn bộ theo thiết kế đến 750 kg; các loại xe quy định cho giấy phép lái xe hạng B và hạng C1.

    g) Hạng D1 cấp cho người lái xe ô tô chở người trên 08 chỗ (không kể chỗ của người lái xe) đến 16 chỗ (không kể chỗ của người lái xe); các loại xe ô tô chở người quy định cho giấy phép lái xe hạng D1 kéo rơ moóc có khối lượng toàn bộ theo thiết kế đến 750 kg; các loại xe quy định cho giấy phép lái xe các hạng B, C1, C.

    h) Hạng D2 cấp cho người lái xe ô tô chở người (kể cả xe buýt) trên 16 chỗ (không kể chỗ của người lái xe) đến 29 chỗ (không kể chỗ của người lái xe); các loại xe ô tô chở người quy định cho giấy phép lái xe hạng D2 kéo rơ moóc có khối lượng toàn bộ theo thiết kế đến 750 kg; các loại xe quy định cho giấy phép lái xe các hạng B, C1, C, D1.

    i) Hạng D cấp cho người lái xe ô tô chở người (kể cả xe buýt) trên 29 chỗ (không kể chỗ của người lái xe); xe ô tô chở người giường nằm; các loại xe ô tô chở người quy định cho giấy phép lái xe hạng D kéo rơ moóc có khối lượng toàn bộ theo thiết kế đến 750 kg; các loại xe quy định cho giấy phép lái xe các hạng B, C1, C, D1, D2.

    k) Hạng BE cấp cho người lái các loại xe ô tô quy định cho giấy phép lái xe hạng B kéo rơ moóc có khối lượng toàn bộ theo thiết kế trên 750 kg.

    l) Hạng C1E cấp cho người lái các loại xe ô tô quy định cho giấy phép lái xe hạng C1 kéo rơ moóc có khối lượng toàn bộ theo thiết kế trên 750 kg.

    m) Hạng CE cấp cho người lái các loại xe ô tô quy định cho giấy phép lái xe hạng C kéo rơ moóc có khối lượng toàn bộ theo thiết kế trên 750 kg; xe ô tô đầu kéo kéo sơ mi rơ moóc.

    n) Hạng D1E cấp cho người lái các loại xe ô tô quy định cho giấy phép lái xe hạng D1 kéo rơ moóc có khối lượng toàn bộ theo thiết kế trên 750 kg.

    o) Hạng D2E cấp cho người lái các loại xe ô tô quy định cho giấy phép lái xe hạng D2 kéo rơ moóc có khối lượng toàn bộ theo thiết kế trên 750 kg.

    p) Hạng DE cấp cho người lái các loại xe ô tô quy định cho giấy phép lái xe hạng D kéo rơ moóc có khối lượng toàn bộ theo thiết kế trên 750 kg; xe ô tô chở khách nối toa.


2. Người khuyết tật điều khiển xe mô tô ba bánh dùng cho người khuyết tật được cấp giấy phép lái xe hạng A1.

3. Người khuyết tật điều khiển xe ô tô số tự động có kết cấu phù hợp với tình trạng khuyết tật thì được cấp giấy phép lái xe hạng B.

4. Người điều khiển xe chở hàng bốn bánh có gắn động cơ, xe chở người bốn bánh có gắn động cơ phải sử dụng giấy phép lái xe có hạng phù hợp với xe ô tô tải hoặc xe ô tô chở người tương ứng.

5. Người điều khiển xe ô tô có thiết kế, cải tạo với số chỗ ít hơn xe cùng loại, kích thước giới hạn tương đương phải sử dụng giấy phép lái xe có hạng phù hợp với xe ô tô cùng loại, kích thước giới hạn tương đương và có số chỗ nhiều nhất.


Tóm lại: Giấy phép lái xe hạng DE được phép lái các loại xe ô tô quy định cho giấy phép lái xe hạng D kéo rơ moóc có khối lượng toàn bộ thiết kế trên 750kg và xe ô tô chở khách nối toa.
",Hạng DE cho phép lái xe ô tô chở người trên 30 chỗ ngồi kéo rơ moóc có trọng tải trên 750 kg.,1.0,0.6984987903107905,1.0,0.9999999999
10,Luật Giao thông Đường bộ 2025 quy định như thế nào về điểm giấy phép lái xe?,"['a) Giấy phép lái xe hết thời hạn sử dụng;\n\nb) Giấy phép lái xe bị thu hồi theo quy định tại khoản 5 Điều 62 của Luật này.\n\n8. Giấy phép lái xe quốc tế được quy định như sau:\n\na) Giấy phép lái xe quốc tế là giấy phép lái xe do cơ quan nhà nước có thẩm quyền của quốc gia là thành viên của Công ước Viên cấp theo một mẫu thống nhất; có thời hạn không quá 03 năm kể từ ngày cấp và phải phù hợp với thời hạn còn hiệu lực của giấy phép lái xe quốc gia;\n\nb) Người có giấy phép lái xe quốc tế do quốc gia là thành viên của Công ước Viên cấp khi lái xe tham gia giao thông đường bộ trên lãnh thổ Việt Nam phải mang theo giấy phép lái xe quốc tế và giấy phép lái xe quốc gia được cấp phù hợp với hạng xe điều khiển, còn thời hạn sử dụng; phải tuân thủ pháp luật về trật tự, an toàn giao thông đường bộ của Việt Nam;\n\nc) Người có giấy phép lái xe quốc tế vi phạm pháp luật về trật tự, an toàn giao thông đường bộ của Việt Nam mà bị tước quyền sử dụng giấy phép lái xe có thời hạn thì thời gian bị tước quyền sử dụng không quá thời gian người lái xe được phép cư trú tại lãnh thổ Việt Nam;\n\nd) Người Việt Nam hoặc người nước ngoài có thẻ thường trú hoặc thẻ tạm trú tại Việt Nam có giấy phép lái xe do Việt Nam hoặc quốc gia là thành viên của điều ước quốc tế mà nước Cộng hòa xã hội chủ nghĩa Việt Nam là thành viên cấp, còn giá trị sử dụng, nếu có nhu cầu được cấp giấy phép lái xe quốc tế.\n\n9. Bộ trưởng Bộ Giao thông vận tải quy định mẫu giấy phép lái xe và giấy phép lái xe quốc tế, trình tự, thủ tục cấp và việc sử dụng giấy phép lái xe, giấy phép lái xe quốc tế; đối với mẫu giấy phép lái xe, trình tự, thủ tục cấp và việc sử dụng giấy phép lái xe của lực lượng quân đội, công an làm nhiệm vụ quốc phòng, an ninh do Bộ trưởng Bộ Quốc phòng, Bộ trưởng Bộ Công an quy định.\n\nĐiều 58. Điểm của giấy phép lái xe \n\n1. Điểm của giấy phép lái xe được dùng để quản lý việc chấp hành pháp luật về trật tự, an toàn giao thông đường bộ của người lái xe trên hệ thống cơ sở dữ liệu về trật tự, an toàn giao thông đường bộ, bao gồm 12 điểm. Số điểm trừ mỗi lần vi phạm tùy thuộc tính chất, mức độ của hành vi vi phạm pháp luật về trật tự, an toàn giao thông đường bộ. Dữ liệu về điểm trừ giấy phép lái xe của người vi phạm sẽ được cập nhật vào hệ thống cơ sở dữ liệu ngay sau khi quyết định xử phạt có hiệu lực thi hành và thông báo cho người bị trừ điểm giấy phép lái xe biết.\n\n2. Giấy phép lái xe chưa bị trừ hết điểm và không bị trừ điểm trong thời hạn 12 tháng từ ngày bị trừ điểm gần nhất thì được phục hồi đủ 12 điểm.\n\n3. Trường hợp giấy phép lái xe bị trừ hết điểm thì người có giấy phép lái xe không được điều khiển phương tiện tham gia giao thông đường bộ theo giấy phép lái xe đó. Sau thời hạn ít nhất là 06 tháng kể từ ngày bị trừ hết điểm, người có giấy phép lái xe được tham gia kiểm tra nội dung kiến thức pháp luật về trật tự, an toàn giao thông đường bộ theo quy định tại khoản 7 Điều 61 của Luật này do lực lượng Cảnh sát giao thông tổ chức, có kết quả đạt yêu cầu thì được phục hồi đủ 12 điểm.\n\n4. Giấy phép lái xe sau khi đổi, cấp lại, nâng hạng được giữ nguyên số điểm của giấy phép lái xe trước khi đổi, cấp lại, nâng hạng.\n\n5. Người có thẩm quyền xử phạt vi phạm hành chính có thẩm quyền trừ điểm giấy phép lái xe.\n\n6. Chính phủ quy định chi tiết khoản 1 Điều này; quy định trình tự, thủ tục, thẩm quyền trừ điểm, phục hồi điểm giấy phép lái xe; quy định lộ trình thực hiện Điều này. Bộ trưởng Bộ Công an quy định chi tiết khoản 3 Điều này.\n\nĐiều 59. Tuổi, sức khỏe của người điều khiển phương tiện tham gia giao thông đường bộ\n\n1. Độ tuổi của người lái xe, người điều khiển xe máy chuyên dùng được quy định như sau:\n\na) Người đủ 16 tuổi trở lên được điều khiển xe gắn máy;\n\nb) Người đủ 18 tuổi trở lên được cấp giấy phép lái xe hạng A1, A, B1, B, C1, được cấp chứng chỉ bồi dưỡng kiến thức pháp luật về giao thông đường bộ để điều khiển xe máy chuyên dùng tham gia giao thông đường bộ;\n\nc) Người đủ 21 tuổi trở lên được cấp giấy phép lái xe hạng C, BE;\n\nd) Người đủ 24 tuổi trở lên được cấp giấy phép lái xe hạng D1, D2, C1E, CE;\n\nđ) Người đủ 27 tuổi trở lên được cấp giấy phép lái xe hạng D, D1E, D2E, DE;\n\ne) Tuổi tối đa của người lái xe ô tô chở người (kể cả xe buýt) trên 29 chỗ (không kể chỗ của người lái xe), xe ô tô chở người giường nằm là đủ 57 tuổi đối với nam, đủ 55 tuổi đối với nữ.\n\n2. Người điều khiển phương tiện tham gia giao thông đường bộ phải bảo đảm điều kiện sức khỏe phù hợp với từng loại phương tiện được phép điều khiển. Bộ trưởng Bộ Y tế quy định về tiêu chuẩn sức khỏe, việc khám sức khỏe đối với người lái xe, người điều khiển xe máy chuyên dùng; việc khám sức khỏe định kỳ đối với người hành nghề lái xe ô tô; xây dựng cơ sở dữ liệu về sức khỏe của người lái xe, người điều khiển xe máy chuyên dùng.\n\n3. Bộ trưởng Bộ Quốc phòng, Bộ trưởng Bộ Công an quy định độ tuổi của người lái xe trong lực lượng quân đội, công an làm nhiệm vụ quốc phòng, an ninh.\n\nĐiều 60. Đào tạo lái xe\n\n1. Người có nhu cầu được cấp giấy phép lái xe phải được đào tạo nội dung lý thuyết và thực hành theo chương trình đào tạo quy định cho từng hạng giấy phép lái xe.\n\n2. Người học lái xe phải được đào tạo tại các cơ sở đào tạo lái xe hoặc các hình thức đào tạo lái xe khác để cấp mới hoặc nâng hạng giấy phép lái xe.\n\n3. Việc đào tạo để nâng hạng giấy phép lái xe thực hiện đối với những đối tượng sau đây:\n\na) Nâng hạng giấy phép lái xe từ hạng B lên hạng C1 hoặc lên hạng C hoặc lên hạng D1 hoặc lên hạng D2;\n\nb) Nâng hạng giấy phép lái xe từ hạng C1 lên hạng C hoặc lên hạng D1 hoặc lên hạng D2;\n\nc) Nâng hạng giấy phép lái xe từ hạng C lên hạng D1 hoặc lên hạng D2 hoặc lên hạng D;\n\nd) Nâng hạng giấy phép lái xe từ hạng D1 lên hạng D2 hoặc lên hạng D;\n\nđ) Nâng hạng giấy phép lái xe từ hạng D2 lên hạng D;\n\ne) Nâng hạng giấy phép lái xe từ hạng B lên hạng BE, từ hạng C1 lên\xa0 hạng C1E, từ hạng C lên hạng CE, từ hạng D1 lên hạng D1E, từ hạng D2 lên hạng D2E, từ hạng D lên hạng DE.\n\n4.\xa0Người có nhu cầu được đào tạo nâng hạng giấy phép lái xe khi giấy phép lái xe còn hiệu lực, phải có đủ thời gian lái xe an toàn quy định cho từng hạng giấy phép lái xe;\xa0đối với việc nâng hạng giấy phép lái xe lên hạng D1, D2, D thì người có nhu cầu được đào tạo còn phải có trình độ từ trung học cơ sở trở lên.\n\n5. Giấy phép lái xe các hạng C, D1, D2, D, BE, C1E, CE, D1E, D2E, DE phải được đào tạo bằng hình thức đào tạo nâng hạng theo các điều kiện quy định tại khoản 3 và khoản 4 Điều này.\n\n6. Cơ sở đào tạo lái xe ô tô phải đáp ứng các điều kiện do Chính phủ quy định; có giáo trình, giáo án; thực hiện đào tạo theo đúng hình thức, nội dung và chương trình quy định cho từng hạng giấy phép lái xe.\n\n7. Chính phủ quy định chi tiết các hình thức đào tạo lái xe khác quy định tại khoản 2 Điều này; quy định trình tự, thủ tục kiểm tra, đánh giá để cấp, cấp lại và thu hồi giấy phép xe tập lái; quy định tiêu chuẩn của giáo viên dạy lái xe; quy định việc cấp, cấp lại và thu hồi giấy chứng nhận giáo viên dạy lái xe; quy định việc cấp, cấp lại và thu hồi giấy phép đào tạo lái xe.\n\n8. Bộ trưởng Bộ Giao thông vận tải quy định hình thức, nội dung, chương trình đào tạo lái xe, thời gian lái xe an toàn cho từng hạng giấy phép lái xe quy định tại khoản 4 Điều này và quy định tiêu chuẩn của cơ sở đào tạo lái xe mô tô; đối với cơ sở đào tạo, tổ chức đào tạo lái xe cho lực lượng quân đội, công an làm nhiệm vụ quốc phòng, an ninh do Bộ trưởng Bộ Quốc phòng, Bộ trưởng Bộ Công an quy định.\n\nĐiều 61. Sát hạch lái xe\n\n1. Người đã hoàn thành chương trình đào tạo lái xe, có độ tuổi, sức khỏe theo quy định tại Điều 59 của Luật này được đăng ký để tham dự kỳ sát hạch lái xe.\n\n2. Nội dung sát hạch lái xe phải phù hợp với hạng giấy phép lái xe và chương trình đào tạo lái xe.\n\n3. Hoạt động sát hạch lái xe ô tô phải thực hiện tại các trung tâm sát hạch lái xe; hoạt động sát hạch lái xe mô tô thực hiện tại các trung tâm sát hạch lái xe hoặc tại sân tập lái đáp ứng điều kiện, tiêu chuẩn về cơ sở vật chất, kỹ thuật. Hoạt động sát hạch lái xe do cơ quan nhà nước có thẩm quyền thực hiện.', 'đ) Không trừ điểm giấy phép lái xe khi giấy phép lái xe đó đang trong thời hạn bị tước quyền sử dụng giấy phép lái xe.\n\n2. Thẩm quyền trừ điểm giấy phép lái xe\n\nNgười có thẩm quyền áp dụng hình thức xử phạt tước quyền sử dụng giấy phép, chứng chỉ hành nghề có thời hạn hoặc đình chỉ hoạt động có thời hạn quy định tại Chương II Phần thứ hai của Luật Xử lý vi phạm hành chính, Mục 1 Chương III của Nghị định này và có thẩm quyền xử phạt vi phạm hành chính đối với hành vi vi phạm có quy định trừ điểm giấy phép lái xe thì có thẩm quyền trừ điểm giấy phép lái xe đối với hành vi vi phạm đó.\n\n3. Trình tự, thủ tục trừ điểm giấy phép lái xe\n\na) Ngay sau khi quyết định xử phạt vi phạm hành chính có hiệu lực thi hành, dữ liệu trừ điểm giấy phép lái xe của người bị xử phạt sẽ được cập nhật tự động vào Cơ sở dữ liệu về xử lý vi phạm hành chính về trật tự, an toàn giao thông đường bộ, người có thẩm quyền trừ điểm giấy phép lái xe thông báo cho người bị trừ điểm giấy phép lái xe biết việc trừ điểm.\n\nTrường hợp Chủ tịch Ủy ban nhân dân cấp huyện, Chủ tịch Ủy ban nhân dân cấp tỉnh ra quyết định xử phạt vi phạm hành chính đối với hành vi vi phạm có trừ điểm giấy phép lái xe thì Trưởng Công an cấp huyện hoặc Trưởng phòng Cảnh sát giao thông Công an cấp tỉnh có trách nhiệm cập nhật dữ liệu trừ điểm giấy phép lái xe vào Cơ sở dữ liệu về xử lý vi phạm hành chính về trật tự, an toàn giao thông đường bộ;\n\nb) Việc thông báo trừ điểm giấy phép lái xe thực hiện bằng văn bản theo mẫu quy định của Bộ trưởng Bộ Công an và được giao trực tiếp hoặc gửi qua dịch vụ bưu chính hoặc thực hiện thông báo bằng phương thức điện tử thông qua tài khoản của công dân đăng ký trên Cổng dịch vụ công, Ứng dụng giao thông trên thiết bị di động khi đáp ứng điều kiện về cơ sở hạ tầng, kỹ thuật, thông tin; đồng thời cập nhật thông tin về giấy phép lái xe bị trừ điểm trên Trang thông tin điện tử của Cục Cảnh sát giao thông. Trường hợp giấy phép lái xe được thể hiện dưới hình thức thông điệp dữ liệu thì cơ quan, người có thẩm quyền thực hiện cập nhật trạng thái trừ điểm giấy phép lái xe trong căn cước điện tử, tài khoản định danh điện tử trên ứng dụng định danh quốc gia.\n\nĐiều 51. Thẩm quyền, trình tự, thủ tục phục hồi điểm giấy phép lái xe\n\n1. Thẩm quyền phục hồi điểm giấy phép lái xe\n\na) Cục trưởng Cục Cảnh sát giao thông có trách nhiệm quản lý, vận hành Cơ sở dữ liệu về xử lý vi phạm hành chính về trật tự, an toàn giao thông đường bộ để thực hiện cập nhật, tự động phục hồi điểm giấy phép lái xe đối với trường hợp quy định tại khoản 2 Điều này;\n\nb) Cục trưởng Cục Cảnh sát giao thông, Trưởng phòng Cảnh sát giao thông nơi tổ chức kiểm tra kiến thức pháp luật về trật tự, an toàn giao thông đường bộ có thẩm quyền phục hồi điểm cho giấy phép lái xe đối với trường hợp quy định tại khoản 3 Điều này.\n\n2. Trình tự, thủ tục phục hồi điểm giấy phép lái xe đối với trường hợp giấy phép lái xe chưa bị trừ hết điểm và không bị trừ điểm trong thời hạn 12 tháng từ ngày bị trừ điểm gần nhất\n\na) Khi đủ thời hạn 12 tháng, kể từ ngày bị trừ điểm giấy phép lái xe gần nhất, dữ liệu điểm giấy phép lái xe sẽ được tự động phục hồi đủ 12 điểm (gồm cả giấy phép lái xe đang trong thời hạn bị tước quyền sử dụng) và cập nhật tự động trong Cơ sở dữ liệu về xử lý vi phạm hành chính về trật tự, an toàn giao thông đường bộ;\n\nb) Ngay sau khi dữ liệu điểm giấy phép lái xe được phục hồi, Cơ sở dữ liệu về xử lý vi phạm hành chính về trật tự, an toàn giao thông đường bộ sẽ tự động chuyển thông tin thông báo cho người được phục hồi điểm giấy phép lái xe biết việc phục hồi điểm theo quy định tại điểm c khoản này;\n\nc) Việc thông báo phục hồi điểm giấy phép lái xe thực hiện bằng phương thức điện tử thông qua tài khoản của công dân đăng ký trên Cổng dịch vụ công, Ứng dụng giao thông trên thiết bị di động; đồng thời cập nhật thông tin về giấy phép lái xe được phục hồi điểm trên Trang thông tin điện tử của Cục Cảnh sát giao thông. Trường hợp giấy phép lái xe được thể hiện dưới hình thức thông điệp dữ liệu thì thực hiện cập nhật trạng thái phục hồi điểm giấy phép lái xe trong căn cước điện tử, tài khoản định danh điện tử trên ứng dụng định danh quốc gia.\n\n3. Trình tự, thủ tục phục hồi điểm giấy phép lái xe đối với trường hợp giấy phép lái xe bị trừ hết điểm\n\na) Sau khi người có giấy phép lái xe bị trừ hết điểm tham gia kiểm tra nội dung kiến thức pháp luật về trật tự, an toàn giao thông đường bộ và đạt yêu cầu, kết quả kiểm tra được cập nhật vào phần mềm kiểm tra kiến thức pháp luật về trật tự, an toàn giao thông đường bộ và đồng bộ dữ liệu với Cơ sở dữ liệu về xử lý vi phạm hành chính về trật tự, an toàn giao thông đường bộ, dữ liệu điểm giấy phép lái xe sẽ được phục hồi đủ 12 điểm và cập nhật tự động trong Cơ sở dữ liệu về xử lý vi phạm hành chính về trật tự, an toàn giao thông đường bộ;\n\nb) Ngay sau khi dữ liệu điểm giấy phép lái xe được phục hồi đủ 12 điểm thì người có thẩm quyền quy định tại điểm b khoản 1 Điều này thông báo cho người được phục hồi điểm giấy phép lái xe biết việc phục hồi điểm;\n\nc) Việc thông báo phục hồi điểm giấy phép lái xe thực hiện bằng văn bản theo mẫu quy định của Bộ trưởng Bộ Công an và được giao trực tiếp hoặc gửi qua dịch vụ bưu chính hoặc thực hiện thông báo bằng phương thức điện tử thông qua tài khoản của công dân đăng ký trên Cổng dịch vụ công, Ứng dụng giao thông trên thiết bị di động; đồng thời cập nhật thông tin về giấy phép lái xe được phục hồi điểm trên Trang thông tin điện tử của Cục Cảnh sát giao thông. Trường hợp giấy phép lái xe được thể hiện dưới hình thức thông điệp dữ liệu thì cơ quan, người có thẩm quyền thực hiện cập nhật trạng thái phục hồi điểm giấy phép lái xe trong căn cước điện tử, tài khoản định danh điện tử trên ứng dụng định danh quốc gia.\n\nChương IV\n\nĐIỀU KHOẢN THI HÀNH\n\nĐiều 52. Sửa đổi, bổ sung một số điều của Nghị định số 100/2019/NĐ-CP ngày 30 tháng 12 năm 2019 của Chính phủ quy định xử phạt vi phạm hành chính trong lĩnh vực giao thông đường bộ và đường sắt đã được sửa đổi, bổ sung một số điều theo Nghị định số 123/2021/NĐ-CP ngày 28 tháng 12 năm 2021 của Chính phủ sửa đổi, bổ sung một số điều của các Nghị định quy định xử phạt vi phạm hành chính trong lĩnh vực hàng hải; giao thông đường bộ, đường sắt; hàng không dân dụng\n\n1. Bổ sung khoản 2a vào sau khoản 2 Điều 1 như sau:\n\n“2a. Hình thức, mức xử phạt, biện pháp khắc phục hậu quả đối với từng hành vi vi phạm hành chính; thẩm quyền lập biên bản, thẩm quyền xử phạt, mức phạt tiền cụ thể đối với từng chức danh về trật tự, an toàn giao thông trong lĩnh vực giao thông đường bộ thì áp dụng quy định tại Nghị định quy định xử phạt vi phạm hành chính về trật tự, an toàn giao thông trong lĩnh vực giao thông đường bộ; trừ điểm, phục hồi điểm giấy phép lái xe”.\n\n2. Sửa đổi, bổ sung một số điểm của khoản 6 Điều 28 như sau:\n\na) Sửa đổi, bổ sung điểm d khoản 6 Điều 28 như sau:\n\n“d) Không thực hiện đúng các nội dung đã đăng ký, niêm yết về: giá cước; giá dịch vụ; tiêu chuẩn chất lượng dịch vụ vận tải, dịch vụ hỗ trợ vận tải;”;\n\nb) Sửa đổi, bổ sung điểm i khoản 6 Điều 28 như sau:\n\n“i) Sử dụng phương tiện kinh doanh vận tải có chất lượng không bảo đảm điều kiện của hình thức kinh doanh đã đăng ký;”.\n\n3. Sửa đổi, bổ sung điểm a, điểm b khoản 10 Điều 28 như sau:\n\n“a) Thực hiện hành vi vi phạm quy định tại điểm a, điểm b, điểm d, điểm đ, điểm h, điểm l, điểm o, điểm p, điểm r, điểm s, điểm t khoản 4; điểm d, điểm i, điểm k, điểm l, điểm n, điểm q khoản 6; điểm e khoản 7 Điều này bị tước quyền sử dụng phù hiệu từ 01 tháng đến 03 tháng (nếu có hoặc đã được cấp) đối với xe vi phạm;\n\nb) Thực hiện hành vi vi phạm quy định tại điểm i, điểm k khoản 4; điểm h khoản 6; điểm b khoản 7 Điều này bị tước quyền sử dụng giấy phép kinh doanh vận tải từ 01 tháng đến 03 tháng;”.\n\n4. Sửa đổi, bổ sung điểm h khoản 11 Điều 28 như sau:\n\n“h) Thực hiện hành vi vi phạm quy định tại điểm n khoản 6 Điều này buộc lắp đặt đồng hồ tính tiền cước, thiết bị in hóa đơn trên xe theo đúng quy định;”.\n\n5. Sửa đổi, bổ sung một số điểm, khoản của Điều 74 như sau:', 'c) Lưu trữ, bảo quản biên bản sát hạch thực hành lái xe trên đường của từng kỳ sát hạch, gồm: chữ ký của thí sinh tại phiếu kết quả sát hạch thực hành lái xe trên đường được in từ thiết bị chấm điểm tự động trên ô tô sát hạch thực hành lái xe trên đường hoặc biên bản sát hạch thực hành lái xe trên đường có chữ ký của sát hạch viên;\n\nd) Trường hợp cơ sở đào tạo lái xe có sân tập lái dùng để thực hiện sát hạch lái xe mô tô phải lưu trữ dữ liệu giám sát sát hạch; dữ liệu kết quả sát hạch lý thuyết, thực hành lái xe trong hình với thời hạn 03 năm.\n\n3. Trung tâm sát hạch lái xe lưu trữ hồ sơ của kỳ sát hạch bao gồm:\n\na) Các tài liệu quy định tại các điểm d, điểm g và điểm h khoản 1 Điều này;\n\nb) Dữ liệu giám sát sát hạch; dữ liệu kết quả sát hạch lý thuyết, thực hành lái xe trong hình, phần mềm mô phỏng các tình huống giao thông và sát hạch trên đường;\n\nc) Danh sách, kết quả sát hạch lái xe trên phần mềm mô phỏng các tình huống giao thông.\n\n4. Thí sinh tự bảo quản Biên bản tổng hợp kết quả sát hạch.\n\n5. Thời gian lưu trữ hồ sơ\n\na) Không thời hạn đối với các tài liệu quy định tại điểm i và điểm k khoản 1 Điều này;\n\nb) 05 năm đối với các tài liệu quy định tại các điểm a, điểm b, điểm c, điểm d, điểm đ, điểm e, điểm g, điểm h khoản 1 Điều này;\n\nc) 02 năm đối với các tài liệu quy định tại điểm b khoản 3 Điều này.\n\nChương III\n\nCẤP, THU HỒI GIẤY PHÉP LÁI XE\n\nĐiều 31. Mẫu giấy phép lái xe\n\n1. Sở Giao thông vận tải thực hiện việc cấp giấy phép lái xe theo quy định tại Mẫu số 01 Phụ lục XXIV ban hành kèm theo Thông tư này kể từ ngày Thông tư này có hiệu lực đến hết ngày 31 tháng 12 năm 2025; việc cấp giấy phép lái xe theo quy định tại Mẫu số 02 Phụ lục XXIV ban hành kèm theo Thông tư được thực hiện kể từ ngày 01 tháng 01 năm 2026.\n\n2. Việc ghi điều kiện hạn chế của giấy phép lái xe áp dụng cho cả Mẫu số 01 và Mẫu số 02 thực hiện theo quy định tại mục 2 của Mẫu số 03 Phụ lục XXIV ban hành kèm theo Thông tư này.\n\n3. Việc ghi danh mục hạng giấy phép lái xe và mã số điều kiện hạn chế thực hiện đối với giấy phép lái xe theo Mẫu số 02 thực hiện theo quy định tại mục 1 và mục 3 của Mẫu số 03 Phụ lục XXIV ban hành kèm theo Thông tư này.\n\nĐiều 32. Sử dụng, quản lý giấy phép lái xe\n\n1. Giấy phép lái xe bằng vật liệu PET. cấp cho mỗi người bảo đảm duy nhất có 01 số quản lý, dùng chung cho cả giấy phép lái xe không thời hạn và giấy phép lái xe có thời hạn.\n\n2. Cá nhân nếu có nhu cầu tích hợp giấy phép lái xe không thời hạn với giấy phép lái xe có thời hạn thì đăng ký vào đơn đề nghị đổi (cấp lại) giấy phép lái xe quy định tại Phụ lục XXVI ban hành kèm theo Thông tư này, làm thủ tục đổi giấy phép lái xe theo quy định tại Điều 36 của Thông tư này.\n\n3. Người có giấy phép lái xe chỉ được lái loại xe ghi trong giấy phép lái xe.\n\n4. Khi đổi, cấp giấy phép lái xe nâng hạng, cơ quan cấp giấy phép lái xe thu lại giấy phép lái xe cũ và tiêu huỷ theo quy định của pháp luật về lưu trữ.\n\n5. Người có giấy phép lái xe hạng B số tự động không được lái loại xe ô tô số cơ khí (số sàn).\n\n6. Người nước ngoài hoặc người Việt Nam cư trú ở nước ngoài có nhu cầu lái xe ở Việt Nam thực hiện như sau:\n\na) Nếu có giấy phép lái xe quốc gia thì phải làm thủ tục đổi sang giấy phép lái xe tương ứng của Việt Nam;\n\nb) Trường hợp điều ước quốc tế về giấy phép lái xe mà Việt Nam là thành viên có quy định khác thì áp dụng quy định của điều ước quốc tế đó.\n\n7. Giấy phép lái xe bằng vật liệu PET. và giấy phép lái xe cấp từ ngày 01 tháng 01 năm 2025 là giấy phép lái xe do cơ quan có thẩm quyền cấp có hiệu lực, có số phôi, ngày cấp, ngày hết hạn in trên giấy phép lái xe trùng với số phôi, ngày cấp, ngày hết hạn trong hệ thống thông tin quản lý giấy phép lái xe hoặc có thông tin giấy phép lái xe đã được tích hợp vào tài khoản định danh điện tử.\n\nĐiều 33. Xác minh giấy phép lái xe\n\n1. Các trường hợp thực hiện xác minh\n\na) Cấp, đổi giấy phép lái xe do ngành Giao thông vận tải cấp\n\nSở Giao thông vận tải phải tra cứu và in thông tin về giấy phép lái xe trong các trường hợp xét sát hạch nâng hạng, đổi, cấp lại giấy phép lái xe từ hệ thống thông tin quản lý giấy phép lái xe; trường hợp chưa có thông tin phải có văn bản đề nghị cơ quan đã cấp giấy phép lái xe xác minh giấy phép lái xe đã cấp.\n\nKhi chưa có kết quả xác minh giấy phép lái xe hoặc có kết quả xác minh giấy phép lái xe không do Sở Giao thông vận tải cấp thì Sở Giao thông vận tải không xét sát hạch nâng hạng, đổi, cấp lại giấy phép lái xe;\n\nb) Đổi giấy phép lái xe quân sự do Bộ Quốc phòng cấp sang giấy phép lái xe do ngành Giao thông vận tải cấp\n\nTrường hợp phát hiện có nghi vấn, cơ quan cấp đổi giấy phép lái xe có văn bản đề nghị Cục Xe - Máy thuộc Bộ Quốc phòng xác minh giấy phép lái xe đã cấp.\n\nKhi chưa có kết quả xác minh giấy phép lái xe hoặc có kết quả xác minh giấy phép lái xe không do Bộ Quốc phòng cấp thì Sở Giao thông vận tải không đổi giấy phép lái xe;\n\nc) Đổi giấy phép lái xe do ngành Công an cấp sang giấy phép lái xe do ngành Giao thông vận tải cấp\n\nTrường hợp phát hiện có nghi vấn, cơ quan cấp đổi giấy phép lái xe có văn bản đề nghị Cục Cảnh sát giao thông thuộc Bộ Công an quản lý giấy phép lái xe xác minh giấy phép lái xe đã cấp.\n\nKhi chưa có kết quả xác minh giấy phép lái xe hoặc có kết quả xác minh giấy phép lái xe không do ngành Công an cấp thì Sở Giao thông vận tải không đổi giấy phép lái xe.\n\n2. Cách thức thực hiện xác minh giấy phép lái xe\n\na) Sau 01 ngày làm việc kể từ ngày nhận được danh sách đề nghị xác minh giấy phép lái xe của cơ sở đào tạo lái xe hoặc hồ sơ hợp lệ quy định tại Điều 36, Điều 37 và Điều 38 Thông tư này, Sở Giao thông vận tải có văn bản bản đề nghị xác minh giấy phép lái xe theo Mẫu số 01 Phụ lục XXV ban hành kèm theo Thông tư này gửi cơ quan đã cấp giấy phép lái xe;\n\nb) Ngay khi nhận được văn bản đề nghị xác minh, Sở Giao thông vận tải tiếp nhận xác minh giấy phép lái xe phải trả lời bằng hình thức điện thoại hoặc thư điện tử hoặc fax; sau 02 ngày làm việc có văn bản trả lời theo Mẫu số 02 quy định tại Phụ lục XXV ban hành kèm theo Thông tư này.\n\nĐiều 34. Cấp giấy phép lái xe\n\n1. Người đạt kết quả kỳ sát hạch được cấp giấy phép lái xe đúng hạng đã trúng tuyển; đối với trường hợp nâng hạng hoặc cấp theo quy định tại khoản 2\n\nĐiều này phải xuất trình bản chính giấy phép lái xe khi đến nhận giấy phép lái xe\n\na) Căn cứ quyết định công nhận trúng tuyển kỳ sát hạch, Sở Giao thông vận tải cấp giấy phép lái xe cho người trúng tuyển. Ngày trúng tuyển ghi tại mặt sau giấy phép lái xe là ngày ký quyết định công nhận trúng tuyển kỳ sát hạch;\n\nb) Thời gian cấp giấy phép lái xe chậm nhất không quá 10 ngày, kể từ ngày kết thúc kỳ sát hạch và người đạt kết quả kỳ sát hạch đã hoàn thành nghĩa vụ nộp lệ phí cấp giấy phép lái xe.\n\n2. Người có giấy phép lái xe quá thời hạn sử dụng\n\na) Người có giấy phép lái xe các hạng B, C1, C, D1, D2, D, BE, C1E, CE, D1E, D2E, DE quá thời hạn sử dụng\n\nQuá hạn dưới 01 năm kể từ ngày hết hạn phải sát hạch lý thuyết theo quy định tại điểm a khoản 1 Điều 17 Thông tư này để cấp giấy phép lái xe.\n\nQuá hạn từ 01 năm trở lên kể từ ngày hết hạn phải sát hạch lý thuyết, thực hành lái xe trong hình và trên đường để cấp giấy phép lái xe theo quy định tại khoản 1, khoản 2 và khoản 3 Điều 17 Thông tư này.\n\nHồ sơ dự sát hạch thực hiện theo quy định tại khoản 3 Điều 29 Thông tư này;\n\nb) Người có giấy phép lái xe các hạng B, C1, C, D1, D2, D, BE, C1E, CE, D1E, D2E, DE bị mất nhưng quá thời hạn sử dụng, có tên trong hồ sơ của Sở Giao thông vận tải, không thuộc trường hợp đang bị các cơ quan có thẩm quyền thu giữ, xử lý phải dự sát hạch các nội dung:\n\nQuá hạn dưới 01 năm, phải dự sát hạch lý thuyết để cấp giấy phép lái xe theo quy định tại điểm a khoản 1 Điều 17 Thông tư này.\n\nQuá hạn từ 01 năm trở lên kể từ ngày hết hạn phải sát hạch lý thuyết, thực hành lái xe trong hình và trên đường để cấp giấy phép lái xe theo quy định tại khoản 1, khoản 2 và khoản 3 Điều 17 Thông tư này.\n\nHồ sơ dự sát hạch thực hiện theo quy định tại khoản 3 Điều 29 của Thông tư này;']","**Nguồn văn bản:** 36_2024_QH15_444251

**Tên văn bản:** Luật Giao thông đường bộ

**Điều 58:** Điểm của giấy phép lái xe

**Nội dung:**

1. Điểm của giấy phép lái xe được dùng để quản lý việc chấp hành pháp luật về trật tự, an toàn giao thông đường bộ của người lái xe trên hệ thống cơ sở dữ liệu về trật tự, an toàn giao thông đường bộ, bao gồm 12 điểm. Số điểm trừ mỗi lần vi phạm tùy thuộc tính chất, mức độ của hành vi vi phạm pháp luật về trật tự, an toàn giao thông đường bộ. Dữ liệu về điểm trừ giấy phép lái xe của người vi phạm sẽ được cập nhật vào hệ thống cơ sở dữ liệu ngay sau khi quyết định xử phạt có hiệu lực thi hành và thông báo cho người bị trừ điểm giấy phép lái xe biết.

2. Giấy phép lái xe chưa bị trừ hết điểm và không bị trừ điểm trong thời hạn 12 tháng từ ngày bị trừ điểm gần nhất thì được phục hồi đủ 12 điểm.

3. Trường hợp giấy phép lái xe bị trừ hết điểm thì người có giấy phép lái xe không được điều khiển phương tiện tham gia giao thông đường bộ theo giấy phép lái xe đó. Sau thời hạn ít nhất là 06 tháng kể từ ngày bị trừ hết điểm, người có giấy phép lái xe được tham gia kiểm tra nội dung kiến thức pháp luật về trật tự, an toàn giao thông đường bộ theo quy định tại khoản 7 Điều 61 của Luật này do lực lượng Cảnh sát giao thông tổ chức, có kết quả đạt yêu cầu thì được phục hồi đủ 12 điểm.

4. Giấy phép lái xe sau khi đổi, cấp lại, nâng hạng được giữ nguyên số điểm của giấy phép lái xe trước khi đổi, cấp lại, nâng hạng.

5. Người có thẩm quyền xử phạt vi phạm hành chính có thẩm quyền trừ điểm giấy phép lái xe.

6. Chính phủ quy định chi tiết khoản 1 Điều này; quy định trình tự, thủ tục, thẩm quyền trừ điểm, phục hồi điểm giấy phép lái xe; quy định lộ trình thực hiện Điều này. Bộ trưởng Bộ Công an quy định chi tiết khoản 3 Điều này.


Tóm lại: Giấy phép lái xe có 12 điểm.  Vi phạm luật giao thông sẽ bị trừ điểm, tùy thuộc vào mức độ vi phạm.  Điểm sẽ được phục hồi tự động sau 12 tháng nếu chưa bị trừ hết điểm hoặc sau 6 tháng và kiểm tra lại kiến thức nếu bị trừ hết điểm.  Chính phủ và Bộ Công an sẽ quy định chi tiết về việc trừ và phục hồi điểm.
","Mỗi giấy phép lái xe có 12 điểm; nếu bị trừ hết điểm, người lái xe phải tham gia kiểm tra phục hồi điểm.",0.9411764705882353,0.7224936585084243,1.0,0.99999999995
11,Người lái xe máy cần làm gì để phục hồi điểm giấy phép lái xe?,"['đ) Không trừ điểm giấy phép lái xe khi giấy phép lái xe đó đang trong thời hạn bị tước quyền sử dụng giấy phép lái xe.\n\n2. Thẩm quyền trừ điểm giấy phép lái xe\n\nNgười có thẩm quyền áp dụng hình thức xử phạt tước quyền sử dụng giấy phép, chứng chỉ hành nghề có thời hạn hoặc đình chỉ hoạt động có thời hạn quy định tại Chương II Phần thứ hai của Luật Xử lý vi phạm hành chính, Mục 1 Chương III của Nghị định này và có thẩm quyền xử phạt vi phạm hành chính đối với hành vi vi phạm có quy định trừ điểm giấy phép lái xe thì có thẩm quyền trừ điểm giấy phép lái xe đối với hành vi vi phạm đó.\n\n3. Trình tự, thủ tục trừ điểm giấy phép lái xe\n\na) Ngay sau khi quyết định xử phạt vi phạm hành chính có hiệu lực thi hành, dữ liệu trừ điểm giấy phép lái xe của người bị xử phạt sẽ được cập nhật tự động vào Cơ sở dữ liệu về xử lý vi phạm hành chính về trật tự, an toàn giao thông đường bộ, người có thẩm quyền trừ điểm giấy phép lái xe thông báo cho người bị trừ điểm giấy phép lái xe biết việc trừ điểm.\n\nTrường hợp Chủ tịch Ủy ban nhân dân cấp huyện, Chủ tịch Ủy ban nhân dân cấp tỉnh ra quyết định xử phạt vi phạm hành chính đối với hành vi vi phạm có trừ điểm giấy phép lái xe thì Trưởng Công an cấp huyện hoặc Trưởng phòng Cảnh sát giao thông Công an cấp tỉnh có trách nhiệm cập nhật dữ liệu trừ điểm giấy phép lái xe vào Cơ sở dữ liệu về xử lý vi phạm hành chính về trật tự, an toàn giao thông đường bộ;\n\nb) Việc thông báo trừ điểm giấy phép lái xe thực hiện bằng văn bản theo mẫu quy định của Bộ trưởng Bộ Công an và được giao trực tiếp hoặc gửi qua dịch vụ bưu chính hoặc thực hiện thông báo bằng phương thức điện tử thông qua tài khoản của công dân đăng ký trên Cổng dịch vụ công, Ứng dụng giao thông trên thiết bị di động khi đáp ứng điều kiện về cơ sở hạ tầng, kỹ thuật, thông tin; đồng thời cập nhật thông tin về giấy phép lái xe bị trừ điểm trên Trang thông tin điện tử của Cục Cảnh sát giao thông. Trường hợp giấy phép lái xe được thể hiện dưới hình thức thông điệp dữ liệu thì cơ quan, người có thẩm quyền thực hiện cập nhật trạng thái trừ điểm giấy phép lái xe trong căn cước điện tử, tài khoản định danh điện tử trên ứng dụng định danh quốc gia.\n\nĐiều 51. Thẩm quyền, trình tự, thủ tục phục hồi điểm giấy phép lái xe\n\n1. Thẩm quyền phục hồi điểm giấy phép lái xe\n\na) Cục trưởng Cục Cảnh sát giao thông có trách nhiệm quản lý, vận hành Cơ sở dữ liệu về xử lý vi phạm hành chính về trật tự, an toàn giao thông đường bộ để thực hiện cập nhật, tự động phục hồi điểm giấy phép lái xe đối với trường hợp quy định tại khoản 2 Điều này;\n\nb) Cục trưởng Cục Cảnh sát giao thông, Trưởng phòng Cảnh sát giao thông nơi tổ chức kiểm tra kiến thức pháp luật về trật tự, an toàn giao thông đường bộ có thẩm quyền phục hồi điểm cho giấy phép lái xe đối với trường hợp quy định tại khoản 3 Điều này.\n\n2. Trình tự, thủ tục phục hồi điểm giấy phép lái xe đối với trường hợp giấy phép lái xe chưa bị trừ hết điểm và không bị trừ điểm trong thời hạn 12 tháng từ ngày bị trừ điểm gần nhất\n\na) Khi đủ thời hạn 12 tháng, kể từ ngày bị trừ điểm giấy phép lái xe gần nhất, dữ liệu điểm giấy phép lái xe sẽ được tự động phục hồi đủ 12 điểm (gồm cả giấy phép lái xe đang trong thời hạn bị tước quyền sử dụng) và cập nhật tự động trong Cơ sở dữ liệu về xử lý vi phạm hành chính về trật tự, an toàn giao thông đường bộ;\n\nb) Ngay sau khi dữ liệu điểm giấy phép lái xe được phục hồi, Cơ sở dữ liệu về xử lý vi phạm hành chính về trật tự, an toàn giao thông đường bộ sẽ tự động chuyển thông tin thông báo cho người được phục hồi điểm giấy phép lái xe biết việc phục hồi điểm theo quy định tại điểm c khoản này;\n\nc) Việc thông báo phục hồi điểm giấy phép lái xe thực hiện bằng phương thức điện tử thông qua tài khoản của công dân đăng ký trên Cổng dịch vụ công, Ứng dụng giao thông trên thiết bị di động; đồng thời cập nhật thông tin về giấy phép lái xe được phục hồi điểm trên Trang thông tin điện tử của Cục Cảnh sát giao thông. Trường hợp giấy phép lái xe được thể hiện dưới hình thức thông điệp dữ liệu thì thực hiện cập nhật trạng thái phục hồi điểm giấy phép lái xe trong căn cước điện tử, tài khoản định danh điện tử trên ứng dụng định danh quốc gia.\n\n3. Trình tự, thủ tục phục hồi điểm giấy phép lái xe đối với trường hợp giấy phép lái xe bị trừ hết điểm\n\na) Sau khi người có giấy phép lái xe bị trừ hết điểm tham gia kiểm tra nội dung kiến thức pháp luật về trật tự, an toàn giao thông đường bộ và đạt yêu cầu, kết quả kiểm tra được cập nhật vào phần mềm kiểm tra kiến thức pháp luật về trật tự, an toàn giao thông đường bộ và đồng bộ dữ liệu với Cơ sở dữ liệu về xử lý vi phạm hành chính về trật tự, an toàn giao thông đường bộ, dữ liệu điểm giấy phép lái xe sẽ được phục hồi đủ 12 điểm và cập nhật tự động trong Cơ sở dữ liệu về xử lý vi phạm hành chính về trật tự, an toàn giao thông đường bộ;\n\nb) Ngay sau khi dữ liệu điểm giấy phép lái xe được phục hồi đủ 12 điểm thì người có thẩm quyền quy định tại điểm b khoản 1 Điều này thông báo cho người được phục hồi điểm giấy phép lái xe biết việc phục hồi điểm;\n\nc) Việc thông báo phục hồi điểm giấy phép lái xe thực hiện bằng văn bản theo mẫu quy định của Bộ trưởng Bộ Công an và được giao trực tiếp hoặc gửi qua dịch vụ bưu chính hoặc thực hiện thông báo bằng phương thức điện tử thông qua tài khoản của công dân đăng ký trên Cổng dịch vụ công, Ứng dụng giao thông trên thiết bị di động; đồng thời cập nhật thông tin về giấy phép lái xe được phục hồi điểm trên Trang thông tin điện tử của Cục Cảnh sát giao thông. Trường hợp giấy phép lái xe được thể hiện dưới hình thức thông điệp dữ liệu thì cơ quan, người có thẩm quyền thực hiện cập nhật trạng thái phục hồi điểm giấy phép lái xe trong căn cước điện tử, tài khoản định danh điện tử trên ứng dụng định danh quốc gia.\n\nChương IV\n\nĐIỀU KHOẢN THI HÀNH\n\nĐiều 52. Sửa đổi, bổ sung một số điều của Nghị định số 100/2019/NĐ-CP ngày 30 tháng 12 năm 2019 của Chính phủ quy định xử phạt vi phạm hành chính trong lĩnh vực giao thông đường bộ và đường sắt đã được sửa đổi, bổ sung một số điều theo Nghị định số 123/2021/NĐ-CP ngày 28 tháng 12 năm 2021 của Chính phủ sửa đổi, bổ sung một số điều của các Nghị định quy định xử phạt vi phạm hành chính trong lĩnh vực hàng hải; giao thông đường bộ, đường sắt; hàng không dân dụng\n\n1. Bổ sung khoản 2a vào sau khoản 2 Điều 1 như sau:\n\n“2a. Hình thức, mức xử phạt, biện pháp khắc phục hậu quả đối với từng hành vi vi phạm hành chính; thẩm quyền lập biên bản, thẩm quyền xử phạt, mức phạt tiền cụ thể đối với từng chức danh về trật tự, an toàn giao thông trong lĩnh vực giao thông đường bộ thì áp dụng quy định tại Nghị định quy định xử phạt vi phạm hành chính về trật tự, an toàn giao thông trong lĩnh vực giao thông đường bộ; trừ điểm, phục hồi điểm giấy phép lái xe”.\n\n2. Sửa đổi, bổ sung một số điểm của khoản 6 Điều 28 như sau:\n\na) Sửa đổi, bổ sung điểm d khoản 6 Điều 28 như sau:\n\n“d) Không thực hiện đúng các nội dung đã đăng ký, niêm yết về: giá cước; giá dịch vụ; tiêu chuẩn chất lượng dịch vụ vận tải, dịch vụ hỗ trợ vận tải;”;\n\nb) Sửa đổi, bổ sung điểm i khoản 6 Điều 28 như sau:\n\n“i) Sử dụng phương tiện kinh doanh vận tải có chất lượng không bảo đảm điều kiện của hình thức kinh doanh đã đăng ký;”.\n\n3. Sửa đổi, bổ sung điểm a, điểm b khoản 10 Điều 28 như sau:\n\n“a) Thực hiện hành vi vi phạm quy định tại điểm a, điểm b, điểm d, điểm đ, điểm h, điểm l, điểm o, điểm p, điểm r, điểm s, điểm t khoản 4; điểm d, điểm i, điểm k, điểm l, điểm n, điểm q khoản 6; điểm e khoản 7 Điều này bị tước quyền sử dụng phù hiệu từ 01 tháng đến 03 tháng (nếu có hoặc đã được cấp) đối với xe vi phạm;\n\nb) Thực hiện hành vi vi phạm quy định tại điểm i, điểm k khoản 4; điểm h khoản 6; điểm b khoản 7 Điều này bị tước quyền sử dụng giấy phép kinh doanh vận tải từ 01 tháng đến 03 tháng;”.\n\n4. Sửa đổi, bổ sung điểm h khoản 11 Điều 28 như sau:\n\n“h) Thực hiện hành vi vi phạm quy định tại điểm n khoản 6 Điều này buộc lắp đặt đồng hồ tính tiền cước, thiết bị in hóa đơn trên xe theo đúng quy định;”.\n\n5. Sửa đổi, bổ sung một số điểm, khoản của Điều 74 như sau:', 'a) Giấy phép lái xe hết thời hạn sử dụng;\n\nb) Giấy phép lái xe bị thu hồi theo quy định tại khoản 5 Điều 62 của Luật này.\n\n8. Giấy phép lái xe quốc tế được quy định như sau:\n\na) Giấy phép lái xe quốc tế là giấy phép lái xe do cơ quan nhà nước có thẩm quyền của quốc gia là thành viên của Công ước Viên cấp theo một mẫu thống nhất; có thời hạn không quá 03 năm kể từ ngày cấp và phải phù hợp với thời hạn còn hiệu lực của giấy phép lái xe quốc gia;\n\nb) Người có giấy phép lái xe quốc tế do quốc gia là thành viên của Công ước Viên cấp khi lái xe tham gia giao thông đường bộ trên lãnh thổ Việt Nam phải mang theo giấy phép lái xe quốc tế và giấy phép lái xe quốc gia được cấp phù hợp với hạng xe điều khiển, còn thời hạn sử dụng; phải tuân thủ pháp luật về trật tự, an toàn giao thông đường bộ của Việt Nam;\n\nc) Người có giấy phép lái xe quốc tế vi phạm pháp luật về trật tự, an toàn giao thông đường bộ của Việt Nam mà bị tước quyền sử dụng giấy phép lái xe có thời hạn thì thời gian bị tước quyền sử dụng không quá thời gian người lái xe được phép cư trú tại lãnh thổ Việt Nam;\n\nd) Người Việt Nam hoặc người nước ngoài có thẻ thường trú hoặc thẻ tạm trú tại Việt Nam có giấy phép lái xe do Việt Nam hoặc quốc gia là thành viên của điều ước quốc tế mà nước Cộng hòa xã hội chủ nghĩa Việt Nam là thành viên cấp, còn giá trị sử dụng, nếu có nhu cầu được cấp giấy phép lái xe quốc tế.\n\n9. Bộ trưởng Bộ Giao thông vận tải quy định mẫu giấy phép lái xe và giấy phép lái xe quốc tế, trình tự, thủ tục cấp và việc sử dụng giấy phép lái xe, giấy phép lái xe quốc tế; đối với mẫu giấy phép lái xe, trình tự, thủ tục cấp và việc sử dụng giấy phép lái xe của lực lượng quân đội, công an làm nhiệm vụ quốc phòng, an ninh do Bộ trưởng Bộ Quốc phòng, Bộ trưởng Bộ Công an quy định.\n\nĐiều 58. Điểm của giấy phép lái xe \n\n1. Điểm của giấy phép lái xe được dùng để quản lý việc chấp hành pháp luật về trật tự, an toàn giao thông đường bộ của người lái xe trên hệ thống cơ sở dữ liệu về trật tự, an toàn giao thông đường bộ, bao gồm 12 điểm. Số điểm trừ mỗi lần vi phạm tùy thuộc tính chất, mức độ của hành vi vi phạm pháp luật về trật tự, an toàn giao thông đường bộ. Dữ liệu về điểm trừ giấy phép lái xe của người vi phạm sẽ được cập nhật vào hệ thống cơ sở dữ liệu ngay sau khi quyết định xử phạt có hiệu lực thi hành và thông báo cho người bị trừ điểm giấy phép lái xe biết.\n\n2. Giấy phép lái xe chưa bị trừ hết điểm và không bị trừ điểm trong thời hạn 12 tháng từ ngày bị trừ điểm gần nhất thì được phục hồi đủ 12 điểm.\n\n3. Trường hợp giấy phép lái xe bị trừ hết điểm thì người có giấy phép lái xe không được điều khiển phương tiện tham gia giao thông đường bộ theo giấy phép lái xe đó. Sau thời hạn ít nhất là 06 tháng kể từ ngày bị trừ hết điểm, người có giấy phép lái xe được tham gia kiểm tra nội dung kiến thức pháp luật về trật tự, an toàn giao thông đường bộ theo quy định tại khoản 7 Điều 61 của Luật này do lực lượng Cảnh sát giao thông tổ chức, có kết quả đạt yêu cầu thì được phục hồi đủ 12 điểm.\n\n4. Giấy phép lái xe sau khi đổi, cấp lại, nâng hạng được giữ nguyên số điểm của giấy phép lái xe trước khi đổi, cấp lại, nâng hạng.\n\n5. Người có thẩm quyền xử phạt vi phạm hành chính có thẩm quyền trừ điểm giấy phép lái xe.\n\n6. Chính phủ quy định chi tiết khoản 1 Điều này; quy định trình tự, thủ tục, thẩm quyền trừ điểm, phục hồi điểm giấy phép lái xe; quy định lộ trình thực hiện Điều này. Bộ trưởng Bộ Công an quy định chi tiết khoản 3 Điều này.\n\nĐiều 59. Tuổi, sức khỏe của người điều khiển phương tiện tham gia giao thông đường bộ\n\n1. Độ tuổi của người lái xe, người điều khiển xe máy chuyên dùng được quy định như sau:\n\na) Người đủ 16 tuổi trở lên được điều khiển xe gắn máy;\n\nb) Người đủ 18 tuổi trở lên được cấp giấy phép lái xe hạng A1, A, B1, B, C1, được cấp chứng chỉ bồi dưỡng kiến thức pháp luật về giao thông đường bộ để điều khiển xe máy chuyên dùng tham gia giao thông đường bộ;\n\nc) Người đủ 21 tuổi trở lên được cấp giấy phép lái xe hạng C, BE;\n\nd) Người đủ 24 tuổi trở lên được cấp giấy phép lái xe hạng D1, D2, C1E, CE;\n\nđ) Người đủ 27 tuổi trở lên được cấp giấy phép lái xe hạng D, D1E, D2E, DE;\n\ne) Tuổi tối đa của người lái xe ô tô chở người (kể cả xe buýt) trên 29 chỗ (không kể chỗ của người lái xe), xe ô tô chở người giường nằm là đủ 57 tuổi đối với nam, đủ 55 tuổi đối với nữ.\n\n2. Người điều khiển phương tiện tham gia giao thông đường bộ phải bảo đảm điều kiện sức khỏe phù hợp với từng loại phương tiện được phép điều khiển. Bộ trưởng Bộ Y tế quy định về tiêu chuẩn sức khỏe, việc khám sức khỏe đối với người lái xe, người điều khiển xe máy chuyên dùng; việc khám sức khỏe định kỳ đối với người hành nghề lái xe ô tô; xây dựng cơ sở dữ liệu về sức khỏe của người lái xe, người điều khiển xe máy chuyên dùng.\n\n3. Bộ trưởng Bộ Quốc phòng, Bộ trưởng Bộ Công an quy định độ tuổi của người lái xe trong lực lượng quân đội, công an làm nhiệm vụ quốc phòng, an ninh.\n\nĐiều 60. Đào tạo lái xe\n\n1. Người có nhu cầu được cấp giấy phép lái xe phải được đào tạo nội dung lý thuyết và thực hành theo chương trình đào tạo quy định cho từng hạng giấy phép lái xe.\n\n2. Người học lái xe phải được đào tạo tại các cơ sở đào tạo lái xe hoặc các hình thức đào tạo lái xe khác để cấp mới hoặc nâng hạng giấy phép lái xe.\n\n3. Việc đào tạo để nâng hạng giấy phép lái xe thực hiện đối với những đối tượng sau đây:\n\na) Nâng hạng giấy phép lái xe từ hạng B lên hạng C1 hoặc lên hạng C hoặc lên hạng D1 hoặc lên hạng D2;\n\nb) Nâng hạng giấy phép lái xe từ hạng C1 lên hạng C hoặc lên hạng D1 hoặc lên hạng D2;\n\nc) Nâng hạng giấy phép lái xe từ hạng C lên hạng D1 hoặc lên hạng D2 hoặc lên hạng D;\n\nd) Nâng hạng giấy phép lái xe từ hạng D1 lên hạng D2 hoặc lên hạng D;\n\nđ) Nâng hạng giấy phép lái xe từ hạng D2 lên hạng D;\n\ne) Nâng hạng giấy phép lái xe từ hạng B lên hạng BE, từ hạng C1 lên\xa0 hạng C1E, từ hạng C lên hạng CE, từ hạng D1 lên hạng D1E, từ hạng D2 lên hạng D2E, từ hạng D lên hạng DE.\n\n4.\xa0Người có nhu cầu được đào tạo nâng hạng giấy phép lái xe khi giấy phép lái xe còn hiệu lực, phải có đủ thời gian lái xe an toàn quy định cho từng hạng giấy phép lái xe;\xa0đối với việc nâng hạng giấy phép lái xe lên hạng D1, D2, D thì người có nhu cầu được đào tạo còn phải có trình độ từ trung học cơ sở trở lên.\n\n5. Giấy phép lái xe các hạng C, D1, D2, D, BE, C1E, CE, D1E, D2E, DE phải được đào tạo bằng hình thức đào tạo nâng hạng theo các điều kiện quy định tại khoản 3 và khoản 4 Điều này.\n\n6. Cơ sở đào tạo lái xe ô tô phải đáp ứng các điều kiện do Chính phủ quy định; có giáo trình, giáo án; thực hiện đào tạo theo đúng hình thức, nội dung và chương trình quy định cho từng hạng giấy phép lái xe.\n\n7. Chính phủ quy định chi tiết các hình thức đào tạo lái xe khác quy định tại khoản 2 Điều này; quy định trình tự, thủ tục kiểm tra, đánh giá để cấp, cấp lại và thu hồi giấy phép xe tập lái; quy định tiêu chuẩn của giáo viên dạy lái xe; quy định việc cấp, cấp lại và thu hồi giấy chứng nhận giáo viên dạy lái xe; quy định việc cấp, cấp lại và thu hồi giấy phép đào tạo lái xe.\n\n8. Bộ trưởng Bộ Giao thông vận tải quy định hình thức, nội dung, chương trình đào tạo lái xe, thời gian lái xe an toàn cho từng hạng giấy phép lái xe quy định tại khoản 4 Điều này và quy định tiêu chuẩn của cơ sở đào tạo lái xe mô tô; đối với cơ sở đào tạo, tổ chức đào tạo lái xe cho lực lượng quân đội, công an làm nhiệm vụ quốc phòng, an ninh do Bộ trưởng Bộ Quốc phòng, Bộ trưởng Bộ Công an quy định.\n\nĐiều 61. Sát hạch lái xe\n\n1. Người đã hoàn thành chương trình đào tạo lái xe, có độ tuổi, sức khỏe theo quy định tại Điều 59 của Luật này được đăng ký để tham dự kỳ sát hạch lái xe.\n\n2. Nội dung sát hạch lái xe phải phù hợp với hạng giấy phép lái xe và chương trình đào tạo lái xe.\n\n3. Hoạt động sát hạch lái xe ô tô phải thực hiện tại các trung tâm sát hạch lái xe; hoạt động sát hạch lái xe mô tô thực hiện tại các trung tâm sát hạch lái xe hoặc tại sân tập lái đáp ứng điều kiện, tiêu chuẩn về cơ sở vật chất, kỹ thuật. Hoạt động sát hạch lái xe do cơ quan nhà nước có thẩm quyền thực hiện.', 'b) Lôi kéo bùn, đất, cát, nguyên liệu, vật liệu hoặc chất phế thải khác ra đường bộ gây mất an toàn giao thông.\n\n3. Phạt tiền từ 4.000.000 đồng đến 6.000.000 đồng đối với người điều khiển xe đổ trái phép rác, đất, cát, đá, vật liệu, chất phế thải trong phạm vi đất dành cho đường bộ ở đoạn đường ngoài đô thị.\n\n4. Phạt tiền từ 10.000.000 đồng đến 15.000.000 đồng đối với người điều khiển xe thực hiện hành vi đổ trái phép rác, đất, cát, đá, vật liệu, chất phế thải ra đường phố.\n\n5. Ngoài việc bị áp dụng hình thức xử phạt, người điều khiển phương tiện (khi điều khiển xe ô tô) thực hiện hành vi vi phạm quy định tại khoản 3, khoản 4 Điều này còn bị trừ điểm giấy phép lái xe 02 điểm.\n\nMục 3. VI PHẠM QUY ĐỊNH VỀ NGƯỜI ĐIỀU KHIỂN PHƯƠNG TIỆN THAM GIA GIAO THÔNG ĐƯỜNG BỘ\n\nĐiều 18. Xử phạt, trừ điểm giấy phép lái xe các hành vi vi phạm quy định về điều kiện của người điều khiển xe cơ giới\n\n1. Phạt cảnh cáo người từ đủ 14 tuổi đến dưới 16 tuổi điều khiển xe mô tô, xe gắn máy, các loại xe tương tự xe mô tô và các loại xe tương tự xe gắn máy hoặc điều khiển xe ô tô, điều khiển xe chở người bốn bánh có gắn động cơ, xe chở hàng bốn bánh có gắn động cơ và các loại xe tương tự xe ô tô.\n\n2. Phạt tiền từ 200.000 đồng đến 300.000 đồng đối với một trong các hành vi vi phạm sau đây:\n\na) Người điều khiển xe mô tô, xe gắn máy, các loại xe tương tự xe mô tô và các loại xe tương tự xe gắn máy kinh doanh vận tải không mang theo chứng nhận bảo hiểm bắt buộc trách nhiệm dân sự của chủ xe cơ giới còn hiệu lực;\n\nb) Người điều khiển xe mô tô, xe gắn máy, các loại xe tương tự xe mô tô và các loại xe tương tự xe gắn máy không có chứng nhận bảo hiểm bắt buộc trách nhiệm dân sự của chủ xe cơ giới còn hiệu lực;\n\nc) Người điều khiển xe mô tô, xe gắn máy, các loại xe tương tự xe mô tô và các loại xe tương tự xe gắn máy kinh doanh vận tải không mang theo chứng nhận đăng ký xe (hoặc bản sao chứng nhận đăng ký xe có chứng thực kèm theo bản gốc giấy biên nhận của tổ chức tín dụng, chi nhánh ngân hàng nước ngoài trong trường hợp tổ chức tín dụng, chi nhánh ngân hàng nước ngoài giữ bản gốc chứng nhận đăng ký xe);\n\nd) Người điều khiển xe mô tô và các loại xe tương tự xe mô tô kinh doanh vận tải không mang theo giấy phép lái xe trừ hành vi vi phạm quy định tại điểm b khoản 5, điểm c khoản 7 Điều này.\n\n3. Phạt tiền từ 300.000 đồng đến 400.000 đồng đối với một trong các hành vi vi phạm sau đây:\n\na) Người điều khiển xe ô tô, xe chở người bốn bánh có gắn động cơ, xe chở hàng bốn bánh có gắn động cơ và các loại xe tương tự xe ô tô kinh doanh vận tải không mang theo giấy phép lái xe, trừ hành vi vi phạm quy định tại điểm c khoản 8 Điều này;\n\nb) Người điều khiển xe ô tô, xe chở người bốn bánh có gắn động cơ, xe chở hàng bốn bánh có gắn động cơ, rơ moóc, sơ mi rơ moóc và các loại xe tương tự xe ô tô kinh doanh vận tải không mang theo chứng nhận đăng ký xe (hoặc bản sao chứng nhận đăng ký xe có chứng thực kèm theo bản gốc giấy biên nhận của tổ chức tín dụng, chi nhánh ngân hàng nước ngoài trong trường hợp tổ chức tín dụng, chi nhánh ngân hàng nước ngoài giữ bản gốc chứng nhận đăng ký xe);\n\nc) Người điều khiển xe ô tô, xe chở người bốn bánh có gắn động cơ, xe chở hàng bốn bánh có gắn động cơ, rơ moóc, sơ mi rơ moóc và các loại xe tương tự xe ô tô kinh doanh vận tải không mang theo giấy chứng nhận kiểm định an toàn kỹ thuật và bảo vệ môi trường đối với loại xe có quy định phải kiểm định.\n\n4. Phạt tiền từ 400.000 đồng đến 600.000 đồng đối với một trong các hành vi vi phạm sau đây:\n\na) Người từ đủ 16 tuổi đến dưới 18 tuổi điều khiển xe mô tô có dung tích xi- lanh từ 50 cm3 trở lên hoặc có công suất động cơ điện từ 04 kW trở lên;\n\nb) Người điều khiển xe ô tô, xe chở người bốn bánh có gắn động cơ, xe chở hàng bốn bánh có gắn động cơ và các loại xe tương tự xe ô tô kinh doanh vận tải không mang theo chứng nhận bảo hiểm bắt buộc trách nhiệm dân sự của chủ xe cơ giới còn hiệu lực;\n\nc) Người điều khiển xe ô tô, xe chở người bốn bánh có gắn động cơ, xe chở hàng bốn bánh có gắn động cơ và các loại xe tương tự xe ô tô không có chứng nhận bảo hiểm bắt buộc trách nhiệm dân sự của chủ xe cơ giới còn hiệu lực.\n\n5. Phạt tiền từ 2.000.000 đồng đến 4.000.000 đồng đối với người điều khiển xe mô tô hai bánh có dung tích xi-lanh đến 125 cm3 hoặc có công suất động cơ điện đến 11 kW và các loại xe tương tự xe mô tô thực hiện một trong các hành vi vi phạm sau đây:\n\na) Không có giấy phép lái xe hoặc sử dụng giấy phép lái xe đã bị trừ hết điểm hoặc sử dụng giấy phép lái xe không do cơ quan có thẩm quyền cấp, giấy phép lái xe bị tẩy xóa, giấy phép lái xe không còn hiệu lực, giấy phép lái xe không phù hợp với loại xe đang điều khiển;\n\nb) Có giấy phép lái xe quốc tế do các nước tham gia Công ước của Liên hợp quốc về Giao thông đường bộ năm 1968 cấp (trừ giấy phép lái xe quốc tế do Việt Nam cấp) nhưng không mang theo giấy phép lái xe quốc gia phù hợp với loại xe được phép điều khiển;\n\nc) Sử dụng giấy phép lái xe không hợp lệ (giấy phép lái xe có số phôi ghi ở mặt sau không trùng với số phôi được cấp mới nhất trong hệ thống thông tin quản lý giấy phép lái xe).\n\n6. Phạt tiền từ 4.000.000 đồng đến 6.000.000 đồng đối với người từ đủ 16 tuổi đến dưới 18 tuổi điều khiển xe ô tô, xe chở người bốn bánh có gắn động cơ, xe chở hàng bốn bánh có gắn động cơ và các loại xe tương tự xe ô tô.\n\n7. Phạt tiền từ 6.000.000 đồng đến 8.000.000 đồng đối với người điều khiển xe mô tô hai bánh có dung tích xi-lanh trên 125 cm3 trở lên hoặc có công suất động cơ điện trên 11 kW, xe mô tô ba bánh thực hiện một trong các hành vi vi phạm sau đây:\n\na) Có giấy phép lái xe nhưng không phù hợp với loại xe đang điều khiển;\n\nb) Không có giấy phép lái xe hoặc sử dụng giấy phép lái xe đã bị trừ hết điểm, giấy phép lái xe không do cơ quan có thẩm quyền cấp, giấy phép lái xe bị tẩy xóa, giấy phép lái xe không còn hiệu lực;\n\nc) Có giấy phép lái xe quốc tế do các nước tham gia Công ước của Liên hợp quốc về Giao thông đường bộ năm 1968 cấp (trừ giấy phép lái xe quốc tế do Việt Nam cấp) nhưng không mang theo giấy phép lái xe quốc gia phù hợp với loại xe được phép điều khiển;\n\nd) Sử dụng giấy phép lái xe không hợp lệ (giấy phép lái xe có số phôi ghi ở mặt sau không trùng với số phôi được cấp mới nhất trong hệ thống thông tin quản lý giấy phép lái xe).\n\n8. Phạt tiền từ 8.000.000 đồng đến 10.000.000 đồng đối với người điều khiển xe ô tô và các loại xe tương tự xe ô tô, xe chở người bốn bánh có gắn động cơ, xe chở hàng bốn bánh có gắn động cơ vi phạm một trong các hành vi sau đây:\n\na) Có giấy phép lái xe nhưng đã hết hạn sử dụng dưới 01 năm;\n\nb) Có giấy phép lái xe quốc tế do các nước tham gia Công ước của Liên hợp quốc về Giao thông đường bộ năm 1968 cấp (trừ giấy phép lái xe quốc tế do Việt Nam cấp) nhưng không mang theo giấy phép lái xe quốc gia phù hợp với loại xe được phép điều khiển;\n\nc) Sử dụng giấy phép lái xe không hợp lệ (giấy phép lái xe có số phôi ghi ở mặt sau không trùng với số phôi được cấp mới nhất trong hệ thống thông tin quản lý giấy phép lái xe).\n\n9. Phạt tiền từ 18.000.000 đồng đến 20.000.000 đồng đối với người điều khiển xe ô tô và các loại xe tương tự xe ô tô, xe chở người bốn bánh có gắn động cơ, xe chở hàng bốn bánh có gắn động cơ vi phạm một trong các hành vi sau đây:\n\na) Có giấy phép lái xe nhưng không phù hợp với loại xe đang điều khiển hoặc có giấy phép lái xe nhưng đã hết hạn sử dụng từ 01 năm trở lên;\n\nb) Không có giấy phép lái xe hoặc sử dụng giấy phép lái xe đã bị trừ hết điểm hoặc sử dụng giấy phép lái xe không do cơ quan có thẩm quyền cấp, giấy phép lái xe bị tẩy xóa, giấy phép lái xe không còn hiệu lực.\n\n10. Ngoài việc bị áp dụng hình thức xử phạt, người điều khiển phương tiện thực hiện hành vi vi phạm quy định tại điểm a khoản 5, điểm b khoản 7, điểm b khoản 9 Điều này còn bị áp dụng biện pháp khắc phục hậu quả buộc nộp lại giấy phép lái xe bị tẩy xóa.']","**Nguồn văn bản:** 168_2024_ND-CP_619502

**Tên văn bản:** Không có tiêu đề trong context

**Điều 51:** Thẩm quyền, trình tự, thủ tục phục hồi điểm giấy phép lái xe

**Nội dung:**

1. Thẩm quyền phục hồi điểm giấy phép lái xe:

    a) Cục trưởng Cục Cảnh sát giao thông có trách nhiệm quản lý, vận hành Cơ sở dữ liệu về xử lý vi phạm hành chính về trật tự, an toàn giao thông đường bộ để thực hiện cập nhật, tự động phục hồi điểm giấy phép lái xe đối với trường hợp quy định tại khoản 2 Điều này.

    b) Cục trưởng Cục Cảnh sát giao thông, Trưởng phòng Cảnh sát giao thông nơi tổ chức kiểm tra kiến thức pháp luật về trật tự, an toàn giao thông đường bộ có thẩm quyền phục hồi điểm cho giấy phép lái xe đối với trường hợp quy định tại khoản 3 Điều này.

2. Trình tự, thủ tục phục hồi điểm giấy phép lái xe đối với trường hợp giấy phép lái xe chưa bị trừ hết điểm và không bị trừ điểm trong thời hạn 12 tháng từ ngày bị trừ điểm gần nhất:

    a) Khi đủ thời hạn 12 tháng, kể từ ngày bị trừ điểm giấy phép lái xe gần nhất, dữ liệu điểm giấy phép lái xe sẽ được tự động phục hồi đủ 12 điểm (gồm cả giấy phép lái xe đang trong thời hạn bị tước quyền sử dụng) và cập nhật tự động trong Cơ sở dữ liệu về xử lý vi phạm hành chính về trật tự, an toàn giao thông đường bộ.

    b) Ngay sau khi dữ liệu điểm giấy phép lái xe được phục hồi, Cơ sở dữ liệu về xử lý vi phạm hành chính về trật tự, an toàn giao thông đường bộ sẽ tự động chuyển thông tin thông báo cho người được phục hồi điểm giấy phép lái xe biết việc phục hồi điểm theo quy định tại điểm c khoản này.

    c) Việc thông báo phục hồi điểm giấy phép lái xe thực hiện bằng phương thức điện tử thông qua tài khoản của công dân đăng ký trên Cổng dịch vụ công, Ứng dụng giao thông trên thiết bị di động; đồng thời cập nhật thông tin về giấy phép lái xe được phục hồi điểm trên Trang thông tin điện tử của Cục Cảnh sát giao thông. Trường hợp giấy phép lái xe được thể hiện dưới hình thức thông điệp dữ liệu thì thực hiện cập nhật trạng thái phục hồi điểm giấy phép lái xe trong căn cước điện tử, tài khoản định danh điện tử trên ứng dụng định danh quốc gia.

3. Trình tự, thủ tục phục hồi điểm giấy phép lái xe đối với trường hợp giấy phép lái xe bị trừ hết điểm:

    a) Sau khi người có giấy phép lái xe bị trừ hết điểm tham gia kiểm tra nội dung kiến thức pháp luật về trật tự, an toàn giao thông đường bộ và đạt yêu cầu, kết quả kiểm tra được cập nhật vào phần mềm kiểm tra kiến thức pháp luật về trật tự, an toàn giao thông đường bộ và đồng bộ dữ liệu với Cơ sở dữ liệu về xử lý vi phạm hành chính về trật tự, an toàn giao thông đường bộ, dữ liệu điểm giấy phép lái xe sẽ được phục hồi đủ 12 điểm và cập nhật tự động trong Cơ sở dữ liệu về xử lý vi phạm hành chính về trật tự, an toàn giao thông đường bộ.

    b) Ngay sau khi dữ liệu điểm giấy phép lái xe được phục hồi đủ 12 điểm thì người có thẩm quyền quy định tại điểm b khoản 1 Điều này thông báo cho người được phục hồi điểm giấy phép lái xe biết việc phục hồi điểm.

    c) Việc thông báo phục hồi điểm giấy phép lái xe thực hiện bằng văn bản theo mẫu quy định của Bộ trưởng Bộ Công an và được giao trực tiếp hoặc gửi qua dịch vụ bưu chính hoặc thực hiện thông báo bằng phương thức điện tử thông qua tài khoản của công dân đăng ký trên Cổng dịch vụ công, Ứng dụng giao thông trên thiết bị di động; đồng thời cập nhật thông tin về giấy phép lái xe được phục hồi điểm trên Trang thông tin điện tử của Cục Cảnh sát giao thông. Trường hợp giấy phép lái xe được thể hiện dưới hình thức thông điệp dữ liệu thì cơ quan, người có thẩm quyền thực hiện cập nhật trạng thái phục hồi điểm giấy phép lái xe trong căn cước điện tử, tài khoản định danh điện tử trên ứng dụng định danh quốc gia.


**Nguồn văn bản:** 36_2024_QH15_444251

**Tên văn bản:** Không có tiêu đề trong context

**Điều 58:** Điểm của giấy phép lái xe

**Nội dung:**

1. Điểm của giấy phép lái xe được dùng để quản lý việc chấp hành pháp luật về trật tự, an toàn giao thông đường bộ của người lái xe trên hệ thống cơ sở dữ liệu về trật tự, an toàn giao thông đường bộ, bao gồm 12 điểm. Số điểm trừ mỗi lần vi phạm tùy thuộc tính chất, mức độ của hành vi vi phạm pháp luật về trật tự, an toàn giao thông đường bộ. Dữ liệu về điểm trừ giấy phép lái xe của người vi phạm sẽ được cập nhật vào hệ thống cơ sở dữ liệu ngay sau khi quyết định xử phạt có hiệu lực thi hành và thông báo cho người bị trừ điểm giấy phép lái xe biết.

2. Giấy phép lái xe chưa bị trừ hết điểm và không bị trừ điểm trong thời hạn 12 tháng từ ngày bị trừ điểm gần nhất thì được phục hồi đủ 12 điểm.

3. Trường hợp giấy phép lái xe bị trừ hết điểm thì người có giấy phép lái xe không được điều khiển phương tiện tham gia giao thông đường bộ theo giấy phép lái xe đó. Sau thời hạn ít nhất là 06 tháng kể từ ngày bị trừ hết điểm, người có giấy phép lái xe được tham gia kiểm tra nội dung kiến thức pháp luật về trật tự, an toàn giao thông đường bộ theo quy định tại khoản 7 Điều 61 của Luật này do lực lượng Cảnh sát giao thông tổ chức, có kết quả đạt yêu cầu thì được phục hồi đủ 12 điểm.

4. Giấy phép lái xe sau khi đổi, cấp lại, nâng hạng được giữ nguyên số điểm của giấy phép lái xe trước khi đổi, cấp lại, nâng hạng.


Tóm lại:  Điều kiện phục hồi điểm giấy phép lái xe máy phụ thuộc vào tình trạng điểm hiện tại. Nếu chưa bị trừ hết điểm và không bị trừ điểm trong 12 tháng, điểm sẽ tự động được phục hồi sau 12 tháng. Nếu bị trừ hết điểm, cần tham gia kiểm tra kiến thức pháp luật về giao thông và đạt yêu cầu sau ít nhất 6 tháng mới được phục hồi điểm.
",Người lái xe máy phải làm kiểm tra lý thuyết theo các câu hỏi như khi thi bằng lái xe.,1.0,0.8184311153171024,0.0,0.0
12,Người lái ô tô cần làm gì để phục hồi điểm giấy phép lái xe?,"['đ) Không trừ điểm giấy phép lái xe khi giấy phép lái xe đó đang trong thời hạn bị tước quyền sử dụng giấy phép lái xe.\n\n2. Thẩm quyền trừ điểm giấy phép lái xe\n\nNgười có thẩm quyền áp dụng hình thức xử phạt tước quyền sử dụng giấy phép, chứng chỉ hành nghề có thời hạn hoặc đình chỉ hoạt động có thời hạn quy định tại Chương II Phần thứ hai của Luật Xử lý vi phạm hành chính, Mục 1 Chương III của Nghị định này và có thẩm quyền xử phạt vi phạm hành chính đối với hành vi vi phạm có quy định trừ điểm giấy phép lái xe thì có thẩm quyền trừ điểm giấy phép lái xe đối với hành vi vi phạm đó.\n\n3. Trình tự, thủ tục trừ điểm giấy phép lái xe\n\na) Ngay sau khi quyết định xử phạt vi phạm hành chính có hiệu lực thi hành, dữ liệu trừ điểm giấy phép lái xe của người bị xử phạt sẽ được cập nhật tự động vào Cơ sở dữ liệu về xử lý vi phạm hành chính về trật tự, an toàn giao thông đường bộ, người có thẩm quyền trừ điểm giấy phép lái xe thông báo cho người bị trừ điểm giấy phép lái xe biết việc trừ điểm.\n\nTrường hợp Chủ tịch Ủy ban nhân dân cấp huyện, Chủ tịch Ủy ban nhân dân cấp tỉnh ra quyết định xử phạt vi phạm hành chính đối với hành vi vi phạm có trừ điểm giấy phép lái xe thì Trưởng Công an cấp huyện hoặc Trưởng phòng Cảnh sát giao thông Công an cấp tỉnh có trách nhiệm cập nhật dữ liệu trừ điểm giấy phép lái xe vào Cơ sở dữ liệu về xử lý vi phạm hành chính về trật tự, an toàn giao thông đường bộ;\n\nb) Việc thông báo trừ điểm giấy phép lái xe thực hiện bằng văn bản theo mẫu quy định của Bộ trưởng Bộ Công an và được giao trực tiếp hoặc gửi qua dịch vụ bưu chính hoặc thực hiện thông báo bằng phương thức điện tử thông qua tài khoản của công dân đăng ký trên Cổng dịch vụ công, Ứng dụng giao thông trên thiết bị di động khi đáp ứng điều kiện về cơ sở hạ tầng, kỹ thuật, thông tin; đồng thời cập nhật thông tin về giấy phép lái xe bị trừ điểm trên Trang thông tin điện tử của Cục Cảnh sát giao thông. Trường hợp giấy phép lái xe được thể hiện dưới hình thức thông điệp dữ liệu thì cơ quan, người có thẩm quyền thực hiện cập nhật trạng thái trừ điểm giấy phép lái xe trong căn cước điện tử, tài khoản định danh điện tử trên ứng dụng định danh quốc gia.\n\nĐiều 51. Thẩm quyền, trình tự, thủ tục phục hồi điểm giấy phép lái xe\n\n1. Thẩm quyền phục hồi điểm giấy phép lái xe\n\na) Cục trưởng Cục Cảnh sát giao thông có trách nhiệm quản lý, vận hành Cơ sở dữ liệu về xử lý vi phạm hành chính về trật tự, an toàn giao thông đường bộ để thực hiện cập nhật, tự động phục hồi điểm giấy phép lái xe đối với trường hợp quy định tại khoản 2 Điều này;\n\nb) Cục trưởng Cục Cảnh sát giao thông, Trưởng phòng Cảnh sát giao thông nơi tổ chức kiểm tra kiến thức pháp luật về trật tự, an toàn giao thông đường bộ có thẩm quyền phục hồi điểm cho giấy phép lái xe đối với trường hợp quy định tại khoản 3 Điều này.\n\n2. Trình tự, thủ tục phục hồi điểm giấy phép lái xe đối với trường hợp giấy phép lái xe chưa bị trừ hết điểm và không bị trừ điểm trong thời hạn 12 tháng từ ngày bị trừ điểm gần nhất\n\na) Khi đủ thời hạn 12 tháng, kể từ ngày bị trừ điểm giấy phép lái xe gần nhất, dữ liệu điểm giấy phép lái xe sẽ được tự động phục hồi đủ 12 điểm (gồm cả giấy phép lái xe đang trong thời hạn bị tước quyền sử dụng) và cập nhật tự động trong Cơ sở dữ liệu về xử lý vi phạm hành chính về trật tự, an toàn giao thông đường bộ;\n\nb) Ngay sau khi dữ liệu điểm giấy phép lái xe được phục hồi, Cơ sở dữ liệu về xử lý vi phạm hành chính về trật tự, an toàn giao thông đường bộ sẽ tự động chuyển thông tin thông báo cho người được phục hồi điểm giấy phép lái xe biết việc phục hồi điểm theo quy định tại điểm c khoản này;\n\nc) Việc thông báo phục hồi điểm giấy phép lái xe thực hiện bằng phương thức điện tử thông qua tài khoản của công dân đăng ký trên Cổng dịch vụ công, Ứng dụng giao thông trên thiết bị di động; đồng thời cập nhật thông tin về giấy phép lái xe được phục hồi điểm trên Trang thông tin điện tử của Cục Cảnh sát giao thông. Trường hợp giấy phép lái xe được thể hiện dưới hình thức thông điệp dữ liệu thì thực hiện cập nhật trạng thái phục hồi điểm giấy phép lái xe trong căn cước điện tử, tài khoản định danh điện tử trên ứng dụng định danh quốc gia.\n\n3. Trình tự, thủ tục phục hồi điểm giấy phép lái xe đối với trường hợp giấy phép lái xe bị trừ hết điểm\n\na) Sau khi người có giấy phép lái xe bị trừ hết điểm tham gia kiểm tra nội dung kiến thức pháp luật về trật tự, an toàn giao thông đường bộ và đạt yêu cầu, kết quả kiểm tra được cập nhật vào phần mềm kiểm tra kiến thức pháp luật về trật tự, an toàn giao thông đường bộ và đồng bộ dữ liệu với Cơ sở dữ liệu về xử lý vi phạm hành chính về trật tự, an toàn giao thông đường bộ, dữ liệu điểm giấy phép lái xe sẽ được phục hồi đủ 12 điểm và cập nhật tự động trong Cơ sở dữ liệu về xử lý vi phạm hành chính về trật tự, an toàn giao thông đường bộ;\n\nb) Ngay sau khi dữ liệu điểm giấy phép lái xe được phục hồi đủ 12 điểm thì người có thẩm quyền quy định tại điểm b khoản 1 Điều này thông báo cho người được phục hồi điểm giấy phép lái xe biết việc phục hồi điểm;\n\nc) Việc thông báo phục hồi điểm giấy phép lái xe thực hiện bằng văn bản theo mẫu quy định của Bộ trưởng Bộ Công an và được giao trực tiếp hoặc gửi qua dịch vụ bưu chính hoặc thực hiện thông báo bằng phương thức điện tử thông qua tài khoản của công dân đăng ký trên Cổng dịch vụ công, Ứng dụng giao thông trên thiết bị di động; đồng thời cập nhật thông tin về giấy phép lái xe được phục hồi điểm trên Trang thông tin điện tử của Cục Cảnh sát giao thông. Trường hợp giấy phép lái xe được thể hiện dưới hình thức thông điệp dữ liệu thì cơ quan, người có thẩm quyền thực hiện cập nhật trạng thái phục hồi điểm giấy phép lái xe trong căn cước điện tử, tài khoản định danh điện tử trên ứng dụng định danh quốc gia.\n\nChương IV\n\nĐIỀU KHOẢN THI HÀNH\n\nĐiều 52. Sửa đổi, bổ sung một số điều của Nghị định số 100/2019/NĐ-CP ngày 30 tháng 12 năm 2019 của Chính phủ quy định xử phạt vi phạm hành chính trong lĩnh vực giao thông đường bộ và đường sắt đã được sửa đổi, bổ sung một số điều theo Nghị định số 123/2021/NĐ-CP ngày 28 tháng 12 năm 2021 của Chính phủ sửa đổi, bổ sung một số điều của các Nghị định quy định xử phạt vi phạm hành chính trong lĩnh vực hàng hải; giao thông đường bộ, đường sắt; hàng không dân dụng\n\n1. Bổ sung khoản 2a vào sau khoản 2 Điều 1 như sau:\n\n“2a. Hình thức, mức xử phạt, biện pháp khắc phục hậu quả đối với từng hành vi vi phạm hành chính; thẩm quyền lập biên bản, thẩm quyền xử phạt, mức phạt tiền cụ thể đối với từng chức danh về trật tự, an toàn giao thông trong lĩnh vực giao thông đường bộ thì áp dụng quy định tại Nghị định quy định xử phạt vi phạm hành chính về trật tự, an toàn giao thông trong lĩnh vực giao thông đường bộ; trừ điểm, phục hồi điểm giấy phép lái xe”.\n\n2. Sửa đổi, bổ sung một số điểm của khoản 6 Điều 28 như sau:\n\na) Sửa đổi, bổ sung điểm d khoản 6 Điều 28 như sau:\n\n“d) Không thực hiện đúng các nội dung đã đăng ký, niêm yết về: giá cước; giá dịch vụ; tiêu chuẩn chất lượng dịch vụ vận tải, dịch vụ hỗ trợ vận tải;”;\n\nb) Sửa đổi, bổ sung điểm i khoản 6 Điều 28 như sau:\n\n“i) Sử dụng phương tiện kinh doanh vận tải có chất lượng không bảo đảm điều kiện của hình thức kinh doanh đã đăng ký;”.\n\n3. Sửa đổi, bổ sung điểm a, điểm b khoản 10 Điều 28 như sau:\n\n“a) Thực hiện hành vi vi phạm quy định tại điểm a, điểm b, điểm d, điểm đ, điểm h, điểm l, điểm o, điểm p, điểm r, điểm s, điểm t khoản 4; điểm d, điểm i, điểm k, điểm l, điểm n, điểm q khoản 6; điểm e khoản 7 Điều này bị tước quyền sử dụng phù hiệu từ 01 tháng đến 03 tháng (nếu có hoặc đã được cấp) đối với xe vi phạm;\n\nb) Thực hiện hành vi vi phạm quy định tại điểm i, điểm k khoản 4; điểm h khoản 6; điểm b khoản 7 Điều này bị tước quyền sử dụng giấy phép kinh doanh vận tải từ 01 tháng đến 03 tháng;”.\n\n4. Sửa đổi, bổ sung điểm h khoản 11 Điều 28 như sau:\n\n“h) Thực hiện hành vi vi phạm quy định tại điểm n khoản 6 Điều này buộc lắp đặt đồng hồ tính tiền cước, thiết bị in hóa đơn trên xe theo đúng quy định;”.\n\n5. Sửa đổi, bổ sung một số điểm, khoản của Điều 74 như sau:', 'a) Giấy phép lái xe hết thời hạn sử dụng;\n\nb) Giấy phép lái xe bị thu hồi theo quy định tại khoản 5 Điều 62 của Luật này.\n\n8. Giấy phép lái xe quốc tế được quy định như sau:\n\na) Giấy phép lái xe quốc tế là giấy phép lái xe do cơ quan nhà nước có thẩm quyền của quốc gia là thành viên của Công ước Viên cấp theo một mẫu thống nhất; có thời hạn không quá 03 năm kể từ ngày cấp và phải phù hợp với thời hạn còn hiệu lực của giấy phép lái xe quốc gia;\n\nb) Người có giấy phép lái xe quốc tế do quốc gia là thành viên của Công ước Viên cấp khi lái xe tham gia giao thông đường bộ trên lãnh thổ Việt Nam phải mang theo giấy phép lái xe quốc tế và giấy phép lái xe quốc gia được cấp phù hợp với hạng xe điều khiển, còn thời hạn sử dụng; phải tuân thủ pháp luật về trật tự, an toàn giao thông đường bộ của Việt Nam;\n\nc) Người có giấy phép lái xe quốc tế vi phạm pháp luật về trật tự, an toàn giao thông đường bộ của Việt Nam mà bị tước quyền sử dụng giấy phép lái xe có thời hạn thì thời gian bị tước quyền sử dụng không quá thời gian người lái xe được phép cư trú tại lãnh thổ Việt Nam;\n\nd) Người Việt Nam hoặc người nước ngoài có thẻ thường trú hoặc thẻ tạm trú tại Việt Nam có giấy phép lái xe do Việt Nam hoặc quốc gia là thành viên của điều ước quốc tế mà nước Cộng hòa xã hội chủ nghĩa Việt Nam là thành viên cấp, còn giá trị sử dụng, nếu có nhu cầu được cấp giấy phép lái xe quốc tế.\n\n9. Bộ trưởng Bộ Giao thông vận tải quy định mẫu giấy phép lái xe và giấy phép lái xe quốc tế, trình tự, thủ tục cấp và việc sử dụng giấy phép lái xe, giấy phép lái xe quốc tế; đối với mẫu giấy phép lái xe, trình tự, thủ tục cấp và việc sử dụng giấy phép lái xe của lực lượng quân đội, công an làm nhiệm vụ quốc phòng, an ninh do Bộ trưởng Bộ Quốc phòng, Bộ trưởng Bộ Công an quy định.\n\nĐiều 58. Điểm của giấy phép lái xe \n\n1. Điểm của giấy phép lái xe được dùng để quản lý việc chấp hành pháp luật về trật tự, an toàn giao thông đường bộ của người lái xe trên hệ thống cơ sở dữ liệu về trật tự, an toàn giao thông đường bộ, bao gồm 12 điểm. Số điểm trừ mỗi lần vi phạm tùy thuộc tính chất, mức độ của hành vi vi phạm pháp luật về trật tự, an toàn giao thông đường bộ. Dữ liệu về điểm trừ giấy phép lái xe của người vi phạm sẽ được cập nhật vào hệ thống cơ sở dữ liệu ngay sau khi quyết định xử phạt có hiệu lực thi hành và thông báo cho người bị trừ điểm giấy phép lái xe biết.\n\n2. Giấy phép lái xe chưa bị trừ hết điểm và không bị trừ điểm trong thời hạn 12 tháng từ ngày bị trừ điểm gần nhất thì được phục hồi đủ 12 điểm.\n\n3. Trường hợp giấy phép lái xe bị trừ hết điểm thì người có giấy phép lái xe không được điều khiển phương tiện tham gia giao thông đường bộ theo giấy phép lái xe đó. Sau thời hạn ít nhất là 06 tháng kể từ ngày bị trừ hết điểm, người có giấy phép lái xe được tham gia kiểm tra nội dung kiến thức pháp luật về trật tự, an toàn giao thông đường bộ theo quy định tại khoản 7 Điều 61 của Luật này do lực lượng Cảnh sát giao thông tổ chức, có kết quả đạt yêu cầu thì được phục hồi đủ 12 điểm.\n\n4. Giấy phép lái xe sau khi đổi, cấp lại, nâng hạng được giữ nguyên số điểm của giấy phép lái xe trước khi đổi, cấp lại, nâng hạng.\n\n5. Người có thẩm quyền xử phạt vi phạm hành chính có thẩm quyền trừ điểm giấy phép lái xe.\n\n6. Chính phủ quy định chi tiết khoản 1 Điều này; quy định trình tự, thủ tục, thẩm quyền trừ điểm, phục hồi điểm giấy phép lái xe; quy định lộ trình thực hiện Điều này. Bộ trưởng Bộ Công an quy định chi tiết khoản 3 Điều này.\n\nĐiều 59. Tuổi, sức khỏe của người điều khiển phương tiện tham gia giao thông đường bộ\n\n1. Độ tuổi của người lái xe, người điều khiển xe máy chuyên dùng được quy định như sau:\n\na) Người đủ 16 tuổi trở lên được điều khiển xe gắn máy;\n\nb) Người đủ 18 tuổi trở lên được cấp giấy phép lái xe hạng A1, A, B1, B, C1, được cấp chứng chỉ bồi dưỡng kiến thức pháp luật về giao thông đường bộ để điều khiển xe máy chuyên dùng tham gia giao thông đường bộ;\n\nc) Người đủ 21 tuổi trở lên được cấp giấy phép lái xe hạng C, BE;\n\nd) Người đủ 24 tuổi trở lên được cấp giấy phép lái xe hạng D1, D2, C1E, CE;\n\nđ) Người đủ 27 tuổi trở lên được cấp giấy phép lái xe hạng D, D1E, D2E, DE;\n\ne) Tuổi tối đa của người lái xe ô tô chở người (kể cả xe buýt) trên 29 chỗ (không kể chỗ của người lái xe), xe ô tô chở người giường nằm là đủ 57 tuổi đối với nam, đủ 55 tuổi đối với nữ.\n\n2. Người điều khiển phương tiện tham gia giao thông đường bộ phải bảo đảm điều kiện sức khỏe phù hợp với từng loại phương tiện được phép điều khiển. Bộ trưởng Bộ Y tế quy định về tiêu chuẩn sức khỏe, việc khám sức khỏe đối với người lái xe, người điều khiển xe máy chuyên dùng; việc khám sức khỏe định kỳ đối với người hành nghề lái xe ô tô; xây dựng cơ sở dữ liệu về sức khỏe của người lái xe, người điều khiển xe máy chuyên dùng.\n\n3. Bộ trưởng Bộ Quốc phòng, Bộ trưởng Bộ Công an quy định độ tuổi của người lái xe trong lực lượng quân đội, công an làm nhiệm vụ quốc phòng, an ninh.\n\nĐiều 60. Đào tạo lái xe\n\n1. Người có nhu cầu được cấp giấy phép lái xe phải được đào tạo nội dung lý thuyết và thực hành theo chương trình đào tạo quy định cho từng hạng giấy phép lái xe.\n\n2. Người học lái xe phải được đào tạo tại các cơ sở đào tạo lái xe hoặc các hình thức đào tạo lái xe khác để cấp mới hoặc nâng hạng giấy phép lái xe.\n\n3. Việc đào tạo để nâng hạng giấy phép lái xe thực hiện đối với những đối tượng sau đây:\n\na) Nâng hạng giấy phép lái xe từ hạng B lên hạng C1 hoặc lên hạng C hoặc lên hạng D1 hoặc lên hạng D2;\n\nb) Nâng hạng giấy phép lái xe từ hạng C1 lên hạng C hoặc lên hạng D1 hoặc lên hạng D2;\n\nc) Nâng hạng giấy phép lái xe từ hạng C lên hạng D1 hoặc lên hạng D2 hoặc lên hạng D;\n\nd) Nâng hạng giấy phép lái xe từ hạng D1 lên hạng D2 hoặc lên hạng D;\n\nđ) Nâng hạng giấy phép lái xe từ hạng D2 lên hạng D;\n\ne) Nâng hạng giấy phép lái xe từ hạng B lên hạng BE, từ hạng C1 lên\xa0 hạng C1E, từ hạng C lên hạng CE, từ hạng D1 lên hạng D1E, từ hạng D2 lên hạng D2E, từ hạng D lên hạng DE.\n\n4.\xa0Người có nhu cầu được đào tạo nâng hạng giấy phép lái xe khi giấy phép lái xe còn hiệu lực, phải có đủ thời gian lái xe an toàn quy định cho từng hạng giấy phép lái xe;\xa0đối với việc nâng hạng giấy phép lái xe lên hạng D1, D2, D thì người có nhu cầu được đào tạo còn phải có trình độ từ trung học cơ sở trở lên.\n\n5. Giấy phép lái xe các hạng C, D1, D2, D, BE, C1E, CE, D1E, D2E, DE phải được đào tạo bằng hình thức đào tạo nâng hạng theo các điều kiện quy định tại khoản 3 và khoản 4 Điều này.\n\n6. Cơ sở đào tạo lái xe ô tô phải đáp ứng các điều kiện do Chính phủ quy định; có giáo trình, giáo án; thực hiện đào tạo theo đúng hình thức, nội dung và chương trình quy định cho từng hạng giấy phép lái xe.\n\n7. Chính phủ quy định chi tiết các hình thức đào tạo lái xe khác quy định tại khoản 2 Điều này; quy định trình tự, thủ tục kiểm tra, đánh giá để cấp, cấp lại và thu hồi giấy phép xe tập lái; quy định tiêu chuẩn của giáo viên dạy lái xe; quy định việc cấp, cấp lại và thu hồi giấy chứng nhận giáo viên dạy lái xe; quy định việc cấp, cấp lại và thu hồi giấy phép đào tạo lái xe.\n\n8. Bộ trưởng Bộ Giao thông vận tải quy định hình thức, nội dung, chương trình đào tạo lái xe, thời gian lái xe an toàn cho từng hạng giấy phép lái xe quy định tại khoản 4 Điều này và quy định tiêu chuẩn của cơ sở đào tạo lái xe mô tô; đối với cơ sở đào tạo, tổ chức đào tạo lái xe cho lực lượng quân đội, công an làm nhiệm vụ quốc phòng, an ninh do Bộ trưởng Bộ Quốc phòng, Bộ trưởng Bộ Công an quy định.\n\nĐiều 61. Sát hạch lái xe\n\n1. Người đã hoàn thành chương trình đào tạo lái xe, có độ tuổi, sức khỏe theo quy định tại Điều 59 của Luật này được đăng ký để tham dự kỳ sát hạch lái xe.\n\n2. Nội dung sát hạch lái xe phải phù hợp với hạng giấy phép lái xe và chương trình đào tạo lái xe.\n\n3. Hoạt động sát hạch lái xe ô tô phải thực hiện tại các trung tâm sát hạch lái xe; hoạt động sát hạch lái xe mô tô thực hiện tại các trung tâm sát hạch lái xe hoặc tại sân tập lái đáp ứng điều kiện, tiêu chuẩn về cơ sở vật chất, kỹ thuật. Hoạt động sát hạch lái xe do cơ quan nhà nước có thẩm quyền thực hiện.', 'b) Chứng nhận đăng ký xe ô tô hoặc bản sao chứng nhận đăng ký xe ô tô có chứng thực kèm bản gốc giấy tờ xác nhận của tổ chức tín dụng, chi nhánh ngân hàng nước ngoài còn hiệu lực trong trường hợp xe đang được thế chấp tại tổ chức tín dụng, chi nhánh ngân hàng nước ngoài (bản chính xuất trình tại thời điểm kiểm tra để đối chiếu) hoặc đính kèm bản sao trong trường hợp nộp trực tuyến.\n\n2. Trình tự thực hiện\n\na) Cơ sở đào tạo gửi hồ sơ theo quy định tại khoản 1 Điều này trực tiếp hoặc qua dịch vụ bưu chính hoặc trực tuyến đến Sở Giao thông vận tải;\n\nb) Trong thời gian không quá 02 ngày làm việc kể từ ngày tiếp nhận hồ sơ, Sở Giao thông vận tải kiểm tra tính đầy đủ của hồ sơ; trường hợp chưa đầy đủ, thì hướng dẫn tổ chức, cá nhân hoàn thiện lại theo quy định; trường hợp nhận đủ hồ sơ hợp lệ theo quy định, trong thời hạn không quá 03 ngày làm việc Sở Giao thông vận tải tổ chức kiểm tra thực tế, lập biên bản theo mẫu quy định tại Phụ lục VIII kèm theo Nghị định này và cấp giấy phép xe tập lái cho cơ sở đào tạo. Trường hợp không cấp, phải trả lời bằng văn bản và nêu rõ lý do;\n\nc) Việc trả kết quả được thực hiện tại trụ sở cơ quan có thẩm quyền cấp giấy phép hoặc qua dịch vụ bưu chính; trường hợp cấp giấy phép xe tập lái điện tử Sở Giao thông vận đăng tải trên Trang thông tin điện tử để cơ sở đào tạo in hoặc lưu trữ trên thiết bị điện tử;\n\nd) Sở Giao thông vận tải lập sổ theo dõi cấp giấy phép xe tập lái theo mẫu quy định tại Phụ lục IX kèm theo Nghị định này.\n\nĐiều 17. Thu hồi giấy phép xe tập lái\n\n1. Giấy phép xe tập lái bị thu hồi trong các trường hợp sau:\n\na) Cấp cho xe tập lái không đáp ứng một trong điều kiện quy định tại khoản 3 Điều 9 của Nghị định này;\n\nb) Bị tẩy xóa, sửa chữa;\n\nc) Để cho tổ chức, cá nhân khác sử dụng vào mục đích đào tạo lái xe;\n\nd) Cơ sở đào tạo lái xe giải thể hoặc bị thu hồi giấy phép đào tạo;\n\nđ) Theo đề nghị của cơ sở đào tạo;\n\ne) Xe tập lái trong cùng một thời điểm sử dụng từ 02 thiết bị DAT trở lên để truyền dữ liệu DAT hoặc sử dụng dữ liệu được truyền từ thiết bị DAT của xe tập lái khác.\n\n2. Sở Giao thông vận tải cấp giấy phép xe tập lái, thực hiện thu hồi theo trình tự sau:\n\na) Trong thời hạn 05 ngày làm việc kể từ ngày phát hiện hành vi vi phạm hoặc theo đề nghị của cơ sở đào tạo thuộc một trong các trường hợp quy định tại điểm a, điểm b, điểm c, điểm d và điểm e khoản 1 Điều này, cơ quan có thẩm quyền ban hành quyết định thu hồi, thông báo đến các cơ quan có liên quan để phối hợp thực hiện và công bố trên Trang thông tin điện tử của Sở Giao thông vận tải;\n\nb) Trường hợp thu hồi giấy phép xe tập lái theo đề nghị của cơ sở đào tạo thực hiện theo trình tự sau:\n\nCơ sở đào tạo gửi văn bản đề nghị thu hồi xe tập lái đến Sở Giao thông vận tải bằng một trong các hình thức: trực tiếp, bưu chính, dịch vụ bưu chính, văn bản điện tử; trong thời hạn 05 ngày làm việc kể từ ngày nhận được văn bản đề nghị của cơ sở đào tạo, cơ quan có thẩm quyền ban hành quyết định thu hồi, thông báo đến các cơ quan có liên quan để phối hợp thực hiện và công bố trên Trang thông tin điện tử của Sở Giao thông vận tải;\n\nc) Cơ sở đào tạo lái xe được cấp giấy phép xe tập lái phải dừng sử dụng xe ô tô đã bị thu hồi giấy phép xe tập lái trong hoạt động giảng dạy ngay sau khi cơ quan có thẩm quyền phát hiện hành vi vi phạm, đồng thời nộp lại giấy phép xe tập lái cho cơ quan cấp ngay sau khi quyết định thu hồi giấy phép xe tập lái có hiệu lực.\n\nĐiều 18. Giấy phép đào tạo lái xe ô tô và thẩm quyền cấp giấy phép đào tạo lái xe ô tô\n\n1. Giấy phép đào tạo lái xe ô tô được Sở Giao thông vận tải cấp cho cơ sở đào tạo lái xe ô tô trên địa bàn đáp ứng đủ điều kiện quy định tại Điều 6, Điều 7, Điều 8 và Điều 9 của Nghị định này.\n\n2. Giấy phép đào tạo lái xe ô tô theo mẫu quy định tại Mẫu số 01 và Mẫu số 02 Phụ lục XI kèm theo Nghị định này.\n\n3. Trường hợp cấp giấy phép đào tạo lái xe điện tử (có mã hai chiều (QR)), Sở Giao thông vận tải đăng tải kết quả trên Trang thông tin điện tử của Sở Giao thông vận tải để truy xuất thông tin về giấy phép đào tạo lái xe.\n\nĐiều 19. Thủ tục cấp giấy phép đào tạo lái xe ô tô\n\n1. Hồ sơ bao gồm:\n\na) Báo cáo đề nghị cấp giấy phép đào tạo lái xe theo mẫu quy định tại Phụ lục XII kèm theo Nghị định này;\n\nb) Quyết định thành lập hoặc cho phép thành lập của cơ quan có thẩm quyền (bản sao kèm bản chính để đối chiếu hoặc bản sao có chứng thực hoặc bản sao điện tử được chứng thực từ bản chính hoặc bản sao điện tử từ sổ gốc);\n\nc) Bản sao giấy chứng nhận quyền sử dụng đất hoặc quyết định giao đất, cho thuê đất của Ủy ban nhân dân cấp tỉnh kèm theo bản sao biên lai (nộp tiền sử dụng đất hoặc tiền thuê đất) hoặc minh chứng đã hoàn thành nghĩa vụ tài chính về đất đai theo quy định pháp luật về đất đai.\n\nTrường hợp thuê cơ sở vật chất gắn liền với đất: bản sao hợp đồng thuê cơ sở vật chất gắn liền với đất còn thời hạn ít nhất là 05 năm kể từ ngày gửi hồ sơ, bảo sao giấy tờ chứng minh quyền sử dụng đất hoặc bản sao giấy tờ chứng minh quyền sở hữu đối với cơ sở vật chất của bên cho thuê;\n\nd) Giấy chứng nhận giáo viên dạy thực hành lái xe (bản sao kèm bản chính để đối chiếu hoặc bản sao có chứng thực hoặc bản sao điện tử được chứng thực từ bản chính hoặc bản sao điện tử từ sổ gốc);\n\nđ) Chứng nhận đăng ký xe, biển số xe hoặc bản sao chứng nhận đăng ký xe, biển số xe có chứng thực kèm bản gốc giấy tờ xác nhận của tổ chức tín dụng, chi nhánh ngân hàng nước ngoài còn hiệu lực trong trường hợp xe đang được thế chấp tại tổ chức tín dụng, chi nhánh ngân hàng nước ngoài (bản chính xuất trình tại thời điểm kiểm tra để đối chiếu).\n\nTrường hợp giấy tờ quy định tại điểm b, điểm c và điểm d khoản này đã được tích hợp vào tài khoản định danh điện tử thì việc xuất trình, kiểm tra có thể thực hiện thông qua tài khoản định danh điện tử.\n\n2. Trình tự thực hiện\n\na) Sau khi hoàn thành xây dựng cơ sở vật chất, đội ngũ giáo viên đáp ứng yêu cầu điều kiện của cơ sở đào tạo lái xe ô tô; tổ chức, cá nhân lập 01 bộ hồ sơ đề nghị cấp phép gửi trực tiếp hoặc qua dịch vụ bưu chính đến Sở Giao thông vận tải;\n\nb) Trường hợp hồ sơ chưa đủ theo quy định, trong thời hạn không quá 02 ngày làm việc kể từ ngày nhận được hồ sơ, Sở Giao thông vận tải phải có văn bản hướng dẫn tổ chức, cá nhân hoàn thiện hồ sơ;\n\nc) Trong thời hạn không quá 10 ngày kể từ ngày nhận đủ hồ sơ hợp lệ theo quy định, Sở Giao thông vận tải tổ chức kiểm tra thực tế cơ sở đào tạo, lập biên bản theo mẫu quy định tại Phụ lục XIII kèm theo Nghị định này và cấp giấy phép đào tạo lái xe ô tô cho cơ sở đủ điều kiện. Trường hợp không cấp, phải trả lời bằng văn bản và nêu rõ lý do;\n\nd) Việc trả kết quả được thực hiện tại trụ sở cơ quan có thẩm quyền cấp giấy phép hoặc qua dịch vụ bưu chính; trường hợp cấp giấy phép đào tạo lái xe điện tử, Sở Giao thông vận tải đăng tải trên Trang thông tin điện tử của Sở Giao thông vận tải để cơ sở đào tạo lái xe in hoặc lưu trên thiết bị điện tử.\n\n3. Trong thời hạn 05 ngày làm việc kể từ ngày Sở Giao thông vận tải cấp giấy phép đào tạo lái xe, Sở Giao thông vận tải gửi Cục Đường bộ Việt Nam mã số quản lý cơ sở đào tạo lái xe ô tô, bản sao giấy phép đào tạo lái xe kèm biên bản kiểm tra cơ sở đào tạo.\n\n4. Trong thời hạn không quá 01 ngày làm việc, kể từ ngày cấp giấy phép đào tạo lái xe cho cơ sở đào tạo, Sở Giao thông vận tải cấp giấy phép xe tập lái. Trường hợp không cấp, phải trả lời bằng văn bản và nêu rõ lý do.\n\na) Việc trả kết quả được thực hiện tại trụ sở cơ quan có thẩm quyền cấp giấy phép hoặc qua dịch vụ bưu chính; trường hợp cấp giấy phép xe tập lái điện tử Sở Giao thông vận đăng tải trên Trang thông tin điện tử để cơ sở đào tạo in hoặc lưu trữ trên thiết bị điện tử;\n\nb) Sở Giao thông vận tải lập Sổ theo dõi cấp giấy phép xe tập lái theo mẫu quy định tại Phụ lục IX kèm theo Nghị định này.\n\nĐiều 20. Thủ tục cấp lại giấy phép đào tạo lái xe ô tô\n\n1. Giấy phép đào tạo lái xe ô tô được cấp lại khi điều chỉnh hạng xe đào tạo, lưu lượng đào tạo và thay đổi địa điểm đào tạo']","**Nguồn văn bản:** 168_2024_ND-CP_619502

**Tên văn bản:** Nghị định số 168/2024/NĐ-CP

**Điều 51:** Thẩm quyền, trình tự, thủ tục phục hồi điểm giấy phép lái xe

**Nội dung:**

1. Thẩm quyền phục hồi điểm giấy phép lái xe:

    a) Cục trưởng Cục Cảnh sát giao thông có trách nhiệm quản lý, vận hành Cơ sở dữ liệu về xử lý vi phạm hành chính về trật tự, an toàn giao thông đường bộ để thực hiện cập nhật, tự động phục hồi điểm giấy phép lái xe đối với trường hợp quy định tại khoản 2 Điều này.

    b) Cục trưởng Cục Cảnh sát giao thông, Trưởng phòng Cảnh sát giao thông nơi tổ chức kiểm tra kiến thức pháp luật về trật tự, an toàn giao thông đường bộ có thẩm quyền phục hồi điểm cho giấy phép lái xe đối với trường hợp quy định tại khoản 3 Điều này.

2. Trình tự, thủ tục phục hồi điểm giấy phép lái xe đối với trường hợp giấy phép lái xe chưa bị trừ hết điểm và không bị trừ điểm trong thời hạn 12 tháng từ ngày bị trừ điểm gần nhất:

    a) Khi đủ thời hạn 12 tháng, kể từ ngày bị trừ điểm giấy phép lái xe gần nhất, dữ liệu điểm giấy phép lái xe sẽ được tự động phục hồi đủ 12 điểm (gồm cả giấy phép lái xe đang trong thời hạn bị tước quyền sử dụng) và cập nhật tự động trong Cơ sở dữ liệu về xử lý vi phạm hành chính về trật tự, an toàn giao thông đường bộ.

    b) Ngay sau khi dữ liệu điểm giấy phép lái xe được phục hồi, Cơ sở dữ liệu về xử lý vi phạm hành chính về trật tự, an toàn giao thông đường bộ sẽ tự động chuyển thông tin thông báo cho người được phục hồi điểm giấy phép lái xe biết việc phục hồi điểm theo quy định tại điểm c khoản này.

    c) Việc thông báo phục hồi điểm giấy phép lái xe thực hiện bằng phương thức điện tử thông qua tài khoản của công dân đăng ký trên Cổng dịch vụ công, Ứng dụng giao thông trên thiết bị di động; đồng thời cập nhật thông tin về giấy phép lái xe được phục hồi điểm trên Trang thông tin điện tử của Cục Cảnh sát giao thông. Trường hợp giấy phép lái xe được thể hiện dưới hình thức thông điệp dữ liệu thì thực hiện cập nhật trạng thái phục hồi điểm giấy phép lái xe trong căn cước điện tử, tài khoản định danh điện tử trên ứng dụng định danh quốc gia.

3. Trình tự, thủ tục phục hồi điểm giấy phép lái xe đối với trường hợp giấy phép lái xe bị trừ hết điểm:

    a) Sau khi người có giấy phép lái xe bị trừ hết điểm tham gia kiểm tra nội dung kiến thức pháp luật về trật tự, an toàn giao thông đường bộ và đạt yêu cầu, kết quả kiểm tra được cập nhật vào phần mềm kiểm tra kiến thức pháp luật về trật tự, an toàn giao thông đường bộ và đồng bộ dữ liệu với Cơ sở dữ liệu về xử lý vi phạm hành chính về trật tự, an toàn giao thông đường bộ, dữ liệu điểm giấy phép lái xe sẽ được phục hồi đủ 12 điểm và cập nhật tự động trong Cơ sở dữ liệu về xử lý vi phạm hành chính về trật tự, an toàn giao thông đường bộ.

    b) Ngay sau khi dữ liệu điểm giấy phép lái xe được phục hồi đủ 12 điểm thì người có thẩm quyền quy định tại điểm b khoản 1 Điều này thông báo cho người được phục hồi điểm giấy phép lái xe biết việc phục hồi điểm.

    c) Việc thông báo phục hồi điểm giấy phép lái xe thực hiện bằng văn bản theo mẫu quy định của Bộ trưởng Bộ Công an và được giao trực tiếp hoặc gửi qua dịch vụ bưu chính hoặc thực hiện thông báo bằng phương thức điện tử thông qua tài khoản của công dân đăng ký trên Cổng dịch vụ công, Ứng dụng giao thông trên thiết bị di động; đồng thời cập nhật thông tin về giấy phép lái xe được phục hồi điểm trên Trang thông tin điện tử của Cục Cảnh sát giao thông. Trường hợp giấy phép lái xe được thể hiện dưới hình thức thông điệp dữ liệu thì cơ quan, người có thẩm quyền thực hiện cập nhật trạng thái phục hồi điểm giấy phép lái xe trong căn cước điện tử, tài khoản định danh điện tử trên ứng dụng định danh quốc gia.


Tóm lại:  Quy trình phục hồi điểm giấy phép lái xe phụ thuộc vào tình trạng điểm hiện tại. Nếu chưa hết điểm và không bị trừ điểm trong 12 tháng, điểm sẽ tự động phục hồi sau 12 tháng. Nếu hết điểm, cần tham gia kiểm tra kiến thức pháp luật về giao thông và đạt yêu cầu mới được phục hồi điểm.  Thông báo phục hồi điểm được thực hiện qua nhiều kênh: điện tử hoặc văn bản.
",Người lái ô tô phải làm kiểm tra lý thuyết và mô phỏng theo các câu hỏi như khi thi bằng lái xe.,1.0,0.6695748677686094,0.0,0.0
13,Luật Giao thông Đường bộ 2025 có quy định gì mới về việc sử dụng điện thoại khi lái xe?,"['6. Trường hợp tước quyền sử dụng giấy phép lái xe tích hợp giấy phép lái xe không thời hạn (xe mô tô, xe tương tự xe mô tô) và giấy phép lái xe có thời hạn (xe ô tô, xe tương tự xe ô tô, xe chở người bốn bánh có gắn động cơ, xe chở hàng bốn bánh có gắn động cơ) thì người có thẩm quyền xử phạt áp dụng tước quyền sử dụng đối với giấy phép lái xe không thời hạn khi người điều khiển xe mô tô, xe tương tự xe mô tô hoặc tước quyền sử dụng đối với giấy phép lái xe có thời hạn khi người điều khiển xe ô tô, xe tương tự xe ô tô, xe chở người bốn bánh có gắn động cơ, xe chở hàng bốn bánh có gắn động cơ thực hiện hành vi vi phạm hành chính có quy định bị tước quyền sử dụng giấy phép lái xe. Trong thời gian bị tước quyền sử dụng, người có giấy phép lái xe tích hợp được cấp, đổi giấy phép lái xe đối với giấy phép lái xe không bị tước quyền sử dụng.\n\n7. Trường hợp giấy phép, chứng chỉ hành nghề được cấp dưới dạng điện tử hoặc thể hiện dưới hình thức thông điệp dữ liệu thì cơ quan, người có thẩm quyền thực hiện tạm giữ, tước trên môi trường điện tử theo quy định nếu đáp ứng điều kiện về cơ sở hạ tầng, kỹ thuật, thông tin. Việc tạm giữ, tước quyền sử dụng được cập nhật trạng thái trên cơ sở dữ liệu, căn cước điện tử, tài khoản định danh điện tử và ứng dụng thông tin điện tử khác theo quy định.\n\nChương II\n\nHÀNH VI VI PHẠM, HÌNH THỨC, MỨC XỬ PHẠT, MỨC TRỪ ĐIỂM GIẤY PHÉP LÁI XE VÀ BIỆN PHÁP KHẮC PHỤC HẬU QUẢ VI PHẠM HÀNH CHÍNH VỀ TRẬT TỰ, AN TOÀN GIAO THÔNG TRONG LĨNH VỰC GIAO THÔNG ĐƯỜNG BỘ\n\nMục 1. VI PHẠM QUY TẮC GIAO THÔNG ĐƯỜNG BỘ\n\nĐiều 6. Xử phạt, trừ điểm giấy phép lái xe của người điều khiển xe ô tô, xe chở người bốn bánh có gắn động cơ, xe chở hàng bốn bánh có gắn động cơ và các loại xe tương tự xe ô tô vi phạm quy tắc giao thông đường bộ\n\n1. Phạt tiền từ 400.000 đồng đến 600.000 đồng đối với người điều khiển xe thực hiện một trong các hành vi vi phạm sau đây:\n\na) Không chấp hành hiệu lệnh, chỉ dẫn của biển báo hiệu, vạch kẻ đường, trừ các hành vi vi phạm quy định tại điểm a, điểm c, điểm d, điểm đ khoản 2; điểm a, điểm d, điểm đ, điểm e, điểm n, điểm o khoản 3; điểm a, điểm b, điểm đ, điểm e, điểm i, điểm k, điểm l khoản 4; điểm a, điểm b, điểm c, điểm d, điểm đ, điểm i, điểm k khoản 5; điểm a khoản 6; khoản 7; điểm b, điểm d khoản 9; điểm a khoản 10; điểm đ khoản 11 Điều này;\n\nb) Khi ra, vào vị trí dừng xe, đỗ xe không có tín hiệu báo cho người điều khiển phương tiện khác biết;\n\nc) Không báo hiệu bằng đèn khẩn cấp hoặc không đặt biển cảnh báo “Chú ý xe đỗ” theo quy định trong trường hợp gặp sự cố kỹ thuật (hoặc bất khả kháng khác) buộc phải đỗ xe chiếm một phần đường xe chạy hoặc tại nơi không được phép đỗ xe, trừ hành vi vi phạm quy định tại điểm c khoản 7 Điều này;\n\nd) Không gắn biển báo hiệu ở phía trước xe kéo, phía sau xe được kéo; điều khiển xe kéo rơ moóc không có biển báo hiệu theo quy định;\n\nđ) Sử dụng còi trong thời gian từ 22 giờ ngày hôm trước đến 05 giờ ngày hôm sau trong khu đông dân cư, khu vực cơ sở khám bệnh, chữa bệnh, trừ các xe ưu tiên đang đi làm nhiệm vụ theo quy định.\n\n2. Phạt tiền từ 600.000 đồng đến 800.000 đồng đối với người điều khiển xe thực hiện một trong các hành vi vi phạm sau đây:\n\na) Chuyển làn đường không đúng nơi cho phép hoặc không có tín hiệu báo trước hoặc chuyển làn đường không đúng quy định “mỗi lần chuyển làn đường chỉ được phép chuyển sang một làn đường liền kề”, trừ các hành vi vi phạm quy định tại điểm g khoản 5 Điều này;\n\nb) Chở người trên buồng lái quá số lượng quy định;\n\nc) Không tuân thủ các quy định về nhường đường tại nơi đường bộ giao nhau, trừ các hành vi vi phạm quy định tại điểm n, điểm o khoản 5 Điều này;\n\nd) Dừng xe, đỗ xe trên phần đường xe chạy ở đoạn đường ngoài đô thị nơi có lề đường rộng; dừng xe, đỗ xe không sát mép đường phía bên phải theo chiều đi ở nơi đường có lề đường hẹp hoặc không có lề đường; dừng xe, đỗ xe ngược với chiều lưu thông của làn đường; dừng xe, đỗ xe trên dải phân cách cố định ở giữa hai phần đường xe chạy; đỗ xe trên dốc không chèn bánh;\n\nđ) Dừng xe không sát theo lề đường, vỉa hè phía bên phải theo chiều đi hoặc bánh xe gần nhất cách lề đường, vỉa hè quá 0,25 mét; dừng xe trên đường dành riêng cho xe buýt; dừng xe trên miệng cống thoát nước, miệng hầm của đường điện thoại, điện cao thế, chỗ dành riêng cho xe chữa cháy lấy nước; rời vị trí lái, tắt máy khi dừng xe (trừ trường hợp rời khỏi vị trí lái để đóng, mở cửa xe, xếp dỡ hàng hóa, kiểm tra kỹ thuật xe) hoặc rời vị trí lái khi dừng xe nhưng không sử dụng phanh đỗ xe (hoặc thực hiện biện pháp an toàn khác); dừng xe, đỗ xe không đúng vị trí quy định ở những đoạn có bố trí nơi dừng xe, đỗ xe; dừng xe, đỗ xe trên phần đường dành cho người đi bộ qua đường; dừng xe nơi có biển “Cấm dừng xe và đỗ xe”, trừ hành vi vi phạm quy định tại điểm đ khoản 4, điểm c khoản 7 Điều này.\n\n3. Phạt tiền từ 800.000 đồng đến 1.000.000 đồng đối với người điều khiển xe thực hiện một trong các hành vi vi phạm sau đây:\n\na) Điều khiển xe chạy quá tốc độ quy định từ 05 km/h đến dưới 10 km/h;\n\nb) Sử dụng còi, rú ga liên tục; sử dụng còi hơi, sử dụng đèn chiếu xa khi gặp người đi bộ qua đường hoặc khi đi trên đoạn đường qua khu dân cư có hệ thống chiếu sáng đang hoạt động hoặc khi gặp xe đi ngược chiều (trừ trường hợp dải phân cách có khả năng chống chói) hoặc khi chuyển hướng xe tại nơi đường giao nhau, trừ các xe ưu tiên đang đi làm nhiệm vụ theo quy định;\n\nc) Chuyển hướng không quan sát hoặc không bảo đảm khoảng cách an toàn với xe phía sau hoặc không giảm tốc độ hoặc không có tín hiệu báo hướng rẽ hoặc có tín hiệu báo hướng rẽ nhưng không sử dụng liên tục trong quá trình chuyển hướng (trừ trường hợp điều khiển xe đi theo hướng cong của đoạn đường bộ ở nơi đường không giao nhau cùng mức);\n\nd) Không tuân thủ các quy định về dừng xe, đỗ xe tại nơi đường bộ giao nhau cùng mức với đường sắt; dừng xe, đỗ xe trong phạm vi bảo vệ công trình đường sắt, phạm vi an toàn của đường sắt;\n\nđ) Dừng xe, đỗ xe tại vị trí: nơi đường bộ giao nhau hoặc trong phạm vi 05 mét tính từ mép đường giao nhau; điểm đón, trả khách; trước cổng hoặc trong phạm vi 05 mét hai bên cổng trụ sở cơ quan, tổ chức có bố trí đường cho xe ra, vào; nơi phần đường có bề rộng chỉ đủ cho một làn xe cơ giới; che khuất biển báo hiệu đường bộ, đèn tín hiệu giao thông; nơi mở dải phân cách giữa; cách xe ô tô đang đỗ ngược chiều dưới 20 mét trên đường phố hẹp, dưới 40 mét trên đường có một làn xe cơ giới trên một chiều đường;\n\ne) Đỗ xe không sát theo lề đường, vỉa hè phía bên phải theo chiều đi hoặc bánh xe gần nhất cách lề đường, vỉa hè quá 0,25 mét; đỗ xe trên đường dành riêng cho xe buýt; đỗ xe trên miệng cống thoát nước, miệng hầm của đường điện thoại, điện cao thế, chỗ dành riêng cho xe chữa cháy lấy nước; đỗ, để xe ở vỉa hè trái quy định của pháp luật; đỗ xe nơi có biển “Cấm đỗ xe” hoặc biển “Cấm dừng xe và đỗ xe”, trừ hành vi vi phạm quy định tại điểm đ khoản 4, điểm c khoản 7 Điều này;\n\ng) Không sử dụng hoặc sử dụng không đủ đèn chiếu sáng trong thời gian từ 18 giờ ngày hôm trước đến 06 giờ ngày hôm sau hoặc khi có sương mù, khói, bụi, trời mưa, thời tiết xấu làm hạn chế tầm nhìn;\n\nh) Điều khiển xe ô tô kéo theo xe khác, vật khác (trừ trường hợp kéo theo một rơ moóc, sơ mi rơ moóc hoặc một xe ô tô, xe máy chuyên dùng khác khi xe này không tự chạy được); điều khiển xe ô tô đẩy xe khác, vật khác; điều khiển xe kéo rơ moóc, sơ mi rơ moóc kéo thêm rơ moóc hoặc xe khác, vật khác; không nối chắc chắn, an toàn giữa xe kéo và xe được kéo khi kéo nhau;\n\ni) Chở người trên xe được kéo, trừ người điều khiển;\n\nk) Không thắt dây đai an toàn khi điều khiển xe chạy trên đường;\n\nl) Chở người trên xe ô tô không thắt dây đai an toàn (tại vị trí có trang bị dây đai an toàn) khi xe đang chạy;\n\nm) Chở trẻ em dưới 10 tuổi và chiều cao dưới 1,35 mét trên xe ô tô ngồi cùng hàng ghế với người lái xe (trừ loại xe ô tô chỉ có một hàng ghế) hoặc không sử dụng thiết bị an toàn phù hợp cho trẻ em theo quy định;\n\nn) Chạy trong hầm đường bộ không sử dụng đèn chiếu sáng gần;', 'BỘ CÔNG AN\n------- CỘNG HÒA XÃ HỘI CHỦ NGHĨA VIỆT NAM\nĐộc lập - Tự do - Hạnh phúc \n--------------- Số: 71/2024/TT-BCA Hà Nội, ngày 12 tháng 11 năm 2024\n\nTHÔNG TƯ\n\nQUY ĐỊNH QUẢN LÝ, VẬN HÀNH, SỬ DỤNG HỆ THỐNG QUẢN LÝ DỮ LIỆU THIẾT BỊ GIÁM SÁT HÀNH TRÌNH VÀ THIẾT BỊ GHI NHẬN HÌNH ẢNH NGƯỜI LÁI XE\n\nCăn cứ Luật Trật tự, an toàn giao thông đường bộ ngày 27 tháng 6 năm 2024;\n\nCăn cứ Nghị định số 01/2018/NĐ-CP ngày 06 tháng 8 năm 2018 của Chính phủ quy định chức năng, nhiệm vụ, quyền hạn và cơ cấu tổ chức của Bộ Công an;\n\nTheo đề nghị của Cục trưởng Cục Cảnh sát giao thông;\n\nBộ trưởng Bộ Công an ban hành Thông tư quy định quản lý, vận hành, sử dụng hệ thống quản lý dữ liệu thiết bị giám sát hành trình và thiết bị ghi nhận hình ảnh người lái xe.\n\nChương I\n\nQUY ĐỊNH CHUNG\n\nĐiều 1. Phạm vi điều chỉnh\n\nThông tư này quy định về quản lý, vận hành, sử dụng hệ thống quản lý dữ liệu thiết bị giám sát hành trình và thiết bị ghi nhận hình ảnh người lái xe và trách nhiệm của các đơn vị, tổ chức, cá nhân có liên quan.\n\nĐiều 2. Đối tượng áp dụng\n\n1. Sĩ quan, hạ sĩ quan Công an nhân dân làm nhiệm vụ quản lý, vận hành, sử dụng hệ thống quản lý dữ liệu thiết bị giám sát hành trình và thiết bị ghi nhận hình ảnh người lái xe (sau đây gọi chung là cán bộ, chiến sĩ).\n\n2. Công an các đơn vị, địa phương.\n\n3. Tổ chức, cá nhân có liên quan.\n\nĐiều 3. Giải thích từ ngữ\n\n1. Hệ thống quản lý dữ liệu thiết bị giám sát hành trình và thiết bị ghi nhận hình ảnh người lái xe là tập hợp các hệ thống dữ liệu thiết bị giám sát hành trình, thiết bị ghi nhận hình ảnh người lái xe, thiết bị phần cứng, phần mềm và đường truyền dùng để thu nhận, quản lý, sử dụng dữ liệu thu thập từ thiết bị giám sát hành trình, thiết bị ghi nhận hình ảnh người lái xe.\n\n2. Hệ thống dữ liệu thiết bị giám sát hành trình và thiết bị ghi nhận hình ảnh người lái xe là tập hợp các dữ liệu được truyền từ thiết bị giám sát hành trình, thiết bị ghi nhận hình ảnh người lái xe về máy chủ dịch vụ và từ máy chủ dịch vụ truyền về máy chủ của Cục Cảnh sát giao thông.\n\n3. Máy chủ dịch vụ là máy chủ của đơn vị vận tải hoặc đơn vị cung cấp dịch vụ liên quan đến giám sát hành trình, ghi nhận hình ảnh người lái xe thực hiện việc tiếp nhận dữ liệu truyền về từ thiết bị giám sát hành trình, thiết bị ghi nhận hình ảnh người lái xe.\n\n4. Đơn vị cung cấp dịch vụ liên quan đến giám sát hành trình, ghi nhận hình ảnh người lái xe (sau đây gọi chung là đơn vị cung cấp dịch vụ) là đơn vị tổ chức thực hiện việc cung cấp dịch vụ quản lý, tổng hợp, phân tích và lưu trữ dữ liệu truyền về từ thiết bị giám sát hành trình, thiết bị ghi nhận hình ảnh người lái xe theo hợp đồng với đơn vị kinh doanh vận tải bằng xe ô tô hoặc các chủ phương tiện theo quy định phải lắp thiết bị giám sát hành trình, thiết bị ghi nhận hình ảnh người lái xe.\n\nĐiều 4. Quy định về phương pháp tính toán\n\nViệc tính toán quá tốc độ xe chạy, thời gian lái xe, xác định không truyền dữ liệu được xác định theo một phương pháp thống nhất trên máy chủ dịch vụ và máy chủ của Cục Cảnh sát giao thông; cụ thể:\n\n1. Tính toán quá tốc độ xe chạy được xác định theo phương pháp tính toán quy định tại Phụ lục II kèm theo Thông tư này.\n\n2. Tính toán thời gian lái xe theo quy định tại khoản 1 Điều 64 Luật Trật tự, an toàn giao thông đường bộ được xác định theo phương pháp tính toán quy định tại Phụ lục III kèm theo Thông tư này.\n\n3. Xác định không truyền dữ liệu được xác định theo phương pháp tính toán quy định tại Phụ lục IV kèm theo Thông tư này.\n\nĐiều 5. Phụ lục kèm theo Thông tư\n\n\n\n1. Phụ lục I: cấu trúc bản tin.\n\n2. Phụ lục II: phương pháp tính toán quá tốc độ xe chạy.\n\n3. Phụ lục III: phương pháp tính toán thời gian lái xe.\n\n4. Phụ lục IV: phương pháp xác định không truyền dữ liệu.\n\nChương II\n\nQUẢN LÝ, VẬN HÀNH, SỬ DỤNG HỆ THỐNG QUẢN LÝ DỮ LIỆU THIẾT BỊ GIÁM SÁT HÀNH TRÌNH VÀ THIẾT BỊ GHI NHẬN HÌNH ẢNH NGƯỜI LÁI XE\n\nĐiều 6. Hệ thống dữ liệu thiết bị giám sát hành trình và thiết bị ghi nhận hình ảnh người lái xe\n\n1. Hệ thống dữ liệu thiết bị giám sát hành trình và thiết bị ghi nhận hình ảnh người lái xe, bao gồm: dữ liệu định danh, dữ liệu hành trình, dữ liệu hình ảnh người lái xe; cụ thể:\n\na) Dữ liệu định danh, bao gồm: tên đơn vị kinh doanh vận tải, mã số thuế, tên cơ quan cấp giấy phép kinh doanh vận tải, biển số xe, số người được phép chở của phương tiện hoặc tải trọng cho phép phương tiện tham gia giao thông đường bộ, loại hình kinh doanh;\n\nb) Dữ liệu hành trình, bao gồm: biển số xe, số giấy phép lái xe, tốc độ, thời gian, tọa độ và các thông tin này được cập nhật liên tục;\n\nc) Dữ liệu hình ảnh người lái xe, bao gồm: biển số xe, số giấy phép lái xe, tốc độ, thời gian, tọa độ, hình ảnh người lái xe và các thông tin này được cập nhật liên tục.\n\n2. Dữ liệu hành trình, dữ liệu hình ảnh người lái xe từ máy chủ dịch vụ được truyền theo cấu trúc bản tin quy định tại Phụ lục I kèm theo Thông tư này về máy chủ của Cục Cảnh sát giao thông trong thời gian không quá 02 phút đối với dữ liệu hành trình, không quá 05 phút đối với dữ liệu hình ảnh người lái xe, kể từ thời điểm máy chủ dịch vụ nhận được dữ liệu. Trường hợp đường truyền bị gián đoạn, chậm nhất trong thời hạn không quá 05 ngày phải gửi đồng thời dữ liệu cũ và dữ liệu hiện tại khi đường truyền hoạt động bình thường và phải có sự chấp thuận của Cục Cảnh sát giao thông. Dữ liệu cũ được truyền theo một kênh truyền riêng, độc lập với kênh truyền dữ liệu hiện tại. Sau khi hết thời hạn truyền lại dữ liệu cũ, hệ thống sẽ thực hiện tính toán lại toàn bộ các thông số.\n\n3. Máy chủ dịch vụ và máy chủ của Cục Cảnh sát giao thông tham gia việc truyền, nhận dữ liệu hành trình, dữ liệu hình ảnh người lái xe phải được đồng bộ hóa với thời gian chuẩn quốc gia theo chuẩn NTP (Network Time Protocol).\n\nĐiều 7. Quản lý, vận hành, sử dụng hệ thống quản lý dữ liệu thiết bị giám sát hành trình và thiết bị ghi nhận hình ảnh người lái xe\n\n1. Hệ thống quản lý dữ liệu thiết bị giám sát hành trình và thiết bị ghi nhận hình ảnh người lái xe do lực lượng Cảnh sát giao thông quản lý, vận hành, sử dụng và thường xuyên theo dõi, kiểm tra việc vận hành hoạt động của hệ thống.\n\n2. Dữ liệu trong hệ thống dữ liệu thiết bị giám sát hành trình, thiết bị ghi nhận hình ảnh người lái xe được kết nối, chia sẻ, bảo mật theo quy định của pháp luật.\n\nĐiều 8. Phân cấp quản lý, sử dụng dữ liệu thu thập từ thiết bị giám sát hành trình, thiết bị ghi nhận hình ảnh người lái xe\n\n1. Cục Cảnh sát giao thông thống nhất quản lý, sử dụng dữ liệu thu thập từ thiết bị giám sát hành trình, thiết bị ghi nhận hình ảnh người lái xe trong phạm vi cả nước, bao gồm:\n\na) Tổng hợp vụ việc vi phạm theo từng loại phương tiện, từng tuyến đường, theo tỉnh, thành phố quản lý đăng ký xe, theo địa giới hành chính và theo các thời điểm khác nhau;\n\nb) Tổng số lần và hành vi vi phạm theo ngày, tháng, năm;\n\nc) Tỷ lệ tổng số km vi phạm/tổng số km xe chạy (tính theo %);\n\nd) Tổng hợp xe có vi phạm quá tốc độ;\n\nđ) Tổng hợp vi phạm về thời gian lái xe theo quy định;\n\ne) Số lần và thời gian không truyền dữ liệu trong tháng;\n\ng) Tổng hợp các thông tin cần thiết khác phục vụ công tác quản lý về trật tự, an toàn giao thông đường bộ.\n\n2. Công an tỉnh, thành phố trực thuộc trung ương quản lý, sử dụng dữ liệu thu thập từ thiết bị giám sát hành trình, thiết bị ghi nhận hình ảnh người lái xe đối với các phương tiện thuộc phạm vi quản lý.\n\nChương III\n\nTRÁCH NHIỆM QUẢN LÝ, VẬN HÀNH, SỬ DỤNG HỆ THỐNG QUẢN LÝ DỮ LIỆU THIẾT BỊ GIÁM SÁT HÀNH TRÌNH VÀ THIẾT BỊ GHI NHẬN HÌNH ẢNH NGƯỜI \n\n\n\nLÁI XE\n\nĐiều 9. Trách nhiệm của Cục Cảnh sát giao thông\n\n1. Báo cáo đề xuất việc đầu tư xây dựng hoặc đề xuất thuê hệ thống quản lý dữ liệu thiết bị giám sát hành trình và thiết bị ghi nhận hình ảnh người lái xe.\n\n2. Trường hợp máy chủ của Cục Cảnh sát giao thông không nhận được dữ liệu từ 30 phút trở lên hoặc xảy ra sự cố về đường truyền hoặc sự cố về máy chủ phải cảnh báo trên hệ thống dữ liệu thiết bị giám sát hành trình, thiết bị ghi nhận hình ảnh người lái xe của Cục Cảnh sát giao thông để các đơn vị sử dụng dữ liệu biết, xử lý.', 'a) Giấy phép lái xe hết thời hạn sử dụng;\n\nb) Giấy phép lái xe bị thu hồi theo quy định tại khoản 5 Điều 62 của Luật này.\n\n8. Giấy phép lái xe quốc tế được quy định như sau:\n\na) Giấy phép lái xe quốc tế là giấy phép lái xe do cơ quan nhà nước có thẩm quyền của quốc gia là thành viên của Công ước Viên cấp theo một mẫu thống nhất; có thời hạn không quá 03 năm kể từ ngày cấp và phải phù hợp với thời hạn còn hiệu lực của giấy phép lái xe quốc gia;\n\nb) Người có giấy phép lái xe quốc tế do quốc gia là thành viên của Công ước Viên cấp khi lái xe tham gia giao thông đường bộ trên lãnh thổ Việt Nam phải mang theo giấy phép lái xe quốc tế và giấy phép lái xe quốc gia được cấp phù hợp với hạng xe điều khiển, còn thời hạn sử dụng; phải tuân thủ pháp luật về trật tự, an toàn giao thông đường bộ của Việt Nam;\n\nc) Người có giấy phép lái xe quốc tế vi phạm pháp luật về trật tự, an toàn giao thông đường bộ của Việt Nam mà bị tước quyền sử dụng giấy phép lái xe có thời hạn thì thời gian bị tước quyền sử dụng không quá thời gian người lái xe được phép cư trú tại lãnh thổ Việt Nam;\n\nd) Người Việt Nam hoặc người nước ngoài có thẻ thường trú hoặc thẻ tạm trú tại Việt Nam có giấy phép lái xe do Việt Nam hoặc quốc gia là thành viên của điều ước quốc tế mà nước Cộng hòa xã hội chủ nghĩa Việt Nam là thành viên cấp, còn giá trị sử dụng, nếu có nhu cầu được cấp giấy phép lái xe quốc tế.\n\n9. Bộ trưởng Bộ Giao thông vận tải quy định mẫu giấy phép lái xe và giấy phép lái xe quốc tế, trình tự, thủ tục cấp và việc sử dụng giấy phép lái xe, giấy phép lái xe quốc tế; đối với mẫu giấy phép lái xe, trình tự, thủ tục cấp và việc sử dụng giấy phép lái xe của lực lượng quân đội, công an làm nhiệm vụ quốc phòng, an ninh do Bộ trưởng Bộ Quốc phòng, Bộ trưởng Bộ Công an quy định.\n\nĐiều 58. Điểm của giấy phép lái xe \n\n1. Điểm của giấy phép lái xe được dùng để quản lý việc chấp hành pháp luật về trật tự, an toàn giao thông đường bộ của người lái xe trên hệ thống cơ sở dữ liệu về trật tự, an toàn giao thông đường bộ, bao gồm 12 điểm. Số điểm trừ mỗi lần vi phạm tùy thuộc tính chất, mức độ của hành vi vi phạm pháp luật về trật tự, an toàn giao thông đường bộ. Dữ liệu về điểm trừ giấy phép lái xe của người vi phạm sẽ được cập nhật vào hệ thống cơ sở dữ liệu ngay sau khi quyết định xử phạt có hiệu lực thi hành và thông báo cho người bị trừ điểm giấy phép lái xe biết.\n\n2. Giấy phép lái xe chưa bị trừ hết điểm và không bị trừ điểm trong thời hạn 12 tháng từ ngày bị trừ điểm gần nhất thì được phục hồi đủ 12 điểm.\n\n3. Trường hợp giấy phép lái xe bị trừ hết điểm thì người có giấy phép lái xe không được điều khiển phương tiện tham gia giao thông đường bộ theo giấy phép lái xe đó. Sau thời hạn ít nhất là 06 tháng kể từ ngày bị trừ hết điểm, người có giấy phép lái xe được tham gia kiểm tra nội dung kiến thức pháp luật về trật tự, an toàn giao thông đường bộ theo quy định tại khoản 7 Điều 61 của Luật này do lực lượng Cảnh sát giao thông tổ chức, có kết quả đạt yêu cầu thì được phục hồi đủ 12 điểm.\n\n4. Giấy phép lái xe sau khi đổi, cấp lại, nâng hạng được giữ nguyên số điểm của giấy phép lái xe trước khi đổi, cấp lại, nâng hạng.\n\n5. Người có thẩm quyền xử phạt vi phạm hành chính có thẩm quyền trừ điểm giấy phép lái xe.\n\n6. Chính phủ quy định chi tiết khoản 1 Điều này; quy định trình tự, thủ tục, thẩm quyền trừ điểm, phục hồi điểm giấy phép lái xe; quy định lộ trình thực hiện Điều này. Bộ trưởng Bộ Công an quy định chi tiết khoản 3 Điều này.\n\nĐiều 59. Tuổi, sức khỏe của người điều khiển phương tiện tham gia giao thông đường bộ\n\n1. Độ tuổi của người lái xe, người điều khiển xe máy chuyên dùng được quy định như sau:\n\na) Người đủ 16 tuổi trở lên được điều khiển xe gắn máy;\n\nb) Người đủ 18 tuổi trở lên được cấp giấy phép lái xe hạng A1, A, B1, B, C1, được cấp chứng chỉ bồi dưỡng kiến thức pháp luật về giao thông đường bộ để điều khiển xe máy chuyên dùng tham gia giao thông đường bộ;\n\nc) Người đủ 21 tuổi trở lên được cấp giấy phép lái xe hạng C, BE;\n\nd) Người đủ 24 tuổi trở lên được cấp giấy phép lái xe hạng D1, D2, C1E, CE;\n\nđ) Người đủ 27 tuổi trở lên được cấp giấy phép lái xe hạng D, D1E, D2E, DE;\n\ne) Tuổi tối đa của người lái xe ô tô chở người (kể cả xe buýt) trên 29 chỗ (không kể chỗ của người lái xe), xe ô tô chở người giường nằm là đủ 57 tuổi đối với nam, đủ 55 tuổi đối với nữ.\n\n2. Người điều khiển phương tiện tham gia giao thông đường bộ phải bảo đảm điều kiện sức khỏe phù hợp với từng loại phương tiện được phép điều khiển. Bộ trưởng Bộ Y tế quy định về tiêu chuẩn sức khỏe, việc khám sức khỏe đối với người lái xe, người điều khiển xe máy chuyên dùng; việc khám sức khỏe định kỳ đối với người hành nghề lái xe ô tô; xây dựng cơ sở dữ liệu về sức khỏe của người lái xe, người điều khiển xe máy chuyên dùng.\n\n3. Bộ trưởng Bộ Quốc phòng, Bộ trưởng Bộ Công an quy định độ tuổi của người lái xe trong lực lượng quân đội, công an làm nhiệm vụ quốc phòng, an ninh.\n\nĐiều 60. Đào tạo lái xe\n\n1. Người có nhu cầu được cấp giấy phép lái xe phải được đào tạo nội dung lý thuyết và thực hành theo chương trình đào tạo quy định cho từng hạng giấy phép lái xe.\n\n2. Người học lái xe phải được đào tạo tại các cơ sở đào tạo lái xe hoặc các hình thức đào tạo lái xe khác để cấp mới hoặc nâng hạng giấy phép lái xe.\n\n3. Việc đào tạo để nâng hạng giấy phép lái xe thực hiện đối với những đối tượng sau đây:\n\na) Nâng hạng giấy phép lái xe từ hạng B lên hạng C1 hoặc lên hạng C hoặc lên hạng D1 hoặc lên hạng D2;\n\nb) Nâng hạng giấy phép lái xe từ hạng C1 lên hạng C hoặc lên hạng D1 hoặc lên hạng D2;\n\nc) Nâng hạng giấy phép lái xe từ hạng C lên hạng D1 hoặc lên hạng D2 hoặc lên hạng D;\n\nd) Nâng hạng giấy phép lái xe từ hạng D1 lên hạng D2 hoặc lên hạng D;\n\nđ) Nâng hạng giấy phép lái xe từ hạng D2 lên hạng D;\n\ne) Nâng hạng giấy phép lái xe từ hạng B lên hạng BE, từ hạng C1 lên\xa0 hạng C1E, từ hạng C lên hạng CE, từ hạng D1 lên hạng D1E, từ hạng D2 lên hạng D2E, từ hạng D lên hạng DE.\n\n4.\xa0Người có nhu cầu được đào tạo nâng hạng giấy phép lái xe khi giấy phép lái xe còn hiệu lực, phải có đủ thời gian lái xe an toàn quy định cho từng hạng giấy phép lái xe;\xa0đối với việc nâng hạng giấy phép lái xe lên hạng D1, D2, D thì người có nhu cầu được đào tạo còn phải có trình độ từ trung học cơ sở trở lên.\n\n5. Giấy phép lái xe các hạng C, D1, D2, D, BE, C1E, CE, D1E, D2E, DE phải được đào tạo bằng hình thức đào tạo nâng hạng theo các điều kiện quy định tại khoản 3 và khoản 4 Điều này.\n\n6. Cơ sở đào tạo lái xe ô tô phải đáp ứng các điều kiện do Chính phủ quy định; có giáo trình, giáo án; thực hiện đào tạo theo đúng hình thức, nội dung và chương trình quy định cho từng hạng giấy phép lái xe.\n\n7. Chính phủ quy định chi tiết các hình thức đào tạo lái xe khác quy định tại khoản 2 Điều này; quy định trình tự, thủ tục kiểm tra, đánh giá để cấp, cấp lại và thu hồi giấy phép xe tập lái; quy định tiêu chuẩn của giáo viên dạy lái xe; quy định việc cấp, cấp lại và thu hồi giấy chứng nhận giáo viên dạy lái xe; quy định việc cấp, cấp lại và thu hồi giấy phép đào tạo lái xe.\n\n8. Bộ trưởng Bộ Giao thông vận tải quy định hình thức, nội dung, chương trình đào tạo lái xe, thời gian lái xe an toàn cho từng hạng giấy phép lái xe quy định tại khoản 4 Điều này và quy định tiêu chuẩn của cơ sở đào tạo lái xe mô tô; đối với cơ sở đào tạo, tổ chức đào tạo lái xe cho lực lượng quân đội, công an làm nhiệm vụ quốc phòng, an ninh do Bộ trưởng Bộ Quốc phòng, Bộ trưởng Bộ Công an quy định.\n\nĐiều 61. Sát hạch lái xe\n\n1. Người đã hoàn thành chương trình đào tạo lái xe, có độ tuổi, sức khỏe theo quy định tại Điều 59 của Luật này được đăng ký để tham dự kỳ sát hạch lái xe.\n\n2. Nội dung sát hạch lái xe phải phù hợp với hạng giấy phép lái xe và chương trình đào tạo lái xe.\n\n3. Hoạt động sát hạch lái xe ô tô phải thực hiện tại các trung tâm sát hạch lái xe; hoạt động sát hạch lái xe mô tô thực hiện tại các trung tâm sát hạch lái xe hoặc tại sân tập lái đáp ứng điều kiện, tiêu chuẩn về cơ sở vật chất, kỹ thuật. Hoạt động sát hạch lái xe do cơ quan nhà nước có thẩm quyền thực hiện.']","**Nguồn văn bản:** 168_2024_ND-CP_619502

**Tên văn bản:**  (Tên văn bản không được cung cấp trong metadata)

**Điều:** (Điều không được cung cấp trong metadata)


**Nội dung:**

Tôi xin lỗi, nhưng văn bản được cung cấp không chứa thông tin cụ thể về quy định sử dụng điện thoại khi lái xe. Văn bản tập trung vào các quy định về xử phạt vi phạm hành chính, tước quyền sử dụng giấy phép lái xe và các quy định khác liên quan đến trật tự, an toàn giao thông đường bộ.  Văn bản đề cập đến nhiều loại vi phạm và mức phạt tiền tương ứng, nhưng không đề cập đến việc sử dụng điện thoại khi lái xe.


Tóm lại: Không tìm thấy thông tin liên quan đến quy định về việc sử dụng điện thoại khi lái xe trong văn bản được cung cấp.
",Luật cấm sử dụng điện thoại di động khi đang điều khiển phương tiện giao thông.,1.0,0.7358228464947413,0.0,0.0
14,Quy định mới về tốc độ tối đa trong khu vực đô thị là gì?,"['BỘ GIAO THÔNG VẬN TẢI\n-------- CỘNG HÒA XÃ HỘI CHỦ NGHĨA VIỆT NAM\nĐộc lập - Tự do - Hạnh phúc \n--------------- Số: 38/2024/TT-BGTVT Hà Nội, Ngày 15 tháng 11 năm 2024\n\nTHÔNG TƯ\n\nQUY ĐỊNH VỀ TỐC ĐỘ VÀ KHOẢNG CÁCH AN TOÀN CỦA XE CƠ GIỚI, XE MÁY CHUYÊN DÙNG THAM GIA GIAO THÔNG TRÊN ĐƯỜNG BỘ\n\nCăn cứ Luật Trật tự, an toàn giao thông đường bộ ngày 27 tháng 6 năm 2024;\n\nCăn cứ Luật Đường bộ ngày 27 tháng 6 năm 2024;\n\nCăn cứ Nghị định số 56/2022/NĐ-CP ngày 24 tháng 8 năm 2022 của Chính phủ quy định chức năng, nhiệm vụ, quyền hạn và cơ cấu tổ chức của Bộ Giao thông vận tải;\n\nTheo đề nghị của Vụ trưởng Vụ Kết cấu hạ tầng giao thông và Cục trưởng Cục đường bộ Việt Nam;\n\nBộ trưởng Bộ Giao thông vận tải ban hành Thông tư quy định về tốc độ và khoảng cách an toàn của xe cơ giới, xe máy chuyên dùng tham gia giao thông trên đường bộ.\n\nChương I\n\nQUY ĐỊNH CHUNG\n\nĐiều 1. Phạm vi điều chỉnh\n\nThông tư này quy định về tốc độ thiết kế của đường bộ; tốc độ khai thác và khoảng cách an toàn của xe cơ giới, xe máy chuyên dùng khi tham gia giao thông trên đường bộ, trừ xe ưu tiên đang đi làm nhiệm vụ theo quy định của pháp luật.\n\nĐiều 2. Đối tượng áp dụng\n\nThông tư này áp dụng đối với người lái xe, người điều khiển xe máy chuyên dùng và tổ chức, cá nhân liên quan đến quản lý và thực hiện các quy định về tốc độ thiết kế, tốc độ khai thác của đường bộ và khoảng cách an toàn của xe cơ giới, xe máy chuyên dùng khi tham gia giao thông trên đường bộ.\n\nĐiều 3. Giải thích từ ngữ\n\nTrong Thông tư này, các từ ngữ dưới đây được hiểu như sau:\n\n1. Đường bộ trong khu đông dân cư là đoạn đường bộ nằm trong khu vực nội thành phố, nội thị xã, nội thị trấn và những đoạn đường có đông dân cư sinh sống sát dọc theo đường, được xác định bằng biển báo “Bắt đầu khu đông dân cư” và biển báo “Hết khu đông dân cư”.\n\n2. Đường đôi là đường có chiều đi và chiều về được phân biệt bằng dải phân cách giữa.\n\n3. Đường một chiều là đường chỉ cho đi một chiều.\n\n4. Đường hai chiều là đường dùng chung cho cả chiều đi và về trên cùng một phần đường xe chạy mà không có dải phân cách giữa.\n\n5. Trọng tải là khối lượng hàng hóa chuyên chở cho phép, được ghi trên Giấy chứng nhận an toàn kỹ thuật và bảo vệ môi trường của phương tiện giao thông cơ giới đường bộ, Giấy chứng \n\n\n\nnhận chất lượng an toàn kỹ thuật và bảo vệ môi trường xe cơ giới nhập khẩu hoặc Giấy chứng nhận chất lượng an toàn kỹ thuật và bảo vệ môi trường kiểu loại ô tô sản xuất, lắp ráp.\n\n6. Tốc độ khai thác tối đa là giá trị tốc độ lớn nhất cho phép phương tiện tham gia giao thông trên đường bộ bảo đảm an toàn giao thông và khai thác hiệu quả tuyến đường.\n\n7. Tốc độ khai thác tối thiểu là giá trị tốc độ nhỏ nhất cho phép phương tiện tham gia giao thông trên đường bộ bảo đảm an toàn giao thông và khai thác hiệu quả tuyến đường.\n\n8. Khoảng cách an toàn là cự ly tối thiểu giữa phương tiện phía sau với phương tiện đang di chuyển liền trước, cùng làn đường, bảo đảm tránh xảy ra va chạm trong trường hợp phương tiện phía trước đột ngột giảm tốc độ hoặc dừng lại.\n\n9. Tốc độ lưu hành là giá trị tốc độ của phương tiện tại thời điểm tham gia giao thông trên đường bộ.\n\nĐiều 4. Nguyên tắc chấp hành quy định về tốc độ khai thác và khoảng cách an toàn khi điều khiển phương tiện trên đường bộ\n\n1. Khi tham gia giao thông trên đường bộ, người lái xe, người điều khiển xe máy chuyên dùng phải chấp hành quy định về tốc độ khai thác và khoảng cách an toàn theo quy định tại Điều 12 Luật Trật tự, an toàn giao thông đường bộ.\n\n2. Tại những đoạn đường không bố trí biển báo tốc độ khai thác tối đa, không bố trí biển báo khoảng cách an toàn giữa hai xe, người điều khiển phương tiện tham gia giao thông phải thực hiện theo quy định tại Điều 6, Điều 7, Điều 8 và Điều 11 Thông tư này.\n\nChương II\n\nTỐC ĐỘ THIẾT KẾ CỦA ĐƯỜNG BỘ; TỐC ĐỘ KHAI THÁC CỦA ĐƯỜNG BỘ, KHOẢNG CÁCH AN TOÀN CỦA XE CƠ GIỚI, XE MÁY CHUYÊN DÙNG THAM GIA GIAO THÔNG TRÊN ĐƯỜNG BỘ\n\nĐiều 5. Tốc độ thiết kế của đường bộ\n\n1. Tốc độ thiết kế của đường bộ là giá trị vận tốc được dùng để tính toán các chỉ tiêu kỹ thuật của đường bộ. Tốc độ thiết kế của đường bộ được xác định trong giai đoạn đầu tư xây dựng, nâng cấp, cải tạo đường bộ nhằm bảo đảm cho phương tiện di chuyển an toàn; được quyết định theo cấp kỹ thuật của đường bộ và điều kiện địa hình.\n\n2. Tốc độ thiết kế đường bộ cao tốc là giá trị vận tốc được dùng để tính toán các chỉ tiêu kỹ thuật của đường bộ cao tốc, được xác định theo cấp đường cao tốc. Khi thiết kế đường bộ cao tốc có thể áp dụng tốc độ thiết kế khác nhau theo từng đoạn nhưng phải bảo đảm các yêu cầu về chiều dài đoạn chuyển tiếp và tốc độ thiết kế trung gian giữa các đoạn. Tốc độ thiết kế đường bộ cao tốc được xác định theo Quy chuẩn kỹ thuật quốc gia về đường bộ cao tốc QCVN 115:2024/BGTVT.\n\n3. Tốc độ thiết kế đường bộ được xác định theo Tiêu chuẩn quốc gia TCVN 4054: 2005 Đường ô tô - Yêu cầu thiết kế.\n\n4. Tốc độ thiết kế đường bộ trong phạm vi đô thị được xác định theo Quy chuẩn kỹ thuật quốc gia về hệ thống công trình hạ tầng kỹ thuật QCVN 07-4:2023/BXD.\n\n5. Tốc độ thiết kế đường giao thông nông thôn được xác định theo Tiêu chuẩn quốc gia TCVN 10380:2014 Đường giao thông nông thôn - Yêu cầu thiết kế.\n\n\n\nĐiều 6. Tốc độ khai thác tối đa cho phép xe cơ giới tham gia giao thông trên đường bộ (trừ đường cao tốc)\n\n1. Tốc độ khai thác tối đa cho phép xe cơ giới tham gia giao thông trên đường bộ trong khu vực đông dân cư\n\nBảng 1\n\nLoại xe cơ giới đường bộ Tốc độ khai thác tối đa (km/h) Tốc độ khai thác tối đa (km/h) Đường đôi; đường một chiều có từ hai làn xe cơ giới trở lên Đường hai chiều; đường một chiều có một làn xe cơ giới Các loại xe cơ giới, trừ các xe được quy định tại Điều 7 và Điều 8 Thông tư này 60 50\n\n2. Tốc độ khai thác tối đa cho phép xe cơ giới tham gia giao thông trên đường bộ ngoài khu vực đông dân cư\n\nBảng 2\n\nLoại xe cơ giới đường bộ Tốc độ khai thác tối đa (km/h) Tốc độ khai thác tối đa (km/h) Đường đôi; đường một chiều có từ hai làn xe cơ giới trở lên Đường hai chiều; đường một chiều có một làn xe cơ giới Xe ô tô chở người đến 28 chỗ không kể chỗ của người lái xe (trừ xe buýt); ô tô tải có trọng tải không lớn hơn 3,5 tấn 90 80 Xe ô tô chở người trên 28 chỗ không kể chỗ người lái xe (trừ xe buýt); ô tô tải có trọng tải trên 3,5 tấn (trừ ô tô xi téc) 80 70 Xe buýt; ô tô đầu kéo kéo sơ mi rơ moóc (trừ ô tô đầu kéo kéo sơ mi rơ moóc xi téc); xe mô tô; ô tô chuyên dùng (trừ ô tô trộn vữa, ô tô trộn bê tông lưu động) 70 60 Ô tô kéo rơ moóc; ô tô kéo xe khác; ô tô trộn vữa, ô tô trộn bê tông lưu động, ô tô xi téc, ô tô đầu kéo kéo sơ mi rơ moóc xi téc, ô tô kéo theo rơ moóc xi téc) 60 50\n\nĐiều 7. Tốc độ khai thác tối đa cho phép đối với xe máy chuyên dùng, xe gắn máy và các loại xe tương tự tham gia giao thông trên đường bộ (trừ đường cao tốc)\n\nXe máy chuyên dùng, xe gắn máy và các loại xe tương tự khi tham gia giao thông, tốc độ khai thác tối đa là 40 km/h.\n\nĐiều 8. Tốc độ khai thác tối đa cho phép đối với xe chở người bốn bánh có gắn động cơ, xe chở hàng bốn bánh có gắn động cơ tham gia giao thông trên đường bộ (trừ đường cao tốc)\n\n1. Xe chở người bốn bánh có gắn động cơ khi tham gia giao thông trong phạm vi và thời gian cho phép hoạt động, tốc độ khai thác tối đa là 30 km/h.\n\n2. Xe chở hàng bốn bánh có gắn động cơ khi tham gia giao thông trong phạm vi và thời gian cho phép hoạt động, tốc độ khai thác tối đa là 50 km/h.\n\nĐiều 9. Tốc độ khai thác tối đa, tốc độ khai thác tối thiểu cho phép đối với các loại xe cơ giới, xe máy chuyên dùng trên đường cao tốc\n\n1. Đường cao tốc phải được đặt biển báo tốc độ khai thác tối đa, tốc độ khai thác tối thiểu.\n\n2. Tốc độ khai thác tối đa cho phép trên đường cao tốc là 120 km/h.\n\n3. Tốc độ khai thác tối thiểu cho phép trên đường cao tốc là 60 km/h. Trường hợp đường cao tốc có tốc độ thiết kế 60 km/h thì tốc độ khai thác tối thiểu thực hiện theo phương án tổ chức giao thông được cấp có thẩm quyền phê duyệt.', '1. Đường cao tốc phải được đặt biển báo tốc độ khai thác tối đa, tốc độ khai thác tối thiểu.\n\n2. Tốc độ khai thác tối đa cho phép trên đường cao tốc là 120 km/h.\n\n3. Tốc độ khai thác tối thiểu cho phép trên đường cao tốc là 60 km/h. Trường hợp đường cao tốc có tốc độ thiết kế 60 km/h thì tốc độ khai thác tối thiểu thực hiện theo phương án tổ chức giao thông được cấp có thẩm quyền phê duyệt.\n\n4. Trị số tốc độ khai thác tối đa, tối thiểu cho phép trên đường cao tốc, kể cả các đường nhánh ra, vào đường cao tốc được xác định trong phương án tổ chức giao thông được cấp có thẩm quyền phê duyệt.\n\nĐiều 10. Đặt biển báo tốc độ khai thác\n\n1. Việc đặt biển báo tốc độ khai thác thực hiện theo quy định của pháp luật về báo hiệu đường bộ và phải căn cứ vào điều kiện thực tế của đoạn tuyến, tuyến đường về: kết cấu hạ tầng giao thông đường bộ, lưu lượng, loại phương tiện và thời gian trong ngày.\n\n2. Cơ quan có thẩm quyền quy định tại khoản 3 Điều này quyết định đặt biển báo hiệu các trường hợp dưới đây:\n\na) Đối với đường đôi, đặt biển báo tốc độ khai thác tối đa riêng cho từng chiều đường;\n\nb) Đặt biển báo tốc độ khai thác tối đa cho một khoảng thời gian trong ngày (biển phụ, biển điện tử);\n\nc) Đặt biển báo tốc độ khai thác tối đa riêng đối với các loại phương tiện có nguy cơ mất an toàn giao thông cao;\n\nd) Đặt biển báo tốc độ khai thác trong trường hợp quy định tại khoản 4 Điều này.\n\n3. Cơ quan có thẩm quyền quyết định đặt biển báo đối với các trường hợp quy định tại khoản 2 Điều này, bao gồm:\n\na) Cục Đường bộ Việt Nam, Cục Đường Cao tốc Việt Nam đối với đường cao tốc được Bộ Giao thông vận tải giao quản lý:\n\nb) Cục Đường bộ Việt Nam đối với đường cao tốc do doanh nghiệp được Nhà nước giao quản lý, vận hành, khai thác; hệ thống quốc lộ và đường khác thuộc phạm vi quản lý của Bộ Giao thông vận tải;\n\nc) Ủy ban nhân dân tỉnh, thành phố trực thuộc Trung ương đối với đường cao tốc, quốc lộ, đường tỉnh, đường huyện, đường xã, đường thôn, đường đô thị và đường chuyên dùng có hoạt động giao thông công cộng thuộc phạm vi quản lý.\n\n4. Cơ quan quản lý đường bộ có thẩm quyền quy định tại khoản 3 Điều này chủ trì, phối hợp với lực lượng cảnh sát giao thông trên tuyến, Ủy ban nhân cấp huyện nơi có đoạn đường cần đặt biển báo tốc độ cho phép để xem xét, quyết định tốc độ khai thác cho phép và tổ chức thực hiện đặt biển báo tốc độ trong các trường hợp sau:\n\na) Đường bộ đang khai thác nằm trong khu vực đông dân cư có điều kiện bất lợi (đường một chiều hoặc đường hai chiều có tổng bề rộng phần xe chạy nhỏ hơn 3,0m và tập trung công trình hạ tầng liên tiếp, sát mép phần xe chạy, tầm nhìn hạn chế).\n\nb) Đường bộ đang khai thác nằm ngoài khu vực đông dân cư thuộc các đoạn đường cấp IV, cấp V, cấp VI và các đoạn đường theo cấp kỹ thuật quy định tại điểm d khoản 2 Điều 10 Luật Đường bộ, có điều kiện bất lợi, tiềm ẩn nguy cơ xảy ra mất an toàn giao thông (bán kính đường cong nhỏ, đường cong liên tiếp, độ dốc dọc lớn, tầm nhìn hạn chế).\n\nĐiều 11. Khoảng cách an toàn giữa hai xe khi tham gia giao thông trên đường bộ\n\n1. Khi điều khiển phương tiện tham gia giao thông trên đường bộ, người lái xe, người điều khiển xe máy chuyên dùng phải giữ một khoảng cách an toàn đối với xe chạy liền trước cùng làn hoặc cùng phần đường, cùng chiều xe của mình; ở nơi có biển báo ""Cự ly tối thiểu giữa hai xe"" phải giữ khoảng cách không nhỏ hơn trị số ghi trên biển báo.\n\n2. Khoảng cách an toàn giữa hai xe khi tham gia giao thông trên đường\n\na) Trong điều kiện mặt đường khô ráo, không có sương mù, mặt đường không trơn trượt, địa hình bằng phẳng, đường thẳng, tầm nhìn bảo đảm, khoảng cách an toàn ứng với mỗi tốc độ được quy định như sau:\n\nBảng 3\n\nTốc độ lưu hành (V km/h) Khoảng cách an toàn (m) V = 60 35 60 < V ≤ 80 55 80 < V ≤ 100 70 100 < V ≤ 120 100\n\nKhi điều khiển xe chạy với tốc độ dưới 60 km/h, người lái xe, người điều khiển xe máy chuyên dùng phải chủ động giữ khoảng cách an toàn phù hợp với xe chạy liền trước xe của mình; khoảng cách này tùy thuộc vào mật độ phương tiện, tình hình giao thông thực tế để đảm bảo an toàn giao thông.\n\nb) Trong điều kiện trời mưa, có sương mù, mặt đường trơn trượt, đường có địa hình quanh co, đèo dốc, tầm nhìn hạn chế, người lái xe phải điều chỉnh khoảng cách an toàn lớn hơn trị số ghi trên biển báo hoặc trị số được quy định tại điểm a khoản này.\n\nChương III\n\nHIỆU LỰC THI HÀNH\n\nĐiều 12. Hiệu lực thi hành\n\n1. Thông tư này có hiệu lực kể từ ngày 01 tháng 01 năm 2025 và thay thế Thông tư số 31/2019/TT-BGTVT ngày 29 tháng 8 năm 2019 của Bộ trưởng Bộ Giao thông vận tải quy định về tốc độ và khoảng cách an toàn của xe cơ giới, xe máy chuyên dùng tham gia giao thông đường bộ, thay thế Điều 15 Thông tư số 06/2023/TT-BGTVT ngày 12 tháng 5 năm 2023 của Bộ trưởng Bộ Giao thông vận tải sửa đổi, bổ sung một số điều của các Thông tư liên quan đến quản lý, khai thác, sử dụng, bảo trì và bảo vệ đường bộ.\n\n2. Trường hợp các văn bản quy phạm được dẫn chiếu tại Thông tư này được sửa đổi, bổ sung hoặc thay thế thì áp dụng các văn bản sửa đổi, bổ sung hoặc thay thế./.\n\nNơi nhận:\n- Bộ trưởng (để b/c);\n- Các Thứ trưởng Bộ GTVT;\n- Văn phòng Chính phủ;\n- Tòa án nhân dân tối cao;\n- Viện kiểm sát nhân dân tối cao;\n- Các Bộ, cơ quan ngang Bộ, cơ quan thuộc Chính phủ;\n- UBND các tỉnh, thành phố trực thuộc Trung ương;\n- Cục Kiểm tra văn bản QPPL (Bộ Tư pháp);\n- Công báo;\n- Cổng Thông tin điện tử Chính phủ;\n- Cổng Thông tin điện tử Bộ GTVT;\n- Các cơ quan, đơn vị thuộc Bộ GTVT;\n- Lưu VT, KCHT(10). KT.BỘ TRƯỞNG\nTHỨ TRƯỞNG\n\n\n\n\nNguyễn Duy Lâm', '2.3.2.2. Đối với hầm dài từ 1.000,0 m trở lên khi không bố trí làn dừng xe khẩn cấp phải bố trí vị trí dừng xe khẩn cấp có chiều dài tối thiểu 30,0 m cách nhau tối đa 500,0 m, bề rộng vị trí dừng xe khẩn cấp theo cấp tốc độ thiết kế của đường bộ cao tốc.\n\n2.4. Bố trí hệ thống đường gom, đường bên để bảo đảm việc đi lại cho người dân khu vực bị ảnh hưởng, chia cắt bởi đường bộ cao tốc.\n\n2.5. Các yếu tố hình học đường bộ cao tốc\n\n2.5.1. Các yếu tố hình học của đường bộ cao tốc phải đáp ứng các yêu cầu được quy định tại Bảng 1 sau đây.\n\nBảng 1 - Các trị số giới hạn thiết kế bình đồ và mặt cắt dọc\n\nSTT Tên chỉ tiêu Đơn vị Cấp tốc độ thiết kế (km/h) Cấp tốc độ thiết kế (km/h) Cấp tốc độ thiết kế (km/h) 1 Tốc độ thiết kế Vtk km/h 120 100 80 2 Độ dốc siêu cao (hay độ nghiêng một mái) lớn nhất isc không lớn hơn % 8 8 8 3 Bán kính tối thiểu Rmin tương ứng với isc = +8% m 650 450 240 (140) 4 Bán kính tương ứng với isc = +2% m 3000 2000 1300 (700) 5 Bán kính tối thiểu không cần cấu tạo siêu cao isc = -2% m 5500 4000 2500 (1500) 6 Chiều dài tối thiểu đường cong chuyển tiếp ứng với Rmin m 210 210 170 (150) 7 Tầm nhìn dừng xe tối thiểu m 210 160 110 (75) 8 Độ dốc dọc lên dốc lớn nhất % 4 5 6 9 Độ dốc dọc xuống dốc lớn nhất % 5,5 6 6 10 Bán kính đường cong đứng lồi tối thiểu giới hạn m 12000 6000 3000 (1500) 11 Bán kính đường cong đứng lồi tối thiểu thông thường m 17000 10000 4500 (2000) 12 Bán kính đường cong đứng lõm tối thiểu giới hạn m 4000 3000 2000 (1000) 13 Bán kính đường cong đứng lõm tối thiểu thông thường m 6000 4500 3000 (1500) 14 Chiều dài đường cong đứng tối thiểu giới hạn m 100 85 70(50) 15 Chiều dài đường cong đứng tối thiểu thông thường m 250 210 170 (120) 1. Trị số trong ngoặc tương ứng với tốc độ thiết kế 60 km/h. 2. Chiều dài đường cong chuyển tiếp phải được tính toán để bảo đảm an toàn, êm thuận. Không phải bố trí đường cong chuyển tiếp tại các đường cong không cần cấu tạo siêu cao. 1. Trị số trong ngoặc tương ứng với tốc độ thiết kế 60 km/h. 2. Chiều dài đường cong chuyển tiếp phải được tính toán để bảo đảm an toàn, êm thuận. Không phải bố trí đường cong chuyển tiếp tại các đường cong không cần cấu tạo siêu cao. 1. Trị số trong ngoặc tương ứng với tốc độ thiết kế 60 km/h. 2. Chiều dài đường cong chuyển tiếp phải được tính toán để bảo đảm an toàn, êm thuận. Không phải bố trí đường cong chuyển tiếp tại các đường cong không cần cấu tạo siêu cao. 1. Trị số trong ngoặc tương ứng với tốc độ thiết kế 60 km/h. 2. Chiều dài đường cong chuyển tiếp phải được tính toán để bảo đảm an toàn, êm thuận. Không phải bố trí đường cong chuyển tiếp tại các đường cong không cần cấu tạo siêu cao. 1. Trị số trong ngoặc tương ứng với tốc độ thiết kế 60 km/h. 2. Chiều dài đường cong chuyển tiếp phải được tính toán để bảo đảm an toàn, êm thuận. Không phải bố trí đường cong chuyển tiếp tại các đường cong không cần cấu tạo siêu cao. 1. Trị số trong ngoặc tương ứng với tốc độ thiết kế 60 km/h. 2. Chiều dài đường cong chuyển tiếp phải được tính toán để bảo đảm an toàn, êm thuận. Không phải bố trí đường cong chuyển tiếp tại các đường cong không cần cấu tạo siêu cao.\n\n2.5.2. Phải bảo đảm tầm nhìn cho các xe trên đường bộ cao tốc.\n\n2.5.3. Quy định về dốc dọc.\n\n2.5.3.1. Độ dốc dọc lớn nhất được quy định tại Bảng 1 tùy thuộc cấp thiết kế của đường bộ cao tốc.\n\n2.5.3.2. Trên các đoạn nền đào phải thiết kế độ dốc dọc tối thiểu bằng 0,50 %.\n\n2.5.3.3. Trên các đoạn chuyển tiếp có độ dốc ngang mặt đường dưới 1,00 % phải thiết kế dốc dọc tối thiểu là 0,50 %.\n\n2.5.3.4. Trong hầm, độ dốc dọc tối thiểu là 0,30 %.\n\n2.5.4. Phải bố trí đường cong đứng dạng tròn hoặc parabol tại các vị trí đổi dốc.\n\n2.6. Nút giao khác mức, đường nhánh ra, vào trên đường bộ cao tốc\n\n2.6.1. Phải bố trí nút giao khác mức tại các vị trí đường bộ cao tốc giao với các loại đường khác.\n\n2.6.2. Trường hợp đường bộ cao tốc vượt trên các đường khác phải bảo đảm tĩnh không tương ứng với cấp kỹ thuật quy hoạch của đường bên dưới.\n\n2.6.3. Khoảng cách tối thiểu giữa nút giao khác mức liên thông và vị trí ra, vào trên đường bộ cao tốc là 4,0 km. Khoảng cách giữa các vị trí nút giao khác mức liên thông trên đường bộ cao tốc tối thiểu 10,0 km, ở gần các thành phố lớn, khu đô thị lớn và khu chức năng khoảng cách tối thiểu 5,0 km. Trường hợp có các yêu cầu về an ninh quốc phòng hoặc phục vụ mục đích đặc biệt nhằm phát triển kinh tế xã hội của địa phương, khoảng cách tối thiểu giữa các nút giao khác mức liên thông được phép giảm xuống nhưng không nhỏ hơn 3,0 km.\n\n2.6.4. Các thông số kỹ thuật áp dụng cho phạm vi nút giao khác mức liên thông và các nhánh ra, vào đường bộ cao tốc.\n\n2.6.4.1. Tốc độ thiết kế trên các đường nhánh thuộc phạm vi nút giao khác mức liên thông được quy định tại Bảng 2 sau đây.\n\nBảng 2 - Tốc độ thiết kế trên các đường nhánh thuộc phạm vi nút giao khác mức liên thông\n\nĐặc điểm nút giao khác mức liên thông Cấp tốc độ thiết kế (km/h) Cấp tốc độ thiết kế (km/h) Cấp tốc độ thiết kế (km/h) 120 100 80 Liên thông giữa đường bộ cao tốc với đường bộ cao tốc và đường cấp I, cấp II 80 ÷ 50 70 ÷ 40 60 ÷ 35 (50 ÷ 35) Liên thông giữa đường bộ cao tốc với đường khác 60 ÷ 35 50 ÷ 35 40 ÷ 30 (35 ÷ 30) Trị số trong ngoặc tương ứng với tốc độ thiết kế là 60 km/h. Trị số trong ngoặc tương ứng với tốc độ thiết kế là 60 km/h. Trị số trong ngoặc tương ứng với tốc độ thiết kế là 60 km/h. Trị số trong ngoặc tương ứng với tốc độ thiết kế là 60 km/h.\n\n2.6.4.2. Các yếu tố hình học của đường nhánh (bán kính đường cong bằng, đường cong chuyển tiếp, siêu cao, độ mở rộng, độ dốc dọc, đường cong đứng, tầm nhìn xe) phải bảo đảm yêu cầu kỹ thuật tương ứng với tốc độ thiết kế.\n\n2.6.5. Phải bố trí làn tăng, giảm tốc tại các nhánh vào, ra đường bộ cao tốc.\n\n2.7. Nền, mặt đường của đường bộ cao tốc\n\n2.7.1. Nền đường\n\n2.7.1.1. Nền đường phải bảo đảm ổn định, duy trì được các kích thước hình học, có đủ cường độ để chịu được các tác động của tải trọng xe và các yếu tố thiên nhiên trong suốt thời gian sử dụng.\n\n2.7.1.2. Nền đường phải tính toán, thiết kế xây dựng dựa trên các số liệu khảo sát địa hình, địa chất, thủy văn.\n\n2.7.2. Mặt đường phải được thiết kế, xây dựng bảo đảm các yêu cầu về cường độ, tính bền vững, độ nhám, độ bằng phẳng và khả năng thoát nước.\n\n2.8. An toàn phòng hộ trên đường bộ cao tốc\n\n2.8.1. Bố trí phòng hộ\n\n2.8.1.1. Phải bố trí đồng bộ hệ thống phòng hộ bảo đảm an toàn giao thông trên đường bộ cao tốc.\n\n2.8.1.2. Phải bố trí hàng rào bảo vệ để ngăn cách người, gia súc hoặc thú rừng qua đường.\n\n2.8.2. Hệ thống báo hiệu trên đường bộ cao tốc được bố trí tuân thủ quy chuẩn kỹ thuật quốc gia về báo hiệu đường bộ.\n\n2.8.3. Phải bố trí hệ thống vạch sơn dẫn hướng và kết hợp với việc bố trí lan can phòng hộ hoặc cọc tiêu để bảo đảm an toàn khai thác.\n\n2.8.4. Chống chói\n\n2.8.4.1. Phải có biện pháp chống chói do đèn pha của xe chạy ngược chiều về ban đêm.\n\n2.8.4.2. Phải kiểm tra việc bảo đảm tầm nhìn ở các đoạn đường cong khi có bố trí các giải pháp chống chói.\n\n2.8.4.3. Đoạn đường bộ cao tốc có dải giữa rộng từ 12,0 m trở lên không cần có biện pháp chống chói.\n\n2.8.5. Bố trí chiếu sáng trên đường bộ cao tốc tại các khu vực sau:\n\n2.8.5.1. Trạm thu phí.\n\n2.8.5.2. Trong hầm.\n\n2.8.5.3. Phạm vi các vị trí giao nhau liên thông trên đường bộ cao tốc.\n\n2.8.6. Phải bố trí tường chống ồn ở gần khu vực đông dân cư.\n\n2.9. Tốc độ tối đa cho phép khai thác trên đường bộ cao tốc không vượt quá 120 km/h. Tốc độ tối đa cho phép và tốc độ thiết kế không được chênh nhau quá 20 km/h; tốc độ tối đa cho phép của 02 đoạn tuyến liên tiếp không được chênh nhau quá 20 km/h.\n\n3. TỔ CHỨC THỰC HIỆN\n\n3.1. Cục Đường cao tốc Việt Nam chịu trách nhiệm tổ chức triển khai Quy chuẩn này.\n\n3.2. Trường hợp các văn bản quy phạm pháp luật được viện dẫn trong Quy chuẩn này có sự thay đổi, bổ sung hoặc được thay thế thì áp dụng theo văn bản sửa đổi, bổ sung, thay thế./.']","**Nguồn văn bản:** /content/drive/MyDrive/ITProject_data/new_law/38_2024_TT-BGTVT_622477.docx

**Tên văn bản:** THÔNG TƯ QUY ĐỊNH VỀ TỐC ĐỘ VÀ KHOẢNG CÁCH AN TOÀN CỦA XE CƠ GIỚI, XE MÁY CHUYÊN DÙNG THAM GIA GIAO THÔNG TRÊN ĐƯỜNG BỘ

**Nội dung:**

Điều 6. Tốc độ khai thác tối đa cho phép xe cơ giới tham gia giao thông trên đường bộ (trừ đường cao tốc):

1. Tốc độ khai thác tối đa cho phép xe cơ giới tham gia giao thông trên đường bộ trong khu vực đông dân cư:

    Bảng 1:

    Loại xe cơ giới đường bộ | Tốc độ khai thác tối đa (km/h) | Tốc độ khai thác tối đa (km/h)
    ---|---|---
    Đường đôi; đường một chiều có từ hai làn xe cơ giới trở lên | Đường hai chiều; đường một chiều có một làn xe cơ giới | Các loại xe cơ giới, trừ các xe được quy định tại Điều 7 và Điều 8 Thông tư này | 60 | 50


2. Tốc độ khai thác tối đa cho phép xe cơ giới tham gia giao thông trên đường bộ ngoài khu vực đông dân cư:

    Bảng 2:

    Loại xe cơ giới đường bộ | Tốc độ khai thác tối đa (km/h) | Tốc độ khai thác tối đa (km/h)
    ---|---|---
    Đường đôi; đường một chiều có từ hai làn xe cơ giới trở lên | Đường hai chiều; đường một chiều có một làn xe cơ giới | Xe ô tô chở người đến 28 chỗ không kể chỗ của người lái xe (trừ xe buýt); ô tô tải có trọng tải không lớn hơn 3,5 tấn | 90 | 80
    |  | Xe ô tô chở người trên 28 chỗ không kể chỗ người lái xe (trừ xe buýt); ô tô tải có trọng tải trên 3,5 tấn (trừ ô tô xi téc) | 80 | 70
    |  | Xe buýt; ô tô đầu kéo kéo sơ mi rơ moóc (trừ ô tô đầu kéo kéo sơ mi rơ moóc xi téc); xe mô tô; ô tô chuyên dùng (trừ ô tô trộn vữa, ô tô trộn bê tông lưu động) | 70 | 60
    |  | Ô tô kéo rơ moóc; ô tô kéo xe khác; ô tô trộn vữa, ô tô trộn bê tông lưu động, ô tô xi téc, ô tô đầu kéo kéo sơ mi rơ moóc xi téc, ô tô kéo theo rơ moóc xi téc | 60 | 50


Tóm lại: Quy định về tốc độ tối đa trong khu vực đô thị là 60km/h đối với đường đôi hoặc đường một chiều có từ hai làn xe trở lên, và 50km/h đối với đường hai chiều hoặc đường một chiều có một làn xe.  Đây là tốc độ khai thác tối đa cho phép đối với các loại xe cơ giới (trừ các loại xe quy định riêng tại Điều 7 và 8 của Thông tư).
",Tốc độ tối đa trong khu vực đô thị được giảm từ 50 km/h xuống 40 km/h.,1.0,0.6469613465036622,0.0,0.0
15,Quy định mới về tốc độ tối đa ngoài khu vực đô thị là gì?,"['BỘ GIAO THÔNG VẬN TẢI\n-------- CỘNG HÒA XÃ HỘI CHỦ NGHĨA VIỆT NAM\nĐộc lập - Tự do - Hạnh phúc \n--------------- Số: 38/2024/TT-BGTVT Hà Nội, Ngày 15 tháng 11 năm 2024\n\nTHÔNG TƯ\n\nQUY ĐỊNH VỀ TỐC ĐỘ VÀ KHOẢNG CÁCH AN TOÀN CỦA XE CƠ GIỚI, XE MÁY CHUYÊN DÙNG THAM GIA GIAO THÔNG TRÊN ĐƯỜNG BỘ\n\nCăn cứ Luật Trật tự, an toàn giao thông đường bộ ngày 27 tháng 6 năm 2024;\n\nCăn cứ Luật Đường bộ ngày 27 tháng 6 năm 2024;\n\nCăn cứ Nghị định số 56/2022/NĐ-CP ngày 24 tháng 8 năm 2022 của Chính phủ quy định chức năng, nhiệm vụ, quyền hạn và cơ cấu tổ chức của Bộ Giao thông vận tải;\n\nTheo đề nghị của Vụ trưởng Vụ Kết cấu hạ tầng giao thông và Cục trưởng Cục đường bộ Việt Nam;\n\nBộ trưởng Bộ Giao thông vận tải ban hành Thông tư quy định về tốc độ và khoảng cách an toàn của xe cơ giới, xe máy chuyên dùng tham gia giao thông trên đường bộ.\n\nChương I\n\nQUY ĐỊNH CHUNG\n\nĐiều 1. Phạm vi điều chỉnh\n\nThông tư này quy định về tốc độ thiết kế của đường bộ; tốc độ khai thác và khoảng cách an toàn của xe cơ giới, xe máy chuyên dùng khi tham gia giao thông trên đường bộ, trừ xe ưu tiên đang đi làm nhiệm vụ theo quy định của pháp luật.\n\nĐiều 2. Đối tượng áp dụng\n\nThông tư này áp dụng đối với người lái xe, người điều khiển xe máy chuyên dùng và tổ chức, cá nhân liên quan đến quản lý và thực hiện các quy định về tốc độ thiết kế, tốc độ khai thác của đường bộ và khoảng cách an toàn của xe cơ giới, xe máy chuyên dùng khi tham gia giao thông trên đường bộ.\n\nĐiều 3. Giải thích từ ngữ\n\nTrong Thông tư này, các từ ngữ dưới đây được hiểu như sau:\n\n1. Đường bộ trong khu đông dân cư là đoạn đường bộ nằm trong khu vực nội thành phố, nội thị xã, nội thị trấn và những đoạn đường có đông dân cư sinh sống sát dọc theo đường, được xác định bằng biển báo “Bắt đầu khu đông dân cư” và biển báo “Hết khu đông dân cư”.\n\n2. Đường đôi là đường có chiều đi và chiều về được phân biệt bằng dải phân cách giữa.\n\n3. Đường một chiều là đường chỉ cho đi một chiều.\n\n4. Đường hai chiều là đường dùng chung cho cả chiều đi và về trên cùng một phần đường xe chạy mà không có dải phân cách giữa.\n\n5. Trọng tải là khối lượng hàng hóa chuyên chở cho phép, được ghi trên Giấy chứng nhận an toàn kỹ thuật và bảo vệ môi trường của phương tiện giao thông cơ giới đường bộ, Giấy chứng \n\n\n\nnhận chất lượng an toàn kỹ thuật và bảo vệ môi trường xe cơ giới nhập khẩu hoặc Giấy chứng nhận chất lượng an toàn kỹ thuật và bảo vệ môi trường kiểu loại ô tô sản xuất, lắp ráp.\n\n6. Tốc độ khai thác tối đa là giá trị tốc độ lớn nhất cho phép phương tiện tham gia giao thông trên đường bộ bảo đảm an toàn giao thông và khai thác hiệu quả tuyến đường.\n\n7. Tốc độ khai thác tối thiểu là giá trị tốc độ nhỏ nhất cho phép phương tiện tham gia giao thông trên đường bộ bảo đảm an toàn giao thông và khai thác hiệu quả tuyến đường.\n\n8. Khoảng cách an toàn là cự ly tối thiểu giữa phương tiện phía sau với phương tiện đang di chuyển liền trước, cùng làn đường, bảo đảm tránh xảy ra va chạm trong trường hợp phương tiện phía trước đột ngột giảm tốc độ hoặc dừng lại.\n\n9. Tốc độ lưu hành là giá trị tốc độ của phương tiện tại thời điểm tham gia giao thông trên đường bộ.\n\nĐiều 4. Nguyên tắc chấp hành quy định về tốc độ khai thác và khoảng cách an toàn khi điều khiển phương tiện trên đường bộ\n\n1. Khi tham gia giao thông trên đường bộ, người lái xe, người điều khiển xe máy chuyên dùng phải chấp hành quy định về tốc độ khai thác và khoảng cách an toàn theo quy định tại Điều 12 Luật Trật tự, an toàn giao thông đường bộ.\n\n2. Tại những đoạn đường không bố trí biển báo tốc độ khai thác tối đa, không bố trí biển báo khoảng cách an toàn giữa hai xe, người điều khiển phương tiện tham gia giao thông phải thực hiện theo quy định tại Điều 6, Điều 7, Điều 8 và Điều 11 Thông tư này.\n\nChương II\n\nTỐC ĐỘ THIẾT KẾ CỦA ĐƯỜNG BỘ; TỐC ĐỘ KHAI THÁC CỦA ĐƯỜNG BỘ, KHOẢNG CÁCH AN TOÀN CỦA XE CƠ GIỚI, XE MÁY CHUYÊN DÙNG THAM GIA GIAO THÔNG TRÊN ĐƯỜNG BỘ\n\nĐiều 5. Tốc độ thiết kế của đường bộ\n\n1. Tốc độ thiết kế của đường bộ là giá trị vận tốc được dùng để tính toán các chỉ tiêu kỹ thuật của đường bộ. Tốc độ thiết kế của đường bộ được xác định trong giai đoạn đầu tư xây dựng, nâng cấp, cải tạo đường bộ nhằm bảo đảm cho phương tiện di chuyển an toàn; được quyết định theo cấp kỹ thuật của đường bộ và điều kiện địa hình.\n\n2. Tốc độ thiết kế đường bộ cao tốc là giá trị vận tốc được dùng để tính toán các chỉ tiêu kỹ thuật của đường bộ cao tốc, được xác định theo cấp đường cao tốc. Khi thiết kế đường bộ cao tốc có thể áp dụng tốc độ thiết kế khác nhau theo từng đoạn nhưng phải bảo đảm các yêu cầu về chiều dài đoạn chuyển tiếp và tốc độ thiết kế trung gian giữa các đoạn. Tốc độ thiết kế đường bộ cao tốc được xác định theo Quy chuẩn kỹ thuật quốc gia về đường bộ cao tốc QCVN 115:2024/BGTVT.\n\n3. Tốc độ thiết kế đường bộ được xác định theo Tiêu chuẩn quốc gia TCVN 4054: 2005 Đường ô tô - Yêu cầu thiết kế.\n\n4. Tốc độ thiết kế đường bộ trong phạm vi đô thị được xác định theo Quy chuẩn kỹ thuật quốc gia về hệ thống công trình hạ tầng kỹ thuật QCVN 07-4:2023/BXD.\n\n5. Tốc độ thiết kế đường giao thông nông thôn được xác định theo Tiêu chuẩn quốc gia TCVN 10380:2014 Đường giao thông nông thôn - Yêu cầu thiết kế.\n\n\n\nĐiều 6. Tốc độ khai thác tối đa cho phép xe cơ giới tham gia giao thông trên đường bộ (trừ đường cao tốc)\n\n1. Tốc độ khai thác tối đa cho phép xe cơ giới tham gia giao thông trên đường bộ trong khu vực đông dân cư\n\nBảng 1\n\nLoại xe cơ giới đường bộ Tốc độ khai thác tối đa (km/h) Tốc độ khai thác tối đa (km/h) Đường đôi; đường một chiều có từ hai làn xe cơ giới trở lên Đường hai chiều; đường một chiều có một làn xe cơ giới Các loại xe cơ giới, trừ các xe được quy định tại Điều 7 và Điều 8 Thông tư này 60 50\n\n2. Tốc độ khai thác tối đa cho phép xe cơ giới tham gia giao thông trên đường bộ ngoài khu vực đông dân cư\n\nBảng 2\n\nLoại xe cơ giới đường bộ Tốc độ khai thác tối đa (km/h) Tốc độ khai thác tối đa (km/h) Đường đôi; đường một chiều có từ hai làn xe cơ giới trở lên Đường hai chiều; đường một chiều có một làn xe cơ giới Xe ô tô chở người đến 28 chỗ không kể chỗ của người lái xe (trừ xe buýt); ô tô tải có trọng tải không lớn hơn 3,5 tấn 90 80 Xe ô tô chở người trên 28 chỗ không kể chỗ người lái xe (trừ xe buýt); ô tô tải có trọng tải trên 3,5 tấn (trừ ô tô xi téc) 80 70 Xe buýt; ô tô đầu kéo kéo sơ mi rơ moóc (trừ ô tô đầu kéo kéo sơ mi rơ moóc xi téc); xe mô tô; ô tô chuyên dùng (trừ ô tô trộn vữa, ô tô trộn bê tông lưu động) 70 60 Ô tô kéo rơ moóc; ô tô kéo xe khác; ô tô trộn vữa, ô tô trộn bê tông lưu động, ô tô xi téc, ô tô đầu kéo kéo sơ mi rơ moóc xi téc, ô tô kéo theo rơ moóc xi téc) 60 50\n\nĐiều 7. Tốc độ khai thác tối đa cho phép đối với xe máy chuyên dùng, xe gắn máy và các loại xe tương tự tham gia giao thông trên đường bộ (trừ đường cao tốc)\n\nXe máy chuyên dùng, xe gắn máy và các loại xe tương tự khi tham gia giao thông, tốc độ khai thác tối đa là 40 km/h.\n\nĐiều 8. Tốc độ khai thác tối đa cho phép đối với xe chở người bốn bánh có gắn động cơ, xe chở hàng bốn bánh có gắn động cơ tham gia giao thông trên đường bộ (trừ đường cao tốc)\n\n1. Xe chở người bốn bánh có gắn động cơ khi tham gia giao thông trong phạm vi và thời gian cho phép hoạt động, tốc độ khai thác tối đa là 30 km/h.\n\n2. Xe chở hàng bốn bánh có gắn động cơ khi tham gia giao thông trong phạm vi và thời gian cho phép hoạt động, tốc độ khai thác tối đa là 50 km/h.\n\nĐiều 9. Tốc độ khai thác tối đa, tốc độ khai thác tối thiểu cho phép đối với các loại xe cơ giới, xe máy chuyên dùng trên đường cao tốc\n\n1. Đường cao tốc phải được đặt biển báo tốc độ khai thác tối đa, tốc độ khai thác tối thiểu.\n\n2. Tốc độ khai thác tối đa cho phép trên đường cao tốc là 120 km/h.\n\n3. Tốc độ khai thác tối thiểu cho phép trên đường cao tốc là 60 km/h. Trường hợp đường cao tốc có tốc độ thiết kế 60 km/h thì tốc độ khai thác tối thiểu thực hiện theo phương án tổ chức giao thông được cấp có thẩm quyền phê duyệt.', '1. Đường cao tốc phải được đặt biển báo tốc độ khai thác tối đa, tốc độ khai thác tối thiểu.\n\n2. Tốc độ khai thác tối đa cho phép trên đường cao tốc là 120 km/h.\n\n3. Tốc độ khai thác tối thiểu cho phép trên đường cao tốc là 60 km/h. Trường hợp đường cao tốc có tốc độ thiết kế 60 km/h thì tốc độ khai thác tối thiểu thực hiện theo phương án tổ chức giao thông được cấp có thẩm quyền phê duyệt.\n\n4. Trị số tốc độ khai thác tối đa, tối thiểu cho phép trên đường cao tốc, kể cả các đường nhánh ra, vào đường cao tốc được xác định trong phương án tổ chức giao thông được cấp có thẩm quyền phê duyệt.\n\nĐiều 10. Đặt biển báo tốc độ khai thác\n\n1. Việc đặt biển báo tốc độ khai thác thực hiện theo quy định của pháp luật về báo hiệu đường bộ và phải căn cứ vào điều kiện thực tế của đoạn tuyến, tuyến đường về: kết cấu hạ tầng giao thông đường bộ, lưu lượng, loại phương tiện và thời gian trong ngày.\n\n2. Cơ quan có thẩm quyền quy định tại khoản 3 Điều này quyết định đặt biển báo hiệu các trường hợp dưới đây:\n\na) Đối với đường đôi, đặt biển báo tốc độ khai thác tối đa riêng cho từng chiều đường;\n\nb) Đặt biển báo tốc độ khai thác tối đa cho một khoảng thời gian trong ngày (biển phụ, biển điện tử);\n\nc) Đặt biển báo tốc độ khai thác tối đa riêng đối với các loại phương tiện có nguy cơ mất an toàn giao thông cao;\n\nd) Đặt biển báo tốc độ khai thác trong trường hợp quy định tại khoản 4 Điều này.\n\n3. Cơ quan có thẩm quyền quyết định đặt biển báo đối với các trường hợp quy định tại khoản 2 Điều này, bao gồm:\n\na) Cục Đường bộ Việt Nam, Cục Đường Cao tốc Việt Nam đối với đường cao tốc được Bộ Giao thông vận tải giao quản lý:\n\nb) Cục Đường bộ Việt Nam đối với đường cao tốc do doanh nghiệp được Nhà nước giao quản lý, vận hành, khai thác; hệ thống quốc lộ và đường khác thuộc phạm vi quản lý của Bộ Giao thông vận tải;\n\nc) Ủy ban nhân dân tỉnh, thành phố trực thuộc Trung ương đối với đường cao tốc, quốc lộ, đường tỉnh, đường huyện, đường xã, đường thôn, đường đô thị và đường chuyên dùng có hoạt động giao thông công cộng thuộc phạm vi quản lý.\n\n4. Cơ quan quản lý đường bộ có thẩm quyền quy định tại khoản 3 Điều này chủ trì, phối hợp với lực lượng cảnh sát giao thông trên tuyến, Ủy ban nhân cấp huyện nơi có đoạn đường cần đặt biển báo tốc độ cho phép để xem xét, quyết định tốc độ khai thác cho phép và tổ chức thực hiện đặt biển báo tốc độ trong các trường hợp sau:\n\na) Đường bộ đang khai thác nằm trong khu vực đông dân cư có điều kiện bất lợi (đường một chiều hoặc đường hai chiều có tổng bề rộng phần xe chạy nhỏ hơn 3,0m và tập trung công trình hạ tầng liên tiếp, sát mép phần xe chạy, tầm nhìn hạn chế).\n\nb) Đường bộ đang khai thác nằm ngoài khu vực đông dân cư thuộc các đoạn đường cấp IV, cấp V, cấp VI và các đoạn đường theo cấp kỹ thuật quy định tại điểm d khoản 2 Điều 10 Luật Đường bộ, có điều kiện bất lợi, tiềm ẩn nguy cơ xảy ra mất an toàn giao thông (bán kính đường cong nhỏ, đường cong liên tiếp, độ dốc dọc lớn, tầm nhìn hạn chế).\n\nĐiều 11. Khoảng cách an toàn giữa hai xe khi tham gia giao thông trên đường bộ\n\n1. Khi điều khiển phương tiện tham gia giao thông trên đường bộ, người lái xe, người điều khiển xe máy chuyên dùng phải giữ một khoảng cách an toàn đối với xe chạy liền trước cùng làn hoặc cùng phần đường, cùng chiều xe của mình; ở nơi có biển báo ""Cự ly tối thiểu giữa hai xe"" phải giữ khoảng cách không nhỏ hơn trị số ghi trên biển báo.\n\n2. Khoảng cách an toàn giữa hai xe khi tham gia giao thông trên đường\n\na) Trong điều kiện mặt đường khô ráo, không có sương mù, mặt đường không trơn trượt, địa hình bằng phẳng, đường thẳng, tầm nhìn bảo đảm, khoảng cách an toàn ứng với mỗi tốc độ được quy định như sau:\n\nBảng 3\n\nTốc độ lưu hành (V km/h) Khoảng cách an toàn (m) V = 60 35 60 < V ≤ 80 55 80 < V ≤ 100 70 100 < V ≤ 120 100\n\nKhi điều khiển xe chạy với tốc độ dưới 60 km/h, người lái xe, người điều khiển xe máy chuyên dùng phải chủ động giữ khoảng cách an toàn phù hợp với xe chạy liền trước xe của mình; khoảng cách này tùy thuộc vào mật độ phương tiện, tình hình giao thông thực tế để đảm bảo an toàn giao thông.\n\nb) Trong điều kiện trời mưa, có sương mù, mặt đường trơn trượt, đường có địa hình quanh co, đèo dốc, tầm nhìn hạn chế, người lái xe phải điều chỉnh khoảng cách an toàn lớn hơn trị số ghi trên biển báo hoặc trị số được quy định tại điểm a khoản này.\n\nChương III\n\nHIỆU LỰC THI HÀNH\n\nĐiều 12. Hiệu lực thi hành\n\n1. Thông tư này có hiệu lực kể từ ngày 01 tháng 01 năm 2025 và thay thế Thông tư số 31/2019/TT-BGTVT ngày 29 tháng 8 năm 2019 của Bộ trưởng Bộ Giao thông vận tải quy định về tốc độ và khoảng cách an toàn của xe cơ giới, xe máy chuyên dùng tham gia giao thông đường bộ, thay thế Điều 15 Thông tư số 06/2023/TT-BGTVT ngày 12 tháng 5 năm 2023 của Bộ trưởng Bộ Giao thông vận tải sửa đổi, bổ sung một số điều của các Thông tư liên quan đến quản lý, khai thác, sử dụng, bảo trì và bảo vệ đường bộ.\n\n2. Trường hợp các văn bản quy phạm được dẫn chiếu tại Thông tư này được sửa đổi, bổ sung hoặc thay thế thì áp dụng các văn bản sửa đổi, bổ sung hoặc thay thế./.\n\nNơi nhận:\n- Bộ trưởng (để b/c);\n- Các Thứ trưởng Bộ GTVT;\n- Văn phòng Chính phủ;\n- Tòa án nhân dân tối cao;\n- Viện kiểm sát nhân dân tối cao;\n- Các Bộ, cơ quan ngang Bộ, cơ quan thuộc Chính phủ;\n- UBND các tỉnh, thành phố trực thuộc Trung ương;\n- Cục Kiểm tra văn bản QPPL (Bộ Tư pháp);\n- Công báo;\n- Cổng Thông tin điện tử Chính phủ;\n- Cổng Thông tin điện tử Bộ GTVT;\n- Các cơ quan, đơn vị thuộc Bộ GTVT;\n- Lưu VT, KCHT(10). KT.BỘ TRƯỞNG\nTHỨ TRƯỞNG\n\n\n\n\nNguyễn Duy Lâm', '2.3.2.2. Đối với hầm dài từ 1.000,0 m trở lên khi không bố trí làn dừng xe khẩn cấp phải bố trí vị trí dừng xe khẩn cấp có chiều dài tối thiểu 30,0 m cách nhau tối đa 500,0 m, bề rộng vị trí dừng xe khẩn cấp theo cấp tốc độ thiết kế của đường bộ cao tốc.\n\n2.4. Bố trí hệ thống đường gom, đường bên để bảo đảm việc đi lại cho người dân khu vực bị ảnh hưởng, chia cắt bởi đường bộ cao tốc.\n\n2.5. Các yếu tố hình học đường bộ cao tốc\n\n2.5.1. Các yếu tố hình học của đường bộ cao tốc phải đáp ứng các yêu cầu được quy định tại Bảng 1 sau đây.\n\nBảng 1 - Các trị số giới hạn thiết kế bình đồ và mặt cắt dọc\n\nSTT Tên chỉ tiêu Đơn vị Cấp tốc độ thiết kế (km/h) Cấp tốc độ thiết kế (km/h) Cấp tốc độ thiết kế (km/h) 1 Tốc độ thiết kế Vtk km/h 120 100 80 2 Độ dốc siêu cao (hay độ nghiêng một mái) lớn nhất isc không lớn hơn % 8 8 8 3 Bán kính tối thiểu Rmin tương ứng với isc = +8% m 650 450 240 (140) 4 Bán kính tương ứng với isc = +2% m 3000 2000 1300 (700) 5 Bán kính tối thiểu không cần cấu tạo siêu cao isc = -2% m 5500 4000 2500 (1500) 6 Chiều dài tối thiểu đường cong chuyển tiếp ứng với Rmin m 210 210 170 (150) 7 Tầm nhìn dừng xe tối thiểu m 210 160 110 (75) 8 Độ dốc dọc lên dốc lớn nhất % 4 5 6 9 Độ dốc dọc xuống dốc lớn nhất % 5,5 6 6 10 Bán kính đường cong đứng lồi tối thiểu giới hạn m 12000 6000 3000 (1500) 11 Bán kính đường cong đứng lồi tối thiểu thông thường m 17000 10000 4500 (2000) 12 Bán kính đường cong đứng lõm tối thiểu giới hạn m 4000 3000 2000 (1000) 13 Bán kính đường cong đứng lõm tối thiểu thông thường m 6000 4500 3000 (1500) 14 Chiều dài đường cong đứng tối thiểu giới hạn m 100 85 70(50) 15 Chiều dài đường cong đứng tối thiểu thông thường m 250 210 170 (120) 1. Trị số trong ngoặc tương ứng với tốc độ thiết kế 60 km/h. 2. Chiều dài đường cong chuyển tiếp phải được tính toán để bảo đảm an toàn, êm thuận. Không phải bố trí đường cong chuyển tiếp tại các đường cong không cần cấu tạo siêu cao. 1. Trị số trong ngoặc tương ứng với tốc độ thiết kế 60 km/h. 2. Chiều dài đường cong chuyển tiếp phải được tính toán để bảo đảm an toàn, êm thuận. Không phải bố trí đường cong chuyển tiếp tại các đường cong không cần cấu tạo siêu cao. 1. Trị số trong ngoặc tương ứng với tốc độ thiết kế 60 km/h. 2. Chiều dài đường cong chuyển tiếp phải được tính toán để bảo đảm an toàn, êm thuận. Không phải bố trí đường cong chuyển tiếp tại các đường cong không cần cấu tạo siêu cao. 1. Trị số trong ngoặc tương ứng với tốc độ thiết kế 60 km/h. 2. Chiều dài đường cong chuyển tiếp phải được tính toán để bảo đảm an toàn, êm thuận. Không phải bố trí đường cong chuyển tiếp tại các đường cong không cần cấu tạo siêu cao. 1. Trị số trong ngoặc tương ứng với tốc độ thiết kế 60 km/h. 2. Chiều dài đường cong chuyển tiếp phải được tính toán để bảo đảm an toàn, êm thuận. Không phải bố trí đường cong chuyển tiếp tại các đường cong không cần cấu tạo siêu cao. 1. Trị số trong ngoặc tương ứng với tốc độ thiết kế 60 km/h. 2. Chiều dài đường cong chuyển tiếp phải được tính toán để bảo đảm an toàn, êm thuận. Không phải bố trí đường cong chuyển tiếp tại các đường cong không cần cấu tạo siêu cao.\n\n2.5.2. Phải bảo đảm tầm nhìn cho các xe trên đường bộ cao tốc.\n\n2.5.3. Quy định về dốc dọc.\n\n2.5.3.1. Độ dốc dọc lớn nhất được quy định tại Bảng 1 tùy thuộc cấp thiết kế của đường bộ cao tốc.\n\n2.5.3.2. Trên các đoạn nền đào phải thiết kế độ dốc dọc tối thiểu bằng 0,50 %.\n\n2.5.3.3. Trên các đoạn chuyển tiếp có độ dốc ngang mặt đường dưới 1,00 % phải thiết kế dốc dọc tối thiểu là 0,50 %.\n\n2.5.3.4. Trong hầm, độ dốc dọc tối thiểu là 0,30 %.\n\n2.5.4. Phải bố trí đường cong đứng dạng tròn hoặc parabol tại các vị trí đổi dốc.\n\n2.6. Nút giao khác mức, đường nhánh ra, vào trên đường bộ cao tốc\n\n2.6.1. Phải bố trí nút giao khác mức tại các vị trí đường bộ cao tốc giao với các loại đường khác.\n\n2.6.2. Trường hợp đường bộ cao tốc vượt trên các đường khác phải bảo đảm tĩnh không tương ứng với cấp kỹ thuật quy hoạch của đường bên dưới.\n\n2.6.3. Khoảng cách tối thiểu giữa nút giao khác mức liên thông và vị trí ra, vào trên đường bộ cao tốc là 4,0 km. Khoảng cách giữa các vị trí nút giao khác mức liên thông trên đường bộ cao tốc tối thiểu 10,0 km, ở gần các thành phố lớn, khu đô thị lớn và khu chức năng khoảng cách tối thiểu 5,0 km. Trường hợp có các yêu cầu về an ninh quốc phòng hoặc phục vụ mục đích đặc biệt nhằm phát triển kinh tế xã hội của địa phương, khoảng cách tối thiểu giữa các nút giao khác mức liên thông được phép giảm xuống nhưng không nhỏ hơn 3,0 km.\n\n2.6.4. Các thông số kỹ thuật áp dụng cho phạm vi nút giao khác mức liên thông và các nhánh ra, vào đường bộ cao tốc.\n\n2.6.4.1. Tốc độ thiết kế trên các đường nhánh thuộc phạm vi nút giao khác mức liên thông được quy định tại Bảng 2 sau đây.\n\nBảng 2 - Tốc độ thiết kế trên các đường nhánh thuộc phạm vi nút giao khác mức liên thông\n\nĐặc điểm nút giao khác mức liên thông Cấp tốc độ thiết kế (km/h) Cấp tốc độ thiết kế (km/h) Cấp tốc độ thiết kế (km/h) 120 100 80 Liên thông giữa đường bộ cao tốc với đường bộ cao tốc và đường cấp I, cấp II 80 ÷ 50 70 ÷ 40 60 ÷ 35 (50 ÷ 35) Liên thông giữa đường bộ cao tốc với đường khác 60 ÷ 35 50 ÷ 35 40 ÷ 30 (35 ÷ 30) Trị số trong ngoặc tương ứng với tốc độ thiết kế là 60 km/h. Trị số trong ngoặc tương ứng với tốc độ thiết kế là 60 km/h. Trị số trong ngoặc tương ứng với tốc độ thiết kế là 60 km/h. Trị số trong ngoặc tương ứng với tốc độ thiết kế là 60 km/h.\n\n2.6.4.2. Các yếu tố hình học của đường nhánh (bán kính đường cong bằng, đường cong chuyển tiếp, siêu cao, độ mở rộng, độ dốc dọc, đường cong đứng, tầm nhìn xe) phải bảo đảm yêu cầu kỹ thuật tương ứng với tốc độ thiết kế.\n\n2.6.5. Phải bố trí làn tăng, giảm tốc tại các nhánh vào, ra đường bộ cao tốc.\n\n2.7. Nền, mặt đường của đường bộ cao tốc\n\n2.7.1. Nền đường\n\n2.7.1.1. Nền đường phải bảo đảm ổn định, duy trì được các kích thước hình học, có đủ cường độ để chịu được các tác động của tải trọng xe và các yếu tố thiên nhiên trong suốt thời gian sử dụng.\n\n2.7.1.2. Nền đường phải tính toán, thiết kế xây dựng dựa trên các số liệu khảo sát địa hình, địa chất, thủy văn.\n\n2.7.2. Mặt đường phải được thiết kế, xây dựng bảo đảm các yêu cầu về cường độ, tính bền vững, độ nhám, độ bằng phẳng và khả năng thoát nước.\n\n2.8. An toàn phòng hộ trên đường bộ cao tốc\n\n2.8.1. Bố trí phòng hộ\n\n2.8.1.1. Phải bố trí đồng bộ hệ thống phòng hộ bảo đảm an toàn giao thông trên đường bộ cao tốc.\n\n2.8.1.2. Phải bố trí hàng rào bảo vệ để ngăn cách người, gia súc hoặc thú rừng qua đường.\n\n2.8.2. Hệ thống báo hiệu trên đường bộ cao tốc được bố trí tuân thủ quy chuẩn kỹ thuật quốc gia về báo hiệu đường bộ.\n\n2.8.3. Phải bố trí hệ thống vạch sơn dẫn hướng và kết hợp với việc bố trí lan can phòng hộ hoặc cọc tiêu để bảo đảm an toàn khai thác.\n\n2.8.4. Chống chói\n\n2.8.4.1. Phải có biện pháp chống chói do đèn pha của xe chạy ngược chiều về ban đêm.\n\n2.8.4.2. Phải kiểm tra việc bảo đảm tầm nhìn ở các đoạn đường cong khi có bố trí các giải pháp chống chói.\n\n2.8.4.3. Đoạn đường bộ cao tốc có dải giữa rộng từ 12,0 m trở lên không cần có biện pháp chống chói.\n\n2.8.5. Bố trí chiếu sáng trên đường bộ cao tốc tại các khu vực sau:\n\n2.8.5.1. Trạm thu phí.\n\n2.8.5.2. Trong hầm.\n\n2.8.5.3. Phạm vi các vị trí giao nhau liên thông trên đường bộ cao tốc.\n\n2.8.6. Phải bố trí tường chống ồn ở gần khu vực đông dân cư.\n\n2.9. Tốc độ tối đa cho phép khai thác trên đường bộ cao tốc không vượt quá 120 km/h. Tốc độ tối đa cho phép và tốc độ thiết kế không được chênh nhau quá 20 km/h; tốc độ tối đa cho phép của 02 đoạn tuyến liên tiếp không được chênh nhau quá 20 km/h.\n\n3. TỔ CHỨC THỰC HIỆN\n\n3.1. Cục Đường cao tốc Việt Nam chịu trách nhiệm tổ chức triển khai Quy chuẩn này.\n\n3.2. Trường hợp các văn bản quy phạm pháp luật được viện dẫn trong Quy chuẩn này có sự thay đổi, bổ sung hoặc được thay thế thì áp dụng theo văn bản sửa đổi, bổ sung, thay thế./.']","**Nguồn văn bản:** /content/drive/MyDrive/ITProject_data/new_law/38_2024_TT-BGTVT_622477.docx

**Tên văn bản:** THÔNG TƯ QUY ĐỊNH VỀ TỐC ĐỘ VÀ KHOẢNG CÁCH AN TOÀN CỦA XE CƠ GIỚI, XE MÁY CHUYÊN DÙNG THAM GIA GIAO THÔNG TRÊN ĐƯỜNG BỘ

**Nội dung:**

Điều 6. Tốc độ khai thác tối đa cho phép xe cơ giới tham gia giao thông trên đường bộ (trừ đường cao tốc):

2. Tốc độ khai thác tối đa cho phép xe cơ giới tham gia giao thông trên đường bộ ngoài khu vực đông dân cư:

Bảng 2:

Loại xe cơ giới đường bộ | Tốc độ khai thác tối đa (km/h) | Tốc độ khai thác tối đa (km/h)
------- | -------- | --------
Đường đôi; đường một chiều có từ hai làn xe cơ giới trở lên | Đường hai chiều; đường một chiều có một làn xe cơ giới | 
Xe ô tô chở người đến 28 chỗ không kể chỗ của người lái xe (trừ xe buýt); ô tô tải có trọng tải không lớn hơn 3,5 tấn | 90 | 80
Xe ô tô chở người trên 28 chỗ không kể chỗ người lái xe (trừ xe buýt); ô tô tải có trọng tải trên 3,5 tấn (trừ ô tô xi téc) | 80 | 70
Xe buýt; ô tô đầu kéo kéo sơ mi rơ moóc (trừ ô tô đầu kéo kéo sơ mi rơ moóc xi téc); xe mô tô; ô tô chuyên dùng (trừ ô tô trộn vữa, ô tô trộn bê tông lưu động) | 70 | 60
Ô tô kéo rơ moóc; ô tô kéo xe khác; ô tô trộn vữa, ô tô trộn bê tông lưu động, ô tô xi téc, ô tô đầu kéo kéo sơ mi rơ moóc xi téc, ô tô kéo theo rơ moóc xi téc | 60 | 50


Tóm lại:  Tốc độ tối đa ngoài khu vực đông dân cư phụ thuộc vào loại xe và loại đường.  Đối với đường đôi hoặc đường một chiều có từ hai làn xe trở lên, tốc độ tối đa dao động từ 90km/h (ô tô chở người dưới 28 chỗ, ô tô tải dưới 3.5 tấn) đến 60km/h (ô tô kéo rơ moóc, xe chuyên dụng nguy hiểm). Đối với đường hai chiều hoặc đường một chiều một làn xe, tốc độ tối đa giảm xuống 10km/h so với đường đôi.
",Tốc độ tối đa ngoài khu vực đô thị được giảm từ 80 km/h xuống 70 km/h.,1.0,0.7069739018374995,0.0,0.0
16,Luật Giao thông Đường bộ 2025 có quy định gì về việc sử dụng đèn pha trong khu vực đô thị?,"['Điều 6. Cơ sở dữ liệu đường bộ\n\n1. Cơ sở dữ liệu đường bộ được thiết kế, xây dựng, vận hành theo Khung kiến trúc tổng thể quốc gia số, bao gồm:\n\na) Cơ sở dữ liệu về quy hoạch mạng lưới đường bộ, quy hoạch kết cấu hạ tầng đường bộ;\n\nb) Cơ sở dữ liệu về tình hình đầu tư, xây dựng kết cấu hạ tầng đường bộ;\n\nc) Cơ sở dữ liệu về kết cấu hạ tầng đường bộ đã đưa vào khai thác;\n\nd) Cơ sở dữ liệu thanh toán điện tử giao thông đường bộ;\n\nđ) Cơ sở dữ liệu về hoạt động vận tải bằng xe ô tô, trừ cơ sở dữ liệu về hành trình của phương tiện giao thông đường bộ, hình ảnh người lái xe và cơ sở dữ liệu về quản lý thời gian điều khiển phương tiện của người lái xe theo quy định của pháp luật.\n\n2. Cơ sở dữ liệu đường bộ được kết nối, chia sẻ với cơ sở dữ liệu về trật tự, an toàn giao thông đường bộ và các cơ sở dữ liệu khác có liên quan.\n\n3. Chính phủ quy định chi tiết khoản 1 và khoản 2 Điều này; quy định việc thu thập, quản lý, khai thác thông tin trong cơ sở dữ liệu đường bộ.\n\nĐiều 7. Các hành vi bị nghiêm cấm\n\n1. Phá hoại kết cấu hạ tầng đường bộ; khai thác, sử dụng kết cấu hạ tầng đường bộ trái quy định của pháp luật.\n\n2. Đấu nối trái phép vào đường chính, đường nhánh; tháo dỡ, di chuyển trái phép hoặc làm sai lệch công trình đường bộ.\n\n3. Lấn, chiếm, sử dụng, xây dựng trái phép trong phạm vi bảo vệ kết cấu hạ tầng đường bộ.\n\n4. Lắp đặt, tháo dỡ, di chuyển, điều chỉnh, che khuất báo hiệu đường bộ trái quy định của pháp luật; gắn, treo, lắp vào báo hiệu đường bộ nội dung không liên quan tới ý nghĩa, mục đích của báo hiệu đường bộ hoặc làm sai lệch báo hiệu đường bộ.\n\n5. Kinh doanh vận tải bằng xe ô tô, bằng xe bốn bánh có gắn động cơ mà không có giấy phép kinh doanh vận tải theo quy định của pháp luật hoặc kinh doanh không đúng giấy phép.\n\n6. Lập điểm đón, trả khách, bốc dỡ hàng hóa trái quy định của pháp luật.\n\nChương II\n\nKẾT CẤU HẠ TẦNG ĐƯỜNG BỘ \n\nMục 1. PHÂN LOẠI, ĐẶT TÊN, SỐ HIỆU ĐƯỜNG BỘ\n\nĐiều 8. Phân loại đường bộ theo cấp quản lý\n\n1. Đường bộ theo cấp quản lý bao gồm: quốc lộ, đường tỉnh, đường huyện, đường xã, đường thôn, đường đô thị, đường chuyên dùng và được xác định như sau:\n\na) Quốc lộ là đường nối liền Thủ đô Hà Nội với trung tâm hành chính cấp tỉnh; đường nối liền các trung tâm hành chính cấp tỉnh; đường có vị trí quan trọng đối với sự phát triển kinh tế - xã hội, bảo đảm quốc phòng, an ninh của vùng, khu vực;\n\nb) Đường tỉnh là đường nằm trong địa bàn một tỉnh nối trung tâm hành chính của tỉnh với trung tâm hành chính của huyện; đường có vị trí quan trọng đối với sự phát triển kinh tế - xã hội của tỉnh;\n\nc) Đường huyện là đường nối trung tâm hành chính của huyện với trung tâm hành chính của xã, cụm xã hoặc trung tâm hành chính của huyện lân cận; đường có vị trí quan trọng đối với sự phát triển kinh tế - xã hội của huyện;\n\nd) Đường xã là đường nối trung tâm hành chính của xã với thôn, làng, ấp, bản, buôn, bon, phum, sóc (sau đây gọi là thôn) và điểm dân cư nông thôn hoặc đường nối với xã lân cận; đường có vị trí quan trọng đối với sự phát triển kinh tế - xã hội của xã;\n\nđ) Đường thôn là đường trong khu vực thôn, đường trục nối thôn với khu vực sản xuất nông nghiệp, lâm nghiệp và cơ sở sản xuất, kinh doanh khác trên địa bàn thôn;\n\ne) Đường đô thị là đường trong phạm vi địa giới hành chính nội thành, nội thị, bao gồm: đường cao tốc đô thị, đường phố, đường ngõ, ngách, kiệt, hẻm trong đô thị;\n\ng) Đường chuyên dùng là đường chuyên phục vụ giao thông cho một hoặc một số cơ quan, tổ chức, cá nhân và đường nội bộ.\n\n2. Đường địa phương bao gồm: đường tỉnh, đường đô thị, đường huyện, đường xã, đường thôn.\n\n3. Bộ Giao thông vận tải có trách nhiệm quản lý quốc lộ, trừ quốc lộ quy định tại điểm a khoản 4 Điều này và đường gom, đường bên quy định tại điểm c khoản 4 Điều này.\n\n4. Ủy ban nhân dân cấp tỉnh có trách nhiệm quản lý các loại đường sau đây:\n\na) Quản lý đường tỉnh, quốc lộ đi qua đô thị loại đặc biệt; quốc lộ khi được phân cấp; tuyến, đoạn tuyến quốc lộ đã hoàn thành việc đầu tư xây dựng tuyến tránh thay thế phù hợp với quy hoạch mạng lưới đường bộ; tuyến, đoạn tuyến quốc lộ không còn trong quy hoạch mạng lưới đường bộ, trừ trường hợp quốc lộ có yêu cầu đặc biệt về bảo đảm quốc phòng, an ninh; tuyến, đoạn tuyến quốc lộ được Thủ tướng Chính phủ giao trên cơ sở đề nghị của Ủy ban nhân dân cấp tỉnh để đáp ứng nhu cầu phát triển kinh tế - xã hội, bảo đảm lợi ích quốc gia, quốc phòng, an ninh, khả năng bố trí nguồn lực của địa phương; tuyến, đoạn tuyến quốc lộ đã được điều chuyển tài sản về Ủy ban nhân dân cấp tỉnh quản lý theo quy định của pháp luật về quản lý, sử dụng tài sản công;\n\nb) Quy định việc quản lý đường đô thị, đường huyện, đường xã, đường thôn;\n\nc) Quản lý đường gom, đường bên tách khỏi quốc lộ.\n\n5. Người quản lý, sử dụng đường bộ đối với đường chuyên dùng có trách nhiệm quản lý đường chuyên dùng theo quy định của Luật này và quy định khác của pháp luật có liên quan.\n\n6. Chính phủ quy định chi tiết Điều này.\n\nĐiều 9. Phân loại đường bộ theo chức năng phục vụ\n\n1. Đường chính là đường phục vụ giao thông chủ yếu trong khu vực, kết nối giao thông các khu vực, vùng.\n\n2. Đường nhánh là đường nối vào đường chính, có chức năng kết nối giao thông các khu vực hai bên đường chính; kết nối giao thông từ đường gom vào đường chính thông qua nút giao.\n\n3. Đường gom là đường để gom hệ thống đường giao thông nội bộ của các khu đô thị, công nghiệp, kinh tế, dân cư, thương mại - dịch vụ và các đường khác vào đường chính hoặc vào đường nhánh trước khi đấu nối vào đường chính. Đường gom có thể là đường bên theo quy định tại khoản 4 Điều này.\n\n4. Đường bên là đường được xây dựng bên cạnh các đoạn đường chính để ngăn cách giao thông khu vực hai bên đường với đường chính. Đường bên được tách khỏi đường chính hoặc ngăn cách với đường chính bằng dải phân cách, tường bảo vệ, rào chắn.\n\n5. Đường dành cho giao thông công cộng là đường phục vụ cho tất cả mọi người, phương tiện giao thông đường bộ theo quy định của Luật này và quy định khác của pháp luật có liên quan.\n\n6. Đường nội bộ là đường trong phạm vi khu chung cư, đô thị, công nghiệp, kinh tế, thương mại - dịch vụ, các cơ quan, tổ chức, đơn vị khác và chỉ phục vụ các đối tượng được phép vào, ra bên trong phạm vi các khu vực quy định tại khoản này.\n\n7. Đường dành riêng cho người đi bộ, người đi xe đạp và các đường khác.\n\nĐiều 10. Cấp kỹ thuật của đường bộ\n\n1. Cấp kỹ thuật của đường bộ phải được xác định trong dự án đầu tư xây dựng đường bộ. Việc thiết kế, thi công xây dựng đường bộ phải thực hiện đúng quy định về cấp kỹ thuật tuyến đường trong dự án đầu tư xây dựng đường bộ được duyệt; tuân thủ quy chuẩn, tiêu chuẩn kỹ thuật về cấp kỹ thuật của đường bộ.\n\n2. Cấp kỹ thuật của đường bộ được quy định trong các quy chuẩn, tiêu chuẩn thiết kế của đường bộ, bao gồm:\n\na) Đường cao tốc;\n\nb) Đường cấp I, II, III, IV, V, VI;\n\nc) Đường đô thị;\n\nd) Đường cấp A, B, C, D, đường khác.\n\n3. Cấp kỹ thuật của đường bộ quy định tại các điểm a, b và d khoản 2 Điều này thực hiện theo quy chuẩn kỹ thuật quốc gia do Bộ trưởng Bộ Giao thông vận tải ban hành và tiêu chuẩn kỹ thuật do cấp có thẩm quyền công bố.\n\n4. Cấp kỹ thuật của đường bộ quy định tại điểm c khoản 2 Điều này thực hiện theo quy chuẩn kỹ thuật quốc gia do Bộ trưởng Bộ Xây dựng ban hành và tiêu chuẩn kỹ thuật do cấp có thẩm quyền công bố.\n\nĐiều 11. Đặt tên, đổi tên, số hiệu đường bộ\n\n1. Việc đặt tên, số hiệu đường bộ được quy định như sau:\n\na) Tên đường bộ được đặt theo tên danh nhân, người có công với đất nước; di tích, sự kiện lịch sử, văn hóa; tên địa danh hoặc tên theo tập quán. Số hiệu đường bộ được đặt theo số tự nhiên hoặc số tự nhiên kèm theo chữ cái nếu cần thiết. Trường hợp đường đô thị trùng với đường khác thì sử dụng cả tên đường đô thị và tên, số hiệu của đường khác;', 'Điều 11. Đặt tên, đổi tên, số hiệu đường bộ\n\n1. Việc đặt tên, số hiệu đường bộ được quy định như sau:\n\na) Tên đường bộ được đặt theo tên danh nhân, người có công với đất nước; di tích, sự kiện lịch sử, văn hóa; tên địa danh hoặc tên theo tập quán. Số hiệu đường bộ được đặt theo số tự nhiên hoặc số tự nhiên kèm theo chữ cái nếu cần thiết. Trường hợp đường đô thị trùng với đường khác thì sử dụng cả tên đường đô thị và tên, số hiệu của đường khác;\n\nb) Tên, số hiệu đường bộ tham gia vào mạng lưới đường bộ quốc tế thực hiện theo điều ước quốc tế giữa nước Cộng hòa xã hội chủ nghĩa Việt Nam với các quốc gia, tổ chức quốc tế có liên quan. Đường bộ kết nối vào mạng lưới đường bộ quốc tế thì sử dụng cả tên, số hiệu đường bộ trong nước và tên, số hiệu đường bộ quốc tế.\n\n2. Trường hợp có tuyến, đoạn tuyến đường bộ đi trùng nhau thì sử dụng tên, số hiệu đường bộ thuộc cấp quản lý cao hơn, trừ trường hợp quy định tại điểm a khoản 1 Điều này.\n\n3. Không bắt buộc đặt tên, số hiệu đường bộ đối với đường xã, đường thôn, đường nội bộ, đường chuyên dùng; không bắt buộc đổi tên, số hiệu đường bộ trong trường hợp đường đó đi qua địa bàn được cấp có thẩm quyền quyết định giải thể, nhập, chia, điều chỉnh địa giới hành chính của địa phương.\n\n4. Chính phủ quy định chi tiết Điều này.\n\nMục 2. ĐẤT DÀNH CHO KẾT CẤU HẠ TẦNG ĐƯỜNG BỘ, BẢO VỆ KẾT CẤU HẠ TẦNG ĐƯỜNG BỘ\n\nĐiều 12. Quỹ đất dành cho kết cấu hạ tầng đường bộ\n\n1. Quỹ đất dành cho kết cấu hạ tầng đường bộ phải phù hợp với quy hoạch mạng lưới đường bộ; quy hoạch, kế hoạch sử dụng đất cấp tỉnh; quy hoạch sử dụng đất cấp huyện và các quy hoạch khác có liên quan.\n\n2. Quỹ đất dành cho kết cấu hạ tầng đường bộ trong đô thị là một bộ phận của đất dành cho giao thông so với đất xây dựng đô thị.\n\n3. Tỷ lệ đất dành cho giao thông trên đất xây dựng đô thị đạt từ 11% đến 26%, phù hợp với tiêu chuẩn về trình độ phát triển cơ sở hạ tầng và kiến trúc cảnh quan khu vực nội thành, nội thị của từng loại đô thị theo quy định của pháp luật về quy hoạch đô thị và quy định khác của pháp luật có liên quan.\n\n4. Đô thị có yếu tố đặc thù theo quy định của Ủy ban Thường vụ Quốc hội thì tỷ lệ đất dành cho giao thông so với đất xây dựng đô thị tối thiểu đạt 50% tỷ lệ đất quy định tại khoản 3 Điều này.\n\nĐiều 13. Đất dành cho kết cấu hạ tầng đường bộ\n\n1. Đất dành cho kết cấu hạ tầng đường bộ bao gồm:\n\na) Đất của đường bộ gồm phần đất để xây dựng công trình đường bộ và phần đất để bảo vệ, bảo trì đường bộ;\n\nb) Đất để xây dựng bến xe; bãi đỗ xe; điểm dừng xe, đỗ xe; trạm dừng nghỉ; các công trình phụ trợ phục vụ cho hoạt động đường bộ;\n\nc) Hành lang an toàn đường bộ.\n\n2. Việc quản lý, sử dụng đất dành cho kết cấu hạ tầng đường bộ phải tuân thủ quy định của pháp luật về đất đai, pháp luật về quy hoạch, pháp luật về quy hoạch đô thị, pháp luật về xây dựng, quy định của Luật này và quy định khác của pháp luật có liên quan.\n\n3. Trường hợp do vị trí tự nhiên mà việc thoát nước từ công trình thuộc kết cấu hạ tầng đường bộ buộc phải qua bất động sản khác thì chủ sở hữu bất động sản có hệ thống thoát nước đi qua phải dành một lối thoát nước thích hợp, không được cản trở hoặc ngăn chặn hệ thống thoát nước.\n\nNgười quản lý, sử dụng đường bộ phải hạn chế đến mức thấp nhất thiệt hại cho chủ sở hữu bất động sản khi xây dựng, lắp đặt hệ thống thoát nước; nếu gây thiệt hại phải bồi thường theo quy định của pháp luật.\n\nĐiều 14. Phần đất để bảo vệ, bảo trì đường bộ\n\n1. Chiều rộng phần đất để bảo vệ, bảo trì đường bộ ngoài đô thị phụ thuộc vào cấp kỹ thuật của đường bộ và được xác định theo nguyên tắc sau đây:\n\na) Đối với đường bộ có nền đắp, phần đất để bảo vệ, bảo trì được xác định từ chân ta luy nền đường ra bên ngoài;\n\nb) Đối với đường bộ có nền đào, phần đất để bảo vệ, bảo trì được xác định từ mép ngoài cùng của rãnh đỉnh ra bên ngoài; ở nơi không xây dựng rãnh đỉnh thì xác định từ mép trên cùng đỉnh mái ta luy dương nền đường ra bên ngoài;\n\nc) Đối với cầu, cống, rãnh, hố thu và các hạng mục công trình của đường bộ thì phần đất để bảo vệ, bảo trì đường bộ được xác định từ mép ngoài bộ phận kết cấu ngoài cùng của công trình trở ra; đối với cầu cạn, cầu vượt trên cao, phạm vi đất để bảo vệ, bảo trì cầu được xác định từ mép ngoài trở ra của móng các hạng mục công trình mố, trụ, mép ngoài của kết cấu cầu;\n\nd) Đối với trường hợp không thuộc quy định tại các điểm a, b và c khoản này, phần đất để bảo vệ, bảo trì đường bộ nằm dọc phía ngoài lề đường và cách lề đường một khoảng đủ để xây dựng rãnh thoát nước, nhưng không nhỏ hơn 01 mét.\n\n2. Phần đất để bảo vệ, bảo trì đường đô thị được xác định theo nguyên tắc sau đây:\n\na) Đường đô thị đã có hè phố thì sử dụng một phần hè phố để thực hiện bảo vệ, bảo trì đường đô thị;\n\nb) Trường hợp đường đô thị đi sát với tường bao nhà ở, tường bao công trình xây dựng khác, đường không có hè phố, đường nằm trong ngõ, ngách, kiệt, hẻm, đường nội bộ khu dân cư đô thị thì được sử dụng một phần mặt đường khi thực hiện bảo vệ, bảo trì đường đô thị;\n\nc) Trường hợp không thuộc quy định tại điểm a và điểm b khoản này thì được xác định tương tự đường ngoài đô thị;\n\nd) Phần đất để bảo vệ, bảo trì cầu, cống, rãnh, hố thu và các hạng mục công trình của đường đô thị được xác định theo quy định tại điểm c khoản 1 Điều này. Trường hợp cầu, cống, rãnh, hố thu và các hạng mục công trình của đường đô thị nằm liền kề với công trình xây dựng khác thì phần đất để bảo vệ, bảo trì là ranh giới của các công trình.\n\n3. Tại các đoạn đường chồng lấn, giao nhau, phần đất để bảo vệ, bảo trì đường bộ được xác định theo đường có cấp kỹ thuật cao hơn; đối với các đường liền kề nhau, phần đất để bảo vệ, bảo trì đường bộ được xác định từ mép của đường ngoài cùng trở ra.\n\n4. Trường hợp phần đất để bảo vệ, bảo trì đường bộ chồng lấn với phạm vi đất dành cho đường sắt thì việc sử dụng phần đất để bảo vệ, bảo trì đường bộ không được ảnh hưởng đến an toàn giao thông và an toàn công trình đường sắt.\n\n5. Trường hợp phần đất để bảo vệ, bảo trì đường bộ chồng lấn với hành lang bảo vệ đê, việc sử dụng phần đất để bảo vệ, bảo trì đường bộ không được ảnh hưởng đến vận hành và an toàn công trình đê điều. Trường hợp phần đất để bảo vệ, bảo trì đường bộ chồng lấn với phạm vi bảo vệ công trình thủy lợi, việc sử dụng phần đất để bảo vệ, bảo trì đường bộ không được ảnh hưởng đến vận hành và an toàn công trình thủy lợi; nếu bị ảnh hưởng thì người quản lý, sử dụng đường bộ, chủ sở hữu hoặc chủ quản lý công trình thủy lợi phải có biện pháp khắc phục, bảo đảm an toàn công trình đường bộ, công trình thủy lợi và an toàn giao thông.\n\n6. Phần đất để bảo vệ, bảo trì hầm đường bộ, bến phà đường bộ, cầu phao đường bộ, công trình kè, tường chắn được xác định như sau:\n\na) Phần đất để bảo vệ, bảo trì hầm đường bộ phụ thuộc vào cấp công trình hầm và được xác định từ mép ngoài cửa hầm chính, cửa hầm phụ, cửa hầm thông gió và các hạng mục công trình khác ra xung quanh;\n\nb) Phần đất để bảo vệ, bảo trì bến phà đường bộ phụ thuộc vào cấp công trình phà và được xác định từ mép ngoài đường xuống bến, công trình bến; phần đất để bảo vệ, bảo trì cầu phao đường bộ được xác định từ mép ngoài đường đầu cầu phao và mố, trụ cầu phao;\n\nc) Trường hợp đường bộ có phần đất để bảo vệ, bảo trì đường bộ chồng lấn với công trình đường thủy nội địa, ranh giới đất để bảo vệ, bảo trì đường bộ là chân móng của đường, các hạng mục thuộc công trình đường bộ;\n\nd) Phần đất bảo vệ, bảo trì công trình kè, tường chắn được xác định từ mép ngoài của bộ phận ngoài cùng của công trình ra xung quanh.\n\n7. Chính phủ quy định chi tiết Điều này.\n\nĐiều 15. Hành lang an toàn đường bộ\n\n1. Chiều rộng hành lang an toàn đường bộ được xác định theo nguyên tắc sau đây:\n\na) Đối với đường ngoài đô thị, xác định từ mép ngoài phần đất để bảo vệ, bảo trì đường bộ, theo quy mô, cấp kỹ thuật của đường; trường hợp đường hiện hữu chưa xác định cấp kỹ thuật, thì căn cứ chiều rộng mặt đường và tiêu chuẩn thiết kế đường để xác định cấp kỹ thuật tương ứng làm căn cứ xác định chiều rộng hành lang an toàn đường bộ;', 'BỘ GIAO THÔNG VẬN TẢI\n------- CỘNG HÒA XÃ HỘI CHỦ NGHĨA VIỆT NAM\nĐộc lập - Tự do - Hạnh phúc \n--------------- Số: 33/2024/TT-BGTVT Hà Nội, ngày 14 tháng 11 năm 2024\n\nTHÔNG TƯ\n\nQUY ĐỊNH VỀ QUẢN LÝ GIÁ DỊCH VỤ SỬ DỤNG PHÀ ĐƯỢC ĐẦU TƯ TỪ NGUỒN VỐN NGÂN SÁCH NHÀ NƯỚC, DO TRUNG ƯƠNG QUẢN LÝ\n\nCăn cứ Luật Giá ngày 19 tháng 6 năm 2023;\n\nCăn cứ Luật Đường bộ ngày 27 tháng 06 năm 2024;\n\nCăn cứ Nghị định số 85/2024/NĐ-CP ngày 10 tháng 7 năm 2024 của Chính phủ quy định chi tiết một số điều của Luật Giá;\n\nCăn cứ Nghị định số 56/2022/NĐ-CP ngày 24 tháng 8 năm 2022 của Chính phủ quy định chức năng, nhiệm vụ, quyền hạn và cơ cấu tổ chức của Bộ Giao thông vận tải;\n\nTheo đề nghị của Vụ trưởng Vụ Tài chính, Cục trưởng Cục Đường bộ Việt Nam; \n\nBộ trưởng Bộ Giao thông vận tải ban hành Thông tư quy định về quản lý giá dịch vụ sử dụng phà được đầu tư từ nguồn vốn ngân sách Nhà nước, do trung ương quản lý.\n\nĐiều 1. Phạm vi điều chỉnh và đối tượng áp dụng\n\n1. Thông tư này quy định về quản lý giá dịch vụ sử dụng phà được đầu tư từ nguồn vốn ngân sách Nhà nước, do trung ương quản lý.\n\n2. Thông tư này áp dụng đối với cơ quan quản lý bến phà, đơn vị cung cấp dịch vụ sử dụng phà và các tổ chức, cá nhân có liên quan đến việc quản lý giá dịch vụ của bến phà được đầu tư từ nguồn vốn ngân sách Nhà nước, do trung ương quản lý.\n\nĐiều 2. Đối tượng phải thanh toán tiền dịch vụ sử dụng phà\n\nĐối tượng phải thanh toán tiền dịch vụ sử dụng phà là: người đi bộ, hành khách đi xe và người điều khiển phương tiện giao thông thô sơ đường bộ, phương tiện giao thông cơ giới đường bộ, xe máy chuyên dùng.\n\nĐiều 3. Đối tượng miễn thu tiền dịch vụ sử dụng phà\n\n1. Xe cứu thương và xe đang chở người bị tai nạn đến nơi cấp cứu.\n\n\n\n2. Xe chữa cháy của lực lượng Cảnh sát phòng cháy, chữa cháy và cứu nạn, cứu hộ và xe chữa cháy của lực lượng khác được huy động đi làm nhiệm vụ chữa cháy có tín hiệu ưu tiên theo quy định của pháp luật.\n\n3. Xe máy nông nghiệp, lâm nghiệp gồm: máy cày, máy bừa, máy xới, máy làm cỏ, máy tuốt lúa.\n\n4. Xe hộ đê; xe đang làm nhiệm vụ khẩn cấp phòng, chống lụt bão theo điều động của cấp có thẩm quyền.\n\n5. Xe chuyên dùng phục vụ quốc phòng bao gồm các xe chuyên dùng mang biển số: nền màu đỏ, chữ và số màu trắng dập chìm có gắn các thiết bị chuyên dụng cho quốc phòng (bao gồm: xe xi téc, xe cần cẩu, xe chở lực lượng vũ trang hành quân được hiểu là xe ô tô chở người có từ 12 chỗ ngồi trở lên, xe vận tải có mui che và được lắp đặt ghế ngồi trong thùng xe, xe kiểm soát, xe kiểm tra quân sự, xe chuyên dùng chở phạm nhân, xe cứu hộ, cứu nạn, xe thông tin vệ tinh, các xe ô tô đặc chủng khác phục vụ quốc phòng), xe đang đi làm nhiệm vụ khẩn cấp sử dụng một trong các tín hiệu ưu tiên theo quy định của pháp luật trong trường hợp làm nhiệm vụ khẩn cấp.\n\n6. Xe chuyên dùng của các đơn vị thuộc hệ thống tổ chức của lực lượng Công an nhân dân bao gồm:\n\na) Xe ô tô tuần tra kiểm soát giao thông của cảnh sát giao thông có đặc điểm: trên nóc xe ô tô có đèn xoay và hai bên thân xe ô tô có in dòng chữ “CẢNH SÁT GIAO THÔNG”;\n\nb) Xe ô tô cảnh sát 113 có in dòng chữ “CẢNH SÁT 113” ở hai bên thân xe;\n\nc) Xe ô tô cảnh sát cơ động có in dòng chữ “CẢNH SÁT CƠ ĐỘNG” ở hai bên thân xe;\n\nd) Xe vận tải có lắp ghế ngồi trong thùng xe của lực lượng Công an nhân dân làm nhiệm vụ;\n\nđ) Xe chở phạm nhân, xe cứu hộ, cứu nạn và các xe chuyên dùng khác của lực lượng Công an nhân dân;\n\ne) Xe đặc chủng (xe thông tin vệ tinh, xe chống đạn, xe phòng chống khủng bố, chống bạo loạn và các xe đặc chủng khác của lực lượng Công an nhân dân);\n\ng) Xe của lực lượng Công an đang đi làm nhiệm vụ khẩn cấp sử dụng tín hiệu ưu tiên theo quy định của pháp luật.\n\n7. Xe của lực lượng quốc phòng tham gia diễn tập, hành quân cơ động lực lượng, vận chuyển vũ khí, trang bị có xe chuyên dụng quân sự dẫn đường.\n\n8. Xe phục vụ tang lễ, gồm:\n\na) Xe có kết cấu chuyên dùng phục vụ tang lễ (bao gồm: xe tang, xe tải lạnh dùng để lưu xác và chở xác);\n\n\n\nb) Các xe phục vụ tang lễ (bao gồm: xe chở khách đi cùng xe tang, xe tải chở hoa, xe rước ảnh).\n\n9. Đoàn xe có xe Cảnh sát giao thông dẫn đường.\n\n10. Xe làm nhiệm vụ vận chuyển thuốc men, máy móc, thiết bị, vật tư, hàng hóa đến những nơi bị thảm họa hoặc đến vùng có dịch bệnh theo quy định của pháp luật về tình trạng khẩn cấp khi có thảm họa lớn, dịch bệnh nguy hiểm.\n\n11. Thương binh, bệnh binh, người khuyết tật, học sinh, trẻ em dưới 10 tuổi (bao gồm cả trường hợp đi xe đạp, xe máy). Khi sử dụng dịch vụ phà trong trường hợp này phải xuất trình giấy tờ (bản chính hoặc bản sao có chứng thực, bản sao điện tử được chứng thực từ bản chính hoặc bản sao điện tử được cấp từ sổ gốc) cần thiết như: thẻ thương binh, bệnh binh; Giấy chứng nhận đối với thương binh, bệnh binh kèm theo căn cước công dân; thẻ học sinh, căn cước công dân hoặc giấy chứng nhận của Nhà trường đối với học sinh.\n\n12. Người, phương tiện sử dụng dịch vụ phà tại bến phà Kênh Tắt, Láng Sắt thuộc Quốc lộ 53, bến phà Kênh Sáu thuộc Quốc lộ 53B.\n\nĐiều 4. Định giá dịch vụ sử dụng phà\n\n1. Khung giá dịch vụ sử dụng phà được định giá theo nguyên tắc và căn cứ quy định tại Điều 22 Luật Giá.\n\n2. Cục Đường bộ Việt Nam quyết định áp dụng phương pháp định giá theo quy định của pháp luật về giá.\n\n3. Cơ quan quản lý bến phà có trách nhiệm chủ trì phối hợp với đơn vị cung cấp dịch vụ sử dụng phà lập phương án giá dịch vụ sử dụng phà theo yêu cầu của Cục Đường bộ Việt Nam, đảm bảo đúng quy định pháp luật về giá và chịu trách nhiệm về phương án giá do mình lập.\n\n4. Cục Đường bộ Việt Nam có trách nhiệm thẩm định phương án giá, trình Bộ Giao thông vận tải ban hành quyết định quy định khung giá cho dịch vụ sử dụng phà.\n\n5. Việc lập, thẩm định hồ sơ phương án giá, ban hành văn bản định giá hoặc điều chỉnh giá thực hiện theo quy định của pháp luật về giá.\n\nĐiều 5. Khung giá dịch vụ sử dụng phà\n\n1. Khung giá sử dụng dịch vụ phà là mức thu tối đa và mức thu tối thiểu cho một lượt quy định cho người đi bộ, hành khách đi xe và từng phương tiện khi tham gia giao thông vượt sông bằng phà. Cơ quan quản lý bến phà và đơn vị cung cấp dịch vụ sử dụng phà quyết định giá cụ thể trong phạm vi khung giá dịch vụ sử dụng phà được Bộ Giao thông vận tải ban hành.\n\n2. Khung giá dịch vụ sử dụng phà được xem xét, điều chỉnh giá khi các yếu tố hình thành giá thay đổi.\n\nĐiều 6. Quản lý vé thu tiền dịch vụ sử dụng phà\n\n1. Việc in, phát hành, quản lý và sử dụng vé thu tiền dịch vụ sử dụng phà theo đúng quy định của pháp luật về quản lý hóa đơn bán hàng hóa, cung ứng dịch vụ.\n\n2. Vé thu tiền dịch vụ sử dụng phà tại các bến phà bao gồm 02 loại: vé lượt, vé tháng.\n\na) Vé lượt: là vé có giá trị sử dụng dịch vụ sử dụng phà một lần, cho một đối tượng phải trả tiền dịch vụ sử dụng phà;\n\nb) Vé tháng: là vé có giá trị sử dụng dịch vụ sử dụng phà nhiều lần trong vòng 30 ngày, kể từ ngày bán ghi cụ thể trên vé đến ngày kết thúc thời hạn được ghi cụ thể trên vé. Vé tháng chỉ áp dụng đối với các đối tượng có quy định mức thu vé tháng tại các văn bản định giá do Bộ trưởng Bộ Giao thông vận tải ban hành;\n\nĐối với người đi bộ, trên vé phải ghi rõ họ, tên và số căn cước (hoặc hộ chiếu; giấy phép lái xe ô tô, mô tô; giấy xác nhận nhân thân do Công an phường, xã nơi thường trú hoặc tạm trú xác nhận). Đối với phương tiện theo quy định không có biển số, trên vé phải ghi rõ loại phương tiện và họ, tên; số căn cước (hoặc hộ chiếu; giấy phép lái xe ô tô, mô tô; giấy xác nhận nhân thân do Công an phường, xã nơi thường trú hoặc tạm trú xác nhận) của người điều khiển phương tiện. Đối với phương tiện theo quy định phải có biển số, trên vé phải ghi rõ loại phương tiện và biển số của phương tiện.\n\n3. Vé mua cho đối tượng phải trả tiền dịch vụ sử dụng phà chỉ có giá trị sử dụng cho đối tượng tại bến phà đó.']","Không tìm thấy thông tin liên quan tới câu hỏi này.
",Cấm sử dụng đèn pha trong khu vực đô thị để tránh gây chói mắt cho người tham gia giao thông khác.,0.0,0.0,0.0,0.0
17,Quy định mới về việc đỗ xe trên vỉa hè là gì?,"['BỘ GIAO THÔNG VẬN TẢI\n------- CỘNG HÒA XÃ HỘI CHỦ NGHĨA VIỆT NAM\nĐộc lập - Tự do - Hạnh phúc \n--------------- Số: 58/2024/TT-BGTVT Hà Nội, ngày 15 tháng 11 năm 2024\n\nTHÔNG TƯ\n\nQUY ĐỊNH VỀ ĐẦU TƯ ĐIỂM DỪNG XE, ĐỖ XE VÀ VỊ TRÍ, QUY MÔ TRẠM DỪNG NGHỈ, ĐIỂM DỪNG XE, ĐỖ XE TRÊN ĐƯỜNG CAO TỐC\n\nCăn cứ Luật Đường bộ ngày 27 tháng 6 năm 2024;\n\nCăn cứ Nghị định số 56/2022/NĐ-CP ngày 24 tháng 8 năm 2022 của Chính phủ quy định chức năng, nhiệm vụ, quyền hạn và cơ cấu tổ chức của Bộ Giao thông vận tải;\n\nTheo đề nghị của Cục trưởng Cục Đường cao tốc Việt Nam;\n\nBộ trưởng Bộ Giao thông vận tải ban hành Thông tư quy định về đầu tư điểm dừng xe, đỗ xe và vị trí, quy mô trạm dừng nghỉ, điểm dừng xe, đỗ xe trên đường cao tốc.\n\nĐiều 1. Phạm vi điều chỉnh\n\nThông tư này quy định chi tiết khoản 3 và khoản 4 Điều 52 Luật Đường bộ, bao gồm:\n\n1. Xem xét quyết định việc đầu tư điểm dừng xe, đỗ xe trên đường cao tốc;\n\n2. Vị trí, quy mô trạm dừng nghỉ, điểm dừng xe, đỗ xe trên đường cao tốc.\n\nĐiều 2. Đối tượng áp dụng\n\nThông tư này áp dụng đối với tổ chức, cá nhân có liên quan đến quyết định đầu tư điểm dừng xe, đỗ xe và xác định vị trí, quy mô trạm dừng nghỉ, điểm dừng xe, đỗ xe trên đường cao tốc.\n\nĐiều 3. Đầu tư điểm dừng xe, đỗ xe\n\n1. Trong quá trình lập báo cáo nghiên cứu khả thi, căn cứ nhu cầu sử dụng dịch vụ, tính chất dự án, đơn vị chuẩn bị dự án nghiên cứu, đề xuất việc đầu tư điểm dừng xe, đỗ xe tại địa điểm:\n\na) Có cảnh quan thiên nhiên hoặc danh lam thắng cảnh, di tích lịch sử - văn hóa nhằm phát triển du lịch, quảng bá văn hóa địa phương;\n\nb) Có đường ra, vào thuận tiện, không che khuất tầm nhìn, phù hợp với tính chất, điều kiện địa hình, địa chất, thủy văn của công trình dự án, bảo đảm an toàn khi khai thác.\n\n\n\n2. Cơ quan quyết định đầu tư dự án đối với dự án đầu tư công hoặc cơ quan phê duyệt dự án đối với dự án đầu tư theo phương thức đối tác công tư quyết định đầu tư điểm dừng xe, đỗ xe căn cứ nghiên cứu, đề xuất của đơn vị chuẩn bị dự án tại khoản 1 Điều này.\n\nĐiều 4. Vị trí, quy mô điểm dừng xe, đỗ xe\n\n1. Điểm dừng xe, đỗ xe được xây dựng ngoài phạm vi hành lang an toàn đường bộ.\n\n2. Điểm dừng, đỗ xe có quy mô diện tích tối thiểu 500 m2 không bao gồm đường ra vào.\n\nĐiều 5. Các hạng mục công trình thuộc điểm dừng xe, đỗ xe\n\n1. Điểm dừng, đỗ xe bao gồm các hạng mục sau:\n\na) Đường ra, vào;\n\nb) Mặt bằng khu vực dừng xe, đỗ xe;\n\nc) Nơi cung cấp thông tin, bản đồ du lịch hoặc các thiết bị nghe, nhìn khác phục vụ cung cấp thông tin cho người tham gia giao thông hoặc quảng bá du lịch địa phương.\n\n2. Yêu cầu thiết kế các hạng mục tại khoản 1 Điều này như sau:\n\na) Đường ra, vào tuân thủ quy định về đường nhánh ra, vào trên đường cao tốc theo Quy chuẩn kỹ thuật quốc gia về đường bộ cao tốc;\n\nb) Kết cấu mặt bằng khu vực dừng xe, đỗ xe và nơi cung cấp thông tin là mặt đường bê tông xi măng có chiều dày tối thiểu 20 cm hoặc bê tông nhựa có chiều dày tối thiểu 7 cm;\n\nc) Đường lưu thông trong mặt bằng khu vực dừng xe, đỗ xe phải có các biển báo hiệu, vạch kẻ đường; có bán kính quay xe tối thiểu 10 m tính theo tim đường, đảm bảo cho các loại phương tiện lưu thông an toàn trong khu vực điểm dừng xe, đỗ xe;\n\nd) Có biện pháp thoát nước phù hợp.\n\nĐiều 6. Vị trí, quy mô trạm dừng nghỉ\n\n1. Trạm dừng nghỉ được xây dựng ngoài phạm vi hành lang an toàn đường bộ theo quy định tại điểm d khoản 1 Điều 39 Luật Đường bộ.\n\n2. Trong quá trình lập báo cáo nghiên cứu khả thi, đơn vị chuẩn bị dự án nghiên cứu, đề xuất vị trí, quy mô trạm dừng nghỉ căn cứ:\n\na) Quy chuẩn kỹ thuật quốc gia về trạm dừng nghỉ, quy chuẩn kỹ thuật quốc\n\ngia về đường bộ cao tốc;\n\n\n\nc) Hình thức đầu tư, khả năng cân đối nguồn lực đầu tư;\n\nd) Điều kiện địa hình, địa chất và tính chất của công trình dự án.\n\nĐiều 7. Hiệu lực thi hành\n\n1. Thông tư này có hiệu lực thi hành kể từ ngày 01 tháng 01 năm 2025.\n\n2. Đối với các trạm dừng nghỉ đã được phê duyệt và quyết định vị trí, quy mô trước ngày Thông tư này có hiệu lực thi hành thì tiếp tục thực hiện theo nội dung đã được phê duyệt./.\n\nNơi nhận:\n- Bộ trưởng (để b/c);\n- Các Thứ trưởng Bộ Giao thông vận tải;\n- Văn phòng Chính phủ;\n- Các bộ, cơ quan ngang bộ, cơ quan thuộc Chính phủ;\n- UBND các tỉnh, thành phố trực thuộc trung ương;\n- Cục Kiểm tra văn bản QPPL (Bộ Tư pháp);\n- Công báo;\n- Cổng thông tin điện tử Chính phủ;\n- Cổng thông tin điện tử Bộ GTVT;\n- Báo Giao thông, Tạp chí GTVT;\n- Lưu: VT, CĐTVN. KT. BỘ TRƯỞNG \nTHỨ TRƯỞNG\n\n\n\n\nNguyễn Duy Lâm', '6. Trường hợp tước quyền sử dụng giấy phép lái xe tích hợp giấy phép lái xe không thời hạn (xe mô tô, xe tương tự xe mô tô) và giấy phép lái xe có thời hạn (xe ô tô, xe tương tự xe ô tô, xe chở người bốn bánh có gắn động cơ, xe chở hàng bốn bánh có gắn động cơ) thì người có thẩm quyền xử phạt áp dụng tước quyền sử dụng đối với giấy phép lái xe không thời hạn khi người điều khiển xe mô tô, xe tương tự xe mô tô hoặc tước quyền sử dụng đối với giấy phép lái xe có thời hạn khi người điều khiển xe ô tô, xe tương tự xe ô tô, xe chở người bốn bánh có gắn động cơ, xe chở hàng bốn bánh có gắn động cơ thực hiện hành vi vi phạm hành chính có quy định bị tước quyền sử dụng giấy phép lái xe. Trong thời gian bị tước quyền sử dụng, người có giấy phép lái xe tích hợp được cấp, đổi giấy phép lái xe đối với giấy phép lái xe không bị tước quyền sử dụng.\n\n7. Trường hợp giấy phép, chứng chỉ hành nghề được cấp dưới dạng điện tử hoặc thể hiện dưới hình thức thông điệp dữ liệu thì cơ quan, người có thẩm quyền thực hiện tạm giữ, tước trên môi trường điện tử theo quy định nếu đáp ứng điều kiện về cơ sở hạ tầng, kỹ thuật, thông tin. Việc tạm giữ, tước quyền sử dụng được cập nhật trạng thái trên cơ sở dữ liệu, căn cước điện tử, tài khoản định danh điện tử và ứng dụng thông tin điện tử khác theo quy định.\n\nChương II\n\nHÀNH VI VI PHẠM, HÌNH THỨC, MỨC XỬ PHẠT, MỨC TRỪ ĐIỂM GIẤY PHÉP LÁI XE VÀ BIỆN PHÁP KHẮC PHỤC HẬU QUẢ VI PHẠM HÀNH CHÍNH VỀ TRẬT TỰ, AN TOÀN GIAO THÔNG TRONG LĨNH VỰC GIAO THÔNG ĐƯỜNG BỘ\n\nMục 1. VI PHẠM QUY TẮC GIAO THÔNG ĐƯỜNG BỘ\n\nĐiều 6. Xử phạt, trừ điểm giấy phép lái xe của người điều khiển xe ô tô, xe chở người bốn bánh có gắn động cơ, xe chở hàng bốn bánh có gắn động cơ và các loại xe tương tự xe ô tô vi phạm quy tắc giao thông đường bộ\n\n1. Phạt tiền từ 400.000 đồng đến 600.000 đồng đối với người điều khiển xe thực hiện một trong các hành vi vi phạm sau đây:\n\na) Không chấp hành hiệu lệnh, chỉ dẫn của biển báo hiệu, vạch kẻ đường, trừ các hành vi vi phạm quy định tại điểm a, điểm c, điểm d, điểm đ khoản 2; điểm a, điểm d, điểm đ, điểm e, điểm n, điểm o khoản 3; điểm a, điểm b, điểm đ, điểm e, điểm i, điểm k, điểm l khoản 4; điểm a, điểm b, điểm c, điểm d, điểm đ, điểm i, điểm k khoản 5; điểm a khoản 6; khoản 7; điểm b, điểm d khoản 9; điểm a khoản 10; điểm đ khoản 11 Điều này;\n\nb) Khi ra, vào vị trí dừng xe, đỗ xe không có tín hiệu báo cho người điều khiển phương tiện khác biết;\n\nc) Không báo hiệu bằng đèn khẩn cấp hoặc không đặt biển cảnh báo “Chú ý xe đỗ” theo quy định trong trường hợp gặp sự cố kỹ thuật (hoặc bất khả kháng khác) buộc phải đỗ xe chiếm một phần đường xe chạy hoặc tại nơi không được phép đỗ xe, trừ hành vi vi phạm quy định tại điểm c khoản 7 Điều này;\n\nd) Không gắn biển báo hiệu ở phía trước xe kéo, phía sau xe được kéo; điều khiển xe kéo rơ moóc không có biển báo hiệu theo quy định;\n\nđ) Sử dụng còi trong thời gian từ 22 giờ ngày hôm trước đến 05 giờ ngày hôm sau trong khu đông dân cư, khu vực cơ sở khám bệnh, chữa bệnh, trừ các xe ưu tiên đang đi làm nhiệm vụ theo quy định.\n\n2. Phạt tiền từ 600.000 đồng đến 800.000 đồng đối với người điều khiển xe thực hiện một trong các hành vi vi phạm sau đây:\n\na) Chuyển làn đường không đúng nơi cho phép hoặc không có tín hiệu báo trước hoặc chuyển làn đường không đúng quy định “mỗi lần chuyển làn đường chỉ được phép chuyển sang một làn đường liền kề”, trừ các hành vi vi phạm quy định tại điểm g khoản 5 Điều này;\n\nb) Chở người trên buồng lái quá số lượng quy định;\n\nc) Không tuân thủ các quy định về nhường đường tại nơi đường bộ giao nhau, trừ các hành vi vi phạm quy định tại điểm n, điểm o khoản 5 Điều này;\n\nd) Dừng xe, đỗ xe trên phần đường xe chạy ở đoạn đường ngoài đô thị nơi có lề đường rộng; dừng xe, đỗ xe không sát mép đường phía bên phải theo chiều đi ở nơi đường có lề đường hẹp hoặc không có lề đường; dừng xe, đỗ xe ngược với chiều lưu thông của làn đường; dừng xe, đỗ xe trên dải phân cách cố định ở giữa hai phần đường xe chạy; đỗ xe trên dốc không chèn bánh;\n\nđ) Dừng xe không sát theo lề đường, vỉa hè phía bên phải theo chiều đi hoặc bánh xe gần nhất cách lề đường, vỉa hè quá 0,25 mét; dừng xe trên đường dành riêng cho xe buýt; dừng xe trên miệng cống thoát nước, miệng hầm của đường điện thoại, điện cao thế, chỗ dành riêng cho xe chữa cháy lấy nước; rời vị trí lái, tắt máy khi dừng xe (trừ trường hợp rời khỏi vị trí lái để đóng, mở cửa xe, xếp dỡ hàng hóa, kiểm tra kỹ thuật xe) hoặc rời vị trí lái khi dừng xe nhưng không sử dụng phanh đỗ xe (hoặc thực hiện biện pháp an toàn khác); dừng xe, đỗ xe không đúng vị trí quy định ở những đoạn có bố trí nơi dừng xe, đỗ xe; dừng xe, đỗ xe trên phần đường dành cho người đi bộ qua đường; dừng xe nơi có biển “Cấm dừng xe và đỗ xe”, trừ hành vi vi phạm quy định tại điểm đ khoản 4, điểm c khoản 7 Điều này.\n\n3. Phạt tiền từ 800.000 đồng đến 1.000.000 đồng đối với người điều khiển xe thực hiện một trong các hành vi vi phạm sau đây:\n\na) Điều khiển xe chạy quá tốc độ quy định từ 05 km/h đến dưới 10 km/h;\n\nb) Sử dụng còi, rú ga liên tục; sử dụng còi hơi, sử dụng đèn chiếu xa khi gặp người đi bộ qua đường hoặc khi đi trên đoạn đường qua khu dân cư có hệ thống chiếu sáng đang hoạt động hoặc khi gặp xe đi ngược chiều (trừ trường hợp dải phân cách có khả năng chống chói) hoặc khi chuyển hướng xe tại nơi đường giao nhau, trừ các xe ưu tiên đang đi làm nhiệm vụ theo quy định;\n\nc) Chuyển hướng không quan sát hoặc không bảo đảm khoảng cách an toàn với xe phía sau hoặc không giảm tốc độ hoặc không có tín hiệu báo hướng rẽ hoặc có tín hiệu báo hướng rẽ nhưng không sử dụng liên tục trong quá trình chuyển hướng (trừ trường hợp điều khiển xe đi theo hướng cong của đoạn đường bộ ở nơi đường không giao nhau cùng mức);\n\nd) Không tuân thủ các quy định về dừng xe, đỗ xe tại nơi đường bộ giao nhau cùng mức với đường sắt; dừng xe, đỗ xe trong phạm vi bảo vệ công trình đường sắt, phạm vi an toàn của đường sắt;\n\nđ) Dừng xe, đỗ xe tại vị trí: nơi đường bộ giao nhau hoặc trong phạm vi 05 mét tính từ mép đường giao nhau; điểm đón, trả khách; trước cổng hoặc trong phạm vi 05 mét hai bên cổng trụ sở cơ quan, tổ chức có bố trí đường cho xe ra, vào; nơi phần đường có bề rộng chỉ đủ cho một làn xe cơ giới; che khuất biển báo hiệu đường bộ, đèn tín hiệu giao thông; nơi mở dải phân cách giữa; cách xe ô tô đang đỗ ngược chiều dưới 20 mét trên đường phố hẹp, dưới 40 mét trên đường có một làn xe cơ giới trên một chiều đường;\n\ne) Đỗ xe không sát theo lề đường, vỉa hè phía bên phải theo chiều đi hoặc bánh xe gần nhất cách lề đường, vỉa hè quá 0,25 mét; đỗ xe trên đường dành riêng cho xe buýt; đỗ xe trên miệng cống thoát nước, miệng hầm của đường điện thoại, điện cao thế, chỗ dành riêng cho xe chữa cháy lấy nước; đỗ, để xe ở vỉa hè trái quy định của pháp luật; đỗ xe nơi có biển “Cấm đỗ xe” hoặc biển “Cấm dừng xe và đỗ xe”, trừ hành vi vi phạm quy định tại điểm đ khoản 4, điểm c khoản 7 Điều này;\n\ng) Không sử dụng hoặc sử dụng không đủ đèn chiếu sáng trong thời gian từ 18 giờ ngày hôm trước đến 06 giờ ngày hôm sau hoặc khi có sương mù, khói, bụi, trời mưa, thời tiết xấu làm hạn chế tầm nhìn;\n\nh) Điều khiển xe ô tô kéo theo xe khác, vật khác (trừ trường hợp kéo theo một rơ moóc, sơ mi rơ moóc hoặc một xe ô tô, xe máy chuyên dùng khác khi xe này không tự chạy được); điều khiển xe ô tô đẩy xe khác, vật khác; điều khiển xe kéo rơ moóc, sơ mi rơ moóc kéo thêm rơ moóc hoặc xe khác, vật khác; không nối chắc chắn, an toàn giữa xe kéo và xe được kéo khi kéo nhau;\n\ni) Chở người trên xe được kéo, trừ người điều khiển;\n\nk) Không thắt dây đai an toàn khi điều khiển xe chạy trên đường;\n\nl) Chở người trên xe ô tô không thắt dây đai an toàn (tại vị trí có trang bị dây đai an toàn) khi xe đang chạy;\n\nm) Chở trẻ em dưới 10 tuổi và chiều cao dưới 1,35 mét trên xe ô tô ngồi cùng hàng ghế với người lái xe (trừ loại xe ô tô chỉ có một hàng ghế) hoặc không sử dụng thiết bị an toàn phù hợp cho trẻ em theo quy định;\n\nn) Chạy trong hầm đường bộ không sử dụng đèn chiếu sáng gần;', 'Điều 43. Quy định về hoạt động của bãi đỗ xe, điểm dừng xe\n\n1. Yêu cầu đối với bãi đỗ xe\n\na) Đảm bảo an ninh, trật tự; đáp ứng yêu cầu về phòng, chống cháy, nổ và vệ sinh môi trường;\n\nb) Đường ra, vào bãi đỗ xe phải được bố trí đảm bảo an toàn và không gây ùn tắc giao thông.\n\n2. Nội dung kinh doanh tại bãi đỗ xe \n\na) Dịch vụ trông giữ phương tiện;\n\nb) Tổ chức các dịch vụ bảo dưỡng, sửa chữa phương tiện;\n\nc) Kinh doanh các dịch vụ khác theo quy định của pháp luật.\n\n3. Quy định đối với đơn vị quản lý, kinh doanh bãi đỗ xe\n\na) Đảm bảo an ninh, trật tự, vệ sinh môi trường và phòng, chống cháy, nổ tại bãi đỗ xe;\n\nb) Niêm yết công khai nội quy, giá các dịch vụ tại bãi đỗ xe, tên và số điện thoại cơ quan quản lý nhà nước có thẩm quyền để chủ xe phản ánh, khiếu nại khi cần thiết;\n\nc) Bồi thường thiệt hại cho người gửi xe nếu để xảy ra mất mát, hư hỏng phương tiện nhận gửi;\n\nd) Chịu sự kiểm tra, giám sát của các cơ quan nhà nước có thẩm quyền;\n\nđ) Kinh doanh các loại dịch vụ quy định tại khoản 2 Điều này;\n\ne) Không được để các chủ phương tiện kinh doanh vận tải sử dụng bãi đỗ xe để đón, trả khách hoặc xếp dỡ hàng hóa, đóng gói, sang tải và bảo quản hàng hóa;\n\ng) Có quyền từ chối phục vụ đối với chủ phương tiện không chấp hành nội quy bãi đỗ xe.\n\n4. Trách nhiệm, quyền hạn của chủ phương tiện hoặc người lái xe tại bãi đỗ xe\n\na) Chấp hành nội quy và sự hướng dẫn của nhân viên điều hành bãi đỗ xe;\n\nb) Sử dụng các dịch vụ tại bãi đỗ xe;\n\nc) Có quyền phản ánh, kiến nghị đến các cơ quan có thẩm quyền về các hành vi vi phạm của bãi đỗ xe.\n\n5. Quy định về điểm dừng xe\n\na) Việc tổ chức điểm dừng xe trên đường bộ phải phù hợp với quy định của pháp luật về trật tự, an toàn giao thông đường bộ và được bố trí tại các vị trí thuận tiện cho người lên, xuống xe;\n\nb) Người điều khiển phương tiện tham gia giao thông đường bộ khi dừng xe tại điểm dừng xe phải chấp hành đúng quy định tại Điều 18 Luật Trật tự an toàn giao thông đường bộ.\n\nChương V\n\nTRÁCH NHIỆM CỦA CÁC CƠ QUAN QUẢN LÝ NHÀ NƯỚC\n\nĐiều 44. Cục Đường bộ Việt Nam\n\n1. Quản lý hoạt động vận tải bằng xe ô tô trong phạm vi cả nước.\n\n2. Thực hiện trách nhiệm theo quy định tại khoản 2 Điều 10, khoản 5 Điều 37, điểm d khoản 2 và điểm c khoản 3 Điều 46 của Thông tư này.\n\n3. Ứng dụng công nghệ thông tin trong quản lý hoạt động vận tải và dịch vụ hỗ trợ vận tải đường bộ, tổ chức triển khai áp dụng thống nhất trong toàn quốc.\n\n4. Xây dựng quy trình điện tử của dịch vụ công trực tuyến đối với các thủ tục cấp, cấp đổi Giấy phép kinh doanh vận tải bằng xe ô tô, phù hiệu, biển hiệu, thủ tục đăng ký khai thác tuyến vận tải khách cố định để áp dụng trong toàn quốc.\n\n5. Rà soát và thực hiện cắm biển hạn chế tốc độ đối với xe khách có giường nằm hai tầng tại các vị trí cần thiết, đặc biệt là khu vực có địa hình đèo, dốc, tại các vị trí có bán kính đường cong nhỏ trên các tuyến quốc lộ thuộc phạm vi quản lý.\n\n6. Thanh tra, kiểm tra và xử lý theo thẩm quyền các hành vi vi phạm quy định về tổ chức quản lý vận tải.\n\n7. Chủ trì, phối hợp với các cơ quan có liên quan chỉ đạo, đôn đốc, theo dõi thực hiện Thông tư này.\n\nĐiều 45. Sở Giao thông vận tải\n\n1. Quản lý hoạt động vận tải bằng xe ô tô và dịch vụ hỗ trợ vận tải đường bộ trên địa bàn địa phương và theo thẩm quyền.\n\n2. Báo cáo Cục Đường bộ Việt Nam về hoạt động vận tải bằng xe ô tô và dịch vụ hỗ trợ vận tải đường bộ trên địa bàn địa phương.\n\n3. Tiếp nhận, tổng hợp, phân tích, khai thác sử dụng các thông tin từ thiết bị giám sát hành trình của xe do đơn vị kinh doanh vận tải (hoặc tổ chức được ủy quyền) cung cấp và từ cơ sở dữ liệu của Cục Cảnh sát giao thông để phục vụ công tác quản lý nhà nước về giao thông vận tải.\n\n4. Xây dựng cơ sở dữ liệu, lập trang thông tin điện tử về quản lý hoạt động vận tải bằng xe ô tô của địa phương. Tổ chức thực hiện dịch vụ công trực tuyến để giải quyết các thủ tục hành chính về hoạt động vận tải bằng xe ô tô và dịch vụ hỗ trợ vận tải đường bộ theo quy định.\n\n5. Khai thác, sử dụng dữ liệu trên phần mềm quản lý bến xe khách của các bến xe để phục vụ công tác quản lý bến xe, thanh tra, kiểm tra hoạt động của các bến xe khách trên địa bàn và người lái xe kinh doanh vận tải trên địa bàn địa phương.\n\n6. Quản lý hoạt động vận tải hành khách đối với xe khách có giường nằm hai tầng\n\na) Kiểm tra, giám sát đối với các đơn vị có sử dụng xe khách có giường nằm hai tầng;\n\nb) Rà soát và thực hiện cắm biển hạn chế tốc độ đối với xe khách có giường nằm hai tầng tại các vị trí cần thiết, đặc biệt là khu vực có địa hình đèo, dốc, tại các vị trí có bán kính đường cong nhỏ trên các tuyến đường do địa phương quản lý.\n\n7. Thanh tra, kiểm tra và xử lý theo thẩm quyền các hành vi vi phạm về tổ chức, quản lý hoạt động vận tải bằng xe ô tô và hoạt động của bến xe, bãi đỗ xe, trạm dừng nghỉ, điểm dừng xe trên đường bộ trên địa bàn địa phương.\n\nChương VI\n\nTỔ CHỨC THỰC HIỆN VÀ HIỆU LỰC THI HÀNH\n\nĐiều 46. Quy định về chế độ báo cáo\n\n1. Báo cáo tình hình hoạt động vận tải của đơn vị kinh doanh vận tải; Báo cáo kết quả hoạt động của bến xe\n\na) Tên báo cáo: báo cáo kết quả hoạt động vận tải, bến xe;\n\nb) Nội dung yêu cầu báo cáo: kết quả hoạt động của đơn vị vận tải, bến xe;\n\nc) Đối tượng thực hiện báo cáo: đơn vị kinh doanh vận tải, bến xe;\n\nd) Cơ quan nhận báo cáo: Sở Giao thông vận tải;\n\nđ) Phương thức gửi, nhận báo cáo: báo cáo được thể hiện dưới hình thức văn bản giấy hoặc văn bản điện tử. Báo cáo được gửi đến cơ quan nhận báo cáo bằng một trong các phương thức sau: gửi trực tiếp, qua dịch vụ bưu chính, fax, qua hệ thống thư điện tử, hoặc các phương thức khác theo quy định của pháp luật;\n\ne) Tần suất thực hiện báo cáo: định kỳ hàng tháng;\n\ng) Thời hạn gửi báo cáo: trước ngày 20 của tháng tiếp theo kỳ báo cáo;\n\nh) Thời gian chốt số liệu báo cáo: từ ngày 01 đến ngày cuối cùng của tháng báo cáo;\n\ni) Mẫu đề cương báo cáo: theo quy định tại Phụ lục XIV, Phụ lục XV và Phụ lục XVI ban hành kèm theo Thông tư này.\n\n2. Báo cáo tình hình hoạt động vận tải đường bộ của địa phương\n\na) Tên báo cáo: báo cáo tình hình hoạt động vận tải;\n\nb) Nội dung yêu cầu báo cáo: kết quả hoạt động vận chuyển hành khách, vận tải hàng hóa; hoạt động của các bến xe trên địa bàn;\n\nc) Đối tượng thực hiện báo cáo: Sở Giao thông vận tải các tỉnh, thành phố trực thuộc Trung ương;\n\nd) Cơ quan nhận báo cáo: Cục Đường bộ Việt Nam;\n\nđ) Phương thức gửi, nhận báo cáo: báo cáo được thể hiện dưới hình thức văn bản giấy hoặc văn bản điện tử. Báo cáo được gửi đến cơ quan nhận báo cáo bằng một trong các phương thức sau: gửi trực tiếp, qua dịch vụ bưu chính, fax, qua hệ thống thư điện tử, hoặc các phương thức khác theo quy định của pháp luật;\n\ne) Tần suất thực hiện báo cáo: định kỳ hàng năm;\n\ng) Thời hạn gửi báo cáo: trước ngày 20 tháng 12 hàng năm;\n\nh) Thời gian chốt số liệu báo cáo: từ ngày 01 tháng 12 của năm trước đến ngày 30 tháng 11 năm báo cáo;\n\ni) Mẫu đề cương báo cáo: theo quy định tại Phụ lục XVII Thông tư này.\n\n3. Báo cáo tình hình hoạt động vận tải đường bộ trên phạm vi toàn quốc như sau:\n\na) Tên báo cáo: báo cáo tình hình hoạt động vận tải;\n\nb) Nội dung yêu cầu báo cáo: kết quả hoạt động vận chuyển hành khách, vận tải hàng hóa; hoạt động của các bến xe trên địa bàn;\n\nc) Đối tượng thực hiện báo cáo: Cục Đường bộ Việt Nam;\n\nd) Cơ quan nhận báo cáo: Bộ Giao thông vận tải;\n\nđ) Phương thức gửi, nhận báo cáo: báo cáo được thể hiện dưới hình thức văn bản giấy hoặc văn bản điện tử. Báo cáo được gửi đến cơ quan nhận báo cáo bằng một trong các phương thức sau: gửi trực tiếp, qua dịch vụ bưu chính, fax, qua hệ thống thư điện tử, hoặc các phương thức khác theo quy định của pháp luật;\n\ne) Tần suất thực hiện báo cáo: định kỳ hằng năm;\n\ng) Thời hạn gửi báo cáo: trước ngày 15 tháng 02 năm tiếp theo của kỳ báo cáo;\n\nh) Thời gian chốt số liệu báo cáo: từ ngày 01 tháng 12 của năm trước đến ngày 30 tháng 11 năm báo cáo;\n\ni) Mẫu đề cương báo cáo: theo quy định tại Phụ lục XVIII ban hành kèm theo Thông tư này.\n\nĐiều 47. Điều khoản thi hành\n\n1. Thông tư này có hiệu lực thi hành kể từ ngày 01 tháng 01 năm 2025.\n\n2. Bãi bỏ các Thông tư:']","Không tìm thấy thông tin liên quan tới câu hỏi này.  Các văn bản được cung cấp tập trung vào quy định về đầu tư điểm dừng xe, đỗ xe trên đường cao tốc và xử phạt vi phạm hành chính về trật tự, an toàn giao thông đường bộ, không đề cập đến quy định về đỗ xe trên vỉa hè.
","Cấm đỗ xe trên vỉa hè, trừ những nơi có biển báo cho phép.",0.4,0.0,0.0,0.49999999995
18,Luật Giao thông Đường bộ 2025 có quy định gì về việc sử dụng làn đường dành cho xe buýt?,"['Điều 21. Quy định về ngừng khai thác trên tuyến, đóng tuyến xe buýt; bổ sung xe, thay thế xe buýt khai thác trên tuyến\n\n1. Ngừng khai thác trên tuyến, đóng tuyến xe buýt\n\na) Trước khi ngừng khai thác ít nhất 30 ngày, đơn vị kinh doanh vận tải có văn bản thông báo ngừng khai thác trên tuyến gửi Sở Giao thông vận tải nơi cấp Giấy phép kinh doanh vận tải bằng xe ô tô.\n\nTrường hợp ngừng khai thác dẫn đến phải thay đổi tần suất chạy xe trên tuyến hoặc phải đóng tuyến, trong thời hạn 10 ngày làm việc kể từ ngày nhận được thông báo của đơn vị kinh doanh vận tải, Sở Giao thông vận tải nơi cấp Giấy phép kinh doanh vận tải bằng xe ô tô (hoặc thống nhất với Sở Giao thông vận tải đầu tuyến bên kia đối với tuyến xe buýt liên tỉnh) công bố tần suất chạy xe mới hoặc công bố đóng tuyến trên cơ sở đề nghị của đơn vị kinh doanh vận tải;\n\nb) Sở Giao thông vận tải có trách nhiệm công bố trên các phương tiện thông tin đại chúng chậm nhất 15 ngày làm việc kể từ ngày nhận được thông báo;\n\nc) Sau thời điểm ngừng khai thác tối đa 05 ngày làm việc, đơn vị kinh doanh vận tải phải nộp lại phù hiệu của các xe ngừng khai thác cho Sở Giao thông vận tải nơi cấp.\n\n2. Bổ sung xe, thay thế xe buýt\n\na) Đơn vị kinh doanh vận tải được thay thế xe đang khai thác trên tuyến hoặc được bổ sung xe nếu việc bổ sung không làm tăng số chuyến xe. Xe được bổ sung, thay thế phải có phù hiệu “XE BUÝT” và phải đảm bảo các yêu cầu về loại phương tiện tham gia khai thác tuyến theo hợp đồng đã ký kết;\n\nb) Đơn vị kinh doanh vận tải được sử dụng các phương tiện bất kỳ của đơn vị mình đã được cấp phù hiệu “XE BUÝT” để thay thế xe đột xuất khi xe đang hoạt động trên tuyến gặp sự cố kỹ thuật hoặc tai nạn giao thông hoặc do các nguyên nhân bất khả kháng khác.\n\nĐiều 22. Quyền hạn và trách nhiệm của đơn vị kinh doanh vận tải hành khách công cộng bằng xe buýt\n\n1. Tổ chức, thực hiện đúng biểu đồ chạy xe theo phương án khai thác đã ký kết trong hợp đồng.\n\n2. Thực hiện các quy định tại Điều 4 của Thông tư này.\n\n3. Xây dựng quy định nội bộ về đồng phục và thẻ tên cho người lái xe, nhân viên phục vụ trên xe, thẻ nhận dạng người lái xe; thẻ tên phải có ảnh, ghi rõ họ tên, đơn vị quản lý, thẻ tên có thể kết hợp với thẻ nhận dạng người lái xe.\n\n4. Được sử dụng thiết bị điện tử để niêm yết thông tin theo quy định tại khoản 2, khoản 3 và khoản 4 Điều 7 của Thông tư này.\n\n5. Thực hiện các trách nhiệm khác theo quy định tại Luật Đường bộ, Luật Trật tự, an toàn giao thông đường bộ; tuân thủ và duy trì các điều kiện kinh doanh đối với đơn vị kinh doanh vận tải hành khách công cộng bằng xe buýt trong quá trình hoạt động kinh doanh vận tải hành khách công cộng bằng xe buýt.\n\nĐiều 23. Quyền hạn và trách nhiệm của người lái xe, nhân viên phục vụ trên xe buýt\n\n1. Đeo thẻ tên, mặc đồng phục theo đúng mẫu đơn vị kinh doanh vận tải đã quy định.\n\n2. Thực hiện đúng biểu đồ, hành trình chạy xe đã được phê duyệt.\n\n3. Cung cấp thông tin về hành trình tuyến, các điểm dừng trên tuyến khi hành khách yêu cầu; hướng dẫn và giúp đỡ hành khách (đặc biệt là người khuyết tật, người cao tuổi, phụ nữ có thai và trẻ em) khi lên, xuống xe; có thái độ phục vụ văn minh, lịch sự.\n\n4. Giữ gìn vệ sinh phương tiện.\n\n5. Thực hiện các trách nhiệm khác theo quy định tại Luật Đường bộ, Luật Trật tự, an toàn giao thông đường bộ; tuân thủ và duy trì các điều kiện kinh doanh đối với người lái xe, nhân viên phục vụ trên xe buýt trong quá trình hoạt động kinh doanh vận tải hành khách công cộng bằng xe buýt.\n\nĐiều 24. Quyền hạn, trách nhiệm của hành khách đi xe buýt\n\n1. Mang theo hành lý với trọng lượng không quá 10 kg và kích thước không quá 30x40x60 cm. Đối với hành khách đi trên xe của tuyến xe buýt có điểm đầu hoặc điểm cuối nằm trong khu vực cảng hàng không, tuyến xe buýt liên tỉnh hành khách được mang theo hành lý với trọng lượng không quá 20 kg và kích thước phù hợp với thiết kế của xe.\n\n2. Chấp hành các quy định khi đi xe và sự hướng dẫn của người lái xe, nhân viên phục vụ trên xe.\n\n3. Yêu cầu nhân viên phục vụ trên xe xuất vé đúng loại sau khi trả tiền; giữ vé suốt hành trình và xuất trình vé khi người có thẩm quyền yêu cầu kiểm tra.\n\n4. Khiếu nại, kiến nghị, phản ánh những hành vi vi phạm quy định về quản lý vận tải của đơn vị kinh doanh vận tải, người lái xe, nhân viên phục vụ trên xe và yêu cầu bồi thường thiệt hại (nếu có).\n\n5. Thực hiện các trách nhiệm khác theo quy định tại Luật Đường bộ, Luật Trật tự, an toàn giao thông đường bộ.\n\nMục 4. KINH DOANH VẬN TẢI HÀNH KHÁCH BẰNG XE TAXI\n\nĐiều 25. Quy định đối với xe taxi\n\n1. Tuân thủ và duy trì các điều kiện kinh doanh đối với xe taxi trong quá trình hoạt động kinh doanh vận tải hành khách bằng xe taxi.\n\n2. Thực hiện niêm yết thông tin như sau:\n\na) Hai bên cánh cửa xe: tên, số điện thoại và biểu trưng (logo) của đơn vị kinh doanh vận tải với kích thước tối thiểu: chiều dài là 20 cm, chiều rộng là 20 cm; bảng giá cước đã kê khai theo mẫu quy định tại Phụ lục III ban hành kèm theo Thông tư này;\n\nb) Trong xe: bảng giá cước tính tiền theo kilômét (km), giá cước tính tiền cho thời gian xe phải chờ đợi theo yêu cầu của hành khách và các chi phí khác (nếu có) mà hành khách phải trả; bảng giá cước đã kê khai theo mẫu quy định tại Phụ lục III ban hành kèm theo Thông tư này;\n\nc) Trường hợp xe taxi sử dụng phần mềm tính tiền phải hiển thị trên giao diện dành cho hành khách bảng giá cước đã kê khai theo mẫu quy định tại Phụ lục III ban hành kèm theo Thông tư này.\n\n3. Việc đảm bảo điều kiện an toàn về phòng cháy và chữa cháy thực hiện theo quy định tại khoản 4 Điều 8 Thông tư này.\n\n4. Trong xe phải có Bảng hướng dẫn về an toàn giao thông và thoát hiểm cho hành khách, các nội dung chính gồm: hướng dẫn cài dây an toàn (nếu có); bảng cấm hút thuốc trên xe; hướng dẫn đóng, mở cửa xe đảm bảo an toàn.\n\nĐiều 26. Điểm dừng đón, trả khách công cộng, điểm đỗ xe taxi\n\n1. Điểm dừng đón, trả khách công cộng cho xe taxi phải đảm bảo an toàn giao thông và được báo hiệu bằng biển báo, vạch sơn kẻ đường theo quy định về tổ chức giao thông.\n\n2. Điểm đỗ xe taxi\n\na) Điểm đỗ xe taxi gồm 02 loại: điểm đỗ xe taxi do đơn vị kinh doanh vận tải tổ chức và quản lý; điểm đỗ xe taxi công cộng do cơ quan quản lý nhà nước của địa phương tổ chức và quản lý;\n\nb) Yêu cầu đối với điểm đỗ xe taxi: đảm bảo trật tự, an toàn và không gây ùn tắc giao thông; đáp ứng yêu cầu về phòng, chống cháy nổ và vệ sinh môi trường.\n\nĐiều 27. Quyền hạn và trách nhiệm của đơn vị kinh doanh vận tải hành khách bằng xe taxi\n\n1. Thực hiện các quy định tại Điều 4 của Thông tư này.\n\n2. Xây dựng quy định đồng phục và thẻ tên cho người lái xe, thẻ nhận dạng người lái xe; thẻ tên phải có ảnh, ghi rõ họ tên, đơn vị quản lý, thẻ tên có thể kết hợp với thẻ nhận dạng người lái xe.\n\n3. Được sử dụng thiết bị điện tử để niêm yết thông tin theo quy định tại khoản 2 Điều 25 của Thông tư này.\n\n4. Thực hiện các trách nhiệm khác theo quy định tại Luật Đường bộ, Luật Trật tự, an toàn giao thông đường bộ; tuân thủ và duy trì các điều kiện kinh doanh đối với đơn vị kinh doanh vận tải hành khách bằng xe taxi trong quá trình hoạt động kinh doanh vận tải hành khách bằng xe taxi.\n\nĐiều 28. Quyền hạn, trách nhiệm của người lái xe taxi\n\n1. Đeo thẻ tên, mặc đồng phục theo đúng quy định của đơn vị kinh doanh vận tải.\n\n2. Thu tiền cước của hành khách khi kết thúc hành trình theo đồng hồ tính tiền hoặc theo thông báo trên phần mềm hoặc theo thỏa thuận giữa hành khách với đơn vị kinh doanh vận tải.\n\n3. Giữ gìn vệ sinh phương tiện.\n\n4. Cung cấp thông tin về tuyến đường khi hành khách yêu cầu; hướng dẫn và giúp đỡ hành khách (đặc biệt là người khuyết tật, người cao tuổi, phụ nữ có thai và trẻ em) khi lên, xuống xe.\n\n5. Thực hiện các trách nhiệm khác theo quy định tại Luật Đường bộ, Luật Trật tự, an toàn giao thông đường bộ.\n\nĐiều 29. Quyền hạn, trách nhiệm của hành khách đi xe taxi\n\n1. Yêu cầu người lái xe cung cấp thông tin về hành trình chạy xe.', 'BỘ\xa0GIAO THÔNG VẬN TẢI\n------- CỘNG HÒA XÃ HỘI CHỦ NGHĨA VIỆT NAM\nĐộc lập - Tự do - Hạnh phúc\n--------------- Số: 32/2024/TT-BGTVT Hà Nội, ngày 13 tháng 11 năm 2024\n\nTHÔNG TƯ\n\nQUY ĐỊNH VỀ QUẢN LÝ GIÁ DỊCH VỤ SỬ DỤNG ĐƯỜNG BỘ CỦA CÁC DỰ ÁN ĐẦU TƯ XÂY DỰNG ĐƯỜNG BỘ ĐỂ KINH DOANH, DO TRUNG ƯƠNG QUẢN LÝ\xa0\n\nCăn cứ Luật Giá ngày 19 tháng 6 năm 2023;\n\nCăn cứ Luật Đường bộ ngày 27 tháng 06 năm 2024;\n\nCăn cứ Nghị định số 85/2024/NĐ-CP ngày 10 tháng 07 năm 2024 của Chính phủ quy định chi tiết một số điều của Luật Giá;\n\nCăn cứ Nghị định số 56/2022/NĐ-CP ngày 24 tháng 8 năm 2022 của Chính phủ quy định chức năng, nhiệm vụ, quyền hạn và cơ cấu tổ chức của Bộ Giao thông vận tải;\n\nTheo đề nghị của Vụ trưởng Vụ Tài chính, Cục trưởng Cục Đường bộ Việt Nam;\n\nBộ trưởng Bộ Giao thông vận tải ban hành Thông tư quy định về quản lý giá dịch vụ sử dụng đường bộ của các dự án đầu tư xây dựng đường bộ để kinh doanh, do trung ương quản lý.\n\nChương I\n\nQUY ĐỊNH CHUNG\n\nĐiều 1. Phạm vi điều chỉnh và đối tượng áp dụng\n\n1. Thông tư này quy định về quản lý giá, các trường hợp miễn và giảm giá dịch vụ sử dụng đường bộ của các dự án đầu tư xây dựng đường bộ (trừ dịch vụ sử dụng đường bộ cao tốc) để kinh doanh, do trung ương quản lý.\n\n2. Thông tư này áp dụng đối với tổ chức, cá nhân liên quan đến việc kinh doanh, sử dụng và quản lý giá dịch vụ sử dụng đường bộ đối với các dự án đầu tư xây dựng đường bộ (trừ dịch vụ sử dụng đường bộ cao tốc) để kinh doanh, do trung ương quản lý.\n\nĐiều 2. Đối tượng và chủ phương tiện phải thanh toán tiền dịch vụ sử dụng đường bộ\n\n1. Đối tượng thanh toán tiền dịch vụ sử dụng đường bộ là phương tiện giao thông đường bộ lưu thông qua trạm thu phí của dự án đầu tư xây dựng đường bộ để kinh doanh do trung ương quản lý (sau đây gọi tắt là phương tiện).\n\n\n\n2. Tổ chức, cá nhân sở hữu, sử dụng hoặc quản lý phương tiện (sau đây gọi tắt là chủ phương tiện) thuộc đối tượng thanh toán tiền dịch vụ sử dụng đường bộ quy định tại khoản 1 Điều này phải thanh toán tiền dịch vụ sử dụng đường bộ, trừ các trường hợp quy định tại Điều 3 của Thông tư này.\n\nĐiều 3. Đối tượng miễn thu tiền dịch vụ sử dụng đường bộ\n\n1. Xe cứu thương.\n\n2. Xe chữa cháy của lực lượng Cảnh sát phòng cháy, chữa cháy và cứu nạn, cứu hộ và xe chữa cháy của lực lượng khác được huy động đi làm nhiệm vụ chữa cháy có tín hiệu ưu tiên theo quy định của pháp luật.\n\n3. Xe máy nông nghiệp, lâm nghiệp gồm: máy cày, máy bừa, máy xới, máy làm cỏ, máy tuốt lúa.\n\n4. Xe chuyên dùng phục vụ quốc phòng bao gồm các xe mang biển số: nền màu đỏ, chữ và số màu trắng dập chìm có gắn các thiết bị chuyên dụng cho quốc phòng (bao gồm: xe xi téc, xe cần cẩu, xe chở lực lượng vũ trang hành quân được hiểu là xe ô tô chở người có từ 12 chỗ ngồi trở lên, xe vận tải có mui che và được lắp đặt ghế ngồi trong thùng xe, xe kiểm soát, xe kiểm tra quân sự, xe chuyên dùng chở phạm nhân, xe cứu hộ, cứu nạn, xe thông tin vệ tinh, các xe ô tô đặc chủng khác phục vụ quốc phòng), xe đang đi làm nhiệm vụ khẩn cấp sử dụng một trong các tín hiệu ưu tiên theo quy định của pháp luật trong trường hợp làm nhiệm vụ khẩn cấp.\n\n5. Xe chuyên dùng của các đơn vị thuộc hệ thống tổ chức của lực lượng Công an nhân dân bao gồm:\n\na) Xe ô tô tuần tra kiểm soát giao thông của cảnh sát giao thông có đặc điểm: trên nóc xe ô tô có đèn xoay và hai bên thân xe ô tô có in dòng chữ “CẢNH SÁT GIAO THÔNG”;\n\nb) Xe ô tô cảnh sát 113 có in dòng chữ “CẢNH SÁT 113” ở hai bên thân xe;\n\nc) Xe ô tô cảnh sát cơ động có in dòng chữ “CẢNH SÁT CƠ ĐỘNG” ở hai bên thân xe;\n\nd) Xe vận tải có lắp ghế ngồi trong thùng xe của lực lượng Công an nhân dân làm nhiệm vụ;\n\nđ) Xe chở phạm nhân, xe cứu hộ, cứu nạn và các xe chuyên dùng khác của lực lượng Công an nhân dân;\n\ne) Xe đặc chủng (xe thông tin vệ tinh, xe chống đạn, xe phòng chống khủng bố, chống bạo loạn và các xe đặc chủng khác của lực lượng Công an nhân dân);\n\ng) Xe của lực lượng Công an đang đi làm nhiệm vụ khẩn cấp sử dụng tín hiệu ưu tiên theo quy định của pháp luật.\n\n6. Xe chuyên dùng phục vụ tang lễ, gồm:\n\n\n\na) Xe có kết cấu chuyên dùng phục vụ tang lễ (bao gồm: xe tang, xe tải lạnh dùng để lưu xác và chở xác);\n\nb) Các xe phục vụ tang lễ (bao gồm: xe chở khách đi cùng xe tang, xe chở hoa, xe rước ảnh) là xe chỉ sử dụng cho hoạt động tang lễ có giấy chứng nhận đăng ký xe mang tên đơn vị phục vụ tang lễ. Đơn vị phục vụ tang lễ có văn bản cam kết các loại xe này chỉ sử dụng cho hoạt động tang lễ gửi nhà cung cấp dịch vụ thanh toán điện tử (trong đó nêu cụ thể số lượng xe, biển số xe).\n\n7. Đoàn xe có xe cảnh sát giao thông dẫn đường.\n\n8. Xe của lực lượng quốc phòng tham gia diễn tập, hành quân cơ động lực lượng, vận chuyển vũ khí, trang bị có xe chuyên dụng quân sự dẫn đường.\n\n9. Xe ô tô của lực lượng công an, quốc phòng sử dụng vé đường bộ toàn quốc theo quy định.\n\n10. Xe hộ đê; xe đang làm nhiệm vụ khẩn cấp phòng, chống lụt bão theo điều động của cấp có thẩm quyền.\n\n11. Xe làm nhiệm vụ vận chuyển thuốc men, máy móc, thiết bị, vật tư, hàng hóa đến những nơi bị thảm họa hoặc đến vùng có dịch bệnh theo quy định của pháp luật về tình trạng khẩn cấp khi có thảm họa lớn, dịch bệnh nguy hiểm.\n\n12. Xe mô tô, xe gắn máy, xe thô sơ.\n\nChương II\n\nQUẢN LÝ GIÁ, VÉ DỊCH VỤ SỬ DỤNG ĐƯỜNG BỘ\n\nĐiều 4. Định giá dịch vụ sử dụng đường bộ\n\n1. Giá tối đa dịch vụ sử dụng đường bộ được định giá theo nguyên tắc và căn cứ quy định tại Điều 22 Luật Giá.\n\n2. Cục Đường bộ Việt Nam quyết định áp dụng phương pháp định giá theo quy định pháp luật về giá.\n\n3. Khi các yếu tố hình thành giá dịch vụ sử dụng đường bộ thay đổi ảnh hưởng đến giá tối đa dịch vụ sử dụng đường bộ, Cục Đường bộ Việt Nam tổ chức lựa chọn các Doanh nghiệp dự án đầu tư xây dựng đường bộ để kinh doanh (Doanh nghiệp dự án) lập phương án giá.\n\n4. Các doanh nghiệp dự án được lựa chọn lập phương án giá có trách nhiệm lập phương án giá theo quy định pháp luật về giá, báo cáo, giải trình về phương án giá, cung cấp các tài liệu, hồ sơ phương án giá theo yêu cầu của Cục Đường bộ Việt Nam và chịu trách nhiệm về phương án giá do mình lập.\n\n5. Cục Đường bộ Việt Nam có trách nhiệm thẩm định phương án giá, trình Bộ Giao thông vận tải ban hành văn bản quy định mức giá tối đa cho dịch vụ sử dụng đường bộ.\n\n6. Việc lập, thẩm định hồ sơ phương án giá, ban hành văn bản định giá hoặc điều chỉnh giá thực hiện theo quy định pháp luật về giá.\n\nĐiều 5. Mức giá tối đa cho dịch vụ sử dụng đường bộ\n\nMức giá tối đa cho một lần sử dụng dịch vụ đường bộ là mức thu tối đa quy định cho một lượt phương tiện khi tham gia giao thông qua trạm thu phí.\n\nĐiều 6. Nguyên tắc xác định mức giá cụ thể, mức giảm và đối tượng giảm giá cụ thể cho dịch vụ sử dụng đường bộ\n\n1. Mức giá cụ thể cho một lần phương tiện sử dụng dịch vụ đường bộ (sau đây gọi tắt là mức giá lượt) không cao hơn mức giá tối đa đối với từng loại phương tiện theo Quyết định ban hành mức giá tối đa cho dịch vụ sử dụng đường bộ của Bộ trưởng Bộ Giao thông vận tải.\n\n2. Mức giá tháng là mức thu đối với một phương tiện tham gia giao thông qua trạm thu phí trong thời hạn 30 ngày. Mức giá tháng được tính bằng 30 (ba mươi) lần mức giá quy định tại khoản 1 Điều này.\n\n3. Mức giá quý là mức thu đối với một phương tiện tham gia giao thông qua trạm thu phí trong thời hạn 90 ngày. Mức giá quý được tính bằng 3 (ba) lần mức giá tháng và chiết khấu 10%.\n\n4. Mức giá lượt, mức giá tháng, mức giá quý cho dịch vụ sử dụng đường bộ đối với từng dự án áp dụng cho từng loại phương tiện được cơ quan có thẩm quyền và Nhà đầu tư, Doanh nghiệp dự án thống nhất tại hợp đồng dự án.\n\n5. Căn cứ tình hình kinh tế xã hội theo từng thời kỳ của địa phương nơi đặt trạm thu phí sử dụng đường bộ, các bên ký hợp đồng dự án thống nhất mức giảm và đối tượng giảm giá cụ thể cho dịch vụ sử dụng đường bộ trên nguyên tắc đảm bảo tính khả thi về phương án tài chính của dự án, đảm bảo hài hòa lợi ích Nhà nước, Nhà đầu tư, người sử dụng dịch vụ đường bộ và phù hợp với quy định của pháp luật.\n\nĐiều 7. Quản lý vé sử dụng đường bộ', 'Điều 16. Quyền hạn, trách nhiệm của hành khách đi xe\n\n1. Yêu cầu đơn vị kinh doanh vận tải cung cấp dịch vụ theo tiêu chuẩn chất lượng dịch vụ đã công bố và niêm yết.\n\n2. Yêu cầu nhân viên phục vụ trên xe xuất vé đúng loại sau khi trả tiền; giữ vé suốt hành trình và xuất trình vé khi người có thẩm quyền kiểm tra.\n\n3. Nhận lại số tiền vé theo quy định tại khoản 4 Điều 14 của Thông tư này.\n\n4. Khiếu nại, kiến nghị, phản ánh những hành vi vi phạm quy định về quản lý vận tải của đơn vị kinh doanh vận tải, người lái xe, nhân viên phục vụ trên xe và yêu cầu bồi thường thiệt hại (nếu có).\n\n5. Chấp hành các quy định để đảm bảo an toàn, an ninh trật tự trên xe; lên, xuống xe tại bến xe hoặc các điểm dừng đón, trả khách theo quy định.\n\n6. Thực hiện các trách nhiệm khác theo quy định tại Luật Đường bộ, Luật Trật tự, an toàn giao thông đường bộ.\n\nMục 3. KINH DOANH VẬN TẢI HÀNH KHÁCH CÔNG CỘNG BẰNG XE BUÝT\n\nĐiều 17. Quy định đối với xe buýt\n\n1. Tuân thủ và duy trì các điều kiện kinh doanh đối với xe buýt trong quá trình hoạt động kinh doanh vận tải hành khách công cộng bằng xe buýt.\n\n2. Trên xe phải trang bị dụng cụ thoát hiểm; việc đảm bảo điều kiện an toàn về phòng cháy và chữa cháy thực hiện theo quy định tại khoản 4 Điều 8 Thông tư này.\n\n3. Niêm yết thông tin\n\na) Niêm yết bên ngoài xe\n\nPhía trên kính trước và sau xe: số hiệu tuyến hoặc mã số tuyến, điểm đầu, điểm cuối của tuyến; chiều cao chữ tối thiểu 06 cm;\n\nHai bên thành xe: số hiệu tuyến hoặc mã số tuyến, số điện thoại của đơn vị kinh doanh vận tải với kích thước tối thiểu: chiều dài là 20 cm, chiều rộng là 20 cm; giá vé (giá cước) đã kê khai theo mẫu quy định tại Phụ lục III ban hành kèm theo Thông tư này;\n\nb) Niêm yết bên trong xe: biển số đăng ký xe (biển kiểm soát xe), số hiệu tuyến hoặc mã số tuyến; sơ đồ vị trí điểm đầu, điểm cuối và các điểm dừng dọc tuyến; giá vé (giá cước) đã kê khai theo mẫu quy định tại Phụ lục III ban hành kèm theo Thông tư này; số điện thoại đường dây nóng của đơn vị kinh doanh vận tải và Sở Giao thông vận tải địa phương; trách nhiệm của người lái xe, nhân viên phục vụ trên xe và hành khách;\n\nc) Bên trong xe có bảng hướng dẫn về an toàn giao thông và thoát hiểm ở vị trí hành khách dễ quan sát, các nội dung chính gồm: hướng dẫn cài dây an toàn (nếu có); hướng dẫn sắp xếp hành lý; biển cấm hút thuốc trên xe; hướng dẫn sử dụng hệ thống điện trên xe (nếu có); hướng dẫn cách sử dụng bình cứu hỏa, búa thoát hiểm và hướng thoát hiểm khi xảy ra sự cố.\n\nĐiều 18. Điểm đầu, điểm cuối, điểm dừng và nhà chờ xe buýt, lệnh vận chuyển\n\n1. Điểm đầu, điểm cuối của tuyến xe buýt\n\na) Có đủ diện tích cho xe buýt quay trở đầu xe, đỗ xe đảm bảo an toàn giao thông theo phương án tổ chức giao thông;\n\nb) Có bảng thông tin các nội dung: tên tuyến; số hiệu tuyến; hành trình; tần suất chạy xe; thời gian hoạt động trong ngày của tuyến; số điện thoại của cơ quan quản lý tuyến và đơn vị kinh doanh vận tải tham gia khai thác tuyến; trách nhiệm của hành khách, người lái xe, nhân viên phục vụ trên xe (nếu có);\n\nc) Có nhà chờ cho hành khách.\n\n2. Điểm dừng xe buýt\n\na) Khu vực xe buýt dừng đón, trả khách được báo hiệu bằng biển báo và vạch sơn kẻ đường; trên biển báo hiệu phải ghi số hiệu tuyến hoặc mã số tuyến, tên tuyến (điểm đầu - điểm cuối), hành trình tuyến rút gọn ở phía sau biển báo;\n\nb) Biển báo điểm dừng xe buýt đảm bảo phù hợp với Quy chuẩn kỹ thuật quốc gia về báo hiệu đường bộ.\n\n3. Tại các bến xe khách, nhà ga đường sắt, cảng hàng không, cảng, bến thủy nội địa, cảng biển có hành trình tuyến xe buýt đi qua phải bố trí điểm dừng đón, trả khách cho xe buýt để kết nối với các phương thức vận tải khác.\n\n4. Nhà chờ xe buýt\n\na) Sở Giao thông vận tải công bố mẫu nhà chờ xe buýt áp dụng trong phạm vi địa phương mình;\n\nb) Tại nhà chờ xe buýt phải niêm yết các thông tin: số hiệu tuyến, tên tuyến, hành trình, tần suất chạy xe, thời gian hoạt động trong ngày của tuyến, số điện thoại đường dây nóng của đơn vị kinh doanh vận tải và Sở Giao thông vận tải địa phương, bản đồ hoặc sơ đồ mạng lưới tuyến.\n\n5. Điểm đầu, điểm cuối, điểm dừng và nhà chờ xe buýt phải được xây dựng đảm bảo thuận tiện cho người khuyết tật tiếp cận sử dụng.\n\n6. Lệnh vận chuyển\n\na) Lệnh vận chuyển bằng bản giấy hoặc điện tử do đơn vị kinh doanh vận tải phát hành theo mẫu quy định tại Phụ lục IV ban hành kèm theo Thông tư này.\n\nKhi thực hiện chuyến đi, lái xe mang theo lệnh vận chuyển bằng bản giấy hoặc có thiết bị truy cập được nội dung của lệnh vận chuyển điện từ; xuất trình lệnh vận chuyển bản giấy hoặc bản điện tử khi lực lượng chức năng yêu cầu.\n\nb) Đơn vị kinh doanh vận tải có trách nhiệm quản lý, cấp và kiểm tra việc sử dụng lệnh vận chuyển.\n\nĐiều 19. Công bố mở tuyến vận tải hành khách công cộng bằng xe buýt\n\n1. Sở Giao thông vận tải công bố mở tuyến vận tải hành khách công cộng bằng xe buýt tại địa phương theo danh mục mạng lưới tuyến được Ủy ban nhân dân cấp tỉnh phê duyệt.\n\n2. Nội dung công bố mở tuyến xe buýt\n\na) Đơn vị kinh doanh vận tải khai thác tuyến;\n\nb) Số hiệu tuyến hoặc mã số tuyến; cự ly; hành trình (điểm đầu, điểm cuối, điểm dừng);\n\nc) Biểu đồ chạy xe, thời gian hoạt động của tuyến;\n\nd) Nhãn hiệu, sức chứa, màu sơn đặc trưng của xe hoạt động trên tuyến;\n\nđ) Giá vé.\n\n3. Sở Giao thông vận tải phải công bố trên Trang thông tin điện tử của Sở các nội dung quy định tại khoản 2 Điều này chậm nhất 15 ngày, trước khi thực hiện hoạt động vận chuyển hành khách trên tuyến xe buýt.\n\nĐiều 20. Quản lý vận tải hành khách bằng xe buýt\n\n1. Sở Giao thông vận tải tổ chức thực hiện việc đấu thầu hoặc đặt hàng khai thác tuyến vận tải hành khách công cộng bằng xe buýt sử dụng nguồn ngân sách địa phương theo quy định của pháp luật về sản xuất và cung ứng sản phẩm, dịch vụ công ích.\n\n2. Đơn vị kinh doanh vận tải có Giấy phép kinh doanh vận tải hành khách bằng xe ô tô loại hình vận tải bằng xe buýt được đăng ký tham gia đấu thầu hoặc được đặt hàng khai thác tuyến vận tải hành khách công cộng bằng xe buýt.\n\n3. Sở Giao thông vận tải địa phương ký hợp đồng khai thác tuyến với đơn vị kinh doanh vận tải trúng thầu hoặc được đặt hàng. Trong hợp đồng phải thể hiện rõ phương án khai thác tuyến bao gồm: tên tuyến, số hiệu tuyến, nhãn hiệu xe, sức chứa của xe, giá vé, biểu đồ chạy xe trên tuyến, thời hạn hợp đồng.\n\n4. Sở Giao thông vận tải quyết định điều chỉnh một phần hoặc toàn bộ biểu đồ, hành trình chạy xe trên tuyến xe buýt nội tỉnh khi có sự thay đổi về tổ chức giao thông dẫn đến phải thay đổi hành trình hoặc trong trường hợp thiên tai, bão lụt hoặc trong trường hợp bất khả kháng khác hoặc theo đề nghị của đơn vị kinh doanh vận tải đang khai thác tuyến phù hợp với nhu cầu và điều kiện thực tế tại từng thời điểm; đơn vị kinh doanh vận tải điều chỉnh phương án khai thác tuyến tương ứng với biểu đồ chạy xe mới điều chỉnh.\n\n5. Đối với các tuyến xe buýt đi qua địa bàn nhiều tỉnh, thành phố, việc điều chỉnh biểu đồ, hành trình chạy xe, ngừng khai thác hoặc đóng tuyến do Sở Giao thông vận tải có tuyến xe buýt nơi đơn vị kinh doanh vận tải đặt trụ sở chính hoặc trụ sở chi nhánh thực hiện sau khi có văn bản thống nhất với Sở Giao thông vận tải địa phương đầu tuyến bên kia; thông báo đến các Sở Giao thông vận tải có tuyến xe buýt đi qua trước khi thực hiện.\n\n6. Quyết định điều chỉnh biểu đồ chạy xe được công bố trên các phương tiện thông tin đại chúng chậm nhất 10 ngày trước khi thực hiện điều chỉnh biểu đồ.\n\nĐiều 21. Quy định về ngừng khai thác trên tuyến, đóng tuyến xe buýt; bổ sung xe, thay thế xe buýt khai thác trên tuyến\n\n1. Ngừng khai thác trên tuyến, đóng tuyến xe buýt\n\na) Trước khi ngừng khai thác ít nhất 30 ngày, đơn vị kinh doanh vận tải có văn bản thông báo ngừng khai thác trên tuyến gửi Sở Giao thông vận tải nơi cấp Giấy phép kinh doanh vận tải bằng xe ô tô.']","Tôi xin lỗi, nhưng tôi không tìm thấy thông tin liên quan đến quy định về việc sử dụng làn đường dành cho xe buýt trong các văn bản được cung cấp.  Các văn bản tập trung vào các quy định khác liên quan đến hoạt động kinh doanh vận tải hành khách bằng xe buýt, bao gồm việc đăng ký, khai thác tuyến, quản lý xe và nhân sự, chứ không đề cập cụ thể đến việc sử dụng làn đường.
",Cấm các phương tiện không phải xe buýt sử dụng làn đường dành riêng cho xe buýt trong giờ cao điểm.,1.0,0.0,0.0,0.0
