,user_input,retrieved_contexts,response,reference,faithfulness,answer_relevancy,context_recall,context_precision
0,Luật Giao thông Đường bộ 2025 có những thay đổi gì về phân hạng giấy phép lái xe?,"['Quá hạn dưới 01 năm, phải dự sát hạch lý thuyết để cấp giấy phép lái xe theo quy định tại điểm a khoản 1 Điều 17 Thông tư này.\n\nQuá hạn từ 01 năm trở lên kể từ ngày hết hạn phải sát hạch lý thuyết, thực hành lái xe trong hình và trên đường để cấp giấy phép lái xe theo quy định tại khoản 1, khoản 2 và khoản 3 Điều 17 Thông tư này.\n\nHồ sơ dự sát hạch thực hiện theo quy định tại khoản 3 Điều 29 của Thông tư này;\n\nc) Ngày trúng tuyển ghi tại mặt sau giấy phép lái xe được tính theo ngày trúng tuyển của giấy phép lái xe cũ;\n\nd) Người dự sát hạch có nhu cầu ôn tập, đăng ký với các cơ sở đào tạo lái xe để được hướng dẫn ôn tập, phải nộp phí ôn tập theo quy định, không phải học lại theo chương trình đào tạo;\n\nđ) Trường hợp không đạt kết quả để được cấp giấy phép lái xe, người có giấy phép lái xe quá thời hạn sử dụng, bị mất nhưng quá thời hạn sử dụng phải đăng ký với Sở Giao thông vận tải để tham gia sát hạch lại.\n\n3. Chưa sát hạch cấp giấy phép lái xe đối với người vi phạm trật tự, an toàn giao thông đường bộ chưa thực hiện xong yêu cầu của cơ quan nhà nước có thẩm quyền về giải quyết, xử lý vụ việc vi phạm hành chính trong lĩnh vực trật tự, an toàn giao thông đường bộ.\n\nĐiều 35. Cấp lại giấy phép lái xe\n\n1. Người có giấy phép lái xe bị mất, còn thời hạn sử dụng được xét cấp lại giấy phép lái xe. Việc cấp lại giấy phép lái xe bị mất thực hiện theo quy định tại các khoản 2, khoản 3 và khoản 4 Điều 36 Thông tư này.\n\n2. Ngày trúng tuyển ghi tại mặt sau giấy phép lái xe được tính theo ngày trúng tuyển của giấy phép lái xe cũ.\n\n3. Không cấp lại giấy phép lái xe đối với các trường hợp sau: giấy phép lái xe không có trong hệ thống thông tin giấy phép lái xe tại Cục Đường bộ Việt Nam, bảng kê danh sách cấp giấy phép lái xe (sổ quản lý); chưa cấp lại giấy phép lái xe đối với người vi phạm trật tự, an toàn giao thông đường bộ chưa thực hiện xong yêu cầu của cơ quan nhà nước có thẩm quyền về giải quyết, xử lý vụ việc vi phạm hành chính trong lĩnh vực trật tự, an toàn giao thông đường bộ.\n\nĐiều 36. Đổi giấy phép lái xe do ngành Giao thông vận tải cấp\n\n1. Yêu cầu đối với việc đổi giấy phép lái xe\n\na) Người Việt Nam, người nước ngoài được đào tạo, sát hạch, cấp giấy phép lái xe tại Việt Nam;\n\nb) Người có giấy phép lái xe do ngành Giao thông vận tải cấp bị hỏng không còn sử dụng được;\n\nc) Người Việt Nam, người nước ngoài có thẻ thường trú ở Việt Nam đã có giấy phép lái xe Việt Nam đổi từ giấy phép lái xe nước ngoài, khi hết hạn nếu có nhu cầu được đổi giấy phép lái xe;\n\nd) Trường hợp ngày, tháng, năm sinh, họ, tên, tên đệm, quốc tịch, nơi sinh, nơi cư trú ghi trên giấy phép lái xe có sai lệch với căn cước công dân hoặc căn cước thì cơ quan quản lý giấy phép lái xe làm thủ tục đổi giấy phép lái xe mới phù hợp với thông tin ghi trong căn cước công dân hoặc căn cước;\n\nđ) Không đổi giấy phép lái xe đối với các trường hợp sau: giấy phép lái xe không có trong hệ thống thông tin giấy phép lái xe tại Cục Đường bộ Việt Nam, bảng kê danh sách cấp giấy phép lái xe (sổ quản lý); người vi phạm trật tự, an toàn giao thông đường bộ chưa thực hiện xong yêu cầu của cơ quan nhà nước có thẩm quyền về giải quyết, xử lý vụ việc vi phạm hành chính trong lĩnh vực trật tự, an toàn giao thông đường bộ.\n\n2. Hồ sơ đổi giấy phép lái xe do ngành Giao thông vận tải cấp, gồm:\n\na) Đơn đề nghị đổi (cấp lại) giấy phép lái xe theo mẫu quy định tại Phụ lục XXVI ban hành kèm theo Thông tư này;\n\nb) Giấy khám sức khỏe của người lái xe do cơ sở khám bệnh, chữa bệnh đủ tiêu chuẩn theo quy định của pháp luật về khám bệnh, chữa bệnh cấp còn hiệu lực (trừ người có giấy phép lái xe hạng A, A1, B1);\n\nc) Bản sao hoặc bản sao điện tử được chứng thực từ bản chính hoặc bản sao điện tử được cấp từ sổ gốc của giấy phép lái xe hoặc Quyết định xử phạt vi phạm hành chính trong lĩnh vực giao thông đường bộ đối với trường hợp tước quyền sử dụng giấy phép lái xe tích hợp;\n\nd) Hộ chiếu còn thời hạn sử dụng (đối với người nước ngoài, người Việt Nam định cư ở nước ngoài).\n\n3. Trình tự thực hiện\n\na) Cá nhân lập 01 bộ hồ sơ theo quy định tại khoản 2 Điều này gửi trực tiếp hoặc qua hệ thống dịch vụ công trực tuyến đến Sở Giao thông vận tải.\n\nTrường hợp nộp hồ sơ trực tiếp cá nhân phải chụp ảnh trực tiếp tại cơ quan cấp giấy phép lái xe và phải hoàn thành nghĩa vụ nộp lệ phí khi được tiếp nhận hồ sơ.\n\nTrường hợp nộp hồ sơ qua hệ thống dịch vụ công trực tuyến, cá nhân kê khai theo hướng dẫn, phải chịu trách nhiệm về tính chính xác, tính hợp pháp của nội dung đã kê khai và phải hoàn thành nghĩa vụ nộp lệ phí cấp giấy phép lái xe thông qua chức năng thanh toán của hệ thống dịch vụ công trực tuyến theo quy định và nộp phí sử dụng dịch vụ khác theo nhu cầu của cá nhân; khi nhận giấy phép lái xe, phải nộp lại giấy phép lái xe cũ để lưu hồ sơ;\n\nb) Sở Giao thông vận tải kiểm tra hồ sơ khi tiếp nhận, tra cứu phần mềm quản lý vi phạm của hệ thống thông tin về đào tạo, sát hạch, cấp giấy phép lái xe, chứng chỉ bồi dưỡng kiến thức pháp luật về giao thông đường bộ, truy cập phần mềm cơ sở dữ liệu về trật tự, an toàn giao thông đường bộ của ngành Công an hoặc tra cứu vi phạm của người lái xe thông qua tài khoản định danh điện tử; trường hợp giấy phép lái xe không thuộc đối tượng được đổi hoặc hồ sơ không đúng theo quy định, phải thông báo trực tiếp hoặc bằng văn bản hoặc qua hệ thống dịch vụ công trực tuyến những nội dung cần bổ sung hoặc sửa đổi cho cá nhân trong thời hạn 02 ngày làm việc, kể từ ngày nhận hồ sơ;\n\nc) Trong thời hạn 05 ngày làm việc, kể từ ngày nhận đủ hồ sơ đúng theo quy định (bao gồm xác thực tài khoản định danh điện tử qua hệ thống định danh và xác thực điện tử), Sở Giao thông vận tải thực hiện việc đổi giấy phép lái xe; trường hợp không đổi giấy phép lái xe thì phải trả lời bằng văn bản và nêu rõ lý do;\n\nd) Cơ quan cấp giấy phép lái xe lưu trữ bản chính hồ sơ đổi giấy phép lái xe của ngành Giao thông vận tải cấp (trừ trường hợp đổi giấy phép lái xe qua hệ thống dịch vụ công trực tuyến) trong thời hạn 02 năm kể từ ngày cấp giấy phép lái xe và thu lại giấy phép lái xe cũ (trường hợp đổi giấy phép lái xe trực tuyến toàn trình, người lái xe chịu trách nhiệm gửi giấy phép lái xe cũ đến cơ quan cấp giấy phép lái xe để hủy theo quy định) trừ trường hợp đổi giấy phép lái xe cho người có giấy phép lái xe tích hợp đang trong thời gian bị tước giấy phép lái xe;\n\nđ) Trường hợp người lái xe có nhu cầu đổi giấy phép lái xe xuống hạng thấp hơn, phải khai rõ tại đơn đề nghị đổi (cấp lại) giấy phép lái xe quy định tại Phụ lục XXVI ban hành kèm theo Thông tư này và chịu trách nhiệm về nội dung kê khai.\n\n4. Việc trả giấy phép lái xe được thực hiện tại cơ quan tiếp nhận hồ sơ hoặc thông qua dịch vụ bưu chính theo yêu cầu của cá nhân; trường hợp nộp hồ sơ qua hệ thống dịch vụ công trực tuyến, giấy phép lái xe được trả cho đúng cá nhân đổi giấy phép lái xe.\n\nĐiều 37. Đổi giấy phép lái xe quân sự do Bộ Quốc phòng cấp sang giấy phép lái xe do ngành Giao thông vận tải cấp\n\n1. Yêu cầu đối với việc đổi giấy phép lái xe do Bộ Quốc phòng cấp sang giấy phép lái xe do ngành Giao thông vận tải cấp\n\na) Người có giấy phép lái xe quân sự còn thời hạn sử dụng khi thôi phục vụ trong quân đội (xuất ngũ, chuyển ngành, nghỉ hưu, chấm dứt hợp đồng lao động trong quân đội) có nhu cầu được đổi giấy phép lái xe;\n\nb) Giấy phép lái xe quân sự có hiệu lực được phép lái nhiều hạng xe khác nhau được đổi sang giấy phép lái xe ngành Giao thông vận tải có hiệu lực lái các hạng xe tương ứng; giấy phép lái xe quân sự hạng Cx được đổi sang giấy phép lái xe hạng C do ngành Giao thông vận tải cấp;\n\nc) Người có giấy phép lái xe quân sự do Bộ Quốc phòng cấp bị hỏng không còn sử dụng được;\n\nd) Không đổi giấy phép lái xe quân sự bị tẩy xóa thông tin hoặc có sự khác biệt về nhận dạng; người vi phạm trật tự, an toàn giao thông đường bộ chưa thực hiện xong yêu cầu của cơ quan nhà nước có thẩm quyền về giải quyết, xử lý vụ việc vi phạm hành chính trong lĩnh vực trật tự, an toàn giao thông đường bộ.\n\n2. Hồ sơ bao gồm:']","**Nguồn văn bản:** /content/drive/MyDrive/ITProject_data/new_law/35_2025_TT-BGTVT_624356.docx

**Tên văn bản:**  (Tên văn bản không được cung cấp trong context)

**Điều/Mục:** (Điều/Mục không được cung cấp trong context)


**Nội dung:**

Tôi xin lỗi, nhưng văn bản được cung cấp không chứa thông tin về những thay đổi trong phân hạng giấy phép lái xe của Luật Giao thông Đường bộ năm 2025.  Văn bản tập trung vào các quy định về việc cấp lại, đổi giấy phép lái xe, bao gồm các trường hợp quá hạn, bị mất, hoặc bị hỏng, cũng như các thủ tục liên quan.  Không có thông tin nào đề cập đến việc thay đổi phân hạng giấy phép lái xe.


Tóm lại:  Văn bản không cung cấp thông tin về thay đổi phân hạng giấy phép lái xe trong Luật Giao thông Đường bộ.
","Từ năm 2025, hệ thống phân hạng giấy phép lái xe được mở rộng lên 15 hạng: A1, A, B1, B, C1, C, D1, D2, D, BE, C1E, CE, D1E, D2E, DE.",0.8,0.0,0.0,0.0
1,Giấy phép lái xe hạng A1 mới cấp cho loại xe nào?,"['8. Ủy ban nhân dân các cấp, trong phạm vi nhiệm vụ, quyền hạn của mình, thực hiện quản lý nhà nước về trật tự, an toàn giao thông đường bộ tại địa phương.\n\nChương IX\n\nĐIỀU KHOẢN THI HÀNH\n\nĐiều 88. Hiệu lực thi hành\n\n1. Luật này có hiệu lực thi hành từ ngày 01 tháng 01 năm 2025, trừ trường hợp quy định tại khoản 2 Điều này.\n\n2. Khoản 3 Điều 10 của Luật này có hiệu lực thi hành từ ngày 01 tháng 01 năm 2026.\n\n3. Luật Giao thông đường bộ số 23/2008/QH12 đã được sửa đổi, bổ sung một số điều theo Luật số 35/2018/QH14 và Luật số 44/2019/QH14 hết hiệu lực kể từ ngày Luật này có hiệu lực thi hành, trừ trường hợp quy định tại các khoản 1, 2, 5 và 6 Điều 89 của Luật này.\n\n4. Nghị quyết số 73/2022/QH15 của Quốc hội về thí điểm đấu giá biển số xe ô tô hết hiệu lực kể từ ngày Luật này có hiệu lực thi hành, trừ trường hợp quy định tại khoản 7 Điều 89 của Luật này.\n\nĐiều 89. Quy định chuyển tiếp\n\n1. Giấy phép lái xe được cấp trước ngày Luật này có hiệu lực thi hành được tiếp tục sử dụng theo thời hạn ghi trên giấy phép lái xe. \n\n2. Giấy phép lái xe được cấp trước ngày Luật này có hiệu lực thi hành nếu chưa thực hiện đổi, cấp lại theo quy định của Luật này có hiệu lực sử dụng như sau:\n\na) Giấy phép lái xe hạng A1 được tiếp tục điều khiển xe mô tô hai bánh có dung tích xi-lanh từ 50 cm3\xa0đến dưới 175 cm3 hoặc có công suất động cơ điện từ 04 kW đến dưới 14 kW;\n\nb) Giấy phép lái xe hạng A2 được tiếp tục điều khiển xe mô tô hai bánh có dung tích xi-lanh từ 175 cm3\xa0trở lên hoặc có công suất động cơ điện từ 14 kW trở lên và các loại xe quy định cho giấy phép lái xe hạng A1 quy định tại điểm a khoản này;\n\nc) Giấy phép lái xe hạng A3 được tiếp tục điều khiển xe mô tô ba bánh, các loại xe quy định cho giấy phép lái xe hạng A1 quy định tại điểm a khoản này và các xe tương tự;\n\nd) Giấy phép lái xe hạng A4 được tiếp tục điều khiển máy kéo có trọng tải đến 1.000 kg;\n\nđ) Giấy phép lái xe hạng B1 số tự động cấp cho người không hành nghề lái xe được tiếp tục điều khiển xe ô tô số tự động chở người đến 08 chỗ (không kể chỗ của người lái xe); xe ô tô tải, kể cả ô tô tải chuyên dùng số tự động có trọng tải dưới 3.500 kg;\n\ne) Giấy phép lái xe hạng B1 cấp cho người không hành nghề lái xe được tiếp tục điều khiển xe ô tô chở người đến 08 chỗ (không kể chỗ của người lái xe); xe ô tô tải, máy kéo có trọng tải dưới 3.500 kg;\n\ng) Giấy phép lái xe hạng B2 cấp cho người hành nghề lái xe được tiếp tục điều khiển xe ô tô chở người đến 08 chỗ (không kể chỗ của người lái xe); xe ô tô tải, máy kéo có trọng tải dưới 3.500 kg;\n\nh) Giấy phép lái xe hạng C được tiếp tục điều khiển xe ô tô tải, máy kéo có trọng tải từ 3.500 kg trở lên và các loại xe quy định cho các giấy phép lái xe hạng B1, B2 quy định tại các điểm đ, e và g khoản này;\n\ni) Giấy phép lái xe hạng D được tiếp tục điều khiển xe ô tô chở người từ 09 chỗ (không kể chỗ của người lái xe) đến 29 chỗ (không kể chỗ của người lái xe) và các loại xe quy định cho các giấy phép lái xe hạng B1, B2, C quy định tại các điểm đ, e, g và h khoản này;\n\nk) Giấy phép lái xe hạng E được tiếp tục điều khiển xe ô tô chở người trên 29 chỗ (không kể chỗ của người lái xe) và các loại xe quy định cho các giấy phép lái xe hạng B1, B2, C, D quy định tại các điểm đ, e, g, h và i khoản này;\n\nl) Giấy phép lái xe hạng FB2, FD được tiếp tục điều khiển các loại xe quy định cho giấy phép lái xe hạng B2, D quy định tại điểm g và điểm i khoản này khi kéo rơ moóc; giấy phép lái xe hạng FC được tiếp tục điều khiển các loại xe quy định cho giấy phép lái xe hạng C quy định tại điểm h khoản này khi kéo rơ moóc, đầu kéo kéo sơ mi rơ moóc; giấy phép lái xe hạng FE được tiếp tục điều khiển các loại xe quy định cho giấy phép lái xe hạng E quy định tại điểm k khoản này khi kéo rơ moóc\xa0hoặc xe ô tô chở khách nối toa.\n\n3. Trường hợp người có giấy phép lái xe đã được cấp trước ngày Luật này có hiệu lực thi hành có nhu cầu đổi, cấp lại giấy phép lái xe thì thực hiện như sau:\n\na) Giấy phép lái xe hạng A1 được đổi, cấp lại sang giấy phép lái xe hạng A với điều kiện hạn chế là chỉ được điều khiển xe mô tô hai bánh có dung tích xi-lanh đến dưới 175 cm3 hoặc có công suất động cơ điện đến dưới 14 kW;\n\nb) Giấy phép lái xe hạng A2 được đổi, cấp lại sang giấy phép lái xe hạng A;\n\nc) Giấy phép lái xe hạng A3 được đổi, cấp lại sang giấy phép lái xe hạng B1;\n\nd) Giấy phép lái xe hạng A4 được đổi, cấp lại sang chứng chỉ điều khiển xe máy chuyên dùng cho người điều khiển máy kéo có trọng tải đến 1.000 kg và chứng chỉ bồi dưỡng kiến thức pháp luật về giao thông đường bộ cho người điều khiển xe máy chuyên dùng;\n\nđ) Giấy phép lái xe hạng B1 số tự động được đổi, cấp lại sang giấy phép lái xe hạng B với điều kiện hạn chế là chỉ được điều khiển xe ô tô số tự động;\n\ne) Giấy phép lái xe hạng B1, B2 được đổi, cấp lại sang giấy phép lái xe hạng B hoặc hạng C1 và chứng chỉ điều khiển xe máy chuyên dùng cho người điều khiển máy kéo có trọng tải đến 3.500 kg;\n\ng) Giấy phép lái xe hạng C giữ nguyên và đổi, cấp lại cùng hạng và chứng chỉ điều khiển xe máy chuyên dùng cho người điều khiển máy kéo có trọng tải trên 3.500 kg;\n\nh) Giấy phép lái xe hạng D được đổi, cấp lại sang giấy phép lái xe hạng D2 và chứng chỉ điều khiển xe máy chuyên dùng cho người điều khiển máy kéo có trọng tải trên 3.500 kg;\n\ni) Giấy phép lái xe hạng E được đổi, cấp lại sang giấy phép lái xe hạng D và chứng chỉ điều khiển xe máy chuyên dùng cho người điều khiển máy kéo có trọng tải trên 3.500 kg;\n\nk) Giấy phép lái xe hạng FB2 được đổi, cấp lại sang giấy phép lái xe hạng BE hoặc hạng C1E và chứng chỉ điều khiển xe máy chuyên dùng cho người điều khiển máy kéo có trọng tải đến 3.500 kg;\n\nl) Giấy phép lái xe hạng FC được đổi, cấp lại sang giấy phép lái xe hạng CE và chứng chỉ điều khiển xe máy chuyên dùng cho người điều khiển máy kéo có trọng tải trên 3.500 kg;\n\nm) Giấy phép lái xe hạng FD được đổi, cấp lại sang giấy phép lái xe hạng D2E và chứng chỉ điều khiển xe máy chuyên dùng cho người điều khiển máy kéo có trọng tải trên 3.500 kg;\n\nn) Giấy phép lái xe hạng FE được đổi, cấp lại sang giấy phép lái xe hạng DE và chứng chỉ điều khiển xe máy chuyên dùng cho người điều khiển máy kéo có trọng tải trên 3.500 kg.\n\n4. Người học lái xe đã được đào tạo lái xe trước ngày Luật này có hiệu lực thi hành hoặc đang được đào tạo lái xe tại ngày Luật này có hiệu lực thi hành chưa được sát hạch, cấp giấy phép lái xe thì được sát hạch, cấp giấy phép lái xe theo hạng giấy phép lái xe đổi, cấp lại quy định tại khoản 3 Điều này.\n\n5. Chứng nhận đăng ký xe, biển số xe máy chuyên dùng cấp trước ngày Luật này có hiệu lực thi hành vẫn có giá trị sử dụng.\n\n6. Chứng nhận chất lượng an toàn kỹ thuật và bảo vệ môi trường được cấp trước ngày Luật này có hiệu lực thi hành thì có giá trị sử dụng đến hết thời hạn ghi trên giấy chứng nhận đó.\n\n7. Việc đấu giá biển số xe ô tô được thực hiện trước ngày Luật này có hiệu lực thi hành và đến ngày Luật này có hiệu lực thi hành đã được cấp văn bản xác nhận biển số xe ô tô trúng đấu giá thì tiếp tục thực hiện theo Nghị quyết số 73/2022/QH15 của Quốc hội về thí điểm đấu giá biển số xe ô tô; trường hợp chưa được cấp xác nhận biển số xe ô tô trúng đấu giá thì tiếp tục thực hiện theo Nghị quyết số 73/2022/QH15 của Quốc hội về thí điểm đấu giá biển số xe ô tô và quy định tại điểm d khoản 1 Điều 38 của Luật này./.\n\nLuật này được Quốc hội nước Cộng hòa xã hội chủ nghĩa Việt Nam khóa XV, kỳ họp thứ 7 thông qua ngày 27 tháng 6 năm 2024.\n\nE-pas: 60179 CHỦ TỊCH QUỐC HỘI\n\n\n\n\nTrần Thanh Mẫn']","**Nguồn văn bản:** /content/drive/MyDrive/ITProject_data/new_law/36_2024_QH15_444251.docx

**Tên văn bản:** Không có tiêu đề trong văn bản cung cấp.

**Điều 89:** Quy định chuyển tiếp

**Nội dung:**

2. Giấy phép lái xe được cấp trước ngày Luật này có hiệu lực thi hành nếu chưa thực hiện đổi, cấp lại theo quy định của Luật này có hiệu lực sử dụng như sau:

    a) Giấy phép lái xe hạng A1 được tiếp tục điều khiển xe mô tô hai bánh có dung tích xi-lanh từ 50 cm3 đến dưới 175 cm3 hoặc có công suất động cơ điện từ 04 kW đến dưới 14 kW;

    b) Giấy phép lái xe hạng A2 được tiếp tục điều khiển xe mô tô hai bánh có dung tích xi-lanh từ 175 cm3 trở lên hoặc có công suất động cơ điện từ 14 kW trở lên và các loại xe quy định cho giấy phép lái xe hạng A1 quy định tại điểm a khoản này;

    c) Giấy phép lái xe hạng A3 được tiếp tục điều khiển xe mô tô ba bánh, các loại xe quy định cho giấy phép lái xe hạng A1 quy định tại điểm a khoản này và các xe tương tự;

    d) Giấy phép lái xe hạng A4 được tiếp tục điều khiển máy kéo có trọng tải đến 1.000 kg;


Tóm lại: Giấy phép lái xe hạng A1 được phép điều khiển xe mô tô hai bánh có dung tích xi-lanh từ 50 cm3 đến dưới 175 cm3 hoặc có công suất động cơ điện từ 04 kW đến dưới 14 kW (theo quy định chuyển tiếp của Luật).
",Hạng A1 mới cấp cho người lái xe mô tô từ trên 50 phân khối đến 125 phân khối.,1.0,0.7567707967349956,0.0,0.0
2,Thời hạn của giấy phép lái xe hạng B theo Luật Giao thông Đường bộ 2025 là bao lâu?,"['a) Chứng nhận đăng ký xe hoặc bản sao Chứng nhận đăng ký xe có chứng thực kèm bản gốc giấy tờ xác nhận của tổ chức tín dụng, chi nhánh ngân hàng nước ngoài còn hiệu lực trong trường hợp xe đang được thế chấp tại tổ chức tín dụng, chi nhánh ngân hàng nước ngoài;\n\nb) Giấy phép lái xe phù hợp với loại xe đang điều khiển;\n\nc) Chứng nhận kiểm định an toàn kỹ thuật và bảo vệ môi trường đối với xe cơ giới theo quy định của pháp luật;\n\nd) Chứng nhận bảo hiểm bắt buộc trách nhiệm dân sự của chủ xe cơ giới.\n\n2. Người điều khiển xe máy chuyên dùng tham gia giao thông đường bộ phải đủ tuổi, sức khỏe theo quy định của pháp luật; có bằng hoặc chứng chỉ điều khiển xe máy chuyên dùng phù hợp loại xe máy chuyên dùng đang điều khiển; có giấy phép lái xe đang còn điểm, còn hiệu lực hoặc chứng chỉ bồi dưỡng kiến thức pháp luật về giao thông đường bộ. Khi tham gia giao thông đường bộ, người điều khiển xe máy chuyên dùng phải mang theo các loại giấy tờ sau đây:\n\na) Chứng nhận đăng ký xe hoặc bản sao Chứng nhận đăng ký xe có chứng thực kèm bản gốc Giấy biên nhận còn hiệu lực của tổ chức tín dụng, chi nhánh ngân hàng nước ngoài trong trường hợp xe đang được thế chấp tại tổ chức tín dụng, chi nhánh ngân hàng nước ngoài;\n\nb) Bằng hoặc chứng chỉ điều khiển xe máy chuyên dùng;\n\nc) Giấy phép lái xe hoặc chứng chỉ bồi dưỡng kiến thức pháp luật về giao thông đường bộ;\n\nd) Chứng nhận kiểm định an toàn kỹ thuật và bảo vệ môi trường đối với xe máy chuyên dùng theo quy định của pháp luật;\n\nđ) Chứng nhận bảo hiểm bắt buộc trách nhiệm dân sự theo quy định của pháp luật.\n\n3. Trường hợp giấy tờ quy định tại khoản 1 và khoản 2 Điều này đã được tích hợp vào tài khoản định danh điện tử thì việc xuất trình, kiểm tra có thể thực hiện thông qua tài khoản định danh điện tử.\n\n4. Người lái xe gắn máy tham gia giao thông đường bộ phải hiểu biết quy tắc giao thông đường bộ, có kỹ năng điều khiển phương tiện; đủ điều kiện về độ tuổi, sức khỏe theo quy định tại điểm a khoản 1 và khoản 2 Điều 59 của Luật này.\n\n5. Người tập lái xe ô tô, người dự sát hạch lái xe ô tô khi tham gia giao thông đường bộ phải thực hành trên xe tập lái, xe sát hạch trên tuyến đường tập lái, tuyến đường sát hạch, có giáo viên dạy lái hoặc sát hạch viên bảo trợ tay lái. Giáo viên dạy lái, sát hạch viên phải mang theo các loại giấy tờ quy định tại khoản 1 Điều này.\n\nĐiều 57. Giấy phép lái xe\n\n1. Giấy phép lái xe bao gồm các hạng sau đây:\n\na) Hạng A1 cấp cho người lái xe mô tô hai bánh có dung tích xi-lanh đến 125 cm3 hoặc có công suất động cơ điện đến 11 kW;\n\nb) Hạng A cấp cho người lái xe mô tô hai bánh có dung tích xi-lanh\xa0 trên 125 cm3\xa0hoặc có công suất động cơ điện trên 11 kW và các loại xe quy định cho giấy phép lái xe hạng A1;\n\nc) Hạng B1 cấp cho người lái xe mô tô ba bánh và các loại xe quy định cho giấy phép lái xe hạng A1;\n\nd) Hạng B cấp cho người lái xe ô tô chở người đến 08 chỗ (không kể chỗ của người lái xe); xe ô tô tải và ô tô chuyên dùng có khối lượng toàn bộ theo thiết kế đến 3.500 kg; các loại xe ô tô quy định cho giấy phép lái xe hạng B kéo rơ moóc có khối lượng toàn bộ theo thiết kế đến 750 kg; \n\nđ) Hạng C1 cấp cho người lái xe ô tô tải và ô tô chuyên dùng có khối lượng toàn bộ theo thiết kế trên 3.500 kg đến 7.500 kg; các loại xe ô tô tải quy định cho giấy phép lái xe hạng C1 kéo rơ moóc có khối lượng toàn bộ theo thiết kế đến 750 kg; các loại xe quy định cho giấy phép lái xe hạng B;\n\ne) Hạng C cấp cho người lái xe ô tô tải và ô tô chuyên dùng có khối lượng toàn bộ theo thiết kế trên 7.500 kg; các loại xe ô tô tải quy định cho giấy phép lái xe hạng C kéo rơ moóc có khối lượng toàn bộ theo thiết kế đến 750 kg; các loại xe quy định cho giấy phép lái xe hạng B và hạng C1;\n\ng) Hạng D1 cấp cho người lái xe ô tô chở người trên 08 chỗ (không kể chỗ của người lái xe) đến 16 chỗ (không kể chỗ của người lái xe); các loại xe ô tô chở người quy định cho giấy phép lái xe hạng D1 kéo rơ moóc có khối lượng toàn bộ theo thiết kế đến 750 kg; các loại xe quy định cho giấy phép lái xe các hạng B, C1, C;\n\nh) Hạng D2 cấp cho người lái xe ô tô chở người (kể cả xe buýt) trên 16 chỗ (không kể chỗ của người lái xe) đến 29 chỗ (không kể chỗ của người lái xe); các loại xe ô tô chở người quy định cho giấy phép lái xe hạng D2 kéo rơ moóc có khối lượng toàn bộ theo thiết kế đến 750 kg; các loại xe quy định cho giấy phép lái xe các hạng B, C1, C, D1;\n\ni) Hạng D cấp cho người lái xe ô tô chở người (kể cả xe buýt) trên 29 chỗ (không kể chỗ của người lái xe); xe ô tô chở người giường nằm; các loại xe ô tô chở người quy định cho giấy phép lái xe hạng D kéo rơ moóc có khối lượng toàn bộ theo thiết kế đến 750 kg; các loại xe quy định cho giấy phép lái xe các hạng B, C1, C, D1, D2;\n\nk) Hạng BE cấp cho người lái các loại xe ô tô quy định cho giấy phép lái xe hạng B kéo rơ moóc có khối lượng toàn bộ theo thiết kế trên 750 kg;\n\nl) Hạng C1E cấp cho người lái các loại xe ô tô quy định cho giấy phép lái xe hạng C1 kéo rơ moóc có khối lượng toàn bộ theo thiết kế trên 750 kg;\n\nm) Hạng CE cấp cho người lái các loại xe ô tô quy định cho giấy phép lái xe hạng C kéo rơ moóc có khối lượng toàn bộ theo thiết kế trên 750 kg; xe ô tô đầu kéo kéo sơ mi rơ moóc;\n\nn) Hạng D1E cấp cho người lái các loại xe ô tô quy định cho giấy phép lái xe hạng D1 kéo rơ moóc có khối lượng toàn bộ theo thiết kế trên 750 kg;\n\no) Hạng D2E cấp cho người lái các loại xe ô tô quy định cho giấy phép lái xe hạng D2 kéo rơ moóc có khối lượng toàn bộ theo thiết kế trên 750 kg;\n\np) Hạng DE cấp cho người lái các loại xe ô tô quy định cho giấy phép lái xe hạng D kéo rơ moóc có khối lượng toàn bộ theo thiết kế trên 750 kg; xe ô tô chở khách nối toa.\n\n2. Người khuyết tật điều khiển xe mô tô ba bánh dùng cho người khuyết tật được cấp giấy phép lái xe hạng A1.\n\nNgười khuyết tật điều khiển xe ô tô số tự động có kết cấu phù hợp với tình trạng khuyết tật thì được cấp giấy phép lái xe hạng B.\n\n3. Người điều khiển xe chở hàng bốn bánh có gắn động cơ, xe chở người bốn bánh có gắn động cơ phải sử dụng giấy phép lái xe có hạng phù hợp với xe ô tô tải hoặc xe ô tô chở người tương ứng.\n\n4. Người điều khiển xe ô tô có thiết kế, cải tạo với số chỗ ít hơn xe cùng loại, kích thước giới hạn tương đương phải sử dụng giấy phép lái xe có hạng phù hợp với xe ô tô cùng loại, kích thước giới hạn tương đương và có số chỗ nhiều nhất.\n\n5. Thời hạn của giấy phép lái xe được quy định như sau:\n\na) Giấy phép lái xe các hạng A1, A, B1 không thời hạn;\n\nb) Giấy phép lái xe hạng B và hạng C1 có thời hạn 10 năm kể từ ngày cấp;\n\nc) Giấy phép lái xe các hạng C, D1, D2, D, BE, C1E, CE, D1E, D2E và DE có thời hạn 05 năm kể từ ngày cấp.\n\n6. Giấy phép lái xe có giá trị sử dụng trong phạm vi lãnh thổ Việt Nam bao gồm:\n\na) Giấy phép lái xe do cơ quan có thẩm quyền của Việt Nam cấp;\n\nb) Giấy phép lái xe quốc tế và giấy phép lái xe quốc gia phù hợp với loại xe được phép điều khiển do quốc gia là thành viên của Công ước của Liên hợp quốc về Giao thông đường bộ năm 1968 (sau đây gọi là Công ước Viên) cấp;\n\nc) Giấy phép lái xe phù hợp với loại xe được phép điều khiển của nước hoặc vùng lãnh thổ mà Việt Nam ký kết điều ước quốc tế hoặc thỏa thuận quốc tế công nhận giấy phép lái xe của nhau;\n\nd) Giấy phép lái xe nước ngoài phù hợp với loại xe được phép điều khiển do quốc gia được công nhận theo điều ước quốc tế mà nước Cộng hòa xã hội chủ nghĩa Việt Nam là thành viên.\n\n7. Giấy phép lái xe không có hiệu lực trong các trường hợp sau đây:\n\na) Giấy phép lái xe hết thời hạn sử dụng;\n\nb) Giấy phép lái xe bị thu hồi theo quy định tại khoản 5 Điều 62 của Luật này.\n\n8. Giấy phép lái xe quốc tế được quy định như sau:\n\na) Giấy phép lái xe quốc tế là giấy phép lái xe do cơ quan nhà nước có thẩm quyền của quốc gia là thành viên của Công ước Viên cấp theo một mẫu thống nhất; có thời hạn không quá 03 năm kể từ ngày cấp và phải phù hợp với thời hạn còn hiệu lực của giấy phép lái xe quốc gia;']","**Nguồn văn bản:** /content/drive/MyDrive/ITProject_data/new_law/36_2024_QH15_444251.docx

**Nội dung:**

Thời hạn của giấy phép lái xe hạng B là 10 năm kể từ ngày cấp.


Tóm lại: Giấy phép lái xe hạng B có thời hạn 10 năm.
",Giấy phép lái xe hạng B có thời hạn 10 năm kể từ ngày cấp.,1.0,0.8502771854850245,1.0,0.9999999999
3,Giấy phép lái xe hạng C1 có thời hạn bao lâu?,"['a) Chứng nhận đăng ký xe hoặc bản sao Chứng nhận đăng ký xe có chứng thực kèm bản gốc giấy tờ xác nhận của tổ chức tín dụng, chi nhánh ngân hàng nước ngoài còn hiệu lực trong trường hợp xe đang được thế chấp tại tổ chức tín dụng, chi nhánh ngân hàng nước ngoài;\n\nb) Giấy phép lái xe phù hợp với loại xe đang điều khiển;\n\nc) Chứng nhận kiểm định an toàn kỹ thuật và bảo vệ môi trường đối với xe cơ giới theo quy định của pháp luật;\n\nd) Chứng nhận bảo hiểm bắt buộc trách nhiệm dân sự của chủ xe cơ giới.\n\n2. Người điều khiển xe máy chuyên dùng tham gia giao thông đường bộ phải đủ tuổi, sức khỏe theo quy định của pháp luật; có bằng hoặc chứng chỉ điều khiển xe máy chuyên dùng phù hợp loại xe máy chuyên dùng đang điều khiển; có giấy phép lái xe đang còn điểm, còn hiệu lực hoặc chứng chỉ bồi dưỡng kiến thức pháp luật về giao thông đường bộ. Khi tham gia giao thông đường bộ, người điều khiển xe máy chuyên dùng phải mang theo các loại giấy tờ sau đây:\n\na) Chứng nhận đăng ký xe hoặc bản sao Chứng nhận đăng ký xe có chứng thực kèm bản gốc Giấy biên nhận còn hiệu lực của tổ chức tín dụng, chi nhánh ngân hàng nước ngoài trong trường hợp xe đang được thế chấp tại tổ chức tín dụng, chi nhánh ngân hàng nước ngoài;\n\nb) Bằng hoặc chứng chỉ điều khiển xe máy chuyên dùng;\n\nc) Giấy phép lái xe hoặc chứng chỉ bồi dưỡng kiến thức pháp luật về giao thông đường bộ;\n\nd) Chứng nhận kiểm định an toàn kỹ thuật và bảo vệ môi trường đối với xe máy chuyên dùng theo quy định của pháp luật;\n\nđ) Chứng nhận bảo hiểm bắt buộc trách nhiệm dân sự theo quy định của pháp luật.\n\n3. Trường hợp giấy tờ quy định tại khoản 1 và khoản 2 Điều này đã được tích hợp vào tài khoản định danh điện tử thì việc xuất trình, kiểm tra có thể thực hiện thông qua tài khoản định danh điện tử.\n\n4. Người lái xe gắn máy tham gia giao thông đường bộ phải hiểu biết quy tắc giao thông đường bộ, có kỹ năng điều khiển phương tiện; đủ điều kiện về độ tuổi, sức khỏe theo quy định tại điểm a khoản 1 và khoản 2 Điều 59 của Luật này.\n\n5. Người tập lái xe ô tô, người dự sát hạch lái xe ô tô khi tham gia giao thông đường bộ phải thực hành trên xe tập lái, xe sát hạch trên tuyến đường tập lái, tuyến đường sát hạch, có giáo viên dạy lái hoặc sát hạch viên bảo trợ tay lái. Giáo viên dạy lái, sát hạch viên phải mang theo các loại giấy tờ quy định tại khoản 1 Điều này.\n\nĐiều 57. Giấy phép lái xe\n\n1. Giấy phép lái xe bao gồm các hạng sau đây:\n\na) Hạng A1 cấp cho người lái xe mô tô hai bánh có dung tích xi-lanh đến 125 cm3 hoặc có công suất động cơ điện đến 11 kW;\n\nb) Hạng A cấp cho người lái xe mô tô hai bánh có dung tích xi-lanh\xa0 trên 125 cm3\xa0hoặc có công suất động cơ điện trên 11 kW và các loại xe quy định cho giấy phép lái xe hạng A1;\n\nc) Hạng B1 cấp cho người lái xe mô tô ba bánh và các loại xe quy định cho giấy phép lái xe hạng A1;\n\nd) Hạng B cấp cho người lái xe ô tô chở người đến 08 chỗ (không kể chỗ của người lái xe); xe ô tô tải và ô tô chuyên dùng có khối lượng toàn bộ theo thiết kế đến 3.500 kg; các loại xe ô tô quy định cho giấy phép lái xe hạng B kéo rơ moóc có khối lượng toàn bộ theo thiết kế đến 750 kg; \n\nđ) Hạng C1 cấp cho người lái xe ô tô tải và ô tô chuyên dùng có khối lượng toàn bộ theo thiết kế trên 3.500 kg đến 7.500 kg; các loại xe ô tô tải quy định cho giấy phép lái xe hạng C1 kéo rơ moóc có khối lượng toàn bộ theo thiết kế đến 750 kg; các loại xe quy định cho giấy phép lái xe hạng B;\n\ne) Hạng C cấp cho người lái xe ô tô tải và ô tô chuyên dùng có khối lượng toàn bộ theo thiết kế trên 7.500 kg; các loại xe ô tô tải quy định cho giấy phép lái xe hạng C kéo rơ moóc có khối lượng toàn bộ theo thiết kế đến 750 kg; các loại xe quy định cho giấy phép lái xe hạng B và hạng C1;\n\ng) Hạng D1 cấp cho người lái xe ô tô chở người trên 08 chỗ (không kể chỗ của người lái xe) đến 16 chỗ (không kể chỗ của người lái xe); các loại xe ô tô chở người quy định cho giấy phép lái xe hạng D1 kéo rơ moóc có khối lượng toàn bộ theo thiết kế đến 750 kg; các loại xe quy định cho giấy phép lái xe các hạng B, C1, C;\n\nh) Hạng D2 cấp cho người lái xe ô tô chở người (kể cả xe buýt) trên 16 chỗ (không kể chỗ của người lái xe) đến 29 chỗ (không kể chỗ của người lái xe); các loại xe ô tô chở người quy định cho giấy phép lái xe hạng D2 kéo rơ moóc có khối lượng toàn bộ theo thiết kế đến 750 kg; các loại xe quy định cho giấy phép lái xe các hạng B, C1, C, D1;\n\ni) Hạng D cấp cho người lái xe ô tô chở người (kể cả xe buýt) trên 29 chỗ (không kể chỗ của người lái xe); xe ô tô chở người giường nằm; các loại xe ô tô chở người quy định cho giấy phép lái xe hạng D kéo rơ moóc có khối lượng toàn bộ theo thiết kế đến 750 kg; các loại xe quy định cho giấy phép lái xe các hạng B, C1, C, D1, D2;\n\nk) Hạng BE cấp cho người lái các loại xe ô tô quy định cho giấy phép lái xe hạng B kéo rơ moóc có khối lượng toàn bộ theo thiết kế trên 750 kg;\n\nl) Hạng C1E cấp cho người lái các loại xe ô tô quy định cho giấy phép lái xe hạng C1 kéo rơ moóc có khối lượng toàn bộ theo thiết kế trên 750 kg;\n\nm) Hạng CE cấp cho người lái các loại xe ô tô quy định cho giấy phép lái xe hạng C kéo rơ moóc có khối lượng toàn bộ theo thiết kế trên 750 kg; xe ô tô đầu kéo kéo sơ mi rơ moóc;\n\nn) Hạng D1E cấp cho người lái các loại xe ô tô quy định cho giấy phép lái xe hạng D1 kéo rơ moóc có khối lượng toàn bộ theo thiết kế trên 750 kg;\n\no) Hạng D2E cấp cho người lái các loại xe ô tô quy định cho giấy phép lái xe hạng D2 kéo rơ moóc có khối lượng toàn bộ theo thiết kế trên 750 kg;\n\np) Hạng DE cấp cho người lái các loại xe ô tô quy định cho giấy phép lái xe hạng D kéo rơ moóc có khối lượng toàn bộ theo thiết kế trên 750 kg; xe ô tô chở khách nối toa.\n\n2. Người khuyết tật điều khiển xe mô tô ba bánh dùng cho người khuyết tật được cấp giấy phép lái xe hạng A1.\n\nNgười khuyết tật điều khiển xe ô tô số tự động có kết cấu phù hợp với tình trạng khuyết tật thì được cấp giấy phép lái xe hạng B.\n\n3. Người điều khiển xe chở hàng bốn bánh có gắn động cơ, xe chở người bốn bánh có gắn động cơ phải sử dụng giấy phép lái xe có hạng phù hợp với xe ô tô tải hoặc xe ô tô chở người tương ứng.\n\n4. Người điều khiển xe ô tô có thiết kế, cải tạo với số chỗ ít hơn xe cùng loại, kích thước giới hạn tương đương phải sử dụng giấy phép lái xe có hạng phù hợp với xe ô tô cùng loại, kích thước giới hạn tương đương và có số chỗ nhiều nhất.\n\n5. Thời hạn của giấy phép lái xe được quy định như sau:\n\na) Giấy phép lái xe các hạng A1, A, B1 không thời hạn;\n\nb) Giấy phép lái xe hạng B và hạng C1 có thời hạn 10 năm kể từ ngày cấp;\n\nc) Giấy phép lái xe các hạng C, D1, D2, D, BE, C1E, CE, D1E, D2E và DE có thời hạn 05 năm kể từ ngày cấp.\n\n6. Giấy phép lái xe có giá trị sử dụng trong phạm vi lãnh thổ Việt Nam bao gồm:\n\na) Giấy phép lái xe do cơ quan có thẩm quyền của Việt Nam cấp;\n\nb) Giấy phép lái xe quốc tế và giấy phép lái xe quốc gia phù hợp với loại xe được phép điều khiển do quốc gia là thành viên của Công ước của Liên hợp quốc về Giao thông đường bộ năm 1968 (sau đây gọi là Công ước Viên) cấp;\n\nc) Giấy phép lái xe phù hợp với loại xe được phép điều khiển của nước hoặc vùng lãnh thổ mà Việt Nam ký kết điều ước quốc tế hoặc thỏa thuận quốc tế công nhận giấy phép lái xe của nhau;\n\nd) Giấy phép lái xe nước ngoài phù hợp với loại xe được phép điều khiển do quốc gia được công nhận theo điều ước quốc tế mà nước Cộng hòa xã hội chủ nghĩa Việt Nam là thành viên.\n\n7. Giấy phép lái xe không có hiệu lực trong các trường hợp sau đây:\n\na) Giấy phép lái xe hết thời hạn sử dụng;\n\nb) Giấy phép lái xe bị thu hồi theo quy định tại khoản 5 Điều 62 của Luật này.\n\n8. Giấy phép lái xe quốc tế được quy định như sau:\n\na) Giấy phép lái xe quốc tế là giấy phép lái xe do cơ quan nhà nước có thẩm quyền của quốc gia là thành viên của Công ước Viên cấp theo một mẫu thống nhất; có thời hạn không quá 03 năm kể từ ngày cấp và phải phù hợp với thời hạn còn hiệu lực của giấy phép lái xe quốc gia;']","**Nguồn văn bản:** /content/drive/MyDrive/ITProject_data/new_law/36_2024_QH15_444251.docx

**Tên văn bản:** Không có thông tin

**Điều 57:** Giấy phép lái xe

**Nội dung:**

5. Thời hạn của giấy phép lái xe được quy định như sau:

    a) Giấy phép lái xe các hạng A1, A, B1 không thời hạn.

    b) Giấy phép lái xe hạng B và hạng C1 có thời hạn 10 năm kể từ ngày cấp.

    c) Giấy phép lái xe các hạng C, D1, D2, D, BE, C1E, CE, D1E, D2E và DE có thời hạn 05 năm kể từ ngày cấp.


Tóm lại: Giấy phép lái xe hạng C1 có thời hạn 10 năm kể từ ngày cấp.
",Giấy phép lái xe hạng C1 có thời hạn 10 năm kể từ ngày cấp.,0.75,0.9357325966046988,1.0,0.9999999999
4,Giấy phép lái xe hạng D có thời hạn bao lâu?,"['a) Chứng nhận đăng ký xe hoặc bản sao Chứng nhận đăng ký xe có chứng thực kèm bản gốc giấy tờ xác nhận của tổ chức tín dụng, chi nhánh ngân hàng nước ngoài còn hiệu lực trong trường hợp xe đang được thế chấp tại tổ chức tín dụng, chi nhánh ngân hàng nước ngoài;\n\nb) Giấy phép lái xe phù hợp với loại xe đang điều khiển;\n\nc) Chứng nhận kiểm định an toàn kỹ thuật và bảo vệ môi trường đối với xe cơ giới theo quy định của pháp luật;\n\nd) Chứng nhận bảo hiểm bắt buộc trách nhiệm dân sự của chủ xe cơ giới.\n\n2. Người điều khiển xe máy chuyên dùng tham gia giao thông đường bộ phải đủ tuổi, sức khỏe theo quy định của pháp luật; có bằng hoặc chứng chỉ điều khiển xe máy chuyên dùng phù hợp loại xe máy chuyên dùng đang điều khiển; có giấy phép lái xe đang còn điểm, còn hiệu lực hoặc chứng chỉ bồi dưỡng kiến thức pháp luật về giao thông đường bộ. Khi tham gia giao thông đường bộ, người điều khiển xe máy chuyên dùng phải mang theo các loại giấy tờ sau đây:\n\na) Chứng nhận đăng ký xe hoặc bản sao Chứng nhận đăng ký xe có chứng thực kèm bản gốc Giấy biên nhận còn hiệu lực của tổ chức tín dụng, chi nhánh ngân hàng nước ngoài trong trường hợp xe đang được thế chấp tại tổ chức tín dụng, chi nhánh ngân hàng nước ngoài;\n\nb) Bằng hoặc chứng chỉ điều khiển xe máy chuyên dùng;\n\nc) Giấy phép lái xe hoặc chứng chỉ bồi dưỡng kiến thức pháp luật về giao thông đường bộ;\n\nd) Chứng nhận kiểm định an toàn kỹ thuật và bảo vệ môi trường đối với xe máy chuyên dùng theo quy định của pháp luật;\n\nđ) Chứng nhận bảo hiểm bắt buộc trách nhiệm dân sự theo quy định của pháp luật.\n\n3. Trường hợp giấy tờ quy định tại khoản 1 và khoản 2 Điều này đã được tích hợp vào tài khoản định danh điện tử thì việc xuất trình, kiểm tra có thể thực hiện thông qua tài khoản định danh điện tử.\n\n4. Người lái xe gắn máy tham gia giao thông đường bộ phải hiểu biết quy tắc giao thông đường bộ, có kỹ năng điều khiển phương tiện; đủ điều kiện về độ tuổi, sức khỏe theo quy định tại điểm a khoản 1 và khoản 2 Điều 59 của Luật này.\n\n5. Người tập lái xe ô tô, người dự sát hạch lái xe ô tô khi tham gia giao thông đường bộ phải thực hành trên xe tập lái, xe sát hạch trên tuyến đường tập lái, tuyến đường sát hạch, có giáo viên dạy lái hoặc sát hạch viên bảo trợ tay lái. Giáo viên dạy lái, sát hạch viên phải mang theo các loại giấy tờ quy định tại khoản 1 Điều này.\n\nĐiều 57. Giấy phép lái xe\n\n1. Giấy phép lái xe bao gồm các hạng sau đây:\n\na) Hạng A1 cấp cho người lái xe mô tô hai bánh có dung tích xi-lanh đến 125 cm3 hoặc có công suất động cơ điện đến 11 kW;\n\nb) Hạng A cấp cho người lái xe mô tô hai bánh có dung tích xi-lanh\xa0 trên 125 cm3\xa0hoặc có công suất động cơ điện trên 11 kW và các loại xe quy định cho giấy phép lái xe hạng A1;\n\nc) Hạng B1 cấp cho người lái xe mô tô ba bánh và các loại xe quy định cho giấy phép lái xe hạng A1;\n\nd) Hạng B cấp cho người lái xe ô tô chở người đến 08 chỗ (không kể chỗ của người lái xe); xe ô tô tải và ô tô chuyên dùng có khối lượng toàn bộ theo thiết kế đến 3.500 kg; các loại xe ô tô quy định cho giấy phép lái xe hạng B kéo rơ moóc có khối lượng toàn bộ theo thiết kế đến 750 kg; \n\nđ) Hạng C1 cấp cho người lái xe ô tô tải và ô tô chuyên dùng có khối lượng toàn bộ theo thiết kế trên 3.500 kg đến 7.500 kg; các loại xe ô tô tải quy định cho giấy phép lái xe hạng C1 kéo rơ moóc có khối lượng toàn bộ theo thiết kế đến 750 kg; các loại xe quy định cho giấy phép lái xe hạng B;\n\ne) Hạng C cấp cho người lái xe ô tô tải và ô tô chuyên dùng có khối lượng toàn bộ theo thiết kế trên 7.500 kg; các loại xe ô tô tải quy định cho giấy phép lái xe hạng C kéo rơ moóc có khối lượng toàn bộ theo thiết kế đến 750 kg; các loại xe quy định cho giấy phép lái xe hạng B và hạng C1;\n\ng) Hạng D1 cấp cho người lái xe ô tô chở người trên 08 chỗ (không kể chỗ của người lái xe) đến 16 chỗ (không kể chỗ của người lái xe); các loại xe ô tô chở người quy định cho giấy phép lái xe hạng D1 kéo rơ moóc có khối lượng toàn bộ theo thiết kế đến 750 kg; các loại xe quy định cho giấy phép lái xe các hạng B, C1, C;\n\nh) Hạng D2 cấp cho người lái xe ô tô chở người (kể cả xe buýt) trên 16 chỗ (không kể chỗ của người lái xe) đến 29 chỗ (không kể chỗ của người lái xe); các loại xe ô tô chở người quy định cho giấy phép lái xe hạng D2 kéo rơ moóc có khối lượng toàn bộ theo thiết kế đến 750 kg; các loại xe quy định cho giấy phép lái xe các hạng B, C1, C, D1;\n\ni) Hạng D cấp cho người lái xe ô tô chở người (kể cả xe buýt) trên 29 chỗ (không kể chỗ của người lái xe); xe ô tô chở người giường nằm; các loại xe ô tô chở người quy định cho giấy phép lái xe hạng D kéo rơ moóc có khối lượng toàn bộ theo thiết kế đến 750 kg; các loại xe quy định cho giấy phép lái xe các hạng B, C1, C, D1, D2;\n\nk) Hạng BE cấp cho người lái các loại xe ô tô quy định cho giấy phép lái xe hạng B kéo rơ moóc có khối lượng toàn bộ theo thiết kế trên 750 kg;\n\nl) Hạng C1E cấp cho người lái các loại xe ô tô quy định cho giấy phép lái xe hạng C1 kéo rơ moóc có khối lượng toàn bộ theo thiết kế trên 750 kg;\n\nm) Hạng CE cấp cho người lái các loại xe ô tô quy định cho giấy phép lái xe hạng C kéo rơ moóc có khối lượng toàn bộ theo thiết kế trên 750 kg; xe ô tô đầu kéo kéo sơ mi rơ moóc;\n\nn) Hạng D1E cấp cho người lái các loại xe ô tô quy định cho giấy phép lái xe hạng D1 kéo rơ moóc có khối lượng toàn bộ theo thiết kế trên 750 kg;\n\no) Hạng D2E cấp cho người lái các loại xe ô tô quy định cho giấy phép lái xe hạng D2 kéo rơ moóc có khối lượng toàn bộ theo thiết kế trên 750 kg;\n\np) Hạng DE cấp cho người lái các loại xe ô tô quy định cho giấy phép lái xe hạng D kéo rơ moóc có khối lượng toàn bộ theo thiết kế trên 750 kg; xe ô tô chở khách nối toa.\n\n2. Người khuyết tật điều khiển xe mô tô ba bánh dùng cho người khuyết tật được cấp giấy phép lái xe hạng A1.\n\nNgười khuyết tật điều khiển xe ô tô số tự động có kết cấu phù hợp với tình trạng khuyết tật thì được cấp giấy phép lái xe hạng B.\n\n3. Người điều khiển xe chở hàng bốn bánh có gắn động cơ, xe chở người bốn bánh có gắn động cơ phải sử dụng giấy phép lái xe có hạng phù hợp với xe ô tô tải hoặc xe ô tô chở người tương ứng.\n\n4. Người điều khiển xe ô tô có thiết kế, cải tạo với số chỗ ít hơn xe cùng loại, kích thước giới hạn tương đương phải sử dụng giấy phép lái xe có hạng phù hợp với xe ô tô cùng loại, kích thước giới hạn tương đương và có số chỗ nhiều nhất.\n\n5. Thời hạn của giấy phép lái xe được quy định như sau:\n\na) Giấy phép lái xe các hạng A1, A, B1 không thời hạn;\n\nb) Giấy phép lái xe hạng B và hạng C1 có thời hạn 10 năm kể từ ngày cấp;\n\nc) Giấy phép lái xe các hạng C, D1, D2, D, BE, C1E, CE, D1E, D2E và DE có thời hạn 05 năm kể từ ngày cấp.\n\n6. Giấy phép lái xe có giá trị sử dụng trong phạm vi lãnh thổ Việt Nam bao gồm:\n\na) Giấy phép lái xe do cơ quan có thẩm quyền của Việt Nam cấp;\n\nb) Giấy phép lái xe quốc tế và giấy phép lái xe quốc gia phù hợp với loại xe được phép điều khiển do quốc gia là thành viên của Công ước của Liên hợp quốc về Giao thông đường bộ năm 1968 (sau đây gọi là Công ước Viên) cấp;\n\nc) Giấy phép lái xe phù hợp với loại xe được phép điều khiển của nước hoặc vùng lãnh thổ mà Việt Nam ký kết điều ước quốc tế hoặc thỏa thuận quốc tế công nhận giấy phép lái xe của nhau;\n\nd) Giấy phép lái xe nước ngoài phù hợp với loại xe được phép điều khiển do quốc gia được công nhận theo điều ước quốc tế mà nước Cộng hòa xã hội chủ nghĩa Việt Nam là thành viên.\n\n7. Giấy phép lái xe không có hiệu lực trong các trường hợp sau đây:\n\na) Giấy phép lái xe hết thời hạn sử dụng;\n\nb) Giấy phép lái xe bị thu hồi theo quy định tại khoản 5 Điều 62 của Luật này.\n\n8. Giấy phép lái xe quốc tế được quy định như sau:\n\na) Giấy phép lái xe quốc tế là giấy phép lái xe do cơ quan nhà nước có thẩm quyền của quốc gia là thành viên của Công ước Viên cấp theo một mẫu thống nhất; có thời hạn không quá 03 năm kể từ ngày cấp và phải phù hợp với thời hạn còn hiệu lực của giấy phép lái xe quốc gia;']","**Nguồn văn bản:** /content/drive/MyDrive/ITProject_data/new_law/36_2024_QH15_444251.docx

**Tên văn bản:** Không có tiêu đề trong văn bản cung cấp.

**Điều 57:** Giấy phép lái xe

**Nội dung:**

5. Thời hạn của giấy phép lái xe được quy định như sau:

    a) Giấy phép lái xe các hạng A1, A, B1 không thời hạn.

    b) Giấy phép lái xe hạng B và hạng C1 có thời hạn 10 năm kể từ ngày cấp.

    c) Giấy phép lái xe các hạng C, D1, D2, D, BE, C1E, CE, D1E, D2E và DE có thời hạn 05 năm kể từ ngày cấp.


Tóm lại: Giấy phép lái xe hạng D có thời hạn 5 năm kể từ ngày cấp.
",Giấy phép lái xe hạng D có thời hạn 5 năm kể từ ngày cấp.,0.75,0.9188068644713779,1.0,0.9999999999
5,Giấy phép lái xe hạng BE cho phép lái những loại xe nào?,"['a) Chứng nhận đăng ký xe hoặc bản sao Chứng nhận đăng ký xe có chứng thực kèm bản gốc giấy tờ xác nhận của tổ chức tín dụng, chi nhánh ngân hàng nước ngoài còn hiệu lực trong trường hợp xe đang được thế chấp tại tổ chức tín dụng, chi nhánh ngân hàng nước ngoài;\n\nb) Giấy phép lái xe phù hợp với loại xe đang điều khiển;\n\nc) Chứng nhận kiểm định an toàn kỹ thuật và bảo vệ môi trường đối với xe cơ giới theo quy định của pháp luật;\n\nd) Chứng nhận bảo hiểm bắt buộc trách nhiệm dân sự của chủ xe cơ giới.\n\n2. Người điều khiển xe máy chuyên dùng tham gia giao thông đường bộ phải đủ tuổi, sức khỏe theo quy định của pháp luật; có bằng hoặc chứng chỉ điều khiển xe máy chuyên dùng phù hợp loại xe máy chuyên dùng đang điều khiển; có giấy phép lái xe đang còn điểm, còn hiệu lực hoặc chứng chỉ bồi dưỡng kiến thức pháp luật về giao thông đường bộ. Khi tham gia giao thông đường bộ, người điều khiển xe máy chuyên dùng phải mang theo các loại giấy tờ sau đây:\n\na) Chứng nhận đăng ký xe hoặc bản sao Chứng nhận đăng ký xe có chứng thực kèm bản gốc Giấy biên nhận còn hiệu lực của tổ chức tín dụng, chi nhánh ngân hàng nước ngoài trong trường hợp xe đang được thế chấp tại tổ chức tín dụng, chi nhánh ngân hàng nước ngoài;\n\nb) Bằng hoặc chứng chỉ điều khiển xe máy chuyên dùng;\n\nc) Giấy phép lái xe hoặc chứng chỉ bồi dưỡng kiến thức pháp luật về giao thông đường bộ;\n\nd) Chứng nhận kiểm định an toàn kỹ thuật và bảo vệ môi trường đối với xe máy chuyên dùng theo quy định của pháp luật;\n\nđ) Chứng nhận bảo hiểm bắt buộc trách nhiệm dân sự theo quy định của pháp luật.\n\n3. Trường hợp giấy tờ quy định tại khoản 1 và khoản 2 Điều này đã được tích hợp vào tài khoản định danh điện tử thì việc xuất trình, kiểm tra có thể thực hiện thông qua tài khoản định danh điện tử.\n\n4. Người lái xe gắn máy tham gia giao thông đường bộ phải hiểu biết quy tắc giao thông đường bộ, có kỹ năng điều khiển phương tiện; đủ điều kiện về độ tuổi, sức khỏe theo quy định tại điểm a khoản 1 và khoản 2 Điều 59 của Luật này.\n\n5. Người tập lái xe ô tô, người dự sát hạch lái xe ô tô khi tham gia giao thông đường bộ phải thực hành trên xe tập lái, xe sát hạch trên tuyến đường tập lái, tuyến đường sát hạch, có giáo viên dạy lái hoặc sát hạch viên bảo trợ tay lái. Giáo viên dạy lái, sát hạch viên phải mang theo các loại giấy tờ quy định tại khoản 1 Điều này.\n\nĐiều 57. Giấy phép lái xe\n\n1. Giấy phép lái xe bao gồm các hạng sau đây:\n\na) Hạng A1 cấp cho người lái xe mô tô hai bánh có dung tích xi-lanh đến 125 cm3 hoặc có công suất động cơ điện đến 11 kW;\n\nb) Hạng A cấp cho người lái xe mô tô hai bánh có dung tích xi-lanh\xa0 trên 125 cm3\xa0hoặc có công suất động cơ điện trên 11 kW và các loại xe quy định cho giấy phép lái xe hạng A1;\n\nc) Hạng B1 cấp cho người lái xe mô tô ba bánh và các loại xe quy định cho giấy phép lái xe hạng A1;\n\nd) Hạng B cấp cho người lái xe ô tô chở người đến 08 chỗ (không kể chỗ của người lái xe); xe ô tô tải và ô tô chuyên dùng có khối lượng toàn bộ theo thiết kế đến 3.500 kg; các loại xe ô tô quy định cho giấy phép lái xe hạng B kéo rơ moóc có khối lượng toàn bộ theo thiết kế đến 750 kg; \n\nđ) Hạng C1 cấp cho người lái xe ô tô tải và ô tô chuyên dùng có khối lượng toàn bộ theo thiết kế trên 3.500 kg đến 7.500 kg; các loại xe ô tô tải quy định cho giấy phép lái xe hạng C1 kéo rơ moóc có khối lượng toàn bộ theo thiết kế đến 750 kg; các loại xe quy định cho giấy phép lái xe hạng B;\n\ne) Hạng C cấp cho người lái xe ô tô tải và ô tô chuyên dùng có khối lượng toàn bộ theo thiết kế trên 7.500 kg; các loại xe ô tô tải quy định cho giấy phép lái xe hạng C kéo rơ moóc có khối lượng toàn bộ theo thiết kế đến 750 kg; các loại xe quy định cho giấy phép lái xe hạng B và hạng C1;\n\ng) Hạng D1 cấp cho người lái xe ô tô chở người trên 08 chỗ (không kể chỗ của người lái xe) đến 16 chỗ (không kể chỗ của người lái xe); các loại xe ô tô chở người quy định cho giấy phép lái xe hạng D1 kéo rơ moóc có khối lượng toàn bộ theo thiết kế đến 750 kg; các loại xe quy định cho giấy phép lái xe các hạng B, C1, C;\n\nh) Hạng D2 cấp cho người lái xe ô tô chở người (kể cả xe buýt) trên 16 chỗ (không kể chỗ của người lái xe) đến 29 chỗ (không kể chỗ của người lái xe); các loại xe ô tô chở người quy định cho giấy phép lái xe hạng D2 kéo rơ moóc có khối lượng toàn bộ theo thiết kế đến 750 kg; các loại xe quy định cho giấy phép lái xe các hạng B, C1, C, D1;\n\ni) Hạng D cấp cho người lái xe ô tô chở người (kể cả xe buýt) trên 29 chỗ (không kể chỗ của người lái xe); xe ô tô chở người giường nằm; các loại xe ô tô chở người quy định cho giấy phép lái xe hạng D kéo rơ moóc có khối lượng toàn bộ theo thiết kế đến 750 kg; các loại xe quy định cho giấy phép lái xe các hạng B, C1, C, D1, D2;\n\nk) Hạng BE cấp cho người lái các loại xe ô tô quy định cho giấy phép lái xe hạng B kéo rơ moóc có khối lượng toàn bộ theo thiết kế trên 750 kg;\n\nl) Hạng C1E cấp cho người lái các loại xe ô tô quy định cho giấy phép lái xe hạng C1 kéo rơ moóc có khối lượng toàn bộ theo thiết kế trên 750 kg;\n\nm) Hạng CE cấp cho người lái các loại xe ô tô quy định cho giấy phép lái xe hạng C kéo rơ moóc có khối lượng toàn bộ theo thiết kế trên 750 kg; xe ô tô đầu kéo kéo sơ mi rơ moóc;\n\nn) Hạng D1E cấp cho người lái các loại xe ô tô quy định cho giấy phép lái xe hạng D1 kéo rơ moóc có khối lượng toàn bộ theo thiết kế trên 750 kg;\n\no) Hạng D2E cấp cho người lái các loại xe ô tô quy định cho giấy phép lái xe hạng D2 kéo rơ moóc có khối lượng toàn bộ theo thiết kế trên 750 kg;\n\np) Hạng DE cấp cho người lái các loại xe ô tô quy định cho giấy phép lái xe hạng D kéo rơ moóc có khối lượng toàn bộ theo thiết kế trên 750 kg; xe ô tô chở khách nối toa.\n\n2. Người khuyết tật điều khiển xe mô tô ba bánh dùng cho người khuyết tật được cấp giấy phép lái xe hạng A1.\n\nNgười khuyết tật điều khiển xe ô tô số tự động có kết cấu phù hợp với tình trạng khuyết tật thì được cấp giấy phép lái xe hạng B.\n\n3. Người điều khiển xe chở hàng bốn bánh có gắn động cơ, xe chở người bốn bánh có gắn động cơ phải sử dụng giấy phép lái xe có hạng phù hợp với xe ô tô tải hoặc xe ô tô chở người tương ứng.\n\n4. Người điều khiển xe ô tô có thiết kế, cải tạo với số chỗ ít hơn xe cùng loại, kích thước giới hạn tương đương phải sử dụng giấy phép lái xe có hạng phù hợp với xe ô tô cùng loại, kích thước giới hạn tương đương và có số chỗ nhiều nhất.\n\n5. Thời hạn của giấy phép lái xe được quy định như sau:\n\na) Giấy phép lái xe các hạng A1, A, B1 không thời hạn;\n\nb) Giấy phép lái xe hạng B và hạng C1 có thời hạn 10 năm kể từ ngày cấp;\n\nc) Giấy phép lái xe các hạng C, D1, D2, D, BE, C1E, CE, D1E, D2E và DE có thời hạn 05 năm kể từ ngày cấp.\n\n6. Giấy phép lái xe có giá trị sử dụng trong phạm vi lãnh thổ Việt Nam bao gồm:\n\na) Giấy phép lái xe do cơ quan có thẩm quyền của Việt Nam cấp;\n\nb) Giấy phép lái xe quốc tế và giấy phép lái xe quốc gia phù hợp với loại xe được phép điều khiển do quốc gia là thành viên của Công ước của Liên hợp quốc về Giao thông đường bộ năm 1968 (sau đây gọi là Công ước Viên) cấp;\n\nc) Giấy phép lái xe phù hợp với loại xe được phép điều khiển của nước hoặc vùng lãnh thổ mà Việt Nam ký kết điều ước quốc tế hoặc thỏa thuận quốc tế công nhận giấy phép lái xe của nhau;\n\nd) Giấy phép lái xe nước ngoài phù hợp với loại xe được phép điều khiển do quốc gia được công nhận theo điều ước quốc tế mà nước Cộng hòa xã hội chủ nghĩa Việt Nam là thành viên.\n\n7. Giấy phép lái xe không có hiệu lực trong các trường hợp sau đây:\n\na) Giấy phép lái xe hết thời hạn sử dụng;\n\nb) Giấy phép lái xe bị thu hồi theo quy định tại khoản 5 Điều 62 của Luật này.\n\n8. Giấy phép lái xe quốc tế được quy định như sau:\n\na) Giấy phép lái xe quốc tế là giấy phép lái xe do cơ quan nhà nước có thẩm quyền của quốc gia là thành viên của Công ước Viên cấp theo một mẫu thống nhất; có thời hạn không quá 03 năm kể từ ngày cấp và phải phù hợp với thời hạn còn hiệu lực của giấy phép lái xe quốc gia;']","**Nguồn văn bản:** /content/drive/MyDrive/ITProject_data/new_law/36_2024_QH15_444251.docx

**Tên văn bản:** Không có tiêu đề trong context

**Điều 57:** Giấy phép lái xe

**Nội dung:**

1. Giấy phép lái xe bao gồm các hạng sau đây:

    k) Hạng BE cấp cho người lái các loại xe ô tô quy định cho giấy phép lái xe hạng B kéo rơ moóc có khối lượng toàn bộ theo thiết kế trên 750 kg;


2.  Các hạng giấy phép lái xe khác cũng được quy định chi tiết trong điều này, bao gồm các hạng A1, A, B1, B, C1, C, D1, D2, D, C1E, CE, D1E, D2E và DE.  Mỗi hạng quy định loại xe cụ thể được phép lái.


Tóm lại: Giấy phép lái xe hạng BE được phép lái các loại xe ô tô quy định cho giấy phép lái xe hạng B kéo rơ moóc có khối lượng toàn bộ theo thiết kế trên 750 kg.  Điều này có nghĩa là hạng BE cho phép lái xe ô tô tải và ô tô chuyên dụng có khối lượng toàn bộ thiết kế đến 3.500kg  kết hợp với rơ moóc có khối lượng trên 750kg.
",Hạng BE cho phép lái xe ô tô chở người đến 9 chỗ ngồi kéo rơ moóc có trọng tải trên 750 kg.,0.8,0.9539424125532504,0.0,0.9999999999
6,Giấy phép lái xe hạng C1E cho phép lái những loại xe nào?,"['a) Chứng nhận đăng ký xe hoặc bản sao Chứng nhận đăng ký xe có chứng thực kèm bản gốc giấy tờ xác nhận của tổ chức tín dụng, chi nhánh ngân hàng nước ngoài còn hiệu lực trong trường hợp xe đang được thế chấp tại tổ chức tín dụng, chi nhánh ngân hàng nước ngoài;\n\nb) Giấy phép lái xe phù hợp với loại xe đang điều khiển;\n\nc) Chứng nhận kiểm định an toàn kỹ thuật và bảo vệ môi trường đối với xe cơ giới theo quy định của pháp luật;\n\nd) Chứng nhận bảo hiểm bắt buộc trách nhiệm dân sự của chủ xe cơ giới.\n\n2. Người điều khiển xe máy chuyên dùng tham gia giao thông đường bộ phải đủ tuổi, sức khỏe theo quy định của pháp luật; có bằng hoặc chứng chỉ điều khiển xe máy chuyên dùng phù hợp loại xe máy chuyên dùng đang điều khiển; có giấy phép lái xe đang còn điểm, còn hiệu lực hoặc chứng chỉ bồi dưỡng kiến thức pháp luật về giao thông đường bộ. Khi tham gia giao thông đường bộ, người điều khiển xe máy chuyên dùng phải mang theo các loại giấy tờ sau đây:\n\na) Chứng nhận đăng ký xe hoặc bản sao Chứng nhận đăng ký xe có chứng thực kèm bản gốc Giấy biên nhận còn hiệu lực của tổ chức tín dụng, chi nhánh ngân hàng nước ngoài trong trường hợp xe đang được thế chấp tại tổ chức tín dụng, chi nhánh ngân hàng nước ngoài;\n\nb) Bằng hoặc chứng chỉ điều khiển xe máy chuyên dùng;\n\nc) Giấy phép lái xe hoặc chứng chỉ bồi dưỡng kiến thức pháp luật về giao thông đường bộ;\n\nd) Chứng nhận kiểm định an toàn kỹ thuật và bảo vệ môi trường đối với xe máy chuyên dùng theo quy định của pháp luật;\n\nđ) Chứng nhận bảo hiểm bắt buộc trách nhiệm dân sự theo quy định của pháp luật.\n\n3. Trường hợp giấy tờ quy định tại khoản 1 và khoản 2 Điều này đã được tích hợp vào tài khoản định danh điện tử thì việc xuất trình, kiểm tra có thể thực hiện thông qua tài khoản định danh điện tử.\n\n4. Người lái xe gắn máy tham gia giao thông đường bộ phải hiểu biết quy tắc giao thông đường bộ, có kỹ năng điều khiển phương tiện; đủ điều kiện về độ tuổi, sức khỏe theo quy định tại điểm a khoản 1 và khoản 2 Điều 59 của Luật này.\n\n5. Người tập lái xe ô tô, người dự sát hạch lái xe ô tô khi tham gia giao thông đường bộ phải thực hành trên xe tập lái, xe sát hạch trên tuyến đường tập lái, tuyến đường sát hạch, có giáo viên dạy lái hoặc sát hạch viên bảo trợ tay lái. Giáo viên dạy lái, sát hạch viên phải mang theo các loại giấy tờ quy định tại khoản 1 Điều này.\n\nĐiều 57. Giấy phép lái xe\n\n1. Giấy phép lái xe bao gồm các hạng sau đây:\n\na) Hạng A1 cấp cho người lái xe mô tô hai bánh có dung tích xi-lanh đến 125 cm3 hoặc có công suất động cơ điện đến 11 kW;\n\nb) Hạng A cấp cho người lái xe mô tô hai bánh có dung tích xi-lanh\xa0 trên 125 cm3\xa0hoặc có công suất động cơ điện trên 11 kW và các loại xe quy định cho giấy phép lái xe hạng A1;\n\nc) Hạng B1 cấp cho người lái xe mô tô ba bánh và các loại xe quy định cho giấy phép lái xe hạng A1;\n\nd) Hạng B cấp cho người lái xe ô tô chở người đến 08 chỗ (không kể chỗ của người lái xe); xe ô tô tải và ô tô chuyên dùng có khối lượng toàn bộ theo thiết kế đến 3.500 kg; các loại xe ô tô quy định cho giấy phép lái xe hạng B kéo rơ moóc có khối lượng toàn bộ theo thiết kế đến 750 kg; \n\nđ) Hạng C1 cấp cho người lái xe ô tô tải và ô tô chuyên dùng có khối lượng toàn bộ theo thiết kế trên 3.500 kg đến 7.500 kg; các loại xe ô tô tải quy định cho giấy phép lái xe hạng C1 kéo rơ moóc có khối lượng toàn bộ theo thiết kế đến 750 kg; các loại xe quy định cho giấy phép lái xe hạng B;\n\ne) Hạng C cấp cho người lái xe ô tô tải và ô tô chuyên dùng có khối lượng toàn bộ theo thiết kế trên 7.500 kg; các loại xe ô tô tải quy định cho giấy phép lái xe hạng C kéo rơ moóc có khối lượng toàn bộ theo thiết kế đến 750 kg; các loại xe quy định cho giấy phép lái xe hạng B và hạng C1;\n\ng) Hạng D1 cấp cho người lái xe ô tô chở người trên 08 chỗ (không kể chỗ của người lái xe) đến 16 chỗ (không kể chỗ của người lái xe); các loại xe ô tô chở người quy định cho giấy phép lái xe hạng D1 kéo rơ moóc có khối lượng toàn bộ theo thiết kế đến 750 kg; các loại xe quy định cho giấy phép lái xe các hạng B, C1, C;\n\nh) Hạng D2 cấp cho người lái xe ô tô chở người (kể cả xe buýt) trên 16 chỗ (không kể chỗ của người lái xe) đến 29 chỗ (không kể chỗ của người lái xe); các loại xe ô tô chở người quy định cho giấy phép lái xe hạng D2 kéo rơ moóc có khối lượng toàn bộ theo thiết kế đến 750 kg; các loại xe quy định cho giấy phép lái xe các hạng B, C1, C, D1;\n\ni) Hạng D cấp cho người lái xe ô tô chở người (kể cả xe buýt) trên 29 chỗ (không kể chỗ của người lái xe); xe ô tô chở người giường nằm; các loại xe ô tô chở người quy định cho giấy phép lái xe hạng D kéo rơ moóc có khối lượng toàn bộ theo thiết kế đến 750 kg; các loại xe quy định cho giấy phép lái xe các hạng B, C1, C, D1, D2;\n\nk) Hạng BE cấp cho người lái các loại xe ô tô quy định cho giấy phép lái xe hạng B kéo rơ moóc có khối lượng toàn bộ theo thiết kế trên 750 kg;\n\nl) Hạng C1E cấp cho người lái các loại xe ô tô quy định cho giấy phép lái xe hạng C1 kéo rơ moóc có khối lượng toàn bộ theo thiết kế trên 750 kg;\n\nm) Hạng CE cấp cho người lái các loại xe ô tô quy định cho giấy phép lái xe hạng C kéo rơ moóc có khối lượng toàn bộ theo thiết kế trên 750 kg; xe ô tô đầu kéo kéo sơ mi rơ moóc;\n\nn) Hạng D1E cấp cho người lái các loại xe ô tô quy định cho giấy phép lái xe hạng D1 kéo rơ moóc có khối lượng toàn bộ theo thiết kế trên 750 kg;\n\no) Hạng D2E cấp cho người lái các loại xe ô tô quy định cho giấy phép lái xe hạng D2 kéo rơ moóc có khối lượng toàn bộ theo thiết kế trên 750 kg;\n\np) Hạng DE cấp cho người lái các loại xe ô tô quy định cho giấy phép lái xe hạng D kéo rơ moóc có khối lượng toàn bộ theo thiết kế trên 750 kg; xe ô tô chở khách nối toa.\n\n2. Người khuyết tật điều khiển xe mô tô ba bánh dùng cho người khuyết tật được cấp giấy phép lái xe hạng A1.\n\nNgười khuyết tật điều khiển xe ô tô số tự động có kết cấu phù hợp với tình trạng khuyết tật thì được cấp giấy phép lái xe hạng B.\n\n3. Người điều khiển xe chở hàng bốn bánh có gắn động cơ, xe chở người bốn bánh có gắn động cơ phải sử dụng giấy phép lái xe có hạng phù hợp với xe ô tô tải hoặc xe ô tô chở người tương ứng.\n\n4. Người điều khiển xe ô tô có thiết kế, cải tạo với số chỗ ít hơn xe cùng loại, kích thước giới hạn tương đương phải sử dụng giấy phép lái xe có hạng phù hợp với xe ô tô cùng loại, kích thước giới hạn tương đương và có số chỗ nhiều nhất.\n\n5. Thời hạn của giấy phép lái xe được quy định như sau:\n\na) Giấy phép lái xe các hạng A1, A, B1 không thời hạn;\n\nb) Giấy phép lái xe hạng B và hạng C1 có thời hạn 10 năm kể từ ngày cấp;\n\nc) Giấy phép lái xe các hạng C, D1, D2, D, BE, C1E, CE, D1E, D2E và DE có thời hạn 05 năm kể từ ngày cấp.\n\n6. Giấy phép lái xe có giá trị sử dụng trong phạm vi lãnh thổ Việt Nam bao gồm:\n\na) Giấy phép lái xe do cơ quan có thẩm quyền của Việt Nam cấp;\n\nb) Giấy phép lái xe quốc tế và giấy phép lái xe quốc gia phù hợp với loại xe được phép điều khiển do quốc gia là thành viên của Công ước của Liên hợp quốc về Giao thông đường bộ năm 1968 (sau đây gọi là Công ước Viên) cấp;\n\nc) Giấy phép lái xe phù hợp với loại xe được phép điều khiển của nước hoặc vùng lãnh thổ mà Việt Nam ký kết điều ước quốc tế hoặc thỏa thuận quốc tế công nhận giấy phép lái xe của nhau;\n\nd) Giấy phép lái xe nước ngoài phù hợp với loại xe được phép điều khiển do quốc gia được công nhận theo điều ước quốc tế mà nước Cộng hòa xã hội chủ nghĩa Việt Nam là thành viên.\n\n7. Giấy phép lái xe không có hiệu lực trong các trường hợp sau đây:\n\na) Giấy phép lái xe hết thời hạn sử dụng;\n\nb) Giấy phép lái xe bị thu hồi theo quy định tại khoản 5 Điều 62 của Luật này.\n\n8. Giấy phép lái xe quốc tế được quy định như sau:\n\na) Giấy phép lái xe quốc tế là giấy phép lái xe do cơ quan nhà nước có thẩm quyền của quốc gia là thành viên của Công ước Viên cấp theo một mẫu thống nhất; có thời hạn không quá 03 năm kể từ ngày cấp và phải phù hợp với thời hạn còn hiệu lực của giấy phép lái xe quốc gia;']","**Nguồn văn bản:** /content/drive/MyDrive/ITProject_data/new_law/36_2024_QH15_444251.docx

**Tên văn bản:** Không có tiêu đề trong context

**Điều 57:** Giấy phép lái xe

**Nội dung:**

1. Giấy phép lái xe bao gồm các hạng sau đây:

    l) Hạng C1E cấp cho người lái các loại xe ô tô quy định cho giấy phép lái xe hạng C1 kéo rơ moóc có khối lượng toàn bộ theo thiết kế trên 750 kg.


Tóm lại: Giấy phép lái xe hạng C1E cho phép lái các loại xe ô tô có khối lượng toàn bộ theo thiết kế từ 3.501 kg đến 7.500 kg (như quy định của hạng C1) và kéo theo rơ moóc có khối lượng toàn bộ thiết kế trên 750 kg.
",Hạng C1E cho phép lái xe ô tô tải có trọng tải từ 3.500 kg đến 7.500 kg kéo rơ moóc có trọng tải trên 750 kg.,1.0,0.878779326389941,1.0,0.9999999999
7,Giấy phép lái xe hạng D1E cho phép lái những loại xe nào?,"['a) Chứng nhận đăng ký xe hoặc bản sao Chứng nhận đăng ký xe có chứng thực kèm bản gốc giấy tờ xác nhận của tổ chức tín dụng, chi nhánh ngân hàng nước ngoài còn hiệu lực trong trường hợp xe đang được thế chấp tại tổ chức tín dụng, chi nhánh ngân hàng nước ngoài;\n\nb) Giấy phép lái xe phù hợp với loại xe đang điều khiển;\n\nc) Chứng nhận kiểm định an toàn kỹ thuật và bảo vệ môi trường đối với xe cơ giới theo quy định của pháp luật;\n\nd) Chứng nhận bảo hiểm bắt buộc trách nhiệm dân sự của chủ xe cơ giới.\n\n2. Người điều khiển xe máy chuyên dùng tham gia giao thông đường bộ phải đủ tuổi, sức khỏe theo quy định của pháp luật; có bằng hoặc chứng chỉ điều khiển xe máy chuyên dùng phù hợp loại xe máy chuyên dùng đang điều khiển; có giấy phép lái xe đang còn điểm, còn hiệu lực hoặc chứng chỉ bồi dưỡng kiến thức pháp luật về giao thông đường bộ. Khi tham gia giao thông đường bộ, người điều khiển xe máy chuyên dùng phải mang theo các loại giấy tờ sau đây:\n\na) Chứng nhận đăng ký xe hoặc bản sao Chứng nhận đăng ký xe có chứng thực kèm bản gốc Giấy biên nhận còn hiệu lực của tổ chức tín dụng, chi nhánh ngân hàng nước ngoài trong trường hợp xe đang được thế chấp tại tổ chức tín dụng, chi nhánh ngân hàng nước ngoài;\n\nb) Bằng hoặc chứng chỉ điều khiển xe máy chuyên dùng;\n\nc) Giấy phép lái xe hoặc chứng chỉ bồi dưỡng kiến thức pháp luật về giao thông đường bộ;\n\nd) Chứng nhận kiểm định an toàn kỹ thuật và bảo vệ môi trường đối với xe máy chuyên dùng theo quy định của pháp luật;\n\nđ) Chứng nhận bảo hiểm bắt buộc trách nhiệm dân sự theo quy định của pháp luật.\n\n3. Trường hợp giấy tờ quy định tại khoản 1 và khoản 2 Điều này đã được tích hợp vào tài khoản định danh điện tử thì việc xuất trình, kiểm tra có thể thực hiện thông qua tài khoản định danh điện tử.\n\n4. Người lái xe gắn máy tham gia giao thông đường bộ phải hiểu biết quy tắc giao thông đường bộ, có kỹ năng điều khiển phương tiện; đủ điều kiện về độ tuổi, sức khỏe theo quy định tại điểm a khoản 1 và khoản 2 Điều 59 của Luật này.\n\n5. Người tập lái xe ô tô, người dự sát hạch lái xe ô tô khi tham gia giao thông đường bộ phải thực hành trên xe tập lái, xe sát hạch trên tuyến đường tập lái, tuyến đường sát hạch, có giáo viên dạy lái hoặc sát hạch viên bảo trợ tay lái. Giáo viên dạy lái, sát hạch viên phải mang theo các loại giấy tờ quy định tại khoản 1 Điều này.\n\nĐiều 57. Giấy phép lái xe\n\n1. Giấy phép lái xe bao gồm các hạng sau đây:\n\na) Hạng A1 cấp cho người lái xe mô tô hai bánh có dung tích xi-lanh đến 125 cm3 hoặc có công suất động cơ điện đến 11 kW;\n\nb) Hạng A cấp cho người lái xe mô tô hai bánh có dung tích xi-lanh\xa0 trên 125 cm3\xa0hoặc có công suất động cơ điện trên 11 kW và các loại xe quy định cho giấy phép lái xe hạng A1;\n\nc) Hạng B1 cấp cho người lái xe mô tô ba bánh và các loại xe quy định cho giấy phép lái xe hạng A1;\n\nd) Hạng B cấp cho người lái xe ô tô chở người đến 08 chỗ (không kể chỗ của người lái xe); xe ô tô tải và ô tô chuyên dùng có khối lượng toàn bộ theo thiết kế đến 3.500 kg; các loại xe ô tô quy định cho giấy phép lái xe hạng B kéo rơ moóc có khối lượng toàn bộ theo thiết kế đến 750 kg; \n\nđ) Hạng C1 cấp cho người lái xe ô tô tải và ô tô chuyên dùng có khối lượng toàn bộ theo thiết kế trên 3.500 kg đến 7.500 kg; các loại xe ô tô tải quy định cho giấy phép lái xe hạng C1 kéo rơ moóc có khối lượng toàn bộ theo thiết kế đến 750 kg; các loại xe quy định cho giấy phép lái xe hạng B;\n\ne) Hạng C cấp cho người lái xe ô tô tải và ô tô chuyên dùng có khối lượng toàn bộ theo thiết kế trên 7.500 kg; các loại xe ô tô tải quy định cho giấy phép lái xe hạng C kéo rơ moóc có khối lượng toàn bộ theo thiết kế đến 750 kg; các loại xe quy định cho giấy phép lái xe hạng B và hạng C1;\n\ng) Hạng D1 cấp cho người lái xe ô tô chở người trên 08 chỗ (không kể chỗ của người lái xe) đến 16 chỗ (không kể chỗ của người lái xe); các loại xe ô tô chở người quy định cho giấy phép lái xe hạng D1 kéo rơ moóc có khối lượng toàn bộ theo thiết kế đến 750 kg; các loại xe quy định cho giấy phép lái xe các hạng B, C1, C;\n\nh) Hạng D2 cấp cho người lái xe ô tô chở người (kể cả xe buýt) trên 16 chỗ (không kể chỗ của người lái xe) đến 29 chỗ (không kể chỗ của người lái xe); các loại xe ô tô chở người quy định cho giấy phép lái xe hạng D2 kéo rơ moóc có khối lượng toàn bộ theo thiết kế đến 750 kg; các loại xe quy định cho giấy phép lái xe các hạng B, C1, C, D1;\n\ni) Hạng D cấp cho người lái xe ô tô chở người (kể cả xe buýt) trên 29 chỗ (không kể chỗ của người lái xe); xe ô tô chở người giường nằm; các loại xe ô tô chở người quy định cho giấy phép lái xe hạng D kéo rơ moóc có khối lượng toàn bộ theo thiết kế đến 750 kg; các loại xe quy định cho giấy phép lái xe các hạng B, C1, C, D1, D2;\n\nk) Hạng BE cấp cho người lái các loại xe ô tô quy định cho giấy phép lái xe hạng B kéo rơ moóc có khối lượng toàn bộ theo thiết kế trên 750 kg;\n\nl) Hạng C1E cấp cho người lái các loại xe ô tô quy định cho giấy phép lái xe hạng C1 kéo rơ moóc có khối lượng toàn bộ theo thiết kế trên 750 kg;\n\nm) Hạng CE cấp cho người lái các loại xe ô tô quy định cho giấy phép lái xe hạng C kéo rơ moóc có khối lượng toàn bộ theo thiết kế trên 750 kg; xe ô tô đầu kéo kéo sơ mi rơ moóc;\n\nn) Hạng D1E cấp cho người lái các loại xe ô tô quy định cho giấy phép lái xe hạng D1 kéo rơ moóc có khối lượng toàn bộ theo thiết kế trên 750 kg;\n\no) Hạng D2E cấp cho người lái các loại xe ô tô quy định cho giấy phép lái xe hạng D2 kéo rơ moóc có khối lượng toàn bộ theo thiết kế trên 750 kg;\n\np) Hạng DE cấp cho người lái các loại xe ô tô quy định cho giấy phép lái xe hạng D kéo rơ moóc có khối lượng toàn bộ theo thiết kế trên 750 kg; xe ô tô chở khách nối toa.\n\n2. Người khuyết tật điều khiển xe mô tô ba bánh dùng cho người khuyết tật được cấp giấy phép lái xe hạng A1.\n\nNgười khuyết tật điều khiển xe ô tô số tự động có kết cấu phù hợp với tình trạng khuyết tật thì được cấp giấy phép lái xe hạng B.\n\n3. Người điều khiển xe chở hàng bốn bánh có gắn động cơ, xe chở người bốn bánh có gắn động cơ phải sử dụng giấy phép lái xe có hạng phù hợp với xe ô tô tải hoặc xe ô tô chở người tương ứng.\n\n4. Người điều khiển xe ô tô có thiết kế, cải tạo với số chỗ ít hơn xe cùng loại, kích thước giới hạn tương đương phải sử dụng giấy phép lái xe có hạng phù hợp với xe ô tô cùng loại, kích thước giới hạn tương đương và có số chỗ nhiều nhất.\n\n5. Thời hạn của giấy phép lái xe được quy định như sau:\n\na) Giấy phép lái xe các hạng A1, A, B1 không thời hạn;\n\nb) Giấy phép lái xe hạng B và hạng C1 có thời hạn 10 năm kể từ ngày cấp;\n\nc) Giấy phép lái xe các hạng C, D1, D2, D, BE, C1E, CE, D1E, D2E và DE có thời hạn 05 năm kể từ ngày cấp.\n\n6. Giấy phép lái xe có giá trị sử dụng trong phạm vi lãnh thổ Việt Nam bao gồm:\n\na) Giấy phép lái xe do cơ quan có thẩm quyền của Việt Nam cấp;\n\nb) Giấy phép lái xe quốc tế và giấy phép lái xe quốc gia phù hợp với loại xe được phép điều khiển do quốc gia là thành viên của Công ước của Liên hợp quốc về Giao thông đường bộ năm 1968 (sau đây gọi là Công ước Viên) cấp;\n\nc) Giấy phép lái xe phù hợp với loại xe được phép điều khiển của nước hoặc vùng lãnh thổ mà Việt Nam ký kết điều ước quốc tế hoặc thỏa thuận quốc tế công nhận giấy phép lái xe của nhau;\n\nd) Giấy phép lái xe nước ngoài phù hợp với loại xe được phép điều khiển do quốc gia được công nhận theo điều ước quốc tế mà nước Cộng hòa xã hội chủ nghĩa Việt Nam là thành viên.\n\n7. Giấy phép lái xe không có hiệu lực trong các trường hợp sau đây:\n\na) Giấy phép lái xe hết thời hạn sử dụng;\n\nb) Giấy phép lái xe bị thu hồi theo quy định tại khoản 5 Điều 62 của Luật này.\n\n8. Giấy phép lái xe quốc tế được quy định như sau:\n\na) Giấy phép lái xe quốc tế là giấy phép lái xe do cơ quan nhà nước có thẩm quyền của quốc gia là thành viên của Công ước Viên cấp theo một mẫu thống nhất; có thời hạn không quá 03 năm kể từ ngày cấp và phải phù hợp với thời hạn còn hiệu lực của giấy phép lái xe quốc gia;']","**Nguồn văn bản:** /content/drive/MyDrive/ITProject_data/new_law/36_2024_QH15_444251.docx

**Tên văn bản:** Không có tiêu đề trong văn bản cung cấp.

**Điều 57:** Giấy phép lái xe

**Nội dung:**

1. Giấy phép lái xe bao gồm các hạng sau đây:

    a) Hạng A1 cấp cho người lái xe mô tô hai bánh có dung tích xi-lanh đến 125 cm3 hoặc có công suất động cơ điện đến 11 kW.

    b) Hạng A cấp cho người lái xe mô tô hai bánh có dung tích xi-lanh trên 125 cm3 hoặc có công suất động cơ điện trên 11 kW và các loại xe quy định cho giấy phép lái xe hạng A1.

    c) Hạng B1 cấp cho người lái xe mô tô ba bánh và các loại xe quy định cho giấy phép lái xe hạng A1.

    d) Hạng B cấp cho người lái xe ô tô chở người đến 08 chỗ (không kể chỗ của người lái xe); xe ô tô tải và ô tô chuyên dùng có khối lượng toàn bộ theo thiết kế đến 3.500 kg; các loại xe ô tô quy định cho giấy phép lái xe hạng B kéo rơ moóc có khối lượng toàn bộ theo thiết kế đến 750 kg.

    đ) Hạng C1 cấp cho người lái xe ô tô tải và ô tô chuyên dùng có khối lượng toàn bộ theo thiết kế trên 3.500 kg đến 7.500 kg; các loại xe ô tô tải quy định cho giấy phép lái xe hạng C1 kéo rơ moóc có khối lượng toàn bộ theo thiết kế đến 750 kg; các loại xe quy định cho giấy phép lái xe hạng B.

    e) Hạng C cấp cho người lái xe ô tô tải và ô tô chuyên dùng có khối lượng toàn bộ theo thiết kế trên 7.500 kg; các loại xe ô tô tải quy định cho giấy phép lái xe hạng C kéo rơ moóc có khối lượng toàn bộ theo thiết kế đến 750 kg; các loại xe quy định cho giấy phép lái xe hạng B và hạng C1.

    g) Hạng D1 cấp cho người lái xe ô tô chở người trên 08 chỗ (không kể chỗ của người lái xe) đến 16 chỗ (không kể chỗ của người lái xe); các loại xe ô tô chở người quy định cho giấy phép lái xe hạng D1 kéo rơ moóc có khối lượng toàn bộ theo thiết kế đến 750 kg; các loại xe quy định cho giấy phép lái xe các hạng B, C1, C.

    h) Hạng D2 cấp cho người lái xe ô tô chở người (kể cả xe buýt) trên 16 chỗ (không kể chỗ của người lái xe) đến 29 chỗ (không kể chỗ của người lái xe); các loại xe ô tô chở người quy định cho giấy phép lái xe hạng D2 kéo rơ moóc có khối lượng toàn bộ theo thiết kế đến 750 kg; các loại xe quy định cho giấy phép lái xe các hạng B, C1, C, D1.

    i) Hạng D cấp cho người lái xe ô tô chở người (kể cả xe buýt) trên 29 chỗ (không kể chỗ của người lái xe); xe ô tô chở người giường nằm; các loại xe ô tô chở người quy định cho giấy phép lái xe hạng D kéo rơ moóc có khối lượng toàn bộ theo thiết kế đến 750 kg; các loại xe quy định cho giấy phép lái xe các hạng B, C1, C, D1, D2.

    k) Hạng BE cấp cho người lái các loại xe ô tô quy định cho giấy phép lái xe hạng B kéo rơ moóc có khối lượng toàn bộ theo thiết kế trên 750 kg.

    l) Hạng C1E cấp cho người lái các loại xe ô tô quy định cho giấy phép lái xe hạng C1 kéo rơ moóc có khối lượng toàn bộ theo thiết kế trên 750 kg.

    m) Hạng CE cấp cho người lái các loại xe ô tô quy định cho giấy phép lái xe hạng C kéo rơ moóc có khối lượng toàn bộ theo thiết kế trên 750 kg; xe ô tô đầu kéo kéo sơ mi rơ moóc.

    n) Hạng D1E cấp cho người lái các loại xe ô tô quy định cho giấy phép lái xe hạng D1 kéo rơ moóc có khối lượng toàn bộ theo thiết kế trên 750 kg.

    o) Hạng D2E cấp cho người lái các loại xe ô tô quy định cho giấy phép lái xe hạng D2 kéo rơ moóc có khối lượng toàn bộ theo thiết kế trên 750 kg.

    p) Hạng DE cấp cho người lái các loại xe ô tô quy định cho giấy phép lái xe hạng D kéo rơ moóc có khối lượng toàn bộ theo thiết kế trên 750 kg; xe ô tô chở khách nối toa.


Tóm lại: Giấy phép lái xe hạng D1E được phép lái các loại xe ô tô quy định cho giấy phép lái xe hạng D1 kéo rơ moóc có khối lượng toàn bộ thiết kế trên 750kg.
",Hạng D1E cho phép lái xe ô tô chở người từ 10 đến 30 chỗ ngồi kéo rơ moóc có trọng tải trên 750 kg.,1.0,0.6704426992635986,0.0,0.9999999999
8,Giấy phép lái xe hạng D2E cho phép lái những loại xe nào?,"['a) Chứng nhận đăng ký xe hoặc bản sao Chứng nhận đăng ký xe có chứng thực kèm bản gốc giấy tờ xác nhận của tổ chức tín dụng, chi nhánh ngân hàng nước ngoài còn hiệu lực trong trường hợp xe đang được thế chấp tại tổ chức tín dụng, chi nhánh ngân hàng nước ngoài;\n\nb) Giấy phép lái xe phù hợp với loại xe đang điều khiển;\n\nc) Chứng nhận kiểm định an toàn kỹ thuật và bảo vệ môi trường đối với xe cơ giới theo quy định của pháp luật;\n\nd) Chứng nhận bảo hiểm bắt buộc trách nhiệm dân sự của chủ xe cơ giới.\n\n2. Người điều khiển xe máy chuyên dùng tham gia giao thông đường bộ phải đủ tuổi, sức khỏe theo quy định của pháp luật; có bằng hoặc chứng chỉ điều khiển xe máy chuyên dùng phù hợp loại xe máy chuyên dùng đang điều khiển; có giấy phép lái xe đang còn điểm, còn hiệu lực hoặc chứng chỉ bồi dưỡng kiến thức pháp luật về giao thông đường bộ. Khi tham gia giao thông đường bộ, người điều khiển xe máy chuyên dùng phải mang theo các loại giấy tờ sau đây:\n\na) Chứng nhận đăng ký xe hoặc bản sao Chứng nhận đăng ký xe có chứng thực kèm bản gốc Giấy biên nhận còn hiệu lực của tổ chức tín dụng, chi nhánh ngân hàng nước ngoài trong trường hợp xe đang được thế chấp tại tổ chức tín dụng, chi nhánh ngân hàng nước ngoài;\n\nb) Bằng hoặc chứng chỉ điều khiển xe máy chuyên dùng;\n\nc) Giấy phép lái xe hoặc chứng chỉ bồi dưỡng kiến thức pháp luật về giao thông đường bộ;\n\nd) Chứng nhận kiểm định an toàn kỹ thuật và bảo vệ môi trường đối với xe máy chuyên dùng theo quy định của pháp luật;\n\nđ) Chứng nhận bảo hiểm bắt buộc trách nhiệm dân sự theo quy định của pháp luật.\n\n3. Trường hợp giấy tờ quy định tại khoản 1 và khoản 2 Điều này đã được tích hợp vào tài khoản định danh điện tử thì việc xuất trình, kiểm tra có thể thực hiện thông qua tài khoản định danh điện tử.\n\n4. Người lái xe gắn máy tham gia giao thông đường bộ phải hiểu biết quy tắc giao thông đường bộ, có kỹ năng điều khiển phương tiện; đủ điều kiện về độ tuổi, sức khỏe theo quy định tại điểm a khoản 1 và khoản 2 Điều 59 của Luật này.\n\n5. Người tập lái xe ô tô, người dự sát hạch lái xe ô tô khi tham gia giao thông đường bộ phải thực hành trên xe tập lái, xe sát hạch trên tuyến đường tập lái, tuyến đường sát hạch, có giáo viên dạy lái hoặc sát hạch viên bảo trợ tay lái. Giáo viên dạy lái, sát hạch viên phải mang theo các loại giấy tờ quy định tại khoản 1 Điều này.\n\nĐiều 57. Giấy phép lái xe\n\n1. Giấy phép lái xe bao gồm các hạng sau đây:\n\na) Hạng A1 cấp cho người lái xe mô tô hai bánh có dung tích xi-lanh đến 125 cm3 hoặc có công suất động cơ điện đến 11 kW;\n\nb) Hạng A cấp cho người lái xe mô tô hai bánh có dung tích xi-lanh\xa0 trên 125 cm3\xa0hoặc có công suất động cơ điện trên 11 kW và các loại xe quy định cho giấy phép lái xe hạng A1;\n\nc) Hạng B1 cấp cho người lái xe mô tô ba bánh và các loại xe quy định cho giấy phép lái xe hạng A1;\n\nd) Hạng B cấp cho người lái xe ô tô chở người đến 08 chỗ (không kể chỗ của người lái xe); xe ô tô tải và ô tô chuyên dùng có khối lượng toàn bộ theo thiết kế đến 3.500 kg; các loại xe ô tô quy định cho giấy phép lái xe hạng B kéo rơ moóc có khối lượng toàn bộ theo thiết kế đến 750 kg; \n\nđ) Hạng C1 cấp cho người lái xe ô tô tải và ô tô chuyên dùng có khối lượng toàn bộ theo thiết kế trên 3.500 kg đến 7.500 kg; các loại xe ô tô tải quy định cho giấy phép lái xe hạng C1 kéo rơ moóc có khối lượng toàn bộ theo thiết kế đến 750 kg; các loại xe quy định cho giấy phép lái xe hạng B;\n\ne) Hạng C cấp cho người lái xe ô tô tải và ô tô chuyên dùng có khối lượng toàn bộ theo thiết kế trên 7.500 kg; các loại xe ô tô tải quy định cho giấy phép lái xe hạng C kéo rơ moóc có khối lượng toàn bộ theo thiết kế đến 750 kg; các loại xe quy định cho giấy phép lái xe hạng B và hạng C1;\n\ng) Hạng D1 cấp cho người lái xe ô tô chở người trên 08 chỗ (không kể chỗ của người lái xe) đến 16 chỗ (không kể chỗ của người lái xe); các loại xe ô tô chở người quy định cho giấy phép lái xe hạng D1 kéo rơ moóc có khối lượng toàn bộ theo thiết kế đến 750 kg; các loại xe quy định cho giấy phép lái xe các hạng B, C1, C;\n\nh) Hạng D2 cấp cho người lái xe ô tô chở người (kể cả xe buýt) trên 16 chỗ (không kể chỗ của người lái xe) đến 29 chỗ (không kể chỗ của người lái xe); các loại xe ô tô chở người quy định cho giấy phép lái xe hạng D2 kéo rơ moóc có khối lượng toàn bộ theo thiết kế đến 750 kg; các loại xe quy định cho giấy phép lái xe các hạng B, C1, C, D1;\n\ni) Hạng D cấp cho người lái xe ô tô chở người (kể cả xe buýt) trên 29 chỗ (không kể chỗ của người lái xe); xe ô tô chở người giường nằm; các loại xe ô tô chở người quy định cho giấy phép lái xe hạng D kéo rơ moóc có khối lượng toàn bộ theo thiết kế đến 750 kg; các loại xe quy định cho giấy phép lái xe các hạng B, C1, C, D1, D2;\n\nk) Hạng BE cấp cho người lái các loại xe ô tô quy định cho giấy phép lái xe hạng B kéo rơ moóc có khối lượng toàn bộ theo thiết kế trên 750 kg;\n\nl) Hạng C1E cấp cho người lái các loại xe ô tô quy định cho giấy phép lái xe hạng C1 kéo rơ moóc có khối lượng toàn bộ theo thiết kế trên 750 kg;\n\nm) Hạng CE cấp cho người lái các loại xe ô tô quy định cho giấy phép lái xe hạng C kéo rơ moóc có khối lượng toàn bộ theo thiết kế trên 750 kg; xe ô tô đầu kéo kéo sơ mi rơ moóc;\n\nn) Hạng D1E cấp cho người lái các loại xe ô tô quy định cho giấy phép lái xe hạng D1 kéo rơ moóc có khối lượng toàn bộ theo thiết kế trên 750 kg;\n\no) Hạng D2E cấp cho người lái các loại xe ô tô quy định cho giấy phép lái xe hạng D2 kéo rơ moóc có khối lượng toàn bộ theo thiết kế trên 750 kg;\n\np) Hạng DE cấp cho người lái các loại xe ô tô quy định cho giấy phép lái xe hạng D kéo rơ moóc có khối lượng toàn bộ theo thiết kế trên 750 kg; xe ô tô chở khách nối toa.\n\n2. Người khuyết tật điều khiển xe mô tô ba bánh dùng cho người khuyết tật được cấp giấy phép lái xe hạng A1.\n\nNgười khuyết tật điều khiển xe ô tô số tự động có kết cấu phù hợp với tình trạng khuyết tật thì được cấp giấy phép lái xe hạng B.\n\n3. Người điều khiển xe chở hàng bốn bánh có gắn động cơ, xe chở người bốn bánh có gắn động cơ phải sử dụng giấy phép lái xe có hạng phù hợp với xe ô tô tải hoặc xe ô tô chở người tương ứng.\n\n4. Người điều khiển xe ô tô có thiết kế, cải tạo với số chỗ ít hơn xe cùng loại, kích thước giới hạn tương đương phải sử dụng giấy phép lái xe có hạng phù hợp với xe ô tô cùng loại, kích thước giới hạn tương đương và có số chỗ nhiều nhất.\n\n5. Thời hạn của giấy phép lái xe được quy định như sau:\n\na) Giấy phép lái xe các hạng A1, A, B1 không thời hạn;\n\nb) Giấy phép lái xe hạng B và hạng C1 có thời hạn 10 năm kể từ ngày cấp;\n\nc) Giấy phép lái xe các hạng C, D1, D2, D, BE, C1E, CE, D1E, D2E và DE có thời hạn 05 năm kể từ ngày cấp.\n\n6. Giấy phép lái xe có giá trị sử dụng trong phạm vi lãnh thổ Việt Nam bao gồm:\n\na) Giấy phép lái xe do cơ quan có thẩm quyền của Việt Nam cấp;\n\nb) Giấy phép lái xe quốc tế và giấy phép lái xe quốc gia phù hợp với loại xe được phép điều khiển do quốc gia là thành viên của Công ước của Liên hợp quốc về Giao thông đường bộ năm 1968 (sau đây gọi là Công ước Viên) cấp;\n\nc) Giấy phép lái xe phù hợp với loại xe được phép điều khiển của nước hoặc vùng lãnh thổ mà Việt Nam ký kết điều ước quốc tế hoặc thỏa thuận quốc tế công nhận giấy phép lái xe của nhau;\n\nd) Giấy phép lái xe nước ngoài phù hợp với loại xe được phép điều khiển do quốc gia được công nhận theo điều ước quốc tế mà nước Cộng hòa xã hội chủ nghĩa Việt Nam là thành viên.\n\n7. Giấy phép lái xe không có hiệu lực trong các trường hợp sau đây:\n\na) Giấy phép lái xe hết thời hạn sử dụng;\n\nb) Giấy phép lái xe bị thu hồi theo quy định tại khoản 5 Điều 62 của Luật này.\n\n8. Giấy phép lái xe quốc tế được quy định như sau:\n\na) Giấy phép lái xe quốc tế là giấy phép lái xe do cơ quan nhà nước có thẩm quyền của quốc gia là thành viên của Công ước Viên cấp theo một mẫu thống nhất; có thời hạn không quá 03 năm kể từ ngày cấp và phải phù hợp với thời hạn còn hiệu lực của giấy phép lái xe quốc gia;']","**Nguồn văn bản:** /content/drive/MyDrive/ITProject_data/new_law/36_2024_QH15_444251.docx

**Nội dung:**

Giấy phép lái xe hạng D2E được phép lái các loại xe ô tô quy định cho giấy phép lái xe hạng D2 kéo rơ moóc có khối lượng toàn bộ theo thiết kế trên 750 kg.  Điều này có nghĩa là, ngoài việc được lái các loại xe quy định cho hạng D2 (ô tô chở người trên 16 chỗ đến 29 chỗ, không kể chỗ lái), người sở hữu giấy phép lái xe hạng D2E còn được phép lái các loại xe này khi kéo theo rơ moóc có khối lượng toàn bộ thiết kế vượt quá 750kg.


Tóm lại: Giấy phép lái xe hạng D2E cho phép lái các loại xe quy định cho hạng D2 và được phép kéo theo rơ moóc có khối lượng trên 750kg.
",Hạng D2E cho phép lái xe ô tô chở người trên 30 chỗ ngồi kéo rơ moóc có trọng tải trên 750 kg.,1.0,0.9623158390648158,0.0,0.9999999999
9,Giấy phép lái xe hạng DE cho phép lái những loại xe nào?,"['a) Chứng nhận đăng ký xe hoặc bản sao Chứng nhận đăng ký xe có chứng thực kèm bản gốc giấy tờ xác nhận của tổ chức tín dụng, chi nhánh ngân hàng nước ngoài còn hiệu lực trong trường hợp xe đang được thế chấp tại tổ chức tín dụng, chi nhánh ngân hàng nước ngoài;\n\nb) Giấy phép lái xe phù hợp với loại xe đang điều khiển;\n\nc) Chứng nhận kiểm định an toàn kỹ thuật và bảo vệ môi trường đối với xe cơ giới theo quy định của pháp luật;\n\nd) Chứng nhận bảo hiểm bắt buộc trách nhiệm dân sự của chủ xe cơ giới.\n\n2. Người điều khiển xe máy chuyên dùng tham gia giao thông đường bộ phải đủ tuổi, sức khỏe theo quy định của pháp luật; có bằng hoặc chứng chỉ điều khiển xe máy chuyên dùng phù hợp loại xe máy chuyên dùng đang điều khiển; có giấy phép lái xe đang còn điểm, còn hiệu lực hoặc chứng chỉ bồi dưỡng kiến thức pháp luật về giao thông đường bộ. Khi tham gia giao thông đường bộ, người điều khiển xe máy chuyên dùng phải mang theo các loại giấy tờ sau đây:\n\na) Chứng nhận đăng ký xe hoặc bản sao Chứng nhận đăng ký xe có chứng thực kèm bản gốc Giấy biên nhận còn hiệu lực của tổ chức tín dụng, chi nhánh ngân hàng nước ngoài trong trường hợp xe đang được thế chấp tại tổ chức tín dụng, chi nhánh ngân hàng nước ngoài;\n\nb) Bằng hoặc chứng chỉ điều khiển xe máy chuyên dùng;\n\nc) Giấy phép lái xe hoặc chứng chỉ bồi dưỡng kiến thức pháp luật về giao thông đường bộ;\n\nd) Chứng nhận kiểm định an toàn kỹ thuật và bảo vệ môi trường đối với xe máy chuyên dùng theo quy định của pháp luật;\n\nđ) Chứng nhận bảo hiểm bắt buộc trách nhiệm dân sự theo quy định của pháp luật.\n\n3. Trường hợp giấy tờ quy định tại khoản 1 và khoản 2 Điều này đã được tích hợp vào tài khoản định danh điện tử thì việc xuất trình, kiểm tra có thể thực hiện thông qua tài khoản định danh điện tử.\n\n4. Người lái xe gắn máy tham gia giao thông đường bộ phải hiểu biết quy tắc giao thông đường bộ, có kỹ năng điều khiển phương tiện; đủ điều kiện về độ tuổi, sức khỏe theo quy định tại điểm a khoản 1 và khoản 2 Điều 59 của Luật này.\n\n5. Người tập lái xe ô tô, người dự sát hạch lái xe ô tô khi tham gia giao thông đường bộ phải thực hành trên xe tập lái, xe sát hạch trên tuyến đường tập lái, tuyến đường sát hạch, có giáo viên dạy lái hoặc sát hạch viên bảo trợ tay lái. Giáo viên dạy lái, sát hạch viên phải mang theo các loại giấy tờ quy định tại khoản 1 Điều này.\n\nĐiều 57. Giấy phép lái xe\n\n1. Giấy phép lái xe bao gồm các hạng sau đây:\n\na) Hạng A1 cấp cho người lái xe mô tô hai bánh có dung tích xi-lanh đến 125 cm3 hoặc có công suất động cơ điện đến 11 kW;\n\nb) Hạng A cấp cho người lái xe mô tô hai bánh có dung tích xi-lanh\xa0 trên 125 cm3\xa0hoặc có công suất động cơ điện trên 11 kW và các loại xe quy định cho giấy phép lái xe hạng A1;\n\nc) Hạng B1 cấp cho người lái xe mô tô ba bánh và các loại xe quy định cho giấy phép lái xe hạng A1;\n\nd) Hạng B cấp cho người lái xe ô tô chở người đến 08 chỗ (không kể chỗ của người lái xe); xe ô tô tải và ô tô chuyên dùng có khối lượng toàn bộ theo thiết kế đến 3.500 kg; các loại xe ô tô quy định cho giấy phép lái xe hạng B kéo rơ moóc có khối lượng toàn bộ theo thiết kế đến 750 kg; \n\nđ) Hạng C1 cấp cho người lái xe ô tô tải và ô tô chuyên dùng có khối lượng toàn bộ theo thiết kế trên 3.500 kg đến 7.500 kg; các loại xe ô tô tải quy định cho giấy phép lái xe hạng C1 kéo rơ moóc có khối lượng toàn bộ theo thiết kế đến 750 kg; các loại xe quy định cho giấy phép lái xe hạng B;\n\ne) Hạng C cấp cho người lái xe ô tô tải và ô tô chuyên dùng có khối lượng toàn bộ theo thiết kế trên 7.500 kg; các loại xe ô tô tải quy định cho giấy phép lái xe hạng C kéo rơ moóc có khối lượng toàn bộ theo thiết kế đến 750 kg; các loại xe quy định cho giấy phép lái xe hạng B và hạng C1;\n\ng) Hạng D1 cấp cho người lái xe ô tô chở người trên 08 chỗ (không kể chỗ của người lái xe) đến 16 chỗ (không kể chỗ của người lái xe); các loại xe ô tô chở người quy định cho giấy phép lái xe hạng D1 kéo rơ moóc có khối lượng toàn bộ theo thiết kế đến 750 kg; các loại xe quy định cho giấy phép lái xe các hạng B, C1, C;\n\nh) Hạng D2 cấp cho người lái xe ô tô chở người (kể cả xe buýt) trên 16 chỗ (không kể chỗ của người lái xe) đến 29 chỗ (không kể chỗ của người lái xe); các loại xe ô tô chở người quy định cho giấy phép lái xe hạng D2 kéo rơ moóc có khối lượng toàn bộ theo thiết kế đến 750 kg; các loại xe quy định cho giấy phép lái xe các hạng B, C1, C, D1;\n\ni) Hạng D cấp cho người lái xe ô tô chở người (kể cả xe buýt) trên 29 chỗ (không kể chỗ của người lái xe); xe ô tô chở người giường nằm; các loại xe ô tô chở người quy định cho giấy phép lái xe hạng D kéo rơ moóc có khối lượng toàn bộ theo thiết kế đến 750 kg; các loại xe quy định cho giấy phép lái xe các hạng B, C1, C, D1, D2;\n\nk) Hạng BE cấp cho người lái các loại xe ô tô quy định cho giấy phép lái xe hạng B kéo rơ moóc có khối lượng toàn bộ theo thiết kế trên 750 kg;\n\nl) Hạng C1E cấp cho người lái các loại xe ô tô quy định cho giấy phép lái xe hạng C1 kéo rơ moóc có khối lượng toàn bộ theo thiết kế trên 750 kg;\n\nm) Hạng CE cấp cho người lái các loại xe ô tô quy định cho giấy phép lái xe hạng C kéo rơ moóc có khối lượng toàn bộ theo thiết kế trên 750 kg; xe ô tô đầu kéo kéo sơ mi rơ moóc;\n\nn) Hạng D1E cấp cho người lái các loại xe ô tô quy định cho giấy phép lái xe hạng D1 kéo rơ moóc có khối lượng toàn bộ theo thiết kế trên 750 kg;\n\no) Hạng D2E cấp cho người lái các loại xe ô tô quy định cho giấy phép lái xe hạng D2 kéo rơ moóc có khối lượng toàn bộ theo thiết kế trên 750 kg;\n\np) Hạng DE cấp cho người lái các loại xe ô tô quy định cho giấy phép lái xe hạng D kéo rơ moóc có khối lượng toàn bộ theo thiết kế trên 750 kg; xe ô tô chở khách nối toa.\n\n2. Người khuyết tật điều khiển xe mô tô ba bánh dùng cho người khuyết tật được cấp giấy phép lái xe hạng A1.\n\nNgười khuyết tật điều khiển xe ô tô số tự động có kết cấu phù hợp với tình trạng khuyết tật thì được cấp giấy phép lái xe hạng B.\n\n3. Người điều khiển xe chở hàng bốn bánh có gắn động cơ, xe chở người bốn bánh có gắn động cơ phải sử dụng giấy phép lái xe có hạng phù hợp với xe ô tô tải hoặc xe ô tô chở người tương ứng.\n\n4. Người điều khiển xe ô tô có thiết kế, cải tạo với số chỗ ít hơn xe cùng loại, kích thước giới hạn tương đương phải sử dụng giấy phép lái xe có hạng phù hợp với xe ô tô cùng loại, kích thước giới hạn tương đương và có số chỗ nhiều nhất.\n\n5. Thời hạn của giấy phép lái xe được quy định như sau:\n\na) Giấy phép lái xe các hạng A1, A, B1 không thời hạn;\n\nb) Giấy phép lái xe hạng B và hạng C1 có thời hạn 10 năm kể từ ngày cấp;\n\nc) Giấy phép lái xe các hạng C, D1, D2, D, BE, C1E, CE, D1E, D2E và DE có thời hạn 05 năm kể từ ngày cấp.\n\n6. Giấy phép lái xe có giá trị sử dụng trong phạm vi lãnh thổ Việt Nam bao gồm:\n\na) Giấy phép lái xe do cơ quan có thẩm quyền của Việt Nam cấp;\n\nb) Giấy phép lái xe quốc tế và giấy phép lái xe quốc gia phù hợp với loại xe được phép điều khiển do quốc gia là thành viên của Công ước của Liên hợp quốc về Giao thông đường bộ năm 1968 (sau đây gọi là Công ước Viên) cấp;\n\nc) Giấy phép lái xe phù hợp với loại xe được phép điều khiển của nước hoặc vùng lãnh thổ mà Việt Nam ký kết điều ước quốc tế hoặc thỏa thuận quốc tế công nhận giấy phép lái xe của nhau;\n\nd) Giấy phép lái xe nước ngoài phù hợp với loại xe được phép điều khiển do quốc gia được công nhận theo điều ước quốc tế mà nước Cộng hòa xã hội chủ nghĩa Việt Nam là thành viên.\n\n7. Giấy phép lái xe không có hiệu lực trong các trường hợp sau đây:\n\na) Giấy phép lái xe hết thời hạn sử dụng;\n\nb) Giấy phép lái xe bị thu hồi theo quy định tại khoản 5 Điều 62 của Luật này.\n\n8. Giấy phép lái xe quốc tế được quy định như sau:\n\na) Giấy phép lái xe quốc tế là giấy phép lái xe do cơ quan nhà nước có thẩm quyền của quốc gia là thành viên của Công ước Viên cấp theo một mẫu thống nhất; có thời hạn không quá 03 năm kể từ ngày cấp và phải phù hợp với thời hạn còn hiệu lực của giấy phép lái xe quốc gia;']","**Nguồn văn bản:** /content/drive/MyDrive/ITProject_data/new_law/36_2024_QH15_444251.docx

**Nội dung:**

Giấy phép lái xe hạng DE cấp cho người lái:

a) Các loại xe ô tô quy định cho giấy phép lái xe hạng D kéo rơ moóc có khối lượng toàn bộ theo thiết kế trên 750 kg;

b) Xe ô tô chở khách nối toa.


Tóm lại: Giấy phép lái xe hạng DE cho phép lái các loại xe ô tô quy định cho giấy phép lái xe hạng D kéo rơ moóc trên 750kg và xe ô tô chở khách nối toa.
",Hạng DE cho phép lái xe ô tô chở người trên 30 chỗ ngồi kéo rơ moóc có trọng tải trên 750 kg.,1.0,0.9338494491325932,0.0,0.9999999999
10,Luật Giao thông Đường bộ 2025 quy định như thế nào về điểm giấy phép lái xe?,"['a) Giấy phép lái xe hết thời hạn sử dụng;\n\nb) Giấy phép lái xe bị thu hồi theo quy định tại khoản 5 Điều 62 của Luật này.\n\n8. Giấy phép lái xe quốc tế được quy định như sau:\n\na) Giấy phép lái xe quốc tế là giấy phép lái xe do cơ quan nhà nước có thẩm quyền của quốc gia là thành viên của Công ước Viên cấp theo một mẫu thống nhất; có thời hạn không quá 03 năm kể từ ngày cấp và phải phù hợp với thời hạn còn hiệu lực của giấy phép lái xe quốc gia;\n\nb) Người có giấy phép lái xe quốc tế do quốc gia là thành viên của Công ước Viên cấp khi lái xe tham gia giao thông đường bộ trên lãnh thổ Việt Nam phải mang theo giấy phép lái xe quốc tế và giấy phép lái xe quốc gia được cấp phù hợp với hạng xe điều khiển, còn thời hạn sử dụng; phải tuân thủ pháp luật về trật tự, an toàn giao thông đường bộ của Việt Nam;\n\nc) Người có giấy phép lái xe quốc tế vi phạm pháp luật về trật tự, an toàn giao thông đường bộ của Việt Nam mà bị tước quyền sử dụng giấy phép lái xe có thời hạn thì thời gian bị tước quyền sử dụng không quá thời gian người lái xe được phép cư trú tại lãnh thổ Việt Nam;\n\nd) Người Việt Nam hoặc người nước ngoài có thẻ thường trú hoặc thẻ tạm trú tại Việt Nam có giấy phép lái xe do Việt Nam hoặc quốc gia là thành viên của điều ước quốc tế mà nước Cộng hòa xã hội chủ nghĩa Việt Nam là thành viên cấp, còn giá trị sử dụng, nếu có nhu cầu được cấp giấy phép lái xe quốc tế.\n\n9. Bộ trưởng Bộ Giao thông vận tải quy định mẫu giấy phép lái xe và giấy phép lái xe quốc tế, trình tự, thủ tục cấp và việc sử dụng giấy phép lái xe, giấy phép lái xe quốc tế; đối với mẫu giấy phép lái xe, trình tự, thủ tục cấp và việc sử dụng giấy phép lái xe của lực lượng quân đội, công an làm nhiệm vụ quốc phòng, an ninh do Bộ trưởng Bộ Quốc phòng, Bộ trưởng Bộ Công an quy định.\n\nĐiều 58. Điểm của giấy phép lái xe \n\n1. Điểm của giấy phép lái xe được dùng để quản lý việc chấp hành pháp luật về trật tự, an toàn giao thông đường bộ của người lái xe trên hệ thống cơ sở dữ liệu về trật tự, an toàn giao thông đường bộ, bao gồm 12 điểm. Số điểm trừ mỗi lần vi phạm tùy thuộc tính chất, mức độ của hành vi vi phạm pháp luật về trật tự, an toàn giao thông đường bộ. Dữ liệu về điểm trừ giấy phép lái xe của người vi phạm sẽ được cập nhật vào hệ thống cơ sở dữ liệu ngay sau khi quyết định xử phạt có hiệu lực thi hành và thông báo cho người bị trừ điểm giấy phép lái xe biết.\n\n2. Giấy phép lái xe chưa bị trừ hết điểm và không bị trừ điểm trong thời hạn 12 tháng từ ngày bị trừ điểm gần nhất thì được phục hồi đủ 12 điểm.\n\n3. Trường hợp giấy phép lái xe bị trừ hết điểm thì người có giấy phép lái xe không được điều khiển phương tiện tham gia giao thông đường bộ theo giấy phép lái xe đó. Sau thời hạn ít nhất là 06 tháng kể từ ngày bị trừ hết điểm, người có giấy phép lái xe được tham gia kiểm tra nội dung kiến thức pháp luật về trật tự, an toàn giao thông đường bộ theo quy định tại khoản 7 Điều 61 của Luật này do lực lượng Cảnh sát giao thông tổ chức, có kết quả đạt yêu cầu thì được phục hồi đủ 12 điểm.\n\n4. Giấy phép lái xe sau khi đổi, cấp lại, nâng hạng được giữ nguyên số điểm của giấy phép lái xe trước khi đổi, cấp lại, nâng hạng.\n\n5. Người có thẩm quyền xử phạt vi phạm hành chính có thẩm quyền trừ điểm giấy phép lái xe.\n\n6. Chính phủ quy định chi tiết khoản 1 Điều này; quy định trình tự, thủ tục, thẩm quyền trừ điểm, phục hồi điểm giấy phép lái xe; quy định lộ trình thực hiện Điều này. Bộ trưởng Bộ Công an quy định chi tiết khoản 3 Điều này.\n\nĐiều 59. Tuổi, sức khỏe của người điều khiển phương tiện tham gia giao thông đường bộ\n\n1. Độ tuổi của người lái xe, người điều khiển xe máy chuyên dùng được quy định như sau:\n\na) Người đủ 16 tuổi trở lên được điều khiển xe gắn máy;\n\nb) Người đủ 18 tuổi trở lên được cấp giấy phép lái xe hạng A1, A, B1, B, C1, được cấp chứng chỉ bồi dưỡng kiến thức pháp luật về giao thông đường bộ để điều khiển xe máy chuyên dùng tham gia giao thông đường bộ;\n\nc) Người đủ 21 tuổi trở lên được cấp giấy phép lái xe hạng C, BE;\n\nd) Người đủ 24 tuổi trở lên được cấp giấy phép lái xe hạng D1, D2, C1E, CE;\n\nđ) Người đủ 27 tuổi trở lên được cấp giấy phép lái xe hạng D, D1E, D2E, DE;\n\ne) Tuổi tối đa của người lái xe ô tô chở người (kể cả xe buýt) trên 29 chỗ (không kể chỗ của người lái xe), xe ô tô chở người giường nằm là đủ 57 tuổi đối với nam, đủ 55 tuổi đối với nữ.\n\n2. Người điều khiển phương tiện tham gia giao thông đường bộ phải bảo đảm điều kiện sức khỏe phù hợp với từng loại phương tiện được phép điều khiển. Bộ trưởng Bộ Y tế quy định về tiêu chuẩn sức khỏe, việc khám sức khỏe đối với người lái xe, người điều khiển xe máy chuyên dùng; việc khám sức khỏe định kỳ đối với người hành nghề lái xe ô tô; xây dựng cơ sở dữ liệu về sức khỏe của người lái xe, người điều khiển xe máy chuyên dùng.\n\n3. Bộ trưởng Bộ Quốc phòng, Bộ trưởng Bộ Công an quy định độ tuổi của người lái xe trong lực lượng quân đội, công an làm nhiệm vụ quốc phòng, an ninh.\n\nĐiều 60. Đào tạo lái xe\n\n1. Người có nhu cầu được cấp giấy phép lái xe phải được đào tạo nội dung lý thuyết và thực hành theo chương trình đào tạo quy định cho từng hạng giấy phép lái xe.\n\n2. Người học lái xe phải được đào tạo tại các cơ sở đào tạo lái xe hoặc các hình thức đào tạo lái xe khác để cấp mới hoặc nâng hạng giấy phép lái xe.\n\n3. Việc đào tạo để nâng hạng giấy phép lái xe thực hiện đối với những đối tượng sau đây:\n\na) Nâng hạng giấy phép lái xe từ hạng B lên hạng C1 hoặc lên hạng C hoặc lên hạng D1 hoặc lên hạng D2;\n\nb) Nâng hạng giấy phép lái xe từ hạng C1 lên hạng C hoặc lên hạng D1 hoặc lên hạng D2;\n\nc) Nâng hạng giấy phép lái xe từ hạng C lên hạng D1 hoặc lên hạng D2 hoặc lên hạng D;\n\nd) Nâng hạng giấy phép lái xe từ hạng D1 lên hạng D2 hoặc lên hạng D;\n\nđ) Nâng hạng giấy phép lái xe từ hạng D2 lên hạng D;\n\ne) Nâng hạng giấy phép lái xe từ hạng B lên hạng BE, từ hạng C1 lên\xa0 hạng C1E, từ hạng C lên hạng CE, từ hạng D1 lên hạng D1E, từ hạng D2 lên hạng D2E, từ hạng D lên hạng DE.\n\n4.\xa0Người có nhu cầu được đào tạo nâng hạng giấy phép lái xe khi giấy phép lái xe còn hiệu lực, phải có đủ thời gian lái xe an toàn quy định cho từng hạng giấy phép lái xe;\xa0đối với việc nâng hạng giấy phép lái xe lên hạng D1, D2, D thì người có nhu cầu được đào tạo còn phải có trình độ từ trung học cơ sở trở lên.\n\n5. Giấy phép lái xe các hạng C, D1, D2, D, BE, C1E, CE, D1E, D2E, DE phải được đào tạo bằng hình thức đào tạo nâng hạng theo các điều kiện quy định tại khoản 3 và khoản 4 Điều này.\n\n6. Cơ sở đào tạo lái xe ô tô phải đáp ứng các điều kiện do Chính phủ quy định; có giáo trình, giáo án; thực hiện đào tạo theo đúng hình thức, nội dung và chương trình quy định cho từng hạng giấy phép lái xe.\n\n7. Chính phủ quy định chi tiết các hình thức đào tạo lái xe khác quy định tại khoản 2 Điều này; quy định trình tự, thủ tục kiểm tra, đánh giá để cấp, cấp lại và thu hồi giấy phép xe tập lái; quy định tiêu chuẩn của giáo viên dạy lái xe; quy định việc cấp, cấp lại và thu hồi giấy chứng nhận giáo viên dạy lái xe; quy định việc cấp, cấp lại và thu hồi giấy phép đào tạo lái xe.\n\n8. Bộ trưởng Bộ Giao thông vận tải quy định hình thức, nội dung, chương trình đào tạo lái xe, thời gian lái xe an toàn cho từng hạng giấy phép lái xe quy định tại khoản 4 Điều này và quy định tiêu chuẩn của cơ sở đào tạo lái xe mô tô; đối với cơ sở đào tạo, tổ chức đào tạo lái xe cho lực lượng quân đội, công an làm nhiệm vụ quốc phòng, an ninh do Bộ trưởng Bộ Quốc phòng, Bộ trưởng Bộ Công an quy định.\n\nĐiều 61. Sát hạch lái xe\n\n1. Người đã hoàn thành chương trình đào tạo lái xe, có độ tuổi, sức khỏe theo quy định tại Điều 59 của Luật này được đăng ký để tham dự kỳ sát hạch lái xe.\n\n2. Nội dung sát hạch lái xe phải phù hợp với hạng giấy phép lái xe và chương trình đào tạo lái xe.\n\n3. Hoạt động sát hạch lái xe ô tô phải thực hiện tại các trung tâm sát hạch lái xe; hoạt động sát hạch lái xe mô tô thực hiện tại các trung tâm sát hạch lái xe hoặc tại sân tập lái đáp ứng điều kiện, tiêu chuẩn về cơ sở vật chất, kỹ thuật. Hoạt động sát hạch lái xe do cơ quan nhà nước có thẩm quyền thực hiện.']","**Nguồn văn bản:** /content/drive/MyDrive/ITProject_data/new_law/36_2024_QH15_444251.docx

**Tên văn bản:** Không có thông tin

**Điều 58:** Điểm của giấy phép lái xe

**Nội dung:**

1. Điểm của giấy phép lái xe được dùng để quản lý việc chấp hành pháp luật về trật tự, an toàn giao thông đường bộ của người lái xe trên hệ thống cơ sở dữ liệu về trật tự, an toàn giao thông đường bộ, bao gồm 12 điểm. Số điểm trừ mỗi lần vi phạm tùy thuộc tính chất, mức độ của hành vi vi phạm pháp luật về trật tự, an toàn giao thông đường bộ. Dữ liệu về điểm trừ giấy phép lái xe của người vi phạm sẽ được cập nhật vào hệ thống cơ sở dữ liệu ngay sau khi quyết định xử phạt có hiệu lực thi hành và thông báo cho người bị trừ điểm giấy phép lái xe biết.

2. Giấy phép lái xe chưa bị trừ hết điểm và không bị trừ điểm trong thời hạn 12 tháng từ ngày bị trừ điểm gần nhất thì được phục hồi đủ 12 điểm.

3. Trường hợp giấy phép lái xe bị trừ hết điểm thì người có giấy phép lái xe không được điều khiển phương tiện tham gia giao thông đường bộ theo giấy phép lái xe đó. Sau thời hạn ít nhất là 06 tháng kể từ ngày bị trừ hết điểm, người có giấy phép lái xe được tham gia kiểm tra nội dung kiến thức pháp luật về trật tự, an toàn giao thông đường bộ theo quy định tại khoản 7 Điều 61 của Luật này do lực lượng Cảnh sát giao thông tổ chức, có kết quả đạt yêu cầu thì được phục hồi đủ 12 điểm.

4. Giấy phép lái xe sau khi đổi, cấp lại, nâng hạng được giữ nguyên số điểm của giấy phép lái xe trước khi đổi, cấp lại, nâng hạng.

5. Người có thẩm quyền xử phạt vi phạm hành chính có thẩm quyền trừ điểm giấy phép lái xe.

6. Chính phủ quy định chi tiết khoản 1 Điều này; quy định trình tự, thủ tục, thẩm quyền trừ điểm, phục hồi điểm giấy phép lái xe; quy định lộ trình thực hiện Điều này. Bộ trưởng Bộ Công an quy định chi tiết khoản 3 Điều này.


Tóm lại: Giấy phép lái xe có 12 điểm.  Vi phạm luật giao thông sẽ bị trừ điểm, tùy thuộc vào mức độ vi phạm.  Nếu hết điểm, người lái xe sẽ không được phép lái xe trong 6 tháng và phải thi lại kiến thức luật giao thông để được phục hồi điểm.  Giấy phép lái xe được giữ nguyên số điểm khi đổi, cấp lại hoặc nâng hạng.
","Mỗi giấy phép lái xe có 12 điểm; nếu bị trừ hết điểm, người lái xe phải tham gia kiểm tra phục hồi điểm.",1.0,0.6618028462348321,1.0,0.9999999999
11,Người lái xe máy cần làm gì để phục hồi điểm giấy phép lái xe?,"['đ) Không trừ điểm giấy phép lái xe khi giấy phép lái xe đó đang trong thời hạn bị tước quyền sử dụng giấy phép lái xe.\n\n2. Thẩm quyền trừ điểm giấy phép lái xe\n\nNgười có thẩm quyền áp dụng hình thức xử phạt tước quyền sử dụng giấy phép, chứng chỉ hành nghề có thời hạn hoặc đình chỉ hoạt động có thời hạn quy định tại Chương II Phần thứ hai của Luật Xử lý vi phạm hành chính, Mục 1 Chương III của Nghị định này và có thẩm quyền xử phạt vi phạm hành chính đối với hành vi vi phạm có quy định trừ điểm giấy phép lái xe thì có thẩm quyền trừ điểm giấy phép lái xe đối với hành vi vi phạm đó.\n\n3. Trình tự, thủ tục trừ điểm giấy phép lái xe\n\na) Ngay sau khi quyết định xử phạt vi phạm hành chính có hiệu lực thi hành, dữ liệu trừ điểm giấy phép lái xe của người bị xử phạt sẽ được cập nhật tự động vào Cơ sở dữ liệu về xử lý vi phạm hành chính về trật tự, an toàn giao thông đường bộ, người có thẩm quyền trừ điểm giấy phép lái xe thông báo cho người bị trừ điểm giấy phép lái xe biết việc trừ điểm.\n\nTrường hợp Chủ tịch Ủy ban nhân dân cấp huyện, Chủ tịch Ủy ban nhân dân cấp tỉnh ra quyết định xử phạt vi phạm hành chính đối với hành vi vi phạm có trừ điểm giấy phép lái xe thì Trưởng Công an cấp huyện hoặc Trưởng phòng Cảnh sát giao thông Công an cấp tỉnh có trách nhiệm cập nhật dữ liệu trừ điểm giấy phép lái xe vào Cơ sở dữ liệu về xử lý vi phạm hành chính về trật tự, an toàn giao thông đường bộ;\n\nb) Việc thông báo trừ điểm giấy phép lái xe thực hiện bằng văn bản theo mẫu quy định của Bộ trưởng Bộ Công an và được giao trực tiếp hoặc gửi qua dịch vụ bưu chính hoặc thực hiện thông báo bằng phương thức điện tử thông qua tài khoản của công dân đăng ký trên Cổng dịch vụ công, Ứng dụng giao thông trên thiết bị di động khi đáp ứng điều kiện về cơ sở hạ tầng, kỹ thuật, thông tin; đồng thời cập nhật thông tin về giấy phép lái xe bị trừ điểm trên Trang thông tin điện tử của Cục Cảnh sát giao thông. Trường hợp giấy phép lái xe được thể hiện dưới hình thức thông điệp dữ liệu thì cơ quan, người có thẩm quyền thực hiện cập nhật trạng thái trừ điểm giấy phép lái xe trong căn cước điện tử, tài khoản định danh điện tử trên ứng dụng định danh quốc gia.\n\nĐiều 51. Thẩm quyền, trình tự, thủ tục phục hồi điểm giấy phép lái xe\n\n1. Thẩm quyền phục hồi điểm giấy phép lái xe\n\na) Cục trưởng Cục Cảnh sát giao thông có trách nhiệm quản lý, vận hành Cơ sở dữ liệu về xử lý vi phạm hành chính về trật tự, an toàn giao thông đường bộ để thực hiện cập nhật, tự động phục hồi điểm giấy phép lái xe đối với trường hợp quy định tại khoản 2 Điều này;\n\nb) Cục trưởng Cục Cảnh sát giao thông, Trưởng phòng Cảnh sát giao thông nơi tổ chức kiểm tra kiến thức pháp luật về trật tự, an toàn giao thông đường bộ có thẩm quyền phục hồi điểm cho giấy phép lái xe đối với trường hợp quy định tại khoản 3 Điều này.\n\n2. Trình tự, thủ tục phục hồi điểm giấy phép lái xe đối với trường hợp giấy phép lái xe chưa bị trừ hết điểm và không bị trừ điểm trong thời hạn 12 tháng từ ngày bị trừ điểm gần nhất\n\na) Khi đủ thời hạn 12 tháng, kể từ ngày bị trừ điểm giấy phép lái xe gần nhất, dữ liệu điểm giấy phép lái xe sẽ được tự động phục hồi đủ 12 điểm (gồm cả giấy phép lái xe đang trong thời hạn bị tước quyền sử dụng) và cập nhật tự động trong Cơ sở dữ liệu về xử lý vi phạm hành chính về trật tự, an toàn giao thông đường bộ;\n\nb) Ngay sau khi dữ liệu điểm giấy phép lái xe được phục hồi, Cơ sở dữ liệu về xử lý vi phạm hành chính về trật tự, an toàn giao thông đường bộ sẽ tự động chuyển thông tin thông báo cho người được phục hồi điểm giấy phép lái xe biết việc phục hồi điểm theo quy định tại điểm c khoản này;\n\nc) Việc thông báo phục hồi điểm giấy phép lái xe thực hiện bằng phương thức điện tử thông qua tài khoản của công dân đăng ký trên Cổng dịch vụ công, Ứng dụng giao thông trên thiết bị di động; đồng thời cập nhật thông tin về giấy phép lái xe được phục hồi điểm trên Trang thông tin điện tử của Cục Cảnh sát giao thông. Trường hợp giấy phép lái xe được thể hiện dưới hình thức thông điệp dữ liệu thì thực hiện cập nhật trạng thái phục hồi điểm giấy phép lái xe trong căn cước điện tử, tài khoản định danh điện tử trên ứng dụng định danh quốc gia.\n\n3. Trình tự, thủ tục phục hồi điểm giấy phép lái xe đối với trường hợp giấy phép lái xe bị trừ hết điểm\n\na) Sau khi người có giấy phép lái xe bị trừ hết điểm tham gia kiểm tra nội dung kiến thức pháp luật về trật tự, an toàn giao thông đường bộ và đạt yêu cầu, kết quả kiểm tra được cập nhật vào phần mềm kiểm tra kiến thức pháp luật về trật tự, an toàn giao thông đường bộ và đồng bộ dữ liệu với Cơ sở dữ liệu về xử lý vi phạm hành chính về trật tự, an toàn giao thông đường bộ, dữ liệu điểm giấy phép lái xe sẽ được phục hồi đủ 12 điểm và cập nhật tự động trong Cơ sở dữ liệu về xử lý vi phạm hành chính về trật tự, an toàn giao thông đường bộ;\n\nb) Ngay sau khi dữ liệu điểm giấy phép lái xe được phục hồi đủ 12 điểm thì người có thẩm quyền quy định tại điểm b khoản 1 Điều này thông báo cho người được phục hồi điểm giấy phép lái xe biết việc phục hồi điểm;\n\nc) Việc thông báo phục hồi điểm giấy phép lái xe thực hiện bằng văn bản theo mẫu quy định của Bộ trưởng Bộ Công an và được giao trực tiếp hoặc gửi qua dịch vụ bưu chính hoặc thực hiện thông báo bằng phương thức điện tử thông qua tài khoản của công dân đăng ký trên Cổng dịch vụ công, Ứng dụng giao thông trên thiết bị di động; đồng thời cập nhật thông tin về giấy phép lái xe được phục hồi điểm trên Trang thông tin điện tử của Cục Cảnh sát giao thông. Trường hợp giấy phép lái xe được thể hiện dưới hình thức thông điệp dữ liệu thì cơ quan, người có thẩm quyền thực hiện cập nhật trạng thái phục hồi điểm giấy phép lái xe trong căn cước điện tử, tài khoản định danh điện tử trên ứng dụng định danh quốc gia.\n\nChương IV\n\nĐIỀU KHOẢN THI HÀNH\n\nĐiều 52. Sửa đổi, bổ sung một số điều của Nghị định số 100/2019/NĐ-CP ngày 30 tháng 12 năm 2019 của Chính phủ quy định xử phạt vi phạm hành chính trong lĩnh vực giao thông đường bộ và đường sắt đã được sửa đổi, bổ sung một số điều theo Nghị định số 123/2021/NĐ-CP ngày 28 tháng 12 năm 2021 của Chính phủ sửa đổi, bổ sung một số điều của các Nghị định quy định xử phạt vi phạm hành chính trong lĩnh vực hàng hải; giao thông đường bộ, đường sắt; hàng không dân dụng\n\n1. Bổ sung khoản 2a vào sau khoản 2 Điều 1 như sau:\n\n“2a. Hình thức, mức xử phạt, biện pháp khắc phục hậu quả đối với từng hành vi vi phạm hành chính; thẩm quyền lập biên bản, thẩm quyền xử phạt, mức phạt tiền cụ thể đối với từng chức danh về trật tự, an toàn giao thông trong lĩnh vực giao thông đường bộ thì áp dụng quy định tại Nghị định quy định xử phạt vi phạm hành chính về trật tự, an toàn giao thông trong lĩnh vực giao thông đường bộ; trừ điểm, phục hồi điểm giấy phép lái xe”.\n\n2. Sửa đổi, bổ sung một số điểm của khoản 6 Điều 28 như sau:\n\na) Sửa đổi, bổ sung điểm d khoản 6 Điều 28 như sau:\n\n“d) Không thực hiện đúng các nội dung đã đăng ký, niêm yết về: giá cước; giá dịch vụ; tiêu chuẩn chất lượng dịch vụ vận tải, dịch vụ hỗ trợ vận tải;”;\n\nb) Sửa đổi, bổ sung điểm i khoản 6 Điều 28 như sau:\n\n“i) Sử dụng phương tiện kinh doanh vận tải có chất lượng không bảo đảm điều kiện của hình thức kinh doanh đã đăng ký;”.\n\n3. Sửa đổi, bổ sung điểm a, điểm b khoản 10 Điều 28 như sau:\n\n“a) Thực hiện hành vi vi phạm quy định tại điểm a, điểm b, điểm d, điểm đ, điểm h, điểm l, điểm o, điểm p, điểm r, điểm s, điểm t khoản 4; điểm d, điểm i, điểm k, điểm l, điểm n, điểm q khoản 6; điểm e khoản 7 Điều này bị tước quyền sử dụng phù hiệu từ 01 tháng đến 03 tháng (nếu có hoặc đã được cấp) đối với xe vi phạm;\n\nb) Thực hiện hành vi vi phạm quy định tại điểm i, điểm k khoản 4; điểm h khoản 6; điểm b khoản 7 Điều này bị tước quyền sử dụng giấy phép kinh doanh vận tải từ 01 tháng đến 03 tháng;”.\n\n4. Sửa đổi, bổ sung điểm h khoản 11 Điều 28 như sau:\n\n“h) Thực hiện hành vi vi phạm quy định tại điểm n khoản 6 Điều này buộc lắp đặt đồng hồ tính tiền cước, thiết bị in hóa đơn trên xe theo đúng quy định;”.\n\n5. Sửa đổi, bổ sung một số điểm, khoản của Điều 74 như sau:']","**Nguồn văn bản:** /content/drive/MyDrive/ITProject_data/new_law/168_2024_ND-CP_619502.docx

**Nội dung:**

Điều kiện phục hồi điểm giấy phép lái xe đối với người điều khiển xe máy được quy định như sau:

1. **Trường hợp giấy phép lái xe chưa bị trừ hết điểm và không bị trừ điểm trong thời hạn 12 tháng từ ngày bị trừ điểm gần nhất:**

    a) Khi đủ thời hạn 12 tháng, kể từ ngày bị trừ điểm giấy phép lái xe gần nhất, dữ liệu điểm giấy phép lái xe sẽ được tự động phục hồi đủ 12 điểm (gồm cả giấy phép lái xe đang trong thời hạn bị tước quyền sử dụng) và cập nhật tự động trong Cơ sở dữ liệu về xử lý vi phạm hành chính về trật tự, an toàn giao thông đường bộ.

    b) Ngay sau khi dữ liệu điểm giấy phép lái xe được phục hồi, Cơ sở dữ liệu về xử lý vi phạm hành chính về trật tự, an toàn giao thông đường bộ sẽ tự động chuyển thông tin thông báo cho người được phục hồi điểm giấy phép lái xe biết việc phục hồi điểm.

    c) Việc thông báo phục hồi điểm giấy phép lái xe thực hiện bằng phương thức điện tử thông qua tài khoản của công dân đăng ký trên Cổng dịch vụ công, Ứng dụng giao thông trên thiết bị di động; đồng thời cập nhật thông tin về giấy phép lái xe được phục hồi điểm trên Trang thông tin điện tử của Cục Cảnh sát giao thông. Trường hợp giấy phép lái xe được thể hiện dưới hình thức thông điệp dữ liệu thì thực hiện cập nhật trạng thái phục hồi điểm giấy phép lái xe trong căn cước điện tử, tài khoản định danh điện tử trên ứng dụng định danh quốc gia.


2. **Trường hợp giấy phép lái xe bị trừ hết điểm:**

    a) Sau khi người có giấy phép lái xe bị trừ hết điểm tham gia kiểm tra nội dung kiến thức pháp luật về trật tự, an toàn giao thông đường bộ và đạt yêu cầu, kết quả kiểm tra được cập nhật vào phần mềm kiểm tra kiến thức pháp luật về trật tự, an toàn giao thông đường bộ và đồng bộ dữ liệu với Cơ sở dữ liệu về xử lý vi phạm hành chính về trật tự, an toàn giao thông đường bộ, dữ liệu điểm giấy phép lái xe sẽ được phục hồi đủ 12 điểm và cập nhật tự động trong Cơ sở dữ liệu về xử lý vi phạm hành chính về trật tự, an toàn giao thông đường bộ.

    b) Ngay sau khi dữ liệu điểm giấy phép lái xe được phục hồi đủ 12 điểm thì người có thẩm quyền thông báo cho người được phục hồi điểm giấy phép lái xe biết việc phục hồi điểm.

    c) Việc thông báo phục hồi điểm giấy phép lái xe thực hiện bằng văn bản theo mẫu quy định của Bộ trưởng Bộ Công an và được giao trực tiếp hoặc gửi qua dịch vụ bưu chính hoặc thực hiện thông báo bằng phương thức điện tử thông qua tài khoản của công dân đăng ký trên Cổng dịch vụ công, Ứng dụng giao thông trên thiết bị di động; đồng thời cập nhật thông tin về giấy phép lái xe được phục hồi điểm trên Trang thông tin điện tử của Cục Cảnh sát giao thông. Trường hợp giấy phép lái xe được thể hiện dưới hình thức thông điệp dữ liệu thì cơ quan, người có thẩm quyền thực hiện cập nhật trạng thái phục hồi điểm giấy phép lái xe trong căn cước điện tử, tài khoản định danh điện tử trên ứng dụng định danh quốc gia.


Tóm lại: Điểm giấy phép lái xe sẽ được tự động phục hồi sau 12 tháng kể từ lần trừ điểm gần nhất nếu chưa bị trừ hết điểm.  Nếu bị trừ hết điểm, cần tham gia và đạt yêu cầu trong kỳ kiểm tra kiến thức pháp luật về trật tự, an toàn giao thông đường bộ để được phục hồi.
",Người lái xe máy phải làm kiểm tra lý thuyết theo các câu hỏi như khi thi bằng lái xe.,0.9545454545454546,0.8183648915698112,1.0,0.0
12,Người lái ô tô cần làm gì để phục hồi điểm giấy phép lái xe?,"['đ) Không trừ điểm giấy phép lái xe khi giấy phép lái xe đó đang trong thời hạn bị tước quyền sử dụng giấy phép lái xe.\n\n2. Thẩm quyền trừ điểm giấy phép lái xe\n\nNgười có thẩm quyền áp dụng hình thức xử phạt tước quyền sử dụng giấy phép, chứng chỉ hành nghề có thời hạn hoặc đình chỉ hoạt động có thời hạn quy định tại Chương II Phần thứ hai của Luật Xử lý vi phạm hành chính, Mục 1 Chương III của Nghị định này và có thẩm quyền xử phạt vi phạm hành chính đối với hành vi vi phạm có quy định trừ điểm giấy phép lái xe thì có thẩm quyền trừ điểm giấy phép lái xe đối với hành vi vi phạm đó.\n\n3. Trình tự, thủ tục trừ điểm giấy phép lái xe\n\na) Ngay sau khi quyết định xử phạt vi phạm hành chính có hiệu lực thi hành, dữ liệu trừ điểm giấy phép lái xe của người bị xử phạt sẽ được cập nhật tự động vào Cơ sở dữ liệu về xử lý vi phạm hành chính về trật tự, an toàn giao thông đường bộ, người có thẩm quyền trừ điểm giấy phép lái xe thông báo cho người bị trừ điểm giấy phép lái xe biết việc trừ điểm.\n\nTrường hợp Chủ tịch Ủy ban nhân dân cấp huyện, Chủ tịch Ủy ban nhân dân cấp tỉnh ra quyết định xử phạt vi phạm hành chính đối với hành vi vi phạm có trừ điểm giấy phép lái xe thì Trưởng Công an cấp huyện hoặc Trưởng phòng Cảnh sát giao thông Công an cấp tỉnh có trách nhiệm cập nhật dữ liệu trừ điểm giấy phép lái xe vào Cơ sở dữ liệu về xử lý vi phạm hành chính về trật tự, an toàn giao thông đường bộ;\n\nb) Việc thông báo trừ điểm giấy phép lái xe thực hiện bằng văn bản theo mẫu quy định của Bộ trưởng Bộ Công an và được giao trực tiếp hoặc gửi qua dịch vụ bưu chính hoặc thực hiện thông báo bằng phương thức điện tử thông qua tài khoản của công dân đăng ký trên Cổng dịch vụ công, Ứng dụng giao thông trên thiết bị di động khi đáp ứng điều kiện về cơ sở hạ tầng, kỹ thuật, thông tin; đồng thời cập nhật thông tin về giấy phép lái xe bị trừ điểm trên Trang thông tin điện tử của Cục Cảnh sát giao thông. Trường hợp giấy phép lái xe được thể hiện dưới hình thức thông điệp dữ liệu thì cơ quan, người có thẩm quyền thực hiện cập nhật trạng thái trừ điểm giấy phép lái xe trong căn cước điện tử, tài khoản định danh điện tử trên ứng dụng định danh quốc gia.\n\nĐiều 51. Thẩm quyền, trình tự, thủ tục phục hồi điểm giấy phép lái xe\n\n1. Thẩm quyền phục hồi điểm giấy phép lái xe\n\na) Cục trưởng Cục Cảnh sát giao thông có trách nhiệm quản lý, vận hành Cơ sở dữ liệu về xử lý vi phạm hành chính về trật tự, an toàn giao thông đường bộ để thực hiện cập nhật, tự động phục hồi điểm giấy phép lái xe đối với trường hợp quy định tại khoản 2 Điều này;\n\nb) Cục trưởng Cục Cảnh sát giao thông, Trưởng phòng Cảnh sát giao thông nơi tổ chức kiểm tra kiến thức pháp luật về trật tự, an toàn giao thông đường bộ có thẩm quyền phục hồi điểm cho giấy phép lái xe đối với trường hợp quy định tại khoản 3 Điều này.\n\n2. Trình tự, thủ tục phục hồi điểm giấy phép lái xe đối với trường hợp giấy phép lái xe chưa bị trừ hết điểm và không bị trừ điểm trong thời hạn 12 tháng từ ngày bị trừ điểm gần nhất\n\na) Khi đủ thời hạn 12 tháng, kể từ ngày bị trừ điểm giấy phép lái xe gần nhất, dữ liệu điểm giấy phép lái xe sẽ được tự động phục hồi đủ 12 điểm (gồm cả giấy phép lái xe đang trong thời hạn bị tước quyền sử dụng) và cập nhật tự động trong Cơ sở dữ liệu về xử lý vi phạm hành chính về trật tự, an toàn giao thông đường bộ;\n\nb) Ngay sau khi dữ liệu điểm giấy phép lái xe được phục hồi, Cơ sở dữ liệu về xử lý vi phạm hành chính về trật tự, an toàn giao thông đường bộ sẽ tự động chuyển thông tin thông báo cho người được phục hồi điểm giấy phép lái xe biết việc phục hồi điểm theo quy định tại điểm c khoản này;\n\nc) Việc thông báo phục hồi điểm giấy phép lái xe thực hiện bằng phương thức điện tử thông qua tài khoản của công dân đăng ký trên Cổng dịch vụ công, Ứng dụng giao thông trên thiết bị di động; đồng thời cập nhật thông tin về giấy phép lái xe được phục hồi điểm trên Trang thông tin điện tử của Cục Cảnh sát giao thông. Trường hợp giấy phép lái xe được thể hiện dưới hình thức thông điệp dữ liệu thì thực hiện cập nhật trạng thái phục hồi điểm giấy phép lái xe trong căn cước điện tử, tài khoản định danh điện tử trên ứng dụng định danh quốc gia.\n\n3. Trình tự, thủ tục phục hồi điểm giấy phép lái xe đối với trường hợp giấy phép lái xe bị trừ hết điểm\n\na) Sau khi người có giấy phép lái xe bị trừ hết điểm tham gia kiểm tra nội dung kiến thức pháp luật về trật tự, an toàn giao thông đường bộ và đạt yêu cầu, kết quả kiểm tra được cập nhật vào phần mềm kiểm tra kiến thức pháp luật về trật tự, an toàn giao thông đường bộ và đồng bộ dữ liệu với Cơ sở dữ liệu về xử lý vi phạm hành chính về trật tự, an toàn giao thông đường bộ, dữ liệu điểm giấy phép lái xe sẽ được phục hồi đủ 12 điểm và cập nhật tự động trong Cơ sở dữ liệu về xử lý vi phạm hành chính về trật tự, an toàn giao thông đường bộ;\n\nb) Ngay sau khi dữ liệu điểm giấy phép lái xe được phục hồi đủ 12 điểm thì người có thẩm quyền quy định tại điểm b khoản 1 Điều này thông báo cho người được phục hồi điểm giấy phép lái xe biết việc phục hồi điểm;\n\nc) Việc thông báo phục hồi điểm giấy phép lái xe thực hiện bằng văn bản theo mẫu quy định của Bộ trưởng Bộ Công an và được giao trực tiếp hoặc gửi qua dịch vụ bưu chính hoặc thực hiện thông báo bằng phương thức điện tử thông qua tài khoản của công dân đăng ký trên Cổng dịch vụ công, Ứng dụng giao thông trên thiết bị di động; đồng thời cập nhật thông tin về giấy phép lái xe được phục hồi điểm trên Trang thông tin điện tử của Cục Cảnh sát giao thông. Trường hợp giấy phép lái xe được thể hiện dưới hình thức thông điệp dữ liệu thì cơ quan, người có thẩm quyền thực hiện cập nhật trạng thái phục hồi điểm giấy phép lái xe trong căn cước điện tử, tài khoản định danh điện tử trên ứng dụng định danh quốc gia.\n\nChương IV\n\nĐIỀU KHOẢN THI HÀNH\n\nĐiều 52. Sửa đổi, bổ sung một số điều của Nghị định số 100/2019/NĐ-CP ngày 30 tháng 12 năm 2019 của Chính phủ quy định xử phạt vi phạm hành chính trong lĩnh vực giao thông đường bộ và đường sắt đã được sửa đổi, bổ sung một số điều theo Nghị định số 123/2021/NĐ-CP ngày 28 tháng 12 năm 2021 của Chính phủ sửa đổi, bổ sung một số điều của các Nghị định quy định xử phạt vi phạm hành chính trong lĩnh vực hàng hải; giao thông đường bộ, đường sắt; hàng không dân dụng\n\n1. Bổ sung khoản 2a vào sau khoản 2 Điều 1 như sau:\n\n“2a. Hình thức, mức xử phạt, biện pháp khắc phục hậu quả đối với từng hành vi vi phạm hành chính; thẩm quyền lập biên bản, thẩm quyền xử phạt, mức phạt tiền cụ thể đối với từng chức danh về trật tự, an toàn giao thông trong lĩnh vực giao thông đường bộ thì áp dụng quy định tại Nghị định quy định xử phạt vi phạm hành chính về trật tự, an toàn giao thông trong lĩnh vực giao thông đường bộ; trừ điểm, phục hồi điểm giấy phép lái xe”.\n\n2. Sửa đổi, bổ sung một số điểm của khoản 6 Điều 28 như sau:\n\na) Sửa đổi, bổ sung điểm d khoản 6 Điều 28 như sau:\n\n“d) Không thực hiện đúng các nội dung đã đăng ký, niêm yết về: giá cước; giá dịch vụ; tiêu chuẩn chất lượng dịch vụ vận tải, dịch vụ hỗ trợ vận tải;”;\n\nb) Sửa đổi, bổ sung điểm i khoản 6 Điều 28 như sau:\n\n“i) Sử dụng phương tiện kinh doanh vận tải có chất lượng không bảo đảm điều kiện của hình thức kinh doanh đã đăng ký;”.\n\n3. Sửa đổi, bổ sung điểm a, điểm b khoản 10 Điều 28 như sau:\n\n“a) Thực hiện hành vi vi phạm quy định tại điểm a, điểm b, điểm d, điểm đ, điểm h, điểm l, điểm o, điểm p, điểm r, điểm s, điểm t khoản 4; điểm d, điểm i, điểm k, điểm l, điểm n, điểm q khoản 6; điểm e khoản 7 Điều này bị tước quyền sử dụng phù hiệu từ 01 tháng đến 03 tháng (nếu có hoặc đã được cấp) đối với xe vi phạm;\n\nb) Thực hiện hành vi vi phạm quy định tại điểm i, điểm k khoản 4; điểm h khoản 6; điểm b khoản 7 Điều này bị tước quyền sử dụng giấy phép kinh doanh vận tải từ 01 tháng đến 03 tháng;”.\n\n4. Sửa đổi, bổ sung điểm h khoản 11 Điều 28 như sau:\n\n“h) Thực hiện hành vi vi phạm quy định tại điểm n khoản 6 Điều này buộc lắp đặt đồng hồ tính tiền cước, thiết bị in hóa đơn trên xe theo đúng quy định;”.\n\n5. Sửa đổi, bổ sung một số điểm, khoản của Điều 74 như sau:']","**Nguồn văn bản:** /content/drive/MyDrive/ITProject_data/new_law/168_2024_ND-CP_619502.docx

**Nội dung:**

Điều 51. Thẩm quyền, trình tự, thủ tục phục hồi điểm giấy phép lái xe

1. Thẩm quyền phục hồi điểm giấy phép lái xe

    a) Cục trưởng Cục Cảnh sát giao thông có trách nhiệm quản lý, vận hành Cơ sở dữ liệu về xử lý vi phạm hành chính về trật tự, an toàn giao thông đường bộ để thực hiện cập nhật, tự động phục hồi điểm giấy phép lái xe đối với trường hợp quy định tại khoản 2 Điều này.

    b) Cục trưởng Cục Cảnh sát giao thông, Trưởng phòng Cảnh sát giao thông nơi tổ chức kiểm tra kiến thức pháp luật về trật tự, an toàn giao thông đường bộ có thẩm quyền phục hồi điểm cho giấy phép lái xe đối với trường hợp quy định tại khoản 3 Điều này.

2. Trình tự, thủ tục phục hồi điểm giấy phép lái xe đối với trường hợp giấy phép lái xe chưa bị trừ hết điểm và không bị trừ điểm trong thời hạn 12 tháng từ ngày bị trừ điểm gần nhất

    a) Khi đủ thời hạn 12 tháng, kể từ ngày bị trừ điểm giấy phép lái xe gần nhất, dữ liệu điểm giấy phép lái xe sẽ được tự động phục hồi đủ 12 điểm (gồm cả giấy phép lái xe đang trong thời hạn bị tước quyền sử dụng) và cập nhật tự động trong Cơ sở dữ liệu về xử lý vi phạm hành chính về trật tự, an toàn giao thông đường bộ.

    b) Ngay sau khi dữ liệu điểm giấy phép lái xe được phục hồi, Cơ sở dữ liệu về xử lý vi phạm hành chính về trật tự, an toàn giao thông đường bộ sẽ tự động chuyển thông tin thông báo cho người được phục hồi điểm giấy phép lái xe biết việc phục hồi điểm theo quy định tại điểm c khoản này.

    c) Việc thông báo phục hồi điểm giấy phép lái xe thực hiện bằng phương thức điện tử thông qua tài khoản của công dân đăng ký trên Cổng dịch vụ công, Ứng dụng giao thông trên thiết bị di động; đồng thời cập nhật thông tin về giấy phép lái xe được phục hồi điểm trên Trang thông tin điện tử của Cục Cảnh sát giao thông. Trường hợp giấy phép lái xe được thể hiện dưới hình thức thông điệp dữ liệu thì thực hiện cập nhật trạng thái phục hồi điểm giấy phép lái xe trong căn cước điện tử, tài khoản định danh điện tử trên ứng dụng định danh quốc gia.

3. Trình tự, thủ tục phục hồi điểm giấy phép lái xe đối với trường hợp giấy phép lái xe bị trừ hết điểm

    a) Sau khi người có giấy phép lái xe bị trừ hết điểm tham gia kiểm tra nội dung kiến thức pháp luật về trật tự, an toàn giao thông đường bộ và đạt yêu cầu, kết quả kiểm tra được cập nhật vào phần mềm kiểm tra kiến thức pháp luật về trật tự, an toàn giao thông đường bộ và đồng bộ dữ liệu với Cơ sở dữ liệu về xử lý vi phạm hành chính về trật tự, an toàn giao thông đường bộ, dữ liệu điểm giấy phép lái xe sẽ được phục hồi đủ 12 điểm và cập nhật tự động trong Cơ sở dữ liệu về xử lý vi phạm hành chính về trật tự, an toàn giao thông đường bộ.

    b) Ngay sau khi dữ liệu điểm giấy phép lái xe được phục hồi đủ 12 điểm thì người có thẩm quyền quy định tại điểm b khoản 1 Điều này thông báo cho người được phục hồi điểm giấy phép lái xe biết việc phục hồi điểm.

    c) Việc thông báo phục hồi điểm giấy phép lái xe thực hiện bằng văn bản theo mẫu quy định của Bộ trưởng Bộ Công an và được giao trực tiếp hoặc gửi qua dịch vụ bưu chính hoặc thực hiện thông báo bằng phương thức điện tử thông qua tài khoản của công dân đăng ký trên Cổng dịch vụ công, Ứng dụng giao thông trên thiết bị di động; đồng thời cập nhật thông tin về giấy phép lái xe được phục hồi điểm trên Trang thông tin điện tử của Cục Cảnh sát giao thông. Trường hợp giấy phép lái xe được thể hiện dưới hình thức thông điệp dữ liệu thì cơ quan, người có thẩm quyền thực hiện cập nhật trạng thái phục hồi điểm giấy phép lái xe trong căn cước điện tử, tài khoản định danh điện tử trên ứng dụng định danh quốc gia.


Tóm lại:  Điểm giấy phép lái xe sẽ được tự động phục hồi sau 12 tháng kể từ ngày trừ điểm gần nhất nếu chưa bị trừ hết điểm.  Nếu bị trừ hết điểm, cần tham gia và đạt yêu cầu kiểm tra kiến thức pháp luật về trật tự, an toàn giao thông đường bộ để được phục hồi.  Thông báo phục hồi điểm được thực hiện qua nhiều kênh, bao gồm điện tử và văn bản.
",Người lái ô tô phải làm kiểm tra lý thuyết và mô phỏng theo các câu hỏi như khi thi bằng lái xe.,1.0,0.7523815311106502,0.0,0.0
13,Luật Giao thông Đường bộ 2025 có quy định gì mới về việc sử dụng điện thoại khi lái xe?,"['6. Trường hợp tước quyền sử dụng giấy phép lái xe tích hợp giấy phép lái xe không thời hạn (xe mô tô, xe tương tự xe mô tô) và giấy phép lái xe có thời hạn (xe ô tô, xe tương tự xe ô tô, xe chở người bốn bánh có gắn động cơ, xe chở hàng bốn bánh có gắn động cơ) thì người có thẩm quyền xử phạt áp dụng tước quyền sử dụng đối với giấy phép lái xe không thời hạn khi người điều khiển xe mô tô, xe tương tự xe mô tô hoặc tước quyền sử dụng đối với giấy phép lái xe có thời hạn khi người điều khiển xe ô tô, xe tương tự xe ô tô, xe chở người bốn bánh có gắn động cơ, xe chở hàng bốn bánh có gắn động cơ thực hiện hành vi vi phạm hành chính có quy định bị tước quyền sử dụng giấy phép lái xe. Trong thời gian bị tước quyền sử dụng, người có giấy phép lái xe tích hợp được cấp, đổi giấy phép lái xe đối với giấy phép lái xe không bị tước quyền sử dụng.\n\n7. Trường hợp giấy phép, chứng chỉ hành nghề được cấp dưới dạng điện tử hoặc thể hiện dưới hình thức thông điệp dữ liệu thì cơ quan, người có thẩm quyền thực hiện tạm giữ, tước trên môi trường điện tử theo quy định nếu đáp ứng điều kiện về cơ sở hạ tầng, kỹ thuật, thông tin. Việc tạm giữ, tước quyền sử dụng được cập nhật trạng thái trên cơ sở dữ liệu, căn cước điện tử, tài khoản định danh điện tử và ứng dụng thông tin điện tử khác theo quy định.\n\nChương II\n\nHÀNH VI VI PHẠM, HÌNH THỨC, MỨC XỬ PHẠT, MỨC TRỪ ĐIỂM GIẤY PHÉP LÁI XE VÀ BIỆN PHÁP KHẮC PHỤC HẬU QUẢ VI PHẠM HÀNH CHÍNH VỀ TRẬT TỰ, AN TOÀN GIAO THÔNG TRONG LĨNH VỰC GIAO THÔNG ĐƯỜNG BỘ\n\nMục 1. VI PHẠM QUY TẮC GIAO THÔNG ĐƯỜNG BỘ\n\nĐiều 6. Xử phạt, trừ điểm giấy phép lái xe của người điều khiển xe ô tô, xe chở người bốn bánh có gắn động cơ, xe chở hàng bốn bánh có gắn động cơ và các loại xe tương tự xe ô tô vi phạm quy tắc giao thông đường bộ\n\n1. Phạt tiền từ 400.000 đồng đến 600.000 đồng đối với người điều khiển xe thực hiện một trong các hành vi vi phạm sau đây:\n\na) Không chấp hành hiệu lệnh, chỉ dẫn của biển báo hiệu, vạch kẻ đường, trừ các hành vi vi phạm quy định tại điểm a, điểm c, điểm d, điểm đ khoản 2; điểm a, điểm d, điểm đ, điểm e, điểm n, điểm o khoản 3; điểm a, điểm b, điểm đ, điểm e, điểm i, điểm k, điểm l khoản 4; điểm a, điểm b, điểm c, điểm d, điểm đ, điểm i, điểm k khoản 5; điểm a khoản 6; khoản 7; điểm b, điểm d khoản 9; điểm a khoản 10; điểm đ khoản 11 Điều này;\n\nb) Khi ra, vào vị trí dừng xe, đỗ xe không có tín hiệu báo cho người điều khiển phương tiện khác biết;\n\nc) Không báo hiệu bằng đèn khẩn cấp hoặc không đặt biển cảnh báo “Chú ý xe đỗ” theo quy định trong trường hợp gặp sự cố kỹ thuật (hoặc bất khả kháng khác) buộc phải đỗ xe chiếm một phần đường xe chạy hoặc tại nơi không được phép đỗ xe, trừ hành vi vi phạm quy định tại điểm c khoản 7 Điều này;\n\nd) Không gắn biển báo hiệu ở phía trước xe kéo, phía sau xe được kéo; điều khiển xe kéo rơ moóc không có biển báo hiệu theo quy định;\n\nđ) Sử dụng còi trong thời gian từ 22 giờ ngày hôm trước đến 05 giờ ngày hôm sau trong khu đông dân cư, khu vực cơ sở khám bệnh, chữa bệnh, trừ các xe ưu tiên đang đi làm nhiệm vụ theo quy định.\n\n2. Phạt tiền từ 600.000 đồng đến 800.000 đồng đối với người điều khiển xe thực hiện một trong các hành vi vi phạm sau đây:\n\na) Chuyển làn đường không đúng nơi cho phép hoặc không có tín hiệu báo trước hoặc chuyển làn đường không đúng quy định “mỗi lần chuyển làn đường chỉ được phép chuyển sang một làn đường liền kề”, trừ các hành vi vi phạm quy định tại điểm g khoản 5 Điều này;\n\nb) Chở người trên buồng lái quá số lượng quy định;\n\nc) Không tuân thủ các quy định về nhường đường tại nơi đường bộ giao nhau, trừ các hành vi vi phạm quy định tại điểm n, điểm o khoản 5 Điều này;\n\nd) Dừng xe, đỗ xe trên phần đường xe chạy ở đoạn đường ngoài đô thị nơi có lề đường rộng; dừng xe, đỗ xe không sát mép đường phía bên phải theo chiều đi ở nơi đường có lề đường hẹp hoặc không có lề đường; dừng xe, đỗ xe ngược với chiều lưu thông của làn đường; dừng xe, đỗ xe trên dải phân cách cố định ở giữa hai phần đường xe chạy; đỗ xe trên dốc không chèn bánh;\n\nđ) Dừng xe không sát theo lề đường, vỉa hè phía bên phải theo chiều đi hoặc bánh xe gần nhất cách lề đường, vỉa hè quá 0,25 mét; dừng xe trên đường dành riêng cho xe buýt; dừng xe trên miệng cống thoát nước, miệng hầm của đường điện thoại, điện cao thế, chỗ dành riêng cho xe chữa cháy lấy nước; rời vị trí lái, tắt máy khi dừng xe (trừ trường hợp rời khỏi vị trí lái để đóng, mở cửa xe, xếp dỡ hàng hóa, kiểm tra kỹ thuật xe) hoặc rời vị trí lái khi dừng xe nhưng không sử dụng phanh đỗ xe (hoặc thực hiện biện pháp an toàn khác); dừng xe, đỗ xe không đúng vị trí quy định ở những đoạn có bố trí nơi dừng xe, đỗ xe; dừng xe, đỗ xe trên phần đường dành cho người đi bộ qua đường; dừng xe nơi có biển “Cấm dừng xe và đỗ xe”, trừ hành vi vi phạm quy định tại điểm đ khoản 4, điểm c khoản 7 Điều này.\n\n3. Phạt tiền từ 800.000 đồng đến 1.000.000 đồng đối với người điều khiển xe thực hiện một trong các hành vi vi phạm sau đây:\n\na) Điều khiển xe chạy quá tốc độ quy định từ 05 km/h đến dưới 10 km/h;\n\nb) Sử dụng còi, rú ga liên tục; sử dụng còi hơi, sử dụng đèn chiếu xa khi gặp người đi bộ qua đường hoặc khi đi trên đoạn đường qua khu dân cư có hệ thống chiếu sáng đang hoạt động hoặc khi gặp xe đi ngược chiều (trừ trường hợp dải phân cách có khả năng chống chói) hoặc khi chuyển hướng xe tại nơi đường giao nhau, trừ các xe ưu tiên đang đi làm nhiệm vụ theo quy định;\n\nc) Chuyển hướng không quan sát hoặc không bảo đảm khoảng cách an toàn với xe phía sau hoặc không giảm tốc độ hoặc không có tín hiệu báo hướng rẽ hoặc có tín hiệu báo hướng rẽ nhưng không sử dụng liên tục trong quá trình chuyển hướng (trừ trường hợp điều khiển xe đi theo hướng cong của đoạn đường bộ ở nơi đường không giao nhau cùng mức);\n\nd) Không tuân thủ các quy định về dừng xe, đỗ xe tại nơi đường bộ giao nhau cùng mức với đường sắt; dừng xe, đỗ xe trong phạm vi bảo vệ công trình đường sắt, phạm vi an toàn của đường sắt;\n\nđ) Dừng xe, đỗ xe tại vị trí: nơi đường bộ giao nhau hoặc trong phạm vi 05 mét tính từ mép đường giao nhau; điểm đón, trả khách; trước cổng hoặc trong phạm vi 05 mét hai bên cổng trụ sở cơ quan, tổ chức có bố trí đường cho xe ra, vào; nơi phần đường có bề rộng chỉ đủ cho một làn xe cơ giới; che khuất biển báo hiệu đường bộ, đèn tín hiệu giao thông; nơi mở dải phân cách giữa; cách xe ô tô đang đỗ ngược chiều dưới 20 mét trên đường phố hẹp, dưới 40 mét trên đường có một làn xe cơ giới trên một chiều đường;\n\ne) Đỗ xe không sát theo lề đường, vỉa hè phía bên phải theo chiều đi hoặc bánh xe gần nhất cách lề đường, vỉa hè quá 0,25 mét; đỗ xe trên đường dành riêng cho xe buýt; đỗ xe trên miệng cống thoát nước, miệng hầm của đường điện thoại, điện cao thế, chỗ dành riêng cho xe chữa cháy lấy nước; đỗ, để xe ở vỉa hè trái quy định của pháp luật; đỗ xe nơi có biển “Cấm đỗ xe” hoặc biển “Cấm dừng xe và đỗ xe”, trừ hành vi vi phạm quy định tại điểm đ khoản 4, điểm c khoản 7 Điều này;\n\ng) Không sử dụng hoặc sử dụng không đủ đèn chiếu sáng trong thời gian từ 18 giờ ngày hôm trước đến 06 giờ ngày hôm sau hoặc khi có sương mù, khói, bụi, trời mưa, thời tiết xấu làm hạn chế tầm nhìn;\n\nh) Điều khiển xe ô tô kéo theo xe khác, vật khác (trừ trường hợp kéo theo một rơ moóc, sơ mi rơ moóc hoặc một xe ô tô, xe máy chuyên dùng khác khi xe này không tự chạy được); điều khiển xe ô tô đẩy xe khác, vật khác; điều khiển xe kéo rơ moóc, sơ mi rơ moóc kéo thêm rơ moóc hoặc xe khác, vật khác; không nối chắc chắn, an toàn giữa xe kéo và xe được kéo khi kéo nhau;\n\ni) Chở người trên xe được kéo, trừ người điều khiển;\n\nk) Không thắt dây đai an toàn khi điều khiển xe chạy trên đường;\n\nl) Chở người trên xe ô tô không thắt dây đai an toàn (tại vị trí có trang bị dây đai an toàn) khi xe đang chạy;\n\nm) Chở trẻ em dưới 10 tuổi và chiều cao dưới 1,35 mét trên xe ô tô ngồi cùng hàng ghế với người lái xe (trừ loại xe ô tô chỉ có một hàng ghế) hoặc không sử dụng thiết bị an toàn phù hợp cho trẻ em theo quy định;\n\nn) Chạy trong hầm đường bộ không sử dụng đèn chiếu sáng gần;']","**Nguồn văn bản:** /content/drive/MyDrive/ITProject_data/new_law/168_2024_ND-CP_619502.docx

**Tên văn bản:**  (Tên văn bản không được cung cấp trong context)

**Điều/Mục:** Chương II, Mục 1, Điều 6

**Nội dung:**

Rất tiếc, văn bản cung cấp không đề cập trực tiếp đến quy định về việc sử dụng điện thoại khi lái xe.  Văn bản tập trung vào việc xử phạt các hành vi vi phạm khác về quy tắc giao thông đường bộ đối với người điều khiển ô tô và các loại xe tương tự.  Nội dung văn bản đề cập đến các hình phạt tiền đối với nhiều hành vi vi phạm, bao gồm:

1. Phạt tiền từ 400.000 đồng đến 600.000 đồng đối với các hành vi như:

    a) Không chấp hành hiệu lệnh, chỉ dẫn của biển báo hiệu, vạch kẻ đường.

    b) Khi ra, vào vị trí dừng xe, đỗ xe không có tín hiệu báo cho người điều khiển phương tiện khác biết.

    c) Không báo hiệu bằng đèn khẩn cấp hoặc không đặt biển cảnh báo “Chú ý xe đỗ” trong trường hợp sự cố kỹ thuật buộc phải đỗ xe.

    d) Không gắn biển báo hiệu ở phía trước xe kéo, phía sau xe được kéo.

    đ) Sử dụng còi trong thời gian từ 22 giờ đến 05 giờ sáng hôm sau trong khu đông dân cư.


2. Phạt tiền từ 600.000 đồng đến 800.000 đồng đối với các hành vi như:

    a) Chuyển làn đường không đúng nơi cho phép hoặc không có tín hiệu báo trước.

    b) Chở người trên buồng lái quá số lượng quy định.

    c) Không tuân thủ các quy định về nhường đường tại nơi đường bộ giao nhau.

    d) Dừng xe, đỗ xe không đúng quy định.

    đ) Dừng xe không sát theo lề đường, vỉa hè.


3. Phạt tiền từ 800.000 đồng đến 1.000.000 đồng đối với các hành vi như:

    a) Điều khiển xe chạy quá tốc độ quy định từ 05 km/h đến dưới 10 km/h.

    b) Sử dụng còi, rú ga liên tục; sử dụng còi hơi, sử dụng đèn chiếu xa không đúng quy định.

    c) Chuyển hướng không quan sát hoặc không bảo đảm khoảng cách an toàn.

    d) Không tuân thủ các quy định về dừng xe, đỗ xe tại nơi đường bộ giao nhau cùng mức với đường sắt.

    đ) Dừng xe, đỗ xe tại vị trí không được phép.

    e) Đỗ xe không đúng quy định.

    g) Không sử dụng hoặc sử dụng không đủ đèn chiếu sáng.

    h) Điều khiển xe ô tô kéo theo xe khác, vật khác không đúng quy định.

    i) Chở người trên xe được kéo, trừ người điều khiển.

    k) Không thắt dây đai an toàn.

    l) Chở người trên xe ô tô không thắt dây đai an toàn.

    m) Chở trẻ em dưới 10 tuổi và chiều cao dưới 1,35 mét không đúng quy định.

    n) Chạy trong hầm đường bộ không sử dụng đèn chiếu sáng gần.


Tóm lại: Văn bản không cung cấp thông tin về quy định sử dụng điện thoại khi lái xe.  Nội dung tập trung vào các hình phạt tiền đối với nhiều hành vi vi phạm khác nhau về quy tắc giao thông đường bộ.  Để biết quy định về sử dụng điện thoại khi lái xe, cần tham khảo nguồn thông tin khác.
",Luật cấm sử dụng điện thoại di động khi đang điều khiển phương tiện giao thông.,1.0,0.0,0.0,0.0
14,Quy định mới về tốc độ tối đa trong khu vực đô thị là gì?,"['BỘ GIAO THÔNG VẬN TẢI\n-------- CỘNG HÒA XÃ HỘI CHỦ NGHĨA VIỆT NAM\nĐộc lập - Tự do - Hạnh phúc \n--------------- Số: 38/2024/TT-BGTVT Hà Nội, Ngày 15 tháng 11 năm 2024\n\nTHÔNG TƯ\n\nQUY ĐỊNH VỀ TỐC ĐỘ VÀ KHOẢNG CÁCH AN TOÀN CỦA XE CƠ GIỚI, XE MÁY CHUYÊN DÙNG THAM GIA GIAO THÔNG TRÊN ĐƯỜNG BỘ\n\nCăn cứ Luật Trật tự, an toàn giao thông đường bộ ngày 27 tháng 6 năm 2024;\n\nCăn cứ Luật Đường bộ ngày 27 tháng 6 năm 2024;\n\nCăn cứ Nghị định số 56/2022/NĐ-CP ngày 24 tháng 8 năm 2022 của Chính phủ quy định chức năng, nhiệm vụ, quyền hạn và cơ cấu tổ chức của Bộ Giao thông vận tải;\n\nTheo đề nghị của Vụ trưởng Vụ Kết cấu hạ tầng giao thông và Cục trưởng Cục đường bộ Việt Nam;\n\nBộ trưởng Bộ Giao thông vận tải ban hành Thông tư quy định về tốc độ và khoảng cách an toàn của xe cơ giới, xe máy chuyên dùng tham gia giao thông trên đường bộ.\n\nChương I\n\nQUY ĐỊNH CHUNG\n\nĐiều 1. Phạm vi điều chỉnh\n\nThông tư này quy định về tốc độ thiết kế của đường bộ; tốc độ khai thác và khoảng cách an toàn của xe cơ giới, xe máy chuyên dùng khi tham gia giao thông trên đường bộ, trừ xe ưu tiên đang đi làm nhiệm vụ theo quy định của pháp luật.\n\nĐiều 2. Đối tượng áp dụng\n\nThông tư này áp dụng đối với người lái xe, người điều khiển xe máy chuyên dùng và tổ chức, cá nhân liên quan đến quản lý và thực hiện các quy định về tốc độ thiết kế, tốc độ khai thác của đường bộ và khoảng cách an toàn của xe cơ giới, xe máy chuyên dùng khi tham gia giao thông trên đường bộ.\n\nĐiều 3. Giải thích từ ngữ\n\nTrong Thông tư này, các từ ngữ dưới đây được hiểu như sau:\n\n1. Đường bộ trong khu đông dân cư là đoạn đường bộ nằm trong khu vực nội thành phố, nội thị xã, nội thị trấn và những đoạn đường có đông dân cư sinh sống sát dọc theo đường, được xác định bằng biển báo “Bắt đầu khu đông dân cư” và biển báo “Hết khu đông dân cư”.\n\n2. Đường đôi là đường có chiều đi và chiều về được phân biệt bằng dải phân cách giữa.\n\n3. Đường một chiều là đường chỉ cho đi một chiều.\n\n4. Đường hai chiều là đường dùng chung cho cả chiều đi và về trên cùng một phần đường xe chạy mà không có dải phân cách giữa.\n\n5. Trọng tải là khối lượng hàng hóa chuyên chở cho phép, được ghi trên Giấy chứng nhận an toàn kỹ thuật và bảo vệ môi trường của phương tiện giao thông cơ giới đường bộ, Giấy chứng \n\n\n\nnhận chất lượng an toàn kỹ thuật và bảo vệ môi trường xe cơ giới nhập khẩu hoặc Giấy chứng nhận chất lượng an toàn kỹ thuật và bảo vệ môi trường kiểu loại ô tô sản xuất, lắp ráp.\n\n6. Tốc độ khai thác tối đa là giá trị tốc độ lớn nhất cho phép phương tiện tham gia giao thông trên đường bộ bảo đảm an toàn giao thông và khai thác hiệu quả tuyến đường.\n\n7. Tốc độ khai thác tối thiểu là giá trị tốc độ nhỏ nhất cho phép phương tiện tham gia giao thông trên đường bộ bảo đảm an toàn giao thông và khai thác hiệu quả tuyến đường.\n\n8. Khoảng cách an toàn là cự ly tối thiểu giữa phương tiện phía sau với phương tiện đang di chuyển liền trước, cùng làn đường, bảo đảm tránh xảy ra va chạm trong trường hợp phương tiện phía trước đột ngột giảm tốc độ hoặc dừng lại.\n\n9. Tốc độ lưu hành là giá trị tốc độ của phương tiện tại thời điểm tham gia giao thông trên đường bộ.\n\nĐiều 4. Nguyên tắc chấp hành quy định về tốc độ khai thác và khoảng cách an toàn khi điều khiển phương tiện trên đường bộ\n\n1. Khi tham gia giao thông trên đường bộ, người lái xe, người điều khiển xe máy chuyên dùng phải chấp hành quy định về tốc độ khai thác và khoảng cách an toàn theo quy định tại Điều 12 Luật Trật tự, an toàn giao thông đường bộ.\n\n2. Tại những đoạn đường không bố trí biển báo tốc độ khai thác tối đa, không bố trí biển báo khoảng cách an toàn giữa hai xe, người điều khiển phương tiện tham gia giao thông phải thực hiện theo quy định tại Điều 6, Điều 7, Điều 8 và Điều 11 Thông tư này.\n\nChương II\n\nTỐC ĐỘ THIẾT KẾ CỦA ĐƯỜNG BỘ; TỐC ĐỘ KHAI THÁC CỦA ĐƯỜNG BỘ, KHOẢNG CÁCH AN TOÀN CỦA XE CƠ GIỚI, XE MÁY CHUYÊN DÙNG THAM GIA GIAO THÔNG TRÊN ĐƯỜNG BỘ\n\nĐiều 5. Tốc độ thiết kế của đường bộ\n\n1. Tốc độ thiết kế của đường bộ là giá trị vận tốc được dùng để tính toán các chỉ tiêu kỹ thuật của đường bộ. Tốc độ thiết kế của đường bộ được xác định trong giai đoạn đầu tư xây dựng, nâng cấp, cải tạo đường bộ nhằm bảo đảm cho phương tiện di chuyển an toàn; được quyết định theo cấp kỹ thuật của đường bộ và điều kiện địa hình.\n\n2. Tốc độ thiết kế đường bộ cao tốc là giá trị vận tốc được dùng để tính toán các chỉ tiêu kỹ thuật của đường bộ cao tốc, được xác định theo cấp đường cao tốc. Khi thiết kế đường bộ cao tốc có thể áp dụng tốc độ thiết kế khác nhau theo từng đoạn nhưng phải bảo đảm các yêu cầu về chiều dài đoạn chuyển tiếp và tốc độ thiết kế trung gian giữa các đoạn. Tốc độ thiết kế đường bộ cao tốc được xác định theo Quy chuẩn kỹ thuật quốc gia về đường bộ cao tốc QCVN 115:2024/BGTVT.\n\n3. Tốc độ thiết kế đường bộ được xác định theo Tiêu chuẩn quốc gia TCVN 4054: 2005 Đường ô tô - Yêu cầu thiết kế.\n\n4. Tốc độ thiết kế đường bộ trong phạm vi đô thị được xác định theo Quy chuẩn kỹ thuật quốc gia về hệ thống công trình hạ tầng kỹ thuật QCVN 07-4:2023/BXD.\n\n5. Tốc độ thiết kế đường giao thông nông thôn được xác định theo Tiêu chuẩn quốc gia TCVN 10380:2014 Đường giao thông nông thôn - Yêu cầu thiết kế.\n\n\n\nĐiều 6. Tốc độ khai thác tối đa cho phép xe cơ giới tham gia giao thông trên đường bộ (trừ đường cao tốc)\n\n1. Tốc độ khai thác tối đa cho phép xe cơ giới tham gia giao thông trên đường bộ trong khu vực đông dân cư\n\nBảng 1\n\nLoại xe cơ giới đường bộ Tốc độ khai thác tối đa (km/h) Tốc độ khai thác tối đa (km/h) Đường đôi; đường một chiều có từ hai làn xe cơ giới trở lên Đường hai chiều; đường một chiều có một làn xe cơ giới Các loại xe cơ giới, trừ các xe được quy định tại Điều 7 và Điều 8 Thông tư này 60 50\n\n2. Tốc độ khai thác tối đa cho phép xe cơ giới tham gia giao thông trên đường bộ ngoài khu vực đông dân cư\n\nBảng 2\n\nLoại xe cơ giới đường bộ Tốc độ khai thác tối đa (km/h) Tốc độ khai thác tối đa (km/h) Đường đôi; đường một chiều có từ hai làn xe cơ giới trở lên Đường hai chiều; đường một chiều có một làn xe cơ giới Xe ô tô chở người đến 28 chỗ không kể chỗ của người lái xe (trừ xe buýt); ô tô tải có trọng tải không lớn hơn 3,5 tấn 90 80 Xe ô tô chở người trên 28 chỗ không kể chỗ người lái xe (trừ xe buýt); ô tô tải có trọng tải trên 3,5 tấn (trừ ô tô xi téc) 80 70 Xe buýt; ô tô đầu kéo kéo sơ mi rơ moóc (trừ ô tô đầu kéo kéo sơ mi rơ moóc xi téc); xe mô tô; ô tô chuyên dùng (trừ ô tô trộn vữa, ô tô trộn bê tông lưu động) 70 60 Ô tô kéo rơ moóc; ô tô kéo xe khác; ô tô trộn vữa, ô tô trộn bê tông lưu động, ô tô xi téc, ô tô đầu kéo kéo sơ mi rơ moóc xi téc, ô tô kéo theo rơ moóc xi téc) 60 50\n\nĐiều 7. Tốc độ khai thác tối đa cho phép đối với xe máy chuyên dùng, xe gắn máy và các loại xe tương tự tham gia giao thông trên đường bộ (trừ đường cao tốc)\n\nXe máy chuyên dùng, xe gắn máy và các loại xe tương tự khi tham gia giao thông, tốc độ khai thác tối đa là 40 km/h.\n\nĐiều 8. Tốc độ khai thác tối đa cho phép đối với xe chở người bốn bánh có gắn động cơ, xe chở hàng bốn bánh có gắn động cơ tham gia giao thông trên đường bộ (trừ đường cao tốc)\n\n1. Xe chở người bốn bánh có gắn động cơ khi tham gia giao thông trong phạm vi và thời gian cho phép hoạt động, tốc độ khai thác tối đa là 30 km/h.\n\n2. Xe chở hàng bốn bánh có gắn động cơ khi tham gia giao thông trong phạm vi và thời gian cho phép hoạt động, tốc độ khai thác tối đa là 50 km/h.\n\nĐiều 9. Tốc độ khai thác tối đa, tốc độ khai thác tối thiểu cho phép đối với các loại xe cơ giới, xe máy chuyên dùng trên đường cao tốc\n\n1. Đường cao tốc phải được đặt biển báo tốc độ khai thác tối đa, tốc độ khai thác tối thiểu.\n\n2. Tốc độ khai thác tối đa cho phép trên đường cao tốc là 120 km/h.\n\n3. Tốc độ khai thác tối thiểu cho phép trên đường cao tốc là 60 km/h. Trường hợp đường cao tốc có tốc độ thiết kế 60 km/h thì tốc độ khai thác tối thiểu thực hiện theo phương án tổ chức giao thông được cấp có thẩm quyền phê duyệt.']","**Nguồn văn bản:** /content/drive/MyDrive/ITProject_data/new_law/38_2024_TT-BGTVT_622477.docx

**Tên văn bản:** THÔNG TƯ QUY ĐỊNH VỀ TỐC ĐỘ VÀ KHOẢNG CÁCH AN TOÀN CỦA XE CƠ GIỚI, XE MÁY CHUYÊN DÙNG THAM GIA GIAO THÔNG TRÊN ĐƯỜNG BỘ

**Nội dung:**

Theo Thông tư số 38/2024/TT-BGTVT, tốc độ khai thác tối đa cho phép xe cơ giới tham gia giao thông trên đường bộ trong khu vực đông dân cư được quy định như sau:

* Đường đôi; đường một chiều có từ hai làn xe cơ giới trở lên: 60 km/h (đối với các loại xe cơ giới, trừ các xe được quy định tại Điều 7 và Điều 8 Thông tư này).

* Đường hai chiều; đường một chiều có một làn xe cơ giới: 50 km/h (đối với các loại xe cơ giới, trừ các xe được quy định tại Điều 7 và Điều 8 Thông tư này).


Lưu ý:  Đường bộ trong khu đông dân cư được định nghĩa là đoạn đường bộ nằm trong khu vực nội thành phố, nội thị xã, nội thị trấn và những đoạn đường có đông dân cư sinh sống sát dọc theo đường, được xác định bằng biển báo “Bắt đầu khu đông dân cư” và biển báo “Hết khu đông dân cư”.  Các loại xe khác (xe máy chuyên dùng, xe chở người bốn bánh, xe chở hàng bốn bánh) có tốc độ giới hạn khác nhau, được quy định cụ thể trong Thông tư.


Tóm lại: Tốc độ tối đa trong khu vực đô thị (khu đông dân cư) là 60km/h đối với đa số các loại xe cơ giới trên đường đôi/đường một chiều nhiều làn, và 50km/h trên đường hai chiều/đường một chiều một làn.  Tuy nhiên, cần xem xét các quy định cụ thể hơn cho từng loại xe trong Thông tư số 38/2024/TT-BGTVT.
",Tốc độ tối đa trong khu vực đô thị được giảm từ 50 km/h xuống 40 km/h.,1.0,0.6737691939350047,0.0,0.0
15,Quy định mới về tốc độ tối đa ngoài khu vực đô thị là gì?,"['BỘ GIAO THÔNG VẬN TẢI\n-------- CỘNG HÒA XÃ HỘI CHỦ NGHĨA VIỆT NAM\nĐộc lập - Tự do - Hạnh phúc \n--------------- Số: 38/2024/TT-BGTVT Hà Nội, Ngày 15 tháng 11 năm 2024\n\nTHÔNG TƯ\n\nQUY ĐỊNH VỀ TỐC ĐỘ VÀ KHOẢNG CÁCH AN TOÀN CỦA XE CƠ GIỚI, XE MÁY CHUYÊN DÙNG THAM GIA GIAO THÔNG TRÊN ĐƯỜNG BỘ\n\nCăn cứ Luật Trật tự, an toàn giao thông đường bộ ngày 27 tháng 6 năm 2024;\n\nCăn cứ Luật Đường bộ ngày 27 tháng 6 năm 2024;\n\nCăn cứ Nghị định số 56/2022/NĐ-CP ngày 24 tháng 8 năm 2022 của Chính phủ quy định chức năng, nhiệm vụ, quyền hạn và cơ cấu tổ chức của Bộ Giao thông vận tải;\n\nTheo đề nghị của Vụ trưởng Vụ Kết cấu hạ tầng giao thông và Cục trưởng Cục đường bộ Việt Nam;\n\nBộ trưởng Bộ Giao thông vận tải ban hành Thông tư quy định về tốc độ và khoảng cách an toàn của xe cơ giới, xe máy chuyên dùng tham gia giao thông trên đường bộ.\n\nChương I\n\nQUY ĐỊNH CHUNG\n\nĐiều 1. Phạm vi điều chỉnh\n\nThông tư này quy định về tốc độ thiết kế của đường bộ; tốc độ khai thác và khoảng cách an toàn của xe cơ giới, xe máy chuyên dùng khi tham gia giao thông trên đường bộ, trừ xe ưu tiên đang đi làm nhiệm vụ theo quy định của pháp luật.\n\nĐiều 2. Đối tượng áp dụng\n\nThông tư này áp dụng đối với người lái xe, người điều khiển xe máy chuyên dùng và tổ chức, cá nhân liên quan đến quản lý và thực hiện các quy định về tốc độ thiết kế, tốc độ khai thác của đường bộ và khoảng cách an toàn của xe cơ giới, xe máy chuyên dùng khi tham gia giao thông trên đường bộ.\n\nĐiều 3. Giải thích từ ngữ\n\nTrong Thông tư này, các từ ngữ dưới đây được hiểu như sau:\n\n1. Đường bộ trong khu đông dân cư là đoạn đường bộ nằm trong khu vực nội thành phố, nội thị xã, nội thị trấn và những đoạn đường có đông dân cư sinh sống sát dọc theo đường, được xác định bằng biển báo “Bắt đầu khu đông dân cư” và biển báo “Hết khu đông dân cư”.\n\n2. Đường đôi là đường có chiều đi và chiều về được phân biệt bằng dải phân cách giữa.\n\n3. Đường một chiều là đường chỉ cho đi một chiều.\n\n4. Đường hai chiều là đường dùng chung cho cả chiều đi và về trên cùng một phần đường xe chạy mà không có dải phân cách giữa.\n\n5. Trọng tải là khối lượng hàng hóa chuyên chở cho phép, được ghi trên Giấy chứng nhận an toàn kỹ thuật và bảo vệ môi trường của phương tiện giao thông cơ giới đường bộ, Giấy chứng \n\n\n\nnhận chất lượng an toàn kỹ thuật và bảo vệ môi trường xe cơ giới nhập khẩu hoặc Giấy chứng nhận chất lượng an toàn kỹ thuật và bảo vệ môi trường kiểu loại ô tô sản xuất, lắp ráp.\n\n6. Tốc độ khai thác tối đa là giá trị tốc độ lớn nhất cho phép phương tiện tham gia giao thông trên đường bộ bảo đảm an toàn giao thông và khai thác hiệu quả tuyến đường.\n\n7. Tốc độ khai thác tối thiểu là giá trị tốc độ nhỏ nhất cho phép phương tiện tham gia giao thông trên đường bộ bảo đảm an toàn giao thông và khai thác hiệu quả tuyến đường.\n\n8. Khoảng cách an toàn là cự ly tối thiểu giữa phương tiện phía sau với phương tiện đang di chuyển liền trước, cùng làn đường, bảo đảm tránh xảy ra va chạm trong trường hợp phương tiện phía trước đột ngột giảm tốc độ hoặc dừng lại.\n\n9. Tốc độ lưu hành là giá trị tốc độ của phương tiện tại thời điểm tham gia giao thông trên đường bộ.\n\nĐiều 4. Nguyên tắc chấp hành quy định về tốc độ khai thác và khoảng cách an toàn khi điều khiển phương tiện trên đường bộ\n\n1. Khi tham gia giao thông trên đường bộ, người lái xe, người điều khiển xe máy chuyên dùng phải chấp hành quy định về tốc độ khai thác và khoảng cách an toàn theo quy định tại Điều 12 Luật Trật tự, an toàn giao thông đường bộ.\n\n2. Tại những đoạn đường không bố trí biển báo tốc độ khai thác tối đa, không bố trí biển báo khoảng cách an toàn giữa hai xe, người điều khiển phương tiện tham gia giao thông phải thực hiện theo quy định tại Điều 6, Điều 7, Điều 8 và Điều 11 Thông tư này.\n\nChương II\n\nTỐC ĐỘ THIẾT KẾ CỦA ĐƯỜNG BỘ; TỐC ĐỘ KHAI THÁC CỦA ĐƯỜNG BỘ, KHOẢNG CÁCH AN TOÀN CỦA XE CƠ GIỚI, XE MÁY CHUYÊN DÙNG THAM GIA GIAO THÔNG TRÊN ĐƯỜNG BỘ\n\nĐiều 5. Tốc độ thiết kế của đường bộ\n\n1. Tốc độ thiết kế của đường bộ là giá trị vận tốc được dùng để tính toán các chỉ tiêu kỹ thuật của đường bộ. Tốc độ thiết kế của đường bộ được xác định trong giai đoạn đầu tư xây dựng, nâng cấp, cải tạo đường bộ nhằm bảo đảm cho phương tiện di chuyển an toàn; được quyết định theo cấp kỹ thuật của đường bộ và điều kiện địa hình.\n\n2. Tốc độ thiết kế đường bộ cao tốc là giá trị vận tốc được dùng để tính toán các chỉ tiêu kỹ thuật của đường bộ cao tốc, được xác định theo cấp đường cao tốc. Khi thiết kế đường bộ cao tốc có thể áp dụng tốc độ thiết kế khác nhau theo từng đoạn nhưng phải bảo đảm các yêu cầu về chiều dài đoạn chuyển tiếp và tốc độ thiết kế trung gian giữa các đoạn. Tốc độ thiết kế đường bộ cao tốc được xác định theo Quy chuẩn kỹ thuật quốc gia về đường bộ cao tốc QCVN 115:2024/BGTVT.\n\n3. Tốc độ thiết kế đường bộ được xác định theo Tiêu chuẩn quốc gia TCVN 4054: 2005 Đường ô tô - Yêu cầu thiết kế.\n\n4. Tốc độ thiết kế đường bộ trong phạm vi đô thị được xác định theo Quy chuẩn kỹ thuật quốc gia về hệ thống công trình hạ tầng kỹ thuật QCVN 07-4:2023/BXD.\n\n5. Tốc độ thiết kế đường giao thông nông thôn được xác định theo Tiêu chuẩn quốc gia TCVN 10380:2014 Đường giao thông nông thôn - Yêu cầu thiết kế.\n\n\n\nĐiều 6. Tốc độ khai thác tối đa cho phép xe cơ giới tham gia giao thông trên đường bộ (trừ đường cao tốc)\n\n1. Tốc độ khai thác tối đa cho phép xe cơ giới tham gia giao thông trên đường bộ trong khu vực đông dân cư\n\nBảng 1\n\nLoại xe cơ giới đường bộ Tốc độ khai thác tối đa (km/h) Tốc độ khai thác tối đa (km/h) Đường đôi; đường một chiều có từ hai làn xe cơ giới trở lên Đường hai chiều; đường một chiều có một làn xe cơ giới Các loại xe cơ giới, trừ các xe được quy định tại Điều 7 và Điều 8 Thông tư này 60 50\n\n2. Tốc độ khai thác tối đa cho phép xe cơ giới tham gia giao thông trên đường bộ ngoài khu vực đông dân cư\n\nBảng 2\n\nLoại xe cơ giới đường bộ Tốc độ khai thác tối đa (km/h) Tốc độ khai thác tối đa (km/h) Đường đôi; đường một chiều có từ hai làn xe cơ giới trở lên Đường hai chiều; đường một chiều có một làn xe cơ giới Xe ô tô chở người đến 28 chỗ không kể chỗ của người lái xe (trừ xe buýt); ô tô tải có trọng tải không lớn hơn 3,5 tấn 90 80 Xe ô tô chở người trên 28 chỗ không kể chỗ người lái xe (trừ xe buýt); ô tô tải có trọng tải trên 3,5 tấn (trừ ô tô xi téc) 80 70 Xe buýt; ô tô đầu kéo kéo sơ mi rơ moóc (trừ ô tô đầu kéo kéo sơ mi rơ moóc xi téc); xe mô tô; ô tô chuyên dùng (trừ ô tô trộn vữa, ô tô trộn bê tông lưu động) 70 60 Ô tô kéo rơ moóc; ô tô kéo xe khác; ô tô trộn vữa, ô tô trộn bê tông lưu động, ô tô xi téc, ô tô đầu kéo kéo sơ mi rơ moóc xi téc, ô tô kéo theo rơ moóc xi téc) 60 50\n\nĐiều 7. Tốc độ khai thác tối đa cho phép đối với xe máy chuyên dùng, xe gắn máy và các loại xe tương tự tham gia giao thông trên đường bộ (trừ đường cao tốc)\n\nXe máy chuyên dùng, xe gắn máy và các loại xe tương tự khi tham gia giao thông, tốc độ khai thác tối đa là 40 km/h.\n\nĐiều 8. Tốc độ khai thác tối đa cho phép đối với xe chở người bốn bánh có gắn động cơ, xe chở hàng bốn bánh có gắn động cơ tham gia giao thông trên đường bộ (trừ đường cao tốc)\n\n1. Xe chở người bốn bánh có gắn động cơ khi tham gia giao thông trong phạm vi và thời gian cho phép hoạt động, tốc độ khai thác tối đa là 30 km/h.\n\n2. Xe chở hàng bốn bánh có gắn động cơ khi tham gia giao thông trong phạm vi và thời gian cho phép hoạt động, tốc độ khai thác tối đa là 50 km/h.\n\nĐiều 9. Tốc độ khai thác tối đa, tốc độ khai thác tối thiểu cho phép đối với các loại xe cơ giới, xe máy chuyên dùng trên đường cao tốc\n\n1. Đường cao tốc phải được đặt biển báo tốc độ khai thác tối đa, tốc độ khai thác tối thiểu.\n\n2. Tốc độ khai thác tối đa cho phép trên đường cao tốc là 120 km/h.\n\n3. Tốc độ khai thác tối thiểu cho phép trên đường cao tốc là 60 km/h. Trường hợp đường cao tốc có tốc độ thiết kế 60 km/h thì tốc độ khai thác tối thiểu thực hiện theo phương án tổ chức giao thông được cấp có thẩm quyền phê duyệt.']","**Nguồn văn bản:** /content/drive/MyDrive/ITProject_data/new_law/38_2024_TT-BGTVT_622477.docx

**Tên văn bản:** THÔNG TƯ QUY ĐỊNH VỀ TỐC ĐỘ VÀ KHOẢNG CÁCH AN TOÀN CỦA XE CƠ GIỚI, XE MÁY CHUYÊN DÙNG THAM GIA GIAO THÔNG TRÊN ĐƯỜNG BỘ

**Nội dung:**

Quy định về tốc độ tối đa ngoài khu vực đô thị (ngoài khu đông dân cư) được nêu trong Điều 6, Bảng 2 của Thông tư:

2. Tốc độ khai thác tối đa cho phép xe cơ giới tham gia giao thông trên đường bộ ngoài khu vực đông dân cư:

	Bảng 2:

	Loại xe cơ giới đường bộ | Tốc độ khai thác tối đa (km/h) | Tốc độ khai thác tối đa (km/h)
	---|---|---
	Đường đôi; đường một chiều có từ hai làn xe cơ giới trở lên | Đường hai chiều; đường một chiều có một làn xe cơ giới |
	Xe ô tô chở người đến 28 chỗ không kể chỗ của người lái xe (trừ xe buýt); ô tô tải có trọng tải không lớn hơn 3,5 tấn | 90 | 80
	Xe ô tô chở người trên 28 chỗ không kể chỗ người lái xe (trừ xe buýt); ô tô tải có trọng tải trên 3,5 tấn (trừ ô tô xi téc) | 80 | 70
	Xe buýt; ô tô đầu kéo kéo sơ mi rơ moóc (trừ ô tô đầu kéo kéo sơ mi rơ moóc xi téc); xe mô tô; ô tô chuyên dùng (trừ ô tô trộn vữa, ô tô trộn bê tông lưu động) | 70 | 60
	Ô tô kéo rơ moóc; ô tô kéo xe khác; ô tô trộn vữa, ô tô trộn bê tông lưu động, ô tô xi téc, ô tô đầu kéo kéo sơ mi rơ moóc xi téc, ô tô kéo theo rơ moóc xi téc | 60 | 50


Tóm lại: Tốc độ tối đa ngoài khu vực đô thị phụ thuộc vào loại xe và loại đường (đường đôi/đường hai chiều, số làn đường).  Tốc độ tối đa dao động từ 50km/h đến 90km/h theo quy định trong Thông tư 38/2024/TT-BGTVT.
",Tốc độ tối đa ngoài khu vực đô thị được giảm từ 80 km/h xuống 70 km/h.,1.0,0.7299466640015521,0.0,0.0
16,Luật Giao thông Đường bộ 2025 có quy định gì về việc sử dụng đèn pha trong khu vực đô thị?,"['Điều 6. Cơ sở dữ liệu đường bộ\n\n1. Cơ sở dữ liệu đường bộ được thiết kế, xây dựng, vận hành theo Khung kiến trúc tổng thể quốc gia số, bao gồm:\n\na) Cơ sở dữ liệu về quy hoạch mạng lưới đường bộ, quy hoạch kết cấu hạ tầng đường bộ;\n\nb) Cơ sở dữ liệu về tình hình đầu tư, xây dựng kết cấu hạ tầng đường bộ;\n\nc) Cơ sở dữ liệu về kết cấu hạ tầng đường bộ đã đưa vào khai thác;\n\nd) Cơ sở dữ liệu thanh toán điện tử giao thông đường bộ;\n\nđ) Cơ sở dữ liệu về hoạt động vận tải bằng xe ô tô, trừ cơ sở dữ liệu về hành trình của phương tiện giao thông đường bộ, hình ảnh người lái xe và cơ sở dữ liệu về quản lý thời gian điều khiển phương tiện của người lái xe theo quy định của pháp luật.\n\n2. Cơ sở dữ liệu đường bộ được kết nối, chia sẻ với cơ sở dữ liệu về trật tự, an toàn giao thông đường bộ và các cơ sở dữ liệu khác có liên quan.\n\n3. Chính phủ quy định chi tiết khoản 1 và khoản 2 Điều này; quy định việc thu thập, quản lý, khai thác thông tin trong cơ sở dữ liệu đường bộ.\n\nĐiều 7. Các hành vi bị nghiêm cấm\n\n1. Phá hoại kết cấu hạ tầng đường bộ; khai thác, sử dụng kết cấu hạ tầng đường bộ trái quy định của pháp luật.\n\n2. Đấu nối trái phép vào đường chính, đường nhánh; tháo dỡ, di chuyển trái phép hoặc làm sai lệch công trình đường bộ.\n\n3. Lấn, chiếm, sử dụng, xây dựng trái phép trong phạm vi bảo vệ kết cấu hạ tầng đường bộ.\n\n4. Lắp đặt, tháo dỡ, di chuyển, điều chỉnh, che khuất báo hiệu đường bộ trái quy định của pháp luật; gắn, treo, lắp vào báo hiệu đường bộ nội dung không liên quan tới ý nghĩa, mục đích của báo hiệu đường bộ hoặc làm sai lệch báo hiệu đường bộ.\n\n5. Kinh doanh vận tải bằng xe ô tô, bằng xe bốn bánh có gắn động cơ mà không có giấy phép kinh doanh vận tải theo quy định của pháp luật hoặc kinh doanh không đúng giấy phép.\n\n6. Lập điểm đón, trả khách, bốc dỡ hàng hóa trái quy định của pháp luật.\n\nChương II\n\nKẾT CẤU HẠ TẦNG ĐƯỜNG BỘ \n\nMục 1. PHÂN LOẠI, ĐẶT TÊN, SỐ HIỆU ĐƯỜNG BỘ\n\nĐiều 8. Phân loại đường bộ theo cấp quản lý\n\n1. Đường bộ theo cấp quản lý bao gồm: quốc lộ, đường tỉnh, đường huyện, đường xã, đường thôn, đường đô thị, đường chuyên dùng và được xác định như sau:\n\na) Quốc lộ là đường nối liền Thủ đô Hà Nội với trung tâm hành chính cấp tỉnh; đường nối liền các trung tâm hành chính cấp tỉnh; đường có vị trí quan trọng đối với sự phát triển kinh tế - xã hội, bảo đảm quốc phòng, an ninh của vùng, khu vực;\n\nb) Đường tỉnh là đường nằm trong địa bàn một tỉnh nối trung tâm hành chính của tỉnh với trung tâm hành chính của huyện; đường có vị trí quan trọng đối với sự phát triển kinh tế - xã hội của tỉnh;\n\nc) Đường huyện là đường nối trung tâm hành chính của huyện với trung tâm hành chính của xã, cụm xã hoặc trung tâm hành chính của huyện lân cận; đường có vị trí quan trọng đối với sự phát triển kinh tế - xã hội của huyện;\n\nd) Đường xã là đường nối trung tâm hành chính của xã với thôn, làng, ấp, bản, buôn, bon, phum, sóc (sau đây gọi là thôn) và điểm dân cư nông thôn hoặc đường nối với xã lân cận; đường có vị trí quan trọng đối với sự phát triển kinh tế - xã hội của xã;\n\nđ) Đường thôn là đường trong khu vực thôn, đường trục nối thôn với khu vực sản xuất nông nghiệp, lâm nghiệp và cơ sở sản xuất, kinh doanh khác trên địa bàn thôn;\n\ne) Đường đô thị là đường trong phạm vi địa giới hành chính nội thành, nội thị, bao gồm: đường cao tốc đô thị, đường phố, đường ngõ, ngách, kiệt, hẻm trong đô thị;\n\ng) Đường chuyên dùng là đường chuyên phục vụ giao thông cho một hoặc một số cơ quan, tổ chức, cá nhân và đường nội bộ.\n\n2. Đường địa phương bao gồm: đường tỉnh, đường đô thị, đường huyện, đường xã, đường thôn.\n\n3. Bộ Giao thông vận tải có trách nhiệm quản lý quốc lộ, trừ quốc lộ quy định tại điểm a khoản 4 Điều này và đường gom, đường bên quy định tại điểm c khoản 4 Điều này.\n\n4. Ủy ban nhân dân cấp tỉnh có trách nhiệm quản lý các loại đường sau đây:\n\na) Quản lý đường tỉnh, quốc lộ đi qua đô thị loại đặc biệt; quốc lộ khi được phân cấp; tuyến, đoạn tuyến quốc lộ đã hoàn thành việc đầu tư xây dựng tuyến tránh thay thế phù hợp với quy hoạch mạng lưới đường bộ; tuyến, đoạn tuyến quốc lộ không còn trong quy hoạch mạng lưới đường bộ, trừ trường hợp quốc lộ có yêu cầu đặc biệt về bảo đảm quốc phòng, an ninh; tuyến, đoạn tuyến quốc lộ được Thủ tướng Chính phủ giao trên cơ sở đề nghị của Ủy ban nhân dân cấp tỉnh để đáp ứng nhu cầu phát triển kinh tế - xã hội, bảo đảm lợi ích quốc gia, quốc phòng, an ninh, khả năng bố trí nguồn lực của địa phương; tuyến, đoạn tuyến quốc lộ đã được điều chuyển tài sản về Ủy ban nhân dân cấp tỉnh quản lý theo quy định của pháp luật về quản lý, sử dụng tài sản công;\n\nb) Quy định việc quản lý đường đô thị, đường huyện, đường xã, đường thôn;\n\nc) Quản lý đường gom, đường bên tách khỏi quốc lộ.\n\n5. Người quản lý, sử dụng đường bộ đối với đường chuyên dùng có trách nhiệm quản lý đường chuyên dùng theo quy định của Luật này và quy định khác của pháp luật có liên quan.\n\n6. Chính phủ quy định chi tiết Điều này.\n\nĐiều 9. Phân loại đường bộ theo chức năng phục vụ\n\n1. Đường chính là đường phục vụ giao thông chủ yếu trong khu vực, kết nối giao thông các khu vực, vùng.\n\n2. Đường nhánh là đường nối vào đường chính, có chức năng kết nối giao thông các khu vực hai bên đường chính; kết nối giao thông từ đường gom vào đường chính thông qua nút giao.\n\n3. Đường gom là đường để gom hệ thống đường giao thông nội bộ của các khu đô thị, công nghiệp, kinh tế, dân cư, thương mại - dịch vụ và các đường khác vào đường chính hoặc vào đường nhánh trước khi đấu nối vào đường chính. Đường gom có thể là đường bên theo quy định tại khoản 4 Điều này.\n\n4. Đường bên là đường được xây dựng bên cạnh các đoạn đường chính để ngăn cách giao thông khu vực hai bên đường với đường chính. Đường bên được tách khỏi đường chính hoặc ngăn cách với đường chính bằng dải phân cách, tường bảo vệ, rào chắn.\n\n5. Đường dành cho giao thông công cộng là đường phục vụ cho tất cả mọi người, phương tiện giao thông đường bộ theo quy định của Luật này và quy định khác của pháp luật có liên quan.\n\n6. Đường nội bộ là đường trong phạm vi khu chung cư, đô thị, công nghiệp, kinh tế, thương mại - dịch vụ, các cơ quan, tổ chức, đơn vị khác và chỉ phục vụ các đối tượng được phép vào, ra bên trong phạm vi các khu vực quy định tại khoản này.\n\n7. Đường dành riêng cho người đi bộ, người đi xe đạp và các đường khác.\n\nĐiều 10. Cấp kỹ thuật của đường bộ\n\n1. Cấp kỹ thuật của đường bộ phải được xác định trong dự án đầu tư xây dựng đường bộ. Việc thiết kế, thi công xây dựng đường bộ phải thực hiện đúng quy định về cấp kỹ thuật tuyến đường trong dự án đầu tư xây dựng đường bộ được duyệt; tuân thủ quy chuẩn, tiêu chuẩn kỹ thuật về cấp kỹ thuật của đường bộ.\n\n2. Cấp kỹ thuật của đường bộ được quy định trong các quy chuẩn, tiêu chuẩn thiết kế của đường bộ, bao gồm:\n\na) Đường cao tốc;\n\nb) Đường cấp I, II, III, IV, V, VI;\n\nc) Đường đô thị;\n\nd) Đường cấp A, B, C, D, đường khác.\n\n3. Cấp kỹ thuật của đường bộ quy định tại các điểm a, b và d khoản 2 Điều này thực hiện theo quy chuẩn kỹ thuật quốc gia do Bộ trưởng Bộ Giao thông vận tải ban hành và tiêu chuẩn kỹ thuật do cấp có thẩm quyền công bố.\n\n4. Cấp kỹ thuật của đường bộ quy định tại điểm c khoản 2 Điều này thực hiện theo quy chuẩn kỹ thuật quốc gia do Bộ trưởng Bộ Xây dựng ban hành và tiêu chuẩn kỹ thuật do cấp có thẩm quyền công bố.\n\nĐiều 11. Đặt tên, đổi tên, số hiệu đường bộ\n\n1. Việc đặt tên, số hiệu đường bộ được quy định như sau:\n\na) Tên đường bộ được đặt theo tên danh nhân, người có công với đất nước; di tích, sự kiện lịch sử, văn hóa; tên địa danh hoặc tên theo tập quán. Số hiệu đường bộ được đặt theo số tự nhiên hoặc số tự nhiên kèm theo chữ cái nếu cần thiết. Trường hợp đường đô thị trùng với đường khác thì sử dụng cả tên đường đô thị và tên, số hiệu của đường khác;']","Không tìm thấy thông tin liên quan tới câu hỏi này.
",Cấm sử dụng đèn pha trong khu vực đô thị để tránh gây chói mắt cho người tham gia giao thông khác.,0.0,0.0,0.0,0.0
17,Quy định mới về việc đỗ xe trên vỉa hè là gì?,"['BỘ GIAO THÔNG VẬN TẢI\n------- CỘNG HÒA XÃ HỘI CHỦ NGHĨA VIỆT NAM\nĐộc lập - Tự do - Hạnh phúc \n--------------- Số: 58/2024/TT-BGTVT Hà Nội, ngày 15 tháng 11 năm 2024\n\nTHÔNG TƯ\n\nQUY ĐỊNH VỀ ĐẦU TƯ ĐIỂM DỪNG XE, ĐỖ XE VÀ VỊ TRÍ, QUY MÔ TRẠM DỪNG NGHỈ, ĐIỂM DỪNG XE, ĐỖ XE TRÊN ĐƯỜNG CAO TỐC\n\nCăn cứ Luật Đường bộ ngày 27 tháng 6 năm 2024;\n\nCăn cứ Nghị định số 56/2022/NĐ-CP ngày 24 tháng 8 năm 2022 của Chính phủ quy định chức năng, nhiệm vụ, quyền hạn và cơ cấu tổ chức của Bộ Giao thông vận tải;\n\nTheo đề nghị của Cục trưởng Cục Đường cao tốc Việt Nam;\n\nBộ trưởng Bộ Giao thông vận tải ban hành Thông tư quy định về đầu tư điểm dừng xe, đỗ xe và vị trí, quy mô trạm dừng nghỉ, điểm dừng xe, đỗ xe trên đường cao tốc.\n\nĐiều 1. Phạm vi điều chỉnh\n\nThông tư này quy định chi tiết khoản 3 và khoản 4 Điều 52 Luật Đường bộ, bao gồm:\n\n1. Xem xét quyết định việc đầu tư điểm dừng xe, đỗ xe trên đường cao tốc;\n\n2. Vị trí, quy mô trạm dừng nghỉ, điểm dừng xe, đỗ xe trên đường cao tốc.\n\nĐiều 2. Đối tượng áp dụng\n\nThông tư này áp dụng đối với tổ chức, cá nhân có liên quan đến quyết định đầu tư điểm dừng xe, đỗ xe và xác định vị trí, quy mô trạm dừng nghỉ, điểm dừng xe, đỗ xe trên đường cao tốc.\n\nĐiều 3. Đầu tư điểm dừng xe, đỗ xe\n\n1. Trong quá trình lập báo cáo nghiên cứu khả thi, căn cứ nhu cầu sử dụng dịch vụ, tính chất dự án, đơn vị chuẩn bị dự án nghiên cứu, đề xuất việc đầu tư điểm dừng xe, đỗ xe tại địa điểm:\n\na) Có cảnh quan thiên nhiên hoặc danh lam thắng cảnh, di tích lịch sử - văn hóa nhằm phát triển du lịch, quảng bá văn hóa địa phương;\n\nb) Có đường ra, vào thuận tiện, không che khuất tầm nhìn, phù hợp với tính chất, điều kiện địa hình, địa chất, thủy văn của công trình dự án, bảo đảm an toàn khi khai thác.\n\n\n\n2. Cơ quan quyết định đầu tư dự án đối với dự án đầu tư công hoặc cơ quan phê duyệt dự án đối với dự án đầu tư theo phương thức đối tác công tư quyết định đầu tư điểm dừng xe, đỗ xe căn cứ nghiên cứu, đề xuất của đơn vị chuẩn bị dự án tại khoản 1 Điều này.\n\nĐiều 4. Vị trí, quy mô điểm dừng xe, đỗ xe\n\n1. Điểm dừng xe, đỗ xe được xây dựng ngoài phạm vi hành lang an toàn đường bộ.\n\n2. Điểm dừng, đỗ xe có quy mô diện tích tối thiểu 500 m2 không bao gồm đường ra vào.\n\nĐiều 5. Các hạng mục công trình thuộc điểm dừng xe, đỗ xe\n\n1. Điểm dừng, đỗ xe bao gồm các hạng mục sau:\n\na) Đường ra, vào;\n\nb) Mặt bằng khu vực dừng xe, đỗ xe;\n\nc) Nơi cung cấp thông tin, bản đồ du lịch hoặc các thiết bị nghe, nhìn khác phục vụ cung cấp thông tin cho người tham gia giao thông hoặc quảng bá du lịch địa phương.\n\n2. Yêu cầu thiết kế các hạng mục tại khoản 1 Điều này như sau:\n\na) Đường ra, vào tuân thủ quy định về đường nhánh ra, vào trên đường cao tốc theo Quy chuẩn kỹ thuật quốc gia về đường bộ cao tốc;\n\nb) Kết cấu mặt bằng khu vực dừng xe, đỗ xe và nơi cung cấp thông tin là mặt đường bê tông xi măng có chiều dày tối thiểu 20 cm hoặc bê tông nhựa có chiều dày tối thiểu 7 cm;\n\nc) Đường lưu thông trong mặt bằng khu vực dừng xe, đỗ xe phải có các biển báo hiệu, vạch kẻ đường; có bán kính quay xe tối thiểu 10 m tính theo tim đường, đảm bảo cho các loại phương tiện lưu thông an toàn trong khu vực điểm dừng xe, đỗ xe;\n\nd) Có biện pháp thoát nước phù hợp.\n\nĐiều 6. Vị trí, quy mô trạm dừng nghỉ\n\n1. Trạm dừng nghỉ được xây dựng ngoài phạm vi hành lang an toàn đường bộ theo quy định tại điểm d khoản 1 Điều 39 Luật Đường bộ.\n\n2. Trong quá trình lập báo cáo nghiên cứu khả thi, đơn vị chuẩn bị dự án nghiên cứu, đề xuất vị trí, quy mô trạm dừng nghỉ căn cứ:\n\na) Quy chuẩn kỹ thuật quốc gia về trạm dừng nghỉ, quy chuẩn kỹ thuật quốc\n\ngia về đường bộ cao tốc;\n\n\n\nc) Hình thức đầu tư, khả năng cân đối nguồn lực đầu tư;\n\nd) Điều kiện địa hình, địa chất và tính chất của công trình dự án.\n\nĐiều 7. Hiệu lực thi hành\n\n1. Thông tư này có hiệu lực thi hành kể từ ngày 01 tháng 01 năm 2025.\n\n2. Đối với các trạm dừng nghỉ đã được phê duyệt và quyết định vị trí, quy mô trước ngày Thông tư này có hiệu lực thi hành thì tiếp tục thực hiện theo nội dung đã được phê duyệt./.\n\nNơi nhận:\n- Bộ trưởng (để b/c);\n- Các Thứ trưởng Bộ Giao thông vận tải;\n- Văn phòng Chính phủ;\n- Các bộ, cơ quan ngang bộ, cơ quan thuộc Chính phủ;\n- UBND các tỉnh, thành phố trực thuộc trung ương;\n- Cục Kiểm tra văn bản QPPL (Bộ Tư pháp);\n- Công báo;\n- Cổng thông tin điện tử Chính phủ;\n- Cổng thông tin điện tử Bộ GTVT;\n- Báo Giao thông, Tạp chí GTVT;\n- Lưu: VT, CĐTVN. KT. BỘ TRƯỞNG \nTHỨ TRƯỞNG\n\n\n\n\nNguyễn Duy Lâm']","Không tìm thấy thông tin liên quan tới câu hỏi này.
","Cấm đỗ xe trên vỉa hè, trừ những nơi có biển báo cho phép.",0.0,0.0,0.0,0.0
18,Luật Giao thông Đường bộ 2025 có quy định gì về việc sử dụng làn đường dành cho xe buýt?,"['Điều 21. Quy định về ngừng khai thác trên tuyến, đóng tuyến xe buýt; bổ sung xe, thay thế xe buýt khai thác trên tuyến\n\n1. Ngừng khai thác trên tuyến, đóng tuyến xe buýt\n\na) Trước khi ngừng khai thác ít nhất 30 ngày, đơn vị kinh doanh vận tải có văn bản thông báo ngừng khai thác trên tuyến gửi Sở Giao thông vận tải nơi cấp Giấy phép kinh doanh vận tải bằng xe ô tô.\n\nTrường hợp ngừng khai thác dẫn đến phải thay đổi tần suất chạy xe trên tuyến hoặc phải đóng tuyến, trong thời hạn 10 ngày làm việc kể từ ngày nhận được thông báo của đơn vị kinh doanh vận tải, Sở Giao thông vận tải nơi cấp Giấy phép kinh doanh vận tải bằng xe ô tô (hoặc thống nhất với Sở Giao thông vận tải đầu tuyến bên kia đối với tuyến xe buýt liên tỉnh) công bố tần suất chạy xe mới hoặc công bố đóng tuyến trên cơ sở đề nghị của đơn vị kinh doanh vận tải;\n\nb) Sở Giao thông vận tải có trách nhiệm công bố trên các phương tiện thông tin đại chúng chậm nhất 15 ngày làm việc kể từ ngày nhận được thông báo;\n\nc) Sau thời điểm ngừng khai thác tối đa 05 ngày làm việc, đơn vị kinh doanh vận tải phải nộp lại phù hiệu của các xe ngừng khai thác cho Sở Giao thông vận tải nơi cấp.\n\n2. Bổ sung xe, thay thế xe buýt\n\na) Đơn vị kinh doanh vận tải được thay thế xe đang khai thác trên tuyến hoặc được bổ sung xe nếu việc bổ sung không làm tăng số chuyến xe. Xe được bổ sung, thay thế phải có phù hiệu “XE BUÝT” và phải đảm bảo các yêu cầu về loại phương tiện tham gia khai thác tuyến theo hợp đồng đã ký kết;\n\nb) Đơn vị kinh doanh vận tải được sử dụng các phương tiện bất kỳ của đơn vị mình đã được cấp phù hiệu “XE BUÝT” để thay thế xe đột xuất khi xe đang hoạt động trên tuyến gặp sự cố kỹ thuật hoặc tai nạn giao thông hoặc do các nguyên nhân bất khả kháng khác.\n\nĐiều 22. Quyền hạn và trách nhiệm của đơn vị kinh doanh vận tải hành khách công cộng bằng xe buýt\n\n1. Tổ chức, thực hiện đúng biểu đồ chạy xe theo phương án khai thác đã ký kết trong hợp đồng.\n\n2. Thực hiện các quy định tại Điều 4 của Thông tư này.\n\n3. Xây dựng quy định nội bộ về đồng phục và thẻ tên cho người lái xe, nhân viên phục vụ trên xe, thẻ nhận dạng người lái xe; thẻ tên phải có ảnh, ghi rõ họ tên, đơn vị quản lý, thẻ tên có thể kết hợp với thẻ nhận dạng người lái xe.\n\n4. Được sử dụng thiết bị điện tử để niêm yết thông tin theo quy định tại khoản 2, khoản 3 và khoản 4 Điều 7 của Thông tư này.\n\n5. Thực hiện các trách nhiệm khác theo quy định tại Luật Đường bộ, Luật Trật tự, an toàn giao thông đường bộ; tuân thủ và duy trì các điều kiện kinh doanh đối với đơn vị kinh doanh vận tải hành khách công cộng bằng xe buýt trong quá trình hoạt động kinh doanh vận tải hành khách công cộng bằng xe buýt.\n\nĐiều 23. Quyền hạn và trách nhiệm của người lái xe, nhân viên phục vụ trên xe buýt\n\n1. Đeo thẻ tên, mặc đồng phục theo đúng mẫu đơn vị kinh doanh vận tải đã quy định.\n\n2. Thực hiện đúng biểu đồ, hành trình chạy xe đã được phê duyệt.\n\n3. Cung cấp thông tin về hành trình tuyến, các điểm dừng trên tuyến khi hành khách yêu cầu; hướng dẫn và giúp đỡ hành khách (đặc biệt là người khuyết tật, người cao tuổi, phụ nữ có thai và trẻ em) khi lên, xuống xe; có thái độ phục vụ văn minh, lịch sự.\n\n4. Giữ gìn vệ sinh phương tiện.\n\n5. Thực hiện các trách nhiệm khác theo quy định tại Luật Đường bộ, Luật Trật tự, an toàn giao thông đường bộ; tuân thủ và duy trì các điều kiện kinh doanh đối với người lái xe, nhân viên phục vụ trên xe buýt trong quá trình hoạt động kinh doanh vận tải hành khách công cộng bằng xe buýt.\n\nĐiều 24. Quyền hạn, trách nhiệm của hành khách đi xe buýt\n\n1. Mang theo hành lý với trọng lượng không quá 10 kg và kích thước không quá 30x40x60 cm. Đối với hành khách đi trên xe của tuyến xe buýt có điểm đầu hoặc điểm cuối nằm trong khu vực cảng hàng không, tuyến xe buýt liên tỉnh hành khách được mang theo hành lý với trọng lượng không quá 20 kg và kích thước phù hợp với thiết kế của xe.\n\n2. Chấp hành các quy định khi đi xe và sự hướng dẫn của người lái xe, nhân viên phục vụ trên xe.\n\n3. Yêu cầu nhân viên phục vụ trên xe xuất vé đúng loại sau khi trả tiền; giữ vé suốt hành trình và xuất trình vé khi người có thẩm quyền yêu cầu kiểm tra.\n\n4. Khiếu nại, kiến nghị, phản ánh những hành vi vi phạm quy định về quản lý vận tải của đơn vị kinh doanh vận tải, người lái xe, nhân viên phục vụ trên xe và yêu cầu bồi thường thiệt hại (nếu có).\n\n5. Thực hiện các trách nhiệm khác theo quy định tại Luật Đường bộ, Luật Trật tự, an toàn giao thông đường bộ.\n\nMục 4. KINH DOANH VẬN TẢI HÀNH KHÁCH BẰNG XE TAXI\n\nĐiều 25. Quy định đối với xe taxi\n\n1. Tuân thủ và duy trì các điều kiện kinh doanh đối với xe taxi trong quá trình hoạt động kinh doanh vận tải hành khách bằng xe taxi.\n\n2. Thực hiện niêm yết thông tin như sau:\n\na) Hai bên cánh cửa xe: tên, số điện thoại và biểu trưng (logo) của đơn vị kinh doanh vận tải với kích thước tối thiểu: chiều dài là 20 cm, chiều rộng là 20 cm; bảng giá cước đã kê khai theo mẫu quy định tại Phụ lục III ban hành kèm theo Thông tư này;\n\nb) Trong xe: bảng giá cước tính tiền theo kilômét (km), giá cước tính tiền cho thời gian xe phải chờ đợi theo yêu cầu của hành khách và các chi phí khác (nếu có) mà hành khách phải trả; bảng giá cước đã kê khai theo mẫu quy định tại Phụ lục III ban hành kèm theo Thông tư này;\n\nc) Trường hợp xe taxi sử dụng phần mềm tính tiền phải hiển thị trên giao diện dành cho hành khách bảng giá cước đã kê khai theo mẫu quy định tại Phụ lục III ban hành kèm theo Thông tư này.\n\n3. Việc đảm bảo điều kiện an toàn về phòng cháy và chữa cháy thực hiện theo quy định tại khoản 4 Điều 8 Thông tư này.\n\n4. Trong xe phải có Bảng hướng dẫn về an toàn giao thông và thoát hiểm cho hành khách, các nội dung chính gồm: hướng dẫn cài dây an toàn (nếu có); bảng cấm hút thuốc trên xe; hướng dẫn đóng, mở cửa xe đảm bảo an toàn.\n\nĐiều 26. Điểm dừng đón, trả khách công cộng, điểm đỗ xe taxi\n\n1. Điểm dừng đón, trả khách công cộng cho xe taxi phải đảm bảo an toàn giao thông và được báo hiệu bằng biển báo, vạch sơn kẻ đường theo quy định về tổ chức giao thông.\n\n2. Điểm đỗ xe taxi\n\na) Điểm đỗ xe taxi gồm 02 loại: điểm đỗ xe taxi do đơn vị kinh doanh vận tải tổ chức và quản lý; điểm đỗ xe taxi công cộng do cơ quan quản lý nhà nước của địa phương tổ chức và quản lý;\n\nb) Yêu cầu đối với điểm đỗ xe taxi: đảm bảo trật tự, an toàn và không gây ùn tắc giao thông; đáp ứng yêu cầu về phòng, chống cháy nổ và vệ sinh môi trường.\n\nĐiều 27. Quyền hạn và trách nhiệm của đơn vị kinh doanh vận tải hành khách bằng xe taxi\n\n1. Thực hiện các quy định tại Điều 4 của Thông tư này.\n\n2. Xây dựng quy định đồng phục và thẻ tên cho người lái xe, thẻ nhận dạng người lái xe; thẻ tên phải có ảnh, ghi rõ họ tên, đơn vị quản lý, thẻ tên có thể kết hợp với thẻ nhận dạng người lái xe.\n\n3. Được sử dụng thiết bị điện tử để niêm yết thông tin theo quy định tại khoản 2 Điều 25 của Thông tư này.\n\n4. Thực hiện các trách nhiệm khác theo quy định tại Luật Đường bộ, Luật Trật tự, an toàn giao thông đường bộ; tuân thủ và duy trì các điều kiện kinh doanh đối với đơn vị kinh doanh vận tải hành khách bằng xe taxi trong quá trình hoạt động kinh doanh vận tải hành khách bằng xe taxi.\n\nĐiều 28. Quyền hạn, trách nhiệm của người lái xe taxi\n\n1. Đeo thẻ tên, mặc đồng phục theo đúng quy định của đơn vị kinh doanh vận tải.\n\n2. Thu tiền cước của hành khách khi kết thúc hành trình theo đồng hồ tính tiền hoặc theo thông báo trên phần mềm hoặc theo thỏa thuận giữa hành khách với đơn vị kinh doanh vận tải.\n\n3. Giữ gìn vệ sinh phương tiện.\n\n4. Cung cấp thông tin về tuyến đường khi hành khách yêu cầu; hướng dẫn và giúp đỡ hành khách (đặc biệt là người khuyết tật, người cao tuổi, phụ nữ có thai và trẻ em) khi lên, xuống xe.\n\n5. Thực hiện các trách nhiệm khác theo quy định tại Luật Đường bộ, Luật Trật tự, an toàn giao thông đường bộ.\n\nĐiều 29. Quyền hạn, trách nhiệm của hành khách đi xe taxi\n\n1. Yêu cầu người lái xe cung cấp thông tin về hành trình chạy xe.']","**Nguồn văn bản:** /content/drive/MyDrive/ITProject_data/new_law/36_2024_TT-BGTVT_633950.docx

**Tên văn bản:** Không có thông tin trong context

**Điều:** Không có thông tin trong context

**Nội dung:**

Tôi xin lỗi, nhưng văn bản được cung cấp không chứa thông tin về quy định sử dụng làn đường dành cho xe buýt.  Văn bản tập trung vào các quy định về quản lý và vận hành xe buýt, bao gồm:

* Ngừng khai thác, đóng tuyến xe buýt:  Quy trình thông báo, thời hạn, và việc nộp lại phù hiệu.
    * Trước khi ngừng khai thác ít nhất 30 ngày, đơn vị kinh doanh vận tải phải thông báo bằng văn bản.
    * Sở Giao thông vận tải có trách nhiệm công bố trên các phương tiện thông tin đại chúng.
    * Sau khi ngừng khai thác tối đa 05 ngày làm việc, đơn vị kinh doanh vận tải phải nộp lại phù hiệu.

* Bổ sung và thay thế xe buýt:  Quy định về việc thay thế xe đang khai thác hoặc bổ sung xe mới, đảm bảo xe có phù hiệu “XE BUÝT” và đáp ứng các yêu cầu.

* Quyền hạn và trách nhiệm của đơn vị kinh doanh vận tải hành khách công cộng bằng xe buýt:  Bao gồm việc tổ chức, thực hiện biểu đồ chạy xe, xây dựng quy định nội bộ về đồng phục và thẻ tên, sử dụng thiết bị điện tử để niêm yết thông tin, và tuân thủ các quy định của Luật Đường bộ, Luật Trật tự, an toàn giao thông đường bộ.

* Quyền hạn và trách nhiệm của người lái xe, nhân viên phục vụ trên xe buýt:  Bao gồm việc đeo thẻ tên, mặc đồng phục, thực hiện đúng biểu đồ, hành trình chạy xe, cung cấp thông tin cho hành khách, giữ gìn vệ sinh phương tiện, và tuân thủ các quy định của Luật Đường bộ, Luật Trật tự, an toàn giao thông đường bộ.

* Quyền hạn và trách nhiệm của hành khách đi xe buýt:  Bao gồm việc mang hành lý, chấp hành quy định, yêu cầu xuất vé, khiếu nại, và tuân thủ các quy định của Luật Đường bộ, Luật Trật tự, an toàn giao thông đường bộ.


Tóm lại: Văn bản không đề cập đến quy định cụ thể về việc sử dụng làn đường dành cho xe buýt.  Để biết thông tin này, bạn cần tham khảo các văn bản pháp luật khác liên quan đến luật giao thông đường bộ.
",Cấm các phương tiện không phải xe buýt sử dụng làn đường dành riêng cho xe buýt trong giờ cao điểm.,1.0,0.0,0.0,0.0
19,"Quy định mới về việc sử dụng còi xe trong khu vực bệnh viện, trường học là gì?","['i) Sử dụng còi trong thời gian từ 22 giờ ngày hôm trước đến 05 giờ ngày hôm sau trong khu đông dân cư, khu vực cơ sở khám bệnh, chữa bệnh, trừ các xe ưu tiên đang đi làm nhiệm vụ theo quy định;\n\nk) Điều khiển xe chạy dưới tốc độ tối thiểu trên đoạn đường bộ có quy định tốc độ tối thiểu cho phép.\n\n2. Phạt tiền từ 400.000 đồng đến 600.000 đồng đối với người điều khiển xe thực hiện một trong các hành vi vi phạm sau đây:\n\na) Dừng xe, đỗ xe trên phần đường xe chạy ở đoạn đường ngoài đô thị nơi có lề đường;\n\nb) Điều khiển xe chạy quá tốc độ quy định từ 05 km/h đến dưới 10 km/h;\n\nc) Điều khiển xe chạy tốc độ thấp mà không đi bên phải phần đường xe chạy gây cản trở giao thông;\n\nd) Dừng xe, đỗ xe ở lòng đường gây cản trở giao thông; tụ tập từ 03 xe trở lên ở lòng đường, trong hầm đường bộ; đỗ, để xe ở lòng đường, vỉa hè trái phép;\n\nđ) Xe không được quyền ưu tiên lắp đặt, sử dụng thiết bị phát tín hiệu của xe được quyền ưu tiên;\n\ne) Dừng xe, đỗ xe trên điểm đón, trả khách, nơi đường bộ giao nhau, trên phần đường dành cho người đi bộ qua đường; dừng xe nơi có biển “Cấm dừng xe và đỗ xe”; đỗ xe tại nơi có biển “Cấm đỗ xe” hoặc biển “Cấm dừng xe và đỗ xe”; không tuân thủ các quy định về dừng xe, đỗ xe tại nơi đường bộ giao nhau cùng mức với đường sắt; dừng xe, đỗ xe trong phạm vi hành lang an toàn giao thông đường sắt;\n\ng) Chở theo 02 người trên xe, trừ trường hợp chở người bệnh đi cấp cứu, trẻ em dưới 12 tuổi, người già yếu hoặc người khuyết tật, áp giải người có hành vi vi phạm pháp luật;\n\nh) Không đội “mũ bảo hiểm cho người đi mô tô, xe máy” hoặc đội “mũ bảo hiểm cho người đi mô tô, xe máy” không cài quai đúng quy cách khi điều khiển xe tham gia giao thông trên đường bộ;\n\ni) Chở người ngồi trên xe không đội “mũ bảo hiểm cho người đi mô tô, xe máy” hoặc đội “mũ bảo hiểm cho người đi mô tô, xe máy” không cài quai đúng quy cách, trừ trường hợp chở người bệnh đi cấp cứu, trẻ em dưới 06 tuổi, áp giải người có hành vi vi phạm pháp luật;\n\nk) Quay đầu xe tại nơi không được quay đầu xe, trừ hành vi vi phạm quy định tại điểm d khoản 4 Điều này.\n\n3. Phạt tiền từ 600.000 đồng đến 800.000 đồng đối với người điều khiển xe thực hiện một trong các hành vi vi phạm sau đây:\n\na) Chuyển hướng không quan sát hoặc không bảo đảm khoảng cách an toàn với xe phía sau hoặc không giảm tốc độ hoặc không có tín hiệu báo hướng rẽ hoặc có tín hiệu báo hướng rẽ nhưng không sử dụng liên tục trong quá trình chuyển hướng (trừ trường hợp điều khiển xe đi theo hướng cong của đoạn đường bộ ở nơi đường không giao nhau cùng mức); điều khiển xe rẽ trái tại nơi có biển báo hiệu có nội dung cấm rẽ trái đối với loại phương tiện đang điều khiển; điều khiển xe rẽ phải tại nơi có biển báo hiệu có nội dung cấm rẽ phải đối với loại phương tiện đang điều khiển;\n\nb) Chở theo từ 03 người trở lên trên xe;\n\nc) Dừng xe, đỗ xe trên cầu;\n\nd) Điều khiển xe không đi bên phải theo chiều đi của mình; đi không đúng phần đường, làn đường quy định (làn cùng chiều hoặc làn ngược chiều); điều khiển xe đi qua dải phân cách cố định ở giữa hai phần đường xe chạy;\n\nđ) Vượt bên phải trong trường hợp không được phép;\n\ne) Người đang điều khiển xe hoặc chở người ngồi trên xe bám, kéo, đẩy xe khác, vật khác, dẫn dắt vật nuôi, mang vác vật cồng kềnh; chở người đứng trên yên, giá đèo hàng hoặc ngồi trên tay lái của xe;\n\ng) Điều khiển xe kéo theo xe khác, vật khác;\n\nh) Chạy trong hầm đường bộ không sử dụng đèn chiếu sáng gần;\n\ni) Không giữ khoảng cách an toàn để xảy ra va chạm với xe chạy liền trước hoặc không giữ khoảng cách theo quy định của biển báo hiệu “Cự ly tối thiểu giữa hai xe”;\n\nk) Điều khiển xe chạy dàn hàng ngang từ 03 xe trở lên;\n\nl) Xe được quyền ưu tiên lắp đặt, sử dụng thiết bị phát tín hiệu ưu tiên không đúng quy định hoặc sử dụng thiết bị phát tín hiệu ưu tiên mà không có giấy phép của cơ quan có thẩm quyền cấp hoặc có giấy phép của cơ quan có thẩm quyền cấp nhưng không còn giá trị sử dụng theo quy định.\n\n4. Phạt tiền từ 800.000 đồng đến 1.000.000 đồng đối với người điều khiển xe thực hiện một trong các hành vi vi phạm sau đây:\n\na) Điều khiển xe chạy quá tốc độ quy định từ 10 km/h đến 20 km/h;\n\nb) Dừng xe, đỗ xe trong hầm đường bộ không đúng nơi quy định;\n\nc) Vượt xe trong những trường hợp không được vượt, vượt xe tại đoạn đường có biển báo hiệu có nội dung cấm vượt đối với loại phương tiện đang điều khiển, trừ các hành vi vi phạm quy định tại điểm đ khoản 3 Điều này;\n\nd) Quay đầu xe trong hầm đường bộ;\n\nđ) Người đang điều khiển xe sử dụng ô (dù), thiết bị âm thanh (trừ thiết bị trợ thính), dùng tay cầm và sử dụng điện thoại hoặc các thiết bị điện tử khác.\n\n5. Phạt tiền từ 1.000.000 đồng đến 2.000.000 đồng đối với người điều khiển xe thực hiện một trong các hành vi vi phạm sau đây:\n\na) Điều khiển xe có liên quan trực tiếp đến vụ tai nạn giao thông mà không dừng ngay phương tiện, không giữ nguyên hiện trường, không trợ giúp người bị nạn, trừ hành vi vi phạm quy định tại điểm c khoản 9 Điều này;\n\nb) Chuyển hướng không nhường quyền đi trước cho: người đi bộ, xe lăn của người khuyết tật qua đường tại nơi có vạch kẻ đường dành cho người đi bộ; xe thô sơ đang đi trên phần đường dành cho xe thô sơ;\n\nc) Chuyển hướng không nhường đường cho: các xe đi ngược chiều; người đi bộ, xe thô sơ đang qua đường tại nơi không có vạch kẻ đường cho người đi bộ.\n\n6. Phạt tiền từ 2.000.000 đồng đến 3.000.000 đồng đối với người điều khiển xe thực hiện một trong các hành vi vi phạm sau đây:\n\na) Điều khiển xe trên đường mà trong máu hoặc hơi thở có nồng độ cồn nhưng chưa vượt quá 50 miligam/100 mililít máu hoặc chưa vượt quá 0,25 miligam/1 lít khí thở;\n\nb) Đi vào khu vực cấm, đường có biển báo hiệu có nội dung cấm đi vào đối với loại phương tiện đang điều khiển, trừ các hành vi vi phạm quy định tại điểm a, điểm b khoản 7 Điều này và các trường hợp xe ưu tiên đang đi làm nhiệm vụ khẩn cấp theo quy định;\n\nc) Không giảm tốc độ (hoặc dừng lại) và nhường đường khi điều khiển xe đi từ đường không ưu tiên ra đường ưu tiên, từ đường nhánh ra đường chính;\n\nd) Không giảm tốc độ và nhường đường cho xe đi đến từ bên phải tại nơi đường giao nhau không có báo hiệu đi theo vòng xuyến; không giảm tốc độ và nhường đường cho xe đi đến từ bên trái tại nơi đường giao nhau có báo hiệu đi theo vòng xuyến.\n\n7. Phạt tiền từ 4.000.000 đồng đến 6.000.000 đồng đối với người điều khiển xe thực hiện một trong các hành vi vi phạm sau đây:\n\na) Đi ngược chiều của đường một chiều, đi ngược chiều trên đường có biển “Cấm đi ngược chiều”, trừ hành vi vi phạm quy định tại điểm b khoản này và các trường hợp xe ưu tiên đang đi làm nhiệm vụ khẩn cấp theo quy định; điều khiển xe đi trên vỉa hè, trừ trường hợp điều khiển xe đi qua vỉa hè để vào nhà, cơ quan;\n\nb) Điều khiển xe đi vào đường cao tốc, trừ xe phục vụ việc quản lý, bảo trì đường cao tốc;\n\nc) Không chấp hành hiệu lệnh của đèn tín hiệu giao thông;\n\nd) Không chấp hành hiệu lệnh, hướng dẫn của người điều khiển giao thông hoặc người kiểm soát giao thông;\n\nđ) Không nhường đường hoặc gây cản trở xe được quyền ưu tiên đang phát tín hiệu ưu tiên đi làm nhiệm vụ.\n\n8. Phạt tiền từ 6.000.000 đồng đến 8.000.000 đồng đối với người điều khiển xe thực hiện một trong các hành vi vi phạm sau đây:\n\na) Điều khiển xe chạy quá tốc độ quy định trên 20 km/h;\n\nb) Điều khiển xe trên đường mà trong máu hoặc hơi thở có nồng độ cồn vượt quá 50 miligam đến 80 miligam/100 mililít máu hoặc vượt quá 0,25 miligam đến 0,4 miligam/1 lít khí thở.\n\n9. Phạt tiền từ 8.000.000 đồng đến 10.000.000 đồng đối với người điều khiển xe thực hiện một trong các hành vi vi phạm sau đây:\n\na) Điều khiển xe lạng lách, đánh võng trên đường bộ; sử dụng chân chống hoặc vật khác quệt xuống đường khi xe đang chạy;\n\nb) Điều khiển xe thành nhóm từ 02 xe trở lên chạy quá tốc độ quy định;\n\nc) Gây tai nạn giao thông không dừng ngay phương tiện, không giữ nguyên hiện trường, không trợ giúp người bị nạn, không ở lại hiện trường hoặc không đến trình báo ngay với cơ quan công an, Ủy ban nhân dân nơi gần nhất;']","**Nguồn văn bản:** /content/drive/MyDrive/ITProject_data/new_law/168_2024_ND-CP_619502.docx

**Nội dung:**

i) Sử dụng còi trong thời gian từ 22 giờ ngày hôm trước đến 05 giờ ngày hôm sau trong khu đông dân cư, khu vực cơ sở khám bệnh, chữa bệnh, trừ các xe ưu tiên đang đi làm nhiệm vụ theo quy định.


Tóm lại:  Quy định cấm sử dụng còi xe từ 22 giờ đến 5 giờ sáng ở khu đông dân cư và khu vực bệnh viện, trường học (cơ sở khám bệnh, chữa bệnh), trừ xe ưu tiên đang làm nhiệm vụ.  Văn bản không nêu rõ hình phạt cụ thể cho việc vi phạm điều này.
","Cấm sử dụng còi xe trong khu vực bệnh viện, trường học để giảm tiếng ồn.",0.5,0.6109891057143285,0.0,0.0
20,Luật Giao thông Đường bộ 2025 có quy định gì về việc sử dụng ghế trẻ em trên ô tô?,"['PHỤ LỤC II\n\nPHÂN LOẠI Ô TÔ CHỞ NGƯỜI TRÊN 08 CHỖ KHÔNG KỂ CHỖ CỦA NGƯỜI LÁI XE\n(Ban hành kèm theo Thông tư số 53/2024/TT-BGTVT ngày 15tháng11 năm 2024 của Bộ trưởng Bộ Giao thông vận tải quy định về phân loại phương tiện giao thông đường bộ và dấu hiệu nhận biết xe cơ giới sử dụng năng lượng sạch, năng lượng xanh, thân thiện môi trường)\n\nMục Tên gọi Đặc điểm Hình vẽ minh họa, ví dụ (nếu có) 1 Ô tô khách (Bus, Coach, Minibus) Ô tô chở người trên 08 chỗ không kể chỗ của người lái xe, có thể có 01 hoặc 02 tầng và không bao gồm các xe ô tô nêu từ Mục 2 đến Mục 11 của bảng này. 2 Ô tô khách giường nằm (Sleeper bus, Sleeper coach) Ô tô chở người trên 08 chỗ không kể chỗ của người lái xe chỉ trang bị giường nằm để chuyên chở hành khách, không kể ghế của người lái và 01 ghế của hướng dẫn viên (nếu có). 3 Ô tô khách thành phố (Ô tô buýt thành phố - Urban bus) Ô tô chở người từ 16 chỗ trở lên không kể chỗ của người lái xe được thiết kế và trang bị để sử dụng trong thành phố và ngoại ô. Trên xe có bố trí các ghế ngồi và chỗ đứng cho khách, cho phép hành khách di chuyển phù hợp với việc dừng, đỗ xe thường xuyên. 4 Ô tô khách thành phố nối toa (Ô tô buýt thành phố nối toa - Articulated bus) Ô tô khách thành phố có hai toa cứng vững trở lên được nối với nhau bằng một khớp quay, hành khách có thể di chuyển từ toa này sang toa khác. Việc nối hoặc tháo rời các toa chỉ có thể được tiến hành tại xưởng. 5 Ô tô khách thành phố hai tầng (Ô tô buýt thành phố hai tầng - Double-deck bus) Ô tô khách thành phố có hai tầng, có bố trí chỗ cho hành khách trên cả hai tầng nhưng không bố trí chỗ đứng cho hành khách trên tầng hai. 6 Ô tô khách thành phố, một tầng, không có nóc (Ô tô buýt thành phố một tầng, không có nóc - Urban bus without roof) Ô tô khách thành phố không có nóc che toàn bộ sàn hoặc một phần sàn xe. 7 Ô tô khách thành phố, hai tầng, không có nóc (Ô tô buýt thành phố, hai tầng, không có nóc - Double-deck bus without roof) Ô tô khách thành phố hai tầng, có tầng thứ hai không có nóc che toàn bộ sàn hoặc một phần sàn xe. 8 Ô tô khách thành phố để người khuyết tật tiếp cận sử dụng (Ô tô buýt thành phố để người khuyết tật tiếp cận sử dụng - Urban buses designed for easy access for disabled people) Ô tô khách thành phố có dấu hiệu nhận biết để người khuyết tật tiếp cận sử dụng và có kết cấu, trang bị đáp ứng Quy chuẩn kỹ thuật quốc gia QCVN 82:2024/BGTVT. 9 Ô tô khách thành phố BRT (Ô tô buýt thành phố BRT - Bus rapid transit) Ô tô khách thành phố có chiều cao sàn xe ngang với chiều cao sàn của các điểm đỗ, dừng để nhận, trả khách. Có cửa lên xuống bên trái hoặc cả hai bên. Trên xe không bố trí: bậc lên xuống; thiết bị thu tiền vé, thu vé. 10 Ô tô khách tập lái (Driver training bus, Driver training coach) Ô tô khách có dấu hiệu nhận biết và trang thiết bị đáp ứng các yêu cầu về xe tập lái theo quy định về đào tạo lái xe. 11 Ô tô tương tự khác Ô tô tương tự các loại ô tô quy định tại Phụ lục này.\n\nPHỤ LỤC III\n\nPHÂN LOẠI Ô TÔ CHỞ NGƯỜI CHUYÊN DÙNG\n(Ban hành kèm theo Thông tư số 53/2024/TT-BGTVT ngày 15 tháng 11 năm 2024 của Bộ trưởng Bộ Giao thông vận tải quy định về phân loại phương tiện giao thông đường bộ và dấu hiệu nhận biết xe cơ giới sử dụng năng lượng sạch, năng lượng xanh, thân thiện môi trường)\n\nMục Tên gọi Đặc điểm Hình vẽ minh họa hoặc ví dụ (nếu có) 1 Ô tô cứu thương (Ambulance) Ô tô chở người chuyên dùng có kết cấu và trang, thiết bị để cấp cứu bệnh nhân hoặc người bị thương trong quá trình vận chuyển. Có trang bị đèn, còi báo hiệu ưu tiên. 2 Ô tô chở phạm nhân (Prison van) Ô tô chở người chuyên dùng có kết cấu và trang bị để chở phạm nhân. 3 Ô tô nhà ở lưu động (Motorhome, Motor caravan) Ô tô chở người chuyên dùng có không gian để đáp ứng việc lưu trú, sinh hoạt của con người khi ô tô ở trạng thái không di chuyển (trạng thái nghỉ) và có các trang, thiết bị tối thiểu sau: - Bàn và ghế; - Chỗ ngủ (có thể được chuyển đổi từ ghế ngồi); - Thiết bị nấu ăn; - Kho chứa đồ (gồm: tủ hoặc ngăn kéo đựng đồ, khu vực bảo quản thức ăn, chứa dụng cụ nấu ăn…). Các trang, thiết bị trên phải được cố định chắc chắn vào sàn hoặc thành xe (riêng bàn có thể thiết kế để dễ dàng tháo rời được). Số chỗ ngủ bố trí trong xe ở trạng thái không di chuyển phải đáp ứng được số người cho phép chở kể cả người lái. Hệ thống điện phục vụ cho các thiết bị điện sinh hoạt phải độc lập với hệ thống điện của xe. Xe có thể được trang bị thêm: - Bồn chứa nước sạch, nước đã qua sử dụng, nước bẩn, bơm nước; - Khu vực vệ sinh gồm: thiết bị vệ sinh, tắm, rửa. 4 Ô tô tang lễ (Hearse, Funeral car, Funeral vehicle) Ô tô chở người chuyên dùng có kết cấu và trang bị để đặt và cố định quan tài chở thi thể. Trong khoang chở quan tài có thể bố trí hoặc không bố trí ghế chở người. 5 Ô tô chở học sinh (School bus) Ô tô chở người chuyên dùng được thiết kế chỉ để đưa, đón học sinh, có các đặc điểm sau: - Xe phải được sơn màu vàng đậm và phải có dấu hiệu nhận biết xe chở học sinh; - Phải có trang, thiết bị phù hợp để chở học sinh và trẻ em mầm non theo quy định của pháp luật; - Tổng số người cho phép chở kể cả người lái không được vượt quá 45 người (ngoại trừ xe chỉ chở trẻ em mầm non hoặc học sinh tiểu học); - Riêng xe được thiết kế chỉ chở trẻ em mầm non hoặc học sinh tiểu học thì số người cho phép chở kể cả người lái không được vượt quá 56 người; - Trường hợp chở từ 27 trẻ em mầm non và học sinh tiểu học trở lên phải bố trí tối thiểu 02 chỗ ngồi dành cho người quản lý học sinh (người trưởng thành). 6 Ô tô tương tự khác Ô tô tương tự các loại ô tô quy định tại Phụ lục này.\n\nPHỤ LỤC IV\n\nPHÂN LOẠI Ô TÔ TẢI THÔNG DỤNG\n(Ban hành kèm theo Thông tư số 53/2024/TT-BGTVT ngày 15 tháng 11 năm 2024 của Bộ trưởng Bộ Giao thông vận tải quy định về phân loại phương tiện giao thông đường bộ và dấu hiệu nhận biết xe cơ giới sử dụng năng lượng sạch, năng lượng xanh, thân thiện môi trường)']","Không tìm thấy thông tin liên quan tới câu hỏi này.
",Bắt buộc sử dụng ghế an toàn cho trẻ em dưới 12 tuổi khi ngồi trên ô tô.,0.0,0.0,0.0,0.0
21,Quy định mới về việc sử dụng dây an toàn trên ô tô là gì?,"['4. Giới hạn theo phương thẳng đứng của đường dây thông tin, viễn thông đi phía trên đường bộ không nhỏ hơn 5,5 mét tính từ điểm thấp nhất của đường dây thông tin, viễn thông đi qua đường bộ tới điểm cao nhất trên mặt đường. Trường hợp đường dây đi phía trên cầu đường bộ phải đáp ứng đồng thời quy định tại khoản này và điểm a khoản 2 Điều này.\n\n5. Giới hạn theo phương thẳng đứng của đường dây tải điện, dây dẫn điện đi phía trên đường bộ được quy định như sau:\n\na) Trường hợp đường dây tải điện, dây dẫn điện đi phía trên đường bộ thì khoảng cách theo phương thẳng đứng tính từ điểm cao nhất của mặt đường bộ tới điểm thấp nhất của đường dây tải điện, dây dẫn điện đi phía trên đường bộ không nhỏ hơn chiều cao tĩnh không của đường bộ cộng với khoảng cách an toàn phóng điện theo quy định của pháp luật về điện lực;\n\nb) Trường hợp đường dây tải điện, dây dẫn điện đi phía trên cầu phải đáp ứng quy định tại điểm a khoản 2 Điều này cộng với khoảng cách an toàn phóng điện theo quy định của pháp luật về điện lực, nhưng không thấp hơn quy định tại điểm a khoản này;\n\nc) Đường dây tải điện, dây dẫn điện đi phía trên cột đèn chiếu sáng của đường bộ phải bảo đảm khoảng cách theo phương thẳng đứng tính từ điểm cao nhất của cột đèn chiếu sáng tới điểm thấp nhất của đường dây tải điện, dây dẫn điện không nhỏ hơn 02 mét cộng với khoảng cách an toàn phóng điện theo quy định của pháp luật về điện lực.\n\n6. Trường hợp đường dây thông tin, viễn thông, đường dây tải điện, dây dẫn điện đi phía trên cầu dây treo, ngoài việc thực hiện quy định tại các khoản 2, 4 và 5 Điều này còn phải bảo đảm an toàn cho hệ thống dây treo và trụ tháp của cầu.\n\n7. Giới hạn khoảng cách an toàn trên không đối với trạm thu phí và các hạng mục công trình đường bộ khác được tính từ điểm cao nhất của công trình trở lên theo phương thẳng đứng là 02 mét; đối với đường dây tải điện, dây dẫn điện còn phải bảo đảm khoảng cách an toàn phóng điện theo quy định của pháp luật về điện lực.\n\n8. Khi tiến hành xây dựng, khai thác, bảo trì công trình ngầm bên dưới công trình đường bộ phải bảo đảm quy chuẩn, tiêu chuẩn kỹ thuật và bảo đảm an toàn cho công trình đường bộ, công trình liền kề.\n\n9. Chính phủ quy định chi tiết khoản 5 Điều này.\n\nĐiều 18. Xây dựng, lắp đặt biển quảng cáo, biển thông tin cổ động, tuyên truyền chính trị trong phạm vi bảo vệ kết cấu hạ tầng đường bộ\n\n1. Biển quảng cáo gồm bảng quảng cáo, băng rôn, biển hiệu, hộp đèn, màn hình chuyên quảng cáo theo quy định của pháp luật về quảng cáo. Biển quảng cáo được xây dựng, lắp đặt tại các vị trí sau đây:\n\na) Trong phạm vi hành lang an toàn đường bộ, trừ hành lang an toàn đường cao tốc và hành lang an toàn đường bộ tại nút giao;\n\nb) Trường hợp nút giao có đường kính lớn hơn 02 lần chiều rộng hành lang an toàn đường bộ, thì được xây dựng, lắp đặt biển quảng cáo trong phạm vi đất giữa nút giao nhưng phải bảo đảm khoảng cách từ biển quảng cáo đến mép ngoài mặt đường theo các hướng không nhỏ hơn chiều rộng hành lang an toàn đường bộ.\n\n2. Việc xây dựng, lắp đặt biển quảng cáo phải đáp ứng các yêu cầu sau đây:\n\na) Không được che khuất báo hiệu đường bộ; không ảnh hưởng đến tầm nhìn của người điều khiển phương tiện tham gia giao thông đường bộ;\n\nb) Không ảnh hưởng đến việc quản lý, khai thác, sử dụng và bảo trì đường bộ, không ảnh hưởng đến an toàn công trình hạ tầng trong phạm vi bảo vệ kết cấu hạ tầng đường bộ, an toàn giao thông đường bộ;\n\nc) Biển quảng cáo phải được lắp đặt bảo đảm bền vững, an toàn, chịu được tác động của tải trọng và các tác động khác; phải được thiết kế, thẩm định và xây dựng theo quy định của Luật này, quy định của pháp luật về xây dựng, pháp luật về quảng cáo.\n\n3. Việc xây dựng, lắp đặt biển quảng cáo quy định tại khoản 1 Điều này phải được cơ quan quản lý đường bộ chấp thuận bằng văn bản về vị trí, quy mô, kích thước biển quảng cáo, phương án thi công để bảo đảm an toàn giao thông, an toàn cho công trình đường bộ và công trình liền kề khác.\n\n4. Tổ chức, cá nhân xây dựng, lắp đặt biển quảng cáo có trách nhiệm sau đây:\n\na) Xây dựng, lắp đặt biển quảng cáo đáp ứng quy định tại các khoản 1, 2 và 3 Điều này;\n\nb) Việc tháo dỡ biển quảng cáo, các bộ phận của biển quảng cáo không được làm ảnh hưởng đến kết cấu hạ tầng đường bộ và không được bồi thường khi có yêu cầu của cơ quan quản lý đường bộ, người quản lý, sử dụng đường bộ;\n\nc) Tuân thủ quy định khác của Luật này, pháp luật về xây dựng, pháp luật về quảng cáo;\n\n5. Việc xây dựng, lắp đặt biển thông tin cổ động, tuyên truyền chính trị phải đáp ứng yêu cầu quy định tại khoản 2, khoản 3, điểm b và điểm c khoản 4 Điều này.\n\n6. Chính phủ quy định chi tiết khoản 3 Điều này.\n\nĐiều 19. Xây dựng, lắp đặt công trình hạ tầng trong phạm vi bảo vệ kết cấu hạ tầng đường bộ\n\n1. Trong phạm vi bảo vệ kết cấu hạ tầng đường bộ, không được xây dựng công trình khác, trừ trường hợp sau đây:\n\na) Công trình phục vụ quốc phòng, an ninh;\n\nb) Công trình thông tin, viễn thông, đường dây tải điện, dây dẫn điện, cột viễn thông, trạm thu phát sóng di động, cột điện;\n\nc) Công trình cấp năng lượng, cấp nước, thoát nước, trừ nhà máy nước, nhà máy sản xuất năng lượng;\n\nd) Công trình thủy lợi, đê điều, phòng, chống thiên tai, thủy điện;\n\nđ) Băng tải phục vụ sản xuất, công trình hạ tầng kỹ thuật đô thị, các công trình đặc biệt khác;\n\ne) Tuyến đường khác giao cắt hoặc đi song song với đường hiện hữu.\n\n2. Công trình quy định tại khoản 1 Điều này khi xây dựng, lắp đặt trong phạm vi bảo vệ kết cấu hạ tầng đường bộ phải bảo đảm quy chuẩn, tiêu chuẩn kỹ thuật, an toàn trong xây dựng, an toàn giao thông đường bộ, quy định của pháp luật về bảo vệ môi trường và không ảnh hưởng đến khai thác, sử dụng kết cấu hạ tầng đường bộ.\n\n3. Việc xây dựng, lắp đặt công trình quy định tại khoản 1 Điều này trong phạm vi bảo vệ kết cấu hạ tầng đường bộ phải được cơ quan quản lý đường bộ có thẩm quyền chấp thuận bằng văn bản, trừ công trình đê điều và trường hợp quy định tại khoản 4 Điều này.\n\n4. Đường dây tải điện, dây dẫn điện, đường dây thông tin, viễn thông xây dựng bên trên đường bộ không cần có văn bản chấp thuận của cơ quan quản lý đường bộ có thẩm quyền khi đáp ứng các quy định sau đây:\n\na) Cột công trình hạ tầng nằm ngoài hành lang an toàn đường bộ;\n\nb) Chiều cao đường dây đi bên trên đường bộ đáp ứng quy định tại Điều 17 của Luật này;\n\nc) Đường dây không ảnh hưởng đến an toàn trong vận hành, khai thác công trình đường bộ.\n\n5. Công trình hạ tầng xây dựng, lắp đặt trong phạm vi bảo vệ đường chuyên dùng phải được sự đồng ý của người quản lý, sử dụng đường bộ đối với đường chuyên dùng.\n\n6. Chủ sở hữu hoặc người quản lý, sử dụng công trình quy định tại khoản 1 Điều này, trừ công trình đê điều, công trình quốc phòng, an ninh phải hoàn trả công trình đường bộ bị ảnh hưởng, bố trí kinh phí và tổ chức di dời công trình trong các trường hợp sau đây:\n\na) Khi cơ quan quản lý đường bộ có thẩm quyền, người quản lý, sử dụng đường bộ có yêu cầu di dời công trình để đầu tư, xây dựng mới, nâng cấp, mở rộng, cải tạo, sửa chữa, bảo trì công trình đường bộ;\n\nb) Công trình ảnh hưởng đến an toàn giao thông đường bộ, an toàn công trình đường bộ mà không có biện pháp khắc phục;\n\nc) Công trình xây dựng trái phép.\n\n7. Chính phủ quy định chi tiết Điều này.\n\nĐiều 20. Xây dựng, quản lý, vận hành, khai thác, bảo trì công trình hạ tầng kỹ thuật sử dụng chung với đường bộ\n\n1. Công trình hạ tầng kỹ thuật sử dụng chung với đường bộ là công trình được xây dựng để bố trí, lắp đặt đường dây thông tin, viễn thông, đường dây tải điện, dây dẫn điện, chiếu sáng công cộng; đường ống cấp nước, thoát nước, cấp năng lượng.\n\n2. Việc xây dựng công trình hạ tầng kỹ thuật sử dụng chung với đường bộ phải đáp ứng các yêu cầu sau đây:\n\na) Phù hợp với quy hoạch, quy mô của dự án, cấp kỹ thuật của đường bộ;\n\nb) Bảo đảm quy chuẩn, tiêu chuẩn kỹ thuật trong xây dựng; bảo đảm quy định của pháp luật về phòng cháy, chữa cháy và cứu nạn, cứu hộ; bảo đảm an toàn công trình, bảo đảm cảnh quan và môi trường;']","Không tìm thấy thông tin liên quan tới câu hỏi này.
","Bắt buộc tất cả hành khách trên ô tô phải thắt dây an toàn, kể cả người ngồi ở hàng ghế sau.",0.0,0.0,0.0,0.0
22,Luật Giao thông Đường bộ 2025 có quy định gì về việc sử dụng mũ bảo hiểm cho người đi xe đạp điện?,"['5. Khi có tín hiệu của xe ưu tiên, người và phương tiện tham gia giao thông đường bộ phải giảm tốc độ, đi sát lề đường bên phải hoặc dừng lại để nhường đường, trạm thu phí phải ưu tiên cho xe ưu tiên qua trạm trong mọi tình huống, không được gây cản trở.\n\n6. Chính phủ quy định về quản lý, lắp đặt, sử dụng thiết bị phát tín hiệu của xe ưu tiên và trình tự, thủ tục cấp mới, cấp lại và thu hồi giấy phép sử dụng thiết bị phát tín hiệu của xe ưu tiên.\n\n7. Bộ trưởng Bộ Công an quy định các đoàn trong nước và khách nước ngoài đến Việt Nam có bố trí xe Cảnh sát giao thông dẫn đường; quy định quy trình dẫn đường của Cảnh sát giao thông đối với các đoàn trong nước và khách nước ngoài đến Việt Nam.\n\nĐiều 28. Trường hợp chở người trên xe ô tô chở hàng\n\n1. Chỉ được chở người trên thùng xe ô tô chở hàng trong trường hợp sau đây:\n\na) Chở người đi làm nhiệm vụ cứu nạn, cứu hộ, phòng, chống thiên tai, dịch bệnh hoặc thực hiện nhiệm vụ khẩn cấp; chở người bị nạn đi cấp cứu; đưa người ra khỏi khu vực nguy hiểm hoặc trong trường hợp khẩn cấp khác theo quy định của pháp luật;\n\nb) Chở người thuộc lực lượng vũ trang nhân dân đi làm nhiệm vụ khẩn cấp; \n\nc) Chở người đi thực hành lái xe trên xe tập lái; chở người dự sát hạch lái xe trên xe sát hạch; chở công nhân đang làm nhiệm vụ duy tu, bảo dưỡng đường bộ;\n\nd) Chở người diễu hành theo đoàn khi được cơ quan có thẩm quyền cho phép.\n\n2. Xe ô tô chở hàng mà chở người trong các trường hợp quy định tại khoản 1 Điều này phải bảo đảm an toàn khi tham gia giao thông đường bộ.\n\nĐiều 29. Xe kéo xe, xe kéo rơ moóc và xe ô tô đầu kéo kéo sơ mi rơ moóc\n\n1. Một xe ô tô chỉ được kéo theo một xe ô tô hoặc xe máy chuyên dùng khác khi xe được kéo không tự chạy được, trừ trường hợp quy định tại khoản 3 Điều 53 của Luật này và phải bảo đảm các quy định sau đây:\n\na) Xe được kéo phải có người điều khiển và hệ thống lái của xe đó phải còn hiệu lực;\n\nb) Việc nối xe kéo với xe được kéo phải bảo đảm chắc chắn, an toàn; trường hợp hệ thống hãm của xe được kéo không còn hiệu lực thì xe kéo nhau phải nối bằng thanh nối cứng;\n\nc) Phía trước của xe kéo và phía sau của xe được kéo phải có biển báo hiệu, có đèn cảnh báo nhấp nháy màu vàng.\n\n2. Xe kéo rơ moóc, xe ô tô đầu kéo chỉ được kéo rơ moóc, sơ mi rơ moóc phù hợp với thiết kế của xe; việc kết nối xe kéo với rơ moóc, xe ô tô đầu kéo với sơ mi rơ moóc phải bảo đảm chắc chắn, an toàn.\n\n3. Không được chở người trên xe được kéo, trừ người điều khiển; xe kéo rơ moóc, xe ô tô đầu kéo kéo sơ mi rơ moóc không được kéo thêm rơ moóc, sơ mi rơ moóc hoặc xe khác.\n\nĐiều 30. Người đi bộ; trẻ em, phụ nữ mang thai, người già yếu, người khuyết tật, người mất năng lực hành vi dân sự tham gia giao thông đường bộ\n\n1. Người đi bộ phải tuân thủ các quy định sau đây:\n\na) Phải đi trên vỉa hè, lề đường, đường dành riêng cho người đi bộ; trường hợp đường không có vỉa hè, lề đường, đường dành riêng cho người đi bộ thì người đi bộ phải đi sát mép đường bên phải theo chiều đi của mình;\n\nb) Chỉ được qua đường ở những nơi có đèn tín hiệu, có vạch kẻ đường hoặc có cầu vượt, hầm dành cho người đi bộ và phải tuân thủ tín hiệu chỉ dẫn, báo hiệu đường bộ. Trường hợp không có đèn tín hiệu, vạch kẻ đường, cầu vượt, hầm dành cho người đi bộ thì phải quan sát các xe đang đi tới, chỉ qua đường khi bảo đảm an toàn, khi qua đường phải có tín hiệu bằng tay;\n\nc) Không được vượt qua dải phân cách, đu, bám vào phương tiện giao thông đường bộ đang di chuyển; khi mang, vác vật cồng kềnh phải bảo đảm an toàn và không gây trở ngại cho người và phương tiện tham gia giao thông đường bộ.\n\n2. Trẻ em, phụ nữ mang thai, người già yếu, người khuyết tật, người mất năng lực hành vi dân sự tham gia giao thông đường bộ được quy định như sau:\n\na) Trẻ em dưới 07 tuổi khi đi qua đường phải có người lớn dẫn dắt; \n\nb) Người khuyết tật sử dụng xe lăn có động cơ hoặc không có động cơ phải đi trên vỉa hè, lề đường và nơi có vạch kẻ đường dành cho người đi bộ và xe thô sơ;\n\nc) Người khiếm thị khi đi trên đường bộ phải có người dẫn dắt hoặc có công cụ để báo hiệu cho người khác nhận biết là người khiếm thị;\n\nd) Người mất năng lực hành vi dân sự khi đi trên đường bộ phải có người dẫn dắt;\n\nđ) Mọi người có trách nhiệm giúp đỡ trẻ em dưới 07 tuổi, phụ nữ mang thai, người già yếu, người khuyết tật, người mất năng lực hành vi dân sự khi đi qua đường.\n\nĐiều 31. Người điều khiển, người được chở, hàng hóa xếp trên xe thô sơ\n\n1. Người điều khiển xe đạp, xe đạp máy chỉ được chở một người, trừ trường hợp chở thêm một trẻ em dưới 07 tuổi thì được chở tối đa hai người.\n\n2. Người điều khiển xe đạp, xe đạp máy không được thực hiện các hành vi quy định tại khoản 3 Điều 33 của Luật này; người được chở trên xe đạp, xe đạp máy khi tham gia giao thông đường bộ không được thực hiện các hành vi quy định tại khoản 4 Điều 33 của Luật này. \n\n3. Người điều khiển, người được chở trên xe đạp máy phải đội mũ bảo hiểm theo đúng quy chuẩn kỹ thuật quốc gia và cài quai đúng quy cách. \n\n4. Người điều khiển xe thô sơ chỉ được cho xe đi hàng một, nơi có phần đường dành cho xe thô sơ thì phải đi đúng phần đường quy định; khi tham gia giao thông đường bộ trong thời gian từ 18 giờ ngày hôm trước đến 06 giờ ngày hôm sau phải sử dụng đèn hoặc có báo hiệu ở phía trước và phía sau xe. \n\n5. Hàng hóa xếp trên xe thô sơ phải bảo đảm an toàn, không gây cản trở giao thông và che khuất tầm nhìn của người điều khiển. Hàng hóa xếp trên xe không vượt quá 1/3 chiều dài thân xe và không vượt quá 01 mét phía trước và phía sau xe; không vượt quá 0,4 mét mỗi bên bánh xe.\n\nĐiều 32. Người điều khiển, dẫn dắt vật nuôi, điều khiển xe vật nuôi kéo đi trên đường bộ\n\n1. Người điều khiển, dẫn dắt vật nuôi, điều khiển xe vật nuôi kéo đi trên đường bộ phải cho vật nuôi đi sát mép đường bên phải; trường hợp cần cho vật nuôi đi ngang qua đường thì phải quan sát và chỉ được đi qua đường khi có đủ điều kiện an toàn; không được gây cản trở cho người và phương tiện tham gia giao thông đường bộ khác.\n\n2. Không được điều khiển, dẫn dắt vật nuôi, điều khiển xe vật nuôi kéo đi vào làn đường dành cho xe cơ giới. \n\n3. Không được thả vật nuôi trên đường bộ.\n\nĐiều 33. Người lái xe, người được chở, hàng hóa xếp trên xe mô tô, xe gắn máy\n\n1. Người lái xe mô tô hai bánh, xe gắn máy chỉ được chở một người, trừ những trường hợp sau thì được chở tối đa hai người:\n\na) Chở người bệnh đi cấp cứu;\n\nb) Áp giải người có hành vi vi phạm pháp luật;\n\nc) Trẻ em dưới 12 tuổi;\n\nd) Người già yếu hoặc người khuyết tật.\n\n2. Người lái xe, người được chở trên xe mô tô hai bánh, xe mô tô ba bánh, xe gắn máy phải đội mũ bảo hiểm theo đúng quy chuẩn kỹ thuật quốc gia và cài quai đúng quy cách.\n\n3. Người lái xe mô tô hai bánh, xe mô tô ba bánh, xe gắn máy không được thực hiện các hành vi sau đây:\n\na) Đi xe dàn hàng ngang;\n\nb) Đi xe vào phần đường dành cho người đi bộ và phương tiện khác;\n\nc) Sử dụng ô, thiết bị âm thanh, trừ thiết bị trợ thính;\n\nd) Buông cả hai tay; đi xe bằng một bánh đối với xe mô tô, xe gắn máy hai bánh; đi xe bằng hai bánh đối với xe mô tô, xe gắn máy ba bánh;\n\nđ) Sử dụng xe để kéo, đẩy xe khác, vật khác, dẫn dắt vật nuôi, mang, vác và chở vật cồng kềnh; chở người đứng trên xe, giá đèo hàng hoặc ngồi trên tay lái; xếp hàng hóa trên xe quá giới hạn quy định;\n\ne) Ngồi về một bên điều khiển xe; đứng, nằm trên xe điều khiển xe; thay người lái xe khi xe đang chạy; quay người về phía sau để điều khiển xe hoặc bịt mắt điều khiển xe; sử dụng chân chống hoặc vật khác quệt xuống đường khi xe đang chạy;\n\ng) Hành vi khác gây mất trật tự, an toàn giao thông đường bộ.\n\n4. Người được chở trên xe mô tô hai bánh, xe mô tô ba bánh, xe gắn máy\xa0 khi tham gia giao thông đường bộ không được thực hiện các hành vi sau đây:\n\na) Mang, vác vật cồng kềnh;\n\nb) Sử dụng ô;\n\nc) Bám, kéo hoặc đẩy các phương tiện khác;\n\nd) Đứng trên yên, giá đèo hàng hoặc ngồi trên tay lái;\n\nđ) Hành vi khác gây mất trật tự, an toàn giao thông đường bộ.']","**Nguồn văn bản:** /content/drive/MyDrive/ITProject_data/new_law/36_2024_QH15_444251.docx

**Tên văn bản:** Không có thông tin

**Điều:** Không có thông tin

**Nội dung:**

Không tìm thấy thông tin cụ thể về quy định sử dụng mũ bảo hiểm cho người đi xe đạp điện trong văn bản được cung cấp.  Văn bản tập trung vào các quy định khác của luật giao thông đường bộ, bao gồm: ưu tiên cho xe ưu tiên, chở người trên xe ô tô chở hàng, xe kéo xe, người đi bộ, người điều khiển xe thô sơ, người điều khiển xe mô tô, xe gắn máy, v.v…  Tuy nhiên, văn bản có đề cập đến việc người điều khiển xe đạp máy và người được chở phải đội mũ bảo hiểm theo đúng quy chuẩn kỹ thuật quốc gia và cài quai đúng quy cách (Điều 31, khoản 3).  Điều này ám chỉ sự cần thiết của mũ bảo hiểm đối với một số loại phương tiện, nhưng không nêu rõ quy định cụ thể cho xe đạp điện.


Tóm lại: Văn bản không cung cấp thông tin về quy định mũ bảo hiểm cho người đi xe đạp điện.  Văn bản đề cập đến việc sử dụng mũ bảo hiểm cho người điều khiển và người ngồi trên xe đạp máy, nhưng không đề cập đến xe đạp điện.
",Bắt buộc người đi xe đạp điện phải đội mũ bảo hiểm đạt chuẩn.,1.0,0.719443166169334,1.0,0.0
23,Quy định mới về việc sử dụng xe máy điện là gì?,"['BỘ QUỐC PHÒNG\n------- CỘNG HÒA XÃ HỘI CHỦ NGHĨA VIỆT NAM\nĐộc lập - Tự do - Hạnh phúc \n--------------- Số: 66/2024/TT-BQP Hà Nội, ngày 14 tháng 10 năm 2024\n\nTHÔNG TƯ\n\nQUY ĐỊNH VỀ KIỂM ĐỊNH AN TOÀN KỸ THUẬT VÀ BẢO VỆ MÔI TRƯỜNG XE CƠ GIỚI, XE MÁY CHUYÊN DÙNG THUỘC PHẠM VI QUẢN LÝ CỦA BỘ QUỐC PHÒNG\n\nCăn cứ Luật Trật tự, an toàn giao thông đường bộ ngày 27 tháng 6 năm 2024;\n\nCăn cứ Nghị định số 01/2022/NĐ-CP ngày 30 tháng 11 năm 2022 của Chính phủ quy định chức năng, nhiệm vụ, quyền hạn và cơ cấu tổ chức của Bộ Quốc phòng;\n\nTheo đề nghị của Chủ nhiệm Tổng cục Kỹ thuật;\n\nBộ trưởng Bộ Quốc phòng ban hành Thông tư quy định về kiểm định an toàn kỹ thuật và bảo vệ môi trường xe cơ giới, xe máy chuyên dùng thuộc phạm vi quản lý của Bộ Quốc phòng.\n\nChương I\n\nQUY ĐỊNH CHUNG\n\nĐiều 1. Phạm vi điều chỉnh\n\nThông tư này quy định về kiểm định an toàn kỹ thuật và bảo vệ môi trường xe cơ giới, xe máy chuyên dùng của các cơ quan, đơn vị, doanh nghiệp thuộc phạm vi quản lý của Bộ Quốc phòng sử dụng vào mục đích quốc phòng, an ninh.\n\nĐiều 2. Đối tượng áp dụng\n\nThông tư này áp dụng đối với các trung tâm, trạm kiểm định an toàn kỹ thuật xe - máy quân sự; các cơ quan, đơn vị, doanh nghiệp thuộc phạm vi quản lý của Bộ Quốc phòng, các tổ chức và cá nhân liên quan đến việc kiểm định an toàn kỹ thuật và bảo vệ môi trường xe cơ giới, xe máy chuyên dùng.\n\nĐiều 3. Giải thích từ ngữ\n\nTrong Thông tư này, các từ ngữ dưới đây được hiểu như sau:\n\n1. Doanh nghiệp thuộc phạm vi quản lý của Bộ Quốc phòng (sau đây viết gọn là doanh nghiệp) là doanh nghiệp trực tiếp phục vụ quốc phòng, an ninh hoặc doanh nghiệp kết hợp kinh tế với quốc phòng, an ninh theo quy định tại Nghị định số 16/2023/NĐ-CP ngày 25 tháng 4 năm 2023 của Chính phủ về tổ chức quản lý và hoạt động của doanh nghiệp trực tiếp phục vụ quốc phòng, an ninh và doanh nghiệp kết hợp kinh tế với quốc phòng, an ninh; sửa đổi quy định tại điểm g khoản 1 Điều 23 Nghị định số 47/2021/NĐ-CP ngày 01 tháng 4 năm 2021 của Chính phủ quy định chi tiết một số điều của Luật Doanh nghiệp.\n\n2. Xe cơ giới là xe được trang bị cho các cơ quan, đơn vị, doanh nghiệp do Bộ Quốc phòng trực tiếp đăng ký, quản lý, sử dụng vào mục đích quốc phòng, an ninh.\n\n3. Xe cơ giới của doanh nghiệp là xe cơ giới sử dụng vào mục đích quốc phòng, an ninh không thuộc trường hợp xe cơ giới quy định tại khoản 2 Điều này.\n\n4. Xe máy chuyên dùng gồm xe máy chuyên dùng quân sự, xe máy thi công; xe máy nông nghiệp, lâm nghiệp và các loại xe chuyên dùng khác có tham gia giao thông được trang bị cho các cơ quan, đơn vị trực thuộc Bộ Quốc phòng theo quy định tại Phụ lục VI kèm theo Thông tư này.\n\n5. Cơ sở kiểm định là các trung tâm, trạm kiểm định an toàn kỹ thuật xe - máy quân sự do Tổng Tham mưu trưởng quyết định thành lập.\n\n6. Kiểm định an toàn kỹ thuật và bảo vệ môi trường xe cơ giới, xe máy chuyên dùng (sau đây viết gọn là kiểm định) là việc kiểm tra, đánh giá lần đầu và định kỳ tình trạng an toàn kỹ thuật và bảo vệ môi trường của xe cơ giới, xe máy chuyên dùng theo các tiêu chuẩn, quy chuẩn, quy định của nhà nước và Bộ Quốc phòng.\n\n7. Chu kỳ kiểm định là khoảng thời gian giữa hai lần kiểm định được tính bằng tháng.\n\n8. Phiếu kiểm định là bản xác nhận kết quả kiểm định an toàn kỹ thuật và bảo vệ môi trường của từng xe cơ giới, xe máy chuyên dùng khi kiểm định.\n\n9. Giấy chứng nhận an toàn kỹ thuật và bảo vệ môi trường xe cơ giới, xe máy chuyên dùng (sau đây gọi là Giấy chứng nhận kiểm định) là bản xác nhận cho xe cơ giới, xe máy chuyên dùng đã được kiểm định đạt các tiêu chuẩn, quy chuẩn, quy định của nhà nước và Bộ Quốc phòng về an toàn kỹ thuật và bảo vệ môi trường, đủ điều kiện tham gia giao thông đường bộ.\n\n\n\n10. Tem kiểm định an toàn kỹ thuật và bảo vệ môi trường xe cơ giới, xe máy chuyên dùng (sau đây viết gọn là Tem kiểm định) là biểu trưng do các cơ sở kiểm định cấp, dán lên xe cơ giới, xe máy chuyên dùng sau khi đã được cấp Giấy chứng nhận kiểm định và được phép tham gia giao thông đường bộ theo thời hạn ghi trên Tem kiểm định.\n\n11. Chỉ huy cơ sở kiểm định là giám đốc, phó giám đốc trung tâm kiểm định; trạm trưởng trạm kiểm định thuộc Bộ Quốc phòng.\n\n12. Kiểm định viên là người có đủ trình độ, kỹ năng, kinh nghiệm được tập huấn (đào tạo); cấp Giấy chứng nhận, thẻ kiểm định viên theo quy định của nhà nước, Bộ Quốc phòng để thực hiện một phần hoặc toàn bộ việc kiểm định xe cơ giới, xe máy chuyên dùng.\n\n13. Chương trình quản lý kiểm định là hệ thống phần mềm do Cục Xe máy - Vận tải/Tổng cục Hậu cần - Kỹ thuật xây dựng để quản lý cơ sở dữ liệu kiểm định và công tác kiểm định xe cơ giới, xe máy chuyên dùng; được sử dụng tại các cơ sở kiểm định và Cục Xe máy - Vận tải/Tổng cục Hậu cần - Kỹ thuật.\n\nĐiều 4. Những hành vi nghiêm cấm\n\n1. Kiểm định không đủ nội dung, không đúng quy trình, quy định; làm sai lệch kết quả kiểm định.\n\n2. Sử dụng thiết bị kiểm tra bị hư hỏng; phương tiện đo, thiết bị kiểm tra chưa được kiểm định, hiệu chuẩn hoặc quá thời hạn sử dụng.\n\n3. Bố trí không đúng, không đủ kiểm định viên trên dây chuyền kiểm định.\n\n4. Tự ý in phôi Giấy chứng nhận kiểm định, Tem kiểm định để sử dụng.\n\n5. Sửa đổi các nội dung in, ghi trên Giấy chứng nhận kiểm định, Tem kiểm định; tự ý bóc, dán Tem kiểm định.\n\n6. Có hành vi tiêu cực, sách nhiễu trong quá trình kiểm định.\n\n7. Kiểm định, cấp Giấy chứng nhận kiểm định, dán Tem kiểm định cho xe cơ giới, xe máy chuyên dùng của doanh nghiệp: Hết niên hạn sử dụng, không nộp phí sử dụng đường bộ theo quy định của pháp luật.\n\nChương II\n\nQUY ĐỊNH VỀ KIỂM ĐỊNH\n\nĐiều 5. Đối tượng, thẩm quyền kiểm định\n\n1. Xe cơ giới, xe máy chuyên dùng phải được kiểm định bằng các trang thiết bị, dụng cụ kiểm định tại cơ sở kiểm định hoặc cơ động (trừ các trường hợp được miễn kiểm định lần đầu theo quy định tại Điều 11 Thông tư này).\n\n2. Việc cơ động kiểm định chỉ áp dụng đối với các cơ quan, đơn vị, doanh nghiệp ở vùng sâu, vùng xa, biên giới, hải đảo không có điều kiện đưa xe cơ giới, xe máy chuyên dùng đến cơ sở kiểm định (khoảng cách từ cơ quan, đơn vị, doanh nghiệp đến cơ sở kiểm định phải có bán kính lớn hơn 50 km); nhóm xe tác chiến; xe cứu thương, cứu hoả, xe làm nhiệm vụ cứu hộ, cứu nạn; xe quá khổ, quá tải không vào được dây chuyền kiểm định.\n\n3. Chỉ huy cơ sở kiểm định kết luận, ký tên, đóng dấu trên Phiếu kiểm định, Giấy chứng nhận kiểm định, Tem kiểm định và chịu trách nhiệm trước pháp luật về kết quả kiểm định.\n\nĐiều 6. Hồ sơ kiểm định lần đầu\n\n1. Xe cơ giới, xe máy chuyên dùng.\n\na) Công văn hoặc giấy giới thiệu đề nghị kiểm định do chỉ huy cơ quan, đơn vị cấp trung đoàn hoặc tương đương trở lên ký tên, đóng dấu theo quy định;\n\nb) Chứng nhận đăng ký xe, lý lịch xe (áp dụng đối với xe cơ giới, xe máy chuyên dùng đã đăng ký);\n\nc) Biển số tạm thời (áp dụng đối với xe cơ giới, xe máy chuyên dùng chưa hoàn thành thủ tục đăng ký);\n\nd) Bản sao Giấy chứng nhận chất lượng an toàn kỹ thuật xe cơ giới, xe máy chuyên dùng cải tạo (áp dụng đối với xe cơ giới, xe máy chuyên dùng cải tạo).\n\n2. Xe cơ giới, xe máy chuyên dùng của doanh nghiệp.\n\na) Công văn hoặc giấy giới thiệu đề nghị kiểm định do giám đốc hoặc phó giám đốc doanh nghiệp ký tên, đóng dấu theo quy định;\n\nb) Chứng nhận đăng ký xe;\n\nc) Bản sao Giấy chứng nhận chất lượng an toàn kỹ thuật và bảo vệ môi trường xe cơ giới, xe máy chuyên dùng (áp dụng đối với xe cơ giới, xe máy chuyên dùng nhập khẩu);\n\n\n\nd) Bản sao Phiếu kiểm tra chất lượng xuất xưởng (áp dụng đối với xe cơ giới, xe máy chuyên dùng sản xuất, lắp ráp trong nước);\n\nđ) Bản sao Giấy chứng nhận chất lượng an toàn kỹ thuật và bảo vệ môi trường xe cơ giới, xe máy chuyên dùng cải tạo (áp dụng đối với xe cơ giới, xe máy chuyên dùng cải tạo).\n\nĐiều 7. Hồ sơ kiểm định định kỳ\n\n1. Xe cơ giới, xe máy chuyên dùng: Thực hiện theo quy định tại các điểm a, b khoản 1 Điều 6 Thông tư này.\n\n2. Xe cơ giới, xe máy chuyên dùng của doanh nghiệp: Thực hiện theo quy định tại các điểm a, b khoản 2 Điều 6 Thông tư này.\n\n3. Lập hồ sơ kiểm định.']","**Nguồn văn bản:** /content/drive/MyDrive/ITProject_data/new_law/66_2024_TT-BQP_628579.docx

**Tên văn bản:** THÔNG TƯ QUY ĐỊNH VỀ KIỂM ĐỊNH AN TOÀN KỸ THUẬT VÀ BẢO VỆ MÔI TRƯỜNG XE CƠ GIỚI, XE MÁY CHUYÊN DÙNG THUỘC PHẠM VI QUẢN LÝ CỦA BỘ QUỐC PHÒNG

**Nội dung:**

Thông tư này tập trung vào quy định về kiểm định an toàn kỹ thuật và bảo vệ môi trường xe cơ giới, xe máy chuyên dùng thuộc phạm vi quản lý của Bộ Quốc phòng, sử dụng vào mục đích quốc phòng, an ninh.  Nội dung bao gồm:

* Phạm vi điều chỉnh:  Quy định về kiểm định đối với xe cơ giới, xe máy chuyên dùng của các cơ quan, đơn vị, doanh nghiệp thuộc phạm vi quản lý của Bộ Quốc phòng.

* Đối tượng áp dụng: Các trung tâm, trạm kiểm định; các cơ quan, đơn vị, doanh nghiệp thuộc phạm vi quản lý của Bộ Quốc phòng; các tổ chức và cá nhân liên quan đến kiểm định.

* Giải thích từ ngữ: Định nghĩa các thuật ngữ như doanh nghiệp, xe cơ giới, xe máy chuyên dùng, cơ sở kiểm định, kiểm định, chu kỳ kiểm định, phiếu kiểm định, giấy chứng nhận kiểm định, tem kiểm định, chỉ huy cơ sở kiểm định, kiểm định viên, chương trình quản lý kiểm định.

* Hành vi nghiêm cấm:  Liệt kê các hành vi như kiểm định không đúng quy trình, sử dụng thiết bị hư hỏng, bố trí không đủ kiểm định viên, tự ý in giấy tờ, sửa đổi nội dung giấy tờ, hành vi tiêu cực, kiểm định cho xe hết hạn sử dụng hoặc không nộp phí đường bộ.

* Quy định về kiểm định:  Bao gồm đối tượng, thẩm quyền kiểm định; hồ sơ kiểm định lần đầu và định kỳ cho xe cơ giới, xe máy chuyên dùng của các cơ quan, đơn vị và doanh nghiệp.


Tóm lại: Thông tư này không đề cập trực tiếp đến quy định sử dụng xe máy điện mà chỉ quy định về kiểm định an toàn kỹ thuật và bảo vệ môi trường đối với xe cơ giới và xe máy chuyên dùng thuộc quản lý của Bộ Quốc phòng.  Không tìm thấy thông tin liên quan tới câu hỏi về quy định sử dụng xe máy điện.
",Người điều khiển xe máy điện phải có giấy phép lái xe hạng A1 trở lên.,0.9545454545454546,0.7367795764557451,0.0,0.0
24,Luật Giao thông Đường bộ 2025 có quy định gì về việc sử dụng xe đạp trên đường cao tốc?,"['BỘ GIAO THÔNG VẬN TẢI\n-------- CỘNG HÒA XÃ HỘI CHỦ NGHĨA VIỆT NAM\nĐộc lập - Tự do - Hạnh phúc \n--------------- Số: 38/2024/TT-BGTVT Hà Nội, Ngày 15 tháng 11 năm 2024\n\nTHÔNG TƯ\n\nQUY ĐỊNH VỀ TỐC ĐỘ VÀ KHOẢNG CÁCH AN TOÀN CỦA XE CƠ GIỚI, XE MÁY CHUYÊN DÙNG THAM GIA GIAO THÔNG TRÊN ĐƯỜNG BỘ\n\nCăn cứ Luật Trật tự, an toàn giao thông đường bộ ngày 27 tháng 6 năm 2024;\n\nCăn cứ Luật Đường bộ ngày 27 tháng 6 năm 2024;\n\nCăn cứ Nghị định số 56/2022/NĐ-CP ngày 24 tháng 8 năm 2022 của Chính phủ quy định chức năng, nhiệm vụ, quyền hạn và cơ cấu tổ chức của Bộ Giao thông vận tải;\n\nTheo đề nghị của Vụ trưởng Vụ Kết cấu hạ tầng giao thông và Cục trưởng Cục đường bộ Việt Nam;\n\nBộ trưởng Bộ Giao thông vận tải ban hành Thông tư quy định về tốc độ và khoảng cách an toàn của xe cơ giới, xe máy chuyên dùng tham gia giao thông trên đường bộ.\n\nChương I\n\nQUY ĐỊNH CHUNG\n\nĐiều 1. Phạm vi điều chỉnh\n\nThông tư này quy định về tốc độ thiết kế của đường bộ; tốc độ khai thác và khoảng cách an toàn của xe cơ giới, xe máy chuyên dùng khi tham gia giao thông trên đường bộ, trừ xe ưu tiên đang đi làm nhiệm vụ theo quy định của pháp luật.\n\nĐiều 2. Đối tượng áp dụng\n\nThông tư này áp dụng đối với người lái xe, người điều khiển xe máy chuyên dùng và tổ chức, cá nhân liên quan đến quản lý và thực hiện các quy định về tốc độ thiết kế, tốc độ khai thác của đường bộ và khoảng cách an toàn của xe cơ giới, xe máy chuyên dùng khi tham gia giao thông trên đường bộ.\n\nĐiều 3. Giải thích từ ngữ\n\nTrong Thông tư này, các từ ngữ dưới đây được hiểu như sau:\n\n1. Đường bộ trong khu đông dân cư là đoạn đường bộ nằm trong khu vực nội thành phố, nội thị xã, nội thị trấn và những đoạn đường có đông dân cư sinh sống sát dọc theo đường, được xác định bằng biển báo “Bắt đầu khu đông dân cư” và biển báo “Hết khu đông dân cư”.\n\n2. Đường đôi là đường có chiều đi và chiều về được phân biệt bằng dải phân cách giữa.\n\n3. Đường một chiều là đường chỉ cho đi một chiều.\n\n4. Đường hai chiều là đường dùng chung cho cả chiều đi và về trên cùng một phần đường xe chạy mà không có dải phân cách giữa.\n\n5. Trọng tải là khối lượng hàng hóa chuyên chở cho phép, được ghi trên Giấy chứng nhận an toàn kỹ thuật và bảo vệ môi trường của phương tiện giao thông cơ giới đường bộ, Giấy chứng \n\n\n\nnhận chất lượng an toàn kỹ thuật và bảo vệ môi trường xe cơ giới nhập khẩu hoặc Giấy chứng nhận chất lượng an toàn kỹ thuật và bảo vệ môi trường kiểu loại ô tô sản xuất, lắp ráp.\n\n6. Tốc độ khai thác tối đa là giá trị tốc độ lớn nhất cho phép phương tiện tham gia giao thông trên đường bộ bảo đảm an toàn giao thông và khai thác hiệu quả tuyến đường.\n\n7. Tốc độ khai thác tối thiểu là giá trị tốc độ nhỏ nhất cho phép phương tiện tham gia giao thông trên đường bộ bảo đảm an toàn giao thông và khai thác hiệu quả tuyến đường.\n\n8. Khoảng cách an toàn là cự ly tối thiểu giữa phương tiện phía sau với phương tiện đang di chuyển liền trước, cùng làn đường, bảo đảm tránh xảy ra va chạm trong trường hợp phương tiện phía trước đột ngột giảm tốc độ hoặc dừng lại.\n\n9. Tốc độ lưu hành là giá trị tốc độ của phương tiện tại thời điểm tham gia giao thông trên đường bộ.\n\nĐiều 4. Nguyên tắc chấp hành quy định về tốc độ khai thác và khoảng cách an toàn khi điều khiển phương tiện trên đường bộ\n\n1. Khi tham gia giao thông trên đường bộ, người lái xe, người điều khiển xe máy chuyên dùng phải chấp hành quy định về tốc độ khai thác và khoảng cách an toàn theo quy định tại Điều 12 Luật Trật tự, an toàn giao thông đường bộ.\n\n2. Tại những đoạn đường không bố trí biển báo tốc độ khai thác tối đa, không bố trí biển báo khoảng cách an toàn giữa hai xe, người điều khiển phương tiện tham gia giao thông phải thực hiện theo quy định tại Điều 6, Điều 7, Điều 8 và Điều 11 Thông tư này.\n\nChương II\n\nTỐC ĐỘ THIẾT KẾ CỦA ĐƯỜNG BỘ; TỐC ĐỘ KHAI THÁC CỦA ĐƯỜNG BỘ, KHOẢNG CÁCH AN TOÀN CỦA XE CƠ GIỚI, XE MÁY CHUYÊN DÙNG THAM GIA GIAO THÔNG TRÊN ĐƯỜNG BỘ\n\nĐiều 5. Tốc độ thiết kế của đường bộ\n\n1. Tốc độ thiết kế của đường bộ là giá trị vận tốc được dùng để tính toán các chỉ tiêu kỹ thuật của đường bộ. Tốc độ thiết kế của đường bộ được xác định trong giai đoạn đầu tư xây dựng, nâng cấp, cải tạo đường bộ nhằm bảo đảm cho phương tiện di chuyển an toàn; được quyết định theo cấp kỹ thuật của đường bộ và điều kiện địa hình.\n\n2. Tốc độ thiết kế đường bộ cao tốc là giá trị vận tốc được dùng để tính toán các chỉ tiêu kỹ thuật của đường bộ cao tốc, được xác định theo cấp đường cao tốc. Khi thiết kế đường bộ cao tốc có thể áp dụng tốc độ thiết kế khác nhau theo từng đoạn nhưng phải bảo đảm các yêu cầu về chiều dài đoạn chuyển tiếp và tốc độ thiết kế trung gian giữa các đoạn. Tốc độ thiết kế đường bộ cao tốc được xác định theo Quy chuẩn kỹ thuật quốc gia về đường bộ cao tốc QCVN 115:2024/BGTVT.\n\n3. Tốc độ thiết kế đường bộ được xác định theo Tiêu chuẩn quốc gia TCVN 4054: 2005 Đường ô tô - Yêu cầu thiết kế.\n\n4. Tốc độ thiết kế đường bộ trong phạm vi đô thị được xác định theo Quy chuẩn kỹ thuật quốc gia về hệ thống công trình hạ tầng kỹ thuật QCVN 07-4:2023/BXD.\n\n5. Tốc độ thiết kế đường giao thông nông thôn được xác định theo Tiêu chuẩn quốc gia TCVN 10380:2014 Đường giao thông nông thôn - Yêu cầu thiết kế.\n\n\n\nĐiều 6. Tốc độ khai thác tối đa cho phép xe cơ giới tham gia giao thông trên đường bộ (trừ đường cao tốc)\n\n1. Tốc độ khai thác tối đa cho phép xe cơ giới tham gia giao thông trên đường bộ trong khu vực đông dân cư\n\nBảng 1\n\nLoại xe cơ giới đường bộ Tốc độ khai thác tối đa (km/h) Tốc độ khai thác tối đa (km/h) Đường đôi; đường một chiều có từ hai làn xe cơ giới trở lên Đường hai chiều; đường một chiều có một làn xe cơ giới Các loại xe cơ giới, trừ các xe được quy định tại Điều 7 và Điều 8 Thông tư này 60 50\n\n2. Tốc độ khai thác tối đa cho phép xe cơ giới tham gia giao thông trên đường bộ ngoài khu vực đông dân cư\n\nBảng 2\n\nLoại xe cơ giới đường bộ Tốc độ khai thác tối đa (km/h) Tốc độ khai thác tối đa (km/h) Đường đôi; đường một chiều có từ hai làn xe cơ giới trở lên Đường hai chiều; đường một chiều có một làn xe cơ giới Xe ô tô chở người đến 28 chỗ không kể chỗ của người lái xe (trừ xe buýt); ô tô tải có trọng tải không lớn hơn 3,5 tấn 90 80 Xe ô tô chở người trên 28 chỗ không kể chỗ người lái xe (trừ xe buýt); ô tô tải có trọng tải trên 3,5 tấn (trừ ô tô xi téc) 80 70 Xe buýt; ô tô đầu kéo kéo sơ mi rơ moóc (trừ ô tô đầu kéo kéo sơ mi rơ moóc xi téc); xe mô tô; ô tô chuyên dùng (trừ ô tô trộn vữa, ô tô trộn bê tông lưu động) 70 60 Ô tô kéo rơ moóc; ô tô kéo xe khác; ô tô trộn vữa, ô tô trộn bê tông lưu động, ô tô xi téc, ô tô đầu kéo kéo sơ mi rơ moóc xi téc, ô tô kéo theo rơ moóc xi téc) 60 50\n\nĐiều 7. Tốc độ khai thác tối đa cho phép đối với xe máy chuyên dùng, xe gắn máy và các loại xe tương tự tham gia giao thông trên đường bộ (trừ đường cao tốc)\n\nXe máy chuyên dùng, xe gắn máy và các loại xe tương tự khi tham gia giao thông, tốc độ khai thác tối đa là 40 km/h.\n\nĐiều 8. Tốc độ khai thác tối đa cho phép đối với xe chở người bốn bánh có gắn động cơ, xe chở hàng bốn bánh có gắn động cơ tham gia giao thông trên đường bộ (trừ đường cao tốc)\n\n1. Xe chở người bốn bánh có gắn động cơ khi tham gia giao thông trong phạm vi và thời gian cho phép hoạt động, tốc độ khai thác tối đa là 30 km/h.\n\n2. Xe chở hàng bốn bánh có gắn động cơ khi tham gia giao thông trong phạm vi và thời gian cho phép hoạt động, tốc độ khai thác tối đa là 50 km/h.\n\nĐiều 9. Tốc độ khai thác tối đa, tốc độ khai thác tối thiểu cho phép đối với các loại xe cơ giới, xe máy chuyên dùng trên đường cao tốc\n\n1. Đường cao tốc phải được đặt biển báo tốc độ khai thác tối đa, tốc độ khai thác tối thiểu.\n\n2. Tốc độ khai thác tối đa cho phép trên đường cao tốc là 120 km/h.\n\n3. Tốc độ khai thác tối thiểu cho phép trên đường cao tốc là 60 km/h. Trường hợp đường cao tốc có tốc độ thiết kế 60 km/h thì tốc độ khai thác tối thiểu thực hiện theo phương án tổ chức giao thông được cấp có thẩm quyền phê duyệt.']","**Nguồn văn bản:** /content/drive/MyDrive/ITProject_data/new_law/38_2024_TT-BGTVT_622477.docx

**Tên văn bản:** THÔNG TƯ QUY ĐỊNH VỀ TỐC ĐỘ VÀ KHOẢNG CÁCH AN TOÀN CỦA XE CƠ GIỚI, XE MÁY CHUYÊN DÙNG THAM GIA GIAO THÔNG TRÊN ĐƯỜNG BỘ

**Nội dung:**

Thông tư này tập trung vào quy định về tốc độ và khoảng cách an toàn của xe cơ giới, xe máy chuyên dùng trên đường bộ, ngoại trừ xe ưu tiên đang làm nhiệm vụ.  Thông tư không đề cập cụ thể đến quy định về việc sử dụng xe đạp trên đường cao tốc.  Tuy nhiên, Điều 9 nêu rõ:

1. Đường cao tốc phải được đặt biển báo tốc độ khai thác tối đa, tốc độ khai thác tối thiểu.

2. Tốc độ khai thác tối đa cho phép trên đường cao tốc là 120 km/h.

3. Tốc độ khai thác tối thiểu cho phép trên đường cao tốc là 60 km/h.  Trường hợp đường cao tốc có tốc độ thiết kế 60 km/h thì tốc độ khai thác tối thiểu thực hiện theo phương án tổ chức giao thông được cấp có thẩm quyền phê duyệt.


Tóm lại: Văn bản không cung cấp thông tin về quy định sử dụng xe đạp trên đường cao tốc.  Văn bản chủ yếu tập trung vào quy định tốc độ và khoảng cách an toàn cho các loại xe cơ giới và xe máy chuyên dụng trên đường bộ, bao gồm cả đường cao tốc.
",Cấm xe đạp lưu thông trên đường cao tốc.,0.9,0.6758617311136813,0.0,0.0
25,Quy định mới về việc sử dụng xe máy trên đường cao tốc là gì?,"['BỘ GIAO THÔNG VẬN TẢI\n-------- CỘNG HÒA XÃ HỘI CHỦ NGHĨA VIỆT NAM\nĐộc lập - Tự do - Hạnh phúc \n--------------- Số: 38/2024/TT-BGTVT Hà Nội, Ngày 15 tháng 11 năm 2024\n\nTHÔNG TƯ\n\nQUY ĐỊNH VỀ TỐC ĐỘ VÀ KHOẢNG CÁCH AN TOÀN CỦA XE CƠ GIỚI, XE MÁY CHUYÊN DÙNG THAM GIA GIAO THÔNG TRÊN ĐƯỜNG BỘ\n\nCăn cứ Luật Trật tự, an toàn giao thông đường bộ ngày 27 tháng 6 năm 2024;\n\nCăn cứ Luật Đường bộ ngày 27 tháng 6 năm 2024;\n\nCăn cứ Nghị định số 56/2022/NĐ-CP ngày 24 tháng 8 năm 2022 của Chính phủ quy định chức năng, nhiệm vụ, quyền hạn và cơ cấu tổ chức của Bộ Giao thông vận tải;\n\nTheo đề nghị của Vụ trưởng Vụ Kết cấu hạ tầng giao thông và Cục trưởng Cục đường bộ Việt Nam;\n\nBộ trưởng Bộ Giao thông vận tải ban hành Thông tư quy định về tốc độ và khoảng cách an toàn của xe cơ giới, xe máy chuyên dùng tham gia giao thông trên đường bộ.\n\nChương I\n\nQUY ĐỊNH CHUNG\n\nĐiều 1. Phạm vi điều chỉnh\n\nThông tư này quy định về tốc độ thiết kế của đường bộ; tốc độ khai thác và khoảng cách an toàn của xe cơ giới, xe máy chuyên dùng khi tham gia giao thông trên đường bộ, trừ xe ưu tiên đang đi làm nhiệm vụ theo quy định của pháp luật.\n\nĐiều 2. Đối tượng áp dụng\n\nThông tư này áp dụng đối với người lái xe, người điều khiển xe máy chuyên dùng và tổ chức, cá nhân liên quan đến quản lý và thực hiện các quy định về tốc độ thiết kế, tốc độ khai thác của đường bộ và khoảng cách an toàn của xe cơ giới, xe máy chuyên dùng khi tham gia giao thông trên đường bộ.\n\nĐiều 3. Giải thích từ ngữ\n\nTrong Thông tư này, các từ ngữ dưới đây được hiểu như sau:\n\n1. Đường bộ trong khu đông dân cư là đoạn đường bộ nằm trong khu vực nội thành phố, nội thị xã, nội thị trấn và những đoạn đường có đông dân cư sinh sống sát dọc theo đường, được xác định bằng biển báo “Bắt đầu khu đông dân cư” và biển báo “Hết khu đông dân cư”.\n\n2. Đường đôi là đường có chiều đi và chiều về được phân biệt bằng dải phân cách giữa.\n\n3. Đường một chiều là đường chỉ cho đi một chiều.\n\n4. Đường hai chiều là đường dùng chung cho cả chiều đi và về trên cùng một phần đường xe chạy mà không có dải phân cách giữa.\n\n5. Trọng tải là khối lượng hàng hóa chuyên chở cho phép, được ghi trên Giấy chứng nhận an toàn kỹ thuật và bảo vệ môi trường của phương tiện giao thông cơ giới đường bộ, Giấy chứng \n\n\n\nnhận chất lượng an toàn kỹ thuật và bảo vệ môi trường xe cơ giới nhập khẩu hoặc Giấy chứng nhận chất lượng an toàn kỹ thuật và bảo vệ môi trường kiểu loại ô tô sản xuất, lắp ráp.\n\n6. Tốc độ khai thác tối đa là giá trị tốc độ lớn nhất cho phép phương tiện tham gia giao thông trên đường bộ bảo đảm an toàn giao thông và khai thác hiệu quả tuyến đường.\n\n7. Tốc độ khai thác tối thiểu là giá trị tốc độ nhỏ nhất cho phép phương tiện tham gia giao thông trên đường bộ bảo đảm an toàn giao thông và khai thác hiệu quả tuyến đường.\n\n8. Khoảng cách an toàn là cự ly tối thiểu giữa phương tiện phía sau với phương tiện đang di chuyển liền trước, cùng làn đường, bảo đảm tránh xảy ra va chạm trong trường hợp phương tiện phía trước đột ngột giảm tốc độ hoặc dừng lại.\n\n9. Tốc độ lưu hành là giá trị tốc độ của phương tiện tại thời điểm tham gia giao thông trên đường bộ.\n\nĐiều 4. Nguyên tắc chấp hành quy định về tốc độ khai thác và khoảng cách an toàn khi điều khiển phương tiện trên đường bộ\n\n1. Khi tham gia giao thông trên đường bộ, người lái xe, người điều khiển xe máy chuyên dùng phải chấp hành quy định về tốc độ khai thác và khoảng cách an toàn theo quy định tại Điều 12 Luật Trật tự, an toàn giao thông đường bộ.\n\n2. Tại những đoạn đường không bố trí biển báo tốc độ khai thác tối đa, không bố trí biển báo khoảng cách an toàn giữa hai xe, người điều khiển phương tiện tham gia giao thông phải thực hiện theo quy định tại Điều 6, Điều 7, Điều 8 và Điều 11 Thông tư này.\n\nChương II\n\nTỐC ĐỘ THIẾT KẾ CỦA ĐƯỜNG BỘ; TỐC ĐỘ KHAI THÁC CỦA ĐƯỜNG BỘ, KHOẢNG CÁCH AN TOÀN CỦA XE CƠ GIỚI, XE MÁY CHUYÊN DÙNG THAM GIA GIAO THÔNG TRÊN ĐƯỜNG BỘ\n\nĐiều 5. Tốc độ thiết kế của đường bộ\n\n1. Tốc độ thiết kế của đường bộ là giá trị vận tốc được dùng để tính toán các chỉ tiêu kỹ thuật của đường bộ. Tốc độ thiết kế của đường bộ được xác định trong giai đoạn đầu tư xây dựng, nâng cấp, cải tạo đường bộ nhằm bảo đảm cho phương tiện di chuyển an toàn; được quyết định theo cấp kỹ thuật của đường bộ và điều kiện địa hình.\n\n2. Tốc độ thiết kế đường bộ cao tốc là giá trị vận tốc được dùng để tính toán các chỉ tiêu kỹ thuật của đường bộ cao tốc, được xác định theo cấp đường cao tốc. Khi thiết kế đường bộ cao tốc có thể áp dụng tốc độ thiết kế khác nhau theo từng đoạn nhưng phải bảo đảm các yêu cầu về chiều dài đoạn chuyển tiếp và tốc độ thiết kế trung gian giữa các đoạn. Tốc độ thiết kế đường bộ cao tốc được xác định theo Quy chuẩn kỹ thuật quốc gia về đường bộ cao tốc QCVN 115:2024/BGTVT.\n\n3. Tốc độ thiết kế đường bộ được xác định theo Tiêu chuẩn quốc gia TCVN 4054: 2005 Đường ô tô - Yêu cầu thiết kế.\n\n4. Tốc độ thiết kế đường bộ trong phạm vi đô thị được xác định theo Quy chuẩn kỹ thuật quốc gia về hệ thống công trình hạ tầng kỹ thuật QCVN 07-4:2023/BXD.\n\n5. Tốc độ thiết kế đường giao thông nông thôn được xác định theo Tiêu chuẩn quốc gia TCVN 10380:2014 Đường giao thông nông thôn - Yêu cầu thiết kế.\n\n\n\nĐiều 6. Tốc độ khai thác tối đa cho phép xe cơ giới tham gia giao thông trên đường bộ (trừ đường cao tốc)\n\n1. Tốc độ khai thác tối đa cho phép xe cơ giới tham gia giao thông trên đường bộ trong khu vực đông dân cư\n\nBảng 1\n\nLoại xe cơ giới đường bộ Tốc độ khai thác tối đa (km/h) Tốc độ khai thác tối đa (km/h) Đường đôi; đường một chiều có từ hai làn xe cơ giới trở lên Đường hai chiều; đường một chiều có một làn xe cơ giới Các loại xe cơ giới, trừ các xe được quy định tại Điều 7 và Điều 8 Thông tư này 60 50\n\n2. Tốc độ khai thác tối đa cho phép xe cơ giới tham gia giao thông trên đường bộ ngoài khu vực đông dân cư\n\nBảng 2\n\nLoại xe cơ giới đường bộ Tốc độ khai thác tối đa (km/h) Tốc độ khai thác tối đa (km/h) Đường đôi; đường một chiều có từ hai làn xe cơ giới trở lên Đường hai chiều; đường một chiều có một làn xe cơ giới Xe ô tô chở người đến 28 chỗ không kể chỗ của người lái xe (trừ xe buýt); ô tô tải có trọng tải không lớn hơn 3,5 tấn 90 80 Xe ô tô chở người trên 28 chỗ không kể chỗ người lái xe (trừ xe buýt); ô tô tải có trọng tải trên 3,5 tấn (trừ ô tô xi téc) 80 70 Xe buýt; ô tô đầu kéo kéo sơ mi rơ moóc (trừ ô tô đầu kéo kéo sơ mi rơ moóc xi téc); xe mô tô; ô tô chuyên dùng (trừ ô tô trộn vữa, ô tô trộn bê tông lưu động) 70 60 Ô tô kéo rơ moóc; ô tô kéo xe khác; ô tô trộn vữa, ô tô trộn bê tông lưu động, ô tô xi téc, ô tô đầu kéo kéo sơ mi rơ moóc xi téc, ô tô kéo theo rơ moóc xi téc) 60 50\n\nĐiều 7. Tốc độ khai thác tối đa cho phép đối với xe máy chuyên dùng, xe gắn máy và các loại xe tương tự tham gia giao thông trên đường bộ (trừ đường cao tốc)\n\nXe máy chuyên dùng, xe gắn máy và các loại xe tương tự khi tham gia giao thông, tốc độ khai thác tối đa là 40 km/h.\n\nĐiều 8. Tốc độ khai thác tối đa cho phép đối với xe chở người bốn bánh có gắn động cơ, xe chở hàng bốn bánh có gắn động cơ tham gia giao thông trên đường bộ (trừ đường cao tốc)\n\n1. Xe chở người bốn bánh có gắn động cơ khi tham gia giao thông trong phạm vi và thời gian cho phép hoạt động, tốc độ khai thác tối đa là 30 km/h.\n\n2. Xe chở hàng bốn bánh có gắn động cơ khi tham gia giao thông trong phạm vi và thời gian cho phép hoạt động, tốc độ khai thác tối đa là 50 km/h.\n\nĐiều 9. Tốc độ khai thác tối đa, tốc độ khai thác tối thiểu cho phép đối với các loại xe cơ giới, xe máy chuyên dùng trên đường cao tốc\n\n1. Đường cao tốc phải được đặt biển báo tốc độ khai thác tối đa, tốc độ khai thác tối thiểu.\n\n2. Tốc độ khai thác tối đa cho phép trên đường cao tốc là 120 km/h.\n\n3. Tốc độ khai thác tối thiểu cho phép trên đường cao tốc là 60 km/h. Trường hợp đường cao tốc có tốc độ thiết kế 60 km/h thì tốc độ khai thác tối thiểu thực hiện theo phương án tổ chức giao thông được cấp có thẩm quyền phê duyệt.']","**Nguồn văn bản:** /content/drive/MyDrive/ITProject_data/new_law/38_2024_TT-BGTVT_622477.docx

**Tên văn bản:** THÔNG TƯ QUY ĐỊNH VỀ TỐC ĐỘ VÀ KHOẢNG CÁCH AN TOÀN CỦA XE CƠ GIỚI, XE MÁY CHUYÊN DÙNG THAM GIA GIAO THÔNG TRÊN ĐƯỜNG BỘ

**Nội dung:**

Thông tư này không trực tiếp đề cập đến việc cấm hay cho phép xe máy lưu thông trên đường cao tốc. Tuy nhiên, Điều 9 của Thông tư nêu rõ:

1. Đường cao tốc phải được đặt biển báo tốc độ khai thác tối đa, tốc độ khai thác tối thiểu.

2. Tốc độ khai thác tối đa cho phép trên đường cao tốc là 120 km/h.

3. Tốc độ khai thác tối thiểu cho phép trên đường cao tốc là 60 km/h. Trường hợp đường cao tốc có tốc độ thiết kế 60 km/h thì tốc độ khai thác tối thiểu thực hiện theo phương án tổ chức giao thông được cấp có thẩm quyền phê duyệt.

Điều 7 quy định tốc độ khai thác tối đa cho phép đối với xe máy chuyên dùng, xe gắn máy và các loại xe tương tự tham gia giao thông trên đường bộ (trừ đường cao tốc) là 40 km/h.  Việc không đề cập đến xe máy trên đường cao tốc trong điều này ngầm hiểu là xe máy không được phép lưu thông trên đường cao tốc.  Tuy nhiên, cần tham khảo thêm các văn bản pháp luật khác để có câu trả lời chính xác nhất.


Tóm lại: Thông tư không nêu rõ quy định về xe máy trên đường cao tốc, nhưng dựa trên quy định về tốc độ tối đa của các loại xe khác và việc không đề cập đến xe máy trong điều khoản về đường cao tốc, có thể hiểu ngầm là xe máy không được phép lưu thông trên đường cao tốc.  Cần tìm hiểu thêm các văn bản pháp luật khác để có thông tin chính xác hơn.
",Cấm xe máy lưu thông trên đường cao tốc.,0.7857142857142857,0.0,0.0,0.0
26,Luật Giao thông Đường bộ 2025 có quy định gì về việc sử dụng xe ô tô tải trong giờ cao điểm?,"['7. Phạt tiền từ 5.000.000 đồng đến 6.000.000 đồng đối với cá nhân, từ 10.000.000 đồng đến 12.000.000 đồng đối với tổ chức kinh doanh vận tải, dịch vụ hỗ trợ vận tải thực hiện một trong các hành vi vi phạm sau đây:\n\na) Không thực hiện việc cung cấp, cập nhật, truyền, lưu trữ, quản lý thông tin, dữ liệu từ thiết bị giám sát hành trình theo quy định;\n\nb) Không thực hiện đúng nội dung thông tin đã niêm yết trên xe theo quy định;\n\nc) Sử dụng phương tiện kinh doanh vận tải không lắp thiết bị giám sát hành trình của xe (đối với hình thức kinh doanh vận tải có quy định phương tiện phải lắp thiết bị) hoặc lắp thiết bị nhưng thiết bị không hoạt động, không đúng quy chuẩn theo quy định hoặc làm sai lệch dữ liệu của thiết bị giám sát hành trình của xe ô tô;\n\nd) Sử dụng xe trung chuyển chở hành khách không đúng quy định;\n\nđ) Sử dụng lái xe điều khiển xe khách giường nằm hai tầng, xe ô tô đưa đón trẻ em mầm non, học sinh chưa đủ số năm kinh nghiệm theo quy định;\n\ne) Sử dụng xe kinh doanh vận tải hành khách theo hợp đồng mà trên xe không có hợp đồng vận tải, danh sách hành khách kèm theo, thiết bị để truy cập nội dung hợp đồng điện tử và danh sách hành khách theo quy định hoặc có hợp đồng vận tải, danh sách hành khách, thiết bị để truy cập nhưng không bảo đảm yêu cầu theo quy định, chở người không có tên trong danh sách hành khách hoặc vận chuyển không đúng đối tượng theo quy định (đối với xe kinh doanh vận tải hành khách theo hợp đồng vận chuyển trẻ em mầm non, học sinh, sinh viên, cán bộ, công chức, viên chức, công nhân);\n\ng) Sử dụng xe ô tô kinh doanh vận tải không lắp thiết bị ghi nhận hình ảnh người lái xe theo quy định (đối với loại xe có quy định phải lắp thiết bị ghi nhận hình ảnh người lái xe) hoặc có lắp thiết bị ghi nhận hình ảnh người lái xe nhưng không ghi, không lưu trữ được dữ liệu trên xe trong quá trình xe tham gia giao thông theo quy định hoặc làm sai lệch dữ liệu của thiết bị ghi nhận hình ảnh người lái xe lắp trên xe ô tô;\n\nh) Không thực hiện việc cung cấp, cập nhật, truyền dẫn, lưu trữ, quản lý thông tin, dữ liệu thu thập từ thiết bị ghi nhận hình ảnh người lái xe lắp trên xe ô tô theo quy định;\n\ni) Sử dụng phương tiện kinh doanh vận tải có niên hạn sử dụng không bảo đảm điều kiện của hình thức kinh doanh đã đăng ký.\n\n8. Phạt tiền từ 10.000.000 đồng đến 12.000.000 đồng đối với cá nhân, từ 20.000.000 đồng đến 24.000.000 đồng đối với tổ chức kinh doanh vận tải, dịch vụ hỗ trợ vận tải thực hiện một trong các hành vi vi phạm sau đây:\n\na) Không tổ chức khám sức khỏe định kỳ cho lái xe theo quy định hoặc có tổ chức khám nhưng không đầy đủ các nội dung theo quy định;\n\nb) Vi phạm quy định về kinh doanh, điều kiện kinh doanh vận tải bằng xe ô tô để xảy ra tai nạn giao thông gây hậu quả từ mức nghiêm trọng trở lên;\n\nc) Sử dụng xe ô tô kinh doanh vận tải để đón, trả khách; nhận, trả hàng trên đường cao tốc.\n\n9. Phạt tiền từ 20.000.000 đồng đến 40.000.000 đồng đối với đơn vị sản xuất, lắp ráp, nhập khẩu thiết bị giám sát hành trình của xe ô tô, đơn vị cung cấp dịch vụ liên quan đến giám sát hành trình, ghi nhận hình ảnh người lái xe thực hiện một trong các hành vi sau:\n\na) Đơn vị sản xuất, lắp ráp, nhập khẩu thiết bị giám sát hành trình của xe ô tô không có nhân sự cho từng vị trí công việc theo quy định;\n\nb) Đơn vị sản xuất, lắp ráp, nhập khẩu thiết bị giám sát hành trình của xe ô tô không báo cáo về việc cập nhật, thay đổi phần mềm của thiết bị theo quy định.\n\n10. Phạt tiền từ 40.000.000 đồng đến 60.000.000 đồng đối với đơn vị sản xuất, lắp ráp, nhập khẩu thiết bị ghi nhận hình ảnh người lái xe lắp trên xe ô tô, đơn vị cung cấp dịch vụ liên quan đến giám sát hành trình, ghi nhận hình ảnh người lái xe thực hiện một trong các hành vi vi phạm sau đây:\n\na) Làm sai lệch thông tin, dữ liệu của thiết bị giám sát hành trình của xe ô tô;\n\nb) Làm sai lệch thông tin, dữ liệu của thiết bị ghi nhận hình ảnh người lái xe lắp trên xe ô tô.\n\n11. Phạt tiền từ 40.000.000 đồng đến 50.000.000 đồng đối với cá nhân, từ 80.000.000 đồng đến 100.000.000 đồng đối với tổ chức kinh doanh vận tải, dịch vụ hỗ trợ vận tải tái phạm hành vi quy định tại điểm a, điểm h khoản 7 Điều này.\n\n12. Ngoài việc bị phạt tiền, cá nhân, tổ chức thực hiện hành vi vi phạm quy định tại điểm c khoản 2; điểm a, điểm b, điểm đ, điểm g khoản 4; điểm b, điểm c, điểm d, điểm đ, điểm e, điểm g khoản 7; điểm c khoản 8 Điều này còn bị áp dụng các hình thức xử phạt bổ sung tước quyền sử dụng phù hiệu từ 01 tháng đến 03 tháng (nếu có hoặc đã được cấp) đối với xe vi phạm.\n\n13. Ngoài việc bị áp dụng hình thức xử phạt, cá nhân, tổ chức thực hiện hành vi vi phạm còn bị áp dụng các biện pháp khắc phục hậu quả sau đây:\n\na) Thực hiện hành vi quy định tại điểm a khoản 4 Điều này buộc cấp thẻ nhận dạng lái xe cho lái xe theo quy định;\n\nb) Thực hiện hành vi quy định tại điểm b, điểm c, điểm d khoản 4; điểm a khoản 8 Điều này buộc tổ chức tập huấn, hướng dẫn nghiệp vụ, quy trình hoặc tổ chức khám sức khỏe định kỳ cho lái xe và nhân viên phục vụ trên xe theo quy định;\n\nc) Thực hiện hành vi quy định tại điểm đ, điểm e khoản 4; điểm c, điểm g khoản 7 Điều này buộc lắp đặt thiết bị giám sát hành trình, thiết bị ghi nhận hình ảnh người lái xe, dây đai an toàn, ghế ngồi cho trẻ em mầm non, học sinh tiểu học trên xe theo đúng quy định;\n\nd) Thực hiện hành vi quy định tại điểm a, điểm h khoản 7; khoản 11 Điều này buộc cung cấp, cập nhật, truyền dẫn, lưu trữ, quản lý thông tin, dữ liệu thu thập từ thiết bị giám sát hành trình, thiết bị ghi nhận hình ảnh người lái xe lắp trên xe ô tô theo quy định;\n\nđ) Thực hiện hành vi quy định tại điểm c, điểm d khoản 6 Điều này buộc thực hiện đúng quy định về màu sơn, biển báo dấu hiệu nhận biết của xe.\n\n14. Ngoài việc bị áp dụng hình thức xử phạt, người điều khiển phương tiện thực hiện hành vi vi phạm còn bị trừ điểm giấy phép lái xe như sau:\n\na) Thực hiện hành vi quy định tại điểm đ khoản 2; điểm b, điểm c, điểm d khoản 6; điểm b, điểm c, điểm e, điểm i khoản 7 Điều này trong trường hợp cá nhân kinh doanh vận tải là người trực tiếp điều khiển phương tiện còn bị trừ điểm giấy phép lái xe 02 điểm;\n\nb) Thực hiện hành vi quy định tại điểm c khoản 8 Điều này trong trường hợp cá nhân kinh doanh vận tải là người trực tiếp điều khiển phương tiện còn bị trừ điểm giấy phép lái xe 06 điểm.\n\nĐiều 27. Xử phạt, trừ điểm giấy phép lái xe của người điều khiển xe ô tô kinh doanh vận tải chở trẻ em mầm non, học sinh, xe ô tô kinh doanh vận tải kết hợp với hoạt động đưa đón trẻ em mầm non, học sinh\n\n1. Phạt tiền từ 1.000.000 đồng đến 2.000.000 đồng đối với người điều khiển xe ô tô kinh doanh vận tải chở trẻ em mầm non, học sinh, xe ô tô kinh doanh vận tải kết hợp với hoạt động đưa đón trẻ em mầm non, học sinh thực hiện một trong các hành vi vi phạm sau đây:\n\na) Không hướng dẫn trẻ em mầm non, học sinh ngồi đúng vị trí quy định trong xe;\n\nb) Điều khiển xe ô tô kinh doanh vận tải chở trẻ em mầm non, học sinh tiểu học, xe ô tô kinh doanh vận tải kết hợp với hoạt động đưa đón trẻ em mầm non, học sinh tiểu học không có dây đai an toàn phù hợp với lứa tuổi hoặc không có ghế ngồi phù hợp với lứa tuổi theo quy định;\n\nc) Điều khiển xe không lắp thiết bị ghi nhận hình ảnh người lái xe hoặc có lắp thiết bị ghi nhận hình ảnh người lái xe nhưng không có tác dụng trong quá trình xe tham gia giao thông theo quy định hoặc làm sai lệch dữ liệu của thiết bị ghi nhận hình ảnh người lái xe lắp trên xe ô tô.\n\n2. Phạt tiền từ 2.000.000 đồng đến 3.000.000 đồng đối với hành vi điều khiển xe ô tô kinh doanh vận tải chở trẻ em mầm non, học sinh tiểu học, xe ô tô kinh doanh vận tải kết hợp với hoạt động đưa đón trẻ em mầm non, học sinh tiểu học không có hoặc không đủ người quản lý trên mỗi xe ô tô theo quy định tại khoản 3 Điều 46 của Luật Trật tự, an toàn giao thông đường bộ.\n\n3. Phạt tiền từ 3.000.000 đồng đến 5.000.000 đồng đối với người điều khiển xe ô tô kinh doanh vận tải chở trẻ em mầm non, học sinh, xe ô tô kinh doanh vận tải kết hợp với hoạt động đưa đón trẻ em mầm non, học sinh thực hiện một trong các hành vi vi phạm sau đây:']","**Nguồn văn bản:** /content/drive/MyDrive/ITProject_data/new_law/168_2024_ND-CP_619502.docx

**Tên văn bản:**  (Tên văn bản không được cung cấp trong context)

**Điều:** (Điều không được cung cấp trong context)


**Nội dung:**

Tôi xin lỗi, nhưng văn bản được cung cấp không chứa thông tin cụ thể về quy định sử dụng xe ô tô tải trong giờ cao điểm. Văn bản tập trung vào các quy định về phạt tiền và xử phạt đối với các vi phạm liên quan đến kinh doanh vận tải, sử dụng thiết bị giám sát hành trình và ghi hình người lái xe,  chứ không đề cập đến việc hạn chế hoặc cấm xe tải trong giờ cao điểm.


Tóm lại: Không tìm thấy thông tin liên quan đến quy định về việc sử dụng xe ô tô tải trong giờ cao điểm trong văn bản được cung cấp.
","Cấm xe ô tô tải có trọng tải trên 2,5 tấn lưu thông trong khu vực đô thị trong giờ cao điểm.",1.0,0.0,0.0,0.0
27,Quy định mới về việc sử dụng xe ô tô chở hàng nguy hiểm là gì?,"['5. Phạt tiền từ 12.000.000 đồng đến 14.000.000 đồng đối với hành vi vận chuyển hàng hóa nguy hiểm không có giấy phép vận chuyển hàng hóa nguy hiểm hoặc có nhưng hết hiệu lực hoặc không thực hiện đúng quy định trong giấy phép vận chuyển hàng hóa nguy hiểm, trừ các hành vi vi phạm quy định tại điểm a khoản 6 Điều 20 của Nghị định này.\n\n6. Ngoài việc bị áp dụng hình thức xử phạt, người thực hiện hành vi vi phạm quy định tại khoản 4, khoản 5 Điều này nếu gây ô nhiễm môi trường còn bị áp dụng các biện pháp khắc phục hậu quả buộc thực hiện các biện pháp khắc phục tình trạng ô nhiễm môi trường do vi phạm hành chính gây ra.\n\n7. Ngoài việc bị áp dụng hình thức xử phạt, người điều khiển phương tiện thực hiện hành vi vi phạm còn bị trừ điểm giấy phép lái xe như sau:\n\na) Thực hiện hành vi quy định tại khoản 3, khoản 4 Điều này bị trừ điểm giấy phép lái xe 02 điểm;\n\nb) Thực hiện hành vi quy định tại khoản 5 Điều này bị trừ điểm giấy phép lái xe 04 điểm.\n\nĐiều 24. Xử phạt, trừ điểm giấy phép lái xe của người điều khiển xe ô tô thực hiện hành vi vi phạm quy định về vận chuyển động vật sống, thực phẩm tươi sống\n\n1. Phạt tiền từ 1.000.000 đồng đến 2.000.000 đồng đối với hành vi vi phạm vận chuyển động vật sống, thực phẩm tươi sống không mang đủ giấy tờ theo quy định (đối với loại động vật sống, thực phẩm tươi sống khi vận chuyển phải có giấy tờ).\n\n2. Phạt tiền từ 3.000.000 đồng đến 5.000.000 đồng đối với hành vi vi phạm vận chuyển thực phẩm tươi sống không chấp hành quy định về an toàn thực phẩm, vệ sinh dịch tễ, phòng dịch và bảo đảm vệ sinh môi trường theo quy định.\n\n3. Ngoài việc bị áp dụng hình thức xử phạt, người điều khiển phương tiện thực hiện hành vi vi phạm quy định tại khoản 2 Điều này còn bị trừ điểm giấy phép lái xe 02 điểm.\n\nĐiều 25. Xử phạt, trừ điểm giấy phép lái xe của người điều khiển xe vệ sinh môi trường, xe ô tô chở phế thải thực hiện hành vi vi phạm quy định về hoạt động vận tải trong đô thị\n\n1. Phạt tiền từ 2.000.000 đồng đến 3.000.000 đồng đối với hành vi điều khiển xe không chạy đúng tuyến, phạm vi, thời gian quy định.\n\n2. Ngoài việc bị áp dụng hình thức xử phạt, người điều khiển phương tiện thực hiện hành vi vi phạm quy định tại khoản 1 Điều này còn bị trừ điểm giấy phép lái xe 02 điểm.\n\nĐiều 26. Xử phạt các hành vi vi phạm quy định về trật tự, an toàn giao thông đường bộ trong vận tải đường bộ, dịch vụ hỗ trợ vận tải đường bộ\n\n1. Phạt tiền từ 500.000 đồng đến 1.000.000 đồng đối với cá nhân, từ 1.000.000 đồng đến 2.000.000 đồng đối với tổ chức thực hiện một trong các hành vi vi phạm sau đây:\n\na) Xếp hàng hóa lên mỗi xe ô tô (kể cả rơ moóc và sơ mi rơ moóc) vượt quá trọng tải (khối lượng hàng chuyên chở) cho phép tham gia giao thông được ghi trong giấy chứng nhận kiểm định an toàn kỹ thuật và bảo vệ môi trường của xe trên 10% đến 50% (trừ xe xi téc chở chất lỏng), trên 20% đến 50% đối với xe xi téc chở chất lỏng;\n\nb) Xếp hàng hóa lên xe ô tô mà không ký xác nhận việc xếp hàng hóa vào giấy vận tải theo quy định.\n\n2. Phạt tiền từ 1.000.000 đồng đến 2.000.000 đồng đối với cá nhân, từ 2.000.000 đồng đến 4.000.000 đồng đối với tổ chức kinh doanh vận tải, dịch vụ hỗ trợ vận tải thực hiện một trong các hành vi vi phạm sau đây:\n\na) Không đánh số thứ tự ghế ngồi, giường nằm trên xe ô tô chở hành khách theo quy định;\n\nb) Sử dụng xe ô tô kinh doanh vận tải hành khách theo tuyến cố định, xe ô tô kinh doanh vận tải hành khách bằng xe buýt không có chỗ ưu tiên cho người khuyết tật, người cao tuổi và phụ nữ mang thai theo quy định;\n\nc) Sử dụng xe ô tô kinh doanh vận tải hành khách không có hướng dẫn cho hành khách về an toàn giao thông, thoát hiểm khi xảy ra sự cố trên xe theo quy định;\n\nd) Không bố trí người áp tải trên xe vận chuyển hàng hóa nguy hiểm đối với những trường hợp quy định phải có người áp tải;\n\nđ) Không cấp lệnh vận chuyển, giấy vận tải cho lái xe hoặc cấp lệnh vận chuyển, giấy vận tải nhưng không đúng theo quy định (đối với loại xe quy định phải cấp lệnh vận chuyển, giấy vận tải);\n\ne) Sử dụng xe vận chuyển hàng hóa nguy hiểm mà không làm sạch hoặc không bóc (xóa) biểu trưng nguy hiểm trên phương tiện khi không tiếp tục vận chuyển loại hàng hóa đó.\n\n3. Phạt tiền từ 2.000.000 đồng đến 3.000.000 đồng đối với cá nhân, từ 4.000.000 đồng đến 6.000.000 đồng đối với tổ chức thực hiện hành vi vi phạm xếp hàng hóa lên mỗi xe ô tô (kể cả rơ moóc và sơ mi rơ moóc) vượt quá trọng tải (khối lượng hàng chuyên chở) cho phép tham gia giao thông được ghi trong giấy chứng nhận kiểm định an toàn kỹ thuật và bảo vệ môi trường của xe trên 50% đến 100%.\n\n4. Phạt tiền từ 3.000.000 đồng đến 4.000.000 đồng đối với cá nhân, từ 6.000.000 đồng đến 8.000.000 đồng đối với tổ chức kinh doanh vận tải, dịch vụ hỗ trợ vận tải thực hiện một trong các hành vi vi phạm sau đây:\n\na) Không cấp thẻ nhận dạng lái xe cho lái xe theo quy định;\n\nb) Sử dụng lái xe, nhân viên phục vụ trên xe để tham gia kinh doanh vận tải bằng xe ô tô mà không được tập huấn, hướng dẫn về nghiệp vụ vận tải hành khách và an toàn giao thông theo quy định (đối với hình thức kinh doanh vận tải có quy định lái xe, nhân viên phục vụ trên xe phải được tập huấn, hướng dẫn nghiệp vụ), trừ các hành vi vi phạm quy định tại điểm c, điểm d khoản này;\n\nc) Sử dụng lái xe, người quản lý trên xe để tham gia kinh doanh vận tải bằng xe ô tô mà không được hướng dẫn về quy trình bảo đảm an toàn khi đưa đón trẻ em mầm non, học sinh;\n\nd) Sử dụng lái xe, người áp tải vận chuyển hàng hóa nguy hiểm mà không được tập huấn về vận chuyển hàng hóa nguy hiểm;\n\nđ) Sử dụng xe ô tô kinh doanh vận tải hành khách không có dây đai an toàn tại các vị trí ghế ngồi, giường nằm theo quy định (trừ xe buýt nội tỉnh);\n\ne) Sử dụng xe ô tô kinh doanh vận tải chở trẻ em mầm non, học sinh tiểu học, xe ô tô kinh doanh vận tải kết hợp với hoạt động đưa đón trẻ em mầm non, học sinh tiểu học không có dây đai an toàn phù hợp với lứa tuổi hoặc không có ghế ngồi phù hợp với lứa tuổi theo quy định;\n\ng) Không thực hiện việc niêm yết thông tin trên xe theo quy định hoặc có niêm yết nhưng không chính xác, không đầy đủ thông tin theo quy định.\n\n5. Phạt tiền từ 4.000.000 đồng đến 5.000.000 đồng đối với cá nhân, từ 8.000.000 đồng đến 10.000.000 đồng đối với tổ chức xếp hàng hóa lên mỗi xe ô tô (kể cả rơ moóc và sơ mi rơ moóc) vượt quá trọng tải (khối lượng hàng chuyên chở) cho phép tham gia giao thông được ghi trong giấy chứng nhận kiểm định an toàn kỹ thuật và bảo vệ môi trường của xe trên 100%.\n\n6. Phạt tiền từ 4.000.000 đồng đến 6.000.000 đồng đối với cá nhân, từ 8.000.000 đồng đến 12.000.000 đồng đối với tổ chức kinh doanh vận tải thực hiện một trong các hành vi vi phạm sau đây:\n\na) Sử dụng xe vận chuyển động vật sống không có kết cấu phù hợp với loại động vật chuyên chở theo quy định;\n\nb) Sử dụng xe ô tô kinh doanh vận tải chở trẻ em mầm non, học sinh, xe ô tô kinh doanh vận tải kết hợp với hoạt động đưa đón trẻ em mầm non, học sinh không có thiết bị ghi nhận hình ảnh trẻ em mầm non, học sinh hoặc không có thiết bị có chức năng cảnh báo, chống bỏ quên trẻ em trên xe hoặc không có thiết bị ghi nhận hình ảnh trẻ em mầm non, học sinh và thiết bị có chức năng cảnh báo, chống bỏ quên trẻ em trên xe;\n\nc) Sử dụng xe ô tô kinh doanh vận tải chở trẻ em mầm non, học sinh không có màu sơn theo quy định;\n\nd) Sử dụng xe ô tô kinh doanh vận tải chở trẻ em mầm non, học sinh, xe ô tô kinh doanh vận tải kết hợp với hoạt động đưa đón trẻ em mầm non, học sinh không có biển báo dấu hiệu nhận biết là xe chở trẻ em mầm non, học sinh theo quy định.\n\n7. Phạt tiền từ 5.000.000 đồng đến 6.000.000 đồng đối với cá nhân, từ 10.000.000 đồng đến 12.000.000 đồng đối với tổ chức kinh doanh vận tải, dịch vụ hỗ trợ vận tải thực hiện một trong các hành vi vi phạm sau đây:\n\na) Không thực hiện việc cung cấp, cập nhật, truyền, lưu trữ, quản lý thông tin, dữ liệu từ thiết bị giám sát hành trình theo quy định;\n\nb) Không thực hiện đúng nội dung thông tin đã niêm yết trên xe theo quy định;']","**Nguồn văn bản:** /content/drive/MyDrive/ITProject_data/new_law/168_2024_ND-CP_619502.docx

**Tên văn bản:**  (Tên văn bản không được cung cấp trong context)

**Điều:** (Điều không được cung cấp trong context)


**Nội dung:**

Dựa trên văn bản được cung cấp, quy định về việc sử dụng xe ô tô chở hàng nguy hiểm được đề cập gián tiếp qua các khoản phạt liên quan đến việc vi phạm quy định vận chuyển hàng hóa nguy hiểm.  Cụ thể:

Điều 20 (không được trích dẫn đầy đủ trong context) đề cập đến việc vận chuyển hàng hóa nguy hiểm không có giấy phép hoặc vi phạm quy định trong giấy phép.  Việc vi phạm này bị phạt tiền từ 12.000.000 đồng đến 14.000.000 đồng.  Ngoài ra, nếu gây ô nhiễm môi trường, người vi phạm còn phải thực hiện các biện pháp khắc phục hậu quả.  Hành vi này cũng bị trừ 4 điểm giấy phép lái xe.

Điều 26, khoản 2, điểm d) quy định phạt tiền đối với tổ chức kinh doanh vận tải, dịch vụ hỗ trợ vận tải nếu không bố trí người áp tải trên xe vận chuyển hàng hóa nguy hiểm trong những trường hợp quy định phải có người áp tải. Mức phạt từ 1.000.000 đồng đến 2.000.000 đồng.

Điều 26, khoản 2, điểm e) quy định phạt tiền đối với tổ chức kinh doanh vận tải, dịch vụ hỗ trợ vận tải nếu sử dụng xe vận chuyển hàng hóa nguy hiểm mà không làm sạch hoặc không bóc (xóa) biểu trưng nguy hiểm trên phương tiện khi không tiếp tục vận chuyển loại hàng hóa đó. Mức phạt từ 1.000.000 đồng đến 2.000.000 đồng.

Điều 26, khoản 4, điểm d) quy định phạt tiền đối với tổ chức kinh doanh vận tải, dịch vụ hỗ trợ vận tải nếu sử dụng lái xe, người áp tải vận chuyển hàng hóa nguy hiểm mà không được tập huấn về vận chuyển hàng hóa nguy hiểm. Mức phạt từ 3.000.000 đồng đến 4.000.000 đồng.


Tóm lại:  Văn bản đề cập đến các hình phạt đối với việc vi phạm quy định vận chuyển hàng hóa nguy hiểm, bao gồm phạt tiền và trừ điểm bằng lái, tùy thuộc vào mức độ vi phạm.  Cụ thể là việc thiếu giấy phép, không tuân thủ quy định trong giấy phép, không có người áp tải, và không làm sạch/xóa biểu trưng nguy hiểm.  Để hiểu rõ hơn về quy định chi tiết, cần tham khảo toàn văn Nghị định 168/2024/NĐ-CP.
",Xe ô tô chở hàng nguy hiểm phải có giấy phép và chỉ được lưu thông trên các tuyến đường quy định.,0.6428571428571429,0.70223254308547,0.0,0.0
28,Luật Giao thông Đường bộ 2025 có quy định gì về việc nghỉ ngơi của tài xế xe tải?,"['BỘ GIAO THÔNG VẬN TẢI\n------- CỘNG HÒA XÃ HỘI CHỦ NGHĨA VIỆT NAM\nĐộc lập - Tự do - Hạnh phúc \n--------------- Số: 36/2024/TT-BGTVT Hà Nội, ngày 15 tháng 11 năm 2024\n\nTHÔNG TƯ\n\nQUY ĐỊNH VỀ TỔ CHỨC, QUẢN LÝ HOẠT ĐỘNG VẬN TẢI BẰNG XE Ô TÔ VÀ HOẠT ĐỘNG CỦA BẾN XE, BÃI ĐỖ XE, TRẠM DỪNG NGHỈ, ĐIỂM DỪNG XE TRÊN ĐƯỜNG BỘ; QUY ĐỊNH TRÌNH TỰ, THỦ TỤC ĐƯA BẾN XE, TRẠM DỪNG NGHỈ VÀO KHAI THÁC\n\nCăn cứ Luật Đường bộ ngày 27 tháng 06 năm 2024; \n\nCăn cứ Luật Trật tự, an toàn giao thông đường bộ ngày 27 tháng 06 năm 2024;\n\nCăn cứ Luật Ban hành văn bản quy phạm pháp luật ngày 22 tháng 6 năm 2015; Luật sửa đổi, bổ sung một số điều của Luật Ban hành văn bản quy phạm pháp luật ngày 18 tháng 6 năm 2020;\n\nCăn cứ Nghị định số 56/2022/NĐ-CP ngày 24 tháng 8 năm 2022 của Chính phủ quy định chức năng, nhiệm vụ, quyền hạn và cơ cấu tổ chức của Bộ Giao thông vận tải;\n\nTheo đề nghị của Vụ trưởng Vụ Vận tải và Cục trưởng Cục Đường bộ Việt Nam;\n\nBộ trưởng Bộ Giao thông vận tải ban hành Thông tư quy định về tổ chức, quản lý hoạt động vận tải bằng xe ô tô và hoạt động của bến xe, bãi đỗ xe, trạm dừng nghỉ, điểm dừng xe trên đường bộ; quy định trình tự, thủ tục đưa bến xe, trạm dừng nghỉ vào khai thác.\n\nChương I\n\nQUY ĐỊNH CHUNG\n\nĐiều 1. Phạm vi điều chỉnh\n\nThông tư này quy định về tổ chức, quản lý hoạt động vận tải hành khách, hàng hóa bằng xe ô tô và hoạt động của bến xe, bãi đỗ xe, trạm dừng nghỉ, điểm dừng xe; trình tự, thủ tục đưa bến xe, trạm dừng nghỉ vào khai thác.\n\nĐiều 2. Đối tượng áp dụng\n\nThông tư này áp dụng đối với cơ quan, tổ chức, cá nhân có liên quan đến hoạt động vận tải hành khách, hàng hóa bằng xe ô tô, bến xe, bãi đỗ xe, trạm dừng nghỉ, điểm dừng xe.\n\nĐiều 3. Giải thích từ ngữ\n\nTrong Thông tư này, các từ ngữ dưới đây được hiểu như sau:\n\n1. Điểm dừng đón, trả khách (bao gồm cả điểm dừng xe buýt) là nơi dừng xe trên đường bộ dành cho xe ô tô hoạt động theo tuyến cố định, xe buýt dừng để hành khách lên, xuống xe trên hành trình chạy xe.\n\n2. Giao nhiệm vụ cho lái xe điều khiển phương tiện để thực hiện vận chuyển thông qua phần mềm hỗ trợ kết nối vận tải bằng xe ô tô là việc tổ chức hoặc cá nhân sử dụng phần mềm hỗ trợ kết nối vận tải để chuyển thông tin về yêu cầu vận chuyển cho người lái xe điều khiển phương tiện thực hiện nhiệm vụ vận chuyển.\n\n3. Quyết định giá cước vận tải là việc đơn vị kinh doanh vận tải xác định giá cước vận tải để thông tin cho khách hàng hoặc trực tiếp thoả thuận với khách hàng để thống nhất mức giá trước khi thực hiện vận chuyển.\n\nChương II\n\nKINH DOANH VẬN TẢI HÀNH KHÁCH BẰNG XE Ô TÔ\n\nMục 1. YÊU CẦU CHUNG\n\nĐiều 4. Quy định đối với đơn vị kinh doanh vận tải hành khách\n\n1. Tuân thủ và duy trì các điều kiện kinh doanh đối với đơn vị kinh doanh vận tải hành khách trong quá trình hoạt động kinh doanh vận tải hành khách.\n\n2. Quản lý và sử dụng xe ô tô kinh doanh vận tải hành khách\n\na) Xây dựng và thực hiện kế hoạch về bảo dưỡng kỹ thuật và sửa chữa phương tiện để đảm bảo các phương tiện phải được bảo dưỡng, sửa chữa theo quy định về bảo dưỡng kỹ thuật, sửa chữa phương tiện giao thông xe cơ giới đường bộ;\n\nb) Lập, cập nhật đầy đủ dữ liệu lý lịch phương tiện, quá trình hoạt động của phương tiện vào Hồ sơ lý lịch phương tiện với các thông tin tối thiểu theo mẫu quy định tại Phụ lục I ban hành kèm theo Thông \n\n\n\ntư này.\n\n3. Quản lý người lái xe kinh doanh vận tải hành khách\n\na) Lập, cập nhật đầy đủ lý lịch hành nghề người lái xe, quá trình hoạt động của lái xe vào Hồ sơ lý lịch hành nghề người lái xe với các thông tin tối thiểu theo mẫu quy định tại Phụ lục II ban hành kèm theo Thông tư này;\n\nb) Đảm bảo việc người lái xe thực hiện đúng quy định về thời gian lái xe theo quy định tại Điều 64 Luật trật tự, an toàn giao thông đường bộ.\n\n4. Trực tiếp điều hành phương tiện, người lái xe của đơn vị mình để thực hiện vận chuyển hành khách theo một trong các hình thức sau\n\na) Thông qua phần mềm hỗ trợ kết nối vận tải;\n\nb) Thông qua lệnh vận chuyển;\n\nc) Thông qua hợp đồng vận chuyển.\n\n5. Quyết định giá cước vận tải đối với hoạt động kinh doanh vận tải của đơn vị.\n\n6. Xây dựng, áp dụng tiêu chuẩn chất lượng dịch vụ\n\nĐơn vị kinh doanh vận tải hành khách theo tuyến cố định, vận tải hành khách công cộng bằng xe buýt, vận tải hành khách bằng xe taxi phải xây dựng, công bố tiêu chuẩn chất lượng dịch vụ vận tải.\n\n7. Lưu trữ hồ sơ, tài liệu có liên quan trong quá trình quản lý, điều hành hoạt động vận tải của đơn vị để phục vụ công tác thanh tra, kiểm tra hoạt động vận tải và công tác tài chính kế toán trong hoạt động vận tải.\n\n8. Tổ chức tập huấn nghiệp vụ vận tải cho lái xe kinh doanh vận tải hoặc nhân viên phục vụ trên xe (nếu có) theo quy định.\n\nMục 2. KINH DOANH VẬN TẢI HÀNH KHÁCH BẰNG XE Ô TÔ THEO TUYẾN CỐ ĐỊNH\n\nĐiều 5. Tiêu chí thiết lập tuyến\n\n1. Có hệ thống đường bộ được công bố khai thác trên toàn bộ hành trình.\n\n2. Có bến xe nơi đi, bến xe nơi đến đã được cơ quan có thẩm quyền công bố đưa vào khai thác.\n\n3. Có mã số tuyến vận tải hành khách cố định\n\na) Tuyến vận tải hành khách cố định liên tỉnh có mã số tuyến được xác định bởi mã số tỉnh, thành phố nơi đi, nơi đến; mã số bến xe khách nơi đi, nơi đến. Mã số tuyến được đánh theo thứ tự: tỉnh, thành phố có mã số nhỏ đứng trước tỉnh, thành phố có mã số lớn; bến xe khách của tỉnh, thành phố có mã số nhỏ đứng trước bến xe khách của tỉnh, thành phố có mã số lớn;\n\nb) Tuyến vận tải hành khách cố định nội tỉnh có mã số tuyến được xác định bởi mã số tỉnh, thành phố; mã số bến xe khách nơi đi, nơi đến. Mã số tuyến được đánh theo thứ tự: mã số tỉnh, thành phố; bến xe khách có mã số nhỏ; bến xe khách có mã số lớn. Trường hợp tuyến có nhiều hành trình khác nhau thì bổ sung thêm ký tự trong bảng chữ cái Tiếng Việt vào cuối của dãy số.\n\n4. Có thời gian giãn cách giữa các chuyến xe và tổng lưu lượng của tuyến\n\na) Thời gian giãn cách giữa các chuyến xe tại bến xe phải được xác định trên cơ sở thống nhất của hai Sở Giao thông vận tải. Sở Giao thông vận tải nơi có đơn vị kinh doanh vận tải đăng ký khai thác lấy ý kiến thống nhất với Sở Giao thông vận tải đầu tuyến bên kia;\n\nb) Tổng lưu lượng của tuyến cố định phải được xác định bằng tổng số chuyến trên tháng; đối với tuyến có nhiều hành trình thì phải xác định lưu lượng cho từng hành trình.\n\nĐiều 6. Tổ chức, quản lý và tiêu chí điểm dừng đón, trả khách tuyến cố định\n\n1. Tiêu chí của điểm dừng đón, trả khách\n\na) Điểm dừng đón, trả khách chỉ được bố trí tại các vị trí đảm bảo an toàn giao thông, thuận tiện cho hành khách lên, xuống xe;\n\nb) Biển chỉ dẫn điểm dừng đón, trả khách áp dụng cho tuyến cố định theo Quy chuẩn kỹ thuật quốc gia về báo hiệu đường bộ;\n\nc) Khoảng cách tối thiểu giữa 02 điểm dừng đón, trả khách liền kề hoặc giữa điểm dừng đón, trả khách với trạm dừng nghỉ hoặc với bến xe hai đầu tuyến do Sở Giao thông vận tải căn cứ tình hình thực tế và việc tổ chức giao thông của địa phương để xác định.\n\n2. Tổ chức, quản lý hoạt động điểm dừng đón, trả khách\n\na) Điểm dừng đón, trả khách chỉ phục vụ các xe ô tô vận tải hành khách tuyến cố định, xe buýt đón, trả khách; không sử dụng cho hoạt động khác;\n\n\n\nb) Tại điểm dừng đón, trả khách chỉ cho phép mỗi xe ô tô vận tải hành khách tuyến cố định được dừng tối đa không quá 03 phút;\n\nc) Sở Giao thông vận tải phối hợp với chính quyền địa phương nơi có điểm dừng đón, trả khách tổ chức, quản lý, đảm bảo an toàn giao thông, an ninh trật tự và vệ sinh môi trường tại khu vực điểm dừng đón, trả khách trên địa bàn địa phương;\n\nd) Sở Giao thông vận tải thông báo bằng văn bản về việc đưa vào khai thác hoặc ngừng khai thác điểm dừng đón, trả khách trên tuyến cố định, xe buýt đến các đơn vị kinh doanh vận tải theo tuyến cố định, xe buýt có hoạt động trên địa bàn, đồng thời đăng tải trên Trang thông tin điện tử của Sở.\n\nĐiều 7. Niêm yết thông tin']","**Nguồn văn bản:** /content/drive/MyDrive/ITProject_data/new_law/36_2024_TT-BGTVT_633950.docx

**Tên văn bản:** THÔNG TƯ QUY ĐỊNH VỀ TỔ CHỨC, QUẢN LÝ HOẠT ĐỘNG VẬN TẢI BẰNG XE Ô TÔ VÀ HOẠT ĐỘNG CỦA BẾN XE, BÃI ĐỖ XE, TRẠM DỪNG NGHỈ, ĐIỂM DỪNG XE TRÊN ĐƯỜNG BỘ; QUY ĐỊNH TRÌNH TỰ, THỦ TỤC ĐƯA BẾN XE, TRẠM DỪNG NGHỈ VÀO KHAI THÁC

**Nội dung:**

Thông tư này không cung cấp thông tin cụ thể về quy định thời gian nghỉ ngơi của tài xế xe tải.  Tuy nhiên, Thông tư đề cập đến việc đơn vị kinh doanh vận tải hành khách phải đảm bảo người lái xe thực hiện đúng quy định về thời gian lái xe theo quy định tại Điều 64 Luật trật tự, an toàn giao thông đường bộ (Điều 4, mục 3, khoản b).  Để biết chi tiết về thời gian nghỉ ngơi của tài xế xe tải, bạn cần tham khảo Điều 64 của Luật trật tự, an toàn giao thông đường bộ.


Tóm lại: Thông tư không nêu rõ quy định về thời gian nghỉ ngơi của tài xế xe tải, mà chỉ nhắc đến việc phải tuân thủ Điều 64 Luật trật tự, an toàn giao thông đường bộ.  Cần tìm hiểu thêm thông tin từ văn bản luật được đề cập.
",Tài xế xe tải phải nghỉ ít nhất 15 phút sau mỗi 4 giờ lái xe liên tục.,0.8571428571428571,0.0,0.0,0.0
29,Quy định mới về việc sử dụng thiết bị giám sát hành trình trên xe ô tô kinh doanh vận tải là gì?,"['7. Phạt tiền từ 5.000.000 đồng đến 6.000.000 đồng đối với cá nhân, từ 10.000.000 đồng đến 12.000.000 đồng đối với tổ chức kinh doanh vận tải, dịch vụ hỗ trợ vận tải thực hiện một trong các hành vi vi phạm sau đây:\n\na) Không thực hiện việc cung cấp, cập nhật, truyền, lưu trữ, quản lý thông tin, dữ liệu từ thiết bị giám sát hành trình theo quy định;\n\nb) Không thực hiện đúng nội dung thông tin đã niêm yết trên xe theo quy định;\n\nc) Sử dụng phương tiện kinh doanh vận tải không lắp thiết bị giám sát hành trình của xe (đối với hình thức kinh doanh vận tải có quy định phương tiện phải lắp thiết bị) hoặc lắp thiết bị nhưng thiết bị không hoạt động, không đúng quy chuẩn theo quy định hoặc làm sai lệch dữ liệu của thiết bị giám sát hành trình của xe ô tô;\n\nd) Sử dụng xe trung chuyển chở hành khách không đúng quy định;\n\nđ) Sử dụng lái xe điều khiển xe khách giường nằm hai tầng, xe ô tô đưa đón trẻ em mầm non, học sinh chưa đủ số năm kinh nghiệm theo quy định;\n\ne) Sử dụng xe kinh doanh vận tải hành khách theo hợp đồng mà trên xe không có hợp đồng vận tải, danh sách hành khách kèm theo, thiết bị để truy cập nội dung hợp đồng điện tử và danh sách hành khách theo quy định hoặc có hợp đồng vận tải, danh sách hành khách, thiết bị để truy cập nhưng không bảo đảm yêu cầu theo quy định, chở người không có tên trong danh sách hành khách hoặc vận chuyển không đúng đối tượng theo quy định (đối với xe kinh doanh vận tải hành khách theo hợp đồng vận chuyển trẻ em mầm non, học sinh, sinh viên, cán bộ, công chức, viên chức, công nhân);\n\ng) Sử dụng xe ô tô kinh doanh vận tải không lắp thiết bị ghi nhận hình ảnh người lái xe theo quy định (đối với loại xe có quy định phải lắp thiết bị ghi nhận hình ảnh người lái xe) hoặc có lắp thiết bị ghi nhận hình ảnh người lái xe nhưng không ghi, không lưu trữ được dữ liệu trên xe trong quá trình xe tham gia giao thông theo quy định hoặc làm sai lệch dữ liệu của thiết bị ghi nhận hình ảnh người lái xe lắp trên xe ô tô;\n\nh) Không thực hiện việc cung cấp, cập nhật, truyền dẫn, lưu trữ, quản lý thông tin, dữ liệu thu thập từ thiết bị ghi nhận hình ảnh người lái xe lắp trên xe ô tô theo quy định;\n\ni) Sử dụng phương tiện kinh doanh vận tải có niên hạn sử dụng không bảo đảm điều kiện của hình thức kinh doanh đã đăng ký.\n\n8. Phạt tiền từ 10.000.000 đồng đến 12.000.000 đồng đối với cá nhân, từ 20.000.000 đồng đến 24.000.000 đồng đối với tổ chức kinh doanh vận tải, dịch vụ hỗ trợ vận tải thực hiện một trong các hành vi vi phạm sau đây:\n\na) Không tổ chức khám sức khỏe định kỳ cho lái xe theo quy định hoặc có tổ chức khám nhưng không đầy đủ các nội dung theo quy định;\n\nb) Vi phạm quy định về kinh doanh, điều kiện kinh doanh vận tải bằng xe ô tô để xảy ra tai nạn giao thông gây hậu quả từ mức nghiêm trọng trở lên;\n\nc) Sử dụng xe ô tô kinh doanh vận tải để đón, trả khách; nhận, trả hàng trên đường cao tốc.\n\n9. Phạt tiền từ 20.000.000 đồng đến 40.000.000 đồng đối với đơn vị sản xuất, lắp ráp, nhập khẩu thiết bị giám sát hành trình của xe ô tô, đơn vị cung cấp dịch vụ liên quan đến giám sát hành trình, ghi nhận hình ảnh người lái xe thực hiện một trong các hành vi sau:\n\na) Đơn vị sản xuất, lắp ráp, nhập khẩu thiết bị giám sát hành trình của xe ô tô không có nhân sự cho từng vị trí công việc theo quy định;\n\nb) Đơn vị sản xuất, lắp ráp, nhập khẩu thiết bị giám sát hành trình của xe ô tô không báo cáo về việc cập nhật, thay đổi phần mềm của thiết bị theo quy định.\n\n10. Phạt tiền từ 40.000.000 đồng đến 60.000.000 đồng đối với đơn vị sản xuất, lắp ráp, nhập khẩu thiết bị ghi nhận hình ảnh người lái xe lắp trên xe ô tô, đơn vị cung cấp dịch vụ liên quan đến giám sát hành trình, ghi nhận hình ảnh người lái xe thực hiện một trong các hành vi vi phạm sau đây:\n\na) Làm sai lệch thông tin, dữ liệu của thiết bị giám sát hành trình của xe ô tô;\n\nb) Làm sai lệch thông tin, dữ liệu của thiết bị ghi nhận hình ảnh người lái xe lắp trên xe ô tô.\n\n11. Phạt tiền từ 40.000.000 đồng đến 50.000.000 đồng đối với cá nhân, từ 80.000.000 đồng đến 100.000.000 đồng đối với tổ chức kinh doanh vận tải, dịch vụ hỗ trợ vận tải tái phạm hành vi quy định tại điểm a, điểm h khoản 7 Điều này.\n\n12. Ngoài việc bị phạt tiền, cá nhân, tổ chức thực hiện hành vi vi phạm quy định tại điểm c khoản 2; điểm a, điểm b, điểm đ, điểm g khoản 4; điểm b, điểm c, điểm d, điểm đ, điểm e, điểm g khoản 7; điểm c khoản 8 Điều này còn bị áp dụng các hình thức xử phạt bổ sung tước quyền sử dụng phù hiệu từ 01 tháng đến 03 tháng (nếu có hoặc đã được cấp) đối với xe vi phạm.\n\n13. Ngoài việc bị áp dụng hình thức xử phạt, cá nhân, tổ chức thực hiện hành vi vi phạm còn bị áp dụng các biện pháp khắc phục hậu quả sau đây:\n\na) Thực hiện hành vi quy định tại điểm a khoản 4 Điều này buộc cấp thẻ nhận dạng lái xe cho lái xe theo quy định;\n\nb) Thực hiện hành vi quy định tại điểm b, điểm c, điểm d khoản 4; điểm a khoản 8 Điều này buộc tổ chức tập huấn, hướng dẫn nghiệp vụ, quy trình hoặc tổ chức khám sức khỏe định kỳ cho lái xe và nhân viên phục vụ trên xe theo quy định;\n\nc) Thực hiện hành vi quy định tại điểm đ, điểm e khoản 4; điểm c, điểm g khoản 7 Điều này buộc lắp đặt thiết bị giám sát hành trình, thiết bị ghi nhận hình ảnh người lái xe, dây đai an toàn, ghế ngồi cho trẻ em mầm non, học sinh tiểu học trên xe theo đúng quy định;\n\nd) Thực hiện hành vi quy định tại điểm a, điểm h khoản 7; khoản 11 Điều này buộc cung cấp, cập nhật, truyền dẫn, lưu trữ, quản lý thông tin, dữ liệu thu thập từ thiết bị giám sát hành trình, thiết bị ghi nhận hình ảnh người lái xe lắp trên xe ô tô theo quy định;\n\nđ) Thực hiện hành vi quy định tại điểm c, điểm d khoản 6 Điều này buộc thực hiện đúng quy định về màu sơn, biển báo dấu hiệu nhận biết của xe.\n\n14. Ngoài việc bị áp dụng hình thức xử phạt, người điều khiển phương tiện thực hiện hành vi vi phạm còn bị trừ điểm giấy phép lái xe như sau:\n\na) Thực hiện hành vi quy định tại điểm đ khoản 2; điểm b, điểm c, điểm d khoản 6; điểm b, điểm c, điểm e, điểm i khoản 7 Điều này trong trường hợp cá nhân kinh doanh vận tải là người trực tiếp điều khiển phương tiện còn bị trừ điểm giấy phép lái xe 02 điểm;\n\nb) Thực hiện hành vi quy định tại điểm c khoản 8 Điều này trong trường hợp cá nhân kinh doanh vận tải là người trực tiếp điều khiển phương tiện còn bị trừ điểm giấy phép lái xe 06 điểm.\n\nĐiều 27. Xử phạt, trừ điểm giấy phép lái xe của người điều khiển xe ô tô kinh doanh vận tải chở trẻ em mầm non, học sinh, xe ô tô kinh doanh vận tải kết hợp với hoạt động đưa đón trẻ em mầm non, học sinh\n\n1. Phạt tiền từ 1.000.000 đồng đến 2.000.000 đồng đối với người điều khiển xe ô tô kinh doanh vận tải chở trẻ em mầm non, học sinh, xe ô tô kinh doanh vận tải kết hợp với hoạt động đưa đón trẻ em mầm non, học sinh thực hiện một trong các hành vi vi phạm sau đây:\n\na) Không hướng dẫn trẻ em mầm non, học sinh ngồi đúng vị trí quy định trong xe;\n\nb) Điều khiển xe ô tô kinh doanh vận tải chở trẻ em mầm non, học sinh tiểu học, xe ô tô kinh doanh vận tải kết hợp với hoạt động đưa đón trẻ em mầm non, học sinh tiểu học không có dây đai an toàn phù hợp với lứa tuổi hoặc không có ghế ngồi phù hợp với lứa tuổi theo quy định;\n\nc) Điều khiển xe không lắp thiết bị ghi nhận hình ảnh người lái xe hoặc có lắp thiết bị ghi nhận hình ảnh người lái xe nhưng không có tác dụng trong quá trình xe tham gia giao thông theo quy định hoặc làm sai lệch dữ liệu của thiết bị ghi nhận hình ảnh người lái xe lắp trên xe ô tô.\n\n2. Phạt tiền từ 2.000.000 đồng đến 3.000.000 đồng đối với hành vi điều khiển xe ô tô kinh doanh vận tải chở trẻ em mầm non, học sinh tiểu học, xe ô tô kinh doanh vận tải kết hợp với hoạt động đưa đón trẻ em mầm non, học sinh tiểu học không có hoặc không đủ người quản lý trên mỗi xe ô tô theo quy định tại khoản 3 Điều 46 của Luật Trật tự, an toàn giao thông đường bộ.\n\n3. Phạt tiền từ 3.000.000 đồng đến 5.000.000 đồng đối với người điều khiển xe ô tô kinh doanh vận tải chở trẻ em mầm non, học sinh, xe ô tô kinh doanh vận tải kết hợp với hoạt động đưa đón trẻ em mầm non, học sinh thực hiện một trong các hành vi vi phạm sau đây:']","**Nguồn văn bản:** /content/drive/MyDrive/ITProject_data/new_law/168_2024_ND-CP_619502.docx

**Nội dung:**

7. Phạt tiền từ 5.000.000 đồng đến 6.000.000 đồng đối với cá nhân, từ 10.000.000 đồng đến 12.000.000 đồng đối với tổ chức kinh doanh vận tải, dịch vụ hỗ trợ vận tải thực hiện một trong các hành vi vi phạm sau đây:

    a) Không thực hiện việc cung cấp, cập nhật, truyền, lưu trữ, quản lý thông tin, dữ liệu từ thiết bị giám sát hành trình theo quy định;

    b) Không thực hiện đúng nội dung thông tin đã niêm yết trên xe theo quy định;

    c) Sử dụng phương tiện kinh doanh vận tải không lắp thiết bị giám sát hành trình của xe (đối với hình thức kinh doanh vận tải có quy định phương tiện phải lắp thiết bị) hoặc lắp thiết bị nhưng thiết bị không hoạt động, không đúng quy chuẩn theo quy định hoặc làm sai lệch dữ liệu của thiết bị giám sát hành trình của xe ô tô;

    d) Sử dụng xe trung chuyển chở hành khách không đúng quy định;

    đ) Sử dụng lái xe điều khiển xe khách giường nằm hai tầng, xe ô tô đưa đón trẻ em mầm non, học sinh chưa đủ số năm kinh nghiệm theo quy định;

    e) Sử dụng xe kinh doanh vận tải hành khách theo hợp đồng mà trên xe không có hợp đồng vận tải, danh sách hành khách kèm theo, thiết bị để truy cập nội dung hợp đồng điện tử và danh sách hành khách theo quy định hoặc có hợp đồng vận tải, danh sách hành khách, thiết bị để truy cập nhưng không bảo đảm yêu cầu theo quy định, chở người không có tên trong danh sách hành khách hoặc vận chuyển không đúng đối tượng theo quy định (đối với xe kinh doanh vận tải hành khách theo hợp đồng vận chuyển trẻ em mầm non, học sinh, sinh viên, cán bộ, công chức, viên chức, công nhân);

    g) Sử dụng xe ô tô kinh doanh vận tải không lắp thiết bị ghi nhận hình ảnh người lái xe theo quy định (đối với loại xe có quy định phải lắp thiết bị ghi nhận hình ảnh người lái xe) hoặc có lắp thiết bị ghi nhận hình ảnh người lái xe nhưng không ghi, không lưu trữ được dữ liệu trên xe trong quá trình xe tham gia giao thông theo quy định hoặc làm sai lệch dữ liệu của thiết bị ghi nhận hình ảnh người lái xe lắp trên xe ô tô;

    h) Không thực hiện việc cung cấp, cập nhật, truyền dẫn, lưu trữ, quản lý thông tin, dữ liệu thu thập từ thiết bị ghi nhận hình ảnh người lái xe lắp trên xe ô tô theo quy định;

    i) Sử dụng phương tiện kinh doanh vận tải có niên hạn sử dụng không bảo đảm điều kiện của hình thức kinh doanh đã đăng ký.


11. Phạt tiền từ 40.000.000 đồng đến 50.000.000 đồng đối với cá nhân, từ 80.000.000 đồng đến 100.000.000 đồng đối với tổ chức kinh doanh vận tải, dịch vụ hỗ trợ vận tải tái phạm hành vi quy định tại điểm a, điểm h khoản 7 Điều này.

12. Ngoài việc bị phạt tiền, cá nhân, tổ chức thực hiện hành vi vi phạm quy định tại điểm c khoản 2; điểm a, điểm b, điểm đ, điểm g khoản 4; điểm b, điểm c, điểm d, điểm đ, điểm e, điểm g khoản 7; điểm c khoản 8 Điều này còn bị áp dụng các hình thức xử phạt bổ sung tước quyền sử dụng phù hiệu từ 01 tháng đến 03 tháng (nếu có hoặc đã được cấp) đối với xe vi phạm.

13. Ngoài việc bị áp dụng hình thức xử phạt, cá nhân, tổ chức thực hiện hành vi vi phạm còn bị áp dụng các biện pháp khắc phục hậu quả sau đây: …(Nội dung liên quan đến khắc phục hậu quả)


Tóm lại:  Quy định về sử dụng thiết bị giám sát hành trình trên xe ô tô kinh doanh vận tải bao gồm các quy định về lắp đặt, hoạt động, cung cấp dữ liệu của thiết bị. Vi phạm các quy định này sẽ bị phạt tiền từ 5.000.000 đồng đến 12.000.000 đồng đối với tổ chức, và từ 5.000.000 đồng đến 6.000.000 đồng đối với cá nhân, tùy thuộc vào mức độ vi phạm.  Tái phạm sẽ bị phạt tiền cao hơn và có thể bị tước quyền sử dụng phù hiệu.
","Bắt buộc lắp đặt thiết bị giám sát hành trình trên tất cả các xe ô tô kinh doanh vận tải để theo dõi tốc độ, thời gian lái xe và hành trình.",0.967741935483871,0.6800140382871983,1.0,0.0
30,Luật Giao thông Đường bộ 2025 có quy định gì về việc sử dụng xe đạp điện trong khu vực đô thị?,"['Điều 6. Cơ sở dữ liệu đường bộ\n\n1. Cơ sở dữ liệu đường bộ được thiết kế, xây dựng, vận hành theo Khung kiến trúc tổng thể quốc gia số, bao gồm:\n\na) Cơ sở dữ liệu về quy hoạch mạng lưới đường bộ, quy hoạch kết cấu hạ tầng đường bộ;\n\nb) Cơ sở dữ liệu về tình hình đầu tư, xây dựng kết cấu hạ tầng đường bộ;\n\nc) Cơ sở dữ liệu về kết cấu hạ tầng đường bộ đã đưa vào khai thác;\n\nd) Cơ sở dữ liệu thanh toán điện tử giao thông đường bộ;\n\nđ) Cơ sở dữ liệu về hoạt động vận tải bằng xe ô tô, trừ cơ sở dữ liệu về hành trình của phương tiện giao thông đường bộ, hình ảnh người lái xe và cơ sở dữ liệu về quản lý thời gian điều khiển phương tiện của người lái xe theo quy định của pháp luật.\n\n2. Cơ sở dữ liệu đường bộ được kết nối, chia sẻ với cơ sở dữ liệu về trật tự, an toàn giao thông đường bộ và các cơ sở dữ liệu khác có liên quan.\n\n3. Chính phủ quy định chi tiết khoản 1 và khoản 2 Điều này; quy định việc thu thập, quản lý, khai thác thông tin trong cơ sở dữ liệu đường bộ.\n\nĐiều 7. Các hành vi bị nghiêm cấm\n\n1. Phá hoại kết cấu hạ tầng đường bộ; khai thác, sử dụng kết cấu hạ tầng đường bộ trái quy định của pháp luật.\n\n2. Đấu nối trái phép vào đường chính, đường nhánh; tháo dỡ, di chuyển trái phép hoặc làm sai lệch công trình đường bộ.\n\n3. Lấn, chiếm, sử dụng, xây dựng trái phép trong phạm vi bảo vệ kết cấu hạ tầng đường bộ.\n\n4. Lắp đặt, tháo dỡ, di chuyển, điều chỉnh, che khuất báo hiệu đường bộ trái quy định của pháp luật; gắn, treo, lắp vào báo hiệu đường bộ nội dung không liên quan tới ý nghĩa, mục đích của báo hiệu đường bộ hoặc làm sai lệch báo hiệu đường bộ.\n\n5. Kinh doanh vận tải bằng xe ô tô, bằng xe bốn bánh có gắn động cơ mà không có giấy phép kinh doanh vận tải theo quy định của pháp luật hoặc kinh doanh không đúng giấy phép.\n\n6. Lập điểm đón, trả khách, bốc dỡ hàng hóa trái quy định của pháp luật.\n\nChương II\n\nKẾT CẤU HẠ TẦNG ĐƯỜNG BỘ \n\nMục 1. PHÂN LOẠI, ĐẶT TÊN, SỐ HIỆU ĐƯỜNG BỘ\n\nĐiều 8. Phân loại đường bộ theo cấp quản lý\n\n1. Đường bộ theo cấp quản lý bao gồm: quốc lộ, đường tỉnh, đường huyện, đường xã, đường thôn, đường đô thị, đường chuyên dùng và được xác định như sau:\n\na) Quốc lộ là đường nối liền Thủ đô Hà Nội với trung tâm hành chính cấp tỉnh; đường nối liền các trung tâm hành chính cấp tỉnh; đường có vị trí quan trọng đối với sự phát triển kinh tế - xã hội, bảo đảm quốc phòng, an ninh của vùng, khu vực;\n\nb) Đường tỉnh là đường nằm trong địa bàn một tỉnh nối trung tâm hành chính của tỉnh với trung tâm hành chính của huyện; đường có vị trí quan trọng đối với sự phát triển kinh tế - xã hội của tỉnh;\n\nc) Đường huyện là đường nối trung tâm hành chính của huyện với trung tâm hành chính của xã, cụm xã hoặc trung tâm hành chính của huyện lân cận; đường có vị trí quan trọng đối với sự phát triển kinh tế - xã hội của huyện;\n\nd) Đường xã là đường nối trung tâm hành chính của xã với thôn, làng, ấp, bản, buôn, bon, phum, sóc (sau đây gọi là thôn) và điểm dân cư nông thôn hoặc đường nối với xã lân cận; đường có vị trí quan trọng đối với sự phát triển kinh tế - xã hội của xã;\n\nđ) Đường thôn là đường trong khu vực thôn, đường trục nối thôn với khu vực sản xuất nông nghiệp, lâm nghiệp và cơ sở sản xuất, kinh doanh khác trên địa bàn thôn;\n\ne) Đường đô thị là đường trong phạm vi địa giới hành chính nội thành, nội thị, bao gồm: đường cao tốc đô thị, đường phố, đường ngõ, ngách, kiệt, hẻm trong đô thị;\n\ng) Đường chuyên dùng là đường chuyên phục vụ giao thông cho một hoặc một số cơ quan, tổ chức, cá nhân và đường nội bộ.\n\n2. Đường địa phương bao gồm: đường tỉnh, đường đô thị, đường huyện, đường xã, đường thôn.\n\n3. Bộ Giao thông vận tải có trách nhiệm quản lý quốc lộ, trừ quốc lộ quy định tại điểm a khoản 4 Điều này và đường gom, đường bên quy định tại điểm c khoản 4 Điều này.\n\n4. Ủy ban nhân dân cấp tỉnh có trách nhiệm quản lý các loại đường sau đây:\n\na) Quản lý đường tỉnh, quốc lộ đi qua đô thị loại đặc biệt; quốc lộ khi được phân cấp; tuyến, đoạn tuyến quốc lộ đã hoàn thành việc đầu tư xây dựng tuyến tránh thay thế phù hợp với quy hoạch mạng lưới đường bộ; tuyến, đoạn tuyến quốc lộ không còn trong quy hoạch mạng lưới đường bộ, trừ trường hợp quốc lộ có yêu cầu đặc biệt về bảo đảm quốc phòng, an ninh; tuyến, đoạn tuyến quốc lộ được Thủ tướng Chính phủ giao trên cơ sở đề nghị của Ủy ban nhân dân cấp tỉnh để đáp ứng nhu cầu phát triển kinh tế - xã hội, bảo đảm lợi ích quốc gia, quốc phòng, an ninh, khả năng bố trí nguồn lực của địa phương; tuyến, đoạn tuyến quốc lộ đã được điều chuyển tài sản về Ủy ban nhân dân cấp tỉnh quản lý theo quy định của pháp luật về quản lý, sử dụng tài sản công;\n\nb) Quy định việc quản lý đường đô thị, đường huyện, đường xã, đường thôn;\n\nc) Quản lý đường gom, đường bên tách khỏi quốc lộ.\n\n5. Người quản lý, sử dụng đường bộ đối với đường chuyên dùng có trách nhiệm quản lý đường chuyên dùng theo quy định của Luật này và quy định khác của pháp luật có liên quan.\n\n6. Chính phủ quy định chi tiết Điều này.\n\nĐiều 9. Phân loại đường bộ theo chức năng phục vụ\n\n1. Đường chính là đường phục vụ giao thông chủ yếu trong khu vực, kết nối giao thông các khu vực, vùng.\n\n2. Đường nhánh là đường nối vào đường chính, có chức năng kết nối giao thông các khu vực hai bên đường chính; kết nối giao thông từ đường gom vào đường chính thông qua nút giao.\n\n3. Đường gom là đường để gom hệ thống đường giao thông nội bộ của các khu đô thị, công nghiệp, kinh tế, dân cư, thương mại - dịch vụ và các đường khác vào đường chính hoặc vào đường nhánh trước khi đấu nối vào đường chính. Đường gom có thể là đường bên theo quy định tại khoản 4 Điều này.\n\n4. Đường bên là đường được xây dựng bên cạnh các đoạn đường chính để ngăn cách giao thông khu vực hai bên đường với đường chính. Đường bên được tách khỏi đường chính hoặc ngăn cách với đường chính bằng dải phân cách, tường bảo vệ, rào chắn.\n\n5. Đường dành cho giao thông công cộng là đường phục vụ cho tất cả mọi người, phương tiện giao thông đường bộ theo quy định của Luật này và quy định khác của pháp luật có liên quan.\n\n6. Đường nội bộ là đường trong phạm vi khu chung cư, đô thị, công nghiệp, kinh tế, thương mại - dịch vụ, các cơ quan, tổ chức, đơn vị khác và chỉ phục vụ các đối tượng được phép vào, ra bên trong phạm vi các khu vực quy định tại khoản này.\n\n7. Đường dành riêng cho người đi bộ, người đi xe đạp và các đường khác.\n\nĐiều 10. Cấp kỹ thuật của đường bộ\n\n1. Cấp kỹ thuật của đường bộ phải được xác định trong dự án đầu tư xây dựng đường bộ. Việc thiết kế, thi công xây dựng đường bộ phải thực hiện đúng quy định về cấp kỹ thuật tuyến đường trong dự án đầu tư xây dựng đường bộ được duyệt; tuân thủ quy chuẩn, tiêu chuẩn kỹ thuật về cấp kỹ thuật của đường bộ.\n\n2. Cấp kỹ thuật của đường bộ được quy định trong các quy chuẩn, tiêu chuẩn thiết kế của đường bộ, bao gồm:\n\na) Đường cao tốc;\n\nb) Đường cấp I, II, III, IV, V, VI;\n\nc) Đường đô thị;\n\nd) Đường cấp A, B, C, D, đường khác.\n\n3. Cấp kỹ thuật của đường bộ quy định tại các điểm a, b và d khoản 2 Điều này thực hiện theo quy chuẩn kỹ thuật quốc gia do Bộ trưởng Bộ Giao thông vận tải ban hành và tiêu chuẩn kỹ thuật do cấp có thẩm quyền công bố.\n\n4. Cấp kỹ thuật của đường bộ quy định tại điểm c khoản 2 Điều này thực hiện theo quy chuẩn kỹ thuật quốc gia do Bộ trưởng Bộ Xây dựng ban hành và tiêu chuẩn kỹ thuật do cấp có thẩm quyền công bố.\n\nĐiều 11. Đặt tên, đổi tên, số hiệu đường bộ\n\n1. Việc đặt tên, số hiệu đường bộ được quy định như sau:\n\na) Tên đường bộ được đặt theo tên danh nhân, người có công với đất nước; di tích, sự kiện lịch sử, văn hóa; tên địa danh hoặc tên theo tập quán. Số hiệu đường bộ được đặt theo số tự nhiên hoặc số tự nhiên kèm theo chữ cái nếu cần thiết. Trường hợp đường đô thị trùng với đường khác thì sử dụng cả tên đường đô thị và tên, số hiệu của đường khác;']","**Nguồn văn bản:** /content/drive/MyDrive/ITProject_data/new_law/35_2024_QH15_588811.docx

**Tên văn bản:** Không có thông tin

**Điều:** Không có thông tin

**Nội dung:**

Tôi xin lỗi, nhưng văn bản được cung cấp không chứa thông tin về quy định sử dụng xe đạp điện trong khu vực đô thị. Văn bản tập trung vào cơ sở dữ liệu đường bộ, phân loại đường bộ, và các hành vi bị nghiêm cấm liên quan đến kết cấu hạ tầng đường bộ.  Nó đề cập đến ""Đường đô thị"" là đường trong phạm vi địa giới hành chính nội thành, nội thị, bao gồm: đường cao tốc đô thị, đường phố, đường ngõ, ngách, kiệt, hẻm trong đô thị, nhưng không đi sâu vào quy định cụ thể về việc sử dụng xe đạp điện.

Tóm lại: Không tìm thấy thông tin liên quan đến quy định về việc sử dụng xe đạp điện trong khu vực đô thị trong văn bản được cung cấp.
",Người điều khiển xe đạp điện trong khu vực đô thị phải tuân thủ các quy định về tốc độ tối đa và không được đi vào làn đường dành cho người đi bộ.,1.0,0.0,0.0,0.0
31,Quy định mới về việc sử dụng xe máy trong khu vực cấm là gì?,"['BỘ QUỐC PHÒNG\n------- CỘNG HÒA XÃ HỘI CHỦ NGHĨA VIỆT NAM\nĐộc lập - Tự do - Hạnh phúc \n--------------- Số: 66/2024/TT-BQP Hà Nội, ngày 14 tháng 10 năm 2024\n\nTHÔNG TƯ\n\nQUY ĐỊNH VỀ KIỂM ĐỊNH AN TOÀN KỸ THUẬT VÀ BẢO VỆ MÔI TRƯỜNG XE CƠ GIỚI, XE MÁY CHUYÊN DÙNG THUỘC PHẠM VI QUẢN LÝ CỦA BỘ QUỐC PHÒNG\n\nCăn cứ Luật Trật tự, an toàn giao thông đường bộ ngày 27 tháng 6 năm 2024;\n\nCăn cứ Nghị định số 01/2022/NĐ-CP ngày 30 tháng 11 năm 2022 của Chính phủ quy định chức năng, nhiệm vụ, quyền hạn và cơ cấu tổ chức của Bộ Quốc phòng;\n\nTheo đề nghị của Chủ nhiệm Tổng cục Kỹ thuật;\n\nBộ trưởng Bộ Quốc phòng ban hành Thông tư quy định về kiểm định an toàn kỹ thuật và bảo vệ môi trường xe cơ giới, xe máy chuyên dùng thuộc phạm vi quản lý của Bộ Quốc phòng.\n\nChương I\n\nQUY ĐỊNH CHUNG\n\nĐiều 1. Phạm vi điều chỉnh\n\nThông tư này quy định về kiểm định an toàn kỹ thuật và bảo vệ môi trường xe cơ giới, xe máy chuyên dùng của các cơ quan, đơn vị, doanh nghiệp thuộc phạm vi quản lý của Bộ Quốc phòng sử dụng vào mục đích quốc phòng, an ninh.\n\nĐiều 2. Đối tượng áp dụng\n\nThông tư này áp dụng đối với các trung tâm, trạm kiểm định an toàn kỹ thuật xe - máy quân sự; các cơ quan, đơn vị, doanh nghiệp thuộc phạm vi quản lý của Bộ Quốc phòng, các tổ chức và cá nhân liên quan đến việc kiểm định an toàn kỹ thuật và bảo vệ môi trường xe cơ giới, xe máy chuyên dùng.\n\nĐiều 3. Giải thích từ ngữ\n\nTrong Thông tư này, các từ ngữ dưới đây được hiểu như sau:\n\n1. Doanh nghiệp thuộc phạm vi quản lý của Bộ Quốc phòng (sau đây viết gọn là doanh nghiệp) là doanh nghiệp trực tiếp phục vụ quốc phòng, an ninh hoặc doanh nghiệp kết hợp kinh tế với quốc phòng, an ninh theo quy định tại Nghị định số 16/2023/NĐ-CP ngày 25 tháng 4 năm 2023 của Chính phủ về tổ chức quản lý và hoạt động của doanh nghiệp trực tiếp phục vụ quốc phòng, an ninh và doanh nghiệp kết hợp kinh tế với quốc phòng, an ninh; sửa đổi quy định tại điểm g khoản 1 Điều 23 Nghị định số 47/2021/NĐ-CP ngày 01 tháng 4 năm 2021 của Chính phủ quy định chi tiết một số điều của Luật Doanh nghiệp.\n\n2. Xe cơ giới là xe được trang bị cho các cơ quan, đơn vị, doanh nghiệp do Bộ Quốc phòng trực tiếp đăng ký, quản lý, sử dụng vào mục đích quốc phòng, an ninh.\n\n3. Xe cơ giới của doanh nghiệp là xe cơ giới sử dụng vào mục đích quốc phòng, an ninh không thuộc trường hợp xe cơ giới quy định tại khoản 2 Điều này.\n\n4. Xe máy chuyên dùng gồm xe máy chuyên dùng quân sự, xe máy thi công; xe máy nông nghiệp, lâm nghiệp và các loại xe chuyên dùng khác có tham gia giao thông được trang bị cho các cơ quan, đơn vị trực thuộc Bộ Quốc phòng theo quy định tại Phụ lục VI kèm theo Thông tư này.\n\n5. Cơ sở kiểm định là các trung tâm, trạm kiểm định an toàn kỹ thuật xe - máy quân sự do Tổng Tham mưu trưởng quyết định thành lập.\n\n6. Kiểm định an toàn kỹ thuật và bảo vệ môi trường xe cơ giới, xe máy chuyên dùng (sau đây viết gọn là kiểm định) là việc kiểm tra, đánh giá lần đầu và định kỳ tình trạng an toàn kỹ thuật và bảo vệ môi trường của xe cơ giới, xe máy chuyên dùng theo các tiêu chuẩn, quy chuẩn, quy định của nhà nước và Bộ Quốc phòng.\n\n7. Chu kỳ kiểm định là khoảng thời gian giữa hai lần kiểm định được tính bằng tháng.\n\n8. Phiếu kiểm định là bản xác nhận kết quả kiểm định an toàn kỹ thuật và bảo vệ môi trường của từng xe cơ giới, xe máy chuyên dùng khi kiểm định.\n\n9. Giấy chứng nhận an toàn kỹ thuật và bảo vệ môi trường xe cơ giới, xe máy chuyên dùng (sau đây gọi là Giấy chứng nhận kiểm định) là bản xác nhận cho xe cơ giới, xe máy chuyên dùng đã được kiểm định đạt các tiêu chuẩn, quy chuẩn, quy định của nhà nước và Bộ Quốc phòng về an toàn kỹ thuật và bảo vệ môi trường, đủ điều kiện tham gia giao thông đường bộ.\n\n\n\n10. Tem kiểm định an toàn kỹ thuật và bảo vệ môi trường xe cơ giới, xe máy chuyên dùng (sau đây viết gọn là Tem kiểm định) là biểu trưng do các cơ sở kiểm định cấp, dán lên xe cơ giới, xe máy chuyên dùng sau khi đã được cấp Giấy chứng nhận kiểm định và được phép tham gia giao thông đường bộ theo thời hạn ghi trên Tem kiểm định.\n\n11. Chỉ huy cơ sở kiểm định là giám đốc, phó giám đốc trung tâm kiểm định; trạm trưởng trạm kiểm định thuộc Bộ Quốc phòng.\n\n12. Kiểm định viên là người có đủ trình độ, kỹ năng, kinh nghiệm được tập huấn (đào tạo); cấp Giấy chứng nhận, thẻ kiểm định viên theo quy định của nhà nước, Bộ Quốc phòng để thực hiện một phần hoặc toàn bộ việc kiểm định xe cơ giới, xe máy chuyên dùng.\n\n13. Chương trình quản lý kiểm định là hệ thống phần mềm do Cục Xe máy - Vận tải/Tổng cục Hậu cần - Kỹ thuật xây dựng để quản lý cơ sở dữ liệu kiểm định và công tác kiểm định xe cơ giới, xe máy chuyên dùng; được sử dụng tại các cơ sở kiểm định và Cục Xe máy - Vận tải/Tổng cục Hậu cần - Kỹ thuật.\n\nĐiều 4. Những hành vi nghiêm cấm\n\n1. Kiểm định không đủ nội dung, không đúng quy trình, quy định; làm sai lệch kết quả kiểm định.\n\n2. Sử dụng thiết bị kiểm tra bị hư hỏng; phương tiện đo, thiết bị kiểm tra chưa được kiểm định, hiệu chuẩn hoặc quá thời hạn sử dụng.\n\n3. Bố trí không đúng, không đủ kiểm định viên trên dây chuyền kiểm định.\n\n4. Tự ý in phôi Giấy chứng nhận kiểm định, Tem kiểm định để sử dụng.\n\n5. Sửa đổi các nội dung in, ghi trên Giấy chứng nhận kiểm định, Tem kiểm định; tự ý bóc, dán Tem kiểm định.\n\n6. Có hành vi tiêu cực, sách nhiễu trong quá trình kiểm định.\n\n7. Kiểm định, cấp Giấy chứng nhận kiểm định, dán Tem kiểm định cho xe cơ giới, xe máy chuyên dùng của doanh nghiệp: Hết niên hạn sử dụng, không nộp phí sử dụng đường bộ theo quy định của pháp luật.\n\nChương II\n\nQUY ĐỊNH VỀ KIỂM ĐỊNH\n\nĐiều 5. Đối tượng, thẩm quyền kiểm định\n\n1. Xe cơ giới, xe máy chuyên dùng phải được kiểm định bằng các trang thiết bị, dụng cụ kiểm định tại cơ sở kiểm định hoặc cơ động (trừ các trường hợp được miễn kiểm định lần đầu theo quy định tại Điều 11 Thông tư này).\n\n2. Việc cơ động kiểm định chỉ áp dụng đối với các cơ quan, đơn vị, doanh nghiệp ở vùng sâu, vùng xa, biên giới, hải đảo không có điều kiện đưa xe cơ giới, xe máy chuyên dùng đến cơ sở kiểm định (khoảng cách từ cơ quan, đơn vị, doanh nghiệp đến cơ sở kiểm định phải có bán kính lớn hơn 50 km); nhóm xe tác chiến; xe cứu thương, cứu hoả, xe làm nhiệm vụ cứu hộ, cứu nạn; xe quá khổ, quá tải không vào được dây chuyền kiểm định.\n\n3. Chỉ huy cơ sở kiểm định kết luận, ký tên, đóng dấu trên Phiếu kiểm định, Giấy chứng nhận kiểm định, Tem kiểm định và chịu trách nhiệm trước pháp luật về kết quả kiểm định.\n\nĐiều 6. Hồ sơ kiểm định lần đầu\n\n1. Xe cơ giới, xe máy chuyên dùng.\n\na) Công văn hoặc giấy giới thiệu đề nghị kiểm định do chỉ huy cơ quan, đơn vị cấp trung đoàn hoặc tương đương trở lên ký tên, đóng dấu theo quy định;\n\nb) Chứng nhận đăng ký xe, lý lịch xe (áp dụng đối với xe cơ giới, xe máy chuyên dùng đã đăng ký);\n\nc) Biển số tạm thời (áp dụng đối với xe cơ giới, xe máy chuyên dùng chưa hoàn thành thủ tục đăng ký);\n\nd) Bản sao Giấy chứng nhận chất lượng an toàn kỹ thuật xe cơ giới, xe máy chuyên dùng cải tạo (áp dụng đối với xe cơ giới, xe máy chuyên dùng cải tạo).\n\n2. Xe cơ giới, xe máy chuyên dùng của doanh nghiệp.\n\na) Công văn hoặc giấy giới thiệu đề nghị kiểm định do giám đốc hoặc phó giám đốc doanh nghiệp ký tên, đóng dấu theo quy định;\n\nb) Chứng nhận đăng ký xe;\n\nc) Bản sao Giấy chứng nhận chất lượng an toàn kỹ thuật và bảo vệ môi trường xe cơ giới, xe máy chuyên dùng (áp dụng đối với xe cơ giới, xe máy chuyên dùng nhập khẩu);\n\n\n\nd) Bản sao Phiếu kiểm tra chất lượng xuất xưởng (áp dụng đối với xe cơ giới, xe máy chuyên dùng sản xuất, lắp ráp trong nước);\n\nđ) Bản sao Giấy chứng nhận chất lượng an toàn kỹ thuật và bảo vệ môi trường xe cơ giới, xe máy chuyên dùng cải tạo (áp dụng đối với xe cơ giới, xe máy chuyên dùng cải tạo).\n\nĐiều 7. Hồ sơ kiểm định định kỳ\n\n1. Xe cơ giới, xe máy chuyên dùng: Thực hiện theo quy định tại các điểm a, b khoản 1 Điều 6 Thông tư này.\n\n2. Xe cơ giới, xe máy chuyên dùng của doanh nghiệp: Thực hiện theo quy định tại các điểm a, b khoản 2 Điều 6 Thông tư này.\n\n3. Lập hồ sơ kiểm định.']","**Nguồn văn bản:** /content/drive/MyDrive/ITProject_data/new_law/66_2024_TT-BQP_628579.docx

**Tên văn bản:** THÔNG TƯ QUY ĐỊNH VỀ KIỂM ĐỊNH AN TOÀN KỸ THUẬT VÀ BẢO VỆ MÔI TRƯỜNG XE CƠ GIỚI, XE MÁY CHUYÊN DÙNG THUỘC PHẠM VI QUẢN LÝ CỦA BỘ QUỐC PHÒNG

**Nội dung:**

Thông tư này tập trung vào quy định về kiểm định an toàn kỹ thuật và bảo vệ môi trường xe cơ giới, xe máy chuyên dùng thuộc phạm vi quản lý của Bộ Quốc phòng, không đề cập đến quy định về việc sử dụng xe máy trong khu vực cấm.  Do đó, không tìm thấy thông tin liên quan tới câu hỏi này trong văn bản được cung cấp.


Tóm lại: Văn bản không chứa thông tin về quy định sử dụng xe máy trong khu vực cấm.
","Cấm xe máy lưu thông trong các khu vực cấm theo biển báo, đặc biệt trong giờ cao điểm.",0.6666666666666666,0.0,0.0,0.0
32,Luật Giao thông Đường bộ 2025 có quy định gì về việc sử dụng xe ô tô cá nhân trong giờ cao điểm?,"['7. Phạt tiền từ 5.000.000 đồng đến 6.000.000 đồng đối với cá nhân, từ 10.000.000 đồng đến 12.000.000 đồng đối với tổ chức kinh doanh vận tải, dịch vụ hỗ trợ vận tải thực hiện một trong các hành vi vi phạm sau đây:\n\na) Không thực hiện việc cung cấp, cập nhật, truyền, lưu trữ, quản lý thông tin, dữ liệu từ thiết bị giám sát hành trình theo quy định;\n\nb) Không thực hiện đúng nội dung thông tin đã niêm yết trên xe theo quy định;\n\nc) Sử dụng phương tiện kinh doanh vận tải không lắp thiết bị giám sát hành trình của xe (đối với hình thức kinh doanh vận tải có quy định phương tiện phải lắp thiết bị) hoặc lắp thiết bị nhưng thiết bị không hoạt động, không đúng quy chuẩn theo quy định hoặc làm sai lệch dữ liệu của thiết bị giám sát hành trình của xe ô tô;\n\nd) Sử dụng xe trung chuyển chở hành khách không đúng quy định;\n\nđ) Sử dụng lái xe điều khiển xe khách giường nằm hai tầng, xe ô tô đưa đón trẻ em mầm non, học sinh chưa đủ số năm kinh nghiệm theo quy định;\n\ne) Sử dụng xe kinh doanh vận tải hành khách theo hợp đồng mà trên xe không có hợp đồng vận tải, danh sách hành khách kèm theo, thiết bị để truy cập nội dung hợp đồng điện tử và danh sách hành khách theo quy định hoặc có hợp đồng vận tải, danh sách hành khách, thiết bị để truy cập nhưng không bảo đảm yêu cầu theo quy định, chở người không có tên trong danh sách hành khách hoặc vận chuyển không đúng đối tượng theo quy định (đối với xe kinh doanh vận tải hành khách theo hợp đồng vận chuyển trẻ em mầm non, học sinh, sinh viên, cán bộ, công chức, viên chức, công nhân);\n\ng) Sử dụng xe ô tô kinh doanh vận tải không lắp thiết bị ghi nhận hình ảnh người lái xe theo quy định (đối với loại xe có quy định phải lắp thiết bị ghi nhận hình ảnh người lái xe) hoặc có lắp thiết bị ghi nhận hình ảnh người lái xe nhưng không ghi, không lưu trữ được dữ liệu trên xe trong quá trình xe tham gia giao thông theo quy định hoặc làm sai lệch dữ liệu của thiết bị ghi nhận hình ảnh người lái xe lắp trên xe ô tô;\n\nh) Không thực hiện việc cung cấp, cập nhật, truyền dẫn, lưu trữ, quản lý thông tin, dữ liệu thu thập từ thiết bị ghi nhận hình ảnh người lái xe lắp trên xe ô tô theo quy định;\n\ni) Sử dụng phương tiện kinh doanh vận tải có niên hạn sử dụng không bảo đảm điều kiện của hình thức kinh doanh đã đăng ký.\n\n8. Phạt tiền từ 10.000.000 đồng đến 12.000.000 đồng đối với cá nhân, từ 20.000.000 đồng đến 24.000.000 đồng đối với tổ chức kinh doanh vận tải, dịch vụ hỗ trợ vận tải thực hiện một trong các hành vi vi phạm sau đây:\n\na) Không tổ chức khám sức khỏe định kỳ cho lái xe theo quy định hoặc có tổ chức khám nhưng không đầy đủ các nội dung theo quy định;\n\nb) Vi phạm quy định về kinh doanh, điều kiện kinh doanh vận tải bằng xe ô tô để xảy ra tai nạn giao thông gây hậu quả từ mức nghiêm trọng trở lên;\n\nc) Sử dụng xe ô tô kinh doanh vận tải để đón, trả khách; nhận, trả hàng trên đường cao tốc.\n\n9. Phạt tiền từ 20.000.000 đồng đến 40.000.000 đồng đối với đơn vị sản xuất, lắp ráp, nhập khẩu thiết bị giám sát hành trình của xe ô tô, đơn vị cung cấp dịch vụ liên quan đến giám sát hành trình, ghi nhận hình ảnh người lái xe thực hiện một trong các hành vi sau:\n\na) Đơn vị sản xuất, lắp ráp, nhập khẩu thiết bị giám sát hành trình của xe ô tô không có nhân sự cho từng vị trí công việc theo quy định;\n\nb) Đơn vị sản xuất, lắp ráp, nhập khẩu thiết bị giám sát hành trình của xe ô tô không báo cáo về việc cập nhật, thay đổi phần mềm của thiết bị theo quy định.\n\n10. Phạt tiền từ 40.000.000 đồng đến 60.000.000 đồng đối với đơn vị sản xuất, lắp ráp, nhập khẩu thiết bị ghi nhận hình ảnh người lái xe lắp trên xe ô tô, đơn vị cung cấp dịch vụ liên quan đến giám sát hành trình, ghi nhận hình ảnh người lái xe thực hiện một trong các hành vi vi phạm sau đây:\n\na) Làm sai lệch thông tin, dữ liệu của thiết bị giám sát hành trình của xe ô tô;\n\nb) Làm sai lệch thông tin, dữ liệu của thiết bị ghi nhận hình ảnh người lái xe lắp trên xe ô tô.\n\n11. Phạt tiền từ 40.000.000 đồng đến 50.000.000 đồng đối với cá nhân, từ 80.000.000 đồng đến 100.000.000 đồng đối với tổ chức kinh doanh vận tải, dịch vụ hỗ trợ vận tải tái phạm hành vi quy định tại điểm a, điểm h khoản 7 Điều này.\n\n12. Ngoài việc bị phạt tiền, cá nhân, tổ chức thực hiện hành vi vi phạm quy định tại điểm c khoản 2; điểm a, điểm b, điểm đ, điểm g khoản 4; điểm b, điểm c, điểm d, điểm đ, điểm e, điểm g khoản 7; điểm c khoản 8 Điều này còn bị áp dụng các hình thức xử phạt bổ sung tước quyền sử dụng phù hiệu từ 01 tháng đến 03 tháng (nếu có hoặc đã được cấp) đối với xe vi phạm.\n\n13. Ngoài việc bị áp dụng hình thức xử phạt, cá nhân, tổ chức thực hiện hành vi vi phạm còn bị áp dụng các biện pháp khắc phục hậu quả sau đây:\n\na) Thực hiện hành vi quy định tại điểm a khoản 4 Điều này buộc cấp thẻ nhận dạng lái xe cho lái xe theo quy định;\n\nb) Thực hiện hành vi quy định tại điểm b, điểm c, điểm d khoản 4; điểm a khoản 8 Điều này buộc tổ chức tập huấn, hướng dẫn nghiệp vụ, quy trình hoặc tổ chức khám sức khỏe định kỳ cho lái xe và nhân viên phục vụ trên xe theo quy định;\n\nc) Thực hiện hành vi quy định tại điểm đ, điểm e khoản 4; điểm c, điểm g khoản 7 Điều này buộc lắp đặt thiết bị giám sát hành trình, thiết bị ghi nhận hình ảnh người lái xe, dây đai an toàn, ghế ngồi cho trẻ em mầm non, học sinh tiểu học trên xe theo đúng quy định;\n\nd) Thực hiện hành vi quy định tại điểm a, điểm h khoản 7; khoản 11 Điều này buộc cung cấp, cập nhật, truyền dẫn, lưu trữ, quản lý thông tin, dữ liệu thu thập từ thiết bị giám sát hành trình, thiết bị ghi nhận hình ảnh người lái xe lắp trên xe ô tô theo quy định;\n\nđ) Thực hiện hành vi quy định tại điểm c, điểm d khoản 6 Điều này buộc thực hiện đúng quy định về màu sơn, biển báo dấu hiệu nhận biết của xe.\n\n14. Ngoài việc bị áp dụng hình thức xử phạt, người điều khiển phương tiện thực hiện hành vi vi phạm còn bị trừ điểm giấy phép lái xe như sau:\n\na) Thực hiện hành vi quy định tại điểm đ khoản 2; điểm b, điểm c, điểm d khoản 6; điểm b, điểm c, điểm e, điểm i khoản 7 Điều này trong trường hợp cá nhân kinh doanh vận tải là người trực tiếp điều khiển phương tiện còn bị trừ điểm giấy phép lái xe 02 điểm;\n\nb) Thực hiện hành vi quy định tại điểm c khoản 8 Điều này trong trường hợp cá nhân kinh doanh vận tải là người trực tiếp điều khiển phương tiện còn bị trừ điểm giấy phép lái xe 06 điểm.\n\nĐiều 27. Xử phạt, trừ điểm giấy phép lái xe của người điều khiển xe ô tô kinh doanh vận tải chở trẻ em mầm non, học sinh, xe ô tô kinh doanh vận tải kết hợp với hoạt động đưa đón trẻ em mầm non, học sinh\n\n1. Phạt tiền từ 1.000.000 đồng đến 2.000.000 đồng đối với người điều khiển xe ô tô kinh doanh vận tải chở trẻ em mầm non, học sinh, xe ô tô kinh doanh vận tải kết hợp với hoạt động đưa đón trẻ em mầm non, học sinh thực hiện một trong các hành vi vi phạm sau đây:\n\na) Không hướng dẫn trẻ em mầm non, học sinh ngồi đúng vị trí quy định trong xe;\n\nb) Điều khiển xe ô tô kinh doanh vận tải chở trẻ em mầm non, học sinh tiểu học, xe ô tô kinh doanh vận tải kết hợp với hoạt động đưa đón trẻ em mầm non, học sinh tiểu học không có dây đai an toàn phù hợp với lứa tuổi hoặc không có ghế ngồi phù hợp với lứa tuổi theo quy định;\n\nc) Điều khiển xe không lắp thiết bị ghi nhận hình ảnh người lái xe hoặc có lắp thiết bị ghi nhận hình ảnh người lái xe nhưng không có tác dụng trong quá trình xe tham gia giao thông theo quy định hoặc làm sai lệch dữ liệu của thiết bị ghi nhận hình ảnh người lái xe lắp trên xe ô tô.\n\n2. Phạt tiền từ 2.000.000 đồng đến 3.000.000 đồng đối với hành vi điều khiển xe ô tô kinh doanh vận tải chở trẻ em mầm non, học sinh tiểu học, xe ô tô kinh doanh vận tải kết hợp với hoạt động đưa đón trẻ em mầm non, học sinh tiểu học không có hoặc không đủ người quản lý trên mỗi xe ô tô theo quy định tại khoản 3 Điều 46 của Luật Trật tự, an toàn giao thông đường bộ.\n\n3. Phạt tiền từ 3.000.000 đồng đến 5.000.000 đồng đối với người điều khiển xe ô tô kinh doanh vận tải chở trẻ em mầm non, học sinh, xe ô tô kinh doanh vận tải kết hợp với hoạt động đưa đón trẻ em mầm non, học sinh thực hiện một trong các hành vi vi phạm sau đây:']","**Nguồn văn bản:** /content/drive/MyDrive/ITProject_data/new_law/168_2024_ND-CP_619502.docx

**Tên văn bản:**  (Tên văn bản không được cung cấp trong metadata)

**Điều:** (Điều không được cung cấp trong metadata)


**Nội dung:**

Tôi xin lỗi, nhưng văn bản được cung cấp tập trung vào các quy định về xử phạt vi phạm hành chính liên quan đến hoạt động kinh doanh vận tải bằng ô tô, đặc biệt là việc sử dụng thiết bị giám sát hành trình và ghi hình người lái xe.  Văn bản không đề cập đến quy định cụ thể nào về việc sử dụng xe ô tô cá nhân trong giờ cao điểm.


Tóm lại: Văn bản không chứa thông tin liên quan đến quy định về việc sử dụng xe ô tô cá nhân trong giờ cao điểm.
",Hạn chế xe ô tô cá nhân lưu thông trong một số khu vực trung tâm thành phố trong giờ cao điểm để giảm ùn tắc giao thông.,0.6,0.0,0.0,0.0
33,Quy định mới về việc sử dụng xe ô tô điện là gì?,"['BỘ GIAO THÔNG VẬN TẢI\n-------- CỘNG HÒA XÃ HỘI CHỦ NGHĨA VIỆT NAM\nĐộc lập - Tự do - Hạnh phúc \n--------------- Số: 53/2024/TT-BGTVT Hà Nội, ngày 15 tháng 11 năm 2024\n\nTHÔNG TƯ\n\nQUY ĐỊNH VỀ PHÂN LOẠI PHƯƠNG TIỆN GIAO THÔNG ĐƯỜNG BỘ VÀ DẤU HIỆU NHẬN BIẾT XE CƠ GIỚI SỬ DỤNG NĂNG LƯỢNG SẠCH, NĂNG LƯỢNG XANH, THÂN THIỆN MÔI TRƯỜNG\n\nCăn cứ Luật Trật tự, an toàn giao thông đường bộ ngày 27 tháng 6 năm 2024;\n\nCăn cứ Nghị định số 56/2022/NĐ-CP ngày 24 tháng 8 năm 2022 của Chính phủ quy định chức năng, nhiệm vụ, quyền hạn và cơ cấu tổ chức của Bộ Giao thông vận tải;\n\nTheo đề nghị của Vụ trưởng Vụ Khoa học - Công nghệ và Môi trường và Cục trưởng Cục Đăng kiểm Việt Nam;\n\nBộ trưởng Bộ Giao thông vận tải ban hành Thông tư quy định về phân loại phương tiện giao thông đường bộ và dấu hiệu nhận biết xe cơ giới sử dụng năng lượng sạch, năng lượng xanh, thân thiện môi trường.\n\nChương I\n\nQUY ĐỊNH CHUNG\n\nĐiều 1. Phạm vi điều chỉnh\n\nThông tư quy định về phân loại phương tiện giao thông đường bộ và dấu hiệu nhận biết xe cơ giới sử dụng năng lượng sạch, năng lượng xanh, thân thiện môi trường.\n\nĐiều 2. Đối tượng áp dụng\n\nThông tư này áp dụng đối với các tổ chức, cá nhân có liên quan đến phân loại phương tiện giao thông đường bộ, dấu hiệu nhận biết xe cơ giới sử dụng năng lượng sạch, năng lượng xanh, thân thiện môi trường.\n\nĐiều 3. Giải thích từ ngữ\n\nTrong Thông tư này, các cụm từ dưới đây được hiểu như sau:\n\n1. Hệ thống truyền động điện (Electric powertrain) là hệ thống bao gồm một hoặc nhiều: thiết bị tích trữ điện năng (ắc quy, pin, bánh đà điện cơ hoặc siêu tụ); thiết bị ổn định điện năng; thiết bị điện được sử dụng để chuyển đổi điện năng tích trữ thành cơ năng truyền tới các bánh xe làm nguồn động lực cho xe chuyển động;\n\n2. Xe thuần điện (PEV - Pure electric vehicle hoặc BEV - Battery electric vehicle) là xe cơ giới sử dụng hệ thống truyền động điện;\n\n3. Xe điện dùng pin nhiên liệu thuần túy (PFCEV - Pure fuel cell electric vehicle hoặc FCEV - Fuel cell electric vehicle) là xe cơ giới điện sử dụng pin nhiên liệu thuần túy, trong đó hệ thống pin nhiên liệu là nguồn năng lượng duy nhất trên xe cho hệ thống động lực của xe;\n\n4. Hệ thống truyền động hybrid điện (Hybrid electric powertrain) là hệ truyền động tiêu thụ năng lượng từ cả hai nguồn năng lượng được tích trữ trên xe, gồm nhiên liệu và thiết bị tích trữ điện năng;\n\n5. Xe hybrid điện (HEV - Hybrid electric vehicle) là xe cơ giới được dẫn động bằng hệ thống truyền động hybrid điện (bao gồm cả xe sử dụng nhiên liệu tiêu thụ chỉ để nạp điện cho thiết bị tích trữ điện năng), gồm có:\n\n\n\na) Xe hybrid điện nhẹ (MHEV - Mild hybrid electric vehicle) là xe hybrid điện; động cơ (mô-tơ) điện có chức năng hỗ trợ động cơ đốt trong khởi động, hỗ trợ tăng tốc, phanh tái tạo và cung cấp năng lượng cho hệ thống phụ trợ. Xe không có khả năng nạp điện được từ nguồn điện bên ngoài;\n\nb) Xe hybrid điện hoàn toàn (FHEV- Full hybrid electric vehicle hoặc SHEV\n\nStrong hybrid electric vehicle) là xe hybrid điện có khả năng di chuyển hoàn toàn chỉ bằng năng lượng điện trong những điều kiện nhất định (như bắt đầu di chuyển từ trạng thái đứng yên, di chuyển ở tốc độ thấp...). Xe không có khả năng nạp điện được từ nguồn điện bên ngoài;\n\nc) Xe hybrid nạp điện ngoài (PHEV - Plug-in hybrid electric vehicle) là xe hybrid điện có khả năng nạp điện được từ nguồn điện bên ngoài.\n\nChương II\n\nPHÂN LOẠI PHƯƠNG TIỆN GIAO THÔNG ĐƯỜNG BỘ THEO MỤC ĐÍCH SỬ DỤNG\n\nĐiều 4. Xe cơ giới\n\nXe cơ giới quy định tại khoản 1 Điều 34 Luật Trật tự, an toàn giao thông đường bộ gồm:\n\n1. Xe ô tô được phân loại như sau:\n\na) Xe ô tô chở người là các loại ô tô có kết cấu và trang bị chủ yếu dùng để chở người, hành lý mang theo. Ô tô chở người cũng có thể kéo theo một rơ moóc. Các loại ô tô chở người gồm:\n\nÔ tô chở người đến 08 chỗ (không kể chỗ của người lái xe) gồm các loại quy định tại Phụ lục I ban hành kèm theo Thông tư này;\n\nÔ tô chở người trên 08 chỗ (không kể chỗ của người lái xe) gồm các loại quy định tại Phụ lục II ban hành kèm theo Thông tư này;\n\nÔ tô chở người chuyên dùng là ô tô chở người có đặc điểm khác với đặc điểm của các loại ô tô chở người nêu trên, có kết cấu và trang bị để chở người trong điều kiện đặc biệt hoặc chở người với sự sắp xếp đặc biệt, gồm các loại quy định tại Phụ lục III ban hành kèm theo Thông tư này;\n\nb) Ô tô chở hàng là các loại ô tô có kết cấu và trang bị chủ yếu dùng để chở hàng. Ô tô chở hàng có thể bố trí tối đa hai hàng ghế và chở không quá 06 người kể cả người lái trong cabin. Ô tô chở hàng cũng có thể kéo theo một rơ moóc. Các loại ô tô chở hàng gồm:\n\nÔ tô tải thông dụng gồm các loại quy định tại Phụ lục IV ban hành kèm theo Thông tư này;\n\nÔ tô tải chuyên dùng bao gồm các loại ô tô chở hàng có kết cấu và trang bị để chở hàng hóa cần sự sắp xếp đặc biệt gồm các loại quy định tại Phụ lục V ban hành kèm theo Thông tư này;\n\nc) Ô tô chuyên dùng là các loại ô tô có kết cấu và trang bị để thực hiện một chức năng, công dụng đặc biệt khác với các loại ô tô nêu tại điểm a và điểm b khoản này. Ô tô chuyên dùng gồm các loại ô tô quy định tại Phụ lục VI ban hành kèm theo Thông tư này;\n\nd) Ô tô đầu kéo là ô tô được thiết kế để kéo sơ mi rơ moóc và có các trang, thiết bị gồm: cơ cấu mâm kéo (fifth-wheel coupling); cơ cấu kết nối và điều khiển hệ thống đèn tín hiệu và hệ thống phanh của sơ mi rơ moóc; có thể trang bị cần cẩu, máy phát điện, cơ cấu móc kéo (tow coupling, hook coupling) để kéo rơ moóc;\n\nđ) Ô tô kéo moóc là ô tô được thiết kế dành riêng hoặc chủ yếu dùng để kéo rơ moóc và có các trang, thiết bị gồm: cơ cấu móc kéo (tow coupling, hook coupling); thùng hoặc sàn chất phụ tải; cơ cấu kết nối và điều khiển hệ thống đèn tín hiệu và hệ thống phanh của rơ moóc;\n\nÔ tô kéo moóc không bao gồm: ô tô chở hàng có trang bị cơ cấu móc kéo; ô tô đầu kéo trang bị thêm cơ cấu móc kéo.\n\n2. Rơ moóc được phân loại theo quy định tại Phụ lục VII ban hành kèm theo Thông tư này.\n\n\n\n3. Sơ mi rơ moóc được phân loại theo quy định tại Phụ lục VIII ban hành kèm theo Thông tư này.\n\n4. Xe chở người bốn bánh có gắn động cơ được phân loại như sau:\n\na) Xe chở người bốn bánh có gắn động cơ tham gia giao thông công cộng là xe được thiết kế để hoạt động trên đường giao thông công cộng;\n\nb) Xe chở người bốn bánh có gắn động cơ hoạt động trên đường chuyên dùng, nội bộ là xe được thiết kế chỉ để hoạt động trên đường chuyên dùng, đường nội bộ.\n\n5. Xe chở hàng bốn bánh có gắn động cơ.\n\n6. Xe mô tô được phân loại như sau:\n\na) Xe mô tô hai bánh;\n\nb) Xe mô tô ba bánh chở người;\n\nc) Xe mô tô ba bánh chở hàng;\n\nd) Xe mô tô ba bánh dùng cho người khuyết tật.\n\n7. Xe gắn máy được phân loại như sau:\n\na) Xe gắn máy hai bánh;\n\nb) Xe gắn máy ba bánh chở người;\n\nc) Xe gắn máy ba bánh chở hàng;\n\nd) Xe gắn máy ba bánh dùng cho người khuyết tật.\n\nĐiều 5. Xe máy chuyên dùng\n\nXe máy chuyên dùng được phân loại như sau:\n\n1. Xe máy thi công được phân loại theo quy định tại Phụ lục IX ban hành kèm theo Thông tư này;\n\n2. Xe máy nông nghiệp, lâm nghiệp là xe máy chuyên dùng chỉ phục vụ trong nông nghiệp, lâm nghiệp;\n\n3. Máy kéo;\n\n4. Rơ moóc, sơ mi rơ moóc được kéo bởi máy kéo: Rơ moóc, sơ mi rơ moóc được thiết kế, chế tạo chỉ để kéo bởi máy kéo;\n\n5. Xe máy thực hiện chức năng, công dụng đặc biệt được phân loại theo quy định tại Phụ lục X ban hành kèm theo Thông tư này;\n\n6. Các loại xe đặc chủng sử dụng vào mục đích quốc phòng, an ninh có tham gia giao thông đường bộ.\n\nĐiều 6. Xe thô sơ\n\nXe thô sơ gồm các loại xe được quy định tại khoản 2 Điều 34 Luật Trật tự, an toàn giao thông đường bộ.\n\nChương III\n\nPHÂN LOẠI XE CƠ GIỚI THEO MỨC ĐỘ TỰ ĐỘNG HÓA\n\nĐiều 7. Phương tiện giao thông thông thường\n\nPhương tiện giao thông thông thường là xe cơ giới mà người lái thực hiện toàn bộ các nhiệm vụ điều khiển chuyển động của xe ngay cả khi được hỗ trợ bởi các hệ thống an toàn chủ động trên xe.\n\nĐiều 8. Phương tiện giao thông thông minh']","**Nguồn văn bản:** /content/drive/MyDrive/ITProject_data/new_law/53_2024_TT-BGTVT_624420.docx

**Tên văn bản:** THÔNG TƯ QUY ĐỊNH VỀ PHÂN LOẠI PHƯƠNG TIỆN GIAO THÔNG ĐƯỜNG BỘ VÀ DẤU HIỆU NHẬN BIẾT XE CƠ GIỚI SỬ DỤNG NĂNG LƯỢNG SẠCH, NĂNG LƯỢNG XANH, THÂN THIỆN MÔI TRƯỜNG

**Nội dung:**

Thông tư này tập trung vào phân loại phương tiện giao thông đường bộ và dấu hiệu nhận biết xe cơ giới sử dụng năng lượng sạch, năng lượng xanh, thân thiện môi trường.  Nội dung liên quan đến ô tô điện được đề cập trong phần định nghĩa:

* **Xe thuần điện (PEV hoặc BEV):** Là xe cơ giới sử dụng hệ thống truyền động điện.

* **Xe điện dùng pin nhiên liệu thuần túy (PFCEV hoặc FCEV):** Là xe cơ giới điện sử dụng pin nhiên liệu thuần túy, hệ thống pin nhiên liệu là nguồn năng lượng duy nhất cho hệ thống động lực.

* **Xe hybrid điện (HEV):** Là xe cơ giới được dẫn động bằng hệ thống truyền động hybrid điện (bao gồm cả xe sử dụng nhiên liệu tiêu thụ chỉ để nạp điện cho thiết bị tích trữ điện năng).  Bao gồm các loại:

    a) Xe hybrid điện nhẹ (MHEV): Động cơ điện hỗ trợ động cơ đốt trong khởi động, hỗ trợ tăng tốc, phanh tái tạo và cung cấp năng lượng cho hệ thống phụ trợ.  Không có khả năng nạp điện từ nguồn điện bên ngoài.

    b) Xe hybrid điện hoàn toàn (FHEV hoặc SHEV): Có khả năng di chuyển hoàn toàn bằng năng lượng điện trong một số điều kiện nhất định. Không có khả năng nạp điện từ nguồn điện bên ngoài.

    c) Xe hybrid nạp điện ngoài (PHEV): Có khả năng nạp điện từ nguồn điện bên ngoài.


Thông tư cũng phân loại ô tô nói chung, bao gồm ô tô chở người, ô tô chở hàng, ô tô chuyên dùng, ô tô đầu kéo và ô tô kéo moóc. Tuy nhiên, chi tiết cụ thể về quy định vận hành, đăng ký, hay các quy định khác liên quan đến ô tô điện không được đề cập trong đoạn văn bản này.


Tóm lại: Văn bản cung cấp định nghĩa về các loại xe điện (thuần điện, điện dùng pin nhiên liệu, hybrid điện) nhưng không đề cập đến các quy định cụ thể về việc sử dụng xe ô tô điện.
",Khuyến khích sử dụng xe ô tô điện bằng cách miễn phí đỗ xe tại một số khu vực và giảm thuế trước bạ.,0.9333333333333333,0.5980037760153764,0.0,0.0
34,Luật Giao thông Đường bộ 2025 có quy định gì về việc sử dụng xe ô tô tự lái?,"['5. Đua xe, tổ chức đua xe, xúi giục, giúp sức, cổ vũ đua xe trái phép; điều khiển phương tiện tham gia giao thông đường bộ lạng lách, đánh võng, rú ga liên tục.\n\n6. Dùng tay cầm và sử dụng điện thoại hoặc thiết bị điện tử khác khi điều khiển phương tiện tham gia giao thông đang di chuyển trên đường bộ.\n\n7. Giao xe cơ giới, xe máy chuyên dùng cho người không đủ điều kiện theo quy định của pháp luật để điều khiển xe tham gia giao thông đường bộ.\n\n8. Đưa xe cơ giới, xe máy chuyên dùng không bảo đảm quy định của pháp luật về an toàn kỹ thuật và bảo vệ môi trường, phương tiện khác không đủ điều kiện theo quy định của pháp luật để tham gia giao thông đường bộ.\n\n9. Nhập khẩu, sản xuất, lắp ráp xe cơ giới, xe máy chuyên dùng không bảo đảm quy định của pháp luật về chất lượng an toàn kỹ thuật và bảo vệ môi trường.\n\n10. Cải tạo xe ô tô loại khác thành xe ô tô chở người, trừ cải tạo thành xe ô tô chở người phục vụ mục đích quốc phòng, an ninh.\n\n11. Cải tạo trái phép; cố ý can thiệp làm sai lệch chỉ số trên đồng hồ báo quãng đường đã chạy của xe ô tô; cắt, hàn, tẩy xóa, đục sửa, đóng lại trái phép số khung, số động cơ của xe cơ giới, xe máy chuyên dùng.\n\n12. Cố ý can thiệp, thay đổi phần mềm điều khiển của xe, động cơ của xe đã được đăng ký với cơ quan quản lý, nhằm mục đích gian lận kết quả kiểm tra, thử nghiệm, kiểm định; thuê, mượn phụ tùng xe cơ giới chỉ để thực hiện việc kiểm định.\n\n13. Chở hàng hóa vượt quá khối lượng toàn bộ, tải trọng trục, kích thước cho phép của xe hoặc vượt quá tải trọng, kích thước giới hạn cho phép của đường bộ khi chưa được cơ quan quản lý cấp phép hoặc không bảo đảm yêu cầu theo quy định của Luật này; chở hàng hóa trên xe có quy định phải chằng buộc nhưng không chằng buộc hoặc chằng buộc không đúng quy định của pháp luật; chở quá số người theo quy định của pháp luật.\n\n14. Vận chuyển hàng hóa cấm lưu hành, vận chuyển trái phép hoặc không thực hiện đầy đủ các quy định của pháp luật về vận chuyển hàng hóa nguy hiểm, động vật hoang dã.\n\n15. Đe dọa, xúc phạm, tranh giành, lôi kéo hành khách; đe doạ, cưỡng ép hành khách sử dụng dịch vụ ngoài ý muốn; chuyển tải, xuống khách hoặc các hành vi khác nhằm trốn tránh phát hiện xe chở quá tải, quá số người theo quy định của pháp luật. \n\n16. Lắp đặt, sử dụng thiết bị âm thanh, ánh sáng trên xe cơ giới, xe máy chuyên dùng gây mất trật tự, an toàn giao thông đường bộ.\n\n17. Sản xuất, sử dụng, mua, bán trái phép biển số xe; điều khiển xe cơ giới, xe máy chuyên dùng gắn biển số xe không do cơ quan nhà nước có thẩm quyền cấp, gắn biển số xe không đúng vị trí; bẻ cong, che lấp biển số xe; làm thay đổi chữ, số, màu sắc, hình dạng, kích thước của biển số xe.\n\n18. Làm gián đoạn hoạt động hoặc làm sai lệch dữ liệu của thiết bị giám sát hành trình, camera lắp trên xe theo quy định của Luật này.\n\n19. Hủy hoại, làm hư hỏng, làm mất tác dụng thiết bị điều khiển, giám sát giao thông đường bộ, thiết bị thông minh hỗ trợ chỉ huy, điều khiển giao thông đường bộ.\n\n20. Đặt, để chướng ngại vật, vật cản khác trái phép trên đường bộ; rải vật sắc nhọn, đổ chất gây trơn trượt trên đường bộ; làm rơi vãi đất đá, hàng hóa, vật liệu xây dựng, phế thải trên đường bộ; đổ, xả thải, làm rơi vãi hóa chất, chất thải gây mất an toàn giao thông đường bộ.\n\n21. Cản trở người, phương tiện tham gia giao thông trên đường bộ; ném gạch, đất, đá, cát hoặc vật thể khác vào người, phương tiện đang tham gia giao thông trên đường bộ.\n\n22. Lợi dụng, lạm dụng nhiệm vụ bảo đảm trật tự, an toàn giao thông đường bộ để thực hiện hành vi vi phạm pháp luật, nhũng nhiễu, xâm phạm lợi ích của Nhà nước, quyền và lợi ích hợp pháp của tổ chức, cá nhân.\n\n23. Lợi dụng chức vụ, quyền hạn, nghề nghiệp của bản thân hoặc người khác để vi phạm pháp luật về trật tự, an toàn giao thông đường bộ hoặc can thiệp, tác động vào quá trình xử lý vi phạm pháp luật về trật tự, an toàn giao thông đường bộ.\n\n24. Sử dụng quyền của xe ưu tiên khi không thực hiện nhiệm vụ theo quy định của pháp luật; lắp đặt, sử dụng thiết bị phát tín hiệu ưu tiên không đúng quy định của pháp luật.\n\n25. Không khai báo, khai báo gian dối hoặc cung cấp thông tin, tài liệu không đúng sự thật để trốn tránh trách nhiệm khi bị phát hiện vi phạm pháp luật về trật tự, an toàn giao thông đường bộ.\n\n26. Bỏ trốn sau khi gây tai nạn giao thông đường bộ để trốn tránh trách nhiệm; khi có điều kiện mà cố ý không cứu giúp người bị tai nạn giao thông đường bộ; xâm phạm tính mạng, sức khỏe, tài sản của người bị nạn, người gây tai nạn giao thông đường bộ hoặc người giúp đỡ, cứu chữa, đưa người bị nạn đi cấp cứu; lợi dụng việc xảy ra tai nạn giao thông đường bộ để hành hung, đe dọa, xúi giục, gây sức ép, làm mất trật tự, cản trở việc xử lý tai nạn giao thông đường bộ.\n\n27. Điều khiển vật thể bay, tàu bay không người lái, phương tiện bay siêu nhẹ hoạt động trong phạm vi khổ giới hạn đường bộ gây cản trở hoặc nguy cơ mất an toàn cho người, phương tiện tham gia giao thông đường bộ, trừ tàu bay không người lái, phương tiện bay siêu nhẹ được cấp phép bay.\n\n28. Hành vi khác vi phạm quy tắc giao thông đường bộ quy định tại Chương II của Luật này.\n\nChương II\n\nQUY TẮC GIAO THÔNG ĐƯỜNG BỘ\n\nĐiều 10. Quy tắc chung\n\n1. Người tham gia giao thông đường bộ phải đi bên phải theo chiều đi của mình, đi đúng làn đường, phần đường quy định, chấp hành báo hiệu đường bộ và các quy tắc giao thông đường bộ khác.\n\n2. Người lái xe và người được chở trên xe ô tô phải thắt dây đai an toàn tại những chỗ có trang bị dây đai an toàn khi tham gia giao thông đường bộ.\n\n3. Khi chở trẻ em dưới 10 tuổi và chiều cao dưới 1,35 mét trên xe ô tô không được cho trẻ em ngồi cùng hàng ghế với người lái xe, trừ loại xe ô tô chỉ có một hàng ghế; người lái xe phải sử dụng, hướng dẫn sử dụng thiết bị an toàn phù hợp cho trẻ em.\n\nĐiều 11. Chấp hành báo hiệu đường bộ\n\n1. Báo hiệu đường bộ bao gồm: hiệu lệnh của người điều khiển giao thông; đèn tín hiệu giao thông; biển báo hiệu đường bộ; vạch kẻ đường và các dấu hiệu khác trên mặt đường; cọc tiêu, tường bảo vệ, rào chắn, đinh phản quang, tiêu phản quang, cột Km, cọc H; thiết bị âm thanh báo hiệu đường bộ.\n\n2. Người tham gia giao thông đường bộ phải chấp hành báo hiệu đường bộ theo thứ tự ưu tiên từ trên xuống dưới như sau: \n\na) Hiệu lệnh của người điều khiển giao thông;\n\nb) Tín hiệu đèn giao thông;\n\nc) Biển báo hiệu đường bộ;\n\nd) Vạch kẻ đường và các dấu hiệu khác trên mặt đường;\n\nđ) Cọc tiêu, tường bảo vệ, rào chắn, đinh phản quang, tiêu phản quang,\ncột Km, cọc H;\n\ne) Thiết bị âm thanh báo hiệu đường bộ.\n\n3. Hiệu lệnh của người điều khiển giao thông được quy định như sau:\n\na) Tay bên phải giơ thẳng đứng để báo hiệu cho người tham gia giao thông đường bộ ở tất cả các hướng phải dừng lại;\n\nb) Hai tay hoặc một tay dang ngang để báo hiệu cho người tham gia giao thông đường bộ ở phía trước và ở phía sau người điều khiển giao thông phải dừng lại; người tham gia giao thông đường bộ ở phía bên phải và bên trái người điều khiển giao thông được đi;\n\nc) Tay bên phải giơ về phía trước để báo hiệu cho người tham gia giao thông đường bộ ở phía sau và bên phải người điều khiển giao thông phải dừng lại; người tham gia giao thông đường bộ ở phía trước người điều khiển giao thông được rẽ phải; người tham gia giao thông đường bộ ở phía bên trái người điều khiển giao thông được đi tất cả các hướng; người đi bộ qua đường phải đi sau lưng người điều khiển giao thông.\n\n4. Tín hiệu đèn giao thông có 03 màu, gồm: màu xanh, màu vàng, màu đỏ; có hiển thị thời gian hoặc không hiển thị thời gian. Người tham gia giao thông đường bộ phải chấp hành như sau:\n\na) Tín hiệu đèn màu xanh là được đi; trường hợp người đi bộ, xe lăn của người khuyết tật đang đi ở lòng đường, người điều khiển phương tiện tham gia giao thông đường bộ phải giảm tốc độ hoặc dừng lại nhường đường cho người đi bộ, xe lăn của người khuyết tật qua đường;']","**Nguồn văn bản:** /content/drive/MyDrive/ITProject_data/new_law/36_2024_QH15_444251.docx

**Tên văn bản:** Không có thông tin

**Điều:** Không có thông tin

**Nội dung:**

Tôi xin lỗi, nhưng văn bản được cung cấp không chứa thông tin về quy định sử dụng xe ô tô tự lái trong Luật Giao thông Đường bộ.  Văn bản tập trung vào các hành vi vi phạm luật giao thông và quy tắc giao thông đường bộ, không đề cập đến công nghệ xe tự lái.

Tóm lại: Không tìm thấy thông tin về quy định sử dụng xe ô tô tự lái trong văn bản được cung cấp.
",Xe ô tô tự lái phải được cấp phép và đáp ứng các tiêu chuẩn an toàn kỹ thuật trước khi tham gia giao thông.,1.0,0.0,0.0,0.0
35,Quy định mới về việc sử dụng xe máy phân khối lớn trong khu vực đô thị là gì?,"['BỘ GIAO THÔNG VẬN TẢI\n------- CỘNG HÒA XÃ HỘI CHỦ NGHĨA VIỆT NAM\nĐộc lập - Tự do - Hạnh phúc \n--------------- Số: 52/2024/TT-BGTVT Hà Nội, ngày 15 tháng 11 năm 2024\n\nTHÔNG TƯ\n\nQUY ĐỊNH VỀ YÊU CẦU KỸ THUẬT ĐỐI VỚI XE CƠ GIỚI, XE MÁY CHUYÊN DÙNG THUỘC ĐỐI TƯỢNG NGHIÊN CỨU PHÁT TRIỂN CÓ NHU CẦU THAM GIA GIAO THÔNG ĐƯỜNG BỘ \n\nCăn cứ Luật Trật tự, an toàn giao thông đường bộ ngày 27 tháng 6 năm 2024; \n\nCăn cứ Nghị định số 56/2022/NĐ-CP ngày 24 tháng 8 năm 2022 của Chính phủ quy định chức năng, nhiệm vụ, quyền hạn và cơ cấu tổ chức của Bộ Giao thông vận tải; \n\nTheo đề nghị của Vụ trưởng Vụ Khoa học - Công nghệ và Môi trường và Cục trưởng Cục Đăng kiểm Việt Nam; \n\nBộ trưởng Bộ Giao thông vận tải ban hành Thông tư quy định về yêu cầu kỹ thuật đối với xe cơ giới, xe máy chuyên dùng thuộc đối tượng nghiên cứu phát triển có nhu cầu tham gia giao thông đường bộ. \n\nĐiều 1. Phạm vi điều chỉnh \n\nThông tư này quy định về yêu cầu kỹ thuật đối với xe cơ giới, xe máy chuyên dùng thuộc đối tượng nghiên cứu phát triển có nhu cầu tham gia giao thông đường bộ. \n\nĐiều 2. Đối tượng áp dụng \n\nThông tư này áp dụng đối với cơ sở nghiên cứu phát triển xe cơ giới, xe máy chuyên dùng thuộc đối tượng nghiên cứu phát triển có nhu cầu tham gia giao thông đường bộ và các tổ chức, cá nhân có liên quan. \n\nĐiều 3. Giải thích từ ngữ \n\nTrong Thông tư này các từ ngữ dưới đây được hiểu như sau: \n\n1. Xe cơ giới, xe máy chuyên dùng thuộc đối tượng nghiên cứu phát triển có nhu cầu tham gia giao thông đường bộ (sau đây gọi tắt là xe nghiên cứu phát triển) là các loại xe được phân loại theo quy định của Bộ trưởng Bộ Giao thông vận tải, chưa được chứng nhận chất lượng an toàn kỹ thuật và bảo vệ môi trường nhưng có nhu cầu tham gia giao thông đường bộ để đánh giá về độ bền, khả năng thích nghi của xe đối với các yếu tố thời tiết, môi trường, điều kiện giao thông \n\n\n\ntại Việt Nam hoặc nhằm mục đích cải tiến chất lượng an toàn kỹ thuật và bảo vệ môi trường của sản phẩm. \n\n2. Chạy thử trên đường là việc xe nghiên cứu phát triển tham gia giao thông đường bộ. \n\n3. Cơ sở nghiên cứu phát triển là doanh nghiệp sản xuất, lắp ráp xe trong nước đã được đánh giá việc bảo đảm chất lượng an toàn kỹ thuật và bảo vệ môi trường đạt yêu cầu theo quy định của pháp luật. \n\n4. Phụ tùng chưa qua sử dụng là các tổng thành, hệ thống, chi tiết của xe chưa được sử dụng để sản xuất, lắp ráp xe hoặc sử dụng với bất kỳ mục đích nào khác. \n\n5. Xe chưa qua sử dụng là xe chưa được đăng ký lưu hành hoặc chưa được đưa vào sử dụng với bất kỳ mục đích nào khác. \n\n6. Kiểm tra chất lượng xuất xưởng là việc cơ sở nghiên cứu phát triển kiểm tra các hệ thống an toàn kỹ thuật của xe nghiên cứu phát triển theo tiêu chuẩn của nhà sản xuất. \n\n7. Phiếu kiểm tra chất lượng xuất xưởng là tài liệu của cơ sở nghiên cứu phát triển cấp cho từng xe nghiên cứu phát triển theo mẫu quy định tại Phụ lục ban hành kèm theo Thông tư này và được in trên phôi phiếu kiểm tra chất lượng xuất xưởng của xe sản xuất, lắp ráp trong nước. \n\n8. Tải trọng giả là tải trọng giả lập, sử dụng để kiểm tra khả năng chịu tải và hoạt động của xe trong các điều kiện khác nhau, nhằm mục đích đánh giá về chất lượng an toàn kỹ thuật và hiệu quả của xe, bao gồm: khối bê tông, khối hoặc tấm kim loại, thùng nước, bao cát, thiết bị mô phỏng tải trọng. \n\n9. Tổ chức có thẩm quyền nước ngoài là tổ chức chứng nhận hoặc tổ chức dịch vụ kỹ thuật thuộc danh sách niêm yết của các nước thành viên tham gia điều ước quốc tế liên quan đến phương tiện giao thông đường bộ mà Việt Nam là thành viên. \n\nĐiều 4. Yêu cầu kỹ thuật chung \n\n1. Xe nghiên cứu phát triển phải là xe thuộc một trong các trường hợp sau: \n\na) Được sản xuất, lắp ráp từ phụ tùng chưa qua sử dụng; \n\nb) Được cải tiến, thay đổi từ xe chưa qua sử dụng và sử dụng phụ tùng chưa qua sử dụng để cải tiến, thay đổi; \n\nc) Được cải tiến, thay đổi từ xe nghiên cứu phát triển đang trong quá trình chạy thử và sử dụng phụ tùng chưa qua sử dụng để cải tiến, thay đổi; \n\nd) Đã được chạy thử trên đường tại nước ngoài. \n\n2. Kích thước và khối lượng của xe phải tuân thủ quy định sau: \n\n\n\na) Đối với xe ô tô: quy chuẩn kỹ thuật quốc gia về chất lượng an toàn kỹ thuật và bảo vệ môi trường đối với xe ô tô; \n\nb) Đối với rơ moóc, sơ mi rơ moóc: quy chuẩn kỹ thuật quốc gia về chất lượng an toàn kỹ thuật và bảo vệ môi trường đối với rơ moóc, sơ mi rơ moóc; \n\nc) Đối với xe chở người bốn bánh có gắn động cơ: quy chuẩn kỹ thuật quốc gia về chất lượng an toàn kỹ thuật và bảo vệ môi trường đối với xe chở người bốn bánh có gắn động cơ; \n\nd) Đối với xe chở hàng bốn bánh có gắn động cơ: quy chuẩn kỹ thuật quốc gia về chất lượng an toàn kỹ thuật và bảo vệ môi trường đối với xe chở hàng bốn bánh có gắn động cơ; \n\nđ) Đối với xe mô tô, xe gắn máy: quy chuẩn kỹ thuật quốc gia về chất lượng an toàn kỹ thuật và bảo vệ môi trường đối với xe mô tô, xe gắn máy; \n\ne) Đối với xe máy chuyên dùng (trừ rơ moóc, sơ mi rơ moóc được kéo bởi máy kéo): \n\nKích thước chiều dài toàn bộ của xe không được lớn hơn 12,2 m; \n\nKích thước chiều rộng toàn bộ của xe không được lớn hơn 2,5 m; \n\nKích thước chiều cao toàn bộ của xe không được lớn hơn 4,0 m; \n\nKhối lượng toàn bộ theo thiết kế và khối lượng toàn bộ theo thiết kế phân bố lên trục xe phải tuân thủ quy định tại quy chuẩn kỹ thuật quốc gia về chất lượng an toàn kỹ thuật và bảo vệ môi trường đối với xe máy chuyên dùng và không được vượt quá tải trọng của đường bộ. \n\ng) Đối với rơ moóc, sơ mi rơ moóc được kéo bởi máy kéo: \n\nKích thước chiều rộng toàn bộ của xe không được lớn hơn 2,5 m; \n\nKích thước chiều cao toàn bộ của xe không được lớn hơn 4,0 m; \n\nKhối lượng toàn bộ theo thiết kế và khối lượng toàn bộ theo thiết kế phân bố lên trục xe phải tuân thủ quy định tại quy chuẩn kỹ thuật quốc gia về chất lượng an toàn kỹ thuật và bảo vệ môi trường đối với xe máy chuyên dùng không được vượt quá tải trọng của đường bộ. \n\n3. Có tài liệu thiết kế, trong đó kết quả tính toán phải thể hiện xe phù hợp với quy định của quy chuẩn kỹ thuật quốc gia nêu tại khoản 2 Điều này. \n\n4. Các phụ tùng xe cơ giới bao gồm: pin lithium sử dụng làm nguồn dự trữ năng lượng trên xe (trường hợp xe sử dụng pin lithium làm nguồn năng lượng dự trữ), gương, đèn, kính, lốp, vành hợp kim phải thuộc kiểu loại đã được chứng nhận hoặc có kết quả thử nghiệm đạt yêu cầu tại Việt Nam hoặc của tổ chức có thẩm quyền nước ngoài. \n\n5. Trường hợp xe được dán hoặc sơn ngụy trang bên ngoài xe thì phải đảm bảo không làm che khuất tầm nhìn của người lái xe qua kính chắn gió, gương chiếu hậu, không ảnh hưởng tới chức năng, hoạt động của đèn chiếu sáng, tín hiệu, cửa thoát hiểm. \n\n6. Phải có dòng chữ “Xe chạy thử” phía trước và phía sau xe. Riêng đối với trường hợp rơ moóc và sơ mi rơ moóc được kéo bởi xe ô tô hoặc máy kéo thì dòng chữ “Xe chạy thử” phải được gắn phía trước xe kéo và phía sau xe được kéo. Kích thước, khoảng cách của dòng chữ “Xe chạy thử” được quy định như sau: chiều cao chữ cái không nhỏ hơn 60 mm, chiều rộng chữ cái không nhỏ hơn 35 mm, khoảng cách giữa các chữ cái là 15±5 mm. \n\n7. Xe ô tô, xe chở người bốn bánh có gắn động cơ, xe chở hàng bốn bánh có gắn động cơ, xe máy chuyên dùng (trừ rơ moóc, sơ mi rơ moóc được kéo bởi máy kéo), xe mô tô, gắn máy phải được trang bị thiết bị theo dõi hành trình đảm bảo ghi nhận được hành trình xe chạy, tốc độ xe chạy; camera hành trình đảm bảo ghi nhận hình ảnh phía trước và phía sau xe khi lưu thông trên đường (trừ xe mô tô, xe gắn máy camera hành trình đảm bảo ghi nhận hình ảnh phía trước xe). Các thiết bị này phải được hoạt động trong toàn bộ thời gian xe chạy thử trên đường. \n\n8. Xe phải được cơ sở nghiên cứu phát triển chạy thử trong đường nội bộ tối thiểu 10 km, kiểm tra xuất xưởng đạt yêu cầu và cấp Phiếu kiểm tra chất lượng xuất xưởng. \n\n9. Khi chất tải lên xe phải đảm bảo khối lượng toàn bộ của xe thực tế không được vượt quá khối lượng toàn bộ theo thiết kế của nhà sản xuất và đảm bảo các yêu cầu sau: \n\na) Số người trên xe không vượt quá số người tối đa cho phép chở, kể cả người lái xe quy định tại Điều 5 Thông tư này;']","**Nguồn văn bản:** /content/drive/MyDrive/ITProject_data/new_law/52_2024_TT-BGTVT_622845.docx

**Tên văn bản:** THÔNG TƯ QUY ĐỊNH VỀ YÊU CẦU KỸ THUẬT ĐỐI VỚI XE CƠ GIỚI, XE MÁY CHUYÊN DÙNG THUỘC ĐỐI TƯỢNG NGHIÊN CỨU PHÁT TRIỂN CÓ NHU CẦU THAM GIA GIAO THÔNG ĐƯỜNG BỘ

**Nội dung:**

Tôi xin lỗi, nhưng văn bản cung cấp không chứa thông tin về quy định cụ thể liên quan đến việc sử dụng xe máy phân khối lớn trong khu vực đô thị. Văn bản tập trung vào yêu cầu kỹ thuật đối với xe cơ giới, xe máy chuyên dùng thuộc đối tượng nghiên cứu phát triển có nhu cầu tham gia giao thông đường bộ, bao gồm các quy định về kích thước, khối lượng, phụ tùng, thiết bị an toàn và thủ tục chạy thử.  Vì vậy, tôi không thể trả lời câu hỏi của bạn dựa trên văn bản này.
Tóm lại: Không tìm thấy thông tin liên quan đến quy định sử dụng xe máy phân khối lớn trong khu vực đô thị trong văn bản được cung cấp.
",Người điều khiển xe máy phân khối lớn trong khu vực đô thị phải có giấy phép lái xe hạng A và tuân thủ các quy định về tốc độ.,0.8333333333333334,0.0,0.0,0.0
36,Luật Giao thông Đường bộ 2025 có quy định gì về việc sử dụng xe ô tô chở hàng trong khu vực dân cư?,"['5. Khi có tín hiệu của xe ưu tiên, người và phương tiện tham gia giao thông đường bộ phải giảm tốc độ, đi sát lề đường bên phải hoặc dừng lại để nhường đường, trạm thu phí phải ưu tiên cho xe ưu tiên qua trạm trong mọi tình huống, không được gây cản trở.\n\n6. Chính phủ quy định về quản lý, lắp đặt, sử dụng thiết bị phát tín hiệu của xe ưu tiên và trình tự, thủ tục cấp mới, cấp lại và thu hồi giấy phép sử dụng thiết bị phát tín hiệu của xe ưu tiên.\n\n7. Bộ trưởng Bộ Công an quy định các đoàn trong nước và khách nước ngoài đến Việt Nam có bố trí xe Cảnh sát giao thông dẫn đường; quy định quy trình dẫn đường của Cảnh sát giao thông đối với các đoàn trong nước và khách nước ngoài đến Việt Nam.\n\nĐiều 28. Trường hợp chở người trên xe ô tô chở hàng\n\n1. Chỉ được chở người trên thùng xe ô tô chở hàng trong trường hợp sau đây:\n\na) Chở người đi làm nhiệm vụ cứu nạn, cứu hộ, phòng, chống thiên tai, dịch bệnh hoặc thực hiện nhiệm vụ khẩn cấp; chở người bị nạn đi cấp cứu; đưa người ra khỏi khu vực nguy hiểm hoặc trong trường hợp khẩn cấp khác theo quy định của pháp luật;\n\nb) Chở người thuộc lực lượng vũ trang nhân dân đi làm nhiệm vụ khẩn cấp; \n\nc) Chở người đi thực hành lái xe trên xe tập lái; chở người dự sát hạch lái xe trên xe sát hạch; chở công nhân đang làm nhiệm vụ duy tu, bảo dưỡng đường bộ;\n\nd) Chở người diễu hành theo đoàn khi được cơ quan có thẩm quyền cho phép.\n\n2. Xe ô tô chở hàng mà chở người trong các trường hợp quy định tại khoản 1 Điều này phải bảo đảm an toàn khi tham gia giao thông đường bộ.\n\nĐiều 29. Xe kéo xe, xe kéo rơ moóc và xe ô tô đầu kéo kéo sơ mi rơ moóc\n\n1. Một xe ô tô chỉ được kéo theo một xe ô tô hoặc xe máy chuyên dùng khác khi xe được kéo không tự chạy được, trừ trường hợp quy định tại khoản 3 Điều 53 của Luật này và phải bảo đảm các quy định sau đây:\n\na) Xe được kéo phải có người điều khiển và hệ thống lái của xe đó phải còn hiệu lực;\n\nb) Việc nối xe kéo với xe được kéo phải bảo đảm chắc chắn, an toàn; trường hợp hệ thống hãm của xe được kéo không còn hiệu lực thì xe kéo nhau phải nối bằng thanh nối cứng;\n\nc) Phía trước của xe kéo và phía sau của xe được kéo phải có biển báo hiệu, có đèn cảnh báo nhấp nháy màu vàng.\n\n2. Xe kéo rơ moóc, xe ô tô đầu kéo chỉ được kéo rơ moóc, sơ mi rơ moóc phù hợp với thiết kế của xe; việc kết nối xe kéo với rơ moóc, xe ô tô đầu kéo với sơ mi rơ moóc phải bảo đảm chắc chắn, an toàn.\n\n3. Không được chở người trên xe được kéo, trừ người điều khiển; xe kéo rơ moóc, xe ô tô đầu kéo kéo sơ mi rơ moóc không được kéo thêm rơ moóc, sơ mi rơ moóc hoặc xe khác.\n\nĐiều 30. Người đi bộ; trẻ em, phụ nữ mang thai, người già yếu, người khuyết tật, người mất năng lực hành vi dân sự tham gia giao thông đường bộ\n\n1. Người đi bộ phải tuân thủ các quy định sau đây:\n\na) Phải đi trên vỉa hè, lề đường, đường dành riêng cho người đi bộ; trường hợp đường không có vỉa hè, lề đường, đường dành riêng cho người đi bộ thì người đi bộ phải đi sát mép đường bên phải theo chiều đi của mình;\n\nb) Chỉ được qua đường ở những nơi có đèn tín hiệu, có vạch kẻ đường hoặc có cầu vượt, hầm dành cho người đi bộ và phải tuân thủ tín hiệu chỉ dẫn, báo hiệu đường bộ. Trường hợp không có đèn tín hiệu, vạch kẻ đường, cầu vượt, hầm dành cho người đi bộ thì phải quan sát các xe đang đi tới, chỉ qua đường khi bảo đảm an toàn, khi qua đường phải có tín hiệu bằng tay;\n\nc) Không được vượt qua dải phân cách, đu, bám vào phương tiện giao thông đường bộ đang di chuyển; khi mang, vác vật cồng kềnh phải bảo đảm an toàn và không gây trở ngại cho người và phương tiện tham gia giao thông đường bộ.\n\n2. Trẻ em, phụ nữ mang thai, người già yếu, người khuyết tật, người mất năng lực hành vi dân sự tham gia giao thông đường bộ được quy định như sau:\n\na) Trẻ em dưới 07 tuổi khi đi qua đường phải có người lớn dẫn dắt; \n\nb) Người khuyết tật sử dụng xe lăn có động cơ hoặc không có động cơ phải đi trên vỉa hè, lề đường và nơi có vạch kẻ đường dành cho người đi bộ và xe thô sơ;\n\nc) Người khiếm thị khi đi trên đường bộ phải có người dẫn dắt hoặc có công cụ để báo hiệu cho người khác nhận biết là người khiếm thị;\n\nd) Người mất năng lực hành vi dân sự khi đi trên đường bộ phải có người dẫn dắt;\n\nđ) Mọi người có trách nhiệm giúp đỡ trẻ em dưới 07 tuổi, phụ nữ mang thai, người già yếu, người khuyết tật, người mất năng lực hành vi dân sự khi đi qua đường.\n\nĐiều 31. Người điều khiển, người được chở, hàng hóa xếp trên xe thô sơ\n\n1. Người điều khiển xe đạp, xe đạp máy chỉ được chở một người, trừ trường hợp chở thêm một trẻ em dưới 07 tuổi thì được chở tối đa hai người.\n\n2. Người điều khiển xe đạp, xe đạp máy không được thực hiện các hành vi quy định tại khoản 3 Điều 33 của Luật này; người được chở trên xe đạp, xe đạp máy khi tham gia giao thông đường bộ không được thực hiện các hành vi quy định tại khoản 4 Điều 33 của Luật này. \n\n3. Người điều khiển, người được chở trên xe đạp máy phải đội mũ bảo hiểm theo đúng quy chuẩn kỹ thuật quốc gia và cài quai đúng quy cách. \n\n4. Người điều khiển xe thô sơ chỉ được cho xe đi hàng một, nơi có phần đường dành cho xe thô sơ thì phải đi đúng phần đường quy định; khi tham gia giao thông đường bộ trong thời gian từ 18 giờ ngày hôm trước đến 06 giờ ngày hôm sau phải sử dụng đèn hoặc có báo hiệu ở phía trước và phía sau xe. \n\n5. Hàng hóa xếp trên xe thô sơ phải bảo đảm an toàn, không gây cản trở giao thông và che khuất tầm nhìn của người điều khiển. Hàng hóa xếp trên xe không vượt quá 1/3 chiều dài thân xe và không vượt quá 01 mét phía trước và phía sau xe; không vượt quá 0,4 mét mỗi bên bánh xe.\n\nĐiều 32. Người điều khiển, dẫn dắt vật nuôi, điều khiển xe vật nuôi kéo đi trên đường bộ\n\n1. Người điều khiển, dẫn dắt vật nuôi, điều khiển xe vật nuôi kéo đi trên đường bộ phải cho vật nuôi đi sát mép đường bên phải; trường hợp cần cho vật nuôi đi ngang qua đường thì phải quan sát và chỉ được đi qua đường khi có đủ điều kiện an toàn; không được gây cản trở cho người và phương tiện tham gia giao thông đường bộ khác.\n\n2. Không được điều khiển, dẫn dắt vật nuôi, điều khiển xe vật nuôi kéo đi vào làn đường dành cho xe cơ giới. \n\n3. Không được thả vật nuôi trên đường bộ.\n\nĐiều 33. Người lái xe, người được chở, hàng hóa xếp trên xe mô tô, xe gắn máy\n\n1. Người lái xe mô tô hai bánh, xe gắn máy chỉ được chở một người, trừ những trường hợp sau thì được chở tối đa hai người:\n\na) Chở người bệnh đi cấp cứu;\n\nb) Áp giải người có hành vi vi phạm pháp luật;\n\nc) Trẻ em dưới 12 tuổi;\n\nd) Người già yếu hoặc người khuyết tật.\n\n2. Người lái xe, người được chở trên xe mô tô hai bánh, xe mô tô ba bánh, xe gắn máy phải đội mũ bảo hiểm theo đúng quy chuẩn kỹ thuật quốc gia và cài quai đúng quy cách.\n\n3. Người lái xe mô tô hai bánh, xe mô tô ba bánh, xe gắn máy không được thực hiện các hành vi sau đây:\n\na) Đi xe dàn hàng ngang;\n\nb) Đi xe vào phần đường dành cho người đi bộ và phương tiện khác;\n\nc) Sử dụng ô, thiết bị âm thanh, trừ thiết bị trợ thính;\n\nd) Buông cả hai tay; đi xe bằng một bánh đối với xe mô tô, xe gắn máy hai bánh; đi xe bằng hai bánh đối với xe mô tô, xe gắn máy ba bánh;\n\nđ) Sử dụng xe để kéo, đẩy xe khác, vật khác, dẫn dắt vật nuôi, mang, vác và chở vật cồng kềnh; chở người đứng trên xe, giá đèo hàng hoặc ngồi trên tay lái; xếp hàng hóa trên xe quá giới hạn quy định;\n\ne) Ngồi về một bên điều khiển xe; đứng, nằm trên xe điều khiển xe; thay người lái xe khi xe đang chạy; quay người về phía sau để điều khiển xe hoặc bịt mắt điều khiển xe; sử dụng chân chống hoặc vật khác quệt xuống đường khi xe đang chạy;\n\ng) Hành vi khác gây mất trật tự, an toàn giao thông đường bộ.\n\n4. Người được chở trên xe mô tô hai bánh, xe mô tô ba bánh, xe gắn máy\xa0 khi tham gia giao thông đường bộ không được thực hiện các hành vi sau đây:\n\na) Mang, vác vật cồng kềnh;\n\nb) Sử dụng ô;\n\nc) Bám, kéo hoặc đẩy các phương tiện khác;\n\nd) Đứng trên yên, giá đèo hàng hoặc ngồi trên tay lái;\n\nđ) Hành vi khác gây mất trật tự, an toàn giao thông đường bộ.']","**Nguồn văn bản:** /content/drive/MyDrive/ITProject_data/new_law/36_2024_QH15_444251.docx

**Tên văn bản:** Không có thông tin trong context

**Điều:** Không có thông tin trong context

**Nội dung:**

Dựa trên văn bản được cung cấp, không có quy định cụ thể nào về việc sử dụng xe ô tô chở hàng trong khu vực dân cư. Tuy nhiên, văn bản đề cập đến việc chở người trên xe ô tô chở hàng, chỉ được phép trong các trường hợp đặc biệt sau:

a) Chở người đi làm nhiệm vụ cứu nạn, cứu hộ, phòng, chống thiên tai, dịch bệnh hoặc thực hiện nhiệm vụ khẩn cấp; chở người bị nạn đi cấp cứu; đưa người ra khỏi khu vực nguy hiểm hoặc trong trường hợp khẩn cấp khác theo quy định của pháp luật.

b) Chở người thuộc lực lượng vũ trang nhân dân đi làm nhiệm vụ khẩn cấp.

c) Chở người đi thực hành lái xe trên xe tập lái; chở người dự sát hạch lái xe trên xe sát hạch; chở công nhân đang làm nhiệm vụ duy tu, bảo dưỡng đường bộ.

d) Chở người diễu hành theo đoàn khi được cơ quan có thẩm quyền cho phép.

Xe ô tô chở hàng chở người trong các trường hợp trên phải đảm bảo an toàn khi tham gia giao thông đường bộ.  Văn bản không đề cập đến các quy định cụ thể khác liên quan đến việc sử dụng xe ô tô chở hàng trong khu vực dân cư.  Để có thông tin đầy đủ, bạn cần tham khảo thêm các văn bản pháp luật khác về giao thông đường bộ.


Tóm lại: Văn bản không cung cấp thông tin về quy định sử dụng xe ô tô chở hàng trong khu vực dân cư, chỉ nêu rõ các trường hợp được phép chở người trên xe ô tô chở hàng và yêu cầu đảm bảo an toàn giao thông.
",Hạn chế xe ô tô chở hàng có trọng tải lớn lưu thông trong khu vực dân cư vào ban đêm để giảm tiếng ồn.,0.9411764705882353,0.7301536305596289,0.0,0.0
37,Quy định mới về việc sử dụng xe ô tô chở khách trong khu vực du lịch là gì?,"['Chương II\n\nQUY ĐỊNH VỀ HOẠT ĐỘNG VẬN TẢI ĐƯỜNG BỘ TRONG NƯỚC\n\nMục 1. QUY ĐỊNH VỀ KINH DOANH VẬN TẢI BẰNG XE Ô TÔ, BẰNG XE BỐN BÁNH CÓ GẮN ĐỘNG CƠ\n\nĐiều 4. Kinh doanh vận tải hành khách bằng xe ô tô theo tuyến cố định\n\n\n\n1. Đơn vị kinh doanh vận tải có Giấy phép kinh doanh vận tải bằng xe ô tô, trong đó có loại hình kinh doanh vận tải hành khách theo tuyến cố định thì được đăng ký khai thác tuyến theo quy định tại Điều 22 của Nghị định này.\n\n2. Tuyến cố định phải xuất phát và kết thúc tại bến xe khách đã được công bố đưa vào khai thác.\n\n3. Sở Giao thông vận tải thực hiện nội dung quản lý tuyến\n\na) Xây dựng, điều chỉnh, bổ sung, công bố danh mục mạng lưới tuyến cố định nội tỉnh; thống nhất với Sở Giao thông vận tải đầu tuyến bên kia để thực hiện xây dựng, điều chỉnh, bổ sung và công bố danh mục mạng lưới tuyến cố định liên tỉnh theo nguyên tắc ổn định các tuyến đã công bố; đối với các tỉnh, thành phố có bến xe bảo đảm tổ chức vận tải theo hướng tuyến cần tuân thủ nguyên tắc tuyến vận tải đi theo hướng nào thì điểm đầu, điểm cuối là bến xe hướng đó;\n\nb) Thông báo biểu đồ chạy xe theo tuyến và cập nhật vào danh mục mạng lưới tuyến các nội dung gồm: tổng số chuyến xe tối đa được khai thác trên tuyến, giãn cách thời gian tối thiểu giữa các chuyến xe liền kề, giờ xuất bến của các chuyến xe đã có đơn vị tham gia khai thác; thông báo danh sách đơn vị đang khai thác tuyến trên hệ thống dịch vụ công trực tuyến của Bộ Giao thông vận tải; xây dựng và thông báo điểm dừng đón, trả khách trên các tuyến;\n\nc) Theo dõi, tổng hợp kết quả hoạt động vận tải của các đơn vị kinh doanh vận tải, bến xe trên tuyến.\n\n4. Xe ô tô kinh doanh vận tải hành khách theo tuyến cố định\n\na) Phải có chỗ ưu tiên cho người khuyết tật, người cao tuổi và phụ nữ mang thai;\n\nb) Phải có phù hiệu “XE TUYẾN CỐ ĐỊNH” theo Mẫu số 01 Phụ lục XIII kèm theo Nghị định này và được dán cố định tại góc trên bên phải ngay sát phía dưới vị trí của Tem kiểm định, mặt trong kính chắn gió phía trước của xe;\n\nc) Phải được niêm yết đầy đủ các thông tin trên xe.\n\n5. Xe ô tô sử dụng để vận tải trung chuyển hành khách\n\na) Sử dụng xe ô tô chở người đến 29 chỗ (không kể chỗ của người lái xe);\n\nb) Phải có phù hiệu “XE TRUNG CHUYỂN” theo Mẫu số 02 Phụ lục XIII kèm theo Nghị định này và được dán cố định tại góc trên bên phải ngay sát phía dưới vị trí của Tem kiểm định, mặt trong kính chắn gió phía trước của xe; phải được niêm yết đầy đủ các thông tin trên xe;\n\nc) Chỉ được hoạt động vận tải trung chuyển hành khách trong phạm vi địa bàn địa phương (cấp tỉnh) nơi cấp phù hiệu “XE TRUNG CHUYỂN”.\n\n6. Quy định đối với hoạt động tăng cường phương tiện để giải toả hành khách trên tuyến cố định\n\na) Tăng cường phương tiện vào các dịp Lễ, Tết và các kỳ thi trung học phổ thông Quốc gia, tuyển sinh đại học, cao đẳng: đơn vị kinh doanh vận tải hành khách đang khai thác theo tuyến cố định căn cứ vào nhu cầu đi lại, thống nhất với bến xe khách xây dựng phương án tăng cường phương tiện trên tuyến; gửi phương án tăng cường đến Sở Giao thông vận tải hai đầu tuyến phối hợp, quản lý;\n\nb) Tăng cường phương tiện vào các ngày cuối tuần (thứ Sáu, thứ Bảy và Chủ nhật) có lượng khách tăng đột biến: đơn vị kinh doanh vận tải hành khách đang khai thác tuyến cố định căn cứ vào nhu cầu đi lại, thống nhất với bến xe khách xây dựng phương án tăng cường phương tiện trên tuyến; thông báo đến Sở Giao thông vận tải hai đầu tuyến để thực hiện trong năm. Căn cứ phương án tăng cường phương tiện đã thông báo đến Sở Giao thông vận tải hai đầu tuyến và lưu lượng khách thực tế tại bến xe, bến xe khách xác nhận chuyến xe tăng cường vào Lệnh vận chuyển của đơn vị kinh doanh vận tải khai thác tuyến khi thực hiện. Xe sử dụng để tăng cường là xe đã được cấp phù hiệu “XE TUYẾN CỐ ĐỊNH”, “XE HỢP ĐỒNG” , “XE BUÝT” liên tỉnh còn giá trị sử dụng.\n\n7. Đơn vị kinh doanh dịch vụ bến xe khách xác nhận vào Lệnh vận chuyển của đơn vị kinh doanh vận tải khi xe xuất bến. Nội dung xác nhận gồm: biển kiểm soát xe, số lượng hành khách và giờ xe xuất bến.\n\n8. Đơn vị kinh doanh vận tải hành khách bằng xe ô tô theo tuyến cố định thực hiện lưu trữ Lệnh vận chuyển của các chuyến xe đã thực hiện trong thời gian tối thiểu 03 năm.\n\nĐiều 5. Kinh doanh vận tải hành khách công cộng bằng xe buýt\n\n1. Đơn vị kinh doanh vận tải có Giấy phép kinh doanh vận tải bằng ô tô, trong đó có loại hình kinh doanh vận tải hành khách công cộng bằng xe buýt thì được tham gia kinh doanh vận tải công cộng bằng xe buýt trên các tuyến xe buýt nội tỉnh, tuyến xe buýt liên tỉnh.\n\n2. Xe ô tô kinh doanh vận tải hành khách công cộng bằng xe buýt\n\na) Phải có chỗ ưu tiên cho người khuyết tật, người cao tuổi và phụ nữ mang thai và trẻ em dưới 6 tuổi;\n\nb) Phải có phù hiệu “XE BUÝT” theo Mẫu số 03 Phụ lục XIII kèm theo Nghị định này và được dán cố định tại góc trên bên phải ngay sát phía dưới vị trí của Tem kiểm định, mặt trong kính chắn gió phía trước của xe; phải được niêm yết đầy đủ các thông tin trên xe;\n\nc) Vị trí, số chỗ ngồi, chỗ đứng cho hành khách và các quy định kỹ thuật khác đối với xe buýt theo quy chuẩn kỹ thuật quốc gia về chất lượng an toàn kỹ thuật và bảo vệ môi trường đối với xe ô tô.\n\n3. Sở Giao thông vận tải thực hiện nội dung quản lý tuyến đối với tuyến xe buýt nội tỉnh, tuyến xe buýt liên tỉnh\n\na) Xây dựng, điều chỉnh, bổ sung và công bố danh mục mạng lưới tuyến, biểu đồ chạy xe trên các tuyến, giá vé;\n\nb) Đề xuất, xây dựng và báo cáo Ủy ban nhân dân cấp tỉnh: về các chính sách hỗ trợ của nhà nước về khuyến khích phát triển vận tải hành khách công cộng bằng xe buýt trên địa bàn địa phương; việc tổ chức đấu thầu, tiêu chí để đặt hàng khai thác đối với tuyến xe buýt trong danh mục mạng lưới tuyến đã công bố theo quy định của pháp luật về thầu; tổ chức đặt hàng khai thác đối với tuyến xe buýt liên tỉnh và tuyến xe buýt có sử dụng xe ô tô thoáng nóc chở khách du lịch không được hỗ trợ kinh phí hoạt động từ ngân sách nhà nước trong danh mục mạng lưới tuyến đã công bố;\n\nc) Xây dựng, bảo trì và quản lý kết cấu hạ tầng phục vụ hoạt động xe buýt; quyết định tiêu chí kỹ thuật, vị trí điểm đầu, điểm cuối và điểm dừng của tuyến xe buýt trên địa bàn địa phương;\n\nd) Theo dõi, tổng hợp kết quả hoạt động vận tải của các đơn vị kinh doanh vận tải trên tuyến; thống kê sản lượng hành khách.\n\n4. Đơn vị kinh doanh vận tải hành khách bằng xe buýt thực hiện lưu trữ Lệnh vận chuyển như sau:\n\na) Lưu trữ Lệnh vận chuyển của các chuyến xe đã thực hiện (không được hỗ trợ kinh phí hoạt động từ ngân sách nhà nước) trong thời hạn ít nhất là 03 năm;\n\nb) Lưu trữ Lệnh vận chuyển của các chuyến xe đã thực hiện (được hỗ trợ kinh phí hoạt động từ ngân sách nhà nước) theo thời hạn tài liệu kế toán phải lưu trữ được quy định tại khoản 5 Điều 41 Luật Kế toán năm 2015.\n\n5. Xe buýt được ưu tiên bố trí nơi dừng, đỗ để đón, trả khách tại các bến xe, nhà ga, sân bay, bến cảng, khu du lịch, điểm du lịch, cơ sở lưu trú du lịch, điểm tham quan du lịch, địa điểm văn hóa, thể thao, trung tâm thương mại, đầu mối giao thông và các địa điểm kết nối với các phương thức vận tải khác; được ưu tiên hoạt động khi tổ chức giao thông tại đô thị.\n\nĐiều 6. Kinh doanh vận tải hành khách bằng xe taxi\n\n1. Đơn vị kinh doanh vận tải có Giấy phép kinh doanh vận tải bằng ô tô, trong đó có loại hình kinh doanh vận tải hành khách bằng taxi thì được tham gia kinh doanh vận tải hành khách bằng taxi.\n\n2. Xe ô tô kinh doanh vận tải hành khách bằng taxi\n\na) Xe ô tô phải bảo đảm đúng theo quy định tại khoản 9 Điều 56 Luật Đường bộ;\n\nb) Phải có phù hiệu “XE TAXI” theo Mẫu số 04 Phụ lục XIII kèm theo Nghị định này và được dán cố định tại góc trên bên phải ngay sát phía dưới vị trí của Tem kiểm định, mặt trong kính chắn gió phía trước của xe; phải được niêm yết đầy đủ các thông tin trên xe theo quy định;']","**Nguồn văn bản:** /content/drive/MyDrive/ITProject_data/new_law/158_2024_ND-CP_636875.docx

**Tên văn bản:**  (Tên văn bản không được cung cấp trong metadata)

**Điều:** (Điều không được cung cấp trong metadata)


**Nội dung:**

Dựa trên văn bản cung cấp, không có quy định cụ thể nào về việc sử dụng xe ô tô chở khách trong khu vực du lịch. Tuy nhiên, văn bản đề cập đến một số quy định liên quan đến hoạt động vận tải hành khách bằng ô tô có thể áp dụng gián tiếp:

* **Xe buýt:**  Xe buýt được ưu tiên bố trí nơi dừng, đỗ để đón, trả khách tại các khu du lịch, điểm du lịch, cơ sở lưu trú du lịch, điểm tham quan du lịch,...

* **Xe trung chuyển:**  Xe ô tô sử dụng để vận tải trung chuyển hành khách (dưới 29 chỗ) chỉ được hoạt động trong phạm vi địa phương nơi cấp phù hiệu “XE TRUNG CHUYỂN”.  Điều này có thể liên quan đến việc vận chuyển khách du lịch trong phạm vi một tỉnh, thành phố.

* **Xe tuyến cố định:**  Các quy định về xe tuyến cố định (phải có chỗ ưu tiên, phù hiệu, niêm yết thông tin...) cũng có thể áp dụng cho các tuyến xe phục vụ khách du lịch nếu tuyến đó được đăng ký là tuyến cố định.


**Tóm lại:** Văn bản không có quy định riêng về sử dụng xe ô tô chở khách trong khu du lịch. Tuy nhiên, các quy định về xe buýt, xe trung chuyển và xe tuyến cố định có thể được áp dụng tùy thuộc vào loại hình vận tải và phạm vi hoạt động.  Để có thông tin chính xác và đầy đủ, cần tham khảo thêm các văn bản pháp luật khác liên quan đến du lịch và vận tải.
",Xe ô tô chở khách trong khu vực du lịch phải đáp ứng các tiêu chuẩn về khí thải và tiếng ồn để bảo vệ môi trường.,1.0,0.756205136275096,0.0,0.0
38,Luật Giao thông Đường bộ 2025 có quy định gì về việc sử dụng xe ô tô chở học sinh?,"['CHÍNH PHỦ\n------- CỘNG HÒA XÃ HỘI CHỦ NGHĨA VIỆT NAM\nĐộc lập - Tự do - Hạnh phúc \n--------------- Số: 151/2024/NĐ-CP Hà Nội, ngày 15 tháng 11 năm 2024\n\nNGHỊ ĐỊNH\n\nQUY ĐỊNH CHI TIẾT MỘT SỐ ĐIỀU VÀ BIỆN PHÁP THI HÀNH LUẬT TRẬT TỰ, AN TOÀN GIAO THÔNG ĐƯỜNG BỘ\n\nCăn cứ Luật Tổ chức Chính phủ ngày 19 tháng 6 năm 2015; Luật sửa đổi, bổ sung một số điều của Luật Tổ chức Chính phủ và Luật Tổ chức chính quyền địa phương ngày 22 tháng 11 năm 2019;\n\nCăn cứ Luật Trật tự, an toàn giao thông đường bộ ngày 27 tháng 6 năm 2024;\n\nTheo đề nghị của Bộ trưởng Bộ Công an;\n\nChính phủ ban hành Nghị định quy định chi tiết một số điều và biện pháp thi hành Luật Trật tự, an toàn giao thông đường bộ.\n\nChương I\n\nNHỮNG QUY ĐỊNH CHUNG\n\nĐiều 1. Phạm vi điều chỉnh\n\nNghị định này quy định chi tiết một số điều và biện pháp thi hành Luật Trật tự, an toàn giao thông đường bộ bao gồm:\n\n1. Điều 6 về giáo dục kiến thức pháp luật về trật tự, an toàn giao thông đường bộ.\n\n2. Khoản 3 Điều 7 về Cơ sở dữ liệu về trật tự, an toàn giao thông đường bộ; việc thu thập, quản lý, khai thác thông tin trong Cơ sở dữ liệu về trật tự, an toàn giao thông đường bộ.\n\n3. Khoản 6 Điều 27 về quản lý, lắp đặt, sử dụng thiết bị phát tín hiệu của xe ưu tiên và trình tự, thủ tục cấp mới, cấp lại, thu hồi giấy phép sử dụng thiết bị phát tín hiệu của xe ưu tiên.\n\n4. Khoản 5 Điều 35 về lắp thiết bị giám sát hành trình đối với xe ô tô kinh doanh vận tải; lắp thiết bị giám sát hành trình và thiết bị ghi nhận hình ảnh người lái xe đối với xe ô tô chở người từ 08 chỗ trở lên (không kể chỗ của người lái xe) kinh doanh vận tải, xe ô tô đầu kéo, xe cứu thương, xe cứu hộ giao thông đường bộ; cấp phép hoạt động đối với phương tiện giao thông thông minh; điều kiện hoạt động của xe thô sơ.\n\n\n\n5. Điểm a khoản 1 Điều 46 về màu sơn của xe ô tô kinh doanh vận tải chở trẻ em mầm non, học sinh.\n\n6. Điểm đ khoản 4 Điều 52 về trường hợp cần thiết phải có người, phương tiện hỗ trợ lái xe, cảnh báo cho người, phương tiện tham gia giao thông đường bộ khác và thực hiện các biện pháp bảo đảm an toàn giao thông đường bộ đối với xe quá khổ giới hạn, xe quá tải trọng, xe bánh xích, xe vận chuyển hàng siêu trường, siêu trọng lưu hành trên đường bộ.\n\n7. Khoản 4 Điều 55 về bảo đảm trật tự, an toàn giao thông đường bộ đối với xe ô tô của người nước ngoài đăng ký tại nước ngoài có tay lái ở bên phải tham gia giao thông tại Việt Nam; xe cơ giới nước ngoài do người nước ngoài đưa vào Việt Nam du lịch.\n\nĐiều 2. Đối tượng áp dụng\n\nNghị định này áp dụng đối với cơ quan, tổ chức, cá nhân trong nước và nước ngoài liên quan đến trật tự, an toàn giao thông đường bộ trên lãnh thổ nước Cộng hòa xã hội chủ nghĩa Việt Nam.\n\nĐiều 3. Phụ lục kèm theo Nghị định\n\n1. Phụ lục I: Yêu cầu kỹ thuật thiết bị phát tín hiệu của xe ưu tiên.\n\n2. Phụ lục II: Biểu mẫu liên quan đến cấp giấy phép sử dụng thiết bị phát tín hiệu của xe ưu tiên.\n\n3. Phụ lục III: Biểu mẫu liên quan đến cấp giấy phép hoạt động phương tiện giao thông thông minh.\n\n4. Phụ lục IV: Biểu mẫu liên quan đến chấp thuận doanh nghiệp kinh doanh dịch vụ lữ hành quốc tế của Việt Nam tổ chức cho người nước ngoài đưa xe cơ giới nước ngoài vào Việt Nam du lịch; tổ chức, cá nhân đưa xe ô tô có tay lái ở bên phải vào tham gia giao thông tại Việt Nam không phải mục đích du lịch.\n\nChương II\n\nGIÁO DỤC KIẾN THỨC PHÁP LUẬT VỀ TRẬT TỰ, AN TOÀN GIAO THÔNG ĐƯỜNG BỘ\n\nĐiều 4. Nội dung giáo dục kiến thức pháp luật về trật tự, an toàn giao thông đường bộ trong các cơ sở giáo dục\n\n1. Nội dung giáo dục kiến thức pháp luật về trật tự, an toàn giao thông đường bộ đối với trẻ em tại cơ sở giáo dục mầm non bao gồm:\n\na) Nhận biết loại phương tiện giao thông đường bộ;\n\nb) Nhận biết đèn tín hiệu giao thông, ý nghĩa tín hiệu đèn và một số biển báo hiệu đường bộ thường gặp;\n\n\n\nc) An toàn khi đi bộ, trên các phương tiện giao thông đường bộ;\n\nd) Biết đội mũ bảo hiểm đúng cách;\n\nđ) Nơi vui chơi an toàn;\n\ne) Những nguy hiểm, hậu quả khi không tuân thủ quy định an toàn giao thông đường bộ.\n\n2. Nội dung giáo dục kiến thức pháp luật về trật tự, an toàn giao thông đường bộ đối với học sinh tiểu học bao gồm:\n\na) Nhận biết hiệu lệnh của người điều khiển giao thông; tín hiệu đèn giao thông; biển báo hiệu đường bộ thường gặp;\n\nb) Một số quy tắc giao thông đường bộ thường gặp; nhận biết được sự cần thiết phải tuân thủ quy tắc giao thông đường bộ;\n\nc) Đi qua đường bộ an toàn;\n\nd) Chọn và đội mũ bảo hiểm đúng cách;\n\nđ) Lên, xuống xe đạp, xe gắn máy, xe mô tô an toàn;\n\ne) Làm quen với xe đạp và cách điều khiển xe đạp an toàn;\n\ng) Một số kỹ năng phòng tránh tai nạn giao thông đường bộ.\n\n3. Nội dung giáo dục kiến thức pháp luật về trật tự, an toàn giao thông đường bộ đối với học sinh trung học cơ sở bao gồm:\n\na) Quy tắc giao thông đường bộ;\n\nb) Nhận biết và chấp hành báo hiệu đường bộ;\n\nc) Đội mũ bảo hiểm đạt chuẩn và cài quai đúng quy cách khi tham gia giao thông đường bộ;\n\nd) An toàn khi ngồi trên xe cơ giới;\n\nđ) Cách điều khiển xe đạp, xe đạp điện an toàn;\n\ne) Phòng ngừa rủi ro, hậu quả của tai nạn giao thông và xử lý sự cố giao thông.\n\n4. Nội dung giáo dục kiến thức pháp luật về trật tự, an toàn giao thông đường bộ đối với học sinh trung học phổ thông, học sinh cơ sở giáo dục nghề nghiệp bao gồm:\n\na) Quy tắc giao thông đường bộ; báo hiệu đường bộ; tốc độ và khoảng cách an toàn của xe cơ giới;\n\nb) Dự đoán và phòng tránh nguy hiểm;\n\nc) Cách điều khiển xe gắn máy an toàn.\n\nĐiều 5. Hướng dẫn kỹ năng lái xe gắn máy an toàn cho học sinh bắt đầu vào học trung học phổ thông và cơ sở giáo dục nghề nghiệp\n\n1. Nội dung hướng dẫn kỹ năng lái xe gắn máy an toàn bao gồm:\n\na) Phương pháp nhận biết và xử lý các tình huống nguy hiểm khi lái xe;\n\nb) Cấu tạo và chức năng của các bộ phận xe gắn máy, phương pháp bảo dưỡng xe, kiểm tra xe an toàn;\n\nc) Văn hóa tham gia giao thông; trách nhiệm của người điều khiển xe cơ giới; cứu giúp người bị tai nạn giao thông;\n\nd) Cách khởi động và tắt máy, cách sử dụng ga, phanh, thay đổi số, sử dụng các thiết bị bảo hộ;\n\nđ) Tư thế lên ngồi lái xe, xuống xe an toàn;\n\ne) Khởi hành, điều chỉnh tốc độ phù hợp, dừng xe an toàn;\n\ng) Lái xe theo 04 hình mẫu bao gồm: đi qua hình số 8, đi qua vạch đường thẳng, đi qua đường có vạch cản, đi qua đường gồ ghề;\n\nh) Các nội dung khác có liên quan.\n\n2. Học sinh thực hành lái xe gắn máy an toàn theo quy định tại điểm d, điểm đ, điểm e, điểm g khoản 1 Điều này.\n\n3. Thời gian hướng dẫn và đánh giá kỹ năng lái xe gắn máy an toàn theo hướng dẫn của cơ quan Cảnh sát giao thông trực tiếp thực hiện phù hợp với yêu cầu thực tiễn tại cơ sở giáo dục và bảo đảm nội dung hướng dẫn quy định tại khoản 1 Điều này.\n\nĐiều 6. Trách nhiệm hướng dẫn kỹ năng lái xe gắn máy an toàn cho học sinh\n\n1. Bộ Công an chủ trì, phối hợp với Bộ Giáo dục và Đào tạo, Bộ Lao động - Thương binh và Xã hội xây dựng chương trình giảng dạy, tài liệu hướng dẫn thực hành kỹ năng lái xe gắn máy an toàn bảo đảm phù hợp với đối tượng, nội dung quy định tại Điều 5 của Nghị định này.\n\n2. Bộ Giáo dục và Đào tạo chủ trì, chỉ đạo cơ quan quản lý trường trung học phổ thông chuẩn bị cơ sở vật chất, phương tiện xe gắn máy để phối hợp với lực lượng Cảnh sát giao thông tổ chức hướng dẫn kỹ năng lái xe gắn máy an toàn.\n\n3. Bộ Lao động - Thương binh và Xã hội chủ trì, chỉ đạo cơ quan quản lý cơ sở giáo dục nghề nghiệp chuẩn bị cơ sở vật chất, phương tiện xe gắn máy để phối hợp với lực lượng Cảnh sát giao thông tổ chức hướng dẫn kỹ năng lái xe gắn máy an toàn.\n\n4. Trách nhiệm của trường trung học phổ thông, cơ sở giáo dục nghề nghiệp:\n\na) Tổ chức cho học sinh, gia đình học sinh ký cam kết chấp hành quy định của pháp luật về trật tự, an toàn giao thông đường bộ, bao gồm các nội dung: học sinh không điều khiển xe mô tô khi chưa đủ điều kiện theo quy định, không điều khiển xe gắn máy khi chưa hoàn thành chương trình hướng dẫn kỹ năng lái xe gắn máy an toàn; gia đình học sinh không giao xe cho học sinh điều khiển khi chưa đủ điều kiện theo quy định của pháp luật;']","**Nguồn văn bản:** /content/drive/MyDrive/ITProject_data/new_law/151_2024_ND-CP_619564.docx

**Tên văn bản:** Nghị định quy định chi tiết một số điều và biện pháp thi hành Luật Trật tự, an toàn giao thông đường bộ

**Nội dung:**

Không tìm thấy thông tin cụ thể về quy định sử dụng xe ô tô chở học sinh trong văn bản này.  Văn bản tập trung vào các quy định chi tiết của Luật Trật tự, an toàn giao thông đường bộ, bao gồm: giáo dục kiến thức pháp luật về trật tự, an toàn giao thông đường bộ; quản lý thiết bị phát tín hiệu của xe ưu tiên; lắp đặt thiết bị giám sát hành trình; màu sơn của xe ô tô kinh doanh vận tải chở trẻ em mầm non, học sinh; và một số quy định khác liên quan đến an toàn giao thông.  Tuy điểm a khoản 1 Điều 46 đề cập đến màu sơn của xe ô tô kinh doanh vận tải chở trẻ em mầm non, học sinh, nhưng không cung cấp chi tiết về quy định sử dụng xe.


Tóm lại: Văn bản cung cấp thông tin về nhiều khía cạnh của Luật Trật tự, an toàn giao thông đường bộ nhưng không đề cập cụ thể đến quy định về việc sử dụng xe ô tô chở học sinh.
","Xe ô tô chở học sinh phải được sơn màu vàng đậm, có thiết bị chống bỏ quên trẻ em và đáp ứng các tiêu chuẩn an toàn khác.",0.9230769230769231,0.0,0.0,0.0
39,Quy định mới về việc sử dụng xe ô tô chở người khuyết tật là gì?,"['5. Khi có tín hiệu của xe ưu tiên, người và phương tiện tham gia giao thông đường bộ phải giảm tốc độ, đi sát lề đường bên phải hoặc dừng lại để nhường đường, trạm thu phí phải ưu tiên cho xe ưu tiên qua trạm trong mọi tình huống, không được gây cản trở.\n\n6. Chính phủ quy định về quản lý, lắp đặt, sử dụng thiết bị phát tín hiệu của xe ưu tiên và trình tự, thủ tục cấp mới, cấp lại và thu hồi giấy phép sử dụng thiết bị phát tín hiệu của xe ưu tiên.\n\n7. Bộ trưởng Bộ Công an quy định các đoàn trong nước và khách nước ngoài đến Việt Nam có bố trí xe Cảnh sát giao thông dẫn đường; quy định quy trình dẫn đường của Cảnh sát giao thông đối với các đoàn trong nước và khách nước ngoài đến Việt Nam.\n\nĐiều 28. Trường hợp chở người trên xe ô tô chở hàng\n\n1. Chỉ được chở người trên thùng xe ô tô chở hàng trong trường hợp sau đây:\n\na) Chở người đi làm nhiệm vụ cứu nạn, cứu hộ, phòng, chống thiên tai, dịch bệnh hoặc thực hiện nhiệm vụ khẩn cấp; chở người bị nạn đi cấp cứu; đưa người ra khỏi khu vực nguy hiểm hoặc trong trường hợp khẩn cấp khác theo quy định của pháp luật;\n\nb) Chở người thuộc lực lượng vũ trang nhân dân đi làm nhiệm vụ khẩn cấp; \n\nc) Chở người đi thực hành lái xe trên xe tập lái; chở người dự sát hạch lái xe trên xe sát hạch; chở công nhân đang làm nhiệm vụ duy tu, bảo dưỡng đường bộ;\n\nd) Chở người diễu hành theo đoàn khi được cơ quan có thẩm quyền cho phép.\n\n2. Xe ô tô chở hàng mà chở người trong các trường hợp quy định tại khoản 1 Điều này phải bảo đảm an toàn khi tham gia giao thông đường bộ.\n\nĐiều 29. Xe kéo xe, xe kéo rơ moóc và xe ô tô đầu kéo kéo sơ mi rơ moóc\n\n1. Một xe ô tô chỉ được kéo theo một xe ô tô hoặc xe máy chuyên dùng khác khi xe được kéo không tự chạy được, trừ trường hợp quy định tại khoản 3 Điều 53 của Luật này và phải bảo đảm các quy định sau đây:\n\na) Xe được kéo phải có người điều khiển và hệ thống lái của xe đó phải còn hiệu lực;\n\nb) Việc nối xe kéo với xe được kéo phải bảo đảm chắc chắn, an toàn; trường hợp hệ thống hãm của xe được kéo không còn hiệu lực thì xe kéo nhau phải nối bằng thanh nối cứng;\n\nc) Phía trước của xe kéo và phía sau của xe được kéo phải có biển báo hiệu, có đèn cảnh báo nhấp nháy màu vàng.\n\n2. Xe kéo rơ moóc, xe ô tô đầu kéo chỉ được kéo rơ moóc, sơ mi rơ moóc phù hợp với thiết kế của xe; việc kết nối xe kéo với rơ moóc, xe ô tô đầu kéo với sơ mi rơ moóc phải bảo đảm chắc chắn, an toàn.\n\n3. Không được chở người trên xe được kéo, trừ người điều khiển; xe kéo rơ moóc, xe ô tô đầu kéo kéo sơ mi rơ moóc không được kéo thêm rơ moóc, sơ mi rơ moóc hoặc xe khác.\n\nĐiều 30. Người đi bộ; trẻ em, phụ nữ mang thai, người già yếu, người khuyết tật, người mất năng lực hành vi dân sự tham gia giao thông đường bộ\n\n1. Người đi bộ phải tuân thủ các quy định sau đây:\n\na) Phải đi trên vỉa hè, lề đường, đường dành riêng cho người đi bộ; trường hợp đường không có vỉa hè, lề đường, đường dành riêng cho người đi bộ thì người đi bộ phải đi sát mép đường bên phải theo chiều đi của mình;\n\nb) Chỉ được qua đường ở những nơi có đèn tín hiệu, có vạch kẻ đường hoặc có cầu vượt, hầm dành cho người đi bộ và phải tuân thủ tín hiệu chỉ dẫn, báo hiệu đường bộ. Trường hợp không có đèn tín hiệu, vạch kẻ đường, cầu vượt, hầm dành cho người đi bộ thì phải quan sát các xe đang đi tới, chỉ qua đường khi bảo đảm an toàn, khi qua đường phải có tín hiệu bằng tay;\n\nc) Không được vượt qua dải phân cách, đu, bám vào phương tiện giao thông đường bộ đang di chuyển; khi mang, vác vật cồng kềnh phải bảo đảm an toàn và không gây trở ngại cho người và phương tiện tham gia giao thông đường bộ.\n\n2. Trẻ em, phụ nữ mang thai, người già yếu, người khuyết tật, người mất năng lực hành vi dân sự tham gia giao thông đường bộ được quy định như sau:\n\na) Trẻ em dưới 07 tuổi khi đi qua đường phải có người lớn dẫn dắt; \n\nb) Người khuyết tật sử dụng xe lăn có động cơ hoặc không có động cơ phải đi trên vỉa hè, lề đường và nơi có vạch kẻ đường dành cho người đi bộ và xe thô sơ;\n\nc) Người khiếm thị khi đi trên đường bộ phải có người dẫn dắt hoặc có công cụ để báo hiệu cho người khác nhận biết là người khiếm thị;\n\nd) Người mất năng lực hành vi dân sự khi đi trên đường bộ phải có người dẫn dắt;\n\nđ) Mọi người có trách nhiệm giúp đỡ trẻ em dưới 07 tuổi, phụ nữ mang thai, người già yếu, người khuyết tật, người mất năng lực hành vi dân sự khi đi qua đường.\n\nĐiều 31. Người điều khiển, người được chở, hàng hóa xếp trên xe thô sơ\n\n1. Người điều khiển xe đạp, xe đạp máy chỉ được chở một người, trừ trường hợp chở thêm một trẻ em dưới 07 tuổi thì được chở tối đa hai người.\n\n2. Người điều khiển xe đạp, xe đạp máy không được thực hiện các hành vi quy định tại khoản 3 Điều 33 của Luật này; người được chở trên xe đạp, xe đạp máy khi tham gia giao thông đường bộ không được thực hiện các hành vi quy định tại khoản 4 Điều 33 của Luật này. \n\n3. Người điều khiển, người được chở trên xe đạp máy phải đội mũ bảo hiểm theo đúng quy chuẩn kỹ thuật quốc gia và cài quai đúng quy cách. \n\n4. Người điều khiển xe thô sơ chỉ được cho xe đi hàng một, nơi có phần đường dành cho xe thô sơ thì phải đi đúng phần đường quy định; khi tham gia giao thông đường bộ trong thời gian từ 18 giờ ngày hôm trước đến 06 giờ ngày hôm sau phải sử dụng đèn hoặc có báo hiệu ở phía trước và phía sau xe. \n\n5. Hàng hóa xếp trên xe thô sơ phải bảo đảm an toàn, không gây cản trở giao thông và che khuất tầm nhìn của người điều khiển. Hàng hóa xếp trên xe không vượt quá 1/3 chiều dài thân xe và không vượt quá 01 mét phía trước và phía sau xe; không vượt quá 0,4 mét mỗi bên bánh xe.\n\nĐiều 32. Người điều khiển, dẫn dắt vật nuôi, điều khiển xe vật nuôi kéo đi trên đường bộ\n\n1. Người điều khiển, dẫn dắt vật nuôi, điều khiển xe vật nuôi kéo đi trên đường bộ phải cho vật nuôi đi sát mép đường bên phải; trường hợp cần cho vật nuôi đi ngang qua đường thì phải quan sát và chỉ được đi qua đường khi có đủ điều kiện an toàn; không được gây cản trở cho người và phương tiện tham gia giao thông đường bộ khác.\n\n2. Không được điều khiển, dẫn dắt vật nuôi, điều khiển xe vật nuôi kéo đi vào làn đường dành cho xe cơ giới. \n\n3. Không được thả vật nuôi trên đường bộ.\n\nĐiều 33. Người lái xe, người được chở, hàng hóa xếp trên xe mô tô, xe gắn máy\n\n1. Người lái xe mô tô hai bánh, xe gắn máy chỉ được chở một người, trừ những trường hợp sau thì được chở tối đa hai người:\n\na) Chở người bệnh đi cấp cứu;\n\nb) Áp giải người có hành vi vi phạm pháp luật;\n\nc) Trẻ em dưới 12 tuổi;\n\nd) Người già yếu hoặc người khuyết tật.\n\n2. Người lái xe, người được chở trên xe mô tô hai bánh, xe mô tô ba bánh, xe gắn máy phải đội mũ bảo hiểm theo đúng quy chuẩn kỹ thuật quốc gia và cài quai đúng quy cách.\n\n3. Người lái xe mô tô hai bánh, xe mô tô ba bánh, xe gắn máy không được thực hiện các hành vi sau đây:\n\na) Đi xe dàn hàng ngang;\n\nb) Đi xe vào phần đường dành cho người đi bộ và phương tiện khác;\n\nc) Sử dụng ô, thiết bị âm thanh, trừ thiết bị trợ thính;\n\nd) Buông cả hai tay; đi xe bằng một bánh đối với xe mô tô, xe gắn máy hai bánh; đi xe bằng hai bánh đối với xe mô tô, xe gắn máy ba bánh;\n\nđ) Sử dụng xe để kéo, đẩy xe khác, vật khác, dẫn dắt vật nuôi, mang, vác và chở vật cồng kềnh; chở người đứng trên xe, giá đèo hàng hoặc ngồi trên tay lái; xếp hàng hóa trên xe quá giới hạn quy định;\n\ne) Ngồi về một bên điều khiển xe; đứng, nằm trên xe điều khiển xe; thay người lái xe khi xe đang chạy; quay người về phía sau để điều khiển xe hoặc bịt mắt điều khiển xe; sử dụng chân chống hoặc vật khác quệt xuống đường khi xe đang chạy;\n\ng) Hành vi khác gây mất trật tự, an toàn giao thông đường bộ.\n\n4. Người được chở trên xe mô tô hai bánh, xe mô tô ba bánh, xe gắn máy\xa0 khi tham gia giao thông đường bộ không được thực hiện các hành vi sau đây:\n\na) Mang, vác vật cồng kềnh;\n\nb) Sử dụng ô;\n\nc) Bám, kéo hoặc đẩy các phương tiện khác;\n\nd) Đứng trên yên, giá đèo hàng hoặc ngồi trên tay lái;\n\nđ) Hành vi khác gây mất trật tự, an toàn giao thông đường bộ.']","**Nguồn văn bản:** /content/drive/MyDrive/ITProject_data/new_law/36_2024_QH15_444251.docx

**Tên văn bản:** Không có thông tin

**Điều 30:** Trường hợp người khuyết tật tham gia giao thông đường bộ

**Nội dung:**

2. Trẻ em, phụ nữ mang thai, người già yếu, người khuyết tật, người mất năng lực hành vi dân sự tham gia giao thông đường bộ được quy định như sau:

    a) Trẻ em dưới 07 tuổi khi đi qua đường phải có người lớn dẫn dắt.

    b) Người khuyết tật sử dụng xe lăn có động cơ hoặc không có động cơ phải đi trên vỉa hè, lề đường và nơi có vạch kẻ đường dành cho người đi bộ và xe thô sơ.

    c) Người khiếm thị khi đi trên đường bộ phải có người dẫn dắt hoặc có công cụ để báo hiệu cho người khác nhận biết là người khiếm thị.

    d) Người mất năng lực hành vi dân sự khi đi trên đường bộ phải có người dẫn dắt.

    đ) Mọi người có trách nhiệm giúp đỡ trẻ em dưới 07 tuổi, phụ nữ mang thai, người già yếu, người khuyết tật, người mất năng lực hành vi dân sự khi đi qua đường.


Tóm lại:  Luật quy định người khuyết tật sử dụng xe lăn phải đi trên vỉa hè, lề đường hoặc nơi có vạch kẻ đường dành riêng.  Trẻ em dưới 7 tuổi, người khiếm thị và người mất năng lực hành vi dân sự cần có người dẫn dắt khi tham gia giao thông.  Mọi người có trách nhiệm giúp đỡ các đối tượng này khi đi qua đường.
",Xe ô tô chở người khuyết tật phải được trang bị thiết bị hỗ trợ và đáp ứng các tiêu chuẩn an toàn đặc biệt.,1.0,0.6992917940196547,0.0,0.0
40,Luật Giao thông Đường bộ 2025 có quy định gì về việc sử dụng xe ô tô chở bệnh nhân?,"['5. Khi có tín hiệu của xe ưu tiên, người và phương tiện tham gia giao thông đường bộ phải giảm tốc độ, đi sát lề đường bên phải hoặc dừng lại để nhường đường, trạm thu phí phải ưu tiên cho xe ưu tiên qua trạm trong mọi tình huống, không được gây cản trở.\n\n6. Chính phủ quy định về quản lý, lắp đặt, sử dụng thiết bị phát tín hiệu của xe ưu tiên và trình tự, thủ tục cấp mới, cấp lại và thu hồi giấy phép sử dụng thiết bị phát tín hiệu của xe ưu tiên.\n\n7. Bộ trưởng Bộ Công an quy định các đoàn trong nước và khách nước ngoài đến Việt Nam có bố trí xe Cảnh sát giao thông dẫn đường; quy định quy trình dẫn đường của Cảnh sát giao thông đối với các đoàn trong nước và khách nước ngoài đến Việt Nam.\n\nĐiều 28. Trường hợp chở người trên xe ô tô chở hàng\n\n1. Chỉ được chở người trên thùng xe ô tô chở hàng trong trường hợp sau đây:\n\na) Chở người đi làm nhiệm vụ cứu nạn, cứu hộ, phòng, chống thiên tai, dịch bệnh hoặc thực hiện nhiệm vụ khẩn cấp; chở người bị nạn đi cấp cứu; đưa người ra khỏi khu vực nguy hiểm hoặc trong trường hợp khẩn cấp khác theo quy định của pháp luật;\n\nb) Chở người thuộc lực lượng vũ trang nhân dân đi làm nhiệm vụ khẩn cấp; \n\nc) Chở người đi thực hành lái xe trên xe tập lái; chở người dự sát hạch lái xe trên xe sát hạch; chở công nhân đang làm nhiệm vụ duy tu, bảo dưỡng đường bộ;\n\nd) Chở người diễu hành theo đoàn khi được cơ quan có thẩm quyền cho phép.\n\n2. Xe ô tô chở hàng mà chở người trong các trường hợp quy định tại khoản 1 Điều này phải bảo đảm an toàn khi tham gia giao thông đường bộ.\n\nĐiều 29. Xe kéo xe, xe kéo rơ moóc và xe ô tô đầu kéo kéo sơ mi rơ moóc\n\n1. Một xe ô tô chỉ được kéo theo một xe ô tô hoặc xe máy chuyên dùng khác khi xe được kéo không tự chạy được, trừ trường hợp quy định tại khoản 3 Điều 53 của Luật này và phải bảo đảm các quy định sau đây:\n\na) Xe được kéo phải có người điều khiển và hệ thống lái của xe đó phải còn hiệu lực;\n\nb) Việc nối xe kéo với xe được kéo phải bảo đảm chắc chắn, an toàn; trường hợp hệ thống hãm của xe được kéo không còn hiệu lực thì xe kéo nhau phải nối bằng thanh nối cứng;\n\nc) Phía trước của xe kéo và phía sau của xe được kéo phải có biển báo hiệu, có đèn cảnh báo nhấp nháy màu vàng.\n\n2. Xe kéo rơ moóc, xe ô tô đầu kéo chỉ được kéo rơ moóc, sơ mi rơ moóc phù hợp với thiết kế của xe; việc kết nối xe kéo với rơ moóc, xe ô tô đầu kéo với sơ mi rơ moóc phải bảo đảm chắc chắn, an toàn.\n\n3. Không được chở người trên xe được kéo, trừ người điều khiển; xe kéo rơ moóc, xe ô tô đầu kéo kéo sơ mi rơ moóc không được kéo thêm rơ moóc, sơ mi rơ moóc hoặc xe khác.\n\nĐiều 30. Người đi bộ; trẻ em, phụ nữ mang thai, người già yếu, người khuyết tật, người mất năng lực hành vi dân sự tham gia giao thông đường bộ\n\n1. Người đi bộ phải tuân thủ các quy định sau đây:\n\na) Phải đi trên vỉa hè, lề đường, đường dành riêng cho người đi bộ; trường hợp đường không có vỉa hè, lề đường, đường dành riêng cho người đi bộ thì người đi bộ phải đi sát mép đường bên phải theo chiều đi của mình;\n\nb) Chỉ được qua đường ở những nơi có đèn tín hiệu, có vạch kẻ đường hoặc có cầu vượt, hầm dành cho người đi bộ và phải tuân thủ tín hiệu chỉ dẫn, báo hiệu đường bộ. Trường hợp không có đèn tín hiệu, vạch kẻ đường, cầu vượt, hầm dành cho người đi bộ thì phải quan sát các xe đang đi tới, chỉ qua đường khi bảo đảm an toàn, khi qua đường phải có tín hiệu bằng tay;\n\nc) Không được vượt qua dải phân cách, đu, bám vào phương tiện giao thông đường bộ đang di chuyển; khi mang, vác vật cồng kềnh phải bảo đảm an toàn và không gây trở ngại cho người và phương tiện tham gia giao thông đường bộ.\n\n2. Trẻ em, phụ nữ mang thai, người già yếu, người khuyết tật, người mất năng lực hành vi dân sự tham gia giao thông đường bộ được quy định như sau:\n\na) Trẻ em dưới 07 tuổi khi đi qua đường phải có người lớn dẫn dắt; \n\nb) Người khuyết tật sử dụng xe lăn có động cơ hoặc không có động cơ phải đi trên vỉa hè, lề đường và nơi có vạch kẻ đường dành cho người đi bộ và xe thô sơ;\n\nc) Người khiếm thị khi đi trên đường bộ phải có người dẫn dắt hoặc có công cụ để báo hiệu cho người khác nhận biết là người khiếm thị;\n\nd) Người mất năng lực hành vi dân sự khi đi trên đường bộ phải có người dẫn dắt;\n\nđ) Mọi người có trách nhiệm giúp đỡ trẻ em dưới 07 tuổi, phụ nữ mang thai, người già yếu, người khuyết tật, người mất năng lực hành vi dân sự khi đi qua đường.\n\nĐiều 31. Người điều khiển, người được chở, hàng hóa xếp trên xe thô sơ\n\n1. Người điều khiển xe đạp, xe đạp máy chỉ được chở một người, trừ trường hợp chở thêm một trẻ em dưới 07 tuổi thì được chở tối đa hai người.\n\n2. Người điều khiển xe đạp, xe đạp máy không được thực hiện các hành vi quy định tại khoản 3 Điều 33 của Luật này; người được chở trên xe đạp, xe đạp máy khi tham gia giao thông đường bộ không được thực hiện các hành vi quy định tại khoản 4 Điều 33 của Luật này. \n\n3. Người điều khiển, người được chở trên xe đạp máy phải đội mũ bảo hiểm theo đúng quy chuẩn kỹ thuật quốc gia và cài quai đúng quy cách. \n\n4. Người điều khiển xe thô sơ chỉ được cho xe đi hàng một, nơi có phần đường dành cho xe thô sơ thì phải đi đúng phần đường quy định; khi tham gia giao thông đường bộ trong thời gian từ 18 giờ ngày hôm trước đến 06 giờ ngày hôm sau phải sử dụng đèn hoặc có báo hiệu ở phía trước và phía sau xe. \n\n5. Hàng hóa xếp trên xe thô sơ phải bảo đảm an toàn, không gây cản trở giao thông và che khuất tầm nhìn của người điều khiển. Hàng hóa xếp trên xe không vượt quá 1/3 chiều dài thân xe và không vượt quá 01 mét phía trước và phía sau xe; không vượt quá 0,4 mét mỗi bên bánh xe.\n\nĐiều 32. Người điều khiển, dẫn dắt vật nuôi, điều khiển xe vật nuôi kéo đi trên đường bộ\n\n1. Người điều khiển, dẫn dắt vật nuôi, điều khiển xe vật nuôi kéo đi trên đường bộ phải cho vật nuôi đi sát mép đường bên phải; trường hợp cần cho vật nuôi đi ngang qua đường thì phải quan sát và chỉ được đi qua đường khi có đủ điều kiện an toàn; không được gây cản trở cho người và phương tiện tham gia giao thông đường bộ khác.\n\n2. Không được điều khiển, dẫn dắt vật nuôi, điều khiển xe vật nuôi kéo đi vào làn đường dành cho xe cơ giới. \n\n3. Không được thả vật nuôi trên đường bộ.\n\nĐiều 33. Người lái xe, người được chở, hàng hóa xếp trên xe mô tô, xe gắn máy\n\n1. Người lái xe mô tô hai bánh, xe gắn máy chỉ được chở một người, trừ những trường hợp sau thì được chở tối đa hai người:\n\na) Chở người bệnh đi cấp cứu;\n\nb) Áp giải người có hành vi vi phạm pháp luật;\n\nc) Trẻ em dưới 12 tuổi;\n\nd) Người già yếu hoặc người khuyết tật.\n\n2. Người lái xe, người được chở trên xe mô tô hai bánh, xe mô tô ba bánh, xe gắn máy phải đội mũ bảo hiểm theo đúng quy chuẩn kỹ thuật quốc gia và cài quai đúng quy cách.\n\n3. Người lái xe mô tô hai bánh, xe mô tô ba bánh, xe gắn máy không được thực hiện các hành vi sau đây:\n\na) Đi xe dàn hàng ngang;\n\nb) Đi xe vào phần đường dành cho người đi bộ và phương tiện khác;\n\nc) Sử dụng ô, thiết bị âm thanh, trừ thiết bị trợ thính;\n\nd) Buông cả hai tay; đi xe bằng một bánh đối với xe mô tô, xe gắn máy hai bánh; đi xe bằng hai bánh đối với xe mô tô, xe gắn máy ba bánh;\n\nđ) Sử dụng xe để kéo, đẩy xe khác, vật khác, dẫn dắt vật nuôi, mang, vác và chở vật cồng kềnh; chở người đứng trên xe, giá đèo hàng hoặc ngồi trên tay lái; xếp hàng hóa trên xe quá giới hạn quy định;\n\ne) Ngồi về một bên điều khiển xe; đứng, nằm trên xe điều khiển xe; thay người lái xe khi xe đang chạy; quay người về phía sau để điều khiển xe hoặc bịt mắt điều khiển xe; sử dụng chân chống hoặc vật khác quệt xuống đường khi xe đang chạy;\n\ng) Hành vi khác gây mất trật tự, an toàn giao thông đường bộ.\n\n4. Người được chở trên xe mô tô hai bánh, xe mô tô ba bánh, xe gắn máy\xa0 khi tham gia giao thông đường bộ không được thực hiện các hành vi sau đây:\n\na) Mang, vác vật cồng kềnh;\n\nb) Sử dụng ô;\n\nc) Bám, kéo hoặc đẩy các phương tiện khác;\n\nd) Đứng trên yên, giá đèo hàng hoặc ngồi trên tay lái;\n\nđ) Hành vi khác gây mất trật tự, an toàn giao thông đường bộ.']","**Nguồn văn bản:** /content/drive/MyDrive/ITProject_data/new_law/36_2024_QH15_444251.docx

**Tên văn bản:** Không có thông tin

**Điều:** Không có thông tin cụ thể về điều khoản

**Nội dung:**

Dựa trên văn bản được cung cấp, không có quy định cụ thể nào về việc sử dụng xe ô tô chở bệnh nhân trong Luật Giao thông Đường bộ. Tuy nhiên, một số điều khoản liên quan có thể được tham khảo:

Điều 28 đề cập đến việc chở người trên xe ô tô chở hàng, trong đó nêu rõ chỉ được phép trong các trường hợp khẩn cấp như:

a) Chở người đi làm nhiệm vụ cứu nạn, cứu hộ, phòng, chống thiên tai, dịch bệnh hoặc thực hiện nhiệm vụ khẩn cấp; chở người bị nạn đi cấp cứu; đưa người ra khỏi khu vực nguy hiểm hoặc trong trường hợp khẩn cấp khác theo quy định của pháp luật.

b) Chở người thuộc lực lượng vũ trang nhân dân đi làm nhiệm vụ khẩn cấp.

c) Chở người đi thực hành lái xe trên xe tập lái; chở người dự sát hạch lái xe trên xe sát hạch; chở công nhân đang làm nhiệm vụ duy tu, bảo dưỡng đường bộ.

d) Chở người diễu hành theo đoàn khi được cơ quan có thẩm quyền cho phép.


Điều 33 đề cập đến việc chở người trên xe mô tô, xe gắn máy, trong đó nêu rõ trường hợp được phép chở tối đa hai người bao gồm:

a) Chở người bệnh đi cấp cứu.

b) Áp giải người có hành vi vi phạm pháp luật.

c) Trẻ em dưới 12 tuổi.

d) Người già yếu hoặc người khuyết tật.


Lưu ý:  Các điều khoản trên chỉ đề cập đến các trường hợp đặc biệt.  Để biết rõ hơn về quy định cụ thể liên quan đến việc sử dụng xe ô tô chở bệnh nhân, cần tham khảo thêm các văn bản pháp luật khác hoặc các cơ quan chức năng có thẩm quyền.


Tóm lại: Văn bản không cung cấp thông tin trực tiếp về quy định chở bệnh nhân bằng ô tô. Tuy nhiên, các điều khoản về chở người trong trường hợp khẩn cấp (cứu hộ, cấp cứu) trên xe ô tô chở hàng và xe mô tô có thể được xem xét trong trường hợp tương tự.  Cần tìm kiếm thêm thông tin từ các nguồn khác để có câu trả lời đầy đủ.
",Xe ô tô chở bệnh nhân phải được trang bị thiết bị y tế cần thiết và đáp ứng các tiêu chuẩn an toàn.,1.0,0.0,0.0,0.0
41,Quy định mới về việc sử dụng xe ô tô chở hàng nguy hiểm là gì?,"['5. Phạt tiền từ 12.000.000 đồng đến 14.000.000 đồng đối với hành vi vận chuyển hàng hóa nguy hiểm không có giấy phép vận chuyển hàng hóa nguy hiểm hoặc có nhưng hết hiệu lực hoặc không thực hiện đúng quy định trong giấy phép vận chuyển hàng hóa nguy hiểm, trừ các hành vi vi phạm quy định tại điểm a khoản 6 Điều 20 của Nghị định này.\n\n6. Ngoài việc bị áp dụng hình thức xử phạt, người thực hiện hành vi vi phạm quy định tại khoản 4, khoản 5 Điều này nếu gây ô nhiễm môi trường còn bị áp dụng các biện pháp khắc phục hậu quả buộc thực hiện các biện pháp khắc phục tình trạng ô nhiễm môi trường do vi phạm hành chính gây ra.\n\n7. Ngoài việc bị áp dụng hình thức xử phạt, người điều khiển phương tiện thực hiện hành vi vi phạm còn bị trừ điểm giấy phép lái xe như sau:\n\na) Thực hiện hành vi quy định tại khoản 3, khoản 4 Điều này bị trừ điểm giấy phép lái xe 02 điểm;\n\nb) Thực hiện hành vi quy định tại khoản 5 Điều này bị trừ điểm giấy phép lái xe 04 điểm.\n\nĐiều 24. Xử phạt, trừ điểm giấy phép lái xe của người điều khiển xe ô tô thực hiện hành vi vi phạm quy định về vận chuyển động vật sống, thực phẩm tươi sống\n\n1. Phạt tiền từ 1.000.000 đồng đến 2.000.000 đồng đối với hành vi vi phạm vận chuyển động vật sống, thực phẩm tươi sống không mang đủ giấy tờ theo quy định (đối với loại động vật sống, thực phẩm tươi sống khi vận chuyển phải có giấy tờ).\n\n2. Phạt tiền từ 3.000.000 đồng đến 5.000.000 đồng đối với hành vi vi phạm vận chuyển thực phẩm tươi sống không chấp hành quy định về an toàn thực phẩm, vệ sinh dịch tễ, phòng dịch và bảo đảm vệ sinh môi trường theo quy định.\n\n3. Ngoài việc bị áp dụng hình thức xử phạt, người điều khiển phương tiện thực hiện hành vi vi phạm quy định tại khoản 2 Điều này còn bị trừ điểm giấy phép lái xe 02 điểm.\n\nĐiều 25. Xử phạt, trừ điểm giấy phép lái xe của người điều khiển xe vệ sinh môi trường, xe ô tô chở phế thải thực hiện hành vi vi phạm quy định về hoạt động vận tải trong đô thị\n\n1. Phạt tiền từ 2.000.000 đồng đến 3.000.000 đồng đối với hành vi điều khiển xe không chạy đúng tuyến, phạm vi, thời gian quy định.\n\n2. Ngoài việc bị áp dụng hình thức xử phạt, người điều khiển phương tiện thực hiện hành vi vi phạm quy định tại khoản 1 Điều này còn bị trừ điểm giấy phép lái xe 02 điểm.\n\nĐiều 26. Xử phạt các hành vi vi phạm quy định về trật tự, an toàn giao thông đường bộ trong vận tải đường bộ, dịch vụ hỗ trợ vận tải đường bộ\n\n1. Phạt tiền từ 500.000 đồng đến 1.000.000 đồng đối với cá nhân, từ 1.000.000 đồng đến 2.000.000 đồng đối với tổ chức thực hiện một trong các hành vi vi phạm sau đây:\n\na) Xếp hàng hóa lên mỗi xe ô tô (kể cả rơ moóc và sơ mi rơ moóc) vượt quá trọng tải (khối lượng hàng chuyên chở) cho phép tham gia giao thông được ghi trong giấy chứng nhận kiểm định an toàn kỹ thuật và bảo vệ môi trường của xe trên 10% đến 50% (trừ xe xi téc chở chất lỏng), trên 20% đến 50% đối với xe xi téc chở chất lỏng;\n\nb) Xếp hàng hóa lên xe ô tô mà không ký xác nhận việc xếp hàng hóa vào giấy vận tải theo quy định.\n\n2. Phạt tiền từ 1.000.000 đồng đến 2.000.000 đồng đối với cá nhân, từ 2.000.000 đồng đến 4.000.000 đồng đối với tổ chức kinh doanh vận tải, dịch vụ hỗ trợ vận tải thực hiện một trong các hành vi vi phạm sau đây:\n\na) Không đánh số thứ tự ghế ngồi, giường nằm trên xe ô tô chở hành khách theo quy định;\n\nb) Sử dụng xe ô tô kinh doanh vận tải hành khách theo tuyến cố định, xe ô tô kinh doanh vận tải hành khách bằng xe buýt không có chỗ ưu tiên cho người khuyết tật, người cao tuổi và phụ nữ mang thai theo quy định;\n\nc) Sử dụng xe ô tô kinh doanh vận tải hành khách không có hướng dẫn cho hành khách về an toàn giao thông, thoát hiểm khi xảy ra sự cố trên xe theo quy định;\n\nd) Không bố trí người áp tải trên xe vận chuyển hàng hóa nguy hiểm đối với những trường hợp quy định phải có người áp tải;\n\nđ) Không cấp lệnh vận chuyển, giấy vận tải cho lái xe hoặc cấp lệnh vận chuyển, giấy vận tải nhưng không đúng theo quy định (đối với loại xe quy định phải cấp lệnh vận chuyển, giấy vận tải);\n\ne) Sử dụng xe vận chuyển hàng hóa nguy hiểm mà không làm sạch hoặc không bóc (xóa) biểu trưng nguy hiểm trên phương tiện khi không tiếp tục vận chuyển loại hàng hóa đó.\n\n3. Phạt tiền từ 2.000.000 đồng đến 3.000.000 đồng đối với cá nhân, từ 4.000.000 đồng đến 6.000.000 đồng đối với tổ chức thực hiện hành vi vi phạm xếp hàng hóa lên mỗi xe ô tô (kể cả rơ moóc và sơ mi rơ moóc) vượt quá trọng tải (khối lượng hàng chuyên chở) cho phép tham gia giao thông được ghi trong giấy chứng nhận kiểm định an toàn kỹ thuật và bảo vệ môi trường của xe trên 50% đến 100%.\n\n4. Phạt tiền từ 3.000.000 đồng đến 4.000.000 đồng đối với cá nhân, từ 6.000.000 đồng đến 8.000.000 đồng đối với tổ chức kinh doanh vận tải, dịch vụ hỗ trợ vận tải thực hiện một trong các hành vi vi phạm sau đây:\n\na) Không cấp thẻ nhận dạng lái xe cho lái xe theo quy định;\n\nb) Sử dụng lái xe, nhân viên phục vụ trên xe để tham gia kinh doanh vận tải bằng xe ô tô mà không được tập huấn, hướng dẫn về nghiệp vụ vận tải hành khách và an toàn giao thông theo quy định (đối với hình thức kinh doanh vận tải có quy định lái xe, nhân viên phục vụ trên xe phải được tập huấn, hướng dẫn nghiệp vụ), trừ các hành vi vi phạm quy định tại điểm c, điểm d khoản này;\n\nc) Sử dụng lái xe, người quản lý trên xe để tham gia kinh doanh vận tải bằng xe ô tô mà không được hướng dẫn về quy trình bảo đảm an toàn khi đưa đón trẻ em mầm non, học sinh;\n\nd) Sử dụng lái xe, người áp tải vận chuyển hàng hóa nguy hiểm mà không được tập huấn về vận chuyển hàng hóa nguy hiểm;\n\nđ) Sử dụng xe ô tô kinh doanh vận tải hành khách không có dây đai an toàn tại các vị trí ghế ngồi, giường nằm theo quy định (trừ xe buýt nội tỉnh);\n\ne) Sử dụng xe ô tô kinh doanh vận tải chở trẻ em mầm non, học sinh tiểu học, xe ô tô kinh doanh vận tải kết hợp với hoạt động đưa đón trẻ em mầm non, học sinh tiểu học không có dây đai an toàn phù hợp với lứa tuổi hoặc không có ghế ngồi phù hợp với lứa tuổi theo quy định;\n\ng) Không thực hiện việc niêm yết thông tin trên xe theo quy định hoặc có niêm yết nhưng không chính xác, không đầy đủ thông tin theo quy định.\n\n5. Phạt tiền từ 4.000.000 đồng đến 5.000.000 đồng đối với cá nhân, từ 8.000.000 đồng đến 10.000.000 đồng đối với tổ chức xếp hàng hóa lên mỗi xe ô tô (kể cả rơ moóc và sơ mi rơ moóc) vượt quá trọng tải (khối lượng hàng chuyên chở) cho phép tham gia giao thông được ghi trong giấy chứng nhận kiểm định an toàn kỹ thuật và bảo vệ môi trường của xe trên 100%.\n\n6. Phạt tiền từ 4.000.000 đồng đến 6.000.000 đồng đối với cá nhân, từ 8.000.000 đồng đến 12.000.000 đồng đối với tổ chức kinh doanh vận tải thực hiện một trong các hành vi vi phạm sau đây:\n\na) Sử dụng xe vận chuyển động vật sống không có kết cấu phù hợp với loại động vật chuyên chở theo quy định;\n\nb) Sử dụng xe ô tô kinh doanh vận tải chở trẻ em mầm non, học sinh, xe ô tô kinh doanh vận tải kết hợp với hoạt động đưa đón trẻ em mầm non, học sinh không có thiết bị ghi nhận hình ảnh trẻ em mầm non, học sinh hoặc không có thiết bị có chức năng cảnh báo, chống bỏ quên trẻ em trên xe hoặc không có thiết bị ghi nhận hình ảnh trẻ em mầm non, học sinh và thiết bị có chức năng cảnh báo, chống bỏ quên trẻ em trên xe;\n\nc) Sử dụng xe ô tô kinh doanh vận tải chở trẻ em mầm non, học sinh không có màu sơn theo quy định;\n\nd) Sử dụng xe ô tô kinh doanh vận tải chở trẻ em mầm non, học sinh, xe ô tô kinh doanh vận tải kết hợp với hoạt động đưa đón trẻ em mầm non, học sinh không có biển báo dấu hiệu nhận biết là xe chở trẻ em mầm non, học sinh theo quy định.\n\n7. Phạt tiền từ 5.000.000 đồng đến 6.000.000 đồng đối với cá nhân, từ 10.000.000 đồng đến 12.000.000 đồng đối với tổ chức kinh doanh vận tải, dịch vụ hỗ trợ vận tải thực hiện một trong các hành vi vi phạm sau đây:\n\na) Không thực hiện việc cung cấp, cập nhật, truyền, lưu trữ, quản lý thông tin, dữ liệu từ thiết bị giám sát hành trình theo quy định;\n\nb) Không thực hiện đúng nội dung thông tin đã niêm yết trên xe theo quy định;']","**Nguồn văn bản:** /content/drive/MyDrive/ITProject_data/new_law/168_2024_ND-CP_619502.docx

**Tên văn bản:**  (Tên văn bản không được cung cấp trong context)

**Điều:** (Điều không được cung cấp trong context)


**Nội dung:**

Dựa trên văn bản được cung cấp, quy định về việc sử dụng xe ô tô chở hàng nguy hiểm được đề cập gián tiếp qua các khoản phạt liên quan đến việc vi phạm quy định vận chuyển hàng hóa nguy hiểm.  Cụ thể:

* **Điều 20 (không được trích dẫn đầy đủ trong context):**  Văn bản đề cập đến việc phạt tiền từ 12.000.000 đồng đến 14.000.000 đồng đối với hành vi vận chuyển hàng hóa nguy hiểm không có giấy phép vận chuyển hoặc có nhưng hết hiệu lực hoặc không thực hiện đúng quy định trong giấy phép.  Điều này ngụ ý rằng việc vận chuyển hàng hóa nguy hiểm cần có giấy phép và tuân thủ các quy định trong giấy phép đó.

* **Điều 26, khoản 2, điểm d):**  Quy định phạt tiền từ 1.000.000 đồng đến 2.000.000 đồng đối với tổ chức kinh doanh vận tải vi phạm quy định về việc không bố trí người áp tải trên xe vận chuyển hàng hóa nguy hiểm đối với những trường hợp quy định phải có người áp tải.  Điều này cho thấy trong một số trường hợp vận chuyển hàng hóa nguy hiểm, việc có người áp tải là bắt buộc.

* **Điều 26, khoản 2, điểm e):** Quy định phạt tiền từ 1.000.000 đồng đến 2.000.000 đồng đối với tổ chức kinh doanh vận tải vi phạm quy định về việc sử dụng xe vận chuyển hàng hóa nguy hiểm mà không làm sạch hoặc không bóc (xóa) biểu trưng nguy hiểm trên phương tiện khi không tiếp tục vận chuyển loại hàng hóa đó. Điều này nhấn mạnh tầm quan trọng của việc tuân thủ các quy định về an toàn và làm sạch phương tiện sau khi vận chuyển hàng hóa nguy hiểm.


**Tóm lại:**  Văn bản không cung cấp một quy định toàn diện về việc sử dụng xe ô tô chở hàng nguy hiểm. Tuy nhiên, nó nhấn mạnh tầm quan trọng của việc có giấy phép vận chuyển, tuân thủ các quy định trong giấy phép, bố trí người áp tải khi cần thiết và làm sạch phương tiện sau khi vận chuyển hàng hóa nguy hiểm để tránh bị phạt tiền.  Để có thông tin đầy đủ và chính xác, cần tham khảo toàn văn Nghị định số 168/2024/NĐ-CP.
",Xe ô tô chở hàng nguy hiểm phải có giấy phép đặc biệt và tuân thủ các quy định về an toàn và môi trường.,0.9230769230769231,0.7121611301948477,1.0,0.9999999999
42,"Luật Giao thông Đường bộ 2025 có quy định gì về việc sử dụng xe ô tô chở hàng quá khổ, quá tải?","['BỘ GIAO THÔNG VẬN TẢI\n------- CỘNG HÒA XÃ HỘI CHỦ NGHĨA VIỆT NAM\nĐộc lập - Tự do - Hạnh phúc\n--------------- Số: 39/2024/TT-BGTVT Hà Nội, ngày 15 tháng 11 năm 2024\n\nTHÔNG TƯ\n\nQUY ĐỊNH VỀ TẢI TRỌNG, KHỔ GIỚI HẠN CỦA ĐƯỜNG BỘ; LƯU HÀNH XE QUÁ KHỔ GIỚI HẠN, XE QUÁ TẢI TRỌNG, XE BÁNH XÍCH TRÊN ĐƯỜNG BỘ; HÀNG SIÊU TRƯỜNG, SIÊU TRỌNG, VẬN CHUYỂN HÀNG SIÊU TRƯỜNG, SIÊU TRỌNG; XẾP HÀNG HÓA TRÊN PHƯƠNG TIỆN GIAO THÔNG ĐƯỜNG BỘ; CẤP GIẤY PHÉP LƯU HÀNH CHO XE QUÁ TẢI TRỌNG, XE QUÁ KHỔ GIỚI HẠN, XE BÁNH XÍCH, XE VẬN CHUYỂN HÀNG SIÊU TRƯỜNG, SIÊU TRỌNG TRÊN ĐƯỜNG BỘ\n\nCăn cứ Luật Đường bộ ngày 27 tháng 6 năm 2024;\n\nCăn cứ Luật Trật tự, an toàn giao thông đường bộ ngày 27 tháng 6 năm 2024;\n\nCăn cứ Nghị định số 56/2022/NĐ-CP ngày 24 tháng 8 năm 2022 của Chính phủ quy định chức năng, nhiệm vụ, quyền hạn và cơ cấu tổ chức của Bộ Giao thông vận tải;\n\nTheo đề nghị của Vụ trưởng Vụ Kết cấu hạ tầng giao thông và Cục trưởng Cục Đường bộ Việt Nam;\n\nBộ trưởng Bộ Giao thông vận tải ban hành Thông tư quy định về tải trọng, khổ giới hạn của đường bộ; lưu hành xe quá khổ giới hạn, xe quá tải trọng, xe bánh xích trên đường bộ; hàng siêu trường, siêu trọng, vận chuyển hàng siêu trường, siêu trọng; xếp hàng hóa trên phương tiện giao thông đường bộ; cấp giấy phép lưu hành cho xe quá tải trọng, xe quá khổ giới hạn, xe bánh xích, xe vận chuyển hàng siêu trường, siêu trọng trên đường bộ.\n\nChương I\n\nQUY ĐỊNH CHUNG\n\nĐiều 1. Phạm vi điều chỉnh\n\nThông tư này quy định về tải trọng, khổ giới hạn của đường bộ; lưu hành xe quá khổ giới hạn, xe quá tải trọng, xe bánh xích trên đường bộ; hàng siêu trường, siêu trọng, vận chuyển hàng siêu trường, siêu trọng; xếp hàng hóa trên phương tiện giao thông đường bộ; cấp giấy phép lưu hành cho xe quá tải trọng, xe quá khổ giới hạn, xe bánh xích, xe vận chuyển hàng siêu trường, siêu trọng trên đường bộ.\n\nĐiều 2. Đối tượng áp dụng\n\nThông tư này áp dụng đối với tổ chức, cá nhân liên quan đến: quản lý, công bố tải trọng, khổ giới hạn của đường bộ; lưu hành xe quá khổ giới hạn, xe quá tải trọng, xe bánh xích trên đường bộ, vận chuyển hàng siêu trường, siêu trọng; xếp hàng hóa trên phương tiện giao thông đường bộ; cấp giấy phép lưu hành cho xe quá tải trọng, xe quá khổ giới hạn, xe bánh xích, xe vận chuyển hàng siêu trường, siêu trọng trên đường bộ.\n\nĐiều 3. Giải thích từ ngữ\n\nTrong Thông tư này, các từ ngữ dưới đây được hiểu như sau:\n\n1. Khối lượng toàn bộ của xe gồm khối lượng bản thân xe cộng với khối lượng của thiết bị chuyên dùng để hỗ trợ phục vụ vận chuyển hàng siêu trường, siêu trọng được lắp, đặt vào phương tiện theo hướng dẫn của nhà sản xuất (nếu có) cộng với khối lượng của người, hành lý và hàng hóa (bao gồm cả công te nơ; các thiết bị được sử dụng để kê, chèn, chằng buộc hàng hóa) xếp trên xe (nếu có).\n\n2. Tải trọng trục xe là khối lượng toàn bộ của xe phân bố trên mỗi trục xe hoặc cụm trục xe.\n\n3. Kích thước tối đa cho phép của phương tiện giao thông cơ giới đường bộ là kích thước bao ngoài giới hạn về chiều rộng, chiều cao, chiều dài của xe kể cả hàng hóa xếp trên xe (nếu có) được phép tham gia giao thông trên đường bộ.\n\n4. Xe bánh xích là loại xe máy chuyên dùng tự hành di chuyển bằng bánh xích, khi tham gia giao thông trên đường bộ, răng xích có thể gây hư hỏng mặt đường, lề đường.\n\n5. Tổ hợp xe là một xe ô tô kéo một rơ moóc hoặc một xe ô tô đầu kéo kéo một sơ mi rơ moóc.\n\n\n\n6. Hàng không thể chia nhỏ, tháo rời (sau đây viết là hàng không thể tháo rời) là hàng dạng kiện còn nguyên kẹp chì, niêm phong của cơ quan hải quan, an ninh, quốc phòng hoặc là tổ hợp cấu kiện, thiết bị, máy móc nếu tháo rời, chia nhỏ sẽ bị hư hỏng hoặc thay đổi công năng.\n\n7. Đường ngang là đoạn đường bộ giao nhau cùng mức với đường sắt, được cơ quan có thẩm quyền cho phép xây dựng và khai thác.\n\n8. Doanh nghiệp đầu tư xây dựng và quản lý khai thác công trình đường bộ là doanh nghiệp dự án đối tác công tư (PPP) và doanh nghiệp được Nhà nước giao đầu tư xây dựng, quản lý, khai thác công trình đường bộ.\n\n9. Đơn nguyên hàng là 01 kiện hàng còn nguyên kẹp chì, niêm phong của cơ quan hải quan, an ninh, quốc phòng hoặc 01 cấu kiện xây dựng hoặc 01 phương tiện, thiết bị, máy móc nguyên chiếc.\n\n10. Đơn vị vận tải là tổ chức, cá nhân sử dụng phương tiện để vận tải hàng hóa trên đường bộ.\n\n11. Người xếp hàng là tổ chức, cá nhân thực hiện việc xếp hàng hóa trên phương tiện giao thông đường bộ.\n\n12. Người áp tải là cá nhân do người thuê vận tải hoặc chủ hàng sử dụng để thực hiện nhiệm vụ áp tải hàng hóa trong quá trình vận chuyển trên đường bộ.\n\n13. Người thuê vận tải là tổ chức, cá nhân thuê đơn vị kinh doanh vận tải vận chuyển hàng hóa bằng phương tiện giao thông đường bộ.\n\n14. Hàng rời là hàng hóa thông thường không được đóng thùng, đóng bao hoặc đóng gói, khi vận chuyển được chứa trực tiếp bằng thùng chở hàng của xe ô tô tải, xe chuyên dùng, xe ô tô tải chuyên dùng, rơ moóc tải chuyên dùng, sơ mi rơ moóc tải chuyên dùng, rơ moóc chuyên dùng, sơ mi rơ moóc chuyên dùng.\n\n15. Hàng bao kiện là hàng hóa được đóng gói trong bao, thùng hoặc kiện để bảo quản và bảo vệ hàng hóa khi vận chuyển.\n\n16. Hàng hình trụ là hàng hóa có hình dạng trụ tròn hoặc hình ống tròn dễ lăn trên mặt phẳng.\n\nChương II\n\nQUY ĐỊNH VỀ TẢI TRỌNG, KHỔ GIỚI HẠN CỦA ĐƯỜNG BỘ\n\nĐiều 4. Tải trọng của đường bộ\n\n1. Tải trọng của đường bộ được quy định tại khoản 1 Điều 27 Luật Đường bộ.\n\n2. Khả năng chịu tải khai thác của đường bộ bao gồm:\n\na) Khả năng chịu tải khai thác của cầu đường bộ được xác định theo hồ sơ thiết kế cầu và tình trạng kỹ thuật thực tế của cầu đường bộ, được cơ quan có thẩm quyền công bố theo quy định tại Điều 6, Điều 7 của Thông tư này;\n\nb) Khả năng chịu tải khai thác của đường được xác định theo hồ sơ thiết kế mặt đường và tình trạng kỹ thuật thực tế của đường, được cơ quan có thẩm quyền công bố theo quy định tại Điều 6, Điều 7 của Thông tư này.\n\nĐiều 5. Khổ giới hạn của đường bộ\n\nKhổ giới hạn của đường bộ được quy định tại khoản 2 Điều 27 Luật Đường bộ, được cơ quan có thẩm quyền công bố theo quy định tại Điều 6, Điều 7 của Thông tư này.\n\nĐiều 6. Công bố tải trọng, khổ giới hạn của đường bộ và trạng thái kỹ thuật đường ngang\n\n1. Cục Đường bộ Việt Nam công bố về tải trọng, khổ giới hạn của quốc lộ được quy định tại khoản 3 Điều 8 Luật Đường bộ (trừ các trường hợp quy định tại khoản 2, khoản 4 Điều này) trên Trang thông tin điện tử của Cục Đường bộ Việt Nam.\n\n2. Cục Đường cao tốc Việt Nam công bố về tải trọng, khổ giới hạn của các tuyến đường cao tốc được giao quản lý trên Trang thông tin điện tử của Cục Đường cao tốc Việt Nam; đồng thời gửi số liệu về Cục Đường bộ Việt Nam để cập nhật trên Trang thông tin điện tử của Cục Đường bộ Việt Nam.\n\n3. Cục Đường sắt Việt Nam công bố trạng thái kỹ thuật đường ngang của mạng lưới đường sắt Việt Nam trên Trang thông tin điện tử của Cục Đường sắt Việt Nam; đồng thời gửi số liệu về Cục Đường bộ Việt Nam để cập nhật trên Trang thông tin điện tử của Cục Đường bộ Việt Nam.\n\n4. Ủy ban nhân dân cấp tỉnh công bố về tải trọng, khổ giới hạn của đường bộ thuộc phạm vi quản lý và đường chuyên dùng có hoạt động giao thông công cộng trên Trang thông tin điện tử của Ủy ban nhân dân cấp tỉnh.\n\n\n\n5. Các cơ quan có thẩm quyền quy định tại khoản 1, khoản 2, khoản 3 và khoản 4 Điều này công bố công khai thông tin tải trọng, khổ giới hạn của đường bộ theo mẫu quy định tại Phụ lục IX ban hành kèm theo Thông tư này.\n\nĐiều 7. Điều chỉnh công bố tải trọng, khổ giới hạn của đường bộ và trạng thái kỹ thuật đường ngang']","**Nguồn văn bản:** /content/drive/MyDrive/ITProject_data/new_law/39_2024_TT-BGTVT_633952.docx

**Tên văn bản:** THÔNG TƯ QUY ĐỊNH VỀ TẢI TRỌNG, KHỔ GIỚI HẠN CỦA ĐƯỜNG BỘ; LƯU HÀNH XE QUÁ KHỔ GIỚI HẠN, XE QUÁ TẢI TRỌNG, XE BÁNH XÍCH TRÊN ĐƯỜNG BỘ; HÀNG SIÊU TRƯỜNG, SIÊU TRỌNG, VẬN CHUYỂN HÀNG SIÊU TRƯỜNG, SIÊU TRỌNG; XẾP HÀNG HÓA TRÊN PHƯƠNG TIỆN GIAO THÔNG ĐƯỜNG BỘ; CẤP GIẤY PHÉP LƯU HÀNH CHO XE QUÁ TẢI TRỌNG, XE QUÁ KHỔ GIỚI HẠN, XE BÁNH XÍCH, XE VẬN CHUYỂN HÀNG SIÊU TRƯỜNG, SIÊU TRỌNG TRÊN ĐƯỜNG BỘ

**Nội dung:**

Thông tư này quy định về tải trọng, khổ giới hạn của đường bộ; lưu hành xe quá khổ giới hạn, xe quá tải trọng, xe bánh xích trên đường bộ; hàng siêu trường, siêu trọng, vận chuyển hàng siêu trường, siêu trọng; xếp hàng hóa trên phương tiện giao thông đường bộ; cấp giấy phép lưu hành cho xe quá tải trọng, xe quá khổ giới hạn, xe bánh xích, xe vận chuyển hàng siêu trường, siêu trọng trên đường bộ.

Điều 4. Tải trọng của đường bộ:

1. Tải trọng của đường bộ được quy định tại khoản 1 Điều 27 Luật Đường bộ.

2. Khả năng chịu tải khai thác của đường bộ bao gồm:

    a) Khả năng chịu tải khai thác của cầu đường bộ được xác định theo hồ sơ thiết kế cầu và tình trạng kỹ thuật thực tế của cầu đường bộ, được cơ quan có thẩm quyền công bố theo quy định tại Điều 6, Điều 7 của Thông tư này;

    b) Khả năng chịu tải khai thác của đường được xác định theo hồ sơ thiết kế mặt đường và tình trạng kỹ thuật thực tế của đường, được cơ quan có thẩm quyền công bố theo quy định tại Điều 6, Điều 7 của Thông tư này.

Điều 5. Khổ giới hạn của đường bộ:

Khổ giới hạn của đường bộ được quy định tại khoản 2 Điều 27 Luật Đường bộ, được cơ quan có thẩm quyền công bố theo quy định tại Điều 6, Điều 7 của Thông tư này.


Tóm lại: Thông tư này quy định chi tiết về tải trọng và khổ giới hạn của đường bộ,  cũng như quy trình lưu hành xe quá khổ, quá tải,  vận chuyển hàng siêu trường, siêu trọng và cấp giấy phép liên quan.  Thông tư nêu rõ cách xác định tải trọng đường bộ (bao gồm cầu và đường) và khổ giới hạn, đồng thời chỉ ra các cơ quan có thẩm quyền công bố thông tin này.
","Cấm xe ô tô chở hàng quá khổ, quá tải lưu thông trên đường bộ; trường hợp đặc biệt phải có giấy phép và tuân thủ các quy định an toàn.",0.9545454545454546,0.6280370276720492,1.0,0.9999999999
43,Quy định mới về việc sử dụng xe ô tô chở hàng đông lạnh là gì?,"['PHỤ LỤC IV\n\nPHÂN LOẠI Ô TÔ TẢI THÔNG DỤNG\n(Ban hành kèm theo Thông tư số 53/2024/TT-BGTVT ngày 15 tháng 11 năm 2024 của Bộ trưởng Bộ Giao thông vận tải quy định về phân loại phương tiện giao thông đường bộ và dấu hiệu nhận biết xe cơ giới sử dụng năng lượng sạch, năng lượng xanh, thân thiện môi trường)\n\nMục Tên gọi Đặc điểm Hình vẽ minh họa, ví dụ (nếu có) 1 Ô tô tải (Cargo truck, Opened truck) Ô tô chở hàng có thùng hàng dạng hở, thành phía sau, thành bên của thùng hàng có thể mở được. Có thể bố trí trang, thiết bị hỗ trợ việc xếp dỡ hàng (cần cẩu, thiết bị nâng, hạ hàng, thiết bị nâng người làm việc trên cao). 2 Ô tô tải tự đổ (Dumper, Tipper, Dump truck) Ô tô chở hàng có thùng hàng dạng hở được liên kết với khung xe thông qua các khớp quay, các khóa hãm và cơ cấu nâng, hạ thùng (xi lanh thủy lực kiểu telescope, cơ cấu arm-roll hoặc cơ cấu hooklift …) và có khả năng tự đổ hàng. Không bao gồm xe tự đổ bánh lốp quy định tại mục 4.5 Phụ lục X ban hành kèm theo Thông tư này. 3 Ô tô tải Pickup ca bin đơn (Pickup with single cab) Ô tô chở hàng có kiểu dáng ca bin và tiện nghi trong khoang chở người tương tự như ô tô con và có các đặc điểm sau: - Thùng hàng dạng hở (có thể có mui phủ) hoặc dạng kín, có thể liền hoặc không liền thân với ca bin, có bố trí cửa để xếp, dỡ hàng; - Trong ca bin có bố trí một hàng ghế; - Thùng hàng không có trang bị tiện nghi và nội thất phục vụ chở người; - Diện tích hữu ích của thùng hàng (Fh) không nhỏ hơn 01m2 và được xác định theo quy định tại Mục A Phụ lục XI ban hành kèm theo Thông tư này; - Tỷ lệ giữa tổng khối lượng hàng hóa cho phép chở (mh) và tổng khối lượng của số người cho phép chở (mng) phải đáp ứng được yêu cầu sau: Trong đó: mng = 65 (kg/người) nhân với số người cho phép chở kể cả người lái. 4 Ô tô tải Pickup ca bin kép (Pickup with double cab, pickup with extra cab) Ô tô chở hàng có kiểu dáng cabin và tiện nghi trong khoang chở người tương tự như ô tô con và có các đặc điểm sau: - Thùng hàng dạng hở (có thể có mui phủ) hoặc dạng kín, có thể liền hoặc không liền thân với ca bin, có bố trí cửa để xếp, dỡ hàng; - Trong ca bin có bố trí hai hàng ghế, có số người cho phép chở kể cả người lái không lớn hơn 05 người; - Thùng hàng không có trang bị tiện nghi và nội thất phục vụ chở người; - Diện tích hữu ích của sàn thùng hàng (Fh) không nhỏ hơn 01m2 và được xác định theo quy định tại Mục A Phụ lục XI ban hành kèm theo Thông tư này; - Tỷ lệ giữa tổng khối lượng hàng hóa cho phép chở (mh) và tổng khối lượng của số người cho phép chở (mng) phải đáp ứng được yêu cầu sau: Trong đó: mng = 65 (kg/người) nhân với số người cho phép chở kể cả người lái. 5 Ô tô tải VAN Ô tô chở hàng có các đặc điểm sau: - Khoang chở hàng dạng kín liền khối với khoang người ngồi; - Có bố trí cửa xếp dỡ hàng ở phía sau và có thể có thêm ở hai bên thành xe; - Có vách ngăn hoặc kết cấu rào chắn cố định để ngăn cách giữa khoang chở hàng và khoang người ngồi; - Không bố trí cửa sổ trên các thành xe tại khu vực khoang chở hàng và trên các cửa xếp dỡ hàng ở hai bên thành xe; nếu có cửa sổ là cửa kính thì phải có các thanh chắn hoặc lưới kim loại để bảo vệ kính; - Diện tích hữu ích của sàn khoang chở hàng (Fh) không nhỏ hơn 01m2 và lớn hơn diện tích hữu ích của sàn khoang chở người (Fng) xác định theo quy định tại Mục B Phụ lục XI ban hành kèm theo Thông tư này; - Tỷ lệ giữa khối lượng hàng hoá cho phép chở (mh) với tổng khối lượng của số người cho phép chở không kể người lái (mng) lớn hơn 1,8; Cụ thể là: mh /mng > 1,8 Khối lượng tính toán cho một người được xác định theo quy định của nhà sản xuất nhưng không nhỏ hơn 65 (kg/người); - Tại khu vực khoang chở hàng không bố trí các trang thiết bị sau đây: Các kết cấu, liên kết chờ để lắp ghế; dây đai an toàn và các cơ cấu neo giữ đai an toàn; cơ cấu điều khiển điều hoà nhiệt độ; gạt tàn thuốc lá; giá để ly, cốc. 6 Ô tô tải có mui (Truck with canvas) Ô tô tải có trang bị thêm mui phủ cho thùng chở hàng để hạn chế nước, gió xâm nhập từ bên ngoài và có các đặc điểm sau: - Khung, mui phủ được cố định hoặc có thể tháo rời khỏi thùng hàng; - Mui phủ có thể là loại mui mềm (vải bạt, vải không thấm nước…) hoặc là loại mui cứng (kim loại, composite…). 7 Ô tô tải thùng kín (Dry van truck, Box body truck, Wing body truck, Hood wing truck) Ô tô chở hàng có các đặc điểm sau: - Có thùng hàng dạng hộp kín, có khả năng chống lại nước, gió, bụi xâm nhập từ bên ngoài nhưng không có khả năng cách nhiệt. - Có thể bố trí cửa ở thành phía sau, thành bên của thùng xe để xếp, dỡ hàng. 8 Ô tô tải đông lạnh (Refrigerated truck, Refrigerated van truck, Frozen truck) Ô tô chở hàng có các đặc điểm sau: - Thùng hàng dạng hộp kín, có khả năng chống lại nước, gió, bụi xâm nhập từ bên ngoài; - Thùng hàng phải làm từ loại vật liệu cách nhiệt hoặc có lớp vật liệu cách nhiệt; - Sàn xe phải có kết cấu để dẫn nhiệt và thoát nước; - Xe phải có thiết bị làm lạnh đảm bảo làm lạnh khoang chở hàng (khi không có hàng) từ nhiệt độ môi trường xuống dưới 0ºC trong vòng 45 phút khi xe ở trạng thái đứng yên, trường hợp xe có bố trí chia khoang chở hàng thành nhiều khoang thì mỗi khoang chở hàng phải đáp ứng được các yêu cầu trên; - Phía sau, thành bên của thùng hàng có thể mở được hoặc có bố trí cửa để xếp, dỡ hàng. 9 Ô tô tải bảo ôn (Insulated truck, Cooling truck, Cooling van truck) Ô tô chở hàng có đặc điểm sau: - Thùng hàng dạng hộp kín, có khả năng chống lại nước, gió, bụi xâm nhập từ bên ngoài; - Thùng hàng phải làm từ loại vật liệu cách nhiệt hoặc có lớp vật liệu cách nhiệt; - Xe có thể có hoặc không có thiết bị làm lạnh; có kết cấu sàn xe hoặc nhiệt độ làm lạnh không đáp ứng được yêu cầu của ô tô tải đông lạnh nêu tại Mục 8 Phụ lục này; - Phía sau, thành bên của thùng hàng có thể mở được hoặc có bố trí cửa để xếp, dỡ hàng. 10 Ô tô tải tập lái (Driver training truck) Ô tô tải thông dụng có dấu hiệu nhận biết và trang thiết bị đáp ứng các yêu cầu về xe tập lái theo quy định về đào tạo lái xe. 11 Ô tô tương tự khác Ô tô tương tự các loại ô tô quy định tại Phụ lục này. Ô tô tải Pickup cabin đơn đông lạnh; Ô tô tải Pickup cabin đơn thùng kín; Ô tô tải Pickup cabin kép có mui; Ô tô tải pickup cabin kép thùng kín; Ô tô tải VAN bảo ôn; Ô tô tải VAN đông lạnh.\n\nPHỤ LỤC V\n\nPHÂN LOẠI Ô TÔ TẢI CHUYÊN DÙNG\n(Ban hành kèm theo Thông tư số 53/2024/TT-BGTVT ngày 15 tháng 11 năm 2024 của Bộ trưởng Bộ Giao thông vận tải quy định về phân loại phương tiện giao thông đường bộ và dấu hiệu nhận biết xe cơ giới sử dụng năng lượng sạch, năng lượng xanh, thân thiện môi trường)']","**Nguồn văn bản:** /content/drive/MyDrive/ITProject_data/new_law/53_2024_TT-BGTVT_624420.docx

**Tên văn bản:** Thông tư số 53/2024/TT-BGTVT ngày 15 tháng 11 năm 2024 của Bộ trưởng Bộ Giao thông vận tải

**Nội dung:**

Theo Phụ lục IV, mục 8 của Thông tư số 53/2024/TT-BGTVT ngày 15 tháng 11 năm 2024, quy định về ô tô tải đông lạnh như sau:

Ô tô tải đông lạnh (Refrigerated truck, Refrigerated van truck, Frozen truck) có các đặc điểm sau:

A. Thùng hàng dạng hộp kín, có khả năng chống lại nước, gió, bụi xâm nhập từ bên ngoài;

B. Thùng hàng phải làm từ loại vật liệu cách nhiệt hoặc có lớp vật liệu cách nhiệt;

C. Sàn xe phải có kết cấu để dẫn nhiệt và thoát nước;

D. Xe phải có thiết bị làm lạnh đảm bảo làm lạnh khoang chở hàng (khi không có hàng) từ nhiệt độ môi trường xuống dưới 0ºC trong vòng 45 phút khi xe ở trạng thái đứng yên, trường hợp xe có bố trí chia khoang chở hàng thành nhiều khoang thì mỗi khoang chở hàng phải đáp ứng được các yêu cầu trên;

E. Phía sau, thành bên của thùng hàng có thể mở được hoặc có bố trí cửa để xếp, dỡ hàng.


Tóm lại:  Ô tô tải đông lạnh phải có thùng kín, cách nhiệt, hệ thống làm lạnh đảm bảo hạ nhiệt độ xuống dưới 0 độ C trong 45 phút khi xe đứng yên và có cửa để xếp dỡ hàng.
",Xe ô tô chở hàng đông lạnh phải được kiểm định và đáp ứng các tiêu chuẩn về nhiệt độ và vệ sinh.,0.8666666666666667,0.6365416748660598,0.0,0.0
44,Luật Giao thông Đường bộ 2025 có quy định gì về việc sử dụng xe ô tô chở xăng dầu?,"['BỘ\xa0GIAO THÔNG VẬN TẢI\n------- CỘNG HÒA XÃ HỘI CHỦ NGHĨA VIỆT NAM\nĐộc lập - Tự do - Hạnh phúc\n--------------- Số: 32/2024/TT-BGTVT Hà Nội, ngày 13 tháng 11 năm 2024\n\nTHÔNG TƯ\n\nQUY ĐỊNH VỀ QUẢN LÝ GIÁ DỊCH VỤ SỬ DỤNG ĐƯỜNG BỘ CỦA CÁC DỰ ÁN ĐẦU TƯ XÂY DỰNG ĐƯỜNG BỘ ĐỂ KINH DOANH, DO TRUNG ƯƠNG QUẢN LÝ\xa0\n\nCăn cứ Luật Giá ngày 19 tháng 6 năm 2023;\n\nCăn cứ Luật Đường bộ ngày 27 tháng 06 năm 2024;\n\nCăn cứ Nghị định số 85/2024/NĐ-CP ngày 10 tháng 07 năm 2024 của Chính phủ quy định chi tiết một số điều của Luật Giá;\n\nCăn cứ Nghị định số 56/2022/NĐ-CP ngày 24 tháng 8 năm 2022 của Chính phủ quy định chức năng, nhiệm vụ, quyền hạn và cơ cấu tổ chức của Bộ Giao thông vận tải;\n\nTheo đề nghị của Vụ trưởng Vụ Tài chính, Cục trưởng Cục Đường bộ Việt Nam;\n\nBộ trưởng Bộ Giao thông vận tải ban hành Thông tư quy định về quản lý giá dịch vụ sử dụng đường bộ của các dự án đầu tư xây dựng đường bộ để kinh doanh, do trung ương quản lý.\n\nChương I\n\nQUY ĐỊNH CHUNG\n\nĐiều 1. Phạm vi điều chỉnh và đối tượng áp dụng\n\n1. Thông tư này quy định về quản lý giá, các trường hợp miễn và giảm giá dịch vụ sử dụng đường bộ của các dự án đầu tư xây dựng đường bộ (trừ dịch vụ sử dụng đường bộ cao tốc) để kinh doanh, do trung ương quản lý.\n\n2. Thông tư này áp dụng đối với tổ chức, cá nhân liên quan đến việc kinh doanh, sử dụng và quản lý giá dịch vụ sử dụng đường bộ đối với các dự án đầu tư xây dựng đường bộ (trừ dịch vụ sử dụng đường bộ cao tốc) để kinh doanh, do trung ương quản lý.\n\nĐiều 2. Đối tượng và chủ phương tiện phải thanh toán tiền dịch vụ sử dụng đường bộ\n\n1. Đối tượng thanh toán tiền dịch vụ sử dụng đường bộ là phương tiện giao thông đường bộ lưu thông qua trạm thu phí của dự án đầu tư xây dựng đường bộ để kinh doanh do trung ương quản lý (sau đây gọi tắt là phương tiện).\n\n\n\n2. Tổ chức, cá nhân sở hữu, sử dụng hoặc quản lý phương tiện (sau đây gọi tắt là chủ phương tiện) thuộc đối tượng thanh toán tiền dịch vụ sử dụng đường bộ quy định tại khoản 1 Điều này phải thanh toán tiền dịch vụ sử dụng đường bộ, trừ các trường hợp quy định tại Điều 3 của Thông tư này.\n\nĐiều 3. Đối tượng miễn thu tiền dịch vụ sử dụng đường bộ\n\n1. Xe cứu thương.\n\n2. Xe chữa cháy của lực lượng Cảnh sát phòng cháy, chữa cháy và cứu nạn, cứu hộ và xe chữa cháy của lực lượng khác được huy động đi làm nhiệm vụ chữa cháy có tín hiệu ưu tiên theo quy định của pháp luật.\n\n3. Xe máy nông nghiệp, lâm nghiệp gồm: máy cày, máy bừa, máy xới, máy làm cỏ, máy tuốt lúa.\n\n4. Xe chuyên dùng phục vụ quốc phòng bao gồm các xe mang biển số: nền màu đỏ, chữ và số màu trắng dập chìm có gắn các thiết bị chuyên dụng cho quốc phòng (bao gồm: xe xi téc, xe cần cẩu, xe chở lực lượng vũ trang hành quân được hiểu là xe ô tô chở người có từ 12 chỗ ngồi trở lên, xe vận tải có mui che và được lắp đặt ghế ngồi trong thùng xe, xe kiểm soát, xe kiểm tra quân sự, xe chuyên dùng chở phạm nhân, xe cứu hộ, cứu nạn, xe thông tin vệ tinh, các xe ô tô đặc chủng khác phục vụ quốc phòng), xe đang đi làm nhiệm vụ khẩn cấp sử dụng một trong các tín hiệu ưu tiên theo quy định của pháp luật trong trường hợp làm nhiệm vụ khẩn cấp.\n\n5. Xe chuyên dùng của các đơn vị thuộc hệ thống tổ chức của lực lượng Công an nhân dân bao gồm:\n\na) Xe ô tô tuần tra kiểm soát giao thông của cảnh sát giao thông có đặc điểm: trên nóc xe ô tô có đèn xoay và hai bên thân xe ô tô có in dòng chữ “CẢNH SÁT GIAO THÔNG”;\n\nb) Xe ô tô cảnh sát 113 có in dòng chữ “CẢNH SÁT 113” ở hai bên thân xe;\n\nc) Xe ô tô cảnh sát cơ động có in dòng chữ “CẢNH SÁT CƠ ĐỘNG” ở hai bên thân xe;\n\nd) Xe vận tải có lắp ghế ngồi trong thùng xe của lực lượng Công an nhân dân làm nhiệm vụ;\n\nđ) Xe chở phạm nhân, xe cứu hộ, cứu nạn và các xe chuyên dùng khác của lực lượng Công an nhân dân;\n\ne) Xe đặc chủng (xe thông tin vệ tinh, xe chống đạn, xe phòng chống khủng bố, chống bạo loạn và các xe đặc chủng khác của lực lượng Công an nhân dân);\n\ng) Xe của lực lượng Công an đang đi làm nhiệm vụ khẩn cấp sử dụng tín hiệu ưu tiên theo quy định của pháp luật.\n\n6. Xe chuyên dùng phục vụ tang lễ, gồm:\n\n\n\na) Xe có kết cấu chuyên dùng phục vụ tang lễ (bao gồm: xe tang, xe tải lạnh dùng để lưu xác và chở xác);\n\nb) Các xe phục vụ tang lễ (bao gồm: xe chở khách đi cùng xe tang, xe chở hoa, xe rước ảnh) là xe chỉ sử dụng cho hoạt động tang lễ có giấy chứng nhận đăng ký xe mang tên đơn vị phục vụ tang lễ. Đơn vị phục vụ tang lễ có văn bản cam kết các loại xe này chỉ sử dụng cho hoạt động tang lễ gửi nhà cung cấp dịch vụ thanh toán điện tử (trong đó nêu cụ thể số lượng xe, biển số xe).\n\n7. Đoàn xe có xe cảnh sát giao thông dẫn đường.\n\n8. Xe của lực lượng quốc phòng tham gia diễn tập, hành quân cơ động lực lượng, vận chuyển vũ khí, trang bị có xe chuyên dụng quân sự dẫn đường.\n\n9. Xe ô tô của lực lượng công an, quốc phòng sử dụng vé đường bộ toàn quốc theo quy định.\n\n10. Xe hộ đê; xe đang làm nhiệm vụ khẩn cấp phòng, chống lụt bão theo điều động của cấp có thẩm quyền.\n\n11. Xe làm nhiệm vụ vận chuyển thuốc men, máy móc, thiết bị, vật tư, hàng hóa đến những nơi bị thảm họa hoặc đến vùng có dịch bệnh theo quy định của pháp luật về tình trạng khẩn cấp khi có thảm họa lớn, dịch bệnh nguy hiểm.\n\n12. Xe mô tô, xe gắn máy, xe thô sơ.\n\nChương II\n\nQUẢN LÝ GIÁ, VÉ DỊCH VỤ SỬ DỤNG ĐƯỜNG BỘ\n\nĐiều 4. Định giá dịch vụ sử dụng đường bộ\n\n1. Giá tối đa dịch vụ sử dụng đường bộ được định giá theo nguyên tắc và căn cứ quy định tại Điều 22 Luật Giá.\n\n2. Cục Đường bộ Việt Nam quyết định áp dụng phương pháp định giá theo quy định pháp luật về giá.\n\n3. Khi các yếu tố hình thành giá dịch vụ sử dụng đường bộ thay đổi ảnh hưởng đến giá tối đa dịch vụ sử dụng đường bộ, Cục Đường bộ Việt Nam tổ chức lựa chọn các Doanh nghiệp dự án đầu tư xây dựng đường bộ để kinh doanh (Doanh nghiệp dự án) lập phương án giá.\n\n4. Các doanh nghiệp dự án được lựa chọn lập phương án giá có trách nhiệm lập phương án giá theo quy định pháp luật về giá, báo cáo, giải trình về phương án giá, cung cấp các tài liệu, hồ sơ phương án giá theo yêu cầu của Cục Đường bộ Việt Nam và chịu trách nhiệm về phương án giá do mình lập.\n\n5. Cục Đường bộ Việt Nam có trách nhiệm thẩm định phương án giá, trình Bộ Giao thông vận tải ban hành văn bản quy định mức giá tối đa cho dịch vụ sử dụng đường bộ.\n\n6. Việc lập, thẩm định hồ sơ phương án giá, ban hành văn bản định giá hoặc điều chỉnh giá thực hiện theo quy định pháp luật về giá.\n\nĐiều 5. Mức giá tối đa cho dịch vụ sử dụng đường bộ\n\nMức giá tối đa cho một lần sử dụng dịch vụ đường bộ là mức thu tối đa quy định cho một lượt phương tiện khi tham gia giao thông qua trạm thu phí.\n\nĐiều 6. Nguyên tắc xác định mức giá cụ thể, mức giảm và đối tượng giảm giá cụ thể cho dịch vụ sử dụng đường bộ\n\n1. Mức giá cụ thể cho một lần phương tiện sử dụng dịch vụ đường bộ (sau đây gọi tắt là mức giá lượt) không cao hơn mức giá tối đa đối với từng loại phương tiện theo Quyết định ban hành mức giá tối đa cho dịch vụ sử dụng đường bộ của Bộ trưởng Bộ Giao thông vận tải.\n\n2. Mức giá tháng là mức thu đối với một phương tiện tham gia giao thông qua trạm thu phí trong thời hạn 30 ngày. Mức giá tháng được tính bằng 30 (ba mươi) lần mức giá quy định tại khoản 1 Điều này.\n\n3. Mức giá quý là mức thu đối với một phương tiện tham gia giao thông qua trạm thu phí trong thời hạn 90 ngày. Mức giá quý được tính bằng 3 (ba) lần mức giá tháng và chiết khấu 10%.\n\n4. Mức giá lượt, mức giá tháng, mức giá quý cho dịch vụ sử dụng đường bộ đối với từng dự án áp dụng cho từng loại phương tiện được cơ quan có thẩm quyền và Nhà đầu tư, Doanh nghiệp dự án thống nhất tại hợp đồng dự án.\n\n5. Căn cứ tình hình kinh tế xã hội theo từng thời kỳ của địa phương nơi đặt trạm thu phí sử dụng đường bộ, các bên ký hợp đồng dự án thống nhất mức giảm và đối tượng giảm giá cụ thể cho dịch vụ sử dụng đường bộ trên nguyên tắc đảm bảo tính khả thi về phương án tài chính của dự án, đảm bảo hài hòa lợi ích Nhà nước, Nhà đầu tư, người sử dụng dịch vụ đường bộ và phù hợp với quy định của pháp luật.\n\nĐiều 7. Quản lý vé sử dụng đường bộ']","**Nguồn văn bản:** /content/drive/MyDrive/ITProject_data/new_law/32_2024_TT-BGTVT_631515.docx

**Tên văn bản:** THÔNG TƯ QUY ĐỊNH VỀ QUẢN LÝ GIÁ DỊCH VỤ SỬ DỤNG ĐƯỜNG BỘ CỦA CÁC DỰ ÁN ĐẦU TƯ XÂY DỰNG ĐƯỜNG BỘ ĐỂ KINH DOANH, DO TRUNG ƯƠNG QUẢN LÝ

**Nội dung:**

Không tìm thấy thông tin liên quan tới quy định về việc sử dụng xe ô tô chở xăng dầu trong Luật Giao thông đường bộ trong văn bản này. Văn bản tập trung vào quy định về quản lý giá dịch vụ sử dụng đường bộ của các dự án đầu tư xây dựng đường bộ, do trung ương quản lý, và các trường hợp được miễn, giảm phí.  Văn bản đề cập đến nhiều loại xe được miễn phí sử dụng đường bộ, nhưng không đề cập cụ thể đến xe chở xăng dầu.


Tóm lại: Văn bản cung cấp không chứa thông tin về quy định sử dụng xe ô tô chở xăng dầu trong Luật Giao thông đường bộ.
","Xe ô tô chở xăng dầu phải có giấy phép đặc biệt, được kiểm định an toàn và tuân thủ các quy định về phòng cháy chữa cháy.",0.8,0.8175840132812869,0.0,0.0
45,Quy định mới về việc sử dụng xe ô tô chở khí gas là gì?,"['BỘ GIAO THÔNG VẬN TẢI\n-------- CỘNG HÒA XÃ HỘI CHỦ NGHĨA VIỆT NAM\nĐộc lập - Tự do - Hạnh phúc \n--------------- Số: 53/2024/TT-BGTVT Hà Nội, ngày 15 tháng 11 năm 2024\n\nTHÔNG TƯ\n\nQUY ĐỊNH VỀ PHÂN LOẠI PHƯƠNG TIỆN GIAO THÔNG ĐƯỜNG BỘ VÀ DẤU HIỆU NHẬN BIẾT XE CƠ GIỚI SỬ DỤNG NĂNG LƯỢNG SẠCH, NĂNG LƯỢNG XANH, THÂN THIỆN MÔI TRƯỜNG\n\nCăn cứ Luật Trật tự, an toàn giao thông đường bộ ngày 27 tháng 6 năm 2024;\n\nCăn cứ Nghị định số 56/2022/NĐ-CP ngày 24 tháng 8 năm 2022 của Chính phủ quy định chức năng, nhiệm vụ, quyền hạn và cơ cấu tổ chức của Bộ Giao thông vận tải;\n\nTheo đề nghị của Vụ trưởng Vụ Khoa học - Công nghệ và Môi trường và Cục trưởng Cục Đăng kiểm Việt Nam;\n\nBộ trưởng Bộ Giao thông vận tải ban hành Thông tư quy định về phân loại phương tiện giao thông đường bộ và dấu hiệu nhận biết xe cơ giới sử dụng năng lượng sạch, năng lượng xanh, thân thiện môi trường.\n\nChương I\n\nQUY ĐỊNH CHUNG\n\nĐiều 1. Phạm vi điều chỉnh\n\nThông tư quy định về phân loại phương tiện giao thông đường bộ và dấu hiệu nhận biết xe cơ giới sử dụng năng lượng sạch, năng lượng xanh, thân thiện môi trường.\n\nĐiều 2. Đối tượng áp dụng\n\nThông tư này áp dụng đối với các tổ chức, cá nhân có liên quan đến phân loại phương tiện giao thông đường bộ, dấu hiệu nhận biết xe cơ giới sử dụng năng lượng sạch, năng lượng xanh, thân thiện môi trường.\n\nĐiều 3. Giải thích từ ngữ\n\nTrong Thông tư này, các cụm từ dưới đây được hiểu như sau:\n\n1. Hệ thống truyền động điện (Electric powertrain) là hệ thống bao gồm một hoặc nhiều: thiết bị tích trữ điện năng (ắc quy, pin, bánh đà điện cơ hoặc siêu tụ); thiết bị ổn định điện năng; thiết bị điện được sử dụng để chuyển đổi điện năng tích trữ thành cơ năng truyền tới các bánh xe làm nguồn động lực cho xe chuyển động;\n\n2. Xe thuần điện (PEV - Pure electric vehicle hoặc BEV - Battery electric vehicle) là xe cơ giới sử dụng hệ thống truyền động điện;\n\n3. Xe điện dùng pin nhiên liệu thuần túy (PFCEV - Pure fuel cell electric vehicle hoặc FCEV - Fuel cell electric vehicle) là xe cơ giới điện sử dụng pin nhiên liệu thuần túy, trong đó hệ thống pin nhiên liệu là nguồn năng lượng duy nhất trên xe cho hệ thống động lực của xe;\n\n4. Hệ thống truyền động hybrid điện (Hybrid electric powertrain) là hệ truyền động tiêu thụ năng lượng từ cả hai nguồn năng lượng được tích trữ trên xe, gồm nhiên liệu và thiết bị tích trữ điện năng;\n\n5. Xe hybrid điện (HEV - Hybrid electric vehicle) là xe cơ giới được dẫn động bằng hệ thống truyền động hybrid điện (bao gồm cả xe sử dụng nhiên liệu tiêu thụ chỉ để nạp điện cho thiết bị tích trữ điện năng), gồm có:\n\n\n\na) Xe hybrid điện nhẹ (MHEV - Mild hybrid electric vehicle) là xe hybrid điện; động cơ (mô-tơ) điện có chức năng hỗ trợ động cơ đốt trong khởi động, hỗ trợ tăng tốc, phanh tái tạo và cung cấp năng lượng cho hệ thống phụ trợ. Xe không có khả năng nạp điện được từ nguồn điện bên ngoài;\n\nb) Xe hybrid điện hoàn toàn (FHEV- Full hybrid electric vehicle hoặc SHEV\n\nStrong hybrid electric vehicle) là xe hybrid điện có khả năng di chuyển hoàn toàn chỉ bằng năng lượng điện trong những điều kiện nhất định (như bắt đầu di chuyển từ trạng thái đứng yên, di chuyển ở tốc độ thấp...). Xe không có khả năng nạp điện được từ nguồn điện bên ngoài;\n\nc) Xe hybrid nạp điện ngoài (PHEV - Plug-in hybrid electric vehicle) là xe hybrid điện có khả năng nạp điện được từ nguồn điện bên ngoài.\n\nChương II\n\nPHÂN LOẠI PHƯƠNG TIỆN GIAO THÔNG ĐƯỜNG BỘ THEO MỤC ĐÍCH SỬ DỤNG\n\nĐiều 4. Xe cơ giới\n\nXe cơ giới quy định tại khoản 1 Điều 34 Luật Trật tự, an toàn giao thông đường bộ gồm:\n\n1. Xe ô tô được phân loại như sau:\n\na) Xe ô tô chở người là các loại ô tô có kết cấu và trang bị chủ yếu dùng để chở người, hành lý mang theo. Ô tô chở người cũng có thể kéo theo một rơ moóc. Các loại ô tô chở người gồm:\n\nÔ tô chở người đến 08 chỗ (không kể chỗ của người lái xe) gồm các loại quy định tại Phụ lục I ban hành kèm theo Thông tư này;\n\nÔ tô chở người trên 08 chỗ (không kể chỗ của người lái xe) gồm các loại quy định tại Phụ lục II ban hành kèm theo Thông tư này;\n\nÔ tô chở người chuyên dùng là ô tô chở người có đặc điểm khác với đặc điểm của các loại ô tô chở người nêu trên, có kết cấu và trang bị để chở người trong điều kiện đặc biệt hoặc chở người với sự sắp xếp đặc biệt, gồm các loại quy định tại Phụ lục III ban hành kèm theo Thông tư này;\n\nb) Ô tô chở hàng là các loại ô tô có kết cấu và trang bị chủ yếu dùng để chở hàng. Ô tô chở hàng có thể bố trí tối đa hai hàng ghế và chở không quá 06 người kể cả người lái trong cabin. Ô tô chở hàng cũng có thể kéo theo một rơ moóc. Các loại ô tô chở hàng gồm:\n\nÔ tô tải thông dụng gồm các loại quy định tại Phụ lục IV ban hành kèm theo Thông tư này;\n\nÔ tô tải chuyên dùng bao gồm các loại ô tô chở hàng có kết cấu và trang bị để chở hàng hóa cần sự sắp xếp đặc biệt gồm các loại quy định tại Phụ lục V ban hành kèm theo Thông tư này;\n\nc) Ô tô chuyên dùng là các loại ô tô có kết cấu và trang bị để thực hiện một chức năng, công dụng đặc biệt khác với các loại ô tô nêu tại điểm a và điểm b khoản này. Ô tô chuyên dùng gồm các loại ô tô quy định tại Phụ lục VI ban hành kèm theo Thông tư này;\n\nd) Ô tô đầu kéo là ô tô được thiết kế để kéo sơ mi rơ moóc và có các trang, thiết bị gồm: cơ cấu mâm kéo (fifth-wheel coupling); cơ cấu kết nối và điều khiển hệ thống đèn tín hiệu và hệ thống phanh của sơ mi rơ moóc; có thể trang bị cần cẩu, máy phát điện, cơ cấu móc kéo (tow coupling, hook coupling) để kéo rơ moóc;\n\nđ) Ô tô kéo moóc là ô tô được thiết kế dành riêng hoặc chủ yếu dùng để kéo rơ moóc và có các trang, thiết bị gồm: cơ cấu móc kéo (tow coupling, hook coupling); thùng hoặc sàn chất phụ tải; cơ cấu kết nối và điều khiển hệ thống đèn tín hiệu và hệ thống phanh của rơ moóc;\n\nÔ tô kéo moóc không bao gồm: ô tô chở hàng có trang bị cơ cấu móc kéo; ô tô đầu kéo trang bị thêm cơ cấu móc kéo.\n\n2. Rơ moóc được phân loại theo quy định tại Phụ lục VII ban hành kèm theo Thông tư này.\n\n\n\n3. Sơ mi rơ moóc được phân loại theo quy định tại Phụ lục VIII ban hành kèm theo Thông tư này.\n\n4. Xe chở người bốn bánh có gắn động cơ được phân loại như sau:\n\na) Xe chở người bốn bánh có gắn động cơ tham gia giao thông công cộng là xe được thiết kế để hoạt động trên đường giao thông công cộng;\n\nb) Xe chở người bốn bánh có gắn động cơ hoạt động trên đường chuyên dùng, nội bộ là xe được thiết kế chỉ để hoạt động trên đường chuyên dùng, đường nội bộ.\n\n5. Xe chở hàng bốn bánh có gắn động cơ.\n\n6. Xe mô tô được phân loại như sau:\n\na) Xe mô tô hai bánh;\n\nb) Xe mô tô ba bánh chở người;\n\nc) Xe mô tô ba bánh chở hàng;\n\nd) Xe mô tô ba bánh dùng cho người khuyết tật.\n\n7. Xe gắn máy được phân loại như sau:\n\na) Xe gắn máy hai bánh;\n\nb) Xe gắn máy ba bánh chở người;\n\nc) Xe gắn máy ba bánh chở hàng;\n\nd) Xe gắn máy ba bánh dùng cho người khuyết tật.\n\nĐiều 5. Xe máy chuyên dùng\n\nXe máy chuyên dùng được phân loại như sau:\n\n1. Xe máy thi công được phân loại theo quy định tại Phụ lục IX ban hành kèm theo Thông tư này;\n\n2. Xe máy nông nghiệp, lâm nghiệp là xe máy chuyên dùng chỉ phục vụ trong nông nghiệp, lâm nghiệp;\n\n3. Máy kéo;\n\n4. Rơ moóc, sơ mi rơ moóc được kéo bởi máy kéo: Rơ moóc, sơ mi rơ moóc được thiết kế, chế tạo chỉ để kéo bởi máy kéo;\n\n5. Xe máy thực hiện chức năng, công dụng đặc biệt được phân loại theo quy định tại Phụ lục X ban hành kèm theo Thông tư này;\n\n6. Các loại xe đặc chủng sử dụng vào mục đích quốc phòng, an ninh có tham gia giao thông đường bộ.\n\nĐiều 6. Xe thô sơ\n\nXe thô sơ gồm các loại xe được quy định tại khoản 2 Điều 34 Luật Trật tự, an toàn giao thông đường bộ.\n\nChương III\n\nPHÂN LOẠI XE CƠ GIỚI THEO MỨC ĐỘ TỰ ĐỘNG HÓA\n\nĐiều 7. Phương tiện giao thông thông thường\n\nPhương tiện giao thông thông thường là xe cơ giới mà người lái thực hiện toàn bộ các nhiệm vụ điều khiển chuyển động của xe ngay cả khi được hỗ trợ bởi các hệ thống an toàn chủ động trên xe.\n\nĐiều 8. Phương tiện giao thông thông minh']","**Nguồn văn bản:** /content/drive/MyDrive/ITProject_data/new_law/53_2024_TT-BGTVT_624420.docx

**Tên văn bản:** THÔNG TƯ QUY ĐỊNH VỀ PHÂN LOẠI PHƯƠNG TIỆN GIAO THÔNG ĐƯỜNG BỘ VÀ DẤU HIỆU NHẬN BIẾT XE CƠ GIỚI SỬ DỤNG NĂNG LƯỢNG SẠCH, NĂNG LƯỢNG XANH, THÂN THIỆN MÔI TRƯỜNG

**Nội dung:**

Tôi xin lỗi, nhưng văn bản được cung cấp không chứa thông tin về quy định cụ thể liên quan đến việc sử dụng xe ô tô chở khí gas.  Văn bản tập trung vào việc phân loại phương tiện giao thông đường bộ theo mục đích sử dụng và mức độ tự động hóa, cũng như dấu hiệu nhận biết xe sử dụng năng lượng sạch, năng lượng xanh, thân thiện môi trường.  Do đó, tôi không thể trả lời câu hỏi của bạn dựa trên văn bản này.
Tóm lại: Không tìm thấy thông tin về quy định sử dụng xe ô tô chở khí gas trong văn bản cung cấp.
","Xe ô tô chở khí gas phải có giấy phép đặc biệt, được kiểm định an toàn và tuân thủ các quy định về phòng cháy chữa cháy.",0.42857142857142855,0.0,0.0,0.0
46,Luật Giao thông Đường bộ 2025 có quy định gì về việc sử dụng xe ô tô chở hóa chất độc hại?,"['đ) Khi vận chuyển hàng rời, vật liệu xây dựng, phế thải không để rơi vãi xuống đường hoặc gây ra tiếng ồn, bụi bẩn trong suốt quá trình vận chuyển trên đường;\n\ne) Khi vận chuyển hàng hoá xếp vượt phía trước và phía sau xe thì ban ngày phải có báo hiệu màu đỏ tại điểm đầu và điểm cuối cùng của hàng hoá, ban đêm hoặc khi trời tối phải có đèn hoặc báo hiệu cho người tham gia giao thông đường bộ để nhận biết.\n\n2. Ủy ban nhân dân cấp tỉnh quy định về sử dụng xe mô tô, xe gắn máy, xe thô sơ để kinh doanh vận chuyển hành khách, hàng hóa tại địa phương.\n\nĐiều 48. Bảo đảm trật tự, an toàn giao thông đường bộ đối với xe bốn bánh có gắn động cơ vận chuyển hành khách, hàng hóa\n\n1. Xe bốn bánh có gắn động cơ vận chuyển hành khách, hàng hóa phải đáp ứng các yêu cầu sau đây:\n\na) Được cấp chứng nhận đăng ký xe và gắn biển số xe; bảo đảm chất lượng an toàn kỹ thuật và bảo vệ môi trường theo quy định của pháp luật;\n\nb) Niêm yết tên và số điện thoại của tổ chức, cá nhân kinh doanh vận tải; niêm yết giá cước vận tải đối với vận chuyển hành khách;\n\nc) Bảo đảm đúng thời gian và phạm vi hoạt động.\n\n2. Ủy ban nhân dân cấp tỉnh quy định thời gian, phạm vi hoạt động vận chuyển hành khách bằng xe bốn bánh có gắn động cơ và hoạt động vận chuyển hàng hóa bằng xe chở hàng bốn bánh có gắn động cơ tại địa phương.\n\nĐiều 49. Bảo đảm trật tự, an toàn giao thông đường bộ đối với xe ô tô vận chuyển hàng hóa \n\n1. Khi vận chuyển hàng hoá bằng xe ô tô, người lái xe phải thực hiện các quy định sau đây:\n\na) Mang đủ giấy tờ theo quy định của pháp luật;\n\nb) Kiểm tra các điều kiện bảo đảm an toàn của xe trước khi tham gia giao thông đường bộ;\n\nc) Kiểm tra việc sắp xếp hàng hóa bảo đảm an toàn; không chở hàng hoá vượt quá khối lượng cho phép hoặc vượt quá khổ giới hạn của xe;\n\nd) Hàng hóa vận chuyển trên xe phải được sắp xếp gọn gàng, chằng buộc chắc chắn, bảo đảm an toàn theo quy định của Bộ trưởng Bộ Giao thông vận tải;\n\nđ) Khi vận chuyển hàng rời, vật liệu xây dựng, phế thải phải che đậy kín, không để rơi vãi xuống đường, gây ra tiếng ồn hoặc bụi bẩn trong suốt quá trình vận chuyển trên đường và chiều cao tối đa của hàng hóa phải thấp hơn mép trên thành thùng xe tối thiểu 10 cm;\n\ne) Khi vận chuyển hàng hoá xếp vượt phía trước và phía sau xe thì ban ngày phải có báo hiệu màu đỏ tại điểm đầu và điểm cuối cùng của hàng hoá, ban đêm hoặc khi trời tối phải có đèn hoặc báo hiệu cho người tham gia giao thông đường bộ để nhận biết.\n\n2. Lực lượng Cảnh sát giao thông chịu trách nhiệm tổ chức tuần tra, kiểm soát, xử lý vi phạm pháp luật về trật tự, an toàn giao thông đường bộ đối với xe ô tô vận chuyển hàng hóa quá tải lưu hành trên đường bộ.\n\nĐiều 50. Bảo đảm trật tự, an toàn giao thông đường bộ đối với phương tiện giao thông đường bộ vận chuyển động vật sống, thực phẩm tươi sống\n\n1. Việc vận chuyển động vật sống phải bảo đảm các yêu cầu sau đây:\n\na) Người lái xe phải mang đủ giấy tờ theo quy định của pháp luật;\n\nb) Phương tiện vận chuyển phải có kết cấu phù hợp với loại động vật chuyên chở;\n\nc) Trong quá trình vận chuyển phải chấp hành các quy định của pháp luật về trật tự, an toàn giao thông đường bộ, vệ sinh dịch tễ, phòng dịch và bảo đảm vệ sinh môi trường.\n\n2. Việc vận chuyển thực phẩm tươi sống phải bảo đảm các yêu cầu sau đây:\n\na) Người lái xe phải mang đủ giấy tờ theo quy định của pháp luật;\n\nb) Trong quá trình vận chuyển phải chấp hành các quy định của pháp luật về trật tự, an toàn giao thông đường bộ, an toàn thực phẩm, vệ sinh dịch tễ, phòng dịch và bảo đảm vệ sinh môi trường.\n\nĐiều 51. Bảo đảm trật tự, an toàn giao thông đường bộ đối với phương tiện giao thông đường bộ vận chuyển hàng hoá nguy hiểm\n\n1. Hàng hóa nguy hiểm là hàng hóa có chứa các chất hoặc vật phẩm nguy hiểm khi chở trên đường bộ có khả năng gây nguy hại tới tính mạng, sức khỏe con người, môi trường, an toàn và an ninh quốc gia.\n\n2. Việc vận chuyển hàng hoá nguy hiểm phải có giấy phép vận chuyển; trong trường hợp cần thiết, đơn vị vận chuyển hàng hoá nguy hiểm phải bố trí người áp tải để bảo đảm trật tự, an toàn giao thông đường bộ.\n\n3. Xe ô tô vận chuyển hàng hoá nguy hiểm phải dán biểu trưng nhận diện hàng hóa nguy hiểm; lắp đèn, tín hiệu cảnh báo.\n\n4. Người lái xe hoặc người áp tải vận chuyển hàng hóa nguy hiểm phải được tập huấn về vận chuyển hàng hóa nguy hiểm.\n\n5. Cơ quan cấp giấy phép vận chuyển hàng hóa nguy hiểm có trách nhiệm gửi thông báo ngay đến cơ quan Cảnh sát giao thông Bộ Công an và cơ quan Cảnh sát giao thông thực hiện nhiệm vụ bảo đảm trật tự, an toàn giao thông trên tuyến đường, đoạn đường mà phương tiện đi qua để chỉ huy, điều khiển giao thông đường bộ, kiểm tra, kiểm soát, xử lý vi phạm pháp luật, bảo đảm trật tự, an toàn giao thông đường bộ.\n\n6. Chính phủ quy định chi tiết Điều này.\n\nĐiều 52. Bảo đảm trật tự, an toàn giao thông đường bộ đối với xe quá khổ giới hạn, xe quá tải trọng, xe bánh xích lưu hành trên đường bộ\n\n1. Xe quá khổ giới hạn bao gồm:\n\na) Xe cơ giới, xe máy chuyên dùng có kích thước bao ngoài vượt quá kích thước giới hạn cho phép của xe theo quy chuẩn kỹ thuật quốc gia về xe cơ giới;\n\nb) Xe cơ giới, xe máy chuyên dùng có kích thước bao ngoài quá khổ giới hạn của đường bộ;\n\nc) Xe cơ giới, xe máy chuyên dùng khi chở hàng hóa có kích thước bao ngoài của xe và hàng hóa vượt quá kích thước giới hạn cho phép xếp hàng hóa của xe hoặc quá khổ giới hạn của đường bộ.\n\n2. Xe quá tải trọng bao gồm:\n\na) Xe cơ giới, xe máy chuyên dùng có khối lượng toàn bộ vượt quá khối lượng cho phép của xe hoặc vượt quá tải trọng của đường bộ;\n\nb) Xe cơ giới, xe máy chuyên dùng có khối lượng toàn bộ phân bổ lên trục xe, cụm trục xe vượt quá tải trọng của trục xe, cụm trục xe hoặc vượt quá tải trọng của đường bộ.\n\n3. Xe quá khổ giới hạn, xe quá tải trọng, xe bánh xích được cấp giấy phép lưu hành xe trên đường bộ trong các trường hợp sau đây:\n\na) Lưu hành xe quá khổ giới hạn quy định tại điểm a và điểm b khoản 1 Điều này không chở hàng hóa, xe có khối lượng bản thân của xe quá tải trọng của đường bộ không chở hàng hóa, xe bánh xích từ nơi sản xuất, ga, cảng và các địa điểm nhập khẩu, sửa chữa, bảo trì đến nơi sử dụng phương tiện và ngược lại hoặc giữa các địa điểm sử dụng phương tiện;\n\nb) Lưu hành xe quá khổ giới hạn, xe quá tải trọng để chở hàng hóa trên đường bộ trong các trường hợp: phục vụ nhiệm vụ quốc phòng, an ninh; phòng, chống, khắc phục hậu quả thiên tai; thực hiện nhiệm vụ trong trường hợp khẩn cấp; chở hàng siêu trường, siêu trọng khi các phương thức vận chuyển hàng hoá bằng đường sắt, đường thuỷ nội địa, hàng không, hàng hải không phù hợp hoặc phải kết hợp phương thức vận tải đường bộ với phương thức vận tải khác;\n\nc) Lưu hành xe quá khổ giới hạn cho phép của xe để chở xe ô tô chở người đến 08 chỗ (không kể chỗ của người lái xe), xe ô tô tải và ô tô chuyên dùng có khối lượng toàn bộ theo thiết kế đến 3.500 kg từ nơi sản xuất, ga, cảng và các địa điểm nhập khẩu, sửa chữa, bảo trì đến nơi sử dụng.\n\n4. Việc bảo vệ công trình đường bộ khi cho phép xe quá khổ giới hạn, xe quá tải trọng, xe bánh xích lưu hành trên đường bộ được quy định như sau:\n\na) Trường hợp xe quá khổ giới hạn, xe quá tải trọng, xe bánh xích vượt quá tải trọng, khổ giới hạn của công trình đường bộ thì tổ chức, cá nhân có nhu cầu lưu hành xe chịu trách nhiệm khảo sát, thiết kế, gia cường công trình đường bộ;\n\nb) Việc khảo sát, thiết kế, gia cường công trình đường bộ do đơn vị đủ điều kiện năng lực hoạt động theo quy định của pháp luật về xây dựng thực hiện;\n\nc) Tổ chức, cá nhân lưu hành xe có trách nhiệm chi trả toàn bộ chi phí để khảo sát, thiết kế, gia cường công trình đường bộ quy định tại điểm b khoản này;\n\nd) Cơ quan, tổ chức, cá nhân quy định tại các điểm a, b và c khoản này có trách nhiệm bồi thường khi xảy ra thiệt hại đối với công trình đường bộ;\n\nđ) Trường hợp cần thiết, phải có người, phương tiện hỗ trợ lái xe, cảnh báo cho người, phương tiện tham gia giao thông đường bộ khác và thực hiện các biện pháp bảo đảm an toàn giao thông đường bộ theo quy định của Chính phủ;']","**Nguồn văn bản:** /content/drive/MyDrive/ITProject_data/new_law/36_2024_QH15_444251.docx

**Tên văn bản:**  (Tên văn bản không được cung cấp trong metadata)

**Điều 51:** Bảo đảm trật tự, an toàn giao thông đường bộ đối với phương tiện giao thông đường bộ vận chuyển hàng hoá nguy hiểm

**Nội dung:**

1. Hàng hóa nguy hiểm là hàng hóa có chứa các chất hoặc vật phẩm nguy hiểm khi chở trên đường bộ có khả năng gây nguy hại tới tính mạng, sức khỏe con người, môi trường, an toàn và an ninh quốc gia.

2. Việc vận chuyển hàng hoá nguy hiểm phải có giấy phép vận chuyển; trong trường hợp cần thiết, đơn vị vận chuyển hàng hoá nguy hiểm phải bố trí người áp tải để bảo đảm trật tự, an toàn giao thông đường bộ.

3. Xe ô tô vận chuyển hàng hoá nguy hiểm phải dán biểu trưng nhận diện hàng hóa nguy hiểm; lắp đèn, tín hiệu cảnh báo.

4. Người lái xe hoặc người áp tải vận chuyển hàng hóa nguy hiểm phải được tập huấn về vận chuyển hàng hóa nguy hiểm.

5. Cơ quan cấp giấy phép vận chuyển hàng hóa nguy hiểm có trách nhiệm gửi thông báo ngay đến cơ quan Cảnh sát giao thông Bộ Công an và cơ quan Cảnh sát giao thông thực hiện nhiệm vụ bảo đảm trật tự, an toàn giao thông trên tuyến đường, đoạn đường mà phương tiện đi qua để chỉ huy, điều khiển giao thông đường bộ, kiểm tra, kiểm soát, xử lý vi phạm pháp luật, bảo đảm trật tự, an toàn giao thông đường bộ.

6. Chính phủ quy định chi tiết Điều này.


Tóm lại: Luật quy định việc vận chuyển hàng hóa nguy hiểm phải có giấy phép, xe phải dán biểu trưng và có đèn tín hiệu cảnh báo, người lái xe/người áp tải phải được tập huấn.  Cơ quan cấp phép phải thông báo cho Cảnh sát giao thông.  Chính phủ sẽ quy định chi tiết hơn.
","Xe ô tô chở hóa chất độc hại phải có giấy phép đặc biệt, được kiểm định an toàn và tuân thủ các quy định về môi trường.",1.0,0.6021879140460035,0.0,0.0
47,Quy định mới về việc sử dụng xe ô tô chở vật liệu xây dựng là gì?,"['BỘ GIAO THÔNG VẬN TẢI\n-------- CỘNG HÒA XÃ HỘI CHỦ NGHĨA VIỆT NAM\nĐộc lập - Tự do - Hạnh phúc \n--------------- Số: 53/2024/TT-BGTVT Hà Nội, ngày 15 tháng 11 năm 2024\n\nTHÔNG TƯ\n\nQUY ĐỊNH VỀ PHÂN LOẠI PHƯƠNG TIỆN GIAO THÔNG ĐƯỜNG BỘ VÀ DẤU HIỆU NHẬN BIẾT XE CƠ GIỚI SỬ DỤNG NĂNG LƯỢNG SẠCH, NĂNG LƯỢNG XANH, THÂN THIỆN MÔI TRƯỜNG\n\nCăn cứ Luật Trật tự, an toàn giao thông đường bộ ngày 27 tháng 6 năm 2024;\n\nCăn cứ Nghị định số 56/2022/NĐ-CP ngày 24 tháng 8 năm 2022 của Chính phủ quy định chức năng, nhiệm vụ, quyền hạn và cơ cấu tổ chức của Bộ Giao thông vận tải;\n\nTheo đề nghị của Vụ trưởng Vụ Khoa học - Công nghệ và Môi trường và Cục trưởng Cục Đăng kiểm Việt Nam;\n\nBộ trưởng Bộ Giao thông vận tải ban hành Thông tư quy định về phân loại phương tiện giao thông đường bộ và dấu hiệu nhận biết xe cơ giới sử dụng năng lượng sạch, năng lượng xanh, thân thiện môi trường.\n\nChương I\n\nQUY ĐỊNH CHUNG\n\nĐiều 1. Phạm vi điều chỉnh\n\nThông tư quy định về phân loại phương tiện giao thông đường bộ và dấu hiệu nhận biết xe cơ giới sử dụng năng lượng sạch, năng lượng xanh, thân thiện môi trường.\n\nĐiều 2. Đối tượng áp dụng\n\nThông tư này áp dụng đối với các tổ chức, cá nhân có liên quan đến phân loại phương tiện giao thông đường bộ, dấu hiệu nhận biết xe cơ giới sử dụng năng lượng sạch, năng lượng xanh, thân thiện môi trường.\n\nĐiều 3. Giải thích từ ngữ\n\nTrong Thông tư này, các cụm từ dưới đây được hiểu như sau:\n\n1. Hệ thống truyền động điện (Electric powertrain) là hệ thống bao gồm một hoặc nhiều: thiết bị tích trữ điện năng (ắc quy, pin, bánh đà điện cơ hoặc siêu tụ); thiết bị ổn định điện năng; thiết bị điện được sử dụng để chuyển đổi điện năng tích trữ thành cơ năng truyền tới các bánh xe làm nguồn động lực cho xe chuyển động;\n\n2. Xe thuần điện (PEV - Pure electric vehicle hoặc BEV - Battery electric vehicle) là xe cơ giới sử dụng hệ thống truyền động điện;\n\n3. Xe điện dùng pin nhiên liệu thuần túy (PFCEV - Pure fuel cell electric vehicle hoặc FCEV - Fuel cell electric vehicle) là xe cơ giới điện sử dụng pin nhiên liệu thuần túy, trong đó hệ thống pin nhiên liệu là nguồn năng lượng duy nhất trên xe cho hệ thống động lực của xe;\n\n4. Hệ thống truyền động hybrid điện (Hybrid electric powertrain) là hệ truyền động tiêu thụ năng lượng từ cả hai nguồn năng lượng được tích trữ trên xe, gồm nhiên liệu và thiết bị tích trữ điện năng;\n\n5. Xe hybrid điện (HEV - Hybrid electric vehicle) là xe cơ giới được dẫn động bằng hệ thống truyền động hybrid điện (bao gồm cả xe sử dụng nhiên liệu tiêu thụ chỉ để nạp điện cho thiết bị tích trữ điện năng), gồm có:\n\n\n\na) Xe hybrid điện nhẹ (MHEV - Mild hybrid electric vehicle) là xe hybrid điện; động cơ (mô-tơ) điện có chức năng hỗ trợ động cơ đốt trong khởi động, hỗ trợ tăng tốc, phanh tái tạo và cung cấp năng lượng cho hệ thống phụ trợ. Xe không có khả năng nạp điện được từ nguồn điện bên ngoài;\n\nb) Xe hybrid điện hoàn toàn (FHEV- Full hybrid electric vehicle hoặc SHEV\n\nStrong hybrid electric vehicle) là xe hybrid điện có khả năng di chuyển hoàn toàn chỉ bằng năng lượng điện trong những điều kiện nhất định (như bắt đầu di chuyển từ trạng thái đứng yên, di chuyển ở tốc độ thấp...). Xe không có khả năng nạp điện được từ nguồn điện bên ngoài;\n\nc) Xe hybrid nạp điện ngoài (PHEV - Plug-in hybrid electric vehicle) là xe hybrid điện có khả năng nạp điện được từ nguồn điện bên ngoài.\n\nChương II\n\nPHÂN LOẠI PHƯƠNG TIỆN GIAO THÔNG ĐƯỜNG BỘ THEO MỤC ĐÍCH SỬ DỤNG\n\nĐiều 4. Xe cơ giới\n\nXe cơ giới quy định tại khoản 1 Điều 34 Luật Trật tự, an toàn giao thông đường bộ gồm:\n\n1. Xe ô tô được phân loại như sau:\n\na) Xe ô tô chở người là các loại ô tô có kết cấu và trang bị chủ yếu dùng để chở người, hành lý mang theo. Ô tô chở người cũng có thể kéo theo một rơ moóc. Các loại ô tô chở người gồm:\n\nÔ tô chở người đến 08 chỗ (không kể chỗ của người lái xe) gồm các loại quy định tại Phụ lục I ban hành kèm theo Thông tư này;\n\nÔ tô chở người trên 08 chỗ (không kể chỗ của người lái xe) gồm các loại quy định tại Phụ lục II ban hành kèm theo Thông tư này;\n\nÔ tô chở người chuyên dùng là ô tô chở người có đặc điểm khác với đặc điểm của các loại ô tô chở người nêu trên, có kết cấu và trang bị để chở người trong điều kiện đặc biệt hoặc chở người với sự sắp xếp đặc biệt, gồm các loại quy định tại Phụ lục III ban hành kèm theo Thông tư này;\n\nb) Ô tô chở hàng là các loại ô tô có kết cấu và trang bị chủ yếu dùng để chở hàng. Ô tô chở hàng có thể bố trí tối đa hai hàng ghế và chở không quá 06 người kể cả người lái trong cabin. Ô tô chở hàng cũng có thể kéo theo một rơ moóc. Các loại ô tô chở hàng gồm:\n\nÔ tô tải thông dụng gồm các loại quy định tại Phụ lục IV ban hành kèm theo Thông tư này;\n\nÔ tô tải chuyên dùng bao gồm các loại ô tô chở hàng có kết cấu và trang bị để chở hàng hóa cần sự sắp xếp đặc biệt gồm các loại quy định tại Phụ lục V ban hành kèm theo Thông tư này;\n\nc) Ô tô chuyên dùng là các loại ô tô có kết cấu và trang bị để thực hiện một chức năng, công dụng đặc biệt khác với các loại ô tô nêu tại điểm a và điểm b khoản này. Ô tô chuyên dùng gồm các loại ô tô quy định tại Phụ lục VI ban hành kèm theo Thông tư này;\n\nd) Ô tô đầu kéo là ô tô được thiết kế để kéo sơ mi rơ moóc và có các trang, thiết bị gồm: cơ cấu mâm kéo (fifth-wheel coupling); cơ cấu kết nối và điều khiển hệ thống đèn tín hiệu và hệ thống phanh của sơ mi rơ moóc; có thể trang bị cần cẩu, máy phát điện, cơ cấu móc kéo (tow coupling, hook coupling) để kéo rơ moóc;\n\nđ) Ô tô kéo moóc là ô tô được thiết kế dành riêng hoặc chủ yếu dùng để kéo rơ moóc và có các trang, thiết bị gồm: cơ cấu móc kéo (tow coupling, hook coupling); thùng hoặc sàn chất phụ tải; cơ cấu kết nối và điều khiển hệ thống đèn tín hiệu và hệ thống phanh của rơ moóc;\n\nÔ tô kéo moóc không bao gồm: ô tô chở hàng có trang bị cơ cấu móc kéo; ô tô đầu kéo trang bị thêm cơ cấu móc kéo.\n\n2. Rơ moóc được phân loại theo quy định tại Phụ lục VII ban hành kèm theo Thông tư này.\n\n\n\n3. Sơ mi rơ moóc được phân loại theo quy định tại Phụ lục VIII ban hành kèm theo Thông tư này.\n\n4. Xe chở người bốn bánh có gắn động cơ được phân loại như sau:\n\na) Xe chở người bốn bánh có gắn động cơ tham gia giao thông công cộng là xe được thiết kế để hoạt động trên đường giao thông công cộng;\n\nb) Xe chở người bốn bánh có gắn động cơ hoạt động trên đường chuyên dùng, nội bộ là xe được thiết kế chỉ để hoạt động trên đường chuyên dùng, đường nội bộ.\n\n5. Xe chở hàng bốn bánh có gắn động cơ.\n\n6. Xe mô tô được phân loại như sau:\n\na) Xe mô tô hai bánh;\n\nb) Xe mô tô ba bánh chở người;\n\nc) Xe mô tô ba bánh chở hàng;\n\nd) Xe mô tô ba bánh dùng cho người khuyết tật.\n\n7. Xe gắn máy được phân loại như sau:\n\na) Xe gắn máy hai bánh;\n\nb) Xe gắn máy ba bánh chở người;\n\nc) Xe gắn máy ba bánh chở hàng;\n\nd) Xe gắn máy ba bánh dùng cho người khuyết tật.\n\nĐiều 5. Xe máy chuyên dùng\n\nXe máy chuyên dùng được phân loại như sau:\n\n1. Xe máy thi công được phân loại theo quy định tại Phụ lục IX ban hành kèm theo Thông tư này;\n\n2. Xe máy nông nghiệp, lâm nghiệp là xe máy chuyên dùng chỉ phục vụ trong nông nghiệp, lâm nghiệp;\n\n3. Máy kéo;\n\n4. Rơ moóc, sơ mi rơ moóc được kéo bởi máy kéo: Rơ moóc, sơ mi rơ moóc được thiết kế, chế tạo chỉ để kéo bởi máy kéo;\n\n5. Xe máy thực hiện chức năng, công dụng đặc biệt được phân loại theo quy định tại Phụ lục X ban hành kèm theo Thông tư này;\n\n6. Các loại xe đặc chủng sử dụng vào mục đích quốc phòng, an ninh có tham gia giao thông đường bộ.\n\nĐiều 6. Xe thô sơ\n\nXe thô sơ gồm các loại xe được quy định tại khoản 2 Điều 34 Luật Trật tự, an toàn giao thông đường bộ.\n\nChương III\n\nPHÂN LOẠI XE CƠ GIỚI THEO MỨC ĐỘ TỰ ĐỘNG HÓA\n\nĐiều 7. Phương tiện giao thông thông thường\n\nPhương tiện giao thông thông thường là xe cơ giới mà người lái thực hiện toàn bộ các nhiệm vụ điều khiển chuyển động của xe ngay cả khi được hỗ trợ bởi các hệ thống an toàn chủ động trên xe.\n\nĐiều 8. Phương tiện giao thông thông minh']","**Nguồn văn bản:** /content/drive/MyDrive/ITProject_data/new_law/53_2024_TT-BGTVT_624420.docx

**Tên văn bản:** THÔNG TƯ QUY ĐỊNH VỀ PHÂN LOẠI PHƯƠNG TIỆN GIAO THÔNG ĐƯỜNG BỘ VÀ DẤU HIỆU NHẬN BIẾT XE CƠ GIỚI SỬ DỤNG NĂNG LƯỢNG SẠCH, NĂNG LƯỢNG XANH, THÂN THIỆN MÔI TRƯỜNG

**Nội dung:**

Thông tư này không cung cấp thông tin cụ thể về quy định sử dụng xe ô tô chở vật liệu xây dựng.  Nội dung chính của văn bản tập trung vào việc phân loại phương tiện giao thông đường bộ theo mục đích sử dụng và mức độ tự động hóa, cũng như dấu hiệu nhận biết xe cơ giới sử dụng năng lượng sạch, năng lượng xanh, thân thiện môi trường.  Văn bản đề cập đến các loại ô tô như:

* Ô tô chở người: Bao gồm ô tô chở người đến 08 chỗ, trên 08 chỗ và ô tô chở người chuyên dùng.
* Ô tô chở hàng: Bao gồm ô tô tải thông dụng và ô tô tải chuyên dùng.
* Ô tô chuyên dùng:  Có kết cấu và trang bị để thực hiện một chức năng, công dụng đặc biệt.
* Ô tô đầu kéo: Được thiết kế để kéo sơ mi rơ moóc.
* Ô tô kéo moóc: Được thiết kế để kéo rơ moóc.


Tuy nhiên, không có thông tin nào liên quan đến quy định cụ thể về việc chở vật liệu xây dựng bằng ô tô.


Tóm lại: Văn bản không chứa thông tin về quy định sử dụng xe ô tô chở vật liệu xây dựng.  Để tìm hiểu thông tin này, cần tham khảo các văn bản pháp luật khác liên quan đến vận tải hàng hóa và an toàn giao thông đường bộ.
",Xe ô tô chở vật liệu xây dựng phải được che phủ kín để tránh rơi vãi và gây ô nhiễm môi trường.,0.8571428571428571,0.7704660321767925,0.0,0.0
48,Luật Giao thông Đường bộ 2025 có quy định gì về việc sử dụng xe ô tô chở rác thải?,"['đ) Không được để các chủ phương tiện kinh doanh vận tải sử dụng bãi đỗ xe để đón, trả khách hoặc xếp, dỡ hàng hóa, đóng gói, sang tải hàng hóa;\n\ne) Từ chối phục vụ đối với chủ phương tiện giao thông đường bộ không chấp hành nội quy bãi đỗ xe;\n\ng) Chịu sự kiểm tra, giám sát của cơ quan nhà nước có thẩm quyền.\n\nĐiều 74. Dịch vụ đại lý vận tải hàng hóa\n\n1. Đơn vị kinh doanh dịch vụ đại lý vận tải hàng hóa được thành lập theo quy định của pháp luật về doanh nghiệp, pháp luật về hợp tác xã.\n\n2. Dịch vụ đại lý vận tải hàng hóa là việc tổ chức, cá nhân được đơn vị kinh doanh vận tải thuê thực hiện một hoặc nhiều công đoạn trong quá trình vận tải, trừ công đoạn trực tiếp điều hành phương tiện và người lái xe hoặc quyết định giá cước vận tải.\n\n3. Đơn vị kinh doanh dịch vụ đại lý vận tải hàng hóa được hưởng tiền công dịch vụ đại lý vận tải theo thoả thuận với đơn vị kinh doanh vận tải.\n\n4. Đơn vị kinh doanh dịch vụ đại lý vận tải hàng hóa khi xếp, dỡ hàng hóa trên xe phải tuân thủ quy định của Luật này và quy định khác của pháp luật có liên quan.\n\nĐiều 75. Dịch vụ đại lý bán vé\n\n1. Đơn vị kinh doanh dịch vụ đại lý bán vé được thành lập theo quy định của pháp luật về doanh nghiệp, pháp luật về hợp tác xã.\n\n2. Đơn vị kinh doanh dịch vụ đại lý bán vé phải có hợp đồng đại lý bán vé với đơn vị kinh doanh vận tải hành khách bằng xe buýt, đơn vị kinh doanh vận tải theo tuyến cố định.\n\n3. Đơn vị kinh doanh vận tải và đơn vị kinh doanh dịch vụ đại lý bán vé không được tổ chức đón, trả khách tại địa điểm đặt đại lý bán vé, trừ trường hợp đại lý bán vé được đặt tại bến xe khách.\n\nĐiều 76. Dịch vụ thu gom hàng, chuyển tải, kho bãi hàng hóa trong hoạt động vận tải đường bộ\n\n1. Đơn vị kinh doanh dịch vụ đại lý thu gom hàng, dịch vụ chuyển tải, dịch vụ kho bãi hàng hóa được thành lập theo quy định của pháp luật về doanh nghiệp, pháp luật về hợp tác xã.\n\n2. Đơn vị kinh doanh dịch vụ đại lý thu gom hàng, dịch vụ chuyển tải, dịch vụ kho bãi hàng hóa phải bảo quản hàng hóa theo quy định của chủ hàng và phải có hợp đồng về việc thu gom hàng, chuyển tải hàng hoặc cho thuê kho bãi hàng hóa với chủ hàng.\n\n3. Việc xếp hàng hóa lên xe ô tô phải tuân thủ quy định của Luật này và quy định khác của pháp luật có liên quan.\n\nĐiều 77. Dịch vụ xếp, dỡ hàng hóa trên phương tiện tham gia giao thông đường bộ\n\n1. Đơn vị kinh doanh dịch vụ xếp, dỡ hàng hóa trên phương tiện tham gia giao thông đường bộ được thành lập theo quy định của pháp luật về doanh nghiệp, pháp luật về hợp tác xã.\n\n2. Việc xếp hàng hóa trên phương tiện không được vượt quá khối lượng hàng hóa chuyên chở cho phép tham gia giao thông được ghi trong giấy chứng nhận kiểm định an toàn kỹ thuật và bảo vệ môi trường của phương tiện giao thông đường bộ và thực hiện quy định của pháp luật về trật tự, an toàn giao thông đường bộ.\n\n3. Người xếp hàng hóa chịu trách nhiệm khi vi phạm các quy định về xếp hàng hóa trên xe ô tô.\n\n4. Người xếp, dỡ hàng hóa chịu trách nhiệm bồi thường mất mát, hư hỏng hàng hóa theo quy định của pháp luật.\n\nĐiều 78. Dịch vụ cho thuê phương tiện giao thông cơ giới đường bộ\n\n1. Dịch vụ cho thuê phương tiện giao thông cơ giới đường bộ bao gồm:\n\na) Dịch vụ cho thuê phương tiện để tự lái là việc tổ chức, cá nhân cho thuê xe ô tô chở người dưới 08 chỗ (không kể chỗ của người lái xe), xe gắn máy, xe mô tô hai bánh, xe mô tô ba bánh để người thuê xe tự điều khiển phương tiện;\n\nb) Dịch vụ cho thuê phương tiện để kinh doanh vận tải, vận tải nội bộ là việc tổ chức, cá nhân cho thuê xe ô tô (không bao gồm thuê người lái xe) để bên thuê xe tổ chức hoạt động kinh doanh vận tải bằng xe ô tô hoặc vận tải nội bộ.\n\n2. Đơn vị kinh doanh cho thuê phương tiện để tự lái phải đáp ứng các yêu cầu sau đây:\n\na) Chỉ được cho thuê phương tiện khi người thuê có giấy phép lái xe đang còn điểm, còn hiệu lực phù hợp với loại xe cho thuê;\n\nb) Không được bố trí lái xe cho người thuê phương tiện;\n\nc) Phải ký kết hợp đồng cho thuê phương tiện để tự lái với người thuê kèm theo bản phô tô giấy phép lái xe của người thuê.\n\n3. Người thuê phương tiện để tự lái không được sử dụng phương tiện đi thuê để vận tải hành khách, hàng hóa có thu tiền.\n\n4. Đơn vị kinh doanh dịch vụ cho thuê phương tiện để kinh doanh vận tải bằng xe ô tô, vận tải nội bộ phải đáp ứng các yêu cầu sau đây:\n\na) Được thành lập theo quy định của pháp luật về doanh nghiệp, pháp luật về hợp tác xã. Đối với nhà cung cấp dịch vụ nước ngoài chỉ được cung cấp dịch vụ thông qua thành lập liên doanh với đối tác Việt Nam theo tỷ lệ vốn góp theo quy định của điều ước quốc tế mà nước Cộng hòa xã hội chủ nghĩa Việt Nam là thành viên và quy định của pháp luật có liên quan;\n\nb) Phải ký kết hợp đồng cho thuê phương tiện không kèm người lái xe với bên thuê.\n\nĐiều 79. Dịch vụ cứu hộ giao thông đường bộ\n\n1. Tổ chức, cá nhân kinh doanh dịch vụ cứu hộ giao thông đường bộ phải đáp ứng các yêu cầu sau đây:\n\na) Được thành lập theo quy định của pháp luật về doanh nghiệp, pháp luật về hợp tác xã;\n\nb) Phải bảo đảm an toàn giao thông, an toàn lao động trong quá trình thực hiện cứu hộ;\n\nc) Không được sử dụng xe cứu hộ để kinh doanh vận tải hàng hóa bằng xe ô tô.\n\n2. Tổ chức, cá nhân kinh doanh dịch vụ cứu hộ giao thông đường bộ có trách nhiệm thực hiện quy định của pháp luật về trật tự, an toàn giao thông đường bộ.\n\nĐiều 80. Dịch vụ phần mềm hỗ trợ kết nối vận tải bằng xe ô tô\n\n1. Phần mềm hỗ trợ kết nối vận tải bằng xe ô tô là giao thức kết nối giữa đơn vị kinh doanh vận tải, người lái xe với hành khách hoặc người thuê vận tải diễn ra trong môi trường điện tử.\n\n2. Tổ chức, cá nhân kinh doanh vận tải bằng xe ô tô sử dụng phần mềm hỗ trợ kết nối vận tải bằng xe ô tô phải tuân thủ các quy định về kinh doanh, điều kiện kinh doanh vận tải bằng xe ô tô, pháp luật về giao dịch điện tử và quy định khác của pháp luật có liên quan.\n\n3. Tổ chức, cá nhân cung cấp dịch vụ phần mềm hỗ trợ kết nối vận tải bằng xe ô tô cho các đơn vị kinh doanh vận tải bằng xe ô tô phải tuân thủ quy định của pháp luật về thương mại điện tử, pháp luật về giao dịch điện tử và quy định khác của pháp luật có liên quan.\n\nChương V\n\nQUẢN LÝ NHÀ NƯỚC VỀ HOẠT ĐỘNG ĐƯỜNG BỘ\n\nĐiều 81. Nội dung quản lý nhà nước về hoạt động đường bộ\n\n1. Xây dựng, ban hành hoặc trình cơ quan có thẩm quyền ban hành và tổ chức thực hiện chính sách, pháp luật; quy chuẩn, tiêu chuẩn kỹ thuật, định mức kinh tế - kỹ thuật về hoạt động đường bộ.\n\n2. Xây dựng, ban hành và tổ chức thực hiện quy hoạch, kế hoạch về hoạt động đường bộ.\n\n3. Tuyên truyền, phổ biến, giáo dục pháp luật trong hoạt động đường bộ.\n\n4. Đầu tư, xây dựng, quản lý, vận hành, khai thác, bảo trì, bảo vệ kết cấu hạ tầng đường bộ.\n\n5. Quản lý vận tải và dịch vụ hỗ trợ vận tải đường bộ.\n\n6. Tổ chức nghiên cứu, ứng dụng khoa học và công nghệ; đào tạo, bồi dưỡng nguồn nhân lực trong hoạt động đường bộ.\n\n7. Kiểm tra, thanh tra, giải quyết khiếu nại, tố cáo; xử lý vi phạm pháp luật trong hoạt động đường bộ.\n\n8. Hợp tác quốc tế trong hoạt động đường bộ.\n\nĐiều 82. Trách nhiệm quản lý nhà nước về hoạt động đường bộ\n\n1. Chính phủ thống nhất quản lý nhà nước về hoạt động đường bộ.\n\n2. Bộ Giao thông vận tải là cơ quan chịu trách nhiệm giúp Chính phủ thực hiện quản lý nhà nước về hoạt động đường bộ.\n\n3. Bộ, cơ quan ngang Bộ, trong phạm vi nhiệm vụ, quyền hạn của mình, có trách nhiệm chủ trì, phối hợp với Bộ Giao thông vận tải thực hiện quản lý nhà nước về hoạt động đường bộ.\n\n4. Ủy ban nhân dân các cấp, trong phạm vi nhiệm vụ, quyền hạn của mình, có trách nhiệm tổ chức thực hiện quản lý nhà nước về hoạt động đường bộ.\n\nĐiều 83. Thanh tra đường bộ\n\nThanh tra đường bộ có nhiệm vụ sau đây:\n\n1. Thanh tra, kiểm tra, xử lý vi phạm pháp luật về kết cấu hạ tầng đường bộ; vận tải đường bộ tại đơn vị vận tải, bến xe, bãi đỗ xe, trạm dừng nghỉ, đơn vị thực hiện dịch vụ hỗ trợ vận tải;']","**Nguồn văn bản:** /content/drive/MyDrive/ITProject_data/new_law/35_2024_QH15_588811.docx

**Tên văn bản:** Không có thông tin trong context

**Điều:** Không có thông tin trong context

**Nội dung:**

Tôi xin lỗi, nhưng văn bản được cung cấp không chứa thông tin về quy định sử dụng xe ô tô chở rác thải trong Luật Giao thông Đường bộ.  Văn bản tập trung vào các quy định về dịch vụ vận tải hàng hóa, dịch vụ đại lý, và quản lý nhà nước về hoạt động đường bộ.  Nội dung không đề cập đến loại phương tiện cụ thể được sử dụng để vận chuyển rác thải hay các quy định liên quan.

Tóm lại: Không tìm thấy thông tin liên quan đến quy định về việc sử dụng xe ô tô chở rác thải trong văn bản được cung cấp.
","Xe ô tô chở rác thải phải được che phủ kín, không để rò rỉ nước thải và tuân thủ các quy định về vệ sinh môi trường.",1.0,0.0,0.0,0.0
49,Quy định mới về việc sử dụng xe ô tô chở động vật sống là gì?,"['5. Phạt tiền từ 12.000.000 đồng đến 14.000.000 đồng đối với hành vi vận chuyển hàng hóa nguy hiểm không có giấy phép vận chuyển hàng hóa nguy hiểm hoặc có nhưng hết hiệu lực hoặc không thực hiện đúng quy định trong giấy phép vận chuyển hàng hóa nguy hiểm, trừ các hành vi vi phạm quy định tại điểm a khoản 6 Điều 20 của Nghị định này.\n\n6. Ngoài việc bị áp dụng hình thức xử phạt, người thực hiện hành vi vi phạm quy định tại khoản 4, khoản 5 Điều này nếu gây ô nhiễm môi trường còn bị áp dụng các biện pháp khắc phục hậu quả buộc thực hiện các biện pháp khắc phục tình trạng ô nhiễm môi trường do vi phạm hành chính gây ra.\n\n7. Ngoài việc bị áp dụng hình thức xử phạt, người điều khiển phương tiện thực hiện hành vi vi phạm còn bị trừ điểm giấy phép lái xe như sau:\n\na) Thực hiện hành vi quy định tại khoản 3, khoản 4 Điều này bị trừ điểm giấy phép lái xe 02 điểm;\n\nb) Thực hiện hành vi quy định tại khoản 5 Điều này bị trừ điểm giấy phép lái xe 04 điểm.\n\nĐiều 24. Xử phạt, trừ điểm giấy phép lái xe của người điều khiển xe ô tô thực hiện hành vi vi phạm quy định về vận chuyển động vật sống, thực phẩm tươi sống\n\n1. Phạt tiền từ 1.000.000 đồng đến 2.000.000 đồng đối với hành vi vi phạm vận chuyển động vật sống, thực phẩm tươi sống không mang đủ giấy tờ theo quy định (đối với loại động vật sống, thực phẩm tươi sống khi vận chuyển phải có giấy tờ).\n\n2. Phạt tiền từ 3.000.000 đồng đến 5.000.000 đồng đối với hành vi vi phạm vận chuyển thực phẩm tươi sống không chấp hành quy định về an toàn thực phẩm, vệ sinh dịch tễ, phòng dịch và bảo đảm vệ sinh môi trường theo quy định.\n\n3. Ngoài việc bị áp dụng hình thức xử phạt, người điều khiển phương tiện thực hiện hành vi vi phạm quy định tại khoản 2 Điều này còn bị trừ điểm giấy phép lái xe 02 điểm.\n\nĐiều 25. Xử phạt, trừ điểm giấy phép lái xe của người điều khiển xe vệ sinh môi trường, xe ô tô chở phế thải thực hiện hành vi vi phạm quy định về hoạt động vận tải trong đô thị\n\n1. Phạt tiền từ 2.000.000 đồng đến 3.000.000 đồng đối với hành vi điều khiển xe không chạy đúng tuyến, phạm vi, thời gian quy định.\n\n2. Ngoài việc bị áp dụng hình thức xử phạt, người điều khiển phương tiện thực hiện hành vi vi phạm quy định tại khoản 1 Điều này còn bị trừ điểm giấy phép lái xe 02 điểm.\n\nĐiều 26. Xử phạt các hành vi vi phạm quy định về trật tự, an toàn giao thông đường bộ trong vận tải đường bộ, dịch vụ hỗ trợ vận tải đường bộ\n\n1. Phạt tiền từ 500.000 đồng đến 1.000.000 đồng đối với cá nhân, từ 1.000.000 đồng đến 2.000.000 đồng đối với tổ chức thực hiện một trong các hành vi vi phạm sau đây:\n\na) Xếp hàng hóa lên mỗi xe ô tô (kể cả rơ moóc và sơ mi rơ moóc) vượt quá trọng tải (khối lượng hàng chuyên chở) cho phép tham gia giao thông được ghi trong giấy chứng nhận kiểm định an toàn kỹ thuật và bảo vệ môi trường của xe trên 10% đến 50% (trừ xe xi téc chở chất lỏng), trên 20% đến 50% đối với xe xi téc chở chất lỏng;\n\nb) Xếp hàng hóa lên xe ô tô mà không ký xác nhận việc xếp hàng hóa vào giấy vận tải theo quy định.\n\n2. Phạt tiền từ 1.000.000 đồng đến 2.000.000 đồng đối với cá nhân, từ 2.000.000 đồng đến 4.000.000 đồng đối với tổ chức kinh doanh vận tải, dịch vụ hỗ trợ vận tải thực hiện một trong các hành vi vi phạm sau đây:\n\na) Không đánh số thứ tự ghế ngồi, giường nằm trên xe ô tô chở hành khách theo quy định;\n\nb) Sử dụng xe ô tô kinh doanh vận tải hành khách theo tuyến cố định, xe ô tô kinh doanh vận tải hành khách bằng xe buýt không có chỗ ưu tiên cho người khuyết tật, người cao tuổi và phụ nữ mang thai theo quy định;\n\nc) Sử dụng xe ô tô kinh doanh vận tải hành khách không có hướng dẫn cho hành khách về an toàn giao thông, thoát hiểm khi xảy ra sự cố trên xe theo quy định;\n\nd) Không bố trí người áp tải trên xe vận chuyển hàng hóa nguy hiểm đối với những trường hợp quy định phải có người áp tải;\n\nđ) Không cấp lệnh vận chuyển, giấy vận tải cho lái xe hoặc cấp lệnh vận chuyển, giấy vận tải nhưng không đúng theo quy định (đối với loại xe quy định phải cấp lệnh vận chuyển, giấy vận tải);\n\ne) Sử dụng xe vận chuyển hàng hóa nguy hiểm mà không làm sạch hoặc không bóc (xóa) biểu trưng nguy hiểm trên phương tiện khi không tiếp tục vận chuyển loại hàng hóa đó.\n\n3. Phạt tiền từ 2.000.000 đồng đến 3.000.000 đồng đối với cá nhân, từ 4.000.000 đồng đến 6.000.000 đồng đối với tổ chức thực hiện hành vi vi phạm xếp hàng hóa lên mỗi xe ô tô (kể cả rơ moóc và sơ mi rơ moóc) vượt quá trọng tải (khối lượng hàng chuyên chở) cho phép tham gia giao thông được ghi trong giấy chứng nhận kiểm định an toàn kỹ thuật và bảo vệ môi trường của xe trên 50% đến 100%.\n\n4. Phạt tiền từ 3.000.000 đồng đến 4.000.000 đồng đối với cá nhân, từ 6.000.000 đồng đến 8.000.000 đồng đối với tổ chức kinh doanh vận tải, dịch vụ hỗ trợ vận tải thực hiện một trong các hành vi vi phạm sau đây:\n\na) Không cấp thẻ nhận dạng lái xe cho lái xe theo quy định;\n\nb) Sử dụng lái xe, nhân viên phục vụ trên xe để tham gia kinh doanh vận tải bằng xe ô tô mà không được tập huấn, hướng dẫn về nghiệp vụ vận tải hành khách và an toàn giao thông theo quy định (đối với hình thức kinh doanh vận tải có quy định lái xe, nhân viên phục vụ trên xe phải được tập huấn, hướng dẫn nghiệp vụ), trừ các hành vi vi phạm quy định tại điểm c, điểm d khoản này;\n\nc) Sử dụng lái xe, người quản lý trên xe để tham gia kinh doanh vận tải bằng xe ô tô mà không được hướng dẫn về quy trình bảo đảm an toàn khi đưa đón trẻ em mầm non, học sinh;\n\nd) Sử dụng lái xe, người áp tải vận chuyển hàng hóa nguy hiểm mà không được tập huấn về vận chuyển hàng hóa nguy hiểm;\n\nđ) Sử dụng xe ô tô kinh doanh vận tải hành khách không có dây đai an toàn tại các vị trí ghế ngồi, giường nằm theo quy định (trừ xe buýt nội tỉnh);\n\ne) Sử dụng xe ô tô kinh doanh vận tải chở trẻ em mầm non, học sinh tiểu học, xe ô tô kinh doanh vận tải kết hợp với hoạt động đưa đón trẻ em mầm non, học sinh tiểu học không có dây đai an toàn phù hợp với lứa tuổi hoặc không có ghế ngồi phù hợp với lứa tuổi theo quy định;\n\ng) Không thực hiện việc niêm yết thông tin trên xe theo quy định hoặc có niêm yết nhưng không chính xác, không đầy đủ thông tin theo quy định.\n\n5. Phạt tiền từ 4.000.000 đồng đến 5.000.000 đồng đối với cá nhân, từ 8.000.000 đồng đến 10.000.000 đồng đối với tổ chức xếp hàng hóa lên mỗi xe ô tô (kể cả rơ moóc và sơ mi rơ moóc) vượt quá trọng tải (khối lượng hàng chuyên chở) cho phép tham gia giao thông được ghi trong giấy chứng nhận kiểm định an toàn kỹ thuật và bảo vệ môi trường của xe trên 100%.\n\n6. Phạt tiền từ 4.000.000 đồng đến 6.000.000 đồng đối với cá nhân, từ 8.000.000 đồng đến 12.000.000 đồng đối với tổ chức kinh doanh vận tải thực hiện một trong các hành vi vi phạm sau đây:\n\na) Sử dụng xe vận chuyển động vật sống không có kết cấu phù hợp với loại động vật chuyên chở theo quy định;\n\nb) Sử dụng xe ô tô kinh doanh vận tải chở trẻ em mầm non, học sinh, xe ô tô kinh doanh vận tải kết hợp với hoạt động đưa đón trẻ em mầm non, học sinh không có thiết bị ghi nhận hình ảnh trẻ em mầm non, học sinh hoặc không có thiết bị có chức năng cảnh báo, chống bỏ quên trẻ em trên xe hoặc không có thiết bị ghi nhận hình ảnh trẻ em mầm non, học sinh và thiết bị có chức năng cảnh báo, chống bỏ quên trẻ em trên xe;\n\nc) Sử dụng xe ô tô kinh doanh vận tải chở trẻ em mầm non, học sinh không có màu sơn theo quy định;\n\nd) Sử dụng xe ô tô kinh doanh vận tải chở trẻ em mầm non, học sinh, xe ô tô kinh doanh vận tải kết hợp với hoạt động đưa đón trẻ em mầm non, học sinh không có biển báo dấu hiệu nhận biết là xe chở trẻ em mầm non, học sinh theo quy định.\n\n7. Phạt tiền từ 5.000.000 đồng đến 6.000.000 đồng đối với cá nhân, từ 10.000.000 đồng đến 12.000.000 đồng đối với tổ chức kinh doanh vận tải, dịch vụ hỗ trợ vận tải thực hiện một trong các hành vi vi phạm sau đây:\n\na) Không thực hiện việc cung cấp, cập nhật, truyền, lưu trữ, quản lý thông tin, dữ liệu từ thiết bị giám sát hành trình theo quy định;\n\nb) Không thực hiện đúng nội dung thông tin đã niêm yết trên xe theo quy định;']","**Nguồn văn bản:** /content/drive/MyDrive/ITProject_data/new_law/168_2024_ND-CP_619502.docx

**Nội dung:**

Điều 24. Xử phạt, trừ điểm giấy phép lái xe của người điều khiển xe ô tô thực hiện hành vi vi phạm quy định về vận chuyển động vật sống, thực phẩm tươi sống

1. Phạt tiền từ 1.000.000 đồng đến 2.000.000 đồng đối với hành vi vi phạm vận chuyển động vật sống, thực phẩm tươi sống không mang đủ giấy tờ theo quy định (đối với loại động vật sống, thực phẩm tươi sống khi vận chuyển phải có giấy tờ).

2. Phạt tiền từ 3.000.000 đồng đến 5.000.000 đồng đối với hành vi vi phạm vận chuyển thực phẩm tươi sống không chấp hành quy định về an toàn thực phẩm, vệ sinh dịch tễ, phòng dịch và bảo đảm vệ sinh môi trường theo quy định.

3. Ngoài việc bị áp dụng hình thức xử phạt, người điều khiển phương tiện thực hiện hành vi vi phạm quy định tại khoản 2 Điều này còn bị trừ điểm giấy phép lái xe 02 điểm.

Điều 26. Xử phạt các hành vi vi phạm quy định về trật tự, an toàn giao thông đường bộ trong vận tải đường bộ, dịch vụ hỗ trợ vận tải đường bộ

6. Phạt tiền từ 4.000.000 đồng đến 6.000.000 đồng đối với cá nhân, từ 8.000.000 đồng đến 12.000.000 đồng đối với tổ chức kinh doanh vận tải thực hiện một trong các hành vi vi phạm sau đây:

    a) Sử dụng xe vận chuyển động vật sống không có kết cấu phù hợp với loại động vật chuyên chở theo quy định.


Tóm lại:  Quy định về vận chuyển động vật sống bằng ô tô bao gồm mức phạt tiền từ 1.000.000 đồng đến 2.000.000 đồng nếu không có đủ giấy tờ theo quy định.  Ngoài ra, việc sử dụng xe không có kết cấu phù hợp để vận chuyển động vật sống sẽ bị phạt tiền từ 4.000.000 đồng đến 6.000.000 đồng (đối với cá nhân) và từ 8.000.000 đồng đến 12.000.000 đồng (đối với tổ chức).  Vi phạm về vận chuyển thực phẩm tươi sống cũng có mức phạt tương tự và có thể bị trừ điểm bằng lái.
","Xe ô tô chở động vật sống phải đảm bảo vệ sinh, an toàn cho động vật và không gây ô nhiễm môi trường.",1.0,0.6576715502040454,0.0,0.0
50,Luật Giao thông Đường bộ 2025 có quy định gì về việc sử dụng xe ô tô chở cây cảnh?,"['5. Phạt tiền từ 12.000.000 đồng đến 14.000.000 đồng đối với hành vi vận chuyển hàng hóa nguy hiểm không có giấy phép vận chuyển hàng hóa nguy hiểm hoặc có nhưng hết hiệu lực hoặc không thực hiện đúng quy định trong giấy phép vận chuyển hàng hóa nguy hiểm, trừ các hành vi vi phạm quy định tại điểm a khoản 6 Điều 20 của Nghị định này.\n\n6. Ngoài việc bị áp dụng hình thức xử phạt, người thực hiện hành vi vi phạm quy định tại khoản 4, khoản 5 Điều này nếu gây ô nhiễm môi trường còn bị áp dụng các biện pháp khắc phục hậu quả buộc thực hiện các biện pháp khắc phục tình trạng ô nhiễm môi trường do vi phạm hành chính gây ra.\n\n7. Ngoài việc bị áp dụng hình thức xử phạt, người điều khiển phương tiện thực hiện hành vi vi phạm còn bị trừ điểm giấy phép lái xe như sau:\n\na) Thực hiện hành vi quy định tại khoản 3, khoản 4 Điều này bị trừ điểm giấy phép lái xe 02 điểm;\n\nb) Thực hiện hành vi quy định tại khoản 5 Điều này bị trừ điểm giấy phép lái xe 04 điểm.\n\nĐiều 24. Xử phạt, trừ điểm giấy phép lái xe của người điều khiển xe ô tô thực hiện hành vi vi phạm quy định về vận chuyển động vật sống, thực phẩm tươi sống\n\n1. Phạt tiền từ 1.000.000 đồng đến 2.000.000 đồng đối với hành vi vi phạm vận chuyển động vật sống, thực phẩm tươi sống không mang đủ giấy tờ theo quy định (đối với loại động vật sống, thực phẩm tươi sống khi vận chuyển phải có giấy tờ).\n\n2. Phạt tiền từ 3.000.000 đồng đến 5.000.000 đồng đối với hành vi vi phạm vận chuyển thực phẩm tươi sống không chấp hành quy định về an toàn thực phẩm, vệ sinh dịch tễ, phòng dịch và bảo đảm vệ sinh môi trường theo quy định.\n\n3. Ngoài việc bị áp dụng hình thức xử phạt, người điều khiển phương tiện thực hiện hành vi vi phạm quy định tại khoản 2 Điều này còn bị trừ điểm giấy phép lái xe 02 điểm.\n\nĐiều 25. Xử phạt, trừ điểm giấy phép lái xe của người điều khiển xe vệ sinh môi trường, xe ô tô chở phế thải thực hiện hành vi vi phạm quy định về hoạt động vận tải trong đô thị\n\n1. Phạt tiền từ 2.000.000 đồng đến 3.000.000 đồng đối với hành vi điều khiển xe không chạy đúng tuyến, phạm vi, thời gian quy định.\n\n2. Ngoài việc bị áp dụng hình thức xử phạt, người điều khiển phương tiện thực hiện hành vi vi phạm quy định tại khoản 1 Điều này còn bị trừ điểm giấy phép lái xe 02 điểm.\n\nĐiều 26. Xử phạt các hành vi vi phạm quy định về trật tự, an toàn giao thông đường bộ trong vận tải đường bộ, dịch vụ hỗ trợ vận tải đường bộ\n\n1. Phạt tiền từ 500.000 đồng đến 1.000.000 đồng đối với cá nhân, từ 1.000.000 đồng đến 2.000.000 đồng đối với tổ chức thực hiện một trong các hành vi vi phạm sau đây:\n\na) Xếp hàng hóa lên mỗi xe ô tô (kể cả rơ moóc và sơ mi rơ moóc) vượt quá trọng tải (khối lượng hàng chuyên chở) cho phép tham gia giao thông được ghi trong giấy chứng nhận kiểm định an toàn kỹ thuật và bảo vệ môi trường của xe trên 10% đến 50% (trừ xe xi téc chở chất lỏng), trên 20% đến 50% đối với xe xi téc chở chất lỏng;\n\nb) Xếp hàng hóa lên xe ô tô mà không ký xác nhận việc xếp hàng hóa vào giấy vận tải theo quy định.\n\n2. Phạt tiền từ 1.000.000 đồng đến 2.000.000 đồng đối với cá nhân, từ 2.000.000 đồng đến 4.000.000 đồng đối với tổ chức kinh doanh vận tải, dịch vụ hỗ trợ vận tải thực hiện một trong các hành vi vi phạm sau đây:\n\na) Không đánh số thứ tự ghế ngồi, giường nằm trên xe ô tô chở hành khách theo quy định;\n\nb) Sử dụng xe ô tô kinh doanh vận tải hành khách theo tuyến cố định, xe ô tô kinh doanh vận tải hành khách bằng xe buýt không có chỗ ưu tiên cho người khuyết tật, người cao tuổi và phụ nữ mang thai theo quy định;\n\nc) Sử dụng xe ô tô kinh doanh vận tải hành khách không có hướng dẫn cho hành khách về an toàn giao thông, thoát hiểm khi xảy ra sự cố trên xe theo quy định;\n\nd) Không bố trí người áp tải trên xe vận chuyển hàng hóa nguy hiểm đối với những trường hợp quy định phải có người áp tải;\n\nđ) Không cấp lệnh vận chuyển, giấy vận tải cho lái xe hoặc cấp lệnh vận chuyển, giấy vận tải nhưng không đúng theo quy định (đối với loại xe quy định phải cấp lệnh vận chuyển, giấy vận tải);\n\ne) Sử dụng xe vận chuyển hàng hóa nguy hiểm mà không làm sạch hoặc không bóc (xóa) biểu trưng nguy hiểm trên phương tiện khi không tiếp tục vận chuyển loại hàng hóa đó.\n\n3. Phạt tiền từ 2.000.000 đồng đến 3.000.000 đồng đối với cá nhân, từ 4.000.000 đồng đến 6.000.000 đồng đối với tổ chức thực hiện hành vi vi phạm xếp hàng hóa lên mỗi xe ô tô (kể cả rơ moóc và sơ mi rơ moóc) vượt quá trọng tải (khối lượng hàng chuyên chở) cho phép tham gia giao thông được ghi trong giấy chứng nhận kiểm định an toàn kỹ thuật và bảo vệ môi trường của xe trên 50% đến 100%.\n\n4. Phạt tiền từ 3.000.000 đồng đến 4.000.000 đồng đối với cá nhân, từ 6.000.000 đồng đến 8.000.000 đồng đối với tổ chức kinh doanh vận tải, dịch vụ hỗ trợ vận tải thực hiện một trong các hành vi vi phạm sau đây:\n\na) Không cấp thẻ nhận dạng lái xe cho lái xe theo quy định;\n\nb) Sử dụng lái xe, nhân viên phục vụ trên xe để tham gia kinh doanh vận tải bằng xe ô tô mà không được tập huấn, hướng dẫn về nghiệp vụ vận tải hành khách và an toàn giao thông theo quy định (đối với hình thức kinh doanh vận tải có quy định lái xe, nhân viên phục vụ trên xe phải được tập huấn, hướng dẫn nghiệp vụ), trừ các hành vi vi phạm quy định tại điểm c, điểm d khoản này;\n\nc) Sử dụng lái xe, người quản lý trên xe để tham gia kinh doanh vận tải bằng xe ô tô mà không được hướng dẫn về quy trình bảo đảm an toàn khi đưa đón trẻ em mầm non, học sinh;\n\nd) Sử dụng lái xe, người áp tải vận chuyển hàng hóa nguy hiểm mà không được tập huấn về vận chuyển hàng hóa nguy hiểm;\n\nđ) Sử dụng xe ô tô kinh doanh vận tải hành khách không có dây đai an toàn tại các vị trí ghế ngồi, giường nằm theo quy định (trừ xe buýt nội tỉnh);\n\ne) Sử dụng xe ô tô kinh doanh vận tải chở trẻ em mầm non, học sinh tiểu học, xe ô tô kinh doanh vận tải kết hợp với hoạt động đưa đón trẻ em mầm non, học sinh tiểu học không có dây đai an toàn phù hợp với lứa tuổi hoặc không có ghế ngồi phù hợp với lứa tuổi theo quy định;\n\ng) Không thực hiện việc niêm yết thông tin trên xe theo quy định hoặc có niêm yết nhưng không chính xác, không đầy đủ thông tin theo quy định.\n\n5. Phạt tiền từ 4.000.000 đồng đến 5.000.000 đồng đối với cá nhân, từ 8.000.000 đồng đến 10.000.000 đồng đối với tổ chức xếp hàng hóa lên mỗi xe ô tô (kể cả rơ moóc và sơ mi rơ moóc) vượt quá trọng tải (khối lượng hàng chuyên chở) cho phép tham gia giao thông được ghi trong giấy chứng nhận kiểm định an toàn kỹ thuật và bảo vệ môi trường của xe trên 100%.\n\n6. Phạt tiền từ 4.000.000 đồng đến 6.000.000 đồng đối với cá nhân, từ 8.000.000 đồng đến 12.000.000 đồng đối với tổ chức kinh doanh vận tải thực hiện một trong các hành vi vi phạm sau đây:\n\na) Sử dụng xe vận chuyển động vật sống không có kết cấu phù hợp với loại động vật chuyên chở theo quy định;\n\nb) Sử dụng xe ô tô kinh doanh vận tải chở trẻ em mầm non, học sinh, xe ô tô kinh doanh vận tải kết hợp với hoạt động đưa đón trẻ em mầm non, học sinh không có thiết bị ghi nhận hình ảnh trẻ em mầm non, học sinh hoặc không có thiết bị có chức năng cảnh báo, chống bỏ quên trẻ em trên xe hoặc không có thiết bị ghi nhận hình ảnh trẻ em mầm non, học sinh và thiết bị có chức năng cảnh báo, chống bỏ quên trẻ em trên xe;\n\nc) Sử dụng xe ô tô kinh doanh vận tải chở trẻ em mầm non, học sinh không có màu sơn theo quy định;\n\nd) Sử dụng xe ô tô kinh doanh vận tải chở trẻ em mầm non, học sinh, xe ô tô kinh doanh vận tải kết hợp với hoạt động đưa đón trẻ em mầm non, học sinh không có biển báo dấu hiệu nhận biết là xe chở trẻ em mầm non, học sinh theo quy định.\n\n7. Phạt tiền từ 5.000.000 đồng đến 6.000.000 đồng đối với cá nhân, từ 10.000.000 đồng đến 12.000.000 đồng đối với tổ chức kinh doanh vận tải, dịch vụ hỗ trợ vận tải thực hiện một trong các hành vi vi phạm sau đây:\n\na) Không thực hiện việc cung cấp, cập nhật, truyền, lưu trữ, quản lý thông tin, dữ liệu từ thiết bị giám sát hành trình theo quy định;\n\nb) Không thực hiện đúng nội dung thông tin đã niêm yết trên xe theo quy định;']","**Nguồn văn bản:** /content/drive/MyDrive/ITProject_data/new_law/168_2024_ND-CP_619502.docx

**Tên văn bản:**  (Tên văn bản không được cung cấp trong context)

**Điều:** (Điều không được cung cấp trong context)


**Nội dung:**

Tôi xin lỗi, nhưng văn bản được cung cấp không chứa thông tin cụ thể về quy định vận chuyển cây cảnh bằng ô tô.  Văn bản tập trung vào các quy định về vận chuyển hàng hóa nguy hiểm, động vật sống, thực phẩm tươi sống, phế thải, và các quy định chung về trọng tải, giấy tờ vận chuyển, an toàn giao thông.  Vì vậy, tôi không thể trả lời câu hỏi của bạn dựa trên văn bản này.

Tóm lại: Không tìm thấy thông tin liên quan đến quy định về việc sử dụng xe ô tô chở cây cảnh trong văn bản được cung cấp.
","Xe ô tô chở cây cảnh phải được sắp xếp gọn gàng, đảm bảo an toàn và không cản trở tầm nhìn của người lái.",0.2222222222222222,0.0,0.0,0.0
51,Quy định mới về việc sử dụng xe ô tô chở hàng dễ cháy nổ là gì?,"['5. Phạt tiền từ 12.000.000 đồng đến 14.000.000 đồng đối với hành vi vận chuyển hàng hóa nguy hiểm không có giấy phép vận chuyển hàng hóa nguy hiểm hoặc có nhưng hết hiệu lực hoặc không thực hiện đúng quy định trong giấy phép vận chuyển hàng hóa nguy hiểm, trừ các hành vi vi phạm quy định tại điểm a khoản 6 Điều 20 của Nghị định này.\n\n6. Ngoài việc bị áp dụng hình thức xử phạt, người thực hiện hành vi vi phạm quy định tại khoản 4, khoản 5 Điều này nếu gây ô nhiễm môi trường còn bị áp dụng các biện pháp khắc phục hậu quả buộc thực hiện các biện pháp khắc phục tình trạng ô nhiễm môi trường do vi phạm hành chính gây ra.\n\n7. Ngoài việc bị áp dụng hình thức xử phạt, người điều khiển phương tiện thực hiện hành vi vi phạm còn bị trừ điểm giấy phép lái xe như sau:\n\na) Thực hiện hành vi quy định tại khoản 3, khoản 4 Điều này bị trừ điểm giấy phép lái xe 02 điểm;\n\nb) Thực hiện hành vi quy định tại khoản 5 Điều này bị trừ điểm giấy phép lái xe 04 điểm.\n\nĐiều 24. Xử phạt, trừ điểm giấy phép lái xe của người điều khiển xe ô tô thực hiện hành vi vi phạm quy định về vận chuyển động vật sống, thực phẩm tươi sống\n\n1. Phạt tiền từ 1.000.000 đồng đến 2.000.000 đồng đối với hành vi vi phạm vận chuyển động vật sống, thực phẩm tươi sống không mang đủ giấy tờ theo quy định (đối với loại động vật sống, thực phẩm tươi sống khi vận chuyển phải có giấy tờ).\n\n2. Phạt tiền từ 3.000.000 đồng đến 5.000.000 đồng đối với hành vi vi phạm vận chuyển thực phẩm tươi sống không chấp hành quy định về an toàn thực phẩm, vệ sinh dịch tễ, phòng dịch và bảo đảm vệ sinh môi trường theo quy định.\n\n3. Ngoài việc bị áp dụng hình thức xử phạt, người điều khiển phương tiện thực hiện hành vi vi phạm quy định tại khoản 2 Điều này còn bị trừ điểm giấy phép lái xe 02 điểm.\n\nĐiều 25. Xử phạt, trừ điểm giấy phép lái xe của người điều khiển xe vệ sinh môi trường, xe ô tô chở phế thải thực hiện hành vi vi phạm quy định về hoạt động vận tải trong đô thị\n\n1. Phạt tiền từ 2.000.000 đồng đến 3.000.000 đồng đối với hành vi điều khiển xe không chạy đúng tuyến, phạm vi, thời gian quy định.\n\n2. Ngoài việc bị áp dụng hình thức xử phạt, người điều khiển phương tiện thực hiện hành vi vi phạm quy định tại khoản 1 Điều này còn bị trừ điểm giấy phép lái xe 02 điểm.\n\nĐiều 26. Xử phạt các hành vi vi phạm quy định về trật tự, an toàn giao thông đường bộ trong vận tải đường bộ, dịch vụ hỗ trợ vận tải đường bộ\n\n1. Phạt tiền từ 500.000 đồng đến 1.000.000 đồng đối với cá nhân, từ 1.000.000 đồng đến 2.000.000 đồng đối với tổ chức thực hiện một trong các hành vi vi phạm sau đây:\n\na) Xếp hàng hóa lên mỗi xe ô tô (kể cả rơ moóc và sơ mi rơ moóc) vượt quá trọng tải (khối lượng hàng chuyên chở) cho phép tham gia giao thông được ghi trong giấy chứng nhận kiểm định an toàn kỹ thuật và bảo vệ môi trường của xe trên 10% đến 50% (trừ xe xi téc chở chất lỏng), trên 20% đến 50% đối với xe xi téc chở chất lỏng;\n\nb) Xếp hàng hóa lên xe ô tô mà không ký xác nhận việc xếp hàng hóa vào giấy vận tải theo quy định.\n\n2. Phạt tiền từ 1.000.000 đồng đến 2.000.000 đồng đối với cá nhân, từ 2.000.000 đồng đến 4.000.000 đồng đối với tổ chức kinh doanh vận tải, dịch vụ hỗ trợ vận tải thực hiện một trong các hành vi vi phạm sau đây:\n\na) Không đánh số thứ tự ghế ngồi, giường nằm trên xe ô tô chở hành khách theo quy định;\n\nb) Sử dụng xe ô tô kinh doanh vận tải hành khách theo tuyến cố định, xe ô tô kinh doanh vận tải hành khách bằng xe buýt không có chỗ ưu tiên cho người khuyết tật, người cao tuổi và phụ nữ mang thai theo quy định;\n\nc) Sử dụng xe ô tô kinh doanh vận tải hành khách không có hướng dẫn cho hành khách về an toàn giao thông, thoát hiểm khi xảy ra sự cố trên xe theo quy định;\n\nd) Không bố trí người áp tải trên xe vận chuyển hàng hóa nguy hiểm đối với những trường hợp quy định phải có người áp tải;\n\nđ) Không cấp lệnh vận chuyển, giấy vận tải cho lái xe hoặc cấp lệnh vận chuyển, giấy vận tải nhưng không đúng theo quy định (đối với loại xe quy định phải cấp lệnh vận chuyển, giấy vận tải);\n\ne) Sử dụng xe vận chuyển hàng hóa nguy hiểm mà không làm sạch hoặc không bóc (xóa) biểu trưng nguy hiểm trên phương tiện khi không tiếp tục vận chuyển loại hàng hóa đó.\n\n3. Phạt tiền từ 2.000.000 đồng đến 3.000.000 đồng đối với cá nhân, từ 4.000.000 đồng đến 6.000.000 đồng đối với tổ chức thực hiện hành vi vi phạm xếp hàng hóa lên mỗi xe ô tô (kể cả rơ moóc và sơ mi rơ moóc) vượt quá trọng tải (khối lượng hàng chuyên chở) cho phép tham gia giao thông được ghi trong giấy chứng nhận kiểm định an toàn kỹ thuật và bảo vệ môi trường của xe trên 50% đến 100%.\n\n4. Phạt tiền từ 3.000.000 đồng đến 4.000.000 đồng đối với cá nhân, từ 6.000.000 đồng đến 8.000.000 đồng đối với tổ chức kinh doanh vận tải, dịch vụ hỗ trợ vận tải thực hiện một trong các hành vi vi phạm sau đây:\n\na) Không cấp thẻ nhận dạng lái xe cho lái xe theo quy định;\n\nb) Sử dụng lái xe, nhân viên phục vụ trên xe để tham gia kinh doanh vận tải bằng xe ô tô mà không được tập huấn, hướng dẫn về nghiệp vụ vận tải hành khách và an toàn giao thông theo quy định (đối với hình thức kinh doanh vận tải có quy định lái xe, nhân viên phục vụ trên xe phải được tập huấn, hướng dẫn nghiệp vụ), trừ các hành vi vi phạm quy định tại điểm c, điểm d khoản này;\n\nc) Sử dụng lái xe, người quản lý trên xe để tham gia kinh doanh vận tải bằng xe ô tô mà không được hướng dẫn về quy trình bảo đảm an toàn khi đưa đón trẻ em mầm non, học sinh;\n\nd) Sử dụng lái xe, người áp tải vận chuyển hàng hóa nguy hiểm mà không được tập huấn về vận chuyển hàng hóa nguy hiểm;\n\nđ) Sử dụng xe ô tô kinh doanh vận tải hành khách không có dây đai an toàn tại các vị trí ghế ngồi, giường nằm theo quy định (trừ xe buýt nội tỉnh);\n\ne) Sử dụng xe ô tô kinh doanh vận tải chở trẻ em mầm non, học sinh tiểu học, xe ô tô kinh doanh vận tải kết hợp với hoạt động đưa đón trẻ em mầm non, học sinh tiểu học không có dây đai an toàn phù hợp với lứa tuổi hoặc không có ghế ngồi phù hợp với lứa tuổi theo quy định;\n\ng) Không thực hiện việc niêm yết thông tin trên xe theo quy định hoặc có niêm yết nhưng không chính xác, không đầy đủ thông tin theo quy định.\n\n5. Phạt tiền từ 4.000.000 đồng đến 5.000.000 đồng đối với cá nhân, từ 8.000.000 đồng đến 10.000.000 đồng đối với tổ chức xếp hàng hóa lên mỗi xe ô tô (kể cả rơ moóc và sơ mi rơ moóc) vượt quá trọng tải (khối lượng hàng chuyên chở) cho phép tham gia giao thông được ghi trong giấy chứng nhận kiểm định an toàn kỹ thuật và bảo vệ môi trường của xe trên 100%.\n\n6. Phạt tiền từ 4.000.000 đồng đến 6.000.000 đồng đối với cá nhân, từ 8.000.000 đồng đến 12.000.000 đồng đối với tổ chức kinh doanh vận tải thực hiện một trong các hành vi vi phạm sau đây:\n\na) Sử dụng xe vận chuyển động vật sống không có kết cấu phù hợp với loại động vật chuyên chở theo quy định;\n\nb) Sử dụng xe ô tô kinh doanh vận tải chở trẻ em mầm non, học sinh, xe ô tô kinh doanh vận tải kết hợp với hoạt động đưa đón trẻ em mầm non, học sinh không có thiết bị ghi nhận hình ảnh trẻ em mầm non, học sinh hoặc không có thiết bị có chức năng cảnh báo, chống bỏ quên trẻ em trên xe hoặc không có thiết bị ghi nhận hình ảnh trẻ em mầm non, học sinh và thiết bị có chức năng cảnh báo, chống bỏ quên trẻ em trên xe;\n\nc) Sử dụng xe ô tô kinh doanh vận tải chở trẻ em mầm non, học sinh không có màu sơn theo quy định;\n\nd) Sử dụng xe ô tô kinh doanh vận tải chở trẻ em mầm non, học sinh, xe ô tô kinh doanh vận tải kết hợp với hoạt động đưa đón trẻ em mầm non, học sinh không có biển báo dấu hiệu nhận biết là xe chở trẻ em mầm non, học sinh theo quy định.\n\n7. Phạt tiền từ 5.000.000 đồng đến 6.000.000 đồng đối với cá nhân, từ 10.000.000 đồng đến 12.000.000 đồng đối với tổ chức kinh doanh vận tải, dịch vụ hỗ trợ vận tải thực hiện một trong các hành vi vi phạm sau đây:\n\na) Không thực hiện việc cung cấp, cập nhật, truyền, lưu trữ, quản lý thông tin, dữ liệu từ thiết bị giám sát hành trình theo quy định;\n\nb) Không thực hiện đúng nội dung thông tin đã niêm yết trên xe theo quy định;']","**Nguồn văn bản:** /content/drive/MyDrive/ITProject_data/new_law/168_2024_ND-CP_619502.docx

**Tên văn bản:**  (Tên văn bản không được cung cấp trong context)

**Điều:** (Điều không được cung cấp trong context)


**Nội dung:**

Tôi xin lỗi, nhưng văn bản được cung cấp không chứa thông tin cụ thể về quy định vận chuyển hàng hóa dễ cháy nổ. Văn bản tập trung vào các hình phạt liên quan đến việc vận chuyển hàng hóa nguy hiểm nói chung, vận chuyển động vật sống, thực phẩm tươi sống, phế thải, và các vi phạm khác về trọng tải, giấy tờ vận chuyển, an toàn giao thông.  Tuy nhiên, không có thông tin chi tiết về quy định riêng cho hàng hóa dễ cháy nổ.  Để có được thông tin chính xác về quy định này, bạn cần tham khảo các văn bản pháp luật khác có liên quan đến vận chuyển hàng hóa nguy hiểm, cụ thể là hàng hóa dễ cháy nổ.


Tóm lại:  Văn bản cung cấp không có thông tin về quy định vận chuyển hàng hóa dễ cháy nổ.  Cần tìm kiếm thêm thông tin từ các nguồn khác.
","Xe ô tô chở hàng dễ cháy nổ phải có giấy phép đặc biệt, được kiểm định an toàn và tuân thủ các quy định về phòng cháy chữa cháy.",1.0,0.0,1.0,0.0
52,Luật Giao thông Đường bộ 2025 có quy định gì về việc sử dụng xe ô tô chở hàng dễ hỏng?,"['5. Phạt tiền từ 12.000.000 đồng đến 14.000.000 đồng đối với hành vi vận chuyển hàng hóa nguy hiểm không có giấy phép vận chuyển hàng hóa nguy hiểm hoặc có nhưng hết hiệu lực hoặc không thực hiện đúng quy định trong giấy phép vận chuyển hàng hóa nguy hiểm, trừ các hành vi vi phạm quy định tại điểm a khoản 6 Điều 20 của Nghị định này.\n\n6. Ngoài việc bị áp dụng hình thức xử phạt, người thực hiện hành vi vi phạm quy định tại khoản 4, khoản 5 Điều này nếu gây ô nhiễm môi trường còn bị áp dụng các biện pháp khắc phục hậu quả buộc thực hiện các biện pháp khắc phục tình trạng ô nhiễm môi trường do vi phạm hành chính gây ra.\n\n7. Ngoài việc bị áp dụng hình thức xử phạt, người điều khiển phương tiện thực hiện hành vi vi phạm còn bị trừ điểm giấy phép lái xe như sau:\n\na) Thực hiện hành vi quy định tại khoản 3, khoản 4 Điều này bị trừ điểm giấy phép lái xe 02 điểm;\n\nb) Thực hiện hành vi quy định tại khoản 5 Điều này bị trừ điểm giấy phép lái xe 04 điểm.\n\nĐiều 24. Xử phạt, trừ điểm giấy phép lái xe của người điều khiển xe ô tô thực hiện hành vi vi phạm quy định về vận chuyển động vật sống, thực phẩm tươi sống\n\n1. Phạt tiền từ 1.000.000 đồng đến 2.000.000 đồng đối với hành vi vi phạm vận chuyển động vật sống, thực phẩm tươi sống không mang đủ giấy tờ theo quy định (đối với loại động vật sống, thực phẩm tươi sống khi vận chuyển phải có giấy tờ).\n\n2. Phạt tiền từ 3.000.000 đồng đến 5.000.000 đồng đối với hành vi vi phạm vận chuyển thực phẩm tươi sống không chấp hành quy định về an toàn thực phẩm, vệ sinh dịch tễ, phòng dịch và bảo đảm vệ sinh môi trường theo quy định.\n\n3. Ngoài việc bị áp dụng hình thức xử phạt, người điều khiển phương tiện thực hiện hành vi vi phạm quy định tại khoản 2 Điều này còn bị trừ điểm giấy phép lái xe 02 điểm.\n\nĐiều 25. Xử phạt, trừ điểm giấy phép lái xe của người điều khiển xe vệ sinh môi trường, xe ô tô chở phế thải thực hiện hành vi vi phạm quy định về hoạt động vận tải trong đô thị\n\n1. Phạt tiền từ 2.000.000 đồng đến 3.000.000 đồng đối với hành vi điều khiển xe không chạy đúng tuyến, phạm vi, thời gian quy định.\n\n2. Ngoài việc bị áp dụng hình thức xử phạt, người điều khiển phương tiện thực hiện hành vi vi phạm quy định tại khoản 1 Điều này còn bị trừ điểm giấy phép lái xe 02 điểm.\n\nĐiều 26. Xử phạt các hành vi vi phạm quy định về trật tự, an toàn giao thông đường bộ trong vận tải đường bộ, dịch vụ hỗ trợ vận tải đường bộ\n\n1. Phạt tiền từ 500.000 đồng đến 1.000.000 đồng đối với cá nhân, từ 1.000.000 đồng đến 2.000.000 đồng đối với tổ chức thực hiện một trong các hành vi vi phạm sau đây:\n\na) Xếp hàng hóa lên mỗi xe ô tô (kể cả rơ moóc và sơ mi rơ moóc) vượt quá trọng tải (khối lượng hàng chuyên chở) cho phép tham gia giao thông được ghi trong giấy chứng nhận kiểm định an toàn kỹ thuật và bảo vệ môi trường của xe trên 10% đến 50% (trừ xe xi téc chở chất lỏng), trên 20% đến 50% đối với xe xi téc chở chất lỏng;\n\nb) Xếp hàng hóa lên xe ô tô mà không ký xác nhận việc xếp hàng hóa vào giấy vận tải theo quy định.\n\n2. Phạt tiền từ 1.000.000 đồng đến 2.000.000 đồng đối với cá nhân, từ 2.000.000 đồng đến 4.000.000 đồng đối với tổ chức kinh doanh vận tải, dịch vụ hỗ trợ vận tải thực hiện một trong các hành vi vi phạm sau đây:\n\na) Không đánh số thứ tự ghế ngồi, giường nằm trên xe ô tô chở hành khách theo quy định;\n\nb) Sử dụng xe ô tô kinh doanh vận tải hành khách theo tuyến cố định, xe ô tô kinh doanh vận tải hành khách bằng xe buýt không có chỗ ưu tiên cho người khuyết tật, người cao tuổi và phụ nữ mang thai theo quy định;\n\nc) Sử dụng xe ô tô kinh doanh vận tải hành khách không có hướng dẫn cho hành khách về an toàn giao thông, thoát hiểm khi xảy ra sự cố trên xe theo quy định;\n\nd) Không bố trí người áp tải trên xe vận chuyển hàng hóa nguy hiểm đối với những trường hợp quy định phải có người áp tải;\n\nđ) Không cấp lệnh vận chuyển, giấy vận tải cho lái xe hoặc cấp lệnh vận chuyển, giấy vận tải nhưng không đúng theo quy định (đối với loại xe quy định phải cấp lệnh vận chuyển, giấy vận tải);\n\ne) Sử dụng xe vận chuyển hàng hóa nguy hiểm mà không làm sạch hoặc không bóc (xóa) biểu trưng nguy hiểm trên phương tiện khi không tiếp tục vận chuyển loại hàng hóa đó.\n\n3. Phạt tiền từ 2.000.000 đồng đến 3.000.000 đồng đối với cá nhân, từ 4.000.000 đồng đến 6.000.000 đồng đối với tổ chức thực hiện hành vi vi phạm xếp hàng hóa lên mỗi xe ô tô (kể cả rơ moóc và sơ mi rơ moóc) vượt quá trọng tải (khối lượng hàng chuyên chở) cho phép tham gia giao thông được ghi trong giấy chứng nhận kiểm định an toàn kỹ thuật và bảo vệ môi trường của xe trên 50% đến 100%.\n\n4. Phạt tiền từ 3.000.000 đồng đến 4.000.000 đồng đối với cá nhân, từ 6.000.000 đồng đến 8.000.000 đồng đối với tổ chức kinh doanh vận tải, dịch vụ hỗ trợ vận tải thực hiện một trong các hành vi vi phạm sau đây:\n\na) Không cấp thẻ nhận dạng lái xe cho lái xe theo quy định;\n\nb) Sử dụng lái xe, nhân viên phục vụ trên xe để tham gia kinh doanh vận tải bằng xe ô tô mà không được tập huấn, hướng dẫn về nghiệp vụ vận tải hành khách và an toàn giao thông theo quy định (đối với hình thức kinh doanh vận tải có quy định lái xe, nhân viên phục vụ trên xe phải được tập huấn, hướng dẫn nghiệp vụ), trừ các hành vi vi phạm quy định tại điểm c, điểm d khoản này;\n\nc) Sử dụng lái xe, người quản lý trên xe để tham gia kinh doanh vận tải bằng xe ô tô mà không được hướng dẫn về quy trình bảo đảm an toàn khi đưa đón trẻ em mầm non, học sinh;\n\nd) Sử dụng lái xe, người áp tải vận chuyển hàng hóa nguy hiểm mà không được tập huấn về vận chuyển hàng hóa nguy hiểm;\n\nđ) Sử dụng xe ô tô kinh doanh vận tải hành khách không có dây đai an toàn tại các vị trí ghế ngồi, giường nằm theo quy định (trừ xe buýt nội tỉnh);\n\ne) Sử dụng xe ô tô kinh doanh vận tải chở trẻ em mầm non, học sinh tiểu học, xe ô tô kinh doanh vận tải kết hợp với hoạt động đưa đón trẻ em mầm non, học sinh tiểu học không có dây đai an toàn phù hợp với lứa tuổi hoặc không có ghế ngồi phù hợp với lứa tuổi theo quy định;\n\ng) Không thực hiện việc niêm yết thông tin trên xe theo quy định hoặc có niêm yết nhưng không chính xác, không đầy đủ thông tin theo quy định.\n\n5. Phạt tiền từ 4.000.000 đồng đến 5.000.000 đồng đối với cá nhân, từ 8.000.000 đồng đến 10.000.000 đồng đối với tổ chức xếp hàng hóa lên mỗi xe ô tô (kể cả rơ moóc và sơ mi rơ moóc) vượt quá trọng tải (khối lượng hàng chuyên chở) cho phép tham gia giao thông được ghi trong giấy chứng nhận kiểm định an toàn kỹ thuật và bảo vệ môi trường của xe trên 100%.\n\n6. Phạt tiền từ 4.000.000 đồng đến 6.000.000 đồng đối với cá nhân, từ 8.000.000 đồng đến 12.000.000 đồng đối với tổ chức kinh doanh vận tải thực hiện một trong các hành vi vi phạm sau đây:\n\na) Sử dụng xe vận chuyển động vật sống không có kết cấu phù hợp với loại động vật chuyên chở theo quy định;\n\nb) Sử dụng xe ô tô kinh doanh vận tải chở trẻ em mầm non, học sinh, xe ô tô kinh doanh vận tải kết hợp với hoạt động đưa đón trẻ em mầm non, học sinh không có thiết bị ghi nhận hình ảnh trẻ em mầm non, học sinh hoặc không có thiết bị có chức năng cảnh báo, chống bỏ quên trẻ em trên xe hoặc không có thiết bị ghi nhận hình ảnh trẻ em mầm non, học sinh và thiết bị có chức năng cảnh báo, chống bỏ quên trẻ em trên xe;\n\nc) Sử dụng xe ô tô kinh doanh vận tải chở trẻ em mầm non, học sinh không có màu sơn theo quy định;\n\nd) Sử dụng xe ô tô kinh doanh vận tải chở trẻ em mầm non, học sinh, xe ô tô kinh doanh vận tải kết hợp với hoạt động đưa đón trẻ em mầm non, học sinh không có biển báo dấu hiệu nhận biết là xe chở trẻ em mầm non, học sinh theo quy định.\n\n7. Phạt tiền từ 5.000.000 đồng đến 6.000.000 đồng đối với cá nhân, từ 10.000.000 đồng đến 12.000.000 đồng đối với tổ chức kinh doanh vận tải, dịch vụ hỗ trợ vận tải thực hiện một trong các hành vi vi phạm sau đây:\n\na) Không thực hiện việc cung cấp, cập nhật, truyền, lưu trữ, quản lý thông tin, dữ liệu từ thiết bị giám sát hành trình theo quy định;\n\nb) Không thực hiện đúng nội dung thông tin đã niêm yết trên xe theo quy định;']","**Nguồn văn bản:** /content/drive/MyDrive/ITProject_data/new_law/168_2024_ND-CP_619502.docx

**Tên văn bản:**  (Tên văn bản không được cung cấp trong context)

**Điều:** (Điều không được cung cấp trong context)


**Nội dung:**

Tôi xin lỗi, nhưng văn bản được cung cấp không chứa thông tin cụ thể về quy định vận chuyển hàng hóa dễ hỏng. Văn bản tập trung vào các quy định về vận chuyển hàng hóa nguy hiểm, thực phẩm tươi sống, động vật sống và các quy định khác liên quan đến xử phạt vi phạm giao thông đường bộ.  Các khoản phạt tiền và trừ điểm giấy phép lái xe được nêu rõ trong từng trường hợp vi phạm cụ thể.  Tuy nhiên, không có thông tin nào đề cập đến quy định riêng biệt cho việc vận chuyển hàng hóa dễ hỏng.


Tóm lại:  Văn bản không cung cấp thông tin về quy định vận chuyển hàng hóa dễ hỏng.
",Xe ô tô chở hàng dễ hỏng phải được trang bị thiết bị bảo quản phù hợp và tuân thủ các quy định về vệ sinh.,0.25,0.0,0.0,0.0
