,user_input,retrieved_contexts,response,reference,faithfulness,answer_relevancy,context_recall,context_precision
0,Luật Giao thông Đường bộ 2025 có những thay đổi gì về phân hạng giấy phép lái xe?,"['1. giấy phép lái xe được cấp trước ngày luật này có hiệu lực thi hành được tiếp tục sử dụng theo thời hạn ghi trên giấy phép lái xe. 2. giấy phép lái xe được cấp trước ngày luật này có hiệu lực thi hành nếu chưa thực hiện đổi, cấp lại theo quy định của luật này có hiệu lực sử dụng như sau: a) giấy phép lái xe hạng a1 được tiếp tục điều khiển xe mô tô hai bánh có dung tích xi-lanh từ 50 cm3\xa0đến dưới 175 cm3 hoặc có công suất động cơ điện từ 04 kw đến dưới 14 kw; b) giấy phép lái xe hạng a2 được tiếp tục điều khiển xe mô tô hai bánh có dung tích xi-lanh từ 175 cm3\xa0trở lên hoặc có công suất động cơ điện từ 14 kw trở lên và các loại xe quy định cho giấy phép lái xe hạng a1 quy định tại điểm a khoản này; c) giấy phép lái xe hạng a3 được tiếp tục điều khiển xe mô tô ba bánh, các loại xe quy định cho giấy phép lái xe hạng a1 quy định tại điểm a khoản này và các xe tương tự; d) giấy phép lái xe hạng a4 được tiếp tục điều khiển máy kéo có trọng tải đến 1.000 kg; đ) giấy phép lái xe hạng b1 số tự động cấp cho người không hành nghề lái xe được tiếp tục điều khiển xe ô tô số tự động chở người đến 08 chỗ (không kể chỗ của người lái xe); xe ô tô tải, kể cả ô tô tải chuyên dùng số tự động có trọng tải dưới 3.500 kg; e) giấy phép lái xe hạng b1 cấp cho người không hành nghề lái xe được tiếp tục điều khiển xe ô tô chở người đến 08 chỗ (không kể chỗ của người lái xe); xe ô tô tải, máy kéo có trọng tải dưới 3.500 kg; g) giấy phép lái xe hạng b2 cấp cho người hành nghề lái xe được tiếp tục điều khiển xe ô tô chở người đến 08 chỗ (không kể chỗ của người lái xe); xe ô tô tải, máy kéo có trọng tải dưới 3.500 kg; h) giấy phép lái xe hạng c được tiếp tục điều khiển xe ô tô tải, máy kéo có trọng tải từ 3.500 kg trở lên và các loại xe quy định cho các giấy phép lái xe hạng b1, b2 quy định tại các điểm đ, e và g khoản này; i) giấy phép lái xe hạng d được tiếp tục điều khiển xe ô tô chở người từ 09 chỗ (không kể chỗ của người lái xe) đến 29 chỗ (không kể chỗ của người lái xe) và các loại xe quy định cho các giấy phép lái xe hạng b1, b2, c quy định tại các điểm đ, e, g và h khoản này; k) giấy phép lái xe hạng e được tiếp tục điều khiển xe ô tô chở người trên 29 chỗ (không kể chỗ của người lái xe) và các loại xe quy định cho các giấy phép lái xe hạng b1, b2, c, d quy định tại các điểm đ, e, g, h và i khoản này; l) giấy phép lái xe hạng fb2, fd được tiếp tục điều khiển các loại xe quy định cho giấy phép lái xe hạng b2, d quy định tại điểm g và điểm i khoản này khi kéo rơ moóc; giấy phép lái xe hạng fc được tiếp tục điều khiển các loại xe quy định cho giấy phép lái xe hạng c quy định tại điểm h khoản này khi kéo rơ moóc, đầu kéo kéo sơ mi rơ moóc; giấy phép lái xe hạng fe được tiếp tục điều khiển các loại xe quy định cho giấy phép lái xe hạng e quy định tại điểm k khoản này khi kéo rơ moóc\xa0hoặc xe ô tô chở khách nối toa. 3. trường hợp người có giấy phép lái xe đã được cấp trước ngày luật này có hiệu lực thi hành có nhu cầu đổi, cấp lại giấy phép lái xe thì thực hiện như sau: a) giấy phép lái xe hạng a1 được đổi, cấp lại sang giấy phép lái xe hạng a với điều kiện hạn chế là chỉ được điều khiển xe mô tô hai bánh có dung tích xi-lanh đến dưới 175 cm3 hoặc có công suất động cơ điện đến dưới 14 kw; b) giấy phép lái xe hạng a2 được đổi, cấp lại sang giấy phép lái xe hạng a; c) giấy phép lái xe hạng a3 được đổi, cấp lại sang giấy phép lái xe hạng b1; d) giấy phép lái xe hạng a4 được đổi, cấp lại sang chứng chỉ điều khiển xe máy chuyên dùng cho người điều khiển máy kéo có trọng tải đến 1.000 kg và chứng chỉ bồi dưỡng kiến thức pháp luật về giao thông đường bộ cho người điều khiển xe máy chuyên dùng; đ) giấy phép lái xe hạng b1 số tự động được đổi, cấp lại sang giấy phép lái xe hạng b với điều kiện hạn chế là chỉ được điều khiển xe ô tô số tự động; e) giấy phép lái xe hạng b1, b2 được đổi, cấp lại sang giấy phép lái xe hạng b hoặc hạng c1 và chứng chỉ điều khiển xe máy chuyên dùng cho người điều khiển máy kéo có trọng tải đến 3.500 kg; g) giấy phép lái xe hạng c giữ nguyên và đổi, cấp lại cùng hạng và chứng chỉ điều khiển xe máy chuyên dùng cho người điều khiển máy kéo có trọng tải trên 3.500 kg; h) giấy phép lái xe hạng d được đổi, cấp lại sang giấy phép lái xe hạng d2 và chứng chỉ điều khiển xe máy chuyên dùng cho người điều khiển máy kéo có trọng tải trên 3.500 kg; i) giấy phép lái xe hạng e được đổi, cấp lại sang giấy phép lái xe hạng d và chứng chỉ điều khiển xe máy chuyên dùng cho người điều khiển máy kéo có trọng tải trên 3.500 kg; k) giấy phép lái xe hạng fb2 được đổi, cấp lại sang giấy phép lái xe hạng be hoặc hạng c1e và chứng chỉ điều khiển xe máy chuyên dùng cho người điều khiển máy kéo có trọng tải đến 3.500 kg; l) giấy phép lái xe hạng fc được đổi, cấp lại sang giấy phép lái xe hạng ce và chứng chỉ điều khiển xe máy chuyên dùng cho người điều khiển máy kéo có trọng tải trên 3.500 kg; m) giấy phép lái xe hạng fd được đổi, cấp lại sang giấy phép lái xe hạng d2e và chứng chỉ điều khiển xe máy chuyên dùng cho người điều khiển máy kéo có trọng tải trên 3.500 kg; n) giấy phép lái xe hạng fe được đổi, cấp lại sang giấy phép lái xe hạng de và chứng chỉ điều khiển xe máy chuyên dùng cho người điều khiển máy kéo có trọng tải trên 3.500 kg. 4. người học lái xe đã được đào tạo lái xe trước ngày luật này có hiệu lực thi hành hoặc đang được đào tạo lái xe tại ngày luật này có hiệu lực thi hành chưa được sát hạch, cấp giấy phép lái xe thì được sát hạch, cấp giấy phép lái xe theo hạng giấy phép lái xe đổi, cấp lại quy định tại khoản 3 điều này. 5. chứng nhận đăng ký xe, biển số xe máy chuyên dùng cấp trước ngày luật này có hiệu lực thi hành vẫn có giá trị sử dụng. 6. chứng nhận chất lượng an toàn kỹ thuật và bảo vệ môi trường được cấp trước ngày luật này có hiệu lực thi hành thì có giá trị sử dụng đến hết thời hạn ghi trên giấy chứng nhận đó. 7. việc đấu giá biển số xe ô tô được thực hiện trước ngày luật này có hiệu lực thi hành và đến ngày luật này có hiệu lực thi hành đã được cấp văn bản xác nhận biển số xe ô tô trúng đấu giá thì tiếp tục thực hiện theo nghị quyết số 73/2022/qh15 của quốc hội về thí điểm đấu giá biển số xe ô tô; trường hợp chưa được cấp xác nhận biển số xe ô tô trúng đấu giá thì tiếp tục thực hiện theo nghị quyết số 73/2022/qh15 của quốc hội về thí điểm đấu giá biển số xe ô tô và quy định tại điểm d khoản 1 điều 38 của luật này./. luật này được quốc hội nước cộng hòa xã hội chủ nghĩa việt nam khóa xv, kỳ họp thứ 7 thông qua ngày 27 tháng 6 năm 2024.', '1. giấy phép lái xe bao gồm các hạng sau đây: a) hạng a1 cấp cho người lái xe mô tô hai bánh có dung tích xi-lanh đến 125 cm3 hoặc có công suất động cơ điện đến 11 kw; b) hạng a cấp cho người lái xe mô tô hai bánh có dung tích xi-lanh\xa0 trên 125 cm3\xa0hoặc có công suất động cơ điện trên 11 kw và các loại xe quy định cho giấy phép lái xe hạng a1; c) hạng b1 cấp cho người lái xe mô tô ba bánh và các loại xe quy định cho giấy phép lái xe hạng a1; d) hạng b cấp cho người lái xe ô tô chở người đến 08 chỗ (không kể chỗ của người lái xe); xe ô tô tải và ô tô chuyên dùng có khối lượng toàn bộ theo thiết kế đến 3.500 kg; các loại xe ô tô quy định cho giấy phép lái xe hạng b kéo rơ moóc có khối lượng toàn bộ theo thiết kế đến 750 kg; đ) hạng c1 cấp cho người lái xe ô tô tải và ô tô chuyên dùng có khối lượng toàn bộ theo thiết kế trên 3.500 kg đến 7.500 kg; các loại xe ô tô tải quy định cho giấy phép lái xe hạng c1 kéo rơ moóc có khối lượng toàn bộ theo thiết kế đến 750 kg; các loại xe quy định cho giấy phép lái xe hạng b; e) hạng c cấp cho người lái xe ô tô tải và ô tô chuyên dùng có khối lượng toàn bộ theo thiết kế trên 7.500 kg; các loại xe ô tô tải quy định cho giấy phép lái xe hạng c kéo rơ moóc có khối lượng toàn bộ theo thiết kế đến 750 kg; các loại xe quy định cho giấy phép lái xe hạng b và hạng c1; g) hạng d1 cấp cho người lái xe ô tô chở người trên 08 chỗ (không kể chỗ của người lái xe) đến 16 chỗ (không kể chỗ của người lái xe); các loại xe ô tô chở người quy định cho giấy phép lái xe hạng d1 kéo rơ moóc có khối lượng toàn bộ theo thiết kế đến 750 kg; các loại xe quy định cho giấy phép lái xe các hạng b, c1, c; h) hạng d2 cấp cho người lái xe ô tô chở người (kể cả xe buýt) trên 16 chỗ (không kể chỗ của người lái xe) đến 29 chỗ (không kể chỗ của người lái xe); các loại xe ô tô chở người quy định cho giấy phép lái xe hạng d2 kéo rơ moóc có khối lượng toàn bộ theo thiết kế đến 750 kg; các loại xe quy định cho giấy phép lái xe các hạng b, c1, c, d1; i) hạng d cấp cho người lái xe ô tô chở người (kể cả xe buýt) trên 29 chỗ (không kể chỗ của người lái xe); xe ô tô chở người giường nằm; các loại xe ô tô chở người quy định cho giấy phép lái xe hạng d kéo rơ moóc có khối lượng toàn bộ theo thiết kế đến 750 kg; các loại xe quy định cho giấy phép lái xe các hạng b, c1, c, d1, d2; k) hạng be cấp cho người lái các loại xe ô tô quy định cho giấy phép lái xe hạng b kéo rơ moóc có khối lượng toàn bộ theo thiết kế trên 750 kg; l) hạng c1e cấp cho người lái các loại xe ô tô quy định cho giấy phép lái xe hạng c1 kéo rơ moóc có khối lượng toàn bộ theo thiết kế trên 750 kg; m) hạng ce cấp cho người lái các loại xe ô tô quy định cho giấy phép lái xe hạng c kéo rơ moóc có khối lượng toàn bộ theo thiết kế trên 750 kg; xe ô tô đầu kéo kéo sơ mi rơ moóc; n) hạng d1e cấp cho người lái các loại xe ô tô quy định cho giấy phép lái xe hạng d1 kéo rơ moóc có khối lượng toàn bộ theo thiết kế trên 750 kg; o) hạng d2e cấp cho người lái các loại xe ô tô quy định cho giấy phép lái xe hạng d2 kéo rơ moóc có khối lượng toàn bộ theo thiết kế trên 750 kg; p) hạng de cấp cho người lái các loại xe ô tô quy định cho giấy phép lái xe hạng d kéo rơ moóc có khối lượng toàn bộ theo thiết kế trên 750 kg; xe ô tô chở khách nối toa. 2. người khuyết tật điều khiển xe mô tô ba bánh dùng cho người khuyết tật được cấp giấy phép lái xe hạng a1. người khuyết tật điều khiển xe ô tô số tự động có kết cấu phù hợp với tình trạng khuyết tật thì được cấp giấy phép lái xe hạng b. 3. người điều khiển xe chở hàng bốn bánh có gắn động cơ, xe chở người bốn bánh có gắn động cơ phải sử dụng giấy phép lái xe có hạng phù hợp với xe ô tô tải hoặc xe ô tô chở người tương ứng. 4. người điều khiển xe ô tô có thiết kế, cải tạo với số chỗ ít hơn xe cùng loại, kích thước giới hạn tương đương phải sử dụng giấy phép lái xe có hạng phù hợp với xe ô tô cùng loại, kích thước giới hạn tương đương và có số chỗ nhiều nhất. 5. thời hạn của giấy phép lái xe được quy định như sau: a) giấy phép lái xe các hạng a1, a, b1 không thời hạn; b) giấy phép lái xe hạng b và hạng c1 có thời hạn 10 năm kể từ ngày cấp; c) giấy phép lái xe các hạng c, d1, d2, d, be, c1e, ce, d1e, d2e và de có thời hạn 05 năm kể từ ngày cấp. 6. giấy phép lái xe có giá trị sử dụng trong phạm vi lãnh thổ việt nam bao gồm: a) giấy phép lái xe do cơ quan có thẩm quyền của việt nam cấp; b) giấy phép lái xe quốc tế và giấy phép lái xe quốc gia phù hợp với loại xe được phép điều khiển do quốc gia là thành viên của công ước của liên hợp quốc về giao thông đường bộ năm 1968 (sau đây gọi là công ước viên) cấp; c) giấy phép lái xe phù hợp với loại xe được phép điều khiển của nước hoặc vùng lãnh thổ mà việt nam ký kết điều ước quốc tế hoặc thỏa thuận quốc tế công nhận giấy phép lái xe của nhau; d) giấy phép lái xe nước ngoài phù hợp với loại xe được phép điều khiển do quốc gia được công nhận theo điều ước quốc tế mà nước cộng hòa xã hội chủ nghĩa việt nam là thành viên. 7. giấy phép lái xe không có hiệu lực trong các trường hợp sau đây: a) giấy phép lái xe hết thời hạn sử dụng; b) giấy phép lái xe bị thu hồi theo quy định tại khoản 5 điều 62 của luật này. 8. giấy phép lái xe quốc tế được quy định như sau: a) giấy phép lái xe quốc tế là giấy phép lái xe do cơ quan nhà nước có thẩm quyền của quốc gia là thành viên của công ước viên cấp theo một mẫu thống nhất; có thời hạn không quá 03 năm kể từ ngày cấp và phải phù hợp với thời hạn còn hiệu lực của giấy phép lái xe quốc gia; b) người có giấy phép lái xe quốc tế do quốc gia là thành viên của công ước viên cấp khi lái xe tham gia giao thông đường bộ trên lãnh thổ việt nam phải mang theo giấy phép lái xe quốc tế và giấy phép lái xe quốc gia được cấp phù hợp với hạng xe điều khiển, còn thời hạn sử dụng; phải tuân thủ pháp luật về trật tự, an toàn giao thông đường bộ của việt nam; c) người có giấy phép lái xe quốc tế vi phạm pháp luật về trật tự, an toàn giao thông đường bộ của việt nam mà bị tước quyền sử dụng giấy phép lái xe có thời hạn thì thời gian bị tước quyền sử dụng không quá thời gian người lái xe được phép cư trú tại lãnh thổ việt nam; d) người việt nam hoặc người nước ngoài có thẻ thường trú hoặc thẻ tạm trú tại việt nam có giấy phép lái xe do việt nam hoặc quốc gia là thành viên của điều ước quốc tế mà nước cộng hòa xã hội chủ nghĩa việt nam là thành viên cấp, còn giá trị sử dụng, nếu có nhu cầu được cấp giấy phép lái xe quốc tế. 9. bộ trưởng bộ giao thông vận tải quy định mẫu giấy phép lái xe và giấy phép lái xe quốc tế, trình tự, thủ tục cấp và việc sử dụng giấy phép lái xe, giấy phép lái xe quốc tế; đối với mẫu giấy phép lái xe, trình tự, thủ tục cấp và việc sử dụng giấy phép lái xe của lực lượng quân đội, công an làm nhiệm vụ quốc phòng, an ninh do bộ trưởng bộ quốc phòng, bộ trưởng bộ công an quy định.', '1. người có nhu cầu được cấp giấy phép lái xe phải được đào tạo nội dung lý thuyết và thực hành theo chương trình đào tạo quy định cho từng hạng giấy phép lái xe. 2. người học lái xe phải được đào tạo tại các cơ sở đào tạo lái xe hoặc các hình thức đào tạo lái xe khác để cấp mới hoặc nâng hạng giấy phép lái xe. 3. việc đào tạo để nâng hạng giấy phép lái xe thực hiện đối với những đối tượng sau đây: a) nâng hạng giấy phép lái xe từ hạng b lên hạng c1 hoặc lên hạng c hoặc lên hạng d1 hoặc lên hạng d2; b) nâng hạng giấy phép lái xe từ hạng c1 lên hạng c hoặc lên hạng d1 hoặc lên hạng d2; c) nâng hạng giấy phép lái xe từ hạng c lên hạng d1 hoặc lên hạng d2 hoặc lên hạng d; d) nâng hạng giấy phép lái xe từ hạng d1 lên hạng d2 hoặc lên hạng d; đ) nâng hạng giấy phép lái xe từ hạng d2 lên hạng d; e) nâng hạng giấy phép lái xe từ hạng b lên hạng be, từ hạng c1 lên\xa0 hạng c1e, từ hạng c lên hạng ce, từ hạng d1 lên hạng d1e, từ hạng d2 lên hạng d2e, từ hạng d lên hạng de. 4.\xa0người có nhu cầu được đào tạo nâng hạng giấy phép lái xe khi giấy phép lái xe còn hiệu lực, phải có đủ thời gian lái xe an toàn quy định cho từng hạng giấy phép lái xe;\xa0đối với việc nâng hạng giấy phép lái xe lên hạng d1, d2, d thì người có nhu cầu được đào tạo còn phải có trình độ từ trung học cơ sở trở lên. 5. giấy phép lái xe các hạng c, d1, d2, d, be, c1e, ce, d1e, d2e, de phải được đào tạo bằng hình thức đào tạo nâng hạng theo các điều kiện quy định tại khoản 3 và khoản 4 điều này. 6. cơ sở đào tạo lái xe ô tô phải đáp ứng các điều kiện do chính phủ quy định; có giáo trình, giáo án; thực hiện đào tạo theo đúng hình thức, nội dung và chương trình quy định cho từng hạng giấy phép lái xe. 7. chính phủ quy định chi tiết các hình thức đào tạo lái xe khác quy định tại khoản 2 điều này; quy định trình tự, thủ tục kiểm tra, đánh giá để cấp, cấp lại và thu hồi giấy phép xe tập lái; quy định tiêu chuẩn của giáo viên dạy lái xe; quy định việc cấp, cấp lại và thu hồi giấy chứng nhận giáo viên dạy lái xe; quy định việc cấp, cấp lại và thu hồi giấy phép đào tạo lái xe. 8. bộ trưởng bộ giao thông vận tải quy định hình thức, nội dung, chương trình đào tạo lái xe, thời gian lái xe an toàn cho từng hạng giấy phép lái xe quy định tại khoản 4 điều này và quy định tiêu chuẩn của cơ sở đào tạo lái xe mô tô; đối với cơ sở đào tạo, tổ chức đào tạo lái xe cho lực lượng quân đội, công an làm nhiệm vụ quốc phòng, an ninh do bộ trưởng bộ quốc phòng, bộ trưởng bộ công an quy định.', '1. tiêu chuẩn sức khỏe của người lái xe, người điều khiển xe máy chuyên dùng quy định tại phụ lục i ban hành kèm theo thông tư này. 2. tiêu chuẩn sức khỏe của người lái xe, người điều khiển xe máy chuyên dùng chia theo 3 nhóm, cụ thể như sau: a) nhóm 1: áp dụng với trường hợp khám sức khỏe để cấp giấy phép lái xe hạng a1, b1 và người điều khiển xe máy chuyên dùng; b) nhóm 2: áp dụng với trường hợp khám sức khỏe để cấp giấy phép lái hạng a và b; c) nhóm 3: áp dụng với trường hợp khám sức khỏe để cấp giấy phép lái hạng c1, c, d1, d2, d, be, c1e, ce, d1e, d2e và de. 3. người có giấy phép lái xe đã được cấp trước ngày 01 tháng 01 năm 2025 nếu có nhu cầu đổi, cấp lại giấy phép lái xe từ hạng a1 sang giấy phép lái xe hạng a theo quy định tại điểm a khoản 3 điều 89 luật trật tự, an toàn giao thông đường bộ: áp dụng tiêu chuẩn sức khỏe nhóm 1 để khám sức khỏe. 4. việc khám sức khỏe đối với người khuyết tật đề nghị cấp giấy phép lái xe hạng a1 hoặc cấp giấy phép lái xe hạng b quy định tại khoản 2 điều 57 luật trật tự, an toàn giao thông đường bộ: áp dụng tiêu chuẩn sức khỏe quy định tại phụ lục i ban hành kèm theo thông tư này để khám sức khỏe nhưng không phải khám chuyên khoa cơ xương khớp.', '1. giấy phép lái xe quân sự, được phân hạng theo quy định của luật trật tự, an toàn giao thông đường bộ, đồng thời phù hợp với đặc thù quân sự của phương tiện cơ giới đường bộ thuộc phạm vi quản lý của bộ quốc phòng. giấy phép lái xe quân sự, gồm: a) hạng a1 cấp cho người điều khiển xe mô tô hai bánh có dung tích xi-lanh đến 125 cm3 hoặc có công suất động cơ điện đến 11 kw; b) hạng a cấp cho người điều khiển xe mô tô hai bánh có dung tích xi-lanh trên 125 cm3 hoặc có công suất động cơ điện trên 11kw và các loại xe quy định cho giấy phép lái xe quân sự hạng a1; c) hạng b1 cấp cho người điều khiển xe mô tô ba bánh và các loại xe quy định cho giấy phép lái xe quân sự hạng a1; d) hạng b cấp cho người điều khiển các loại xe ô tô chở người đến 08 chỗ ngồi (không kể chỗ của người lái xe); xe ô tô tải và ô tô chuyên dùng có khối lượng toàn bộ theo thiết kế đến 3.500 kg; các loại xe ô tô quy định cho giấy phép lái xe hạng b có kéo rơ moóc hoặc vũ khí, khí tài quân sự dạng rơ moóc có khối lượng toàn bộ theo thiết kế đến 750 kg; đ) hạng c1 cấp cho người điều khiển các loại xe ô tô vận tải và ô tô chuyên dùng có khối lượng toàn bộ theo thiết kế trên 3.500 kg đến 7.500 kg; các loại xe ô tô quy định cho giấy phép lái xe hạng c1 kéo rơ moóc hoặc vũ khí, khí tài quân sự dạng rơ moóc có khối lượng toàn bộ theo thiết kế đến 750 kg; các loại xe quy định cho giấy phép lái xe quân sự hạng b; e) hạng c cấp cho người điều khiển các loại xe ô tô tải và ô tô chuyên dùng có khối lượng toàn bộ theo thiết kế trên 7.500 kg; các loại xe ô tô tải quy định cho giấy phép lái xe hạng c kéo rơ moóc hoặc vũ khí, khí tài quân sự dạng rơ moóc có khối lượng toàn bộ theo thiết kế đến 750 kg; các loại xe quy định cho giấy phép lái xe quân sự hạng b và hạng c1; g) hạng d1 cấp cho người điều khiển xe ô tô chở người trên 8 chỗ (không kể chỗ của người lái xe) đến 16 chỗ (không kể chỗ của người lái xe); các loại xe ô tô chở người quy định cho giấy phép lái xe hạng d1 kéo rơ moóc hoặc vũ khí, khí tài quân sự dạng rơ moóc có khối lượng toàn bộ theo thiết kế đến 750 kg; các loại xe quy định cho giấy phép lái xe quân sự hạng b, c1, c; h) hạng d2 cấp cho người điều khiển xe ô tô chở người từ trên 16 đến 29 chỗ (không kể chỗ của người lái xe); các loại xe ô tô chở người quy định cho giấy phép lái xe hạng d2 kéo rơ moóc hoặc vũ khí, khí tài quân sự dạng rơ moóc có khối lượng toàn bộ theo thiết kế đến 750 kg; các loại xe quy định cho giấy phép lái xe quân sự hạng b, c1, c, d1; i) hạng d cấp cho người điều khiển xe ô tô chở người từ trên 29 chỗ (không kể chỗ của người lái xe); các loại xe ô tô chở người quy định cho giấy phép lái xe hạng d kéo rơ moóc hoặc vũ khí, khí tài quân sự dạng rơ moóc có khối lượng toàn bộ theo thiết kế đến 750 kg; các loại xe quy định cho giấy phép lái xe quân sự hạng b, c1, c, d1, d2; k) hạng c1e cấp cho người điều khiển các loại xe ô tô quy định cho giấy phép lái xe hạng c1 kéo rơ moóc hoặc vũ khí, khí tài quân sự dạng rơ moóc có khối lượng toàn bộ theo thiết kế trên 750 kg; l) hạng ce cấp cho người điều khiển các loại xe ô tô quy định cho giấy phép lái xe hạng c kéo rơ moóc hoặc vũ khí, khí tài quân sự dạng rơ moóc có khối lượng toàn bộ theo thiết kế trên 750 kg; xe ô tô đầu kéo kéo sơ mi rơ moóc hoặc khí tài quân sự dạng sơ mi rơ moóc; m) hạng cx cấp cho người đã có giấy phép lái xe quân sự hạng c để điều khiển xe xích kéo vũ khí, khí tài quân sự. 2. người điều khiển xe chở hàng bốn bánh có gắn động cơ, xe chở người bốn bánh có gắn động cơ phải sử dụng giấy phép lái xe có hạng phù hợp với xe ô tô tải và ô tô chở người tương ứng. 3. người điều khiển xe ô tô có thiết kế, cải tạo với số chỗ ngồi ít hơn ô tô cùng loại, kích thước giới hạn tương đương phải sử dụng giấy phép lái xe có hạng phù hợp với ô tô cùng loại, kích thước giới hạn tương đương và có số chỗ ngồi nhiều nhất.']","**Nguồn văn bản:** 36_2024_QH15_444251

**Tên văn bản:** Luật Trật tự, an toàn giao thông đường bộ

**Điều 57:** Giấy phép lái xe

**Nội dung:**

1. Giấy phép lái xe bao gồm các hạng sau đây:

	a) Hạng A1 cấp cho người lái xe mô tô hai bánh có dung tích xi-lanh đến 125 cm3 hoặc có công suất động cơ điện đến 11 kW.

	b) Hạng A cấp cho người lái xe mô tô hai bánh có dung tích xi-lanh trên 125 cm3 hoặc có công suất động cơ điện trên 11 kW và các loại xe quy định cho giấy phép lái xe hạng A1.

	c) Hạng B1 cấp cho người lái xe mô tô ba bánh và các loại xe quy định cho giấy phép lái xe hạng A1.

	d) Hạng B cấp cho người lái xe ô tô chở người đến 08 chỗ (không kể chỗ của người lái xe); xe ô tô tải và ô tô chuyên dùng có khối lượng toàn bộ theo thiết kế đến 3.500 kg; các loại xe ô tô quy định cho giấy phép lái xe hạng B kéo rơ moóc có khối lượng toàn bộ theo thiết kế đến 750 kg.

	đ) Hạng C1 cấp cho người lái xe ô tô tải và ô tô chuyên dùng có khối lượng toàn bộ theo thiết kế trên 3.500 kg đến 7.500 kg; các loại xe ô tô tải quy định cho giấy phép lái xe hạng C1 kéo rơ moóc có khối lượng toàn bộ theo thiết kế đến 750 kg; các loại xe quy định cho giấy phép lái xe hạng B.

	e) Hạng C cấp cho người lái xe ô tô tải và ô tô chuyên dùng có khối lượng toàn bộ theo thiết kế trên 7.500 kg; các loại xe ô tô tải quy định cho giấy phép lái xe hạng C kéo rơ moóc có khối lượng toàn bộ theo thiết kế đến 750 kg; các loại xe quy định cho giấy phép lái xe hạng B và hạng C1.

	g) Hạng D1 cấp cho người lái xe ô tô chở người trên 08 chỗ (không kể chỗ của người lái xe) đến 16 chỗ (không kể chỗ của người lái xe); các loại xe ô tô chở người quy định cho giấy phép lái xe hạng D1 kéo rơ moóc có khối lượng toàn bộ theo thiết kế đến 750 kg; các loại xe quy định cho giấy phép lái xe các hạng B, C1, C.

	h) Hạng D2 cấp cho người lái xe ô tô chở người (kể cả xe buýt) trên 16 chỗ (không kể chỗ của người lái xe) đến 29 chỗ (không kể chỗ của người lái xe); các loại xe ô tô chở người quy định cho giấy phép lái xe hạng D2 kéo rơ moóc có khối lượng toàn bộ theo thiết kế đến 750 kg; các loại xe quy định cho giấy phép lái xe các hạng B, C1, C, D1.

	i) Hạng D cấp cho người lái xe ô tô chở người (kể cả xe buýt) trên 29 chỗ (không kể chỗ của người lái xe); xe ô tô chở người giường nằm; các loại xe ô tô chở người quy định cho giấy phép lái xe hạng D kéo rơ moóc có khối lượng toàn bộ theo thiết kế đến 750 kg; các loại xe quy định cho giấy phép lái xe các hạng B, C1, C, D1, D2.

	k) Hạng BE cấp cho người lái các loại xe ô tô quy định cho giấy phép lái xe hạng B kéo rơ moóc có khối lượng toàn bộ theo thiết kế trên 750 kg.

	l) Hạng C1E cấp cho người lái các loại xe ô tô quy định cho giấy phép lái xe hạng C1 kéo rơ moóc có khối lượng toàn bộ theo thiết kế trên 750 kg.

	m) Hạng CE cấp cho người lái các loại xe ô tô quy định cho giấy phép lái xe hạng C kéo rơ moóc có khối lượng toàn bộ theo thiết kế trên 750 kg; xe ô tô đầu kéo kéo sơ mi rơ moóc.

	n) Hạng D1E cấp cho người lái các loại xe ô tô quy định cho giấy phép lái xe hạng D1 kéo rơ moóc có khối lượng toàn bộ theo thiết kế trên 750 kg.

	o) Hạng D2E cấp cho người lái các loại xe ô tô quy định cho giấy phép lái xe hạng D2 kéo rơ moóc có khối lượng toàn bộ theo thiết kế trên 750 kg.

	p) Hạng DE cấp cho người lái các loại xe ô tô quy định cho giấy phép lái xe hạng D kéo rơ moóc có khối lượng toàn bộ theo thiết kế trên 750 kg; xe ô tô chở khách nối toa.


**Tóm lại:** Giấy phép lái xe được phân thành nhiều hạng từ A1, A, B1, B, C1, C, D1, D2, D, BE, C1E, CE, D1E, D2E, DE,  tùy thuộc vào loại xe được phép điều khiển (xe mô tô 2 bánh, 3 bánh, ô tô chở người, ô tô tải, xe kéo rơ-moóc,...), dung tích xi lanh, công suất động cơ, khối lượng toàn bộ theo thiết kế.
","Từ năm 2025, hệ thống phân hạng giấy phép lái xe được mở rộng lên 15 hạng: A1, A, B1, B, C1, C, D1, D2, D, BE, C1E, CE, D1E, D2E, DE.",1.0,0.3701342688225407,0.0,0.49999999995
1,Giấy phép lái xe hạng A1 mới cấp cho loại xe nào?,"['1. giấy phép lái xe được cấp trước ngày luật này có hiệu lực thi hành được tiếp tục sử dụng theo thời hạn ghi trên giấy phép lái xe. 2. giấy phép lái xe được cấp trước ngày luật này có hiệu lực thi hành nếu chưa thực hiện đổi, cấp lại theo quy định của luật này có hiệu lực sử dụng như sau: a) giấy phép lái xe hạng a1 được tiếp tục điều khiển xe mô tô hai bánh có dung tích xi-lanh từ 50 cm3\xa0đến dưới 175 cm3 hoặc có công suất động cơ điện từ 04 kw đến dưới 14 kw; b) giấy phép lái xe hạng a2 được tiếp tục điều khiển xe mô tô hai bánh có dung tích xi-lanh từ 175 cm3\xa0trở lên hoặc có công suất động cơ điện từ 14 kw trở lên và các loại xe quy định cho giấy phép lái xe hạng a1 quy định tại điểm a khoản này; c) giấy phép lái xe hạng a3 được tiếp tục điều khiển xe mô tô ba bánh, các loại xe quy định cho giấy phép lái xe hạng a1 quy định tại điểm a khoản này và các xe tương tự; d) giấy phép lái xe hạng a4 được tiếp tục điều khiển máy kéo có trọng tải đến 1.000 kg; đ) giấy phép lái xe hạng b1 số tự động cấp cho người không hành nghề lái xe được tiếp tục điều khiển xe ô tô số tự động chở người đến 08 chỗ (không kể chỗ của người lái xe); xe ô tô tải, kể cả ô tô tải chuyên dùng số tự động có trọng tải dưới 3.500 kg; e) giấy phép lái xe hạng b1 cấp cho người không hành nghề lái xe được tiếp tục điều khiển xe ô tô chở người đến 08 chỗ (không kể chỗ của người lái xe); xe ô tô tải, máy kéo có trọng tải dưới 3.500 kg; g) giấy phép lái xe hạng b2 cấp cho người hành nghề lái xe được tiếp tục điều khiển xe ô tô chở người đến 08 chỗ (không kể chỗ của người lái xe); xe ô tô tải, máy kéo có trọng tải dưới 3.500 kg; h) giấy phép lái xe hạng c được tiếp tục điều khiển xe ô tô tải, máy kéo có trọng tải từ 3.500 kg trở lên và các loại xe quy định cho các giấy phép lái xe hạng b1, b2 quy định tại các điểm đ, e và g khoản này; i) giấy phép lái xe hạng d được tiếp tục điều khiển xe ô tô chở người từ 09 chỗ (không kể chỗ của người lái xe) đến 29 chỗ (không kể chỗ của người lái xe) và các loại xe quy định cho các giấy phép lái xe hạng b1, b2, c quy định tại các điểm đ, e, g và h khoản này; k) giấy phép lái xe hạng e được tiếp tục điều khiển xe ô tô chở người trên 29 chỗ (không kể chỗ của người lái xe) và các loại xe quy định cho các giấy phép lái xe hạng b1, b2, c, d quy định tại các điểm đ, e, g, h và i khoản này; l) giấy phép lái xe hạng fb2, fd được tiếp tục điều khiển các loại xe quy định cho giấy phép lái xe hạng b2, d quy định tại điểm g và điểm i khoản này khi kéo rơ moóc; giấy phép lái xe hạng fc được tiếp tục điều khiển các loại xe quy định cho giấy phép lái xe hạng c quy định tại điểm h khoản này khi kéo rơ moóc, đầu kéo kéo sơ mi rơ moóc; giấy phép lái xe hạng fe được tiếp tục điều khiển các loại xe quy định cho giấy phép lái xe hạng e quy định tại điểm k khoản này khi kéo rơ moóc\xa0hoặc xe ô tô chở khách nối toa. 3. trường hợp người có giấy phép lái xe đã được cấp trước ngày luật này có hiệu lực thi hành có nhu cầu đổi, cấp lại giấy phép lái xe thì thực hiện như sau: a) giấy phép lái xe hạng a1 được đổi, cấp lại sang giấy phép lái xe hạng a với điều kiện hạn chế là chỉ được điều khiển xe mô tô hai bánh có dung tích xi-lanh đến dưới 175 cm3 hoặc có công suất động cơ điện đến dưới 14 kw; b) giấy phép lái xe hạng a2 được đổi, cấp lại sang giấy phép lái xe hạng a; c) giấy phép lái xe hạng a3 được đổi, cấp lại sang giấy phép lái xe hạng b1; d) giấy phép lái xe hạng a4 được đổi, cấp lại sang chứng chỉ điều khiển xe máy chuyên dùng cho người điều khiển máy kéo có trọng tải đến 1.000 kg và chứng chỉ bồi dưỡng kiến thức pháp luật về giao thông đường bộ cho người điều khiển xe máy chuyên dùng; đ) giấy phép lái xe hạng b1 số tự động được đổi, cấp lại sang giấy phép lái xe hạng b với điều kiện hạn chế là chỉ được điều khiển xe ô tô số tự động; e) giấy phép lái xe hạng b1, b2 được đổi, cấp lại sang giấy phép lái xe hạng b hoặc hạng c1 và chứng chỉ điều khiển xe máy chuyên dùng cho người điều khiển máy kéo có trọng tải đến 3.500 kg; g) giấy phép lái xe hạng c giữ nguyên và đổi, cấp lại cùng hạng và chứng chỉ điều khiển xe máy chuyên dùng cho người điều khiển máy kéo có trọng tải trên 3.500 kg; h) giấy phép lái xe hạng d được đổi, cấp lại sang giấy phép lái xe hạng d2 và chứng chỉ điều khiển xe máy chuyên dùng cho người điều khiển máy kéo có trọng tải trên 3.500 kg; i) giấy phép lái xe hạng e được đổi, cấp lại sang giấy phép lái xe hạng d và chứng chỉ điều khiển xe máy chuyên dùng cho người điều khiển máy kéo có trọng tải trên 3.500 kg; k) giấy phép lái xe hạng fb2 được đổi, cấp lại sang giấy phép lái xe hạng be hoặc hạng c1e và chứng chỉ điều khiển xe máy chuyên dùng cho người điều khiển máy kéo có trọng tải đến 3.500 kg; l) giấy phép lái xe hạng fc được đổi, cấp lại sang giấy phép lái xe hạng ce và chứng chỉ điều khiển xe máy chuyên dùng cho người điều khiển máy kéo có trọng tải trên 3.500 kg; m) giấy phép lái xe hạng fd được đổi, cấp lại sang giấy phép lái xe hạng d2e và chứng chỉ điều khiển xe máy chuyên dùng cho người điều khiển máy kéo có trọng tải trên 3.500 kg; n) giấy phép lái xe hạng fe được đổi, cấp lại sang giấy phép lái xe hạng de và chứng chỉ điều khiển xe máy chuyên dùng cho người điều khiển máy kéo có trọng tải trên 3.500 kg. 4. người học lái xe đã được đào tạo lái xe trước ngày luật này có hiệu lực thi hành hoặc đang được đào tạo lái xe tại ngày luật này có hiệu lực thi hành chưa được sát hạch, cấp giấy phép lái xe thì được sát hạch, cấp giấy phép lái xe theo hạng giấy phép lái xe đổi, cấp lại quy định tại khoản 3 điều này. 5. chứng nhận đăng ký xe, biển số xe máy chuyên dùng cấp trước ngày luật này có hiệu lực thi hành vẫn có giá trị sử dụng. 6. chứng nhận chất lượng an toàn kỹ thuật và bảo vệ môi trường được cấp trước ngày luật này có hiệu lực thi hành thì có giá trị sử dụng đến hết thời hạn ghi trên giấy chứng nhận đó. 7. việc đấu giá biển số xe ô tô được thực hiện trước ngày luật này có hiệu lực thi hành và đến ngày luật này có hiệu lực thi hành đã được cấp văn bản xác nhận biển số xe ô tô trúng đấu giá thì tiếp tục thực hiện theo nghị quyết số 73/2022/qh15 của quốc hội về thí điểm đấu giá biển số xe ô tô; trường hợp chưa được cấp xác nhận biển số xe ô tô trúng đấu giá thì tiếp tục thực hiện theo nghị quyết số 73/2022/qh15 của quốc hội về thí điểm đấu giá biển số xe ô tô và quy định tại điểm d khoản 1 điều 38 của luật này./. luật này được quốc hội nước cộng hòa xã hội chủ nghĩa việt nam khóa xv, kỳ họp thứ 7 thông qua ngày 27 tháng 6 năm 2024.', '1. giấy phép lái xe bao gồm các hạng sau đây: a) hạng a1 cấp cho người lái xe mô tô hai bánh có dung tích xi-lanh đến 125 cm3 hoặc có công suất động cơ điện đến 11 kw; b) hạng a cấp cho người lái xe mô tô hai bánh có dung tích xi-lanh\xa0 trên 125 cm3\xa0hoặc có công suất động cơ điện trên 11 kw và các loại xe quy định cho giấy phép lái xe hạng a1; c) hạng b1 cấp cho người lái xe mô tô ba bánh và các loại xe quy định cho giấy phép lái xe hạng a1; d) hạng b cấp cho người lái xe ô tô chở người đến 08 chỗ (không kể chỗ của người lái xe); xe ô tô tải và ô tô chuyên dùng có khối lượng toàn bộ theo thiết kế đến 3.500 kg; các loại xe ô tô quy định cho giấy phép lái xe hạng b kéo rơ moóc có khối lượng toàn bộ theo thiết kế đến 750 kg; đ) hạng c1 cấp cho người lái xe ô tô tải và ô tô chuyên dùng có khối lượng toàn bộ theo thiết kế trên 3.500 kg đến 7.500 kg; các loại xe ô tô tải quy định cho giấy phép lái xe hạng c1 kéo rơ moóc có khối lượng toàn bộ theo thiết kế đến 750 kg; các loại xe quy định cho giấy phép lái xe hạng b; e) hạng c cấp cho người lái xe ô tô tải và ô tô chuyên dùng có khối lượng toàn bộ theo thiết kế trên 7.500 kg; các loại xe ô tô tải quy định cho giấy phép lái xe hạng c kéo rơ moóc có khối lượng toàn bộ theo thiết kế đến 750 kg; các loại xe quy định cho giấy phép lái xe hạng b và hạng c1; g) hạng d1 cấp cho người lái xe ô tô chở người trên 08 chỗ (không kể chỗ của người lái xe) đến 16 chỗ (không kể chỗ của người lái xe); các loại xe ô tô chở người quy định cho giấy phép lái xe hạng d1 kéo rơ moóc có khối lượng toàn bộ theo thiết kế đến 750 kg; các loại xe quy định cho giấy phép lái xe các hạng b, c1, c; h) hạng d2 cấp cho người lái xe ô tô chở người (kể cả xe buýt) trên 16 chỗ (không kể chỗ của người lái xe) đến 29 chỗ (không kể chỗ của người lái xe); các loại xe ô tô chở người quy định cho giấy phép lái xe hạng d2 kéo rơ moóc có khối lượng toàn bộ theo thiết kế đến 750 kg; các loại xe quy định cho giấy phép lái xe các hạng b, c1, c, d1; i) hạng d cấp cho người lái xe ô tô chở người (kể cả xe buýt) trên 29 chỗ (không kể chỗ của người lái xe); xe ô tô chở người giường nằm; các loại xe ô tô chở người quy định cho giấy phép lái xe hạng d kéo rơ moóc có khối lượng toàn bộ theo thiết kế đến 750 kg; các loại xe quy định cho giấy phép lái xe các hạng b, c1, c, d1, d2; k) hạng be cấp cho người lái các loại xe ô tô quy định cho giấy phép lái xe hạng b kéo rơ moóc có khối lượng toàn bộ theo thiết kế trên 750 kg; l) hạng c1e cấp cho người lái các loại xe ô tô quy định cho giấy phép lái xe hạng c1 kéo rơ moóc có khối lượng toàn bộ theo thiết kế trên 750 kg; m) hạng ce cấp cho người lái các loại xe ô tô quy định cho giấy phép lái xe hạng c kéo rơ moóc có khối lượng toàn bộ theo thiết kế trên 750 kg; xe ô tô đầu kéo kéo sơ mi rơ moóc; n) hạng d1e cấp cho người lái các loại xe ô tô quy định cho giấy phép lái xe hạng d1 kéo rơ moóc có khối lượng toàn bộ theo thiết kế trên 750 kg; o) hạng d2e cấp cho người lái các loại xe ô tô quy định cho giấy phép lái xe hạng d2 kéo rơ moóc có khối lượng toàn bộ theo thiết kế trên 750 kg; p) hạng de cấp cho người lái các loại xe ô tô quy định cho giấy phép lái xe hạng d kéo rơ moóc có khối lượng toàn bộ theo thiết kế trên 750 kg; xe ô tô chở khách nối toa. 2. người khuyết tật điều khiển xe mô tô ba bánh dùng cho người khuyết tật được cấp giấy phép lái xe hạng a1. người khuyết tật điều khiển xe ô tô số tự động có kết cấu phù hợp với tình trạng khuyết tật thì được cấp giấy phép lái xe hạng b. 3. người điều khiển xe chở hàng bốn bánh có gắn động cơ, xe chở người bốn bánh có gắn động cơ phải sử dụng giấy phép lái xe có hạng phù hợp với xe ô tô tải hoặc xe ô tô chở người tương ứng. 4. người điều khiển xe ô tô có thiết kế, cải tạo với số chỗ ít hơn xe cùng loại, kích thước giới hạn tương đương phải sử dụng giấy phép lái xe có hạng phù hợp với xe ô tô cùng loại, kích thước giới hạn tương đương và có số chỗ nhiều nhất. 5. thời hạn của giấy phép lái xe được quy định như sau: a) giấy phép lái xe các hạng a1, a, b1 không thời hạn; b) giấy phép lái xe hạng b và hạng c1 có thời hạn 10 năm kể từ ngày cấp; c) giấy phép lái xe các hạng c, d1, d2, d, be, c1e, ce, d1e, d2e và de có thời hạn 05 năm kể từ ngày cấp. 6. giấy phép lái xe có giá trị sử dụng trong phạm vi lãnh thổ việt nam bao gồm: a) giấy phép lái xe do cơ quan có thẩm quyền của việt nam cấp; b) giấy phép lái xe quốc tế và giấy phép lái xe quốc gia phù hợp với loại xe được phép điều khiển do quốc gia là thành viên của công ước của liên hợp quốc về giao thông đường bộ năm 1968 (sau đây gọi là công ước viên) cấp; c) giấy phép lái xe phù hợp với loại xe được phép điều khiển của nước hoặc vùng lãnh thổ mà việt nam ký kết điều ước quốc tế hoặc thỏa thuận quốc tế công nhận giấy phép lái xe của nhau; d) giấy phép lái xe nước ngoài phù hợp với loại xe được phép điều khiển do quốc gia được công nhận theo điều ước quốc tế mà nước cộng hòa xã hội chủ nghĩa việt nam là thành viên. 7. giấy phép lái xe không có hiệu lực trong các trường hợp sau đây: a) giấy phép lái xe hết thời hạn sử dụng; b) giấy phép lái xe bị thu hồi theo quy định tại khoản 5 điều 62 của luật này. 8. giấy phép lái xe quốc tế được quy định như sau: a) giấy phép lái xe quốc tế là giấy phép lái xe do cơ quan nhà nước có thẩm quyền của quốc gia là thành viên của công ước viên cấp theo một mẫu thống nhất; có thời hạn không quá 03 năm kể từ ngày cấp và phải phù hợp với thời hạn còn hiệu lực của giấy phép lái xe quốc gia; b) người có giấy phép lái xe quốc tế do quốc gia là thành viên của công ước viên cấp khi lái xe tham gia giao thông đường bộ trên lãnh thổ việt nam phải mang theo giấy phép lái xe quốc tế và giấy phép lái xe quốc gia được cấp phù hợp với hạng xe điều khiển, còn thời hạn sử dụng; phải tuân thủ pháp luật về trật tự, an toàn giao thông đường bộ của việt nam; c) người có giấy phép lái xe quốc tế vi phạm pháp luật về trật tự, an toàn giao thông đường bộ của việt nam mà bị tước quyền sử dụng giấy phép lái xe có thời hạn thì thời gian bị tước quyền sử dụng không quá thời gian người lái xe được phép cư trú tại lãnh thổ việt nam; d) người việt nam hoặc người nước ngoài có thẻ thường trú hoặc thẻ tạm trú tại việt nam có giấy phép lái xe do việt nam hoặc quốc gia là thành viên của điều ước quốc tế mà nước cộng hòa xã hội chủ nghĩa việt nam là thành viên cấp, còn giá trị sử dụng, nếu có nhu cầu được cấp giấy phép lái xe quốc tế. 9. bộ trưởng bộ giao thông vận tải quy định mẫu giấy phép lái xe và giấy phép lái xe quốc tế, trình tự, thủ tục cấp và việc sử dụng giấy phép lái xe, giấy phép lái xe quốc tế; đối với mẫu giấy phép lái xe, trình tự, thủ tục cấp và việc sử dụng giấy phép lái xe của lực lượng quân đội, công an làm nhiệm vụ quốc phòng, an ninh do bộ trưởng bộ quốc phòng, bộ trưởng bộ công an quy định.', '1. giấy phép lái xe quân sự, được phân hạng theo quy định của luật trật tự, an toàn giao thông đường bộ, đồng thời phù hợp với đặc thù quân sự của phương tiện cơ giới đường bộ thuộc phạm vi quản lý của bộ quốc phòng. giấy phép lái xe quân sự, gồm: a) hạng a1 cấp cho người điều khiển xe mô tô hai bánh có dung tích xi-lanh đến 125 cm3 hoặc có công suất động cơ điện đến 11 kw; b) hạng a cấp cho người điều khiển xe mô tô hai bánh có dung tích xi-lanh trên 125 cm3 hoặc có công suất động cơ điện trên 11kw và các loại xe quy định cho giấy phép lái xe quân sự hạng a1; c) hạng b1 cấp cho người điều khiển xe mô tô ba bánh và các loại xe quy định cho giấy phép lái xe quân sự hạng a1; d) hạng b cấp cho người điều khiển các loại xe ô tô chở người đến 08 chỗ ngồi (không kể chỗ của người lái xe); xe ô tô tải và ô tô chuyên dùng có khối lượng toàn bộ theo thiết kế đến 3.500 kg; các loại xe ô tô quy định cho giấy phép lái xe hạng b có kéo rơ moóc hoặc vũ khí, khí tài quân sự dạng rơ moóc có khối lượng toàn bộ theo thiết kế đến 750 kg; đ) hạng c1 cấp cho người điều khiển các loại xe ô tô vận tải và ô tô chuyên dùng có khối lượng toàn bộ theo thiết kế trên 3.500 kg đến 7.500 kg; các loại xe ô tô quy định cho giấy phép lái xe hạng c1 kéo rơ moóc hoặc vũ khí, khí tài quân sự dạng rơ moóc có khối lượng toàn bộ theo thiết kế đến 750 kg; các loại xe quy định cho giấy phép lái xe quân sự hạng b; e) hạng c cấp cho người điều khiển các loại xe ô tô tải và ô tô chuyên dùng có khối lượng toàn bộ theo thiết kế trên 7.500 kg; các loại xe ô tô tải quy định cho giấy phép lái xe hạng c kéo rơ moóc hoặc vũ khí, khí tài quân sự dạng rơ moóc có khối lượng toàn bộ theo thiết kế đến 750 kg; các loại xe quy định cho giấy phép lái xe quân sự hạng b và hạng c1; g) hạng d1 cấp cho người điều khiển xe ô tô chở người trên 8 chỗ (không kể chỗ của người lái xe) đến 16 chỗ (không kể chỗ của người lái xe); các loại xe ô tô chở người quy định cho giấy phép lái xe hạng d1 kéo rơ moóc hoặc vũ khí, khí tài quân sự dạng rơ moóc có khối lượng toàn bộ theo thiết kế đến 750 kg; các loại xe quy định cho giấy phép lái xe quân sự hạng b, c1, c; h) hạng d2 cấp cho người điều khiển xe ô tô chở người từ trên 16 đến 29 chỗ (không kể chỗ của người lái xe); các loại xe ô tô chở người quy định cho giấy phép lái xe hạng d2 kéo rơ moóc hoặc vũ khí, khí tài quân sự dạng rơ moóc có khối lượng toàn bộ theo thiết kế đến 750 kg; các loại xe quy định cho giấy phép lái xe quân sự hạng b, c1, c, d1; i) hạng d cấp cho người điều khiển xe ô tô chở người từ trên 29 chỗ (không kể chỗ của người lái xe); các loại xe ô tô chở người quy định cho giấy phép lái xe hạng d kéo rơ moóc hoặc vũ khí, khí tài quân sự dạng rơ moóc có khối lượng toàn bộ theo thiết kế đến 750 kg; các loại xe quy định cho giấy phép lái xe quân sự hạng b, c1, c, d1, d2; k) hạng c1e cấp cho người điều khiển các loại xe ô tô quy định cho giấy phép lái xe hạng c1 kéo rơ moóc hoặc vũ khí, khí tài quân sự dạng rơ moóc có khối lượng toàn bộ theo thiết kế trên 750 kg; l) hạng ce cấp cho người điều khiển các loại xe ô tô quy định cho giấy phép lái xe hạng c kéo rơ moóc hoặc vũ khí, khí tài quân sự dạng rơ moóc có khối lượng toàn bộ theo thiết kế trên 750 kg; xe ô tô đầu kéo kéo sơ mi rơ moóc hoặc khí tài quân sự dạng sơ mi rơ moóc; m) hạng cx cấp cho người đã có giấy phép lái xe quân sự hạng c để điều khiển xe xích kéo vũ khí, khí tài quân sự. 2. người điều khiển xe chở hàng bốn bánh có gắn động cơ, xe chở người bốn bánh có gắn động cơ phải sử dụng giấy phép lái xe có hạng phù hợp với xe ô tô tải và ô tô chở người tương ứng. 3. người điều khiển xe ô tô có thiết kế, cải tạo với số chỗ ngồi ít hơn ô tô cùng loại, kích thước giới hạn tương đương phải sử dụng giấy phép lái xe có hạng phù hợp với ô tô cùng loại, kích thước giới hạn tương đương và có số chỗ ngồi nhiều nhất.', '1. hạng a1, a, gồm: a) kế hoạch huấn luyện lái xe mô tô quân sự hạng a1, a (kèm theo danh sách học viên) của cơ quan, đơn vị theo quy định tại mẫu số 13 phụ lục i kèm theo thông tư này; b) đơn đề nghị học và sát hạch, cấp giấy phép lái xe quân sự của cá nhân có xác nhận của thủ trưởng cơ quan, đơn vị trực tiếp quản lý từ cấp trung đoàn hoặc tương đương trở lên theo quy định tại mẫu số 01 phụ lục i kèm theo thông tư này; c) bản sao căn cước công dân (căn cước) và bản sao một trong các loại giấy tờ sau: giấy chứng minh quân nhân, công chức quốc phòng, công nhân và viên chức quốc phòng, quyết định nhập ngũ, tuyển dụng, phiếu quân nhân, thẻ học viên, quyết định thăng, phong quân hàm, nâng lương gần nhất còn hiệu lực; d) giấy chứng nhận sức khỏe theo quy định do quân y cấp trung đoàn và tương đương trở lên xác nhận theo quy định tại mẫu số 02 phụ lục i kèm theo thông tư này; đ) hai ảnh màu cỡ 2 x 3 cm (ảnh chụp trên nền màu xanh; quân nhân mặc quân phục thường dùng; công chức quốc phòng, công nhân và viên chức quốc phòng, lao động hợp đồng mặc đồng phục; đeo biển tên theo quy định, không đội mũ). 2. hạng b1, b, c1, c, gồm: a) kế hoạch đào tạo lái xe quân sự hạng b1, b, c1, c (kèm theo danh sách học viên) của cơ sở đào tạo; b) bản sao quyết định giao chỉ tiêu đào tạo nhân viên kỹ thuật sơ cấp của tổng tham mưu trưởng đối với trường hợp đào tạo theo chỉ tiêu nhiệm vụ; văn bản đề nghị đào tạo lái xe của thủ trưởng cơ quan, đơn vị đầu mối trực thuộc bộ quốc phòng đối với trường hợp gửi đào tạo; c) hồ sơ quy định tại các điểm b, c, d, đ khoản 1 điều này; 3. đào tạo nâng hạng giấy phép lái xe quân sự ngoài hồ sơ quy định tại khoản 2 điều này phải bổ sung các giấy tờ như sau: a) bản khai thời gian lái xe và số km lái xe an toàn quy định cho từng hạng xe có xác nhận của thủ trưởng cơ quan, đơn vị trực tiếp quản lý từ cấp trung đoàn hoặc tương đương trở lên theo quy định tại mẫu số 03 phụ lục i kèm theo thông tư này; b) bản sao giấy phép lái xe quân sự đang sử dụng. mục ii. cơ sở đào tạo lái xe quân sự', '1. đào tạo lái xe hạng a1, a: do cơ quan xe - máy hoặc cơ quan xe máy - vận tải các đơn vị trực thuộc bộ quốc phòng tổ chức tại các đơn vị hoặc tại các cơ sở đào tạo lái xe thuộc cấp mình quản lý. 2. đào tạo lái xe các hạng b1, b, c1, c1e, c, ce, cx, d1, d2, d: được đào tạo tập trung tại các cơ sở đào tạo lái xe quân sự. 3. đào tạo lái xe hạng c1e, ce, cx, d1, d2, d: phải được đào tạo theo hình thức nâng hạng. 4. người có giấy phép lái xe dân sự được tuyển dụng vào các cơ quan, đơn vị quân đội để thực hiện nhiệm vụ lái xe quân sự phải hoàn thành chương trình huấn luyện chuyển loại lái xe quân sự trước khi làm thủ tục đổi giấy phép lái xe.']","**Nguồn văn bản:** 36_2024_QH15_444251

**Tên văn bản:** Luật Trật tự, an toàn giao thông đường bộ

**Điều 57:** Giấy phép lái xe

**Nội dung:**

1. Giấy phép lái xe bao gồm các hạng sau đây:

	a) Hạng A1 cấp cho người lái xe mô tô hai bánh có dung tích xi-lanh đến 125 cm3 hoặc có công suất động cơ điện đến 11 kw.

	b) Hạng A cấp cho người lái xe mô tô hai bánh có dung tích xi-lanh trên 125 cm3 hoặc có công suất động cơ điện trên 11 kw và các loại xe quy định cho giấy phép lái xe hạng A1.

	c) Hạng B1 cấp cho người lái xe mô tô ba bánh và các loại xe quy định cho giấy phép lái xe hạng A1.

	d) Hạng B cấp cho người lái xe ô tô chở người đến 08 chỗ (không kể chỗ của người lái xe); xe ô tô tải và ô tô chuyên dùng có khối lượng toàn bộ theo thiết kế đến 3.500 kg; các loại xe ô tô quy định cho giấy phép lái xe hạng B kéo rơ moóc có khối lượng toàn bộ theo thiết kế đến 750 kg.
    
    đ) Hạng C1 cấp cho người lái xe ô tô tải và ô tô chuyên dùng có khối lượng toàn bộ theo thiết kế trên 3.500 kg đến 7.500 kg; các loại xe ô tô tải quy định cho giấy phép lái xe hạng C1 kéo rơ moóc có khối lượng toàn bộ theo thiết kế đến 750 kg; các loại xe quy định cho giấy phép lái xe hạng B.

    e) Hạng C cấp cho người lái xe ô tô tải và ô tô chuyên dùng có khối lượng toàn bộ theo thiết kế trên 7.500 kg; các loại xe ô tô tải quy định cho giấy phép lái xe hạng C kéo rơ moóc có khối lượng toàn bộ theo thiết kế đến 750 kg; các loại xe quy định cho giấy phép lái xe hạng B và hạng C1.

    g) Hạng D1 cấp cho người lái xe ô tô chở người trên 08 chỗ (không kể chỗ của người lái xe) đến 16 chỗ (không kể chỗ của người lái xe); các loại xe ô tô chở người quy định cho giấy phép lái xe hạng D1 kéo rơ moóc có khối lượng toàn bộ theo thiết kế đến 750 kg; các loại xe quy định cho giấy phép lái xe các hạng B, C1, C.

    h) Hạng D2 cấp cho người lái xe ô tô chở người (kể cả xe buýt) trên 16 chỗ (không kể chỗ của người lái xe) đến 29 chỗ (không kể chỗ của người lái xe); các loại xe ô tô chở người quy định cho giấy phép lái xe hạng D2 kéo rơ moóc có khối lượng toàn bộ theo thiết kế đến 750 kg; các loại xe quy định cho giấy phép lái xe các hạng B, C1, C, D1.


**Tóm lại:** Giấy phép lái xe hạng A1 được cấp cho người lái xe mô tô hai bánh có dung tích xi lanh đến 125 cm3 hoặc có công suất động cơ điện đến 11 kw.
",Hạng A1 mới cấp cho người lái xe mô tô từ trên 50 phân khối đến 125 phân khối.,1.0,0.4167682140306696,0.0,0.0
2,Thời hạn của giấy phép lái xe hạng B theo Luật Giao thông Đường bộ 2025 là bao lâu?,"['1. là công dân việt nam, người nước ngoài được phép cư trú hoặc đang làm việc, học tập tại việt nam. 2. người học lái xe để nâng hạng giấy phép lái xe phải đáp ứng theo quy định tại khoản 4 điều 60 luật trật tự, an toàn giao thông đường bộ; trong đó, thời gian lái xe an toàn cho từng hạng giấy phép lái xe được quy định cụ thể như sau: a) hạng b lên c1, b lên c, b lên d1, b lên be, c1 lên c, c1 lên d1, c1 lên d2, c1 lên c1e, c lên d1, c lên d2, d1 lên d2, d1 lên d, d1 lên d1e, d2 lên d, d2 lên d2e, d lên de: thời gian lái xe an toàn từ 02 năm trở lên; b) hạng b lên d2, c lên ce, c lên d: thời gian lái xe an toàn từ 03 năm trở lên. 3. người đã có giấy phép lái xe hạng b số tự động được đăng ký học để cấp mới giấy phép lái xe hạng b số cơ khí (số sàn), người đã có giấy phép lái xe hạng b được đăng ký học để cấp mới giấy phép lái xe hạng c1 và phải học đủ nội dung chương trình đào tạo lái xe theo quy định, hồ sơ của người học lái xe thực hiện theo quy định tại khoản 1 điều 15 thông tư này; trường hợp đạt kết quả sát hạch, cơ quan tổ chức sát hạch có văn bản đề nghị cơ quan đã cấp giấy phép xe cắt góc giấy phép lái xe cũ và có văn bản đề nghị cục đường bộ việt nam xóa số quản lý giấy phép lái xe đã cấp.', '1. người đạt kết quả kỳ sát hạch được cấp giấy phép lái xe đúng hạng đã trúng tuyển; đối với trường hợp nâng hạng hoặc cấp theo quy định tại khoản 2 điều này phải xuất trình bản chính giấy phép lái xe khi đến nhận giấy phép lái xe a) căn cứ quyết định công nhận trúng tuyển kỳ sát hạch, sở giao thông vận tải cấp giấy phép lái xe cho người trúng tuyển. ngày trúng tuyển ghi tại mặt sau giấy phép lái xe là ngày ký quyết định công nhận trúng tuyển kỳ sát hạch; b) thời gian cấp giấy phép lái xe chậm nhất không quá 10 ngày, kể từ ngày kết thúc kỳ sát hạch và người đạt kết quả kỳ sát hạch đã hoàn thành nghĩa vụ nộp lệ phí cấp giấy phép lái xe. 2. người có giấy phép lái xe quá thời hạn sử dụng a) người có giấy phép lái xe các hạng b, c1, c, d1, d2, d, be, c1e, ce, d1e, d2e, de quá thời hạn sử dụng quá hạn dưới 01 năm kể từ ngày hết hạn phải sát hạch lý thuyết theo quy định tại điểm a khoản 1 điều 17 thông tư này để cấp giấy phép lái xe. quá hạn từ 01 năm trở lên kể từ ngày hết hạn phải sát hạch lý thuyết, thực hành lái xe trong hình và trên đường để cấp giấy phép lái xe theo quy định tại khoản 1, khoản 2 và khoản 3 điều 17 thông tư này. hồ sơ dự sát hạch thực hiện theo quy định tại khoản 3 điều 29 thông tư này; b) người có giấy phép lái xe các hạng b, c1, c, d1, d2, d, be, c1e, ce, d1e, d2e, de bị mất nhưng quá thời hạn sử dụng, có tên trong hồ sơ của sở giao thông vận tải, không thuộc trường hợp đang bị các cơ quan có thẩm quyền thu giữ, xử lý phải dự sát hạch các nội dung: quá hạn dưới 01 năm, phải dự sát hạch lý thuyết để cấp giấy phép lái xe theo quy định tại điểm a khoản 1 điều 17 thông tư này. quá hạn từ 01 năm trở lên kể từ ngày hết hạn phải sát hạch lý thuyết, thực hành lái xe trong hình và trên đường để cấp giấy phép lái xe theo quy định tại khoản 1, khoản 2 và khoản 3 điều 17 thông tư này. hồ sơ dự sát hạch thực hiện theo quy định tại khoản 3 điều 29 của thông tư này; c) ngày trúng tuyển ghi tại mặt sau giấy phép lái xe được tính theo ngày trúng tuyển của giấy phép lái xe cũ; d) người dự sát hạch có nhu cầu ôn tập, đăng ký với các cơ sở đào tạo lái xe để được hướng dẫn ôn tập, phải nộp phí ôn tập theo quy định, không phải học lại theo chương trình đào tạo; đ) trường hợp không đạt kết quả để được cấp giấy phép lái xe, người có giấy phép lái xe quá thời hạn sử dụng, bị mất nhưng quá thời hạn sử dụng phải đăng ký với sở giao thông vận tải để tham gia sát hạch lại. 3. chưa sát hạch cấp giấy phép lái xe đối với người vi phạm trật tự, an toàn giao thông đường bộ chưa thực hiện xong yêu cầu của cơ quan nhà nước có thẩm quyền về giải quyết, xử lý vụ việc vi phạm hành chính trong lĩnh vực trật tự, an toàn giao thông đường bộ.', '1. giấy phép lái xe bao gồm các hạng sau đây: a) hạng a1 cấp cho người lái xe mô tô hai bánh có dung tích xi-lanh đến 125 cm3 hoặc có công suất động cơ điện đến 11 kw; b) hạng a cấp cho người lái xe mô tô hai bánh có dung tích xi-lanh\xa0 trên 125 cm3\xa0hoặc có công suất động cơ điện trên 11 kw và các loại xe quy định cho giấy phép lái xe hạng a1; c) hạng b1 cấp cho người lái xe mô tô ba bánh và các loại xe quy định cho giấy phép lái xe hạng a1; d) hạng b cấp cho người lái xe ô tô chở người đến 08 chỗ (không kể chỗ của người lái xe); xe ô tô tải và ô tô chuyên dùng có khối lượng toàn bộ theo thiết kế đến 3.500 kg; các loại xe ô tô quy định cho giấy phép lái xe hạng b kéo rơ moóc có khối lượng toàn bộ theo thiết kế đến 750 kg; đ) hạng c1 cấp cho người lái xe ô tô tải và ô tô chuyên dùng có khối lượng toàn bộ theo thiết kế trên 3.500 kg đến 7.500 kg; các loại xe ô tô tải quy định cho giấy phép lái xe hạng c1 kéo rơ moóc có khối lượng toàn bộ theo thiết kế đến 750 kg; các loại xe quy định cho giấy phép lái xe hạng b; e) hạng c cấp cho người lái xe ô tô tải và ô tô chuyên dùng có khối lượng toàn bộ theo thiết kế trên 7.500 kg; các loại xe ô tô tải quy định cho giấy phép lái xe hạng c kéo rơ moóc có khối lượng toàn bộ theo thiết kế đến 750 kg; các loại xe quy định cho giấy phép lái xe hạng b và hạng c1; g) hạng d1 cấp cho người lái xe ô tô chở người trên 08 chỗ (không kể chỗ của người lái xe) đến 16 chỗ (không kể chỗ của người lái xe); các loại xe ô tô chở người quy định cho giấy phép lái xe hạng d1 kéo rơ moóc có khối lượng toàn bộ theo thiết kế đến 750 kg; các loại xe quy định cho giấy phép lái xe các hạng b, c1, c; h) hạng d2 cấp cho người lái xe ô tô chở người (kể cả xe buýt) trên 16 chỗ (không kể chỗ của người lái xe) đến 29 chỗ (không kể chỗ của người lái xe); các loại xe ô tô chở người quy định cho giấy phép lái xe hạng d2 kéo rơ moóc có khối lượng toàn bộ theo thiết kế đến 750 kg; các loại xe quy định cho giấy phép lái xe các hạng b, c1, c, d1; i) hạng d cấp cho người lái xe ô tô chở người (kể cả xe buýt) trên 29 chỗ (không kể chỗ của người lái xe); xe ô tô chở người giường nằm; các loại xe ô tô chở người quy định cho giấy phép lái xe hạng d kéo rơ moóc có khối lượng toàn bộ theo thiết kế đến 750 kg; các loại xe quy định cho giấy phép lái xe các hạng b, c1, c, d1, d2; k) hạng be cấp cho người lái các loại xe ô tô quy định cho giấy phép lái xe hạng b kéo rơ moóc có khối lượng toàn bộ theo thiết kế trên 750 kg; l) hạng c1e cấp cho người lái các loại xe ô tô quy định cho giấy phép lái xe hạng c1 kéo rơ moóc có khối lượng toàn bộ theo thiết kế trên 750 kg; m) hạng ce cấp cho người lái các loại xe ô tô quy định cho giấy phép lái xe hạng c kéo rơ moóc có khối lượng toàn bộ theo thiết kế trên 750 kg; xe ô tô đầu kéo kéo sơ mi rơ moóc; n) hạng d1e cấp cho người lái các loại xe ô tô quy định cho giấy phép lái xe hạng d1 kéo rơ moóc có khối lượng toàn bộ theo thiết kế trên 750 kg; o) hạng d2e cấp cho người lái các loại xe ô tô quy định cho giấy phép lái xe hạng d2 kéo rơ moóc có khối lượng toàn bộ theo thiết kế trên 750 kg; p) hạng de cấp cho người lái các loại xe ô tô quy định cho giấy phép lái xe hạng d kéo rơ moóc có khối lượng toàn bộ theo thiết kế trên 750 kg; xe ô tô chở khách nối toa. 2. người khuyết tật điều khiển xe mô tô ba bánh dùng cho người khuyết tật được cấp giấy phép lái xe hạng a1. người khuyết tật điều khiển xe ô tô số tự động có kết cấu phù hợp với tình trạng khuyết tật thì được cấp giấy phép lái xe hạng b. 3. người điều khiển xe chở hàng bốn bánh có gắn động cơ, xe chở người bốn bánh có gắn động cơ phải sử dụng giấy phép lái xe có hạng phù hợp với xe ô tô tải hoặc xe ô tô chở người tương ứng. 4. người điều khiển xe ô tô có thiết kế, cải tạo với số chỗ ít hơn xe cùng loại, kích thước giới hạn tương đương phải sử dụng giấy phép lái xe có hạng phù hợp với xe ô tô cùng loại, kích thước giới hạn tương đương và có số chỗ nhiều nhất. 5. thời hạn của giấy phép lái xe được quy định như sau: a) giấy phép lái xe các hạng a1, a, b1 không thời hạn; b) giấy phép lái xe hạng b và hạng c1 có thời hạn 10 năm kể từ ngày cấp; c) giấy phép lái xe các hạng c, d1, d2, d, be, c1e, ce, d1e, d2e và de có thời hạn 05 năm kể từ ngày cấp. 6. giấy phép lái xe có giá trị sử dụng trong phạm vi lãnh thổ việt nam bao gồm: a) giấy phép lái xe do cơ quan có thẩm quyền của việt nam cấp; b) giấy phép lái xe quốc tế và giấy phép lái xe quốc gia phù hợp với loại xe được phép điều khiển do quốc gia là thành viên của công ước của liên hợp quốc về giao thông đường bộ năm 1968 (sau đây gọi là công ước viên) cấp; c) giấy phép lái xe phù hợp với loại xe được phép điều khiển của nước hoặc vùng lãnh thổ mà việt nam ký kết điều ước quốc tế hoặc thỏa thuận quốc tế công nhận giấy phép lái xe của nhau; d) giấy phép lái xe nước ngoài phù hợp với loại xe được phép điều khiển do quốc gia được công nhận theo điều ước quốc tế mà nước cộng hòa xã hội chủ nghĩa việt nam là thành viên. 7. giấy phép lái xe không có hiệu lực trong các trường hợp sau đây: a) giấy phép lái xe hết thời hạn sử dụng; b) giấy phép lái xe bị thu hồi theo quy định tại khoản 5 điều 62 của luật này. 8. giấy phép lái xe quốc tế được quy định như sau: a) giấy phép lái xe quốc tế là giấy phép lái xe do cơ quan nhà nước có thẩm quyền của quốc gia là thành viên của công ước viên cấp theo một mẫu thống nhất; có thời hạn không quá 03 năm kể từ ngày cấp và phải phù hợp với thời hạn còn hiệu lực của giấy phép lái xe quốc gia; b) người có giấy phép lái xe quốc tế do quốc gia là thành viên của công ước viên cấp khi lái xe tham gia giao thông đường bộ trên lãnh thổ việt nam phải mang theo giấy phép lái xe quốc tế và giấy phép lái xe quốc gia được cấp phù hợp với hạng xe điều khiển, còn thời hạn sử dụng; phải tuân thủ pháp luật về trật tự, an toàn giao thông đường bộ của việt nam; c) người có giấy phép lái xe quốc tế vi phạm pháp luật về trật tự, an toàn giao thông đường bộ của việt nam mà bị tước quyền sử dụng giấy phép lái xe có thời hạn thì thời gian bị tước quyền sử dụng không quá thời gian người lái xe được phép cư trú tại lãnh thổ việt nam; d) người việt nam hoặc người nước ngoài có thẻ thường trú hoặc thẻ tạm trú tại việt nam có giấy phép lái xe do việt nam hoặc quốc gia là thành viên của điều ước quốc tế mà nước cộng hòa xã hội chủ nghĩa việt nam là thành viên cấp, còn giá trị sử dụng, nếu có nhu cầu được cấp giấy phép lái xe quốc tế. 9. bộ trưởng bộ giao thông vận tải quy định mẫu giấy phép lái xe và giấy phép lái xe quốc tế, trình tự, thủ tục cấp và việc sử dụng giấy phép lái xe, giấy phép lái xe quốc tế; đối với mẫu giấy phép lái xe, trình tự, thủ tục cấp và việc sử dụng giấy phép lái xe của lực lượng quân đội, công an làm nhiệm vụ quốc phòng, an ninh do bộ trưởng bộ quốc phòng, bộ trưởng bộ công an quy định.', '1. mẫu giấy phép lái xe quân sự a) giấy phép lái xe quân sự thực hiện theo quy định tại mẫu số 08 kèm theo thông tư này; b) cục trưởng cục xe máy - vận tải/tổng cục hậu cần - kỹ thuật có trách nhiệm quản lý việc sử dụng giấy phép lái xe quân sự thuộc phạm vi quản lý của bộ quốc phòng. 2. thời hạn sử dụng giấy phép lái xe quân sự a) giấy phép lái xe quân sự hạng a1, a, b1 là không thời hạn; b) giấy phép lái xe quân sự các hạng b, c1, c, d1, d2, d, c1e, ce, cx có thời hạn 05 năm kể từ ngày cấp; c) trường hợp cấp, đổi do lý do khác thời hạn theo thời hạn ghi trên giấy phép lái xe quân sự. 3. giấy phép lái xe quân sự không có hiệu lực trong các trường hợp sau: a) giấy phép lái xe quân sự hết thời hạn sử dụng được ghi trên giấy phép lái xe; b) giấy phép lái xe quân sự bị trừ hết điểm theo quy định tại điều 7 của thông tư này; c) giấy phép lái xe quân sự có quyết định thu hồi theo khoản 1 điều 47 thông tư này.', '1. quân nhân, công chức quốc phòng, công nhân viên chức quốc phòng, lao động hợp đồng đang phục vụ trong bộ quốc phòng có đủ các điều kiện: tiêu chuẩn về tuổi đời, thời gian công tác, sức khỏe, trình độ văn hóa, phẩm chất chính trị theo quy định của bộ quốc phòng. đối với lao động hợp đồng: chỉ đào tạo nâng hạng khi có đủ điều kiện, tiêu chuẩn quy định tại khoản 1 điều này. 2. đối với người học nâng hạng giấy phép lái xe quân sự phải có thời gian lái xe và số km lái xe an toàn như sau: a) từ hạng b lên hạng c1; hạng c1 lên hạng c, c1e; hạng c lên hạng d1, ce, cx; hạng d1 lên hạng d2; hạng d2 lên hạng d: có thời gian lái xe 02 năm trở lên và 30.000 km lái xe an toàn trở lên (trừ các trường hợp đào tạo chuyển tiếp từ hạng c lên hạng ce hoặc cx theo chỉ tiêu của bộ tổng tham mưu); b) từ hạng b lên hạng c, d1; hạng c1 lên d1; hạng c lên hạng d2; hạng d1 lên hạng d: có thời gian lái xe 03 năm trở lên và có 50.000 km lái xe an toàn trở lên; c) từ hạng b lên hạng d2, từ hạng c1 lên hạng d2, từ hạng c lên hạng d: có thời gian lái xe 05 năm trở lên và 100.000 km lái xe an toàn trở lên. 3. đối với người học nâng hạng giấy phép lái xe quân sự lên hạng d1, d2, d ngoài các quy định tại các khoản 1, 2 điều này phải có bằng tốt nghiệp trung học cơ sở trở lên.']","**Nguồn văn bản:** 36_2024_QH15_444251

**Tên văn bản:** Luật Trật tự, an toàn giao thông đường bộ

**Điều 57:** Giấy phép lái xe

**Nội dung:**

5. Thời hạn của giấy phép lái xe được quy định như sau:

	a) Giấy phép lái xe các hạng A1, A, B1 không thời hạn.

	b) Giấy phép lái xe hạng B và hạng C1 có thời hạn 10 năm kể từ ngày cấp.

	c) Giấy phép lái xe các hạng C, D1, D2, D, BE, C1E, CE, D1E, D2E và DE có thời hạn 05 năm kể từ ngày cấp.


**Tóm lại:** Thời hạn của giấy phép lái xe hạng B là 10 năm kể từ ngày cấp.
",Giấy phép lái xe hạng B có thời hạn 10 năm kể từ ngày cấp.,0.625,0.6435826396351249,1.0,0.3333333333
3,Giấy phép lái xe hạng C1 có thời hạn bao lâu?,"['1. là công dân việt nam, người nước ngoài được phép cư trú hoặc đang làm việc, học tập tại việt nam. 2. người học lái xe để nâng hạng giấy phép lái xe phải đáp ứng theo quy định tại khoản 4 điều 60 luật trật tự, an toàn giao thông đường bộ; trong đó, thời gian lái xe an toàn cho từng hạng giấy phép lái xe được quy định cụ thể như sau: a) hạng b lên c1, b lên c, b lên d1, b lên be, c1 lên c, c1 lên d1, c1 lên d2, c1 lên c1e, c lên d1, c lên d2, d1 lên d2, d1 lên d, d1 lên d1e, d2 lên d, d2 lên d2e, d lên de: thời gian lái xe an toàn từ 02 năm trở lên; b) hạng b lên d2, c lên ce, c lên d: thời gian lái xe an toàn từ 03 năm trở lên. 3. người đã có giấy phép lái xe hạng b số tự động được đăng ký học để cấp mới giấy phép lái xe hạng b số cơ khí (số sàn), người đã có giấy phép lái xe hạng b được đăng ký học để cấp mới giấy phép lái xe hạng c1 và phải học đủ nội dung chương trình đào tạo lái xe theo quy định, hồ sơ của người học lái xe thực hiện theo quy định tại khoản 1 điều 15 thông tư này; trường hợp đạt kết quả sát hạch, cơ quan tổ chức sát hạch có văn bản đề nghị cơ quan đã cấp giấy phép xe cắt góc giấy phép lái xe cũ và có văn bản đề nghị cục đường bộ việt nam xóa số quản lý giấy phép lái xe đã cấp.', '1. giấy phép lái xe bao gồm các hạng sau đây: a) hạng a1 cấp cho người lái xe mô tô hai bánh có dung tích xi-lanh đến 125 cm3 hoặc có công suất động cơ điện đến 11 kw; b) hạng a cấp cho người lái xe mô tô hai bánh có dung tích xi-lanh\xa0 trên 125 cm3\xa0hoặc có công suất động cơ điện trên 11 kw và các loại xe quy định cho giấy phép lái xe hạng a1; c) hạng b1 cấp cho người lái xe mô tô ba bánh và các loại xe quy định cho giấy phép lái xe hạng a1; d) hạng b cấp cho người lái xe ô tô chở người đến 08 chỗ (không kể chỗ của người lái xe); xe ô tô tải và ô tô chuyên dùng có khối lượng toàn bộ theo thiết kế đến 3.500 kg; các loại xe ô tô quy định cho giấy phép lái xe hạng b kéo rơ moóc có khối lượng toàn bộ theo thiết kế đến 750 kg; đ) hạng c1 cấp cho người lái xe ô tô tải và ô tô chuyên dùng có khối lượng toàn bộ theo thiết kế trên 3.500 kg đến 7.500 kg; các loại xe ô tô tải quy định cho giấy phép lái xe hạng c1 kéo rơ moóc có khối lượng toàn bộ theo thiết kế đến 750 kg; các loại xe quy định cho giấy phép lái xe hạng b; e) hạng c cấp cho người lái xe ô tô tải và ô tô chuyên dùng có khối lượng toàn bộ theo thiết kế trên 7.500 kg; các loại xe ô tô tải quy định cho giấy phép lái xe hạng c kéo rơ moóc có khối lượng toàn bộ theo thiết kế đến 750 kg; các loại xe quy định cho giấy phép lái xe hạng b và hạng c1; g) hạng d1 cấp cho người lái xe ô tô chở người trên 08 chỗ (không kể chỗ của người lái xe) đến 16 chỗ (không kể chỗ của người lái xe); các loại xe ô tô chở người quy định cho giấy phép lái xe hạng d1 kéo rơ moóc có khối lượng toàn bộ theo thiết kế đến 750 kg; các loại xe quy định cho giấy phép lái xe các hạng b, c1, c; h) hạng d2 cấp cho người lái xe ô tô chở người (kể cả xe buýt) trên 16 chỗ (không kể chỗ của người lái xe) đến 29 chỗ (không kể chỗ của người lái xe); các loại xe ô tô chở người quy định cho giấy phép lái xe hạng d2 kéo rơ moóc có khối lượng toàn bộ theo thiết kế đến 750 kg; các loại xe quy định cho giấy phép lái xe các hạng b, c1, c, d1; i) hạng d cấp cho người lái xe ô tô chở người (kể cả xe buýt) trên 29 chỗ (không kể chỗ của người lái xe); xe ô tô chở người giường nằm; các loại xe ô tô chở người quy định cho giấy phép lái xe hạng d kéo rơ moóc có khối lượng toàn bộ theo thiết kế đến 750 kg; các loại xe quy định cho giấy phép lái xe các hạng b, c1, c, d1, d2; k) hạng be cấp cho người lái các loại xe ô tô quy định cho giấy phép lái xe hạng b kéo rơ moóc có khối lượng toàn bộ theo thiết kế trên 750 kg; l) hạng c1e cấp cho người lái các loại xe ô tô quy định cho giấy phép lái xe hạng c1 kéo rơ moóc có khối lượng toàn bộ theo thiết kế trên 750 kg; m) hạng ce cấp cho người lái các loại xe ô tô quy định cho giấy phép lái xe hạng c kéo rơ moóc có khối lượng toàn bộ theo thiết kế trên 750 kg; xe ô tô đầu kéo kéo sơ mi rơ moóc; n) hạng d1e cấp cho người lái các loại xe ô tô quy định cho giấy phép lái xe hạng d1 kéo rơ moóc có khối lượng toàn bộ theo thiết kế trên 750 kg; o) hạng d2e cấp cho người lái các loại xe ô tô quy định cho giấy phép lái xe hạng d2 kéo rơ moóc có khối lượng toàn bộ theo thiết kế trên 750 kg; p) hạng de cấp cho người lái các loại xe ô tô quy định cho giấy phép lái xe hạng d kéo rơ moóc có khối lượng toàn bộ theo thiết kế trên 750 kg; xe ô tô chở khách nối toa. 2. người khuyết tật điều khiển xe mô tô ba bánh dùng cho người khuyết tật được cấp giấy phép lái xe hạng a1. người khuyết tật điều khiển xe ô tô số tự động có kết cấu phù hợp với tình trạng khuyết tật thì được cấp giấy phép lái xe hạng b. 3. người điều khiển xe chở hàng bốn bánh có gắn động cơ, xe chở người bốn bánh có gắn động cơ phải sử dụng giấy phép lái xe có hạng phù hợp với xe ô tô tải hoặc xe ô tô chở người tương ứng. 4. người điều khiển xe ô tô có thiết kế, cải tạo với số chỗ ít hơn xe cùng loại, kích thước giới hạn tương đương phải sử dụng giấy phép lái xe có hạng phù hợp với xe ô tô cùng loại, kích thước giới hạn tương đương và có số chỗ nhiều nhất. 5. thời hạn của giấy phép lái xe được quy định như sau: a) giấy phép lái xe các hạng a1, a, b1 không thời hạn; b) giấy phép lái xe hạng b và hạng c1 có thời hạn 10 năm kể từ ngày cấp; c) giấy phép lái xe các hạng c, d1, d2, d, be, c1e, ce, d1e, d2e và de có thời hạn 05 năm kể từ ngày cấp. 6. giấy phép lái xe có giá trị sử dụng trong phạm vi lãnh thổ việt nam bao gồm: a) giấy phép lái xe do cơ quan có thẩm quyền của việt nam cấp; b) giấy phép lái xe quốc tế và giấy phép lái xe quốc gia phù hợp với loại xe được phép điều khiển do quốc gia là thành viên của công ước của liên hợp quốc về giao thông đường bộ năm 1968 (sau đây gọi là công ước viên) cấp; c) giấy phép lái xe phù hợp với loại xe được phép điều khiển của nước hoặc vùng lãnh thổ mà việt nam ký kết điều ước quốc tế hoặc thỏa thuận quốc tế công nhận giấy phép lái xe của nhau; d) giấy phép lái xe nước ngoài phù hợp với loại xe được phép điều khiển do quốc gia được công nhận theo điều ước quốc tế mà nước cộng hòa xã hội chủ nghĩa việt nam là thành viên. 7. giấy phép lái xe không có hiệu lực trong các trường hợp sau đây: a) giấy phép lái xe hết thời hạn sử dụng; b) giấy phép lái xe bị thu hồi theo quy định tại khoản 5 điều 62 của luật này. 8. giấy phép lái xe quốc tế được quy định như sau: a) giấy phép lái xe quốc tế là giấy phép lái xe do cơ quan nhà nước có thẩm quyền của quốc gia là thành viên của công ước viên cấp theo một mẫu thống nhất; có thời hạn không quá 03 năm kể từ ngày cấp và phải phù hợp với thời hạn còn hiệu lực của giấy phép lái xe quốc gia; b) người có giấy phép lái xe quốc tế do quốc gia là thành viên của công ước viên cấp khi lái xe tham gia giao thông đường bộ trên lãnh thổ việt nam phải mang theo giấy phép lái xe quốc tế và giấy phép lái xe quốc gia được cấp phù hợp với hạng xe điều khiển, còn thời hạn sử dụng; phải tuân thủ pháp luật về trật tự, an toàn giao thông đường bộ của việt nam; c) người có giấy phép lái xe quốc tế vi phạm pháp luật về trật tự, an toàn giao thông đường bộ của việt nam mà bị tước quyền sử dụng giấy phép lái xe có thời hạn thì thời gian bị tước quyền sử dụng không quá thời gian người lái xe được phép cư trú tại lãnh thổ việt nam; d) người việt nam hoặc người nước ngoài có thẻ thường trú hoặc thẻ tạm trú tại việt nam có giấy phép lái xe do việt nam hoặc quốc gia là thành viên của điều ước quốc tế mà nước cộng hòa xã hội chủ nghĩa việt nam là thành viên cấp, còn giá trị sử dụng, nếu có nhu cầu được cấp giấy phép lái xe quốc tế. 9. bộ trưởng bộ giao thông vận tải quy định mẫu giấy phép lái xe và giấy phép lái xe quốc tế, trình tự, thủ tục cấp và việc sử dụng giấy phép lái xe, giấy phép lái xe quốc tế; đối với mẫu giấy phép lái xe, trình tự, thủ tục cấp và việc sử dụng giấy phép lái xe của lực lượng quân đội, công an làm nhiệm vụ quốc phòng, an ninh do bộ trưởng bộ quốc phòng, bộ trưởng bộ công an quy định.', '1. nội dung kiểm tra, bao gồm: a) kiểm tra lý thuyết kiến thức pháp luật về trật tự, an toàn giao thông đường bộ được thực hiện theo câu hỏi sát hạch lý thuyết để cấp giấy phép lái xe theo quy định của bộ trưởng bộ giao thông vận tải (sau đây viết gọn là kiểm tra lý thuyết kiến thức pháp luật); b) kiểm tra kiến thức pháp luật về trật tự, an toàn giao thông đường bộ theo mô phỏng các tình huống giao thông trên máy tính theo quy định của bộ trưởng bộ giao thông vận tải (sau đây viết gọn là kiểm tra kiến thức pháp luật theo mô phỏng). 2. phương pháp kiểm tra: a) đối với kiểm tra lý thuyết kiến thức pháp luật, người dự kiểm tra thực hiện bài kiểm tra trắc nghiệm trên máy tính theo phần mềm kiểm tra kiến thức pháp luật về trật tự, an toàn giao thông đường bộ; b) đối với kiểm tra kiến thức pháp luật theo mô phỏng, người dự kiểm tra xử lý các tình huống giao thông theo mô phỏng trên máy tính. 3. thời gian, kết cấu bài kiểm tra và kết quả kiểm tra lý thuyết kiến thức pháp luật đạt yêu cầu: a) người dự kiểm tra có giấy phép lái xe hạng a1 làm bài kiểm tra trong thời gian 19 phút. kết cấu bài kiểm tra gồm 25 câu hỏi trắc nghiệm, mỗi câu hỏi được tính 01 điểm, trong đó có 01 câu hỏi được tính là điểm liệt. kết quả từ 21/25 điểm trở lên là đạt yêu cầu. trường hợp kết quả từ 21/25 điểm trở lên nhưng trả lời sai vào câu hỏi được tính là điểm liệt thì không đạt yêu cầu; b) người dự kiểm tra có giấy phép lái xe hạng a, b1 làm bài kiểm tra trong thời gian 19 phút. kết cấu bài kiểm tra gồm 25 câu hỏi trắc nghiệm, mỗi câu hỏi được tính 01 điểm, trong đó có 01 câu hỏi được tính là điểm liệt. kết quả đạt từ 23/25 điểm trở lên là đạt yêu cầu. trường hợp kết quả từ 23/25 điểm trở lên nhưng trả lời sai vào câu hỏi được tính là điểm liệt thì không đạt yêu cầu; c) người dự kiểm tra có giấy phép lái xe hạng b làm bài kiểm tra trong thời gian 20 phút. kết cấu bài kiểm tra gồm 30 câu hỏi trắc nghiệm, mỗi câu hỏi được tính 01 điểm, trong đó có 01 câu hỏi được tính là điểm liệt. kết quả đạt từ 27/30 điểm trở lên là đạt yêu cầu. trường hợp kết quả từ 27/30 điểm trở lên nhưng trả lời sai vào câu hỏi được tính là điểm liệt thì không đạt yêu cầu; d) người dự kiểm tra có giấy phép lái xe hạng c1 làm bài kiểm tra trong thời gian 22 phút. kết cấu bài kiểm tra gồm 35 câu hỏi trắc nghiệm, mỗi câu hỏi được tính 01 điểm, trong đó có 01 câu hỏi được tính là điểm liệt. kết quả đạt từ 32/35 điểm trở lên là đạt yêu cầu. trường hợp kết quả từ 32/35 điểm trở lên nhưng trả lời sai vào câu hỏi được tính là điểm liệt thì không đạt yêu cầu; đ) người dự kiểm tra có giấy phép lái xe hạng c làm bài kiểm tra trong thời gian 24 phút. kết cấu bài kiểm tra gồm 40 câu hỏi trắc nghiệm, mỗi câu hỏi được tính 01 điểm, trong đó có 01 câu hỏi được tính là điểm liệt. kết quả đạt từ 36/40 điểm trở lên là đạt yêu cầu. trường hợp kết quả từ 36/40 điểm trở lên nhưng trả lời sai vào câu hỏi được tính là điểm liệt thì không đạt yêu cầu; e) người dự kiểm tra có giấy phép lái xe hạng d1, d2, d, be, c1q, ce, d1e, d2e, de làm bài kiểm tra trong thời gian 26 phút. kết cấu bài kiểm tra gồm 45 câu hỏi trắc nghiệm, mỗi câu hỏi được tính 01 điểm, trong đó có 01 câu hỏi được tính là điểm liệt. kết quả đạt từ 41/45 điểm trở lên là đạt yêu cầu. trường hợp kết quả từ 41/45 điểm trở lên nhưng trả lời sai vào câu hỏi được tính là điểm liệt thì không đạt yêu cầu. 4. thời gian, kết cấu bài kiểm tra và kết quả kiểm tra kiến thức pháp luật theo mô phỏng đạt yêu cầu: thời gian kiểm tra không quá 10 phút. bài kiểm tra được thiết kế dưới dạng 10 câu hỏi mô phỏng các tình huống giao thông, mỗi câu hỏi là 01 tình huống tiềm ẩn nguy cơ mất an toàn giao thông, mỗi câu hỏi có số điểm tối đa là 05 điểm và số điểm tối thiểu là 0 điểm. số điểm đạt được của người dự kiểm tra tương ứng với thời điểm nhận biết và xác định tình huống tiềm ẩn nguy cơ mất an toàn giao thông thông qua việc tương tác với máy tính có cài đặt phần mềm mô phỏng. người dự kiểm tra đạt từ 35/50 điểm trở lên là đạt yêu cầu. 5. kết quả kiểm tra đạt yêu cầu được phục hồi điểm giấy phép lái xe: a) đối với trường hợp người có giấy phép lái xe mô tô bị trừ hết điểm: được phục hồi điểm giấy phép lái xe khi có kết quả kiểm tra lý thuyết kiến thức pháp luật đạt yêu cầu quy định tại điểm a, điểm b khoản 3 điều này; b) đối với trường hợp người có giấy phép lái xe ô tô bị trừ hết điểm: được phục hồi điểm giấy phép lái xe khi có kết quả kiểm tra đạt yêu cầu đối với cả 02 nội dung là kiểm tra lý thuyết kiến thức pháp luật và kiểm tra kiến thức pháp luật theo mô phỏng quy định tại các điểm c, d, đ, e khoản 3 và khoản 4 điều này. người có kết quả kiểm tra lý thuyết kiến thức pháp luật không đạt yêu cầu thì không được kiểm tra kiến thức pháp luật theo mô phỏng. người có kết quả kiểm tra lý thuyết kiến thức pháp luật đạt yêu cầu nhưng có kết quả kiểm tra kiến thức pháp luật theo mô phỏng không đạt yêu cầu thì được bảo lưu kết quả kiểm tra lý thuyết kiến thức pháp luật trong thời gian 01 năm, kể từ ngày kiểm tra có kết quả đạt yêu cầu. người dự kiểm tra có kết quả kiểm tra không đạt yêu cầu có thể đăng ký kiểm tra lại sau 07 ngày làm việc, kể từ ngày kết thúc kiểm tra trước đó.', '1. mẫu giấy phép lái xe quân sự a) giấy phép lái xe quân sự thực hiện theo quy định tại mẫu số 08 kèm theo thông tư này; b) cục trưởng cục xe máy - vận tải/tổng cục hậu cần - kỹ thuật có trách nhiệm quản lý việc sử dụng giấy phép lái xe quân sự thuộc phạm vi quản lý của bộ quốc phòng. 2. thời hạn sử dụng giấy phép lái xe quân sự a) giấy phép lái xe quân sự hạng a1, a, b1 là không thời hạn; b) giấy phép lái xe quân sự các hạng b, c1, c, d1, d2, d, c1e, ce, cx có thời hạn 05 năm kể từ ngày cấp; c) trường hợp cấp, đổi do lý do khác thời hạn theo thời hạn ghi trên giấy phép lái xe quân sự. 3. giấy phép lái xe quân sự không có hiệu lực trong các trường hợp sau: a) giấy phép lái xe quân sự hết thời hạn sử dụng được ghi trên giấy phép lái xe; b) giấy phép lái xe quân sự bị trừ hết điểm theo quy định tại điều 7 của thông tư này; c) giấy phép lái xe quân sự có quyết định thu hồi theo khoản 1 điều 47 thông tư này.', '1. quân nhân, công chức quốc phòng, công nhân viên chức quốc phòng, lao động hợp đồng đang phục vụ trong bộ quốc phòng có đủ các điều kiện: tiêu chuẩn về tuổi đời, thời gian công tác, sức khỏe, trình độ văn hóa, phẩm chất chính trị theo quy định của bộ quốc phòng. đối với lao động hợp đồng: chỉ đào tạo nâng hạng khi có đủ điều kiện, tiêu chuẩn quy định tại khoản 1 điều này. 2. đối với người học nâng hạng giấy phép lái xe quân sự phải có thời gian lái xe và số km lái xe an toàn như sau: a) từ hạng b lên hạng c1; hạng c1 lên hạng c, c1e; hạng c lên hạng d1, ce, cx; hạng d1 lên hạng d2; hạng d2 lên hạng d: có thời gian lái xe 02 năm trở lên và 30.000 km lái xe an toàn trở lên (trừ các trường hợp đào tạo chuyển tiếp từ hạng c lên hạng ce hoặc cx theo chỉ tiêu của bộ tổng tham mưu); b) từ hạng b lên hạng c, d1; hạng c1 lên d1; hạng c lên hạng d2; hạng d1 lên hạng d: có thời gian lái xe 03 năm trở lên và có 50.000 km lái xe an toàn trở lên; c) từ hạng b lên hạng d2, từ hạng c1 lên hạng d2, từ hạng c lên hạng d: có thời gian lái xe 05 năm trở lên và 100.000 km lái xe an toàn trở lên. 3. đối với người học nâng hạng giấy phép lái xe quân sự lên hạng d1, d2, d ngoài các quy định tại các khoản 1, 2 điều này phải có bằng tốt nghiệp trung học cơ sở trở lên.']","**Nguồn văn bản:** 36_2024_QH15_444251

**Tên văn bản:** Luật Trật tự, an toàn giao thông đường bộ

**Điều 57:** Giấy phép lái xe

**Nội dung:**

5. Thời hạn của giấy phép lái xe được quy định như sau:

	a) Giấy phép lái xe các hạng A1, A, B1 không thời hạn.

	b) Giấy phép lái xe hạng B và hạng C1 có thời hạn 10 năm kể từ ngày cấp.

	c) Giấy phép lái xe các hạng C, D1, D2, D, BE, C1E, CE, D1E, D2E và DE có thời hạn 05 năm kể từ ngày cấp.


**Tóm lại:** Giấy phép lái xe hạng C1 có thời hạn 10 năm.
",Giấy phép lái xe hạng C1 có thời hạn 10 năm kể từ ngày cấp.,0.8,0.7678764955162561,1.0,0.49999999995
4,Giấy phép lái xe hạng D có thời hạn bao lâu?,"['1. là công dân việt nam, người nước ngoài được phép cư trú hoặc đang làm việc, học tập tại việt nam. 2. người học lái xe để nâng hạng giấy phép lái xe phải đáp ứng theo quy định tại khoản 4 điều 60 luật trật tự, an toàn giao thông đường bộ; trong đó, thời gian lái xe an toàn cho từng hạng giấy phép lái xe được quy định cụ thể như sau: a) hạng b lên c1, b lên c, b lên d1, b lên be, c1 lên c, c1 lên d1, c1 lên d2, c1 lên c1e, c lên d1, c lên d2, d1 lên d2, d1 lên d, d1 lên d1e, d2 lên d, d2 lên d2e, d lên de: thời gian lái xe an toàn từ 02 năm trở lên; b) hạng b lên d2, c lên ce, c lên d: thời gian lái xe an toàn từ 03 năm trở lên. 3. người đã có giấy phép lái xe hạng b số tự động được đăng ký học để cấp mới giấy phép lái xe hạng b số cơ khí (số sàn), người đã có giấy phép lái xe hạng b được đăng ký học để cấp mới giấy phép lái xe hạng c1 và phải học đủ nội dung chương trình đào tạo lái xe theo quy định, hồ sơ của người học lái xe thực hiện theo quy định tại khoản 1 điều 15 thông tư này; trường hợp đạt kết quả sát hạch, cơ quan tổ chức sát hạch có văn bản đề nghị cơ quan đã cấp giấy phép xe cắt góc giấy phép lái xe cũ và có văn bản đề nghị cục đường bộ việt nam xóa số quản lý giấy phép lái xe đã cấp.', '1. giấy phép lái xe bao gồm các hạng sau đây: a) hạng a1 cấp cho người lái xe mô tô hai bánh có dung tích xi-lanh đến 125 cm3 hoặc có công suất động cơ điện đến 11 kw; b) hạng a cấp cho người lái xe mô tô hai bánh có dung tích xi-lanh\xa0 trên 125 cm3\xa0hoặc có công suất động cơ điện trên 11 kw và các loại xe quy định cho giấy phép lái xe hạng a1; c) hạng b1 cấp cho người lái xe mô tô ba bánh và các loại xe quy định cho giấy phép lái xe hạng a1; d) hạng b cấp cho người lái xe ô tô chở người đến 08 chỗ (không kể chỗ của người lái xe); xe ô tô tải và ô tô chuyên dùng có khối lượng toàn bộ theo thiết kế đến 3.500 kg; các loại xe ô tô quy định cho giấy phép lái xe hạng b kéo rơ moóc có khối lượng toàn bộ theo thiết kế đến 750 kg; đ) hạng c1 cấp cho người lái xe ô tô tải và ô tô chuyên dùng có khối lượng toàn bộ theo thiết kế trên 3.500 kg đến 7.500 kg; các loại xe ô tô tải quy định cho giấy phép lái xe hạng c1 kéo rơ moóc có khối lượng toàn bộ theo thiết kế đến 750 kg; các loại xe quy định cho giấy phép lái xe hạng b; e) hạng c cấp cho người lái xe ô tô tải và ô tô chuyên dùng có khối lượng toàn bộ theo thiết kế trên 7.500 kg; các loại xe ô tô tải quy định cho giấy phép lái xe hạng c kéo rơ moóc có khối lượng toàn bộ theo thiết kế đến 750 kg; các loại xe quy định cho giấy phép lái xe hạng b và hạng c1; g) hạng d1 cấp cho người lái xe ô tô chở người trên 08 chỗ (không kể chỗ của người lái xe) đến 16 chỗ (không kể chỗ của người lái xe); các loại xe ô tô chở người quy định cho giấy phép lái xe hạng d1 kéo rơ moóc có khối lượng toàn bộ theo thiết kế đến 750 kg; các loại xe quy định cho giấy phép lái xe các hạng b, c1, c; h) hạng d2 cấp cho người lái xe ô tô chở người (kể cả xe buýt) trên 16 chỗ (không kể chỗ của người lái xe) đến 29 chỗ (không kể chỗ của người lái xe); các loại xe ô tô chở người quy định cho giấy phép lái xe hạng d2 kéo rơ moóc có khối lượng toàn bộ theo thiết kế đến 750 kg; các loại xe quy định cho giấy phép lái xe các hạng b, c1, c, d1; i) hạng d cấp cho người lái xe ô tô chở người (kể cả xe buýt) trên 29 chỗ (không kể chỗ của người lái xe); xe ô tô chở người giường nằm; các loại xe ô tô chở người quy định cho giấy phép lái xe hạng d kéo rơ moóc có khối lượng toàn bộ theo thiết kế đến 750 kg; các loại xe quy định cho giấy phép lái xe các hạng b, c1, c, d1, d2; k) hạng be cấp cho người lái các loại xe ô tô quy định cho giấy phép lái xe hạng b kéo rơ moóc có khối lượng toàn bộ theo thiết kế trên 750 kg; l) hạng c1e cấp cho người lái các loại xe ô tô quy định cho giấy phép lái xe hạng c1 kéo rơ moóc có khối lượng toàn bộ theo thiết kế trên 750 kg; m) hạng ce cấp cho người lái các loại xe ô tô quy định cho giấy phép lái xe hạng c kéo rơ moóc có khối lượng toàn bộ theo thiết kế trên 750 kg; xe ô tô đầu kéo kéo sơ mi rơ moóc; n) hạng d1e cấp cho người lái các loại xe ô tô quy định cho giấy phép lái xe hạng d1 kéo rơ moóc có khối lượng toàn bộ theo thiết kế trên 750 kg; o) hạng d2e cấp cho người lái các loại xe ô tô quy định cho giấy phép lái xe hạng d2 kéo rơ moóc có khối lượng toàn bộ theo thiết kế trên 750 kg; p) hạng de cấp cho người lái các loại xe ô tô quy định cho giấy phép lái xe hạng d kéo rơ moóc có khối lượng toàn bộ theo thiết kế trên 750 kg; xe ô tô chở khách nối toa. 2. người khuyết tật điều khiển xe mô tô ba bánh dùng cho người khuyết tật được cấp giấy phép lái xe hạng a1. người khuyết tật điều khiển xe ô tô số tự động có kết cấu phù hợp với tình trạng khuyết tật thì được cấp giấy phép lái xe hạng b. 3. người điều khiển xe chở hàng bốn bánh có gắn động cơ, xe chở người bốn bánh có gắn động cơ phải sử dụng giấy phép lái xe có hạng phù hợp với xe ô tô tải hoặc xe ô tô chở người tương ứng. 4. người điều khiển xe ô tô có thiết kế, cải tạo với số chỗ ít hơn xe cùng loại, kích thước giới hạn tương đương phải sử dụng giấy phép lái xe có hạng phù hợp với xe ô tô cùng loại, kích thước giới hạn tương đương và có số chỗ nhiều nhất. 5. thời hạn của giấy phép lái xe được quy định như sau: a) giấy phép lái xe các hạng a1, a, b1 không thời hạn; b) giấy phép lái xe hạng b và hạng c1 có thời hạn 10 năm kể từ ngày cấp; c) giấy phép lái xe các hạng c, d1, d2, d, be, c1e, ce, d1e, d2e và de có thời hạn 05 năm kể từ ngày cấp. 6. giấy phép lái xe có giá trị sử dụng trong phạm vi lãnh thổ việt nam bao gồm: a) giấy phép lái xe do cơ quan có thẩm quyền của việt nam cấp; b) giấy phép lái xe quốc tế và giấy phép lái xe quốc gia phù hợp với loại xe được phép điều khiển do quốc gia là thành viên của công ước của liên hợp quốc về giao thông đường bộ năm 1968 (sau đây gọi là công ước viên) cấp; c) giấy phép lái xe phù hợp với loại xe được phép điều khiển của nước hoặc vùng lãnh thổ mà việt nam ký kết điều ước quốc tế hoặc thỏa thuận quốc tế công nhận giấy phép lái xe của nhau; d) giấy phép lái xe nước ngoài phù hợp với loại xe được phép điều khiển do quốc gia được công nhận theo điều ước quốc tế mà nước cộng hòa xã hội chủ nghĩa việt nam là thành viên. 7. giấy phép lái xe không có hiệu lực trong các trường hợp sau đây: a) giấy phép lái xe hết thời hạn sử dụng; b) giấy phép lái xe bị thu hồi theo quy định tại khoản 5 điều 62 của luật này. 8. giấy phép lái xe quốc tế được quy định như sau: a) giấy phép lái xe quốc tế là giấy phép lái xe do cơ quan nhà nước có thẩm quyền của quốc gia là thành viên của công ước viên cấp theo một mẫu thống nhất; có thời hạn không quá 03 năm kể từ ngày cấp và phải phù hợp với thời hạn còn hiệu lực của giấy phép lái xe quốc gia; b) người có giấy phép lái xe quốc tế do quốc gia là thành viên của công ước viên cấp khi lái xe tham gia giao thông đường bộ trên lãnh thổ việt nam phải mang theo giấy phép lái xe quốc tế và giấy phép lái xe quốc gia được cấp phù hợp với hạng xe điều khiển, còn thời hạn sử dụng; phải tuân thủ pháp luật về trật tự, an toàn giao thông đường bộ của việt nam; c) người có giấy phép lái xe quốc tế vi phạm pháp luật về trật tự, an toàn giao thông đường bộ của việt nam mà bị tước quyền sử dụng giấy phép lái xe có thời hạn thì thời gian bị tước quyền sử dụng không quá thời gian người lái xe được phép cư trú tại lãnh thổ việt nam; d) người việt nam hoặc người nước ngoài có thẻ thường trú hoặc thẻ tạm trú tại việt nam có giấy phép lái xe do việt nam hoặc quốc gia là thành viên của điều ước quốc tế mà nước cộng hòa xã hội chủ nghĩa việt nam là thành viên cấp, còn giá trị sử dụng, nếu có nhu cầu được cấp giấy phép lái xe quốc tế. 9. bộ trưởng bộ giao thông vận tải quy định mẫu giấy phép lái xe và giấy phép lái xe quốc tế, trình tự, thủ tục cấp và việc sử dụng giấy phép lái xe, giấy phép lái xe quốc tế; đối với mẫu giấy phép lái xe, trình tự, thủ tục cấp và việc sử dụng giấy phép lái xe của lực lượng quân đội, công an làm nhiệm vụ quốc phòng, an ninh do bộ trưởng bộ quốc phòng, bộ trưởng bộ công an quy định.', '1. mẫu giấy phép lái xe quân sự a) giấy phép lái xe quân sự thực hiện theo quy định tại mẫu số 08 kèm theo thông tư này; b) cục trưởng cục xe máy - vận tải/tổng cục hậu cần - kỹ thuật có trách nhiệm quản lý việc sử dụng giấy phép lái xe quân sự thuộc phạm vi quản lý của bộ quốc phòng. 2. thời hạn sử dụng giấy phép lái xe quân sự a) giấy phép lái xe quân sự hạng a1, a, b1 là không thời hạn; b) giấy phép lái xe quân sự các hạng b, c1, c, d1, d2, d, c1e, ce, cx có thời hạn 05 năm kể từ ngày cấp; c) trường hợp cấp, đổi do lý do khác thời hạn theo thời hạn ghi trên giấy phép lái xe quân sự. 3. giấy phép lái xe quân sự không có hiệu lực trong các trường hợp sau: a) giấy phép lái xe quân sự hết thời hạn sử dụng được ghi trên giấy phép lái xe; b) giấy phép lái xe quân sự bị trừ hết điểm theo quy định tại điều 7 của thông tư này; c) giấy phép lái xe quân sự có quyết định thu hồi theo khoản 1 điều 47 thông tư này.', '1. quân nhân, công chức quốc phòng, công nhân viên chức quốc phòng, lao động hợp đồng đang phục vụ trong bộ quốc phòng đủ 18 tuổi trở lên được cấp giấy phép lái xe quân sự hạng a1, a, b1, b, c1, c. 2. quân nhân, công chức quốc phòng, công nhân viên chức quốc phòng, lao động hợp đồng đang phục vụ trong bộ quốc phòng đủ 24 tuổi trở lên được cấp giấy phép lái xe quân sự hạng d1, d2, c1e, ce, cx. các trường hợp đào tạo chuyển tiếp từ hạng c lên hạng ce hoặc cx theo chỉ tiêu của bộ tổng tham mưu, đủ 19 tuổi trở lên. 3. quân nhân, công chức quốc phòng, công nhân viên chức quốc phòng, lao động hợp đồng đang phục vụ trong bộ quốc phòng đủ 27 tuổi trở lên được cấp giấy phép lái xe quân sự hạng d. độ tuổi tối đa của người được cấp giấy phép lái xe quân sự hạng d là đủ 57 tuổi đối với nam và đủ 55 tuổi đối với nữ. chương ii đào tạo lái xe quân sự mục i. người học', '1. quân nhân, công chức quốc phòng, công nhân viên chức quốc phòng, lao động hợp đồng đang phục vụ trong bộ quốc phòng có đủ các điều kiện: tiêu chuẩn về tuổi đời, thời gian công tác, sức khỏe, trình độ văn hóa, phẩm chất chính trị theo quy định của bộ quốc phòng. đối với lao động hợp đồng: chỉ đào tạo nâng hạng khi có đủ điều kiện, tiêu chuẩn quy định tại khoản 1 điều này. 2. đối với người học nâng hạng giấy phép lái xe quân sự phải có thời gian lái xe và số km lái xe an toàn như sau: a) từ hạng b lên hạng c1; hạng c1 lên hạng c, c1e; hạng c lên hạng d1, ce, cx; hạng d1 lên hạng d2; hạng d2 lên hạng d: có thời gian lái xe 02 năm trở lên và 30.000 km lái xe an toàn trở lên (trừ các trường hợp đào tạo chuyển tiếp từ hạng c lên hạng ce hoặc cx theo chỉ tiêu của bộ tổng tham mưu); b) từ hạng b lên hạng c, d1; hạng c1 lên d1; hạng c lên hạng d2; hạng d1 lên hạng d: có thời gian lái xe 03 năm trở lên và có 50.000 km lái xe an toàn trở lên; c) từ hạng b lên hạng d2, từ hạng c1 lên hạng d2, từ hạng c lên hạng d: có thời gian lái xe 05 năm trở lên và 100.000 km lái xe an toàn trở lên. 3. đối với người học nâng hạng giấy phép lái xe quân sự lên hạng d1, d2, d ngoài các quy định tại các khoản 1, 2 điều này phải có bằng tốt nghiệp trung học cơ sở trở lên.']","**Nguồn văn bản:** 36_2024_QH15_444251

**Tên văn bản:** Luật Trật tự, an toàn giao thông đường bộ

**Điều 57:** Giấy phép lái xe

**Nội dung:**

5. Thời hạn của giấy phép lái xe được quy định như sau:

	a) Giấy phép lái xe các hạng A1, A, B1 không thời hạn.

	b) Giấy phép lái xe hạng B và hạng C1 có thời hạn 10 năm kể từ ngày cấp.

	c) Giấy phép lái xe các hạng C, D1, D2, D, BE, C1E, CE, D1E, D2E và DE có thời hạn 05 năm kể từ ngày cấp.


**Tóm lại:** Thời hạn của giấy phép lái xe hạng D là 05 năm kể từ ngày cấp.
",Giấy phép lái xe hạng D có thời hạn 5 năm kể từ ngày cấp.,0.625,0.7040036859215267,1.0,0.5833333333041666
5,Giấy phép lái xe hạng BE cho phép lái những loại xe nào?,"['1. đào tạo từ xa, tự học có hướng dẫn áp dụng đối với các môn học pháp luật về giao thông đường bộ, đạo đức, văn hóa giao thông và phòng chống tác hại của rượu, bia khi tham gia giao thông và học lý thuyết của các môn: cấu tạo và sửa chữa thông thường; kỹ năng phòng cháy, chữa cháy và cứu nạn, cứu hộ; kỹ thuật lái xe để cấp giấy phép lái xe hạng b, c1, c, d1, d2, d, be, c1e, ce, d1e, d2e và de. 2. người học phải đăng ký tại cơ sở được phép đào tạo để được quản lý theo quy định của bộ giao thông vận tải. mục 2. điều kiện kinh doanh của cơ sở đào tạo lái xe ô tô', '1. yêu cầu đối với việc đổi giấy phép lái xe hoặc bằng lái xe của nước ngoài sang giấy phép lái xe do ngành giao thông vận tải cấp a) người nước ngoài cư trú, làm việc, học tập tại việt nam có giấy phép lái xe quốc gia còn thời hạn sử dụng và có một trong các giấy tờ sau: giấy chứng minh thư ngoại giao, giấy chứng minh thư công vụ, thẻ tạm trú, thẻ cư trú, thẻ lưu trú hoặc thẻ thường trú với thời gian từ 03 tháng trở lên nếu có nhu cầu lái xe ở việt nam được xét đổi sang hạng giấy phép lái xe tương ứng của việt nam; b) người việt nam (mang quốc tịch việt nam) trong thời gian cư trú, học tập, làm việc ở nước ngoài được cơ quan có thẩm quyền nước ngoài cấp giấy phép lái xe quốc gia, còn thời hạn sử dụng, nếu có nhu cầu lái xe tại việt nam được xét đổi sang hạng giấy phép lái xe tương ứng của việt nam; c) không đổi giấy phép lái xe tạm thời của nước ngoài; giấy phép lái xe quốc tế; giấy phép lái xe của nước ngoài quá thời hạn sử dụng, bị tẩy xóa, rách nát không còn đủ thông tin để đổi giấy phép lái xe hoặc có sự khác biệt về nhận dạng; giấy phép lái xe nước ngoài không do cơ quan có thẩm quyền cấp; người việt nam có giấy phép lái xe nước ngoài có thời gian lưu trú tại nước ngoài dưới 03 tháng và thời hạn lưu trú không phù hợp với thời gian đào tạo lái xe của nước cấp giấy phép lái xe. 2. hồ sơ bao gồm: a) đơn đề nghị đổi (cấp lại) giấy phép lái xe (đối với người việt nam theo mẫu quy định tại phụ lục xxvi ban hành kèm theo thông tư này, đối với người nước ngoài theo mẫu quy định tại phụ lục xxvii ban hành kèm theo thông tư này); b) bản dịch giấy phép lái xe nước ngoài ra tiếng việt được bảo chứng chất lượng dịch thuật của cơ quan công chứng tại việt nam, cơ quan đại diện việt nam ở nước ngoài mà người dịch làm việc, đóng dấu giáp lai với bản sao giấy phép lái xe; c) giấy khám sức khỏe của người lái xe do cơ sở khám bệnh, chữa bệnh đủ tiêu chuẩn theo quy định của pháp luật về khám bệnh, chữa bệnh cấp còn hiệu lực (trừ người nước ngoài đổi giấy phép lái xe theo thời hạn ghi trong thị thực nhập cảnh hoặc thẻ tạm trú); d) bản sao hoặc bản sao điện tử được chứng thực từ bản chính hoặc bản sao điện tử được cấp từ sổ gốc của một trong các giấy tờ: thẻ tạm trú, thẻ thường trú hoặc chứng minh thư ngoại giao, chứng minh thư công vụ. 3. trình tự thực hiện a) cá nhân lập 01 bộ hồ sơ theo quy định tại khoản 2 điều này gửi trực tiếp tại sở giao thông vận tải nơi đăng ký cư trú, lưu trú, tạm trú hoặc thường trú; cá nhân phải chụp ảnh trực tiếp tại cơ quan cấp giấy phép lái xe và phải xuất trình bản chính các hồ sơ nêu trên (trừ các bản chính đã gửi) để đối chiếu và phải hoàn thành nghĩa vụ nộp lệ phí khi được tiếp nhận hồ sơ; b) trong thời hạn 05 ngày làm việc, kể từ ngày nhận đủ hồ sơ đúng theo quy định (bao gồm xác thực tài khoản định danh điện tử qua hệ thống định danh và xác thực điện tử), sở giao thông vận tải thực hiện việc đổi giấy phép lái xe; trường hợp không đổi giấy phép lái xe thì phải trả lời bằng văn bản và nêu rõ lý do; c) việc trả giấy phép lái xe được thực hiện tại cơ quan tiếp nhận hồ sơ hoặc thông qua dịch vụ bưu chính theo yêu cầu của cá nhân. 4. hồ sơ đổi giấy phép lái xe do cơ quan đổi giấy phép lái xe giao cho người lái xe quản lý là hồ sơ gốc, gồm các tài liệu quy định tại khoản 2 điều này và giấy phép lái xe nước ngoài. hồ sơ đổi giấy phép lái xe của người nước ngoài không thường trú tại việt nam do cơ quan đổi giấy phép lái xe lưu trữ 01 năm, gồm các tài liệu quy định tại khoản 2 điều này. 5. trường hợp phát hiện có nghi vấn về việc nhập cảnh, cư trú của người nước ngoài tại việt nam, cơ quan cấp đổi giấy phép lái xe có văn bản đề nghị bộ ngoại giao, cục quản lý xuất nhập cảnh thuộc bộ công an, phòng quản lý xuất nhập cảnh thuộc công an tỉnh, thành phố trực thuộc trung ương xác minh. 6. thời hạn sử dụng và hạng xe được phép điều khiển a) thời hạn sử dụng giấy phép lái xe việt nam đổi cho người nước ngoài phù hợp với thời hạn ghi tại một trong các giấy tờ quy định tại điểm a khoản 1 điều này phù hợp với thời hạn sử dụng giấy phép lái xe nước ngoài nhưng không vượt quá thời hạn quy định của giấy phép lái xe việt nam; b) giấy phép lái xe quốc gia cấp cho người đổi được điều khiển nhiều hạng xe khác nhau được đổi sang giấy phép lái xe việt nam để điều khiển các hạng xe tương ứng.', '1. giấy phép lái xe được cấp trước ngày luật này có hiệu lực thi hành được tiếp tục sử dụng theo thời hạn ghi trên giấy phép lái xe. 2. giấy phép lái xe được cấp trước ngày luật này có hiệu lực thi hành nếu chưa thực hiện đổi, cấp lại theo quy định của luật này có hiệu lực sử dụng như sau: a) giấy phép lái xe hạng a1 được tiếp tục điều khiển xe mô tô hai bánh có dung tích xi-lanh từ 50 cm3\xa0đến dưới 175 cm3 hoặc có công suất động cơ điện từ 04 kw đến dưới 14 kw; b) giấy phép lái xe hạng a2 được tiếp tục điều khiển xe mô tô hai bánh có dung tích xi-lanh từ 175 cm3\xa0trở lên hoặc có công suất động cơ điện từ 14 kw trở lên và các loại xe quy định cho giấy phép lái xe hạng a1 quy định tại điểm a khoản này; c) giấy phép lái xe hạng a3 được tiếp tục điều khiển xe mô tô ba bánh, các loại xe quy định cho giấy phép lái xe hạng a1 quy định tại điểm a khoản này và các xe tương tự; d) giấy phép lái xe hạng a4 được tiếp tục điều khiển máy kéo có trọng tải đến 1.000 kg; đ) giấy phép lái xe hạng b1 số tự động cấp cho người không hành nghề lái xe được tiếp tục điều khiển xe ô tô số tự động chở người đến 08 chỗ (không kể chỗ của người lái xe); xe ô tô tải, kể cả ô tô tải chuyên dùng số tự động có trọng tải dưới 3.500 kg; e) giấy phép lái xe hạng b1 cấp cho người không hành nghề lái xe được tiếp tục điều khiển xe ô tô chở người đến 08 chỗ (không kể chỗ của người lái xe); xe ô tô tải, máy kéo có trọng tải dưới 3.500 kg; g) giấy phép lái xe hạng b2 cấp cho người hành nghề lái xe được tiếp tục điều khiển xe ô tô chở người đến 08 chỗ (không kể chỗ của người lái xe); xe ô tô tải, máy kéo có trọng tải dưới 3.500 kg; h) giấy phép lái xe hạng c được tiếp tục điều khiển xe ô tô tải, máy kéo có trọng tải từ 3.500 kg trở lên và các loại xe quy định cho các giấy phép lái xe hạng b1, b2 quy định tại các điểm đ, e và g khoản này; i) giấy phép lái xe hạng d được tiếp tục điều khiển xe ô tô chở người từ 09 chỗ (không kể chỗ của người lái xe) đến 29 chỗ (không kể chỗ của người lái xe) và các loại xe quy định cho các giấy phép lái xe hạng b1, b2, c quy định tại các điểm đ, e, g và h khoản này; k) giấy phép lái xe hạng e được tiếp tục điều khiển xe ô tô chở người trên 29 chỗ (không kể chỗ của người lái xe) và các loại xe quy định cho các giấy phép lái xe hạng b1, b2, c, d quy định tại các điểm đ, e, g, h và i khoản này; l) giấy phép lái xe hạng fb2, fd được tiếp tục điều khiển các loại xe quy định cho giấy phép lái xe hạng b2, d quy định tại điểm g và điểm i khoản này khi kéo rơ moóc; giấy phép lái xe hạng fc được tiếp tục điều khiển các loại xe quy định cho giấy phép lái xe hạng c quy định tại điểm h khoản này khi kéo rơ moóc, đầu kéo kéo sơ mi rơ moóc; giấy phép lái xe hạng fe được tiếp tục điều khiển các loại xe quy định cho giấy phép lái xe hạng e quy định tại điểm k khoản này khi kéo rơ moóc\xa0hoặc xe ô tô chở khách nối toa. 3. trường hợp người có giấy phép lái xe đã được cấp trước ngày luật này có hiệu lực thi hành có nhu cầu đổi, cấp lại giấy phép lái xe thì thực hiện như sau: a) giấy phép lái xe hạng a1 được đổi, cấp lại sang giấy phép lái xe hạng a với điều kiện hạn chế là chỉ được điều khiển xe mô tô hai bánh có dung tích xi-lanh đến dưới 175 cm3 hoặc có công suất động cơ điện đến dưới 14 kw; b) giấy phép lái xe hạng a2 được đổi, cấp lại sang giấy phép lái xe hạng a; c) giấy phép lái xe hạng a3 được đổi, cấp lại sang giấy phép lái xe hạng b1; d) giấy phép lái xe hạng a4 được đổi, cấp lại sang chứng chỉ điều khiển xe máy chuyên dùng cho người điều khiển máy kéo có trọng tải đến 1.000 kg và chứng chỉ bồi dưỡng kiến thức pháp luật về giao thông đường bộ cho người điều khiển xe máy chuyên dùng; đ) giấy phép lái xe hạng b1 số tự động được đổi, cấp lại sang giấy phép lái xe hạng b với điều kiện hạn chế là chỉ được điều khiển xe ô tô số tự động; e) giấy phép lái xe hạng b1, b2 được đổi, cấp lại sang giấy phép lái xe hạng b hoặc hạng c1 và chứng chỉ điều khiển xe máy chuyên dùng cho người điều khiển máy kéo có trọng tải đến 3.500 kg; g) giấy phép lái xe hạng c giữ nguyên và đổi, cấp lại cùng hạng và chứng chỉ điều khiển xe máy chuyên dùng cho người điều khiển máy kéo có trọng tải trên 3.500 kg; h) giấy phép lái xe hạng d được đổi, cấp lại sang giấy phép lái xe hạng d2 và chứng chỉ điều khiển xe máy chuyên dùng cho người điều khiển máy kéo có trọng tải trên 3.500 kg; i) giấy phép lái xe hạng e được đổi, cấp lại sang giấy phép lái xe hạng d và chứng chỉ điều khiển xe máy chuyên dùng cho người điều khiển máy kéo có trọng tải trên 3.500 kg; k) giấy phép lái xe hạng fb2 được đổi, cấp lại sang giấy phép lái xe hạng be hoặc hạng c1e và chứng chỉ điều khiển xe máy chuyên dùng cho người điều khiển máy kéo có trọng tải đến 3.500 kg; l) giấy phép lái xe hạng fc được đổi, cấp lại sang giấy phép lái xe hạng ce và chứng chỉ điều khiển xe máy chuyên dùng cho người điều khiển máy kéo có trọng tải trên 3.500 kg; m) giấy phép lái xe hạng fd được đổi, cấp lại sang giấy phép lái xe hạng d2e và chứng chỉ điều khiển xe máy chuyên dùng cho người điều khiển máy kéo có trọng tải trên 3.500 kg; n) giấy phép lái xe hạng fe được đổi, cấp lại sang giấy phép lái xe hạng de và chứng chỉ điều khiển xe máy chuyên dùng cho người điều khiển máy kéo có trọng tải trên 3.500 kg. 4. người học lái xe đã được đào tạo lái xe trước ngày luật này có hiệu lực thi hành hoặc đang được đào tạo lái xe tại ngày luật này có hiệu lực thi hành chưa được sát hạch, cấp giấy phép lái xe thì được sát hạch, cấp giấy phép lái xe theo hạng giấy phép lái xe đổi, cấp lại quy định tại khoản 3 điều này. 5. chứng nhận đăng ký xe, biển số xe máy chuyên dùng cấp trước ngày luật này có hiệu lực thi hành vẫn có giá trị sử dụng. 6. chứng nhận chất lượng an toàn kỹ thuật và bảo vệ môi trường được cấp trước ngày luật này có hiệu lực thi hành thì có giá trị sử dụng đến hết thời hạn ghi trên giấy chứng nhận đó. 7. việc đấu giá biển số xe ô tô được thực hiện trước ngày luật này có hiệu lực thi hành và đến ngày luật này có hiệu lực thi hành đã được cấp văn bản xác nhận biển số xe ô tô trúng đấu giá thì tiếp tục thực hiện theo nghị quyết số 73/2022/qh15 của quốc hội về thí điểm đấu giá biển số xe ô tô; trường hợp chưa được cấp xác nhận biển số xe ô tô trúng đấu giá thì tiếp tục thực hiện theo nghị quyết số 73/2022/qh15 của quốc hội về thí điểm đấu giá biển số xe ô tô và quy định tại điểm d khoản 1 điều 38 của luật này./. luật này được quốc hội nước cộng hòa xã hội chủ nghĩa việt nam khóa xv, kỳ họp thứ 7 thông qua ngày 27 tháng 6 năm 2024.', '1. giấy phép lái xe bao gồm các hạng sau đây: a) hạng a1 cấp cho người lái xe mô tô hai bánh có dung tích xi-lanh đến 125 cm3 hoặc có công suất động cơ điện đến 11 kw; b) hạng a cấp cho người lái xe mô tô hai bánh có dung tích xi-lanh\xa0 trên 125 cm3\xa0hoặc có công suất động cơ điện trên 11 kw và các loại xe quy định cho giấy phép lái xe hạng a1; c) hạng b1 cấp cho người lái xe mô tô ba bánh và các loại xe quy định cho giấy phép lái xe hạng a1; d) hạng b cấp cho người lái xe ô tô chở người đến 08 chỗ (không kể chỗ của người lái xe); xe ô tô tải và ô tô chuyên dùng có khối lượng toàn bộ theo thiết kế đến 3.500 kg; các loại xe ô tô quy định cho giấy phép lái xe hạng b kéo rơ moóc có khối lượng toàn bộ theo thiết kế đến 750 kg; đ) hạng c1 cấp cho người lái xe ô tô tải và ô tô chuyên dùng có khối lượng toàn bộ theo thiết kế trên 3.500 kg đến 7.500 kg; các loại xe ô tô tải quy định cho giấy phép lái xe hạng c1 kéo rơ moóc có khối lượng toàn bộ theo thiết kế đến 750 kg; các loại xe quy định cho giấy phép lái xe hạng b; e) hạng c cấp cho người lái xe ô tô tải và ô tô chuyên dùng có khối lượng toàn bộ theo thiết kế trên 7.500 kg; các loại xe ô tô tải quy định cho giấy phép lái xe hạng c kéo rơ moóc có khối lượng toàn bộ theo thiết kế đến 750 kg; các loại xe quy định cho giấy phép lái xe hạng b và hạng c1; g) hạng d1 cấp cho người lái xe ô tô chở người trên 08 chỗ (không kể chỗ của người lái xe) đến 16 chỗ (không kể chỗ của người lái xe); các loại xe ô tô chở người quy định cho giấy phép lái xe hạng d1 kéo rơ moóc có khối lượng toàn bộ theo thiết kế đến 750 kg; các loại xe quy định cho giấy phép lái xe các hạng b, c1, c; h) hạng d2 cấp cho người lái xe ô tô chở người (kể cả xe buýt) trên 16 chỗ (không kể chỗ của người lái xe) đến 29 chỗ (không kể chỗ của người lái xe); các loại xe ô tô chở người quy định cho giấy phép lái xe hạng d2 kéo rơ moóc có khối lượng toàn bộ theo thiết kế đến 750 kg; các loại xe quy định cho giấy phép lái xe các hạng b, c1, c, d1; i) hạng d cấp cho người lái xe ô tô chở người (kể cả xe buýt) trên 29 chỗ (không kể chỗ của người lái xe); xe ô tô chở người giường nằm; các loại xe ô tô chở người quy định cho giấy phép lái xe hạng d kéo rơ moóc có khối lượng toàn bộ theo thiết kế đến 750 kg; các loại xe quy định cho giấy phép lái xe các hạng b, c1, c, d1, d2; k) hạng be cấp cho người lái các loại xe ô tô quy định cho giấy phép lái xe hạng b kéo rơ moóc có khối lượng toàn bộ theo thiết kế trên 750 kg; l) hạng c1e cấp cho người lái các loại xe ô tô quy định cho giấy phép lái xe hạng c1 kéo rơ moóc có khối lượng toàn bộ theo thiết kế trên 750 kg; m) hạng ce cấp cho người lái các loại xe ô tô quy định cho giấy phép lái xe hạng c kéo rơ moóc có khối lượng toàn bộ theo thiết kế trên 750 kg; xe ô tô đầu kéo kéo sơ mi rơ moóc; n) hạng d1e cấp cho người lái các loại xe ô tô quy định cho giấy phép lái xe hạng d1 kéo rơ moóc có khối lượng toàn bộ theo thiết kế trên 750 kg; o) hạng d2e cấp cho người lái các loại xe ô tô quy định cho giấy phép lái xe hạng d2 kéo rơ moóc có khối lượng toàn bộ theo thiết kế trên 750 kg; p) hạng de cấp cho người lái các loại xe ô tô quy định cho giấy phép lái xe hạng d kéo rơ moóc có khối lượng toàn bộ theo thiết kế trên 750 kg; xe ô tô chở khách nối toa. 2. người khuyết tật điều khiển xe mô tô ba bánh dùng cho người khuyết tật được cấp giấy phép lái xe hạng a1. người khuyết tật điều khiển xe ô tô số tự động có kết cấu phù hợp với tình trạng khuyết tật thì được cấp giấy phép lái xe hạng b. 3. người điều khiển xe chở hàng bốn bánh có gắn động cơ, xe chở người bốn bánh có gắn động cơ phải sử dụng giấy phép lái xe có hạng phù hợp với xe ô tô tải hoặc xe ô tô chở người tương ứng. 4. người điều khiển xe ô tô có thiết kế, cải tạo với số chỗ ít hơn xe cùng loại, kích thước giới hạn tương đương phải sử dụng giấy phép lái xe có hạng phù hợp với xe ô tô cùng loại, kích thước giới hạn tương đương và có số chỗ nhiều nhất. 5. thời hạn của giấy phép lái xe được quy định như sau: a) giấy phép lái xe các hạng a1, a, b1 không thời hạn; b) giấy phép lái xe hạng b và hạng c1 có thời hạn 10 năm kể từ ngày cấp; c) giấy phép lái xe các hạng c, d1, d2, d, be, c1e, ce, d1e, d2e và de có thời hạn 05 năm kể từ ngày cấp. 6. giấy phép lái xe có giá trị sử dụng trong phạm vi lãnh thổ việt nam bao gồm: a) giấy phép lái xe do cơ quan có thẩm quyền của việt nam cấp; b) giấy phép lái xe quốc tế và giấy phép lái xe quốc gia phù hợp với loại xe được phép điều khiển do quốc gia là thành viên của công ước của liên hợp quốc về giao thông đường bộ năm 1968 (sau đây gọi là công ước viên) cấp; c) giấy phép lái xe phù hợp với loại xe được phép điều khiển của nước hoặc vùng lãnh thổ mà việt nam ký kết điều ước quốc tế hoặc thỏa thuận quốc tế công nhận giấy phép lái xe của nhau; d) giấy phép lái xe nước ngoài phù hợp với loại xe được phép điều khiển do quốc gia được công nhận theo điều ước quốc tế mà nước cộng hòa xã hội chủ nghĩa việt nam là thành viên. 7. giấy phép lái xe không có hiệu lực trong các trường hợp sau đây: a) giấy phép lái xe hết thời hạn sử dụng; b) giấy phép lái xe bị thu hồi theo quy định tại khoản 5 điều 62 của luật này. 8. giấy phép lái xe quốc tế được quy định như sau: a) giấy phép lái xe quốc tế là giấy phép lái xe do cơ quan nhà nước có thẩm quyền của quốc gia là thành viên của công ước viên cấp theo một mẫu thống nhất; có thời hạn không quá 03 năm kể từ ngày cấp và phải phù hợp với thời hạn còn hiệu lực của giấy phép lái xe quốc gia; b) người có giấy phép lái xe quốc tế do quốc gia là thành viên của công ước viên cấp khi lái xe tham gia giao thông đường bộ trên lãnh thổ việt nam phải mang theo giấy phép lái xe quốc tế và giấy phép lái xe quốc gia được cấp phù hợp với hạng xe điều khiển, còn thời hạn sử dụng; phải tuân thủ pháp luật về trật tự, an toàn giao thông đường bộ của việt nam; c) người có giấy phép lái xe quốc tế vi phạm pháp luật về trật tự, an toàn giao thông đường bộ của việt nam mà bị tước quyền sử dụng giấy phép lái xe có thời hạn thì thời gian bị tước quyền sử dụng không quá thời gian người lái xe được phép cư trú tại lãnh thổ việt nam; d) người việt nam hoặc người nước ngoài có thẻ thường trú hoặc thẻ tạm trú tại việt nam có giấy phép lái xe do việt nam hoặc quốc gia là thành viên của điều ước quốc tế mà nước cộng hòa xã hội chủ nghĩa việt nam là thành viên cấp, còn giá trị sử dụng, nếu có nhu cầu được cấp giấy phép lái xe quốc tế. 9. bộ trưởng bộ giao thông vận tải quy định mẫu giấy phép lái xe và giấy phép lái xe quốc tế, trình tự, thủ tục cấp và việc sử dụng giấy phép lái xe, giấy phép lái xe quốc tế; đối với mẫu giấy phép lái xe, trình tự, thủ tục cấp và việc sử dụng giấy phép lái xe của lực lượng quân đội, công an làm nhiệm vụ quốc phòng, an ninh do bộ trưởng bộ quốc phòng, bộ trưởng bộ công an quy định.']","**Nguồn văn bản:** 36_2024_QH15_444251

**Tên văn bản:** Luật Trật tự, an toàn giao thông đường bộ

**Điều 57:** Giấy phép lái xe

**Nội dung:**

1. Giấy phép lái xe bao gồm các hạng sau đây:

        a) Hạng A1 cấp cho người lái xe mô tô hai bánh có dung tích xi-lanh đến 125 cm3 hoặc có công suất động cơ điện đến 11 kW.

        b) Hạng A cấp cho người lái xe mô tô hai bánh có dung tích xi-lanh trên 125 cm3 hoặc có công suất động cơ điện trên 11 kW và các loại xe quy định cho giấy phép lái xe hạng A1.

        c) Hạng B1 cấp cho người lái xe mô tô ba bánh và các loại xe quy định cho giấy phép lái xe hạng A1.

        d) Hạng B cấp cho người lái xe ô tô chở người đến 08 chỗ (không kể chỗ của người lái xe); xe ô tô tải và ô tô chuyên dùng có khối lượng toàn bộ theo thiết kế đến 3.500 kg; các loại xe ô tô quy định cho giấy phép lái xe hạng B kéo rơ moóc có khối lượng toàn bộ theo thiết kế đến 750 kg.

        đ) Hạng C1 cấp cho người lái xe ô tô tải và ô tô chuyên dùng có khối lượng toàn bộ theo thiết kế trên 3.500 kg đến 7.500 kg; các loại xe ô tô tải quy định cho giấy phép lái xe hạng C1 kéo rơ moóc có khối lượng toàn bộ theo thiết kế đến 750 kg; các loại xe quy định cho giấy phép lái xe hạng B.

        e) Hạng C cấp cho người lái xe ô tô tải và ô tô chuyên dùng có khối lượng toàn bộ theo thiết kế trên 7.500 kg; các loại xe ô tô tải quy định cho giấy phép lái xe hạng C kéo rơ moóc có khối lượng toàn bộ theo thiết kế đến 750 kg; các loại xe quy định cho giấy phép lái xe hạng B và hạng C1.

        g) Hạng D1 cấp cho người lái xe ô tô chở người trên 08 chỗ (không kể chỗ của người lái xe) đến 16 chỗ (không kể chỗ của người lái xe); các loại xe ô tô chở người quy định cho giấy phép lái xe hạng D1 kéo rơ moóc có khối lượng toàn bộ theo thiết kế đến 750 kg; các loại xe quy định cho giấy phép lái xe các hạng B, C1, C.

        h) Hạng D2 cấp cho người lái xe ô tô chở người (kể cả xe buýt) trên 16 chỗ (không kể chỗ của người lái xe) đến 29 chỗ (không kể chỗ của người lái xe); các loại xe ô tô chở người quy định cho giấy phép lái xe hạng D2 kéo rơ moóc có khối lượng toàn bộ theo thiết kế đến 750 kg; các loại xe quy định cho giấy phép lái xe các hạng B, C1, C, D1.

        i) Hạng D cấp cho người lái xe ô tô chở người (kể cả xe buýt) trên 29 chỗ (không kể chỗ của người lái xe); xe ô tô chở người giường nằm; các loại xe ô tô chở người quy định cho giấy phép lái xe hạng D kéo rơ moóc có khối lượng toàn bộ theo thiết kế đến 750 kg; các loại xe quy định cho giấy phép lái xe các hạng B, C1, C, D1, D2.

        k) Hạng BE cấp cho người lái các loại xe ô tô quy định cho giấy phép lái xe hạng B kéo rơ moóc có khối lượng toàn bộ theo thiết kế trên 750 kg.

        l) Hạng C1E cấp cho người lái các loại xe ô tô quy định cho giấy phép lái xe hạng C1 kéo rơ moóc có khối lượng toàn bộ theo thiết kế trên 750 kg.

        m) Hạng CE cấp cho người lái các loại xe ô tô quy định cho giấy phép lái xe hạng C kéo rơ moóc có khối lượng toàn bộ theo thiết kế trên 750 kg; xe ô tô đầu kéo kéo sơ mi rơ moóc.

        n) Hạng D1E cấp cho người lái các loại xe ô tô quy định cho giấy phép lái xe hạng D1 kéo rơ moóc có khối lượng toàn bộ theo thiết kế trên 750 kg.

        o) Hạng D2E cấp cho người lái các loại xe ô tô quy định cho giấy phép lái xe hạng D2 kéo rơ moóc có khối lượng toàn bộ theo thiết kế trên 750 kg.

        p) Hạng DE cấp cho người lái các loại xe ô tô quy định cho giấy phép lái xe hạng D kéo rơ moóc có khối lượng toàn bộ theo thiết kế trên 750 kg; xe ô tô chở khách nối toa.


**Tóm lại:** Giấy phép lái xe hạng BE cho phép điều khiển xe ô tô chở người đến 08 chỗ, xe ô tô tải và ô tô chuyên dùng có khối lượng toàn bộ theo thiết kế đến 3.500 kg, được kéo rơ moóc có khối lượng toàn bộ theo thiết kế trên 750 kg.
",Hạng BE cho phép lái xe ô tô chở người đến 9 chỗ ngồi kéo rơ moóc có trọng tải trên 750 kg.,1.0,0.5117391123738069,1.0,0.249999999975
6,Giấy phép lái xe hạng C1E cho phép lái những loại xe nào?,"['1. giấy phép lái xe bao gồm các hạng sau đây: a) hạng a1 cấp cho người lái xe mô tô hai bánh có dung tích xi-lanh đến 125 cm3 hoặc có công suất động cơ điện đến 11 kw; b) hạng a cấp cho người lái xe mô tô hai bánh có dung tích xi-lanh\xa0 trên 125 cm3\xa0hoặc có công suất động cơ điện trên 11 kw và các loại xe quy định cho giấy phép lái xe hạng a1; c) hạng b1 cấp cho người lái xe mô tô ba bánh và các loại xe quy định cho giấy phép lái xe hạng a1; d) hạng b cấp cho người lái xe ô tô chở người đến 08 chỗ (không kể chỗ của người lái xe); xe ô tô tải và ô tô chuyên dùng có khối lượng toàn bộ theo thiết kế đến 3.500 kg; các loại xe ô tô quy định cho giấy phép lái xe hạng b kéo rơ moóc có khối lượng toàn bộ theo thiết kế đến 750 kg; đ) hạng c1 cấp cho người lái xe ô tô tải và ô tô chuyên dùng có khối lượng toàn bộ theo thiết kế trên 3.500 kg đến 7.500 kg; các loại xe ô tô tải quy định cho giấy phép lái xe hạng c1 kéo rơ moóc có khối lượng toàn bộ theo thiết kế đến 750 kg; các loại xe quy định cho giấy phép lái xe hạng b; e) hạng c cấp cho người lái xe ô tô tải và ô tô chuyên dùng có khối lượng toàn bộ theo thiết kế trên 7.500 kg; các loại xe ô tô tải quy định cho giấy phép lái xe hạng c kéo rơ moóc có khối lượng toàn bộ theo thiết kế đến 750 kg; các loại xe quy định cho giấy phép lái xe hạng b và hạng c1; g) hạng d1 cấp cho người lái xe ô tô chở người trên 08 chỗ (không kể chỗ của người lái xe) đến 16 chỗ (không kể chỗ của người lái xe); các loại xe ô tô chở người quy định cho giấy phép lái xe hạng d1 kéo rơ moóc có khối lượng toàn bộ theo thiết kế đến 750 kg; các loại xe quy định cho giấy phép lái xe các hạng b, c1, c; h) hạng d2 cấp cho người lái xe ô tô chở người (kể cả xe buýt) trên 16 chỗ (không kể chỗ của người lái xe) đến 29 chỗ (không kể chỗ của người lái xe); các loại xe ô tô chở người quy định cho giấy phép lái xe hạng d2 kéo rơ moóc có khối lượng toàn bộ theo thiết kế đến 750 kg; các loại xe quy định cho giấy phép lái xe các hạng b, c1, c, d1; i) hạng d cấp cho người lái xe ô tô chở người (kể cả xe buýt) trên 29 chỗ (không kể chỗ của người lái xe); xe ô tô chở người giường nằm; các loại xe ô tô chở người quy định cho giấy phép lái xe hạng d kéo rơ moóc có khối lượng toàn bộ theo thiết kế đến 750 kg; các loại xe quy định cho giấy phép lái xe các hạng b, c1, c, d1, d2; k) hạng be cấp cho người lái các loại xe ô tô quy định cho giấy phép lái xe hạng b kéo rơ moóc có khối lượng toàn bộ theo thiết kế trên 750 kg; l) hạng c1e cấp cho người lái các loại xe ô tô quy định cho giấy phép lái xe hạng c1 kéo rơ moóc có khối lượng toàn bộ theo thiết kế trên 750 kg; m) hạng ce cấp cho người lái các loại xe ô tô quy định cho giấy phép lái xe hạng c kéo rơ moóc có khối lượng toàn bộ theo thiết kế trên 750 kg; xe ô tô đầu kéo kéo sơ mi rơ moóc; n) hạng d1e cấp cho người lái các loại xe ô tô quy định cho giấy phép lái xe hạng d1 kéo rơ moóc có khối lượng toàn bộ theo thiết kế trên 750 kg; o) hạng d2e cấp cho người lái các loại xe ô tô quy định cho giấy phép lái xe hạng d2 kéo rơ moóc có khối lượng toàn bộ theo thiết kế trên 750 kg; p) hạng de cấp cho người lái các loại xe ô tô quy định cho giấy phép lái xe hạng d kéo rơ moóc có khối lượng toàn bộ theo thiết kế trên 750 kg; xe ô tô chở khách nối toa. 2. người khuyết tật điều khiển xe mô tô ba bánh dùng cho người khuyết tật được cấp giấy phép lái xe hạng a1. người khuyết tật điều khiển xe ô tô số tự động có kết cấu phù hợp với tình trạng khuyết tật thì được cấp giấy phép lái xe hạng b. 3. người điều khiển xe chở hàng bốn bánh có gắn động cơ, xe chở người bốn bánh có gắn động cơ phải sử dụng giấy phép lái xe có hạng phù hợp với xe ô tô tải hoặc xe ô tô chở người tương ứng. 4. người điều khiển xe ô tô có thiết kế, cải tạo với số chỗ ít hơn xe cùng loại, kích thước giới hạn tương đương phải sử dụng giấy phép lái xe có hạng phù hợp với xe ô tô cùng loại, kích thước giới hạn tương đương và có số chỗ nhiều nhất. 5. thời hạn của giấy phép lái xe được quy định như sau: a) giấy phép lái xe các hạng a1, a, b1 không thời hạn; b) giấy phép lái xe hạng b và hạng c1 có thời hạn 10 năm kể từ ngày cấp; c) giấy phép lái xe các hạng c, d1, d2, d, be, c1e, ce, d1e, d2e và de có thời hạn 05 năm kể từ ngày cấp. 6. giấy phép lái xe có giá trị sử dụng trong phạm vi lãnh thổ việt nam bao gồm: a) giấy phép lái xe do cơ quan có thẩm quyền của việt nam cấp; b) giấy phép lái xe quốc tế và giấy phép lái xe quốc gia phù hợp với loại xe được phép điều khiển do quốc gia là thành viên của công ước của liên hợp quốc về giao thông đường bộ năm 1968 (sau đây gọi là công ước viên) cấp; c) giấy phép lái xe phù hợp với loại xe được phép điều khiển của nước hoặc vùng lãnh thổ mà việt nam ký kết điều ước quốc tế hoặc thỏa thuận quốc tế công nhận giấy phép lái xe của nhau; d) giấy phép lái xe nước ngoài phù hợp với loại xe được phép điều khiển do quốc gia được công nhận theo điều ước quốc tế mà nước cộng hòa xã hội chủ nghĩa việt nam là thành viên. 7. giấy phép lái xe không có hiệu lực trong các trường hợp sau đây: a) giấy phép lái xe hết thời hạn sử dụng; b) giấy phép lái xe bị thu hồi theo quy định tại khoản 5 điều 62 của luật này. 8. giấy phép lái xe quốc tế được quy định như sau: a) giấy phép lái xe quốc tế là giấy phép lái xe do cơ quan nhà nước có thẩm quyền của quốc gia là thành viên của công ước viên cấp theo một mẫu thống nhất; có thời hạn không quá 03 năm kể từ ngày cấp và phải phù hợp với thời hạn còn hiệu lực của giấy phép lái xe quốc gia; b) người có giấy phép lái xe quốc tế do quốc gia là thành viên của công ước viên cấp khi lái xe tham gia giao thông đường bộ trên lãnh thổ việt nam phải mang theo giấy phép lái xe quốc tế và giấy phép lái xe quốc gia được cấp phù hợp với hạng xe điều khiển, còn thời hạn sử dụng; phải tuân thủ pháp luật về trật tự, an toàn giao thông đường bộ của việt nam; c) người có giấy phép lái xe quốc tế vi phạm pháp luật về trật tự, an toàn giao thông đường bộ của việt nam mà bị tước quyền sử dụng giấy phép lái xe có thời hạn thì thời gian bị tước quyền sử dụng không quá thời gian người lái xe được phép cư trú tại lãnh thổ việt nam; d) người việt nam hoặc người nước ngoài có thẻ thường trú hoặc thẻ tạm trú tại việt nam có giấy phép lái xe do việt nam hoặc quốc gia là thành viên của điều ước quốc tế mà nước cộng hòa xã hội chủ nghĩa việt nam là thành viên cấp, còn giá trị sử dụng, nếu có nhu cầu được cấp giấy phép lái xe quốc tế. 9. bộ trưởng bộ giao thông vận tải quy định mẫu giấy phép lái xe và giấy phép lái xe quốc tế, trình tự, thủ tục cấp và việc sử dụng giấy phép lái xe, giấy phép lái xe quốc tế; đối với mẫu giấy phép lái xe, trình tự, thủ tục cấp và việc sử dụng giấy phép lái xe của lực lượng quân đội, công an làm nhiệm vụ quốc phòng, an ninh do bộ trưởng bộ quốc phòng, bộ trưởng bộ công an quy định.', '1. giấy phép lái xe quân sự, được phân hạng theo quy định của luật trật tự, an toàn giao thông đường bộ, đồng thời phù hợp với đặc thù quân sự của phương tiện cơ giới đường bộ thuộc phạm vi quản lý của bộ quốc phòng. giấy phép lái xe quân sự, gồm: a) hạng a1 cấp cho người điều khiển xe mô tô hai bánh có dung tích xi-lanh đến 125 cm3 hoặc có công suất động cơ điện đến 11 kw; b) hạng a cấp cho người điều khiển xe mô tô hai bánh có dung tích xi-lanh trên 125 cm3 hoặc có công suất động cơ điện trên 11kw và các loại xe quy định cho giấy phép lái xe quân sự hạng a1; c) hạng b1 cấp cho người điều khiển xe mô tô ba bánh và các loại xe quy định cho giấy phép lái xe quân sự hạng a1; d) hạng b cấp cho người điều khiển các loại xe ô tô chở người đến 08 chỗ ngồi (không kể chỗ của người lái xe); xe ô tô tải và ô tô chuyên dùng có khối lượng toàn bộ theo thiết kế đến 3.500 kg; các loại xe ô tô quy định cho giấy phép lái xe hạng b có kéo rơ moóc hoặc vũ khí, khí tài quân sự dạng rơ moóc có khối lượng toàn bộ theo thiết kế đến 750 kg; đ) hạng c1 cấp cho người điều khiển các loại xe ô tô vận tải và ô tô chuyên dùng có khối lượng toàn bộ theo thiết kế trên 3.500 kg đến 7.500 kg; các loại xe ô tô quy định cho giấy phép lái xe hạng c1 kéo rơ moóc hoặc vũ khí, khí tài quân sự dạng rơ moóc có khối lượng toàn bộ theo thiết kế đến 750 kg; các loại xe quy định cho giấy phép lái xe quân sự hạng b; e) hạng c cấp cho người điều khiển các loại xe ô tô tải và ô tô chuyên dùng có khối lượng toàn bộ theo thiết kế trên 7.500 kg; các loại xe ô tô tải quy định cho giấy phép lái xe hạng c kéo rơ moóc hoặc vũ khí, khí tài quân sự dạng rơ moóc có khối lượng toàn bộ theo thiết kế đến 750 kg; các loại xe quy định cho giấy phép lái xe quân sự hạng b và hạng c1; g) hạng d1 cấp cho người điều khiển xe ô tô chở người trên 8 chỗ (không kể chỗ của người lái xe) đến 16 chỗ (không kể chỗ của người lái xe); các loại xe ô tô chở người quy định cho giấy phép lái xe hạng d1 kéo rơ moóc hoặc vũ khí, khí tài quân sự dạng rơ moóc có khối lượng toàn bộ theo thiết kế đến 750 kg; các loại xe quy định cho giấy phép lái xe quân sự hạng b, c1, c; h) hạng d2 cấp cho người điều khiển xe ô tô chở người từ trên 16 đến 29 chỗ (không kể chỗ của người lái xe); các loại xe ô tô chở người quy định cho giấy phép lái xe hạng d2 kéo rơ moóc hoặc vũ khí, khí tài quân sự dạng rơ moóc có khối lượng toàn bộ theo thiết kế đến 750 kg; các loại xe quy định cho giấy phép lái xe quân sự hạng b, c1, c, d1; i) hạng d cấp cho người điều khiển xe ô tô chở người từ trên 29 chỗ (không kể chỗ của người lái xe); các loại xe ô tô chở người quy định cho giấy phép lái xe hạng d kéo rơ moóc hoặc vũ khí, khí tài quân sự dạng rơ moóc có khối lượng toàn bộ theo thiết kế đến 750 kg; các loại xe quy định cho giấy phép lái xe quân sự hạng b, c1, c, d1, d2; k) hạng c1e cấp cho người điều khiển các loại xe ô tô quy định cho giấy phép lái xe hạng c1 kéo rơ moóc hoặc vũ khí, khí tài quân sự dạng rơ moóc có khối lượng toàn bộ theo thiết kế trên 750 kg; l) hạng ce cấp cho người điều khiển các loại xe ô tô quy định cho giấy phép lái xe hạng c kéo rơ moóc hoặc vũ khí, khí tài quân sự dạng rơ moóc có khối lượng toàn bộ theo thiết kế trên 750 kg; xe ô tô đầu kéo kéo sơ mi rơ moóc hoặc khí tài quân sự dạng sơ mi rơ moóc; m) hạng cx cấp cho người đã có giấy phép lái xe quân sự hạng c để điều khiển xe xích kéo vũ khí, khí tài quân sự. 2. người điều khiển xe chở hàng bốn bánh có gắn động cơ, xe chở người bốn bánh có gắn động cơ phải sử dụng giấy phép lái xe có hạng phù hợp với xe ô tô tải và ô tô chở người tương ứng. 3. người điều khiển xe ô tô có thiết kế, cải tạo với số chỗ ngồi ít hơn ô tô cùng loại, kích thước giới hạn tương đương phải sử dụng giấy phép lái xe có hạng phù hợp với ô tô cùng loại, kích thước giới hạn tương đương và có số chỗ ngồi nhiều nhất.']","**Nguồn văn bản:** 36_2024_QH15_444251

**Tên văn bản:** Luật Trật tự, an toàn giao thông đường bộ

**Điều 57:** giấy phép lái xe

**Nội dung:**

1. Giấy phép lái xe bao gồm các hạng sau đây:

        a) Hạng A1 cấp cho người lái xe mô tô hai bánh có dung tích xi-lanh đến 125 cm3 hoặc có công suất động cơ điện đến 11 kW.

        b) Hạng A cấp cho người lái xe mô tô hai bánh có dung tích xi-lanh trên 125 cm3 hoặc có công suất động cơ điện trên 11 kW và các loại xe quy định cho giấy phép lái xe hạng A1.

        c) Hạng B1 cấp cho người lái xe mô tô ba bánh và các loại xe quy định cho giấy phép lái xe hạng A1.

        d) Hạng B cấp cho người lái xe ô tô chở người đến 08 chỗ (không kể chỗ của người lái xe); xe ô tô tải và ô tô chuyên dùng có khối lượng toàn bộ theo thiết kế đến 3.500 kg; các loại xe ô tô quy định cho giấy phép lái xe hạng B kéo rơ moóc có khối lượng toàn bộ theo thiết kế đến 750 kg.

        đ) Hạng C1 cấp cho người lái xe ô tô tải và ô tô chuyên dùng có khối lượng toàn bộ theo thiết kế trên 3.500 kg đến 7.500 kg; các loại xe ô tô tải quy định cho giấy phép lái xe hạng C1 kéo rơ moóc có khối lượng toàn bộ theo thiết kế đến 750 kg; các loại xe quy định cho giấy phép lái xe hạng B.

        e) Hạng C cấp cho người lái xe ô tô tải và ô tô chuyên dùng có khối lượng toàn bộ theo thiết kế trên 7.500 kg; các loại xe ô tô tải quy định cho giấy phép lái xe hạng C kéo rơ moóc có khối lượng toàn bộ theo thiết kế đến 750 kg; các loại xe quy định cho giấy phép lái xe hạng B và hạng C1.

        g) Hạng D1 cấp cho người lái xe ô tô chở người trên 08 chỗ (không kể chỗ của người lái xe) đến 16 chỗ (không kể chỗ của người lái xe); các loại xe ô tô chở người quy định cho giấy phép lái xe hạng D1 kéo rơ moóc có khối lượng toàn bộ theo thiết kế đến 750 kg; các loại xe quy định cho giấy phép lái xe các hạng B, C1, C.
        
        h) Hạng D2 cấp cho người lái xe ô tô chở người (kể cả xe buýt) trên 16 chỗ (không kể chỗ của người lái xe) đến 29 chỗ (không kể chỗ của người lái xe); các loại xe ô tô chở người quy định cho giấy phép lái xe hạng D2 kéo rơ moóc có khối lượng toàn bộ theo thiết kế đến 750 kg; các loại xe quy định cho giấy phép lái xe các hạng B, C1, C, D1.

        i) Hạng D cấp cho người lái xe ô tô chở người (kể cả xe buýt) trên 29 chỗ (không kể chỗ của người lái xe); xe ô tô chở người giường nằm; các loại xe ô tô chở người quy định cho giấy phép lái xe hạng D kéo rơ moóc có khối lượng toàn bộ theo thiết kế đến 750 kg; các loại xe quy định cho giấy phép lái xe các hạng B, C1, C, D1, D2.

        k) Hạng BE cấp cho người lái các loại xe ô tô quy định cho giấy phép lái xe hạng B kéo rơ moóc có khối lượng toàn bộ theo thiết kế trên 750 kg.

        l) Hạng C1E cấp cho người lái các loại xe ô tô quy định cho giấy phép lái xe hạng C1 kéo rơ moóc có khối lượng toàn bộ theo thiết kế trên 750 kg.

        m) Hạng CE cấp cho người lái các loại xe ô tô quy định cho giấy phép lái xe hạng C kéo rơ moóc có khối lượng toàn bộ theo thiết kế trên 750 kg; xe ô tô đầu kéo kéo sơ mi rơ moóc.

        n) Hạng D1E cấp cho người lái các loại xe ô tô quy định cho giấy phép lái xe hạng D1 kéo rơ moóc có khối lượng toàn bộ theo thiết kế trên 750 kg.

        o) Hạng D2E cấp cho người lái các loại xe ô tô quy định cho giấy phép lái xe hạng D2 kéo rơ moóc có khối lượng toàn bộ theo thiết kế trên 750 kg.

        p) Hạng DE cấp cho người lái các loại xe ô tô quy định cho giấy phép lái xe hạng D kéo rơ moóc có khối lượng toàn bộ theo thiết kế trên 750 kg; xe ô tô chở khách nối toa.


2. Người khuyết tật điều khiển xe mô tô ba bánh dùng cho người khuyết tật được cấp giấy phép lái xe hạng A1. Người khuyết tật điều khiển xe ô tô số tự động có kết cấu phù hợp với tình trạng khuyết tật thì được cấp giấy phép lái xe hạng B.

3. Người điều khiển xe chở hàng bốn bánh có gắn động cơ, xe chở người bốn bánh có gắn động cơ phải sử dụng giấy phép lái xe có hạng phù hợp với xe ô tô tải hoặc xe ô tô chở người tương ứng.

4. Người điều khiển xe ô tô có thiết kế, cải tạo với số chỗ ít hơn xe cùng loại, kích thước giới hạn tương đương phải sử dụng giấy phép lái xe có hạng phù hợp với xe ô tô cùng loại, kích thước giới hạn tương đương và có số chỗ nhiều nhất.

5. Thời hạn của giấy phép lái xe được quy định như sau:

        a) Giấy phép lái xe các hạng A1, A, B1 không thời hạn.

        b) Giấy phép lái xe hạng B và hạng C1 có thời hạn 10 năm kể từ ngày cấp.

        c) Giấy phép lái xe các hạng C, D1, D2, D, BE, C1E, CE, D1E, D2E và DE có thời hạn 05 năm kể từ ngày cấp.


**Tóm lại:** Giấy phép lái xe hạng C1E cho phép lái các loại xe ô tô quy định cho giấy phép lái xe hạng C1 kéo rơ moóc có khối lượng toàn bộ theo thiết kế trên 750 kg.  Hạng C1 là xe ô tô tải và ô tô chuyên dùng có khối lượng toàn bộ theo thiết kế trên 3.500 kg đến 7.500 kg.
",Hạng C1E cho phép lái xe ô tô tải có trọng tải từ 3.500 kg đến 7.500 kg kéo rơ moóc có trọng tải trên 750 kg.,1.0,0.84852858736028,1.0,0.99999999995
7,Giấy phép lái xe hạng D1E cho phép lái những loại xe nào?,"['1. đào tạo từ xa, tự học có hướng dẫn áp dụng đối với các môn học pháp luật về giao thông đường bộ, đạo đức, văn hóa giao thông và phòng chống tác hại của rượu, bia khi tham gia giao thông và học lý thuyết của các môn: cấu tạo và sửa chữa thông thường; kỹ năng phòng cháy, chữa cháy và cứu nạn, cứu hộ; kỹ thuật lái xe để cấp giấy phép lái xe hạng b, c1, c, d1, d2, d, be, c1e, ce, d1e, d2e và de. 2. người học phải đăng ký tại cơ sở được phép đào tạo để được quản lý theo quy định của bộ giao thông vận tải. mục 2. điều kiện kinh doanh của cơ sở đào tạo lái xe ô tô', '1. giấy phép lái xe bao gồm các hạng sau đây: a) hạng a1 cấp cho người lái xe mô tô hai bánh có dung tích xi-lanh đến 125 cm3 hoặc có công suất động cơ điện đến 11 kw; b) hạng a cấp cho người lái xe mô tô hai bánh có dung tích xi-lanh\xa0 trên 125 cm3\xa0hoặc có công suất động cơ điện trên 11 kw và các loại xe quy định cho giấy phép lái xe hạng a1; c) hạng b1 cấp cho người lái xe mô tô ba bánh và các loại xe quy định cho giấy phép lái xe hạng a1; d) hạng b cấp cho người lái xe ô tô chở người đến 08 chỗ (không kể chỗ của người lái xe); xe ô tô tải và ô tô chuyên dùng có khối lượng toàn bộ theo thiết kế đến 3.500 kg; các loại xe ô tô quy định cho giấy phép lái xe hạng b kéo rơ moóc có khối lượng toàn bộ theo thiết kế đến 750 kg; đ) hạng c1 cấp cho người lái xe ô tô tải và ô tô chuyên dùng có khối lượng toàn bộ theo thiết kế trên 3.500 kg đến 7.500 kg; các loại xe ô tô tải quy định cho giấy phép lái xe hạng c1 kéo rơ moóc có khối lượng toàn bộ theo thiết kế đến 750 kg; các loại xe quy định cho giấy phép lái xe hạng b; e) hạng c cấp cho người lái xe ô tô tải và ô tô chuyên dùng có khối lượng toàn bộ theo thiết kế trên 7.500 kg; các loại xe ô tô tải quy định cho giấy phép lái xe hạng c kéo rơ moóc có khối lượng toàn bộ theo thiết kế đến 750 kg; các loại xe quy định cho giấy phép lái xe hạng b và hạng c1; g) hạng d1 cấp cho người lái xe ô tô chở người trên 08 chỗ (không kể chỗ của người lái xe) đến 16 chỗ (không kể chỗ của người lái xe); các loại xe ô tô chở người quy định cho giấy phép lái xe hạng d1 kéo rơ moóc có khối lượng toàn bộ theo thiết kế đến 750 kg; các loại xe quy định cho giấy phép lái xe các hạng b, c1, c; h) hạng d2 cấp cho người lái xe ô tô chở người (kể cả xe buýt) trên 16 chỗ (không kể chỗ của người lái xe) đến 29 chỗ (không kể chỗ của người lái xe); các loại xe ô tô chở người quy định cho giấy phép lái xe hạng d2 kéo rơ moóc có khối lượng toàn bộ theo thiết kế đến 750 kg; các loại xe quy định cho giấy phép lái xe các hạng b, c1, c, d1; i) hạng d cấp cho người lái xe ô tô chở người (kể cả xe buýt) trên 29 chỗ (không kể chỗ của người lái xe); xe ô tô chở người giường nằm; các loại xe ô tô chở người quy định cho giấy phép lái xe hạng d kéo rơ moóc có khối lượng toàn bộ theo thiết kế đến 750 kg; các loại xe quy định cho giấy phép lái xe các hạng b, c1, c, d1, d2; k) hạng be cấp cho người lái các loại xe ô tô quy định cho giấy phép lái xe hạng b kéo rơ moóc có khối lượng toàn bộ theo thiết kế trên 750 kg; l) hạng c1e cấp cho người lái các loại xe ô tô quy định cho giấy phép lái xe hạng c1 kéo rơ moóc có khối lượng toàn bộ theo thiết kế trên 750 kg; m) hạng ce cấp cho người lái các loại xe ô tô quy định cho giấy phép lái xe hạng c kéo rơ moóc có khối lượng toàn bộ theo thiết kế trên 750 kg; xe ô tô đầu kéo kéo sơ mi rơ moóc; n) hạng d1e cấp cho người lái các loại xe ô tô quy định cho giấy phép lái xe hạng d1 kéo rơ moóc có khối lượng toàn bộ theo thiết kế trên 750 kg; o) hạng d2e cấp cho người lái các loại xe ô tô quy định cho giấy phép lái xe hạng d2 kéo rơ moóc có khối lượng toàn bộ theo thiết kế trên 750 kg; p) hạng de cấp cho người lái các loại xe ô tô quy định cho giấy phép lái xe hạng d kéo rơ moóc có khối lượng toàn bộ theo thiết kế trên 750 kg; xe ô tô chở khách nối toa. 2. người khuyết tật điều khiển xe mô tô ba bánh dùng cho người khuyết tật được cấp giấy phép lái xe hạng a1. người khuyết tật điều khiển xe ô tô số tự động có kết cấu phù hợp với tình trạng khuyết tật thì được cấp giấy phép lái xe hạng b. 3. người điều khiển xe chở hàng bốn bánh có gắn động cơ, xe chở người bốn bánh có gắn động cơ phải sử dụng giấy phép lái xe có hạng phù hợp với xe ô tô tải hoặc xe ô tô chở người tương ứng. 4. người điều khiển xe ô tô có thiết kế, cải tạo với số chỗ ít hơn xe cùng loại, kích thước giới hạn tương đương phải sử dụng giấy phép lái xe có hạng phù hợp với xe ô tô cùng loại, kích thước giới hạn tương đương và có số chỗ nhiều nhất. 5. thời hạn của giấy phép lái xe được quy định như sau: a) giấy phép lái xe các hạng a1, a, b1 không thời hạn; b) giấy phép lái xe hạng b và hạng c1 có thời hạn 10 năm kể từ ngày cấp; c) giấy phép lái xe các hạng c, d1, d2, d, be, c1e, ce, d1e, d2e và de có thời hạn 05 năm kể từ ngày cấp. 6. giấy phép lái xe có giá trị sử dụng trong phạm vi lãnh thổ việt nam bao gồm: a) giấy phép lái xe do cơ quan có thẩm quyền của việt nam cấp; b) giấy phép lái xe quốc tế và giấy phép lái xe quốc gia phù hợp với loại xe được phép điều khiển do quốc gia là thành viên của công ước của liên hợp quốc về giao thông đường bộ năm 1968 (sau đây gọi là công ước viên) cấp; c) giấy phép lái xe phù hợp với loại xe được phép điều khiển của nước hoặc vùng lãnh thổ mà việt nam ký kết điều ước quốc tế hoặc thỏa thuận quốc tế công nhận giấy phép lái xe của nhau; d) giấy phép lái xe nước ngoài phù hợp với loại xe được phép điều khiển do quốc gia được công nhận theo điều ước quốc tế mà nước cộng hòa xã hội chủ nghĩa việt nam là thành viên. 7. giấy phép lái xe không có hiệu lực trong các trường hợp sau đây: a) giấy phép lái xe hết thời hạn sử dụng; b) giấy phép lái xe bị thu hồi theo quy định tại khoản 5 điều 62 của luật này. 8. giấy phép lái xe quốc tế được quy định như sau: a) giấy phép lái xe quốc tế là giấy phép lái xe do cơ quan nhà nước có thẩm quyền của quốc gia là thành viên của công ước viên cấp theo một mẫu thống nhất; có thời hạn không quá 03 năm kể từ ngày cấp và phải phù hợp với thời hạn còn hiệu lực của giấy phép lái xe quốc gia; b) người có giấy phép lái xe quốc tế do quốc gia là thành viên của công ước viên cấp khi lái xe tham gia giao thông đường bộ trên lãnh thổ việt nam phải mang theo giấy phép lái xe quốc tế và giấy phép lái xe quốc gia được cấp phù hợp với hạng xe điều khiển, còn thời hạn sử dụng; phải tuân thủ pháp luật về trật tự, an toàn giao thông đường bộ của việt nam; c) người có giấy phép lái xe quốc tế vi phạm pháp luật về trật tự, an toàn giao thông đường bộ của việt nam mà bị tước quyền sử dụng giấy phép lái xe có thời hạn thì thời gian bị tước quyền sử dụng không quá thời gian người lái xe được phép cư trú tại lãnh thổ việt nam; d) người việt nam hoặc người nước ngoài có thẻ thường trú hoặc thẻ tạm trú tại việt nam có giấy phép lái xe do việt nam hoặc quốc gia là thành viên của điều ước quốc tế mà nước cộng hòa xã hội chủ nghĩa việt nam là thành viên cấp, còn giá trị sử dụng, nếu có nhu cầu được cấp giấy phép lái xe quốc tế. 9. bộ trưởng bộ giao thông vận tải quy định mẫu giấy phép lái xe và giấy phép lái xe quốc tế, trình tự, thủ tục cấp và việc sử dụng giấy phép lái xe, giấy phép lái xe quốc tế; đối với mẫu giấy phép lái xe, trình tự, thủ tục cấp và việc sử dụng giấy phép lái xe của lực lượng quân đội, công an làm nhiệm vụ quốc phòng, an ninh do bộ trưởng bộ quốc phòng, bộ trưởng bộ công an quy định.', '1. người có nhu cầu được cấp giấy phép lái xe phải được đào tạo nội dung lý thuyết và thực hành theo chương trình đào tạo quy định cho từng hạng giấy phép lái xe. 2. người học lái xe phải được đào tạo tại các cơ sở đào tạo lái xe hoặc các hình thức đào tạo lái xe khác để cấp mới hoặc nâng hạng giấy phép lái xe. 3. việc đào tạo để nâng hạng giấy phép lái xe thực hiện đối với những đối tượng sau đây: a) nâng hạng giấy phép lái xe từ hạng b lên hạng c1 hoặc lên hạng c hoặc lên hạng d1 hoặc lên hạng d2; b) nâng hạng giấy phép lái xe từ hạng c1 lên hạng c hoặc lên hạng d1 hoặc lên hạng d2; c) nâng hạng giấy phép lái xe từ hạng c lên hạng d1 hoặc lên hạng d2 hoặc lên hạng d; d) nâng hạng giấy phép lái xe từ hạng d1 lên hạng d2 hoặc lên hạng d; đ) nâng hạng giấy phép lái xe từ hạng d2 lên hạng d; e) nâng hạng giấy phép lái xe từ hạng b lên hạng be, từ hạng c1 lên\xa0 hạng c1e, từ hạng c lên hạng ce, từ hạng d1 lên hạng d1e, từ hạng d2 lên hạng d2e, từ hạng d lên hạng de. 4.\xa0người có nhu cầu được đào tạo nâng hạng giấy phép lái xe khi giấy phép lái xe còn hiệu lực, phải có đủ thời gian lái xe an toàn quy định cho từng hạng giấy phép lái xe;\xa0đối với việc nâng hạng giấy phép lái xe lên hạng d1, d2, d thì người có nhu cầu được đào tạo còn phải có trình độ từ trung học cơ sở trở lên. 5. giấy phép lái xe các hạng c, d1, d2, d, be, c1e, ce, d1e, d2e, de phải được đào tạo bằng hình thức đào tạo nâng hạng theo các điều kiện quy định tại khoản 3 và khoản 4 điều này. 6. cơ sở đào tạo lái xe ô tô phải đáp ứng các điều kiện do chính phủ quy định; có giáo trình, giáo án; thực hiện đào tạo theo đúng hình thức, nội dung và chương trình quy định cho từng hạng giấy phép lái xe. 7. chính phủ quy định chi tiết các hình thức đào tạo lái xe khác quy định tại khoản 2 điều này; quy định trình tự, thủ tục kiểm tra, đánh giá để cấp, cấp lại và thu hồi giấy phép xe tập lái; quy định tiêu chuẩn của giáo viên dạy lái xe; quy định việc cấp, cấp lại và thu hồi giấy chứng nhận giáo viên dạy lái xe; quy định việc cấp, cấp lại và thu hồi giấy phép đào tạo lái xe. 8. bộ trưởng bộ giao thông vận tải quy định hình thức, nội dung, chương trình đào tạo lái xe, thời gian lái xe an toàn cho từng hạng giấy phép lái xe quy định tại khoản 4 điều này và quy định tiêu chuẩn của cơ sở đào tạo lái xe mô tô; đối với cơ sở đào tạo, tổ chức đào tạo lái xe cho lực lượng quân đội, công an làm nhiệm vụ quốc phòng, an ninh do bộ trưởng bộ quốc phòng, bộ trưởng bộ công an quy định.', '1. giấy phép lái xe quân sự, được phân hạng theo quy định của luật trật tự, an toàn giao thông đường bộ, đồng thời phù hợp với đặc thù quân sự của phương tiện cơ giới đường bộ thuộc phạm vi quản lý của bộ quốc phòng. giấy phép lái xe quân sự, gồm: a) hạng a1 cấp cho người điều khiển xe mô tô hai bánh có dung tích xi-lanh đến 125 cm3 hoặc có công suất động cơ điện đến 11 kw; b) hạng a cấp cho người điều khiển xe mô tô hai bánh có dung tích xi-lanh trên 125 cm3 hoặc có công suất động cơ điện trên 11kw và các loại xe quy định cho giấy phép lái xe quân sự hạng a1; c) hạng b1 cấp cho người điều khiển xe mô tô ba bánh và các loại xe quy định cho giấy phép lái xe quân sự hạng a1; d) hạng b cấp cho người điều khiển các loại xe ô tô chở người đến 08 chỗ ngồi (không kể chỗ của người lái xe); xe ô tô tải và ô tô chuyên dùng có khối lượng toàn bộ theo thiết kế đến 3.500 kg; các loại xe ô tô quy định cho giấy phép lái xe hạng b có kéo rơ moóc hoặc vũ khí, khí tài quân sự dạng rơ moóc có khối lượng toàn bộ theo thiết kế đến 750 kg; đ) hạng c1 cấp cho người điều khiển các loại xe ô tô vận tải và ô tô chuyên dùng có khối lượng toàn bộ theo thiết kế trên 3.500 kg đến 7.500 kg; các loại xe ô tô quy định cho giấy phép lái xe hạng c1 kéo rơ moóc hoặc vũ khí, khí tài quân sự dạng rơ moóc có khối lượng toàn bộ theo thiết kế đến 750 kg; các loại xe quy định cho giấy phép lái xe quân sự hạng b; e) hạng c cấp cho người điều khiển các loại xe ô tô tải và ô tô chuyên dùng có khối lượng toàn bộ theo thiết kế trên 7.500 kg; các loại xe ô tô tải quy định cho giấy phép lái xe hạng c kéo rơ moóc hoặc vũ khí, khí tài quân sự dạng rơ moóc có khối lượng toàn bộ theo thiết kế đến 750 kg; các loại xe quy định cho giấy phép lái xe quân sự hạng b và hạng c1; g) hạng d1 cấp cho người điều khiển xe ô tô chở người trên 8 chỗ (không kể chỗ của người lái xe) đến 16 chỗ (không kể chỗ của người lái xe); các loại xe ô tô chở người quy định cho giấy phép lái xe hạng d1 kéo rơ moóc hoặc vũ khí, khí tài quân sự dạng rơ moóc có khối lượng toàn bộ theo thiết kế đến 750 kg; các loại xe quy định cho giấy phép lái xe quân sự hạng b, c1, c; h) hạng d2 cấp cho người điều khiển xe ô tô chở người từ trên 16 đến 29 chỗ (không kể chỗ của người lái xe); các loại xe ô tô chở người quy định cho giấy phép lái xe hạng d2 kéo rơ moóc hoặc vũ khí, khí tài quân sự dạng rơ moóc có khối lượng toàn bộ theo thiết kế đến 750 kg; các loại xe quy định cho giấy phép lái xe quân sự hạng b, c1, c, d1; i) hạng d cấp cho người điều khiển xe ô tô chở người từ trên 29 chỗ (không kể chỗ của người lái xe); các loại xe ô tô chở người quy định cho giấy phép lái xe hạng d kéo rơ moóc hoặc vũ khí, khí tài quân sự dạng rơ moóc có khối lượng toàn bộ theo thiết kế đến 750 kg; các loại xe quy định cho giấy phép lái xe quân sự hạng b, c1, c, d1, d2; k) hạng c1e cấp cho người điều khiển các loại xe ô tô quy định cho giấy phép lái xe hạng c1 kéo rơ moóc hoặc vũ khí, khí tài quân sự dạng rơ moóc có khối lượng toàn bộ theo thiết kế trên 750 kg; l) hạng ce cấp cho người điều khiển các loại xe ô tô quy định cho giấy phép lái xe hạng c kéo rơ moóc hoặc vũ khí, khí tài quân sự dạng rơ moóc có khối lượng toàn bộ theo thiết kế trên 750 kg; xe ô tô đầu kéo kéo sơ mi rơ moóc hoặc khí tài quân sự dạng sơ mi rơ moóc; m) hạng cx cấp cho người đã có giấy phép lái xe quân sự hạng c để điều khiển xe xích kéo vũ khí, khí tài quân sự. 2. người điều khiển xe chở hàng bốn bánh có gắn động cơ, xe chở người bốn bánh có gắn động cơ phải sử dụng giấy phép lái xe có hạng phù hợp với xe ô tô tải và ô tô chở người tương ứng. 3. người điều khiển xe ô tô có thiết kế, cải tạo với số chỗ ngồi ít hơn ô tô cùng loại, kích thước giới hạn tương đương phải sử dụng giấy phép lái xe có hạng phù hợp với ô tô cùng loại, kích thước giới hạn tương đương và có số chỗ ngồi nhiều nhất.']","**Nguồn văn bản:** 36_2024_QH15_444251

**Tên văn bản:** Luật Trật tự, an toàn giao thông đường bộ

**Điều 57:** Giấy phép lái xe

**Nội dung:**

1. Giấy phép lái xe bao gồm các hạng sau đây:

        a) Hạng A1 cấp cho người lái xe mô tô hai bánh có dung tích xi-lanh đến 125 cm3 hoặc có công suất động cơ điện đến 11 kW.

        b) Hạng A cấp cho người lái xe mô tô hai bánh có dung tích xi-lanh trên 125 cm3 hoặc có công suất động cơ điện trên 11 kW và các loại xe quy định cho giấy phép lái xe hạng A1.

        c) Hạng B1 cấp cho người lái xe mô tô ba bánh và các loại xe quy định cho giấy phép lái xe hạng A1.

        d) Hạng B cấp cho người lái xe ô tô chở người đến 08 chỗ (không kể chỗ của người lái xe); xe ô tô tải và ô tô chuyên dùng có khối lượng toàn bộ theo thiết kế đến 3.500 kg; các loại xe ô tô quy định cho giấy phép lái xe hạng B kéo rơ moóc có khối lượng toàn bộ theo thiết kế đến 750 kg.

        đ) Hạng C1 cấp cho người lái xe ô tô tải và ô tô chuyên dùng có khối lượng toàn bộ theo thiết kế trên 3.500 kg đến 7.500 kg; các loại xe ô tô tải quy định cho giấy phép lái xe hạng C1 kéo rơ moóc có khối lượng toàn bộ theo thiết kế đến 750 kg; các loại xe quy định cho giấy phép lái xe hạng B.

        e) Hạng C cấp cho người lái xe ô tô tải và ô tô chuyên dùng có khối lượng toàn bộ theo thiết kế trên 7.500 kg; các loại xe ô tô tải quy định cho giấy phép lái xe hạng C kéo rơ moóc có khối lượng toàn bộ theo thiết kế đến 750 kg; các loại xe quy định cho giấy phép lái xe hạng B và hạng C1.

        g) Hạng D1 cấp cho người lái xe ô tô chở người trên 08 chỗ (không kể chỗ của người lái xe) đến 16 chỗ (không kể chỗ của người lái xe); các loại xe ô tô chở người quy định cho giấy phép lái xe hạng D1 kéo rơ moóc có khối lượng toàn bộ theo thiết kế đến 750 kg; các loại xe quy định cho giấy phép lái xe các hạng B, C1, C.

        h) Hạng D2 cấp cho người lái xe ô tô chở người (kể cả xe buýt) trên 16 chỗ (không kể chỗ của người lái xe) đến 29 chỗ (không kể chỗ của người lái xe); các loại xe ô tô chở người quy định cho giấy phép lái xe hạng D2 kéo rơ moóc có khối lượng toàn bộ theo thiết kế đến 750 kg; các loại xe quy định cho giấy phép lái xe các hạng B, C1, C, D1.

        i) Hạng D cấp cho người lái xe ô tô chở người (kể cả xe buýt) trên 29 chỗ (không kể chỗ của người lái xe); xe ô tô chở người giường nằm; các loại xe ô tô chở người quy định cho giấy phép lái xe hạng D kéo rơ moóc có khối lượng toàn bộ theo thiết kế đến 750 kg; các loại xe quy định cho giấy phép lái xe các hạng B, C1, C, D1, D2.

        k) Hạng BE cấp cho người lái các loại xe ô tô quy định cho giấy phép lái xe hạng B kéo rơ moóc có khối lượng toàn bộ theo thiết kế trên 750 kg.

        l) Hạng C1E cấp cho người lái các loại xe ô tô quy định cho giấy phép lái xe hạng C1 kéo rơ moóc có khối lượng toàn bộ theo thiết kế trên 750 kg.

        m) Hạng CE cấp cho người lái các loại xe ô tô quy định cho giấy phép lái xe hạng C kéo rơ moóc có khối lượng toàn bộ theo thiết kế trên 750 kg; xe ô tô đầu kéo kéo sơ mi rơ moóc.

        n) Hạng D1E cấp cho người lái các loại xe ô tô quy định cho giấy phép lái xe hạng D1 kéo rơ moóc có khối lượng toàn bộ theo thiết kế trên 750 kg.

        o) Hạng D2E cấp cho người lái các loại xe ô tô quy định cho giấy phép lái xe hạng D2 kéo rơ moóc có khối lượng toàn bộ theo thiết kế trên 750 kg.

        p) Hạng DE cấp cho người lái các loại xe ô tô quy định cho giấy phép lái xe hạng D kéo rơ moóc có khối lượng toàn bộ theo thiết kế trên 750 kg; xe ô tô chở khách nối toa.


**Tóm lại:** Giấy phép lái xe hạng D1E cấp cho người lái các loại xe ô tô quy định cho giấy phép lái xe hạng D1 (xe ô tô chở người từ 09 chỗ đến 16 chỗ) kéo rơ moóc có khối lượng toàn bộ theo thiết kế trên 750 kg.
",Hạng D1E cho phép lái xe ô tô chở người từ 10 đến 30 chỗ ngồi kéo rơ moóc có trọng tải trên 750 kg.,1.0,0.4479732434727348,0.0,0.49999999995
8,Giấy phép lái xe hạng D2E cho phép lái những loại xe nào?,"['1. đào tạo từ xa, tự học có hướng dẫn áp dụng đối với các môn học pháp luật về giao thông đường bộ, đạo đức, văn hóa giao thông và phòng chống tác hại của rượu, bia khi tham gia giao thông và học lý thuyết của các môn: cấu tạo và sửa chữa thông thường; kỹ năng phòng cháy, chữa cháy và cứu nạn, cứu hộ; kỹ thuật lái xe để cấp giấy phép lái xe hạng b, c1, c, d1, d2, d, be, c1e, ce, d1e, d2e và de. 2. người học phải đăng ký tại cơ sở được phép đào tạo để được quản lý theo quy định của bộ giao thông vận tải. mục 2. điều kiện kinh doanh của cơ sở đào tạo lái xe ô tô', '1. giấy phép lái xe bao gồm các hạng sau đây: a) hạng a1 cấp cho người lái xe mô tô hai bánh có dung tích xi-lanh đến 125 cm3 hoặc có công suất động cơ điện đến 11 kw; b) hạng a cấp cho người lái xe mô tô hai bánh có dung tích xi-lanh\xa0 trên 125 cm3\xa0hoặc có công suất động cơ điện trên 11 kw và các loại xe quy định cho giấy phép lái xe hạng a1; c) hạng b1 cấp cho người lái xe mô tô ba bánh và các loại xe quy định cho giấy phép lái xe hạng a1; d) hạng b cấp cho người lái xe ô tô chở người đến 08 chỗ (không kể chỗ của người lái xe); xe ô tô tải và ô tô chuyên dùng có khối lượng toàn bộ theo thiết kế đến 3.500 kg; các loại xe ô tô quy định cho giấy phép lái xe hạng b kéo rơ moóc có khối lượng toàn bộ theo thiết kế đến 750 kg; đ) hạng c1 cấp cho người lái xe ô tô tải và ô tô chuyên dùng có khối lượng toàn bộ theo thiết kế trên 3.500 kg đến 7.500 kg; các loại xe ô tô tải quy định cho giấy phép lái xe hạng c1 kéo rơ moóc có khối lượng toàn bộ theo thiết kế đến 750 kg; các loại xe quy định cho giấy phép lái xe hạng b; e) hạng c cấp cho người lái xe ô tô tải và ô tô chuyên dùng có khối lượng toàn bộ theo thiết kế trên 7.500 kg; các loại xe ô tô tải quy định cho giấy phép lái xe hạng c kéo rơ moóc có khối lượng toàn bộ theo thiết kế đến 750 kg; các loại xe quy định cho giấy phép lái xe hạng b và hạng c1; g) hạng d1 cấp cho người lái xe ô tô chở người trên 08 chỗ (không kể chỗ của người lái xe) đến 16 chỗ (không kể chỗ của người lái xe); các loại xe ô tô chở người quy định cho giấy phép lái xe hạng d1 kéo rơ moóc có khối lượng toàn bộ theo thiết kế đến 750 kg; các loại xe quy định cho giấy phép lái xe các hạng b, c1, c; h) hạng d2 cấp cho người lái xe ô tô chở người (kể cả xe buýt) trên 16 chỗ (không kể chỗ của người lái xe) đến 29 chỗ (không kể chỗ của người lái xe); các loại xe ô tô chở người quy định cho giấy phép lái xe hạng d2 kéo rơ moóc có khối lượng toàn bộ theo thiết kế đến 750 kg; các loại xe quy định cho giấy phép lái xe các hạng b, c1, c, d1; i) hạng d cấp cho người lái xe ô tô chở người (kể cả xe buýt) trên 29 chỗ (không kể chỗ của người lái xe); xe ô tô chở người giường nằm; các loại xe ô tô chở người quy định cho giấy phép lái xe hạng d kéo rơ moóc có khối lượng toàn bộ theo thiết kế đến 750 kg; các loại xe quy định cho giấy phép lái xe các hạng b, c1, c, d1, d2; k) hạng be cấp cho người lái các loại xe ô tô quy định cho giấy phép lái xe hạng b kéo rơ moóc có khối lượng toàn bộ theo thiết kế trên 750 kg; l) hạng c1e cấp cho người lái các loại xe ô tô quy định cho giấy phép lái xe hạng c1 kéo rơ moóc có khối lượng toàn bộ theo thiết kế trên 750 kg; m) hạng ce cấp cho người lái các loại xe ô tô quy định cho giấy phép lái xe hạng c kéo rơ moóc có khối lượng toàn bộ theo thiết kế trên 750 kg; xe ô tô đầu kéo kéo sơ mi rơ moóc; n) hạng d1e cấp cho người lái các loại xe ô tô quy định cho giấy phép lái xe hạng d1 kéo rơ moóc có khối lượng toàn bộ theo thiết kế trên 750 kg; o) hạng d2e cấp cho người lái các loại xe ô tô quy định cho giấy phép lái xe hạng d2 kéo rơ moóc có khối lượng toàn bộ theo thiết kế trên 750 kg; p) hạng de cấp cho người lái các loại xe ô tô quy định cho giấy phép lái xe hạng d kéo rơ moóc có khối lượng toàn bộ theo thiết kế trên 750 kg; xe ô tô chở khách nối toa. 2. người khuyết tật điều khiển xe mô tô ba bánh dùng cho người khuyết tật được cấp giấy phép lái xe hạng a1. người khuyết tật điều khiển xe ô tô số tự động có kết cấu phù hợp với tình trạng khuyết tật thì được cấp giấy phép lái xe hạng b. 3. người điều khiển xe chở hàng bốn bánh có gắn động cơ, xe chở người bốn bánh có gắn động cơ phải sử dụng giấy phép lái xe có hạng phù hợp với xe ô tô tải hoặc xe ô tô chở người tương ứng. 4. người điều khiển xe ô tô có thiết kế, cải tạo với số chỗ ít hơn xe cùng loại, kích thước giới hạn tương đương phải sử dụng giấy phép lái xe có hạng phù hợp với xe ô tô cùng loại, kích thước giới hạn tương đương và có số chỗ nhiều nhất. 5. thời hạn của giấy phép lái xe được quy định như sau: a) giấy phép lái xe các hạng a1, a, b1 không thời hạn; b) giấy phép lái xe hạng b và hạng c1 có thời hạn 10 năm kể từ ngày cấp; c) giấy phép lái xe các hạng c, d1, d2, d, be, c1e, ce, d1e, d2e và de có thời hạn 05 năm kể từ ngày cấp. 6. giấy phép lái xe có giá trị sử dụng trong phạm vi lãnh thổ việt nam bao gồm: a) giấy phép lái xe do cơ quan có thẩm quyền của việt nam cấp; b) giấy phép lái xe quốc tế và giấy phép lái xe quốc gia phù hợp với loại xe được phép điều khiển do quốc gia là thành viên của công ước của liên hợp quốc về giao thông đường bộ năm 1968 (sau đây gọi là công ước viên) cấp; c) giấy phép lái xe phù hợp với loại xe được phép điều khiển của nước hoặc vùng lãnh thổ mà việt nam ký kết điều ước quốc tế hoặc thỏa thuận quốc tế công nhận giấy phép lái xe của nhau; d) giấy phép lái xe nước ngoài phù hợp với loại xe được phép điều khiển do quốc gia được công nhận theo điều ước quốc tế mà nước cộng hòa xã hội chủ nghĩa việt nam là thành viên. 7. giấy phép lái xe không có hiệu lực trong các trường hợp sau đây: a) giấy phép lái xe hết thời hạn sử dụng; b) giấy phép lái xe bị thu hồi theo quy định tại khoản 5 điều 62 của luật này. 8. giấy phép lái xe quốc tế được quy định như sau: a) giấy phép lái xe quốc tế là giấy phép lái xe do cơ quan nhà nước có thẩm quyền của quốc gia là thành viên của công ước viên cấp theo một mẫu thống nhất; có thời hạn không quá 03 năm kể từ ngày cấp và phải phù hợp với thời hạn còn hiệu lực của giấy phép lái xe quốc gia; b) người có giấy phép lái xe quốc tế do quốc gia là thành viên của công ước viên cấp khi lái xe tham gia giao thông đường bộ trên lãnh thổ việt nam phải mang theo giấy phép lái xe quốc tế và giấy phép lái xe quốc gia được cấp phù hợp với hạng xe điều khiển, còn thời hạn sử dụng; phải tuân thủ pháp luật về trật tự, an toàn giao thông đường bộ của việt nam; c) người có giấy phép lái xe quốc tế vi phạm pháp luật về trật tự, an toàn giao thông đường bộ của việt nam mà bị tước quyền sử dụng giấy phép lái xe có thời hạn thì thời gian bị tước quyền sử dụng không quá thời gian người lái xe được phép cư trú tại lãnh thổ việt nam; d) người việt nam hoặc người nước ngoài có thẻ thường trú hoặc thẻ tạm trú tại việt nam có giấy phép lái xe do việt nam hoặc quốc gia là thành viên của điều ước quốc tế mà nước cộng hòa xã hội chủ nghĩa việt nam là thành viên cấp, còn giá trị sử dụng, nếu có nhu cầu được cấp giấy phép lái xe quốc tế. 9. bộ trưởng bộ giao thông vận tải quy định mẫu giấy phép lái xe và giấy phép lái xe quốc tế, trình tự, thủ tục cấp và việc sử dụng giấy phép lái xe, giấy phép lái xe quốc tế; đối với mẫu giấy phép lái xe, trình tự, thủ tục cấp và việc sử dụng giấy phép lái xe của lực lượng quân đội, công an làm nhiệm vụ quốc phòng, an ninh do bộ trưởng bộ quốc phòng, bộ trưởng bộ công an quy định.', '1. giấy phép lái xe quân sự, được phân hạng theo quy định của luật trật tự, an toàn giao thông đường bộ, đồng thời phù hợp với đặc thù quân sự của phương tiện cơ giới đường bộ thuộc phạm vi quản lý của bộ quốc phòng. giấy phép lái xe quân sự, gồm: a) hạng a1 cấp cho người điều khiển xe mô tô hai bánh có dung tích xi-lanh đến 125 cm3 hoặc có công suất động cơ điện đến 11 kw; b) hạng a cấp cho người điều khiển xe mô tô hai bánh có dung tích xi-lanh trên 125 cm3 hoặc có công suất động cơ điện trên 11kw và các loại xe quy định cho giấy phép lái xe quân sự hạng a1; c) hạng b1 cấp cho người điều khiển xe mô tô ba bánh và các loại xe quy định cho giấy phép lái xe quân sự hạng a1; d) hạng b cấp cho người điều khiển các loại xe ô tô chở người đến 08 chỗ ngồi (không kể chỗ của người lái xe); xe ô tô tải và ô tô chuyên dùng có khối lượng toàn bộ theo thiết kế đến 3.500 kg; các loại xe ô tô quy định cho giấy phép lái xe hạng b có kéo rơ moóc hoặc vũ khí, khí tài quân sự dạng rơ moóc có khối lượng toàn bộ theo thiết kế đến 750 kg; đ) hạng c1 cấp cho người điều khiển các loại xe ô tô vận tải và ô tô chuyên dùng có khối lượng toàn bộ theo thiết kế trên 3.500 kg đến 7.500 kg; các loại xe ô tô quy định cho giấy phép lái xe hạng c1 kéo rơ moóc hoặc vũ khí, khí tài quân sự dạng rơ moóc có khối lượng toàn bộ theo thiết kế đến 750 kg; các loại xe quy định cho giấy phép lái xe quân sự hạng b; e) hạng c cấp cho người điều khiển các loại xe ô tô tải và ô tô chuyên dùng có khối lượng toàn bộ theo thiết kế trên 7.500 kg; các loại xe ô tô tải quy định cho giấy phép lái xe hạng c kéo rơ moóc hoặc vũ khí, khí tài quân sự dạng rơ moóc có khối lượng toàn bộ theo thiết kế đến 750 kg; các loại xe quy định cho giấy phép lái xe quân sự hạng b và hạng c1; g) hạng d1 cấp cho người điều khiển xe ô tô chở người trên 8 chỗ (không kể chỗ của người lái xe) đến 16 chỗ (không kể chỗ của người lái xe); các loại xe ô tô chở người quy định cho giấy phép lái xe hạng d1 kéo rơ moóc hoặc vũ khí, khí tài quân sự dạng rơ moóc có khối lượng toàn bộ theo thiết kế đến 750 kg; các loại xe quy định cho giấy phép lái xe quân sự hạng b, c1, c; h) hạng d2 cấp cho người điều khiển xe ô tô chở người từ trên 16 đến 29 chỗ (không kể chỗ của người lái xe); các loại xe ô tô chở người quy định cho giấy phép lái xe hạng d2 kéo rơ moóc hoặc vũ khí, khí tài quân sự dạng rơ moóc có khối lượng toàn bộ theo thiết kế đến 750 kg; các loại xe quy định cho giấy phép lái xe quân sự hạng b, c1, c, d1; i) hạng d cấp cho người điều khiển xe ô tô chở người từ trên 29 chỗ (không kể chỗ của người lái xe); các loại xe ô tô chở người quy định cho giấy phép lái xe hạng d kéo rơ moóc hoặc vũ khí, khí tài quân sự dạng rơ moóc có khối lượng toàn bộ theo thiết kế đến 750 kg; các loại xe quy định cho giấy phép lái xe quân sự hạng b, c1, c, d1, d2; k) hạng c1e cấp cho người điều khiển các loại xe ô tô quy định cho giấy phép lái xe hạng c1 kéo rơ moóc hoặc vũ khí, khí tài quân sự dạng rơ moóc có khối lượng toàn bộ theo thiết kế trên 750 kg; l) hạng ce cấp cho người điều khiển các loại xe ô tô quy định cho giấy phép lái xe hạng c kéo rơ moóc hoặc vũ khí, khí tài quân sự dạng rơ moóc có khối lượng toàn bộ theo thiết kế trên 750 kg; xe ô tô đầu kéo kéo sơ mi rơ moóc hoặc khí tài quân sự dạng sơ mi rơ moóc; m) hạng cx cấp cho người đã có giấy phép lái xe quân sự hạng c để điều khiển xe xích kéo vũ khí, khí tài quân sự. 2. người điều khiển xe chở hàng bốn bánh có gắn động cơ, xe chở người bốn bánh có gắn động cơ phải sử dụng giấy phép lái xe có hạng phù hợp với xe ô tô tải và ô tô chở người tương ứng. 3. người điều khiển xe ô tô có thiết kế, cải tạo với số chỗ ngồi ít hơn ô tô cùng loại, kích thước giới hạn tương đương phải sử dụng giấy phép lái xe có hạng phù hợp với ô tô cùng loại, kích thước giới hạn tương đương và có số chỗ ngồi nhiều nhất.', '1. giấy phép lái xe quân sự được cấp trước ngày thông tư này có hiệu lực thi hành được tiếp tục sử dụng theo thời hạn ghi trên giấy phép lái xe. 2. giấy phép lái xe quân sự được cấp trước ngày thông tư này có hiệu lực thi hành nếu chưa thực hiện đổi, cấp lại theo quy định của thông tư này có hiệu lực sử dụng như sau: a) giấy phép lái xe quân sự hạng a1 được tiếp tục điều khiển xe mô tô hai bánh có dung tích xi-lanh từ 50 cm3 đến dưới 175 cm3 hoặc có công suất động cơ điện từ 04 kw đến dưới 14 kw; b) giấy phép lái xe quân sự hạng a2 được tiếp tục điều khiển xe mô tô hai bánh có dung tích xi-lanh từ 175 cm3 trở lên hoặc có công suất động cơ điện từ 14 kw trở lên và các loại xe quy định cho giấy phép lái xe hạng a1 quy định tại điểm a khoản này; c) giấy phép lái xe quân sự hạng a3 được tiếp tục điều khiển xe mô tô ba bánh, các loại xe quy định cho giấy phép lái xe hạng a1 quy định tại điểm a khoản này và các xe tương tự; d) giấy phép lái xe quân sự hạng b2 được tiếp tục điều khiển xe ô tô chở người đến 08 chỗ (không kể chỗ của người lái xe); xe ô tô tải, máy kéo có trọng tải dưới 3.500 kg; các loại xe ô tô quy định cho giấy phép lái xe hạng b kéo theo một rơ moóc hoặc vũ khí, khí tài quân sự dạng rơ moóc có khối lượng toàn bộ theo thiết kế đến 750 kg; đ) giấy phép lái xe quân sự hạng c được tiếp tục điều khiển xe ô tô tải, máy kéo có trọng tải từ 3.500 kg trở lên và các loại xe quy định cho các giấy phép lái xe hạng b2 quy định tại điểm d khoản này; các loại xe ô tô quy định cho giấy phép lái xe hạng c kéo theo một rơ moóc hoặc vũ khí, khí tài quân sự dạng rơ moóc có khối lượng toàn bộ theo thiết kế đến 750 kg; e) giấy phép lái xe quân sự hạng d được tiếp tục điều khiển xe ô tô chở người từ 09 chỗ (không kể chỗ của người lái xe) đến 29 chỗ (không kể chỗ của người lái xe) và các loại xe quy định cho các giấy phép lái xe hạng b2, c quy định tại các điểm d, đ khoản này; các loại xe ô tô quy định cho giấy phép lái xe hạng d2 kéo theo một rơ moóc hoặc vũ khí, khí tài quân sự dạng rơ moóc có khối lượng toàn bộ theo thiết kế đến 750 kg; g) giấy phép lái xe quân sự hạng e được tiếp tục điều khiển xe ô tô chở người trên 29 chỗ (không kể chỗ của người lái xe) và các loại xe quy định cho các giấy phép lái xe hạng b2, c, d quy định tại các điểm d, đ và e khoản này; các loại ô tô quy định cho giấy phép lái xe hạng d kéo theo một rơ moóc hoặc vũ khí, khí tài quân sự dạng rơ moóc có khối lượng toàn bộ theo thiết kế đến 750 kg; h) giấy phép lái xe quân sự hạng fc được tiếp tục điều khiển các loại xe quy định cho giấy phép lái xe hạng c quy định tại điểm đ khoản này khi kéo rơ moóc, khí tài quân sự dạng rơ moóc và ô tô đầu kéo kéo sơ mi rơ moóc, khí tài quân sự dạng sơ mi rơ moóc; i) giấy phép lái xe quân sự hạng fx được tiếp tục điều khiển xe xích kéo vũ khí, khí tài quân sự và các loại xe quy định cho giấy phép lái xe hạng c quy định tại điểm đ khoản này. 3. trường hợp người có giấy phép, lái xe quân sự đã được cấp trước ngày thông tư này có hiệu lực thi hành khi đổi, cấp lại giấy phép lái xe thì thực hiện như sau: a) giấy phép lái xe quân sự hạng a1 được đổi, cấp lại sang giấy phép lái xe quân sự hạng a với điều kiện hạn chế là chỉ được điều khiển xe mô tô hai bánh có dung tích xi-lanh đến dưới 175 cm3 hoặc có công suất động cơ điện đến dưới 14 kw; b) giấy phép lái xe quân sự hạng a2 được đổi, cấp lại sang giấy phép lái xe quân sự hạng a; c) giấy phép lái xe quân sự hạng a3 được đổi, cấp lại sang giấy phép lái xe quân sự hạng b1; d) giấy phép lái xe quân sự hạng b2 được đổi, cấp lại sang giấy phép lái xe quân sự hạng b hoặc hạng c1; đ) giấy phép lái xe quân sự hạng c giữ nguyên và đổi, cấp lại cùng hạng; e) giấy phép lái xe quân sự hạng d được đổi, cấp lại sang giấy phép lái xe quân sự hạng d2; g) giấy phép lái xe quân sự hạng e được đổi, cấp lại sang giấy phép lái xe quân sự hạng d; h) giấy phép lái xe quân sự hạng fc được đổi, cấp lại sang giấy phép lái xe quân sự hạng ce; i) giấy phép lái xe quân sự hạng fx được đổi, cấp lại sang giấy phép lái xe quân sự hạng cx; 4. người học lái xe đã được đào tạo lái xe trước ngày thông tư này có hiệu lực thi hành hoặc đang được đào tạo lái xe tại ngày thông tư này có hiệu lực thi hành chưa được sát hạch thì được sát hạch, cấp giấy phép lái xe theo hạng giấy phép lái xe đổi, cấp lại quy định tại khoản 3 điều này.']","**Nguồn văn bản:** 36_2024_QH15_444251

**Tên văn bản:** Luật Trật tự, an toàn giao thông đường bộ

**Điều 57:** Giấy phép lái xe

**Nội dung:**

1. Giấy phép lái xe bao gồm các hạng sau đây:

        a) Hạng A1 cấp cho người lái xe mô tô hai bánh có dung tích xi-lanh đến 125 cm3 hoặc có công suất động cơ điện đến 11 kW.

        b) Hạng A cấp cho người lái xe mô tô hai bánh có dung tích xi-lanh trên 125 cm3 hoặc có công suất động cơ điện trên 11 kW và các loại xe quy định cho giấy phép lái xe hạng A1.

        c) Hạng B1 cấp cho người lái xe mô tô ba bánh và các loại xe quy định cho giấy phép lái xe hạng A1.

        d) Hạng B cấp cho người lái xe ô tô chở người đến 08 chỗ (không kể chỗ của người lái xe); xe ô tô tải và ô tô chuyên dùng có khối lượng toàn bộ theo thiết kế đến 3.500 kg; các loại xe ô tô quy định cho giấy phép lái xe hạng B kéo rơ moóc có khối lượng toàn bộ theo thiết kế đến 750 kg.

        đ) Hạng C1 cấp cho người lái xe ô tô tải và ô tô chuyên dùng có khối lượng toàn bộ theo thiết kế trên 3.500 kg đến 7.500 kg; các loại xe ô tô tải quy định cho giấy phép lái xe hạng C1 kéo rơ moóc có khối lượng toàn bộ theo thiết kế đến 750 kg; các loại xe quy định cho giấy phép lái xe hạng B.

        e) Hạng C cấp cho người lái xe ô tô tải và ô tô chuyên dùng có khối lượng toàn bộ theo thiết kế trên 7.500 kg; các loại xe ô tô tải quy định cho giấy phép lái xe hạng C kéo rơ moóc có khối lượng toàn bộ theo thiết kế đến 750 kg; các loại xe quy định cho giấy phép lái xe hạng B và hạng C1.

        g) Hạng D1 cấp cho người lái xe ô tô chở người trên 08 chỗ (không kể chỗ của người lái xe) đến 16 chỗ (không kể chỗ của người lái xe); các loại xe ô tô chở người quy định cho giấy phép lái xe hạng D1 kéo rơ moóc có khối lượng toàn bộ theo thiết kế đến 750 kg; các loại xe quy định cho giấy phép lái xe các hạng B, C1, C.

        h) Hạng D2 cấp cho người lái xe ô tô chở người (kể cả xe buýt) trên 16 chỗ (không kể chỗ của người lái xe) đến 29 chỗ (không kể chỗ của người lái xe); các loại xe ô tô chở người quy định cho giấy phép lái xe hạng D2 kéo rơ moóc có khối lượng toàn bộ theo thiết kế đến 750 kg; các loại xe quy định cho giấy phép lái xe các hạng B, C1, C, D1.

        i) Hạng D cấp cho người lái xe ô tô chở người (kể cả xe buýt) trên 29 chỗ (không kể chỗ của người lái xe); xe ô tô chở người giường nằm; các loại xe ô tô chở người quy định cho giấy phép lái xe hạng D kéo rơ moóc có khối lượng toàn bộ theo thiết kế đến 750 kg; các loại xe quy định cho giấy phép lái xe các hạng B, C1, C, D1, D2.

        k) Hạng BE cấp cho người lái các loại xe ô tô quy định cho giấy phép lái xe hạng B kéo rơ moóc có khối lượng toàn bộ theo thiết kế trên 750 kg.

        l) Hạng C1E cấp cho người lái các loại xe ô tô quy định cho giấy phép lái xe hạng C1 kéo rơ moóc có khối lượng toàn bộ theo thiết kế trên 750 kg.

        m) Hạng CE cấp cho người lái các loại xe ô tô quy định cho giấy phép lái xe hạng C kéo rơ moóc có khối lượng toàn bộ theo thiết kế trên 750 kg; xe ô tô đầu kéo kéo sơ mi rơ moóc.

        n) Hạng D1E cấp cho người lái các loại xe ô tô quy định cho giấy phép lái xe hạng D1 kéo rơ moóc có khối lượng toàn bộ theo thiết kế trên 750 kg.

        o) Hạng D2E cấp cho người lái các loại xe ô tô quy định cho giấy phép lái xe hạng D2 kéo rơ moóc có khối lượng toàn bộ theo thiết kế trên 750 kg.

        p) Hạng DE cấp cho người lái các loại xe ô tô quy định cho giấy phép lái xe hạng D kéo rơ moóc có khối lượng toàn bộ theo thiết kế trên 750 kg; xe ô tô chở khách nối toa.


**Tóm lại:** Giấy phép lái xe hạng D2E cho phép lái xe ô tô chở người từ 16 đến 29 chỗ, kể cả xe buýt,  kéo theo rơ moóc có khối lượng toàn bộ theo thiết kế trên 750 kg và tất cả các loại xe thuộc hạng B, C1, C, D1, D2.
",Hạng D2E cho phép lái xe ô tô chở người trên 30 chỗ ngồi kéo rơ moóc có trọng tải trên 750 kg.,0.25,0.47133790133930314,0.0,0.0
9,Giấy phép lái xe hạng DE cho phép lái những loại xe nào?,"['1. đào tạo từ xa, tự học có hướng dẫn áp dụng đối với các môn học pháp luật về giao thông đường bộ, đạo đức, văn hóa giao thông và phòng chống tác hại của rượu, bia khi tham gia giao thông và học lý thuyết của các môn: cấu tạo và sửa chữa thông thường; kỹ năng phòng cháy, chữa cháy và cứu nạn, cứu hộ; kỹ thuật lái xe để cấp giấy phép lái xe hạng b, c1, c, d1, d2, d, be, c1e, ce, d1e, d2e và de. 2. người học phải đăng ký tại cơ sở được phép đào tạo để được quản lý theo quy định của bộ giao thông vận tải. mục 2. điều kiện kinh doanh của cơ sở đào tạo lái xe ô tô', '1. giấy phép lái xe được cấp trước ngày luật này có hiệu lực thi hành được tiếp tục sử dụng theo thời hạn ghi trên giấy phép lái xe. 2. giấy phép lái xe được cấp trước ngày luật này có hiệu lực thi hành nếu chưa thực hiện đổi, cấp lại theo quy định của luật này có hiệu lực sử dụng như sau: a) giấy phép lái xe hạng a1 được tiếp tục điều khiển xe mô tô hai bánh có dung tích xi-lanh từ 50 cm3\xa0đến dưới 175 cm3 hoặc có công suất động cơ điện từ 04 kw đến dưới 14 kw; b) giấy phép lái xe hạng a2 được tiếp tục điều khiển xe mô tô hai bánh có dung tích xi-lanh từ 175 cm3\xa0trở lên hoặc có công suất động cơ điện từ 14 kw trở lên và các loại xe quy định cho giấy phép lái xe hạng a1 quy định tại điểm a khoản này; c) giấy phép lái xe hạng a3 được tiếp tục điều khiển xe mô tô ba bánh, các loại xe quy định cho giấy phép lái xe hạng a1 quy định tại điểm a khoản này và các xe tương tự; d) giấy phép lái xe hạng a4 được tiếp tục điều khiển máy kéo có trọng tải đến 1.000 kg; đ) giấy phép lái xe hạng b1 số tự động cấp cho người không hành nghề lái xe được tiếp tục điều khiển xe ô tô số tự động chở người đến 08 chỗ (không kể chỗ của người lái xe); xe ô tô tải, kể cả ô tô tải chuyên dùng số tự động có trọng tải dưới 3.500 kg; e) giấy phép lái xe hạng b1 cấp cho người không hành nghề lái xe được tiếp tục điều khiển xe ô tô chở người đến 08 chỗ (không kể chỗ của người lái xe); xe ô tô tải, máy kéo có trọng tải dưới 3.500 kg; g) giấy phép lái xe hạng b2 cấp cho người hành nghề lái xe được tiếp tục điều khiển xe ô tô chở người đến 08 chỗ (không kể chỗ của người lái xe); xe ô tô tải, máy kéo có trọng tải dưới 3.500 kg; h) giấy phép lái xe hạng c được tiếp tục điều khiển xe ô tô tải, máy kéo có trọng tải từ 3.500 kg trở lên và các loại xe quy định cho các giấy phép lái xe hạng b1, b2 quy định tại các điểm đ, e và g khoản này; i) giấy phép lái xe hạng d được tiếp tục điều khiển xe ô tô chở người từ 09 chỗ (không kể chỗ của người lái xe) đến 29 chỗ (không kể chỗ của người lái xe) và các loại xe quy định cho các giấy phép lái xe hạng b1, b2, c quy định tại các điểm đ, e, g và h khoản này; k) giấy phép lái xe hạng e được tiếp tục điều khiển xe ô tô chở người trên 29 chỗ (không kể chỗ của người lái xe) và các loại xe quy định cho các giấy phép lái xe hạng b1, b2, c, d quy định tại các điểm đ, e, g, h và i khoản này; l) giấy phép lái xe hạng fb2, fd được tiếp tục điều khiển các loại xe quy định cho giấy phép lái xe hạng b2, d quy định tại điểm g và điểm i khoản này khi kéo rơ moóc; giấy phép lái xe hạng fc được tiếp tục điều khiển các loại xe quy định cho giấy phép lái xe hạng c quy định tại điểm h khoản này khi kéo rơ moóc, đầu kéo kéo sơ mi rơ moóc; giấy phép lái xe hạng fe được tiếp tục điều khiển các loại xe quy định cho giấy phép lái xe hạng e quy định tại điểm k khoản này khi kéo rơ moóc\xa0hoặc xe ô tô chở khách nối toa. 3. trường hợp người có giấy phép lái xe đã được cấp trước ngày luật này có hiệu lực thi hành có nhu cầu đổi, cấp lại giấy phép lái xe thì thực hiện như sau: a) giấy phép lái xe hạng a1 được đổi, cấp lại sang giấy phép lái xe hạng a với điều kiện hạn chế là chỉ được điều khiển xe mô tô hai bánh có dung tích xi-lanh đến dưới 175 cm3 hoặc có công suất động cơ điện đến dưới 14 kw; b) giấy phép lái xe hạng a2 được đổi, cấp lại sang giấy phép lái xe hạng a; c) giấy phép lái xe hạng a3 được đổi, cấp lại sang giấy phép lái xe hạng b1; d) giấy phép lái xe hạng a4 được đổi, cấp lại sang chứng chỉ điều khiển xe máy chuyên dùng cho người điều khiển máy kéo có trọng tải đến 1.000 kg và chứng chỉ bồi dưỡng kiến thức pháp luật về giao thông đường bộ cho người điều khiển xe máy chuyên dùng; đ) giấy phép lái xe hạng b1 số tự động được đổi, cấp lại sang giấy phép lái xe hạng b với điều kiện hạn chế là chỉ được điều khiển xe ô tô số tự động; e) giấy phép lái xe hạng b1, b2 được đổi, cấp lại sang giấy phép lái xe hạng b hoặc hạng c1 và chứng chỉ điều khiển xe máy chuyên dùng cho người điều khiển máy kéo có trọng tải đến 3.500 kg; g) giấy phép lái xe hạng c giữ nguyên và đổi, cấp lại cùng hạng và chứng chỉ điều khiển xe máy chuyên dùng cho người điều khiển máy kéo có trọng tải trên 3.500 kg; h) giấy phép lái xe hạng d được đổi, cấp lại sang giấy phép lái xe hạng d2 và chứng chỉ điều khiển xe máy chuyên dùng cho người điều khiển máy kéo có trọng tải trên 3.500 kg; i) giấy phép lái xe hạng e được đổi, cấp lại sang giấy phép lái xe hạng d và chứng chỉ điều khiển xe máy chuyên dùng cho người điều khiển máy kéo có trọng tải trên 3.500 kg; k) giấy phép lái xe hạng fb2 được đổi, cấp lại sang giấy phép lái xe hạng be hoặc hạng c1e và chứng chỉ điều khiển xe máy chuyên dùng cho người điều khiển máy kéo có trọng tải đến 3.500 kg; l) giấy phép lái xe hạng fc được đổi, cấp lại sang giấy phép lái xe hạng ce và chứng chỉ điều khiển xe máy chuyên dùng cho người điều khiển máy kéo có trọng tải trên 3.500 kg; m) giấy phép lái xe hạng fd được đổi, cấp lại sang giấy phép lái xe hạng d2e và chứng chỉ điều khiển xe máy chuyên dùng cho người điều khiển máy kéo có trọng tải trên 3.500 kg; n) giấy phép lái xe hạng fe được đổi, cấp lại sang giấy phép lái xe hạng de và chứng chỉ điều khiển xe máy chuyên dùng cho người điều khiển máy kéo có trọng tải trên 3.500 kg. 4. người học lái xe đã được đào tạo lái xe trước ngày luật này có hiệu lực thi hành hoặc đang được đào tạo lái xe tại ngày luật này có hiệu lực thi hành chưa được sát hạch, cấp giấy phép lái xe thì được sát hạch, cấp giấy phép lái xe theo hạng giấy phép lái xe đổi, cấp lại quy định tại khoản 3 điều này. 5. chứng nhận đăng ký xe, biển số xe máy chuyên dùng cấp trước ngày luật này có hiệu lực thi hành vẫn có giá trị sử dụng. 6. chứng nhận chất lượng an toàn kỹ thuật và bảo vệ môi trường được cấp trước ngày luật này có hiệu lực thi hành thì có giá trị sử dụng đến hết thời hạn ghi trên giấy chứng nhận đó. 7. việc đấu giá biển số xe ô tô được thực hiện trước ngày luật này có hiệu lực thi hành và đến ngày luật này có hiệu lực thi hành đã được cấp văn bản xác nhận biển số xe ô tô trúng đấu giá thì tiếp tục thực hiện theo nghị quyết số 73/2022/qh15 của quốc hội về thí điểm đấu giá biển số xe ô tô; trường hợp chưa được cấp xác nhận biển số xe ô tô trúng đấu giá thì tiếp tục thực hiện theo nghị quyết số 73/2022/qh15 của quốc hội về thí điểm đấu giá biển số xe ô tô và quy định tại điểm d khoản 1 điều 38 của luật này./. luật này được quốc hội nước cộng hòa xã hội chủ nghĩa việt nam khóa xv, kỳ họp thứ 7 thông qua ngày 27 tháng 6 năm 2024.', '1. giấy phép lái xe bao gồm các hạng sau đây: a) hạng a1 cấp cho người lái xe mô tô hai bánh có dung tích xi-lanh đến 125 cm3 hoặc có công suất động cơ điện đến 11 kw; b) hạng a cấp cho người lái xe mô tô hai bánh có dung tích xi-lanh\xa0 trên 125 cm3\xa0hoặc có công suất động cơ điện trên 11 kw và các loại xe quy định cho giấy phép lái xe hạng a1; c) hạng b1 cấp cho người lái xe mô tô ba bánh và các loại xe quy định cho giấy phép lái xe hạng a1; d) hạng b cấp cho người lái xe ô tô chở người đến 08 chỗ (không kể chỗ của người lái xe); xe ô tô tải và ô tô chuyên dùng có khối lượng toàn bộ theo thiết kế đến 3.500 kg; các loại xe ô tô quy định cho giấy phép lái xe hạng b kéo rơ moóc có khối lượng toàn bộ theo thiết kế đến 750 kg; đ) hạng c1 cấp cho người lái xe ô tô tải và ô tô chuyên dùng có khối lượng toàn bộ theo thiết kế trên 3.500 kg đến 7.500 kg; các loại xe ô tô tải quy định cho giấy phép lái xe hạng c1 kéo rơ moóc có khối lượng toàn bộ theo thiết kế đến 750 kg; các loại xe quy định cho giấy phép lái xe hạng b; e) hạng c cấp cho người lái xe ô tô tải và ô tô chuyên dùng có khối lượng toàn bộ theo thiết kế trên 7.500 kg; các loại xe ô tô tải quy định cho giấy phép lái xe hạng c kéo rơ moóc có khối lượng toàn bộ theo thiết kế đến 750 kg; các loại xe quy định cho giấy phép lái xe hạng b và hạng c1; g) hạng d1 cấp cho người lái xe ô tô chở người trên 08 chỗ (không kể chỗ của người lái xe) đến 16 chỗ (không kể chỗ của người lái xe); các loại xe ô tô chở người quy định cho giấy phép lái xe hạng d1 kéo rơ moóc có khối lượng toàn bộ theo thiết kế đến 750 kg; các loại xe quy định cho giấy phép lái xe các hạng b, c1, c; h) hạng d2 cấp cho người lái xe ô tô chở người (kể cả xe buýt) trên 16 chỗ (không kể chỗ của người lái xe) đến 29 chỗ (không kể chỗ của người lái xe); các loại xe ô tô chở người quy định cho giấy phép lái xe hạng d2 kéo rơ moóc có khối lượng toàn bộ theo thiết kế đến 750 kg; các loại xe quy định cho giấy phép lái xe các hạng b, c1, c, d1; i) hạng d cấp cho người lái xe ô tô chở người (kể cả xe buýt) trên 29 chỗ (không kể chỗ của người lái xe); xe ô tô chở người giường nằm; các loại xe ô tô chở người quy định cho giấy phép lái xe hạng d kéo rơ moóc có khối lượng toàn bộ theo thiết kế đến 750 kg; các loại xe quy định cho giấy phép lái xe các hạng b, c1, c, d1, d2; k) hạng be cấp cho người lái các loại xe ô tô quy định cho giấy phép lái xe hạng b kéo rơ moóc có khối lượng toàn bộ theo thiết kế trên 750 kg; l) hạng c1e cấp cho người lái các loại xe ô tô quy định cho giấy phép lái xe hạng c1 kéo rơ moóc có khối lượng toàn bộ theo thiết kế trên 750 kg; m) hạng ce cấp cho người lái các loại xe ô tô quy định cho giấy phép lái xe hạng c kéo rơ moóc có khối lượng toàn bộ theo thiết kế trên 750 kg; xe ô tô đầu kéo kéo sơ mi rơ moóc; n) hạng d1e cấp cho người lái các loại xe ô tô quy định cho giấy phép lái xe hạng d1 kéo rơ moóc có khối lượng toàn bộ theo thiết kế trên 750 kg; o) hạng d2e cấp cho người lái các loại xe ô tô quy định cho giấy phép lái xe hạng d2 kéo rơ moóc có khối lượng toàn bộ theo thiết kế trên 750 kg; p) hạng de cấp cho người lái các loại xe ô tô quy định cho giấy phép lái xe hạng d kéo rơ moóc có khối lượng toàn bộ theo thiết kế trên 750 kg; xe ô tô chở khách nối toa. 2. người khuyết tật điều khiển xe mô tô ba bánh dùng cho người khuyết tật được cấp giấy phép lái xe hạng a1. người khuyết tật điều khiển xe ô tô số tự động có kết cấu phù hợp với tình trạng khuyết tật thì được cấp giấy phép lái xe hạng b. 3. người điều khiển xe chở hàng bốn bánh có gắn động cơ, xe chở người bốn bánh có gắn động cơ phải sử dụng giấy phép lái xe có hạng phù hợp với xe ô tô tải hoặc xe ô tô chở người tương ứng. 4. người điều khiển xe ô tô có thiết kế, cải tạo với số chỗ ít hơn xe cùng loại, kích thước giới hạn tương đương phải sử dụng giấy phép lái xe có hạng phù hợp với xe ô tô cùng loại, kích thước giới hạn tương đương và có số chỗ nhiều nhất. 5. thời hạn của giấy phép lái xe được quy định như sau: a) giấy phép lái xe các hạng a1, a, b1 không thời hạn; b) giấy phép lái xe hạng b và hạng c1 có thời hạn 10 năm kể từ ngày cấp; c) giấy phép lái xe các hạng c, d1, d2, d, be, c1e, ce, d1e, d2e và de có thời hạn 05 năm kể từ ngày cấp. 6. giấy phép lái xe có giá trị sử dụng trong phạm vi lãnh thổ việt nam bao gồm: a) giấy phép lái xe do cơ quan có thẩm quyền của việt nam cấp; b) giấy phép lái xe quốc tế và giấy phép lái xe quốc gia phù hợp với loại xe được phép điều khiển do quốc gia là thành viên của công ước của liên hợp quốc về giao thông đường bộ năm 1968 (sau đây gọi là công ước viên) cấp; c) giấy phép lái xe phù hợp với loại xe được phép điều khiển của nước hoặc vùng lãnh thổ mà việt nam ký kết điều ước quốc tế hoặc thỏa thuận quốc tế công nhận giấy phép lái xe của nhau; d) giấy phép lái xe nước ngoài phù hợp với loại xe được phép điều khiển do quốc gia được công nhận theo điều ước quốc tế mà nước cộng hòa xã hội chủ nghĩa việt nam là thành viên. 7. giấy phép lái xe không có hiệu lực trong các trường hợp sau đây: a) giấy phép lái xe hết thời hạn sử dụng; b) giấy phép lái xe bị thu hồi theo quy định tại khoản 5 điều 62 của luật này. 8. giấy phép lái xe quốc tế được quy định như sau: a) giấy phép lái xe quốc tế là giấy phép lái xe do cơ quan nhà nước có thẩm quyền của quốc gia là thành viên của công ước viên cấp theo một mẫu thống nhất; có thời hạn không quá 03 năm kể từ ngày cấp và phải phù hợp với thời hạn còn hiệu lực của giấy phép lái xe quốc gia; b) người có giấy phép lái xe quốc tế do quốc gia là thành viên của công ước viên cấp khi lái xe tham gia giao thông đường bộ trên lãnh thổ việt nam phải mang theo giấy phép lái xe quốc tế và giấy phép lái xe quốc gia được cấp phù hợp với hạng xe điều khiển, còn thời hạn sử dụng; phải tuân thủ pháp luật về trật tự, an toàn giao thông đường bộ của việt nam; c) người có giấy phép lái xe quốc tế vi phạm pháp luật về trật tự, an toàn giao thông đường bộ của việt nam mà bị tước quyền sử dụng giấy phép lái xe có thời hạn thì thời gian bị tước quyền sử dụng không quá thời gian người lái xe được phép cư trú tại lãnh thổ việt nam; d) người việt nam hoặc người nước ngoài có thẻ thường trú hoặc thẻ tạm trú tại việt nam có giấy phép lái xe do việt nam hoặc quốc gia là thành viên của điều ước quốc tế mà nước cộng hòa xã hội chủ nghĩa việt nam là thành viên cấp, còn giá trị sử dụng, nếu có nhu cầu được cấp giấy phép lái xe quốc tế. 9. bộ trưởng bộ giao thông vận tải quy định mẫu giấy phép lái xe và giấy phép lái xe quốc tế, trình tự, thủ tục cấp và việc sử dụng giấy phép lái xe, giấy phép lái xe quốc tế; đối với mẫu giấy phép lái xe, trình tự, thủ tục cấp và việc sử dụng giấy phép lái xe của lực lượng quân đội, công an làm nhiệm vụ quốc phòng, an ninh do bộ trưởng bộ quốc phòng, bộ trưởng bộ công an quy định.', '1. giấy phép lái xe quân sự, được phân hạng theo quy định của luật trật tự, an toàn giao thông đường bộ, đồng thời phù hợp với đặc thù quân sự của phương tiện cơ giới đường bộ thuộc phạm vi quản lý của bộ quốc phòng. giấy phép lái xe quân sự, gồm: a) hạng a1 cấp cho người điều khiển xe mô tô hai bánh có dung tích xi-lanh đến 125 cm3 hoặc có công suất động cơ điện đến 11 kw; b) hạng a cấp cho người điều khiển xe mô tô hai bánh có dung tích xi-lanh trên 125 cm3 hoặc có công suất động cơ điện trên 11kw và các loại xe quy định cho giấy phép lái xe quân sự hạng a1; c) hạng b1 cấp cho người điều khiển xe mô tô ba bánh và các loại xe quy định cho giấy phép lái xe quân sự hạng a1; d) hạng b cấp cho người điều khiển các loại xe ô tô chở người đến 08 chỗ ngồi (không kể chỗ của người lái xe); xe ô tô tải và ô tô chuyên dùng có khối lượng toàn bộ theo thiết kế đến 3.500 kg; các loại xe ô tô quy định cho giấy phép lái xe hạng b có kéo rơ moóc hoặc vũ khí, khí tài quân sự dạng rơ moóc có khối lượng toàn bộ theo thiết kế đến 750 kg; đ) hạng c1 cấp cho người điều khiển các loại xe ô tô vận tải và ô tô chuyên dùng có khối lượng toàn bộ theo thiết kế trên 3.500 kg đến 7.500 kg; các loại xe ô tô quy định cho giấy phép lái xe hạng c1 kéo rơ moóc hoặc vũ khí, khí tài quân sự dạng rơ moóc có khối lượng toàn bộ theo thiết kế đến 750 kg; các loại xe quy định cho giấy phép lái xe quân sự hạng b; e) hạng c cấp cho người điều khiển các loại xe ô tô tải và ô tô chuyên dùng có khối lượng toàn bộ theo thiết kế trên 7.500 kg; các loại xe ô tô tải quy định cho giấy phép lái xe hạng c kéo rơ moóc hoặc vũ khí, khí tài quân sự dạng rơ moóc có khối lượng toàn bộ theo thiết kế đến 750 kg; các loại xe quy định cho giấy phép lái xe quân sự hạng b và hạng c1; g) hạng d1 cấp cho người điều khiển xe ô tô chở người trên 8 chỗ (không kể chỗ của người lái xe) đến 16 chỗ (không kể chỗ của người lái xe); các loại xe ô tô chở người quy định cho giấy phép lái xe hạng d1 kéo rơ moóc hoặc vũ khí, khí tài quân sự dạng rơ moóc có khối lượng toàn bộ theo thiết kế đến 750 kg; các loại xe quy định cho giấy phép lái xe quân sự hạng b, c1, c; h) hạng d2 cấp cho người điều khiển xe ô tô chở người từ trên 16 đến 29 chỗ (không kể chỗ của người lái xe); các loại xe ô tô chở người quy định cho giấy phép lái xe hạng d2 kéo rơ moóc hoặc vũ khí, khí tài quân sự dạng rơ moóc có khối lượng toàn bộ theo thiết kế đến 750 kg; các loại xe quy định cho giấy phép lái xe quân sự hạng b, c1, c, d1; i) hạng d cấp cho người điều khiển xe ô tô chở người từ trên 29 chỗ (không kể chỗ của người lái xe); các loại xe ô tô chở người quy định cho giấy phép lái xe hạng d kéo rơ moóc hoặc vũ khí, khí tài quân sự dạng rơ moóc có khối lượng toàn bộ theo thiết kế đến 750 kg; các loại xe quy định cho giấy phép lái xe quân sự hạng b, c1, c, d1, d2; k) hạng c1e cấp cho người điều khiển các loại xe ô tô quy định cho giấy phép lái xe hạng c1 kéo rơ moóc hoặc vũ khí, khí tài quân sự dạng rơ moóc có khối lượng toàn bộ theo thiết kế trên 750 kg; l) hạng ce cấp cho người điều khiển các loại xe ô tô quy định cho giấy phép lái xe hạng c kéo rơ moóc hoặc vũ khí, khí tài quân sự dạng rơ moóc có khối lượng toàn bộ theo thiết kế trên 750 kg; xe ô tô đầu kéo kéo sơ mi rơ moóc hoặc khí tài quân sự dạng sơ mi rơ moóc; m) hạng cx cấp cho người đã có giấy phép lái xe quân sự hạng c để điều khiển xe xích kéo vũ khí, khí tài quân sự. 2. người điều khiển xe chở hàng bốn bánh có gắn động cơ, xe chở người bốn bánh có gắn động cơ phải sử dụng giấy phép lái xe có hạng phù hợp với xe ô tô tải và ô tô chở người tương ứng. 3. người điều khiển xe ô tô có thiết kế, cải tạo với số chỗ ngồi ít hơn ô tô cùng loại, kích thước giới hạn tương đương phải sử dụng giấy phép lái xe có hạng phù hợp với ô tô cùng loại, kích thước giới hạn tương đương và có số chỗ ngồi nhiều nhất.', '1. giấy phép lái xe quân sự được cấp trước ngày thông tư này có hiệu lực thi hành được tiếp tục sử dụng theo thời hạn ghi trên giấy phép lái xe. 2. giấy phép lái xe quân sự được cấp trước ngày thông tư này có hiệu lực thi hành nếu chưa thực hiện đổi, cấp lại theo quy định của thông tư này có hiệu lực sử dụng như sau: a) giấy phép lái xe quân sự hạng a1 được tiếp tục điều khiển xe mô tô hai bánh có dung tích xi-lanh từ 50 cm3 đến dưới 175 cm3 hoặc có công suất động cơ điện từ 04 kw đến dưới 14 kw; b) giấy phép lái xe quân sự hạng a2 được tiếp tục điều khiển xe mô tô hai bánh có dung tích xi-lanh từ 175 cm3 trở lên hoặc có công suất động cơ điện từ 14 kw trở lên và các loại xe quy định cho giấy phép lái xe hạng a1 quy định tại điểm a khoản này; c) giấy phép lái xe quân sự hạng a3 được tiếp tục điều khiển xe mô tô ba bánh, các loại xe quy định cho giấy phép lái xe hạng a1 quy định tại điểm a khoản này và các xe tương tự; d) giấy phép lái xe quân sự hạng b2 được tiếp tục điều khiển xe ô tô chở người đến 08 chỗ (không kể chỗ của người lái xe); xe ô tô tải, máy kéo có trọng tải dưới 3.500 kg; các loại xe ô tô quy định cho giấy phép lái xe hạng b kéo theo một rơ moóc hoặc vũ khí, khí tài quân sự dạng rơ moóc có khối lượng toàn bộ theo thiết kế đến 750 kg; đ) giấy phép lái xe quân sự hạng c được tiếp tục điều khiển xe ô tô tải, máy kéo có trọng tải từ 3.500 kg trở lên và các loại xe quy định cho các giấy phép lái xe hạng b2 quy định tại điểm d khoản này; các loại xe ô tô quy định cho giấy phép lái xe hạng c kéo theo một rơ moóc hoặc vũ khí, khí tài quân sự dạng rơ moóc có khối lượng toàn bộ theo thiết kế đến 750 kg; e) giấy phép lái xe quân sự hạng d được tiếp tục điều khiển xe ô tô chở người từ 09 chỗ (không kể chỗ của người lái xe) đến 29 chỗ (không kể chỗ của người lái xe) và các loại xe quy định cho các giấy phép lái xe hạng b2, c quy định tại các điểm d, đ khoản này; các loại xe ô tô quy định cho giấy phép lái xe hạng d2 kéo theo một rơ moóc hoặc vũ khí, khí tài quân sự dạng rơ moóc có khối lượng toàn bộ theo thiết kế đến 750 kg; g) giấy phép lái xe quân sự hạng e được tiếp tục điều khiển xe ô tô chở người trên 29 chỗ (không kể chỗ của người lái xe) và các loại xe quy định cho các giấy phép lái xe hạng b2, c, d quy định tại các điểm d, đ và e khoản này; các loại ô tô quy định cho giấy phép lái xe hạng d kéo theo một rơ moóc hoặc vũ khí, khí tài quân sự dạng rơ moóc có khối lượng toàn bộ theo thiết kế đến 750 kg; h) giấy phép lái xe quân sự hạng fc được tiếp tục điều khiển các loại xe quy định cho giấy phép lái xe hạng c quy định tại điểm đ khoản này khi kéo rơ moóc, khí tài quân sự dạng rơ moóc và ô tô đầu kéo kéo sơ mi rơ moóc, khí tài quân sự dạng sơ mi rơ moóc; i) giấy phép lái xe quân sự hạng fx được tiếp tục điều khiển xe xích kéo vũ khí, khí tài quân sự và các loại xe quy định cho giấy phép lái xe hạng c quy định tại điểm đ khoản này. 3. trường hợp người có giấy phép, lái xe quân sự đã được cấp trước ngày thông tư này có hiệu lực thi hành khi đổi, cấp lại giấy phép lái xe thì thực hiện như sau: a) giấy phép lái xe quân sự hạng a1 được đổi, cấp lại sang giấy phép lái xe quân sự hạng a với điều kiện hạn chế là chỉ được điều khiển xe mô tô hai bánh có dung tích xi-lanh đến dưới 175 cm3 hoặc có công suất động cơ điện đến dưới 14 kw; b) giấy phép lái xe quân sự hạng a2 được đổi, cấp lại sang giấy phép lái xe quân sự hạng a; c) giấy phép lái xe quân sự hạng a3 được đổi, cấp lại sang giấy phép lái xe quân sự hạng b1; d) giấy phép lái xe quân sự hạng b2 được đổi, cấp lại sang giấy phép lái xe quân sự hạng b hoặc hạng c1; đ) giấy phép lái xe quân sự hạng c giữ nguyên và đổi, cấp lại cùng hạng; e) giấy phép lái xe quân sự hạng d được đổi, cấp lại sang giấy phép lái xe quân sự hạng d2; g) giấy phép lái xe quân sự hạng e được đổi, cấp lại sang giấy phép lái xe quân sự hạng d; h) giấy phép lái xe quân sự hạng fc được đổi, cấp lại sang giấy phép lái xe quân sự hạng ce; i) giấy phép lái xe quân sự hạng fx được đổi, cấp lại sang giấy phép lái xe quân sự hạng cx; 4. người học lái xe đã được đào tạo lái xe trước ngày thông tư này có hiệu lực thi hành hoặc đang được đào tạo lái xe tại ngày thông tư này có hiệu lực thi hành chưa được sát hạch thì được sát hạch, cấp giấy phép lái xe theo hạng giấy phép lái xe đổi, cấp lại quy định tại khoản 3 điều này.']","**Nguồn văn bản:** 36_2024_QH15_444251

**Tên văn bản:** Luật Trật tự, an toàn giao thông đường bộ

**Điều 57:** Giấy phép lái xe

**Nội dung:**

1. Giấy phép lái xe bao gồm các hạng sau đây:

        a) Hạng DE cấp cho người lái các loại xe ô tô quy định cho giấy phép lái xe hạng D kéo rơ moóc có khối lượng toàn bộ theo thiết kế trên 750 kg; xe ô tô chở khách nối toa.

2. Người khuyết tật điều khiển xe mô tô ba bánh dùng cho người khuyết tật được cấp giấy phép lái xe hạng A1. Người khuyết tật điều khiển xe ô tô số tự động có kết cấu phù hợp với tình trạng khuyết tật thì được cấp giấy phép lái xe hạng B.

3. Người điều khiển xe chở hàng bốn bánh có gắn động cơ, xe chở người bốn bánh có gắn động cơ phải sử dụng giấy phép lái xe có hạng phù hợp với xe ô tô tải hoặc xe ô tô chở người tương ứng.

4. Người điều khiển xe ô tô có thiết kế, cải tạo với số chỗ ít hơn xe cùng loại, kích thước giới hạn tương đương phải sử dụng giấy phép lái xe có hạng phù hợp với xe ô tô cùng loại, kích thước giới hạn tương đương và có số chỗ nhiều nhất.

5. Thời hạn của giấy phép lái xe được quy định như sau:
        
        a) Giấy phép lái xe các hạng A1, A, B1 không thời hạn.

        b) Giấy phép lái xe hạng B và hạng C1 có thời hạn 10 năm kể từ ngày cấp.

        c) Giấy phép lái xe các hạng C, D1, D2, D, BE, C1E, CE, D1E, D2E và DE có thời hạn 05 năm kể từ ngày cấp.


**Tóm lại:** Giấy phép lái xe hạng DE cho phép điều khiển xe ô tô chở người trên 29 chỗ (kể cả xe buýt, xe giường nằm) kéo rơ moóc trên 750 kg và xe ô tô chở khách nối toa. Giấy phép này có thời hạn 5 năm.
",Hạng DE cho phép lái xe ô tô chở người trên 30 chỗ ngồi kéo rơ moóc có trọng tải trên 750 kg.,1.0,0.5435950259089726,1.0,0.3333333333
10,Luật Giao thông Đường bộ 2025 quy định như thế nào về điểm giấy phép lái xe?,"['1. phạt tiền từ 400.000 đồng đến 600.000 đồng đối với người điều khiển xe thực hiện một trong các hành vi vi phạm sau đây: a) không chấp hành hiệu lệnh, chỉ dẫn của biển báo hiệu, vạch kẻ đường, trừ các hành vi vi phạm quy định tại điểm a, điểm c, điểm d, điểm đ khoản 2; điểm a, điểm d, điểm đ, điểm e, điểm n, điểm o khoản 3; điểm a, điểm b, điểm đ, điểm e, điểm i, điểm k, điểm l khoản 4; điểm a, điểm b, điểm c, điểm d, điểm đ, điểm i, điểm k khoản 5; điểm a khoản 6; khoản 7; điểm b, điểm d khoản 9; điểm a khoản 10; điểm đ khoản 11 điều này; b) khi ra, vào vị trí dừng xe, đỗ xe không có tín hiệu báo cho người điều khiển phương tiện khác biết; c) không báo hiệu bằng đèn khẩn cấp hoặc không đặt biển cảnh báo “chú ý xe đỗ” theo quy định trong trường hợp gặp sự cố kỹ thuật (hoặc bất khả kháng khác) buộc phải đỗ xe chiếm một phần đường xe chạy hoặc tại nơi không được phép đỗ xe, trừ hành vi vi phạm quy định tại điểm c khoản 7 điều này; d) không gắn biển báo hiệu ở phía trước xe kéo, phía sau xe được kéo; điều khiển xe kéo rơ moóc không có biển báo hiệu theo quy định; đ) sử dụng còi trong thời gian từ 22 giờ ngày hôm trước đến 05 giờ ngày hôm sau trong khu đông dân cư, khu vực cơ sở khám bệnh, chữa bệnh, trừ các xe ưu tiên đang đi làm nhiệm vụ theo quy định. 2. phạt tiền từ 600.000 đồng đến 800.000 đồng đối với người điều khiển xe thực hiện một trong các hành vi vi phạm sau đây: a) chuyển làn đường không đúng nơi cho phép hoặc không có tín hiệu báo trước hoặc chuyển làn đường không đúng quy định “mỗi lần chuyển làn đường chỉ được phép chuyển sang một làn đường liền kề”, trừ các hành vi vi phạm quy định tại điểm g khoản 5 điều này; b) chở người trên buồng lái quá số lượng quy định; c) không tuân thủ các quy định về nhường đường tại nơi đường bộ giao nhau, trừ các hành vi vi phạm quy định tại điểm n, điểm o khoản 5 điều này; d) dừng xe, đỗ xe trên phần đường xe chạy ở đoạn đường ngoài đô thị nơi có lề đường rộng; dừng xe, đỗ xe không sát mép đường phía bên phải theo chiều đi ở nơi đường có lề đường hẹp hoặc không có lề đường; dừng xe, đỗ xe ngược với chiều lưu thông của làn đường; dừng xe, đỗ xe trên dải phân cách cố định ở giữa hai phần đường xe chạy; đỗ xe trên dốc không chèn bánh; đ) dừng xe không sát theo lề đường, vỉa hè phía bên phải theo chiều đi hoặc bánh xe gần nhất cách lề đường, vỉa hè quá 0,25 mét; dừng xe trên đường dành riêng cho xe buýt; dừng xe trên miệng cống thoát nước, miệng hầm của đường điện thoại, điện cao thế, chỗ dành riêng cho xe chữa cháy lấy nước; rời vị trí lái, tắt máy khi dừng xe (trừ trường hợp rời khỏi vị trí lái để đóng, mở cửa xe, xếp dỡ hàng hóa, kiểm tra kỹ thuật xe) hoặc rời vị trí lái khi dừng xe nhưng không sử dụng phanh đỗ xe (hoặc thực hiện biện pháp an toàn khác); dừng xe, đỗ xe không đúng vị trí quy định ở những đoạn có bố trí nơi dừng xe, đỗ xe; dừng xe, đỗ xe trên phần đường dành cho người đi bộ qua đường; dừng xe nơi có biển “cấm dừng xe và đỗ xe”, trừ hành vi vi phạm quy định tại điểm đ khoản 4, điểm c khoản 7 điều này. 3. phạt tiền từ 800.000 đồng đến 1.000.000 đồng đối với người điều khiển xe thực hiện một trong các hành vi vi phạm sau đây: a) điều khiển xe chạy quá tốc độ quy định từ 05 km/h đến dưới 10 km/h; b) sử dụng còi, rú ga liên tục; sử dụng còi hơi, sử dụng đèn chiếu xa khi gặp người đi bộ qua đường hoặc khi đi trên đoạn đường qua khu dân cư có hệ thống chiếu sáng đang hoạt động hoặc khi gặp xe đi ngược chiều (trừ trường hợp dải phân cách có khả năng chống chói) hoặc khi chuyển hướng xe tại nơi đường giao nhau, trừ các xe ưu tiên đang đi làm nhiệm vụ theo quy định; c) chuyển hướng không quan sát hoặc không bảo đảm khoảng cách an toàn với xe phía sau hoặc không giảm tốc độ hoặc không có tín hiệu báo hướng rẽ hoặc có tín hiệu báo hướng rẽ nhưng không sử dụng liên tục trong quá trình chuyển hướng (trừ trường hợp điều khiển xe đi theo hướng cong của đoạn đường bộ ở nơi đường không giao nhau cùng mức); d) không tuân thủ các quy định về dừng xe, đỗ xe tại nơi đường bộ giao nhau cùng mức với đường sắt; dừng xe, đỗ xe trong phạm vi bảo vệ công trình đường sắt, phạm vi an toàn của đường sắt; đ) dừng xe, đỗ xe tại vị trí: nơi đường bộ giao nhau hoặc trong phạm vi 05 mét tính từ mép đường giao nhau; điểm đón, trả khách; trước cổng hoặc trong phạm vi 05 mét hai bên cổng trụ sở cơ quan, tổ chức có bố trí đường cho xe ra, vào; nơi phần đường có bề rộng chỉ đủ cho một làn xe cơ giới; che khuất biển báo hiệu đường bộ, đèn tín hiệu giao thông; nơi mở dải phân cách giữa; cách xe ô tô đang đỗ ngược chiều dưới 20 mét trên đường phố hẹp, dưới 40 mét trên đường có một làn xe cơ giới trên một chiều đường; e) đỗ xe không sát theo lề đường, vỉa hè phía bên phải theo chiều đi hoặc bánh xe gần nhất cách lề đường, vỉa hè quá 0,25 mét; đỗ xe trên đường dành riêng cho xe buýt; đỗ xe trên miệng cống thoát nước, miệng hầm của đường điện thoại, điện cao thế, chỗ dành riêng cho xe chữa cháy lấy nước; đỗ, để xe ở vỉa hè trái quy định của pháp luật; đỗ xe nơi có biển “cấm đỗ xe” hoặc biển “cấm dừng xe và đỗ xe”, trừ hành vi vi phạm quy định tại điểm đ khoản 4, điểm c khoản 7 điều này; g) không sử dụng hoặc sử dụng không đủ đèn chiếu sáng trong thời gian từ 18 giờ ngày hôm trước đến 06 giờ ngày hôm sau hoặc khi có sương mù, khói, bụi, trời mưa, thời tiết xấu làm hạn chế tầm nhìn; h) điều khiển xe ô tô kéo theo xe khác, vật khác (trừ trường hợp kéo theo một rơ moóc, sơ mi rơ moóc hoặc một xe ô tô, xe máy chuyên dùng khác khi xe này không tự chạy được); điều khiển xe ô tô đẩy xe khác, vật khác; điều khiển xe kéo rơ moóc, sơ mi rơ moóc kéo thêm rơ moóc hoặc xe khác, vật khác; không nối chắc chắn, an toàn giữa xe kéo và xe được kéo khi kéo nhau; i) chở người trên xe được kéo, trừ người điều khiển; k) không thắt dây đai an toàn khi điều khiển xe chạy trên đường; l) chở người trên xe ô tô không thắt dây đai an toàn (tại vị trí có trang bị dây đai an toàn) khi xe đang chạy; m) chở trẻ em dưới 10 tuổi và chiều cao dưới 1,35 mét trên xe ô tô ngồi cùng hàng ghế với người lái xe (trừ loại xe ô tô chỉ có một hàng ghế) hoặc không sử dụng thiết bị an toàn phù hợp cho trẻ em theo quy định; n) chạy trong hầm đường bộ không sử dụng đèn chiếu sáng gần; o) điều khiển xe chạy dưới tốc độ tối thiểu trên đoạn đường bộ có quy định tốc độ tối thiểu cho phép; p) điều khiển xe chạy tốc độ thấp hơn các xe khác đi cùng chiều mà không đi về làn đường bên phải chiều đi của mình, trừ trường hợp các xe khác đi cùng chiều chạy quá tốc độ quy định. 4. phạt tiền từ 2.000.000 đồng đến 3.000.000 đồng đối với người điều khiển xe thực hiện một trong các hành vi vi phạm sau đây: a) điều khiển xe không đủ điều kiện đã thu phí theo hình thức điện tử tự động không dừng (xe không gắn thẻ đầu cuối) đi vào làn đường dành riêng thu phí theo hình thức điện tử tự động không dừng tại các trạm thu phí; b) dừng xe, đỗ xe tại vị trí: bên trái đường một chiều hoặc bên trái (theo hướng lưu thông) của đường đôi; trên đoạn đường cong hoặc gần đầu dốc nơi tầm nhìn bị che khuất; trên cầu (trừ trường hợp tổ chức giao thông cho phép), gầm cầu vượt (trừ những nơi cho phép dừng xe, đỗ xe), song song với một xe khác đang dừng, đỗ, trừ hành vi vi phạm quy định tại điểm c khoản 7 điều này; c) không thực hiện biện pháp bảo đảm an toàn theo quy định khi xe ô tô bị hư hỏng ngay tại nơi đường bộ giao nhau cùng mức với đường sắt; d) không nhường đường cho xe xin vượt khi có đủ điều kiện an toàn; đ) lùi xe, quay đầu xe trong hầm đường bộ; dừng xe, đỗ xe trong hầm đường bộ không đúng nơi quy định; không có báo hiệu bằng đèn khẩn cấp, không đặt biển cảnh báo ""chú ý xe đỗ"" (hoặc đèn cảnh báo) về phía sau xe khoảng cách đảm bảo an toàn khi dừng xe, đỗ xe trong hầm đường bộ trong trường hợp gặp sự cố kỹ thuật hoặc bất khả kháng khác buộc phải dừng xe, đỗ xe; e) lùi xe ở đường một chiều, đường có biển “cấm đi ngược chiều”, khu vực cấm dừng, trên phần đường dành cho người đi bộ qua đường, nơi đường bộ giao nhau, nơi đường bộ giao nhau cùng mức với đường sắt, nơi tầm nhìn bị che khuất; lùi xe không quan sát hai bên, phía sau xe hoặc không có tín hiệu lùi xe, trừ hành vi vi phạm quy định tại điểm đ khoản 11 điều này; g) điều khiển xe có liên quan trực tiếp đến vụ tai nạn giao thông mà không dừng ngay phương tiện, không giữ nguyên hiện trường, không trợ giúp người bị nạn, trừ hành vi vi phạm quy định tại khoản 8 điều này; h) xe được quyền ưu tiên lắp đặt, sử dụng thiết bị phát tín hiệu ưu tiên không đúng quy định hoặc sử dụng thiết bị phát tín hiệu ưu tiên mà không có giấy phép của cơ quan có thẩm quyền cấp hoặc có giấy phép của cơ quan có thẩm quyền cấp nhưng không còn giá trị sử dụng theo quy định; i) quay đầu xe ở phần đường dành cho người đi bộ qua đường, trên cầu, đầu cầu, gầm cầu vượt, ngầm, tại nơi đường bộ giao nhau cùng mức với đường sắt, đường hẹp, đường dốc, đoạn đường cong tầm nhìn bị che khuất, trên đường một chiều, trừ khi có hiệu lệnh của người điều khiển giao thông hoặc chỉ dẫn của biển báo hiệu tạm thời hoặc tổ chức giao thông tại những khu vực này có bố trí nơi quay đầu xe; k) quay đầu xe tại nơi có biển báo hiệu có nội dung cấm quay đầu đối với loại phương tiện đang điều khiển; điều khiển xe rẽ trái tại nơi có biển báo hiệu có nội dung cấm rẽ trái đối với loại phương tiện đang điều khiển; điều khiển xe rẽ phải tại nơi có biển báo hiệu có nội dung cấm rẽ phải đối với loại phương tiện đang điều khiển; l) không giữ khoảng cách an toàn để xảy ra va chạm với xe chạy liền trước hoặc không giữ khoảng cách theo quy định của biển báo hiệu “cự ly tối thiểu giữa hai xe”, trừ các hành vi vi phạm quy định tại điểm d khoản 5 điều này. 5. phạt tiền từ 4.000.000 đồng đến 6.000.000 đồng đối với người điều khiển xe thực hiện một trong các hành vi vi phạm sau đây: a) vượt xe trong những trường hợp không được vượt, vượt xe tại đoạn đường có biển báo hiệu có nội dung cấm vượt (đối với loại phương tiện đang điều khiển); không có tín hiệu trước khi vượt hoặc có tín hiệu vượt xe nhưng không sử dụng trong suốt quá trình vượt xe; vượt bên phải xe khác trong trường hợp không được phép; b) điều khiển xe không đi bên phải theo chiều đi của mình; đi không đúng phần đường hoặc làn đường quy định (làn cùng chiều hoặc làn ngược chiều) trừ hành vi quy định tại điểm a khoản 4 điều này; điều khiển xe đi qua dải phân cách cố định ở giữa hai phần đường xe chạy; c) tránh xe đi ngược chiều không đúng quy định (trừ hành vi vi phạm sử dụng đèn chiếu xa khi tránh xe đi ngược chiều quy định tại điểm b khoản 3 điều này); không nhường đường cho xe đi ngược chiều theo quy định tại nơi đường hẹp, đường dốc, nơi có chướng ngại vật; d) không tuân thủ quy định khi vào hoặc ra đường cao tốc; điều khiển xe chạy ở làn dừng xe khẩn cấp hoặc phần lề đường của đường cao tốc; không tuân thủ quy định về khoảng cách an toàn đối với xe chạy liền trước khi chạy trên đường cao tốc; đ) điều khiển xe chạy quá tốc độ quy định từ 10 km/h đến 20 km/h; e) xe không được quyền ưu tiên lắp đặt, sử dụng thiết bị phát tín hiệu của xe được quyền ưu tiên; g) chuyển làn đường không đúng nơi cho phép hoặc không có tín hiệu báo trước hoặc chuyển làn đường không đúng quy định “mỗi lần chuyển làn đường chỉ được phép chuyển sang một làn đường liền kề” khi chạy trên đường cao tốc; h) dùng tay cầm và sử dụng điện thoại hoặc các thiết bị điện tử khác khi điều khiển phương tiện tham gia giao thông đang di chuyển trên đường bộ; i) đi vào khu vực cấm, đường có biển báo hiệu có nội dung cấm đi vào đối với loại phương tiện đang điều khiển, trừ các hành vi vi phạm quy định tại điểm d khoản 9, điểm đ khoản 11 điều này, hành vi bị cấm đi vào công trình thủy lợi và các trường hợp xe ưu tiên đang đi làm nhiệm vụ khẩn cấp theo quy định; k) dừng xe, đỗ xe, quay đầu xe trái quy định gây ùn tắc giao thông; l) chuyển hướng không nhường quyền đi trước cho: người đi bộ, xe lăn của người khuyết tật qua đường tại nơi có vạch kẻ đường dành cho người đi bộ; xe thô sơ đang đi trên phần đường dành cho xe thô sơ; m) chuyển hướng không nhường đường cho: các xe đi ngược chiều; người đi bộ, xe thô sơ đang qua đường tại nơi không có vạch kẻ đường cho người đi bộ; n) không giảm tốc độ (hoặc dừng lại) và nhường đường khi điều khiển xe đi từ đường không ưu tiên ra đường ưu tiên, từ đường nhánh ra đường chính; o) không giảm tốc độ và nhường đường cho xe đi đến từ bên phải tại nơi đường giao nhau không có báo hiệu đi theo vòng xuyến; không giảm tốc độ và nhường đường cho xe đi đến từ bên trái tại nơi đường giao nhau có báo hiệu đi theo vòng xuyến; p) chở người trên thùng xe trái quy định; chở người trên nóc xe; để người đu bám ở cửa xe, bên ngoài thành xe khi xe đang chạy; q) mở cửa xe, để cửa xe mở không bảo đảm an toàn. 6. phạt tiền từ 6.000.000 đồng đến 8.000.000 đồng đối với người điều khiển xe thực hiện một trong các hành vi vi phạm sau đây: a) điều khiển xe chạy quá tốc độ quy định trên 20 km/h đến 35 km/h; b) không nhường đường hoặc gây cản trở xe được quyền ưu tiên đang phát tín hiệu ưu tiên đi làm nhiệm vụ; c) điều khiển xe trên đường mà trong máu hoặc hơi thở có nồng độ cồn nhưng chưa vượt quá 50 miligam/100 mililít máu hoặc chưa vượt quá 0,25 miligam/1 lít khí thở; d) điều khiển xe đi trên vỉa hè, trừ trường hợp điều khiển xe đi qua vỉa hè để vào nhà, cơ quan. 7. phạt tiền từ 12.000.000 đồng đến 14.000.000 đồng đối với người điều khiển xe thực hiện một trong các hành vi vi phạm sau đây: a) điều khiển xe chạy quá tốc độ quy định trên 35 km/h; b) điều khiển xe chở người bốn bánh có gắn động cơ, xe chở hàng bốn bánh có gắn động cơ đi vào đường cao tốc; c) dừng xe, đỗ xe trên đường cao tốc không đúng nơi quy định; không có báo hiệu bằng đèn khẩn cấp khi gặp sự cố kỹ thuật hoặc bất khả kháng khác buộc phải dừng xe, đỗ xe ở làn dừng xe khẩn cấp trên đường cao tốc; không có báo hiệu bằng đèn khẩn cấp, không đặt biển cảnh báo “chú ý xe đỗ” (hoặc đèn cảnh báo) về phía sau xe khoảng cách tối thiểu 150 mét khi dừng xe, đỗ xe trong trường hợp gặp sự cố kỹ thuật hoặc bất khả kháng khác buộc phải dừng xe, đỗ xe trên một phần làn đường xe chạy trên đường cao tốc. 8. phạt tiền từ 16.000.000 đồng đến 18.000.000 đồng đối với người điều khiển xe thực hiện hành vi vi phạm gây tai nạn giao thông không dừng ngay phương tiện, không giữ nguyên hiện trường, không trợ giúp người bị nạn, không ở lại hiện trường hoặc không đến trình báo ngay với cơ quan công an, ủy ban nhân dân nơi gần nhất. 9. phạt tiền từ 18.000.000 đồng đến 20.000.000 đồng đối với người điều khiển xe thực hiện một trong các hành vi vi phạm sau đây: a) điều khiển xe trên đường mà trong máu hoặc hơi thở có nồng độ cồn vượt quá 50 miligam đến 80 miligam/100 mililít máu hoặc vượt quá 0,25 miligam đến 0,4 miligam/1 lít khí thở; b) không chấp hành hiệu lệnh của đèn tín hiệu giao thông; c) không chấp hành hiệu lệnh, hướng dẫn của người điều khiển giao thông hoặc người kiểm soát giao thông; d) đi ngược chiều của đường một chiều, đi ngược chiều trên đường có biển ""cấm đi ngược chiều”, trừ các hành vi vi phạm quy định tại điểm đ khoản 11 điều này và các trường hợp xe ưu tiên đang đi làm nhiệm vụ khẩn cấp theo quy định. 10. phạt tiền từ 20.000.000 đồng đến 22.000.000 đồng đối với người điều khiển xe thực hiện một trong các hành vi vi phạm sau đây: a) điều khiển xe không quan sát, giảm tốc độ hoặc dừng lại để bảo đảm an toàn theo quy định mà gây tai nạn giao thông; điều khiển xe chạy quá tốc độ quy định gây tai nạn giao thông; dừng xe, đỗ xe, quay đầu xe, lùi xe, tránh xe, vượt xe, chuyển hướng, chuyển làn đường không đúng quy định gây tai nạn giao thông; không đi đúng phần đường, làn đường, không giữ khoảng cách an toàn giữa hai xe theo quy định gây tai nạn giao thông hoặc đi vào đường có biển báo hiệu có nội dung cấm đi vào đối với loại phương tiện đang điều khiển gây tai nạn giao thông, trừ các hành vi vi phạm quy định tại điểm đ khoản 11 điều này; b) vi phạm quy định tại một trong các điểm, khoản sau của điều này mà gây tai nạn giao thông: điểm a, điểm b, điểm c, điểm d, điểm đ khoản 1; điểm c khoản 2; điểm b, điểm g, điểm h, điểm n, điểm o, điểm p, khoản 3; điểm a, điểm c, điểm d khoản 4; điểm c, điểm d, điểm e, điểm h, điểm n, điểm o, điểm q khoản 5; điểm b khoản 7; điểm b, điểm c, điểm d khoản 9 điều này. 11. phạt tiền từ 30.000.000 đồng đến 40.000.000 đồng đối với người điều khiển xe thực hiện một trong các hành vi vi phạm sau đây: a) điều khiển xe trên đường mà trong máu hoặc hơi thở có nồng độ cồn vượt quá 80 miligam/100 mililít máu hoặc vượt quá 0,4 miligam/1 lít khí thở; b) không chấp hành yêu cầu kiểm tra về nồng độ cồn của người thi hành công vụ; c) điều khiển xe trên đường mà trong cơ thể có chất ma túy hoặc chất kích thích khác mà pháp luật cấm sử dụng; d) không chấp hành yêu cầu kiểm tra về chất ma túy hoặc chất kích thích khác mà pháp luật cấm sử dụng của người thi hành công vụ; đ) điều khiển xe đi ngược chiều trên đường cao tốc, lùi xe trên đường cao tốc, quay đầu xe trên đường cao tốc, trừ các xe ưu tiên đang đi làm nhiệm vụ khẩn cấp theo quy định. 12. phạt tiền từ 40.000.000 đồng đến 50.000.000 đồng đối với người điều khiển xe thực hiện hành vi điều khiển xe lạng lách, đánh võng trên đường bộ; chạy quá tốc độ đuổi nhau trên đường bộ; dùng chân điều khiển vô lăng xe khi xe đang chạy trên đường bộ. 13. phạt tiền từ 50.000.000 đồng đến 70.000.000 đồng đối với người điều khiển xe thực hiện hành vi vi phạm quy định tại khoản 12 điều này mà gây tai nạn giao thông. 14. tịch thu phương tiện đối với người điều khiển xe tái phạm hành vi điều khiển xe lạng lách, đánh võng quy định tại khoản 12 điều này. 15. ngoài việc bị phạt tiền, người điều khiển xe thực hiện hành vi vi phạm còn bị áp dụng các hình thức xử phạt bổ sung sau đây: a) thực hiện hành vi quy định tại điểm e khoản 5 điều này còn bị tịch thu thiết bị phát tín hiệu ưu tiên lắp đặt, sử dụng trái quy định; b) thực hiện hành vi quy định tại khoản 12 điều này bị tước quyền sử dụng giấy phép lái xe từ 10 tháng đến 12 tháng; c) thực hiện hành vi quy định tại điểm a, điểm b, điểm c, điểm d khoản 11; khoản 13; khoản 14 điều này bị tước quyền sử dụng giấy phép lái xe từ 22 tháng đến 24 tháng. 16. ngoài việc bị áp dụng hình thức xử phạt, người điều khiển xe thực hiện hành vi vi phạm còn bị trừ điểm giấy phép lái xe như sau: a) thực hiện hành vi quy định tại điểm h, điểm i khoản 3; điểm a, điểm b, điểm c, điểm d, điểm đ, điểm g khoản 4; điểm a, điểm b, điểm c, điểm d, điểm đ, điểm e, điểm g, điểm i, điểm k, điểm n, điểm o khoản 5 điều này bị trừ điểm giấy phép lái xe 02 điểm; b) thực hiện hành vi quy định tại điểm h khoản 5; khoản 6; điểm b khoản 7; điểm b, điểm c, điểm d khoản 9 điều này bị trừ điểm giấy phép lái xe 04 điểm; c) thực hiện hành vi quy định tại điểm p khoản 5; điểm a, điểm c khoản 7; khoản 8 điều này bị trừ điểm giấy phép lái xe 06 điểm; d) thực hiện hành vi quy định tại điểm a khoản 9, khoản 10, điểm đ khoản 11 điều này bị trừ điểm giấy phép lái xe 10 điểm.', '1. phạt tiền từ 100.000 đồng đến 200.000 đồng đối với hành vi vi phạm: không hướng dẫn hành khách đứng, nằm, ngồi đúng vị trí quy định trong xe. 2. phạt tiền từ 400.000 đồng đến 600.000 đồng trên mỗi người vượt quá quy định được phép chở của phương tiện nhưng tổng mức phạt tiền tối đa không vượt quá 75.000.000 đồng đối với người điều khiển xe ô tô chở hành khách, ô tô chở người (trừ xe buýt) thực hiện hành vi vi phạm chở quá số người quy định được phép chở của phương tiện, trừ các hành vi vi phạm quy định tại khoản 4 điều này. 3. phạt tiền từ 600.000 đồng đến 800.000 đồng đối với một trong các hành vi vi phạm sau đây: a) không đóng cửa lên xuống khi xe đang chạy; b) để người ngồi trên xe khi xe xuống phà, đang trên phà và khi lên bến (trừ người lái xe, trẻ em, phụ nữ mang thai, người già yếu, người bệnh, người khuyết tật); c) không chạy đúng tuyến đường, lịch trình, hành trình vận tải được phép hoạt động theo quy định; d) để người mắc võng nằm trên xe khi xe đang chạy; đ) sắp xếp, chằng buộc hành lý, hàng hóa không bảo đảm an toàn; để rơi hành lý, hàng hóa trên xe xuống đường; để hàng hóa trong khoang chở hành khách; e) chở hành lý, hàng hóa vượt quá kích thước bao ngoài của xe; g) điều khiển xe vận tải hành khách không có nhân viên phục vụ trên xe đối với những xe quy định phải có nhân viên phục vụ; h) điều khiển xe ô tô kinh doanh vận tải không có dây đai an toàn tại các vị trí ghế ngồi, giường nằm theo quy định (trừ xe buýt nội tỉnh); i) điều khiển xe ô tô kinh doanh vận tải không có hướng dẫn cho hành khách về an toàn giao thông và thoát hiểm khi xảy ra sự cố trên xe theo quy định; k) điều khiển xe không niêm yết hành trình chạy xe hoặc niêm yết hành trình chạy xe không đúng với hành trình đã được cơ quan có thẩm quyền cấp phép. 4. phạt tiền từ 1.000.000 đồng đến 2.000.000 đồng trên mỗi người vượt quá quy định được phép chở của phương tiện nhưng tổng mức phạt tiền tối đa không vượt quá 75.000.000 đồng đối với người điều khiển xe ô tô chở hành khách (kinh doanh vận tải hành khách theo tuyến cố định, hợp đồng) chạy tuyến có cự ly lớn hơn 300 km thực hiện hành vi vi phạm chở quá số người quy định được phép chở của phương tiện. 5. phạt tiền từ 1.000.000 đồng đến 2.000.000 đồng đối với một trong các hành vi vi phạm sau đây: a) để người lên, xuống xe khi xe đang chạy; b) xếp hành lý, hàng hóa trên xe làm lệch xe; c) đón, trả hành khách không đúng nơi quy định trên những tuyến đường đã xác định nơi đón, trả khách hoặc dừng đón, trả hành khách quá thời gian quy định, trừ hành vi vi phạm quy định tại khoản 8 điều này; d) đón, trả hành khách tại nơi cấm dừng, cấm đỗ, nơi đường cong tầm nhìn bị che khuất, trừ hành vi vi phạm quy định tại khoản 8 điều này; đ) điều khiển xe vận tải hành khách theo hợp đồng sử dụng hợp đồng bằng văn bản giấy không có hoặc không mang theo danh sách hành khách theo quy định, chở người không có tên trong danh sách hành khách hoặc vận chuyển không đúng đối tượng theo quy định (đối với xe kinh doanh vận tải hành khách theo hợp đồng vận chuyển trẻ em mầm non, học sinh, sinh viên, cán bộ, công chức, viên chức, công nhân), không có hoặc không mang theo hợp đồng vận tải hoặc có hợp đồng vận tải nhưng không đúng theo quy định; e) vận chuyển hành khách theo tuyến cố định không có hoặc không mang theo lệnh vận chuyển hoặc có mang theo lệnh vận chuyển nhưng không ghi đầy đủ thông tin, không có xác nhận của bến xe khách nơi đi, bến xe khách nơi đến theo quy định; g) đón, trả hành khách không đúng địa điểm đón, trả hành khách được ghi trong hợp đồng, trừ hành vi vi phạm quy định tại khoản 8 điều này; h) vận chuyển khách liên vận quốc tế theo tuyến cố định không có hoặc không mang theo lệnh vận chuyển, không có danh sách hành khách theo quy định hoặc chở người không có tên trong danh sách hành khách, trừ hành vi vi phạm quy định tại điểm b khoản 1 điều 37 của nghị định này; i) chở hành lý, hàng hóa vượt quá trọng tải theo thiết kế của xe; k) không sử dụng thẻ nhận dạng lái xe để đăng nhập thông tin theo quy định hoặc sử dụng thẻ nhận dạng lái xe của lái xe khác để đăng nhập thông tin khi điều khiển xe ô tô chở khách; l) điều khiển xe ô tô chở người từ 08 chỗ trở lên (không kể chỗ của người lái xe) kinh doanh vận tải hành khách không lắp thiết bị ghi nhận hình ảnh người lái xe hoặc có lắp thiết bị ghi nhận hình ảnh người lái xe nhưng không có tác dụng trong quá trình xe tham gia giao thông theo quy định hoặc làm sai lệch dữ liệu của thiết bị ghi nhận hình ảnh người lái xe lắp trên xe ô tô; m) điều khiển xe vận tải hành khách theo hợp đồng sử dụng hợp đồng điện tử không có thiết bị để truy cập được nội dung của hợp đồng điện tử và danh sách hành khách hoặc có nhưng không cung cấp cho lực lượng chức năng khi có yêu cầu, chở người không có tên trong danh sách hành khách hoặc vận chuyển không đúng đối tượng theo quy định (đối với xe kinh doanh vận tải hành khách theo hợp đồng vận chuyển trẻ em mầm non, học sinh, sinh viên, cán bộ, công chức, viên chức, công nhân). 6. phạt tiền từ 3.000.000 đồng đến 5.000.000 đồng đối với một trong các hành vi vi phạm sau đây: a) vận chuyển hàng hóa nguy hiểm, hàng độc hại, dễ cháy, dễ nổ, động vật, hàng có mùi hôi thối hoặc hàng hóa khác ảnh hưởng đến sức khỏe của hành khách trên xe; b) chở người trên mui xe, trong khoang chở hành lý của xe; c) đe dọa, xúc phạm, tranh giành, lôi kéo hành khách; đe dọa, cưỡng ép hành khách sử dụng dịch vụ ngoài ý muốn; chuyển tải, xuống khách hoặc các hành vi khác nhằm trốn tránh phát hiện xe chở quá tải, quá số người theo quy định của pháp luật; d) điều khiển xe ô tô kinh doanh vận tải quá thời gian quy định tại khoản 1 điều 64 của luật trật tự, an toàn giao thông đường bộ; không thực hiện đúng quy định về thời gian nghỉ giữa hai lần lái xe liên tục của người lái xe; đ) điều khiển xe kinh doanh vận tải hành khách không lắp thiết bị giám sát hành trình của xe theo quy định hoặc có lắp thiết bị giám sát hành trình của xe nhưng thiết bị không hoạt động theo quy định hoặc làm sai lệch dữ liệu của thiết bị giám sát hành trình của xe ô tô; e) điều khiển xe chở hành khách liên vận quốc tế không có hoặc không gắn ký hiệu phân biệt quốc gia. 7. phạt tiền từ 5.000.000 đồng đến 7.000.000 đồng đối với hành vi vi phạm điều khiển xe chở hành khách không có hoặc không gắn phù hiệu theo quy định hoặc có nhưng đã hết giá trị sử dụng hoặc sử dụng phù hiệu không do cơ quan có thẩm quyền cấp. 8. phạt tiền từ 10.000.000 đồng đến 12.000.000 đồng đối với người điều khiển xe thực hiện hành vi đón, trả hành khách trên đường cao tốc. 9. ngoài việc bị áp dụng hình thức xử phạt, người điều khiển phương tiện thực hiện hành vi vi phạm quy định tại khoản 7 điều này bị thu hồi phù hiệu đã hết giá trị sử dụng hoặc phù hiệu không do cơ quan có thẩm quyền cấp. 10. ngoài việc bị áp dụng hình thức xử phạt, người điều khiển phương tiện thực hiện hành vi vi phạm còn bị trừ điểm giấy phép lái xe như sau: a) thực hiện hành vi quy định tại điểm c, điểm d, điểm e khoản 3; điểm a, điểm b, điểm c, điểm d, điểm đ, điểm e, điểm g, điểm h, điểm i, điểm k, điểm m khoản 5; khoản 6; khoản 7 điều này bị trừ điểm giấy phép lái xe 02 điểm; b) thực hiện hành vi quy định tại khoản 2, khoản 4 (trường hợp vượt trên 50% đến 100% số người quy định được phép chở của phương tiện) điều này bị trừ điểm giấy phép lái xe 04 điểm; c) thực hiện hành vi vi phạm quy định tại khoản 8 điều này bị trừ điểm giấy phép lái xe 06 điểm; d) thực hiện hành vi quy định tại khoản 2, khoản 4 (trường hợp vượt trên 100% số người quy định được phép chở của phương tiện) điều này bị trừ điểm giấy phép lái xe 10 điểm.', '1. điểm của giấy phép lái xe được dùng để quản lý việc chấp hành pháp luật về trật tự, an toàn giao thông đường bộ của người lái xe trên hệ thống cơ sở dữ liệu về trật tự, an toàn giao thông đường bộ, bao gồm 12 điểm. số điểm trừ mỗi lần vi phạm tùy thuộc tính chất, mức độ của hành vi vi phạm pháp luật về trật tự, an toàn giao thông đường bộ. dữ liệu về điểm trừ giấy phép lái xe của người vi phạm sẽ được cập nhật vào hệ thống cơ sở dữ liệu ngay sau khi quyết định xử phạt có hiệu lực thi hành và thông báo cho người bị trừ điểm giấy phép lái xe biết. 2. giấy phép lái xe chưa bị trừ hết điểm và không bị trừ điểm trong thời hạn 12 tháng từ ngày bị trừ điểm gần nhất thì được phục hồi đủ 12 điểm. 3. trường hợp giấy phép lái xe bị trừ hết điểm thì người có giấy phép lái xe không được điều khiển phương tiện tham gia giao thông đường bộ theo giấy phép lái xe đó. sau thời hạn ít nhất là 06 tháng kể từ ngày bị trừ hết điểm, người có giấy phép lái xe được tham gia kiểm tra nội dung kiến thức pháp luật về trật tự, an toàn giao thông đường bộ theo quy định tại khoản 7 điều 61 của luật này do lực lượng cảnh sát giao thông tổ chức, có kết quả đạt yêu cầu thì được phục hồi đủ 12 điểm. 4. giấy phép lái xe sau khi đổi, cấp lại, nâng hạng được giữ nguyên số điểm của giấy phép lái xe trước khi đổi, cấp lại, nâng hạng. 5. người có thẩm quyền xử phạt vi phạm hành chính có thẩm quyền trừ điểm giấy phép lái xe. 6. chính phủ quy định chi tiết khoản 1 điều này; quy định trình tự, thủ tục, thẩm quyền trừ điểm, phục hồi điểm giấy phép lái xe; quy định lộ trình thực hiện điều này. bộ trưởng bộ công an quy định chi tiết khoản 3 điều này.', '1. điểm của giấy phép lái xe quân sự gồm 12 điểm theo quy định của luật trật tự, an toàn giao thông đường bộ, được dùng để quản lý việc chấp hành pháp luật về trật tự, an toàn giao thông đường bộ của người lái xe. số điểm trừ mỗi lần tùy theo tính chất, mức độ vi phạm theo quy định của pháp luật. giấy phép lái xe chưa bị trừ hết điểm và không bị trừ điểm trong thời hạn 12 tháng kể từ ngày bị trừ điểm gần nhất thì được phục hồi đủ 12 điểm. 2. trường hợp giấy phép lái xe quân sự bị trừ hết điểm, sau thời hạn ít nhất 06 tháng kể từ ngày bị trừ hết điểm, người có giấy phép lái xe quân sự bị trừ hết điểm được tham gia kiểm tra kiến thức pháp luật về giao thông đường bộ tổ chức tại cơ sở đào tạo lái xe quân sự theo quy định tại điểm a khoản 1 điều 40 và khoản 1 điều 41 thông tư này, nếu kết quả đặt yêu cầu được phục hồi đủ 12 điểm. 3. điểm của giấy phép lái xe quân sự đổi, cấp lại, đào tạo nâng hạng được giữ nguyên như trước khi đổi, cấp lại, đào tạo nâng hạng.']","**Nguồn văn bản:** 36_2024_QH15_444251

**Tên văn bản:** Luật Trật tự, an toàn giao thông đường bộ

**Điều 58:** Điểm của giấy phép lái xe

**Nội dung:**

1. Điểm của giấy phép lái xe được dùng để quản lý việc chấp hành pháp luật về trật tự, an toàn giao thông đường bộ của người lái xe trên hệ thống cơ sở dữ liệu về trật tự, an toàn giao thông đường bộ, bao gồm 12 điểm.

    Số điểm trừ mỗi lần vi phạm tùy thuộc tính chất, mức độ của hành vi vi phạm pháp luật về trật tự, an toàn giao thông đường bộ.

    Dữ liệu về điểm trừ giấy phép lái xe của người vi phạm sẽ được cập nhật vào hệ thống cơ sở dữ liệu ngay sau khi quyết định xử phạt có hiệu lực thi hành và thông báo cho người bị trừ điểm giấy phép lái xe biết.


2. Giấy phép lái xe chưa bị trừ hết điểm và không bị trừ điểm trong thời hạn 12 tháng từ ngày bị trừ điểm gần nhất thì được phục hồi đủ 12 điểm.


3. Trường hợp giấy phép lái xe bị trừ hết điểm thì người có giấy phép lái xe không được điều khiển phương tiện tham gia giao thông đường bộ theo giấy phép lái xe đó. 

    Sau thời hạn ít nhất là 06 tháng kể từ ngày bị trừ hết điểm, người có giấy phép lái xe được tham gia kiểm tra nội dung kiến thức pháp luật về trật tự, an toàn giao thông đường bộ theo quy định tại khoản 7 điều 61 của luật này do lực lượng cảnh sát giao thông tổ chức, có kết quả đạt yêu cầu thì được phục hồi đủ 12 điểm.


4. Giấy phép lái xe sau khi đổi, cấp lại, nâng hạng được giữ nguyên số điểm của giấy phép lái xe trước khi đổi, cấp lại, nâng hạng.


5. Người có thẩm quyền xử phạt vi phạm hành chính có thẩm quyền trừ điểm giấy phép lái xe.


6. Chính phủ quy định chi tiết khoản 1 điều này; quy định trình tự, thủ tục, thẩm quyền trừ điểm, phục hồi điểm giấy phép lái xe; quy định lộ trình thực hiện điều này. 

    Bộ trưởng Bộ Công an quy định chi tiết khoản 3 điều này.

**Tóm lại:** Giấy phép lái xe có 12 điểm. Điểm bị trừ tùy theo mức độ vi phạm. Nếu bị trừ hết điểm, người lái xe không được lái xe cho đến khi được phục hồi lại điểm sau khi thi lại luật và đủ điều kiện theo quy định.
","Mỗi giấy phép lái xe có 12 điểm; nếu bị trừ hết điểm, người lái xe phải tham gia kiểm tra phục hồi điểm.",0.95,0.5798451285367071,1.0,0.4166666666458333
11,Người lái xe máy cần làm gì để phục hồi điểm giấy phép lái xe?,"['1. thẩm quyền phục hồi điểm giấy phép lái xe a) cục trưởng cục cảnh sát giao thông có trách nhiệm quản lý, vận hành cơ sở dữ liệu về xử lý vi phạm hành chính về trật tự, an toàn giao thông đường bộ để thực hiện cập nhật, tự động phục hồi điểm giấy phép lái xe đối với trường hợp quy định tại khoản 2 điều này; b) cục trưởng cục cảnh sát giao thông, trưởng phòng cảnh sát giao thông nơi tổ chức kiểm tra kiến thức pháp luật về trật tự, an toàn giao thông đường bộ có thẩm quyền phục hồi điểm cho giấy phép lái xe đối với trường hợp quy định tại khoản 3 điều này. 2. trình tự, thủ tục phục hồi điểm giấy phép lái xe đối với trường hợp giấy phép lái xe chưa bị trừ hết điểm và không bị trừ điểm trong thời hạn 12 tháng từ ngày bị trừ điểm gần nhất a) khi đủ thời hạn 12 tháng, kể từ ngày bị trừ điểm giấy phép lái xe gần nhất, dữ liệu điểm giấy phép lái xe sẽ được tự động phục hồi đủ 12 điểm (gồm cả giấy phép lái xe đang trong thời hạn bị tước quyền sử dụng) và cập nhật tự động trong cơ sở dữ liệu về xử lý vi phạm hành chính về trật tự, an toàn giao thông đường bộ; b) ngay sau khi dữ liệu điểm giấy phép lái xe được phục hồi, cơ sở dữ liệu về xử lý vi phạm hành chính về trật tự, an toàn giao thông đường bộ sẽ tự động chuyển thông tin thông báo cho người được phục hồi điểm giấy phép lái xe biết việc phục hồi điểm theo quy định tại điểm c khoản này; c) việc thông báo phục hồi điểm giấy phép lái xe thực hiện bằng phương thức điện tử thông qua tài khoản của công dân đăng ký trên cổng dịch vụ công, ứng dụng giao thông trên thiết bị di động; đồng thời cập nhật thông tin về giấy phép lái xe được phục hồi điểm trên trang thông tin điện tử của cục cảnh sát giao thông. trường hợp giấy phép lái xe được thể hiện dưới hình thức thông điệp dữ liệu thì thực hiện cập nhật trạng thái phục hồi điểm giấy phép lái xe trong căn cước điện tử, tài khoản định danh điện tử trên ứng dụng định danh quốc gia. 3. trình tự, thủ tục phục hồi điểm giấy phép lái xe đối với trường hợp giấy phép lái xe bị trừ hết điểm a) sau khi người có giấy phép lái xe bị trừ hết điểm tham gia kiểm tra nội dung kiến thức pháp luật về trật tự, an toàn giao thông đường bộ và đạt yêu cầu, kết quả kiểm tra được cập nhật vào phần mềm kiểm tra kiến thức pháp luật về trật tự, an toàn giao thông đường bộ và đồng bộ dữ liệu với cơ sở dữ liệu về xử lý vi phạm hành chính về trật tự, an toàn giao thông đường bộ, dữ liệu điểm giấy phép lái xe sẽ được phục hồi đủ 12 điểm và cập nhật tự động trong cơ sở dữ liệu về xử lý vi phạm hành chính về trật tự, an toàn giao thông đường bộ; b) ngay sau khi dữ liệu điểm giấy phép lái xe được phục hồi đủ 12 điểm thì người có thẩm quyền quy định tại điểm b khoản 1 điều này thông báo cho người được phục hồi điểm giấy phép lái xe biết việc phục hồi điểm; c) việc thông báo phục hồi điểm giấy phép lái xe thực hiện bằng văn bản theo mẫu quy định của bộ trưởng bộ công an và được giao trực tiếp hoặc gửi qua dịch vụ bưu chính hoặc thực hiện thông báo bằng phương thức điện tử thông qua tài khoản của công dân đăng ký trên cổng dịch vụ công, ứng dụng giao thông trên thiết bị di động; đồng thời cập nhật thông tin về giấy phép lái xe được phục hồi điểm trên trang thông tin điện tử của cục cảnh sát giao thông. trường hợp giấy phép lái xe được thể hiện dưới hình thức thông điệp dữ liệu thì cơ quan, người có thẩm quyền thực hiện cập nhật trạng thái phục hồi điểm giấy phép lái xe trong căn cước điện tử, tài khoản định danh điện tử trên ứng dụng định danh quốc gia. chương iv điều khoản thi hành', '1. điểm của giấy phép lái xe được dùng để quản lý việc chấp hành pháp luật về trật tự, an toàn giao thông đường bộ của người lái xe trên hệ thống cơ sở dữ liệu về trật tự, an toàn giao thông đường bộ, bao gồm 12 điểm. số điểm trừ mỗi lần vi phạm tùy thuộc tính chất, mức độ của hành vi vi phạm pháp luật về trật tự, an toàn giao thông đường bộ. dữ liệu về điểm trừ giấy phép lái xe của người vi phạm sẽ được cập nhật vào hệ thống cơ sở dữ liệu ngay sau khi quyết định xử phạt có hiệu lực thi hành và thông báo cho người bị trừ điểm giấy phép lái xe biết. 2. giấy phép lái xe chưa bị trừ hết điểm và không bị trừ điểm trong thời hạn 12 tháng từ ngày bị trừ điểm gần nhất thì được phục hồi đủ 12 điểm. 3. trường hợp giấy phép lái xe bị trừ hết điểm thì người có giấy phép lái xe không được điều khiển phương tiện tham gia giao thông đường bộ theo giấy phép lái xe đó. sau thời hạn ít nhất là 06 tháng kể từ ngày bị trừ hết điểm, người có giấy phép lái xe được tham gia kiểm tra nội dung kiến thức pháp luật về trật tự, an toàn giao thông đường bộ theo quy định tại khoản 7 điều 61 của luật này do lực lượng cảnh sát giao thông tổ chức, có kết quả đạt yêu cầu thì được phục hồi đủ 12 điểm. 4. giấy phép lái xe sau khi đổi, cấp lại, nâng hạng được giữ nguyên số điểm của giấy phép lái xe trước khi đổi, cấp lại, nâng hạng. 5. người có thẩm quyền xử phạt vi phạm hành chính có thẩm quyền trừ điểm giấy phép lái xe. 6. chính phủ quy định chi tiết khoản 1 điều này; quy định trình tự, thủ tục, thẩm quyền trừ điểm, phục hồi điểm giấy phép lái xe; quy định lộ trình thực hiện điều này. bộ trưởng bộ công an quy định chi tiết khoản 3 điều này.', '1. điểm của giấy phép lái xe quân sự gồm 12 điểm theo quy định của luật trật tự, an toàn giao thông đường bộ, được dùng để quản lý việc chấp hành pháp luật về trật tự, an toàn giao thông đường bộ của người lái xe. số điểm trừ mỗi lần tùy theo tính chất, mức độ vi phạm theo quy định của pháp luật. giấy phép lái xe chưa bị trừ hết điểm và không bị trừ điểm trong thời hạn 12 tháng kể từ ngày bị trừ điểm gần nhất thì được phục hồi đủ 12 điểm. 2. trường hợp giấy phép lái xe quân sự bị trừ hết điểm, sau thời hạn ít nhất 06 tháng kể từ ngày bị trừ hết điểm, người có giấy phép lái xe quân sự bị trừ hết điểm được tham gia kiểm tra kiến thức pháp luật về giao thông đường bộ tổ chức tại cơ sở đào tạo lái xe quân sự theo quy định tại điểm a khoản 1 điều 40 và khoản 1 điều 41 thông tư này, nếu kết quả đặt yêu cầu được phục hồi đủ 12 điểm. 3. điểm của giấy phép lái xe quân sự đổi, cấp lại, đào tạo nâng hạng được giữ nguyên như trước khi đổi, cấp lại, đào tạo nâng hạng.', '1. khi người vi phạm đến giải quyết vi phạm, thực hiện như sau: a) tiếp nhận biên bản vi phạm hành chính từ người vi phạm và đối chiếu với hồ sơ vi phạm (trường hợp làm mất biên bản vi phạm hành chính, phải đối chiếu kỹ thông tin về nhân thân của người vi phạm với hồ sơ vi phạm); không giải quyết vụ việc đối với người trung gian (trừ trường hợp được ủy quyền theo quy định của pháp luật) hoặc ngoài vị trí quy định giải quyết vi phạm hành chính của đơn vị. đối với vụ việc cần xác minh làm rõ, thì báo cáo đề xuất người có thẩm quyền tổ chức xác minh; b) thông báo hình thức, mức xử phạt, biện pháp ngăn chặn, biện pháp trừ điểm giấy phép lái xe (theo mẫu số 02 ban hành kèm theo thông tư này), biện pháp khác, kết quả thu thập được hành vi vi phạm bằng phương tiện, thiết bị kỹ thuật nghiệp vụ theo quy định; trường hợp giấy phép, chứng chỉ hành nghề, giấy phép lái xe đã được tích hợp, cập nhật trong tài khoản định danh điện tử trên ứng dụng định danh quốc gia, cơ sở dữ liệu do bộ công an quản lý, vận hành thì khi áp dụng hình thức tước quyền sử dụng giấy phép, chứng chỉ hành nghề, người có thẩm quyền thực hiện việc tước trên môi trường điện tử, cập nhật thông tin về việc tước quyền sử dụng giấy phép, chứng chỉ hành nghề đó trên cơ sở dữ liệu xử lý vi phạm hành chính và đồng bộ với ứng dụng định danh quốc gia, cổng dịch vụ công, trang thông tin điện tử của cục cảnh sát giao thông, cơ sở dữ liệu do bộ công an quản lý, vận hành, app vnecsgt, ứng dụng giao thông trên thiết bị di động dành cho công dân do bộ công an quản lý, vận hành (sau đây gọi là app vnetraffic) để người vi phạm, chủ phương tiện (đối với giấy tờ của chủ phương tiện) biết, chấp hành theo quy định của pháp luật về trật tự, an toàn giao thông đường bộ, phục vụ các lực lượng chức năng có thẩm quyền kiểm tra, kiểm soát, xử lý vi phạm; việc thông báo trừ điểm giấy phép lái xe thực hiện theo quy định tại nghị định của chính phủ quy định xử phạt vi phạm hành chính về trật tự, an toàn giao thông trong lĩnh vực giao thông đường bộ; trừ điểm, phục hồi điểm giấy phép lái xe. c) giao quyết định xử phạt vi phạm hành chính cho người bị xử phạt hoặc người đại diện hợp pháp, người được ủy quyền của người bị xử phạt; d) tiếp nhận, kiểm tra, đối chiếu biên lai thu tiền phạt (hoặc chứng từ thu, nộp tiền phạt khác theo quy định của pháp luật) với hồ sơ vi phạm hành chính và lưu hồ sơ; đ) trả lại tang vật, phương tiện, giấy tờ bị tạm giữ, tước quyền sử dụng theo thủ tục hành chính cho người bị xử phạt. trường hợp giấy tờ đó có thông tin bị tạm giữ hoặc tước quyền sử dụng trên ứng dụng định danh quốc gia, cơ sở dữ liệu do bộ công an quản lý, vận hành thì người có thẩm quyền ra quyết định, lập biên bản trả lại giấy tờ cho người bị xử phạt; cơ sở dữ liệu xử lý vi phạm hành chính thực hiện đồng bộ thông tin với ứng dụng định danh quốc gia, cơ sở dữ liệu, phần mềm quy định tại điểm b khoản này để gỡ bỏ nội dung thông tin về việc tạm giữ, tước quyền sử dụng giấy tờ đó; e) trường hợp giải quyết vụ việc theo thông báo vi phạm hành chính về trật tự, an toàn giao thông đường bộ: kiểm tra, đối chiếu các thông tin trên giấy thông báo, giấy tờ tùy thân; cho người vi phạm xem kết quả thu thập được hành vi vi phạm bằng phương tiện, thiết bị kỹ thuật nghiệp vụ; lập biên bản vi phạm hành chính và thực hiện xử lý vi phạm theo quy định. 2. trường hợp người vi phạm thực hiện việc nộp tiền xử phạt vi phạm hành chính qua cổng dịch vụ công a) người có thẩm quyền xử phạt gửi thông tin xử phạt lên cổng dịch vụ công; cổng dịch vụ công tự động thông báo cho người vi phạm tra cứu thông tin quyết định xử phạt vi phạm hành chính thông qua số điện thoại người vi phạm đã cung cấp cho cơ quan công an tại thời điểm lập biên bản vi phạm hành chính; đăng ký xe; b) người vi phạm truy cập vào cổng dịch vụ công thông qua số quyết định xử phạt vi phạm hành chính đã được thông báo hoặc số biên bản vi phạm hành chính để tra cứu thông tin quyết định xử phạt vi phạm hành chính; nộp tiền xử phạt vi phạm hành chính, đăng ký nhận lại giấy tờ bị tạm giữ, tước qua dịch vụ bưu chính công ích; c) người có thẩm quyền xử phạt tra cứu biên lai điện tử thu tiền xử phạt vi phạm hành chính được hệ thống cổng dịch vụ công gửi về để in, lưu hồ sơ xử phạt vi phạm hành chính và làm căn cứ trả lại giấy tờ bị tạm giữ, gỡ bỏ nội dung thông tin về việc tạm giữ trên ứng dụng định danh quốc gia, cơ sở dữ liệu, phần mềm theo quy định tại điểm d khoản này; d) người có thẩm quyền xử phạt vi phạm hành chính trả lại giấy tờ bị tạm giữ, bị tước (khi hết thời hạn tước quyền sử dụng) cho người bị xử phạt qua dịch vụ bưu chính công ích. trường hợp giấy tờ đó có thông tin về việc bị tạm giữ, tước quyền sử dụng trên ứng dụng định danh quốc gia, cơ sở dữ liệu do bộ công an quản lý, vận hành thì cơ sở dữ liệu xử lý vi phạm hành chính thực hiện đồng bộ thông tin với ứng dụng định danh quốc gia, cơ sở dữ liệu, phần mềm quy định tại điểm b khoản 1 điều này để gỡ bỏ nội dung thông tin về việc tạm giữ, tước quyền sử dụng giấy tờ đó. 3. trường hợp người vi phạm thực hiện nộp phạt vi phạm hành chính thông qua dịch vụ bưu chính công ích thì thực hiện theo quy định tại điều 20 nghị định số 118/2021/nđ-cp. 4. trường hợp đã quá thời hạn hẹn đến giải quyết vụ việc vi phạm ghi trong biên bản vi phạm hành chính hoặc trong thông báo của người có thẩm quyền xử phạt hoặc quá thời hạn thi hành quyết định xử phạt mà chủ phương tiện, người vi phạm chưa đến giải quyết, xử lý hoặc chưa chấp hành quyết định xử phạt thì người có thẩm quyền xử phạt gửi thông báo cho cơ quan đăng kiểm (đối với phương tiện giao thông có quy định phải kiểm định), cơ quan đăng ký xe, cơ quan cấp giấy phép lái xe để phối hợp xử lý theo quy định tại luật trật tự, an toàn giao thông đường bộ; nghị định của chính phủ quy định xử phạt vi phạm hành chính về trật tự, an toàn giao thông trong lĩnh vực giao thông đường bộ; trừ điểm, phục hồi điểm giấy phép lái xe. việc gửi thông báo đến cơ quan đăng kiểm, cơ quan đăng ký xe, cơ quan cấp giấy phép lái xe thực hiện bằng phương thức điện tử kết nối, chia sẻ dữ liệu hoặc bằng văn bản. 5. việc trừ điểm, phục hồi điểm giấy phép lái xe được thực hiện theo quy định tại nghị định của chính phủ quy định xử phạt vi phạm hành chính về trật tự, an toàn giao thông trong lĩnh vực giao thông đường bộ; trừ điểm, phục hồi điểm giấy phép lái xe.']","**Nguồn văn bản:** 168_2024_ND-CP_619502

**Tên văn bản:** Nghị định Quy định xử phạt vi phạm hành chính về trật tự, an toàn giao thông trong lĩnh vực giao thông đường bộ; trừ điểm, phục hồi điểm giấy phép lái xe

**Điều 51:** Thẩm quyền, trình tự, thủ tục phục hồi điểm giấy phép lái xe

**Nội dung:**

1. Thẩm quyền phục hồi điểm giấy phép lái xe

	a) Cục trưởng Cục Cảnh sát giao thông có trách nhiệm quản lý, vận hành cơ sở dữ liệu về xử lý vi phạm hành chính về trật tự, an toàn giao thông đường bộ để thực hiện cập nhật, tự động phục hồi điểm giấy phép lái xe đối với trường hợp quy định tại khoản 2 Điều này.

	b) Cục trưởng Cục Cảnh sát giao thông, Trưởng phòng Cảnh sát giao thông nơi tổ chức kiểm tra kiến thức pháp luật về trật tự, an toàn giao thông đường bộ có thẩm quyền phục hồi điểm cho giấy phép lái xe đối với trường hợp quy định tại khoản 3 Điều này.

2. Trình tự, thủ tục phục hồi điểm giấy phép lái xe đối với trường hợp giấy phép lái xe chưa bị trừ hết điểm và không bị trừ điểm trong thời hạn 12 tháng từ ngày bị trừ điểm gần nhất

	a) Khi đủ thời hạn 12 tháng, kể từ ngày bị trừ điểm giấy phép lái xe gần nhất, dữ liệu điểm giấy phép lái xe sẽ được tự động phục hồi đủ 12 điểm (gồm cả giấy phép lái xe đang trong thời hạn bị tước quyền sử dụng) và cập nhật tự động trong cơ sở dữ liệu về xử lý vi phạm hành chính về trật tự, an toàn giao thông đường bộ.

	b) Ngay sau khi dữ liệu điểm giấy phép lái xe được phục hồi, cơ sở dữ liệu về xử lý vi phạm hành chính về trật tự, an toàn giao thông đường bộ sẽ tự động chuyển thông tin thông báo cho người được phục hồi điểm giấy phép lái xe biết việc phục hồi điểm theo quy định tại điểm c khoản này.

	c) Việc thông báo phục hồi điểm giấy phép lái xe thực hiện bằng phương thức điện tử thông qua tài khoản của công dân đăng ký trên Cổng Dịch vụ công, ứng dụng giao thông trên thiết bị di động; đồng thời cập nhật thông tin về giấy phép lái xe được phục hồi điểm trên trang thông tin điện tử của Cục Cảnh sát giao thông. Trường hợp giấy phép lái xe được thể hiện dưới hình thức thông điệp dữ liệu thì thực hiện cập nhật trạng thái phục hồi điểm giấy phép lái xe trong căn cước điện tử, tài khoản định danh điện tử trên ứng dụng định danh quốc gia.


3. Trình tự, thủ tục phục hồi điểm giấy phép lái xe đối với trường hợp giấy phép lái xe bị trừ hết điểm

	a) Sau khi người có giấy phép lái xe bị trừ hết điểm tham gia kiểm tra nội dung kiến thức pháp luật về trật tự, an toàn giao thông đường bộ và đạt yêu cầu, kết quả kiểm tra được cập nhật vào phần mềm kiểm tra kiến thức pháp luật về trật tự, an toàn giao thông đường bộ và đồng bộ dữ liệu với cơ sở dữ liệu về xử lý vi phạm hành chính về trật tự, an toàn giao thông đường bộ, dữ liệu điểm giấy phép lái xe sẽ được phục hồi đủ 12 điểm và cập nhật tự động trong cơ sở dữ liệu về xử lý vi phạm hành chính về trật tự, an toàn giao thông đường bộ.

	b) Ngay sau khi dữ liệu điểm giấy phép lái xe được phục hồi đủ 12 điểm thì người có thẩm quyền quy định tại điểm b khoản 1 Điều này thông báo cho người được phục hồi điểm giấy phép lái xe biết việc phục hồi điểm.

	c) Việc thông báo phục hồi điểm giấy phép lái xe thực hiện bằng văn bản theo mẫu quy định của Bộ trưởng Bộ Công an và được giao trực tiếp hoặc gửi qua dịch vụ bưu chính hoặc thực hiện thông báo bằng phương thức điện tử thông qua tài khoản của công dân đăng ký trên Cổng Dịch vụ công, ứng dụng giao thông trên thiết bị di động; đồng thời cập nhật thông tin về giấy phép lái xe được phục hồi điểm trên trang thông tin điện tử của Cục Cảnh sát giao thông. Trường hợp giấy phép lái xe được thể hiện dưới hình thức thông điệp dữ liệu thì cơ quan, người có thẩm quyền thực hiện cập nhật trạng thái phục hồi điểm giấy phép lái xe trong căn cước điện tử, tài khoản định danh điện tử trên ứng dụng định danh quốc gia.


**Tóm lại:** Có hai trường hợp để phục hồi điểm giấy phép lái xe máy: 1) Nếu chưa bị trừ hết điểm và không vi phạm trong 12 tháng, điểm sẽ tự động được phục hồi. 2) Nếu bị trừ hết điểm, người lái xe phải tham gia kiểm tra kiến thức luật giao thông sau ít nhất 6 tháng kể từ ngày bị trừ hết điểm và đạt yêu cầu thì mới được phục hồi điểm.
",Người lái xe máy phải làm kiểm tra lý thuyết theo các câu hỏi như khi thi bằng lái xe.,1.0,0.6197964030086434,1.0,0.9999999999666667
12,Người lái ô tô cần làm gì để phục hồi điểm giấy phép lái xe?,"['1. thẩm quyền phục hồi điểm giấy phép lái xe a) cục trưởng cục cảnh sát giao thông có trách nhiệm quản lý, vận hành cơ sở dữ liệu về xử lý vi phạm hành chính về trật tự, an toàn giao thông đường bộ để thực hiện cập nhật, tự động phục hồi điểm giấy phép lái xe đối với trường hợp quy định tại khoản 2 điều này; b) cục trưởng cục cảnh sát giao thông, trưởng phòng cảnh sát giao thông nơi tổ chức kiểm tra kiến thức pháp luật về trật tự, an toàn giao thông đường bộ có thẩm quyền phục hồi điểm cho giấy phép lái xe đối với trường hợp quy định tại khoản 3 điều này. 2. trình tự, thủ tục phục hồi điểm giấy phép lái xe đối với trường hợp giấy phép lái xe chưa bị trừ hết điểm và không bị trừ điểm trong thời hạn 12 tháng từ ngày bị trừ điểm gần nhất a) khi đủ thời hạn 12 tháng, kể từ ngày bị trừ điểm giấy phép lái xe gần nhất, dữ liệu điểm giấy phép lái xe sẽ được tự động phục hồi đủ 12 điểm (gồm cả giấy phép lái xe đang trong thời hạn bị tước quyền sử dụng) và cập nhật tự động trong cơ sở dữ liệu về xử lý vi phạm hành chính về trật tự, an toàn giao thông đường bộ; b) ngay sau khi dữ liệu điểm giấy phép lái xe được phục hồi, cơ sở dữ liệu về xử lý vi phạm hành chính về trật tự, an toàn giao thông đường bộ sẽ tự động chuyển thông tin thông báo cho người được phục hồi điểm giấy phép lái xe biết việc phục hồi điểm theo quy định tại điểm c khoản này; c) việc thông báo phục hồi điểm giấy phép lái xe thực hiện bằng phương thức điện tử thông qua tài khoản của công dân đăng ký trên cổng dịch vụ công, ứng dụng giao thông trên thiết bị di động; đồng thời cập nhật thông tin về giấy phép lái xe được phục hồi điểm trên trang thông tin điện tử của cục cảnh sát giao thông. trường hợp giấy phép lái xe được thể hiện dưới hình thức thông điệp dữ liệu thì thực hiện cập nhật trạng thái phục hồi điểm giấy phép lái xe trong căn cước điện tử, tài khoản định danh điện tử trên ứng dụng định danh quốc gia. 3. trình tự, thủ tục phục hồi điểm giấy phép lái xe đối với trường hợp giấy phép lái xe bị trừ hết điểm a) sau khi người có giấy phép lái xe bị trừ hết điểm tham gia kiểm tra nội dung kiến thức pháp luật về trật tự, an toàn giao thông đường bộ và đạt yêu cầu, kết quả kiểm tra được cập nhật vào phần mềm kiểm tra kiến thức pháp luật về trật tự, an toàn giao thông đường bộ và đồng bộ dữ liệu với cơ sở dữ liệu về xử lý vi phạm hành chính về trật tự, an toàn giao thông đường bộ, dữ liệu điểm giấy phép lái xe sẽ được phục hồi đủ 12 điểm và cập nhật tự động trong cơ sở dữ liệu về xử lý vi phạm hành chính về trật tự, an toàn giao thông đường bộ; b) ngay sau khi dữ liệu điểm giấy phép lái xe được phục hồi đủ 12 điểm thì người có thẩm quyền quy định tại điểm b khoản 1 điều này thông báo cho người được phục hồi điểm giấy phép lái xe biết việc phục hồi điểm; c) việc thông báo phục hồi điểm giấy phép lái xe thực hiện bằng văn bản theo mẫu quy định của bộ trưởng bộ công an và được giao trực tiếp hoặc gửi qua dịch vụ bưu chính hoặc thực hiện thông báo bằng phương thức điện tử thông qua tài khoản của công dân đăng ký trên cổng dịch vụ công, ứng dụng giao thông trên thiết bị di động; đồng thời cập nhật thông tin về giấy phép lái xe được phục hồi điểm trên trang thông tin điện tử của cục cảnh sát giao thông. trường hợp giấy phép lái xe được thể hiện dưới hình thức thông điệp dữ liệu thì cơ quan, người có thẩm quyền thực hiện cập nhật trạng thái phục hồi điểm giấy phép lái xe trong căn cước điện tử, tài khoản định danh điện tử trên ứng dụng định danh quốc gia. chương iv điều khoản thi hành', '1. điểm của giấy phép lái xe được dùng để quản lý việc chấp hành pháp luật về trật tự, an toàn giao thông đường bộ của người lái xe trên hệ thống cơ sở dữ liệu về trật tự, an toàn giao thông đường bộ, bao gồm 12 điểm. số điểm trừ mỗi lần vi phạm tùy thuộc tính chất, mức độ của hành vi vi phạm pháp luật về trật tự, an toàn giao thông đường bộ. dữ liệu về điểm trừ giấy phép lái xe của người vi phạm sẽ được cập nhật vào hệ thống cơ sở dữ liệu ngay sau khi quyết định xử phạt có hiệu lực thi hành và thông báo cho người bị trừ điểm giấy phép lái xe biết. 2. giấy phép lái xe chưa bị trừ hết điểm và không bị trừ điểm trong thời hạn 12 tháng từ ngày bị trừ điểm gần nhất thì được phục hồi đủ 12 điểm. 3. trường hợp giấy phép lái xe bị trừ hết điểm thì người có giấy phép lái xe không được điều khiển phương tiện tham gia giao thông đường bộ theo giấy phép lái xe đó. sau thời hạn ít nhất là 06 tháng kể từ ngày bị trừ hết điểm, người có giấy phép lái xe được tham gia kiểm tra nội dung kiến thức pháp luật về trật tự, an toàn giao thông đường bộ theo quy định tại khoản 7 điều 61 của luật này do lực lượng cảnh sát giao thông tổ chức, có kết quả đạt yêu cầu thì được phục hồi đủ 12 điểm. 4. giấy phép lái xe sau khi đổi, cấp lại, nâng hạng được giữ nguyên số điểm của giấy phép lái xe trước khi đổi, cấp lại, nâng hạng. 5. người có thẩm quyền xử phạt vi phạm hành chính có thẩm quyền trừ điểm giấy phép lái xe. 6. chính phủ quy định chi tiết khoản 1 điều này; quy định trình tự, thủ tục, thẩm quyền trừ điểm, phục hồi điểm giấy phép lái xe; quy định lộ trình thực hiện điều này. bộ trưởng bộ công an quy định chi tiết khoản 3 điều này.', 'thông tư này quy định kiểm tra kiến thức pháp luật về trật tự, an toàn giao thông đường bộ đối với người có giấy phép lái xe bị trừ hết điểm để được phục hồi điểm giấy phép lái xe.']","**Nguồn văn bản:** 168_2024_ND-CP_619502

**Tên văn bản:** Nghị định Quy định xử phạt vi phạm hành chính về trật tự, an toàn giao thông trong lĩnh vực giao thông đường bộ; trừ điểm, phục hồi điểm giấy phép lái xe

**Điều 51:** Thẩm quyền, trình tự, thủ tục phục hồi điểm giấy phép lái xe

**Nội dung:**

1. Thẩm quyền phục hồi điểm giấy phép lái xe

	a) Cục trưởng Cục Cảnh sát giao thông có trách nhiệm quản lý, vận hành cơ sở dữ liệu về xử lý vi phạm hành chính về trật tự, an toàn giao thông đường bộ để thực hiện cập nhật, tự động phục hồi điểm giấy phép lái xe đối với trường hợp quy định tại khoản 2 Điều này.

	b) Cục trưởng Cục Cảnh sát giao thông, Trưởng phòng Cảnh sát giao thông nơi tổ chức kiểm tra kiến thức pháp luật về trật tự, an toàn giao thông đường bộ có thẩm quyền phục hồi điểm cho giấy phép lái xe đối với trường hợp quy định tại khoản 3 Điều này.

2. Trình tự, thủ tục phục hồi điểm giấy phép lái xe đối với trường hợp giấy phép lái xe chưa bị trừ hết điểm và không bị trừ điểm trong thời hạn 12 tháng từ ngày bị trừ điểm gần nhất

	a) Khi đủ thời hạn 12 tháng, kể từ ngày bị trừ điểm giấy phép lái xe gần nhất, dữ liệu điểm giấy phép lái xe sẽ được tự động phục hồi đủ 12 điểm (gồm cả giấy phép lái xe đang trong thời hạn bị tước quyền sử dụng) và cập nhật tự động trong cơ sở dữ liệu về xử lý vi phạm hành chính về trật tự, an toàn giao thông đường bộ.

	b) Ngay sau khi dữ liệu điểm giấy phép lái xe được phục hồi, cơ sở dữ liệu về xử lý vi phạm hành chính về trật tự, an toàn giao thông đường bộ sẽ tự động chuyển thông tin thông báo cho người được phục hồi điểm giấy phép lái xe biết việc phục hồi điểm theo quy định tại điểm c khoản này.

	c) Việc thông báo phục hồi điểm giấy phép lái xe thực hiện bằng phương thức điện tử thông qua tài khoản của công dân đăng ký trên Cổng Dịch vụ công, ứng dụng giao thông trên thiết bị di động; đồng thời cập nhật thông tin về giấy phép lái xe được phục hồi điểm trên trang thông tin điện tử của Cục Cảnh sát giao thông. Trường hợp giấy phép lái xe được thể hiện dưới hình thức thông điệp dữ liệu thì thực hiện cập nhật trạng thái phục hồi điểm giấy phép lái xe trong căn cước điện tử, tài khoản định danh điện tử trên ứng dụng định danh quốc gia.


3. Trình tự, thủ tục phục hồi điểm giấy phép lái xe đối với trường hợp giấy phép lái xe bị trừ hết điểm

	a) Sau khi người có giấy phép lái xe bị trừ hết điểm tham gia kiểm tra nội dung kiến thức pháp luật về trật tự, an toàn giao thông đường bộ và đạt yêu cầu, kết quả kiểm tra được cập nhật vào phần mềm kiểm tra kiến thức pháp luật về trật tự, an toàn giao thông đường bộ và đồng bộ dữ liệu với cơ sở dữ liệu về xử lý vi phạm hành chính về trật tự, an toàn giao thông đường bộ, dữ liệu điểm giấy phép lái xe sẽ được phục hồi đủ 12 điểm và cập nhật tự động trong cơ sở dữ liệu về xử lý vi phạm hành chính về trật tự, an toàn giao thông đường bộ.

	b) Ngay sau khi dữ liệu điểm giấy phép lái xe được phục hồi đủ 12 điểm thì người có thẩm quyền quy định tại điểm b khoản 1 Điều này thông báo cho người được phục hồi điểm giấy phép lái xe biết việc phục hồi điểm.

	c) Việc thông báo phục hồi điểm giấy phép lái xe thực hiện bằng văn bản theo mẫu quy định của Bộ trưởng Bộ Công an và được giao trực tiếp hoặc gửi qua dịch vụ bưu chính hoặc thực hiện thông báo bằng phương thức điện tử thông qua tài khoản của công dân đăng ký trên Cổng Dịch vụ công, ứng dụng giao thông trên thiết bị di động; đồng thời cập nhật thông tin về giấy phép lái xe được phục hồi điểm trên trang thông tin điện tử của Cục Cảnh sát giao thông. Trường hợp giấy phép lái xe được thể hiện dưới hình thức thông điệp dữ liệu thì cơ quan, người có thẩm quyền thực hiện cập nhật trạng thái phục hồi điểm giấy phép lái xe trong căn cước điện tử, tài khoản định danh điện tử trên ứng dụng định danh quốc gia.


**Tóm lại:** Có hai trường hợp để phục hồi điểm giấy phép lái xe: 1. Giấy phép lái xe chưa bị trừ hết điểm và không bị trừ điểm trong 12 tháng gần nhất sẽ được tự động phục hồi đủ 12 điểm. 2. Giấy phép lái xe bị trừ hết điểm thì người lái xe phải tham gia kiểm tra kiến thức luật giao thông đường bộ và đạt yêu cầu thì được phục hồi đủ 12 điểm.
",Người lái ô tô phải làm kiểm tra lý thuyết và mô phỏng theo các câu hỏi như khi thi bằng lái xe.,1.0,0.5588260791241608,0.0,0.99999999995
13,Luật Giao thông Đường bộ 2025 có quy định gì mới về việc sử dụng điện thoại khi lái xe?,"['1. phạt tiền từ 400.000 đồng đến 600.000 đồng đối với người điều khiển xe thực hiện một trong các hành vi vi phạm sau đây: a) không chấp hành hiệu lệnh, chỉ dẫn của biển báo hiệu, vạch kẻ đường, trừ các hành vi vi phạm quy định tại điểm a, điểm c, điểm d, điểm đ khoản 2; điểm a, điểm d, điểm đ, điểm e, điểm n, điểm o khoản 3; điểm a, điểm b, điểm đ, điểm e, điểm i, điểm k, điểm l khoản 4; điểm a, điểm b, điểm c, điểm d, điểm đ, điểm i, điểm k khoản 5; điểm a khoản 6; khoản 7; điểm b, điểm d khoản 9; điểm a khoản 10; điểm đ khoản 11 điều này; b) khi ra, vào vị trí dừng xe, đỗ xe không có tín hiệu báo cho người điều khiển phương tiện khác biết; c) không báo hiệu bằng đèn khẩn cấp hoặc không đặt biển cảnh báo “chú ý xe đỗ” theo quy định trong trường hợp gặp sự cố kỹ thuật (hoặc bất khả kháng khác) buộc phải đỗ xe chiếm một phần đường xe chạy hoặc tại nơi không được phép đỗ xe, trừ hành vi vi phạm quy định tại điểm c khoản 7 điều này; d) không gắn biển báo hiệu ở phía trước xe kéo, phía sau xe được kéo; điều khiển xe kéo rơ moóc không có biển báo hiệu theo quy định; đ) sử dụng còi trong thời gian từ 22 giờ ngày hôm trước đến 05 giờ ngày hôm sau trong khu đông dân cư, khu vực cơ sở khám bệnh, chữa bệnh, trừ các xe ưu tiên đang đi làm nhiệm vụ theo quy định. 2. phạt tiền từ 600.000 đồng đến 800.000 đồng đối với người điều khiển xe thực hiện một trong các hành vi vi phạm sau đây: a) chuyển làn đường không đúng nơi cho phép hoặc không có tín hiệu báo trước hoặc chuyển làn đường không đúng quy định “mỗi lần chuyển làn đường chỉ được phép chuyển sang một làn đường liền kề”, trừ các hành vi vi phạm quy định tại điểm g khoản 5 điều này; b) chở người trên buồng lái quá số lượng quy định; c) không tuân thủ các quy định về nhường đường tại nơi đường bộ giao nhau, trừ các hành vi vi phạm quy định tại điểm n, điểm o khoản 5 điều này; d) dừng xe, đỗ xe trên phần đường xe chạy ở đoạn đường ngoài đô thị nơi có lề đường rộng; dừng xe, đỗ xe không sát mép đường phía bên phải theo chiều đi ở nơi đường có lề đường hẹp hoặc không có lề đường; dừng xe, đỗ xe ngược với chiều lưu thông của làn đường; dừng xe, đỗ xe trên dải phân cách cố định ở giữa hai phần đường xe chạy; đỗ xe trên dốc không chèn bánh; đ) dừng xe không sát theo lề đường, vỉa hè phía bên phải theo chiều đi hoặc bánh xe gần nhất cách lề đường, vỉa hè quá 0,25 mét; dừng xe trên đường dành riêng cho xe buýt; dừng xe trên miệng cống thoát nước, miệng hầm của đường điện thoại, điện cao thế, chỗ dành riêng cho xe chữa cháy lấy nước; rời vị trí lái, tắt máy khi dừng xe (trừ trường hợp rời khỏi vị trí lái để đóng, mở cửa xe, xếp dỡ hàng hóa, kiểm tra kỹ thuật xe) hoặc rời vị trí lái khi dừng xe nhưng không sử dụng phanh đỗ xe (hoặc thực hiện biện pháp an toàn khác); dừng xe, đỗ xe không đúng vị trí quy định ở những đoạn có bố trí nơi dừng xe, đỗ xe; dừng xe, đỗ xe trên phần đường dành cho người đi bộ qua đường; dừng xe nơi có biển “cấm dừng xe và đỗ xe”, trừ hành vi vi phạm quy định tại điểm đ khoản 4, điểm c khoản 7 điều này. 3. phạt tiền từ 800.000 đồng đến 1.000.000 đồng đối với người điều khiển xe thực hiện một trong các hành vi vi phạm sau đây: a) điều khiển xe chạy quá tốc độ quy định từ 05 km/h đến dưới 10 km/h; b) sử dụng còi, rú ga liên tục; sử dụng còi hơi, sử dụng đèn chiếu xa khi gặp người đi bộ qua đường hoặc khi đi trên đoạn đường qua khu dân cư có hệ thống chiếu sáng đang hoạt động hoặc khi gặp xe đi ngược chiều (trừ trường hợp dải phân cách có khả năng chống chói) hoặc khi chuyển hướng xe tại nơi đường giao nhau, trừ các xe ưu tiên đang đi làm nhiệm vụ theo quy định; c) chuyển hướng không quan sát hoặc không bảo đảm khoảng cách an toàn với xe phía sau hoặc không giảm tốc độ hoặc không có tín hiệu báo hướng rẽ hoặc có tín hiệu báo hướng rẽ nhưng không sử dụng liên tục trong quá trình chuyển hướng (trừ trường hợp điều khiển xe đi theo hướng cong của đoạn đường bộ ở nơi đường không giao nhau cùng mức); d) không tuân thủ các quy định về dừng xe, đỗ xe tại nơi đường bộ giao nhau cùng mức với đường sắt; dừng xe, đỗ xe trong phạm vi bảo vệ công trình đường sắt, phạm vi an toàn của đường sắt; đ) dừng xe, đỗ xe tại vị trí: nơi đường bộ giao nhau hoặc trong phạm vi 05 mét tính từ mép đường giao nhau; điểm đón, trả khách; trước cổng hoặc trong phạm vi 05 mét hai bên cổng trụ sở cơ quan, tổ chức có bố trí đường cho xe ra, vào; nơi phần đường có bề rộng chỉ đủ cho một làn xe cơ giới; che khuất biển báo hiệu đường bộ, đèn tín hiệu giao thông; nơi mở dải phân cách giữa; cách xe ô tô đang đỗ ngược chiều dưới 20 mét trên đường phố hẹp, dưới 40 mét trên đường có một làn xe cơ giới trên một chiều đường; e) đỗ xe không sát theo lề đường, vỉa hè phía bên phải theo chiều đi hoặc bánh xe gần nhất cách lề đường, vỉa hè quá 0,25 mét; đỗ xe trên đường dành riêng cho xe buýt; đỗ xe trên miệng cống thoát nước, miệng hầm của đường điện thoại, điện cao thế, chỗ dành riêng cho xe chữa cháy lấy nước; đỗ, để xe ở vỉa hè trái quy định của pháp luật; đỗ xe nơi có biển “cấm đỗ xe” hoặc biển “cấm dừng xe và đỗ xe”, trừ hành vi vi phạm quy định tại điểm đ khoản 4, điểm c khoản 7 điều này; g) không sử dụng hoặc sử dụng không đủ đèn chiếu sáng trong thời gian từ 18 giờ ngày hôm trước đến 06 giờ ngày hôm sau hoặc khi có sương mù, khói, bụi, trời mưa, thời tiết xấu làm hạn chế tầm nhìn; h) điều khiển xe ô tô kéo theo xe khác, vật khác (trừ trường hợp kéo theo một rơ moóc, sơ mi rơ moóc hoặc một xe ô tô, xe máy chuyên dùng khác khi xe này không tự chạy được); điều khiển xe ô tô đẩy xe khác, vật khác; điều khiển xe kéo rơ moóc, sơ mi rơ moóc kéo thêm rơ moóc hoặc xe khác, vật khác; không nối chắc chắn, an toàn giữa xe kéo và xe được kéo khi kéo nhau; i) chở người trên xe được kéo, trừ người điều khiển; k) không thắt dây đai an toàn khi điều khiển xe chạy trên đường; l) chở người trên xe ô tô không thắt dây đai an toàn (tại vị trí có trang bị dây đai an toàn) khi xe đang chạy; m) chở trẻ em dưới 10 tuổi và chiều cao dưới 1,35 mét trên xe ô tô ngồi cùng hàng ghế với người lái xe (trừ loại xe ô tô chỉ có một hàng ghế) hoặc không sử dụng thiết bị an toàn phù hợp cho trẻ em theo quy định; n) chạy trong hầm đường bộ không sử dụng đèn chiếu sáng gần; o) điều khiển xe chạy dưới tốc độ tối thiểu trên đoạn đường bộ có quy định tốc độ tối thiểu cho phép; p) điều khiển xe chạy tốc độ thấp hơn các xe khác đi cùng chiều mà không đi về làn đường bên phải chiều đi của mình, trừ trường hợp các xe khác đi cùng chiều chạy quá tốc độ quy định. 4. phạt tiền từ 2.000.000 đồng đến 3.000.000 đồng đối với người điều khiển xe thực hiện một trong các hành vi vi phạm sau đây: a) điều khiển xe không đủ điều kiện đã thu phí theo hình thức điện tử tự động không dừng (xe không gắn thẻ đầu cuối) đi vào làn đường dành riêng thu phí theo hình thức điện tử tự động không dừng tại các trạm thu phí; b) dừng xe, đỗ xe tại vị trí: bên trái đường một chiều hoặc bên trái (theo hướng lưu thông) của đường đôi; trên đoạn đường cong hoặc gần đầu dốc nơi tầm nhìn bị che khuất; trên cầu (trừ trường hợp tổ chức giao thông cho phép), gầm cầu vượt (trừ những nơi cho phép dừng xe, đỗ xe), song song với một xe khác đang dừng, đỗ, trừ hành vi vi phạm quy định tại điểm c khoản 7 điều này; c) không thực hiện biện pháp bảo đảm an toàn theo quy định khi xe ô tô bị hư hỏng ngay tại nơi đường bộ giao nhau cùng mức với đường sắt; d) không nhường đường cho xe xin vượt khi có đủ điều kiện an toàn; đ) lùi xe, quay đầu xe trong hầm đường bộ; dừng xe, đỗ xe trong hầm đường bộ không đúng nơi quy định; không có báo hiệu bằng đèn khẩn cấp, không đặt biển cảnh báo ""chú ý xe đỗ"" (hoặc đèn cảnh báo) về phía sau xe khoảng cách đảm bảo an toàn khi dừng xe, đỗ xe trong hầm đường bộ trong trường hợp gặp sự cố kỹ thuật hoặc bất khả kháng khác buộc phải dừng xe, đỗ xe; e) lùi xe ở đường một chiều, đường có biển “cấm đi ngược chiều”, khu vực cấm dừng, trên phần đường dành cho người đi bộ qua đường, nơi đường bộ giao nhau, nơi đường bộ giao nhau cùng mức với đường sắt, nơi tầm nhìn bị che khuất; lùi xe không quan sát hai bên, phía sau xe hoặc không có tín hiệu lùi xe, trừ hành vi vi phạm quy định tại điểm đ khoản 11 điều này; g) điều khiển xe có liên quan trực tiếp đến vụ tai nạn giao thông mà không dừng ngay phương tiện, không giữ nguyên hiện trường, không trợ giúp người bị nạn, trừ hành vi vi phạm quy định tại khoản 8 điều này; h) xe được quyền ưu tiên lắp đặt, sử dụng thiết bị phát tín hiệu ưu tiên không đúng quy định hoặc sử dụng thiết bị phát tín hiệu ưu tiên mà không có giấy phép của cơ quan có thẩm quyền cấp hoặc có giấy phép của cơ quan có thẩm quyền cấp nhưng không còn giá trị sử dụng theo quy định; i) quay đầu xe ở phần đường dành cho người đi bộ qua đường, trên cầu, đầu cầu, gầm cầu vượt, ngầm, tại nơi đường bộ giao nhau cùng mức với đường sắt, đường hẹp, đường dốc, đoạn đường cong tầm nhìn bị che khuất, trên đường một chiều, trừ khi có hiệu lệnh của người điều khiển giao thông hoặc chỉ dẫn của biển báo hiệu tạm thời hoặc tổ chức giao thông tại những khu vực này có bố trí nơi quay đầu xe; k) quay đầu xe tại nơi có biển báo hiệu có nội dung cấm quay đầu đối với loại phương tiện đang điều khiển; điều khiển xe rẽ trái tại nơi có biển báo hiệu có nội dung cấm rẽ trái đối với loại phương tiện đang điều khiển; điều khiển xe rẽ phải tại nơi có biển báo hiệu có nội dung cấm rẽ phải đối với loại phương tiện đang điều khiển; l) không giữ khoảng cách an toàn để xảy ra va chạm với xe chạy liền trước hoặc không giữ khoảng cách theo quy định của biển báo hiệu “cự ly tối thiểu giữa hai xe”, trừ các hành vi vi phạm quy định tại điểm d khoản 5 điều này. 5. phạt tiền từ 4.000.000 đồng đến 6.000.000 đồng đối với người điều khiển xe thực hiện một trong các hành vi vi phạm sau đây: a) vượt xe trong những trường hợp không được vượt, vượt xe tại đoạn đường có biển báo hiệu có nội dung cấm vượt (đối với loại phương tiện đang điều khiển); không có tín hiệu trước khi vượt hoặc có tín hiệu vượt xe nhưng không sử dụng trong suốt quá trình vượt xe; vượt bên phải xe khác trong trường hợp không được phép; b) điều khiển xe không đi bên phải theo chiều đi của mình; đi không đúng phần đường hoặc làn đường quy định (làn cùng chiều hoặc làn ngược chiều) trừ hành vi quy định tại điểm a khoản 4 điều này; điều khiển xe đi qua dải phân cách cố định ở giữa hai phần đường xe chạy; c) tránh xe đi ngược chiều không đúng quy định (trừ hành vi vi phạm sử dụng đèn chiếu xa khi tránh xe đi ngược chiều quy định tại điểm b khoản 3 điều này); không nhường đường cho xe đi ngược chiều theo quy định tại nơi đường hẹp, đường dốc, nơi có chướng ngại vật; d) không tuân thủ quy định khi vào hoặc ra đường cao tốc; điều khiển xe chạy ở làn dừng xe khẩn cấp hoặc phần lề đường của đường cao tốc; không tuân thủ quy định về khoảng cách an toàn đối với xe chạy liền trước khi chạy trên đường cao tốc; đ) điều khiển xe chạy quá tốc độ quy định từ 10 km/h đến 20 km/h; e) xe không được quyền ưu tiên lắp đặt, sử dụng thiết bị phát tín hiệu của xe được quyền ưu tiên; g) chuyển làn đường không đúng nơi cho phép hoặc không có tín hiệu báo trước hoặc chuyển làn đường không đúng quy định “mỗi lần chuyển làn đường chỉ được phép chuyển sang một làn đường liền kề” khi chạy trên đường cao tốc; h) dùng tay cầm và sử dụng điện thoại hoặc các thiết bị điện tử khác khi điều khiển phương tiện tham gia giao thông đang di chuyển trên đường bộ; i) đi vào khu vực cấm, đường có biển báo hiệu có nội dung cấm đi vào đối với loại phương tiện đang điều khiển, trừ các hành vi vi phạm quy định tại điểm d khoản 9, điểm đ khoản 11 điều này, hành vi bị cấm đi vào công trình thủy lợi và các trường hợp xe ưu tiên đang đi làm nhiệm vụ khẩn cấp theo quy định; k) dừng xe, đỗ xe, quay đầu xe trái quy định gây ùn tắc giao thông; l) chuyển hướng không nhường quyền đi trước cho: người đi bộ, xe lăn của người khuyết tật qua đường tại nơi có vạch kẻ đường dành cho người đi bộ; xe thô sơ đang đi trên phần đường dành cho xe thô sơ; m) chuyển hướng không nhường đường cho: các xe đi ngược chiều; người đi bộ, xe thô sơ đang qua đường tại nơi không có vạch kẻ đường cho người đi bộ; n) không giảm tốc độ (hoặc dừng lại) và nhường đường khi điều khiển xe đi từ đường không ưu tiên ra đường ưu tiên, từ đường nhánh ra đường chính; o) không giảm tốc độ và nhường đường cho xe đi đến từ bên phải tại nơi đường giao nhau không có báo hiệu đi theo vòng xuyến; không giảm tốc độ và nhường đường cho xe đi đến từ bên trái tại nơi đường giao nhau có báo hiệu đi theo vòng xuyến; p) chở người trên thùng xe trái quy định; chở người trên nóc xe; để người đu bám ở cửa xe, bên ngoài thành xe khi xe đang chạy; q) mở cửa xe, để cửa xe mở không bảo đảm an toàn. 6. phạt tiền từ 6.000.000 đồng đến 8.000.000 đồng đối với người điều khiển xe thực hiện một trong các hành vi vi phạm sau đây: a) điều khiển xe chạy quá tốc độ quy định trên 20 km/h đến 35 km/h; b) không nhường đường hoặc gây cản trở xe được quyền ưu tiên đang phát tín hiệu ưu tiên đi làm nhiệm vụ; c) điều khiển xe trên đường mà trong máu hoặc hơi thở có nồng độ cồn nhưng chưa vượt quá 50 miligam/100 mililít máu hoặc chưa vượt quá 0,25 miligam/1 lít khí thở; d) điều khiển xe đi trên vỉa hè, trừ trường hợp điều khiển xe đi qua vỉa hè để vào nhà, cơ quan. 7. phạt tiền từ 12.000.000 đồng đến 14.000.000 đồng đối với người điều khiển xe thực hiện một trong các hành vi vi phạm sau đây: a) điều khiển xe chạy quá tốc độ quy định trên 35 km/h; b) điều khiển xe chở người bốn bánh có gắn động cơ, xe chở hàng bốn bánh có gắn động cơ đi vào đường cao tốc; c) dừng xe, đỗ xe trên đường cao tốc không đúng nơi quy định; không có báo hiệu bằng đèn khẩn cấp khi gặp sự cố kỹ thuật hoặc bất khả kháng khác buộc phải dừng xe, đỗ xe ở làn dừng xe khẩn cấp trên đường cao tốc; không có báo hiệu bằng đèn khẩn cấp, không đặt biển cảnh báo “chú ý xe đỗ” (hoặc đèn cảnh báo) về phía sau xe khoảng cách tối thiểu 150 mét khi dừng xe, đỗ xe trong trường hợp gặp sự cố kỹ thuật hoặc bất khả kháng khác buộc phải dừng xe, đỗ xe trên một phần làn đường xe chạy trên đường cao tốc. 8. phạt tiền từ 16.000.000 đồng đến 18.000.000 đồng đối với người điều khiển xe thực hiện hành vi vi phạm gây tai nạn giao thông không dừng ngay phương tiện, không giữ nguyên hiện trường, không trợ giúp người bị nạn, không ở lại hiện trường hoặc không đến trình báo ngay với cơ quan công an, ủy ban nhân dân nơi gần nhất. 9. phạt tiền từ 18.000.000 đồng đến 20.000.000 đồng đối với người điều khiển xe thực hiện một trong các hành vi vi phạm sau đây: a) điều khiển xe trên đường mà trong máu hoặc hơi thở có nồng độ cồn vượt quá 50 miligam đến 80 miligam/100 mililít máu hoặc vượt quá 0,25 miligam đến 0,4 miligam/1 lít khí thở; b) không chấp hành hiệu lệnh của đèn tín hiệu giao thông; c) không chấp hành hiệu lệnh, hướng dẫn của người điều khiển giao thông hoặc người kiểm soát giao thông; d) đi ngược chiều của đường một chiều, đi ngược chiều trên đường có biển ""cấm đi ngược chiều”, trừ các hành vi vi phạm quy định tại điểm đ khoản 11 điều này và các trường hợp xe ưu tiên đang đi làm nhiệm vụ khẩn cấp theo quy định. 10. phạt tiền từ 20.000.000 đồng đến 22.000.000 đồng đối với người điều khiển xe thực hiện một trong các hành vi vi phạm sau đây: a) điều khiển xe không quan sát, giảm tốc độ hoặc dừng lại để bảo đảm an toàn theo quy định mà gây tai nạn giao thông; điều khiển xe chạy quá tốc độ quy định gây tai nạn giao thông; dừng xe, đỗ xe, quay đầu xe, lùi xe, tránh xe, vượt xe, chuyển hướng, chuyển làn đường không đúng quy định gây tai nạn giao thông; không đi đúng phần đường, làn đường, không giữ khoảng cách an toàn giữa hai xe theo quy định gây tai nạn giao thông hoặc đi vào đường có biển báo hiệu có nội dung cấm đi vào đối với loại phương tiện đang điều khiển gây tai nạn giao thông, trừ các hành vi vi phạm quy định tại điểm đ khoản 11 điều này; b) vi phạm quy định tại một trong các điểm, khoản sau của điều này mà gây tai nạn giao thông: điểm a, điểm b, điểm c, điểm d, điểm đ khoản 1; điểm c khoản 2; điểm b, điểm g, điểm h, điểm n, điểm o, điểm p, khoản 3; điểm a, điểm c, điểm d khoản 4; điểm c, điểm d, điểm e, điểm h, điểm n, điểm o, điểm q khoản 5; điểm b khoản 7; điểm b, điểm c, điểm d khoản 9 điều này. 11. phạt tiền từ 30.000.000 đồng đến 40.000.000 đồng đối với người điều khiển xe thực hiện một trong các hành vi vi phạm sau đây: a) điều khiển xe trên đường mà trong máu hoặc hơi thở có nồng độ cồn vượt quá 80 miligam/100 mililít máu hoặc vượt quá 0,4 miligam/1 lít khí thở; b) không chấp hành yêu cầu kiểm tra về nồng độ cồn của người thi hành công vụ; c) điều khiển xe trên đường mà trong cơ thể có chất ma túy hoặc chất kích thích khác mà pháp luật cấm sử dụng; d) không chấp hành yêu cầu kiểm tra về chất ma túy hoặc chất kích thích khác mà pháp luật cấm sử dụng của người thi hành công vụ; đ) điều khiển xe đi ngược chiều trên đường cao tốc, lùi xe trên đường cao tốc, quay đầu xe trên đường cao tốc, trừ các xe ưu tiên đang đi làm nhiệm vụ khẩn cấp theo quy định. 12. phạt tiền từ 40.000.000 đồng đến 50.000.000 đồng đối với người điều khiển xe thực hiện hành vi điều khiển xe lạng lách, đánh võng trên đường bộ; chạy quá tốc độ đuổi nhau trên đường bộ; dùng chân điều khiển vô lăng xe khi xe đang chạy trên đường bộ. 13. phạt tiền từ 50.000.000 đồng đến 70.000.000 đồng đối với người điều khiển xe thực hiện hành vi vi phạm quy định tại khoản 12 điều này mà gây tai nạn giao thông. 14. tịch thu phương tiện đối với người điều khiển xe tái phạm hành vi điều khiển xe lạng lách, đánh võng quy định tại khoản 12 điều này. 15. ngoài việc bị phạt tiền, người điều khiển xe thực hiện hành vi vi phạm còn bị áp dụng các hình thức xử phạt bổ sung sau đây: a) thực hiện hành vi quy định tại điểm e khoản 5 điều này còn bị tịch thu thiết bị phát tín hiệu ưu tiên lắp đặt, sử dụng trái quy định; b) thực hiện hành vi quy định tại khoản 12 điều này bị tước quyền sử dụng giấy phép lái xe từ 10 tháng đến 12 tháng; c) thực hiện hành vi quy định tại điểm a, điểm b, điểm c, điểm d khoản 11; khoản 13; khoản 14 điều này bị tước quyền sử dụng giấy phép lái xe từ 22 tháng đến 24 tháng. 16. ngoài việc bị áp dụng hình thức xử phạt, người điều khiển xe thực hiện hành vi vi phạm còn bị trừ điểm giấy phép lái xe như sau: a) thực hiện hành vi quy định tại điểm h, điểm i khoản 3; điểm a, điểm b, điểm c, điểm d, điểm đ, điểm g khoản 4; điểm a, điểm b, điểm c, điểm d, điểm đ, điểm e, điểm g, điểm i, điểm k, điểm n, điểm o khoản 5 điều này bị trừ điểm giấy phép lái xe 02 điểm; b) thực hiện hành vi quy định tại điểm h khoản 5; khoản 6; điểm b khoản 7; điểm b, điểm c, điểm d khoản 9 điều này bị trừ điểm giấy phép lái xe 04 điểm; c) thực hiện hành vi quy định tại điểm p khoản 5; điểm a, điểm c khoản 7; khoản 8 điều này bị trừ điểm giấy phép lái xe 06 điểm; d) thực hiện hành vi quy định tại điểm a khoản 9, khoản 10, điểm đ khoản 11 điều này bị trừ điểm giấy phép lái xe 10 điểm.', '1. phạt tiền từ 200.000 đồng đến 400.000 đồng đối với người điều khiển xe thực hiện một trong các hành vi vi phạm sau đây: a) không chấp hành hiệu lệnh, chỉ dẫn của biển báo hiệu, vạch kẻ đường, trừ các hành vi vi phạm quy định tại điểm b, điểm d, điểm e khoản 2; điểm a, điểm c, điểm d, điểm h khoản 3; điểm a, điểm b, điểm c, điểm d khoản 4; điểm b, điểm d khoản 6; điểm a, điểm b, điểm c khoản 7; điểm a khoản 8; điểm b khoản 9; điểm a khoản 10 điều này; b) không có tín hiệu trước khi vượt hoặc có tín hiệu vượt xe nhưng không sử dụng trong suốt quá trình vượt xe; c) lùi xe mô tô ba bánh không quan sát hai bên, phía sau xe hoặc không có tín hiệu lùi xe; d) chở người ngồi trên xe sử dụng ô (dù); đ) không tuân thủ các quy định về nhường đường tại nơi đường giao nhau, trừ các hành vi vi phạm quy định tại điểm c, điểm d khoản 6 điều này; e) chuyển làn đường không đúng nơi cho phép hoặc không có tín hiệu báo trước hoặc chuyển làn đường không đúng quy định “mỗi lần chuyển làn đường chỉ được phép chuyển sang một làn đường liền kề”; g) không sử dụng đèn chiếu sáng trong thời gian từ 18 giờ ngày hôm trước đến 06 giờ ngày hôm sau hoặc khi có sương mù, khói, bụi, trời mưa, thời tiết xấu làm hạn chế tầm nhìn; h) tránh xe không đúng quy định; sử dụng đèn chiếu xa khi gặp người đi bộ qua đường hoặc khi đi trên đoạn đường qua khu dân cư có hệ thống chiếu sáng đang hoạt động hoặc khi gặp xe đi ngược chiều (trừ trường hợp dải phân cách có khả năng chống chói) hoặc khi chuyển hướng xe tại nơi đường giao nhau; không nhường đường cho xe đi ngược chiều theo quy định tại nơi đường hẹp, đường dốc, nơi có chướng ngại vật; i) sử dụng còi trong thời gian từ 22 giờ ngày hôm trước đến 05 giờ ngày hôm sau trong khu đông dân cư, khu vực cơ sở khám bệnh, chữa bệnh, trừ các xe ưu tiên đang đi làm nhiệm vụ theo quy định; k) điều khiển xe chạy dưới tốc độ tối thiểu trên đoạn đường bộ có quy định tốc độ tối thiểu cho phép. 2. phạt tiền từ 400.000 đồng đến 600.000 đồng đối với người điều khiển xe thực hiện một trong các hành vi vi phạm sau đây: a) dừng xe, đỗ xe trên phần đường xe chạy ở đoạn đường ngoài đô thị nơi có lề đường; b) điều khiển xe chạy quá tốc độ quy định từ 05 km/h đến dưới 10 km/h; c) điều khiển xe chạy tốc độ thấp mà không đi bên phải phần đường xe chạy gây cản trở giao thông; d) dừng xe, đỗ xe ở lòng đường gây cản trở giao thông; tụ tập từ 03 xe trở lên ở lòng đường, trong hầm đường bộ; đỗ, để xe ở lòng đường, vỉa hè trái phép; đ) xe không được quyền ưu tiên lắp đặt, sử dụng thiết bị phát tín hiệu của xe được quyền ưu tiên; e) dừng xe, đỗ xe trên điểm đón, trả khách, nơi đường bộ giao nhau, trên phần đường dành cho người đi bộ qua đường; dừng xe nơi có biển “cấm dừng xe và đỗ xe”; đỗ xe tại nơi có biển “cấm đỗ xe” hoặc biển “cấm dừng xe và đỗ xe”; không tuân thủ các quy định về dừng xe, đỗ xe tại nơi đường bộ giao nhau cùng mức với đường sắt; dừng xe, đỗ xe trong phạm vi hành lang an toàn giao thông đường sắt; g) chở theo 02 người trên xe, trừ trường hợp chở người bệnh đi cấp cứu, trẻ em dưới 12 tuổi, người già yếu hoặc người khuyết tật, áp giải người có hành vi vi phạm pháp luật; h) không đội “mũ bảo hiểm cho người đi mô tô, xe máy” hoặc đội “mũ bảo hiểm cho người đi mô tô, xe máy” không cài quai đúng quy cách khi điều khiển xe tham gia giao thông trên đường bộ; i) chở người ngồi trên xe không đội “mũ bảo hiểm cho người đi mô tô, xe máy” hoặc đội “mũ bảo hiểm cho người đi mô tô, xe máy” không cài quai đúng quy cách, trừ trường hợp chở người bệnh đi cấp cứu, trẻ em dưới 06 tuổi, áp giải người có hành vi vi phạm pháp luật; k) quay đầu xe tại nơi không được quay đầu xe, trừ hành vi vi phạm quy định tại điểm d khoản 4 điều này. 3. phạt tiền từ 600.000 đồng đến 800.000 đồng đối với người điều khiển xe thực hiện một trong các hành vi vi phạm sau đây: a) chuyển hướng không quan sát hoặc không bảo đảm khoảng cách an toàn với xe phía sau hoặc không giảm tốc độ hoặc không có tín hiệu báo hướng rẽ hoặc có tín hiệu báo hướng rẽ nhưng không sử dụng liên tục trong quá trình chuyển hướng (trừ trường hợp điều khiển xe đi theo hướng cong của đoạn đường bộ ở nơi đường không giao nhau cùng mức); điều khiển xe rẽ trái tại nơi có biển báo hiệu có nội dung cấm rẽ trái đối với loại phương tiện đang điều khiển; điều khiển xe rẽ phải tại nơi có biển báo hiệu có nội dung cấm rẽ phải đối với loại phương tiện đang điều khiển; b) chở theo từ 03 người trở lên trên xe; c) dừng xe, đỗ xe trên cầu; d) điều khiển xe không đi bên phải theo chiều đi của mình; đi không đúng phần đường, làn đường quy định (làn cùng chiều hoặc làn ngược chiều); điều khiển xe đi qua dải phân cách cố định ở giữa hai phần đường xe chạy; đ) vượt bên phải trong trường hợp không được phép; e) người đang điều khiển xe hoặc chở người ngồi trên xe bám, kéo, đẩy xe khác, vật khác, dẫn dắt vật nuôi, mang vác vật cồng kềnh; chở người đứng trên yên, giá đèo hàng hoặc ngồi trên tay lái của xe; g) điều khiển xe kéo theo xe khác, vật khác; h) chạy trong hầm đường bộ không sử dụng đèn chiếu sáng gần; i) không giữ khoảng cách an toàn để xảy ra va chạm với xe chạy liền trước hoặc không giữ khoảng cách theo quy định của biển báo hiệu “cự ly tối thiểu giữa hai xe”; k) điều khiển xe chạy dàn hàng ngang từ 03 xe trở lên; l) xe được quyền ưu tiên lắp đặt, sử dụng thiết bị phát tín hiệu ưu tiên không đúng quy định hoặc sử dụng thiết bị phát tín hiệu ưu tiên mà không có giấy phép của cơ quan có thẩm quyền cấp hoặc có giấy phép của cơ quan có thẩm quyền cấp nhưng không còn giá trị sử dụng theo quy định. 4. phạt tiền từ 800.000 đồng đến 1.000.000 đồng đối với người điều khiển xe thực hiện một trong các hành vi vi phạm sau đây: a) điều khiển xe chạy quá tốc độ quy định từ 10 km/h đến 20 km/h; b) dừng xe, đỗ xe trong hầm đường bộ không đúng nơi quy định; c) vượt xe trong những trường hợp không được vượt, vượt xe tại đoạn đường có biển báo hiệu có nội dung cấm vượt đối với loại phương tiện đang điều khiển, trừ các hành vi vi phạm quy định tại điểm đ khoản 3 điều này; d) quay đầu xe trong hầm đường bộ; đ) người đang điều khiển xe sử dụng ô (dù), thiết bị âm thanh (trừ thiết bị trợ thính), dùng tay cầm và sử dụng điện thoại hoặc các thiết bị điện tử khác. 5. phạt tiền từ 1.000.000 đồng đến 2.000.000 đồng đối với người điều khiển xe thực hiện một trong các hành vi vi phạm sau đây: a) điều khiển xe có liên quan trực tiếp đến vụ tai nạn giao thông mà không dừng ngay phương tiện, không giữ nguyên hiện trường, không trợ giúp người bị nạn, trừ hành vi vi phạm quy định tại điểm c khoản 9 điều này; b) chuyển hướng không nhường quyền đi trước cho: người đi bộ, xe lăn của người khuyết tật qua đường tại nơi có vạch kẻ đường dành cho người đi bộ; xe thô sơ đang đi trên phần đường dành cho xe thô sơ; c) chuyển hướng không nhường đường cho: các xe đi ngược chiều; người đi bộ, xe thô sơ đang qua đường tại nơi không có vạch kẻ đường cho người đi bộ. 6. phạt tiền từ 2.000.000 đồng đến 3.000.000 đồng đối với người điều khiển xe thực hiện một trong các hành vi vi phạm sau đây: a) điều khiển xe trên đường mà trong máu hoặc hơi thở có nồng độ cồn nhưng chưa vượt quá 50 miligam/100 mililít máu hoặc chưa vượt quá 0,25 miligam/1 lít khí thở; b) đi vào khu vực cấm, đường có biển báo hiệu có nội dung cấm đi vào đối với loại phương tiện đang điều khiển, trừ các hành vi vi phạm quy định tại điểm a, điểm b khoản 7 điều này và các trường hợp xe ưu tiên đang đi làm nhiệm vụ khẩn cấp theo quy định; c) không giảm tốc độ (hoặc dừng lại) và nhường đường khi điều khiển xe đi từ đường không ưu tiên ra đường ưu tiên, từ đường nhánh ra đường chính; d) không giảm tốc độ và nhường đường cho xe đi đến từ bên phải tại nơi đường giao nhau không có báo hiệu đi theo vòng xuyến; không giảm tốc độ và nhường đường cho xe đi đến từ bên trái tại nơi đường giao nhau có báo hiệu đi theo vòng xuyến. 7. phạt tiền từ 4.000.000 đồng đến 6.000.000 đồng đối với người điều khiển xe thực hiện một trong các hành vi vi phạm sau đây: a) đi ngược chiều của đường một chiều, đi ngược chiều trên đường có biển “cấm đi ngược chiều”, trừ hành vi vi phạm quy định tại điểm b khoản này và các trường hợp xe ưu tiên đang đi làm nhiệm vụ khẩn cấp theo quy định; điều khiển xe đi trên vỉa hè, trừ trường hợp điều khiển xe đi qua vỉa hè để vào nhà, cơ quan; b) điều khiển xe đi vào đường cao tốc, trừ xe phục vụ việc quản lý, bảo trì đường cao tốc; c) không chấp hành hiệu lệnh của đèn tín hiệu giao thông; d) không chấp hành hiệu lệnh, hướng dẫn của người điều khiển giao thông hoặc người kiểm soát giao thông; đ) không nhường đường hoặc gây cản trở xe được quyền ưu tiên đang phát tín hiệu ưu tiên đi làm nhiệm vụ. 8. phạt tiền từ 6.000.000 đồng đến 8.000.000 đồng đối với người điều khiển xe thực hiện một trong các hành vi vi phạm sau đây: a) điều khiển xe chạy quá tốc độ quy định trên 20 km/h; b) điều khiển xe trên đường mà trong máu hoặc hơi thở có nồng độ cồn vượt quá 50 miligam đến 80 miligam/100 mililít máu hoặc vượt quá 0,25 miligam đến 0,4 miligam/1 lít khí thở. 9. phạt tiền từ 8.000.000 đồng đến 10.000.000 đồng đối với người điều khiển xe thực hiện một trong các hành vi vi phạm sau đây: a) điều khiển xe lạng lách, đánh võng trên đường bộ; sử dụng chân chống hoặc vật khác quệt xuống đường khi xe đang chạy; b) điều khiển xe thành nhóm từ 02 xe trở lên chạy quá tốc độ quy định; c) gây tai nạn giao thông không dừng ngay phương tiện, không giữ nguyên hiện trường, không trợ giúp người bị nạn, không ở lại hiện trường hoặc không đến trình báo ngay với cơ quan công an, ủy ban nhân dân nơi gần nhất; d) điều khiển xe trên đường mà trong máu hoặc hơi thở có nồng độ cồn vượt quá 80 miligam/100 mililít máu hoặc vượt quá 0,4 miligam/1 lít khí thở; đ) không chấp hành yêu cầu kiểm tra về nồng độ cồn của người thi hành công vụ; e) điều khiển xe trên đường mà trong cơ thể có chất ma túy hoặc chất kích thích khác mà pháp luật cấm sử dụng; g) không chấp hành yêu cầu kiểm tra về chất ma túy hoặc chất kích thích khác mà pháp luật cấm sử dụng của người thi hành công vụ; h) ngồi phía sau vòng tay qua người ngồi trước để điều khiển xe, trừ trường hợp chở trẻ em dưới 06 tuổi ngồi phía trước; i) điều khiển xe thành đoàn gây cản trở giao thông, trừ trường hợp được cơ quan có thẩm quyền cấp phép; k) sử dụng còi, rú ga (nẹt pô) liên tục trong khu đông dân cư, khu vực cơ sở khám bệnh, chữa bệnh, trừ các xe ưu tiên đang đi làm nhiệm vụ theo quy định. 10. phạt tiền từ 10.000.000 đồng đến 14.000.000 đồng đối với người điều khiển xe thực hiện một trong các hành vi vi phạm sau đây: a) điều khiển xe không quan sát, giảm tốc độ hoặc dừng lại để bảo đảm an toàn theo quy định mà gây tai nạn giao thông; điều khiển xe chạy quá tốc độ quy định gây tai nạn giao thông; đi vào đường cao tốc, dừng xe, đỗ xe, quay đầu xe, lùi xe, vượt xe, chuyển hướng, chuyển làn đường không đúng quy định gây tai nạn giao thông; không đi đúng phần đường, làn đường, không giữ khoảng cách an toàn giữa hai xe theo quy định gây tai nạn giao thông hoặc đi vào đường có biển báo hiệu có nội dung cấm đi vào đối với loại phương tiện đang điều khiển, đi ngược chiều của đường một chiều, đi ngược chiều trên đường có biển “cấm đi ngược chiều” gây tai nạn giao thông; b) vi phạm quy định tại một trong các điểm, khoản sau của điều này mà gây tai nạn giao thông: điểm a, điểm d, điểm đ, điểm g, điểm h, điểm i, điểm k khoản 1; điểm c, điểm đ, điểm g khoản 2; điểm b, điểm e, điểm g, điểm h, điểm k khoản 3; điểm đ khoản 4; điểm c, điểm d khoản 6; điểm c, điểm d, điểm đ khoản 7; điểm a, điểm b, điểm h, điểm k khoản 9 điều này. 11. tịch thu phương tiện đối với người điều khiển xe thực hiện một trong các hành vi vi phạm sau đây: a) buông cả hai tay khi đang điều khiển xe; dùng chân điều khiển xe; ngồi về một bên điều khiển xe; nằm trên yên xe điều khiển xe; thay người điều khiển khi xe đang chạy; quay người về phía sau để điều khiển xe hoặc bịt mắt điều khiển xe; b) điều khiển xe chạy bằng một bánh đối với xe hai bánh, chạy bằng hai bánh đối với xe ba bánh; c) tái phạm hành vi điều khiển xe lạng lách, đánh võng quy định tại điểm a khoản 9 điều này. 12. ngoài việc bị áp dụng hình thức xử phạt chính, người điều khiển xe thực hiện hành vi vi phạm còn bị áp dụng các hình thức xử phạt bổ sung sau đây: a) thực hiện hành vi quy định tại điểm đ khoản 2 điều này còn bị tịch thu thiết bị phát tín hiệu ưu tiên lắp đặt, sử dụng trái quy định; b) thực hiện hành vi quy định tại điểm a, điểm b, điểm h, điểm i, điểm k khoản 9 điều này bị tước quyền sử dụng giấy phép lái xe từ 10 tháng đến 12 tháng; c) thực hiện hành vi quy định tại điểm d, điểm đ, điểm e, điểm g khoản 9; khoản 11 điều này bị tước quyền sử dụng giấy phép lái xe từ 22 tháng đến 24 tháng. 13. ngoài việc bị áp dụng hình thức xử phạt, người điều khiển xe thực hiện hành vi vi phạm còn bị trừ điểm giấy phép lái xe như sau: a) thực hiện hành vi quy định tại điểm b khoản 3; khoản 5; điểm b, điểm c, điểm d khoản 6; điểm a khoản 7 điều này bị trừ điểm giấy phép lái xe 02 điểm; b) thực hiện hành vi quy định tại điểm đ khoản 4; điểm a khoản 6; điểm c, điểm d, điểm đ khoản 7; điểm a khoản 8 điều này bị trừ điểm giấy phép lái xe 04 điểm; c) thực hiện hành vi quy định tại điểm b khoản 7, điểm c khoản 9 điều này bị trừ điểm giấy phép lái xe 06 điểm; d) thực hiện hành vi quy định tại điểm b khoản 8, khoản 10 điều này bị trừ điểm giấy phép lái xe 10 điểm.', 'thực hiện trách nhiệm của chủ phương tiện giao thông đường bộ theo quy định của pháp luật về thanh toán điện tử giao thông đường bộ, pháp luật về thu phí sử dụng đường cao tốc.', '1. các hồ sơ đề nghị cấp giấy phép lưu hành xe đã gửi đến và được cơ quan có thẩm quyền cấp giấy phép lưu hành xe tiếp nhận trước ngày thông tư này có hiệu lực thi hành thì được thực hiện theo quy định của pháp luật tại thời điểm nộp hồ sơ đề nghị. 2. các giấy phép lưu hành xe đã được cơ quan có thẩm quyền cấp trước ngày thông tư này có hiệu lực thi hành, tiếp tục được sử dụng cho đến khi hết thời hạn ghi trong giấy phép lưu hành xe./. phụ lục i (ban hành kèm theo thông tư số 39/2024/tt-bgtvt ngày 15 tháng 11 năm 2024 của bộ trưởng bộ giao thông vận tải) cộng hòa xã hội chủ nghĩa việt nam\nđộc lập - tự do - hạnh phúc\n--------------- đơn đề nghị cấp giấy phép lưu hành xe quá tải trọng, xe quá khổ giới hạn, xe vận chuyển hàng siêu trường, siêu trọng trên đường bộ kính gửi: ……... (tên cơ quan cấp giấy phép lưu hành xe) ….... - cá nhân, tổ chức đề nghị: ...................................................................................... - địa chỉ: .................................................... điện thoại: ............................................ đề nghị cấp giấy phép lưu hành cho xe … (xe quá tải trọng, xe quá khổ giới hạn, xe vận chuyển hàng siêu trường, siêu trọng) … trên đường bộ với các thông số sau: 6. tuyến đường và thời gian vận chuyển: - tuyến đường vận chuyển (ghi đầy đủ, cụ thể nơi đi, nơi đến, tên từng đoạn tuyến đường bộ, các vị trí chuyển hướng, đi qua đường ngang tại km...): ……… - thời gian đề nghị lưu hành: từ ngày… tháng ... năm ... đến ngày... tháng... năm... 7. lý do đề nghị cấp giấy phép lưu hành xe: ……. (ghi cụ thể lý do theo nội dung tại khoản 1 điều 22 của thông tư số /2024/tt-bgtvt) ……………… 8. cam kết của cá nhân, tổ chức đề nghị (về: (a) tính chính xác của các thông tin cung cấp trong đơn đề nghị và hồ sơ; (b) tính hợp pháp của phương tiện và hàng hóa tại thời điểm đề nghị cấp giấy phép lưu hành xe; (c) việc chấp hành quy định của pháp luật về bảo đảm an toàn giao thông và an toàn cho công trình đường bộ; (d) chịu trách nhiệm trước pháp luật nếu để xảy ra mất an toàn giao thông trong quá trình lưu hành phương tiện được cấp giấy phép lưu hành trên đường bộ và khắc phục hậu quả (nếu có))……………........................... .......................................................................................................................… ghi chú: đối với tổ hợp phương tiện vận chuyển loại hàng siêu trường, siêu trọng có kích thước, khối lượng lớn, tuyến đường vận chuyển dài, địa hình phức tạp hoặc phải dùng thiết bị chuyên dùng để hỗ trợ, đơn đề nghị có nhiều thông tin thì bổ sung phụ lục kèm theo. phụ lục ii (ban hành kèm theo thông tư số 39/2024/tt-bgtvt ngày 15 tháng 11 năm 2024 của bộ trưởng bộ giao thông vận tải) cộng hòa xã hội chủ nghĩa việt nam\nđộc lập - tự do - hạnh phúc\n--------------- đơn đề nghị cấp giấy phép lưu hành\nxe bánh xích tự hành trên đường bộ kính gửi: .... (tên cơ quan cấp giấy phép lưu hành xe) .... - cá nhân, tổ chức đề nghị: ....................................................................................... - địa chỉ: ........................................... điện thoại: ……………………… - đề nghị cấp giấy phép lưu hành cho xe bánh xích tự hành trên đường bộ: .... - biển số đăng ký (nếu có): ....................................................................................... - khối lượng bản thân xe: .............................................. (kg) - kích thước của xe: + chiều dài: ................................................. (m) + chiều rộng: ................................................. (m) + chiều cao: ................................................ (m) - loại xích (nhọn hoặc bằng): .................................................. - chiều rộng bánh xích mỗi bên: .........................(m) - khoảng cách giữa hai mép ngoài của bánh: ........................... (m) - tuyến đường vận chuyển (ghi đầy đủ, cụ thể tên từng đoạn tuyến đường bộ, các vị trí chuyển hướng, đi qua đường ngang tại km …): - thời gian đề nghị lưu hành: từ ngày...tháng...năm... đến ngày... tháng... năm... - lý do đề nghị cấp giấy phép lưu hành xe: …... (ghi cụ thể lý do theo nội dung khoản 1 điều 22 của thông tư số ... /2024/tt-bgtvt) …………………… - cam kết của cá nhân, tổ chức đề nghị (về: (a) tính chính xác của các thông tin cung cấp trong đơn đề nghị và hồ sơ; (b) tính hợp pháp của phương tiện tại thời điểm đề nghị cấp giấy phép lưu hành xe; (c) việc chấp hành quy định của pháp luật về bảo đảm an toàn giao thông và an toàn cho công trình đường bộ; (d) chịu trách nhiệm trước pháp luật nếu để xảy ra mất an toàn giao thông trong quá trình lưu hành phương tiện được cấp giấy phép lưu hành trên đường bộ và khắc phục hậu quả (nếu có)): ………………………………….. phụ lục iii (ban hành kèm theo thông tư số 39/2024/tt-bgtvt ngày 15 tháng 11 năm 2024 của bộ trưởng bộ giao thông vận tải) giấy phép lưu hành xe quá tải trọng, xe quá khổ giới hạn, xe vận chuyển hàng siêu trường, siêu trọng trên đường bộ có giá trị đến hết ngày ... tháng ... năm ... - căn cứ luật đường bộ ngày 27 tháng 6 năm 2024; - căn cứ luật trật tự, an toàn giao thông đường bộ ngày 27 tháng 6 năm 2024; - căn cứ thông tư số /2024/tt-bgtvt ngày /11/2024 của bộ trưởng bộ gtvt quy định về tải trọng, khổ giới hạn của đường bộ; lưu hành xe quá khổ giới hạn, xe quá tải trọng, xe bánh xích trên đường bộ; hàng siêu trường, siêu trọng, vận chuyển hàng siêu trường, siêu trọng; xếp hàng hóa trên phương tiện giao thông đường bộ; cấp giấy phép lưu hành cho xe quá tải trọng, xe quá khổ giới hạn, xe bánh xích, xe vận chuyển hàng siêu trường, siêu trọng trên đường bộ. - xét đơn đề nghị cấp giấy phép lưu hành xe quá tải trọng, xe quá khổ giới hạn, xe vận chuyển hàng siêu trường, siêu trọng trên đường bộ ngày .... tháng .... năm .... của …….. (tên tổ chức, cá nhân đứng đơn, địa chỉ), cho phép lưu hành xe ... (xe quá tải trọng, xe quá khổ giới hạn, xe vận chuyển hàng siêu trường, siêu trọng) ... trên đường bộ của .... (tên tổ chức, cá nhân chủ xe) ... với các thông tin như sau: 7. các điều kiện quy định khi lưu hành xe trên đường bộ - chủ phương tiện, người điều khiển phương tiện phải tuân thủ các quy định của luật đường bộ, luật trật tự, an toàn giao thông đường bộ. - xe phải có hệ thống hãm đủ hiệu lực (kể cả rm/smrm kéo theo); hệ thống liên kết nối xe đầu kéo với rm/smrm phải chắc chắn, bảo đảm an toàn và đúng quy định của nhà sản xuất; phải có cờ, đèn báo hiệu điểm nhô ra lớn nhất của kích thước bao ngoài của xe theo quy định. - khi lưu hành trên đường cao tốc và qua hầm đường bộ, trạm thu phí phải tuân thủ quy định về tốc độ, khoảng cách, làn đường và các quy định về quản lý, khai thác của công trình hoặc hướng dẫn của đơn vị quản lý công trình đó (nếu có). - khi qua cầu, xe chạy đúng .... (tim hoặc làn) .... với tốc độ .... không dừng, đỗ, phanh, hãm xe trên cầu; không dừng, đỗ xe trong phạm vi đường ngang. - ….. (các điều kiện quy định bảo đảm an toàn khác nếu cần thiết) ... - phải chịu sự kiểm tra, kiểm soát của lực lượng kiểm soát giao thông trên đường bộ. 8. số điện thoại liên hệ của cơ quan cấp giấy phép lưu hành xe: ghi chú: đối với tổ hợp phương tiện vận chuyển loại hàng siêu trường, siêu trọng có kích thước, khối lượng lớn, tuyến đường vận chuyển dài, địa hình phức tạp hoặc phải dùng thiết bị chuyên dùng để hỗ trợ, giấy phép lưu hành có nhiều thông tin thì bổ sung phụ lục kèm theo. phụ lục iv (ban hành kèm theo thông tư số 39/2024/tt-bgtvt ngày 15 tháng 11 năm 2024 của bộ trưởng bộ giao thông vận tải) giấy phép lưu hành xe bánh xích tự hành trên đường bộ có giá trị đến hết ngày … tháng… năm.... - căn cứ luật đường bộ ngày 27 tháng 6 năm 2024; - căn cứ luật trật tự, an toàn giao thông đường bộ ngày 27 tháng 6 năm 2024; - căn cứ thông tư số /2024/tt-bgtvt ngày /11/2024 của bộ trưởng bộ gtvt quy định về tải trọng, khổ giới hạn của đường bộ; lưu hành xe quá khổ giới hạn, xe quá tải trọng, xe bánh xích trên đường bộ; hàng siêu trường, siêu trọng, vận chuyển hàng siêu trường, siêu trọng; xếp hàng hóa trên phương tiện giao thông đường bộ; cấp giấy phép lưu hành cho xe quá tải trọng, xe quá khổ giới hạn, xe bánh xích, xe vận chuyển hàng siêu trường, siêu trọng trên đường bộ. - xét đơn đề nghị cấp giấy phép lưu hành xe bánh xích tự hành trên đường bộ ngày....tháng....năm…của… (tên tổ chức, cá nhân đứng đơn, địa chỉ)……….., 1. cho phép lưu hành xe bánh xích tự hành trên đường bộ cụ thể như sau: xe bánh xích (nhãn hiệu xe): …….. biển số đăng ký: ………..của ……. ................. (tên tổ chức, cá nhân chủ xe) …………… với các thông số như sau: - chiều dài: ............... m; - chiều rộng: …… m; - chiều cao (tính từ mặt đường trở lên): …. m - khối lượng toàn bộ của xe: …. tấn; - loại bánh xích (bằng hay nhọn): .......................................................................... - nơi đi ......... (ghi cụ thể km .........../ql (đt) ......... , địa danh) hoặc ghi cụ thể tuyến đường, địa danh đối với tuyến đường bộ không bố trí cột km - nơi đến ...... .. (ghi cụ thể km ......../ql (đt....., địa danh) hoặc ghi cụ thể tuyến đường, địa danh đối với tuyến đường bộ không bố trí cột km + các tuyến được đi: …. (ghi đầy đủ, cụ thể tên đoạn tuyến đường bộ được đi, các vị trí chuyển hướng, đi qua đường ngang (nếu có), các điểm khống chế từ nơi đi đến nơi đến)... 2. các điều kiện quy định khi lưu hành xe trên đường bộ - chủ phương tiện, người điều khiển phương tiện phải tuân thủ các quy định của luật đường bộ, luật trật tự, an toàn giao thông đường bộ. - phải bảo đảm các điều kiện an toàn kỹ thuật của xe và phải lắp guốc cho bánh xích. - chạy phía bên phải của chiều đi, đúng tốc độ thiết kế của xe và không quá tốc độ quy định trên đường; nhường đường cho các phương tiện khác. - khi qua cầu phải đi đúng .... (tim hoặc làn) .... với tốc độ chậm, không dừng, đỗ trên cầu; không dừng, đỗ xe trong phạm vi đường ngang. - ….. (các điều kiện quy định bảo đảm an toàn khác nếu cần thiết) .................. - phải chịu sự kiểm tra, kiểm soát của các lực lượng kiểm soát giao thông trên đường. 3. số điện thoại liên hệ của cơ quan cấp giấy phép lưu hành xe: phụ lục v (ban hành kèm theo thông tư số 39/2024/tt-bgtvt ngày 15 tháng 11 năm 2024 của bộ trưởng bộ giao thông vận tải) báo cáo cấp giấy phép lưu hành cho xe quá tải trọng\ntrên đường bộ (kể cả xe bánh xích) (tháng............. năm ) kính gửi: ……………………………….. phụ lục vi (ban hành kèm theo thông tư số 39/2024/tt-bgtvt ngày 15 tháng 11 năm 2024 của bộ trưởng bộ giao thông vận tải) báo cáo cấp giấy phép lưu hành cho xe quá khổ giới hạn trên đường bộ (kể cả xe bánh xích) (tháng ........................ năm ..........) kính gửi: …………………………………. phụ lục vii (ban hành kèm theo thông tư số 39/2024/tt-bgtvt ngày 15 tháng 11 năm 2024 của bộ trưởng bộ giao thông vận tải) báo cáo cấp giấy phép lưu hành cho xe quá tải trọng và xe quá khổ giới hạn trên đường bộ (kể cả xe bánh xích) (tháng………năm……….) kính gửi: …………………………………. phụ lục viii (ban hành kèm theo thông tư số 39/2024/tt-bgtvt ngày 15 tháng 11 năm 2024 của bộ trưởng bộ giao thông vận tải) báo cáo tổng hợp số lượng cấp giấy phép lưu hành xe quá tải trọng, xe quá khổ giới hạn, xe bánh xích trên đường bộ và xe vận chuyển hàng siêu trường, siêu trọng (tháng .......... năm...................) kính gửi: ………………………………….. phụ lục ix (ban hành kèm theo thông tư số 39/2024/tt-bgtvt ngày 15 tháng 11 năm 2024 của bộ trưởng bộ giao thông vận tải) nội dung công bố tải trọng, khổ giới hạn của đường bộ i. các tuyến, đoạn tuyến đường bộ đã vào cấp (có tải trọng thiết kế mặt đường cho xe có tải trọng trục nhỏ hơn hoặc bằng 10 tấn/trục đơn của xe, tải trọng thiết kế cầu là hl - 93 hoặc tương đương) ii. các vị trí hạn chế tải trọng, khổ giới hạn trên đường bộ iii. các cầu hạn chế tải trọng, khổ giới hạn ghi chú: số liệu nhập tại cột (7) có dạng xx-yy-zz trong đó: 1. số hiệu thứ nhất xx là giới hạn khối lượng toàn bộ xe ô tô tải 2. số hiệu thứ hai yy là giới hạn khối lượng toàn bộ xe ô tô đầu kéo kéo sơ-mi-rơ-moóc; 3. số hiệu thứ ba zz là giới hạn khối lượng toàn bộ xe ô tô kéo rơ-moóc. ví dụ: thông tin tại cột (7) là 23 - 29 - 32, nghĩa là xe ô tô tải được phép lưu thông với khối lượng toàn bộ (cả xe và hàng) nhỏ hơn hoặc bằng 23 tấn; xe ô tô đầu kéo kéo sơ-mi- rơ-moóc được lưu thông với khối lượng toàn bộ (cả xe và hàng) nhỏ hơn hoặc bằng 29 tấn và xe ô tô kéo rơ-moóc được lưu thông với khối lượng toàn bộ (cả xe và hàng) nhỏ hơn hoặc bằng 32 tấn. phụ lục x (ban hành kèm theo thông tư số 39/2024/tt-bgtvt ngày 15 tháng 11 năm 2024 của bộ trưởng bộ giao thông vận tải) một số trang thiết bị thường dùng để gia cố, chằng buộc, chèn, lót hàng hóa 1. yêu cầu chung các dụng cụ dùng để gia cố, chằng buộc, chèn, lót hàng hóa phải có quy cách đảm bảo cố định chắc chắn được hàng hóa trên phương tiện trong mọi điều kiện vận hành như khi phương tiện lên dốc, tăng tốc, phanh đột ngột hoặc vào cung đường nghiêng ngang. 2. chêm và để chêm 2.1. có 3 loại chêm, gồm: chêm nhọn, khối chêm, để chêm được sử dụng để ngăn khối hàng tròn hoặc hình trụ lăn trên sàn xe. a) chêm nhọn (chêm góc): thông thường các góc chêm là 15o không có khả năng cố định và chức năng chính là để giữ hàng hóa ở đúng vị trí trong quá trình bốc dỡ. chêm nhọn được minh họa tại hình 1.1. b) khối chêm (góc chêm xấp xỉ 45o): là khối để ngăn dãy hàng có tiết diện tròn (cuộn hàng) khỏi sự xê dịch. các cuộn hàng phải được chằng buộc lại chắc chắn trên sàn chất tải với các nẹp cạnh và cần thiết phải chằng buộc qua nóc đối với 2 cuộn phía sau. khối chêm có chiều cao nhỏ nhất bằng r/3 (một phần ba bán kính của khối hàng) nếu không có dây chằng buộc qua nóc. nếu sử dụng trong trường hợp có kết hợp chằng buộc qua nóc, chiều cao của khối chêm không vượt quá 20 cm. khi dùng đinh cố định chêm gỗ xuống sàn, chú ý đảm bảo khả năng chịu lực của nó không giảm đi. khối chêm được minh họa tại hình 1.1. hình 1.1. minh họa mô tả chêm nhọn và khối chêm c) để chêm: hai chêm dài được gắn với nhau ở một khoảng cách nhất định bởi các thanh giằng bắt chặt bằng bu lông đai ốc hoặc bởi các dây xích. các thanh giằng này được sắp xếp tạo ra 1 khoảng cách nhỏ nhất so với sàn xe là 20 mm để đảm bảo không xảy ra sự xê dịch ngang của các khối hàng dạng cuộn hoặc hình trụ. để chêm được minh họa tại hình 1.2. (góc khoảng 370 trong tam giác vuông, với các cạnh theo tỷ lệ 3, 4 và 5) hình 1.2. minh họa mô tả để chêm 2.2. chêm được sử dụng cho cuộn dây quấn ngang như minh họa tại hình 1.3, cụ thể như sau: - chêm vào vị trí trống của cuộn dây nên ôm trọn toàn bộ bề rộng cuộn dây. - các thiết bị ổn định và khoảng trống dưới cuộn dây tương tự như đối với phương pháp dùng máng. - sử dụng các tấm trống trượt giữa để gia cố và sàn chất tải. hình 1.3. minh họa mô tả kích thước để chêm 3. thiết bị chằng buộc 3.1. việc lựa chọn thiết bị phù hợp nhất cho việc chằng buộc cố định hàng hóa vào một phương tiện phụ thuộc vào loại và thành phần khối hàng được vận chuyển. vận chuyển hàng hỗn hợp sẽ cần nhiều loại thiết bị chằng buộc khác nhau. 3.2. một số loại thiết bị chằng buộc khuyên dùng cho một số loại hàng: a) các loại dây đai chằng buộc thường được sử dụng trong phương pháp chằng buộc qua nóc hoặc cũng có thể được sử dụng cho chằng buộc thẳng (đặc biệt nên sử dụng loại dây chằng có kích thước lớn hơn). các loại dây chằng buộc thường bao gồm một dây đai cùng với một số loại phụ kiện kết nối và lắp vào một thiết bị kéo căng; b) dây xích thường được sử dụng chằng buộc các loại hàng hóa có góc cạnh sắc và hàng nặng như máy móc, thiết bị, sắt thép, bê tông, thiết bị quân sự,... tất cả các mắt xích phải luôn luôn được kiểm tra trước khi sử dụng. dây xích chỉ được sử dụng gắn với thiết bị kéo căng và những đai ốc siết phù hợp với khả năng chịu tải của dây xích; c) dây thừng, dây cáp thường sử dụng khi vận chuyển bê tông cốt thép hay các loại hàng hóa như gỗ ép hay gỗ tròn xếp chồng theo chiều dọc. cáp bện bằng dây thép thích hợp cho việc chằng buộc hàng hóa được sử dụng tương tự như dây xích. dây cáp chằng buộc chỉ được sử dụng trong khoảng nhiệt độ từ -40°c đến +100°c. ở nhiệt độ dưới 0°c, cần phát hiện và loại bỏ băng đóng trên phanh và dây kéo của các bộ phận kéo căng (tời, cần trục). 3.3. phương pháp chằng buộc thành vòng quanh khối hàng và cố định vào sàn chất tải là một hình thức sử dụng dây chằng cuốn quanh khối hàng và cố định nó sang 2 bên của sàn xe nhằm mục đích hạn chế sự dịch chuyển ngang của khối hàng này. để chống lật hàng, xoắn theo chiều dọc trong quá trình vận chuyển, cần sử dụng 2 cặp dây chằng như minh họa tại hình 1.4. khả năng cố định hàng hóa của phương pháp này phụ thuộc vào khả năng chịu lực của các điểm neo giữ cùng những thứ khác. hình 1.4. minh họa mô tả bố trí 2 cặp dây chằng buộc vòng quanh hàng hóa lưu ý: để đảm bảo hàng hóa không xê dịch theo hướng về phía trước, cần phải sử dụng các biện pháp cố định hàng hóa cơ bản khác kết hợp với phương pháp chằng buộc thành vòng với hàng hóa. các vòng dây chằng chỉ cung cấp các lực giữ ngang, tức là sang hai bên thành phương tiện như minh họa tại hình 1.5. hình 1.5. minh họa mô tả chằng buộc vòng kết hợp với để chêm 4. máng máng thường được sử dụng đối với các cuộn nặng từ 4 tấn trở lên để đảm bảo an toàn và bắt buộc sử dụng đối với cuộn nặng từ 10 tấn trở lên. đối với các cuộn từ 4 đến 10 tấn có thể sử dụng thêm chêm. hình 1.6 minh họa xếp cuộn trên máng. một số yêu cầu đối với máng: a) độ dốc ở góc 35 độ theo phương ngang; b) các cuộn dây, nếu được đặt trên máng, nên có khoảng cách tối thiểu 20 mm với đáy máng; c) tỷ lệ bề rộng/chiều cao của cuộn dây không thấp hơn 0,7; d) nếu thấp hơn 0,7, cuộn dây cần được sắp xếp dựa vào một thiết bị hỗ trợ; đ) quy tắc then chốt: “bề rộng của máng bằng ít nhất 60% bán kính cuộn dây”; e) vùng tiếp xúc của cuộn dây cần thấp hơn đỉnh của máng. lưu ý: nếu máng làm bằng thép thì bắt buộc phải sử dụng thảm cao su hoặc vật chèn lót. hình 1.6. minh họa mô tả xếp cuộn dây với máng 5. khung chữ h khung chữ h là một công cụ tốt để cố định cuộn dây. nó được sử dụng cho cả cuộn dây đặt ngang trên máng hoặc cuộn dây được đặt dọc trên mâm hàng. phụ lục xi (ban hành kèm theo thông tư số 39/2024/tt-bgtvt ngày 15 tháng 11 năm 2024 của bộ trưởng bộ giao thông vận tải) hướng dẫn xếp hàng hóa là phương tiện vận tải, máy móc, thiết bị kỹ thuật 1. xếp hàng hóa là máy móc, thiết bị kỹ thuật trong khi vận chuyển các nội dung tại mục này hướng dẫn về xếp và cố định hàng hóa là máy móc, thiết bị kỹ thuật có bánh xích và có bánh xe trên phương tiện vận tải đường bộ và không áp dụng đối với việc vận chuyển máy móc khổ lớn (quá khổ) trên phương tiện chuyên dùng và phải có giấy phép lưu hành trên đường bộ, cụ thể như sau: a) khi vận chuyển một thiết bị có bánh xe hoặc bánh xích thì chúng phải được chằng buộc đúng vị trí trên phương tiện vận chuyển cùng với việc sử dụng hệ thống phanh hãm; b) khi vận chuyển, những loại máy móc, thiết bị kỹ thuật có thể di chuyển được như cần cẩu, khung giàn, cần trục và cabin, v.v… phải được để đúng vị trí theo hướng dẫn của nhà sản xuất và phải được buộc chặt để tránh việc di chuyển gây ảnh hưởng đến phần thân chính của máy móc; c) trước khi máy móc được xếp lên thùng xe tải, cần phải làm sạch tất cả các bùn đất lỏng trên đó nhằm tránh việc bùn đất có thể đông đặc lại cản trở giao thông trên đường hoặc làm hư hại các phương tiện khác; cần loại bỏ dầu, mỡ trên cầu nâng, lốp xe của máy móc và sàn của thùng xe kéo để tránh bị trượt. đối với các loại hàng hóa là máy móc, phương tiện vận tải thì trước khi xếp lên xe ô tô phải rút hết nhiên liệu ra khỏi bình chứa; d) khi máy móc đã được xếp gọn và động cơ đã ngừng hoạt động, cần giảm bớt áp lực trong hệ thống thủy lực bằng cách đưa tất cả các cần điều khiển về đúng vị trí. cần điều khiển cần được gài lại để tránh việc các bộ phận bị dịch chuyển của trong quá trình vận chuyển. bao bì, dụng cụ hoặc những bộ phận nặng khác như thùng, xô, gầu xúc, dao, xẻng và các thiết bị nâng không được xếp tùy tiện trong cabin của tài xế mà tất cả phải được tháo dỡ khỏi máy móc và phải được chằng buộc vào sàn của phương tiện vận chuyển; đ) các thiết bị kỹ thuật cần phải được cố định để tránh việc di chuyển về trước, sau và 2 bên bằng dây đai hoặc dây xích được buộc chặt vào những điểm neo giữ trên xe. tất cả các dây chằng buộc phải được xiết chặt; e) khi vận chuyển hàng hóa quá cao, lái xe cần biết chính xác chiều cao của hàng hóa và chiều rộng của hàng hóa ở độ cao đó để tránh việc gây hư hỏng cầu đường bộ. những hàng hóa có trọng tâm cao có thể ảnh hưởng nghiêm trọng đến sự ổn định của phương tiện và của chính hàng hóa đó thì chỉ được vận chuyển bằng những phương tiện vận tải có sàn thấp; g) các thiết bị chằng buộc cho các máy móc, thiết bị kỹ thuật gồm có xích, dây đai thép, lưới và những thiết bị nối và kéo căng; h) máy móc, thiết bị được vận chuyển cần phải được kiểm tra sau khi phương tiện đã đi được một quãng đường ngắn để đảm bảo rằng không có một di chuyển nào xảy ra và các thiết bị cố định được xiết chặt. việc kiểm tra phải được thực hiện thường xuyên trong suốt hành trình. hình 2.1, hình 2.2, hình 2.3, hình 2.4 và hình 2.5 minh họa về phương pháp xếp máy móc, thiết bị kỹ thuật hình 2.1. mô tả xe bánh hơi được chằng chéo lên sàn xe mặt bằng từ các điểm được đánh dấu (x) hình 2.2. mô tả phương pháp cố định máy kéo nông nghiệp trên sơ mi rơ moóc hình 2.3. mô tả phương pháp cố định xe nâng hàng trên sơ mi rơ moóc hình 2.4. mô tả phương pháp cố định xe lu đường trên sơ mi rơ moóc hình 2.5. mô tả phương pháp cố định máy xúc bánh lốp, bánh xích trên sơ mi rơ moóc 2. xếp hàng hóa là xe ô tô trong khi vận chuyển xe ô tô và các thùng xe kéo phải được vận chuyển bằng các phương tiện thích hợp, bao gồm cả việc bố trí dây chằng buộc thích hợp về số lượng, vị trí và chiều dài tương ứng. việc sắp xếp cố định loại hàng hóa này dựa trên các nguyên tắc cơ bản giống với máy móc kỹ thuật và đảm bảo một số nguyên tắc sau đây: a) xe ô tô hoặc thùng xe kéo phải bố trí thêm phanh hãm; b) khóa bánh lái phải được bố trí linh hoạt và phải được trang bị thêm guốc hãm; c) hộp số được giữ ở số thấp nhất có thể; d) các thiết bị hãm phải được gắn cố định vào phương tiện được chuyên chở; đ) chú ý rút toàn bộ nhiên liệu trong xe trước khi đưa lên xe tải vận chuyển. một số hình ảnh minh họa về phương pháp xếp xe ô tô để vận chuyển các loại phương tiện này tốt nhất là kết hợp cả hai phương pháp chằng buộc và phương pháp chèn chặn cố định hàng hóa. - trường hợp 1 nếu phương tiện được chuyên chở nằm trên sàn chất tải ngang hoặc dốc về phía trước tối đa 100 (tức là 1/6) thì phải sử dụng phương pháp chèn chặn. hai khối chặn được bố trí ở vị trí phía trước của bánh trước và hai khối chặn được bố trí ở phía sau của bất kỳ cặp bánh xe nào. việc chằng buộc được áp dụng cho cặp bánh xe xa nhất (xem hình a và b). - trường hợp 2 nếu khi vận chuyển các phương tiện như được mô tả ở trường hợp 1 và các khối chặn không được đặt ở vị trí trước của bánh trước thì phương án thay thế là bố trí các khối chặn này ở phía trước của cả 2 bánh sau và đồng thời phải sử dụng cả dây chằng cố định. - trường hợp 3 nếu phương tiện được đặt nằm trên sàn chất tải có góc nghiêng quá 100 hướng về phía đầu của phương tiện chuyên chở, hai khối chặn được đặt ở phía trước của cặp bánh xa nhất và hai khối chặn được đặt ở phía sau của cặp bánh sau. sử dụng dây chằng buộc cho cả bánh trước và sau. - trường hợp 4 nếu phương tiện được vận chuyển như được miêu tả ở trường hợp 2 và các khối chặn không thể đặt ở phía trước của cặp bánh xa nhất, có thể thay thế bằng việc chặn ở phía trước của cặp bánh sau. - trường hợp 5 nếu như phương tiện được vận chuyển được đặt nằm trên sàn chất tải nghiêng một góc 100 về phía sau thì phải sử dụng phương pháp chèn chặn để đảm bảo không xê dịch. các khối chặn được đặt cả ở phía trước và phía sau của cặp bánh xe xa nhất. các bánh xe được chặn này phải được chằng buộc thêm. - trường hợp 6 cố định phương tiện đặt theo hướng xe tải di chuyển: + 1 khối chêm bánh ở phía trước và một khối khác đặt sau bánh sau. + chằng buộc thêm bánh sau bằng dây chằng buộc qua 3 điểm cố định. + đặt chêm trước bánh xe phía trước, ở vị trí chéo với bánh sau đã được cố định. + nếu các chêm chèn chặn bánh xe không thể sử dụng vì lý do kỹ thuật, thêm một bánh xe nữa cần phải được cố định bằng đai chằng buộc. a. cố định 2 bánh xe chéo nhau b. cố định 3 bánh xe - trường hợp 7 cố định phương tiện đặt ngược với chiều xe tải di chuyển: + 1 khối chêm bánh ở phía trước và một khối khác đặt sau ở bánh sau. + đặt một chêm trước và một khối khác ở sau bánh xe phía trước ở vị trí chéo với bánh sau đã được cố định. + chằng buộc thêm cả 2 bánh bằng dây chằng buộc qua 3 điểm cố định. + nếu các chêm chèn chặn bánh xe không thể sử dụng vì lý do kỹ thuật, thêm một bánh xe nữa phải được cố định bằng đai chằng buộc. a. cố định 2 bánh xe chéo nhau b. cố định 3 bánh xe phụ lục xii (ban hành kèm theo thông tư số 39/2024/tt-bgtvt ngày 15 tháng 11 năm 2024 của bộ trưởng bộ giao thông vận tải) hướng dẫn việc xếp và che phủ hàng rời 1. xếp và che phủ hàng rời hàng rời là các loại vật liệu như cát khô, tro, mạt kim loại,… rất dễ bị gió thổi đi, do đó chúng phải luôn luôn được che phủ bằng những tấm bạt che phù hợp. hàng rời là những loại hàng hóa ở dạng hạt lớn như sắt vụn, đá, sỏi, phế liệu xây dựng,... phải được che phủ bằng lưới, kích thước mắt lưới phải nhỏ hơn kích thước những hạt nhỏ nhất để hạn chế hàng hóa bị lọt, rơi vãi khi vận chuyển. hình 3.1. minh họa về xếp hàng rời 2. khi vận chuyển cần chú ý kiểm tra trục xe có thể bị quá tải khi xe lên và xuống dốc cao bởi vì các hạt rời có thể di chuyển trong thùng xe. cụ thể hàng sẽ di chuyển dễ dàng từ đầu này đến đầu kia của thùng xe vì vậy cần kiểm tra thường xuyên trong điều kiện này và có thể xếp lại tải (san đều tải trên bề mặt thùng xe hoặc công-ten-nơ) khi xe dừng đỗ ở nơi an toàn. hình 3.2. minh họa mô tả tải dịch chuyển khi xe lên dốc phụ lục xiii (ban hành kèm theo thông tư số 39/2024/tt-bgtvt ngày 15 tháng 11 năm 2024 của bộ trưởng bộ giao thông vận tải) hướng dẫn xếp hàng dạng trụ 1. hướng dẫn chung 1.1. hàng dạng trụ được xếp theo phương thẳng đứng, phương ngang hoặc phương dọc theo chiều dài xe tùy thuộc vào chiều dài của hàng so với thùng xe. 1.2. các loại hàng hóa dạng cuộn hay dạng thùng xếp nằm ngang thì nên xếp đường tâm của chúng theo chiều ngang thân xe (vuông góc với thành xe), đồng thời nên sử dụng chèn chặn bằng các khối chêm hoặc để chêm đặt phía trước hoặc sau khối hàng. trường hợp hàng dạng trụ có bề mặt trơn nhẵn, khi xếp chồng lên nhau phải sử dụng vật liệu đệm lót giữa các lớp hàng để chống trơn trượt. 1.3. các loại hàng dạng trụ cần được chằng buộc vào thành xe hoặc sử dụng giá kê, giá đỡ, chèn lót để cố định, tránh dịch chuyển trong quá trình vận chuyển. với hàng hóa có khối lượng nặng, cần thiết sử dụng các dầm để phân bổ tải trọng đều trên mâm hàng, sàn xe hoặc sàn công-ten-nơ. hình 4.1. minh họa mô tả một số ví dụ về cách xếp và cố định hàng trụ ống 2. hướng dẫn xếp và cố định một số loại hàng dạng trụ cụ thể 2.1. cuộn giấy hình 4.2 minh họa khi vận chuyển các cuộn giấy có 2 lớp và 2 hàng, lớp trên không xếp hết, được xếp trên sàn chất tải bằng phẳng và được cố định vào thành bên của thùng xe. hình 4.2. minh họa mô tả cách xếp các cuộn giấy không đồng đều về chiều cao lớp trên cùng sẽ được ổn định ngang nhờ ma sát và các tấm chặn trước hoặc sau. ngoài ra, phương án sử dụng khung giới hạn cũng có thể được áp dụng: • hàng hóa không xếp hết toàn bộ bề ngang sàn chất tải. • góc giữa dây chằng buộc qua nóc và sàn chất tải lớn hơn 600. • việc chèn chặn ở phía sau khi cần thiết sử dụng thanh chèn lót (2). • để việc phân bổ lực chằng buộc hiệu quả, các nẹp cạnh (5) được sử dụng giữa các khối hàng hóa. 2.2. cuộn tấm kim loại a) cuộn lõi ngang các cuộn tấm kim loại, khi đặt lõi ngang thì tốt nhất phải được chở trên xe có một khung đặt cuộn dây (máng hoặc để chêm) trên sàn chất tải. nếu không có thêm các biện pháp cố định khác, khả năng các cuộn dây sẽ bị dịch chuyển trên để chêm, do đó một số lượng dây chằng buộc đầy đủ phải được sử dụng để hỗ trợ cố định tải trọng. ngoài ra, khi không có xe chuyên dụng, cuộn có thể được đóng gói trên mâm hàng với để chêm như hình dưới đây. hình 4.3. minh họa việc xếp các cuộn tấm nặng trên sàn xe mặt bằng không có thành bên. đối với mặt hàng tập trung lớn như thế này, cần đặc biệt xem xét tới sự phân bố tải trọng. hình 4.3. minh họa mô tả cách xếp cuộn kim loại lõi ngang - tấm kim loại dạng cuộn trên để chêm (2) được chằng buộc các hướng bằng dây chằng buộc vòng quanh (1). - nẹp cạnh (3) được đặt ở tất cả các cạnh. cuộn phải được gắn chặt vào giá đỡ bằng ít nhất hai dây chằng hoặc bằng một đai thép tiêu chuẩn. các dây chằng phải tiếp xúc với bề mặt của cuộn dây và các để chêm. nếu để chêm không được sử dụng, thì các cuộn dây hoặc các giá đỡ phải được chằng buộc bằng dây xích hoặc đai vải kết hợp các thiết bị kéo căng. b) cuộn lõi dọc - các cuộn lõi dọc thường được xếp lên phương tiện có sàn xe phẳng và là một trong những hàng hóa khó khăn nhất để cố định như hình 4.4. hình 4.4. minh họa mô tả cách xếp cuộn lõi dọc hình 4.5 mô tả cách chằng buộc phù hợp sử dụng một tấm hình chữ thập cùng với dây xích hoặc dây co giãn để giữ an toàn cho cuộn dây đặt lõi dọc có đường kính lớn. nên đặt cuộn trên đường tâm của các phương tiện và tấm hình chữ thập đặt trên nóc của cuộn với các chốt định vị nằm bên trong lõi. tấm hình chữ thập cần được đặt sao cho hướng rãnh trên nó ngang qua trục của phương tiện để phù hợp với dây chằng buộc bằng xích thông thường. các dây chằng buộc được gắn vào điểm neo giữ trên xe và kéo căng theo cách thông thường. - có thể cố định cuộn kim loại như trên mà không sử dụng tới kẹp giữ, nhưng dây co giãn hoặc dây xích phải được bố trí rất cẩn trọng và đầy đủ để đảm bảo hoàn toàn tránh được bất kỳ sự xê dịch nào của cuộn. - đối với cuộn có trọng lượng tập trung cao thì việc xem xét sự phân bố tải trọng là đặc biệt quan trọng. hình 4.5. minh họa mô tả chằng buộc hàng dạng cuộn 2.3. thùng tròn hình 4.6. minh họa việc vận chuyển các thùng hàng dạng ống kích thước đầy đủ, xếp thành 2 lớp vào 4 hàng dài. lớp trên không được xếp hết và toàn bộ khối hàng được xếp trong công te nơ hoặc trong thùng xe. hình 4.6. minh họa mô tả về vận chuyển các thùng hàng dạng ống kích thước đầy đủ - hàng hóa xếp hết toàn bộ bề ngang công te nơ hoặc thùng xe. - các vật liệu chặn hay thanh chèn lót (1) được bố trí chèn chặn ở phía sau. - các dây chằng buộc ngang thân của hàng hóa (2) được sử dụng để chống lật cho hàng hóa. - thanh gỗ kê ngang làm chân để (3) tạo ra những lớp chèn chặn trước sau cho lớp hàng hóa trên. 2.4. trục hoặc dầm tròn hoặc thép trục hoặc dầm tròn hoặc thép bình thường được xếp trên để chêm và được giữ chặt bằng các dây chằng buộc vòng quanh. hình 4.7 cho thấy trụ dầm được cố định trên một sàn chất tải phẳng không có các trụ chống ở mặt bên. nếu hàng hóa không được xếp cố định áp sát vào thành trước thùng xe, chèn chặn sau bằng khối chèn hoặc thanh chống là cần thiết. các dây chằng buộc được bố trí cuốn xung quanh hàng hóa (1). các khối hình trụ sẽ được đặt trên để chêm (2). hình 4.7. minh họa mô tả về vận chuyển dầm tròn cho công trình xây dựng 2.5. cuộn dây a) các cuộn dây tốt nhất được bó lại với nhau để tạo thành một cuộn đồng đều và bền chắc và được xếp trên sàn chất tải của phương tiện chở như thể hiện trong hình bên dưới. các bó được sắp xếp để tạo ra một khoảng trống 10 cm giữa hàng hóa và thành bên của sàn chất tải; b) hình 4.8 mô tả về vận chuyển các cuộn dây, theo đó dây chằng buộc vòng quanh (2) được thắt chặt giữa các lớp, do đó tạo ra một hình thế cố định chắc chắn lớp trên nhờ lớp dưới; c) dây chằng buộc vòng quanh (1) cùng với dây đai được thắt chặt qua các cuộn của lớp đáy nhằm cố định cả 2 bên của tất cả các cuộn ở lớp dưới. - các lớp trên là lớp được cố định bằng dây buộc vòng qua (2). - dây chằng xung quanh bằng dây thép chằng buộc hàng hóa theo hướng ngang (1). - đai thép được đề nghị không sử dụng cho các mục đích khác. hình 4.8. minh họa mô tả về vận chuyển các cuộn dây 2.6. thanh gỗ tròn a) việc xếp hàng là thanh gỗ tròn lên xe phải đảm bảo nguyên tắc về phân bố tải trọng; sử dụng dây xích hoặc đai chằng buộc và tất cả dây chằng buộc được thắt chặt bởi chốt néo hoặc khóa tải. khi phương tiện di chuyển trên đường phải được thường xuyên kiểm tra trong suốt hành trình và tất cả dây chằng buộc cần thắt chặt lại nếu cần thiết; b) phương pháp xếp chồng lên nhau theo chiều dọc: các thanh gỗ ở giữa phía đầu phải cao hơn so với các thanh gỗ bên để hình thành khối hàng hình chóp và cho phép nó được chằng buộc căng, như minh họa tại hình 4.9, cụ thể như sau: thực hiện chằng buộc qua nóc cần được thắt chặt qua mỗi khối hàng hóa (cọc gỗ) theo các số lần sau đây: - ít nhất hai lần nếu khối hàng hóa là những thanh gỗ vẫn còn nguyên vỏ cây có chiều dài tối đa là 3,3 m; - ít nhất ba lần nếu khối hàng dài hơn 3,3 m hoặc không phụ thuộc vào độ dài nếu vỏ đã được lột. dây chằng buộc qua nóc được đặt nằm ngang giữa mỗi cặp trụ chống sàn xe trước và sau mỗi khối hàng. hình 4.9. minh họa mô tả xếp các thanh gỗ tròn được xếp đúng và xếp sai trên thùng xe c) phương pháp xếp chồng lên nhau theo chiều ngang như minh họa tại hình 4.10, cụ thể như sau: - các thanh gỗ xếp chồng lên nhau theo chiều ngang của sàn xe mặt bằng không thể được cố định hoàn toàn bằng cách chằng buộc thông thường; - nếu các thanh gỗ được chở ngang thì thùng xe có cửa mở ngang và khối hàng không chất cao hơn nóc thùng xe. hình 4.10. minh họa mô tả xếp thanh gỗ được xếp chồng ngang trên xe tải thùng có cửa ngang 2.7. hàng dạng ống có kích thước dài a) việc vận chuyển hàng dạng ống có kích thước dài phải sử dụng xe thùng hở hoặc các xe mà hàng được chằng buộc trên một thùng xe kéo ở một đầu. các phương tiện phải được trang bị giá kê hoặc dầm gối, để chêm, chèn, tấm lót và trụ chống (cột chống) sàn xe đủ khả năng chịu tải; b) chằng buộc bằng đai hoặc xích đủ khả năng chịu tải để đảm bảo an toàn khối hàng; sử dụng tối thiểu sáu dây đai hoặc xích để chằng buộc ở phần đuôi, giữa và phần dầu lô hàng; tất cả dây chằng buộc được thắt chặt bởi chốt néo hoặc khóa tải như minh họa tại hình 4.11; c) khi phương tiện di chuyển trên đường phải được thường xuyên kiểm tra trong suốt hành trình và tất cả dây chằng buộc cần thắt chặt lại nếu cần thiết. hình 4.11. minh họa mô tả cách xếp, chằng buộc, chêm, chèn hàng dạng ống có kích thước dài phụ lục xiv (ban hành kèm theo thông tư số 39/2024/tt-bgtvt ngày 15 tháng 11 năm 2024 của bộ trưởng bộ giao thông vận tải) hướng dẫn xếp hàng vào công te nơ 1. xếp hàng hóa trong công te nơ một số nguyên tắc khi xếp hàng hóa trong công te nơ: a) xếp hàng hóa không được vượt quá tải trọng quy định của công te nơ; b) xếp hàng phải phân bổ đều khắp diện tích sàn (tấm đáy) của công te nơ; không được đặt nhiều hơn 60% khối lượng hàng hóa trên một nửa (1/2) chiều dài của công te nơ. nếu trường hợp này xảy ra, nó có thể dẫn đến quá tải cho trục; c) những hàng nặng hơn không được xếp lên trên hàng nhẹ hơn; d) hàng hóa phải được chằng buộc trong công te nơ để chống được mọi lực tác động dự kiến xuất hiện trong quá trình vận chuyển. những khe hở giữa các lớp hàng và giữa lô hàng và thành công te nơ được chèn bằng vật liệu đệm lót sạch sẽ, khô ráo như tấm nhám tăng ma sát, mâm hàng, rơm rạ, cỏ khô, vỏ bào, phên tre đan, túi khí…; đ) khi hàng chuyên chở là máy móc có hình dáng phức tạp, khó xác định trọng tâm thì phải làm giá đỡ thích hợp có chèn đệm, chằng buộc để cố định vị trí của chúng; e) không chằng buộc quá căng làm tăng áp lực lớn lên các điểm tựa tương đối yếu của công te nơ như: cửa, vách mặt trước. các cột chống hoặc giá đỡ được bố trí theo chiều dọc của công te nơ; g) sau khi việc đóng gói hàng vào công te nơ được hoàn thành, các bậc chặn cần được chèn vào nếu cần thiết để chắc chắn rằng hàng hóa và những miếng lót, chèn không bị rơi ra khi các cánh cửa mở ra. lưới chằng buộc thường sử dụng cho mục đích này; cách khác là có thể dựng cửa gỗ hoặc kim loại. cần luôn luôn kiểm tra để đảm bảo các cửa đã được khóa và các cơ chế khóa theo đúng trình tự hoạt động. 2. một số hình ảnh minh họa về xếp hàng hóa trong công te nơ hình 5.1. minh họa về những thùng hàng rời được xếp 2 chồng trong công te nơ, 2 lớp và 4 hàng hình 5.2. minh họa về các thùng hàng tải trọng trung bình được chồng đôi trong công te nơ', 'cán bộ cảnh sát giao thông làm nhiệm vụ tuần tra, kiểm soát phát hiện vụ tai nạn giao thông đường bộ hoặc được lãnh đạo có thẩm quyền phân công đến hiện trường phải thực hiện những nhiệm vụ sau: 1. tổ chức cứu nạn, cứu hộ a) quan sát hiện trường, phát hiện những mối nguy hiểm như: cháy, nổ, chất độc hại, nguy cơ gãy, đổ phương tiện, đe dọa đến tính mạng, sức khỏe của người bị thương, người còn bị mắc kẹt trong các phương tiện hoặc có thể đe dọa đến lực lượng khám nghiệm, thực hiện các biện pháp khẩn cấp để phòng ngừa, ngăn chặn và báo cáo lãnh đạo đơn vị chỉ đạo phối hợp với các lực lượng khác trong công an nhân dân theo quy định tại điều 14 thông tư số 62/2020/tt-bca ngày 19 tháng 6 năm 2020 của bộ trưởng bộ công an quy định về phân công trách nhiệm và quan hệ phối hợp trong công tác điều tra, giải quyết tai nạn giao thông của lực lượng công an nhân dân để tổ chức cứu nạn, cứu hộ, hạn chế thiệt hại; b) xác định số người chết, bị thương; thông báo kịp thời cho cơ sở khám bệnh, chữa bệnh nơi gần nhất, nếu có người bị thương cần cấp cứu. trường hợp người bị thương còn nguyên vị trí tại hiện trường sau khi xảy ra vụ tai nạn giao thông đường bộ phải đánh dấu vị trí người bị nạn, xét thấy cần thiết thì tổ chức sơ cứu trước khi đưa nạn nhân đi cấp cứu; trường hợp sử dụng phương tiện liên quan đến vụ tai nạn giao thông đường bộ để đưa người bị nạn đi cấp cứu phải đánh dấu vị trí của phương tiện, vị trí dấu vết trên phương tiện, ghi nhận những thông tin liên quan đến phương tiện và người điều khiển phương tiện (nếu có); c) trường hợp đến hiện trường mà người có liên quan trong vụ tai nạn giao thông đường bộ bị thương đã được đưa đi cấp cứu hoặc rời khỏi hiện trường, phải cử cán bộ xác minh nhân thân của nạn nhân; thông qua bác sĩ, nhân viên cơ sở khám bệnh, chữa bệnh cấp cứu nạn nhân để xác minh nhanh tình trạng tổn thương cơ thể của nạn nhân; d) trường hợp người bị nạn từ chối đi cấp cứu thì cán bộ cảnh sát giao thông phải lập biên bản theo mẫu biên bản số 02 ban hành kèm theo nghị định số 118/2021/nđ-cp ngày 23 tháng 12 năm 2021 của chính phủ quy định chi tiết một số điều và biện pháp thi hành luật xử lý vi phạm hành chính (sau đây viết tắt là nghị định số 118/2021/nđ-cp), ghi nhận sự việc này, có sự xác nhận của nhân viên y tế (nếu có), người chứng kiến; đ) trường hợp người bị nạn đã chết phải giữ nguyên vị trí và che đậy thi thể, không di chuyển các phương tiện liên quan đến vụ tai nạn giao thông đường bộ tại hiện trường (nếu vị trí thi thể có thể gây ùn tắc giao thông mà không có phương án phân luồng, giải phóng giao thông thì phải đánh dấu vị trí, chụp ảnh, ghi hình thi thể và vị trí của thi thể rồi nhanh chóng đưa vào vị trí thích hợp để bảo vệ); e) trường hợp các phương tiện liên quan đến vụ tai nạn giao thông đường bộ bị hư hỏng, không còn hoạt động được thì phải thông báo cho các đơn vị có chức năng cứu hộ bố trí phương tiện cẩu, kéo chuyên dụng phù hợp đến hiện trường để cứu hộ phương tiện vào nơi thích hợp theo yêu cầu của cán bộ làm nhiệm vụ điều tra, xác minh, giải quyết tai nạn giao thông đường bộ. mọi chi phí cứu hộ do chủ phương tiện chịu trách nhiệm chi trả. 2. bảo vệ hiện trường vụ tai nạn giao thông đường bộ a) sử dụng dây căng phản quang, cọc tiêu hình chóp nón, biển báo cấm đường, biển chỉ dẫn hướng đi hoặc biển cảnh báo nguy hiểm và biển phụ, đèn chiếu sáng, đèn cảnh báo nguy hiểm được trang bị cho cảnh sát giao thông làm nhiệm vụ tuần tra, kiểm soát, xử lý vi phạm để khoanh vùng bảo vệ hiện trường, bảo vệ an toàn cho cán bộ khám nghiệm hiện trường, có biện pháp bảo vệ tài sản của người bị nạn, hàng hoá trên phương tiện trong vụ tai nạn giao thông đường bộ; b) bố trí cán bộ điều tiết giao thông tại khu vực hiện trường được khoanh vùng bảo vệ tối thiểu khoảng cách 70 mét (đối với đường bộ cao tốc tối thiểu là 100 mét) đồng thời đặt biển cảnh báo nguy hiểm, biển hạn chế tốc độ, biển chỉ dẫn cách 01 mét đến 02 mét phía trước cán bộ điều tiết giao thông để cảnh báo người điều khiển phương tiện đi qua khu vực hiện trường giảm tốc độ, chú ý quan sát không gây nguy hiểm cho lực lượng khám nghiệm hiện trường; c) nếu có phương tiện giao thông cơ giới đường bộ chuyên dụng của cảnh sát giao thông được trang bị hệ thống còi, đèn ưu tiên, đèn chiếu sáng thì cho phương tiện dừng sát lề đường bên phải phía trước khu vực hiện trường theo chiều đường có nhiều phương tiện lưu thông đến khu vực hiện trường, phía sau phương tiện phải được đặt các cọc tiêu hình chóp nón, biển cảnh báo nguy hiểm, biển hạn chế tốc độ, biển chỉ dẫn theo quy định, đồng thời bật hệ thống còi, đèn ưu tiên, đèn chiếu sáng để cảnh báo cho các phương tiện khác biết. 3. tổ chức, hướng dẫn giao thông không để xảy ra ùn tắc a) trường hợp phương tiện liên quan đến vụ tai nạn giao thông đường bộ có thể gây ùn tắc giao thông thì phải đánh dấu vị trí của phương tiện, vị trí các dấu vết trên phương tiện, chụp ảnh, ghi hình phương tiện và vị trí phương tiện rồi nhanh chóng đưa phương tiện vào vị trí thích hợp để bảo vệ, trừ trường hợp quy định tại điểm đ khoản 1 điều này; b) trường hợp vụ tai nạn giao thông đường bộ đã gây ùn tắc giao thông phải báo cáo lãnh đạo đơn vị để có phương án tăng cường lực lượng, phương tiện, phân luồng giao thông, giải quyết ùn tắc từ xa. 4. trường hợp người, phương tiện liên quan đến vụ tai nạn giao thông đường bộ bỏ chạy, ngoài việc phải thực hiện theo quy định tại các khoản 1, 2 và 3 điều này, đồng thời xác minh thông tin chi tiết về đặc điểm người gây tai nạn bỏ chạy; loại phương tiện, màu sơn, biển số của phương tiện (tra cứu trên hệ thống phần mềm đăng ký, quản lý phương tiện), đặc biệt là những thiệt hại về phương tiện và hướng phương tiện bỏ chạy. đối chiếu, xác định những dấu vết hình thành trong quá trình va chạm. căn cứ đặc điểm phương tiện bỏ chạy, các dấu vết để lại trên phương tiện để tổ chức truy tìm người, phương tiện gây tai nạn, thông báo cho các đơn vị cảnh sát giao thông trên tuyến phối hợp truy bắt, đồng thời thông báo trên các phương tiện thông tin đại chúng để truy tìm. 5. huy động người, phương tiện, thiết bị dân sự trong trường hợp cấp bách trong trường hợp cấp bách để đưa người bị nạn đi cấp cứu, truy bắt người phạm tội, người gây tai nạn giao thông đường bộ bỏ chạy, cứu nạn, cứu hộ, chữa cháy hoặc nhiệm vụ khẩn cấp khác thì thực hiện quyền huy động người, phương tiện, thiết bị dân sự theo quy định tại điều 68 luật trật tự, an toàn giao thông đường bộ năm 2024. 6. thu thập thông tin ban đầu a) quan sát để phát hiện, thu thập các dấu vết dễ bị thay đổi hoặc mất; những thay đổi ảnh hưởng đến hiện trường trong quá trình tổ chức cấp cứu người bị nạn; b) tìm người điều khiển phương tiện và những người có liên quan đến vụ tai nạn giao thông đường bộ; kiểm tra, tạm giữ giấy tờ của người và phương tiện liên quan đến vụ tai nạn giao thông đường bộ theo quy định; trường hợp thông tin các giấy tờ của người và phương tiện đã được tích hợp cập nhập trong căn cước điện tử, tài khoản định danh điện tử trên ứng dụng định danh quốc gia, trong cơ sở dữ liệu do bộ công an quản lý thì thực hiện việc kiểm tra thông qua thông tin trong căn cước điện tử, tài khoản định danh điện tử trên ứng dụng định danh quốc gia, cơ sở dữ liệu do bộ công an quản lý; c) tìm những người chứng kiến, người biết việc để thu thập thông tin về vụ tai nạn giao thông đường bộ (nếu có thì ghi rõ họ tên, nơi cư trú, số điện thoại, số định danh cá nhân hoặc hộ chiếu hoặc giấy tờ có giá trị đi lại quốc tế); d) sử dụng phương tiện, thiết bị kỹ thuật nghiệp vụ được trang cấp cho lực lượng cảnh sát giao thông để kiểm tra ngay nồng độ cồn, chất ma túy hoặc các chất kích thích khác mà pháp luật cấm sử dụng đối với người điều khiển phương tiện liên quan đến vụ tai nạn giao thông đường bộ tại hiện trường hoặc yêu cầu cơ sở khám bệnh, chữa bệnh kiểm tra nồng độ cồn, chất ma túy hoặc các chất kích thích khác mà pháp luật cấm sử dụng trong máu của người điều khiển phương tiện liên quan đến vụ tai nạn đang được cấp cứu hoặc không kiểm tra được bằng phương tiện, thiết bị kỹ thuật nghiệp vụ; đ) xem xét, thu thập dữ liệu điện tử qua hệ thống giám sát giao thông của cảnh sát giao thông; đề nghị cơ quan, tổ chức, cá nhân phối hợp cung cấp dữ liệu điện tử của camera giám sát hành trình, thiết bị giám sát hành trình gắn trên phương tiện đi qua khu vực hiện trường hoặc hình ảnh qua camera của cơ quan, tổ chức, cá nhân xung quanh khu vực hiện trường trong khoảng thời gian xảy ra tai nạn giao thông đường bộ (nếu có). 7. phối hợp với các đơn vị có liên quan xác định sơ bộ hậu quả thiệt hại ban đầu về người và tài sản ngay tại hiện trường vụ tai nạn giao thông đường bộ a) cảnh sát giao thông chủ trì, phối hợp các đơn vị có liên quan thực hiện xác định sơ bộ thiệt hại ban đầu căn cứ vào thực tế tại hiện trường gồm: phương tiện, tài sản bị hư hỏng; thiệt hại về người; lời khai của người điều khiển phương tiện giao thông đường bộ, nạn nhân, người có liên quan và các thông tin, tài liệu thu thập được để xác định giá trị sơ bộ thiệt hại ban đầu về người và tài sản; b) thành phần tham gia với cảnh sát giao thông xác định sơ bộ thiệt hại ban đầu gồm: đại diện cơ quan cảnh sát điều tra công an cấp huyện hoặc điều tra viên bố trí tại công an cấp xã nơi xảy ra vụ tai nạn giao thông đường bộ (nếu có); đại diện viện kiểm sát nhân dân cấp huyện (nếu có); người điều khiển phương tiện giao thông đường bộ, nạn nhân hoặc người đại diện hợp pháp (nếu có); đại diện chính quyền cấp xã (nếu có); đại diện tổ chức, cá nhân có chức năng, điều kiện đánh giá, xác định thiệt hại về tài sản (nếu có); bác sĩ, nhân viên cơ sở khám bệnh, chữa bệnh (nếu có); người chứng kiến, người có quyền lợi, nghĩa vụ liên quan, người có kiến thức chuyên môn (nếu có); c) việc xác định sơ bộ thiệt hại ban đầu phải được lập biên bản theo mẫu số 03/tnđb ban hành kèm theo thông tư này. trường hợp các thành viên có ý kiến khác nhau thì đơn vị chủ trì quyết định việc xác định sơ bộ thiệt hại ban đầu. 8. khi thực hiện nhiệm vụ theo quy định tại các khoản 1, 2, 3, 4, 5, 6 và 7 điều này a) nếu phát hiện vụ tai nạn giao thông đường bộ có một trong các dấu hiệu về hậu quả: có người chết tại hiện trường, chết trên đường đi cấp cứu, đang cấp cứu mà chết, có nguy cơ chết; có người bị thương dập, nát, đứt, rời tay, chân; chấn thương sọ não; có từ 03 người trở lên bị thương gãy tay, chân trở lên hoặc có căn cứ xác định tổn hại cho sức khỏe với tỷ lệ tổn thương cơ thể từ 61% trở lên hoặc có căn cứ xác định thiệt hại tài sản từ 100 triệu đồng trở lên thì thực hiện như sau: đối với cán bộ cục cảnh sát giao thông thì báo cáo cục trưởng, cán bộ phòng cảnh sát giao thông công an cấp tỉnh thì báo cáo trưởng phòng để chuyển ngay cho cơ quan cảnh sát điều tra công an cấp huyện có thẩm quyền điều tra, giải quyết; đối với cán bộ cảnh sát giao thông công an cấp huyện, báo cáo trưởng công an cấp huyện phân công cảnh sát điều tra tiếp nhận điều tra, giải quyết; b) trường hợp vụ tai nạn giao thông đường bộ không thuộc điểm a khoản này mà thuộc trách nhiệm điều tra giải quyết của cục cảnh sát giao thông và phòng cảnh sát giao thông công an cấp tỉnh nếu xác định vụ tai nạn giao thông đường bộ có khả năng có dấu hiệu tội phạm được quy định tại một trong các điều 260, 261, 262, 263, 264 và 281 bộ luật hình sự năm 2015 (sửa đổi, bổ sung năm 2017) thì cán bộ của cục cảnh sát giao thông phải báo cáo cục trưởng, cán bộ của phòng cảnh sát giao thông công an cấp tỉnh phải báo cáo trưởng phòng để thực hiện nhiệm vụ, quyền hạn điều tra theo quy định tại điều 38 luật tổ chức cơ quan điều tra hình sự năm 2015 và điều 40 bộ luật tố tụng hình sự năm 2015 (sửa đổi bổ sung năm 2021); c) đối với vụ tai nạn giao thông đường bộ không thuộc trường hợp quy định tại điểm a, b khoản này thì phân công cán bộ cảnh sát giao thông tiến hành điều tra, xác minh, giải quyết theo quy định của thông tư này và pháp luật có liên quan. 9. trong quá trình xác minh, giải quyết vụ tai nạn giao thông đường bộ, nếu có người bị thương đang điều trị mà chết hoặc có cơ sở xác định nguyên nhân chết do vụ tai nạn giao thông đường bộ gây ra thì thực hiện như sau: a) đối với cán bộ cục cảnh sát giao thông thì báo cáo cục trưởng, cán bộ phòng cảnh sát giao thông công an cấp tỉnh thì báo cáo trưởng phòng để chuyển cho cơ quan cảnh sát điều tra công an cấp huyện có thẩm quyền điều tra, giải quyết; b) đối với cán bộ cảnh sát giao thông công an cấp huyện, báo cáo trưởng công an cấp huyện phân công cảnh sát điều tra tiếp nhận điều tra, giải quyết. mục 2. nội dung, biện pháp điều tra, xác minh vụ tai nạn giao thông đường bộ']","**Nguồn văn bản:** 168_2024_ND-CP_619502

**Tên văn bản:** Nghị định Quy định xử phạt vi phạm hành chính về trật tự, an toàn giao thông trong lĩnh vực giao thông đường bộ; trừ điểm, phục hồi điểm giấy phép lái xe

**Điều 6:** xử phạt, trừ điểm giấy phép lái xe của người điều khiển xe ô tô, xe chở người bốn bánh có gắn động cơ, xe chở hàng bốn bánh có gắn động cơ và các loại xe tương tự xe ô tô vi phạm quy tắc giao thông đường bộ

**Nội dung:**

5. Phạt tiền từ 4.000.000 đồng đến 6.000.000 đồng đối với người điều khiển xe thực hiện một trong các hành vi vi phạm sau đây:

	a) Vượt xe trong những trường hợp không được vượt, vượt xe tại đoạn đường có biển báo hiệu có nội dung cấm vượt (đối với loại phương tiện đang điều khiển); không có tín hiệu trước khi vượt hoặc có tín hiệu vượt xe nhưng không sử dụng trong suốt quá trình vượt xe; vượt bên phải xe khác trong trường hợp không được phép.

	b) Điều khiển xe không đi bên phải theo chiều đi của mình; đi không đúng phần đường hoặc làn đường quy định (làn cùng chiều hoặc làn ngược chiều) trừ hành vi quy định tại điểm a khoản 4 điều này; điều khiển xe đi qua dải phân cách cố định ở giữa hai phần đường xe chạy.

	c) Tránh xe đi ngược chiều không đúng quy định (trừ hành vi vi phạm sử dụng đèn chiếu xa khi tránh xe đi ngược chiều quy định tại điểm b khoản 3 điều này); không nhường đường cho xe đi ngược chiều theo quy định tại nơi đường hẹp, đường dốc, nơi có chướng ngại vật.

	d) Không tuân thủ quy định khi vào hoặc ra đường cao tốc; điều khiển xe chạy ở làn dừng xe khẩn cấp hoặc phần lề đường của đường cao tốc; không tuân thủ quy định về khoảng cách an toàn đối với xe chạy liền trước khi chạy trên đường cao tốc.

	đ) Điều khiển xe chạy quá tốc độ quy định từ 10 km/h đến 20 km/h.

	e) Xe không được quyền ưu tiên lắp đặt, sử dụng thiết bị phát tín hiệu của xe được quyền ưu tiên.

	g) Chuyển làn đường không đúng nơi cho phép hoặc không có tín hiệu báo trước hoặc chuyển làn đường không đúng quy định “mỗi lần chuyển làn đường chỉ được phép chuyển sang một làn đường liền kề” khi chạy trên đường cao tốc.

	h) Dùng tay cầm và sử dụng điện thoại hoặc các thiết bị điện tử khác khi điều khiển phương tiện tham gia giao thông đang di chuyển trên đường bộ.

	i) Đi vào khu vực cấm, đường có biển báo hiệu có nội dung cấm đi vào đối với loại phương tiện đang điều khiển, trừ các hành vi vi phạm quy định tại điểm d khoản 9, điểm đ khoản 11 điều này, hành vi bị cấm đi vào công trình thủy lợi và các trường hợp xe ưu tiên đang đi làm nhiệm vụ khẩn cấp theo quy định.

	k) Dừng xe, đỗ xe, quay đầu xe trái quy định gây ùn tắc giao thông.

	l) Chuyển hướng không nhường quyền đi trước cho: người đi bộ, xe lăn của người khuyết tật qua đường tại nơi có vạch kẻ đường dành cho người đi bộ; xe thô sơ đang đi trên phần đường dành cho xe thô sơ.

	m) Chuyển hướng không nhường đường cho: các xe đi ngược chiều; người đi bộ, xe thô sơ đang qua đường tại nơi không có vạch kẻ đường cho người đi bộ.

	n) Không giảm tốc độ (hoặc dừng lại) và nhường đường khi điều khiển xe đi từ đường không ưu tiên ra đường ưu tiên, từ đường nhánh ra đường chính.

	o) Không giảm tốc độ và nhường đường cho xe đi đến từ bên phải tại nơi đường giao nhau không có báo hiệu đi theo vòng xuyến; không giảm tốc độ và nhường đường cho xe đi đến từ bên trái tại nơi đường giao nhau có báo hiệu đi theo vòng xuyến.

	p) Chở người trên thùng xe trái quy định; chở người trên nóc xe; để người đu bám ở cửa xe, bên ngoài thành xe khi xe đang chạy.

	q) Mở cửa xe, để cửa xe mở không bảo đảm an toàn.


**Điều 7:** xử phạt, trừ điểm giấy phép lái của người điều khiển xe mô tô, xe gắn máy, các loại xe tương tự xe mô tô và các loại xe tương tự xe gắn máy vi phạm quy tắc giao thông đường bộ

**Nội dung:**

4. Phạt tiền từ 800.000 đồng đến 1.000.000 đồng đối với người điều khiển xe thực hiện một trong các hành vi vi phạm sau đây:
    
    a) Điều khiển xe chạy quá tốc độ quy định từ 10 km/h đến 20 km/h.
    
    b) Dừng xe, đỗ xe trong hầm đường bộ không đúng nơi quy định.
    
    c) Vượt xe trong những trường hợp không được vượt, vượt xe tại đoạn đường có biển báo hiệu có nội dung cấm vượt đối với loại phương tiện đang điều khiển, trừ các hành vi vi phạm quy định tại điểm đ khoản 3 điều này.
    
    d) Quay đầu xe trong hầm đường bộ.
    
    đ) Người đang điều khiển xe sử dụng ô (dù), thiết bị âm thanh (trừ thiết bị trợ thính), dùng tay cầm và sử dụng điện thoại hoặc các thiết bị điện tử khác.


**Tóm lại:**  Người điều khiển ô tô bị phạt 4.000.000 - 6.000.000 đồng nếu dùng tay cầm và sử dụng điện thoại hoặc các thiết bị điện tử khác khi xe đang di chuyển. Người điều khiển xe máy bị phạt 800.000 - 1.000.000 đồng cho hành vi tương tự.
",Luật cấm sử dụng điện thoại di động khi đang điều khiển phương tiện giao thông.,0.5,0.49591193164534547,1.0,0.99999999995
14,Quy định mới về tốc độ tối đa trong khu vực đô thị là gì?,"['1. tốc độ thiết kế của đường bộ là giá trị vận tốc được dùng để tính toán các chỉ tiêu kỹ thuật của đường bộ. tốc độ thiết kế của đường bộ được xác định trong giai đoạn đầu tư xây dựng, nâng cấp, cải tạo đường bộ nhằm bảo đảm cho phương tiện di chuyển an toàn; được quyết định theo cấp kỹ thuật của đường bộ và điều kiện địa hình. 2. tốc độ thiết kế đường bộ cao tốc là giá trị vận tốc được dùng để tính toán các chỉ tiêu kỹ thuật của đường bộ cao tốc, được xác định theo cấp đường cao tốc. khi thiết kế đường bộ cao tốc có thể áp dụng tốc độ thiết kế khác nhau theo từng đoạn nhưng phải bảo đảm các yêu cầu về chiều dài đoạn chuyển tiếp và tốc độ thiết kế trung gian giữa các đoạn. tốc độ thiết kế đường bộ cao tốc được xác định theo quy chuẩn kỹ thuật quốc gia về đường bộ cao tốc qcvn 115:2024/bgtvt. 3. tốc độ thiết kế đường bộ được xác định theo tiêu chuẩn quốc gia tcvn 4054: 2005 đường ô tô - yêu cầu thiết kế. 4. tốc độ thiết kế đường bộ trong phạm vi đô thị được xác định theo quy chuẩn kỹ thuật quốc gia về hệ thống công trình hạ tầng kỹ thuật qcvn 07-4:2023/bxd. 5. tốc độ thiết kế đường giao thông nông thôn được xác định theo tiêu chuẩn quốc gia tcvn 10380:2014 đường giao thông nông thôn - yêu cầu thiết kế.', '1. tốc độ khai thác tối đa cho phép xe cơ giới tham gia giao thông trên đường bộ trong khu vực đông dân cư bảng 1 2. tốc độ khai thác tối đa cho phép xe cơ giới tham gia giao thông trên đường bộ ngoài khu vực đông dân cư bảng 2', 'xe máy chuyên dùng, xe gắn máy và các loại xe tương tự khi tham gia giao thông, tốc độ khai thác tối đa là 40 km/h.', '1. thông tư này có hiệu lực thi hành kể từ ngày 01 tháng 01 năm 2025. 2. thông tư này thay thế thông tư số 06/2024/tt-bgtvt ngày 31 tháng 3 năm 2024 của bộ trưởng bộ giao thông vận tải ban hành quy chuẩn kỹ thuật quốc gia về đường bộ cao tốc qcvn 115:2024./. qcvn 117:2024/bgtvt quy chuẩn kỹ thuật quốc gia về đường bộ cao tốc national technical regulation on expressway lời nói đầu qcvn 117:2024/bgtvt “quy chuẩn kỹ thuật quốc gia về đường bộ cao tốc” do cục đường cao tốc việt nam chủ trì biên soạn, vụ khoa học - công nghệ và môi trường trình duyệt, bộ khoa học và công nghệ thẩm định, bộ trưởng bộ giao thông vận tải ban hành theo thông tư số 57/2024/tt-bgtvt ngày 15 tháng 11 năm 2024. quy chuẩn này thay thế quy chuẩn qcvn 115:2024/bgtvt - quy chuẩn kỹ thuật quốc gia về đường bộ cao tốc (ban hành kèm theo thông tư số 06/2024/tt- bgtvt ngày 31 tháng 3 năm 2024 của bộ trưởng bộ giao thông vận tải). mục lục 1. quy định chung 2. quy định kỹ thuật 3. tổ chức thực hiện quy chuẩn kỹ thuật quốc gia về đường bộ cao tốc national technical regulation on expressway 1. quy định chung 1.1. phạm vi điều chỉnh quy chuẩn này quy định các yêu cầu kỹ thuật trong đầu tư xây dựng, quản lý, vận hành, khai thác và bảo trì đường bộ cao tốc (trừ đường cao tốc đô thị). 1.2. đối tượng áp dụng quy chuẩn này áp dụng đối với các tổ chức, cá nhân có liên quan đến hoạt động đầu tư xây dựng, quản lý, vận hành khai thác và bảo trì đường bộ cao tốc. 1.3. giải thích từ ngữ trong quy chuẩn này, các từ ngữ dưới đây được hiểu như sau: 1.3.1. làn dừng xe khẩn cấp làn dừng xe khẩn cấp là làn được thiết kế để làm nơi dừng đỗ khẩn cấp của các phương tiện gặp sự cố, để các phương tiện cứu hộ, cứu nạn hoạt động; các phương tiện khác không được chạy xe hoặc dừng xe ở làn dừng xe khẩn cấp, trừ xe ưu tiên. 1.3.2. lưu lượng xe thiết kế lưu lượng xe thiết kế là số xe con được quy đổi từ các loại xe khác, thông qua một mặt cắt trong một đơn vị thời gian, tính cho năm tương lai. 1.3.3. năm tương lai năm tương lai là năm thứ 20 kể từ năm dự kiến hoàn thành đường bộ cao tốc đưa vào khai thác. 1.4. tốc độ thiết kế đường bộ cao tốc tốc độ thiết kế đường bộ cao tốc được phân làm 03 cấp như sau: cấp 120 có tốc độ thiết kế là 120 km/h; cấp 100 có tốc độ thiết kế là 100 km/h; cấp 80 có tốc độ thiết kế là 80 km/h; đối với vị trí địa hình đặc biệt phức tạp, yếu tố quốc phòng an ninh, cho phép áp dụng tốc độ thiết kế 60 km/h. trên đường bộ cao tốc có thể có những đoạn áp dụng cấp khác nhau, nhưng đoạn này phải dài từ 15 km trở lên và tốc độ thiết kế của hai đoạn liên tiếp không được chênh nhau quá 20 km/h. trường hợp đường bộ cao tốc áp dụng cấp tốc độ thiết kế quá một cấp (20 km/h), phải có một đoạn quá độ dài ít nhất 02 km có cấp tốc độ thiết kế trung gian. 1.5. tài liệu viện dẫn các tài liệu được viện dẫn trong quy chuẩn này bao gồm: - qcvn 41:2024/bgtvt\xa0 “quy chuẩn kỹ thuật quốc gia về báo hiệu đường bộ’’. - qcvn 43:2024/bgtvt\xa0 “quy chuẩn kỹ thuật quốc gia về trạm dừng nghỉ đường bộ”. - qcvn 07-4: 2023/bxd\xa0 “quy chuẩn kỹ thuật quốc gia về hệ thống công trình hạ tầng kỹ thuật - công trình giao thông đô thị"". - qcvn 116:2024/bgtvt\xa0 “quy chuẩn kỹ thuật quốc gia về công trình kiểm soát tải trọng xe”. - qcvn 02:2022/bxd\xa0 “quy chuẩn kỹ thuật quốc gia về số liệu điều kiện tự nhiên dùng trong xây dựng”. 2. quy định về kỹ thuật 2.1. yêu cầu chung 2.1.1. kết cấu công trình đường bộ cao tốc phải bảo đảm ổn định, bền vững, phù hợp với điều kiện tự nhiên. 2.1.2. đường bộ cao tốc có quy mô tối thiểu 04 làn xe chạy (02 làn xe cho mỗi chiều); có làn dừng xe khẩn cấp được bố trí liên tục (trừ các vị trí: qua cầu có khẩu độ nhịp từ 150,0 m trở lên; cầu có trụ cao từ 50,0 m trở lên; hầm; đoạn có bố trí làn tăng, giảm tốc hoặc làn phụ leo dốc). 2.1.3. các công trình, hạng mục công trình gắn với đường bộ cao tốc bao gồm: đường gom hoặc đường bên; trung tâm quản lý, điều hành giao thông tuyến; trạm dừng nghỉ, điểm dừng xe, đỗ xe; hệ thống thu phí điện tử không dừng đối với tuyến đường có thu phí; công trình kiểm soát tải trọng xe; hàng rào bảo vệ và các công trình khác của đường bộ cao tốc. 2.1.4. mặt cắt ngang đường bộ cao tốc được bố trí trên cùng một nền đường hoặc được bố trí trên hai nền đường riêng biệt đối với hai chiều xe chạy. 2.2. mặt cắt ngang đường bộ cao tốc 2.2.1. số làn xe chạy được xác định trên cơ sở lưu lượng xe thiết kế, nhưng không ít hơn 02 làn xe cho mỗi chiều. chiều rộng làn xe chạy tối thiểu 3,75 m đối với đường cấp 120, cấp 100 và tối thiểu 3,50 m đối với đường cấp 80 (gồm các đoạn được thiết kế với tốc độ 60 km/h). 2.2.2. làn dừng xe khẩn cấp có chiều rộng tối thiểu 3,00 m đối với đường cấp 120, cấp 100 và tối thiểu 2,50 m đối với đường cấp 80 (gồm các đoạn được thiết kế với tốc độ 60 km/h). 2.2.3. dải giữa 2.2.3.1. bố trí dải giữa (gồm dải phân cách giữa và dải an toàn ở hai bên của dải phân cách giữa) để phân chia hai chiều xe chạy. chiều rộng của dải an toàn tối thiểu là 0,75 m đối với đường cấp 120, cấp 100 và tối thiểu 0,50 m đối với đường cấp 80 (gồm các đoạn được thiết kế với tốc độ 60 km/h). dải phân cách giữa được thiết kế để bảo đảm an toàn. 2.2.3.2. trường hợp 02 chiều xe chạy được bố trí trên 02 nền đường riêng biệt, phía bên trái theo chiều xe chạy bố trí dải an toàn và lề đất. dải an toàn trong trường hợp này có chiều rộng tối thiểu 1,00 m đối với đường cấp 120, cấp 100 và tối thiểu 0,75 m đối với đường cấp 80 (gồm các đoạn được thiết kế với tốc độ 60 km/h). 2.2.4. chiều rộng lề đất tối thiểu 0,75 m, bề mặt được trồng cỏ hoặc dùng các loại vật liệu khác để chống xói. 2.3. mặt cắt ngang cầu và hầm trên đường bộ cao tốc 2.3.1. các cầu trên đường bộ cao tốc bố trí đủ các yếu tố mặt cắt ngang như của tuyến chính. đối với các cầu có khẩu độ nhịp từ 150,0 m trở lên; cầu có trụ cao từ 50,0 m trở lên khi không bố trí làn dừng khẩn cấp, phải bố trí đoạn chuyển tiếp từ mặt cắt đường vào phần cầu bị thu hẹp. 2.3.2. mặt cắt ngang hầm trên đường bộ cao tốc 2.3.2.1. mặt cắt ngang hầm bảo đảm chiều rộng để bố trí đầy đủ các yếu tố mặt cắt ngang như của tuyến chính và phần dành cho người đi bộ (phục vụ công tác bảo trì và thoát hiểm trong trường hợp khẩn cấp). trường hợp hầm không bố trí làn dừng xe khẩn cấp phải bố trí dải an toàn, chiều rộng của dải an toàn theo cấp tốc độ thiết kế của đường bộ cao tốc. 2.3.2.2. đối với hầm dài từ 1.000,0 m trở lên khi không bố trí làn dừng xe khẩn cấp phải bố trí vị trí dừng xe khẩn cấp có chiều dài tối thiểu 30,0 m cách nhau tối đa 500,0 m, bề rộng vị trí dừng xe khẩn cấp theo cấp tốc độ thiết kế của đường bộ cao tốc. 2.4. bố trí hệ thống đường gom, đường bên để bảo đảm việc đi lại cho người dân khu vực bị ảnh hưởng, chia cắt bởi đường bộ cao tốc. 2.5. các yếu tố hình học đường bộ cao tốc 2.5.1. các yếu tố hình học của đường bộ cao tốc phải đáp ứng các yêu cầu được quy định tại bảng 1 sau đây. bảng 1 - các trị số giới hạn thiết kế bình đồ và mặt cắt dọc 2.5.2. phải bảo đảm tầm nhìn cho các xe trên đường bộ cao tốc. 2.5.3. quy định về dốc dọc. 2.5.3.1. độ dốc dọc lớn nhất được quy định tại bảng 1 tùy thuộc cấp thiết kế của đường bộ cao tốc. 2.5.3.2. trên các đoạn nền đào phải thiết kế độ dốc dọc tối thiểu bằng 0,50 %. 2.5.3.3. trên các đoạn chuyển tiếp có độ dốc ngang mặt đường dưới 1,00 % phải thiết kế dốc dọc tối thiểu là 0,50 %. 2.5.3.4. trong hầm, độ dốc dọc tối thiểu là 0,30 %. 2.5.4. phải bố trí đường cong đứng dạng tròn hoặc parabol tại các vị trí đổi dốc. 2.6. nút giao khác mức, đường nhánh ra, vào trên đường bộ cao tốc 2.6.1. phải bố trí nút giao khác mức tại các vị trí đường bộ cao tốc giao với các loại đường khác. 2.6.2. trường hợp đường bộ cao tốc vượt trên các đường khác phải bảo đảm tĩnh không tương ứng với cấp kỹ thuật quy hoạch của đường bên dưới. 2.6.3. khoảng cách tối thiểu giữa nút giao khác mức liên thông và vị trí ra, vào trên đường bộ cao tốc là 4,0 km. khoảng cách giữa các vị trí nút giao khác mức liên thông trên đường bộ cao tốc tối thiểu 10,0 km, ở gần các thành phố lớn, khu đô thị lớn và khu chức năng khoảng cách tối thiểu 5,0 km. trường hợp có các yêu cầu về an ninh quốc phòng hoặc phục vụ mục đích đặc biệt nhằm phát triển kinh tế xã hội của địa phương, khoảng cách tối thiểu giữa các nút giao khác mức liên thông được phép giảm xuống nhưng không nhỏ hơn 3,0 km. 2.6.4. các thông số kỹ thuật áp dụng cho phạm vi nút giao khác mức liên thông và các nhánh ra, vào đường bộ cao tốc. 2.6.4.1. tốc độ thiết kế trên các đường nhánh thuộc phạm vi nút giao khác mức liên thông được quy định tại bảng 2 sau đây. bảng 2 - tốc độ thiết kế trên các đường nhánh thuộc phạm vi nút giao khác mức liên thông 2.6.4.2. các yếu tố hình học của đường nhánh (bán kính đường cong bằng, đường cong chuyển tiếp, siêu cao, độ mở rộng, độ dốc dọc, đường cong đứng, tầm nhìn xe) phải bảo đảm yêu cầu kỹ thuật tương ứng với tốc độ thiết kế. 2.6.5. phải bố trí làn tăng, giảm tốc tại các nhánh vào, ra đường bộ cao tốc. 2.7. nền, mặt đường của đường bộ cao tốc 2.7.1. nền đường 2.7.1.1. nền đường phải bảo đảm ổn định, duy trì được các kích thước hình học, có đủ cường độ để chịu được các tác động của tải trọng xe và các yếu tố thiên nhiên trong suốt thời gian sử dụng. 2.7.1.2. nền đường phải tính toán, thiết kế xây dựng dựa trên các số liệu khảo sát địa hình, địa chất, thủy văn. 2.7.2. mặt đường phải được thiết kế, xây dựng bảo đảm các yêu cầu về cường độ, tính bền vững, độ nhám, độ bằng phẳng và khả năng thoát nước. 2.8. an toàn phòng hộ trên đường bộ cao tốc 2.8.1. bố trí phòng hộ 2.8.1.1. phải bố trí đồng bộ hệ thống phòng hộ bảo đảm an toàn giao thông trên đường bộ cao tốc. 2.8.1.2. phải bố trí hàng rào bảo vệ để ngăn cách người, gia súc hoặc thú rừng qua đường. 2.8.2. hệ thống báo hiệu trên đường bộ cao tốc được bố trí tuân thủ quy chuẩn kỹ thuật quốc gia về báo hiệu đường bộ. 2.8.3. phải bố trí hệ thống vạch sơn dẫn hướng và kết hợp với việc bố trí lan can phòng hộ hoặc cọc tiêu để bảo đảm an toàn khai thác. 2.8.4. chống chói 2.8.4.1. phải có biện pháp chống chói do đèn pha của xe chạy ngược chiều về ban đêm. 2.8.4.2. phải kiểm tra việc bảo đảm tầm nhìn ở các đoạn đường cong khi có bố trí các giải pháp chống chói. 2.8.4.3. đoạn đường bộ cao tốc có dải giữa rộng từ 12,0 m trở lên không cần có biện pháp chống chói. 2.8.5. bố trí chiếu sáng trên đường bộ cao tốc tại các khu vực sau: 2.8.5.1. trạm thu phí. 2.8.5.2. trong hầm. 2.8.5.3. phạm vi các vị trí giao nhau liên thông trên đường bộ cao tốc. 2.8.6. phải bố trí tường chống ồn ở gần khu vực đông dân cư. 2.9. tốc độ tối đa cho phép khai thác trên đường bộ cao tốc không vượt quá 120 km/h. tốc độ tối đa cho phép và tốc độ thiết kế không được chênh nhau quá 20 km/h; tốc độ tối đa cho phép của 02 đoạn tuyến liên tiếp không được chênh nhau quá 20 km/h. 3. tổ chức thực hiện 3.1. cục đường cao tốc việt nam chịu trách nhiệm tổ chức triển khai quy chuẩn này. 3.2. trường hợp các văn bản quy phạm pháp luật được viện dẫn trong quy chuẩn này có sự thay đổi, bổ sung hoặc được thay thế thì áp dụng theo văn bản sửa đổi, bổ sung, thay thế./.', '1. cục trưởng cục cảnh sát giao thông có trách nhiệm hướng dẫn, kiểm tra, đôn đốc việc thực hiện thông tư này. 2. cục trưởng cục kế hoạch và tài chính thực hiện việc tham mưu, báo cáo lãnh đạo bộ công an về bảo đảm kinh phí đầu tư xây dựng, quản lý, vận hành hệ thống quản lý dữ liệu thiết bị giám sát hành trình và thiết bị ghi nhận hình ảnh người lái xe. 3. thủ trưởng đơn vị thuộc cơ quan bộ, giám đốc công an tỉnh, thành phố trực thuộc trung ương, cơ quan, tổ chức, cá nhân có liên quan chịu trách nhiệm thi hành thông tư này. trong quá trình thực hiện thông tư, nếu có khó khăn, vướng mắc, công an các đơn vị, địa phương, tổ chức, cá nhân có liên quan báo cáo về bộ công an (qua cục cảnh sát giao thông) để kịp thời hướng dẫn./. phụ lục i cấu trúc bản tin\n(kèm theo thông tư số 71/2024/tt-bca ngày 12/11/2024 của bộ trưởng bộ công an) i. cấu trúc bản tin dữ liệu giám sát hành trình 1. mô tả các trường dữ liệu a) biển kiểm soát: viết liền, không phân biệt chữ hoa, chữ thường, không ký tự đặc biệt. ví dụ: 29a12345; b) thời gian: unix-time theo múi giờ việt nam; c) tốc độ: đơn vị km/h; d) vị trí (tọa độ): decimal degree, wgs84; đ) số giấy phép lái xe: viết liền, không phân biệt chữ hoa, chữ thường, không ký tự đặc biệt; e) mã số thuế: mã số thuế của đơn vị kinh doanh vận tải được viết theo cấu trúc do bộ tài chính quy định; g) đơn vị kinh doanh vận tải: tên đơn vị kinh doanh vận tải, không phân biệt chữ hoa, chữ thường; h) số người chuyên chở: số người quy định được phép chở của phương tiện - là số tự nhiên lớn hơn 1; trường hợp xe vận tải hàng hóa thì bỏ trống mục này; i) tải trọng xe: tải trọng cho phép phương tiện tham gia giao thông (đơn vị: tấn). trường hợp xe vận tải hành khách thì bỏ trống mục này; k) loại hình kinh doanh: loại hình kinh doanh vận tải theo quy định. không phân biệt chữ hoa, chữ thường, không ký tự đặc biệt. 2. nguyên tắc truyền dữ liệu giám sát hành trình a) các trường dữ liệu tại các điểm a, b, c, d, đ mục 1 của phụ lục i là các trường dữ liệu gốc từ thiết bị giám sát hành trình, đơn vị kinh doanh vận tải, chủ phương tiện/đơn vị truyền dữ liệu không được sửa chữa hoặc làm sai lệch dữ liệu khi truyền về máy chủ của cục cảnh sát giao thông; b) các trường dữ liệu tại các điểm e, g, h, i, k mục 1 của phụ lục i là các trường dữ liệu mã số thuế, đơn vị kinh doanh vận tải, chủ phương tiện/đơn vị truyền dữ liệu cập nhật bổ sung (sau khi được cấp phù hiệu kinh doanh vận tải) và truyền về máy chủ của cục cảnh sát giao thông. trường hợp đơn vị kinh doanh vận tải, chủ phương tiện/đơn vị truyền dữ liệu thực hiện truyền dữ liệu khi chưa được cấp phù hiệu thì bỏ trống thông tin các trường dữ liệu này; c) dữ liệu truyền về máy chủ của cục cảnh sát giao thông phải bảo đảm truyền theo thứ tự về thời gian. ii. cấu trúc bản tin dữ liệu hình ảnh 1. mô tả các trường dữ liệu a) biển kiểm soát: viết liền, không phân biệt chữ hoa, chữ thường, không ký tự đặc biệt. ví dụ: 29a12345; b) thời gian: unix-time theo múi giờ việt nam; c) vị trí (tọa độ): decimal degree, wgs84; d) số giấy phép lái xe: viết liền, không phân biệt chữ hoa, chữ thường, không ký tự đặc biệt; đ) imageguid: guid của ảnh được sinh ra ngẫu nhiên từ máy chủ đơn vị truyền dữ liệu; e) cameraview: viết liền dưới dạng 0b000z0y0x trong đó x = 1: hình ảnh chụp người lái xe; y = 1: hình ảnh chụp cửa khách lên xuống xe; z = 1: hình ảnh chụp khoang hành khách. ví dụ 1: 0b00010101: hình ảnh này chứa thông tin quan sát được cả 3 yếu tố, vị trí người lái, cửa khách lên xuống, khoang hành khác trong cùng 1 ảnh. ví dụ 2: 0b00000001: ảnh này chỉ quan sát tại vị trí người lái xe; g) imagedata: dữ liệu ảnh được mã hóa dưới dạng base64; h) imagechecksum: mã crc32 của imagedata; i) camerald: tên chủng loại camera đã đăng ký với cơ quan có thẩm quyền; k) senderlmagelink: đường link dạng https đến máy chủ của đơn vị truyền dữ liệu chứa ảnh vừa truyền để phục vụ công tác đối sánh dữ liệu. đường link phải có thời gian tồn tại ít nhất 72 giờ kể từ khi truyền dữ liệu về máy chủ của cục cảnh sát giao thông; l) providerld: mã định danh đơn vị truyền dữ liệu, mỗi đơn vị truyền dữ liệu chỉ có một id duy nhất. 2. nguyên tắc truyền dữ liệu hình ảnh dữ liệu hình ảnh truyền về máy chủ của cục cảnh sát giao thông phải bảo đảm truyền theo thứ tự về thời gian./. phụ lục ii phương pháp tính toán quá tốc độ xe chạy\n(kèm theo thông tư số 71/2024/tt-bca ngày 12/11/2024 của bộ trưởng bộ công an) i. xử lý lọc nhiễu các bản tin giám sát hành trình trước khi tính toán máy chủ dịch vụ và máy chủ của cục cảnh sát giao thông thực hiện xử lý lọc nhiều, loại bỏ đối với các bản tin giám sát hành trình nhận được trước khi đưa vào tính toán gồm: 1. bản tin có thời gian không hợp lệ a) thời gian gửi về tương lai; b) thời gian bản tin sau nhỏ hơn thời gian bản tin trước. 2. bản tin có tọa độ không hợp lệ a) kinh độ hoặc vĩ độ = 0; b) kinh độ, vĩ độ nhảy ra xa trong khoảng thời gian ngắn (quãng đường/ thời gian >= 200 km/h); c) tọa độ nằm ngoài phạm vi lãnh thổ việt nam, toạ độ không nằm trên mặt đất. 3. bản tin có tốc độ không hợp lệ a) tốc độ tức thời trên bản tin gửi về >= 200 km/h; b) tốc độ tại các bản tin liên tiếp là một số cố định; c) tốc độ < 0 km/h. ii. phương pháp tính km xe chạy 1. phương pháp tính km xe chạy dtb[n] trong đó: kinhdo1, vido1 lần lượt là kinh độ và vĩ độ bản tin thứ n-1; kinhdo2, vido2 lần lượt là kinh độ và vĩ độ bản tin thứ n; dtb[n] = khoangcach(kinhdo1,vido1,kinhdo2,vido2)(km); function khoangcach(kinhdo1,vido1 ,kinhdo2,vido2); {double p1x = kinhdo1 * (math.pi/180); double p1y = vido1 * (math.pi/180); double p2x = kinhdo2 * (math.pi/180); double p2y = vido2 * (math.pi/180); double kc = 0; double temp = 0; kc = p2x - p1x; temp = math.cos(kc); temp = temp * math.cos(p2y); temp = temp * math.cos(p1y); kc = math.sin(p1y); kc = kc * math.sin(p2y); temp = temp + kc; kc = math.acos(temp); kc = kc * 6371}. ghi chú: chỉ thực hiện tính toán khoảng cách di chuyển của phương tiện khi tốc độ tức thời > 0 km/h; giá trị của kết quả tính toán được làm tròn đến 04 chữ số thập phân. 2. ví dụ mẫu cấu trúc bản tin (thời gian, kinh độ, vĩ độ, tốc độ). ví dụ 1: các bản tin liên tiếp của biển số xe 24c04608. bản tin 1 (26/05/2024 00:04:56, 104.33180167, 22.14273667, 12); bản tin 2 (26/05/2024 00:05:09, 104.33188833, 22.14348, 19). tính khoảng cách giữa bản tin thứ 2 và bản tin thứ 1 là: dtb[2] = khoangcach(104.33180167,22.14273667,104.33188833,22.14348) = 0.0831(km). ví dụ 2: các bản tin liên tiếp của biển số xe 30s4546. bản tin 1 (26/05/2024 07:39:45, 105.651398,21.101025,41); bản tin 2 (26/05/2024 07:40:04, 105.652657, 21.100183, 36). tính khoảng cách giữa bản tin thứ 2 và bản tin thứ 1 là: dtb[2] = khoangcach(105.651398,21.101025,105.652657,21.100183) = 0.1607(km). iii. giải thuật tính toán vi phạm tốc độ 1. việc tính toán quá tốc độ xe chạy dựa trên tọa độ, chiều của các biển báo tốc độ và khu vực hạn chế tốc độ được cơ quan có thẩm quyền công bố. 2. trường hợp chưa có dữ liệu về tọa độ, chiều của các biển báo tốc độ và khu vực hạn chế tốc độ được cơ quan có thẩm quyền công bố thì thực hiện tính toán trên cơ sở tốc độ tối đa cho phép xe cơ giới tham gia giao thông ngoài khu vực đông dân cư đối với từng loại xe. 3. trường hợp tốc độ tối đa cho phép giữa các làn của tuyến đường khác nhau thì thực hiện tính toán trên cơ sở tốc độ tối đa cho phép của làn xe có tốc độ cao nhất. 4. giá trị của kết quả tính toán được làm tròn đến 02 chữ số thập phân. a) thuật ngữ viết tắt: n: là thứ tự bản tin từ thiết bị giám sát hành trình; v[n]: tốc độ tức thời (km/h); vlimit[n]: tốc độ tối đa cho phép (km/h); vtb[n]: tốc độ trung bình (km/h); vss[n]: tốc độ để so sánh với vlimit[n] xác định phương tiện vi phạm (km/h); vvipham[n]: tốc độ vi phạm (km/h); ttb[n]: thời gian giữa bản tin thứ n và n - 1 (giây); dtb[n]: khoảng cách giữa bản tin thứ n và n - 1 (km); b) lưu đồ tính toán: c) mô tả lưu đồ tính toán: sau khi thực hiện lọc các bản tin không hợp lệ được mô tả tại mục 1 của phụ lục ii kèm theo thông tư này thì thực hiện tính toán quá tốc độ. tính khoảng thời gian so với bản tin trước (ttb[n]), tùy thuộc vào khoảng thời gian này sẽ có những tính toán tốc độ trung bình, quãng đường như sau: ttb[n] > 60 giây: không tính toán quá tốc độ và sẽ thống kê vi phạm truyền dữ liệu. 10 giây < ttb[n] <= 60 giây: tính quãng đường dựa vào tọa độ 2 bản tin liên tiếp. tính tốc độ: vtb[n] = (dtb[n]/ttb[n]) * 3600. ttb[n] <= 10 giây: tính quãng đường = vtb[n] * ttb[n]. tính tốc độ: vtb[n] = (v[n] + v[n-1])/2 tính tốc độ so sánh (vss[n]): vss[n] = vtb[n] - 3. sai số về tốc độ đang áp dụng trên hệ thống cho toàn bộ các thiết bị là -3 km/h. tính tốc độ vi phạm: thời gian bắt đầu tính vi phạm tốc độ tại thời điểm vss[n] > vlimit[n] đến thời điểm kết thúc vi phạm vss[n] <= vlimit[n] (đơn vị tính theo giây). nếu vss[n] > vlimit[n] được duy trì liên tục trong khoảng thời gian từ 20 giây trở lên thì được ghi nhận là phương tiện vi phạm tốc độ xe chạy. vvipham[n] = vss[n] - vlimit[n]. sử dụng tốc độ vi phạm cao nhất và tốc độ tối đa cho phép tương ứng để xác định mức độ vi phạm theo khoảng (từ 5km/h đến 10 km/h, từ 10 km/h đến 20 km/h, từ 20 km/h đến 35 km/h, trên 35 km/h). ghi chú: tốc độ hiển thị trên bản đồ số theo dõi trực tuyến và tại bảng thống kê chi tiết hành trình là tốc độ tức thời (v[n]) (lấy thông tin theo từng bản tin truyền); v[n] >=200 km/h -> bỏ bản tin. nếu bản tin sau bản tin v[n] >=200 km/h so với bản tin trước v[n] >=200 km/h, thời gian > 60 giây thì dùng tính toán vi phạm tốc độ. còn nếu thời gian < 60 giây thì vẫn tính vss; v[n] = 0 km/h -> vẫn tính vss như bình thường./. c) mô tả lưu đồ tính toán: sau khi thực hiện lọc các bản tin không hợp lệ được mô tả tại mục 1 của phụ lục ii kèm theo thông tư này thì thực hiện tính toán quá tốc độ. tính khoảng thời gian so với bản tin trước (ttb[n]), tùy thuộc vào khoảng thời gian này sẽ có những tính toán tốc độ trung bình, quãng đường như sau: ttb[n] > 60 giây: không tính toán quá tốc độ và sẽ thống kê vi phạm truyền dữ liệu. 10 giây < ttb[n] <= 60 giây: tính quãng đường dựa vào tọa độ 2 bản tin liên tiếp. tính tốc độ: vtb[n] = (dtb[n]/ttb[n]) * 3600. ttb[n] <= 10 giây: tính quãng đường = vtb[n] * ttb[n]. tính tốc độ: vtb[n] = (v[n] + v[n-1])/2 tính tốc độ so sánh (vss[n]): vss[n] = vtb[n] - 3. sai số về tốc độ đang áp dụng trên hệ thống cho toàn bộ các thiết bị là -3 km/h. tính tốc độ vi phạm: thời gian bắt đầu tính vi phạm tốc độ tại thời điểm vss[n] > vlimit[n] đến thời điểm kết thúc vi phạm vss[n] <= vlimit[n] (đơn vị tính theo giây). nếu vss[n] > vlimit[n] được duy trì liên tục trong khoảng thời gian từ 20 giây trở lên thì được ghi nhận là phương tiện vi phạm tốc độ xe chạy. vvipham[n] = vss[n] - vlimit[n]. sử dụng tốc độ vi phạm cao nhất và tốc độ tối đa cho phép tương ứng để xác định mức độ vi phạm theo khoảng (từ 5km/h đến 10 km/h, từ 10 km/h đến 20 km/h, từ 20 km/h đến 35 km/h, trên 35 km/h). ghi chú: tốc độ hiển thị trên bản đồ số theo dõi trực tuyến và tại bảng thống kê chi tiết hành trình là tốc độ tức thời (v[n]) (lấy thông tin theo từng bản tin truyền); v[n] > 200 km/h -> bỏ bản tin. nếu bản tin sau bản tin v[n] > 200 km/h so với bản tin trước v[n] > 200 km/h, thời gian > 60 giây thì dừng tính toán vi phạm tốc độ. còn nếu thời gian < 60 giây thì vẫn tính vss; v[n] = 0 km/h -> vẫn tính vss như bình thường./. phụ lục iii phương pháp tính toán thời gian lái xe\n(kèm theo thông tư số 71/2024/tt-bca ngày 12/11/2024 của bộ trưởng bộ công an) i. thời gian lái xe 1. thời gian xác định xe bắt đầu di chuyển khi người lái xe quẹt thẻ và có 2 bản tin liên tiếp có vận tốc tức thời > 3 km/h. 2. thời gian kết thúc khi thiết bị ghi nhận thay đổi lái xe. ii. tính toán vi phạm thời gian lái xe 1. vi phạm thời gian lái xe được xác định trên cơ sở quy định tại khoản 1 điều 64 luật trật tự, an toàn giao thông đường bộ. 2. vi phạm thời gian lái xe trong ngày được xác định trên cơ sở quy định tại khoản 1 điều 64 luật trật tự, an toàn giao thông đường bộ. ngày làm việc của người lái xe được tính từ 00:00 giờ đến 24:00 giờ. iii. thời gian dừng, đỗ xe được bắt đầu tính khi 2 bản tin liên tiếp có vận tốc tức thời <= 3km/h, kết thúc khi có 2 bản tin liên tiếp có vận tốc tức thời > 3km/h và quãng đường dịch chuyển > 100m. hành trình xe chạy được bắt đầu tính khi có 2 bản tin liên tiếp có vận tốc tức thời > 3km/h và quảng đường dịch chuyển > 100m./. phụ lục iv phương pháp xác định không truyền dữ liệu\n(kèm theo thông tư số 71/2024/tt-bca ngày 12/11/2024 của bộ trưởng bộ công an) i. xác định đơn vị truyền dữ liệu đối với trường hợp một phương tiện lắp nhiều hơn một thiết bị giám sát hành trình và thiết bị ghi nhận hình ảnh người lái xe 1. đối với một phương tiện lắp nhiều hơn một thiết bị giám sát hành trình và thiết bị ghi nhận hình ảnh người lái xe, tại một thời điểm chỉ được truyền duy nhất dữ liệu từ một thiết bị giám sát hành trình và một thiết bị ghi nhận hình ảnh người lái xe lên hệ thống dữ liệu của cục cảnh sát giao thông. 2. trường hợp tại một thời điểm, một phương tiện có đồng thời từ hai nguồn dữ liệu giám sát hành trình và dữ liệu hình ảnh người lái xe truyền lên hệ thống dữ liệu của cục cảnh sát giao thông sẽ ghi nhận là dữ liệu truyền không đúng quy định. ii. truyền dữ liệu trong trường hợp xe bị mất tín hiệu do đường truyền bị gián đoạn 1. khi đường truyền hoạt động bình thường, đơn vị truyền dữ liệu thực hiện việc truyền dữ liệu hiện tại và dữ liệu cũ từ thời điểm bị mất tín hiệu đến thời điểm có tín hiệu theo quy định. dữ liệu cũ được truyền theo một kênh truyền riêng, độc lập với kênh truyền dữ liệu hiện tại. sau khi hết thời hạn truyền lại dữ liệu cũ, hệ thống sẽ thực hiện tính toán lại toàn bộ các thông số. 2. truyền dữ liệu hiện tại để phục vụ hiển thị vị trí phương tiện đang hoạt động trên màn hình theo dõi trực tuyến. 3. dữ liệu cũ kể từ thời điểm mất tín hiệu đến thời điểm hiện tại được truyền theo thứ tự về thời gian để phục vụ việc tính toán theo quy định. iii. tính toán chi tiết từng lần vi phạm truyền dữ liệu vi phạm truyền dữ liệu được xác định khi phương tiện có sự dịch chuyển về vị trí so với vị trí được ghi nhận tại thời điểm bắt đầu ngừng truyền dữ liệu và không có dữ liệu trong khoảng thời gian phương tiện di chuyển giữa hai vị trí. cụ thể thời gian giữa 2 bản tin liên tiếp >120 giây và khoảng cách giữa 2 bản tin liên tiếp > 500m. iv. xác định phương tiện không truyền dữ liệu trong ngày phương tiện không truyền dữ liệu trong ngày được tính khi phương tiện không truyền bản tin nào lên hệ thống (n = 0), hoặc có truyền dữ liệu nhưng các thông tin trong bản tin truyền không có giá trị sử dụng (bản tin không hợp lệ được xác định tại mục 1 của phụ lục ii kèm theo thông tư này)./.']","**Nguồn văn bản:** 38_2024_TT-BGTVT_622477

**Tên văn bản:** Thông tư Quy định về tốc độ và khoảng cách an toàn của xe cơ giới, xe máy chuyên dùng tham gia giao thông trên đường bộ

**Điều 6:** Tốc độ khai thác tối đa cho phép xe cơ giới tham gia giao thông trên đường bộ (trừ đường cao tốc)

**Nội dung:**

1. Tốc độ khai thác tối đa cho phép xe cơ giới tham gia giao thông trên đường bộ trong khu vực đông dân cư bảng 1

2. Tốc độ khai thác tối đa cho phép xe cơ giới tham gia giao thông trên đường bộ ngoài khu vực đông dân cư bảng 2


**Tóm lại:**  Thông tư 38/2024/TT-BGTVT quy định tốc độ tối đa trong khu vực đông dân cư được nêu trong bảng 1 của điều 6, tuy nhiên nội dung bảng này không được cung cấp trong context.  Vì vậy, tôi không thể cung cấp con số cụ thể. Vui lòng cung cấp thêm thông tin về bảng 1 để có được câu trả lời chính xác.
",Tốc độ tối đa trong khu vực đô thị được giảm từ 50 km/h xuống 40 km/h.,0.75,0.0,0.0,0.0
15,Quy định mới về tốc độ tối đa ngoài khu vực đô thị là gì?,"['1. tốc độ thiết kế của đường bộ là giá trị vận tốc được dùng để tính toán các chỉ tiêu kỹ thuật của đường bộ. tốc độ thiết kế của đường bộ được xác định trong giai đoạn đầu tư xây dựng, nâng cấp, cải tạo đường bộ nhằm bảo đảm cho phương tiện di chuyển an toàn; được quyết định theo cấp kỹ thuật của đường bộ và điều kiện địa hình. 2. tốc độ thiết kế đường bộ cao tốc là giá trị vận tốc được dùng để tính toán các chỉ tiêu kỹ thuật của đường bộ cao tốc, được xác định theo cấp đường cao tốc. khi thiết kế đường bộ cao tốc có thể áp dụng tốc độ thiết kế khác nhau theo từng đoạn nhưng phải bảo đảm các yêu cầu về chiều dài đoạn chuyển tiếp và tốc độ thiết kế trung gian giữa các đoạn. tốc độ thiết kế đường bộ cao tốc được xác định theo quy chuẩn kỹ thuật quốc gia về đường bộ cao tốc qcvn 115:2024/bgtvt. 3. tốc độ thiết kế đường bộ được xác định theo tiêu chuẩn quốc gia tcvn 4054: 2005 đường ô tô - yêu cầu thiết kế. 4. tốc độ thiết kế đường bộ trong phạm vi đô thị được xác định theo quy chuẩn kỹ thuật quốc gia về hệ thống công trình hạ tầng kỹ thuật qcvn 07-4:2023/bxd. 5. tốc độ thiết kế đường giao thông nông thôn được xác định theo tiêu chuẩn quốc gia tcvn 10380:2014 đường giao thông nông thôn - yêu cầu thiết kế.', '1. tốc độ khai thác tối đa cho phép xe cơ giới tham gia giao thông trên đường bộ trong khu vực đông dân cư bảng 1 2. tốc độ khai thác tối đa cho phép xe cơ giới tham gia giao thông trên đường bộ ngoài khu vực đông dân cư bảng 2', 'xe máy chuyên dùng, xe gắn máy và các loại xe tương tự khi tham gia giao thông, tốc độ khai thác tối đa là 40 km/h.', '1. thông tư này có hiệu lực thi hành kể từ ngày 01 tháng 01 năm 2025. 2. thông tư này thay thế thông tư số 06/2024/tt-bgtvt ngày 31 tháng 3 năm 2024 của bộ trưởng bộ giao thông vận tải ban hành quy chuẩn kỹ thuật quốc gia về đường bộ cao tốc qcvn 115:2024./. qcvn 117:2024/bgtvt quy chuẩn kỹ thuật quốc gia về đường bộ cao tốc national technical regulation on expressway lời nói đầu qcvn 117:2024/bgtvt “quy chuẩn kỹ thuật quốc gia về đường bộ cao tốc” do cục đường cao tốc việt nam chủ trì biên soạn, vụ khoa học - công nghệ và môi trường trình duyệt, bộ khoa học và công nghệ thẩm định, bộ trưởng bộ giao thông vận tải ban hành theo thông tư số 57/2024/tt-bgtvt ngày 15 tháng 11 năm 2024. quy chuẩn này thay thế quy chuẩn qcvn 115:2024/bgtvt - quy chuẩn kỹ thuật quốc gia về đường bộ cao tốc (ban hành kèm theo thông tư số 06/2024/tt- bgtvt ngày 31 tháng 3 năm 2024 của bộ trưởng bộ giao thông vận tải). mục lục 1. quy định chung 2. quy định kỹ thuật 3. tổ chức thực hiện quy chuẩn kỹ thuật quốc gia về đường bộ cao tốc national technical regulation on expressway 1. quy định chung 1.1. phạm vi điều chỉnh quy chuẩn này quy định các yêu cầu kỹ thuật trong đầu tư xây dựng, quản lý, vận hành, khai thác và bảo trì đường bộ cao tốc (trừ đường cao tốc đô thị). 1.2. đối tượng áp dụng quy chuẩn này áp dụng đối với các tổ chức, cá nhân có liên quan đến hoạt động đầu tư xây dựng, quản lý, vận hành khai thác và bảo trì đường bộ cao tốc. 1.3. giải thích từ ngữ trong quy chuẩn này, các từ ngữ dưới đây được hiểu như sau: 1.3.1. làn dừng xe khẩn cấp làn dừng xe khẩn cấp là làn được thiết kế để làm nơi dừng đỗ khẩn cấp của các phương tiện gặp sự cố, để các phương tiện cứu hộ, cứu nạn hoạt động; các phương tiện khác không được chạy xe hoặc dừng xe ở làn dừng xe khẩn cấp, trừ xe ưu tiên. 1.3.2. lưu lượng xe thiết kế lưu lượng xe thiết kế là số xe con được quy đổi từ các loại xe khác, thông qua một mặt cắt trong một đơn vị thời gian, tính cho năm tương lai. 1.3.3. năm tương lai năm tương lai là năm thứ 20 kể từ năm dự kiến hoàn thành đường bộ cao tốc đưa vào khai thác. 1.4. tốc độ thiết kế đường bộ cao tốc tốc độ thiết kế đường bộ cao tốc được phân làm 03 cấp như sau: cấp 120 có tốc độ thiết kế là 120 km/h; cấp 100 có tốc độ thiết kế là 100 km/h; cấp 80 có tốc độ thiết kế là 80 km/h; đối với vị trí địa hình đặc biệt phức tạp, yếu tố quốc phòng an ninh, cho phép áp dụng tốc độ thiết kế 60 km/h. trên đường bộ cao tốc có thể có những đoạn áp dụng cấp khác nhau, nhưng đoạn này phải dài từ 15 km trở lên và tốc độ thiết kế của hai đoạn liên tiếp không được chênh nhau quá 20 km/h. trường hợp đường bộ cao tốc áp dụng cấp tốc độ thiết kế quá một cấp (20 km/h), phải có một đoạn quá độ dài ít nhất 02 km có cấp tốc độ thiết kế trung gian. 1.5. tài liệu viện dẫn các tài liệu được viện dẫn trong quy chuẩn này bao gồm: - qcvn 41:2024/bgtvt\xa0 “quy chuẩn kỹ thuật quốc gia về báo hiệu đường bộ’’. - qcvn 43:2024/bgtvt\xa0 “quy chuẩn kỹ thuật quốc gia về trạm dừng nghỉ đường bộ”. - qcvn 07-4: 2023/bxd\xa0 “quy chuẩn kỹ thuật quốc gia về hệ thống công trình hạ tầng kỹ thuật - công trình giao thông đô thị"". - qcvn 116:2024/bgtvt\xa0 “quy chuẩn kỹ thuật quốc gia về công trình kiểm soát tải trọng xe”. - qcvn 02:2022/bxd\xa0 “quy chuẩn kỹ thuật quốc gia về số liệu điều kiện tự nhiên dùng trong xây dựng”. 2. quy định về kỹ thuật 2.1. yêu cầu chung 2.1.1. kết cấu công trình đường bộ cao tốc phải bảo đảm ổn định, bền vững, phù hợp với điều kiện tự nhiên. 2.1.2. đường bộ cao tốc có quy mô tối thiểu 04 làn xe chạy (02 làn xe cho mỗi chiều); có làn dừng xe khẩn cấp được bố trí liên tục (trừ các vị trí: qua cầu có khẩu độ nhịp từ 150,0 m trở lên; cầu có trụ cao từ 50,0 m trở lên; hầm; đoạn có bố trí làn tăng, giảm tốc hoặc làn phụ leo dốc). 2.1.3. các công trình, hạng mục công trình gắn với đường bộ cao tốc bao gồm: đường gom hoặc đường bên; trung tâm quản lý, điều hành giao thông tuyến; trạm dừng nghỉ, điểm dừng xe, đỗ xe; hệ thống thu phí điện tử không dừng đối với tuyến đường có thu phí; công trình kiểm soát tải trọng xe; hàng rào bảo vệ và các công trình khác của đường bộ cao tốc. 2.1.4. mặt cắt ngang đường bộ cao tốc được bố trí trên cùng một nền đường hoặc được bố trí trên hai nền đường riêng biệt đối với hai chiều xe chạy. 2.2. mặt cắt ngang đường bộ cao tốc 2.2.1. số làn xe chạy được xác định trên cơ sở lưu lượng xe thiết kế, nhưng không ít hơn 02 làn xe cho mỗi chiều. chiều rộng làn xe chạy tối thiểu 3,75 m đối với đường cấp 120, cấp 100 và tối thiểu 3,50 m đối với đường cấp 80 (gồm các đoạn được thiết kế với tốc độ 60 km/h). 2.2.2. làn dừng xe khẩn cấp có chiều rộng tối thiểu 3,00 m đối với đường cấp 120, cấp 100 và tối thiểu 2,50 m đối với đường cấp 80 (gồm các đoạn được thiết kế với tốc độ 60 km/h). 2.2.3. dải giữa 2.2.3.1. bố trí dải giữa (gồm dải phân cách giữa và dải an toàn ở hai bên của dải phân cách giữa) để phân chia hai chiều xe chạy. chiều rộng của dải an toàn tối thiểu là 0,75 m đối với đường cấp 120, cấp 100 và tối thiểu 0,50 m đối với đường cấp 80 (gồm các đoạn được thiết kế với tốc độ 60 km/h). dải phân cách giữa được thiết kế để bảo đảm an toàn. 2.2.3.2. trường hợp 02 chiều xe chạy được bố trí trên 02 nền đường riêng biệt, phía bên trái theo chiều xe chạy bố trí dải an toàn và lề đất. dải an toàn trong trường hợp này có chiều rộng tối thiểu 1,00 m đối với đường cấp 120, cấp 100 và tối thiểu 0,75 m đối với đường cấp 80 (gồm các đoạn được thiết kế với tốc độ 60 km/h). 2.2.4. chiều rộng lề đất tối thiểu 0,75 m, bề mặt được trồng cỏ hoặc dùng các loại vật liệu khác để chống xói. 2.3. mặt cắt ngang cầu và hầm trên đường bộ cao tốc 2.3.1. các cầu trên đường bộ cao tốc bố trí đủ các yếu tố mặt cắt ngang như của tuyến chính. đối với các cầu có khẩu độ nhịp từ 150,0 m trở lên; cầu có trụ cao từ 50,0 m trở lên khi không bố trí làn dừng khẩn cấp, phải bố trí đoạn chuyển tiếp từ mặt cắt đường vào phần cầu bị thu hẹp. 2.3.2. mặt cắt ngang hầm trên đường bộ cao tốc 2.3.2.1. mặt cắt ngang hầm bảo đảm chiều rộng để bố trí đầy đủ các yếu tố mặt cắt ngang như của tuyến chính và phần dành cho người đi bộ (phục vụ công tác bảo trì và thoát hiểm trong trường hợp khẩn cấp). trường hợp hầm không bố trí làn dừng xe khẩn cấp phải bố trí dải an toàn, chiều rộng của dải an toàn theo cấp tốc độ thiết kế của đường bộ cao tốc. 2.3.2.2. đối với hầm dài từ 1.000,0 m trở lên khi không bố trí làn dừng xe khẩn cấp phải bố trí vị trí dừng xe khẩn cấp có chiều dài tối thiểu 30,0 m cách nhau tối đa 500,0 m, bề rộng vị trí dừng xe khẩn cấp theo cấp tốc độ thiết kế của đường bộ cao tốc. 2.4. bố trí hệ thống đường gom, đường bên để bảo đảm việc đi lại cho người dân khu vực bị ảnh hưởng, chia cắt bởi đường bộ cao tốc. 2.5. các yếu tố hình học đường bộ cao tốc 2.5.1. các yếu tố hình học của đường bộ cao tốc phải đáp ứng các yêu cầu được quy định tại bảng 1 sau đây. bảng 1 - các trị số giới hạn thiết kế bình đồ và mặt cắt dọc 2.5.2. phải bảo đảm tầm nhìn cho các xe trên đường bộ cao tốc. 2.5.3. quy định về dốc dọc. 2.5.3.1. độ dốc dọc lớn nhất được quy định tại bảng 1 tùy thuộc cấp thiết kế của đường bộ cao tốc. 2.5.3.2. trên các đoạn nền đào phải thiết kế độ dốc dọc tối thiểu bằng 0,50 %. 2.5.3.3. trên các đoạn chuyển tiếp có độ dốc ngang mặt đường dưới 1,00 % phải thiết kế dốc dọc tối thiểu là 0,50 %. 2.5.3.4. trong hầm, độ dốc dọc tối thiểu là 0,30 %. 2.5.4. phải bố trí đường cong đứng dạng tròn hoặc parabol tại các vị trí đổi dốc. 2.6. nút giao khác mức, đường nhánh ra, vào trên đường bộ cao tốc 2.6.1. phải bố trí nút giao khác mức tại các vị trí đường bộ cao tốc giao với các loại đường khác. 2.6.2. trường hợp đường bộ cao tốc vượt trên các đường khác phải bảo đảm tĩnh không tương ứng với cấp kỹ thuật quy hoạch của đường bên dưới. 2.6.3. khoảng cách tối thiểu giữa nút giao khác mức liên thông và vị trí ra, vào trên đường bộ cao tốc là 4,0 km. khoảng cách giữa các vị trí nút giao khác mức liên thông trên đường bộ cao tốc tối thiểu 10,0 km, ở gần các thành phố lớn, khu đô thị lớn và khu chức năng khoảng cách tối thiểu 5,0 km. trường hợp có các yêu cầu về an ninh quốc phòng hoặc phục vụ mục đích đặc biệt nhằm phát triển kinh tế xã hội của địa phương, khoảng cách tối thiểu giữa các nút giao khác mức liên thông được phép giảm xuống nhưng không nhỏ hơn 3,0 km. 2.6.4. các thông số kỹ thuật áp dụng cho phạm vi nút giao khác mức liên thông và các nhánh ra, vào đường bộ cao tốc. 2.6.4.1. tốc độ thiết kế trên các đường nhánh thuộc phạm vi nút giao khác mức liên thông được quy định tại bảng 2 sau đây. bảng 2 - tốc độ thiết kế trên các đường nhánh thuộc phạm vi nút giao khác mức liên thông 2.6.4.2. các yếu tố hình học của đường nhánh (bán kính đường cong bằng, đường cong chuyển tiếp, siêu cao, độ mở rộng, độ dốc dọc, đường cong đứng, tầm nhìn xe) phải bảo đảm yêu cầu kỹ thuật tương ứng với tốc độ thiết kế. 2.6.5. phải bố trí làn tăng, giảm tốc tại các nhánh vào, ra đường bộ cao tốc. 2.7. nền, mặt đường của đường bộ cao tốc 2.7.1. nền đường 2.7.1.1. nền đường phải bảo đảm ổn định, duy trì được các kích thước hình học, có đủ cường độ để chịu được các tác động của tải trọng xe và các yếu tố thiên nhiên trong suốt thời gian sử dụng. 2.7.1.2. nền đường phải tính toán, thiết kế xây dựng dựa trên các số liệu khảo sát địa hình, địa chất, thủy văn. 2.7.2. mặt đường phải được thiết kế, xây dựng bảo đảm các yêu cầu về cường độ, tính bền vững, độ nhám, độ bằng phẳng và khả năng thoát nước. 2.8. an toàn phòng hộ trên đường bộ cao tốc 2.8.1. bố trí phòng hộ 2.8.1.1. phải bố trí đồng bộ hệ thống phòng hộ bảo đảm an toàn giao thông trên đường bộ cao tốc. 2.8.1.2. phải bố trí hàng rào bảo vệ để ngăn cách người, gia súc hoặc thú rừng qua đường. 2.8.2. hệ thống báo hiệu trên đường bộ cao tốc được bố trí tuân thủ quy chuẩn kỹ thuật quốc gia về báo hiệu đường bộ. 2.8.3. phải bố trí hệ thống vạch sơn dẫn hướng và kết hợp với việc bố trí lan can phòng hộ hoặc cọc tiêu để bảo đảm an toàn khai thác. 2.8.4. chống chói 2.8.4.1. phải có biện pháp chống chói do đèn pha của xe chạy ngược chiều về ban đêm. 2.8.4.2. phải kiểm tra việc bảo đảm tầm nhìn ở các đoạn đường cong khi có bố trí các giải pháp chống chói. 2.8.4.3. đoạn đường bộ cao tốc có dải giữa rộng từ 12,0 m trở lên không cần có biện pháp chống chói. 2.8.5. bố trí chiếu sáng trên đường bộ cao tốc tại các khu vực sau: 2.8.5.1. trạm thu phí. 2.8.5.2. trong hầm. 2.8.5.3. phạm vi các vị trí giao nhau liên thông trên đường bộ cao tốc. 2.8.6. phải bố trí tường chống ồn ở gần khu vực đông dân cư. 2.9. tốc độ tối đa cho phép khai thác trên đường bộ cao tốc không vượt quá 120 km/h. tốc độ tối đa cho phép và tốc độ thiết kế không được chênh nhau quá 20 km/h; tốc độ tối đa cho phép của 02 đoạn tuyến liên tiếp không được chênh nhau quá 20 km/h. 3. tổ chức thực hiện 3.1. cục đường cao tốc việt nam chịu trách nhiệm tổ chức triển khai quy chuẩn này. 3.2. trường hợp các văn bản quy phạm pháp luật được viện dẫn trong quy chuẩn này có sự thay đổi, bổ sung hoặc được thay thế thì áp dụng theo văn bản sửa đổi, bổ sung, thay thế./.', '1. cục trưởng cục cảnh sát giao thông có trách nhiệm hướng dẫn, kiểm tra, đôn đốc việc thực hiện thông tư này. 2. cục trưởng cục kế hoạch và tài chính thực hiện việc tham mưu, báo cáo lãnh đạo bộ công an về bảo đảm kinh phí đầu tư xây dựng, quản lý, vận hành hệ thống quản lý dữ liệu thiết bị giám sát hành trình và thiết bị ghi nhận hình ảnh người lái xe. 3. thủ trưởng đơn vị thuộc cơ quan bộ, giám đốc công an tỉnh, thành phố trực thuộc trung ương, cơ quan, tổ chức, cá nhân có liên quan chịu trách nhiệm thi hành thông tư này. trong quá trình thực hiện thông tư, nếu có khó khăn, vướng mắc, công an các đơn vị, địa phương, tổ chức, cá nhân có liên quan báo cáo về bộ công an (qua cục cảnh sát giao thông) để kịp thời hướng dẫn./. phụ lục i cấu trúc bản tin\n(kèm theo thông tư số 71/2024/tt-bca ngày 12/11/2024 của bộ trưởng bộ công an) i. cấu trúc bản tin dữ liệu giám sát hành trình 1. mô tả các trường dữ liệu a) biển kiểm soát: viết liền, không phân biệt chữ hoa, chữ thường, không ký tự đặc biệt. ví dụ: 29a12345; b) thời gian: unix-time theo múi giờ việt nam; c) tốc độ: đơn vị km/h; d) vị trí (tọa độ): decimal degree, wgs84; đ) số giấy phép lái xe: viết liền, không phân biệt chữ hoa, chữ thường, không ký tự đặc biệt; e) mã số thuế: mã số thuế của đơn vị kinh doanh vận tải được viết theo cấu trúc do bộ tài chính quy định; g) đơn vị kinh doanh vận tải: tên đơn vị kinh doanh vận tải, không phân biệt chữ hoa, chữ thường; h) số người chuyên chở: số người quy định được phép chở của phương tiện - là số tự nhiên lớn hơn 1; trường hợp xe vận tải hàng hóa thì bỏ trống mục này; i) tải trọng xe: tải trọng cho phép phương tiện tham gia giao thông (đơn vị: tấn). trường hợp xe vận tải hành khách thì bỏ trống mục này; k) loại hình kinh doanh: loại hình kinh doanh vận tải theo quy định. không phân biệt chữ hoa, chữ thường, không ký tự đặc biệt. 2. nguyên tắc truyền dữ liệu giám sát hành trình a) các trường dữ liệu tại các điểm a, b, c, d, đ mục 1 của phụ lục i là các trường dữ liệu gốc từ thiết bị giám sát hành trình, đơn vị kinh doanh vận tải, chủ phương tiện/đơn vị truyền dữ liệu không được sửa chữa hoặc làm sai lệch dữ liệu khi truyền về máy chủ của cục cảnh sát giao thông; b) các trường dữ liệu tại các điểm e, g, h, i, k mục 1 của phụ lục i là các trường dữ liệu mã số thuế, đơn vị kinh doanh vận tải, chủ phương tiện/đơn vị truyền dữ liệu cập nhật bổ sung (sau khi được cấp phù hiệu kinh doanh vận tải) và truyền về máy chủ của cục cảnh sát giao thông. trường hợp đơn vị kinh doanh vận tải, chủ phương tiện/đơn vị truyền dữ liệu thực hiện truyền dữ liệu khi chưa được cấp phù hiệu thì bỏ trống thông tin các trường dữ liệu này; c) dữ liệu truyền về máy chủ của cục cảnh sát giao thông phải bảo đảm truyền theo thứ tự về thời gian. ii. cấu trúc bản tin dữ liệu hình ảnh 1. mô tả các trường dữ liệu a) biển kiểm soát: viết liền, không phân biệt chữ hoa, chữ thường, không ký tự đặc biệt. ví dụ: 29a12345; b) thời gian: unix-time theo múi giờ việt nam; c) vị trí (tọa độ): decimal degree, wgs84; d) số giấy phép lái xe: viết liền, không phân biệt chữ hoa, chữ thường, không ký tự đặc biệt; đ) imageguid: guid của ảnh được sinh ra ngẫu nhiên từ máy chủ đơn vị truyền dữ liệu; e) cameraview: viết liền dưới dạng 0b000z0y0x trong đó x = 1: hình ảnh chụp người lái xe; y = 1: hình ảnh chụp cửa khách lên xuống xe; z = 1: hình ảnh chụp khoang hành khách. ví dụ 1: 0b00010101: hình ảnh này chứa thông tin quan sát được cả 3 yếu tố, vị trí người lái, cửa khách lên xuống, khoang hành khác trong cùng 1 ảnh. ví dụ 2: 0b00000001: ảnh này chỉ quan sát tại vị trí người lái xe; g) imagedata: dữ liệu ảnh được mã hóa dưới dạng base64; h) imagechecksum: mã crc32 của imagedata; i) camerald: tên chủng loại camera đã đăng ký với cơ quan có thẩm quyền; k) senderlmagelink: đường link dạng https đến máy chủ của đơn vị truyền dữ liệu chứa ảnh vừa truyền để phục vụ công tác đối sánh dữ liệu. đường link phải có thời gian tồn tại ít nhất 72 giờ kể từ khi truyền dữ liệu về máy chủ của cục cảnh sát giao thông; l) providerld: mã định danh đơn vị truyền dữ liệu, mỗi đơn vị truyền dữ liệu chỉ có một id duy nhất. 2. nguyên tắc truyền dữ liệu hình ảnh dữ liệu hình ảnh truyền về máy chủ của cục cảnh sát giao thông phải bảo đảm truyền theo thứ tự về thời gian./. phụ lục ii phương pháp tính toán quá tốc độ xe chạy\n(kèm theo thông tư số 71/2024/tt-bca ngày 12/11/2024 của bộ trưởng bộ công an) i. xử lý lọc nhiễu các bản tin giám sát hành trình trước khi tính toán máy chủ dịch vụ và máy chủ của cục cảnh sát giao thông thực hiện xử lý lọc nhiều, loại bỏ đối với các bản tin giám sát hành trình nhận được trước khi đưa vào tính toán gồm: 1. bản tin có thời gian không hợp lệ a) thời gian gửi về tương lai; b) thời gian bản tin sau nhỏ hơn thời gian bản tin trước. 2. bản tin có tọa độ không hợp lệ a) kinh độ hoặc vĩ độ = 0; b) kinh độ, vĩ độ nhảy ra xa trong khoảng thời gian ngắn (quãng đường/ thời gian >= 200 km/h); c) tọa độ nằm ngoài phạm vi lãnh thổ việt nam, toạ độ không nằm trên mặt đất. 3. bản tin có tốc độ không hợp lệ a) tốc độ tức thời trên bản tin gửi về >= 200 km/h; b) tốc độ tại các bản tin liên tiếp là một số cố định; c) tốc độ < 0 km/h. ii. phương pháp tính km xe chạy 1. phương pháp tính km xe chạy dtb[n] trong đó: kinhdo1, vido1 lần lượt là kinh độ và vĩ độ bản tin thứ n-1; kinhdo2, vido2 lần lượt là kinh độ và vĩ độ bản tin thứ n; dtb[n] = khoangcach(kinhdo1,vido1,kinhdo2,vido2)(km); function khoangcach(kinhdo1,vido1 ,kinhdo2,vido2); {double p1x = kinhdo1 * (math.pi/180); double p1y = vido1 * (math.pi/180); double p2x = kinhdo2 * (math.pi/180); double p2y = vido2 * (math.pi/180); double kc = 0; double temp = 0; kc = p2x - p1x; temp = math.cos(kc); temp = temp * math.cos(p2y); temp = temp * math.cos(p1y); kc = math.sin(p1y); kc = kc * math.sin(p2y); temp = temp + kc; kc = math.acos(temp); kc = kc * 6371}. ghi chú: chỉ thực hiện tính toán khoảng cách di chuyển của phương tiện khi tốc độ tức thời > 0 km/h; giá trị của kết quả tính toán được làm tròn đến 04 chữ số thập phân. 2. ví dụ mẫu cấu trúc bản tin (thời gian, kinh độ, vĩ độ, tốc độ). ví dụ 1: các bản tin liên tiếp của biển số xe 24c04608. bản tin 1 (26/05/2024 00:04:56, 104.33180167, 22.14273667, 12); bản tin 2 (26/05/2024 00:05:09, 104.33188833, 22.14348, 19). tính khoảng cách giữa bản tin thứ 2 và bản tin thứ 1 là: dtb[2] = khoangcach(104.33180167,22.14273667,104.33188833,22.14348) = 0.0831(km). ví dụ 2: các bản tin liên tiếp của biển số xe 30s4546. bản tin 1 (26/05/2024 07:39:45, 105.651398,21.101025,41); bản tin 2 (26/05/2024 07:40:04, 105.652657, 21.100183, 36). tính khoảng cách giữa bản tin thứ 2 và bản tin thứ 1 là: dtb[2] = khoangcach(105.651398,21.101025,105.652657,21.100183) = 0.1607(km). iii. giải thuật tính toán vi phạm tốc độ 1. việc tính toán quá tốc độ xe chạy dựa trên tọa độ, chiều của các biển báo tốc độ và khu vực hạn chế tốc độ được cơ quan có thẩm quyền công bố. 2. trường hợp chưa có dữ liệu về tọa độ, chiều của các biển báo tốc độ và khu vực hạn chế tốc độ được cơ quan có thẩm quyền công bố thì thực hiện tính toán trên cơ sở tốc độ tối đa cho phép xe cơ giới tham gia giao thông ngoài khu vực đông dân cư đối với từng loại xe. 3. trường hợp tốc độ tối đa cho phép giữa các làn của tuyến đường khác nhau thì thực hiện tính toán trên cơ sở tốc độ tối đa cho phép của làn xe có tốc độ cao nhất. 4. giá trị của kết quả tính toán được làm tròn đến 02 chữ số thập phân. a) thuật ngữ viết tắt: n: là thứ tự bản tin từ thiết bị giám sát hành trình; v[n]: tốc độ tức thời (km/h); vlimit[n]: tốc độ tối đa cho phép (km/h); vtb[n]: tốc độ trung bình (km/h); vss[n]: tốc độ để so sánh với vlimit[n] xác định phương tiện vi phạm (km/h); vvipham[n]: tốc độ vi phạm (km/h); ttb[n]: thời gian giữa bản tin thứ n và n - 1 (giây); dtb[n]: khoảng cách giữa bản tin thứ n và n - 1 (km); b) lưu đồ tính toán: c) mô tả lưu đồ tính toán: sau khi thực hiện lọc các bản tin không hợp lệ được mô tả tại mục 1 của phụ lục ii kèm theo thông tư này thì thực hiện tính toán quá tốc độ. tính khoảng thời gian so với bản tin trước (ttb[n]), tùy thuộc vào khoảng thời gian này sẽ có những tính toán tốc độ trung bình, quãng đường như sau: ttb[n] > 60 giây: không tính toán quá tốc độ và sẽ thống kê vi phạm truyền dữ liệu. 10 giây < ttb[n] <= 60 giây: tính quãng đường dựa vào tọa độ 2 bản tin liên tiếp. tính tốc độ: vtb[n] = (dtb[n]/ttb[n]) * 3600. ttb[n] <= 10 giây: tính quãng đường = vtb[n] * ttb[n]. tính tốc độ: vtb[n] = (v[n] + v[n-1])/2 tính tốc độ so sánh (vss[n]): vss[n] = vtb[n] - 3. sai số về tốc độ đang áp dụng trên hệ thống cho toàn bộ các thiết bị là -3 km/h. tính tốc độ vi phạm: thời gian bắt đầu tính vi phạm tốc độ tại thời điểm vss[n] > vlimit[n] đến thời điểm kết thúc vi phạm vss[n] <= vlimit[n] (đơn vị tính theo giây). nếu vss[n] > vlimit[n] được duy trì liên tục trong khoảng thời gian từ 20 giây trở lên thì được ghi nhận là phương tiện vi phạm tốc độ xe chạy. vvipham[n] = vss[n] - vlimit[n]. sử dụng tốc độ vi phạm cao nhất và tốc độ tối đa cho phép tương ứng để xác định mức độ vi phạm theo khoảng (từ 5km/h đến 10 km/h, từ 10 km/h đến 20 km/h, từ 20 km/h đến 35 km/h, trên 35 km/h). ghi chú: tốc độ hiển thị trên bản đồ số theo dõi trực tuyến và tại bảng thống kê chi tiết hành trình là tốc độ tức thời (v[n]) (lấy thông tin theo từng bản tin truyền); v[n] >=200 km/h -> bỏ bản tin. nếu bản tin sau bản tin v[n] >=200 km/h so với bản tin trước v[n] >=200 km/h, thời gian > 60 giây thì dùng tính toán vi phạm tốc độ. còn nếu thời gian < 60 giây thì vẫn tính vss; v[n] = 0 km/h -> vẫn tính vss như bình thường./. c) mô tả lưu đồ tính toán: sau khi thực hiện lọc các bản tin không hợp lệ được mô tả tại mục 1 của phụ lục ii kèm theo thông tư này thì thực hiện tính toán quá tốc độ. tính khoảng thời gian so với bản tin trước (ttb[n]), tùy thuộc vào khoảng thời gian này sẽ có những tính toán tốc độ trung bình, quãng đường như sau: ttb[n] > 60 giây: không tính toán quá tốc độ và sẽ thống kê vi phạm truyền dữ liệu. 10 giây < ttb[n] <= 60 giây: tính quãng đường dựa vào tọa độ 2 bản tin liên tiếp. tính tốc độ: vtb[n] = (dtb[n]/ttb[n]) * 3600. ttb[n] <= 10 giây: tính quãng đường = vtb[n] * ttb[n]. tính tốc độ: vtb[n] = (v[n] + v[n-1])/2 tính tốc độ so sánh (vss[n]): vss[n] = vtb[n] - 3. sai số về tốc độ đang áp dụng trên hệ thống cho toàn bộ các thiết bị là -3 km/h. tính tốc độ vi phạm: thời gian bắt đầu tính vi phạm tốc độ tại thời điểm vss[n] > vlimit[n] đến thời điểm kết thúc vi phạm vss[n] <= vlimit[n] (đơn vị tính theo giây). nếu vss[n] > vlimit[n] được duy trì liên tục trong khoảng thời gian từ 20 giây trở lên thì được ghi nhận là phương tiện vi phạm tốc độ xe chạy. vvipham[n] = vss[n] - vlimit[n]. sử dụng tốc độ vi phạm cao nhất và tốc độ tối đa cho phép tương ứng để xác định mức độ vi phạm theo khoảng (từ 5km/h đến 10 km/h, từ 10 km/h đến 20 km/h, từ 20 km/h đến 35 km/h, trên 35 km/h). ghi chú: tốc độ hiển thị trên bản đồ số theo dõi trực tuyến và tại bảng thống kê chi tiết hành trình là tốc độ tức thời (v[n]) (lấy thông tin theo từng bản tin truyền); v[n] > 200 km/h -> bỏ bản tin. nếu bản tin sau bản tin v[n] > 200 km/h so với bản tin trước v[n] > 200 km/h, thời gian > 60 giây thì dừng tính toán vi phạm tốc độ. còn nếu thời gian < 60 giây thì vẫn tính vss; v[n] = 0 km/h -> vẫn tính vss như bình thường./. phụ lục iii phương pháp tính toán thời gian lái xe\n(kèm theo thông tư số 71/2024/tt-bca ngày 12/11/2024 của bộ trưởng bộ công an) i. thời gian lái xe 1. thời gian xác định xe bắt đầu di chuyển khi người lái xe quẹt thẻ và có 2 bản tin liên tiếp có vận tốc tức thời > 3 km/h. 2. thời gian kết thúc khi thiết bị ghi nhận thay đổi lái xe. ii. tính toán vi phạm thời gian lái xe 1. vi phạm thời gian lái xe được xác định trên cơ sở quy định tại khoản 1 điều 64 luật trật tự, an toàn giao thông đường bộ. 2. vi phạm thời gian lái xe trong ngày được xác định trên cơ sở quy định tại khoản 1 điều 64 luật trật tự, an toàn giao thông đường bộ. ngày làm việc của người lái xe được tính từ 00:00 giờ đến 24:00 giờ. iii. thời gian dừng, đỗ xe được bắt đầu tính khi 2 bản tin liên tiếp có vận tốc tức thời <= 3km/h, kết thúc khi có 2 bản tin liên tiếp có vận tốc tức thời > 3km/h và quãng đường dịch chuyển > 100m. hành trình xe chạy được bắt đầu tính khi có 2 bản tin liên tiếp có vận tốc tức thời > 3km/h và quảng đường dịch chuyển > 100m./. phụ lục iv phương pháp xác định không truyền dữ liệu\n(kèm theo thông tư số 71/2024/tt-bca ngày 12/11/2024 của bộ trưởng bộ công an) i. xác định đơn vị truyền dữ liệu đối với trường hợp một phương tiện lắp nhiều hơn một thiết bị giám sát hành trình và thiết bị ghi nhận hình ảnh người lái xe 1. đối với một phương tiện lắp nhiều hơn một thiết bị giám sát hành trình và thiết bị ghi nhận hình ảnh người lái xe, tại một thời điểm chỉ được truyền duy nhất dữ liệu từ một thiết bị giám sát hành trình và một thiết bị ghi nhận hình ảnh người lái xe lên hệ thống dữ liệu của cục cảnh sát giao thông. 2. trường hợp tại một thời điểm, một phương tiện có đồng thời từ hai nguồn dữ liệu giám sát hành trình và dữ liệu hình ảnh người lái xe truyền lên hệ thống dữ liệu của cục cảnh sát giao thông sẽ ghi nhận là dữ liệu truyền không đúng quy định. ii. truyền dữ liệu trong trường hợp xe bị mất tín hiệu do đường truyền bị gián đoạn 1. khi đường truyền hoạt động bình thường, đơn vị truyền dữ liệu thực hiện việc truyền dữ liệu hiện tại và dữ liệu cũ từ thời điểm bị mất tín hiệu đến thời điểm có tín hiệu theo quy định. dữ liệu cũ được truyền theo một kênh truyền riêng, độc lập với kênh truyền dữ liệu hiện tại. sau khi hết thời hạn truyền lại dữ liệu cũ, hệ thống sẽ thực hiện tính toán lại toàn bộ các thông số. 2. truyền dữ liệu hiện tại để phục vụ hiển thị vị trí phương tiện đang hoạt động trên màn hình theo dõi trực tuyến. 3. dữ liệu cũ kể từ thời điểm mất tín hiệu đến thời điểm hiện tại được truyền theo thứ tự về thời gian để phục vụ việc tính toán theo quy định. iii. tính toán chi tiết từng lần vi phạm truyền dữ liệu vi phạm truyền dữ liệu được xác định khi phương tiện có sự dịch chuyển về vị trí so với vị trí được ghi nhận tại thời điểm bắt đầu ngừng truyền dữ liệu và không có dữ liệu trong khoảng thời gian phương tiện di chuyển giữa hai vị trí. cụ thể thời gian giữa 2 bản tin liên tiếp >120 giây và khoảng cách giữa 2 bản tin liên tiếp > 500m. iv. xác định phương tiện không truyền dữ liệu trong ngày phương tiện không truyền dữ liệu trong ngày được tính khi phương tiện không truyền bản tin nào lên hệ thống (n = 0), hoặc có truyền dữ liệu nhưng các thông tin trong bản tin truyền không có giá trị sử dụng (bản tin không hợp lệ được xác định tại mục 1 của phụ lục ii kèm theo thông tư này)./.']","**Nguồn văn bản:** 38_2024_TT-BGTVT_622477

**Tên văn bản:** Thông tư Quy định về tốc độ và khoảng cách an toàn của xe cơ giới, xe máy chuyên dùng tham gia giao thông trên đường bộ

**Điều 6:** Tốc độ khai thác tối đa cho phép xe cơ giới tham gia giao thông trên đường bộ (trừ đường cao tốc)

**Nội dung:**

1. Tốc độ khai thác tối đa cho phép xe cơ giới tham gia giao thông trên đường bộ trong khu vực đông dân cư bảng 1

2. Tốc độ khai thác tối đa cho phép xe cơ giới tham gia giao thông trên đường bộ ngoài khu vực đông dân cư bảng 2


**Tóm lại:** Thông tư 38/2024/TT-BGTVT quy định tốc độ tối đa cho phép xe cơ giới ngoài khu vực đông dân cư được nêu trong bảng 2 của điều 6, nhưng nội dung bảng này không được cung cấp trong context.
",Tốc độ tối đa ngoài khu vực đô thị được giảm từ 80 km/h xuống 70 km/h.,0.16666666666666666,0.0,0.0,0.0
16,Luật Giao thông Đường bộ 2025 có quy định gì về việc sử dụng đèn pha trong khu vực đô thị?,"['1. điều kiện hoạt động của xe thô sơ quy định tại điểm a, điểm b, điểm c, điểm e khoản 2 điều 34 luật trật tự, an toàn giao thông đường bộ bao gồm: a) hệ thống, bộ phận hãm có hiệu lực; b) có bộ phận phát âm thanh cảnh báo (còi, chuông); c) có đèn chiếu sáng hoặc tấm phản quang phía trước; phía sau phải có đèn tín hiệu hoặc tấm phản quang. trường hợp có quy định về tiêu chuẩn, quy chuẩn kỹ thuật đối với phương tiện xe thô sơ quy định tại khoản này thì thực hiện theo quy định của tiêu chuẩn, quy chuẩn kỹ thuật tương ứng. 2. đối với xe thô sơ quy định tại điểm d, điểm đ khoản 2 điều 34 luật trật tự, an toàn giao thông đường bộ có tấm phản quang hoặc thiết bị phát sáng vào ban đêm để nhận biết.', '1. phạt tiền từ 200.000 đồng đến 400.000 đồng đối với người điều khiển xe thực hiện một trong các hành vi vi phạm sau đây: a) không chấp hành hiệu lệnh, chỉ dẫn của biển báo hiệu, vạch kẻ đường, trừ các hành vi vi phạm quy định tại điểm b, điểm d, điểm e khoản 2; điểm a, điểm c, điểm d, điểm h khoản 3; điểm a, điểm b, điểm c, điểm d khoản 4; điểm b, điểm d khoản 6; điểm a, điểm b, điểm c khoản 7; điểm a khoản 8; điểm b khoản 9; điểm a khoản 10 điều này; b) không có tín hiệu trước khi vượt hoặc có tín hiệu vượt xe nhưng không sử dụng trong suốt quá trình vượt xe; c) lùi xe mô tô ba bánh không quan sát hai bên, phía sau xe hoặc không có tín hiệu lùi xe; d) chở người ngồi trên xe sử dụng ô (dù); đ) không tuân thủ các quy định về nhường đường tại nơi đường giao nhau, trừ các hành vi vi phạm quy định tại điểm c, điểm d khoản 6 điều này; e) chuyển làn đường không đúng nơi cho phép hoặc không có tín hiệu báo trước hoặc chuyển làn đường không đúng quy định “mỗi lần chuyển làn đường chỉ được phép chuyển sang một làn đường liền kề”; g) không sử dụng đèn chiếu sáng trong thời gian từ 18 giờ ngày hôm trước đến 06 giờ ngày hôm sau hoặc khi có sương mù, khói, bụi, trời mưa, thời tiết xấu làm hạn chế tầm nhìn; h) tránh xe không đúng quy định; sử dụng đèn chiếu xa khi gặp người đi bộ qua đường hoặc khi đi trên đoạn đường qua khu dân cư có hệ thống chiếu sáng đang hoạt động hoặc khi gặp xe đi ngược chiều (trừ trường hợp dải phân cách có khả năng chống chói) hoặc khi chuyển hướng xe tại nơi đường giao nhau; không nhường đường cho xe đi ngược chiều theo quy định tại nơi đường hẹp, đường dốc, nơi có chướng ngại vật; i) sử dụng còi trong thời gian từ 22 giờ ngày hôm trước đến 05 giờ ngày hôm sau trong khu đông dân cư, khu vực cơ sở khám bệnh, chữa bệnh, trừ các xe ưu tiên đang đi làm nhiệm vụ theo quy định; k) điều khiển xe chạy dưới tốc độ tối thiểu trên đoạn đường bộ có quy định tốc độ tối thiểu cho phép. 2. phạt tiền từ 400.000 đồng đến 600.000 đồng đối với người điều khiển xe thực hiện một trong các hành vi vi phạm sau đây: a) dừng xe, đỗ xe trên phần đường xe chạy ở đoạn đường ngoài đô thị nơi có lề đường; b) điều khiển xe chạy quá tốc độ quy định từ 05 km/h đến dưới 10 km/h; c) điều khiển xe chạy tốc độ thấp mà không đi bên phải phần đường xe chạy gây cản trở giao thông; d) dừng xe, đỗ xe ở lòng đường gây cản trở giao thông; tụ tập từ 03 xe trở lên ở lòng đường, trong hầm đường bộ; đỗ, để xe ở lòng đường, vỉa hè trái phép; đ) xe không được quyền ưu tiên lắp đặt, sử dụng thiết bị phát tín hiệu của xe được quyền ưu tiên; e) dừng xe, đỗ xe trên điểm đón, trả khách, nơi đường bộ giao nhau, trên phần đường dành cho người đi bộ qua đường; dừng xe nơi có biển “cấm dừng xe và đỗ xe”; đỗ xe tại nơi có biển “cấm đỗ xe” hoặc biển “cấm dừng xe và đỗ xe”; không tuân thủ các quy định về dừng xe, đỗ xe tại nơi đường bộ giao nhau cùng mức với đường sắt; dừng xe, đỗ xe trong phạm vi hành lang an toàn giao thông đường sắt; g) chở theo 02 người trên xe, trừ trường hợp chở người bệnh đi cấp cứu, trẻ em dưới 12 tuổi, người già yếu hoặc người khuyết tật, áp giải người có hành vi vi phạm pháp luật; h) không đội “mũ bảo hiểm cho người đi mô tô, xe máy” hoặc đội “mũ bảo hiểm cho người đi mô tô, xe máy” không cài quai đúng quy cách khi điều khiển xe tham gia giao thông trên đường bộ; i) chở người ngồi trên xe không đội “mũ bảo hiểm cho người đi mô tô, xe máy” hoặc đội “mũ bảo hiểm cho người đi mô tô, xe máy” không cài quai đúng quy cách, trừ trường hợp chở người bệnh đi cấp cứu, trẻ em dưới 06 tuổi, áp giải người có hành vi vi phạm pháp luật; k) quay đầu xe tại nơi không được quay đầu xe, trừ hành vi vi phạm quy định tại điểm d khoản 4 điều này. 3. phạt tiền từ 600.000 đồng đến 800.000 đồng đối với người điều khiển xe thực hiện một trong các hành vi vi phạm sau đây: a) chuyển hướng không quan sát hoặc không bảo đảm khoảng cách an toàn với xe phía sau hoặc không giảm tốc độ hoặc không có tín hiệu báo hướng rẽ hoặc có tín hiệu báo hướng rẽ nhưng không sử dụng liên tục trong quá trình chuyển hướng (trừ trường hợp điều khiển xe đi theo hướng cong của đoạn đường bộ ở nơi đường không giao nhau cùng mức); điều khiển xe rẽ trái tại nơi có biển báo hiệu có nội dung cấm rẽ trái đối với loại phương tiện đang điều khiển; điều khiển xe rẽ phải tại nơi có biển báo hiệu có nội dung cấm rẽ phải đối với loại phương tiện đang điều khiển; b) chở theo từ 03 người trở lên trên xe; c) dừng xe, đỗ xe trên cầu; d) điều khiển xe không đi bên phải theo chiều đi của mình; đi không đúng phần đường, làn đường quy định (làn cùng chiều hoặc làn ngược chiều); điều khiển xe đi qua dải phân cách cố định ở giữa hai phần đường xe chạy; đ) vượt bên phải trong trường hợp không được phép; e) người đang điều khiển xe hoặc chở người ngồi trên xe bám, kéo, đẩy xe khác, vật khác, dẫn dắt vật nuôi, mang vác vật cồng kềnh; chở người đứng trên yên, giá đèo hàng hoặc ngồi trên tay lái của xe; g) điều khiển xe kéo theo xe khác, vật khác; h) chạy trong hầm đường bộ không sử dụng đèn chiếu sáng gần; i) không giữ khoảng cách an toàn để xảy ra va chạm với xe chạy liền trước hoặc không giữ khoảng cách theo quy định của biển báo hiệu “cự ly tối thiểu giữa hai xe”; k) điều khiển xe chạy dàn hàng ngang từ 03 xe trở lên; l) xe được quyền ưu tiên lắp đặt, sử dụng thiết bị phát tín hiệu ưu tiên không đúng quy định hoặc sử dụng thiết bị phát tín hiệu ưu tiên mà không có giấy phép của cơ quan có thẩm quyền cấp hoặc có giấy phép của cơ quan có thẩm quyền cấp nhưng không còn giá trị sử dụng theo quy định. 4. phạt tiền từ 800.000 đồng đến 1.000.000 đồng đối với người điều khiển xe thực hiện một trong các hành vi vi phạm sau đây: a) điều khiển xe chạy quá tốc độ quy định từ 10 km/h đến 20 km/h; b) dừng xe, đỗ xe trong hầm đường bộ không đúng nơi quy định; c) vượt xe trong những trường hợp không được vượt, vượt xe tại đoạn đường có biển báo hiệu có nội dung cấm vượt đối với loại phương tiện đang điều khiển, trừ các hành vi vi phạm quy định tại điểm đ khoản 3 điều này; d) quay đầu xe trong hầm đường bộ; đ) người đang điều khiển xe sử dụng ô (dù), thiết bị âm thanh (trừ thiết bị trợ thính), dùng tay cầm và sử dụng điện thoại hoặc các thiết bị điện tử khác. 5. phạt tiền từ 1.000.000 đồng đến 2.000.000 đồng đối với người điều khiển xe thực hiện một trong các hành vi vi phạm sau đây: a) điều khiển xe có liên quan trực tiếp đến vụ tai nạn giao thông mà không dừng ngay phương tiện, không giữ nguyên hiện trường, không trợ giúp người bị nạn, trừ hành vi vi phạm quy định tại điểm c khoản 9 điều này; b) chuyển hướng không nhường quyền đi trước cho: người đi bộ, xe lăn của người khuyết tật qua đường tại nơi có vạch kẻ đường dành cho người đi bộ; xe thô sơ đang đi trên phần đường dành cho xe thô sơ; c) chuyển hướng không nhường đường cho: các xe đi ngược chiều; người đi bộ, xe thô sơ đang qua đường tại nơi không có vạch kẻ đường cho người đi bộ. 6. phạt tiền từ 2.000.000 đồng đến 3.000.000 đồng đối với người điều khiển xe thực hiện một trong các hành vi vi phạm sau đây: a) điều khiển xe trên đường mà trong máu hoặc hơi thở có nồng độ cồn nhưng chưa vượt quá 50 miligam/100 mililít máu hoặc chưa vượt quá 0,25 miligam/1 lít khí thở; b) đi vào khu vực cấm, đường có biển báo hiệu có nội dung cấm đi vào đối với loại phương tiện đang điều khiển, trừ các hành vi vi phạm quy định tại điểm a, điểm b khoản 7 điều này và các trường hợp xe ưu tiên đang đi làm nhiệm vụ khẩn cấp theo quy định; c) không giảm tốc độ (hoặc dừng lại) và nhường đường khi điều khiển xe đi từ đường không ưu tiên ra đường ưu tiên, từ đường nhánh ra đường chính; d) không giảm tốc độ và nhường đường cho xe đi đến từ bên phải tại nơi đường giao nhau không có báo hiệu đi theo vòng xuyến; không giảm tốc độ và nhường đường cho xe đi đến từ bên trái tại nơi đường giao nhau có báo hiệu đi theo vòng xuyến. 7. phạt tiền từ 4.000.000 đồng đến 6.000.000 đồng đối với người điều khiển xe thực hiện một trong các hành vi vi phạm sau đây: a) đi ngược chiều của đường một chiều, đi ngược chiều trên đường có biển “cấm đi ngược chiều”, trừ hành vi vi phạm quy định tại điểm b khoản này và các trường hợp xe ưu tiên đang đi làm nhiệm vụ khẩn cấp theo quy định; điều khiển xe đi trên vỉa hè, trừ trường hợp điều khiển xe đi qua vỉa hè để vào nhà, cơ quan; b) điều khiển xe đi vào đường cao tốc, trừ xe phục vụ việc quản lý, bảo trì đường cao tốc; c) không chấp hành hiệu lệnh của đèn tín hiệu giao thông; d) không chấp hành hiệu lệnh, hướng dẫn của người điều khiển giao thông hoặc người kiểm soát giao thông; đ) không nhường đường hoặc gây cản trở xe được quyền ưu tiên đang phát tín hiệu ưu tiên đi làm nhiệm vụ. 8. phạt tiền từ 6.000.000 đồng đến 8.000.000 đồng đối với người điều khiển xe thực hiện một trong các hành vi vi phạm sau đây: a) điều khiển xe chạy quá tốc độ quy định trên 20 km/h; b) điều khiển xe trên đường mà trong máu hoặc hơi thở có nồng độ cồn vượt quá 50 miligam đến 80 miligam/100 mililít máu hoặc vượt quá 0,25 miligam đến 0,4 miligam/1 lít khí thở. 9. phạt tiền từ 8.000.000 đồng đến 10.000.000 đồng đối với người điều khiển xe thực hiện một trong các hành vi vi phạm sau đây: a) điều khiển xe lạng lách, đánh võng trên đường bộ; sử dụng chân chống hoặc vật khác quệt xuống đường khi xe đang chạy; b) điều khiển xe thành nhóm từ 02 xe trở lên chạy quá tốc độ quy định; c) gây tai nạn giao thông không dừng ngay phương tiện, không giữ nguyên hiện trường, không trợ giúp người bị nạn, không ở lại hiện trường hoặc không đến trình báo ngay với cơ quan công an, ủy ban nhân dân nơi gần nhất; d) điều khiển xe trên đường mà trong máu hoặc hơi thở có nồng độ cồn vượt quá 80 miligam/100 mililít máu hoặc vượt quá 0,4 miligam/1 lít khí thở; đ) không chấp hành yêu cầu kiểm tra về nồng độ cồn của người thi hành công vụ; e) điều khiển xe trên đường mà trong cơ thể có chất ma túy hoặc chất kích thích khác mà pháp luật cấm sử dụng; g) không chấp hành yêu cầu kiểm tra về chất ma túy hoặc chất kích thích khác mà pháp luật cấm sử dụng của người thi hành công vụ; h) ngồi phía sau vòng tay qua người ngồi trước để điều khiển xe, trừ trường hợp chở trẻ em dưới 06 tuổi ngồi phía trước; i) điều khiển xe thành đoàn gây cản trở giao thông, trừ trường hợp được cơ quan có thẩm quyền cấp phép; k) sử dụng còi, rú ga (nẹt pô) liên tục trong khu đông dân cư, khu vực cơ sở khám bệnh, chữa bệnh, trừ các xe ưu tiên đang đi làm nhiệm vụ theo quy định. 10. phạt tiền từ 10.000.000 đồng đến 14.000.000 đồng đối với người điều khiển xe thực hiện một trong các hành vi vi phạm sau đây: a) điều khiển xe không quan sát, giảm tốc độ hoặc dừng lại để bảo đảm an toàn theo quy định mà gây tai nạn giao thông; điều khiển xe chạy quá tốc độ quy định gây tai nạn giao thông; đi vào đường cao tốc, dừng xe, đỗ xe, quay đầu xe, lùi xe, vượt xe, chuyển hướng, chuyển làn đường không đúng quy định gây tai nạn giao thông; không đi đúng phần đường, làn đường, không giữ khoảng cách an toàn giữa hai xe theo quy định gây tai nạn giao thông hoặc đi vào đường có biển báo hiệu có nội dung cấm đi vào đối với loại phương tiện đang điều khiển, đi ngược chiều của đường một chiều, đi ngược chiều trên đường có biển “cấm đi ngược chiều” gây tai nạn giao thông; b) vi phạm quy định tại một trong các điểm, khoản sau của điều này mà gây tai nạn giao thông: điểm a, điểm d, điểm đ, điểm g, điểm h, điểm i, điểm k khoản 1; điểm c, điểm đ, điểm g khoản 2; điểm b, điểm e, điểm g, điểm h, điểm k khoản 3; điểm đ khoản 4; điểm c, điểm d khoản 6; điểm c, điểm d, điểm đ khoản 7; điểm a, điểm b, điểm h, điểm k khoản 9 điều này. 11. tịch thu phương tiện đối với người điều khiển xe thực hiện một trong các hành vi vi phạm sau đây: a) buông cả hai tay khi đang điều khiển xe; dùng chân điều khiển xe; ngồi về một bên điều khiển xe; nằm trên yên xe điều khiển xe; thay người điều khiển khi xe đang chạy; quay người về phía sau để điều khiển xe hoặc bịt mắt điều khiển xe; b) điều khiển xe chạy bằng một bánh đối với xe hai bánh, chạy bằng hai bánh đối với xe ba bánh; c) tái phạm hành vi điều khiển xe lạng lách, đánh võng quy định tại điểm a khoản 9 điều này. 12. ngoài việc bị áp dụng hình thức xử phạt chính, người điều khiển xe thực hiện hành vi vi phạm còn bị áp dụng các hình thức xử phạt bổ sung sau đây: a) thực hiện hành vi quy định tại điểm đ khoản 2 điều này còn bị tịch thu thiết bị phát tín hiệu ưu tiên lắp đặt, sử dụng trái quy định; b) thực hiện hành vi quy định tại điểm a, điểm b, điểm h, điểm i, điểm k khoản 9 điều này bị tước quyền sử dụng giấy phép lái xe từ 10 tháng đến 12 tháng; c) thực hiện hành vi quy định tại điểm d, điểm đ, điểm e, điểm g khoản 9; khoản 11 điều này bị tước quyền sử dụng giấy phép lái xe từ 22 tháng đến 24 tháng. 13. ngoài việc bị áp dụng hình thức xử phạt, người điều khiển xe thực hiện hành vi vi phạm còn bị trừ điểm giấy phép lái xe như sau: a) thực hiện hành vi quy định tại điểm b khoản 3; khoản 5; điểm b, điểm c, điểm d khoản 6; điểm a khoản 7 điều này bị trừ điểm giấy phép lái xe 02 điểm; b) thực hiện hành vi quy định tại điểm đ khoản 4; điểm a khoản 6; điểm c, điểm d, điểm đ khoản 7; điểm a khoản 8 điều này bị trừ điểm giấy phép lái xe 04 điểm; c) thực hiện hành vi quy định tại điểm b khoản 7, điểm c khoản 9 điều này bị trừ điểm giấy phép lái xe 06 điểm; d) thực hiện hành vi quy định tại điểm b khoản 8, khoản 10 điều này bị trừ điểm giấy phép lái xe 10 điểm.', '1. tổ chức giao thông được thực hiện từ giai đoạn quy hoạch, đầu tư, xây dựng đến giai đoạn quản lý, vận hành, khai thác, sử dụng, bảo trì kết cấu hạ tầng đường bộ nhằm bảo đảm giao thông thông suốt, an toàn, hiệu quả. 2. nội dung tổ chức giao thông đường bộ trong giai đoạn thiết kế, thi công xây dựng, quản lý, vận hành, khai thác, sử dụng, bảo trì công trình đường bộ bao gồm: a) quy định số làn đường, phần đường dành cho xe ô tô và các phương tiện tham gia giao thông đường bộ khác, phần đường dành cho người đi bộ; chiều đi, tốc độ các phương tiện cơ giới tham gia giao thông đường bộ; b) tổ chức phân làn, phân luồng trên tuyến đường đang đầu tư xây dựng và tại các tuyến đường bộ kết nối; c) quy định giao thông tại các nút giao, vị trí đấu nối với đường khác; quy định về tránh, vượt xe trên đường, các điểm được phép dừng xe, đỗ xe trên đường, vị trí đón, trả khách; d) quy định khổ giới hạn và tải trọng cho phép phương tiện tham gia giao thông đường bộ an toàn; đ) quy định thời gian cho phép tham gia giao thông; thời gian cho phép đi theo các hướng của đèn tín hiệu giao thông; e) quy định thời gian bật, tắt hệ thống chiếu sáng trên đường; g) quy định về các trường hợp tạm dừng khai thác một phần hoặc toàn bộ tuyến đường; h) khai thác, sử dụng hệ thống quản lý giao thông thông minh, trung tâm quản lý, điều hành giao thông tuyến đường cao tốc và các thiết bị công nghệ khác phục vụ cung cấp thông tin, chỉ dẫn cho người tham gia giao thông đường bộ; i) lắp đặt đầy đủ hệ thống báo hiệu đường bộ và thực hiện các công việc cần thiết khác; k) phê duyệt phương án tổ chức giao thông đối với đường cao tốc. 3. chủ đầu tư dự án đầu tư xây dựng công trình đường bộ, người quản lý, sử dụng đường bộ, tổ chức, cá nhân liên quan có trách nhiệm lắp đặt, điều chỉnh, bổ sung đầy đủ báo hiệu đường bộ, công trình an toàn giao thông đường bộ đối với dự án và tuyến đường thuộc phạm vi quản lý; thực hiện phương án tổ chức giao thông đường cao tốc được phê duyệt. 4. việc theo dõi, đánh giá tình hình giao thông trên tuyến đường, điều chỉnh tổ chức giao thông để khắc phục tình trạng ùn tắc giao thông, bảo đảm trật tự, an toàn giao thông đường bộ được thực hiện trong quá trình vận hành, khai thác, sử dụng, bảo trì đường bộ. 5. bộ giao thông vận tải, ủy ban nhân dân các cấp chịu trách nhiệm tổ chức giao thông trên các tuyến đường bộ thuộc phạm vi quản lý. 6. người quản lý, sử dụng đường bộ đối với đường chuyên dùng chịu trách nhiệm tổ chức giao thông trên đường chuyên dùng; trường hợp đường chuyên dùng có hoạt động giao thông công cộng thì phải tổ chức giao thông theo quy định của điều này. 7. chính phủ quy định chi tiết điều này.', '1. trung tâm chỉ huy giao thông bao gồm các công trình hạ tầng kỹ thuật, hệ thống thiết bị công nghệ và cơ sở dữ liệu do lực lượng cảnh sát giao thông quản lý, vận hành, khai thác. 2. trung tâm chỉ huy giao thông có nhiệm vụ thu thập, lưu trữ, phân tích, xử lý dữ liệu về tình hình trật tự, an toàn giao thông đường bộ phục vụ chỉ huy, điều khiển giao thông đường bộ, giải quyết tai nạn giao thông đường bộ, tuần tra, kiểm soát về trật tự, an toàn giao thông đường bộ, đấu tranh phòng, chống tội phạm và các vi phạm pháp luật khác trên đường bộ; cung cấp thông tin về tình trạng giao thông cho người tham gia giao thông đường bộ; phục vụ điều hành hoạt động giao thông đường bộ trật tự, an toàn, thông suốt. 3. trung tâm chỉ huy giao thông bao gồm: trung tâm chỉ huy giao thông quốc gia, trung tâm chỉ huy giao thông tỉnh, thành phố trực thuộc trung ương. 4. trung tâm chỉ huy giao thông được kết nối, chia sẻ dữ liệu với các bộ, ngành và các hệ thống, cơ sở dữ liệu sau đây: a) hệ thống đèn tín hiệu giao thông đường bộ; b) hệ thống giám sát bảo đảm an ninh, trật tự, an toàn giao thông đường bộ; c) hệ thống quản lý dữ liệu thiết bị giám sát hành trình và thiết bị ghi nhận hình ảnh người lái xe; d) hệ thống camera trên tuyến giao thông, trong đô thị; đ) thiết bị thông minh hỗ trợ chỉ huy, điều khiển giao thông đường bộ; thiết bị phục vụ công tác điều khiển giao thông, tuần tra, kiểm soát và điều tra giải quyết tai nạn giao thông đường bộ tại hiện trường; e) trung tâm quản lý hệ thống giao thông thông minh; g) công trình kiểm soát tải trọng xe cơ giới, hệ thống thiết bị kỹ thuật nghiệp vụ kiểm tra tải trọng xe cơ giới; h) cơ sở dữ liệu khác theo quy định tại khoản 1 điều 7 của luật này. 5. bộ trưởng bộ công an ban hành quy chuẩn kỹ thuật quốc gia về trung tâm chỉ huy giao thông; quy định việc xây dựng, quản lý, hoạt động của trung tâm chỉ huy giao thông.']","**Nguồn văn bản:** 168_2024_ND-CP_619502

**Tên văn bản:** Nghị định Quy định xử phạt vi phạm hành chính về trật tự, an toàn giao thông trong lĩnh vực giao thông đường bộ; trừ điểm, phục hồi điểm giấy phép lái xe

**Điều 7:** Xử phạt, trừ điểm giấy phép lái của người điều khiển xe mô tô, xe gắn máy, các loại xe tương tự xe mô tô và các loại xe tương tự xe gắn máy vi phạm quy tắc giao thông đường bộ

**Nội dung:**

1. Phạt tiền từ 200.000 đồng đến 400.000 đồng đối với người điều khiển xe thực hiện một trong các hành vi vi phạm sau đây:

	g) Không sử dụng đèn chiếu sáng trong thời gian từ 18 giờ ngày hôm trước đến 06 giờ ngày hôm sau hoặc khi có sương mù, khói, bụi, trời mưa, thời tiết xấu làm hạn chế tầm nhìn.

	h) Tránh xe không đúng quy định; sử dụng đèn chiếu xa khi gặp người đi bộ qua đường hoặc khi đi trên đoạn đường qua khu dân cư có hệ thống chiếu sáng đang hoạt động hoặc khi gặp xe đi ngược chiều (trừ trường hợp dải phân cách có khả năng chống chói) hoặc khi chuyển hướng xe tại nơi đường giao nhau; không nhường đường cho xe đi ngược chiều theo quy định tại nơi đường hẹp, đường dốc, nơi có chướng ngại vật.


**Tóm lại:**  Trong khu vực đô thị, khi gặp người đi bộ qua đường, khi đi trên đoạn đường có hệ thống chiếu sáng đang hoạt động, khi gặp xe đi ngược chiều (trừ trường hợp có dải phân cách chống chói) hoặc khi chuyển hướng xe tại nơi đường giao nhau, không được sử dụng đèn chiếu xa.  Ngoài ra, phải sử dụng đèn chiếu sáng trong thời gian từ 18 giờ ngày hôm trước đến 06 giờ ngày hôm sau hoặc khi có sương mù, khói, bụi, trời mưa, thời tiết xấu hạn chế tầm nhìn.
",Cấm sử dụng đèn pha trong khu vực đô thị để tránh gây chói mắt cho người tham gia giao thông khác.,0.9,0.43571012184781127,0.0,0.49999999995
17,Quy định mới về việc đỗ xe trên vỉa hè là gì?,"['1. phạt tiền từ 400.000 đồng đến 600.000 đồng đối với người điều khiển xe thực hiện một trong các hành vi vi phạm sau đây: a) không chấp hành hiệu lệnh, chỉ dẫn của biển báo hiệu, vạch kẻ đường, trừ các hành vi vi phạm quy định tại điểm a, điểm c, điểm d, điểm đ khoản 2; điểm a, điểm d, điểm đ, điểm e, điểm n, điểm o khoản 3; điểm a, điểm b, điểm đ, điểm e, điểm i, điểm k, điểm l khoản 4; điểm a, điểm b, điểm c, điểm d, điểm đ, điểm i, điểm k khoản 5; điểm a khoản 6; khoản 7; điểm b, điểm d khoản 9; điểm a khoản 10; điểm đ khoản 11 điều này; b) khi ra, vào vị trí dừng xe, đỗ xe không có tín hiệu báo cho người điều khiển phương tiện khác biết; c) không báo hiệu bằng đèn khẩn cấp hoặc không đặt biển cảnh báo “chú ý xe đỗ” theo quy định trong trường hợp gặp sự cố kỹ thuật (hoặc bất khả kháng khác) buộc phải đỗ xe chiếm một phần đường xe chạy hoặc tại nơi không được phép đỗ xe, trừ hành vi vi phạm quy định tại điểm c khoản 7 điều này; d) không gắn biển báo hiệu ở phía trước xe kéo, phía sau xe được kéo; điều khiển xe kéo rơ moóc không có biển báo hiệu theo quy định; đ) sử dụng còi trong thời gian từ 22 giờ ngày hôm trước đến 05 giờ ngày hôm sau trong khu đông dân cư, khu vực cơ sở khám bệnh, chữa bệnh, trừ các xe ưu tiên đang đi làm nhiệm vụ theo quy định. 2. phạt tiền từ 600.000 đồng đến 800.000 đồng đối với người điều khiển xe thực hiện một trong các hành vi vi phạm sau đây: a) chuyển làn đường không đúng nơi cho phép hoặc không có tín hiệu báo trước hoặc chuyển làn đường không đúng quy định “mỗi lần chuyển làn đường chỉ được phép chuyển sang một làn đường liền kề”, trừ các hành vi vi phạm quy định tại điểm g khoản 5 điều này; b) chở người trên buồng lái quá số lượng quy định; c) không tuân thủ các quy định về nhường đường tại nơi đường bộ giao nhau, trừ các hành vi vi phạm quy định tại điểm n, điểm o khoản 5 điều này; d) dừng xe, đỗ xe trên phần đường xe chạy ở đoạn đường ngoài đô thị nơi có lề đường rộng; dừng xe, đỗ xe không sát mép đường phía bên phải theo chiều đi ở nơi đường có lề đường hẹp hoặc không có lề đường; dừng xe, đỗ xe ngược với chiều lưu thông của làn đường; dừng xe, đỗ xe trên dải phân cách cố định ở giữa hai phần đường xe chạy; đỗ xe trên dốc không chèn bánh; đ) dừng xe không sát theo lề đường, vỉa hè phía bên phải theo chiều đi hoặc bánh xe gần nhất cách lề đường, vỉa hè quá 0,25 mét; dừng xe trên đường dành riêng cho xe buýt; dừng xe trên miệng cống thoát nước, miệng hầm của đường điện thoại, điện cao thế, chỗ dành riêng cho xe chữa cháy lấy nước; rời vị trí lái, tắt máy khi dừng xe (trừ trường hợp rời khỏi vị trí lái để đóng, mở cửa xe, xếp dỡ hàng hóa, kiểm tra kỹ thuật xe) hoặc rời vị trí lái khi dừng xe nhưng không sử dụng phanh đỗ xe (hoặc thực hiện biện pháp an toàn khác); dừng xe, đỗ xe không đúng vị trí quy định ở những đoạn có bố trí nơi dừng xe, đỗ xe; dừng xe, đỗ xe trên phần đường dành cho người đi bộ qua đường; dừng xe nơi có biển “cấm dừng xe và đỗ xe”, trừ hành vi vi phạm quy định tại điểm đ khoản 4, điểm c khoản 7 điều này. 3. phạt tiền từ 800.000 đồng đến 1.000.000 đồng đối với người điều khiển xe thực hiện một trong các hành vi vi phạm sau đây: a) điều khiển xe chạy quá tốc độ quy định từ 05 km/h đến dưới 10 km/h; b) sử dụng còi, rú ga liên tục; sử dụng còi hơi, sử dụng đèn chiếu xa khi gặp người đi bộ qua đường hoặc khi đi trên đoạn đường qua khu dân cư có hệ thống chiếu sáng đang hoạt động hoặc khi gặp xe đi ngược chiều (trừ trường hợp dải phân cách có khả năng chống chói) hoặc khi chuyển hướng xe tại nơi đường giao nhau, trừ các xe ưu tiên đang đi làm nhiệm vụ theo quy định; c) chuyển hướng không quan sát hoặc không bảo đảm khoảng cách an toàn với xe phía sau hoặc không giảm tốc độ hoặc không có tín hiệu báo hướng rẽ hoặc có tín hiệu báo hướng rẽ nhưng không sử dụng liên tục trong quá trình chuyển hướng (trừ trường hợp điều khiển xe đi theo hướng cong của đoạn đường bộ ở nơi đường không giao nhau cùng mức); d) không tuân thủ các quy định về dừng xe, đỗ xe tại nơi đường bộ giao nhau cùng mức với đường sắt; dừng xe, đỗ xe trong phạm vi bảo vệ công trình đường sắt, phạm vi an toàn của đường sắt; đ) dừng xe, đỗ xe tại vị trí: nơi đường bộ giao nhau hoặc trong phạm vi 05 mét tính từ mép đường giao nhau; điểm đón, trả khách; trước cổng hoặc trong phạm vi 05 mét hai bên cổng trụ sở cơ quan, tổ chức có bố trí đường cho xe ra, vào; nơi phần đường có bề rộng chỉ đủ cho một làn xe cơ giới; che khuất biển báo hiệu đường bộ, đèn tín hiệu giao thông; nơi mở dải phân cách giữa; cách xe ô tô đang đỗ ngược chiều dưới 20 mét trên đường phố hẹp, dưới 40 mét trên đường có một làn xe cơ giới trên một chiều đường; e) đỗ xe không sát theo lề đường, vỉa hè phía bên phải theo chiều đi hoặc bánh xe gần nhất cách lề đường, vỉa hè quá 0,25 mét; đỗ xe trên đường dành riêng cho xe buýt; đỗ xe trên miệng cống thoát nước, miệng hầm của đường điện thoại, điện cao thế, chỗ dành riêng cho xe chữa cháy lấy nước; đỗ, để xe ở vỉa hè trái quy định của pháp luật; đỗ xe nơi có biển “cấm đỗ xe” hoặc biển “cấm dừng xe và đỗ xe”, trừ hành vi vi phạm quy định tại điểm đ khoản 4, điểm c khoản 7 điều này; g) không sử dụng hoặc sử dụng không đủ đèn chiếu sáng trong thời gian từ 18 giờ ngày hôm trước đến 06 giờ ngày hôm sau hoặc khi có sương mù, khói, bụi, trời mưa, thời tiết xấu làm hạn chế tầm nhìn; h) điều khiển xe ô tô kéo theo xe khác, vật khác (trừ trường hợp kéo theo một rơ moóc, sơ mi rơ moóc hoặc một xe ô tô, xe máy chuyên dùng khác khi xe này không tự chạy được); điều khiển xe ô tô đẩy xe khác, vật khác; điều khiển xe kéo rơ moóc, sơ mi rơ moóc kéo thêm rơ moóc hoặc xe khác, vật khác; không nối chắc chắn, an toàn giữa xe kéo và xe được kéo khi kéo nhau; i) chở người trên xe được kéo, trừ người điều khiển; k) không thắt dây đai an toàn khi điều khiển xe chạy trên đường; l) chở người trên xe ô tô không thắt dây đai an toàn (tại vị trí có trang bị dây đai an toàn) khi xe đang chạy; m) chở trẻ em dưới 10 tuổi và chiều cao dưới 1,35 mét trên xe ô tô ngồi cùng hàng ghế với người lái xe (trừ loại xe ô tô chỉ có một hàng ghế) hoặc không sử dụng thiết bị an toàn phù hợp cho trẻ em theo quy định; n) chạy trong hầm đường bộ không sử dụng đèn chiếu sáng gần; o) điều khiển xe chạy dưới tốc độ tối thiểu trên đoạn đường bộ có quy định tốc độ tối thiểu cho phép; p) điều khiển xe chạy tốc độ thấp hơn các xe khác đi cùng chiều mà không đi về làn đường bên phải chiều đi của mình, trừ trường hợp các xe khác đi cùng chiều chạy quá tốc độ quy định. 4. phạt tiền từ 2.000.000 đồng đến 3.000.000 đồng đối với người điều khiển xe thực hiện một trong các hành vi vi phạm sau đây: a) điều khiển xe không đủ điều kiện đã thu phí theo hình thức điện tử tự động không dừng (xe không gắn thẻ đầu cuối) đi vào làn đường dành riêng thu phí theo hình thức điện tử tự động không dừng tại các trạm thu phí; b) dừng xe, đỗ xe tại vị trí: bên trái đường một chiều hoặc bên trái (theo hướng lưu thông) của đường đôi; trên đoạn đường cong hoặc gần đầu dốc nơi tầm nhìn bị che khuất; trên cầu (trừ trường hợp tổ chức giao thông cho phép), gầm cầu vượt (trừ những nơi cho phép dừng xe, đỗ xe), song song với một xe khác đang dừng, đỗ, trừ hành vi vi phạm quy định tại điểm c khoản 7 điều này; c) không thực hiện biện pháp bảo đảm an toàn theo quy định khi xe ô tô bị hư hỏng ngay tại nơi đường bộ giao nhau cùng mức với đường sắt; d) không nhường đường cho xe xin vượt khi có đủ điều kiện an toàn; đ) lùi xe, quay đầu xe trong hầm đường bộ; dừng xe, đỗ xe trong hầm đường bộ không đúng nơi quy định; không có báo hiệu bằng đèn khẩn cấp, không đặt biển cảnh báo ""chú ý xe đỗ"" (hoặc đèn cảnh báo) về phía sau xe khoảng cách đảm bảo an toàn khi dừng xe, đỗ xe trong hầm đường bộ trong trường hợp gặp sự cố kỹ thuật hoặc bất khả kháng khác buộc phải dừng xe, đỗ xe; e) lùi xe ở đường một chiều, đường có biển “cấm đi ngược chiều”, khu vực cấm dừng, trên phần đường dành cho người đi bộ qua đường, nơi đường bộ giao nhau, nơi đường bộ giao nhau cùng mức với đường sắt, nơi tầm nhìn bị che khuất; lùi xe không quan sát hai bên, phía sau xe hoặc không có tín hiệu lùi xe, trừ hành vi vi phạm quy định tại điểm đ khoản 11 điều này; g) điều khiển xe có liên quan trực tiếp đến vụ tai nạn giao thông mà không dừng ngay phương tiện, không giữ nguyên hiện trường, không trợ giúp người bị nạn, trừ hành vi vi phạm quy định tại khoản 8 điều này; h) xe được quyền ưu tiên lắp đặt, sử dụng thiết bị phát tín hiệu ưu tiên không đúng quy định hoặc sử dụng thiết bị phát tín hiệu ưu tiên mà không có giấy phép của cơ quan có thẩm quyền cấp hoặc có giấy phép của cơ quan có thẩm quyền cấp nhưng không còn giá trị sử dụng theo quy định; i) quay đầu xe ở phần đường dành cho người đi bộ qua đường, trên cầu, đầu cầu, gầm cầu vượt, ngầm, tại nơi đường bộ giao nhau cùng mức với đường sắt, đường hẹp, đường dốc, đoạn đường cong tầm nhìn bị che khuất, trên đường một chiều, trừ khi có hiệu lệnh của người điều khiển giao thông hoặc chỉ dẫn của biển báo hiệu tạm thời hoặc tổ chức giao thông tại những khu vực này có bố trí nơi quay đầu xe; k) quay đầu xe tại nơi có biển báo hiệu có nội dung cấm quay đầu đối với loại phương tiện đang điều khiển; điều khiển xe rẽ trái tại nơi có biển báo hiệu có nội dung cấm rẽ trái đối với loại phương tiện đang điều khiển; điều khiển xe rẽ phải tại nơi có biển báo hiệu có nội dung cấm rẽ phải đối với loại phương tiện đang điều khiển; l) không giữ khoảng cách an toàn để xảy ra va chạm với xe chạy liền trước hoặc không giữ khoảng cách theo quy định của biển báo hiệu “cự ly tối thiểu giữa hai xe”, trừ các hành vi vi phạm quy định tại điểm d khoản 5 điều này. 5. phạt tiền từ 4.000.000 đồng đến 6.000.000 đồng đối với người điều khiển xe thực hiện một trong các hành vi vi phạm sau đây: a) vượt xe trong những trường hợp không được vượt, vượt xe tại đoạn đường có biển báo hiệu có nội dung cấm vượt (đối với loại phương tiện đang điều khiển); không có tín hiệu trước khi vượt hoặc có tín hiệu vượt xe nhưng không sử dụng trong suốt quá trình vượt xe; vượt bên phải xe khác trong trường hợp không được phép; b) điều khiển xe không đi bên phải theo chiều đi của mình; đi không đúng phần đường hoặc làn đường quy định (làn cùng chiều hoặc làn ngược chiều) trừ hành vi quy định tại điểm a khoản 4 điều này; điều khiển xe đi qua dải phân cách cố định ở giữa hai phần đường xe chạy; c) tránh xe đi ngược chiều không đúng quy định (trừ hành vi vi phạm sử dụng đèn chiếu xa khi tránh xe đi ngược chiều quy định tại điểm b khoản 3 điều này); không nhường đường cho xe đi ngược chiều theo quy định tại nơi đường hẹp, đường dốc, nơi có chướng ngại vật; d) không tuân thủ quy định khi vào hoặc ra đường cao tốc; điều khiển xe chạy ở làn dừng xe khẩn cấp hoặc phần lề đường của đường cao tốc; không tuân thủ quy định về khoảng cách an toàn đối với xe chạy liền trước khi chạy trên đường cao tốc; đ) điều khiển xe chạy quá tốc độ quy định từ 10 km/h đến 20 km/h; e) xe không được quyền ưu tiên lắp đặt, sử dụng thiết bị phát tín hiệu của xe được quyền ưu tiên; g) chuyển làn đường không đúng nơi cho phép hoặc không có tín hiệu báo trước hoặc chuyển làn đường không đúng quy định “mỗi lần chuyển làn đường chỉ được phép chuyển sang một làn đường liền kề” khi chạy trên đường cao tốc; h) dùng tay cầm và sử dụng điện thoại hoặc các thiết bị điện tử khác khi điều khiển phương tiện tham gia giao thông đang di chuyển trên đường bộ; i) đi vào khu vực cấm, đường có biển báo hiệu có nội dung cấm đi vào đối với loại phương tiện đang điều khiển, trừ các hành vi vi phạm quy định tại điểm d khoản 9, điểm đ khoản 11 điều này, hành vi bị cấm đi vào công trình thủy lợi và các trường hợp xe ưu tiên đang đi làm nhiệm vụ khẩn cấp theo quy định; k) dừng xe, đỗ xe, quay đầu xe trái quy định gây ùn tắc giao thông; l) chuyển hướng không nhường quyền đi trước cho: người đi bộ, xe lăn của người khuyết tật qua đường tại nơi có vạch kẻ đường dành cho người đi bộ; xe thô sơ đang đi trên phần đường dành cho xe thô sơ; m) chuyển hướng không nhường đường cho: các xe đi ngược chiều; người đi bộ, xe thô sơ đang qua đường tại nơi không có vạch kẻ đường cho người đi bộ; n) không giảm tốc độ (hoặc dừng lại) và nhường đường khi điều khiển xe đi từ đường không ưu tiên ra đường ưu tiên, từ đường nhánh ra đường chính; o) không giảm tốc độ và nhường đường cho xe đi đến từ bên phải tại nơi đường giao nhau không có báo hiệu đi theo vòng xuyến; không giảm tốc độ và nhường đường cho xe đi đến từ bên trái tại nơi đường giao nhau có báo hiệu đi theo vòng xuyến; p) chở người trên thùng xe trái quy định; chở người trên nóc xe; để người đu bám ở cửa xe, bên ngoài thành xe khi xe đang chạy; q) mở cửa xe, để cửa xe mở không bảo đảm an toàn. 6. phạt tiền từ 6.000.000 đồng đến 8.000.000 đồng đối với người điều khiển xe thực hiện một trong các hành vi vi phạm sau đây: a) điều khiển xe chạy quá tốc độ quy định trên 20 km/h đến 35 km/h; b) không nhường đường hoặc gây cản trở xe được quyền ưu tiên đang phát tín hiệu ưu tiên đi làm nhiệm vụ; c) điều khiển xe trên đường mà trong máu hoặc hơi thở có nồng độ cồn nhưng chưa vượt quá 50 miligam/100 mililít máu hoặc chưa vượt quá 0,25 miligam/1 lít khí thở; d) điều khiển xe đi trên vỉa hè, trừ trường hợp điều khiển xe đi qua vỉa hè để vào nhà, cơ quan. 7. phạt tiền từ 12.000.000 đồng đến 14.000.000 đồng đối với người điều khiển xe thực hiện một trong các hành vi vi phạm sau đây: a) điều khiển xe chạy quá tốc độ quy định trên 35 km/h; b) điều khiển xe chở người bốn bánh có gắn động cơ, xe chở hàng bốn bánh có gắn động cơ đi vào đường cao tốc; c) dừng xe, đỗ xe trên đường cao tốc không đúng nơi quy định; không có báo hiệu bằng đèn khẩn cấp khi gặp sự cố kỹ thuật hoặc bất khả kháng khác buộc phải dừng xe, đỗ xe ở làn dừng xe khẩn cấp trên đường cao tốc; không có báo hiệu bằng đèn khẩn cấp, không đặt biển cảnh báo “chú ý xe đỗ” (hoặc đèn cảnh báo) về phía sau xe khoảng cách tối thiểu 150 mét khi dừng xe, đỗ xe trong trường hợp gặp sự cố kỹ thuật hoặc bất khả kháng khác buộc phải dừng xe, đỗ xe trên một phần làn đường xe chạy trên đường cao tốc. 8. phạt tiền từ 16.000.000 đồng đến 18.000.000 đồng đối với người điều khiển xe thực hiện hành vi vi phạm gây tai nạn giao thông không dừng ngay phương tiện, không giữ nguyên hiện trường, không trợ giúp người bị nạn, không ở lại hiện trường hoặc không đến trình báo ngay với cơ quan công an, ủy ban nhân dân nơi gần nhất. 9. phạt tiền từ 18.000.000 đồng đến 20.000.000 đồng đối với người điều khiển xe thực hiện một trong các hành vi vi phạm sau đây: a) điều khiển xe trên đường mà trong máu hoặc hơi thở có nồng độ cồn vượt quá 50 miligam đến 80 miligam/100 mililít máu hoặc vượt quá 0,25 miligam đến 0,4 miligam/1 lít khí thở; b) không chấp hành hiệu lệnh của đèn tín hiệu giao thông; c) không chấp hành hiệu lệnh, hướng dẫn của người điều khiển giao thông hoặc người kiểm soát giao thông; d) đi ngược chiều của đường một chiều, đi ngược chiều trên đường có biển ""cấm đi ngược chiều”, trừ các hành vi vi phạm quy định tại điểm đ khoản 11 điều này và các trường hợp xe ưu tiên đang đi làm nhiệm vụ khẩn cấp theo quy định. 10. phạt tiền từ 20.000.000 đồng đến 22.000.000 đồng đối với người điều khiển xe thực hiện một trong các hành vi vi phạm sau đây: a) điều khiển xe không quan sát, giảm tốc độ hoặc dừng lại để bảo đảm an toàn theo quy định mà gây tai nạn giao thông; điều khiển xe chạy quá tốc độ quy định gây tai nạn giao thông; dừng xe, đỗ xe, quay đầu xe, lùi xe, tránh xe, vượt xe, chuyển hướng, chuyển làn đường không đúng quy định gây tai nạn giao thông; không đi đúng phần đường, làn đường, không giữ khoảng cách an toàn giữa hai xe theo quy định gây tai nạn giao thông hoặc đi vào đường có biển báo hiệu có nội dung cấm đi vào đối với loại phương tiện đang điều khiển gây tai nạn giao thông, trừ các hành vi vi phạm quy định tại điểm đ khoản 11 điều này; b) vi phạm quy định tại một trong các điểm, khoản sau của điều này mà gây tai nạn giao thông: điểm a, điểm b, điểm c, điểm d, điểm đ khoản 1; điểm c khoản 2; điểm b, điểm g, điểm h, điểm n, điểm o, điểm p, khoản 3; điểm a, điểm c, điểm d khoản 4; điểm c, điểm d, điểm e, điểm h, điểm n, điểm o, điểm q khoản 5; điểm b khoản 7; điểm b, điểm c, điểm d khoản 9 điều này. 11. phạt tiền từ 30.000.000 đồng đến 40.000.000 đồng đối với người điều khiển xe thực hiện một trong các hành vi vi phạm sau đây: a) điều khiển xe trên đường mà trong máu hoặc hơi thở có nồng độ cồn vượt quá 80 miligam/100 mililít máu hoặc vượt quá 0,4 miligam/1 lít khí thở; b) không chấp hành yêu cầu kiểm tra về nồng độ cồn của người thi hành công vụ; c) điều khiển xe trên đường mà trong cơ thể có chất ma túy hoặc chất kích thích khác mà pháp luật cấm sử dụng; d) không chấp hành yêu cầu kiểm tra về chất ma túy hoặc chất kích thích khác mà pháp luật cấm sử dụng của người thi hành công vụ; đ) điều khiển xe đi ngược chiều trên đường cao tốc, lùi xe trên đường cao tốc, quay đầu xe trên đường cao tốc, trừ các xe ưu tiên đang đi làm nhiệm vụ khẩn cấp theo quy định. 12. phạt tiền từ 40.000.000 đồng đến 50.000.000 đồng đối với người điều khiển xe thực hiện hành vi điều khiển xe lạng lách, đánh võng trên đường bộ; chạy quá tốc độ đuổi nhau trên đường bộ; dùng chân điều khiển vô lăng xe khi xe đang chạy trên đường bộ. 13. phạt tiền từ 50.000.000 đồng đến 70.000.000 đồng đối với người điều khiển xe thực hiện hành vi vi phạm quy định tại khoản 12 điều này mà gây tai nạn giao thông. 14. tịch thu phương tiện đối với người điều khiển xe tái phạm hành vi điều khiển xe lạng lách, đánh võng quy định tại khoản 12 điều này. 15. ngoài việc bị phạt tiền, người điều khiển xe thực hiện hành vi vi phạm còn bị áp dụng các hình thức xử phạt bổ sung sau đây: a) thực hiện hành vi quy định tại điểm e khoản 5 điều này còn bị tịch thu thiết bị phát tín hiệu ưu tiên lắp đặt, sử dụng trái quy định; b) thực hiện hành vi quy định tại khoản 12 điều này bị tước quyền sử dụng giấy phép lái xe từ 10 tháng đến 12 tháng; c) thực hiện hành vi quy định tại điểm a, điểm b, điểm c, điểm d khoản 11; khoản 13; khoản 14 điều này bị tước quyền sử dụng giấy phép lái xe từ 22 tháng đến 24 tháng. 16. ngoài việc bị áp dụng hình thức xử phạt, người điều khiển xe thực hiện hành vi vi phạm còn bị trừ điểm giấy phép lái xe như sau: a) thực hiện hành vi quy định tại điểm h, điểm i khoản 3; điểm a, điểm b, điểm c, điểm d, điểm đ, điểm g khoản 4; điểm a, điểm b, điểm c, điểm d, điểm đ, điểm e, điểm g, điểm i, điểm k, điểm n, điểm o khoản 5 điều này bị trừ điểm giấy phép lái xe 02 điểm; b) thực hiện hành vi quy định tại điểm h khoản 5; khoản 6; điểm b khoản 7; điểm b, điểm c, điểm d khoản 9 điều này bị trừ điểm giấy phép lái xe 04 điểm; c) thực hiện hành vi quy định tại điểm p khoản 5; điểm a, điểm c khoản 7; khoản 8 điều này bị trừ điểm giấy phép lái xe 06 điểm; d) thực hiện hành vi quy định tại điểm a khoản 9, khoản 10, điểm đ khoản 11 điều này bị trừ điểm giấy phép lái xe 10 điểm.', '1. phạt tiền từ 100.000 đồng đến 200.000 đồng đối với người điều khiển xe thực hiện một trong các hành vi vi phạm sau đây: a) không đi bên phải theo chiều đi của mình, đi không đúng phần đường quy định; b) dừng xe đột ngột; chuyển hướng không báo hiệu trước; c) không chấp hành hiệu lệnh hoặc chỉ dẫn của biển báo hiệu, vạch kẻ đường, trừ các hành vi vi phạm quy định tại điểm đ khoản 2, điểm c khoản 3 điều này; d) vượt bên phải trong các trường hợp không được phép; đ) dừng xe, đỗ xe trên phần đường xe chạy ở đoạn đường ngoài đô thị nơi có lề đường; e) chạy trong hầm đường bộ không bật đèn hoặc không có vật phát sáng báo hiệu; dừng xe, đỗ xe trong hầm đường bộ không đúng nơi quy định; quay đầu xe trong hầm đường bộ; g) điều khiển xe đạp, xe đạp máy đi dàn hàng ngang từ 03 xe trở lên, xe thô sơ khác đi dàn hàng ngang từ 02 xe trở lên; h) người điều khiển xe đạp, xe đạp máy sử dụng ô (dù), dùng tay cầm và sử dụng điện thoại hoặc các thiết bị điện tử khác; chở người ngồi trên xe đạp, xe đạp máy sử dụng ô (dù); i) điều khiển xe thô sơ trong thời gian từ 18 giờ ngày hôm trước đến 06 giờ ngày hôm sau không sử dụng đèn hoặc không có báo hiệu ở phía trước và phía sau xe; k) để xe ở lòng đường, vỉa hè trái phép; đỗ xe ở lòng đường gây cản trở giao thông, đỗ xe trên cầu gây cản trở giao thông; l) không tuân thủ các quy định về dừng xe, đỗ xe tại nơi đường bộ giao nhau cùng mức với đường sắt; m) dùng xe đẩy làm quầy hàng lưu động trên đường gây cản trở giao thông; n) không giảm tốc độ (hoặc dừng lại) và nhường đường khi điều khiển xe đi từ đường không ưu tiên ra đường ưu tiên, từ đường nhánh ra đường chính; o) xe đạp, xe đạp máy, xe xích lô chở quá số người quy định, trừ trường hợp chở người bệnh đi cấp cứu; p) điều khiển xe trên đường mà trong máu hoặc hơi thở có nồng độ cồn nhưng chưa vượt quá 50 miligam/100 mililít máu hoặc chưa vượt quá 0,25 miligam/1 lít khí thở. 2. phạt tiền từ 150.000 đồng đến 250.000 đồng đối với người điều khiển xe thực hiện một trong các hành vi vi phạm sau đây: a) điều khiển xe đạp, xe đạp máy buông cả hai tay; chuyển hướng đột ngột trước đầu xe cơ giới đang chạy; dùng chân điều khiển xe đạp, xe đạp máy; b) không chấp hành hiệu lệnh, chỉ dẫn của người điều khiển giao thông hoặc người kiểm soát giao thông; c) người đang điều khiển xe hoặc chở người ngồi trên xe bám, kéo, đẩy xe khác, vật khác, mang vác vật cồng kềnh; điều khiển xe kéo theo xe khác, vật khác; d) không nhường đường cho xe xin vượt khi có đủ điều kiện an toàn hoặc gây cản trở đối với xe cơ giới xin vượt, gây cản trở xe ưu tiên; đ) không chấp hành hiệu lệnh của đèn tín hiệu giao thông. 3. phạt tiền từ 300.000 đồng đến 400.000 đồng đối với người điều khiển xe thực hiện một trong các hành vi vi phạm sau đây: a) điều khiển xe lạng lách, đánh võng; đuổi nhau trên đường; b) đi xe bằng một bánh đối với xe đạp, xe đạp máy; đi xe bằng hai bánh đối với xe xích lô; c) đi vào khu vực cấm, đường có biển báo hiệu nội dung cấm đi vào đối với loại phương tiện đang điều khiển; đi ngược chiều đường của đường một chiều, đường có biển “cấm đi ngược chiều""; d) điều khiển xe trên đường mà trong máu hoặc hơi thở có nồng độ cồn vượt quá 50 miligam đến 80 miligam/100 mililít máu hoặc vượt quá 0,25 miligam đến 0,4 miligam/1 lít khí thở. 4. phạt tiền từ 400.000 đồng đến 600.000 đồng đối với người điều khiển xe thực hiện một trong các hành vi vi phạm sau đây: a) gây tai nạn giao thông không dừng ngay phương tiện, không giữ nguyên hiện trường, không trợ giúp người bị nạn, không ở lại hiện trường hoặc không đến trình báo ngay với cơ quan công an, ủy ban nhân dân nơi gần nhất; b) điều khiển xe trên đường mà trong máu hoặc hơi thở có nồng độ cồn vượt quá 80 miligam/100 mililít máu hoặc vượt quá 0,4 miligam/1 lít khí thở; c) không chấp hành yêu cầu kiểm tra về nồng độ cồn của người thi hành công vụ; d) người điều khiển xe đạp máy không đội “mũ bảo hiểm cho người đi mô tô, xe máy” hoặc đội “mũ bảo hiểm cho người đi mô tô, xe máy” không cài quai đúng quy cách khi tham gia giao thông trên đường bộ; đ) chở người ngồi trên xe đạp máy không đội “mũ bảo hiểm cho người đi mô tô, xe máy” hoặc đội “mũ bảo hiểm cho người đi mô tô, xe máy” không cài quai đúng quy cách, trừ trường hợp chở người bệnh đi cấp cứu, trẻ em dưới 06 tuổi, áp giải người có hành vi vi phạm pháp luật. 5. phạt tiền từ 800.000 đồng đến 1.200.000 đồng đối với người điều khiển xe đi vào đường cao tốc, trừ phương tiện phục vụ việc quản lý, bảo trì đường cao tốc.', '1. dừng xe là trạng thái đứng yên tạm thời của xe trong một khoảng thời gian cần thiết đủ để cho người lên xe, xuống xe, xếp dỡ hàng hóa, kiểm tra kỹ thuật xe hoặc hoạt động khác. khi dừng xe không được tắt máy và không được rời khỏi vị trí lái, trừ trường hợp rời khỏi vị trí lái để đóng, mở cửa xe, xếp dỡ hàng hóa, kiểm tra kỹ thuật xe nhưng phải sử dụng phanh đỗ xe hoặc thực hiện biện pháp an toàn khác. 2. đỗ xe là trạng thái đứng yên của xe không giới hạn thời gian. khi đỗ xe, người điều khiển phương tiện tham gia giao thông đường bộ chỉ được rời khỏi xe khi đã sử dụng phanh đỗ xe hoặc thực hiện biện pháp an toàn khác. xe đỗ trên đoạn đường dốc phải đánh lái về phía lề đường, chèn bánh. 3. người điều khiển phương tiện tham gia giao thông đường bộ khi dừng xe, đỗ xe trên đường phải thực hiện các quy định sau đây: a) có tín hiệu báo cho người điều khiển phương tiện tham gia giao thông đường bộ khác biết khi ra, vào vị trí dừng xe, đỗ xe; b) không làm ảnh hưởng đến người đi bộ và các phương tiện tham gia giao thông đường bộ. 4. người điều khiển phương tiện tham gia giao thông đường bộ không được dừng xe, đỗ xe tại các vị trí sau đây: a) bên trái đường một chiều; b) trên đoạn đường cong hoặc gần đầu dốc mà tầm nhìn bị che khuất; c) trên cầu, trừ những trường hợp tổ chức giao thông cho phép; d) gầm cầu vượt, trừ những nơi cho phép dừng xe, đỗ xe; đ) song song cùng chiều với một xe khác đang dừng, đỗ trên đường; e) cách xe ô tô đang đỗ ngược chiều dưới 20 mét trên đường phố hẹp, \ndưới 40 mét trên đường có một làn xe cơ giới trên một chiều đường; g) trên phần đường dành cho người đi bộ qua đường; h) nơi đường giao nhau và trong phạm vi 05 mét tính từ mép đường giao nhau; i) điểm đón, trả khách; k) trước cổng và trong phạm vi 05 mét hai bên cổng trụ sở cơ quan, tổ chức có bố trí đường cho xe ra, vào; l) tại nơi phần đường có chiều rộng chỉ đủ cho một làn xe cơ giới; m) trong phạm vi an toàn của đường sắt; n) che khuất biển báo hiệu đường bộ, đèn tín hiệu giao thông; o) trên đường dành riêng cho xe buýt, trên miệng cống thoát nước, miệng hầm của đường điện thoại, điện cao thế, chỗ dành riêng cho xe chữa cháy lấy nước; trên lòng đường, vỉa hè trái quy định của pháp luật. 5. trên đường bộ, người điều khiển phương tiện tham gia giao thông đường bộ chỉ được dừng xe, đỗ xe ở nơi có lề đường rộng hoặc khu đất ở bên ngoài phần đường xe chạy; trường hợp lề đường hẹp hoặc không có lề đường thì chỉ được dừng xe, đỗ xe sát mép đường phía bên phải theo chiều đi của mình. 6. trên đường phố, người điều khiển phương tiện tham gia giao thông đường bộ chỉ được dừng xe, đỗ xe sát theo lề đường, vỉa hè phía bên phải theo chiều đi của mình; bánh xe gần nhất không được cách xa lề đường, vỉa hè quá 0,25 mét và không gây cản trở, nguy hiểm cho người và phương tiện tham gia giao thông đường bộ. 7. trong trường hợp gặp sự cố kỹ thuật hoặc bất khả kháng khác buộc phải đỗ xe, khi đỗ xe chiếm một phần đường xe chạy hoặc tại nơi không được phép đỗ, phải có báo hiệu bằng đèn khẩn cấp hoặc đặt biển cảnh báo về phía sau xe để người điều khiển phương tiện tham gia giao thông đường bộ khác biết.']","**Nguồn văn bản:** 36_2024_QH15_444251

**Tên văn bản:** Luật Trật tự, an toàn giao thông đường bộ

**Điều 18:** Dừng xe, đỗ xe

**Nội dung:**

4. Người điều khiển phương tiện tham gia giao thông đường bộ không được dừng xe, đỗ xe tại các vị trí sau đây:

	a) Bên trái đường một chiều.

	b) Trên đoạn đường cong hoặc gần đầu dốc mà tầm nhìn bị che khuất.

	c) Trên cầu, trừ những trường hợp tổ chức giao thông cho phép.

	d) Gầm cầu vượt, trừ những nơi cho phép dừng xe, đỗ xe.

	đ) Song song cùng chiều với một xe khác đang dừng, đỗ trên đường.

	e) Cách xe ô tô đang đỗ ngược chiều dưới 20 mét trên đường phố hẹp, dưới 40 mét trên đường có một làn xe cơ giới trên một chiều đường.

	g) Trên phần đường dành cho người đi bộ qua đường.

	h) Nơi đường giao nhau và trong phạm vi 05 mét tính từ mép đường giao nhau.

	i) Điểm đón, trả khách.

	k) Trước cổng và trong phạm vi 05 mét hai bên cổng trụ sở cơ quan, tổ chức có bố trí đường cho xe ra, vào.

	l) Tại nơi phần đường có chiều rộng chỉ đủ cho một làn xe cơ giới.

	m) Trong phạm vi an toàn của đường sắt.

	n) Che khuất biển báo hiệu đường bộ, đèn tín hiệu giao thông.

	o) Trên đường dành riêng cho xe buýt, trên miệng cống thoát nước, miệng hầm của đường điện thoại, điện cao thế, chỗ dành riêng cho xe chữa cháy lấy nước; trên lòng đường, vỉa hè trái quy định của pháp luật.


5. Trên đường bộ, người điều khiển phương tiện tham gia giao thông đường bộ chỉ được dừng xe, đỗ xe ở nơi có lề đường rộng hoặc khu đất ở bên ngoài phần đường xe chạy; trường hợp lề đường hẹp hoặc không có lề đường thì chỉ được dừng xe, đỗ xe sát mép đường phía bên phải theo chiều đi của mình.

6. Trên đường phố, người điều khiển phương tiện tham gia giao thông đường bộ chỉ được dừng xe, đỗ xe sát theo lề đường, vỉa hè phía bên phải theo chiều đi của mình; bánh xe gần nhất không được cách xa lề đường, vỉa hè quá 0,25 mét và không gây cản trở, nguy hiểm cho người và phương tiện tham gia giao thông đường bộ.


**Tóm lại:** Đỗ xe trên vỉa hè là bị cấm, trừ trường hợp đỗ xe sát lề đường, vỉa hè phía bên phải theo chiều đi, bánh xe gần nhất không được cách xa lề đường, vỉa hè quá 0,25 mét và không gây cản trở giao thông.  Việc đỗ xe trên lòng đường, vỉa hè trái quy định của pháp luật sẽ bị xử phạt.
","Cấm đỗ xe trên vỉa hè, trừ những nơi có biển báo cho phép.",1.0,0.4056240086000793,1.0,0.9999999999
18,Luật Giao thông Đường bộ 2025 có quy định gì về việc sử dụng làn đường dành cho xe buýt?,"['1. đơn vị kinh doanh vận tải có giấy phép kinh doanh vận tải bằng ô tô, trong đó có loại hình kinh doanh vận tải hành khách công cộng bằng xe buýt thì được tham gia kinh doanh vận tải công cộng bằng xe buýt trên các tuyến xe buýt nội tỉnh, tuyến xe buýt liên tỉnh. 2. xe ô tô kinh doanh vận tải hành khách công cộng bằng xe buýt a) phải có chỗ ưu tiên cho người khuyết tật, người cao tuổi và phụ nữ mang thai và trẻ em dưới 6 tuổi; b) phải có phù hiệu “xe buýt” theo mẫu số 03 phụ lục xiii kèm theo nghị định này và được dán cố định tại góc trên bên phải ngay sát phía dưới vị trí của tem kiểm định, mặt trong kính chắn gió phía trước của xe; phải được niêm yết đầy đủ các thông tin trên xe; c) vị trí, số chỗ ngồi, chỗ đứng cho hành khách và các quy định kỹ thuật khác đối với xe buýt theo quy chuẩn kỹ thuật quốc gia về chất lượng an toàn kỹ thuật và bảo vệ môi trường đối với xe ô tô. 3. sở giao thông vận tải thực hiện nội dung quản lý tuyến đối với tuyến xe buýt nội tỉnh, tuyến xe buýt liên tỉnh a) xây dựng, điều chỉnh, bổ sung và công bố danh mục mạng lưới tuyến, biểu đồ chạy xe trên các tuyến, giá vé; b) đề xuất, xây dựng và báo cáo ủy ban nhân dân cấp tỉnh: về các chính sách hỗ trợ của nhà nước về khuyến khích phát triển vận tải hành khách công cộng bằng xe buýt trên địa bàn địa phương; việc tổ chức đấu thầu, tiêu chí để đặt hàng khai thác đối với tuyến xe buýt trong danh mục mạng lưới tuyến đã công bố theo quy định của pháp luật về thầu; tổ chức đặt hàng khai thác đối với tuyến xe buýt liên tỉnh và tuyến xe buýt có sử dụng xe ô tô thoáng nóc chở khách du lịch không được hỗ trợ kinh phí hoạt động từ ngân sách nhà nước trong danh mục mạng lưới tuyến đã công bố; c) xây dựng, bảo trì và quản lý kết cấu hạ tầng phục vụ hoạt động xe buýt; quyết định tiêu chí kỹ thuật, vị trí điểm đầu, điểm cuối và điểm dừng của tuyến xe buýt trên địa bàn địa phương; d) theo dõi, tổng hợp kết quả hoạt động vận tải của các đơn vị kinh doanh vận tải trên tuyến; thống kê sản lượng hành khách. 4. đơn vị kinh doanh vận tải hành khách bằng xe buýt thực hiện lưu trữ lệnh vận chuyển như sau: a) lưu trữ lệnh vận chuyển của các chuyến xe đã thực hiện (không được hỗ trợ kinh phí hoạt động từ ngân sách nhà nước) trong thời hạn ít nhất là 03 năm; b) lưu trữ lệnh vận chuyển của các chuyến xe đã thực hiện (được hỗ trợ kinh phí hoạt động từ ngân sách nhà nước) theo thời hạn tài liệu kế toán phải lưu trữ được quy định tại khoản 5 điều 41 luật kế toán năm 2015. 5. xe buýt được ưu tiên bố trí nơi dừng, đỗ để đón, trả khách tại các bến xe, nhà ga, sân bay, bến cảng, khu du lịch, điểm du lịch, cơ sở lưu trú du lịch, điểm tham quan du lịch, địa điểm văn hóa, thể thao, trung tâm thương mại, đầu mối giao thông và các địa điểm kết nối với các phương thức vận tải khác; được ưu tiên hoạt động khi tổ chức giao thông tại đô thị.', 'thực hiện trách nhiệm của chủ phương tiện giao thông đường bộ theo quy định của pháp luật về thanh toán điện tử giao thông đường bộ, pháp luật về thu phí sử dụng đường cao tốc.', '1. dừng xe là trạng thái đứng yên tạm thời của xe trong một khoảng thời gian cần thiết đủ để cho người lên xe, xuống xe, xếp dỡ hàng hóa, kiểm tra kỹ thuật xe hoặc hoạt động khác. khi dừng xe không được tắt máy và không được rời khỏi vị trí lái, trừ trường hợp rời khỏi vị trí lái để đóng, mở cửa xe, xếp dỡ hàng hóa, kiểm tra kỹ thuật xe nhưng phải sử dụng phanh đỗ xe hoặc thực hiện biện pháp an toàn khác. 2. đỗ xe là trạng thái đứng yên của xe không giới hạn thời gian. khi đỗ xe, người điều khiển phương tiện tham gia giao thông đường bộ chỉ được rời khỏi xe khi đã sử dụng phanh đỗ xe hoặc thực hiện biện pháp an toàn khác. xe đỗ trên đoạn đường dốc phải đánh lái về phía lề đường, chèn bánh. 3. người điều khiển phương tiện tham gia giao thông đường bộ khi dừng xe, đỗ xe trên đường phải thực hiện các quy định sau đây: a) có tín hiệu báo cho người điều khiển phương tiện tham gia giao thông đường bộ khác biết khi ra, vào vị trí dừng xe, đỗ xe; b) không làm ảnh hưởng đến người đi bộ và các phương tiện tham gia giao thông đường bộ. 4. người điều khiển phương tiện tham gia giao thông đường bộ không được dừng xe, đỗ xe tại các vị trí sau đây: a) bên trái đường một chiều; b) trên đoạn đường cong hoặc gần đầu dốc mà tầm nhìn bị che khuất; c) trên cầu, trừ những trường hợp tổ chức giao thông cho phép; d) gầm cầu vượt, trừ những nơi cho phép dừng xe, đỗ xe; đ) song song cùng chiều với một xe khác đang dừng, đỗ trên đường; e) cách xe ô tô đang đỗ ngược chiều dưới 20 mét trên đường phố hẹp, \ndưới 40 mét trên đường có một làn xe cơ giới trên một chiều đường; g) trên phần đường dành cho người đi bộ qua đường; h) nơi đường giao nhau và trong phạm vi 05 mét tính từ mép đường giao nhau; i) điểm đón, trả khách; k) trước cổng và trong phạm vi 05 mét hai bên cổng trụ sở cơ quan, tổ chức có bố trí đường cho xe ra, vào; l) tại nơi phần đường có chiều rộng chỉ đủ cho một làn xe cơ giới; m) trong phạm vi an toàn của đường sắt; n) che khuất biển báo hiệu đường bộ, đèn tín hiệu giao thông; o) trên đường dành riêng cho xe buýt, trên miệng cống thoát nước, miệng hầm của đường điện thoại, điện cao thế, chỗ dành riêng cho xe chữa cháy lấy nước; trên lòng đường, vỉa hè trái quy định của pháp luật. 5. trên đường bộ, người điều khiển phương tiện tham gia giao thông đường bộ chỉ được dừng xe, đỗ xe ở nơi có lề đường rộng hoặc khu đất ở bên ngoài phần đường xe chạy; trường hợp lề đường hẹp hoặc không có lề đường thì chỉ được dừng xe, đỗ xe sát mép đường phía bên phải theo chiều đi của mình. 6. trên đường phố, người điều khiển phương tiện tham gia giao thông đường bộ chỉ được dừng xe, đỗ xe sát theo lề đường, vỉa hè phía bên phải theo chiều đi của mình; bánh xe gần nhất không được cách xa lề đường, vỉa hè quá 0,25 mét và không gây cản trở, nguy hiểm cho người và phương tiện tham gia giao thông đường bộ. 7. trong trường hợp gặp sự cố kỹ thuật hoặc bất khả kháng khác buộc phải đỗ xe, khi đỗ xe chiếm một phần đường xe chạy hoặc tại nơi không được phép đỗ, phải có báo hiệu bằng đèn khẩn cấp hoặc đặt biển cảnh báo về phía sau xe để người điều khiển phương tiện tham gia giao thông đường bộ khác biết.', '1. yêu cầu đơn vị kinh doanh vận tải cung cấp dịch vụ theo tiêu chuẩn chất lượng dịch vụ đã công bố và niêm yết. 2. yêu cầu nhân viên phục vụ trên xe xuất vé đúng loại sau khi trả tiền; giữ vé suốt hành trình và xuất trình vé khi người có thẩm quyền kiểm tra. 3. nhận lại số tiền vé theo quy định tại khoản 4 điều 14 của thông tư này. 4. khiếu nại, kiến nghị, phản ánh những hành vi vi phạm quy định về quản lý vận tải của đơn vị kinh doanh vận tải, người lái xe, nhân viên phục vụ trên xe và yêu cầu bồi thường thiệt hại (nếu có). 5. chấp hành các quy định để đảm bảo an toàn, an ninh trật tự trên xe; lên, xuống xe tại bến xe hoặc các điểm dừng đón, trả khách theo quy định. 6. thực hiện các trách nhiệm khác theo quy định tại luật đường bộ, luật trật tự, an toàn giao thông đường bộ. mục 3. kinh doanh vận tải hành khách công cộng bằng xe buýt']","**Nguồn văn bản:** 36_2024_QH15_444251

**Tên văn bản:** Luật Trật tự, an toàn giao thông đường bộ

**Điều 18:** Dừng xe, đỗ xe

**Nội dung:**

4. Người điều khiển phương tiện tham gia giao thông đường bộ không được dừng xe, đỗ xe tại các vị trí sau đây:

	a) Bên trái đường một chiều.

	b) Trên đoạn đường cong hoặc gần đầu dốc mà tầm nhìn bị che khuất.

	c) Trên cầu, trừ những trường hợp tổ chức giao thông cho phép.

	d) Gầm cầu vượt, trừ những nơi cho phép dừng xe, đỗ xe.

	đ) Song song cùng chiều với một xe khác đang dừng, đỗ trên đường.

	e) Cách xe ô tô đang đỗ ngược chiều dưới 20 mét trên đường phố hẹp, dưới 40 mét trên đường có một làn xe cơ giới trên một chiều đường.

	g) Trên phần đường dành cho người đi bộ qua đường.

	h) Nơi đường giao nhau và trong phạm vi 05 mét tính từ mép đường giao nhau.

	i) Điểm đón, trả khách.

	k) Trước cổng và trong phạm vi 05 mét hai bên cổng trụ sở cơ quan, tổ chức có bố trí đường cho xe ra, vào.

	l) Tại nơi phần đường có chiều rộng chỉ đủ cho một làn xe cơ giới.

	m) Trong phạm vi an toàn của đường sắt.

	n) Che khuất biển báo hiệu đường bộ, đèn tín hiệu giao thông.

	o) Trên đường dành riêng cho xe buýt, trên miệng cống thoát nước, miệng hầm của đường điện thoại, điện cao thế, chỗ dành riêng cho xe chữa cháy lấy nước; trên lòng đường, vỉa hè trái quy định của pháp luật.


**Tóm lại:** Theo Luật Giao thông Đường bộ, không được dừng, đỗ xe trên đường dành riêng cho xe buýt.
",Cấm các phương tiện không phải xe buýt sử dụng làn đường dành riêng cho xe buýt trong giờ cao điểm.,0.9411764705882353,0.48388133941708333,0.0,0.0
19,"Quy định mới về việc sử dụng còi xe trong khu vực bệnh viện, trường học là gì?","['1. phạt tiền từ 200.000 đồng đến 400.000 đồng đối với người điều khiển xe thực hiện một trong các hành vi vi phạm sau đây: a) không chấp hành hiệu lệnh, chỉ dẫn của biển báo hiệu, vạch kẻ đường, trừ các hành vi vi phạm quy định tại điểm b, điểm d, điểm e khoản 2; điểm a, điểm c, điểm d, điểm h khoản 3; điểm a, điểm b, điểm c, điểm d khoản 4; điểm b, điểm d khoản 6; điểm a, điểm b, điểm c khoản 7; điểm a khoản 8; điểm b khoản 9; điểm a khoản 10 điều này; b) không có tín hiệu trước khi vượt hoặc có tín hiệu vượt xe nhưng không sử dụng trong suốt quá trình vượt xe; c) lùi xe mô tô ba bánh không quan sát hai bên, phía sau xe hoặc không có tín hiệu lùi xe; d) chở người ngồi trên xe sử dụng ô (dù); đ) không tuân thủ các quy định về nhường đường tại nơi đường giao nhau, trừ các hành vi vi phạm quy định tại điểm c, điểm d khoản 6 điều này; e) chuyển làn đường không đúng nơi cho phép hoặc không có tín hiệu báo trước hoặc chuyển làn đường không đúng quy định “mỗi lần chuyển làn đường chỉ được phép chuyển sang một làn đường liền kề”; g) không sử dụng đèn chiếu sáng trong thời gian từ 18 giờ ngày hôm trước đến 06 giờ ngày hôm sau hoặc khi có sương mù, khói, bụi, trời mưa, thời tiết xấu làm hạn chế tầm nhìn; h) tránh xe không đúng quy định; sử dụng đèn chiếu xa khi gặp người đi bộ qua đường hoặc khi đi trên đoạn đường qua khu dân cư có hệ thống chiếu sáng đang hoạt động hoặc khi gặp xe đi ngược chiều (trừ trường hợp dải phân cách có khả năng chống chói) hoặc khi chuyển hướng xe tại nơi đường giao nhau; không nhường đường cho xe đi ngược chiều theo quy định tại nơi đường hẹp, đường dốc, nơi có chướng ngại vật; i) sử dụng còi trong thời gian từ 22 giờ ngày hôm trước đến 05 giờ ngày hôm sau trong khu đông dân cư, khu vực cơ sở khám bệnh, chữa bệnh, trừ các xe ưu tiên đang đi làm nhiệm vụ theo quy định; k) điều khiển xe chạy dưới tốc độ tối thiểu trên đoạn đường bộ có quy định tốc độ tối thiểu cho phép. 2. phạt tiền từ 400.000 đồng đến 600.000 đồng đối với người điều khiển xe thực hiện một trong các hành vi vi phạm sau đây: a) dừng xe, đỗ xe trên phần đường xe chạy ở đoạn đường ngoài đô thị nơi có lề đường; b) điều khiển xe chạy quá tốc độ quy định từ 05 km/h đến dưới 10 km/h; c) điều khiển xe chạy tốc độ thấp mà không đi bên phải phần đường xe chạy gây cản trở giao thông; d) dừng xe, đỗ xe ở lòng đường gây cản trở giao thông; tụ tập từ 03 xe trở lên ở lòng đường, trong hầm đường bộ; đỗ, để xe ở lòng đường, vỉa hè trái phép; đ) xe không được quyền ưu tiên lắp đặt, sử dụng thiết bị phát tín hiệu của xe được quyền ưu tiên; e) dừng xe, đỗ xe trên điểm đón, trả khách, nơi đường bộ giao nhau, trên phần đường dành cho người đi bộ qua đường; dừng xe nơi có biển “cấm dừng xe và đỗ xe”; đỗ xe tại nơi có biển “cấm đỗ xe” hoặc biển “cấm dừng xe và đỗ xe”; không tuân thủ các quy định về dừng xe, đỗ xe tại nơi đường bộ giao nhau cùng mức với đường sắt; dừng xe, đỗ xe trong phạm vi hành lang an toàn giao thông đường sắt; g) chở theo 02 người trên xe, trừ trường hợp chở người bệnh đi cấp cứu, trẻ em dưới 12 tuổi, người già yếu hoặc người khuyết tật, áp giải người có hành vi vi phạm pháp luật; h) không đội “mũ bảo hiểm cho người đi mô tô, xe máy” hoặc đội “mũ bảo hiểm cho người đi mô tô, xe máy” không cài quai đúng quy cách khi điều khiển xe tham gia giao thông trên đường bộ; i) chở người ngồi trên xe không đội “mũ bảo hiểm cho người đi mô tô, xe máy” hoặc đội “mũ bảo hiểm cho người đi mô tô, xe máy” không cài quai đúng quy cách, trừ trường hợp chở người bệnh đi cấp cứu, trẻ em dưới 06 tuổi, áp giải người có hành vi vi phạm pháp luật; k) quay đầu xe tại nơi không được quay đầu xe, trừ hành vi vi phạm quy định tại điểm d khoản 4 điều này. 3. phạt tiền từ 600.000 đồng đến 800.000 đồng đối với người điều khiển xe thực hiện một trong các hành vi vi phạm sau đây: a) chuyển hướng không quan sát hoặc không bảo đảm khoảng cách an toàn với xe phía sau hoặc không giảm tốc độ hoặc không có tín hiệu báo hướng rẽ hoặc có tín hiệu báo hướng rẽ nhưng không sử dụng liên tục trong quá trình chuyển hướng (trừ trường hợp điều khiển xe đi theo hướng cong của đoạn đường bộ ở nơi đường không giao nhau cùng mức); điều khiển xe rẽ trái tại nơi có biển báo hiệu có nội dung cấm rẽ trái đối với loại phương tiện đang điều khiển; điều khiển xe rẽ phải tại nơi có biển báo hiệu có nội dung cấm rẽ phải đối với loại phương tiện đang điều khiển; b) chở theo từ 03 người trở lên trên xe; c) dừng xe, đỗ xe trên cầu; d) điều khiển xe không đi bên phải theo chiều đi của mình; đi không đúng phần đường, làn đường quy định (làn cùng chiều hoặc làn ngược chiều); điều khiển xe đi qua dải phân cách cố định ở giữa hai phần đường xe chạy; đ) vượt bên phải trong trường hợp không được phép; e) người đang điều khiển xe hoặc chở người ngồi trên xe bám, kéo, đẩy xe khác, vật khác, dẫn dắt vật nuôi, mang vác vật cồng kềnh; chở người đứng trên yên, giá đèo hàng hoặc ngồi trên tay lái của xe; g) điều khiển xe kéo theo xe khác, vật khác; h) chạy trong hầm đường bộ không sử dụng đèn chiếu sáng gần; i) không giữ khoảng cách an toàn để xảy ra va chạm với xe chạy liền trước hoặc không giữ khoảng cách theo quy định của biển báo hiệu “cự ly tối thiểu giữa hai xe”; k) điều khiển xe chạy dàn hàng ngang từ 03 xe trở lên; l) xe được quyền ưu tiên lắp đặt, sử dụng thiết bị phát tín hiệu ưu tiên không đúng quy định hoặc sử dụng thiết bị phát tín hiệu ưu tiên mà không có giấy phép của cơ quan có thẩm quyền cấp hoặc có giấy phép của cơ quan có thẩm quyền cấp nhưng không còn giá trị sử dụng theo quy định. 4. phạt tiền từ 800.000 đồng đến 1.000.000 đồng đối với người điều khiển xe thực hiện một trong các hành vi vi phạm sau đây: a) điều khiển xe chạy quá tốc độ quy định từ 10 km/h đến 20 km/h; b) dừng xe, đỗ xe trong hầm đường bộ không đúng nơi quy định; c) vượt xe trong những trường hợp không được vượt, vượt xe tại đoạn đường có biển báo hiệu có nội dung cấm vượt đối với loại phương tiện đang điều khiển, trừ các hành vi vi phạm quy định tại điểm đ khoản 3 điều này; d) quay đầu xe trong hầm đường bộ; đ) người đang điều khiển xe sử dụng ô (dù), thiết bị âm thanh (trừ thiết bị trợ thính), dùng tay cầm và sử dụng điện thoại hoặc các thiết bị điện tử khác. 5. phạt tiền từ 1.000.000 đồng đến 2.000.000 đồng đối với người điều khiển xe thực hiện một trong các hành vi vi phạm sau đây: a) điều khiển xe có liên quan trực tiếp đến vụ tai nạn giao thông mà không dừng ngay phương tiện, không giữ nguyên hiện trường, không trợ giúp người bị nạn, trừ hành vi vi phạm quy định tại điểm c khoản 9 điều này; b) chuyển hướng không nhường quyền đi trước cho: người đi bộ, xe lăn của người khuyết tật qua đường tại nơi có vạch kẻ đường dành cho người đi bộ; xe thô sơ đang đi trên phần đường dành cho xe thô sơ; c) chuyển hướng không nhường đường cho: các xe đi ngược chiều; người đi bộ, xe thô sơ đang qua đường tại nơi không có vạch kẻ đường cho người đi bộ. 6. phạt tiền từ 2.000.000 đồng đến 3.000.000 đồng đối với người điều khiển xe thực hiện một trong các hành vi vi phạm sau đây: a) điều khiển xe trên đường mà trong máu hoặc hơi thở có nồng độ cồn nhưng chưa vượt quá 50 miligam/100 mililít máu hoặc chưa vượt quá 0,25 miligam/1 lít khí thở; b) đi vào khu vực cấm, đường có biển báo hiệu có nội dung cấm đi vào đối với loại phương tiện đang điều khiển, trừ các hành vi vi phạm quy định tại điểm a, điểm b khoản 7 điều này và các trường hợp xe ưu tiên đang đi làm nhiệm vụ khẩn cấp theo quy định; c) không giảm tốc độ (hoặc dừng lại) và nhường đường khi điều khiển xe đi từ đường không ưu tiên ra đường ưu tiên, từ đường nhánh ra đường chính; d) không giảm tốc độ và nhường đường cho xe đi đến từ bên phải tại nơi đường giao nhau không có báo hiệu đi theo vòng xuyến; không giảm tốc độ và nhường đường cho xe đi đến từ bên trái tại nơi đường giao nhau có báo hiệu đi theo vòng xuyến. 7. phạt tiền từ 4.000.000 đồng đến 6.000.000 đồng đối với người điều khiển xe thực hiện một trong các hành vi vi phạm sau đây: a) đi ngược chiều của đường một chiều, đi ngược chiều trên đường có biển “cấm đi ngược chiều”, trừ hành vi vi phạm quy định tại điểm b khoản này và các trường hợp xe ưu tiên đang đi làm nhiệm vụ khẩn cấp theo quy định; điều khiển xe đi trên vỉa hè, trừ trường hợp điều khiển xe đi qua vỉa hè để vào nhà, cơ quan; b) điều khiển xe đi vào đường cao tốc, trừ xe phục vụ việc quản lý, bảo trì đường cao tốc; c) không chấp hành hiệu lệnh của đèn tín hiệu giao thông; d) không chấp hành hiệu lệnh, hướng dẫn của người điều khiển giao thông hoặc người kiểm soát giao thông; đ) không nhường đường hoặc gây cản trở xe được quyền ưu tiên đang phát tín hiệu ưu tiên đi làm nhiệm vụ. 8. phạt tiền từ 6.000.000 đồng đến 8.000.000 đồng đối với người điều khiển xe thực hiện một trong các hành vi vi phạm sau đây: a) điều khiển xe chạy quá tốc độ quy định trên 20 km/h; b) điều khiển xe trên đường mà trong máu hoặc hơi thở có nồng độ cồn vượt quá 50 miligam đến 80 miligam/100 mililít máu hoặc vượt quá 0,25 miligam đến 0,4 miligam/1 lít khí thở. 9. phạt tiền từ 8.000.000 đồng đến 10.000.000 đồng đối với người điều khiển xe thực hiện một trong các hành vi vi phạm sau đây: a) điều khiển xe lạng lách, đánh võng trên đường bộ; sử dụng chân chống hoặc vật khác quệt xuống đường khi xe đang chạy; b) điều khiển xe thành nhóm từ 02 xe trở lên chạy quá tốc độ quy định; c) gây tai nạn giao thông không dừng ngay phương tiện, không giữ nguyên hiện trường, không trợ giúp người bị nạn, không ở lại hiện trường hoặc không đến trình báo ngay với cơ quan công an, ủy ban nhân dân nơi gần nhất; d) điều khiển xe trên đường mà trong máu hoặc hơi thở có nồng độ cồn vượt quá 80 miligam/100 mililít máu hoặc vượt quá 0,4 miligam/1 lít khí thở; đ) không chấp hành yêu cầu kiểm tra về nồng độ cồn của người thi hành công vụ; e) điều khiển xe trên đường mà trong cơ thể có chất ma túy hoặc chất kích thích khác mà pháp luật cấm sử dụng; g) không chấp hành yêu cầu kiểm tra về chất ma túy hoặc chất kích thích khác mà pháp luật cấm sử dụng của người thi hành công vụ; h) ngồi phía sau vòng tay qua người ngồi trước để điều khiển xe, trừ trường hợp chở trẻ em dưới 06 tuổi ngồi phía trước; i) điều khiển xe thành đoàn gây cản trở giao thông, trừ trường hợp được cơ quan có thẩm quyền cấp phép; k) sử dụng còi, rú ga (nẹt pô) liên tục trong khu đông dân cư, khu vực cơ sở khám bệnh, chữa bệnh, trừ các xe ưu tiên đang đi làm nhiệm vụ theo quy định. 10. phạt tiền từ 10.000.000 đồng đến 14.000.000 đồng đối với người điều khiển xe thực hiện một trong các hành vi vi phạm sau đây: a) điều khiển xe không quan sát, giảm tốc độ hoặc dừng lại để bảo đảm an toàn theo quy định mà gây tai nạn giao thông; điều khiển xe chạy quá tốc độ quy định gây tai nạn giao thông; đi vào đường cao tốc, dừng xe, đỗ xe, quay đầu xe, lùi xe, vượt xe, chuyển hướng, chuyển làn đường không đúng quy định gây tai nạn giao thông; không đi đúng phần đường, làn đường, không giữ khoảng cách an toàn giữa hai xe theo quy định gây tai nạn giao thông hoặc đi vào đường có biển báo hiệu có nội dung cấm đi vào đối với loại phương tiện đang điều khiển, đi ngược chiều của đường một chiều, đi ngược chiều trên đường có biển “cấm đi ngược chiều” gây tai nạn giao thông; b) vi phạm quy định tại một trong các điểm, khoản sau của điều này mà gây tai nạn giao thông: điểm a, điểm d, điểm đ, điểm g, điểm h, điểm i, điểm k khoản 1; điểm c, điểm đ, điểm g khoản 2; điểm b, điểm e, điểm g, điểm h, điểm k khoản 3; điểm đ khoản 4; điểm c, điểm d khoản 6; điểm c, điểm d, điểm đ khoản 7; điểm a, điểm b, điểm h, điểm k khoản 9 điều này. 11. tịch thu phương tiện đối với người điều khiển xe thực hiện một trong các hành vi vi phạm sau đây: a) buông cả hai tay khi đang điều khiển xe; dùng chân điều khiển xe; ngồi về một bên điều khiển xe; nằm trên yên xe điều khiển xe; thay người điều khiển khi xe đang chạy; quay người về phía sau để điều khiển xe hoặc bịt mắt điều khiển xe; b) điều khiển xe chạy bằng một bánh đối với xe hai bánh, chạy bằng hai bánh đối với xe ba bánh; c) tái phạm hành vi điều khiển xe lạng lách, đánh võng quy định tại điểm a khoản 9 điều này. 12. ngoài việc bị áp dụng hình thức xử phạt chính, người điều khiển xe thực hiện hành vi vi phạm còn bị áp dụng các hình thức xử phạt bổ sung sau đây: a) thực hiện hành vi quy định tại điểm đ khoản 2 điều này còn bị tịch thu thiết bị phát tín hiệu ưu tiên lắp đặt, sử dụng trái quy định; b) thực hiện hành vi quy định tại điểm a, điểm b, điểm h, điểm i, điểm k khoản 9 điều này bị tước quyền sử dụng giấy phép lái xe từ 10 tháng đến 12 tháng; c) thực hiện hành vi quy định tại điểm d, điểm đ, điểm e, điểm g khoản 9; khoản 11 điều này bị tước quyền sử dụng giấy phép lái xe từ 22 tháng đến 24 tháng. 13. ngoài việc bị áp dụng hình thức xử phạt, người điều khiển xe thực hiện hành vi vi phạm còn bị trừ điểm giấy phép lái xe như sau: a) thực hiện hành vi quy định tại điểm b khoản 3; khoản 5; điểm b, điểm c, điểm d khoản 6; điểm a khoản 7 điều này bị trừ điểm giấy phép lái xe 02 điểm; b) thực hiện hành vi quy định tại điểm đ khoản 4; điểm a khoản 6; điểm c, điểm d, điểm đ khoản 7; điểm a khoản 8 điều này bị trừ điểm giấy phép lái xe 04 điểm; c) thực hiện hành vi quy định tại điểm b khoản 7, điểm c khoản 9 điều này bị trừ điểm giấy phép lái xe 06 điểm; d) thực hiện hành vi quy định tại điểm b khoản 8, khoản 10 điều này bị trừ điểm giấy phép lái xe 10 điểm.', '1. chỉ được sử dụng tín hiệu còi của phương tiện tham gia giao thông đường bộ trong các trường hợp sau đây: a) báo hiệu cho người tham gia giao thông đường bộ khi xuất hiện tình huống có thể mất an toàn giao thông; b) báo hiệu chuẩn bị vượt xe. 2. không sử dụng còi liên tục; không sử dụng còi có âm lượng không đúng quy định; không sử dụng còi trong thời gian từ 22 giờ ngày hôm trước đến 05 giờ ngày hôm sau trong khu đông dân cư, khu vực cơ sở khám bệnh, chữa bệnh, trừ xe ưu tiên.', '1. quy chuẩn kỹ thuật quốc gia về cơ sở vật chất kỹ thuật và vị trí cơ sở đăng kiểm xe cơ giới, cơ sở kiểm định khí thải xe mô tô, xe gắn máy. mã số: qcvn 103:2024/bgtvt. 2. quy chuẩn kỹ thuật quốc gia về cơ sở bảo hành, bảo dưỡng xe cơ giới. mã số: qcvn 121:2025/bgtvt. điều 2. 1. thông tư này có hiệu lực thi hành kể từ ngày 01 tháng 01 năm 2025. 2. bãi bỏ thông tư số 30/2019/tt-bgtvt ngày 28 tháng 8 năm 2019 của bộ trưởng bộ giao thông vận tải về việc ban hành quy chuẩn kỹ thuật quốc gia về đơn vị đăng kiểm xe cơ giới qcvn 103:2019/bgtvt. qcvn 103:2024/bgtvt quy chuẩn kỹ thuật quốc gia về cơ sở vật chất kỹ thuật và vị trí cơ sở đăng kiểm xe cơ giới, cơ sở kiểm định khí thải xe mô tô, xe gắn máy national technical regulations on technical facilities and location of vehicle inspection station, motorcycles and mopeds emission inspection stations lời nói đầu qcvn 103:2024/bgtvt do cục đăng kiểm việt nam biên soạn, vụ khoa học công nghệ và môi trường trình duyệt, bộ khoa học và công nghệ thẩm định, bộ trưởng bộ giao thông vận tải ban hành kèm theo thông tư số 50/2024/tt-bgtvt ngày 15 tháng 11 năm 2024 qcvn 103:2024/bgtvt thay thế cho qcvn 103:2019/bgtvt được ban hành bởi thông tư số 30/2019/tt-bgtvt ngày 28 tháng 8 năm 2019 của bộ trưởng bộ giao thông vận tải. quy chuẩn kỹ thuật quốc gia về cơ sở vật chất kỹ thuật và vị trí cơ sở đăng kiểm xe cơ giới, cơ sở kiểm định khí thải xe mô tô, xe gắn máy national technical regulations on technical facilities and location of vehicle inspection station, motorcycles and mopeds emission inspection stations i. quy định chung 1.1. phạm vi điều chỉnh quy chuẩn này quy định yêu cầu kỹ thuật về cơ sở vật chất và vị trí của cơ sở đăng kiểm xe cơ giới, cơ sở kiểm định khí thải xe mô tô, xe gắn máy. 1.2. đối tượng áp dụng quy chuẩn này áp dụng đối với tổ chức, cá nhân có liên quan đến yêu cầu kỹ thuật về cơ sở vật chất và vị trí của cơ sở đăng kiểm xe cơ giới, cơ sở kiểm định khí thải xe mô tô, xe gắn máy. quy chuẩn này không áp dụng đối với cơ sở đăng kiểm xe cơ giới, cơ sở kiểm định khí thải xe mô tô, xe gắn máy sử dụng vào mục đích quốc phòng, an ninh. 2. quy định về cơ sở vật chất kỹ thuật và vị trí cơ sở đăng kiểm xe cơ giới 2.1. yêu cầu chung 2.1.1. cơ sở vật chất kỹ thuật của cơ sở đăng kiểm bao gồm: mặt bằng; khu vực xe chờ; đường nội bộ; xưởng kiểm định; nhà văn phòng; dây chuyền kiểm định; vị trí kiểm tra; thiết bị, dụng cụ kiểm tra; thiết bị, dụng cụ hỗ trợ kiểm tra; hệ thống thông tin quản lý kiểm định; thông tin niêm yết và các hệ thống, thiết bị hỗ trợ việc kiểm định xe cơ giới. 2.1.2. có khu vực dành cho xe chờ vào kiểm định và xe chờ cấp kết quả kiểm định. các khu vực này không được sử dụng chung với khu vực kiểm tra. 2.1.3. hệ thống đường nội bộ cho xe cơ giới và khu vực đỗ xe được phủ bê tông nhựa hoặc bê tông xi măng; chiều rộng mặt đường (phần vật liệu phủ) không nhỏ hơn 3,0 mét. 2.1.4. có trang bị các hệ thống, thiết bị hỗ trợ, bao gồm: 2.1.4.1. hệ thống âm thanh để thông báo cho chủ xe; 2.1.4.2. màn hình hiển thị có kích thước tối thiểu 32 inch tại phòng chờ khách hàng để công khai quá trình hoạt động kiểm định ở các vị trí kiểm tra; 2.1.4.3. hệ thống camera, máy ảnh chụp ảnh xe cơ giới vào kiểm định có hiển thị thời gian chụp trên ảnh và có độ phân giải từ 1280x720 pixels trở lên; 2.1.4.4. thiết bị thông gió cưỡng bức ở vị trí kiểm tra khí thải nếu vị trí kiểm tra khí thải ở trong nhà xưởng. 2.1.5. các thiết bị kiểm tra tối thiểu gồm: 2.1.5.1. thiết bị kiểm tra phanh; 2.1.5.2. thiết bị đo độ trượt ngang của bánh xe; 2.1.5.3. thiết bị phân tích khí thải (phương tiện đo nồng độ các khí trong khí thải); 2.1.5.4. thiết bị đo độ khói; 2.1.5.5. thiết bị đo âm lượng (phương tiện đo độ ồn); 2.1.5.6. thiết bị kiểm tra đèn chiếu sáng phía trước; 2.1.5.7. thiết bị nêu tại điểm 2.1.5.3 không áp dụng với cơ sở đăng kiểm chỉ kiểm định xe trang bị động cơ cháy do nén (diessel) và xe điện; 2.1.5.8. thiết bị nêu tại điểm 2.1.5.4 không áp dụng với cơ sở đăng kiểm chỉ kiểm định xe trang bị động cơ cháy cưỡng bức và xe điện; 2.1.5.9. thiết bị nêu tại điểm 2.1.5.3, điểm 2.1.5.4, điểm 2.1.5.5 và điểm 2.1.5.6 có thể dùng chung cho các dây chuyền kiểm định; 2.1.5.10. trường hợp thiết bị kiểm tra đèn chiếu sáng phía trước dùng chung giữa các dây chuyền kiểm định thì phải được lắp đặt trên cùng một đường ray. 2.1.6. các thiết bị hỗ trợ kiểm tra tối thiểu gồm: 2.1.6.1. thiết bị hỗ trợ kiểm tra gầm; 2.1.6.2. kích nâng; 2.1.6.3. thiết bị nâng (cầu nâng) xe cơ giới hoặc hầm kiểm tra; 2.1.6.4. trường hợp sử dụng cầu nâng thay thế hầm kiểm tra thì không cần trang bị thiết bị tại điểm 2.1.6.1. 2.1.7. các dụng cụ kiểm tra tối thiểu gồm: 2.1.7.1. thước đo chiều dài (thước cuộn); 2.1.7.2. búa kiểm tra; 2.1.7.3. dụng cụ kiểm tra áp suất lốp; 2.1.7.4. đèn soi kiểm tra cầm tay; 2.1.7.5. các dụng cụ kiểm tra nêu tại điểm 2.1.7 được dùng chung cho các dây chuyền kiểm định. 2.1.8. các dụng cụ hỗ trợ kiểm tra tối thiểu gồm: 2.1.8.1. gương hoặc camera quan sát hỗ trợ kiểm tra đèn tín hiệu; 2.1.8.2. cục chèn bánh xe; 2.1.8.3. thanh, đòn hỗ trợ kiểm tra bánh xe; 2.1.8.4. các dụng cụ nêu tại điểm 2.1.8 được dùng chung cho các dây chuyền kiểm định. 2.1.9. thiết bị, dụng cụ để thực hiện kiểm định ngoài cơ sở đăng kiểm gồm: 2.1.9.1. thiết bị kiểm tra quy định tại điểm 2.1.5 (trừ điểm 2.1.5.1 và điểm 2.1.5.2); 2.1.9.2. kích nâng di động; 2.1.9.3. dụng cụ kiểm tra quy định tại điểm 2.1.7 và dụng cụ hỗ trợ kiểm tra quy định điểm 2.1.8 (trừ điểm 2.1.8.1); 2.1.9.4. dụng cụ đo tốc độ (để phục vụ cho việc kiểm tra hiệu quả phanh ở trên đường). 2.1.10. thiết bị kiểm tra được bố trí trong một hoặc nhiều xưởng kiểm định; riêng thiết bị phân tích khí thải và thiết bị đo độ khói có thể bố trí ngoài xưởng kiểm định. 2.1.11. tài liệu của thiết bị kiểm tra 2.1.11.1. đối với các thiết bị kiểm tra chưa qua sử dụng: 2.1.11.1.1. chứng nhận xuất xứ (certificate of origin - c/o) - không áp dụng với thiết bị được sản xuất trong nước; chứng nhận chất lượng của nhà sản xuất thiết bị (certificate of quality - c/q); 2.1.11.1.2. tài liệu hướng dẫn sử dụng (bản giấy hoặc bản điện tử) bằng tiếng việt trong đó có thể hiện thông số kỹ thuật và hướng dẫn sử dụng các tính năng của thiết bị; tài liệu chứng minh thiết bị kiểm tra phải thỏa mãn tối thiểu một trong các tiêu chuẩn tương ứng như: iso, oiml, iec, tcvn và đảm bảo các yêu cầu kỹ thuật đo lường theo văn bản kỹ thuật đo lường việt nam (đlvn). 2.1.11.2. đối với các thiết bị kiểm tra đã qua sử dụng: tài liệu hướng dẫn sử dụng (bản giấy hoặc bản điện tử) bằng tiếng việt trong đó có thể hiện thông số kỹ thuật và hướng dẫn sử dụng các tính năng của thiết bị. 2.1.12. các thiết bị kiểm tra gồm: thiết bị kiểm tra phanh, thiết bị đo độ trượt ngang của bánh xe, thiết bị đo độ khói phải được trang bị kèm theo bộ dụng cụ kiểm tra, đánh giá độ chính xác phù hợp với kiểu loại thiết bị theo quy định của nhà sản xuất. 2.1.13. sai số cho phép đối với các kích thước của thiết bị, kích thước lắp đặt thiết bị, dải đo, độ chính xác được xác định theo công bố của nhà sản xuất thiết bị nhưng không vượt quá giá trị giới hạn cho phép tương ứng quy định tại điểm 2.4.2 của quy chuẩn này. 2.1.14. mỗi cơ sở đăng kiểm có ít nhất một thiết bị kiểm tra phanh có chức năng kiểm tra thực tế được loại xe có kiểu dẫn động bốn bánh toàn thời gian (awd) hoạt động ở chế độ bốn bánh toàn thời gian. 2.1.15. trường hợp cơ sở đăng kiểm xe cơ giới được bố trí chung với bến xe, trạm dừng nghỉ thì khu vực xe chờ, đường nội bộ và nhà văn phòng có thể dùng chung với bến xe, trạm dừng nghỉ. 2.2. xưởng kiểm định, vị trí kiểm tra 2.2.1. xưởng kiểm định 2.2.1.1. đối với xưởng kiểm định chỉ có một dây chuyền kiểm định loại i: kích thước thông xe tối thiểu (dài x rộng x cao) là 30 x 4 x 3,5 (m). 2.2.1.2. đối với xưởng kiểm định chỉ có một dây chuyền kiểm định loại ii: kích thước thông xe tối thiểu (dài x rộng x cao) là 36 x 5 x 4,5 (m). 2.2.1.3. đối với xưởng kiểm định có bố trí nhiều dây chuyền kiểm định, kích thước thông xe tối thiểu phải đảm bảo: 2.2.1.3.1. khoảng cách giữa tâm hai dây chuyền kiểm định cạnh nhau không nhỏ hơn 4 m; 2.2.1.3.2. khoảng cách từ tâm các dây chuyền ngoài cùng đến mặt trong tường bao gần nhất (hoặc tới mép gần nhất công trình cố định) của xưởng kiểm định không nhỏ hơn 2,0 m; 2.2.1.3.3. chiều dài, chiều cao của kích thước thông xe tối thiểu với từng loại dây chuyền phải đáp ứng quy định tương ứng tại điểm 2.2.1.1 và điểm 2.2.1.2. 2.2.1.4. trong không gian giới hạn bởi kích thước thông xe tối thiểu nêu tại điểm 2.2.1.1, điểm 2.2.1.2 và điểm 2.2.1.3 không được bố trí vật cản hoặc công trình cố định ảnh hưởng tới sự di chuyển của phương tiện và thao tác của đăng kiểm viên trong quá trình kiểm định. 2.2.1.5. đối với trường hợp dây chuyền kiểm định bố trí tại nhiều xưởng kiểm định thì tổng chiều dài tối thiểu các xưởng kiểm định phải bằng chiều dài tương ứng với loại dây chuyền quy định tại điểm 2.2.1.1 và điểm 2.2.1.2. 2.2.1.6. nhà xưởng kiểm định được xây dựng đảm bảo kết cấu chắc chắn, có mái che, đảm bảo thông gió, chiếu sáng và không bị hắt nước vào thiết bị khi trời mưa. có sơn sọc màu vàng-đen được sơn theo quy cách bề rộng 10 cm, nghiêng 45 độ để cảnh báo tại nơi lắp đặt của các thiết bị kiểm tra (thiết bị kiểm tra phanh, thiết bị đo độ trượt ngang, hầm kiểm tra, thiết bị hỗ trợ kiểm tra gầm). các vị trí kiểm tra phải được đánh dấu bằng việc sơn đường viền màu vàng trên sàn nhà xưởng với chiều rộng đường viền là 10 cm. 2.2.2. yêu cầu về các vị trí kiểm tra 2.2.2.1. vị trí kiểm tra đèn chiếu sáng phía trước 2.2.2.1.1. đối với dây chuyền kiểm định loại i hình 1. vị trí kiểm tra đèn chiếu sáng phía trước đối với dây chuyền kiểm định loại i 2.2.2.1.1.1. vị trí kiểm tra đèn chiếu sáng phía trước được đánh dấu trên sàn với kích thước chiều dài tối thiểu 4,0 m, chiều rộng tối thiểu 2,5 m. vị trí này có thể nằm chồng lên vị trí kiểm tra khác; được xây dựng có độ phẳng (mặt phẳng đỗ xe hay còn gọi là phần diện tích bánh xe đi qua) không vượt quá ± 6 mm. các thiết bị được lắp đặt trong vị trí này phải đáp ứng yêu cầu về độ phẳng không vượt quá ± 6 mm (không kể khe hở làm việc của thiết bị hỗ trợ kiểm tra gầm); 2.2.2.1.1.2. đường ray để di chuyển thiết bị kiểm tra đèn chiếu sáng phía trước phải thẳng, có độ dài tối thiểu 4,0 m, được lắp đặt chắc chắn và song song với mặt phẳng đỗ xe đồng thời không bị xê dịch trong suốt hành trình di chuyển của thiết bị kiểm tra đèn chiếu sáng phía trước theo chiều dài đường ray; 2.2.2.1.1.3. trong không gian tương ứng với khoảng cách tối thiểu 1,0 m phía trước thiết bị kiểm tra đèn chiếu sáng phía trước không được có các vật cản ảnh hưởng đến quá trình kiểm tra đèn chiếu sáng phía trước (hình 1). 2.2.2.1.2. đối với dây chuyền kiểm định loại ii hình 2. vị trí kiểm tra đèn chiếu sáng phía trước đối với dây chuyền kiểm định loại ii 2.2.2.1.2.1. vị trí kiểm tra đèn chiếu sáng phía trước được đánh dấu trên sàn với kích thước chiều dài tối thiểu 12,0 m, chiều rộng tối thiểu 3,0 m. vị trí này có thể nằm chồng lên vị trí kiểm tra khác; được xây dựng có độ phẳng (mặt phẳng đỗ xe hay còn gọi là phần diện tích bánh xe đi qua) không vượt quá ± 6 mm. các thiết bị được lắp đặt trong vị trí này phải đáp ứng yêu cầu về độ phẳng không vượt quá ± 6 mm (không kể khe hở làm việc của thiết bị hỗ trợ kiểm tra gầm); 2.2.2.1.2.2. đường ray để di chuyển thiết bị kiểm tra đèn chiếu sáng phía trước phải thẳng, có độ dài tối thiểu 4,0 m, được lắp đặt chắc chắn và song song với mặt phẳng đỗ xe đồng thời không bị xê dịch trong suốt hành trình di chuyển của thiết bị kiểm tra đèn chiếu sáng phía trước theo chiều dài đường ray; 2.2.2.1.2.3. trong không gian tương ứng với khoảng cách tối thiểu 1,0 m phía trước thiết bị kiểm tra đèn chiếu sáng phía trước không được có các vật cản ảnh hưởng đến quá trình kiểm tra đèn chiếu sáng phía trước (hình 2). 2.2.2.2. vị trí kiểm tra phanh 2.2.2.2.1. đối với dây chuyền kiểm định loại i hình 3. vị trí kiểm tra phanh đối với dây chuyền kiểm định loại i 2.2.2.2.1.1. vị trí kiểm tra phanh được đánh dấu trên sàn với kích thước chiều dài tối thiểu 14,0 m, chiều rộng tối thiểu 3,5 m. thiết bị kiểm tra phanh phải được lắp đặt ở vị trí trung tâm theo chiều dọc của vị trí kiểm tra; 2.2.2.2.1.2. ở khoảng cách tối thiểu 2,1 m phía trước và phía sau của đường trung tâm bệ thử phanh phải được xây dựng có độ bằng phẳng không vượt quá ± 6 mm; 2.2.2.2.1.3. một phần của vị trí kiểm tra phanh có thể nằm bên ngoài xưởng kiểm định nhưng phải đảm bảo bệ thử phanh nằm trong nhà xưởng và không bị hắt nước khi trời mưa; 2.2.2.2.1.4. thiết bị kiểm tra phanh có thể lắp đặt tại khu vực hầm kiểm tra nhưng không được ảnh hưởng đến việc kiểm tra đèn chiếu sáng phía trước; 2.2.2.2.1.5. trường hợp lắp đặt bệ thử phanh ngoài hầm kiểm tra thì bất kỳ điểm nào của bệ thử phanh con lăn phải cách đầu hầm kiểm tra tối thiểu 0,6 m; 2.2.2.2.1.6. màn hình hiển thị thông tin điều khiển và giá trị kiểm tra được đặt ở vị trí dễ quan sát bằng mắt thường của người kiểm tra. 2.2.2.2.2. đối với dây chuyền kiểm định loại ii hình 4. vị trí kiểm tra phanh đối với dây chuyền kiểm định loại ii 2.2.2.2.2.1. vị trí kiểm tra phanh được đánh dấu trên sàn với kích thước chiều dài tối thiểu 22,0 m, chiều rộng tối thiểu 4,0 m. thiết bị kiểm tra phanh phải được lắp đặt ở vị trí trung tâm theo chiều dọc của vị trí kiểm tra; 2.2.2.2.2.2. ở khoảng cách tối thiểu 2,1 m phía trước và phía sau của đường trung tâm bệ thử phanh phải được xây dựng có độ bằng phẳng không vượt quá ± 6 mm; 2.2.2.2.2.3. một phần của vị trí kiểm tra phanh có thể nằm bên ngoài xưởng kiểm định nhưng phải đảm bảo bệ thử phanh nằm trong nhà xưởng và không bị hắt nước khi trời mưa; 2.2.2.2.2.4. thiết bị kiểm tra phanh có thể lắp đặt tại khu vực hầm kiểm tra nhưng không được ảnh hưởng đến việc kiểm tra đèn chiếu sáng phía trước; 2.2.2.2.2.5. trường hợp lắp đặt bệ thử phanh ngoài hầm kiểm tra thì bất kỳ điểm nào của bệ thử phanh con lăn phải cách đầu hầm kiểm tra tối thiểu 0,6 m; 2.2.2.2.2.6. màn hình hiển thị thông tin điều khiển và giá trị kiểm tra được đặt ở vị trí dễ quan sát bằng mắt thường của người kiểm tra. 2.2.2.3. vị trí kiểm tra gầm (hầm kiểm tra) hình 5. các phương án bố trí hầm kiểm tra 2.2.2.3.1. đối với dây chuyền kiểm định loại i 2.2.2.3.1.1. vị trí kiểm tra gầm được đánh dấu trên sàn; 2.2.2.3.1.2. chiều dài làm việc (l) hầm kiểm tra tối thiểu là 6,0 m; 2.2.2.3.1.3. chiều rộng (r1) làm việc hai vách của miệng hầm trong suốt chiều dài làm việc tối thiểu là 0,6 m và không quá 1,0 m. chiều rộng (r) đo được trên hai vách của thân hầm tối thiểu bằng chiều rộng hai vách của miệng hầm; 2.2.2.3.1.4. độ sâu làm việc (h) đo được trong suốt chiều dài làm việc tính từ điểm cao nhất miệng hầm kiểm tra tới mặt đáy sàn tối thiểu là 1,3 m và không lớn hơn 1,75 m. có thể sử dụng các miếng kê để đáp ứng yêu cầu về chiều cao này để đảm bảo việc kiểm tra; 2.2.2.3.1.5. có tối thiểu 2 lối lên xuống và đảm bảo không bị đọng nước; 2.2.2.3.1.6. có gờ bảo vệ bằng thép có chiều cao tối thiểu 50 mm so với nền sàn nhà xưởng và được sơn cảnh báo nguy hiểm; 2.2.2.3.1.7. có thiết bị hỗ trợ kiểm tra gầm phải được lắp đặt trong phạm vi chiều dài làm việc của hầm kiểm tra và khoảng cách từ điểm gần nhất của thiết bị hỗ trợ kiểm tra gầm đến mép trong của đầu hầm kiểm tra theo phương dọc tối thiểu 1,5 m. bề mặt làm việc của thiết bị hỗ trợ kiểm tra gầm phải có độ phẳng trong khoảng ± 6 mm với sàn nhà xưởng tại vị trí lắp đặt; 2.2.2.3.1.8. kích nâng được lắp đặt trên hầm kiểm tra đảm bảo các phần của kích nâng ở trạng thái chưa làm việc không được nhô cao quá so với gờ bảo vệ; khoảng cách từ điểm gần nhất của bàn nâng của kích nâng (khi kích nâng ở vị trí gần đầu hầm nhất) đến điểm mép trong của đầu hầm kiểm tra tối thiểu 1,5 m; 2.2.2.3.1.9. kích nâng và thiết bị hỗ trợ kiểm tra gầm được lắp đặt trong không gian tương ứng với chiều dài làm việc của hầm. 2.2.2.3.2. đối với dây chuyền kiểm định loại ii 2.2.2.3.2.1. vị trí kiểm tra gầm được đánh dấu trên sàn; 2.2.2.3.2.2. chiều dài làm việc hầm kiểm tra (l) tối thiểu là 12,0 m; 2.2.2.3.2.3. chiều rộng (r1) làm việc hai vách của miệng hầm trong suốt chiều dài làm việc tối thiểu là 0,7 m và không quá 1,05 m. chiều rộng (r) đo được trên hai vách của thân hầm tối thiểu bằng chiều rộng hai vách của miệng hầm; 2.2.2.3.2.4. độ sâu làm việc (h) đo được trong suốt chiều dài làm việc tính từ điểm cao nhất của miệng hầm kiểm tra tới mặt đáy sàn tối thiểu là 1,2 m và không lớn hơn 1,6 m (không tính đến chiều cao gờ bảo vệ). có thể sử dụng các miếng kê để đáp ứng yêu cầu về chiều cao này để đảm bảo việc kiểm tra; 2.2.2.3.2.5. có tối thiểu 2 lối lên xuống và đảm bảo không bị đọng nước; 2.2.2.3.2.6. có gờ bảo vệ bằng thép có chiều cao tối thiểu 50 mm so với nền sàn nhà xưởng và được sơn cảnh báo nguy hiểm; 2.2.2.3.2.7. có thiết bị hỗ trợ kiểm tra gầm phải được lắp đặt trong phạm vi chiều dài làm việc của hầm kiểm tra và khoảng cách từ điểm gần nhất của thiết bị hỗ trợ kiểm tra gầm đến mép trong của đầu hầm kiểm tra theo phương dọc tối thiểu 1,5 m. bề mặt làm việc của thiết bị hỗ trợ kiểm tra gầm phải có độ phẳng trong khoảng ± 6 mm với sàn nhà xưởng tại vị trí lắp đặt; 2.2.2.3.2.8. kích nâng được lắp đặt trên hầm kiểm tra đảm bảo các phần của kích nâng ở trạng thái chưa làm việc không được nhô cao quá so với gờ bảo vệ; khoảng cách từ điểm gần nhất của bàn nâng của kích nâng (khi kích nâng ở vị trí gần đầu hầm nhất) đến điểm mép trong của đầu hầm kiểm tra tối thiểu 1,5 m; 2.2.2.3.2.9. kích nâng và thiết bị hỗ trợ kiểm tra gầm được lắp đặt trong không gian tương ứng với chiều dài làm việc của hầm. 2.2.2.4. vị trí kiểm tra độ trượt ngang của bánh xe 2.2.2.4.1. đối với dây chuyền kiểm định loại i 2.2.2.4.1.1. vị trí kiểm tra gầm được đánh dấu trên sàn; 2.2.2.4.1.2. thiết bị đo độ trượt ngang của bánh xe phải được lắp đặt chắc chắn vào sàn nhà xưởng; 2.2.2.4.1.3. khoảng cách giữa hai điểm gần nhất tính từ thiết bị đo độ trượt ngang của bánh xe tới bệ thử phanh tối thiểu là 0,8 m. hình 6. vị trí lắp đặt thiết bị đo độ trượt ngang của bánh xe đối với dây chuyền kiểm định loại i 2.2.2.4.2. đối với dây chuyền kiểm định loại ii 2.2.2.4.2.1. vị trí kiểm tra gầm được đánh dấu trên sàn; 2.2.2.4.2.2. thiết bị đo độ trượt ngang của bánh xe phải được lắp đặt chắc chắn vào sàn nhà xưởng; 2.2.2.4.2.3. khoảng cách giữa hai điểm gần nhất tính từ thiết bị đo độ trượt ngang của bánh xe tới bệ thử phanh tối thiểu 2,8 m. hình 7. vị trí lắp đặt thiết bị đo độ trượt ngang của bánh xe đối với dây chuyền kiểm định loại ii 2.3. nhà văn phòng 2.3.1. nhà văn phòng là nơi để bố trí khu vực tiếp nhận hồ sơ, trả kết quả kiểm định, lưu trữ hồ sơ; phòng chờ; phòng làm việc của nhân viên và các phòng phụ trợ khác; được trang bị các thiết bị văn phòng phục vụ hoạt động kiểm định. 2.3.2. phòng chờ có bố trí chỗ ngồi cho khách hàng. 2.4. thiết bị kiểm tra 2.4.1. yêu cầu về phần mềm điều khiển thiết bị 2.4.1.1. phần mềm điều khiển thiết bị kết nối được với các thiết bị kiểm tra nêu tại điểm 2.1.5. 2.4.1.2. các tính năng tối thiểu của phần mềm điều khiển thiết bị: 2.4.1.2.1. điều khiển các thiết bị hoạt động đúng chức năng theo quy trình kiểm tra; hiển thị các giá trị đo theo thời gian thực, đưa ra chỉ thị để người kiểm tra thực hiện các thao tác; đọc được các kết quả đo tương ứng với từng thiết bị khi kết thúc quá trình kiểm tra và lưu trữ trong cơ sở dữ liệu của phần mềm; 2.4.1.2.2. kết nối, trao đổi thông tin với phần mềm quản lý kiểm định về: phương tiện chờ kiểm tra, kết quả kiểm tra (các giá trị đo của thiết bị) của phương tiện đã hoàn thành kiểm tra kèm theo số nhận dạng hoặc số serial của thiết bị, thời gian kiểm tra và ký hiệu của phiên bản phần mềm. việc kết nối, trao đổi thông tin phải đảm bảo chính xác; dữ liệu kết quả kiểm tra phải được mã hoá; 2.4.1.2.3. truy xuất dữ liệu để hiển thị và in ra kết quả của các lần kiểm tra được lưu trữ; truy xuất được mã nhận dạng hoặc số serial của thiết bị; 2.4.1.2.4. dữ liệu của phần mềm điều khiển thiết bị được mã hoá, sao lưu, lưu trữ trong thời gian ít nhất 36 tháng trên máy chủ của đơn vị. 2.4.2. yêu cầu kỹ thuật đối với các thiết bị 2.4.2.1. thiết bị phân tích khí thải 2.4.2.1.1. đo được các thành phần khí thải của động cơ cháy cưỡng bức: co, co2, hc, o2; 2.4.2.1.2. hiển thị được giá trị hệ số dư lượng không khí - lamda (λ); 2.4.2.1.3. ghi nhận được tốc độ và nhiệt độ dầu động cơ trong quá trình kiểm tra; 2.4.2.1.4. có hệ thống tách nước để chống nước xâm nhập vào buồng kiểm tra; 2.4.2.1.5. đầu lấy mẫu phải được trang bị kèm theo cơ cấu kẹp chặt vào ống xả, có kích thước phù hợp với yêu cầu đo theo khuyến cáo của nhà sản xuất thiết bị nhưng đầu lấy mẫu phải đưa được vào sâu trong ống xả tối thiểu 300 mm; trường hợp nhà sản xuất trang bị nhiều loại đầu lấy mẫu thì phải sử dụng loại đầu lấy mẫu có kích thước phù hợp; 2.4.2.1.6. dải đo và độ chính xác theo công bố của nhà sản xuất nhưng không vượt quá giá trị giới hạn trong bảng 1: bảng 1: thông số dải đo, độ chính xác của thiết bị phân tích khí thải 2.4.2.1.7. thiết bị có khả năng hiển thị và lưu trữ kết quả đo bằng giá trị nồng độ các thành phần khí thải, hệ số lamda, giá trị tốc độ và nhiệt độ dầu động cơ ở chế độ tốc độ không tải và chế độ tốc độ không tải có tăng tốc; 2.4.2.1.8. trong quá trình hoạt động, thiết bị phân tích khí thải phải đáp ứng các yêu cầu sau: 2.4.2.1.8.1. đầu lấy mẫu phải nguyên vẹn, không móp méo, rò rỉ, không bị tắc; 2.4.2.1.8.2. màn hình hiển thị rõ và đầy đủ các thông tin; 2.4.2.1.8.3. cảm biến tốc độ quay trục khuỷu động cơ lấy được tín hiệu và biến thiên theo tốc độ quay thực tế của trục khuỷu động cơ; 2.4.2.1.8.4. cảm biến nhiệt độ dầu động cơ nhận được tín hiệu khi tiếp xúc với nguồn nhiệt; 2.4.2.1.8.5. phần mềm của thiết bị điều khiển thiết bị hoạt động đúng chức năng; 2.4.2.1.8.6. máy tính hoạt động bình thường và kết nối được với mạng nội bộ và truyền được số liệu; 2.4.2.1.8.7. khi ở trạng thái sẵn sàng làm việc thì các chỉ số hc, co và hệ số lamda (λ) không hiển thị hoặc hiển thị giá trị trong sai số cho phép của nhà sản xuất. 2.4.2.2. thiết bị đo độ khói 2.4.2.2.1. đo được độ khói (%hsu) hoặc hệ số hấp thụ ánh sáng (m-1) của khí thải động cơ cháy do nén; 2.4.2.2.2. ghi nhận được tốc độ nhỏ nhất, lớn nhất của động cơ, thời gian gia tốc và nhiệt độ dầu động cơ ở mỗi chu trình đo; 2.4.2.2.3. đo được các thông số ở chế độ gia tốc tự do; 2.4.2.2.4. đầu lấy mẫu phải được trang bị kèm theo cơ cấu kẹp chặt vào ống xả, có kích thước phù hợp với yêu cầu đo theo khuyến cáo của nhà sản xuất thiết bị nhưng đầu lấy mẫu phải đưa được vào sâu trong ống xả tối thiểu 50 mm; trường hợp nhà sản xuất trang bị nhiều loại đầu lấy mẫu thì phải sử dụng loại đầu lấy mẫu có kích thước phù hợp; 2.4.2.2.5. dải đo và độ chính xác theo công bố của nhà sản xuất nhưng không vượt quá giá trị giới hạn trong bảng 2: bảng 2: thông số dải đo, độ chính xác của thiết bị đo độ khói 2.4.2.2.6. xử lý, hiển thị và lưu trữ kết quả: 2.4.2.2.6.1. thiết bị có khả năng hiển thị và lưu trữ kết quả đo bằng số các giá trị độ khói và hệ số hấp thụ ánh sáng, tốc độ nhỏ nhất, lớn nhất của động cơ, thời gian tăng tốc và nhiệt độ dầu động cơ ở mỗi chu trình đo; 2.4.2.2.6.2. ghi nhận kết quả đo độ khói hoặc hệ số hấp thụ ánh sáng trung bình và chiều rộng dải đo của 3 chu trình đo sau cùng. 2.4.2.2.7. trong quá trình hoạt động, thiết bị đo độ khói phải đáp ứng các yêu cầu sau: 2.4.2.2.7.1. đầu lấy mẫu phải nguyên vẹn, không móp méo, không thủng lỗ, không bị tắc; 2.4.2.2.7.2. cảm biến tốc độ quay trục khuỷu động cơ lấy được tín hiệu và biến thiên theo tốc độ quay thực tế của trục khuỷu động cơ; 2.4.2.2.7.3. cảm biến nhiệt độ dầu động cơ nhận được tín hiệu khi tiếp xúc với nguồn nhiệt; 2.4.2.2.7.4. có chống nhiễu (tiếp đất) cho hệ thống tín hiệu thiết bị kiểm tra; 2.4.2.2.7.5. màn hình máy tính hiển thị rõ và đầy đủ các thông tin kiểm tra; 2.4.2.2.7.6. phần mềm của thiết bị điều khiển thiết bị hoạt động đúng chức năng; 2.4.2.2.7.7. máy tính hoạt động bình thường và kết nối được với mạng nội bộ và truyền được số liệu; 2.4.2.2.7.8. khi ở trạng thái sẵn sàng làm việc, giá trị độ khói hoặc hệ số hấp thụ ánh sáng không hiển thị hoặc hiển thị giá trị trong sai số cho phép của nhà sản xuất. 2.4.2.3. thiết bị kiểm tra phanh 2.4.2.3.1. là thiết bị kiểm tra phanh kiểu con lăn có chức năng kiểm tra lực phanh trên mỗi trục bánh xe; 2.4.2.3.2. khả năng chịu tải trọng trục tối đa theo công bố của nhà sản xuất thiết bị không nhỏ hơn 2.000 kg đối với dây chuyền kiểm định loại i và không nhỏ hơn 13.000 kg đối với dây chuyền kiểm định loại ii; 2.4.2.3.3. kích thước lắp đặt đảm bảo điều kiện tại bảng 3: bảng 3: thông số kích thước lắp đặt của thiết bị kiểm tra phanh 2.4.2.3.4. tự động dừng khi có hiện tượng trượt giữa bánh xe và con lăn trong quá trình kiểm tra; 2.4.2.3.5. hiển thị và ghi nhận giá trị lực phanh tại từng thời điểm ở từng bánh xe trên mỗi trục; 2.4.2.3.6. kiểm tra được hệ thống phanh đỗ và hệ thống phanh chính và có tính năng rà ô van; 2.4.2.3.7. hệ số bám tối thiểu của con lăn (µ): 2.4.2.3.7.1. đối với thiết bị chưa qua sử dụng, µ được ghi nhận theo công bố của nhà sản xuất thiết bị nhưng không thấp hơn 0,5; 2.4.2.3.7.2. đối với thiết bị đã qua sử dụng, µ có giá trị tối thiểu là 0,5 trong điều kiện làm việc với bề mặt tiếp xúc giữa lốp xe và con lăn là khô và lốp xe ở trạng thái hoạt động bình thường, được xác định theo công thức sau: trong đó: froll - là lực phanh một bên đo được trên thiết bị kiểm tra phanh; m - là khối lượng của trục xe hiển thị trên thiết bị kiểm tra phanh (kg); g - là gia tốc trọng trường (m/s2). 2.4.2.3.7.3. phương tiện dùng để kiểm tra µ phải phù hợp với loại dây chuyền, trường hợp thiết bị đáp ứng quy định kiểm tra với cả 2 loại dây chuyền thì sử dụng phương tiện tương ứng với dây chuyền loại ii để kiểm tra. 2.4.2.3.8. chiều dài con lăn và đường kính con lăn đáp ứng yêu cầu tại bảng 4: bảng 4: thông số con lăn của thiết bị kiểm tra phanh (*) chỉ áp dụng với thiết bị chưa qua sử dụng; 2.4.2.3.9. số lượng cảm biến khối lượng không nhỏ hơn 4 đối với dây chuyền kiểm định loại i và không nhỏ hơn 8 đối với dây chuyền kiểm định loại ii; ở mức dưới 10.000 n, lực thẳng đứng phải được đo với dung sai không quá ± 300 n; ở mức từ 10.000 n trở lên, giá trị này không quá ± 3 % giá trị đo được; 2.4.2.3.10. có thiết bị điều khiển từ xa và điều khiển trực tiếp tại vị trí tủ điều khiển; 2.4.2.3.11. ở mức đến 2.000 n độ chính xác của phép đo lực phanh là ± 100 n, trên 2.000 n thì độ chính xác là ± 3%. sai lệch lực phanh tối đa cho phép ở cùng điểm đo giống nhau giữa bên trái và bên phải của bệ thử phanh phải là ± 100 n ở mức dưới 2.000 n và ± 5% ở mức từ 2.000 n trở lên; 2.4.2.3.12. dải đo của thiết bị trên mỗi bánh xe tối thiểu từ 0 đến 7.500 n đối với dây chuyền kiểm định loại i và từ 0 đến 30.000 n đối với dây chuyền kiểm định loại ii. thiết bị phải có dải đo với bước đo không được lớn hơn 100 n khi giá trị thang đo đến 5.000 n và không lớn hơn 500 n khi giá trị thang đo trên 5.000 n; 2.4.2.3.13. hiển thị được giá trị lực phanh riêng ở từng bánh xe trên mỗi trục; 2.4.2.3.14. hiển thị được hiệu quả phanh trên trục và hiệu quả phanh toàn bộ được tính theo công thức: 2.4.2.3.14.1. hiệu quả phanh trên trục kt: trong đó: ∑fpti - tổng lực phanh trên tất cả các bánh xe trên trục khi kiểm tra phanh; gt - khối lượng trục xe khi kiểm tra phanh. 2.4.2.3.14.2. hiệu quả phanh toàn bộ kp: trong đó: ∑fpi - tổng lực phanh trên tất cả các bánh xe; g - khối lượng xe khi kiểm tra phanh. 2.4.2.3.15. hiển thị được sai lệch lực phanh giữa hai bên bánh xe trên cùng một trục (giữa bánh bên phải và bên trái): trong đó: ksl- sai lệch lực phanh trên một trục; pfl - lực phanh lớn hơn trên cùng một trục; pfn - lực phanh nhỏ hơn trên cùng một trục. 2.4.2.3.16. trong quá trình hoạt động, thiết bị kiểm tra phanh phải đáp ứng các yêu cầu sau: 2.4.2.3.16.1. con lăn ma sát không bị bong tróc lớp ma sát đến khung xương; 2.4.2.3.16.2. con lăn quay trơn không bị biến dạng, cong vênh; 2.4.2.3.16.3. các chi tiết, tổng thành hoạt động bình thường, không bị kẹt, không có các tiếng kêu hoặc rung giật bất thường; 2.4.2.3.16.4. màn hình hiển thị rõ và đầy đủ các thông tin kiểm tra; 2.4.2.3.16.5. phần mềm của thiết bị điều khiển thiết bị hoạt động đúng chức năng; 2.4.2.3.16.6. máy tính hoạt động bình thường và kết nối được với mạng nội bộ và truyền được số liệu; 2.4.2.3.16.7. ở trạng thái sẵn sàng làm việc, giá trị lực phanh và giá trị khối lượng không hiển thị hoặc hiển thị giá trị trong sai số cho phép của nhà sản xuất. 2.4.2.4. thiết bị đo độ trượt ngang của bánh xe 2.4.2.4.1. tự động đo và ghi nhận giá trị độ trượt ngang khi bánh xe lăn qua tấm trượt ngang; có cảm biến nhận biết tín hiệu đầu vào và đầu ra; 2.4.2.4.2. bề mặt tấm trượt ngang đảm bảo cứng vững; khả năng chịu tải trọng trục hoặc tải trọng bánh xe tối đa theo công bố của nhà sản xuất thiết bị không nhỏ hơn 2.000 kg/trục hoặc 1.000 kg/bánh xe (đối với dây chuyền kiểm định loại i) và không nhỏ hơn 13.000 kg/trục hoặc 6.500 kg/bánh xe (đối với dây chuyền kiểm định loại ii); 2.4.2.4.3. dải đo về hai phía không nhỏ hơn 10 (mm/m hoặc m/km); 2.4.2.4.4. bước đo không lớn hơn 0,1 (mm/m hoặc m/km); 2.4.2.4.5. sai số không quá ± 0,2 (mm/m hoặc m/km); 2.4.2.4.6. trong quá trình hoạt động, thiết bị đo độ trượt ngang của bánh xe phải đáp ứng các yêu cầu sau: 2.4.2.4.6.1. hành trình tối đa của tấm trượt khi di chuyển về hai phía không nhỏ hơn 10 mm; 2.4.2.4.6.2. màn hình hiển thị rõ và đầy đủ các thông tin; 2.4.2.4.6.3. các chi tiết, bộ phận hoạt động bình thường (không bị kẹt, lắp đặt không chắc chắn); 2.4.2.4.6.4. ở trạng thái sẵn sàng làm việc, giá trị độ trượt ngang không hiển thị hoặc hiển thị giá trị trong sai số cho phép của nhà sản xuất. 2.4.2.5. thiết bị kiểm tra đèn chiếu sáng phía trước 2.4.2.5.1. đo được cường độ sáng tại tâm quang học của đèn và tại điểm sáng lớn nhất của chùm sáng đèn chiếu xa; đo được độ lệch chùm sáng của đèn chiếu xa; 2.4.2.5.2. xác định được giao điểm của đường sáng tối, phần hình nêm nhô lên của chùm sáng (điểm gãy của đường cut-off) của đèn chiếu gần và đo được độ lệch chùm sáng của đèn chiếu gần; 2.4.2.5.3. có khả năng di chuyển buồng đo lên, xuống và xoay một góc nhất định quanh trục đỡ buồng đo; di chuyển được sang hai bên. chiều cao tâm buồng đo phải điều chỉnh được trong phạm vi từ 250 mm đến 1.300 mm so với mặt sàn vị trí kiểm tra; 2.4.2.5.4. có chức năng hỗ trợ xác định và định vị vị trí đo; 2.4.2.5.5. dải đo và độ chính xác theo công bố của nhà sản xuất nhưng không vượt quá giá trị giới hạn trong bảng 5: bảng 5: thông số dải đo, độ chính xác của thiết bị đo đèn 2.4.2.5.6. hiển thị được cường độ, độ lệch chùm sáng của đèn chiếu xa; độ lệch chùm sáng của đèn chiếu gần; 2.4.2.5.7. trong quá trình hoạt động, thiết bị kiểm tra đèn chiếu sáng phía trước phải đáp ứng các yêu cầu sau: 2.4.2.5.7.1. trụ đỡ buồng đo phải đảm bảo theo phương thẳng đứng; 2.4.2.5.7.2. buồng đo được lắp đặt chắc chắn với trụ đỡ buồng đo và đảm bảo cân bằng ở vị trí kiểm tra theo cả phương dọc và phương ngang; 2.4.2.5.7.3. bánh xe di chuyển dễ dàng, không rơ rão; 2.4.2.5.7.4. màn hình của thiết bị hiển thị đầy đủ, rõ ràng các thông tin; 2.4.2.5.7.5. phím điều khiển hoạt động đúng chức năng; 2.4.2.5.7.6. phần mềm của thiết bị điều khiển thiết bị hoạt động đúng chức năng; 2.4.2.5.7.7. khi ngắt nguồn điện đầu vào, thiết bị phải hoạt động được tiếp tục trong thời gian tối thiểu 3 phút; 2.4.2.5.7.8. thiết bị kết nối và truyền được dữ liệu kiểm tra. 2.4.2.6. thiết bị đo âm lượng 2.4.2.6.1. giữ được giá trị âm lượng lớn nhất khi đo; 2.4.2.6.2. có màn hình hiển thị bằng số; 2.4.2.6.3. kết nối và truyền được số liệu sang máy tính; 2.4.2.6.4. thiết bị phải có khả năng phản hồi kết quả đo ở mức nhanh (f) và chậm (s). phải có bộ phận chắn gió trùm lên micro; 2.4.2.6.5. dải đo và cấp chính xác phải thỏa mãn phạm vi trong bảng 6: bảng 6: thông số dải đo, cấp chính xác của thiết bị đo âm lượng 2.4.2.6.6. trong quá trình hoạt động, thiết bị đo âm lượng phải đáp ứng các yêu cầu sau: 2.4.2.6.6.1. thiết bị phải hoạt động ổn định; 2.4.2.6.6.2. màn hình phải bảo đảm hiển thị rõ ràng các thông số; 2.4.2.6.6.3. bộ phận chắn gió trùm lên micro không bị hỏng, rách; 2.4.2.6.6.4. kết nối và truyền dữ liệu được với máy tính; 2.4.2.6.6.5. chỉ số phải hiển thị tương ứng với sự thay đổi của âm lượng. 2.5. thiết bị hỗ trợ kiểm tra, dụng cụ kiểm tra, dụng cụ hỗ trợ kiểm tra 2.5.1. yêu cầu về thiết bị hỗ trợ kiểm tra: 2.5.1.1. thiết bị hỗ trợ kiểm tra gầm: 2.5.1.1.1. khả năng chịu tải trọng trục tối thiểu 2.000 kg đối với dây chuyền kiểm định loại i và tối thiểu 13.000 kg đối với dây chuyền kiểm định loại ii; 2.5.1.1.2. trong quá trình hoạt động, thiết bị phải đáp ứng các yêu cầu sau: 2.5.1.1.2.1. không bị rò rỉ môi chất công tác, các công tắc điều khiển hoạt động đúng chức năng; 2.5.1.1.2.2. đưa xe vào kiểm tra, thiết bị phải dịch chuyển được theo các hướng, không có tiếng kêu bất thường, không bị kẹt; 2.5.1.1.2.3. phương dịch chuyển và chế độ làm việc phù hợp với công bố của nhà sản xuất; 2.5.1.1.2.4. hành trình dịch chuyển và tốc độ di chuyển phù hợp với công bố của nhà sản xuất. 2.5.1.2. kích nâng: 2.5.1.2.1. kích nâng có khả năng nâng cả hai bánh xe trên cùng 1 trục và khả năng chịu tải trọng trục tối thiểu 5 tấn đối với dây chuyền kiểm định loại i và tối thiểu 15 tấn đối với dây chuyền kiểm định loại ii. trong trường hợp sử dụng kích nâng di động thì kích nâng phải có khả năng chịu tải tải trọng bánh xe tối thiểu 2,5 tấn/bánh xe đối với xe thuộc đối tượng kiểm định trên dây chuyền kiểm định loại i và tối thiểu 7,5 tấn/bánh xe đối với xe thuộc đối tượng kiểm định trên dây chuyền kiểm định loại ii; 2.5.1.2.2. trong quá trình hoạt động, kích nâng phải đáp ứng các yêu cầu sau: 2.5.1.2.2.1. kích nâng không bị rò rỉ môi chất công tác, các công tắc điều khiển hoạt động đúng chức năng; 2.5.1.2.2.2. đưa xe vào kiểm tra, kích phải nâng được trục xe phù hợp theo các dây chuyền kiểm định tương ứng. 2.5.1.3. thiết bị nâng (cầu nâng) xe cơ giới (chỉ áp dụng đối với dây chuyền loại i): 2.5.1.3.1. cầu nâng phải có sức nâng tối thiểu 5 tấn, có khả năng điều chỉnh phù hợp với từng loại xe; 2.5.1.3.2. có chiều cao nâng tối thiểu 1,3 m; 2.5.1.3.3. cầu nâng phải được kiểm định an toàn theo quy định. 2.5.2. yêu cầu về dụng cụ kiểm tra: 2.5.2.1. thước cuộn có phạm vi đo không nhỏ hơn 20 m và đạt cấp chính xác iii trở lên; 2.5.2.2. búa kiểm tra là loại búa chuyên dùng kiểm tra được chất lượng mối ghép bằng bu lông; 2.5.2.3. dụng cụ kiểm tra áp suất lốp có đơn vị đo theo hệ đo lường si (bar) có dải đo từ 0 bar đến 12 bar; 2.5.2.4. đèn soi kiểm tra cầm tay: đèn phải thuộc loại điện áp thấp (không quá 36v), công suất phải đảm bảo việc quan sát được bằng mắt thường khi kiểm tra và bên ngoài của đèn được bảo vệ cách điện. 2.5.3. yêu cầu về dụng cụ hỗ trợ kiểm tra: 2.5.3.1. gương quan sát hỗ trợ kiểm tra đèn tín hiệu là gương cầu lồi có đường kính của bề mặt phản xạ tối thiểu 600 mm, phải lắp ở vị trí đảm bảo tại vị trí người lái quan sát được đèn tín hiệu phía trước và phía sau; 2.5.3.2. cục chèn bánh xe bằng gỗ hoặc cao su, chống trôi được xe trong quá trình kiểm tra; 2.5.3.3. thanh, đòn hỗ trợ kiểm tra bánh xe phù hợp với xe kiểm tra; 2.5.3.4. dụng cụ đo tốc độ có dải đo tối thiểu từ 0-80 km/h, đơn vị hiển thị là km/h, bước đo lớn nhất 1 km/h. 2.6. hệ thống thông tin quản lý kiểm định 2.6.1. hệ thống thông tin quản lý kiểm định được xây dựng để quản lý hoạt động kiểm định của cơ sở đăng kiểm. 2.6.2. cơ sở dữ liệu kiểm định có tối thiểu các thông tin sau: 2.6.2.1. cơ sở đăng kiểm: thông tin đơn vị, quá trình hoạt động; 2.6.2.2. nhân sự cơ sở đăng kiểm; 2.6.2.3. quản lý thiết bị kiểm tra: thông tin về thiết bị; các sự cố của thiết bị; các lần kiểm tra, đánh giá, kiểm định, hiệu chuẩn thiết bị; 2.6.2.4. hồ sơ phương tiện, các lần thay đổi thông số kỹ thuật và thay đổi thông tin hành chính; 2.6.2.5. kiểm định phương tiện: thông tin quản lý lần kiểm định, đánh giá lỗi của các hạng mục kiểm định không đạt, thông số đo của các thiết bị kiểm tra; 2.6.2.6. thông tin quản lý giấy chứng nhận và tem kiểm định; 2.6.2.7. hình ảnh phương tiện khi kiểm định. 2.6.3. tính năng của phần mềm quản lý kiểm định: 2.6.3.1. thực hiện tạo lập, lưu trữ dữ liệu kiểm định; kết nối trao đổi thông tin với phần mềm điều khiển thiết bị kiểm tra; kết nối trao đổi thông tin với cơ sở dữ liệu kiểm định của cục đăng kiểm việt nam; truy xuất, thống kê, lập báo cáo liên quan đến hoạt động kiểm định; có tính năng đảm bảo an toàn dữ liệu, chống sự can thiệp từ bên ngoài; 2.6.3.2. dữ liệu kiểm định được tạo lập và lưu trữ theo thời gian thực vào cơ sở dữ liệu phần mềm quản lý kiểm định của cục đăng kiểm việt nam 2.6.4. hạ tầng công nghệ thông tin của cơ sở đăng kiểm 2.6.4.1. mạng máy tính cục bộ (lan) của cơ sở đăng kiểm bao gồm: máy chủ để lưu trữ cơ sở dữ liệu kiểm định và quản lý domain mạng; các máy tính để sử dụng cho phần mềm quản lý kiểm định, phần mềm điều khiển thiết bị kiểm tra và các phần mềm cần thiết khác của đơn vị; thiết bị chuyển mạch mạng (switch) và hệ thống dây mạng có khả năng kết nối các máy tính tới thiết bị chuyển mạch mạng với tốc độ tối thiểu 100 mbps. 2.6.4.2. mạng máy tính diện rộng (wan) tại cơ sở đăng kiểm: có ít nhất 01 đường truyền internet có địa chỉ ip tĩnh với băng thông tối thiểu 100 mbps. được trang bị thiết bị tường lửa (firewall) có tính năng tạo kênh kết nối mạng riêng ảo (vpn) tới hạ tầng công nghệ thông tin của cục đăng kiểm việt nam. 2.6.5. hệ thống camera giám sát: 2.6.5.1. dây chuyền kiểm định phải bố trí camera ip sử dụng riêng cho việc giám sát kiểm định xe cơ giới (có độ phân giải video tối thiểu 1280 x 720 pixels và tốc độ khung hình tối thiểu 30 hình trên giây); đảm bảo quan sát, lưu trữ được clip, hình ảnh các vị trí kiểm tra trên dây chuyền kiểm định cho khoảng thời gian tối thiểu 30 ngày; 2.6.5.2. hình ảnh camera giám sát quá trình kiểm định trên dây chuyền phải kết nối với màn hình tại phòng chờ để chủ xe theo dõi hình ảnh kiểm tra xe trong quá trình kiểm định; 2.6.5.3. tín hiệu hình ảnh camera giám sát phải được kết nối tới sở giao thông vận tải tại địa phương và cục đăng kiểm việt nam để theo dõi, giám sát. 2.6.6. phần mềm quản lý việc tính tiền, thu giá dịch vụ, phí, lệ phí liên quan đến hoạt động kiểm định. 2.7. các thông tin niêm yết 2.7.1. các biển hiệu, thông báo (trích từ các quy định hiện hành, cập nhật khi có thay đổi) niêm yết công khai dưới dạng bảng thông báo nền bảng màu trắng hoặc xanh tương ứng với chữ màu xanh hoặc trắng (hoặc bảng điện tử), vị trí treo dễ thấy, dễ đọc bằng mắt thường. 2.7.2. các thông tin phải công khai tại phòng chờ bao gồm: 2.7.2.1. những văn bản có liên quan đến công tác kiểm định; 2.7.2.2. quy trình kiểm định và các vị trí kiểm tra theo quy trình iso của đơn vị; 2.7.2.3. chu kỳ kiểm định an toàn kỹ thuật và bảo vệ môi trường của xe cơ giới, có kích thước tối thiểu khổ a1; 2.7.2.4. các chỉ tiêu đánh giá về cường độ sáng và độ lệch chùm sáng của đèn chiếu sáng phía trước, lực phanh, độ trượt ngang, âm lượng còi, hàm lượng khí thải, độ khói có kích thước tối thiểu khổ a0; 2.7.2.5. giấy tờ cần thiết khi lập hồ sơ phương tiện và kiểm định, có kích thước tối thiểu khổ a1; 2.7.2.6. thông báo “số điện thoại đường dây nóng” của cơ sở đăng kiểm, sở giao thông vận tải địa phương, cục đăng kiểm việt nam có kích thước tối thiểu khổ a3; 2.7.2.7. biểu giá kiểm định, lệ phí cấp giấy chứng nhận và phí sử dụng đường bộ theo quy định, có kích thước tối thiểu khổ a1; 2.7.2.8. thời gian làm việc của cơ sở đăng kiểm. 2.7.3. thông tin phải công khai tại xưởng kiểm định: 2.7.3.1. quy trình sử dụng thiết bị kiểm tra: được trình bày thành từng bảng có vị trí treo tương ứng với vị trí sử dụng thiết bị, có kích thước tối thiểu khổ a2; 2.7.3.2. nội dung về các yêu cầu, phương pháp kiểm định an toàn kỹ thuật và bảo vệ môi trường đối với xe ô tô, rơ moóc, sơ mi rơ moóc, xe chở hàng bốn bánh có gắn động cơ, xe chở người bốn bánh có gắn động cơ tham gia giao thông đường bộ, có kích thước tối thiểu khổ a0; 2.7.3.3. chỉ báo về khu vực dành riêng cho kiểm định. 2.7.4. biển hiệu cơ sở đăng kiểm: biển hiệu (theo mẫu ở phụ lục a) được kẻ bằng chữ màu trắng trên nền xanh nước biển, có kích thước (dài x rộng) phù hợp với vị trí treo biển, được lắp đặt chắc chắn. 2.8. vị trí cơ sở đăng kiểm xe cơ giới đối với cơ sở đăng kiểm xe cơ giới phải cách cơ sở giáo dục phổ thông, bệnh viện tối thiểu là 50 m. 3. quy định về cơ sở vật chất kỹ thuật và vị trí cơ sở kiểm định khí thải xe mô tô, xe gắn máy 3.1. yêu cầu chung 3.1.1. cơ sở vật chất kỹ thuật của cơ sở kiểm định khí thải xe mô tô, xe gắn máy bao gồm: 3.1.1.1. khu vực chờ và trả kết quả kiểm định; 3.1.1.2. khu vực kiểm định; 3.1.1.3. thiết bị kiểm tra khí thải bao gồm: 3.1.1.3.1. thiết bị phân tích khí thải (phương tiện đo khí thải xe cơ giới); 3.1.1.3.2. thiết bị đo độ khói; 3.1.1.3.3. thiết bị nêu tại điểm 3.1.1.3.1 không áp dụng với cơ sở kiểm định khí thải chỉ kiểm định xe trang bị động cơ cháy do nén (diesel); 3.1.1.3.4. thiết bị nêu tại điểm 3.1.1.3.2 không áp dụng với cơ sở kiểm định khí thải chỉ kiểm định xe trang bị động cơ cháy cưỡng bức; 3.1.1.4. hệ thống quản lý thông tin kiểm định khí thải; 3.1.1.5. các thông tin niêm yết về công tác kiểm định khí thải xe mô tô, xe gắn máy. 3.1.2. khu vực chờ và trả kết quả kiểm định phải tách biệt với khu vực kiểm định. 3.2. khu vực kiểm định 3.2.1. có thiết bị thông gió cưỡng bức đối với cơ sở kiểm định khí thải thực hiện việc kiểm định khí thải trong nhà; 3.2.2. khu vực kiểm định phải được đánh dấu bằng đường viền màu vàng trên sàn với chiều rộng đường viền là 10 cm; 3.2.3. có camera giám sát khu vực kiểm định khí thải. 3.3. thiết bị phân tích khí thải, thiết bị đo độ khói và phần mềm điều khiển thiết bị 3.3.1. thiết bị phân tích khí thải tuân thủ các quy định tại điểm 2.4.2.1. 3.3.2. thiết bị đo độ khói tuân thủ các quy định tại điểm 2.4.2.2. 3.3.3. yêu cầu về phần mềm điều khiển thiết bị 3.3.3.1. kết nối được với thiết bị tại điểm 3.1.1.3; 3.3.3.2. hiển thị và ghi nhận được các thành phần khí thải theo phương pháp đo; 3.3.3.3. lưu trữ trong cơ sở dữ liệu; kết nối được với máy tính và in ra được kết quả kiểm định sau khi hoàn thành quá trình kiểm định; 3.3.3.4. kết nối, trao đổi thông tin với phần mềm quản lý kiểm định khí thải về: kết quả, thời gian kiểm định của phương tiện. việc kết nối, trao đổi thông tin phải đảm bảo chính xác; 3.3.3.5. dữ liệu kiểm định phải được lưu trữ trong thời gian ít nhất 36 tháng kể từ ngày phương tiện được kiểm định. 3.4. 