,user_input,retrieved_contexts,response,reference,faithfulness,answer_relevancy,context_recall,context_precision
0,Luật Giao thông Đường bộ 2025 có những thay đổi gì về phân hạng giấy phép lái xe?,"['1. yêu cầu đối với việc đổi giấy phép lái xe do ngành công an cấp sang giấy phép lái xe do ngành giao thông vận tải cấp a) người có giấy phép lái xe do ngành công an cấp sau ngày 31 tháng 7 năm 1995, còn thời hạn sử dụng, khi thôi không tiếp tục phục vụ trong ngành công an (xuất ngũ, chuyển ngành, nghỉ hưu, chấm dứt hợp đồng lao động trong công an nhân dân), có nhu cầu được đổi giấy phép lái xe; b) người có giấy phép lái xe mô tô của ngành công an cấp trước ngày 01 tháng 8 năm 1995 bị hỏng không còn sử dụng được có nhu cầu đổi, có tên trong sổ lưu được xét đổi giấy phép lái xe mới; c) không đổi giấy phép lái xe do ngành công an cấp bị tẩy xóa thông tin để đổi giấy phép lái xe hoặc có sự khác biệt về nhận dạng; người vi phạm trật tự, an toàn giao thông đường bộ chưa thực hiện xong yêu cầu của cơ quan nhà nước có thẩm quyền về giải quyết, xử lý vụ việc vi phạm hành chính trong lĩnh vực trật tự, an toàn giao thông đường bộ. 2. hồ sơ đổi giấy phép lái xe mô tô do ngành công an cấp trước ngày 01 tháng 8 năm 1995: đơn đề nghị đổi (cấp lại) giấy phép lái xe theo mẫu quy định tại phụ lục xxvi ban hành kèm theo thông tư này. 3. hồ sơ đổi giấy phép lái xe do ngành công an cấp từ ngày 01 tháng 8 năm 1995: a) đơn đề nghị đổi (cấp lại) giấy phép lái xe theo mẫu quy định tại phụ lục xxvi ban hành kèm theo thông tư này; b) bản sao giấy phép lái xe; bản sao quyết định ra khỏi ngành hoặc nghỉ hưu của cấp có thẩm quyền hoặc bản sao quyết định của cấp có thẩm quyền về việc thôi không tiếp tục phục vụ trong lực lượng công an xã hoặc bản sao quyết định chấm dứt hợp đồng lao động và quyết định tuyển dụng hoặc hợp đồng lao động từ 12 tháng trở lên của các đơn vị trong công an nhân dân; c) giấy khám sức khỏe của người lái xe do cơ sở khám bệnh, chữa bệnh đủ tiêu chuẩn theo quy định của pháp luật về khám bệnh, chữa bệnh cấp còn hiệu lực. 4. hồ sơ đổi giấy phép lái xe do ngành công an cấp cho học viên hệ dân sự các trường công an nhân dân trước ngày 31 tháng 7 năm 2020: a) giấy tờ quy định tại các điểm a và c khoản 3 điều này; b) bản sao hoặc bản sao điện tử được chứng thực từ bản chính hoặc bản sao điện tử được cấp từ sổ gốc của quyết định công nhận tốt nghiệp của các trường, học viện trong công an nhân dân; c) hồ sơ gốc do ngành công an cấp, gồm: đơn đề nghị sát hạch, cấp, đổi giấy phép lái xe có xác nhận của thủ trưởng đơn vị nơi công tác; giấy chứng nhận sức khỏe của người lái xe; chứng chỉ tốt nghiệp chương trình đào tạo lái xe; biên bản tổng hợp kết quả sát hạch lái xe. 5. trình tự thực hiện a) cá nhân lập 01 bộ hồ sơ theo quy định tại khoản 2 hoặc khoản 3 hoặc khoản 4 điều này gửi trực tiếp tại sở giao thông vận tải; cá nhân phải chụp ảnh trực tiếp tại cơ quan cấp giấy phép lái xe và phải hoàn thành nghĩa vụ nộp lệ phí khi được tiếp nhận hồ sơ; b) sở giao thông vận tải kiểm tra hồ sơ, tra cứu phần mềm cơ sở dữ liệu về trật tự, an toàn giao thông đường bộ của ngành công an hoặc tra cứu vi phạm của người lái xe thông qua tài khoản định danh điện tử; trường hợp giấy phép lái xe không thuộc đối tượng được đổi hoặc hồ sơ không đúng theo quy định, phải thông báo trực tiếp hoặc bằng văn bản những nội dung cần bổ sung hoặc sửa đổi cho cá nhân trong thời hạn 02 ngày làm việc, kể từ ngày nhận hồ sơ; c) trong thời hạn 05 ngày làm việc, kể từ ngày nhận đủ hồ sơ đúng theo quy định (bao gồm xác thực tài khoản định danh điện tử qua hệ thống định danh và xác thực điện tử), sở giao thông vận tải thực hiện việc đổi giấy phép lái xe; trường hợp không đổi giấy phép lái xe thì phải trả lời bằng văn bản và nêu rõ lý do; d) việc trả giấy phép lái xe được thực hiện tại cơ quan tiếp nhận hồ sơ hoặc thông qua dịch vụ bưu chính theo yêu cầu của cá nhân; đ) trường hợp người lái xe có nhu cầu đổi giấy phép lái xe xuống hạng thấp hơn, phải khai rõ tại đơn đề nghị đổi (cấp lại) giấy phép lái xe quy định tại phụ lục xxvi ban hành kèm theo thông tư này và chịu trách nhiệm về nội dung kê khai; e) cơ quan cấp giấy phép lái xe lưu bản sao hồ sơ đổi giấy phép lái xe do ngành công an cấp trong thời hạn 02 năm kể từ ngày cấp giấy phép lái xe và cắt góc giấy phép lái xe cũ. 6. hồ sơ đổi giấy phép lái xe do ngành công an cấp là hồ sơ gốc, gồm tài liệu quy định tại khoản 2, khoản 3 và khoản 4 điều này và giấy phép lái xe do ngành công an cấp đã được cắt góc, giao cho người lái xe tự bảo quản.', '1. thông tư này có hiệu lực thi hành từ ngày 01 tháng 01 năm 2025. 2. thông tư này bãi bỏ các thông tư: a) thông tư số 06/2011/tt-bgtvt ngày 07 tháng 3 năm 2011 của bộ trưởng bộ giao thông vận tải quy định về bồi dưỡng kiến thức pháp luật về giao thông đường bộ cho người điều khiển xe máy chuyên dùng tham gia giao thông đường bộ; b) thông tư số 07/2013/tt- bgtvt ngày 03 tháng 5 năm 2013 của bộ trưởng bộ giao thông vận tải quy định về quản lý, vận hành và khai thác hệ thống thông tin giấy phép lái xe; c) thông tư số 29/2015/tt-bgtvt ngày 06 tháng 7 năm 2015 của bộ trưởng bộ giao thông vận tải ban hành thông tư quy định về cấp, sử dụng giấy phép lái xe quốc tế; d) thông tư số 12/2017/tt-bgtvt ngày 15 tháng 4 năm 2017 của bộ trưởng bộ giao thông vận tải quy định về đào tạo, sát hạch, cấp giấy phép lái xe cơ giới đường bộ; đ) thông tư số 38/2019/tt-bgtvt ngày 08 tháng 10 năm 2019 của bộ trưởng bộ giao thông vận tải sửa đổi, bổ sung một số điều thông tư số 12/2017/tt-bgtvt ngày 15 tháng 4 năm 2017 của bộ trưởng bộ giao thông vận tải quy định về đào tạo, sát hạch, cấp giấy phép lái xe cơ giới đường bộ; e) thông tư số 01/2021/tt-bgtvt ngày 27 tháng 01 năm 2021 của bộ trưởng bộ giao thông vận tải sửa đổi, bổ sung một số điều thông tư số 29/2015/tt-bgtvt ngày 06 tháng 7 năm 2015 của bộ trưởng bộ giao thông vận tải quy định về cấp, sử dụng giấy phép lái xe quốc tế và thông tư số 12/2017/tt-bgtvt ngày 15 tháng 4 năm 2017 của bộ trưởng bộ giao thông vận tải quy định về đào tạo, sát hạch, cấp giấy phép lái xe cơ giới đường bộ; g) thông tư số 04/2022/tt-bgtvt ngày 22 tháng 4 năm 2022 của bộ trưởng bộ giao thông vận tải sửa đổi, bổ sung một số điều thông tư số 12/2017/tt- bgtvt ngày 15 tháng 4 năm 2017 của bộ trưởng bộ giao thông vận tải quy định về đào tạo, sát hạch, cấp giấy phép lái xe cơ giới đường bộ; h) điều 2, điều 4, điều 10, điều 12, điều 15, điều 20 và điều 22 thông tư số 05/2023/tt-bgtvt ngày 27 ngày 4 tháng 2023 của bộ trưởng bộ giao thông vận tải sửa đổi, bổ sung một số điều của các thông tư liên quan đến lĩnh vực vận tải đường bộ, dịch vụ hỗ trợ vận tải đường bộ, phương tiện và người lái; i) điều 1, điều 3 và điều 4 thông tư số 05/2024/tt-bgtvt ngày 31 tháng 3 năm 2024 của bộ trưởng bộ giao thông vận tải sửa đổi, bổ sung một số điều của các thông tư liên quan đến lĩnh vực vận tải đường bộ, dịch vụ hỗ trợ vận tải đường bộ, phương tiện và người lái.', '1. tiêu chuẩn sức khỏe của người lái xe, người điều khiển xe máy chuyên dùng quy định tại phụ lục i ban hành kèm theo thông tư này. 2. tiêu chuẩn sức khỏe của người lái xe, người điều khiển xe máy chuyên dùng chia theo 3 nhóm, cụ thể như sau: a) nhóm 1: áp dụng với trường hợp khám sức khỏe để cấp giấy phép lái xe hạng a1, b1 và người điều khiển xe máy chuyên dùng; b) nhóm 2: áp dụng với trường hợp khám sức khỏe để cấp giấy phép lái hạng a và b; c) nhóm 3: áp dụng với trường hợp khám sức khỏe để cấp giấy phép lái hạng c1, c, d1, d2, d, be, c1e, ce, d1e, d2e và de. 3. người có giấy phép lái xe đã được cấp trước ngày 01 tháng 01 năm 2025 nếu có nhu cầu đổi, cấp lại giấy phép lái xe từ hạng a1 sang giấy phép lái xe hạng a theo quy định tại điểm a khoản 3 điều 89 luật trật tự, an toàn giao thông đường bộ: áp dụng tiêu chuẩn sức khỏe nhóm 1 để khám sức khỏe. 4. việc khám sức khỏe đối với người khuyết tật đề nghị cấp giấy phép lái xe hạng a1 hoặc cấp giấy phép lái xe hạng b quy định tại khoản 2 điều 57 luật trật tự, an toàn giao thông đường bộ: áp dụng tiêu chuẩn sức khỏe quy định tại phụ lục i ban hành kèm theo thông tư này để khám sức khỏe nhưng không phải khám chuyên khoa cơ xương khớp.', '1. thông tư này có hiệu lực thi hành từ ngày 01 tháng 01 năm 2025 và thay thế các văn bản quy phạm pháp luật sau: a) thông tư số 72/2019/tt-bca ngày 12 tháng 12 năm 2019 của bộ trưởng bộ công an quy định về tổ chức kiểm định an toàn kỹ thuật và bảo vệ môi trường đối với xe ô tô, xe máy chuyên dùng trong công an nhân dân (sau đây viết gọn là thông tư số 72/2019/tt-bca); b) thông tư số 118/2021/tt-bca ngày 06 tháng 12 năm 2021 của bộ trưởng bộ công an quy định về việc cải tạo xe cơ giới trong công an nhân dân (sau đây viết gọn là thông tư số 118/2021/tt-bca). 2. giấy chứng nhận thẩm định thiết kế xe cơ giới cải tạo và giấy chứng nhận chất lượng an toàn kỹ thuật và bảo vệ môi trường xe cơ giới cải tạo đã cấp theo quy định tại thông tư số 118/2021/tt-bca thì được tiếp tục sử dụng đến hết thời hạn được ghi trên giấy chứng nhận. đối với những biểu mẫu đã in theo quy định tại thông tư số 118/2021/tt-bca nhưng chưa sử dụng, gồm: giấy chứng nhận thẩm định thiết kế xe cơ giới cải tạo, giấy chứng nhận chất lượng an toàn kỹ thuật và bảo vệ môi trường xe cơ giới cải tạo được tiếp tục sử dụng đến ngày 31 tháng 12 năm 2025. 3. giấy chứng nhận kiểm định, tem kiểm định đã cấp theo quy định tại thông tư số 72/2019/tt-bca thì tiếp tục sử dụng đến hết thời hạn được ghi trên giấy chứng nhận kiểm định, tem kiểm định. đối với những biểu mẫu đã in theo quy định tại thông tư số 72/2019/tt-bca nhưng chưa sử dụng, gồm: sổ kiểm định, tem kiểm định, giấy chứng kiểm định được tiếp tục sử dụng đến ngày 31 tháng 12 năm 2025. 4. sổ kiểm định đã cấp theo quy định tại thông tư số 72/2019/tt-bca thì vẫn có giá trị sử dụng. 5. xe cơ giới được cải tạo từ xe ô tô sát xi theo quy định tại thông tư số 118/2021/tt-bca được áp dụng chu kỳ kiểm định như xe sản xuất, lắp ráp được quy định tại mục 1 phụ lục iii ban hành kèm theo thông tư này khi thông tư này có hiệu lực. 6. giấy chứng nhận cán bộ kiểm định xe công an nhân dân đã được cấp theo quy định tại thông tư số 72/2019/tt-bca thì được tiếp tục sử dụng. biểu mẫu giấy chứng nhận cán bộ kiểm định xe công an nhân dân đã in theo quy định tại thông tư số 72/2019/tt-bca nhưng chưa sử dụng thì được tiếp tục sử dụng đến ngày 31 tháng 12 năm 2025. 7. trường hợp các văn bản quy phạm pháp luật được dẫn chiếu trong thông tư này được sửa đổi, bổ sung, thay thế thì nội dung dẫn chiếu thực hiện theo văn bản quy phạm pháp luật được sửa đổi, bổ sung, thay thế.']","**Nguồn văn bản:** 35_2024_TT-BGTVT_624356

**Tên văn bản:** Thông tư Quy định về đào tạo, sát hạch, cấp giấy phép lái xe; cấp, sử dụng giấy phép lái xe quốc tế; đào tạo, kiểm tra, cấp chứng chỉ bồi dưỡng kiến thức pháp luật về giao thông đường bộ

**Điều 38:** đổi giấy phép lái xe do ngành công an cấp sang giấy phép lái xe do ngành giao thông vận tải cấp

**Nội dung:**

Thông tư này không đề cập đến những thay đổi về phân hạng giấy phép lái xe trong Luật Giao thông Đường bộ năm 2025.  Thông tư tập trung vào quy trình đổi giấy phép lái xe do ngành công an cấp sang giấy phép lái xe do ngành giao thông vận tải cấp, bao gồm các yêu cầu, hồ sơ và trình tự thực hiện.  Nội dung không cung cấp thông tin về việc sửa đổi, bổ sung hay thay đổi phân hạng giấy phép lái xe.


**Điều 66:** Hiệu lực thi hành

**Nội dung:**

Điều này nêu rõ thông tư có hiệu lực từ ngày 01 tháng 01 năm 2025 và bãi bỏ một số thông tư cũ liên quan đến đào tạo, sát hạch, cấp giấy phép lái xe và các vấn đề khác. Tuy nhiên, không có thông tin nào liên quan đến việc thay đổi phân hạng giấy phép lái xe.


**Nguồn văn bản:** 36_2024_TT-BYT_622478

**Tên văn bản:** Thông tư Quy định về tiêu chuẩn sức khỏe, việc khám sức khỏe đối với người lái xe, người điều khiển xe máy chuyên dùng; việc khám sức khỏe định kỳ đối với người hành nghề lái xe ô tô; cơ sở dữ liệu về sức khỏe của người lái xe, người điều khiển xe máy chuyên dùng

**Điều 2:** Tiêu chuẩn sức khỏe của người lái xe, người điều khiển xe máy chuyên dùng

**Nội dung:**

Thông tư này đề cập đến tiêu chuẩn sức khỏe cho các hạng giấy phép lái xe (A1, B1, A, B, C1, C, D1, D2, D, BE, C1E, CE, D1E, D2E, DE), nhưng không cung cấp thông tin về sự thay đổi phân hạng giấy phép lái xe trong Luật Giao thông Đường bộ năm 2025.


**Nguồn văn bản:** 82_2024_TT-BCA_634522

**Tên văn bản:** Thông tư Quy định về chứng nhận chất lượng an toàn kỹ thuật và bảo vệ môi trường của xe cơ giới, xe máy chuyên dùng, phụ tùng xe cơ giới trong nhập khẩu, sản xuất, lắp ráp, cải tạo và kiểm định xe cơ giới, xe máy chuyên dùng thuộc phạm vi quản lý của bộ công an

**Điều 39:** Hiệu lực thi hành và điều khoản chuyển tiếp

**Nội dung:**

Thông tư này không liên quan đến phân hạng giấy phép lái xe.


Tóm lại:  Không tìm thấy thông tin về những thay đổi về phân hạng giấy phép lái xe trong Luật Giao thông Đường bộ năm 2025 trong các văn bản được cung cấp.
","Từ năm 2025, hệ thống phân hạng giấy phép lái xe được mở rộng lên 15 hạng: A1, A, B1, B, C1, C, D1, D2, D, BE, C1E, CE, D1E, D2E, DE.",1.0,0.8639428560252065,0.0,0.0
1,Giấy phép lái xe hạng A1 mới cấp cho loại xe nào?,"['1. tự học áp dụng đối với các môn học lý thuyết để cấp giấy phép lái xe các hạng a1, a và b1. 2. người học phải đăng ký tại cơ sở được phép đào tạo để được quản lý theo quy định của bộ giao thông vận tải.', '1. giấy phép lái xe được cấp trước ngày luật này có hiệu lực thi hành được tiếp tục sử dụng theo thời hạn ghi trên giấy phép lái xe. 2. giấy phép lái xe được cấp trước ngày luật này có hiệu lực thi hành nếu chưa thực hiện đổi, cấp lại theo quy định của luật này có hiệu lực sử dụng như sau: a) giấy phép lái xe hạng a1 được tiếp tục điều khiển xe mô tô hai bánh có dung tích xi-lanh từ 50 cm3\xa0đến dưới 175 cm3 hoặc có công suất động cơ điện từ 04 kw đến dưới 14 kw; b) giấy phép lái xe hạng a2 được tiếp tục điều khiển xe mô tô hai bánh có dung tích xi-lanh từ 175 cm3\xa0trở lên hoặc có công suất động cơ điện từ 14 kw trở lên và các loại xe quy định cho giấy phép lái xe hạng a1 quy định tại điểm a khoản này; c) giấy phép lái xe hạng a3 được tiếp tục điều khiển xe mô tô ba bánh, các loại xe quy định cho giấy phép lái xe hạng a1 quy định tại điểm a khoản này và các xe tương tự; d) giấy phép lái xe hạng a4 được tiếp tục điều khiển máy kéo có trọng tải đến 1.000 kg; đ) giấy phép lái xe hạng b1 số tự động cấp cho người không hành nghề lái xe được tiếp tục điều khiển xe ô tô số tự động chở người đến 08 chỗ (không kể chỗ của người lái xe); xe ô tô tải, kể cả ô tô tải chuyên dùng số tự động có trọng tải dưới 3.500 kg; e) giấy phép lái xe hạng b1 cấp cho người không hành nghề lái xe được tiếp tục điều khiển xe ô tô chở người đến 08 chỗ (không kể chỗ của người lái xe); xe ô tô tải, máy kéo có trọng tải dưới 3.500 kg; g) giấy phép lái xe hạng b2 cấp cho người hành nghề lái xe được tiếp tục điều khiển xe ô tô chở người đến 08 chỗ (không kể chỗ của người lái xe); xe ô tô tải, máy kéo có trọng tải dưới 3.500 kg; h) giấy phép lái xe hạng c được tiếp tục điều khiển xe ô tô tải, máy kéo có trọng tải từ 3.500 kg trở lên và các loại xe quy định cho các giấy phép lái xe hạng b1, b2 quy định tại các điểm đ, e và g khoản này; i) giấy phép lái xe hạng d được tiếp tục điều khiển xe ô tô chở người từ 09 chỗ (không kể chỗ của người lái xe) đến 29 chỗ (không kể chỗ của người lái xe) và các loại xe quy định cho các giấy phép lái xe hạng b1, b2, c quy định tại các điểm đ, e, g và h khoản này; k) giấy phép lái xe hạng e được tiếp tục điều khiển xe ô tô chở người trên 29 chỗ (không kể chỗ của người lái xe) và các loại xe quy định cho các giấy phép lái xe hạng b1, b2, c, d quy định tại các điểm đ, e, g, h và i khoản này; l) giấy phép lái xe hạng fb2, fd được tiếp tục điều khiển các loại xe quy định cho giấy phép lái xe hạng b2, d quy định tại điểm g và điểm i khoản này khi kéo rơ moóc; giấy phép lái xe hạng fc được tiếp tục điều khiển các loại xe quy định cho giấy phép lái xe hạng c quy định tại điểm h khoản này khi kéo rơ moóc, đầu kéo kéo sơ mi rơ moóc; giấy phép lái xe hạng fe được tiếp tục điều khiển các loại xe quy định cho giấy phép lái xe hạng e quy định tại điểm k khoản này khi kéo rơ moóc\xa0hoặc xe ô tô chở khách nối toa. 3. trường hợp người có giấy phép lái xe đã được cấp trước ngày luật này có hiệu lực thi hành có nhu cầu đổi, cấp lại giấy phép lái xe thì thực hiện như sau: a) giấy phép lái xe hạng a1 được đổi, cấp lại sang giấy phép lái xe hạng a với điều kiện hạn chế là chỉ được điều khiển xe mô tô hai bánh có dung tích xi-lanh đến dưới 175 cm3 hoặc có công suất động cơ điện đến dưới 14 kw; b) giấy phép lái xe hạng a2 được đổi, cấp lại sang giấy phép lái xe hạng a; c) giấy phép lái xe hạng a3 được đổi, cấp lại sang giấy phép lái xe hạng b1; d) giấy phép lái xe hạng a4 được đổi, cấp lại sang chứng chỉ điều khiển xe máy chuyên dùng cho người điều khiển máy kéo có trọng tải đến 1.000 kg và chứng chỉ bồi dưỡng kiến thức pháp luật về giao thông đường bộ cho người điều khiển xe máy chuyên dùng; đ) giấy phép lái xe hạng b1 số tự động được đổi, cấp lại sang giấy phép lái xe hạng b với điều kiện hạn chế là chỉ được điều khiển xe ô tô số tự động; e) giấy phép lái xe hạng b1, b2 được đổi, cấp lại sang giấy phép lái xe hạng b hoặc hạng c1 và chứng chỉ điều khiển xe máy chuyên dùng cho người điều khiển máy kéo có trọng tải đến 3.500 kg; g) giấy phép lái xe hạng c giữ nguyên và đổi, cấp lại cùng hạng và chứng chỉ điều khiển xe máy chuyên dùng cho người điều khiển máy kéo có trọng tải trên 3.500 kg; h) giấy phép lái xe hạng d được đổi, cấp lại sang giấy phép lái xe hạng d2 và chứng chỉ điều khiển xe máy chuyên dùng cho người điều khiển máy kéo có trọng tải trên 3.500 kg; i) giấy phép lái xe hạng e được đổi, cấp lại sang giấy phép lái xe hạng d và chứng chỉ điều khiển xe máy chuyên dùng cho người điều khiển máy kéo có trọng tải trên 3.500 kg; k) giấy phép lái xe hạng fb2 được đổi, cấp lại sang giấy phép lái xe hạng be hoặc hạng c1e và chứng chỉ điều khiển xe máy chuyên dùng cho người điều khiển máy kéo có trọng tải đến 3.500 kg; l) giấy phép lái xe hạng fc được đổi, cấp lại sang giấy phép lái xe hạng ce và chứng chỉ điều khiển xe máy chuyên dùng cho người điều khiển máy kéo có trọng tải trên 3.500 kg; m) giấy phép lái xe hạng fd được đổi, cấp lại sang giấy phép lái xe hạng d2e và chứng chỉ điều khiển xe máy chuyên dùng cho người điều khiển máy kéo có trọng tải trên 3.500 kg; n) giấy phép lái xe hạng fe được đổi, cấp lại sang giấy phép lái xe hạng de và chứng chỉ điều khiển xe máy chuyên dùng cho người điều khiển máy kéo có trọng tải trên 3.500 kg. 4. người học lái xe đã được đào tạo lái xe trước ngày luật này có hiệu lực thi hành hoặc đang được đào tạo lái xe tại ngày luật này có hiệu lực thi hành chưa được sát hạch, cấp giấy phép lái xe thì được sát hạch, cấp giấy phép lái xe theo hạng giấy phép lái xe đổi, cấp lại quy định tại khoản 3 điều này. 5. chứng nhận đăng ký xe, biển số xe máy chuyên dùng cấp trước ngày luật này có hiệu lực thi hành vẫn có giá trị sử dụng. 6. chứng nhận chất lượng an toàn kỹ thuật và bảo vệ môi trường được cấp trước ngày luật này có hiệu lực thi hành thì có giá trị sử dụng đến hết thời hạn ghi trên giấy chứng nhận đó. 7. việc đấu giá biển số xe ô tô được thực hiện trước ngày luật này có hiệu lực thi hành và đến ngày luật này có hiệu lực thi hành đã được cấp văn bản xác nhận biển số xe ô tô trúng đấu giá thì tiếp tục thực hiện theo nghị quyết số 73/2022/qh15 của quốc hội về thí điểm đấu giá biển số xe ô tô; trường hợp chưa được cấp xác nhận biển số xe ô tô trúng đấu giá thì tiếp tục thực hiện theo nghị quyết số 73/2022/qh15 của quốc hội về thí điểm đấu giá biển số xe ô tô và quy định tại điểm d khoản 1 điều 38 của luật này./. luật này được quốc hội nước cộng hòa xã hội chủ nghĩa việt nam khóa xv, kỳ họp thứ 7 thông qua ngày 27 tháng 6 năm 2024.', '1. giấy phép lái xe bao gồm các hạng sau đây: a) hạng a1 cấp cho người lái xe mô tô hai bánh có dung tích xi-lanh đến 125 cm3 hoặc có công suất động cơ điện đến 11 kw; b) hạng a cấp cho người lái xe mô tô hai bánh có dung tích xi-lanh\xa0 trên 125 cm3\xa0hoặc có công suất động cơ điện trên 11 kw và các loại xe quy định cho giấy phép lái xe hạng a1; c) hạng b1 cấp cho người lái xe mô tô ba bánh và các loại xe quy định cho giấy phép lái xe hạng a1; d) hạng b cấp cho người lái xe ô tô chở người đến 08 chỗ (không kể chỗ của người lái xe); xe ô tô tải và ô tô chuyên dùng có khối lượng toàn bộ theo thiết kế đến 3.500 kg; các loại xe ô tô quy định cho giấy phép lái xe hạng b kéo rơ moóc có khối lượng toàn bộ theo thiết kế đến 750 kg; đ) hạng c1 cấp cho người lái xe ô tô tải và ô tô chuyên dùng có khối lượng toàn bộ theo thiết kế trên 3.500 kg đến 7.500 kg; các loại xe ô tô tải quy định cho giấy phép lái xe hạng c1 kéo rơ moóc có khối lượng toàn bộ theo thiết kế đến 750 kg; các loại xe quy định cho giấy phép lái xe hạng b; e) hạng c cấp cho người lái xe ô tô tải và ô tô chuyên dùng có khối lượng toàn bộ theo thiết kế trên 7.500 kg; các loại xe ô tô tải quy định cho giấy phép lái xe hạng c kéo rơ moóc có khối lượng toàn bộ theo thiết kế đến 750 kg; các loại xe quy định cho giấy phép lái xe hạng b và hạng c1; g) hạng d1 cấp cho người lái xe ô tô chở người trên 08 chỗ (không kể chỗ của người lái xe) đến 16 chỗ (không kể chỗ của người lái xe); các loại xe ô tô chở người quy định cho giấy phép lái xe hạng d1 kéo rơ moóc có khối lượng toàn bộ theo thiết kế đến 750 kg; các loại xe quy định cho giấy phép lái xe các hạng b, c1, c; h) hạng d2 cấp cho người lái xe ô tô chở người (kể cả xe buýt) trên 16 chỗ (không kể chỗ của người lái xe) đến 29 chỗ (không kể chỗ của người lái xe); các loại xe ô tô chở người quy định cho giấy phép lái xe hạng d2 kéo rơ moóc có khối lượng toàn bộ theo thiết kế đến 750 kg; các loại xe quy định cho giấy phép lái xe các hạng b, c1, c, d1; i) hạng d cấp cho người lái xe ô tô chở người (kể cả xe buýt) trên 29 chỗ (không kể chỗ của người lái xe); xe ô tô chở người giường nằm; các loại xe ô tô chở người quy định cho giấy phép lái xe hạng d kéo rơ moóc có khối lượng toàn bộ theo thiết kế đến 750 kg; các loại xe quy định cho giấy phép lái xe các hạng b, c1, c, d1, d2; k) hạng be cấp cho người lái các loại xe ô tô quy định cho giấy phép lái xe hạng b kéo rơ moóc có khối lượng toàn bộ theo thiết kế trên 750 kg; l) hạng c1e cấp cho người lái các loại xe ô tô quy định cho giấy phép lái xe hạng c1 kéo rơ moóc có khối lượng toàn bộ theo thiết kế trên 750 kg; m) hạng ce cấp cho người lái các loại xe ô tô quy định cho giấy phép lái xe hạng c kéo rơ moóc có khối lượng toàn bộ theo thiết kế trên 750 kg; xe ô tô đầu kéo kéo sơ mi rơ moóc; n) hạng d1e cấp cho người lái các loại xe ô tô quy định cho giấy phép lái xe hạng d1 kéo rơ moóc có khối lượng toàn bộ theo thiết kế trên 750 kg; o) hạng d2e cấp cho người lái các loại xe ô tô quy định cho giấy phép lái xe hạng d2 kéo rơ moóc có khối lượng toàn bộ theo thiết kế trên 750 kg; p) hạng de cấp cho người lái các loại xe ô tô quy định cho giấy phép lái xe hạng d kéo rơ moóc có khối lượng toàn bộ theo thiết kế trên 750 kg; xe ô tô chở khách nối toa. 2. người khuyết tật điều khiển xe mô tô ba bánh dùng cho người khuyết tật được cấp giấy phép lái xe hạng a1. người khuyết tật điều khiển xe ô tô số tự động có kết cấu phù hợp với tình trạng khuyết tật thì được cấp giấy phép lái xe hạng b. 3. người điều khiển xe chở hàng bốn bánh có gắn động cơ, xe chở người bốn bánh có gắn động cơ phải sử dụng giấy phép lái xe có hạng phù hợp với xe ô tô tải hoặc xe ô tô chở người tương ứng. 4. người điều khiển xe ô tô có thiết kế, cải tạo với số chỗ ít hơn xe cùng loại, kích thước giới hạn tương đương phải sử dụng giấy phép lái xe có hạng phù hợp với xe ô tô cùng loại, kích thước giới hạn tương đương và có số chỗ nhiều nhất. 5. thời hạn của giấy phép lái xe được quy định như sau: a) giấy phép lái xe các hạng a1, a, b1 không thời hạn; b) giấy phép lái xe hạng b và hạng c1 có thời hạn 10 năm kể từ ngày cấp; c) giấy phép lái xe các hạng c, d1, d2, d, be, c1e, ce, d1e, d2e và de có thời hạn 05 năm kể từ ngày cấp. 6. giấy phép lái xe có giá trị sử dụng trong phạm vi lãnh thổ việt nam bao gồm: a) giấy phép lái xe do cơ quan có thẩm quyền của việt nam cấp; b) giấy phép lái xe quốc tế và giấy phép lái xe quốc gia phù hợp với loại xe được phép điều khiển do quốc gia là thành viên của công ước của liên hợp quốc về giao thông đường bộ năm 1968 (sau đây gọi là công ước viên) cấp; c) giấy phép lái xe phù hợp với loại xe được phép điều khiển của nước hoặc vùng lãnh thổ mà việt nam ký kết điều ước quốc tế hoặc thỏa thuận quốc tế công nhận giấy phép lái xe của nhau; d) giấy phép lái xe nước ngoài phù hợp với loại xe được phép điều khiển do quốc gia được công nhận theo điều ước quốc tế mà nước cộng hòa xã hội chủ nghĩa việt nam là thành viên. 7. giấy phép lái xe không có hiệu lực trong các trường hợp sau đây: a) giấy phép lái xe hết thời hạn sử dụng; b) giấy phép lái xe bị thu hồi theo quy định tại khoản 5 điều 62 của luật này. 8. giấy phép lái xe quốc tế được quy định như sau: a) giấy phép lái xe quốc tế là giấy phép lái xe do cơ quan nhà nước có thẩm quyền của quốc gia là thành viên của công ước viên cấp theo một mẫu thống nhất; có thời hạn không quá 03 năm kể từ ngày cấp và phải phù hợp với thời hạn còn hiệu lực của giấy phép lái xe quốc gia; b) người có giấy phép lái xe quốc tế do quốc gia là thành viên của công ước viên cấp khi lái xe tham gia giao thông đường bộ trên lãnh thổ việt nam phải mang theo giấy phép lái xe quốc tế và giấy phép lái xe quốc gia được cấp phù hợp với hạng xe điều khiển, còn thời hạn sử dụng; phải tuân thủ pháp luật về trật tự, an toàn giao thông đường bộ của việt nam; c) người có giấy phép lái xe quốc tế vi phạm pháp luật về trật tự, an toàn giao thông đường bộ của việt nam mà bị tước quyền sử dụng giấy phép lái xe có thời hạn thì thời gian bị tước quyền sử dụng không quá thời gian người lái xe được phép cư trú tại lãnh thổ việt nam; d) người việt nam hoặc người nước ngoài có thẻ thường trú hoặc thẻ tạm trú tại việt nam có giấy phép lái xe do việt nam hoặc quốc gia là thành viên của điều ước quốc tế mà nước cộng hòa xã hội chủ nghĩa việt nam là thành viên cấp, còn giá trị sử dụng, nếu có nhu cầu được cấp giấy phép lái xe quốc tế. 9. bộ trưởng bộ giao thông vận tải quy định mẫu giấy phép lái xe và giấy phép lái xe quốc tế, trình tự, thủ tục cấp và việc sử dụng giấy phép lái xe, giấy phép lái xe quốc tế; đối với mẫu giấy phép lái xe, trình tự, thủ tục cấp và việc sử dụng giấy phép lái xe của lực lượng quân đội, công an làm nhiệm vụ quốc phòng, an ninh do bộ trưởng bộ quốc phòng, bộ trưởng bộ công an quy định.', '1. giấy phép lái xe quân sự được cấp trước ngày thông tư này có hiệu lực thi hành được tiếp tục sử dụng theo thời hạn ghi trên giấy phép lái xe. 2. giấy phép lái xe quân sự được cấp trước ngày thông tư này có hiệu lực thi hành nếu chưa thực hiện đổi, cấp lại theo quy định của thông tư này có hiệu lực sử dụng như sau: a) giấy phép lái xe quân sự hạng a1 được tiếp tục điều khiển xe mô tô hai bánh có dung tích xi-lanh từ 50 cm3 đến dưới 175 cm3 hoặc có công suất động cơ điện từ 04 kw đến dưới 14 kw; b) giấy phép lái xe quân sự hạng a2 được tiếp tục điều khiển xe mô tô hai bánh có dung tích xi-lanh từ 175 cm3 trở lên hoặc có công suất động cơ điện từ 14 kw trở lên và các loại xe quy định cho giấy phép lái xe hạng a1 quy định tại điểm a khoản này; c) giấy phép lái xe quân sự hạng a3 được tiếp tục điều khiển xe mô tô ba bánh, các loại xe quy định cho giấy phép lái xe hạng a1 quy định tại điểm a khoản này và các xe tương tự; d) giấy phép lái xe quân sự hạng b2 được tiếp tục điều khiển xe ô tô chở người đến 08 chỗ (không kể chỗ của người lái xe); xe ô tô tải, máy kéo có trọng tải dưới 3.500 kg; các loại xe ô tô quy định cho giấy phép lái xe hạng b kéo theo một rơ moóc hoặc vũ khí, khí tài quân sự dạng rơ moóc có khối lượng toàn bộ theo thiết kế đến 750 kg; đ) giấy phép lái xe quân sự hạng c được tiếp tục điều khiển xe ô tô tải, máy kéo có trọng tải từ 3.500 kg trở lên và các loại xe quy định cho các giấy phép lái xe hạng b2 quy định tại điểm d khoản này; các loại xe ô tô quy định cho giấy phép lái xe hạng c kéo theo một rơ moóc hoặc vũ khí, khí tài quân sự dạng rơ moóc có khối lượng toàn bộ theo thiết kế đến 750 kg; e) giấy phép lái xe quân sự hạng d được tiếp tục điều khiển xe ô tô chở người từ 09 chỗ (không kể chỗ của người lái xe) đến 29 chỗ (không kể chỗ của người lái xe) và các loại xe quy định cho các giấy phép lái xe hạng b2, c quy định tại các điểm d, đ khoản này; các loại xe ô tô quy định cho giấy phép lái xe hạng d2 kéo theo một rơ moóc hoặc vũ khí, khí tài quân sự dạng rơ moóc có khối lượng toàn bộ theo thiết kế đến 750 kg; g) giấy phép lái xe quân sự hạng e được tiếp tục điều khiển xe ô tô chở người trên 29 chỗ (không kể chỗ của người lái xe) và các loại xe quy định cho các giấy phép lái xe hạng b2, c, d quy định tại các điểm d, đ và e khoản này; các loại ô tô quy định cho giấy phép lái xe hạng d kéo theo một rơ moóc hoặc vũ khí, khí tài quân sự dạng rơ moóc có khối lượng toàn bộ theo thiết kế đến 750 kg; h) giấy phép lái xe quân sự hạng fc được tiếp tục điều khiển các loại xe quy định cho giấy phép lái xe hạng c quy định tại điểm đ khoản này khi kéo rơ moóc, khí tài quân sự dạng rơ moóc và ô tô đầu kéo kéo sơ mi rơ moóc, khí tài quân sự dạng sơ mi rơ moóc; i) giấy phép lái xe quân sự hạng fx được tiếp tục điều khiển xe xích kéo vũ khí, khí tài quân sự và các loại xe quy định cho giấy phép lái xe hạng c quy định tại điểm đ khoản này. 3. trường hợp người có giấy phép, lái xe quân sự đã được cấp trước ngày thông tư này có hiệu lực thi hành khi đổi, cấp lại giấy phép lái xe thì thực hiện như sau: a) giấy phép lái xe quân sự hạng a1 được đổi, cấp lại sang giấy phép lái xe quân sự hạng a với điều kiện hạn chế là chỉ được điều khiển xe mô tô hai bánh có dung tích xi-lanh đến dưới 175 cm3 hoặc có công suất động cơ điện đến dưới 14 kw; b) giấy phép lái xe quân sự hạng a2 được đổi, cấp lại sang giấy phép lái xe quân sự hạng a; c) giấy phép lái xe quân sự hạng a3 được đổi, cấp lại sang giấy phép lái xe quân sự hạng b1; d) giấy phép lái xe quân sự hạng b2 được đổi, cấp lại sang giấy phép lái xe quân sự hạng b hoặc hạng c1; đ) giấy phép lái xe quân sự hạng c giữ nguyên và đổi, cấp lại cùng hạng; e) giấy phép lái xe quân sự hạng d được đổi, cấp lại sang giấy phép lái xe quân sự hạng d2; g) giấy phép lái xe quân sự hạng e được đổi, cấp lại sang giấy phép lái xe quân sự hạng d; h) giấy phép lái xe quân sự hạng fc được đổi, cấp lại sang giấy phép lái xe quân sự hạng ce; i) giấy phép lái xe quân sự hạng fx được đổi, cấp lại sang giấy phép lái xe quân sự hạng cx; 4. người học lái xe đã được đào tạo lái xe trước ngày thông tư này có hiệu lực thi hành hoặc đang được đào tạo lái xe tại ngày thông tư này có hiệu lực thi hành chưa được sát hạch thì được sát hạch, cấp giấy phép lái xe theo hạng giấy phép lái xe đổi, cấp lại quy định tại khoản 3 điều này.']","**Nguồn văn bản:** 36_2024_QH15_444251

**Tên văn bản:** Luật Trật tự, an toàn giao thông đường bộ

**Điều 57:** Giấy phép lái xe

**Nội dung:**

1. Giấy phép lái xe hạng A1 cấp cho người lái xe mô tô hai bánh có dung tích xi-lanh đến 125 cm3 hoặc có công suất động cơ điện đến 11 kW.


Tóm lại: Giấy phép lái xe hạng A1 được phép điều khiển xe mô tô hai bánh có dung tích xi-lanh đến 125 cm3 hoặc công suất động cơ điện đến 11 kW.
",Hạng A1 mới cấp cho người lái xe mô tô từ trên 50 phân khối đến 125 phân khối.,1.0,0.5541043674313116,0.0,0.0
2,Thời hạn của giấy phép lái xe hạng B theo Luật Giao thông Đường bộ 2025 là bao lâu?,"['1. là công dân việt nam, người nước ngoài được phép cư trú hoặc đang làm việc, học tập tại việt nam. 2. người học lái xe để nâng hạng giấy phép lái xe phải đáp ứng theo quy định tại khoản 4 điều 60 luật trật tự, an toàn giao thông đường bộ; trong đó, thời gian lái xe an toàn cho từng hạng giấy phép lái xe được quy định cụ thể như sau: a) hạng b lên c1, b lên c, b lên d1, b lên be, c1 lên c, c1 lên d1, c1 lên d2, c1 lên c1e, c lên d1, c lên d2, d1 lên d2, d1 lên d, d1 lên d1e, d2 lên d, d2 lên d2e, d lên de: thời gian lái xe an toàn từ 02 năm trở lên; b) hạng b lên d2, c lên ce, c lên d: thời gian lái xe an toàn từ 03 năm trở lên. 3. người đã có giấy phép lái xe hạng b số tự động được đăng ký học để cấp mới giấy phép lái xe hạng b số cơ khí (số sàn), người đã có giấy phép lái xe hạng b được đăng ký học để cấp mới giấy phép lái xe hạng c1 và phải học đủ nội dung chương trình đào tạo lái xe theo quy định, hồ sơ của người học lái xe thực hiện theo quy định tại khoản 1 điều 15 thông tư này; trường hợp đạt kết quả sát hạch, cơ quan tổ chức sát hạch có văn bản đề nghị cơ quan đã cấp giấy phép xe cắt góc giấy phép lái xe cũ và có văn bản đề nghị cục đường bộ việt nam xóa số quản lý giấy phép lái xe đã cấp.', '1. người đạt kết quả kỳ sát hạch được cấp giấy phép lái xe đúng hạng đã trúng tuyển; đối với trường hợp nâng hạng hoặc cấp theo quy định tại khoản 2 điều này phải xuất trình bản chính giấy phép lái xe khi đến nhận giấy phép lái xe a) căn cứ quyết định công nhận trúng tuyển kỳ sát hạch, sở giao thông vận tải cấp giấy phép lái xe cho người trúng tuyển. ngày trúng tuyển ghi tại mặt sau giấy phép lái xe là ngày ký quyết định công nhận trúng tuyển kỳ sát hạch; b) thời gian cấp giấy phép lái xe chậm nhất không quá 10 ngày, kể từ ngày kết thúc kỳ sát hạch và người đạt kết quả kỳ sát hạch đã hoàn thành nghĩa vụ nộp lệ phí cấp giấy phép lái xe. 2. người có giấy phép lái xe quá thời hạn sử dụng a) người có giấy phép lái xe các hạng b, c1, c, d1, d2, d, be, c1e, ce, d1e, d2e, de quá thời hạn sử dụng quá hạn dưới 01 năm kể từ ngày hết hạn phải sát hạch lý thuyết theo quy định tại điểm a khoản 1 điều 17 thông tư này để cấp giấy phép lái xe. quá hạn từ 01 năm trở lên kể từ ngày hết hạn phải sát hạch lý thuyết, thực hành lái xe trong hình và trên đường để cấp giấy phép lái xe theo quy định tại khoản 1, khoản 2 và khoản 3 điều 17 thông tư này. hồ sơ dự sát hạch thực hiện theo quy định tại khoản 3 điều 29 thông tư này; b) người có giấy phép lái xe các hạng b, c1, c, d1, d2, d, be, c1e, ce, d1e, d2e, de bị mất nhưng quá thời hạn sử dụng, có tên trong hồ sơ của sở giao thông vận tải, không thuộc trường hợp đang bị các cơ quan có thẩm quyền thu giữ, xử lý phải dự sát hạch các nội dung: quá hạn dưới 01 năm, phải dự sát hạch lý thuyết để cấp giấy phép lái xe theo quy định tại điểm a khoản 1 điều 17 thông tư này. quá hạn từ 01 năm trở lên kể từ ngày hết hạn phải sát hạch lý thuyết, thực hành lái xe trong hình và trên đường để cấp giấy phép lái xe theo quy định tại khoản 1, khoản 2 và khoản 3 điều 17 thông tư này. hồ sơ dự sát hạch thực hiện theo quy định tại khoản 3 điều 29 của thông tư này; c) ngày trúng tuyển ghi tại mặt sau giấy phép lái xe được tính theo ngày trúng tuyển của giấy phép lái xe cũ; d) người dự sát hạch có nhu cầu ôn tập, đăng ký với các cơ sở đào tạo lái xe để được hướng dẫn ôn tập, phải nộp phí ôn tập theo quy định, không phải học lại theo chương trình đào tạo; đ) trường hợp không đạt kết quả để được cấp giấy phép lái xe, người có giấy phép lái xe quá thời hạn sử dụng, bị mất nhưng quá thời hạn sử dụng phải đăng ký với sở giao thông vận tải để tham gia sát hạch lại. 3. chưa sát hạch cấp giấy phép lái xe đối với người vi phạm trật tự, an toàn giao thông đường bộ chưa thực hiện xong yêu cầu của cơ quan nhà nước có thẩm quyền về giải quyết, xử lý vụ việc vi phạm hành chính trong lĩnh vực trật tự, an toàn giao thông đường bộ.', '1. giấy phép lái xe bao gồm các hạng sau đây: a) hạng a1 cấp cho người lái xe mô tô hai bánh có dung tích xi-lanh đến 125 cm3 hoặc có công suất động cơ điện đến 11 kw; b) hạng a cấp cho người lái xe mô tô hai bánh có dung tích xi-lanh\xa0 trên 125 cm3\xa0hoặc có công suất động cơ điện trên 11 kw và các loại xe quy định cho giấy phép lái xe hạng a1; c) hạng b1 cấp cho người lái xe mô tô ba bánh và các loại xe quy định cho giấy phép lái xe hạng a1; d) hạng b cấp cho người lái xe ô tô chở người đến 08 chỗ (không kể chỗ của người lái xe); xe ô tô tải và ô tô chuyên dùng có khối lượng toàn bộ theo thiết kế đến 3.500 kg; các loại xe ô tô quy định cho giấy phép lái xe hạng b kéo rơ moóc có khối lượng toàn bộ theo thiết kế đến 750 kg; đ) hạng c1 cấp cho người lái xe ô tô tải và ô tô chuyên dùng có khối lượng toàn bộ theo thiết kế trên 3.500 kg đến 7.500 kg; các loại xe ô tô tải quy định cho giấy phép lái xe hạng c1 kéo rơ moóc có khối lượng toàn bộ theo thiết kế đến 750 kg; các loại xe quy định cho giấy phép lái xe hạng b; e) hạng c cấp cho người lái xe ô tô tải và ô tô chuyên dùng có khối lượng toàn bộ theo thiết kế trên 7.500 kg; các loại xe ô tô tải quy định cho giấy phép lái xe hạng c kéo rơ moóc có khối lượng toàn bộ theo thiết kế đến 750 kg; các loại xe quy định cho giấy phép lái xe hạng b và hạng c1; g) hạng d1 cấp cho người lái xe ô tô chở người trên 08 chỗ (không kể chỗ của người lái xe) đến 16 chỗ (không kể chỗ của người lái xe); các loại xe ô tô chở người quy định cho giấy phép lái xe hạng d1 kéo rơ moóc có khối lượng toàn bộ theo thiết kế đến 750 kg; các loại xe quy định cho giấy phép lái xe các hạng b, c1, c; h) hạng d2 cấp cho người lái xe ô tô chở người (kể cả xe buýt) trên 16 chỗ (không kể chỗ của người lái xe) đến 29 chỗ (không kể chỗ của người lái xe); các loại xe ô tô chở người quy định cho giấy phép lái xe hạng d2 kéo rơ moóc có khối lượng toàn bộ theo thiết kế đến 750 kg; các loại xe quy định cho giấy phép lái xe các hạng b, c1, c, d1; i) hạng d cấp cho người lái xe ô tô chở người (kể cả xe buýt) trên 29 chỗ (không kể chỗ của người lái xe); xe ô tô chở người giường nằm; các loại xe ô tô chở người quy định cho giấy phép lái xe hạng d kéo rơ moóc có khối lượng toàn bộ theo thiết kế đến 750 kg; các loại xe quy định cho giấy phép lái xe các hạng b, c1, c, d1, d2; k) hạng be cấp cho người lái các loại xe ô tô quy định cho giấy phép lái xe hạng b kéo rơ moóc có khối lượng toàn bộ theo thiết kế trên 750 kg; l) hạng c1e cấp cho người lái các loại xe ô tô quy định cho giấy phép lái xe hạng c1 kéo rơ moóc có khối lượng toàn bộ theo thiết kế trên 750 kg; m) hạng ce cấp cho người lái các loại xe ô tô quy định cho giấy phép lái xe hạng c kéo rơ moóc có khối lượng toàn bộ theo thiết kế trên 750 kg; xe ô tô đầu kéo kéo sơ mi rơ moóc; n) hạng d1e cấp cho người lái các loại xe ô tô quy định cho giấy phép lái xe hạng d1 kéo rơ moóc có khối lượng toàn bộ theo thiết kế trên 750 kg; o) hạng d2e cấp cho người lái các loại xe ô tô quy định cho giấy phép lái xe hạng d2 kéo rơ moóc có khối lượng toàn bộ theo thiết kế trên 750 kg; p) hạng de cấp cho người lái các loại xe ô tô quy định cho giấy phép lái xe hạng d kéo rơ moóc có khối lượng toàn bộ theo thiết kế trên 750 kg; xe ô tô chở khách nối toa. 2. người khuyết tật điều khiển xe mô tô ba bánh dùng cho người khuyết tật được cấp giấy phép lái xe hạng a1. người khuyết tật điều khiển xe ô tô số tự động có kết cấu phù hợp với tình trạng khuyết tật thì được cấp giấy phép lái xe hạng b. 3. người điều khiển xe chở hàng bốn bánh có gắn động cơ, xe chở người bốn bánh có gắn động cơ phải sử dụng giấy phép lái xe có hạng phù hợp với xe ô tô tải hoặc xe ô tô chở người tương ứng. 4. người điều khiển xe ô tô có thiết kế, cải tạo với số chỗ ít hơn xe cùng loại, kích thước giới hạn tương đương phải sử dụng giấy phép lái xe có hạng phù hợp với xe ô tô cùng loại, kích thước giới hạn tương đương và có số chỗ nhiều nhất. 5. thời hạn của giấy phép lái xe được quy định như sau: a) giấy phép lái xe các hạng a1, a, b1 không thời hạn; b) giấy phép lái xe hạng b và hạng c1 có thời hạn 10 năm kể từ ngày cấp; c) giấy phép lái xe các hạng c, d1, d2, d, be, c1e, ce, d1e, d2e và de có thời hạn 05 năm kể từ ngày cấp. 6. giấy phép lái xe có giá trị sử dụng trong phạm vi lãnh thổ việt nam bao gồm: a) giấy phép lái xe do cơ quan có thẩm quyền của việt nam cấp; b) giấy phép lái xe quốc tế và giấy phép lái xe quốc gia phù hợp với loại xe được phép điều khiển do quốc gia là thành viên của công ước của liên hợp quốc về giao thông đường bộ năm 1968 (sau đây gọi là công ước viên) cấp; c) giấy phép lái xe phù hợp với loại xe được phép điều khiển của nước hoặc vùng lãnh thổ mà việt nam ký kết điều ước quốc tế hoặc thỏa thuận quốc tế công nhận giấy phép lái xe của nhau; d) giấy phép lái xe nước ngoài phù hợp với loại xe được phép điều khiển do quốc gia được công nhận theo điều ước quốc tế mà nước cộng hòa xã hội chủ nghĩa việt nam là thành viên. 7. giấy phép lái xe không có hiệu lực trong các trường hợp sau đây: a) giấy phép lái xe hết thời hạn sử dụng; b) giấy phép lái xe bị thu hồi theo quy định tại khoản 5 điều 62 của luật này. 8. giấy phép lái xe quốc tế được quy định như sau: a) giấy phép lái xe quốc tế là giấy phép lái xe do cơ quan nhà nước có thẩm quyền của quốc gia là thành viên của công ước viên cấp theo một mẫu thống nhất; có thời hạn không quá 03 năm kể từ ngày cấp và phải phù hợp với thời hạn còn hiệu lực của giấy phép lái xe quốc gia; b) người có giấy phép lái xe quốc tế do quốc gia là thành viên của công ước viên cấp khi lái xe tham gia giao thông đường bộ trên lãnh thổ việt nam phải mang theo giấy phép lái xe quốc tế và giấy phép lái xe quốc gia được cấp phù hợp với hạng xe điều khiển, còn thời hạn sử dụng; phải tuân thủ pháp luật về trật tự, an toàn giao thông đường bộ của việt nam; c) người có giấy phép lái xe quốc tế vi phạm pháp luật về trật tự, an toàn giao thông đường bộ của việt nam mà bị tước quyền sử dụng giấy phép lái xe có thời hạn thì thời gian bị tước quyền sử dụng không quá thời gian người lái xe được phép cư trú tại lãnh thổ việt nam; d) người việt nam hoặc người nước ngoài có thẻ thường trú hoặc thẻ tạm trú tại việt nam có giấy phép lái xe do việt nam hoặc quốc gia là thành viên của điều ước quốc tế mà nước cộng hòa xã hội chủ nghĩa việt nam là thành viên cấp, còn giá trị sử dụng, nếu có nhu cầu được cấp giấy phép lái xe quốc tế. 9. bộ trưởng bộ giao thông vận tải quy định mẫu giấy phép lái xe và giấy phép lái xe quốc tế, trình tự, thủ tục cấp và việc sử dụng giấy phép lái xe, giấy phép lái xe quốc tế; đối với mẫu giấy phép lái xe, trình tự, thủ tục cấp và việc sử dụng giấy phép lái xe của lực lượng quân đội, công an làm nhiệm vụ quốc phòng, an ninh do bộ trưởng bộ quốc phòng, bộ trưởng bộ công an quy định.', '1. mẫu giấy phép lái xe quân sự a) giấy phép lái xe quân sự thực hiện theo quy định tại mẫu số 08 kèm theo thông tư này; b) cục trưởng cục xe máy - vận tải/tổng cục hậu cần - kỹ thuật có trách nhiệm quản lý việc sử dụng giấy phép lái xe quân sự thuộc phạm vi quản lý của bộ quốc phòng. 2. thời hạn sử dụng giấy phép lái xe quân sự a) giấy phép lái xe quân sự hạng a1, a, b1 là không thời hạn; b) giấy phép lái xe quân sự các hạng b, c1, c, d1, d2, d, c1e, ce, cx có thời hạn 05 năm kể từ ngày cấp; c) trường hợp cấp, đổi do lý do khác thời hạn theo thời hạn ghi trên giấy phép lái xe quân sự. 3. giấy phép lái xe quân sự không có hiệu lực trong các trường hợp sau: a) giấy phép lái xe quân sự hết thời hạn sử dụng được ghi trên giấy phép lái xe; b) giấy phép lái xe quân sự bị trừ hết điểm theo quy định tại điều 7 của thông tư này; c) giấy phép lái xe quân sự có quyết định thu hồi theo khoản 1 điều 47 thông tư này.', '1. quân nhân, công chức quốc phòng, công nhân viên chức quốc phòng, lao động hợp đồng đang phục vụ trong bộ quốc phòng có đủ các điều kiện: tiêu chuẩn về tuổi đời, thời gian công tác, sức khỏe, trình độ văn hóa, phẩm chất chính trị theo quy định của bộ quốc phòng. đối với lao động hợp đồng: chỉ đào tạo nâng hạng khi có đủ điều kiện, tiêu chuẩn quy định tại khoản 1 điều này. 2. đối với người học nâng hạng giấy phép lái xe quân sự phải có thời gian lái xe và số km lái xe an toàn như sau: a) từ hạng b lên hạng c1; hạng c1 lên hạng c, c1e; hạng c lên hạng d1, ce, cx; hạng d1 lên hạng d2; hạng d2 lên hạng d: có thời gian lái xe 02 năm trở lên và 30.000 km lái xe an toàn trở lên (trừ các trường hợp đào tạo chuyển tiếp từ hạng c lên hạng ce hoặc cx theo chỉ tiêu của bộ tổng tham mưu); b) từ hạng b lên hạng c, d1; hạng c1 lên d1; hạng c lên hạng d2; hạng d1 lên hạng d: có thời gian lái xe 03 năm trở lên và có 50.000 km lái xe an toàn trở lên; c) từ hạng b lên hạng d2, từ hạng c1 lên hạng d2, từ hạng c lên hạng d: có thời gian lái xe 05 năm trở lên và 100.000 km lái xe an toàn trở lên. 3. đối với người học nâng hạng giấy phép lái xe quân sự lên hạng d1, d2, d ngoài các quy định tại các khoản 1, 2 điều này phải có bằng tốt nghiệp trung học cơ sở trở lên.']","**Nguồn văn bản:** 36_2024_QH15_444251

**Tên văn bản:** Luật Trật tự, an toàn giao thông đường bộ

**Điều 57:** Giấy phép lái xe

**Nội dung:**

5. Thời hạn của giấy phép lái xe được quy định như sau:

    a) Giấy phép lái xe các hạng A1, A, B1 không thời hạn.

    b) Giấy phép lái xe hạng B và hạng C1 có thời hạn 10 năm kể từ ngày cấp.

    c) Giấy phép lái xe các hạng C, D1, D2, D, BE, C1E, CE, D1E, D2E và DE có thời hạn 05 năm kể từ ngày cấp.


Tóm lại: Thời hạn giấy phép lái xe hạng B là 10 năm kể từ ngày cấp.
",Giấy phép lái xe hạng B có thời hạn 10 năm kể từ ngày cấp.,0.625,0.6435826396351249,1.0,0.3333333333
3,Giấy phép lái xe hạng C1 có thời hạn bao lâu?,"['1. là công dân việt nam, người nước ngoài được phép cư trú hoặc đang làm việc, học tập tại việt nam. 2. người học lái xe để nâng hạng giấy phép lái xe phải đáp ứng theo quy định tại khoản 4 điều 60 luật trật tự, an toàn giao thông đường bộ; trong đó, thời gian lái xe an toàn cho từng hạng giấy phép lái xe được quy định cụ thể như sau: a) hạng b lên c1, b lên c, b lên d1, b lên be, c1 lên c, c1 lên d1, c1 lên d2, c1 lên c1e, c lên d1, c lên d2, d1 lên d2, d1 lên d, d1 lên d1e, d2 lên d, d2 lên d2e, d lên de: thời gian lái xe an toàn từ 02 năm trở lên; b) hạng b lên d2, c lên ce, c lên d: thời gian lái xe an toàn từ 03 năm trở lên. 3. người đã có giấy phép lái xe hạng b số tự động được đăng ký học để cấp mới giấy phép lái xe hạng b số cơ khí (số sàn), người đã có giấy phép lái xe hạng b được đăng ký học để cấp mới giấy phép lái xe hạng c1 và phải học đủ nội dung chương trình đào tạo lái xe theo quy định, hồ sơ của người học lái xe thực hiện theo quy định tại khoản 1 điều 15 thông tư này; trường hợp đạt kết quả sát hạch, cơ quan tổ chức sát hạch có văn bản đề nghị cơ quan đã cấp giấy phép xe cắt góc giấy phép lái xe cũ và có văn bản đề nghị cục đường bộ việt nam xóa số quản lý giấy phép lái xe đã cấp.', '1. giấy phép lái xe bao gồm các hạng sau đây: a) hạng a1 cấp cho người lái xe mô tô hai bánh có dung tích xi-lanh đến 125 cm3 hoặc có công suất động cơ điện đến 11 kw; b) hạng a cấp cho người lái xe mô tô hai bánh có dung tích xi-lanh\xa0 trên 125 cm3\xa0hoặc có công suất động cơ điện trên 11 kw và các loại xe quy định cho giấy phép lái xe hạng a1; c) hạng b1 cấp cho người lái xe mô tô ba bánh và các loại xe quy định cho giấy phép lái xe hạng a1; d) hạng b cấp cho người lái xe ô tô chở người đến 08 chỗ (không kể chỗ của người lái xe); xe ô tô tải và ô tô chuyên dùng có khối lượng toàn bộ theo thiết kế đến 3.500 kg; các loại xe ô tô quy định cho giấy phép lái xe hạng b kéo rơ moóc có khối lượng toàn bộ theo thiết kế đến 750 kg; đ) hạng c1 cấp cho người lái xe ô tô tải và ô tô chuyên dùng có khối lượng toàn bộ theo thiết kế trên 3.500 kg đến 7.500 kg; các loại xe ô tô tải quy định cho giấy phép lái xe hạng c1 kéo rơ moóc có khối lượng toàn bộ theo thiết kế đến 750 kg; các loại xe quy định cho giấy phép lái xe hạng b; e) hạng c cấp cho người lái xe ô tô tải và ô tô chuyên dùng có khối lượng toàn bộ theo thiết kế trên 7.500 kg; các loại xe ô tô tải quy định cho giấy phép lái xe hạng c kéo rơ moóc có khối lượng toàn bộ theo thiết kế đến 750 kg; các loại xe quy định cho giấy phép lái xe hạng b và hạng c1; g) hạng d1 cấp cho người lái xe ô tô chở người trên 08 chỗ (không kể chỗ của người lái xe) đến 16 chỗ (không kể chỗ của người lái xe); các loại xe ô tô chở người quy định cho giấy phép lái xe hạng d1 kéo rơ moóc có khối lượng toàn bộ theo thiết kế đến 750 kg; các loại xe quy định cho giấy phép lái xe các hạng b, c1, c; h) hạng d2 cấp cho người lái xe ô tô chở người (kể cả xe buýt) trên 16 chỗ (không kể chỗ của người lái xe) đến 29 chỗ (không kể chỗ của người lái xe); các loại xe ô tô chở người quy định cho giấy phép lái xe hạng d2 kéo rơ moóc có khối lượng toàn bộ theo thiết kế đến 750 kg; các loại xe quy định cho giấy phép lái xe các hạng b, c1, c, d1; i) hạng d cấp cho người lái xe ô tô chở người (kể cả xe buýt) trên 29 chỗ (không kể chỗ của người lái xe); xe ô tô chở người giường nằm; các loại xe ô tô chở người quy định cho giấy phép lái xe hạng d kéo rơ moóc có khối lượng toàn bộ theo thiết kế đến 750 kg; các loại xe quy định cho giấy phép lái xe các hạng b, c1, c, d1, d2; k) hạng be cấp cho người lái các loại xe ô tô quy định cho giấy phép lái xe hạng b kéo rơ moóc có khối lượng toàn bộ theo thiết kế trên 750 kg; l) hạng c1e cấp cho người lái các loại xe ô tô quy định cho giấy phép lái xe hạng c1 kéo rơ moóc có khối lượng toàn bộ theo thiết kế trên 750 kg; m) hạng ce cấp cho người lái các loại xe ô tô quy định cho giấy phép lái xe hạng c kéo rơ moóc có khối lượng toàn bộ theo thiết kế trên 750 kg; xe ô tô đầu kéo kéo sơ mi rơ moóc; n) hạng d1e cấp cho người lái các loại xe ô tô quy định cho giấy phép lái xe hạng d1 kéo rơ moóc có khối lượng toàn bộ theo thiết kế trên 750 kg; o) hạng d2e cấp cho người lái các loại xe ô tô quy định cho giấy phép lái xe hạng d2 kéo rơ moóc có khối lượng toàn bộ theo thiết kế trên 750 kg; p) hạng de cấp cho người lái các loại xe ô tô quy định cho giấy phép lái xe hạng d kéo rơ moóc có khối lượng toàn bộ theo thiết kế trên 750 kg; xe ô tô chở khách nối toa. 2. người khuyết tật điều khiển xe mô tô ba bánh dùng cho người khuyết tật được cấp giấy phép lái xe hạng a1. người khuyết tật điều khiển xe ô tô số tự động có kết cấu phù hợp với tình trạng khuyết tật thì được cấp giấy phép lái xe hạng b. 3. người điều khiển xe chở hàng bốn bánh có gắn động cơ, xe chở người bốn bánh có gắn động cơ phải sử dụng giấy phép lái xe có hạng phù hợp với xe ô tô tải hoặc xe ô tô chở người tương ứng. 4. người điều khiển xe ô tô có thiết kế, cải tạo với số chỗ ít hơn xe cùng loại, kích thước giới hạn tương đương phải sử dụng giấy phép lái xe có hạng phù hợp với xe ô tô cùng loại, kích thước giới hạn tương đương và có số chỗ nhiều nhất. 5. thời hạn của giấy phép lái xe được quy định như sau: a) giấy phép lái xe các hạng a1, a, b1 không thời hạn; b) giấy phép lái xe hạng b và hạng c1 có thời hạn 10 năm kể từ ngày cấp; c) giấy phép lái xe các hạng c, d1, d2, d, be, c1e, ce, d1e, d2e và de có thời hạn 05 năm kể từ ngày cấp. 6. giấy phép lái xe có giá trị sử dụng trong phạm vi lãnh thổ việt nam bao gồm: a) giấy phép lái xe do cơ quan có thẩm quyền của việt nam cấp; b) giấy phép lái xe quốc tế và giấy phép lái xe quốc gia phù hợp với loại xe được phép điều khiển do quốc gia là thành viên của công ước của liên hợp quốc về giao thông đường bộ năm 1968 (sau đây gọi là công ước viên) cấp; c) giấy phép lái xe phù hợp với loại xe được phép điều khiển của nước hoặc vùng lãnh thổ mà việt nam ký kết điều ước quốc tế hoặc thỏa thuận quốc tế công nhận giấy phép lái xe của nhau; d) giấy phép lái xe nước ngoài phù hợp với loại xe được phép điều khiển do quốc gia được công nhận theo điều ước quốc tế mà nước cộng hòa xã hội chủ nghĩa việt nam là thành viên. 7. giấy phép lái xe không có hiệu lực trong các trường hợp sau đây: a) giấy phép lái xe hết thời hạn sử dụng; b) giấy phép lái xe bị thu hồi theo quy định tại khoản 5 điều 62 của luật này. 8. giấy phép lái xe quốc tế được quy định như sau: a) giấy phép lái xe quốc tế là giấy phép lái xe do cơ quan nhà nước có thẩm quyền của quốc gia là thành viên của công ước viên cấp theo một mẫu thống nhất; có thời hạn không quá 03 năm kể từ ngày cấp và phải phù hợp với thời hạn còn hiệu lực của giấy phép lái xe quốc gia; b) người có giấy phép lái xe quốc tế do quốc gia là thành viên của công ước viên cấp khi lái xe tham gia giao thông đường bộ trên lãnh thổ việt nam phải mang theo giấy phép lái xe quốc tế và giấy phép lái xe quốc gia được cấp phù hợp với hạng xe điều khiển, còn thời hạn sử dụng; phải tuân thủ pháp luật về trật tự, an toàn giao thông đường bộ của việt nam; c) người có giấy phép lái xe quốc tế vi phạm pháp luật về trật tự, an toàn giao thông đường bộ của việt nam mà bị tước quyền sử dụng giấy phép lái xe có thời hạn thì thời gian bị tước quyền sử dụng không quá thời gian người lái xe được phép cư trú tại lãnh thổ việt nam; d) người việt nam hoặc người nước ngoài có thẻ thường trú hoặc thẻ tạm trú tại việt nam có giấy phép lái xe do việt nam hoặc quốc gia là thành viên của điều ước quốc tế mà nước cộng hòa xã hội chủ nghĩa việt nam là thành viên cấp, còn giá trị sử dụng, nếu có nhu cầu được cấp giấy phép lái xe quốc tế. 9. bộ trưởng bộ giao thông vận tải quy định mẫu giấy phép lái xe và giấy phép lái xe quốc tế, trình tự, thủ tục cấp và việc sử dụng giấy phép lái xe, giấy phép lái xe quốc tế; đối với mẫu giấy phép lái xe, trình tự, thủ tục cấp và việc sử dụng giấy phép lái xe của lực lượng quân đội, công an làm nhiệm vụ quốc phòng, an ninh do bộ trưởng bộ quốc phòng, bộ trưởng bộ công an quy định.', '1. nội dung kiểm tra, bao gồm: a) kiểm tra lý thuyết kiến thức pháp luật về trật tự, an toàn giao thông đường bộ được thực hiện theo câu hỏi sát hạch lý thuyết để cấp giấy phép lái xe theo quy định của bộ trưởng bộ giao thông vận tải (sau đây viết gọn là kiểm tra lý thuyết kiến thức pháp luật); b) kiểm tra kiến thức pháp luật về trật tự, an toàn giao thông đường bộ theo mô phỏng các tình huống giao thông trên máy tính theo quy định của bộ trưởng bộ giao thông vận tải (sau đây viết gọn là kiểm tra kiến thức pháp luật theo mô phỏng). 2. phương pháp kiểm tra: a) đối với kiểm tra lý thuyết kiến thức pháp luật, người dự kiểm tra thực hiện bài kiểm tra trắc nghiệm trên máy tính theo phần mềm kiểm tra kiến thức pháp luật về trật tự, an toàn giao thông đường bộ; b) đối với kiểm tra kiến thức pháp luật theo mô phỏng, người dự kiểm tra xử lý các tình huống giao thông theo mô phỏng trên máy tính. 3. thời gian, kết cấu bài kiểm tra và kết quả kiểm tra lý thuyết kiến thức pháp luật đạt yêu cầu: a) người dự kiểm tra có giấy phép lái xe hạng a1 làm bài kiểm tra trong thời gian 19 phút. kết cấu bài kiểm tra gồm 25 câu hỏi trắc nghiệm, mỗi câu hỏi được tính 01 điểm, trong đó có 01 câu hỏi được tính là điểm liệt. kết quả từ 21/25 điểm trở lên là đạt yêu cầu. trường hợp kết quả từ 21/25 điểm trở lên nhưng trả lời sai vào câu hỏi được tính là điểm liệt thì không đạt yêu cầu; b) người dự kiểm tra có giấy phép lái xe hạng a, b1 làm bài kiểm tra trong thời gian 19 phút. kết cấu bài kiểm tra gồm 25 câu hỏi trắc nghiệm, mỗi câu hỏi được tính 01 điểm, trong đó có 01 câu hỏi được tính là điểm liệt. kết quả đạt từ 23/25 điểm trở lên là đạt yêu cầu. trường hợp kết quả từ 23/25 điểm trở lên nhưng trả lời sai vào câu hỏi được tính là điểm liệt thì không đạt yêu cầu; c) người dự kiểm tra có giấy phép lái xe hạng b làm bài kiểm tra trong thời gian 20 phút. kết cấu bài kiểm tra gồm 30 câu hỏi trắc nghiệm, mỗi câu hỏi được tính 01 điểm, trong đó có 01 câu hỏi được tính là điểm liệt. kết quả đạt từ 27/30 điểm trở lên là đạt yêu cầu. trường hợp kết quả từ 27/30 điểm trở lên nhưng trả lời sai vào câu hỏi được tính là điểm liệt thì không đạt yêu cầu; d) người dự kiểm tra có giấy phép lái xe hạng c1 làm bài kiểm tra trong thời gian 22 phút. kết cấu bài kiểm tra gồm 35 câu hỏi trắc nghiệm, mỗi câu hỏi được tính 01 điểm, trong đó có 01 câu hỏi được tính là điểm liệt. kết quả đạt từ 32/35 điểm trở lên là đạt yêu cầu. trường hợp kết quả từ 32/35 điểm trở lên nhưng trả lời sai vào câu hỏi được tính là điểm liệt thì không đạt yêu cầu; đ) người dự kiểm tra có giấy phép lái xe hạng c làm bài kiểm tra trong thời gian 24 phút. kết cấu bài kiểm tra gồm 40 câu hỏi trắc nghiệm, mỗi câu hỏi được tính 01 điểm, trong đó có 01 câu hỏi được tính là điểm liệt. kết quả đạt từ 36/40 điểm trở lên là đạt yêu cầu. trường hợp kết quả từ 36/40 điểm trở lên nhưng trả lời sai vào câu hỏi được tính là điểm liệt thì không đạt yêu cầu; e) người dự kiểm tra có giấy phép lái xe hạng d1, d2, d, be, c1q, ce, d1e, d2e, de làm bài kiểm tra trong thời gian 26 phút. kết cấu bài kiểm tra gồm 45 câu hỏi trắc nghiệm, mỗi câu hỏi được tính 01 điểm, trong đó có 01 câu hỏi được tính là điểm liệt. kết quả đạt từ 41/45 điểm trở lên là đạt yêu cầu. trường hợp kết quả từ 41/45 điểm trở lên nhưng trả lời sai vào câu hỏi được tính là điểm liệt thì không đạt yêu cầu. 4. thời gian, kết cấu bài kiểm tra và kết quả kiểm tra kiến thức pháp luật theo mô phỏng đạt yêu cầu: thời gian kiểm tra không quá 10 phút. bài kiểm tra được thiết kế dưới dạng 10 câu hỏi mô phỏng các tình huống giao thông, mỗi câu hỏi là 01 tình huống tiềm ẩn nguy cơ mất an toàn giao thông, mỗi câu hỏi có số điểm tối đa là 05 điểm và số điểm tối thiểu là 0 điểm. số điểm đạt được của người dự kiểm tra tương ứng với thời điểm nhận biết và xác định tình huống tiềm ẩn nguy cơ mất an toàn giao thông thông qua việc tương tác với máy tính có cài đặt phần mềm mô phỏng. người dự kiểm tra đạt từ 35/50 điểm trở lên là đạt yêu cầu. 5. kết quả kiểm tra đạt yêu cầu được phục hồi điểm giấy phép lái xe: a) đối với trường hợp người có giấy phép lái xe mô tô bị trừ hết điểm: được phục hồi điểm giấy phép lái xe khi có kết quả kiểm tra lý thuyết kiến thức pháp luật đạt yêu cầu quy định tại điểm a, điểm b khoản 3 điều này; b) đối với trường hợp người có giấy phép lái xe ô tô bị trừ hết điểm: được phục hồi điểm giấy phép lái xe khi có kết quả kiểm tra đạt yêu cầu đối với cả 02 nội dung là kiểm tra lý thuyết kiến thức pháp luật và kiểm tra kiến thức pháp luật theo mô phỏng quy định tại các điểm c, d, đ, e khoản 3 và khoản 4 điều này. người có kết quả kiểm tra lý thuyết kiến thức pháp luật không đạt yêu cầu thì không được kiểm tra kiến thức pháp luật theo mô phỏng. người có kết quả kiểm tra lý thuyết kiến thức pháp luật đạt yêu cầu nhưng có kết quả kiểm tra kiến thức pháp luật theo mô phỏng không đạt yêu cầu thì được bảo lưu kết quả kiểm tra lý thuyết kiến thức pháp luật trong thời gian 01 năm, kể từ ngày kiểm tra có kết quả đạt yêu cầu. người dự kiểm tra có kết quả kiểm tra không đạt yêu cầu có thể đăng ký kiểm tra lại sau 07 ngày làm việc, kể từ ngày kết thúc kiểm tra trước đó.', '1. mẫu giấy phép lái xe quân sự a) giấy phép lái xe quân sự thực hiện theo quy định tại mẫu số 08 kèm theo thông tư này; b) cục trưởng cục xe máy - vận tải/tổng cục hậu cần - kỹ thuật có trách nhiệm quản lý việc sử dụng giấy phép lái xe quân sự thuộc phạm vi quản lý của bộ quốc phòng. 2. thời hạn sử dụng giấy phép lái xe quân sự a) giấy phép lái xe quân sự hạng a1, a, b1 là không thời hạn; b) giấy phép lái xe quân sự các hạng b, c1, c, d1, d2, d, c1e, ce, cx có thời hạn 05 năm kể từ ngày cấp; c) trường hợp cấp, đổi do lý do khác thời hạn theo thời hạn ghi trên giấy phép lái xe quân sự. 3. giấy phép lái xe quân sự không có hiệu lực trong các trường hợp sau: a) giấy phép lái xe quân sự hết thời hạn sử dụng được ghi trên giấy phép lái xe; b) giấy phép lái xe quân sự bị trừ hết điểm theo quy định tại điều 7 của thông tư này; c) giấy phép lái xe quân sự có quyết định thu hồi theo khoản 1 điều 47 thông tư này.', '1. quân nhân, công chức quốc phòng, công nhân viên chức quốc phòng, lao động hợp đồng đang phục vụ trong bộ quốc phòng có đủ các điều kiện: tiêu chuẩn về tuổi đời, thời gian công tác, sức khỏe, trình độ văn hóa, phẩm chất chính trị theo quy định của bộ quốc phòng. đối với lao động hợp đồng: chỉ đào tạo nâng hạng khi có đủ điều kiện, tiêu chuẩn quy định tại khoản 1 điều này. 2. đối với người học nâng hạng giấy phép lái xe quân sự phải có thời gian lái xe và số km lái xe an toàn như sau: a) từ hạng b lên hạng c1; hạng c1 lên hạng c, c1e; hạng c lên hạng d1, ce, cx; hạng d1 lên hạng d2; hạng d2 lên hạng d: có thời gian lái xe 02 năm trở lên và 30.000 km lái xe an toàn trở lên (trừ các trường hợp đào tạo chuyển tiếp từ hạng c lên hạng ce hoặc cx theo chỉ tiêu của bộ tổng tham mưu); b) từ hạng b lên hạng c, d1; hạng c1 lên d1; hạng c lên hạng d2; hạng d1 lên hạng d: có thời gian lái xe 03 năm trở lên và có 50.000 km lái xe an toàn trở lên; c) từ hạng b lên hạng d2, từ hạng c1 lên hạng d2, từ hạng c lên hạng d: có thời gian lái xe 05 năm trở lên và 100.000 km lái xe an toàn trở lên. 3. đối với người học nâng hạng giấy phép lái xe quân sự lên hạng d1, d2, d ngoài các quy định tại các khoản 1, 2 điều này phải có bằng tốt nghiệp trung học cơ sở trở lên.']","**Nguồn văn bản:** 36_2024_QH15_444251

**Tên văn bản:** Luật Trật tự, an toàn giao thông đường bộ

**Điều 57:** Giấy phép lái xe

**Nội dung:**

5. Thời hạn của giấy phép lái xe được quy định như sau:

    a) Giấy phép lái xe các hạng A1, A, B1 không thời hạn.

    b) Giấy phép lái xe hạng B và hạng C1 có thời hạn 10 năm kể từ ngày cấp.

    c) Giấy phép lái xe các hạng C, D1, D2, D, BE, C1E, CE, D1E, D2E và DE có thời hạn 05 năm kể từ ngày cấp.


Tóm lại: Thời hạn của giấy phép lái xe hạng C1 là 10 năm kể từ ngày cấp.
",Giấy phép lái xe hạng C1 có thời hạn 10 năm kể từ ngày cấp.,0.625,0.7369063300275268,1.0,0.49999999995
4,Giấy phép lái xe hạng D có thời hạn bao lâu?,"['1. là công dân việt nam, người nước ngoài được phép cư trú hoặc đang làm việc, học tập tại việt nam. 2. người học lái xe để nâng hạng giấy phép lái xe phải đáp ứng theo quy định tại khoản 4 điều 60 luật trật tự, an toàn giao thông đường bộ; trong đó, thời gian lái xe an toàn cho từng hạng giấy phép lái xe được quy định cụ thể như sau: a) hạng b lên c1, b lên c, b lên d1, b lên be, c1 lên c, c1 lên d1, c1 lên d2, c1 lên c1e, c lên d1, c lên d2, d1 lên d2, d1 lên d, d1 lên d1e, d2 lên d, d2 lên d2e, d lên de: thời gian lái xe an toàn từ 02 năm trở lên; b) hạng b lên d2, c lên ce, c lên d: thời gian lái xe an toàn từ 03 năm trở lên. 3. người đã có giấy phép lái xe hạng b số tự động được đăng ký học để cấp mới giấy phép lái xe hạng b số cơ khí (số sàn), người đã có giấy phép lái xe hạng b được đăng ký học để cấp mới giấy phép lái xe hạng c1 và phải học đủ nội dung chương trình đào tạo lái xe theo quy định, hồ sơ của người học lái xe thực hiện theo quy định tại khoản 1 điều 15 thông tư này; trường hợp đạt kết quả sát hạch, cơ quan tổ chức sát hạch có văn bản đề nghị cơ quan đã cấp giấy phép xe cắt góc giấy phép lái xe cũ và có văn bản đề nghị cục đường bộ việt nam xóa số quản lý giấy phép lái xe đã cấp.', '1. giấy phép lái xe bao gồm các hạng sau đây: a) hạng a1 cấp cho người lái xe mô tô hai bánh có dung tích xi-lanh đến 125 cm3 hoặc có công suất động cơ điện đến 11 kw; b) hạng a cấp cho người lái xe mô tô hai bánh có dung tích xi-lanh\xa0 trên 125 cm3\xa0hoặc có công suất động cơ điện trên 11 kw và các loại xe quy định cho giấy phép lái xe hạng a1; c) hạng b1 cấp cho người lái xe mô tô ba bánh và các loại xe quy định cho giấy phép lái xe hạng a1; d) hạng b cấp cho người lái xe ô tô chở người đến 08 chỗ (không kể chỗ của người lái xe); xe ô tô tải và ô tô chuyên dùng có khối lượng toàn bộ theo thiết kế đến 3.500 kg; các loại xe ô tô quy định cho giấy phép lái xe hạng b kéo rơ moóc có khối lượng toàn bộ theo thiết kế đến 750 kg; đ) hạng c1 cấp cho người lái xe ô tô tải và ô tô chuyên dùng có khối lượng toàn bộ theo thiết kế trên 3.500 kg đến 7.500 kg; các loại xe ô tô tải quy định cho giấy phép lái xe hạng c1 kéo rơ moóc có khối lượng toàn bộ theo thiết kế đến 750 kg; các loại xe quy định cho giấy phép lái xe hạng b; e) hạng c cấp cho người lái xe ô tô tải và ô tô chuyên dùng có khối lượng toàn bộ theo thiết kế trên 7.500 kg; các loại xe ô tô tải quy định cho giấy phép lái xe hạng c kéo rơ moóc có khối lượng toàn bộ theo thiết kế đến 750 kg; các loại xe quy định cho giấy phép lái xe hạng b và hạng c1; g) hạng d1 cấp cho người lái xe ô tô chở người trên 08 chỗ (không kể chỗ của người lái xe) đến 16 chỗ (không kể chỗ của người lái xe); các loại xe ô tô chở người quy định cho giấy phép lái xe hạng d1 kéo rơ moóc có khối lượng toàn bộ theo thiết kế đến 750 kg; các loại xe quy định cho giấy phép lái xe các hạng b, c1, c; h) hạng d2 cấp cho người lái xe ô tô chở người (kể cả xe buýt) trên 16 chỗ (không kể chỗ của người lái xe) đến 29 chỗ (không kể chỗ của người lái xe); các loại xe ô tô chở người quy định cho giấy phép lái xe hạng d2 kéo rơ moóc có khối lượng toàn bộ theo thiết kế đến 750 kg; các loại xe quy định cho giấy phép lái xe các hạng b, c1, c, d1; i) hạng d cấp cho người lái xe ô tô chở người (kể cả xe buýt) trên 29 chỗ (không kể chỗ của người lái xe); xe ô tô chở người giường nằm; các loại xe ô tô chở người quy định cho giấy phép lái xe hạng d kéo rơ moóc có khối lượng toàn bộ theo thiết kế đến 750 kg; các loại xe quy định cho giấy phép lái xe các hạng b, c1, c, d1, d2; k) hạng be cấp cho người lái các loại xe ô tô quy định cho giấy phép lái xe hạng b kéo rơ moóc có khối lượng toàn bộ theo thiết kế trên 750 kg; l) hạng c1e cấp cho người lái các loại xe ô tô quy định cho giấy phép lái xe hạng c1 kéo rơ moóc có khối lượng toàn bộ theo thiết kế trên 750 kg; m) hạng ce cấp cho người lái các loại xe ô tô quy định cho giấy phép lái xe hạng c kéo rơ moóc có khối lượng toàn bộ theo thiết kế trên 750 kg; xe ô tô đầu kéo kéo sơ mi rơ moóc; n) hạng d1e cấp cho người lái các loại xe ô tô quy định cho giấy phép lái xe hạng d1 kéo rơ moóc có khối lượng toàn bộ theo thiết kế trên 750 kg; o) hạng d2e cấp cho người lái các loại xe ô tô quy định cho giấy phép lái xe hạng d2 kéo rơ moóc có khối lượng toàn bộ theo thiết kế trên 750 kg; p) hạng de cấp cho người lái các loại xe ô tô quy định cho giấy phép lái xe hạng d kéo rơ moóc có khối lượng toàn bộ theo thiết kế trên 750 kg; xe ô tô chở khách nối toa. 2. người khuyết tật điều khiển xe mô tô ba bánh dùng cho người khuyết tật được cấp giấy phép lái xe hạng a1. người khuyết tật điều khiển xe ô tô số tự động có kết cấu phù hợp với tình trạng khuyết tật thì được cấp giấy phép lái xe hạng b. 3. người điều khiển xe chở hàng bốn bánh có gắn động cơ, xe chở người bốn bánh có gắn động cơ phải sử dụng giấy phép lái xe có hạng phù hợp với xe ô tô tải hoặc xe ô tô chở người tương ứng. 4. người điều khiển xe ô tô có thiết kế, cải tạo với số chỗ ít hơn xe cùng loại, kích thước giới hạn tương đương phải sử dụng giấy phép lái xe có hạng phù hợp với xe ô tô cùng loại, kích thước giới hạn tương đương và có số chỗ nhiều nhất. 5. thời hạn của giấy phép lái xe được quy định như sau: a) giấy phép lái xe các hạng a1, a, b1 không thời hạn; b) giấy phép lái xe hạng b và hạng c1 có thời hạn 10 năm kể từ ngày cấp; c) giấy phép lái xe các hạng c, d1, d2, d, be, c1e, ce, d1e, d2e và de có thời hạn 05 năm kể từ ngày cấp. 6. giấy phép lái xe có giá trị sử dụng trong phạm vi lãnh thổ việt nam bao gồm: a) giấy phép lái xe do cơ quan có thẩm quyền của việt nam cấp; b) giấy phép lái xe quốc tế và giấy phép lái xe quốc gia phù hợp với loại xe được phép điều khiển do quốc gia là thành viên của công ước của liên hợp quốc về giao thông đường bộ năm 1968 (sau đây gọi là công ước viên) cấp; c) giấy phép lái xe phù hợp với loại xe được phép điều khiển của nước hoặc vùng lãnh thổ mà việt nam ký kết điều ước quốc tế hoặc thỏa thuận quốc tế công nhận giấy phép lái xe của nhau; d) giấy phép lái xe nước ngoài phù hợp với loại xe được phép điều khiển do quốc gia được công nhận theo điều ước quốc tế mà nước cộng hòa xã hội chủ nghĩa việt nam là thành viên. 7. giấy phép lái xe không có hiệu lực trong các trường hợp sau đây: a) giấy phép lái xe hết thời hạn sử dụng; b) giấy phép lái xe bị thu hồi theo quy định tại khoản 5 điều 62 của luật này. 8. giấy phép lái xe quốc tế được quy định như sau: a) giấy phép lái xe quốc tế là giấy phép lái xe do cơ quan nhà nước có thẩm quyền của quốc gia là thành viên của công ước viên cấp theo một mẫu thống nhất; có thời hạn không quá 03 năm kể từ ngày cấp và phải phù hợp với thời hạn còn hiệu lực của giấy phép lái xe quốc gia; b) người có giấy phép lái xe quốc tế do quốc gia là thành viên của công ước viên cấp khi lái xe tham gia giao thông đường bộ trên lãnh thổ việt nam phải mang theo giấy phép lái xe quốc tế và giấy phép lái xe quốc gia được cấp phù hợp với hạng xe điều khiển, còn thời hạn sử dụng; phải tuân thủ pháp luật về trật tự, an toàn giao thông đường bộ của việt nam; c) người có giấy phép lái xe quốc tế vi phạm pháp luật về trật tự, an toàn giao thông đường bộ của việt nam mà bị tước quyền sử dụng giấy phép lái xe có thời hạn thì thời gian bị tước quyền sử dụng không quá thời gian người lái xe được phép cư trú tại lãnh thổ việt nam; d) người việt nam hoặc người nước ngoài có thẻ thường trú hoặc thẻ tạm trú tại việt nam có giấy phép lái xe do việt nam hoặc quốc gia là thành viên của điều ước quốc tế mà nước cộng hòa xã hội chủ nghĩa việt nam là thành viên cấp, còn giá trị sử dụng, nếu có nhu cầu được cấp giấy phép lái xe quốc tế. 9. bộ trưởng bộ giao thông vận tải quy định mẫu giấy phép lái xe và giấy phép lái xe quốc tế, trình tự, thủ tục cấp và việc sử dụng giấy phép lái xe, giấy phép lái xe quốc tế; đối với mẫu giấy phép lái xe, trình tự, thủ tục cấp và việc sử dụng giấy phép lái xe của lực lượng quân đội, công an làm nhiệm vụ quốc phòng, an ninh do bộ trưởng bộ quốc phòng, bộ trưởng bộ công an quy định.', '1. mẫu giấy phép lái xe quân sự a) giấy phép lái xe quân sự thực hiện theo quy định tại mẫu số 08 kèm theo thông tư này; b) cục trưởng cục xe máy - vận tải/tổng cục hậu cần - kỹ thuật có trách nhiệm quản lý việc sử dụng giấy phép lái xe quân sự thuộc phạm vi quản lý của bộ quốc phòng. 2. thời hạn sử dụng giấy phép lái xe quân sự a) giấy phép lái xe quân sự hạng a1, a, b1 là không thời hạn; b) giấy phép lái xe quân sự các hạng b, c1, c, d1, d2, d, c1e, ce, cx có thời hạn 05 năm kể từ ngày cấp; c) trường hợp cấp, đổi do lý do khác thời hạn theo thời hạn ghi trên giấy phép lái xe quân sự. 3. giấy phép lái xe quân sự không có hiệu lực trong các trường hợp sau: a) giấy phép lái xe quân sự hết thời hạn sử dụng được ghi trên giấy phép lái xe; b) giấy phép lái xe quân sự bị trừ hết điểm theo quy định tại điều 7 của thông tư này; c) giấy phép lái xe quân sự có quyết định thu hồi theo khoản 1 điều 47 thông tư này.', '1. quân nhân, công chức quốc phòng, công nhân viên chức quốc phòng, lao động hợp đồng đang phục vụ trong bộ quốc phòng đủ 18 tuổi trở lên được cấp giấy phép lái xe quân sự hạng a1, a, b1, b, c1, c. 2. quân nhân, công chức quốc phòng, công nhân viên chức quốc phòng, lao động hợp đồng đang phục vụ trong bộ quốc phòng đủ 24 tuổi trở lên được cấp giấy phép lái xe quân sự hạng d1, d2, c1e, ce, cx. các trường hợp đào tạo chuyển tiếp từ hạng c lên hạng ce hoặc cx theo chỉ tiêu của bộ tổng tham mưu, đủ 19 tuổi trở lên. 3. quân nhân, công chức quốc phòng, công nhân viên chức quốc phòng, lao động hợp đồng đang phục vụ trong bộ quốc phòng đủ 27 tuổi trở lên được cấp giấy phép lái xe quân sự hạng d. độ tuổi tối đa của người được cấp giấy phép lái xe quân sự hạng d là đủ 57 tuổi đối với nam và đủ 55 tuổi đối với nữ. chương ii đào tạo lái xe quân sự mục i. người học', '1. quân nhân, công chức quốc phòng, công nhân viên chức quốc phòng, lao động hợp đồng đang phục vụ trong bộ quốc phòng có đủ các điều kiện: tiêu chuẩn về tuổi đời, thời gian công tác, sức khỏe, trình độ văn hóa, phẩm chất chính trị theo quy định của bộ quốc phòng. đối với lao động hợp đồng: chỉ đào tạo nâng hạng khi có đủ điều kiện, tiêu chuẩn quy định tại khoản 1 điều này. 2. đối với người học nâng hạng giấy phép lái xe quân sự phải có thời gian lái xe và số km lái xe an toàn như sau: a) từ hạng b lên hạng c1; hạng c1 lên hạng c, c1e; hạng c lên hạng d1, ce, cx; hạng d1 lên hạng d2; hạng d2 lên hạng d: có thời gian lái xe 02 năm trở lên và 30.000 km lái xe an toàn trở lên (trừ các trường hợp đào tạo chuyển tiếp từ hạng c lên hạng ce hoặc cx theo chỉ tiêu của bộ tổng tham mưu); b) từ hạng b lên hạng c, d1; hạng c1 lên d1; hạng c lên hạng d2; hạng d1 lên hạng d: có thời gian lái xe 03 năm trở lên và có 50.000 km lái xe an toàn trở lên; c) từ hạng b lên hạng d2, từ hạng c1 lên hạng d2, từ hạng c lên hạng d: có thời gian lái xe 05 năm trở lên và 100.000 km lái xe an toàn trở lên. 3. đối với người học nâng hạng giấy phép lái xe quân sự lên hạng d1, d2, d ngoài các quy định tại các khoản 1, 2 điều này phải có bằng tốt nghiệp trung học cơ sở trở lên.']","**Nguồn văn bản:** 36_2024_QH15_444251

**Tên văn bản:** Luật Trật tự, an toàn giao thông đường bộ

**Điều 57:** Giấy phép lái xe

**Nội dung:**

5. Thời hạn của giấy phép lái xe được quy định như sau:

    a) Giấy phép lái xe các hạng A1, A, B1 không thời hạn.

    b) Giấy phép lái xe hạng B và hạng C1 có thời hạn 10 năm kể từ ngày cấp.

    c) Giấy phép lái xe các hạng C, D1, D2, D, BE, C1E, CE, D1E, D2E và DE có thời hạn 05 năm kể từ ngày cấp.


Tóm lại: Thời hạn giấy phép lái xe hạng D là 05 năm kể từ ngày cấp.
",Giấy phép lái xe hạng D có thời hạn 5 năm kể từ ngày cấp.,0.625,0.7304722913872667,1.0,0.5833333333041666
5,Giấy phép lái xe hạng BE cho phép lái những loại xe nào?,"['1. đào tạo từ xa, tự học có hướng dẫn áp dụng đối với các môn học pháp luật về giao thông đường bộ, đạo đức, văn hóa giao thông và phòng chống tác hại của rượu, bia khi tham gia giao thông và học lý thuyết của các môn: cấu tạo và sửa chữa thông thường; kỹ năng phòng cháy, chữa cháy và cứu nạn, cứu hộ; kỹ thuật lái xe để cấp giấy phép lái xe hạng b, c1, c, d1, d2, d, be, c1e, ce, d1e, d2e và de. 2. người học phải đăng ký tại cơ sở được phép đào tạo để được quản lý theo quy định của bộ giao thông vận tải. mục 2. điều kiện kinh doanh của cơ sở đào tạo lái xe ô tô', '1. giấy phép lái xe được cấp trước ngày luật này có hiệu lực thi hành được tiếp tục sử dụng theo thời hạn ghi trên giấy phép lái xe. 2. giấy phép lái xe được cấp trước ngày luật này có hiệu lực thi hành nếu chưa thực hiện đổi, cấp lại theo quy định của luật này có hiệu lực sử dụng như sau: a) giấy phép lái xe hạng a1 được tiếp tục điều khiển xe mô tô hai bánh có dung tích xi-lanh từ 50 cm3\xa0đến dưới 175 cm3 hoặc có công suất động cơ điện từ 04 kw đến dưới 14 kw; b) giấy phép lái xe hạng a2 được tiếp tục điều khiển xe mô tô hai bánh có dung tích xi-lanh từ 175 cm3\xa0trở lên hoặc có công suất động cơ điện từ 14 kw trở lên và các loại xe quy định cho giấy phép lái xe hạng a1 quy định tại điểm a khoản này; c) giấy phép lái xe hạng a3 được tiếp tục điều khiển xe mô tô ba bánh, các loại xe quy định cho giấy phép lái xe hạng a1 quy định tại điểm a khoản này và các xe tương tự; d) giấy phép lái xe hạng a4 được tiếp tục điều khiển máy kéo có trọng tải đến 1.000 kg; đ) giấy phép lái xe hạng b1 số tự động cấp cho người không hành nghề lái xe được tiếp tục điều khiển xe ô tô số tự động chở người đến 08 chỗ (không kể chỗ của người lái xe); xe ô tô tải, kể cả ô tô tải chuyên dùng số tự động có trọng tải dưới 3.500 kg; e) giấy phép lái xe hạng b1 cấp cho người không hành nghề lái xe được tiếp tục điều khiển xe ô tô chở người đến 08 chỗ (không kể chỗ của người lái xe); xe ô tô tải, máy kéo có trọng tải dưới 3.500 kg; g) giấy phép lái xe hạng b2 cấp cho người hành nghề lái xe được tiếp tục điều khiển xe ô tô chở người đến 08 chỗ (không kể chỗ của người lái xe); xe ô tô tải, máy kéo có trọng tải dưới 3.500 kg; h) giấy phép lái xe hạng c được tiếp tục điều khiển xe ô tô tải, máy kéo có trọng tải từ 3.500 kg trở lên và các loại xe quy định cho các giấy phép lái xe hạng b1, b2 quy định tại các điểm đ, e và g khoản này; i) giấy phép lái xe hạng d được tiếp tục điều khiển xe ô tô chở người từ 09 chỗ (không kể chỗ của người lái xe) đến 29 chỗ (không kể chỗ của người lái xe) và các loại xe quy định cho các giấy phép lái xe hạng b1, b2, c quy định tại các điểm đ, e, g và h khoản này; k) giấy phép lái xe hạng e được tiếp tục điều khiển xe ô tô chở người trên 29 chỗ (không kể chỗ của người lái xe) và các loại xe quy định cho các giấy phép lái xe hạng b1, b2, c, d quy định tại các điểm đ, e, g, h và i khoản này; l) giấy phép lái xe hạng fb2, fd được tiếp tục điều khiển các loại xe quy định cho giấy phép lái xe hạng b2, d quy định tại điểm g và điểm i khoản này khi kéo rơ moóc; giấy phép lái xe hạng fc được tiếp tục điều khiển các loại xe quy định cho giấy phép lái xe hạng c quy định tại điểm h khoản này khi kéo rơ moóc, đầu kéo kéo sơ mi rơ moóc; giấy phép lái xe hạng fe được tiếp tục điều khiển các loại xe quy định cho giấy phép lái xe hạng e quy định tại điểm k khoản này khi kéo rơ moóc\xa0hoặc xe ô tô chở khách nối toa. 3. trường hợp người có giấy phép lái xe đã được cấp trước ngày luật này có hiệu lực thi hành có nhu cầu đổi, cấp lại giấy phép lái xe thì thực hiện như sau: a) giấy phép lái xe hạng a1 được đổi, cấp lại sang giấy phép lái xe hạng a với điều kiện hạn chế là chỉ được điều khiển xe mô tô hai bánh có dung tích xi-lanh đến dưới 175 cm3 hoặc có công suất động cơ điện đến dưới 14 kw; b) giấy phép lái xe hạng a2 được đổi, cấp lại sang giấy phép lái xe hạng a; c) giấy phép lái xe hạng a3 được đổi, cấp lại sang giấy phép lái xe hạng b1; d) giấy phép lái xe hạng a4 được đổi, cấp lại sang chứng chỉ điều khiển xe máy chuyên dùng cho người điều khiển máy kéo có trọng tải đến 1.000 kg và chứng chỉ bồi dưỡng kiến thức pháp luật về giao thông đường bộ cho người điều khiển xe máy chuyên dùng; đ) giấy phép lái xe hạng b1 số tự động được đổi, cấp lại sang giấy phép lái xe hạng b với điều kiện hạn chế là chỉ được điều khiển xe ô tô số tự động; e) giấy phép lái xe hạng b1, b2 được đổi, cấp lại sang giấy phép lái xe hạng b hoặc hạng c1 và chứng chỉ điều khiển xe máy chuyên dùng cho người điều khiển máy kéo có trọng tải đến 3.500 kg; g) giấy phép lái xe hạng c giữ nguyên và đổi, cấp lại cùng hạng và chứng chỉ điều khiển xe máy chuyên dùng cho người điều khiển máy kéo có trọng tải trên 3.500 kg; h) giấy phép lái xe hạng d được đổi, cấp lại sang giấy phép lái xe hạng d2 và chứng chỉ điều khiển xe máy chuyên dùng cho người điều khiển máy kéo có trọng tải trên 3.500 kg; i) giấy phép lái xe hạng e được đổi, cấp lại sang giấy phép lái xe hạng d và chứng chỉ điều khiển xe máy chuyên dùng cho người điều khiển máy kéo có trọng tải trên 3.500 kg; k) giấy phép lái xe hạng fb2 được đổi, cấp lại sang giấy phép lái xe hạng be hoặc hạng c1e và chứng chỉ điều khiển xe máy chuyên dùng cho người điều khiển máy kéo có trọng tải đến 3.500 kg; l) giấy phép lái xe hạng fc được đổi, cấp lại sang giấy phép lái xe hạng ce và chứng chỉ điều khiển xe máy chuyên dùng cho người điều khiển máy kéo có trọng tải trên 3.500 kg; m) giấy phép lái xe hạng fd được đổi, cấp lại sang giấy phép lái xe hạng d2e và chứng chỉ điều khiển xe máy chuyên dùng cho người điều khiển máy kéo có trọng tải trên 3.500 kg; n) giấy phép lái xe hạng fe được đổi, cấp lại sang giấy phép lái xe hạng de và chứng chỉ điều khiển xe máy chuyên dùng cho người điều khiển máy kéo có trọng tải trên 3.500 kg. 4. người học lái xe đã được đào tạo lái xe trước ngày luật này có hiệu lực thi hành hoặc đang được đào tạo lái xe tại ngày luật này có hiệu lực thi hành chưa được sát hạch, cấp giấy phép lái xe thì được sát hạch, cấp giấy phép lái xe theo hạng giấy phép lái xe đổi, cấp lại quy định tại khoản 3 điều này. 5. chứng nhận đăng ký xe, biển số xe máy chuyên dùng cấp trước ngày luật này có hiệu lực thi hành vẫn có giá trị sử dụng. 6. chứng nhận chất lượng an toàn kỹ thuật và bảo vệ môi trường được cấp trước ngày luật này có hiệu lực thi hành thì có giá trị sử dụng đến hết thời hạn ghi trên giấy chứng nhận đó. 7. việc đấu giá biển số xe ô tô được thực hiện trước ngày luật này có hiệu lực thi hành và đến ngày luật này có hiệu lực thi hành đã được cấp văn bản xác nhận biển số xe ô tô trúng đấu giá thì tiếp tục thực hiện theo nghị quyết số 73/2022/qh15 của quốc hội về thí điểm đấu giá biển số xe ô tô; trường hợp chưa được cấp xác nhận biển số xe ô tô trúng đấu giá thì tiếp tục thực hiện theo nghị quyết số 73/2022/qh15 của quốc hội về thí điểm đấu giá biển số xe ô tô và quy định tại điểm d khoản 1 điều 38 của luật này./. luật này được quốc hội nước cộng hòa xã hội chủ nghĩa việt nam khóa xv, kỳ họp thứ 7 thông qua ngày 27 tháng 6 năm 2024.', '1. giấy phép lái xe bao gồm các hạng sau đây: a) hạng a1 cấp cho người lái xe mô tô hai bánh có dung tích xi-lanh đến 125 cm3 hoặc có công suất động cơ điện đến 11 kw; b) hạng a cấp cho người lái xe mô tô hai bánh có dung tích xi-lanh\xa0 trên 125 cm3\xa0hoặc có công suất động cơ điện trên 11 kw và các loại xe quy định cho giấy phép lái xe hạng a1; c) hạng b1 cấp cho người lái xe mô tô ba bánh và các loại xe quy định cho giấy phép lái xe hạng a1; d) hạng b cấp cho người lái xe ô tô chở người đến 08 chỗ (không kể chỗ của người lái xe); xe ô tô tải và ô tô chuyên dùng có khối lượng toàn bộ theo thiết kế đến 3.500 kg; các loại xe ô tô quy định cho giấy phép lái xe hạng b kéo rơ moóc có khối lượng toàn bộ theo thiết kế đến 750 kg; đ) hạng c1 cấp cho người lái xe ô tô tải và ô tô chuyên dùng có khối lượng toàn bộ theo thiết kế trên 3.500 kg đến 7.500 kg; các loại xe ô tô tải quy định cho giấy phép lái xe hạng c1 kéo rơ moóc có khối lượng toàn bộ theo thiết kế đến 750 kg; các loại xe quy định cho giấy phép lái xe hạng b; e) hạng c cấp cho người lái xe ô tô tải và ô tô chuyên dùng có khối lượng toàn bộ theo thiết kế trên 7.500 kg; các loại xe ô tô tải quy định cho giấy phép lái xe hạng c kéo rơ moóc có khối lượng toàn bộ theo thiết kế đến 750 kg; các loại xe quy định cho giấy phép lái xe hạng b và hạng c1; g) hạng d1 cấp cho người lái xe ô tô chở người trên 08 chỗ (không kể chỗ của người lái xe) đến 16 chỗ (không kể chỗ của người lái xe); các loại xe ô tô chở người quy định cho giấy phép lái xe hạng d1 kéo rơ moóc có khối lượng toàn bộ theo thiết kế đến 750 kg; các loại xe quy định cho giấy phép lái xe các hạng b, c1, c; h) hạng d2 cấp cho người lái xe ô tô chở người (kể cả xe buýt) trên 16 chỗ (không kể chỗ của người lái xe) đến 29 chỗ (không kể chỗ của người lái xe); các loại xe ô tô chở người quy định cho giấy phép lái xe hạng d2 kéo rơ moóc có khối lượng toàn bộ theo thiết kế đến 750 kg; các loại xe quy định cho giấy phép lái xe các hạng b, c1, c, d1; i) hạng d cấp cho người lái xe ô tô chở người (kể cả xe buýt) trên 29 chỗ (không kể chỗ của người lái xe); xe ô tô chở người giường nằm; các loại xe ô tô chở người quy định cho giấy phép lái xe hạng d kéo rơ moóc có khối lượng toàn bộ theo thiết kế đến 750 kg; các loại xe quy định cho giấy phép lái xe các hạng b, c1, c, d1, d2; k) hạng be cấp cho người lái các loại xe ô tô quy định cho giấy phép lái xe hạng b kéo rơ moóc có khối lượng toàn bộ theo thiết kế trên 750 kg; l) hạng c1e cấp cho người lái các loại xe ô tô quy định cho giấy phép lái xe hạng c1 kéo rơ moóc có khối lượng toàn bộ theo thiết kế trên 750 kg; m) hạng ce cấp cho người lái các loại xe ô tô quy định cho giấy phép lái xe hạng c kéo rơ moóc có khối lượng toàn bộ theo thiết kế trên 750 kg; xe ô tô đầu kéo kéo sơ mi rơ moóc; n) hạng d1e cấp cho người lái các loại xe ô tô quy định cho giấy phép lái xe hạng d1 kéo rơ moóc có khối lượng toàn bộ theo thiết kế trên 750 kg; o) hạng d2e cấp cho người lái các loại xe ô tô quy định cho giấy phép lái xe hạng d2 kéo rơ moóc có khối lượng toàn bộ theo thiết kế trên 750 kg; p) hạng de cấp cho người lái các loại xe ô tô quy định cho giấy phép lái xe hạng d kéo rơ moóc có khối lượng toàn bộ theo thiết kế trên 750 kg; xe ô tô chở khách nối toa. 2. người khuyết tật điều khiển xe mô tô ba bánh dùng cho người khuyết tật được cấp giấy phép lái xe hạng a1. người khuyết tật điều khiển xe ô tô số tự động có kết cấu phù hợp với tình trạng khuyết tật thì được cấp giấy phép lái xe hạng b. 3. người điều khiển xe chở hàng bốn bánh có gắn động cơ, xe chở người bốn bánh có gắn động cơ phải sử dụng giấy phép lái xe có hạng phù hợp với xe ô tô tải hoặc xe ô tô chở người tương ứng. 4. người điều khiển xe ô tô có thiết kế, cải tạo với số chỗ ít hơn xe cùng loại, kích thước giới hạn tương đương phải sử dụng giấy phép lái xe có hạng phù hợp với xe ô tô cùng loại, kích thước giới hạn tương đương và có số chỗ nhiều nhất. 5. thời hạn của giấy phép lái xe được quy định như sau: a) giấy phép lái xe các hạng a1, a, b1 không thời hạn; b) giấy phép lái xe hạng b và hạng c1 có thời hạn 10 năm kể từ ngày cấp; c) giấy phép lái xe các hạng c, d1, d2, d, be, c1e, ce, d1e, d2e và de có thời hạn 05 năm kể từ ngày cấp. 6. giấy phép lái xe có giá trị sử dụng trong phạm vi lãnh thổ việt nam bao gồm: a) giấy phép lái xe do cơ quan có thẩm quyền của việt nam cấp; b) giấy phép lái xe quốc tế và giấy phép lái xe quốc gia phù hợp với loại xe được phép điều khiển do quốc gia là thành viên của công ước của liên hợp quốc về giao thông đường bộ năm 1968 (sau đây gọi là công ước viên) cấp; c) giấy phép lái xe phù hợp với loại xe được phép điều khiển của nước hoặc vùng lãnh thổ mà việt nam ký kết điều ước quốc tế hoặc thỏa thuận quốc tế công nhận giấy phép lái xe của nhau; d) giấy phép lái xe nước ngoài phù hợp với loại xe được phép điều khiển do quốc gia được công nhận theo điều ước quốc tế mà nước cộng hòa xã hội chủ nghĩa việt nam là thành viên. 7. giấy phép lái xe không có hiệu lực trong các trường hợp sau đây: a) giấy phép lái xe hết thời hạn sử dụng; b) giấy phép lái xe bị thu hồi theo quy định tại khoản 5 điều 62 của luật này. 8. giấy phép lái xe quốc tế được quy định như sau: a) giấy phép lái xe quốc tế là giấy phép lái xe do cơ quan nhà nước có thẩm quyền của quốc gia là thành viên của công ước viên cấp theo một mẫu thống nhất; có thời hạn không quá 03 năm kể từ ngày cấp và phải phù hợp với thời hạn còn hiệu lực của giấy phép lái xe quốc gia; b) người có giấy phép lái xe quốc tế do quốc gia là thành viên của công ước viên cấp khi lái xe tham gia giao thông đường bộ trên lãnh thổ việt nam phải mang theo giấy phép lái xe quốc tế và giấy phép lái xe quốc gia được cấp phù hợp với hạng xe điều khiển, còn thời hạn sử dụng; phải tuân thủ pháp luật về trật tự, an toàn giao thông đường bộ của việt nam; c) người có giấy phép lái xe quốc tế vi phạm pháp luật về trật tự, an toàn giao thông đường bộ của việt nam mà bị tước quyền sử dụng giấy phép lái xe có thời hạn thì thời gian bị tước quyền sử dụng không quá thời gian người lái xe được phép cư trú tại lãnh thổ việt nam; d) người việt nam hoặc người nước ngoài có thẻ thường trú hoặc thẻ tạm trú tại việt nam có giấy phép lái xe do việt nam hoặc quốc gia là thành viên của điều ước quốc tế mà nước cộng hòa xã hội chủ nghĩa việt nam là thành viên cấp, còn giá trị sử dụng, nếu có nhu cầu được cấp giấy phép lái xe quốc tế. 9. bộ trưởng bộ giao thông vận tải quy định mẫu giấy phép lái xe và giấy phép lái xe quốc tế, trình tự, thủ tục cấp và việc sử dụng giấy phép lái xe, giấy phép lái xe quốc tế; đối với mẫu giấy phép lái xe, trình tự, thủ tục cấp và việc sử dụng giấy phép lái xe của lực lượng quân đội, công an làm nhiệm vụ quốc phòng, an ninh do bộ trưởng bộ quốc phòng, bộ trưởng bộ công an quy định.']","**Nguồn văn bản:** 36_2024_QH15_444251

**Tên văn bản:** Luật Trật tự, an toàn giao thông đường bộ

**Điều 57:** Giấy phép lái xe

**Nội dung:**

1. Giấy phép lái xe bao gồm các hạng sau đây:

    k) Hạng BE cấp cho người lái các loại xe ô tô quy định cho giấy phép lái xe hạng B kéo rơ moóc có khối lượng toàn bộ theo thiết kế trên 750 kg.


Tóm lại: Giấy phép lái xe hạng BE được phép lái các loại xe ô tô quy định cho giấy phép lái xe hạng B kéo rơ moóc có khối lượng toàn bộ theo thiết kế trên 750 kg.
",Hạng BE cho phép lái xe ô tô chở người đến 9 chỗ ngồi kéo rơ moóc có trọng tải trên 750 kg.,1.0,0.532554527469015,0.0,0.3333333333
6,Giấy phép lái xe hạng C1E cho phép lái những loại xe nào?,"['1. đào tạo từ xa, tự học có hướng dẫn áp dụng đối với các môn học pháp luật về giao thông đường bộ, đạo đức, văn hóa giao thông và phòng chống tác hại của rượu, bia khi tham gia giao thông và học lý thuyết của các môn: cấu tạo và sửa chữa thông thường; kỹ năng phòng cháy, chữa cháy và cứu nạn, cứu hộ; kỹ thuật lái xe để cấp giấy phép lái xe hạng b, c1, c, d1, d2, d, be, c1e, ce, d1e, d2e và de. 2. người học phải đăng ký tại cơ sở được phép đào tạo để được quản lý theo quy định của bộ giao thông vận tải. mục 2. điều kiện kinh doanh của cơ sở đào tạo lái xe ô tô', '1. giấy phép lái xe bao gồm các hạng sau đây: a) hạng a1 cấp cho người lái xe mô tô hai bánh có dung tích xi-lanh đến 125 cm3 hoặc có công suất động cơ điện đến 11 kw; b) hạng a cấp cho người lái xe mô tô hai bánh có dung tích xi-lanh\xa0 trên 125 cm3\xa0hoặc có công suất động cơ điện trên 11 kw và các loại xe quy định cho giấy phép lái xe hạng a1; c) hạng b1 cấp cho người lái xe mô tô ba bánh và các loại xe quy định cho giấy phép lái xe hạng a1; d) hạng b cấp cho người lái xe ô tô chở người đến 08 chỗ (không kể chỗ của người lái xe); xe ô tô tải và ô tô chuyên dùng có khối lượng toàn bộ theo thiết kế đến 3.500 kg; các loại xe ô tô quy định cho giấy phép lái xe hạng b kéo rơ moóc có khối lượng toàn bộ theo thiết kế đến 750 kg; đ) hạng c1 cấp cho người lái xe ô tô tải và ô tô chuyên dùng có khối lượng toàn bộ theo thiết kế trên 3.500 kg đến 7.500 kg; các loại xe ô tô tải quy định cho giấy phép lái xe hạng c1 kéo rơ moóc có khối lượng toàn bộ theo thiết kế đến 750 kg; các loại xe quy định cho giấy phép lái xe hạng b; e) hạng c cấp cho người lái xe ô tô tải và ô tô chuyên dùng có khối lượng toàn bộ theo thiết kế trên 7.500 kg; các loại xe ô tô tải quy định cho giấy phép lái xe hạng c kéo rơ moóc có khối lượng toàn bộ theo thiết kế đến 750 kg; các loại xe quy định cho giấy phép lái xe hạng b và hạng c1; g) hạng d1 cấp cho người lái xe ô tô chở người trên 08 chỗ (không kể chỗ của người lái xe) đến 16 chỗ (không kể chỗ của người lái xe); các loại xe ô tô chở người quy định cho giấy phép lái xe hạng d1 kéo rơ moóc có khối lượng toàn bộ theo thiết kế đến 750 kg; các loại xe quy định cho giấy phép lái xe các hạng b, c1, c; h) hạng d2 cấp cho người lái xe ô tô chở người (kể cả xe buýt) trên 16 chỗ (không kể chỗ của người lái xe) đến 29 chỗ (không kể chỗ của người lái xe); các loại xe ô tô chở người quy định cho giấy phép lái xe hạng d2 kéo rơ moóc có khối lượng toàn bộ theo thiết kế đến 750 kg; các loại xe quy định cho giấy phép lái xe các hạng b, c1, c, d1; i) hạng d cấp cho người lái xe ô tô chở người (kể cả xe buýt) trên 29 chỗ (không kể chỗ của người lái xe); xe ô tô chở người giường nằm; các loại xe ô tô chở người quy định cho giấy phép lái xe hạng d kéo rơ moóc có khối lượng toàn bộ theo thiết kế đến 750 kg; các loại xe quy định cho giấy phép lái xe các hạng b, c1, c, d1, d2; k) hạng be cấp cho người lái các loại xe ô tô quy định cho giấy phép lái xe hạng b kéo rơ moóc có khối lượng toàn bộ theo thiết kế trên 750 kg; l) hạng c1e cấp cho người lái các loại xe ô tô quy định cho giấy phép lái xe hạng c1 kéo rơ moóc có khối lượng toàn bộ theo thiết kế trên 750 kg; m) hạng ce cấp cho người lái các loại xe ô tô quy định cho giấy phép lái xe hạng c kéo rơ moóc có khối lượng toàn bộ theo thiết kế trên 750 kg; xe ô tô đầu kéo kéo sơ mi rơ moóc; n) hạng d1e cấp cho người lái các loại xe ô tô quy định cho giấy phép lái xe hạng d1 kéo rơ moóc có khối lượng toàn bộ theo thiết kế trên 750 kg; o) hạng d2e cấp cho người lái các loại xe ô tô quy định cho giấy phép lái xe hạng d2 kéo rơ moóc có khối lượng toàn bộ theo thiết kế trên 750 kg; p) hạng de cấp cho người lái các loại xe ô tô quy định cho giấy phép lái xe hạng d kéo rơ moóc có khối lượng toàn bộ theo thiết kế trên 750 kg; xe ô tô chở khách nối toa. 2. người khuyết tật điều khiển xe mô tô ba bánh dùng cho người khuyết tật được cấp giấy phép lái xe hạng a1. người khuyết tật điều khiển xe ô tô số tự động có kết cấu phù hợp với tình trạng khuyết tật thì được cấp giấy phép lái xe hạng b. 3. người điều khiển xe chở hàng bốn bánh có gắn động cơ, xe chở người bốn bánh có gắn động cơ phải sử dụng giấy phép lái xe có hạng phù hợp với xe ô tô tải hoặc xe ô tô chở người tương ứng. 4. người điều khiển xe ô tô có thiết kế, cải tạo với số chỗ ít hơn xe cùng loại, kích thước giới hạn tương đương phải sử dụng giấy phép lái xe có hạng phù hợp với xe ô tô cùng loại, kích thước giới hạn tương đương và có số chỗ nhiều nhất. 5. thời hạn của giấy phép lái xe được quy định như sau: a) giấy phép lái xe các hạng a1, a, b1 không thời hạn; b) giấy phép lái xe hạng b và hạng c1 có thời hạn 10 năm kể từ ngày cấp; c) giấy phép lái xe các hạng c, d1, d2, d, be, c1e, ce, d1e, d2e và de có thời hạn 05 năm kể từ ngày cấp. 6. giấy phép lái xe có giá trị sử dụng trong phạm vi lãnh thổ việt nam bao gồm: a) giấy phép lái xe do cơ quan có thẩm quyền của việt nam cấp; b) giấy phép lái xe quốc tế và giấy phép lái xe quốc gia phù hợp với loại xe được phép điều khiển do quốc gia là thành viên của công ước của liên hợp quốc về giao thông đường bộ năm 1968 (sau đây gọi là công ước viên) cấp; c) giấy phép lái xe phù hợp với loại xe được phép điều khiển của nước hoặc vùng lãnh thổ mà việt nam ký kết điều ước quốc tế hoặc thỏa thuận quốc tế công nhận giấy phép lái xe của nhau; d) giấy phép lái xe nước ngoài phù hợp với loại xe được phép điều khiển do quốc gia được công nhận theo điều ước quốc tế mà nước cộng hòa xã hội chủ nghĩa việt nam là thành viên. 7. giấy phép lái xe không có hiệu lực trong các trường hợp sau đây: a) giấy phép lái xe hết thời hạn sử dụng; b) giấy phép lái xe bị thu hồi theo quy định tại khoản 5 điều 62 của luật này. 8. giấy phép lái xe quốc tế được quy định như sau: a) giấy phép lái xe quốc tế là giấy phép lái xe do cơ quan nhà nước có thẩm quyền của quốc gia là thành viên của công ước viên cấp theo một mẫu thống nhất; có thời hạn không quá 03 năm kể từ ngày cấp và phải phù hợp với thời hạn còn hiệu lực của giấy phép lái xe quốc gia; b) người có giấy phép lái xe quốc tế do quốc gia là thành viên của công ước viên cấp khi lái xe tham gia giao thông đường bộ trên lãnh thổ việt nam phải mang theo giấy phép lái xe quốc tế và giấy phép lái xe quốc gia được cấp phù hợp với hạng xe điều khiển, còn thời hạn sử dụng; phải tuân thủ pháp luật về trật tự, an toàn giao thông đường bộ của việt nam; c) người có giấy phép lái xe quốc tế vi phạm pháp luật về trật tự, an toàn giao thông đường bộ của việt nam mà bị tước quyền sử dụng giấy phép lái xe có thời hạn thì thời gian bị tước quyền sử dụng không quá thời gian người lái xe được phép cư trú tại lãnh thổ việt nam; d) người việt nam hoặc người nước ngoài có thẻ thường trú hoặc thẻ tạm trú tại việt nam có giấy phép lái xe do việt nam hoặc quốc gia là thành viên của điều ước quốc tế mà nước cộng hòa xã hội chủ nghĩa việt nam là thành viên cấp, còn giá trị sử dụng, nếu có nhu cầu được cấp giấy phép lái xe quốc tế. 9. bộ trưởng bộ giao thông vận tải quy định mẫu giấy phép lái xe và giấy phép lái xe quốc tế, trình tự, thủ tục cấp và việc sử dụng giấy phép lái xe, giấy phép lái xe quốc tế; đối với mẫu giấy phép lái xe, trình tự, thủ tục cấp và việc sử dụng giấy phép lái xe của lực lượng quân đội, công an làm nhiệm vụ quốc phòng, an ninh do bộ trưởng bộ quốc phòng, bộ trưởng bộ công an quy định.', '1. giấy phép lái xe quân sự, được phân hạng theo quy định của luật trật tự, an toàn giao thông đường bộ, đồng thời phù hợp với đặc thù quân sự của phương tiện cơ giới đường bộ thuộc phạm vi quản lý của bộ quốc phòng. giấy phép lái xe quân sự, gồm: a) hạng a1 cấp cho người điều khiển xe mô tô hai bánh có dung tích xi-lanh đến 125 cm3 hoặc có công suất động cơ điện đến 11 kw; b) hạng a cấp cho người điều khiển xe mô tô hai bánh có dung tích xi-lanh trên 125 cm3 hoặc có công suất động cơ điện trên 11kw và các loại xe quy định cho giấy phép lái xe quân sự hạng a1; c) hạng b1 cấp cho người điều khiển xe mô tô ba bánh và các loại xe quy định cho giấy phép lái xe quân sự hạng a1; d) hạng b cấp cho người điều khiển các loại xe ô tô chở người đến 08 chỗ ngồi (không kể chỗ của người lái xe); xe ô tô tải và ô tô chuyên dùng có khối lượng toàn bộ theo thiết kế đến 3.500 kg; các loại xe ô tô quy định cho giấy phép lái xe hạng b có kéo rơ moóc hoặc vũ khí, khí tài quân sự dạng rơ moóc có khối lượng toàn bộ theo thiết kế đến 750 kg; đ) hạng c1 cấp cho người điều khiển các loại xe ô tô vận tải và ô tô chuyên dùng có khối lượng toàn bộ theo thiết kế trên 3.500 kg đến 7.500 kg; các loại xe ô tô quy định cho giấy phép lái xe hạng c1 kéo rơ moóc hoặc vũ khí, khí tài quân sự dạng rơ moóc có khối lượng toàn bộ theo thiết kế đến 750 kg; các loại xe quy định cho giấy phép lái xe quân sự hạng b; e) hạng c cấp cho người điều khiển các loại xe ô tô tải và ô tô chuyên dùng có khối lượng toàn bộ theo thiết kế trên 7.500 kg; các loại xe ô tô tải quy định cho giấy phép lái xe hạng c kéo rơ moóc hoặc vũ khí, khí tài quân sự dạng rơ moóc có khối lượng toàn bộ theo thiết kế đến 750 kg; các loại xe quy định cho giấy phép lái xe quân sự hạng b và hạng c1; g) hạng d1 cấp cho người điều khiển xe ô tô chở người trên 8 chỗ (không kể chỗ của người lái xe) đến 16 chỗ (không kể chỗ của người lái xe); các loại xe ô tô chở người quy định cho giấy phép lái xe hạng d1 kéo rơ moóc hoặc vũ khí, khí tài quân sự dạng rơ moóc có khối lượng toàn bộ theo thiết kế đến 750 kg; các loại xe quy định cho giấy phép lái xe quân sự hạng b, c1, c; h) hạng d2 cấp cho người điều khiển xe ô tô chở người từ trên 16 đến 29 chỗ (không kể chỗ của người lái xe); các loại xe ô tô chở người quy định cho giấy phép lái xe hạng d2 kéo rơ moóc hoặc vũ khí, khí tài quân sự dạng rơ moóc có khối lượng toàn bộ theo thiết kế đến 750 kg; các loại xe quy định cho giấy phép lái xe quân sự hạng b, c1, c, d1; i) hạng d cấp cho người điều khiển xe ô tô chở người từ trên 29 chỗ (không kể chỗ của người lái xe); các loại xe ô tô chở người quy định cho giấy phép lái xe hạng d kéo rơ moóc hoặc vũ khí, khí tài quân sự dạng rơ moóc có khối lượng toàn bộ theo thiết kế đến 750 kg; các loại xe quy định cho giấy phép lái xe quân sự hạng b, c1, c, d1, d2; k) hạng c1e cấp cho người điều khiển các loại xe ô tô quy định cho giấy phép lái xe hạng c1 kéo rơ moóc hoặc vũ khí, khí tài quân sự dạng rơ moóc có khối lượng toàn bộ theo thiết kế trên 750 kg; l) hạng ce cấp cho người điều khiển các loại xe ô tô quy định cho giấy phép lái xe hạng c kéo rơ moóc hoặc vũ khí, khí tài quân sự dạng rơ moóc có khối lượng toàn bộ theo thiết kế trên 750 kg; xe ô tô đầu kéo kéo sơ mi rơ moóc hoặc khí tài quân sự dạng sơ mi rơ moóc; m) hạng cx cấp cho người đã có giấy phép lái xe quân sự hạng c để điều khiển xe xích kéo vũ khí, khí tài quân sự. 2. người điều khiển xe chở hàng bốn bánh có gắn động cơ, xe chở người bốn bánh có gắn động cơ phải sử dụng giấy phép lái xe có hạng phù hợp với xe ô tô tải và ô tô chở người tương ứng. 3. người điều khiển xe ô tô có thiết kế, cải tạo với số chỗ ngồi ít hơn ô tô cùng loại, kích thước giới hạn tương đương phải sử dụng giấy phép lái xe có hạng phù hợp với ô tô cùng loại, kích thước giới hạn tương đương và có số chỗ ngồi nhiều nhất.', '1. giấy phép lái xe quân sự được cấp trước ngày thông tư này có hiệu lực thi hành được tiếp tục sử dụng theo thời hạn ghi trên giấy phép lái xe. 2. giấy phép lái xe quân sự được cấp trước ngày thông tư này có hiệu lực thi hành nếu chưa thực hiện đổi, cấp lại theo quy định của thông tư này có hiệu lực sử dụng như sau: a) giấy phép lái xe quân sự hạng a1 được tiếp tục điều khiển xe mô tô hai bánh có dung tích xi-lanh từ 50 cm3 đến dưới 175 cm3 hoặc có công suất động cơ điện từ 04 kw đến dưới 14 kw; b) giấy phép lái xe quân sự hạng a2 được tiếp tục điều khiển xe mô tô hai bánh có dung tích xi-lanh từ 175 cm3 trở lên hoặc có công suất động cơ điện từ 14 kw trở lên và các loại xe quy định cho giấy phép lái xe hạng a1 quy định tại điểm a khoản này; c) giấy phép lái xe quân sự hạng a3 được tiếp tục điều khiển xe mô tô ba bánh, các loại xe quy định cho giấy phép lái xe hạng a1 quy định tại điểm a khoản này và các xe tương tự; d) giấy phép lái xe quân sự hạng b2 được tiếp tục điều khiển xe ô tô chở người đến 08 chỗ (không kể chỗ của người lái xe); xe ô tô tải, máy kéo có trọng tải dưới 3.500 kg; các loại xe ô tô quy định cho giấy phép lái xe hạng b kéo theo một rơ moóc hoặc vũ khí, khí tài quân sự dạng rơ moóc có khối lượng toàn bộ theo thiết kế đến 750 kg; đ) giấy phép lái xe quân sự hạng c được tiếp tục điều khiển xe ô tô tải, máy kéo có trọng tải từ 3.500 kg trở lên và các loại xe quy định cho các giấy phép lái xe hạng b2 quy định tại điểm d khoản này; các loại xe ô tô quy định cho giấy phép lái xe hạng c kéo theo một rơ moóc hoặc vũ khí, khí tài quân sự dạng rơ moóc có khối lượng toàn bộ theo thiết kế đến 750 kg; e) giấy phép lái xe quân sự hạng d được tiếp tục điều khiển xe ô tô chở người từ 09 chỗ (không kể chỗ của người lái xe) đến 29 chỗ (không kể chỗ của người lái xe) và các loại xe quy định cho các giấy phép lái xe hạng b2, c quy định tại các điểm d, đ khoản này; các loại xe ô tô quy định cho giấy phép lái xe hạng d2 kéo theo một rơ moóc hoặc vũ khí, khí tài quân sự dạng rơ moóc có khối lượng toàn bộ theo thiết kế đến 750 kg; g) giấy phép lái xe quân sự hạng e được tiếp tục điều khiển xe ô tô chở người trên 29 chỗ (không kể chỗ của người lái xe) và các loại xe quy định cho các giấy phép lái xe hạng b2, c, d quy định tại các điểm d, đ và e khoản này; các loại ô tô quy định cho giấy phép lái xe hạng d kéo theo một rơ moóc hoặc vũ khí, khí tài quân sự dạng rơ moóc có khối lượng toàn bộ theo thiết kế đến 750 kg; h) giấy phép lái xe quân sự hạng fc được tiếp tục điều khiển các loại xe quy định cho giấy phép lái xe hạng c quy định tại điểm đ khoản này khi kéo rơ moóc, khí tài quân sự dạng rơ moóc và ô tô đầu kéo kéo sơ mi rơ moóc, khí tài quân sự dạng sơ mi rơ moóc; i) giấy phép lái xe quân sự hạng fx được tiếp tục điều khiển xe xích kéo vũ khí, khí tài quân sự và các loại xe quy định cho giấy phép lái xe hạng c quy định tại điểm đ khoản này. 3. trường hợp người có giấy phép, lái xe quân sự đã được cấp trước ngày thông tư này có hiệu lực thi hành khi đổi, cấp lại giấy phép lái xe thì thực hiện như sau: a) giấy phép lái xe quân sự hạng a1 được đổi, cấp lại sang giấy phép lái xe quân sự hạng a với điều kiện hạn chế là chỉ được điều khiển xe mô tô hai bánh có dung tích xi-lanh đến dưới 175 cm3 hoặc có công suất động cơ điện đến dưới 14 kw; b) giấy phép lái xe quân sự hạng a2 được đổi, cấp lại sang giấy phép lái xe quân sự hạng a; c) giấy phép lái xe quân sự hạng a3 được đổi, cấp lại sang giấy phép lái xe quân sự hạng b1; d) giấy phép lái xe quân sự hạng b2 được đổi, cấp lại sang giấy phép lái xe quân sự hạng b hoặc hạng c1; đ) giấy phép lái xe quân sự hạng c giữ nguyên và đổi, cấp lại cùng hạng; e) giấy phép lái xe quân sự hạng d được đổi, cấp lại sang giấy phép lái xe quân sự hạng d2; g) giấy phép lái xe quân sự hạng e được đổi, cấp lại sang giấy phép lái xe quân sự hạng d; h) giấy phép lái xe quân sự hạng fc được đổi, cấp lại sang giấy phép lái xe quân sự hạng ce; i) giấy phép lái xe quân sự hạng fx được đổi, cấp lại sang giấy phép lái xe quân sự hạng cx; 4. người học lái xe đã được đào tạo lái xe trước ngày thông tư này có hiệu lực thi hành hoặc đang được đào tạo lái xe tại ngày thông tư này có hiệu lực thi hành chưa được sát hạch thì được sát hạch, cấp giấy phép lái xe theo hạng giấy phép lái xe đổi, cấp lại quy định tại khoản 3 điều này.']","**Nguồn văn bản:** 36_2024_QH15_444251

**Tên văn bản:** Luật Trật tự, an toàn giao thông đường bộ

**Điều 57:** Giấy phép lái xe

**Nội dung:**

1. Giấy phép lái xe hạng C1E cấp cho người lái các loại xe ô tô quy định cho giấy phép lái xe hạng C1 kéo rơ moóc có khối lượng toàn bộ theo thiết kế trên 750 kg.

2.  Giấy phép lái xe hạng C1 quy định người lái xe ô tô tải và ô tô chuyên dùng có khối lượng toàn bộ theo thiết kế trên 3.500 kg đến 7.500 kg; các loại xe ô tô tải quy định cho giấy phép lái xe hạng C1 kéo rơ moóc có khối lượng toàn bộ theo thiết kế đến 750 kg; các loại xe quy định cho giấy phép lái xe hạng B.  Do đó, giấy phép lái xe hạng C1E cho phép lái các loại xe này khi kéo theo rơ moóc có khối lượng toàn bộ thiết kế trên 750kg.


Tóm lại: Giấy phép lái xe hạng C1E cho phép lái các loại xe ô tô tải và ô tô chuyên dùng có khối lượng toàn bộ thiết kế từ 3.500 kg đến 7.500 kg,  và các loại xe quy định cho giấy phép lái xe hạng B, khi kéo theo rơ moóc có khối lượng toàn bộ thiết kế trên 750 kg.
",Hạng C1E cho phép lái xe ô tô tải có trọng tải từ 3.500 kg đến 7.500 kg kéo rơ moóc có trọng tải trên 750 kg.,1.0,0.7016990986866357,1.0,0.5833333333041666
7,Giấy phép lái xe hạng D1E cho phép lái những loại xe nào?,"['1. giấy phép lái xe bao gồm các hạng sau đây: a) hạng a1 cấp cho người lái xe mô tô hai bánh có dung tích xi-lanh đến 125 cm3 hoặc có công suất động cơ điện đến 11 kw; b) hạng a cấp cho người lái xe mô tô hai bánh có dung tích xi-lanh\xa0 trên 125 cm3\xa0hoặc có công suất động cơ điện trên 11 kw và các loại xe quy định cho giấy phép lái xe hạng a1; c) hạng b1 cấp cho người lái xe mô tô ba bánh và các loại xe quy định cho giấy phép lái xe hạng a1; d) hạng b cấp cho người lái xe ô tô chở người đến 08 chỗ (không kể chỗ của người lái xe); xe ô tô tải và ô tô chuyên dùng có khối lượng toàn bộ theo thiết kế đến 3.500 kg; các loại xe ô tô quy định cho giấy phép lái xe hạng b kéo rơ moóc có khối lượng toàn bộ theo thiết kế đến 750 kg; đ) hạng c1 cấp cho người lái xe ô tô tải và ô tô chuyên dùng có khối lượng toàn bộ theo thiết kế trên 3.500 kg đến 7.500 kg; các loại xe ô tô tải quy định cho giấy phép lái xe hạng c1 kéo rơ moóc có khối lượng toàn bộ theo thiết kế đến 750 kg; các loại xe quy định cho giấy phép lái xe hạng b; e) hạng c cấp cho người lái xe ô tô tải và ô tô chuyên dùng có khối lượng toàn bộ theo thiết kế trên 7.500 kg; các loại xe ô tô tải quy định cho giấy phép lái xe hạng c kéo rơ moóc có khối lượng toàn bộ theo thiết kế đến 750 kg; các loại xe quy định cho giấy phép lái xe hạng b và hạng c1; g) hạng d1 cấp cho người lái xe ô tô chở người trên 08 chỗ (không kể chỗ của người lái xe) đến 16 chỗ (không kể chỗ của người lái xe); các loại xe ô tô chở người quy định cho giấy phép lái xe hạng d1 kéo rơ moóc có khối lượng toàn bộ theo thiết kế đến 750 kg; các loại xe quy định cho giấy phép lái xe các hạng b, c1, c; h) hạng d2 cấp cho người lái xe ô tô chở người (kể cả xe buýt) trên 16 chỗ (không kể chỗ của người lái xe) đến 29 chỗ (không kể chỗ của người lái xe); các loại xe ô tô chở người quy định cho giấy phép lái xe hạng d2 kéo rơ moóc có khối lượng toàn bộ theo thiết kế đến 750 kg; các loại xe quy định cho giấy phép lái xe các hạng b, c1, c, d1; i) hạng d cấp cho người lái xe ô tô chở người (kể cả xe buýt) trên 29 chỗ (không kể chỗ của người lái xe); xe ô tô chở người giường nằm; các loại xe ô tô chở người quy định cho giấy phép lái xe hạng d kéo rơ moóc có khối lượng toàn bộ theo thiết kế đến 750 kg; các loại xe quy định cho giấy phép lái xe các hạng b, c1, c, d1, d2; k) hạng be cấp cho người lái các loại xe ô tô quy định cho giấy phép lái xe hạng b kéo rơ moóc có khối lượng toàn bộ theo thiết kế trên 750 kg; l) hạng c1e cấp cho người lái các loại xe ô tô quy định cho giấy phép lái xe hạng c1 kéo rơ moóc có khối lượng toàn bộ theo thiết kế trên 750 kg; m) hạng ce cấp cho người lái các loại xe ô tô quy định cho giấy phép lái xe hạng c kéo rơ moóc có khối lượng toàn bộ theo thiết kế trên 750 kg; xe ô tô đầu kéo kéo sơ mi rơ moóc; n) hạng d1e cấp cho người lái các loại xe ô tô quy định cho giấy phép lái xe hạng d1 kéo rơ moóc có khối lượng toàn bộ theo thiết kế trên 750 kg; o) hạng d2e cấp cho người lái các loại xe ô tô quy định cho giấy phép lái xe hạng d2 kéo rơ moóc có khối lượng toàn bộ theo thiết kế trên 750 kg; p) hạng de cấp cho người lái các loại xe ô tô quy định cho giấy phép lái xe hạng d kéo rơ moóc có khối lượng toàn bộ theo thiết kế trên 750 kg; xe ô tô chở khách nối toa. 2. người khuyết tật điều khiển xe mô tô ba bánh dùng cho người khuyết tật được cấp giấy phép lái xe hạng a1. người khuyết tật điều khiển xe ô tô số tự động có kết cấu phù hợp với tình trạng khuyết tật thì được cấp giấy phép lái xe hạng b. 3. người điều khiển xe chở hàng bốn bánh có gắn động cơ, xe chở người bốn bánh có gắn động cơ phải sử dụng giấy phép lái xe có hạng phù hợp với xe ô tô tải hoặc xe ô tô chở người tương ứng. 4. người điều khiển xe ô tô có thiết kế, cải tạo với số chỗ ít hơn xe cùng loại, kích thước giới hạn tương đương phải sử dụng giấy phép lái xe có hạng phù hợp với xe ô tô cùng loại, kích thước giới hạn tương đương và có số chỗ nhiều nhất. 5. thời hạn của giấy phép lái xe được quy định như sau: a) giấy phép lái xe các hạng a1, a, b1 không thời hạn; b) giấy phép lái xe hạng b và hạng c1 có thời hạn 10 năm kể từ ngày cấp; c) giấy phép lái xe các hạng c, d1, d2, d, be, c1e, ce, d1e, d2e và de có thời hạn 05 năm kể từ ngày cấp. 6. giấy phép lái xe có giá trị sử dụng trong phạm vi lãnh thổ việt nam bao gồm: a) giấy phép lái xe do cơ quan có thẩm quyền của việt nam cấp; b) giấy phép lái xe quốc tế và giấy phép lái xe quốc gia phù hợp với loại xe được phép điều khiển do quốc gia là thành viên của công ước của liên hợp quốc về giao thông đường bộ năm 1968 (sau đây gọi là công ước viên) cấp; c) giấy phép lái xe phù hợp với loại xe được phép điều khiển của nước hoặc vùng lãnh thổ mà việt nam ký kết điều ước quốc tế hoặc thỏa thuận quốc tế công nhận giấy phép lái xe của nhau; d) giấy phép lái xe nước ngoài phù hợp với loại xe được phép điều khiển do quốc gia được công nhận theo điều ước quốc tế mà nước cộng hòa xã hội chủ nghĩa việt nam là thành viên. 7. giấy phép lái xe không có hiệu lực trong các trường hợp sau đây: a) giấy phép lái xe hết thời hạn sử dụng; b) giấy phép lái xe bị thu hồi theo quy định tại khoản 5 điều 62 của luật này. 8. giấy phép lái xe quốc tế được quy định như sau: a) giấy phép lái xe quốc tế là giấy phép lái xe do cơ quan nhà nước có thẩm quyền của quốc gia là thành viên của công ước viên cấp theo một mẫu thống nhất; có thời hạn không quá 03 năm kể từ ngày cấp và phải phù hợp với thời hạn còn hiệu lực của giấy phép lái xe quốc gia; b) người có giấy phép lái xe quốc tế do quốc gia là thành viên của công ước viên cấp khi lái xe tham gia giao thông đường bộ trên lãnh thổ việt nam phải mang theo giấy phép lái xe quốc tế và giấy phép lái xe quốc gia được cấp phù hợp với hạng xe điều khiển, còn thời hạn sử dụng; phải tuân thủ pháp luật về trật tự, an toàn giao thông đường bộ của việt nam; c) người có giấy phép lái xe quốc tế vi phạm pháp luật về trật tự, an toàn giao thông đường bộ của việt nam mà bị tước quyền sử dụng giấy phép lái xe có thời hạn thì thời gian bị tước quyền sử dụng không quá thời gian người lái xe được phép cư trú tại lãnh thổ việt nam; d) người việt nam hoặc người nước ngoài có thẻ thường trú hoặc thẻ tạm trú tại việt nam có giấy phép lái xe do việt nam hoặc quốc gia là thành viên của điều ước quốc tế mà nước cộng hòa xã hội chủ nghĩa việt nam là thành viên cấp, còn giá trị sử dụng, nếu có nhu cầu được cấp giấy phép lái xe quốc tế. 9. bộ trưởng bộ giao thông vận tải quy định mẫu giấy phép lái xe và giấy phép lái xe quốc tế, trình tự, thủ tục cấp và việc sử dụng giấy phép lái xe, giấy phép lái xe quốc tế; đối với mẫu giấy phép lái xe, trình tự, thủ tục cấp và việc sử dụng giấy phép lái xe của lực lượng quân đội, công an làm nhiệm vụ quốc phòng, an ninh do bộ trưởng bộ quốc phòng, bộ trưởng bộ công an quy định.', '1. giấy phép lái xe quân sự, được phân hạng theo quy định của luật trật tự, an toàn giao thông đường bộ, đồng thời phù hợp với đặc thù quân sự của phương tiện cơ giới đường bộ thuộc phạm vi quản lý của bộ quốc phòng. giấy phép lái xe quân sự, gồm: a) hạng a1 cấp cho người điều khiển xe mô tô hai bánh có dung tích xi-lanh đến 125 cm3 hoặc có công suất động cơ điện đến 11 kw; b) hạng a cấp cho người điều khiển xe mô tô hai bánh có dung tích xi-lanh trên 125 cm3 hoặc có công suất động cơ điện trên 11kw và các loại xe quy định cho giấy phép lái xe quân sự hạng a1; c) hạng b1 cấp cho người điều khiển xe mô tô ba bánh và các loại xe quy định cho giấy phép lái xe quân sự hạng a1; d) hạng b cấp cho người điều khiển các loại xe ô tô chở người đến 08 chỗ ngồi (không kể chỗ của người lái xe); xe ô tô tải và ô tô chuyên dùng có khối lượng toàn bộ theo thiết kế đến 3.500 kg; các loại xe ô tô quy định cho giấy phép lái xe hạng b có kéo rơ moóc hoặc vũ khí, khí tài quân sự dạng rơ moóc có khối lượng toàn bộ theo thiết kế đến 750 kg; đ) hạng c1 cấp cho người điều khiển các loại xe ô tô vận tải và ô tô chuyên dùng có khối lượng toàn bộ theo thiết kế trên 3.500 kg đến 7.500 kg; các loại xe ô tô quy định cho giấy phép lái xe hạng c1 kéo rơ moóc hoặc vũ khí, khí tài quân sự dạng rơ moóc có khối lượng toàn bộ theo thiết kế đến 750 kg; các loại xe quy định cho giấy phép lái xe quân sự hạng b; e) hạng c cấp cho người điều khiển các loại xe ô tô tải và ô tô chuyên dùng có khối lượng toàn bộ theo thiết kế trên 7.500 kg; các loại xe ô tô tải quy định cho giấy phép lái xe hạng c kéo rơ moóc hoặc vũ khí, khí tài quân sự dạng rơ moóc có khối lượng toàn bộ theo thiết kế đến 750 kg; các loại xe quy định cho giấy phép lái xe quân sự hạng b và hạng c1; g) hạng d1 cấp cho người điều khiển xe ô tô chở người trên 8 chỗ (không kể chỗ của người lái xe) đến 16 chỗ (không kể chỗ của người lái xe); các loại xe ô tô chở người quy định cho giấy phép lái xe hạng d1 kéo rơ moóc hoặc vũ khí, khí tài quân sự dạng rơ moóc có khối lượng toàn bộ theo thiết kế đến 750 kg; các loại xe quy định cho giấy phép lái xe quân sự hạng b, c1, c; h) hạng d2 cấp cho người điều khiển xe ô tô chở người từ trên 16 đến 29 chỗ (không kể chỗ của người lái xe); các loại xe ô tô chở người quy định cho giấy phép lái xe hạng d2 kéo rơ moóc hoặc vũ khí, khí tài quân sự dạng rơ moóc có khối lượng toàn bộ theo thiết kế đến 750 kg; các loại xe quy định cho giấy phép lái xe quân sự hạng b, c1, c, d1; i) hạng d cấp cho người điều khiển xe ô tô chở người từ trên 29 chỗ (không kể chỗ của người lái xe); các loại xe ô tô chở người quy định cho giấy phép lái xe hạng d kéo rơ moóc hoặc vũ khí, khí tài quân sự dạng rơ moóc có khối lượng toàn bộ theo thiết kế đến 750 kg; các loại xe quy định cho giấy phép lái xe quân sự hạng b, c1, c, d1, d2; k) hạng c1e cấp cho người điều khiển các loại xe ô tô quy định cho giấy phép lái xe hạng c1 kéo rơ moóc hoặc vũ khí, khí tài quân sự dạng rơ moóc có khối lượng toàn bộ theo thiết kế trên 750 kg; l) hạng ce cấp cho người điều khiển các loại xe ô tô quy định cho giấy phép lái xe hạng c kéo rơ moóc hoặc vũ khí, khí tài quân sự dạng rơ moóc có khối lượng toàn bộ theo thiết kế trên 750 kg; xe ô tô đầu kéo kéo sơ mi rơ moóc hoặc khí tài quân sự dạng sơ mi rơ moóc; m) hạng cx cấp cho người đã có giấy phép lái xe quân sự hạng c để điều khiển xe xích kéo vũ khí, khí tài quân sự. 2. người điều khiển xe chở hàng bốn bánh có gắn động cơ, xe chở người bốn bánh có gắn động cơ phải sử dụng giấy phép lái xe có hạng phù hợp với xe ô tô tải và ô tô chở người tương ứng. 3. người điều khiển xe ô tô có thiết kế, cải tạo với số chỗ ngồi ít hơn ô tô cùng loại, kích thước giới hạn tương đương phải sử dụng giấy phép lái xe có hạng phù hợp với ô tô cùng loại, kích thước giới hạn tương đương và có số chỗ ngồi nhiều nhất.']","**Nguồn văn bản:** 36_2024_QH15_444251

**Tên văn bản:** Luật Trật tự, an toàn giao thông đường bộ

**Điều 57:** giấy phép lái xe

**Nội dung:**

Giấy phép lái xe hạng D1E được phép lái các loại xe ô tô quy định cho giấy phép lái xe hạng D1 kéo rơ moóc có khối lượng toàn bộ theo thiết kế trên 750 kg.


Tóm lại: Giấy phép lái xe hạng D1E được phép lái các loại xe ô tô chở người từ trên 8 đến 16 chỗ (không kể chỗ lái) và kéo rơ moóc có khối lượng trên 750kg.
",Hạng D1E cho phép lái xe ô tô chở người từ 10 đến 30 chỗ ngồi kéo rơ moóc có trọng tải trên 750 kg.,1.0,0.8756984946043823,0.0,0.9999999999
8,Giấy phép lái xe hạng D2E cho phép lái những loại xe nào?,"['1. đào tạo từ xa, tự học có hướng dẫn áp dụng đối với các môn học pháp luật về giao thông đường bộ, đạo đức, văn hóa giao thông và phòng chống tác hại của rượu, bia khi tham gia giao thông và học lý thuyết của các môn: cấu tạo và sửa chữa thông thường; kỹ năng phòng cháy, chữa cháy và cứu nạn, cứu hộ; kỹ thuật lái xe để cấp giấy phép lái xe hạng b, c1, c, d1, d2, d, be, c1e, ce, d1e, d2e và de. 2. người học phải đăng ký tại cơ sở được phép đào tạo để được quản lý theo quy định của bộ giao thông vận tải. mục 2. điều kiện kinh doanh của cơ sở đào tạo lái xe ô tô', '1. giấy phép lái xe bao gồm các hạng sau đây: a) hạng a1 cấp cho người lái xe mô tô hai bánh có dung tích xi-lanh đến 125 cm3 hoặc có công suất động cơ điện đến 11 kw; b) hạng a cấp cho người lái xe mô tô hai bánh có dung tích xi-lanh\xa0 trên 125 cm3\xa0hoặc có công suất động cơ điện trên 11 kw và các loại xe quy định cho giấy phép lái xe hạng a1; c) hạng b1 cấp cho người lái xe mô tô ba bánh và các loại xe quy định cho giấy phép lái xe hạng a1; d) hạng b cấp cho người lái xe ô tô chở người đến 08 chỗ (không kể chỗ của người lái xe); xe ô tô tải và ô tô chuyên dùng có khối lượng toàn bộ theo thiết kế đến 3.500 kg; các loại xe ô tô quy định cho giấy phép lái xe hạng b kéo rơ moóc có khối lượng toàn bộ theo thiết kế đến 750 kg; đ) hạng c1 cấp cho người lái xe ô tô tải và ô tô chuyên dùng có khối lượng toàn bộ theo thiết kế trên 3.500 kg đến 7.500 kg; các loại xe ô tô tải quy định cho giấy phép lái xe hạng c1 kéo rơ moóc có khối lượng toàn bộ theo thiết kế đến 750 kg; các loại xe quy định cho giấy phép lái xe hạng b; e) hạng c cấp cho người lái xe ô tô tải và ô tô chuyên dùng có khối lượng toàn bộ theo thiết kế trên 7.500 kg; các loại xe ô tô tải quy định cho giấy phép lái xe hạng c kéo rơ moóc có khối lượng toàn bộ theo thiết kế đến 750 kg; các loại xe quy định cho giấy phép lái xe hạng b và hạng c1; g) hạng d1 cấp cho người lái xe ô tô chở người trên 08 chỗ (không kể chỗ của người lái xe) đến 16 chỗ (không kể chỗ của người lái xe); các loại xe ô tô chở người quy định cho giấy phép lái xe hạng d1 kéo rơ moóc có khối lượng toàn bộ theo thiết kế đến 750 kg; các loại xe quy định cho giấy phép lái xe các hạng b, c1, c; h) hạng d2 cấp cho người lái xe ô tô chở người (kể cả xe buýt) trên 16 chỗ (không kể chỗ của người lái xe) đến 29 chỗ (không kể chỗ của người lái xe); các loại xe ô tô chở người quy định cho giấy phép lái xe hạng d2 kéo rơ moóc có khối lượng toàn bộ theo thiết kế đến 750 kg; các loại xe quy định cho giấy phép lái xe các hạng b, c1, c, d1; i) hạng d cấp cho người lái xe ô tô chở người (kể cả xe buýt) trên 29 chỗ (không kể chỗ của người lái xe); xe ô tô chở người giường nằm; các loại xe ô tô chở người quy định cho giấy phép lái xe hạng d kéo rơ moóc có khối lượng toàn bộ theo thiết kế đến 750 kg; các loại xe quy định cho giấy phép lái xe các hạng b, c1, c, d1, d2; k) hạng be cấp cho người lái các loại xe ô tô quy định cho giấy phép lái xe hạng b kéo rơ moóc có khối lượng toàn bộ theo thiết kế trên 750 kg; l) hạng c1e cấp cho người lái các loại xe ô tô quy định cho giấy phép lái xe hạng c1 kéo rơ moóc có khối lượng toàn bộ theo thiết kế trên 750 kg; m) hạng ce cấp cho người lái các loại xe ô tô quy định cho giấy phép lái xe hạng c kéo rơ moóc có khối lượng toàn bộ theo thiết kế trên 750 kg; xe ô tô đầu kéo kéo sơ mi rơ moóc; n) hạng d1e cấp cho người lái các loại xe ô tô quy định cho giấy phép lái xe hạng d1 kéo rơ moóc có khối lượng toàn bộ theo thiết kế trên 750 kg; o) hạng d2e cấp cho người lái các loại xe ô tô quy định cho giấy phép lái xe hạng d2 kéo rơ moóc có khối lượng toàn bộ theo thiết kế trên 750 kg; p) hạng de cấp cho người lái các loại xe ô tô quy định cho giấy phép lái xe hạng d kéo rơ moóc có khối lượng toàn bộ theo thiết kế trên 750 kg; xe ô tô chở khách nối toa. 2. người khuyết tật điều khiển xe mô tô ba bánh dùng cho người khuyết tật được cấp giấy phép lái xe hạng a1. người khuyết tật điều khiển xe ô tô số tự động có kết cấu phù hợp với tình trạng khuyết tật thì được cấp giấy phép lái xe hạng b. 3. người điều khiển xe chở hàng bốn bánh có gắn động cơ, xe chở người bốn bánh có gắn động cơ phải sử dụng giấy phép lái xe có hạng phù hợp với xe ô tô tải hoặc xe ô tô chở người tương ứng. 4. người điều khiển xe ô tô có thiết kế, cải tạo với số chỗ ít hơn xe cùng loại, kích thước giới hạn tương đương phải sử dụng giấy phép lái xe có hạng phù hợp với xe ô tô cùng loại, kích thước giới hạn tương đương và có số chỗ nhiều nhất. 5. thời hạn của giấy phép lái xe được quy định như sau: a) giấy phép lái xe các hạng a1, a, b1 không thời hạn; b) giấy phép lái xe hạng b và hạng c1 có thời hạn 10 năm kể từ ngày cấp; c) giấy phép lái xe các hạng c, d1, d2, d, be, c1e, ce, d1e, d2e và de có thời hạn 05 năm kể từ ngày cấp. 6. giấy phép lái xe có giá trị sử dụng trong phạm vi lãnh thổ việt nam bao gồm: a) giấy phép lái xe do cơ quan có thẩm quyền của việt nam cấp; b) giấy phép lái xe quốc tế và giấy phép lái xe quốc gia phù hợp với loại xe được phép điều khiển do quốc gia là thành viên của công ước của liên hợp quốc về giao thông đường bộ năm 1968 (sau đây gọi là công ước viên) cấp; c) giấy phép lái xe phù hợp với loại xe được phép điều khiển của nước hoặc vùng lãnh thổ mà việt nam ký kết điều ước quốc tế hoặc thỏa thuận quốc tế công nhận giấy phép lái xe của nhau; d) giấy phép lái xe nước ngoài phù hợp với loại xe được phép điều khiển do quốc gia được công nhận theo điều ước quốc tế mà nước cộng hòa xã hội chủ nghĩa việt nam là thành viên. 7. giấy phép lái xe không có hiệu lực trong các trường hợp sau đây: a) giấy phép lái xe hết thời hạn sử dụng; b) giấy phép lái xe bị thu hồi theo quy định tại khoản 5 điều 62 của luật này. 8. giấy phép lái xe quốc tế được quy định như sau: a) giấy phép lái xe quốc tế là giấy phép lái xe do cơ quan nhà nước có thẩm quyền của quốc gia là thành viên của công ước viên cấp theo một mẫu thống nhất; có thời hạn không quá 03 năm kể từ ngày cấp và phải phù hợp với thời hạn còn hiệu lực của giấy phép lái xe quốc gia; b) người có giấy phép lái xe quốc tế do quốc gia là thành viên của công ước viên cấp khi lái xe tham gia giao thông đường bộ trên lãnh thổ việt nam phải mang theo giấy phép lái xe quốc tế và giấy phép lái xe quốc gia được cấp phù hợp với hạng xe điều khiển, còn thời hạn sử dụng; phải tuân thủ pháp luật về trật tự, an toàn giao thông đường bộ của việt nam; c) người có giấy phép lái xe quốc tế vi phạm pháp luật về trật tự, an toàn giao thông đường bộ của việt nam mà bị tước quyền sử dụng giấy phép lái xe có thời hạn thì thời gian bị tước quyền sử dụng không quá thời gian người lái xe được phép cư trú tại lãnh thổ việt nam; d) người việt nam hoặc người nước ngoài có thẻ thường trú hoặc thẻ tạm trú tại việt nam có giấy phép lái xe do việt nam hoặc quốc gia là thành viên của điều ước quốc tế mà nước cộng hòa xã hội chủ nghĩa việt nam là thành viên cấp, còn giá trị sử dụng, nếu có nhu cầu được cấp giấy phép lái xe quốc tế. 9. bộ trưởng bộ giao thông vận tải quy định mẫu giấy phép lái xe và giấy phép lái xe quốc tế, trình tự, thủ tục cấp và việc sử dụng giấy phép lái xe, giấy phép lái xe quốc tế; đối với mẫu giấy phép lái xe, trình tự, thủ tục cấp và việc sử dụng giấy phép lái xe của lực lượng quân đội, công an làm nhiệm vụ quốc phòng, an ninh do bộ trưởng bộ quốc phòng, bộ trưởng bộ công an quy định.', '1. giấy phép lái xe quân sự, được phân hạng theo quy định của luật trật tự, an toàn giao thông đường bộ, đồng thời phù hợp với đặc thù quân sự của phương tiện cơ giới đường bộ thuộc phạm vi quản lý của bộ quốc phòng. giấy phép lái xe quân sự, gồm: a) hạng a1 cấp cho người điều khiển xe mô tô hai bánh có dung tích xi-lanh đến 125 cm3 hoặc có công suất động cơ điện đến 11 kw; b) hạng a cấp cho người điều khiển xe mô tô hai bánh có dung tích xi-lanh trên 125 cm3 hoặc có công suất động cơ điện trên 11kw và các loại xe quy định cho giấy phép lái xe quân sự hạng a1; c) hạng b1 cấp cho người điều khiển xe mô tô ba bánh và các loại xe quy định cho giấy phép lái xe quân sự hạng a1; d) hạng b cấp cho người điều khiển các loại xe ô tô chở người đến 08 chỗ ngồi (không kể chỗ của người lái xe); xe ô tô tải và ô tô chuyên dùng có khối lượng toàn bộ theo thiết kế đến 3.500 kg; các loại xe ô tô quy định cho giấy phép lái xe hạng b có kéo rơ moóc hoặc vũ khí, khí tài quân sự dạng rơ moóc có khối lượng toàn bộ theo thiết kế đến 750 kg; đ) hạng c1 cấp cho người điều khiển các loại xe ô tô vận tải và ô tô chuyên dùng có khối lượng toàn bộ theo thiết kế trên 3.500 kg đến 7.500 kg; các loại xe ô tô quy định cho giấy phép lái xe hạng c1 kéo rơ moóc hoặc vũ khí, khí tài quân sự dạng rơ moóc có khối lượng toàn bộ theo thiết kế đến 750 kg; các loại xe quy định cho giấy phép lái xe quân sự hạng b; e) hạng c cấp cho người điều khiển các loại xe ô tô tải và ô tô chuyên dùng có khối lượng toàn bộ theo thiết kế trên 7.500 kg; các loại xe ô tô tải quy định cho giấy phép lái xe hạng c kéo rơ moóc hoặc vũ khí, khí tài quân sự dạng rơ moóc có khối lượng toàn bộ theo thiết kế đến 750 kg; các loại xe quy định cho giấy phép lái xe quân sự hạng b và hạng c1; g) hạng d1 cấp cho người điều khiển xe ô tô chở người trên 8 chỗ (không kể chỗ của người lái xe) đến 16 chỗ (không kể chỗ của người lái xe); các loại xe ô tô chở người quy định cho giấy phép lái xe hạng d1 kéo rơ moóc hoặc vũ khí, khí tài quân sự dạng rơ moóc có khối lượng toàn bộ theo thiết kế đến 750 kg; các loại xe quy định cho giấy phép lái xe quân sự hạng b, c1, c; h) hạng d2 cấp cho người điều khiển xe ô tô chở người từ trên 16 đến 29 chỗ (không kể chỗ của người lái xe); các loại xe ô tô chở người quy định cho giấy phép lái xe hạng d2 kéo rơ moóc hoặc vũ khí, khí tài quân sự dạng rơ moóc có khối lượng toàn bộ theo thiết kế đến 750 kg; các loại xe quy định cho giấy phép lái xe quân sự hạng b, c1, c, d1; i) hạng d cấp cho người điều khiển xe ô tô chở người từ trên 29 chỗ (không kể chỗ của người lái xe); các loại xe ô tô chở người quy định cho giấy phép lái xe hạng d kéo rơ moóc hoặc vũ khí, khí tài quân sự dạng rơ moóc có khối lượng toàn bộ theo thiết kế đến 750 kg; các loại xe quy định cho giấy phép lái xe quân sự hạng b, c1, c, d1, d2; k) hạng c1e cấp cho người điều khiển các loại xe ô tô quy định cho giấy phép lái xe hạng c1 kéo rơ moóc hoặc vũ khí, khí tài quân sự dạng rơ moóc có khối lượng toàn bộ theo thiết kế trên 750 kg; l) hạng ce cấp cho người điều khiển các loại xe ô tô quy định cho giấy phép lái xe hạng c kéo rơ moóc hoặc vũ khí, khí tài quân sự dạng rơ moóc có khối lượng toàn bộ theo thiết kế trên 750 kg; xe ô tô đầu kéo kéo sơ mi rơ moóc hoặc khí tài quân sự dạng sơ mi rơ moóc; m) hạng cx cấp cho người đã có giấy phép lái xe quân sự hạng c để điều khiển xe xích kéo vũ khí, khí tài quân sự. 2. người điều khiển xe chở hàng bốn bánh có gắn động cơ, xe chở người bốn bánh có gắn động cơ phải sử dụng giấy phép lái xe có hạng phù hợp với xe ô tô tải và ô tô chở người tương ứng. 3. người điều khiển xe ô tô có thiết kế, cải tạo với số chỗ ngồi ít hơn ô tô cùng loại, kích thước giới hạn tương đương phải sử dụng giấy phép lái xe có hạng phù hợp với ô tô cùng loại, kích thước giới hạn tương đương và có số chỗ ngồi nhiều nhất.', '1. giấy phép lái xe quân sự được cấp trước ngày thông tư này có hiệu lực thi hành được tiếp tục sử dụng theo thời hạn ghi trên giấy phép lái xe. 2. giấy phép lái xe quân sự được cấp trước ngày thông tư này có hiệu lực thi hành nếu chưa thực hiện đổi, cấp lại theo quy định của thông tư này có hiệu lực sử dụng như sau: a) giấy phép lái xe quân sự hạng a1 được tiếp tục điều khiển xe mô tô hai bánh có dung tích xi-lanh từ 50 cm3 đến dưới 175 cm3 hoặc có công suất động cơ điện từ 04 kw đến dưới 14 kw; b) giấy phép lái xe quân sự hạng a2 được tiếp tục điều khiển xe mô tô hai bánh có dung tích xi-lanh từ 175 cm3 trở lên hoặc có công suất động cơ điện từ 14 kw trở lên và các loại xe quy định cho giấy phép lái xe hạng a1 quy định tại điểm a khoản này; c) giấy phép lái xe quân sự hạng a3 được tiếp tục điều khiển xe mô tô ba bánh, các loại xe quy định cho giấy phép lái xe hạng a1 quy định tại điểm a khoản này và các xe tương tự; d) giấy phép lái xe quân sự hạng b2 được tiếp tục điều khiển xe ô tô chở người đến 08 chỗ (không kể chỗ của người lái xe); xe ô tô tải, máy kéo có trọng tải dưới 3.500 kg; các loại xe ô tô quy định cho giấy phép lái xe hạng b kéo theo một rơ moóc hoặc vũ khí, khí tài quân sự dạng rơ moóc có khối lượng toàn bộ theo thiết kế đến 750 kg; đ) giấy phép lái xe quân sự hạng c được tiếp tục điều khiển xe ô tô tải, máy kéo có trọng tải từ 3.500 kg trở lên và các loại xe quy định cho các giấy phép lái xe hạng b2 quy định tại điểm d khoản này; các loại xe ô tô quy định cho giấy phép lái xe hạng c kéo theo một rơ moóc hoặc vũ khí, khí tài quân sự dạng rơ moóc có khối lượng toàn bộ theo thiết kế đến 750 kg; e) giấy phép lái xe quân sự hạng d được tiếp tục điều khiển xe ô tô chở người từ 09 chỗ (không kể chỗ của người lái xe) đến 29 chỗ (không kể chỗ của người lái xe) và các loại xe quy định cho các giấy phép lái xe hạng b2, c quy định tại các điểm d, đ khoản này; các loại xe ô tô quy định cho giấy phép lái xe hạng d2 kéo theo một rơ moóc hoặc vũ khí, khí tài quân sự dạng rơ moóc có khối lượng toàn bộ theo thiết kế đến 750 kg; g) giấy phép lái xe quân sự hạng e được tiếp tục điều khiển xe ô tô chở người trên 29 chỗ (không kể chỗ của người lái xe) và các loại xe quy định cho các giấy phép lái xe hạng b2, c, d quy định tại các điểm d, đ và e khoản này; các loại ô tô quy định cho giấy phép lái xe hạng d kéo theo một rơ moóc hoặc vũ khí, khí tài quân sự dạng rơ moóc có khối lượng toàn bộ theo thiết kế đến 750 kg; h) giấy phép lái xe quân sự hạng fc được tiếp tục điều khiển các loại xe quy định cho giấy phép lái xe hạng c quy định tại điểm đ khoản này khi kéo rơ moóc, khí tài quân sự dạng rơ moóc và ô tô đầu kéo kéo sơ mi rơ moóc, khí tài quân sự dạng sơ mi rơ moóc; i) giấy phép lái xe quân sự hạng fx được tiếp tục điều khiển xe xích kéo vũ khí, khí tài quân sự và các loại xe quy định cho giấy phép lái xe hạng c quy định tại điểm đ khoản này. 3. trường hợp người có giấy phép, lái xe quân sự đã được cấp trước ngày thông tư này có hiệu lực thi hành khi đổi, cấp lại giấy phép lái xe thì thực hiện như sau: a) giấy phép lái xe quân sự hạng a1 được đổi, cấp lại sang giấy phép lái xe quân sự hạng a với điều kiện hạn chế là chỉ được điều khiển xe mô tô hai bánh có dung tích xi-lanh đến dưới 175 cm3 hoặc có công suất động cơ điện đến dưới 14 kw; b) giấy phép lái xe quân sự hạng a2 được đổi, cấp lại sang giấy phép lái xe quân sự hạng a; c) giấy phép lái xe quân sự hạng a3 được đổi, cấp lại sang giấy phép lái xe quân sự hạng b1; d) giấy phép lái xe quân sự hạng b2 được đổi, cấp lại sang giấy phép lái xe quân sự hạng b hoặc hạng c1; đ) giấy phép lái xe quân sự hạng c giữ nguyên và đổi, cấp lại cùng hạng; e) giấy phép lái xe quân sự hạng d được đổi, cấp lại sang giấy phép lái xe quân sự hạng d2; g) giấy phép lái xe quân sự hạng e được đổi, cấp lại sang giấy phép lái xe quân sự hạng d; h) giấy phép lái xe quân sự hạng fc được đổi, cấp lại sang giấy phép lái xe quân sự hạng ce; i) giấy phép lái xe quân sự hạng fx được đổi, cấp lại sang giấy phép lái xe quân sự hạng cx; 4. người học lái xe đã được đào tạo lái xe trước ngày thông tư này có hiệu lực thi hành hoặc đang được đào tạo lái xe tại ngày thông tư này có hiệu lực thi hành chưa được sát hạch thì được sát hạch, cấp giấy phép lái xe theo hạng giấy phép lái xe đổi, cấp lại quy định tại khoản 3 điều này.']","**Nguồn văn bản:** 36_2024_QH15_444251

**Tên văn bản:** Luật Trật tự, an toàn giao thông đường bộ

**Điều 57:** Giấy phép lái xe

**Nội dung:**

1. Giấy phép lái xe hạng D2E được phép lái các loại xe ô tô quy định cho giấy phép lái xe hạng D2 kéo rơ moóc có khối lượng toàn bộ theo thiết kế trên 750 kg.

2.  Hạng D2 cấp cho người lái xe ô tô chở người (kể cả xe buýt) trên 16 chỗ (không kể chỗ của người lái xe) đến 29 chỗ (không kể chỗ của người lái xe); các loại xe ô tô chở người quy định cho giấy phép lái xe hạng D2 kéo rơ moóc có khối lượng toàn bộ theo thiết kế đến 750 kg; các loại xe quy định cho giấy phép lái xe các hạng B, C1, C, D1.  Như vậy, hạng D2E bao gồm các loại xe quy định cho hạng D2 và thêm điều kiện về rơ moóc có khối lượng trên 750kg.


Tóm lại: Giấy phép lái xe hạng D2E cho phép lái xe ô tô chở từ 16 đến 29 người (không kể người lái),  và các loại xe quy định cho hạng B, C1, C, D1, cùng với rơ moóc có khối lượng toàn bộ thiết kế trên 750kg.
",Hạng D2E cho phép lái xe ô tô chở người trên 30 chỗ ngồi kéo rơ moóc có trọng tải trên 750 kg.,1.0,0.7386955027469332,1.0,0.0
9,Giấy phép lái xe hạng DE cho phép lái những loại xe nào?,"['1. đào tạo từ xa, tự học có hướng dẫn áp dụng đối với các môn học pháp luật về giao thông đường bộ, đạo đức, văn hóa giao thông và phòng chống tác hại của rượu, bia khi tham gia giao thông và học lý thuyết của các môn: cấu tạo và sửa chữa thông thường; kỹ năng phòng cháy, chữa cháy và cứu nạn, cứu hộ; kỹ thuật lái xe để cấp giấy phép lái xe hạng b, c1, c, d1, d2, d, be, c1e, ce, d1e, d2e và de. 2. người học phải đăng ký tại cơ sở được phép đào tạo để được quản lý theo quy định của bộ giao thông vận tải. mục 2. điều kiện kinh doanh của cơ sở đào tạo lái xe ô tô', '1. giấy phép lái xe được cấp trước ngày luật này có hiệu lực thi hành được tiếp tục sử dụng theo thời hạn ghi trên giấy phép lái xe. 2. giấy phép lái xe được cấp trước ngày luật này có hiệu lực thi hành nếu chưa thực hiện đổi, cấp lại theo quy định của luật này có hiệu lực sử dụng như sau: a) giấy phép lái xe hạng a1 được tiếp tục điều khiển xe mô tô hai bánh có dung tích xi-lanh từ 50 cm3\xa0đến dưới 175 cm3 hoặc có công suất động cơ điện từ 04 kw đến dưới 14 kw; b) giấy phép lái xe hạng a2 được tiếp tục điều khiển xe mô tô hai bánh có dung tích xi-lanh từ 175 cm3\xa0trở lên hoặc có công suất động cơ điện từ 14 kw trở lên và các loại xe quy định cho giấy phép lái xe hạng a1 quy định tại điểm a khoản này; c) giấy phép lái xe hạng a3 được tiếp tục điều khiển xe mô tô ba bánh, các loại xe quy định cho giấy phép lái xe hạng a1 quy định tại điểm a khoản này và các xe tương tự; d) giấy phép lái xe hạng a4 được tiếp tục điều khiển máy kéo có trọng tải đến 1.000 kg; đ) giấy phép lái xe hạng b1 số tự động cấp cho người không hành nghề lái xe được tiếp tục điều khiển xe ô tô số tự động chở người đến 08 chỗ (không kể chỗ của người lái xe); xe ô tô tải, kể cả ô tô tải chuyên dùng số tự động có trọng tải dưới 3.500 kg; e) giấy phép lái xe hạng b1 cấp cho người không hành nghề lái xe được tiếp tục điều khiển xe ô tô chở người đến 08 chỗ (không kể chỗ của người lái xe); xe ô tô tải, máy kéo có trọng tải dưới 3.500 kg; g) giấy phép lái xe hạng b2 cấp cho người hành nghề lái xe được tiếp tục điều khiển xe ô tô chở người đến 08 chỗ (không kể chỗ của người lái xe); xe ô tô tải, máy kéo có trọng tải dưới 3.500 kg; h) giấy phép lái xe hạng c được tiếp tục điều khiển xe ô tô tải, máy kéo có trọng tải từ 3.500 kg trở lên và các loại xe quy định cho các giấy phép lái xe hạng b1, b2 quy định tại các điểm đ, e và g khoản này; i) giấy phép lái xe hạng d được tiếp tục điều khiển xe ô tô chở người từ 09 chỗ (không kể chỗ của người lái xe) đến 29 chỗ (không kể chỗ của người lái xe) và các loại xe quy định cho các giấy phép lái xe hạng b1, b2, c quy định tại các điểm đ, e, g và h khoản này; k) giấy phép lái xe hạng e được tiếp tục điều khiển xe ô tô chở người trên 29 chỗ (không kể chỗ của người lái xe) và các loại xe quy định cho các giấy phép lái xe hạng b1, b2, c, d quy định tại các điểm đ, e, g, h và i khoản này; l) giấy phép lái xe hạng fb2, fd được tiếp tục điều khiển các loại xe quy định cho giấy phép lái xe hạng b2, d quy định tại điểm g và điểm i khoản này khi kéo rơ moóc; giấy phép lái xe hạng fc được tiếp tục điều khiển các loại xe quy định cho giấy phép lái xe hạng c quy định tại điểm h khoản này khi kéo rơ moóc, đầu kéo kéo sơ mi rơ moóc; giấy phép lái xe hạng fe được tiếp tục điều khiển các loại xe quy định cho giấy phép lái xe hạng e quy định tại điểm k khoản này khi kéo rơ moóc\xa0hoặc xe ô tô chở khách nối toa. 3. trường hợp người có giấy phép lái xe đã được cấp trước ngày luật này có hiệu lực thi hành có nhu cầu đổi, cấp lại giấy phép lái xe thì thực hiện như sau: a) giấy phép lái xe hạng a1 được đổi, cấp lại sang giấy phép lái xe hạng a với điều kiện hạn chế là chỉ được điều khiển xe mô tô hai bánh có dung tích xi-lanh đến dưới 175 cm3 hoặc có công suất động cơ điện đến dưới 14 kw; b) giấy phép lái xe hạng a2 được đổi, cấp lại sang giấy phép lái xe hạng a; c) giấy phép lái xe hạng a3 được đổi, cấp lại sang giấy phép lái xe hạng b1; d) giấy phép lái xe hạng a4 được đổi, cấp lại sang chứng chỉ điều khiển xe máy chuyên dùng cho người điều khiển máy kéo có trọng tải đến 1.000 kg và chứng chỉ bồi dưỡng kiến thức pháp luật về giao thông đường bộ cho người điều khiển xe máy chuyên dùng; đ) giấy phép lái xe hạng b1 số tự động được đổi, cấp lại sang giấy phép lái xe hạng b với điều kiện hạn chế là chỉ được điều khiển xe ô tô số tự động; e) giấy phép lái xe hạng b1, b2 được đổi, cấp lại sang giấy phép lái xe hạng b hoặc hạng c1 và chứng chỉ điều khiển xe máy chuyên dùng cho người điều khiển máy kéo có trọng tải đến 3.500 kg; g) giấy phép lái xe hạng c giữ nguyên và đổi, cấp lại cùng hạng và chứng chỉ điều khiển xe máy chuyên dùng cho người điều khiển máy kéo có trọng tải trên 3.500 kg; h) giấy phép lái xe hạng d được đổi, cấp lại sang giấy phép lái xe hạng d2 và chứng chỉ điều khiển xe máy chuyên dùng cho người điều khiển máy kéo có trọng tải trên 3.500 kg; i) giấy phép lái xe hạng e được đổi, cấp lại sang giấy phép lái xe hạng d và chứng chỉ điều khiển xe máy chuyên dùng cho người điều khiển máy kéo có trọng tải trên 3.500 kg; k) giấy phép lái xe hạng fb2 được đổi, cấp lại sang giấy phép lái xe hạng be hoặc hạng c1e và chứng chỉ điều khiển xe máy chuyên dùng cho người điều khiển máy kéo có trọng tải đến 3.500 kg; l) giấy phép lái xe hạng fc được đổi, cấp lại sang giấy phép lái xe hạng ce và chứng chỉ điều khiển xe máy chuyên dùng cho người điều khiển máy kéo có trọng tải trên 3.500 kg; m) giấy phép lái xe hạng fd được đổi, cấp lại sang giấy phép lái xe hạng d2e và chứng chỉ điều khiển xe máy chuyên dùng cho người điều khiển máy kéo có trọng tải trên 3.500 kg; n) giấy phép lái xe hạng fe được đổi, cấp lại sang giấy phép lái xe hạng de và chứng chỉ điều khiển xe máy chuyên dùng cho người điều khiển máy kéo có trọng tải trên 3.500 kg. 4. người học lái xe đã được đào tạo lái xe trước ngày luật này có hiệu lực thi hành hoặc đang được đào tạo lái xe tại ngày luật này có hiệu lực thi hành chưa được sát hạch, cấp giấy phép lái xe thì được sát hạch, cấp giấy phép lái xe theo hạng giấy phép lái xe đổi, cấp lại quy định tại khoản 3 điều này. 5. chứng nhận đăng ký xe, biển số xe máy chuyên dùng cấp trước ngày luật này có hiệu lực thi hành vẫn có giá trị sử dụng. 6. chứng nhận chất lượng an toàn kỹ thuật và bảo vệ môi trường được cấp trước ngày luật này có hiệu lực thi hành thì có giá trị sử dụng đến hết thời hạn ghi trên giấy chứng nhận đó. 7. việc đấu giá biển số xe ô tô được thực hiện trước ngày luật này có hiệu lực thi hành và đến ngày luật này có hiệu lực thi hành đã được cấp văn bản xác nhận biển số xe ô tô trúng đấu giá thì tiếp tục thực hiện theo nghị quyết số 73/2022/qh15 của quốc hội về thí điểm đấu giá biển số xe ô tô; trường hợp chưa được cấp xác nhận biển số xe ô tô trúng đấu giá thì tiếp tục thực hiện theo nghị quyết số 73/2022/qh15 của quốc hội về thí điểm đấu giá biển số xe ô tô và quy định tại điểm d khoản 1 điều 38 của luật này./. luật này được quốc hội nước cộng hòa xã hội chủ nghĩa việt nam khóa xv, kỳ họp thứ 7 thông qua ngày 27 tháng 6 năm 2024.', '1. giấy phép lái xe bao gồm các hạng sau đây: a) hạng a1 cấp cho người lái xe mô tô hai bánh có dung tích xi-lanh đến 125 cm3 hoặc có công suất động cơ điện đến 11 kw; b) hạng a cấp cho người lái xe mô tô hai bánh có dung tích xi-lanh\xa0 trên 125 cm3\xa0hoặc có công suất động cơ điện trên 11 kw và các loại xe quy định cho giấy phép lái xe hạng a1; c) hạng b1 cấp cho người lái xe mô tô ba bánh và các loại xe quy định cho giấy phép lái xe hạng a1; d) hạng b cấp cho người lái xe ô tô chở người đến 08 chỗ (không kể chỗ của người lái xe); xe ô tô tải và ô tô chuyên dùng có khối lượng toàn bộ theo thiết kế đến 3.500 kg; các loại xe ô tô quy định cho giấy phép lái xe hạng b kéo rơ moóc có khối lượng toàn bộ theo thiết kế đến 750 kg; đ) hạng c1 cấp cho người lái xe ô tô tải và ô tô chuyên dùng có khối lượng toàn bộ theo thiết kế trên 3.500 kg đến 7.500 kg; các loại xe ô tô tải quy định cho giấy phép lái xe hạng c1 kéo rơ moóc có khối lượng toàn bộ theo thiết kế đến 750 kg; các loại xe quy định cho giấy phép lái xe hạng b; e) hạng c cấp cho người lái xe ô tô tải và ô tô chuyên dùng có khối lượng toàn bộ theo thiết kế trên 7.500 kg; các loại xe ô tô tải quy định cho giấy phép lái xe hạng c kéo rơ moóc có khối lượng toàn bộ theo thiết kế đến 750 kg; các loại xe quy định cho giấy phép lái xe hạng b và hạng c1; g) hạng d1 cấp cho người lái xe ô tô chở người trên 08 chỗ (không kể chỗ của người lái xe) đến 16 chỗ (không kể chỗ của người lái xe); các loại xe ô tô chở người quy định cho giấy phép lái xe hạng d1 kéo rơ moóc có khối lượng toàn bộ theo thiết kế đến 750 kg; các loại xe quy định cho giấy phép lái xe các hạng b, c1, c; h) hạng d2 cấp cho người lái xe ô tô chở người (kể cả xe buýt) trên 16 chỗ (không kể chỗ của người lái xe) đến 29 chỗ (không kể chỗ của người lái xe); các loại xe ô tô chở người quy định cho giấy phép lái xe hạng d2 kéo rơ moóc có khối lượng toàn bộ theo thiết kế đến 750 kg; các loại xe quy định cho giấy phép lái xe các hạng b, c1, c, d1; i) hạng d cấp cho người lái xe ô tô chở người (kể cả xe buýt) trên 29 chỗ (không kể chỗ của người lái xe); xe ô tô chở người giường nằm; các loại xe ô tô chở người quy định cho giấy phép lái xe hạng d kéo rơ moóc có khối lượng toàn bộ theo thiết kế đến 750 kg; các loại xe quy định cho giấy phép lái xe các hạng b, c1, c, d1, d2; k) hạng be cấp cho người lái các loại xe ô tô quy định cho giấy phép lái xe hạng b kéo rơ moóc có khối lượng toàn bộ theo thiết kế trên 750 kg; l) hạng c1e cấp cho người lái các loại xe ô tô quy định cho giấy phép lái xe hạng c1 kéo rơ moóc có khối lượng toàn bộ theo thiết kế trên 750 kg; m) hạng ce cấp cho người lái các loại xe ô tô quy định cho giấy phép lái xe hạng c kéo rơ moóc có khối lượng toàn bộ theo thiết kế trên 750 kg; xe ô tô đầu kéo kéo sơ mi rơ moóc; n) hạng d1e cấp cho người lái các loại xe ô tô quy định cho giấy phép lái xe hạng d1 kéo rơ moóc có khối lượng toàn bộ theo thiết kế trên 750 kg; o) hạng d2e cấp cho người lái các loại xe ô tô quy định cho giấy phép lái xe hạng d2 kéo rơ moóc có khối lượng toàn bộ theo thiết kế trên 750 kg; p) hạng de cấp cho người lái các loại xe ô tô quy định cho giấy phép lái xe hạng d kéo rơ moóc có khối lượng toàn bộ theo thiết kế trên 750 kg; xe ô tô chở khách nối toa. 2. người khuyết tật điều khiển xe mô tô ba bánh dùng cho người khuyết tật được cấp giấy phép lái xe hạng a1. người khuyết tật điều khiển xe ô tô số tự động có kết cấu phù hợp với tình trạng khuyết tật thì được cấp giấy phép lái xe hạng b. 3. người điều khiển xe chở hàng bốn bánh có gắn động cơ, xe chở người bốn bánh có gắn động cơ phải sử dụng giấy phép lái xe có hạng phù hợp với xe ô tô tải hoặc xe ô tô chở người tương ứng. 4. người điều khiển xe ô tô có thiết kế, cải tạo với số chỗ ít hơn xe cùng loại, kích thước giới hạn tương đương phải sử dụng giấy phép lái xe có hạng phù hợp với xe ô tô cùng loại, kích thước giới hạn tương đương và có số chỗ nhiều nhất. 5. thời hạn của giấy phép lái xe được quy định như sau: a) giấy phép lái xe các hạng a1, a, b1 không thời hạn; b) giấy phép lái xe hạng b và hạng c1 có thời hạn 10 năm kể từ ngày cấp; c) giấy phép lái xe các hạng c, d1, d2, d, be, c1e, ce, d1e, d2e và de có thời hạn 05 năm kể từ ngày cấp. 6. giấy phép lái xe có giá trị sử dụng trong phạm vi lãnh thổ việt nam bao gồm: a) giấy phép lái xe do cơ quan có thẩm quyền của việt nam cấp; b) giấy phép lái xe quốc tế và giấy phép lái xe quốc gia phù hợp với loại xe được phép điều khiển do quốc gia là thành viên của công ước của liên hợp quốc về giao thông đường bộ năm 1968 (sau đây gọi là công ước viên) cấp; c) giấy phép lái xe phù hợp với loại xe được phép điều khiển của nước hoặc vùng lãnh thổ mà việt nam ký kết điều ước quốc tế hoặc thỏa thuận quốc tế công nhận giấy phép lái xe của nhau; d) giấy phép lái xe nước ngoài phù hợp với loại xe được phép điều khiển do quốc gia được công nhận theo điều ước quốc tế mà nước cộng hòa xã hội chủ nghĩa việt nam là thành viên. 7. giấy phép lái xe không có hiệu lực trong các trường hợp sau đây: a) giấy phép lái xe hết thời hạn sử dụng; b) giấy phép lái xe bị thu hồi theo quy định tại khoản 5 điều 62 của luật này. 8. giấy phép lái xe quốc tế được quy định như sau: a) giấy phép lái xe quốc tế là giấy phép lái xe do cơ quan nhà nước có thẩm quyền của quốc gia là thành viên của công ước viên cấp theo một mẫu thống nhất; có thời hạn không quá 03 năm kể từ ngày cấp và phải phù hợp với thời hạn còn hiệu lực của giấy phép lái xe quốc gia; b) người có giấy phép lái xe quốc tế do quốc gia là thành viên của công ước viên cấp khi lái xe tham gia giao thông đường bộ trên lãnh thổ việt nam phải mang theo giấy phép lái xe quốc tế và giấy phép lái xe quốc gia được cấp phù hợp với hạng xe điều khiển, còn thời hạn sử dụng; phải tuân thủ pháp luật về trật tự, an toàn giao thông đường bộ của việt nam; c) người có giấy phép lái xe quốc tế vi phạm pháp luật về trật tự, an toàn giao thông đường bộ của việt nam mà bị tước quyền sử dụng giấy phép lái xe có thời hạn thì thời gian bị tước quyền sử dụng không quá thời gian người lái xe được phép cư trú tại lãnh thổ việt nam; d) người việt nam hoặc người nước ngoài có thẻ thường trú hoặc thẻ tạm trú tại việt nam có giấy phép lái xe do việt nam hoặc quốc gia là thành viên của điều ước quốc tế mà nước cộng hòa xã hội chủ nghĩa việt nam là thành viên cấp, còn giá trị sử dụng, nếu có nhu cầu được cấp giấy phép lái xe quốc tế. 9. bộ trưởng bộ giao thông vận tải quy định mẫu giấy phép lái xe và giấy phép lái xe quốc tế, trình tự, thủ tục cấp và việc sử dụng giấy phép lái xe, giấy phép lái xe quốc tế; đối với mẫu giấy phép lái xe, trình tự, thủ tục cấp và việc sử dụng giấy phép lái xe của lực lượng quân đội, công an làm nhiệm vụ quốc phòng, an ninh do bộ trưởng bộ quốc phòng, bộ trưởng bộ công an quy định.', '1. giấy phép lái xe quân sự, được phân hạng theo quy định của luật trật tự, an toàn giao thông đường bộ, đồng thời phù hợp với đặc thù quân sự của phương tiện cơ giới đường bộ thuộc phạm vi quản lý của bộ quốc phòng. giấy phép lái xe quân sự, gồm: a) hạng a1 cấp cho người điều khiển xe mô tô hai bánh có dung tích xi-lanh đến 125 cm3 hoặc có công suất động cơ điện đến 11 kw; b) hạng a cấp cho người điều khiển xe mô tô hai bánh có dung tích xi-lanh trên 125 cm3 hoặc có công suất động cơ điện trên 11kw và các loại xe quy định cho giấy phép lái xe quân sự hạng a1; c) hạng b1 cấp cho người điều khiển xe mô tô ba bánh và các loại xe quy định cho giấy phép lái xe quân sự hạng a1; d) hạng b cấp cho người điều khiển các loại xe ô tô chở người đến 08 chỗ ngồi (không kể chỗ của người lái xe); xe ô tô tải và ô tô chuyên dùng có khối lượng toàn bộ theo thiết kế đến 3.500 kg; các loại xe ô tô quy định cho giấy phép lái xe hạng b có kéo rơ moóc hoặc vũ khí, khí tài quân sự dạng rơ moóc có khối lượng toàn bộ theo thiết kế đến 750 kg; đ) hạng c1 cấp cho người điều khiển các loại xe ô tô vận tải và ô tô chuyên dùng có khối lượng toàn bộ theo thiết kế trên 3.500 kg đến 7.500 kg; các loại xe ô tô quy định cho giấy phép lái xe hạng c1 kéo rơ moóc hoặc vũ khí, khí tài quân sự dạng rơ moóc có khối lượng toàn bộ theo thiết kế đến 750 kg; các loại xe quy định cho giấy phép lái xe quân sự hạng b; e) hạng c cấp cho người điều khiển các loại xe ô tô tải và ô tô chuyên dùng có khối lượng toàn bộ theo thiết kế trên 7.500 kg; các loại xe ô tô tải quy định cho giấy phép lái xe hạng c kéo rơ moóc hoặc vũ khí, khí tài quân sự dạng rơ moóc có khối lượng toàn bộ theo thiết kế đến 750 kg; các loại xe quy định cho giấy phép lái xe quân sự hạng b và hạng c1; g) hạng d1 cấp cho người điều khiển xe ô tô chở người trên 8 chỗ (không kể chỗ của người lái xe) đến 16 chỗ (không kể chỗ của người lái xe); các loại xe ô tô chở người quy định cho giấy phép lái xe hạng d1 kéo rơ moóc hoặc vũ khí, khí tài quân sự dạng rơ moóc có khối lượng toàn bộ theo thiết kế đến 750 kg; các loại xe quy định cho giấy phép lái xe quân sự hạng b, c1, c; h) hạng d2 cấp cho người điều khiển xe ô tô chở người từ trên 16 đến 29 chỗ (không kể chỗ của người lái xe); các loại xe ô tô chở người quy định cho giấy phép lái xe hạng d2 kéo rơ moóc hoặc vũ khí, khí tài quân sự dạng rơ moóc có khối lượng toàn bộ theo thiết kế đến 750 kg; các loại xe quy định cho giấy phép lái xe quân sự hạng b, c1, c, d1; i) hạng d cấp cho người điều khiển xe ô tô chở người từ trên 29 chỗ (không kể chỗ của người lái xe); các loại xe ô tô chở người quy định cho giấy phép lái xe hạng d kéo rơ moóc hoặc vũ khí, khí tài quân sự dạng rơ moóc có khối lượng toàn bộ theo thiết kế đến 750 kg; các loại xe quy định cho giấy phép lái xe quân sự hạng b, c1, c, d1, d2; k) hạng c1e cấp cho người điều khiển các loại xe ô tô quy định cho giấy phép lái xe hạng c1 kéo rơ moóc hoặc vũ khí, khí tài quân sự dạng rơ moóc có khối lượng toàn bộ theo thiết kế trên 750 kg; l) hạng ce cấp cho người điều khiển các loại xe ô tô quy định cho giấy phép lái xe hạng c kéo rơ moóc hoặc vũ khí, khí tài quân sự dạng rơ moóc có khối lượng toàn bộ theo thiết kế trên 750 kg; xe ô tô đầu kéo kéo sơ mi rơ moóc hoặc khí tài quân sự dạng sơ mi rơ moóc; m) hạng cx cấp cho người đã có giấy phép lái xe quân sự hạng c để điều khiển xe xích kéo vũ khí, khí tài quân sự. 2. người điều khiển xe chở hàng bốn bánh có gắn động cơ, xe chở người bốn bánh có gắn động cơ phải sử dụng giấy phép lái xe có hạng phù hợp với xe ô tô tải và ô tô chở người tương ứng. 3. người điều khiển xe ô tô có thiết kế, cải tạo với số chỗ ngồi ít hơn ô tô cùng loại, kích thước giới hạn tương đương phải sử dụng giấy phép lái xe có hạng phù hợp với ô tô cùng loại, kích thước giới hạn tương đương và có số chỗ ngồi nhiều nhất.', '1. giấy phép lái xe quân sự được cấp trước ngày thông tư này có hiệu lực thi hành được tiếp tục sử dụng theo thời hạn ghi trên giấy phép lái xe. 2. giấy phép lái xe quân sự được cấp trước ngày thông tư này có hiệu lực thi hành nếu chưa thực hiện đổi, cấp lại theo quy định của thông tư này có hiệu lực sử dụng như sau: a) giấy phép lái xe quân sự hạng a1 được tiếp tục điều khiển xe mô tô hai bánh có dung tích xi-lanh từ 50 cm3 đến dưới 175 cm3 hoặc có công suất động cơ điện từ 04 kw đến dưới 14 kw; b) giấy phép lái xe quân sự hạng a2 được tiếp tục điều khiển xe mô tô hai bánh có dung tích xi-lanh từ 175 cm3 trở lên hoặc có công suất động cơ điện từ 14 kw trở lên và các loại xe quy định cho giấy phép lái xe hạng a1 quy định tại điểm a khoản này; c) giấy phép lái xe quân sự hạng a3 được tiếp tục điều khiển xe mô tô ba bánh, các loại xe quy định cho giấy phép lái xe hạng a1 quy định tại điểm a khoản này và các xe tương tự; d) giấy phép lái xe quân sự hạng b2 được tiếp tục điều khiển xe ô tô chở người đến 08 chỗ (không kể chỗ của người lái xe); xe ô tô tải, máy kéo có trọng tải dưới 3.500 kg; các loại xe ô tô quy định cho giấy phép lái xe hạng b kéo theo một rơ moóc hoặc vũ khí, khí tài quân sự dạng rơ moóc có khối lượng toàn bộ theo thiết kế đến 750 kg; đ) giấy phép lái xe quân sự hạng c được tiếp tục điều khiển xe ô tô tải, máy kéo có trọng tải từ 3.500 kg trở lên và các loại xe quy định cho các giấy phép lái xe hạng b2 quy định tại điểm d khoản này; các loại xe ô tô quy định cho giấy phép lái xe hạng c kéo theo một rơ moóc hoặc vũ khí, khí tài quân sự dạng rơ moóc có khối lượng toàn bộ theo thiết kế đến 750 kg; e) giấy phép lái xe quân sự hạng d được tiếp tục điều khiển xe ô tô chở người từ 09 chỗ (không kể chỗ của người lái xe) đến 29 chỗ (không kể chỗ của người lái xe) và các loại xe quy định cho các giấy phép lái xe hạng b2, c quy định tại các điểm d, đ khoản này; các loại xe ô tô quy định cho giấy phép lái xe hạng d2 kéo theo một rơ moóc hoặc vũ khí, khí tài quân sự dạng rơ moóc có khối lượng toàn bộ theo thiết kế đến 750 kg; g) giấy phép lái xe quân sự hạng e được tiếp tục điều khiển xe ô tô chở người trên 29 chỗ (không kể chỗ của người lái xe) và các loại xe quy định cho các giấy phép lái xe hạng b2, c, d quy định tại các điểm d, đ và e khoản này; các loại ô tô quy định cho giấy phép lái xe hạng d kéo theo một rơ moóc hoặc vũ khí, khí tài quân sự dạng rơ moóc có khối lượng toàn bộ theo thiết kế đến 750 kg; h) giấy phép lái xe quân sự hạng fc được tiếp tục điều khiển các loại xe quy định cho giấy phép lái xe hạng c quy định tại điểm đ khoản này khi kéo rơ moóc, khí tài quân sự dạng rơ moóc và ô tô đầu kéo kéo sơ mi rơ moóc, khí tài quân sự dạng sơ mi rơ moóc; i) giấy phép lái xe quân sự hạng fx được tiếp tục điều khiển xe xích kéo vũ khí, khí tài quân sự và các loại xe quy định cho giấy phép lái xe hạng c quy định tại điểm đ khoản này. 3. trường hợp người có giấy phép, lái xe quân sự đã được cấp trước ngày thông tư này có hiệu lực thi hành khi đổi, cấp lại giấy phép lái xe thì thực hiện như sau: a) giấy phép lái xe quân sự hạng a1 được đổi, cấp lại sang giấy phép lái xe quân sự hạng a với điều kiện hạn chế là chỉ được điều khiển xe mô tô hai bánh có dung tích xi-lanh đến dưới 175 cm3 hoặc có công suất động cơ điện đến dưới 14 kw; b) giấy phép lái xe quân sự hạng a2 được đổi, cấp lại sang giấy phép lái xe quân sự hạng a; c) giấy phép lái xe quân sự hạng a3 được đổi, cấp lại sang giấy phép lái xe quân sự hạng b1; d) giấy phép lái xe quân sự hạng b2 được đổi, cấp lại sang giấy phép lái xe quân sự hạng b hoặc hạng c1; đ) giấy phép lái xe quân sự hạng c giữ nguyên và đổi, cấp lại cùng hạng; e) giấy phép lái xe quân sự hạng d được đổi, cấp lại sang giấy phép lái xe quân sự hạng d2; g) giấy phép lái xe quân sự hạng e được đổi, cấp lại sang giấy phép lái xe quân sự hạng d; h) giấy phép lái xe quân sự hạng fc được đổi, cấp lại sang giấy phép lái xe quân sự hạng ce; i) giấy phép lái xe quân sự hạng fx được đổi, cấp lại sang giấy phép lái xe quân sự hạng cx; 4. người học lái xe đã được đào tạo lái xe trước ngày thông tư này có hiệu lực thi hành hoặc đang được đào tạo lái xe tại ngày thông tư này có hiệu lực thi hành chưa được sát hạch thì được sát hạch, cấp giấy phép lái xe theo hạng giấy phép lái xe đổi, cấp lại quy định tại khoản 3 điều này.']","**Nguồn văn bản:** 36_2024_QH15_444251

**Tên văn bản:** Luật Trật tự, an toàn giao thông đường bộ

**Điều 57:** Giấy phép lái xe

**Nội dung:**

1. Giấy phép lái xe bao gồm các hạng sau đây:

    a) Hạng A1 cấp cho người lái xe mô tô hai bánh có dung tích xi-lanh đến 125 cm3 hoặc có công suất động cơ điện đến 11 kw.

    b) Hạng A cấp cho người lái xe mô tô hai bánh có dung tích xi-lanh trên 125 cm3 hoặc có công suất động cơ điện trên 11 kw và các loại xe quy định cho giấy phép lái xe hạng A1.

    c) Hạng B1 cấp cho người lái xe mô tô ba bánh và các loại xe quy định cho giấy phép lái xe hạng A1.

    d) Hạng B cấp cho người lái xe ô tô chở người đến 08 chỗ (không kể chỗ của người lái xe); xe ô tô tải và ô tô chuyên dùng có khối lượng toàn bộ theo thiết kế đến 3.500 kg; các loại xe ô tô quy định cho giấy phép lái xe hạng B kéo rơ moóc có khối lượng toàn bộ theo thiết kế đến 750 kg.

    đ) Hạng C1 cấp cho người lái xe ô tô tải và ô tô chuyên dùng có khối lượng toàn bộ theo thiết kế trên 3.500 kg đến 7.500 kg; các loại xe ô tô tải quy định cho giấy phép lái xe hạng C1 kéo rơ moóc có khối lượng toàn bộ theo thiết kế đến 750 kg; các loại xe quy định cho giấy phép lái xe hạng B.

    e) Hạng C cấp cho người lái xe ô tô tải và ô tô chuyên dùng có khối lượng toàn bộ theo thiết kế trên 7.500 kg; các loại xe ô tô tải quy định cho giấy phép lái xe hạng C kéo rơ moóc có khối lượng toàn bộ theo thiết kế đến 750 kg; các loại xe quy định cho giấy phép lái xe hạng B và hạng C1.

    g) Hạng D1 cấp cho người lái xe ô tô chở người trên 08 chỗ (không kể chỗ của người lái xe) đến 16 chỗ (không kể chỗ của người lái xe); các loại xe ô tô chở người quy định cho giấy phép lái xe hạng D1 kéo rơ moóc có khối lượng toàn bộ theo thiết kế đến 750 kg; các loại xe quy định cho giấy phép lái xe các hạng B, C1, C.

    h) Hạng D2 cấp cho người lái xe ô tô chở người (kể cả xe buýt) trên 16 chỗ (không kể chỗ của người lái xe) đến 29 chỗ (không kể chỗ của người lái xe); các loại xe ô tô chở người quy định cho giấy phép lái xe hạng D2 kéo rơ moóc có khối lượng toàn bộ theo thiết kế đến 750 kg; các loại xe quy định cho giấy phép lái xe các hạng B, C1, C, D1.

    i) Hạng D cấp cho người lái xe ô tô chở người (kể cả xe buýt) trên 29 chỗ (không kể chỗ của người lái xe); xe ô tô chở người giường nằm; các loại xe ô tô chở người quy định cho giấy phép lái xe hạng D kéo rơ moóc có khối lượng toàn bộ theo thiết kế đến 750 kg; các loại xe quy định cho giấy phép lái xe các hạng B, C1, C, D1, D2.

    k) Hạng BE cấp cho người lái các loại xe ô tô quy định cho giấy phép lái xe hạng B kéo rơ moóc có khối lượng toàn bộ theo thiết kế trên 750 kg.

    l) Hạng C1E cấp cho người lái các loại xe ô tô quy định cho giấy phép lái xe hạng C1 kéo rơ moóc có khối lượng toàn bộ theo thiết kế trên 750 kg.

    m) Hạng CE cấp cho người lái các loại xe ô tô quy định cho giấy phép lái xe hạng C kéo rơ moóc có khối lượng toàn bộ theo thiết kế trên 750 kg; xe ô tô đầu kéo kéo sơ mi rơ moóc.

    n) Hạng D1E cấp cho người lái các loại xe ô tô quy định cho giấy phép lái xe hạng D1 kéo rơ moóc có khối lượng toàn bộ theo thiết kế trên 750 kg.

    o) Hạng D2E cấp cho người lái các loại xe ô tô quy định cho giấy phép lái xe hạng D2 kéo rơ moóc có khối lượng toàn bộ theo thiết kế trên 750 kg.

    p) Hạng DE cấp cho người lái các loại xe ô tô quy định cho giấy phép lái xe hạng D kéo rơ moóc có khối lượng toàn bộ theo thiết kế trên 750 kg; xe ô tô chở khách nối toa.


2. ... (Các khoản tiếp theo của điều 57 không liên quan trực tiếp đến câu hỏi)


Tóm lại: Giấy phép lái xe hạng DE cho phép lái các loại xe ô tô quy định cho giấy phép lái xe hạng D kéo rơ moóc có khối lượng toàn bộ thiết kế trên 750kg và xe ô tô chở khách nối toa.
",Hạng DE cho phép lái xe ô tô chở người trên 30 chỗ ngồi kéo rơ moóc có trọng tải trên 750 kg.,1.0,0.7344749206153619,1.0,0.3333333333
10,Luật Giao thông Đường bộ 2025 quy định như thế nào về điểm giấy phép lái xe?,"['1. phạt tiền từ 400.000 đồng đến 600.000 đồng đối với người điều khiển xe thực hiện một trong các hành vi vi phạm sau đây: a) không chấp hành hiệu lệnh, chỉ dẫn của biển báo hiệu, vạch kẻ đường, trừ các hành vi vi phạm quy định tại điểm a, điểm c, điểm d, điểm đ khoản 2; điểm a, điểm d, điểm đ, điểm e, điểm n, điểm o khoản 3; điểm a, điểm b, điểm đ, điểm e, điểm i, điểm k, điểm l khoản 4; điểm a, điểm b, điểm c, điểm d, điểm đ, điểm i, điểm k khoản 5; điểm a khoản 6; khoản 7; điểm b, điểm d khoản 9; điểm a khoản 10; điểm đ khoản 11 điều này; b) khi ra, vào vị trí dừng xe, đỗ xe không có tín hiệu báo cho người điều khiển phương tiện khác biết; c) không báo hiệu bằng đèn khẩn cấp hoặc không đặt biển cảnh báo “chú ý xe đỗ” theo quy định trong trường hợp gặp sự cố kỹ thuật (hoặc bất khả kháng khác) buộc phải đỗ xe chiếm một phần đường xe chạy hoặc tại nơi không được phép đỗ xe, trừ hành vi vi phạm quy định tại điểm c khoản 7 điều này; d) không gắn biển báo hiệu ở phía trước xe kéo, phía sau xe được kéo; điều khiển xe kéo rơ moóc không có biển báo hiệu theo quy định; đ) sử dụng còi trong thời gian từ 22 giờ ngày hôm trước đến 05 giờ ngày hôm sau trong khu đông dân cư, khu vực cơ sở khám bệnh, chữa bệnh, trừ các xe ưu tiên đang đi làm nhiệm vụ theo quy định. 2. phạt tiền từ 600.000 đồng đến 800.000 đồng đối với người điều khiển xe thực hiện một trong các hành vi vi phạm sau đây: a) chuyển làn đường không đúng nơi cho phép hoặc không có tín hiệu báo trước hoặc chuyển làn đường không đúng quy định “mỗi lần chuyển làn đường chỉ được phép chuyển sang một làn đường liền kề”, trừ các hành vi vi phạm quy định tại điểm g khoản 5 điều này; b) chở người trên buồng lái quá số lượng quy định; c) không tuân thủ các quy định về nhường đường tại nơi đường bộ giao nhau, trừ các hành vi vi phạm quy định tại điểm n, điểm o khoản 5 điều này; d) dừng xe, đỗ xe trên phần đường xe chạy ở đoạn đường ngoài đô thị nơi có lề đường rộng; dừng xe, đỗ xe không sát mép đường phía bên phải theo chiều đi ở nơi đường có lề đường hẹp hoặc không có lề đường; dừng xe, đỗ xe ngược với chiều lưu thông của làn đường; dừng xe, đỗ xe trên dải phân cách cố định ở giữa hai phần đường xe chạy; đỗ xe trên dốc không chèn bánh; đ) dừng xe không sát theo lề đường, vỉa hè phía bên phải theo chiều đi hoặc bánh xe gần nhất cách lề đường, vỉa hè quá 0,25 mét; dừng xe trên đường dành riêng cho xe buýt; dừng xe trên miệng cống thoát nước, miệng hầm của đường điện thoại, điện cao thế, chỗ dành riêng cho xe chữa cháy lấy nước; rời vị trí lái, tắt máy khi dừng xe (trừ trường hợp rời khỏi vị trí lái để đóng, mở cửa xe, xếp dỡ hàng hóa, kiểm tra kỹ thuật xe) hoặc rời vị trí lái khi dừng xe nhưng không sử dụng phanh đỗ xe (hoặc thực hiện biện pháp an toàn khác); dừng xe, đỗ xe không đúng vị trí quy định ở những đoạn có bố trí nơi dừng xe, đỗ xe; dừng xe, đỗ xe trên phần đường dành cho người đi bộ qua đường; dừng xe nơi có biển “cấm dừng xe và đỗ xe”, trừ hành vi vi phạm quy định tại điểm đ khoản 4, điểm c khoản 7 điều này. 3. phạt tiền từ 800.000 đồng đến 1.000.000 đồng đối với người điều khiển xe thực hiện một trong các hành vi vi phạm sau đây: a) điều khiển xe chạy quá tốc độ quy định từ 05 km/h đến dưới 10 km/h; b) sử dụng còi, rú ga liên tục; sử dụng còi hơi, sử dụng đèn chiếu xa khi gặp người đi bộ qua đường hoặc khi đi trên đoạn đường qua khu dân cư có hệ thống chiếu sáng đang hoạt động hoặc khi gặp xe đi ngược chiều (trừ trường hợp dải phân cách có khả năng chống chói) hoặc khi chuyển hướng xe tại nơi đường giao nhau, trừ các xe ưu tiên đang đi làm nhiệm vụ theo quy định; c) chuyển hướng không quan sát hoặc không bảo đảm khoảng cách an toàn với xe phía sau hoặc không giảm tốc độ hoặc không có tín hiệu báo hướng rẽ hoặc có tín hiệu báo hướng rẽ nhưng không sử dụng liên tục trong quá trình chuyển hướng (trừ trường hợp điều khiển xe đi theo hướng cong của đoạn đường bộ ở nơi đường không giao nhau cùng mức); d) không tuân thủ các quy định về dừng xe, đỗ xe tại nơi đường bộ giao nhau cùng mức với đường sắt; dừng xe, đỗ xe trong phạm vi bảo vệ công trình đường sắt, phạm vi an toàn của đường sắt; đ) dừng xe, đỗ xe tại vị trí: nơi đường bộ giao nhau hoặc trong phạm vi 05 mét tính từ mép đường giao nhau; điểm đón, trả khách; trước cổng hoặc trong phạm vi 05 mét hai bên cổng trụ sở cơ quan, tổ chức có bố trí đường cho xe ra, vào; nơi phần đường có bề rộng chỉ đủ cho một làn xe cơ giới; che khuất biển báo hiệu đường bộ, đèn tín hiệu giao thông; nơi mở dải phân cách giữa; cách xe ô tô đang đỗ ngược chiều dưới 20 mét trên đường phố hẹp, dưới 40 mét trên đường có một làn xe cơ giới trên một chiều đường; e) đỗ xe không sát theo lề đường, vỉa hè phía bên phải theo chiều đi hoặc bánh xe gần nhất cách lề đường, vỉa hè quá 0,25 mét; đỗ xe trên đường dành riêng cho xe buýt; đỗ xe trên miệng cống thoát nước, miệng hầm của đường điện thoại, điện cao thế, chỗ dành riêng cho xe chữa cháy lấy nước; đỗ, để xe ở vỉa hè trái quy định của pháp luật; đỗ xe nơi có biển “cấm đỗ xe” hoặc biển “cấm dừng xe và đỗ xe”, trừ hành vi vi phạm quy định tại điểm đ khoản 4, điểm c khoản 7 điều này; g) không sử dụng hoặc sử dụng không đủ đèn chiếu sáng trong thời gian từ 18 giờ ngày hôm trước đến 06 giờ ngày hôm sau hoặc khi có sương mù, khói, bụi, trời mưa, thời tiết xấu làm hạn chế tầm nhìn; h) điều khiển xe ô tô kéo theo xe khác, vật khác (trừ trường hợp kéo theo một rơ moóc, sơ mi rơ moóc hoặc một xe ô tô, xe máy chuyên dùng khác khi xe này không tự chạy được); điều khiển xe ô tô đẩy xe khác, vật khác; điều khiển xe kéo rơ moóc, sơ mi rơ moóc kéo thêm rơ moóc hoặc xe khác, vật khác; không nối chắc chắn, an toàn giữa xe kéo và xe được kéo khi kéo nhau; i) chở người trên xe được kéo, trừ người điều khiển; k) không thắt dây đai an toàn khi điều khiển xe chạy trên đường; l) chở người trên xe ô tô không thắt dây đai an toàn (tại vị trí có trang bị dây đai an toàn) khi xe đang chạy; m) chở trẻ em dưới 10 tuổi và chiều cao dưới 1,35 mét trên xe ô tô ngồi cùng hàng ghế với người lái xe (trừ loại xe ô tô chỉ có một hàng ghế) hoặc không sử dụng thiết bị an toàn phù hợp cho trẻ em theo quy định; n) chạy trong hầm đường bộ không sử dụng đèn chiếu sáng gần; o) điều khiển xe chạy dưới tốc độ tối thiểu trên đoạn đường bộ có quy định tốc độ tối thiểu cho phép; p) điều khiển xe chạy tốc độ thấp hơn các xe khác đi cùng chiều mà không đi về làn đường bên phải chiều đi của mình, trừ trường hợp các xe khác đi cùng chiều chạy quá tốc độ quy định. 4. phạt tiền từ 2.000.000 đồng đến 3.000.000 đồng đối với người điều khiển xe thực hiện một trong các hành vi vi phạm sau đây: a) điều khiển xe không đủ điều kiện đã thu phí theo hình thức điện tử tự động không dừng (xe không gắn thẻ đầu cuối) đi vào làn đường dành riêng thu phí theo hình thức điện tử tự động không dừng tại các trạm thu phí; b) dừng xe, đỗ xe tại vị trí: bên trái đường một chiều hoặc bên trái (theo hướng lưu thông) của đường đôi; trên đoạn đường cong hoặc gần đầu dốc nơi tầm nhìn bị che khuất; trên cầu (trừ trường hợp tổ chức giao thông cho phép), gầm cầu vượt (trừ những nơi cho phép dừng xe, đỗ xe), song song với một xe khác đang dừng, đỗ, trừ hành vi vi phạm quy định tại điểm c khoản 7 điều này; c) không thực hiện biện pháp bảo đảm an toàn theo quy định khi xe ô tô bị hư hỏng ngay tại nơi đường bộ giao nhau cùng mức với đường sắt; d) không nhường đường cho xe xin vượt khi có đủ điều kiện an toàn; đ) lùi xe, quay đầu xe trong hầm đường bộ; dừng xe, đỗ xe trong hầm đường bộ không đúng nơi quy định; không có báo hiệu bằng đèn khẩn cấp, không đặt biển cảnh báo ""chú ý xe đỗ"" (hoặc đèn cảnh báo) về phía sau xe khoảng cách đảm bảo an toàn khi dừng xe, đỗ xe trong hầm đường bộ trong trường hợp gặp sự cố kỹ thuật hoặc bất khả kháng khác buộc phải dừng xe, đỗ xe; e) lùi xe ở đường một chiều, đường có biển “cấm đi ngược chiều”, khu vực cấm dừng, trên phần đường dành cho người đi bộ qua đường, nơi đường bộ giao nhau, nơi đường bộ giao nhau cùng mức với đường sắt, nơi tầm nhìn bị che khuất; lùi xe không quan sát hai bên, phía sau xe hoặc không có tín hiệu lùi xe, trừ hành vi vi phạm quy định tại điểm đ khoản 11 điều này; g) điều khiển xe có liên quan trực tiếp đến vụ tai nạn giao thông mà không dừng ngay phương tiện, không giữ nguyên hiện trường, không trợ giúp người bị nạn, trừ hành vi vi phạm quy định tại khoản 8 điều này; h) xe được quyền ưu tiên lắp đặt, sử dụng thiết bị phát tín hiệu ưu tiên không đúng quy định hoặc sử dụng thiết bị phát tín hiệu ưu tiên mà không có giấy phép của cơ quan có thẩm quyền cấp hoặc có giấy phép của cơ quan có thẩm quyền cấp nhưng không còn giá trị sử dụng theo quy định; i) quay đầu xe ở phần đường dành cho người đi bộ qua đường, trên cầu, đầu cầu, gầm cầu vượt, ngầm, tại nơi đường bộ giao nhau cùng mức với đường sắt, đường hẹp, đường dốc, đoạn đường cong tầm nhìn bị che khuất, trên đường một chiều, trừ khi có hiệu lệnh của người điều khiển giao thông hoặc chỉ dẫn của biển báo hiệu tạm thời hoặc tổ chức giao thông tại những khu vực này có bố trí nơi quay đầu xe; k) quay đầu xe tại nơi có biển báo hiệu có nội dung cấm quay đầu đối với loại phương tiện đang điều khiển; điều khiển xe rẽ trái tại nơi có biển báo hiệu có nội dung cấm rẽ trái đối với loại phương tiện đang điều khiển; điều khiển xe rẽ phải tại nơi có biển báo hiệu có nội dung cấm rẽ phải đối với loại phương tiện đang điều khiển; l) không giữ khoảng cách an toàn để xảy ra va chạm với xe chạy liền trước hoặc không giữ khoảng cách theo quy định của biển báo hiệu “cự ly tối thiểu giữa hai xe”, trừ các hành vi vi phạm quy định tại điểm d khoản 5 điều này. 5. phạt tiền từ 4.000.000 đồng đến 6.000.000 đồng đối với người điều khiển xe thực hiện một trong các hành vi vi phạm sau đây: a) vượt xe trong những trường hợp không được vượt, vượt xe tại đoạn đường có biển báo hiệu có nội dung cấm vượt (đối với loại phương tiện đang điều khiển); không có tín hiệu trước khi vượt hoặc có tín hiệu vượt xe nhưng không sử dụng trong suốt quá trình vượt xe; vượt bên phải xe khác trong trường hợp không được phép; b) điều khiển xe không đi bên phải theo chiều đi của mình; đi không đúng phần đường hoặc làn đường quy định (làn cùng chiều hoặc làn ngược chiều) trừ hành vi quy định tại điểm a khoản 4 điều này; điều khiển xe đi qua dải phân cách cố định ở giữa hai phần đường xe chạy; c) tránh xe đi ngược chiều không đúng quy định (trừ hành vi vi phạm sử dụng đèn chiếu xa khi tránh xe đi ngược chiều quy định tại điểm b khoản 3 điều này); không nhường đường cho xe đi ngược chiều theo quy định tại nơi đường hẹp, đường dốc, nơi có chướng ngại vật; d) không tuân thủ quy định khi vào hoặc ra đường cao tốc; điều khiển xe chạy ở làn dừng xe khẩn cấp hoặc phần lề đường của đường cao tốc; không tuân thủ quy định về khoảng cách an toàn đối với xe chạy liền trước khi chạy trên đường cao tốc; đ) điều khiển xe chạy quá tốc độ quy định từ 10 km/h đến 20 km/h; e) xe không được quyền ưu tiên lắp đặt, sử dụng thiết bị phát tín hiệu của xe được quyền ưu tiên; g) chuyển làn đường không đúng nơi cho phép hoặc không có tín hiệu báo trước hoặc chuyển làn đường không đúng quy định “mỗi lần chuyển làn đường chỉ được phép chuyển sang một làn đường liền kề” khi chạy trên đường cao tốc; h) dùng tay cầm và sử dụng điện thoại hoặc các thiết bị điện tử khác khi điều khiển phương tiện tham gia giao thông đang di chuyển trên đường bộ; i) đi vào khu vực cấm, đường có biển báo hiệu có nội dung cấm đi vào đối với loại phương tiện đang điều khiển, trừ các hành vi vi phạm quy định tại điểm d khoản 9, điểm đ khoản 11 điều này, hành vi bị cấm đi vào công trình thủy lợi và các trường hợp xe ưu tiên đang đi làm nhiệm vụ khẩn cấp theo quy định; k) dừng xe, đỗ xe, quay đầu xe trái quy định gây ùn tắc giao thông; l) chuyển hướng không nhường quyền đi trước cho: người đi bộ, xe lăn của người khuyết tật qua đường tại nơi có vạch kẻ đường dành cho người đi bộ; xe thô sơ đang đi trên phần đường dành cho xe thô sơ; m) chuyển hướng không nhường đường cho: các xe đi ngược chiều; người đi bộ, xe thô sơ đang qua đường tại nơi không có vạch kẻ đường cho người đi bộ; n) không giảm tốc độ (hoặc dừng lại) và nhường đường khi điều khiển xe đi từ đường không ưu tiên ra đường ưu tiên, từ đường nhánh ra đường chính; o) không giảm tốc độ và nhường đường cho xe đi đến từ bên phải tại nơi đường giao nhau không có báo hiệu đi theo vòng xuyến; không giảm tốc độ và nhường đường cho xe đi đến từ bên trái tại nơi đường giao nhau có báo hiệu đi theo vòng xuyến; p) chở người trên thùng xe trái quy định; chở người trên nóc xe; để người đu bám ở cửa xe, bên ngoài thành xe khi xe đang chạy; q) mở cửa xe, để cửa xe mở không bảo đảm an toàn. 6. phạt tiền từ 6.000.000 đồng đến 8.000.000 đồng đối với người điều khiển xe thực hiện một trong các hành vi vi phạm sau đây: a) điều khiển xe chạy quá tốc độ quy định trên 20 km/h đến 35 km/h; b) không nhường đường hoặc gây cản trở xe được quyền ưu tiên đang phát tín hiệu ưu tiên đi làm nhiệm vụ; c) điều khiển xe trên đường mà trong máu hoặc hơi thở có nồng độ cồn nhưng chưa vượt quá 50 miligam/100 mililít máu hoặc chưa vượt quá 0,25 miligam/1 lít khí thở; d) điều khiển xe đi trên vỉa hè, trừ trường hợp điều khiển xe đi qua vỉa hè để vào nhà, cơ quan. 7. phạt tiền từ 12.000.000 đồng đến 14.000.000 đồng đối với người điều khiển xe thực hiện một trong các hành vi vi phạm sau đây: a) điều khiển xe chạy quá tốc độ quy định trên 35 km/h; b) điều khiển xe chở người bốn bánh có gắn động cơ, xe chở hàng bốn bánh có gắn động cơ đi vào đường cao tốc; c) dừng xe, đỗ xe trên đường cao tốc không đúng nơi quy định; không có báo hiệu bằng đèn khẩn cấp khi gặp sự cố kỹ thuật hoặc bất khả kháng khác buộc phải dừng xe, đỗ xe ở làn dừng xe khẩn cấp trên đường cao tốc; không có báo hiệu bằng đèn khẩn cấp, không đặt biển cảnh báo “chú ý xe đỗ” (hoặc đèn cảnh báo) về phía sau xe khoảng cách tối thiểu 150 mét khi dừng xe, đỗ xe trong trường hợp gặp sự cố kỹ thuật hoặc bất khả kháng khác buộc phải dừng xe, đỗ xe trên một phần làn đường xe chạy trên đường cao tốc. 8. phạt tiền từ 16.000.000 đồng đến 18.000.000 đồng đối với người điều khiển xe thực hiện hành vi vi phạm gây tai nạn giao thông không dừng ngay phương tiện, không giữ nguyên hiện trường, không trợ giúp người bị nạn, không ở lại hiện trường hoặc không đến trình báo ngay với cơ quan công an, ủy ban nhân dân nơi gần nhất. 9. phạt tiền từ 18.000.000 đồng đến 20.000.000 đồng đối với người điều khiển xe thực hiện một trong các hành vi vi phạm sau đây: a) điều khiển xe trên đường mà trong máu hoặc hơi thở có nồng độ cồn vượt quá 50 miligam đến 80 miligam/100 mililít máu hoặc vượt quá 0,25 miligam đến 0,4 miligam/1 lít khí thở; b) không chấp hành hiệu lệnh của đèn tín hiệu giao thông; c) không chấp hành hiệu lệnh, hướng dẫn của người điều khiển giao thông hoặc người kiểm soát giao thông; d) đi ngược chiều của đường một chiều, đi ngược chiều trên đường có biển ""cấm đi ngược chiều”, trừ các hành vi vi phạm quy định tại điểm đ khoản 11 điều này và các trường hợp xe ưu tiên đang đi làm nhiệm vụ khẩn cấp theo quy định. 10. phạt tiền từ 20.000.000 đồng đến 22.000.000 đồng đối với người điều khiển xe thực hiện một trong các hành vi vi phạm sau đây: a) điều khiển xe không quan sát, giảm tốc độ hoặc dừng lại để bảo đảm an toàn theo quy định mà gây tai nạn giao thông; điều khiển xe chạy quá tốc độ quy định gây tai nạn giao thông; dừng xe, đỗ xe, quay đầu xe, lùi xe, tránh xe, vượt xe, chuyển hướng, chuyển làn đường không đúng quy định gây tai nạn giao thông; không đi đúng phần đường, làn đường, không giữ khoảng cách an toàn giữa hai xe theo quy định gây tai nạn giao thông hoặc đi vào đường có biển báo hiệu có nội dung cấm đi vào đối với loại phương tiện đang điều khiển gây tai nạn giao thông, trừ các hành vi vi phạm quy định tại điểm đ khoản 11 điều này; b) vi phạm quy định tại một trong các điểm, khoản sau của điều này mà gây tai nạn giao thông: điểm a, điểm b, điểm c, điểm d, điểm đ khoản 1; điểm c khoản 2; điểm b, điểm g, điểm h, điểm n, điểm o, điểm p, khoản 3; điểm a, điểm c, điểm d khoản 4; điểm c, điểm d, điểm e, điểm h, điểm n, điểm o, điểm q khoản 5; điểm b khoản 7; điểm b, điểm c, điểm d khoản 9 điều này. 11. phạt tiền từ 30.000.000 đồng đến 40.000.000 đồng đối với người điều khiển xe thực hiện một trong các hành vi vi phạm sau đây: a) điều khiển xe trên đường mà trong máu hoặc hơi thở có nồng độ cồn vượt quá 80 miligam/100 mililít máu hoặc vượt quá 0,4 miligam/1 lít khí thở; b) không chấp hành yêu cầu kiểm tra về nồng độ cồn của người thi hành công vụ; c) điều khiển xe trên đường mà trong cơ thể có chất ma túy hoặc chất kích thích khác mà pháp luật cấm sử dụng; d) không chấp hành yêu cầu kiểm tra về chất ma túy hoặc chất kích thích khác mà pháp luật cấm sử dụng của người thi hành công vụ; đ) điều khiển xe đi ngược chiều trên đường cao tốc, lùi xe trên đường cao tốc, quay đầu xe trên đường cao tốc, trừ các xe ưu tiên đang đi làm nhiệm vụ khẩn cấp theo quy định. 12. phạt tiền từ 40.000.000 đồng đến 50.000.000 đồng đối với người điều khiển xe thực hiện hành vi điều khiển xe lạng lách, đánh võng trên đường bộ; chạy quá tốc độ đuổi nhau trên đường bộ; dùng chân điều khiển vô lăng xe khi xe đang chạy trên đường bộ. 13. phạt tiền từ 50.000.000 đồng đến 70.000.000 đồng đối với người điều khiển xe thực hiện hành vi vi phạm quy định tại khoản 12 điều này mà gây tai nạn giao thông. 14. tịch thu phương tiện đối với người điều khiển xe tái phạm hành vi điều khiển xe lạng lách, đánh võng quy định tại khoản 12 điều này. 15. ngoài việc bị phạt tiền, người điều khiển xe thực hiện hành vi vi phạm còn bị áp dụng các hình thức xử phạt bổ sung sau đây: a) thực hiện hành vi quy định tại điểm e khoản 5 điều này còn bị tịch thu thiết bị phát tín hiệu ưu tiên lắp đặt, sử dụng trái quy định; b) thực hiện hành vi quy định tại khoản 12 điều này bị tước quyền sử dụng giấy phép lái xe từ 10 tháng đến 12 tháng; c) thực hiện hành vi quy định tại điểm a, điểm b, điểm c, điểm d khoản 11; khoản 13; khoản 14 điều này bị tước quyền sử dụng giấy phép lái xe từ 22 tháng đến 24 tháng. 16. ngoài việc bị áp dụng hình thức xử phạt, người điều khiển xe thực hiện hành vi vi phạm còn bị trừ điểm giấy phép lái xe như sau: a) thực hiện hành vi quy định tại điểm h, điểm i khoản 3; điểm a, điểm b, điểm c, điểm d, điểm đ, điểm g khoản 4; điểm a, điểm b, điểm c, điểm d, điểm đ, điểm e, điểm g, điểm i, điểm k, điểm n, điểm o khoản 5 điều này bị trừ điểm giấy phép lái xe 02 điểm; b) thực hiện hành vi quy định tại điểm h khoản 5; khoản 6; điểm b khoản 7; điểm b, điểm c, điểm d khoản 9 điều này bị trừ điểm giấy phép lái xe 04 điểm; c) thực hiện hành vi quy định tại điểm p khoản 5; điểm a, điểm c khoản 7; khoản 8 điều này bị trừ điểm giấy phép lái xe 06 điểm; d) thực hiện hành vi quy định tại điểm a khoản 9, khoản 10, điểm đ khoản 11 điều này bị trừ điểm giấy phép lái xe 10 điểm.', '1. phạt tiền từ 100.000 đồng đến 200.000 đồng đối với hành vi vi phạm: không hướng dẫn hành khách đứng, nằm, ngồi đúng vị trí quy định trong xe. 2. phạt tiền từ 400.000 đồng đến 600.000 đồng trên mỗi người vượt quá quy định được phép chở của phương tiện nhưng tổng mức phạt tiền tối đa không vượt quá 75.000.000 đồng đối với người điều khiển xe ô tô chở hành khách, ô tô chở người (trừ xe buýt) thực hiện hành vi vi phạm chở quá số người quy định được phép chở của phương tiện, trừ các hành vi vi phạm quy định tại khoản 4 điều này. 3. phạt tiền từ 600.000 đồng đến 800.000 đồng đối với một trong các hành vi vi phạm sau đây: a) không đóng cửa lên xuống khi xe đang chạy; b) để người ngồi trên xe khi xe xuống phà, đang trên phà và khi lên bến (trừ người lái xe, trẻ em, phụ nữ mang thai, người già yếu, người bệnh, người khuyết tật); c) không chạy đúng tuyến đường, lịch trình, hành trình vận tải được phép hoạt động theo quy định; d) để người mắc võng nằm trên xe khi xe đang chạy; đ) sắp xếp, chằng buộc hành lý, hàng hóa không bảo đảm an toàn; để rơi hành lý, hàng hóa trên xe xuống đường; để hàng hóa trong khoang chở hành khách; e) chở hành lý, hàng hóa vượt quá kích thước bao ngoài của xe; g) điều khiển xe vận tải hành khách không có nhân viên phục vụ trên xe đối với những xe quy định phải có nhân viên phục vụ; h) điều khiển xe ô tô kinh doanh vận tải không có dây đai an toàn tại các vị trí ghế ngồi, giường nằm theo quy định (trừ xe buýt nội tỉnh); i) điều khiển xe ô tô kinh doanh vận tải không có hướng dẫn cho hành khách về an toàn giao thông và thoát hiểm khi xảy ra sự cố trên xe theo quy định; k) điều khiển xe không niêm yết hành trình chạy xe hoặc niêm yết hành trình chạy xe không đúng với hành trình đã được cơ quan có thẩm quyền cấp phép. 4. phạt tiền từ 1.000.000 đồng đến 2.000.000 đồng trên mỗi người vượt quá quy định được phép chở của phương tiện nhưng tổng mức phạt tiền tối đa không vượt quá 75.000.000 đồng đối với người điều khiển xe ô tô chở hành khách (kinh doanh vận tải hành khách theo tuyến cố định, hợp đồng) chạy tuyến có cự ly lớn hơn 300 km thực hiện hành vi vi phạm chở quá số người quy định được phép chở của phương tiện. 5. phạt tiền từ 1.000.000 đồng đến 2.000.000 đồng đối với một trong các hành vi vi phạm sau đây: a) để người lên, xuống xe khi xe đang chạy; b) xếp hành lý, hàng hóa trên xe làm lệch xe; c) đón, trả hành khách không đúng nơi quy định trên những tuyến đường đã xác định nơi đón, trả khách hoặc dừng đón, trả hành khách quá thời gian quy định, trừ hành vi vi phạm quy định tại khoản 8 điều này; d) đón, trả hành khách tại nơi cấm dừng, cấm đỗ, nơi đường cong tầm nhìn bị che khuất, trừ hành vi vi phạm quy định tại khoản 8 điều này; đ) điều khiển xe vận tải hành khách theo hợp đồng sử dụng hợp đồng bằng văn bản giấy không có hoặc không mang theo danh sách hành khách theo quy định, chở người không có tên trong danh sách hành khách hoặc vận chuyển không đúng đối tượng theo quy định (đối với xe kinh doanh vận tải hành khách theo hợp đồng vận chuyển trẻ em mầm non, học sinh, sinh viên, cán bộ, công chức, viên chức, công nhân), không có hoặc không mang theo hợp đồng vận tải hoặc có hợp đồng vận tải nhưng không đúng theo quy định; e) vận chuyển hành khách theo tuyến cố định không có hoặc không mang theo lệnh vận chuyển hoặc có mang theo lệnh vận chuyển nhưng không ghi đầy đủ thông tin, không có xác nhận của bến xe khách nơi đi, bến xe khách nơi đến theo quy định; g) đón, trả hành khách không đúng địa điểm đón, trả hành khách được ghi trong hợp đồng, trừ hành vi vi phạm quy định tại khoản 8 điều này; h) vận chuyển khách liên vận quốc tế theo tuyến cố định không có hoặc không mang theo lệnh vận chuyển, không có danh sách hành khách theo quy định hoặc chở người không có tên trong danh sách hành khách, trừ hành vi vi phạm quy định tại điểm b khoản 1 điều 37 của nghị định này; i) chở hành lý, hàng hóa vượt quá trọng tải theo thiết kế của xe; k) không sử dụng thẻ nhận dạng lái xe để đăng nhập thông tin theo quy định hoặc sử dụng thẻ nhận dạng lái xe của lái xe khác để đăng nhập thông tin khi điều khiển xe ô tô chở khách; l) điều khiển xe ô tô chở người từ 08 chỗ trở lên (không kể chỗ của người lái xe) kinh doanh vận tải hành khách không lắp thiết bị ghi nhận hình ảnh người lái xe hoặc có lắp thiết bị ghi nhận hình ảnh người lái xe nhưng không có tác dụng trong quá trình xe tham gia giao thông theo quy định hoặc làm sai lệch dữ liệu của thiết bị ghi nhận hình ảnh người lái xe lắp trên xe ô tô; m) điều khiển xe vận tải hành khách theo hợp đồng sử dụng hợp đồng điện tử không có thiết bị để truy cập được nội dung của hợp đồng điện tử và danh sách hành khách hoặc có nhưng không cung cấp cho lực lượng chức năng khi có yêu cầu, chở người không có tên trong danh sách hành khách hoặc vận chuyển không đúng đối tượng theo quy định (đối với xe kinh doanh vận tải hành khách theo hợp đồng vận chuyển trẻ em mầm non, học sinh, sinh viên, cán bộ, công chức, viên chức, công nhân). 6. phạt tiền từ 3.000.000 đồng đến 5.000.000 đồng đối với một trong các hành vi vi phạm sau đây: a) vận chuyển hàng hóa nguy hiểm, hàng độc hại, dễ cháy, dễ nổ, động vật, hàng có mùi hôi thối hoặc hàng hóa khác ảnh hưởng đến sức khỏe của hành khách trên xe; b) chở người trên mui xe, trong khoang chở hành lý của xe; c) đe dọa, xúc phạm, tranh giành, lôi kéo hành khách; đe dọa, cưỡng ép hành khách sử dụng dịch vụ ngoài ý muốn; chuyển tải, xuống khách hoặc các hành vi khác nhằm trốn tránh phát hiện xe chở quá tải, quá số người theo quy định của pháp luật; d) điều khiển xe ô tô kinh doanh vận tải quá thời gian quy định tại khoản 1 điều 64 của luật trật tự, an toàn giao thông đường bộ; không thực hiện đúng quy định về thời gian nghỉ giữa hai lần lái xe liên tục của người lái xe; đ) điều khiển xe kinh doanh vận tải hành khách không lắp thiết bị giám sát hành trình của xe theo quy định hoặc có lắp thiết bị giám sát hành trình của xe nhưng thiết bị không hoạt động theo quy định hoặc làm sai lệch dữ liệu của thiết bị giám sát hành trình của xe ô tô; e) điều khiển xe chở hành khách liên vận quốc tế không có hoặc không gắn ký hiệu phân biệt quốc gia. 7. phạt tiền từ 5.000.000 đồng đến 7.000.000 đồng đối với hành vi vi phạm điều khiển xe chở hành khách không có hoặc không gắn phù hiệu theo quy định hoặc có nhưng đã hết giá trị sử dụng hoặc sử dụng phù hiệu không do cơ quan có thẩm quyền cấp. 8. phạt tiền từ 10.000.000 đồng đến 12.000.000 đồng đối với người điều khiển xe thực hiện hành vi đón, trả hành khách trên đường cao tốc. 9. ngoài việc bị áp dụng hình thức xử phạt, người điều khiển phương tiện thực hiện hành vi vi phạm quy định tại khoản 7 điều này bị thu hồi phù hiệu đã hết giá trị sử dụng hoặc phù hiệu không do cơ quan có thẩm quyền cấp. 10. ngoài việc bị áp dụng hình thức xử phạt, người điều khiển phương tiện thực hiện hành vi vi phạm còn bị trừ điểm giấy phép lái xe như sau: a) thực hiện hành vi quy định tại điểm c, điểm d, điểm e khoản 3; điểm a, điểm b, điểm c, điểm d, điểm đ, điểm e, điểm g, điểm h, điểm i, điểm k, điểm m khoản 5; khoản 6; khoản 7 điều này bị trừ điểm giấy phép lái xe 02 điểm; b) thực hiện hành vi quy định tại khoản 2, khoản 4 (trường hợp vượt trên 50% đến 100% số người quy định được phép chở của phương tiện) điều này bị trừ điểm giấy phép lái xe 04 điểm; c) thực hiện hành vi vi phạm quy định tại khoản 8 điều này bị trừ điểm giấy phép lái xe 06 điểm; d) thực hiện hành vi quy định tại khoản 2, khoản 4 (trường hợp vượt trên 100% số người quy định được phép chở của phương tiện) điều này bị trừ điểm giấy phép lái xe 10 điểm.', 'thông tư này quy định kiểm tra kiến thức pháp luật về trật tự, an toàn giao thông đường bộ đối với người có giấy phép lái xe bị trừ hết điểm để được phục hồi điểm giấy phép lái xe.', '1. điểm của giấy phép lái xe quân sự gồm 12 điểm theo quy định của luật trật tự, an toàn giao thông đường bộ, được dùng để quản lý việc chấp hành pháp luật về trật tự, an toàn giao thông đường bộ của người lái xe. số điểm trừ mỗi lần tùy theo tính chất, mức độ vi phạm theo quy định của pháp luật. giấy phép lái xe chưa bị trừ hết điểm và không bị trừ điểm trong thời hạn 12 tháng kể từ ngày bị trừ điểm gần nhất thì được phục hồi đủ 12 điểm. 2. trường hợp giấy phép lái xe quân sự bị trừ hết điểm, sau thời hạn ít nhất 06 tháng kể từ ngày bị trừ hết điểm, người có giấy phép lái xe quân sự bị trừ hết điểm được tham gia kiểm tra kiến thức pháp luật về giao thông đường bộ tổ chức tại cơ sở đào tạo lái xe quân sự theo quy định tại điểm a khoản 1 điều 40 và khoản 1 điều 41 thông tư này, nếu kết quả đặt yêu cầu được phục hồi đủ 12 điểm. 3. điểm của giấy phép lái xe quân sự đổi, cấp lại, đào tạo nâng hạng được giữ nguyên như trước khi đổi, cấp lại, đào tạo nâng hạng.', '1. cục trưởng cục cảnh sát giao thông chịu trách nhiệm chỉ đạo, hướng dẫn, kiểm tra, đôn đốc công an các đơn vị, địa phương thi hành thông tư này. 2. thủ trưởng các đơn vị trực thuộc cơ quan bộ công an, giám đốc công an cấp tỉnh chịu trách nhiệm thi hành thông tư này. 3. trong quá trình triển khai thực hiện thông tư này, nếu có khó khăn, vướng mắc, công an các đơn vị, địa phương báo cáo về bộ công an (qua cục cảnh sát giao thông) để có hướng dẫn kịp thời./. mẫu số 01 (kèm theo thông tư số 73/2024/tt-bca ngày 15/11/2024 của bộ trưởng bộ công an) thông báo vi phạm hành chính về trật tự, an toàn giao thông đường bộ kính gửi: ……………(4)…………….. ……….. (5)……………. đã sử dụng phương tiện, thiết bị kỹ thuật nghiệp vụ hoặc tiếp nhận kết quả ghi thu được từ phương tiện, thiết bị kỹ thuật của ……(6)….. phát hiện và ghi nhận: phương tiện (ghi rõ loại phương tiện, biển số, màu biển số): ........................................ chủ phương tiện: …………………………………………………….; số định danh cá nhân hoặc số căn cước/căn cước công dân (nếu có) ...................................................................................................................... địa chỉ: ....................................................................................................................... thời gian, địa điểm vi phạm: ........................................................................................ hành vi vi phạm: ………………………………………………………………., được quy định tại nghị định số ……/…../nđ-cp ngày .../.../... của chính phủ quy định xử phạt vi phạm hành chính về trật tự, an toàn giao thông trong lĩnh vực giao thông đường bộ; trừ điểm, phục hồi điểm giấy phép lái xe. biện pháp ngăn chặn được áp dụng (nếu có): .............................................................. yêu cầu chủ phương tiện, tổ chức, cá nhân có liên quan đến hành vi vi phạm đúng......giờ...... ngày ..…./…../…… có mặt tại trụ sở …….(2)……… để giải quyết vụ việc vi phạm theo quy định của pháp luật. nếu việc đi lại gặp khó khăn và không có điều kiện trực tiếp đến trụ sở cơ quan …….(2)……. để giải quyết vụ việc vi phạm, thì đúng .......giờ....... ngày ..../…./…. có mặt tại trụ sở …..(7)…… để giải quyết vụ việc vi phạm theo quy định của pháp luật. khi đến giải quyết phải mang theo thông báo này và các giấy tờ có liên quan đến phương tiện và người điều khiển phương tiện. nếu quá thời gian trên, người được yêu cầu không đến để giải quyết vụ việc vi phạm, thì sẽ bị xử lý theo quy định của pháp luật/. (kèm theo kết quả thu thập được bằng phương tiện, thiết bị kỹ thuật nghiệp vụ). ____________________ ghi chú: (1) cơ quan chủ quản. (2) cơ quan của người có thẩm quyền xử phạt. (3) địa danh. (4) chủ phương tiện. (5) đơn vị phát hiện vi phạm. (6) đơn vị chuyển kết quả ghi thu được bằng phương tiện, thiết bị kỹ thuật (nếu có). (7) tên công an cấp huyện hoặc công an cấp xã (nơi chủ phương tiện, tổ chức, cá nhân có liên quan đến hành vi vi phạm cư trú, đóng trụ sở) mà cơ quan công an nơi phát hiện vi phạm đã chuyển kết quả thu thập được bằng phương tiện, thiết bị kỹ thuật nghiệp vụ. mẫu số 02 (kèm theo thông tư số 73/2024/tt-bca ngày 15/11/2024 của bộ trưởng bộ công an) thông báo về việc trừ điểm giấy phép lái xe căn cứ quyết định số \xa0\xa0\xa0\xa0\xa0\xa0\xa0/qđ-xphc ngày \xa0\xa0\xa0\xa0/ \xa0\xa0\xa0\xa0/ \xa0\xa0\xa0\xa0về xử phạt vi phạm hành chính đối với: ông (bà): .................................................................................................................... điều khiển phương tiện (ghi rõ loại phương tiện (ô tô hoặc mô tô), biển số, màu biển số, số đăng ký) vi phạm: số định danh cá nhân hoặc số căn cước/căn cước công dân ...................................... nơi cư trú:................................................................................................................... số điểm hiện có của giấy phép lái xe (loại ô tô hoặc mô tô, số …….., hạng: ……., ngày cấp: …../…../….., tại: …………………….): .............................................................................. số điểm bị trừ (ghi rõ số điểm của giấy phép lái xe ô tô hoặc mô tô): ……………; ngày ……/……/……. bị trừ điểm giấy phép lái xe. số điểm còn lại (ghi rõ điểm của giấy phép lái xe ô tô hoặc mô tô): .............................. trường hợp ông (bà) bị trừ hết điểm giấy phép lái xe, sau thời hạn ít nhất 06 tháng kể từ ngày bị trừ hết điểm được tham gia kiểm tra nội dung kiến thức pháp luật về trật tự, an toàn giao thông đường bộ theo quy định, nếu có kết quả kiểm tra đạt yêu cầu thì được phục hồi đủ 12 điểm giấy phép lái xe. ……………. (4) …………… thông báo để ông (bà) biết, chấp hành các quy định của pháp luật trật tự, an toàn giao thông đường bộ./. __________________________ ghi chú: (1) cơ quan chủ quản. (2), (4) cơ quan của người có thẩm quyền trừ điểm giấy phép lái xe. (3) địa danh. mẫu số 03 (kèm theo thông tư số 73/2024/tt-bca ngày 15/11/2024 của bộ trưởng bộ công an) phiếu chuyển kết quả thu thập được bằng phương tiện, thiết bị kỹ thuật nghiệp vụ về hành vi vi phạm hành chính về trật tự, an toàn giao thông đường bộ kính gửi: ……….……(4)……………….. …………(2)…………… chuyển kết quả thu thập được bằng phương tiện, thiết bị kỹ thuật nghiệp vụ đối với: phương tiện giao thông (ghi rõ loại phương tiện, biển số, màu biển): .......................... chủ phương tiện: ………………………; số định danh cá nhân hoặc số căn cước/ căn cước công dân (nếu có) địa chỉ: ..................................................................................................................... thời gian, địa điểm vi phạm: ...................................................................................... hành vi vi phạm: ................................................. được quy định tại nghị định số …./…./nđ-cp ngày .../.../... của chính phủ quy định xử phạt vi phạm hành chính về trật tự, an toàn giao thông trong lĩnh vực giao thông đường bộ; trừ điểm, phục hồi điểm giấy phép lái xe. ngày …../.../…. ..............(2)............. đã gửi thông báo đến chủ phương tiện, tổ chức, cá nhân có liên quan đến hành vi vi phạm đến trụ sở cơ quan công an để giải quyết vụ việc. đề nghị …….......(4)…....…… thực hiện giải quyết, xử lý theo quy định của pháp luật khi chủ phương tiện, tổ chức, cá nhân có liên quan đến hành vi vi phạm đến trụ sở đơn vị để giải quyết vụ việc. (kèm theo kết quả thu thập được bằng phương tiện, thiết bị kỹ thuật nghiệp vụ)./. ___________________________ ghi chú: (1) cơ quan chủ quản. (2) cơ quan của người có thẩm quyền xử phạt (nơi phát hiện vi phạm). (3) địa danh. (4) tên cơ quan công an cấp huyện hoặc công an cấp xã nơi chủ phương tiện, tổ chức, cá nhân liên quan đến hành vi vi phạm cư trú, đóng trụ sở. mẫu số 04 (kèm theo thông tư số 73/2024/tt-bca ngày 15/11/2024 của bộ trưởng bộ công an) phiếu gửi thông báo vi phạm hành chính về trật tự, an toàn giao thông đường bộ hoặc thông báo dữ liệu (thông tin, hình ảnh) phản ánh vi phạm hành chính về trật tự, an toàn giao thông đường bộ kính gửi: ……………………..(4)………………….. ……(2)…… thực hiện thông báo vi phạm hành chính về trật tự, an toàn giao thông đường bộ số .........., ngày ...../..../.... hoặc thông báo dữ liệu (thông tin, hình ảnh) phản ánh vi phạm hành chính về trật tự, an toàn giao thông đường bộ do tổ chức, cá nhân cung cấp, đăng tải trên các phương tiện thông tin đại chúng, số ........... ngày ……/……/……. (gửi kèm theo). đối với: …………(5)……………; số định danh cá nhân hoặc số căn cước/căn cước công dân (nếu có) địa chỉ: …………………………….. số điện thoại (nếu có): .............................................. phương tiện giao thông (ghi rõ loại phương tiện, biển số, màu biển số): \xa0……………………… có hành vi vi phạm (hoặc dấu hiệu vi phạm): ................................................................................. đề nghị ………(4)…………. chuyển thông báo tới …………(5)………. và giám sát việc thực hiện./. phiếu báo kính gửi ………….(2)…………… công an xã, phường, thị trấn: ………(4)………… đã nhận được phiếu gửi kèm thông báo số: ........ ngày …../…./….. và đã chuyển thông báo đến ................(5)............... hoặc .............…...(7)……...............… vậy thông báo để cơ quan đã gửi thông báo biết./. __________________________ ghi chú: (1) cơ quan chủ quản. (2) cơ quan gửi thông báo vi phạm. (3) địa danh. (4) công an xã, phường, thị trấn nơi chủ phương tiện vi phạm (có dấu hiệu vi phạm) cư trú, đóng trụ sở. (5) chủ phương tiện. (6) hồ sơ xử lý vi phạm. (7) không cư trú tại xã, phường, thị trấn (ghi rõ lý do); đã bán, cho, tặng cho người khác (ghi rõ tên, tuổi, địa chỉ nơi cư trú, học tập, công tác); ........... mẫu số 05 (kèm theo thông tư số 73/2024/tt-bca ngày 15/11/2024 của bộ trưởng bộ công an) __________________________ ghi chú: (1) cục cảnh sát giao thông; công an cấp tỉnh. (2) phòng hướng dẫn tuần tra, kiểm soát giao thông đường bộ, đường sắt; phòng cảnh sát giao thông hoặc công an cấp huyện. (3) đội...; trạm... * in trên khổ a3, 100 trang (không kể bìa), bìa màu xanh ngọc. mẫu số 06 (kèm theo thông tư số 73/2024/tt-bca ngày 15/11/2024 của bộ trưởng bộ công an) thông báo dữ liệu (thông tin, hình ảnh) phản ánh vi phạm hành chính về trật tự, an toàn giao thông đường bộ kính gửi: ……………….(4)……………………… hồi ... giờ ... ngày ……./……/…….., ………………(2)………………. đã tiếp nhận dữ liệu (thông tin, hình ảnh) phản ánh vi phạm hành chính về trật tự, an toàn giao thông đường bộ do cá nhân, tổ chức cung cấp hoặc đăng tải trên phương tiện thông tin đại chúng, mạng xã hội. qua xác minh, xem xét: phương tiện giao thông (ghi rõ loại phương tiện, biển số, màu biển số): ....................... chủ phương tiện: ……………………………………….; số định danh cá nhân hoặc số căn cước/căn cước công dân (nếu có): ................................................................................................................................... địa chỉ: ....................................................................................................................... có dấu hiệu vi phạm: ................................................................................................... được quy định tại nghị định số ……/..../nđ-cp ngày ……/…../……. của chính phủ quy định xử phạt vi phạm hành chính về trật tự, an toàn giao thông trong lĩnh vực giao thông đường bộ; trừ điểm, phục hồi điểm giấy phép lái xe. đề nghị chủ phương tiện, người điều khiển phương tiện đúng …….. giờ …….. ngày …../……/…… có mặt tại trụ sở ……..(2)……… để làm rõ vụ việc. khi đến giải quyết phải mang theo thông báo này và các giấy tờ có liên quan đến phương tiện giao thông và người điều khiển phương tiện./. _________________________ ghi chú: (1) cơ quan chủ quản. (2) cơ quan của người gửi thông báo. (3) địa danh. (4) chủ phương tiện.']","**Nguồn văn bản:** 168_2024_ND-CP_619502

**Tên văn bản:** Nghị định Quy định xử phạt vi phạm hành chính về trật tự, an toàn giao thông trong lĩnh vực giao thông đường bộ; trừ điểm, phục hồi điểm giấy phép lái xe

**Điều 6:** xử phạt, trừ điểm giấy phép lái xe của người điều khiển xe ô tô, xe chở người bốn bánh có gắn động cơ, xe chở hàng bốn bánh có gắn động cơ và các loại xe tương tự xe ô tô vi phạm quy tắc giao thông đường bộ

**Nội dung:**

Nghị định này quy định chi tiết các mức phạt tiền và số điểm bị trừ đối với nhiều hành vi vi phạm giao thông.  Một số hành vi vi phạm dẫn đến việc trừ điểm giấy phép lái xe bao gồm:

* **Trừ 2 điểm:**
    * Thực hiện hành vi quy định tại điểm h, điểm i khoản 3; điểm a, điểm b, điểm c, điểm d, điểm đ, điểm g khoản 4; điểm a, điểm b, điểm c, điểm d, điểm đ, điểm e, điểm g, điểm i, điểm k, điểm n, điểm o khoản 5 điều này.

* **Trừ 4 điểm:**
    * Thực hiện hành vi quy định tại điểm h khoản 5; khoản 6; điểm b khoản 7; điểm b, điểm c, điểm d khoản 9 điều này.

* **Trừ 6 điểm:**
    * Thực hiện hành vi quy định tại điểm p khoản 5; điểm a, điểm c khoản 7; khoản 8 điều này.

* **Trừ 10 điểm:**
    * Thực hiện hành vi quy định tại điểm a khoản 9, khoản 10, điểm đ khoản 11 điều này.


**Tóm lại:**  Nghị định quy định việc trừ điểm giấy phép lái xe dựa trên mức độ nghiêm trọng của các vi phạm giao thông.  Số điểm bị trừ khác nhau tùy thuộc vào hành vi vi phạm, dao động từ 2 đến 10 điểm.  Chi tiết các hành vi vi phạm và số điểm bị trừ được liệt kê cụ thể trong văn bản.
","Mỗi giấy phép lái xe có 12 điểm; nếu bị trừ hết điểm, người lái xe phải tham gia kiểm tra phục hồi điểm.",0.9047619047619048,0.4537703002214582,1.0,0.249999999975
11,Người lái xe máy cần làm gì để phục hồi điểm giấy phép lái xe?,"['1. phạt tiền từ 3.000.000 đồng đến 5.000.000 đồng đối với hành vi không thực hiện đúng quy định trong giấy phép lưu hành, trừ các hành vi vi phạm quy định tại điểm a, điểm b khoản 3; điểm b, điểm c khoản 4 điều này. 2. phạt tiền từ 4.000.000 đồng đến 6.000.000 đồng đối với hành vi điều khiển xe mà tổng trọng lượng (khối lượng toàn bộ) của xe vượt quá tải trọng cho phép của đường bộ trên 10% đến 20%, trừ trường hợp có giấy phép lưu hành còn giá trị sử dụng. 3. phạt tiền từ 8.000.000 đồng đến 10.000.000 đồng đối với một trong các hành vi vi phạm sau đây: a) chở hàng vượt khổ giới hạn của xe hoặc của đường bộ ghi trong giấy phép lưu hành; b) điều khiển xe bánh xích tham gia giao thông không có giấy phép lưu hành hoặc có giấy phép lưu hành nhưng không còn giá trị sử dụng theo quy định hoặc lưu thông trực tiếp trên đường mà không thực hiện biện pháp bảo vệ đường theo quy định; c) điều khiển xe có kích thước bao ngoài vượt quá khép giới hạn của đường bộ hoặc chở hàng vượt khổ giới hạn của đường bộ hoặc chở hàng vượt quá kích thước giới hạn xếp hàng hóa của xe tham gia giao thông, trừ trường hợp có giấy phép lưu hành còn giá trị sử dụng; d) điều khiển xe có kích thước bao ngoài vượt quá kích thước giới hạn cho phép của xe theo quy định, trừ trường hợp có giấy phép lưu hành còn giá trị sử dụng. 4. phạt tiền từ 13.000.000 đồng đến 15.000.000 đồng đối với một trong các hành vi vi phạm sau đây: a) điều khiển xe mà tổng trọng lượng (khối lượng toàn bộ) của xe hoặc tải trọng trục xe (bao gồm cả hàng hóa xếp trên xe, người được chở trên xe) vượt quá tải trọng cho phép của đường bộ trên 20% đến 50%, trừ trường hợp có giấy phép lưu hành còn giá trị sử dụng; b) điều khiển xe có giấy phép lưu hành còn giá trị sử dụng nhưng tổng trọng lượng (khối lượng toàn bộ) của xe hoặc tải trọng trục xe (bao gồm cả hàng hóa xếp trên xe nếu có) vượt quá quy định trong giấy phép lưu hành; c) điều khiển xe có giấy phép lưu hành còn giá trị sử dụng nhưng đi không đúng tuyến đường quy định trong giấy phép lưu hành. 5. phạt tiền từ 40.000.000 đồng đến 50.000.000 đồng đối với một trong các hành vi vi phạm sau đây: a) điều khiển xe mà tổng trọng lượng (khối lượng toàn bộ) của xe hoặc tải trọng trục xe (bao gồm cả hàng hóa xếp trên xe, người được chở trên xe) vượt quá tải trọng cho phép của đường bộ trên 50%, trừ trường hợp có giấy phép lưu hành còn giá trị sử dụng; b) không chấp hành yêu cầu kiểm tra về trọng tải, tải trọng, khổ giới hạn xe, vận chuyển hàng siêu trường, siêu trọng của người thi hành công vụ; chuyển tải hoặc dùng các thủ đoạn khác để trốn tránh việc phát hiện xe chở quá tải, quá khổ. 6. ngoài việc bị áp dụng hình thức xử phạt, người điều khiển phương tiện thực hiện hành vi vi phạm quy định tại khoản 1, khoản 2, khoản 3, khoản 4, khoản 5 điều này nếu gây hư hại cầu, đường còn bị áp dụng biện pháp khắc phục hậu quả buộc khôi phục lại tình trạng ban đầu đã bị thay đổi do vi phạm hành chính gây ra. 7. ngoài việc bị áp dụng hình thức xử phạt, người điều khiển phương tiện thực hiện hành vi vi phạm còn bị trừ điểm giấy phép lái xe như sau: a) thực hiện hành vi quy định tại khoản 1, khoản 3, điểm a khoản 4 điều này còn bị trừ điểm giấy phép lái xe 02 điểm; b) thực hiện hành vi quy định tại điểm b, điểm c khoản 4 điều này còn bị trừ điểm giấy phép lái xe 03 điểm; c) thực hiện hành vi quy định tại điểm a khoản 5 điều này còn bị trừ điểm giấy phép lái xe 04 điểm; d) thực hiện hành vi quy định tại điểm b khoản 5 điều này còn bị trừ điểm giấy phép lái xe 10 điểm.', '1. thẩm quyền phục hồi điểm giấy phép lái xe a) cục trưởng cục cảnh sát giao thông có trách nhiệm quản lý, vận hành cơ sở dữ liệu về xử lý vi phạm hành chính về trật tự, an toàn giao thông đường bộ để thực hiện cập nhật, tự động phục hồi điểm giấy phép lái xe đối với trường hợp quy định tại khoản 2 điều này; b) cục trưởng cục cảnh sát giao thông, trưởng phòng cảnh sát giao thông nơi tổ chức kiểm tra kiến thức pháp luật về trật tự, an toàn giao thông đường bộ có thẩm quyền phục hồi điểm cho giấy phép lái xe đối với trường hợp quy định tại khoản 3 điều này. 2. trình tự, thủ tục phục hồi điểm giấy phép lái xe đối với trường hợp giấy phép lái xe chưa bị trừ hết điểm và không bị trừ điểm trong thời hạn 12 tháng từ ngày bị trừ điểm gần nhất a) khi đủ thời hạn 12 tháng, kể từ ngày bị trừ điểm giấy phép lái xe gần nhất, dữ liệu điểm giấy phép lái xe sẽ được tự động phục hồi đủ 12 điểm (gồm cả giấy phép lái xe đang trong thời hạn bị tước quyền sử dụng) và cập nhật tự động trong cơ sở dữ liệu về xử lý vi phạm hành chính về trật tự, an toàn giao thông đường bộ; b) ngay sau khi dữ liệu điểm giấy phép lái xe được phục hồi, cơ sở dữ liệu về xử lý vi phạm hành chính về trật tự, an toàn giao thông đường bộ sẽ tự động chuyển thông tin thông báo cho người được phục hồi điểm giấy phép lái xe biết việc phục hồi điểm theo quy định tại điểm c khoản này; c) việc thông báo phục hồi điểm giấy phép lái xe thực hiện bằng phương thức điện tử thông qua tài khoản của công dân đăng ký trên cổng dịch vụ công, ứng dụng giao thông trên thiết bị di động; đồng thời cập nhật thông tin về giấy phép lái xe được phục hồi điểm trên trang thông tin điện tử của cục cảnh sát giao thông. trường hợp giấy phép lái xe được thể hiện dưới hình thức thông điệp dữ liệu thì thực hiện cập nhật trạng thái phục hồi điểm giấy phép lái xe trong căn cước điện tử, tài khoản định danh điện tử trên ứng dụng định danh quốc gia. 3. trình tự, thủ tục phục hồi điểm giấy phép lái xe đối với trường hợp giấy phép lái xe bị trừ hết điểm a) sau khi người có giấy phép lái xe bị trừ hết điểm tham gia kiểm tra nội dung kiến thức pháp luật về trật tự, an toàn giao thông đường bộ và đạt yêu cầu, kết quả kiểm tra được cập nhật vào phần mềm kiểm tra kiến thức pháp luật về trật tự, an toàn giao thông đường bộ và đồng bộ dữ liệu với cơ sở dữ liệu về xử lý vi phạm hành chính về trật tự, an toàn giao thông đường bộ, dữ liệu điểm giấy phép lái xe sẽ được phục hồi đủ 12 điểm và cập nhật tự động trong cơ sở dữ liệu về xử lý vi phạm hành chính về trật tự, an toàn giao thông đường bộ; b) ngay sau khi dữ liệu điểm giấy phép lái xe được phục hồi đủ 12 điểm thì người có thẩm quyền quy định tại điểm b khoản 1 điều này thông báo cho người được phục hồi điểm giấy phép lái xe biết việc phục hồi điểm; c) việc thông báo phục hồi điểm giấy phép lái xe thực hiện bằng văn bản theo mẫu quy định của bộ trưởng bộ công an và được giao trực tiếp hoặc gửi qua dịch vụ bưu chính hoặc thực hiện thông báo bằng phương thức điện tử thông qua tài khoản của công dân đăng ký trên cổng dịch vụ công, ứng dụng giao thông trên thiết bị di động; đồng thời cập nhật thông tin về giấy phép lái xe được phục hồi điểm trên trang thông tin điện tử của cục cảnh sát giao thông. trường hợp giấy phép lái xe được thể hiện dưới hình thức thông điệp dữ liệu thì cơ quan, người có thẩm quyền thực hiện cập nhật trạng thái phục hồi điểm giấy phép lái xe trong căn cước điện tử, tài khoản định danh điện tử trên ứng dụng định danh quốc gia. chương iv điều khoản thi hành', '1. điểm của giấy phép lái xe được dùng để quản lý việc chấp hành pháp luật về trật tự, an toàn giao thông đường bộ của người lái xe trên hệ thống cơ sở dữ liệu về trật tự, an toàn giao thông đường bộ, bao gồm 12 điểm. số điểm trừ mỗi lần vi phạm tùy thuộc tính chất, mức độ của hành vi vi phạm pháp luật về trật tự, an toàn giao thông đường bộ. dữ liệu về điểm trừ giấy phép lái xe của người vi phạm sẽ được cập nhật vào hệ thống cơ sở dữ liệu ngay sau khi quyết định xử phạt có hiệu lực thi hành và thông báo cho người bị trừ điểm giấy phép lái xe biết. 2. giấy phép lái xe chưa bị trừ hết điểm và không bị trừ điểm trong thời hạn 12 tháng từ ngày bị trừ điểm gần nhất thì được phục hồi đủ 12 điểm. 3. trường hợp giấy phép lái xe bị trừ hết điểm thì người có giấy phép lái xe không được điều khiển phương tiện tham gia giao thông đường bộ theo giấy phép lái xe đó. sau thời hạn ít nhất là 06 tháng kể từ ngày bị trừ hết điểm, người có giấy phép lái xe được tham gia kiểm tra nội dung kiến thức pháp luật về trật tự, an toàn giao thông đường bộ theo quy định tại khoản 7 điều 61 của luật này do lực lượng cảnh sát giao thông tổ chức, có kết quả đạt yêu cầu thì được phục hồi đủ 12 điểm. 4. giấy phép lái xe sau khi đổi, cấp lại, nâng hạng được giữ nguyên số điểm của giấy phép lái xe trước khi đổi, cấp lại, nâng hạng. 5. người có thẩm quyền xử phạt vi phạm hành chính có thẩm quyền trừ điểm giấy phép lái xe. 6. chính phủ quy định chi tiết khoản 1 điều này; quy định trình tự, thủ tục, thẩm quyền trừ điểm, phục hồi điểm giấy phép lái xe; quy định lộ trình thực hiện điều này. bộ trưởng bộ công an quy định chi tiết khoản 3 điều này.', '1. điểm của giấy phép lái xe quân sự gồm 12 điểm theo quy định của luật trật tự, an toàn giao thông đường bộ, được dùng để quản lý việc chấp hành pháp luật về trật tự, an toàn giao thông đường bộ của người lái xe. số điểm trừ mỗi lần tùy theo tính chất, mức độ vi phạm theo quy định của pháp luật. giấy phép lái xe chưa bị trừ hết điểm và không bị trừ điểm trong thời hạn 12 tháng kể từ ngày bị trừ điểm gần nhất thì được phục hồi đủ 12 điểm. 2. trường hợp giấy phép lái xe quân sự bị trừ hết điểm, sau thời hạn ít nhất 06 tháng kể từ ngày bị trừ hết điểm, người có giấy phép lái xe quân sự bị trừ hết điểm được tham gia kiểm tra kiến thức pháp luật về giao thông đường bộ tổ chức tại cơ sở đào tạo lái xe quân sự theo quy định tại điểm a khoản 1 điều 40 và khoản 1 điều 41 thông tư này, nếu kết quả đặt yêu cầu được phục hồi đủ 12 điểm. 3. điểm của giấy phép lái xe quân sự đổi, cấp lại, đào tạo nâng hạng được giữ nguyên như trước khi đổi, cấp lại, đào tạo nâng hạng.']","**Nguồn văn bản:** 168_2024_ND-CP_619502

**Tên văn bản:** Nghị định Quy định xử phạt vi phạm hành chính về trật tự, an toàn giao thông trong lĩnh vực giao thông đường bộ; trừ điểm, phục hồi điểm giấy phép lái xe

**Điều 51:** Thẩm quyền, trình tự, thủ tục phục hồi điểm giấy phép lái xe

**Nội dung:**

1. Thẩm quyền phục hồi điểm giấy phép lái xe:

    a) Cục trưởng Cục cảnh sát giao thông có trách nhiệm quản lý, vận hành cơ sở dữ liệu về xử lý vi phạm hành chính về trật tự, an toàn giao thông đường bộ để thực hiện cập nhật, tự động phục hồi điểm giấy phép lái xe đối với trường hợp quy định tại khoản 2 điều này.

    b) Cục trưởng Cục cảnh sát giao thông, trưởng phòng cảnh sát giao thông nơi tổ chức kiểm tra kiến thức pháp luật về trật tự, an toàn giao thông đường bộ có thẩm quyền phục hồi điểm cho giấy phép lái xe đối với trường hợp quy định tại khoản 3 điều này.

2. Trình tự, thủ tục phục hồi điểm giấy phép lái xe đối với trường hợp giấy phép lái xe chưa bị trừ hết điểm và không bị trừ điểm trong thời hạn 12 tháng từ ngày bị trừ điểm gần nhất:

    a) Khi đủ thời hạn 12 tháng, kể từ ngày bị trừ điểm giấy phép lái xe gần nhất, dữ liệu điểm giấy phép lái xe sẽ được tự động phục hồi đủ 12 điểm (gồm cả giấy phép lái xe đang trong thời hạn bị tước quyền sử dụng) và cập nhật tự động trong cơ sở dữ liệu về xử lý vi phạm hành chính về trật tự, an toàn giao thông đường bộ.

    b) Ngay sau khi dữ liệu điểm giấy phép lái xe được phục hồi, cơ sở dữ liệu về xử lý vi phạm hành chính về trật tự, an toàn giao thông đường bộ sẽ tự động chuyển thông tin thông báo cho người được phục hồi điểm giấy phép lái xe biết việc phục hồi điểm theo quy định tại điểm c khoản này.

    c) Việc thông báo phục hồi điểm giấy phép lái xe thực hiện bằng phương thức điện tử thông qua tài khoản của công dân đăng ký trên cổng dịch vụ công, ứng dụng giao thông trên thiết bị di động; đồng thời cập nhật thông tin về giấy phép lái xe được phục hồi điểm trên trang thông tin điện tử của Cục cảnh sát giao thông. Trường hợp giấy phép lái xe được thể hiện dưới hình thức thông điệp dữ liệu thì thực hiện cập nhật trạng thái phục hồi điểm giấy phép lái xe trong căn cước điện tử, tài khoản định danh điện tử trên ứng dụng định danh quốc gia.

3. Trình tự, thủ tục phục hồi điểm giấy phép lái xe đối với trường hợp giấy phép lái xe bị trừ hết điểm:

    a) Sau khi người có giấy phép lái xe bị trừ hết điểm tham gia kiểm tra nội dung kiến thức pháp luật về trật tự, an toàn giao thông đường bộ và đạt yêu cầu, kết quả kiểm tra được cập nhật vào phần mềm kiểm tra kiến thức pháp luật về trật tự, an toàn giao thông đường bộ và đồng bộ dữ liệu với cơ sở dữ liệu về xử lý vi phạm hành chính về trật tự, an toàn giao thông đường bộ, dữ liệu điểm giấy phép lái xe sẽ được phục hồi đủ 12 điểm và cập nhật tự động trong cơ sở dữ liệu về xử lý vi phạm hành chính về trật tự, an toàn giao thông đường bộ.

    b) Ngay sau khi dữ liệu điểm giấy phép lái xe được phục hồi đủ 12 điểm thì người có thẩm quyền quy định tại điểm b khoản 1 điều này thông báo cho người được phục hồi điểm giấy phép lái xe biết việc phục hồi điểm.

    c) Việc thông báo phục hồi điểm giấy phép lái xe thực hiện bằng văn bản theo mẫu quy định của Bộ trưởng Bộ Công an và được giao trực tiếp hoặc gửi qua dịch vụ bưu chính hoặc thực hiện thông báo bằng phương thức điện tử thông qua tài khoản của công dân đăng ký trên cổng dịch vụ công, ứng dụng giao thông trên thiết bị di động; đồng thời cập nhật thông tin về giấy phép lái xe được phục hồi điểm trên trang thông tin điện tử của Cục cảnh sát giao thông. Trường hợp giấy phép lái xe được thể hiện dưới hình thức thông điệp dữ liệu thì cơ quan, người có thẩm quyền thực hiện cập nhật trạng thái phục hồi điểm giấy phép lái xe trong căn cước điện tử, tài khoản định danh điện tử trên ứng dụng định danh quốc gia.


**Nguồn văn bản:** 36_2024_QH15_444251

**Tên văn bản:** Luật Trật tự, an toàn giao thông đường bộ

**Điều 58:** Điểm của giấy phép lái xe

**Nội dung:**

1. Điểm của giấy phép lái xe được dùng để quản lý việc chấp hành pháp luật về trật tự, an toàn giao thông đường bộ của người lái xe trên hệ thống cơ sở dữ liệu về trật tự, an toàn giao thông đường bộ, bao gồm 12 điểm. Số điểm trừ mỗi lần vi phạm tùy thuộc tính chất, mức độ của hành vi vi phạm pháp luật về trật tự, an toàn giao thông đường bộ. Dữ liệu về điểm trừ giấy phép lái xe của người vi phạm sẽ được cập nhật vào hệ thống cơ sở dữ liệu ngay sau khi quyết định xử phạt có hiệu lực thi hành và thông báo cho người bị trừ điểm giấy phép lái xe biết.

2. Giấy phép lái xe chưa bị trừ hết điểm và không bị trừ điểm trong thời hạn 12 tháng từ ngày bị trừ điểm gần nhất thì được phục hồi đủ 12 điểm.

3. Trường hợp giấy phép lái xe bị trừ hết điểm thì người có giấy phép lái xe không được điều khiển phương tiện tham gia giao thông đường bộ theo giấy phép lái xe đó. Sau thời hạn ít nhất là 06 tháng kể từ ngày bị trừ hết điểm, người có giấy phép lái xe được tham gia kiểm tra nội dung kiến thức pháp luật về trật tự, an toàn giao thông đường bộ theo quy định tại khoản 7 điều 61 của Luật này do lực lượng cảnh sát giao thông tổ chức, có kết quả đạt yêu cầu thì được phục hồi đủ 12 điểm.


**Nguồn văn bản:** 68_2024_TT-BQP_628772

**Tên văn bản:** Thông tư Quy định về đào tạo, sát hạch, cấp giấy phép lái xe quân sự; bồi dưỡng kiến thức pháp luật về giao thông đường bộ cho người điều khiển xe máy chuyên dùng thuộc phạm vi quản lý của Bộ Quốc phòng

**Điều 7:** Điểm của giấy phép lái xe quân sự

**Nội dung:**

1. Điểm của giấy phép lái xe quân sự gồm 12 điểm theo quy định của Luật trật tự, an toàn giao thông đường bộ, được dùng để quản lý việc chấp hành pháp luật về trật tự, an toàn giao thông đường bộ của người lái xe. Số điểm trừ mỗi lần tùy theo tính chất, mức độ vi phạm theo quy định của pháp luật. Giấy phép lái xe chưa bị trừ hết điểm và không bị trừ điểm trong thời hạn 12 tháng kể từ ngày bị trừ điểm gần nhất thì được phục hồi đủ 12 điểm.

2. Trường hợp giấy phép lái xe quân sự bị trừ hết điểm, sau thời hạn ít nhất 06 tháng kể từ ngày bị trừ hết điểm, người có giấy phép lái xe quân sự bị trừ hết điểm được tham gia kiểm tra kiến thức pháp luật về giao thông đường bộ tổ chức tại cơ sở đào tạo lái xe quân sự theo quy định tại điểm a khoản 1 điều 40 và khoản 1 điều 41 Thông tư này, nếu kết quả đạt yêu cầu được phục hồi đủ 12 điểm.


Tóm lại: Điều kiện phục hồi điểm giấy phép lái xe máy phụ thuộc vào việc giấy phép có bị trừ hết điểm hay chưa. Nếu chưa bị trừ hết điểm và không bị trừ điểm trong 12 tháng, điểm sẽ tự động được phục hồi sau 12 tháng.  Nếu bị trừ hết điểm, người điều khiển xe phải tham gia kiểm tra lại kiến thức pháp luật về giao thông đường bộ và đạt yêu cầu mới được phục hồi điểm sau ít nhất 6 tháng.
",Người lái xe máy phải làm kiểm tra lý thuyết theo các câu hỏi như khi thi bằng lái xe.,1.0,0.8088281965050365,1.0,0.5833333333041666
12,Người lái ô tô cần làm gì để phục hồi điểm giấy phép lái xe?,"['1. thẩm quyền phục hồi điểm giấy phép lái xe a) cục trưởng cục cảnh sát giao thông có trách nhiệm quản lý, vận hành cơ sở dữ liệu về xử lý vi phạm hành chính về trật tự, an toàn giao thông đường bộ để thực hiện cập nhật, tự động phục hồi điểm giấy phép lái xe đối với trường hợp quy định tại khoản 2 điều này; b) cục trưởng cục cảnh sát giao thông, trưởng phòng cảnh sát giao thông nơi tổ chức kiểm tra kiến thức pháp luật về trật tự, an toàn giao thông đường bộ có thẩm quyền phục hồi điểm cho giấy phép lái xe đối với trường hợp quy định tại khoản 3 điều này. 2. trình tự, thủ tục phục hồi điểm giấy phép lái xe đối với trường hợp giấy phép lái xe chưa bị trừ hết điểm và không bị trừ điểm trong thời hạn 12 tháng từ ngày bị trừ điểm gần nhất a) khi đủ thời hạn 12 tháng, kể từ ngày bị trừ điểm giấy phép lái xe gần nhất, dữ liệu điểm giấy phép lái xe sẽ được tự động phục hồi đủ 12 điểm (gồm cả giấy phép lái xe đang trong thời hạn bị tước quyền sử dụng) và cập nhật tự động trong cơ sở dữ liệu về xử lý vi phạm hành chính về trật tự, an toàn giao thông đường bộ; b) ngay sau khi dữ liệu điểm giấy phép lái xe được phục hồi, cơ sở dữ liệu về xử lý vi phạm hành chính về trật tự, an toàn giao thông đường bộ sẽ tự động chuyển thông tin thông báo cho người được phục hồi điểm giấy phép lái xe biết việc phục hồi điểm theo quy định tại điểm c khoản này; c) việc thông báo phục hồi điểm giấy phép lái xe thực hiện bằng phương thức điện tử thông qua tài khoản của công dân đăng ký trên cổng dịch vụ công, ứng dụng giao thông trên thiết bị di động; đồng thời cập nhật thông tin về giấy phép lái xe được phục hồi điểm trên trang thông tin điện tử của cục cảnh sát giao thông. trường hợp giấy phép lái xe được thể hiện dưới hình thức thông điệp dữ liệu thì thực hiện cập nhật trạng thái phục hồi điểm giấy phép lái xe trong căn cước điện tử, tài khoản định danh điện tử trên ứng dụng định danh quốc gia. 3. trình tự, thủ tục phục hồi điểm giấy phép lái xe đối với trường hợp giấy phép lái xe bị trừ hết điểm a) sau khi người có giấy phép lái xe bị trừ hết điểm tham gia kiểm tra nội dung kiến thức pháp luật về trật tự, an toàn giao thông đường bộ và đạt yêu cầu, kết quả kiểm tra được cập nhật vào phần mềm kiểm tra kiến thức pháp luật về trật tự, an toàn giao thông đường bộ và đồng bộ dữ liệu với cơ sở dữ liệu về xử lý vi phạm hành chính về trật tự, an toàn giao thông đường bộ, dữ liệu điểm giấy phép lái xe sẽ được phục hồi đủ 12 điểm và cập nhật tự động trong cơ sở dữ liệu về xử lý vi phạm hành chính về trật tự, an toàn giao thông đường bộ; b) ngay sau khi dữ liệu điểm giấy phép lái xe được phục hồi đủ 12 điểm thì người có thẩm quyền quy định tại điểm b khoản 1 điều này thông báo cho người được phục hồi điểm giấy phép lái xe biết việc phục hồi điểm; c) việc thông báo phục hồi điểm giấy phép lái xe thực hiện bằng văn bản theo mẫu quy định của bộ trưởng bộ công an và được giao trực tiếp hoặc gửi qua dịch vụ bưu chính hoặc thực hiện thông báo bằng phương thức điện tử thông qua tài khoản của công dân đăng ký trên cổng dịch vụ công, ứng dụng giao thông trên thiết bị di động; đồng thời cập nhật thông tin về giấy phép lái xe được phục hồi điểm trên trang thông tin điện tử của cục cảnh sát giao thông. trường hợp giấy phép lái xe được thể hiện dưới hình thức thông điệp dữ liệu thì cơ quan, người có thẩm quyền thực hiện cập nhật trạng thái phục hồi điểm giấy phép lái xe trong căn cước điện tử, tài khoản định danh điện tử trên ứng dụng định danh quốc gia. chương iv điều khoản thi hành', '1. khi người vi phạm đến giải quyết vi phạm, thực hiện như sau: a) tiếp nhận biên bản vi phạm hành chính từ người vi phạm và đối chiếu với hồ sơ vi phạm (trường hợp làm mất biên bản vi phạm hành chính, phải đối chiếu kỹ thông tin về nhân thân của người vi phạm với hồ sơ vi phạm); không giải quyết vụ việc đối với người trung gian (trừ trường hợp được ủy quyền theo quy định của pháp luật) hoặc ngoài vị trí quy định giải quyết vi phạm hành chính của đơn vị. đối với vụ việc cần xác minh làm rõ, thì báo cáo đề xuất người có thẩm quyền tổ chức xác minh; b) thông báo hình thức, mức xử phạt, biện pháp ngăn chặn, biện pháp trừ điểm giấy phép lái xe (theo mẫu số 02 ban hành kèm theo thông tư này), biện pháp khác, kết quả thu thập được hành vi vi phạm bằng phương tiện, thiết bị kỹ thuật nghiệp vụ theo quy định; trường hợp giấy phép, chứng chỉ hành nghề, giấy phép lái xe đã được tích hợp, cập nhật trong tài khoản định danh điện tử trên ứng dụng định danh quốc gia, cơ sở dữ liệu do bộ công an quản lý, vận hành thì khi áp dụng hình thức tước quyền sử dụng giấy phép, chứng chỉ hành nghề, người có thẩm quyền thực hiện việc tước trên môi trường điện tử, cập nhật thông tin về việc tước quyền sử dụng giấy phép, chứng chỉ hành nghề đó trên cơ sở dữ liệu xử lý vi phạm hành chính và đồng bộ với ứng dụng định danh quốc gia, cổng dịch vụ công, trang thông tin điện tử của cục cảnh sát giao thông, cơ sở dữ liệu do bộ công an quản lý, vận hành, app vnecsgt, ứng dụng giao thông trên thiết bị di động dành cho công dân do bộ công an quản lý, vận hành (sau đây gọi là app vnetraffic) để người vi phạm, chủ phương tiện (đối với giấy tờ của chủ phương tiện) biết, chấp hành theo quy định của pháp luật về trật tự, an toàn giao thông đường bộ, phục vụ các lực lượng chức năng có thẩm quyền kiểm tra, kiểm soát, xử lý vi phạm; việc thông báo trừ điểm giấy phép lái xe thực hiện theo quy định tại nghị định của chính phủ quy định xử phạt vi phạm hành chính về trật tự, an toàn giao thông trong lĩnh vực giao thông đường bộ; trừ điểm, phục hồi điểm giấy phép lái xe. c) giao quyết định xử phạt vi phạm hành chính cho người bị xử phạt hoặc người đại diện hợp pháp, người được ủy quyền của người bị xử phạt; d) tiếp nhận, kiểm tra, đối chiếu biên lai thu tiền phạt (hoặc chứng từ thu, nộp tiền phạt khác theo quy định của pháp luật) với hồ sơ vi phạm hành chính và lưu hồ sơ; đ) trả lại tang vật, phương tiện, giấy tờ bị tạm giữ, tước quyền sử dụng theo thủ tục hành chính cho người bị xử phạt. trường hợp giấy tờ đó có thông tin bị tạm giữ hoặc tước quyền sử dụng trên ứng dụng định danh quốc gia, cơ sở dữ liệu do bộ công an quản lý, vận hành thì người có thẩm quyền ra quyết định, lập biên bản trả lại giấy tờ cho người bị xử phạt; cơ sở dữ liệu xử lý vi phạm hành chính thực hiện đồng bộ thông tin với ứng dụng định danh quốc gia, cơ sở dữ liệu, phần mềm quy định tại điểm b khoản này để gỡ bỏ nội dung thông tin về việc tạm giữ, tước quyền sử dụng giấy tờ đó; e) trường hợp giải quyết vụ việc theo thông báo vi phạm hành chính về trật tự, an toàn giao thông đường bộ: kiểm tra, đối chiếu các thông tin trên giấy thông báo, giấy tờ tùy thân; cho người vi phạm xem kết quả thu thập được hành vi vi phạm bằng phương tiện, thiết bị kỹ thuật nghiệp vụ; lập biên bản vi phạm hành chính và thực hiện xử lý vi phạm theo quy định. 2. trường hợp người vi phạm thực hiện việc nộp tiền xử phạt vi phạm hành chính qua cổng dịch vụ công a) người có thẩm quyền xử phạt gửi thông tin xử phạt lên cổng dịch vụ công; cổng dịch vụ công tự động thông báo cho người vi phạm tra cứu thông tin quyết định xử phạt vi phạm hành chính thông qua số điện thoại người vi phạm đã cung cấp cho cơ quan công an tại thời điểm lập biên bản vi phạm hành chính; đăng ký xe; b) người vi phạm truy cập vào cổng dịch vụ công thông qua số quyết định xử phạt vi phạm hành chính đã được thông báo hoặc số biên bản vi phạm hành chính để tra cứu thông tin quyết định xử phạt vi phạm hành chính; nộp tiền xử phạt vi phạm hành chính, đăng ký nhận lại giấy tờ bị tạm giữ, tước qua dịch vụ bưu chính công ích; c) người có thẩm quyền xử phạt tra cứu biên lai điện tử thu tiền xử phạt vi phạm hành chính được hệ thống cổng dịch vụ công gửi về để in, lưu hồ sơ xử phạt vi phạm hành chính và làm căn cứ trả lại giấy tờ bị tạm giữ, gỡ bỏ nội dung thông tin về việc tạm giữ trên ứng dụng định danh quốc gia, cơ sở dữ liệu, phần mềm theo quy định tại điểm d khoản này; d) người có thẩm quyền xử phạt vi phạm hành chính trả lại giấy tờ bị tạm giữ, bị tước (khi hết thời hạn tước quyền sử dụng) cho người bị xử phạt qua dịch vụ bưu chính công ích. trường hợp giấy tờ đó có thông tin về việc bị tạm giữ, tước quyền sử dụng trên ứng dụng định danh quốc gia, cơ sở dữ liệu do bộ công an quản lý, vận hành thì cơ sở dữ liệu xử lý vi phạm hành chính thực hiện đồng bộ thông tin với ứng dụng định danh quốc gia, cơ sở dữ liệu, phần mềm quy định tại điểm b khoản 1 điều này để gỡ bỏ nội dung thông tin về việc tạm giữ, tước quyền sử dụng giấy tờ đó. 3. trường hợp người vi phạm thực hiện nộp phạt vi phạm hành chính thông qua dịch vụ bưu chính công ích thì thực hiện theo quy định tại điều 20 nghị định số 118/2021/nđ-cp. 4. trường hợp đã quá thời hạn hẹn đến giải quyết vụ việc vi phạm ghi trong biên bản vi phạm hành chính hoặc trong thông báo của người có thẩm quyền xử phạt hoặc quá thời hạn thi hành quyết định xử phạt mà chủ phương tiện, người vi phạm chưa đến giải quyết, xử lý hoặc chưa chấp hành quyết định xử phạt thì người có thẩm quyền xử phạt gửi thông báo cho cơ quan đăng kiểm (đối với phương tiện giao thông có quy định phải kiểm định), cơ quan đăng ký xe, cơ quan cấp giấy phép lái xe để phối hợp xử lý theo quy định tại luật trật tự, an toàn giao thông đường bộ; nghị định của chính phủ quy định xử phạt vi phạm hành chính về trật tự, an toàn giao thông trong lĩnh vực giao thông đường bộ; trừ điểm, phục hồi điểm giấy phép lái xe. việc gửi thông báo đến cơ quan đăng kiểm, cơ quan đăng ký xe, cơ quan cấp giấy phép lái xe thực hiện bằng phương thức điện tử kết nối, chia sẻ dữ liệu hoặc bằng văn bản. 5. việc trừ điểm, phục hồi điểm giấy phép lái xe được thực hiện theo quy định tại nghị định của chính phủ quy định xử phạt vi phạm hành chính về trật tự, an toàn giao thông trong lĩnh vực giao thông đường bộ; trừ điểm, phục hồi điểm giấy phép lái xe.']","**Nguồn văn bản:** 168_2024_ND-CP_619502

**Tên văn bản:** Nghị định Quy định xử phạt vi phạm hành chính về trật tự, an toàn giao thông trong lĩnh vực giao thông đường bộ; trừ điểm, phục hồi điểm giấy phép lái xe

**Điều 51:** Thẩm quyền, trình tự, thủ tục phục hồi điểm giấy phép lái xe

**Nội dung:**

1. Thẩm quyền phục hồi điểm giấy phép lái xe:

    a) Cục trưởng Cục cảnh sát giao thông có trách nhiệm quản lý, vận hành cơ sở dữ liệu về xử lý vi phạm hành chính về trật tự, an toàn giao thông đường bộ để thực hiện cập nhật, tự động phục hồi điểm giấy phép lái xe đối với trường hợp quy định tại khoản 2 điều này.

    b) Cục trưởng Cục cảnh sát giao thông, trưởng phòng cảnh sát giao thông nơi tổ chức kiểm tra kiến thức pháp luật về trật tự, an toàn giao thông đường bộ có thẩm quyền phục hồi điểm cho giấy phép lái xe đối với trường hợp quy định tại khoản 3 điều này.

2. Trình tự, thủ tục phục hồi điểm giấy phép lái xe đối với trường hợp giấy phép lái xe chưa bị trừ hết điểm và không bị trừ điểm trong thời hạn 12 tháng từ ngày bị trừ điểm gần nhất:

    a) Khi đủ thời hạn 12 tháng, kể từ ngày bị trừ điểm giấy phép lái xe gần nhất, dữ liệu điểm giấy phép lái xe sẽ được tự động phục hồi đủ 12 điểm (gồm cả giấy phép lái xe đang trong thời hạn bị tước quyền sử dụng) và cập nhật tự động trong cơ sở dữ liệu về xử lý vi phạm hành chính về trật tự, an toàn giao thông đường bộ.

    b) Ngay sau khi dữ liệu điểm giấy phép lái xe được phục hồi, cơ sở dữ liệu về xử lý vi phạm hành chính về trật tự, an toàn giao thông đường bộ sẽ tự động chuyển thông tin thông báo cho người được phục hồi điểm giấy phép lái xe biết việc phục hồi điểm theo quy định tại điểm c khoản này.

    c) Việc thông báo phục hồi điểm giấy phép lái xe thực hiện bằng phương thức điện tử thông qua tài khoản của công dân đăng ký trên cổng dịch vụ công, ứng dụng giao thông trên thiết bị di động; đồng thời cập nhật thông tin về giấy phép lái xe được phục hồi điểm trên trang thông tin điện tử của Cục cảnh sát giao thông. Trường hợp giấy phép lái xe được thể hiện dưới hình thức thông điệp dữ liệu thì thực hiện cập nhật trạng thái phục hồi điểm giấy phép lái xe trong căn cước điện tử, tài khoản định danh điện tử trên ứng dụng định danh quốc gia.

3. Trình tự, thủ tục phục hồi điểm giấy phép lái xe đối với trường hợp giấy phép lái xe bị trừ hết điểm:

    a) Sau khi người có giấy phép lái xe bị trừ hết điểm tham gia kiểm tra nội dung kiến thức pháp luật về trật tự, an toàn giao thông đường bộ và đạt yêu cầu, kết quả kiểm tra được cập nhật vào phần mềm kiểm tra kiến thức pháp luật về trật tự, an toàn giao thông đường bộ và đồng bộ dữ liệu với cơ sở dữ liệu về xử lý vi phạm hành chính về trật tự, an toàn giao thông đường bộ, dữ liệu điểm giấy phép lái xe sẽ được phục hồi đủ 12 điểm và cập nhật tự động trong cơ sở dữ liệu về xử lý vi phạm hành chính về trật tự, an toàn giao thông đường bộ.

    b) Ngay sau khi dữ liệu điểm giấy phép lái xe được phục hồi đủ 12 điểm thì người có thẩm quyền quy định tại điểm b khoản 1 điều này thông báo cho người được phục hồi điểm giấy phép lái xe biết việc phục hồi điểm.

    c) Việc thông báo phục hồi điểm giấy phép lái xe thực hiện bằng văn bản theo mẫu quy định của Bộ trưởng Bộ Công an và được giao trực tiếp hoặc gửi qua dịch vụ bưu chính hoặc thực hiện thông báo bằng phương thức điện tử thông qua tài khoản của công dân đăng ký trên cổng dịch vụ công, ứng dụng giao thông trên thiết bị di động; đồng thời cập nhật thông tin về giấy phép lái xe được phục hồi điểm trên trang thông tin điện tử của Cục cảnh sát giao thông. Trường hợp giấy phép lái xe được thể hiện dưới hình thức thông điệp dữ liệu thì cơ quan, người có thẩm quyền thực hiện cập nhật trạng thái phục hồi điểm giấy phép lái xe trong căn cước điện tử, tài khoản định danh điện tử trên ứng dụng định danh quốc gia.


Tóm lại:  Quy trình phục hồi điểm giấy phép lái xe phụ thuộc vào tình trạng giấy phép. Nếu chưa bị trừ hết điểm và không bị trừ điểm trong 12 tháng gần nhất, điểm sẽ tự động được phục hồi sau 12 tháng.  Nếu bị trừ hết điểm, cần tham gia kiểm tra kiến thức pháp luật về giao thông và đạt yêu cầu thì điểm mới được phục hồi. Thông báo phục hồi điểm được thực hiện qua nhiều kênh như điện tử (cổng dịch vụ công, ứng dụng giao thông) hoặc văn bản.
",Người lái ô tô phải làm kiểm tra lý thuyết và mô phỏng theo các câu hỏi như khi thi bằng lái xe.,1.0,0.5511884257958247,0.0,0.9999999999
13,Luật Giao thông Đường bộ 2025 có quy định gì mới về việc sử dụng điện thoại khi lái xe?,"['1. phạt tiền từ 400.000 đồng đến 600.000 đồng đối với người điều khiển xe thực hiện một trong các hành vi vi phạm sau đây: a) không chấp hành hiệu lệnh, chỉ dẫn của biển báo hiệu, vạch kẻ đường, trừ các hành vi vi phạm quy định tại điểm a, điểm c, điểm d, điểm đ khoản 2; điểm a, điểm d, điểm đ, điểm e, điểm n, điểm o khoản 3; điểm a, điểm b, điểm đ, điểm e, điểm i, điểm k, điểm l khoản 4; điểm a, điểm b, điểm c, điểm d, điểm đ, điểm i, điểm k khoản 5; điểm a khoản 6; khoản 7; điểm b, điểm d khoản 9; điểm a khoản 10; điểm đ khoản 11 điều này; b) khi ra, vào vị trí dừng xe, đỗ xe không có tín hiệu báo cho người điều khiển phương tiện khác biết; c) không báo hiệu bằng đèn khẩn cấp hoặc không đặt biển cảnh báo “chú ý xe đỗ” theo quy định trong trường hợp gặp sự cố kỹ thuật (hoặc bất khả kháng khác) buộc phải đỗ xe chiếm một phần đường xe chạy hoặc tại nơi không được phép đỗ xe, trừ hành vi vi phạm quy định tại điểm c khoản 7 điều này; d) không gắn biển báo hiệu ở phía trước xe kéo, phía sau xe được kéo; điều khiển xe kéo rơ moóc không có biển báo hiệu theo quy định; đ) sử dụng còi trong thời gian từ 22 giờ ngày hôm trước đến 05 giờ ngày hôm sau trong khu đông dân cư, khu vực cơ sở khám bệnh, chữa bệnh, trừ các xe ưu tiên đang đi làm nhiệm vụ theo quy định. 2. phạt tiền từ 600.000 đồng đến 800.000 đồng đối với người điều khiển xe thực hiện một trong các hành vi vi phạm sau đây: a) chuyển làn đường không đúng nơi cho phép hoặc không có tín hiệu báo trước hoặc chuyển làn đường không đúng quy định “mỗi lần chuyển làn đường chỉ được phép chuyển sang một làn đường liền kề”, trừ các hành vi vi phạm quy định tại điểm g khoản 5 điều này; b) chở người trên buồng lái quá số lượng quy định; c) không tuân thủ các quy định về nhường đường tại nơi đường bộ giao nhau, trừ các hành vi vi phạm quy định tại điểm n, điểm o khoản 5 điều này; d) dừng xe, đỗ xe trên phần đường xe chạy ở đoạn đường ngoài đô thị nơi có lề đường rộng; dừng xe, đỗ xe không sát mép đường phía bên phải theo chiều đi ở nơi đường có lề đường hẹp hoặc không có lề đường; dừng xe, đỗ xe ngược với chiều lưu thông của làn đường; dừng xe, đỗ xe trên dải phân cách cố định ở giữa hai phần đường xe chạy; đỗ xe trên dốc không chèn bánh; đ) dừng xe không sát theo lề đường, vỉa hè phía bên phải theo chiều đi hoặc bánh xe gần nhất cách lề đường, vỉa hè quá 0,25 mét; dừng xe trên đường dành riêng cho xe buýt; dừng xe trên miệng cống thoát nước, miệng hầm của đường điện thoại, điện cao thế, chỗ dành riêng cho xe chữa cháy lấy nước; rời vị trí lái, tắt máy khi dừng xe (trừ trường hợp rời khỏi vị trí lái để đóng, mở cửa xe, xếp dỡ hàng hóa, kiểm tra kỹ thuật xe) hoặc rời vị trí lái khi dừng xe nhưng không sử dụng phanh đỗ xe (hoặc thực hiện biện pháp an toàn khác); dừng xe, đỗ xe không đúng vị trí quy định ở những đoạn có bố trí nơi dừng xe, đỗ xe; dừng xe, đỗ xe trên phần đường dành cho người đi bộ qua đường; dừng xe nơi có biển “cấm dừng xe và đỗ xe”, trừ hành vi vi phạm quy định tại điểm đ khoản 4, điểm c khoản 7 điều này. 3. phạt tiền từ 800.000 đồng đến 1.000.000 đồng đối với người điều khiển xe thực hiện một trong các hành vi vi phạm sau đây: a) điều khiển xe chạy quá tốc độ quy định từ 05 km/h đến dưới 10 km/h; b) sử dụng còi, rú ga liên tục; sử dụng còi hơi, sử dụng đèn chiếu xa khi gặp người đi bộ qua đường hoặc khi đi trên đoạn đường qua khu dân cư có hệ thống chiếu sáng đang hoạt động hoặc khi gặp xe đi ngược chiều (trừ trường hợp dải phân cách có khả năng chống chói) hoặc khi chuyển hướng xe tại nơi đường giao nhau, trừ các xe ưu tiên đang đi làm nhiệm vụ theo quy định; c) chuyển hướng không quan sát hoặc không bảo đảm khoảng cách an toàn với xe phía sau hoặc không giảm tốc độ hoặc không có tín hiệu báo hướng rẽ hoặc có tín hiệu báo hướng rẽ nhưng không sử dụng liên tục trong quá trình chuyển hướng (trừ trường hợp điều khiển xe đi theo hướng cong của đoạn đường bộ ở nơi đường không giao nhau cùng mức); d) không tuân thủ các quy định về dừng xe, đỗ xe tại nơi đường bộ giao nhau cùng mức với đường sắt; dừng xe, đỗ xe trong phạm vi bảo vệ công trình đường sắt, phạm vi an toàn của đường sắt; đ) dừng xe, đỗ xe tại vị trí: nơi đường bộ giao nhau hoặc trong phạm vi 05 mét tính từ mép đường giao nhau; điểm đón, trả khách; trước cổng hoặc trong phạm vi 05 mét hai bên cổng trụ sở cơ quan, tổ chức có bố trí đường cho xe ra, vào; nơi phần đường có bề rộng chỉ đủ cho một làn xe cơ giới; che khuất biển báo hiệu đường bộ, đèn tín hiệu giao thông; nơi mở dải phân cách giữa; cách xe ô tô đang đỗ ngược chiều dưới 20 mét trên đường phố hẹp, dưới 40 mét trên đường có một làn xe cơ giới trên một chiều đường; e) đỗ xe không sát theo lề đường, vỉa hè phía bên phải theo chiều đi hoặc bánh xe gần nhất cách lề đường, vỉa hè quá 0,25 mét; đỗ xe trên đường dành riêng cho xe buýt; đỗ xe trên miệng cống thoát nước, miệng hầm của đường điện thoại, điện cao thế, chỗ dành riêng cho xe chữa cháy lấy nước; đỗ, để xe ở vỉa hè trái quy định của pháp luật; đỗ xe nơi có biển “cấm đỗ xe” hoặc biển “cấm dừng xe và đỗ xe”, trừ hành vi vi phạm quy định tại điểm đ khoản 4, điểm c khoản 7 điều này; g) không sử dụng hoặc sử dụng không đủ đèn chiếu sáng trong thời gian từ 18 giờ ngày hôm trước đến 06 giờ ngày hôm sau hoặc khi có sương mù, khói, bụi, trời mưa, thời tiết xấu làm hạn chế tầm nhìn; h) điều khiển xe ô tô kéo theo xe khác, vật khác (trừ trường hợp kéo theo một rơ moóc, sơ mi rơ moóc hoặc một xe ô tô, xe máy chuyên dùng khác khi xe này không tự chạy được); điều khiển xe ô tô đẩy xe khác, vật khác; điều khiển xe kéo rơ moóc, sơ mi rơ moóc kéo thêm rơ moóc hoặc xe khác, vật khác; không nối chắc chắn, an toàn giữa xe kéo và xe được kéo khi kéo nhau; i) chở người trên xe được kéo, trừ người điều khiển; k) không thắt dây đai an toàn khi điều khiển xe chạy trên đường; l) chở người trên xe ô tô không thắt dây đai an toàn (tại vị trí có trang bị dây đai an toàn) khi xe đang chạy; m) chở trẻ em dưới 10 tuổi và chiều cao dưới 1,35 mét trên xe ô tô ngồi cùng hàng ghế với người lái xe (trừ loại xe ô tô chỉ có một hàng ghế) hoặc không sử dụng thiết bị an toàn phù hợp cho trẻ em theo quy định; n) chạy trong hầm đường bộ không sử dụng đèn chiếu sáng gần; o) điều khiển xe chạy dưới tốc độ tối thiểu trên đoạn đường bộ có quy định tốc độ tối thiểu cho phép; p) điều khiển xe chạy tốc độ thấp hơn các xe khác đi cùng chiều mà không đi về làn đường bên phải chiều đi của mình, trừ trường hợp các xe khác đi cùng chiều chạy quá tốc độ quy định. 4. phạt tiền từ 2.000.000 đồng đến 3.000.000 đồng đối với người điều khiển xe thực hiện một trong các hành vi vi phạm sau đây: a) điều khiển xe không đủ điều kiện đã thu phí theo hình thức điện tử tự động không dừng (xe không gắn thẻ đầu cuối) đi vào làn đường dành riêng thu phí theo hình thức điện tử tự động không dừng tại các trạm thu phí; b) dừng xe, đỗ xe tại vị trí: bên trái đường một chiều hoặc bên trái (theo hướng lưu thông) của đường đôi; trên đoạn đường cong hoặc gần đầu dốc nơi tầm nhìn bị che khuất; trên cầu (trừ trường hợp tổ chức giao thông cho phép), gầm cầu vượt (trừ những nơi cho phép dừng xe, đỗ xe), song song với một xe khác đang dừng, đỗ, trừ hành vi vi phạm quy định tại điểm c khoản 7 điều này; c) không thực hiện biện pháp bảo đảm an toàn theo quy định khi xe ô tô bị hư hỏng ngay tại nơi đường bộ giao nhau cùng mức với đường sắt; d) không nhường đường cho xe xin vượt khi có đủ điều kiện an toàn; đ) lùi xe, quay đầu xe trong hầm đường bộ; dừng xe, đỗ xe trong hầm đường bộ không đúng nơi quy định; không có báo hiệu bằng đèn khẩn cấp, không đặt biển cảnh báo ""chú ý xe đỗ"" (hoặc đèn cảnh báo) về phía sau xe khoảng cách đảm bảo an toàn khi dừng xe, đỗ xe trong hầm đường bộ trong trường hợp gặp sự cố kỹ thuật hoặc bất khả kháng khác buộc phải dừng xe, đỗ xe; e) lùi xe ở đường một chiều, đường có biển “cấm đi ngược chiều”, khu vực cấm dừng, trên phần đường dành cho người đi bộ qua đường, nơi đường bộ giao nhau, nơi đường bộ giao nhau cùng mức với đường sắt, nơi tầm nhìn bị che khuất; lùi xe không quan sát hai bên, phía sau xe hoặc không có tín hiệu lùi xe, trừ hành vi vi phạm quy định tại điểm đ khoản 11 điều này; g) điều khiển xe có liên quan trực tiếp đến vụ tai nạn giao thông mà không dừng ngay phương tiện, không giữ nguyên hiện trường, không trợ giúp người bị nạn, trừ hành vi vi phạm quy định tại khoản 8 điều này; h) xe được quyền ưu tiên lắp đặt, sử dụng thiết bị phát tín hiệu ưu tiên không đúng quy định hoặc sử dụng thiết bị phát tín hiệu ưu tiên mà không có giấy phép của cơ quan có thẩm quyền cấp hoặc có giấy phép của cơ quan có thẩm quyền cấp nhưng không còn giá trị sử dụng theo quy định; i) quay đầu xe ở phần đường dành cho người đi bộ qua đường, trên cầu, đầu cầu, gầm cầu vượt, ngầm, tại nơi đường bộ giao nhau cùng mức với đường sắt, đường hẹp, đường dốc, đoạn đường cong tầm nhìn bị che khuất, trên đường một chiều, trừ khi có hiệu lệnh của người điều khiển giao thông hoặc chỉ dẫn của biển báo hiệu tạm thời hoặc tổ chức giao thông tại những khu vực này có bố trí nơi quay đầu xe; k) quay đầu xe tại nơi có biển báo hiệu có nội dung cấm quay đầu đối với loại phương tiện đang điều khiển; điều khiển xe rẽ trái tại nơi có biển báo hiệu có nội dung cấm rẽ trái đối với loại phương tiện đang điều khiển; điều khiển xe rẽ phải tại nơi có biển báo hiệu có nội dung cấm rẽ phải đối với loại phương tiện đang điều khiển; l) không giữ khoảng cách an toàn để xảy ra va chạm với xe chạy liền trước hoặc không giữ khoảng cách theo quy định của biển báo hiệu “cự ly tối thiểu giữa hai xe”, trừ các hành vi vi phạm quy định tại điểm d khoản 5 điều này. 5. phạt tiền từ 4.000.000 đồng đến 6.000.000 đồng đối với người điều khiển xe thực hiện một trong các hành vi vi phạm sau đây: a) vượt xe trong những trường hợp không được vượt, vượt xe tại đoạn đường có biển báo hiệu có nội dung cấm vượt (đối với loại phương tiện đang điều khiển); không có tín hiệu trước khi vượt hoặc có tín hiệu vượt xe nhưng không sử dụng trong suốt quá trình vượt xe; vượt bên phải xe khác trong trường hợp không được phép; b) điều khiển xe không đi bên phải theo chiều đi của mình; đi không đúng phần đường hoặc làn đường quy định (làn cùng chiều hoặc làn ngược chiều) trừ hành vi quy định tại điểm a khoản 4 điều này; điều khiển xe đi qua dải phân cách cố định ở giữa hai phần đường xe chạy; c) tránh xe đi ngược chiều không đúng quy định (trừ hành vi vi phạm sử dụng đèn chiếu xa khi tránh xe đi ngược chiều quy định tại điểm b khoản 3 điều này); không nhường đường cho xe đi ngược chiều theo quy định tại nơi đường hẹp, đường dốc, nơi có chướng ngại vật; d) không tuân thủ quy định khi vào hoặc ra đường cao tốc; điều khiển xe chạy ở làn dừng xe khẩn cấp hoặc phần lề đường của đường cao tốc; không tuân thủ quy định về khoảng cách an toàn đối với xe chạy liền trước khi chạy trên đường cao tốc; đ) điều khiển xe chạy quá tốc độ quy định từ 10 km/h đến 20 km/h; e) xe không được quyền ưu tiên lắp đặt, sử dụng thiết bị phát tín hiệu của xe được quyền ưu tiên; g) chuyển làn đường không đúng nơi cho phép hoặc không có tín hiệu báo trước hoặc chuyển làn đường không đúng quy định “mỗi lần chuyển làn đường chỉ được phép chuyển sang một làn đường liền kề” khi chạy trên đường cao tốc; h) dùng tay cầm và sử dụng điện thoại hoặc các thiết bị điện tử khác khi điều khiển phương tiện tham gia giao thông đang di chuyển trên đường bộ; i) đi vào khu vực cấm, đường có biển báo hiệu có nội dung cấm đi vào đối với loại phương tiện đang điều khiển, trừ các hành vi vi phạm quy định tại điểm d khoản 9, điểm đ khoản 11 điều này, hành vi bị cấm đi vào công trình thủy lợi và các trường hợp xe ưu tiên đang đi làm nhiệm vụ khẩn cấp theo quy định; k) dừng xe, đỗ xe, quay đầu xe trái quy định gây ùn tắc giao thông; l) chuyển hướng không nhường quyền đi trước cho: người đi bộ, xe lăn của người khuyết tật qua đường tại nơi có vạch kẻ đường dành cho người đi bộ; xe thô sơ đang đi trên phần đường dành cho xe thô sơ; m) chuyển hướng không nhường đường cho: các xe đi ngược chiều; người đi bộ, xe thô sơ đang qua đường tại nơi không có vạch kẻ đường cho người đi bộ; n) không giảm tốc độ (hoặc dừng lại) và nhường đường khi điều khiển xe đi từ đường không ưu tiên ra đường ưu tiên, từ đường nhánh ra đường chính; o) không giảm tốc độ và nhường đường cho xe đi đến từ bên phải tại nơi đường giao nhau không có báo hiệu đi theo vòng xuyến; không giảm tốc độ và nhường đường cho xe đi đến từ bên trái tại nơi đường giao nhau có báo hiệu đi theo vòng xuyến; p) chở người trên thùng xe trái quy định; chở người trên nóc xe; để người đu bám ở cửa xe, bên ngoài thành xe khi xe đang chạy; q) mở cửa xe, để cửa xe mở không bảo đảm an toàn. 6. phạt tiền từ 6.000.000 đồng đến 8.000.000 đồng đối với người điều khiển xe thực hiện một trong các hành vi vi phạm sau đây: a) điều khiển xe chạy quá tốc độ quy định trên 20 km/h đến 35 km/h; b) không nhường đường hoặc gây cản trở xe được quyền ưu tiên đang phát tín hiệu ưu tiên đi làm nhiệm vụ; c) điều khiển xe trên đường mà trong máu hoặc hơi thở có nồng độ cồn nhưng chưa vượt quá 50 miligam/100 mililít máu hoặc chưa vượt quá 0,25 miligam/1 lít khí thở; d) điều khiển xe đi trên vỉa hè, trừ trường hợp điều khiển xe đi qua vỉa hè để vào nhà, cơ quan. 7. phạt tiền từ 12.000.000 đồng đến 14.000.000 đồng đối với người điều khiển xe thực hiện một trong các hành vi vi phạm sau đây: a) điều khiển xe chạy quá tốc độ quy định trên 35 km/h; b) điều khiển xe chở người bốn bánh có gắn động cơ, xe chở hàng bốn bánh có gắn động cơ đi vào đường cao tốc; c) dừng xe, đỗ xe trên đường cao tốc không đúng nơi quy định; không có báo hiệu bằng đèn khẩn cấp khi gặp sự cố kỹ thuật hoặc bất khả kháng khác buộc phải dừng xe, đỗ xe ở làn dừng xe khẩn cấp trên đường cao tốc; không có báo hiệu bằng đèn khẩn cấp, không đặt biển cảnh báo “chú ý xe đỗ” (hoặc đèn cảnh báo) về phía sau xe khoảng cách tối thiểu 150 mét khi dừng xe, đỗ xe trong trường hợp gặp sự cố kỹ thuật hoặc bất khả kháng khác buộc phải dừng xe, đỗ xe trên một phần làn đường xe chạy trên đường cao tốc. 8. phạt tiền từ 16.000.000 đồng đến 18.000.000 đồng đối với người điều khiển xe thực hiện hành vi vi phạm gây tai nạn giao thông không dừng ngay phương tiện, không giữ nguyên hiện trường, không trợ giúp người bị nạn, không ở lại hiện trường hoặc không đến trình báo ngay với cơ quan công an, ủy ban nhân dân nơi gần nhất. 9. phạt tiền từ 18.000.000 đồng đến 20.000.000 đồng đối với người điều khiển xe thực hiện một trong các hành vi vi phạm sau đây: a) điều khiển xe trên đường mà trong máu hoặc hơi thở có nồng độ cồn vượt quá 50 miligam đến 80 miligam/100 mililít máu hoặc vượt quá 0,25 miligam đến 0,4 miligam/1 lít khí thở; b) không chấp hành hiệu lệnh của đèn tín hiệu giao thông; c) không chấp hành hiệu lệnh, hướng dẫn của người điều khiển giao thông hoặc người kiểm soát giao thông; d) đi ngược chiều của đường một chiều, đi ngược chiều trên đường có biển ""cấm đi ngược chiều”, trừ các hành vi vi phạm quy định tại điểm đ khoản 11 điều này và các trường hợp xe ưu tiên đang đi làm nhiệm vụ khẩn cấp theo quy định. 10. phạt tiền từ 20.000.000 đồng đến 22.000.000 đồng đối với người điều khiển xe thực hiện một trong các hành vi vi phạm sau đây: a) điều khiển xe không quan sát, giảm tốc độ hoặc dừng lại để bảo đảm an toàn theo quy định mà gây tai nạn giao thông; điều khiển xe chạy quá tốc độ quy định gây tai nạn giao thông; dừng xe, đỗ xe, quay đầu xe, lùi xe, tránh xe, vượt xe, chuyển hướng, chuyển làn đường không đúng quy định gây tai nạn giao thông; không đi đúng phần đường, làn đường, không giữ khoảng cách an toàn giữa hai xe theo quy định gây tai nạn giao thông hoặc đi vào đường có biển báo hiệu có nội dung cấm đi vào đối với loại phương tiện đang điều khiển gây tai nạn giao thông, trừ các hành vi vi phạm quy định tại điểm đ khoản 11 điều này; b) vi phạm quy định tại một trong các điểm, khoản sau của điều này mà gây tai nạn giao thông: điểm a, điểm b, điểm c, điểm d, điểm đ khoản 1; điểm c khoản 2; điểm b, điểm g, điểm h, điểm n, điểm o, điểm p, khoản 3; điểm a, điểm c, điểm d khoản 4; điểm c, điểm d, điểm e, điểm h, điểm n, điểm o, điểm q khoản 5; điểm b khoản 7; điểm b, điểm c, điểm d khoản 9 điều này. 11. phạt tiền từ 30.000.000 đồng đến 40.000.000 đồng đối với người điều khiển xe thực hiện một trong các hành vi vi phạm sau đây: a) điều khiển xe trên đường mà trong máu hoặc hơi thở có nồng độ cồn vượt quá 80 miligam/100 mililít máu hoặc vượt quá 0,4 miligam/1 lít khí thở; b) không chấp hành yêu cầu kiểm tra về nồng độ cồn của người thi hành công vụ; c) điều khiển xe trên đường mà trong cơ thể có chất ma túy hoặc chất kích thích khác mà pháp luật cấm sử dụng; d) không chấp hành yêu cầu kiểm tra về chất ma túy hoặc chất kích thích khác mà pháp luật cấm sử dụng của người thi hành công vụ; đ) điều khiển xe đi ngược chiều trên đường cao tốc, lùi xe trên đường cao tốc, quay đầu xe trên đường cao tốc, trừ các xe ưu tiên đang đi làm nhiệm vụ khẩn cấp theo quy định. 12. phạt tiền từ 40.000.000 đồng đến 50.000.000 đồng đối với người điều khiển xe thực hiện hành vi điều khiển xe lạng lách, đánh võng trên đường bộ; chạy quá tốc độ đuổi nhau trên đường bộ; dùng chân điều khiển vô lăng xe khi xe đang chạy trên đường bộ. 13. phạt tiền từ 50.000.000 đồng đến 70.000.000 đồng đối với người điều khiển xe thực hiện hành vi vi phạm quy định tại khoản 12 điều này mà gây tai nạn giao thông. 14. tịch thu phương tiện đối với người điều khiển xe tái phạm hành vi điều khiển xe lạng lách, đánh võng quy định tại khoản 12 điều này. 15. ngoài việc bị phạt tiền, người điều khiển xe thực hiện hành vi vi phạm còn bị áp dụng các hình thức xử phạt bổ sung sau đây: a) thực hiện hành vi quy định tại điểm e khoản 5 điều này còn bị tịch thu thiết bị phát tín hiệu ưu tiên lắp đặt, sử dụng trái quy định; b) thực hiện hành vi quy định tại khoản 12 điều này bị tước quyền sử dụng giấy phép lái xe từ 10 tháng đến 12 tháng; c) thực hiện hành vi quy định tại điểm a, điểm b, điểm c, điểm d khoản 11; khoản 13; khoản 14 điều này bị tước quyền sử dụng giấy phép lái xe từ 22 tháng đến 24 tháng. 16. ngoài việc bị áp dụng hình thức xử phạt, người điều khiển xe thực hiện hành vi vi phạm còn bị trừ điểm giấy phép lái xe như sau: a) thực hiện hành vi quy định tại điểm h, điểm i khoản 3; điểm a, điểm b, điểm c, điểm d, điểm đ, điểm g khoản 4; điểm a, điểm b, điểm c, điểm d, điểm đ, điểm e, điểm g, điểm i, điểm k, điểm n, điểm o khoản 5 điều này bị trừ điểm giấy phép lái xe 02 điểm; b) thực hiện hành vi quy định tại điểm h khoản 5; khoản 6; điểm b khoản 7; điểm b, điểm c, điểm d khoản 9 điều này bị trừ điểm giấy phép lái xe 04 điểm; c) thực hiện hành vi quy định tại điểm p khoản 5; điểm a, điểm c khoản 7; khoản 8 điều này bị trừ điểm giấy phép lái xe 06 điểm; d) thực hiện hành vi quy định tại điểm a khoản 9, khoản 10, điểm đ khoản 11 điều này bị trừ điểm giấy phép lái xe 10 điểm.', '1. phạt tiền từ 200.000 đồng đến 400.000 đồng đối với người điều khiển xe thực hiện một trong các hành vi vi phạm sau đây: a) không chấp hành hiệu lệnh, chỉ dẫn của biển báo hiệu, vạch kẻ đường, trừ các hành vi vi phạm quy định tại điểm b, điểm d, điểm e khoản 2; điểm a, điểm c, điểm d, điểm h khoản 3; điểm a, điểm b, điểm c, điểm d khoản 4; điểm b, điểm d khoản 6; điểm a, điểm b, điểm c khoản 7; điểm a khoản 8; điểm b khoản 9; điểm a khoản 10 điều này; b) không có tín hiệu trước khi vượt hoặc có tín hiệu vượt xe nhưng không sử dụng trong suốt quá trình vượt xe; c) lùi xe mô tô ba bánh không quan sát hai bên, phía sau xe hoặc không có tín hiệu lùi xe; d) chở người ngồi trên xe sử dụng ô (dù); đ) không tuân thủ các quy định về nhường đường tại nơi đường giao nhau, trừ các hành vi vi phạm quy định tại điểm c, điểm d khoản 6 điều này; e) chuyển làn đường không đúng nơi cho phép hoặc không có tín hiệu báo trước hoặc chuyển làn đường không đúng quy định “mỗi lần chuyển làn đường chỉ được phép chuyển sang một làn đường liền kề”; g) không sử dụng đèn chiếu sáng trong thời gian từ 18 giờ ngày hôm trước đến 06 giờ ngày hôm sau hoặc khi có sương mù, khói, bụi, trời mưa, thời tiết xấu làm hạn chế tầm nhìn; h) tránh xe không đúng quy định; sử dụng đèn chiếu xa khi gặp người đi bộ qua đường hoặc khi đi trên đoạn đường qua khu dân cư có hệ thống chiếu sáng đang hoạt động hoặc khi gặp xe đi ngược chiều (trừ trường hợp dải phân cách có khả năng chống chói) hoặc khi chuyển hướng xe tại nơi đường giao nhau; không nhường đường cho xe đi ngược chiều theo quy định tại nơi đường hẹp, đường dốc, nơi có chướng ngại vật; i) sử dụng còi trong thời gian từ 22 giờ ngày hôm trước đến 05 giờ ngày hôm sau trong khu đông dân cư, khu vực cơ sở khám bệnh, chữa bệnh, trừ các xe ưu tiên đang đi làm nhiệm vụ theo quy định; k) điều khiển xe chạy dưới tốc độ tối thiểu trên đoạn đường bộ có quy định tốc độ tối thiểu cho phép. 2. phạt tiền từ 400.000 đồng đến 600.000 đồng đối với người điều khiển xe thực hiện một trong các hành vi vi phạm sau đây: a) dừng xe, đỗ xe trên phần đường xe chạy ở đoạn đường ngoài đô thị nơi có lề đường; b) điều khiển xe chạy quá tốc độ quy định từ 05 km/h đến dưới 10 km/h; c) điều khiển xe chạy tốc độ thấp mà không đi bên phải phần đường xe chạy gây cản trở giao thông; d) dừng xe, đỗ xe ở lòng đường gây cản trở giao thông; tụ tập từ 03 xe trở lên ở lòng đường, trong hầm đường bộ; đỗ, để xe ở lòng đường, vỉa hè trái phép; đ) xe không được quyền ưu tiên lắp đặt, sử dụng thiết bị phát tín hiệu của xe được quyền ưu tiên; e) dừng xe, đỗ xe trên điểm đón, trả khách, nơi đường bộ giao nhau, trên phần đường dành cho người đi bộ qua đường; dừng xe nơi có biển “cấm dừng xe và đỗ xe”; đỗ xe tại nơi có biển “cấm đỗ xe” hoặc biển “cấm dừng xe và đỗ xe”; không tuân thủ các quy định về dừng xe, đỗ xe tại nơi đường bộ giao nhau cùng mức với đường sắt; dừng xe, đỗ xe trong phạm vi hành lang an toàn giao thông đường sắt; g) chở theo 02 người trên xe, trừ trường hợp chở người bệnh đi cấp cứu, trẻ em dưới 12 tuổi, người già yếu hoặc người khuyết tật, áp giải người có hành vi vi phạm pháp luật; h) không đội “mũ bảo hiểm cho người đi mô tô, xe máy” hoặc đội “mũ bảo hiểm cho người đi mô tô, xe máy” không cài quai đúng quy cách khi điều khiển xe tham gia giao thông trên đường bộ; i) chở người ngồi trên xe không đội “mũ bảo hiểm cho người đi mô tô, xe máy” hoặc đội “mũ bảo hiểm cho người đi mô tô, xe máy” không cài quai đúng quy cách, trừ trường hợp chở người bệnh đi cấp cứu, trẻ em dưới 06 tuổi, áp giải người có hành vi vi phạm pháp luật; k) quay đầu xe tại nơi không được quay đầu xe, trừ hành vi vi phạm quy định tại điểm d khoản 4 điều này. 3. phạt tiền từ 600.000 đồng đến 800.000 đồng đối với người điều khiển xe thực hiện một trong các hành vi vi phạm sau đây: a) chuyển hướng không quan sát hoặc không bảo đảm khoảng cách an toàn với xe phía sau hoặc không giảm tốc độ hoặc không có tín hiệu báo hướng rẽ hoặc có tín hiệu báo hướng rẽ nhưng không sử dụng liên tục trong quá trình chuyển hướng (trừ trường hợp điều khiển xe đi theo hướng cong của đoạn đường bộ ở nơi đường không giao nhau cùng mức); điều khiển xe rẽ trái tại nơi có biển báo hiệu có nội dung cấm rẽ trái đối với loại phương tiện đang điều khiển; điều khiển xe rẽ phải tại nơi có biển báo hiệu có nội dung cấm rẽ phải đối với loại phương tiện đang điều khiển; b) chở theo từ 03 người trở lên trên xe; c) dừng xe, đỗ xe trên cầu; d) điều khiển xe không đi bên phải theo chiều đi của mình; đi không đúng phần đường, làn đường quy định (làn cùng chiều hoặc làn ngược chiều); điều khiển xe đi qua dải phân cách cố định ở giữa hai phần đường xe chạy; đ) vượt bên phải trong trường hợp không được phép; e) người đang điều khiển xe hoặc chở người ngồi trên xe bám, kéo, đẩy xe khác, vật khác, dẫn dắt vật nuôi, mang vác vật cồng kềnh; chở người đứng trên yên, giá đèo hàng hoặc ngồi trên tay lái của xe; g) điều khiển xe kéo theo xe khác, vật khác; h) chạy trong hầm đường bộ không sử dụng đèn chiếu sáng gần; i) không giữ khoảng cách an toàn để xảy ra va chạm với xe chạy liền trước hoặc không giữ khoảng cách theo quy định của biển báo hiệu “cự ly tối thiểu giữa hai xe”; k) điều khiển xe chạy dàn hàng ngang từ 03 xe trở lên; l) xe được quyền ưu tiên lắp đặt, sử dụng thiết bị phát tín hiệu ưu tiên không đúng quy định hoặc sử dụng thiết bị phát tín hiệu ưu tiên mà không có giấy phép của cơ quan có thẩm quyền cấp hoặc có giấy phép của cơ quan có thẩm quyền cấp nhưng không còn giá trị sử dụng theo quy định. 4. phạt tiền từ 800.000 đồng đến 1.000.000 đồng đối với người điều khiển xe thực hiện một trong các hành vi vi phạm sau đây: a) điều khiển xe chạy quá tốc độ quy định từ 10 km/h đến 20 km/h; b) dừng xe, đỗ xe trong hầm đường bộ không đúng nơi quy định; c) vượt xe trong những trường hợp không được vượt, vượt xe tại đoạn đường có biển báo hiệu có nội dung cấm vượt đối với loại phương tiện đang điều khiển, trừ các hành vi vi phạm quy định tại điểm đ khoản 3 điều này; d) quay đầu xe trong hầm đường bộ; đ) người đang điều khiển xe sử dụng ô (dù), thiết bị âm thanh (trừ thiết bị trợ thính), dùng tay cầm và sử dụng điện thoại hoặc các thiết bị điện tử khác. 5. phạt tiền từ 1.000.000 đồng đến 2.000.000 đồng đối với người điều khiển xe thực hiện một trong các hành vi vi phạm sau đây: a) điều khiển xe có liên quan trực tiếp đến vụ tai nạn giao thông mà không dừng ngay phương tiện, không giữ nguyên hiện trường, không trợ giúp người bị nạn, trừ hành vi vi phạm quy định tại điểm c khoản 9 điều này; b) chuyển hướng không nhường quyền đi trước cho: người đi bộ, xe lăn của người khuyết tật qua đường tại nơi có vạch kẻ đường dành cho người đi bộ; xe thô sơ đang đi trên phần đường dành cho xe thô sơ; c) chuyển hướng không nhường đường cho: các xe đi ngược chiều; người đi bộ, xe thô sơ đang qua đường tại nơi không có vạch kẻ đường cho người đi bộ. 6. phạt tiền từ 2.000.000 đồng đến 3.000.000 đồng đối với người điều khiển xe thực hiện một trong các hành vi vi phạm sau đây: a) điều khiển xe trên đường mà trong máu hoặc hơi thở có nồng độ cồn nhưng chưa vượt quá 50 miligam/100 mililít máu hoặc chưa vượt quá 0,25 miligam/1 lít khí thở; b) đi vào khu vực cấm, đường có biển báo hiệu có nội dung cấm đi vào đối với loại phương tiện đang điều khiển, trừ các hành vi vi phạm quy định tại điểm a, điểm b khoản 7 điều này và các trường hợp xe ưu tiên đang đi làm nhiệm vụ khẩn cấp theo quy định; c) không giảm tốc độ (hoặc dừng lại) và nhường đường khi điều khiển xe đi từ đường không ưu tiên ra đường ưu tiên, từ đường nhánh ra đường chính; d) không giảm tốc độ và nhường đường cho xe đi đến từ bên phải tại nơi đường giao nhau không có báo hiệu đi theo vòng xuyến; không giảm tốc độ và nhường đường cho xe đi đến từ bên trái tại nơi đường giao nhau có báo hiệu đi theo vòng xuyến. 7. phạt tiền từ 4.000.000 đồng đến 6.000.000 đồng đối với người điều khiển xe thực hiện một trong các hành vi vi phạm sau đây: a) đi ngược chiều của đường một chiều, đi ngược chiều trên đường có biển “cấm đi ngược chiều”, trừ hành vi vi phạm quy định tại điểm b khoản này và các trường hợp xe ưu tiên đang đi làm nhiệm vụ khẩn cấp theo quy định; điều khiển xe đi trên vỉa hè, trừ trường hợp điều khiển xe đi qua vỉa hè để vào nhà, cơ quan; b) điều khiển xe đi vào đường cao tốc, trừ xe phục vụ việc quản lý, bảo trì đường cao tốc; c) không chấp hành hiệu lệnh của đèn tín hiệu giao thông; d) không chấp hành hiệu lệnh, hướng dẫn của người điều khiển giao thông hoặc người kiểm soát giao thông; đ) không nhường đường hoặc gây cản trở xe được quyền ưu tiên đang phát tín hiệu ưu tiên đi làm nhiệm vụ. 8. phạt tiền từ 6.000.000 đồng đến 8.000.000 đồng đối với người điều khiển xe thực hiện một trong các hành vi vi phạm sau đây: a) điều khiển xe chạy quá tốc độ quy định trên 20 km/h; b) điều khiển xe trên đường mà trong máu hoặc hơi thở có nồng độ cồn vượt quá 50 miligam đến 80 miligam/100 mililít máu hoặc vượt quá 0,25 miligam đến 0,4 miligam/1 lít khí thở. 9. phạt tiền từ 8.000.000 đồng đến 10.000.000 đồng đối với người điều khiển xe thực hiện một trong các hành vi vi phạm sau đây: a) điều khiển xe lạng lách, đánh võng trên đường bộ; sử dụng chân chống hoặc vật khác quệt xuống đường khi xe đang chạy; b) điều khiển xe thành nhóm từ 02 xe trở lên chạy quá tốc độ quy định; c) gây tai nạn giao thông không dừng ngay phương tiện, không giữ nguyên hiện trường, không trợ giúp người bị nạn, không ở lại hiện trường hoặc không đến trình báo ngay với cơ quan công an, ủy ban nhân dân nơi gần nhất; d) điều khiển xe trên đường mà trong máu hoặc hơi thở có nồng độ cồn vượt quá 80 miligam/100 mililít máu hoặc vượt quá 0,4 miligam/1 lít khí thở; đ) không chấp hành yêu cầu kiểm tra về nồng độ cồn của người thi hành công vụ; e) điều khiển xe trên đường mà trong cơ thể có chất ma túy hoặc chất kích thích khác mà pháp luật cấm sử dụng; g) không chấp hành yêu cầu kiểm tra về chất ma túy hoặc chất kích thích khác mà pháp luật cấm sử dụng của người thi hành công vụ; h) ngồi phía sau vòng tay qua người ngồi trước để điều khiển xe, trừ trường hợp chở trẻ em dưới 06 tuổi ngồi phía trước; i) điều khiển xe thành đoàn gây cản trở giao thông, trừ trường hợp được cơ quan có thẩm quyền cấp phép; k) sử dụng còi, rú ga (nẹt pô) liên tục trong khu đông dân cư, khu vực cơ sở khám bệnh, chữa bệnh, trừ các xe ưu tiên đang đi làm nhiệm vụ theo quy định. 10. phạt tiền từ 10.000.000 đồng đến 14.000.000 đồng đối với người điều khiển xe thực hiện một trong các hành vi vi phạm sau đây: a) điều khiển xe không quan sát, giảm tốc độ hoặc dừng lại để bảo đảm an toàn theo quy định mà gây tai nạn giao thông; điều khiển xe chạy quá tốc độ quy định gây tai nạn giao thông; đi vào đường cao tốc, dừng xe, đỗ xe, quay đầu xe, lùi xe, vượt xe, chuyển hướng, chuyển làn đường không đúng quy định gây tai nạn giao thông; không đi đúng phần đường, làn đường, không giữ khoảng cách an toàn giữa hai xe theo quy định gây tai nạn giao thông hoặc đi vào đường có biển báo hiệu có nội dung cấm đi vào đối với loại phương tiện đang điều khiển, đi ngược chiều của đường một chiều, đi ngược chiều trên đường có biển “cấm đi ngược chiều” gây tai nạn giao thông; b) vi phạm quy định tại một trong các điểm, khoản sau của điều này mà gây tai nạn giao thông: điểm a, điểm d, điểm đ, điểm g, điểm h, điểm i, điểm k khoản 1; điểm c, điểm đ, điểm g khoản 2; điểm b, điểm e, điểm g, điểm h, điểm k khoản 3; điểm đ khoản 4; điểm c, điểm d khoản 6; điểm c, điểm d, điểm đ khoản 7; điểm a, điểm b, điểm h, điểm k khoản 9 điều này. 11. tịch thu phương tiện đối với người điều khiển xe thực hiện một trong các hành vi vi phạm sau đây: a) buông cả hai tay khi đang điều khiển xe; dùng chân điều khiển xe; ngồi về một bên điều khiển xe; nằm trên yên xe điều khiển xe; thay người điều khiển khi xe đang chạy; quay người về phía sau để điều khiển xe hoặc bịt mắt điều khiển xe; b) điều khiển xe chạy bằng một bánh đối với xe hai bánh, chạy bằng hai bánh đối với xe ba bánh; c) tái phạm hành vi điều khiển xe lạng lách, đánh võng quy định tại điểm a khoản 9 điều này. 12. ngoài việc bị áp dụng hình thức xử phạt chính, người điều khiển xe thực hiện hành vi vi phạm còn bị áp dụng các hình thức xử phạt bổ sung sau đây: a) thực hiện hành vi quy định tại điểm đ khoản 2 điều này còn bị tịch thu thiết bị phát tín hiệu ưu tiên lắp đặt, sử dụng trái quy định; b) thực hiện hành vi quy định tại điểm a, điểm b, điểm h, điểm i, điểm k khoản 9 điều này bị tước quyền sử dụng giấy phép lái xe từ 10 tháng đến 12 tháng; c) thực hiện hành vi quy định tại điểm d, điểm đ, điểm e, điểm g khoản 9; khoản 11 điều này bị tước quyền sử dụng giấy phép lái xe từ 22 tháng đến 24 tháng. 13. ngoài việc bị áp dụng hình thức xử phạt, người điều khiển xe thực hiện hành vi vi phạm còn bị trừ điểm giấy phép lái xe như sau: a) thực hiện hành vi quy định tại điểm b khoản 3; khoản 5; điểm b, điểm c, điểm d khoản 6; điểm a khoản 7 điều này bị trừ điểm giấy phép lái xe 02 điểm; b) thực hiện hành vi quy định tại điểm đ khoản 4; điểm a khoản 6; điểm c, điểm d, điểm đ khoản 7; điểm a khoản 8 điều này bị trừ điểm giấy phép lái xe 04 điểm; c) thực hiện hành vi quy định tại điểm b khoản 7, điểm c khoản 9 điều này bị trừ điểm giấy phép lái xe 06 điểm; d) thực hiện hành vi quy định tại điểm b khoản 8, khoản 10 điều này bị trừ điểm giấy phép lái xe 10 điểm.', '1. tổ chức giao thông được thực hiện từ giai đoạn quy hoạch, đầu tư, xây dựng đến giai đoạn quản lý, vận hành, khai thác, sử dụng, bảo trì kết cấu hạ tầng đường bộ nhằm bảo đảm giao thông thông suốt, an toàn, hiệu quả. 2. nội dung tổ chức giao thông đường bộ trong giai đoạn thiết kế, thi công xây dựng, quản lý, vận hành, khai thác, sử dụng, bảo trì công trình đường bộ bao gồm: a) quy định số làn đường, phần đường dành cho xe ô tô và các phương tiện tham gia giao thông đường bộ khác, phần đường dành cho người đi bộ; chiều đi, tốc độ các phương tiện cơ giới tham gia giao thông đường bộ; b) tổ chức phân làn, phân luồng trên tuyến đường đang đầu tư xây dựng và tại các tuyến đường bộ kết nối; c) quy định giao thông tại các nút giao, vị trí đấu nối với đường khác; quy định về tránh, vượt xe trên đường, các điểm được phép dừng xe, đỗ xe trên đường, vị trí đón, trả khách; d) quy định khổ giới hạn và tải trọng cho phép phương tiện tham gia giao thông đường bộ an toàn; đ) quy định thời gian cho phép tham gia giao thông; thời gian cho phép đi theo các hướng của đèn tín hiệu giao thông; e) quy định thời gian bật, tắt hệ thống chiếu sáng trên đường; g) quy định về các trường hợp tạm dừng khai thác một phần hoặc toàn bộ tuyến đường; h) khai thác, sử dụng hệ thống quản lý giao thông thông minh, trung tâm quản lý, điều hành giao thông tuyến đường cao tốc và các thiết bị công nghệ khác phục vụ cung cấp thông tin, chỉ dẫn cho người tham gia giao thông đường bộ; i) lắp đặt đầy đủ hệ thống báo hiệu đường bộ và thực hiện các công việc cần thiết khác; k) phê duyệt phương án tổ chức giao thông đối với đường cao tốc. 3. chủ đầu tư dự án đầu tư xây dựng công trình đường bộ, người quản lý, sử dụng đường bộ, tổ chức, cá nhân liên quan có trách nhiệm lắp đặt, điều chỉnh, bổ sung đầy đủ báo hiệu đường bộ, công trình an toàn giao thông đường bộ đối với dự án và tuyến đường thuộc phạm vi quản lý; thực hiện phương án tổ chức giao thông đường cao tốc được phê duyệt. 4. việc theo dõi, đánh giá tình hình giao thông trên tuyến đường, điều chỉnh tổ chức giao thông để khắc phục tình trạng ùn tắc giao thông, bảo đảm trật tự, an toàn giao thông đường bộ được thực hiện trong quá trình vận hành, khai thác, sử dụng, bảo trì đường bộ. 5. bộ giao thông vận tải, ủy ban nhân dân các cấp chịu trách nhiệm tổ chức giao thông trên các tuyến đường bộ thuộc phạm vi quản lý. 6. người quản lý, sử dụng đường bộ đối với đường chuyên dùng chịu trách nhiệm tổ chức giao thông trên đường chuyên dùng; trường hợp đường chuyên dùng có hoạt động giao thông công cộng thì phải tổ chức giao thông theo quy định của điều này. 7. chính phủ quy định chi tiết điều này.', '1. tuân thủ và duy trì các điều kiện kinh doanh đối với xe buýt trong quá trình hoạt động kinh doanh vận tải hành khách công cộng bằng xe buýt. 2. trên xe phải trang bị dụng cụ thoát hiểm; việc đảm bảo điều kiện an toàn về phòng cháy và chữa cháy thực hiện theo quy định tại khoản 4 điều 8 thông tư này. 3. niêm yết thông tin a) niêm yết bên ngoài xe phía trên kính trước và sau xe: số hiệu tuyến hoặc mã số tuyến, điểm đầu, điểm cuối của tuyến; chiều cao chữ tối thiểu 06 cm; hai bên thành xe: số hiệu tuyến hoặc mã số tuyến, số điện thoại của đơn vị kinh doanh vận tải với kích thước tối thiểu: chiều dài là 20 cm, chiều rộng là 20 cm; giá vé (giá cước) đã kê khai theo mẫu quy định tại phụ lục iii ban hành kèm theo thông tư này; b) niêm yết bên trong xe: biển số đăng ký xe (biển kiểm soát xe), số hiệu tuyến hoặc mã số tuyến; sơ đồ vị trí điểm đầu, điểm cuối và các điểm dừng dọc tuyến; giá vé (giá cước) đã kê khai theo mẫu quy định tại phụ lục iii ban hành kèm theo thông tư này; số điện thoại đường dây nóng của đơn vị kinh doanh vận tải và sở giao thông vận tải địa phương; trách nhiệm của người lái xe, nhân viên phục vụ trên xe và hành khách; c) bên trong xe có bảng hướng dẫn về an toàn giao thông và thoát hiểm ở vị trí hành khách dễ quan sát, các nội dung chính gồm: hướng dẫn cài dây an toàn (nếu có); hướng dẫn sắp xếp hành lý; biển cấm hút thuốc trên xe; hướng dẫn sử dụng hệ thống điện trên xe (nếu có); hướng dẫn cách sử dụng bình cứu hỏa, búa thoát hiểm và hướng thoát hiểm khi xảy ra sự cố.']","**Nguồn văn bản:** 168_2024_ND-CP_619502

**Tên văn bản:** Nghị định Quy định xử phạt vi phạm hành chính về trật tự, an toàn giao thông trong lĩnh vực giao thông đường bộ; trừ điểm, phục hồi điểm giấy phép lái xe

**Điều 5:**  hành vi sử dụng tay cầm và sử dụng điện thoại hoặc các thiết bị điện tử khác khi điều khiển phương tiện tham gia giao thông đang di chuyển trên đường bộ.

**Nội dung:**

Phạt tiền từ 4.000.000 đồng đến 6.000.000 đồng đối với người điều khiển xe thực hiện một trong các hành vi vi phạm sau đây:

h) Dùng tay cầm và sử dụng điện thoại hoặc các thiết bị điện tử khác khi điều khiển phương tiện tham gia giao thông đang di chuyển trên đường bộ;


Tóm lại:  Việc sử dụng tay cầm và điện thoại hoặc các thiết bị điện tử khác khi lái xe đang di chuyển bị phạt tiền từ 4.000.000 đồng đến 6.000.000 đồng.
",Luật cấm sử dụng điện thoại di động khi đang điều khiển phương tiện giao thông.,0.5,0.5130244755170882,1.0,0.49999999995
14,Quy định mới về tốc độ tối đa trong khu vực đô thị là gì?,"['1. tốc độ thiết kế của đường bộ là giá trị vận tốc được dùng để tính toán các chỉ tiêu kỹ thuật của đường bộ. tốc độ thiết kế của đường bộ được xác định trong giai đoạn đầu tư xây dựng, nâng cấp, cải tạo đường bộ nhằm bảo đảm cho phương tiện di chuyển an toàn; được quyết định theo cấp kỹ thuật của đường bộ và điều kiện địa hình. 2. tốc độ thiết kế đường bộ cao tốc là giá trị vận tốc được dùng để tính toán các chỉ tiêu kỹ thuật của đường bộ cao tốc, được xác định theo cấp đường cao tốc. khi thiết kế đường bộ cao tốc có thể áp dụng tốc độ thiết kế khác nhau theo từng đoạn nhưng phải bảo đảm các yêu cầu về chiều dài đoạn chuyển tiếp và tốc độ thiết kế trung gian giữa các đoạn. tốc độ thiết kế đường bộ cao tốc được xác định theo quy chuẩn kỹ thuật quốc gia về đường bộ cao tốc qcvn 115:2024/bgtvt. 3. tốc độ thiết kế đường bộ được xác định theo tiêu chuẩn quốc gia tcvn 4054: 2005 đường ô tô - yêu cầu thiết kế. 4. tốc độ thiết kế đường bộ trong phạm vi đô thị được xác định theo quy chuẩn kỹ thuật quốc gia về hệ thống công trình hạ tầng kỹ thuật qcvn 07-4:2023/bxd. 5. tốc độ thiết kế đường giao thông nông thôn được xác định theo tiêu chuẩn quốc gia tcvn 10380:2014 đường giao thông nông thôn - yêu cầu thiết kế.', '1. thông tư này có hiệu lực thi hành kể từ ngày 01 tháng 01 năm 2025. 2. thông tư này thay thế thông tư số 06/2024/tt-bgtvt ngày 31 tháng 3 năm 2024 của bộ trưởng bộ giao thông vận tải ban hành quy chuẩn kỹ thuật quốc gia về đường bộ cao tốc qcvn 115:2024./. qcvn 117:2024/bgtvt quy chuẩn kỹ thuật quốc gia về đường bộ cao tốc national technical regulation on expressway lời nói đầu qcvn 117:2024/bgtvt “quy chuẩn kỹ thuật quốc gia về đường bộ cao tốc” do cục đường cao tốc việt nam chủ trì biên soạn, vụ khoa học - công nghệ và môi trường trình duyệt, bộ khoa học và công nghệ thẩm định, bộ trưởng bộ giao thông vận tải ban hành theo thông tư số 57/2024/tt-bgtvt ngày 15 tháng 11 năm 2024. quy chuẩn này thay thế quy chuẩn qcvn 115:2024/bgtvt - quy chuẩn kỹ thuật quốc gia về đường bộ cao tốc (ban hành kèm theo thông tư số 06/2024/tt- bgtvt ngày 31 tháng 3 năm 2024 của bộ trưởng bộ giao thông vận tải). mục lục 1. quy định chung 2. quy định kỹ thuật 3. tổ chức thực hiện quy chuẩn kỹ thuật quốc gia về đường bộ cao tốc national technical regulation on expressway 1. quy định chung 1.1. phạm vi điều chỉnh quy chuẩn này quy định các yêu cầu kỹ thuật trong đầu tư xây dựng, quản lý, vận hành, khai thác và bảo trì đường bộ cao tốc (trừ đường cao tốc đô thị). 1.2. đối tượng áp dụng quy chuẩn này áp dụng đối với các tổ chức, cá nhân có liên quan đến hoạt động đầu tư xây dựng, quản lý, vận hành khai thác và bảo trì đường bộ cao tốc. 1.3. giải thích từ ngữ trong quy chuẩn này, các từ ngữ dưới đây được hiểu như sau: 1.3.1. làn dừng xe khẩn cấp làn dừng xe khẩn cấp là làn được thiết kế để làm nơi dừng đỗ khẩn cấp của các phương tiện gặp sự cố, để các phương tiện cứu hộ, cứu nạn hoạt động; các phương tiện khác không được chạy xe hoặc dừng xe ở làn dừng xe khẩn cấp, trừ xe ưu tiên. 1.3.2. lưu lượng xe thiết kế lưu lượng xe thiết kế là số xe con được quy đổi từ các loại xe khác, thông qua một mặt cắt trong một đơn vị thời gian, tính cho năm tương lai. 1.3.3. năm tương lai năm tương lai là năm thứ 20 kể từ năm dự kiến hoàn thành đường bộ cao tốc đưa vào khai thác. 1.4. tốc độ thiết kế đường bộ cao tốc tốc độ thiết kế đường bộ cao tốc được phân làm 03 cấp như sau: cấp 120 có tốc độ thiết kế là 120 km/h; cấp 100 có tốc độ thiết kế là 100 km/h; cấp 80 có tốc độ thiết kế là 80 km/h; đối với vị trí địa hình đặc biệt phức tạp, yếu tố quốc phòng an ninh, cho phép áp dụng tốc độ thiết kế 60 km/h. trên đường bộ cao tốc có thể có những đoạn áp dụng cấp khác nhau, nhưng đoạn này phải dài từ 15 km trở lên và tốc độ thiết kế của hai đoạn liên tiếp không được chênh nhau quá 20 km/h. trường hợp đường bộ cao tốc áp dụng cấp tốc độ thiết kế quá một cấp (20 km/h), phải có một đoạn quá độ dài ít nhất 02 km có cấp tốc độ thiết kế trung gian. 1.5. tài liệu viện dẫn các tài liệu được viện dẫn trong quy chuẩn này bao gồm: - qcvn 41:2024/bgtvt\xa0 “quy chuẩn kỹ thuật quốc gia về báo hiệu đường bộ’’. - qcvn 43:2024/bgtvt\xa0 “quy chuẩn kỹ thuật quốc gia về trạm dừng nghỉ đường bộ”. - qcvn 07-4: 2023/bxd\xa0 “quy chuẩn kỹ thuật quốc gia về hệ thống công trình hạ tầng kỹ thuật - công trình giao thông đô thị"". - qcvn 116:2024/bgtvt\xa0 “quy chuẩn kỹ thuật quốc gia về công trình kiểm soát tải trọng xe”. - qcvn 02:2022/bxd\xa0 “quy chuẩn kỹ thuật quốc gia về số liệu điều kiện tự nhiên dùng trong xây dựng”. 2. quy định về kỹ thuật 2.1. yêu cầu chung 2.1.1. kết cấu công trình đường bộ cao tốc phải bảo đảm ổn định, bền vững, phù hợp với điều kiện tự nhiên. 2.1.2. đường bộ cao tốc có quy mô tối thiểu 04 làn xe chạy (02 làn xe cho mỗi chiều); có làn dừng xe khẩn cấp được bố trí liên tục (trừ các vị trí: qua cầu có khẩu độ nhịp từ 150,0 m trở lên; cầu có trụ cao từ 50,0 m trở lên; hầm; đoạn có bố trí làn tăng, giảm tốc hoặc làn phụ leo dốc). 2.1.3. các công trình, hạng mục công trình gắn với đường bộ cao tốc bao gồm: đường gom hoặc đường bên; trung tâm quản lý, điều hành giao thông tuyến; trạm dừng nghỉ, điểm dừng xe, đỗ xe; hệ thống thu phí điện tử không dừng đối với tuyến đường có thu phí; công trình kiểm soát tải trọng xe; hàng rào bảo vệ và các công trình khác của đường bộ cao tốc. 2.1.4. mặt cắt ngang đường bộ cao tốc được bố trí trên cùng một nền đường hoặc được bố trí trên hai nền đường riêng biệt đối với hai chiều xe chạy. 2.2. mặt cắt ngang đường bộ cao tốc 2.2.1. số làn xe chạy được xác định trên cơ sở lưu lượng xe thiết kế, nhưng không ít hơn 02 làn xe cho mỗi chiều. chiều rộng làn xe chạy tối thiểu 3,75 m đối với đường cấp 120, cấp 100 và tối thiểu 3,50 m đối với đường cấp 80 (gồm các đoạn được thiết kế với tốc độ 60 km/h). 2.2.2. làn dừng xe khẩn cấp có chiều rộng tối thiểu 3,00 m đối với đường cấp 120, cấp 100 và tối thiểu 2,50 m đối với đường cấp 80 (gồm các đoạn được thiết kế với tốc độ 60 km/h). 2.2.3. dải giữa 2.2.3.1. bố trí dải giữa (gồm dải phân cách giữa và dải an toàn ở hai bên của dải phân cách giữa) để phân chia hai chiều xe chạy. chiều rộng của dải an toàn tối thiểu là 0,75 m đối với đường cấp 120, cấp 100 và tối thiểu 0,50 m đối với đường cấp 80 (gồm các đoạn được thiết kế với tốc độ 60 km/h). dải phân cách giữa được thiết kế để bảo đảm an toàn. 2.2.3.2. trường hợp 02 chiều xe chạy được bố trí trên 02 nền đường riêng biệt, phía bên trái theo chiều xe chạy bố trí dải an toàn và lề đất. dải an toàn trong trường hợp này có chiều rộng tối thiểu 1,00 m đối với đường cấp 120, cấp 100 và tối thiểu 0,75 m đối với đường cấp 80 (gồm các đoạn được thiết kế với tốc độ 60 km/h). 2.2.4. chiều rộng lề đất tối thiểu 0,75 m, bề mặt được trồng cỏ hoặc dùng các loại vật liệu khác để chống xói. 2.3. mặt cắt ngang cầu và hầm trên đường bộ cao tốc 2.3.1. các cầu trên đường bộ cao tốc bố trí đủ các yếu tố mặt cắt ngang như của tuyến chính. đối với các cầu có khẩu độ nhịp từ 150,0 m trở lên; cầu có trụ cao từ 50,0 m trở lên khi không bố trí làn dừng khẩn cấp, phải bố trí đoạn chuyển tiếp từ mặt cắt đường vào phần cầu bị thu hẹp. 2.3.2. mặt cắt ngang hầm trên đường bộ cao tốc 2.3.2.1. mặt cắt ngang hầm bảo đảm chiều rộng để bố trí đầy đủ các yếu tố mặt cắt ngang như của tuyến chính và phần dành cho người đi bộ (phục vụ công tác bảo trì và thoát hiểm trong trường hợp khẩn cấp). trường hợp hầm không bố trí làn dừng xe khẩn cấp phải bố trí dải an toàn, chiều rộng của dải an toàn theo cấp tốc độ thiết kế của đường bộ cao tốc. 2.3.2.2. đối với hầm dài từ 1.000,0 m trở lên khi không bố trí làn dừng xe khẩn cấp phải bố trí vị trí dừng xe khẩn cấp có chiều dài tối thiểu 30,0 m cách nhau tối đa 500,0 m, bề rộng vị trí dừng xe khẩn cấp theo cấp tốc độ thiết kế của đường bộ cao tốc. 2.4. bố trí hệ thống đường gom, đường bên để bảo đảm việc đi lại cho người dân khu vực bị ảnh hưởng, chia cắt bởi đường bộ cao tốc. 2.5. các yếu tố hình học đường bộ cao tốc 2.5.1. các yếu tố hình học của đường bộ cao tốc phải đáp ứng các yêu cầu được quy định tại bảng 1 sau đây. bảng 1 - các trị số giới hạn thiết kế bình đồ và mặt cắt dọc 2.5.2. phải bảo đảm tầm nhìn cho các xe trên đường bộ cao tốc. 2.5.3. quy định về dốc dọc. 2.5.3.1. độ dốc dọc lớn nhất được quy định tại bảng 1 tùy thuộc cấp thiết kế của đường bộ cao tốc. 2.5.3.2. trên các đoạn nền đào phải thiết kế độ dốc dọc tối thiểu bằng 0,50 %. 2.5.3.3. trên các đoạn chuyển tiếp có độ dốc ngang mặt đường dưới 1,00 % phải thiết kế dốc dọc tối thiểu là 0,50 %. 2.5.3.4. trong hầm, độ dốc dọc tối thiểu là 0,30 %. 2.5.4. phải bố trí đường cong đứng dạng tròn hoặc parabol tại các vị trí đổi dốc. 2.6. nút giao khác mức, đường nhánh ra, vào trên đường bộ cao tốc 2.6.1. phải bố trí nút giao khác mức tại các vị trí đường bộ cao tốc giao với các loại đường khác. 2.6.2. trường hợp đường bộ cao tốc vượt trên các đường khác phải bảo đảm tĩnh không tương ứng với cấp kỹ thuật quy hoạch của đường bên dưới. 2.6.3. khoảng cách tối thiểu giữa nút giao khác mức liên thông và vị trí ra, vào trên đường bộ cao tốc là 4,0 km. khoảng cách giữa các vị trí nút giao khác mức liên thông trên đường bộ cao tốc tối thiểu 10,0 km, ở gần các thành phố lớn, khu đô thị lớn và khu chức năng khoảng cách tối thiểu 5,0 km. trường hợp có các yêu cầu về an ninh quốc phòng hoặc phục vụ mục đích đặc biệt nhằm phát triển kinh tế xã hội của địa phương, khoảng cách tối thiểu giữa các nút giao khác mức liên thông được phép giảm xuống nhưng không nhỏ hơn 3,0 km. 2.6.4. các thông số kỹ thuật áp dụng cho phạm vi nút giao khác mức liên thông và các nhánh ra, vào đường bộ cao tốc. 2.6.4.1. tốc độ thiết kế trên các đường nhánh thuộc phạm vi nút giao khác mức liên thông được quy định tại bảng 2 sau đây. bảng 2 - tốc độ thiết kế trên các đường nhánh thuộc phạm vi nút giao khác mức liên thông 2.6.4.2. các yếu tố hình học của đường nhánh (bán kính đường cong bằng, đường cong chuyển tiếp, siêu cao, độ mở rộng, độ dốc dọc, đường cong đứng, tầm nhìn xe) phải bảo đảm yêu cầu kỹ thuật tương ứng với tốc độ thiết kế. 2.6.5. phải bố trí làn tăng, giảm tốc tại các nhánh vào, ra đường bộ cao tốc. 2.7. nền, mặt đường của đường bộ cao tốc 2.7.1. nền đường 2.7.1.1. nền đường phải bảo đảm ổn định, duy trì được các kích thước hình học, có đủ cường độ để chịu được các tác động của tải trọng xe và các yếu tố thiên nhiên trong suốt thời gian sử dụng. 2.7.1.2. nền đường phải tính toán, thiết kế xây dựng dựa trên các số liệu khảo sát địa hình, địa chất, thủy văn. 2.7.2. mặt đường phải được thiết kế, xây dựng bảo đảm các yêu cầu về cường độ, tính bền vững, độ nhám, độ bằng phẳng và khả năng thoát nước. 2.8. an toàn phòng hộ trên đường bộ cao tốc 2.8.1. bố trí phòng hộ 2.8.1.1. phải bố trí đồng bộ hệ thống phòng hộ bảo đảm an toàn giao thông trên đường bộ cao tốc. 2.8.1.2. phải bố trí hàng rào bảo vệ để ngăn cách người, gia súc hoặc thú rừng qua đường. 2.8.2. hệ thống báo hiệu trên đường bộ cao tốc được bố trí tuân thủ quy chuẩn kỹ thuật quốc gia về báo hiệu đường bộ. 2.8.3. phải bố trí hệ thống vạch sơn dẫn hướng và kết hợp với việc bố trí lan can phòng hộ hoặc cọc tiêu để bảo đảm an toàn khai thác. 2.8.4. chống chói 2.8.4.1. phải có biện pháp chống chói do đèn pha của xe chạy ngược chiều về ban đêm. 2.8.4.2. phải kiểm tra việc bảo đảm tầm nhìn ở các đoạn đường cong khi có bố trí các giải pháp chống chói. 2.8.4.3. đoạn đường bộ cao tốc có dải giữa rộng từ 12,0 m trở lên không cần có biện pháp chống chói. 2.8.5. bố trí chiếu sáng trên đường bộ cao tốc tại các khu vực sau: 2.8.5.1. trạm thu phí. 2.8.5.2. trong hầm. 2.8.5.3. phạm vi các vị trí giao nhau liên thông trên đường bộ cao tốc. 2.8.6. phải bố trí tường chống ồn ở gần khu vực đông dân cư. 2.9. tốc độ tối đa cho phép khai thác trên đường bộ cao tốc không vượt quá 120 km/h. tốc độ tối đa cho phép và tốc độ thiết kế không được chênh nhau quá 20 km/h; tốc độ tối đa cho phép của 02 đoạn tuyến liên tiếp không được chênh nhau quá 20 km/h. 3. tổ chức thực hiện 3.1. cục đường cao tốc việt nam chịu trách nhiệm tổ chức triển khai quy chuẩn này. 3.2. trường hợp các văn bản quy phạm pháp luật được viện dẫn trong quy chuẩn này có sự thay đổi, bổ sung hoặc được thay thế thì áp dụng theo văn bản sửa đổi, bổ sung, thay thế./.', '1. cục trưởng cục cảnh sát giao thông có trách nhiệm hướng dẫn, kiểm tra, đôn đốc việc thực hiện thông tư này. 2. cục trưởng cục kế hoạch và tài chính thực hiện việc tham mưu, báo cáo lãnh đạo bộ công an về bảo đảm kinh phí đầu tư xây dựng, quản lý, vận hành hệ thống quản lý dữ liệu thiết bị giám sát hành trình và thiết bị ghi nhận hình ảnh người lái xe. 3. thủ trưởng đơn vị thuộc cơ quan bộ, giám đốc công an tỉnh, thành phố trực thuộc trung ương, cơ quan, tổ chức, cá nhân có liên quan chịu trách nhiệm thi hành thông tư này. trong quá trình thực hiện thông tư, nếu có khó khăn, vướng mắc, công an các đơn vị, địa phương, tổ chức, cá nhân có liên quan báo cáo về bộ công an (qua cục cảnh sát giao thông) để kịp thời hướng dẫn./. phụ lục i cấu trúc bản tin\n(kèm theo thông tư số 71/2024/tt-bca ngày 12/11/2024 của bộ trưởng bộ công an) i. cấu trúc bản tin dữ liệu giám sát hành trình 1. mô tả các trường dữ liệu a) biển kiểm soát: viết liền, không phân biệt chữ hoa, chữ thường, không ký tự đặc biệt. ví dụ: 29a12345; b) thời gian: unix-time theo múi giờ việt nam; c) tốc độ: đơn vị km/h; d) vị trí (tọa độ): decimal degree, wgs84; đ) số giấy phép lái xe: viết liền, không phân biệt chữ hoa, chữ thường, không ký tự đặc biệt; e) mã số thuế: mã số thuế của đơn vị kinh doanh vận tải được viết theo cấu trúc do bộ tài chính quy định; g) đơn vị kinh doanh vận tải: tên đơn vị kinh doanh vận tải, không phân biệt chữ hoa, chữ thường; h) số người chuyên chở: số người quy định được phép chở của phương tiện - là số tự nhiên lớn hơn 1; trường hợp xe vận tải hàng hóa thì bỏ trống mục này; i) tải trọng xe: tải trọng cho phép phương tiện tham gia giao thông (đơn vị: tấn). trường hợp xe vận tải hành khách thì bỏ trống mục này; k) loại hình kinh doanh: loại hình kinh doanh vận tải theo quy định. không phân biệt chữ hoa, chữ thường, không ký tự đặc biệt. 2. nguyên tắc truyền dữ liệu giám sát hành trình a) các trường dữ liệu tại các điểm a, b, c, d, đ mục 1 của phụ lục i là các trường dữ liệu gốc từ thiết bị giám sát hành trình, đơn vị kinh doanh vận tải, chủ phương tiện/đơn vị truyền dữ liệu không được sửa chữa hoặc làm sai lệch dữ liệu khi truyền về máy chủ của cục cảnh sát giao thông; b) các trường dữ liệu tại các điểm e, g, h, i, k mục 1 của phụ lục i là các trường dữ liệu mã số thuế, đơn vị kinh doanh vận tải, chủ phương tiện/đơn vị truyền dữ liệu cập nhật bổ sung (sau khi được cấp phù hiệu kinh doanh vận tải) và truyền về máy chủ của cục cảnh sát giao thông. trường hợp đơn vị kinh doanh vận tải, chủ phương tiện/đơn vị truyền dữ liệu thực hiện truyền dữ liệu khi chưa được cấp phù hiệu thì bỏ trống thông tin các trường dữ liệu này; c) dữ liệu truyền về máy chủ của cục cảnh sát giao thông phải bảo đảm truyền theo thứ tự về thời gian. ii. cấu trúc bản tin dữ liệu hình ảnh 1. mô tả các trường dữ liệu a) biển kiểm soát: viết liền, không phân biệt chữ hoa, chữ thường, không ký tự đặc biệt. ví dụ: 29a12345; b) thời gian: unix-time theo múi giờ việt nam; c) vị trí (tọa độ): decimal degree, wgs84; d) số giấy phép lái xe: viết liền, không phân biệt chữ hoa, chữ thường, không ký tự đặc biệt; đ) imageguid: guid của ảnh được sinh ra ngẫu nhiên từ máy chủ đơn vị truyền dữ liệu; e) cameraview: viết liền dưới dạng 0b000z0y0x trong đó x = 1: hình ảnh chụp người lái xe; y = 1: hình ảnh chụp cửa khách lên xuống xe; z = 1: hình ảnh chụp khoang hành khách. ví dụ 1: 0b00010101: hình ảnh này chứa thông tin quan sát được cả 3 yếu tố, vị trí người lái, cửa khách lên xuống, khoang hành khác trong cùng 1 ảnh. ví dụ 2: 0b00000001: ảnh này chỉ quan sát tại vị trí người lái xe; g) imagedata: dữ liệu ảnh được mã hóa dưới dạng base64; h) imagechecksum: mã crc32 của imagedata; i) camerald: tên chủng loại camera đã đăng ký với cơ quan có thẩm quyền; k) senderlmagelink: đường link dạng https đến máy chủ của đơn vị truyền dữ liệu chứa ảnh vừa truyền để phục vụ công tác đối sánh dữ liệu. đường link phải có thời gian tồn tại ít nhất 72 giờ kể từ khi truyền dữ liệu về máy chủ của cục cảnh sát giao thông; l) providerld: mã định danh đơn vị truyền dữ liệu, mỗi đơn vị truyền dữ liệu chỉ có một id duy nhất. 2. nguyên tắc truyền dữ liệu hình ảnh dữ liệu hình ảnh truyền về máy chủ của cục cảnh sát giao thông phải bảo đảm truyền theo thứ tự về thời gian./. phụ lục ii phương pháp tính toán quá tốc độ xe chạy\n(kèm theo thông tư số 71/2024/tt-bca ngày 12/11/2024 của bộ trưởng bộ công an) i. xử lý lọc nhiễu các bản tin giám sát hành trình trước khi tính toán máy chủ dịch vụ và máy chủ của cục cảnh sát giao thông thực hiện xử lý lọc nhiều, loại bỏ đối với các bản tin giám sát hành trình nhận được trước khi đưa vào tính toán gồm: 1. bản tin có thời gian không hợp lệ a) thời gian gửi về tương lai; b) thời gian bản tin sau nhỏ hơn thời gian bản tin trước. 2. bản tin có tọa độ không hợp lệ a) kinh độ hoặc vĩ độ = 0; b) kinh độ, vĩ độ nhảy ra xa trong khoảng thời gian ngắn (quãng đường/ thời gian >= 200 km/h); c) tọa độ nằm ngoài phạm vi lãnh thổ việt nam, toạ độ không nằm trên mặt đất. 3. bản tin có tốc độ không hợp lệ a) tốc độ tức thời trên bản tin gửi về >= 200 km/h; b) tốc độ tại các bản tin liên tiếp là một số cố định; c) tốc độ < 0 km/h. ii. phương pháp tính km xe chạy 1. phương pháp tính km xe chạy dtb[n] trong đó: kinhdo1, vido1 lần lượt là kinh độ và vĩ độ bản tin thứ n-1; kinhdo2, vido2 lần lượt là kinh độ và vĩ độ bản tin thứ n; dtb[n] = khoangcach(kinhdo1,vido1,kinhdo2,vido2)(km); function khoangcach(kinhdo1,vido1 ,kinhdo2,vido2); {double p1x = kinhdo1 * (math.pi/180); double p1y = vido1 * (math.pi/180); double p2x = kinhdo2 * (math.pi/180); double p2y = vido2 * (math.pi/180); double kc = 0; double temp = 0; kc = p2x - p1x; temp = math.cos(kc); temp = temp * math.cos(p2y); temp = temp * math.cos(p1y); kc = math.sin(p1y); kc = kc * math.sin(p2y); temp = temp + kc; kc = math.acos(temp); kc = kc * 6371}. ghi chú: chỉ thực hiện tính toán khoảng cách di chuyển của phương tiện khi tốc độ tức thời > 0 km/h; giá trị của kết quả tính toán được làm tròn đến 04 chữ số thập phân. 2. ví dụ mẫu cấu trúc bản tin (thời gian, kinh độ, vĩ độ, tốc độ). ví dụ 1: các bản tin liên tiếp của biển số xe 24c04608. bản tin 1 (26/05/2024 00:04:56, 104.33180167, 22.14273667, 12); bản tin 2 (26/05/2024 00:05:09, 104.33188833, 22.14348, 19). tính khoảng cách giữa bản tin thứ 2 và bản tin thứ 1 là: dtb[2] = khoangcach(104.33180167,22.14273667,104.33188833,22.14348) = 0.0831(km). ví dụ 2: các bản tin liên tiếp của biển số xe 30s4546. bản tin 1 (26/05/2024 07:39:45, 105.651398,21.101025,41); bản tin 2 (26/05/2024 07:40:04, 105.652657, 21.100183, 36). tính khoảng cách giữa bản tin thứ 2 và bản tin thứ 1 là: dtb[2] = khoangcach(105.651398,21.101025,105.652657,21.100183) = 0.1607(km). iii. giải thuật tính toán vi phạm tốc độ 1. việc tính toán quá tốc độ xe chạy dựa trên tọa độ, chiều của các biển báo tốc độ và khu vực hạn chế tốc độ được cơ quan có thẩm quyền công bố. 2. trường hợp chưa có dữ liệu về tọa độ, chiều của các biển báo tốc độ và khu vực hạn chế tốc độ được cơ quan có thẩm quyền công bố thì thực hiện tính toán trên cơ sở tốc độ tối đa cho phép xe cơ giới tham gia giao thông ngoài khu vực đông dân cư đối với từng loại xe. 3. trường hợp tốc độ tối đa cho phép giữa các làn của tuyến đường khác nhau thì thực hiện tính toán trên cơ sở tốc độ tối đa cho phép của làn xe có tốc độ cao nhất. 4. giá trị của kết quả tính toán được làm tròn đến 02 chữ số thập phân. a) thuật ngữ viết tắt: n: là thứ tự bản tin từ thiết bị giám sát hành trình; v[n]: tốc độ tức thời (km/h); vlimit[n]: tốc độ tối đa cho phép (km/h); vtb[n]: tốc độ trung bình (km/h); vss[n]: tốc độ để so sánh với vlimit[n] xác định phương tiện vi phạm (km/h); vvipham[n]: tốc độ vi phạm (km/h); ttb[n]: thời gian giữa bản tin thứ n và n - 1 (giây); dtb[n]: khoảng cách giữa bản tin thứ n và n - 1 (km); b) lưu đồ tính toán: c) mô tả lưu đồ tính toán: sau khi thực hiện lọc các bản tin không hợp lệ được mô tả tại mục 1 của phụ lục ii kèm theo thông tư này thì thực hiện tính toán quá tốc độ. tính khoảng thời gian so với bản tin trước (ttb[n]), tùy thuộc vào khoảng thời gian này sẽ có những tính toán tốc độ trung bình, quãng đường như sau: ttb[n] > 60 giây: không tính toán quá tốc độ và sẽ thống kê vi phạm truyền dữ liệu. 10 giây < ttb[n] <= 60 giây: tính quãng đường dựa vào tọa độ 2 bản tin liên tiếp. tính tốc độ: vtb[n] = (dtb[n]/ttb[n]) * 3600. ttb[n] <= 10 giây: tính quãng đường = vtb[n] * ttb[n]. tính tốc độ: vtb[n] = (v[n] + v[n-1])/2 tính tốc độ so sánh (vss[n]): vss[n] = vtb[n] - 3. sai số về tốc độ đang áp dụng trên hệ thống cho toàn bộ các thiết bị là -3 km/h. tính tốc độ vi phạm: thời gian bắt đầu tính vi phạm tốc độ tại thời điểm vss[n] > vlimit[n] đến thời điểm kết thúc vi phạm vss[n] <= vlimit[n] (đơn vị tính theo giây). nếu vss[n] > vlimit[n] được duy trì liên tục trong khoảng thời gian từ 20 giây trở lên thì được ghi nhận là phương tiện vi phạm tốc độ xe chạy. vvipham[n] = vss[n] - vlimit[n]. sử dụng tốc độ vi phạm cao nhất và tốc độ tối đa cho phép tương ứng để xác định mức độ vi phạm theo khoảng (từ 5km/h đến 10 km/h, từ 10 km/h đến 20 km/h, từ 20 km/h đến 35 km/h, trên 35 km/h). ghi chú: tốc độ hiển thị trên bản đồ số theo dõi trực tuyến và tại bảng thống kê chi tiết hành trình là tốc độ tức thời (v[n]) (lấy thông tin theo từng bản tin truyền); v[n] >=200 km/h -> bỏ bản tin. nếu bản tin sau bản tin v[n] >=200 km/h so với bản tin trước v[n] >=200 km/h, thời gian > 60 giây thì dùng tính toán vi phạm tốc độ. còn nếu thời gian < 60 giây thì vẫn tính vss; v[n] = 0 km/h -> vẫn tính vss như bình thường./. c) mô tả lưu đồ tính toán: sau khi thực hiện lọc các bản tin không hợp lệ được mô tả tại mục 1 của phụ lục ii kèm theo thông tư này thì thực hiện tính toán quá tốc độ. tính khoảng thời gian so với bản tin trước (ttb[n]), tùy thuộc vào khoảng thời gian này sẽ có những tính toán tốc độ trung bình, quãng đường như sau: ttb[n] > 60 giây: không tính toán quá tốc độ và sẽ thống kê vi phạm truyền dữ liệu. 10 giây < ttb[n] <= 60 giây: tính quãng đường dựa vào tọa độ 2 bản tin liên tiếp. tính tốc độ: vtb[n] = (dtb[n]/ttb[n]) * 3600. ttb[n] <= 10 giây: tính quãng đường = vtb[n] * ttb[n]. tính tốc độ: vtb[n] = (v[n] + v[n-1])/2 tính tốc độ so sánh (vss[n]): vss[n] = vtb[n] - 3. sai số về tốc độ đang áp dụng trên hệ thống cho toàn bộ các thiết bị là -3 km/h. tính tốc độ vi phạm: thời gian bắt đầu tính vi phạm tốc độ tại thời điểm vss[n] > vlimit[n] đến thời điểm kết thúc vi phạm vss[n] <= vlimit[n] (đơn vị tính theo giây). nếu vss[n] > vlimit[n] được duy trì liên tục trong khoảng thời gian từ 20 giây trở lên thì được ghi nhận là phương tiện vi phạm tốc độ xe chạy. vvipham[n] = vss[n] - vlimit[n]. sử dụng tốc độ vi phạm cao nhất và tốc độ tối đa cho phép tương ứng để xác định mức độ vi phạm theo khoảng (từ 5km/h đến 10 km/h, từ 10 km/h đến 20 km/h, từ 20 km/h đến 35 km/h, trên 35 km/h). ghi chú: tốc độ hiển thị trên bản đồ số theo dõi trực tuyến và tại bảng thống kê chi tiết hành trình là tốc độ tức thời (v[n]) (lấy thông tin theo từng bản tin truyền); v[n] > 200 km/h -> bỏ bản tin. nếu bản tin sau bản tin v[n] > 200 km/h so với bản tin trước v[n] > 200 km/h, thời gian > 60 giây thì dừng tính toán vi phạm tốc độ. còn nếu thời gian < 60 giây thì vẫn tính vss; v[n] = 0 km/h -> vẫn tính vss như bình thường./. phụ lục iii phương pháp tính toán thời gian lái xe\n(kèm theo thông tư số 71/2024/tt-bca ngày 12/11/2024 của bộ trưởng bộ công an) i. thời gian lái xe 1. thời gian xác định xe bắt đầu di chuyển khi người lái xe quẹt thẻ và có 2 bản tin liên tiếp có vận tốc tức thời > 3 km/h. 2. thời gian kết thúc khi thiết bị ghi nhận thay đổi lái xe. ii. tính toán vi phạm thời gian lái xe 1. vi phạm thời gian lái xe được xác định trên cơ sở quy định tại khoản 1 điều 64 luật trật tự, an toàn giao thông đường bộ. 2. vi phạm thời gian lái xe trong ngày được xác định trên cơ sở quy định tại khoản 1 điều 64 luật trật tự, an toàn giao thông đường bộ. ngày làm việc của người lái xe được tính từ 00:00 giờ đến 24:00 giờ. iii. thời gian dừng, đỗ xe được bắt đầu tính khi 2 bản tin liên tiếp có vận tốc tức thời <= 3km/h, kết thúc khi có 2 bản tin liên tiếp có vận tốc tức thời > 3km/h và quãng đường dịch chuyển > 100m. hành trình xe chạy được bắt đầu tính khi có 2 bản tin liên tiếp có vận tốc tức thời > 3km/h và quảng đường dịch chuyển > 100m./. phụ lục iv phương pháp xác định không truyền dữ liệu\n(kèm theo thông tư số 71/2024/tt-bca ngày 12/11/2024 của bộ trưởng bộ công an) i. xác định đơn vị truyền dữ liệu đối với trường hợp một phương tiện lắp nhiều hơn một thiết bị giám sát hành trình và thiết bị ghi nhận hình ảnh người lái xe 1. đối với một phương tiện lắp nhiều hơn một thiết bị giám sát hành trình và thiết bị ghi nhận hình ảnh người lái xe, tại một thời điểm chỉ được truyền duy nhất dữ liệu từ một thiết bị giám sát hành trình và một thiết bị ghi nhận hình ảnh người lái xe lên hệ thống dữ liệu của cục cảnh sát giao thông. 2. trường hợp tại một thời điểm, một phương tiện có đồng thời từ hai nguồn dữ liệu giám sát hành trình và dữ liệu hình ảnh người lái xe truyền lên hệ thống dữ liệu của cục cảnh sát giao thông sẽ ghi nhận là dữ liệu truyền không đúng quy định. ii. truyền dữ liệu trong trường hợp xe bị mất tín hiệu do đường truyền bị gián đoạn 1. khi đường truyền hoạt động bình thường, đơn vị truyền dữ liệu thực hiện việc truyền dữ liệu hiện tại và dữ liệu cũ từ thời điểm bị mất tín hiệu đến thời điểm có tín hiệu theo quy định. dữ liệu cũ được truyền theo một kênh truyền riêng, độc lập với kênh truyền dữ liệu hiện tại. sau khi hết thời hạn truyền lại dữ liệu cũ, hệ thống sẽ thực hiện tính toán lại toàn bộ các thông số. 2. truyền dữ liệu hiện tại để phục vụ hiển thị vị trí phương tiện đang hoạt động trên màn hình theo dõi trực tuyến. 3. dữ liệu cũ kể từ thời điểm mất tín hiệu đến thời điểm hiện tại được truyền theo thứ tự về thời gian để phục vụ việc tính toán theo quy định. iii. tính toán chi tiết từng lần vi phạm truyền dữ liệu vi phạm truyền dữ liệu được xác định khi phương tiện có sự dịch chuyển về vị trí so với vị trí được ghi nhận tại thời điểm bắt đầu ngừng truyền dữ liệu và không có dữ liệu trong khoảng thời gian phương tiện di chuyển giữa hai vị trí. cụ thể thời gian giữa 2 bản tin liên tiếp >120 giây và khoảng cách giữa 2 bản tin liên tiếp > 500m. iv. xác định phương tiện không truyền dữ liệu trong ngày phương tiện không truyền dữ liệu trong ngày được tính khi phương tiện không truyền bản tin nào lên hệ thống (n = 0), hoặc có truyền dữ liệu nhưng các thông tin trong bản tin truyền không có giá trị sử dụng (bản tin không hợp lệ được xác định tại mục 1 của phụ lục ii kèm theo thông tư này)./.']","**Nguồn văn bản:** 38_2024_TT-BGTVT_622477

**Tên văn bản:** Thông tư Quy định về tốc độ và khoảng cách an toàn của xe cơ giới, xe máy chuyên dùng tham gia giao thông trên đường bộ

**Điều 5:** tốc độ thiết kế của đường bộ

**Nội dung:**

4. Tốc độ thiết kế đường bộ trong phạm vi đô thị được xác định theo quy chuẩn kỹ thuật quốc gia về hệ thống công trình hạ tầng kỹ thuật QCVN 07-4:2023/BXD.


Tóm lại:  Quy định cụ thể về tốc độ tối đa trong khu vực đô thị không được nêu trong văn bản này, mà được xác định theo quy chuẩn kỹ thuật quốc gia QCVN 07-4:2023/BXD.  Để biết chính xác tốc độ tối đa, cần tham khảo quy chuẩn này.
",Tốc độ tối đa trong khu vực đô thị được giảm từ 50 km/h xuống 40 km/h.,0.2857142857142857,0.6392589424331846,0.0,0.0
15,Quy định mới về tốc độ tối đa ngoài khu vực đô thị là gì?,"['1. tốc độ thiết kế của đường bộ là giá trị vận tốc được dùng để tính toán các chỉ tiêu kỹ thuật của đường bộ. tốc độ thiết kế của đường bộ được xác định trong giai đoạn đầu tư xây dựng, nâng cấp, cải tạo đường bộ nhằm bảo đảm cho phương tiện di chuyển an toàn; được quyết định theo cấp kỹ thuật của đường bộ và điều kiện địa hình. 2. tốc độ thiết kế đường bộ cao tốc là giá trị vận tốc được dùng để tính toán các chỉ tiêu kỹ thuật của đường bộ cao tốc, được xác định theo cấp đường cao tốc. khi thiết kế đường bộ cao tốc có thể áp dụng tốc độ thiết kế khác nhau theo từng đoạn nhưng phải bảo đảm các yêu cầu về chiều dài đoạn chuyển tiếp và tốc độ thiết kế trung gian giữa các đoạn. tốc độ thiết kế đường bộ cao tốc được xác định theo quy chuẩn kỹ thuật quốc gia về đường bộ cao tốc qcvn 115:2024/bgtvt. 3. tốc độ thiết kế đường bộ được xác định theo tiêu chuẩn quốc gia tcvn 4054: 2005 đường ô tô - yêu cầu thiết kế. 4. tốc độ thiết kế đường bộ trong phạm vi đô thị được xác định theo quy chuẩn kỹ thuật quốc gia về hệ thống công trình hạ tầng kỹ thuật qcvn 07-4:2023/bxd. 5. tốc độ thiết kế đường giao thông nông thôn được xác định theo tiêu chuẩn quốc gia tcvn 10380:2014 đường giao thông nông thôn - yêu cầu thiết kế.', '1. thông tư này có hiệu lực thi hành kể từ ngày 01 tháng 01 năm 2025. 2. thông tư này thay thế thông tư số 06/2024/tt-bgtvt ngày 31 tháng 3 năm 2024 của bộ trưởng bộ giao thông vận tải ban hành quy chuẩn kỹ thuật quốc gia về đường bộ cao tốc qcvn 115:2024./. qcvn 117:2024/bgtvt quy chuẩn kỹ thuật quốc gia về đường bộ cao tốc national technical regulation on expressway lời nói đầu qcvn 117:2024/bgtvt “quy chuẩn kỹ thuật quốc gia về đường bộ cao tốc” do cục đường cao tốc việt nam chủ trì biên soạn, vụ khoa học - công nghệ và môi trường trình duyệt, bộ khoa học và công nghệ thẩm định, bộ trưởng bộ giao thông vận tải ban hành theo thông tư số 57/2024/tt-bgtvt ngày 15 tháng 11 năm 2024. quy chuẩn này thay thế quy chuẩn qcvn 115:2024/bgtvt - quy chuẩn kỹ thuật quốc gia về đường bộ cao tốc (ban hành kèm theo thông tư số 06/2024/tt- bgtvt ngày 31 tháng 3 năm 2024 của bộ trưởng bộ giao thông vận tải). mục lục 1. quy định chung 2. quy định kỹ thuật 3. tổ chức thực hiện quy chuẩn kỹ thuật quốc gia về đường bộ cao tốc national technical regulation on expressway 1. quy định chung 1.1. phạm vi điều chỉnh quy chuẩn này quy định các yêu cầu kỹ thuật trong đầu tư xây dựng, quản lý, vận hành, khai thác và bảo trì đường bộ cao tốc (trừ đường cao tốc đô thị). 1.2. đối tượng áp dụng quy chuẩn này áp dụng đối với các tổ chức, cá nhân có liên quan đến hoạt động đầu tư xây dựng, quản lý, vận hành khai thác và bảo trì đường bộ cao tốc. 1.3. giải thích từ ngữ trong quy chuẩn này, các từ ngữ dưới đây được hiểu như sau: 1.3.1. làn dừng xe khẩn cấp làn dừng xe khẩn cấp là làn được thiết kế để làm nơi dừng đỗ khẩn cấp của các phương tiện gặp sự cố, để các phương tiện cứu hộ, cứu nạn hoạt động; các phương tiện khác không được chạy xe hoặc dừng xe ở làn dừng xe khẩn cấp, trừ xe ưu tiên. 1.3.2. lưu lượng xe thiết kế lưu lượng xe thiết kế là số xe con được quy đổi từ các loại xe khác, thông qua một mặt cắt trong một đơn vị thời gian, tính cho năm tương lai. 1.3.3. năm tương lai năm tương lai là năm thứ 20 kể từ năm dự kiến hoàn thành đường bộ cao tốc đưa vào khai thác. 1.4. tốc độ thiết kế đường bộ cao tốc tốc độ thiết kế đường bộ cao tốc được phân làm 03 cấp như sau: cấp 120 có tốc độ thiết kế là 120 km/h; cấp 100 có tốc độ thiết kế là 100 km/h; cấp 80 có tốc độ thiết kế là 80 km/h; đối với vị trí địa hình đặc biệt phức tạp, yếu tố quốc phòng an ninh, cho phép áp dụng tốc độ thiết kế 60 km/h. trên đường bộ cao tốc có thể có những đoạn áp dụng cấp khác nhau, nhưng đoạn này phải dài từ 15 km trở lên và tốc độ thiết kế của hai đoạn liên tiếp không được chênh nhau quá 20 km/h. trường hợp đường bộ cao tốc áp dụng cấp tốc độ thiết kế quá một cấp (20 km/h), phải có một đoạn quá độ dài ít nhất 02 km có cấp tốc độ thiết kế trung gian. 1.5. tài liệu viện dẫn các tài liệu được viện dẫn trong quy chuẩn này bao gồm: - qcvn 41:2024/bgtvt\xa0 “quy chuẩn kỹ thuật quốc gia về báo hiệu đường bộ’’. - qcvn 43:2024/bgtvt\xa0 “quy chuẩn kỹ thuật quốc gia về trạm dừng nghỉ đường bộ”. - qcvn 07-4: 2023/bxd\xa0 “quy chuẩn kỹ thuật quốc gia về hệ thống công trình hạ tầng kỹ thuật - công trình giao thông đô thị"". - qcvn 116:2024/bgtvt\xa0 “quy chuẩn kỹ thuật quốc gia về công trình kiểm soát tải trọng xe”. - qcvn 02:2022/bxd\xa0 “quy chuẩn kỹ thuật quốc gia về số liệu điều kiện tự nhiên dùng trong xây dựng”. 2. quy định về kỹ thuật 2.1. yêu cầu chung 2.1.1. kết cấu công trình đường bộ cao tốc phải bảo đảm ổn định, bền vững, phù hợp với điều kiện tự nhiên. 2.1.2. đường bộ cao tốc có quy mô tối thiểu 04 làn xe chạy (02 làn xe cho mỗi chiều); có làn dừng xe khẩn cấp được bố trí liên tục (trừ các vị trí: qua cầu có khẩu độ nhịp từ 150,0 m trở lên; cầu có trụ cao từ 50,0 m trở lên; hầm; đoạn có bố trí làn tăng, giảm tốc hoặc làn phụ leo dốc). 2.1.3. các công trình, hạng mục công trình gắn với đường bộ cao tốc bao gồm: đường gom hoặc đường bên; trung tâm quản lý, điều hành giao thông tuyến; trạm dừng nghỉ, điểm dừng xe, đỗ xe; hệ thống thu phí điện tử không dừng đối với tuyến đường có thu phí; công trình kiểm soát tải trọng xe; hàng rào bảo vệ và các công trình khác của đường bộ cao tốc. 2.1.4. mặt cắt ngang đường bộ cao tốc được bố trí trên cùng một nền đường hoặc được bố trí trên hai nền đường riêng biệt đối với hai chiều xe chạy. 2.2. mặt cắt ngang đường bộ cao tốc 2.2.1. số làn xe chạy được xác định trên cơ sở lưu lượng xe thiết kế, nhưng không ít hơn 02 làn xe cho mỗi chiều. chiều rộng làn xe chạy tối thiểu 3,75 m đối với đường cấp 120, cấp 100 và tối thiểu 3,50 m đối với đường cấp 80 (gồm các đoạn được thiết kế với tốc độ 60 km/h). 2.2.2. làn dừng xe khẩn cấp có chiều rộng tối thiểu 3,00 m đối với đường cấp 120, cấp 100 và tối thiểu 2,50 m đối với đường cấp 80 (gồm các đoạn được thiết kế với tốc độ 60 km/h). 2.2.3. dải giữa 2.2.3.1. bố trí dải giữa (gồm dải phân cách giữa và dải an toàn ở hai bên của dải phân cách giữa) để phân chia hai chiều xe chạy. chiều rộng của dải an toàn tối thiểu là 0,75 m đối với đường cấp 120, cấp 100 và tối thiểu 0,50 m đối với đường cấp 80 (gồm các đoạn được thiết kế với tốc độ 60 km/h). dải phân cách giữa được thiết kế để bảo đảm an toàn. 2.2.3.2. trường hợp 02 chiều xe chạy được bố trí trên 02 nền đường riêng biệt, phía bên trái theo chiều xe chạy bố trí dải an toàn và lề đất. dải an toàn trong trường hợp này có chiều rộng tối thiểu 1,00 m đối với đường cấp 120, cấp 100 và tối thiểu 0,75 m đối với đường cấp 80 (gồm các đoạn được thiết kế với tốc độ 60 km/h). 2.2.4. chiều rộng lề đất tối thiểu 0,75 m, bề mặt được trồng cỏ hoặc dùng các loại vật liệu khác để chống xói. 2.3. mặt cắt ngang cầu và hầm trên đường bộ cao tốc 2.3.1. các cầu trên đường bộ cao tốc bố trí đủ các yếu tố mặt cắt ngang như của tuyến chính. đối với các cầu có khẩu độ nhịp từ 150,0 m trở lên; cầu có trụ cao từ 50,0 m trở lên khi không bố trí làn dừng khẩn cấp, phải bố trí đoạn chuyển tiếp từ mặt cắt đường vào phần cầu bị thu hẹp. 2.3.2. mặt cắt ngang hầm trên đường bộ cao tốc 2.3.2.1. mặt cắt ngang hầm bảo đảm chiều rộng để bố trí đầy đủ các yếu tố mặt cắt ngang như của tuyến chính và phần dành cho người đi bộ (phục vụ công tác bảo trì và thoát hiểm trong trường hợp khẩn cấp). trường hợp hầm không bố trí làn dừng xe khẩn cấp phải bố trí dải an toàn, chiều rộng của dải an toàn theo cấp tốc độ thiết kế của đường bộ cao tốc. 2.3.2.2. đối với hầm dài từ 1.000,0 m trở lên khi không bố trí làn dừng xe khẩn cấp phải bố trí vị trí dừng xe khẩn cấp có chiều dài tối thiểu 30,0 m cách nhau tối đa 500,0 m, bề rộng vị trí dừng xe khẩn cấp theo cấp tốc độ thiết kế của đường bộ cao tốc. 2.4. bố trí hệ thống đường gom, đường bên để bảo đảm việc đi lại cho người dân khu vực bị ảnh hưởng, chia cắt bởi đường bộ cao tốc. 2.5. các yếu tố hình học đường bộ cao tốc 2.5.1. các yếu tố hình học của đường bộ cao tốc phải đáp ứng các yêu cầu được quy định tại bảng 1 sau đây. bảng 1 - các trị số giới hạn thiết kế bình đồ và mặt cắt dọc 2.5.2. phải bảo đảm tầm nhìn cho các xe trên đường bộ cao tốc. 2.5.3. quy định về dốc dọc. 2.5.3.1. độ dốc dọc lớn nhất được quy định tại bảng 1 tùy thuộc cấp thiết kế của đường bộ cao tốc. 2.5.3.2. trên các đoạn nền đào phải thiết kế độ dốc dọc tối thiểu bằng 0,50 %. 2.5.3.3. trên các đoạn chuyển tiếp có độ dốc ngang mặt đường dưới 1,00 % phải thiết kế dốc dọc tối thiểu là 0,50 %. 2.5.3.4. trong hầm, độ dốc dọc tối thiểu là 0,30 %. 2.5.4. phải bố trí đường cong đứng dạng tròn hoặc parabol tại các vị trí đổi dốc. 2.6. nút giao khác mức, đường nhánh ra, vào trên đường bộ cao tốc 2.6.1. phải bố trí nút giao khác mức tại các vị trí đường bộ cao tốc giao với các loại đường khác. 2.6.2. trường hợp đường bộ cao tốc vượt trên các đường khác phải bảo đảm tĩnh không tương ứng với cấp kỹ thuật quy hoạch của đường bên dưới. 2.6.3. khoảng cách tối thiểu giữa nút giao khác mức liên thông và vị trí ra, vào trên đường bộ cao tốc là 4,0 km. khoảng cách giữa các vị trí nút giao khác mức liên thông trên đường bộ cao tốc tối thiểu 10,0 km, ở gần các thành phố lớn, khu đô thị lớn và khu chức năng khoảng cách tối thiểu 5,0 km. trường hợp có các yêu cầu về an ninh quốc phòng hoặc phục vụ mục đích đặc biệt nhằm phát triển kinh tế xã hội của địa phương, khoảng cách tối thiểu giữa các nút giao khác mức liên thông được phép giảm xuống nhưng không nhỏ hơn 3,0 km. 2.6.4. các thông số kỹ thuật áp dụng cho phạm vi nút giao khác mức liên thông và các nhánh ra, vào đường bộ cao tốc. 2.6.4.1. tốc độ thiết kế trên các đường nhánh thuộc phạm vi nút giao khác mức liên thông được quy định tại bảng 2 sau đây. bảng 2 - tốc độ thiết kế trên các đường nhánh thuộc phạm vi nút giao khác mức liên thông 2.6.4.2. các yếu tố hình học của đường nhánh (bán kính đường cong bằng, đường cong chuyển tiếp, siêu cao, độ mở rộng, độ dốc dọc, đường cong đứng, tầm nhìn xe) phải bảo đảm yêu cầu kỹ thuật tương ứng với tốc độ thiết kế. 2.6.5. phải bố trí làn tăng, giảm tốc tại các nhánh vào, ra đường bộ cao tốc. 2.7. nền, mặt đường của đường bộ cao tốc 2.7.1. nền đường 2.7.1.1. nền đường phải bảo đảm ổn định, duy trì được các kích thước hình học, có đủ cường độ để chịu được các tác động của tải trọng xe và các yếu tố thiên nhiên trong suốt thời gian sử dụng. 2.7.1.2. nền đường phải tính toán, thiết kế xây dựng dựa trên các số liệu khảo sát địa hình, địa chất, thủy văn. 2.7.2. mặt đường phải được thiết kế, xây dựng bảo đảm các yêu cầu về cường độ, tính bền vững, độ nhám, độ bằng phẳng và khả năng thoát nước. 2.8. an toàn phòng hộ trên đường bộ cao tốc 2.8.1. bố trí phòng hộ 2.8.1.1. phải bố trí đồng bộ hệ thống phòng hộ bảo đảm an toàn giao thông trên đường bộ cao tốc. 2.8.1.2. phải bố trí hàng rào bảo vệ để ngăn cách người, gia súc hoặc thú rừng qua đường. 2.8.2. hệ thống báo hiệu trên đường bộ cao tốc được bố trí tuân thủ quy chuẩn kỹ thuật quốc gia về báo hiệu đường bộ. 2.8.3. phải bố trí hệ thống vạch sơn dẫn hướng và kết hợp với việc bố trí lan can phòng hộ hoặc cọc tiêu để bảo đảm an toàn khai thác. 2.8.4. chống chói 2.8.4.1. phải có biện pháp chống chói do đèn pha của xe chạy ngược chiều về ban đêm. 2.8.4.2. phải kiểm tra việc bảo đảm tầm nhìn ở các đoạn đường cong khi có bố trí các giải pháp chống chói. 2.8.4.3. đoạn đường bộ cao tốc có dải giữa rộng từ 12,0 m trở lên không cần có biện pháp chống chói. 2.8.5. bố trí chiếu sáng trên đường bộ cao tốc tại các khu vực sau: 2.8.5.1. trạm thu phí. 2.8.5.2. trong hầm. 2.8.5.3. phạm vi các vị trí giao nhau liên thông trên đường bộ cao tốc. 2.8.6. phải bố trí tường chống ồn ở gần khu vực đông dân cư. 2.9. tốc độ tối đa cho phép khai thác trên đường bộ cao tốc không vượt quá 120 km/h. tốc độ tối đa cho phép và tốc độ thiết kế không được chênh nhau quá 20 km/h; tốc độ tối đa cho phép của 02 đoạn tuyến liên tiếp không được chênh nhau quá 20 km/h. 3. tổ chức thực hiện 3.1. cục đường cao tốc việt nam chịu trách nhiệm tổ chức triển khai quy chuẩn này. 3.2. trường hợp các văn bản quy phạm pháp luật được viện dẫn trong quy chuẩn này có sự thay đổi, bổ sung hoặc được thay thế thì áp dụng theo văn bản sửa đổi, bổ sung, thay thế./.', '1. cục trưởng cục cảnh sát giao thông có trách nhiệm hướng dẫn, kiểm tra, đôn đốc việc thực hiện thông tư này. 2. cục trưởng cục kế hoạch và tài chính thực hiện việc tham mưu, báo cáo lãnh đạo bộ công an về bảo đảm kinh phí đầu tư xây dựng, quản lý, vận hành hệ thống quản lý dữ liệu thiết bị giám sát hành trình và thiết bị ghi nhận hình ảnh người lái xe. 3. thủ trưởng đơn vị thuộc cơ quan bộ, giám đốc công an tỉnh, thành phố trực thuộc trung ương, cơ quan, tổ chức, cá nhân có liên quan chịu trách nhiệm thi hành thông tư này. trong quá trình thực hiện thông tư, nếu có khó khăn, vướng mắc, công an các đơn vị, địa phương, tổ chức, cá nhân có liên quan báo cáo về bộ công an (qua cục cảnh sát giao thông) để kịp thời hướng dẫn./. phụ lục i cấu trúc bản tin\n(kèm theo thông tư số 71/2024/tt-bca ngày 12/11/2024 của bộ trưởng bộ công an) i. cấu trúc bản tin dữ liệu giám sát hành trình 1. mô tả các trường dữ liệu a) biển kiểm soát: viết liền, không phân biệt chữ hoa, chữ thường, không ký tự đặc biệt. ví dụ: 29a12345; b) thời gian: unix-time theo múi giờ việt nam; c) tốc độ: đơn vị km/h; d) vị trí (tọa độ): decimal degree, wgs84; đ) số giấy phép lái xe: viết liền, không phân biệt chữ hoa, chữ thường, không ký tự đặc biệt; e) mã số thuế: mã số thuế của đơn vị kinh doanh vận tải được viết theo cấu trúc do bộ tài chính quy định; g) đơn vị kinh doanh vận tải: tên đơn vị kinh doanh vận tải, không phân biệt chữ hoa, chữ thường; h) số người chuyên chở: số người quy định được phép chở của phương tiện - là số tự nhiên lớn hơn 1; trường hợp xe vận tải hàng hóa thì bỏ trống mục này; i) tải trọng xe: tải trọng cho phép phương tiện tham gia giao thông (đơn vị: tấn). trường hợp xe vận tải hành khách thì bỏ trống mục này; k) loại hình kinh doanh: loại hình kinh doanh vận tải theo quy định. không phân biệt chữ hoa, chữ thường, không ký tự đặc biệt. 2. nguyên tắc truyền dữ liệu giám sát hành trình a) các trường dữ liệu tại các điểm a, b, c, d, đ mục 1 của phụ lục i là các trường dữ liệu gốc từ thiết bị giám sát hành trình, đơn vị kinh doanh vận tải, chủ phương tiện/đơn vị truyền dữ liệu không được sửa chữa hoặc làm sai lệch dữ liệu khi truyền về máy chủ của cục cảnh sát giao thông; b) các trường dữ liệu tại các điểm e, g, h, i, k mục 1 của phụ lục i là các trường dữ liệu mã số thuế, đơn vị kinh doanh vận tải, chủ phương tiện/đơn vị truyền dữ liệu cập nhật bổ sung (sau khi được cấp phù hiệu kinh doanh vận tải) và truyền về máy chủ của cục cảnh sát giao thông. trường hợp đơn vị kinh doanh vận tải, chủ phương tiện/đơn vị truyền dữ liệu thực hiện truyền dữ liệu khi chưa được cấp phù hiệu thì bỏ trống thông tin các trường dữ liệu này; c) dữ liệu truyền về máy chủ của cục cảnh sát giao thông phải bảo đảm truyền theo thứ tự về thời gian. ii. cấu trúc bản tin dữ liệu hình ảnh 1. mô tả các trường dữ liệu a) biển kiểm soát: viết liền, không phân biệt chữ hoa, chữ thường, không ký tự đặc biệt. ví dụ: 29a12345; b) thời gian: unix-time theo múi giờ việt nam; c) vị trí (tọa độ): decimal degree, wgs84; d) số giấy phép lái xe: viết liền, không phân biệt chữ hoa, chữ thường, không ký tự đặc biệt; đ) imageguid: guid của ảnh được sinh ra ngẫu nhiên từ máy chủ đơn vị truyền dữ liệu; e) cameraview: viết liền dưới dạng 0b000z0y0x trong đó x = 1: hình ảnh chụp người lái xe; y = 1: hình ảnh chụp cửa khách lên xuống xe; z = 1: hình ảnh chụp khoang hành khách. ví dụ 1: 0b00010101: hình ảnh này chứa thông tin quan sát được cả 3 yếu tố, vị trí người lái, cửa khách lên xuống, khoang hành khác trong cùng 1 ảnh. ví dụ 2: 0b00000001: ảnh này chỉ quan sát tại vị trí người lái xe; g) imagedata: dữ liệu ảnh được mã hóa dưới dạng base64; h) imagechecksum: mã crc32 của imagedata; i) camerald: tên chủng loại camera đã đăng ký với cơ quan có thẩm quyền; k) senderlmagelink: đường link dạng https đến máy chủ của đơn vị truyền dữ liệu chứa ảnh vừa truyền để phục vụ công tác đối sánh dữ liệu. đường link phải có thời gian tồn tại ít nhất 72 giờ kể từ khi truyền dữ liệu về máy chủ của cục cảnh sát giao thông; l) providerld: mã định danh đơn vị truyền dữ liệu, mỗi đơn vị truyền dữ liệu chỉ có một id duy nhất. 2. nguyên tắc truyền dữ liệu hình ảnh dữ liệu hình ảnh truyền về máy chủ của cục cảnh sát giao thông phải bảo đảm truyền theo thứ tự về thời gian./. phụ lục ii phương pháp tính toán quá tốc độ xe chạy\n(kèm theo thông tư số 71/2024/tt-bca ngày 12/11/2024 của bộ trưởng bộ công an) i. xử lý lọc nhiễu các bản tin giám sát hành trình trước khi tính toán máy chủ dịch vụ và máy chủ của cục cảnh sát giao thông thực hiện xử lý lọc nhiều, loại bỏ đối với các bản tin giám sát hành trình nhận được trước khi đưa vào tính toán gồm: 1. bản tin có thời gian không hợp lệ a) thời gian gửi về tương lai; b) thời gian bản tin sau nhỏ hơn thời gian bản tin trước. 2. bản tin có tọa độ không hợp lệ a) kinh độ hoặc vĩ độ = 0; b) kinh độ, vĩ độ nhảy ra xa trong khoảng thời gian ngắn (quãng đường/ thời gian >= 200 km/h); c) tọa độ nằm ngoài phạm vi lãnh thổ việt nam, toạ độ không nằm trên mặt đất. 3. bản tin có tốc độ không hợp lệ a) tốc độ tức thời trên bản tin gửi về >= 200 km/h; b) tốc độ tại các bản tin liên tiếp là một số cố định; c) tốc độ < 0 km/h. ii. phương pháp tính km xe chạy 1. phương pháp tính km xe chạy dtb[n] trong đó: kinhdo1, vido1 lần lượt là kinh độ và vĩ độ bản tin thứ n-1; kinhdo2, vido2 lần lượt là kinh độ và vĩ độ bản tin thứ n; dtb[n] = khoangcach(kinhdo1,vido1,kinhdo2,vido2)(km); function khoangcach(kinhdo1,vido1 ,kinhdo2,vido2); {double p1x = kinhdo1 * (math.pi/180); double p1y = vido1 * (math.pi/180); double p2x = kinhdo2 * (math.pi/180); double p2y = vido2 * (math.pi/180); double kc = 0; double temp = 0; kc = p2x - p1x; temp = math.cos(kc); temp = temp * math.cos(p2y); temp = temp * math.cos(p1y); kc = math.sin(p1y); kc = kc * math.sin(p2y); temp = temp + kc; kc = math.acos(temp); kc = kc * 6371}. ghi chú: chỉ thực hiện tính toán khoảng cách di chuyển của phương tiện khi tốc độ tức thời > 0 km/h; giá trị của kết quả tính toán được làm tròn đến 04 chữ số thập phân. 2. ví dụ mẫu cấu trúc bản tin (thời gian, kinh độ, vĩ độ, tốc độ). ví dụ 1: các bản tin liên tiếp của biển số xe 24c04608. bản tin 1 (26/05/2024 00:04:56, 104.33180167, 22.14273667, 12); bản tin 2 (26/05/2024 00:05:09, 104.33188833, 22.14348, 19). tính khoảng cách giữa bản tin thứ 2 và bản tin thứ 1 là: dtb[2] = khoangcach(104.33180167,22.14273667,104.33188833,22.14348) = 0.0831(km). ví dụ 2: các bản tin liên tiếp của biển số xe 30s4546. bản tin 1 (26/05/2024 07:39:45, 105.651398,21.101025,41); bản tin 2 (26/05/2024 07:40:04, 105.652657, 21.100183, 36). tính khoảng cách giữa bản tin thứ 2 và bản tin thứ 1 là: dtb[2] = khoangcach(105.651398,21.101025,105.652657,21.100183) = 0.1607(km). iii. giải thuật tính toán vi phạm tốc độ 1. việc tính toán quá tốc độ xe chạy dựa trên tọa độ, chiều của các biển báo tốc độ và khu vực hạn chế tốc độ được cơ quan có thẩm quyền công bố. 2. trường hợp chưa có dữ liệu về tọa độ, chiều của các biển báo tốc độ và khu vực hạn chế tốc độ được cơ quan có thẩm quyền công bố thì thực hiện tính toán trên cơ sở tốc độ tối đa cho phép xe cơ giới tham gia giao thông ngoài khu vực đông dân cư đối với từng loại xe. 3. trường hợp tốc độ tối đa cho phép giữa các làn của tuyến đường khác nhau thì thực hiện tính toán trên cơ sở tốc độ tối đa cho phép của làn xe có tốc độ cao nhất. 4. giá trị của kết quả tính toán được làm tròn đến 02 chữ số thập phân. a) thuật ngữ viết tắt: n: là thứ tự bản tin từ thiết bị giám sát hành trình; v[n]: tốc độ tức thời (km/h); vlimit[n]: tốc độ tối đa cho phép (km/h); vtb[n]: tốc độ trung bình (km/h); vss[n]: tốc độ để so sánh với vlimit[n] xác định phương tiện vi phạm (km/h); vvipham[n]: tốc độ vi phạm (km/h); ttb[n]: thời gian giữa bản tin thứ n và n - 1 (giây); dtb[n]: khoảng cách giữa bản tin thứ n và n - 1 (km); b) lưu đồ tính toán: c) mô tả lưu đồ tính toán: sau khi thực hiện lọc các bản tin không hợp lệ được mô tả tại mục 1 của phụ lục ii kèm theo thông tư này thì thực hiện tính toán quá tốc độ. tính khoảng thời gian so với bản tin trước (ttb[n]), tùy thuộc vào khoảng thời gian này sẽ có những tính toán tốc độ trung bình, quãng đường như sau: ttb[n] > 60 giây: không tính toán quá tốc độ và sẽ thống kê vi phạm truyền dữ liệu. 10 giây < ttb[n] <= 60 giây: tính quãng đường dựa vào tọa độ 2 bản tin liên tiếp. tính tốc độ: vtb[n] = (dtb[n]/ttb[n]) * 3600. ttb[n] <= 10 giây: tính quãng đường = vtb[n] * ttb[n]. tính tốc độ: vtb[n] = (v[n] + v[n-1])/2 tính tốc độ so sánh (vss[n]): vss[n] = vtb[n] - 3. sai số về tốc độ đang áp dụng trên hệ thống cho toàn bộ các thiết bị là -3 km/h. tính tốc độ vi phạm: thời gian bắt đầu tính vi phạm tốc độ tại thời điểm vss[n] > vlimit[n] đến thời điểm kết thúc vi phạm vss[n] <= vlimit[n] (đơn vị tính theo giây). nếu vss[n] > vlimit[n] được duy trì liên tục trong khoảng thời gian từ 20 giây trở lên thì được ghi nhận là phương tiện vi phạm tốc độ xe chạy. vvipham[n] = vss[n] - vlimit[n]. sử dụng tốc độ vi phạm cao nhất và tốc độ tối đa cho phép tương ứng để xác định mức độ vi phạm theo khoảng (từ 5km/h đến 10 km/h, từ 10 km/h đến 20 km/h, từ 20 km/h đến 35 km/h, trên 35 km/h). ghi chú: tốc độ hiển thị trên bản đồ số theo dõi trực tuyến và tại bảng thống kê chi tiết hành trình là tốc độ tức thời (v[n]) (lấy thông tin theo từng bản tin truyền); v[n] >=200 km/h -> bỏ bản tin. nếu bản tin sau bản tin v[n] >=200 km/h so với bản tin trước v[n] >=200 km/h, thời gian > 60 giây thì dùng tính toán vi phạm tốc độ. còn nếu thời gian < 60 giây thì vẫn tính vss; v[n] = 0 km/h -> vẫn tính vss như bình thường./. c) mô tả lưu đồ tính toán: sau khi thực hiện lọc các bản tin không hợp lệ được mô tả tại mục 1 của phụ lục ii kèm theo thông tư này thì thực hiện tính toán quá tốc độ. tính khoảng thời gian so với bản tin trước (ttb[n]), tùy thuộc vào khoảng thời gian này sẽ có những tính toán tốc độ trung bình, quãng đường như sau: ttb[n] > 60 giây: không tính toán quá tốc độ và sẽ thống kê vi phạm truyền dữ liệu. 10 giây < ttb[n] <= 60 giây: tính quãng đường dựa vào tọa độ 2 bản tin liên tiếp. tính tốc độ: vtb[n] = (dtb[n]/ttb[n]) * 3600. ttb[n] <= 10 giây: tính quãng đường = vtb[n] * ttb[n]. tính tốc độ: vtb[n] = (v[n] + v[n-1])/2 tính tốc độ so sánh (vss[n]): vss[n] = vtb[n] - 3. sai số về tốc độ đang áp dụng trên hệ thống cho toàn bộ các thiết bị là -3 km/h. tính tốc độ vi phạm: thời gian bắt đầu tính vi phạm tốc độ tại thời điểm vss[n] > vlimit[n] đến thời điểm kết thúc vi phạm vss[n] <= vlimit[n] (đơn vị tính theo giây). nếu vss[n] > vlimit[n] được duy trì liên tục trong khoảng thời gian từ 20 giây trở lên thì được ghi nhận là phương tiện vi phạm tốc độ xe chạy. vvipham[n] = vss[n] - vlimit[n]. sử dụng tốc độ vi phạm cao nhất và tốc độ tối đa cho phép tương ứng để xác định mức độ vi phạm theo khoảng (từ 5km/h đến 10 km/h, từ 10 km/h đến 20 km/h, từ 20 km/h đến 35 km/h, trên 35 km/h). ghi chú: tốc độ hiển thị trên bản đồ số theo dõi trực tuyến và tại bảng thống kê chi tiết hành trình là tốc độ tức thời (v[n]) (lấy thông tin theo từng bản tin truyền); v[n] > 200 km/h -> bỏ bản tin. nếu bản tin sau bản tin v[n] > 200 km/h so với bản tin trước v[n] > 200 km/h, thời gian > 60 giây thì dừng tính toán vi phạm tốc độ. còn nếu thời gian < 60 giây thì vẫn tính vss; v[n] = 0 km/h -> vẫn tính vss như bình thường./. phụ lục iii phương pháp tính toán thời gian lái xe\n(kèm theo thông tư số 71/2024/tt-bca ngày 12/11/2024 của bộ trưởng bộ công an) i. thời gian lái xe 1. thời gian xác định xe bắt đầu di chuyển khi người lái xe quẹt thẻ và có 2 bản tin liên tiếp có vận tốc tức thời > 3 km/h. 2. thời gian kết thúc khi thiết bị ghi nhận thay đổi lái xe. ii. tính toán vi phạm thời gian lái xe 1. vi phạm thời gian lái xe được xác định trên cơ sở quy định tại khoản 1 điều 64 luật trật tự, an toàn giao thông đường bộ. 2. vi phạm thời gian lái xe trong ngày được xác định trên cơ sở quy định tại khoản 1 điều 64 luật trật tự, an toàn giao thông đường bộ. ngày làm việc của người lái xe được tính từ 00:00 giờ đến 24:00 giờ. iii. thời gian dừng, đỗ xe được bắt đầu tính khi 2 bản tin liên tiếp có vận tốc tức thời <= 3km/h, kết thúc khi có 2 bản tin liên tiếp có vận tốc tức thời > 3km/h và quãng đường dịch chuyển > 100m. hành trình xe chạy được bắt đầu tính khi có 2 bản tin liên tiếp có vận tốc tức thời > 3km/h và quảng đường dịch chuyển > 100m./. phụ lục iv phương pháp xác định không truyền dữ liệu\n(kèm theo thông tư số 71/2024/tt-bca ngày 12/11/2024 của bộ trưởng bộ công an) i. xác định đơn vị truyền dữ liệu đối với trường hợp một phương tiện lắp nhiều hơn một thiết bị giám sát hành trình và thiết bị ghi nhận hình ảnh người lái xe 1. đối với một phương tiện lắp nhiều hơn một thiết bị giám sát hành trình và thiết bị ghi nhận hình ảnh người lái xe, tại một thời điểm chỉ được truyền duy nhất dữ liệu từ một thiết bị giám sát hành trình và một thiết bị ghi nhận hình ảnh người lái xe lên hệ thống dữ liệu của cục cảnh sát giao thông. 2. trường hợp tại một thời điểm, một phương tiện có đồng thời từ hai nguồn dữ liệu giám sát hành trình và dữ liệu hình ảnh người lái xe truyền lên hệ thống dữ liệu của cục cảnh sát giao thông sẽ ghi nhận là dữ liệu truyền không đúng quy định. ii. truyền dữ liệu trong trường hợp xe bị mất tín hiệu do đường truyền bị gián đoạn 1. khi đường truyền hoạt động bình thường, đơn vị truyền dữ liệu thực hiện việc truyền dữ liệu hiện tại và dữ liệu cũ từ thời điểm bị mất tín hiệu đến thời điểm có tín hiệu theo quy định. dữ liệu cũ được truyền theo một kênh truyền riêng, độc lập với kênh truyền dữ liệu hiện tại. sau khi hết thời hạn truyền lại dữ liệu cũ, hệ thống sẽ thực hiện tính toán lại toàn bộ các thông số. 2. truyền dữ liệu hiện tại để phục vụ hiển thị vị trí phương tiện đang hoạt động trên màn hình theo dõi trực tuyến. 3. dữ liệu cũ kể từ thời điểm mất tín hiệu đến thời điểm hiện tại được truyền theo thứ tự về thời gian để phục vụ việc tính toán theo quy định. iii. tính toán chi tiết từng lần vi phạm truyền dữ liệu vi phạm truyền dữ liệu được xác định khi phương tiện có sự dịch chuyển về vị trí so với vị trí được ghi nhận tại thời điểm bắt đầu ngừng truyền dữ liệu và không có dữ liệu trong khoảng thời gian phương tiện di chuyển giữa hai vị trí. cụ thể thời gian giữa 2 bản tin liên tiếp >120 giây và khoảng cách giữa 2 bản tin liên tiếp > 500m. iv. xác định phương tiện không truyền dữ liệu trong ngày phương tiện không truyền dữ liệu trong ngày được tính khi phương tiện không truyền bản tin nào lên hệ thống (n = 0), hoặc có truyền dữ liệu nhưng các thông tin trong bản tin truyền không có giá trị sử dụng (bản tin không hợp lệ được xác định tại mục 1 của phụ lục ii kèm theo thông tư này)./.']","**Nguồn văn bản:** 57_2024_TT-BGTVT_635197

**Tên văn bản:** Thông tư Ban hành quy chuẩn kỹ thuật quốc gia về đường bộ cao tốc

**Điều 2:** Hiệu lực thi hành

**Nội dung:**

2.9. Tốc độ tối đa cho phép khai thác trên đường bộ cao tốc không vượt quá 120 km/h. Tốc độ tối đa cho phép và tốc độ thiết kế không được chênh nhau quá 20 km/h; tốc độ tối đa cho phép của 02 đoạn tuyến liên tiếp không được chênh nhau quá 20 km/h.


Tóm lại: Tốc độ tối đa cho phép trên đường bộ cao tốc là 120 km/h, chênh lệch giữa tốc độ tối đa cho phép và tốc độ thiết kế không quá 20 km/h, và chênh lệch tốc độ tối đa cho phép giữa hai đoạn tuyến liên tiếp cũng không quá 20 km/h.  Lưu ý rằng đây là quy định về đường cao tốc,  và không phải là quy định chung về tốc độ tối đa ngoài khu vực đô thị.  Thông tin chi tiết về tốc độ tối đa ngoài khu vực đô thị cần tham khảo thêm các văn bản pháp luật khác.
",Tốc độ tối đa ngoài khu vực đô thị được giảm từ 80 km/h xuống 70 km/h.,0.8888888888888888,0.5659678277449444,0.0,0.0
16,Luật Giao thông Đường bộ 2025 có quy định gì về việc sử dụng đèn pha trong khu vực đô thị?,"['1. điều kiện hoạt động của xe thô sơ quy định tại điểm a, điểm b, điểm c, điểm e khoản 2 điều 34 luật trật tự, an toàn giao thông đường bộ bao gồm: a) hệ thống, bộ phận hãm có hiệu lực; b) có bộ phận phát âm thanh cảnh báo (còi, chuông); c) có đèn chiếu sáng hoặc tấm phản quang phía trước; phía sau phải có đèn tín hiệu hoặc tấm phản quang. trường hợp có quy định về tiêu chuẩn, quy chuẩn kỹ thuật đối với phương tiện xe thô sơ quy định tại khoản này thì thực hiện theo quy định của tiêu chuẩn, quy chuẩn kỹ thuật tương ứng. 2. đối với xe thô sơ quy định tại điểm d, điểm đ khoản 2 điều 34 luật trật tự, an toàn giao thông đường bộ có tấm phản quang hoặc thiết bị phát sáng vào ban đêm để nhận biết.', '1. phạt tiền từ 200.000 đồng đến 400.000 đồng đối với người điều khiển xe thực hiện một trong các hành vi vi phạm sau đây: a) không chấp hành hiệu lệnh, chỉ dẫn của biển báo hiệu, vạch kẻ đường, trừ các hành vi vi phạm quy định tại điểm b, điểm d, điểm e khoản 2; điểm a, điểm c, điểm d, điểm h khoản 3; điểm a, điểm b, điểm c, điểm d khoản 4; điểm b, điểm d khoản 6; điểm a, điểm b, điểm c khoản 7; điểm a khoản 8; điểm b khoản 9; điểm a khoản 10 điều này; b) không có tín hiệu trước khi vượt hoặc có tín hiệu vượt xe nhưng không sử dụng trong suốt quá trình vượt xe; c) lùi xe mô tô ba bánh không quan sát hai bên, phía sau xe hoặc không có tín hiệu lùi xe; d) chở người ngồi trên xe sử dụng ô (dù); đ) không tuân thủ các quy định về nhường đường tại nơi đường giao nhau, trừ các hành vi vi phạm quy định tại điểm c, điểm d khoản 6 điều này; e) chuyển làn đường không đúng nơi cho phép hoặc không có tín hiệu báo trước hoặc chuyển làn đường không đúng quy định “mỗi lần chuyển làn đường chỉ được phép chuyển sang một làn đường liền kề”; g) không sử dụng đèn chiếu sáng trong thời gian từ 18 giờ ngày hôm trước đến 06 giờ ngày hôm sau hoặc khi có sương mù, khói, bụi, trời mưa, thời tiết xấu làm hạn chế tầm nhìn; h) tránh xe không đúng quy định; sử dụng đèn chiếu xa khi gặp người đi bộ qua đường hoặc khi đi trên đoạn đường qua khu dân cư có hệ thống chiếu sáng đang hoạt động hoặc khi gặp xe đi ngược chiều (trừ trường hợp dải phân cách có khả năng chống chói) hoặc khi chuyển hướng xe tại nơi đường giao nhau; không nhường đường cho xe đi ngược chiều theo quy định tại nơi đường hẹp, đường dốc, nơi có chướng ngại vật; i) sử dụng còi trong thời gian từ 22 giờ ngày hôm trước đến 05 giờ ngày hôm sau trong khu đông dân cư, khu vực cơ sở khám bệnh, chữa bệnh, trừ các xe ưu tiên đang đi làm nhiệm vụ theo quy định; k) điều khiển xe chạy dưới tốc độ tối thiểu trên đoạn đường bộ có quy định tốc độ tối thiểu cho phép. 2. phạt tiền từ 400.000 đồng đến 600.000 đồng đối với người điều khiển xe thực hiện một trong các hành vi vi phạm sau đây: a) dừng xe, đỗ xe trên phần đường xe chạy ở đoạn đường ngoài đô thị nơi có lề đường; b) điều khiển xe chạy quá tốc độ quy định từ 05 km/h đến dưới 10 km/h; c) điều khiển xe chạy tốc độ thấp mà không đi bên phải phần đường xe chạy gây cản trở giao thông; d) dừng xe, đỗ xe ở lòng đường gây cản trở giao thông; tụ tập từ 03 xe trở lên ở lòng đường, trong hầm đường bộ; đỗ, để xe ở lòng đường, vỉa hè trái phép; đ) xe không được quyền ưu tiên lắp đặt, sử dụng thiết bị phát tín hiệu của xe được quyền ưu tiên; e) dừng xe, đỗ xe trên điểm đón, trả khách, nơi đường bộ giao nhau, trên phần đường dành cho người đi bộ qua đường; dừng xe nơi có biển “cấm dừng xe và đỗ xe”; đỗ xe tại nơi có biển “cấm đỗ xe” hoặc biển “cấm dừng xe và đỗ xe”; không tuân thủ các quy định về dừng xe, đỗ xe tại nơi đường bộ giao nhau cùng mức với đường sắt; dừng xe, đỗ xe trong phạm vi hành lang an toàn giao thông đường sắt; g) chở theo 02 người trên xe, trừ trường hợp chở người bệnh đi cấp cứu, trẻ em dưới 12 tuổi, người già yếu hoặc người khuyết tật, áp giải người có hành vi vi phạm pháp luật; h) không đội “mũ bảo hiểm cho người đi mô tô, xe máy” hoặc đội “mũ bảo hiểm cho người đi mô tô, xe máy” không cài quai đúng quy cách khi điều khiển xe tham gia giao thông trên đường bộ; i) chở người ngồi trên xe không đội “mũ bảo hiểm cho người đi mô tô, xe máy” hoặc đội “mũ bảo hiểm cho người đi mô tô, xe máy” không cài quai đúng quy cách, trừ trường hợp chở người bệnh đi cấp cứu, trẻ em dưới 06 tuổi, áp giải người có hành vi vi phạm pháp luật; k) quay đầu xe tại nơi không được quay đầu xe, trừ hành vi vi phạm quy định tại điểm d khoản 4 điều này. 3. phạt tiền từ 600.000 đồng đến 800.000 đồng đối với người điều khiển xe thực hiện một trong các hành vi vi phạm sau đây: a) chuyển hướng không quan sát hoặc không bảo đảm khoảng cách an toàn với xe phía sau hoặc không giảm tốc độ hoặc không có tín hiệu báo hướng rẽ hoặc có tín hiệu báo hướng rẽ nhưng không sử dụng liên tục trong quá trình chuyển hướng (trừ trường hợp điều khiển xe đi theo hướng cong của đoạn đường bộ ở nơi đường không giao nhau cùng mức); điều khiển xe rẽ trái tại nơi có biển báo hiệu có nội dung cấm rẽ trái đối với loại phương tiện đang điều khiển; điều khiển xe rẽ phải tại nơi có biển báo hiệu có nội dung cấm rẽ phải đối với loại phương tiện đang điều khiển; b) chở theo từ 03 người trở lên trên xe; c) dừng xe, đỗ xe trên cầu; d) điều khiển xe không đi bên phải theo chiều đi của mình; đi không đúng phần đường, làn đường quy định (làn cùng chiều hoặc làn ngược chiều); điều khiển xe đi qua dải phân cách cố định ở giữa hai phần đường xe chạy; đ) vượt bên phải trong trường hợp không được phép; e) người đang điều khiển xe hoặc chở người ngồi trên xe bám, kéo, đẩy xe khác, vật khác, dẫn dắt vật nuôi, mang vác vật cồng kềnh; chở người đứng trên yên, giá đèo hàng hoặc ngồi trên tay lái của xe; g) điều khiển xe kéo theo xe khác, vật khác; h) chạy trong hầm đường bộ không sử dụng đèn chiếu sáng gần; i) không giữ khoảng cách an toàn để xảy ra va chạm với xe chạy liền trước hoặc không giữ khoảng cách theo quy định của biển báo hiệu “cự ly tối thiểu giữa hai xe”; k) điều khiển xe chạy dàn hàng ngang từ 03 xe trở lên; l) xe được quyền ưu tiên lắp đặt, sử dụng thiết bị phát tín hiệu ưu tiên không đúng quy định hoặc sử dụng thiết bị phát tín hiệu ưu tiên mà không có giấy phép của cơ quan có thẩm quyền cấp hoặc có giấy phép của cơ quan có thẩm quyền cấp nhưng không còn giá trị sử dụng theo quy định. 4. phạt tiền từ 800.000 đồng đến 1.000.000 đồng đối với người điều khiển xe thực hiện một trong các hành vi vi phạm sau đây: a) điều khiển xe chạy quá tốc độ quy định từ 10 km/h đến 20 km/h; b) dừng xe, đỗ xe trong hầm đường bộ không đúng nơi quy định; c) vượt xe trong những trường hợp không được vượt, vượt xe tại đoạn đường có biển báo hiệu có nội dung cấm vượt đối với loại phương tiện đang điều khiển, trừ các hành vi vi phạm quy định tại điểm đ khoản 3 điều này; d) quay đầu xe trong hầm đường bộ; đ) người đang điều khiển xe sử dụng ô (dù), thiết bị âm thanh (trừ thiết bị trợ thính), dùng tay cầm và sử dụng điện thoại hoặc các thiết bị điện tử khác. 5. phạt tiền từ 1.000.000 đồng đến 2.000.000 đồng đối với người điều khiển xe thực hiện một trong các hành vi vi phạm sau đây: a) điều khiển xe có liên quan trực tiếp đến vụ tai nạn giao thông mà không dừng ngay phương tiện, không giữ nguyên hiện trường, không trợ giúp người bị nạn, trừ hành vi vi phạm quy định tại điểm c khoản 9 điều này; b) chuyển hướng không nhường quyền đi trước cho: người đi bộ, xe lăn của người khuyết tật qua đường tại nơi có vạch kẻ đường dành cho người đi bộ; xe thô sơ đang đi trên phần đường dành cho xe thô sơ; c) chuyển hướng không nhường đường cho: các xe đi ngược chiều; người đi bộ, xe thô sơ đang qua đường tại nơi không có vạch kẻ đường cho người đi bộ. 6. phạt tiền từ 2.000.000 đồng đến 3.000.000 đồng đối với người điều khiển xe thực hiện một trong các hành vi vi phạm sau đây: a) điều khiển xe trên đường mà trong máu hoặc hơi thở có nồng độ cồn nhưng chưa vượt quá 50 miligam/100 mililít máu hoặc chưa vượt quá 0,25 miligam/1 lít khí thở; b) đi vào khu vực cấm, đường có biển báo hiệu có nội dung cấm đi vào đối với loại phương tiện đang điều khiển, trừ các hành vi vi phạm quy định tại điểm a, điểm b khoản 7 điều này và các trường hợp xe ưu tiên đang đi làm nhiệm vụ khẩn cấp theo quy định; c) không giảm tốc độ (hoặc dừng lại) và nhường đường khi điều khiển xe đi từ đường không ưu tiên ra đường ưu tiên, từ đường nhánh ra đường chính; d) không giảm tốc độ và nhường đường cho xe đi đến từ bên phải tại nơi đường giao nhau không có báo hiệu đi theo vòng xuyến; không giảm tốc độ và nhường đường cho xe đi đến từ bên trái tại nơi đường giao nhau có báo hiệu đi theo vòng xuyến. 7. phạt tiền từ 4.000.000 đồng đến 6.000.000 đồng đối với người điều khiển xe thực hiện một trong các hành vi vi phạm sau đây: a) đi ngược chiều của đường một chiều, đi ngược chiều trên đường có biển “cấm đi ngược chiều”, trừ hành vi vi phạm quy định tại điểm b khoản này và các trường hợp xe ưu tiên đang đi làm nhiệm vụ khẩn cấp theo quy định; điều khiển xe đi trên vỉa hè, trừ trường hợp điều khiển xe đi qua vỉa hè để vào nhà, cơ quan; b) điều khiển xe đi vào đường cao tốc, trừ xe phục vụ việc quản lý, bảo trì đường cao tốc; c) không chấp hành hiệu lệnh của đèn tín hiệu giao thông; d) không chấp hành hiệu lệnh, hướng dẫn của người điều khiển giao thông hoặc người kiểm soát giao thông; đ) không nhường đường hoặc gây cản trở xe được quyền ưu tiên đang phát tín hiệu ưu tiên đi làm nhiệm vụ. 8. phạt tiền từ 6.000.000 đồng đến 8.000.000 đồng đối với người điều khiển xe thực hiện một trong các hành vi vi phạm sau đây: a) điều khiển xe chạy quá tốc độ quy định trên 20 km/h; b) điều khiển xe trên đường mà trong máu hoặc hơi thở có nồng độ cồn vượt quá 50 miligam đến 80 miligam/100 mililít máu hoặc vượt quá 0,25 miligam đến 0,4 miligam/1 lít khí thở. 9. phạt tiền từ 8.000.000 đồng đến 10.000.000 đồng đối với người điều khiển xe thực hiện một trong các hành vi vi phạm sau đây: a) điều khiển xe lạng lách, đánh võng trên đường bộ; sử dụng chân chống hoặc vật khác quệt xuống đường khi xe đang chạy; b) điều khiển xe thành nhóm từ 02 xe trở lên chạy quá tốc độ quy định; c) gây tai nạn giao thông không dừng ngay phương tiện, không giữ nguyên hiện trường, không trợ giúp người bị nạn, không ở lại hiện trường hoặc không đến trình báo ngay với cơ quan công an, ủy ban nhân dân nơi gần nhất; d) điều khiển xe trên đường mà trong máu hoặc hơi thở có nồng độ cồn vượt quá 80 miligam/100 mililít máu hoặc vượt quá 0,4 miligam/1 lít khí thở; đ) không chấp hành yêu cầu kiểm tra về nồng độ cồn của người thi hành công vụ; e) điều khiển xe trên đường mà trong cơ thể có chất ma túy hoặc chất kích thích khác mà pháp luật cấm sử dụng; g) không chấp hành yêu cầu kiểm tra về chất ma túy hoặc chất kích thích khác mà pháp luật cấm sử dụng của người thi hành công vụ; h) ngồi phía sau vòng tay qua người ngồi trước để điều khiển xe, trừ trường hợp chở trẻ em dưới 06 tuổi ngồi phía trước; i) điều khiển xe thành đoàn gây cản trở giao thông, trừ trường hợp được cơ quan có thẩm quyền cấp phép; k) sử dụng còi, rú ga (nẹt pô) liên tục trong khu đông dân cư, khu vực cơ sở khám bệnh, chữa bệnh, trừ các xe ưu tiên đang đi làm nhiệm vụ theo quy định. 10. phạt tiền từ 10.000.000 đồng đến 14.000.000 đồng đối với người điều khiển xe thực hiện một trong các hành vi vi phạm sau đây: a) điều khiển xe không quan sát, giảm tốc độ hoặc dừng lại để bảo đảm an toàn theo quy định mà gây tai nạn giao thông; điều khiển xe chạy quá tốc độ quy định gây tai nạn giao thông; đi vào đường cao tốc, dừng xe, đỗ xe, quay đầu xe, lùi xe, vượt xe, chuyển hướng, chuyển làn đường không đúng quy định gây tai nạn giao thông; không đi đúng phần đường, làn đường, không giữ khoảng cách an toàn giữa hai xe theo quy định gây tai nạn giao thông hoặc đi vào đường có biển báo hiệu có nội dung cấm đi vào đối với loại phương tiện đang điều khiển, đi ngược chiều của đường một chiều, đi ngược chiều trên đường có biển “cấm đi ngược chiều” gây tai nạn giao thông; b) vi phạm quy định tại một trong các điểm, khoản sau của điều này mà gây tai nạn giao thông: điểm a, điểm d, điểm đ, điểm g, điểm h, điểm i, điểm k khoản 1; điểm c, điểm đ, điểm g khoản 2; điểm b, điểm e, điểm g, điểm h, điểm k khoản 3; điểm đ khoản 4; điểm c, điểm d khoản 6; điểm c, điểm d, điểm đ khoản 7; điểm a, điểm b, điểm h, điểm k khoản 9 điều này. 11. tịch thu phương tiện đối với người điều khiển xe thực hiện một trong các hành vi vi phạm sau đây: a) buông cả hai tay khi đang điều khiển xe; dùng chân điều khiển xe; ngồi về một bên điều khiển xe; nằm trên yên xe điều khiển xe; thay người điều khiển khi xe đang chạy; quay người về phía sau để điều khiển xe hoặc bịt mắt điều khiển xe; b) điều khiển xe chạy bằng một bánh đối với xe hai bánh, chạy bằng hai bánh đối với xe ba bánh; c) tái phạm hành vi điều khiển xe lạng lách, đánh võng quy định tại điểm a khoản 9 điều này. 12. ngoài việc bị áp dụng hình thức xử phạt chính, người điều khiển xe thực hiện hành vi vi phạm còn bị áp dụng các hình thức xử phạt bổ sung sau đây: a) thực hiện hành vi quy định tại điểm đ khoản 2 điều này còn bị tịch thu thiết bị phát tín hiệu ưu tiên lắp đặt, sử dụng trái quy định; b) thực hiện hành vi quy định tại điểm a, điểm b, điểm h, điểm i, điểm k khoản 9 điều này bị tước quyền sử dụng giấy phép lái xe từ 10 tháng đến 12 tháng; c) thực hiện hành vi quy định tại điểm d, điểm đ, điểm e, điểm g khoản 9; khoản 11 điều này bị tước quyền sử dụng giấy phép lái xe từ 22 tháng đến 24 tháng. 13. ngoài việc bị áp dụng hình thức xử phạt, người điều khiển xe thực hiện hành vi vi phạm còn bị trừ điểm giấy phép lái xe như sau: a) thực hiện hành vi quy định tại điểm b khoản 3; khoản 5; điểm b, điểm c, điểm d khoản 6; điểm a khoản 7 điều này bị trừ điểm giấy phép lái xe 02 điểm; b) thực hiện hành vi quy định tại điểm đ khoản 4; điểm a khoản 6; điểm c, điểm d, điểm đ khoản 7; điểm a khoản 8 điều này bị trừ điểm giấy phép lái xe 04 điểm; c) thực hiện hành vi quy định tại điểm b khoản 7, điểm c khoản 9 điều này bị trừ điểm giấy phép lái xe 06 điểm; d) thực hiện hành vi quy định tại điểm b khoản 8, khoản 10 điều này bị trừ điểm giấy phép lái xe 10 điểm.', '1. bến xe, bãi đỗ xe, trạm dừng nghỉ được quy định như sau: a) bến xe phải được xây dựng tại các đô thị là trung tâm hành chính cấp huyện trở lên và các khu vực cần thiết khác để phục vụ vận tải hành khách công cộng; b) bãi đỗ xe được xây dựng phù hợp với nhu cầu đỗ xe tại các khu vực trong đô thị, ngoại ô thành phố, thị xã, đường có lưu lượng vận tải lớn và các khu vực khác khi cần thiết để phục vụ đỗ xe, trông giữ xe. bãi đỗ xe gồm: bãi đỗ xe tải; bãi đỗ xe khách, xe con; bãi đỗ xe dùng cho nhiều loại xe; c) bến xe được đầu tư, xây dựng đáp ứng yêu cầu quy chuẩn kỹ thuật quốc gia do bộ trưởng bộ giao thông vận tải ban hành. đối với bãi đỗ xe đô thị thực hiện theo quy chuẩn kỹ thuật quốc gia do bộ trưởng bộ xây dựng ban hành; d) trạm dừng nghỉ phải xây dựng ngoài phạm vi hành lang an toàn đường bộ, bảo đảm quy chuẩn kỹ thuật quốc gia do bộ trưởng bộ giao thông vận tải ban hành; đ) trạm dừng nghỉ, bến xe phải có hệ thống sạc điện cho phương tiện giao thông cơ giới sử dụng năng lượng điện theo quy định của pháp luật về tiêu chuẩn, quy chuẩn kỹ thuật. ưu tiên bố trí hệ thống sạc điện cho phương tiện giao thông cơ giới sử dụng năng lượng điện tại bãi đỗ xe. bến xe, bãi đỗ xe, trạm dừng nghỉ được kết hợp đầu tư, xây dựng để thực hiện hoạt động dịch vụ thương mại. 2. điểm dừng xe được quy định như sau: a) điểm dừng xe trong đô thị và trong các khu dân cư, cơ quan, tổ chức nhằm đáp ứng nhu cầu dừng xe phục vụ giao thông đô thị và các khu vực, địa điểm này; b) điểm dừng xe trong phạm vi đường bộ được bố trí tại một số vị trí nhất định dành cho xe ô tô để đón, trả khách; c) đối với các đường ngoài đô thị được đầu tư, xây dựng mới hoặc nâng cấp, mở rộng, cải tạo thì điểm dừng xe phải được xây dựng ngoài phạm vi đường bộ. 3. trạm thu phí đường bộ là nơi thu tiền sử dụng đường bộ đối với phương tiện tham gia giao thông đường bộ. 4. công trình kiểm soát tải trọng xe được quy định như sau: a) công trình kiểm soát tải trọng xe để xác định tải trọng trục xe, khối lượng toàn bộ của xe tham gia giao thông trên đường bộ, bảo đảm phù hợp với quy chuẩn kỹ thuật quốc gia do bộ trưởng bộ giao thông vận tải ban hành; b) bộ giao thông vận tải, ủy ban nhân dân cấp tỉnh quyết định vị trí xây dựng, lắp đặt công trình kiểm soát tải trọng xe trên đường bộ thuộc phạm vi quản lý; c) cơ quan quản lý đường bộ, cơ quan chức năng có thẩm quyền, tổ chức được giao quản lý, vận hành, khai thác, bảo trì công trình đường bộ sử dụng công trình kiểm soát tải trọng xe để thực hiện việc thu thập, phân tích, đánh giá tác động của tải trọng trục xe, khối lượng toàn bộ của xe đến an toàn công trình, an toàn giao thông đường bộ; phát hiện vi phạm, xử lý theo quy định của pháp luật; d) dữ liệu thu thập từ công trình kiểm soát tải trọng xe phải được kết nối, chia sẻ kịp thời với lực lượng cảnh sát giao thông để xử lý vi phạm pháp luật. 5. bộ trưởng bộ giao thông vận tải quy định về hoạt động của bến xe, bãi đỗ xe, trạm dừng nghỉ, điểm dừng xe, trạm thu phí đường bộ, công trình kiểm soát tải trọng xe trên đường bộ; quy định trình tự, thủ tục đưa bến xe, trạm dừng nghỉ vào khai thác.', '1. xe buýt, xe chở người bốn bánh có gắn động cơ phải hoạt động đúng tuyến, đúng lịch trình, thời gian được phép hoạt động và dừng xe, đỗ xe đúng nơi quy định. 2. xe taxi đón, trả hành khách theo thỏa thuận giữa hành khách và người lái xe nhưng phải chấp hành các quy định của pháp luật về trật tự, an toàn giao thông đường bộ khi đón, trả hành khách. 3. xe chở hàng phải hoạt động đúng tuyến, phạm vi và thời gian quy định đối với từng loại xe. 4. xe vệ sinh môi trường, xe ô tô chở vật liệu xây dựng, phế thải rời phải được che phủ kín, không để rơi vãi trên đường phố và có thời gian hoạt động theo quy định của ủy ban nhân dân cấp tỉnh. 5. ủy ban nhân dân cấp tỉnh quy định về hoạt động vận tải đường bộ trong đô thị và tỷ lệ phương tiện vận chuyển hành khách công cộng có thiết bị hỗ trợ cho người khuyết tật trong đô thị.', '1. tuần tra, kiểm soát cơ động cảnh sát giao thông di chuyển trên tuyến, địa bàn được phân công bằng phương tiện giao thông hoặc đi bộ thực hiện tuần tra, kiểm soát theo kế hoạch đã được cấp có thẩm quyền ban hành, trực tiếp quan sát hoặc thông qua sử dụng phương tiện, thiết bị kỹ thuật nghiệp vụ để giám sát, phòng ngừa, phát hiện, ngăn chặn, xử lý hành vi vi phạm pháp luật về trật tự, an toàn giao thông đường bộ và các hành vi vi phạm pháp luật khác theo thẩm quyền. 2. kiểm soát tại một điểm trên đường giao thông, tại trạm cảnh sát giao thông a) cảnh sát giao thông tổ chức lực lượng tại một điểm trên đường giao thông, tại trạm cảnh sát giao thông theo kế hoạch đã được cấp có thẩm quyền ban hành để thực hiện dừng phương tiện, kiểm soát, phát hiện, xử lý các hành vi vi phạm pháp luật về trật tự, an toàn giao thông đường bộ và các hành vi vi phạm pháp luật khác theo thẩm quyền; b) tại một điểm trên đường giao thông, lựa chọn địa điểm, mặt đường rộng, thoáng, không che khuất tầm nhìn và đúng quy định của pháp luật về trật tự, an toàn giao thông đường bộ, pháp luật về đường bộ và pháp luật có liên quan; c) khi tổ chức lực lượng kiểm soát tại một điểm trên đường giao thông, tại trạm cảnh sát giao thông, phải sử dụng camera được trang bị để ghi hình hoạt động kiểm soát của tổ cảnh sát giao thông. kiểm soát vào buổi tối, ban đêm phải có đèn chiếu sáng và bảo đảm đủ ánh sáng. 3. tuần tra, kiểm soát cơ động kết hợp với kiểm soát tại một điểm trên đường giao thông, tại trạm cảnh sát giao thông khi tuần tra, kiểm soát cơ động được kiểm soát tại một điểm trên đường giao thông, tại trạm cảnh sát giao thông hoặc khi kiểm soát tại một điểm trên đường giao thông, tại trạm cảnh sát giao thông được tuần tra, kiểm soát cơ động nhưng phải ghi rõ trong kế hoạch tuần tra, kiểm soát đã được cấp có thẩm quyền ban hành. 4. khi tuần tra, kiểm soát công khai theo quy định tại khoản 1, khoản 2, khoản 3 điều này phải có kế hoạch của trưởng phòng hướng dẫn tuần tra, kiểm soát giao thông đường bộ, đường sắt thuộc cục cảnh sát giao thông (sau đây viết gọn là trưởng phòng hướng dẫn tuần tra, kiểm soát giao thông đường bộ, đường sắt), trưởng phòng cảnh sát giao thông, trưởng công an huyện, quận, thị xã, thành phố thuộc tỉnh, thành phố trực thuộc trung ương (sau đây viết gọn là trưởng công an cấp huyện) trở lên ban hành và bảo đảm các quy định sau: a) sử dụng trang phục cảnh sát theo quy định tại khoản 1 điều 9 thông tư này; b) sử dụng phương tiện giao thông theo quy định tại khoản 2 điều 9 thông tư này hoặc đi bộ để tuần tra, kiểm soát trong phạm vi tuyến, địa bàn được phân công; c) sử dụng các phương tiện, thiết bị kỹ thuật nghiệp vụ; vũ khí, công cụ hỗ trợ và phương tiện kỹ thuật khác theo quy định của thông tư này.']","**Nguồn văn bản:** 168_2024_ND-CP_619502

**Tên văn bản:** Nghị định Quy định xử phạt vi phạm hành chính về trật tự, an toàn giao thông trong lĩnh vực giao thông đường bộ; trừ điểm, phục hồi điểm giấy phép lái xe

**Điều 7:** Xử phạt, trừ điểm giấy phép lái của người điều khiển xe mô tô, xe gắn máy, các loại xe tương tự xe mô tô và các loại xe tương tự xe gắn máy vi phạm quy tắc giao thông đường bộ

**Nội dung:**

1. Phạt tiền từ 200.000 đồng đến 400.000 đồng đối với người điều khiển xe thực hiện một trong các hành vi vi phạm sau đây:

    g) Không sử dụng đèn chiếu sáng trong thời gian từ 18 giờ ngày hôm trước đến 06 giờ ngày hôm sau hoặc khi có sương mù, khói, bụi, trời mưa, thời tiết xấu làm hạn chế tầm nhìn;
    h) Sử dụng đèn chiếu xa khi gặp người đi bộ qua đường hoặc khi đi trên đoạn đường qua khu dân cư có hệ thống chiếu sáng đang hoạt động hoặc khi gặp xe đi ngược chiều (trừ trường hợp dải phân cách có khả năng chống chói) hoặc khi chuyển hướng xe tại nơi đường giao nhau; không nhường đường cho xe đi ngược chiều theo quy định tại nơi đường hẹp, đường dốc, nơi có chướng ngại vật;


Tóm lại: Nghị định 168/2024/NĐ-CP quy định phạt tiền từ 200.000 đến 400.000 đồng đối với người điều khiển xe không sử dụng đèn chiếu sáng trong thời gian từ 18h đến 6h hoặc khi thời tiết xấu, và sử dụng đèn chiếu xa không đúng quy định trong khu vực đô thị.
",Cấm sử dụng đèn pha trong khu vực đô thị để tránh gây chói mắt cho người tham gia giao thông khác.,0.7777777777777778,0.4017868263727656,0.0,0.49999999995
17,Quy định mới về việc đỗ xe trên vỉa hè là gì?,"['1. phạt tiền từ 400.000 đồng đến 600.000 đồng đối với người điều khiển xe thực hiện một trong các hành vi vi phạm sau đây: a) không chấp hành hiệu lệnh, chỉ dẫn của biển báo hiệu, vạch kẻ đường, trừ các hành vi vi phạm quy định tại điểm a, điểm c, điểm d, điểm đ khoản 2; điểm a, điểm d, điểm đ, điểm e, điểm n, điểm o khoản 3; điểm a, điểm b, điểm đ, điểm e, điểm i, điểm k, điểm l khoản 4; điểm a, điểm b, điểm c, điểm d, điểm đ, điểm i, điểm k khoản 5; điểm a khoản 6; khoản 7; điểm b, điểm d khoản 9; điểm a khoản 10; điểm đ khoản 11 điều này; b) khi ra, vào vị trí dừng xe, đỗ xe không có tín hiệu báo cho người điều khiển phương tiện khác biết; c) không báo hiệu bằng đèn khẩn cấp hoặc không đặt biển cảnh báo “chú ý xe đỗ” theo quy định trong trường hợp gặp sự cố kỹ thuật (hoặc bất khả kháng khác) buộc phải đỗ xe chiếm một phần đường xe chạy hoặc tại nơi không được phép đỗ xe, trừ hành vi vi phạm quy định tại điểm c khoản 7 điều này; d) không gắn biển báo hiệu ở phía trước xe kéo, phía sau xe được kéo; điều khiển xe kéo rơ moóc không có biển báo hiệu theo quy định; đ) sử dụng còi trong thời gian từ 22 giờ ngày hôm trước đến 05 giờ ngày hôm sau trong khu đông dân cư, khu vực cơ sở khám bệnh, chữa bệnh, trừ các xe ưu tiên đang đi làm nhiệm vụ theo quy định. 2. phạt tiền từ 600.000 đồng đến 800.000 đồng đối với người điều khiển xe thực hiện một trong các hành vi vi phạm sau đây: a) chuyển làn đường không đúng nơi cho phép hoặc không có tín hiệu báo trước hoặc chuyển làn đường không đúng quy định “mỗi lần chuyển làn đường chỉ được phép chuyển sang một làn đường liền kề”, trừ các hành vi vi phạm quy định tại điểm g khoản 5 điều này; b) chở người trên buồng lái quá số lượng quy định; c) không tuân thủ các quy định về nhường đường tại nơi đường bộ giao nhau, trừ các hành vi vi phạm quy định tại điểm n, điểm o khoản 5 điều này; d) dừng xe, đỗ xe trên phần đường xe chạy ở đoạn đường ngoài đô thị nơi có lề đường rộng; dừng xe, đỗ xe không sát mép đường phía bên phải theo chiều đi ở nơi đường có lề đường hẹp hoặc không có lề đường; dừng xe, đỗ xe ngược với chiều lưu thông của làn đường; dừng xe, đỗ xe trên dải phân cách cố định ở giữa hai phần đường xe chạy; đỗ xe trên dốc không chèn bánh; đ) dừng xe không sát theo lề đường, vỉa hè phía bên phải theo chiều đi hoặc bánh xe gần nhất cách lề đường, vỉa hè quá 0,25 mét; dừng xe trên đường dành riêng cho xe buýt; dừng xe trên miệng cống thoát nước, miệng hầm của đường điện thoại, điện cao thế, chỗ dành riêng cho xe chữa cháy lấy nước; rời vị trí lái, tắt máy khi dừng xe (trừ trường hợp rời khỏi vị trí lái để đóng, mở cửa xe, xếp dỡ hàng hóa, kiểm tra kỹ thuật xe) hoặc rời vị trí lái khi dừng xe nhưng không sử dụng phanh đỗ xe (hoặc thực hiện biện pháp an toàn khác); dừng xe, đỗ xe không đúng vị trí quy định ở những đoạn có bố trí nơi dừng xe, đỗ xe; dừng xe, đỗ xe trên phần đường dành cho người đi bộ qua đường; dừng xe nơi có biển “cấm dừng xe và đỗ xe”, trừ hành vi vi phạm quy định tại điểm đ khoản 4, điểm c khoản 7 điều này. 3. phạt tiền từ 800.000 đồng đến 1.000.000 đồng đối với người điều khiển xe thực hiện một trong các hành vi vi phạm sau đây: a) điều khiển xe chạy quá tốc độ quy định từ 05 km/h đến dưới 10 km/h; b) sử dụng còi, rú ga liên tục; sử dụng còi hơi, sử dụng đèn chiếu xa khi gặp người đi bộ qua đường hoặc khi đi trên đoạn đường qua khu dân cư có hệ thống chiếu sáng đang hoạt động hoặc khi gặp xe đi ngược chiều (trừ trường hợp dải phân cách có khả năng chống chói) hoặc khi chuyển hướng xe tại nơi đường giao nhau, trừ các xe ưu tiên đang đi làm nhiệm vụ theo quy định; c) chuyển hướng không quan sát hoặc không bảo đảm khoảng cách an toàn với xe phía sau hoặc không giảm tốc độ hoặc không có tín hiệu báo hướng rẽ hoặc có tín hiệu báo hướng rẽ nhưng không sử dụng liên tục trong quá trình chuyển hướng (trừ trường hợp điều khiển xe đi theo hướng cong của đoạn đường bộ ở nơi đường không giao nhau cùng mức); d) không tuân thủ các quy định về dừng xe, đỗ xe tại nơi đường bộ giao nhau cùng mức với đường sắt; dừng xe, đỗ xe trong phạm vi bảo vệ công trình đường sắt, phạm vi an toàn của đường sắt; đ) dừng xe, đỗ xe tại vị trí: nơi đường bộ giao nhau hoặc trong phạm vi 05 mét tính từ mép đường giao nhau; điểm đón, trả khách; trước cổng hoặc trong phạm vi 05 mét hai bên cổng trụ sở cơ quan, tổ chức có bố trí đường cho xe ra, vào; nơi phần đường có bề rộng chỉ đủ cho một làn xe cơ giới; che khuất biển báo hiệu đường bộ, đèn tín hiệu giao thông; nơi mở dải phân cách giữa; cách xe ô tô đang đỗ ngược chiều dưới 20 mét trên đường phố hẹp, dưới 40 mét trên đường có một làn xe cơ giới trên một chiều đường; e) đỗ xe không sát theo lề đường, vỉa hè phía bên phải theo chiều đi hoặc bánh xe gần nhất cách lề đường, vỉa hè quá 0,25 mét; đỗ xe trên đường dành riêng cho xe buýt; đỗ xe trên miệng cống thoát nước, miệng hầm của đường điện thoại, điện cao thế, chỗ dành riêng cho xe chữa cháy lấy nước; đỗ, để xe ở vỉa hè trái quy định của pháp luật; đỗ xe nơi có biển “cấm đỗ xe” hoặc biển “cấm dừng xe và đỗ xe”, trừ hành vi vi phạm quy định tại điểm đ khoản 4, điểm c khoản 7 điều này; g) không sử dụng hoặc sử dụng không đủ đèn chiếu sáng trong thời gian từ 18 giờ ngày hôm trước đến 06 giờ ngày hôm sau hoặc khi có sương mù, khói, bụi, trời mưa, thời tiết xấu làm hạn chế tầm nhìn; h) điều khiển xe ô tô kéo theo xe khác, vật khác (trừ trường hợp kéo theo một rơ moóc, sơ mi rơ moóc hoặc một xe ô tô, xe máy chuyên dùng khác khi xe này không tự chạy được); điều khiển xe ô tô đẩy xe khác, vật khác; điều khiển xe kéo rơ moóc, sơ mi rơ moóc kéo thêm rơ moóc hoặc xe khác, vật khác; không nối chắc chắn, an toàn giữa xe kéo và xe được kéo khi kéo nhau; i) chở người trên xe được kéo, trừ người điều khiển; k) không thắt dây đai an toàn khi điều khiển xe chạy trên đường; l) chở người trên xe ô tô không thắt dây đai an toàn (tại vị trí có trang bị dây đai an toàn) khi xe đang chạy; m) chở trẻ em dưới 10 tuổi và chiều cao dưới 1,35 mét trên xe ô tô ngồi cùng hàng ghế với người lái xe (trừ loại xe ô tô chỉ có một hàng ghế) hoặc không sử dụng thiết bị an toàn phù hợp cho trẻ em theo quy định; n) chạy trong hầm đường bộ không sử dụng đèn chiếu sáng gần; o) điều khiển xe chạy dưới tốc độ tối thiểu trên đoạn đường bộ có quy định tốc độ tối thiểu cho phép; p) điều khiển xe chạy tốc độ thấp hơn các xe khác đi cùng chiều mà không đi về làn đường bên phải chiều đi của mình, trừ trường hợp các xe khác đi cùng chiều chạy quá tốc độ quy định. 4. phạt tiền từ 2.000.000 đồng đến 3.000.000 đồng đối với người điều khiển xe thực hiện một trong các hành vi vi phạm sau đây: a) điều khiển xe không đủ điều kiện đã thu phí theo hình thức điện tử tự động không dừng (xe không gắn thẻ đầu cuối) đi vào làn đường dành riêng thu phí theo hình thức điện tử tự động không dừng tại các trạm thu phí; b) dừng xe, đỗ xe tại vị trí: bên trái đường một chiều hoặc bên trái (theo hướng lưu thông) của đường đôi; trên đoạn đường cong hoặc gần đầu dốc nơi tầm nhìn bị che khuất; trên cầu (trừ trường hợp tổ chức giao thông cho phép), gầm cầu vượt (trừ những nơi cho phép dừng xe, đỗ xe), song song với một xe khác đang dừng, đỗ, trừ hành vi vi phạm quy định tại điểm c khoản 7 điều này; c) không thực hiện biện pháp bảo đảm an toàn theo quy định khi xe ô tô bị hư hỏng ngay tại nơi đường bộ giao nhau cùng mức với đường sắt; d) không nhường đường cho xe xin vượt khi có đủ điều kiện an toàn; đ) lùi xe, quay đầu xe trong hầm đường bộ; dừng xe, đỗ xe trong hầm đường bộ không đúng nơi quy định; không có báo hiệu bằng đèn khẩn cấp, không đặt biển cảnh báo ""chú ý xe đỗ"" (hoặc đèn cảnh báo) về phía sau xe khoảng cách đảm bảo an toàn khi dừng xe, đỗ xe trong hầm đường bộ trong trường hợp gặp sự cố kỹ thuật hoặc bất khả kháng khác buộc phải dừng xe, đỗ xe; e) lùi xe ở đường một chiều, đường có biển “cấm đi ngược chiều”, khu vực cấm dừng, trên phần đường dành cho người đi bộ qua đường, nơi đường bộ giao nhau, nơi đường bộ giao nhau cùng mức với đường sắt, nơi tầm nhìn bị che khuất; lùi xe không quan sát hai bên, phía sau xe hoặc không có tín hiệu lùi xe, trừ hành vi vi phạm quy định tại điểm đ khoản 11 điều này; g) điều khiển xe có liên quan trực tiếp đến vụ tai nạn giao thông mà không dừng ngay phương tiện, không giữ nguyên hiện trường, không trợ giúp người bị nạn, trừ hành vi vi phạm quy định tại khoản 8 điều này; h) xe được quyền ưu tiên lắp đặt, sử dụng thiết bị phát tín hiệu ưu tiên không đúng quy định hoặc sử dụng thiết bị phát tín hiệu ưu tiên mà không có giấy phép của cơ quan có thẩm quyền cấp hoặc có giấy phép của cơ quan có thẩm quyền cấp nhưng không còn giá trị sử dụng theo quy định; i) quay đầu xe ở phần đường dành cho người đi bộ qua đường, trên cầu, đầu cầu, gầm cầu vượt, ngầm, tại nơi đường bộ giao nhau cùng mức với đường sắt, đường hẹp, đường dốc, đoạn đường cong tầm nhìn bị che khuất, trên đường một chiều, trừ khi có hiệu lệnh của người điều khiển giao thông hoặc chỉ dẫn của biển báo hiệu tạm thời hoặc tổ chức giao thông tại những khu vực này có bố trí nơi quay đầu xe; k) quay đầu xe tại nơi có biển báo hiệu có nội dung cấm quay đầu đối với loại phương tiện đang điều khiển; điều khiển xe rẽ trái tại nơi có biển báo hiệu có nội dung cấm rẽ trái đối với loại phương tiện đang điều khiển; điều khiển xe rẽ phải tại nơi có biển báo hiệu có nội dung cấm rẽ phải đối với loại phương tiện đang điều khiển; l) không giữ khoảng cách an toàn để xảy ra va chạm với xe chạy liền trước hoặc không giữ khoảng cách theo quy định của biển báo hiệu “cự ly tối thiểu giữa hai xe”, trừ các hành vi vi phạm quy định tại điểm d khoản 5 điều này. 5. phạt tiền từ 4.000.000 đồng đến 6.000.000 đồng đối với người điều khiển xe thực hiện một trong các hành vi vi phạm sau đây: a) vượt xe trong những trường hợp không được vượt, vượt xe tại đoạn đường có biển báo hiệu có nội dung cấm vượt (đối với loại phương tiện đang điều khiển); không có tín hiệu trước khi vượt hoặc có tín hiệu vượt xe nhưng không sử dụng trong suốt quá trình vượt xe; vượt bên phải xe khác trong trường hợp không được phép; b) điều khiển xe không đi bên phải theo chiều đi của mình; đi không đúng phần đường hoặc làn đường quy định (làn cùng chiều hoặc làn ngược chiều) trừ hành vi quy định tại điểm a khoản 4 điều này; điều khiển xe đi qua dải phân cách cố định ở giữa hai phần đường xe chạy; c) tránh xe đi ngược chiều không đúng quy định (trừ hành vi vi phạm sử dụng đèn chiếu xa khi tránh xe đi ngược chiều quy định tại điểm b khoản 3 điều này); không nhường đường cho xe đi ngược chiều theo quy định tại nơi đường hẹp, đường dốc, nơi có chướng ngại vật; d) không tuân thủ quy định khi vào hoặc ra đường cao tốc; điều khiển xe chạy ở làn dừng xe khẩn cấp hoặc phần lề đường của đường cao tốc; không tuân thủ quy định về khoảng cách an toàn đối với xe chạy liền trước khi chạy trên đường cao tốc; đ) điều khiển xe chạy quá tốc độ quy định từ 10 km/h đến 20 km/h; e) xe không được quyền ưu tiên lắp đặt, sử dụng thiết bị phát tín hiệu của xe được quyền ưu tiên; g) chuyển làn đường không đúng nơi cho phép hoặc không có tín hiệu báo trước hoặc chuyển làn đường không đúng quy định “mỗi lần chuyển làn đường chỉ được phép chuyển sang một làn đường liền kề” khi chạy trên đường cao tốc; h) dùng tay cầm và sử dụng điện thoại hoặc các thiết bị điện tử khác khi điều khiển phương tiện tham gia giao thông đang di chuyển trên đường bộ; i) đi vào khu vực cấm, đường có biển báo hiệu có nội dung cấm đi vào đối với loại phương tiện đang điều khiển, trừ các hành vi vi phạm quy định tại điểm d khoản 9, điểm đ khoản 11 điều này, hành vi bị cấm đi vào công trình thủy lợi và các trường hợp xe ưu tiên đang đi làm nhiệm vụ khẩn cấp theo quy định; k) dừng xe, đỗ xe, quay đầu xe trái quy định gây ùn tắc giao thông; l) chuyển hướng không nhường quyền đi trước cho: người đi bộ, xe lăn của người khuyết tật qua đường tại nơi có vạch kẻ đường dành cho người đi bộ; xe thô sơ đang đi trên phần đường dành cho xe thô sơ; m) chuyển hướng không nhường đường cho: các xe đi ngược chiều; người đi bộ, xe thô sơ đang qua đường tại nơi không có vạch kẻ đường cho người đi bộ; n) không giảm tốc độ (hoặc dừng lại) và nhường đường khi điều khiển xe đi từ đường không ưu tiên ra đường ưu tiên, từ đường nhánh ra đường chính; o) không giảm tốc độ và nhường đường cho xe đi đến từ bên phải tại nơi đường giao nhau không có báo hiệu đi theo vòng xuyến; không giảm tốc độ và nhường đường cho xe đi đến từ bên trái tại nơi đường giao nhau có báo hiệu đi theo vòng xuyến; p) chở người trên thùng xe trái quy định; chở người trên nóc xe; để người đu bám ở cửa xe, bên ngoài thành xe khi xe đang chạy; q) mở cửa xe, để cửa xe mở không bảo đảm an toàn. 6. phạt tiền từ 6.000.000 đồng đến 8.000.000 đồng đối với người điều khiển xe thực hiện một trong các hành vi vi phạm sau đây: a) điều khiển xe chạy quá tốc độ quy định trên 20 km/h đến 35 km/h; b) không nhường đường hoặc gây cản trở xe được quyền ưu tiên đang phát tín hiệu ưu tiên đi làm nhiệm vụ; c) điều khiển xe trên đường mà trong máu hoặc hơi thở có nồng độ cồn nhưng chưa vượt quá 50 miligam/100 mililít máu hoặc chưa vượt quá 0,25 miligam/1 lít khí thở; d) điều khiển xe đi trên vỉa hè, trừ trường hợp điều khiển xe đi qua vỉa hè để vào nhà, cơ quan. 7. phạt tiền từ 12.000.000 đồng đến 14.000.000 đồng đối với người điều khiển xe thực hiện một trong các hành vi vi phạm sau đây: a) điều khiển xe chạy quá tốc độ quy định trên 35 km/h; b) điều khiển xe chở người bốn bánh có gắn động cơ, xe chở hàng bốn bánh có gắn động cơ đi vào đường cao tốc; c) dừng xe, đỗ xe trên đường cao tốc không đúng nơi quy định; không có báo hiệu bằng đèn khẩn cấp khi gặp sự cố kỹ thuật hoặc bất khả kháng khác buộc phải dừng xe, đỗ xe ở làn dừng xe khẩn cấp trên đường cao tốc; không có báo hiệu bằng đèn khẩn cấp, không đặt biển cảnh báo “chú ý xe đỗ” (hoặc đèn cảnh báo) về phía sau xe khoảng cách tối thiểu 150 mét khi dừng xe, đỗ xe trong trường hợp gặp sự cố kỹ thuật hoặc bất khả kháng khác buộc phải dừng xe, đỗ xe trên một phần làn đường xe chạy trên đường cao tốc. 8. phạt tiền từ 16.000.000 đồng đến 18.000.000 đồng đối với người điều khiển xe thực hiện hành vi vi phạm gây tai nạn giao thông không dừng ngay phương tiện, không giữ nguyên hiện trường, không trợ giúp người bị nạn, không ở lại hiện trường hoặc không đến trình báo ngay với cơ quan công an, ủy ban nhân dân nơi gần nhất. 9. phạt tiền từ 18.000.000 đồng đến 20.000.000 đồng đối với người điều khiển xe thực hiện một trong các hành vi vi phạm sau đây: a) điều khiển xe trên đường mà trong máu hoặc hơi thở có nồng độ cồn vượt quá 50 miligam đến 80 miligam/100 mililít máu hoặc vượt quá 0,25 miligam đến 0,4 miligam/1 lít khí thở; b) không chấp hành hiệu lệnh của đèn tín hiệu giao thông; c) không chấp hành hiệu lệnh, hướng dẫn của người điều khiển giao thông hoặc người kiểm soát giao thông; d) đi ngược chiều của đường một chiều, đi ngược chiều trên đường có biển ""cấm đi ngược chiều”, trừ các hành vi vi phạm quy định tại điểm đ khoản 11 điều này và các trường hợp xe ưu tiên đang đi làm nhiệm vụ khẩn cấp theo quy định. 10. phạt tiền từ 20.000.000 đồng đến 22.000.000 đồng đối với người điều khiển xe thực hiện một trong các hành vi vi phạm sau đây: a) điều khiển xe không quan sát, giảm tốc độ hoặc dừng lại để bảo đảm an toàn theo quy định mà gây tai nạn giao thông; điều khiển xe chạy quá tốc độ quy định gây tai nạn giao thông; dừng xe, đỗ xe, quay đầu xe, lùi xe, tránh xe, vượt xe, chuyển hướng, chuyển làn đường không đúng quy định gây tai nạn giao thông; không đi đúng phần đường, làn đường, không giữ khoảng cách an toàn giữa hai xe theo quy định gây tai nạn giao thông hoặc đi vào đường có biển báo hiệu có nội dung cấm đi vào đối với loại phương tiện đang điều khiển gây tai nạn giao thông, trừ các hành vi vi phạm quy định tại điểm đ khoản 11 điều này; b) vi phạm quy định tại một trong các điểm, khoản sau của điều này mà gây tai nạn giao thông: điểm a, điểm b, điểm c, điểm d, điểm đ khoản 1; điểm c khoản 2; điểm b, điểm g, điểm h, điểm n, điểm o, điểm p, khoản 3; điểm a, điểm c, điểm d khoản 4; điểm c, điểm d, điểm e, điểm h, điểm n, điểm o, điểm q khoản 5; điểm b khoản 7; điểm b, điểm c, điểm d khoản 9 điều này. 11. phạt tiền từ 30.000.000 đồng đến 40.000.000 đồng đối với người điều khiển xe thực hiện một trong các hành vi vi phạm sau đây: a) điều khiển xe trên đường mà trong máu hoặc hơi thở có nồng độ cồn vượt quá 80 miligam/100 mililít máu hoặc vượt quá 0,4 miligam/1 lít khí thở; b) không chấp hành yêu cầu kiểm tra về nồng độ cồn của người thi hành công vụ; c) điều khiển xe trên đường mà trong cơ thể có chất ma túy hoặc chất kích thích khác mà pháp luật cấm sử dụng; d) không chấp hành yêu cầu kiểm tra về chất ma túy hoặc chất kích thích khác mà pháp luật cấm sử dụng của người thi hành công vụ; đ) điều khiển xe đi ngược chiều trên đường cao tốc, lùi xe trên đường cao tốc, quay đầu xe trên đường cao tốc, trừ các xe ưu tiên đang đi làm nhiệm vụ khẩn cấp theo quy định. 12. phạt tiền từ 40.000.000 đồng đến 50.000.000 đồng đối với người điều khiển xe thực hiện hành vi điều khiển xe lạng lách, đánh võng trên đường bộ; chạy quá tốc độ đuổi nhau trên đường bộ; dùng chân điều khiển vô lăng xe khi xe đang chạy trên đường bộ. 13. phạt tiền từ 50.000.000 đồng đến 70.000.000 đồng đối với người điều khiển xe thực hiện hành vi vi phạm quy định tại khoản 12 điều này mà gây tai nạn giao thông. 14. tịch thu phương tiện đối với người điều khiển xe tái phạm hành vi điều khiển xe lạng lách, đánh võng quy định tại khoản 12 điều này. 15. ngoài việc bị phạt tiền, người điều khiển xe thực hiện hành vi vi phạm còn bị áp dụng các hình thức xử phạt bổ sung sau đây: a) thực hiện hành vi quy định tại điểm e khoản 5 điều này còn bị tịch thu thiết bị phát tín hiệu ưu tiên lắp đặt, sử dụng trái quy định; b) thực hiện hành vi quy định tại khoản 12 điều này bị tước quyền sử dụng giấy phép lái xe từ 10 tháng đến 12 tháng; c) thực hiện hành vi quy định tại điểm a, điểm b, điểm c, điểm d khoản 11; khoản 13; khoản 14 điều này bị tước quyền sử dụng giấy phép lái xe từ 22 tháng đến 24 tháng. 16. ngoài việc bị áp dụng hình thức xử phạt, người điều khiển xe thực hiện hành vi vi phạm còn bị trừ điểm giấy phép lái xe như sau: a) thực hiện hành vi quy định tại điểm h, điểm i khoản 3; điểm a, điểm b, điểm c, điểm d, điểm đ, điểm g khoản 4; điểm a, điểm b, điểm c, điểm d, điểm đ, điểm e, điểm g, điểm i, điểm k, điểm n, điểm o khoản 5 điều này bị trừ điểm giấy phép lái xe 02 điểm; b) thực hiện hành vi quy định tại điểm h khoản 5; khoản 6; điểm b khoản 7; điểm b, điểm c, điểm d khoản 9 điều này bị trừ điểm giấy phép lái xe 04 điểm; c) thực hiện hành vi quy định tại điểm p khoản 5; điểm a, điểm c khoản 7; khoản 8 điều này bị trừ điểm giấy phép lái xe 06 điểm; d) thực hiện hành vi quy định tại điểm a khoản 9, khoản 10, điểm đ khoản 11 điều này bị trừ điểm giấy phép lái xe 10 điểm.', '1. phạt tiền từ 100.000 đồng đến 200.000 đồng đối với người điều khiển xe thực hiện một trong các hành vi vi phạm sau đây: a) không đi bên phải theo chiều đi của mình, đi không đúng phần đường quy định; b) dừng xe đột ngột; chuyển hướng không báo hiệu trước; c) không chấp hành hiệu lệnh hoặc chỉ dẫn của biển báo hiệu, vạch kẻ đường, trừ các hành vi vi phạm quy định tại điểm đ khoản 2, điểm c khoản 3 điều này; d) vượt bên phải trong các trường hợp không được phép; đ) dừng xe, đỗ xe trên phần đường xe chạy ở đoạn đường ngoài đô thị nơi có lề đường; e) chạy trong hầm đường bộ không bật đèn hoặc không có vật phát sáng báo hiệu; dừng xe, đỗ xe trong hầm đường bộ không đúng nơi quy định; quay đầu xe trong hầm đường bộ; g) điều khiển xe đạp, xe đạp máy đi dàn hàng ngang từ 03 xe trở lên, xe thô sơ khác đi dàn hàng ngang từ 02 xe trở lên; h) người điều khiển xe đạp, xe đạp máy sử dụng ô (dù), dùng tay cầm và sử dụng điện thoại hoặc các thiết bị điện tử khác; chở người ngồi trên xe đạp, xe đạp máy sử dụng ô (dù); i) điều khiển xe thô sơ trong thời gian từ 18 giờ ngày hôm trước đến 06 giờ ngày hôm sau không sử dụng đèn hoặc không có báo hiệu ở phía trước và phía sau xe; k) để xe ở lòng đường, vỉa hè trái phép; đỗ xe ở lòng đường gây cản trở giao thông, đỗ xe trên cầu gây cản trở giao thông; l) không tuân thủ các quy định về dừng xe, đỗ xe tại nơi đường bộ giao nhau cùng mức với đường sắt; m) dùng xe đẩy làm quầy hàng lưu động trên đường gây cản trở giao thông; n) không giảm tốc độ (hoặc dừng lại) và nhường đường khi điều khiển xe đi từ đường không ưu tiên ra đường ưu tiên, từ đường nhánh ra đường chính; o) xe đạp, xe đạp máy, xe xích lô chở quá số người quy định, trừ trường hợp chở người bệnh đi cấp cứu; p) điều khiển xe trên đường mà trong máu hoặc hơi thở có nồng độ cồn nhưng chưa vượt quá 50 miligam/100 mililít máu hoặc chưa vượt quá 0,25 miligam/1 lít khí thở. 2. phạt tiền từ 150.000 đồng đến 250.000 đồng đối với người điều khiển xe thực hiện một trong các hành vi vi phạm sau đây: a) điều khiển xe đạp, xe đạp máy buông cả hai tay; chuyển hướng đột ngột trước đầu xe cơ giới đang chạy; dùng chân điều khiển xe đạp, xe đạp máy; b) không chấp hành hiệu lệnh, chỉ dẫn của người điều khiển giao thông hoặc người kiểm soát giao thông; c) người đang điều khiển xe hoặc chở người ngồi trên xe bám, kéo, đẩy xe khác, vật khác, mang vác vật cồng kềnh; điều khiển xe kéo theo xe khác, vật khác; d) không nhường đường cho xe xin vượt khi có đủ điều kiện an toàn hoặc gây cản trở đối với xe cơ giới xin vượt, gây cản trở xe ưu tiên; đ) không chấp hành hiệu lệnh của đèn tín hiệu giao thông. 3. phạt tiền từ 300.000 đồng đến 400.000 đồng đối với người điều khiển xe thực hiện một trong các hành vi vi phạm sau đây: a) điều khiển xe lạng lách, đánh võng; đuổi nhau trên đường; b) đi xe bằng một bánh đối với xe đạp, xe đạp máy; đi xe bằng hai bánh đối với xe xích lô; c) đi vào khu vực cấm, đường có biển báo hiệu nội dung cấm đi vào đối với loại phương tiện đang điều khiển; đi ngược chiều đường của đường một chiều, đường có biển “cấm đi ngược chiều""; d) điều khiển xe trên đường mà trong máu hoặc hơi thở có nồng độ cồn vượt quá 50 miligam đến 80 miligam/100 mililít máu hoặc vượt quá 0,25 miligam đến 0,4 miligam/1 lít khí thở. 4. phạt tiền từ 400.000 đồng đến 600.000 đồng đối với người điều khiển xe thực hiện một trong các hành vi vi phạm sau đây: a) gây tai nạn giao thông không dừng ngay phương tiện, không giữ nguyên hiện trường, không trợ giúp người bị nạn, không ở lại hiện trường hoặc không đến trình báo ngay với cơ quan công an, ủy ban nhân dân nơi gần nhất; b) điều khiển xe trên đường mà trong máu hoặc hơi thở có nồng độ cồn vượt quá 80 miligam/100 mililít máu hoặc vượt quá 0,4 miligam/1 lít khí thở; c) không chấp hành yêu cầu kiểm tra về nồng độ cồn của người thi hành công vụ; d) người điều khiển xe đạp máy không đội “mũ bảo hiểm cho người đi mô tô, xe máy” hoặc đội “mũ bảo hiểm cho người đi mô tô, xe máy” không cài quai đúng quy cách khi tham gia giao thông trên đường bộ; đ) chở người ngồi trên xe đạp máy không đội “mũ bảo hiểm cho người đi mô tô, xe máy” hoặc đội “mũ bảo hiểm cho người đi mô tô, xe máy” không cài quai đúng quy cách, trừ trường hợp chở người bệnh đi cấp cứu, trẻ em dưới 06 tuổi, áp giải người có hành vi vi phạm pháp luật. 5. phạt tiền từ 800.000 đồng đến 1.200.000 đồng đối với người điều khiển xe đi vào đường cao tốc, trừ phương tiện phục vụ việc quản lý, bảo trì đường cao tốc.', '1. dừng xe là trạng thái đứng yên tạm thời của xe trong một khoảng thời gian cần thiết đủ để cho người lên xe, xuống xe, xếp dỡ hàng hóa, kiểm tra kỹ thuật xe hoặc hoạt động khác. khi dừng xe không được tắt máy và không được rời khỏi vị trí lái, trừ trường hợp rời khỏi vị trí lái để đóng, mở cửa xe, xếp dỡ hàng hóa, kiểm tra kỹ thuật xe nhưng phải sử dụng phanh đỗ xe hoặc thực hiện biện pháp an toàn khác. 2. đỗ xe là trạng thái đứng yên của xe không giới hạn thời gian. khi đỗ xe, người điều khiển phương tiện tham gia giao thông đường bộ chỉ được rời khỏi xe khi đã sử dụng phanh đỗ xe hoặc thực hiện biện pháp an toàn khác. xe đỗ trên đoạn đường dốc phải đánh lái về phía lề đường, chèn bánh. 3. người điều khiển phương tiện tham gia giao thông đường bộ khi dừng xe, đỗ xe trên đường phải thực hiện các quy định sau đây: a) có tín hiệu báo cho người điều khiển phương tiện tham gia giao thông đường bộ khác biết khi ra, vào vị trí dừng xe, đỗ xe; b) không làm ảnh hưởng đến người đi bộ và các phương tiện tham gia giao thông đường bộ. 4. người điều khiển phương tiện tham gia giao thông đường bộ không được dừng xe, đỗ xe tại các vị trí sau đây: a) bên trái đường một chiều; b) trên đoạn đường cong hoặc gần đầu dốc mà tầm nhìn bị che khuất; c) trên cầu, trừ những trường hợp tổ chức giao thông cho phép; d) gầm cầu vượt, trừ những nơi cho phép dừng xe, đỗ xe; đ) song song cùng chiều với một xe khác đang dừng, đỗ trên đường; e) cách xe ô tô đang đỗ ngược chiều dưới 20 mét trên đường phố hẹp, \ndưới 40 mét trên đường có một làn xe cơ giới trên một chiều đường; g) trên phần đường dành cho người đi bộ qua đường; h) nơi đường giao nhau và trong phạm vi 05 mét tính từ mép đường giao nhau; i) điểm đón, trả khách; k) trước cổng và trong phạm vi 05 mét hai bên cổng trụ sở cơ quan, tổ chức có bố trí đường cho xe ra, vào; l) tại nơi phần đường có chiều rộng chỉ đủ cho một làn xe cơ giới; m) trong phạm vi an toàn của đường sắt; n) che khuất biển báo hiệu đường bộ, đèn tín hiệu giao thông; o) trên đường dành riêng cho xe buýt, trên miệng cống thoát nước, miệng hầm của đường điện thoại, điện cao thế, chỗ dành riêng cho xe chữa cháy lấy nước; trên lòng đường, vỉa hè trái quy định của pháp luật. 5. trên đường bộ, người điều khiển phương tiện tham gia giao thông đường bộ chỉ được dừng xe, đỗ xe ở nơi có lề đường rộng hoặc khu đất ở bên ngoài phần đường xe chạy; trường hợp lề đường hẹp hoặc không có lề đường thì chỉ được dừng xe, đỗ xe sát mép đường phía bên phải theo chiều đi của mình. 6. trên đường phố, người điều khiển phương tiện tham gia giao thông đường bộ chỉ được dừng xe, đỗ xe sát theo lề đường, vỉa hè phía bên phải theo chiều đi của mình; bánh xe gần nhất không được cách xa lề đường, vỉa hè quá 0,25 mét và không gây cản trở, nguy hiểm cho người và phương tiện tham gia giao thông đường bộ. 7. trong trường hợp gặp sự cố kỹ thuật hoặc bất khả kháng khác buộc phải đỗ xe, khi đỗ xe chiếm một phần đường xe chạy hoặc tại nơi không được phép đỗ, phải có báo hiệu bằng đèn khẩn cấp hoặc đặt biển cảnh báo về phía sau xe để người điều khiển phương tiện tham gia giao thông đường bộ khác biết.']","**Nguồn văn bản:** 168_2024_ND-CP_619502

**Tên văn bản:** Nghị định Quy định xử phạt vi phạm hành chính về trật tự, an toàn giao thông trong lĩnh vực giao thông đường bộ; trừ điểm, phục hồi điểm giấy phép lái xe

**Điều 6:** xử phạt, trừ điểm giấy phép lái xe của người điều khiển xe ô tô, xe chở người bốn bánh có gắn động cơ, xe chở hàng bốn bánh có gắn động cơ và các loại xe tương tự xe ô tô vi phạm quy tắc giao thông đường bộ

**Nội dung:**

Điều 6 của Nghị định nêu rõ các quy định về xử phạt đối với hành vi dừng và đỗ xe vi phạm.  Một số điểm đáng chú ý liên quan đến việc đỗ xe trên vỉa hè như sau:

2. Phạt tiền từ 600.000 đồng đến 800.000 đồng đối với người điều khiển xe thực hiện một trong các hành vi vi phạm sau đây:

    đ) Dừng xe không sát theo lề đường, vỉa hè phía bên phải theo chiều đi hoặc bánh xe gần nhất cách lề đường, vỉa hè quá 0,25 mét; dừng xe trên đường dành riêng cho xe buýt; dừng xe trên miệng cống thoát nước, miệng hầm của đường điện thoại, điện cao thế, chỗ dành riêng cho xe chữa cháy lấy nước; rời vị trí lái, tắt máy khi dừng xe (trừ trường hợp rời khỏi vị trí lái để đóng, mở cửa xe, xếp dỡ hàng hóa, kiểm tra kỹ thuật xe) hoặc rời vị trí lái khi dừng xe nhưng không sử dụng phanh đỗ xe (hoặc thực hiện biện pháp an toàn khác); dừng xe, đỗ xe không đúng vị trí quy định ở những đoạn có bố trí nơi dừng xe, đỗ xe; dừng xe, đỗ xe trên phần đường dành cho người đi bộ qua đường; dừng xe nơi có biển “cấm dừng xe và đỗ xe”, trừ hành vi vi phạm quy định tại điểm đ khoản 4, điểm c khoản 7 điều này.


3. Phạt tiền từ 800.000 đồng đến 1.000.000 đồng đối với người điều khiển xe thực hiện một trong các hành vi vi phạm sau đây:

    đ) Đỗ xe không sát theo lề đường, vỉa hè phía bên phải theo chiều đi hoặc bánh xe gần nhất cách lề đường, vỉa hè quá 0,25 mét; đỗ xe trên đường dành riêng cho xe buýt; đỗ xe trên miệng cống thoát nước, miệng hầm của đường điện thoại, điện cao thế, chỗ dành riêng cho xe chữa cháy lấy nước; đỗ, để xe ở vỉa hè trái quy định của pháp luật; đỗ xe nơi có biển “cấm đỗ xe” hoặc biển “cấm dừng xe và đỗ xe”, trừ hành vi vi phạm quy định tại điểm đ khoản 4, điểm c khoản 7 điều này.


4. Phạt tiền từ 2.000.000 đồng đến 3.000.000 đồng đối với người điều khiển xe thực hiện một trong các hành vi vi phạm sau đây:

    b) Dừng xe, đỗ xe tại vị trí: bên trái đường một chiều hoặc bên trái (theo hướng lưu thông) của đường đôi; trên đoạn đường cong hoặc gần đầu dốc nơi tầm nhìn bị che khuất; trên cầu (trừ trường hợp tổ chức giao thông cho phép), gầm cầu vượt (trừ những nơi cho phép dừng xe, đỗ xe), song song với một xe khác đang dừng, đỗ, trừ hành vi vi phạm quy định tại điểm c khoản 7 điều này.


**Nguồn văn bản:** 36_2024_QH15_444251

**Tên văn bản:** Luật Trật tự, an toàn giao thông đường bộ

**Điều 18:** Dừng xe, đỗ xe

**Nội dung:**

Điều 18 của Luật Trật tự, an toàn giao thông đường bộ quy định về dừng xe và đỗ xe.  Các điểm liên quan đến đỗ xe trên vỉa hè:

4. Người điều khiển phương tiện tham gia giao thông đường bộ không được dừng xe, đỗ xe tại các vị trí sau đây:

    o) Trên lòng đường, vỉa hè trái quy định của pháp luật.

5. Trên đường bộ, người điều khiển phương tiện tham gia giao thông đường bộ chỉ được dừng xe, đỗ xe ở nơi có lề đường rộng hoặc khu đất ở bên ngoài phần đường xe chạy; trường hợp lề đường hẹp hoặc không có lề đường thì chỉ được dừng xe, đỗ xe sát mép đường phía bên phải theo chiều đi của mình.

6. Trên đường phố, người điều khiển phương tiện tham gia giao thông đường bộ chỉ được dừng xe, đỗ xe sát theo lề đường, vỉa hè phía bên phải theo chiều đi của mình; bánh xe gần nhất không được cách xa lề đường, vỉa hè quá 0,25 mét và không gây cản trở, nguy hiểm cho người và phương tiện tham gia giao thông đường bộ.

7. Trong trường hợp gặp sự cố kỹ thuật hoặc bất khả kháng khác buộc phải đỗ xe, khi đỗ xe chiếm một phần đường xe chạy hoặc tại nơi không được phép đỗ, phải có báo hiệu bằng đèn khẩn cấp hoặc đặt biển cảnh báo về phía sau xe để người điều khiển phương tiện tham gia giao thông đường bộ khác biết.


Tóm lại:  Việc đỗ xe trên vỉa hè phải tuân thủ nghiêm ngặt các quy định về vị trí, khoảng cách với lề đường, và không được gây cản trở giao thông. Vi phạm sẽ bị phạt tiền với mức phạt khác nhau tùy thuộc vào mức độ vi phạm.  Cần đỗ xe đúng quy định, sát lề đường bên phải, và không được đỗ xe ở những nơi cấm đỗ.  Trong trường hợp bất khả kháng phải đỗ xe ở nơi không được phép, cần báo hiệu bằng đèn khẩn cấp hoặc biển báo.
","Cấm đỗ xe trên vỉa hè, trừ những nơi có biển báo cho phép.",0.9117647058823529,0.3494667481894093,1.0,0.9999999999
18,Luật Giao thông Đường bộ 2025 có quy định gì về việc sử dụng làn đường dành cho xe buýt?,"['1. đơn vị kinh doanh vận tải có giấy phép kinh doanh vận tải bằng ô tô, trong đó có loại hình kinh doanh vận tải hành khách công cộng bằng xe buýt thì được tham gia kinh doanh vận tải công cộng bằng xe buýt trên các tuyến xe buýt nội tỉnh, tuyến xe buýt liên tỉnh. 2. xe ô tô kinh doanh vận tải hành khách công cộng bằng xe buýt a) phải có chỗ ưu tiên cho người khuyết tật, người cao tuổi và phụ nữ mang thai và trẻ em dưới 6 tuổi; b) phải có phù hiệu “xe buýt” theo mẫu số 03 phụ lục xiii kèm theo nghị định này và được dán cố định tại góc trên bên phải ngay sát phía dưới vị trí của tem kiểm định, mặt trong kính chắn gió phía trước của xe; phải được niêm yết đầy đủ các thông tin trên xe; c) vị trí, số chỗ ngồi, chỗ đứng cho hành khách và các quy định kỹ thuật khác đối với xe buýt theo quy chuẩn kỹ thuật quốc gia về chất lượng an toàn kỹ thuật và bảo vệ môi trường đối với xe ô tô. 3. sở giao thông vận tải thực hiện nội dung quản lý tuyến đối với tuyến xe buýt nội tỉnh, tuyến xe buýt liên tỉnh a) xây dựng, điều chỉnh, bổ sung và công bố danh mục mạng lưới tuyến, biểu đồ chạy xe trên các tuyến, giá vé; b) đề xuất, xây dựng và báo cáo ủy ban nhân dân cấp tỉnh: về các chính sách hỗ trợ của nhà nước về khuyến khích phát triển vận tải hành khách công cộng bằng xe buýt trên địa bàn địa phương; việc tổ chức đấu thầu, tiêu chí để đặt hàng khai thác đối với tuyến xe buýt trong danh mục mạng lưới tuyến đã công bố theo quy định của pháp luật về thầu; tổ chức đặt hàng khai thác đối với tuyến xe buýt liên tỉnh và tuyến xe buýt có sử dụng xe ô tô thoáng nóc chở khách du lịch không được hỗ trợ kinh phí hoạt động từ ngân sách nhà nước trong danh mục mạng lưới tuyến đã công bố; c) xây dựng, bảo trì và quản lý kết cấu hạ tầng phục vụ hoạt động xe buýt; quyết định tiêu chí kỹ thuật, vị trí điểm đầu, điểm cuối và điểm dừng của tuyến xe buýt trên địa bàn địa phương; d) theo dõi, tổng hợp kết quả hoạt động vận tải của các đơn vị kinh doanh vận tải trên tuyến; thống kê sản lượng hành khách. 4. đơn vị kinh doanh vận tải hành khách bằng xe buýt thực hiện lưu trữ lệnh vận chuyển như sau: a) lưu trữ lệnh vận chuyển của các chuyến xe đã thực hiện (không được hỗ trợ kinh phí hoạt động từ ngân sách nhà nước) trong thời hạn ít nhất là 03 năm; b) lưu trữ lệnh vận chuyển của các chuyến xe đã thực hiện (được hỗ trợ kinh phí hoạt động từ ngân sách nhà nước) theo thời hạn tài liệu kế toán phải lưu trữ được quy định tại khoản 5 điều 41 luật kế toán năm 2015. 5. xe buýt được ưu tiên bố trí nơi dừng, đỗ để đón, trả khách tại các bến xe, nhà ga, sân bay, bến cảng, khu du lịch, điểm du lịch, cơ sở lưu trú du lịch, điểm tham quan du lịch, địa điểm văn hóa, thể thao, trung tâm thương mại, đầu mối giao thông và các địa điểm kết nối với các phương thức vận tải khác; được ưu tiên hoạt động khi tổ chức giao thông tại đô thị.', '1. dừng xe là trạng thái đứng yên tạm thời của xe trong một khoảng thời gian cần thiết đủ để cho người lên xe, xuống xe, xếp dỡ hàng hóa, kiểm tra kỹ thuật xe hoặc hoạt động khác. khi dừng xe không được tắt máy và không được rời khỏi vị trí lái, trừ trường hợp rời khỏi vị trí lái để đóng, mở cửa xe, xếp dỡ hàng hóa, kiểm tra kỹ thuật xe nhưng phải sử dụng phanh đỗ xe hoặc thực hiện biện pháp an toàn khác. 2. đỗ xe là trạng thái đứng yên của xe không giới hạn thời gian. khi đỗ xe, người điều khiển phương tiện tham gia giao thông đường bộ chỉ được rời khỏi xe khi đã sử dụng phanh đỗ xe hoặc thực hiện biện pháp an toàn khác. xe đỗ trên đoạn đường dốc phải đánh lái về phía lề đường, chèn bánh. 3. người điều khiển phương tiện tham gia giao thông đường bộ khi dừng xe, đỗ xe trên đường phải thực hiện các quy định sau đây: a) có tín hiệu báo cho người điều khiển phương tiện tham gia giao thông đường bộ khác biết khi ra, vào vị trí dừng xe, đỗ xe; b) không làm ảnh hưởng đến người đi bộ và các phương tiện tham gia giao thông đường bộ. 4. người điều khiển phương tiện tham gia giao thông đường bộ không được dừng xe, đỗ xe tại các vị trí sau đây: a) bên trái đường một chiều; b) trên đoạn đường cong hoặc gần đầu dốc mà tầm nhìn bị che khuất; c) trên cầu, trừ những trường hợp tổ chức giao thông cho phép; d) gầm cầu vượt, trừ những nơi cho phép dừng xe, đỗ xe; đ) song song cùng chiều với một xe khác đang dừng, đỗ trên đường; e) cách xe ô tô đang đỗ ngược chiều dưới 20 mét trên đường phố hẹp, \ndưới 40 mét trên đường có một làn xe cơ giới trên một chiều đường; g) trên phần đường dành cho người đi bộ qua đường; h) nơi đường giao nhau và trong phạm vi 05 mét tính từ mép đường giao nhau; i) điểm đón, trả khách; k) trước cổng và trong phạm vi 05 mét hai bên cổng trụ sở cơ quan, tổ chức có bố trí đường cho xe ra, vào; l) tại nơi phần đường có chiều rộng chỉ đủ cho một làn xe cơ giới; m) trong phạm vi an toàn của đường sắt; n) che khuất biển báo hiệu đường bộ, đèn tín hiệu giao thông; o) trên đường dành riêng cho xe buýt, trên miệng cống thoát nước, miệng hầm của đường điện thoại, điện cao thế, chỗ dành riêng cho xe chữa cháy lấy nước; trên lòng đường, vỉa hè trái quy định của pháp luật. 5. trên đường bộ, người điều khiển phương tiện tham gia giao thông đường bộ chỉ được dừng xe, đỗ xe ở nơi có lề đường rộng hoặc khu đất ở bên ngoài phần đường xe chạy; trường hợp lề đường hẹp hoặc không có lề đường thì chỉ được dừng xe, đỗ xe sát mép đường phía bên phải theo chiều đi của mình. 6. trên đường phố, người điều khiển phương tiện tham gia giao thông đường bộ chỉ được dừng xe, đỗ xe sát theo lề đường, vỉa hè phía bên phải theo chiều đi của mình; bánh xe gần nhất không được cách xa lề đường, vỉa hè quá 0,25 mét và không gây cản trở, nguy hiểm cho người và phương tiện tham gia giao thông đường bộ. 7. trong trường hợp gặp sự cố kỹ thuật hoặc bất khả kháng khác buộc phải đỗ xe, khi đỗ xe chiếm một phần đường xe chạy hoặc tại nơi không được phép đỗ, phải có báo hiệu bằng đèn khẩn cấp hoặc đặt biển cảnh báo về phía sau xe để người điều khiển phương tiện tham gia giao thông đường bộ khác biết.']","**Nguồn văn bản:** 158_2024_ND-CP_636875

**Tên văn bản:** Nghị định Quy định về hoạt động vận tải đường bộ

**Điều 5:** kinh doanh vận tải hành khách công cộng bằng xe buýt

**Nội dung:**

1. Đơn vị kinh doanh vận tải có giấy phép kinh doanh vận tải bằng ô tô, trong đó có loại hình kinh doanh vận tải hành khách công cộng bằng xe buýt thì được tham gia kinh doanh vận tải công cộng bằng xe buýt trên các tuyến xe buýt nội tỉnh, tuyến xe buýt liên tỉnh.

2. Xe ô tô kinh doanh vận tải hành khách công cộng bằng xe buýt:
    a) Phải có chỗ ưu tiên cho người khuyết tật, người cao tuổi và phụ nữ mang thai và trẻ em dưới 6 tuổi.
    b) Phải có phù hiệu “xe buýt” theo mẫu số 03 phụ lục XIII kèm theo nghị định này và được dán cố định tại góc trên bên phải ngay sát phía dưới vị trí của tem kiểm định, mặt trong kính chắn gió phía trước của xe; phải được niêm yết đầy đủ các thông tin trên xe.
    c) Vị trí, số chỗ ngồi, chỗ đứng cho hành khách và các quy định kỹ thuật khác đối với xe buýt theo quy chuẩn kỹ thuật quốc gia về chất lượng an toàn kỹ thuật và bảo vệ môi trường đối với xe ô tô.

3. Sở giao thông vận tải thực hiện nội dung quản lý tuyến đối với tuyến xe buýt nội tỉnh, tuyến xe buýt liên tỉnh:
    a) Xây dựng, điều chỉnh, bổ sung và công bố danh mục mạng lưới tuyến, biểu đồ chạy xe trên các tuyến, giá vé.
    b) Đề xuất, xây dựng và báo cáo ủy ban nhân dân cấp tỉnh: về các chính sách hỗ trợ của nhà nước về khuyến khích phát triển vận tải hành khách công cộng bằng xe buýt trên địa bàn địa phương; việc tổ chức đấu thầu, tiêu chí để đặt hàng khai thác đối với tuyến xe buýt trong danh mục mạng lưới tuyến đã công bố theo quy định của pháp luật về thầu; tổ chức đặt hàng khai thác đối với tuyến xe buýt liên tỉnh và tuyến xe buýt có sử dụng xe ô tô thoáng nóc chở khách du lịch không được hỗ trợ kinh phí hoạt động từ ngân sách nhà nước trong danh mục mạng lưới tuyến đã công bố.
    c) Xây dựng, bảo trì và quản lý kết cấu hạ tầng phục vụ hoạt động xe buýt; quyết định tiêu chí kỹ thuật, vị trí điểm đầu, điểm cuối và điểm dừng của tuyến xe buýt trên địa bàn địa phương.
    d) Theo dõi, tổng hợp kết quả hoạt động vận tải của các đơn vị kinh doanh vận tải trên tuyến; thống kê sản lượng hành khách.

4. Đơn vị kinh doanh vận tải hành khách bằng xe buýt thực hiện lưu trữ lệnh vận chuyển như sau:
    a) Lưu trữ lệnh vận chuyển của các chuyến xe đã thực hiện (không được hỗ trợ kinh phí hoạt động từ ngân sách nhà nước) trong thời hạn ít nhất là 03 năm.
    b) Lưu trữ lệnh vận chuyển của các chuyến xe đã thực hiện (được hỗ trợ kinh phí hoạt động từ ngân sách nhà nước) theo thời hạn tài liệu kế toán phải lưu trữ được quy định tại khoản 5 điều 41 luật kế toán năm 2015.

5. Xe buýt được ưu tiên bố trí nơi dừng, đỗ để đón, trả khách tại các bến xe, nhà ga, sân bay, bến cảng, khu du lịch, điểm du lịch, cơ sở lưu trú du lịch, điểm tham quan du lịch, địa điểm văn hóa, thể thao, trung tâm thương mại, đầu mối giao thông và các địa điểm kết nối với các phương thức vận tải khác; được ưu tiên hoạt động khi tổ chức giao thông tại đô thị.


**Nguồn văn bản:** 36_2024_QH15_444251

**Tên văn bản:** Luật Trật tự, an toàn giao thông đường bộ

**Điều 18:** Dừng xe, đỗ xe

**Nội dung:**

4. Người điều khiển phương tiện tham gia giao thông đường bộ không được dừng xe, đỗ xe tại các vị trí sau đây:
    o) Trên đường dành riêng cho xe buýt, trên miệng cống thoát nước, miệng hầm của đường điện thoại, điện cao thế, chỗ dành riêng cho xe chữa cháy lấy nước; trên lòng đường, vỉa hè trái quy định của pháp luật.


Tóm lại:  Nghị định 158/2024/NĐ-CP quy định về hoạt động kinh doanh vận tải hành khách công cộng bằng xe buýt, bao gồm điều kiện kinh doanh,  quy chuẩn kỹ thuật xe buýt và ưu tiên hoạt động của xe buýt. Luật giao thông đường bộ 36/2024/QH15 nghiêm cấm dừng, đỗ xe trên đường dành riêng cho xe buýt.
",Cấm các phương tiện không phải xe buýt sử dụng làn đường dành riêng cho xe buýt trong giờ cao điểm.,0.8,0.5437583379620615,0.0,0.0
19,"Quy định mới về việc sử dụng còi xe trong khu vực bệnh viện, trường học là gì?","['1. phạt tiền từ 200.000 đồng đến 400.000 đồng đối với người điều khiển xe thực hiện một trong các hành vi vi phạm sau đây: a) không chấp hành hiệu lệnh, chỉ dẫn của biển báo hiệu, vạch kẻ đường, trừ các hành vi vi phạm quy định tại điểm b, điểm d, điểm e khoản 2; điểm a, điểm c, điểm d, điểm h khoản 3; điểm a, điểm b, điểm c, điểm d khoản 4; điểm b, điểm d khoản 6; điểm a, điểm b, điểm c khoản 7; điểm a khoản 8; điểm b khoản 9; điểm a khoản 10 điều này; b) không có tín hiệu trước khi vượt hoặc có tín hiệu vượt xe nhưng không sử dụng trong suốt quá trình vượt xe; c) lùi xe mô tô ba bánh không quan sát hai bên, phía sau xe hoặc không có tín hiệu lùi xe; d) chở người ngồi trên xe sử dụng ô (dù); đ) không tuân thủ các quy định về nhường đường tại nơi đường giao nhau, trừ các hành vi vi phạm quy định tại điểm c, điểm d khoản 6 điều này; e) chuyển làn đường không đúng nơi cho phép hoặc không có tín hiệu báo trước hoặc chuyển làn đường không đúng quy định “mỗi lần chuyển làn đường chỉ được phép chuyển sang một làn đường liền kề”; g) không sử dụng đèn chiếu sáng trong thời gian từ 18 giờ ngày hôm trước đến 06 giờ ngày hôm sau hoặc khi có sương mù, khói, bụi, trời mưa, thời tiết xấu làm hạn chế tầm nhìn; h) tránh xe không đúng quy định; sử dụng đèn chiếu xa khi gặp người đi bộ qua đường hoặc khi đi trên đoạn đường qua khu dân cư có hệ thống chiếu sáng đang hoạt động hoặc khi gặp xe đi ngược chiều (trừ trường hợp dải phân cách có khả năng chống chói) hoặc khi chuyển hướng xe tại nơi đường giao nhau; không nhường đường cho xe đi ngược chiều theo quy định tại nơi đường hẹp, đường dốc, nơi có chướng ngại vật; i) sử dụng còi trong thời gian từ 22 giờ ngày hôm trước đến 05 giờ ngày hôm sau trong khu đông dân cư, khu vực cơ sở khám bệnh, chữa bệnh, trừ các xe ưu tiên đang đi làm nhiệm vụ theo quy định; k) điều khiển xe chạy dưới tốc độ tối thiểu trên đoạn đường bộ có quy định tốc độ tối thiểu cho phép. 2. phạt tiền từ 400.000 đồng đến 600.000 đồng đối với người điều khiển xe thực hiện một trong các hành vi vi phạm sau đây: a) dừng xe, đỗ xe trên phần đường xe chạy ở đoạn đường ngoài đô thị nơi có lề đường; b) điều khiển xe chạy quá tốc độ quy định từ 05 km/h đến dưới 10 km/h; c) điều khiển xe chạy tốc độ thấp mà không đi bên phải phần đường xe chạy gây cản trở giao thông; d) dừng xe, đỗ xe ở lòng đường gây cản trở giao thông; tụ tập từ 03 xe trở lên ở lòng đường, trong hầm đường bộ; đỗ, để xe ở lòng đường, vỉa hè trái phép; đ) xe không được quyền ưu tiên lắp đặt, sử dụng thiết bị phát tín hiệu của xe được quyền ưu tiên; e) dừng xe, đỗ xe trên điểm đón, trả khách, nơi đường bộ giao nhau, trên phần đường dành cho người đi bộ qua đường; dừng xe nơi có biển “cấm dừng xe và đỗ xe”; đỗ xe tại nơi có biển “cấm đỗ xe” hoặc biển “cấm dừng xe và đỗ xe”; không tuân thủ các quy định về dừng xe, đỗ xe tại nơi đường bộ giao nhau cùng mức với đường sắt; dừng xe, đỗ xe trong phạm vi hành lang an toàn giao thông đường sắt; g) chở theo 02 người trên xe, trừ trường hợp chở người bệnh đi cấp cứu, trẻ em dưới 12 tuổi, người già yếu hoặc người khuyết tật, áp giải người có hành vi vi phạm pháp luật; h) không đội “mũ bảo hiểm cho người đi mô tô, xe máy” hoặc đội “mũ bảo hiểm cho người đi mô tô, xe máy” không cài quai đúng quy cách khi điều khiển xe tham gia giao thông trên đường bộ; i) chở người ngồi trên xe không đội “mũ bảo hiểm cho người đi mô tô, xe máy” hoặc đội “mũ bảo hiểm cho người đi mô tô, xe máy” không cài quai đúng quy cách, trừ trường hợp chở người bệnh đi cấp cứu, trẻ em dưới 06 tuổi, áp giải người có hành vi vi phạm pháp luật; k) quay đầu xe tại nơi không được quay đầu xe, trừ hành vi vi phạm quy định tại điểm d khoản 4 điều này. 3. phạt tiền từ 600.000 đồng đến 800.000 đồng đối với người điều khiển xe thực hiện một trong các hành vi vi phạm sau đây: a) chuyển hướng không quan sát hoặc không bảo đảm khoảng cách an toàn với xe phía sau hoặc không giảm tốc độ hoặc không có tín hiệu báo hướng rẽ hoặc có tín hiệu báo hướng rẽ nhưng không sử dụng liên tục trong quá trình chuyển hướng (trừ trường hợp điều khiển xe đi theo hướng cong của đoạn đường bộ ở nơi đường không giao nhau cùng mức); điều khiển xe rẽ trái tại nơi có biển báo hiệu có nội dung cấm rẽ trái đối với loại phương tiện đang điều khiển; điều khiển xe rẽ phải tại nơi có biển báo hiệu có nội dung cấm rẽ phải đối với loại phương tiện đang điều khiển; b) chở theo từ 03 người trở lên trên xe; c) dừng xe, đỗ xe trên cầu; d) điều khiển xe không đi bên phải theo chiều đi của mình; đi không đúng phần đường, làn đường quy định (làn cùng chiều hoặc làn ngược chiều); điều khiển xe đi qua dải phân cách cố định ở giữa hai phần đường xe chạy; đ) vượt bên phải trong trường hợp không được phép; e) người đang điều khiển xe hoặc chở người ngồi trên xe bám, kéo, đẩy xe khác, vật khác, dẫn dắt vật nuôi, mang vác vật cồng kềnh; chở người đứng trên yên, giá đèo hàng hoặc ngồi trên tay lái của xe; g) điều khiển xe kéo theo xe khác, vật khác; h) chạy trong hầm đường bộ không sử dụng đèn chiếu sáng gần; i) không giữ khoảng cách an toàn để xảy ra va chạm với xe chạy liền trước hoặc không giữ khoảng cách theo quy định của biển báo hiệu “cự ly tối thiểu giữa hai xe”; k) điều khiển xe chạy dàn hàng ngang từ 03 xe trở lên; l) xe được quyền ưu tiên lắp đặt, sử dụng thiết bị phát tín hiệu ưu tiên không đúng quy định hoặc sử dụng thiết bị phát tín hiệu ưu tiên mà không có giấy phép của cơ quan có thẩm quyền cấp hoặc có giấy phép của cơ quan có thẩm quyền cấp nhưng không còn giá trị sử dụng theo quy định. 4. phạt tiền từ 800.000 đồng đến 1.000.000 đồng đối với người điều khiển xe thực hiện một trong các hành vi vi phạm sau đây: a) điều khiển xe chạy quá tốc độ quy định từ 10 km/h đến 20 km/h; b) dừng xe, đỗ xe trong hầm đường bộ không đúng nơi quy định; c) vượt xe trong những trường hợp không được vượt, vượt xe tại đoạn đường có biển báo hiệu có nội dung cấm vượt đối với loại phương tiện đang điều khiển, trừ các hành vi vi phạm quy định tại điểm đ khoản 3 điều này; d) quay đầu xe trong hầm đường bộ; đ) người đang điều khiển xe sử dụng ô (dù), thiết bị âm thanh (trừ thiết bị trợ thính), dùng tay cầm và sử dụng điện thoại hoặc các thiết bị điện tử khác. 5. phạt tiền từ 1.000.000 đồng đến 2.000.000 đồng đối với người điều khiển xe thực hiện một trong các hành vi vi phạm sau đây: a) điều khiển xe có liên quan trực tiếp đến vụ tai nạn giao thông mà không dừng ngay phương tiện, không giữ nguyên hiện trường, không trợ giúp người bị nạn, trừ hành vi vi phạm quy định tại điểm c khoản 9 điều này; b) chuyển hướng không nhường quyền đi trước cho: người đi bộ, xe lăn của người khuyết tật qua đường tại nơi có vạch kẻ đường dành cho người đi bộ; xe thô sơ đang đi trên phần đường dành cho xe thô sơ; c) chuyển hướng không nhường đường cho: các xe đi ngược chiều; người đi bộ, xe thô sơ đang qua đường tại nơi không có vạch kẻ đường cho người đi bộ. 6. phạt tiền từ 2.000.000 đồng đến 3.000.000 đồng đối với người điều khiển xe thực hiện một trong các hành vi vi phạm sau đây: a) điều khiển xe trên đường mà trong máu hoặc hơi thở có nồng độ cồn nhưng chưa vượt quá 50 miligam/100 mililít máu hoặc chưa vượt quá 0,25 miligam/1 lít khí thở; b) đi vào khu vực cấm, đường có biển báo hiệu có nội dung cấm đi vào đối với loại phương tiện đang điều khiển, trừ các hành vi vi phạm quy định tại điểm a, điểm b khoản 7 điều này và các trường hợp xe ưu tiên đang đi làm nhiệm vụ khẩn cấp theo quy định; c) không giảm tốc độ (hoặc dừng lại) và nhường đường khi điều khiển xe đi từ đường không ưu tiên ra đường ưu tiên, từ đường nhánh ra đường chính; d) không giảm tốc độ và nhường đường cho xe đi đến từ bên phải tại nơi đường giao nhau không có báo hiệu đi theo vòng xuyến; không giảm tốc độ và nhường đường cho xe đi đến từ bên trái tại nơi đường giao nhau có báo hiệu đi theo vòng xuyến. 7. phạt tiền từ 4.000.000 đồng đến 6.000.000 đồng đối với người điều khiển xe thực hiện một trong các hành vi vi phạm sau đây: a) đi ngược chiều của đường một chiều, đi ngược chiều trên đường có biển “cấm đi ngược chiều”, trừ hành vi vi phạm quy định tại điểm b khoản này và các trường hợp xe ưu tiên đang đi làm nhiệm vụ khẩn cấp theo quy định; điều khiển xe đi trên vỉa hè, trừ trường hợp điều khiển xe đi qua vỉa hè để vào nhà, cơ quan; b) điều khiển xe đi vào đường cao tốc, trừ xe phục vụ việc quản lý, bảo trì đường cao tốc; c) không chấp hành hiệu lệnh của đèn tín hiệu giao thông; d) không chấp hành hiệu lệnh, hướng dẫn của người điều khiển giao thông hoặc người kiểm soát giao thông; đ) không nhường đường hoặc gây cản trở xe được quyền ưu tiên đang phát tín hiệu ưu tiên đi làm nhiệm vụ. 8. phạt tiền từ 6.000.000 đồng đến 8.000.000 đồng đối với người điều khiển xe thực hiện một trong các hành vi vi phạm sau đây: a) điều khiển xe chạy quá tốc độ quy định trên 20 km/h; b) điều khiển xe trên đường mà trong máu hoặc hơi thở có nồng độ cồn vượt quá 50 miligam đến 80 miligam/100 mililít máu hoặc vượt quá 0,25 miligam đến 0,4 miligam/1 lít khí thở. 9. phạt tiền từ 8.000.000 đồng đến 10.000.000 đồng đối với người điều khiển xe thực hiện một trong các hành vi vi phạm sau đây: a) điều khiển xe lạng lách, đánh võng trên đường bộ; sử dụng chân chống hoặc vật khác quệt xuống đường khi xe đang chạy; b) điều khiển xe thành nhóm từ 02 xe trở lên chạy quá tốc độ quy định; c) gây tai nạn giao thông không dừng ngay phương tiện, không giữ nguyên hiện trường, không trợ giúp người bị nạn, không ở lại hiện trường hoặc không đến trình báo ngay với cơ quan công an, ủy ban nhân dân nơi gần nhất; d) điều khiển xe trên đường mà trong máu hoặc hơi thở có nồng độ cồn vượt quá 80 miligam/100 mililít máu hoặc vượt quá 0,4 miligam/1 lít khí thở; đ) không chấp hành yêu cầu kiểm tra về nồng độ cồn của người thi hành công vụ; e) điều khiển xe trên đường mà trong cơ thể có chất ma túy hoặc chất kích thích khác mà pháp luật cấm sử dụng; g) không chấp hành yêu cầu kiểm tra về chất ma túy hoặc chất kích thích khác mà pháp luật cấm sử dụng của người thi hành công vụ; h) ngồi phía sau vòng tay qua người ngồi trước để điều khiển xe, trừ trường hợp chở trẻ em dưới 06 tuổi ngồi phía trước; i) điều khiển xe thành đoàn gây cản trở giao thông, trừ trường hợp được cơ quan có thẩm quyền cấp phép; k) sử dụng còi, rú ga (nẹt pô) liên tục trong khu đông dân cư, khu vực cơ sở khám bệnh, chữa bệnh, trừ các xe ưu tiên đang đi làm nhiệm vụ theo quy định. 10. phạt tiền từ 10.000.000 đồng đến 14.000.000 đồng đối với người điều khiển xe thực hiện một trong các hành vi vi phạm sau đây: a) điều khiển xe không quan sát, giảm tốc độ hoặc dừng lại để bảo đảm an toàn theo quy định mà gây tai nạn giao thông; điều khiển xe chạy quá tốc độ quy định gây tai nạn giao thông; đi vào đường cao tốc, dừng xe, đỗ xe, quay đầu xe, lùi xe, vượt xe, chuyển hướng, chuyển làn đường không đúng quy định gây tai nạn giao thông; không đi đúng phần đường, làn đường, không giữ khoảng cách an toàn giữa hai xe theo quy định gây tai nạn giao thông hoặc đi vào đường có biển báo hiệu có nội dung cấm đi vào đối với loại phương tiện đang điều khiển, đi ngược chiều của đường một chiều, đi ngược chiều trên đường có biển “cấm đi ngược chiều” gây tai nạn giao thông; b) vi phạm quy định tại một trong các điểm, khoản sau của điều này mà gây tai nạn giao thông: điểm a, điểm d, điểm đ, điểm g, điểm h, điểm i, điểm k khoản 1; điểm c, điểm đ, điểm g khoản 2; điểm b, điểm e, điểm g, điểm h, điểm k khoản 3; điểm đ khoản 4; điểm c, điểm d khoản 6; điểm c, điểm d, điểm đ khoản 7; điểm a, điểm b, điểm h, điểm k khoản 9 điều này. 11. tịch thu phương tiện đối với người điều khiển xe thực hiện một trong các hành vi vi phạm sau đây: a) buông cả hai tay khi đang điều khiển xe; dùng chân điều khiển xe; ngồi về một bên điều khiển xe; nằm trên yên xe điều khiển xe; thay người điều khiển khi xe đang chạy; quay người về phía sau để điều khiển xe hoặc bịt mắt điều khiển xe; b) điều khiển xe chạy bằng một bánh đối với xe hai bánh, chạy bằng hai bánh đối với xe ba bánh; c) tái phạm hành vi điều khiển xe lạng lách, đánh võng quy định tại điểm a khoản 9 điều này. 12. ngoài việc bị áp dụng hình thức xử phạt chính, người điều khiển xe thực hiện hành vi vi phạm còn bị áp dụng các hình thức xử phạt bổ sung sau đây: a) thực hiện hành vi quy định tại điểm đ khoản 2 điều này còn bị tịch thu thiết bị phát tín hiệu ưu tiên lắp đặt, sử dụng trái quy định; b) thực hiện hành vi quy định tại điểm a, điểm b, điểm h, điểm i, điểm k khoản 9 điều này bị tước quyền sử dụng giấy phép lái xe từ 10 tháng đến 12 tháng; c) thực hiện hành vi quy định tại điểm d, điểm đ, điểm e, điểm g khoản 9; khoản 11 điều này bị tước quyền sử dụng giấy phép lái xe từ 22 tháng đến 24 tháng. 13. ngoài việc bị áp dụng hình thức xử phạt, người điều khiển xe thực hiện hành vi vi phạm còn bị trừ điểm giấy phép lái xe như sau: a) thực hiện hành vi quy định tại điểm b khoản 3; khoản 5; điểm b, điểm c, điểm d khoản 6; điểm a khoản 7 điều này bị trừ điểm giấy phép lái xe 02 điểm; b) thực hiện hành vi quy định tại điểm đ khoản 4; điểm a khoản 6; điểm c, điểm d, điểm đ khoản 7; điểm a khoản 8 điều này bị trừ điểm giấy phép lái xe 04 điểm; c) thực hiện hành vi quy định tại điểm b khoản 7, điểm c khoản 9 điều này bị trừ điểm giấy phép lái xe 06 điểm; d) thực hiện hành vi quy định tại điểm b khoản 8, khoản 10 điều này bị trừ điểm giấy phép lái xe 10 điểm.', '1. chỉ được sử dụng tín hiệu còi của phương tiện tham gia giao thông đường bộ trong các trường hợp sau đây: a) báo hiệu cho người tham gia giao thông đường bộ khi xuất hiện tình huống có thể mất an toàn giao thông; b) báo hiệu chuẩn bị vượt xe. 2. không sử dụng còi liên tục; không sử dụng còi có âm lượng không đúng quy định; không sử dụng còi trong thời gian từ 22 giờ ngày hôm trước đến 05 giờ ngày hôm sau trong khu đông dân cư, khu vực cơ sở khám bệnh, chữa bệnh, trừ xe ưu tiên.', '1. quy chuẩn kỹ thuật quốc gia về cơ sở vật chất kỹ thuật và vị trí cơ sở đăng kiểm xe cơ giới, cơ sở kiểm định khí thải xe mô tô, xe gắn máy. mã số: qcvn 103:2024/bgtvt. 2. quy chuẩn kỹ thuật quốc gia về cơ sở bảo hành, bảo dưỡng xe cơ giới. mã số: qcvn 121:2025/bgtvt. điều 2. 1. thông tư này có hiệu lực thi hành kể từ ngày 01 tháng 01 năm 2025. 2. bãi bỏ thông tư số 30/2019/tt-bgtvt ngày 28 tháng 8 năm 2019 của bộ trưởng bộ giao thông vận tải về việc ban hành quy chuẩn kỹ thuật quốc gia về đơn vị đăng kiểm xe cơ giới qcvn 103:2019/bgtvt. qcvn 103:2024/bgtvt quy chuẩn kỹ thuật quốc gia về cơ sở vật chất kỹ thuật và vị trí cơ sở đăng kiểm xe cơ giới, cơ sở kiểm định khí thải xe mô tô, xe gắn máy national technical regulations on technical facilities and location of vehicle inspection station, motorcycles and mopeds emission inspection stations lời nói đầu qcvn 103:2024/bgtvt do cục đăng kiểm việt nam biên soạn, vụ khoa học công nghệ và môi trường trình duyệt, bộ khoa học và công nghệ thẩm định, bộ trưởng bộ giao thông vận tải ban hành kèm theo thông tư số 50/2024/tt-bgtvt ngày 15 tháng 11 năm 2024 qcvn 103:2024/bgtvt thay thế cho qcvn 103:2019/bgtvt được ban hành bởi thông tư số 30/2019/tt-bgtvt ngày 28 tháng 8 năm 2019 của bộ trưởng bộ giao thông vận tải. quy chuẩn kỹ thuật quốc gia về cơ sở vật chất kỹ thuật và vị trí cơ sở đăng kiểm xe cơ giới, cơ sở kiểm định khí thải xe mô tô, xe gắn máy national technical regulations on technical facilities and location of vehicle inspection station, motorcycles and mopeds emission inspection stations i. quy định chung 1.1. phạm vi điều chỉnh quy chuẩn này quy định yêu cầu kỹ thuật về cơ sở vật chất và vị trí của cơ sở đăng kiểm xe cơ giới, cơ sở kiểm định khí thải xe mô tô, xe gắn máy. 1.2. đối tượng áp dụng quy chuẩn này áp dụng đối với tổ chức, cá nhân có liên quan đến yêu cầu kỹ thuật về cơ sở vật chất và vị trí của cơ sở đăng kiểm xe cơ giới, cơ sở kiểm định khí thải xe mô tô, xe gắn máy. quy chuẩn này không áp dụng đối với cơ sở đăng kiểm xe cơ giới, cơ sở kiểm định khí thải xe mô tô, xe gắn máy sử dụng vào mục đích quốc phòng, an ninh. 2. quy định về cơ sở vật chất kỹ thuật và vị trí cơ sở đăng kiểm xe cơ giới 2.1. yêu cầu chung 2.1.1. cơ sở vật chất kỹ thuật của cơ sở đăng kiểm bao gồm: mặt bằng; khu vực xe chờ; đường nội bộ; xưởng kiểm định; nhà văn phòng; dây chuyền kiểm định; vị trí kiểm tra; thiết bị, dụng cụ kiểm tra; thiết bị, dụng cụ hỗ trợ kiểm tra; hệ thống thông tin quản lý kiểm định; thông tin niêm yết và các hệ thống, thiết bị hỗ trợ việc kiểm định xe cơ giới. 2.1.2. có khu vực dành cho xe chờ vào kiểm định và xe chờ cấp kết quả kiểm định. các khu vực này không được sử dụng chung với khu vực kiểm tra. 2.1.3. hệ thống đường nội bộ cho xe cơ giới và khu vực đỗ xe được phủ bê tông nhựa hoặc bê tông xi măng; chiều rộng mặt đường (phần vật liệu phủ) không nhỏ hơn 3,0 mét. 2.1.4. có trang bị các hệ thống, thiết bị hỗ trợ, bao gồm: 2.1.4.1. hệ thống âm thanh để thông báo cho chủ xe; 2.1.4.2. màn hình hiển thị có kích thước tối thiểu 32 inch tại phòng chờ khách hàng để công khai quá trình hoạt động kiểm định ở các vị trí kiểm tra; 2.1.4.3. hệ thống camera, máy ảnh chụp ảnh xe cơ giới vào kiểm định có hiển thị thời gian chụp trên ảnh và có độ phân giải từ 1280x720 pixels trở lên; 2.1.4.4. thiết bị thông gió cưỡng bức ở vị trí kiểm tra khí thải nếu vị trí kiểm tra khí thải ở trong nhà xưởng. 2.1.5. các thiết bị kiểm tra tối thiểu gồm: 2.1.5.1. thiết bị kiểm tra phanh; 2.1.5.2. thiết bị đo độ trượt ngang của bánh xe; 2.1.5.3. thiết bị phân tích khí thải (phương tiện đo nồng độ các khí trong khí thải); 2.1.5.4. thiết bị đo độ khói; 2.1.5.5. thiết bị đo âm lượng (phương tiện đo độ ồn); 2.1.5.6. thiết bị kiểm tra đèn chiếu sáng phía trước; 2.1.5.7. thiết bị nêu tại điểm 2.1.5.3 không áp dụng với cơ sở đăng kiểm chỉ kiểm định xe trang bị động cơ cháy do nén (diessel) và xe điện; 2.1.5.8. thiết bị nêu tại điểm 2.1.5.4 không áp dụng với cơ sở đăng kiểm chỉ kiểm định xe trang bị động cơ cháy cưỡng bức và xe điện; 2.1.5.9. thiết bị nêu tại điểm 2.1.5.3, điểm 2.1.5.4, điểm 2.1.5.5 và điểm 2.1.5.6 có thể dùng chung cho các dây chuyền kiểm định; 2.1.5.10. trường hợp thiết bị kiểm tra đèn chiếu sáng phía trước dùng chung giữa các dây chuyền kiểm định thì phải được lắp đặt trên cùng một đường ray. 2.1.6. các thiết bị hỗ trợ kiểm tra tối thiểu gồm: 2.1.6.1. thiết bị hỗ trợ kiểm tra gầm; 2.1.6.2. kích nâng; 2.1.6.3. thiết bị nâng (cầu nâng) xe cơ giới hoặc hầm kiểm tra; 2.1.6.4. trường hợp sử dụng cầu nâng thay thế hầm kiểm tra thì không cần trang bị thiết bị tại điểm 2.1.6.1. 2.1.7. các dụng cụ kiểm tra tối thiểu gồm: 2.1.7.1. thước đo chiều dài (thước cuộn); 2.1.7.2. búa kiểm tra; 2.1.7.3. dụng cụ kiểm tra áp suất lốp; 2.1.7.4. đèn soi kiểm tra cầm tay; 2.1.7.5. các dụng cụ kiểm tra nêu tại điểm 2.1.7 được dùng chung cho các dây chuyền kiểm định. 2.1.8. các dụng cụ hỗ trợ kiểm tra tối thiểu gồm: 2.1.8.1. gương hoặc camera quan sát hỗ trợ kiểm tra đèn tín hiệu; 2.1.8.2. cục chèn bánh xe; 2.1.8.3. thanh, đòn hỗ trợ kiểm tra bánh xe; 2.1.8.4. các dụng cụ nêu tại điểm 2.1.8 được dùng chung cho các dây chuyền kiểm định. 2.1.9. thiết bị, dụng cụ để thực hiện kiểm định ngoài cơ sở đăng kiểm gồm: 2.1.9.1. thiết bị kiểm tra quy định tại điểm 2.1.5 (trừ điểm 2.1.5.1 và điểm 2.1.5.2); 2.1.9.2. kích nâng di động; 2.1.9.3. dụng cụ kiểm tra quy định tại điểm 2.1.7 và dụng cụ hỗ trợ kiểm tra quy định điểm 2.1.8 (trừ điểm 2.1.8.1); 2.1.9.4. dụng cụ đo tốc độ (để phục vụ cho việc kiểm tra hiệu quả phanh ở trên đường). 2.1.10. thiết bị kiểm tra được bố trí trong một hoặc nhiều xưởng kiểm định; riêng thiết bị phân tích khí thải và thiết bị đo độ khói có thể bố trí ngoài xưởng kiểm định. 2.1.11. tài liệu của thiết bị kiểm tra 2.1.11.1. đối với các thiết bị kiểm tra chưa qua sử dụng: 2.1.11.1.1. chứng nhận xuất xứ (certificate of origin - c/o) - không áp dụng với thiết bị được sản xuất trong nước; chứng nhận chất lượng của nhà sản xuất thiết bị (certificate of quality - c/q); 2.1.11.1.2. tài liệu hướng dẫn sử dụng (bản giấy hoặc bản điện tử) bằng tiếng việt trong đó có thể hiện thông số kỹ thuật và hướng dẫn sử dụng các tính năng của thiết bị; tài liệu chứng minh thiết bị kiểm tra phải thỏa mãn tối thiểu một trong các tiêu chuẩn tương ứng như: iso, oiml, iec, tcvn và đảm bảo các yêu cầu kỹ thuật đo lường theo văn bản kỹ thuật đo lường việt nam (đlvn). 2.1.11.2. đối với các thiết bị kiểm tra đã qua sử dụng: tài liệu hướng dẫn sử dụng (bản giấy hoặc bản điện tử) bằng tiếng việt trong đó có thể hiện thông số kỹ thuật và hướng dẫn sử dụng các tính năng của thiết bị. 2.1.12. các thiết bị kiểm tra gồm: thiết bị kiểm tra phanh, thiết bị đo độ trượt ngang của bánh xe, thiết bị đo độ khói phải được trang bị kèm theo bộ dụng cụ kiểm tra, đánh giá độ chính xác phù hợp với kiểu loại thiết bị theo quy định của nhà sản xuất. 2.1.13. sai số cho phép đối với các kích thước của thiết bị, kích thước lắp đặt thiết bị, dải đo, độ chính xác được xác định theo công bố của nhà sản xuất thiết bị nhưng không vượt quá giá trị giới hạn cho phép tương ứng quy định tại điểm 2.4.2 của quy chuẩn này. 2.1.14. mỗi cơ sở đăng kiểm có ít nhất một thiết bị kiểm tra phanh có chức năng kiểm tra thực tế được loại xe có kiểu dẫn động bốn bánh toàn thời gian (awd) hoạt động ở chế độ bốn bánh toàn thời gian. 2.1.15. trường hợp cơ sở đăng kiểm xe cơ giới được bố trí chung với bến xe, trạm dừng nghỉ thì khu vực xe chờ, đường nội bộ và nhà văn phòng có thể dùng chung với bến xe, trạm dừng nghỉ. 2.2. xưởng kiểm định, vị trí kiểm tra 2.2.1. xưởng kiểm định 2.2.1.1. đối với xưởng kiểm định chỉ có một dây chuyền kiểm định loại i: kích thước thông xe tối thiểu (dài x rộng x cao) là 30 x 4 x 3,5 (m). 2.2.1.2. đối với xưởng kiểm định chỉ có một dây chuyền kiểm định loại ii: kích thước thông xe tối thiểu (dài x rộng x cao) là 36 x 5 x 4,5 (m). 2.2.1.3. đối với xưởng kiểm định có bố trí nhiều dây chuyền kiểm định, kích thước thông xe tối thiểu phải đảm bảo: 2.2.1.3.1. khoảng cách giữa tâm hai dây chuyền kiểm định cạnh nhau không nhỏ hơn 4 m; 2.2.1.3.2. khoảng cách từ tâm các dây chuyền ngoài cùng đến mặt trong tường bao gần nhất (hoặc tới mép gần nhất công trình cố định) của xưởng kiểm định không nhỏ hơn 2,0 m; 2.2.1.3.3. chiều dài, chiều cao của kích thước thông xe tối thiểu với từng loại dây chuyền phải đáp ứng quy định tương ứng tại điểm 2.2.1.1 và điểm 2.2.1.2. 2.2.1.4. trong không gian giới hạn bởi kích thước thông xe tối thiểu nêu tại điểm 2.2.1.1, điểm 2.2.1.2 và điểm 2.2.1.3 không được bố trí vật cản hoặc công trình cố định ảnh hưởng tới sự di chuyển của phương tiện và thao tác của đăng kiểm viên trong quá trình kiểm định. 2.2.1.5. đối với trường hợp dây chuyền kiểm định bố trí tại nhiều xưởng kiểm định thì tổng chiều dài tối thiểu các xưởng kiểm định phải bằng chiều dài tương ứng với loại dây chuyền quy định tại điểm 2.2.1.1 và điểm 2.2.1.2. 2.2.1.6. nhà xưởng kiểm định được xây dựng đảm bảo kết cấu chắc chắn, có mái che, đảm bảo thông gió, chiếu sáng và không bị hắt nước vào thiết bị khi trời mưa. có sơn sọc màu vàng-đen được sơn theo quy cách bề rộng 10 cm, nghiêng 45 độ để cảnh báo tại nơi lắp đặt của các thiết bị kiểm tra (thiết bị kiểm tra phanh, thiết bị đo độ trượt ngang, hầm kiểm tra, thiết bị hỗ trợ kiểm tra gầm). các vị trí kiểm tra phải được đánh dấu bằng việc sơn đường viền màu vàng trên sàn nhà xưởng với chiều rộng đường viền là 10 cm. 2.2.2. yêu cầu về các vị trí kiểm tra 2.2.2.1. vị trí kiểm tra đèn chiếu sáng phía trước 2.2.2.1.1. đối với dây chuyền kiểm định loại i hình 1. vị trí kiểm tra đèn chiếu sáng phía trước đối với dây chuyền kiểm định loại i 2.2.2.1.1.1. vị trí kiểm tra đèn chiếu sáng phía trước được đánh dấu trên sàn với kích thước chiều dài tối thiểu 4,0 m, chiều rộng tối thiểu 2,5 m. vị trí này có thể nằm chồng lên vị trí kiểm tra khác; được xây dựng có độ phẳng (mặt phẳng đỗ xe hay còn gọi là phần diện tích bánh xe đi qua) không vượt quá ± 6 mm. các thiết bị được lắp đặt trong vị trí này phải đáp ứng yêu cầu về độ phẳng không vượt quá ± 6 mm (không kể khe hở làm việc của thiết bị hỗ trợ kiểm tra gầm); 2.2.2.1.1.2. đường ray để di chuyển thiết bị kiểm tra đèn chiếu sáng phía trước phải thẳng, có độ dài tối thiểu 4,0 m, được lắp đặt chắc chắn và song song với mặt phẳng đỗ xe đồng thời không bị xê dịch trong suốt hành trình di chuyển của thiết bị kiểm tra đèn chiếu sáng phía trước theo chiều dài đường ray; 2.2.2.1.1.3. trong không gian tương ứng với khoảng cách tối thiểu 1,0 m phía trước thiết bị kiểm tra đèn chiếu sáng phía trước không được có các vật cản ảnh hưởng đến quá trình kiểm tra đèn chiếu sáng phía trước (hình 1). 2.2.2.1.2. đối với dây chuyền kiểm định loại ii hình 2. vị trí kiểm tra đèn chiếu sáng phía trước đối với dây chuyền kiểm định loại ii 2.2.2.1.2.1. vị trí kiểm tra đèn chiếu sáng phía trước được đánh dấu trên sàn với kích thước chiều dài tối thiểu 12,0 m, chiều rộng tối thiểu 3,0 m. vị trí này có thể nằm chồng lên vị trí kiểm tra khác; được xây dựng có độ phẳng (mặt phẳng đỗ xe hay còn gọi là phần diện tích bánh xe đi qua) không vượt quá ± 6 mm. các thiết bị được lắp đặt trong vị trí này phải đáp ứng yêu cầu về độ phẳng không vượt quá ± 6 mm (không kể khe hở làm việc của thiết bị hỗ trợ kiểm tra gầm); 2.2.2.1.2.2. đường ray để di chuyển thiết bị kiểm tra đèn chiếu sáng phía trước phải thẳng, có độ dài tối thiểu 4,0 m, được lắp đặt chắc chắn và song song với mặt phẳng đỗ xe đồng thời không bị xê dịch trong suốt hành trình di chuyển của thiết bị kiểm tra đèn chiếu sáng phía trước theo chiều dài đường ray; 2.2.2.1.2.3. trong không gian tương ứng với khoảng cách tối thiểu 1,0 m phía trước thiết bị kiểm tra đèn chiếu sáng phía trước không được có các vật cản ảnh hưởng đến quá trình kiểm tra đèn chiếu sáng phía trước (hình 2). 2.2.2.2. vị trí kiểm tra phanh 2.2.2.2.1. đối với dây chuyền kiểm định loại i hình 3. vị trí kiểm tra phanh đối với dây chuyền kiểm định loại i 2.2.2.2.1.1. vị trí kiểm tra phanh được đánh dấu trên sàn với kích thước chiều dài tối thiểu 14,0 m, chiều rộng tối thiểu 3,5 m. thiết bị kiểm tra phanh phải được lắp đặt ở vị trí trung tâm theo chiều dọc của vị trí kiểm tra; 2.2.2.2.1.2. ở khoảng cách tối thiểu 2,1 m phía trước và phía sau của đường trung tâm bệ thử phanh phải được xây dựng có độ bằng phẳng không vượt quá ± 6 mm; 2.2.2.2.1.3. một phần của vị trí kiểm tra phanh có thể nằm bên ngoài xưởng kiểm định nhưng phải đảm bảo bệ thử phanh nằm trong nhà xưởng và không bị hắt nước khi trời mưa; 2.2.2.2.1.4. thiết bị kiểm tra phanh có thể lắp đặt tại khu vực hầm kiểm tra nhưng không được ảnh hưởng đến việc kiểm tra đèn chiếu sáng phía trước; 2.2.2.2.1.5. trường hợp lắp đặt bệ thử phanh ngoài hầm kiểm tra thì bất kỳ điểm nào của bệ thử phanh con lăn phải cách đầu hầm kiểm tra tối thiểu 0,6 m; 2.2.2.2.1.6. màn hình hiển thị thông tin điều khiển và giá trị kiểm tra được đặt ở vị trí dễ quan sát bằng mắt thường của người kiểm tra. 2.2.2.2.2. đối với dây chuyền kiểm định loại ii hình 4. vị trí kiểm tra phanh đối với dây chuyền kiểm định loại ii 2.2.2.2.2.1. vị trí kiểm tra phanh được đánh dấu trên sàn với kích thước chiều dài tối thiểu 22,0 m, chiều rộng tối thiểu 4,0 m. thiết bị kiểm tra phanh phải được lắp đặt ở vị trí trung tâm theo chiều dọc của vị trí kiểm tra; 2.2.2.2.2.2. ở khoảng cách tối thiểu 2,1 m phía trước và phía sau của đường trung tâm bệ thử phanh phải được xây dựng có độ bằng phẳng không vượt quá ± 6 mm; 2.2.2.2.2.3. một phần của vị trí kiểm tra phanh có thể nằm bên ngoài xưởng kiểm định nhưng phải đảm bảo bệ thử phanh nằm trong nhà xưởng và không bị hắt nước khi trời mưa; 2.2.2.2.2.4. thiết bị kiểm tra phanh có thể lắp đặt tại khu vực hầm kiểm tra nhưng không được ảnh hưởng đến việc kiểm tra đèn chiếu sáng phía trước; 2.2.2.2.2.5. trường hợp lắp đặt bệ thử phanh ngoài hầm kiểm tra thì bất kỳ điểm nào của bệ thử phanh con lăn phải cách đầu hầm kiểm tra tối thiểu 0,6 m; 2.2.2.2.2.6. màn hình hiển thị thông tin điều khiển và giá trị kiểm tra được đặt ở vị trí dễ quan sát bằng mắt thường của người kiểm tra. 2.2.2.3. vị trí kiểm tra gầm (hầm kiểm tra) hình 5. các phương án bố trí hầm kiểm tra 2.2.2.3.1. đối với dây chuyền kiểm định loại i 2.2.2.3.1.1. vị trí kiểm tra gầm được đánh dấu trên sàn; 2.2.2.3.1.2. chiều dài làm việc (l) hầm kiểm tra tối thiểu là 6,0 m; 2.2.2.3.1.3. chiều rộng (r1) làm việc hai vách của miệng hầm trong suốt chiều dài làm việc tối thiểu là 0,6 m và không quá 1,0 m. chiều rộng (r) đo được trên hai vách của thân hầm tối thiểu bằng chiều rộng hai vách của miệng hầm; 2.2.2.3.1.4. độ sâu làm việc (h) đo được trong suốt chiều dài làm việc tính từ điểm cao nhất miệng hầm kiểm tra tới mặt đáy sàn tối thiểu là 1,3 m và không lớn hơn 1,75 m. có thể sử dụng các miếng kê để đáp ứng yêu cầu về chiều cao này để đảm bảo việc kiểm tra; 2.2.2.3.1.5. có tối thiểu 2 lối lên xuống và đảm bảo không bị đọng nước; 2.2.2.3.1.6. có gờ bảo vệ bằng thép có chiều cao tối thiểu 50 mm so với nền sàn nhà xưởng và được sơn cảnh báo nguy hiểm; 2.2.2.3.1.7. có thiết bị hỗ trợ kiểm tra gầm phải được lắp đặt trong phạm vi chiều dài làm việc của hầm kiểm tra và khoảng cách từ điểm gần nhất của thiết bị hỗ trợ kiểm tra gầm đến mép trong của đầu hầm kiểm tra theo phương dọc tối thiểu 1,5 m. bề mặt làm việc của thiết bị hỗ trợ kiểm tra gầm phải có độ phẳng trong khoảng ± 6 mm với sàn nhà xưởng tại vị trí lắp đặt; 2.2.2.3.1.8. kích nâng được lắp đặt trên hầm kiểm tra đảm bảo các phần của kích nâng ở trạng thái chưa làm việc không được nhô cao quá so với gờ bảo vệ; khoảng cách từ điểm gần nhất của bàn nâng của kích nâng (khi kích nâng ở vị trí gần đầu hầm nhất) đến điểm mép trong của đầu hầm kiểm tra tối thiểu 1,5 m; 2.2.2.3.1.9. kích nâng và thiết bị hỗ trợ kiểm tra gầm được lắp đặt trong không gian tương ứng với chiều dài làm việc của hầm. 2.2.2.3.2. đối với dây chuyền kiểm định loại ii 2.2.2.3.2.1. vị trí kiểm tra gầm được đánh dấu trên sàn; 2.2.2.3.2.2. chiều dài làm việc hầm kiểm tra (l) tối thiểu là 12,0 m; 2.2.2.3.2.3. chiều rộng (r1) làm việc hai vách của miệng hầm trong suốt chiều dài làm việc tối thiểu là 0,7 m và không quá 1,05 m. chiều rộng (r) đo được trên hai vách của thân hầm tối thiểu bằng chiều rộng hai vách của miệng hầm; 2.2.2.3.2.4. độ sâu làm việc (h) đo được trong suốt chiều dài làm việc tính từ điểm cao nhất của miệng hầm kiểm tra tới mặt đáy sàn tối thiểu là 1,2 m và không lớn hơn 1,6 m (không tính đến chiều cao gờ bảo vệ). có thể sử dụng các miếng kê để đáp ứng yêu cầu về chiều cao này để đảm bảo việc kiểm tra; 2.2.2.3.2.5. có tối thiểu 2 lối lên xuống và đảm bảo không bị đọng nước; 2.2.2.3.2.6. có gờ bảo vệ bằng thép có chiều cao tối thiểu 50 mm so với nền sàn nhà xưởng và được sơn cảnh báo nguy hiểm; 2.2.2.3.2.7. có thiết bị hỗ trợ kiểm tra gầm phải được lắp đặt trong phạm vi chiều dài làm việc của hầm kiểm tra và khoảng cách từ điểm gần nhất của thiết bị hỗ trợ kiểm tra gầm đến mép trong của đầu hầm kiểm tra theo phương dọc tối thiểu 1,5 m. bề mặt làm việc của thiết bị hỗ trợ kiểm tra gầm phải có độ phẳng trong khoảng ± 6 mm với sàn nhà xưởng tại vị trí lắp đặt; 2.2.2.3.2.8. kích nâng được lắp đặt trên hầm kiểm tra đảm bảo các phần của kích nâng ở trạng thái chưa làm việc không được nhô cao quá so với gờ bảo vệ; khoảng cách từ điểm gần nhất của bàn nâng của kích nâng (khi kích nâng ở vị trí gần đầu hầm nhất) đến điểm mép trong của đầu hầm kiểm tra tối thiểu 1,5 m; 2.2.2.3.2.9. kích nâng và thiết bị hỗ trợ kiểm tra gầm được lắp đặt trong không gian tương ứng với chiều dài làm việc của hầm. 2.2.2.4. vị trí kiểm tra độ trượt ngang của bánh xe 2.2.2.4.1. đối với dây chuyền kiểm định loại i 2.2.2.4.1.1. vị trí kiểm tra gầm được đánh dấu trên sàn; 2.2.2.4.1.2. thiết bị đo độ trượt ngang của bánh xe phải được lắp đặt chắc chắn vào sàn nhà xưởng; 2.2.2.4.1.3. khoảng cách giữa hai điểm gần nhất tính từ thiết bị đo độ trượt ngang của bánh xe tới bệ thử phanh tối thiểu là 0,8 m. hình 6. vị trí lắp đặt thiết bị đo độ trượt ngang của bánh xe đối với dây chuyền kiểm định loại i 2.2.2.4.2. đối với dây chuyền kiểm định loại ii 2.2.2.4.2.1. vị trí kiểm tra gầm được đánh dấu trên sàn; 2.2.2.4.2.2. thiết bị đo độ trượt ngang của bánh xe phải được lắp đặt chắc chắn vào sàn nhà xưởng; 2.2.2.4.2.3. khoảng cách giữa hai điểm gần nhất tính từ thiết bị đo độ trượt ngang của bánh xe tới bệ thử phanh tối thiểu 2,8 m. hình 7. vị trí lắp đặt thiết bị đo độ trượt ngang của bánh xe đối với dây chuyền kiểm định loại ii 2.3. nhà văn phòng 2.3.1. nhà văn phòng là nơi để bố trí khu vực tiếp nhận hồ sơ, trả kết quả kiểm định, lưu trữ hồ sơ; phòng chờ; phòng làm việc của nhân viên và các phòng phụ trợ khác; được trang bị các thiết bị văn phòng phục vụ hoạt động kiểm định. 2.3.2. phòng chờ có bố trí chỗ ngồi cho khách hàng. 2.4. thiết bị kiểm tra 2.4.1. yêu cầu về phần mềm điều khiển thiết bị 2.4.1.1. phần mềm điều khiển thiết bị kết nối được với các thiết bị kiểm tra nêu tại điểm 2.1.5. 2.4.1.2. các tính năng tối thiểu của phần mềm điều khiển thiết bị: 2.4.1.2.1. điều khiển các thiết bị hoạt động đúng chức năng theo quy trình kiểm tra; hiển thị các giá trị đo theo thời gian thực, đưa ra chỉ thị để người kiểm tra thực hiện các thao tác; đọc được các kết quả đo tương ứng với từng thiết bị khi kết thúc quá trình kiểm tra và lưu trữ trong cơ sở dữ liệu của phần mềm; 2.4.1.2.2. kết nối, trao đổi thông tin với phần mềm quản lý kiểm định về: phương tiện chờ kiểm tra, kết quả kiểm tra (các giá trị đo của thiết bị) của phương tiện đã hoàn thành kiểm tra kèm theo số nhận dạng hoặc số serial của thiết bị, thời gian kiểm tra và ký hiệu của phiên bản phần mềm. việc kết nối, trao đổi thông tin phải đảm bảo chính xác; dữ liệu kết quả kiểm tra phải được mã hoá; 2.4.1.2.3. truy xuất dữ liệu để hiển thị và in ra kết quả của các lần kiểm tra được lưu trữ; truy xuất được mã nhận dạng hoặc số serial của thiết bị; 2.4.1.2.4. dữ liệu của phần mềm điều khiển thiết bị được mã hoá, sao lưu, lưu trữ trong thời gian ít nhất 36 tháng trên máy chủ của đơn vị. 2.4.2. yêu cầu kỹ thuật đối với các thiết bị 2.4.2.1. thiết bị phân tích khí thải 2.4.2.1.1. đo được các thành phần khí thải của động cơ cháy cưỡng bức: co, co2, hc, o2; 2.4.2.1.2. hiển thị được giá trị hệ số dư lượng không khí - lamda (λ); 2.4.2.1.3. ghi nhận được tốc độ và nhiệt độ dầu động cơ trong quá trình kiểm tra; 2.4.2.1.4. có hệ thống tách nước để chống nước xâm nhập vào buồng kiểm tra; 2.4.2.1.5. đầu lấy mẫu phải được trang bị kèm theo cơ cấu kẹp chặt vào ống xả, có kích thước phù hợp với yêu cầu đo theo khuyến cáo của nhà sản xuất thiết bị nhưng đầu lấy mẫu phải đưa được vào sâu trong ống xả tối thiểu 300 mm; trường hợp nhà sản xuất trang bị nhiều loại đầu lấy mẫu thì phải sử dụng loại đầu lấy mẫu có kích thước phù hợp; 2.4.2.1.6. dải đo và độ chính xác theo công bố của nhà sản xuất nhưng không vượt quá giá trị giới hạn trong bảng 1: bảng 1: thông số dải đo, độ chính xác của thiết bị phân tích khí thải 2.4.2.1.7. thiết bị có khả năng hiển thị và lưu trữ kết quả đo bằng giá trị nồng độ các thành phần khí thải, hệ số lamda, giá trị tốc độ và nhiệt độ dầu động cơ ở chế độ tốc độ không tải và chế độ tốc độ không tải có tăng tốc; 2.4.2.1.8. trong quá trình hoạt động, thiết bị phân tích khí thải phải đáp ứng các yêu cầu sau: 2.4.2.1.8.1. đầu lấy mẫu phải nguyên vẹn, không móp méo, rò rỉ, không bị tắc; 2.4.2.1.8.2. màn hình hiển thị rõ và đầy đủ các thông tin; 2.4.2.1.8.3. cảm biến tốc độ quay trục khuỷu động cơ lấy được tín hiệu và biến thiên theo tốc độ quay thực tế của trục khuỷu động cơ; 2.4.2.1.8.4. cảm biến nhiệt độ dầu động cơ nhận được tín hiệu khi tiếp xúc với nguồn nhiệt; 2.4.2.1.8.5. phần mềm của thiết bị điều khiển thiết bị hoạt động đúng chức năng; 2.4.2.1.8.6. máy tính hoạt động bình thường và kết nối được với mạng nội bộ và truyền được số liệu; 2.4.2.1.8.7. khi ở trạng thái sẵn sàng làm việc thì các chỉ số hc, co và hệ số lamda (λ) không hiển thị hoặc hiển thị giá trị trong sai số cho phép của nhà sản xuất. 2.4.2.2. thiết bị đo độ khói 2.4.2.2.1. đo được độ khói (%hsu) hoặc hệ số hấp thụ ánh sáng (m-1) của khí thải động cơ cháy do nén; 2.4.2.2.2. ghi nhận được tốc độ nhỏ nhất, lớn nhất của động cơ, thời gian gia tốc và nhiệt độ dầu động cơ ở mỗi chu trình đo; 2.4.2.2.3. đo được các thông số ở chế độ gia tốc tự do; 2.4.2.2.4. đầu lấy mẫu phải được trang bị kèm theo cơ cấu kẹp chặt vào ống xả, có kích thước phù hợp với yêu cầu đo theo khuyến cáo của nhà sản xuất thiết bị nhưng đầu lấy mẫu phải đưa được vào sâu trong ống xả tối thiểu 50 mm; trường hợp nhà sản xuất trang bị nhiều loại đầu lấy mẫu thì phải sử dụng loại đầu lấy mẫu có kích thước phù hợp; 2.4.2.2.5. dải đo và độ chính xác theo công bố của nhà sản xuất nhưng không vượt quá giá trị giới hạn trong bảng 2: bảng 2: thông số dải đo, độ chính xác của thiết bị đo độ khói 2.4.2.2.6. xử lý, hiển thị và lưu trữ kết quả: 2.4.2.2.6.1. thiết bị có khả năng hiển thị và lưu trữ kết quả đo bằng số các giá trị độ khói và hệ số hấp thụ ánh sáng, tốc độ nhỏ nhất, lớn nhất của động cơ, thời gian tăng tốc và nhiệt độ dầu động cơ ở mỗi chu trình đo; 2.4.2.2.6.2. ghi nhận kết quả đo độ khói hoặc hệ số hấp thụ ánh sáng trung bình và chiều rộng dải đo của 3 chu trình đo sau cùng. 2.4.2.2.7. trong quá trình hoạt động, thiết bị đo độ khói phải đáp ứng các yêu cầu sau: 2.4.2.2.7.1. đầu lấy mẫu phải nguyên vẹn, không móp méo, không thủng lỗ, không bị tắc; 2.4.2.2.7.2. cảm biến tốc độ quay trục khuỷu động cơ lấy được tín hiệu và biến thiên theo tốc độ quay thực tế của trục khuỷu động cơ; 2.4.2.2.7.3. cảm biến nhiệt độ dầu động cơ nhận được tín hiệu khi tiếp xúc với nguồn nhiệt; 2.4.2.2.7.4. có chống nhiễu (tiếp đất) cho hệ thống tín hiệu thiết bị kiểm tra; 2.4.2.2.7.5. màn hình máy tính hiển thị rõ và đầy đủ các thông tin kiểm tra; 2.4.2.2.7.6. phần mềm của thiết bị điều khiển thiết bị hoạt động đúng chức năng; 2.4.2.2.7.7. máy tính hoạt động bình thường và kết nối được với mạng nội bộ và truyền được số liệu; 2.4.2.2.7.8. khi ở trạng thái sẵn sàng làm việc, giá trị độ khói hoặc hệ số hấp thụ ánh sáng không hiển thị hoặc hiển thị giá trị trong sai số cho phép của nhà sản xuất. 2.4.2.3. thiết bị kiểm tra phanh 2.4.2.3.1. là thiết bị kiểm tra phanh kiểu con lăn có chức năng kiểm tra lực phanh trên mỗi trục bánh xe; 2.4.2.3.2. khả năng chịu tải trọng trục tối đa theo công bố của nhà sản xuất thiết bị không nhỏ hơn 2.000 kg đối với dây chuyền kiểm định loại i và không nhỏ hơn 13.000 kg đối với dây chuyền kiểm định loại ii; 2.4.2.3.3. kích thước lắp đặt đảm bảo điều kiện tại bảng 3: bảng 3: thông số kích thước lắp đặt của thiết bị kiểm tra phanh 2.4.2.3.4. tự động dừng khi có hiện tượng trượt giữa bánh xe và con lăn trong quá trình kiểm tra; 2.4.2.3.5. hiển thị và ghi nhận giá trị lực phanh tại từng thời điểm ở từng bánh xe trên mỗi trục; 2.4.2.3.6. kiểm tra được hệ thống phanh đỗ và hệ thống phanh chính và có tính năng rà ô van; 2.4.2.3.7. hệ số bám tối thiểu của con lăn (µ): 2.4.2.3.7.1. đối với thiết bị chưa qua sử dụng, µ được ghi nhận theo công bố của nhà sản xuất thiết bị nhưng không thấp hơn 0,5; 2.4.2.3.7.2. đối với thiết bị đã qua sử dụng, µ có giá trị tối thiểu là 0,5 trong điều kiện làm việc với bề mặt tiếp xúc giữa lốp xe và con lăn là khô và lốp xe ở trạng thái hoạt động bình thường, được xác định theo công thức sau: trong đó: froll - là lực phanh một bên đo được trên thiết bị kiểm tra phanh; m - là khối lượng của trục xe hiển thị trên thiết bị kiểm tra phanh (kg); g - là gia tốc trọng trường (m/s2). 2.4.2.3.7.3. phương tiện dùng để kiểm tra µ phải phù hợp với loại dây chuyền, trường hợp thiết bị đáp ứng quy định kiểm tra với cả 2 loại dây chuyền thì sử dụng phương tiện tương ứng với dây chuyền loại ii để kiểm tra. 2.4.2.3.8. chiều dài con lăn và đường kính con lăn đáp ứng yêu cầu tại bảng 4: bảng 4: thông số con lăn của thiết bị kiểm tra phanh (*) chỉ áp dụng với thiết bị chưa qua sử dụng; 2.4.2.3.9. số lượng cảm biến khối lượng không nhỏ hơn 4 đối với dây chuyền kiểm định loại i và không nhỏ hơn 8 đối với dây chuyền kiểm định loại ii; ở mức dưới 10.000 n, lực thẳng đứng phải được đo với dung sai không quá ± 300 n; ở mức từ 10.000 n trở lên, giá trị này không quá ± 3 % giá trị đo được; 2.4.2.3.10. có thiết bị điều khiển từ xa và điều khiển trực tiếp tại vị trí tủ điều khiển; 2.4.2.3.11. ở mức đến 2.000 n độ chính xác của phép đo lực phanh là ± 100 n, trên 2.000 n thì độ chính xác là ± 3%. sai lệch lực phanh tối đa cho phép ở cùng điểm đo giống nhau giữa bên trái và bên phải của bệ thử phanh phải là ± 100 n ở mức dưới 2.000 n và ± 5% ở mức từ 2.000 n trở lên; 2.4.2.3.12. dải đo của thiết bị trên mỗi bánh xe tối thiểu từ 0 đến 7.500 n đối với dây chuyền kiểm định loại i và từ 0 đến 30.000 n đối với dây chuyền kiểm định loại ii. thiết bị phải có dải đo với bước đo không được lớn hơn 100 n khi giá trị thang đo đến 5.000 n và không lớn hơn 500 n khi giá trị thang đo trên 5.000 n; 2.4.2.3.13. hiển thị được giá trị lực phanh riêng ở từng bánh xe trên mỗi trục; 2.4.2.3.14. hiển thị được hiệu quả phanh trên trục và hiệu quả phanh toàn bộ được tính theo công thức: 2.4.2.3.14.1. hiệu quả phanh trên trục kt: trong đó: ∑fpti - tổng lực phanh trên tất cả các bánh xe trên trục khi kiểm tra phanh; gt - khối lượng trục xe khi kiểm tra phanh. 2.4.2.3.14.2. hiệu quả phanh toàn bộ kp: trong đó: ∑fpi - tổng lực phanh trên tất cả các bánh xe; g - khối lượng xe khi kiểm tra phanh. 2.4.2.3.15. hiển thị được sai lệch lực phanh giữa hai bên bánh xe trên cùng một trục (giữa bánh bên phải và bên trái): trong đó: ksl- sai lệch lực phanh trên một trục; pfl - lực phanh lớn hơn trên cùng một trục; pfn - lực phanh nhỏ hơn trên cùng một trục. 2.4.2.3.16. trong quá trình hoạt động, thiết bị kiểm tra phanh phải đáp ứng các yêu cầu sau: 2.4.2.3.16.1. con lăn ma sát không bị bong tróc lớp ma sát đến khung xương; 2.4.2.3.16.2. con lăn quay trơn không bị biến dạng, cong vênh; 2.4.2.3.16.3. các chi tiết, tổng thành hoạt động bình thường, không bị kẹt, không có các tiếng kêu hoặc rung giật bất thường; 2.4.2.3.16.4. màn hình hiển thị rõ và đầy đủ các thông tin kiểm tra; 2.4.2.3.16.5. phần mềm của thiết bị điều khiển thiết bị hoạt động đúng chức năng; 2.4.2.3.16.6. máy tính hoạt động bình thường và kết nối được với mạng nội bộ và truyền được số liệu; 2.4.2.3.16.7. ở trạng thái sẵn sàng làm việc, giá trị lực phanh và giá trị khối lượng không hiển thị hoặc hiển thị giá trị trong sai số cho phép của nhà sản xuất. 2.4.2.4. thiết bị đo độ trượt ngang của bánh xe 2.4.2.4.1. tự động đo và ghi nhận giá trị độ trượt ngang khi bánh xe lăn qua tấm trượt ngang; có cảm biến nhận biết tín hiệu đầu vào và đầu ra; 2.4.2.4.2. bề mặt tấm trượt ngang đảm bảo cứng vững; khả năng chịu tải trọng trục hoặc tải trọng bánh xe tối đa theo công bố của nhà sản xuất thiết bị không nhỏ hơn 2.000 kg/trục hoặc 1.000 kg/bánh xe (đối với dây chuyền kiểm định loại i) và không nhỏ hơn 13.000 kg/trục hoặc 6.500 kg/bánh xe (đối với dây chuyền kiểm định loại ii); 2.4.2.4.3. dải đo về hai phía không nhỏ hơn 10 (mm/m hoặc m/km); 2.4.2.4.4. bước đo không lớn hơn 0,1 (mm/m hoặc m/km); 2.4.2.4.5. sai số không quá ± 0,2 (mm/m hoặc m/km); 2.4.2.4.6. trong quá trình hoạt động, thiết bị đo độ trượt ngang của bánh xe phải đáp ứng các yêu cầu sau: 2.4.2.4.6.1. hành trình tối đa của tấm trượt khi di chuyển về hai phía không nhỏ hơn 10 mm; 2.4.2.4.6.2. màn hình hiển thị rõ và đầy đủ các thông tin; 2.4.2.4.6.3. các chi tiết, bộ phận hoạt động bình thường (không bị kẹt, lắp đặt không chắc chắn); 2.4.2.4.6.4. ở trạng thái sẵn sàng làm việc, giá trị độ trượt ngang không hiển thị hoặc hiển thị giá trị trong sai số cho phép của nhà sản xuất. 2.4.2.5. thiết bị kiểm tra đèn chiếu sáng phía trước 2.4.2.5.1. đo được cường độ sáng tại tâm quang học của đèn và tại điểm sáng lớn nhất của chùm sáng đèn chiếu xa; đo được độ lệch chùm sáng của đèn chiếu xa; 2.4.2.5.2. xác định được giao điểm của đường sáng tối, phần hình nêm nhô lên của chùm sáng (điểm gãy của đường cut-off) của đèn chiếu gần và đo được độ lệch chùm sáng của đèn chiếu gần; 2.4.2.5.3. có khả năng di chuyển buồng đo lên, xuống và xoay một góc nhất định quanh trục đỡ buồng đo; di chuyển được sang hai bên. chiều cao tâm buồng đo phải điều chỉnh được trong phạm vi từ 250 mm đến 1.300 mm so với mặt sàn vị trí kiểm tra; 2.4.2.5.4. có chức năng hỗ trợ xác định và định vị vị trí đo; 2.4.2.5.5. dải đo và độ chính xác theo công bố của nhà sản xuất nhưng không vượt quá giá trị giới hạn trong bảng 5: bảng 5: thông số dải đo, độ chính xác của thiết bị đo đèn 2.4.2.5.6. hiển thị được cường độ, độ lệch chùm sáng của đèn chiếu xa; độ lệch chùm sáng của đèn chiếu gần; 2.4.2.5.7. trong quá trình hoạt động, thiết bị kiểm tra đèn chiếu sáng phía trước phải đáp ứng các yêu cầu sau: 2.4.2.5.7.1. trụ đỡ buồng đo phải đảm bảo theo phương thẳng đứng; 2.4.2.5.7.2. buồng đo được lắp đặt chắc chắn với trụ đỡ buồng đo và đảm bảo cân bằng ở vị trí kiểm tra theo cả phương dọc và phương ngang; 2.4.2.5.7.3. bánh xe di chuyển dễ dàng, không rơ rão; 2.4.2.5.7.4. màn hình của thiết bị hiển thị đầy đủ, rõ ràng các thông tin; 2.4.2.5.7.5. phím điều khiển hoạt động đúng chức năng; 2.4.2.5.7.6. phần mềm của thiết bị điều khiển thiết bị hoạt động đúng chức năng; 2.4.2.5.7.7. khi ngắt nguồn điện đầu vào, thiết bị phải hoạt động được tiếp tục trong thời gian tối thiểu 3 phút; 2.4.2.5.7.8. thiết bị kết nối và truyền được dữ liệu kiểm tra. 2.4.2.6. thiết bị đo âm lượng 2.4.2.6.1. giữ được giá trị âm lượng lớn nhất khi đo; 2.4.2.6.2. có màn hình hiển thị bằng số; 2.4.2.6.3. kết nối và truyền được số liệu sang máy tính; 2.4.2.6.4. thiết bị phải có khả năng phản hồi kết quả đo ở mức nhanh (f) và chậm (s). phải có bộ phận chắn gió trùm lên micro; 2.4.2.6.5. dải đo và cấp chính xác phải thỏa mãn phạm vi trong bảng 6: bảng 6: thông số dải đo, cấp chính xác của thiết bị đo âm lượng 2.4.2.6.6. trong quá trình hoạt động, thiết bị đo âm lượng phải đáp ứng các yêu cầu sau: 2.4.2.6.6.1. thiết bị phải hoạt động ổn định; 2.4.2.6.6.2. màn hình phải bảo đảm hiển thị rõ ràng các thông số; 2.4.2.6.6.3. bộ phận chắn gió trùm lên micro không bị hỏng, rách; 2.4.2.6.6.4. kết nối và truyền dữ liệu được với máy tính; 2.4.2.6.6.5. chỉ số phải hiển thị tương ứng với sự thay đổi của âm lượng. 2.5. thiết bị hỗ trợ kiểm tra, dụng cụ kiểm tra, dụng cụ hỗ trợ kiểm tra 2.5.1. yêu cầu về thiết bị hỗ trợ kiểm tra: 2.5.1.1. thiết bị hỗ trợ kiểm tra gầm: 2.5.1.1.1. khả năng chịu tải trọng trục tối thiểu 2.000 kg đối với dây chuyền kiểm định loại i và tối thiểu 13.000 kg đối với dây chuyền kiểm định loại ii; 2.5.1.1.2. trong quá trình hoạt động, thiết bị phải đáp ứng các yêu cầu sau: 2.5.1.1.2.1. không bị rò rỉ môi chất công tác, các công tắc điều khiển hoạt động đúng chức năng; 2.5.1.1.2.2. đưa xe vào kiểm tra, thiết bị phải dịch chuyển được theo các hướng, không có tiếng kêu bất thường, không bị kẹt; 2.5.1.1.2.3. phương dịch chuyển và chế độ làm việc phù hợp với công bố của nhà sản xuất; 2.5.1.1.2.4. hành trình dịch chuyển và tốc độ di chuyển phù hợp với công bố của nhà sản xuất. 2.5.1.2. kích nâng: 2.5.1.2.1. kích nâng có khả năng nâng cả hai bánh xe trên cùng 1 trục và khả năng chịu tải trọng trục tối thiểu 5 tấn đối với dây chuyền kiểm định loại i và tối thiểu 15 tấn đối với dây chuyền kiểm định loại ii. trong trường hợp sử dụng kích nâng di động thì kích nâng phải có khả năng chịu tải tải trọng bánh xe tối thiểu 2,5 tấn/bánh xe đối với xe thuộc đối tượng kiểm định trên dây chuyền kiểm định loại i và tối thiểu 7,5 tấn/bánh xe đối với xe thuộc đối tượng kiểm định trên dây chuyền kiểm định loại ii; 2.5.1.2.2. trong quá trình hoạt động, kích nâng phải đáp ứng các yêu cầu sau: 2.5.1.2.2.1. kích nâng không bị rò rỉ môi chất công tác, các công tắc điều khiển hoạt động đúng chức năng; 2.5.1.2.2.2. đưa xe vào kiểm tra, kích phải nâng được trục xe phù hợp theo các dây chuyền kiểm định tương ứng. 2.5.1.3. thiết bị nâng (cầu nâng) xe cơ giới (chỉ áp dụng đối với dây chuyền loại i): 2.5.1.3.1. cầu nâng phải có sức nâng tối thiểu 5 tấn, có khả năng điều chỉnh phù hợp với từng loại xe; 2.5.1.3.2. có chiều cao nâng tối thiểu 1,3 m; 2.5.1.3.3. cầu nâng phải được kiểm định an toàn theo quy định. 2.5.2. yêu cầu về dụng cụ kiểm tra: 2.5.2.1. thước cuộn có phạm vi đo không nhỏ hơn 20 m và đạt cấp chính xác iii trở lên; 2.5.2.2. búa kiểm tra là loại búa chuyên dùng kiểm tra được chất lượng mối ghép bằng bu lông; 2.5.2.3. dụng cụ kiểm tra áp suất lốp có đơn vị đo theo hệ đo lường si (bar) có dải đo từ 0 bar đến 12 bar; 2.5.2.4. đèn soi kiểm tra cầm tay: đèn phải thuộc loại điện áp thấp (không quá 36v), công suất phải đảm bảo việc quan sát được bằng mắt thường khi kiểm tra và bên ngoài của đèn được bảo vệ cách điện. 2.5.3. yêu cầu về dụng cụ hỗ trợ kiểm tra: 2.5.3.1. gương quan sát hỗ trợ kiểm tra đèn tín hiệu là gương cầu lồi có đường kính của bề mặt phản xạ tối thiểu 600 mm, phải lắp ở vị trí đảm bảo tại vị trí người lái quan sát được đèn tín hiệu phía trước và phía sau; 2.5.3.2. cục chèn bánh xe bằng gỗ hoặc cao su, chống trôi được xe trong quá trình kiểm tra; 2.5.3.3. thanh, đòn hỗ trợ kiểm tra bánh xe phù hợp với xe kiểm tra; 2.5.3.4. dụng cụ đo tốc độ có dải đo tối thiểu từ 0-80 km/h, đơn vị hiển thị là km/h, bước đo lớn nhất 1 km/h. 2.6. hệ thống thông tin quản lý kiểm định 2.6.1. hệ thống thông tin quản lý kiểm định được xây dựng để quản lý hoạt động kiểm định của cơ sở đăng kiểm. 2.6.2. cơ sở dữ liệu kiểm định có tối thiểu các thông tin sau: 2.6.2.1. cơ sở đăng kiểm: thông tin đơn vị, quá trình hoạt động; 2.6.2.2. nhân sự cơ sở đăng kiểm; 2.6.2.3. quản lý thiết bị kiểm tra: thông tin về thiết bị; các sự cố của thiết bị; các lần kiểm tra, đánh giá, kiểm định, hiệu chuẩn thiết bị; 2.6.2.4. hồ sơ phương tiện, các lần thay đổi thông số kỹ thuật và thay đổi thông tin hành chính; 2.6.2.5. kiểm định phương tiện: thông tin quản lý lần kiểm định, đánh giá lỗi của các hạng mục kiểm định không đạt, thông số đo của các thiết bị kiểm tra; 2.6.2.6. thông tin quản lý giấy chứng nhận và tem kiểm định; 2.6.2.7. hình ảnh phương tiện khi kiểm định. 2.6.3. tính năng của phần mềm quản lý kiểm định: 2.6.3.1. thực hiện tạo lập, lưu trữ dữ liệu kiểm định; kết nối trao đổi thông tin với phần mềm điều khiển thiết bị kiểm tra; kết nối trao đổi thông tin với cơ sở dữ liệu kiểm định của cục đăng kiểm việt nam; truy xuất, thống kê, lập báo cáo liên quan đến hoạt động kiểm định; có tính năng đảm bảo an toàn dữ liệu, chống sự can thiệp từ bên ngoài; 2.6.3.2. dữ liệu kiểm định được tạo lập và lưu trữ theo thời gian thực vào cơ sở dữ liệu phần mềm quản lý kiểm định của cục đăng kiểm việt nam 2.6.4. hạ tầng công nghệ thông tin của cơ sở đăng kiểm 2.6.4.1. mạng máy tính cục bộ (lan) của cơ sở đăng kiểm bao gồm: máy chủ để lưu trữ cơ sở dữ liệu kiểm định và quản lý domain mạng; các máy tính để sử dụng cho phần mềm quản lý kiểm định, phần mềm điều khiển thiết bị kiểm tra và các phần mềm cần thiết khác của đơn vị; thiết bị chuyển mạch mạng (switch) và hệ thống dây mạng có khả năng kết nối các máy tính tới thiết bị chuyển mạch mạng với tốc độ tối thiểu 100 mbps. 2.6.4.2. mạng máy tính diện rộng (wan) tại cơ sở đăng kiểm: có ít nhất 01 đường truyền internet có địa chỉ ip tĩnh với băng thông tối thiểu 100 mbps. được trang bị thiết bị tường lửa (firewall) có tính năng tạo kênh kết nối mạng riêng ảo (vpn) tới hạ tầng công nghệ thông tin của cục đăng kiểm việt nam. 2.6.5. hệ thống camera giám sát: 2.6.5.1. dây chuyền kiểm định phải bố trí camera ip sử dụng riêng cho việc giám sát kiểm định xe cơ giới (có độ phân giải video tối thiểu 1280 x 720 pixels và tốc độ khung hình tối thiểu 30 hình trên giây); đảm bảo quan sát, lưu trữ được clip, hình ảnh các vị trí kiểm tra trên dây chuyền kiểm định cho khoảng thời gian tối thiểu 30 ngày; 2.6.5.2. hình ảnh camera giám sát quá trình kiểm định trên dây chuyền phải kết nối với màn hình tại phòng chờ để chủ xe theo dõi hình ảnh kiểm tra xe trong quá trình kiểm định; 2.6.5.3. tín hiệu hình ảnh camera giám sát phải được kết nối tới sở giao thông vận tải tại địa phương và cục đăng kiểm việt nam để theo dõi, giám sát. 2.6.6. phần mềm quản lý việc tính tiền, thu giá dịch vụ, phí, lệ phí liên quan đến hoạt động kiểm định. 2.7. các thông tin niêm yết 2.7.1. các biển hiệu, thông báo (trích từ các quy định hiện hành, cập nhật khi có thay đổi) niêm yết công khai dưới dạng bảng thông báo nền bảng màu trắng hoặc xanh tương ứng với chữ màu xanh hoặc trắng (hoặc bảng điện tử), vị trí treo dễ thấy, dễ đọc bằng mắt thường. 2.7.2. các thông tin phải công khai tại phòng chờ bao gồm: 2.7.2.1. những văn bản có liên quan đến công tác kiểm định; 2.7.2.2. quy trình kiểm định và các vị trí kiểm tra theo quy trình iso của đơn vị; 2.7.2.3. chu kỳ kiểm định an toàn kỹ thuật và bảo vệ môi trường của xe cơ giới, có kích thước tối thiểu khổ a1; 2.7.2.4. các chỉ tiêu đánh giá về cường độ sáng và độ lệch chùm sáng của đèn chiếu sáng phía trước, lực phanh, độ trượt ngang, âm lượng còi, hàm lượng khí thải, độ khói có kích thước tối thiểu khổ a0; 2.7.2.5. giấy tờ cần thiết khi lập hồ sơ phương tiện và kiểm định, có kích thước tối thiểu khổ a1; 2.7.2.6. thông báo “số điện thoại đường dây nóng” của cơ sở đăng kiểm, sở giao thông vận tải địa phương, cục đăng kiểm việt nam có kích thước tối thiểu khổ a3; 2.7.2.7. biểu giá kiểm định, lệ phí cấp giấy chứng nhận và phí sử dụng đường bộ theo quy định, có kích thước tối thiểu khổ a1; 2.7.2.8. thời gian làm việc của cơ sở đăng kiểm. 2.7.3. thông tin phải công khai tại xưởng kiểm định: 2.7.3.1. quy trình sử dụng thiết bị kiểm tra: được trình bày thành từng bảng có vị trí treo tương ứng với vị trí sử dụng thiết bị, có kích thước tối thiểu khổ a2; 2.7.3.2. nội dung về các yêu cầu, phương pháp kiểm định an toàn kỹ thuật và bảo vệ môi trường đối với xe ô tô, rơ moóc, sơ mi rơ moóc, xe chở hàng bốn bánh có gắn động cơ, xe chở người bốn bánh có gắn động cơ tham gia giao thông đường bộ, có kích thước tối thiểu khổ a0; 2.7.3.3. chỉ báo về khu vực dành riêng cho kiểm định. 2.7.4. biển hiệu cơ sở đăng kiểm: biển hiệu (theo mẫu ở phụ lục a) được kẻ bằng chữ màu trắng trên nền xanh nước biển, có kích thước (dài x rộng) phù hợp với vị trí treo biển, được lắp đặt chắc chắn. 2.8. vị trí cơ sở đăng kiểm xe cơ giới đối với cơ sở đăng kiểm xe cơ giới phải cách cơ sở giáo dục phổ thông, bệnh viện tối thiểu là 50 m. 3. quy định về cơ sở vật chất kỹ thuật và vị trí cơ sở kiểm định khí thải xe mô tô, xe gắn máy 3.1. yêu cầu chung 3.1.1. cơ sở vật chất kỹ thuật của cơ sở kiểm định khí thải xe mô tô, xe gắn máy bao gồm: 3.1.1.1. khu vực chờ và trả kết quả kiểm định; 3.1.1.2. khu vực kiểm định; 3.1.1.3. thiết bị kiểm tra khí thải bao gồm: 3.1.1.3.1. thiết bị phân tích khí thải (phương tiện đo khí thải xe cơ giới); 3.1.1.3.2. thiết bị đo độ khói; 3.1.1.3.3. thiết bị nêu tại điểm 3.1.1.3.1 không áp dụng với cơ sở kiểm định khí thải chỉ kiểm định xe trang bị động cơ cháy do nén (diesel); 3.1.1.3.4. thiết bị nêu tại điểm 3.1.1.3.2 không áp dụng với cơ sở kiểm định khí thải chỉ kiểm định xe trang bị động cơ cháy cưỡng bức; 3.1.1.4. hệ thống quản lý thông tin kiểm định khí thải; 3.1.1.5. các thông tin niêm yết về công tác kiểm định khí thải xe mô tô, xe gắn máy. 3.1.2. khu vực chờ và trả kết quả kiểm định phải tách biệt với khu vực kiểm định. 3.2. khu vực kiểm định 3.2.1. có thiết bị thông gió cưỡng bức đối với cơ sở kiểm định khí thải thực hiện việc kiểm định khí thải trong nhà; 3.2.2. khu vực kiểm định phải được đánh dấu bằng đường viền màu vàng trên sàn với chiều rộng đường viền là 10 cm; 3.2.3. có camera giám sát khu vực kiểm định khí thải. 3.3. thiết bị phân tích khí thải, thiết bị đo độ khói và phần mềm điều khiển thiết bị 3.3.1. thiết bị phân tích khí thải tuân thủ các quy định tại điểm 2.4.2.1. 3.3.2. thiết bị đo độ khói tuân thủ các quy định tại điểm 2.4.2.2. 3.3.3. yêu cầu về phần mềm điều khiển thiết bị 3.3.3.1. kết nối được với thiết bị tại điểm 3.1.1.3; 3.3.3.2. hiển thị và ghi nhận được các thành phần khí thải theo phương pháp đo; 3.3.3.3. lưu trữ trong cơ sở dữ liệu; kết nối được với máy tính và in ra được kết quả kiểm định sau khi hoàn thành quá trình kiểm định; 3.3.3.4. kết nối, trao đổi thông tin với phần mềm quản lý kiểm định khí thải về: kết quả, thời gian kiểm định của phương tiện. việc kết nối, trao đổi thông tin phải đảm bảo chính xác; 3.3.3.5. dữ liệu kiểm định phải được lưu trữ trong thời gian ít nhất 36 tháng kể từ ngày phương tiện được kiểm định. 3.4. hệ thống quản lý thông tin kiểm định khí thải 3.4.1. phần mềm quản lý kiểm định khí thải: 3.4.1.1. phần mềm quản lý kiểm định khí thải có các trường thông tin sau: 3.4.1.1.1. thông tin về cơ sở kiểm định: mã số đơn vị, địa chỉ, tổ chức thành lập, người đại diện, số điện thoại, email đơn vị; 3.4.1.1.2. thông tin về nhân sự của cơ sở kiểm định khí thải; 3.4.1.1.3. thông tin về thiết bị kiểm tra: kiểu loại, số hiệu, năm sản xuất, ngày đưa vào sử dụng; thông tin về bảo dưỡng, sửa chữa, hiệu chuẩn, kiểm định của thiết bị; 3.4.1.1.4. thông tin kiểm định khí thải phương tiện: thời điểm kiểm định, thiết bị kiểm tra thực hiện kiểm định, biển số đăng ký, nhãn hiệu, số loại của phương tiện; hàm lượng các chất độc hại trong khí thải, kết quả đánh giá kiểm tra khí thải; 3.4.1.2. phần mềm quản lý kiểm định khí thải có các tính năng sau: 3.4.1.2.1. kết nối trực tiếp với thiết bị kiểm tra hoặc thông qua phần mềm điều khiển thiết bị để lấy thông tin về nồng độ, thành phần khí thải; 3.4.1.2.2. kết nối trao đổi thông tin với cơ sở dữ liệu kiểm định của cục đăng kiểm việt nam; 3.4.1.2.3. tạo lập báo cáo, thống kê liên quan đến hoạt động kiểm định khí thải. 3.4.2. camera giám sát: 3.4.2.1. trang bị camera ip sử dụng riêng cho việc giám sát kiểm định khí thải xe mô tô, xe gắn máy; đảm bảo quan sát, lưu trữ được clip, hình ảnh vị trí kiểm tra cho khoảng thời gian tối thiểu 30 ngày; 3.4.2.2. tín hiệu hình ảnh camera giám sát phải được kết nối tới sở giao thông vận tải địa phương, đăng kiểm việt nam để theo dõi, giám sát. 3.5. các thông tin niêm yết 3.5.1. có biển hiệu (theo mẫu ở phụ lục a) được kẻ bằng chữ màu trắng trên nền xanh nước biển, có kích thước (dài x rộng) phù hợp với vị trí treo biển, được lắp đặt chắc chắn. 3.5.2. phải bố trí không gian và niêm yết công khai các thông tin cần công khai theo quy định của chính phủ quy định về điều kiện kinh doanh dịch vụ kiểm định xe cơ giới; tổ chức, hoạt động của cơ sở đăng kiểm; niên hạn sử dụng của xe cơ giới. 3.6. cơ sở kiểm định khí thải tổ chức việc kiểm định khí thải xe mô tô, xe gắn máy lưu động bằng xe chuyên dùng 3.6.1. xe được sơn màu xanh nước biển, có dòng chữ biểu trưng “xe chuyên dùng kiểm định khí thải xe mô tô, xe gắn máy” màu trắng trên nền màu xanh nước biển ở hai bên thành xe. 3.6.2. thiết bị kiểm tra khí thải và các trang thiết bị công nghệ thông tin, hệ thống camera giám sát phải được bố trí, lắp đặt cố định trên xe chuyên dùng. 3.6.3. đảm bảo duy trì nguồn điện để công tác kiểm định không bị gián đoạn. 3.6.4. đặt biển báo hiệu nguy hiểm theo quy định của pháp luật khi thực hiện công tác kiểm định, đảm bảo người tham gia giao thông dễ dàng nhận biết, quan sát. 3.6.5. đáp ứng các quy định tại điều 3 trừ quy định tại điểm 3.1.1.1, điểm 3.1.1.5, điểm 3.2.1, điểm 3.2.2 và điểm 3.5.2. 3.7. vị trí cơ sở kiểm định khí thải xe mô tô, xe gắn máy cơ sở kiểm định khí thải xe mô tô, xe gắn máy phải cách cơ sở giáo dục phổ thông, bệnh viện tối thiểu là 50 m. 4. quy định quản lý 4.1. cơ sở đăng kiểm xe cơ giới 4.1.1. cơ sở đăng kiểm xe cơ giới trước khi đưa vào hoạt động phải được tổ chức đánh giá sự phù hợp được cục đăng kiểm việt nam chỉ định để đánh giá, chứng nhận phù hợp với quy chuẩn này theo quy định tại thông tư số 28/2012/tt-bkhcn ngày 12 tháng 12 năm 2012 của bộ trưởng bộ khoa học và công nghệ quy định về công bố hợp chuẩn, công bố hợp quy và phương thức đánh giá sự phù hợp với luật tiêu chuẩn và quy chuẩn kỹ thuật (thông tư số 28/2012/tt-bkhcn) và thông tư số 02/2017/tt- bkhcn ngày 31 tháng 3 năm 2017 của bộ trưởng bộ khoa học và công nghệ sửa đổi, bổ sung một số điều của thông tư số 28/2012/tt-bkhcn ngày 12 tháng 12 năm 2012 của bộ trưởng bộ khoa học và công nghệ quy định về công bố hợp chuẩn, công bố hợp quy. 4.1.2. việc chứng nhận cơ sở đăng kiểm xe cơ giới phù hợp quy chuẩn này được thực hiện theo phương thức 8 quy định tại thông tư 28/2012/tt-bkhcn của bộ trưởng bộ khoa học và công nghệ. 4.1.3. kết quả kiểm tra, đánh giá, chứng nhận cơ sở đăng kiểm xe cơ giới phù hợp với quy chuẩn này của tổ chức đánh giá sự phù hợp được chỉ định có hiệu lực trong thời hạn 36 tháng. 4.2. cơ sở kiểm định khí thải xe mô tô, xe gắn máy: 4.2.1 cơ sở kiểm định khí thải xe mô tô, xe gắn máy trước khi đưa vào vận hành, khai thác phải được sở giao thông vận tải tại địa phương kiểm tra đáp ứng yêu cầu quy định tại quy chuẩn này. 4.2.2. kết quả kiểm tra, đánh giá cơ sở kiểm định khí thải xe mô tô, xe gắn máy đáp ứng quy chuẩn này có hiệu lực trong thời hạn 36 tháng. 5. trách nhiệm của tổ chức, cá nhân. 5.1. trách nhiệm của cục đăng kiểm việt nam 5.1.1. quản lý nhà nước đối với hoạt động đánh giá sự phù hợp cơ sở đăng kiểm xe cơ giới, cơ sở kiểm định khí thải xe mô tô, xe gắn máy phù hợp với quy chuẩn này. 5.1.1. xây dựng, quản lý hệ thống tiếp nhận hình ảnh từ hệ thống giám sát quá trình kiểm định của các cơ sở đăng kiểm. 5.1.2. cập nhật và thông báo cho các cơ sở đăng kiểm về phiên bản phần mềm quản lý kiểm định. 5.1.3. chia sẻ cơ sở dữ liệu về kiểm công tác kiểm định xe cơ giới, kiểm định khí thải xe mô tô, xe gắn máy của địa phương cho sở giao thông vận tải. 5.1.4. chỉ định tổ chức đánh giá sự phù hợp để đánh giá, chứng nhận cơ sở đăng kiểm xe cơ giới phù hợp quy chuẩn này theo quy định pháp luật về chất lượng sản phẩm hàng hóa, pháp luật về tiêu chuẩn và quy chuẩn kỹ thuật 5.2. trách nhiệm của sở giao thông vận tải 5.2.1. tiếp nhận dữ liệu về công tác kiểm định xe cơ giới, kiểm định khí thải xe mô tô, xe gắn máy của địa phương từ cục đăng kiểm việt nam. 5.2.2. xây dựng, quản lý hệ thống tiếp nhận hình ảnh từ hệ thống giám sát quá trình kiểm định của các cơ sở đăng kiểm tại địa phương. 5.3. trách nhiệm của cơ sở đăng kiểm xe cơ giới, cơ sở kiểm định khí thải xe mô tô, xe gắn máy 5.3.1. duy trì tình trạng hoạt động và độ chính xác của thiết bị kiểm tra theo hướng dẫn của nhà sản xuất thiết bị, đảm bảo đáp ứng các yêu cầu tại quy chuẩn này. 5.3.2. kiểm định, hiệu chuẩn thiết bị kiểm tra thuộc quy chuẩn này theo quy định của pháp luật về đo lường. 5.3.3. sử dụng đúng phiên bản phần mềm quản lý kiểm định do cục đăng kiểm việt nam chuyển giao và cập nhật phiên bản mới nếu có. 6. tổ chức thực hiện 6.1. cục đăng kiểm việt nam chịu trách nhiệm tổ chức thực hiện quy chuẩn này. 6.2. điều khoản chuyển tiếp 6.2.1. các cơ sở đăng kiểm xe cơ giới đã được cấp giấy chứng nhận đủ điều kiện hoạt động kiểm định xe cơ giới trước ngày quy chuẩn này có hiệu lực phải đáp ứng quy định tại điểm 2.1.14., 2.4.1.2., 2.4.2.3.9., 2.4.2.5.1., 2.4.2.5.2. của quy chuẩn này chậm nhất trước ngày 01 tháng 01 năm 2027. 6.2.2. các cơ sở đăng kiểm xe cơ giới đã được cấp giấy chứng nhận đủ điều kiện hoạt động kiểm định xe cơ giới trước ngày 01 tháng 7 năm 2016 phải đáp ứng quy định tại các điểm 2.2.1.1., 2.2.1.2. và 2.2.1.3. của quy chuẩn này chậm nhất trước ngày 01 tháng 01 năm 2027. 6.2.3. các cơ sở đăng kiểm xe cơ giới đã được cấp giấy chứng nhận đủ điều kiện hoạt động kiểm định xe cơ giới trước ngày 15 tháng 10 năm 2019 phải đáp ứng được quy định tại điểm 2.2.2. của quy chuẩn này chậm nhất trước ngày 01 tháng 01 năm 2027. 6.2.4. không áp dụng quy định tại điểm 2.8 đối với các cơ sở đăng kiểm xe cơ giới đã được cấp giấy chứng nhận đủ điều kiện hoạt động kiểm định xe cơ giới hoặc đã được các cơ quan chức năng chấp thuận việc đầu tư, xây dựng nhưng chưa được cấp giấy chứng nhận đủ điều kiện hoạt động kiểm định xe cơ giới trước ngày quy chuẩn này có hiệu lực. 6.3. trường hợp các văn bản quy phạm pháp luật, tài liệu được viện dẫn trong quy chuẩn này có sửa đổi, bổ sung, thay thế thì thực hiện theo các văn bản quy phạm pháp luật, tài liệu được sửa đổi, bổ sung, thay thế đó. phụ lục a mẫu biển hiệu cho cơ sở đăng kiểm xe cơ giới; \ncơ sở kiểm định khí thải xe mô tô, xe gắn máy ghi chú: ký hiệu trong mẫu: kiểu chữ: arial phần biển hiệu: - nền xanh nước biển. - kiểu chữ..(2)..mầu trắng, có chiều cao bằng 1/3 đến 1/4 chiều cao bảng (h) qcvn 121:2024/bgtvt quy chuẩn kỹ thuật quốc gia về cơ sở bảo hành, bảo dưỡng xe cơ giới national technical regulation on road motor vehicles service workshops. lời nói đầu qcvn 121:2024/bgtvt do cục đăng kiểm việt nam biên soạn, vụ khoa học - công nghệ và môi trường trình duyệt, bộ khoa học và công nghệ thẩm định, bộ trưởng bộ giao thông vận tải ban hành kèm theo thông tư số 50/2024/tt-bgtvt ngày 15 tháng 11 năm 2024. quy chuẩn kỹ thuật quốc gia về cơ sở bảo hành, bảo dưỡng xe cơ giới. national technical regulation on road motor vehicles service workshops. 1. quy định chung 1.1. phạm vi điều chỉnh quy chuẩn này quy định các yêu cầu đối với cơ sở bảo hành, bảo dưỡng xe cơ giới. quy chuẩn này không áp dụng đối với cơ sở bảo hành, bảo dưỡng các xe cơ giới sử dụng vào mục đích quốc phòng, an ninh. 1.2. đối tượng áp dụng quy chuẩn này áp dụng đối với các cơ sở thực hiện việc bảo hành, bảo dưỡng xe cơ giới (sau đây gọi tắt là xe) và các tổ chức, cá nhân có liên quan đến việc quản lý hoạt động của cơ sở bảo hành, bảo dưỡng xe. 1.3. giải thích từ ngữ 1.3.1. bảo dưỡng là công việc dự phòng được tiến hành bắt buộc sau mỗi chu kỳ vận hành nhất định trong khai thác theo nội dung công việc đã được nhà sản xuất xe quy định nhằm duy trì trạng thái kỹ thuật tốt nhất của xe. 1.3.2. bảo hành là nghĩa vụ pháp lý của doanh nghiệp sản xuất, lắp ráp và doanh nghiệp nhập khẩu xe trong việc bảo đảm chất lượng xe đã bán ra trong điều kiện nhất định. 1.3.3. cơ sở bảo hành, bảo dưỡng là cơ sở được doanh nghiệp sản xuất, lắp ráp, nhập khẩu xe ủy quyền, chỉ định hoặc công bố là cơ sở thực hiện việc bảo hành, bảo dưỡng cho các xe do doanh nghiệp đó sản xuất, lắp ráp, nhập khẩu để kinh doanh tại việt nam (sau đây gọi tắt là cơ sở). 1.3.4. kỹ thuật viên là người tham gia trực tiếp vào quá trình kiểm tra, bảo hành, bảo dưỡng xe. 1.3.5. vị trí làm việc là vị trí mặt bằng và không gian có kích thước đáp ứng yêu cầu tại quy chuẩn này, được bố trí dụng cụ, thiết bị và kỹ thuật viên để thực hiện công việc bảo hành, bảo dưỡng. 1.3.6. tổ chức đánh giá sự phù hợp là tổ chức được quy định tại khoản 8 điều 3 của luật chất lượng sản phẩm, hàng hóa. 2. quy định về kỹ thuật 2.1. yêu cầu về mặt bằng và các khu vực của cơ sở 2.1.1. mặt bằng tổng thể: mặt bằng của cơ sở bao gồm nhà xưởng, các khu vực phục vụ công việc, phòng điều hành, kho phụ tùng, đường giao thông nội bộ, khu vực tiếp nhận, bàn giao xe. 2.1.2. nhà xưởng: nhà xưởng được xây dựng có mái che, có kích thước lối ra vào đáp ứng yêu cầu di chuyển của loại xe vào bảo hành, bảo dưỡng. 2.1.3. các khu vực của cơ sở: 2.1.3.1. số lượng tối thiểu như quy định tại bảng 1. bảng 1 - các khu vực của cơ sở 2.1.3.2. các khu vực phải được phân chia, có biển báo và chỉ dẫn. 2.1.4. kích thước từng vị trí làm việc tương ứng với loại xe thực hiện bảo hành, bảo dưỡng phải đáp ứng yêu cầu tối thiểu quy định tại bảng 2. bảng 2 - kích thước tối thiểu của các vị trí làm việc kích thước tính bằng mét 2.1.5. chiều cao của không gian tại các vị trí bảo hành, bảo dưỡng, lối đi dành cho xe di chuyển trong xưởng phải đáp ứng loại xe có chiều cao đăng ký bảo hành bảo dưỡng tại cơ sở. 2.2. trang thiết bị, dụng cụ phục vụ bảo hành, bảo dưỡng (chủng loại phù hợp với loại xe thực hiện bảo hành, bảo dưỡng): 2.2.1. dụng cụ quy định tại bảng 4 dưới đây bảng 4 - các dụng cụ tối thiểu phục vụ bảo hành bảo dưỡng 2.2.2. trang thiết bị cơ sở bảo hành, bảo dưỡng phải có tối thiểu các trang thiết bị sau: 2.2.2.1. cầu nâng hoặc bàn nâng xe (áp dụng đối với cơ sở bảo hành, bảo dưỡng các loại xe: ô tô con, ô tô khách từ 16 chỗ trở xuống, ô tô tải van, ô tô tải pickup, ô tô tải và ô tô chuyên dùng có khối lượng toàn bộ đến 3,5 tấn, xe bốn bánh có gắn động cơ). 2.2.2.2. hầm kiểm tra xe (áp dụng đối với cơ sở bảo hành, bảo dưỡng các loại xe: ô tô khách trên 16 chỗ, ô tô tải và ô tô chuyên dùng có khối lượng toàn bộ trên 3,5 tấn trong trường hợp cơ sở không trang bị cầu nâng hoặc bàn nâng xe phù hợp) 2.2.2.3. thiết bị hoặc dụng cụ thu hồi dầu thải (đối với các xe có sử dụng động cơ đốt trong); 2.2.2.4. thiết bị hoặc dụng cụ bơm dầu (đối với các xe có sử dụng động cơ đốt trong)(9); 2.2.2.5. thiết bị hoặc dụng cụ bơm mỡ (đối với các xe có sử dụng bơm mỡ); 2.2.2.6. thiết bị hoặc dụng cụ chuyên dùng phục vụ tháo, lắp xe (theo nhà sản xuất xe công bố); 2.2.2.7. đồng hồ đo điện đa năng; 2.2.2.8. thiết bị sạc ắc quy (đối với các xe có sử dụng ắc quy); 2.2.2.9. thiết bị hoặc dụng cụ kiểm tra hệ thống nhiên liệu (đối với các xe có sử dụng động cơ đốt trong)(9); 2.2.2.10. thiết bị kiểm tra, bảo dưỡng hệ thống điều hòa (đối với các xe có trang bị hệ thống điều hòa không khí)(9); 2.2.2.11. thiết bị chẩn đoán động cơ và tình trạng kỹ thuật của xe tương ứng với các loại xe cơ sở thực hiện bảo hành, bảo dưỡng (áp dụng với cơ sở bảo hành, bảo dưỡng xe có trang bị ecu điều khiển, không áp dụng đối với cơ sở bảo hành, bảo dưỡng rơ moóc, sơ mi rơ moóc); 2.2.2.12. thiết bị hoặc dụng cụ đo độ chụm bánh xe dẫn hướng (không áp dụng đối với cơ sở bảo hành, bảo dưỡng rơ moóc, sơ mi rơ moóc, mô tô, xe gắn máy); 2.2.2.13. thiết bị, dụng cụ bảo dưỡng, sửa chữa thân vỏ(9); 2.2.2.14. máy nén khí; 2.2.2.15. súng phun sơn(9); 2.2.2.16. đèn sấy sơn(9); 2.2.2.17. thiết bị, dụng cụ để bảo vệ an toàn cách điện cho kỹ thuật viên khi thực hiện công việc bảo hành, bảo dưỡng cho xe điện, xe hybrid điện theo yêu cầu của nhà sản xuất xe; 2.2.2.18. đồng hồ kiểm tra dòng điện và điện áp cao cho xe điện, xe hybrid điện theo quy định của nhà sản xuất xe; 2.2.2.19. thiết bị, dụng cụ để nâng, hạ, di chuyển pin và sạc pin cho xe điện, xe hybrid điện theo yêu cầu của nhà sản xuất xe(9). 2.3. thiết bị kiểm tra xuất xưởng(10) (phù hợp để kiểm tra được loại xe bảo hành, bảo dưỡng) cơ sở bảo hành, bảo dưỡng phải có tối thiểu các trang thiết bị sau: 2.3.1. thiết bị kiểm tra độ trượt ngang (không áp dụng đối với cơ sở bảo hành, bảo dưỡng rơ moóc, sơ mi rơ moóc); 2.3.2. thiết bị kiểm tra góc đặt bánh xe (áp dụng đối với cơ sở bảo hành, bảo dưỡng các loại xe có hệ thống treo độc lập, không áp dụng đối với cơ sở bảo hành, bảo dưỡng rơ moóc, sơ mi rơ moóc); 2.3.3. thiết bị kiểm tra góc quay lái của bánh xe dẫn hướng (không áp dụng đối với cơ sở bảo hành, bảo dưỡng rơ moóc, sơ mi rơ moóc); 2.3.4. thiết bị kiểm tra lực phanh trên các bánh xe; 2.3.5. thiết bị kiểm tra đèn chiếu sáng phía trước: kiểm tra được loại đèn chiếu sáng phía trước của xe được bảo hành, bảo dưỡng theo các tiêu chí kiểm tra sau (không áp dụng đối với cơ sở bảo hành, bảo dưỡng rơ moóc, sơ mi rơ moóc): 2.3.5.1. đo và hiển thị được cường độ sáng tại tâm quang học của đèn chiếu xa theo đơn vị cd hoặc bội số của cd; 2.3.5.2. đo và hiển thị được độ lệch tâm chùm sáng của đèn chiếu xa và độ lệch của giao điểm của đường sáng tối và phần hình nêm nhô lên của chùm sáng (điểm gẫy của đường cut-off) của đèn chiếu gần theo phương thẳng đứng và phương ngang. nội dung kiểm tra độ lệch nêu trên có thể được thực hiện bằng màn đo tọa độ. 2.3.6. thiết bị kiểm tra khí thải (không áp dụng đối với cơ sở bảo hành, bảo dưỡng xe điện, cơ sở bảo hành, bảo dưỡng rơ moóc, sơ mi rơ moóc): 2.3.6.1. phù hợp với loại nhiên liệu của xe bảo hành bảo dưỡng; 2.3.6.2. đối với thiết bị đo độ khói động cơ cháy do nén (động cơ diesel): đơn vị đo là độ khói (%hsu) hoặc hệ số hấp thụ ánh sáng (m-1); 2.3.6.3. đối với thiết bị phân tích khí thải cho động cơ cháy cưỡng bức (động cơ xăng, động cơ lpg, …): đo được thành phần khí thải co và hc, đơn vị đo co là % và hc là ppm; 2.3.6.4. có giải pháp ghi nhận được tốc độ vòng quay và nhiệt độ dầu động cơ trong quá trình kiểm tra. 2.3.7. các thiết bị kiểm tra xuất xưởng định kỳ được kiểm tra, xác nhận tình trạng hoạt động. 2.3.8. các thiết bị kiểm tra xuất xưởng phải được bố trí trên mặt bằng và không gian đáp ứng được việc kiểm tra các loại xe bảo hành, bảo dưỡng tại cơ sở. 3. quy định về quản lý 3.1. cơ sở bảo hành bảo dưỡng xe cơ giới 3.1.1. cơ sở bảo hành bảo dưỡng xe cơ giới trước khi đưa vào hoạt động phải được công bố hợp quy theo quy định tại thông tư số 28/2012/tt-bkhcn ngày 12 tháng 12 năm 2012 của bộ trưởng bộ khoa học và công nghệ quy định về công bố hợp chuẩn, công bố hợp quy và phương thức đánh giá sự phù hợp với tiêu chuẩn, quy chuẩn kỹ thuật (thông tư số 28/2012/tt-bkhcn) và thông tư số 02/2017/tt-bkhcn ngày 31 tháng 3 năm 2017 của bộ trưởng bộ khoa học và công nghệ sửa đổi, bổ sung một số điều của thông tư số 28/2012/tt-bkhcn ngày 12 tháng 12 năm 2012 của bộ trưởng bộ khoa học và công nghệ quy định về công bố hợp chuẩn, công bố hợp quy. 3.1.2. công bố hợp quy cơ sở bảo hành, bảo dưỡng xe cơ giới phải dựa trên kết quả đánh giá, chứng nhận của tổ chức đánh giá sự phù hợp được cục đăng kiểm việt nam chỉ định để đánh giá, chứng nhận phù hợp với quy chuẩn này theo quy định tại thông tư số 28/2012/tt-bkhcn ngày 12 tháng 12 năm 2012 của bộ trưởng bộ khoa học và công nghệ. 3.1.3. việc đánh giá, chứng nhận cơ sở bảo hành, bảo dưỡng xe cơ giới phù hợp quy chuẩn này được thực hiện theo phương thức 8 quy định tại điểm h khoản 1 điều 5 thông tư 28/2012/tt-bkhcn ngày 12 tháng 12 năm 2012 của bộ trưởng bộ khoa học và công nghệ. kết quả đánh giá, chứng nhận sự phù hợp với quy chuẩn này có hiệu lực trong thời hạn 36 tháng. 4. trách nhiệm của tổ chức, cá nhân 4.1. trách nhiệm của cục đăng kiểm việt nam 4.1.1. quản lý nhà nước đối với hoạt động đánh giá sự phù hợp cơ sở bảo hành, bảo dưỡng xe cơ giới phù hợp với quy chuẩn này. 4.1.2. chỉ định tổ chức đánh giá sự phù hợp để đánh giá, chứng nhận cơ sở bảo hành, bảo dưỡng xe cơ giới phù hợp quy chuẩn này theo quy định của pháp luật về chất lượng sản phẩm hàng hóa, pháp luật về tiêu chuẩn và quy chuẩn kỹ thuật. 4.2. trách nhiệm của sở giao thông vận tải tiếp nhận hồ sơ đăng ký công bố hợp quy của các cơ sở bảo hành, bảo dưỡng xe cơ giới và thực hiện chế độ báo cáo theo quy định tại khoản 3 điều 14 nghị định số 127/2007/nđ-cp ngày 01 tháng 8 năm 2007 quy định chi tiết thi hành một số điều của luật tiêu chuẩn và quy chuẩn kỹ thuật. 4.2. trách nhiệm của cơ sở bảo hành, bảo dưỡng xe cơ giới 4.2.1. thực hiện công bố hợp quy cơ sở bảo hành, bảo dưỡng xe cơ giới trước khi đưa vào hoạt động theo quy định của pháp luật. 4.2.2. thực hiện công việc bảo hành, bảo dưỡng và kiểm tra xuất xưởng cho các xe bảo hành, bảo dưỡng tại cơ sở theo yêu cầu của nhà sản xuất. 4.2.3. vận hành các thiết bị, dụng cụ phục vụ bảo hành, bảo dưỡng, các thiết bị kiểm tra xuất xưởng xe phải tuân thủ theo quy định của nhà sản xuất xe, nhà sản xuất thiết bị, đảm bảo duy trì tình trạng hoạt động bình thường của các trang thiết bị để thực hiện công việc. 5. tổ chức thực hiện 5.1. cục đăng kiểm việt nam chịu trách nhiệm tổ chức thực hiện quy chuẩn này. 5.2. cơ sở bảo hành, bảo dưỡng ô tô đã được doanh nghiệp sản xuất, lắp ráp, nhập khẩu ô tô công bố là cơ sở bảo hành, bảo dưỡng theo quy định của pháp luật, cơ sở bảo hành, bảo dưỡng mô tô, xe gắn máy đã thực hiện việc bảo hành, bảo dưỡng theo ủy quyền, chỉ định hoặc công bố của doanh nghiệp sản xuất, lắp ráp, nhập khẩu xe trước ngày quy chuẩn này có hiệu lực phải đáp ứng các yêu cầu quy định tại quy chuẩn này từ ngày 01 tháng 01 năm 2028. 5.3. trường hợp các văn bản quy phạm pháp luật, tài liệu được viện dẫn trong quy chuẩn này có sửa đổi, bổ sung, thay thế thì thực hiện theo các văn bản quy phạm pháp luật, tài liệu được sửa đổi, bổ sung, thay thế. ______________________ (9), (10) không áp dụng đối với cơ sở bảo hành, bảo dưỡng mô tô, xe gắn máy']","**Nguồn văn bản:** 168_2024_ND-CP_619502

**Tên văn bản:** Nghị định Quy định xử phạt vi phạm hành chính về trật tự, an toàn giao thông trong lĩnh vực giao thông đường bộ; trừ điểm, phục hồi điểm giấy phép lái xe

**Điều 7:** xử phạt, trừ điểm giấy phép lái của người điều khiển xe mô tô, xe gắn máy, các loại xe tương tự xe mô tô và các loại xe tương tự xe gắn máy vi phạm quy tắc giao thông đường bộ

**Nội dung:**

1. Phạt tiền từ 200.000 đồng đến 400.000 đồng đối với người điều khiển xe thực hiện một trong các hành vi vi phạm sau đây:

    i) Sử dụng còi trong thời gian từ 22 giờ ngày hôm trước đến 05 giờ ngày hôm sau trong khu đông dân cư, khu vực cơ sở khám bệnh, chữa bệnh, trừ các xe ưu tiên đang đi làm nhiệm vụ theo quy định;


**Nguồn văn bản:** 36_2024_QH15_444251

**Tên văn bản:** Luật Trật tự, an toàn giao thông đường bộ

**Điều 21:** sử dụng tín hiệu còi

**Nội dung:**

2. Không sử dụng còi liên tục; không sử dụng còi có âm lượng không đúng quy định; không sử dụng còi trong thời gian từ 22 giờ ngày hôm trước đến 05 giờ ngày hôm sau trong khu đông dân cư, khu vực cơ sở khám bệnh, chữa bệnh, trừ xe ưu tiên.


**Nguồn văn bản:** 50_2024_TT-BGTVT_635820

**Tên văn bản:** Thông tư Ban hành quy chuẩn kỹ thuật quốc gia về cơ sở vật chất kỹ thuật và vị trí cơ sở đăng kiểm xe cơ giới, cơ sở kiểm định khí thải xe mô tô, xe gắn máy và quy chuẩn kỹ thuật quốc gia về cơ sở bảo hành, bảo dưỡng xe cơ giới

**Điều 1:** ban hành kèm theo thông tư này:

**Nội dung:**  (Thông tư này không liên quan đến câu hỏi về sử dụng còi xe)


Tóm lại:  Việc sử dụng còi xe bị cấm từ 22 giờ đến 5 giờ sáng hôm sau tại khu đông dân cư và khu vực bệnh viện, trường học (cơ sở khám bệnh, chữa bệnh), trừ các xe ưu tiên đang làm nhiệm vụ.  Vi phạm sẽ bị phạt tiền từ 200.000 đến 400.000 đồng.  Không được sử dụng còi liên tục hoặc còi có âm lượng không đúng quy định.
","Cấm sử dụng còi xe trong khu vực bệnh viện, trường học để giảm tiếng ồn.",0.8571428571428571,0.37303435741756347,0.0,0.0
20,Luật Giao thông Đường bộ 2025 có quy định gì về việc sử dụng ghế trẻ em trên ô tô?,"['1. phạt tiền từ 500.000 đồng đến 1.000.000 đồng đối với cá nhân, từ 1.000.000 đồng đến 2.000.000 đồng đối với tổ chức thực hiện một trong các hành vi vi phạm sau đây: a) xếp hàng hóa lên mỗi xe ô tô (kể cả rơ moóc và sơ mi rơ moóc) vượt quá trọng tải (khối lượng hàng chuyên chở) cho phép tham gia giao thông được ghi trong giấy chứng nhận kiểm định an toàn kỹ thuật và bảo vệ môi trường của xe trên 10% đến 50% (trừ xe xi téc chở chất lỏng), trên 20% đến 50% đối với xe xi téc chở chất lỏng; b) xếp hàng hóa lên xe ô tô mà không ký xác nhận việc xếp hàng hóa vào giấy vận tải theo quy định. 2. phạt tiền từ 1.000.000 đồng đến 2.000.000 đồng đối với cá nhân, từ 2.000.000 đồng đến 4.000.000 đồng đối với tổ chức kinh doanh vận tải, dịch vụ hỗ trợ vận tải thực hiện một trong các hành vi vi phạm sau đây: a) không đánh số thứ tự ghế ngồi, giường nằm trên xe ô tô chở hành khách theo quy định; b) sử dụng xe ô tô kinh doanh vận tải hành khách theo tuyến cố định, xe ô tô kinh doanh vận tải hành khách bằng xe buýt không có chỗ ưu tiên cho người khuyết tật, người cao tuổi và phụ nữ mang thai theo quy định; c) sử dụng xe ô tô kinh doanh vận tải hành khách không có hướng dẫn cho hành khách về an toàn giao thông, thoát hiểm khi xảy ra sự cố trên xe theo quy định; d) không bố trí người áp tải trên xe vận chuyển hàng hóa nguy hiểm đối với những trường hợp quy định phải có người áp tải; đ) không cấp lệnh vận chuyển, giấy vận tải cho lái xe hoặc cấp lệnh vận chuyển, giấy vận tải nhưng không đúng theo quy định (đối với loại xe quy định phải cấp lệnh vận chuyển, giấy vận tải); e) sử dụng xe vận chuyển hàng hóa nguy hiểm mà không làm sạch hoặc không bóc (xóa) biểu trưng nguy hiểm trên phương tiện khi không tiếp tục vận chuyển loại hàng hóa đó. 3. phạt tiền từ 2.000.000 đồng đến 3.000.000 đồng đối với cá nhân, từ 4.000.000 đồng đến 6.000.000 đồng đối với tổ chức thực hiện hành vi vi phạm xếp hàng hóa lên mỗi xe ô tô (kể cả rơ moóc và sơ mi rơ moóc) vượt quá trọng tải (khối lượng hàng chuyên chở) cho phép tham gia giao thông được ghi trong giấy chứng nhận kiểm định an toàn kỹ thuật và bảo vệ môi trường của xe trên 50% đến 100%. 4. phạt tiền từ 3.000.000 đồng đến 4.000.000 đồng đối với cá nhân, từ 6.000.000 đồng đến 8.000.000 đồng đối với tổ chức kinh doanh vận tải, dịch vụ hỗ trợ vận tải thực hiện một trong các hành vi vi phạm sau đây: a) không cấp thẻ nhận dạng lái xe cho lái xe theo quy định; b) sử dụng lái xe, nhân viên phục vụ trên xe để tham gia kinh doanh vận tải bằng xe ô tô mà không được tập huấn, hướng dẫn về nghiệp vụ vận tải hành khách và an toàn giao thông theo quy định (đối với hình thức kinh doanh vận tải có quy định lái xe, nhân viên phục vụ trên xe phải được tập huấn, hướng dẫn nghiệp vụ), trừ các hành vi vi phạm quy định tại điểm c, điểm d khoản này; c) sử dụng lái xe, người quản lý trên xe để tham gia kinh doanh vận tải bằng xe ô tô mà không được hướng dẫn về quy trình bảo đảm an toàn khi đưa đón trẻ em mầm non, học sinh; d) sử dụng lái xe, người áp tải vận chuyển hàng hóa nguy hiểm mà không được tập huấn về vận chuyển hàng hóa nguy hiểm; đ) sử dụng xe ô tô kinh doanh vận tải hành khách không có dây đai an toàn tại các vị trí ghế ngồi, giường nằm theo quy định (trừ xe buýt nội tỉnh); e) sử dụng xe ô tô kinh doanh vận tải chở trẻ em mầm non, học sinh tiểu học, xe ô tô kinh doanh vận tải kết hợp với hoạt động đưa đón trẻ em mầm non, học sinh tiểu học không có dây đai an toàn phù hợp với lứa tuổi hoặc không có ghế ngồi phù hợp với lứa tuổi theo quy định; g) không thực hiện việc niêm yết thông tin trên xe theo quy định hoặc có niêm yết nhưng không chính xác, không đầy đủ thông tin theo quy định. 5. phạt tiền từ 4.000.000 đồng đến 5.000.000 đồng đối với cá nhân, từ 8.000.000 đồng đến 10.000.000 đồng đối với tổ chức xếp hàng hóa lên mỗi xe ô tô (kể cả rơ moóc và sơ mi rơ moóc) vượt quá trọng tải (khối lượng hàng chuyên chở) cho phép tham gia giao thông được ghi trong giấy chứng nhận kiểm định an toàn kỹ thuật và bảo vệ môi trường của xe trên 100%. 6. phạt tiền từ 4.000.000 đồng đến 6.000.000 đồng đối với cá nhân, từ 8.000.000 đồng đến 12.000.000 đồng đối với tổ chức kinh doanh vận tải thực hiện một trong các hành vi vi phạm sau đây: a) sử dụng xe vận chuyển động vật sống không có kết cấu phù hợp với loại động vật chuyên chở theo quy định; b) sử dụng xe ô tô kinh doanh vận tải chở trẻ em mầm non, học sinh, xe ô tô kinh doanh vận tải kết hợp với hoạt động đưa đón trẻ em mầm non, học sinh không có thiết bị ghi nhận hình ảnh trẻ em mầm non, học sinh hoặc không có thiết bị có chức năng cảnh báo, chống bỏ quên trẻ em trên xe hoặc không có thiết bị ghi nhận hình ảnh trẻ em mầm non, học sinh và thiết bị có chức năng cảnh báo, chống bỏ quên trẻ em trên xe; c) sử dụng xe ô tô kinh doanh vận tải chở trẻ em mầm non, học sinh không có màu sơn theo quy định; d) sử dụng xe ô tô kinh doanh vận tải chở trẻ em mầm non, học sinh, xe ô tô kinh doanh vận tải kết hợp với hoạt động đưa đón trẻ em mầm non, học sinh không có biển báo dấu hiệu nhận biết là xe chở trẻ em mầm non, học sinh theo quy định. 7. phạt tiền từ 5.000.000 đồng đến 6.000.000 đồng đối với cá nhân, từ 10.000.000 đồng đến 12.000.000 đồng đối với tổ chức kinh doanh vận tải, dịch vụ hỗ trợ vận tải thực hiện một trong các hành vi vi phạm sau đây: a) không thực hiện việc cung cấp, cập nhật, truyền, lưu trữ, quản lý thông tin, dữ liệu từ thiết bị giám sát hành trình theo quy định; b) không thực hiện đúng nội dung thông tin đã niêm yết trên xe theo quy định; c) sử dụng phương tiện kinh doanh vận tải không lắp thiết bị giám sát hành trình của xe (đối với hình thức kinh doanh vận tải có quy định phương tiện phải lắp thiết bị) hoặc lắp thiết bị nhưng thiết bị không hoạt động, không đúng quy chuẩn theo quy định hoặc làm sai lệch dữ liệu của thiết bị giám sát hành trình của xe ô tô; d) sử dụng xe trung chuyển chở hành khách không đúng quy định; đ) sử dụng lái xe điều khiển xe khách giường nằm hai tầng, xe ô tô đưa đón trẻ em mầm non, học sinh chưa đủ số năm kinh nghiệm theo quy định; e) sử dụng xe kinh doanh vận tải hành khách theo hợp đồng mà trên xe không có hợp đồng vận tải, danh sách hành khách kèm theo, thiết bị để truy cập nội dung hợp đồng điện tử và danh sách hành khách theo quy định hoặc có hợp đồng vận tải, danh sách hành khách, thiết bị để truy cập nhưng không bảo đảm yêu cầu theo quy định, chở người không có tên trong danh sách hành khách hoặc vận chuyển không đúng đối tượng theo quy định (đối với xe kinh doanh vận tải hành khách theo hợp đồng vận chuyển trẻ em mầm non, học sinh, sinh viên, cán bộ, công chức, viên chức, công nhân); g) sử dụng xe ô tô kinh doanh vận tải không lắp thiết bị ghi nhận hình ảnh người lái xe theo quy định (đối với loại xe có quy định phải lắp thiết bị ghi nhận hình ảnh người lái xe) hoặc có lắp thiết bị ghi nhận hình ảnh người lái xe nhưng không ghi, không lưu trữ được dữ liệu trên xe trong quá trình xe tham gia giao thông theo quy định hoặc làm sai lệch dữ liệu của thiết bị ghi nhận hình ảnh người lái xe lắp trên xe ô tô; h) không thực hiện việc cung cấp, cập nhật, truyền dẫn, lưu trữ, quản lý thông tin, dữ liệu thu thập từ thiết bị ghi nhận hình ảnh người lái xe lắp trên xe ô tô theo quy định; i) sử dụng phương tiện kinh doanh vận tải có niên hạn sử dụng không bảo đảm điều kiện của hình thức kinh doanh đã đăng ký. 8. phạt tiền từ 10.000.000 đồng đến 12.000.000 đồng đối với cá nhân, từ 20.000.000 đồng đến 24.000.000 đồng đối với tổ chức kinh doanh vận tải, dịch vụ hỗ trợ vận tải thực hiện một trong các hành vi vi phạm sau đây: a) không tổ chức khám sức khỏe định kỳ cho lái xe theo quy định hoặc có tổ chức khám nhưng không đầy đủ các nội dung theo quy định; b) vi phạm quy định về kinh doanh, điều kiện kinh doanh vận tải bằng xe ô tô để xảy ra tai nạn giao thông gây hậu quả từ mức nghiêm trọng trở lên; c) sử dụng xe ô tô kinh doanh vận tải để đón, trả khách; nhận, trả hàng trên đường cao tốc. 9. phạt tiền từ 20.000.000 đồng đến 40.000.000 đồng đối với đơn vị sản xuất, lắp ráp, nhập khẩu thiết bị giám sát hành trình của xe ô tô, đơn vị cung cấp dịch vụ liên quan đến giám sát hành trình, ghi nhận hình ảnh người lái xe thực hiện một trong các hành vi sau: a) đơn vị sản xuất, lắp ráp, nhập khẩu thiết bị giám sát hành trình của xe ô tô không có nhân sự cho từng vị trí công việc theo quy định; b) đơn vị sản xuất, lắp ráp, nhập khẩu thiết bị giám sát hành trình của xe ô tô không báo cáo về việc cập nhật, thay đổi phần mềm của thiết bị theo quy định. 10. phạt tiền từ 40.000.000 đồng đến 60.000.000 đồng đối với đơn vị sản xuất, lắp ráp, nhập khẩu thiết bị ghi nhận hình ảnh người lái xe lắp trên xe ô tô, đơn vị cung cấp dịch vụ liên quan đến giám sát hành trình, ghi nhận hình ảnh người lái xe thực hiện một trong các hành vi vi phạm sau đây: a) làm sai lệch thông tin, dữ liệu của thiết bị giám sát hành trình của xe ô tô; b) làm sai lệch thông tin, dữ liệu của thiết bị ghi nhận hình ảnh người lái xe lắp trên xe ô tô. 11. phạt tiền từ 40.000.000 đồng đến 50.000.000 đồng đối với cá nhân, từ 80.000.000 đồng đến 100.000.000 đồng đối với tổ chức kinh doanh vận tải, dịch vụ hỗ trợ vận tải tái phạm hành vi quy định tại điểm a, điểm h khoản 7 điều này. 12. ngoài việc bị phạt tiền, cá nhân, tổ chức thực hiện hành vi vi phạm quy định tại điểm c khoản 2; điểm a, điểm b, điểm đ, điểm g khoản 4; điểm b, điểm c, điểm d, điểm đ, điểm e, điểm g khoản 7; điểm c khoản 8 điều này còn bị áp dụng các hình thức xử phạt bổ sung tước quyền sử dụng phù hiệu từ 01 tháng đến 03 tháng (nếu có hoặc đã được cấp) đối với xe vi phạm. 13. ngoài việc bị áp dụng hình thức xử phạt, cá nhân, tổ chức thực hiện hành vi vi phạm còn bị áp dụng các biện pháp khắc phục hậu quả sau đây: a) thực hiện hành vi quy định tại điểm a khoản 4 điều này buộc cấp thẻ nhận dạng lái xe cho lái xe theo quy định; b) thực hiện hành vi quy định tại điểm b, điểm c, điểm d khoản 4; điểm a khoản 8 điều này buộc tổ chức tập huấn, hướng dẫn nghiệp vụ, quy trình hoặc tổ chức khám sức khỏe định kỳ cho lái xe và nhân viên phục vụ trên xe theo quy định; c) thực hiện hành vi quy định tại điểm đ, điểm e khoản 4; điểm c, điểm g khoản 7 điều này buộc lắp đặt thiết bị giám sát hành trình, thiết bị ghi nhận hình ảnh người lái xe, dây đai an toàn, ghế ngồi cho trẻ em mầm non, học sinh tiểu học trên xe theo đúng quy định; d) thực hiện hành vi quy định tại điểm a, điểm h khoản 7; khoản 11 điều này buộc cung cấp, cập nhật, truyền dẫn, lưu trữ, quản lý thông tin, dữ liệu thu thập từ thiết bị giám sát hành trình, thiết bị ghi nhận hình ảnh người lái xe lắp trên xe ô tô theo quy định; đ) thực hiện hành vi quy định tại điểm c, điểm d khoản 6 điều này buộc thực hiện đúng quy định về màu sơn, biển báo dấu hiệu nhận biết của xe. 14. ngoài việc bị áp dụng hình thức xử phạt, người điều khiển phương tiện thực hiện hành vi vi phạm còn bị trừ điểm giấy phép lái xe như sau: a) thực hiện hành vi quy định tại điểm đ khoản 2; điểm b, điểm c, điểm d khoản 6; điểm b, điểm c, điểm e, điểm i khoản 7 điều này trong trường hợp cá nhân kinh doanh vận tải là người trực tiếp điều khiển phương tiện còn bị trừ điểm giấy phép lái xe 02 điểm; b) thực hiện hành vi quy định tại điểm c khoản 8 điều này trong trường hợp cá nhân kinh doanh vận tải là người trực tiếp điều khiển phương tiện còn bị trừ điểm giấy phép lái xe 06 điểm.', '1. tuyên truyền, phổ biến pháp luật về trật tự, an toàn giao thông đường bộ được thực hiện thường xuyên, rộng rãi, phù hợp với các tầng lớp nhân dân, người nước ngoài trên lãnh thổ nước cộng hòa xã hội chủ nghĩa việt nam. 2. cơ quan quản lý nhà nước về trật tự, an toàn giao thông đường bộ chủ trì, phối hợp với các cơ quan, tổ chức, cá nhân có liên quan thực hiện tuyên truyền, phổ biến pháp luật về trật tự, an toàn giao thông đường bộ. 3. cơ quan thông tin, truyền thông có trách nhiệm tổ chức tuyên truyền, phổ biến pháp luật về trật tự, an toàn giao thông đường bộ trên các phương tiện thông tin, truyền thông đại chúng. 4. mặt trận tổ quốc việt nam và các tổ chức thành viên của mặt trận có trách nhiệm phối hợp với cơ quan hữu quan và chính quyền địa phương tuyên truyền, vận động nhân dân thực hiện pháp luật về trật tự, an toàn giao thông đường bộ. 5. bộ, cơ quan ngang bộ, ủy ban nhân dân các cấp, trong phạm vi nhiệm vụ, quyền hạn của mình, có trách nhiệm tổ chức tuyên truyền, phổ biến pháp luật về trật tự, an toàn giao thông đường bộ, có hình thức tuyên truyền, phổ biến phù hợp với từng đối tượng. 6. đơn vị lực lượng vũ trang nhân dân, cơ quan, tổ chức, cơ sở giáo dục có trách nhiệm tổ chức tuyên truyền, phổ biến pháp luật về trật tự, an toàn giao thông đường bộ cho đối tượng thuộc thẩm quyền quản lý. 7. thành viên trong gia đình có trách nhiệm tuyên truyền, nhắc nhở thành viên khác chấp hành pháp luật về trật tự, an toàn giao thông đường bộ, sử dụng dây đai an toàn, ghế dành cho trẻ em hoặc có người lớn ngồi cùng trẻ em phía sau khi chở trẻ em dưới 06 tuổi bằng xe gắn máy, xe mô tô.', '1. người tham gia giao thông đường bộ phải đi bên phải theo chiều đi của mình, đi đúng làn đường, phần đường quy định, chấp hành báo hiệu đường bộ và các quy tắc giao thông đường bộ khác. 2. người lái xe và người được chở trên xe ô tô phải thắt dây đai an toàn tại những chỗ có trang bị dây đai an toàn khi tham gia giao thông đường bộ. 3. khi chở trẻ em dưới 10 tuổi và chiều cao dưới 1,35 mét trên xe ô tô không được cho trẻ em ngồi cùng hàng ghế với người lái xe, trừ loại xe ô tô chỉ có một hàng ghế; người lái xe phải sử dụng, hướng dẫn sử dụng thiết bị an toàn phù hợp cho trẻ em.', '1. xe ô tô kinh doanh vận tải chở trẻ em mầm non, học sinh phải đáp ứng các yêu cầu sau đây: a) bảo đảm các điều kiện quy định tại khoản 1 và khoản 2 điều 35 của luật này; có thiết bị ghi nhận hình ảnh trẻ em mầm non, học sinh và thiết bị có chức năng cảnh báo, chống bỏ quên trẻ em trên xe; có niên hạn sử dụng không quá 20 năm; có màu sơn theo quy định của chính phủ; b) xe ô tô chở trẻ em mầm non hoặc học sinh tiểu học phải có dây đai an toàn phù hợp với lứa tuổi hoặc sử dụng xe có ghế ngồi phù hợp với lứa tuổi theo quy định của pháp luật. 2. xe ô tô kinh doanh vận tải kết hợp với hoạt động đưa đón trẻ em mầm non, học sinh phải đáp ứng các yêu cầu theo quy định tại khoản 3 điều 10, khoản 1 và khoản 2 điều 35 của luật này; có thiết bị ghi nhận hình ảnh trẻ em mầm non, học sinh và thiết bị có chức năng cảnh báo, chống bỏ quên trẻ em trên xe đáp ứng yêu cầu theo quy định tại điểm a khoản 1 điều này. 3. khi đưa đón trẻ em mầm non, học sinh tiểu học phải bố trí tối thiểu 01 người quản lý trên mỗi xe ô tô để hướng dẫn, giám sát, duy trì trật tự và bảo đảm an toàn cho trẻ em mầm non, học sinh tiểu học trong suốt chuyến đi. trường hợp xe từ 29 chỗ trở lên (không kể chỗ của người lái xe) mà chở từ 27 trẻ em mầm non và học sinh tiểu học trở lên phải bố trí tối thiểu 02 người quản lý trên mỗi xe ô tô. người quản lý, người lái xe có trách nhiệm kiểm tra trẻ em mầm non, học sinh tiểu học khi xuống xe; không được để trẻ em mầm non, học sinh tiểu học trên xe khi người quản lý và người lái xe đã rời xe. 4. người lái xe ô tô đưa đón trẻ em mầm non, học sinh phải có tối thiểu 02 năm kinh nghiệm lái xe vận tải hành khách. 5. cơ sở giáo dục phải xây dựng quy trình bảo đảm an toàn khi đưa đón trẻ em mầm non, học sinh; hướng dẫn cho lái xe và người quản lý trẻ em mầm non, học sinh nắm vững và thực hiện đúng quy trình; chịu trách nhiệm bảo đảm trật tự, an toàn giao thông đường bộ khi tổ chức đưa đón trẻ em mầm non, học sinh của cơ sở giáo dục đó. 6. xe đưa đón trẻ em mầm non, học sinh được ưu tiên trong tổ chức phân luồng, điều tiết giao thông, bố trí nơi dừng xe, đỗ xe tại khu vực trường học và tại các điểm trên lộ trình đưa đón trẻ em mầm non, học sinh.', '1. độ tuổi của người lái xe, người điều khiển xe máy chuyên dùng được quy định như sau: a) người đủ 16 tuổi trở lên được điều khiển xe gắn máy; b) người đủ 18 tuổi trở lên được cấp giấy phép lái xe hạng a1, a, b1, b, c1, được cấp chứng chỉ bồi dưỡng kiến thức pháp luật về giao thông đường bộ để điều khiển xe máy chuyên dùng tham gia giao thông đường bộ; c) người đủ 21 tuổi trở lên được cấp giấy phép lái xe hạng c, be; d) người đủ 24 tuổi trở lên được cấp giấy phép lái xe hạng d1, d2, c1e, ce; đ) người đủ 27 tuổi trở lên được cấp giấy phép lái xe hạng d, d1e, d2e, de; e) tuổi tối đa của người lái xe ô tô chở người (kể cả xe buýt) trên 29 chỗ (không kể chỗ của người lái xe), xe ô tô chở người giường nằm là đủ 57 tuổi đối với nam, đủ 55 tuổi đối với nữ. 2. người điều khiển phương tiện tham gia giao thông đường bộ phải bảo đảm điều kiện sức khỏe phù hợp với từng loại phương tiện được phép điều khiển. bộ trưởng bộ y tế quy định về tiêu chuẩn sức khỏe, việc khám sức khỏe đối với người lái xe, người điều khiển xe máy chuyên dùng; việc khám sức khỏe định kỳ đối với người hành nghề lái xe ô tô; xây dựng cơ sở dữ liệu về sức khỏe của người lái xe, người điều khiển xe máy chuyên dùng. 3. bộ trưởng bộ quốc phòng, bộ trưởng bộ công an quy định độ tuổi của người lái xe trong lực lượng quân đội, công an làm nhiệm vụ quốc phòng, an ninh.']","**Nguồn văn bản:** 36_2024_QH15_444251

**Tên văn bản:** Luật Trật tự, an toàn giao thông đường bộ

**Điều 10:** Quy tắc chung

**Nội dung:**

3. Khi chở trẻ em dưới 10 tuổi và chiều cao dưới 1,35 mét trên xe ô tô không được cho trẻ em ngồi cùng hàng ghế với người lái xe, trừ loại xe ô tô chỉ có một hàng ghế; người lái xe phải sử dụng, hướng dẫn sử dụng thiết bị an toàn phù hợp cho trẻ em.


**Nguồn văn bản:** 36_2024_QH15_444251

**Tên văn bản:** Luật Trật tự, an toàn giao thông đường bộ

**Điều 46:** Bảo đảm trật tự, an toàn giao thông đường bộ đối với xe ô tô chở trẻ em mầm non, học sinh

**Nội dung:**

1. Xe ô tô kinh doanh vận tải chở trẻ em mầm non, học sinh phải đáp ứng các yêu cầu sau đây:
    a) Bảo đảm các điều kiện quy định tại khoản 1 và khoản 2 điều 35 của luật này; có thiết bị ghi nhận hình ảnh trẻ em mầm non, học sinh và thiết bị có chức năng cảnh báo, chống bỏ quên trẻ em trên xe; có niên hạn sử dụng không quá 20 năm; có màu sơn theo quy định của chính phủ;
    b) Xe ô tô chở trẻ em mầm non hoặc học sinh tiểu học phải có dây đai an toàn phù hợp với lứa tuổi hoặc sử dụng xe có ghế ngồi phù hợp với lứa tuổi theo quy định của pháp luật.

2. Xe ô tô kinh doanh vận tải kết hợp với hoạt động đưa đón trẻ em mầm non, học sinh phải đáp ứng các yêu cầu theo quy định tại khoản 3 điều 10, khoản 1 và khoản 2 điều 35 của luật này; có thiết bị ghi nhận hình ảnh trẻ em mầm non, học sinh và thiết bị có chức năng cảnh báo, chống bỏ quên trẻ em trên xe đáp ứng yêu cầu theo quy định tại điểm a khoản 1 điều này.

Tóm lại: Luật quy định trẻ em dưới 10 tuổi, cao dưới 1,35m không được ngồi cùng hàng ghế với người lái xe (trừ xe chỉ có 1 hàng ghế).  Xe ô tô chở trẻ em mầm non, học sinh phải đáp ứng các yêu cầu về thiết bị an toàn, dây đai an toàn hoặc ghế ngồi phù hợp lứa tuổi, và có thể cần người quản lý đi kèm tùy thuộc số lượng trẻ.
",Bắt buộc sử dụng ghế an toàn cho trẻ em dưới 12 tuổi khi ngồi trên ô tô.,1.0,0.6417124383025233,0.0,0.0
21,Quy định mới về việc sử dụng dây an toàn trên ô tô là gì?,"['1. xe ô tô vận tải người nội bộ a) sử dụng xe ô tô phải đáp ứng các điều kiện tham gia giao thông theo quy định tại khoản 1 điều 35, khoản 1, khoản 2 và khoản 3 điều 40 của luật trật tự, an toàn giao thông đường bộ; phải có dây an toàn tại các vị trí ghế ngồi, có hướng dẫn về an toàn giao thông và thoát hiểm khi xảy ra sự cố trên xe; b) xe ô tô phải được niêm yết (dán cố định) cụm từ “xe nội bộ” làm bằng vật liệu phản quang trên kính phía trước và kính phía sau xe, kích thước tối thiểu của cụm từ “xe nội bộ” là 10 x 35 cm theo mẫu số 12 phụ lục xiii kèm theo nghị định này. trường hợp niêm yết bằng thiết bị điện tử phải bảo đảm cụm từ “xe nội bộ” luôn được bật sáng và có kích thước tối thiểu là 10 x 35 cm; c) phải thuộc quyền sở hữu hoặc quyền sử dụng hợp pháp theo hợp đồng thuê phương tiện bằng văn bản của đơn vị vận tải nội bộ với tổ chức, cá nhân theo quy định của pháp luật. trường hợp xe đăng ký thuộc sở hữu của thành viên hợp tác xã phải có hợp đồng dịch vụ giữa thành viên với hợp tác xã, trong đó quy định hợp tác xã có quyền, trách nhiệm và nghĩa vụ quản lý, sử dụng, điều hành xe ô tô thuộc sở hữu của thành viên hợp tác xã. 2. đơn vị hoạt động vận tải nội bộ bằng xe ô tô a) theo dõi, giám sát hoạt động của lái xe và phương tiện trong suốt quá trình hoạt động vận tải nội bộ; thực hiện chế độ bảo dưỡng sửa chữa phương tiện đúng quy định về bảo dưỡng kỹ thuật, sửa chữa phương tiện giao thông xe cơ giới đường bộ; kiểm tra điều kiện an toàn giao thông của xe và lái xe ô tô trước khi thực hiện nhiệm vụ vận chuyển; kiểm tra, giám sát hoạt động của xe ô tô và người lái xe trên hành trình; b) bảo đảm quy định về thời gian lái xe liên tục, thời gian làm việc trong ngày, thời gian nghỉ của người lái xe theo quy định tại khoản 1 điều 64 luật trật tự, an toàn giao thông đường bộ; c) tổ chức thực hiện bảo đảm công tác quản lý an toàn theo quy định tại khoản 10 điều 11 nghị định này; d) lập, cập nhật đầy đủ các nội dung quy định về quá trình hoạt động của phương tiện và lái xe thuộc đơn vị vào lý lịch phương tiện, lý lịch hành nghề lái xe, thực hiện theo dõi quá trình hoạt động và bảo dưỡng, sửa chữa phương tiện theo quy định về bảo dưỡng kỹ thuật, sửa chữa phương tiện giao thông xe cơ giới đường bộ; đ) không sử dụng xe ô tô chở người có giường nằm hai tầng để hoạt động trên các tuyến đường cấp v miền núi, vi miền núi; e) không được sử dụng người lái xe đang trong thời gian bị cấm hành nghề theo quy định của pháp luật; không sử dụng lái xe có dưới 02 năm kinh nghiệm điều khiển xe khách có trọng tải thiết kế từ 29 chỗ (không kể chỗ của người lái xe) trở lên để điều khiển xe có giường nằm hai tầng. tổ chức khám sức khỏe định kỳ cho người lái xe và sử dụng người lái xe đủ sức khỏe theo quy định. 3. người lái xe ô tô hoạt động vận tải nội bộ a) có trách nhiệm kiểm tra các điều kiện bảo đảm an toàn của xe, hướng dẫn cho người ngồi trên xe về an toàn giao thông và thoát hiểm khi gặp sự cố, yêu cầu người ngồi trên xe thắt dây an toàn trước khi cho xe khởi hành; kiểm tra việc sắp xếp, chằng buộc hành lý bảo đảm an toàn; b) thực hiện quy định về thời gian lái xe liên tục, thời gian làm việc trong ngày, thời gian nghỉ theo khoản 1 điều 64 luật trật tự, an toàn giao thông đường bộ; c) không được chở người trên mui, trong khoang chở hành lý hoặc để người đu, bám bên ngoài xe; không được chở hàng nguy hiểm, hàng cấm lưu hành, hàng lậu, động thực vật hoang dã; không được chở người, hành lý, hàng hóa vượt quá trọng tải, quá số người theo quy định; d) từ chối điều khiển phương tiện khi phát hiện phương tiện không bảo đảm các điều kiện về an toàn, không có hoặc không có đủ dây an toàn trên xe.', '1. người tham gia giao thông đường bộ phải đi bên phải theo chiều đi của mình, đi đúng làn đường, phần đường quy định, chấp hành báo hiệu đường bộ và các quy tắc giao thông đường bộ khác. 2. người lái xe và người được chở trên xe ô tô phải thắt dây đai an toàn tại những chỗ có trang bị dây đai an toàn khi tham gia giao thông đường bộ. 3. khi chở trẻ em dưới 10 tuổi và chiều cao dưới 1,35 mét trên xe ô tô không được cho trẻ em ngồi cùng hàng ghế với người lái xe, trừ loại xe ô tô chỉ có một hàng ghế; người lái xe phải sử dụng, hướng dẫn sử dụng thiết bị an toàn phù hợp cho trẻ em.', '1. tuân thủ và duy trì các điều kiện kinh doanh đối với xe buýt trong quá trình hoạt động kinh doanh vận tải hành khách công cộng bằng xe buýt. 2. trên xe phải trang bị dụng cụ thoát hiểm; việc đảm bảo điều kiện an toàn về phòng cháy và chữa cháy thực hiện theo quy định tại khoản 4 điều 8 thông tư này. 3. niêm yết thông tin a) niêm yết bên ngoài xe phía trên kính trước và sau xe: số hiệu tuyến hoặc mã số tuyến, điểm đầu, điểm cuối của tuyến; chiều cao chữ tối thiểu 06 cm; hai bên thành xe: số hiệu tuyến hoặc mã số tuyến, số điện thoại của đơn vị kinh doanh vận tải với kích thước tối thiểu: chiều dài là 20 cm, chiều rộng là 20 cm; giá vé (giá cước) đã kê khai theo mẫu quy định tại phụ lục iii ban hành kèm theo thông tư này; b) niêm yết bên trong xe: biển số đăng ký xe (biển kiểm soát xe), số hiệu tuyến hoặc mã số tuyến; sơ đồ vị trí điểm đầu, điểm cuối và các điểm dừng dọc tuyến; giá vé (giá cước) đã kê khai theo mẫu quy định tại phụ lục iii ban hành kèm theo thông tư này; số điện thoại đường dây nóng của đơn vị kinh doanh vận tải và sở giao thông vận tải địa phương; trách nhiệm của người lái xe, nhân viên phục vụ trên xe và hành khách; c) bên trong xe có bảng hướng dẫn về an toàn giao thông và thoát hiểm ở vị trí hành khách dễ quan sát, các nội dung chính gồm: hướng dẫn cài dây an toàn (nếu có); hướng dẫn sắp xếp hành lý; biển cấm hút thuốc trên xe; hướng dẫn sử dụng hệ thống điện trên xe (nếu có); hướng dẫn cách sử dụng bình cứu hỏa, búa thoát hiểm và hướng thoát hiểm khi xảy ra sự cố.', '1. tuân thủ và duy trì các điều kiện kinh doanh đối với xe taxi trong quá trình hoạt động kinh doanh vận tải hành khách bằng xe taxi. 2. thực hiện niêm yết thông tin như sau: a) hai bên cánh cửa xe: tên, số điện thoại và biểu trưng (logo) của đơn vị kinh doanh vận tải với kích thước tối thiểu: chiều dài là 20 cm, chiều rộng là 20 cm; bảng giá cước đã kê khai theo mẫu quy định tại phụ lục iii ban hành kèm theo thông tư này; b) trong xe: bảng giá cước tính tiền theo kilômét (km), giá cước tính tiền cho thời gian xe phải chờ đợi theo yêu cầu của hành khách và các chi phí khác (nếu có) mà hành khách phải trả; bảng giá cước đã kê khai theo mẫu quy định tại phụ lục iii ban hành kèm theo thông tư này; c) trường hợp xe taxi sử dụng phần mềm tính tiền phải hiển thị trên giao diện dành cho hành khách bảng giá cước đã kê khai theo mẫu quy định tại phụ lục iii ban hành kèm theo thông tư này. 3. việc đảm bảo điều kiện an toàn về phòng cháy và chữa cháy thực hiện theo quy định tại khoản 4 điều 8 thông tư này. 4. trong xe phải có bảng hướng dẫn về an toàn giao thông và thoát hiểm cho hành khách, các nội dung chính gồm: hướng dẫn cài dây an toàn (nếu có); bảng cấm hút thuốc trên xe; hướng dẫn đóng, mở cửa xe đảm bảo an toàn.']","**Nguồn văn bản:** 36_2024_QH15_444251

**Tên văn bản:** Luật Trật tự, an toàn giao thông đường bộ

**Điều 10:** quy tắc chung

**Nội dung:**

2. Người lái xe và người được chở trên xe ô tô phải thắt dây đai an toàn tại những chỗ có trang bị dây đai an toàn khi tham gia giao thông đường bộ.

3. Khi chở trẻ em dưới 10 tuổi và chiều cao dưới 1,35 mét trên xe ô tô không được cho trẻ em ngồi cùng hàng ghế với người lái xe, trừ loại xe ô tô chỉ có một hàng ghế; người lái xe phải sử dụng, hướng dẫn sử dụng thiết bị an toàn phù hợp cho trẻ em.


**Nguồn văn bản:** 158_2024_ND-CP_636875

**Tên văn bản:** Nghị định Quy định về hoạt động vận tải đường bộ

**Điều 24:** quy định đối với vận tải người nội bộ bằng xe ô tô

**Nội dung:**

1. Xe ô tô vận tải người nội bộ:

    a) Sử dụng xe ô tô phải đáp ứng các điều kiện tham gia giao thông theo quy định; phải có dây an toàn tại các vị trí ghế ngồi, có hướng dẫn về an toàn giao thông và thoát hiểm khi xảy ra sự cố trên xe.

3. Người lái xe ô tô hoạt động vận tải nội bộ:

    a) Có trách nhiệm kiểm tra các điều kiện bảo đảm an toàn của xe, hướng dẫn cho người ngồi trên xe về an toàn giao thông và thoát hiểm khi gặp sự cố, yêu cầu người ngồi trên xe thắt dây an toàn trước khi cho xe khởi hành; kiểm tra việc sắp xếp, chằng buộc hành lý bảo đảm an toàn.


**Nguồn văn bản:** 36_2024_TT-BGTVT_633950

**Tên văn bản:** Thông tư Quy định về tổ chức, quản lý hoạt động vận tải bằng xe ô tô và hoạt động của bến xe, bãi đỗ xe, trạm dừng nghỉ, điểm dừng xe trên đường bộ; quy định trình tự, thủ tục đưa bến xe, trạm dừng nghỉ vào khai thác

**Điều 17:** quy định đối với xe buýt

**Nội dung:**

c) Bên trong xe có bảng hướng dẫn về an toàn giao thông và thoát hiểm ở vị trí hành khách dễ quan sát, các nội dung chính gồm: hướng dẫn cài dây an toàn (nếu có); hướng dẫn sắp xếp hành lý; biển cấm hút thuốc trên xe; hướng dẫn sử dụng hệ thống điện trên xe (nếu có); hướng dẫn cách sử dụng bình cứu hỏa, búa thoát hiểm và hướng thoát hiểm khi xảy ra sự cố.


**Nguồn văn bản:** 36_2024_TT-BGTVT_633950

**Tên văn bản:** Thông tư Quy định về tổ chức, quản lý hoạt động vận tải bằng xe ô tô và hoạt động của bến xe, bãi đỗ xe, trạm dừng nghỉ, điểm dừng xe trên đường bộ; quy định trình tự, thủ tục đưa bến xe, trạm dừng nghỉ vào khai thác

**Điều 25:** quy định đối với xe taxi

**Nội dung:**

4. Trong xe phải có bảng hướng dẫn về an toàn giao thông và thoát hiểm cho hành khách, các nội dung chính gồm: hướng dẫn cài dây an toàn (nếu có); bảng cấm hút thuốc trên xe; hướng dẫn đóng, mở cửa xe đảm bảo an toàn.

Tóm lại:  Luật quy định người lái xe và hành khách trên ô tô phải thắt dây an toàn nếu xe được trang bị.  Các văn bản khác nhấn mạnh trách nhiệm của người lái xe trong việc hướng dẫn và đảm bảo hành khách thắt dây an toàn, cũng như trang bị hướng dẫn sử dụng dây an toàn trên xe.
","Bắt buộc tất cả hành khách trên ô tô phải thắt dây an toàn, kể cả người ngồi ở hàng ghế sau.",1.0,0.4532400208450611,0.0,0.0
