,user_input,retrieved_contexts,response,reference,faithfulness,answer_relevancy,context_recall,context_precision
0,Luật Giao thông Đường bộ 2025 có những thay đổi gì về phân hạng giấy phép lái xe?,"['1. giấy phép lái xe quân sự, được phân hạng theo quy định của luật trật tự, an toàn giao thông đường bộ, đồng thời phù hợp với đặc thù quân sự của phương tiện cơ giới đường bộ thuộc phạm vi quản lý của bộ quốc phòng. giấy phép lái xe quân sự, gồm: a) hạng a1 cấp cho người điều khiển xe mô tô hai bánh có dung tích xi-lanh đến 125 cm3 hoặc có công suất động cơ điện đến 11 kw; b) hạng a cấp cho người điều khiển xe mô tô hai bánh có dung tích xi-lanh trên 125 cm3 hoặc có công suất động cơ điện trên 11kw và các loại xe quy định cho giấy phép lái xe quân sự hạng a1; c) hạng b1 cấp cho người điều khiển xe mô tô ba bánh và các loại xe quy định cho giấy phép lái xe quân sự hạng a1; d) hạng b cấp cho người điều khiển các loại xe ô tô chở người đến 08 chỗ ngồi (không kể chỗ của người lái xe); xe ô tô tải và ô tô chuyên dùng có khối lượng toàn bộ theo thiết kế đến 3.500 kg; các loại xe ô tô quy định cho giấy phép lái xe hạng b có kéo rơ moóc hoặc vũ khí, khí tài quân sự dạng rơ moóc có khối lượng toàn bộ theo thiết kế đến 750 kg; đ) hạng c1 cấp cho người điều khiển các loại xe ô tô vận tải và ô tô chuyên dùng có khối lượng toàn bộ theo thiết kế trên 3.500 kg đến 7.500 kg; các loại xe ô tô quy định cho giấy phép lái xe hạng c1 kéo rơ moóc hoặc vũ khí, khí tài quân sự dạng rơ moóc có khối lượng toàn bộ theo thiết kế đến 750 kg; các loại xe quy định cho giấy phép lái xe quân sự hạng b; e) hạng c cấp cho người điều khiển các loại xe ô tô tải và ô tô chuyên dùng có khối lượng toàn bộ theo thiết kế trên 7.500 kg; các loại xe ô tô tải quy định cho giấy phép lái xe hạng c kéo rơ moóc hoặc vũ khí, khí tài quân sự dạng rơ moóc có khối lượng toàn bộ theo thiết kế đến 750 kg; các loại xe quy định cho giấy phép lái xe quân sự hạng b và hạng c1; g) hạng d1 cấp cho người điều khiển xe ô tô chở người trên 8 chỗ (không kể chỗ của người lái xe) đến 16 chỗ (không kể chỗ của người lái xe); các loại xe ô tô chở người quy định cho giấy phép lái xe hạng d1 kéo rơ moóc hoặc vũ khí, khí tài quân sự dạng rơ moóc có khối lượng toàn bộ theo thiết kế đến 750 kg; các loại xe quy định cho giấy phép lái xe quân sự hạng b, c1, c; h) hạng d2 cấp cho người điều khiển xe ô tô chở người từ trên 16 đến 29 chỗ (không kể chỗ của người lái xe); các loại xe ô tô chở người quy định cho giấy phép lái xe hạng d2 kéo rơ moóc hoặc vũ khí, khí tài quân sự dạng rơ moóc có khối lượng toàn bộ theo thiết kế đến 750 kg; các loại xe quy định cho giấy phép lái xe quân sự hạng b, c1, c, d1; i) hạng d cấp cho người điều khiển xe ô tô chở người từ trên 29 chỗ (không kể chỗ của người lái xe); các loại xe ô tô chở người quy định cho giấy phép lái xe hạng d kéo rơ moóc hoặc vũ khí, khí tài quân sự dạng rơ moóc có khối lượng toàn bộ theo thiết kế đến 750 kg; các loại xe quy định cho giấy phép lái xe quân sự hạng b, c1, c, d1, d2; k) hạng c1e cấp cho người điều khiển các loại xe ô tô quy định cho giấy phép lái xe hạng c1 kéo rơ moóc hoặc vũ khí, khí tài quân sự dạng rơ moóc có khối lượng toàn bộ theo thiết kế trên 750 kg; l) hạng ce cấp cho người điều khiển các loại xe ô tô quy định cho giấy phép lái xe hạng c kéo rơ moóc hoặc vũ khí, khí tài quân sự dạng rơ moóc có khối lượng toàn bộ theo thiết kế trên 750 kg; xe ô tô đầu kéo kéo sơ mi rơ moóc hoặc khí tài quân sự dạng sơ mi rơ moóc; m) hạng cx cấp cho người đã có giấy phép lái xe quân sự hạng c để điều khiển xe xích kéo vũ khí, khí tài quân sự. 2. người điều khiển xe chở hàng bốn bánh có gắn động cơ, xe chở người bốn bánh có gắn động cơ phải sử dụng giấy phép lái xe có hạng phù hợp với xe ô tô tải và ô tô chở người tương ứng. 3. người điều khiển xe ô tô có thiết kế, cải tạo với số chỗ ngồi ít hơn ô tô cùng loại, kích thước giới hạn tương đương phải sử dụng giấy phép lái xe có hạng phù hợp với ô tô cùng loại, kích thước giới hạn tương đương và có số chỗ ngồi nhiều nhất.']","**Nguồn văn bản:** 68_2024_TT-BQP_628772

**Tên văn bản:** Thông tư Quy định về đào tạo, sát hạch, cấp giấy phép lái xe quân sự; bồi dưỡng kiến thức pháp luật về giao thông đường bộ cho người điều khiển xe máy chuyên dùng thuộc phạm vi quản lý của bộ quốc phòng

**Điều 5:** giấy phép lái xe quân sự

**Nội dung:**

1. Giấy phép lái xe quân sự, được phân hạng theo quy định của Luật Trật tự, An toàn giao thông đường bộ, đồng thời phù hợp với đặc thù quân sự của phương tiện cơ giới đường bộ thuộc phạm vi quản lý của Bộ Quốc phòng. Giấy phép lái xe quân sự, gồm:

	a) Hạng A1 cấp cho người điều khiển xe mô tô hai bánh có dung tích xi-lanh đến 125 cm3 hoặc có công suất động cơ điện đến 11 kW.

	b) Hạng A cấp cho người điều khiển xe mô tô hai bánh có dung tích xi-lanh trên 125 cm3 hoặc có công suất động cơ điện trên 11kW và các loại xe quy định cho giấy phép lái xe quân sự hạng A1.

	c) Hạng B1 cấp cho người điều khiển xe mô tô ba bánh và các loại xe quy định cho giấy phép lái xe quân sự hạng A1.

	d) Hạng B cấp cho người điều khiển các loại xe ô tô chở người đến 08 chỗ ngồi (không kể chỗ của người lái xe); xe ô tô tải và ô tô chuyên dùng có khối lượng toàn bộ theo thiết kế đến 3.500 kg; các loại xe ô tô quy định cho giấy phép lái xe hạng B có kéo rơ moóc hoặc vũ khí, khí tài quân sự dạng rơ moóc có khối lượng toàn bộ theo thiết kế đến 750 kg.

	đ) Hạng C1 cấp cho người điều khiển các loại xe ô tô vận tải và ô tô chuyên dùng có khối lượng toàn bộ theo thiết kế trên 3.500 kg đến 7.500 kg; các loại xe ô tô quy định cho giấy phép lái xe hạng C1 kéo rơ moóc hoặc vũ khí, khí tài quân sự dạng rơ moóc có khối lượng toàn bộ theo thiết kế đến 750 kg; các loại xe quy định cho giấy phép lái xe quân sự hạng B.

	e) Hạng C cấp cho người điều khiển các loại xe ô tô tải và ô tô chuyên dùng có khối lượng toàn bộ theo thiết kế trên 7.500 kg; các loại xe ô tô tải quy định cho giấy phép lái xe hạng C kéo rơ moóc hoặc vũ khí, khí tài quân sự dạng rơ moóc có khối lượng toàn bộ theo thiết kế đến 750 kg; các loại xe quy định cho giấy phép lái xe quân sự hạng B và hạng C1.

	g) Hạng D1 cấp cho người điều khiển xe ô tô chở người trên 8 chỗ (không kể chỗ của người lái xe) đến 16 chỗ (không kể chỗ của người lái xe); các loại xe ô tô chở người quy định cho giấy phép lái xe hạng D1 kéo rơ moóc hoặc vũ khí, khí tài quân sự dạng rơ moóc có khối lượng toàn bộ theo thiết kế đến 750 kg; các loại xe quy định cho giấy phép lái xe quân sự hạng B, C1, C.

	h) Hạng D2 cấp cho người điều khiển xe ô tô chở người từ trên 16 đến 29 chỗ (không kể chỗ của người lái xe); các loại xe ô tô chở người quy định cho giấy phép lái xe hạng D2 kéo rơ moóc hoặc vũ khí, khí tài quân sự dạng rơ moóc có khối lượng toàn bộ theo thiết kế đến 750 kg; các loại xe quy định cho giấy phép lái xe quân sự hạng B, C1, C, D1.

	i) Hạng D cấp cho người điều khiển xe ô tô chở người từ trên 29 chỗ (không kể chỗ của người lái xe); các loại xe ô tô chở người quy định cho giấy phép lái xe hạng D kéo rơ moóc hoặc vũ khí, khí tài quân sự dạng rơ moóc có khối lượng toàn bộ theo thiết kế đến 750 kg; các loại xe quy định cho giấy phép lái xe quân sự hạng B, C1, C, D1, D2.

	k) Hạng C1E cấp cho người điều khiển các loại xe ô tô quy định cho giấy phép lái xe hạng C1 kéo rơ moóc hoặc vũ khí, khí tài quân sự dạng rơ moóc có khối lượng toàn bộ theo thiết kế trên 750 kg.

	l) Hạng CE cấp cho người điều khiển các loại xe ô tô quy định cho giấy phép lái xe hạng C kéo rơ moóc hoặc vũ khí, khí tài quân sự dạng rơ moóc có khối lượng toàn bộ theo thiết kế trên 750 kg; xe ô tô đầu kéo kéo sơ mi rơ moóc hoặc khí tài quân sự dạng sơ mi rơ moóc.

	m) Hạng CX cấp cho người đã có giấy phép lái xe quân sự hạng C để điều khiển xe xích kéo vũ khí, khí tài quân sự.

2. Người điều khiển xe chở hàng bốn bánh có gắn động cơ, xe chở người bốn bánh có gắn động cơ phải sử dụng giấy phép lái xe có hạng phù hợp với xe ô tô tải và ô tô chở người tương ứng.

3. Người điều khiển xe ô tô có thiết kế, cải tạo với số chỗ ngồi ít hơn ô tô cùng loại, kích thước giới hạn tương đương phải sử dụng giấy phép lái xe có hạng phù hợp với ô tô cùng loại, kích thước giới hạn tương đương và có số chỗ ngồi nhiều nhất.


**Tóm lại:** Giấy phép lái xe quân sự được phân hạng từ A1, A, B1, B, C1, C, D1, D2, D, C1E, CE, CX  tương ứng với các loại xe và khối lượng chuyên chở được quy định rõ ràng, đồng thời tuân thủ Luật Giao thông Đường bộ và các quy định quân sự đặc thù.
","Từ năm 2025, hệ thống phân hạng giấy phép lái xe được mở rộng lên 15 hạng: A1, A, B1, B, C1, C, D1, D2, D, BE, C1E, CE, D1E, D2E, DE.",1.0,0.49483922738141617,0.0,0.0
1,Giấy phép lái xe hạng A1 mới cấp cho loại xe nào?,"['1. giấy phép lái xe được cấp trước ngày luật này có hiệu lực thi hành được tiếp tục sử dụng theo thời hạn ghi trên giấy phép lái xe. 2. giấy phép lái xe được cấp trước ngày luật này có hiệu lực thi hành nếu chưa thực hiện đổi, cấp lại theo quy định của luật này có hiệu lực sử dụng như sau: a) giấy phép lái xe hạng a1 được tiếp tục điều khiển xe mô tô hai bánh có dung tích xi-lanh từ 50 cm3\xa0đến dưới 175 cm3 hoặc có công suất động cơ điện từ 04 kw đến dưới 14 kw; b) giấy phép lái xe hạng a2 được tiếp tục điều khiển xe mô tô hai bánh có dung tích xi-lanh từ 175 cm3\xa0trở lên hoặc có công suất động cơ điện từ 14 kw trở lên và các loại xe quy định cho giấy phép lái xe hạng a1 quy định tại điểm a khoản này; c) giấy phép lái xe hạng a3 được tiếp tục điều khiển xe mô tô ba bánh, các loại xe quy định cho giấy phép lái xe hạng a1 quy định tại điểm a khoản này và các xe tương tự; d) giấy phép lái xe hạng a4 được tiếp tục điều khiển máy kéo có trọng tải đến 1.000 kg; đ) giấy phép lái xe hạng b1 số tự động cấp cho người không hành nghề lái xe được tiếp tục điều khiển xe ô tô số tự động chở người đến 08 chỗ (không kể chỗ của người lái xe); xe ô tô tải, kể cả ô tô tải chuyên dùng số tự động có trọng tải dưới 3.500 kg; e) giấy phép lái xe hạng b1 cấp cho người không hành nghề lái xe được tiếp tục điều khiển xe ô tô chở người đến 08 chỗ (không kể chỗ của người lái xe); xe ô tô tải, máy kéo có trọng tải dưới 3.500 kg; g) giấy phép lái xe hạng b2 cấp cho người hành nghề lái xe được tiếp tục điều khiển xe ô tô chở người đến 08 chỗ (không kể chỗ của người lái xe); xe ô tô tải, máy kéo có trọng tải dưới 3.500 kg; h) giấy phép lái xe hạng c được tiếp tục điều khiển xe ô tô tải, máy kéo có trọng tải từ 3.500 kg trở lên và các loại xe quy định cho các giấy phép lái xe hạng b1, b2 quy định tại các điểm đ, e và g khoản này; i) giấy phép lái xe hạng d được tiếp tục điều khiển xe ô tô chở người từ 09 chỗ (không kể chỗ của người lái xe) đến 29 chỗ (không kể chỗ của người lái xe) và các loại xe quy định cho các giấy phép lái xe hạng b1, b2, c quy định tại các điểm đ, e, g và h khoản này; k) giấy phép lái xe hạng e được tiếp tục điều khiển xe ô tô chở người trên 29 chỗ (không kể chỗ của người lái xe) và các loại xe quy định cho các giấy phép lái xe hạng b1, b2, c, d quy định tại các điểm đ, e, g, h và i khoản này; l) giấy phép lái xe hạng fb2, fd được tiếp tục điều khiển các loại xe quy định cho giấy phép lái xe hạng b2, d quy định tại điểm g và điểm i khoản này khi kéo rơ moóc; giấy phép lái xe hạng fc được tiếp tục điều khiển các loại xe quy định cho giấy phép lái xe hạng c quy định tại điểm h khoản này khi kéo rơ moóc, đầu kéo kéo sơ mi rơ moóc; giấy phép lái xe hạng fe được tiếp tục điều khiển các loại xe quy định cho giấy phép lái xe hạng e quy định tại điểm k khoản này khi kéo rơ moóc\xa0hoặc xe ô tô chở khách nối toa. 3. trường hợp người có giấy phép lái xe đã được cấp trước ngày luật này có hiệu lực thi hành có nhu cầu đổi, cấp lại giấy phép lái xe thì thực hiện như sau: a) giấy phép lái xe hạng a1 được đổi, cấp lại sang giấy phép lái xe hạng a với điều kiện hạn chế là chỉ được điều khiển xe mô tô hai bánh có dung tích xi-lanh đến dưới 175 cm3 hoặc có công suất động cơ điện đến dưới 14 kw; b) giấy phép lái xe hạng a2 được đổi, cấp lại sang giấy phép lái xe hạng a; c) giấy phép lái xe hạng a3 được đổi, cấp lại sang giấy phép lái xe hạng b1; d) giấy phép lái xe hạng a4 được đổi, cấp lại sang chứng chỉ điều khiển xe máy chuyên dùng cho người điều khiển máy kéo có trọng tải đến 1.000 kg và chứng chỉ bồi dưỡng kiến thức pháp luật về giao thông đường bộ cho người điều khiển xe máy chuyên dùng; đ) giấy phép lái xe hạng b1 số tự động được đổi, cấp lại sang giấy phép lái xe hạng b với điều kiện hạn chế là chỉ được điều khiển xe ô tô số tự động; e) giấy phép lái xe hạng b1, b2 được đổi, cấp lại sang giấy phép lái xe hạng b hoặc hạng c1 và chứng chỉ điều khiển xe máy chuyên dùng cho người điều khiển máy kéo có trọng tải đến 3.500 kg; g) giấy phép lái xe hạng c giữ nguyên và đổi, cấp lại cùng hạng và chứng chỉ điều khiển xe máy chuyên dùng cho người điều khiển máy kéo có trọng tải trên 3.500 kg; h) giấy phép lái xe hạng d được đổi, cấp lại sang giấy phép lái xe hạng d2 và chứng chỉ điều khiển xe máy chuyên dùng cho người điều khiển máy kéo có trọng tải trên 3.500 kg; i) giấy phép lái xe hạng e được đổi, cấp lại sang giấy phép lái xe hạng d và chứng chỉ điều khiển xe máy chuyên dùng cho người điều khiển máy kéo có trọng tải trên 3.500 kg; k) giấy phép lái xe hạng fb2 được đổi, cấp lại sang giấy phép lái xe hạng be hoặc hạng c1e và chứng chỉ điều khiển xe máy chuyên dùng cho người điều khiển máy kéo có trọng tải đến 3.500 kg; l) giấy phép lái xe hạng fc được đổi, cấp lại sang giấy phép lái xe hạng ce và chứng chỉ điều khiển xe máy chuyên dùng cho người điều khiển máy kéo có trọng tải trên 3.500 kg; m) giấy phép lái xe hạng fd được đổi, cấp lại sang giấy phép lái xe hạng d2e và chứng chỉ điều khiển xe máy chuyên dùng cho người điều khiển máy kéo có trọng tải trên 3.500 kg; n) giấy phép lái xe hạng fe được đổi, cấp lại sang giấy phép lái xe hạng de và chứng chỉ điều khiển xe máy chuyên dùng cho người điều khiển máy kéo có trọng tải trên 3.500 kg. 4. người học lái xe đã được đào tạo lái xe trước ngày luật này có hiệu lực thi hành hoặc đang được đào tạo lái xe tại ngày luật này có hiệu lực thi hành chưa được sát hạch, cấp giấy phép lái xe thì được sát hạch, cấp giấy phép lái xe theo hạng giấy phép lái xe đổi, cấp lại quy định tại khoản 3 điều này. 5. chứng nhận đăng ký xe, biển số xe máy chuyên dùng cấp trước ngày luật này có hiệu lực thi hành vẫn có giá trị sử dụng. 6. chứng nhận chất lượng an toàn kỹ thuật và bảo vệ môi trường được cấp trước ngày luật này có hiệu lực thi hành thì có giá trị sử dụng đến hết thời hạn ghi trên giấy chứng nhận đó. 7. việc đấu giá biển số xe ô tô được thực hiện trước ngày luật này có hiệu lực thi hành và đến ngày luật này có hiệu lực thi hành đã được cấp văn bản xác nhận biển số xe ô tô trúng đấu giá thì tiếp tục thực hiện theo nghị quyết số 73/2022/qh15 của quốc hội về thí điểm đấu giá biển số xe ô tô; trường hợp chưa được cấp xác nhận biển số xe ô tô trúng đấu giá thì tiếp tục thực hiện theo nghị quyết số 73/2022/qh15 của quốc hội về thí điểm đấu giá biển số xe ô tô và quy định tại điểm d khoản 1 điều 38 của luật này./. luật này được quốc hội nước cộng hòa xã hội chủ nghĩa việt nam khóa xv, kỳ họp thứ 7 thông qua ngày 27 tháng 6 năm 2024.']","**Nguồn văn bản:** 36_2024_QH15_444251

**Tên văn bản:** Luật Trật tự, an toàn giao thông đường bộ

**Điều 89:** quy định chuyển tiếp

**Nội dung:**

1. Giấy phép lái xe được cấp trước ngày luật này có hiệu lực thi hành được tiếp tục sử dụng theo thời hạn ghi trên giấy phép lái xe.

2. Giấy phép lái xe được cấp trước ngày luật này có hiệu lực thi hành nếu chưa thực hiện đổi, cấp lại theo quy định của luật này có hiệu lực sử dụng như sau:

	a) Giấy phép lái xe hạng A1 được tiếp tục điều khiển xe mô tô hai bánh có dung tích xi-lanh từ 50 cm3 đến dưới 175 cm3 hoặc có công suất động cơ điện từ 04 kw đến dưới 14 kw.

	b) Giấy phép lái xe hạng A2 được tiếp tục điều khiển xe mô tô hai bánh có dung tích xi-lanh từ 175 cm3 trở lên hoặc có công suất động cơ điện từ 14 kw trở lên và các loại xe quy định cho giấy phép lái xe hạng A1 quy định tại điểm a khoản này.

	c) Giấy phép lái xe hạng A3 được tiếp tục điều khiển xe mô tô ba bánh, các loại xe quy định cho giấy phép lái xe hạng A1 quy định tại điểm a khoản này và các xe tương tự.
    
    d) Giấy phép lái xe hạng A4 được tiếp tục điều khiển máy kéo có trọng tải đến 1.000 kg.

    đ) Giấy phép lái xe hạng B1 số tự động cấp cho người không hành nghề lái xe được tiếp tục điều khiển xe ô tô số tự động chở người đến 08 chỗ (không kể chỗ của người lái xe); xe ô tô tải, kể cả ô tô tải chuyên dùng số tự động có trọng tải dưới 3.500 kg.

    e) Giấy phép lái xe hạng B1 cấp cho người không hành nghề lái xe được tiếp tục điều khiển xe ô tô chở người đến 08 chỗ (không kể chỗ của người lái xe); xe ô tô tải, máy kéo có trọng tải dưới 3.500 kg.

    g) Giấy phép lái xe hạng B2 cấp cho người hành nghề lái xe được tiếp tục điều khiển xe ô tô chở người đến 08 chỗ (không kể chỗ của người lái xe); xe ô tô tải, máy kéo có trọng tải dưới 3.500 kg.

    h) Giấy phép lái xe hạng C được tiếp tục điều khiển xe ô tô tải, máy kéo có trọng tải từ 3.500 kg trở lên và các loại xe quy định cho các giấy phép lái xe hạng B1, B2 quy định tại các điểm đ, e và g khoản này.

    i) Giấy phép lái xe hạng D được tiếp tục điều khiển xe ô tô chở người từ 09 chỗ (không kể chỗ của người lái xe) đến 29 chỗ (không kể chỗ của người lái xe) và các loại xe quy định cho các giấy phép lái xe hạng B1, B2, C quy định tại các điểm đ, e, g và h khoản này.

    k) Giấy phép lái xe hạng E được tiếp tục điều khiển xe ô tô chở người trên 29 chỗ (không kể chỗ của người lái xe) và các loại xe quy định cho các giấy phép lái xe hạng B1, B2, C, D quy định tại các điểm đ, e, g, h và i khoản này.

    l) Giấy phép lái xe hạng FB2, FD được tiếp tục điều khiển các loại xe quy định cho giấy phép lái xe hạng B2, D quy định tại điểm g và điểm i khoản này khi kéo rơ moóc; giấy phép lái xe hạng FC được tiếp tục điều khiển các loại xe quy định cho giấy phép lái xe hạng C quy định tại điểm h khoản này khi kéo rơ moóc, đầu kéo kéo sơ mi rơ moóc; giấy phép lái xe hạng FE được tiếp tục điều khiển các loại xe quy định cho giấy phép lái xe hạng E quy định tại điểm k khoản này khi kéo rơ moóc hoặc xe ô tô chở khách nối toa.


3. Trường hợp người có giấy phép lái xe đã được cấp trước ngày luật này có hiệu lực thi hành có nhu cầu đổi, cấp lại giấy phép lái xe thì thực hiện như sau:
    ....

4. Người học lái xe đã được đào tạo lái xe trước ngày luật này có hiệu lực thi hành hoặc đang được đào tạo lái xe tại ngày luật này có hiệu lực thi hành chưa được sát hạch, cấp giấy phép lái xe thì được sát hạch, cấp giấy phép lái xe theo hạng giấy phép lái xe đổi, cấp lại quy định tại khoản 3 điều này.

5. Chứng nhận đăng ký xe, biển số xe máy chuyên dùng cấp trước ngày luật này có hiệu lực thi hành vẫn có giá trị sử dụng.

6. Chứng nhận chất lượng an toàn kỹ thuật và bảo vệ môi trường được cấp trước ngày luật này có hiệu lực thi hành thì có giá trị sử dụng đến hết thời hạn ghi trên giấy chứng nhận đó.

7. Việc đấu giá biển số xe ô tô được thực hiện trước ngày luật này có hiệu lực thi hành và đến ngày luật này có hiệu lực thi hành đã được cấp văn bản xác nhận biển số xe ô tô trúng đấu giá thì tiếp tục thực hiện theo Nghị quyết số 73/2022/QH15 của Quốc hội về thí điểm đấu giá biển số xe ô tô; trường hợp chưa được cấp xác nhận biển số xe ô tô trúng đấu giá thì tiếp tục thực hiện theo Nghị quyết số 73/2022/QH15 của Quốc hội về thí điểm đấu giá biển số xe ô tô và quy định tại điểm d khoản 1 Điều 38 của luật này.


**Tóm lại:** Giấy phép lái xe hạng A1 được cấp cho người điều khiển xe mô tô hai bánh có dung tích xi lanh từ 50 cm3 đến dưới 175 cm3 hoặc có công suất động cơ điện từ 4 kW đến dưới 14 kW.
",Hạng A1 mới cấp cho người lái xe mô tô từ trên 50 phân khối đến 125 phân khối.,0.0,0.6074625528449488,0.0,0.0
2,Thời hạn của giấy phép lái xe hạng B theo Luật Giao thông Đường bộ 2025 là bao lâu?,"['1. là công dân việt nam, người nước ngoài được phép cư trú hoặc đang làm việc, học tập tại việt nam. 2. người học lái xe để nâng hạng giấy phép lái xe phải đáp ứng theo quy định tại khoản 4 điều 60 luật trật tự, an toàn giao thông đường bộ; trong đó, thời gian lái xe an toàn cho từng hạng giấy phép lái xe được quy định cụ thể như sau: a) hạng b lên c1, b lên c, b lên d1, b lên be, c1 lên c, c1 lên d1, c1 lên d2, c1 lên c1e, c lên d1, c lên d2, d1 lên d2, d1 lên d, d1 lên d1e, d2 lên d, d2 lên d2e, d lên de: thời gian lái xe an toàn từ 02 năm trở lên; b) hạng b lên d2, c lên ce, c lên d: thời gian lái xe an toàn từ 03 năm trở lên. 3. người đã có giấy phép lái xe hạng b số tự động được đăng ký học để cấp mới giấy phép lái xe hạng b số cơ khí (số sàn), người đã có giấy phép lái xe hạng b được đăng ký học để cấp mới giấy phép lái xe hạng c1 và phải học đủ nội dung chương trình đào tạo lái xe theo quy định, hồ sơ của người học lái xe thực hiện theo quy định tại khoản 1 điều 15 thông tư này; trường hợp đạt kết quả sát hạch, cơ quan tổ chức sát hạch có văn bản đề nghị cơ quan đã cấp giấy phép xe cắt góc giấy phép lái xe cũ và có văn bản đề nghị cục đường bộ việt nam xóa số quản lý giấy phép lái xe đã cấp.']","Không tìm thấy thông tin liên quan tới câu hỏi này.
",Giấy phép lái xe hạng B có thời hạn 10 năm kể từ ngày cấp.,0.0,-0.0,0.0,0.0
3,Giấy phép lái xe hạng C1 có thời hạn bao lâu?,"['1. mẫu giấy phép lái xe quân sự a) giấy phép lái xe quân sự thực hiện theo quy định tại mẫu số 08 kèm theo thông tư này; b) cục trưởng cục xe máy - vận tải/tổng cục hậu cần - kỹ thuật có trách nhiệm quản lý việc sử dụng giấy phép lái xe quân sự thuộc phạm vi quản lý của bộ quốc phòng. 2. thời hạn sử dụng giấy phép lái xe quân sự a) giấy phép lái xe quân sự hạng a1, a, b1 là không thời hạn; b) giấy phép lái xe quân sự các hạng b, c1, c, d1, d2, d, c1e, ce, cx có thời hạn 05 năm kể từ ngày cấp; c) trường hợp cấp, đổi do lý do khác thời hạn theo thời hạn ghi trên giấy phép lái xe quân sự. 3. giấy phép lái xe quân sự không có hiệu lực trong các trường hợp sau: a) giấy phép lái xe quân sự hết thời hạn sử dụng được ghi trên giấy phép lái xe; b) giấy phép lái xe quân sự bị trừ hết điểm theo quy định tại điều 7 của thông tư này; c) giấy phép lái xe quân sự có quyết định thu hồi theo khoản 1 điều 47 thông tư này.']","**Nguồn văn bản:** 68_2024_TT-BQP_628772

**Tên văn bản:** Thông tư Quy định về đào tạo, sát hạch, cấp giấy phép lái xe quân sự; bồi dưỡng kiến thức pháp luật về giao thông đường bộ cho người điều khiển xe máy chuyên dùng thuộc phạm vi quản lý của bộ quốc phòng

**Điều 6:** Mẫu và thời hạn giấy phép lái xe quân sự

**Nội dung:**

1. Mẫu giấy phép lái xe quân sự

	a) Giấy phép lái xe quân sự thực hiện theo quy định tại mẫu số 08 kèm theo thông tư này.

	b) Cục trưởng Cục Xe máy - Vận tải/Tổng cục Hậu cần - Kỹ thuật có trách nhiệm quản lý việc sử dụng giấy phép lái xe quân sự thuộc phạm vi quản lý của Bộ Quốc phòng.

2. Thời hạn sử dụng giấy phép lái xe quân sự

	a) Giấy phép lái xe quân sự hạng A1, A, B1 là không thời hạn.

	b) Giấy phép lái xe quân sự các hạng B, C1, C, D1, D2, D, C1E, CE, CX có thời hạn 05 năm kể từ ngày cấp.

	c) Trường hợp cấp, đổi do lý do khác thời hạn theo thời hạn ghi trên giấy phép lái xe quân sự.

3. Giấy phép lái xe quân sự không có hiệu lực trong các trường hợp sau:

	a) Giấy phép lái xe quân sự hết thời hạn sử dụng được ghi trên giấy phép lái xe.

	b) Giấy phép lái xe quân sự bị trừ hết điểm theo quy định tại Điều 7 của Thông tư này.

	c) Giấy phép lái xe quân sự có quyết định thu hồi theo khoản 1 Điều 47 Thông tư này.


Tóm lại: Thời hạn của giấy phép lái xe quân sự hạng C1 là 05 năm.
",Giấy phép lái xe hạng C1 có thời hạn 10 năm kể từ ngày cấp.,0.75,0.7437359319972937,0.0,0.0
4,Giấy phép lái xe hạng D có thời hạn bao lâu?,"['1. quân nhân, công chức quốc phòng, công nhân viên chức quốc phòng, lao động hợp đồng đang phục vụ trong bộ quốc phòng có đủ các điều kiện: tiêu chuẩn về tuổi đời, thời gian công tác, sức khỏe, trình độ văn hóa, phẩm chất chính trị theo quy định của bộ quốc phòng. đối với lao động hợp đồng: chỉ đào tạo nâng hạng khi có đủ điều kiện, tiêu chuẩn quy định tại khoản 1 điều này. 2. đối với người học nâng hạng giấy phép lái xe quân sự phải có thời gian lái xe và số km lái xe an toàn như sau: a) từ hạng b lên hạng c1; hạng c1 lên hạng c, c1e; hạng c lên hạng d1, ce, cx; hạng d1 lên hạng d2; hạng d2 lên hạng d: có thời gian lái xe 02 năm trở lên và 30.000 km lái xe an toàn trở lên (trừ các trường hợp đào tạo chuyển tiếp từ hạng c lên hạng ce hoặc cx theo chỉ tiêu của bộ tổng tham mưu); b) từ hạng b lên hạng c, d1; hạng c1 lên d1; hạng c lên hạng d2; hạng d1 lên hạng d: có thời gian lái xe 03 năm trở lên và có 50.000 km lái xe an toàn trở lên; c) từ hạng b lên hạng d2, từ hạng c1 lên hạng d2, từ hạng c lên hạng d: có thời gian lái xe 05 năm trở lên và 100.000 km lái xe an toàn trở lên. 3. đối với người học nâng hạng giấy phép lái xe quân sự lên hạng d1, d2, d ngoài các quy định tại các khoản 1, 2 điều này phải có bằng tốt nghiệp trung học cơ sở trở lên.']","**Nguồn văn bản:** 68_2024_TT-BQP_628772

**Tên văn bản:** Thông tư Quy định về đào tạo, sát hạch, cấp giấy phép lái xe quân sự; bồi dưỡng kiến thức pháp luật về giao thông đường bộ cho người điều khiển xe máy chuyên dùng thuộc phạm vi quản lý của bộ quốc phòng

**Điều 9:** Điều kiện đối với người học lái xe quân sự

**Nội dung:**

1. Quân nhân, công chức quốc phòng, công nhân viên chức quốc phòng, lao động hợp đồng đang phục vụ trong Bộ Quốc phòng có đủ các điều kiện: tiêu chuẩn về tuổi đời, thời gian công tác, sức khỏe, trình độ văn hóa, phẩm chất chính trị theo quy định của Bộ Quốc phòng. Đối với lao động hợp đồng: chỉ đào tạo nâng hạng khi có đủ điều kiện, tiêu chuẩn quy định tại khoản 1 điều này.

2. Đối với người học nâng hạng giấy phép lái xe quân sự phải có thời gian lái xe và số km lái xe an toàn như sau:

	a) Từ hạng B lên hạng C1; hạng C1 lên hạng C, C1E; hạng C lên hạng D1, CE, CX; hạng D1 lên hạng D2; hạng D2 lên hạng D: có thời gian lái xe 02 năm trở lên và 30.000 km lái xe an toàn trở lên (trừ các trường hợp đào tạo chuyển tiếp từ hạng C lên hạng CE hoặc CX theo chỉ tiêu của Bộ Tổng Tham mưu).

	b) Từ hạng B lên hạng C, D1; hạng C1 lên D1; hạng C lên hạng D2; hạng D1 lên hạng D: có thời gian lái xe 03 năm trở lên và có 50.000 km lái xe an toàn trở lên.

	c) Từ hạng B lên hạng D2, từ hạng C1 lên hạng D2, từ hạng C lên hạng D: có thời gian lái xe 05 năm trở lên và 100.000 km lái xe an toàn trở lên.

3. Đối với người học nâng hạng giấy phép lái xe quân sự lên hạng D1, D2, D ngoài các quy định tại các khoản 1, 2 điều này phải có bằng tốt nghiệp trung học cơ sở trở lên.


**Tóm lại:**  Văn bản này không đề cập đến thời hạn của giấy phép lái xe hạng D mà chỉ nói về điều kiện nâng hạng giấy phép lái xe quân sự.
",Giấy phép lái xe hạng D có thời hạn 5 năm kể từ ngày cấp.,0.6666666666666666,0.0,0.0,0.0
5,Giấy phép lái xe hạng BE cho phép lái những loại xe nào?,"['1. giấy phép lái xe được cấp trước ngày luật này có hiệu lực thi hành được tiếp tục sử dụng theo thời hạn ghi trên giấy phép lái xe. 2. giấy phép lái xe được cấp trước ngày luật này có hiệu lực thi hành nếu chưa thực hiện đổi, cấp lại theo quy định của luật này có hiệu lực sử dụng như sau: a) giấy phép lái xe hạng a1 được tiếp tục điều khiển xe mô tô hai bánh có dung tích xi-lanh từ 50 cm3\xa0đến dưới 175 cm3 hoặc có công suất động cơ điện từ 04 kw đến dưới 14 kw; b) giấy phép lái xe hạng a2 được tiếp tục điều khiển xe mô tô hai bánh có dung tích xi-lanh từ 175 cm3\xa0trở lên hoặc có công suất động cơ điện từ 14 kw trở lên và các loại xe quy định cho giấy phép lái xe hạng a1 quy định tại điểm a khoản này; c) giấy phép lái xe hạng a3 được tiếp tục điều khiển xe mô tô ba bánh, các loại xe quy định cho giấy phép lái xe hạng a1 quy định tại điểm a khoản này và các xe tương tự; d) giấy phép lái xe hạng a4 được tiếp tục điều khiển máy kéo có trọng tải đến 1.000 kg; đ) giấy phép lái xe hạng b1 số tự động cấp cho người không hành nghề lái xe được tiếp tục điều khiển xe ô tô số tự động chở người đến 08 chỗ (không kể chỗ của người lái xe); xe ô tô tải, kể cả ô tô tải chuyên dùng số tự động có trọng tải dưới 3.500 kg; e) giấy phép lái xe hạng b1 cấp cho người không hành nghề lái xe được tiếp tục điều khiển xe ô tô chở người đến 08 chỗ (không kể chỗ của người lái xe); xe ô tô tải, máy kéo có trọng tải dưới 3.500 kg; g) giấy phép lái xe hạng b2 cấp cho người hành nghề lái xe được tiếp tục điều khiển xe ô tô chở người đến 08 chỗ (không kể chỗ của người lái xe); xe ô tô tải, máy kéo có trọng tải dưới 3.500 kg; h) giấy phép lái xe hạng c được tiếp tục điều khiển xe ô tô tải, máy kéo có trọng tải từ 3.500 kg trở lên và các loại xe quy định cho các giấy phép lái xe hạng b1, b2 quy định tại các điểm đ, e và g khoản này; i) giấy phép lái xe hạng d được tiếp tục điều khiển xe ô tô chở người từ 09 chỗ (không kể chỗ của người lái xe) đến 29 chỗ (không kể chỗ của người lái xe) và các loại xe quy định cho các giấy phép lái xe hạng b1, b2, c quy định tại các điểm đ, e, g và h khoản này; k) giấy phép lái xe hạng e được tiếp tục điều khiển xe ô tô chở người trên 29 chỗ (không kể chỗ của người lái xe) và các loại xe quy định cho các giấy phép lái xe hạng b1, b2, c, d quy định tại các điểm đ, e, g, h và i khoản này; l) giấy phép lái xe hạng fb2, fd được tiếp tục điều khiển các loại xe quy định cho giấy phép lái xe hạng b2, d quy định tại điểm g và điểm i khoản này khi kéo rơ moóc; giấy phép lái xe hạng fc được tiếp tục điều khiển các loại xe quy định cho giấy phép lái xe hạng c quy định tại điểm h khoản này khi kéo rơ moóc, đầu kéo kéo sơ mi rơ moóc; giấy phép lái xe hạng fe được tiếp tục điều khiển các loại xe quy định cho giấy phép lái xe hạng e quy định tại điểm k khoản này khi kéo rơ moóc\xa0hoặc xe ô tô chở khách nối toa. 3. trường hợp người có giấy phép lái xe đã được cấp trước ngày luật này có hiệu lực thi hành có nhu cầu đổi, cấp lại giấy phép lái xe thì thực hiện như sau: a) giấy phép lái xe hạng a1 được đổi, cấp lại sang giấy phép lái xe hạng a với điều kiện hạn chế là chỉ được điều khiển xe mô tô hai bánh có dung tích xi-lanh đến dưới 175 cm3 hoặc có công suất động cơ điện đến dưới 14 kw; b) giấy phép lái xe hạng a2 được đổi, cấp lại sang giấy phép lái xe hạng a; c) giấy phép lái xe hạng a3 được đổi, cấp lại sang giấy phép lái xe hạng b1; d) giấy phép lái xe hạng a4 được đổi, cấp lại sang chứng chỉ điều khiển xe máy chuyên dùng cho người điều khiển máy kéo có trọng tải đến 1.000 kg và chứng chỉ bồi dưỡng kiến thức pháp luật về giao thông đường bộ cho người điều khiển xe máy chuyên dùng; đ) giấy phép lái xe hạng b1 số tự động được đổi, cấp lại sang giấy phép lái xe hạng b với điều kiện hạn chế là chỉ được điều khiển xe ô tô số tự động; e) giấy phép lái xe hạng b1, b2 được đổi, cấp lại sang giấy phép lái xe hạng b hoặc hạng c1 và chứng chỉ điều khiển xe máy chuyên dùng cho người điều khiển máy kéo có trọng tải đến 3.500 kg; g) giấy phép lái xe hạng c giữ nguyên và đổi, cấp lại cùng hạng và chứng chỉ điều khiển xe máy chuyên dùng cho người điều khiển máy kéo có trọng tải trên 3.500 kg; h) giấy phép lái xe hạng d được đổi, cấp lại sang giấy phép lái xe hạng d2 và chứng chỉ điều khiển xe máy chuyên dùng cho người điều khiển máy kéo có trọng tải trên 3.500 kg; i) giấy phép lái xe hạng e được đổi, cấp lại sang giấy phép lái xe hạng d và chứng chỉ điều khiển xe máy chuyên dùng cho người điều khiển máy kéo có trọng tải trên 3.500 kg; k) giấy phép lái xe hạng fb2 được đổi, cấp lại sang giấy phép lái xe hạng be hoặc hạng c1e và chứng chỉ điều khiển xe máy chuyên dùng cho người điều khiển máy kéo có trọng tải đến 3.500 kg; l) giấy phép lái xe hạng fc được đổi, cấp lại sang giấy phép lái xe hạng ce và chứng chỉ điều khiển xe máy chuyên dùng cho người điều khiển máy kéo có trọng tải trên 3.500 kg; m) giấy phép lái xe hạng fd được đổi, cấp lại sang giấy phép lái xe hạng d2e và chứng chỉ điều khiển xe máy chuyên dùng cho người điều khiển máy kéo có trọng tải trên 3.500 kg; n) giấy phép lái xe hạng fe được đổi, cấp lại sang giấy phép lái xe hạng de và chứng chỉ điều khiển xe máy chuyên dùng cho người điều khiển máy kéo có trọng tải trên 3.500 kg. 4. người học lái xe đã được đào tạo lái xe trước ngày luật này có hiệu lực thi hành hoặc đang được đào tạo lái xe tại ngày luật này có hiệu lực thi hành chưa được sát hạch, cấp giấy phép lái xe thì được sát hạch, cấp giấy phép lái xe theo hạng giấy phép lái xe đổi, cấp lại quy định tại khoản 3 điều này. 5. chứng nhận đăng ký xe, biển số xe máy chuyên dùng cấp trước ngày luật này có hiệu lực thi hành vẫn có giá trị sử dụng. 6. chứng nhận chất lượng an toàn kỹ thuật và bảo vệ môi trường được cấp trước ngày luật này có hiệu lực thi hành thì có giá trị sử dụng đến hết thời hạn ghi trên giấy chứng nhận đó. 7. việc đấu giá biển số xe ô tô được thực hiện trước ngày luật này có hiệu lực thi hành và đến ngày luật này có hiệu lực thi hành đã được cấp văn bản xác nhận biển số xe ô tô trúng đấu giá thì tiếp tục thực hiện theo nghị quyết số 73/2022/qh15 của quốc hội về thí điểm đấu giá biển số xe ô tô; trường hợp chưa được cấp xác nhận biển số xe ô tô trúng đấu giá thì tiếp tục thực hiện theo nghị quyết số 73/2022/qh15 của quốc hội về thí điểm đấu giá biển số xe ô tô và quy định tại điểm d khoản 1 điều 38 của luật này./. luật này được quốc hội nước cộng hòa xã hội chủ nghĩa việt nam khóa xv, kỳ họp thứ 7 thông qua ngày 27 tháng 6 năm 2024.']","**Nguồn văn bản:** 36_2024_QH15_444251

**Tên văn bản:** Luật Trật tự, an toàn giao thông đường bộ

**Điều 89:** quy định chuyển tiếp

**Nội dung:**

1. Giấy phép lái xe được cấp trước ngày luật này có hiệu lực thi hành được tiếp tục sử dụng theo thời hạn ghi trên giấy phép lái xe.

2. Giấy phép lái xe được cấp trước ngày luật này có hiệu lực thi hành nếu chưa thực hiện đổi, cấp lại theo quy định của luật này có hiệu lực sử dụng như sau:

	a) Giấy phép lái xe hạng A1 được tiếp tục điều khiển xe mô tô hai bánh có dung tích xi-lanh từ 50 cm3 đến dưới 175 cm3 hoặc có công suất động cơ điện từ 04 kw đến dưới 14 kw.

	b) Giấy phép lái xe hạng A2 được tiếp tục điều khiển xe mô tô hai bánh có dung tích xi-lanh từ 175 cm3 trở lên hoặc có công suất động cơ điện từ 14 kw trở lên và các loại xe quy định cho giấy phép lái xe hạng A1 quy định tại điểm a khoản này.

	c) Giấy phép lái xe hạng A3 được tiếp tục điều khiển xe mô tô ba bánh, các loại xe quy định cho giấy phép lái xe hạng A1 quy định tại điểm a khoản này và các xe tương tự.
    
    d) Giấy phép lái xe hạng A4 được tiếp tục điều khiển máy kéo có trọng tải đến 1.000 kg.

	đ) Giấy phép lái xe hạng B1 số tự động cấp cho người không hành nghề lái xe được tiếp tục điều khiển xe ô tô số tự động chở người đến 08 chỗ (không kể chỗ của người lái xe); xe ô tô tải, kể cả ô tô tải chuyên dùng số tự động có trọng tải dưới 3.500 kg.

	e) Giấy phép lái xe hạng B1 cấp cho người không hành nghề lái xe được tiếp tục điều khiển xe ô tô chở người đến 08 chỗ (không kể chỗ của người lái xe); xe ô tô tải, máy kéo có trọng tải dưới 3.500 kg.

	g) Giấy phép lái xe hạng B2 cấp cho người hành nghề lái xe được tiếp tục điều khiển xe ô tô chở người đến 08 chỗ (không kể chỗ của người lái xe); xe ô tô tải, máy kéo có trọng tải dưới 3.500 kg.

	h) Giấy phép lái xe hạng C được tiếp tục điều khiển xe ô tô tải, máy kéo có trọng tải từ 3.500 kg trở lên và các loại xe quy định cho các giấy phép lái xe hạng B1, B2 quy định tại các điểm đ, e và g khoản này.

	i) Giấy phép lái xe hạng D được tiếp tục điều khiển xe ô tô chở người từ 09 chỗ (không kể chỗ của người lái xe) đến 29 chỗ (không kể chỗ của người lái xe) và các loại xe quy định cho các giấy phép lái xe hạng B1, B2, C quy định tại các điểm đ, e, g và h khoản này.

	k) Giấy phép lái xe hạng E được tiếp tục điều khiển xe ô tô chở người trên 29 chỗ (không kể chỗ của người lái xe) và các loại xe quy định cho các giấy phép lái xe hạng B1, B2, C, D quy định tại các điểm đ, e, g, h và i khoản này.

	l) Giấy phép lái xe hạng FB2, FD được tiếp tục điều khiển các loại xe quy định cho giấy phép lái xe hạng B2, D quy định tại điểm g và điểm i khoản này khi kéo rơ moóc; giấy phép lái xe hạng FC được tiếp tục điều khiển các loại xe quy định cho giấy phép lái xe hạng C quy định tại điểm h khoản này khi kéo rơ moóc, đầu kéo kéo sơ mi rơ moóc; giấy phép lái xe hạng FE được tiếp tục điều khiển các loại xe quy định cho giấy phép lái xe hạng E quy định tại điểm k khoản này khi kéo rơ moóc hoặc xe ô tô chở khách nối toa.


3. Trường hợp người có giấy phép lái xe đã được cấp trước ngày luật này có hiệu lực thi hành có nhu cầu đổi, cấp lại giấy phép lái xe thì thực hiện như sau:

    ... (Các quy định đổi GPLX)

4. Người học lái xe đã được đào tạo lái xe trước ngày luật này có hiệu lực thi hành hoặc đang được đào tạo lái xe tại ngày luật này có hiệu lực thi hành chưa được sát hạch, cấp giấy phép lái xe thì được sát hạch, cấp giấy phép lái xe theo hạng giấy phép lái xe đổi, cấp lại quy định tại khoản 3 điều này.

5. Chứng nhận đăng ký xe, biển số xe máy chuyên dùng cấp trước ngày luật này có hiệu lực thi hành vẫn có giá trị sử dụng.

6. Chứng nhận chất lượng an toàn kỹ thuật và bảo vệ môi trường được cấp trước ngày luật này có hiệu lực thi hành thì có giá trị sử dụng đến hết thời hạn ghi trên giấy chứng nhận đó.

7. Việc đấu giá biển số xe ô tô được thực hiện trước ngày luật này có hiệu lực thi hành và đến ngày luật này có hiệu lực thi hành đã được cấp văn bản xác nhận biển số xe ô tô trúng đấu giá thì tiếp tục thực hiện theo Nghị quyết số 73/2022/QH15 của Quốc hội về thí điểm đấu giá biển số xe ô tô; trường hợp chưa được cấp xác nhận biển số xe ô tô trúng đấu giá thì tiếp tục thực hiện theo Nghị quyết số 73/2022/QH15 của Quốc hội về thí điểm đấu giá biển số xe ô tô và quy định tại điểm d khoản 1 Điều 38 của luật này.


**Tóm lại:**  Theo luật này, giấy phép lái xe hạng BE được đổi từ hạng FB2. Hạng FB2 được phép điều khiển các loại xe hạng B2 khi kéo rơ moóc. Hạng B2 được phép điều khiển xe ô tô chở người đến 08 chỗ, xe ô tô tải, máy kéo có trọng tải dưới 3.500 kg. Vậy, giấy phép lái xe hạng BE cho phép điều khiển xe ô tô chở người đến 08 chỗ, xe ô tô tải, máy kéo có trọng tải dưới 3.500 kg khi kéo rơ moóc.
",Hạng BE cho phép lái xe ô tô chở người đến 9 chỗ ngồi kéo rơ moóc có trọng tải trên 750 kg.,1.0,0.620438450586042,0.0,0.0
6,Giấy phép lái xe hạng C1E cho phép lái những loại xe nào?,"['1. giấy phép lái xe quân sự, được phân hạng theo quy định của luật trật tự, an toàn giao thông đường bộ, đồng thời phù hợp với đặc thù quân sự của phương tiện cơ giới đường bộ thuộc phạm vi quản lý của bộ quốc phòng. giấy phép lái xe quân sự, gồm: a) hạng a1 cấp cho người điều khiển xe mô tô hai bánh có dung tích xi-lanh đến 125 cm3 hoặc có công suất động cơ điện đến 11 kw; b) hạng a cấp cho người điều khiển xe mô tô hai bánh có dung tích xi-lanh trên 125 cm3 hoặc có công suất động cơ điện trên 11kw và các loại xe quy định cho giấy phép lái xe quân sự hạng a1; c) hạng b1 cấp cho người điều khiển xe mô tô ba bánh và các loại xe quy định cho giấy phép lái xe quân sự hạng a1; d) hạng b cấp cho người điều khiển các loại xe ô tô chở người đến 08 chỗ ngồi (không kể chỗ của người lái xe); xe ô tô tải và ô tô chuyên dùng có khối lượng toàn bộ theo thiết kế đến 3.500 kg; các loại xe ô tô quy định cho giấy phép lái xe hạng b có kéo rơ moóc hoặc vũ khí, khí tài quân sự dạng rơ moóc có khối lượng toàn bộ theo thiết kế đến 750 kg; đ) hạng c1 cấp cho người điều khiển các loại xe ô tô vận tải và ô tô chuyên dùng có khối lượng toàn bộ theo thiết kế trên 3.500 kg đến 7.500 kg; các loại xe ô tô quy định cho giấy phép lái xe hạng c1 kéo rơ moóc hoặc vũ khí, khí tài quân sự dạng rơ moóc có khối lượng toàn bộ theo thiết kế đến 750 kg; các loại xe quy định cho giấy phép lái xe quân sự hạng b; e) hạng c cấp cho người điều khiển các loại xe ô tô tải và ô tô chuyên dùng có khối lượng toàn bộ theo thiết kế trên 7.500 kg; các loại xe ô tô tải quy định cho giấy phép lái xe hạng c kéo rơ moóc hoặc vũ khí, khí tài quân sự dạng rơ moóc có khối lượng toàn bộ theo thiết kế đến 750 kg; các loại xe quy định cho giấy phép lái xe quân sự hạng b và hạng c1; g) hạng d1 cấp cho người điều khiển xe ô tô chở người trên 8 chỗ (không kể chỗ của người lái xe) đến 16 chỗ (không kể chỗ của người lái xe); các loại xe ô tô chở người quy định cho giấy phép lái xe hạng d1 kéo rơ moóc hoặc vũ khí, khí tài quân sự dạng rơ moóc có khối lượng toàn bộ theo thiết kế đến 750 kg; các loại xe quy định cho giấy phép lái xe quân sự hạng b, c1, c; h) hạng d2 cấp cho người điều khiển xe ô tô chở người từ trên 16 đến 29 chỗ (không kể chỗ của người lái xe); các loại xe ô tô chở người quy định cho giấy phép lái xe hạng d2 kéo rơ moóc hoặc vũ khí, khí tài quân sự dạng rơ moóc có khối lượng toàn bộ theo thiết kế đến 750 kg; các loại xe quy định cho giấy phép lái xe quân sự hạng b, c1, c, d1; i) hạng d cấp cho người điều khiển xe ô tô chở người từ trên 29 chỗ (không kể chỗ của người lái xe); các loại xe ô tô chở người quy định cho giấy phép lái xe hạng d kéo rơ moóc hoặc vũ khí, khí tài quân sự dạng rơ moóc có khối lượng toàn bộ theo thiết kế đến 750 kg; các loại xe quy định cho giấy phép lái xe quân sự hạng b, c1, c, d1, d2; k) hạng c1e cấp cho người điều khiển các loại xe ô tô quy định cho giấy phép lái xe hạng c1 kéo rơ moóc hoặc vũ khí, khí tài quân sự dạng rơ moóc có khối lượng toàn bộ theo thiết kế trên 750 kg; l) hạng ce cấp cho người điều khiển các loại xe ô tô quy định cho giấy phép lái xe hạng c kéo rơ moóc hoặc vũ khí, khí tài quân sự dạng rơ moóc có khối lượng toàn bộ theo thiết kế trên 750 kg; xe ô tô đầu kéo kéo sơ mi rơ moóc hoặc khí tài quân sự dạng sơ mi rơ moóc; m) hạng cx cấp cho người đã có giấy phép lái xe quân sự hạng c để điều khiển xe xích kéo vũ khí, khí tài quân sự. 2. người điều khiển xe chở hàng bốn bánh có gắn động cơ, xe chở người bốn bánh có gắn động cơ phải sử dụng giấy phép lái xe có hạng phù hợp với xe ô tô tải và ô tô chở người tương ứng. 3. người điều khiển xe ô tô có thiết kế, cải tạo với số chỗ ngồi ít hơn ô tô cùng loại, kích thước giới hạn tương đương phải sử dụng giấy phép lái xe có hạng phù hợp với ô tô cùng loại, kích thước giới hạn tương đương và có số chỗ ngồi nhiều nhất.']","**Nguồn văn bản:** 68_2024_TT-BQP_628772

**Tên văn bản:** Thông tư Quy định về đào tạo, sát hạch, cấp giấy phép lái xe quân sự; bồi dưỡng kiến thức pháp luật về giao thông đường bộ cho người điều khiển xe máy chuyên dùng thuộc phạm vi quản lý của bộ quốc phòng

**Điều 5:** giấy phép lái xe quân sự

**Nội dung:**

1. Giấy phép lái xe quân sự, được phân hạng theo quy định của Luật trật tự, an toàn giao thông đường bộ, đồng thời phù hợp với đặc thù quân sự của phương tiện cơ giới đường bộ thuộc phạm vi quản lý của Bộ Quốc phòng. Giấy phép lái xe quân sự, gồm:

	a) Hạng A1 cấp cho người điều khiển xe mô tô hai bánh có dung tích xi-lanh đến 125 cm3 hoặc có công suất động cơ điện đến 11 kW.

	b) Hạng A cấp cho người điều khiển xe mô tô hai bánh có dung tích xi-lanh trên 125 cm3 hoặc có công suất động cơ điện trên 11kW và các loại xe quy định cho giấy phép lái xe quân sự hạng A1.

	c) Hạng B1 cấp cho người điều khiển xe mô tô ba bánh và các loại xe quy định cho giấy phép lái xe quân sự hạng A1.

	d) Hạng B cấp cho người điều khiển các loại xe ô tô chở người đến 08 chỗ ngồi (không kể chỗ của người lái xe); xe ô tô tải và ô tô chuyên dùng có khối lượng toàn bộ theo thiết kế đến 3.500 kg; các loại xe ô tô quy định cho giấy phép lái xe hạng B có kéo rơ moóc hoặc vũ khí, khí tài quân sự dạng rơ moóc có khối lượng toàn bộ theo thiết kế đến 750 kg.

	đ) Hạng C1 cấp cho người điều khiển các loại xe ô tô vận tải và ô tô chuyên dùng có khối lượng toàn bộ theo thiết kế trên 3.500 kg đến 7.500 kg; các loại xe ô tô quy định cho giấy phép lái xe hạng C1 kéo rơ moóc hoặc vũ khí, khí tài quân sự dạng rơ moóc có khối lượng toàn bộ theo thiết kế đến 750 kg; các loại xe quy định cho giấy phép lái xe quân sự hạng B.

	e) Hạng C cấp cho người điều khiển các loại xe ô tô tải và ô tô chuyên dùng có khối lượng toàn bộ theo thiết kế trên 7.500 kg; các loại xe ô tô tải quy định cho giấy phép lái xe hạng C kéo rơ moóc hoặc vũ khí, khí tài quân sự dạng rơ moóc có khối lượng toàn bộ theo thiết kế đến 750 kg; các loại xe quy định cho giấy phép lái xe quân sự hạng B và hạng C1.

	g) Hạng D1 cấp cho người điều khiển xe ô tô chở người trên 8 chỗ (không kể chỗ của người lái xe) đến 16 chỗ (không kể chỗ của người lái xe); các loại xe ô tô chở người quy định cho giấy phép lái xe hạng D1 kéo rơ moóc hoặc vũ khí, khí tài quân sự dạng rơ moóc có khối lượng toàn bộ theo thiết kế đến 750 kg; các loại xe quy định cho giấy phép lái xe quân sự hạng B, C1, C.

	h) Hạng D2 cấp cho người điều khiển xe ô tô chở người từ trên 16 đến 29 chỗ (không kể chỗ của người lái xe); các loại xe ô tô chở người quy định cho giấy phép lái xe hạng D2 kéo rơ moóc hoặc vũ khí, khí tài quân sự dạng rơ moóc có khối lượng toàn bộ theo thiết kế đến 750 kg; các loại xe quy định cho giấy phép lái xe quân sự hạng B, C1, C, D1.

	i) Hạng D cấp cho người điều khiển xe ô tô chở người từ trên 29 chỗ (không kể chỗ của người lái xe); các loại xe ô tô chở người quy định cho giấy phép lái xe hạng D kéo rơ moóc hoặc vũ khí, khí tài quân sự dạng rơ moóc có khối lượng toàn bộ theo thiết kế đến 750 kg; các loại xe quy định cho giấy phép lái xe quân sự hạng B, C1, C, D1, D2.

	k) Hạng C1E cấp cho người điều khiển các loại xe ô tô quy định cho giấy phép lái xe hạng C1 kéo rơ moóc hoặc vũ khí, khí tài quân sự dạng rơ moóc có khối lượng toàn bộ theo thiết kế trên 750 kg.

	l) Hạng CE cấp cho người điều khiển các loại xe ô tô quy định cho giấy phép lái xe hạng C kéo rơ moóc hoặc vũ khí, khí tài quân sự dạng rơ moóc có khối lượng toàn bộ theo thiết kế trên 750 kg; xe ô tô đầu kéo kéo sơ mi rơ moóc hoặc khí tài quân sự dạng sơ mi rơ moóc.

	m) Hạng CX cấp cho người đã có giấy phép lái xe quân sự hạng C để điều khiển xe xích kéo vũ khí, khí tài quân sự.

2. Người điều khiển xe chở hàng bốn bánh có gắn động cơ, xe chở người bốn bánh có gắn động cơ phải sử dụng giấy phép lái xe có hạng phù hợp với xe ô tô tải và ô tô chở người tương ứng.

3. Người điều khiển xe ô tô có thiết kế, cải tạo với số chỗ ngồi ít hơn ô tô cùng loại, kích thước giới hạn tương đương phải sử dụng giấy phép lái xe có hạng phù hợp với ô tô cùng loại, kích thước giới hạn tương đương và có số chỗ ngồi nhiều nhất.


**Tóm lại:** Giấy phép lái xe hạng C1E cho phép điều khiển các loại xe ô tô quy định cho giấy phép lái xe hạng C1 kéo rơ moóc hoặc vũ khí, khí tài quân sự dạng rơ moóc có khối lượng toàn bộ theo thiết kế trên 750 kg.
",Hạng C1E cho phép lái xe ô tô tải có trọng tải từ 3.500 kg đến 7.500 kg kéo rơ moóc có trọng tải trên 750 kg.,1.0,0.37310768170676,1.0,0.9999999999
7,Giấy phép lái xe hạng D1E cho phép lái những loại xe nào?,"['1. giấy phép lái xe bao gồm các hạng sau đây: a) hạng a1 cấp cho người lái xe mô tô hai bánh có dung tích xi-lanh đến 125 cm3 hoặc có công suất động cơ điện đến 11 kw; b) hạng a cấp cho người lái xe mô tô hai bánh có dung tích xi-lanh\xa0 trên 125 cm3\xa0hoặc có công suất động cơ điện trên 11 kw và các loại xe quy định cho giấy phép lái xe hạng a1; c) hạng b1 cấp cho người lái xe mô tô ba bánh và các loại xe quy định cho giấy phép lái xe hạng a1; d) hạng b cấp cho người lái xe ô tô chở người đến 08 chỗ (không kể chỗ của người lái xe); xe ô tô tải và ô tô chuyên dùng có khối lượng toàn bộ theo thiết kế đến 3.500 kg; các loại xe ô tô quy định cho giấy phép lái xe hạng b kéo rơ moóc có khối lượng toàn bộ theo thiết kế đến 750 kg; đ) hạng c1 cấp cho người lái xe ô tô tải và ô tô chuyên dùng có khối lượng toàn bộ theo thiết kế trên 3.500 kg đến 7.500 kg; các loại xe ô tô tải quy định cho giấy phép lái xe hạng c1 kéo rơ moóc có khối lượng toàn bộ theo thiết kế đến 750 kg; các loại xe quy định cho giấy phép lái xe hạng b; e) hạng c cấp cho người lái xe ô tô tải và ô tô chuyên dùng có khối lượng toàn bộ theo thiết kế trên 7.500 kg; các loại xe ô tô tải quy định cho giấy phép lái xe hạng c kéo rơ moóc có khối lượng toàn bộ theo thiết kế đến 750 kg; các loại xe quy định cho giấy phép lái xe hạng b và hạng c1; g) hạng d1 cấp cho người lái xe ô tô chở người trên 08 chỗ (không kể chỗ của người lái xe) đến 16 chỗ (không kể chỗ của người lái xe); các loại xe ô tô chở người quy định cho giấy phép lái xe hạng d1 kéo rơ moóc có khối lượng toàn bộ theo thiết kế đến 750 kg; các loại xe quy định cho giấy phép lái xe các hạng b, c1, c; h) hạng d2 cấp cho người lái xe ô tô chở người (kể cả xe buýt) trên 16 chỗ (không kể chỗ của người lái xe) đến 29 chỗ (không kể chỗ của người lái xe); các loại xe ô tô chở người quy định cho giấy phép lái xe hạng d2 kéo rơ moóc có khối lượng toàn bộ theo thiết kế đến 750 kg; các loại xe quy định cho giấy phép lái xe các hạng b, c1, c, d1; i) hạng d cấp cho người lái xe ô tô chở người (kể cả xe buýt) trên 29 chỗ (không kể chỗ của người lái xe); xe ô tô chở người giường nằm; các loại xe ô tô chở người quy định cho giấy phép lái xe hạng d kéo rơ moóc có khối lượng toàn bộ theo thiết kế đến 750 kg; các loại xe quy định cho giấy phép lái xe các hạng b, c1, c, d1, d2; k) hạng be cấp cho người lái các loại xe ô tô quy định cho giấy phép lái xe hạng b kéo rơ moóc có khối lượng toàn bộ theo thiết kế trên 750 kg; l) hạng c1e cấp cho người lái các loại xe ô tô quy định cho giấy phép lái xe hạng c1 kéo rơ moóc có khối lượng toàn bộ theo thiết kế trên 750 kg; m) hạng ce cấp cho người lái các loại xe ô tô quy định cho giấy phép lái xe hạng c kéo rơ moóc có khối lượng toàn bộ theo thiết kế trên 750 kg; xe ô tô đầu kéo kéo sơ mi rơ moóc; n) hạng d1e cấp cho người lái các loại xe ô tô quy định cho giấy phép lái xe hạng d1 kéo rơ moóc có khối lượng toàn bộ theo thiết kế trên 750 kg; o) hạng d2e cấp cho người lái các loại xe ô tô quy định cho giấy phép lái xe hạng d2 kéo rơ moóc có khối lượng toàn bộ theo thiết kế trên 750 kg; p) hạng de cấp cho người lái các loại xe ô tô quy định cho giấy phép lái xe hạng d kéo rơ moóc có khối lượng toàn bộ theo thiết kế trên 750 kg; xe ô tô chở khách nối toa. 2. người khuyết tật điều khiển xe mô tô ba bánh dùng cho người khuyết tật được cấp giấy phép lái xe hạng a1. người khuyết tật điều khiển xe ô tô số tự động có kết cấu phù hợp với tình trạng khuyết tật thì được cấp giấy phép lái xe hạng b. 3. người điều khiển xe chở hàng bốn bánh có gắn động cơ, xe chở người bốn bánh có gắn động cơ phải sử dụng giấy phép lái xe có hạng phù hợp với xe ô tô tải hoặc xe ô tô chở người tương ứng. 4. người điều khiển xe ô tô có thiết kế, cải tạo với số chỗ ít hơn xe cùng loại, kích thước giới hạn tương đương phải sử dụng giấy phép lái xe có hạng phù hợp với xe ô tô cùng loại, kích thước giới hạn tương đương và có số chỗ nhiều nhất. 5. thời hạn của giấy phép lái xe được quy định như sau: a) giấy phép lái xe các hạng a1, a, b1 không thời hạn; b) giấy phép lái xe hạng b và hạng c1 có thời hạn 10 năm kể từ ngày cấp; c) giấy phép lái xe các hạng c, d1, d2, d, be, c1e, ce, d1e, d2e và de có thời hạn 05 năm kể từ ngày cấp. 6. giấy phép lái xe có giá trị sử dụng trong phạm vi lãnh thổ việt nam bao gồm: a) giấy phép lái xe do cơ quan có thẩm quyền của việt nam cấp; b) giấy phép lái xe quốc tế và giấy phép lái xe quốc gia phù hợp với loại xe được phép điều khiển do quốc gia là thành viên của công ước của liên hợp quốc về giao thông đường bộ năm 1968 (sau đây gọi là công ước viên) cấp; c) giấy phép lái xe phù hợp với loại xe được phép điều khiển của nước hoặc vùng lãnh thổ mà việt nam ký kết điều ước quốc tế hoặc thỏa thuận quốc tế công nhận giấy phép lái xe của nhau; d) giấy phép lái xe nước ngoài phù hợp với loại xe được phép điều khiển do quốc gia được công nhận theo điều ước quốc tế mà nước cộng hòa xã hội chủ nghĩa việt nam là thành viên. 7. giấy phép lái xe không có hiệu lực trong các trường hợp sau đây: a) giấy phép lái xe hết thời hạn sử dụng; b) giấy phép lái xe bị thu hồi theo quy định tại khoản 5 điều 62 của luật này. 8. giấy phép lái xe quốc tế được quy định như sau: a) giấy phép lái xe quốc tế là giấy phép lái xe do cơ quan nhà nước có thẩm quyền của quốc gia là thành viên của công ước viên cấp theo một mẫu thống nhất; có thời hạn không quá 03 năm kể từ ngày cấp và phải phù hợp với thời hạn còn hiệu lực của giấy phép lái xe quốc gia; b) người có giấy phép lái xe quốc tế do quốc gia là thành viên của công ước viên cấp khi lái xe tham gia giao thông đường bộ trên lãnh thổ việt nam phải mang theo giấy phép lái xe quốc tế và giấy phép lái xe quốc gia được cấp phù hợp với hạng xe điều khiển, còn thời hạn sử dụng; phải tuân thủ pháp luật về trật tự, an toàn giao thông đường bộ của việt nam; c) người có giấy phép lái xe quốc tế vi phạm pháp luật về trật tự, an toàn giao thông đường bộ của việt nam mà bị tước quyền sử dụng giấy phép lái xe có thời hạn thì thời gian bị tước quyền sử dụng không quá thời gian người lái xe được phép cư trú tại lãnh thổ việt nam; d) người việt nam hoặc người nước ngoài có thẻ thường trú hoặc thẻ tạm trú tại việt nam có giấy phép lái xe do việt nam hoặc quốc gia là thành viên của điều ước quốc tế mà nước cộng hòa xã hội chủ nghĩa việt nam là thành viên cấp, còn giá trị sử dụng, nếu có nhu cầu được cấp giấy phép lái xe quốc tế. 9. bộ trưởng bộ giao thông vận tải quy định mẫu giấy phép lái xe và giấy phép lái xe quốc tế, trình tự, thủ tục cấp và việc sử dụng giấy phép lái xe, giấy phép lái xe quốc tế; đối với mẫu giấy phép lái xe, trình tự, thủ tục cấp và việc sử dụng giấy phép lái xe của lực lượng quân đội, công an làm nhiệm vụ quốc phòng, an ninh do bộ trưởng bộ quốc phòng, bộ trưởng bộ công an quy định.']","**Nguồn văn bản:** 36_2024_QH15_444251

**Tên văn bản:** Luật Trật tự, an toàn giao thông đường bộ

**Điều 57:** giấy phép lái xe

**Nội dung:**

1. Giấy phép lái xe bao gồm các hạng sau đây:

        a) Hạng A1 cấp cho người lái xe mô tô hai bánh có dung tích xi-lanh đến 125 cm3 hoặc có công suất động cơ điện đến 11 kW.

        b) Hạng A cấp cho người lái xe mô tô hai bánh có dung tích xi-lanh trên 125 cm3 hoặc có công suất động cơ điện trên 11 kW và các loại xe quy định cho giấy phép lái xe hạng A1.

        c) Hạng B1 cấp cho người lái xe mô tô ba bánh và các loại xe quy định cho giấy phép lái xe hạng A1.

        d) Hạng B cấp cho người lái xe ô tô chở người đến 08 chỗ (không kể chỗ của người lái xe); xe ô tô tải và ô tô chuyên dùng có khối lượng toàn bộ theo thiết kế đến 3.500 kg; các loại xe ô tô quy định cho giấy phép lái xe hạng B kéo rơ moóc có khối lượng toàn bộ theo thiết kế đến 750 kg.

        đ) Hạng C1 cấp cho người lái xe ô tô tải và ô tô chuyên dùng có khối lượng toàn bộ theo thiết kế trên 3.500 kg đến 7.500 kg; các loại xe ô tô tải quy định cho giấy phép lái xe hạng C1 kéo rơ moóc có khối lượng toàn bộ theo thiết kế đến 750 kg; các loại xe quy định cho giấy phép lái xe hạng B.

        e) Hạng C cấp cho người lái xe ô tô tải và ô tô chuyên dùng có khối lượng toàn bộ theo thiết kế trên 7.500 kg; các loại xe ô tô tải quy định cho giấy phép lái xe hạng C kéo rơ moóc có khối lượng toàn bộ theo thiết kế đến 750 kg; các loại xe quy định cho giấy phép lái xe hạng B và hạng C1.

        g) Hạng D1 cấp cho người lái xe ô tô chở người trên 08 chỗ (không kể chỗ của người lái xe) đến 16 chỗ (không kể chỗ của người lái xe); các loại xe ô tô chở người quy định cho giấy phép lái xe hạng D1 kéo rơ moóc có khối lượng toàn bộ theo thiết kế đến 750 kg; các loại xe quy định cho giấy phép lái xe các hạng B, C1, C.

        h) Hạng D2 cấp cho người lái xe ô tô chở người (kể cả xe buýt) trên 16 chỗ (không kể chỗ của người lái xe) đến 29 chỗ (không kể chỗ của người lái xe); các loại xe ô tô chở người quy định cho giấy phép lái xe hạng D2 kéo rơ moóc có khối lượng toàn bộ theo thiết kế đến 750 kg; các loại xe quy định cho giấy phép lái xe các hạng B, C1, C, D1.

        i) Hạng D cấp cho người lái xe ô tô chở người (kể cả xe buýt) trên 29 chỗ (không kể chỗ của người lái xe); xe ô tô chở người giường nằm; các loại xe ô tô chở người quy định cho giấy phép lái xe hạng D kéo rơ moóc có khối lượng toàn bộ theo thiết kế đến 750 kg; các loại xe quy định cho giấy phép lái xe các hạng B, C1, C, D1, D2.

        k) Hạng BE cấp cho người lái các loại xe ô tô quy định cho giấy phép lái xe hạng B kéo rơ moóc có khối lượng toàn bộ theo thiết kế trên 750 kg.

        l) Hạng C1E cấp cho người lái các loại xe ô tô quy định cho giấy phép lái xe hạng C1 kéo rơ moóc có khối lượng toàn bộ theo thiết kế trên 750 kg.

        m) Hạng CE cấp cho người lái các loại xe ô tô quy định cho giấy phép lái xe hạng C kéo rơ moóc có khối lượng toàn bộ theo thiết kế trên 750 kg; xe ô tô đầu kéo kéo sơ mi rơ moóc.

        n) Hạng D1E cấp cho người lái các loại xe ô tô quy định cho giấy phép lái xe hạng D1 kéo rơ moóc có khối lượng toàn bộ theo thiết kế trên 750 kg.

        o) Hạng D2E cấp cho người lái các loại xe ô tô quy định cho giấy phép lái xe hạng D2 kéo rơ moóc có khối lượng toàn bộ theo thiết kế trên 750 kg.

        p) Hạng DE cấp cho người lái các loại xe ô tô quy định cho giấy phép lái xe hạng D kéo rơ moóc có khối lượng toàn bộ theo thiết kế trên 750 kg; xe ô tô chở khách nối toa.


2. Người khuyết tật điều khiển xe mô tô ba bánh dùng cho người khuyết tật được cấp giấy phép lái xe hạng A1. Người khuyết tật điều khiển xe ô tô số tự động có kết cấu phù hợp với tình trạng khuyết tật thì được cấp giấy phép lái xe hạng B.

3. Người điều khiển xe chở hàng bốn bánh có gắn động cơ, xe chở người bốn bánh có gắn động cơ phải sử dụng giấy phép lái xe có hạng phù hợp với xe ô tô tải hoặc xe ô tô chở người tương ứng.

4. Người điều khiển xe ô tô có thiết kế, cải tạo với số chỗ ít hơn xe cùng loại, kích thước giới hạn tương đương phải sử dụng giấy phép lái xe có hạng phù hợp với xe ô tô cùng loại, kích thước giới hạn tương đương và có số chỗ nhiều nhất.

5. Thời hạn của giấy phép lái xe được quy định như sau:
        a) Giấy phép lái xe các hạng A1, A, B1 không thời hạn.
        b) Giấy phép lái xe hạng B và hạng C1 có thời hạn 10 năm kể từ ngày cấp.
        c) Giấy phép lái xe các hạng C, D1, D2, D, BE, C1E, CE, D1E, D2E và DE có thời hạn 05 năm kể từ ngày cấp.


6.  Giấy phép lái xe có giá trị sử dụng trong phạm vi lãnh thổ Việt Nam bao gồm:
        a) Giấy phép lái xe do cơ quan có thẩm quyền của Việt Nam cấp.
        b) Giấy phép lái xe quốc tế và giấy phép lái xe quốc gia phù hợp với loại xe được phép điều khiển do quốc gia là thành viên của Công ước của Liên hợp quốc về giao thông đường bộ năm 1968 (sau đây gọi là Công ước Viên) cấp.
        c) Giấy phép lái xe phù hợp với loại xe được phép điều khiển của nước hoặc vùng lãnh thổ mà Việt Nam ký kết điều ước quốc tế hoặc thỏa thuận quốc tế công nhận giấy phép lái xe của nhau.
        d) Giấy phép lái xe nước ngoài phù hợp với loại xe được phép điều khiển do quốc gia được công nhận theo điều ước quốc tế mà nước Cộng hòa xã hội chủ nghĩa Việt Nam là thành viên.


7. Giấy phép lái xe không có hiệu lực trong các trường hợp sau đây:
        a) Giấy phép lái xe hết thời hạn sử dụng.
        b) Giấy phép lái xe bị thu hồi theo quy định tại khoản 5 Điều 62 của Luật này.


8. Giấy phép lái xe quốc tế được quy định như sau:
        a) Giấy phép lái xe quốc tế là giấy phép lái xe do cơ quan nhà nước có thẩm quyền của quốc gia là thành viên của Công ước Viên cấp theo một mẫu thống nhất; có thời hạn không quá 03 năm kể từ ngày cấp và phải phù hợp với thời hạn còn hiệu lực của giấy phép lái xe quốc gia.
        b) Người có giấy phép lái xe quốc tế do quốc gia là thành viên của Công ước Viên cấp khi lái xe tham gia giao thông đường bộ trên lãnh thổ Việt Nam phải mang theo giấy phép lái xe quốc tế và giấy phép lái xe quốc gia được cấp phù hợp với hạng xe điều khiển, còn thời hạn sử dụng; phải tuân thủ pháp luật về trật tự, an toàn giao thông đường bộ của Việt Nam.
        c) Người có giấy phép lái xe quốc tế vi phạm pháp luật về trật tự, an toàn giao thông đường bộ của Việt Nam mà bị tước quyền sử dụng giấy phép lái xe có thời hạn thì thời gian bị tước quyền sử dụng không quá thời gian người lái xe được phép cư trú tại lãnh thổ Việt Nam.
        d) Người Việt Nam hoặc người nước ngoài có thẻ thường trú hoặc thẻ tạm trú tại Việt Nam có giấy phép lái xe do Việt Nam hoặc quốc gia là thành viên của điều ước quốc tế mà nước Cộng hòa xã hội chủ nghĩa Việt Nam là thành viên cấp, còn giá trị sử dụng, nếu có nhu cầu được cấp giấy phép lái xe quốc tế.


9. Bộ trưởng Bộ Giao thông vận tải quy định mẫu giấy phép lái xe và giấy phép lái xe quốc tế, trình tự, thủ tục cấp và việc sử dụng giấy phép lái xe, giấy phép lái xe quốc tế; đối với mẫu giấy phép lái xe, trình tự, thủ tục cấp và việc sử dụng giấy phép lái xe của lực lượng quân đội, công an làm nhiệm vụ quốc phòng, an ninh do Bộ trưởng Bộ Quốc phòng, Bộ trưởng Bộ Công an quy định.


**Tóm lại:** Giấy phép lái xe hạng D1E cấp cho người lái các loại xe ô tô quy định cho giấy phép lái xe hạng D1 (ô tô chở người từ 09 đến 16 chỗ) kéo rơ moóc có khối lượng toàn bộ theo thiết kế trên 750 kg. Giấy phép này có thời hạn 05 năm.
",Hạng D1E cho phép lái xe ô tô chở người từ 10 đến 30 chỗ ngồi kéo rơ moóc có trọng tải trên 750 kg.,1.0,0.3480183338690968,0.0,0.9999999999
8,Giấy phép lái xe hạng D2E cho phép lái những loại xe nào?,"['1. giấy phép lái xe quân sự được cấp trước ngày thông tư này có hiệu lực thi hành được tiếp tục sử dụng theo thời hạn ghi trên giấy phép lái xe. 2. giấy phép lái xe quân sự được cấp trước ngày thông tư này có hiệu lực thi hành nếu chưa thực hiện đổi, cấp lại theo quy định của thông tư này có hiệu lực sử dụng như sau: a) giấy phép lái xe quân sự hạng a1 được tiếp tục điều khiển xe mô tô hai bánh có dung tích xi-lanh từ 50 cm3 đến dưới 175 cm3 hoặc có công suất động cơ điện từ 04 kw đến dưới 14 kw; b) giấy phép lái xe quân sự hạng a2 được tiếp tục điều khiển xe mô tô hai bánh có dung tích xi-lanh từ 175 cm3 trở lên hoặc có công suất động cơ điện từ 14 kw trở lên và các loại xe quy định cho giấy phép lái xe hạng a1 quy định tại điểm a khoản này; c) giấy phép lái xe quân sự hạng a3 được tiếp tục điều khiển xe mô tô ba bánh, các loại xe quy định cho giấy phép lái xe hạng a1 quy định tại điểm a khoản này và các xe tương tự; d) giấy phép lái xe quân sự hạng b2 được tiếp tục điều khiển xe ô tô chở người đến 08 chỗ (không kể chỗ của người lái xe); xe ô tô tải, máy kéo có trọng tải dưới 3.500 kg; các loại xe ô tô quy định cho giấy phép lái xe hạng b kéo theo một rơ moóc hoặc vũ khí, khí tài quân sự dạng rơ moóc có khối lượng toàn bộ theo thiết kế đến 750 kg; đ) giấy phép lái xe quân sự hạng c được tiếp tục điều khiển xe ô tô tải, máy kéo có trọng tải từ 3.500 kg trở lên và các loại xe quy định cho các giấy phép lái xe hạng b2 quy định tại điểm d khoản này; các loại xe ô tô quy định cho giấy phép lái xe hạng c kéo theo một rơ moóc hoặc vũ khí, khí tài quân sự dạng rơ moóc có khối lượng toàn bộ theo thiết kế đến 750 kg; e) giấy phép lái xe quân sự hạng d được tiếp tục điều khiển xe ô tô chở người từ 09 chỗ (không kể chỗ của người lái xe) đến 29 chỗ (không kể chỗ của người lái xe) và các loại xe quy định cho các giấy phép lái xe hạng b2, c quy định tại các điểm d, đ khoản này; các loại xe ô tô quy định cho giấy phép lái xe hạng d2 kéo theo một rơ moóc hoặc vũ khí, khí tài quân sự dạng rơ moóc có khối lượng toàn bộ theo thiết kế đến 750 kg; g) giấy phép lái xe quân sự hạng e được tiếp tục điều khiển xe ô tô chở người trên 29 chỗ (không kể chỗ của người lái xe) và các loại xe quy định cho các giấy phép lái xe hạng b2, c, d quy định tại các điểm d, đ và e khoản này; các loại ô tô quy định cho giấy phép lái xe hạng d kéo theo một rơ moóc hoặc vũ khí, khí tài quân sự dạng rơ moóc có khối lượng toàn bộ theo thiết kế đến 750 kg; h) giấy phép lái xe quân sự hạng fc được tiếp tục điều khiển các loại xe quy định cho giấy phép lái xe hạng c quy định tại điểm đ khoản này khi kéo rơ moóc, khí tài quân sự dạng rơ moóc và ô tô đầu kéo kéo sơ mi rơ moóc, khí tài quân sự dạng sơ mi rơ moóc; i) giấy phép lái xe quân sự hạng fx được tiếp tục điều khiển xe xích kéo vũ khí, khí tài quân sự và các loại xe quy định cho giấy phép lái xe hạng c quy định tại điểm đ khoản này. 3. trường hợp người có giấy phép, lái xe quân sự đã được cấp trước ngày thông tư này có hiệu lực thi hành khi đổi, cấp lại giấy phép lái xe thì thực hiện như sau: a) giấy phép lái xe quân sự hạng a1 được đổi, cấp lại sang giấy phép lái xe quân sự hạng a với điều kiện hạn chế là chỉ được điều khiển xe mô tô hai bánh có dung tích xi-lanh đến dưới 175 cm3 hoặc có công suất động cơ điện đến dưới 14 kw; b) giấy phép lái xe quân sự hạng a2 được đổi, cấp lại sang giấy phép lái xe quân sự hạng a; c) giấy phép lái xe quân sự hạng a3 được đổi, cấp lại sang giấy phép lái xe quân sự hạng b1; d) giấy phép lái xe quân sự hạng b2 được đổi, cấp lại sang giấy phép lái xe quân sự hạng b hoặc hạng c1; đ) giấy phép lái xe quân sự hạng c giữ nguyên và đổi, cấp lại cùng hạng; e) giấy phép lái xe quân sự hạng d được đổi, cấp lại sang giấy phép lái xe quân sự hạng d2; g) giấy phép lái xe quân sự hạng e được đổi, cấp lại sang giấy phép lái xe quân sự hạng d; h) giấy phép lái xe quân sự hạng fc được đổi, cấp lại sang giấy phép lái xe quân sự hạng ce; i) giấy phép lái xe quân sự hạng fx được đổi, cấp lại sang giấy phép lái xe quân sự hạng cx; 4. người học lái xe đã được đào tạo lái xe trước ngày thông tư này có hiệu lực thi hành hoặc đang được đào tạo lái xe tại ngày thông tư này có hiệu lực thi hành chưa được sát hạch thì được sát hạch, cấp giấy phép lái xe theo hạng giấy phép lái xe đổi, cấp lại quy định tại khoản 3 điều này.']","**Nguồn văn bản:** 68_2024_TT-BQP_628772

**Tên văn bản:** Thông tư Quy định về đào tạo, sát hạch, cấp giấy phép lái xe quân sự; bồi dưỡng kiến thức pháp luật về giao thông đường bộ cho người điều khiển xe máy chuyên dùng thuộc phạm vi quản lý của bộ quốc phòng

**Điều 61:** quy định chuyển tiếp

**Nội dung:**

1. Giấy phép lái xe quân sự được cấp trước ngày thông tư này có hiệu lực thi hành được tiếp tục sử dụng theo thời hạn ghi trên giấy phép lái xe.

2. Giấy phép lái xe quân sự được cấp trước ngày thông tư này có hiệu lực thi hành nếu chưa thực hiện đổi, cấp lại theo quy định của thông tư này có hiệu lực sử dụng như sau:

	a) Giấy phép lái xe quân sự hạng A1 được tiếp tục điều khiển xe mô tô hai bánh có dung tích xi-lanh từ 50 cm3 đến dưới 175 cm3 hoặc có công suất động cơ điện từ 04 kW đến dưới 14 kW.

	b) Giấy phép lái xe quân sự hạng A2 được tiếp tục điều khiển xe mô tô hai bánh có dung tích xi-lanh từ 175 cm3 trở lên hoặc có công suất động cơ điện từ 14 kW trở lên và các loại xe quy định cho giấy phép lái xe hạng A1 quy định tại điểm a khoản này.

	c) Giấy phép lái xe quân sự hạng A3 được tiếp tục điều khiển xe mô tô ba bánh, các loại xe quy định cho giấy phép lái xe hạng A1 quy định tại điểm a khoản này và các xe tương tự.

	d) Giấy phép lái xe quân sự hạng B2 được tiếp tục điều khiển xe ô tô chở người đến 08 chỗ (không kể chỗ của người lái xe); xe ô tô tải, máy kéo có trọng tải dưới 3.500 kg; các loại xe ô tô quy định cho giấy phép lái xe hạng B kéo theo một rơ moóc hoặc vũ khí, khí tài quân sự dạng rơ moóc có khối lượng toàn bộ theo thiết kế đến 750 kg.

	đ) Giấy phép lái xe quân sự hạng C được tiếp tục điều khiển xe ô tô tải, máy kéo có trọng tải từ 3.500 kg trở lên và các loại xe quy định cho các giấy phép lái xe hạng B2 quy định tại điểm d khoản này; các loại xe ô tô quy định cho giấy phép lái xe hạng C kéo theo một rơ moóc hoặc vũ khí, khí tài quân sự dạng rơ moóc có khối lượng toàn bộ theo thiết kế đến 750 kg.

	e) Giấy phép lái xe quân sự hạng D được tiếp tục điều khiển xe ô tô chở người từ 09 chỗ (không kể chỗ của người lái xe) đến 29 chỗ (không kể chỗ của người lái xe) và các loại xe quy định cho các giấy phép lái xe hạng B2, C quy định tại các điểm d, đ khoản này; các loại xe ô tô quy định cho giấy phép lái xe hạng D2 kéo theo một rơ moóc hoặc vũ khí, khí tài quân sự dạng rơ moóc có khối lượng toàn bộ theo thiết kế đến 750 kg.

	g) Giấy phép lái xe quân sự hạng E được tiếp tục điều khiển xe ô tô chở người trên 29 chỗ (không kể chỗ của người lái xe) và các loại xe quy định cho các giấy phép lái xe hạng B2, C, D quy định tại các điểm d, đ và e khoản này; các loại ô tô quy định cho giấy phép lái xe hạng D kéo theo một rơ moóc hoặc vũ khí, khí tài quân sự dạng rơ moóc có khối lượng toàn bộ theo thiết kế đến 750 kg.


3. ...

4. ...

**Tóm lại:** Giấy phép lái xe quân sự hạng D cho phép điều khiển xe ô tô chở người từ 9 đến 29 chỗ (không kể chỗ người lái), các loại xe thuộc hạng B2, C và có thể kéo theo rơ moóc hoặc vũ khí, khí tài quân sự dạng rơ moóc đến 750kg. Giấy phép hạng D2 là hạng giấy phép được đổi từ hạng D khi thực hiện đổi, cấp lại theo thông tư này.
",Hạng D2E cho phép lái xe ô tô chở người trên 30 chỗ ngồi kéo rơ moóc có trọng tải trên 750 kg.,1.0,0.4350854516261447,0.0,0.0
9,Giấy phép lái xe hạng DE cho phép lái những loại xe nào?,"['1. đào tạo từ xa, tự học có hướng dẫn áp dụng đối với các môn học pháp luật về giao thông đường bộ, đạo đức, văn hóa giao thông và phòng chống tác hại của rượu, bia khi tham gia giao thông và học lý thuyết của các môn: cấu tạo và sửa chữa thông thường; kỹ năng phòng cháy, chữa cháy và cứu nạn, cứu hộ; kỹ thuật lái xe để cấp giấy phép lái xe hạng b, c1, c, d1, d2, d, be, c1e, ce, d1e, d2e và de. 2. người học phải đăng ký tại cơ sở được phép đào tạo để được quản lý theo quy định của bộ giao thông vận tải. mục 2. điều kiện kinh doanh của cơ sở đào tạo lái xe ô tô']","**Nguồn văn bản:** 160_2024_ND-CP_624017

**Tên văn bản:** Nghị định Quy định về hoạt động đào tạo và sát hạch lái xe

**Điều 5:** Hình thức đào tạo từ xa, tự học có hướng dẫn

**Nội dung:**

1. Đào tạo từ xa, tự học có hướng dẫn áp dụng đối với các môn học pháp luật về giao thông đường bộ, đạo đức, văn hóa giao thông và phòng, chống tác hại của rượu, bia khi tham gia giao thông và học lý thuyết của các môn: cấu tạo và sửa chữa thông thường; kỹ năng phòng cháy, chữa cháy và cứu nạn, cứu hộ; kỹ thuật lái xe để cấp giấy phép lái xe hạng B, C1, C, D1, D2, D, BE, C1E, CE, D1E, D2E và DE.

2. Người học phải đăng ký tại cơ sở được phép đào tạo để được quản lý theo quy định của Bộ Giao thông vận tải.


Tóm lại: Văn bản này đề cập đến việc đào tạo lái xe hạng DE, nhưng không nêu rõ các loại xe được phép lái với giấy phép lái xe hạng DE. Do đó, tôi không thể trả lời câu hỏi của bạn dựa trên văn bản này.
",Hạng DE cho phép lái xe ô tô chở người trên 30 chỗ ngồi kéo rơ moóc có trọng tải trên 750 kg.,0.5454545454545454,0.0,0.0,0.0
10,Luật Giao thông Đường bộ 2025 quy định như thế nào về điểm giấy phép lái xe?,"['1. điểm của giấy phép lái xe quân sự gồm 12 điểm theo quy định của luật trật tự, an toàn giao thông đường bộ, được dùng để quản lý việc chấp hành pháp luật về trật tự, an toàn giao thông đường bộ của người lái xe. số điểm trừ mỗi lần tùy theo tính chất, mức độ vi phạm theo quy định của pháp luật. giấy phép lái xe chưa bị trừ hết điểm và không bị trừ điểm trong thời hạn 12 tháng kể từ ngày bị trừ điểm gần nhất thì được phục hồi đủ 12 điểm. 2. trường hợp giấy phép lái xe quân sự bị trừ hết điểm, sau thời hạn ít nhất 06 tháng kể từ ngày bị trừ hết điểm, người có giấy phép lái xe quân sự bị trừ hết điểm được tham gia kiểm tra kiến thức pháp luật về giao thông đường bộ tổ chức tại cơ sở đào tạo lái xe quân sự theo quy định tại điểm a khoản 1 điều 40 và khoản 1 điều 41 thông tư này, nếu kết quả đặt yêu cầu được phục hồi đủ 12 điểm. 3. điểm của giấy phép lái xe quân sự đổi, cấp lại, đào tạo nâng hạng được giữ nguyên như trước khi đổi, cấp lại, đào tạo nâng hạng.']","**Nguồn văn bản:** 68_2024_TT-BQP_628772

**Tên văn bản:** Thông tư Quy định về đào tạo, sát hạch, cấp giấy phép lái xe quân sự; bồi dưỡng kiến thức pháp luật về giao thông đường bộ cho người điều khiển xe máy chuyên dùng thuộc phạm vi quản lý của bộ quốc phòng

**Điều 7:** Điểm của giấy phép lái xe quân sự

**Nội dung:**

1. Điểm của giấy phép lái xe quân sự gồm 12 điểm theo quy định của Luật Trật tự, An toàn giao thông đường bộ, được dùng để quản lý việc chấp hành pháp luật về trật tự, an toàn giao thông đường bộ của người lái xe.

Số điểm trừ mỗi lần tùy theo tính chất, mức độ vi phạm theo quy định của pháp luật.

Giấy phép lái xe chưa bị trừ hết điểm và không bị trừ điểm trong thời hạn 12 tháng kể từ ngày bị trừ điểm gần nhất thì được phục hồi đủ 12 điểm.

2. Trường hợp giấy phép lái xe quân sự bị trừ hết điểm, sau thời hạn ít nhất 06 tháng kể từ ngày bị trừ hết điểm, người có giấy phép lái xe quân sự bị trừ hết điểm được tham gia kiểm tra kiến thức pháp luật về giao thông đường bộ tổ chức tại cơ sở đào tạo lái xe quân sự theo quy định tại điểm a khoản 1 Điều 40 và khoản 1 Điều 41 Thông tư này, nếu kết quả đạt yêu cầu được phục hồi đủ 12 điểm.

3. Điểm của giấy phép lái xe quân sự đổi, cấp lại, đào tạo nâng hạng được giữ nguyên như trước khi đổi, cấp lại, đào tạo nâng hạng.


Tóm lại: Giấy phép lái xe quân sự có 12 điểm. Điểm bị trừ khi vi phạm luật giao thông. Nếu bị trừ hết điểm, sau 6 tháng có thể thi lại để được phục hồi 12 điểm. Khi đổi, cấp lại hoặc nâng hạng, điểm được giữ nguyên.  Thông tin này chỉ áp dụng cho giấy phép lái xe quân sự, không phải giấy phép lái xe dân sự.
","Mỗi giấy phép lái xe có 12 điểm; nếu bị trừ hết điểm, người lái xe phải tham gia kiểm tra phục hồi điểm.",0.8888888888888888,0.5389926049606926,1.0,0.9999999999
11,Người lái xe máy cần làm gì để phục hồi điểm giấy phép lái xe?,"['1. thẩm quyền phục hồi điểm giấy phép lái xe a) cục trưởng cục cảnh sát giao thông có trách nhiệm quản lý, vận hành cơ sở dữ liệu về xử lý vi phạm hành chính về trật tự, an toàn giao thông đường bộ để thực hiện cập nhật, tự động phục hồi điểm giấy phép lái xe đối với trường hợp quy định tại khoản 2 điều này; b) cục trưởng cục cảnh sát giao thông, trưởng phòng cảnh sát giao thông nơi tổ chức kiểm tra kiến thức pháp luật về trật tự, an toàn giao thông đường bộ có thẩm quyền phục hồi điểm cho giấy phép lái xe đối với trường hợp quy định tại khoản 3 điều này. 2. trình tự, thủ tục phục hồi điểm giấy phép lái xe đối với trường hợp giấy phép lái xe chưa bị trừ hết điểm và không bị trừ điểm trong thời hạn 12 tháng từ ngày bị trừ điểm gần nhất a) khi đủ thời hạn 12 tháng, kể từ ngày bị trừ điểm giấy phép lái xe gần nhất, dữ liệu điểm giấy phép lái xe sẽ được tự động phục hồi đủ 12 điểm (gồm cả giấy phép lái xe đang trong thời hạn bị tước quyền sử dụng) và cập nhật tự động trong cơ sở dữ liệu về xử lý vi phạm hành chính về trật tự, an toàn giao thông đường bộ; b) ngay sau khi dữ liệu điểm giấy phép lái xe được phục hồi, cơ sở dữ liệu về xử lý vi phạm hành chính về trật tự, an toàn giao thông đường bộ sẽ tự động chuyển thông tin thông báo cho người được phục hồi điểm giấy phép lái xe biết việc phục hồi điểm theo quy định tại điểm c khoản này; c) việc thông báo phục hồi điểm giấy phép lái xe thực hiện bằng phương thức điện tử thông qua tài khoản của công dân đăng ký trên cổng dịch vụ công, ứng dụng giao thông trên thiết bị di động; đồng thời cập nhật thông tin về giấy phép lái xe được phục hồi điểm trên trang thông tin điện tử của cục cảnh sát giao thông. trường hợp giấy phép lái xe được thể hiện dưới hình thức thông điệp dữ liệu thì thực hiện cập nhật trạng thái phục hồi điểm giấy phép lái xe trong căn cước điện tử, tài khoản định danh điện tử trên ứng dụng định danh quốc gia. 3. trình tự, thủ tục phục hồi điểm giấy phép lái xe đối với trường hợp giấy phép lái xe bị trừ hết điểm a) sau khi người có giấy phép lái xe bị trừ hết điểm tham gia kiểm tra nội dung kiến thức pháp luật về trật tự, an toàn giao thông đường bộ và đạt yêu cầu, kết quả kiểm tra được cập nhật vào phần mềm kiểm tra kiến thức pháp luật về trật tự, an toàn giao thông đường bộ và đồng bộ dữ liệu với cơ sở dữ liệu về xử lý vi phạm hành chính về trật tự, an toàn giao thông đường bộ, dữ liệu điểm giấy phép lái xe sẽ được phục hồi đủ 12 điểm và cập nhật tự động trong cơ sở dữ liệu về xử lý vi phạm hành chính về trật tự, an toàn giao thông đường bộ; b) ngay sau khi dữ liệu điểm giấy phép lái xe được phục hồi đủ 12 điểm thì người có thẩm quyền quy định tại điểm b khoản 1 điều này thông báo cho người được phục hồi điểm giấy phép lái xe biết việc phục hồi điểm; c) việc thông báo phục hồi điểm giấy phép lái xe thực hiện bằng văn bản theo mẫu quy định của bộ trưởng bộ công an và được giao trực tiếp hoặc gửi qua dịch vụ bưu chính hoặc thực hiện thông báo bằng phương thức điện tử thông qua tài khoản của công dân đăng ký trên cổng dịch vụ công, ứng dụng giao thông trên thiết bị di động; đồng thời cập nhật thông tin về giấy phép lái xe được phục hồi điểm trên trang thông tin điện tử của cục cảnh sát giao thông. trường hợp giấy phép lái xe được thể hiện dưới hình thức thông điệp dữ liệu thì cơ quan, người có thẩm quyền thực hiện cập nhật trạng thái phục hồi điểm giấy phép lái xe trong căn cước điện tử, tài khoản định danh điện tử trên ứng dụng định danh quốc gia. chương iv điều khoản thi hành']","**Nguồn văn bản:** 168_2024_ND-CP_619502

**Tên văn bản:** Nghị định Quy định xử phạt vi phạm hành chính về trật tự, an toàn giao thông trong lĩnh vực giao thông đường bộ; trừ điểm, phục hồi điểm giấy phép lái xe

**Điều 51:** Thẩm quyền, trình tự, thủ tục phục hồi điểm giấy phép lái xe

**Nội dung:**

1. Thẩm quyền phục hồi điểm giấy phép lái xe

	a) Cục trưởng Cục Cảnh sát giao thông có trách nhiệm quản lý, vận hành cơ sở dữ liệu về xử lý vi phạm hành chính về trật tự, an toàn giao thông đường bộ để thực hiện cập nhật, tự động phục hồi điểm giấy phép lái xe đối với trường hợp quy định tại khoản 2 Điều này.

	b) Cục trưởng Cục Cảnh sát giao thông, Trưởng phòng Cảnh sát giao thông nơi tổ chức kiểm tra kiến thức pháp luật về trật tự, an toàn giao thông đường bộ có thẩm quyền phục hồi điểm cho giấy phép lái xe đối với trường hợp quy định tại khoản 3 Điều này.

2. Trình tự, thủ tục phục hồi điểm giấy phép lái xe đối với trường hợp giấy phép lái xe chưa bị trừ hết điểm và không bị trừ điểm trong thời hạn 12 tháng từ ngày bị trừ điểm gần nhất

	a) Khi đủ thời hạn 12 tháng, kể từ ngày bị trừ điểm giấy phép lái xe gần nhất, dữ liệu điểm giấy phép lái xe sẽ được tự động phục hồi đủ 12 điểm (gồm cả giấy phép lái xe đang trong thời hạn bị tước quyền sử dụng) và cập nhật tự động trong cơ sở dữ liệu về xử lý vi phạm hành chính về trật tự, an toàn giao thông đường bộ.

	b) Ngay sau khi dữ liệu điểm giấy phép lái xe được phục hồi, cơ sở dữ liệu về xử lý vi phạm hành chính về trật tự, an toàn giao thông đường bộ sẽ tự động chuyển thông tin thông báo cho người được phục hồi điểm giấy phép lái xe biết việc phục hồi điểm theo quy định tại điểm c khoản này.

	c) Việc thông báo phục hồi điểm giấy phép lái xe thực hiện bằng phương thức điện tử thông qua tài khoản của công dân đăng ký trên Cổng Dịch vụ công, ứng dụng giao thông trên thiết bị di động; đồng thời cập nhật thông tin về giấy phép lái xe được phục hồi điểm trên trang thông tin điện tử của Cục Cảnh sát giao thông. Trường hợp giấy phép lái xe được thể hiện dưới hình thức thông điệp dữ liệu thì thực hiện cập nhật trạng thái phục hồi điểm giấy phép lái xe trong căn cước điện tử, tài khoản định danh điện tử trên ứng dụng định danh quốc gia.


3. Trình tự, thủ tục phục hồi điểm giấy phép lái xe đối với trường hợp giấy phép lái xe bị trừ hết điểm

	a) Sau khi người có giấy phép lái xe bị trừ hết điểm tham gia kiểm tra nội dung kiến thức pháp luật về trật tự, an toàn giao thông đường bộ và đạt yêu cầu, kết quả kiểm tra được cập nhật vào phần mềm kiểm tra kiến thức pháp luật về trật tự, an toàn giao thông đường bộ và đồng bộ dữ liệu với cơ sở dữ liệu về xử lý vi phạm hành chính về trật tự, an toàn giao thông đường bộ, dữ liệu điểm giấy phép lái xe sẽ được phục hồi đủ 12 điểm và cập nhật tự động trong cơ sở dữ liệu về xử lý vi phạm hành chính về trật tự, an toàn giao thông đường bộ.

	b) Ngay sau khi dữ liệu điểm giấy phép lái xe được phục hồi đủ 12 điểm thì người có thẩm quyền quy định tại điểm b khoản 1 Điều này thông báo cho người được phục hồi điểm giấy phép lái xe biết việc phục hồi điểm.

	c) Việc thông báo phục hồi điểm giấy phép lái xe thực hiện bằng văn bản theo mẫu quy định của Bộ trưởng Bộ Công an và được giao trực tiếp hoặc gửi qua dịch vụ bưu chính hoặc thực hiện thông báo bằng phương thức điện tử thông qua tài khoản của công dân đăng ký trên Cổng Dịch vụ công, ứng dụng giao thông trên thiết bị di động; đồng thời cập nhật thông tin về giấy phép lái xe được phục hồi điểm trên trang thông tin điện tử của Cục Cảnh sát giao thông. Trường hợp giấy phép lái xe được thể hiện dưới hình thức thông điệp dữ liệu thì cơ quan, người có thẩm quyền thực hiện cập nhật trạng thái phục hồi điểm giấy phép lái xe trong căn cước điện tử, tài khoản định danh điện tử trên ứng dụng định danh quốc gia.


**Tóm lại:** Có hai trường hợp để phục hồi điểm giấy phép lái xe máy: 1) Nếu chưa bị trừ hết điểm, sau 12 tháng không vi phạm, điểm sẽ tự động được phục hồi. 2) Nếu bị trừ hết điểm, cần tham gia kiểm tra kiến thức luật giao thông đường bộ và đạt yêu cầu để được phục hồi điểm.
",Người lái xe máy phải làm kiểm tra lý thuyết theo các câu hỏi như khi thi bằng lái xe.,1.0,0.6350295758270951,1.0,0.9999999999
12,Người lái ô tô cần làm gì để phục hồi điểm giấy phép lái xe?,"['1. thẩm quyền phục hồi điểm giấy phép lái xe a) cục trưởng cục cảnh sát giao thông có trách nhiệm quản lý, vận hành cơ sở dữ liệu về xử lý vi phạm hành chính về trật tự, an toàn giao thông đường bộ để thực hiện cập nhật, tự động phục hồi điểm giấy phép lái xe đối với trường hợp quy định tại khoản 2 điều này; b) cục trưởng cục cảnh sát giao thông, trưởng phòng cảnh sát giao thông nơi tổ chức kiểm tra kiến thức pháp luật về trật tự, an toàn giao thông đường bộ có thẩm quyền phục hồi điểm cho giấy phép lái xe đối với trường hợp quy định tại khoản 3 điều này. 2. trình tự, thủ tục phục hồi điểm giấy phép lái xe đối với trường hợp giấy phép lái xe chưa bị trừ hết điểm và không bị trừ điểm trong thời hạn 12 tháng từ ngày bị trừ điểm gần nhất a) khi đủ thời hạn 12 tháng, kể từ ngày bị trừ điểm giấy phép lái xe gần nhất, dữ liệu điểm giấy phép lái xe sẽ được tự động phục hồi đủ 12 điểm (gồm cả giấy phép lái xe đang trong thời hạn bị tước quyền sử dụng) và cập nhật tự động trong cơ sở dữ liệu về xử lý vi phạm hành chính về trật tự, an toàn giao thông đường bộ; b) ngay sau khi dữ liệu điểm giấy phép lái xe được phục hồi, cơ sở dữ liệu về xử lý vi phạm hành chính về trật tự, an toàn giao thông đường bộ sẽ tự động chuyển thông tin thông báo cho người được phục hồi điểm giấy phép lái xe biết việc phục hồi điểm theo quy định tại điểm c khoản này; c) việc thông báo phục hồi điểm giấy phép lái xe thực hiện bằng phương thức điện tử thông qua tài khoản của công dân đăng ký trên cổng dịch vụ công, ứng dụng giao thông trên thiết bị di động; đồng thời cập nhật thông tin về giấy phép lái xe được phục hồi điểm trên trang thông tin điện tử của cục cảnh sát giao thông. trường hợp giấy phép lái xe được thể hiện dưới hình thức thông điệp dữ liệu thì thực hiện cập nhật trạng thái phục hồi điểm giấy phép lái xe trong căn cước điện tử, tài khoản định danh điện tử trên ứng dụng định danh quốc gia. 3. trình tự, thủ tục phục hồi điểm giấy phép lái xe đối với trường hợp giấy phép lái xe bị trừ hết điểm a) sau khi người có giấy phép lái xe bị trừ hết điểm tham gia kiểm tra nội dung kiến thức pháp luật về trật tự, an toàn giao thông đường bộ và đạt yêu cầu, kết quả kiểm tra được cập nhật vào phần mềm kiểm tra kiến thức pháp luật về trật tự, an toàn giao thông đường bộ và đồng bộ dữ liệu với cơ sở dữ liệu về xử lý vi phạm hành chính về trật tự, an toàn giao thông đường bộ, dữ liệu điểm giấy phép lái xe sẽ được phục hồi đủ 12 điểm và cập nhật tự động trong cơ sở dữ liệu về xử lý vi phạm hành chính về trật tự, an toàn giao thông đường bộ; b) ngay sau khi dữ liệu điểm giấy phép lái xe được phục hồi đủ 12 điểm thì người có thẩm quyền quy định tại điểm b khoản 1 điều này thông báo cho người được phục hồi điểm giấy phép lái xe biết việc phục hồi điểm; c) việc thông báo phục hồi điểm giấy phép lái xe thực hiện bằng văn bản theo mẫu quy định của bộ trưởng bộ công an và được giao trực tiếp hoặc gửi qua dịch vụ bưu chính hoặc thực hiện thông báo bằng phương thức điện tử thông qua tài khoản của công dân đăng ký trên cổng dịch vụ công, ứng dụng giao thông trên thiết bị di động; đồng thời cập nhật thông tin về giấy phép lái xe được phục hồi điểm trên trang thông tin điện tử của cục cảnh sát giao thông. trường hợp giấy phép lái xe được thể hiện dưới hình thức thông điệp dữ liệu thì cơ quan, người có thẩm quyền thực hiện cập nhật trạng thái phục hồi điểm giấy phép lái xe trong căn cước điện tử, tài khoản định danh điện tử trên ứng dụng định danh quốc gia. chương iv điều khoản thi hành']","**Nguồn văn bản:** 168_2024_ND-CP_619502

**Tên văn bản:** Nghị định Quy định xử phạt vi phạm hành chính về trật tự, an toàn giao thông trong lĩnh vực giao thông đường bộ; trừ điểm, phục hồi điểm giấy phép lái xe

**Điều 51:** Thẩm quyền, trình tự, thủ tục phục hồi điểm giấy phép lái xe

**Nội dung:**

1. Thẩm quyền phục hồi điểm giấy phép lái xe

	a) Cục trưởng Cục Cảnh sát giao thông có trách nhiệm quản lý, vận hành cơ sở dữ liệu về xử lý vi phạm hành chính về trật tự, an toàn giao thông đường bộ để thực hiện cập nhật, tự động phục hồi điểm giấy phép lái xe đối với trường hợp quy định tại khoản 2 Điều này.

	b) Cục trưởng Cục Cảnh sát giao thông, Trưởng phòng Cảnh sát giao thông nơi tổ chức kiểm tra kiến thức pháp luật về trật tự, an toàn giao thông đường bộ có thẩm quyền phục hồi điểm cho giấy phép lái xe đối với trường hợp quy định tại khoản 3 Điều này.

2. Trình tự, thủ tục phục hồi điểm giấy phép lái xe đối với trường hợp giấy phép lái xe chưa bị trừ hết điểm và không bị trừ điểm trong thời hạn 12 tháng từ ngày bị trừ điểm gần nhất

	a) Khi đủ thời hạn 12 tháng, kể từ ngày bị trừ điểm giấy phép lái xe gần nhất, dữ liệu điểm giấy phép lái xe sẽ được tự động phục hồi đủ 12 điểm (gồm cả giấy phép lái xe đang trong thời hạn bị tước quyền sử dụng) và cập nhật tự động trong cơ sở dữ liệu về xử lý vi phạm hành chính về trật tự, an toàn giao thông đường bộ.

	b) Ngay sau khi dữ liệu điểm giấy phép lái xe được phục hồi, cơ sở dữ liệu về xử lý vi phạm hành chính về trật tự, an toàn giao thông đường bộ sẽ tự động chuyển thông tin thông báo cho người được phục hồi điểm giấy phép lái xe biết việc phục hồi điểm theo quy định tại điểm c khoản này.

	c) Việc thông báo phục hồi điểm giấy phép lái xe thực hiện bằng phương thức điện tử thông qua tài khoản của công dân đăng ký trên Cổng Dịch vụ công, ứng dụng giao thông trên thiết bị di động; đồng thời cập nhật thông tin về giấy phép lái xe được phục hồi điểm trên trang thông tin điện tử của Cục Cảnh sát giao thông. Trường hợp giấy phép lái xe được thể hiện dưới hình thức thông điệp dữ liệu thì thực hiện cập nhật trạng thái phục hồi điểm giấy phép lái xe trong căn cước điện tử, tài khoản định danh điện tử trên ứng dụng định danh quốc gia.


3. Trình tự, thủ tục phục hồi điểm giấy phép lái xe đối với trường hợp giấy phép lái xe bị trừ hết điểm

	a) Sau khi người có giấy phép lái xe bị trừ hết điểm tham gia kiểm tra nội dung kiến thức pháp luật về trật tự, an toàn giao thông đường bộ và đạt yêu cầu, kết quả kiểm tra được cập nhật vào phần mềm kiểm tra kiến thức pháp luật về trật tự, an toàn giao thông đường bộ và đồng bộ dữ liệu với cơ sở dữ liệu về xử lý vi phạm hành chính về trật tự, an toàn giao thông đường bộ, dữ liệu điểm giấy phép lái xe sẽ được phục hồi đủ 12 điểm và cập nhật tự động trong cơ sở dữ liệu về xử lý vi phạm hành chính về trật tự, an toàn giao thông đường bộ.

	b) Ngay sau khi dữ liệu điểm giấy phép lái xe được phục hồi đủ 12 điểm thì người có thẩm quyền quy định tại điểm b khoản 1 Điều này thông báo cho người được phục hồi điểm giấy phép lái xe biết việc phục hồi điểm.

	c) Việc thông báo phục hồi điểm giấy phép lái xe thực hiện bằng văn bản theo mẫu quy định của Bộ trưởng Bộ Công an và được giao trực tiếp hoặc gửi qua dịch vụ bưu chính hoặc thực hiện thông báo bằng phương thức điện tử thông qua tài khoản của công dân đăng ký trên Cổng Dịch vụ công, ứng dụng giao thông trên thiết bị di động; đồng thời cập nhật thông tin về giấy phép lái xe được phục hồi điểm trên trang thông tin điện tử của Cục Cảnh sát giao thông. Trường hợp giấy phép lái xe được thể hiện dưới hình thức thông điệp dữ liệu thì cơ quan, người có thẩm quyền thực hiện cập nhật trạng thái phục hồi điểm giấy phép lái xe trong căn cước điện tử, tài khoản định danh điện tử trên ứng dụng định danh quốc gia.


**Tóm lại:** Có hai trường hợp để phục hồi điểm giấy phép lái xe: 1) Nếu chưa bị trừ hết điểm và không vi phạm trong 12 tháng, điểm sẽ tự động được phục hồi. 2) Nếu bị trừ hết điểm, cần tham gia kiểm tra kiến thức luật giao thông đường bộ và đạt yêu cầu để được phục hồi điểm.
",Người lái ô tô phải làm kiểm tra lý thuyết và mô phỏng theo các câu hỏi như khi thi bằng lái xe.,1.0,0.5588260791241608,0.0,0.0
13,Luật Giao thông Đường bộ 2025 có quy định gì mới về việc sử dụng điện thoại khi lái xe?,"['thực hiện trách nhiệm của chủ phương tiện giao thông đường bộ theo quy định của pháp luật về thanh toán điện tử giao thông đường bộ, pháp luật về thu phí sử dụng đường cao tốc.']","Không tìm thấy thông tin liên quan tới câu hỏi này.
",Luật cấm sử dụng điện thoại di động khi đang điều khiển phương tiện giao thông.,0.0,0.0,0.0,0.0
14,Quy định mới về tốc độ tối đa trong khu vực đô thị là gì?,"['xe máy chuyên dùng, xe gắn máy và các loại xe tương tự khi tham gia giao thông, tốc độ khai thác tối đa là 40 km/h.']","**Nguồn văn bản:** 38_2024_TT-BGTVT_622477

**Tên văn bản:** Thông tư Quy định về tốc độ và khoảng cách an toàn của xe cơ giới, xe máy chuyên dùng tham gia giao thông trên đường bộ

**Điều 7:** tốc độ khai thác tối đa cho phép đối với xe máy chuyên dùng, xe gắn máy và các loại xe tương tự tham gia giao thông trên đường bộ (trừ đường cao tốc)

**Nội dung:**

Xe máy chuyên dùng, xe gắn máy và các loại xe tương tự khi tham gia giao thông, tốc độ khai thác tối đa là 40 km/h.

**Tóm lại:** Tốc độ tối đa cho xe máy chuyên dùng, xe gắn máy và các loại xe tương tự (trừ đường cao tốc) là 40 km/h.  Context không đề cập đến tốc độ tối đa trong khu vực đô thị.
",Tốc độ tối đa trong khu vực đô thị được giảm từ 50 km/h xuống 40 km/h.,0.5,0.5043587342248778,0.0,0.0
15,Quy định mới về tốc độ tối đa ngoài khu vực đô thị là gì?,"['xe máy chuyên dùng, xe gắn máy và các loại xe tương tự khi tham gia giao thông, tốc độ khai thác tối đa là 40 km/h.']","**Nguồn văn bản:** 38_2024_TT-BGTVT_622477

**Tên văn bản:** Thông tư Quy định về tốc độ và khoảng cách an toàn của xe cơ giới, xe máy chuyên dùng tham gia giao thông trên đường bộ

**Điều 7:** tốc độ khai thác tối đa cho phép đối với xe máy chuyên dùng, xe gắn máy và các loại xe tương tự tham gia giao thông trên đường bộ (trừ đường cao tốc)

**Nội dung:**

Xe máy chuyên dùng, xe gắn máy và các loại xe tương tự khi tham gia giao thông, tốc độ khai thác tối đa là 40 km/h.

**Tóm lại:** Văn bản này quy định tốc độ tối đa cho xe máy chuyên dùng, xe gắn máy và các loại xe tương tự (trừ đường cao tốc) là 40 km/h. Tuy nhiên, câu hỏi của bạn là về tốc độ tối đa *ngoài khu vực đô thị*, và văn bản này không cung cấp thông tin về trường hợp này.
",Tốc độ tối đa ngoài khu vực đô thị được giảm từ 80 km/h xuống 70 km/h.,0.42857142857142855,0.0,0.0,0.0
16,Luật Giao thông Đường bộ 2025 có quy định gì về việc sử dụng đèn pha trong khu vực đô thị?,"['1. điều kiện hoạt động của xe thô sơ quy định tại điểm a, điểm b, điểm c, điểm e khoản 2 điều 34 luật trật tự, an toàn giao thông đường bộ bao gồm: a) hệ thống, bộ phận hãm có hiệu lực; b) có bộ phận phát âm thanh cảnh báo (còi, chuông); c) có đèn chiếu sáng hoặc tấm phản quang phía trước; phía sau phải có đèn tín hiệu hoặc tấm phản quang. trường hợp có quy định về tiêu chuẩn, quy chuẩn kỹ thuật đối với phương tiện xe thô sơ quy định tại khoản này thì thực hiện theo quy định của tiêu chuẩn, quy chuẩn kỹ thuật tương ứng. 2. đối với xe thô sơ quy định tại điểm d, điểm đ khoản 2 điều 34 luật trật tự, an toàn giao thông đường bộ có tấm phản quang hoặc thiết bị phát sáng vào ban đêm để nhận biết.']","Không tìm thấy thông tin liên quan tới câu hỏi này.
",Cấm sử dụng đèn pha trong khu vực đô thị để tránh gây chói mắt cho người tham gia giao thông khác.,0.0,0.0,0.0,0.0
17,Quy định mới về việc đỗ xe trên vỉa hè là gì?,"['1. phạt tiền từ 400.000 đồng đến 600.000 đồng đối với người điều khiển xe thực hiện một trong các hành vi vi phạm sau đây: a) không chấp hành hiệu lệnh, chỉ dẫn của biển báo hiệu, vạch kẻ đường, trừ các hành vi vi phạm quy định tại điểm a, điểm c, điểm d, điểm đ khoản 2; điểm a, điểm d, điểm đ, điểm e, điểm n, điểm o khoản 3; điểm a, điểm b, điểm đ, điểm e, điểm i, điểm k, điểm l khoản 4; điểm a, điểm b, điểm c, điểm d, điểm đ, điểm i, điểm k khoản 5; điểm a khoản 6; khoản 7; điểm b, điểm d khoản 9; điểm a khoản 10; điểm đ khoản 11 điều này; b) khi ra, vào vị trí dừng xe, đỗ xe không có tín hiệu báo cho người điều khiển phương tiện khác biết; c) không báo hiệu bằng đèn khẩn cấp hoặc không đặt biển cảnh báo “chú ý xe đỗ” theo quy định trong trường hợp gặp sự cố kỹ thuật (hoặc bất khả kháng khác) buộc phải đỗ xe chiếm một phần đường xe chạy hoặc tại nơi không được phép đỗ xe, trừ hành vi vi phạm quy định tại điểm c khoản 7 điều này; d) không gắn biển báo hiệu ở phía trước xe kéo, phía sau xe được kéo; điều khiển xe kéo rơ moóc không có biển báo hiệu theo quy định; đ) sử dụng còi trong thời gian từ 22 giờ ngày hôm trước đến 05 giờ ngày hôm sau trong khu đông dân cư, khu vực cơ sở khám bệnh, chữa bệnh, trừ các xe ưu tiên đang đi làm nhiệm vụ theo quy định. 2. phạt tiền từ 600.000 đồng đến 800.000 đồng đối với người điều khiển xe thực hiện một trong các hành vi vi phạm sau đây: a) chuyển làn đường không đúng nơi cho phép hoặc không có tín hiệu báo trước hoặc chuyển làn đường không đúng quy định “mỗi lần chuyển làn đường chỉ được phép chuyển sang một làn đường liền kề”, trừ các hành vi vi phạm quy định tại điểm g khoản 5 điều này; b) chở người trên buồng lái quá số lượng quy định; c) không tuân thủ các quy định về nhường đường tại nơi đường bộ giao nhau, trừ các hành vi vi phạm quy định tại điểm n, điểm o khoản 5 điều này; d) dừng xe, đỗ xe trên phần đường xe chạy ở đoạn đường ngoài đô thị nơi có lề đường rộng; dừng xe, đỗ xe không sát mép đường phía bên phải theo chiều đi ở nơi đường có lề đường hẹp hoặc không có lề đường; dừng xe, đỗ xe ngược với chiều lưu thông của làn đường; dừng xe, đỗ xe trên dải phân cách cố định ở giữa hai phần đường xe chạy; đỗ xe trên dốc không chèn bánh; đ) dừng xe không sát theo lề đường, vỉa hè phía bên phải theo chiều đi hoặc bánh xe gần nhất cách lề đường, vỉa hè quá 0,25 mét; dừng xe trên đường dành riêng cho xe buýt; dừng xe trên miệng cống thoát nước, miệng hầm của đường điện thoại, điện cao thế, chỗ dành riêng cho xe chữa cháy lấy nước; rời vị trí lái, tắt máy khi dừng xe (trừ trường hợp rời khỏi vị trí lái để đóng, mở cửa xe, xếp dỡ hàng hóa, kiểm tra kỹ thuật xe) hoặc rời vị trí lái khi dừng xe nhưng không sử dụng phanh đỗ xe (hoặc thực hiện biện pháp an toàn khác); dừng xe, đỗ xe không đúng vị trí quy định ở những đoạn có bố trí nơi dừng xe, đỗ xe; dừng xe, đỗ xe trên phần đường dành cho người đi bộ qua đường; dừng xe nơi có biển “cấm dừng xe và đỗ xe”, trừ hành vi vi phạm quy định tại điểm đ khoản 4, điểm c khoản 7 điều này. 3. phạt tiền từ 800.000 đồng đến 1.000.000 đồng đối với người điều khiển xe thực hiện một trong các hành vi vi phạm sau đây: a) điều khiển xe chạy quá tốc độ quy định từ 05 km/h đến dưới 10 km/h; b) sử dụng còi, rú ga liên tục; sử dụng còi hơi, sử dụng đèn chiếu xa khi gặp người đi bộ qua đường hoặc khi đi trên đoạn đường qua khu dân cư có hệ thống chiếu sáng đang hoạt động hoặc khi gặp xe đi ngược chiều (trừ trường hợp dải phân cách có khả năng chống chói) hoặc khi chuyển hướng xe tại nơi đường giao nhau, trừ các xe ưu tiên đang đi làm nhiệm vụ theo quy định; c) chuyển hướng không quan sát hoặc không bảo đảm khoảng cách an toàn với xe phía sau hoặc không giảm tốc độ hoặc không có tín hiệu báo hướng rẽ hoặc có tín hiệu báo hướng rẽ nhưng không sử dụng liên tục trong quá trình chuyển hướng (trừ trường hợp điều khiển xe đi theo hướng cong của đoạn đường bộ ở nơi đường không giao nhau cùng mức); d) không tuân thủ các quy định về dừng xe, đỗ xe tại nơi đường bộ giao nhau cùng mức với đường sắt; dừng xe, đỗ xe trong phạm vi bảo vệ công trình đường sắt, phạm vi an toàn của đường sắt; đ) dừng xe, đỗ xe tại vị trí: nơi đường bộ giao nhau hoặc trong phạm vi 05 mét tính từ mép đường giao nhau; điểm đón, trả khách; trước cổng hoặc trong phạm vi 05 mét hai bên cổng trụ sở cơ quan, tổ chức có bố trí đường cho xe ra, vào; nơi phần đường có bề rộng chỉ đủ cho một làn xe cơ giới; che khuất biển báo hiệu đường bộ, đèn tín hiệu giao thông; nơi mở dải phân cách giữa; cách xe ô tô đang đỗ ngược chiều dưới 20 mét trên đường phố hẹp, dưới 40 mét trên đường có một làn xe cơ giới trên một chiều đường; e) đỗ xe không sát theo lề đường, vỉa hè phía bên phải theo chiều đi hoặc bánh xe gần nhất cách lề đường, vỉa hè quá 0,25 mét; đỗ xe trên đường dành riêng cho xe buýt; đỗ xe trên miệng cống thoát nước, miệng hầm của đường điện thoại, điện cao thế, chỗ dành riêng cho xe chữa cháy lấy nước; đỗ, để xe ở vỉa hè trái quy định của pháp luật; đỗ xe nơi có biển “cấm đỗ xe” hoặc biển “cấm dừng xe và đỗ xe”, trừ hành vi vi phạm quy định tại điểm đ khoản 4, điểm c khoản 7 điều này; g) không sử dụng hoặc sử dụng không đủ đèn chiếu sáng trong thời gian từ 18 giờ ngày hôm trước đến 06 giờ ngày hôm sau hoặc khi có sương mù, khói, bụi, trời mưa, thời tiết xấu làm hạn chế tầm nhìn; h) điều khiển xe ô tô kéo theo xe khác, vật khác (trừ trường hợp kéo theo một rơ moóc, sơ mi rơ moóc hoặc một xe ô tô, xe máy chuyên dùng khác khi xe này không tự chạy được); điều khiển xe ô tô đẩy xe khác, vật khác; điều khiển xe kéo rơ moóc, sơ mi rơ moóc kéo thêm rơ moóc hoặc xe khác, vật khác; không nối chắc chắn, an toàn giữa xe kéo và xe được kéo khi kéo nhau; i) chở người trên xe được kéo, trừ người điều khiển; k) không thắt dây đai an toàn khi điều khiển xe chạy trên đường; l) chở người trên xe ô tô không thắt dây đai an toàn (tại vị trí có trang bị dây đai an toàn) khi xe đang chạy; m) chở trẻ em dưới 10 tuổi và chiều cao dưới 1,35 mét trên xe ô tô ngồi cùng hàng ghế với người lái xe (trừ loại xe ô tô chỉ có một hàng ghế) hoặc không sử dụng thiết bị an toàn phù hợp cho trẻ em theo quy định; n) chạy trong hầm đường bộ không sử dụng đèn chiếu sáng gần; o) điều khiển xe chạy dưới tốc độ tối thiểu trên đoạn đường bộ có quy định tốc độ tối thiểu cho phép; p) điều khiển xe chạy tốc độ thấp hơn các xe khác đi cùng chiều mà không đi về làn đường bên phải chiều đi của mình, trừ trường hợp các xe khác đi cùng chiều chạy quá tốc độ quy định. 4. phạt tiền từ 2.000.000 đồng đến 3.000.000 đồng đối với người điều khiển xe thực hiện một trong các hành vi vi phạm sau đây: a) điều khiển xe không đủ điều kiện đã thu phí theo hình thức điện tử tự động không dừng (xe không gắn thẻ đầu cuối) đi vào làn đường dành riêng thu phí theo hình thức điện tử tự động không dừng tại các trạm thu phí; b) dừng xe, đỗ xe tại vị trí: bên trái đường một chiều hoặc bên trái (theo hướng lưu thông) của đường đôi; trên đoạn đường cong hoặc gần đầu dốc nơi tầm nhìn bị che khuất; trên cầu (trừ trường hợp tổ chức giao thông cho phép), gầm cầu vượt (trừ những nơi cho phép dừng xe, đỗ xe), song song với một xe khác đang dừng, đỗ, trừ hành vi vi phạm quy định tại điểm c khoản 7 điều này; c) không thực hiện biện pháp bảo đảm an toàn theo quy định khi xe ô tô bị hư hỏng ngay tại nơi đường bộ giao nhau cùng mức với đường sắt; d) không nhường đường cho xe xin vượt khi có đủ điều kiện an toàn; đ) lùi xe, quay đầu xe trong hầm đường bộ; dừng xe, đỗ xe trong hầm đường bộ không đúng nơi quy định; không có báo hiệu bằng đèn khẩn cấp, không đặt biển cảnh báo ""chú ý xe đỗ"" (hoặc đèn cảnh báo) về phía sau xe khoảng cách đảm bảo an toàn khi dừng xe, đỗ xe trong hầm đường bộ trong trường hợp gặp sự cố kỹ thuật hoặc bất khả kháng khác buộc phải dừng xe, đỗ xe; e) lùi xe ở đường một chiều, đường có biển “cấm đi ngược chiều”, khu vực cấm dừng, trên phần đường dành cho người đi bộ qua đường, nơi đường bộ giao nhau, nơi đường bộ giao nhau cùng mức với đường sắt, nơi tầm nhìn bị che khuất; lùi xe không quan sát hai bên, phía sau xe hoặc không có tín hiệu lùi xe, trừ hành vi vi phạm quy định tại điểm đ khoản 11 điều này; g) điều khiển xe có liên quan trực tiếp đến vụ tai nạn giao thông mà không dừng ngay phương tiện, không giữ nguyên hiện trường, không trợ giúp người bị nạn, trừ hành vi vi phạm quy định tại khoản 8 điều này; h) xe được quyền ưu tiên lắp đặt, sử dụng thiết bị phát tín hiệu ưu tiên không đúng quy định hoặc sử dụng thiết bị phát tín hiệu ưu tiên mà không có giấy phép của cơ quan có thẩm quyền cấp hoặc có giấy phép của cơ quan có thẩm quyền cấp nhưng không còn giá trị sử dụng theo quy định; i) quay đầu xe ở phần đường dành cho người đi bộ qua đường, trên cầu, đầu cầu, gầm cầu vượt, ngầm, tại nơi đường bộ giao nhau cùng mức với đường sắt, đường hẹp, đường dốc, đoạn đường cong tầm nhìn bị che khuất, trên đường một chiều, trừ khi có hiệu lệnh của người điều khiển giao thông hoặc chỉ dẫn của biển báo hiệu tạm thời hoặc tổ chức giao thông tại những khu vực này có bố trí nơi quay đầu xe; k) quay đầu xe tại nơi có biển báo hiệu có nội dung cấm quay đầu đối với loại phương tiện đang điều khiển; điều khiển xe rẽ trái tại nơi có biển báo hiệu có nội dung cấm rẽ trái đối với loại phương tiện đang điều khiển; điều khiển xe rẽ phải tại nơi có biển báo hiệu có nội dung cấm rẽ phải đối với loại phương tiện đang điều khiển; l) không giữ khoảng cách an toàn để xảy ra va chạm với xe chạy liền trước hoặc không giữ khoảng cách theo quy định của biển báo hiệu “cự ly tối thiểu giữa hai xe”, trừ các hành vi vi phạm quy định tại điểm d khoản 5 điều này. 5. phạt tiền từ 4.000.000 đồng đến 6.000.000 đồng đối với người điều khiển xe thực hiện một trong các hành vi vi phạm sau đây: a) vượt xe trong những trường hợp không được vượt, vượt xe tại đoạn đường có biển báo hiệu có nội dung cấm vượt (đối với loại phương tiện đang điều khiển); không có tín hiệu trước khi vượt hoặc có tín hiệu vượt xe nhưng không sử dụng trong suốt quá trình vượt xe; vượt bên phải xe khác trong trường hợp không được phép; b) điều khiển xe không đi bên phải theo chiều đi của mình; đi không đúng phần đường hoặc làn đường quy định (làn cùng chiều hoặc làn ngược chiều) trừ hành vi quy định tại điểm a khoản 4 điều này; điều khiển xe đi qua dải phân cách cố định ở giữa hai phần đường xe chạy; c) tránh xe đi ngược chiều không đúng quy định (trừ hành vi vi phạm sử dụng đèn chiếu xa khi tránh xe đi ngược chiều quy định tại điểm b khoản 3 điều này); không nhường đường cho xe đi ngược chiều theo quy định tại nơi đường hẹp, đường dốc, nơi có chướng ngại vật; d) không tuân thủ quy định khi vào hoặc ra đường cao tốc; điều khiển xe chạy ở làn dừng xe khẩn cấp hoặc phần lề đường của đường cao tốc; không tuân thủ quy định về khoảng cách an toàn đối với xe chạy liền trước khi chạy trên đường cao tốc; đ) điều khiển xe chạy quá tốc độ quy định từ 10 km/h đến 20 km/h; e) xe không được quyền ưu tiên lắp đặt, sử dụng thiết bị phát tín hiệu của xe được quyền ưu tiên; g) chuyển làn đường không đúng nơi cho phép hoặc không có tín hiệu báo trước hoặc chuyển làn đường không đúng quy định “mỗi lần chuyển làn đường chỉ được phép chuyển sang một làn đường liền kề” khi chạy trên đường cao tốc; h) dùng tay cầm và sử dụng điện thoại hoặc các thiết bị điện tử khác khi điều khiển phương tiện tham gia giao thông đang di chuyển trên đường bộ; i) đi vào khu vực cấm, đường có biển báo hiệu có nội dung cấm đi vào đối với loại phương tiện đang điều khiển, trừ các hành vi vi phạm quy định tại điểm d khoản 9, điểm đ khoản 11 điều này, hành vi bị cấm đi vào công trình thủy lợi và các trường hợp xe ưu tiên đang đi làm nhiệm vụ khẩn cấp theo quy định; k) dừng xe, đỗ xe, quay đầu xe trái quy định gây ùn tắc giao thông; l) chuyển hướng không nhường quyền đi trước cho: người đi bộ, xe lăn của người khuyết tật qua đường tại nơi có vạch kẻ đường dành cho người đi bộ; xe thô sơ đang đi trên phần đường dành cho xe thô sơ; m) chuyển hướng không nhường đường cho: các xe đi ngược chiều; người đi bộ, xe thô sơ đang qua đường tại nơi không có vạch kẻ đường cho người đi bộ; n) không giảm tốc độ (hoặc dừng lại) và nhường đường khi điều khiển xe đi từ đường không ưu tiên ra đường ưu tiên, từ đường nhánh ra đường chính; o) không giảm tốc độ và nhường đường cho xe đi đến từ bên phải tại nơi đường giao nhau không có báo hiệu đi theo vòng xuyến; không giảm tốc độ và nhường đường cho xe đi đến từ bên trái tại nơi đường giao nhau có báo hiệu đi theo vòng xuyến; p) chở người trên thùng xe trái quy định; chở người trên nóc xe; để người đu bám ở cửa xe, bên ngoài thành xe khi xe đang chạy; q) mở cửa xe, để cửa xe mở không bảo đảm an toàn. 6. phạt tiền từ 6.000.000 đồng đến 8.000.000 đồng đối với người điều khiển xe thực hiện một trong các hành vi vi phạm sau đây: a) điều khiển xe chạy quá tốc độ quy định trên 20 km/h đến 35 km/h; b) không nhường đường hoặc gây cản trở xe được quyền ưu tiên đang phát tín hiệu ưu tiên đi làm nhiệm vụ; c) điều khiển xe trên đường mà trong máu hoặc hơi thở có nồng độ cồn nhưng chưa vượt quá 50 miligam/100 mililít máu hoặc chưa vượt quá 0,25 miligam/1 lít khí thở; d) điều khiển xe đi trên vỉa hè, trừ trường hợp điều khiển xe đi qua vỉa hè để vào nhà, cơ quan. 7. phạt tiền từ 12.000.000 đồng đến 14.000.000 đồng đối với người điều khiển xe thực hiện một trong các hành vi vi phạm sau đây: a) điều khiển xe chạy quá tốc độ quy định trên 35 km/h; b) điều khiển xe chở người bốn bánh có gắn động cơ, xe chở hàng bốn bánh có gắn động cơ đi vào đường cao tốc; c) dừng xe, đỗ xe trên đường cao tốc không đúng nơi quy định; không có báo hiệu bằng đèn khẩn cấp khi gặp sự cố kỹ thuật hoặc bất khả kháng khác buộc phải dừng xe, đỗ xe ở làn dừng xe khẩn cấp trên đường cao tốc; không có báo hiệu bằng đèn khẩn cấp, không đặt biển cảnh báo “chú ý xe đỗ” (hoặc đèn cảnh báo) về phía sau xe khoảng cách tối thiểu 150 mét khi dừng xe, đỗ xe trong trường hợp gặp sự cố kỹ thuật hoặc bất khả kháng khác buộc phải dừng xe, đỗ xe trên một phần làn đường xe chạy trên đường cao tốc. 8. phạt tiền từ 16.000.000 đồng đến 18.000.000 đồng đối với người điều khiển xe thực hiện hành vi vi phạm gây tai nạn giao thông không dừng ngay phương tiện, không giữ nguyên hiện trường, không trợ giúp người bị nạn, không ở lại hiện trường hoặc không đến trình báo ngay với cơ quan công an, ủy ban nhân dân nơi gần nhất. 9. phạt tiền từ 18.000.000 đồng đến 20.000.000 đồng đối với người điều khiển xe thực hiện một trong các hành vi vi phạm sau đây: a) điều khiển xe trên đường mà trong máu hoặc hơi thở có nồng độ cồn vượt quá 50 miligam đến 80 miligam/100 mililít máu hoặc vượt quá 0,25 miligam đến 0,4 miligam/1 lít khí thở; b) không chấp hành hiệu lệnh của đèn tín hiệu giao thông; c) không chấp hành hiệu lệnh, hướng dẫn của người điều khiển giao thông hoặc người kiểm soát giao thông; d) đi ngược chiều của đường một chiều, đi ngược chiều trên đường có biển ""cấm đi ngược chiều”, trừ các hành vi vi phạm quy định tại điểm đ khoản 11 điều này và các trường hợp xe ưu tiên đang đi làm nhiệm vụ khẩn cấp theo quy định. 10. phạt tiền từ 20.000.000 đồng đến 22.000.000 đồng đối với người điều khiển xe thực hiện một trong các hành vi vi phạm sau đây: a) điều khiển xe không quan sát, giảm tốc độ hoặc dừng lại để bảo đảm an toàn theo quy định mà gây tai nạn giao thông; điều khiển xe chạy quá tốc độ quy định gây tai nạn giao thông; dừng xe, đỗ xe, quay đầu xe, lùi xe, tránh xe, vượt xe, chuyển hướng, chuyển làn đường không đúng quy định gây tai nạn giao thông; không đi đúng phần đường, làn đường, không giữ khoảng cách an toàn giữa hai xe theo quy định gây tai nạn giao thông hoặc đi vào đường có biển báo hiệu có nội dung cấm đi vào đối với loại phương tiện đang điều khiển gây tai nạn giao thông, trừ các hành vi vi phạm quy định tại điểm đ khoản 11 điều này; b) vi phạm quy định tại một trong các điểm, khoản sau của điều này mà gây tai nạn giao thông: điểm a, điểm b, điểm c, điểm d, điểm đ khoản 1; điểm c khoản 2; điểm b, điểm g, điểm h, điểm n, điểm o, điểm p, khoản 3; điểm a, điểm c, điểm d khoản 4; điểm c, điểm d, điểm e, điểm h, điểm n, điểm o, điểm q khoản 5; điểm b khoản 7; điểm b, điểm c, điểm d khoản 9 điều này. 11. phạt tiền từ 30.000.000 đồng đến 40.000.000 đồng đối với người điều khiển xe thực hiện một trong các hành vi vi phạm sau đây: a) điều khiển xe trên đường mà trong máu hoặc hơi thở có nồng độ cồn vượt quá 80 miligam/100 mililít máu hoặc vượt quá 0,4 miligam/1 lít khí thở; b) không chấp hành yêu cầu kiểm tra về nồng độ cồn của người thi hành công vụ; c) điều khiển xe trên đường mà trong cơ thể có chất ma túy hoặc chất kích thích khác mà pháp luật cấm sử dụng; d) không chấp hành yêu cầu kiểm tra về chất ma túy hoặc chất kích thích khác mà pháp luật cấm sử dụng của người thi hành công vụ; đ) điều khiển xe đi ngược chiều trên đường cao tốc, lùi xe trên đường cao tốc, quay đầu xe trên đường cao tốc, trừ các xe ưu tiên đang đi làm nhiệm vụ khẩn cấp theo quy định. 12. phạt tiền từ 40.000.000 đồng đến 50.000.000 đồng đối với người điều khiển xe thực hiện hành vi điều khiển xe lạng lách, đánh võng trên đường bộ; chạy quá tốc độ đuổi nhau trên đường bộ; dùng chân điều khiển vô lăng xe khi xe đang chạy trên đường bộ. 13. phạt tiền từ 50.000.000 đồng đến 70.000.000 đồng đối với người điều khiển xe thực hiện hành vi vi phạm quy định tại khoản 12 điều này mà gây tai nạn giao thông. 14. tịch thu phương tiện đối với người điều khiển xe tái phạm hành vi điều khiển xe lạng lách, đánh võng quy định tại khoản 12 điều này. 15. ngoài việc bị phạt tiền, người điều khiển xe thực hiện hành vi vi phạm còn bị áp dụng các hình thức xử phạt bổ sung sau đây: a) thực hiện hành vi quy định tại điểm e khoản 5 điều này còn bị tịch thu thiết bị phát tín hiệu ưu tiên lắp đặt, sử dụng trái quy định; b) thực hiện hành vi quy định tại khoản 12 điều này bị tước quyền sử dụng giấy phép lái xe từ 10 tháng đến 12 tháng; c) thực hiện hành vi quy định tại điểm a, điểm b, điểm c, điểm d khoản 11; khoản 13; khoản 14 điều này bị tước quyền sử dụng giấy phép lái xe từ 22 tháng đến 24 tháng. 16. ngoài việc bị áp dụng hình thức xử phạt, người điều khiển xe thực hiện hành vi vi phạm còn bị trừ điểm giấy phép lái xe như sau: a) thực hiện hành vi quy định tại điểm h, điểm i khoản 3; điểm a, điểm b, điểm c, điểm d, điểm đ, điểm g khoản 4; điểm a, điểm b, điểm c, điểm d, điểm đ, điểm e, điểm g, điểm i, điểm k, điểm n, điểm o khoản 5 điều này bị trừ điểm giấy phép lái xe 02 điểm; b) thực hiện hành vi quy định tại điểm h khoản 5; khoản 6; điểm b khoản 7; điểm b, điểm c, điểm d khoản 9 điều này bị trừ điểm giấy phép lái xe 04 điểm; c) thực hiện hành vi quy định tại điểm p khoản 5; điểm a, điểm c khoản 7; khoản 8 điều này bị trừ điểm giấy phép lái xe 06 điểm; d) thực hiện hành vi quy định tại điểm a khoản 9, khoản 10, điểm đ khoản 11 điều này bị trừ điểm giấy phép lái xe 10 điểm.']","**Nguồn văn bản:** 168_2024_ND-CP_619502

**Tên văn bản:** Nghị định Quy định xử phạt vi phạm hành chính về trật tự, an toàn giao thông trong lĩnh vực giao thông đường bộ; trừ điểm, phục hồi điểm giấy phép lái xe

**Điều 6:** xử phạt, trừ điểm giấy phép lái xe của người điều khiển xe ô tô, xe chở người bốn bánh có gắn động cơ, xe chở hàng bốn bánh có gắn động cơ và các loại xe tương tự xe ô tô vi phạm quy tắc giao thông đường bộ

**Nội dung:**

2. Phạt tiền từ 600.000 đồng đến 800.000 đồng đối với người điều khiển xe thực hiện một trong các hành vi vi phạm sau đây:

	a) Chuyển làn đường không đúng nơi cho phép hoặc không có tín hiệu báo trước hoặc chuyển làn đường không đúng quy định “mỗi lần chuyển làn đường chỉ được phép chuyển sang một làn đường liền kề”, trừ các hành vi vi phạm quy định tại điểm g khoản 5 điều này.

	b) Chở người trên buồng lái quá số lượng quy định.

	c) Không tuân thủ các quy định về nhường đường tại nơi đường bộ giao nhau, trừ các hành vi vi phạm quy định tại điểm n, điểm o khoản 5 điều này.

	d) Dừng xe, đỗ xe trên phần đường xe chạy ở đoạn đường ngoài đô thị nơi có lề đường rộng; dừng xe, đỗ xe không sát mép đường phía bên phải theo chiều đi ở nơi đường có lề đường hẹp hoặc không có lề đường; dừng xe, đỗ xe ngược với chiều lưu thông của làn đường; dừng xe, đỗ xe trên dải phân cách cố định ở giữa hai phần đường xe chạy; đỗ xe trên dốc không chèn bánh.

	đ) Dừng xe không sát theo lề đường, vỉa hè phía bên phải theo chiều đi hoặc bánh xe gần nhất cách lề đường, vỉa hè quá 0,25 mét; dừng xe trên đường dành riêng cho xe buýt; dừng xe trên miệng cống thoát nước, miệng hầm của đường điện thoại, điện cao thế, chỗ dành riêng cho xe chữa cháy lấy nước; rời vị trí lái, tắt máy khi dừng xe (trừ trường hợp rời khỏi vị trí lái để đóng, mở cửa xe, xếp dỡ hàng hóa, kiểm tra kỹ thuật xe) hoặc rời vị trí lái khi dừng xe nhưng không sử dụng phanh đỗ xe (hoặc thực hiện biện pháp an toàn khác); dừng xe, đỗ xe không đúng vị trí quy định ở những đoạn có bố trí nơi dừng xe, đỗ xe; dừng xe, đỗ xe trên phần đường dành cho người đi bộ qua đường; dừng xe nơi có biển “cấm dừng xe và đỗ xe”, trừ hành vi vi phạm quy định tại điểm đ khoản 4, điểm c khoản 7 điều này.


3. Phạt tiền từ 800.000 đồng đến 1.000.000 đồng đối với người điều khiển xe thực hiện một trong các hành vi vi phạm sau đây:
    
    a) Điều khiển xe chạy quá tốc độ quy định từ 05 km/h đến dưới 10 km/h.

    b) Sử dụng còi, rú ga liên tục; sử dụng còi hơi, sử dụng đèn chiếu xa khi gặp người đi bộ qua đường hoặc khi đi trên đoạn đường qua khu dân cư có hệ thống chiếu sáng đang hoạt động hoặc khi gặp xe đi ngược chiều (trừ trường hợp dải phân cách có khả năng chống chói) hoặc khi chuyển hướng xe tại nơi đường giao nhau, trừ các xe ưu tiên đang đi làm nhiệm vụ theo quy định.

    c) Chuyển hướng không quan sát hoặc không bảo đảm khoảng cách an toàn với xe phía sau hoặc không giảm tốc độ hoặc không có tín hiệu báo hướng rẽ hoặc có tín hiệu báo hướng rẽ nhưng không sử dụng liên tục trong quá trình chuyển hướng (trừ trường hợp điều khiển xe đi theo hướng cong của đoạn đường bộ ở nơi đường không giao nhau cùng mức).

    d) Không tuân thủ các quy định về dừng xe, đỗ xe tại nơi đường bộ giao nhau cùng mức với đường sắt; dừng xe, đỗ xe trong phạm vi bảo vệ công trình đường sắt, phạm vi an toàn của đường sắt.

    đ) Dừng xe, đỗ xe tại vị trí: Nơi đường bộ giao nhau hoặc trong phạm vi 05 mét tính từ mép đường giao nhau; điểm đón, trả khách; trước cổng hoặc trong phạm vi 05 mét hai bên cổng trụ sở cơ quan, tổ chức có bố trí đường cho xe ra, vào; nơi phần đường có bề rộng chỉ đủ cho một làn xe cơ giới; che khuất biển báo hiệu đường bộ, đèn tín hiệu giao thông; nơi mở dải phân cách giữa; cách xe ô tô đang đỗ ngược chiều dưới 20 mét trên đường phố hẹp, dưới 40 mét trên đường có một làn xe cơ giới trên một chiều đường.

    e) Đỗ xe không sát theo lề đường, vỉa hè phía bên phải theo chiều đi hoặc bánh xe gần nhất cách lề đường, vỉa hè quá 0,25 mét; đỗ xe trên đường dành riêng cho xe buýt; đỗ xe trên miệng cống thoát nước, miệng hầm của đường điện thoại, điện cao thế, chỗ dành riêng cho xe chữa cháy lấy nước; đỗ, để xe ở vỉa hè trái quy định của pháp luật; đỗ xe nơi có biển “cấm đỗ xe” hoặc biển “cấm dừng xe và đỗ xe”, trừ hành vi vi phạm quy định tại điểm đ khoản 4, điểm c khoản 7 điều này.


6. Phạt tiền từ 6.000.000 đồng đến 8.000.000 đồng đối với người điều khiển xe thực hiện một trong các hành vi vi phạm sau đây:

	a) Điều khiển xe chạy quá tốc độ quy định trên 20 km/h đến 35 km/h.

	b) Không nhường đường hoặc gây cản trở xe được quyền ưu tiên đang phát tín hiệu ưu tiên đi làm nhiệm vụ.

	c) Điều khiển xe trên đường mà trong máu hoặc hơi thở có nồng độ cồn nhưng chưa vượt quá 50 miligam/100 mililít máu hoặc chưa vượt quá 0,25 miligam/1 lít khí thở.

	d) Điều khiển xe đi trên vỉa hè, trừ trường hợp điều khiển xe đi qua vỉa hè để vào nhà, cơ quan.


**Tóm lại:** Đỗ xe ở vỉa hè trái quy định sẽ bị phạt tiền từ 800.000 đồng đến 1.000.000 đồng. Đi trên vỉa hè (trừ trường hợp vào nhà, cơ quan) bị phạt từ 6.000.000 đồng đến 8.000.000 đồng.  Dừng xe không sát lề đường, vỉa hè hoặc bánh xe cách lề đường, vỉa hè quá 0,25m bị phạt từ 600.000 đồng đến 800.000 đồng.
","Cấm đỗ xe trên vỉa hè, trừ những nơi có biển báo cho phép.",1.0,0.28547576988423734,0.0,0.9999999999
18,Luật Giao thông Đường bộ 2025 có quy định gì về việc sử dụng làn đường dành cho xe buýt?,"['1. dừng xe là trạng thái đứng yên tạm thời của xe trong một khoảng thời gian cần thiết đủ để cho người lên xe, xuống xe, xếp dỡ hàng hóa, kiểm tra kỹ thuật xe hoặc hoạt động khác. khi dừng xe không được tắt máy và không được rời khỏi vị trí lái, trừ trường hợp rời khỏi vị trí lái để đóng, mở cửa xe, xếp dỡ hàng hóa, kiểm tra kỹ thuật xe nhưng phải sử dụng phanh đỗ xe hoặc thực hiện biện pháp an toàn khác. 2. đỗ xe là trạng thái đứng yên của xe không giới hạn thời gian. khi đỗ xe, người điều khiển phương tiện tham gia giao thông đường bộ chỉ được rời khỏi xe khi đã sử dụng phanh đỗ xe hoặc thực hiện biện pháp an toàn khác. xe đỗ trên đoạn đường dốc phải đánh lái về phía lề đường, chèn bánh. 3. người điều khiển phương tiện tham gia giao thông đường bộ khi dừng xe, đỗ xe trên đường phải thực hiện các quy định sau đây: a) có tín hiệu báo cho người điều khiển phương tiện tham gia giao thông đường bộ khác biết khi ra, vào vị trí dừng xe, đỗ xe; b) không làm ảnh hưởng đến người đi bộ và các phương tiện tham gia giao thông đường bộ. 4. người điều khiển phương tiện tham gia giao thông đường bộ không được dừng xe, đỗ xe tại các vị trí sau đây: a) bên trái đường một chiều; b) trên đoạn đường cong hoặc gần đầu dốc mà tầm nhìn bị che khuất; c) trên cầu, trừ những trường hợp tổ chức giao thông cho phép; d) gầm cầu vượt, trừ những nơi cho phép dừng xe, đỗ xe; đ) song song cùng chiều với một xe khác đang dừng, đỗ trên đường; e) cách xe ô tô đang đỗ ngược chiều dưới 20 mét trên đường phố hẹp, \ndưới 40 mét trên đường có một làn xe cơ giới trên một chiều đường; g) trên phần đường dành cho người đi bộ qua đường; h) nơi đường giao nhau và trong phạm vi 05 mét tính từ mép đường giao nhau; i) điểm đón, trả khách; k) trước cổng và trong phạm vi 05 mét hai bên cổng trụ sở cơ quan, tổ chức có bố trí đường cho xe ra, vào; l) tại nơi phần đường có chiều rộng chỉ đủ cho một làn xe cơ giới; m) trong phạm vi an toàn của đường sắt; n) che khuất biển báo hiệu đường bộ, đèn tín hiệu giao thông; o) trên đường dành riêng cho xe buýt, trên miệng cống thoát nước, miệng hầm của đường điện thoại, điện cao thế, chỗ dành riêng cho xe chữa cháy lấy nước; trên lòng đường, vỉa hè trái quy định của pháp luật. 5. trên đường bộ, người điều khiển phương tiện tham gia giao thông đường bộ chỉ được dừng xe, đỗ xe ở nơi có lề đường rộng hoặc khu đất ở bên ngoài phần đường xe chạy; trường hợp lề đường hẹp hoặc không có lề đường thì chỉ được dừng xe, đỗ xe sát mép đường phía bên phải theo chiều đi của mình. 6. trên đường phố, người điều khiển phương tiện tham gia giao thông đường bộ chỉ được dừng xe, đỗ xe sát theo lề đường, vỉa hè phía bên phải theo chiều đi của mình; bánh xe gần nhất không được cách xa lề đường, vỉa hè quá 0,25 mét và không gây cản trở, nguy hiểm cho người và phương tiện tham gia giao thông đường bộ. 7. trong trường hợp gặp sự cố kỹ thuật hoặc bất khả kháng khác buộc phải đỗ xe, khi đỗ xe chiếm một phần đường xe chạy hoặc tại nơi không được phép đỗ, phải có báo hiệu bằng đèn khẩn cấp hoặc đặt biển cảnh báo về phía sau xe để người điều khiển phương tiện tham gia giao thông đường bộ khác biết.']","**Nguồn văn bản:** 36_2024_QH15_444251

**Tên văn bản:** Luật Trật tự, an toàn giao thông đường bộ

**Điều 18:** Dừng xe, đỗ xe

**Nội dung:**

1. Dừng xe là trạng thái đứng yên tạm thời của xe trong một khoảng thời gian cần thiết đủ để cho người lên xe, xuống xe, xếp dỡ hàng hóa, kiểm tra kỹ thuật xe hoặc hoạt động khác. 
Khi dừng xe không được tắt máy và không được rời khỏi vị trí lái, trừ trường hợp rời khỏi vị trí lái để đóng, mở cửa xe, xếp dỡ hàng hóa, kiểm tra kỹ thuật xe nhưng phải sử dụng phanh đỗ xe hoặc thực hiện biện pháp an toàn khác.

2. Đỗ xe là trạng thái đứng yên của xe không giới hạn thời gian. 
Khi đỗ xe, người điều khiển phương tiện tham gia giao thông đường bộ chỉ được rời khỏi xe khi đã sử dụng phanh đỗ xe hoặc thực hiện biện pháp an toàn khác. 
Xe đỗ trên đoạn đường dốc phải đánh lái về phía lề đường, chèn bánh.

3. Người điều khiển phương tiện tham gia giao thông đường bộ khi dừng xe, đỗ xe trên đường phải thực hiện các quy định sau đây:

	a) Có tín hiệu báo cho người điều khiển phương tiện tham gia giao thông đường bộ khác biết khi ra, vào vị trí dừng xe, đỗ xe.

	b) Không làm ảnh hưởng đến người đi bộ và các phương tiện tham gia giao thông đường bộ.

4. Người điều khiển phương tiện tham gia giao thông đường bộ không được dừng xe, đỗ xe tại các vị trí sau đây:

	a) Bên trái đường một chiều.

	b) Trên đoạn đường cong hoặc gần đầu dốc mà tầm nhìn bị che khuất.

	c) Trên cầu, trừ những trường hợp tổ chức giao thông cho phép.

	d) Gầm cầu vượt, trừ những nơi cho phép dừng xe, đỗ xe.

	đ) Song song cùng chiều với một xe khác đang dừng, đỗ trên đường.

	e) Cách xe ô tô đang đỗ ngược chiều dưới 20 mét trên đường phố hẹp, dưới 40 mét trên đường có một làn xe cơ giới trên một chiều đường.

	g) Trên phần đường dành cho người đi bộ qua đường.

	h) Nơi đường giao nhau và trong phạm vi 05 mét tính từ mép đường giao nhau.

	i) Điểm đón, trả khách.

	k) Trước cổng và trong phạm vi 05 mét hai bên cổng trụ sở cơ quan, tổ chức có bố trí đường cho xe ra, vào.

	l) Tại nơi phần đường có chiều rộng chỉ đủ cho một làn xe cơ giới.

	m) Trong phạm vi an toàn của đường sắt.

	n) Che khuất biển báo hiệu đường bộ, đèn tín hiệu giao thông.

	o) Trên đường dành riêng cho xe buýt, trên miệng cống thoát nước, miệng hầm của đường điện thoại, điện cao thế, chỗ dành riêng cho xe chữa cháy lấy nước; trên lòng đường, vỉa hè trái quy định của pháp luật.


5. Trên đường bộ, người điều khiển phương tiện tham gia giao thông đường bộ chỉ được dừng xe, đỗ xe ở nơi có lề đường rộng hoặc khu đất ở bên ngoài phần đường xe chạy; trường hợp lề đường hẹp hoặc không có lề đường thì chỉ được dừng xe, đỗ xe sát mép đường phía bên phải theo chiều đi của mình.

6. Trên đường phố, người điều khiển phương tiện tham gia giao thông đường bộ chỉ được dừng xe, đỗ xe sát theo lề đường, vỉa hè phía bên phải theo chiều đi của mình; bánh xe gần nhất không được cách xa lề đường, vỉa hè quá 0,25 mét và không gây cản trở, nguy hiểm cho người và phương tiện tham gia giao thông đường bộ.

7. Trong trường hợp gặp sự cố kỹ thuật hoặc bất khả kháng khác buộc phải đỗ xe, khi đỗ xe chiếm một phần đường xe chạy hoặc tại nơi không được phép đỗ, phải có báo hiệu bằng đèn khẩn cấp hoặc đặt biển cảnh báo về phía sau xe để người điều khiển phương tiện tham gia giao thông đường bộ khác biết.


Tóm lại: Không được dừng, đỗ xe trên đường dành riêng cho xe buýt (Khoản 4, Điều 18).
",Cấm các phương tiện không phải xe buýt sử dụng làn đường dành riêng cho xe buýt trong giờ cao điểm.,1.0,0.5013478676725198,0.0,0.0
19,"Quy định mới về việc sử dụng còi xe trong khu vực bệnh viện, trường học là gì?","['1. chỉ được sử dụng tín hiệu còi của phương tiện tham gia giao thông đường bộ trong các trường hợp sau đây: a) báo hiệu cho người tham gia giao thông đường bộ khi xuất hiện tình huống có thể mất an toàn giao thông; b) báo hiệu chuẩn bị vượt xe. 2. không sử dụng còi liên tục; không sử dụng còi có âm lượng không đúng quy định; không sử dụng còi trong thời gian từ 22 giờ ngày hôm trước đến 05 giờ ngày hôm sau trong khu đông dân cư, khu vực cơ sở khám bệnh, chữa bệnh, trừ xe ưu tiên.']","**Nguồn văn bản:** 36_2024_QH15_444251

**Tên văn bản:** Luật Trật tự, an toàn giao thông đường bộ

**Điều 21:** Sử dụng tín hiệu còi

**Nội dung:**

1. Chỉ được sử dụng tín hiệu còi của phương tiện tham gia giao thông đường bộ trong các trường hợp sau đây:

	a) Báo hiệu cho người tham gia giao thông đường bộ khi xuất hiện tình huống có thể mất an toàn giao thông.

	b) Báo hiệu chuẩn bị vượt xe.

2. Không sử dụng còi liên tục; không sử dụng còi có âm lượng không đúng quy định; không sử dụng còi trong thời gian từ 22 giờ ngày hôm trước đến 05 giờ ngày hôm sau trong khu đông dân cư, khu vực cơ sở khám bệnh, chữa bệnh, trừ xe ưu tiên.


Tóm lại: Không được sử dụng còi xe trong khu vực bệnh viện từ 22h hôm trước đến 5h hôm sau, trừ xe ưu tiên.  Việc sử dụng còi tại trường học không được đề cập cụ thể, tuy nhiên chỉ được bấm còi khi báo hiệu tình huống mất an toàn giao thông hoặc khi vượt.
","Cấm sử dụng còi xe trong khu vực bệnh viện, trường học để giảm tiếng ồn.",0.6363636363636364,0.5155458463483997,0.0,0.0
20,Luật Giao thông Đường bộ 2025 có quy định gì về việc sử dụng ghế trẻ em trên ô tô?,"['1. tuyên truyền, phổ biến pháp luật về trật tự, an toàn giao thông đường bộ được thực hiện thường xuyên, rộng rãi, phù hợp với các tầng lớp nhân dân, người nước ngoài trên lãnh thổ nước cộng hòa xã hội chủ nghĩa việt nam. 2. cơ quan quản lý nhà nước về trật tự, an toàn giao thông đường bộ chủ trì, phối hợp với các cơ quan, tổ chức, cá nhân có liên quan thực hiện tuyên truyền, phổ biến pháp luật về trật tự, an toàn giao thông đường bộ. 3. cơ quan thông tin, truyền thông có trách nhiệm tổ chức tuyên truyền, phổ biến pháp luật về trật tự, an toàn giao thông đường bộ trên các phương tiện thông tin, truyền thông đại chúng. 4. mặt trận tổ quốc việt nam và các tổ chức thành viên của mặt trận có trách nhiệm phối hợp với cơ quan hữu quan và chính quyền địa phương tuyên truyền, vận động nhân dân thực hiện pháp luật về trật tự, an toàn giao thông đường bộ. 5. bộ, cơ quan ngang bộ, ủy ban nhân dân các cấp, trong phạm vi nhiệm vụ, quyền hạn của mình, có trách nhiệm tổ chức tuyên truyền, phổ biến pháp luật về trật tự, an toàn giao thông đường bộ, có hình thức tuyên truyền, phổ biến phù hợp với từng đối tượng. 6. đơn vị lực lượng vũ trang nhân dân, cơ quan, tổ chức, cơ sở giáo dục có trách nhiệm tổ chức tuyên truyền, phổ biến pháp luật về trật tự, an toàn giao thông đường bộ cho đối tượng thuộc thẩm quyền quản lý. 7. thành viên trong gia đình có trách nhiệm tuyên truyền, nhắc nhở thành viên khác chấp hành pháp luật về trật tự, an toàn giao thông đường bộ, sử dụng dây đai an toàn, ghế dành cho trẻ em hoặc có người lớn ngồi cùng trẻ em phía sau khi chở trẻ em dưới 06 tuổi bằng xe gắn máy, xe mô tô.']","**Nguồn văn bản:** 36_2024_QH15_444251

**Tên văn bản:** Luật Trật tự, an toàn giao thông đường bộ

**Điều 5:** tuyên truyền, phổ biến pháp luật về trật tự, an toàn giao thông đường bộ

**Nội dung:**

1. Tuyên truyền, phổ biến pháp luật về trật tự, an toàn giao thông đường bộ được thực hiện thường xuyên, rộng rãi, phù hợp với các tầng lớp nhân dân, người nước ngoài trên lãnh thổ nước Cộng hòa xã hội chủ nghĩa Việt Nam.

2. Cơ quan quản lý nhà nước về trật tự, an toàn giao thông đường bộ chủ trì, phối hợp với các cơ quan, tổ chức, cá nhân có liên quan thực hiện tuyên truyền, phổ biến pháp luật về trật tự, an toàn giao thông đường bộ.

3. Cơ quan thông tin, truyền thông có trách nhiệm tổ chức tuyên truyền, phổ biến pháp luật về trật tự, an toàn giao thông đường bộ trên các phương tiện thông tin, truyền thông đại chúng.

4. Mặt trận Tổ quốc Việt Nam và các tổ chức thành viên của Mặt trận có trách nhiệm phối hợp với cơ quan hữu quan và chính quyền địa phương tuyên truyền, vận động nhân dân thực hiện pháp luật về trật tự, an toàn giao thông đường bộ.

5. Bộ, cơ quan ngang bộ, Ủy ban nhân dân các cấp, trong phạm vi nhiệm vụ, quyền hạn của mình, có trách nhiệm tổ chức tuyên truyền, phổ biến pháp luật về trật tự, an toàn giao thông đường bộ, có hình thức tuyên truyền, phổ biến phù hợp với từng đối tượng.

6. Đơn vị lực lượng vũ trang nhân dân, cơ quan, tổ chức, cơ sở giáo dục có trách nhiệm tổ chức tuyên truyền, phổ biến pháp luật về trật tự, an toàn giao thông đường bộ cho đối tượng thuộc thẩm quyền quản lý.

7. Thành viên trong gia đình có trách nhiệm tuyên truyền, nhắc nhở thành viên khác chấp hành pháp luật về trật tự, an toàn giao thông đường bộ, sử dụng dây đai an toàn, ghế dành cho trẻ em hoặc có người lớn ngồi cùng trẻ em phía sau khi chở trẻ em dưới 06 tuổi bằng xe gắn máy, xe mô tô.


**Tóm lại:**  Khi chở trẻ em dưới 6 tuổi bằng xe gắn máy, xe mô tô phải có người lớn ngồi cùng phía sau và sử dụng ghế dành cho trẻ em hoặc có người lớn ngồi cùng.  Luật cũng quy định trách nhiệm của các cơ quan, tổ chức, cá nhân và gia đình trong việc tuyên truyền, phổ biến pháp luật về trật tự an toàn giao thông đường bộ.
",Bắt buộc sử dụng ghế an toàn cho trẻ em dưới 12 tuổi khi ngồi trên ô tô.,0.7272727272727273,0.6113396890540206,0.0,0.0
21,Quy định mới về việc sử dụng dây an toàn trên ô tô là gì?,"['1. xe ô tô vận tải người nội bộ a) sử dụng xe ô tô phải đáp ứng các điều kiện tham gia giao thông theo quy định tại khoản 1 điều 35, khoản 1, khoản 2 và khoản 3 điều 40 của luật trật tự, an toàn giao thông đường bộ; phải có dây an toàn tại các vị trí ghế ngồi, có hướng dẫn về an toàn giao thông và thoát hiểm khi xảy ra sự cố trên xe; b) xe ô tô phải được niêm yết (dán cố định) cụm từ “xe nội bộ” làm bằng vật liệu phản quang trên kính phía trước và kính phía sau xe, kích thước tối thiểu của cụm từ “xe nội bộ” là 10 x 35 cm theo mẫu số 12 phụ lục xiii kèm theo nghị định này. trường hợp niêm yết bằng thiết bị điện tử phải bảo đảm cụm từ “xe nội bộ” luôn được bật sáng và có kích thước tối thiểu là 10 x 35 cm; c) phải thuộc quyền sở hữu hoặc quyền sử dụng hợp pháp theo hợp đồng thuê phương tiện bằng văn bản của đơn vị vận tải nội bộ với tổ chức, cá nhân theo quy định của pháp luật. trường hợp xe đăng ký thuộc sở hữu của thành viên hợp tác xã phải có hợp đồng dịch vụ giữa thành viên với hợp tác xã, trong đó quy định hợp tác xã có quyền, trách nhiệm và nghĩa vụ quản lý, sử dụng, điều hành xe ô tô thuộc sở hữu của thành viên hợp tác xã. 2. đơn vị hoạt động vận tải nội bộ bằng xe ô tô a) theo dõi, giám sát hoạt động của lái xe và phương tiện trong suốt quá trình hoạt động vận tải nội bộ; thực hiện chế độ bảo dưỡng sửa chữa phương tiện đúng quy định về bảo dưỡng kỹ thuật, sửa chữa phương tiện giao thông xe cơ giới đường bộ; kiểm tra điều kiện an toàn giao thông của xe và lái xe ô tô trước khi thực hiện nhiệm vụ vận chuyển; kiểm tra, giám sát hoạt động của xe ô tô và người lái xe trên hành trình; b) bảo đảm quy định về thời gian lái xe liên tục, thời gian làm việc trong ngày, thời gian nghỉ của người lái xe theo quy định tại khoản 1 điều 64 luật trật tự, an toàn giao thông đường bộ; c) tổ chức thực hiện bảo đảm công tác quản lý an toàn theo quy định tại khoản 10 điều 11 nghị định này; d) lập, cập nhật đầy đủ các nội dung quy định về quá trình hoạt động của phương tiện và lái xe thuộc đơn vị vào lý lịch phương tiện, lý lịch hành nghề lái xe, thực hiện theo dõi quá trình hoạt động và bảo dưỡng, sửa chữa phương tiện theo quy định về bảo dưỡng kỹ thuật, sửa chữa phương tiện giao thông xe cơ giới đường bộ; đ) không sử dụng xe ô tô chở người có giường nằm hai tầng để hoạt động trên các tuyến đường cấp v miền núi, vi miền núi; e) không được sử dụng người lái xe đang trong thời gian bị cấm hành nghề theo quy định của pháp luật; không sử dụng lái xe có dưới 02 năm kinh nghiệm điều khiển xe khách có trọng tải thiết kế từ 29 chỗ (không kể chỗ của người lái xe) trở lên để điều khiển xe có giường nằm hai tầng. tổ chức khám sức khỏe định kỳ cho người lái xe và sử dụng người lái xe đủ sức khỏe theo quy định. 3. người lái xe ô tô hoạt động vận tải nội bộ a) có trách nhiệm kiểm tra các điều kiện bảo đảm an toàn của xe, hướng dẫn cho người ngồi trên xe về an toàn giao thông và thoát hiểm khi gặp sự cố, yêu cầu người ngồi trên xe thắt dây an toàn trước khi cho xe khởi hành; kiểm tra việc sắp xếp, chằng buộc hành lý bảo đảm an toàn; b) thực hiện quy định về thời gian lái xe liên tục, thời gian làm việc trong ngày, thời gian nghỉ theo khoản 1 điều 64 luật trật tự, an toàn giao thông đường bộ; c) không được chở người trên mui, trong khoang chở hành lý hoặc để người đu, bám bên ngoài xe; không được chở hàng nguy hiểm, hàng cấm lưu hành, hàng lậu, động thực vật hoang dã; không được chở người, hành lý, hàng hóa vượt quá trọng tải, quá số người theo quy định; d) từ chối điều khiển phương tiện khi phát hiện phương tiện không bảo đảm các điều kiện về an toàn, không có hoặc không có đủ dây an toàn trên xe.']","**Nguồn văn bản:** 158_2024_ND-CP_636875

**Tên văn bản:** Nghị định Quy định về hoạt động vận tải đường bộ

**Điều 24:** quy định đối với vận tải người nội bộ bằng xe ô tô

**Nội dung:**

1. Xe ô tô vận tải người nội bộ

	a) Sử dụng xe ô tô phải đáp ứng các điều kiện tham gia giao thông theo quy định tại khoản 1 Điều 35, khoản 1, khoản 2 và khoản 3 Điều 40 của Luật Trật tự, an toàn giao thông đường bộ; phải có dây an toàn tại các vị trí ghế ngồi, có hướng dẫn về an toàn giao thông và thoát hiểm khi xảy ra sự cố trên xe.

	b) Xe ô tô phải được niêm yết (dán cố định) cụm từ “xe nội bộ” làm bằng vật liệu phản quang trên kính phía trước và kính phía sau xe, kích thước tối thiểu của cụm từ “xe nội bộ” là 10 x 35 cm theo mẫu số 12 Phụ lục XIII kèm theo Nghị định này. Trường hợp niêm yết bằng thiết bị điện tử phải bảo đảm cụm từ “xe nội bộ” luôn được bật sáng và có kích thước tối thiểu là 10 x 35 cm.

	c) Phải thuộc quyền sở hữu hoặc quyền sử dụng hợp pháp theo hợp đồng thuê phương tiện bằng văn bản của đơn vị vận tải nội bộ với tổ chức, cá nhân theo quy định của pháp luật. Trường hợp xe đăng ký thuộc sở hữu của thành viên hợp tác xã phải có hợp đồng dịch vụ giữa thành viên với hợp tác xã, trong đó quy định hợp tác xã có quyền, trách nhiệm và nghĩa vụ quản lý, sử dụng, điều hành xe ô tô thuộc sở hữu của thành viên hợp tác xã.

2. Đơn vị hoạt động vận tải nội bộ bằng xe ô tô

	a) Theo dõi, giám sát hoạt động của lái xe và phương tiện trong suốt quá trình hoạt động vận tải nội bộ; thực hiện chế độ bảo dưỡng sửa chữa phương tiện đúng quy định về bảo dưỡng kỹ thuật, sửa chữa phương tiện giao thông xe cơ giới đường bộ; kiểm tra điều kiện an toàn giao thông của xe và lái xe ô tô trước khi thực hiện nhiệm vụ vận chuyển; kiểm tra, giám sát hoạt động của xe ô tô và người lái xe trên hành trình.

	b) Bảo đảm quy định về thời gian lái xe liên tục, thời gian làm việc trong ngày, thời gian nghỉ của người lái xe theo quy định tại khoản 1 Điều 64 Luật Trật tự, an toàn giao thông đường bộ.

	c) Tổ chức thực hiện bảo đảm công tác quản lý an toàn theo quy định tại khoản 10 Điều 11 Nghị định này.

	d) Lập, cập nhật đầy đủ các nội dung quy định về quá trình hoạt động của phương tiện và lái xe thuộc đơn vị vào lý lịch phương tiện, lý lịch hành nghề lái xe, thực hiện theo dõi quá trình hoạt động và bảo dưỡng, sửa chữa phương tiện theo quy định về bảo dưỡng kỹ thuật, sửa chữa phương tiện giao thông xe cơ giới đường bộ.

	đ) Không sử dụng xe ô tô chở người có giường nằm hai tầng để hoạt động trên các tuyến đường cấp V miền núi, vi miền núi.

	e) Không được sử dụng người lái xe đang trong thời gian bị cấm hành nghề theo quy định của pháp luật; không sử dụng lái xe có dưới 02 năm kinh nghiệm điều khiển xe khách có trọng tải thiết kế từ 29 chỗ (không kể chỗ của người lái xe) trở lên để điều khiển xe có giường nằm hai tầng. Tổ chức khám sức khỏe định kỳ cho người lái xe và sử dụng người lái xe đủ sức khỏe theo quy định.


3. Người lái xe ô tô hoạt động vận tải nội bộ

	a) Có trách nhiệm kiểm tra các điều kiện bảo đảm an toàn của xe, hướng dẫn cho người ngồi trên xe về an toàn giao thông và thoát hiểm khi gặp sự cố, yêu cầu người ngồi trên xe thắt dây an toàn trước khi cho xe khởi hành; kiểm tra việc sắp xếp, chằng buộc hành lý bảo đảm an toàn.

	b) Thực hiện quy định về thời gian lái xe liên tục, thời gian làm việc trong ngày, thời gian nghỉ theo khoản 1 Điều 64 Luật Trật tự, an toàn giao thông đường bộ.

	c) Không được chở người trên mui, trong khoang chở hành lý hoặc để người đu, bám bên ngoài xe; không được chở hàng nguy hiểm, hàng cấm lưu hành, hàng lậu, động thực vật hoang dã; không được chở người, hành lý, hàng hóa vượt quá trọng tải, quá số người theo quy định.

	d) Từ chối điều khiển phương tiện khi phát hiện phương tiện không bảo đảm các điều kiện về an toàn, không có hoặc không có đủ dây an toàn trên xe.

Tóm lại: Xe ô tô vận tải người nội bộ phải có dây an toàn tại tất cả các vị trí ghế ngồi. Người lái xe có trách nhiệm yêu cầu hành khách thắt dây an toàn trước khi xe khởi hành.
","Bắt buộc tất cả hành khách trên ô tô phải thắt dây an toàn, kể cả người ngồi ở hàng ghế sau.",1.0,0.28507586246464794,0.0,0.0
22,Luật Giao thông Đường bộ 2025 có quy định gì về việc sử dụng mũ bảo hiểm cho người đi xe đạp điện?,"['1. người điều khiển xe đạp, xe đạp máy chỉ được chở một người, trừ trường hợp chở thêm một trẻ em dưới 07 tuổi thì được chở tối đa hai người. 2. người điều khiển xe đạp, xe đạp máy không được thực hiện các hành vi quy định tại khoản 3 điều 33 của luật này; người được chở trên xe đạp, xe đạp máy khi tham gia giao thông đường bộ không được thực hiện các hành vi quy định tại khoản 4 điều 33 của luật này. 3. người điều khiển, người được chở trên xe đạp máy phải đội mũ bảo hiểm theo đúng quy chuẩn kỹ thuật quốc gia và cài quai đúng quy cách. 4. người điều khiển xe thô sơ chỉ được cho xe đi hàng một, nơi có phần đường dành cho xe thô sơ thì phải đi đúng phần đường quy định; khi tham gia giao thông đường bộ trong thời gian từ 18 giờ ngày hôm trước đến 06 giờ ngày hôm sau phải sử dụng đèn hoặc có báo hiệu ở phía trước và phía sau xe. 5. hàng hóa xếp trên xe thô sơ phải bảo đảm an toàn, không gây cản trở giao thông và che khuất tầm nhìn của người điều khiển. hàng hóa xếp trên xe không vượt quá 1/3 chiều dài thân xe và không vượt quá 01 mét phía trước và phía sau xe; không vượt quá 0,4 mét mỗi bên bánh xe.']","**Nguồn văn bản:** 36_2024_QH15_444251

**Tên văn bản:** Luật Trật tự, an toàn giao thông đường bộ

**Điều 31:** người điều khiển, người được chở, hàng hóa xếp trên xe thô sơ

**Nội dung:**

1. Người điều khiển xe đạp, xe đạp máy chỉ được chở một người, trừ trường hợp chở thêm một trẻ em dưới 07 tuổi thì được chở tối đa hai người.

2. Người điều khiển xe đạp, xe đạp máy không được thực hiện các hành vi quy định tại khoản 3 điều 33 của luật này; người được chở trên xe đạp, xe đạp máy khi tham gia giao thông đường bộ không được thực hiện các hành vi quy định tại khoản 4 điều 33 của luật này.

3. Người điều khiển, người được chở trên xe đạp máy phải đội mũ bảo hiểm theo đúng quy chuẩn kỹ thuật quốc gia và cài quai đúng quy cách.

4. Người điều khiển xe thô sơ chỉ được cho xe đi hàng một, nơi có phần đường dành cho xe thô sơ thì phải đi đúng phần đường quy định; khi tham gia giao thông đường bộ trong thời gian từ 18 giờ ngày hôm trước đến 06 giờ ngày hôm sau phải sử dụng đèn hoặc có báo hiệu ở phía trước và phía sau xe.

5. Hàng hóa xếp trên xe thô sơ phải bảo đảm an toàn, không gây cản trở giao thông và che khuất tầm nhìn của người điều khiển. Hàng hóa xếp trên xe không vượt quá 1/3 chiều dài thân xe và không vượt quá 01 mét phía trước và phía sau xe; không vượt quá 0,4 mét mỗi bên bánh xe.

**Tóm lại:** Theo điều 31 của Luật Trật tự, an toàn giao thông đường bộ, người điều khiển và người được chở trên xe đạp máy phải đội mũ bảo hiểm đạt chuẩn và cài quai đúng quy cách.  Văn bản này không đề cập đến việc sử dụng mũ bảo hiểm cho người đi xe đạp điện.
",Bắt buộc người đi xe đạp điện phải đội mũ bảo hiểm đạt chuẩn.,0.7222222222222222,0.7130080804208948,0.0,0.0
23,Quy định mới về việc sử dụng xe máy điện là gì?,"['thông tư quy định về phân loại phương tiện giao thông đường bộ và dấu hiệu nhận biết xe cơ giới sử dụng năng lượng sạch, năng lượng xanh, thân thiện môi trường.']","**Nguồn văn bản:** 53_2024_TT-BGTVT_624420

**Tên văn bản:** Thông tư Quy định về phân loại phương tiện giao thông đường bộ và dấu hiệu nhận biết xe cơ giới sử dụng năng lượng sạch, năng lượng xanh, thân thiện môi trường

**Điều 1:** phạm vi điều chỉnh

**Nội dung:**

Thông tư quy định về phân loại phương tiện giao thông đường bộ và dấu hiệu nhận biết xe cơ giới sử dụng năng lượng sạch, năng lượng xanh, thân thiện môi trường.

Tóm lại: Văn bản này quy định về phân loại phương tiện giao thông đường bộ, bao gồm cả xe máy điện, và dấu hiệu nhận biết xe cơ giới sử dụng năng lượng sạch, năng lượng xanh, thân thiện môi trường. Tuy nhiên, chi tiết về quy định sử dụng xe máy điện không được đề cập trong đoạn trích này.
",Người điều khiển xe máy điện phải có giấy phép lái xe hạng A1 trở lên.,0.5,0.42236196731748255,0.0,0.0
24,Luật Giao thông Đường bộ 2025 có quy định gì về việc sử dụng xe đạp trên đường cao tốc?,"['1. khi tham gia giao thông trên đường bộ, người lái xe, người điều khiển xe máy chuyên dùng phải chấp hành quy định về tốc độ khai thác và khoảng cách an toàn theo quy định tại điều 12 luật trật tự, an toàn giao thông đường bộ. 2. tại những đoạn đường không bố trí biển báo tốc độ khai thác tối đa, không bố trí biển báo khoảng cách an toàn giữa hai xe, người điều khiển phương tiện tham gia giao thông phải thực hiện theo quy định tại điều 6, điều 7, điều 8 và điều 11 thông tư này. chương ii tốc độ thiết kế của đường bộ; tốc độ khai thác của đường bộ, khoảng cách an toàn của xe cơ giới, xe máy chuyên dùng tham gia giao thông trên đường bộ']","Không tìm thấy thông tin liên quan tới câu hỏi này.
",Cấm xe đạp lưu thông trên đường cao tốc.,0.0,0.0,0.0,0.0
25,Quy định mới về việc sử dụng xe máy trên đường cao tốc là gì?,"['thông tư này áp dụng đối với người lái xe, người điều khiển xe máy chuyên dùng và tổ chức, cá nhân liên quan đến quản lý và thực hiện các quy định về tốc độ thiết kế, tốc độ khai thác của đường bộ và khoảng cách an toàn của xe cơ giới, xe máy chuyên dùng khi tham gia giao thông trên đường bộ.']","Không tìm thấy thông tin liên quan tới câu hỏi này.
",Cấm xe máy lưu thông trên đường cao tốc.,0.0,-0.0,0.0,0.0
26,Luật Giao thông Đường bộ 2025 có quy định gì về việc sử dụng xe ô tô tải trong giờ cao điểm?,"['1. tổ chức giao thông được thực hiện từ giai đoạn quy hoạch, đầu tư, xây dựng đến giai đoạn quản lý, vận hành, khai thác, sử dụng, bảo trì kết cấu hạ tầng đường bộ nhằm bảo đảm giao thông thông suốt, an toàn, hiệu quả. 2. nội dung tổ chức giao thông đường bộ trong giai đoạn thiết kế, thi công xây dựng, quản lý, vận hành, khai thác, sử dụng, bảo trì công trình đường bộ bao gồm: a) quy định số làn đường, phần đường dành cho xe ô tô và các phương tiện tham gia giao thông đường bộ khác, phần đường dành cho người đi bộ; chiều đi, tốc độ các phương tiện cơ giới tham gia giao thông đường bộ; b) tổ chức phân làn, phân luồng trên tuyến đường đang đầu tư xây dựng và tại các tuyến đường bộ kết nối; c) quy định giao thông tại các nút giao, vị trí đấu nối với đường khác; quy định về tránh, vượt xe trên đường, các điểm được phép dừng xe, đỗ xe trên đường, vị trí đón, trả khách; d) quy định khổ giới hạn và tải trọng cho phép phương tiện tham gia giao thông đường bộ an toàn; đ) quy định thời gian cho phép tham gia giao thông; thời gian cho phép đi theo các hướng của đèn tín hiệu giao thông; e) quy định thời gian bật, tắt hệ thống chiếu sáng trên đường; g) quy định về các trường hợp tạm dừng khai thác một phần hoặc toàn bộ tuyến đường; h) khai thác, sử dụng hệ thống quản lý giao thông thông minh, trung tâm quản lý, điều hành giao thông tuyến đường cao tốc và các thiết bị công nghệ khác phục vụ cung cấp thông tin, chỉ dẫn cho người tham gia giao thông đường bộ; i) lắp đặt đầy đủ hệ thống báo hiệu đường bộ và thực hiện các công việc cần thiết khác; k) phê duyệt phương án tổ chức giao thông đối với đường cao tốc. 3. chủ đầu tư dự án đầu tư xây dựng công trình đường bộ, người quản lý, sử dụng đường bộ, tổ chức, cá nhân liên quan có trách nhiệm lắp đặt, điều chỉnh, bổ sung đầy đủ báo hiệu đường bộ, công trình an toàn giao thông đường bộ đối với dự án và tuyến đường thuộc phạm vi quản lý; thực hiện phương án tổ chức giao thông đường cao tốc được phê duyệt. 4. việc theo dõi, đánh giá tình hình giao thông trên tuyến đường, điều chỉnh tổ chức giao thông để khắc phục tình trạng ùn tắc giao thông, bảo đảm trật tự, an toàn giao thông đường bộ được thực hiện trong quá trình vận hành, khai thác, sử dụng, bảo trì đường bộ. 5. bộ giao thông vận tải, ủy ban nhân dân các cấp chịu trách nhiệm tổ chức giao thông trên các tuyến đường bộ thuộc phạm vi quản lý. 6. người quản lý, sử dụng đường bộ đối với đường chuyên dùng chịu trách nhiệm tổ chức giao thông trên đường chuyên dùng; trường hợp đường chuyên dùng có hoạt động giao thông công cộng thì phải tổ chức giao thông theo quy định của điều này. 7. chính phủ quy định chi tiết điều này.']","**Nguồn văn bản:** 35_2024_QH15_588811

**Tên văn bản:** Luật Đường bộ

**Điều 25:** Tổ chức giao thông

**Nội dung:**

1. Tổ chức giao thông được thực hiện từ giai đoạn quy hoạch, đầu tư, xây dựng đến giai đoạn quản lý, vận hành, khai thác, sử dụng, bảo trì kết cấu hạ tầng đường bộ nhằm bảo đảm giao thông thông suốt, an toàn, hiệu quả.

2. Nội dung tổ chức giao thông đường bộ trong giai đoạn thiết kế, thi công xây dựng, quản lý, vận hành, khai thác, sử dụng, bảo trì công trình đường bộ bao gồm:

	a) Quy định số làn đường, phần đường dành cho xe ô tô và các phương tiện tham gia giao thông đường bộ khác, phần đường dành cho người đi bộ; chiều đi, tốc độ các phương tiện cơ giới tham gia giao thông đường bộ.

	b) Tổ chức phân làn, phân luồng trên tuyến đường đang đầu tư xây dựng và tại các tuyến đường bộ kết nối.

	c) Quy định giao thông tại các nút giao, vị trí đấu nối với đường khác; quy định về tránh, vượt xe trên đường, các điểm được phép dừng xe, đỗ xe trên đường, vị trí đón, trả khách.

	d) Quy định khổ giới hạn và tải trọng cho phép phương tiện tham gia giao thông đường bộ an toàn.

	đ) Quy định thời gian cho phép tham gia giao thông; thời gian cho phép đi theo các hướng của đèn tín hiệu giao thông.

	e) Quy định thời gian bật, tắt hệ thống chiếu sáng trên đường.

	g) Quy định về các trường hợp tạm dừng khai thác một phần hoặc toàn bộ tuyến đường.

	h) Khai thác, sử dụng hệ thống quản lý giao thông thông minh, trung tâm quản lý, điều hành giao thông tuyến đường cao tốc và các thiết bị công nghệ khác phục vụ cung cấp thông tin, chỉ dẫn cho người tham gia giao thông đường bộ.

	i) Lắp đặt đầy đủ hệ thống báo hiệu đường bộ và thực hiện các công việc cần thiết khác.

	k) Phê duyệt phương án tổ chức giao thông đối với đường cao tốc.

3. Chủ đầu tư dự án đầu tư xây dựng công trình đường bộ, người quản lý, sử dụng đường bộ, tổ chức, cá nhân liên quan có trách nhiệm lắp đặt, điều chỉnh, bổ sung đầy đủ báo hiệu đường bộ, công trình an toàn giao thông đường bộ đối với dự án và tuyến đường thuộc phạm vi quản lý; thực hiện phương án tổ chức giao thông đường cao tốc được phê duyệt.

4. Việc theo dõi, đánh giá tình hình giao thông trên tuyến đường, điều chỉnh tổ chức giao thông để khắc phục tình trạng ùn tắc giao thông, bảo đảm trật tự, an toàn giao thông đường bộ được thực hiện trong quá trình vận hành, khai thác, sử dụng, bảo trì đường bộ.

5. Bộ Giao thông Vận tải, Ủy ban nhân dân các cấp chịu trách nhiệm tổ chức giao thông trên các tuyến đường bộ thuộc phạm vi quản lý.

6. Người quản lý, sử dụng đường bộ đối với đường chuyên dùng chịu trách nhiệm tổ chức giao thông trên đường chuyên dùng; trường hợp đường chuyên dùng có hoạt động giao thông công cộng thì phải tổ chức giao thông theo quy định của điều này.

7. Chính phủ quy định chi tiết điều này.


Tóm lại: Điều 25 Luật Đường bộ quy định về tổ chức giao thông nói chung, bao gồm cả việc quy định thời gian cho phép tham gia giao thông (điểm đ khoản 2), nhưng không đề cập cụ thể đến việc hạn chế sử dụng xe ô tô tải trong giờ cao điểm. Việc này thuộc thẩm quyền của Ủy ban nhân dân các cấp (khoản 5) trong việc tổ chức giao thông trên các tuyến đường thuộc phạm vi quản lý.
","Cấm xe ô tô tải có trọng tải trên 2,5 tấn lưu thông trong khu vực đô thị trong giờ cao điểm.",0.9259259259259259,0.5331471390027875,0.0,0.0
27,Quy định mới về việc sử dụng xe ô tô chở hàng nguy hiểm là gì?,"['1. đơn vị kinh doanh vận tải có giấy phép kinh doanh vận tải bằng ô tô, trong đó có một hoặc các loại hình kinh doanh vận tải hàng hóa bằng xe ô tô quy định tại khoản 2, khoản 3 và khoản 4 điều này thì được tham gia kinh doanh vận tải hàng hóa bằng xe ô tô theo loại hình đã đăng ký. 2. kinh doanh vận tải hàng hóa bằng xe taxi tải là việc sử dụng xe ô tô có trọng tải từ 1.500 ki-lô-gam trở xuống để vận chuyển hàng hóa và người thuê vận tải trả tiền cho lái xe theo đồng hồ tính tiền hoặc theo phần mềm tính tiền trên xe. mặt ngoài hai bên thành xe hoặc cánh cửa xe niêm yết cụm từ “taxi tải” theo mẫu số 08 phụ lục xiii kèm theo nghị định này, số điện thoại liên lạc, tên đơn vị kinh doanh vận tải. 3. kinh doanh vận tải hàng hóa siêu trường, siêu trọng a) kinh doanh vận tải hàng hóa siêu trường, siêu trọng là việc sử dụng xe ô tô để vận chuyển hàng không thể chia nhỏ, tháo rời, khi vận chuyển trên đường bộ làm cho phương tiện hoặc tổ hợp phương tiện bị vượt quá giới hạn cho phép tham gia giao thông đường bộ về kích thước, khối lượng theo quy định của pháp luật; b) khi vận chuyển hàng hóa siêu trường, siêu trọng, phải thực hiện theo quy định tại điều 53 luật trật tự, an toàn giao thông đường bộ. 4. kinh doanh vận tải hàng hóa nguy hiểm a) kinh doanh vận tải hàng hóa nguy hiểm là việc sử dụng xe ô tô để vận chuyển hàng hóa có chứa các chất nguy hiểm có khả năng gây nguy hại tới tính mạng, sức khỏe con người, môi trường, an toàn và an ninh quốc gia; b) khi vận chuyển hàng hóa nguy hiểm phải thực hiện theo quy định tại điều 51 luật trật tự, an toàn giao thông đường bộ. 5. kinh doanh vận tải hàng hóa thông thường là hình thức kinh doanh vận tải hàng hóa, trừ các hình thức kinh doanh vận tải quy định tại các khoản 2, khoản 3 điều này. 6. xe ô tô đầu kéo kéo rơ moóc hoặc sơ mi rơ moóc kinh doanh vận tải hàng hóa, xe ô tô tải kinh doanh vận tải hàng hóa thông thường và xe taxi tải phải có phù hiệu “xe tải” theo mẫu số 09 phụ lục xiii kèm theo nghị định này và được dán cố định tại góc trên bên phải ngay sát phía dưới vị trí của tem kiểm định, mặt trong kính chắn gió phía trước của xe. 7. đơn vị kinh doanh vận tải hàng hóa phải chịu trách nhiệm thực hiện đúng quy định việc xếp hàng hóa lên xe ô tô. 8. đơn vị kinh doanh vận tải hàng hóa phải cấp cho lái xe giấy vận tải trong quá trình vận chuyển hàng hóa trên đường. giấy vận tải phải có xác nhận (ký, ghi rõ họ và tên) khối lượng hàng hóa đã xếp lên phương tiện của chủ hàng (hoặc người được chủ hàng ủy quyền) hoặc đại diện đơn vị, cá nhân thực hiện việc xếp hàng. 9. khi vận chuyển hàng hóa, lái xe phải mang theo giấy vận tải (giấy vận chuyển) bằng văn bản giấy hoặc phải có thiết bị để truy cập vào phần mềm thể hiện nội dung của giấy vận tải và các giấy tờ của lái xe và phương tiện theo quy định của pháp luật. đơn vị kinh doanh vận tải và lái xe không được chở hàng vượt quá khối lượng cho phép tham gia giao thông. 10. đối với hoạt động vận chuyển xe đạp, xe mô tô, xe gắn máy và các loại xe tương tự qua hầm đường bộ áp dụng theo quy định tại khoản 4 điều này. 11. giấy vận tải bằng văn bản giấy hoặc điện tử do đơn vị kinh doanh vận tải hàng hóa tự phát hành và có các thông tin tối thiểu gồm: tên đơn vị vận tải; biển kiểm soát xe; tên đơn vị hoặc người thuê vận tải; hành trình (điểm đầu, điểm cuối); số hợp đồng, ngày tháng năm ký hợp đồng (nếu có); loại hàng và khối lượng hàng vận chuyển trên xe. đơn vị kinh doanh vận tải hàng hóa phải thực hiện lưu trữ giấy vận tải của các chuyến xe đã thực hiện trong thời gian tối thiểu 03 năm. 12. việc bồi thường hàng hóa hư hỏng, mất mát, thiếu hụt được thực hiện theo hợp đồng vận chuyển hoặc theo thỏa thuận giữa người kinh doanh vận tải và người thuê vận tải.']","**Nguồn văn bản:** 158_2024_ND-CP_636875

**Tên văn bản:** Nghị định Quy định về hoạt động vận tải đường bộ

**Điều 8:** kinh doanh vận tải hàng hóa bằng xe ô tô

**Nội dung:**

4. Kinh doanh vận tải hàng hóa nguy hiểm

	a) Kinh doanh vận tải hàng hóa nguy hiểm là việc sử dụng xe ô tô để vận chuyển hàng hóa có chứa các chất nguy hiểm có khả năng gây nguy hại tới tính mạng, sức khỏe con người, môi trường, an toàn và an ninh quốc gia.

	b) Khi vận chuyển hàng hóa nguy hiểm phải thực hiện theo quy định tại Điều 51 Luật Trật tự, an toàn giao thông đường bộ.


Tóm lại: Xe ô tô vận chuyển hàng hóa nguy hiểm phải tuân thủ quy định tại Điều 51 của Luật Trật tự, an toàn giao thông đường bộ. Hàng hóa nguy hiểm là hàng hóa có chứa chất gây nguy hại tới tính mạng, sức khỏe, môi trường, an toàn và an ninh quốc gia.
",Xe ô tô chở hàng nguy hiểm phải có giấy phép và chỉ được lưu thông trên các tuyến đường quy định.,0.8,0.5474838207418481,0.0,0.0
28,Luật Giao thông Đường bộ 2025 có quy định gì về việc nghỉ ngơi của tài xế xe tải?,"['1. đơn vị kinh doanh vận tải bằng xe ô tô, bằng xe bốn bánh có gắn động cơ phải có bộ phận quản lý an toàn, xây dựng và thực hiện bảo đảm an toàn giao thông trong hoạt động vận tải đáp ứng yêu cầu sau: a) có người trực tiếp điều hành vận tải theo quy định tại khoản 2 điều này và có nhân sự thực hiện theo dõi, giám sát hoạt động của lái xe, phương tiện trong suốt quá trình tham gia kinh doanh vận tải; b) xây dựng và thực hiện các nhiệm vụ bảo đảm an toàn giao thông theo quy định tại điều này; c) giao nhiệm vụ cho lái xe; chỉ sử dụng lái xe điều khiển phương tiện kinh doanh vận tải có giấy phép lái xe phù hợp loại xe theo quy định tại điều 57 luật trật tự, an toàn giao thông đường bộ và lái xe đã được cấp giấy chứng nhận hoàn thành tập huấn nghiệp vụ vận tải. 2. người trực tiếp điều hành vận tải của đơn vị kinh doanh vận tải phải bảo đảm các yêu cầu như sau: a) đối với đơn vị kinh doanh vận tải hành khách theo tuyến cố định, kinh doanh vận tải hành khách bằng xe buýt, bằng xe taxi và các đơn vị kinh doanh vận tải hàng hóa sử dụng xe ô tô kéo rơ moóc, xe ô tô đầu kéo kéo theo sơ mi rơ moóc phải có trình độ chuyên môn về vận tải (có chứng chỉ sơ cấp chuyên ngành vận tải hoặc có bằng tốt nghiệp trung cấp chuyên ngành vận tải hoặc đường bộ trở lên); b) đối với đơn vị kinh doanh vận tải hành khách, hàng hóa (không thuộc đối tượng quy định tại điểm a khoản này) đáp ứng yêu cầu tại điểm a khoản này hoặc phải có kinh nghiệm làm việc tại đơn vị kinh doanh vận tải tối thiểu từ 03 năm trở lên hoặc là chủ hộ kinh doanh vận tải của đơn vị kinh doanh vận tải hoặc là người đại diện pháp luật của đơn vị kinh doanh vận tải; c) bảo đảm về thời gian làm việc tại đơn vị kinh doanh vận tải theo quy định của pháp luật về lao động và phù hợp với thời gian hoạt động kinh doanh của đơn vị mình. 3. bộ phận quản lý an toàn tại đơn vị kinh doanh vận tải bằng xe ô tô, bằng xe bốn bánh có gắn động cơ trước khi giao nhiệm vụ vận chuyển mới cho người lái xe phải thực hiện các nhiệm vụ sau: a) tổng hợp, phân tích các dữ liệu về hoạt động của từng phương tiện trong quá trình thực hiện nhiệm vụ vận chuyển thông qua thiết bị giám sát hành trình, thiết bị ghi nhận hình ảnh người lái xe (áp dụng đối với phương tiện thuộc đối tượng phải lắp) để chấn chỉnh, nhắc nhở và xử lý các trường hợp vi phạm; b) tiếp nhận và giải quyết các đề xuất, phản ánh của người lái xe về các vấn đề liên quan đến an toàn giao thông; c) phối hợp với bộ phận khác của đơn vị để bố trí xe và người lái xe thực hiện nhiệm vụ vận chuyển, bảo đảm thời gian lái xe liên tục, thời gian lái xe trong một ngày, trong một tuần, thời gian nghỉ ngơi của người lái xe theo quy định tại điều 64 luật trật tự, an toàn giao thông đường bộ. 4. trước khi thực hiện nhiệm vụ vận chuyển, bộ phận quản lý an toàn hoặc người trực tiếp điều hành vận tải hoặc cán bộ quản lý do đơn vị phân công và người lái xe phải thực hiện các nội dung công việc (riêng đối với hoạt động kinh doanh vận tải bằng xe taxi thực hiện theo kế hoạch sản xuất kinh doanh của đơn vị): a) kiểm tra giấy phép lái xe của người lái xe; giấy chứng nhận kiểm định an toàn kỹ thuật và bảo vệ môi trường; giấy chứng nhận đăng ký xe; lệnh vận chuyển đối với hoạt động vận chuyển hành khách theo tuyến cố định, xe buýt; hợp đồng vận tải đối với hoạt động vận chuyển hành khách theo hợp đồng; giấy vận tải đối với hoạt động vận tải hàng hóa; b) thông báo trực tiếp hoặc qua phần mềm của đơn vị kinh doanh vận tải cho người lái xe các yêu cầu vận chuyển của khách hàng; c) kiểm tra nồng độ cồn, chất ma túy đối với người lái xe (nếu đơn vị có trang bị thiết bị, dụng cụ kiểm tra). 5. sau khi được giao nhiệm vụ và trước khi cho xe khởi hành, người lái xe được giao nhiệm vụ vận chuyển phải thực hiện kiểm tra bảo đảm tình trạng an toàn kỹ thuật của phương tiện tối thiểu các nội dung chính gồm: kiểm tra thiết bị giám sát hành trình, thiết bị ghi nhận hình ảnh người lái xe lắp trên xe (đối với những xe bắt buộc phải lắp theo quy định) bảo đảm tình trạng hoạt động tốt; kiểm tra hệ thống lái; kiểm tra các bánh xe; kiểm tra hệ thống phanh; hệ thống đèn, còi; thông tin niêm yết trên xe. 6. trước khi cho xe khởi hành thực hiện nhiệm vụ vận chuyển, người lái xe nhận nhiệm vụ phải sử dụng thẻ nhận dạng người lái xe của mình để đăng nhập thông tin qua đầu đọc thẻ của thiết bị giám sát hành trình của xe. 7. khi xe đang hoạt động trên đường a) bộ phận quản lý an toàn giao thông hoặc người được giao nhiệm vụ quản lý an toàn giao thông trong đơn vị kinh doanh vận tải thực hiện các nhiệm vụ: thông qua dữ liệu từ thiết bị giám sát hành trình, khi phát hiện lái xe vi phạm quá thời gian lái xe liên tục, quá thời gian lái xe trong ngày, chạy sai hành trình, thiết bị giám sát hành trình không hoạt động thì kịp thời thông tin cho lái xe yêu cầu điều chỉnh, kịp thời khắc phục các sai phạm; b) người lái xe phải chấp hành nghiêm các quy định về an toàn giao thông trong quá trình điều khiển phương tiện để vận chuyển hành khách, hàng hóa, chấp hành quy định về thời gian lái xe liên tục, thời gian lái xe trong một ngày, trong một tuần, quy định về tốc độ, hành trình chạy xe, thiết bị giám sát hành trình, thiết bị ghi nhận hình ảnh người lái xe (đối với loại phương tiện phải lắp) bảo đảm luôn hoạt động; báo cáo ngay thời gian, địa điểm và nguyên nhân khi xảy ra sự cố mất an toàn giao thông để đơn vị có biện pháp xử lý kịp thời. 8. khi người lái xe kết thúc nhiệm vụ được giao hoặc kết thúc ca làm việc a) bộ phận quản lý an toàn hoặc người trực tiếp điều hành vận tải hoặc cán bộ quản lý do đơn vị phân công phải thực hiện các nhiệm vụ: thống kê quãng đường phương tiện đã thực hiện làm căn cứ lập kế hoạch và thực hiện chế độ bảo dưỡng, sửa chữa phương tiện bảo đảm theo đúng chu kỳ bảo dưỡng định kỳ; thống kê và theo dõi kết quả bảo dưỡng, sửa chữa của từng phương tiện; thống kê các lỗi vi phạm về tốc độ xe chạy, vi phạm về thời gian người lái xe liên tục, thời gian lái xe trong một ngày, trong một tuần, hoạt động sai hành trình vận chuyển, dữ liệu từ thiết bị giám sát hành trình, thiết bị ghi nhận hình ảnh người lái xe (đối với loại phương tiện phải lắp) bị gián đoạn; báo cáo lãnh đạo đơn vị xử lý theo quy chế; tổng hợp các sự cố mất an toàn giao thông trong quá trình xe hoạt động kinh doanh vận tải trên đường; b) người lái xe phải thực hiện các nhiệm vụ: sử dụng thẻ nhận dạng người lái xe của mình để đăng xuất thông tin qua đầu đọc thẻ của thiết bị giám sát hành trình của xe; sau khi kết thúc hành trình hoặc kết thúc ca làm việc, trước khi rời khỏi xe, người lái xe phải kiểm tra khoang hành khách để bảo đảm không còn hành khách ở trên xe (áp dụng đối với xe kinh doanh vận tải hành khách). 9. theo định kỳ tháng, quý, năm, bộ phận (cán bộ quản lý do đơn vị phân công) quản lý an toàn phải thực hiện các nhiệm vụ sau: a) thống kê số vụ, nguyên nhân, mức độ tai nạn giao thông đã xảy ra của từng người lái xe và của toàn đơn vị; b) xây dựng và thực hiện phương án xử lý khi xảy ra sự cố gây mất an toàn giao thông trong quá trình kinh doanh vận tải; c) tổ chức đánh giá, rút kinh nghiệm đối với toàn bộ người lái xe của đơn vị sau khi xảy ra tai nạn giao thông từ nghiêm trọng trở lên trong quá trình kinh doanh vận tải; d) phối hợp với các bộ phận nghiệp vụ của đơn vị để tổ chức tập huấn nghiệp vụ vận tải cho toàn bộ người lái xe của đơn vị theo quy định; đ) lưu trữ hồ sơ, sổ sách ghi chép bằng bản giấy hoặc lưu trên phần mềm kết quả thực hiện các nhiệm vụ theo quy định tại khoản 2, khoản 3, và điểm a khoản 7 điều này. thời gian lưu trữ tối thiểu 03 năm. 10. đơn vị hoạt động vận tải nội bộ phải theo dõi, tổng hợp hoạt động của lái xe, xe ô tô, xe bốn bánh có gắn động cơ trong quá trình vận tải cán bộ, công nhân viên, người lao động hoặc trẻ em mầm non, học sinh, sinh viên; vận tải sản phẩm, hàng hóa hoặc trang thiết bị, dụng cụ, nguyên vật liệu, nhiên liệu để phục vụ quá trình sản xuất, tiêu thụ sản phẩm hoặc dịch vụ của đơn vị vận tải nội bộ. đơn vị vận tải nội bộ, người lái xe phải bảo đảm tối thiểu công tác quản lý an toàn giao thông trong hoạt động vận tải nội bộ bằng xe ô tô, bằng xe bốn bánh có gắn động cơ theo các nội dung quy định sau: a) quy định tại điểm c khoản 3, điểm c khoản 4 điều này; b) kiểm tra giấy phép lái xe của người lái xe; giấy chứng nhận kiểm định an toàn kỹ thuật và bảo vệ môi trường; giấy chứng nhận đăng ký xe; c) sau khi được giao nhiệm vụ và trước khi cho xe khởi hành, người lái xe được giao nhiệm vụ vận chuyển phải thực hiện kiểm tra bảo đảm tình trạng an toàn kỹ thuật của phương tiện; kiểm tra hệ thống lái; kiểm tra các bánh xe; kiểm tra hệ thống phanh; hệ thống đèn, còi; thông tin niêm yết trên xe. khi xe đang hoạt động trên đường, người lái xe phải chấp hành nghiêm các quy định về an toàn giao thông trong quá trình điều khiển phương tiện để vận chuyển hành khách, hàng hóa, chấp hành quy định về thời gian lái xe liên tục, thời gian lái xe trong một ngày, trong một tuần, quy định về tốc độ, hành trình chạy xe; báo cáo ngay thời gian, địa điểm và nguyên nhân khi xảy ra sự cố mất an toàn giao thông để đơn vị có biện pháp xử lý kịp thời. sau khi kết thúc hành trình hoặc kết thúc ca làm việc, trước khi rời khỏi xe, người lái xe phải kiểm tra khoang hành khách để bảo đảm không còn hành khách ở trên xe (áp dụng đối với xe kinh doanh vận tải hành khách); d) đơn vị vận tải nội bộ phải thực hiện: theo dõi, tổng hợp quá trình hoạt động thực hiện nhiệm vụ vận chuyển của phương tiện và người lái xe; thực hiện nhắc nhở, chấn chỉnh khi xảy ra các sự cố gây mất an toàn giao thông; thực hiện thống kê quãng đường phương tiện đã thực hiện làm căn cứ lập kế hoạch và thực hiện chế độ bảo dưỡng, sửa chữa phương tiện bảo đảm theo đúng chu kỳ bảo dưỡng định kỳ; thống kê và theo dõi kết quả bảo dưỡng, sửa chữa của từng phương tiện; tổng hợp các sự cố mất an toàn giao thông trong quá trình xe hoạt động vận tải trên đường. 11. đơn vị kinh doanh dịch vụ bến xe khách, bến xe hàng phải bảo đảm thực hiện đầy đủ quy định tại khoản 2 điều 72 luật đường bộ; xây dựng, thực hiện quy trình xe ra, vào bến bảo đảm an toàn cho phương tiện hoạt động trong bến xe. 12. đơn vị kinh doanh vận tải a) sử dụng xe ô tô, xe bốn bánh có gắn động cơ tham gia kinh doanh vận tải phải đáp ứng các điều kiện tham gia giao thông theo quy định tại khoản 1 và khoản 2 điều 35, khoản 1, khoản 2 và khoản 3 điều 40 của luật trật tự, an toàn giao thông đường bộ; phải có dây an toàn tại các vị trí ghế ngồi, giường nằm (trừ xe buýt nội tỉnh), có hướng dẫn cho hành khách về an toàn giao thông và thoát hiểm khi xảy ra sự cố trên xe; b) không sử dụng xe ô tô khách có giường nằm hai tầng để hoạt động trên các tuyến đường cấp v và cấp vi miền núi; c) sử dụng lái xe kinh doanh vận tải phải có ít nhất 02 năm kinh nghiệm điều khiển xe ô tô khách có trọng tải thiết kế trên 29 chỗ (không kể chỗ của người lái xe) để điều khiển xe ô tô khách có giường nằm hai tầng; d) lập, cập nhật đầy đủ các nội dung quy định về quá trình hoạt động của xe ô tô, xe bốn bánh có gắn động cơ và lái xe thuộc đơn vị vào lý lịch phương tiện, lý lịch hành nghề lái xe; đ) đơn vị kinh doanh vận tải hành khách, lái xe, nhân viên phục vụ trên xe (nếu có) khi nhận hàng hóa ký gửi xe ô tô (người gửi hàng hóa không đi theo xe) phải thực hiện theo quy định tại điều 68 luật đường bộ. 13. thời gian nghỉ giữa 2 lần lái xe liên tục như sau: a) đối với lái xe ô tô taxi, xe ô tô buýt nội tỉnh tối thiểu là 05 phút; b) đối với lái xe ô tô vận tải hành khách theo tuyến cố định, xe buýt liên tỉnh, xe ô tô vận tải hành khách theo hợp đồng, xe ô tô vận tải hàng hóa tối thiểu là 15 phút.']","**Nguồn văn bản:** 158_2024_ND-CP_636875

**Tên văn bản:** Nghị định Quy định về hoạt động vận tải đường bộ

**Điều 11:** quy định về công tác bảo đảm an toàn trong hoạt động vận tải bằng xe ô tô, bằng xe bốn bánh có gắn động cơ

**Nội dung:**

3. Bộ phận quản lý an toàn tại đơn vị kinh doanh vận tải bằng xe ô tô, bằng xe bốn bánh có gắn động cơ trước khi giao nhiệm vụ vận chuyển mới cho người lái xe phải thực hiện các nhiệm vụ sau:

    a) Tổng hợp, phân tích các dữ liệu về hoạt động của từng phương tiện trong quá trình thực hiện nhiệm vụ vận chuyển thông qua thiết bị giám sát hành trình, thiết bị ghi nhận hình ảnh người lái xe (áp dụng đối với phương tiện thuộc đối tượng phải lắp) để chấn chỉnh, nhắc nhở và xử lý các trường hợp vi phạm.

    b) Tiếp nhận và giải quyết các đề xuất, phản ánh của người lái xe về các vấn đề liên quan đến an toàn giao thông.

    c) Phối hợp với bộ phận khác của đơn vị để bố trí xe và người lái xe thực hiện nhiệm vụ vận chuyển, bảo đảm thời gian lái xe liên tục, thời gian lái xe trong một ngày, trong một tuần, thời gian nghỉ ngơi của người lái xe theo quy định tại điều 64 Luật Trật tự, an toàn giao thông đường bộ.

13. Thời gian nghỉ giữa 2 lần lái xe liên tục như sau:

    a) Đối với lái xe ô tô taxi, xe ô tô buýt nội tỉnh tối thiểu là 05 phút.

    b) Đối với lái xe ô tô vận tải hành khách theo tuyến cố định, xe buýt liên tỉnh, xe ô tô vận tải hành khách theo hợp đồng, xe ô tô vận tải hàng hóa tối thiểu là 15 phút.


**Tóm lại:** Thời gian nghỉ ngơi của tài xế xe tải giữa 2 lần lái xe liên tục tối thiểu là 15 phút theo quy định tại Điều 11 và Điều 64 của Luật Trật tự, an toàn giao thông đường bộ.  Việc bố trí thời gian lái xe và nghỉ ngơi của tài xế phải được bộ phận quản lý an toàn của đơn vị kinh doanh vận tải đảm bảo.
",Tài xế xe tải phải nghỉ ít nhất 15 phút sau mỗi 4 giờ lái xe liên tục.,0.8181818181818182,0.5319594607064845,0.0,0.0
29,Quy định mới về việc sử dụng thiết bị giám sát hành trình trên xe ô tô kinh doanh vận tải là gì?,"['1. phạt tiền từ 500.000 đồng đến 1.000.000 đồng đối với cá nhân, từ 1.000.000 đồng đến 2.000.000 đồng đối với tổ chức thực hiện một trong các hành vi vi phạm sau đây: a) xếp hàng hóa lên mỗi xe ô tô (kể cả rơ moóc và sơ mi rơ moóc) vượt quá trọng tải (khối lượng hàng chuyên chở) cho phép tham gia giao thông được ghi trong giấy chứng nhận kiểm định an toàn kỹ thuật và bảo vệ môi trường của xe trên 10% đến 50% (trừ xe xi téc chở chất lỏng), trên 20% đến 50% đối với xe xi téc chở chất lỏng; b) xếp hàng hóa lên xe ô tô mà không ký xác nhận việc xếp hàng hóa vào giấy vận tải theo quy định. 2. phạt tiền từ 1.000.000 đồng đến 2.000.000 đồng đối với cá nhân, từ 2.000.000 đồng đến 4.000.000 đồng đối với tổ chức kinh doanh vận tải, dịch vụ hỗ trợ vận tải thực hiện một trong các hành vi vi phạm sau đây: a) không đánh số thứ tự ghế ngồi, giường nằm trên xe ô tô chở hành khách theo quy định; b) sử dụng xe ô tô kinh doanh vận tải hành khách theo tuyến cố định, xe ô tô kinh doanh vận tải hành khách bằng xe buýt không có chỗ ưu tiên cho người khuyết tật, người cao tuổi và phụ nữ mang thai theo quy định; c) sử dụng xe ô tô kinh doanh vận tải hành khách không có hướng dẫn cho hành khách về an toàn giao thông, thoát hiểm khi xảy ra sự cố trên xe theo quy định; d) không bố trí người áp tải trên xe vận chuyển hàng hóa nguy hiểm đối với những trường hợp quy định phải có người áp tải; đ) không cấp lệnh vận chuyển, giấy vận tải cho lái xe hoặc cấp lệnh vận chuyển, giấy vận tải nhưng không đúng theo quy định (đối với loại xe quy định phải cấp lệnh vận chuyển, giấy vận tải); e) sử dụng xe vận chuyển hàng hóa nguy hiểm mà không làm sạch hoặc không bóc (xóa) biểu trưng nguy hiểm trên phương tiện khi không tiếp tục vận chuyển loại hàng hóa đó. 3. phạt tiền từ 2.000.000 đồng đến 3.000.000 đồng đối với cá nhân, từ 4.000.000 đồng đến 6.000.000 đồng đối với tổ chức thực hiện hành vi vi phạm xếp hàng hóa lên mỗi xe ô tô (kể cả rơ moóc và sơ mi rơ moóc) vượt quá trọng tải (khối lượng hàng chuyên chở) cho phép tham gia giao thông được ghi trong giấy chứng nhận kiểm định an toàn kỹ thuật và bảo vệ môi trường của xe trên 50% đến 100%. 4. phạt tiền từ 3.000.000 đồng đến 4.000.000 đồng đối với cá nhân, từ 6.000.000 đồng đến 8.000.000 đồng đối với tổ chức kinh doanh vận tải, dịch vụ hỗ trợ vận tải thực hiện một trong các hành vi vi phạm sau đây: a) không cấp thẻ nhận dạng lái xe cho lái xe theo quy định; b) sử dụng lái xe, nhân viên phục vụ trên xe để tham gia kinh doanh vận tải bằng xe ô tô mà không được tập huấn, hướng dẫn về nghiệp vụ vận tải hành khách và an toàn giao thông theo quy định (đối với hình thức kinh doanh vận tải có quy định lái xe, nhân viên phục vụ trên xe phải được tập huấn, hướng dẫn nghiệp vụ), trừ các hành vi vi phạm quy định tại điểm c, điểm d khoản này; c) sử dụng lái xe, người quản lý trên xe để tham gia kinh doanh vận tải bằng xe ô tô mà không được hướng dẫn về quy trình bảo đảm an toàn khi đưa đón trẻ em mầm non, học sinh; d) sử dụng lái xe, người áp tải vận chuyển hàng hóa nguy hiểm mà không được tập huấn về vận chuyển hàng hóa nguy hiểm; đ) sử dụng xe ô tô kinh doanh vận tải hành khách không có dây đai an toàn tại các vị trí ghế ngồi, giường nằm theo quy định (trừ xe buýt nội tỉnh); e) sử dụng xe ô tô kinh doanh vận tải chở trẻ em mầm non, học sinh tiểu học, xe ô tô kinh doanh vận tải kết hợp với hoạt động đưa đón trẻ em mầm non, học sinh tiểu học không có dây đai an toàn phù hợp với lứa tuổi hoặc không có ghế ngồi phù hợp với lứa tuổi theo quy định; g) không thực hiện việc niêm yết thông tin trên xe theo quy định hoặc có niêm yết nhưng không chính xác, không đầy đủ thông tin theo quy định. 5. phạt tiền từ 4.000.000 đồng đến 5.000.000 đồng đối với cá nhân, từ 8.000.000 đồng đến 10.000.000 đồng đối với tổ chức xếp hàng hóa lên mỗi xe ô tô (kể cả rơ moóc và sơ mi rơ moóc) vượt quá trọng tải (khối lượng hàng chuyên chở) cho phép tham gia giao thông được ghi trong giấy chứng nhận kiểm định an toàn kỹ thuật và bảo vệ môi trường của xe trên 100%. 6. phạt tiền từ 4.000.000 đồng đến 6.000.000 đồng đối với cá nhân, từ 8.000.000 đồng đến 12.000.000 đồng đối với tổ chức kinh doanh vận tải thực hiện một trong các hành vi vi phạm sau đây: a) sử dụng xe vận chuyển động vật sống không có kết cấu phù hợp với loại động vật chuyên chở theo quy định; b) sử dụng xe ô tô kinh doanh vận tải chở trẻ em mầm non, học sinh, xe ô tô kinh doanh vận tải kết hợp với hoạt động đưa đón trẻ em mầm non, học sinh không có thiết bị ghi nhận hình ảnh trẻ em mầm non, học sinh hoặc không có thiết bị có chức năng cảnh báo, chống bỏ quên trẻ em trên xe hoặc không có thiết bị ghi nhận hình ảnh trẻ em mầm non, học sinh và thiết bị có chức năng cảnh báo, chống bỏ quên trẻ em trên xe; c) sử dụng xe ô tô kinh doanh vận tải chở trẻ em mầm non, học sinh không có màu sơn theo quy định; d) sử dụng xe ô tô kinh doanh vận tải chở trẻ em mầm non, học sinh, xe ô tô kinh doanh vận tải kết hợp với hoạt động đưa đón trẻ em mầm non, học sinh không có biển báo dấu hiệu nhận biết là xe chở trẻ em mầm non, học sinh theo quy định. 7. phạt tiền từ 5.000.000 đồng đến 6.000.000 đồng đối với cá nhân, từ 10.000.000 đồng đến 12.000.000 đồng đối với tổ chức kinh doanh vận tải, dịch vụ hỗ trợ vận tải thực hiện một trong các hành vi vi phạm sau đây: a) không thực hiện việc cung cấp, cập nhật, truyền, lưu trữ, quản lý thông tin, dữ liệu từ thiết bị giám sát hành trình theo quy định; b) không thực hiện đúng nội dung thông tin đã niêm yết trên xe theo quy định; c) sử dụng phương tiện kinh doanh vận tải không lắp thiết bị giám sát hành trình của xe (đối với hình thức kinh doanh vận tải có quy định phương tiện phải lắp thiết bị) hoặc lắp thiết bị nhưng thiết bị không hoạt động, không đúng quy chuẩn theo quy định hoặc làm sai lệch dữ liệu của thiết bị giám sát hành trình của xe ô tô; d) sử dụng xe trung chuyển chở hành khách không đúng quy định; đ) sử dụng lái xe điều khiển xe khách giường nằm hai tầng, xe ô tô đưa đón trẻ em mầm non, học sinh chưa đủ số năm kinh nghiệm theo quy định; e) sử dụng xe kinh doanh vận tải hành khách theo hợp đồng mà trên xe không có hợp đồng vận tải, danh sách hành khách kèm theo, thiết bị để truy cập nội dung hợp đồng điện tử và danh sách hành khách theo quy định hoặc có hợp đồng vận tải, danh sách hành khách, thiết bị để truy cập nhưng không bảo đảm yêu cầu theo quy định, chở người không có tên trong danh sách hành khách hoặc vận chuyển không đúng đối tượng theo quy định (đối với xe kinh doanh vận tải hành khách theo hợp đồng vận chuyển trẻ em mầm non, học sinh, sinh viên, cán bộ, công chức, viên chức, công nhân); g) sử dụng xe ô tô kinh doanh vận tải không lắp thiết bị ghi nhận hình ảnh người lái xe theo quy định (đối với loại xe có quy định phải lắp thiết bị ghi nhận hình ảnh người lái xe) hoặc có lắp thiết bị ghi nhận hình ảnh người lái xe nhưng không ghi, không lưu trữ được dữ liệu trên xe trong quá trình xe tham gia giao thông theo quy định hoặc làm sai lệch dữ liệu của thiết bị ghi nhận hình ảnh người lái xe lắp trên xe ô tô; h) không thực hiện việc cung cấp, cập nhật, truyền dẫn, lưu trữ, quản lý thông tin, dữ liệu thu thập từ thiết bị ghi nhận hình ảnh người lái xe lắp trên xe ô tô theo quy định; i) sử dụng phương tiện kinh doanh vận tải có niên hạn sử dụng không bảo đảm điều kiện của hình thức kinh doanh đã đăng ký. 8. phạt tiền từ 10.000.000 đồng đến 12.000.000 đồng đối với cá nhân, từ 20.000.000 đồng đến 24.000.000 đồng đối với tổ chức kinh doanh vận tải, dịch vụ hỗ trợ vận tải thực hiện một trong các hành vi vi phạm sau đây: a) không tổ chức khám sức khỏe định kỳ cho lái xe theo quy định hoặc có tổ chức khám nhưng không đầy đủ các nội dung theo quy định; b) vi phạm quy định về kinh doanh, điều kiện kinh doanh vận tải bằng xe ô tô để xảy ra tai nạn giao thông gây hậu quả từ mức nghiêm trọng trở lên; c) sử dụng xe ô tô kinh doanh vận tải để đón, trả khách; nhận, trả hàng trên đường cao tốc. 9. phạt tiền từ 20.000.000 đồng đến 40.000.000 đồng đối với đơn vị sản xuất, lắp ráp, nhập khẩu thiết bị giám sát hành trình của xe ô tô, đơn vị cung cấp dịch vụ liên quan đến giám sát hành trình, ghi nhận hình ảnh người lái xe thực hiện một trong các hành vi sau: a) đơn vị sản xuất, lắp ráp, nhập khẩu thiết bị giám sát hành trình của xe ô tô không có nhân sự cho từng vị trí công việc theo quy định; b) đơn vị sản xuất, lắp ráp, nhập khẩu thiết bị giám sát hành trình của xe ô tô không báo cáo về việc cập nhật, thay đổi phần mềm của thiết bị theo quy định. 10. phạt tiền từ 40.000.000 đồng đến 60.000.000 đồng đối với đơn vị sản xuất, lắp ráp, nhập khẩu thiết bị ghi nhận hình ảnh người lái xe lắp trên xe ô tô, đơn vị cung cấp dịch vụ liên quan đến giám sát hành trình, ghi nhận hình ảnh người lái xe thực hiện một trong các hành vi vi phạm sau đây: a) làm sai lệch thông tin, dữ liệu của thiết bị giám sát hành trình của xe ô tô; b) làm sai lệch thông tin, dữ liệu của thiết bị ghi nhận hình ảnh người lái xe lắp trên xe ô tô. 11. phạt tiền từ 40.000.000 đồng đến 50.000.000 đồng đối với cá nhân, từ 80.000.000 đồng đến 100.000.000 đồng đối với tổ chức kinh doanh vận tải, dịch vụ hỗ trợ vận tải tái phạm hành vi quy định tại điểm a, điểm h khoản 7 điều này. 12. ngoài việc bị phạt tiền, cá nhân, tổ chức thực hiện hành vi vi phạm quy định tại điểm c khoản 2; điểm a, điểm b, điểm đ, điểm g khoản 4; điểm b, điểm c, điểm d, điểm đ, điểm e, điểm g khoản 7; điểm c khoản 8 điều này còn bị áp dụng các hình thức xử phạt bổ sung tước quyền sử dụng phù hiệu từ 01 tháng đến 03 tháng (nếu có hoặc đã được cấp) đối với xe vi phạm. 13. ngoài việc bị áp dụng hình thức xử phạt, cá nhân, tổ chức thực hiện hành vi vi phạm còn bị áp dụng các biện pháp khắc phục hậu quả sau đây: a) thực hiện hành vi quy định tại điểm a khoản 4 điều này buộc cấp thẻ nhận dạng lái xe cho lái xe theo quy định; b) thực hiện hành vi quy định tại điểm b, điểm c, điểm d khoản 4; điểm a khoản 8 điều này buộc tổ chức tập huấn, hướng dẫn nghiệp vụ, quy trình hoặc tổ chức khám sức khỏe định kỳ cho lái xe và nhân viên phục vụ trên xe theo quy định; c) thực hiện hành vi quy định tại điểm đ, điểm e khoản 4; điểm c, điểm g khoản 7 điều này buộc lắp đặt thiết bị giám sát hành trình, thiết bị ghi nhận hình ảnh người lái xe, dây đai an toàn, ghế ngồi cho trẻ em mầm non, học sinh tiểu học trên xe theo đúng quy định; d) thực hiện hành vi quy định tại điểm a, điểm h khoản 7; khoản 11 điều này buộc cung cấp, cập nhật, truyền dẫn, lưu trữ, quản lý thông tin, dữ liệu thu thập từ thiết bị giám sát hành trình, thiết bị ghi nhận hình ảnh người lái xe lắp trên xe ô tô theo quy định; đ) thực hiện hành vi quy định tại điểm c, điểm d khoản 6 điều này buộc thực hiện đúng quy định về màu sơn, biển báo dấu hiệu nhận biết của xe. 14. ngoài việc bị áp dụng hình thức xử phạt, người điều khiển phương tiện thực hiện hành vi vi phạm còn bị trừ điểm giấy phép lái xe như sau: a) thực hiện hành vi quy định tại điểm đ khoản 2; điểm b, điểm c, điểm d khoản 6; điểm b, điểm c, điểm e, điểm i khoản 7 điều này trong trường hợp cá nhân kinh doanh vận tải là người trực tiếp điều khiển phương tiện còn bị trừ điểm giấy phép lái xe 02 điểm; b) thực hiện hành vi quy định tại điểm c khoản 8 điều này trong trường hợp cá nhân kinh doanh vận tải là người trực tiếp điều khiển phương tiện còn bị trừ điểm giấy phép lái xe 06 điểm.']","**Nguồn văn bản:** 168_2024_ND-CP_619502

**Tên văn bản:** Nghị định Quy định xử phạt vi phạm hành chính về trật tự, an toàn giao thông trong lĩnh vực giao thông đường bộ; trừ điểm, phục hồi điểm giấy phép lái xe

**Điều 26:** Xử phạt các hành vi vi phạm quy định về trật tự, an toàn giao thông đường bộ trong vận tải đường bộ, dịch vụ hỗ trợ vận tải đường bộ

**Nội dung:**

7. Phạt tiền từ 5.000.000 đồng đến 6.000.000 đồng đối với cá nhân, từ 10.000.000 đồng đến 12.000.000 đồng đối với tổ chức kinh doanh vận tải, dịch vụ hỗ trợ vận tải thực hiện một trong các hành vi vi phạm sau đây:

	a) Không thực hiện việc cung cấp, cập nhật, truyền, lưu trữ, quản lý thông tin, dữ liệu từ thiết bị giám sát hành trình theo quy định.

	b) Không thực hiện đúng nội dung thông tin đã niêm yết trên xe theo quy định.

	c) Sử dụng phương tiện kinh doanh vận tải không lắp thiết bị giám sát hành trình của xe (đối với hình thức kinh doanh vận tải có quy định phương tiện phải lắp thiết bị) hoặc lắp thiết bị nhưng thiết bị không hoạt động, không đúng quy chuẩn theo quy định hoặc làm sai lệch dữ liệu của thiết bị giám sát hành trình của xe ô tô.

	d) Sử dụng xe trung chuyển chở hành khách không đúng quy định.

	đ) Sử dụng lái xe điều khiển xe khách giường nằm hai tầng, xe ô tô đưa đón trẻ em mầm non, học sinh chưa đủ số năm kinh nghiệm theo quy định.

	e) Sử dụng xe kinh doanh vận tải hành khách theo hợp đồng mà trên xe không có hợp đồng vận tải, danh sách hành khách kèm theo, thiết bị để truy cập nội dung hợp đồng điện tử và danh sách hành khách theo quy định hoặc có hợp đồng vận tải, danh sách hành khách, thiết bị để truy cập nhưng không bảo đảm yêu cầu theo quy định, chở người không có tên trong danh sách hành khách hoặc vận chuyển không đúng đối tượng theo quy định (đối với xe kinh doanh vận tải hành khách theo hợp đồng vận chuyển trẻ em mầm non, học sinh, sinh viên, cán bộ, công chức, viên chức, công nhân).

	g) Sử dụng xe ô tô kinh doanh vận tải không lắp thiết bị ghi nhận hình ảnh người lái xe theo quy định (đối với loại xe có quy định phải lắp thiết bị ghi nhận hình ảnh người lái xe) hoặc có lắp thiết bị ghi nhận hình ảnh người lái xe nhưng không ghi, không lưu trữ được dữ liệu trên xe trong quá trình xe tham gia giao thông theo quy định hoặc làm sai lệch dữ liệu của thiết bị ghi nhận hình ảnh người lái xe lắp trên xe ô tô.

	h) Không thực hiện việc cung cấp, cập nhật, truyền dẫn, lưu trữ, quản lý thông tin, dữ liệu thu thập từ thiết bị ghi nhận hình ảnh người lái xe lắp trên xe ô tô theo quy định.

	i) Sử dụng phương tiện kinh doanh vận tải có niên hạn sử dụng không bảo đảm điều kiện của hình thức kinh doanh đã đăng ký.

11. Phạt tiền từ 40.000.000 đồng đến 50.000.000 đồng đối với cá nhân, từ 80.000.000 đồng đến 100.000.000 đồng đối với tổ chức kinh doanh vận tải, dịch vụ hỗ trợ vận tải tái phạm hành vi quy định tại điểm a, điểm h khoản 7 điều này.

13. Ngoài việc bị áp dụng hình thức xử phạt, cá nhân, tổ chức thực hiện hành vi vi phạm còn bị áp dụng các biện pháp khắc phục hậu quả sau đây:
    
    a) Thực hiện hành vi quy định tại điểm a khoản 4 điều này buộc cấp thẻ nhận dạng lái xe cho lái xe theo quy định.

    b) Thực hiện hành vi quy định tại điểm b, điểm c, điểm d khoản 4; điểm a khoản 8 điều này buộc tổ chức tập huấn, hướng dẫn nghiệp vụ, quy trình hoặc tổ chức khám sức khỏe định kỳ cho lái xe và nhân viên phục vụ trên xe theo quy định.

    c) Thực hiện hành vi quy định tại điểm đ, điểm e khoản 4; điểm c, điểm g khoản 7 điều này buộc lắp đặt thiết bị giám sát hành trình, thiết bị ghi nhận hình ảnh người lái xe, dây đai an toàn, ghế ngồi cho trẻ em mầm non, học sinh tiểu học trên xe theo đúng quy định.

    d) Thực hiện hành vi quy định tại điểm a, điểm h khoản 7; khoản 11 điều này buộc cung cấp, cập nhật, truyền dẫn, lưu trữ, quản lý thông tin, dữ liệu thu thập từ thiết bị giám sát hành trình, thiết bị ghi nhận hình ảnh người lái xe lắp trên xe ô tô theo quy định.

    đ) Thực hiện hành vi quy định tại điểm c, điểm d khoản 6 điều này buộc thực hiện đúng quy định về màu sơn, biển báo dấu hiệu nhận biết của xe.


**Tóm lại:** Xe ô tô kinh doanh vận tải phải lắp đặt thiết bị giám sát hành trình, cung cấp, cập nhật, truyền dẫn, lưu trữ và quản lý dữ liệu từ thiết bị. Nếu không lắp đặt, lắp đặt thiết bị không hoạt động, không đúng quy chuẩn, làm sai lệch dữ liệu hoặc không thực hiện việc cung cấp, cập nhật dữ liệu sẽ bị phạt tiền từ 5.000.000 - 6.000.000 đồng đối với cá nhân và 10.000.000 - 12.000.000 đồng đối với tổ chức. Trường hợp tái phạm sẽ bị phạt nặng hơn.
","Bắt buộc lắp đặt thiết bị giám sát hành trình trên tất cả các xe ô tô kinh doanh vận tải để theo dõi tốc độ, thời gian lái xe và hành trình.",1.0,0.46353710488205735,1.0,0.0
30,Luật Giao thông Đường bộ 2025 có quy định gì về việc sử dụng xe đạp điện trong khu vực đô thị?,"['1. xe buýt, xe chở người bốn bánh có gắn động cơ phải hoạt động đúng tuyến, đúng lịch trình, thời gian được phép hoạt động và dừng xe, đỗ xe đúng nơi quy định. 2. xe taxi đón, trả hành khách theo thỏa thuận giữa hành khách và người lái xe nhưng phải chấp hành các quy định của pháp luật về trật tự, an toàn giao thông đường bộ khi đón, trả hành khách. 3. xe chở hàng phải hoạt động đúng tuyến, phạm vi và thời gian quy định đối với từng loại xe. 4. xe vệ sinh môi trường, xe ô tô chở vật liệu xây dựng, phế thải rời phải được che phủ kín, không để rơi vãi trên đường phố và có thời gian hoạt động theo quy định của ủy ban nhân dân cấp tỉnh. 5. ủy ban nhân dân cấp tỉnh quy định về hoạt động vận tải đường bộ trong đô thị và tỷ lệ phương tiện vận chuyển hành khách công cộng có thiết bị hỗ trợ cho người khuyết tật trong đô thị.']","**Nguồn văn bản:** 36_2024_QH15_444251

**Tên văn bản:** Luật Trật tự, an toàn giao thông đường bộ

**Điều 44:** Bảo đảm trật tự, an toàn giao thông đường bộ đối với phương tiện vận tải đường bộ trong đô thị

**Nội dung:**

1. Xe buýt, xe chở người bốn bánh có gắn động cơ phải hoạt động đúng tuyến, đúng lịch trình, thời gian được phép hoạt động và dừng xe, đỗ xe đúng nơi quy định.

2. Xe taxi đón, trả hành khách theo thỏa thuận giữa hành khách và người lái xe nhưng phải chấp hành các quy định của pháp luật về trật tự, an toàn giao thông đường bộ khi đón, trả hành khách.

3. Xe chở hàng phải hoạt động đúng tuyến, phạm vi và thời gian quy định đối với từng loại xe.

4. Xe vệ sinh môi trường, xe ô tô chở vật liệu xây dựng, phế thải rời phải được che phủ kín, không để rơi vãi trên đường phố và có thời gian hoạt động theo quy định của ủy ban nhân dân cấp tỉnh.

5. Ủy ban nhân dân cấp tỉnh quy định về hoạt động vận tải đường bộ trong đô thị và tỷ lệ phương tiện vận chuyển hành khách công cộng có thiết bị hỗ trợ cho người khuyết tật trong đô thị.

Tóm lại: Đoạn luật này không đề cập đến việc sử dụng xe đạp điện trong khu vực đô thị. Nó tập trung vào quy định hoạt động của các loại xe như xe buýt, taxi, xe chở hàng, xe vệ sinh,... trong đô thị.
",Người điều khiển xe đạp điện trong khu vực đô thị phải tuân thủ các quy định về tốc độ tối đa và không được đi vào làn đường dành cho người đi bộ.,0.7894736842105263,0.49627919099795664,0.0,0.0
31,Quy định mới về việc sử dụng xe máy trong khu vực cấm là gì?,"['1. phạt tiền từ 400.000 đồng đến 600.000 đồng đối với người điều khiển xe thực hiện một trong các hành vi vi phạm sau đây: a) không chấp hành hiệu lệnh, chỉ dẫn của biển báo hiệu, vạch kẻ đường, trừ các hành vi vi phạm quy định tại điểm a, điểm c, điểm d, điểm đ khoản 2; điểm a, điểm d, điểm đ, điểm e, điểm n, điểm o khoản 3; điểm a, điểm b, điểm đ, điểm e, điểm i, điểm k, điểm l khoản 4; điểm a, điểm b, điểm c, điểm d, điểm đ, điểm i, điểm k khoản 5; điểm a khoản 6; khoản 7; điểm b, điểm d khoản 9; điểm a khoản 10; điểm đ khoản 11 điều này; b) khi ra, vào vị trí dừng xe, đỗ xe không có tín hiệu báo cho người điều khiển phương tiện khác biết; c) không báo hiệu bằng đèn khẩn cấp hoặc không đặt biển cảnh báo “chú ý xe đỗ” theo quy định trong trường hợp gặp sự cố kỹ thuật (hoặc bất khả kháng khác) buộc phải đỗ xe chiếm một phần đường xe chạy hoặc tại nơi không được phép đỗ xe, trừ hành vi vi phạm quy định tại điểm c khoản 7 điều này; d) không gắn biển báo hiệu ở phía trước xe kéo, phía sau xe được kéo; điều khiển xe kéo rơ moóc không có biển báo hiệu theo quy định; đ) sử dụng còi trong thời gian từ 22 giờ ngày hôm trước đến 05 giờ ngày hôm sau trong khu đông dân cư, khu vực cơ sở khám bệnh, chữa bệnh, trừ các xe ưu tiên đang đi làm nhiệm vụ theo quy định. 2. phạt tiền từ 600.000 đồng đến 800.000 đồng đối với người điều khiển xe thực hiện một trong các hành vi vi phạm sau đây: a) chuyển làn đường không đúng nơi cho phép hoặc không có tín hiệu báo trước hoặc chuyển làn đường không đúng quy định “mỗi lần chuyển làn đường chỉ được phép chuyển sang một làn đường liền kề”, trừ các hành vi vi phạm quy định tại điểm g khoản 5 điều này; b) chở người trên buồng lái quá số lượng quy định; c) không tuân thủ các quy định về nhường đường tại nơi đường bộ giao nhau, trừ các hành vi vi phạm quy định tại điểm n, điểm o khoản 5 điều này; d) dừng xe, đỗ xe trên phần đường xe chạy ở đoạn đường ngoài đô thị nơi có lề đường rộng; dừng xe, đỗ xe không sát mép đường phía bên phải theo chiều đi ở nơi đường có lề đường hẹp hoặc không có lề đường; dừng xe, đỗ xe ngược với chiều lưu thông của làn đường; dừng xe, đỗ xe trên dải phân cách cố định ở giữa hai phần đường xe chạy; đỗ xe trên dốc không chèn bánh; đ) dừng xe không sát theo lề đường, vỉa hè phía bên phải theo chiều đi hoặc bánh xe gần nhất cách lề đường, vỉa hè quá 0,25 mét; dừng xe trên đường dành riêng cho xe buýt; dừng xe trên miệng cống thoát nước, miệng hầm của đường điện thoại, điện cao thế, chỗ dành riêng cho xe chữa cháy lấy nước; rời vị trí lái, tắt máy khi dừng xe (trừ trường hợp rời khỏi vị trí lái để đóng, mở cửa xe, xếp dỡ hàng hóa, kiểm tra kỹ thuật xe) hoặc rời vị trí lái khi dừng xe nhưng không sử dụng phanh đỗ xe (hoặc thực hiện biện pháp an toàn khác); dừng xe, đỗ xe không đúng vị trí quy định ở những đoạn có bố trí nơi dừng xe, đỗ xe; dừng xe, đỗ xe trên phần đường dành cho người đi bộ qua đường; dừng xe nơi có biển “cấm dừng xe và đỗ xe”, trừ hành vi vi phạm quy định tại điểm đ khoản 4, điểm c khoản 7 điều này. 3. phạt tiền từ 800.000 đồng đến 1.000.000 đồng đối với người điều khiển xe thực hiện một trong các hành vi vi phạm sau đây: a) điều khiển xe chạy quá tốc độ quy định từ 05 km/h đến dưới 10 km/h; b) sử dụng còi, rú ga liên tục; sử dụng còi hơi, sử dụng đèn chiếu xa khi gặp người đi bộ qua đường hoặc khi đi trên đoạn đường qua khu dân cư có hệ thống chiếu sáng đang hoạt động hoặc khi gặp xe đi ngược chiều (trừ trường hợp dải phân cách có khả năng chống chói) hoặc khi chuyển hướng xe tại nơi đường giao nhau, trừ các xe ưu tiên đang đi làm nhiệm vụ theo quy định; c) chuyển hướng không quan sát hoặc không bảo đảm khoảng cách an toàn với xe phía sau hoặc không giảm tốc độ hoặc không có tín hiệu báo hướng rẽ hoặc có tín hiệu báo hướng rẽ nhưng không sử dụng liên tục trong quá trình chuyển hướng (trừ trường hợp điều khiển xe đi theo hướng cong của đoạn đường bộ ở nơi đường không giao nhau cùng mức); d) không tuân thủ các quy định về dừng xe, đỗ xe tại nơi đường bộ giao nhau cùng mức với đường sắt; dừng xe, đỗ xe trong phạm vi bảo vệ công trình đường sắt, phạm vi an toàn của đường sắt; đ) dừng xe, đỗ xe tại vị trí: nơi đường bộ giao nhau hoặc trong phạm vi 05 mét tính từ mép đường giao nhau; điểm đón, trả khách; trước cổng hoặc trong phạm vi 05 mét hai bên cổng trụ sở cơ quan, tổ chức có bố trí đường cho xe ra, vào; nơi phần đường có bề rộng chỉ đủ cho một làn xe cơ giới; che khuất biển báo hiệu đường bộ, đèn tín hiệu giao thông; nơi mở dải phân cách giữa; cách xe ô tô đang đỗ ngược chiều dưới 20 mét trên đường phố hẹp, dưới 40 mét trên đường có một làn xe cơ giới trên một chiều đường; e) đỗ xe không sát theo lề đường, vỉa hè phía bên phải theo chiều đi hoặc bánh xe gần nhất cách lề đường, vỉa hè quá 0,25 mét; đỗ xe trên đường dành riêng cho xe buýt; đỗ xe trên miệng cống thoát nước, miệng hầm của đường điện thoại, điện cao thế, chỗ dành riêng cho xe chữa cháy lấy nước; đỗ, để xe ở vỉa hè trái quy định của pháp luật; đỗ xe nơi có biển “cấm đỗ xe” hoặc biển “cấm dừng xe và đỗ xe”, trừ hành vi vi phạm quy định tại điểm đ khoản 4, điểm c khoản 7 điều này; g) không sử dụng hoặc sử dụng không đủ đèn chiếu sáng trong thời gian từ 18 giờ ngày hôm trước đến 06 giờ ngày hôm sau hoặc khi có sương mù, khói, bụi, trời mưa, thời tiết xấu làm hạn chế tầm nhìn; h) điều khiển xe ô tô kéo theo xe khác, vật khác (trừ trường hợp kéo theo một rơ moóc, sơ mi rơ moóc hoặc một xe ô tô, xe máy chuyên dùng khác khi xe này không tự chạy được); điều khiển xe ô tô đẩy xe khác, vật khác; điều khiển xe kéo rơ moóc, sơ mi rơ moóc kéo thêm rơ moóc hoặc xe khác, vật khác; không nối chắc chắn, an toàn giữa xe kéo và xe được kéo khi kéo nhau; i) chở người trên xe được kéo, trừ người điều khiển; k) không thắt dây đai an toàn khi điều khiển xe chạy trên đường; l) chở người trên xe ô tô không thắt dây đai an toàn (tại vị trí có trang bị dây đai an toàn) khi xe đang chạy; m) chở trẻ em dưới 10 tuổi và chiều cao dưới 1,35 mét trên xe ô tô ngồi cùng hàng ghế với người lái xe (trừ loại xe ô tô chỉ có một hàng ghế) hoặc không sử dụng thiết bị an toàn phù hợp cho trẻ em theo quy định; n) chạy trong hầm đường bộ không sử dụng đèn chiếu sáng gần; o) điều khiển xe chạy dưới tốc độ tối thiểu trên đoạn đường bộ có quy định tốc độ tối thiểu cho phép; p) điều khiển xe chạy tốc độ thấp hơn các xe khác đi cùng chiều mà không đi về làn đường bên phải chiều đi của mình, trừ trường hợp các xe khác đi cùng chiều chạy quá tốc độ quy định. 4. phạt tiền từ 2.000.000 đồng đến 3.000.000 đồng đối với người điều khiển xe thực hiện một trong các hành vi vi phạm sau đây: a) điều khiển xe không đủ điều kiện đã thu phí theo hình thức điện tử tự động không dừng (xe không gắn thẻ đầu cuối) đi vào làn đường dành riêng thu phí theo hình thức điện tử tự động không dừng tại các trạm thu phí; b) dừng xe, đỗ xe tại vị trí: bên trái đường một chiều hoặc bên trái (theo hướng lưu thông) của đường đôi; trên đoạn đường cong hoặc gần đầu dốc nơi tầm nhìn bị che khuất; trên cầu (trừ trường hợp tổ chức giao thông cho phép), gầm cầu vượt (trừ những nơi cho phép dừng xe, đỗ xe), song song với một xe khác đang dừng, đỗ, trừ hành vi vi phạm quy định tại điểm c khoản 7 điều này; c) không thực hiện biện pháp bảo đảm an toàn theo quy định khi xe ô tô bị hư hỏng ngay tại nơi đường bộ giao nhau cùng mức với đường sắt; d) không nhường đường cho xe xin vượt khi có đủ điều kiện an toàn; đ) lùi xe, quay đầu xe trong hầm đường bộ; dừng xe, đỗ xe trong hầm đường bộ không đúng nơi quy định; không có báo hiệu bằng đèn khẩn cấp, không đặt biển cảnh báo ""chú ý xe đỗ"" (hoặc đèn cảnh báo) về phía sau xe khoảng cách đảm bảo an toàn khi dừng xe, đỗ xe trong hầm đường bộ trong trường hợp gặp sự cố kỹ thuật hoặc bất khả kháng khác buộc phải dừng xe, đỗ xe; e) lùi xe ở đường một chiều, đường có biển “cấm đi ngược chiều”, khu vực cấm dừng, trên phần đường dành cho người đi bộ qua đường, nơi đường bộ giao nhau, nơi đường bộ giao nhau cùng mức với đường sắt, nơi tầm nhìn bị che khuất; lùi xe không quan sát hai bên, phía sau xe hoặc không có tín hiệu lùi xe, trừ hành vi vi phạm quy định tại điểm đ khoản 11 điều này; g) điều khiển xe có liên quan trực tiếp đến vụ tai nạn giao thông mà không dừng ngay phương tiện, không giữ nguyên hiện trường, không trợ giúp người bị nạn, trừ hành vi vi phạm quy định tại khoản 8 điều này; h) xe được quyền ưu tiên lắp đặt, sử dụng thiết bị phát tín hiệu ưu tiên không đúng quy định hoặc sử dụng thiết bị phát tín hiệu ưu tiên mà không có giấy phép của cơ quan có thẩm quyền cấp hoặc có giấy phép của cơ quan có thẩm quyền cấp nhưng không còn giá trị sử dụng theo quy định; i) quay đầu xe ở phần đường dành cho người đi bộ qua đường, trên cầu, đầu cầu, gầm cầu vượt, ngầm, tại nơi đường bộ giao nhau cùng mức với đường sắt, đường hẹp, đường dốc, đoạn đường cong tầm nhìn bị che khuất, trên đường một chiều, trừ khi có hiệu lệnh của người điều khiển giao thông hoặc chỉ dẫn của biển báo hiệu tạm thời hoặc tổ chức giao thông tại những khu vực này có bố trí nơi quay đầu xe; k) quay đầu xe tại nơi có biển báo hiệu có nội dung cấm quay đầu đối với loại phương tiện đang điều khiển; điều khiển xe rẽ trái tại nơi có biển báo hiệu có nội dung cấm rẽ trái đối với loại phương tiện đang điều khiển; điều khiển xe rẽ phải tại nơi có biển báo hiệu có nội dung cấm rẽ phải đối với loại phương tiện đang điều khiển; l) không giữ khoảng cách an toàn để xảy ra va chạm với xe chạy liền trước hoặc không giữ khoảng cách theo quy định của biển báo hiệu “cự ly tối thiểu giữa hai xe”, trừ các hành vi vi phạm quy định tại điểm d khoản 5 điều này. 5. phạt tiền từ 4.000.000 đồng đến 6.000.000 đồng đối với người điều khiển xe thực hiện một trong các hành vi vi phạm sau đây: a) vượt xe trong những trường hợp không được vượt, vượt xe tại đoạn đường có biển báo hiệu có nội dung cấm vượt (đối với loại phương tiện đang điều khiển); không có tín hiệu trước khi vượt hoặc có tín hiệu vượt xe nhưng không sử dụng trong suốt quá trình vượt xe; vượt bên phải xe khác trong trường hợp không được phép; b) điều khiển xe không đi bên phải theo chiều đi của mình; đi không đúng phần đường hoặc làn đường quy định (làn cùng chiều hoặc làn ngược chiều) trừ hành vi quy định tại điểm a khoản 4 điều này; điều khiển xe đi qua dải phân cách cố định ở giữa hai phần đường xe chạy; c) tránh xe đi ngược chiều không đúng quy định (trừ hành vi vi phạm sử dụng đèn chiếu xa khi tránh xe đi ngược chiều quy định tại điểm b khoản 3 điều này); không nhường đường cho xe đi ngược chiều theo quy định tại nơi đường hẹp, đường dốc, nơi có chướng ngại vật; d) không tuân thủ quy định khi vào hoặc ra đường cao tốc; điều khiển xe chạy ở làn dừng xe khẩn cấp hoặc phần lề đường của đường cao tốc; không tuân thủ quy định về khoảng cách an toàn đối với xe chạy liền trước khi chạy trên đường cao tốc; đ) điều khiển xe chạy quá tốc độ quy định từ 10 km/h đến 20 km/h; e) xe không được quyền ưu tiên lắp đặt, sử dụng thiết bị phát tín hiệu của xe được quyền ưu tiên; g) chuyển làn đường không đúng nơi cho phép hoặc không có tín hiệu báo trước hoặc chuyển làn đường không đúng quy định “mỗi lần chuyển làn đường chỉ được phép chuyển sang một làn đường liền kề” khi chạy trên đường cao tốc; h) dùng tay cầm và sử dụng điện thoại hoặc các thiết bị điện tử khác khi điều khiển phương tiện tham gia giao thông đang di chuyển trên đường bộ; i) đi vào khu vực cấm, đường có biển báo hiệu có nội dung cấm đi vào đối với loại phương tiện đang điều khiển, trừ các hành vi vi phạm quy định tại điểm d khoản 9, điểm đ khoản 11 điều này, hành vi bị cấm đi vào công trình thủy lợi và các trường hợp xe ưu tiên đang đi làm nhiệm vụ khẩn cấp theo quy định; k) dừng xe, đỗ xe, quay đầu xe trái quy định gây ùn tắc giao thông; l) chuyển hướng không nhường quyền đi trước cho: người đi bộ, xe lăn của người khuyết tật qua đường tại nơi có vạch kẻ đường dành cho người đi bộ; xe thô sơ đang đi trên phần đường dành cho xe thô sơ; m) chuyển hướng không nhường đường cho: các xe đi ngược chiều; người đi bộ, xe thô sơ đang qua đường tại nơi không có vạch kẻ đường cho người đi bộ; n) không giảm tốc độ (hoặc dừng lại) và nhường đường khi điều khiển xe đi từ đường không ưu tiên ra đường ưu tiên, từ đường nhánh ra đường chính; o) không giảm tốc độ và nhường đường cho xe đi đến từ bên phải tại nơi đường giao nhau không có báo hiệu đi theo vòng xuyến; không giảm tốc độ và nhường đường cho xe đi đến từ bên trái tại nơi đường giao nhau có báo hiệu đi theo vòng xuyến; p) chở người trên thùng xe trái quy định; chở người trên nóc xe; để người đu bám ở cửa xe, bên ngoài thành xe khi xe đang chạy; q) mở cửa xe, để cửa xe mở không bảo đảm an toàn. 6. phạt tiền từ 6.000.000 đồng đến 8.000.000 đồng đối với người điều khiển xe thực hiện một trong các hành vi vi phạm sau đây: a) điều khiển xe chạy quá tốc độ quy định trên 20 km/h đến 35 km/h; b) không nhường đường hoặc gây cản trở xe được quyền ưu tiên đang phát tín hiệu ưu tiên đi làm nhiệm vụ; c) điều khiển xe trên đường mà trong máu hoặc hơi thở có nồng độ cồn nhưng chưa vượt quá 50 miligam/100 mililít máu hoặc chưa vượt quá 0,25 miligam/1 lít khí thở; d) điều khiển xe đi trên vỉa hè, trừ trường hợp điều khiển xe đi qua vỉa hè để vào nhà, cơ quan. 7. phạt tiền từ 12.000.000 đồng đến 14.000.000 đồng đối với người điều khiển xe thực hiện một trong các hành vi vi phạm sau đây: a) điều khiển xe chạy quá tốc độ quy định trên 35 km/h; b) điều khiển xe chở người bốn bánh có gắn động cơ, xe chở hàng bốn bánh có gắn động cơ đi vào đường cao tốc; c) dừng xe, đỗ xe trên đường cao tốc không đúng nơi quy định; không có báo hiệu bằng đèn khẩn cấp khi gặp sự cố kỹ thuật hoặc bất khả kháng khác buộc phải dừng xe, đỗ xe ở làn dừng xe khẩn cấp trên đường cao tốc; không có báo hiệu bằng đèn khẩn cấp, không đặt biển cảnh báo “chú ý xe đỗ” (hoặc đèn cảnh báo) về phía sau xe khoảng cách tối thiểu 150 mét khi dừng xe, đỗ xe trong trường hợp gặp sự cố kỹ thuật hoặc bất khả kháng khác buộc phải dừng xe, đỗ xe trên một phần làn đường xe chạy trên đường cao tốc. 8. phạt tiền từ 16.000.000 đồng đến 18.000.000 đồng đối với người điều khiển xe thực hiện hành vi vi phạm gây tai nạn giao thông không dừng ngay phương tiện, không giữ nguyên hiện trường, không trợ giúp người bị nạn, không ở lại hiện trường hoặc không đến trình báo ngay với cơ quan công an, ủy ban nhân dân nơi gần nhất. 9. phạt tiền từ 18.000.000 đồng đến 20.000.000 đồng đối với người điều khiển xe thực hiện một trong các hành vi vi phạm sau đây: a) điều khiển xe trên đường mà trong máu hoặc hơi thở có nồng độ cồn vượt quá 50 miligam đến 80 miligam/100 mililít máu hoặc vượt quá 0,25 miligam đến 0,4 miligam/1 lít khí thở; b) không chấp hành hiệu lệnh của đèn tín hiệu giao thông; c) không chấp hành hiệu lệnh, hướng dẫn của người điều khiển giao thông hoặc người kiểm soát giao thông; d) đi ngược chiều của đường một chiều, đi ngược chiều trên đường có biển ""cấm đi ngược chiều”, trừ các hành vi vi phạm quy định tại điểm đ khoản 11 điều này và các trường hợp xe ưu tiên đang đi làm nhiệm vụ khẩn cấp theo quy định. 10. phạt tiền từ 20.000.000 đồng đến 22.000.000 đồng đối với người điều khiển xe thực hiện một trong các hành vi vi phạm sau đây: a) điều khiển xe không quan sát, giảm tốc độ hoặc dừng lại để bảo đảm an toàn theo quy định mà gây tai nạn giao thông; điều khiển xe chạy quá tốc độ quy định gây tai nạn giao thông; dừng xe, đỗ xe, quay đầu xe, lùi xe, tránh xe, vượt xe, chuyển hướng, chuyển làn đường không đúng quy định gây tai nạn giao thông; không đi đúng phần đường, làn đường, không giữ khoảng cách an toàn giữa hai xe theo quy định gây tai nạn giao thông hoặc đi vào đường có biển báo hiệu có nội dung cấm đi vào đối với loại phương tiện đang điều khiển gây tai nạn giao thông, trừ các hành vi vi phạm quy định tại điểm đ khoản 11 điều này; b) vi phạm quy định tại một trong các điểm, khoản sau của điều này mà gây tai nạn giao thông: điểm a, điểm b, điểm c, điểm d, điểm đ khoản 1; điểm c khoản 2; điểm b, điểm g, điểm h, điểm n, điểm o, điểm p, khoản 3; điểm a, điểm c, điểm d khoản 4; điểm c, điểm d, điểm e, điểm h, điểm n, điểm o, điểm q khoản 5; điểm b khoản 7; điểm b, điểm c, điểm d khoản 9 điều này. 11. phạt tiền từ 30.000.000 đồng đến 40.000.000 đồng đối với người điều khiển xe thực hiện một trong các hành vi vi phạm sau đây: a) điều khiển xe trên đường mà trong máu hoặc hơi thở có nồng độ cồn vượt quá 80 miligam/100 mililít máu hoặc vượt quá 0,4 miligam/1 lít khí thở; b) không chấp hành yêu cầu kiểm tra về nồng độ cồn của người thi hành công vụ; c) điều khiển xe trên đường mà trong cơ thể có chất ma túy hoặc chất kích thích khác mà pháp luật cấm sử dụng; d) không chấp hành yêu cầu kiểm tra về chất ma túy hoặc chất kích thích khác mà pháp luật cấm sử dụng của người thi hành công vụ; đ) điều khiển xe đi ngược chiều trên đường cao tốc, lùi xe trên đường cao tốc, quay đầu xe trên đường cao tốc, trừ các xe ưu tiên đang đi làm nhiệm vụ khẩn cấp theo quy định. 12. phạt tiền từ 40.000.000 đồng đến 50.000.000 đồng đối với người điều khiển xe thực hiện hành vi điều khiển xe lạng lách, đánh võng trên đường bộ; chạy quá tốc độ đuổi nhau trên đường bộ; dùng chân điều khiển vô lăng xe khi xe đang chạy trên đường bộ. 13. phạt tiền từ 50.000.000 đồng đến 70.000.000 đồng đối với người điều khiển xe thực hiện hành vi vi phạm quy định tại khoản 12 điều này mà gây tai nạn giao thông. 14. tịch thu phương tiện đối với người điều khiển xe tái phạm hành vi điều khiển xe lạng lách, đánh võng quy định tại khoản 12 điều này. 15. ngoài việc bị phạt tiền, người điều khiển xe thực hiện hành vi vi phạm còn bị áp dụng các hình thức xử phạt bổ sung sau đây: a) thực hiện hành vi quy định tại điểm e khoản 5 điều này còn bị tịch thu thiết bị phát tín hiệu ưu tiên lắp đặt, sử dụng trái quy định; b) thực hiện hành vi quy định tại khoản 12 điều này bị tước quyền sử dụng giấy phép lái xe từ 10 tháng đến 12 tháng; c) thực hiện hành vi quy định tại điểm a, điểm b, điểm c, điểm d khoản 11; khoản 13; khoản 14 điều này bị tước quyền sử dụng giấy phép lái xe từ 22 tháng đến 24 tháng. 16. ngoài việc bị áp dụng hình thức xử phạt, người điều khiển xe thực hiện hành vi vi phạm còn bị trừ điểm giấy phép lái xe như sau: a) thực hiện hành vi quy định tại điểm h, điểm i khoản 3; điểm a, điểm b, điểm c, điểm d, điểm đ, điểm g khoản 4; điểm a, điểm b, điểm c, điểm d, điểm đ, điểm e, điểm g, điểm i, điểm k, điểm n, điểm o khoản 5 điều này bị trừ điểm giấy phép lái xe 02 điểm; b) thực hiện hành vi quy định tại điểm h khoản 5; khoản 6; điểm b khoản 7; điểm b, điểm c, điểm d khoản 9 điều này bị trừ điểm giấy phép lái xe 04 điểm; c) thực hiện hành vi quy định tại điểm p khoản 5; điểm a, điểm c khoản 7; khoản 8 điều này bị trừ điểm giấy phép lái xe 06 điểm; d) thực hiện hành vi quy định tại điểm a khoản 9, khoản 10, điểm đ khoản 11 điều này bị trừ điểm giấy phép lái xe 10 điểm.']","Không tìm thấy thông tin liên quan tới câu hỏi này.
","Cấm xe máy lưu thông trong các khu vực cấm theo biển báo, đặc biệt trong giờ cao điểm.",0.0,-0.0,0.0,0.0
32,Luật Giao thông Đường bộ 2025 có quy định gì về việc sử dụng xe ô tô cá nhân trong giờ cao điểm?,"['1. chỉ được sử dụng tín hiệu còi của phương tiện tham gia giao thông đường bộ trong các trường hợp sau đây: a) báo hiệu cho người tham gia giao thông đường bộ khi xuất hiện tình huống có thể mất an toàn giao thông; b) báo hiệu chuẩn bị vượt xe. 2. không sử dụng còi liên tục; không sử dụng còi có âm lượng không đúng quy định; không sử dụng còi trong thời gian từ 22 giờ ngày hôm trước đến 05 giờ ngày hôm sau trong khu đông dân cư, khu vực cơ sở khám bệnh, chữa bệnh, trừ xe ưu tiên.']","Không tìm thấy thông tin liên quan tới câu hỏi này.
",Hạn chế xe ô tô cá nhân lưu thông trong một số khu vực trung tâm thành phố trong giờ cao điểm để giảm ùn tắc giao thông.,0.0,0.0,0.0,0.0
33,Quy định mới về việc sử dụng xe ô tô điện là gì?,"['thông tư quy định về phân loại phương tiện giao thông đường bộ và dấu hiệu nhận biết xe cơ giới sử dụng năng lượng sạch, năng lượng xanh, thân thiện môi trường.']","**Nguồn văn bản:** 53_2024_TT-BGTVT_624420

**Tên văn bản:** Thông tư Quy định về phân loại phương tiện giao thông đường bộ và dấu hiệu nhận biết xe cơ giới sử dụng năng lượng sạch, năng lượng xanh, thân thiện môi trường

**Điều 1:** phạm vi điều chỉnh

**Nội dung:**

Thông tư quy định về phân loại phương tiện giao thông đường bộ và dấu hiệu nhận biết xe cơ giới sử dụng năng lượng sạch, năng lượng xanh, thân thiện môi trường.

Tóm lại: Văn bản này quy định về phân loại phương tiện giao thông đường bộ và dấu hiệu nhận biết xe cơ giới sử dụng năng lượng sạch, năng lượng xanh, thân thiện môi trường, nhưng chưa đề cập cụ thể đến quy định về việc sử dụng xe ô tô điện.
",Khuyến khích sử dụng xe ô tô điện bằng cách miễn phí đỗ xe tại một số khu vực và giảm thuế trước bạ.,0.5,0.5977275339291396,0.0,0.0
34,Luật Giao thông Đường bộ 2025 có quy định gì về việc sử dụng xe ô tô tự lái?,"['thông tư này áp dụng đối với người lái xe, người điều khiển xe máy chuyên dùng và tổ chức, cá nhân liên quan đến quản lý và thực hiện các quy định về tốc độ thiết kế, tốc độ khai thác của đường bộ và khoảng cách an toàn của xe cơ giới, xe máy chuyên dùng khi tham gia giao thông trên đường bộ.']","Không tìm thấy thông tin liên quan tới câu hỏi này.
",Xe ô tô tự lái phải được cấp phép và đáp ứng các tiêu chuẩn an toàn kỹ thuật trước khi tham gia giao thông.,0.0,-0.0,0.0,0.0
35,Quy định mới về việc sử dụng xe máy phân khối lớn trong khu vực đô thị là gì?,"['1. xe buýt, xe chở người bốn bánh có gắn động cơ phải hoạt động đúng tuyến, đúng lịch trình, thời gian được phép hoạt động và dừng xe, đỗ xe đúng nơi quy định. 2. xe taxi đón, trả hành khách theo thỏa thuận giữa hành khách và người lái xe nhưng phải chấp hành các quy định của pháp luật về trật tự, an toàn giao thông đường bộ khi đón, trả hành khách. 3. xe chở hàng phải hoạt động đúng tuyến, phạm vi và thời gian quy định đối với từng loại xe. 4. xe vệ sinh môi trường, xe ô tô chở vật liệu xây dựng, phế thải rời phải được che phủ kín, không để rơi vãi trên đường phố và có thời gian hoạt động theo quy định của ủy ban nhân dân cấp tỉnh. 5. ủy ban nhân dân cấp tỉnh quy định về hoạt động vận tải đường bộ trong đô thị và tỷ lệ phương tiện vận chuyển hành khách công cộng có thiết bị hỗ trợ cho người khuyết tật trong đô thị.']","**Nguồn văn bản:** 36_2024_QH15_444251

**Tên văn bản:** Luật Trật tự, an toàn giao thông đường bộ

**Điều 44:** Bảo đảm trật tự, an toàn giao thông đường bộ đối với phương tiện vận tải đường bộ trong đô thị

**Nội dung:**

1. Xe buýt, xe chở người bốn bánh có gắn động cơ phải hoạt động đúng tuyến, đúng lịch trình, thời gian được phép hoạt động và dừng xe, đỗ xe đúng nơi quy định.

2. Xe taxi đón, trả hành khách theo thỏa thuận giữa hành khách và người lái xe nhưng phải chấp hành các quy định của pháp luật về trật tự, an toàn giao thông đường bộ khi đón, trả hành khách.

3. Xe chở hàng phải hoạt động đúng tuyến, phạm vi và thời gian quy định đối với từng loại xe.

4. Xe vệ sinh môi trường, xe ô tô chở vật liệu xây dựng, phế thải rời phải được che phủ kín, không để rơi vãi trên đường phố và có thời gian hoạt động theo quy định của ủy ban nhân dân cấp tỉnh.

5. Ủy ban nhân dân cấp tỉnh quy định về hoạt động vận tải đường bộ trong đô thị và tỷ lệ phương tiện vận chuyển hành khách công cộng có thiết bị hỗ trợ cho người khuyết tật trong đô thị.

Tóm lại: Văn bản này không đề cập đến quy định cụ thể về việc sử dụng xe máy phân khối lớn trong khu vực đô thị. Nó chỉ quy định về hoạt động của các loại xe vận tải đường bộ như xe buýt, taxi, xe chở hàng, xe vệ sinh,... trong đô thị.
",Người điều khiển xe máy phân khối lớn trong khu vực đô thị phải có giấy phép lái xe hạng A và tuân thủ các quy định về tốc độ.,0.7368421052631579,0.5353761802116052,0.0,0.0
36,Luật Giao thông Đường bộ 2025 có quy định gì về việc sử dụng xe ô tô chở hàng trong khu vực dân cư?,"['1. xe buýt, xe chở người bốn bánh có gắn động cơ phải hoạt động đúng tuyến, đúng lịch trình, thời gian được phép hoạt động và dừng xe, đỗ xe đúng nơi quy định. 2. xe taxi đón, trả hành khách theo thỏa thuận giữa hành khách và người lái xe nhưng phải chấp hành các quy định của pháp luật về trật tự, an toàn giao thông đường bộ khi đón, trả hành khách. 3. xe chở hàng phải hoạt động đúng tuyến, phạm vi và thời gian quy định đối với từng loại xe. 4. xe vệ sinh môi trường, xe ô tô chở vật liệu xây dựng, phế thải rời phải được che phủ kín, không để rơi vãi trên đường phố và có thời gian hoạt động theo quy định của ủy ban nhân dân cấp tỉnh. 5. ủy ban nhân dân cấp tỉnh quy định về hoạt động vận tải đường bộ trong đô thị và tỷ lệ phương tiện vận chuyển hành khách công cộng có thiết bị hỗ trợ cho người khuyết tật trong đô thị.']","**Nguồn văn bản:** 36_2024_QH15_444251

**Tên văn bản:** Luật Trật tự, an toàn giao thông đường bộ

**Điều 44:** Bảo đảm trật tự, an toàn giao thông đường bộ đối với phương tiện vận tải đường bộ trong đô thị

**Nội dung:**

1. Xe buýt, xe chở người bốn bánh có gắn động cơ phải hoạt động đúng tuyến, đúng lịch trình, thời gian được phép hoạt động và dừng xe, đỗ xe đúng nơi quy định.

2. Xe taxi đón, trả hành khách theo thỏa thuận giữa hành khách và người lái xe nhưng phải chấp hành các quy định của pháp luật về trật tự, an toàn giao thông đường bộ khi đón, trả hành khách.

3. Xe chở hàng phải hoạt động đúng tuyến, phạm vi và thời gian quy định đối với từng loại xe.

4. Xe vệ sinh môi trường, xe ô tô chở vật liệu xây dựng, phế thải rời phải được che phủ kín, không để rơi vãi trên đường phố và có thời gian hoạt động theo quy định của ủy ban nhân dân cấp tỉnh.

5. Ủy ban nhân dân cấp tỉnh quy định về hoạt động vận tải đường bộ trong đô thị và tỷ lệ phương tiện vận chuyển hành khách công cộng có thiết bị hỗ trợ cho người khuyết tật trong đô thị.


Tóm lại: Đối với xe ô tô chở hàng hoạt động trong khu vực đô thị, Luật quy định phải hoạt động đúng tuyến đường, phạm vi hoạt động và thời gian được phép hoạt động theo quy định.  Việc quy định cụ thể do Ủy ban nhân dân cấp tỉnh ban hành.
",Hạn chế xe ô tô chở hàng có trọng tải lớn lưu thông trong khu vực dân cư vào ban đêm để giảm tiếng ồn.,0.8,0.521356902138805,0.0,0.0
37,Quy định mới về việc sử dụng xe ô tô chở khách trong khu vực du lịch là gì?,"['1. đơn vị kinh doanh vận tải hành khách bằng xe ô tô có các quyền sau đây: a) thu tiền vận tải; b) từ chối vận tải hành khách có hành vi gây rối trật tự công cộng trên xe ô tô, cản trở hoạt động của đơn vị kinh doanh vận tải hành khách bằng xe ô tô, ảnh hưởng đến tính mạng, sức khỏe, tài sản của người khác, gian lận vé; c) quyết định các chính sách ưu đãi để phục vụ khách hàng và mở rộng thị trường kinh doanh. 2. đơn vị kinh doanh vận tải hành khách bằng xe ô tô có các nghĩa vụ sau đây: a) chấp hành và thực hiện đầy đủ quy định về kinh doanh, điều kiện kinh doanh vận tải bằng xe ô tô, cam kết về chất lượng vận tải, hợp đồng vận tải; b) mua bảo hiểm cho hành khách; phí bảo hiểm được tính vào giá vé, giá trị hợp đồng vận tải; c) thực hiện kê khai giá theo quy định của pháp luật về giá; cung cấp vé, chứng từ thu tiền vận tải; d) bồi thường thiệt hại do người lao động, người đại diện của đơn vị kinh doanh vận tải hành khách bằng xe ô tô gây ra trong quá trình vận tải theo quy định của pháp luật; đ) thực hiện việc miễn giảm giá vé đối với người cao tuổi, người khuyết tật và các đối tượng chính sách khác theo quy định của pháp luật; e) không được để tổ chức, cá nhân không có giấy phép kinh doanh vận tải bằng xe ô tô loại hình vận tải hành khách thực hiện điều hành phương tiện và lái xe hoặc quyết định giá cước để vận tải hành khách; g) không được sử dụng người không có giấy phép lái xe hoặc có giấy phép lái xe nhưng không phù hợp với loại xe, người có giấy phép lái xe bị trừ hết điểm, người đang bị tước hoặc bị thu hồi giấy phép lái xe để điều khiển phương tiện vận tải hành khách.']","**Nguồn văn bản:** 35_2024_QH15_588811

**Tên văn bản:** Luật Đường bộ

**Điều 58:** Quyền và nghĩa vụ của đơn vị kinh doanh vận tải hành khách bằng xe ô tô

**Nội dung:**

1. Đơn vị kinh doanh vận tải hành khách bằng xe ô tô có các quyền sau đây:

	a) Thu tiền vận tải.

	b) Từ chối vận tải hành khách có hành vi gây rối trật tự công cộng trên xe ô tô, cản trở hoạt động của đơn vị kinh doanh vận tải hành khách bằng xe ô tô, ảnh hưởng đến tính mạng, sức khỏe, tài sản của người khác, gian lận vé.

	c) Quyết định các chính sách ưu đãi để phục vụ khách hàng và mở rộng thị trường kinh doanh.


2. Đơn vị kinh doanh vận tải hành khách bằng xe ô tô có các nghĩa vụ sau đây:

	a) Chấp hành và thực hiện đầy đủ quy định về kinh doanh, điều kiện kinh doanh vận tải bằng xe ô tô, cam kết về chất lượng vận tải, hợp đồng vận tải.

	b) Mua bảo hiểm cho hành khách; phí bảo hiểm được tính vào giá vé, giá trị hợp đồng vận tải.

	c) Thực hiện kê khai giá theo quy định của pháp luật về giá; cung cấp vé, chứng từ thu tiền vận tải.

	d) Bồi thường thiệt hại do người lao động, người đại diện của đơn vị kinh doanh vận tải hành khách bằng xe ô tô gây ra trong quá trình vận tải theo quy định của pháp luật.

	đ) Thực hiện việc miễn giảm giá vé đối với người cao tuổi, người khuyết tật và các đối tượng chính sách khác theo quy định của pháp luật.

	e) Không được để tổ chức, cá nhân không có giấy phép kinh doanh vận tải bằng xe ô tô loại hình vận tải hành khách thực hiện điều hành phương tiện và lái xe hoặc quyết định giá cước để vận tải hành khách.

	g) Không được sử dụng người không có giấy phép lái xe hoặc có giấy phép lái xe nhưng không phù hợp với loại xe, người có giấy phép lái xe bị trừ hết điểm, người đang bị tước hoặc bị thu hồi giấy phép lái xe để điều khiển phương tiện vận tải hành khách.


Tóm lại: Văn bản cung cấp thông tin về quyền và nghĩa vụ của đơn vị kinh doanh vận tải hành khách bằng xe ô tô, chứ không đề cập đến quy định cụ thể về việc sử dụng xe ô tô chở khách trong khu vực du lịch.
",Xe ô tô chở khách trong khu vực du lịch phải đáp ứng các tiêu chuẩn về khí thải và tiếng ồn để bảo vệ môi trường.,0.8636363636363636,0.431521326792962,0.0,0.0
38,Luật Giao thông Đường bộ 2025 có quy định gì về việc sử dụng xe ô tô chở học sinh?,"['1. xe ô tô kinh doanh vận tải chở trẻ em mầm non, học sinh quy định tại điểm a khoản 1 điều 46 luật trật tự, an toàn giao thông đường bộ phải được sơn màu vàng đậm phủ bên ngoài thân xe; mặt trước và hai cạnh bên xe phía trên cửa sổ phải có biển báo dấu hiệu nhận biết là xe chuyên dùng chở trẻ em mầm non, học sinh. 2. xe ô tô kinh doanh vận tải kết hợp với hoạt động đưa đón trẻ em mầm non, học sinh quy định tại khoản 2 điều 46 luật trật tự, an toàn giao thông đường bộ phải có biển báo dấu hiệu nhận biết là xe chở trẻ em mầm non, học sinh đặt ở mặt trước và hai cạnh bên xe phía trên cửa sổ.']","**Nguồn văn bản:** 151_2024_ND-CP_619564

**Tên văn bản:** Nghị định Quy định chi tiết một số điều và biện pháp thi hành luật trật tự, an toàn giao thông đường bộ

**Điều 30:** Màu sơn của xe ô tô kinh doanh vận tải chở trẻ em mầm non, học sinh

**Nội dung:**

1. Xe ô tô kinh doanh vận tải chở trẻ em mầm non, học sinh quy định tại điểm a khoản 1 Điều 46 Luật Trật tự, an toàn giao thông đường bộ phải được sơn màu vàng đậm phủ bên ngoài thân xe; mặt trước và hai cạnh bên xe phía trên cửa sổ phải có biển báo dấu hiệu nhận biết là xe chuyên dùng chở trẻ em mầm non, học sinh.

2. Xe ô tô kinh doanh vận tải kết hợp với hoạt động đưa đón trẻ em mầm non, học sinh quy định tại khoản 2 Điều 46 Luật Trật tự, an toàn giao thông đường bộ phải có biển báo dấu hiệu nhận biết là xe chở trẻ em mầm non, học sinh đặt ở mặt trước và hai cạnh bên xe phía trên cửa sổ.


Tóm lại: Xe ô tô kinh doanh vận tải chở trẻ em mầm non, học sinh phải sơn màu vàng đậm và có biển báo nhận biết ở mặt trước và hai bên hông xe. Xe kinh doanh vận tải kết hợp đưa đón học sinh cũng phải có biển báo tương tự.
","Xe ô tô chở học sinh phải được sơn màu vàng đậm, có thiết bị chống bỏ quên trẻ em và đáp ứng các tiêu chuẩn an toàn khác.",0.7142857142857143,0.47690352872453684,0.0,0.0
39,Quy định mới về việc sử dụng xe ô tô chở người khuyết tật là gì?,"['1. có địa điểm xây dựng cơ sở vật chất bảo đảm diện tích sử dụng hợp pháp tối thiểu là 1.000 m2. 2. hệ thống phòng học chuyên môn a) phòng sử dụng học lý thuyết: có các trang thiết bị làm công cụ hỗ trợ việc giảng dạy về các nội dung: pháp luật giao thông đường bộ, đạo đức người lái xe, văn hóa giao thông, phòng chống tác hại của rượu, bia khi tham gia giao thông và phòng chống cháy nổ và cứu nạn, cứu hộ; trường hợp, các thiết bị công nghệ thông tin chưa mô tả hệ thống báo hiệu đường bộ, sa hình, thì phải có hệ thống tranh vẽ. diện tích phòng học không nhỏ hơn 48 m2/phòng; b) phòng sử dụng học kỹ thuật ô tô: có các thiết bị công nghệ thông tin làm công cụ hỗ trợ việc giảng dạy về cấu tạo, sửa chữa thông thường và kỹ thuật lái xe, kiến thức mới về nâng hạng; có mô hình cắt bổ động cơ, hệ thống truyền lực và hệ thống điện; có trang bị đồ nghề chuyên dùng để hướng dẫn học sinh thực hành tháo lắp lốp, kiểm tra dầu xe, nước làm mát; có xe ô tô được kê kích bảo đảm an toàn để tập số nguội, số nóng; có cabin học lái xe; trường hợp, các thiết bị công nghệ thông tin chưa có sơ đồ mô tả cấu tạo và nguyên lý hoạt động của động cơ, hệ thống truyền lực, hệ thống treo, hệ thống phanh, hệ thống lái, các thao tác lái xe cơ bản (điều chỉnh ghế lái, tư thế ngồi lái, vị trí cầm vô lăng lái...), thì phải có hệ thống tranh vẽ; diện tích phòng học không nhỏ hơn 100 m2/phòng. trường hợp, mô hình cắt bổ động cơ, hệ thống truyền lực, hệ thống điện; khu vực hướng dẫn học sinh thực hành tháo lắp lốp, kiểm tra dầu xe, nước làm mát; xe ô tô để tập số nguội, số nóng; cabin học lái xe ô tô được bố trí ở khu vực riêng biệt thì diện tích phòng học không nhỏ hơn 48 m2/phòng; c) hệ thống phòng học chuyên môn thuộc quyền sử dụng hợp pháp của cơ sở đào tạo lái xe; cơ sở đào tạo lái xe ô tô bố trí số lượng phòng học lý thuyết và phòng sử dụng học kỹ thuật ô tô phù hợp với lưu lượng, hình thức và chương trình đào tạo; số lượng phòng học tính theo lưu lượng học viên; được xác định theo nguyên tắc 01 phòng sử dụng học lý thuyết và 01 phòng sử dụng học kỹ thuật ô tô đáp ứng tối đa lưu lượng 500 học viên. 3. xe tập lái a) cơ sở đào tạo phải có xe tập lái của các hạng được phép đào tạo, thuộc quyền sử dụng hợp pháp của cơ sở đào tạo lái xe; được cơ quan có thẩm quyền cấp giấy phép xe tập lái; trường hợp cơ sở đào tạo có dịch vụ sát hạch lái xe, căn cứ thời gian sử dụng xe sát hạch vào mục đích sát hạch, được phép sử dụng xe sát hạch để vừa thực hiện sát hạch lái xe, vừa đào tạo lái xe nhưng phải bảo đảm số lượng xe sát hạch dùng để tính lưu lượng đào tạo không quá 50% số xe sát hạch sử dụng để dạy thực hành lái xe; b) xe tập lái các hạng phải sử dụng các loại xe tương ứng với hạng giấy phép lái xe quy định tại khoản 1 điều 57 luật trật tự, an toàn giao thông đường bộ. trong đó: xe tập lái hạng b gồm xe sử dụng loại chuyển số tự động (bao gồm cả ô tô điện) hoặc chuyển số cơ khí (số sàn); xe tập lái hạng c1, c, d1, d2, d, be, c1e, ce, d1e, d2e và de sử dụng loại chuyển số cơ khí (số sàn); c) ô tô tải sử dụng để làm xe tập lái hạng b phải có khối lượng toàn bộ theo thiết kế từ 2.500 kg đến 3.500 kg với số lượng không quá 30% tổng số xe tập lái cùng hạng của cơ sở đào tạo; d) xe tập lái được gắn 02 biển “tập lái” trước và sau xe theo mẫu quy định tại phụ lục i kèm theo nghị định này; có hệ thống phanh phụ được lắp đặt bảo đảm hiệu quả phanh, được bố trí bên ghế ngồi của giáo viên dạy thực hành lái xe; xe tập lái trên đường giao thông có thiết bị giám sát thời gian và quãng đường học thực hành lái xe của học viên; xe tập lái loại ô tô tải thùng có mui che mưa, che nắng, ghế ngồi cho học viên; có giấy chứng nhận kiểm định an toàn kỹ thuật và bảo vệ môi trường phương tiện giao thông cơ giới đường bộ còn hiệu lực; đ) xe mô tô ba bánh để làm xe tập lái cho người khuyết tật là xe mô tô ba bánh dùng cho người khuyết tật đã được cơ quan có thẩm quyền cấp giấy chứng nhận đăng ký xe và biển số xe; e) xe ô tô hạng b số tự động được dùng làm xe tập lái cho người khuyết tật bàn chân phải hoặc bàn tay phải hoặc bàn tay trái; xe ô tô hạng b số tự động dùng làm xe tập lái cho người khuyết tật ngoài việc đáp ứng các quy định tại điểm a, điểm d khoản này còn phải có kết cấu phù hợp để các tay và chân còn lại của người khuyết tật vừa giữ được vô lăng lái, vừa dễ dàng điều khiển cần gạt tín hiệu báo rẽ, đèn chiếu sáng, cần gạt mưa, cần số, cần phanh tay, bàn đạp phanh chân, bàn đạp ga trong mọi tình huống khi lái xe theo đúng chức năng thiết kế của nhà sản xuất ô tô hoặc được cơ quan có thẩm quyền cấp giấy chứng nhận cải tạo xe cơ giới xác nhận hệ thống điều khiển của xe phù hợp để người khuyết tật lái xe an toàn. 4. sân tập lái xe a) thuộc quyền sử dụng hợp pháp của cơ sở đào tạo lái xe; trường hợp cơ sở đào tạo có dịch vụ sát hạch lái xe, căn cứ thời gian sử dụng sân sát hạch vào mục đích sát hạch, được phép sử dụng sân sát hạch để vừa thực hiện sát hạch lái xe, vừa đào tạo lái xe nhưng chỉ được tính tối đa không quá 01 sân tập lái để tính lưu lượng đào tạo; b) cơ sở đào tạo lái xe ô tô bố trí số lượng sân tập lái phù hợp với lưu lượng và chương trình đào tạo; số lượng sân tập lái tính theo lưu lượng học viên; được xác định theo nguyên tắc 01 sân tập lái ô tô đáp ứng tối đa lưu lượng 1.000 học viên; c) sân tập lái xe ô tô phải có đủ hệ thống biển báo hiệu đường bộ, bảo đảm diện tích để bố trí đủ các bài học theo nội dung chương trình đào tạo đối với các hạng xe dùng để đào tạo; việc bố trí hình và kích thước các bài tập lái xe ô tô tổng hợp theo quy chuẩn kỹ thuật quốc gia về trung tâm sát hạch lái xe cơ giới đường bộ đối với từng hạng xe tương ứng và phải được bó vỉa; d) mặt sân có cao độ và hệ thống thoát nước bảo đảm không bị ngập nước; bề mặt các làn đường và hình tập lái được thảm nhựa hoặc bê tông xi măng, có đủ vạch sơn kẻ đường; đ) có nhà chờ, có ghế ngồi cho học viên học thực hành. mục 3. tiêu chuẩn giáo viên dạy lái xe ô tô; thủ tục cấp, cấp lại và thu hồi giấy chứng nhận giáo viên dạy thực hành lái xe, giấy phép xe tập lái, giấy phép đào tạo lái xe ô tô, giải thể cơ sở đào tạo']","**Nguồn văn bản:** 160_2024_ND-CP_624017

**Tên văn bản:** Nghị định Quy định về hoạt động đào tạo và sát hạch lái xe

**Điều 9:** Điều kiện về cơ sở vật chất kỹ thuật

**Nội dung:**

3. Xe tập lái

    e) Xe ô tô hạng B số tự động được dùng làm xe tập lái cho người khuyết tật bàn chân phải hoặc bàn tay phải hoặc bàn tay trái; Xe ô tô hạng B số tự động dùng làm xe tập lái cho người khuyết tật ngoài việc đáp ứng các quy định tại điểm a, điểm d khoản này còn phải có kết cấu phù hợp để các tay và chân còn lại của người khuyết tật vừa giữ được vô lăng lái, vừa dễ dàng điều khiển cần gạt tín hiệu báo rẽ, đèn chiếu sáng, cần gạt mưa, cần số, cần phanh tay, bàn đạp phanh chân, bàn đạp ga trong mọi tình huống khi lái xe theo đúng chức năng thiết kế của nhà sản xuất ô tô hoặc được cơ quan có thẩm quyền cấp giấy chứng nhận cải tạo xe cơ giới xác nhận hệ thống điều khiển của xe phù hợp để người khuyết tật lái xe an toàn.


**Tóm lại:** Người khuyết tật bàn chân phải, tay phải hoặc tay trái có thể sử dụng xe ô tô hạng B số tự động để tập lái. Xe tập lái phải đảm bảo người khuyết tật có thể dễ dàng điều khiển các bộ phận của xe hoặc có giấy chứng nhận cải tạo phù hợp.
",Xe ô tô chở người khuyết tật phải được trang bị thiết bị hỗ trợ và đáp ứng các tiêu chuẩn an toàn đặc biệt.,0.6666666666666666,0.5745043953719973,1.0,0.0
40,Luật Giao thông Đường bộ 2025 có quy định gì về việc sử dụng xe ô tô chở bệnh nhân?,"['1. dịch vụ vận tải người bệnh là việc tổ chức, cá nhân sử dụng xe ô tô cứu thương có thiết bị y tế chuyên dùng để vận tải người bệnh cấp cứu hoặc vận tải người bệnh. 2. cơ sở khám bệnh, chữa bệnh, tổ chức, cá nhân cung cấp dịch vụ vận tải người bệnh và sử dụng xe ô tô cứu thương để vận tải người bệnh phải đáp ứng điều kiện theo quy định của pháp luật về khám bệnh, chữa bệnh và quy định khác của pháp luật có liên quan. 3. xe ô tô cứu thương vận tải người bệnh phải có dấu hiệu nhận diện, niêm yết thông tin, lắp thiết bị giám sát hành trình, thiết bị ghi nhận hình ảnh người lái xe theo quy định của pháp luật về trật tự, an toàn giao thông đường bộ và quy định khác của pháp luật có liên quan.']","**Nguồn văn bản:** 35_2024_QH15_588811

**Tên văn bản:** Luật Đường bộ

**Điều 69:** hoạt động vận tải người bệnh bằng xe ô tô cứu thương

**Nội dung:**

1. Dịch vụ vận tải người bệnh là việc tổ chức, cá nhân sử dụng xe ô tô cứu thương có thiết bị y tế chuyên dùng để vận tải người bệnh cấp cứu hoặc vận tải người bệnh.

2. Cơ sở khám bệnh, chữa bệnh, tổ chức, cá nhân cung cấp dịch vụ vận tải người bệnh và sử dụng xe ô tô cứu thương để vận tải người bệnh phải đáp ứng điều kiện theo quy định của pháp luật về khám bệnh, chữa bệnh và quy định khác của pháp luật có liên quan.

3. Xe ô tô cứu thương vận tải người bệnh phải có dấu hiệu nhận diện, niêm yết thông tin, lắp thiết bị giám sát hành trình, thiết bị ghi nhận hình ảnh người lái xe theo quy định của pháp luật về trật tự, an toàn giao thông đường bộ và quy định khác của pháp luật có liên quan.

Tóm lại: Xe ô tô cứu thương dùng để vận chuyển người bệnh phải tuân thủ các quy định của pháp luật về khám chữa bệnh và trật tự an toàn giao thông đường bộ, bao gồm các quy định về điều kiện cung cấp dịch vụ, dấu hiệu nhận diện, thiết bị giám sát hành trình và ghi nhận hình ảnh người lái.
",Xe ô tô chở bệnh nhân phải được trang bị thiết bị y tế cần thiết và đáp ứng các tiêu chuẩn an toàn.,1.0,0.5636696313747718,0.0,0.0
41,Quy định mới về việc sử dụng xe ô tô chở hàng nguy hiểm là gì?,"['1. đơn vị kinh doanh vận tải có giấy phép kinh doanh vận tải bằng ô tô, trong đó có một hoặc các loại hình kinh doanh vận tải hàng hóa bằng xe ô tô quy định tại khoản 2, khoản 3 và khoản 4 điều này thì được tham gia kinh doanh vận tải hàng hóa bằng xe ô tô theo loại hình đã đăng ký. 2. kinh doanh vận tải hàng hóa bằng xe taxi tải là việc sử dụng xe ô tô có trọng tải từ 1.500 ki-lô-gam trở xuống để vận chuyển hàng hóa và người thuê vận tải trả tiền cho lái xe theo đồng hồ tính tiền hoặc theo phần mềm tính tiền trên xe. mặt ngoài hai bên thành xe hoặc cánh cửa xe niêm yết cụm từ “taxi tải” theo mẫu số 08 phụ lục xiii kèm theo nghị định này, số điện thoại liên lạc, tên đơn vị kinh doanh vận tải. 3. kinh doanh vận tải hàng hóa siêu trường, siêu trọng a) kinh doanh vận tải hàng hóa siêu trường, siêu trọng là việc sử dụng xe ô tô để vận chuyển hàng không thể chia nhỏ, tháo rời, khi vận chuyển trên đường bộ làm cho phương tiện hoặc tổ hợp phương tiện bị vượt quá giới hạn cho phép tham gia giao thông đường bộ về kích thước, khối lượng theo quy định của pháp luật; b) khi vận chuyển hàng hóa siêu trường, siêu trọng, phải thực hiện theo quy định tại điều 53 luật trật tự, an toàn giao thông đường bộ. 4. kinh doanh vận tải hàng hóa nguy hiểm a) kinh doanh vận tải hàng hóa nguy hiểm là việc sử dụng xe ô tô để vận chuyển hàng hóa có chứa các chất nguy hiểm có khả năng gây nguy hại tới tính mạng, sức khỏe con người, môi trường, an toàn và an ninh quốc gia; b) khi vận chuyển hàng hóa nguy hiểm phải thực hiện theo quy định tại điều 51 luật trật tự, an toàn giao thông đường bộ. 5. kinh doanh vận tải hàng hóa thông thường là hình thức kinh doanh vận tải hàng hóa, trừ các hình thức kinh doanh vận tải quy định tại các khoản 2, khoản 3 điều này. 6. xe ô tô đầu kéo kéo rơ moóc hoặc sơ mi rơ moóc kinh doanh vận tải hàng hóa, xe ô tô tải kinh doanh vận tải hàng hóa thông thường và xe taxi tải phải có phù hiệu “xe tải” theo mẫu số 09 phụ lục xiii kèm theo nghị định này và được dán cố định tại góc trên bên phải ngay sát phía dưới vị trí của tem kiểm định, mặt trong kính chắn gió phía trước của xe. 7. đơn vị kinh doanh vận tải hàng hóa phải chịu trách nhiệm thực hiện đúng quy định việc xếp hàng hóa lên xe ô tô. 8. đơn vị kinh doanh vận tải hàng hóa phải cấp cho lái xe giấy vận tải trong quá trình vận chuyển hàng hóa trên đường. giấy vận tải phải có xác nhận (ký, ghi rõ họ và tên) khối lượng hàng hóa đã xếp lên phương tiện của chủ hàng (hoặc người được chủ hàng ủy quyền) hoặc đại diện đơn vị, cá nhân thực hiện việc xếp hàng. 9. khi vận chuyển hàng hóa, lái xe phải mang theo giấy vận tải (giấy vận chuyển) bằng văn bản giấy hoặc phải có thiết bị để truy cập vào phần mềm thể hiện nội dung của giấy vận tải và các giấy tờ của lái xe và phương tiện theo quy định của pháp luật. đơn vị kinh doanh vận tải và lái xe không được chở hàng vượt quá khối lượng cho phép tham gia giao thông. 10. đối với hoạt động vận chuyển xe đạp, xe mô tô, xe gắn máy và các loại xe tương tự qua hầm đường bộ áp dụng theo quy định tại khoản 4 điều này. 11. giấy vận tải bằng văn bản giấy hoặc điện tử do đơn vị kinh doanh vận tải hàng hóa tự phát hành và có các thông tin tối thiểu gồm: tên đơn vị vận tải; biển kiểm soát xe; tên đơn vị hoặc người thuê vận tải; hành trình (điểm đầu, điểm cuối); số hợp đồng, ngày tháng năm ký hợp đồng (nếu có); loại hàng và khối lượng hàng vận chuyển trên xe. đơn vị kinh doanh vận tải hàng hóa phải thực hiện lưu trữ giấy vận tải của các chuyến xe đã thực hiện trong thời gian tối thiểu 03 năm. 12. việc bồi thường hàng hóa hư hỏng, mất mát, thiếu hụt được thực hiện theo hợp đồng vận chuyển hoặc theo thỏa thuận giữa người kinh doanh vận tải và người thuê vận tải.']","**Nguồn văn bản:** 158_2024_ND-CP_636875

**Tên văn bản:** Nghị định Quy định về hoạt động vận tải đường bộ

**Điều 8:** kinh doanh vận tải hàng hóa bằng xe ô tô

**Nội dung:**

4. Kinh doanh vận tải hàng hóa nguy hiểm

	a) Kinh doanh vận tải hàng hóa nguy hiểm là việc sử dụng xe ô tô để vận chuyển hàng hóa có chứa các chất nguy hiểm có khả năng gây nguy hại tới tính mạng, sức khỏe con người, môi trường, an toàn và an ninh quốc gia.

	b) Khi vận chuyển hàng hóa nguy hiểm phải thực hiện theo quy định tại Điều 51 Luật Trật tự, an toàn giao thông đường bộ.


Tóm lại: Xe ô tô vận chuyển hàng hóa nguy hiểm phải tuân thủ quy định tại Điều 51 của Luật Trật tự, an toàn giao thông đường bộ. Hàng hóa nguy hiểm được định nghĩa là hàng hóa có chứa các chất gây nguy hại tới tính mạng, sức khỏe con người, môi trường, an toàn và an ninh quốc gia.
",Xe ô tô chở hàng nguy hiểm phải có giấy phép đặc biệt và tuân thủ các quy định về an toàn và môi trường.,0.8,0.6035132579987332,0.0,0.0
42,"Luật Giao thông Đường bộ 2025 có quy định gì về việc sử dụng xe ô tô chở hàng quá khổ, quá tải?","['thông tư này quy định về tải trọng, khổ giới hạn của đường bộ; lưu hành xe quá khổ giới hạn, xe quá tải trọng, xe bánh xích trên đường bộ; hàng siêu trường, siêu trọng, vận chuyển hàng siêu trường, siêu trọng; xếp hàng hóa trên phương tiện giao thông đường bộ; cấp giấy phép lưu hành cho xe quá tải trọng, xe quá khổ giới hạn, xe bánh xích, xe vận chuyển hàng siêu trường, siêu trọng trên đường bộ.']","**Nguồn văn bản:** 39_2024_TT-BGTVT_633952

**Tên văn bản:** Thông tư Quy định về tải trọng, khổ giới hạn của đường bộ; lưu hành xe quá khổ giới hạn, xe quá tải trọng, xe bánh xích trên đường bộ; hàng siêu trường, siêu trọng, vận chuyển hàng siêu trường, siêu trọng; xếp hàng hóa trên phương tiện giao thông đường bộ; cấp giấy phép lưu hành cho xe quá tải trọng, xe quá khổ giới hạn, xe bánh xích, xe vận chuyển hàng siêu trường, siêu trọng trên đường bộ

**Điều 1:** phạm vi điều chỉnh

**Nội dung:**

Thông tư này quy định về tải trọng, khổ giới hạn của đường bộ; lưu hành xe quá khổ giới hạn, xe quá tải trọng, xe bánh xích trên đường bộ; hàng siêu trường, siêu trọng, vận chuyển hàng siêu trường, siêu trọng; xếp hàng hóa trên phương tiện giao thông đường bộ; cấp giấy phép lưu hành cho xe quá tải trọng, xe quá khổ giới hạn, xe bánh xích, xe vận chuyển hàng siêu trường, siêu trọng trên đường bộ.

**Tóm lại:** Thông tư này quy định toàn diện về tải trọng, khổ giới hạn đường bộ, lưu hành xe quá khổ, quá tải, vận chuyển hàng siêu trường, siêu trọng và cấp phép lưu hành cho các loại xe này.
","Cấm xe ô tô chở hàng quá khổ, quá tải lưu thông trên đường bộ; trường hợp đặc biệt phải có giấy phép và tuân thủ các quy định an toàn.",1.0,0.2716184260021159,1.0,0.0
43,Quy định mới về việc sử dụng xe ô tô chở hàng đông lạnh là gì?,"['1. phạt tiền từ 500.000 đồng đến 1.000.000 đồng đối với cá nhân, từ 1.000.000 đồng đến 2.000.000 đồng đối với tổ chức thực hiện một trong các hành vi vi phạm sau đây: a) xếp hàng hóa lên mỗi xe ô tô (kể cả rơ moóc và sơ mi rơ moóc) vượt quá trọng tải (khối lượng hàng chuyên chở) cho phép tham gia giao thông được ghi trong giấy chứng nhận kiểm định an toàn kỹ thuật và bảo vệ môi trường của xe trên 10% đến 50% (trừ xe xi téc chở chất lỏng), trên 20% đến 50% đối với xe xi téc chở chất lỏng; b) xếp hàng hóa lên xe ô tô mà không ký xác nhận việc xếp hàng hóa vào giấy vận tải theo quy định. 2. phạt tiền từ 1.000.000 đồng đến 2.000.000 đồng đối với cá nhân, từ 2.000.000 đồng đến 4.000.000 đồng đối với tổ chức kinh doanh vận tải, dịch vụ hỗ trợ vận tải thực hiện một trong các hành vi vi phạm sau đây: a) không đánh số thứ tự ghế ngồi, giường nằm trên xe ô tô chở hành khách theo quy định; b) sử dụng xe ô tô kinh doanh vận tải hành khách theo tuyến cố định, xe ô tô kinh doanh vận tải hành khách bằng xe buýt không có chỗ ưu tiên cho người khuyết tật, người cao tuổi và phụ nữ mang thai theo quy định; c) sử dụng xe ô tô kinh doanh vận tải hành khách không có hướng dẫn cho hành khách về an toàn giao thông, thoát hiểm khi xảy ra sự cố trên xe theo quy định; d) không bố trí người áp tải trên xe vận chuyển hàng hóa nguy hiểm đối với những trường hợp quy định phải có người áp tải; đ) không cấp lệnh vận chuyển, giấy vận tải cho lái xe hoặc cấp lệnh vận chuyển, giấy vận tải nhưng không đúng theo quy định (đối với loại xe quy định phải cấp lệnh vận chuyển, giấy vận tải); e) sử dụng xe vận chuyển hàng hóa nguy hiểm mà không làm sạch hoặc không bóc (xóa) biểu trưng nguy hiểm trên phương tiện khi không tiếp tục vận chuyển loại hàng hóa đó. 3. phạt tiền từ 2.000.000 đồng đến 3.000.000 đồng đối với cá nhân, từ 4.000.000 đồng đến 6.000.000 đồng đối với tổ chức thực hiện hành vi vi phạm xếp hàng hóa lên mỗi xe ô tô (kể cả rơ moóc và sơ mi rơ moóc) vượt quá trọng tải (khối lượng hàng chuyên chở) cho phép tham gia giao thông được ghi trong giấy chứng nhận kiểm định an toàn kỹ thuật và bảo vệ môi trường của xe trên 50% đến 100%. 4. phạt tiền từ 3.000.000 đồng đến 4.000.000 đồng đối với cá nhân, từ 6.000.000 đồng đến 8.000.000 đồng đối với tổ chức kinh doanh vận tải, dịch vụ hỗ trợ vận tải thực hiện một trong các hành vi vi phạm sau đây: a) không cấp thẻ nhận dạng lái xe cho lái xe theo quy định; b) sử dụng lái xe, nhân viên phục vụ trên xe để tham gia kinh doanh vận tải bằng xe ô tô mà không được tập huấn, hướng dẫn về nghiệp vụ vận tải hành khách và an toàn giao thông theo quy định (đối với hình thức kinh doanh vận tải có quy định lái xe, nhân viên phục vụ trên xe phải được tập huấn, hướng dẫn nghiệp vụ), trừ các hành vi vi phạm quy định tại điểm c, điểm d khoản này; c) sử dụng lái xe, người quản lý trên xe để tham gia kinh doanh vận tải bằng xe ô tô mà không được hướng dẫn về quy trình bảo đảm an toàn khi đưa đón trẻ em mầm non, học sinh; d) sử dụng lái xe, người áp tải vận chuyển hàng hóa nguy hiểm mà không được tập huấn về vận chuyển hàng hóa nguy hiểm; đ) sử dụng xe ô tô kinh doanh vận tải hành khách không có dây đai an toàn tại các vị trí ghế ngồi, giường nằm theo quy định (trừ xe buýt nội tỉnh); e) sử dụng xe ô tô kinh doanh vận tải chở trẻ em mầm non, học sinh tiểu học, xe ô tô kinh doanh vận tải kết hợp với hoạt động đưa đón trẻ em mầm non, học sinh tiểu học không có dây đai an toàn phù hợp với lứa tuổi hoặc không có ghế ngồi phù hợp với lứa tuổi theo quy định; g) không thực hiện việc niêm yết thông tin trên xe theo quy định hoặc có niêm yết nhưng không chính xác, không đầy đủ thông tin theo quy định. 5. phạt tiền từ 4.000.000 đồng đến 5.000.000 đồng đối với cá nhân, từ 8.000.000 đồng đến 10.000.000 đồng đối với tổ chức xếp hàng hóa lên mỗi xe ô tô (kể cả rơ moóc và sơ mi rơ moóc) vượt quá trọng tải (khối lượng hàng chuyên chở) cho phép tham gia giao thông được ghi trong giấy chứng nhận kiểm định an toàn kỹ thuật và bảo vệ môi trường của xe trên 100%. 6. phạt tiền từ 4.000.000 đồng đến 6.000.000 đồng đối với cá nhân, từ 8.000.000 đồng đến 12.000.000 đồng đối với tổ chức kinh doanh vận tải thực hiện một trong các hành vi vi phạm sau đây: a) sử dụng xe vận chuyển động vật sống không có kết cấu phù hợp với loại động vật chuyên chở theo quy định; b) sử dụng xe ô tô kinh doanh vận tải chở trẻ em mầm non, học sinh, xe ô tô kinh doanh vận tải kết hợp với hoạt động đưa đón trẻ em mầm non, học sinh không có thiết bị ghi nhận hình ảnh trẻ em mầm non, học sinh hoặc không có thiết bị có chức năng cảnh báo, chống bỏ quên trẻ em trên xe hoặc không có thiết bị ghi nhận hình ảnh trẻ em mầm non, học sinh và thiết bị có chức năng cảnh báo, chống bỏ quên trẻ em trên xe; c) sử dụng xe ô tô kinh doanh vận tải chở trẻ em mầm non, học sinh không có màu sơn theo quy định; d) sử dụng xe ô tô kinh doanh vận tải chở trẻ em mầm non, học sinh, xe ô tô kinh doanh vận tải kết hợp với hoạt động đưa đón trẻ em mầm non, học sinh không có biển báo dấu hiệu nhận biết là xe chở trẻ em mầm non, học sinh theo quy định. 7. phạt tiền từ 5.000.000 đồng đến 6.000.000 đồng đối với cá nhân, từ 10.000.000 đồng đến 12.000.000 đồng đối với tổ chức kinh doanh vận tải, dịch vụ hỗ trợ vận tải thực hiện một trong các hành vi vi phạm sau đây: a) không thực hiện việc cung cấp, cập nhật, truyền, lưu trữ, quản lý thông tin, dữ liệu từ thiết bị giám sát hành trình theo quy định; b) không thực hiện đúng nội dung thông tin đã niêm yết trên xe theo quy định; c) sử dụng phương tiện kinh doanh vận tải không lắp thiết bị giám sát hành trình của xe (đối với hình thức kinh doanh vận tải có quy định phương tiện phải lắp thiết bị) hoặc lắp thiết bị nhưng thiết bị không hoạt động, không đúng quy chuẩn theo quy định hoặc làm sai lệch dữ liệu của thiết bị giám sát hành trình của xe ô tô; d) sử dụng xe trung chuyển chở hành khách không đúng quy định; đ) sử dụng lái xe điều khiển xe khách giường nằm hai tầng, xe ô tô đưa đón trẻ em mầm non, học sinh chưa đủ số năm kinh nghiệm theo quy định; e) sử dụng xe kinh doanh vận tải hành khách theo hợp đồng mà trên xe không có hợp đồng vận tải, danh sách hành khách kèm theo, thiết bị để truy cập nội dung hợp đồng điện tử và danh sách hành khách theo quy định hoặc có hợp đồng vận tải, danh sách hành khách, thiết bị để truy cập nhưng không bảo đảm yêu cầu theo quy định, chở người không có tên trong danh sách hành khách hoặc vận chuyển không đúng đối tượng theo quy định (đối với xe kinh doanh vận tải hành khách theo hợp đồng vận chuyển trẻ em mầm non, học sinh, sinh viên, cán bộ, công chức, viên chức, công nhân); g) sử dụng xe ô tô kinh doanh vận tải không lắp thiết bị ghi nhận hình ảnh người lái xe theo quy định (đối với loại xe có quy định phải lắp thiết bị ghi nhận hình ảnh người lái xe) hoặc có lắp thiết bị ghi nhận hình ảnh người lái xe nhưng không ghi, không lưu trữ được dữ liệu trên xe trong quá trình xe tham gia giao thông theo quy định hoặc làm sai lệch dữ liệu của thiết bị ghi nhận hình ảnh người lái xe lắp trên xe ô tô; h) không thực hiện việc cung cấp, cập nhật, truyền dẫn, lưu trữ, quản lý thông tin, dữ liệu thu thập từ thiết bị ghi nhận hình ảnh người lái xe lắp trên xe ô tô theo quy định; i) sử dụng phương tiện kinh doanh vận tải có niên hạn sử dụng không bảo đảm điều kiện của hình thức kinh doanh đã đăng ký. 8. phạt tiền từ 10.000.000 đồng đến 12.000.000 đồng đối với cá nhân, từ 20.000.000 đồng đến 24.000.000 đồng đối với tổ chức kinh doanh vận tải, dịch vụ hỗ trợ vận tải thực hiện một trong các hành vi vi phạm sau đây: a) không tổ chức khám sức khỏe định kỳ cho lái xe theo quy định hoặc có tổ chức khám nhưng không đầy đủ các nội dung theo quy định; b) vi phạm quy định về kinh doanh, điều kiện kinh doanh vận tải bằng xe ô tô để xảy ra tai nạn giao thông gây hậu quả từ mức nghiêm trọng trở lên; c) sử dụng xe ô tô kinh doanh vận tải để đón, trả khách; nhận, trả hàng trên đường cao tốc. 9. phạt tiền từ 20.000.000 đồng đến 40.000.000 đồng đối với đơn vị sản xuất, lắp ráp, nhập khẩu thiết bị giám sát hành trình của xe ô tô, đơn vị cung cấp dịch vụ liên quan đến giám sát hành trình, ghi nhận hình ảnh người lái xe thực hiện một trong các hành vi sau: a) đơn vị sản xuất, lắp ráp, nhập khẩu thiết bị giám sát hành trình của xe ô tô không có nhân sự cho từng vị trí công việc theo quy định; b) đơn vị sản xuất, lắp ráp, nhập khẩu thiết bị giám sát hành trình của xe ô tô không báo cáo về việc cập nhật, thay đổi phần mềm của thiết bị theo quy định. 10. phạt tiền từ 40.000.000 đồng đến 60.000.000 đồng đối với đơn vị sản xuất, lắp ráp, nhập khẩu thiết bị ghi nhận hình ảnh người lái xe lắp trên xe ô tô, đơn vị cung cấp dịch vụ liên quan đến giám sát hành trình, ghi nhận hình ảnh người lái xe thực hiện một trong các hành vi vi phạm sau đây: a) làm sai lệch thông tin, dữ liệu của thiết bị giám sát hành trình của xe ô tô; b) làm sai lệch thông tin, dữ liệu của thiết bị ghi nhận hình ảnh người lái xe lắp trên xe ô tô. 11. phạt tiền từ 40.000.000 đồng đến 50.000.000 đồng đối với cá nhân, từ 80.000.000 đồng đến 100.000.000 đồng đối với tổ chức kinh doanh vận tải, dịch vụ hỗ trợ vận tải tái phạm hành vi quy định tại điểm a, điểm h khoản 7 điều này. 12. ngoài việc bị phạt tiền, cá nhân, tổ chức thực hiện hành vi vi phạm quy định tại điểm c khoản 2; điểm a, điểm b, điểm đ, điểm g khoản 4; điểm b, điểm c, điểm d, điểm đ, điểm e, điểm g khoản 7; điểm c khoản 8 điều này còn bị áp dụng các hình thức xử phạt bổ sung tước quyền sử dụng phù hiệu từ 01 tháng đến 03 tháng (nếu có hoặc đã được cấp) đối với xe vi phạm. 13. ngoài việc bị áp dụng hình thức xử phạt, cá nhân, tổ chức thực hiện hành vi vi phạm còn bị áp dụng các biện pháp khắc phục hậu quả sau đây: a) thực hiện hành vi quy định tại điểm a khoản 4 điều này buộc cấp thẻ nhận dạng lái xe cho lái xe theo quy định; b) thực hiện hành vi quy định tại điểm b, điểm c, điểm d khoản 4; điểm a khoản 8 điều này buộc tổ chức tập huấn, hướng dẫn nghiệp vụ, quy trình hoặc tổ chức khám sức khỏe định kỳ cho lái xe và nhân viên phục vụ trên xe theo quy định; c) thực hiện hành vi quy định tại điểm đ, điểm e khoản 4; điểm c, điểm g khoản 7 điều này buộc lắp đặt thiết bị giám sát hành trình, thiết bị ghi nhận hình ảnh người lái xe, dây đai an toàn, ghế ngồi cho trẻ em mầm non, học sinh tiểu học trên xe theo đúng quy định; d) thực hiện hành vi quy định tại điểm a, điểm h khoản 7; khoản 11 điều này buộc cung cấp, cập nhật, truyền dẫn, lưu trữ, quản lý thông tin, dữ liệu thu thập từ thiết bị giám sát hành trình, thiết bị ghi nhận hình ảnh người lái xe lắp trên xe ô tô theo quy định; đ) thực hiện hành vi quy định tại điểm c, điểm d khoản 6 điều này buộc thực hiện đúng quy định về màu sơn, biển báo dấu hiệu nhận biết của xe. 14. ngoài việc bị áp dụng hình thức xử phạt, người điều khiển phương tiện thực hiện hành vi vi phạm còn bị trừ điểm giấy phép lái xe như sau: a) thực hiện hành vi quy định tại điểm đ khoản 2; điểm b, điểm c, điểm d khoản 6; điểm b, điểm c, điểm e, điểm i khoản 7 điều này trong trường hợp cá nhân kinh doanh vận tải là người trực tiếp điều khiển phương tiện còn bị trừ điểm giấy phép lái xe 02 điểm; b) thực hiện hành vi quy định tại điểm c khoản 8 điều này trong trường hợp cá nhân kinh doanh vận tải là người trực tiếp điều khiển phương tiện còn bị trừ điểm giấy phép lái xe 06 điểm.']","**Nguồn văn bản:** 168_2024_ND-CP_619502

**Tên văn bản:** Nghị định Quy định xử phạt vi phạm hành chính về trật tự, an toàn giao thông trong lĩnh vực giao thông đường bộ; trừ điểm, phục hồi điểm giấy phép lái xe

**Điều 26:** xử phạt các hành vi vi phạm quy định về trật tự, an toàn giao thông đường bộ trong vận tải đường bộ, dịch vụ hỗ trợ vận tải đường bộ

**Nội dung:**

1. Phạt tiền từ 500.000 đồng đến 1.000.000 đồng đối với cá nhân, từ 1.000.000 đồng đến 2.000.000 đồng đối với tổ chức thực hiện một trong các hành vi vi phạm sau đây:

	a) Xếp hàng hóa lên mỗi xe ô tô (kể cả rơ moóc và sơ mi rơ moóc) vượt quá trọng tải (khối lượng hàng chuyên chở) cho phép tham gia giao thông được ghi trong giấy chứng nhận kiểm định an toàn kỹ thuật và bảo vệ môi trường của xe trên 10% đến 50% (trừ xe xi téc chở chất lỏng), trên 20% đến 50% đối với xe xi téc chở chất lỏng.

	b) Xếp hàng hóa lên xe ô tô mà không ký xác nhận việc xếp hàng hóa vào giấy vận tải theo quy định.

2. Phạt tiền từ 1.000.000 đồng đến 2.000.000 đồng đối với cá nhân, từ 2.000.000 đồng đến 4.000.000 đồng đối với tổ chức kinh doanh vận tải, dịch vụ hỗ trợ vận tải thực hiện một trong các hành vi vi phạm sau đây:
    ...

3. Phạt tiền từ 2.000.000 đồng đến 3.000.000 đồng đối với cá nhân, từ 4.000.000 đồng đến 6.000.000 đồng đối với tổ chức thực hiện hành vi vi phạm xếp hàng hóa lên mỗi xe ô tô (kể cả rơ moóc và sơ mi rơ moóc) vượt quá trọng tải (khối lượng hàng chuyên chở) cho phép tham gia giao thông được ghi trong giấy chứng nhận kiểm định an toàn kỹ thuật và bảo vệ môi trường của xe trên 50% đến 100%.
    ...

4. Phạt tiền từ 3.000.000 đồng đến 4.000.000 đồng đối với cá nhân, từ 6.000.000 đồng đến 8.000.000 đồng đối với tổ chức kinh doanh vận tải, dịch vụ hỗ trợ vận tải thực hiện một trong các hành vi vi phạm sau đây:
    ...

5. Phạt tiền từ 4.000.000 đồng đến 5.000.000 đồng đối với cá nhân, từ 8.000.000 đồng đến 10.000.000 đồng đối với tổ chức xếp hàng hóa lên mỗi xe ô tô (kể cả rơ moóc và sơ mi rơ moóc) vượt quá trọng tải (khối lượng hàng chuyên chở) cho phép tham gia giao thông được ghi trong giấy chứng nhận kiểm định an toàn kỹ thuật và bảo vệ môi trường của xe trên 100%.
    ...

6. Phạt tiền từ 4.000.000 đồng đến 6.000.000 đồng đối với cá nhân, từ 8.000.000 đồng đến 12.000.000 đồng đối với tổ chức kinh doanh vận tải thực hiện một trong các hành vi vi phạm sau đây:
    ...

7. Phạt tiền từ 5.000.000 đồng đến 6.000.000 đồng đối với cá nhân, từ 10.000.000 đồng đến 12.000.000 đồng đối với tổ chức kinh doanh vận tải, dịch vụ hỗ trợ vận tải thực hiện một trong các hành vi vi phạm sau đây:
    ...

8. Phạt tiền từ 10.000.000 đồng đến 12.000.000 đồng đối với cá nhân, từ 20.000.000 đồng đến 24.000.000 đồng đối với tổ chức kinh doanh vận tải, dịch vụ hỗ trợ vận tải thực hiện một trong các hành vi vi phạm sau đây:
    ...

9. Phạt tiền từ 20.000.000 đồng đến 40.000.000 đồng đối với đơn vị sản xuất, lắp ráp, nhập khẩu thiết bị giám sát hành trình của xe ô tô, đơn vị cung cấp dịch vụ liên quan đến giám sát hành trình, ghi nhận hình ảnh người lái xe thực hiện một trong các hành vi sau:
    ...

10. Phạt tiền từ 40.000.000 đồng đến 60.000.000 đồng đối với đơn vị sản xuất, lắp ráp, nhập khẩu thiết bị ghi nhận hình ảnh người lái xe lắp trên xe ô tô, đơn vị cung cấp dịch vụ liên quan đến giám sát hành trình, ghi nhận hình ảnh người lái xe thực hiện một trong các hành vi vi phạm sau đây:
    ...

11. Phạt tiền từ 40.000.000 đồng đến 50.000.000 đồng đối với cá nhân, từ 80.000.000 đồng đến 100.000.000 đồng đối với tổ chức kinh doanh vận tải, dịch vụ hỗ trợ vận tải tái phạm hành vi quy định tại điểm a, điểm h khoản 7 điều này.
    ...

12. Ngoài việc bị phạt tiền, cá nhân, tổ chức thực hiện hành vi vi phạm quy định tại điểm c khoản 2; điểm a, điểm b, điểm đ, điểm g khoản 4; điểm b, điểm c, điểm d, điểm đ, điểm e, điểm g khoản 7; điểm c khoản 8 điều này còn bị áp dụng các hình thức xử phạt bổ sung tước quyền sử dụng phù hiệu từ 01 tháng đến 03 tháng (nếu có hoặc đã được cấp) đối với xe vi phạm.
    ...

13. Ngoài việc bị áp dụng hình thức xử phạt, cá nhân, tổ chức thực hiện hành vi vi phạm còn bị áp dụng các biện pháp khắc phục hậu quả sau đây:
    ...

14. Ngoài việc bị áp dụng hình thức xử phạt, người điều khiển phương tiện thực hiện hành vi vi phạm còn bị trừ điểm giấy phép lái xe như sau:
    ...


**Tóm lại:** Văn bản này không đề cập cụ thể đến quy định riêng cho xe ô tô chở hàng đông lạnh, mà tập trung vào các quy định chung về vận tải hàng hóa bằng xe ô tô như trọng tải, giấy tờ vận tải, thiết bị an toàn,...  Để tìm hiểu quy định cụ thể về xe chở hàng đông lạnh, bạn cần tham khảo các văn bản pháp luật khác liên quan đến vận chuyển hàng hóa đặc biệt hoặc an toàn thực phẩm.
",Xe ô tô chở hàng đông lạnh phải được kiểm định và đáp ứng các tiêu chuẩn về nhiệt độ và vệ sinh.,0.9,0.5176705880766713,0.0,0.0
44,Luật Giao thông Đường bộ 2025 có quy định gì về việc sử dụng xe ô tô chở xăng dầu?,"['thực hiện trách nhiệm của chủ phương tiện giao thông đường bộ theo quy định của pháp luật về thanh toán điện tử giao thông đường bộ, pháp luật về thu phí sử dụng đường cao tốc.']","Không tìm thấy thông tin liên quan tới câu hỏi này.
","Xe ô tô chở xăng dầu phải có giấy phép đặc biệt, được kiểm định an toàn và tuân thủ các quy định về phòng cháy chữa cháy.",0.0,0.0,0.0,0.0
45,Quy định mới về việc sử dụng xe ô tô chở khí gas là gì?,"['1. việc vận chuyển hành khách bằng xe ô tô phải tuân thủ các quy định sau đây: a) đón, trả hành khách đúng nơi quy định; hướng dẫn sử dụng trang thiết bị an toàn trên xe; có biện pháp giữ gìn vệ sinh trong xe; b) vận chuyển hành khách đúng lịch trình, lộ trình đã đăng ký, trừ trường hợp bất khả kháng; c) không chở hành khách trên nóc xe, trong khoang chở hành lý hoặc để hành khách đu, bám bên ngoài xe; d) không chở hàng hóa nguy hiểm, hàng hóa cấm lưu hành, hàng lậu, động vật hoang dã, hàng có mùi hôi thối hoặc động vật, hàng hóa khác có ảnh hưởng đến sức khỏe của hành khách, môi trường; đ) không chở quá số người, chở hành lý, hàng hóa vượt quá khối lượng cho phép hoặc vi phạm quy định khác của pháp luật; e) không chở hàng hóa trong khoang chở hành khách. 2. người lái xe, nhân viên phục vụ trên xe ô tô vận chuyển hành khách có trách nhiệm sau đây: a) thực hiện quy định tại khoản 1 điều này; b) trước khi cho xe khởi hành phải kiểm tra các điều kiện bảo đảm an toàn của xe, hướng dẫn cho hành khách về an toàn giao thông đường bộ và thoát hiểm khi gặp sự cố; c) hướng dẫn, yêu cầu, kiểm tra người trên xe thực hiện quy định tại khoản 2 điều 10 của luật này; d) kiểm tra việc sắp xếp, chằng buộc hành lý, hàng hóa bảo đảm an toàn; đ) giữ gìn trật tự, vệ sinh trong xe; e) phối hợp thực hiện các nhiệm vụ khác theo yêu cầu của cơ quan công an trong công tác bảo vệ an ninh quốc gia, bảo đảm trật tự, an toàn xã hội; g) thực hiện các quy tắc giao thông đường bộ khác quy định tại chương ii của luật này.']","Không tìm thấy thông tin liên quan tới câu hỏi này.
","Xe ô tô chở khí gas phải có giấy phép đặc biệt, được kiểm định an toàn và tuân thủ các quy định về phòng cháy chữa cháy.",0.0,-0.0,0.0,0.0
46,Luật Giao thông Đường bộ 2025 có quy định gì về việc sử dụng xe ô tô chở hóa chất độc hại?,"['1. đơn vị kinh doanh vận tải có giấy phép kinh doanh vận tải bằng ô tô, trong đó có một hoặc các loại hình kinh doanh vận tải hàng hóa bằng xe ô tô quy định tại khoản 2, khoản 3 và khoản 4 điều này thì được tham gia kinh doanh vận tải hàng hóa bằng xe ô tô theo loại hình đã đăng ký. 2. kinh doanh vận tải hàng hóa bằng xe taxi tải là việc sử dụng xe ô tô có trọng tải từ 1.500 ki-lô-gam trở xuống để vận chuyển hàng hóa và người thuê vận tải trả tiền cho lái xe theo đồng hồ tính tiền hoặc theo phần mềm tính tiền trên xe. mặt ngoài hai bên thành xe hoặc cánh cửa xe niêm yết cụm từ “taxi tải” theo mẫu số 08 phụ lục xiii kèm theo nghị định này, số điện thoại liên lạc, tên đơn vị kinh doanh vận tải. 3. kinh doanh vận tải hàng hóa siêu trường, siêu trọng a) kinh doanh vận tải hàng hóa siêu trường, siêu trọng là việc sử dụng xe ô tô để vận chuyển hàng không thể chia nhỏ, tháo rời, khi vận chuyển trên đường bộ làm cho phương tiện hoặc tổ hợp phương tiện bị vượt quá giới hạn cho phép tham gia giao thông đường bộ về kích thước, khối lượng theo quy định của pháp luật; b) khi vận chuyển hàng hóa siêu trường, siêu trọng, phải thực hiện theo quy định tại điều 53 luật trật tự, an toàn giao thông đường bộ. 4. kinh doanh vận tải hàng hóa nguy hiểm a) kinh doanh vận tải hàng hóa nguy hiểm là việc sử dụng xe ô tô để vận chuyển hàng hóa có chứa các chất nguy hiểm có khả năng gây nguy hại tới tính mạng, sức khỏe con người, môi trường, an toàn và an ninh quốc gia; b) khi vận chuyển hàng hóa nguy hiểm phải thực hiện theo quy định tại điều 51 luật trật tự, an toàn giao thông đường bộ. 5. kinh doanh vận tải hàng hóa thông thường là hình thức kinh doanh vận tải hàng hóa, trừ các hình thức kinh doanh vận tải quy định tại các khoản 2, khoản 3 điều này. 6. xe ô tô đầu kéo kéo rơ moóc hoặc sơ mi rơ moóc kinh doanh vận tải hàng hóa, xe ô tô tải kinh doanh vận tải hàng hóa thông thường và xe taxi tải phải có phù hiệu “xe tải” theo mẫu số 09 phụ lục xiii kèm theo nghị định này và được dán cố định tại góc trên bên phải ngay sát phía dưới vị trí của tem kiểm định, mặt trong kính chắn gió phía trước của xe. 7. đơn vị kinh doanh vận tải hàng hóa phải chịu trách nhiệm thực hiện đúng quy định việc xếp hàng hóa lên xe ô tô. 8. đơn vị kinh doanh vận tải hàng hóa phải cấp cho lái xe giấy vận tải trong quá trình vận chuyển hàng hóa trên đường. giấy vận tải phải có xác nhận (ký, ghi rõ họ và tên) khối lượng hàng hóa đã xếp lên phương tiện của chủ hàng (hoặc người được chủ hàng ủy quyền) hoặc đại diện đơn vị, cá nhân thực hiện việc xếp hàng. 9. khi vận chuyển hàng hóa, lái xe phải mang theo giấy vận tải (giấy vận chuyển) bằng văn bản giấy hoặc phải có thiết bị để truy cập vào phần mềm thể hiện nội dung của giấy vận tải và các giấy tờ của lái xe và phương tiện theo quy định của pháp luật. đơn vị kinh doanh vận tải và lái xe không được chở hàng vượt quá khối lượng cho phép tham gia giao thông. 10. đối với hoạt động vận chuyển xe đạp, xe mô tô, xe gắn máy và các loại xe tương tự qua hầm đường bộ áp dụng theo quy định tại khoản 4 điều này. 11. giấy vận tải bằng văn bản giấy hoặc điện tử do đơn vị kinh doanh vận tải hàng hóa tự phát hành và có các thông tin tối thiểu gồm: tên đơn vị vận tải; biển kiểm soát xe; tên đơn vị hoặc người thuê vận tải; hành trình (điểm đầu, điểm cuối); số hợp đồng, ngày tháng năm ký hợp đồng (nếu có); loại hàng và khối lượng hàng vận chuyển trên xe. đơn vị kinh doanh vận tải hàng hóa phải thực hiện lưu trữ giấy vận tải của các chuyến xe đã thực hiện trong thời gian tối thiểu 03 năm. 12. việc bồi thường hàng hóa hư hỏng, mất mát, thiếu hụt được thực hiện theo hợp đồng vận chuyển hoặc theo thỏa thuận giữa người kinh doanh vận tải và người thuê vận tải.']","**Nguồn văn bản:** 158_2024_ND-CP_636875

**Tên văn bản:** Nghị định Quy định về hoạt động vận tải đường bộ

**Điều 8:** kinh doanh vận tải hàng hóa bằng xe ô tô

**Nội dung:**

4. Kinh doanh vận tải hàng hóa nguy hiểm

	a) Kinh doanh vận tải hàng hóa nguy hiểm là việc sử dụng xe ô tô để vận chuyển hàng hóa có chứa các chất nguy hiểm có khả năng gây nguy hại tới tính mạng, sức khỏe con người, môi trường, an toàn và an ninh quốc gia.

	b) Khi vận chuyển hàng hóa nguy hiểm phải thực hiện theo quy định tại Điều 51 Luật Trật tự, an toàn giao thông đường bộ.


**Tóm lại:** Việc vận chuyển hóa chất độc hại bằng xe ô tô được coi là kinh doanh vận tải hàng hóa nguy hiểm và phải tuân thủ quy định tại Điều 51 của Luật Trật tự, an toàn giao thông đường bộ.
","Xe ô tô chở hóa chất độc hại phải có giấy phép đặc biệt, được kiểm định an toàn và tuân thủ các quy định về môi trường.",1.0,0.5043194507487131,0.0,0.0
47,Quy định mới về việc sử dụng xe ô tô chở vật liệu xây dựng là gì?,"['1. đơn vị vận tải phải lựa chọn phương tiện phù hợp với kích thước, khối lượng hàng hóa vận chuyển. hàng hóa được vận chuyển phải phù hợp với kết cấu của khoang chứa hàng và công năng của phương tiện vận chuyển. 2. việc xếp hàng hóa trên phương tiện giao thông đường bộ khi tham gia giao thông trên đường bộ phải tuân thủ các quy định về khối lượng toàn bộ của xe, tải trọng trục xe, cụm trục xe, chiều cao, chiều rộng, chiều dài xếp hàng hóa cho phép của xe quy định tại điều 14, điều 15, điều 16 và điều 17 của thông tư này và không vượt quá khối lượng hàng hóa chuyên chở cho phép tham gia giao thông ghi trong giấy chứng nhận kiểm định an toàn kỹ thuật và bảo vệ môi trường của xe trừ trường hợp được cấp giấy phép lưu hành xe quá tải trọng, xe quá khổ giới hạn, xe vận chuyển hàng siêu trường, siêu trọng trên đường bộ. 3. hàng hóa xếp trên phương tiện phải được xếp đặt gọn gàng, xếp dàn đều, chằng buộc chắc chắn, chèn, lót đảm bảo không bị xê dịch theo các phương ngang, phương dọc và phương thẳng đứng; đảm bảo các quy định về vệ sinh môi trường; không để rơi vãi khi phương tiện tham gia giao thông; không cản trở tầm nhìn của lái xe; không làm mất thăng bằng của phương tiện hoặc gây khó khăn cho lái xe khi điều khiển; không che khuất đèn, biển số đăng ký và các cảnh báo an toàn của phương tiện. một số trang thiết bị thường dùng để gia cố, chằng buộc, chèn, lót hàng hóa được hướng dẫn tại phụ lục x ban hành kèm theo thông tư này. 4. đối với các loại hàng hóa là máy móc, phương tiện giao thông, trước khi xếp lên phương tiện phải rút hết nhiên liệu ra khỏi bình chứa. phương pháp xếp hàng hóa là máy móc, phương tiện giao thông được hướng dẫn tại phụ lục xi ban hành kèm theo thông tư này. 5. việc xếp hàng hóa trên phương tiện đối với các loại hàng hóa đã được đóng gói thành bao, kiện, thùng, cuộn, khối thực hiện theo hướng dẫn của nhà sản xuất. 6. việc xếp các loại hàng hóa nguy hiểm trên phương tiện thực hiện theo quy định về vận chuyển hàng hóa nguy hiểm bằng phương tiện giao thông cơ giới đường bộ và quy định tại chương này.']","**Nguồn văn bản:** 39_2024_TT-BGTVT_633952

**Tên văn bản:** Thông tư Quy định về tải trọng, khổ giới hạn của đường bộ; lưu hành xe quá khổ giới hạn, xe quá tải trọng, xe bánh xích trên đường bộ; hàng siêu trường, siêu trọng, vận chuyển hàng siêu trường, siêu trọng; xếp hàng hóa trên phương tiện giao thông đường bộ; cấp giấy phép lưu hành cho xe quá tải trọng, xe quá khổ giới hạn, xe bánh xích, xe vận chuyển hàng siêu trường, siêu trọng trên đường bộ

**Điều 13:** quy định chung về xếp hàng hóa trên phương tiện giao thông đường bộ

**Nội dung:**

1. Đơn vị vận tải phải lựa chọn phương tiện phù hợp với kích thước, khối lượng hàng hóa vận chuyển. 

    Hàng hóa được vận chuyển phải phù hợp với kết cấu của khoang chứa hàng và công năng của phương tiện vận chuyển.

2. Việc xếp hàng hóa trên phương tiện giao thông đường bộ khi tham gia giao thông trên đường bộ phải tuân thủ các quy định về khối lượng toàn bộ của xe, tải trọng trục xe, cụm trục xe, chiều cao, chiều rộng, chiều dài xếp hàng hóa cho phép của xe quy định tại điều 14, điều 15, điều 16 và điều 17 của thông tư này và không vượt quá khối lượng hàng hóa chuyên chở cho phép tham gia giao thông ghi trong giấy chứng nhận kiểm định an toàn kỹ thuật và bảo vệ môi trường của xe trừ trường hợp được cấp giấy phép lưu hành xe quá tải trọng, xe quá khổ giới hạn, xe vận chuyển hàng siêu trường, siêu trọng trên đường bộ.

3. Hàng hóa xếp trên phương tiện phải được xếp đặt gọn gàng, xếp dàn đều, chằng buộc chắc chắn, chèn, lót đảm bảo không bị xê dịch theo các phương ngang, phương dọc và phương thẳng đứng; đảm bảo các quy định về vệ sinh môi trường; không để rơi vãi khi phương tiện tham gia giao thông; không cản trở tầm nhìn của lái xe; không làm mất thăng bằng của phương tiện hoặc gây khó khăn cho lái xe khi điều khiển; không che khuất đèn, biển số đăng ký và các cảnh báo an toàn của phương tiện. 

    Một số trang thiết bị thường dùng để gia cố, chằng buộc, chèn, lót hàng hóa được hướng dẫn tại phụ lục x ban hành kèm theo thông tư này.

4. Đối với các loại hàng hóa là máy móc, phương tiện giao thông, trước khi xếp lên phương tiện phải rút hết nhiên liệu ra khỏi bình chứa. 

    Phương pháp xếp hàng hóa là máy móc, phương tiện giao thông được hướng dẫn tại phụ lục xi ban hành kèm theo thông tư này.

5. Việc xếp hàng hóa trên phương tiện đối với các loại hàng hóa đã được đóng gói thành bao, kiện, thùng, cuộn, khối thực hiện theo hướng dẫn của nhà sản xuất.

6. Việc xếp các loại hàng hóa nguy hiểm trên phương tiện thực hiện theo quy định về vận chuyển hàng hóa nguy hiểm bằng phương tiện giao thông cơ giới đường bộ và quy định tại chương này.


**Tóm lại:** Khi chở vật liệu xây dựng bằng ô tô, cần tuân thủ các quy định về tải trọng, kích thước, chằng buộc hàng hóa để đảm bảo an toàn giao thông. Cụ thể, phải chọn xe phù hợp, xếp hàng gọn gàng, chằng buộc chắc chắn, không che khuất tầm nhìn, không gây mất thăng bằng, và tuân thủ quy định về vận chuyển hàng hóa nguy hiểm nếu có. Chi tiết về tải trọng, kích thước được quy định tại các điều 14, 15, 16 và 17 của Thông tư này.
",Xe ô tô chở vật liệu xây dựng phải được che phủ kín để tránh rơi vãi và gây ô nhiễm môi trường.,1.0,0.4921613405456869,0.0,0.0
48,Luật Giao thông Đường bộ 2025 có quy định gì về việc sử dụng xe ô tô chở rác thải?,"['thông tư quy định về phân loại phương tiện giao thông đường bộ và dấu hiệu nhận biết xe cơ giới sử dụng năng lượng sạch, năng lượng xanh, thân thiện môi trường.']","**Nguồn văn bản:** 53_2024_TT-BGTVT_624420

**Tên văn bản:** Thông tư Quy định về phân loại phương tiện giao thông đường bộ và dấu hiệu nhận biết xe cơ giới sử dụng năng lượng sạch, năng lượng xanh, thân thiện môi trường

**điều 1:** phạm vi điều chỉnh

**Nội dung:**

Thông tư quy định về phân loại phương tiện giao thông đường bộ và dấu hiệu nhận biết xe cơ giới sử dụng năng lượng sạch, năng lượng xanh, thân thiện môi trường.

Tóm lại: Văn bản này không chứa thông tin về luật giao thông đường bộ liên quan đến việc sử dụng xe ô tô chở rác thải.
","Xe ô tô chở rác thải phải được che phủ kín, không để rò rỉ nước thải và tuân thủ các quy định về vệ sinh môi trường.",0.4,0.5933928759741125,0.0,0.0
49,Quy định mới về việc sử dụng xe ô tô chở động vật sống là gì?,"['1. việc vận chuyển động vật sống phải bảo đảm các yêu cầu sau đây: a) người lái xe phải mang đủ giấy tờ theo quy định của pháp luật; b) phương tiện vận chuyển phải có kết cấu phù hợp với loại động vật chuyên chở; c) trong quá trình vận chuyển phải chấp hành các quy định của pháp luật về trật tự, an toàn giao thông đường bộ, vệ sinh dịch tễ, phòng dịch và bảo đảm vệ sinh môi trường. 2. việc vận chuyển thực phẩm tươi sống phải bảo đảm các yêu cầu sau đây: a) người lái xe phải mang đủ giấy tờ theo quy định của pháp luật; b) trong quá trình vận chuyển phải chấp hành các quy định của pháp luật về trật tự, an toàn giao thông đường bộ, an toàn thực phẩm, vệ sinh dịch tễ, phòng dịch và bảo đảm vệ sinh môi trường.']","**Nguồn văn bản:** 36_2024_QH15_444251

**Tên văn bản:** Luật Trật tự, an toàn giao thông đường bộ

**Điều 50:** Bảo đảm trật tự, an toàn giao thông đường bộ đối với phương tiện giao thông đường bộ vận chuyển động vật sống, thực phẩm tươi sống

**Nội dung:**

1. Việc vận chuyển động vật sống phải bảo đảm các yêu cầu sau đây:

	a) Người lái xe phải mang đủ giấy tờ theo quy định của pháp luật.

	b) Phương tiện vận chuyển phải có kết cấu phù hợp với loại động vật chuyên chở.

	c) Trong quá trình vận chuyển phải chấp hành các quy định của pháp luật về trật tự, an toàn giao thông đường bộ, vệ sinh dịch tễ, phòng dịch và bảo đảm vệ sinh môi trường.

2. Việc vận chuyển thực phẩm tươi sống phải bảo đảm các yêu cầu sau đây:

	a) Người lái xe phải mang đủ giấy tờ theo quy định của pháp luật.

	b) Trong quá trình vận chuyển phải chấp hành các quy định của pháp luật về trật tự, an toàn giao thông đường bộ, an toàn thực phẩm, vệ sinh dịch tễ, phòng dịch và bảo đảm vệ sinh môi trường.


Tóm lại: Xe ô tô chở động vật sống phải có giấy tờ hợp lệ, kết cấu phù hợp với động vật vận chuyển và tuân thủ quy định về trật tự an toàn giao thông, vệ sinh dịch tễ, phòng dịch và bảo vệ môi trường.
","Xe ô tô chở động vật sống phải đảm bảo vệ sinh, an toàn cho động vật và không gây ô nhiễm môi trường.",1.0,0.5064272423136946,0.0,0.9999999999
50,Luật Giao thông Đường bộ 2025 có quy định gì về việc sử dụng xe ô tô chở cây cảnh?,"['thực hiện trách nhiệm của chủ phương tiện giao thông đường bộ theo quy định của pháp luật về thanh toán điện tử giao thông đường bộ, pháp luật về thu phí sử dụng đường cao tốc.']","Không tìm thấy thông tin liên quan tới câu hỏi này.
","Xe ô tô chở cây cảnh phải được sắp xếp gọn gàng, đảm bảo an toàn và không cản trở tầm nhìn của người lái.",0.0,0.0,0.0,0.0
51,Quy định mới về việc sử dụng xe ô tô chở hàng dễ cháy nổ là gì?,"['1. phạt tiền từ 500.000 đồng đến 1.000.000 đồng đối với cá nhân, từ 1.000.000 đồng đến 2.000.000 đồng đối với tổ chức thực hiện một trong các hành vi vi phạm sau đây: a) xếp hàng hóa lên mỗi xe ô tô (kể cả rơ moóc và sơ mi rơ moóc) vượt quá trọng tải (khối lượng hàng chuyên chở) cho phép tham gia giao thông được ghi trong giấy chứng nhận kiểm định an toàn kỹ thuật và bảo vệ môi trường của xe trên 10% đến 50% (trừ xe xi téc chở chất lỏng), trên 20% đến 50% đối với xe xi téc chở chất lỏng; b) xếp hàng hóa lên xe ô tô mà không ký xác nhận việc xếp hàng hóa vào giấy vận tải theo quy định. 2. phạt tiền từ 1.000.000 đồng đến 2.000.000 đồng đối với cá nhân, từ 2.000.000 đồng đến 4.000.000 đồng đối với tổ chức kinh doanh vận tải, dịch vụ hỗ trợ vận tải thực hiện một trong các hành vi vi phạm sau đây: a) không đánh số thứ tự ghế ngồi, giường nằm trên xe ô tô chở hành khách theo quy định; b) sử dụng xe ô tô kinh doanh vận tải hành khách theo tuyến cố định, xe ô tô kinh doanh vận tải hành khách bằng xe buýt không có chỗ ưu tiên cho người khuyết tật, người cao tuổi và phụ nữ mang thai theo quy định; c) sử dụng xe ô tô kinh doanh vận tải hành khách không có hướng dẫn cho hành khách về an toàn giao thông, thoát hiểm khi xảy ra sự cố trên xe theo quy định; d) không bố trí người áp tải trên xe vận chuyển hàng hóa nguy hiểm đối với những trường hợp quy định phải có người áp tải; đ) không cấp lệnh vận chuyển, giấy vận tải cho lái xe hoặc cấp lệnh vận chuyển, giấy vận tải nhưng không đúng theo quy định (đối với loại xe quy định phải cấp lệnh vận chuyển, giấy vận tải); e) sử dụng xe vận chuyển hàng hóa nguy hiểm mà không làm sạch hoặc không bóc (xóa) biểu trưng nguy hiểm trên phương tiện khi không tiếp tục vận chuyển loại hàng hóa đó. 3. phạt tiền từ 2.000.000 đồng đến 3.000.000 đồng đối với cá nhân, từ 4.000.000 đồng đến 6.000.000 đồng đối với tổ chức thực hiện hành vi vi phạm xếp hàng hóa lên mỗi xe ô tô (kể cả rơ moóc và sơ mi rơ moóc) vượt quá trọng tải (khối lượng hàng chuyên chở) cho phép tham gia giao thông được ghi trong giấy chứng nhận kiểm định an toàn kỹ thuật và bảo vệ môi trường của xe trên 50% đến 100%. 4. phạt tiền từ 3.000.000 đồng đến 4.000.000 đồng đối với cá nhân, từ 6.000.000 đồng đến 8.000.000 đồng đối với tổ chức kinh doanh vận tải, dịch vụ hỗ trợ vận tải thực hiện một trong các hành vi vi phạm sau đây: a) không cấp thẻ nhận dạng lái xe cho lái xe theo quy định; b) sử dụng lái xe, nhân viên phục vụ trên xe để tham gia kinh doanh vận tải bằng xe ô tô mà không được tập huấn, hướng dẫn về nghiệp vụ vận tải hành khách và an toàn giao thông theo quy định (đối với hình thức kinh doanh vận tải có quy định lái xe, nhân viên phục vụ trên xe phải được tập huấn, hướng dẫn nghiệp vụ), trừ các hành vi vi phạm quy định tại điểm c, điểm d khoản này; c) sử dụng lái xe, người quản lý trên xe để tham gia kinh doanh vận tải bằng xe ô tô mà không được hướng dẫn về quy trình bảo đảm an toàn khi đưa đón trẻ em mầm non, học sinh; d) sử dụng lái xe, người áp tải vận chuyển hàng hóa nguy hiểm mà không được tập huấn về vận chuyển hàng hóa nguy hiểm; đ) sử dụng xe ô tô kinh doanh vận tải hành khách không có dây đai an toàn tại các vị trí ghế ngồi, giường nằm theo quy định (trừ xe buýt nội tỉnh); e) sử dụng xe ô tô kinh doanh vận tải chở trẻ em mầm non, học sinh tiểu học, xe ô tô kinh doanh vận tải kết hợp với hoạt động đưa đón trẻ em mầm non, học sinh tiểu học không có dây đai an toàn phù hợp với lứa tuổi hoặc không có ghế ngồi phù hợp với lứa tuổi theo quy định; g) không thực hiện việc niêm yết thông tin trên xe theo quy định hoặc có niêm yết nhưng không chính xác, không đầy đủ thông tin theo quy định. 5. phạt tiền từ 4.000.000 đồng đến 5.000.000 đồng đối với cá nhân, từ 8.000.000 đồng đến 10.000.000 đồng đối với tổ chức xếp hàng hóa lên mỗi xe ô tô (kể cả rơ moóc và sơ mi rơ moóc) vượt quá trọng tải (khối lượng hàng chuyên chở) cho phép tham gia giao thông được ghi trong giấy chứng nhận kiểm định an toàn kỹ thuật và bảo vệ môi trường của xe trên 100%. 6. phạt tiền từ 4.000.000 đồng đến 6.000.000 đồng đối với cá nhân, từ 8.000.000 đồng đến 12.000.000 đồng đối với tổ chức kinh doanh vận tải thực hiện một trong các hành vi vi phạm sau đây: a) sử dụng xe vận chuyển động vật sống không có kết cấu phù hợp với loại động vật chuyên chở theo quy định; b) sử dụng xe ô tô kinh doanh vận tải chở trẻ em mầm non, học sinh, xe ô tô kinh doanh vận tải kết hợp với hoạt động đưa đón trẻ em mầm non, học sinh không có thiết bị ghi nhận hình ảnh trẻ em mầm non, học sinh hoặc không có thiết bị có chức năng cảnh báo, chống bỏ quên trẻ em trên xe hoặc không có thiết bị ghi nhận hình ảnh trẻ em mầm non, học sinh và thiết bị có chức năng cảnh báo, chống bỏ quên trẻ em trên xe; c) sử dụng xe ô tô kinh doanh vận tải chở trẻ em mầm non, học sinh không có màu sơn theo quy định; d) sử dụng xe ô tô kinh doanh vận tải chở trẻ em mầm non, học sinh, xe ô tô kinh doanh vận tải kết hợp với hoạt động đưa đón trẻ em mầm non, học sinh không có biển báo dấu hiệu nhận biết là xe chở trẻ em mầm non, học sinh theo quy định. 7. phạt tiền từ 5.000.000 đồng đến 6.000.000 đồng đối với cá nhân, từ 10.000.000 đồng đến 12.000.000 đồng đối với tổ chức kinh doanh vận tải, dịch vụ hỗ trợ vận tải thực hiện một trong các hành vi vi phạm sau đây: a) không thực hiện việc cung cấp, cập nhật, truyền, lưu trữ, quản lý thông tin, dữ liệu từ thiết bị giám sát hành trình theo quy định; b) không thực hiện đúng nội dung thông tin đã niêm yết trên xe theo quy định; c) sử dụng phương tiện kinh doanh vận tải không lắp thiết bị giám sát hành trình của xe (đối với hình thức kinh doanh vận tải có quy định phương tiện phải lắp thiết bị) hoặc lắp thiết bị nhưng thiết bị không hoạt động, không đúng quy chuẩn theo quy định hoặc làm sai lệch dữ liệu của thiết bị giám sát hành trình của xe ô tô; d) sử dụng xe trung chuyển chở hành khách không đúng quy định; đ) sử dụng lái xe điều khiển xe khách giường nằm hai tầng, xe ô tô đưa đón trẻ em mầm non, học sinh chưa đủ số năm kinh nghiệm theo quy định; e) sử dụng xe kinh doanh vận tải hành khách theo hợp đồng mà trên xe không có hợp đồng vận tải, danh sách hành khách kèm theo, thiết bị để truy cập nội dung hợp đồng điện tử và danh sách hành khách theo quy định hoặc có hợp đồng vận tải, danh sách hành khách, thiết bị để truy cập nhưng không bảo đảm yêu cầu theo quy định, chở người không có tên trong danh sách hành khách hoặc vận chuyển không đúng đối tượng theo quy định (đối với xe kinh doanh vận tải hành khách theo hợp đồng vận chuyển trẻ em mầm non, học sinh, sinh viên, cán bộ, công chức, viên chức, công nhân); g) sử dụng xe ô tô kinh doanh vận tải không lắp thiết bị ghi nhận hình ảnh người lái xe theo quy định (đối với loại xe có quy định phải lắp thiết bị ghi nhận hình ảnh người lái xe) hoặc có lắp thiết bị ghi nhận hình ảnh người lái xe nhưng không ghi, không lưu trữ được dữ liệu trên xe trong quá trình xe tham gia giao thông theo quy định hoặc làm sai lệch dữ liệu của thiết bị ghi nhận hình ảnh người lái xe lắp trên xe ô tô; h) không thực hiện việc cung cấp, cập nhật, truyền dẫn, lưu trữ, quản lý thông tin, dữ liệu thu thập từ thiết bị ghi nhận hình ảnh người lái xe lắp trên xe ô tô theo quy định; i) sử dụng phương tiện kinh doanh vận tải có niên hạn sử dụng không bảo đảm điều kiện của hình thức kinh doanh đã đăng ký. 8. phạt tiền từ 10.000.000 đồng đến 12.000.000 đồng đối với cá nhân, từ 20.000.000 đồng đến 24.000.000 đồng đối với tổ chức kinh doanh vận tải, dịch vụ hỗ trợ vận tải thực hiện một trong các hành vi vi phạm sau đây: a) không tổ chức khám sức khỏe định kỳ cho lái xe theo quy định hoặc có tổ chức khám nhưng không đầy đủ các nội dung theo quy định; b) vi phạm quy định về kinh doanh, điều kiện kinh doanh vận tải bằng xe ô tô để xảy ra tai nạn giao thông gây hậu quả từ mức nghiêm trọng trở lên; c) sử dụng xe ô tô kinh doanh vận tải để đón, trả khách; nhận, trả hàng trên đường cao tốc. 9. phạt tiền từ 20.000.000 đồng đến 40.000.000 đồng đối với đơn vị sản xuất, lắp ráp, nhập khẩu thiết bị giám sát hành trình của xe ô tô, đơn vị cung cấp dịch vụ liên quan đến giám sát hành trình, ghi nhận hình ảnh người lái xe thực hiện một trong các hành vi sau: a) đơn vị sản xuất, lắp ráp, nhập khẩu thiết bị giám sát hành trình của xe ô tô không có nhân sự cho từng vị trí công việc theo quy định; b) đơn vị sản xuất, lắp ráp, nhập khẩu thiết bị giám sát hành trình của xe ô tô không báo cáo về việc cập nhật, thay đổi phần mềm của thiết bị theo quy định. 10. phạt tiền từ 40.000.000 đồng đến 60.000.000 đồng đối với đơn vị sản xuất, lắp ráp, nhập khẩu thiết bị ghi nhận hình ảnh người lái xe lắp trên xe ô tô, đơn vị cung cấp dịch vụ liên quan đến giám sát hành trình, ghi nhận hình ảnh người lái xe thực hiện một trong các hành vi vi phạm sau đây: a) làm sai lệch thông tin, dữ liệu của thiết bị giám sát hành trình của xe ô tô; b) làm sai lệch thông tin, dữ liệu của thiết bị ghi nhận hình ảnh người lái xe lắp trên xe ô tô. 11. phạt tiền từ 40.000.000 đồng đến 50.000.000 đồng đối với cá nhân, từ 80.000.000 đồng đến 100.000.000 đồng đối với tổ chức kinh doanh vận tải, dịch vụ hỗ trợ vận tải tái phạm hành vi quy định tại điểm a, điểm h khoản 7 điều này. 12. ngoài việc bị phạt tiền, cá nhân, tổ chức thực hiện hành vi vi phạm quy định tại điểm c khoản 2; điểm a, điểm b, điểm đ, điểm g khoản 4; điểm b, điểm c, điểm d, điểm đ, điểm e, điểm g khoản 7; điểm c khoản 8 điều này còn bị áp dụng các hình thức xử phạt bổ sung tước quyền sử dụng phù hiệu từ 01 tháng đến 03 tháng (nếu có hoặc đã được cấp) đối với xe vi phạm. 13. ngoài việc bị áp dụng hình thức xử phạt, cá nhân, tổ chức thực hiện hành vi vi phạm còn bị áp dụng các biện pháp khắc phục hậu quả sau đây: a) thực hiện hành vi quy định tại điểm a khoản 4 điều này buộc cấp thẻ nhận dạng lái xe cho lái xe theo quy định; b) thực hiện hành vi quy định tại điểm b, điểm c, điểm d khoản 4; điểm a khoản 8 điều này buộc tổ chức tập huấn, hướng dẫn nghiệp vụ, quy trình hoặc tổ chức khám sức khỏe định kỳ cho lái xe và nhân viên phục vụ trên xe theo quy định; c) thực hiện hành vi quy định tại điểm đ, điểm e khoản 4; điểm c, điểm g khoản 7 điều này buộc lắp đặt thiết bị giám sát hành trình, thiết bị ghi nhận hình ảnh người lái xe, dây đai an toàn, ghế ngồi cho trẻ em mầm non, học sinh tiểu học trên xe theo đúng quy định; d) thực hiện hành vi quy định tại điểm a, điểm h khoản 7; khoản 11 điều này buộc cung cấp, cập nhật, truyền dẫn, lưu trữ, quản lý thông tin, dữ liệu thu thập từ thiết bị giám sát hành trình, thiết bị ghi nhận hình ảnh người lái xe lắp trên xe ô tô theo quy định; đ) thực hiện hành vi quy định tại điểm c, điểm d khoản 6 điều này buộc thực hiện đúng quy định về màu sơn, biển báo dấu hiệu nhận biết của xe. 14. ngoài việc bị áp dụng hình thức xử phạt, người điều khiển phương tiện thực hiện hành vi vi phạm còn bị trừ điểm giấy phép lái xe như sau: a) thực hiện hành vi quy định tại điểm đ khoản 2; điểm b, điểm c, điểm d khoản 6; điểm b, điểm c, điểm e, điểm i khoản 7 điều này trong trường hợp cá nhân kinh doanh vận tải là người trực tiếp điều khiển phương tiện còn bị trừ điểm giấy phép lái xe 02 điểm; b) thực hiện hành vi quy định tại điểm c khoản 8 điều này trong trường hợp cá nhân kinh doanh vận tải là người trực tiếp điều khiển phương tiện còn bị trừ điểm giấy phép lái xe 06 điểm.']","**Nguồn văn bản:** 168_2024_ND-CP_619502

**Tên văn bản:** Nghị định Quy định xử phạt vi phạm hành chính về trật tự, an toàn giao thông trong lĩnh vực giao thông đường bộ; trừ điểm, phục hồi điểm giấy phép lái xe

**Điều 26:** xử phạt các hành vi vi phạm quy định về trật tự, an toàn giao thông đường bộ trong vận tải đường bộ, dịch vụ hỗ trợ vận tải đường bộ

**Nội dung:**

Văn bản này không đề cập cụ thể đến quy định xử phạt đối với việc sử dụng xe ô tô chở hàng dễ cháy nổ. Tuy nhiên, văn bản có quy định về việc xử phạt đối với vận chuyển hàng hóa nguy hiểm:

2. Phạt tiền từ 1.000.000 đồng đến 2.000.000 đồng đối với cá nhân, từ 2.000.000 đồng đến 4.000.000 đồng đối với tổ chức kinh doanh vận tải, dịch vụ hỗ trợ vận tải thực hiện một trong các hành vi vi phạm sau đây:

    d) Không bố trí người áp tải trên xe vận chuyển hàng hóa nguy hiểm đối với những trường hợp quy định phải có người áp tải.

    đ) Không cấp lệnh vận chuyển, giấy vận tải cho lái xe hoặc cấp lệnh vận chuyển, giấy vận tải nhưng không đúng theo quy định (đối với loại xe quy định phải cấp lệnh vận chuyển, giấy vận tải).

    e) Sử dụng xe vận chuyển hàng hóa nguy hiểm mà không làm sạch hoặc không bóc (xóa) biểu trưng nguy hiểm trên phương tiện khi không tiếp tục vận chuyển loại hàng hóa đó.

4. Phạt tiền từ 3.000.000 đồng đến 4.000.000 đồng đối với cá nhân, từ 6.000.000 đồng đến 8.000.000 đồng đối với tổ chức kinh doanh vận tải, dịch vụ hỗ trợ vận tải thực hiện một trong các hành vi vi phạm sau đây:


    d) Sử dụng lái xe, người áp tải vận chuyển hàng hóa nguy hiểm mà không được tập huấn về vận chuyển hàng hóa nguy hiểm.


**Tóm lại:** Văn bản này không trực tiếp đề cập đến quy định xử phạt việc chở hàng dễ cháy nổ, nhưng quy định xử phạt các hành vi vi phạm liên quan đến vận chuyển hàng hóa nguy hiểm như không có người áp tải, không có lệnh vận chuyển, giấy vận tải hợp lệ, không làm sạch xe sau khi vận chuyển và người áp tải không được tập huấn.  Để biết chi tiết về quy định xử phạt đối với việc sử dụng xe ô tô chở hàng dễ cháy nổ, bạn cần tham khảo các văn bản pháp luật khác có liên quan.
","Xe ô tô chở hàng dễ cháy nổ phải có giấy phép đặc biệt, được kiểm định an toàn và tuân thủ các quy định về phòng cháy chữa cháy.",0.9285714285714286,0.0,1.0,0.0
52,Luật Giao thông Đường bộ 2025 có quy định gì về việc sử dụng xe ô tô chở hàng dễ hỏng?,"['1. đơn vị kinh doanh vận tải có giấy phép kinh doanh vận tải bằng ô tô, trong đó có một hoặc các loại hình kinh doanh vận tải hàng hóa bằng xe ô tô quy định tại khoản 2, khoản 3 và khoản 4 điều này thì được tham gia kinh doanh vận tải hàng hóa bằng xe ô tô theo loại hình đã đăng ký. 2. kinh doanh vận tải hàng hóa bằng xe taxi tải là việc sử dụng xe ô tô có trọng tải từ 1.500 ki-lô-gam trở xuống để vận chuyển hàng hóa và người thuê vận tải trả tiền cho lái xe theo đồng hồ tính tiền hoặc theo phần mềm tính tiền trên xe. mặt ngoài hai bên thành xe hoặc cánh cửa xe niêm yết cụm từ “taxi tải” theo mẫu số 08 phụ lục xiii kèm theo nghị định này, số điện thoại liên lạc, tên đơn vị kinh doanh vận tải. 3. kinh doanh vận tải hàng hóa siêu trường, siêu trọng a) kinh doanh vận tải hàng hóa siêu trường, siêu trọng là việc sử dụng xe ô tô để vận chuyển hàng không thể chia nhỏ, tháo rời, khi vận chuyển trên đường bộ làm cho phương tiện hoặc tổ hợp phương tiện bị vượt quá giới hạn cho phép tham gia giao thông đường bộ về kích thước, khối lượng theo quy định của pháp luật; b) khi vận chuyển hàng hóa siêu trường, siêu trọng, phải thực hiện theo quy định tại điều 53 luật trật tự, an toàn giao thông đường bộ. 4. kinh doanh vận tải hàng hóa nguy hiểm a) kinh doanh vận tải hàng hóa nguy hiểm là việc sử dụng xe ô tô để vận chuyển hàng hóa có chứa các chất nguy hiểm có khả năng gây nguy hại tới tính mạng, sức khỏe con người, môi trường, an toàn và an ninh quốc gia; b) khi vận chuyển hàng hóa nguy hiểm phải thực hiện theo quy định tại điều 51 luật trật tự, an toàn giao thông đường bộ. 5. kinh doanh vận tải hàng hóa thông thường là hình thức kinh doanh vận tải hàng hóa, trừ các hình thức kinh doanh vận tải quy định tại các khoản 2, khoản 3 điều này. 6. xe ô tô đầu kéo kéo rơ moóc hoặc sơ mi rơ moóc kinh doanh vận tải hàng hóa, xe ô tô tải kinh doanh vận tải hàng hóa thông thường và xe taxi tải phải có phù hiệu “xe tải” theo mẫu số 09 phụ lục xiii kèm theo nghị định này và được dán cố định tại góc trên bên phải ngay sát phía dưới vị trí của tem kiểm định, mặt trong kính chắn gió phía trước của xe. 7. đơn vị kinh doanh vận tải hàng hóa phải chịu trách nhiệm thực hiện đúng quy định việc xếp hàng hóa lên xe ô tô. 8. đơn vị kinh doanh vận tải hàng hóa phải cấp cho lái xe giấy vận tải trong quá trình vận chuyển hàng hóa trên đường. giấy vận tải phải có xác nhận (ký, ghi rõ họ và tên) khối lượng hàng hóa đã xếp lên phương tiện của chủ hàng (hoặc người được chủ hàng ủy quyền) hoặc đại diện đơn vị, cá nhân thực hiện việc xếp hàng. 9. khi vận chuyển hàng hóa, lái xe phải mang theo giấy vận tải (giấy vận chuyển) bằng văn bản giấy hoặc phải có thiết bị để truy cập vào phần mềm thể hiện nội dung của giấy vận tải và các giấy tờ của lái xe và phương tiện theo quy định của pháp luật. đơn vị kinh doanh vận tải và lái xe không được chở hàng vượt quá khối lượng cho phép tham gia giao thông. 10. đối với hoạt động vận chuyển xe đạp, xe mô tô, xe gắn máy và các loại xe tương tự qua hầm đường bộ áp dụng theo quy định tại khoản 4 điều này. 11. giấy vận tải bằng văn bản giấy hoặc điện tử do đơn vị kinh doanh vận tải hàng hóa tự phát hành và có các thông tin tối thiểu gồm: tên đơn vị vận tải; biển kiểm soát xe; tên đơn vị hoặc người thuê vận tải; hành trình (điểm đầu, điểm cuối); số hợp đồng, ngày tháng năm ký hợp đồng (nếu có); loại hàng và khối lượng hàng vận chuyển trên xe. đơn vị kinh doanh vận tải hàng hóa phải thực hiện lưu trữ giấy vận tải của các chuyến xe đã thực hiện trong thời gian tối thiểu 03 năm. 12. việc bồi thường hàng hóa hư hỏng, mất mát, thiếu hụt được thực hiện theo hợp đồng vận chuyển hoặc theo thỏa thuận giữa người kinh doanh vận tải và người thuê vận tải.']","**Nguồn văn bản:** 158_2024_ND-CP_636875

**Tên văn bản:** Nghị định Quy định về hoạt động vận tải đường bộ

**Điều 8:** kinh doanh vận tải hàng hóa bằng xe ô tô

**Nội dung:**

1. Đơn vị kinh doanh vận tải có giấy phép kinh doanh vận tải bằng ô tô, trong đó có một hoặc các loại hình kinh doanh vận tải hàng hóa bằng xe ô tô quy định tại khoản 2, khoản 3 và khoản 4 điều này thì được tham gia kinh doanh vận tải hàng hóa bằng xe ô tô theo loại hình đã đăng ký.

2. Kinh doanh vận tải hàng hóa bằng xe taxi tải là việc sử dụng xe ô tô có trọng tải từ 1.500 ki-lô-gam trở xuống để vận chuyển hàng hóa và người thuê vận tải trả tiền cho lái xe theo đồng hồ tính tiền hoặc theo phần mềm tính tiền trên xe. Mặt ngoài hai bên thành xe hoặc cánh cửa xe niêm yết cụm từ “taxi tải” theo mẫu số 08 phụ lục XIII kèm theo Nghị định này, số điện thoại liên lạc, tên đơn vị kinh doanh vận tải.

3. Kinh doanh vận tải hàng hóa siêu trường, siêu trọng

	a) Kinh doanh vận tải hàng hóa siêu trường, siêu trọng là việc sử dụng xe ô tô để vận chuyển hàng không thể chia nhỏ, tháo rời, khi vận chuyển trên đường bộ làm cho phương tiện hoặc tổ hợp phương tiện bị vượt quá giới hạn cho phép tham gia giao thông đường bộ về kích thước, khối lượng theo quy định của pháp luật.

	b) Khi vận chuyển hàng hóa siêu trường, siêu trọng, phải thực hiện theo quy định tại Điều 53 Luật Trật tự, an toàn giao thông đường bộ.

4. Kinh doanh vận tải hàng hóa nguy hiểm

	a) Kinh doanh vận tải hàng hóa nguy hiểm là việc sử dụng xe ô tô để vận chuyển hàng hóa có chứa các chất nguy hiểm có khả năng gây nguy hại tới tính mạng, sức khỏe con người, môi trường, an toàn và an ninh quốc gia.

	b) Khi vận chuyển hàng hóa nguy hiểm phải thực hiện theo quy định tại Điều 51 Luật Trật tự, an toàn giao thông đường bộ.

5. Kinh doanh vận tải hàng hóa thông thường là hình thức kinh doanh vận tải hàng hóa, trừ các hình thức kinh doanh vận tải quy định tại các khoản 2, khoản 3 điều này.


6. Xe ô tô đầu kéo kéo rơ moóc hoặc sơ mi rơ moóc kinh doanh vận tải hàng hóa, xe ô tô tải kinh doanh vận tải hàng hóa thông thường và xe taxi tải phải có phù hiệu “xe tải” theo mẫu số 09 phụ lục XIII kèm theo Nghị định này và được dán cố định tại góc trên bên phải ngay sát phía dưới vị trí của tem kiểm định, mặt trong kính chắn gió phía trước của xe.

7. Đơn vị kinh doanh vận tải hàng hóa phải chịu trách nhiệm thực hiện đúng quy định việc xếp hàng hóa lên xe ô tô.

8. Đơn vị kinh doanh vận tải hàng hóa phải cấp cho lái xe giấy vận tải trong quá trình vận chuyển hàng hóa trên đường. Giấy vận tải phải có xác nhận (ký, ghi rõ họ và tên) khối lượng hàng hóa đã xếp lên phương tiện của chủ hàng (hoặc người được chủ hàng ủy quyền) hoặc đại diện đơn vị, cá nhân thực hiện việc xếp hàng.

9. Khi vận chuyển hàng hóa, lái xe phải mang theo giấy vận tải (giấy vận chuyển) bằng văn bản giấy hoặc phải có thiết bị để truy cập vào phần mềm thể hiện nội dung của giấy vận tải và các giấy tờ của lái xe và phương tiện theo quy định của pháp luật. Đơn vị kinh doanh vận tải và lái xe không được chở hàng vượt quá khối lượng cho phép tham gia giao thông.

10. Đối với hoạt động vận chuyển xe đạp, xe mô tô, xe gắn máy và các loại xe tương tự qua hầm đường bộ áp dụng theo quy định tại khoản 4 điều này.

11. Giấy vận tải bằng văn bản giấy hoặc điện tử do đơn vị kinh doanh vận tải hàng hóa tự phát hành và có các thông tin tối thiểu gồm: tên đơn vị vận tải; biển kiểm soát xe; tên đơn vị hoặc người thuê vận tải; hành trình (điểm đầu, điểm cuối); số hợp đồng, ngày tháng năm ký hợp đồng (nếu có); loại hàng và khối lượng hàng vận chuyển trên xe. Đơn vị kinh doanh vận tải hàng hóa phải thực hiện lưu trữ giấy vận tải của các chuyến xe đã thực hiện trong thời gian tối thiểu 03 năm.

12. Việc bồi thường hàng hóa hư hỏng, mất mát, thiếu hụt được thực hiện theo hợp đồng vận chuyển hoặc theo thỏa thuận giữa người kinh doanh vận tải và người thuê vận tải.


**Tóm lại:** Văn bản này không đề cập cụ thể về việc vận chuyển hàng hóa dễ hỏng mà quy định chung về kinh doanh vận tải hàng hóa bằng xe ô tô, bao gồm các loại hình kinh doanh, quy định về giấy tờ, trách nhiệm của đơn vị vận tải và lái xe.  Việc vận chuyển hàng dễ hỏng sẽ thuộc loại hình ""kinh doanh vận tải hàng hóa thông thường"" (khoản 5) và tuân thủ các quy định chung như các loại hàng hóa khác.
",Xe ô tô chở hàng dễ hỏng phải được trang bị thiết bị bảo quản phù hợp và tuân thủ các quy định về vệ sinh.,1.0,0.6226251270379733,0.0,0.0
53,"Quy định mới về việc sử dụng xe ô tô chở hàng quá khổ, quá tải là gì?","['thông tư này quy định về tải trọng, khổ giới hạn của đường bộ; lưu hành xe quá khổ giới hạn, xe quá tải trọng, xe bánh xích trên đường bộ; hàng siêu trường, siêu trọng, vận chuyển hàng siêu trường, siêu trọng; xếp hàng hóa trên phương tiện giao thông đường bộ; cấp giấy phép lưu hành cho xe quá tải trọng, xe quá khổ giới hạn, xe bánh xích, xe vận chuyển hàng siêu trường, siêu trọng trên đường bộ.']","**Nguồn văn bản:** 39_2024_TT-BGTVT_633952

**Tên văn bản:** Thông tư Quy định về tải trọng, khổ giới hạn của đường bộ; lưu hành xe quá khổ giới hạn, xe quá tải trọng, xe bánh xích trên đường bộ; hàng siêu trường, siêu trọng, vận chuyển hàng siêu trường, siêu trọng; xếp hàng hóa trên phương tiện giao thông đường bộ; cấp giấy phép lưu hành cho xe quá tải trọng, xe quá khổ giới hạn, xe bánh xích, xe vận chuyển hàng siêu trường, siêu trọng trên đường bộ

**điều 1:** phạm vi điều chỉnh

**Nội dung:**

Thông tư này quy định về tải trọng, khổ giới hạn của đường bộ; lưu hành xe quá khổ giới hạn, xe quá tải trọng, xe bánh xích trên đường bộ; hàng siêu trường, siêu trọng, vận chuyển hàng siêu trường, siêu trọng; xếp hàng hóa trên phương tiện giao thông đường bộ; cấp giấy phép lưu hành cho xe quá tải trọng, xe quá khổ giới hạn, xe bánh xích, xe vận chuyển hàng siêu trường, siêu trọng trên đường bộ.

**Tóm lại:** Thông tư này quy định về tải trọng, khổ giới hạn của đường bộ và việc lưu hành xe quá khổ, quá tải, bao gồm cả việc vận chuyển hàng siêu trường, siêu trọng và cấp phép lưu hành cho các loại xe này.
","Cấm xe ô tô chở hàng quá khổ, quá tải lưu thông trên đường bộ; trường hợp đặc biệt phải có giấy phép và tuân thủ các quy định an toàn.",0.8823529411764706,0.15115026348836422,0.0,0.0
54,Luật Giao thông Đường bộ 2025 có quy định gì về việc sử dụng xe ô tô chở hàng nguy hiểm?,"['1. đơn vị kinh doanh vận tải có giấy phép kinh doanh vận tải bằng ô tô, trong đó có một hoặc các loại hình kinh doanh vận tải hàng hóa bằng xe ô tô quy định tại khoản 2, khoản 3 và khoản 4 điều này thì được tham gia kinh doanh vận tải hàng hóa bằng xe ô tô theo loại hình đã đăng ký. 2. kinh doanh vận tải hàng hóa bằng xe taxi tải là việc sử dụng xe ô tô có trọng tải từ 1.500 ki-lô-gam trở xuống để vận chuyển hàng hóa và người thuê vận tải trả tiền cho lái xe theo đồng hồ tính tiền hoặc theo phần mềm tính tiền trên xe. mặt ngoài hai bên thành xe hoặc cánh cửa xe niêm yết cụm từ “taxi tải” theo mẫu số 08 phụ lục xiii kèm theo nghị định này, số điện thoại liên lạc, tên đơn vị kinh doanh vận tải. 3. kinh doanh vận tải hàng hóa siêu trường, siêu trọng a) kinh doanh vận tải hàng hóa siêu trường, siêu trọng là việc sử dụng xe ô tô để vận chuyển hàng không thể chia nhỏ, tháo rời, khi vận chuyển trên đường bộ làm cho phương tiện hoặc tổ hợp phương tiện bị vượt quá giới hạn cho phép tham gia giao thông đường bộ về kích thước, khối lượng theo quy định của pháp luật; b) khi vận chuyển hàng hóa siêu trường, siêu trọng, phải thực hiện theo quy định tại điều 53 luật trật tự, an toàn giao thông đường bộ. 4. kinh doanh vận tải hàng hóa nguy hiểm a) kinh doanh vận tải hàng hóa nguy hiểm là việc sử dụng xe ô tô để vận chuyển hàng hóa có chứa các chất nguy hiểm có khả năng gây nguy hại tới tính mạng, sức khỏe con người, môi trường, an toàn và an ninh quốc gia; b) khi vận chuyển hàng hóa nguy hiểm phải thực hiện theo quy định tại điều 51 luật trật tự, an toàn giao thông đường bộ. 5. kinh doanh vận tải hàng hóa thông thường là hình thức kinh doanh vận tải hàng hóa, trừ các hình thức kinh doanh vận tải quy định tại các khoản 2, khoản 3 điều này. 6. xe ô tô đầu kéo kéo rơ moóc hoặc sơ mi rơ moóc kinh doanh vận tải hàng hóa, xe ô tô tải kinh doanh vận tải hàng hóa thông thường và xe taxi tải phải có phù hiệu “xe tải” theo mẫu số 09 phụ lục xiii kèm theo nghị định này và được dán cố định tại góc trên bên phải ngay sát phía dưới vị trí của tem kiểm định, mặt trong kính chắn gió phía trước của xe. 7. đơn vị kinh doanh vận tải hàng hóa phải chịu trách nhiệm thực hiện đúng quy định việc xếp hàng hóa lên xe ô tô. 8. đơn vị kinh doanh vận tải hàng hóa phải cấp cho lái xe giấy vận tải trong quá trình vận chuyển hàng hóa trên đường. giấy vận tải phải có xác nhận (ký, ghi rõ họ và tên) khối lượng hàng hóa đã xếp lên phương tiện của chủ hàng (hoặc người được chủ hàng ủy quyền) hoặc đại diện đơn vị, cá nhân thực hiện việc xếp hàng. 9. khi vận chuyển hàng hóa, lái xe phải mang theo giấy vận tải (giấy vận chuyển) bằng văn bản giấy hoặc phải có thiết bị để truy cập vào phần mềm thể hiện nội dung của giấy vận tải và các giấy tờ của lái xe và phương tiện theo quy định của pháp luật. đơn vị kinh doanh vận tải và lái xe không được chở hàng vượt quá khối lượng cho phép tham gia giao thông. 10. đối với hoạt động vận chuyển xe đạp, xe mô tô, xe gắn máy và các loại xe tương tự qua hầm đường bộ áp dụng theo quy định tại khoản 4 điều này. 11. giấy vận tải bằng văn bản giấy hoặc điện tử do đơn vị kinh doanh vận tải hàng hóa tự phát hành và có các thông tin tối thiểu gồm: tên đơn vị vận tải; biển kiểm soát xe; tên đơn vị hoặc người thuê vận tải; hành trình (điểm đầu, điểm cuối); số hợp đồng, ngày tháng năm ký hợp đồng (nếu có); loại hàng và khối lượng hàng vận chuyển trên xe. đơn vị kinh doanh vận tải hàng hóa phải thực hiện lưu trữ giấy vận tải của các chuyến xe đã thực hiện trong thời gian tối thiểu 03 năm. 12. việc bồi thường hàng hóa hư hỏng, mất mát, thiếu hụt được thực hiện theo hợp đồng vận chuyển hoặc theo thỏa thuận giữa người kinh doanh vận tải và người thuê vận tải.']","**Nguồn văn bản:** 158_2024_ND-CP_636875

**Tên văn bản:** Nghị định Quy định về hoạt động vận tải đường bộ

**Điều 8:** kinh doanh vận tải hàng hóa bằng xe ô tô

**Nội dung:**

4. Kinh doanh vận tải hàng hóa nguy hiểm

	a) Kinh doanh vận tải hàng hóa nguy hiểm là việc sử dụng xe ô tô để vận chuyển hàng hóa có chứa các chất nguy hiểm có khả năng gây nguy hại tới tính mạng, sức khỏe con người, môi trường, an toàn và an ninh quốc gia.

	b) Khi vận chuyển hàng hóa nguy hiểm phải thực hiện theo quy định tại Điều 51 Luật Trật tự, an toàn giao thông đường bộ.


Tóm lại: Kinh doanh vận tải hàng hóa nguy hiểm bằng xe ô tô là vận chuyển hàng hóa nguy hại bằng xe ô tô và phải tuân thủ quy định tại Điều 51 Luật Trật tự, an toàn giao thông đường bộ.
",Xe ô tô chở hàng nguy hiểm phải có giấy phép đặc biệt và tuân thủ các quy định về an toàn và môi trường.,0.8,0.5061190421370103,0.0,0.0
55,Quy định mới về việc sử dụng xe ô tô chở vật liệu xây dựng là gì?,"['1. đơn vị vận tải phải lựa chọn phương tiện phù hợp với kích thước, khối lượng hàng hóa vận chuyển. hàng hóa được vận chuyển phải phù hợp với kết cấu của khoang chứa hàng và công năng của phương tiện vận chuyển. 2. việc xếp hàng hóa trên phương tiện giao thông đường bộ khi tham gia giao thông trên đường bộ phải tuân thủ các quy định về khối lượng toàn bộ của xe, tải trọng trục xe, cụm trục xe, chiều cao, chiều rộng, chiều dài xếp hàng hóa cho phép của xe quy định tại điều 14, điều 15, điều 16 và điều 17 của thông tư này và không vượt quá khối lượng hàng hóa chuyên chở cho phép tham gia giao thông ghi trong giấy chứng nhận kiểm định an toàn kỹ thuật và bảo vệ môi trường của xe trừ trường hợp được cấp giấy phép lưu hành xe quá tải trọng, xe quá khổ giới hạn, xe vận chuyển hàng siêu trường, siêu trọng trên đường bộ. 3. hàng hóa xếp trên phương tiện phải được xếp đặt gọn gàng, xếp dàn đều, chằng buộc chắc chắn, chèn, lót đảm bảo không bị xê dịch theo các phương ngang, phương dọc và phương thẳng đứng; đảm bảo các quy định về vệ sinh môi trường; không để rơi vãi khi phương tiện tham gia giao thông; không cản trở tầm nhìn của lái xe; không làm mất thăng bằng của phương tiện hoặc gây khó khăn cho lái xe khi điều khiển; không che khuất đèn, biển số đăng ký và các cảnh báo an toàn của phương tiện. một số trang thiết bị thường dùng để gia cố, chằng buộc, chèn, lót hàng hóa được hướng dẫn tại phụ lục x ban hành kèm theo thông tư này. 4. đối với các loại hàng hóa là máy móc, phương tiện giao thông, trước khi xếp lên phương tiện phải rút hết nhiên liệu ra khỏi bình chứa. phương pháp xếp hàng hóa là máy móc, phương tiện giao thông được hướng dẫn tại phụ lục xi ban hành kèm theo thông tư này. 5. việc xếp hàng hóa trên phương tiện đối với các loại hàng hóa đã được đóng gói thành bao, kiện, thùng, cuộn, khối thực hiện theo hướng dẫn của nhà sản xuất. 6. việc xếp các loại hàng hóa nguy hiểm trên phương tiện thực hiện theo quy định về vận chuyển hàng hóa nguy hiểm bằng phương tiện giao thông cơ giới đường bộ và quy định tại chương này.']","**Nguồn văn bản:** 39_2024_TT-BGTVT_633952

**Tên văn bản:** Thông tư Quy định về tải trọng, khổ giới hạn của đường bộ; lưu hành xe quá khổ giới hạn, xe quá tải trọng, xe bánh xích trên đường bộ; hàng siêu trường, siêu trọng, vận chuyển hàng siêu trường, siêu trọng; xếp hàng hóa trên phương tiện giao thông đường bộ; cấp giấy phép lưu hành cho xe quá tải trọng, xe quá khổ giới hạn, xe bánh xích, xe vận chuyển hàng siêu trường, siêu trọng trên đường bộ

**Điều 13:** quy định chung về xếp hàng hóa trên phương tiện giao thông đường bộ

**Nội dung:**

1. Đơn vị vận tải phải lựa chọn phương tiện phù hợp với kích thước, khối lượng hàng hóa vận chuyển. 

    Hàng hóa được vận chuyển phải phù hợp với kết cấu của khoang chứa hàng và công năng của phương tiện vận chuyển.

2. Việc xếp hàng hóa trên phương tiện giao thông đường bộ khi tham gia giao thông trên đường bộ phải tuân thủ các quy định về khối lượng toàn bộ của xe, tải trọng trục xe, cụm trục xe, chiều cao, chiều rộng, chiều dài xếp hàng hóa cho phép của xe quy định tại điều 14, điều 15, điều 16 và điều 17 của thông tư này và không vượt quá khối lượng hàng hóa chuyên chở cho phép tham gia giao thông ghi trong giấy chứng nhận kiểm định an toàn kỹ thuật và bảo vệ môi trường của xe trừ trường hợp được cấp giấy phép lưu hành xe quá tải trọng, xe quá khổ giới hạn, xe vận chuyển hàng siêu trường, siêu trọng trên đường bộ.

3. Hàng hóa xếp trên phương tiện phải được xếp đặt gọn gàng, xếp dàn đều, chằng buộc chắc chắn, chèn, lót đảm bảo không bị xê dịch theo các phương ngang, phương dọc và phương thẳng đứng; đảm bảo các quy định về vệ sinh môi trường; không để rơi vãi khi phương tiện tham gia giao thông; không cản trở tầm nhìn của lái xe; không làm mất thăng bằng của phương tiện hoặc gây khó khăn cho lái xe khi điều khiển; không che khuất đèn, biển số đăng ký và các cảnh báo an toàn của phương tiện. 

    Một số trang thiết bị thường dùng để gia cố, chằng buộc, chèn, lót hàng hóa được hướng dẫn tại phụ lục x ban hành kèm theo thông tư này.

4. Đối với các loại hàng hóa là máy móc, phương tiện giao thông, trước khi xếp lên phương tiện phải rút hết nhiên liệu ra khỏi bình chứa. 

    Phương pháp xếp hàng hóa là máy móc, phương tiện giao thông được hướng dẫn tại phụ lục xi ban hành kèm theo thông tư này.

5. Việc xếp hàng hóa trên phương tiện đối với các loại hàng hóa đã được đóng gói thành bao, kiện, thùng, cuộn, khối thực hiện theo hướng dẫn của nhà sản xuất.

6. Việc xếp các loại hàng hóa nguy hiểm trên phương tiện thực hiện theo quy định về vận chuyển hàng hóa nguy hiểm bằng phương tiện giao thông cơ giới đường bộ và quy định tại chương này.


**Tóm lại:**  Xe ô tô chở vật liệu xây dựng phải tuân thủ quy định về kích thước, khối lượng hàng hóa; xếp hàng gọn gàng, chắc chắn, không gây mất an toàn giao thông; tuân thủ quy định về tải trọng, khổ giới hạn; và có giấy phép nếu vượt quá tải trọng, khổ giới hạn cho phép. Đối với máy móc, cần rút hết nhiên liệu trước khi vận chuyển. Hàng hóa nguy hiểm tuân thủ quy định riêng.
",Xe ô tô chở vật liệu xây dựng phải được che phủ kín để tránh rơi vãi và gây ô nhiễm môi trường.,1.0,0.4921613405456869,0.0,0.0
56,Luật Giao thông Đường bộ 2025 có quy định gì về việc sử dụng xe ô tô chở rác thải?,"['thông tư quy định về phân loại phương tiện giao thông đường bộ và dấu hiệu nhận biết xe cơ giới sử dụng năng lượng sạch, năng lượng xanh, thân thiện môi trường.']","**Nguồn văn bản:** 53_2024_TT-BGTVT_624420

**Tên văn bản:** Thông tư Quy định về phân loại phương tiện giao thông đường bộ và dấu hiệu nhận biết xe cơ giới sử dụng năng lượng sạch, năng lượng xanh, thân thiện môi trường

**điều 1:** phạm vi điều chỉnh

**Nội dung:**

Thông tư quy định về phân loại phương tiện giao thông đường bộ và dấu hiệu nhận biết xe cơ giới sử dụng năng lượng sạch, năng lượng xanh, thân thiện môi trường.

Tóm lại: Văn bản này không chứa thông tin về luật giao thông đường bộ liên quan đến việc sử dụng xe ô tô chở rác thải.
","Xe ô tô chở rác thải phải được che phủ kín, không để rò rỉ nước thải và tuân thủ các quy định về vệ sinh môi trường.",0.4,0.5951793501343648,0.0,0.0
57,Quy định mới về việc sử dụng xe ô tô chở động vật sống là gì?,"['1. việc vận chuyển động vật sống phải bảo đảm các yêu cầu sau đây: a) người lái xe phải mang đủ giấy tờ theo quy định của pháp luật; b) phương tiện vận chuyển phải có kết cấu phù hợp với loại động vật chuyên chở; c) trong quá trình vận chuyển phải chấp hành các quy định của pháp luật về trật tự, an toàn giao thông đường bộ, vệ sinh dịch tễ, phòng dịch và bảo đảm vệ sinh môi trường. 2. việc vận chuyển thực phẩm tươi sống phải bảo đảm các yêu cầu sau đây: a) người lái xe phải mang đủ giấy tờ theo quy định của pháp luật; b) trong quá trình vận chuyển phải chấp hành các quy định của pháp luật về trật tự, an toàn giao thông đường bộ, an toàn thực phẩm, vệ sinh dịch tễ, phòng dịch và bảo đảm vệ sinh môi trường.']","**Nguồn văn bản:** 36_2024_QH15_444251

**Tên văn bản:** Luật Trật tự, an toàn giao thông đường bộ

**Điều 50:** Bảo đảm trật tự, an toàn giao thông đường bộ đối với phương tiện giao thông đường bộ vận chuyển động vật sống, thực phẩm tươi sống

**Nội dung:**

1. Việc vận chuyển động vật sống phải bảo đảm các yêu cầu sau đây:

	a) Người lái xe phải mang đủ giấy tờ theo quy định của pháp luật.

	b) Phương tiện vận chuyển phải có kết cấu phù hợp với loại động vật chuyên chở.

	c) Trong quá trình vận chuyển phải chấp hành các quy định của pháp luật về trật tự, an toàn giao thông đường bộ, vệ sinh dịch tễ, phòng dịch và bảo đảm vệ sinh môi trường.

2. Việc vận chuyển thực phẩm tươi sống phải bảo đảm các yêu cầu sau đây:

	a) Người lái xe phải mang đủ giấy tờ theo quy định của pháp luật.

	b) Trong quá trình vận chuyển phải chấp hành các quy định của pháp luật về trật tự, an toàn giao thông đường bộ, an toàn thực phẩm, vệ sinh dịch tễ, phòng dịch và bảo đảm vệ sinh môi trường.


Tóm lại: Xe ô tô chở động vật sống phải có giấy tờ hợp lệ, kết cấu phù hợp với động vật vận chuyển và tuân thủ quy định về trật tự an toàn giao thông, vệ sinh dịch tễ, phòng dịch và bảo vệ môi trường.
","Xe ô tô chở động vật sống phải đảm bảo vệ sinh, an toàn cho động vật và không gây ô nhiễm môi trường.",1.0,0.4993268479305377,0.0,0.9999999999
58,Luật Giao thông Đường bộ 2025 có quy định gì về việc sử dụng xe ô tô chở cây cảnh?,"['thực hiện trách nhiệm của chủ phương tiện giao thông đường bộ theo quy định của pháp luật về thanh toán điện tử giao thông đường bộ, pháp luật về thu phí sử dụng đường cao tốc.']","Không tìm thấy thông tin liên quan tới câu hỏi này.
","Xe ô tô chở cây cảnh phải được sắp xếp gọn gàng, đảm bảo an toàn và không cản trở tầm nhìn của người lái.",0.0,0.0,0.0,0.0
59,Quy định mới về việc sử dụng xe ô tô chở hàng dễ cháy nổ là gì?,"['1. phạt tiền từ 500.000 đồng đến 1.000.000 đồng đối với cá nhân, từ 1.000.000 đồng đến 2.000.000 đồng đối với tổ chức thực hiện một trong các hành vi vi phạm sau đây: a) xếp hàng hóa lên mỗi xe ô tô (kể cả rơ moóc và sơ mi rơ moóc) vượt quá trọng tải (khối lượng hàng chuyên chở) cho phép tham gia giao thông được ghi trong giấy chứng nhận kiểm định an toàn kỹ thuật và bảo vệ môi trường của xe trên 10% đến 50% (trừ xe xi téc chở chất lỏng), trên 20% đến 50% đối với xe xi téc chở chất lỏng; b) xếp hàng hóa lên xe ô tô mà không ký xác nhận việc xếp hàng hóa vào giấy vận tải theo quy định. 2. phạt tiền từ 1.000.000 đồng đến 2.000.000 đồng đối với cá nhân, từ 2.000.000 đồng đến 4.000.000 đồng đối với tổ chức kinh doanh vận tải, dịch vụ hỗ trợ vận tải thực hiện một trong các hành vi vi phạm sau đây: a) không đánh số thứ tự ghế ngồi, giường nằm trên xe ô tô chở hành khách theo quy định; b) sử dụng xe ô tô kinh doanh vận tải hành khách theo tuyến cố định, xe ô tô kinh doanh vận tải hành khách bằng xe buýt không có chỗ ưu tiên cho người khuyết tật, người cao tuổi và phụ nữ mang thai theo quy định; c) sử dụng xe ô tô kinh doanh vận tải hành khách không có hướng dẫn cho hành khách về an toàn giao thông, thoát hiểm khi xảy ra sự cố trên xe theo quy định; d) không bố trí người áp tải trên xe vận chuyển hàng hóa nguy hiểm đối với những trường hợp quy định phải có người áp tải; đ) không cấp lệnh vận chuyển, giấy vận tải cho lái xe hoặc cấp lệnh vận chuyển, giấy vận tải nhưng không đúng theo quy định (đối với loại xe quy định phải cấp lệnh vận chuyển, giấy vận tải); e) sử dụng xe vận chuyển hàng hóa nguy hiểm mà không làm sạch hoặc không bóc (xóa) biểu trưng nguy hiểm trên phương tiện khi không tiếp tục vận chuyển loại hàng hóa đó. 3. phạt tiền từ 2.000.000 đồng đến 3.000.000 đồng đối với cá nhân, từ 4.000.000 đồng đến 6.000.000 đồng đối với tổ chức thực hiện hành vi vi phạm xếp hàng hóa lên mỗi xe ô tô (kể cả rơ moóc và sơ mi rơ moóc) vượt quá trọng tải (khối lượng hàng chuyên chở) cho phép tham gia giao thông được ghi trong giấy chứng nhận kiểm định an toàn kỹ thuật và bảo vệ môi trường của xe trên 50% đến 100%. 4. phạt tiền từ 3.000.000 đồng đến 4.000.000 đồng đối với cá nhân, từ 6.000.000 đồng đến 8.000.000 đồng đối với tổ chức kinh doanh vận tải, dịch vụ hỗ trợ vận tải thực hiện một trong các hành vi vi phạm sau đây: a) không cấp thẻ nhận dạng lái xe cho lái xe theo quy định; b) sử dụng lái xe, nhân viên phục vụ trên xe để tham gia kinh doanh vận tải bằng xe ô tô mà không được tập huấn, hướng dẫn về nghiệp vụ vận tải hành khách và an toàn giao thông theo quy định (đối với hình thức kinh doanh vận tải có quy định lái xe, nhân viên phục vụ trên xe phải được tập huấn, hướng dẫn nghiệp vụ), trừ các hành vi vi phạm quy định tại điểm c, điểm d khoản này; c) sử dụng lái xe, người quản lý trên xe để tham gia kinh doanh vận tải bằng xe ô tô mà không được hướng dẫn về quy trình bảo đảm an toàn khi đưa đón trẻ em mầm non, học sinh; d) sử dụng lái xe, người áp tải vận chuyển hàng hóa nguy hiểm mà không được tập huấn về vận chuyển hàng hóa nguy hiểm; đ) sử dụng xe ô tô kinh doanh vận tải hành khách không có dây đai an toàn tại các vị trí ghế ngồi, giường nằm theo quy định (trừ xe buýt nội tỉnh); e) sử dụng xe ô tô kinh doanh vận tải chở trẻ em mầm non, học sinh tiểu học, xe ô tô kinh doanh vận tải kết hợp với hoạt động đưa đón trẻ em mầm non, học sinh tiểu học không có dây đai an toàn phù hợp với lứa tuổi hoặc không có ghế ngồi phù hợp với lứa tuổi theo quy định; g) không thực hiện việc niêm yết thông tin trên xe theo quy định hoặc có niêm yết nhưng không chính xác, không đầy đủ thông tin theo quy định. 5. phạt tiền từ 4.000.000 đồng đến 5.000.000 đồng đối với cá nhân, từ 8.000.000 đồng đến 10.000.000 đồng đối với tổ chức xếp hàng hóa lên mỗi xe ô tô (kể cả rơ moóc và sơ mi rơ moóc) vượt quá trọng tải (khối lượng hàng chuyên chở) cho phép tham gia giao thông được ghi trong giấy chứng nhận kiểm định an toàn kỹ thuật và bảo vệ môi trường của xe trên 100%. 6. phạt tiền từ 4.000.000 đồng đến 6.000.000 đồng đối với cá nhân, từ 8.000.000 đồng đến 12.000.000 đồng đối với tổ chức kinh doanh vận tải thực hiện một trong các hành vi vi phạm sau đây: a) sử dụng xe vận chuyển động vật sống không có kết cấu phù hợp với loại động vật chuyên chở theo quy định; b) sử dụng xe ô tô kinh doanh vận tải chở trẻ em mầm non, học sinh, xe ô tô kinh doanh vận tải kết hợp với hoạt động đưa đón trẻ em mầm non, học sinh không có thiết bị ghi nhận hình ảnh trẻ em mầm non, học sinh hoặc không có thiết bị có chức năng cảnh báo, chống bỏ quên trẻ em trên xe hoặc không có thiết bị ghi nhận hình ảnh trẻ em mầm non, học sinh và thiết bị có chức năng cảnh báo, chống bỏ quên trẻ em trên xe; c) sử dụng xe ô tô kinh doanh vận tải chở trẻ em mầm non, học sinh không có màu sơn theo quy định; d) sử dụng xe ô tô kinh doanh vận tải chở trẻ em mầm non, học sinh, xe ô tô kinh doanh vận tải kết hợp với hoạt động đưa đón trẻ em mầm non, học sinh không có biển báo dấu hiệu nhận biết là xe chở trẻ em mầm non, học sinh theo quy định. 7. phạt tiền từ 5.000.000 đồng đến 6.000.000 đồng đối với cá nhân, từ 10.000.000 đồng đến 12.000.000 đồng đối với tổ chức kinh doanh vận tải, dịch vụ hỗ trợ vận tải thực hiện một trong các hành vi vi phạm sau đây: a) không thực hiện việc cung cấp, cập nhật, truyền, lưu trữ, quản lý thông tin, dữ liệu từ thiết bị giám sát hành trình theo quy định; b) không thực hiện đúng nội dung thông tin đã niêm yết trên xe theo quy định; c) sử dụng phương tiện kinh doanh vận tải không lắp thiết bị giám sát hành trình của xe (đối với hình thức kinh doanh vận tải có quy định phương tiện phải lắp thiết bị) hoặc lắp thiết bị nhưng thiết bị không hoạt động, không đúng quy chuẩn theo quy định hoặc làm sai lệch dữ liệu của thiết bị giám sát hành trình của xe ô tô; d) sử dụng xe trung chuyển chở hành khách không đúng quy định; đ) sử dụng lái xe điều khiển xe khách giường nằm hai tầng, xe ô tô đưa đón trẻ em mầm non, học sinh chưa đủ số năm kinh nghiệm theo quy định; e) sử dụng xe kinh doanh vận tải hành khách theo hợp đồng mà trên xe không có hợp đồng vận tải, danh sách hành khách kèm theo, thiết bị để truy cập nội dung hợp đồng điện tử và danh sách hành khách theo quy định hoặc có hợp đồng vận tải, danh sách hành khách, thiết bị để truy cập nhưng không bảo đảm yêu cầu theo quy định, chở người không có tên trong danh sách hành khách hoặc vận chuyển không đúng đối tượng theo quy định (đối với xe kinh doanh vận tải hành khách theo hợp đồng vận chuyển trẻ em mầm non, học sinh, sinh viên, cán bộ, công chức, viên chức, công nhân); g) sử dụng xe ô tô kinh doanh vận tải không lắp thiết bị ghi nhận hình ảnh người lái xe theo quy định (đối với loại xe có quy định phải lắp thiết bị ghi nhận hình ảnh người lái xe) hoặc có lắp thiết bị ghi nhận hình ảnh người lái xe nhưng không ghi, không lưu trữ được dữ liệu trên xe trong quá trình xe tham gia giao thông theo quy định hoặc làm sai lệch dữ liệu của thiết bị ghi nhận hình ảnh người lái xe lắp trên xe ô tô; h) không thực hiện việc cung cấp, cập nhật, truyền dẫn, lưu trữ, quản lý thông tin, dữ liệu thu thập từ thiết bị ghi nhận hình ảnh người lái xe lắp trên xe ô tô theo quy định; i) sử dụng phương tiện kinh doanh vận tải có niên hạn sử dụng không bảo đảm điều kiện của hình thức kinh doanh đã đăng ký. 8. phạt tiền từ 10.000.000 đồng đến 12.000.000 đồng đối với cá nhân, từ 20.000.000 đồng đến 24.000.000 đồng đối với tổ chức kinh doanh vận tải, dịch vụ hỗ trợ vận tải thực hiện một trong các hành vi vi phạm sau đây: a) không tổ chức khám sức khỏe định kỳ cho lái xe theo quy định hoặc có tổ chức khám nhưng không đầy đủ các nội dung theo quy định; b) vi phạm quy định về kinh doanh, điều kiện kinh doanh vận tải bằng xe ô tô để xảy ra tai nạn giao thông gây hậu quả từ mức nghiêm trọng trở lên; c) sử dụng xe ô tô kinh doanh vận tải để đón, trả khách; nhận, trả hàng trên đường cao tốc. 9. phạt tiền từ 20.000.000 đồng đến 40.000.000 đồng đối với đơn vị sản xuất, lắp ráp, nhập khẩu thiết bị giám sát hành trình của xe ô tô, đơn vị cung cấp dịch vụ liên quan đến giám sát hành trình, ghi nhận hình ảnh người lái xe thực hiện một trong các hành vi sau: a) đơn vị sản xuất, lắp ráp, nhập khẩu thiết bị giám sát hành trình của xe ô tô không có nhân sự cho từng vị trí công việc theo quy định; b) đơn vị sản xuất, lắp ráp, nhập khẩu thiết bị giám sát hành trình của xe ô tô không báo cáo về việc cập nhật, thay đổi phần mềm của thiết bị theo quy định. 10. phạt tiền từ 40.000.000 đồng đến 60.000.000 đồng đối với đơn vị sản xuất, lắp ráp, nhập khẩu thiết bị ghi nhận hình ảnh người lái xe lắp trên xe ô tô, đơn vị cung cấp dịch vụ liên quan đến giám sát hành trình, ghi nhận hình ảnh người lái xe thực hiện một trong các hành vi vi phạm sau đây: a) làm sai lệch thông tin, dữ liệu của thiết bị giám sát hành trình của xe ô tô; b) làm sai lệch thông tin, dữ liệu của thiết bị ghi nhận hình ảnh người lái xe lắp trên xe ô tô. 11. phạt tiền từ 40.000.000 đồng đến 50.000.000 đồng đối với cá nhân, từ 80.000.000 đồng đến 100.000.000 đồng đối với tổ chức kinh doanh vận tải, dịch vụ hỗ trợ vận tải tái phạm hành vi quy định tại điểm a, điểm h khoản 7 điều này. 12. ngoài việc bị phạt tiền, cá nhân, tổ chức thực hiện hành vi vi phạm quy định tại điểm c khoản 2; điểm a, điểm b, điểm đ, điểm g khoản 4; điểm b, điểm c, điểm d, điểm đ, điểm e, điểm g khoản 7; điểm c khoản 8 điều này còn bị áp dụng các hình thức xử phạt bổ sung tước quyền sử dụng phù hiệu từ 01 tháng đến 03 tháng (nếu có hoặc đã được cấp) đối với xe vi phạm. 13. ngoài việc bị áp dụng hình thức xử phạt, cá nhân, tổ chức thực hiện hành vi vi phạm còn bị áp dụng các biện pháp khắc phục hậu quả sau đây: a) thực hiện hành vi quy định tại điểm a khoản 4 điều này buộc cấp thẻ nhận dạng lái xe cho lái xe theo quy định; b) thực hiện hành vi quy định tại điểm b, điểm c, điểm d khoản 4; điểm a khoản 8 điều này buộc tổ chức tập huấn, hướng dẫn nghiệp vụ, quy trình hoặc tổ chức khám sức khỏe định kỳ cho lái xe và nhân viên phục vụ trên xe theo quy định; c) thực hiện hành vi quy định tại điểm đ, điểm e khoản 4; điểm c, điểm g khoản 7 điều này buộc lắp đặt thiết bị giám sát hành trình, thiết bị ghi nhận hình ảnh người lái xe, dây đai an toàn, ghế ngồi cho trẻ em mầm non, học sinh tiểu học trên xe theo đúng quy định; d) thực hiện hành vi quy định tại điểm a, điểm h khoản 7; khoản 11 điều này buộc cung cấp, cập nhật, truyền dẫn, lưu trữ, quản lý thông tin, dữ liệu thu thập từ thiết bị giám sát hành trình, thiết bị ghi nhận hình ảnh người lái xe lắp trên xe ô tô theo quy định; đ) thực hiện hành vi quy định tại điểm c, điểm d khoản 6 điều này buộc thực hiện đúng quy định về màu sơn, biển báo dấu hiệu nhận biết của xe. 14. ngoài việc bị áp dụng hình thức xử phạt, người điều khiển phương tiện thực hiện hành vi vi phạm còn bị trừ điểm giấy phép lái xe như sau: a) thực hiện hành vi quy định tại điểm đ khoản 2; điểm b, điểm c, điểm d khoản 6; điểm b, điểm c, điểm e, điểm i khoản 7 điều này trong trường hợp cá nhân kinh doanh vận tải là người trực tiếp điều khiển phương tiện còn bị trừ điểm giấy phép lái xe 02 điểm; b) thực hiện hành vi quy định tại điểm c khoản 8 điều này trong trường hợp cá nhân kinh doanh vận tải là người trực tiếp điều khiển phương tiện còn bị trừ điểm giấy phép lái xe 06 điểm.']","**Nguồn văn bản:** 168_2024_ND-CP_619502

**Tên văn bản:** Nghị định Quy định xử phạt vi phạm hành chính về trật tự, an toàn giao thông trong lĩnh vực giao thông đường bộ; trừ điểm, phục hồi điểm giấy phép lái xe

**Điều 26:** xử phạt các hành vi vi phạm quy định về trật tự, an toàn giao thông đường bộ trong vận tải đường bộ, dịch vụ hỗ trợ vận tải đường bộ

**Nội dung:**  
1. Phạt tiền từ 500.000 đồng đến 1.000.000 đồng đối với cá nhân, từ 1.000.000 đồng đến 2.000.000 đồng đối với tổ chức thực hiện một trong các hành vi vi phạm sau đây:

	a) Xếp hàng hóa lên mỗi xe ô tô (kể cả rơ moóc và sơ mi rơ moóc) vượt quá trọng tải (khối lượng hàng chuyên chở) cho phép tham gia giao thông được ghi trong giấy chứng nhận kiểm định an toàn kỹ thuật và bảo vệ môi trường của xe trên 10% đến 50% (trừ xe xi téc chở chất lỏng), trên 20% đến 50% đối với xe xi téc chở chất lỏng.

	b) Xếp hàng hóa lên xe ô tô mà không ký xác nhận việc xếp hàng hóa vào giấy vận tải theo quy định.

2. Phạt tiền từ 1.000.000 đồng đến 2.000.000 đồng đối với cá nhân, từ 2.000.000 đồng đến 4.000.000 đồng đối với tổ chức kinh doanh vận tải, dịch vụ hỗ trợ vận tải thực hiện một trong các hành vi vi phạm sau đây:
	
	a) Không đánh số thứ tự ghế ngồi, giường nằm trên xe ô tô chở hành khách theo quy định.

	b) Sử dụng xe ô tô kinh doanh vận tải hành khách theo tuyến cố định, xe ô tô kinh doanh vận tải hành khách bằng xe buýt không có chỗ ưu tiên cho người khuyết tật, người cao tuổi và phụ nữ mang thai theo quy định.

	c) Sử dụng xe ô tô kinh doanh vận tải hành khách không có hướng dẫn cho hành khách về an toàn giao thông, thoát hiểm khi xảy ra sự cố trên xe theo quy định.

	d) Không bố trí người áp tải trên xe vận chuyển hàng hóa nguy hiểm đối với những trường hợp quy định phải có người áp tải.

	đ) Không cấp lệnh vận chuyển, giấy vận tải cho lái xe hoặc cấp lệnh vận chuyển, giấy vận tải nhưng không đúng theo quy định (đối với loại xe quy định phải cấp lệnh vận chuyển, giấy vận tải).

	e) Sử dụng xe vận chuyển hàng hóa nguy hiểm mà không làm sạch hoặc không bóc (xóa) biểu trưng nguy hiểm trên phương tiện khi không tiếp tục vận chuyển loại hàng hóa đó.


... (Các khoản 3, 4, 5, 6, 7, 8, 9, 10, 11, 12, 13, 14)

**Tóm lại:** Văn bản này không đề cập cụ thể đến quy định về việc sử dụng xe ô tô chở hàng dễ cháy nổ.  Văn bản chỉ đề cập chung chung tới việc vận chuyển hàng hóa nguy hiểm tại Khoản 2, Điểm d và e.
","Xe ô tô chở hàng dễ cháy nổ phải có giấy phép đặc biệt, được kiểm định an toàn và tuân thủ các quy định về phòng cháy chữa cháy.",0.8333333333333334,0.6514666931348715,1.0,0.0
60,Luật Giao thông Đường bộ 2025 có quy định gì về việc sử dụng xe ô tô chở hàng dễ hỏng?,"['1. đơn vị kinh doanh vận tải có giấy phép kinh doanh vận tải bằng ô tô, trong đó có một hoặc các loại hình kinh doanh vận tải hàng hóa bằng xe ô tô quy định tại khoản 2, khoản 3 và khoản 4 điều này thì được tham gia kinh doanh vận tải hàng hóa bằng xe ô tô theo loại hình đã đăng ký. 2. kinh doanh vận tải hàng hóa bằng xe taxi tải là việc sử dụng xe ô tô có trọng tải từ 1.500 ki-lô-gam trở xuống để vận chuyển hàng hóa và người thuê vận tải trả tiền cho lái xe theo đồng hồ tính tiền hoặc theo phần mềm tính tiền trên xe. mặt ngoài hai bên thành xe hoặc cánh cửa xe niêm yết cụm từ “taxi tải” theo mẫu số 08 phụ lục xiii kèm theo nghị định này, số điện thoại liên lạc, tên đơn vị kinh doanh vận tải. 3. kinh doanh vận tải hàng hóa siêu trường, siêu trọng a) kinh doanh vận tải hàng hóa siêu trường, siêu trọng là việc sử dụng xe ô tô để vận chuyển hàng không thể chia nhỏ, tháo rời, khi vận chuyển trên đường bộ làm cho phương tiện hoặc tổ hợp phương tiện bị vượt quá giới hạn cho phép tham gia giao thông đường bộ về kích thước, khối lượng theo quy định của pháp luật; b) khi vận chuyển hàng hóa siêu trường, siêu trọng, phải thực hiện theo quy định tại điều 53 luật trật tự, an toàn giao thông đường bộ. 4. kinh doanh vận tải hàng hóa nguy hiểm a) kinh doanh vận tải hàng hóa nguy hiểm là việc sử dụng xe ô tô để vận chuyển hàng hóa có chứa các chất nguy hiểm có khả năng gây nguy hại tới tính mạng, sức khỏe con người, môi trường, an toàn và an ninh quốc gia; b) khi vận chuyển hàng hóa nguy hiểm phải thực hiện theo quy định tại điều 51 luật trật tự, an toàn giao thông đường bộ. 5. kinh doanh vận tải hàng hóa thông thường là hình thức kinh doanh vận tải hàng hóa, trừ các hình thức kinh doanh vận tải quy định tại các khoản 2, khoản 3 điều này. 6. xe ô tô đầu kéo kéo rơ moóc hoặc sơ mi rơ moóc kinh doanh vận tải hàng hóa, xe ô tô tải kinh doanh vận tải hàng hóa thông thường và xe taxi tải phải có phù hiệu “xe tải” theo mẫu số 09 phụ lục xiii kèm theo nghị định này và được dán cố định tại góc trên bên phải ngay sát phía dưới vị trí của tem kiểm định, mặt trong kính chắn gió phía trước của xe. 7. đơn vị kinh doanh vận tải hàng hóa phải chịu trách nhiệm thực hiện đúng quy định việc xếp hàng hóa lên xe ô tô. 8. đơn vị kinh doanh vận tải hàng hóa phải cấp cho lái xe giấy vận tải trong quá trình vận chuyển hàng hóa trên đường. giấy vận tải phải có xác nhận (ký, ghi rõ họ và tên) khối lượng hàng hóa đã xếp lên phương tiện của chủ hàng (hoặc người được chủ hàng ủy quyền) hoặc đại diện đơn vị, cá nhân thực hiện việc xếp hàng. 9. khi vận chuyển hàng hóa, lái xe phải mang theo giấy vận tải (giấy vận chuyển) bằng văn bản giấy hoặc phải có thiết bị để truy cập vào phần mềm thể hiện nội dung của giấy vận tải và các giấy tờ của lái xe và phương tiện theo quy định của pháp luật. đơn vị kinh doanh vận tải và lái xe không được chở hàng vượt quá khối lượng cho phép tham gia giao thông. 10. đối với hoạt động vận chuyển xe đạp, xe mô tô, xe gắn máy và các loại xe tương tự qua hầm đường bộ áp dụng theo quy định tại khoản 4 điều này. 11. giấy vận tải bằng văn bản giấy hoặc điện tử do đơn vị kinh doanh vận tải hàng hóa tự phát hành và có các thông tin tối thiểu gồm: tên đơn vị vận tải; biển kiểm soát xe; tên đơn vị hoặc người thuê vận tải; hành trình (điểm đầu, điểm cuối); số hợp đồng, ngày tháng năm ký hợp đồng (nếu có); loại hàng và khối lượng hàng vận chuyển trên xe. đơn vị kinh doanh vận tải hàng hóa phải thực hiện lưu trữ giấy vận tải của các chuyến xe đã thực hiện trong thời gian tối thiểu 03 năm. 12. việc bồi thường hàng hóa hư hỏng, mất mát, thiếu hụt được thực hiện theo hợp đồng vận chuyển hoặc theo thỏa thuận giữa người kinh doanh vận tải và người thuê vận tải.']","**Nguồn văn bản:** 158_2024_ND-CP_636875

**Tên văn bản:** Nghị định Quy định về hoạt động vận tải đường bộ

**Điều 8:** kinh doanh vận tải hàng hóa bằng xe ô tô

**Nội dung:**

1. Đơn vị kinh doanh vận tải có giấy phép kinh doanh vận tải bằng ô tô, trong đó có một hoặc các loại hình kinh doanh vận tải hàng hóa bằng xe ô tô quy định tại khoản 2, khoản 3 và khoản 4 điều này thì được tham gia kinh doanh vận tải hàng hóa bằng xe ô tô theo loại hình đã đăng ký.

2. Kinh doanh vận tải hàng hóa bằng xe taxi tải là việc sử dụng xe ô tô có trọng tải từ 1.500 ki-lô-gam trở xuống để vận chuyển hàng hóa và người thuê vận tải trả tiền cho lái xe theo đồng hồ tính tiền hoặc theo phần mềm tính tiền trên xe.
Mặt ngoài hai bên thành xe hoặc cánh cửa xe niêm yết cụm từ “taxi tải” theo mẫu số 08 phụ lục XIII kèm theo Nghị định này, số điện thoại liên lạc, tên đơn vị kinh doanh vận tải.

3. Kinh doanh vận tải hàng hóa siêu trường, siêu trọng
 a) Kinh doanh vận tải hàng hóa siêu trường, siêu trọng là việc sử dụng xe ô tô để vận chuyển hàng không thể chia nhỏ, tháo rời, khi vận chuyển trên đường bộ làm cho phương tiện hoặc tổ hợp phương tiện bị vượt quá giới hạn cho phép tham gia giao thông đường bộ về kích thước, khối lượng theo quy định của pháp luật.
 b) Khi vận chuyển hàng hóa siêu trường, siêu trọng, phải thực hiện theo quy định tại Điều 53 Luật Trật tự, an toàn giao thông đường bộ.

4. Kinh doanh vận tải hàng hóa nguy hiểm
 a) Kinh doanh vận tải hàng hóa nguy hiểm là việc sử dụng xe ô tô để vận chuyển hàng hóa có chứa các chất nguy hiểm có khả năng gây nguy hại tới tính mạng, sức khỏe con người, môi trường, an toàn và an ninh quốc gia.
 b) Khi vận chuyển hàng hóa nguy hiểm phải thực hiện theo quy định tại Điều 51 Luật Trật tự, an toàn giao thông đường bộ.

5. Kinh doanh vận tải hàng hóa thông thường là hình thức kinh doanh vận tải hàng hóa, trừ các hình thức kinh doanh vận tải quy định tại các khoản 2, khoản 3 điều này.

6. Xe ô tô đầu kéo kéo rơ moóc hoặc sơ mi rơ moóc kinh doanh vận tải hàng hóa, xe ô tô tải kinh doanh vận tải hàng hóa thông thường và xe taxi tải phải có phù hiệu “xe tải” theo mẫu số 09 phụ lục XIII kèm theo Nghị định này và được dán cố định tại góc trên bên phải ngay sát phía dưới vị trí của tem kiểm định, mặt trong kính chắn gió phía trước của xe.

7. Đơn vị kinh doanh vận tải hàng hóa phải chịu trách nhiệm thực hiện đúng quy định việc xếp hàng hóa lên xe ô tô.

8. Đơn vị kinh doanh vận tải hàng hóa phải cấp cho lái xe giấy vận tải trong quá trình vận chuyển hàng hóa trên đường. Giấy vận tải phải có xác nhận (ký, ghi rõ họ và tên) khối lượng hàng hóa đã xếp lên phương tiện của chủ hàng (hoặc người được chủ hàng ủy quyền) hoặc đại diện đơn vị, cá nhân thực hiện việc xếp hàng.

9. Khi vận chuyển hàng hóa, lái xe phải mang theo giấy vận tải (giấy vận chuyển) bằng văn bản giấy hoặc phải có thiết bị để truy cập vào phần mềm thể hiện nội dung của giấy vận tải và các giấy tờ của lái xe và phương tiện theo quy định của pháp luật. Đơn vị kinh doanh vận tải và lái xe không được chở hàng vượt quá khối lượng cho phép tham gia giao thông.


**Tóm lại:** Văn bản này không đề cập cụ thể về việc vận chuyển hàng hóa dễ hỏng nhưng quy định chung về kinh doanh vận tải hàng hóa bằng xe ô tô, bao gồm các loại hình kinh doanh, quy định về giấy phép, phù hiệu, giấy vận tải và trách nhiệm của đơn vị kinh doanh vận tải. Việc vận chuyển hàng hóa dễ hỏng có thể thuộc loại hình kinh doanh vận tải hàng hóa thông thường, và cần tuân thủ các quy định chung nêu trong nghị định này.  Để biết thêm chi tiết về vận chuyển hàng dễ hỏng, cần tham khảo các quy định khác của Luật Giao thông Đường bộ.
",Xe ô tô chở hàng dễ hỏng phải được trang bị thiết bị bảo quản phù hợp và tuân thủ các quy định về vệ sinh.,0.85,0.6233766731246785,0.0,0.0
61,"Quy định mới về việc sử dụng xe ô tô chở hàng quá khổ, quá tải là gì?","['thông tư này quy định về tải trọng, khổ giới hạn của đường bộ; lưu hành xe quá khổ giới hạn, xe quá tải trọng, xe bánh xích trên đường bộ; hàng siêu trường, siêu trọng, vận chuyển hàng siêu trường, siêu trọng; xếp hàng hóa trên phương tiện giao thông đường bộ; cấp giấy phép lưu hành cho xe quá tải trọng, xe quá khổ giới hạn, xe bánh xích, xe vận chuyển hàng siêu trường, siêu trọng trên đường bộ.']","**Nguồn văn bản:** 39_2024_TT-BGTVT_633952

**Tên văn bản:** Thông tư Quy định về tải trọng, khổ giới hạn của đường bộ; lưu hành xe quá khổ giới hạn, xe quá tải trọng, xe bánh xích trên đường bộ; hàng siêu trường, siêu trọng, vận chuyển hàng siêu trường, siêu trọng; xếp hàng hóa trên phương tiện giao thông đường bộ; cấp giấy phép lưu hành cho xe quá tải trọng, xe quá khổ giới hạn, xe bánh xích, xe vận chuyển hàng siêu trường, siêu trọng trên đường bộ

**Điều 1:** phạm vi điều chỉnh

**Nội dung:**

Thông tư này quy định về tải trọng, khổ giới hạn của đường bộ; lưu hành xe quá khổ giới hạn, xe quá tải trọng, xe bánh xích trên đường bộ; hàng siêu trường, siêu trọng, vận chuyển hàng siêu trường, siêu trọng; xếp hàng hóa trên phương tiện giao thông đường bộ; cấp giấy phép lưu hành cho xe quá tải trọng, xe quá khổ giới hạn, xe bánh xích, xe vận chuyển hàng siêu trường, siêu trọng trên đường bộ.

**Tóm lại:** Thông tư này quy định về tải trọng, khổ giới hạn của đường bộ và việc lưu hành xe quá khổ, quá tải, xe bánh xích, vận chuyển hàng siêu trường, siêu trọng trên đường bộ, bao gồm cả việc cấp phép lưu hành.
","Cấm xe ô tô chở hàng quá khổ, quá tải lưu thông trên đường bộ; trường hợp đặc biệt phải có giấy phép và tuân thủ các quy định an toàn.",0.8461538461538461,0.1681005528827859,0.0,0.0
62,Luật Giao thông Đường bộ 2025 có quy định gì về việc sử dụng xe ô tô chở hàng nguy hiểm?,"['1. đơn vị kinh doanh vận tải có giấy phép kinh doanh vận tải bằng ô tô, trong đó có một hoặc các loại hình kinh doanh vận tải hàng hóa bằng xe ô tô quy định tại khoản 2, khoản 3 và khoản 4 điều này thì được tham gia kinh doanh vận tải hàng hóa bằng xe ô tô theo loại hình đã đăng ký. 2. kinh doanh vận tải hàng hóa bằng xe taxi tải là việc sử dụng xe ô tô có trọng tải từ 1.500 ki-lô-gam trở xuống để vận chuyển hàng hóa và người thuê vận tải trả tiền cho lái xe theo đồng hồ tính tiền hoặc theo phần mềm tính tiền trên xe. mặt ngoài hai bên thành xe hoặc cánh cửa xe niêm yết cụm từ “taxi tải” theo mẫu số 08 phụ lục xiii kèm theo nghị định này, số điện thoại liên lạc, tên đơn vị kinh doanh vận tải. 3. kinh doanh vận tải hàng hóa siêu trường, siêu trọng a) kinh doanh vận tải hàng hóa siêu trường, siêu trọng là việc sử dụng xe ô tô để vận chuyển hàng không thể chia nhỏ, tháo rời, khi vận chuyển trên đường bộ làm cho phương tiện hoặc tổ hợp phương tiện bị vượt quá giới hạn cho phép tham gia giao thông đường bộ về kích thước, khối lượng theo quy định của pháp luật; b) khi vận chuyển hàng hóa siêu trường, siêu trọng, phải thực hiện theo quy định tại điều 53 luật trật tự, an toàn giao thông đường bộ. 4. kinh doanh vận tải hàng hóa nguy hiểm a) kinh doanh vận tải hàng hóa nguy hiểm là việc sử dụng xe ô tô để vận chuyển hàng hóa có chứa các chất nguy hiểm có khả năng gây nguy hại tới tính mạng, sức khỏe con người, môi trường, an toàn và an ninh quốc gia; b) khi vận chuyển hàng hóa nguy hiểm phải thực hiện theo quy định tại điều 51 luật trật tự, an toàn giao thông đường bộ. 5. kinh doanh vận tải hàng hóa thông thường là hình thức kinh doanh vận tải hàng hóa, trừ các hình thức kinh doanh vận tải quy định tại các khoản 2, khoản 3 điều này. 6. xe ô tô đầu kéo kéo rơ moóc hoặc sơ mi rơ moóc kinh doanh vận tải hàng hóa, xe ô tô tải kinh doanh vận tải hàng hóa thông thường và xe taxi tải phải có phù hiệu “xe tải” theo mẫu số 09 phụ lục xiii kèm theo nghị định này và được dán cố định tại góc trên bên phải ngay sát phía dưới vị trí của tem kiểm định, mặt trong kính chắn gió phía trước của xe. 7. đơn vị kinh doanh vận tải hàng hóa phải chịu trách nhiệm thực hiện đúng quy định việc xếp hàng hóa lên xe ô tô. 8. đơn vị kinh doanh vận tải hàng hóa phải cấp cho lái xe giấy vận tải trong quá trình vận chuyển hàng hóa trên đường. giấy vận tải phải có xác nhận (ký, ghi rõ họ và tên) khối lượng hàng hóa đã xếp lên phương tiện của chủ hàng (hoặc người được chủ hàng ủy quyền) hoặc đại diện đơn vị, cá nhân thực hiện việc xếp hàng. 9. khi vận chuyển hàng hóa, lái xe phải mang theo giấy vận tải (giấy vận chuyển) bằng văn bản giấy hoặc phải có thiết bị để truy cập vào phần mềm thể hiện nội dung của giấy vận tải và các giấy tờ của lái xe và phương tiện theo quy định của pháp luật. đơn vị kinh doanh vận tải và lái xe không được chở hàng vượt quá khối lượng cho phép tham gia giao thông. 10. đối với hoạt động vận chuyển xe đạp, xe mô tô, xe gắn máy và các loại xe tương tự qua hầm đường bộ áp dụng theo quy định tại khoản 4 điều này. 11. giấy vận tải bằng văn bản giấy hoặc điện tử do đơn vị kinh doanh vận tải hàng hóa tự phát hành và có các thông tin tối thiểu gồm: tên đơn vị vận tải; biển kiểm soát xe; tên đơn vị hoặc người thuê vận tải; hành trình (điểm đầu, điểm cuối); số hợp đồng, ngày tháng năm ký hợp đồng (nếu có); loại hàng và khối lượng hàng vận chuyển trên xe. đơn vị kinh doanh vận tải hàng hóa phải thực hiện lưu trữ giấy vận tải của các chuyến xe đã thực hiện trong thời gian tối thiểu 03 năm. 12. việc bồi thường hàng hóa hư hỏng, mất mát, thiếu hụt được thực hiện theo hợp đồng vận chuyển hoặc theo thỏa thuận giữa người kinh doanh vận tải và người thuê vận tải.']","**Nguồn văn bản:** 158_2024_ND-CP_636875

**Tên văn bản:** Nghị định Quy định về hoạt động vận tải đường bộ

**Điều 8:** kinh doanh vận tải hàng hóa bằng xe ô tô

**Nội dung:**

4. Kinh doanh vận tải hàng hóa nguy hiểm

	a) Kinh doanh vận tải hàng hóa nguy hiểm là việc sử dụng xe ô tô để vận chuyển hàng hóa có chứa các chất nguy hiểm có khả năng gây nguy hại tới tính mạng, sức khỏe con người, môi trường, an toàn và an ninh quốc gia.

	b) Khi vận chuyển hàng hóa nguy hiểm phải thực hiện theo quy định tại Điều 51 Luật Trật tự, An toàn giao thông đường bộ.


Tóm lại: Việc kinh doanh vận tải hàng hóa nguy hiểm bằng xe ô tô phải tuân thủ quy định tại Điều 51 của Luật Trật tự, An toàn giao thông đường bộ.
",Xe ô tô chở hàng nguy hiểm phải có giấy phép đặc biệt và tuân thủ các quy định về an toàn và môi trường.,0.75,0.5394289244126388,0.0,0.0
63,Quy định mới về việc sử dụng xe ô tô chở vật liệu xây dựng là gì?,"['1. đơn vị vận tải phải lựa chọn phương tiện phù hợp với kích thước, khối lượng hàng hóa vận chuyển. hàng hóa được vận chuyển phải phù hợp với kết cấu của khoang chứa hàng và công năng của phương tiện vận chuyển. 2. việc xếp hàng hóa trên phương tiện giao thông đường bộ khi tham gia giao thông trên đường bộ phải tuân thủ các quy định về khối lượng toàn bộ của xe, tải trọng trục xe, cụm trục xe, chiều cao, chiều rộng, chiều dài xếp hàng hóa cho phép của xe quy định tại điều 14, điều 15, điều 16 và điều 17 của thông tư này và không vượt quá khối lượng hàng hóa chuyên chở cho phép tham gia giao thông ghi trong giấy chứng nhận kiểm định an toàn kỹ thuật và bảo vệ môi trường của xe trừ trường hợp được cấp giấy phép lưu hành xe quá tải trọng, xe quá khổ giới hạn, xe vận chuyển hàng siêu trường, siêu trọng trên đường bộ. 3. hàng hóa xếp trên phương tiện phải được xếp đặt gọn gàng, xếp dàn đều, chằng buộc chắc chắn, chèn, lót đảm bảo không bị xê dịch theo các phương ngang, phương dọc và phương thẳng đứng; đảm bảo các quy định về vệ sinh môi trường; không để rơi vãi khi phương tiện tham gia giao thông; không cản trở tầm nhìn của lái xe; không làm mất thăng bằng của phương tiện hoặc gây khó khăn cho lái xe khi điều khiển; không che khuất đèn, biển số đăng ký và các cảnh báo an toàn của phương tiện. một số trang thiết bị thường dùng để gia cố, chằng buộc, chèn, lót hàng hóa được hướng dẫn tại phụ lục x ban hành kèm theo thông tư này. 4. đối với các loại hàng hóa là máy móc, phương tiện giao thông, trước khi xếp lên phương tiện phải rút hết nhiên liệu ra khỏi bình chứa. phương pháp xếp hàng hóa là máy móc, phương tiện giao thông được hướng dẫn tại phụ lục xi ban hành kèm theo thông tư này. 5. việc xếp hàng hóa trên phương tiện đối với các loại hàng hóa đã được đóng gói thành bao, kiện, thùng, cuộn, khối thực hiện theo hướng dẫn của nhà sản xuất. 6. việc xếp các loại hàng hóa nguy hiểm trên phương tiện thực hiện theo quy định về vận chuyển hàng hóa nguy hiểm bằng phương tiện giao thông cơ giới đường bộ và quy định tại chương này.']","**Nguồn văn bản:** 39_2024_TT-BGTVT_633952

**Tên văn bản:** Thông tư Quy định về tải trọng, khổ giới hạn của đường bộ; lưu hành xe quá khổ giới hạn, xe quá tải trọng, xe bánh xích trên đường bộ; hàng siêu trường, siêu trọng, vận chuyển hàng siêu trường, siêu trọng; xếp hàng hóa trên phương tiện giao thông đường bộ; cấp giấy phép lưu hành cho xe quá tải trọng, xe quá khổ giới hạn, xe bánh xích, xe vận chuyển hàng siêu trường, siêu trọng trên đường bộ

**Điều 13:** quy định chung về xếp hàng hóa trên phương tiện giao thông đường bộ

**Nội dung:**

1. Đơn vị vận tải phải lựa chọn phương tiện phù hợp với kích thước, khối lượng hàng hóa vận chuyển. 

Hàng hóa được vận chuyển phải phù hợp với kết cấu của khoang chứa hàng và công năng của phương tiện vận chuyển.

2. Việc xếp hàng hóa trên phương tiện giao thông đường bộ khi tham gia giao thông trên đường bộ phải tuân thủ các quy định về khối lượng toàn bộ của xe, tải trọng trục xe, cụm trục xe, chiều cao, chiều rộng, chiều dài xếp hàng hóa cho phép của xe quy định tại điều 14, điều 15, điều 16 và điều 17 của thông tư này và không vượt quá khối lượng hàng hóa chuyên chở cho phép tham gia giao thông ghi trong giấy chứng nhận kiểm định an toàn kỹ thuật và bảo vệ môi trường của xe trừ trường hợp được cấp giấy phép lưu hành xe quá tải trọng, xe quá khổ giới hạn, xe vận chuyển hàng siêu trường, siêu trọng trên đường bộ.

3. Hàng hóa xếp trên phương tiện phải được xếp đặt gọn gàng, xếp dàn đều, chằng buộc chắc chắn, chèn, lót đảm bảo không bị xê dịch theo các phương ngang, phương dọc và phương thẳng đứng; đảm bảo các quy định về vệ sinh môi trường; không để rơi vãi khi phương tiện tham gia giao thông; không cản trở tầm nhìn của lái xe; không làm mất thăng bằng của phương tiện hoặc gây khó khăn cho lái xe khi điều khiển; không che khuất đèn, biển số đăng ký và các cảnh báo an toàn của phương tiện. 

Một số trang thiết bị thường dùng để gia cố, chằng buộc, chèn, lót hàng hóa được hướng dẫn tại phụ lục x ban hành kèm theo thông tư này.

4. Đối với các loại hàng hóa là máy móc, phương tiện giao thông, trước khi xếp lên phương tiện phải rút hết nhiên liệu ra khỏi bình chứa. 

Phương pháp xếp hàng hóa là máy móc, phương tiện giao thông được hướng dẫn tại phụ lục xi ban hành kèm theo thông tư này.

5. Việc xếp hàng hóa trên phương tiện đối với các loại hàng hóa đã được đóng gói thành bao, kiện, thùng, cuộn, khối thực hiện theo hướng dẫn của nhà sản xuất.

6. Việc xếp các loại hàng hóa nguy hiểm trên phương tiện thực hiện theo quy định về vận chuyển hàng hóa nguy hiểm bằng phương tiện giao thông cơ giới đường bộ và quy định tại chương này.


**Tóm lại:**  Xe ô tô chở vật liệu xây dựng phải tuân thủ quy định về kích thước, khối lượng hàng hóa; xếp hàng gọn gàng, chắc chắn, không rơi vãi, không cản trở tầm nhìn, không che khuất đèn, biển số; rút hết nhiên liệu (nếu chở máy móc, phương tiện); tuân thủ hướng dẫn của nhà sản xuất (nếu hàng hóa đóng gói) và quy định vận chuyển hàng nguy hiểm (nếu có). Chi tiết xem Điều 13, 14, 15, 16, 17 của Thông tư 39/2024/TT-BGTVT.
",Xe ô tô chở vật liệu xây dựng phải được che phủ kín để tránh rơi vãi và gây ô nhiễm môi trường.,1.0,0.4795266031734768,0.0,0.0
64,Luật Giao thông Đường bộ 2025 có quy định gì về việc sử dụng xe ô tô chở rác thải?,"['thông tư quy định về phân loại phương tiện giao thông đường bộ và dấu hiệu nhận biết xe cơ giới sử dụng năng lượng sạch, năng lượng xanh, thân thiện môi trường.']","**Nguồn văn bản:** 53_2024_TT-BGTVT_624420

**Tên văn bản:** Thông tư Quy định về phân loại phương tiện giao thông đường bộ và dấu hiệu nhận biết xe cơ giới sử dụng năng lượng sạch, năng lượng xanh, thân thiện môi trường

**điều 1:** phạm vi điều chỉnh

**Nội dung:**

Thông tư quy định về phân loại phương tiện giao thông đường bộ và dấu hiệu nhận biết xe cơ giới sử dụng năng lượng sạch, năng lượng xanh, thân thiện môi trường.

Tóm lại: Văn bản này không chứa thông tin về luật giao thông đường bộ liên quan đến việc sử dụng xe ô tô chở rác thải.
","Xe ô tô chở rác thải phải được che phủ kín, không để rò rỉ nước thải và tuân thủ các quy định về vệ sinh môi trường.",0.4,0.596380025778226,0.0,0.0
65,Quy định mới về việc sử dụng xe ô tô chở động vật sống là gì?,"['1. việc vận chuyển động vật sống phải bảo đảm các yêu cầu sau đây: a) người lái xe phải mang đủ giấy tờ theo quy định của pháp luật; b) phương tiện vận chuyển phải có kết cấu phù hợp với loại động vật chuyên chở; c) trong quá trình vận chuyển phải chấp hành các quy định của pháp luật về trật tự, an toàn giao thông đường bộ, vệ sinh dịch tễ, phòng dịch và bảo đảm vệ sinh môi trường. 2. việc vận chuyển thực phẩm tươi sống phải bảo đảm các yêu cầu sau đây: a) người lái xe phải mang đủ giấy tờ theo quy định của pháp luật; b) trong quá trình vận chuyển phải chấp hành các quy định của pháp luật về trật tự, an toàn giao thông đường bộ, an toàn thực phẩm, vệ sinh dịch tễ, phòng dịch và bảo đảm vệ sinh môi trường.']","**Nguồn văn bản:** 36_2024_QH15_444251

**Tên văn bản:** Luật Trật tự, an toàn giao thông đường bộ

**Điều 50:** Bảo đảm trật tự, an toàn giao thông đường bộ đối với phương tiện giao thông đường bộ vận chuyển động vật sống, thực phẩm tươi sống

**Nội dung:**

1. Việc vận chuyển động vật sống phải bảo đảm các yêu cầu sau đây:

    a) Người lái xe phải mang đủ giấy tờ theo quy định của pháp luật.

    b) Phương tiện vận chuyển phải có kết cấu phù hợp với loại động vật chuyên chở.

    c) Trong quá trình vận chuyển phải chấp hành các quy định của pháp luật về trật tự, an toàn giao thông đường bộ, vệ sinh dịch tễ, phòng dịch và bảo đảm vệ sinh môi trường.


2. Việc vận chuyển thực phẩm tươi sống phải bảo đảm các yêu cầu sau đây:

    a) Người lái xe phải mang đủ giấy tờ theo quy định của pháp luật.

    b) Trong quá trình vận chuyển phải chấp hành các quy định của pháp luật về trật tự, an toàn giao thông đường bộ, an toàn thực phẩm, vệ sinh dịch tễ, phòng dịch và bảo đảm vệ sinh môi trường.


**Tóm lại:** Xe ô tô chở động vật sống phải có giấy tờ hợp lệ, kết cấu xe phù hợp với động vật vận chuyển và tuân thủ quy định về trật tự an toàn giao thông, vệ sinh dịch tễ, phòng dịch và bảo vệ môi trường.
","Xe ô tô chở động vật sống phải đảm bảo vệ sinh, an toàn cho động vật và không gây ô nhiễm môi trường.",1.0,0.4994725406616842,0.0,0.9999999999
66,Luật Giao thông Đường bộ 2025 có quy định gì về việc sử dụng xe ô tô chở cây cảnh?,"['thực hiện trách nhiệm của chủ phương tiện giao thông đường bộ theo quy định của pháp luật về thanh toán điện tử giao thông đường bộ, pháp luật về thu phí sử dụng đường cao tốc.']","Không tìm thấy thông tin liên quan tới câu hỏi này.
","Xe ô tô chở cây cảnh phải được sắp xếp gọn gàng, đảm bảo an toàn và không cản trở tầm nhìn của người lái.",0.0,0.0,0.0,0.0
67,Quy định mới về việc sử dụng xe ô tô chở hàng dễ cháy nổ là gì?,"['1. phạt tiền từ 500.000 đồng đến 1.000.000 đồng đối với cá nhân, từ 1.000.000 đồng đến 2.000.000 đồng đối với tổ chức thực hiện một trong các hành vi vi phạm sau đây: a) xếp hàng hóa lên mỗi xe ô tô (kể cả rơ moóc và sơ mi rơ moóc) vượt quá trọng tải (khối lượng hàng chuyên chở) cho phép tham gia giao thông được ghi trong giấy chứng nhận kiểm định an toàn kỹ thuật và bảo vệ môi trường của xe trên 10% đến 50% (trừ xe xi téc chở chất lỏng), trên 20% đến 50% đối với xe xi téc chở chất lỏng; b) xếp hàng hóa lên xe ô tô mà không ký xác nhận việc xếp hàng hóa vào giấy vận tải theo quy định. 2. phạt tiền từ 1.000.000 đồng đến 2.000.000 đồng đối với cá nhân, từ 2.000.000 đồng đến 4.000.000 đồng đối với tổ chức kinh doanh vận tải, dịch vụ hỗ trợ vận tải thực hiện một trong các hành vi vi phạm sau đây: a) không đánh số thứ tự ghế ngồi, giường nằm trên xe ô tô chở hành khách theo quy định; b) sử dụng xe ô tô kinh doanh vận tải hành khách theo tuyến cố định, xe ô tô kinh doanh vận tải hành khách bằng xe buýt không có chỗ ưu tiên cho người khuyết tật, người cao tuổi và phụ nữ mang thai theo quy định; c) sử dụng xe ô tô kinh doanh vận tải hành khách không có hướng dẫn cho hành khách về an toàn giao thông, thoát hiểm khi xảy ra sự cố trên xe theo quy định; d) không bố trí người áp tải trên xe vận chuyển hàng hóa nguy hiểm đối với những trường hợp quy định phải có người áp tải; đ) không cấp lệnh vận chuyển, giấy vận tải cho lái xe hoặc cấp lệnh vận chuyển, giấy vận tải nhưng không đúng theo quy định (đối với loại xe quy định phải cấp lệnh vận chuyển, giấy vận tải); e) sử dụng xe vận chuyển hàng hóa nguy hiểm mà không làm sạch hoặc không bóc (xóa) biểu trưng nguy hiểm trên phương tiện khi không tiếp tục vận chuyển loại hàng hóa đó. 3. phạt tiền từ 2.000.000 đồng đến 3.000.000 đồng đối với cá nhân, từ 4.000.000 đồng đến 6.000.000 đồng đối với tổ chức thực hiện hành vi vi phạm xếp hàng hóa lên mỗi xe ô tô (kể cả rơ moóc và sơ mi rơ moóc) vượt quá trọng tải (khối lượng hàng chuyên chở) cho phép tham gia giao thông được ghi trong giấy chứng nhận kiểm định an toàn kỹ thuật và bảo vệ môi trường của xe trên 50% đến 100%. 4. phạt tiền từ 3.000.000 đồng đến 4.000.000 đồng đối với cá nhân, từ 6.000.000 đồng đến 8.000.000 đồng đối với tổ chức kinh doanh vận tải, dịch vụ hỗ trợ vận tải thực hiện một trong các hành vi vi phạm sau đây: a) không cấp thẻ nhận dạng lái xe cho lái xe theo quy định; b) sử dụng lái xe, nhân viên phục vụ trên xe để tham gia kinh doanh vận tải bằng xe ô tô mà không được tập huấn, hướng dẫn về nghiệp vụ vận tải hành khách và an toàn giao thông theo quy định (đối với hình thức kinh doanh vận tải có quy định lái xe, nhân viên phục vụ trên xe phải được tập huấn, hướng dẫn nghiệp vụ), trừ các hành vi vi phạm quy định tại điểm c, điểm d khoản này; c) sử dụng lái xe, người quản lý trên xe để tham gia kinh doanh vận tải bằng xe ô tô mà không được hướng dẫn về quy trình bảo đảm an toàn khi đưa đón trẻ em mầm non, học sinh; d) sử dụng lái xe, người áp tải vận chuyển hàng hóa nguy hiểm mà không được tập huấn về vận chuyển hàng hóa nguy hiểm; đ) sử dụng xe ô tô kinh doanh vận tải hành khách không có dây đai an toàn tại các vị trí ghế ngồi, giường nằm theo quy định (trừ xe buýt nội tỉnh); e) sử dụng xe ô tô kinh doanh vận tải chở trẻ em mầm non, học sinh tiểu học, xe ô tô kinh doanh vận tải kết hợp với hoạt động đưa đón trẻ em mầm non, học sinh tiểu học không có dây đai an toàn phù hợp với lứa tuổi hoặc không có ghế ngồi phù hợp với lứa tuổi theo quy định; g) không thực hiện việc niêm yết thông tin trên xe theo quy định hoặc có niêm yết nhưng không chính xác, không đầy đủ thông tin theo quy định. 5. phạt tiền từ 4.000.000 đồng đến 5.000.000 đồng đối với cá nhân, từ 8.000.000 đồng đến 10.000.000 đồng đối với tổ chức xếp hàng hóa lên mỗi xe ô tô (kể cả rơ moóc và sơ mi rơ moóc) vượt quá trọng tải (khối lượng hàng chuyên chở) cho phép tham gia giao thông được ghi trong giấy chứng nhận kiểm định an toàn kỹ thuật và bảo vệ môi trường của xe trên 100%. 6. phạt tiền từ 4.000.000 đồng đến 6.000.000 đồng đối với cá nhân, từ 8.000.000 đồng đến 12.000.000 đồng đối với tổ chức kinh doanh vận tải thực hiện một trong các hành vi vi phạm sau đây: a) sử dụng xe vận chuyển động vật sống không có kết cấu phù hợp với loại động vật chuyên chở theo quy định; b) sử dụng xe ô tô kinh doanh vận tải chở trẻ em mầm non, học sinh, xe ô tô kinh doanh vận tải kết hợp với hoạt động đưa đón trẻ em mầm non, học sinh không có thiết bị ghi nhận hình ảnh trẻ em mầm non, học sinh hoặc không có thiết bị có chức năng cảnh báo, chống bỏ quên trẻ em trên xe hoặc không có thiết bị ghi nhận hình ảnh trẻ em mầm non, học sinh và thiết bị có chức năng cảnh báo, chống bỏ quên trẻ em trên xe; c) sử dụng xe ô tô kinh doanh vận tải chở trẻ em mầm non, học sinh không có màu sơn theo quy định; d) sử dụng xe ô tô kinh doanh vận tải chở trẻ em mầm non, học sinh, xe ô tô kinh doanh vận tải kết hợp với hoạt động đưa đón trẻ em mầm non, học sinh không có biển báo dấu hiệu nhận biết là xe chở trẻ em mầm non, học sinh theo quy định. 7. phạt tiền từ 5.000.000 đồng đến 6.000.000 đồng đối với cá nhân, từ 10.000.000 đồng đến 12.000.000 đồng đối với tổ chức kinh doanh vận tải, dịch vụ hỗ trợ vận tải thực hiện một trong các hành vi vi phạm sau đây: a) không thực hiện việc cung cấp, cập nhật, truyền, lưu trữ, quản lý thông tin, dữ liệu từ thiết bị giám sát hành trình theo quy định; b) không thực hiện đúng nội dung thông tin đã niêm yết trên xe theo quy định; c) sử dụng phương tiện kinh doanh vận tải không lắp thiết bị giám sát hành trình của xe (đối với hình thức kinh doanh vận tải có quy định phương tiện phải lắp thiết bị) hoặc lắp thiết bị nhưng thiết bị không hoạt động, không đúng quy chuẩn theo quy định hoặc làm sai lệch dữ liệu của thiết bị giám sát hành trình của xe ô tô; d) sử dụng xe trung chuyển chở hành khách không đúng quy định; đ) sử dụng lái xe điều khiển xe khách giường nằm hai tầng, xe ô tô đưa đón trẻ em mầm non, học sinh chưa đủ số năm kinh nghiệm theo quy định; e) sử dụng xe kinh doanh vận tải hành khách theo hợp đồng mà trên xe không có hợp đồng vận tải, danh sách hành khách kèm theo, thiết bị để truy cập nội dung hợp đồng điện tử và danh sách hành khách theo quy định hoặc có hợp đồng vận tải, danh sách hành khách, thiết bị để truy cập nhưng không bảo đảm yêu cầu theo quy định, chở người không có tên trong danh sách hành khách hoặc vận chuyển không đúng đối tượng theo quy định (đối với xe kinh doanh vận tải hành khách theo hợp đồng vận chuyển trẻ em mầm non, học sinh, sinh viên, cán bộ, công chức, viên chức, công nhân); g) sử dụng xe ô tô kinh doanh vận tải không lắp thiết bị ghi nhận hình ảnh người lái xe theo quy định (đối với loại xe có quy định phải lắp thiết bị ghi nhận hình ảnh người lái xe) hoặc có lắp thiết bị ghi nhận hình ảnh người lái xe nhưng không ghi, không lưu trữ được dữ liệu trên xe trong quá trình xe tham gia giao thông theo quy định hoặc làm sai lệch dữ liệu của thiết bị ghi nhận hình ảnh người lái xe lắp trên xe ô tô; h) không thực hiện việc cung cấp, cập nhật, truyền dẫn, lưu trữ, quản lý thông tin, dữ liệu thu thập từ thiết bị ghi nhận hình ảnh người lái xe lắp trên xe ô tô theo quy định; i) sử dụng phương tiện kinh doanh vận tải có niên hạn sử dụng không bảo đảm điều kiện của hình thức kinh doanh đã đăng ký. 8. phạt tiền từ 10.000.000 đồng đến 12.000.000 đồng đối với cá nhân, từ 20.000.000 đồng đến 24.000.000 đồng đối với tổ chức kinh doanh vận tải, dịch vụ hỗ trợ vận tải thực hiện một trong các hành vi vi phạm sau đây: a) không tổ chức khám sức khỏe định kỳ cho lái xe theo quy định hoặc có tổ chức khám nhưng không đầy đủ các nội dung theo quy định; b) vi phạm quy định về kinh doanh, điều kiện kinh doanh vận tải bằng xe ô tô để xảy ra tai nạn giao thông gây hậu quả từ mức nghiêm trọng trở lên; c) sử dụng xe ô tô kinh doanh vận tải để đón, trả khách; nhận, trả hàng trên đường cao tốc. 9. phạt tiền từ 20.000.000 đồng đến 40.000.000 đồng đối với đơn vị sản xuất, lắp ráp, nhập khẩu thiết bị giám sát hành trình của xe ô tô, đơn vị cung cấp dịch vụ liên quan đến giám sát hành trình, ghi nhận hình ảnh người lái xe thực hiện một trong các hành vi sau: a) đơn vị sản xuất, lắp ráp, nhập khẩu thiết bị giám sát hành trình của xe ô tô không có nhân sự cho từng vị trí công việc theo quy định; b) đơn vị sản xuất, lắp ráp, nhập khẩu thiết bị giám sát hành trình của xe ô tô không báo cáo về việc cập nhật, thay đổi phần mềm của thiết bị theo quy định. 10. phạt tiền từ 40.000.000 đồng đến 60.000.000 đồng đối với đơn vị sản xuất, lắp ráp, nhập khẩu thiết bị ghi nhận hình ảnh người lái xe lắp trên xe ô tô, đơn vị cung cấp dịch vụ liên quan đến giám sát hành trình, ghi nhận hình ảnh người lái xe thực hiện một trong các hành vi vi phạm sau đây: a) làm sai lệch thông tin, dữ liệu của thiết bị giám sát hành trình của xe ô tô; b) làm sai lệch thông tin, dữ liệu của thiết bị ghi nhận hình ảnh người lái xe lắp trên xe ô tô. 11. phạt tiền từ 40.000.000 đồng đến 50.000.000 đồng đối với cá nhân, từ 80.000.000 đồng đến 100.000.000 đồng đối với tổ chức kinh doanh vận tải, dịch vụ hỗ trợ vận tải tái phạm hành vi quy định tại điểm a, điểm h khoản 7 điều này. 12. ngoài việc bị phạt tiền, cá nhân, tổ chức thực hiện hành vi vi phạm quy định tại điểm c khoản 2; điểm a, điểm b, điểm đ, điểm g khoản 4; điểm b, điểm c, điểm d, điểm đ, điểm e, điểm g khoản 7; điểm c khoản 8 điều này còn bị áp dụng các hình thức xử phạt bổ sung tước quyền sử dụng phù hiệu từ 01 tháng đến 03 tháng (nếu có hoặc đã được cấp) đối với xe vi phạm. 13. ngoài việc bị áp dụng hình thức xử phạt, cá nhân, tổ chức thực hiện hành vi vi phạm còn bị áp dụng các biện pháp khắc phục hậu quả sau đây: a) thực hiện hành vi quy định tại điểm a khoản 4 điều này buộc cấp thẻ nhận dạng lái xe cho lái xe theo quy định; b) thực hiện hành vi quy định tại điểm b, điểm c, điểm d khoản 4; điểm a khoản 8 điều này buộc tổ chức tập huấn, hướng dẫn nghiệp vụ, quy trình hoặc tổ chức khám sức khỏe định kỳ cho lái xe và nhân viên phục vụ trên xe theo quy định; c) thực hiện hành vi quy định tại điểm đ, điểm e khoản 4; điểm c, điểm g khoản 7 điều này buộc lắp đặt thiết bị giám sát hành trình, thiết bị ghi nhận hình ảnh người lái xe, dây đai an toàn, ghế ngồi cho trẻ em mầm non, học sinh tiểu học trên xe theo đúng quy định; d) thực hiện hành vi quy định tại điểm a, điểm h khoản 7; khoản 11 điều này buộc cung cấp, cập nhật, truyền dẫn, lưu trữ, quản lý thông tin, dữ liệu thu thập từ thiết bị giám sát hành trình, thiết bị ghi nhận hình ảnh người lái xe lắp trên xe ô tô theo quy định; đ) thực hiện hành vi quy định tại điểm c, điểm d khoản 6 điều này buộc thực hiện đúng quy định về màu sơn, biển báo dấu hiệu nhận biết của xe. 14. ngoài việc bị áp dụng hình thức xử phạt, người điều khiển phương tiện thực hiện hành vi vi phạm còn bị trừ điểm giấy phép lái xe như sau: a) thực hiện hành vi quy định tại điểm đ khoản 2; điểm b, điểm c, điểm d khoản 6; điểm b, điểm c, điểm e, điểm i khoản 7 điều này trong trường hợp cá nhân kinh doanh vận tải là người trực tiếp điều khiển phương tiện còn bị trừ điểm giấy phép lái xe 02 điểm; b) thực hiện hành vi quy định tại điểm c khoản 8 điều này trong trường hợp cá nhân kinh doanh vận tải là người trực tiếp điều khiển phương tiện còn bị trừ điểm giấy phép lái xe 06 điểm.']","**Nguồn văn bản:** 168_2024_ND-CP_619502

**Tên văn bản:** Nghị định Quy định xử phạt vi phạm hành chính về trật tự, an toàn giao thông trong lĩnh vực giao thông đường bộ; trừ điểm, phục hồi điểm giấy phép lái xe

**Điều 26:** xử phạt các hành vi vi phạm quy định về trật tự, an toàn giao thông đường bộ trong vận tải đường bộ, dịch vụ hỗ trợ vận tải đường bộ

**Nội dung:**  
1. Phạt tiền từ 500.000 đồng đến 1.000.000 đồng đối với cá nhân, từ 1.000.000 đồng đến 2.000.000 đồng đối với tổ chức thực hiện một trong các hành vi vi phạm sau đây:

	a) Xếp hàng hóa lên mỗi xe ô tô (kể cả rơ moóc và sơ mi rơ moóc) vượt quá trọng tải (khối lượng hàng chuyên chở) cho phép tham gia giao thông được ghi trong giấy chứng nhận kiểm định an toàn kỹ thuật và bảo vệ môi trường của xe trên 10% đến 50% (trừ xe xi téc chở chất lỏng), trên 20% đến 50% đối với xe xi téc chở chất lỏng.

	b) Xếp hàng hóa lên xe ô tô mà không ký xác nhận việc xếp hàng hóa vào giấy vận tải theo quy định.

2. Phạt tiền từ 1.000.000 đồng đến 2.000.000 đồng đối với cá nhân, từ 2.000.000 đồng đến 4.000.000 đồng đối với tổ chức kinh doanh vận tải, dịch vụ hỗ trợ vận tải thực hiện một trong các hành vi vi phạm sau đây:
...
7. Phạt tiền từ 5.000.000 đồng đến 6.000.000 đồng đối với cá nhân, từ 10.000.000 đồng đến 12.000.000 đồng đối với tổ chức kinh doanh vận tải, dịch vụ hỗ trợ vận tải thực hiện một trong các hành vi vi phạm sau đây:
...

14. Ngoài việc bị áp dụng hình thức xử phạt, người điều khiển phương tiện thực hiện hành vi vi phạm còn bị trừ điểm giấy phép lái xe như sau:
...


**Tóm lại:** Văn bản cung cấp không đề cập cụ thể đến quy định xử phạt đối với việc sử dụng xe ô tô chở hàng dễ cháy nổ.  Văn bản tập trung vào các hành vi vi phạm liên quan đến trọng tải, giấy tờ vận tải, an toàn hành khách, thiết bị trên xe, v.v. trong vận tải đường bộ.
","Xe ô tô chở hàng dễ cháy nổ phải có giấy phép đặc biệt, được kiểm định an toàn và tuân thủ các quy định về phòng cháy chữa cháy.",0.7333333333333333,0.0,1.0,0.0
68,Luật Giao thông Đường bộ 2025 có quy định gì về việc sử dụng xe ô tô chở hàng dễ hỏng?,"['1. đơn vị kinh doanh vận tải có giấy phép kinh doanh vận tải bằng ô tô, trong đó có một hoặc các loại hình kinh doanh vận tải hàng hóa bằng xe ô tô quy định tại khoản 2, khoản 3 và khoản 4 điều này thì được tham gia kinh doanh vận tải hàng hóa bằng xe ô tô theo loại hình đã đăng ký. 2. kinh doanh vận tải hàng hóa bằng xe taxi tải là việc sử dụng xe ô tô có trọng tải từ 1.500 ki-lô-gam trở xuống để vận chuyển hàng hóa và người thuê vận tải trả tiền cho lái xe theo đồng hồ tính tiền hoặc theo phần mềm tính tiền trên xe. mặt ngoài hai bên thành xe hoặc cánh cửa xe niêm yết cụm từ “taxi tải” theo mẫu số 08 phụ lục xiii kèm theo nghị định này, số điện thoại liên lạc, tên đơn vị kinh doanh vận tải. 3. kinh doanh vận tải hàng hóa siêu trường, siêu trọng a) kinh doanh vận tải hàng hóa siêu trường, siêu trọng là việc sử dụng xe ô tô để vận chuyển hàng không thể chia nhỏ, tháo rời, khi vận chuyển trên đường bộ làm cho phương tiện hoặc tổ hợp phương tiện bị vượt quá giới hạn cho phép tham gia giao thông đường bộ về kích thước, khối lượng theo quy định của pháp luật; b) khi vận chuyển hàng hóa siêu trường, siêu trọng, phải thực hiện theo quy định tại điều 53 luật trật tự, an toàn giao thông đường bộ. 4. kinh doanh vận tải hàng hóa nguy hiểm a) kinh doanh vận tải hàng hóa nguy hiểm là việc sử dụng xe ô tô để vận chuyển hàng hóa có chứa các chất nguy hiểm có khả năng gây nguy hại tới tính mạng, sức khỏe con người, môi trường, an toàn và an ninh quốc gia; b) khi vận chuyển hàng hóa nguy hiểm phải thực hiện theo quy định tại điều 51 luật trật tự, an toàn giao thông đường bộ. 5. kinh doanh vận tải hàng hóa thông thường là hình thức kinh doanh vận tải hàng hóa, trừ các hình thức kinh doanh vận tải quy định tại các khoản 2, khoản 3 điều này. 6. xe ô tô đầu kéo kéo rơ moóc hoặc sơ mi rơ moóc kinh doanh vận tải hàng hóa, xe ô tô tải kinh doanh vận tải hàng hóa thông thường và xe taxi tải phải có phù hiệu “xe tải” theo mẫu số 09 phụ lục xiii kèm theo nghị định này và được dán cố định tại góc trên bên phải ngay sát phía dưới vị trí của tem kiểm định, mặt trong kính chắn gió phía trước của xe. 7. đơn vị kinh doanh vận tải hàng hóa phải chịu trách nhiệm thực hiện đúng quy định việc xếp hàng hóa lên xe ô tô. 8. đơn vị kinh doanh vận tải hàng hóa phải cấp cho lái xe giấy vận tải trong quá trình vận chuyển hàng hóa trên đường. giấy vận tải phải có xác nhận (ký, ghi rõ họ và tên) khối lượng hàng hóa đã xếp lên phương tiện của chủ hàng (hoặc người được chủ hàng ủy quyền) hoặc đại diện đơn vị, cá nhân thực hiện việc xếp hàng. 9. khi vận chuyển hàng hóa, lái xe phải mang theo giấy vận tải (giấy vận chuyển) bằng văn bản giấy hoặc phải có thiết bị để truy cập vào phần mềm thể hiện nội dung của giấy vận tải và các giấy tờ của lái xe và phương tiện theo quy định của pháp luật. đơn vị kinh doanh vận tải và lái xe không được chở hàng vượt quá khối lượng cho phép tham gia giao thông. 10. đối với hoạt động vận chuyển xe đạp, xe mô tô, xe gắn máy và các loại xe tương tự qua hầm đường bộ áp dụng theo quy định tại khoản 4 điều này. 11. giấy vận tải bằng văn bản giấy hoặc điện tử do đơn vị kinh doanh vận tải hàng hóa tự phát hành và có các thông tin tối thiểu gồm: tên đơn vị vận tải; biển kiểm soát xe; tên đơn vị hoặc người thuê vận tải; hành trình (điểm đầu, điểm cuối); số hợp đồng, ngày tháng năm ký hợp đồng (nếu có); loại hàng và khối lượng hàng vận chuyển trên xe. đơn vị kinh doanh vận tải hàng hóa phải thực hiện lưu trữ giấy vận tải của các chuyến xe đã thực hiện trong thời gian tối thiểu 03 năm. 12. việc bồi thường hàng hóa hư hỏng, mất mát, thiếu hụt được thực hiện theo hợp đồng vận chuyển hoặc theo thỏa thuận giữa người kinh doanh vận tải và người thuê vận tải.']","**Nguồn văn bản:** 158_2024_ND-CP_636875

**Tên văn bản:** Nghị định Quy định về hoạt động vận tải đường bộ

**Điều 8:** kinh doanh vận tải hàng hóa bằng xe ô tô

**Nội dung:**

1. Đơn vị kinh doanh vận tải có giấy phép kinh doanh vận tải bằng ô tô, trong đó có một hoặc các loại hình kinh doanh vận tải hàng hóa bằng xe ô tô quy định tại khoản 2, khoản 3 và khoản 4 điều này thì được tham gia kinh doanh vận tải hàng hóa bằng xe ô tô theo loại hình đã đăng ký.

2. Kinh doanh vận tải hàng hóa bằng xe taxi tải là việc sử dụng xe ô tô có trọng tải từ 1.500 ki-lô-gam trở xuống để vận chuyển hàng hóa và người thuê vận tải trả tiền cho lái xe theo đồng hồ tính tiền hoặc theo phần mềm tính tiền trên xe. Mặt ngoài hai bên thành xe hoặc cánh cửa xe niêm yết cụm từ “taxi tải” theo mẫu số 08 phụ lục XIII kèm theo nghị định này, số điện thoại liên lạc, tên đơn vị kinh doanh vận tải.

3. Kinh doanh vận tải hàng hóa siêu trường, siêu trọng

	a) Kinh doanh vận tải hàng hóa siêu trường, siêu trọng là việc sử dụng xe ô tô để vận chuyển hàng không thể chia nhỏ, tháo rời, khi vận chuyển trên đường bộ làm cho phương tiện hoặc tổ hợp phương tiện bị vượt quá giới hạn cho phép tham gia giao thông đường bộ về kích thước, khối lượng theo quy định của pháp luật.

	b) Khi vận chuyển hàng hóa siêu trường, siêu trọng, phải thực hiện theo quy định tại Điều 53 Luật Trật tự, an toàn giao thông đường bộ.

4. Kinh doanh vận tải hàng hóa nguy hiểm

	a) Kinh doanh vận tải hàng hóa nguy hiểm là việc sử dụng xe ô tô để vận chuyển hàng hóa có chứa các chất nguy hiểm có khả năng gây nguy hại tới tính mạng, sức khỏe con người, môi trường, an toàn và an ninh quốc gia.

	b) Khi vận chuyển hàng hóa nguy hiểm phải thực hiện theo quy định tại Điều 51 Luật Trật tự, an toàn giao thông đường bộ.

5. Kinh doanh vận tải hàng hóa thông thường là hình thức kinh doanh vận tải hàng hóa, trừ các hình thức kinh doanh vận tải quy định tại các khoản 2, khoản 3 điều này.

6. Xe ô tô đầu kéo kéo rơ moóc hoặc sơ mi rơ moóc kinh doanh vận tải hàng hóa, xe ô tô tải kinh doanh vận tải hàng hóa thông thường và xe taxi tải phải có phù hiệu “xe tải” theo mẫu số 09 phụ lục XIII kèm theo nghị định này và được dán cố định tại góc trên bên phải ngay sát phía dưới vị trí của tem kiểm định, mặt trong kính chắn gió phía trước của xe.

7. Đơn vị kinh doanh vận tải hàng hóa phải chịu trách nhiệm thực hiện đúng quy định việc xếp hàng hóa lên xe ô tô.

8. Đơn vị kinh doanh vận tải hàng hóa phải cấp cho lái xe giấy vận tải trong quá trình vận chuyển hàng hóa trên đường. Giấy vận tải phải có xác nhận (ký, ghi rõ họ và tên) khối lượng hàng hóa đã xếp lên phương tiện của chủ hàng (hoặc người được chủ hàng ủy quyền) hoặc đại diện đơn vị, cá nhân thực hiện việc xếp hàng.

9. Khi vận chuyển hàng hóa, lái xe phải mang theo giấy vận tải (giấy vận chuyển) bằng văn bản giấy hoặc phải có thiết bị để truy cập vào phần mềm thể hiện nội dung của giấy vận tải và các giấy tờ của lái xe và phương tiện theo quy định của pháp luật. Đơn vị kinh doanh vận tải và lái xe không được chở hàng vượt quá khối lượng cho phép tham gia giao thông.


Tóm lại: Văn bản này không đề cập cụ thể về việc sử dụng xe ô tô chở hàng dễ hỏng mà chỉ quy định chung về kinh doanh vận tải hàng hóa bằng xe ô tô, bao gồm các loại hình kinh doanh, điều kiện kinh doanh, trách nhiệm của đơn vị kinh doanh vận tải và lái xe. Để tìm hiểu về quy định cụ thể cho việc vận chuyển hàng dễ hỏng, cần tham khảo các văn bản pháp luật khác.
",Xe ô tô chở hàng dễ hỏng phải được trang bị thiết bị bảo quản phù hợp và tuân thủ các quy định về vệ sinh.,0.8571428571428571,0.0,0.0,0.0
69,"Quy định mới về việc sử dụng xe ô tô chở hàng quá khổ, quá tải là gì?","['thông tư này quy định về tải trọng, khổ giới hạn của đường bộ; lưu hành xe quá khổ giới hạn, xe quá tải trọng, xe bánh xích trên đường bộ; hàng siêu trường, siêu trọng, vận chuyển hàng siêu trường, siêu trọng; xếp hàng hóa trên phương tiện giao thông đường bộ; cấp giấy phép lưu hành cho xe quá tải trọng, xe quá khổ giới hạn, xe bánh xích, xe vận chuyển hàng siêu trường, siêu trọng trên đường bộ.']","**Nguồn văn bản:** 39_2024_TT-BGTVT_633952

**Tên văn bản:** Thông tư Quy định về tải trọng, khổ giới hạn của đường bộ; lưu hành xe quá khổ giới hạn, xe quá tải trọng, xe bánh xích trên đường bộ; hàng siêu trường, siêu trọng, vận chuyển hàng siêu trường, siêu trọng; xếp hàng hóa trên phương tiện giao thông đường bộ; cấp giấy phép lưu hành cho xe quá tải trọng, xe quá khổ giới hạn, xe bánh xích, xe vận chuyển hàng siêu trường, siêu trọng trên đường bộ

**Điều 1:** Phạm vi điều chỉnh

**Nội dung:**

Thông tư này quy định về tải trọng, khổ giới hạn của đường bộ; lưu hành xe quá khổ giới hạn, xe quá tải trọng, xe bánh xích trên đường bộ; hàng siêu trường, siêu trọng, vận chuyển hàng siêu trường, siêu trọng; xếp hàng hóa trên phương tiện giao thông đường bộ; cấp giấy phép lưu hành cho xe quá tải trọng, xe quá khổ giới hạn, xe bánh xích, xe vận chuyển hàng siêu trường, siêu trọng trên đường bộ.

**Tóm lại:** Thông tư này quy định toàn diện về tải trọng, khổ giới hạn đường bộ, lưu hành xe quá khổ, quá tải, vận chuyển hàng siêu trường, siêu trọng và cấp phép lưu hành cho các loại xe này.
","Cấm xe ô tô chở hàng quá khổ, quá tải lưu thông trên đường bộ; trường hợp đặc biệt phải có giấy phép và tuân thủ các quy định an toàn.",0.5,0.1652114486019488,0.0,0.0
70,Luật Giao thông Đường bộ 2025 có quy định gì về việc sử dụng xe ô tô chở hàng nguy hiểm?,"['1. đơn vị kinh doanh vận tải có giấy phép kinh doanh vận tải bằng ô tô, trong đó có một hoặc các loại hình kinh doanh vận tải hàng hóa bằng xe ô tô quy định tại khoản 2, khoản 3 và khoản 4 điều này thì được tham gia kinh doanh vận tải hàng hóa bằng xe ô tô theo loại hình đã đăng ký. 2. kinh doanh vận tải hàng hóa bằng xe taxi tải là việc sử dụng xe ô tô có trọng tải từ 1.500 ki-lô-gam trở xuống để vận chuyển hàng hóa và người thuê vận tải trả tiền cho lái xe theo đồng hồ tính tiền hoặc theo phần mềm tính tiền trên xe. mặt ngoài hai bên thành xe hoặc cánh cửa xe niêm yết cụm từ “taxi tải” theo mẫu số 08 phụ lục xiii kèm theo nghị định này, số điện thoại liên lạc, tên đơn vị kinh doanh vận tải. 3. kinh doanh vận tải hàng hóa siêu trường, siêu trọng a) kinh doanh vận tải hàng hóa siêu trường, siêu trọng là việc sử dụng xe ô tô để vận chuyển hàng không thể chia nhỏ, tháo rời, khi vận chuyển trên đường bộ làm cho phương tiện hoặc tổ hợp phương tiện bị vượt quá giới hạn cho phép tham gia giao thông đường bộ về kích thước, khối lượng theo quy định của pháp luật; b) khi vận chuyển hàng hóa siêu trường, siêu trọng, phải thực hiện theo quy định tại điều 53 luật trật tự, an toàn giao thông đường bộ. 4. kinh doanh vận tải hàng hóa nguy hiểm a) kinh doanh vận tải hàng hóa nguy hiểm là việc sử dụng xe ô tô để vận chuyển hàng hóa có chứa các chất nguy hiểm có khả năng gây nguy hại tới tính mạng, sức khỏe con người, môi trường, an toàn và an ninh quốc gia; b) khi vận chuyển hàng hóa nguy hiểm phải thực hiện theo quy định tại điều 51 luật trật tự, an toàn giao thông đường bộ. 5. kinh doanh vận tải hàng hóa thông thường là hình thức kinh doanh vận tải hàng hóa, trừ các hình thức kinh doanh vận tải quy định tại các khoản 2, khoản 3 điều này. 6. xe ô tô đầu kéo kéo rơ moóc hoặc sơ mi rơ moóc kinh doanh vận tải hàng hóa, xe ô tô tải kinh doanh vận tải hàng hóa thông thường và xe taxi tải phải có phù hiệu “xe tải” theo mẫu số 09 phụ lục xiii kèm theo nghị định này và được dán cố định tại góc trên bên phải ngay sát phía dưới vị trí của tem kiểm định, mặt trong kính chắn gió phía trước của xe. 7. đơn vị kinh doanh vận tải hàng hóa phải chịu trách nhiệm thực hiện đúng quy định việc xếp hàng hóa lên xe ô tô. 8. đơn vị kinh doanh vận tải hàng hóa phải cấp cho lái xe giấy vận tải trong quá trình vận chuyển hàng hóa trên đường. giấy vận tải phải có xác nhận (ký, ghi rõ họ và tên) khối lượng hàng hóa đã xếp lên phương tiện của chủ hàng (hoặc người được chủ hàng ủy quyền) hoặc đại diện đơn vị, cá nhân thực hiện việc xếp hàng. 9. khi vận chuyển hàng hóa, lái xe phải mang theo giấy vận tải (giấy vận chuyển) bằng văn bản giấy hoặc phải có thiết bị để truy cập vào phần mềm thể hiện nội dung của giấy vận tải và các giấy tờ của lái xe và phương tiện theo quy định của pháp luật. đơn vị kinh doanh vận tải và lái xe không được chở hàng vượt quá khối lượng cho phép tham gia giao thông. 10. đối với hoạt động vận chuyển xe đạp, xe mô tô, xe gắn máy và các loại xe tương tự qua hầm đường bộ áp dụng theo quy định tại khoản 4 điều này. 11. giấy vận tải bằng văn bản giấy hoặc điện tử do đơn vị kinh doanh vận tải hàng hóa tự phát hành và có các thông tin tối thiểu gồm: tên đơn vị vận tải; biển kiểm soát xe; tên đơn vị hoặc người thuê vận tải; hành trình (điểm đầu, điểm cuối); số hợp đồng, ngày tháng năm ký hợp đồng (nếu có); loại hàng và khối lượng hàng vận chuyển trên xe. đơn vị kinh doanh vận tải hàng hóa phải thực hiện lưu trữ giấy vận tải của các chuyến xe đã thực hiện trong thời gian tối thiểu 03 năm. 12. việc bồi thường hàng hóa hư hỏng, mất mát, thiếu hụt được thực hiện theo hợp đồng vận chuyển hoặc theo thỏa thuận giữa người kinh doanh vận tải và người thuê vận tải.']","**Nguồn văn bản:** 158_2024_ND-CP_636875

**Tên văn bản:** Nghị định Quy định về hoạt động vận tải đường bộ

**Điều 8:** kinh doanh vận tải hàng hóa bằng xe ô tô

**Nội dung:**

4. Kinh doanh vận tải hàng hóa nguy hiểm

	a) Kinh doanh vận tải hàng hóa nguy hiểm là việc sử dụng xe ô tô để vận chuyển hàng hóa có chứa các chất nguy hiểm có khả năng gây nguy hại tới tính mạng, sức khỏe con người, môi trường, an toàn và an ninh quốc gia.

	b) Khi vận chuyển hàng hóa nguy hiểm phải thực hiện theo quy định tại Điều 51 Luật Trật tự, An toàn giao thông đường bộ.


Tóm lại: Việc kinh doanh vận tải hàng hóa nguy hiểm bằng xe ô tô phải tuân thủ quy định tại Điều 51 của Luật Trật tự, An toàn giao thông đường bộ.
",Xe ô tô chở hàng nguy hiểm phải có giấy phép đặc biệt và tuân thủ các quy định về an toàn và môi trường.,0.75,0.5394289244126388,0.0,0.0
71,Quy định mới về việc sử dụng xe ô tô chở vật liệu xây dựng là gì?,"['1. đơn vị vận tải phải lựa chọn phương tiện phù hợp với kích thước, khối lượng hàng hóa vận chuyển. hàng hóa được vận chuyển phải phù hợp với kết cấu của khoang chứa hàng và công năng của phương tiện vận chuyển. 2. việc xếp hàng hóa trên phương tiện giao thông đường bộ khi tham gia giao thông trên đường bộ phải tuân thủ các quy định về khối lượng toàn bộ của xe, tải trọng trục xe, cụm trục xe, chiều cao, chiều rộng, chiều dài xếp hàng hóa cho phép của xe quy định tại điều 14, điều 15, điều 16 và điều 17 của thông tư này và không vượt quá khối lượng hàng hóa chuyên chở cho phép tham gia giao thông ghi trong giấy chứng nhận kiểm định an toàn kỹ thuật và bảo vệ môi trường của xe trừ trường hợp được cấp giấy phép lưu hành xe quá tải trọng, xe quá khổ giới hạn, xe vận chuyển hàng siêu trường, siêu trọng trên đường bộ. 3. hàng hóa xếp trên phương tiện phải được xếp đặt gọn gàng, xếp dàn đều, chằng buộc chắc chắn, chèn, lót đảm bảo không bị xê dịch theo các phương ngang, phương dọc và phương thẳng đứng; đảm bảo các quy định về vệ sinh môi trường; không để rơi vãi khi phương tiện tham gia giao thông; không cản trở tầm nhìn của lái xe; không làm mất thăng bằng của phương tiện hoặc gây khó khăn cho lái xe khi điều khiển; không che khuất đèn, biển số đăng ký và các cảnh báo an toàn của phương tiện. một số trang thiết bị thường dùng để gia cố, chằng buộc, chèn, lót hàng hóa được hướng dẫn tại phụ lục x ban hành kèm theo thông tư này. 4. đối với các loại hàng hóa là máy móc, phương tiện giao thông, trước khi xếp lên phương tiện phải rút hết nhiên liệu ra khỏi bình chứa. phương pháp xếp hàng hóa là máy móc, phương tiện giao thông được hướng dẫn tại phụ lục xi ban hành kèm theo thông tư này. 5. việc xếp hàng hóa trên phương tiện đối với các loại hàng hóa đã được đóng gói thành bao, kiện, thùng, cuộn, khối thực hiện theo hướng dẫn của nhà sản xuất. 6. việc xếp các loại hàng hóa nguy hiểm trên phương tiện thực hiện theo quy định về vận chuyển hàng hóa nguy hiểm bằng phương tiện giao thông cơ giới đường bộ và quy định tại chương này.']","**Nguồn văn bản:** 39_2024_TT-BGTVT_633952

**Tên văn bản:** Thông tư Quy định về tải trọng, khổ giới hạn của đường bộ; lưu hành xe quá khổ giới hạn, xe quá tải trọng, xe bánh xích trên đường bộ; hàng siêu trường, siêu trọng, vận chuyển hàng siêu trường, siêu trọng; xếp hàng hóa trên phương tiện giao thông đường bộ; cấp giấy phép lưu hành cho xe quá tải trọng, xe quá khổ giới hạn, xe bánh xích, xe vận chuyển hàng siêu trường, siêu trọng trên đường bộ

**Điều 13:** quy định chung về xếp hàng hóa trên phương tiện giao thông đường bộ

**Nội dung:**

1. Đơn vị vận tải phải lựa chọn phương tiện phù hợp với kích thước, khối lượng hàng hóa vận chuyển. Hàng hóa được vận chuyển phải phù hợp với kết cấu của khoang chứa hàng và công năng của phương tiện vận chuyển.

2. Việc xếp hàng hóa trên phương tiện giao thông đường bộ khi tham gia giao thông trên đường bộ phải tuân thủ các quy định về khối lượng toàn bộ của xe, tải trọng trục xe, cụm trục xe, chiều cao, chiều rộng, chiều dài xếp hàng hóa cho phép của xe quy định tại điều 14, điều 15, điều 16 và điều 17 của thông tư này và không vượt quá khối lượng hàng hóa chuyên chở cho phép tham gia giao thông ghi trong giấy chứng nhận kiểm định an toàn kỹ thuật và bảo vệ môi trường của xe trừ trường hợp được cấp giấy phép lưu hành xe quá tải trọng, xe quá khổ giới hạn, xe vận chuyển hàng siêu trường, siêu trọng trên đường bộ.

3. Hàng hóa xếp trên phương tiện phải được xếp đặt gọn gàng, xếp dàn đều, chằng buộc chắc chắn, chèn, lót đảm bảo không bị xê dịch theo các phương ngang, phương dọc và phương thẳng đứng; đảm bảo các quy định về vệ sinh môi trường; không để rơi vãi khi phương tiện tham gia giao thông; không cản trở tầm nhìn của lái xe; không làm mất thăng bằng của phương tiện hoặc gây khó khăn cho lái xe khi điều khiển; không che khuất đèn, biển số đăng ký và các cảnh báo an toàn của phương tiện. Một số trang thiết bị thường dùng để gia cố, chằng buộc, chèn, lót hàng hóa được hướng dẫn tại phụ lục X ban hành kèm theo thông tư này.

4. Đối với các loại hàng hóa là máy móc, phương tiện giao thông, trước khi xếp lên phương tiện phải rút hết nhiên liệu ra khỏi bình chứa. Phương pháp xếp hàng hóa là máy móc, phương tiện giao thông được hướng dẫn tại phụ lục XI ban hành kèm theo thông tư này.

5. Việc xếp hàng hóa trên phương tiện đối với các loại hàng hóa đã được đóng gói thành bao, kiện, thùng, cuộn, khối thực hiện theo hướng dẫn của nhà sản xuất.

6. Việc xếp các loại hàng hóa nguy hiểm trên phương tiện thực hiện theo quy định về vận chuyển hàng hóa nguy hiểm bằng phương tiện giao thông cơ giới đường bộ và quy định tại chương này.


**Tóm lại:**  Khi chở vật liệu xây dựng bằng ô tô, cần tuân thủ quy định về kích thước, khối lượng hàng hóa phù hợp với xe. Việc xếp hàng phải đảm bảo an toàn, gọn gàng, chắc chắn, không gây cản trở giao thông, không che khuất tầm nhìn và không vượt quá tải trọng cho phép. Cần tuân thủ các quy định tại Điều 14, 15, 16, 17 của Thông tư này và các quy định về vận chuyển hàng nguy hiểm (nếu có).  Đối với máy móc, phương tiện giao thông, cần rút hết nhiên liệu trước khi xếp lên xe.
",Xe ô tô chở vật liệu xây dựng phải được che phủ kín để tránh rơi vãi và gây ô nhiễm môi trường.,1.0,0.4921613405456869,0.0,0.0
72,Luật Giao thông Đường bộ 2025 có quy định gì về việc sử dụng xe ô tô chở rác thải?,"['thông tư quy định về phân loại phương tiện giao thông đường bộ và dấu hiệu nhận biết xe cơ giới sử dụng năng lượng sạch, năng lượng xanh, thân thiện môi trường.']","**Nguồn văn bản:** 53_2024_TT-BGTVT_624420

**Tên văn bản:** Thông tư Quy định về phân loại phương tiện giao thông đường bộ và dấu hiệu nhận biết xe cơ giới sử dụng năng lượng sạch, năng lượng xanh, thân thiện môi trường

**điều 1:** phạm vi điều chỉnh

**Nội dung:**

Thông tư quy định về phân loại phương tiện giao thông đường bộ và dấu hiệu nhận biết xe cơ giới sử dụng năng lượng sạch, năng lượng xanh, thân thiện môi trường.

Tóm lại: Văn bản này không chứa thông tin về luật giao thông đường bộ liên quan đến việc sử dụng xe ô tô chở rác thải.
","Xe ô tô chở rác thải phải được che phủ kín, không để rò rỉ nước thải và tuân thủ các quy định về vệ sinh môi trường.",0.4,0.5939785470045188,0.0,0.0
73,Quy định mới về việc sử dụng xe ô tô chở động vật sống là gì?,"['1. việc vận chuyển động vật sống phải bảo đảm các yêu cầu sau đây: a) người lái xe phải mang đủ giấy tờ theo quy định của pháp luật; b) phương tiện vận chuyển phải có kết cấu phù hợp với loại động vật chuyên chở; c) trong quá trình vận chuyển phải chấp hành các quy định của pháp luật về trật tự, an toàn giao thông đường bộ, vệ sinh dịch tễ, phòng dịch và bảo đảm vệ sinh môi trường. 2. việc vận chuyển thực phẩm tươi sống phải bảo đảm các yêu cầu sau đây: a) người lái xe phải mang đủ giấy tờ theo quy định của pháp luật; b) trong quá trình vận chuyển phải chấp hành các quy định của pháp luật về trật tự, an toàn giao thông đường bộ, an toàn thực phẩm, vệ sinh dịch tễ, phòng dịch và bảo đảm vệ sinh môi trường.']","**Nguồn văn bản:** 36_2024_QH15_444251

**Tên văn bản:** Luật Trật tự, an toàn giao thông đường bộ

**Điều 50:** Bảo đảm trật tự, an toàn giao thông đường bộ đối với phương tiện giao thông đường bộ vận chuyển động vật sống, thực phẩm tươi sống

**Nội dung:**

1. Việc vận chuyển động vật sống phải bảo đảm các yêu cầu sau đây:

	a) Người lái xe phải mang đủ giấy tờ theo quy định của pháp luật.

	b) Phương tiện vận chuyển phải có kết cấu phù hợp với loại động vật chuyên chở.

	c) Trong quá trình vận chuyển phải chấp hành các quy định của pháp luật về trật tự, an toàn giao thông đường bộ, vệ sinh dịch tễ, phòng dịch và bảo đảm vệ sinh môi trường.

2. Việc vận chuyển thực phẩm tươi sống phải bảo đảm các yêu cầu sau đây:

	a) Người lái xe phải mang đủ giấy tờ theo quy định của pháp luật.

	b) Trong quá trình vận chuyển phải chấp hành các quy định của pháp luật về trật tự, an toàn giao thông đường bộ, an toàn thực phẩm, vệ sinh dịch tễ, phòng dịch và bảo đảm vệ sinh môi trường.


Tóm lại: Xe ô tô chở động vật sống phải có giấy tờ hợp lệ, kết cấu phù hợp với động vật vận chuyển và tuân thủ quy định về trật tự an toàn giao thông, vệ sinh dịch tễ, phòng dịch và bảo vệ môi trường.
","Xe ô tô chở động vật sống phải đảm bảo vệ sinh, an toàn cho động vật và không gây ô nhiễm môi trường.",1.0,0.4994725406616842,0.0,0.9999999999
74,Luật Giao thông Đường bộ 2025 có quy định gì về việc sử dụng xe ô tô chở cây cảnh?,"['thực hiện trách nhiệm của chủ phương tiện giao thông đường bộ theo quy định của pháp luật về thanh toán điện tử giao thông đường bộ, pháp luật về thu phí sử dụng đường cao tốc.']","Không tìm thấy thông tin liên quan tới câu hỏi này.
","Xe ô tô chở cây cảnh phải được sắp xếp gọn gàng, đảm bảo an toàn và không cản trở tầm nhìn của người lái.",0.0,0.0,0.0,0.0
75,Quy định mới về việc sử dụng xe ô tô chở hàng dễ cháy nổ là gì?,"['1. phạt tiền từ 500.000 đồng đến 1.000.000 đồng đối với cá nhân, từ 1.000.000 đồng đến 2.000.000 đồng đối với tổ chức thực hiện một trong các hành vi vi phạm sau đây: a) xếp hàng hóa lên mỗi xe ô tô (kể cả rơ moóc và sơ mi rơ moóc) vượt quá trọng tải (khối lượng hàng chuyên chở) cho phép tham gia giao thông được ghi trong giấy chứng nhận kiểm định an toàn kỹ thuật và bảo vệ môi trường của xe trên 10% đến 50% (trừ xe xi téc chở chất lỏng), trên 20% đến 50% đối với xe xi téc chở chất lỏng; b) xếp hàng hóa lên xe ô tô mà không ký xác nhận việc xếp hàng hóa vào giấy vận tải theo quy định. 2. phạt tiền từ 1.000.000 đồng đến 2.000.000 đồng đối với cá nhân, từ 2.000.000 đồng đến 4.000.000 đồng đối với tổ chức kinh doanh vận tải, dịch vụ hỗ trợ vận tải thực hiện một trong các hành vi vi phạm sau đây: a) không đánh số thứ tự ghế ngồi, giường nằm trên xe ô tô chở hành khách theo quy định; b) sử dụng xe ô tô kinh doanh vận tải hành khách theo tuyến cố định, xe ô tô kinh doanh vận tải hành khách bằng xe buýt không có chỗ ưu tiên cho người khuyết tật, người cao tuổi và phụ nữ mang thai theo quy định; c) sử dụng xe ô tô kinh doanh vận tải hành khách không có hướng dẫn cho hành khách về an toàn giao thông, thoát hiểm khi xảy ra sự cố trên xe theo quy định; d) không bố trí người áp tải trên xe vận chuyển hàng hóa nguy hiểm đối với những trường hợp quy định phải có người áp tải; đ) không cấp lệnh vận chuyển, giấy vận tải cho lái xe hoặc cấp lệnh vận chuyển, giấy vận tải nhưng không đúng theo quy định (đối với loại xe quy định phải cấp lệnh vận chuyển, giấy vận tải); e) sử dụng xe vận chuyển hàng hóa nguy hiểm mà không làm sạch hoặc không bóc (xóa) biểu trưng nguy hiểm trên phương tiện khi không tiếp tục vận chuyển loại hàng hóa đó. 3. phạt tiền từ 2.000.000 đồng đến 3.000.000 đồng đối với cá nhân, từ 4.000.000 đồng đến 6.000.000 đồng đối với tổ chức thực hiện hành vi vi phạm xếp hàng hóa lên mỗi xe ô tô (kể cả rơ moóc và sơ mi rơ moóc) vượt quá trọng tải (khối lượng hàng chuyên chở) cho phép tham gia giao thông được ghi trong giấy chứng nhận kiểm định an toàn kỹ thuật và bảo vệ môi trường của xe trên 50% đến 100%. 4. phạt tiền từ 3.000.000 đồng đến 4.000.000 đồng đối với cá nhân, từ 6.000.000 đồng đến 8.000.000 đồng đối với tổ chức kinh doanh vận tải, dịch vụ hỗ trợ vận tải thực hiện một trong các hành vi vi phạm sau đây: a) không cấp thẻ nhận dạng lái xe cho lái xe theo quy định; b) sử dụng lái xe, nhân viên phục vụ trên xe để tham gia kinh doanh vận tải bằng xe ô tô mà không được tập huấn, hướng dẫn về nghiệp vụ vận tải hành khách và an toàn giao thông theo quy định (đối với hình thức kinh doanh vận tải có quy định lái xe, nhân viên phục vụ trên xe phải được tập huấn, hướng dẫn nghiệp vụ), trừ các hành vi vi phạm quy định tại điểm c, điểm d khoản này; c) sử dụng lái xe, người quản lý trên xe để tham gia kinh doanh vận tải bằng xe ô tô mà không được hướng dẫn về quy trình bảo đảm an toàn khi đưa đón trẻ em mầm non, học sinh; d) sử dụng lái xe, người áp tải vận chuyển hàng hóa nguy hiểm mà không được tập huấn về vận chuyển hàng hóa nguy hiểm; đ) sử dụng xe ô tô kinh doanh vận tải hành khách không có dây đai an toàn tại các vị trí ghế ngồi, giường nằm theo quy định (trừ xe buýt nội tỉnh); e) sử dụng xe ô tô kinh doanh vận tải chở trẻ em mầm non, học sinh tiểu học, xe ô tô kinh doanh vận tải kết hợp với hoạt động đưa đón trẻ em mầm non, học sinh tiểu học không có dây đai an toàn phù hợp với lứa tuổi hoặc không có ghế ngồi phù hợp với lứa tuổi theo quy định; g) không thực hiện việc niêm yết thông tin trên xe theo quy định hoặc có niêm yết nhưng không chính xác, không đầy đủ thông tin theo quy định. 5. phạt tiền từ 4.000.000 đồng đến 5.000.000 đồng đối với cá nhân, từ 8.000.000 đồng đến 10.000.000 đồng đối với tổ chức xếp hàng hóa lên mỗi xe ô tô (kể cả rơ moóc và sơ mi rơ moóc) vượt quá trọng tải (khối lượng hàng chuyên chở) cho phép tham gia giao thông được ghi trong giấy chứng nhận kiểm định an toàn kỹ thuật và bảo vệ môi trường của xe trên 100%. 6. phạt tiền từ 4.000.000 đồng đến 6.000.000 đồng đối với cá nhân, từ 8.000.000 đồng đến 12.000.000 đồng đối với tổ chức kinh doanh vận tải thực hiện một trong các hành vi vi phạm sau đây: a) sử dụng xe vận chuyển động vật sống không có kết cấu phù hợp với loại động vật chuyên chở theo quy định; b) sử dụng xe ô tô kinh doanh vận tải chở trẻ em mầm non, học sinh, xe ô tô kinh doanh vận tải kết hợp với hoạt động đưa đón trẻ em mầm non, học sinh không có thiết bị ghi nhận hình ảnh trẻ em mầm non, học sinh hoặc không có thiết bị có chức năng cảnh báo, chống bỏ quên trẻ em trên xe hoặc không có thiết bị ghi nhận hình ảnh trẻ em mầm non, học sinh và thiết bị có chức năng cảnh báo, chống bỏ quên trẻ em trên xe; c) sử dụng xe ô tô kinh doanh vận tải chở trẻ em mầm non, học sinh không có màu sơn theo quy định; d) sử dụng xe ô tô kinh doanh vận tải chở trẻ em mầm non, học sinh, xe ô tô kinh doanh vận tải kết hợp với hoạt động đưa đón trẻ em mầm non, học sinh không có biển báo dấu hiệu nhận biết là xe chở trẻ em mầm non, học sinh theo quy định. 7. phạt tiền từ 5.000.000 đồng đến 6.000.000 đồng đối với cá nhân, từ 10.000.000 đồng đến 12.000.000 đồng đối với tổ chức kinh doanh vận tải, dịch vụ hỗ trợ vận tải thực hiện một trong các hành vi vi phạm sau đây: a) không thực hiện việc cung cấp, cập nhật, truyền, lưu trữ, quản lý thông tin, dữ liệu từ thiết bị giám sát hành trình theo quy định; b) không thực hiện đúng nội dung thông tin đã niêm yết trên xe theo quy định; c) sử dụng phương tiện kinh doanh vận tải không lắp thiết bị giám sát hành trình của xe (đối với hình thức kinh doanh vận tải có quy định phương tiện phải lắp thiết bị) hoặc lắp thiết bị nhưng thiết bị không hoạt động, không đúng quy chuẩn theo quy định hoặc làm sai lệch dữ liệu của thiết bị giám sát hành trình của xe ô tô; d) sử dụng xe trung chuyển chở hành khách không đúng quy định; đ) sử dụng lái xe điều khiển xe khách giường nằm hai tầng, xe ô tô đưa đón trẻ em mầm non, học sinh chưa đủ số năm kinh nghiệm theo quy định; e) sử dụng xe kinh doanh vận tải hành khách theo hợp đồng mà trên xe không có hợp đồng vận tải, danh sách hành khách kèm theo, thiết bị để truy cập nội dung hợp đồng điện tử và danh sách hành khách theo quy định hoặc có hợp đồng vận tải, danh sách hành khách, thiết bị để truy cập nhưng không bảo đảm yêu cầu theo quy định, chở người không có tên trong danh sách hành khách hoặc vận chuyển không đúng đối tượng theo quy định (đối với xe kinh doanh vận tải hành khách theo hợp đồng vận chuyển trẻ em mầm non, học sinh, sinh viên, cán bộ, công chức, viên chức, công nhân); g) sử dụng xe ô tô kinh doanh vận tải không lắp thiết bị ghi nhận hình ảnh người lái xe theo quy định (đối với loại xe có quy định phải lắp thiết bị ghi nhận hình ảnh người lái xe) hoặc có lắp thiết bị ghi nhận hình ảnh người lái xe nhưng không ghi, không lưu trữ được dữ liệu trên xe trong quá trình xe tham gia giao thông theo quy định hoặc làm sai lệch dữ liệu của thiết bị ghi nhận hình ảnh người lái xe lắp trên xe ô tô; h) không thực hiện việc cung cấp, cập nhật, truyền dẫn, lưu trữ, quản lý thông tin, dữ liệu thu thập từ thiết bị ghi nhận hình ảnh người lái xe lắp trên xe ô tô theo quy định; i) sử dụng phương tiện kinh doanh vận tải có niên hạn sử dụng không bảo đảm điều kiện của hình thức kinh doanh đã đăng ký. 8. phạt tiền từ 10.000.000 đồng đến 12.000.000 đồng đối với cá nhân, từ 20.000.000 đồng đến 24.000.000 đồng đối với tổ chức kinh doanh vận tải, dịch vụ hỗ trợ vận tải thực hiện một trong các hành vi vi phạm sau đây: a) không tổ chức khám sức khỏe định kỳ cho lái xe theo quy định hoặc có tổ chức khám nhưng không đầy đủ các nội dung theo quy định; b) vi phạm quy định về kinh doanh, điều kiện kinh doanh vận tải bằng xe ô tô để xảy ra tai nạn giao thông gây hậu quả từ mức nghiêm trọng trở lên; c) sử dụng xe ô tô kinh doanh vận tải để đón, trả khách; nhận, trả hàng trên đường cao tốc. 9. phạt tiền từ 20.000.000 đồng đến 40.000.000 đồng đối với đơn vị sản xuất, lắp ráp, nhập khẩu thiết bị giám sát hành trình của xe ô tô, đơn vị cung cấp dịch vụ liên quan đến giám sát hành trình, ghi nhận hình ảnh người lái xe thực hiện một trong các hành vi sau: a) đơn vị sản xuất, lắp ráp, nhập khẩu thiết bị giám sát hành trình của xe ô tô không có nhân sự cho từng vị trí công việc theo quy định; b) đơn vị sản xuất, lắp ráp, nhập khẩu thiết bị giám sát hành trình của xe ô tô không báo cáo về việc cập nhật, thay đổi phần mềm của thiết bị theo quy định. 10. phạt tiền từ 40.000.000 đồng đến 60.000.000 đồng đối với đơn vị sản xuất, lắp ráp, nhập khẩu thiết bị ghi nhận hình ảnh người lái xe lắp trên xe ô tô, đơn vị cung cấp dịch vụ liên quan đến giám sát hành trình, ghi nhận hình ảnh người lái xe thực hiện một trong các hành vi vi phạm sau đây: a) làm sai lệch thông tin, dữ liệu của thiết bị giám sát hành trình của xe ô tô; b) làm sai lệch thông tin, dữ liệu của thiết bị ghi nhận hình ảnh người lái xe lắp trên xe ô tô. 11. phạt tiền từ 40.000.000 đồng đến 50.000.000 đồng đối với cá nhân, từ 80.000.000 đồng đến 100.000.000 đồng đối với tổ chức kinh doanh vận tải, dịch vụ hỗ trợ vận tải tái phạm hành vi quy định tại điểm a, điểm h khoản 7 điều này. 12. ngoài việc bị phạt tiền, cá nhân, tổ chức thực hiện hành vi vi phạm quy định tại điểm c khoản 2; điểm a, điểm b, điểm đ, điểm g khoản 4; điểm b, điểm c, điểm d, điểm đ, điểm e, điểm g khoản 7; điểm c khoản 8 điều này còn bị áp dụng các hình thức xử phạt bổ sung tước quyền sử dụng phù hiệu từ 01 tháng đến 03 tháng (nếu có hoặc đã được cấp) đối với xe vi phạm. 13. ngoài việc bị áp dụng hình thức xử phạt, cá nhân, tổ chức thực hiện hành vi vi phạm còn bị áp dụng các biện pháp khắc phục hậu quả sau đây: a) thực hiện hành vi quy định tại điểm a khoản 4 điều này buộc cấp thẻ nhận dạng lái xe cho lái xe theo quy định; b) thực hiện hành vi quy định tại điểm b, điểm c, điểm d khoản 4; điểm a khoản 8 điều này buộc tổ chức tập huấn, hướng dẫn nghiệp vụ, quy trình hoặc tổ chức khám sức khỏe định kỳ cho lái xe và nhân viên phục vụ trên xe theo quy định; c) thực hiện hành vi quy định tại điểm đ, điểm e khoản 4; điểm c, điểm g khoản 7 điều này buộc lắp đặt thiết bị giám sát hành trình, thiết bị ghi nhận hình ảnh người lái xe, dây đai an toàn, ghế ngồi cho trẻ em mầm non, học sinh tiểu học trên xe theo đúng quy định; d) thực hiện hành vi quy định tại điểm a, điểm h khoản 7; khoản 11 điều này buộc cung cấp, cập nhật, truyền dẫn, lưu trữ, quản lý thông tin, dữ liệu thu thập từ thiết bị giám sát hành trình, thiết bị ghi nhận hình ảnh người lái xe lắp trên xe ô tô theo quy định; đ) thực hiện hành vi quy định tại điểm c, điểm d khoản 6 điều này buộc thực hiện đúng quy định về màu sơn, biển báo dấu hiệu nhận biết của xe. 14. ngoài việc bị áp dụng hình thức xử phạt, người điều khiển phương tiện thực hiện hành vi vi phạm còn bị trừ điểm giấy phép lái xe như sau: a) thực hiện hành vi quy định tại điểm đ khoản 2; điểm b, điểm c, điểm d khoản 6; điểm b, điểm c, điểm e, điểm i khoản 7 điều này trong trường hợp cá nhân kinh doanh vận tải là người trực tiếp điều khiển phương tiện còn bị trừ điểm giấy phép lái xe 02 điểm; b) thực hiện hành vi quy định tại điểm c khoản 8 điều này trong trường hợp cá nhân kinh doanh vận tải là người trực tiếp điều khiển phương tiện còn bị trừ điểm giấy phép lái xe 06 điểm.']","**Nguồn văn bản:** 168_2024_ND-CP_619502

**Tên văn bản:** Nghị định Quy định xử phạt vi phạm hành chính về trật tự, an toàn giao thông trong lĩnh vực giao thông đường bộ; trừ điểm, phục hồi điểm giấy phép lái xe

**Điều 26:** xử phạt các hành vi vi phạm quy định về trật tự, an toàn giao thông đường bộ trong vận tải đường bộ, dịch vụ hỗ trợ vận tải đường bộ

**Nội dung:**  
Văn bản này không đề cập cụ thể đến quy định về việc sử dụng xe ô tô chở hàng dễ cháy nổ. Tuy nhiên, khoản 2 có nhắc đến việc xử phạt đối với hành vi “không bố trí người áp tải trên xe vận chuyển hàng hóa nguy hiểm đối với những trường hợp quy định phải có người áp tải”. Điều này có thể áp dụng cho việc vận chuyển hàng dễ cháy nổ nếu được phân loại là hàng hóa nguy hiểm.

**Tóm lại:** Văn bản cung cấp không có quy định cụ thể về xe chở hàng dễ cháy nổ, nhưng có quy định phạt khi không có người áp tải trên xe vận chuyển hàng nguy hiểm, có thể bao gồm cả hàng dễ cháy nổ.
","Xe ô tô chở hàng dễ cháy nổ phải có giấy phép đặc biệt, được kiểm định an toàn và tuân thủ các quy định về phòng cháy chữa cháy.",0.6666666666666666,0.6548974875617989,1.0,0.0
76,"Luật Giao thông Đường bộ 2008 gồm mấy chương, mấy điều?",['luật này quy định về quy tắc giao thông đường bộ; kết cấu hạ tầng giao thông đường bộ; phương tiện và người tham gia giao thông đường bộ; vận tải đường bộ và quản lý nhà nước về giao thông đường bộ.'],"Không tìm thấy thông tin liên quan tới câu hỏi này.
",Luật Giao thông Đường bộ 2008 gồm 8 chương và 89 điều.,0.0,-0.0,0.0,0.0
77,Đường cao tốc được định nghĩa như thế nào theo Luật Giao thông Đường bộ?,"['1. đường cao tốc phải được đặt biển báo tốc độ khai thác tối đa, tốc độ khai thác tối thiểu. 2. tốc độ khai thác tối đa cho phép trên đường cao tốc là 120 km/h. 3. tốc độ khai thác tối thiểu cho phép trên đường cao tốc là 60 km/h. trường hợp đường cao tốc có tốc độ thiết kế 60 km/h thì tốc độ khai thác tối thiểu thực hiện theo phương án tổ chức giao thông được cấp có thẩm quyền phê duyệt. 4. trị số tốc độ khai thác tối đa, tối thiểu cho phép trên đường cao tốc, kể cả các đường nhánh ra, vào đường cao tốc được xác định trong phương án tổ chức giao thông được cấp có thẩm quyền phê duyệt.']","**Nguồn văn bản:** 38_2024_TT-BGTVT_622477

**Tên văn bản:** Thông tư Quy định về tốc độ và khoảng cách an toàn của xe cơ giới, xe máy chuyên dùng tham gia giao thông trên đường bộ

**Điều 9:** Tốc độ khai thác tối đa, tốc độ khai thác tối thiểu cho phép đối với các loại xe cơ giới, xe máy chuyên dùng trên đường cao tốc

**Nội dung:**

1. Đường cao tốc phải được đặt biển báo tốc độ khai thác tối đa, tốc độ khai thác tối thiểu.

2. Tốc độ khai thác tối đa cho phép trên đường cao tốc là 120 km/h.

3. Tốc độ khai thác tối thiểu cho phép trên đường cao tốc là 60 km/h.

Trường hợp đường cao tốc có tốc độ thiết kế 60 km/h thì tốc độ khai thác tối thiểu thực hiện theo phương án tổ chức giao thông được cấp có thẩm quyền phê duyệt.

4. Trị số tốc độ khai thác tối đa, tối thiểu cho phép trên đường cao tốc, kể cả các đường nhánh ra, vào đường cao tốc được xác định trong phương án tổ chức giao thông được cấp có thẩm quyền phê duyệt.


Tóm lại: Văn bản này không định nghĩa đường cao tốc mà chỉ quy định về tốc độ tối đa và tối thiểu trên đường cao tốc là 120km/h và 60km/h.  Các tốc độ này được thể hiện trên biển báo và có thể được điều chỉnh theo phương án tổ chức giao thông được phê duyệt.
","Đường cao tốc là đường dành cho xe cơ giới, có dải phân cách chia đường cho xe chạy hai chiều riêng biệt; không giao nhau cùng mức với một hoặc các đường khác; được bố trí đầy đủ trang thiết bị phục vụ, bảo đảm giao thông liên tục, an toàn, rút ngắn thời gian hành trình và chỉ cho xe ra, vào ở những điểm nhất định.",1.0,0.48730092224052307,0.0,0.0
78,Người điều khiển giao thông bao gồm những ai?,"['1. trật tự, an toàn giao thông đường bộ là trạng thái giao thông trên đường bộ có trật tự, bảo đảm an toàn, thông suốt; được hình thành và điều chỉnh bởi các quy tắc, nguyên tắc, quy phạm pháp luật trong lĩnh vực giao thông đường bộ. 2. phương tiện giao thông đường bộ là các loại xe, bao gồm: phương tiện giao thông cơ giới đường bộ (sau đây gọi là xe cơ giới), phương tiện giao thông thô sơ đường bộ (sau đây gọi là xe thô sơ), xe máy chuyên dùng và các loại xe tương tự. 3. phương tiện tham gia giao thông đường bộ là phương tiện giao thông đường bộ tham gia giao thông trên đường bộ. 4. đường ưu tiên\xa0là đường mà trên đó phương tiện tham gia giao thông đường bộ được các phương tiện tham gia giao thông đường bộ đến từ hướng khác nhường đường khi qua nơi đường giao nhau, được cắm biển báo hiệu đường ưu tiên. 5. phần đường xe chạy là phần của đường bộ được sử dụng cho phương tiện giao thông đường bộ đi lại. 6. làn đường là một phần của phần đường xe chạy được chia theo chiều dọc của đường, có đủ chiều rộng cho xe chạy an toàn. 7. cải tạo xe (sau đây gọi là cải tạo) là việc thay đổi đặc điểm của xe đã được cấp đăng ký xe, biển số xe hoặc xe đã qua sử dụng được nhập khẩu dẫn đến thay đổi về kiểu loại xe theo quy định của cơ quan có thẩm quyền. 8. người tham gia giao thông đường bộ bao gồm: người điều khiển, người được chở trên phương tiện tham gia giao thông đường bộ; người điều khiển, dẫn dắt vật nuôi trên đường bộ; người đi bộ trên đường bộ. 9. người điều khiển phương tiện tham gia giao thông đường bộ bao gồm: người điều khiển xe cơ giới (sau đây gọi là người lái xe), người điều khiển xe thô sơ, người điều khiển xe máy chuyên dùng. 10. người điều khiển giao thông đường bộ (sau đây gọi là người điều khiển giao thông) bao gồm: cảnh sát giao thông và người được giao nhiệm vụ hướng dẫn giao thông trên đường bộ. 11. ùn tắc giao thông đường bộ (sau đây gọi là ùn tắc giao thông) là tình trạng người, phương tiện tham gia giao thông đường bộ bị dồn ứ, di chuyển với tốc độ rất chậm hoặc không thể di chuyển được. 12. tai nạn giao thông đường bộ là va chạm liên quan đến người, phương tiện khi tham gia giao thông đường bộ, xảy ra ngoài ý muốn của người tham gia giao thông đường bộ, gây thiệt hại đến tính mạng, sức khỏe, tài sản của cá nhân hoặc tài sản của cơ quan, tổ chức. 13. thiết bị an toàn cho trẻ em là thiết bị có đủ khả năng bảo đảm an toàn cho trẻ em ở tư thế ngồi hoặc nằm trên xe ô tô, được thiết kế để giảm nguy cơ chấn thương cho người dùng trong trường hợp xảy ra va chạm hoặc xe ô tô giảm tốc độ đột ngột, bằng cách hạn chế sự di chuyển của cơ thể trẻ em. 14. thiết bị thông minh hỗ trợ chỉ huy, điều khiển giao thông đường bộ là thiết bị kỹ thuật công nghệ có khả năng phát hiện, phân tích, đánh giá các tình huống giao thông đường bộ, vi phạm pháp luật trên đường bộ; do lực lượng chức năng sử dụng để hỗ trợ chỉ huy, điều khiển giao thông đường bộ, giải quyết tình huống và xử lý vi phạm pháp luật trên đường bộ.']","**Nguồn văn bản:** 36_2024_QH15_444251

**Tên văn bản:** Luật Trật tự, an toàn giao thông đường bộ

**Điều 2:** Giải thích từ ngữ

**Nội dung:**

10. Người điều khiển giao thông đường bộ (sau đây gọi là người điều khiển giao thông) bao gồm:

 a) Cảnh sát giao thông.

 b) Người được giao nhiệm vụ hướng dẫn giao thông trên đường bộ.


**Tóm lại:** Người điều khiển giao thông đường bộ gồm cảnh sát giao thông và người được giao nhiệm vụ hướng dẫn giao thông.
","Người điều khiển giao thông bao gồm cảnh sát giao thông và người được giao nhiệm vụ hướng dẫn giao thông tại nơi thi công, nơi ùn tắc giao thông, ở bến phà, tại cầu đường bộ đi chung với đường sắt.",1.0,0.47781742605925004,1.0,0.9999999999
79,Khái niệm 'đường phố' được định nghĩa như thế nào?,"['1. trật tự, an toàn giao thông đường bộ là trạng thái giao thông trên đường bộ có trật tự, bảo đảm an toàn, thông suốt; được hình thành và điều chỉnh bởi các quy tắc, nguyên tắc, quy phạm pháp luật trong lĩnh vực giao thông đường bộ. 2. phương tiện giao thông đường bộ là các loại xe, bao gồm: phương tiện giao thông cơ giới đường bộ (sau đây gọi là xe cơ giới), phương tiện giao thông thô sơ đường bộ (sau đây gọi là xe thô sơ), xe máy chuyên dùng và các loại xe tương tự. 3. phương tiện tham gia giao thông đường bộ là phương tiện giao thông đường bộ tham gia giao thông trên đường bộ. 4. đường ưu tiên\xa0là đường mà trên đó phương tiện tham gia giao thông đường bộ được các phương tiện tham gia giao thông đường bộ đến từ hướng khác nhường đường khi qua nơi đường giao nhau, được cắm biển báo hiệu đường ưu tiên. 5. phần đường xe chạy là phần của đường bộ được sử dụng cho phương tiện giao thông đường bộ đi lại. 6. làn đường là một phần của phần đường xe chạy được chia theo chiều dọc của đường, có đủ chiều rộng cho xe chạy an toàn. 7. cải tạo xe (sau đây gọi là cải tạo) là việc thay đổi đặc điểm của xe đã được cấp đăng ký xe, biển số xe hoặc xe đã qua sử dụng được nhập khẩu dẫn đến thay đổi về kiểu loại xe theo quy định của cơ quan có thẩm quyền. 8. người tham gia giao thông đường bộ bao gồm: người điều khiển, người được chở trên phương tiện tham gia giao thông đường bộ; người điều khiển, dẫn dắt vật nuôi trên đường bộ; người đi bộ trên đường bộ. 9. người điều khiển phương tiện tham gia giao thông đường bộ bao gồm: người điều khiển xe cơ giới (sau đây gọi là người lái xe), người điều khiển xe thô sơ, người điều khiển xe máy chuyên dùng. 10. người điều khiển giao thông đường bộ (sau đây gọi là người điều khiển giao thông) bao gồm: cảnh sát giao thông và người được giao nhiệm vụ hướng dẫn giao thông trên đường bộ. 11. ùn tắc giao thông đường bộ (sau đây gọi là ùn tắc giao thông) là tình trạng người, phương tiện tham gia giao thông đường bộ bị dồn ứ, di chuyển với tốc độ rất chậm hoặc không thể di chuyển được. 12. tai nạn giao thông đường bộ là va chạm liên quan đến người, phương tiện khi tham gia giao thông đường bộ, xảy ra ngoài ý muốn của người tham gia giao thông đường bộ, gây thiệt hại đến tính mạng, sức khỏe, tài sản của cá nhân hoặc tài sản của cơ quan, tổ chức. 13. thiết bị an toàn cho trẻ em là thiết bị có đủ khả năng bảo đảm an toàn cho trẻ em ở tư thế ngồi hoặc nằm trên xe ô tô, được thiết kế để giảm nguy cơ chấn thương cho người dùng trong trường hợp xảy ra va chạm hoặc xe ô tô giảm tốc độ đột ngột, bằng cách hạn chế sự di chuyển của cơ thể trẻ em. 14. thiết bị thông minh hỗ trợ chỉ huy, điều khiển giao thông đường bộ là thiết bị kỹ thuật công nghệ có khả năng phát hiện, phân tích, đánh giá các tình huống giao thông đường bộ, vi phạm pháp luật trên đường bộ; do lực lượng chức năng sử dụng để hỗ trợ chỉ huy, điều khiển giao thông đường bộ, giải quyết tình huống và xử lý vi phạm pháp luật trên đường bộ.']","**Nguồn văn bản:** 36_2024_QH15_444251

**Tên văn bản:** Luật Trật tự, an toàn giao thông đường bộ

**điều 2:** giải thích từ ngữ

**Nội dung:**

1. Trật tự, an toàn giao thông đường bộ là trạng thái giao thông trên đường bộ có trật tự, bảo đảm an toàn, thông suốt; được hình thành và điều chỉnh bởi các quy tắc, nguyên tắc, quy phạm pháp luật trong lĩnh vực giao thông đường bộ.

2. Phương tiện giao thông đường bộ là các loại xe, bao gồm:

	a) Phương tiện giao thông cơ giới đường bộ (sau đây gọi là xe cơ giới).

	b) Phương tiện giao thông thô sơ đường bộ (sau đây gọi là xe thô sơ).

	c) Xe máy chuyên dùng và các loại xe tương tự.

3. Phương tiện tham gia giao thông đường bộ là phương tiện giao thông đường bộ tham gia giao thông trên đường bộ.

4. Đường ưu tiên là đường mà trên đó phương tiện tham gia giao thông đường bộ được các phương tiện tham gia giao thông đường bộ đến từ hướng khác nhường đường khi qua nơi đường giao nhau, được cắm biển báo hiệu đường ưu tiên.

5. Phần đường xe chạy là phần của đường bộ được sử dụng cho phương tiện giao thông đường bộ đi lại.

6. Làn đường là một phần của phần đường xe chạy được chia theo chiều dọc của đường, có đủ chiều rộng cho xe chạy an toàn.

7. Cải tạo xe (sau đây gọi là cải tạo) là việc thay đổi đặc điểm của xe đã được cấp đăng ký xe, biển số xe hoặc xe đã qua sử dụng được nhập khẩu dẫn đến thay đổi về kiểu loại xe theo quy định của cơ quan có thẩm quyền.

8. Người tham gia giao thông đường bộ bao gồm:

	a) Người điều khiển, người được chở trên phương tiện tham gia giao thông đường bộ.

	b) Người điều khiển, dẫn dắt vật nuôi trên đường bộ.

	c) Người đi bộ trên đường bộ.

9. Người điều khiển phương tiện tham gia giao thông đường bộ bao gồm:

	a) Người điều khiển xe cơ giới (sau đây gọi là người lái xe).

	b) Người điều khiển xe thô sơ.

	c) Người điều khiển xe máy chuyên dùng.

10. Người điều khiển giao thông đường bộ (sau đây gọi là người điều khiển giao thông) bao gồm: cảnh sát giao thông và người được giao nhiệm vụ hướng dẫn giao thông trên đường bộ.

11. Ùn tắc giao thông đường bộ (sau đây gọi là ùn tắc giao thông) là tình trạng người, phương tiện tham gia giao thông đường bộ bị dồn ứ, di chuyển với tốc độ rất chậm hoặc không thể di chuyển được.

12. Tai nạn giao thông đường bộ là va chạm liên quan đến người, phương tiện khi tham gia giao thông đường bộ, xảy ra ngoài ý muốn của người tham gia giao thông đường bộ, gây thiệt hại đến tính mạng, sức khỏe, tài sản của cá nhân hoặc tài sản của cơ quan, tổ chức.

13. Thiết bị an toàn cho trẻ em là thiết bị có đủ khả năng bảo đảm an toàn cho trẻ em ở tư thế ngồi hoặc nằm trên xe ô tô, được thiết kế để giảm nguy cơ chấn thương cho người dùng trong trường hợp xảy ra va chạm hoặc xe ô tô giảm tốc độ đột ngột, bằng cách hạn chế sự di chuyển của cơ thể trẻ em.

14. Thiết bị thông minh hỗ trợ chỉ huy, điều khiển giao thông đường bộ là thiết bị kỹ thuật công nghệ có khả năng phát hiện, phân tích, đánh giá các tình huống giao thông đường bộ, vi phạm pháp luật trên đường bộ; do lực lượng chức năng sử dụng để hỗ trợ chỉ huy, điều khiển giao thông đường bộ, giải quyết tình huống và xử lý vi phạm pháp luật trên đường bộ.


Tóm lại: Không tìm thấy định nghĩa của ""đường phố"" trong đoạn văn bản được cung cấp. Văn bản này định nghĩa các thuật ngữ liên quan đến trật tự và an toàn giao thông đường bộ, nhưng không bao gồm định nghĩa về ""đường phố"".
","Đường phố là đường đô thị, gồm lòng đường và hè phố.",1.0,0.7681840701234904,0.0,0.0
80,Người tham gia giao thông phải chấp hành quy tắc nào?,"['1. người lái xe, người điều khiển xe máy chuyên dùng phải chấp hành quy định về tốc độ, khoảng cách an toàn tối thiểu với xe phía trước cùng làn đường hoặc phần đường. 2. người điều khiển phương tiện tham gia giao thông đường bộ phải bảo đảm tốc độ phù hợp điều kiện của cầu, đường, mật độ giao thông, địa hình, thời tiết và các yếu tố ảnh hưởng khác để bảo đảm an toàn. 3. người điều khiển phương tiện tham gia giao thông đường bộ phải quan sát, giảm tốc độ hoặc dừng lại để bảo đảm an toàn trong các trường hợp sau đây: a) tại nơi có vạch kẻ đường hoặc báo hiệu khác dành cho người đi bộ hoặc tại nơi mà người đi bộ, xe lăn của người khuyết tật đang qua đường; b) có báo hiệu cảnh báo nguy hiểm hoặc có chướng ngại vật trên đường; c) chuyển hướng xe chạy hoặc tầm nhìn bị hạn chế; d) nơi đường bộ giao nhau cùng mức với đường bộ, đường bộ giao nhau cùng mức với đường sắt; đường hẹp, đường vòng, đường quanh co, đường đèo, dốc; đ) nơi cầu, cống hẹp, đập tràn, đường ngầm, hầm chui, hầm đường bộ; e) khu vực có trường học, bệnh viện, bến xe, công trình công cộng tập trung đông người, khu vực đông dân cư, chợ, khu vực đang thi công trên đường bộ, hiện trường vụ tai nạn giao thông đường bộ; g) có vật nuôi đi trên đường hoặc chăn thả ở ven đường; h) tránh xe đi ngược chiều hoặc khi cho xe đi phía sau vượt; khi có tín hiệu xin đường, tín hiệu khẩn cấp của xe đi cùng chiều phía trước; i) điểm dừng xe, đỗ xe trên đường bộ có khách đang lên, xuống xe; k) gặp xe vận chuyển hàng siêu trường, siêu trọng, hàng hóa nguy hiểm; đoàn người đi bộ; l) gặp xe ưu tiên; m) điều kiện trời mưa, gió, sương, khói, bụi, mặt đường trơn trượt, lầy lội, có nhiều đất đá, vật liệu rơi vãi ảnh hưởng đến an toàn giao thông đường bộ; n) khu vực đang tổ chức kiểm soát giao thông đường bộ. 4. bộ trưởng bộ giao thông vận tải quy định chi tiết về tốc độ và khoảng cách an toàn của xe cơ giới, xe máy chuyên dùng tham gia giao thông đường bộ.']","**Nguồn văn bản:** 36_2024_QH15_444251

**Tên văn bản:** Luật Trật tự, an toàn giao thông đường bộ

**Điều 12:** Chấp hành quy định về tốc độ và khoảng cách giữa các xe

**Nội dung:**

1. Người lái xe, người điều khiển xe máy chuyên dùng phải chấp hành quy định về tốc độ, khoảng cách an toàn tối thiểu với xe phía trước cùng làn đường hoặc phần đường.

2. Người điều khiển phương tiện tham gia giao thông đường bộ phải bảo đảm tốc độ phù hợp điều kiện của cầu, đường, mật độ giao thông, địa hình, thời tiết và các yếu tố ảnh hưởng khác để bảo đảm an toàn.

3. Người điều khiển phương tiện tham gia giao thông đường bộ phải quan sát, giảm tốc độ hoặc dừng lại để bảo đảm an toàn trong các trường hợp sau đây:

	a) Tại nơi có vạch kẻ đường hoặc báo hiệu khác dành cho người đi bộ hoặc tại nơi mà người đi bộ, xe lăn của người khuyết tật đang qua đường.

	b) Có báo hiệu cảnh báo nguy hiểm hoặc có chướng ngại vật trên đường.

	c) Chuyển hướng xe chạy hoặc tầm nhìn bị hạn chế.

	d) Nơi đường bộ giao nhau cùng mức với đường bộ, đường bộ giao nhau cùng mức với đường sắt; đường hẹp, đường vòng, đường quanh co, đường đèo, dốc.

	đ) Nơi cầu, cống hẹp, đập tràn, đường ngầm, hầm chui, hầm đường bộ.

	e) Khu vực có trường học, bệnh viện, bến xe, công trình công cộng tập trung đông người, khu vực đông dân cư, chợ, khu vực đang thi công trên đường bộ, hiện trường vụ tai nạn giao thông đường bộ.

	g) Có vật nuôi đi trên đường hoặc chăn thả ở ven đường.

	h) Tránh xe đi ngược chiều hoặc khi cho xe đi phía sau vượt; khi có tín hiệu xin đường, tín hiệu khẩn cấp của xe đi cùng chiều phía trước.

	i) Điểm dừng xe, đỗ xe trên đường bộ có khách đang lên, xuống xe.

	k) Gặp xe vận chuyển hàng siêu trường, siêu trọng, hàng hóa nguy hiểm; đoàn người đi bộ.

	l) Gặp xe ưu tiên.

	m) Điều kiện trời mưa, gió, sương, khói, bụi, mặt đường trơn trượt, lầy lội, có nhiều đất đá, vật liệu rơi vãi ảnh hưởng đến an toàn giao thông đường bộ.

	n) Khu vực đang tổ chức kiểm soát giao thông đường bộ.

4. Bộ trưởng Bộ Giao thông vận tải quy định chi tiết về tốc độ và khoảng cách an toàn của xe cơ giới, xe máy chuyên dùng tham gia giao thông đường bộ.


Tóm lại: Người tham gia giao thông phải chấp hành quy định về tốc độ, khoảng cách an toàn, quan sát và giảm tốc độ khi cần thiết để đảm bảo an toàn trong nhiều trường hợp cụ thể như gần trường học, bệnh viện, gặp xe ưu tiên, điều kiện thời tiết xấu, v.v.
","Người tham gia giao thông phải đi bên phải của đường đi, đi đúng làn đường, phần đường quy định và phải chấp hành biển báo hiệu đường bộ; xe ô tô có trang bị dây an toàn thì người lái xe phải thắt dây an toàn.",1.0,0.46570818667296837,0.0,0.0
81,"Trong các trường hợp tránh nhau trên đường hẹp, xe nào phải nhường đường?","['1. trên đường không phân chia thành hai chiều xe chạy riêng biệt, hai xe đi ngược chiều tránh nhau, người điều khiển phương tiện tham gia giao thông đường bộ phải giảm tốc độ và cho xe đi về bên phải theo chiều xe chạy của mình. 2. các trường hợp nhường đường khi tránh nhau bao gồm: a) nơi đường hẹp chỉ đủ cho một xe chạy và có chỗ tránh xe thì xe nào ở gần chỗ tránh hơn phải vào vị trí tránh, nhường đường cho xe đi ngược chiều; b) xe xuống dốc phải nhường đường cho xe lên dốc; c) xe có chướng ngại vật phía trước phải nhường đường cho xe không có chướng ngại vật phía trước.']","**Nguồn văn bản:** 36_2024_QH15_444251

**Tên văn bản:** Luật Trật tự, an toàn giao thông đường bộ

**Điều 17:** Tránh xe đi ngược chiều

**Nội dung:**

1. Trên đường không phân chia thành hai chiều xe chạy riêng biệt, hai xe đi ngược chiều tránh nhau, người điều khiển phương tiện tham gia giao thông đường bộ phải giảm tốc độ và cho xe đi về bên phải theo chiều xe chạy của mình.

2. Các trường hợp nhường đường khi tránh nhau bao gồm:

	a) Nơi đường hẹp chỉ đủ cho một xe chạy và có chỗ tránh xe thì xe nào ở gần chỗ tránh hơn phải vào vị trí tránh, nhường đường cho xe đi ngược chiều.

	b) Xe xuống dốc phải nhường đường cho xe lên dốc.

	c) Xe có chướng ngại vật phía trước phải nhường đường cho xe không có chướng ngại vật phía trước.


Tóm lại: Khi tránh nhau trên đường hẹp, xe gần chỗ tránh xe hơn phải nhường đường; xe xuống dốc nhường xe lên dốc; xe có chướng ngại vật phía trước nhường đường cho xe không có chướng ngại vật.
","Nơi đường hẹp chỉ đủ cho một xe chạy và có chỗ tránh xe thì xe nào ở gần chỗ tránh hơn phải vào vị trí tránh, nhường đường cho xe kia đi.",0.8,0.32644911796936027,1.0,0.9999999999
82,Xe xuống dốc phải nhường đường cho xe nào?,"['1. trên đường không phân chia thành hai chiều xe chạy riêng biệt, hai xe đi ngược chiều tránh nhau, người điều khiển phương tiện tham gia giao thông đường bộ phải giảm tốc độ và cho xe đi về bên phải theo chiều xe chạy của mình. 2. các trường hợp nhường đường khi tránh nhau bao gồm: a) nơi đường hẹp chỉ đủ cho một xe chạy và có chỗ tránh xe thì xe nào ở gần chỗ tránh hơn phải vào vị trí tránh, nhường đường cho xe đi ngược chiều; b) xe xuống dốc phải nhường đường cho xe lên dốc; c) xe có chướng ngại vật phía trước phải nhường đường cho xe không có chướng ngại vật phía trước.']","**Nguồn văn bản:** 36_2024_QH15_444251

**Tên văn bản:** Luật Trật tự, an toàn giao thông đường bộ

**Điều 17:** Tránh xe đi ngược chiều

**Nội dung:**

1. Trên đường không phân chia thành hai chiều xe chạy riêng biệt, hai xe đi ngược chiều tránh nhau, người điều khiển phương tiện tham gia giao thông đường bộ phải giảm tốc độ và cho xe đi về bên phải theo chiều xe chạy của mình.

2. Các trường hợp nhường đường khi tránh nhau bao gồm:

	a) Nơi đường hẹp chỉ đủ cho một xe chạy và có chỗ tránh xe thì xe nào ở gần chỗ tránh hơn phải vào vị trí tránh, nhường đường cho xe đi ngược chiều.

	b) Xe xuống dốc phải nhường đường cho xe lên dốc.

	c) Xe có chướng ngại vật phía trước phải nhường đường cho xe không có chướng ngại vật phía trước.

Tóm lại: Xe xuống dốc phải nhường đường cho xe lên dốc.
",Xe xuống dốc phải nhường đường cho xe đang lên dốc.,1.0,0.45147035906607513,1.0,0.9999999999
83,Khái niệm 'phương tiện giao thông cơ giới đường bộ' bao gồm những loại xe nào?,"['trong thông tư này các từ ngữ dưới đây được hiểu như sau: 1. xe cơ giới, xe máy chuyên dùng thuộc đối tượng nghiên cứu phát triển có nhu cầu tham gia giao thông đường bộ (sau đây gọi tắt là xe nghiên cứu phát triển) là các loại xe được phân loại theo quy định của bộ trưởng bộ giao thông vận tải, chưa được chứng nhận chất lượng an toàn kỹ thuật và bảo vệ môi trường nhưng có nhu cầu tham gia giao thông đường bộ để đánh giá về độ bền, khả năng thích nghi của xe đối với các yếu tố thời tiết, môi trường, điều kiện giao thông tại việt nam hoặc nhằm mục đích cải tiến chất lượng an toàn kỹ thuật và bảo vệ môi trường của sản phẩm. 2. chạy thử trên đường là việc xe nghiên cứu phát triển tham gia giao thông đường bộ. 3. cơ sở nghiên cứu phát triển là doanh nghiệp sản xuất, lắp ráp xe trong nước đã được đánh giá việc bảo đảm chất lượng an toàn kỹ thuật và bảo vệ môi trường đạt yêu cầu theo quy định của pháp luật. 4. phụ tùng chưa qua sử dụng là các tổng thành, hệ thống, chi tiết của xe chưa được sử dụng để sản xuất, lắp ráp xe hoặc sử dụng với bất kỳ mục đích nào khác. 5. xe chưa qua sử dụng là xe chưa được đăng ký lưu hành hoặc chưa được đưa vào sử dụng với bất kỳ mục đích nào khác. 6. kiểm tra chất lượng xuất xưởng là việc cơ sở nghiên cứu phát triển kiểm tra các hệ thống an toàn kỹ thuật của xe nghiên cứu phát triển theo tiêu chuẩn của nhà sản xuất. 7. phiếu kiểm tra chất lượng xuất xưởng là tài liệu của cơ sở nghiên cứu phát triển cấp cho từng xe nghiên cứu phát triển theo mẫu quy định tại phụ lục ban hành kèm theo thông tư này và được in trên phôi phiếu kiểm tra chất lượng xuất xưởng của xe sản xuất, lắp ráp trong nước. 8. tải trọng giả là tải trọng giả lập, sử dụng để kiểm tra khả năng chịu tải và hoạt động của xe trong các điều kiện khác nhau, nhằm mục đích đánh giá về chất lượng an toàn kỹ thuật và hiệu quả của xe, bao gồm: khối bê tông, khối hoặc tấm kim loại, thùng nước, bao cát, thiết bị mô phỏng tải trọng. 9. tổ chức có thẩm quyền nước ngoài là tổ chức chứng nhận hoặc tổ chức dịch vụ kỹ thuật thuộc danh sách niêm yết của các nước thành viên tham gia điều ước quốc tế liên quan đến phương tiện giao thông đường bộ mà việt nam là thành viên.']","**Nguồn văn bản:** 52_2024_TT-BGTVT_622845

**Tên văn bản:** Thông tư Quy định về yêu cầu kỹ thuật đối với xe cơ giới, xe máy chuyên dùng thuộc đối tượng nghiên cứu phát triển có nhu cầu tham gia giao thông đường bộ

**Điều 3:** Giải thích từ ngữ

**Nội dung:**

Trong Thông tư này các từ ngữ dưới đây được hiểu như sau:

1. Xe cơ giới, xe máy chuyên dùng thuộc đối tượng nghiên cứu phát triển có nhu cầu tham gia giao thông đường bộ (sau đây gọi tắt là xe nghiên cứu phát triển) là các loại xe được phân loại theo quy định của Bộ trưởng Bộ Giao thông vận tải, chưa được chứng nhận chất lượng an toàn kỹ thuật và bảo vệ môi trường nhưng có nhu cầu tham gia giao thông đường bộ để đánh giá về độ bền, khả năng thích nghi của xe đối với các yếu tố thời tiết, môi trường, điều kiện giao thông tại Việt Nam hoặc nhằm mục đích cải tiến chất lượng an toàn kỹ thuật và bảo vệ môi trường của sản phẩm.


2. Chạy thử trên đường là việc xe nghiên cứu phát triển tham gia giao thông đường bộ.


3. Cơ sở nghiên cứu phát triển là doanh nghiệp sản xuất, lắp ráp xe trong nước đã được đánh giá việc bảo đảm chất lượng an toàn kỹ thuật và bảo vệ môi trường đạt yêu cầu theo quy định của pháp luật.


4. Phụ tùng chưa qua sử dụng là các tổng thành, hệ thống, chi tiết của xe chưa được sử dụng để sản xuất, lắp ráp xe hoặc sử dụng với bất kỳ mục đích nào khác.


5. Xe chưa qua sử dụng là xe chưa được đăng ký lưu hành hoặc chưa được đưa vào sử dụng với bất kỳ mục đích nào khác.


6. Kiểm tra chất lượng xuất xưởng là việc cơ sở nghiên cứu phát triển kiểm tra các hệ thống an toàn kỹ thuật của xe nghiên cứu phát triển theo tiêu chuẩn của nhà sản xuất.


7. Phiếu kiểm tra chất lượng xuất xưởng là tài liệu của cơ sở nghiên cứu phát triển cấp cho từng xe nghiên cứu phát triển theo mẫu quy định tại Phụ lục ban hành kèm theo Thông tư này và được in trên phôi phiếu kiểm tra chất lượng xuất xưởng của xe sản xuất, lắp ráp trong nước.


8. Tải trọng giả là tải trọng giả lập, sử dụng để kiểm tra khả năng chịu tải và hoạt động của xe trong các điều kiện khác nhau, nhằm mục đích đánh giá về chất lượng an toàn kỹ thuật và hiệu quả của xe, bao gồm: khối bê tông, khối hoặc tấm kim loại, thùng nước, bao cát, thiết bị mô phỏng tải trọng.


9. Tổ chức có thẩm quyền nước ngoài là tổ chức chứng nhận hoặc tổ chức dịch vụ kỹ thuật thuộc danh sách niêm yết của các nước thành viên tham gia điều ước quốc tế liên quan đến phương tiện giao thông đường bộ mà Việt Nam là thành viên.

**Tóm lại:** Văn bản này không định nghĩa ""phương tiện giao thông cơ giới đường bộ"" mà chỉ giải thích các thuật ngữ liên quan đến xe nghiên cứu phát triển. Do đó, không tìm thấy thông tin trả lời trực tiếp cho câu hỏi.
","Phương tiện giao thông cơ giới đường bộ bao gồm: mô tô hai bánh, mô tô ba bánh, xe gắn máy, xe ô tô, máy kéo và các loại xe tương tự.",0.7333333333333333,0.0,0.0,0.0
84,Khái niệm 'phương tiện giao thông thô sơ đường bộ' bao gồm những loại xe nào?,"['1. trật tự, an toàn giao thông đường bộ là trạng thái giao thông trên đường bộ có trật tự, bảo đảm an toàn, thông suốt; được hình thành và điều chỉnh bởi các quy tắc, nguyên tắc, quy phạm pháp luật trong lĩnh vực giao thông đường bộ. 2. phương tiện giao thông đường bộ là các loại xe, bao gồm: phương tiện giao thông cơ giới đường bộ (sau đây gọi là xe cơ giới), phương tiện giao thông thô sơ đường bộ (sau đây gọi là xe thô sơ), xe máy chuyên dùng và các loại xe tương tự. 3. phương tiện tham gia giao thông đường bộ là phương tiện giao thông đường bộ tham gia giao thông trên đường bộ. 4. đường ưu tiên\xa0là đường mà trên đó phương tiện tham gia giao thông đường bộ được các phương tiện tham gia giao thông đường bộ đến từ hướng khác nhường đường khi qua nơi đường giao nhau, được cắm biển báo hiệu đường ưu tiên. 5. phần đường xe chạy là phần của đường bộ được sử dụng cho phương tiện giao thông đường bộ đi lại. 6. làn đường là một phần của phần đường xe chạy được chia theo chiều dọc của đường, có đủ chiều rộng cho xe chạy an toàn. 7. cải tạo xe (sau đây gọi là cải tạo) là việc thay đổi đặc điểm của xe đã được cấp đăng ký xe, biển số xe hoặc xe đã qua sử dụng được nhập khẩu dẫn đến thay đổi về kiểu loại xe theo quy định của cơ quan có thẩm quyền. 8. người tham gia giao thông đường bộ bao gồm: người điều khiển, người được chở trên phương tiện tham gia giao thông đường bộ; người điều khiển, dẫn dắt vật nuôi trên đường bộ; người đi bộ trên đường bộ. 9. người điều khiển phương tiện tham gia giao thông đường bộ bao gồm: người điều khiển xe cơ giới (sau đây gọi là người lái xe), người điều khiển xe thô sơ, người điều khiển xe máy chuyên dùng. 10. người điều khiển giao thông đường bộ (sau đây gọi là người điều khiển giao thông) bao gồm: cảnh sát giao thông và người được giao nhiệm vụ hướng dẫn giao thông trên đường bộ. 11. ùn tắc giao thông đường bộ (sau đây gọi là ùn tắc giao thông) là tình trạng người, phương tiện tham gia giao thông đường bộ bị dồn ứ, di chuyển với tốc độ rất chậm hoặc không thể di chuyển được. 12. tai nạn giao thông đường bộ là va chạm liên quan đến người, phương tiện khi tham gia giao thông đường bộ, xảy ra ngoài ý muốn của người tham gia giao thông đường bộ, gây thiệt hại đến tính mạng, sức khỏe, tài sản của cá nhân hoặc tài sản của cơ quan, tổ chức. 13. thiết bị an toàn cho trẻ em là thiết bị có đủ khả năng bảo đảm an toàn cho trẻ em ở tư thế ngồi hoặc nằm trên xe ô tô, được thiết kế để giảm nguy cơ chấn thương cho người dùng trong trường hợp xảy ra va chạm hoặc xe ô tô giảm tốc độ đột ngột, bằng cách hạn chế sự di chuyển của cơ thể trẻ em. 14. thiết bị thông minh hỗ trợ chỉ huy, điều khiển giao thông đường bộ là thiết bị kỹ thuật công nghệ có khả năng phát hiện, phân tích, đánh giá các tình huống giao thông đường bộ, vi phạm pháp luật trên đường bộ; do lực lượng chức năng sử dụng để hỗ trợ chỉ huy, điều khiển giao thông đường bộ, giải quyết tình huống và xử lý vi phạm pháp luật trên đường bộ.']","**Nguồn văn bản:** 36_2024_QH15_444251

**Tên văn bản:** Luật Trật tự, an toàn giao thông đường bộ

**Điều 2:** Giải thích từ ngữ

**Nội dung:**

2. Phương tiện giao thông đường bộ là các loại xe, bao gồm:

    a) Phương tiện giao thông cơ giới đường bộ (sau đây gọi là xe cơ giới).

    b) Phương tiện giao thông thô sơ đường bộ (sau đây gọi là xe thô sơ).

    c) Xe máy chuyên dùng và các loại xe tương tự.


Tóm lại: Phương tiện giao thông thô sơ đường bộ là một loại phương tiện giao thông đường bộ, thuộc nhóm các loại xe.
","Phương tiện giao thông thô sơ đường bộ bao gồm: xe đạp, xe xích lô, xe lăn dùng cho người khuyết tật, xe súc vật kéo và các loại xe tương tự.",1.0,0.4348269630469479,0.0,0.0
85,Người điều khiển phương tiện tham gia giao thông phải tuân thủ những quy tắc nào?,"['1. người lái xe, người điều khiển xe máy chuyên dùng phải chấp hành quy định về tốc độ, khoảng cách an toàn tối thiểu với xe phía trước cùng làn đường hoặc phần đường. 2. người điều khiển phương tiện tham gia giao thông đường bộ phải bảo đảm tốc độ phù hợp điều kiện của cầu, đường, mật độ giao thông, địa hình, thời tiết và các yếu tố ảnh hưởng khác để bảo đảm an toàn. 3. người điều khiển phương tiện tham gia giao thông đường bộ phải quan sát, giảm tốc độ hoặc dừng lại để bảo đảm an toàn trong các trường hợp sau đây: a) tại nơi có vạch kẻ đường hoặc báo hiệu khác dành cho người đi bộ hoặc tại nơi mà người đi bộ, xe lăn của người khuyết tật đang qua đường; b) có báo hiệu cảnh báo nguy hiểm hoặc có chướng ngại vật trên đường; c) chuyển hướng xe chạy hoặc tầm nhìn bị hạn chế; d) nơi đường bộ giao nhau cùng mức với đường bộ, đường bộ giao nhau cùng mức với đường sắt; đường hẹp, đường vòng, đường quanh co, đường đèo, dốc; đ) nơi cầu, cống hẹp, đập tràn, đường ngầm, hầm chui, hầm đường bộ; e) khu vực có trường học, bệnh viện, bến xe, công trình công cộng tập trung đông người, khu vực đông dân cư, chợ, khu vực đang thi công trên đường bộ, hiện trường vụ tai nạn giao thông đường bộ; g) có vật nuôi đi trên đường hoặc chăn thả ở ven đường; h) tránh xe đi ngược chiều hoặc khi cho xe đi phía sau vượt; khi có tín hiệu xin đường, tín hiệu khẩn cấp của xe đi cùng chiều phía trước; i) điểm dừng xe, đỗ xe trên đường bộ có khách đang lên, xuống xe; k) gặp xe vận chuyển hàng siêu trường, siêu trọng, hàng hóa nguy hiểm; đoàn người đi bộ; l) gặp xe ưu tiên; m) điều kiện trời mưa, gió, sương, khói, bụi, mặt đường trơn trượt, lầy lội, có nhiều đất đá, vật liệu rơi vãi ảnh hưởng đến an toàn giao thông đường bộ; n) khu vực đang tổ chức kiểm soát giao thông đường bộ. 4. bộ trưởng bộ giao thông vận tải quy định chi tiết về tốc độ và khoảng cách an toàn của xe cơ giới, xe máy chuyên dùng tham gia giao thông đường bộ.']","**Nguồn văn bản:** 36_2024_QH15_444251

**Tên văn bản:** Luật Trật tự, an toàn giao thông đường bộ

**Điều 12:** Chấp hành quy định về tốc độ và khoảng cách giữa các xe

**Nội dung:**

1. Người lái xe, người điều khiển xe máy chuyên dùng phải chấp hành quy định về tốc độ, khoảng cách an toàn tối thiểu với xe phía trước cùng làn đường hoặc phần đường.

2. Người điều khiển phương tiện tham gia giao thông đường bộ phải bảo đảm tốc độ phù hợp điều kiện của cầu, đường, mật độ giao thông, địa hình, thời tiết và các yếu tố ảnh hưởng khác để bảo đảm an toàn.

3. Người điều khiển phương tiện tham gia giao thông đường bộ phải quan sát, giảm tốc độ hoặc dừng lại để bảo đảm an toàn trong các trường hợp sau đây:

	a) Tại nơi có vạch kẻ đường hoặc báo hiệu khác dành cho người đi bộ hoặc tại nơi mà người đi bộ, xe lăn của người khuyết tật đang qua đường.

	b) Có báo hiệu cảnh báo nguy hiểm hoặc có chướng ngại vật trên đường.

	c) Chuyển hướng xe chạy hoặc tầm nhìn bị hạn chế.

	d) Nơi đường bộ giao nhau cùng mức với đường bộ, đường bộ giao nhau cùng mức với đường sắt; đường hẹp, đường vòng, đường quanh co, đường đèo, dốc.

	đ) Nơi cầu, cống hẹp, đập tràn, đường ngầm, hầm chui, hầm đường bộ.

	e) Khu vực có trường học, bệnh viện, bến xe, công trình công cộng tập trung đông người, khu vực đông dân cư, chợ, khu vực đang thi công trên đường bộ, hiện trường vụ tai nạn giao thông đường bộ.

	g) Có vật nuôi đi trên đường hoặc chăn thả ở ven đường.

	h) Tránh xe đi ngược chiều hoặc khi cho xe đi phía sau vượt; khi có tín hiệu xin đường, tín hiệu khẩn cấp của xe đi cùng chiều phía trước.

	i) Điểm dừng xe, đỗ xe trên đường bộ có khách đang lên, xuống xe.

	k) Gặp xe vận chuyển hàng siêu trường, siêu trọng, hàng hóa nguy hiểm; đoàn người đi bộ.

	l) Gặp xe ưu tiên.

	m) Điều kiện trời mưa, gió, sương, khói, bụi, mặt đường trơn trượt, lầy lội, có nhiều đất đá, vật liệu rơi vãi ảnh hưởng đến an toàn giao thông đường bộ.

	n) Khu vực đang tổ chức kiểm soát giao thông đường bộ.

4. Bộ trưởng Bộ Giao thông vận tải quy định chi tiết về tốc độ và khoảng cách an toàn của xe cơ giới, xe máy chuyên dùng tham gia giao thông đường bộ.


Tóm lại: Người điều khiển phương tiện phải tuân thủ tốc độ, khoảng cách an toàn, quan sát và giảm tốc độ khi cần thiết trong các trường hợp cụ thể như gần người đi bộ, có chướng ngại vật, giao lộ, khu vực đông dân cư, gặp xe ưu tiên, điều kiện thời tiết xấu, v.v... để đảm bảo an toàn giao thông.
","Người điều khiển phương tiện phải tuân thủ quy tắc giao thông đường bộ, chấp hành hiệu lệnh, chỉ dẫn của hệ thống báo hiệu đường bộ và người điều khiển giao thông.",1.0,0.5005245301402156,0.0,0.0
86,"Trong khu vực đông dân cư, tốc độ tối đa cho phép của xe cơ giới là bao nhiêu?",['1. tốc độ khai thác tối đa cho phép xe cơ giới tham gia giao thông trên đường bộ trong khu vực đông dân cư bảng 1 2. tốc độ khai thác tối đa cho phép xe cơ giới tham gia giao thông trên đường bộ ngoài khu vực đông dân cư bảng 2'],"**Nguồn văn bản:** 38_2024_TT-BGTVT_622477

**Tên văn bản:** Thông tư Quy định về tốc độ và khoảng cách an toàn của xe cơ giới, xe máy chuyên dùng tham gia giao thông trên đường bộ

**Điều 6:** tốc độ khai thác tối đa cho phép xe cơ giới tham gia giao thông trên đường bộ (trừ đường cao tốc)

**Nội dung:**

1. Tốc độ khai thác tối đa cho phép xe cơ giới tham gia giao thông trên đường bộ trong khu vực đông dân cư bảng 1

2. Tốc độ khai thác tối đa cho phép xe cơ giới tham gia giao thông trên đường bộ ngoài khu vực đông dân cư bảng 2

Tóm lại: Văn bản này quy định tốc độ tối đa cho phép của xe cơ giới trong khu vực đông dân cư, nhưng chưa cung cấp con số cụ thể. Cần tra cứu bảng 1 trong văn bản để biết tốc độ tối đa được phép.
","Trong khu vực đông dân cư, tốc độ tối đa cho phép của xe cơ giới là 50 km/h, trừ khi có biển báo quy định tốc độ khác.",0.5714285714285714,0.5667298311851657,0.0,0.0
87,Người đi bộ tham gia giao thông phải tuân thủ những quy định nào?,"['1. báo hiệu đường bộ bao gồm: hiệu lệnh của người điều khiển giao thông; đèn tín hiệu giao thông; biển báo hiệu đường bộ; vạch kẻ đường và các dấu hiệu khác trên mặt đường; cọc tiêu, tường bảo vệ, rào chắn, đinh phản quang, tiêu phản quang, cột km, cọc h; thiết bị âm thanh báo hiệu đường bộ. 2. người tham gia giao thông đường bộ phải chấp hành báo hiệu đường bộ theo thứ tự ưu tiên từ trên xuống dưới như sau: a) hiệu lệnh của người điều khiển giao thông; b) tín hiệu đèn giao thông; c) biển báo hiệu đường bộ; d) vạch kẻ đường và các dấu hiệu khác trên mặt đường; đ) cọc tiêu, tường bảo vệ, rào chắn, đinh phản quang, tiêu phản quang,\ncột km, cọc h; e) thiết bị âm thanh báo hiệu đường bộ. 3. hiệu lệnh của người điều khiển giao thông được quy định như sau: a) tay bên phải giơ thẳng đứng để báo hiệu cho người tham gia giao thông đường bộ ở tất cả các hướng phải dừng lại; b) hai tay hoặc một tay dang ngang để báo hiệu cho người tham gia giao thông đường bộ ở phía trước và ở phía sau người điều khiển giao thông phải dừng lại; người tham gia giao thông đường bộ ở phía bên phải và bên trái người điều khiển giao thông được đi; c) tay bên phải giơ về phía trước để báo hiệu cho người tham gia giao thông đường bộ ở phía sau và bên phải người điều khiển giao thông phải dừng lại; người tham gia giao thông đường bộ ở phía trước người điều khiển giao thông được rẽ phải; người tham gia giao thông đường bộ ở phía bên trái người điều khiển giao thông được đi tất cả các hướng; người đi bộ qua đường phải đi sau lưng người điều khiển giao thông. 4. tín hiệu đèn giao thông có 03 màu, gồm: màu xanh, màu vàng, màu đỏ; có hiển thị thời gian hoặc không hiển thị thời gian. người tham gia giao thông đường bộ phải chấp hành như sau: a) tín hiệu đèn màu xanh là được đi; trường hợp người đi bộ, xe lăn của người khuyết tật đang đi ở lòng đường, người điều khiển phương tiện tham gia giao thông đường bộ phải giảm tốc độ hoặc dừng lại nhường đường cho người đi bộ, xe lăn của người khuyết tật qua đường; b) tín hiệu đèn màu vàng phải dừng lại trước vạch dừng; trường hợp đang đi trên vạch dừng hoặc đã đi qua vạch dừng mà tín hiệu đèn màu vàng thì được đi tiếp; trường hợp tín hiệu đèn màu vàng nhấp nháy, người điều khiển phương tiện tham gia giao thông đường bộ được đi nhưng phải quan sát, giảm tốc độ hoặc dừng lại nhường đường cho người đi bộ, xe lăn của người khuyết tật qua đường hoặc các phương tiện khác; c) tín hiệu đèn màu đỏ là cấm đi. 5. báo hiệu của biển báo hiệu đường bộ được quy định như sau: a) biển báo cấm để biểu thị các điều cấm; b) biển báo nguy hiểm để cảnh báo các tình huống nguy hiểm có thể xảy ra; c) biển hiệu lệnh để báo hiệu lệnh phải thi hành; d) biển chỉ dẫn để chỉ dẫn hướng đi hoặc các điều cần biết; đ) biển phụ để thuyết minh bổ sung cho biển báo cấm, biển báo nguy hiểm, biển hiệu lệnh và biển chỉ dẫn. 6. vạch kẻ đường là vạch chỉ sự phân chia làn đường, vị trí hoặc hướng đi, vị trí dừng lại. 7. cọc tiêu, tường bảo vệ để hướng dẫn cho người tham gia giao thông đường bộ biết phạm vi an toàn của nền đường và hướng đi của đường. 8. rào chắn để ngăn không cho người, phương tiện qua lại. 9. đinh phản quang, tiêu phản quang để thông tin, cảnh báo về phần đường, làn đường. 10. cột km, cọc h để báo hiệu cho người tham gia giao thông đường bộ về các thông tin của đường bộ. 11. thiết bị âm thanh báo hiệu đường bộ để hỗ trợ cảnh báo nguy hiểm cho người tham gia giao thông đường bộ. 12. khi ở một vị trí vừa có biển báo hiệu đặt cố định vừa có biển báo hiệu tạm thời mà hai biển có ý nghĩa khác nhau, người tham gia giao thông đường bộ phải chấp hành hiệu lệnh của biển báo hiệu tạm thời. 13. bộ trưởng bộ giao thông vận tải ban hành quy chuẩn kỹ thuật quốc gia về báo hiệu đường bộ, trừ hiệu lệnh của người điều khiển giao thông. 14. bộ trưởng bộ công an quy định chi tiết khoản 3 điều này.']","**Nguồn văn bản:** 36_2024_QH15_444251

**Tên văn bản:** Luật Trật tự, an toàn giao thông đường bộ

**Điều 11:** Chấp hành báo hiệu đường bộ

**Nội dung:**

1. Báo hiệu đường bộ bao gồm:

    a) Hiệu lệnh của người điều khiển giao thông.

    b) Đèn tín hiệu giao thông.

    c) Biển báo hiệu đường bộ.

    d) Vạch kẻ đường và các dấu hiệu khác trên mặt đường.

    đ) Cọc tiêu, tường bảo vệ, rào chắn, đinh phản quang, tiêu phản quang, cột km, cọc h.

    e) Thiết bị âm thanh báo hiệu đường bộ.


2. Người tham gia giao thông đường bộ phải chấp hành báo hiệu đường bộ theo thứ tự ưu tiên từ trên xuống dưới như sau:

    a) Hiệu lệnh của người điều khiển giao thông.

    b) Tín hiệu đèn giao thông.

    c) Biển báo hiệu đường bộ.

    d) Vạch kẻ đường và các dấu hiệu khác trên mặt đường.

    đ) Cọc tiêu, tường bảo vệ, rào chắn, đinh phản quang, tiêu phản quang, cột km, cọc h.

    e) Thiết bị âm thanh báo hiệu đường bộ.


3. Hiệu lệnh của người điều khiển giao thông được quy định như sau:

    a) Tay bên phải giơ thẳng đứng để báo hiệu cho người tham gia giao thông đường bộ ở tất cả các hướng phải dừng lại.

    b) Hai tay hoặc một tay dang ngang để báo hiệu cho người tham gia giao thông đường bộ ở phía trước và ở phía sau người điều khiển giao thông phải dừng lại; người tham gia giao thông đường bộ ở phía bên phải và bên trái người điều khiển giao thông được đi.

    c) Tay bên phải giơ về phía trước để báo hiệu cho người tham gia giao thông đường bộ ở phía sau và bên phải người điều khiển giao thông phải dừng lại; người tham gia giao thông đường bộ ở phía trước người điều khiển giao thông được rẽ phải; người tham gia giao thông đường bộ ở phía bên trái người điều khiển giao thông được đi tất cả các hướng; người đi bộ qua đường phải đi sau lưng người điều khiển giao thông.


4. Tín hiệu đèn giao thông có 03 màu, gồm: màu xanh, màu vàng, màu đỏ; có hiển thị thời gian hoặc không hiển thị thời gian. Người tham gia giao thông đường bộ phải chấp hành như sau:

    a) Tín hiệu đèn màu xanh là được đi; trường hợp người đi bộ, xe lăn của người khuyết tật đang đi ở lòng đường, người điều khiển phương tiện tham gia giao thông đường bộ phải giảm tốc độ hoặc dừng lại nhường đường cho người đi bộ, xe lăn của người khuyết tật qua đường.

    b) Tín hiệu đèn màu vàng phải dừng lại trước vạch dừng; trường hợp đang đi trên vạch dừng hoặc đã đi qua vạch dừng mà tín hiệu đèn màu vàng thì được đi tiếp; trường hợp tín hiệu đèn màu vàng nhấp nháy, người điều khiển phương tiện tham gia giao thông đường bộ được đi nhưng phải quan sát, giảm tốc độ hoặc dừng lại nhường đường cho người đi bộ, xe lăn của người khuyết tật qua đường hoặc các phương tiện khác.

    c) Tín hiệu đèn màu đỏ là cấm đi.


**Tóm lại:** Người đi bộ khi tham gia giao thông phải tuân thủ tín hiệu giao thông, hiệu lệnh của người điều khiển giao thông và các biển báo hiệu đường bộ. Cụ thể, người đi bộ phải dừng lại khi gặp đèn đỏ, được qua đường khi đèn xanh (lưu ý các phương tiện phải nhường đường), và đi sau lưng người điều khiển giao thông khi người này ra hiệu lệnh cho phép.  Khi đèn vàng nhấp nháy, người đi bộ được qua đường nhưng cần quan sát và cẩn trọng.
","Người đi bộ phải đi trên hè phố, lề đường; trường hợp không có hè phố, lề đường thì phải đi sát mép đường. Khi qua đường, phải quan sát và chỉ qua đường tại nơi có vạch kẻ đường, cầu vượt, hầm chui hoặc nơi có đèn tín hiệu.",1.0,0.7282543414583774,0.0,0.0
88,"Người điều khiển xe mô tô, xe gắn máy có được sử dụng điện thoại di động khi đang lái xe không?","['1. lực lượng cảnh sát giao thông được trang bị vũ khí, công cụ hỗ trợ theo quy định của pháp luật về quản lý, sử dụng vũ khí, vật liệu nổ và công cụ hỗ trợ; phương tiện giao thông đường bộ, phương tiện, thiết bị kỹ thuật nghiệp vụ, thiết bị thông minh hỗ trợ chỉ huy, điều khiển giao thông đường bộ. lực lượng khác trong công an nhân dân tham gia phối hợp với cảnh sát giao thông thực hiện tuần tra, kiểm soát được trang bị phương tiện, thiết bị kỹ thuật nghiệp vụ, vũ khí, công cụ hỗ trợ phù hợp với nhiệm vụ được giao theo quy định của pháp luật. 2. các lực lượng quy định tại khoản 1 điều này được sử dụng vũ khí, công cụ hỗ trợ được trang bị theo quy định của pháp luật về quản lý, sử dụng vũ khí, vật liệu nổ và công cụ hỗ trợ; sử dụng phương tiện giao thông đường bộ, phương tiện, thiết bị kỹ thuật nghiệp vụ, thiết bị thông minh hỗ trợ chỉ huy, điều khiển giao thông đường bộ theo quy định của bộ trưởng bộ công an; sử dụng thiết bị lưu trữ dữ liệu do tổ chức, cá nhân cung cấp để phân tích, đánh giá, dự báo tình hình trật tự, an toàn giao thông đường bộ, phát hiện vi phạm pháp luật về trật tự, an toàn giao thông đường bộ và các vi phạm pháp luật khác theo quy định của pháp luật. 3. vũ khí, công cụ hỗ trợ trang bị được quản lý theo quy định của pháp luật về quản lý, sử dụng vũ khí, vật liệu nổ và công cụ hỗ trợ; phương tiện, thiết bị kỹ thuật nghiệp vụ, thiết bị thông minh hỗ trợ chỉ huy, điều khiển giao thông đường bộ được quản lý theo quy định của luật này, pháp luật về xử lý vi phạm hành chính và các quy định khác của pháp luật có liên quan.']","**Nguồn văn bản:** 36_2024_QH15_444251

**Tên văn bản:** Luật Trật tự, an toàn giao thông đường bộ

**Điều 70:** Trang bị, sử dụng phương tiện, thiết bị, vũ khí, công cụ hỗ trợ khi tuần tra, kiểm soát

**Nội dung:**

1. Lực lượng cảnh sát giao thông được trang bị vũ khí, công cụ hỗ trợ theo quy định của pháp luật về quản lý, sử dụng vũ khí, vật liệu nổ và công cụ hỗ trợ; phương tiện giao thông đường bộ, phương tiện, thiết bị kỹ thuật nghiệp vụ, thiết bị thông minh hỗ trợ chỉ huy, điều khiển giao thông đường bộ.

    Lực lượng khác trong công an nhân dân tham gia phối hợp với cảnh sát giao thông thực hiện tuần tra, kiểm soát được trang bị phương tiện, thiết bị kỹ thuật nghiệp vụ, vũ khí, công cụ hỗ trợ phù hợp với nhiệm vụ được giao theo quy định của pháp luật.


2. Các lực lượng quy định tại khoản 1 điều này được sử dụng vũ khí, công cụ hỗ trợ được trang bị theo quy định của pháp luật về quản lý, sử dụng vũ khí, vật liệu nổ và công cụ hỗ trợ; sử dụng phương tiện giao thông đường bộ, phương tiện, thiết bị kỹ thuật nghiệp vụ, thiết bị thông minh hỗ trợ chỉ huy, điều khiển giao thông đường bộ theo quy định của Bộ trưởng Bộ Công an; sử dụng thiết bị lưu trữ dữ liệu do tổ chức, cá nhân cung cấp để phân tích, đánh giá, dự báo tình hình trật tự, an toàn giao thông đường bộ, phát hiện vi phạm pháp luật về trật tự, an toàn giao thông đường bộ và các vi phạm pháp luật khác theo quy định của pháp luật.


3. Vũ khí, công cụ hỗ trợ trang bị được quản lý theo quy định của pháp luật về quản lý, sử dụng vũ khí, vật liệu nổ và công cụ hỗ trợ; phương tiện, thiết bị kỹ thuật nghiệp vụ, thiết bị thông minh hỗ trợ chỉ huy, điều khiển giao thông đường bộ được quản lý theo quy định của luật này, pháp luật về xử lý vi phạm hành chính và các quy định khác của pháp luật có liên quan.


Tóm lại: Văn bản này không chứa thông tin về việc sử dụng điện thoại di động khi điều khiển xe mô tô, xe gắn máy.
","Người điều khiển xe mô tô, xe gắn máy không được sử dụng điện thoại di động, thiết bị âm thanh trừ thiết bị trợ thính.",1.0,0.5536990285093287,0.0,0.0
89,"Việc chở người trên xe mô tô, xe gắn máy được quy định như thế nào?","['1. điều khiển xe cơ giới tham gia giao thông đường bộ không có giấy phép lái xe theo quy định của pháp luật; điều khiển xe máy chuyên dùng tham gia giao thông đường bộ không có giấy phép lái xe hoặc chứng chỉ bồi dưỡng kiến thức pháp luật về giao thông đường bộ, bằng hoặc chứng chỉ điều khiển xe máy chuyên dùng. 2. điều khiển phương tiện tham gia giao thông đường bộ mà trong máu hoặc hơi thở có nồng độ cồn. 3. điều khiển phương tiện tham gia giao thông đường bộ mà trong cơ thể có chất ma túy hoặc chất kích thích khác mà pháp luật cấm sử dụng. 4. xúc phạm, đe dọa, cản trở, chống đối hoặc không chấp hành hiệu lệnh, hướng dẫn, yêu cầu kiểm tra, kiểm soát của người thi hành công vụ về bảo đảm trật tự, an toàn giao thông đường bộ. 5. đua xe, tổ chức đua xe, xúi giục, giúp sức, cổ vũ đua xe trái phép; điều khiển phương tiện tham gia giao thông đường bộ lạng lách, đánh võng, rú ga liên tục. 6. dùng tay cầm và sử dụng điện thoại hoặc thiết bị điện tử khác khi điều khiển phương tiện tham gia giao thông đang di chuyển trên đường bộ. 7. giao xe cơ giới, xe máy chuyên dùng cho người không đủ điều kiện theo quy định của pháp luật để điều khiển xe tham gia giao thông đường bộ. 8. đưa xe cơ giới, xe máy chuyên dùng không bảo đảm quy định của pháp luật về an toàn kỹ thuật và bảo vệ môi trường, phương tiện khác không đủ điều kiện theo quy định của pháp luật để tham gia giao thông đường bộ. 9. nhập khẩu, sản xuất, lắp ráp xe cơ giới, xe máy chuyên dùng không bảo đảm quy định của pháp luật về chất lượng an toàn kỹ thuật và bảo vệ môi trường. 10. cải tạo xe ô tô loại khác thành xe ô tô chở người, trừ cải tạo thành xe ô tô chở người phục vụ mục đích quốc phòng, an ninh. 11. cải tạo trái phép; cố ý can thiệp làm sai lệch chỉ số trên đồng hồ báo quãng đường đã chạy của xe ô tô; cắt, hàn, tẩy xóa, đục sửa, đóng lại trái phép số khung, số động cơ của xe cơ giới, xe máy chuyên dùng. 12. cố ý can thiệp, thay đổi phần mềm điều khiển của xe, động cơ của xe đã được đăng ký với cơ quan quản lý, nhằm mục đích gian lận kết quả kiểm tra, thử nghiệm, kiểm định; thuê, mượn phụ tùng xe cơ giới chỉ để thực hiện việc kiểm định. 13. chở hàng hóa vượt quá khối lượng toàn bộ, tải trọng trục, kích thước cho phép của xe hoặc vượt quá tải trọng, kích thước giới hạn cho phép của đường bộ khi chưa được cơ quan quản lý cấp phép hoặc không bảo đảm yêu cầu theo quy định của luật này; chở hàng hóa trên xe có quy định phải chằng buộc nhưng không chằng buộc hoặc chằng buộc không đúng quy định của pháp luật; chở quá số người theo quy định của pháp luật. 14. vận chuyển hàng hóa cấm lưu hành, vận chuyển trái phép hoặc không thực hiện đầy đủ các quy định của pháp luật về vận chuyển hàng hóa nguy hiểm, động vật hoang dã. 15. đe dọa, xúc phạm, tranh giành, lôi kéo hành khách; đe doạ, cưỡng ép hành khách sử dụng dịch vụ ngoài ý muốn; chuyển tải, xuống khách hoặc các hành vi khác nhằm trốn tránh phát hiện xe chở quá tải, quá số người theo quy định của pháp luật. 16. lắp đặt, sử dụng thiết bị âm thanh, ánh sáng trên xe cơ giới, xe máy chuyên dùng gây mất trật tự, an toàn giao thông đường bộ. 17. sản xuất, sử dụng, mua, bán trái phép biển số xe; điều khiển xe cơ giới, xe máy chuyên dùng gắn biển số xe không do cơ quan nhà nước có thẩm quyền cấp, gắn biển số xe không đúng vị trí; bẻ cong, che lấp biển số xe; làm thay đổi chữ, số, màu sắc, hình dạng, kích thước của biển số xe. 18. làm gián đoạn hoạt động hoặc làm sai lệch dữ liệu của thiết bị giám sát hành trình, camera lắp trên xe theo quy định của luật này. 19. hủy hoại, làm hư hỏng, làm mất tác dụng thiết bị điều khiển, giám sát giao thông đường bộ, thiết bị thông minh hỗ trợ chỉ huy, điều khiển giao thông đường bộ. 20. đặt, để chướng ngại vật, vật cản khác trái phép trên đường bộ; rải vật sắc nhọn, đổ chất gây trơn trượt trên đường bộ; làm rơi vãi đất đá, hàng hóa, vật liệu xây dựng, phế thải trên đường bộ; đổ, xả thải, làm rơi vãi hóa chất, chất thải gây mất an toàn giao thông đường bộ. 21. cản trở người, phương tiện tham gia giao thông trên đường bộ; ném gạch, đất, đá, cát hoặc vật thể khác vào người, phương tiện đang tham gia giao thông trên đường bộ. 22. lợi dụng, lạm dụng nhiệm vụ bảo đảm trật tự, an toàn giao thông đường bộ để thực hiện hành vi vi phạm pháp luật, nhũng nhiễu, xâm phạm lợi ích của nhà nước, quyền và lợi ích hợp pháp của tổ chức, cá nhân. 23. lợi dụng chức vụ, quyền hạn, nghề nghiệp của bản thân hoặc người khác để vi phạm pháp luật về trật tự, an toàn giao thông đường bộ hoặc can thiệp, tác động vào quá trình xử lý vi phạm pháp luật về trật tự, an toàn giao thông đường bộ. 24. sử dụng quyền của xe ưu tiên khi không thực hiện nhiệm vụ theo quy định của pháp luật; lắp đặt, sử dụng thiết bị phát tín hiệu ưu tiên không đúng quy định của pháp luật. 25. không khai báo, khai báo gian dối hoặc cung cấp thông tin, tài liệu không đúng sự thật để trốn tránh trách nhiệm khi bị phát hiện vi phạm pháp luật về trật tự, an toàn giao thông đường bộ. 26. bỏ trốn sau khi gây tai nạn giao thông đường bộ để trốn tránh trách nhiệm; khi có điều kiện mà cố ý không cứu giúp người bị tai nạn giao thông đường bộ; xâm phạm tính mạng, sức khỏe, tài sản của người bị nạn, người gây tai nạn giao thông đường bộ hoặc người giúp đỡ, cứu chữa, đưa người bị nạn đi cấp cứu; lợi dụng việc xảy ra tai nạn giao thông đường bộ để hành hung, đe dọa, xúi giục, gây sức ép, làm mất trật tự, cản trở việc xử lý tai nạn giao thông đường bộ. 27. điều khiển vật thể bay, tàu bay không người lái, phương tiện bay siêu nhẹ hoạt động trong phạm vi khổ giới hạn đường bộ gây cản trở hoặc nguy cơ mất an toàn cho người, phương tiện tham gia giao thông đường bộ, trừ tàu bay không người lái, phương tiện bay siêu nhẹ được cấp phép bay. 28. hành vi khác vi phạm quy tắc giao thông đường bộ quy định tại chương ii của luật này. chương ii quy tắc giao thông đường bộ']","**Nguồn văn bản:** 36_2024_QH15_444251

**Tên văn bản:** Luật Trật tự, an toàn giao thông đường bộ

**điều 9:** Các hành vi bị nghiêm cấm

**Nội dung:**

1. Điều khiển xe cơ giới tham gia giao thông đường bộ không có giấy phép lái xe theo quy định của pháp luật; Điều khiển xe máy chuyên dùng tham gia giao thông đường bộ không có giấy phép lái xe hoặc chứng chỉ bồi dưỡng kiến thức pháp luật về giao thông đường bộ, bằng hoặc chứng chỉ điều khiển xe máy chuyên dùng.

2. Điều khiển phương tiện tham gia giao thông đường bộ mà trong máu hoặc hơi thở có nồng độ cồn.

3. Điều khiển phương tiện tham gia giao thông đường bộ mà trong cơ thể có chất ma túy hoặc chất kích thích khác mà pháp luật cấm sử dụng.

4. Xúc phạm, đe dọa, cản trở, chống đối hoặc không chấp hành hiệu lệnh, hướng dẫn, yêu cầu kiểm tra, kiểm soát của người thi hành công vụ về bảo đảm trật tự, an toàn giao thông đường bộ.

5. Đua xe, tổ chức đua xe, xúi giục, giúp sức, cổ vũ đua xe trái phép; Điều khiển phương tiện tham gia giao thông đường bộ lạng lách, đánh võng, rú ga liên tục.

6. Dùng tay cầm và sử dụng điện thoại hoặc thiết bị điện tử khác khi điều khiển phương tiện tham gia giao thông đang di chuyển trên đường bộ.

7. Giao xe cơ giới, xe máy chuyên dùng cho người không đủ điều kiện theo quy định của pháp luật để điều khiển xe tham gia giao thông đường bộ.

8. Đưa xe cơ giới, xe máy chuyên dùng không bảo đảm quy định của pháp luật về an toàn kỹ thuật và bảo vệ môi trường, phương tiện khác không đủ điều kiện theo quy định của pháp luật để tham gia giao thông đường bộ.

9. Nhập khẩu, sản xuất, lắp ráp xe cơ giới, xe máy chuyên dùng không bảo đảm quy định của pháp luật về chất lượng an toàn kỹ thuật và bảo vệ môi trường.

10. Cải tạo xe ô tô loại khác thành xe ô tô chở người, trừ cải tạo thành xe ô tô chở người phục vụ mục đích quốc phòng, an ninh.

11. Cải tạo trái phép; Cố ý can thiệp làm sai lệch chỉ số trên đồng hồ báo quãng đường đã chạy của xe ô tô; Cắt, hàn, tẩy xóa, đục sửa, đóng lại trái phép số khung, số động cơ của xe cơ giới, xe máy chuyên dùng.

12. Cố ý can thiệp, thay đổi phần mềm điều khiển của xe, động cơ của xe đã được đăng ký với cơ quan quản lý, nhằm mục đích gian lận kết quả kiểm tra, thử nghiệm, kiểm định; Thuê, mượn phụ tùng xe cơ giới chỉ để thực hiện việc kiểm định.

13. Chở hàng hóa vượt quá khối lượng toàn bộ, tải trọng trục, kích thước cho phép của xe hoặc vượt quá tải trọng, kích thước giới hạn cho phép của đường bộ khi chưa được cơ quan quản lý cấp phép hoặc không bảo đảm yêu cầu theo quy định của luật này; Chở hàng hóa trên xe có quy định phải chằng buộc nhưng không chằng buộc hoặc chằng buộc không đúng quy định của pháp luật; Chở quá số người theo quy định của pháp luật.


Tóm lại: Văn bản cung cấp liệt kê các hành vi bị nghiêm cấm khi tham gia giao thông, trong đó có hành vi chở quá số người quy định (điểm 13). Tuy nhiên, văn bản này không cung cấp chi tiết quy định về số người được phép chở trên mỗi loại xe mô tô, xe gắn máy. Cần tìm kiếm thêm thông tin ở các văn bản pháp luật khác để có câu trả lời chính xác.
","Người điều khiển xe mô tô, xe gắn máy chỉ được chở tối đa một người, trừ trường hợp chở người bệnh đi cấp cứu, trẻ em dưới 14 tuổi hoặc áp giải người vi phạm pháp luật.",1.0,0.4521336168975825,0.0,0.0
90,"Người điều khiển xe ô tô phải làm gì khi dừng xe, đỗ xe trên đường bộ?","['1. dừng xe là trạng thái đứng yên tạm thời của xe trong một khoảng thời gian cần thiết đủ để cho người lên xe, xuống xe, xếp dỡ hàng hóa, kiểm tra kỹ thuật xe hoặc hoạt động khác. khi dừng xe không được tắt máy và không được rời khỏi vị trí lái, trừ trường hợp rời khỏi vị trí lái để đóng, mở cửa xe, xếp dỡ hàng hóa, kiểm tra kỹ thuật xe nhưng phải sử dụng phanh đỗ xe hoặc thực hiện biện pháp an toàn khác. 2. đỗ xe là trạng thái đứng yên của xe không giới hạn thời gian. khi đỗ xe, người điều khiển phương tiện tham gia giao thông đường bộ chỉ được rời khỏi xe khi đã sử dụng phanh đỗ xe hoặc thực hiện biện pháp an toàn khác. xe đỗ trên đoạn đường dốc phải đánh lái về phía lề đường, chèn bánh. 3. người điều khiển phương tiện tham gia giao thông đường bộ khi dừng xe, đỗ xe trên đường phải thực hiện các quy định sau đây: a) có tín hiệu báo cho người điều khiển phương tiện tham gia giao thông đường bộ khác biết khi ra, vào vị trí dừng xe, đỗ xe; b) không làm ảnh hưởng đến người đi bộ và các phương tiện tham gia giao thông đường bộ. 4. người điều khiển phương tiện tham gia giao thông đường bộ không được dừng xe, đỗ xe tại các vị trí sau đây: a) bên trái đường một chiều; b) trên đoạn đường cong hoặc gần đầu dốc mà tầm nhìn bị che khuất; c) trên cầu, trừ những trường hợp tổ chức giao thông cho phép; d) gầm cầu vượt, trừ những nơi cho phép dừng xe, đỗ xe; đ) song song cùng chiều với một xe khác đang dừng, đỗ trên đường; e) cách xe ô tô đang đỗ ngược chiều dưới 20 mét trên đường phố hẹp, \ndưới 40 mét trên đường có một làn xe cơ giới trên một chiều đường; g) trên phần đường dành cho người đi bộ qua đường; h) nơi đường giao nhau và trong phạm vi 05 mét tính từ mép đường giao nhau; i) điểm đón, trả khách; k) trước cổng và trong phạm vi 05 mét hai bên cổng trụ sở cơ quan, tổ chức có bố trí đường cho xe ra, vào; l) tại nơi phần đường có chiều rộng chỉ đủ cho một làn xe cơ giới; m) trong phạm vi an toàn của đường sắt; n) che khuất biển báo hiệu đường bộ, đèn tín hiệu giao thông; o) trên đường dành riêng cho xe buýt, trên miệng cống thoát nước, miệng hầm của đường điện thoại, điện cao thế, chỗ dành riêng cho xe chữa cháy lấy nước; trên lòng đường, vỉa hè trái quy định của pháp luật. 5. trên đường bộ, người điều khiển phương tiện tham gia giao thông đường bộ chỉ được dừng xe, đỗ xe ở nơi có lề đường rộng hoặc khu đất ở bên ngoài phần đường xe chạy; trường hợp lề đường hẹp hoặc không có lề đường thì chỉ được dừng xe, đỗ xe sát mép đường phía bên phải theo chiều đi của mình. 6. trên đường phố, người điều khiển phương tiện tham gia giao thông đường bộ chỉ được dừng xe, đỗ xe sát theo lề đường, vỉa hè phía bên phải theo chiều đi của mình; bánh xe gần nhất không được cách xa lề đường, vỉa hè quá 0,25 mét và không gây cản trở, nguy hiểm cho người và phương tiện tham gia giao thông đường bộ. 7. trong trường hợp gặp sự cố kỹ thuật hoặc bất khả kháng khác buộc phải đỗ xe, khi đỗ xe chiếm một phần đường xe chạy hoặc tại nơi không được phép đỗ, phải có báo hiệu bằng đèn khẩn cấp hoặc đặt biển cảnh báo về phía sau xe để người điều khiển phương tiện tham gia giao thông đường bộ khác biết.']","**Nguồn văn bản:** 36_2024_QH15_444251

**Tên văn bản:** Luật Trật tự, an toàn giao thông đường bộ

**Điều 18:** Dừng xe, đỗ xe

**Nội dung:**

1. Dừng xe là trạng thái đứng yên tạm thời của xe trong một khoảng thời gian cần thiết đủ để cho người lên xe, xuống xe, xếp dỡ hàng hóa, kiểm tra kỹ thuật xe hoặc hoạt động khác. Khi dừng xe không được tắt máy và không được rời khỏi vị trí lái, trừ trường hợp rời khỏi vị trí lái để đóng, mở cửa xe, xếp dỡ hàng hóa, kiểm tra kỹ thuật xe nhưng phải sử dụng phanh đỗ xe hoặc thực hiện biện pháp an toàn khác.

2. Đỗ xe là trạng thái đứng yên của xe không giới hạn thời gian. Khi đỗ xe, người điều khiển phương tiện tham gia giao thông đường bộ chỉ được rời khỏi xe khi đã sử dụng phanh đỗ xe hoặc thực hiện biện pháp an toàn khác. Xe đỗ trên đoạn đường dốc phải đánh lái về phía lề đường, chèn bánh.

3. Người điều khiển phương tiện tham gia giao thông đường bộ khi dừng xe, đỗ xe trên đường phải thực hiện các quy định sau đây:

	a) Có tín hiệu báo cho người điều khiển phương tiện tham gia giao thông đường bộ khác biết khi ra, vào vị trí dừng xe, đỗ xe.

	b) Không làm ảnh hưởng đến người đi bộ và các phương tiện tham gia giao thông đường bộ.

4. Người điều khiển phương tiện tham gia giao thông đường bộ không được dừng xe, đỗ xe tại các vị trí sau đây:

	a) Bên trái đường một chiều.

	b) Trên đoạn đường cong hoặc gần đầu dốc mà tầm nhìn bị che khuất.

	c) Trên cầu, trừ những trường hợp tổ chức giao thông cho phép.

	d) Gầm cầu vượt, trừ những nơi cho phép dừng xe, đỗ xe.

	đ) Song song cùng chiều với một xe khác đang dừng, đỗ trên đường.

	e) Cách xe ô tô đang đỗ ngược chiều dưới 20 mét trên đường phố hẹp, dưới 40 mét trên đường có một làn xe cơ giới trên một chiều đường.

	g) Trên phần đường dành cho người đi bộ qua đường.

	h) Nơi đường giao nhau và trong phạm vi 05 mét tính từ mép đường giao nhau.

	i) Điểm đón, trả khách.

	k) Trước cổng và trong phạm vi 05 mét hai bên cổng trụ sở cơ quan, tổ chức có bố trí đường cho xe ra, vào.

	l) Tại nơi phần đường có chiều rộng chỉ đủ cho một làn xe cơ giới.

	m) Trong phạm vi an toàn của đường sắt.

	n) Che khuất biển báo hiệu đường bộ, đèn tín hiệu giao thông.

	o) Trên đường dành riêng cho xe buýt, trên miệng cống thoát nước, miệng hầm của đường điện thoại, điện cao thế, chỗ dành riêng cho xe chữa cháy lấy nước; trên lòng đường, vỉa hè trái quy định của pháp luật.


5. Trên đường bộ, người điều khiển phương tiện tham gia giao thông đường bộ chỉ được dừng xe, đỗ xe ở nơi có lề đường rộng hoặc khu đất ở bên ngoài phần đường xe chạy; trường hợp lề đường hẹp hoặc không có lề đường thì chỉ được dừng xe, đỗ xe sát mép đường phía bên phải theo chiều đi của mình.

6. Trên đường phố, người điều khiển phương tiện tham gia giao thông đường bộ chỉ được dừng xe, đỗ xe sát theo lề đường, vỉa hè phía bên phải theo chiều đi của mình; bánh xe gần nhất không được cách xa lề đường, vỉa hè quá 0,25 mét và không gây cản trở, nguy hiểm cho người và phương tiện tham gia giao thông đường bộ.

7. Trong trường hợp gặp sự cố kỹ thuật hoặc bất khả kháng khác buộc phải đỗ xe, khi đỗ xe chiếm một phần đường xe chạy hoặc tại nơi không được phép đỗ, phải có báo hiệu bằng đèn khẩn cấp hoặc đặt biển cảnh báo về phía sau xe để người điều khiển phương tiện tham gia giao thông đường bộ khác biết.


**Tóm lại:** Khi dừng xe, không tắt máy, không rời vị trí lái (trừ một số trường hợp). Khi đỗ xe, phải dùng phanh đỗ hoặc các biện pháp an toàn khác. Phải báo hiệu khi dừng, đỗ; không ảnh hưởng đến người khác. Có danh sách các vị trí cấm dừng, đỗ và quy định về vị trí được phép dừng, đỗ trên đường bộ và đường phố. Khi gặp sự cố phải đỗ xe ở nơi cấm đỗ, phải đặt biển báo hiệu.
","Khi dừng xe, đỗ xe trên đường bộ, người điều khiển xe ô tô phải cho xe dừng, đỗ sát mép đường bên phải theo chiều đi của mình; bánh xe gần nhất không được cách hè phố quá 0,25 mét và không gây cản trở, nguy hiểm cho giao thông.",1.0,0.5452688110853163,1.0,0.9999999999
91,Việc sử dụng còi xe được quy định như thế nào trong khu vực đông dân cư?,"['1. phạt tiền từ 200.000 đồng đến 400.000 đồng đối với người điều khiển xe thực hiện một trong các hành vi vi phạm sau đây: a) không chấp hành hiệu lệnh, chỉ dẫn của biển báo hiệu, vạch kẻ đường, trừ các hành vi vi phạm quy định tại điểm b, điểm d, điểm e khoản 2; điểm a, điểm c, điểm d, điểm h khoản 3; điểm a, điểm b, điểm c, điểm d khoản 4; điểm b, điểm d khoản 6; điểm a, điểm b, điểm c khoản 7; điểm a khoản 8; điểm b khoản 9; điểm a khoản 10 điều này; b) không có tín hiệu trước khi vượt hoặc có tín hiệu vượt xe nhưng không sử dụng trong suốt quá trình vượt xe; c) lùi xe mô tô ba bánh không quan sát hai bên, phía sau xe hoặc không có tín hiệu lùi xe; d) chở người ngồi trên xe sử dụng ô (dù); đ) không tuân thủ các quy định về nhường đường tại nơi đường giao nhau, trừ các hành vi vi phạm quy định tại điểm c, điểm d khoản 6 điều này; e) chuyển làn đường không đúng nơi cho phép hoặc không có tín hiệu báo trước hoặc chuyển làn đường không đúng quy định “mỗi lần chuyển làn đường chỉ được phép chuyển sang một làn đường liền kề”; g) không sử dụng đèn chiếu sáng trong thời gian từ 18 giờ ngày hôm trước đến 06 giờ ngày hôm sau hoặc khi có sương mù, khói, bụi, trời mưa, thời tiết xấu làm hạn chế tầm nhìn; h) tránh xe không đúng quy định; sử dụng đèn chiếu xa khi gặp người đi bộ qua đường hoặc khi đi trên đoạn đường qua khu dân cư có hệ thống chiếu sáng đang hoạt động hoặc khi gặp xe đi ngược chiều (trừ trường hợp dải phân cách có khả năng chống chói) hoặc khi chuyển hướng xe tại nơi đường giao nhau; không nhường đường cho xe đi ngược chiều theo quy định tại nơi đường hẹp, đường dốc, nơi có chướng ngại vật; i) sử dụng còi trong thời gian từ 22 giờ ngày hôm trước đến 05 giờ ngày hôm sau trong khu đông dân cư, khu vực cơ sở khám bệnh, chữa bệnh, trừ các xe ưu tiên đang đi làm nhiệm vụ theo quy định; k) điều khiển xe chạy dưới tốc độ tối thiểu trên đoạn đường bộ có quy định tốc độ tối thiểu cho phép. 2. phạt tiền từ 400.000 đồng đến 600.000 đồng đối với người điều khiển xe thực hiện một trong các hành vi vi phạm sau đây: a) dừng xe, đỗ xe trên phần đường xe chạy ở đoạn đường ngoài đô thị nơi có lề đường; b) điều khiển xe chạy quá tốc độ quy định từ 05 km/h đến dưới 10 km/h; c) điều khiển xe chạy tốc độ thấp mà không đi bên phải phần đường xe chạy gây cản trở giao thông; d) dừng xe, đỗ xe ở lòng đường gây cản trở giao thông; tụ tập từ 03 xe trở lên ở lòng đường, trong hầm đường bộ; đỗ, để xe ở lòng đường, vỉa hè trái phép; đ) xe không được quyền ưu tiên lắp đặt, sử dụng thiết bị phát tín hiệu của xe được quyền ưu tiên; e) dừng xe, đỗ xe trên điểm đón, trả khách, nơi đường bộ giao nhau, trên phần đường dành cho người đi bộ qua đường; dừng xe nơi có biển “cấm dừng xe và đỗ xe”; đỗ xe tại nơi có biển “cấm đỗ xe” hoặc biển “cấm dừng xe và đỗ xe”; không tuân thủ các quy định về dừng xe, đỗ xe tại nơi đường bộ giao nhau cùng mức với đường sắt; dừng xe, đỗ xe trong phạm vi hành lang an toàn giao thông đường sắt; g) chở theo 02 người trên xe, trừ trường hợp chở người bệnh đi cấp cứu, trẻ em dưới 12 tuổi, người già yếu hoặc người khuyết tật, áp giải người có hành vi vi phạm pháp luật; h) không đội “mũ bảo hiểm cho người đi mô tô, xe máy” hoặc đội “mũ bảo hiểm cho người đi mô tô, xe máy” không cài quai đúng quy cách khi điều khiển xe tham gia giao thông trên đường bộ; i) chở người ngồi trên xe không đội “mũ bảo hiểm cho người đi mô tô, xe máy” hoặc đội “mũ bảo hiểm cho người đi mô tô, xe máy” không cài quai đúng quy cách, trừ trường hợp chở người bệnh đi cấp cứu, trẻ em dưới 06 tuổi, áp giải người có hành vi vi phạm pháp luật; k) quay đầu xe tại nơi không được quay đầu xe, trừ hành vi vi phạm quy định tại điểm d khoản 4 điều này. 3. phạt tiền từ 600.000 đồng đến 800.000 đồng đối với người điều khiển xe thực hiện một trong các hành vi vi phạm sau đây: a) chuyển hướng không quan sát hoặc không bảo đảm khoảng cách an toàn với xe phía sau hoặc không giảm tốc độ hoặc không có tín hiệu báo hướng rẽ hoặc có tín hiệu báo hướng rẽ nhưng không sử dụng liên tục trong quá trình chuyển hướng (trừ trường hợp điều khiển xe đi theo hướng cong của đoạn đường bộ ở nơi đường không giao nhau cùng mức); điều khiển xe rẽ trái tại nơi có biển báo hiệu có nội dung cấm rẽ trái đối với loại phương tiện đang điều khiển; điều khiển xe rẽ phải tại nơi có biển báo hiệu có nội dung cấm rẽ phải đối với loại phương tiện đang điều khiển; b) chở theo từ 03 người trở lên trên xe; c) dừng xe, đỗ xe trên cầu; d) điều khiển xe không đi bên phải theo chiều đi của mình; đi không đúng phần đường, làn đường quy định (làn cùng chiều hoặc làn ngược chiều); điều khiển xe đi qua dải phân cách cố định ở giữa hai phần đường xe chạy; đ) vượt bên phải trong trường hợp không được phép; e) người đang điều khiển xe hoặc chở người ngồi trên xe bám, kéo, đẩy xe khác, vật khác, dẫn dắt vật nuôi, mang vác vật cồng kềnh; chở người đứng trên yên, giá đèo hàng hoặc ngồi trên tay lái của xe; g) điều khiển xe kéo theo xe khác, vật khác; h) chạy trong hầm đường bộ không sử dụng đèn chiếu sáng gần; i) không giữ khoảng cách an toàn để xảy ra va chạm với xe chạy liền trước hoặc không giữ khoảng cách theo quy định của biển báo hiệu “cự ly tối thiểu giữa hai xe”; k) điều khiển xe chạy dàn hàng ngang từ 03 xe trở lên; l) xe được quyền ưu tiên lắp đặt, sử dụng thiết bị phát tín hiệu ưu tiên không đúng quy định hoặc sử dụng thiết bị phát tín hiệu ưu tiên mà không có giấy phép của cơ quan có thẩm quyền cấp hoặc có giấy phép của cơ quan có thẩm quyền cấp nhưng không còn giá trị sử dụng theo quy định. 4. phạt tiền từ 800.000 đồng đến 1.000.000 đồng đối với người điều khiển xe thực hiện một trong các hành vi vi phạm sau đây: a) điều khiển xe chạy quá tốc độ quy định từ 10 km/h đến 20 km/h; b) dừng xe, đỗ xe trong hầm đường bộ không đúng nơi quy định; c) vượt xe trong những trường hợp không được vượt, vượt xe tại đoạn đường có biển báo hiệu có nội dung cấm vượt đối với loại phương tiện đang điều khiển, trừ các hành vi vi phạm quy định tại điểm đ khoản 3 điều này; d) quay đầu xe trong hầm đường bộ; đ) người đang điều khiển xe sử dụng ô (dù), thiết bị âm thanh (trừ thiết bị trợ thính), dùng tay cầm và sử dụng điện thoại hoặc các thiết bị điện tử khác. 5. phạt tiền từ 1.000.000 đồng đến 2.000.000 đồng đối với người điều khiển xe thực hiện một trong các hành vi vi phạm sau đây: a) điều khiển xe có liên quan trực tiếp đến vụ tai nạn giao thông mà không dừng ngay phương tiện, không giữ nguyên hiện trường, không trợ giúp người bị nạn, trừ hành vi vi phạm quy định tại điểm c khoản 9 điều này; b) chuyển hướng không nhường quyền đi trước cho: người đi bộ, xe lăn của người khuyết tật qua đường tại nơi có vạch kẻ đường dành cho người đi bộ; xe thô sơ đang đi trên phần đường dành cho xe thô sơ; c) chuyển hướng không nhường đường cho: các xe đi ngược chiều; người đi bộ, xe thô sơ đang qua đường tại nơi không có vạch kẻ đường cho người đi bộ. 6. phạt tiền từ 2.000.000 đồng đến 3.000.000 đồng đối với người điều khiển xe thực hiện một trong các hành vi vi phạm sau đây: a) điều khiển xe trên đường mà trong máu hoặc hơi thở có nồng độ cồn nhưng chưa vượt quá 50 miligam/100 mililít máu hoặc chưa vượt quá 0,25 miligam/1 lít khí thở; b) đi vào khu vực cấm, đường có biển báo hiệu có nội dung cấm đi vào đối với loại phương tiện đang điều khiển, trừ các hành vi vi phạm quy định tại điểm a, điểm b khoản 7 điều này và các trường hợp xe ưu tiên đang đi làm nhiệm vụ khẩn cấp theo quy định; c) không giảm tốc độ (hoặc dừng lại) và nhường đường khi điều khiển xe đi từ đường không ưu tiên ra đường ưu tiên, từ đường nhánh ra đường chính; d) không giảm tốc độ và nhường đường cho xe đi đến từ bên phải tại nơi đường giao nhau không có báo hiệu đi theo vòng xuyến; không giảm tốc độ và nhường đường cho xe đi đến từ bên trái tại nơi đường giao nhau có báo hiệu đi theo vòng xuyến. 7. phạt tiền từ 4.000.000 đồng đến 6.000.000 đồng đối với người điều khiển xe thực hiện một trong các hành vi vi phạm sau đây: a) đi ngược chiều của đường một chiều, đi ngược chiều trên đường có biển “cấm đi ngược chiều”, trừ hành vi vi phạm quy định tại điểm b khoản này và các trường hợp xe ưu tiên đang đi làm nhiệm vụ khẩn cấp theo quy định; điều khiển xe đi trên vỉa hè, trừ trường hợp điều khiển xe đi qua vỉa hè để vào nhà, cơ quan; b) điều khiển xe đi vào đường cao tốc, trừ xe phục vụ việc quản lý, bảo trì đường cao tốc; c) không chấp hành hiệu lệnh của đèn tín hiệu giao thông; d) không chấp hành hiệu lệnh, hướng dẫn của người điều khiển giao thông hoặc người kiểm soát giao thông; đ) không nhường đường hoặc gây cản trở xe được quyền ưu tiên đang phát tín hiệu ưu tiên đi làm nhiệm vụ. 8. phạt tiền từ 6.000.000 đồng đến 8.000.000 đồng đối với người điều khiển xe thực hiện một trong các hành vi vi phạm sau đây: a) điều khiển xe chạy quá tốc độ quy định trên 20 km/h; b) điều khiển xe trên đường mà trong máu hoặc hơi thở có nồng độ cồn vượt quá 50 miligam đến 80 miligam/100 mililít máu hoặc vượt quá 0,25 miligam đến 0,4 miligam/1 lít khí thở. 9. phạt tiền từ 8.000.000 đồng đến 10.000.000 đồng đối với người điều khiển xe thực hiện một trong các hành vi vi phạm sau đây: a) điều khiển xe lạng lách, đánh võng trên đường bộ; sử dụng chân chống hoặc vật khác quệt xuống đường khi xe đang chạy; b) điều khiển xe thành nhóm từ 02 xe trở lên chạy quá tốc độ quy định; c) gây tai nạn giao thông không dừng ngay phương tiện, không giữ nguyên hiện trường, không trợ giúp người bị nạn, không ở lại hiện trường hoặc không đến trình báo ngay với cơ quan công an, ủy ban nhân dân nơi gần nhất; d) điều khiển xe trên đường mà trong máu hoặc hơi thở có nồng độ cồn vượt quá 80 miligam/100 mililít máu hoặc vượt quá 0,4 miligam/1 lít khí thở; đ) không chấp hành yêu cầu kiểm tra về nồng độ cồn của người thi hành công vụ; e) điều khiển xe trên đường mà trong cơ thể có chất ma túy hoặc chất kích thích khác mà pháp luật cấm sử dụng; g) không chấp hành yêu cầu kiểm tra về chất ma túy hoặc chất kích thích khác mà pháp luật cấm sử dụng của người thi hành công vụ; h) ngồi phía sau vòng tay qua người ngồi trước để điều khiển xe, trừ trường hợp chở trẻ em dưới 06 tuổi ngồi phía trước; i) điều khiển xe thành đoàn gây cản trở giao thông, trừ trường hợp được cơ quan có thẩm quyền cấp phép; k) sử dụng còi, rú ga (nẹt pô) liên tục trong khu đông dân cư, khu vực cơ sở khám bệnh, chữa bệnh, trừ các xe ưu tiên đang đi làm nhiệm vụ theo quy định. 10. phạt tiền từ 10.000.000 đồng đến 14.000.000 đồng đối với người điều khiển xe thực hiện một trong các hành vi vi phạm sau đây: a) điều khiển xe không quan sát, giảm tốc độ hoặc dừng lại để bảo đảm an toàn theo quy định mà gây tai nạn giao thông; điều khiển xe chạy quá tốc độ quy định gây tai nạn giao thông; đi vào đường cao tốc, dừng xe, đỗ xe, quay đầu xe, lùi xe, vượt xe, chuyển hướng, chuyển làn đường không đúng quy định gây tai nạn giao thông; không đi đúng phần đường, làn đường, không giữ khoảng cách an toàn giữa hai xe theo quy định gây tai nạn giao thông hoặc đi vào đường có biển báo hiệu có nội dung cấm đi vào đối với loại phương tiện đang điều khiển, đi ngược chiều của đường một chiều, đi ngược chiều trên đường có biển “cấm đi ngược chiều” gây tai nạn giao thông; b) vi phạm quy định tại một trong các điểm, khoản sau của điều này mà gây tai nạn giao thông: điểm a, điểm d, điểm đ, điểm g, điểm h, điểm i, điểm k khoản 1; điểm c, điểm đ, điểm g khoản 2; điểm b, điểm e, điểm g, điểm h, điểm k khoản 3; điểm đ khoản 4; điểm c, điểm d khoản 6; điểm c, điểm d, điểm đ khoản 7; điểm a, điểm b, điểm h, điểm k khoản 9 điều này. 11. tịch thu phương tiện đối với người điều khiển xe thực hiện một trong các hành vi vi phạm sau đây: a) buông cả hai tay khi đang điều khiển xe; dùng chân điều khiển xe; ngồi về một bên điều khiển xe; nằm trên yên xe điều khiển xe; thay người điều khiển khi xe đang chạy; quay người về phía sau để điều khiển xe hoặc bịt mắt điều khiển xe; b) điều khiển xe chạy bằng một bánh đối với xe hai bánh, chạy bằng hai bánh đối với xe ba bánh; c) tái phạm hành vi điều khiển xe lạng lách, đánh võng quy định tại điểm a khoản 9 điều này. 12. ngoài việc bị áp dụng hình thức xử phạt chính, người điều khiển xe thực hiện hành vi vi phạm còn bị áp dụng các hình thức xử phạt bổ sung sau đây: a) thực hiện hành vi quy định tại điểm đ khoản 2 điều này còn bị tịch thu thiết bị phát tín hiệu ưu tiên lắp đặt, sử dụng trái quy định; b) thực hiện hành vi quy định tại điểm a, điểm b, điểm h, điểm i, điểm k khoản 9 điều này bị tước quyền sử dụng giấy phép lái xe từ 10 tháng đến 12 tháng; c) thực hiện hành vi quy định tại điểm d, điểm đ, điểm e, điểm g khoản 9; khoản 11 điều này bị tước quyền sử dụng giấy phép lái xe từ 22 tháng đến 24 tháng. 13. ngoài việc bị áp dụng hình thức xử phạt, người điều khiển xe thực hiện hành vi vi phạm còn bị trừ điểm giấy phép lái xe như sau: a) thực hiện hành vi quy định tại điểm b khoản 3; khoản 5; điểm b, điểm c, điểm d khoản 6; điểm a khoản 7 điều này bị trừ điểm giấy phép lái xe 02 điểm; b) thực hiện hành vi quy định tại điểm đ khoản 4; điểm a khoản 6; điểm c, điểm d, điểm đ khoản 7; điểm a khoản 8 điều này bị trừ điểm giấy phép lái xe 04 điểm; c) thực hiện hành vi quy định tại điểm b khoản 7, điểm c khoản 9 điều này bị trừ điểm giấy phép lái xe 06 điểm; d) thực hiện hành vi quy định tại điểm b khoản 8, khoản 10 điều này bị trừ điểm giấy phép lái xe 10 điểm.']","**Nguồn văn bản:** 168_2024_ND-CP_619502

**Tên văn bản:** Nghị định Quy định xử phạt vi phạm hành chính về trật tự, an toàn giao thông trong lĩnh vực giao thông đường bộ; trừ điểm, phục hồi điểm giấy phép lái xe

**Điều 7:** xử phạt, trừ điểm giấy phép lái của người điều khiển xe mô tô, xe gắn máy, các loại xe tương tự xe mô tô và các loại xe tương tự xe gắn máy vi phạm quy tắc giao thông đường bộ

**Nội dung:**

1. Phạt tiền từ 200.000 đồng đến 400.000 đồng đối với người điều khiển xe thực hiện một trong các hành vi vi phạm sau đây:

        a) Không chấp hành hiệu lệnh, chỉ dẫn của biển báo hiệu, vạch kẻ đường, trừ các hành vi vi phạm quy định tại điểm b, điểm d, điểm e khoản 2; điểm a, điểm c, điểm d, điểm h khoản 3; điểm a, điểm b, điểm c, điểm d khoản 4; điểm b, điểm d khoản 6; điểm a, điểm b, điểm c khoản 7; điểm a khoản 8; điểm b khoản 9; điểm a khoản 10 điều này.

        b) Không có tín hiệu trước khi vượt hoặc có tín hiệu vượt xe nhưng không sử dụng trong suốt quá trình vượt xe.

        c) Lùi xe mô tô ba bánh không quan sát hai bên, phía sau xe hoặc không có tín hiệu lùi xe.

        d) Chở người ngồi trên xe sử dụng ô (dù).

        đ) Không tuân thủ các quy định về nhường đường tại nơi đường giao nhau, trừ các hành vi vi phạm quy định tại điểm c, điểm d khoản 6 điều này.

        e) Chuyển làn đường không đúng nơi cho phép hoặc không có tín hiệu báo trước hoặc chuyển làn đường không đúng quy định “mỗi lần chuyển làn đường chỉ được phép chuyển sang một làn đường liền kề”.

        g) Không sử dụng đèn chiếu sáng trong thời gian từ 18 giờ ngày hôm trước đến 06 giờ ngày hôm sau hoặc khi có sương mù, khói, bụi, trời mưa, thời tiết xấu làm hạn chế tầm nhìn.

        h) Tránh xe không đúng quy định; sử dụng đèn chiếu xa khi gặp người đi bộ qua đường hoặc khi đi trên đoạn đường qua khu dân cư có hệ thống chiếu sáng đang hoạt động hoặc khi gặp xe đi ngược chiều (trừ trường hợp dải phân cách có khả năng chống chói) hoặc khi chuyển hướng xe tại nơi đường giao nhau; không nhường đường cho xe đi ngược chiều theo quy định tại nơi đường hẹp, đường dốc, nơi có chướng ngại vật.

        i) Sử dụng còi trong thời gian từ 22 giờ ngày hôm trước đến 05 giờ ngày hôm sau trong khu đông dân cư, khu vực cơ sở khám bệnh, chữa bệnh, trừ các xe ưu tiên đang đi làm nhiệm vụ theo quy định.

        k) Điều khiển xe chạy dưới tốc độ tối thiểu trên đoạn đường bộ có quy định tốc độ tối thiểu cho phép.


9. Phạt tiền từ 8.000.000 đồng đến 10.000.000 đồng đối với người điều khiển xe thực hiện một trong các hành vi vi phạm sau đây:
        
        a) Điều khiển xe lạng lách, đánh võng trên đường bộ; sử dụng chân chống hoặc vật khác quệt xuống đường khi xe đang chạy.

        b) Điều khiển xe thành nhóm từ 02 xe trở lên chạy quá tốc độ quy định.

        c) Gây tai nạn giao thông không dừng ngay phương tiện, không giữ nguyên hiện trường, không trợ giúp người bị nạn, không ở lại hiện trường hoặc không đến trình báo ngay với cơ quan công an, ủy ban nhân dân nơi gần nhất.

        d) Điều khiển xe trên đường mà trong máu hoặc hơi thở có nồng độ cồn vượt quá 80 miligam/100 mililít máu hoặc vượt quá 0,4 miligam/1 lít khí thở.

        đ) Không chấp hành yêu cầu kiểm tra về nồng độ cồn của người thi hành công vụ.

        e) Điều khiển xe trên đường mà trong cơ thể có chất ma túy hoặc chất kích thích khác mà pháp luật cấm sử dụng.

        g) Không chấp hành yêu cầu kiểm tra về chất ma túy hoặc chất kích thích khác mà pháp luật cấm sử dụng của người thi hành công vụ.

        h) Ngồi phía sau vòng tay qua người ngồi trước để điều khiển xe, trừ trường hợp chở trẻ em dưới 06 tuổi ngồi phía trước.

        i) Điều khiển xe thành đoàn gây cản trở giao thông, trừ trường hợp được cơ quan có thẩm quyền cấp phép.

        k) Sử dụng còi, rú ga (nẹt pô) liên tục trong khu đông dân cư, khu vực cơ sở khám bệnh, chữa bệnh, trừ các xe ưu tiên đang đi làm nhiệm vụ theo quy định.



**Tóm lại:** Cấm sử dụng còi từ 22h hôm trước đến 5h hôm sau trong khu đông dân cư, khu vực cơ sở khám bệnh, chữa bệnh, trừ xe ưu tiên. Phạt tiền từ 200.000 - 400.000 đồng.  Ngoài ra, nếu sử dụng còi và rú ga liên tục sẽ bị phạt từ 8.000.000 - 10.000.000 đồng.
","Trong khu vực đông dân cư, từ 22 giờ đến 5 giờ sáng hôm sau, người điều khiển xe cơ giới không được bấm còi, rú ga liên tục, trừ các xe ưu tiên đang đi làm nhiệm vụ theo quy định.",1.0,0.3810536147171371,1.0,0.9999999999
92,Người điều khiển xe khi tham gia giao thông có bắt buộc phải mang theo giấy tờ gì?,"['1. người lái xe tham gia giao thông đường bộ phải đủ tuổi, sức khỏe theo quy định của pháp luật; có giấy phép lái xe đang còn điểm, còn hiệu lực phù hợp với loại xe đang điều khiển do cơ quan có thẩm quyền cấp, trừ người lái xe gắn máy quy định tại khoản 4 điều này. khi tham gia giao thông đường bộ, người lái xe phải mang theo các giấy tờ sau đây: a) chứng nhận đăng ký xe hoặc bản sao chứng nhận đăng ký xe có chứng thực kèm bản gốc giấy tờ xác nhận của tổ chức tín dụng, chi nhánh ngân hàng nước ngoài còn hiệu lực trong trường hợp xe đang được thế chấp tại tổ chức tín dụng, chi nhánh ngân hàng nước ngoài; b) giấy phép lái xe phù hợp với loại xe đang điều khiển; c) chứng nhận kiểm định an toàn kỹ thuật và bảo vệ môi trường đối với xe cơ giới theo quy định của pháp luật; d) chứng nhận bảo hiểm bắt buộc trách nhiệm dân sự của chủ xe cơ giới. 2. người điều khiển xe máy chuyên dùng tham gia giao thông đường bộ phải đủ tuổi, sức khỏe theo quy định của pháp luật; có bằng hoặc chứng chỉ điều khiển xe máy chuyên dùng phù hợp loại xe máy chuyên dùng đang điều khiển; có giấy phép lái xe đang còn điểm, còn hiệu lực hoặc chứng chỉ bồi dưỡng kiến thức pháp luật về giao thông đường bộ. khi tham gia giao thông đường bộ, người điều khiển xe máy chuyên dùng phải mang theo các loại giấy tờ sau đây: a) chứng nhận đăng ký xe hoặc bản sao chứng nhận đăng ký xe có chứng thực kèm bản gốc giấy biên nhận còn hiệu lực của tổ chức tín dụng, chi nhánh ngân hàng nước ngoài trong trường hợp xe đang được thế chấp tại tổ chức tín dụng, chi nhánh ngân hàng nước ngoài; b) bằng hoặc chứng chỉ điều khiển xe máy chuyên dùng; c) giấy phép lái xe hoặc chứng chỉ bồi dưỡng kiến thức pháp luật về giao thông đường bộ; d) chứng nhận kiểm định an toàn kỹ thuật và bảo vệ môi trường đối với xe máy chuyên dùng theo quy định của pháp luật; đ) chứng nhận bảo hiểm bắt buộc trách nhiệm dân sự theo quy định của pháp luật. 3. trường hợp giấy tờ quy định tại khoản 1 và khoản 2 điều này đã được tích hợp vào tài khoản định danh điện tử thì việc xuất trình, kiểm tra có thể thực hiện thông qua tài khoản định danh điện tử. 4. người lái xe gắn máy tham gia giao thông đường bộ phải hiểu biết quy tắc giao thông đường bộ, có kỹ năng điều khiển phương tiện; đủ điều kiện về độ tuổi, sức khỏe theo quy định tại điểm a khoản 1 và khoản 2 điều 59 của luật này. 5. người tập lái xe ô tô, người dự sát hạch lái xe ô tô khi tham gia giao thông đường bộ phải thực hành trên xe tập lái, xe sát hạch trên tuyến đường tập lái, tuyến đường sát hạch, có giáo viên dạy lái hoặc sát hạch viên bảo trợ tay lái. giáo viên dạy lái, sát hạch viên phải mang theo các loại giấy tờ quy định tại khoản 1 điều này.']","**Nguồn văn bản:** 36_2024_QH15_444251

**Tên văn bản:** Luật Trật tự, an toàn giao thông đường bộ

**Điều 56:** Điều kiện của người điều khiển phương tiện tham gia giao thông đường bộ

**Nội dung:**

1. Người lái xe tham gia giao thông đường bộ phải đủ tuổi, sức khỏe theo quy định của pháp luật; có giấy phép lái xe đang còn điểm, còn hiệu lực phù hợp với loại xe đang điều khiển do cơ quan có thẩm quyền cấp, trừ người lái xe gắn máy quy định tại khoản 4 điều này. Khi tham gia giao thông đường bộ, người lái xe phải mang theo các giấy tờ sau đây:

	a) Chứng nhận đăng ký xe hoặc bản sao chứng nhận đăng ký xe có chứng thực kèm bản gốc giấy tờ xác nhận của tổ chức tín dụng, chi nhánh ngân hàng nước ngoài còn hiệu lực trong trường hợp xe đang được thế chấp tại tổ chức tín dụng, chi nhánh ngân hàng nước ngoài.

	b) Giấy phép lái xe phù hợp với loại xe đang điều khiển.

	c) Chứng nhận kiểm định an toàn kỹ thuật và bảo vệ môi trường đối với xe cơ giới theo quy định của pháp luật.

	d) Chứng nhận bảo hiểm bắt buộc trách nhiệm dân sự của chủ xe cơ giới.

2. Người điều khiển xe máy chuyên dùng tham gia giao thông đường bộ phải đủ tuổi, sức khỏe theo quy định của pháp luật; có bằng hoặc chứng chỉ điều khiển xe máy chuyên dùng phù hợp loại xe máy chuyên dùng đang điều khiển; có giấy phép lái xe đang còn điểm, còn hiệu lực hoặc chứng chỉ bồi dưỡng kiến thức pháp luật về giao thông đường bộ. Khi tham gia giao thông đường bộ, người điều khiển xe máy chuyên dùng phải mang theo các loại giấy tờ sau đây:

	a) Chứng nhận đăng ký xe hoặc bản sao chứng nhận đăng ký xe có chứng thực kèm bản gốc giấy biên nhận còn hiệu lực của tổ chức tín dụng, chi nhánh ngân hàng nước ngoài trong trường hợp xe đang được thế chấp tại tổ chức tín dụng, chi nhánh ngân hàng nước ngoài.

	b) Bằng hoặc chứng chỉ điều khiển xe máy chuyên dùng.

	c) Giấy phép lái xe hoặc chứng chỉ bồi dưỡng kiến thức pháp luật về giao thông đường bộ.

	d) Chứng nhận kiểm định an toàn kỹ thuật và bảo vệ môi trường đối với xe máy chuyên dùng theo quy định của pháp luật.

	đ) Chứng nhận bảo hiểm bắt buộc trách nhiệm dân sự theo quy định của pháp luật.

3. Trường hợp giấy tờ quy định tại khoản 1 và khoản 2 điều này đã được tích hợp vào tài khoản định danh điện tử thì việc xuất trình, kiểm tra có thể thực hiện thông qua tài khoản định danh điện tử.

4. Người lái xe gắn máy tham gia giao thông đường bộ phải hiểu biết quy tắc giao thông đường bộ, có kỹ năng điều khiển phương tiện; đủ điều kiện về độ tuổi, sức khỏe theo quy định tại điểm a khoản 1 và khoản 2 điều 59 của luật này.

5. Người tập lái xe ô tô, người dự sát hạch lái xe ô tô khi tham gia giao thông đường bộ phải thực hành trên xe tập lái, xe sát hạch trên tuyến đường tập lái, tuyến đường sát hạch, có giáo viên dạy lái hoặc sát hạch viên bảo trợ tay lái. Giáo viên dạy lái, sát hạch viên phải mang theo các loại giấy tờ quy định tại khoản 1 điều này.


**Tóm lại:** Khi tham gia giao thông, người lái xe (trừ xe gắn máy) phải mang theo: chứng nhận đăng ký xe, giấy phép lái xe, chứng nhận kiểm định an toàn kỹ thuật và bảo vệ môi trường (đối với xe cơ giới), và chứng nhận bảo hiểm bắt buộc trách nhiệm dân sự. Người điều khiển xe máy chuyên dùng cần mang theo các giấy tờ tương tự, bổ sung bằng/chứng chỉ điều khiển xe máy chuyên dùng.  Nếu các giấy tờ này đã được tích hợp vào tài khoản định danh điện tử thì có thể xuất trình thông qua tài khoản đó.
","Người điều khiển xe khi tham gia giao thông phải mang theo các giấy tờ sau: giấy đăng ký xe, giấy phép lái xe phù hợp với loại xe đang điều khiển, giấy chứng nhận kiểm định an toàn kỹ thuật và bảo vệ môi trường (đối với xe cơ giới), giấy chứng nhận bảo hiểm trách nhiệm dân sự của chủ xe cơ giới.",1.0,0.5810342464924081,1.0,0.9999999999
93,Việc sử dụng đèn chiếu xa (đèn pha) được quy định như thế nào khi tham gia giao thông?,"['1. phạt tiền từ 200.000 đồng đến 400.000 đồng đối với người điều khiển xe thực hiện một trong các hành vi vi phạm sau đây: a) không chấp hành hiệu lệnh, chỉ dẫn của biển báo hiệu, vạch kẻ đường, trừ các hành vi vi phạm quy định tại điểm b, điểm d, điểm e khoản 2; điểm a, điểm c, điểm d, điểm h khoản 3; điểm a, điểm b, điểm c, điểm d khoản 4; điểm b, điểm d khoản 6; điểm a, điểm b, điểm c khoản 7; điểm a khoản 8; điểm b khoản 9; điểm a khoản 10 điều này; b) không có tín hiệu trước khi vượt hoặc có tín hiệu vượt xe nhưng không sử dụng trong suốt quá trình vượt xe; c) lùi xe mô tô ba bánh không quan sát hai bên, phía sau xe hoặc không có tín hiệu lùi xe; d) chở người ngồi trên xe sử dụng ô (dù); đ) không tuân thủ các quy định về nhường đường tại nơi đường giao nhau, trừ các hành vi vi phạm quy định tại điểm c, điểm d khoản 6 điều này; e) chuyển làn đường không đúng nơi cho phép hoặc không có tín hiệu báo trước hoặc chuyển làn đường không đúng quy định “mỗi lần chuyển làn đường chỉ được phép chuyển sang một làn đường liền kề”; g) không sử dụng đèn chiếu sáng trong thời gian từ 18 giờ ngày hôm trước đến 06 giờ ngày hôm sau hoặc khi có sương mù, khói, bụi, trời mưa, thời tiết xấu làm hạn chế tầm nhìn; h) tránh xe không đúng quy định; sử dụng đèn chiếu xa khi gặp người đi bộ qua đường hoặc khi đi trên đoạn đường qua khu dân cư có hệ thống chiếu sáng đang hoạt động hoặc khi gặp xe đi ngược chiều (trừ trường hợp dải phân cách có khả năng chống chói) hoặc khi chuyển hướng xe tại nơi đường giao nhau; không nhường đường cho xe đi ngược chiều theo quy định tại nơi đường hẹp, đường dốc, nơi có chướng ngại vật; i) sử dụng còi trong thời gian từ 22 giờ ngày hôm trước đến 05 giờ ngày hôm sau trong khu đông dân cư, khu vực cơ sở khám bệnh, chữa bệnh, trừ các xe ưu tiên đang đi làm nhiệm vụ theo quy định; k) điều khiển xe chạy dưới tốc độ tối thiểu trên đoạn đường bộ có quy định tốc độ tối thiểu cho phép. 2. phạt tiền từ 400.000 đồng đến 600.000 đồng đối với người điều khiển xe thực hiện một trong các hành vi vi phạm sau đây: a) dừng xe, đỗ xe trên phần đường xe chạy ở đoạn đường ngoài đô thị nơi có lề đường; b) điều khiển xe chạy quá tốc độ quy định từ 05 km/h đến dưới 10 km/h; c) điều khiển xe chạy tốc độ thấp mà không đi bên phải phần đường xe chạy gây cản trở giao thông; d) dừng xe, đỗ xe ở lòng đường gây cản trở giao thông; tụ tập từ 03 xe trở lên ở lòng đường, trong hầm đường bộ; đỗ, để xe ở lòng đường, vỉa hè trái phép; đ) xe không được quyền ưu tiên lắp đặt, sử dụng thiết bị phát tín hiệu của xe được quyền ưu tiên; e) dừng xe, đỗ xe trên điểm đón, trả khách, nơi đường bộ giao nhau, trên phần đường dành cho người đi bộ qua đường; dừng xe nơi có biển “cấm dừng xe và đỗ xe”; đỗ xe tại nơi có biển “cấm đỗ xe” hoặc biển “cấm dừng xe và đỗ xe”; không tuân thủ các quy định về dừng xe, đỗ xe tại nơi đường bộ giao nhau cùng mức với đường sắt; dừng xe, đỗ xe trong phạm vi hành lang an toàn giao thông đường sắt; g) chở theo 02 người trên xe, trừ trường hợp chở người bệnh đi cấp cứu, trẻ em dưới 12 tuổi, người già yếu hoặc người khuyết tật, áp giải người có hành vi vi phạm pháp luật; h) không đội “mũ bảo hiểm cho người đi mô tô, xe máy” hoặc đội “mũ bảo hiểm cho người đi mô tô, xe máy” không cài quai đúng quy cách khi điều khiển xe tham gia giao thông trên đường bộ; i) chở người ngồi trên xe không đội “mũ bảo hiểm cho người đi mô tô, xe máy” hoặc đội “mũ bảo hiểm cho người đi mô tô, xe máy” không cài quai đúng quy cách, trừ trường hợp chở người bệnh đi cấp cứu, trẻ em dưới 06 tuổi, áp giải người có hành vi vi phạm pháp luật; k) quay đầu xe tại nơi không được quay đầu xe, trừ hành vi vi phạm quy định tại điểm d khoản 4 điều này. 3. phạt tiền từ 600.000 đồng đến 800.000 đồng đối với người điều khiển xe thực hiện một trong các hành vi vi phạm sau đây: a) chuyển hướng không quan sát hoặc không bảo đảm khoảng cách an toàn với xe phía sau hoặc không giảm tốc độ hoặc không có tín hiệu báo hướng rẽ hoặc có tín hiệu báo hướng rẽ nhưng không sử dụng liên tục trong quá trình chuyển hướng (trừ trường hợp điều khiển xe đi theo hướng cong của đoạn đường bộ ở nơi đường không giao nhau cùng mức); điều khiển xe rẽ trái tại nơi có biển báo hiệu có nội dung cấm rẽ trái đối với loại phương tiện đang điều khiển; điều khiển xe rẽ phải tại nơi có biển báo hiệu có nội dung cấm rẽ phải đối với loại phương tiện đang điều khiển; b) chở theo từ 03 người trở lên trên xe; c) dừng xe, đỗ xe trên cầu; d) điều khiển xe không đi bên phải theo chiều đi của mình; đi không đúng phần đường, làn đường quy định (làn cùng chiều hoặc làn ngược chiều); điều khiển xe đi qua dải phân cách cố định ở giữa hai phần đường xe chạy; đ) vượt bên phải trong trường hợp không được phép; e) người đang điều khiển xe hoặc chở người ngồi trên xe bám, kéo, đẩy xe khác, vật khác, dẫn dắt vật nuôi, mang vác vật cồng kềnh; chở người đứng trên yên, giá đèo hàng hoặc ngồi trên tay lái của xe; g) điều khiển xe kéo theo xe khác, vật khác; h) chạy trong hầm đường bộ không sử dụng đèn chiếu sáng gần; i) không giữ khoảng cách an toàn để xảy ra va chạm với xe chạy liền trước hoặc không giữ khoảng cách theo quy định của biển báo hiệu “cự ly tối thiểu giữa hai xe”; k) điều khiển xe chạy dàn hàng ngang từ 03 xe trở lên; l) xe được quyền ưu tiên lắp đặt, sử dụng thiết bị phát tín hiệu ưu tiên không đúng quy định hoặc sử dụng thiết bị phát tín hiệu ưu tiên mà không có giấy phép của cơ quan có thẩm quyền cấp hoặc có giấy phép của cơ quan có thẩm quyền cấp nhưng không còn giá trị sử dụng theo quy định. 4. phạt tiền từ 800.000 đồng đến 1.000.000 đồng đối với người điều khiển xe thực hiện một trong các hành vi vi phạm sau đây: a) điều khiển xe chạy quá tốc độ quy định từ 10 km/h đến 20 km/h; b) dừng xe, đỗ xe trong hầm đường bộ không đúng nơi quy định; c) vượt xe trong những trường hợp không được vượt, vượt xe tại đoạn đường có biển báo hiệu có nội dung cấm vượt đối với loại phương tiện đang điều khiển, trừ các hành vi vi phạm quy định tại điểm đ khoản 3 điều này; d) quay đầu xe trong hầm đường bộ; đ) người đang điều khiển xe sử dụng ô (dù), thiết bị âm thanh (trừ thiết bị trợ thính), dùng tay cầm và sử dụng điện thoại hoặc các thiết bị điện tử khác. 5. phạt tiền từ 1.000.000 đồng đến 2.000.000 đồng đối với người điều khiển xe thực hiện một trong các hành vi vi phạm sau đây: a) điều khiển xe có liên quan trực tiếp đến vụ tai nạn giao thông mà không dừng ngay phương tiện, không giữ nguyên hiện trường, không trợ giúp người bị nạn, trừ hành vi vi phạm quy định tại điểm c khoản 9 điều này; b) chuyển hướng không nhường quyền đi trước cho: người đi bộ, xe lăn của người khuyết tật qua đường tại nơi có vạch kẻ đường dành cho người đi bộ; xe thô sơ đang đi trên phần đường dành cho xe thô sơ; c) chuyển hướng không nhường đường cho: các xe đi ngược chiều; người đi bộ, xe thô sơ đang qua đường tại nơi không có vạch kẻ đường cho người đi bộ. 6. phạt tiền từ 2.000.000 đồng đến 3.000.000 đồng đối với người điều khiển xe thực hiện một trong các hành vi vi phạm sau đây: a) điều khiển xe trên đường mà trong máu hoặc hơi thở có nồng độ cồn nhưng chưa vượt quá 50 miligam/100 mililít máu hoặc chưa vượt quá 0,25 miligam/1 lít khí thở; b) đi vào khu vực cấm, đường có biển báo hiệu có nội dung cấm đi vào đối với loại phương tiện đang điều khiển, trừ các hành vi vi phạm quy định tại điểm a, điểm b khoản 7 điều này và các trường hợp xe ưu tiên đang đi làm nhiệm vụ khẩn cấp theo quy định; c) không giảm tốc độ (hoặc dừng lại) và nhường đường khi điều khiển xe đi từ đường không ưu tiên ra đường ưu tiên, từ đường nhánh ra đường chính; d) không giảm tốc độ và nhường đường cho xe đi đến từ bên phải tại nơi đường giao nhau không có báo hiệu đi theo vòng xuyến; không giảm tốc độ và nhường đường cho xe đi đến từ bên trái tại nơi đường giao nhau có báo hiệu đi theo vòng xuyến. 7. phạt tiền từ 4.000.000 đồng đến 6.000.000 đồng đối với người điều khiển xe thực hiện một trong các hành vi vi phạm sau đây: a) đi ngược chiều của đường một chiều, đi ngược chiều trên đường có biển “cấm đi ngược chiều”, trừ hành vi vi phạm quy định tại điểm b khoản này và các trường hợp xe ưu tiên đang đi làm nhiệm vụ khẩn cấp theo quy định; điều khiển xe đi trên vỉa hè, trừ trường hợp điều khiển xe đi qua vỉa hè để vào nhà, cơ quan; b) điều khiển xe đi vào đường cao tốc, trừ xe phục vụ việc quản lý, bảo trì đường cao tốc; c) không chấp hành hiệu lệnh của đèn tín hiệu giao thông; d) không chấp hành hiệu lệnh, hướng dẫn của người điều khiển giao thông hoặc người kiểm soát giao thông; đ) không nhường đường hoặc gây cản trở xe được quyền ưu tiên đang phát tín hiệu ưu tiên đi làm nhiệm vụ. 8. phạt tiền từ 6.000.000 đồng đến 8.000.000 đồng đối với người điều khiển xe thực hiện một trong các hành vi vi phạm sau đây: a) điều khiển xe chạy quá tốc độ quy định trên 20 km/h; b) điều khiển xe trên đường mà trong máu hoặc hơi thở có nồng độ cồn vượt quá 50 miligam đến 80 miligam/100 mililít máu hoặc vượt quá 0,25 miligam đến 0,4 miligam/1 lít khí thở. 9. phạt tiền từ 8.000.000 đồng đến 10.000.000 đồng đối với người điều khiển xe thực hiện một trong các hành vi vi phạm sau đây: a) điều khiển xe lạng lách, đánh võng trên đường bộ; sử dụng chân chống hoặc vật khác quệt xuống đường khi xe đang chạy; b) điều khiển xe thành nhóm từ 02 xe trở lên chạy quá tốc độ quy định; c) gây tai nạn giao thông không dừng ngay phương tiện, không giữ nguyên hiện trường, không trợ giúp người bị nạn, không ở lại hiện trường hoặc không đến trình báo ngay với cơ quan công an, ủy ban nhân dân nơi gần nhất; d) điều khiển xe trên đường mà trong máu hoặc hơi thở có nồng độ cồn vượt quá 80 miligam/100 mililít máu hoặc vượt quá 0,4 miligam/1 lít khí thở; đ) không chấp hành yêu cầu kiểm tra về nồng độ cồn của người thi hành công vụ; e) điều khiển xe trên đường mà trong cơ thể có chất ma túy hoặc chất kích thích khác mà pháp luật cấm sử dụng; g) không chấp hành yêu cầu kiểm tra về chất ma túy hoặc chất kích thích khác mà pháp luật cấm sử dụng của người thi hành công vụ; h) ngồi phía sau vòng tay qua người ngồi trước để điều khiển xe, trừ trường hợp chở trẻ em dưới 06 tuổi ngồi phía trước; i) điều khiển xe thành đoàn gây cản trở giao thông, trừ trường hợp được cơ quan có thẩm quyền cấp phép; k) sử dụng còi, rú ga (nẹt pô) liên tục trong khu đông dân cư, khu vực cơ sở khám bệnh, chữa bệnh, trừ các xe ưu tiên đang đi làm nhiệm vụ theo quy định. 10. phạt tiền từ 10.000.000 đồng đến 14.000.000 đồng đối với người điều khiển xe thực hiện một trong các hành vi vi phạm sau đây: a) điều khiển xe không quan sát, giảm tốc độ hoặc dừng lại để bảo đảm an toàn theo quy định mà gây tai nạn giao thông; điều khiển xe chạy quá tốc độ quy định gây tai nạn giao thông; đi vào đường cao tốc, dừng xe, đỗ xe, quay đầu xe, lùi xe, vượt xe, chuyển hướng, chuyển làn đường không đúng quy định gây tai nạn giao thông; không đi đúng phần đường, làn đường, không giữ khoảng cách an toàn giữa hai xe theo quy định gây tai nạn giao thông hoặc đi vào đường có biển báo hiệu có nội dung cấm đi vào đối với loại phương tiện đang điều khiển, đi ngược chiều của đường một chiều, đi ngược chiều trên đường có biển “cấm đi ngược chiều” gây tai nạn giao thông; b) vi phạm quy định tại một trong các điểm, khoản sau của điều này mà gây tai nạn giao thông: điểm a, điểm d, điểm đ, điểm g, điểm h, điểm i, điểm k khoản 1; điểm c, điểm đ, điểm g khoản 2; điểm b, điểm e, điểm g, điểm h, điểm k khoản 3; điểm đ khoản 4; điểm c, điểm d khoản 6; điểm c, điểm d, điểm đ khoản 7; điểm a, điểm b, điểm h, điểm k khoản 9 điều này. 11. tịch thu phương tiện đối với người điều khiển xe thực hiện một trong các hành vi vi phạm sau đây: a) buông cả hai tay khi đang điều khiển xe; dùng chân điều khiển xe; ngồi về một bên điều khiển xe; nằm trên yên xe điều khiển xe; thay người điều khiển khi xe đang chạy; quay người về phía sau để điều khiển xe hoặc bịt mắt điều khiển xe; b) điều khiển xe chạy bằng một bánh đối với xe hai bánh, chạy bằng hai bánh đối với xe ba bánh; c) tái phạm hành vi điều khiển xe lạng lách, đánh võng quy định tại điểm a khoản 9 điều này. 12. ngoài việc bị áp dụng hình thức xử phạt chính, người điều khiển xe thực hiện hành vi vi phạm còn bị áp dụng các hình thức xử phạt bổ sung sau đây: a) thực hiện hành vi quy định tại điểm đ khoản 2 điều này còn bị tịch thu thiết bị phát tín hiệu ưu tiên lắp đặt, sử dụng trái quy định; b) thực hiện hành vi quy định tại điểm a, điểm b, điểm h, điểm i, điểm k khoản 9 điều này bị tước quyền sử dụng giấy phép lái xe từ 10 tháng đến 12 tháng; c) thực hiện hành vi quy định tại điểm d, điểm đ, điểm e, điểm g khoản 9; khoản 11 điều này bị tước quyền sử dụng giấy phép lái xe từ 22 tháng đến 24 tháng. 13. ngoài việc bị áp dụng hình thức xử phạt, người điều khiển xe thực hiện hành vi vi phạm còn bị trừ điểm giấy phép lái xe như sau: a) thực hiện hành vi quy định tại điểm b khoản 3; khoản 5; điểm b, điểm c, điểm d khoản 6; điểm a khoản 7 điều này bị trừ điểm giấy phép lái xe 02 điểm; b) thực hiện hành vi quy định tại điểm đ khoản 4; điểm a khoản 6; điểm c, điểm d, điểm đ khoản 7; điểm a khoản 8 điều này bị trừ điểm giấy phép lái xe 04 điểm; c) thực hiện hành vi quy định tại điểm b khoản 7, điểm c khoản 9 điều này bị trừ điểm giấy phép lái xe 06 điểm; d) thực hiện hành vi quy định tại điểm b khoản 8, khoản 10 điều này bị trừ điểm giấy phép lái xe 10 điểm.']","**Nguồn văn bản:** 168_2024_ND-CP_619502

**Tên văn bản:** Nghị định Quy định xử phạt vi phạm hành chính về trật tự, an toàn giao thông trong lĩnh vực giao thông đường bộ; trừ điểm, phục hồi điểm giấy phép lái xe

**Điều 7:** xử phạt, trừ điểm giấy phép lái của người điều khiển xe mô tô, xe gắn máy, các loại xe tương tự xe mô tô và các loại xe tương tự xe gắn máy vi phạm quy tắc giao thông đường bộ

**Nội dung:**

1. Phạt tiền từ 200.000 đồng đến 400.000 đồng đối với người điều khiển xe thực hiện một trong các hành vi vi phạm sau đây:

        a) Không chấp hành hiệu lệnh, chỉ dẫn của biển báo hiệu, vạch kẻ đường, trừ các hành vi vi phạm quy định tại điểm b, điểm d, điểm e khoản 2; điểm a, điểm c, điểm d, điểm h khoản 3; điểm a, điểm b, điểm c, điểm d khoản 4; điểm b, điểm d khoản 6; điểm a, điểm b, điểm c khoản 7; điểm a khoản 8; điểm b khoản 9; điểm a khoản 10 điều này.

        b) Không có tín hiệu trước khi vượt hoặc có tín hiệu vượt xe nhưng không sử dụng trong suốt quá trình vượt xe.

        c) Lùi xe mô tô ba bánh không quan sát hai bên, phía sau xe hoặc không có tín hiệu lùi xe.

        d) Chở người ngồi trên xe sử dụng ô (dù).

        đ) Không tuân thủ các quy định về nhường đường tại nơi đường giao nhau, trừ các hành vi vi phạm quy định tại điểm c, điểm d khoản 6 điều này.

        e) Chuyển làn đường không đúng nơi cho phép hoặc không có tín hiệu báo trước hoặc chuyển làn đường không đúng quy định “mỗi lần chuyển làn đường chỉ được phép chuyển sang một làn đường liền kề”.

        g) Không sử dụng đèn chiếu sáng trong thời gian từ 18 giờ ngày hôm trước đến 06 giờ ngày hôm sau hoặc khi có sương mù, khói, bụi, trời mưa, thời tiết xấu làm hạn chế tầm nhìn.

        h) Tránh xe không đúng quy định; sử dụng đèn chiếu xa khi gặp người đi bộ qua đường hoặc khi đi trên đoạn đường qua khu dân cư có hệ thống chiếu sáng đang hoạt động hoặc khi gặp xe đi ngược chiều (trừ trường hợp dải phân cách có khả năng chống chói) hoặc khi chuyển hướng xe tại nơi đường giao nhau; không nhường đường cho xe đi ngược chiều theo quy định tại nơi đường hẹp, đường dốc, nơi có chướng ngại vật.

        i) Sử dụng còi trong thời gian từ 22 giờ ngày hôm trước đến 05 giờ ngày hôm sau trong khu đông dân cư, khu vực cơ sở khám bệnh, chữa bệnh, trừ các xe ưu tiên đang đi làm nhiệm vụ theo quy định.

        k) Điều khiển xe chạy dưới tốc độ tối thiểu trên đoạn đường bộ có quy định tốc độ tối thiểu cho phép.


**Tóm lại:**  Phạt tiền từ 200.000 - 400.000 đồng đối với hành vi sử dụng đèn chiếu xa khi gặp người đi bộ qua đường, khi đi trên đoạn đường qua khu dân cư có hệ thống chiếu sáng đang hoạt động, khi gặp xe đi ngược chiều (trừ trường hợp dải phân cách có khả năng chống chói), hoặc khi chuyển hướng xe tại nơi đường giao nhau.
","Người điều khiển xe cơ giới không được sử dụng đèn chiếu xa khi tránh xe đi ngược chiều, trong khu đô thị và khu đông dân cư, trừ các trường hợp theo quy định.",1.0,0.49248600750322097,1.0,0.9999999999
94,Người điều khiển xe máy chuyên dùng có bắt buộc phải có giấy phép lái xe không?,"['1. đối với người điều khiển xe quân sự: a) có giấy phép lái xe quân sự phù hợp với loại xe theo quy định; b) trường hợp điều khiển xe mang biển số quân sự phục vụ lãnh đạo đảng, nhà nước; được phép sử dụng giấy phép lái xe dân sự; c) phải chấp hành nghiêm quy định của pháp luật và quy định của bộ quốc phòng về điều khiển xe quân sự khi tham gia giao thông. 2. đối với người điều khiển xe máy chuyên dùng: a) nếu chưa có giấy phép lái xe, phải có chứng chỉ bồi dưỡng kiến thức pháp luật về giao thông đường bộ; b) có chứng chỉ điều khiển xe máy chuyên dùng; c) phải chấp hành nghiêm quy định của pháp luật và bộ quốc phòng về điều khiển xe máy chuyên dùng khi tham gia giao thông. 3. trường hợp xe quá tải trọng, quá khổ giới hạn, xe bánh xích; vận chuyển hàng siêu trường, siêu trọng trên đường bộ trong điều kiện bình thường phải thực hiện theo quy định của bộ giao thông vận tải; trường hợp làm nhiệm vụ khẩn cấp thực hiện theo quy định của bộ quốc phòng và phải có các biện pháp bảo đảm an toàn giao thông, an toàn công trình đường bộ theo quy định của pháp luật. 4. trường hợp xe chở hàng trái phép bị tạm giữ hàng hóa, phương tiện thì chuyển giao cho cơ quan chức năng xử lý theo quy định của pháp luật. người điều khiển xe nếu vi phạm các quy định khi tham gia giao thông, tùy theo tính chất, mức độ vi phạm bị xử phạt vi phạm hành chính, xử lý kỷ luật hoặc bị truy cứu trách nhiệm hình sự theo quy định của pháp luật. 5. lực lượng kiểm tra xe quân sự, kiểm soát quân sự phối hợp chặt chẽ với các cơ quan chức năng, kiểm tra các hoạt động của xe quân sự; xe mang biển số dân sự của các doanh nghiệp quân đội tham gia giao thông. khi phát hiện hành vi vi phạm thì chấn chỉnh kịp thời, xử lý theo quy định của pháp luật và quy định của bộ quốc phòng. 6. chỉ huy cơ quan, đơn vị các cấp chịu trách nhiệm về việc sử dụng xe quân sự do cơ quan, đơn vị mình quản lý.']","**Nguồn văn bản:** 69_2024_TT-BQP_628970

**Tên văn bản:** Thông tư Quy định về đăng ký, quản lý, sử dụng xe cơ giới, xe máy chuyên dùng thuộc phạm vi quản lý của bộ quốc phòng

**Điều 26:** Sử dụng xe quân sự

**Nội dung:**

2. Đối với người điều khiển xe máy chuyên dùng:

	a) Nếu chưa có giấy phép lái xe, phải có chứng chỉ bồi dưỡng kiến thức pháp luật về giao thông đường bộ.

	b) Có chứng chỉ điều khiển xe máy chuyên dùng.

	c) Phải chấp hành nghiêm quy định của pháp luật và Bộ Quốc phòng về điều khiển xe máy chuyên dùng khi tham gia giao thông.


Tóm lại: Người điều khiển xe máy chuyên dùng không bắt buộc phải có giấy phép lái xe nhưng phải có chứng chỉ bồi dưỡng kiến thức pháp luật về giao thông đường bộ và chứng chỉ điều khiển xe máy chuyên dùng.
",Người điều khiển xe máy chuyên dùng có tốc độ thiết kế lớn hơn 70 km/h phải có giấy phép lái xe hạng A4; nếu tốc độ thiết kế không quá 70 km/h thì phải có chứng chỉ bồi dưỡng kiến thức pháp luật về giao thông đường bộ.,1.0,0.4323196968570497,0.0,0.0
95,Việc chở hàng hóa trên xe ô tô được quy định như thế nào để đảm bảo an toàn giao thông?,"['1. giấy vận tải là giấy tờ để xác nhận việc người lái xe đã nhận hàng hóa với số lượng, chủng loại, tình trạng hàng hóa để vận tải đến nơi trả hàng; là bằng chứng của hợp đồng vận tải hàng hóa. 2. đơn vị kinh doanh vận tải hàng hóa bằng xe ô tô có trách nhiệm sau đây: a) thực hiện điều hành phương tiện và lái xe hoặc quyết định giá cước để vận tải hàng hóa; b) tổ chức khám sức khỏe cho người lái xe và sử dụng người lái xe đủ sức khỏe theo quy định của pháp luật; c) ứng dụng công nghệ thông tin để quản lý điều hành và cung cấp dữ liệu về hoạt động vận tải theo quy định của pháp luật; d) chịu trách nhiệm hoặc liên đới chịu trách nhiệm về hậu quả mà người lao động, người đại diện của đơn vị kinh doanh vận tải hàng hóa bằng xe ô tô gây ra do thực hiện yêu cầu của đơn vị kinh doanh vận tải hàng hóa bằng xe ô tô trái quy định của pháp luật; đ) chịu trách nhiệm hoặc liên đới chịu trách nhiệm về hành vi vi phạm của người lao động, người đại diện của đơn vị kinh doanh vận tải hàng hóa bằng xe ô tô gây ra theo quy định của pháp luật. 3. việc vận tải hàng hóa bằng xe ô tô thực hiện theo quy định tại điều 56 của luật này, thực hiện đầy đủ các yêu cầu, điều kiện về bảo đảm trật tự, an toàn giao thông đường bộ theo quy định của pháp luật về trật tự, an toàn giao thông đường bộ và quy định khác của pháp luật có liên quan. khi vận tải hàng hóa trên đường bộ phải có giấy vận tải theo quy định của pháp luật. 4. bộ trưởng bộ giao thông vận tải quy định về tổ chức và quản lý hoạt động vận tải hàng hóa bằng xe ô tô.']","**Nguồn văn bản:** 35_2024_QH15_588811

**Tên văn bản:** Luật Đường bộ

**Điều 61:** Vận tải hàng hóa bằng xe ô tô

**Nội dung:**

1. Giấy vận tải là giấy tờ để xác nhận việc người lái xe đã nhận hàng hóa với số lượng, chủng loại, tình trạng hàng hóa để vận tải đến nơi trả hàng; là bằng chứng của hợp đồng vận tải hàng hóa.

2. Đơn vị kinh doanh vận tải hàng hóa bằng xe ô tô có trách nhiệm sau đây:

	a) Thực hiện điều hành phương tiện và lái xe hoặc quyết định giá cước để vận tải hàng hóa.

	b) Tổ chức khám sức khỏe cho người lái xe và sử dụng người lái xe đủ sức khỏe theo quy định của pháp luật.

	c) Ứng dụng công nghệ thông tin để quản lý điều hành và cung cấp dữ liệu về hoạt động vận tải theo quy định của pháp luật.

	d) Chịu trách nhiệm hoặc liên đới chịu trách nhiệm về hậu quả mà người lao động, người đại diện của đơn vị kinh doanh vận tải hàng hóa bằng xe ô tô gây ra do thực hiện yêu cầu của đơn vị kinh doanh vận tải hàng hóa bằng xe ô tô trái quy định của pháp luật.

	đ) Chịu trách nhiệm hoặc liên đới chịu trách nhiệm về hành vi vi phạm của người lao động, người đại diện của đơn vị kinh doanh vận tải hàng hóa bằng xe ô tô gây ra theo quy định của pháp luật.


3. Việc vận tải hàng hóa bằng xe ô tô thực hiện theo quy định tại Điều 56 của Luật này, thực hiện đầy đủ các yêu cầu, điều kiện về bảo đảm trật tự, an toàn giao thông đường bộ theo quy định của pháp luật về trật tự, an toàn giao thông đường bộ và quy định khác của pháp luật có liên quan. Khi vận tải hàng hóa trên đường bộ phải có giấy vận tải theo quy định của pháp luật.

4. Bộ trưởng Bộ Giao thông vận tải quy định về tổ chức và quản lý hoạt động vận tải hàng hóa bằng xe ô tô.

**Tóm lại:** Để đảm bảo an toàn giao thông khi chở hàng hóa bằng xe ô tô, cần tuân thủ Điều 56 của Luật Đường bộ, các quy định về trật tự an toàn giao thông đường bộ và phải có giấy vận tải. Đơn vị kinh doanh vận tải có trách nhiệm điều hành, quản lý lái xe, đảm bảo sức khỏe lái xe, ứng dụng công nghệ thông tin và chịu trách nhiệm về hành vi của người lao động.
","Hàng hóa xếp trên xe ô tô phải được chằng buộc chắc chắn, không vượt quá giới hạn xếp hàng cho phép và không che khuất đèn, biển số xe.",1.0,0.6629195069806704,0.0,0.0
96,Người điều khiển xe đạp điện có bắt buộc phải đội mũ bảo hiểm không?,"['1. người điều khiển xe đạp, xe đạp máy chỉ được chở một người, trừ trường hợp chở thêm một trẻ em dưới 07 tuổi thì được chở tối đa hai người. 2. người điều khiển xe đạp, xe đạp máy không được thực hiện các hành vi quy định tại khoản 3 điều 33 của luật này; người được chở trên xe đạp, xe đạp máy khi tham gia giao thông đường bộ không được thực hiện các hành vi quy định tại khoản 4 điều 33 của luật này. 3. người điều khiển, người được chở trên xe đạp máy phải đội mũ bảo hiểm theo đúng quy chuẩn kỹ thuật quốc gia và cài quai đúng quy cách. 4. người điều khiển xe thô sơ chỉ được cho xe đi hàng một, nơi có phần đường dành cho xe thô sơ thì phải đi đúng phần đường quy định; khi tham gia giao thông đường bộ trong thời gian từ 18 giờ ngày hôm trước đến 06 giờ ngày hôm sau phải sử dụng đèn hoặc có báo hiệu ở phía trước và phía sau xe. 5. hàng hóa xếp trên xe thô sơ phải bảo đảm an toàn, không gây cản trở giao thông và che khuất tầm nhìn của người điều khiển. hàng hóa xếp trên xe không vượt quá 1/3 chiều dài thân xe và không vượt quá 01 mét phía trước và phía sau xe; không vượt quá 0,4 mét mỗi bên bánh xe.']","**Nguồn văn bản:** 36_2024_QH15_444251

**Tên văn bản:** Luật Trật tự, an toàn giao thông đường bộ

**Điều 31:** Người điều khiển, người được chở, hàng hóa xếp trên xe thô sơ

**Nội dung:**

1. Người điều khiển xe đạp, xe đạp máy chỉ được chở một người, trừ trường hợp chở thêm một trẻ em dưới 07 tuổi thì được chở tối đa hai người.

2. Người điều khiển xe đạp, xe đạp máy không được thực hiện các hành vi quy định tại khoản 3 điều 33 của luật này; người được chở trên xe đạp, xe đạp máy khi tham gia giao thông đường bộ không được thực hiện các hành vi quy định tại khoản 4 điều 33 của luật này.

3. Người điều khiển, người được chở trên xe đạp máy phải đội mũ bảo hiểm theo đúng quy chuẩn kỹ thuật quốc gia và cài quai đúng quy cách.

4. Người điều khiển xe thô sơ chỉ được cho xe đi hàng một, nơi có phần đường dành cho xe thô sơ thì phải đi đúng phần đường quy định; khi tham gia giao thông đường bộ trong thời gian từ 18 giờ ngày hôm trước đến 06 giờ ngày hôm sau phải sử dụng đèn hoặc có báo hiệu ở phía trước và phía sau xe.

5. Hàng hóa xếp trên xe thô sơ phải bảo đảm an toàn, không gây cản trở giao thông và che khuất tầm nhìn của người điều khiển. Hàng hóa xếp trên xe không vượt quá 1/3 chiều dài thân xe và không vượt quá 01 mét phía trước và phía sau xe; không vượt quá 0,4 mét mỗi bên bánh xe.


Tóm lại: Theo điều 31 của Luật Trật tự, an toàn giao thông đường bộ, người điều khiển và người được chở trên xe đạp máy phải đội mũ bảo hiểm.  Điều luật này không đề cập cụ thể đến xe đạp điện. Tuy nhiên, tùy theo phân loại của xe đạp điện (xe đạp điện được coi là xe máy hay xe đạp) mà áp dụng quy định đội mũ bảo hiểm tương ứng. Nếu xe đạp điện được phân loại là xe máy thì người điều khiển và người ngồi sau phải đội mũ bảo hiểm.
",Người điều khiển và người ngồi trên xe đạp điện bắt buộc phải đội mũ bảo hiểm có cài quai đúng quy cách khi tham gia giao thông.,0.0,0.854823211159851,0.0,0.9999999999
